id,title,url,section,lead,date,source,scrape_time,last_update,news_content
2588280,4班來往西九龍站及廣州東站高鐵列車取消,https://www.881903.com/news/local/2588280,local,運輸署表示，接獲內地鐵路單位通報，由於內地段有設備故障，今日有4班來往西九龍站及廣州東站的高鐵列車取消，受影響的是前往廣州東站的G6568及G6556班次，以及前往西九龍站的G6565及G6553班次。,2025-07-22 11:29,cradio,2025-07-22 11:45,2025-07-22 11:29:00,運輸署表示，接獲內地鐵路單位通報，由於內地段有設備故障，今日有4班來往西九龍站及廣州東站的高鐵列車取消，受影響的是前往廣州東站的G6568及G6556班次，以及前往西九龍站的G6565及G6553班次。
2588278,據報歐盟料領導人訪華成果有限　不會有實質協議,https://www.881903.com/news/china/2588278,china,"歐盟委員會主席馮德萊恩及歐洲理事會主席科斯塔，周四將到訪北京，與國家主席習近平會晤，並與總理李強共同主持第25次中歐領導人會晤。彭博社引述歐盟官員報道，歐方預期今次訪華的實際成果有限。
報道指，歐方估計除了有機會加強在氣候變化方面的合作以外，與中國的會談不會達成其他實質協議，但會進行實際、開放、直接、良好和建設性對話，明確提出希望中方採取措施，以修復經貿關係，以及重新平衡雙邊關係，而歐中峰會亦不會...",2025-07-22 11:24,cradio,2025-07-22 11:30,2025-07-22 11:24:00,"歐盟委員會主席馮德萊恩及歐洲理事會主席科斯塔，周四將到訪北京，與國家主席習近平會晤，並與總理李強共同主持第25次中歐領導人會晤。彭博社引述歐盟官員報道，歐方預期今次訪華的實際成果有限。

報道指，歐方估計除了有機會加強在氣候變化方面的合作以外，與中國的會談不會達成其他實質協議，但會進行實際、開放、直接、良好和建設性對話，明確提出希望中方採取措施，以修復經貿關係，以及重新平衡雙邊關係，而歐中峰會亦不會發表聯合聲明。

另外，歐盟領導人周三將到訪東京，會晤日本首相石破茂。歐盟官員指，雙方將簽署國防工業合作和經濟安全協議，公布一系列加強國防安全、工業及商業、抵禦外國干涉和操縱的合作措施，鞏固雙方的印太地區戰略夥伴地位，亦會表明共同反對任何試圖以武力或脅迫手段，改變台海現狀的行為。"
2588276,大摩料雅下工程初期華新水泥將受惠　未來或帶動銅鋁需求,https://www.881903.com/news/finance/2588276,finance,摩根士丹利報告指，西藏雅魯藏布江下游水電項目於上星期六正式動工，總投資達1.2萬億元人民幣，裝機容量60至70吉瓦(GW)，相當於三峽工程的三倍，項目建設期預計達18至20年。大摩預期，在建設階段，水泥和鋼鐵行業會直接受益，預計項目總水泥需求量達2000萬至3000萬噸，年均需求100萬至150萬噸，預計華新水泥(06655.HK)將成為最大受益者，因為華新水泥西藏生產基地距離項目僅400公里，同...,2025-07-22 11:18,cradio,2025-07-22 11:30,2025-07-22 11:18:00,"摩根士丹利報告指，西藏雅魯藏布江下游水電項目於上星期六正式動工，總投資達1.2萬億元人民幣，裝機容量60至70吉瓦(GW)，相當於三峽工程的三倍，項目建設期預計達18至20年。大摩預期，在建設階段，水泥和鋼鐵行業會直接受益，預計項目總水泥需求量達2000萬至3000萬噸，年均需求100萬至150萬噸，預計華新水泥(06655.HK)將成為最大受益者，因為華新水泥西藏生產基地距離項目僅400公里，同時中國建材(03323.HK)及海螺水泥(00914.HK)西藏的產能也將受惠。

大摩又指，後期水電站設備及輸電電纜將帶動銅及鋁材需求，項目投產後年發電量超過3000億度，或將刺激當地數據中心等用電密集型項目投資，進一步帶動銅及鋁的需求，但可能對火電及煤需求構成壓力。"
2588275,風暴韋帕在越南太平省再次登陸　暴雨或引發洪水泥石流,https://www.881903.com/news/international/2588275,international,"風暴「韋帕」橫過北部灣後，早上在越南北部太平省沿海第3次登陸。越南氣象部門預計，「韋帕」將帶來500毫米雨量，可能引發洪水和泥石流。越南當局嚴陣以待，總理范明正星期日已下令沿海省份進入緊急狀態，動員近35萬名士兵戒備。部分機場、港口和火車服務暫停，多班航班取消或延誤。

去年風暴「摩羯」吹襲越南，引發洪災，造成約300人死亡，33億美元損失。",2025-07-22 11:15,cradio,2025-07-22 11:30,2025-07-22 11:15:00,"風暴「韋帕」橫過北部灣後，早上在越南北部太平省沿海第3次登陸。越南氣象部門預計，「韋帕」將帶來500毫米雨量，可能引發洪水和泥石流。越南當局嚴陣以待，總理范明正星期日已下令沿海省份進入緊急狀態，動員近35萬名士兵戒備。部分機場、港口和火車服務暫停，多班航班取消或延誤。

去年風暴「摩羯」吹襲越南，引發洪災，造成約300人死亡，33億美元損失。"
2588274,世大運｜港隊組合陳顥樺黃凱彤晉級乒乓混雙四強,https://www.881903.com/news/sports/2588274,sports,"在德國舉行的世界大學生運動會，港隊乒乓球混雙組合陳顥樺及黃凱彤晉級四強，不設銅牌戰下，穩奪一面獎牌。
陳顥樺及黃凱彤凌晨在八強賽，面對以中立身份出戰的俄羅斯組合。港隊表現慢熱，開賽初段先輸兩局9:11及8:11，但其後迅速調整狀態，連贏兩局11:9及12:10扳平。雙方之後再各贏一局，打成局數3:3。在決勝負的第7局，雙方纏鬥至10:10平手，要打「刁時」，港隊組合頂住壓力連取兩分，險勝12:10...",2025-07-22 11:09,cradio,2025-07-22 11:15,2025-07-22 11:09:00,"在德國舉行的世界大學生運動會，港隊乒乓球混雙組合陳顥樺及黃凱彤晉級四強，不設銅牌戰下，穩奪一面獎牌。

陳顥樺及黃凱彤凌晨在八強賽，面對以中立身份出戰的俄羅斯組合。港隊表現慢熱，開賽初段先輸兩局9:11及8:11，但其後迅速調整狀態，連贏兩局11:9及12:10扳平。雙方之後再各贏一局，打成局數3:3。在決勝負的第7局，雙方纏鬥至10:10平手，要打「刁時」，港隊組合頂住壓力連取兩分，險勝12:10，總局數贏4:3淘汰對手，打入四強。港隊在本港時間下午4時，將對戰國家隊組合曾蓓勛及韓菲兒，爭奪晚上的決賽席位。"
2588271,據報中美討論兩國元首今年稍後於亞洲會晤,https://www.881903.com/news/china/2588271,china,"《路透社》報道，中美官員正討論安排兩國元首，今年稍後在亞州會面。消息人士指，美國總統特朗普可能會出席10月底，在南韓慶州舉行的亞太經合組織（APEC）領導人非正式會議，屆時有望與國家主席習近平會面，但暫時仍未敲定安排。

南韓總理金民錫表示，總統李在明已經正式邀請APEC各成員領導人，出席10月31日至11月1日舉行的APEC峰會。對於中美領導人出席的可能性，金民錫表示，相關安排將取決於政府的外交...",2025-07-22 11:06,cradio,2025-07-22 11:15,2025-07-22 11:06:00,"《路透社》報道，中美官員正討論安排兩國元首，今年稍後在亞州會面。消息人士指，美國總統特朗普可能會出席10月底，在南韓慶州舉行的亞太經合組織（APEC）領導人非正式會議，屆時有望與國家主席習近平會面，但暫時仍未敲定安排。

南韓總理金民錫表示，總統李在明已經正式邀請APEC各成員領導人，出席10月31日至11月1日舉行的APEC峰會。對於中美領導人出席的可能性，金民錫表示，相關安排將取決於政府的外交努力，期待此次峰會能為南韓外交和國際秩序開辟新的方向。

在北京，外交部發言人郭嘉昆在例行記者會上，被問到中美元首是否將在未來幾個月內會面時指，目前沒有可以提供的信息，只表示元首外交對中美關係發揮著不可替代的戰略引領作用。"
2588268,巴西擬在中國設稅務諮詢辦公室　加深對華關係,https://www.881903.com/news/china/2588268,china,"路透社報道，巴西將在中國設立稅務諮詢辦公室，加深對華關係。報道引述巴西政府的總統命令草案與預備文件，提到雙邊貿易日益複雜，有需要加強稅收和海關事務上的合作。巴西財政部否認在華設立新的辦公室與貿易戰有關，強調沒有任何政治動機，又指稅務諮詢辦公室將透過交換關鍵訊息，打擊稅務和海關違規行為，在國際合作中發揮戰略作用，亦為外國投資者和海外公民，提供有關巴西法律的技術指引，協助提升法律確定性和營商環境。
中...",2025-07-22 10:26,cradio,2025-07-22 10:30,2025-07-22 10:26:00,"路透社報道，巴西將在中國設立稅務諮詢辦公室，加深對華關係。報道引述巴西政府的總統命令草案與預備文件，提到雙邊貿易日益複雜，有需要加強稅收和海關事務上的合作。巴西財政部否認在華設立新的辦公室與貿易戰有關，強調沒有任何政治動機，又指稅務諮詢辦公室將透過交換關鍵訊息，打擊稅務和海關違規行為，在國際合作中發揮戰略作用，亦為外國投資者和海外公民，提供有關巴西法律的技術指引，協助提升法律確定性和營商環境。

中國自2009年以來，一直是巴西最大貿易夥伴。巴西出口總額當中，對華出口佔28%。另一方面，美國總統特朗普早前去信巴西總統盧拉，將由8月1日起，對從巴西進口的商品徵收50%關稅，同時要求巴西政府停止對前總統博索納羅的司法調查。"
2588267,中國駐英大使鄭澤光轉任常駐國際海事組織代表,https://www.881903.com/news/china/2588267,china,"中國駐英國大使鄭澤光將轉任中國常駐國際海事組織代表。鄭澤光周一到訪國際海事組織總部，向秘書長多明戈斯通報中國設立常駐國際海事組織代表處的決定，並遞交中國政府委派他出任常駐代表的全權證書。
鄭澤光表示，中國政府高度重視國際海事組織作為聯合國專門機構，在加強海上安全，防止船舶造成污染等方面的關鍵作用，中方設立常駐代表處，有利於進一步深化中國同組織秘書處及各會員的交流與合作，為促進國際海事合作、推動構建...",2025-07-22 10:24,cradio,2025-07-22 10:30,2025-07-22 10:24:00,"中國駐英國大使鄭澤光將轉任中國常駐國際海事組織代表。鄭澤光周一到訪國際海事組織總部，向秘書長多明戈斯通報中國設立常駐國際海事組織代表處的決定，並遞交中國政府委派他出任常駐代表的全權證書。

鄭澤光表示，中國政府高度重視國際海事組織作為聯合國專門機構，在加強海上安全，防止船舶造成污染等方面的關鍵作用，中方設立常駐代表處，有利於進一步深化中國同組織秘書處及各會員的交流與合作，為促進國際海事合作、推動構建全球海洋命運共同體作出新的貢獻。

多明戈斯表示歡迎，又期待中國繼續支持國際海事組織的工作。"
2588266,阿里升級Qwen3模型　性能超Kimi-K2等頂級模型,https://www.881903.com/news/finance/2588266,finance,阿里巴巴(09988.HK)旗下大模型通義千問Qwen更新了旗艦版Qwen3模型，推出Qwen3非思考模式的更新版本，通用能力顯著提升，包括指令遵循、邏輯推理、文本理解、數學、科學、編程及工具使用等方面，在GQPA（知識）、AIME25（數學）、LiveCodeBench（編程）、Arena-Hard（人類偏好對齊）、BFCL（代理能力）等眾多測評中表現出色，超過Kimi-K2、DeepSeek-...,2025-07-22 10:21,cradio,2025-07-22 10:30,2025-07-22 10:21:00,"阿里巴巴(09988.HK)旗下大模型通義千問Qwen更新了旗艦版Qwen3模型，推出Qwen3非思考模式的更新版本，通用能力顯著提升，包括指令遵循、邏輯推理、文本理解、數學、科學、編程及工具使用等方面，在GQPA（知識）、AIME25（數學）、LiveCodeBench（編程）、Arena-Hard（人類偏好對齊）、BFCL（代理能力）等眾多測評中表現出色，超過Kimi-K2、DeepSeek-V3等頂級開源模型以及Claude-Opus4-Non-thinking等領先閉源模型。Qwen3支持256K長文本，現已開源更新。

阿里雲表示，在經過與社區溝通和深思熟慮後，決定停止使用混合思考模式，轉為分別訓練指示(Instruct)和思考(Thinking)模型，以獲得最佳質量。

目前Qwen3新模型已在魔搭社區和HuggingFace上開源更新。"
2588265,喀麥隆國腳安保姆加盟曼聯,https://www.881903.com/news/sports/2588265,sports,"英超球會曼聯宣布，由賓福特羅致喀麥隆國腳安保姆，據報轉會費達7100萬英鎊。25歲的安保姆與曼聯簽約至2030年，可以出任前場鋒線多個位置，上個英超賽季為賓福特射入20球，排射手榜第四位，另外送出8次助攻。
安保姆表示，自小就是曼聯球迷，一直希望為紅魔鬼披甲，指曼聯有宏偉的主場球館及熱情的球迷，新賽季會在主帥阿摩廉麾下學習，繼續努力提升自己，期待與隊內其他世界級隊友並肩作戰。
他又對效力6年、一起...",2025-07-22 10:13,cradio,2025-07-22 10:15,2025-07-22 10:13:00,"英超球會曼聯宣布，由賓福特羅致喀麥隆國腳安保姆，據報轉會費達7100萬英鎊。25歲的安保姆與曼聯簽約至2030年，可以出任前場鋒線多個位置，上個英超賽季為賓福特射入20球，排射手榜第四位，另外送出8次助攻。

安保姆表示，自小就是曼聯球迷，一直希望為紅魔鬼披甲，指曼聯有宏偉的主場球館及熱情的球迷，新賽季會在主帥阿摩廉麾下學習，繼續努力提升自己，期待與隊內其他世界級隊友並肩作戰。

他又對效力6年、一起由英冠「升超」的賓福特上下職球員及球迷致謝，形容是一段充滿歡笑與喜悅的非凡旅程，令他有家的感覺，永遠不會忘記這段經歷。"
2588264,書展閉幕｜有市民入場尋「跳樓價」書籍　展商七折優惠冀追回生意,https://www.881903.com/news/local/2588264,local,"書展最後一日舉行，早上已有不少市民在場外排隊，等候入場。有市民帶同行李箱到場，指

特意等到最後一日展期才入場，預料參展商可能會以「跳樓價」發售書籍，認為如果有六五折優惠已十分吸引。

天地圖書負責人歐小姐指，自書展首日已經提供所有書籍八折優惠，部份今日會提供七折優惠，期望可以追回一成生意，彌補周日因颱風而未能開放的損失。",2025-07-22 10:10,cradio,2025-07-22 10:15,2025-07-22 10:10:00,"書展最後一日舉行，早上已有不少市民在場外排隊，等候入場。有市民帶同行李箱到場，指

特意等到最後一日展期才入場，預料參展商可能會以「跳樓價」發售書籍，認為如果有六五折優惠已十分吸引。

天地圖書負責人歐小姐指，自書展首日已經提供所有書籍八折優惠，部份今日會提供七折優惠，期望可以追回一成生意，彌補周日因颱風而未能開放的損失。"
2588263,梁振英：政府開發土地沒有白做　對「購房資金通」有保留,https://www.881903.com/news/local/2588263,local,全國政協副主席、前行政長官梁振英在電台節目指，過去社會經常指本港土地供應不足，令樓價和租金快速上升，工商百業和一般市民都難以負擔，形容解決方法並非透過樓市「辣招」壓抑需求，而是增加土地供應，亦是社會共識和特區政府的任務。他説政府開發土地工作沒有白做，現時住宅樓宇、寫字樓，以至創科用地等，都有可觀增加，而由於本港地價遠遠高於建造成本，認為地產商買地並投入建造後，等於「洗濕了頭」，一定會繼續發展土地。...,2025-07-22 10:07,cradio,2025-07-22 10:15,2025-07-22 10:07:00,"全國政協副主席、前行政長官梁振英在電台節目指，過去社會經常指本港土地供應不足，令樓價和租金快速上升，工商百業和一般市民都難以負擔，形容解決方法並非透過樓市「辣招」壓抑需求，而是增加土地供應，亦是社會共識和特區政府的任務。他説政府開發土地工作沒有白做，現時住宅樓宇、寫字樓，以至創科用地等，都有可觀增加，而由於本港地價遠遠高於建造成本，認為地產商買地並投入建造後，等於「洗濕了頭」，一定會繼續發展土地。

對於全國人大常委、民建聯李慧琼等，提倡建立「購房資金通」，讓兩地居民可以在兩地購房，包括便利內地高才在港置業，梁振英有保留。他指房屋供應比以前充裕，是全社會合力的成果，而特區政府第一服務對象是香港居民，舉例指早年樓價急升時，當局推出「辣招」，便是壓抑非香港永久居民的需求，認為不能為了讓住宅單位賣得更好，而引入有關措施。"
2588262,啟德體育園及大球場周四起實施特別交通安排,https://www.881903.com/news/local/2588262,local,"利物浦和AC米蘭，以及阿仙奴和熱刺4支球隊，將先後於本周六及下周四，在啟德體育園進行比賽，各球會周四起會在啟德體育園和香港大球場開始公開訓練，附近一帶將實施特別交通及運輸安排。

運輸署表示，在兩場比賽當日，啟德體育園附近一帶的交通預期會較繁忙，呼籲觀眾乘搭公共交通工具前往，避免使用私家車。署方已協調本地及跨境公共運輸服務營辦商，在離場時段加強服務；港鐵將會加密屯馬綫的班次，專營巴士公司提供11條...",2025-07-22 10:02,cradio,2025-07-22 10:15,2025-07-22 10:02:00,"利物浦和AC米蘭，以及阿仙奴和熱刺4支球隊，將先後於本周六及下周四，在啟德體育園進行比賽，各球會周四起會在啟德體育園和香港大球場開始公開訓練，附近一帶將實施特別交通及運輸安排。

運輸署表示，在兩場比賽當日，啟德體育園附近一帶的交通預期會較繁忙，呼籲觀眾乘搭公共交通工具前往，避免使用私家車。署方已協調本地及跨境公共運輸服務營辦商，在離場時段加強服務；港鐵將會加密屯馬綫的班次，專營巴士公司提供11條特別巴士路線。另外，園方將於離場時段安排跨境巴士服務，便利旅客經落馬洲／皇崗口岸、港珠澳大橋和深圳灣口岸返回內地；乘客需預先購票，離場後現場不設售票。

署方又提醒，如經羅湖口岸過關，需趕及港鐵屯馬綫最後一班相關列車，分別於晚上10時59分及11時01分，於宋皇臺站及啟德站開出。"
2588261,白宮拒WSJ記者隨團採訪總統訪蘇格蘭　報復涉愛潑斯坦報道,https://www.881903.com/news/international/2588261,international,美國特朗普政府與《華爾街日報》(WSJ)的爭議升溫。白宮證實，拒絕讓《華爾街日報》記者在總統特朗普周末出訪蘇格蘭期間隨團採訪。特朗普星期五起將訪問蘇格蘭5日，《華爾街日報》記者帕蒂原本獲安排，在特朗普訪問的最後兩日，擔任印刷媒體記者代表，隨行採訪。白宮新聞秘書萊維特星期一指，《華爾街日報》涉及虛假和誹謗行為，帕蒂已被剔出蘇格蘭訪問團記者名單，但未有交代《華爾街日報》記者日後可否在白宮或出訪行程採訪...,2025-07-22 09:50,cradio,2025-07-22 10:00,2025-07-22 09:50:00,"美國特朗普政府與《華爾街日報》(WSJ)的爭議升溫。白宮證實，拒絕讓《華爾街日報》記者在總統特朗普周末出訪蘇格蘭期間隨團採訪。特朗普星期五起將訪問蘇格蘭5日，《華爾街日報》記者帕蒂原本獲安排，在特朗普訪問的最後兩日，擔任印刷媒體記者代表，隨行採訪。白宮新聞秘書萊維特星期一指，《華爾街日報》涉及虛假和誹謗行為，帕蒂已被剔出蘇格蘭訪問團記者名單，但未有交代《華爾街日報》記者日後可否在白宮或出訪行程採訪。

《華爾街日報》日前報道，特朗普2003年曾致函已故富豪愛潑斯坦，祝賀他生日，信件上附有裸女圖案。特朗普否認報道內容，並向《華爾街日報》提告。今次被禁採訪的記者帕蒂，並非負責有關愛潑斯坦報道。"
2588260,粵港澳三地消委會聯合發布消費提示,https://www.881903.com/news/local/2588260,local,"粵港澳三地的消費者委員會，就跨境網購內地商品，聯合發布消費提示。香港消委會指，部分內地商品受內地政策法規、物流成本、商品性質及營銷策略等因素影響，只供內地市場銷售，市民網上平台購買再運送到香港，增加消費風險，遇上退貨或換貨等消費糾紛時，亦面臨困難。

三地消委會提醒，港澳與內地對產品標準及規定各有不同，購買前應仔細查閲產品的詳細資料，避免收貨後引起消費糾紛； 另外，由於跨境網購涉內地物流運輸、集運...",2025-07-22 09:44,cradio,2025-07-22 10:00,2025-07-22 09:44:00,"粵港澳三地的消費者委員會，就跨境網購內地商品，聯合發布消費提示。香港消委會指，部分內地商品受內地政策法規、物流成本、商品性質及營銷策略等因素影響，只供內地市場銷售，市民網上平台購買再運送到香港，增加消費風險，遇上退貨或換貨等消費糾紛時，亦面臨困難。

三地消委會提醒，港澳與內地對產品標準及規定各有不同，購買前應仔細查閲產品的詳細資料，避免收貨後引起消費糾紛； 另外，由於跨境網購涉內地物流運輸、集運倉代收及暫存、跨境運輸、本地派送或自取等多個環節，應盡可能在運輸過程中檢查商品的狀況，若購買貴重、易碎等商品時，可優先選擇能提供開箱驗貨服務的集運倉，或額外購買「開箱拍照」等服務，並優先選擇提供退貨運費保險的商品，以及留意產品是否屬於禁止出境或入境的物品。"
2588259,本港九九金開市升275元,https://www.881903.com/news/finance/2588259,finance,本港金價方面，九九金開市31770元，升275元,2025-07-22 09:44,cradio,2025-07-22 10:00,2025-07-22 09:44:00,本港金價方面，九九金開市31770元，升275元
2588257,內地股市初段微升,https://www.881903.com/news/finance/2588257,finance,內地股市初段個別發展，上證綜合指數3560點，升不足1點；深證成分指數11014點，升6點；兩市成交額1031億元人民幣。創業板指數升6點。,2025-07-22 09:36,cradio,2025-07-22 09:45,2025-07-22 09:36:00,內地股市初段個別發展，上證綜合指數3560點，升不足1點；深證成分指數11014點，升6點；兩市成交額1031億元人民幣。創業板指數升6點。
2588252,人民幣兌美元中間價上調62點子,https://www.881903.com/news/finance/2588252,finance,人民幣兌美元中間價報7.146，上調62點子。離岸人民幣兌美元報7.1711。,2025-07-22 09:28,cradio,2025-07-22 09:45,2025-07-22 09:28:00,人民幣兌美元中間價報7.146，上調62點子。離岸人民幣兌美元報7.1711。
2588253,港股高開30點,https://www.881903.com/news/finance/2588253,finance,港股高開30點，恒生指數報25024點，再創新高。,2025-07-22 09:21,cradio,2025-07-22 09:45,2025-07-22 09:21:00,港股高開30點，恒生指數報25024點，再創新高。
2588251,領展王國龍明年6月前退任行政總裁,https://www.881903.com/news/finance/2588251,finance,"領展(00823.HK)宣布，行政總裁王國龍明年6月底前將退任集團行政總裁及執行董事。董事會將展開全面的甄選程序，物色合適繼任人，王國龍將在過渡期間協助集團順利交接。

王國龍表示，對現有管理層充滿信心，並相信已為領展邁向下一階段的發展建立合適的團隊。

領展董事會主席歐敦勤衷心感謝王國龍多年來的貢獻，指過去16年來，王國龍領導領展不斷成長和轉型，為基金單位持有人、商戶、員工和集團服務的廣大社區帶...",2025-07-22 09:14,cradio,2025-07-22 09:30,2025-07-22 09:14:00,"領展(00823.HK)宣布，行政總裁王國龍明年6月底前將退任集團行政總裁及執行董事。董事會將展開全面的甄選程序，物色合適繼任人，王國龍將在過渡期間協助集團順利交接。

王國龍表示，對現有管理層充滿信心，並相信已為領展邁向下一階段的發展建立合適的團隊。

領展董事會主席歐敦勤衷心感謝王國龍多年來的貢獻，指過去16年來，王國龍領導領展不斷成長和轉型，為基金單位持有人、商戶、員工和集團服務的廣大社區帶來裨益。"
