id,title,url,section,lead,date,source,scrape_time,last_update,news_content
2588301,山東濟南暴雨成災2人死亡　10人失蹤,https://www.881903.com/news/china/2588301,china,"山東濟南暴雨成災，至少2人死亡，10人失蹤。濟南市萊蕪區今日凌晨下暴雨，最大降雨量達364毫米。區內村鎮發生山洪災害，19間房屋沖毀和損壞，救援人員正搜救失蹤者，並開展善後工作。

另外，受強降雨影響，部分途經山東的列車延誤。泰山景區暫停開放。",2025-07-22 14:23,cradio,2025-07-22 14:30,2025-07-22 14:23:00,"山東濟南暴雨成災，至少2人死亡，10人失蹤。濟南市萊蕪區今日凌晨下暴雨，最大降雨量達364毫米。區內村鎮發生山洪災害，19間房屋沖毀和損壞，救援人員正搜救失蹤者，並開展善後工作。

另外，受強降雨影響，部分途經山東的列車延誤。泰山景區暫停開放。"
2588300,日美貿易談判代表會晤爭取下月前達成協議,https://www.881903.com/news/international/2588300,international,"日本貿易談判代表、經濟再生擔當大臣赤澤亮正到訪華盛頓，與美國商務部長盧特尼克會晤，繼續兩國的貿易及關稅談判，是他於3個月內，第8次到訪華盛頓磋商。日本內閣官房發聲明指，兩人會談逾兩小時，深入坦誠討論以爭取達成互利的貿易協議，希望與華府在下月1日的對等關稅生效限期前，就關稅問題達成一致，同時致力維護日本國家利益。　
經過早前多輪磋商，日美貿易協議談判仍未有進展。日本首相石破茂領導的執政聯盟，早前在選...",2025-07-22 14:20,cradio,2025-07-22 14:30,2025-07-22 14:20:00,"日本貿易談判代表、經濟再生擔當大臣赤澤亮正到訪華盛頓，與美國商務部長盧特尼克會晤，繼續兩國的貿易及關稅談判，是他於3個月內，第8次到訪華盛頓磋商。日本內閣官房發聲明指，兩人會談逾兩小時，深入坦誠討論以爭取達成互利的貿易協議，希望與華府在下月1日的對等關稅生效限期前，就關稅問題達成一致，同時致力維護日本國家利益。　

經過早前多輪磋商，日美貿易協議談判仍未有進展。日本首相石破茂領導的執政聯盟，早前在選舉中失去參議院過半數優勢。美國財長貝森特表示，不特別關注日本政府內部事務，會專注於達成一份有利美國人民的協議。"
2588299,南韓指北韓在未有提前通報下兩度泄洪,https://www.881903.com/news/international/2588299,international,"南韓統一部表示，北韓於上月25日和上周五，先後兩次在兩韓邊界的臨津江上遊黃江大壩泄洪，但未有提前知會韓方。
官員表示，臨津江必勝橋水位早上升至1.08米，略高於疏散標準的1米，但仍遠低於啟動應急響應的標準，當局正密切關注情況，並與有關部門緊密合作，減少邊境地區的影響。
韓聯社報道，今次統一部未有就北韓無提前通知泄洪表示遺憾，亦未有使用「擅自泄洪」等措辭，與上次尹錫悅政府時期不同。報道又指，黃江大壩...",2025-07-22 14:11,cradio,2025-07-22 14:15,2025-07-22 14:11:00,"南韓統一部表示，北韓於上月25日和上周五，先後兩次在兩韓邊界的臨津江上遊黃江大壩泄洪，但未有提前知會韓方。

官員表示，臨津江必勝橋水位早上升至1.08米，略高於疏散標準的1米，但仍遠低於啟動應急響應的標準，當局正密切關注情況，並與有關部門緊密合作，減少邊境地區的影響。

韓聯社報道，今次統一部未有就北韓無提前通知泄洪表示遺憾，亦未有使用「擅自泄洪」等措辭，與上次尹錫悅政府時期不同。報道又指，黃江大壩開閘泄洪，會令處於下游的南韓京畿道郡南大壩和必勝橋水位迅速上升，邊境地區面臨洪災風險。2009年9月北韓曾在未提前通報下突然泄洪，導致臨津江下遊有人員傷亡。"
2588298,日本百日咳感染連續四周創新高　今年累計逾4.8萬宗,https://www.881903.com/news/international/2588298,international,日本百日咳疫情持續擴散，感染數字連續四星期創新高。截至本月13日的一星期，全國錄得3682宗百日咳感染，按周多104人。按地域計，東京都的感染人數最多，單周有273人感染。今年以來日本累計有逾4.8萬人感染百日咳，至少4名嬰兒死亡，全部不足半歲。兒科學會呼籲家長，為滿2個月大的嬰兒接種疫苗。,2025-07-22 14:10,cradio,2025-07-22 14:15,2025-07-22 14:10:00,日本百日咳疫情持續擴散，感染數字連續四星期創新高。截至本月13日的一星期，全國錄得3682宗百日咳感染，按周多104人。按地域計，東京都的感染人數最多，單周有273人感染。今年以來日本累計有逾4.8萬人感染百日咳，至少4名嬰兒死亡，全部不足半歲。兒科學會呼籲家長，為滿2個月大的嬰兒接種疫苗。
2588296,多名自民黨成員要求石破茂辭職,https://www.881903.com/news/international/2588296,international,"日本執政聯盟失去參眾兩院過半優勢，但首相石破茂無意下台。多名自民黨成員公開要求石破茂辭職，有黨內意見認為自民黨將無可避免舉行黨總裁選舉。自民黨前幹事長甘利明在社交平台發文，批評石破茂未能達到議席目標，先後在參眾兩院選舉慘敗後仍戀棧權力。領導自民黨大阪府支部的參議員青山繁晴，認為石破茂政府不適合領導日本與美國進行貿易談判，呼籲石破茂辭職。自民黨高知縣支部決定，向黨本部提交申請，要求石破茂盡快辭職。
...",2025-07-22 13:49,cradio,2025-07-22 14:00,2025-07-22 13:49:00,"日本執政聯盟失去參眾兩院過半優勢，但首相石破茂無意下台。多名自民黨成員公開要求石破茂辭職，有黨內意見認為自民黨將無可避免舉行黨總裁選舉。自民黨前幹事長甘利明在社交平台發文，批評石破茂未能達到議席目標，先後在參眾兩院選舉慘敗後仍戀棧權力。領導自民黨大阪府支部的參議員青山繁晴，認為石破茂政府不適合領導日本與美國進行貿易談判，呼籲石破茂辭職。自民黨高知縣支部決定，向黨本部提交申請，要求石破茂盡快辭職。

　

至於現任內閣成員，內閣官房長官林芳正與總務大臣村上誠一郎指，會繼續支持石破茂執政。農林水產大臣小泉進次郎指，要認真檢討選舉結果。自民黨高層計劃召集黨內的參眾兩院議員下星期開會，為石破茂爭取支持。"
2588294,勞聯提交施政報告建議　倡破欠基金擴至保障強積金供款,https://www.881903.com/news/local/2588294,local,"行政長官李家超將於9月發表新一份《施政報告》，勞聯提交42項建議，包括把破欠基金的保障，擴展至強積金僱主供款。勞聯主席林振昇表示近期多家企業倒閉，有僱員被拖欠強積金供款，認為擴大「破欠基金」的保障範圍，不會對基金造成重大負擔。
其餘建議包括就年齡歧視立法、保障外賣員等平台工作者、設法定工傷及退休保障、暫停輸入部分工種外勞，以及訂立5天法定有薪照顧者假期等。",2025-07-22 13:42,cradio,2025-07-22 13:45,2025-07-22 13:42:00,"行政長官李家超將於9月發表新一份《施政報告》，勞聯提交42項建議，包括把破欠基金的保障，擴展至強積金僱主供款。勞聯主席林振昇表示近期多家企業倒閉，有僱員被拖欠強積金供款，認為擴大「破欠基金」的保障範圍，不會對基金造成重大負擔。

其餘建議包括就年齡歧視立法、保障外賣員等平台工作者、設法定工傷及退休保障、暫停輸入部分工種外勞，以及訂立5天法定有薪照顧者假期等。"
2588293,特朗普上任滿半年　支持率跌至約4成,https://www.881903.com/news/international/2588293,international,"美國總統特朗普再次入主白宮滿半年，多項民調顯示，他的支持率跌至只有約4成。
哥倫比亞廣播公司的民調顯示，特朗普支持率約為42%，比2月上任初期下跌11個百分點。64%受訪者不滿意政府處理通脹的表現，是特朗普上任以來新高。另外，有47%受訪者認為，特朗普力推的《大而美法案》，會對民眾造成傷害；超過6成人認為，法案只對富裕階層有利。
另外，《經濟學人》的調查顯示，特朗普的支持率跌至41%，較上周再跌1...",2025-07-22 13:24,cradio,2025-07-22 13:30,2025-07-22 13:24:00,"美國總統特朗普再次入主白宮滿半年，多項民調顯示，他的支持率跌至只有約4成。

哥倫比亞廣播公司的民調顯示，特朗普支持率約為42%，比2月上任初期下跌11個百分點。64%受訪者不滿意政府處理通脹的表現，是特朗普上任以來新高。另外，有47%受訪者認為，特朗普力推的《大而美法案》，會對民眾造成傷害；超過6成人認為，法案只對富裕階層有利。

另外，《經濟學人》的調查顯示，特朗普的支持率跌至41%，較上周再跌1.6個百分點，不支持率有55%；淨支持率由上任初期的2個百分點，轉為負14個百分點。"
2588292,中大研發「磁控軟性螺旋微導管」　有助治療中遠端血管栓塞,https://www.881903.com/news/local/2588292,local,"中文大學醫學院及工程學院組成跨學科研究團隊，成功研發「磁控軟性螺旋微導管」，有助治療中遠端血管栓塞患者治療，減少併發症的風險。

新研發的「微導管」只有0.5毫米至0.9毫米大小、具柔性導尖，可應用在針對性腦血管介入治療上，有望突破傳統中風介入治療工作的限制，為腦血管阻塞患者提供更快捷、更安全、更精準的治療方案。研究團隊已經在白兔及體外人胎盤血管中成功測試新技術，顯示具有臨床應用潛力。",2025-07-22 13:15,cradio,2025-07-22 13:30,2025-07-22 13:15:00,"中文大學醫學院及工程學院組成跨學科研究團隊，成功研發「磁控軟性螺旋微導管」，有助治療中遠端血管栓塞患者治療，減少併發症的風險。

新研發的「微導管」只有0.5毫米至0.9毫米大小、具柔性導尖，可應用在針對性腦血管介入治療上，有望突破傳統中風介入治療工作的限制，為腦血管阻塞患者提供更快捷、更安全、更精準的治療方案。研究團隊已經在白兔及體外人胎盤血管中成功測試新技術，顯示具有臨床應用潛力。"
2588291,孟加拉空軍教練機撞落學校增至27死,https://www.881903.com/news/international/2588291,international,"孟加拉空軍一架中國製教練機，昨日在首都達卡墜毀，撞落一間學校，死亡人數增至27人，88名傷者正在醫院留醫，包括多名兒童，部分人情況嚴重。孟加拉今日全國哀悼一日，各地下半旗致哀，當局已成立特別委員會調查事件。

事發在墜毀的是一架F-7 BGI教練機，為中國「殲-7」戰機的外銷機種，由成都飛機工業公司研製。當地時間昨日下午1時許，涉事的軍機由達卡一個基地起飛作例行訓練，不久就出現技術故障，機師曾嘗試...",2025-07-22 13:00,cradio,2025-07-22 13:15,2025-07-22 13:00:00,"孟加拉空軍一架中國製教練機，昨日在首都達卡墜毀，撞落一間學校，死亡人數增至27人，88名傷者正在醫院留醫，包括多名兒童，部分人情況嚴重。孟加拉今日全國哀悼一日，各地下半旗致哀，當局已成立特別委員會調查事件。

事發在墜毀的是一架F-7 BGI教練機，為中國「殲-7」戰機的外銷機種，由成都飛機工業公司研製。當地時間昨日下午1時許，涉事的軍機由達卡一個基地起飛作例行訓練，不久就出現技術故障，機師曾嘗試飛到人煙稀少的地區，但最終撞落一間學校的校舍，並引發大火。"
2588290,32歲男子涉「起底」分居妻子及女兒資料被捕,https://www.881903.com/news/local/2588290,local,"一名32歲男子，涉嫌在未經分居妻子同意下，披露妻子和女兒的個人資料，違反《私隱條例》被私隱專員公署拘捕，獲准保釋候查。

女事主去年初與被捕人分居後，同年底誕下女兒。公署指，有人在今年5月，分別在社交平台的公開群組及個人帳戶，先後發布2條包含女事主及女兒個人資料的帖文及留言，並上載一份聲稱基因分析報告，質疑被捕人與女嬰的血緣關係，以及對女事主作負面評論。被披露的個人資料包括女事主的中英文姓名、身份...",2025-07-22 12:56,cradio,2025-07-22 13:00,2025-07-22 12:56:00,"一名32歲男子，涉嫌在未經分居妻子同意下，披露妻子和女兒的個人資料，違反《私隱條例》被私隱專員公署拘捕，獲准保釋候查。

女事主去年初與被捕人分居後，同年底誕下女兒。公署指，有人在今年5月，分別在社交平台的公開群組及個人帳戶，先後發布2條包含女事主及女兒個人資料的帖文及留言，並上載一份聲稱基因分析報告，質疑被捕人與女嬰的血緣關係，以及對女事主作負面評論。被披露的個人資料包括女事主的中英文姓名、身份證號碼及住址等。"
2588289,立法會審議「控煙十招」　議員關注先訂立後審議業界難配合,https://www.881903.com/news/local/2588289,local,"立法會法案委員會審議政府提出的「控煙十招」。政府提交的修正案，建議將禁止向18歲以下人士提供煙草產品的禁令生效日期，提早至修訂條例刊憲當日；亦建議將加味煙禁令更貼近加拿大的監管框架， 以清單形式列明禁止的「指明添加劑」及豁免物質。

批發及零售界邵家輝表示，不完全同意禁止售賣加味煙，擔心限制市民及遊客的選擇，又關注以「先訂立後審議」方式，實施完稅煙標籤制度及全煙害警示包裝，擔心業界未能配合，認為以...",2025-07-22 12:55,cradio,2025-07-22 13:00,2025-07-22 12:55:00,"立法會法案委員會審議政府提出的「控煙十招」。政府提交的修正案，建議將禁止向18歲以下人士提供煙草產品的禁令生效日期，提早至修訂條例刊憲當日；亦建議將加味煙禁令更貼近加拿大的監管框架， 以清單形式列明禁止的「指明添加劑」及豁免物質。

批發及零售界邵家輝表示，不完全同意禁止售賣加味煙，擔心限制市民及遊客的選擇，又關注以「先訂立後審議」方式，實施完稅煙標籤制度及全煙害警示包裝，擔心業界未能配合，認為以「先審議後訂立」較恰當。他早前已就條例草案向委員會提出修正案，但指估計日後仍有不同的修訂，會直接將修正案提交立法會大會。

選委界簡慧敏指，有調查指加味捲煙會令青少年更易上癮，專家亦認為禁止加味煙是刻不容援，認為當局已平衝加味煙的危害及經濟影響。

醫務衞生局副秘書長李力綱表示，政府謹慎進行控煙修例工作，生效前會與立法會有充分溝通，議員可充分表達意見，亦會預留充足時間讓持分者準備。

法案委員會在完成審議修正案後，會在9月10日在立法會大會恢復二讀辯論。"
2588288,香港郵政「投寄易」平台疑遭網絡攻擊　專家相信是設定有漏洞,https://www.881903.com/news/local/2588288,local,"香港郵政表示，網上平台「投寄易」遭網絡攻擊，有帳戶持有人的通訊錄資料被讀取，暫未知受影響人數，以及是否有資料外洩；如有資料，會立即通知受影響人士。「投寄易」服務現已恢復正常。

香港郵政昨晚近午夜發稿，形容是「資訊保安事故」，指初步調查顯示，有「投寄易」帳戶持有人的通訊錄資料被讀取，包括寄件人和收件人姓名、地址、電話號碼、傳真號碼和電郵地址。香港郵政譴責網絡攻擊行為，又指發現事件後，已即時採取行動...",2025-07-22 12:44,cradio,2025-07-22 13:00,2025-07-22 12:44:00,"香港郵政表示，網上平台「投寄易」遭網絡攻擊，有帳戶持有人的通訊錄資料被讀取，暫未知受影響人數，以及是否有資料外洩；如有資料，會立即通知受影響人士。「投寄易」服務現已恢復正常。

香港郵政昨晚近午夜發稿，形容是「資訊保安事故」，指初步調查顯示，有「投寄易」帳戶持有人的通訊錄資料被讀取，包括寄件人和收件人姓名、地址、電話號碼、傳真號碼和電郵地址。香港郵政譴責網絡攻擊行為，又指發現事件後，已即時採取行動，阻止未經授權的讀取，即日按既定程序，分別向警方報案、通知數字政策辦公室，以及向個人資料私隱專員公署和保安局通報。

資訊保安專家方保僑：或涉設定漏洞　多於網絡攻擊

香港資訊科技商會榮譽會長方保僑接受訪問時指，據他了解，「投寄易」系統設定出現問題，導致更改用戶通訊錄的網址後，可以看到其他人的通訊錄資料，形容事件是「程序漏洞」多於遭網絡攻擊，的確未必有資料外洩。他相信，香港郵政已修復漏洞，短期內應該不會再出問題，但郵政仍應交由網絡保安專家，詳細檢視系統是否有其他漏洞。他建議「投寄易」用戶，查看帳戶通訊錄是否載有親友的個人資料，如果有，應通知並讓對方有所防範。

另外，方保僑關注，「投寄易」系統設置在香港郵政本身的伺服器，而非放在政府雲端，建議日後參照其他政府部門的內部指引，說明涉及機密或個人資料的系統，都必須放置在政府雲端伺服器。他又說，類似事件時有發生，不同部門都應該持續檢視系統安全性。"
2588287,港股半日升62點穿25000　華虹中芯升逾3%,https://www.881903.com/news/finance/2588287,finance,"港股半日靠穩，恒生指數高開30點，升穿兩萬五，最多曾升126點，半日收報25057點，升62點，大市成交1378億元；國企指數9040點，升不足1點，恒生科技指數5589點，升3點。

科技股半日個別發展，騰訊(00700.HK)升3元，報524.5元；阿里巴巴(09988.HK)跌0.7元，報117.2元；美團(03690.HK)跌逾1%，報128.6元，跌2.2元；據報京東(09618.HK)...",2025-07-22 12:24,cradio,2025-07-22 12:30,2025-07-22 12:24:00,"港股半日靠穩，恒生指數高開30點，升穿兩萬五，最多曾升126點，半日收報25057點，升62點，大市成交1378億元；國企指數9040點，升不足1點，恒生科技指數5589點，升3點。

科技股半日個別發展，騰訊(00700.HK)升3元，報524.5元；阿里巴巴(09988.HK)跌0.7元，報117.2元；美團(03690.HK)跌逾1%，報128.6元，跌2.2元；據報京東(09618.HK)首家自營外賣門店開業，股價跌1元，報129.9元；百度(09888.HK)升近1%，報87.55元，升0.8元。

晶片股造好，華虹(01347.HK)升逾3%，報37.1元；中芯(00981.HK)升逾3%，報48.85元，是半日升幅最大藍籌。

昨日急升的「雅下工程」概念股部份繼續向上，東方電氣(01072.HK)升逾5%，報25.9元；哈爾濱電氣(01133.HK)盈喜，預告中期純利翻倍至10億人民幣，股價升逾8%，報8.51元；安徽海螺水泥(00914.HK)升0.1元，報24.35元；反觀中國建材(03323.HK)跌逾1%，報4.86元；華潤建材科技(01313.HK)無升跌，報2.13元。

領展(00823.HK)宣布，行政總裁王國龍明年6月底前將退任集團行政總裁及執行董事，股價升逾1%，報43.35元。

黃金股向上，招金(01818.HK)升逾2%，報21.65元；中國黃金國際(02099.HK)升逾1%，報70.95元；紫金(02899.HK)升3%，報22.3元；山東黃金(01787.HK)升近1%，報27.45元。

智駕股偏軟，優必選(09880.HK)折讓9.1%配股，料籌24.1億元，股價跌逾5%，報85.15元；知行汽車(01274.HK)跌逾3%，報15.5元；地平線(09660.HK)跌逾3%，報6.75元。

新東方(09901.HK)跌逾4%，報37元，是半日跌幅最大藍籌。"
2588286,丘應樺：銀發市場龐大　有助商界拓展客群,https://www.881903.com/news/local/2588286,local,"商務及經濟發展局局長丘應樺出席一個軟餐活動時指，銀髮經濟市場龐大，發展銀髮經濟不止關乎本地長者福祉，更能吸引境外長者旅客來港消費，有助商界拓展客群。

他樂見商界在商經局推動下，將現有菜式轉化為軟餐版本，並自主研發軟餐，又感謝社會各界積極響應政府銀髮經濟工作組的呼籲，和商界合作，透過提供適老產品技術支援及專業培訓等，把握銀髮巿場的機遇，提升長者生活質量，推動本港經濟發展。",2025-07-22 12:02,cradio,2025-07-22 12:30,2025-07-22 12:30:00,"商務及經濟發展局局長丘應樺出席一個軟餐活動時指，銀髮經濟市場龐大，發展銀髮經濟不止關乎本地長者福祉，更能吸引境外長者旅客來港消費，有助商界拓展客群。

他樂見商界在商經局推動下，將現有菜式轉化為軟餐版本，並自主研發軟餐，又感謝社會各界積極響應政府銀髮經濟工作組的呼籲，和商界合作，透過提供適老產品技術支援及專業培訓等，把握銀髮巿場的機遇，提升長者生活質量，推動本港經濟發展。

有連鎖餐飲品牌推出為吞嚥困難人士研發的軟餐，有中式的蝦餃、燒賣及蘿蔔糕等，亦有西式的「香草雞鎚飯」及「瑞士雞翼飯」。有獲認證為「照護食種子餐廳」的酒樓，推出「翡翠琵琶豆腐」、「金腿魚茸炒鮮奶」、「蟹籽蟹肉燴伊麵」等5款食品。

集團依照「國際吞噤障礙飲食標準（1DDSl）」製作軟餐，並會向接近200間安老院舍，提供1.5萬份免費軟餐。"
2588285,Google獲官方認證奧數金牌　OpenAI自行提前公布奪金捱批,https://www.881903.com/news/finance/2588285,finance,"國際數學奧林匹克（IMO）今年首度成為全球人工智能領軍企業Google DeepMind和OpenAI的角力場，兩間公司皆宣布旗下AI系統首次取得金牌水準，與全球最優秀高中生比肩，標誌著AI在複雜數學推理領域的重大突破。

Google DeepMind 旗下新一代Gemini Deep Think模型正式參賽，按照奧數官方規定在9小時內解答六道極具挑戰性的題目，成功完美解出其中五題，獲得35分，...",2025-07-22 11:52,cradio,2025-07-22 12:45,2025-07-22 11:52:00,"國際數學奧林匹克（IMO）今年首度成為全球人工智能領軍企業Google DeepMind和OpenAI的角力場，兩間公司皆宣布旗下AI系統首次取得金牌水準，與全球最優秀高中生比肩，標誌著AI在複雜數學推理領域的重大突破。

Google DeepMind 旗下新一代Gemini Deep Think模型正式參賽，按照奧數官方規定在9小時內解答六道極具挑戰性的題目，成功完美解出其中五題，獲得35分，達到金牌線。而DeepMind的答案經過奧數官方工作人員核准與計分，與人類參賽者完全同等標準。

而OpenAI就是在官方比賽結束後，將自家尚未公開發布的通用大型語言模型，套用到本屆奧數題目，並遵循比賽條件作答，同樣取得35分的金牌級表現。OpenAI是邀請3位前奧數金牌得主獨立評分。雖未正式參賽，但成績亦被公認為技術里程碑。

OpenAI則是提前在社交媒體上自行公布取得金牌成績，但成績並未經過奧數官方評審團評估，也沒有奧數官方評委直接參與評審，是未經官方認證的自評結果。

奧數主辦方要求所有參加AI評測的團隊在閉幕結束後至少等待一周才可公開成績，以尊重參賽青少年，避免焦點被提前奪走，但OpenAI選擇提前在社交媒體上自行公布取得金牌成績，導致官方與學界批評做法粗魯且不恰當。"
2588281,領展股東：望下任CEO更具地產觸覺,https://www.881903.com/news/finance/2588281,finance,領展(00823.HK)今日舉行股東會，對於行政總裁王國龍退任，有股東認為領展換人是應該，王國龍的銀行背景與領展格格不入，領展需要有對地產更熟悉、觸覺更敏銳的接班人。他指對領展2022年入標奪得安達臣道首幅商業項目後，入標第二幅商業地落選感到失望，認為是管理團隊欠缺地產觸覺，出價有誤，希望管理層汲取教訓。,2025-07-22 11:30,cradio,2025-07-22 11:45,2025-07-22 11:30:00,領展(00823.HK)今日舉行股東會，對於行政總裁王國龍退任，有股東認為領展換人是應該，王國龍的銀行背景與領展格格不入，領展需要有對地產更熟悉、觸覺更敏銳的接班人。他指對領展2022年入標奪得安達臣道首幅商業項目後，入標第二幅商業地落選感到失望，認為是管理團隊欠缺地產觸覺，出價有誤，希望管理層汲取教訓。
