id,title,url,section,lead,date,source,scrape_time,last_update,news_content
2604480,全運會公路單車｜港隊伍柏亨第四名完賽　與獎牌擦身而過,https://www.881903.com/news/sports/2604480,sports,"全運會公路單車男子個人計時賽，港隊代表伍柏亨得第四名，慢第三名選手約8秒，未能收獲獎牌；另一名港將劉允祐就得第六名。
賽事早上在珠海舉行，共有28名選手參加，最終由山東的苗城碩以46分17秒得金牌。
至於隨即舉行的女子個人計時賽，就由海南的張好以39分02秒奪金，港隊梁穎儀就慢冠軍約1分30秒，以第8名完賽。",2025-11-07 14:26,cradio,2025-11-07 14:30,2025-11-07 14:26:00,"全運會公路單車男子個人計時賽，港隊代表伍柏亨得第四名，慢第三名選手約8秒，未能收獲獎牌；另一名港將劉允祐就得第六名。

賽事早上在珠海舉行，共有28名選手參加，最終由山東的苗城碩以46分17秒得金牌。

至於隨即舉行的女子個人計時賽，就由海南的張好以39分02秒奪金，港隊梁穎儀就慢冠軍約1分30秒，以第8名完賽。"
2604479,65歲以上長者11月16日可免費乘港鐵輕鐵,https://www.881903.com/news/local/2604479,local,"本月16日是「長者日」，港鐵當日將為65歲或以上的長者，提供免費乘車優惠。長者當日使用樂悠咭、長者八達通或個人八達通，可免費乘搭港鐵、輕鐵及港鐵巴士，但優惠不適用於機場快綫、東鐵綫過境車程及高鐵；乘搭東鐵綫頭等須支付額外費用。
港鐵公司常務總監楊美珍表示，期望透過每年「長者日」提供免費乘車優惠，以表達對長者的敬意，並鼓勵他們多外出活動，促進社區聯繫與凝聚力。",2025-11-07 14:22,cradio,2025-11-07 14:30,2025-11-07 14:22:00,"本月16日是「長者日」，港鐵當日將為65歲或以上的長者，提供免費乘車優惠。長者當日使用樂悠咭、長者八達通或個人八達通，可免費乘搭港鐵、輕鐵及港鐵巴士，但優惠不適用於機場快綫、東鐵綫過境車程及高鐵；乘搭東鐵綫頭等須支付額外費用。

港鐵公司常務總監楊美珍表示，期望透過每年「長者日」提供免費乘車優惠，以表達對長者的敬意，並鼓勵他們多外出活動，促進社區聯繫與凝聚力。"
2604485,滙豐將本港今年經濟增長上調至3.2%　明年上調至2.4%,https://www.881903.com/news/finance/2604485,finance,"滙豐環球投資研究報告，將本港今年本地生產總值(GDP)增長預測由2.5%上調至3.2%，明年由2.1%上調至2.4%，2027年由2.2%上調至2.5%。

預期貿易動能相對穩健　消費續改善

滙豐環球投資研究大中華區經濟師辛怡然表示，本港第3季GDP按年上升3.8%，超出預期，顯示經濟活動持續具韌性，為今次上調預測貢獻0.4個百分點。滙豐預期年內餘下時間仍有相對穩健的貿易動能，以及自第2季以來持...",2025-11-07 14:20,cradio,2025-11-07 15:00,2025-11-07 14:20:00,"滙豐環球投資研究報告，將本港今年本地生產總值(GDP)增長預測由2.5%上調至3.2%，明年由2.1%上調至2.4%，2027年由2.2%上調至2.5%。

預期貿易動能相對穩健　消費續改善

滙豐環球投資研究大中華區經濟師辛怡然表示，本港第3季GDP按年上升3.8%，超出預期，顯示經濟活動持續具韌性，為今次上調預測貢獻0.4個百分點。滙豐預期年內餘下時間仍有相對穩健的貿易動能，以及自第2季以來持續改善的消費。隨著美國聯儲局9月與10月重啟減息、本港互聯互通更佳，以及培育新增長動能的政策重點，對香港經濟看法更為正面。

貿易是第三季經濟的主要支撐，在中美近期達成協議後，相關領域或再獲緩衝。不過，考慮到明年各經濟體對美關稅整體抬升，以及今年「提早下單」後的需求回落，明年貿易或出現部分回吐。﻿

至於消費自第2季以來表現更佳，預期隨著住宅物業市場出現穩定跡象，以及股市跑贏所帶來的正面財富效應，消費將獲得更多驅動因素。若美國12月再度減息，加上住宅庫存近來下降，相關支持可能進一步增強。

辛怡然又說，香港今年金融活動回升，IPO熱潮、南向資金通創新高，以及股市表現領先，為財富與金融服務帶來增長機遇。而香港與內地及全球的互聯互通提升，將有助鞏固香港作為國際金融與貿易中心的地位，這判斷亦在「十五五」規劃中得到呼應。近期對金融科技、科技與創新的推動，將有助可持續增長。"
2604478,小鵬逆市造好 美銀上調目標價至105元,https://www.881903.com/news/finance/2604478,finance,"小鵬汽車(09868.HK)股價逆市造好，最高見94.45元，升逾5%，最新報92.5元，升3.1元，升近3.5%。
小鵬汽車前日攜手高德地圖，宣布明年3款自研Robotaxi車型正式試運營，整合高德叫車平台並開放生態布局，進軍海外市場。小鵬同時發布人形機器人IRON，並宣布明年底目標實現規模量產高階人形機器人。
美銀將小鵬汽車目標價上調至27美元，核心驅動力在於""物理AI""戰略及技術變現能力，獲...",2025-11-07 13:48,cradio,2025-11-07 14:00,2025-11-07 13:48:00,"小鵬汽車(09868.HK)股價逆市造好，最高見94.45元，升逾5%，最新報92.5元，升3.1元，升近3.5%。

小鵬汽車前日攜手高德地圖，宣布明年3款自研Robotaxi車型正式試運營，整合高德叫車平台並開放生態布局，進軍海外市場。小鵬同時發布人形機器人IRON，並宣布明年底目標實現規模量產高階人形機器人。

美銀將小鵬汽車目標價上調至27美元，核心驅動力在於""物理AI""戰略及技術變現能力，獲得關鍵驗證。大眾汽車已成為小鵬VLA 2.0大模型和圖靈AI芯片的首個客戶，標誌著小鵬的AI技術已成功商業化。而小鵬的Robotaxi、人形機器人和飛行汽車，均計劃在2026年實現量產或交付。小鵬ADR昨晚顯著上升，收報23.89美元，升2.1美元，升幅9.6%。

小鵬的IRON機器人亮相後，在網上引發討論，部份網民懷疑是真人扮演，董事長兼首席執行官何小鵬特別拍攝片斷，掀開機器人部份衣服，顯示內部的機器，證明是真正的機器人。

美銀的報告，重申對小鵬汽車的""買入""評級，將美國預託證券的目標價，由26美元上調至27美元，港股目標價亦相應從101港元上調至105港元。

雖然上調目標價，但美銀對小鵬的盈利預測趨於保守。報告預計，由於產品組合調整，公司毛利率將面臨壓力，導致2025年虧損擴大。不過，仍預計小鵬有望在2025年第四季度實現盈利。"
2604476,11月16日長者日消費優惠　3800間店舖參與,https://www.881903.com/news/local/2604476,local,社署指，將於本月16日「長者日」，籌辦「長者日消費優惠」活動，邀請本地飲食業、零售業及其他商戶，為長者咭持有人提供特別折扣或優惠。發言人表示，全港18區已有超過400間機構和商戶參與相關活動，約3800間店舖將於活動當日在門市展示優惠內容及使用條款或細則，並張貼相關宣傳海報，以方便長者識別。長者咭持有人只需以手機掃描宣傳海報上的二維碼，即可瀏覽參與商戶名單及優惠資料。,2025-11-07 13:27,cradio,2025-11-07 13:30,2025-11-07 13:27:00,社署指，將於本月16日「長者日」，籌辦「長者日消費優惠」活動，邀請本地飲食業、零售業及其他商戶，為長者咭持有人提供特別折扣或優惠。發言人表示，全港18區已有超過400間機構和商戶參與相關活動，約3800間店舖將於活動當日在門市展示優惠內容及使用條款或細則，並張貼相關宣傳海報，以方便長者識別。長者咭持有人只需以手機掃描宣傳海報上的二維碼，即可瀏覽參與商戶名單及優惠資料。
2604475,解放軍首艘電磁彈射型航母「福建艦」入列　習近平登艦視察,https://www.881903.com/news/china/2604475,china,"解放軍第一艘電磁彈射型航空母艦「福建艦」，前日下午在海南三亞舉行入列授旗儀式。中共中央總書記、國家主席、中央軍委主席習近平出席儀式，並登艦視察。

習近平在儀式上向「福建艦」艦長與政治委員授予八一軍旗，並於儀式後登艦視察，聽取航母建設發展工作匯報，了解航母體系作戰能力生成、電磁彈射系統建設運用等情況，又觀看艦載機彈射放飛的流程演示，並與艦載機機師交流，詳細詢問飛機技戰術性能和電磁彈射的特點優勢。
...",2025-11-07 13:22,cradio,2025-11-07 13:30,2025-11-07 13:22:00,"解放軍第一艘電磁彈射型航空母艦「福建艦」，前日下午在海南三亞舉行入列授旗儀式。中共中央總書記、國家主席、中央軍委主席習近平出席儀式，並登艦視察。

習近平在儀式上向「福建艦」艦長與政治委員授予八一軍旗，並於儀式後登艦視察，聽取航母建設發展工作匯報，了解航母體系作戰能力生成、電磁彈射系統建設運用等情況，又觀看艦載機彈射放飛的流程演示，並與艦載機機師交流，詳細詢問飛機技戰術性能和電磁彈射的特點優勢。

習近平隨後前往福建艦的艦島，登上塔台了解飛行指揮和起降運行情況，他在駕駛室察看值勤戰位，並在航泊日誌上簽名，又到彈射綜合控制站，觀摩工作流程，按下彈射按鈕，亦與艦上官兵交流，到餐廳和士兵艙視察他們的飲食和住宿保障情況。

「福建艦」是中國第三艘航空母艦，舷號為「18」，由中國完全自主設計建造。新華社報道指，「福建艦」採用電磁彈射技術是由習近平親自決策，技術處於世界先進水平，飛行甲板上有4道阻攔索，與3個彈射起飛位，艦載機包括殲-35、殲-15T、空警-600等新型軍機。"
2604474,馬斯克：人形機器人明年量產 FSD獲中國部份批准,https://www.881903.com/news/finance/2604474,finance,"特斯拉行政總裁馬斯克在萬億薪酬方案通過後，在股東大會展望業務發展，指特斯拉人形機器人將在明年啟動量產，首先會在弗里蒙特啟動年產百萬台的生產線，然後將在奧斯汀建造1000萬台年產能的生產線。
馬斯克指，Optimus機器人將採用年度發布周期，每次都會有重大改進。第4代預計2027年推出，第5代預計2028年推出。
他又說，特斯拉已掌握機器人複雜的手部工程，形容人形機器人本質上是""有手臂和腿的智能車""...",2025-11-07 13:22,cradio,2025-11-07 13:30,2025-11-07 13:22:00,"特斯拉行政總裁馬斯克在萬億薪酬方案通過後，在股東大會展望業務發展，指特斯拉人形機器人將在明年啟動量產，首先會在弗里蒙特啟動年產百萬台的生產線，然後將在奧斯汀建造1000萬台年產能的生產線。

馬斯克指，Optimus機器人將採用年度發布周期，每次都會有重大改進。第4代預計2027年推出，第5代預計2028年推出。

他又說，特斯拉已掌握機器人複雜的手部工程，形容人形機器人本質上是""有手臂和腿的智能車""，與特斯拉車輛現有的電池、電機、人工智能等技術同源打造。一旦實現每年100萬台的持續產量，生產成本將在2萬美元左右。但他亦承認，對人形機器人的研發投入是個""無底洞""。

他又相信人形機器人將真正消除貧困，提供超越人類外科醫生的精準醫療，為每個人提供""超乎想象的醫療服務""。人形機器人的經濟效應巨大，可將全球經濟規模擴大10至100倍。並且將可用於月球和火星基地建設。

他又預期，人類可能在20年內實現通過Neuralink，將人類意識快照上傳到特斯拉人形機器人當中。屆時，人形機器人有可能具備人類意識。

自動駕駛方面，馬斯克指，智能輔助駕駛系統(FSD)V14.1版本已經很流暢，V14.3版本將達到""睡一覺醒來就抵達目的地""的水平。他相信在未來幾個月內，借助FSD技術，駕駛員將被允許邊開車邊發短信。而受監管的FSD Supervised目前已在6個國家/地區推出。

馬斯克又透露，特斯拉的FSD在中國獲得""部分批准""，他獲悉FSD有望在明年2月或3月左右獲得全面批准。

特斯拉首款專為無人駕駛設計的Robotaxi運營車輛Cybercab，將於明年4月在得州超級工廠啟動量產，車輛無方向盤、無踏板、無後視鏡，每公里運行只需幾毫子。馬斯克說，目標是將Cyber​​cab的下線時間縮短到10秒以內，理論上可以壓縮到5秒，年產能將從50萬台飆升至200萬至500萬台。

馬斯克又指，特斯拉已準備好能源解決方案，但芯片供應仍需擴大，可能需要建造一座巨型芯片工廠Terafab，目標是每月生產100萬片晶圓。

汽車方面，馬斯克指，仍然是特斯拉未來計劃的重要領域。他最近提到""史上最震撼的產品演示""，指的是全新Roadster，明年4月1日將發布新技術演示，預計12至18個月後量產，又揚言是""有史以來最酷的車，如果它還算是一輛車的話""。"
2604473,南韓蔚山發電廠鍋爐倒塌　至少3死2失蹤,https://www.881903.com/news/international/2604473,international,"南韓蔚山市一間發電廠昨日有塔式鍋爐倒塌，壓住一批工人，其中3人被救出後證實死亡，2人被推定死亡，另外有2人仍然下落不明。
事發在當地昨日下午約2時，涉事鍋爐約60米高，當時正用炸藥拆除，期間倒塌，9名工人被困，消防接報到場後成功救出2人。被埋工人全部都是外判商的員工。總統李在明指示動用一切資源搜救及善後。",2025-11-07 13:18,cradio,2025-11-07 13:30,2025-11-07 13:18:00,"南韓蔚山市一間發電廠昨日有塔式鍋爐倒塌，壓住一批工人，其中3人被救出後證實死亡，2人被推定死亡，另外有2人仍然下落不明。

事發在當地昨日下午約2時，涉事鍋爐約60米高，當時正用炸藥拆除，期間倒塌，9名工人被困，消防接報到場後成功救出2人。被埋工人全部都是外判商的員工。總統李在明指示動用一切資源搜救及善後。"
2604472,廉署與警方拘32人　涉騙取中小企貸款1.4億元,https://www.881903.com/news/local/2604472,local,廉政公署與警方採取聯合行動，拘捕32人，涉嫌以貪污手段，詐騙政府中小企融資擔保計劃，涉及22間中小企的28宗申請，貸款金額達1.4億元。被捕人士包括銀行前線職員及中介公司負責人，牽涉賄款約50萬元。廉署指，有中介在過去三年招攬不同人假扮中小企東主，向銀行申請百分百擔保特惠貸款、八成及九成信貸擔保產品，而大部分公司沒有實質業務，甚至是空殼公司。中介同時行賄銀行職員批出貸款，有涉案的銀行職員獲貸款額約...,2025-11-07 13:02,cradio,2025-11-07 13:15,2025-11-07 13:02:00,"廉政公署與警方採取聯合行動，拘捕32人，涉嫌以貪污手段，詐騙政府中小企融資擔保計劃，涉及22間中小企的28宗申請，貸款金額達1.4億元。被捕人士包括銀行前線職員及中介公司負責人，牽涉賄款約50萬元。廉署指，有中介在過去三年招攬不同人假扮中小企東主，向銀行申請百分百擔保特惠貸款、八成及九成信貸擔保產品，而大部分公司沒有實質業務，甚至是空殼公司。中介同時行賄銀行職員批出貸款，有涉案的銀行職員獲貸款額約6%作為報酬，調查期間已成功截停批出部分貸款。

警方表示，被捕人向銀行提交虛假月結單、員工強積金供款記錄及稅單，藉此誇大營業額，騙取批出貸款，當中8間中小企成功貸款，涉款5千萬元，而相關款項批出後，被人在短時間內提取，大部分申請公司都沒有按時還款。"
2604471,南韓指北韓向東部海域發射彈道導彈,https://www.881903.com/news/international/2604471,international,"北韓時隔16日，再發射彈道導彈。南韓聯合參謀本部表示，北韓向東部海域發射至少一枚型號不明的彈道導彈。軍方正在分析導彈的類型和射程等數據。
今次是自南韓李在明政府成立後，北韓第二次發射導彈，對上一次是在上月底。分析認為，北韓發射導彈可能意在抗議美國政府近期採取的一系列制裁措施。",2025-11-07 12:57,cradio,2025-11-07 13:00,2025-11-07 12:57:00,"北韓時隔16日，再發射彈道導彈。南韓聯合參謀本部表示，北韓向東部海域發射至少一枚型號不明的彈道導彈。軍方正在分析導彈的類型和射程等數據。

今次是自南韓李在明政府成立後，北韓第二次發射導彈，對上一次是在上月底。分析認為，北韓發射導彈可能意在抗議美國政府近期採取的一系列制裁措施。"
2604470,大灣區跨境救護車計劃周日起擴至珠海與南沙,https://www.881903.com/news/local/2604470,local,政府公布，「大灣區跨境直通救護車試行計劃」將由星期日起，擴展至珠海與南沙的指定醫院。特區政府過去兩個月，分別聯同珠海市及廣州市南沙區人民政府進行演練，模擬救護車跨境載送病人，過程大致順暢。新增的內地指定醫院，包括珠海市人民醫院和中山大學附屬第一醫院南沙院區。醫務衞生局局長盧寵茂表示，隨着粵港澳大灣區城市高度融合，以「點對點」方式跨境轉運病人的需求日益殷切；試行計劃的擴展有助提升大灣區的醫療協作，為...,2025-11-07 12:52,cradio,2025-11-07 13:00,2025-11-07 12:52:00,"政府公布，「大灣區跨境直通救護車試行計劃」將由星期日起，擴展至珠海與南沙的指定醫院。特區政府過去兩個月，分別聯同珠海市及廣州市南沙區人民政府進行演練，模擬救護車跨境載送病人，過程大致順暢。新增的內地指定醫院，包括珠海市人民醫院和中山大學附屬第一醫院南沙院區。醫務衞生局局長盧寵茂表示，隨着粵港澳大灣區城市高度融合，以「點對點」方式跨境轉運病人的需求日益殷切；試行計劃的擴展有助提升大灣區的醫療協作，為病人提供更安全、及時和便捷的轉運安排。

　　

試行計劃於去年11月底推出，首階段實行跨境直通救護車由深圳市和澳門的指定醫院，載送病人到香港的指定公立醫院。截至今年11月初，粵港澳三地已成功轉運17名病人，其中11人由深圳出發，6人由澳門出發。當局指，試行計劃啓動以來，整體運作良好，並會延續一年至明年11月底。"
2604469,DoubleLine：私募投資人需對AI熱潮保持謹慎,https://www.881903.com/news/finance/2604469,finance,"DoubleLine Capital的全球發達市場信貸主管科恩(Robert Cohen)表示，固定收益投資人對於資助人工智能熱潮應保持謹慎。他在彭博的播客節目指，不單要對科技行業保持警惕，亦要注意支援這些新項目的相關產業，因為不知道萬一熱潮退郤時，會觸發甚麼連鎖反應。
近期，科技公司在公私債務市場大舉借貸，以投資人工智能。Google母公司Alphabet今個星期，在美國發行175億美元債券，並...",2025-11-07 12:52,cradio,2025-11-07 13:00,2025-11-07 12:52:00,"DoubleLine Capital的全球發達市場信貸主管科恩(Robert Cohen)表示，固定收益投資人對於資助人工智能熱潮應保持謹慎。他在彭博的播客節目指，不單要對科技行業保持警惕，亦要注意支援這些新項目的相關產業，因為不知道萬一熱潮退郤時，會觸發甚麼連鎖反應。

近期，科技公司在公私債務市場大舉借貸，以投資人工智能。Google母公司Alphabet今個星期，在美國發行175億美元債券，並在歐洲發行65億歐元債券；Meta上星期籌得300億美元，之前在路易斯安那州的相關項目，亦進行270億美元的私人募資；甲骨文就在9月，向債券投資人籌得180億美元。

科恩指出，這些融資常採用創新結構，如表外融資，而這些龐大資本項目是否能獲利仍是未知數。他警告，產能過剩可能導致虧損，又指出電力與化工等相關產業，可能有風險面臨困境，強調項目必須證明有獲利能力，否則市場將出現劇烈反應。

摩根士丹利預測，雲端運算巨頭在2028年前，將在數據中心等基建上，投資約3萬億美元，估算約一半資金可由現金流支付，其餘則需透過債務籌措。

科恩表達憂慮的同時，仍預期固定收益投資人對科技業債務有強勁需求，指企業併購活動低迷、再融資主導，整體信貸市場供應不足，投資人樂於投資更多債券。

但科恩指，部份客戶對私募借貸的回報失望，不希望再投入相關範疇，而是希望尋找其他替代投資，以分散風險。"
2604465,報道引Meta內部文件指詐騙違規廣告佔銷售1成,https://www.881903.com/news/finance/2604465,finance,"路透社引述Meta的內部文件報道，Meta預計去年總銷售額的10%(約160億美元)，來自於網路詐騙與違禁商品的廣告。問題廣告類型包括：詐騙性電子商務與投資計畫、非法線上賭場、違禁醫療產品銷售。
報道指，文件顯示Meta正試圖衡量旗下社交平台Facebook與Instagram上，詐騙廣告的普遍程度。
Meta去年總銷售額超過1645億美元，今年第3季銷售額按年增長26%，達512.4億美元。而為...",2025-11-07 12:23,cradio,2025-11-07 12:30,2025-11-07 12:23:00,"路透社引述Meta的內部文件報道，Meta預計去年總銷售額的10%(約160億美元)，來自於網路詐騙與違禁商品的廣告。問題廣告類型包括：詐騙性電子商務與投資計畫、非法線上賭場、違禁醫療產品銷售。

報道指，文件顯示Meta正試圖衡量旗下社交平台Facebook與Instagram上，詐騙廣告的普遍程度。

Meta去年總銷售額超過1645億美元，今年第3季銷售額按年增長26%，達512.4億美元。而為了加大人工智能投資，Meta將全年最低支出預估，提高20億美元。

報道引述Meta去年12月的文件，提到公司每年從高風險詐騙廣告，創造約70億美元的年化收入，每天向用戶展示約150億則高風險詐騙廣告。報道指，雖然部分文件顯示Meta有意減少虛假廣告，但其他文件則顯示，公司擔心若突然移除這些廣告，可能會影響業務預測。

報道又引述Meta發言人表示，公司正「積極」打擊詐騙與欺詐廣告。對於10%廣告收入來自詐騙的估算，發言人指是「粗略且過度概括的估計」，後續審查發現許多廣告並未違規。

發言人補充，洩露的文件不幸呈現片面的觀點，扭曲Meta對詐騙廣告的處理方式，只是聚焦他們評估問題的規模，而非公司採取的全面行動。"
2604464,周一鳴：國家安全工作　仍任重道遠,https://www.881903.com/news/local/2604464,local,"警方早上在警察總部舉行警隊紀念日儀式，悼念在執行職務期間殉職的警務人員。警務處處長周一鳴，帶領在場人士先默哀2分鐘，他致辭時表示，殉職同袍的事蹟，突顯警察是一份值得引以為傲的使命，殉職人員對捍衛社會及市民生命財產的堅持，除成為警隊典範，更在巿民心中留下深刻印記，亦驅使警隊即使過去面對不同治安挑戰、重大事件、天災、疫症，都仍然令香港社會重拾正軌，市民安定生活得到保障。
周一鳴表示，面對世界複雜多變的...",2025-11-07 12:09,cradio,2025-11-07 12:15,2025-11-07 12:09:00,"警方早上在警察總部舉行警隊紀念日儀式，悼念在執行職務期間殉職的警務人員。警務處處長周一鳴，帶領在場人士先默哀2分鐘，他致辭時表示，殉職同袍的事蹟，突顯警察是一份值得引以為傲的使命，殉職人員對捍衛社會及市民生命財產的堅持，除成為警隊典範，更在巿民心中留下深刻印記，亦驅使警隊即使過去面對不同治安挑戰、重大事件、天災、疫症，都仍然令香港社會重拾正軌，市民安定生活得到保障。

周一鳴表示，面對世界複雜多變的環境，維護國家安全和維持社會治安的工作，仍然任重道遠，深信警隊每一位成員都會秉承前人精神，迎難而上，令香港警察成為世界上其中一支最優秀的執法隊伍。"
