id,title,url,section,lead,date,source,scrape_time,last_update,news_content
2588369,海關破逾11億元洗黑錢案　拘2男,https://www.881903.com/news/local/2588369,local,"海關偵破一宗涉及11.5億元的洗黑錢案，並拘捕2名男子，涉嫌利用走私現金和虛擬資產洗黑錢。案件仍在調查，不排除有更多人被捕。
海關指，涉案的37歲本地男子和50歲非本地男子，分別報稱自僱及無業。海關早前發現他們偷運現金離境，並以來歷不明的資金頻密地進行巨額的穩定幣和法定貨幣交易，與他們背景和財務狀況極不相稱。海關早上突擊搜查4個住宅單位及2間公司，並拘捕兩人，他們正保釋候查。",2025-07-22 19:22,cradio,2025-07-22 19:30,2025-07-22 19:22:00,"海關偵破一宗涉及11.5億元的洗黑錢案，並拘捕2名男子，涉嫌利用走私現金和虛擬資產洗黑錢。案件仍在調查，不排除有更多人被捕。

海關指，涉案的37歲本地男子和50歲非本地男子，分別報稱自僱及無業。海關早前發現他們偷運現金離境，並以來歷不明的資金頻密地進行巨額的穩定幣和法定貨幣交易，與他們背景和財務狀況極不相稱。海關早上突擊搜查4個住宅單位及2間公司，並拘捕兩人，他們正保釋候查。"
2588365,司法部原副部長劉志強涉貪逾4200萬元人民幣　判囚13年,https://www.881903.com/news/china/2588365,china,"國家司法部原黨組成員、副部長劉志強，受賄超過4245萬元人民幣，今日在安徽省蕪湖市中級人民法院一審判處有期徒刑13年，並罰款300萬元人民幣；受賄所得財物及孳息上繳國庫。
審理查明，在2007年至去年4月，劉志強利用擔任公安部國際合作局局長，司法部黨組成員、副部長，國家禁毒委員會委員等職務上的便利，以及職權、地位形成的便利條件，爲他人在企業經營、項目承攬、業務推廣、職務晉升等事項上提供幫助，直接或...",2025-07-22 19:01,cradio,2025-07-22 19:15,2025-07-22 19:01:00,"國家司法部原黨組成員、副部長劉志強，受賄超過4245萬元人民幣，今日在安徽省蕪湖市中級人民法院一審判處有期徒刑13年，並罰款300萬元人民幣；受賄所得財物及孳息上繳國庫。

審理查明，在2007年至去年4月，劉志強利用擔任公安部國際合作局局長，司法部黨組成員、副部長，國家禁毒委員會委員等職務上的便利，以及職權、地位形成的便利條件，爲他人在企業經營、項目承攬、業務推廣、職務晉升等事項上提供幫助，直接或通過他人非法收受財物。

法院認為，劉志強的行爲構成受賄罪，受賄數額特別巨大，應依法懲處。鑑於他主動交代辦案機關尚未掌握的部分受賄事實，認罪悔罪，積極退贓，涉案贓款贓物大部分已追繳到案，依法可從輕處罰。"
2588362,觀光船「海龍明珠號」颱風期間撞碼頭　海事處將檢控船東,https://www.881903.com/news/local/2588362,local,"周日十號颶風信號生效期間，觀光船「海龍明珠號」在堅尼地城對開海面飄浮，並撞向招商局碼頭。海事處表示，根據《商船（本地船隻）條例》，船東、船東代理人或船長，在船隻發生碰撞後，須立即以口頭、訊號或書面方式，向海事處處長報告，並須於事發24小時內，以書面方式向處長提交詳情；由於處方尚未收到詳細書面報告，因此會檢控船東，並會繼續調查，如發現其他違反海事條例的情況，會再跟進和檢控。
海事處回覆查詢時指，據初...",2025-07-22 18:43,cradio,2025-07-22 18:45,2025-07-22 18:43:00,"周日十號颶風信號生效期間，觀光船「海龍明珠號」在堅尼地城對開海面飄浮，並撞向招商局碼頭。海事處表示，根據《商船（本地船隻）條例》，船東、船東代理人或船長，在船隻發生碰撞後，須立即以口頭、訊號或書面方式，向海事處處長報告，並須於事發24小時內，以書面方式向處長提交詳情；由於處方尚未收到詳細書面報告，因此會檢控船東，並會繼續調查，如發現其他違反海事條例的情況，會再跟進和檢控。

海事處回覆查詢時指，據初步了解，涉事船隻較早前停泊在油麻地錨地；處方接報後，一直與船隻負責人保持密切聯繫，得悉船東正安排在安全情況下，將船隻盡快拖至避風塘停泊，涉及費用由船東自行承擔。"
2588360,機場三跑分判商工頭向下屬索賄　判囚半年,https://www.881903.com/news/local/2588360,local,"一名機場三跑項目分判商「工頭」，向下屬索取賄款，協助對方繼續獲聘，早前被裁定一項代理人索取利益罪成，今日在西九龍裁判法院被判入獄半年。
案情指，39歲的新領海機械行前「工頭」許偉國，在2022年12月初，向屬下一名起重機操作工人索取每日100元至200元的賄款，以協助對方繼續受僱於新領海。有關起重機操作工人在2022年11月入職，日薪1400元，遭被告索賄後不久辭工，沒有支付任何賄款。",2025-07-22 18:40,cradio,2025-07-22 18:45,2025-07-22 18:40:00,"一名機場三跑項目分判商「工頭」，向下屬索取賄款，協助對方繼續獲聘，早前被裁定一項代理人索取利益罪成，今日在西九龍裁判法院被判入獄半年。

案情指，39歲的新領海機械行前「工頭」許偉國，在2022年12月初，向屬下一名起重機操作工人索取每日100元至200元的賄款，以協助對方繼續受僱於新領海。有關起重機操作工人在2022年11月入職，日薪1400元，遭被告索賄後不久辭工，沒有支付任何賄款。"
2588355,「救世」十合一快檢試劑需更新說明書　免錯誤解讀檢測結果,https://www.881903.com/news/local/2588355,local,"衛生署接獲快測供應商「救世(SAVEWO)」通知，一款「十合一抗原快速檢測試劑」產品說明書需進行更新，以免用家錯誤解讀檢測結果。根據「救世」提供的資料，涉事產品可多合一檢測流感、新冠及H5N1禽流感等10款呼吸道病毒，今年3月起在本港零售市場分銷。製造商在進行內部測試後更新說明書，指若H5N1檢測欄為陽性而FIuA+B/COV檢測欄為陰性，則代表H5N1禽流感檢測結果為無效。
「救世」已將更新的說...",2025-07-22 18:21,cradio,2025-07-22 18:30,2025-07-22 18:21:00,"衛生署接獲快測供應商「救世(SAVEWO)」通知，一款「十合一抗原快速檢測試劑」產品說明書需進行更新，以免用家錯誤解讀檢測結果。根據「救世」提供的資料，涉事產品可多合一檢測流感、新冠及H5N1禽流感等10款呼吸道病毒，今年3月起在本港零售市場分銷。製造商在進行內部測試後更新說明書，指若H5N1檢測欄為陽性而FIuA+B/COV檢測欄為陰性，則代表H5N1禽流感檢測結果為無效。

「救世」已將更新的說明書上載網頁，市民如對快測結果有疑問，可致電55032370向「救世」查詢。"
2588352,彭博：貝萊德限制員工在中國使用公司裝置,https://www.881903.com/news/china/2588352,china,"彭博報道，全球最大資產管理公司貝萊德要求所有員工，在前往中國公幹時，不能攜帶公司裝置，只能使用臨時租借的手提電話。
報道指，貝萊德上周三發出內部備忘錄，指員工前往中國公幹時，將不能攜帶及使用公司的手提電話及電腦等裝置，亦不能在當地使用公司手提電腦或通過虛擬私人網路（VPN）進行遠端訪問。另外，員工私下到訪中國時，亦將無法登入貝萊德的網絡系統。貝萊德暫未對報道置評。
近日先後傳出有美國企業及政府員工...",2025-07-22 18:10,cradio,2025-07-22 18:15,2025-07-22 18:10:00,"彭博報道，全球最大資產管理公司貝萊德要求所有員工，在前往中國公幹時，不能攜帶公司裝置，只能使用臨時租借的手提電話。

報道指，貝萊德上周三發出內部備忘錄，指員工前往中國公幹時，將不能攜帶及使用公司的手提電話及電腦等裝置，亦不能在當地使用公司手提電腦或通過虛擬私人網路（VPN）進行遠端訪問。另外，員工私下到訪中國時，亦將無法登入貝萊德的網絡系統。貝萊德暫未對報道置評。

近日先後傳出有美國企業及政府員工，前往中國後被禁止出境，包括富國銀行的華裔董事總經理茅晨月，中方指她涉及一宗刑事案件。富國銀行目前已暫停安排員工到中國公幹。"
2588350,「智方便」新增查閱及繳付政府帳單功能,https://www.881903.com/news/local/2588350,local,"政府「智方便」流動應用程式將陸續新增查閱及繳付不同政府帳單功能，包括查閱水費單，及香港郵政「特快專遞」帳單的結欠，並可透過「轉數快」繳付帳單。未來數月，市民亦可以「智方便」查閱有關水務署帳戶的待辦事項，例如水費帳單繳款提示，及查詢服務的申請進度，例如水務署釣魚牌照及水喉匠牌照的申請進度。

數字政策辦公室表示，「智方便」至今有超過350萬登記用戶，接達超過1 200項政府及公私營機構網上服務和政府...",2025-07-22 18:08,cradio,2025-07-22 18:15,2025-07-22 18:08:00,"政府「智方便」流動應用程式將陸續新增查閱及繳付不同政府帳單功能，包括查閱水費單，及香港郵政「特快專遞」帳單的結欠，並可透過「轉數快」繳付帳單。未來數月，市民亦可以「智方便」查閱有關水務署帳戶的待辦事項，例如水費帳單繳款提示，及查詢服務的申請進度，例如水務署釣魚牌照及水喉匠牌照的申請進度。

數字政策辦公室表示，「智方便」至今有超過350萬登記用戶，接達超過1 200項政府及公私營機構網上服務和政府電子表格，目標是今年在「智方便」平台為所有數字政府服務提供一站式數碼服務，實現政府服務「一網通辦」。"
2588345,順德逾2400人確診基孔肯雅熱　澳門有1宗輸入個案,https://www.881903.com/news/local/2588345,local,"廣東省佛山市基孔肯雅熱疫情持續。截至昨日，疫情最嚴重的順德錄得2471宗確診，主要集中在樂從鎮、北滘鎮及陳村鎮；禪城區及南海區亦有逾50人受感染，全部都屬輕症。廣東省疾控中心表示，近期蚊蟲進入快速繁殖期，省內已發生基孔肯雅熱疫情，登革熱疫情亦進入快速上升期，提醒民眾清理積水，防止蚊蟲叮咬。
澳門衛生局疾病預防及控制中心指，上周五錄得今年首宗基孔肯雅熱輸入病例，患者曾前往順德，但強調目前當地傳播風險...",2025-07-22 17:48,cradio,2025-07-22 18:00,2025-07-22 17:48:00,"廣東省佛山市基孔肯雅熱疫情持續。截至昨日，疫情最嚴重的順德錄得2471宗確診，主要集中在樂從鎮、北滘鎮及陳村鎮；禪城區及南海區亦有逾50人受感染，全部都屬輕症。廣東省疾控中心表示，近期蚊蟲進入快速繁殖期，省內已發生基孔肯雅熱疫情，登革熱疫情亦進入快速上升期，提醒民眾清理積水，防止蚊蟲叮咬。

澳門衛生局疾病預防及控制中心指，上周五錄得今年首宗基孔肯雅熱輸入病例，患者曾前往順德，但強調目前當地傳播風險可控，提醒民眾如出現發燒、關節痛等症狀，應立即求醫。

北京市疾控中心亦發布提醒，指北京目前偶有境外輸入病例，隨著國際交流日益頻繁，病例輸入風險持續存在。"
2588340,紅磡都市公園第二期開放　周六起一連三日有多項免費活動,https://www.881903.com/news/local/2588340,local,"毗鄰紅磡碼頭的紅磡都市公園，第二期已於上周五正式開放，新增平衡車道、綠化區及洗手間等設施。連同第一期，佔地約6600平方米的整個園區已全面啟用。
紅磡都市公園將於星期六起，一連三日的下午舉行「海濱動感樂」活動，設有平衡車體驗、約1.5米高巨型充氣保齡球「全壘打」、充氣射箭等活動，現場亦設有多個以運動元素為主題的大型吹氣裝置，包括啞鈴、壺鈴及平衡車等。活動費用全免。",2025-07-22 17:19,cradio,2025-07-22 17:30,2025-07-22 17:19:00,"毗鄰紅磡碼頭的紅磡都市公園，第二期已於上周五正式開放，新增平衡車道、綠化區及洗手間等設施。連同第一期，佔地約6600平方米的整個園區已全面啟用。

紅磡都市公園將於星期六起，一連三日的下午舉行「海濱動感樂」活動，設有平衡車體驗、約1.5米高巨型充氣保齡球「全壘打」、充氣射箭等活動，現場亦設有多個以運動元素為主題的大型吹氣裝置，包括啞鈴、壺鈴及平衡車等。活動費用全免。"
2588337,阿根廷放寬對中國公民簽證　持美歐簽證可毋須阿根廷簽證,https://www.881903.com/news/china/2588337,china,"阿根廷即日起放寬對中國公民的簽證要求，持有美國或歐盟簽證的中國公民可毋須阿根廷簽證，即可入境阿根廷旅遊或經商。阿根廷政府表示，總統米萊作出有關決定，是為了促進旅遊業發展，並取消阻礙阿根廷經濟自由發展的機制。

中方早前擴大免簽國家範圍，包括阿根廷等5國持普通護照人員，今年6月至明年5月底，來華經商、旅遊觀光、探親訪友、交流訪問、過境不超過30日，可免辦簽證入境。",2025-07-22 16:51,cradio,2025-07-22 17:00,2025-07-22 16:51:00,"阿根廷即日起放寬對中國公民的簽證要求，持有美國或歐盟簽證的中國公民可毋須阿根廷簽證，即可入境阿根廷旅遊或經商。阿根廷政府表示，總統米萊作出有關決定，是為了促進旅遊業發展，並取消阻礙阿根廷經濟自由發展的機制。

中方早前擴大免簽國家範圍，包括阿根廷等5國持普通護照人員，今年6月至明年5月底，來華經商、旅遊觀光、探親訪友、交流訪問、過境不超過30日，可免辦簽證入境。"
2588336,周大福上季零售值下跌1.9%　港澳同店銷售增2.2%,https://www.881903.com/news/finance/2588336,finance,"周大福(01929.HK)截至6月底的首季零售值下跌1.9%，其中港澳及其他市場零售值增長7.8%，佔集團零售值13.6%；而佔比逾86%的內地市場，零售值下跌3.3%。

同店銷售方面，內地跌幅收窄至3.3%，港澳及其他市場增長2.2%，其中黃金首飾升6.6%，黃金首飾同店平均售價則上升至10400港元。

主席鄭家純表示，在標誌性系列帶動下，定價黃金產品保持積極勢頭，季內按年增長20.8%。在...",2025-07-22 16:45,cradio,2025-07-22 17:00,2025-07-22 16:45:00,"周大福(01929.HK)截至6月底的首季零售值下跌1.9%，其中港澳及其他市場零售值增長7.8%，佔集團零售值13.6%；而佔比逾86%的內地市場，零售值下跌3.3%。

同店銷售方面，內地跌幅收窄至3.3%，港澳及其他市場增長2.2%，其中黃金首飾升6.6%，黃金首飾同店平均售價則上升至10400港元。

主席鄭家純表示，在標誌性系列帶動下，定價黃金產品保持積極勢頭，季內按年增長20.8%。在 黃金首飾及產品類別中，定價產品的零 售值佔比由去年同期的15.8%迅速上升至季內的19.8%，進一步支持集團盈利的韌性。

另外，內地電子商務的零售值保持強勁勢頭，按年上升27%。季內對內地零售 值的貢獻7.6%，對銷量貢獻則是16.9%。主要因為深受顧客歡迎的IP聯乘合作及618購物節的強勁需求。"
2588335,彭博：新加坡新思路投資結束 資本返還投資者,https://www.881903.com/news/finance/2588335,finance,"彭博報道指，新加坡歷史最悠久的對沖基金之一—新思路投資(New Silk Road Investment)正在結束，聯合創始人洪逸倫(Yik Luen Hoong)在一封電子郵件表示，過去幾年，傳統的美國機構資金來源，對亞洲流動性股權投資的熱情有所降低，很大程度上是由於地緣政治原因。他還說，所有剩餘的資本將返還給投資者，並將關閉投資工具。
新思路投資在約16年前創立，截至去年12月，管理資產的規模...",2025-07-22 16:43,cradio,2025-07-22 16:45,2025-07-22 16:43:00,"彭博報道指，新加坡歷史最悠久的對沖基金之一—新思路投資(New Silk Road Investment)正在結束，聯合創始人洪逸倫(Yik Luen Hoong)在一封電子郵件表示，過去幾年，傳統的美國機構資金來源，對亞洲流動性股權投資的熱情有所降低，很大程度上是由於地緣政治原因。他還說，所有剩餘的資本將返還給投資者，並將關閉投資工具。

新思路投資在約16年前創立，截至去年12月，管理資產的規模跌至6.15億美元，遠低於2021年的近20億美元。彭博指，市場動盪和地緣政治衝突，令小型對沖基金面臨越來越嚴峻的情況，大型競爭對手亦吸走大量資金。

彭博指，新思路投資創立時，在新加坡金融圈曾是相對的先驅。當時，新加坡對沖基金市場整體管理的資產規模，只有僅590億新加坡元(460億美元)；截至去年12月，則達到3270億新加坡元。

基金是中國早期的外國投資者之一，在上海設有團隊。2012年，基金根據合格境外投資者(QFII)計劃，獲批可投資以人民幣計價的中國內地股票和債券；當時獲中國證監會同類批准的公司不到200家。

但新思路投資近年績效下滑。彭博引述知情人士透露，過去5年中，公司旗下Asia Landmark基金和中國基金，有3年回報率為負數，2022年分別下跌28%和19%。同年，中國滬深300指數重挫22%。跌勢持續到2023年，許多投資中國的老手受損。

報道又指，新思路投資過去受到美國機構投資者的歡迎，但其中許多投資者對於投資亞洲變得謹慎，並開始贖回他們的基金。洪逸倫說，新思路投資只是亞洲眾多未獲時代青睞的主動價值基金之一。市場已經發生變化，不再青睞那些偏重價值的較長期基本面投資手法。

洪逸倫又說，公司今年早前曾試圖縮減規模，包括裁減上海的員工，並關閉一隻近期推出的東南亞基金。他表示，公司並非因為虧損而被迫關閉，又指新加坡仍然是成功的對沖基金重鎮。但公司兩位創始人都年過60歲，他們選擇放慢節奏，但接班人還沒有準備好掌舵。

他說，只是決定高掛戰靴，把資金返還給投資者，讓他們能夠採取這個時代更適合的策略。兩個老兵選擇另一條人生路徑，就這麼簡單。"
2588334,李在明涉5宗刑事案全部庭審暫停,https://www.881903.com/news/international/2588334,international,"南韓水原地方法院決定，押後審理總統李在明涉嫌索賄對朝匯款案，意味李在明牽涉的5宗刑事案件，全部庭審都暫停。水原地方法院刑事審判庭舉行庭前會議，指被告李在明現為總統，履行國家元首職務，為確保被告專注於履行《憲法》保障的總統職務，順利施政，決定日後再擇期開庭審理案件。
檢方去年6月起訴李在明，於2019年1月至2020年1月出任京畿道知事期間，與前京畿道副知事李華泳，合謀向前裳邦爾集團會長金聖泰索賄8...",2025-07-22 16:38,cradio,2025-07-22 16:45,2025-07-22 16:38:00,"南韓水原地方法院決定，押後審理總統李在明涉嫌索賄對朝匯款案，意味李在明牽涉的5宗刑事案件，全部庭審都暫停。水原地方法院刑事審判庭舉行庭前會議，指被告李在明現為總統，履行國家元首職務，為確保被告專注於履行《憲法》保障的總統職務，順利施政，決定日後再擇期開庭審理案件。

檢方去年6月起訴李在明，於2019年1月至2020年1月出任京畿道知事期間，與前京畿道副知事李華泳，合謀向前裳邦爾集團會長金聖泰索賄800萬美元，當中500萬美元是京畿道承諾提供給北韓的智慧農場項目經費，其餘300萬美元是李在明的訪朝經費。

李在明共牽涉5宗刑事案，其餘4宗包括涉嫌違反《公職選舉法》案的重審、地產開發弊案、挪用京畿道政府公款案，以及涉嫌教唆偽證案二審。"
2588333,國泰前地勤涉受賄向人蛇發登機證　潛逃15年後在港落網,https://www.881903.com/news/local/2588333,local,"國泰航空一名前地勤人員，涉嫌於15年前偷運人蛇，其後棄保潛逃，昨日於香港落網，被控4項「代理人串謀接受利益罪」。他今日被押解到西九龍裁判法院應訊，暫時毋須答辯。裁判官將案件押後到9月30日再訊，期間被告須還柙懲教署看管。

案發在2008至09年，現年44歲的男子徐英傑，當時任職國泰航空客戶服務主任，負責在香港機場協助旅客辦理登機手續。控罪指，被告涉嫌串謀偷運人蛇集團的成員，以及另外2名國泰地勤人...",2025-07-22 16:31,cradio,2025-07-22 16:45,2025-07-22 16:31:00,"國泰航空一名前地勤人員，涉嫌於15年前偷運人蛇，其後棄保潛逃，昨日於香港落網，被控4項「代理人串謀接受利益罪」。他今日被押解到西九龍裁判法院應訊，暫時毋須答辯。裁判官將案件押後到9月30日再訊，期間被告須還柙懲教署看管。

案發在2008至09年，現年44歲的男子徐英傑，當時任職國泰航空客戶服務主任，負責在香港機場協助旅客辦理登機手續。控罪指，被告涉嫌串謀偷運人蛇集團的成員，以及另外2名國泰地勤人員，向人蛇發出登機證，確保他們成功辦理登機手續，並就每名人蛇收取1000至2000元賄款。

除了徐英傑之外，其餘2名涉案地勤及2名人蛇集團成員，早年已認罪，2011年於區域法院被判監14至20個月。"
2588330,港股收升135點報25130點　信義玻璃飊7%,https://www.881903.com/news/finance/2588330,finance,"港股全日反覆向上，突破兩萬五關口。恒生指數高開30點後一度倒跌近百點，最終以全日最高位25130點收市，升135點，大市成交2661億元；國企指數9075點，升35點；恒生科技指數5606點，升21點。

科技股個別發展，騰訊(00700.HK)升近1%，報526元；阿里巴巴(09988.HK)升0.1元，報118元；美團(03690.HK)跌逾1%，報129元；據報京東(09618.HK)首家自...",2025-07-22 16:21,cradio,2025-07-22 16:30,2025-07-22 16:21:00,"港股全日反覆向上，突破兩萬五關口。恒生指數高開30點後一度倒跌近百點，最終以全日最高位25130點收市，升135點，大市成交2661億元；國企指數9075點，升35點；恒生科技指數5606點，升21點。

科技股個別發展，騰訊(00700.HK)升近1%，報526元；阿里巴巴(09988.HK)升0.1元，報118元；美團(03690.HK)跌逾1%，報129元；據報京東(09618.HK)首家自營外賣門店開業，股價跌0.4元，報130.5元；百度(09888.HK)升逾1%，報87.95元；快手(01024.HK)升近2%，報72.75元。

昨日急升的「雅下工程」概念股個別發展，東方電氣(01072.HK)繼昨日懷疑因烏龍盤而飊升65%後，今日早段曾再升12%，收市倒跌近3%，報23.95元。哈爾濱電氣(01133.HK)發盈喜，預告中期純利翻倍至10億人民幣，股價升逾8%，報8.5元；安徽海螺水泥(00914.HK)升逾2%，報24.85元；中國建材(03323.HK)升近1%，報4.95元。

光伏股造好，信義玻璃(00868.HK)升逾7%，報8.75元，是全日升幅最強藍籌；信義光能(00968.HK)升近5%，報3.07元；協鑫科技(03800.HK)升逾6%，報1.28元；福萊特玻璃(06865.HK)升近4%，報10.68元。"
2588329,曼谷抵港男子行李藏12公斤大麻花被捕,https://www.881903.com/news/local/2588329,local,海關在機場拘捕一名從泰國曼谷抵港的39歲男子，在他的寄艙行李內檢獲約12公斤大麻花，黑市約值250萬元。被捕男子被控一項販運危險藥物罪，明日在西九龍裁判法院提堂。,2025-07-22 16:19,cradio,2025-07-22 16:30,2025-07-22 16:19:00,海關在機場拘捕一名從泰國曼谷抵港的39歲男子，在他的寄艙行李內檢獲約12公斤大麻花，黑市約值250萬元。被捕男子被控一項販運危險藥物罪，明日在西九龍裁判法院提堂。
