id,title,url,section,lead,date,source,scrape_time,last_update,news_content
2578777,美股上揚　道指升331點,https://www.881903.com/news/finance/2578777,finance,"紐約股巿上升。市場觀望美國總統特朗普與更多國家達成貿易協議，從而降低關稅。

道瓊斯工業平均指數收巿報42654點，上升331點。

納斯達克指數收巿報19211點，上升98點。

標普五百指數收巿報5958點，上升41點。

總計整個星期，納指上升7.2%。道指及標指上升3.4%及5.3%。",2025-05-17 04:30,cradio,2025-05-17 05:00,2025-05-17 04:30:00,"紐約股巿上升。市場觀望美國總統特朗普與更多國家達成貿易協議，從而降低關稅。

道瓊斯工業平均指數收巿報42654點，上升331點。

納斯達克指數收巿報19211點，上升98點。

標普五百指數收巿報5958點，上升41點。

總計整個星期，納指上升7.2%。道指及標指上升3.4%及5.3%。"
2578776,美國議員去信特朗普　指關稅或令美國變得孤立,https://www.881903.com/news/international/2578776,international,"美國參議院3名分別來自外交關係委員會、軍事委員會及情報委員會的民主黨議員，去信總統特朗普，表示關注他的關稅政策，破壞美國長期以來與盟友及夥伴的關係，最終損害美國國家安全利益，可能令「美國優先」變成「美國孤立」，警告在同中國的戰略競爭中，如果美國袛靠自己，將更難取勝，呼籲特朗普評估他短視及衝動的關稅措施，對美國國家安全的長期影響。
信件指，參議院在審議政府2026財政年度預算案期間，將會舉行一系列聽...",2025-05-17 04:21,cradio,2025-05-17 04:30,2025-05-17 04:21:00,"美國參議院3名分別來自外交關係委員會、軍事委員會及情報委員會的民主黨議員，去信總統特朗普，表示關注他的關稅政策，破壞美國長期以來與盟友及夥伴的關係，最終損害美國國家安全利益，可能令「美國優先」變成「美國孤立」，警告在同中國的戰略競爭中，如果美國袛靠自己，將更難取勝，呼籲特朗普評估他短視及衝動的關稅措施，對美國國家安全的長期影響。

信件指，參議院在審議政府2026財政年度預算案期間，將會舉行一系列聽證會，期望政府官員說明關稅行動，對美國盟友及夥伴關係的影響。"
2578775,紐約期油上升1.4%,https://www.881903.com/news/finance/2578775,finance,油價上升。紐約期油收巿報62.49美元，上升87美仙，升幅1.4%。,2025-05-17 03:20,cradio,2025-05-17 03:30,2025-05-17 03:20:00,油價上升。紐約期油收巿報62.49美元，上升87美仙，升幅1.4%。
2578774,以軍空襲也門港口　限制胡塞武裝補給能力,https://www.881903.com/news/international/2578774,international,以色列軍方空襲也門西部，由胡塞武裝控制的兩個港口。以軍聲明指，行動是回應胡塞武裝本周多次用導彈及無人機攻擊以色列，又指胡塞武裝利用有關港口轉運武器。以色列傳媒引述軍方消息人士報道，15架以軍戰機共向目標投擲35枚炸彈。空襲令長度超過80米的船隻無法停靠有關港口，嚴重限制胡塞武裝的物資補給能力。,2025-05-17 02:48,cradio,2025-05-17 03:00,2025-05-17 02:48:00,以色列軍方空襲也門西部，由胡塞武裝控制的兩個港口。以軍聲明指，行動是回應胡塞武裝本周多次用導彈及無人機攻擊以色列，又指胡塞武裝利用有關港口轉運武器。以色列傳媒引述軍方消息人士報道，15架以軍戰機共向目標投擲35枚炸彈。空襲令長度超過80米的船隻無法停靠有關港口，嚴重限制胡塞武裝的物資補給能力。
2578773,特朗普稱未能與貿易夥伴逐一談判　將自行定出關稅稅率,https://www.881903.com/news/international/2578773,international,"美國總統特朗普指，他的政府未能與所有貿易夥伴談判達成協議，將於未來兩、三星期自行定出對他們的關稅稅率。
特朗普上月初宣布向貿易夥伴加徵對等關稅，其後決定暫緩90日實施。他周五在阿聯酋會晤商界領袖時表示，有150個國家希望與美國達成協議，但華府沒有足夠時間與他們逐一談判。財長貝森特與商務部長盧特尼克將去信通知他們美國徵收的稅率。特朗普認為稅率將會非常公平，收到信件的國家可以提出上訴。",2025-05-17 02:09,cradio,2025-05-17 02:15,2025-05-17 02:09:00,"美國總統特朗普指，他的政府未能與所有貿易夥伴談判達成協議，將於未來兩、三星期自行定出對他們的關稅稅率。

特朗普上月初宣布向貿易夥伴加徵對等關稅，其後決定暫緩90日實施。他周五在阿聯酋會晤商界領袖時表示，有150個國家希望與美國達成協議，但華府沒有足夠時間與他們逐一談判。財長貝森特與商務部長盧特尼克將去信通知他們美國徵收的稅率。特朗普認為稅率將會非常公平，收到信件的國家可以提出上訴。"
2578772,羅馬網球賽｜艾卡拉斯率先晉身男單決賽,https://www.881903.com/news/sports/2578772,sports,"羅馬泥地網球賽，西班牙的艾卡拉斯率先晉身男單決賽。他在4強對意大利的穆薩迪，贏直落兩盤6-3及7-6。

另一個決賽席位由意大利的辛納及美國的保羅爭奪。",2025-05-17 01:30,cradio,2025-05-17 01:45,2025-05-17 01:30:00,"羅馬泥地網球賽，西班牙的艾卡拉斯率先晉身男單決賽。他在4強對意大利的穆薩迪，贏直落兩盤6-3及7-6。

另一個決賽席位由意大利的辛納及美國的保羅爭奪。"
2578771,ICC首席檢察官被指性行為不當　暫時休假,https://www.881903.com/news/international/2578771,international,"國際刑事法院(ICC)宣布，首席檢察官卡里姆汗暫時休假，直至完成他被指性行為不當的調查。
55歲的卡里姆汗被指強迫一名女助手發生性關係，並向對方進行性騷擾。卡里姆汗否認指控。在去年5月，卡里姆汗以涉嫌戰爭罪和反人類罪，申請對以色列總理內塔尼亞胡發出逮捕令。美國總統特朗普今年2月簽署行政命令，將卡里姆汗列入制裁名單。",2025-05-17 01:11,cradio,2025-05-17 01:15,2025-05-17 01:11:00,"國際刑事法院(ICC)宣布，首席檢察官卡里姆汗暫時休假，直至完成他被指性行為不當的調查。

55歲的卡里姆汗被指強迫一名女助手發生性關係，並向對方進行性騷擾。卡里姆汗否認指控。在去年5月，卡里姆汗以涉嫌戰爭罪和反人類罪，申請對以色列總理內塔尼亞胡發出逮捕令。美國總統特朗普今年2月簽署行政命令，將卡里姆汗列入制裁名單。"
2578770,歐洲股巿上升,https://www.881903.com/news/finance/2578770,finance,"歐洲股巿上升。
英國股巿收巿報8684點，上升50點。
法國股巿收巿報7886點，上升33點。
德國股巿收巿報23767點，上升71點。",2025-05-17 00:22,cradio,2025-05-17 00:30,2025-05-17 00:22:00,"歐洲股巿上升。

英國股巿收巿報8684點，上升50點。

法國股巿收巿報7886點，上升33點。

德國股巿收巿報23767點，上升71點。"
2578769,巴西商業農場首爆禽流感  中國暫停進口巴西禽肉60日,https://www.881903.com/news/international/2578769,international,"巴西首次發現有商業農場爆發禽流感，有關農場位於南里約格朗德州，農業部表示，已啟動應急方案，包括在農場方圓10公里內進行調查，以及疫情是否有可能同其他農場有關。已將事件通報世界動物衛生組織。受事件影響，中國政府已暫停從巴西進口禽肉60日。

農業部表示，禽流感不會通過食用禽肉及蛋傳播，人類感染禽流感的風險較低，主要發生在與禽類有密切接觸的飼養員及專業人員身上。農業部長法瓦羅表示，如果能消除疫情，有可...",2025-05-16 23:41,cradio,2025-05-16 23:45,2025-05-16 23:41:00,"巴西首次發現有商業農場爆發禽流感，有關農場位於南里約格朗德州，農業部表示，已啟動應急方案，包括在農場方圓10公里內進行調查，以及疫情是否有可能同其他農場有關。已將事件通報世界動物衛生組織。受事件影響，中國政府已暫停從巴西進口禽肉60日。

農業部表示，禽流感不會通過食用禽肉及蛋傳播，人類感染禽流感的風險較低，主要發生在與禽類有密切接觸的飼養員及專業人員身上。農業部長法瓦羅表示，如果能消除疫情，有可能在60日內恢復正常的禽肉貿易往來，包括與中國的貿易。"
2578768,外籍男子控襲警、普通襲擊及從合法羈押逃離,https://www.881903.com/news/local/2578768,local,"一名47歲外籍男子被控襲警、普通襲擊及從合法羈押逃離，明日在觀塘裁判法院提堂。
這名男子早前涉及一宗傷人案被捕及檢控，其後因身體不適送往瑪麗醫院治理。他昨日在留院期間企圖逃走，其間襲擊一名男警及一名醫院女職員，當場被制服。遇襲男警腳部受傷，醫院女職員膝蓋受傷。",2025-05-16 23:19,cradio,2025-05-16 23:30,2025-05-16 23:19:00,"一名47歲外籍男子被控襲警、普通襲擊及從合法羈押逃離，明日在觀塘裁判法院提堂。

這名男子早前涉及一宗傷人案被捕及檢控，其後因身體不適送往瑪麗醫院治理。他昨日在留院期間企圖逃走，其間襲擊一名男警及一名醫院女職員，當場被制服。遇襲男警腳部受傷，醫院女職員膝蓋受傷。"
2578767,美國4月新屋動工按月升1.6%,https://www.881903.com/news/finance/2578767,finance,"美國4月份新屋動工，按月上升1.6%，以年率計有136萬間，當中單戶住宅動工按月下跌2.1%，有92.7萬間。

4月建築批文按月下跌4.7%，有141萬間，單戶住宅動工批文按月跌6.2%，有92萬間。",2025-05-16 23:09,cradio,2025-05-16 23:15,2025-05-16 23:09:00,"美國4月份新屋動工，按月上升1.6%，以年率計有136萬間，當中單戶住宅動工按月下跌2.1%，有92.7萬間。

4月建築批文按月下跌4.7%，有141萬間，單戶住宅動工批文按月跌6.2%，有92萬間。"
2578766,本月密歇根大學消費者信心指數跌至50.8,https://www.881903.com/news/finance/2578766,finance,美國5月份密歇根大學消費者信心指數，下跌2.7%，至50.8，差過市場預期，是2022年7月以來最低水平，亦是連續兩個月下跌。,2025-05-16 22:46,cradio,2025-05-16 23:00,2025-05-16 22:46:00,美國5月份密歇根大學消費者信心指數，下跌2.7%，至50.8，差過市場預期，是2022年7月以來最低水平，亦是連續兩個月下跌。
2578765,美國新任駐華大使龐德偉向外交部遞交國書副本,https://www.881903.com/news/china/2578765,china,"昨日到北京履新的美國新任駐華大使龐德偉，今日到外交部，向部長助理兼禮賓司司長洪磊遞交國書副本。龐德偉在駐華使館的社交平台表示，很期待能在中國代表總統特朗普以及美國人民，推進美國的利益。

龐德偉早前表示，已準備好工作，讓美國更安全、更強大及更繁榮。外交部發言人林劍表示，中方始終堅持互相尊重、和平共處、合作共贏的原則看待和處理中美關係，也希望美方和中方相向而行。",2025-05-16 22:39,cradio,2025-05-16 22:45,2025-05-16 22:39:00,"昨日到北京履新的美國新任駐華大使龐德偉，今日到外交部，向部長助理兼禮賓司司長洪磊遞交國書副本。龐德偉在駐華使館的社交平台表示，很期待能在中國代表總統特朗普以及美國人民，推進美國的利益。

龐德偉早前表示，已準備好工作，讓美國更安全、更強大及更繁榮。外交部發言人林劍表示，中方始終堅持互相尊重、和平共處、合作共贏的原則看待和處理中美關係，也希望美方和中方相向而行。"
2578764,南丫海難死因研訊｜船廠董事同意屬南丫四號最終決策人 供稱「若出錯須負責」,https://www.881903.com/news/local/2578764,local,"2012年南丫海難死因研訊第9天，法庭繼續傳召負責建造「南丫四號」的財利船廠董事羅愕瑩出庭。海事處代表律師引述早前另一名董事羅衍瑩供稱，羅愕瑩是「南丫四號」項目的最終決策人。羅愕瑩回應，自己不能每件事情都做，但同意自己是建造「南丫四號」的最終決策人，若出錯他須負責。
羅愕瑩昨日供稱，在1994年設計「南丫四號」時，發現若將舵機房及油箱房設計為水密艙，即在兩艙之間安裝水密門，便會不符合海事處列明，舵...",2025-05-16 22:27,cradio,2025-05-16 22:30,2025-05-16 22:27:00,"2012年南丫海難死因研訊第9天，法庭繼續傳召負責建造「南丫四號」的財利船廠董事羅愕瑩出庭。海事處代表律師引述早前另一名董事羅衍瑩供稱，羅愕瑩是「南丫四號」項目的最終決策人。羅愕瑩回應，自己不能每件事情都做，但同意自己是建造「南丫四號」的最終決策人，若出錯他須負責。

羅愕瑩昨日供稱，在1994年設計「南丫四號」時，發現若將舵機房及油箱房設計為水密艙，即在兩艙之間安裝水密門，便會不符合海事處列明，舵機房長度須為船隻總長度一成的規定，因此與新加坡設計公司董事商討，決定將兩個船艙打通。

他今天解釋，指財利船廠所有船的尾艙長度都不會少於船身長度的一成，因此把「南丫四號」兩個船艙打通是按照船廠一貫做法。海事處代表律師則指，長度規例是用於計算船隻穩性，與船隻實際結構無關；又指過往海事處資料顯示，財利船廠並非所有船隻都符合他所指的規例，羅愕瑩回應指不知道。"
2578763,上水有工人維修簷篷失足跌下泳池  昏迷送院,https://www.881903.com/news/local/2578763,local,上水金錢路與金翠路交界一間獨立屋，一名67歲工人下午3時前，維修一個約3米高的簷篷期間，失足跌落游泳池遇溺，由同事救起，昏迷再送往北區醫院治理。警方列作工業意外有人受傷。,2025-05-16 22:17,cradio,2025-05-16 22:30,2025-05-16 22:17:00,上水金錢路與金翠路交界一間獨立屋，一名67歲工人下午3時前，維修一個約3米高的簷篷期間，失足跌落游泳池遇溺，由同事救起，昏迷再送往北區醫院治理。警方列作工業意外有人受傷。
2578762,美國國土安全部調查前FBI局長發帖涉籲暗殺特朗普,https://www.881903.com/news/international/2578762,international,"美國國土安全部長諾姆表示，她的部門及特勤局正調查前聯邦調查局長科米，涉嫌發貼文呼籲暗殺總統特朗普。科米星期四在社交平台發布一張，在沙灘上用貝殼排成「8647」的相片，事後被特朗普支持者解讀為威脅暗殺特朗普。在美國俚語中，86解作「趕走」、「擺脫」或「拒絕服務」。而特朗普就是美國第47任總統。

科米其後刪除貼文，解釋是在沙灘散步時看到有關貝殼，估計是政治信息，他完全無想過有人會聯想到暴力，強調反對...",2025-05-16 22:06,cradio,2025-05-16 22:15,2025-05-16 22:06:00,"美國國土安全部長諾姆表示，她的部門及特勤局正調查前聯邦調查局長科米，涉嫌發貼文呼籲暗殺總統特朗普。科米星期四在社交平台發布一張，在沙灘上用貝殼排成「8647」的相片，事後被特朗普支持者解讀為威脅暗殺特朗普。在美國俚語中，86解作「趕走」、「擺脫」或「拒絕服務」。而特朗普就是美國第47任總統。

科米其後刪除貼文，解釋是在沙灘散步時看到有關貝殼，估計是政治信息，他完全無想過有人會聯想到暴力，強調反對任何形式的暴力，因此刪除貼文。不過特朗普今日回應指，連小孩都知道86是解作暗殺，科米曾擔任聯邦調查局長，完全明白照片的箇中意思，他不會表態，交由幕僚決定，但形容科米是腐敗的警察。

科米在2013至2017年擔任聯邦調查局長，在特朗普首個任期曾指揮「通俄門」調查，到2017被特朗普革職。他一向反對特朗普，曾指特朗普在道德上不適合擔任總統。"
2578761,美股早段個別發展,https://www.881903.com/news/finance/2578761,finance,"美股早段個別發展，市場觀望總統特朗普與更多國家達成貿易協議，從而降低關稅。
道瓊斯指數最新報42254點，跌68點；
標準普爾500指數報5919點，升2點。
納斯達克指數報19122點，升10點。",2025-05-16 21:43,cradio,2025-05-16 21:45,2025-05-16 21:43:00,"美股早段個別發展，市場觀望總統特朗普與更多國家達成貿易協議，從而降低關稅。

道瓊斯指數最新報42254點，跌68點；

標準普爾500指數報5919點，升2點。

納斯達克指數報19122點，升10點。"
2578760,警方搗破高利貸非法收債集團 拘捕43人,https://www.881903.com/news/local/2578760,local,"警方搗破一個由黑幫操控的放高利貸及非法收債集團，拘捕43人，涉嫌串謀無牌放債等罪。被捕人包括集團主腦及骨幹成員，部分人有黑社會背景。警方指，犯罪集團自去年年中起運作，以短訊或在社交媒體隨機致電形式，聲稱有借貸優惠等作招徠，形容成員分工清晰；一旦借貸人無力償還款項，便會以淋紅油、打恐嚇電話等方式脅迫還款。

警方本周二，持法庭手令搜查荃灣一個工廈單位，檢獲集團5000份去年7月至今的放債紀錄，總數逾...",2025-05-16 21:34,cradio,2025-05-16 21:45,2025-05-16 21:34:00,"警方搗破一個由黑幫操控的放高利貸及非法收債集團，拘捕43人，涉嫌串謀無牌放債等罪。被捕人包括集團主腦及骨幹成員，部分人有黑社會背景。警方指，犯罪集團自去年年中起運作，以短訊或在社交媒體隨機致電形式，聲稱有借貸優惠等作招徠，形容成員分工清晰；一旦借貸人無力償還款項，便會以淋紅油、打恐嚇電話等方式脅迫還款。

警方本周二，持法庭手令搜查荃灣一個工廈單位，檢獲集團5000份去年7月至今的放債紀錄，總數逾8000萬元，每筆債款由數千至數萬元不等。警方其後在全港各區以涉嫌串謀無牌放債等罪拘捕24人、及以涉嫌刑事毀壞等罪拘捕19人，分別與18宗非法收債案件有關。"
2578759,日本空自教練機墜落蓄水池事故　其中1人屍體尋回,https://www.881903.com/news/international/2578759,international,"日本航空自衛隊T-4教練機，在愛知縣墜落蓄水池事故，當局尋回其中1名機組人員屍體。航空自衛隊指，救援人員經過兩日搜索，在事故現場周邊發現疑似其中1人屍體，已送往愛知縣小牧基地進一步確認，將連同早前尋獲的引擎和機輪等部件，一併分析，調查事故起因。
事發在周三，涉事教練機原定由小牧基地，飛往宮崎縣的新田原基地，但起飛不久墜落蓄水池，當時機上載有2名分別29和31歲男隊員。",2025-05-16 21:29,cradio,2025-05-16 21:45,2025-05-16 21:29:00,"日本航空自衛隊T-4教練機，在愛知縣墜落蓄水池事故，當局尋回其中1名機組人員屍體。航空自衛隊指，救援人員經過兩日搜索，在事故現場周邊發現疑似其中1人屍體，已送往愛知縣小牧基地進一步確認，將連同早前尋獲的引擎和機輪等部件，一併分析，調查事故起因。

事發在周三，涉事教練機原定由小牧基地，飛往宮崎縣的新田原基地，但起飛不久墜落蓄水池，當時機上載有2名分別29和31歲男隊員。"
2578758,澳洲公民因聯同烏軍作戰  被俄羅斯法院判監13年,https://www.881903.com/news/international/2578758,international,"一名澳洲公民因到烏克蘭參戰抵抗俄羅斯，被俄羅斯控制的烏東地區法院，裁定以僱傭兵身份參與武裝衝突罪成，判監13年，要在高度設防監獄服刑。

33歲的詹金斯，來自墨爾本，是一名教師，去年3月至12月參與對抗俄羅斯的作戰，其後被俄軍俘虜。今年1月曾傳出他被俘虜後遭殺害，觸發澳洲傳召俄羅斯大使，其後證實是虛報。",2025-05-16 21:08,cradio,2025-05-16 21:15,2025-05-16 21:08:00,"一名澳洲公民因到烏克蘭參戰抵抗俄羅斯，被俄羅斯控制的烏東地區法院，裁定以僱傭兵身份參與武裝衝突罪成，判監13年，要在高度設防監獄服刑。

33歲的詹金斯，來自墨爾本，是一名教師，去年3月至12月參與對抗俄羅斯的作戰，其後被俄軍俘虜。今年1月曾傳出他被俘虜後遭殺害，觸發澳洲傳召俄羅斯大使，其後證實是虛報。"
2578757,廣西壯族自治區政府主席藍天立  涉嚴重違紀違法受查,https://www.881903.com/news/china/2578757,china,"廣西壯族自治區黨委副書記、自治區政府主席藍天立，涉嫌嚴重違紀違法，正接受中央紀委國家監委紀律審查和監察調查。藍天立是今年來，中央紀委網站公開通報落馬的第21名中管幹部，亦是繼西藏自治區政府原主席齊扎拉、湖北省委原書記蔣超良及山西省原省長金湘軍後，今年被中央紀委審查調查的第4個正部級官員。

62歲的藍天立，長期在廣西壯族自治區科技廳工作，曾任副廳長、廳長，其後擔任河池市市長、市委書記。2011年升...",2025-05-16 20:35,cradio,2025-05-16 21:00,2025-05-16 20:35:00,"廣西壯族自治區黨委副書記、自治區政府主席藍天立，涉嫌嚴重違紀違法，正接受中央紀委國家監委紀律審查和監察調查。藍天立是今年來，中央紀委網站公開通報落馬的第21名中管幹部，亦是繼西藏自治區政府原主席齊扎拉、湖北省委原書記蔣超良及山西省原省長金湘軍後，今年被中央紀委審查調查的第4個正部級官員。

62歲的藍天立，長期在廣西壯族自治區科技廳工作，曾任副廳長、廳長，其後擔任河池市市長、市委書記。2011年升任廣西壯族自治區人民政府副主席，2018年升任自治區政協主席，2020年年底擔任自治區黨委副書記、政府主席。"
2578756,北京再落冰雹,https://www.881903.com/news/china/2578756,china,"北京傍晚有強對流天氣，再落冰雹，是四日內第二次。市氣象台今早發布雷電橙色、冰雹黃色及大風黃色預警信號。預計由下午3時許至晚上11時，北京市自西向東有雷陣雨天氣，局部地區短時間雨勢較大，並伴有8至10級大風和分散的冰雹，可能造成一定的損失。

當局下令中小學及相關培訓機構停止戶外活動，並進行排查巡查，做好廣告牌加固、高空作業防護，妥善安置易受大風影響的室外物品。星期二晚有汽車玻璃被冰雹擊穿，有車主早...",2025-05-16 20:19,cradio,2025-05-16 20:30,2025-05-16 20:19:00,"北京傍晚有強對流天氣，再落冰雹，是四日內第二次。市氣象台今早發布雷電橙色、冰雹黃色及大風黃色預警信號。預計由下午3時許至晚上11時，北京市自西向東有雷陣雨天氣，局部地區短時間雨勢較大，並伴有8至10級大風和分散的冰雹，可能造成一定的損失。

當局下令中小學及相關培訓機構停止戶外活動，並進行排查巡查，做好廣告牌加固、高空作業防護，妥善安置易受大風影響的室外物品。星期二晚有汽車玻璃被冰雹擊穿，有車主早已用棉被、車冚及紙箱等覆蓋車身，以免遭受損失。"
2578755,英國牛津郡商業園區大火致3死  包括2名消防員,https://www.881903.com/news/international/2578755,international,"英國牛津郡一個商業園區發生大火，3人死亡，包括2名消防員及1名平民，另有2名消防員重傷留醫。事發園區是一個汽車與航空工業中心，有超過50間公司，前身是皇家空軍基地，當地星期四傍晚6時許起火，冒出大量濃煙，火勢目前已受控，暫時未知火警起因。

牛津郡議會表示，市政廳將下半旗，為殉職消防員致哀。首相施紀賢形容是令人震驚的消息，指消防員的英勇令人敬佩，慰問死者家屬，期望留院的傷者早日康復。",2025-05-16 19:58,cradio,2025-05-16 20:15,2025-05-16 19:58:00,"英國牛津郡一個商業園區發生大火，3人死亡，包括2名消防員及1名平民，另有2名消防員重傷留醫。事發園區是一個汽車與航空工業中心，有超過50間公司，前身是皇家空軍基地，當地星期四傍晚6時許起火，冒出大量濃煙，火勢目前已受控，暫時未知火警起因。

牛津郡議會表示，市政廳將下半旗，為殉職消防員致哀。首相施紀賢形容是令人震驚的消息，指消防員的英勇令人敬佩，慰問死者家屬，期望留院的傷者早日康復。"
