id,title,url,section,lead,date,source,scrape_time,last_update,news_content
2590216,大摩：關稅將令美國物價未來數月上升1個百分點,https://www.881903.com/news/finance/2590216,finance,"摩根士丹利預計，美國物價未來數月可能受關稅影響，上漲約1個百分點，隨後通脹會因為需求疲軟而逐漸消退。
大摩指，美國5月進口數據顯示，實際關稅稅率為8.3%，低於摩根士丹利基準預測的10%至15%水平，但預計6月和7月將趨向於預測值。大摩相信，運輸延誤、美墨加協定下從墨西哥和加拿大進口量高於預期，以及從新興市場進口量的大幅下降，是導致實際稅率低於預期的主要原因。
大摩說，6月和7月數據，可能顯示有效...",2025-08-04 11:06,cradio,2025-08-04 11:15,2025-08-04 11:06:00,"摩根士丹利預計，美國物價未來數月可能受關稅影響，上漲約1個百分點，隨後通脹會因為需求疲軟而逐漸消退。

大摩指，美國5月進口數據顯示，實際關稅稅率為8.3%，低於摩根士丹利基準預測的10%至15%水平，但預計6月和7月將趨向於預測值。大摩相信，運輸延誤、美墨加協定下從墨西哥和加拿大進口量高於預期，以及從新興市場進口量的大幅下降，是導致實際稅率低於預期的主要原因。

大摩說，6月和7月數據，可能顯示有效關稅率上升，對美國通脹的傳導效應將更加明顯。歷史上，關稅實施後對消費者價格的實際影響，通常在3至5個月後顯現，而對經濟增長的連鎖反應則在3個月後出現。"
2590214,北京落暴雨　5區發出暴雨紅色預警,https://www.881903.com/news/china/2590214,china,北京再現暴雨，門頭溝區、房山區、豐台區、石景山區及懷柔區，早上均發出暴雨紅色預警信號，預計今日中午起至明早8時，有關地區的6小時累計雨量可能達到150毫米，個別地點雨量更可能達到200毫米，山區及淺山區出現山洪及泥石流等災害的風險極高，低窪地區極易出現積水。 ​​​,2025-08-04 10:52,cradio,2025-08-04 11:00,2025-08-04 10:52:00,北京再現暴雨，門頭溝區、房山區、豐台區、石景山區及懷柔區，早上均發出暴雨紅色預警信號，預計今日中午起至明早8時，有關地區的6小時累計雨量可能達到150毫米，個別地點雨量更可能達到200毫米，山區及淺山區出現山洪及泥石流等災害的風險極高，低窪地區極易出現積水。 ​​​
2590212,穆迪：經濟數據可能預示美國處衰退邊緣,https://www.881903.com/news/finance/2590212,finance,"評級機構穆迪的首席經濟學家贊迪(Mark Zandi)警告，過去一星期公布的各項指標，可能預示美國經濟正處於衰退邊緣。
美國勞工統計局上星期公布的就業數據遠差過預期後，總統特朗普撤換局長。贊迪指出，不僅美國的勞動市場正在走弱，而且消費者支出持平，建築業和製造業則在萎縮。他又認為，在通脹率仍高於2%目標的情況下，聯儲局很難透過貨幣政策，重振經濟的增長。
美國7月經季度調整後，新增非農業就業人數錄得7...",2025-08-04 10:41,cradio,2025-08-04 10:45,2025-08-04 10:41:00,"評級機構穆迪的首席經濟學家贊迪(Mark Zandi)警告，過去一星期公布的各項指標，可能預示美國經濟正處於衰退邊緣。

美國勞工統計局上星期公布的就業數據遠差過預期後，總統特朗普撤換局長。贊迪指出，不僅美國的勞動市場正在走弱，而且消費者支出持平，建築業和製造業則在萎縮。他又認為，在通脹率仍高於2%目標的情況下，聯儲局很難透過貨幣政策，重振經濟的增長。

美國7月經季度調整後，新增非農業就業人數錄得7.3萬，遠低於市場預期的11萬人。勞工統計局又5月的新增非農就業人數，從14.4萬人下調至1.9萬；6月從14.7萬人修正至1.4萬人。5月和6月累計修正減少25.6萬人，觸發華爾街的悲觀預期。摩根大通指出，勞動力需求下滑至此種程度，是經濟衰退的預警信號。

美國自4月開始對多國徵收關稅，但經濟在過去幾個月表現出韌性，但現時又變得黯淡。贊迪表示，當經濟處於拐點，例如轉入衰退，數據往往會進行大幅修改。

贊迪指，美國的失業率仍然很低，但只是因為勞動力增長停滯。外國出生的勞動力數量正在減少，勞動參與率亦都下降。另外，大範圍的招聘凍結，尤其是針對應屆畢業生，以及工作時間的減少，都是就業市場壓力日益加劇的跡象。

同時，雖然美國第二季度GDP的增長數據較預期強，但剔除外貿影響，美國國內需求的指標顯示，美國經濟正在放緩。而個人消費支出報告則顯示，6月核心通脹率加速至2.8%，進一步高於聯儲局2%的目標，同時6月份消費者支出增幅低於預期。

另外，美國6月份建築支出繼續下降，其中單戶住宅建設大幅下滑。供應管理協會7月份製造業活動指數亦都下滑，表明收縮速度加快。

贊迪表示，美國經濟陷入困境的原因不難理解，主要因為美國政府不斷加碼的關稅措施，和高度限制性的移民政策。關稅正日益侵蝕美國企業的利潤和美國家庭的購買力，移民勞動力減少則意味著經濟規模縮小。"
2590211,南韓南部暴雨　逾2500人疏散,https://www.881903.com/news/international/2590211,international,"南韓南部再有新一輪暴雨，昨日起至今日清晨5時，全羅南道務安郡的累計降雨量達到289.6毫米，每小時降雨量高達142.1毫米。釜山、光州、忠清南道、全羅南道、慶尚北道和慶尚南道，超過2500人要緊急疏散避險。慶尚道和忠清北道發出暴雨預警。

務安郡一名60多歲男子昨日被水沖走，被發現時處於心臟驟停狀態，確切死因有待確認，暫時未知是否與暴雨有關。",2025-08-04 10:37,cradio,2025-08-04 10:45,2025-08-04 10:37:00,"南韓南部再有新一輪暴雨，昨日起至今日清晨5時，全羅南道務安郡的累計降雨量達到289.6毫米，每小時降雨量高達142.1毫米。釜山、光州、忠清南道、全羅南道、慶尚北道和慶尚南道，超過2500人要緊急疏散避險。慶尚道和忠清北道發出暴雨預警。

務安郡一名60多歲男子昨日被水沖走，被發現時處於心臟驟停狀態，確切死因有待確認，暫時未知是否與暴雨有關。"
2590210,兩大代理十大屋苑周末成交跌6宗　天氣不穩影響睇樓,https://www.881903.com/news/finance/2590210,finance,"兩大地產代理十大屋苑上周末交投量回落，美聯錄得7宗成交，按周跌3宗；中原錄得7宗，按周亦跌3宗，重返單位數。零成交屋苑有康怡花園、海怡半島、麗港城、新都城、沙田第一城及映灣園。

美聯物業住宅部行政總裁布少明指出，上周末天氣不穩，影響二手睇樓活動，加上個別一手餘貨新盤熱銷搶客，削弱二手市場購買力，導致交投受壓。由於8月份多個新盤部署應市，當中不乏大型屋苑，料將成為市場焦點，雖然預期本月樓市聚焦一手...",2025-08-04 10:31,cradio,2025-08-04 10:45,2025-08-04 10:31:00,"兩大地產代理十大屋苑上周末交投量回落，美聯錄得7宗成交，按周跌3宗；中原錄得7宗，按周亦跌3宗，重返單位數。零成交屋苑有康怡花園、海怡半島、麗港城、新都城、沙田第一城及映灣園。

美聯物業住宅部行政總裁布少明指出，上周末天氣不穩，影響二手睇樓活動，加上個別一手餘貨新盤熱銷搶客，削弱二手市場購買力，導致交投受壓。由於8月份多個新盤部署應市，當中不乏大型屋苑，料將成為市場焦點，雖然預期本月樓市聚焦一手，但隨著市況向好及購買力釋放，二手交投將保持活躍。

中原地產亞太區副主席兼住宅部總裁陳永傑表示，天氣欠佳影響部份二手成交，但近期樓市氣氛持續正面，上周末一手市場未有全新盤開售，主力去貨尾，兩天料錄近百宗成交，一手銷情理想，反映買家入市意欲高企，一手熱賣亦同時刺激二手入市氣氛。預期天氣回穩後，睇樓活動陸續恢復正常，二手成交將會回升。"
2590207,特朗普：中東特使本周訪俄爭取俄烏停火,https://www.881903.com/news/international/2590207,international,"美國總統特朗普表示，美國中東問題特使威特科夫本周將出訪俄羅斯，爭取達成俄烏停火協議，重申如果俄方於周五的限期前都未停火，將實施制裁。特朗普說，預計威特科夫周三或周四訪俄，又指只要莫斯科同意達成一項不會再有人被殺的協議，就可以免於制裁，同時批評俄方狡猾，擅長規避制裁。
特朗普又指，早前下令部署到更靠近俄羅斯區域的兩艘核潛艇已就位，但無透露具體位置。",2025-08-04 10:19,cradio,2025-08-04 10:30,2025-08-04 10:19:00,"美國總統特朗普表示，美國中東問題特使威特科夫本周將出訪俄羅斯，爭取達成俄烏停火協議，重申如果俄方於周五的限期前都未停火，將實施制裁。特朗普說，預計威特科夫周三或周四訪俄，又指只要莫斯科同意達成一項不會再有人被殺的協議，就可以免於制裁，同時批評俄方狡猾，擅長規避制裁。

特朗普又指，早前下令部署到更靠近俄羅斯區域的兩艘核潛艇已就位，但無透露具體位置。"
2590206,國泰西班牙來港航機疑機翼出現問題一度要求機場戒備,https://www.881903.com/news/local/2590206,local,"國泰航空一架由西班牙巴塞羅那飛香港的客機，懷疑機翼出現問題，早上9時許抵港前，一度要求本港機場戒備，客機其後在早上9時46分安全降落，機場之後解除戒備。

涉事航班編號CX318，機上載有近300名乘客及機組人員，消防一度出動消防車戒備。",2025-08-04 10:18,cradio,2025-08-04 10:30,2025-08-04 10:18:00,"國泰航空一架由西班牙巴塞羅那飛香港的客機，懷疑機翼出現問題，早上9時許抵港前，一度要求本港機場戒備，客機其後在早上9時46分安全降落，機場之後解除戒備。

涉事航班編號CX318，機上載有近300名乘客及機組人員，消防一度出動消防車戒備。"
2590204,內地股市初段個別發展,https://www.881903.com/news/finance/2590204,finance,內地股市初段個別發展，上證綜合指數3569點，升9點；深證成分指數10977點，跌13點；兩市成交額4712億元人民幣。創業板指數跌6點。,2025-08-04 10:06,cradio,2025-08-04 10:15,2025-08-04 10:06:00,內地股市初段個別發展，上證綜合指數3569點，升9點；深證成分指數10977點，跌13點；兩市成交額4712億元人民幣。創業板指數跌6點。
2590203,南韓外長：與美日合作　同時與華保持良好關係,https://www.881903.com/news/china/2590203,china,"南韓外長趙顯指，李在明政府主張與美國和日本開展合作，同時致力與中國建立並保持良好的關係。趙顯接受美國《華盛頓郵報》訪問時指，將中國崛起視為挑戰，認為要保持一定警惕，又指中國在經濟方面發展得非常好和快，已經成為競爭者，但認為單方面試圖遏制中國不會奏效，強調南韓意識到與中國接觸的必要。

中國外交部早前指，中韓關係發展的根本動力，源於雙方的共同利益，不針對第三方，也不應受第三方因素影響，中方一貫反對選...",2025-08-04 10:06,cradio,2025-08-04 10:15,2025-08-04 10:06:00,"南韓外長趙顯指，李在明政府主張與美國和日本開展合作，同時致力與中國建立並保持良好的關係。趙顯接受美國《華盛頓郵報》訪問時指，將中國崛起視為挑戰，認為要保持一定警惕，又指中國在經濟方面發展得非常好和快，已經成為競爭者，但認為單方面試圖遏制中國不會奏效，強調南韓意識到與中國接觸的必要。

中國外交部早前指，中韓關係發展的根本動力，源於雙方的共同利益，不針對第三方，也不應受第三方因素影響，中方一貫反對選邊站隊和陣營對抗，願同韓方一道，推動中韓關係健康穩定發展。"
2590202,呷哺呷哺料上半年減虧最多70%,https://www.881903.com/news/finance/2590202,finance,"呷哺呷哺(00520.HK)預期上半年虧損介乎8千萬至1億元人民幣，較去年同期大幅收窄約63.2%至70.5%。收入約19億元人民幣，按年跌約18.9%。
公司表示，上半年虧損大幅減少主要由於集團持續致力成本優化，以數字化供應鏈驅動結構性降本增效，依託集採優勢，打通供應商協同鏈路；持續升級新型物流樞紐及標準化流程，優化配送路徑網絡，實現營運效率提升與綜合成本下降，改善經營效益；及通過優化餐廳佈局結...",2025-08-04 09:55,cradio,2025-08-04 10:00,2025-08-04 09:55:00,"呷哺呷哺(00520.HK)預期上半年虧損介乎8千萬至1億元人民幣，較去年同期大幅收窄約63.2%至70.5%。收入約19億元人民幣，按年跌約18.9%。

公司表示，上半年虧損大幅減少主要由於集團持續致力成本優化，以數字化供應鏈驅動結構性降本增效，依託集採優勢，打通供應商協同鏈路；持續升級新型物流樞紐及標準化流程，優化配送路徑網絡，實現營運效率提升與綜合成本下降，改善經營效益；及通過優化餐廳佈局結構，包括關閉低效餐廳、新增餐廳重點聚焦高潛力區域等舉措綜合提升餐廳營運效率。

公司預計，對關閉及持續虧損餐廳的資產減值損失計提金額，較去年同期大幅下降約64.1%。"
2590201,習近平就研究吸收網民對「十五五」意見作出重要指示,https://www.881903.com/news/china/2590201,china,"國家主席習近平近日就研究吸收網民對「十五五」規劃編制工作意見建議，作出重要指示強調，指相關的徵求意見活動參與度高、覆蓋面廣，是全過程人民民主的一次生動實踐，又指廣大人民群眾積極建言獻策，提出了許多有價值的意見建議，有關部門要認真研究吸納。

　　

人民日報、新華社等官方媒體，早前就「十五五」規劃，展開一個月的網絡徵求意見活動，累計收到超過311萬條網民建言。",2025-08-04 09:54,cradio,2025-08-04 10:00,2025-08-04 09:54:00,"國家主席習近平近日就研究吸收網民對「十五五」規劃編制工作意見建議，作出重要指示強調，指相關的徵求意見活動參與度高、覆蓋面廣，是全過程人民民主的一次生動實踐，又指廣大人民群眾積極建言獻策，提出了許多有價值的意見建議，有關部門要認真研究吸納。

　　

人民日報、新華社等官方媒體，早前就「十五五」規劃，展開一個月的網絡徵求意見活動，累計收到超過311萬條網民建言。"
2590200,華潤醫療盈警料半年少賺25%　股價挫12%,https://www.881903.com/news/finance/2590200,finance,"華潤醫療(01515.HK)發盈警，預料上半年純利按年跌20%至25%；剔除一次性收到燕化IOT協議下，以前年度管理費及供應鏈損失賠償款項約2.1億元人民幣，和對應的企業所得稅後，純利按年跌約55%至60%。
華潤醫療股價早段下挫最多12.9%，報3.86元。
華潤醫療表示，預期利潤下降主要由於醫保次均費用下降導致成員醫療機構經營利潤下降。同時公司逐漸退出IOT(投資-營運-移交模式)業務，令對應...",2025-08-04 09:51,cradio,2025-08-04 10:00,2025-08-04 09:51:00,"華潤醫療(01515.HK)發盈警，預料上半年純利按年跌20%至25%；剔除一次性收到燕化IOT協議下，以前年度管理費及供應鏈損失賠償款項約2.1億元人民幣，和對應的企業所得稅後，純利按年跌約55%至60%。

華潤醫療股價早段下挫最多12.9%，報3.86元。

華潤醫療表示，預期利潤下降主要由於醫保次均費用下降導致成員醫療機構經營利潤下降。同時公司逐漸退出IOT(投資-營運-移交模式)業務，令對應的利潤貢獻下降。公司表示，下半年將繼續積極改善收入結構，推動管理精細化，控制營運成本，提高經營效益。"
2590198,南韓拆除對北韓擴音器,https://www.881903.com/news/international/2590198,international,"南韓國防部表示，爲緩和南北緊張局勢，即日起拆除對北韓進行廣播的擴音器，強調不會影響軍隊戰備形勢。報道指，軍方將拆除約20個擴音器，預計2至3天內完成。
南韓總統李在明6月初上台後，下令停止對北韓的擴音廣播，其後北韓亦停止對南韓的噪音廣播。",2025-08-04 09:38,cradio,2025-08-04 09:45,2025-08-04 09:38:00,"南韓國防部表示，爲緩和南北緊張局勢，即日起拆除對北韓進行廣播的擴音器，強調不會影響軍隊戰備形勢。報道指，軍方將拆除約20個擴音器，預計2至3天內完成。

南韓總統李在明6月初上台後，下令停止對北韓的擴音廣播，其後北韓亦停止對南韓的噪音廣播。"
2590196,楊德強：正最後微調全運會預備工作　會安排免費電視台轉播賽事,https://www.881903.com/news/local/2590196,local,"全運會統籌辦公室主任楊德強表示，正就全運會的預備作最後微調，其中在場地方面，會在落實參賽名單後，做好運動員住宿、交通及接待的準備。他又指，中央電視台將負責拍攝全運會的比賽情況，當局會安排本港免費電視台轉播；當局亦正就票務安排進行測試，會盡快公佈售票詳情；亦將在西九龍高鐵站及機場等4個口岸，為代表團安排特別通道，不會影響一般旅客。

楊德強在電台節目指，已完成本港賽區所有項目的測試賽，國家體育總局以...",2025-08-04 09:30,cradio,2025-08-04 09:45,2025-08-04 09:30:00,"全運會統籌辦公室主任楊德強表示，正就全運會的預備作最後微調，其中在場地方面，會在落實參賽名單後，做好運動員住宿、交通及接待的準備。他又指，中央電視台將負責拍攝全運會的比賽情況，當局會安排本港免費電視台轉播；當局亦正就票務安排進行測試，會盡快公佈售票詳情；亦將在西九龍高鐵站及機場等4個口岸，為代表團安排特別通道，不會影響一般旅客。

楊德強在電台節目指，已完成本港賽區所有項目的測試賽，國家體育總局以及兩地的體育總會都表示滿意，會根據專家意見，為場館作出微調，當局正與旅行社商討推出套票，吸引旅客到不同地方觀賽，亦會設計場館附近的8條旅遊路線，介紹場館資訊及附近景點。"
2590195,港股低開75點,https://www.881903.com/news/finance/2590195,finance,港股低開75點，恒生指數報24431點。,2025-08-04 09:23,cradio,2025-08-04 09:30,2025-08-04 09:23:00,港股低開75點，恒生指數報24431點。
2590194,人民幣兌美元中間價上調101點子,https://www.881903.com/news/finance/2590194,finance,人民幣兌美元中間價報7.1395，上調101點子。離岸人民幣兌美元報7.1903。,2025-08-04 09:22,cradio,2025-08-04 09:30,2025-08-04 09:22:00,人民幣兌美元中間價報7.1395，上調101點子。離岸人民幣兌美元報7.1903。
2590192,渠務署：周六暴雨期間確認5宗嚴重水浸　一至兩小時完成處理,https://www.881903.com/news/local/2590192,local,"天文台在上周六一度發出黑色暴雨警告訊號。渠務署署長莫永昌表示，署方周六共收到120名市民致電求助，即時調動派出緊急應變隊伍處理，其中確認5宗較嚴重的水浸個案，分別位於北大嶼山、屯門、西貢及荃灣等地，個別水浸深度達200至300亳米，署方接報後一至兩小時內已完成處理，受影響道路大致恢復正常運作。
莫永昌在電台節目表示，署方汲取2023年本港出現特大暴雨的經驗，去年起已為雨季作出「超前部署」，包括將可...",2025-08-04 09:03,cradio,2025-08-04 09:15,2025-08-04 09:03:00,"天文台在上周六一度發出黑色暴雨警告訊號。渠務署署長莫永昌表示，署方周六共收到120名市民致電求助，即時調動派出緊急應變隊伍處理，其中確認5宗較嚴重的水浸個案，分別位於北大嶼山、屯門、西貢及荃灣等地，個別水浸深度達200至300亳米，署方接報後一至兩小時內已完成處理，受影響道路大致恢復正常運作。

莫永昌在電台節目表示，署方汲取2023年本港出現特大暴雨的經驗，去年起已為雨季作出「超前部署」，包括將可動員的緊急應變隊伍由160隊增至180隊，並在全港各區部署30多個應急行動基地。

他又表示，署方今年引入4部不同類型的強力排水機械人，加強處理水浸的能力，其中名為「龍吸水」的機械人，排水能力可達每小時800立方米，署方剛購置多兩部「龍吸水」機械人，會視乎情況，再引入其他科技及機械人處理水浸。"
2590188,加拿大財長：加美領袖近日或對話　商討關稅,https://www.881903.com/news/international/2590188,international,"加拿大財長勒布朗預計，總理卡尼未來數日會與美國總統特朗對話， 討論美國計劃對加拿大貨品加徵35%關稅。勒布朗接受美國哥倫比亞廣播公司訪問時指，對美國的決定感到失望，但相信加美兩國在推動兩個強大經濟體合作方面，有很多共通點。他形容與美國官員針對關稅問題的對話具有建設性，但承認仍未解決方案。

勒布朗被問到加拿大撤回對美國關稅的報復措施會否有助談判，他指與美國合作的同時，會確保對加拿大經濟至關重要的行...",2025-08-04 08:36,cradio,2025-08-04 08:45,2025-08-04 08:36:00,"加拿大財長勒布朗預計，總理卡尼未來數日會與美國總統特朗對話， 討論美國計劃對加拿大貨品加徵35%關稅。勒布朗接受美國哥倫比亞廣播公司訪問時指，對美國的決定感到失望，但相信加美兩國在推動兩個強大經濟體合作方面，有很多共通點。他形容與美國官員針對關稅問題的對話具有建設性，但承認仍未解決方案。

勒布朗被問到加拿大撤回對美國關稅的報復措施會否有助談判，他指與美國合作的同時，會確保對加拿大經濟至關重要的行業繼續存在。"
2590187,防護中心：本港輸入基孔肯雅熱個案風險仍高,https://www.881903.com/news/local/2590187,local,"本港至今錄得1宗基孔肯雅熱輸入個案。衛生防護中心傳染病處高級醫生黃凱基表示，個案在潛伏期內都不在香港，屬於輸入個案。他指，基孔肯雅熱潛伏期一般是3至8日，患者會出現發燒、關節痛及出疹等病癥，本港與內地交往頻繁，相信有高風險仍會出現輸入個案，但基孔肯雅熱一般不會由人傳人感染，病毒需要靠蚊子傳播，因此本港要做好控蚊工作。
黃凱基在電台節目表示，現時暫時沒有可信及準確的基孔肯雅熱檢測劑供大眾使用，如市民...",2025-08-04 08:32,cradio,2025-08-04 08:45,2025-08-04 08:32:00,"本港至今錄得1宗基孔肯雅熱輸入個案。衛生防護中心傳染病處高級醫生黃凱基表示，個案在潛伏期內都不在香港，屬於輸入個案。他指，基孔肯雅熱潛伏期一般是3至8日，患者會出現發燒、關節痛及出疹等病癥，本港與內地交往頻繁，相信有高風險仍會出現輸入個案，但基孔肯雅熱一般不會由人傳人感染，病毒需要靠蚊子傳播，因此本港要做好控蚊工作。

黃凱基在電台節目表示，現時暫時沒有可信及準確的基孔肯雅熱檢測劑供大眾使用，如市民在受影響地區回港後出現病徵，應盡快求醫。他又指，相關疫苗在國際間較新，現時沒有國家或地區廣泛使用，本港會留意世衛有關疫苗的報告。"
2590186,海關與內地大型電商平台商討防違禁品流入香港,https://www.881903.com/news/local/2590186,local,"海關關長陳子達表示，正與內地大型電商平台商討採取措施，防止違禁品跨境流入香港。陳子達接受報章專訪時指，已接觸淘寶及拼多多等平台，討論防止違禁品通過電商渠道進入本港，包括把相關的違法商品由香港市場下架，或在線上搜索時作出屏蔽等，希望能達成協議，但承認做法有一定難度，因為部分本港的違禁品，在內地可以合法銷售。

一名13歲男童上月由內地網購煙霧彈，涉嫌非法管有爆炸品被捕。陳子達說，偶然有違禁品流入市面...",2025-08-04 08:04,cradio,2025-08-04 08:15,2025-08-04 08:04:00,"海關關長陳子達表示，正與內地大型電商平台商討採取措施，防止違禁品跨境流入香港。陳子達接受報章專訪時指，已接觸淘寶及拼多多等平台，討論防止違禁品通過電商渠道進入本港，包括把相關的違法商品由香港市場下架，或在線上搜索時作出屏蔽等，希望能達成協議，但承認做法有一定難度，因為部分本港的違禁品，在內地可以合法銷售。

一名13歲男童上月由內地網購煙霧彈，涉嫌非法管有爆炸品被捕。陳子達說，偶然有違禁品流入市面不代表海關的檢查機制有漏洞，對目前的出入口清關系統有信心。"
