id,title,url,section,lead,date,source,scrape_time,last_update,news_content
2578754,黃仁勳抵達台灣訪問  料將公布輝達台灣新總部選址,https://www.881903.com/news/china/2578754,china,"人工智能晶片龍頭「輝達」行政總裁黃仁勳，下午由阿聯酋乘坐私人飛機抵達台北，將出席台北國際電腦展及世大運等活動。有傳他會趁此行公布輝達的台灣新總部選址，黃仁勳表示，達輝成長快速，擁有天份的工程師持續增加，台灣的辦公室已太小，需要找到全新及更大的辦公室，以容納不斷擴增的團隊，但選址未正式宣布，可能等到下周一在台北國際電腦展主題演講時再透露。

黃仁勳又表示，今晚會與台積電董事長魏哲家晚宴，明日與台積電...",2025-05-16 19:37,cradio,2025-05-16 19:45,2025-05-16 19:37:00,"人工智能晶片龍頭「輝達」行政總裁黃仁勳，下午由阿聯酋乘坐私人飛機抵達台北，將出席台北國際電腦展及世大運等活動。有傳他會趁此行公布輝達的台灣新總部選址，黃仁勳表示，達輝成長快速，擁有天份的工程師持續增加，台灣的辦公室已太小，需要找到全新及更大的辦公室，以容納不斷擴增的團隊，但選址未正式宣布，可能等到下周一在台北國際電腦展主題演講時再透露。

黃仁勳又表示，今晚會與台積電董事長魏哲家晚宴，明日與台積電創辦人張忠謀食飯。他又指，台灣仍然會是全球科技生態的中心，指台灣有太多有創新精神的公司，完全相信台灣會持續蓬勃發展。

英國《金融時報》報道，黃仁勳上月訪問上海時，與市長龔正討論輝達在上海興建研發中心的計劃，以應對美國對先進晶片的出口管制，維持產品在中國的競爭力。報道又指輝達正在上海物色新的辦公大樓，準備租賃以擴充員工辦公空間。"
2578753,前港督衛奕信兒子魏磊將任英國駐華大使　8月履新,https://www.881903.com/news/china/2578753,china,"英國外交部委任前港督衛奕信兒子魏磊，為新任駐華大使，今年8月履新。魏磊在社交網站指，對於重回中國、出任駐華大使感到榮幸，未來將推動加強中英兩國合作，維護英國利益。
從事外交工作多年的魏磊，除了英文，亦能夠說流利普通話和法文，同時略懂葡語，曾任英國駐華使館政治參贊，以及英國駐荷蘭及駐巴西大使，2022年擔任時任首相約翰遜的首席私人秘書，到前年出任外交部歐洲事務總幹事。
至於現任大使吳若蘭，英國外交部...",2025-05-16 19:24,cradio,2025-05-16 19:30,2025-05-16 19:24:00,"英國外交部委任前港督衛奕信兒子魏磊，為新任駐華大使，今年8月履新。魏磊在社交網站指，對於重回中國、出任駐華大使感到榮幸，未來將推動加強中英兩國合作，維護英國利益。

從事外交工作多年的魏磊，除了英文，亦能夠說流利普通話和法文，同時略懂葡語，曾任英國駐華使館政治參贊，以及英國駐荷蘭及駐巴西大使，2022年擔任時任首相約翰遜的首席私人秘書，到前年出任外交部歐洲事務總幹事。

至於現任大使吳若蘭，英國外交部指她將調往其他外交部門任職。"
2578752,51歲女子內地注射肉毒桿菌毒素後中毒  情況穩定,https://www.881903.com/news/local/2578752,local,"一名有長期病患的51歲女子，在內地注射肉毒桿菌毒素後，出現肉毒中毒，情況穩定。
衛生防護中心表示，根據女病人提供的資料，她本月8日在內地接受注射，但未能確定注射人員的專業資格。翌日開始出現雙眼下垂、重影和視力模糊，本周二出現吞嚥及呼吸困難、言語不清和四肢乏力，前日到北大嶼山醫院求診，昨日再轉往瑪嘉烈醫院接受治療。臨床診斷懷疑她因注射肉毒桿菌毒素導致中毒。
防護中心已將個案通報內地有關當局，並進行流...",2025-05-16 19:13,cradio,2025-05-16 19:15,2025-05-16 19:13:00,"一名有長期病患的51歲女子，在內地注射肉毒桿菌毒素後，出現肉毒中毒，情況穩定。

衛生防護中心表示，根據女病人提供的資料，她本月8日在內地接受注射，但未能確定注射人員的專業資格。翌日開始出現雙眼下垂、重影和視力模糊，本周二出現吞嚥及呼吸困難、言語不清和四肢乏力，前日到北大嶼山醫院求診，昨日再轉往瑪嘉烈醫院接受治療。臨床診斷懷疑她因注射肉毒桿菌毒素導致中毒。

防護中心已將個案通報內地有關當局，並進行流行病學調查。中心表示，在香港注射肉毒桿菌毒素只應由本地註冊醫生施行，消費者應了解醫生的全名，並查閲香港醫務委員會註冊醫生名單，同時查詢專業資格和相關資歷。在香港以外地區接受注射，必須特別謹慎，確認有關人員合資格或已向註冊執業。一旦有來源不明的針劑，應拒絕接受注射。"
2578749,習近平就烏拉圭前總統穆希卡逝世表示深切哀悼,https://www.881903.com/news/china/2578749,china,"國家主席習近平就烏拉圭前總統穆希卡逝世，向烏拉圭總統奧爾西致唁電，代表中國政府和人民表示深切哀悼，向穆希卡親屬和烏拉圭人民表示誠摯慰問。

習近平指出，穆希卡畢生為烏拉圭人民謀福祉，深受人民愛戴，在國際社會享有較高威望。他生前長期致力於推動中烏關係發展，他的逝世令中國人民失去了一位老朋友、好朋友。習近平表示，高度重視中烏關係發展，願同與總統奧爾西一起努力，繼續推動中烏全面戰略夥伴關係不斷向前發展。...",2025-05-16 19:05,cradio,2025-05-16 19:15,2025-05-16 19:05:00,"國家主席習近平就烏拉圭前總統穆希卡逝世，向烏拉圭總統奧爾西致唁電，代表中國政府和人民表示深切哀悼，向穆希卡親屬和烏拉圭人民表示誠摯慰問。

習近平指出，穆希卡畢生為烏拉圭人民謀福祉，深受人民愛戴，在國際社會享有較高威望。他生前長期致力於推動中烏關係發展，他的逝世令中國人民失去了一位老朋友、好朋友。習近平表示，高度重視中烏關係發展，願同與總統奧爾西一起努力，繼續推動中烏全面戰略夥伴關係不斷向前發展。

穆希卡曾經是游擊隊員，於2010年至2015年擔任烏拉圭總統，因為節儉的生活方式而受到愛戴，並捐出大部份薪金，有「世界最窮總統」之稱。他去年透露患有食道癌，日前逝世，終年89歲。"
2578748,入境處與警方反黑工拘捕16人,https://www.881903.com/news/local/2578748,local,入境處過去四日在全港採取反非法勞工行動，部分聯同警方執行，共搜查超過140個地點，拘捕16人，包括7男9女，由27至61歲，當中10個是懷疑非法勞工、4個是涉嫌聘用黑工的僱主，另外兩人涉嫌逾期居留。,2025-05-16 18:47,cradio,2025-05-16 19:00,2025-05-16 18:47:00,入境處過去四日在全港採取反非法勞工行動，部分聯同警方執行，共搜查超過140個地點，拘捕16人，包括7男9女，由27至61歲，當中10個是懷疑非法勞工、4個是涉嫌聘用黑工的僱主，另外兩人涉嫌逾期居留。
2578745,新增1宗外地傳入登革熱  病人曾到孟加拉,https://www.881903.com/news/local/2578745,local,"衛生防護中心過去七日，錄得1宗外地傳入的登革熱感染個案。病人在潛伏期內曾到孟加拉。

本港今年已錄得21宗外地傳入登革熱個案。",2025-05-16 18:32,cradio,2025-05-16 19:00,2025-05-16 18:32:00,"衛生防護中心過去七日，錄得1宗外地傳入的登革熱感染個案。病人在潛伏期內曾到孟加拉。

本港今年已錄得21宗外地傳入登革熱個案。"
2578743,海關檢獲425萬元懷疑冒牌手機及配件   拘捕9人,https://www.881903.com/news/local/2578743,local,"海關在觀塘及深水埗打擊售賣冒牌物品，檢獲約3300件懷疑冒牌手提電話及配件，估計市值約425萬元，拘捕9人。

海關接獲舉報及調查後，在商標持有人協助下，星期二突擊搜查三間位於觀塘工業區的批發公司，昨日再搜查深水埗三間零售店，檢獲這批手機及電話配件。行動中拘捕7男2女，年齡介乎23至46歲，包括3名董事、1名店主及5名售貨員。被捕人士獲准保釋候查。",2025-05-16 18:29,cradio,2025-05-16 19:00,2025-05-16 18:29:00,"海關在觀塘及深水埗打擊售賣冒牌物品，檢獲約3300件懷疑冒牌手提電話及配件，估計市值約425萬元，拘捕9人。

海關接獲舉報及調查後，在商標持有人協助下，星期二突擊搜查三間位於觀塘工業區的批發公司，昨日再搜查深水埗三間零售店，檢獲這批手機及電話配件。行動中拘捕7男2女，年齡介乎23至46歲，包括3名董事、1名店主及5名售貨員。被捕人士獲准保釋候查。"
2578740,金管局副總裁李達志任期  延長至正常退休年齡後兩年,https://www.881903.com/news/local/2578740,local,"金管局宣布，財政司司長根據外匯基金諮詢委員會轄下管治委員會的建議，批准延長副總裁李達志的任期，至正常退休年齡後兩年，今年10月生效。李達志將繼續負責金管局的儲備管理、金融基建和金融科技發展。

李達志亦是按揭證券公司執行董事。",2025-05-16 18:19,cradio,2025-05-16 18:30,2025-05-16 18:19:00,"金管局宣布，財政司司長根據外匯基金諮詢委員會轄下管治委員會的建議，批准延長副總裁李達志的任期，至正常退休年齡後兩年，今年10月生效。李達志將繼續負責金管局的儲備管理、金融基建和金融科技發展。

李達志亦是按揭證券公司執行董事。"
2578739,美的中通快遞晉身藍籌　科指加入比亞迪,https://www.881903.com/news/finance/2578739,finance,"恒指公司公布季檢結果，美的(00300.HK)及中通快遞(02057.HK)將納入恒生指數，成份股增至85隻。恒生科技指數加入比亞迪(01211.HK)，剔除閱文(00772.HK)，成份股維持30隻。
國企指數沒有變動。
所有變動6月6日收盤後實施，6月9日(星期一)生效。",2025-05-16 18:12,cradio,2025-05-16 18:15,2025-05-16 18:12:00,"恒指公司公布季檢結果，美的(00300.HK)及中通快遞(02057.HK)將納入恒生指數，成份股增至85隻。恒生科技指數加入比亞迪(01211.HK)，剔除閱文(00772.HK)，成份股維持30隻。

國企指數沒有變動。

所有變動6月6日收盤後實施，6月9日(星期一)生效。"
2578738,深水埗75歲長期病患男子感染類鼻疽,https://www.881903.com/news/local/2578738,local,"本港新增一宗類鼻疽個案。患者是一名有長期病患的75歲男子，居於深水埗，本月6日出現發燒和氣促，四日後到明愛醫院求診並入院治療，臨床樣本化驗證實對類鼻疽伯克氏菌呈陽性反應。衛生防護中心正調查個案的感染源頭，及進行流行病學調查。
本港今年來共錄得5宗類鼻疽個案，當中4人居於深水埗。去年有23宗。",2025-05-16 18:12,cradio,2025-05-16 18:15,2025-05-16 18:12:00,"本港新增一宗類鼻疽個案。患者是一名有長期病患的75歲男子，居於深水埗，本月6日出現發燒和氣促，四日後到明愛醫院求診並入院治療，臨床樣本化驗證實對類鼻疽伯克氏菌呈陽性反應。衛生防護中心正調查個案的感染源頭，及進行流行病學調查。

本港今年來共錄得5宗類鼻疽個案，當中4人居於深水埗。去年有23宗。"
2578732,男子上水獨立屋工作期間失足墮泳池昏迷,https://www.881903.com/news/local/2578732,local,一名60多歲男子在上水工作期間，跌落泳池遇溺昏迷。下午近3時，警方接獲金翠路一幢獨立屋的保安員報案，指事主在屋苑內裝設一個遮陰棚時，懷疑失足墮下屋苑泳池，獲救後昏迷，送往北區醫院救治。,2025-05-16 17:44,cradio,2025-05-16 18:00,2025-05-16 17:44:00,一名60多歲男子在上水工作期間，跌落泳池遇溺昏迷。下午近3時，警方接獲金翠路一幢獨立屋的保安員報案，指事主在屋苑內裝設一個遮陰棚時，懷疑失足墮下屋苑泳池，獲救後昏迷，送往北區醫院救治。
2578721,本港首季GDP增長3.1%　維持全年增2%至3%預測,https://www.881903.com/news/finance/2578721,finance,"本港今年首季經濟維持按年增長3.1%，與初值一樣，較上季的2.5%升幅有所加快。經季節性調整後按季比較，實質本地生產總值明顯增長1.9%。全年增長預測維持財政預算案公布的2%至3%。

政府表示，主要是受到貨物出口和服務輸出顯著上升，以及整體投資開支恢復溫和增長所支持，但私人消費開支繼續錄得輕微跌幅。

受到外部需求大致持續，以及預期美國關稅在4月初大幅上升，令部分貨物提前付運所支持，整體貨物出口...",2025-05-16 16:31,cradio,2025-05-16 16:45,2025-05-16 16:31:00,"本港今年首季經濟維持按年增長3.1%，與初值一樣，較上季的2.5%升幅有所加快。經季節性調整後按季比較，實質本地生產總值明顯增長1.9%。全年增長預測維持財政預算案公布的2%至3%。

政府表示，主要是受到貨物出口和服務輸出顯著上升，以及整體投資開支恢復溫和增長所支持，但私人消費開支繼續錄得輕微跌幅。

受到外部需求大致持續，以及預期美國關稅在4月初大幅上升，令部分貨物提前付運所支持，整體貨物出口繼上一季按年實質增加1.3%後，首季增長加快至8.4%，按季比較顯著上升10.2%。

服務輸出繼上一季增長6.5%後，首季繼續明顯擴張6.6%。旅遊和運輸服務輸出繼續擴張，而受惠跨境金融及集資活動顯著增加，金融服務輸出急升。

私人消費開支受到市民消費模式改變的持續影響，按年實質輕微下跌1.1%，上一季微跌0.2%。整體投資開支上一季微跌0.7%後，在第一季重拾溫和增長，上升2.8%。"
2578719,特朗普細女誕下男嬰　特朗普：是時候回家看孫兒,https://www.881903.com/news/international/2578719,international,正在中東訪問的美國總統特朗普，今日將結束行程返回美國。他表示，今次中東之行極好，但現時是時候返家，指他的女兒蒂芙尼誕下了嬰兒，他要回家看孫兒，指女兒及孫兒的情況都十分好。,2025-05-16 16:24,cradio,2025-05-16 16:30,2025-05-16 16:24:00,正在中東訪問的美國總統特朗普，今日將結束行程返回美國。他表示，今次中東之行極好，但現時是時候返家，指他的女兒蒂芙尼誕下了嬰兒，他要回家看孫兒，指女兒及孫兒的情況都十分好。
2578718,中原CCL升0.26%　未破橫行悶局,https://www.881903.com/news/finance/2578718,finance,"反映二手樓價的中原城市領先指數CCL最新報136.7點，按周升0.26%，今年以來累積跌0.68%。
中原地產研究部高級聯席董事楊明儀指出，受外圍利好消息刺激，港股重上22000點，但新盤低價搶客，二手樓市持續處於拉鋸局面，短期樓價走勢反覆受壓。CCL連續7周於136點水平窄幅爭持，未破橫行悶局，仍然尋找支持位。
四區樓價三升一跌，港島按周升0.62%。九龍按周升0.56%。新界西按周升0.17%...",2025-05-16 16:24,cradio,2025-05-16 16:30,2025-05-16 16:24:00,"反映二手樓價的中原城市領先指數CCL最新報136.7點，按周升0.26%，今年以來累積跌0.68%。

中原地產研究部高級聯席董事楊明儀指出，受外圍利好消息刺激，港股重上22000點，但新盤低價搶客，二手樓市持續處於拉鋸局面，短期樓價走勢反覆受壓。CCL連續7周於136點水平窄幅爭持，未破橫行悶局，仍然尋找支持位。

四區樓價三升一跌，港島按周升0.62%。九龍按周升0.56%。新界西按周升0.17%。新界東按周跌1.20%。"
2578717,泰國曼谷審計署新建大樓倒塌  15人接逮捕令後向警方投案,https://www.881903.com/news/international/2578717,international,"泰國刑事法院昨日就曼谷新建的審計署大樓，受3月底緬甸地震波及倒塌的事故，向17人發出逮捕令，涉嫌專業疏忽導致他人死亡，以及違反建築規例。當中15人今日向警方投案，包括意泰發展的總裁，他坐輪椅到警署。他們被帶到法庭進行審前覆核，全部否認控罪。另外2人將於下周一投案。

這宗塌樓事故造成92人死亡，9人受傷，仍有4人下落不明。涉案人士來自三間公司，包括設計公司、建築監督公司，以及意泰發展與中鐵十局的聯...",2025-05-16 16:24,cradio,2025-05-16 16:30,2025-05-16 16:24:00,"泰國刑事法院昨日就曼谷新建的審計署大樓，受3月底緬甸地震波及倒塌的事故，向17人發出逮捕令，涉嫌專業疏忽導致他人死亡，以及違反建築規例。當中15人今日向警方投案，包括意泰發展的總裁，他坐輪椅到警署。他們被帶到法庭進行審前覆核，全部否認控罪。另外2人將於下周一投案。

這宗塌樓事故造成92人死亡，9人受傷，仍有4人下落不明。涉案人士來自三間公司，包括設計公司、建築監督公司，以及意泰發展與中鐵十局的聯營公司。警方指，專家評估發現，建築設計不符合當局規定及技術標準，混凝土與鋼材質量不合格，工程文件亦有偽造的簽名。"
2578716,港股收市跌逾百點　網易飊13%阿里跌4%,https://www.881903.com/news/finance/2578716,finance,"港股收市跌逾百點，恒生指數低開204點，最多跌262點，收市報23345點，跌108點，大市成交價1907億元；國企指數報8468點，跌41點；恒生科技指數5281點，跌16點。

科技股大致向下，阿里巴巴(09988.HK)上季經調整純利增22%，連特息派25美仙，股價跌逾4%，報123.4元；騰訊(00700.HK)跌逾1%，報508元；京東(09618.HK)跌逾2%，報131.8元；美團(...",2025-05-16 16:14,cradio,2025-05-16 16:30,2025-05-16 16:14:00,"港股收市跌逾百點，恒生指數低開204點，最多跌262點，收市報23345點，跌108點，大市成交價1907億元；國企指數報8468點，跌41點；恒生科技指數5281點，跌16點。

科技股大致向下，阿里巴巴(09988.HK)上季經調整純利增22%，連特息派25美仙，股價跌逾4%，報123.4元；騰訊(00700.HK)跌逾1%，報508元；京東(09618.HK)跌逾2%，報131.8元；美團(03690.HK)跌近3%，報131.4元；百度(09888.HK)跌逾1%，報88.5元。嗶哩嗶哩(09626.HK)升近4%，報144.8元。

網易(09999.HK)首季經調整純利按年增32%，派息13.5美仙，股價飊升13%，報190元。

小米(01810.HK)創辦人雷軍講到車禍事故，強調直面問題持續改進，另外本月稍後發布自主研發設計手機晶片「玄戒O1」，股價升逾1%，報51元。

比亞迪(01211.HK)升逾3%再度破頂，報434.2元。蔚來(09866.HK)升逾2%，報32.25元；理想(02015.HK)升近2%報113.2元。

內地餐飲綠茶集團(06831.HK)首日掛牌，收市報6.29元，較招股定價7.19元低逾12%。"
2578715,中方促英國秉持客觀對華認知　樹立正確政策導向,https://www.881903.com/news/china/2578715,china,"英國預計下月初公布對華關係審計報告。在北京，外交部發言人林劍強調，中英都是聯合國安理會常任理事國和世界主要經濟體，在全球挑戰日益增多的形勢下，加強互利合作，符合兩國根本和長遠利益，也有利世界和平與發展。
林劍敦促英方秉持客觀對華認知，樹立正確政策導向，為中英關係健康穩定發展，營造良好氛圍。",2025-05-16 16:13,cradio,2025-05-16 16:15,2025-05-16 16:13:00,"英國預計下月初公布對華關係審計報告。在北京，外交部發言人林劍強調，中英都是聯合國安理會常任理事國和世界主要經濟體，在全球挑戰日益增多的形勢下，加強互利合作，符合兩國根本和長遠利益，也有利世界和平與發展。

林劍敦促英方秉持客觀對華認知，樹立正確政策導向，為中英關係健康穩定發展，營造良好氛圍。"
2578714,商務部召開全國離境退稅工作推進會　促擴入境消費,https://www.881903.com/news/china/2578714,china,"商務部在北京召開全國離境退稅工作推進會，副部長盛秋平出席並講話。
會議指，發展離境退稅是大力提振消費的重要抓手，亦是應對外部衝擊的重要舉措，和擴大高水平對外開放的重要途徑，各地商務主管部門要積極與相關部門，加快推進「擴商店、增商品、優服務」工作，著力提高退稅商店覆蓋面，提升商品吸引力，增強境外旅客獲得感，擴大入境消費，為大力提振消費、推動經濟持續回升向好，積極貢獻。
會議提出要加緊完善工作機制，加...",2025-05-16 16:10,cradio,2025-05-16 16:15,2025-05-16 16:10:00,"商務部在北京召開全國離境退稅工作推進會，副部長盛秋平出席並講話。

會議指，發展離境退稅是大力提振消費的重要抓手，亦是應對外部衝擊的重要舉措，和擴大高水平對外開放的重要途徑，各地商務主管部門要積極與相關部門，加快推進「擴商店、增商品、優服務」工作，著力提高退稅商店覆蓋面，提升商品吸引力，增強境外旅客獲得感，擴大入境消費，為大力提振消費、推動經濟持續回升向好，積極貢獻。

會議提出要加緊完善工作機制，加強部門協同，廣泛凝聚合力，加強數據賦能，創新工作舉措，推動離境退稅政策加快落實落地。"
2578713,俄烏將在土耳其展開談判　據報多輛汽車陸續駛入會場,https://www.881903.com/news/international/2578713,international,"俄羅斯與烏克蘭原定昨日在土耳其展開的談判，推遲至今日舉行。報道指，土耳其、美國和烏克蘭代表，早上先在伊斯坦布爾的總統府舉行三方會談；到中午，俄烏雙方和土耳其代表會再展開三方會談，將是俄烏自2022年3月以來首次直接對話。消息指美國聯同俄烏兩國，還有土耳其的代表，亦計劃召開四方會談。報道指，多輛汽車陸續駛入會場。

克里姆林宮早前公布，俄方代表團由總統助理梅金斯基擔任團長，成員包括副外長加盧津、副防...",2025-05-16 15:59,cradio,2025-05-16 16:15,2025-05-16 15:59:00,"俄羅斯與烏克蘭原定昨日在土耳其展開的談判，推遲至今日舉行。報道指，土耳其、美國和烏克蘭代表，早上先在伊斯坦布爾的總統府舉行三方會談；到中午，俄烏雙方和土耳其代表會再展開三方會談，將是俄烏自2022年3月以來首次直接對話。消息指美國聯同俄烏兩國，還有土耳其的代表，亦計劃召開四方會談。報道指，多輛汽車陸續駛入會場。

克里姆林宮早前公布，俄方代表團由總統助理梅金斯基擔任團長，成員包括副外長加盧津、副防長福明等。烏克蘭代表團就有12人，由防長烏梅洛夫率領，成員包括烏克蘭安全局、總統辦公室、外交部等部門官員。拒絕出席談判的總統澤連斯基，已經轉抵阿爾巴尼亞，出席歐洲政治共同體峰會。至於美國代表，報道指包括美國國務院政策規劃辦公室主任安東。

外交部：中方支持俄烏開啟直接對話

在北京，外交部發言人林劍在例行記者會說，中方在烏克蘭危機問題上，立場一貫、明確，支持一切致力於和平的努力，支持俄烏雙方開啟直接對話，希望有關各方繼續通過對話談判，達成一份公平、持久、有約束力，並是各當事方接受的和平協議，最終實現烏克蘭危機政治解決。"
2578712,中方：尊重伊朗和平利用核能權利,https://www.881903.com/news/china/2578712,china,"中方回應美國總統特朗普指將與伊朗達成新的核協議，外交部發言人林劍表示，中方始終致力於推動伊朗核問題的政治外交解決，重視伊方不發展核武器的承諾，尊重伊朗和平利用核能的權利，反對一切非法單邊制裁。
林劍說，中方願繼續同有關各方保持溝通協調，為推動達成兼顧各方合理關切的解決方案，發揮建設性作用，切實維護國際核不擴散體系，促進中東地區和平與穩定。",2025-05-16 15:53,cradio,2025-05-16 16:00,2025-05-16 15:53:00,"中方回應美國總統特朗普指將與伊朗達成新的核協議，外交部發言人林劍表示，中方始終致力於推動伊朗核問題的政治外交解決，重視伊方不發展核武器的承諾，尊重伊朗和平利用核能的權利，反對一切非法單邊制裁。

林劍說，中方願繼續同有關各方保持溝通協調，為推動達成兼顧各方合理關切的解決方案，發揮建設性作用，切實維護國際核不擴散體系，促進中東地區和平與穩定。"
