id,title,url,section,lead,date,source,scrape_time,last_update,news_content
2591872,南韓最高法院裁定Baby Shark製作公司在侵權案勝訴,https://www.881903.com/news/international/2591872,international,"兒歌《Baby Shark》的南韓製作公司，被美國作曲家入稟指控侵權。南韓最高法院今日頒下判決，裁定南韓製作公司勝訴，結束長達6年的訴訟。

案件追溯至2019年3月，美國作曲家奧利指控南韓製作公司「碰碰狐公司」在2015年推出兒歌《Baby Shark》，抄襲他在2011年發表的同名兒歌，入稟南韓法院索償。一審和二審法院都判原告敗訴，最高法院今日亦駁回原告上訴，表示認同下級法院的觀點，認為《Ba...",2025-08-14 14:23,cradio,2025-08-14 14:30,2025-08-14 14:23:00,"兒歌《Baby Shark》的南韓製作公司，被美國作曲家入稟指控侵權。南韓最高法院今日頒下判決，裁定南韓製作公司勝訴，結束長達6年的訴訟。

案件追溯至2019年3月，美國作曲家奧利指控南韓製作公司「碰碰狐公司」在2015年推出兒歌《Baby Shark》，抄襲他在2011年發表的同名兒歌，入稟南韓法院索償。一審和二審法院都判原告敗訴，最高法院今日亦駁回原告上訴，表示認同下級法院的觀點，認為《Baby Shark》雖然改編自北美童謠，但有關童謠與奧利的作品無關，認為南韓製作方沒有抄襲原告作品。"
2591871,消委會：22款兒童汽車安全椅中　有3款保護力較弱或遜色,https://www.881903.com/news/local/2591871,local,"消委會發表國際消費者研究及試驗組織的最新測試結果，指以5點為滿分，22款在香港發售的兒童汽車安全座椅樣本，全部的安全程度均獲3.5點評分或以上，但使用假人進行模擬撞擊測試時，就有2款樣本的保護能力較弱；另外有1款樣本，假人量得的受力數值較高，反映保護力遜色。

消委會又指，測試發現，有4款樣本的安全步驟較繁複，較大機會安裝錯誤。消委會呼籲相關製造商，改善兒童安全座椅的設計與使用說明，進一步提升撞擊...",2025-08-14 14:00,cradio,2025-08-14 14:15,2025-08-14 14:00:00,"消委會發表國際消費者研究及試驗組織的最新測試結果，指以5點為滿分，22款在香港發售的兒童汽車安全座椅樣本，全部的安全程度均獲3.5點評分或以上，但使用假人進行模擬撞擊測試時，就有2款樣本的保護能力較弱；另外有1款樣本，假人量得的受力數值較高，反映保護力遜色。

消委會又指，測試發現，有4款樣本的安全步驟較繁複，較大機會安裝錯誤。消委會呼籲相關製造商，改善兒童安全座椅的設計與使用說明，進一步提升撞擊防護能力，確保產品使用指引內容清晰易明，讓家長容易理解和正確操作。消委會又提醒家長，安裝兒童汽車安全座椅時，應細閱說明書及相關指示，按正確步驟逐步完成安裝，並確保安全座椅穩固、安全帶扣妥，讓安全座椅發揮守護兒童的功能。"
2591873,消委會測試28款小學生鞋　有2款所含的致癌物超禁,https://www.881903.com/news/local/2591873,local,"新學年即將開始，消委會測試市面上28款小學生鞋樣本，發現有2款樣本含致癌物質「六價鉻」，含量分別是每公斤4.5及5毫克，超出歐盟標準上限。消委會指，雖然兒童一般會穿襪子才穿鞋，但未能完全排除接觸到鞋內「六價鉻」的風險；又指含有「六價鉻」的皮革，可能會導致皮疹、潰瘍，亦可能會致敏，引起接觸性皮膚炎。消委會提醒家長，一旦發現子女腳部持續出皮疹或皮膚炎，應停止穿着懷疑有問題的鞋履，並盡快求醫。

另外，...",2025-08-14 14:00,cradio,2025-08-14 14:30,2025-08-14 14:00:00,"新學年即將開始，消委會測試市面上28款小學生鞋樣本，發現有2款樣本含致癌物質「六價鉻」，含量分別是每公斤4.5及5毫克，超出歐盟標準上限。消委會指，雖然兒童一般會穿襪子才穿鞋，但未能完全排除接觸到鞋內「六價鉻」的風險；又指含有「六價鉻」的皮革，可能會導致皮疹、潰瘍，亦可能會致敏，引起接觸性皮膚炎。消委會提醒家長，一旦發現子女腳部持續出皮疹或皮膚炎，應停止穿着懷疑有問題的鞋履，並盡快求醫。

另外，有4款小學生鞋樣本驗出含有塑化劑，其中1款的內底檢出的含量是8.69%，超出歐盟標準上限近86倍；另外有1款樣本的鞋墊及內部亦驗出塑化劑。消委會指，一般而言，塑化劑不會有效地被皮膚吸收，但如果有傷口或濕疹，則會增加吸收塑化劑的風險，家長應教導子女穿脫鞋子後要清洗雙手，避免因接觸口部或食物，而間接攝入塑化劑。"
2591868,本地男子涉借「高德」帳戶予黑工使用被捕,https://www.881903.com/news/local/2591868,local,警方拘捕一名50多歲的本地男子，涉嫌借出「高德」帳戶予黑工使用，涉嫌「串謀詐騙」，稍後會開記者會交代案情。,2025-08-14 13:47,cradio,2025-08-14 14:00,2025-08-14 13:47:00,警方拘捕一名50多歲的本地男子，涉嫌借出「高德」帳戶予黑工使用，涉嫌「串謀詐騙」，稍後會開記者會交代案情。
2591867,港大指港人青光眼患病率高於預期　應設立系統性篩查機制,https://www.881903.com/news/local/2591867,local,"港大與奧比斯公布為期2年的青光眼人工智能篩查計劃結果，招募5800多名50歲或以上市民，提供免費眼睛檢查。結果顯示，接受檢查的市民，視神經退化患病率為11.6%，其中6.9%是因為青光眼，數字高於預期及中國流行病學估計值，反映應設立系統性篩查及轉介機制。

港大醫學院眼科學系名譽臨床教授李啟煌表示，計劃結果反映，本港有不少青光眼隱性患者需要及早被發現及治療，人工智能技術能更高效及精準找出高危個案，...",2025-08-14 13:46,cradio,2025-08-14 14:00,2025-08-14 13:46:00,"港大與奧比斯公布為期2年的青光眼人工智能篩查計劃結果，招募5800多名50歲或以上市民，提供免費眼睛檢查。結果顯示，接受檢查的市民，視神經退化患病率為11.6%，其中6.9%是因為青光眼，數字高於預期及中國流行病學估計值，反映應設立系統性篩查及轉介機制。

港大醫學院眼科學系名譽臨床教授李啟煌表示，計劃結果反映，本港有不少青光眼隱性患者需要及早被發現及治療，人工智能技術能更高效及精準找出高危個案，亦可應用在公立醫院門診，縮短輪候時間，令公眾能早一步篩查、少一分風險。"
2591866,中方就歷史等問題向日方表達關切　日方要求確保在華日僑安全,https://www.881903.com/news/china/2591866,china,"外交部亞洲司司長劉勁松，昨日約見日本駐華使館首席公使橫地晃，就歷史、台灣和在日中國公民安全等問題，向日方表達嚴重關切。
共同社就引述日本大使館消息指，橫地晃在會上提及7月31日，江蘇省蘇州市發生的日籍母子遇襲受傷事件，再度強烈要求中方確保在華日本僑民安全。",2025-08-14 13:28,cradio,2025-08-14 13:45,2025-08-14 13:28:00,"外交部亞洲司司長劉勁松，昨日約見日本駐華使館首席公使橫地晃，就歷史、台灣和在日中國公民安全等問題，向日方表達嚴重關切。

共同社就引述日本大使館消息指，橫地晃在會上提及7月31日，江蘇省蘇州市發生的日籍母子遇襲受傷事件，再度強烈要求中方確保在華日本僑民安全。"
2591865,南韓外長：將求同存異維護對華關係,https://www.881903.com/news/international/2591865,international,"南韓外長趙顯表示，將求同存異，維護對華關係。趙顯在記者會指，韓中兩國存在根本差異，但需要有效管控差異，開展合作與對話，強調會以實事求是的角度出發，維護好韓中關係。

另外，中國外交部亞洲司司長劉勁松，星期三會見南韓駐華使館臨時代辦金漢圭，就兩國關係中的重要問題交換意見。南韓駐華大使館表示，今次會面是韓中日常接觸的一環。南韓傳媒報道，據了解雙方就韓方向中方派遣特使等事宜，廣泛交換意見。",2025-08-14 13:23,cradio,2025-08-14 13:30,2025-08-14 13:23:00,"南韓外長趙顯表示，將求同存異，維護對華關係。趙顯在記者會指，韓中兩國存在根本差異，但需要有效管控差異，開展合作與對話，強調會以實事求是的角度出發，維護好韓中關係。

另外，中國外交部亞洲司司長劉勁松，星期三會見南韓駐華使館臨時代辦金漢圭，就兩國關係中的重要問題交換意見。南韓駐華大使館表示，今次會面是韓中日常接觸的一環。南韓傳媒報道，據了解雙方就韓方向中方派遣特使等事宜，廣泛交換意見。"
2591863,中國算力規模全球第2 佔6成人工智能專利,https://www.881903.com/news/china/2591863,china,"國家數據局局長劉烈宏在國新辦發布會，介紹十四五期間數字中國建設，指中國數字基礎設施目前在規模、技術等方面，處於世界領先地位，算力總規模位於全球第2。尤其""東數西算""工程深入實施，8大算力樞紐節點，5個在西部地區，有利於發揮西部地區清潔能源優勢，有效促進區域協調發展。
劉烈宏指，過去業界經常以""缺芯少魂""，形容中國在高端芯片、操作系統等方面自主可控不足的問題。經過多年攻堅，這些問題逐步解決，集成電路...",2025-08-14 13:17,cradio,2025-08-14 13:30,2025-08-14 13:17:00,"國家數據局局長劉烈宏在國新辦發布會，介紹十四五期間數字中國建設，指中國數字基礎設施目前在規模、技術等方面，處於世界領先地位，算力總規模位於全球第2。尤其""東數西算""工程深入實施，8大算力樞紐節點，5個在西部地區，有利於發揮西部地區清潔能源優勢，有效促進區域協調發展。

劉烈宏指，過去業界經常以""缺芯少魂""，形容中國在高端芯片、操作系統等方面自主可控不足的問題。經過多年攻堅，這些問題逐步解決，集成電路加快布局，形成覆蓋設計、制造、封裝測試、材料和裝備的完整產業鏈。國產操作系統加速崛起，鴻蒙生態設備總量突破11.9億台，為手機、汽車、家電等1200多類產品，裝上""智能中樞""。人工智能綜合實力亦實現整體性、系統性躍升，專利數量佔全球總量的60%。

他又指，數字基礎設施的超前部署和迭代升級，帶動網絡購物、在線教育、遠程醫療、5G+工業互聯網等新模式、新業態蓬勃發展。農業農村方面，隨著5G網絡和農村電商的發展，手機成為 ”新農具”、數據成為 ”新農資”、直播成為""新農活""，有效帶動農村居民增收致富。

劉烈宏提到，去年推出公共數據資源開發利用等21項政策，今年還將推出數據產權等10多項制度，全國一體化數據市場正在加快構建。人工智能模型訓練推動數據交易需求攀升，截至6月底，各地高質量數據集累計交易額近40億元。上海、天津、安徽等地正在試點數據、語料作價入股等新模式，引導企業將高質量數據集折算為股權。

他又說，去年初，中國日均Token(詞元)的消耗量為1千億，截至今年6月底，日均Token消耗量已經突破30萬億，1年半時間增長300多倍，反映中國人工智能應用規模的快速增長。

國家數據局將通過體系化布局，持續推進高質量數據集建設，加快打造具身智能、低空經濟、生物製造等重點領域的數據高地。"
2591858,內地鋰電池研究取得突破 能量密度及續航升2至3倍,https://www.881903.com/news/china/2591858,china,"新華社報道指，天津大學科研團隊與合作者經過數年攻關，突破現有傳統鋰離子電池在能量密度和應用性能上的瓶頸，研製出能量密度超過每公斤600瓦時的軟包電芯，和每公斤480瓦時的模組電池，性能指標比現有主流鋰離子電池的能量密度和續航能力提高2至3倍。研究成果剛在國際知名學術期刊《自然》發表。
報道引述團隊負責人、天津大學材料學院教授胡文彬指，研究團隊為未來鋰金屬電池的應用，奠定重要基礎，同時兼具優異的循環...",2025-08-14 12:36,cradio,2025-08-14 12:45,2025-08-14 12:36:00,"新華社報道指，天津大學科研團隊與合作者經過數年攻關，突破現有傳統鋰離子電池在能量密度和應用性能上的瓶頸，研製出能量密度超過每公斤600瓦時的軟包電芯，和每公斤480瓦時的模組電池，性能指標比現有主流鋰離子電池的能量密度和續航能力提高2至3倍。研究成果剛在國際知名學術期刊《自然》發表。

報道引述團隊負責人、天津大學材料學院教授胡文彬指，研究團隊為未來鋰金屬電池的應用，奠定重要基礎，同時兼具優異的循環穩定性和安全特性。高能鋰金屬電池的技術突破，將大幅提升儲能系統的能量密度與續航能力，其在電動交通、低空經濟、航天裝備及高端儲能等領域應用廣泛。

報道指，目前團隊正積極推進相關成果的技術轉化和應用驗證，已經建設高能鋰金屬電池中試生產線，成功應用於中國3款微型全電無人飛行器。團隊已經掌握高能鋰金屬電池""材料-電解液-電極-電池""全鏈條核心技術，全部原材料和關鍵技術自主可控，預計今年下半年全面投產運行。"
2591857,入境處各項服務兩小時內恢復,https://www.881903.com/news/local/2591857,local,"入境事務處宣布，因應黑色暴雨警告信號已取消，入境事務處總部及轄下各分區辦事處、人事登記處和生死及婚姻登記處，將於兩小時內恢復服務。　　

因為黑雨警告生效而未能按預約時間，到人事登記辦事處辦理身份證申請的市民，可於今日辦公時間內，或者往後的工作日前往有關辦事處辦理手續，而無須重新預約。服務輪候時間將視乎當日情況可能較長。",2025-08-14 12:34,cradio,2025-08-14 12:45,2025-08-14 12:34:00,"入境事務處宣布，因應黑色暴雨警告信號已取消，入境事務處總部及轄下各分區辦事處、人事登記處和生死及婚姻登記處，將於兩小時內恢復服務。　　

因為黑雨警告生效而未能按預約時間，到人事登記辦事處辦理身份證申請的市民，可於今日辦公時間內，或者往後的工作日前往有關辦事處辦理手續，而無須重新預約。服務輪候時間將視乎當日情況可能較長。"
2591856,神二十乘組近日擇機實施第三次出艙活動,https://www.881903.com/news/china/2591856,china,神舟二十號航天員乘組，將於近日擇機實施第三次出艙活動。神二十乘組自6月26日完成第二次出艙活動以來，迎來天舟九號貨運飛船，並完成天宮太空站站內環境監測、設備檢查維護、物資清點整理和出艙活動準備等工作，空間生命科學與人體研究、微重力基礎物理，和空間新技術與應用等領域實驗任務穩步推進。目前，太空站組合體運行穩定，神二十航天員乘組身心狀態良好，已做好出艙活動各項準備工作。,2025-08-14 12:32,cradio,2025-08-14 12:45,2025-08-14 12:32:00,神舟二十號航天員乘組，將於近日擇機實施第三次出艙活動。神二十乘組自6月26日完成第二次出艙活動以來，迎來天舟九號貨運飛船，並完成天宮太空站站內環境監測、設備檢查維護、物資清點整理和出艙活動準備等工作，空間生命科學與人體研究、微重力基礎物理，和空間新技術與應用等領域實驗任務穩步推進。目前，太空站組合體運行穩定，神二十航天員乘組身心狀態良好，已做好出艙活動各項準備工作。
2591854,標普：內地汽車產能利用率料回歸80%,https://www.881903.com/news/finance/2591854,finance,"標普全球汽車大中華區汽車分析聯合總監陶杲表示，雖然當前內地汽車產能利用率處於相對低的水平，但伴隨未來幾年出口市場持續增長，國內汽車消費復蘇，預計國內的汽車產能利用率會回歸到80%的健康水平。
根據標普測算，內地汽車產能在2017至2018年達到峰值，近2年隨著汽車產業的優勝劣汰，大批造車新勢力已開始退出，總體的產能有明顯下降。",2025-08-14 12:23,cradio,2025-08-14 12:30,2025-08-14 12:23:00,"標普全球汽車大中華區汽車分析聯合總監陶杲表示，雖然當前內地汽車產能利用率處於相對低的水平，但伴隨未來幾年出口市場持續增長，國內汽車消費復蘇，預計國內的汽車產能利用率會回歸到80%的健康水平。

根據標普測算，內地汽車產能在2017至2018年達到峰值，近2年隨著汽車產業的優勝劣汰，大批造車新勢力已開始退出，總體的產能有明顯下降。"
2591850,所有熱帶氣旋警告信號取消,https://www.881903.com/news/local/2591850,local,天文台於下午12時20分，取消所有熱帶氣旋警告信號。,2025-08-14 12:20,cradio,2025-08-14 12:30,2025-08-14 12:20:00,天文台於下午12時20分，取消所有熱帶氣旋警告信號。
2591855,希慎興業中期基本溢利升1.2%　派息27仙,https://www.881903.com/news/finance/2591855,finance,"希慎興業(00014.HK)中期純利7500萬元，按年下跌82.4%，基本溢利10.3億元，按年升1.2%。中期息維持每股27港仙。

上半年營業額17.3億元，按年升2.2%。其中商舖業務營業額按年增加 2.1%，受惠優化的商鋪組合和新一代奢華品牌旗艦店，吸引優質租戶並推動銷售額增長。

寫字樓業務營業額按年上升0.8%。在充滿挑戰的寫字樓市場下，業務維持穩定，出租率由90%上升至 92%，緩解...",2025-08-14 12:19,cradio,2025-08-14 12:30,2025-08-14 12:19:00,"希慎興業(00014.HK)中期純利7500萬元，按年下跌82.4%，基本溢利10.3億元，按年升1.2%。中期息維持每股27港仙。

上半年營業額17.3億元，按年升2.2%。其中商舖業務營業額按年增加 2.1%，受惠優化的商鋪組合和新一代奢華品牌旗艦店，吸引優質租戶並推動銷售額增長。

寫字樓業務營業額按年上升0.8%。在充滿挑戰的寫字樓市場下，業務維持穩定，出租率由90%上升至 92%，緩解租金水平回落的壓力。

希慎表示，營業額增長主要受惠於核心業務板塊的穩健表現，香港商舖業務保持韌性。集團營業額增長來自資產組合優化及銷售表現改善。

寫字樓出租率提升至92%，有助於緩解租金調降的影響。上海利園的強勁擴張以及竹林苑自去年以來出租率的回升，亦為期內整體營業額及溢利增長作出貢獻。期內，平均約4%的商舖樓面面積因利園區的重大優化工程而關閉。"
2591852,吉利汽車中期少賺14%,https://www.881903.com/news/finance/2591852,finance,吉利汽車(00175.HK)中期純利92.9億元人民幣，按年跌13.9%。收入1502.85億元，按年升26.5%。汽車總銷量約140.92萬部，按年增47.4%。維持不派中期息。,2025-08-14 12:19,cradio,2025-08-14 12:30,2025-08-14 12:19:00,吉利汽車(00175.HK)中期純利92.9億元人民幣，按年跌13.9%。收入1502.85億元，按年升26.5%。汽車總銷量約140.92萬部，按年增47.4%。維持不派中期息。
2591851,鴨脷洲發生一宗山泥傾瀉　土力工程處派員視察,https://www.881903.com/news/local/2591851,local,土力工程處指，鴨脷洲發生一宗山泥傾瀉，已派員到現場視察。處方表示，持續暴雨會增加山泥傾瀉風險，由於港島南區在過去數小時的累積雨量特別高，附近的市民應該特別提高警覺，遠離斜坡。,2025-08-14 12:18,cradio,2025-08-14 12:30,2025-08-14 12:18:00,土力工程處指，鴨脷洲發生一宗山泥傾瀉，已派員到現場視察。處方表示，持續暴雨會增加山泥傾瀉風險，由於港島南區在過去數小時的累積雨量特別高，附近的市民應該特別提高警覺，遠離斜坡。
2591848,黃色暴雨警告生效,https://www.881903.com/news/local/2591848,local,天文台在下午12 時10分發出黃色暴雨警告信號。,2025-08-14 12:10,cradio,2025-08-14 12:30,2025-08-14 12:10:00,天文台在下午12 時10分發出黃色暴雨警告信號。
2591847,港股曾創今年新高半日回吐15點　騰訊績後升逾1%,https://www.881903.com/news/finance/2591847,finance,"美國減息預期升溫，推動港股一度創今年新高，恒生指數繼昨日急升逾600點後，今朝高開152點，高見25766點，是今年以來即市新高，中午報25597點，跌15點，半日成交額增至逾1628億。國企指數9166點，升16點；恒生科技指數5605點，跌25點。

科技股普遍向上，騰訊(00700.HK)上季經調整多賺10%，好過市場預期，兼且獲多間大行唱好及提升目標價，股價一度升穿600元大關，中午報59...",2025-08-14 12:01,cradio,2025-08-14 12:30,2025-08-14 12:01:00,"美國減息預期升溫，推動港股一度創今年新高，恒生指數繼昨日急升逾600點後，今朝高開152點，高見25766點，是今年以來即市新高，中午報25597點，跌15點，半日成交額增至逾1628億。國企指數9166點，升16點；恒生科技指數5605點，跌25點。

科技股普遍向上，騰訊(00700.HK)上季經調整多賺10%，好過市場預期，兼且獲多間大行唱好及提升目標價，股價一度升穿600元大關，中午報594元，升8元，升幅1.4%。快手(01024.HK)升0.6元，報75.55元；美團(03690.HK)升0.4元，報124.7元。

阿里巴巴(09988.HK)則跌逾1%，報122.2元；京東(09618.HK)今日公布業績，股價跌逾1%，報125.5元。

聯想(00992.HK)上季純利按年增逾1倍，股價跌逾3%，報11.11元。比亞迪電子(00285.HK)跌逾4%，報39.08元，是半日跌幅最大藍籌。

李寧(02331.HK)升逾4%，報17.72元，是半日升幅最大藍籌。

長江基建(01038.HK)中期多賺1%，股價跌逾1%，報54.2元。

今日多隻股票會公布業績，長和(00001.HK)跌0.1元，報52.1元；長實(01113.HK)跌0.06元，報37.88元；中電信(00728.HK)跌近1%，報6.17元；港鐵(00066.HK)升0.08元，報28.36元。"
2591846,醫管局普通科門診下午2起恢復服務,https://www.881903.com/news/local/2591846,local,"醫管局宣布，轄下專科門診診所、專職醫療及其他日間服務，會於黑色暴雨警告信號取消後的兩小時內陸續恢復服務。而普通科門診診所將於下午2時起恢復服務。
早前已在普通科門診診所、專科門診診所、專職醫療及其他日間服務預約覆診日期的慢性疾病或專科門診病人，如因暴雨影響而未能應診，請依照覆診紙上的指示處理預約安排。至於經電話預約系統或手機應用程式「HA Go」預約普通科門診的病人，請於黑色暴雨警告信號取消一小時...",2025-08-14 11:26,cradio,2025-08-14 11:30,2025-08-14 11:26:00,"醫管局宣布，轄下專科門診診所、專職醫療及其他日間服務，會於黑色暴雨警告信號取消後的兩小時內陸續恢復服務。而普通科門診診所將於下午2時起恢復服務。

早前已在普通科門診診所、專科門診診所、專職醫療及其他日間服務預約覆診日期的慢性疾病或專科門診病人，如因暴雨影響而未能應診，請依照覆診紙上的指示處理預約安排。至於經電話預約系統或手機應用程式「HA Go」預約普通科門診的病人，請於黑色暴雨警告信號取消一小時後，重新預約診症。"
