id,title,url,section,lead,date,source,scrape_time,last_update,news_content
2591950,證監會及金管局關注穩定幣概念市場波動  將採嚴厲行動,https://www.881903.com/news/local/2591950,local,"證監會和金管局就近期出現與穩定幣概念相關的市場波動，發表聯合聲明，指這些波動看似源於擬在香港申請穩定幣發行人牌照、從事相關活動或探討此類計劃可行性等相關的公告、新聞、社交媒體帖文或市場揣測。部分聲稱亦提及近期曾與香港金融監管當局接觸；證監會密切監察交易活動。針對任何可能損害市場廉潔穩健的操縱或欺詐行為，將採取嚴厲行動。

證監會行政總裁梁鳳儀表示，投資者應時刻警惕短期價格波動帶來的誘人回報假象，並...",2025-08-14 20:24,cradio,2025-08-14 21:00,2025-08-14 20:24:00,"證監會和金管局就近期出現與穩定幣概念相關的市場波動，發表聯合聲明，指這些波動看似源於擬在香港申請穩定幣發行人牌照、從事相關活動或探討此類計劃可行性等相關的公告、新聞、社交媒體帖文或市場揣測。部分聲稱亦提及近期曾與香港金融監管當局接觸；證監會密切監察交易活動。針對任何可能損害市場廉潔穩健的操縱或欺詐行為，將採取嚴厲行動。

證監會行政總裁梁鳳儀表示，投資者應時刻警惕短期價格波動帶來的誘人回報假象，並對未經證實的聲稱保持謹慎，尤其是社交媒體上出現的言論。證監會將繼續密切監察市場活動，會毫不猶豫地採取有力的行動。

金管局總裁余偉文表示，金管局審批穩定幣發行人牌照申請，門檻甚高，在初期僅會批出數個牌照。作為正常的市場溝通，金管局已與多家機構就穩定幣牌照進行初步溝通。這些溝通及對牌照的意向表達和申請，並不構成對任何機構的批准，也並非對其獲批牌照前景的任何認可。"
2591949,國務院新增K字簽證  發給外國青年科技人才入境,https://www.881903.com/news/china/2591949,china,國務院修改外國人入境出境管理條例，增加一項「K字簽證，發給入境的外國青年科技人才」。列明申請K字簽證，應當符合中國政府有關主管部門規定的外國青年科技人才的條件和要求，並提交相應的證明材料，由今年10月1日起實施。,2025-08-14 20:21,cradio,2025-08-14 20:30,2025-08-14 20:21:00,國務院修改外國人入境出境管理條例，增加一項「K字簽證，發給入境的外國青年科技人才」。列明申請K字簽證，應當符合中國政府有關主管部門規定的外國青年科技人才的條件和要求，並提交相應的證明材料，由今年10月1日起實施。
2591948,王毅邀泰柬外長茶敘  籲兩國消除誤解重建互信,https://www.881903.com/news/china/2591948,china,"中共中央政治局委員、外長王毅邀請柬埔寨副首相兼外相布拉索昆及泰國外長瑪里，在雲南安寧茶敘，就泰柬邊境衝突進行友好坦誠溝通。

王毅表示，柬泰雙方都不希望邊境衝突持續下去，都有意願恢復對話、改善關係，今次在安寧舉行的瀾湄外長會提供了一個契機。安寧寓意著和平、和諧、和睦，這也是鄰國相處之道。冤家宜解不宜結，希望柬泰雙方在此共同發出“安寧之聲”。中國支持柬泰雙方接觸對話、消除誤解、重建互信，恢復正常交往...",2025-08-14 20:05,cradio,2025-08-14 20:15,2025-08-14 20:05:00,"中共中央政治局委員、外長王毅邀請柬埔寨副首相兼外相布拉索昆及泰國外長瑪里，在雲南安寧茶敘，就泰柬邊境衝突進行友好坦誠溝通。

王毅表示，柬泰雙方都不希望邊境衝突持續下去，都有意願恢復對話、改善關係，今次在安寧舉行的瀾湄外長會提供了一個契機。安寧寓意著和平、和諧、和睦，這也是鄰國相處之道。冤家宜解不宜結，希望柬泰雙方在此共同發出“安寧之聲”。中國支持柬泰雙方接觸對話、消除誤解、重建互信，恢復正常交往合作；支持雙方全面落實柬泰邊界總委員會特別會議共識，鞏固現地停火局面；支持東盟發揮應有作用，以“東盟方式”妥善解決問題；支持雙方回應兩國人民訴求，儘快重開邊境口岸。中方願根據柬泰雙方意願，為兩國邊境地區掃雷等提供支持和幫助。

王毅說，中國有句古話，兄弟鬩於墻，外禦其侮。柬泰是永遠的鄰居和兄弟，相信雙方能夠管控好具體糾紛，攜手應對各種全球性挑戰，這必將受到兩國人民歡迎，也是地區國家的共同期待。

泰柬外長感謝中方為雙方溝通提供機會，高度讚賞中方為緩和局勢、推動對話發揮的建設性作用。雙方都強調，和平可貴，睦鄰為重，重申願積極落實停火協議，用好用足對話機制，以和平方式管控並解決好爭端。三國外長同意以靈活方式繼續保持溝通。"
2591947,羅淑佩觀看《大狀王》　冀更多本地作品走出國際,https://www.881903.com/news/local/2591947,local,"原創粵語音樂劇《大狀王》於西九戲曲中心第三度公演，上演30場，文化體育及旅遊局局長羅淑佩到場觀看演出，她在開幕酒會致辭時表示，有關劇作以廣東人熟悉的人物作為起點，亦加入西方音樂元素，揉合傳統及當代、中西合璧的文化精髓，完美展現香港中外文化匯聚的特色。期望西九文化區創作更多本地作品，並走出世界舞台，說好香港及中國故事。
《大狀王》由西九文化區委約創作，並與香港話劇團製作，西九文化區表示，劇作早前亦於...",2025-08-14 19:52,cradio,2025-08-14 20:00,2025-08-14 19:52:00,"原創粵語音樂劇《大狀王》於西九戲曲中心第三度公演，上演30場，文化體育及旅遊局局長羅淑佩到場觀看演出，她在開幕酒會致辭時表示，有關劇作以廣東人熟悉的人物作為起點，亦加入西方音樂元素，揉合傳統及當代、中西合璧的文化精髓，完美展現香港中外文化匯聚的特色。期望西九文化區創作更多本地作品，並走出世界舞台，說好香港及中國故事。

《大狀王》由西九文化區委約創作，並與香港話劇團製作，西九文化區表示，劇作早前亦於北京及上海巡演，23場演出共吸引逾3.5萬名觀眾，創下香港音樂劇在內地巡演的場次及觀眾人次紀錄，今次《大狀王》在西九戲曲中心重演，為即將開幕、以音樂劇等大型表演藝術節目為重點的西九演藝中心，奠定良好基礎。"
2591944,食安中心籲停用一款法國進口軟芝士　指或受李斯特菌污染,https://www.881903.com/news/local/2591944,local,"食安中心表示，歐盟食品和飼料快速預警系統通報，指一款由法國進口的軟芝士，可能受李斯特菌污染，正在法國進行回收。中心呼籲市民停止食用有關產品；業界如持有受影響產品，應立即停用或停售。
需停用的產品，是200克裝的「St Maure Vieux Porche 45% 200G」，進口商是歐陸食品有限公司，受影響批次編號包括「C5162104」、「C5169106」及「C5175123」，最佳食用日期分...",2025-08-14 19:43,cradio,2025-08-14 19:45,2025-08-14 19:43:00,"食安中心表示，歐盟食品和飼料快速預警系統通報，指一款由法國進口的軟芝士，可能受李斯特菌污染，正在法國進行回收。中心呼籲市民停止食用有關產品；業界如持有受影響產品，應立即停用或停售。

需停用的產品，是200克裝的「St Maure Vieux Porche 45% 200G」，進口商是歐陸食品有限公司，受影響批次編號包括「C5162104」、「C5169106」及「C5175123」，最佳食用日期分別是今年7月31日、8月5日及8月13日或之前。"
2591943,本港人口維持逾752萬   較2022年同期增18萬,https://www.881903.com/news/local/2591943,local,"本港截至今年年中的人口為752萬7500人，按年大致維持不變。由去年年中至今年年中，錄得18200名香港居民淨移入，同期錄得14800人自然減少，出生人數為35200人，死亡人數則為50000人。總人口中，常住居民佔724萬7600人，流動居民約28萬人。

政府發言人表示，香港繼續受惠於各項吸引人才和輸入勞工措施。過去幾年，有不少人士從內地及世界各地移入香港，抵銷人口自然減少的影響，使整體人口保...",2025-08-14 19:26,cradio,2025-08-14 19:30,2025-08-14 19:26:00,"本港截至今年年中的人口為752萬7500人，按年大致維持不變。由去年年中至今年年中，錄得18200名香港居民淨移入，同期錄得14800人自然減少，出生人數為35200人，死亡人數則為50000人。總人口中，常住居民佔724萬7600人，流動居民約28萬人。

政府發言人表示，香港繼續受惠於各項吸引人才和輸入勞工措施。過去幾年，有不少人士從內地及世界各地移入香港，抵銷人口自然減少的影響，使整體人口保持穩定，並較2022年年中人口增加超過18萬人。"
2591940,盧寵茂結束訪問新加坡　冀加強基層醫療等合作,https://www.881903.com/news/local/2591940,local,"醫務衛生局長盧寵茂結束訪問新加坡，他在的最後一日行程到訪新加坡國立癌症中心、製藥企業和綜合診療所。盧寵茂介紹香港發展成為國際醫療創新樞紐的多項重要措施，鼓勵海外藥廠善用「1+」新藥審批機制，及明年開始分階段推行的「第一層審批」新藥註冊機制，將新研發藥物引入香港，以應付本地醫療需要。他亦歡迎海外藥廠來港開展臨床試驗，充分發揮香港所具備的多項獨特優勢。
盧寵茂參觀當地的綜合診療所時，與診所高層人員就兩...",2025-08-14 19:09,cradio,2025-08-14 19:15,2025-08-14 19:09:00,"醫務衛生局長盧寵茂結束訪問新加坡，他在的最後一日行程到訪新加坡國立癌症中心、製藥企業和綜合診療所。盧寵茂介紹香港發展成為國際醫療創新樞紐的多項重要措施，鼓勵海外藥廠善用「1+」新藥審批機制，及明年開始分階段推行的「第一層審批」新藥註冊機制，將新研發藥物引入香港，以應付本地醫療需要。他亦歡迎海外藥廠來港開展臨床試驗，充分發揮香港所具備的多項獨特優勢。

盧寵茂參觀當地的綜合診療所時，與診所高層人員就兩地基層醫療服務作深入交流，指香港正積極推進基層醫療系統重大改革，以應對人口老化及慢性疾病病患率上升帶來的挑戰，期待與新加坡共同探索基層醫療的最佳實踐，以推進亞太區醫療衛生的可持續發展。"
2591937,公屋一般輪候時間上升至5.4年,https://www.881903.com/news/local/2591937,local,"房委會公布，截至今年6月底，公屋一般申請者平均輪候時間輕微上升0.1年至5.4年。長者一人申請者的平均輪候時間較上一季上升0.2年，至3.5年。過去12個月，獲安排入住傳統公屋或「簡約公屋」的一般申請者的公屋綜合輪候時間，由上一季的5.3年下降0.2年至5.1年。
身兼房委會委員的立法會議員梁文廣表示，由於今季獲編配的2900宗個案，都是市區或擴展市區的翻新公屋單位，市區公屋單位需求殷切，輪候時間...",2025-08-14 18:54,cradio,2025-08-14 19:00,2025-08-14 18:54:00,"房委會公布，截至今年6月底，公屋一般申請者平均輪候時間輕微上升0.1年至5.4年。長者一人申請者的平均輪候時間較上一季上升0.2年，至3.5年。過去12個月，獲安排入住傳統公屋或「簡約公屋」的一般申請者的公屋綜合輪候時間，由上一季的5.3年下降0.2年至5.1年。

身兼房委會委員的立法會議員梁文廣表示，由於今季獲編配的2900宗個案，都是市區或擴展市區的翻新公屋單位，市區公屋單位需求殷切，輪候時間上升是屬預期之內。他表示，隨着政府打擊濫用公屋措施見效，加上《房屋條例》修訂將於明年推行，以及綠置居等資助出售房屋陸續落成入伙，令房委會收回更多公屋單位，促進單位流轉，有助穩定平均輪候時間。

梁文廣又指，綜合輪候時間下降，反映簡約公屋政策成效顯著，相信下半年將有更多簡約公屋項目落成入伙，輪候時間有望在2026至27年度回落至4.5年。"
2591935,新增2宗基孔肯雅熱輸入個案   父女潛伏期內到孟加拉,https://www.881903.com/news/local/2591935,local,"本港新增2宗基孔肯雅熱輸入個案，累計輸入病例增至8宗。患者是一對父女，50歲父親及8歲女兒住在將軍澳日出康城名都。二人上月20日至上周日到孟加拉首都達卡，未確定外遊期間有無曾被蚊叮咬。

父親在孟加拉期間發燒，四肢出現關節痛，曾在當地門診求醫，但無需住院，當時的血液樣本對基孔肯雅熱病毒呈陽性反應。他返港前已退燒，但因關節腫脹，周二到私家醫院求診，由於他已對蚊子不具傳染性，無需入院。至於女兒，周二出...",2025-08-14 18:52,cradio,2025-08-14 19:00,2025-08-14 18:52:00,"本港新增2宗基孔肯雅熱輸入個案，累計輸入病例增至8宗。患者是一對父女，50歲父親及8歲女兒住在將軍澳日出康城名都。二人上月20日至上周日到孟加拉首都達卡，未確定外遊期間有無曾被蚊叮咬。

父親在孟加拉期間發燒，四肢出現關節痛，曾在當地門診求醫，但無需住院，當時的血液樣本對基孔肯雅熱病毒呈陽性反應。他返港前已退燒，但因關節腫脹，周二到私家醫院求診，由於他已對蚊子不具傳染性，無需入院。至於女兒，周二出現出現發燒、咳嗽及疲倦，昨日到私家醫院求診，目前在醫院治療，情況穩定。

中心表示，二人血液樣本對基孔肯雅熱病毒呈陽性反應。由於他們潛伏期內在孟加拉逗留，中心認為他們是在外遊期間受到感染，屬輸入個案。3名家居接觸者，包括2名曾同行到孟加拉的家人，都沒有出現病徵，正接受醫學監察。"
2591933,海關在美菲抵港快遞包裹檢活龜及活珊瑚  總值431萬,https://www.881903.com/news/local/2591933,local,海關上月至本月初，截查數批從美國及菲律賓抵港、報稱是衣物、玩具及食物等快遞包裹，檢獲419隻活龜，和1574個活珊瑚，估計市值共約431萬。拘捕5名簽收包裹或協助取件的懷疑涉案人士，全部保釋候查。,2025-08-14 18:43,cradio,2025-08-14 18:45,2025-08-14 18:43:00,海關上月至本月初，截查數批從美國及菲律賓抵港、報稱是衣物、玩具及食物等快遞包裹，檢獲419隻活龜，和1574個活珊瑚，估計市值共約431萬。拘捕5名簽收包裹或協助取件的懷疑涉案人士，全部保釋候查。
2591932,馬鞍山及屯門掃管笏白紋伊蚊誘蚊器指數高於10%,https://www.881903.com/news/local/2591932,local,"食環署公布本月第3批，10個監察地區白紋伊蚊誘蚊器指數，馬鞍山指數最高，達11.3%。

食環署表示，全港25個監察地區中，15個地區的誘蚊器指數比上月下跌或保持不變，蚊患情況有改善或維持低水平。有8區指數輕微上升，但指數低於10%。指數高於10%的沙田馬鞍山及屯門掃管笏，署方正聯同部門及持份者，找出蚊患情況較高的地點，進行密集及具針對性的控蚊工作。",2025-08-14 18:39,cradio,2025-08-14 18:45,2025-08-14 18:39:00,"食環署公布本月第3批，10個監察地區白紋伊蚊誘蚊器指數，馬鞍山指數最高，達11.3%。

食環署表示，全港25個監察地區中，15個地區的誘蚊器指數比上月下跌或保持不變，蚊患情況有改善或維持低水平。有8區指數輕微上升，但指數低於10%。指數高於10%的沙田馬鞍山及屯門掃管笏，署方正聯同部門及持份者，找出蚊患情況較高的地點，進行密集及具針對性的控蚊工作。"
2591931,C朗拿度跟隨球隊艾納斯抵港　備戰沙特超級盃,https://www.881903.com/news/local/2591931,local,"葡萄牙球星C朗拿度，隨同效力的沙特聯賽球隊艾納斯抵港，備戰沙特超級盃。艾納斯在社交平台上載相片，C朗及沙迪奧文尼、祖奧菲歷斯等隊友，抵達下榻的酒店，受到在場球迷熱烈歡迎。

艾納斯是四支來港競逐沙特超級盃的球隊之一，下星期二晚會在香港大球場鬥伊蒂哈德，爭入下周六晚的決賽。",2025-08-14 18:38,cradio,2025-08-14 18:45,2025-08-14 18:38:00,"葡萄牙球星C朗拿度，隨同效力的沙特聯賽球隊艾納斯抵港，備戰沙特超級盃。艾納斯在社交平台上載相片，C朗及沙迪奧文尼、祖奧菲歷斯等隊友，抵達下榻的酒店，受到在場球迷熱烈歡迎。

艾納斯是四支來港競逐沙特超級盃的球隊之一，下星期二晚會在香港大球場鬥伊蒂哈德，爭入下周六晚的決賽。"
2591923,長和黎啟明：出售港口磋商邀內地投資者加入　料可達致成果,https://www.881903.com/news/local/2591923,local,"長和聯席董事總經理黎啟明，在中期業績的分析員會議，回應長和出售港口事宜，表示隨著獨家磋商期在7月27日屆滿，現在已經進入交易的新階段，包括邀請來自內地的主要投資者加入討論。

他強調，這類規模的交易，很多國家和監管機構，包括中國、美國、英國、歐盟和其他國家都有不同的考量，在未獲得所有相關監管機構和部門批准之前 ，是不會進行任何交易。

他又說，深信出售港口的討論有機會達致成果，但這類規模和複雜的交...",2025-08-14 18:20,cradio,2025-08-14 18:30,2025-08-14 18:20:00,"長和聯席董事總經理黎啟明，在中期業績的分析員會議，回應長和出售港口事宜，表示隨著獨家磋商期在7月27日屆滿，現在已經進入交易的新階段，包括邀請來自內地的主要投資者加入討論。

他強調，這類規模的交易，很多國家和監管機構，包括中國、美國、英國、歐盟和其他國家都有不同的考量，在未獲得所有相關監管機構和部門批准之前 ，是不會進行任何交易。

他又說，深信出售港口的討論有機會達致成果，但這類規模和複雜的交易，即使能夠在年內達成具約束力的新協議，但實際交易應該會推到明年。"
2591917,美俄阿拉斯加峰會準備就緒  普京特朗普將單獨會晤及開記招,https://www.881903.com/news/international/2591917,international,"美國總統特朗普明日將與俄羅斯總統普京在阿拉斯加的理查森軍事基地會晤。俄羅斯克里姆林宮表示，會晤將於當地周五早上11時半、即本港周六凌晨3時半開始，兩人將首先舉行單獨會晤，隨後兩國代表團加入，討論圍繞調解烏克蘭危機。會後普京同特朗普將召開聯合記者會。

加入談判的俄羅斯代表團5名成員，包括外長拉夫羅夫、總統助理烏沙科夫、國防部長別洛烏索夫、財長西盧安諾夫，以及俄羅斯直接投資基金總裁德米特里耶夫。

...",2025-08-14 17:45,cradio,2025-08-14 18:00,2025-08-14 17:45:00,"美國總統特朗普明日將與俄羅斯總統普京在阿拉斯加的理查森軍事基地會晤。俄羅斯克里姆林宮表示，會晤將於當地周五早上11時半、即本港周六凌晨3時半開始，兩人將首先舉行單獨會晤，隨後兩國代表團加入，討論圍繞調解烏克蘭危機。會後普京同特朗普將召開聯合記者會。

加入談判的俄羅斯代表團5名成員，包括外長拉夫羅夫、總統助理烏沙科夫、國防部長別洛烏索夫、財長西盧安諾夫，以及俄羅斯直接投資基金總裁德米特里耶夫。

烏沙科夫表示，俄美已就兩國元首會晤達成一致。核心議題是解決烏克蘭危機。"
2591914,澤連斯基轉抵倫敦晤施紀賢,https://www.881903.com/news/international/2591914,international,"烏克蘭總統澤連斯基在德國結束美歐首腦視像會談後，轉到英國倫敦與首相施紀賢會面，繼續尋求在明日的美俄首腦會談中，保障烏方利益。

澤連斯基抵達唐寧街首相府後，與施紀賢擁抱和握手合照。期間多名記者問到，他們會否相信美國總統特朗普能促成公平的俄烏停火協議，但兩人都未有回應。",2025-08-14 17:33,cradio,2025-08-14 17:45,2025-08-14 17:33:00,"烏克蘭總統澤連斯基在德國結束美歐首腦視像會談後，轉到英國倫敦與首相施紀賢會面，繼續尋求在明日的美俄首腦會談中，保障烏方利益。

澤連斯基抵達唐寧街首相府後，與施紀賢擁抱和握手合照。期間多名記者問到，他們會否相信美國總統特朗普能促成公平的俄烏停火協議，但兩人都未有回應。"
2591910,長實中期基本溢利升1.6%　息39仙,https://www.881903.com/news/finance/2591910,finance,"長實(01113.HK)中期純利63.02億元，按年跌26.2%；扣除投資物業重沽的溢利68.05億元，按年升1.6%。中期息維持39仙。

期內已確認的物業銷售收入73.66億元，按年上升58.9%，但銷售收益則減少2.9%至17.68億元。主要因為市況疲弱，促進項目銷售而設立多項折扣優惠，期內收益率因而較低。

物業租務收入30.02億元，按年下跌3.7%。上半年度收益為23.15億元，按年下...",2025-08-14 16:59,cradio,2025-08-14 17:15,2025-08-14 16:59:00,"長實(01113.HK)中期純利63.02億元，按年跌26.2%；扣除投資物業重沽的溢利68.05億元，按年升1.6%。中期息維持39仙。

期內已確認的物業銷售收入73.66億元，按年上升58.9%，但銷售收益則減少2.9%至17.68億元。主要因為市況疲弱，促進項目銷售而設立多項折扣優惠，期內收益率因而較低。

物業租務收入30.02億元，按年下跌3.7%。上半年度收益為23.15億元，按年下跌5.2%。物業租務收入及收益均較去年同期減少，皆因內地上海梅龍鎮廣場及商廈於合營期滿後不再提供租金收入，而香港零售及寫字樓物業租賃持續淡靜。

主席李澤鉅表示，香港上半年實質生產總值按年上升約3%，成功吸引國際資金與優秀人才，憑藉超級聯繫人內聯外通獨特角色，在中央政府堅實支持下，進一步鞏固國際金融、貿易及航運中心之地位。港府推行不同措施，支持房地產市場及刺激投資氣氛，住宅物業市場將繼續受房屋土地政策及利率走向主導。

集團作為跨國企業，核心策略將繼續致力維持穩固及多元化之投資與資產組合。憑藉財務實力及低水平資本負債比率的優勢，以及可持續發展的投資策略，集團適時把握環球市場各類機遇，沉穩應對市場風浪與挑戰，繼續推動業務長遠發展，為股東帶來穩定回報。"
2591909,辛辛那堤網賽丨莎芭倫卡及施維雅迪晉女單8強,https://www.881903.com/news/sports/2591909,sports,"美國辛辛那堤網球公開賽，一姐、白俄羅斯的莎芭倫卡及3號種子、波蘭的施維雅，晉級女單8強。

頭號種子莎芭倫卡對陣西班牙的馬妮羅，首盤先贏6:1，第2盤雙方戰成5:5，莎芭倫卡其後成功破發，連贏兩局，以7:5鎖定勝局；施維雅迪迎戰羅馬尼亞的姬絲蒂亞，就以6:4及6:3兩盤橫掃。",2025-08-14 16:56,cradio,2025-08-14 17:00,2025-08-14 16:56:00,"美國辛辛那堤網球公開賽，一姐、白俄羅斯的莎芭倫卡及3號種子、波蘭的施維雅，晉級女單8強。

頭號種子莎芭倫卡對陣西班牙的馬妮羅，首盤先贏6:1，第2盤雙方戰成5:5，莎芭倫卡其後成功破發，連贏兩局，以7:5鎖定勝局；施維雅迪迎戰羅馬尼亞的姬絲蒂亞，就以6:4及6:3兩盤橫掃。"
