id,title,url,section,lead,date,source,scrape_time,last_update,news_content
2590278,本港新增6宗退伍軍人病個案　全屬散發病例,https://www.881903.com/news/local/2590278,local,"本港上周錄得6宗社區感染的退伍軍人病個案，4男2女患者均有長期病患，年齡54至88歲，分別居於黃大仙、屯門、西貢及東區。

衛生防護中心正展開流行病學調查，初步調查顯示，6宗個案全屬散發病例，與早前確診個案未有流行病學關連。

截至上周六，本港今年錄得96宗退伍軍人病個案。",2025-08-04 16:51,cradio,2025-08-04 17:00,2025-08-04 16:51:00,"本港上周錄得6宗社區感染的退伍軍人病個案，4男2女患者均有長期病患，年齡54至88歲，分別居於黃大仙、屯門、西貢及東區。

衛生防護中心正展開流行病學調查，初步調查顯示，6宗個案全屬散發病例，與早前確診個案未有流行病學關連。

截至上周六，本港今年錄得96宗退伍軍人病個案。"
2590274,455名義務律師獲服務獎　陳國基：法治是香港成功的基石和核心價值,https://www.881903.com/news/local/2590274,local,"政府公布2023至24年度「義務法律服務表揚計劃」的結果，共有455名法律專業人員獲獎，其中125人獲頒個人組特別獎項，即提供不少於50小時義務法律服務；亦有9間律師事務所和大律師辦事處獲得公司組獎項。
政務司司長陳國基感謝獲獎人士和公司，以專業知識服務市民和貢獻社會，又指法治是香港賴以成功的基石和核心價值，在提供法律援助服務外，政府一直致力推動義務法律服務，協助市民在有需要時可透過訴諸法律以尋求...",2025-08-04 16:34,cradio,2025-08-04 16:45,2025-08-04 16:34:00,"政府公布2023至24年度「義務法律服務表揚計劃」的結果，共有455名法律專業人員獲獎，其中125人獲頒個人組特別獎項，即提供不少於50小時義務法律服務；亦有9間律師事務所和大律師辦事處獲得公司組獎項。

政務司司長陳國基感謝獲獎人士和公司，以專業知識服務市民和貢獻社會，又指法治是香港賴以成功的基石和核心價值，在提供法律援助服務外，政府一直致力推動義務法律服務，協助市民在有需要時可透過訴諸法律以尋求公義。發言人指，現時有1500名義務律師參與政府推行的「免費法律諮詢計劃」，在9個民政事務處由義務律師為市民提供法律意見及指導，去年處理近7200宗個案。"
2590272,丘應樺：烏茲別克為中亞經濟引擎　鼓勵更多當地企業來港,https://www.881903.com/news/local/2590272,local,"商務及經濟發展局局長丘應樺出席一個烏茲別克商務論壇上致辭時表示，烏茲別克是中亞地區的經濟引擎，擁有豐富的天然資源和龐大的勞動力市場，更成為了「一帶一路」倡議在中亞地區的關鍵國家，為外資企業提供廣闊的市場空間。

丘應樺表示，香港作為國際金融和貿易中心，在「一國兩制」下擁有獨特優勢，在促進區域合作中扮演重要角色，是烏茲別克企業和投資者不可缺少的門戶，特別是在粵港澳大灣區發展戰略的推動下，香港正迎來新...",2025-08-04 16:32,cradio,2025-08-04 16:45,2025-08-04 16:32:00,"商務及經濟發展局局長丘應樺出席一個烏茲別克商務論壇上致辭時表示，烏茲別克是中亞地區的經濟引擎，擁有豐富的天然資源和龐大的勞動力市場，更成為了「一帶一路」倡議在中亞地區的關鍵國家，為外資企業提供廣闊的市場空間。

丘應樺表示，香港作為國際金融和貿易中心，在「一國兩制」下擁有獨特優勢，在促進區域合作中扮演重要角色，是烏茲別克企業和投資者不可缺少的門戶，特別是在粵港澳大灣區發展戰略的推動下，香港正迎來新的發展機遇，歡迎外資企業「走進來」，實現互利共贏。

丘應樺又邀請烏茲別克出席本港在9月舉辦的第十屆「一帶一路高峰論壇」，鼓勵更多烏茲別克企業來港投資，利用香港的國際優勢開拓內地及全球市場。"
2590271,克魯格曼：關稅武器化將破壞全球對美國制度信任,https://www.881903.com/news/international/2590271,international,"諾貝爾經濟學獎得主克魯格曼(Paul Krugman)在英國《金融時報》播客節目，討論美國在特朗普政府政策下，面臨的信任危機和治理崩潰的風險，批評特朗普政府正將關稅從一個經濟調節工具，變為赤裸裸的""政治威脅手段""，不僅破壞全球對美國制度的信任，也正侵蝕美國國內的治理基礎。
克魯格曼認為，特朗普在任期間對中國、歐盟及其他經濟體不斷揮舞關稅大棒，意在逼迫對方就範，這種""威脅即政策""的做法，已成為一種新...",2025-08-04 16:23,cradio,2025-08-04 16:30,2025-08-04 16:23:00,"諾貝爾經濟學獎得主克魯格曼(Paul Krugman)在英國《金融時報》播客節目，討論美國在特朗普政府政策下，面臨的信任危機和治理崩潰的風險，批評特朗普政府正將關稅從一個經濟調節工具，變為赤裸裸的""政治威脅手段""，不僅破壞全球對美國制度的信任，也正侵蝕美國國內的治理基礎。

克魯格曼認為，特朗普在任期間對中國、歐盟及其他經濟體不斷揮舞關稅大棒，意在逼迫對方就範，這種""威脅即政策""的做法，已成為一種新型經濟外交常態，正在顛覆自「布列頓森林體系」以來，美國所主導的""規則型貿易秩序""，走向一個以""力量至上""為導向的非制度化時代。

克魯格曼舉例，特朗普政府對墨西哥、加拿大和中國等主要貿易夥伴，頻繁更改關稅威脅言辭，嚴重打擊投資者和企業對未來政策環境的預期穩定性。指總統發一條推文，稅率就改變，這不是市場經濟，而是政策投機。

他指，如果關稅繼續被武器化，美國將愈發成為一個""尋租型國家"" (rent-seeking state)，即決策權不再由制度和法治約束，而成為政治集團或個人謀取短期利益的手段。這種做法令他想起一些治理脆弱國家的""強人統治""模式，不單損害美國在全球經濟治理中的正當性，亦動搖避險的地位，強調華府不能一方面要求全球資金繼續信任美元、美債，一方面又在國內政治與國際政策上大搞不確定性。”

克魯格曼警告，這種情緒政治化的關稅政策，雖然短期內可帶來選舉紅利，但長期來看，實際經濟收益微乎其微，甚至可能引發全球供應鏈脫鉤，和美國制造業成本上升。他又認為關稅必然引發連鎖反應，最大受害者往往是本國消費者與小企業。

在節目結尾，主持人請克魯格曼選擇一首歌曲，代表當前情緒或觀點，他選擇了美國已故著名女歌手Carole King 的名曲《為時已晚》(It‘s too late)。克魯格曼表示，雖然這首歌並非關於政治，但它的憂郁旋律和""為時已晚""的主題，恰如其分地表達他自己對美國制度滑坡的無奈與悲觀。"
2590270,李家超明率政府代表團訪問澳門　與澳門特首岑浩輝會面,https://www.881903.com/news/local/2590270,local,"行政長官李家超明天率領政府代表團訪問澳門，將與澳門特區行政長官岑浩輝會面，並到訪當地基建設施。
代表團成員包括財政司司長陳茂波、政制及內地事務局局長曾國衞、醫務衞生局局長盧寵茂教授、運輸及物流局局長陳美寶和行政長官辦公室主任葉文娟，並於下午返港。",2025-08-04 16:22,cradio,2025-08-04 16:30,2025-08-04 16:22:00,"行政長官李家超明天率領政府代表團訪問澳門，將與澳門特區行政長官岑浩輝會面，並到訪當地基建設施。

代表團成員包括財政司司長陳茂波、政制及內地事務局局長曾國衞、醫務衞生局局長盧寵茂教授、運輸及物流局局長陳美寶和行政長官辦公室主任葉文娟，並於下午返港。"
2590267,港股收市升225點　英諾賽科飊3成晶片股造好,https://www.881903.com/news/finance/2590267,finance,"港股先跌後升，恒生指數低開75點，最多跌過百點，之後轉升，收市報24733點，升225點，大市成交2347億元，北水淨流出近181億；國企指數8893點，升89點；恒生科技指數5481點，升83點。

內地半導體股英諾賽科(02577.HK)確認與輝達在電源架構上合作，推動AI數據中心規模化落地。股價急升3成，報75.15元，升17.55元。

其他半導體股亦造好，有報道指，美國出口許可延遲批出，...",2025-08-04 16:12,cradio,2025-08-04 16:30,2025-08-04 16:12:00,"港股先跌後升，恒生指數低開75點，最多跌過百點，之後轉升，收市報24733點，升225點，大市成交2347億元，北水淨流出近181億；國企指數8893點，升89點；恒生科技指數5481點，升83點。

內地半導體股英諾賽科(02577.HK)確認與輝達在電源架構上合作，推動AI數據中心規模化落地。股價急升3成，報75.15元，升17.55元。

其他半導體股亦造好，有報道指，美國出口許可延遲批出，拖慢輝達對中國發售H20晶片。中芯(00981.HK)升近3%，報51.5元，升1.45元；華虹半導體(01347.HK)升逾8%，報42.88元；ASMPT(00522.HK)升逾3%，報67.55元。

科技股大致向上，騰訊(00700.HK)升近3%，報550元，升15元；快手(01024.HK)升逾3%，報77元，升2.4元；嗶哩嗶哩(09626.HK)升逾1%，報176.7元；阿里巴巴(09988.HK)則跌0.7元，報116.2元。

聯想(00992.HK)升近5%，報10.6元；小米(01810.HK)升2%，報54.55元。

金價重上3300美元水平，黃金相關股造好，招金(01818.HK)升近8%，報20.98元；

紫金(02899.HK)升逾2%，報21.66元；山東黃金(01787.HK)升逾1成，報26.9元；老鋪黃金(06181.HK)升6%，報733元；周大福(01928.HK)升逾2%，報13.53元。

中電(00002.HK)中期純利56.24億元，按年跌5.5%，派第二次中期息63仙，股價0.1元，報67.5元。

內銀股向好，農行(01288.HK)升近3%，報5.26元；工行(01398.HK)升逾1%，報6.06元；招行(03968.HK)升逾1%，報51元。

新東方(09901.HK)升6%，報36.58元，是全日升幅最大藍籌。信義玻璃(00868.HK)跌近4%，報7.82元，是全日跌幅最大藍籌。

華潤醫療(01515.HK)發盈利預警，料上半年少賺25%，股價跌15%，報3.74元。"
2590266,淨康集團不合理拒聘本地求職者　被停補充勞工優化計劃申請一年,https://www.881903.com/news/local/2590266,local,"有份參加「補充勞工優化計劃」的滅蟲公司淨康集團，因無合理理由拒絕聘用合資格的本地求職者，被暫停申請資格一年。勞工處表示，淨康進行四星期本地招聘時，違反規定，故對公司實施行政制裁，由上月31日起，已拒絕處理公司提交的輸入勞工申請，同時中止處理已提交的申請。

勞工處指，優化計劃訂明，僱主如違反勞工或入境法例、優化計劃或標準僱傭合約的規定，勞工處會作出行政制裁，提醒僱主嚴格遵守相關規定，包括優先聘用合...",2025-08-04 16:01,cradio,2025-08-04 16:15,2025-08-04 16:01:00,"有份參加「補充勞工優化計劃」的滅蟲公司淨康集團，因無合理理由拒絕聘用合資格的本地求職者，被暫停申請資格一年。勞工處表示，淨康進行四星期本地招聘時，違反規定，故對公司實施行政制裁，由上月31日起，已拒絕處理公司提交的輸入勞工申請，同時中止處理已提交的申請。

勞工處指，優化計劃訂明，僱主如違反勞工或入境法例、優化計劃或標準僱傭合約的規定，勞工處會作出行政制裁，提醒僱主嚴格遵守相關規定，包括優先聘用合適本地勞工。"
2590265,內地投資者上星期購港股ETF金額創紀錄,https://www.881903.com/news/finance/2590265,finance,"彭博報道指，內地投資者利用近期港股回落的機會，增加對香港市場的投資，買入追蹤港股的交易所買賣基金(ETF)的金額，創紀錄新高。
根據彭博編製的數據，投資香港股票的在岸上市ETF，上星期淨購買量激增至前所未有的270億元人民幣(38億美元)，涉及約80個產品。
恆生科技指數上星期下跌近5%，是美國總統特朗普4月初宣布""對等關稅""以來，最大的一星期跌幅，但就反而刺添內地投資者購買港股ETF的熱潮。上星...",2025-08-04 15:45,cradio,2025-08-04 16:00,2025-08-04 15:45:00,"彭博報道指，內地投資者利用近期港股回落的機會，增加對香港市場的投資，買入追蹤港股的交易所買賣基金(ETF)的金額，創紀錄新高。

根據彭博編製的數據，投資香港股票的在岸上市ETF，上星期淨購買量激增至前所未有的270億元人民幣(38億美元)，涉及約80個產品。

恆生科技指數上星期下跌近5%，是美國總統特朗普4月初宣布""對等關稅""以來，最大的一星期跌幅，但就反而刺添內地投資者購買港股ETF的熱潮。上星期港股ETF流入量，比4月中旬大跌期間高出約 25%。"
2590264,日方要求中方嚴厲處罰江蘇日籍母子遇襲案犯人,https://www.881903.com/news/china/2590264,china,"江蘇蘇州日前有一對日籍母子遇襲，母親受傷。日本官房長官林芳正表示，中方上星期五通報，稱將依法採取相應處罰。日方將繼續強烈要求中方嚴厲處罰疑犯，防止類似案件再發生，確保日僑的安全。
案發在上星期四傍晚，涉事母子當時在地鐵站內行走，期間母親被人用類似石頭的東西砸傷，沒有生命危險，男童無恙。疑犯犯案後逃離現場，其後被拘留，當局未有公布疑犯的國籍及性別。",2025-08-04 15:40,cradio,2025-08-04 15:45,2025-08-04 15:40:00,"江蘇蘇州日前有一對日籍母子遇襲，母親受傷。日本官房長官林芳正表示，中方上星期五通報，稱將依法採取相應處罰。日方將繼續強烈要求中方嚴厲處罰疑犯，防止類似案件再發生，確保日僑的安全。

案發在上星期四傍晚，涉事母子當時在地鐵站內行走，期間母親被人用類似石頭的東西砸傷，沒有生命危險，男童無恙。疑犯犯案後逃離現場，其後被拘留，當局未有公布疑犯的國籍及性別。"
2590263,新蒲崗工廈外牆石屎剝落擊傷女子　一名男子被捕,https://www.881903.com/news/local/2590263,local,"新蒲崗有工廈外牆石屎剝落，一名女子被擊中頭部受傷。警方拘捕一名男子，暫列作高空墮物。
下午近2時，女傷者經過大有街一幢工業大廈時，被一塊約拳頭大的石屎碎片擊中後腦受傷，救護員到場，將傷者送往伊利沙伯醫院治理。",2025-08-04 15:39,cradio,2025-08-04 15:45,2025-08-04 15:39:00,"新蒲崗有工廈外牆石屎剝落，一名女子被擊中頭部受傷。警方拘捕一名男子，暫列作高空墮物。

下午近2時，女傷者經過大有街一幢工業大廈時，被一塊約拳頭大的石屎碎片擊中後腦受傷，救護員到場，將傷者送往伊利沙伯醫院治理。"
2590262,北京市檢察院第一分院原檢察長項明  貪污受賄判死緩,https://www.881903.com/news/china/2590262,china,"北京市人民檢察院第一分院原檢察長項明，貪污受賄，在北京市第二中級人民法院公開宣判，判處死刑，緩期二年執行，剝奪政治權利終身，沒收個人全部財產，在死緩期滿減爲無期徒刑後，終身監禁，不得減刑、假釋，同時處以罰款人民幣200萬元。

73歲的項明，曾任北京市檢察院副檢察長，第一檢察分院檢察長，黨組書記，2012年退休，在2022年被查。

項明任職期間曾推動司法改革，並出版內部書籍《逐日》，標榜「追求法...",2025-08-04 15:32,cradio,2025-08-04 15:45,2025-08-04 15:32:00,"北京市人民檢察院第一分院原檢察長項明，貪污受賄，在北京市第二中級人民法院公開宣判，判處死刑，緩期二年執行，剝奪政治權利終身，沒收個人全部財產，在死緩期滿減爲無期徒刑後，終身監禁，不得減刑、假釋，同時處以罰款人民幣200萬元。

73歲的項明，曾任北京市檢察院副檢察長，第一檢察分院檢察長，黨組書記，2012年退休，在2022年被查。

項明任職期間曾推動司法改革，並出版內部書籍《逐日》，標榜「追求法治理想」，最終因貪腐落馬。"
2590261,內地股市全日先跌後升,https://www.881903.com/news/finance/2590261,finance,內地股市先跌後升，上證綜合指數以全日最高位收市，報3583點，升23點；深證成分指數亦以全日最高位收市，報11041點，升50點。兩市成交額14985億元人民幣。創業板指數升0.5%。,2025-08-04 15:28,cradio,2025-08-04 15:45,2025-08-04 15:28:00,內地股市先跌後升，上證綜合指數以全日最高位收市，報3583點，升23點；深證成分指數亦以全日最高位收市，報11041點，升50點。兩市成交額14985億元人民幣。創業板指數升0.5%。
2590258,台灣中南部暴雨增至4死3人失蹤　多處交通中斷,https://www.881903.com/news/china/2590258,china,台灣中南部連日暴雨，增至4死、3人失蹤，另有74人受傷。當地受西南氣流持續影響，昨日有超過100個觀測站，錄得單日雨量超過200毫米。高雄茂林多納林道，過去7日的累計降雨量達2759毫米，超過台灣每年2500毫米的平均降雨量。暴雨導致140條道路及隧道交通中斷，嘉義縣阿里山公路多處坍方落石，屏東有大規模崩塌，台東太麻里鄉溪水暴漲沖毀土堤，台鐵雲林林內站雙向路軌被溪水淹沒。另有最少303戶斷電，當局...,2025-08-04 14:47,cradio,2025-08-04 15:00,2025-08-04 14:47:00,"台灣中南部連日暴雨，增至4死、3人失蹤，另有74人受傷。當地受西南氣流持續影響，昨日有超過100個觀測站，錄得單日雨量超過200毫米。高雄茂林多納林道，過去7日的累計降雨量達2759毫米，超過台灣每年2500毫米的平均降雨量。暴雨導致140條道路及隧道交通中斷，嘉義縣阿里山公路多處坍方落石，屏東有大規模崩塌，台東太麻里鄉溪水暴漲沖毀土堤，台鐵雲林林內站雙向路軌被溪水淹沒。另有最少303戶斷電，當局至今緊急疏散近5800人。

氣象部門預測，中南部今日仍不排除有大暴雨。高雄市、台南市、嘉義縣、南投縣及屏東縣等多地，今日停班停課。"
2590257,柬泰邊境聯合委員會特別會議籌備工作在大馬展開,https://www.881903.com/news/international/2590257,international,"柬埔寨與泰國邊境聯合委員會特別會議將於星期四舉行，負責籌備的秘書處會議今早率先在馬來西亞吉隆坡召開，由馬來西亞武裝部隊主持，柬泰兩國高級軍官代表出席會議。秘書處會議將持續至星期三，旨在敲定特別會議的框架，並就議程內容及相關安排達成共識。

柬埔寨與泰國上月交火多日，柬埔寨首相洪瑪奈及泰國代總理普坦其後在馬來西亞會談，宣布將無條件停火，並召開邊境聯合委員會特別會議，推動兩國邊境恢復和平穩定。",2025-08-04 14:28,cradio,2025-08-04 14:45,2025-08-04 14:28:00,"柬埔寨與泰國邊境聯合委員會特別會議將於星期四舉行，負責籌備的秘書處會議今早率先在馬來西亞吉隆坡召開，由馬來西亞武裝部隊主持，柬泰兩國高級軍官代表出席會議。秘書處會議將持續至星期三，旨在敲定特別會議的框架，並就議程內容及相關安排達成共識。

柬埔寨與泰國上月交火多日，柬埔寨首相洪瑪奈及泰國代總理普坦其後在馬來西亞會談，宣布將無條件停火，並召開邊境聯合委員會特別會議，推動兩國邊境恢復和平穩定。"
2590247,菲律賓印度南海聯合巡航　指中方尾隨跟蹤,https://www.881903.com/news/china/2590247,china,"菲律賓與印度在南海舉行聯合海上巡航。菲律賓武裝部隊總參謀長布勞納表示，周日開始、為期兩天的菲印聯合巡航取得成功，希望兩軍未來加強合作，進行更多聯合演習。他又指，中方在巡航期間有派員尾隨跟蹤，是預料之內，演習過程中沒有發生意外。
菲律賓總統小馬可斯周一起，國事訪問印度5日，將與印度總理莫迪會晤，討論加強兩國在國防、貿易投資、農業以及醫藥等領域的合作。
在北京，國防部發言人上周批評，菲方迎合域外勢力在...",2025-08-04 14:00,cradio,2025-08-04 14:15,2025-08-04 14:00:00,"菲律賓與印度在南海舉行聯合海上巡航。菲律賓武裝部隊總參謀長布勞納表示，周日開始、為期兩天的菲印聯合巡航取得成功，希望兩軍未來加強合作，進行更多聯合演習。他又指，中方在巡航期間有派員尾隨跟蹤，是預料之內，演習過程中沒有發生意外。

菲律賓總統小馬可斯周一起，國事訪問印度5日，將與印度總理莫迪會晤，討論加強兩國在國防、貿易投資、農業以及醫藥等領域的合作。

在北京，國防部發言人上周批評，菲方迎合域外勢力在南海攪局作亂，是不折不扣的麻煩及危險製造者，強調中方維護國家領土主權和海洋權益的決心意志堅定不移，將繼續依法依規堅決反制菲方侵權挑釁行徑。"
2590246,俄羅斯列寧格勒巴士撞火車　至少2死10傷,https://www.881903.com/news/international/2590246,international,俄羅斯列寧格勒州一輛巴士與貨運列車相撞，至少2死10傷。鐵路管理公司指，事發時巴士駛入鐵路路口，列車正駛近，列車司機緊急煞車，但因距離太短，未能避免相撞。 鐵路當局指，涉事的是普通巴士，地方檢察官就指是旅遊巴。,2025-08-04 13:55,cradio,2025-08-04 14:00,2025-08-04 13:55:00,俄羅斯列寧格勒州一輛巴士與貨運列車相撞，至少2死10傷。鐵路管理公司指，事發時巴士駛入鐵路路口，列車正駛近，列車司機緊急煞車，但因距離太短，未能避免相撞。 鐵路當局指，涉事的是普通巴士，地方檢察官就指是旅遊巴。
2590245,中國自研eVTOL成功運送物資到海上石油平台,https://www.881903.com/news/finance/2590245,finance,"中國自主研發的2噸級大型電動垂直起降航空器(eVTOL)""凱瑞鷗""，昨日裝載新鮮水果和緊急藥品等物資，成功實現全球首次海上石油平台物資運輸飛行，標誌在海陸低空物流場景應用中，邁出關鍵一步。
今次飛行的2噸級eVTOL""凱瑞鷗""採用複合翼構造，適用航程200公里，最高速度每小時200公里，載重能力達400公斤。報道引述業內人士表示，率先商業化的小型無人機，正在末端配送場景中加速滲透，而中大型無人機正...",2025-08-04 13:49,cradio,2025-08-04 14:00,2025-08-04 13:49:00,"中國自主研發的2噸級大型電動垂直起降航空器(eVTOL)""凱瑞鷗""，昨日裝載新鮮水果和緊急藥品等物資，成功實現全球首次海上石油平台物資運輸飛行，標誌在海陸低空物流場景應用中，邁出關鍵一步。

今次飛行的2噸級eVTOL""凱瑞鷗""採用複合翼構造，適用航程200公里，最高速度每小時200公里，載重能力達400公斤。報道引述業內人士表示，率先商業化的小型無人機，正在末端配送場景中加速滲透，而中大型無人機正經歷從技術驗證，到規模應用的關鍵期。未來5年，中國低空物流市場規模有望突破千億元。

內地傳媒統計，今年以來eVTOL概念股股價平均上漲近18%，美力科技漲幅最高，年內累計上漲127.4%。永悅科技、山河智能、瑞可達、縱橫股份、華依科技的股價都上漲超過60%。"
2590243,遼寧艦及山東艦航母到西太進行遠洋訓練　戰鬥機升空查證來襲無人機,https://www.881903.com/news/china/2590243,china,解放軍公開海軍遼寧艦及山東艦航母編隊，到西太平洋開展遠海遠洋訓練的片段。片段見到，在訓練中，面對不明高空無人機來襲，4架戰鬥機及時起飛，對高空的無人機進行查證，包括進行全程的雷達截獲，而無人機的位置一直在導彈的容許發射範圍之內。,2025-08-04 13:42,cradio,2025-08-04 13:45,2025-08-04 13:42:00,解放軍公開海軍遼寧艦及山東艦航母編隊，到西太平洋開展遠海遠洋訓練的片段。片段見到，在訓練中，面對不明高空無人機來襲，4架戰鬥機及時起飛，對高空的無人機進行查證，包括進行全程的雷達截獲，而無人機的位置一直在導彈的容許發射範圍之內。
