id,title,url,section,lead,date,source,scrape_time,last_update,news_content
2592012,京東完成收購佳寶　加速拓展香港零售市場,https://www.881903.com/news/local/2592012,local,"京東集團(09618.HK)宣布，正式完成收購香港佳寶食品超級市場，將依托京東供應鏈優勢，推動佳寶完善全渠道業務拓展，進一步豐富香港零售消費市場的優質商品供應，促進京東在粵港澳大灣區的生鮮供應鏈布局，加速拓展香港本地零售市場。佳寶創始人林曉毅掌管新設立的創新零售-佳寶業務部。

佳寶創始人林曉毅掌業務部

京東表示，京東所有業務都圍繞供應鏈開展，今次收購佳寶正是京東強化供應鏈戰略的關鍵落子，意味著...",2025-08-15 10:35,cradio,2025-08-15 10:45,2025-08-15 10:35:00,"京東集團(09618.HK)宣布，正式完成收購香港佳寶食品超級市場，將依托京東供應鏈優勢，推動佳寶完善全渠道業務拓展，進一步豐富香港零售消費市場的優質商品供應，促進京東在粵港澳大灣區的生鮮供應鏈布局，加速拓展香港本地零售市場。佳寶創始人林曉毅掌管新設立的創新零售-佳寶業務部。

佳寶創始人林曉毅掌業務部

京東表示，京東所有業務都圍繞供應鏈開展，今次收購佳寶正是京東強化供應鏈戰略的關鍵落子，意味著京東正式進軍香港實體零售領域，通過全面整合佳寶線下門店網絡，進一步提升香港零售市場的商品豐富度和價格競爭力。京東對佳寶的管理團隊和未來合作充滿信心。

收購完成後，京東佳寶超市明日起舉行為期三天的全場8折大促活動，將涵蓋首批數十款京東供應鏈商品，未來京東供應鏈商品將持續登陸香港。"
2592011,職訓局中華廚藝學院爆手足口病　薄扶林大樓停課至周日,https://www.881903.com/news/local/2592011,local,"職訓局薄扶林大樓的中華廚藝學院，爆發手足口病個案，最少9人受感染。

衛生署回覆本台查詢時確認，衛生防護中心周二錄得爆發，初步調查顯示，個案涉及6名學生及3名員工。包括8男1女，上周三起先後出現口腔潰瘍、手或腳出紅疹或水疱，及發燒等病徵，全部已經求醫。其中兩人曾入院，當中一人已出院，其餘患者病況輕微，情況穩定。

防護中心已派員實地視察中華廚藝學院，建議所需的感染控制和預防措施，並已為受影響人士安...",2025-08-15 10:34,cradio,2025-08-15 10:45,2025-08-15 10:34:00,"職訓局薄扶林大樓的中華廚藝學院，爆發手足口病個案，最少9人受感染。

衛生署回覆本台查詢時確認，衛生防護中心周二錄得爆發，初步調查顯示，個案涉及6名學生及3名員工。包括8男1女，上周三起先後出現口腔潰瘍、手或腳出紅疹或水疱，及發燒等病徵，全部已經求醫。其中兩人曾入院，當中一人已出院，其餘患者病況輕微，情況穩定。

防護中心已派員實地視察中華廚藝學院，建議所需的感染控制和預防措施，並已為受影響人士安排樣本化驗，及對學院進行醫學監察，個案仍在調查。

薄扶林大樓內學院及訓練中心　停課至周日

職訓局表示，已即時加強清潔和消毒，並將相關個案呈報衛生防護中心。薄扶林大樓內的學院和訓練中心，昨日起至周日停課，期間訓練餐廳亦會暫停服務。

職訓局提醒教職員及學生，注意個人及環境衛生，預防感染；若出現病徵應盡快求醫，並留在家中休息。"
2592009,大熊貓龍鳳胎寶寶一歲生日　不少市民提早到場預約參觀,https://www.881903.com/news/local/2592009,local,"大熊貓龍鳳胎加加和得得，今日迎來一歲生日。為配合樂園慶祝「大熊貓龍鳳胎盛大生日派對」，今日海洋公園的「大熊貓之旅」，開放時間改為下午3時至5時。不少巿民在海洋公園開園前到場排隊，期望能領取手環，預約下午入場。

有巿民指，每個月會入園探望大熊貓2至3次，形容大熊貓寶寶「大得好快」，期望牠們健健康康成長。有廣州旅客指，適逢大熊貓龍鳳胎寶寶生日，特意請假來港探望牠們，形容心情激動和興奮，亦帶備自製應援...",2025-08-15 10:27,cradio,2025-08-15 10:30,2025-08-15 10:27:00,"大熊貓龍鳳胎加加和得得，今日迎來一歲生日。為配合樂園慶祝「大熊貓龍鳳胎盛大生日派對」，今日海洋公園的「大熊貓之旅」，開放時間改為下午3時至5時。不少巿民在海洋公園開園前到場排隊，期望能領取手環，預約下午入場。

有巿民指，每個月會入園探望大熊貓2至3次，形容大熊貓寶寶「大得好快」，期望牠們健健康康成長。有廣州旅客指，適逢大熊貓龍鳳胎寶寶生日，特意請假來港探望牠們，形容心情激動和興奮，亦帶備自製應援物品到場打卡，在港期間會同大熊貓粉絲朋友見面。

參與「大熊貓龍鳳胎盛大生日派對」的市民，除了在專屬時段探訪大熊貓外，並將獲得大熊貓相關禮物。"
2592008,卓永興：推動社會綠色轉型一直有加強與內地合作,https://www.881903.com/news/local/2592008,local,"政務司副司長卓永興在全國生態日啓動禮致詞時表示，特區政府一直推動社會綠色轉型，加強與內地合作，過去兩年與內地簽訂多項合作協議，涵蓋后海灣一帶的濕地生態環境，和梧桐山/紅花嶺保育。卓永興又見證本港和深圳簽署《大型水深野生動物聯合救護機制工作備忘錄》，未來會深化兩地大型水深野生動物的救護協助。

 
 國家自2023年起將每年8月15日定為全國生態日，今年進入第三屆，特區政府推出多項活動響應，包括濕地...",2025-08-15 10:22,cradio,2025-08-15 10:30,2025-08-15 10:22:00,"政務司副司長卓永興在全國生態日啓動禮致詞時表示，特區政府一直推動社會綠色轉型，加強與內地合作，過去兩年與內地簽訂多項合作協議，涵蓋后海灣一帶的濕地生態環境，和梧桐山/紅花嶺保育。卓永興又見證本港和深圳簽署《大型水深野生動物聯合救護機制工作備忘錄》，未來會深化兩地大型水深野生動物的救護協助。

國家自2023年起將每年8月15日定為全國生態日，今年進入第三屆，特區政府推出多項活動響應，包括濕地公園今日免費開放，場內提供免費導賞團；市民今日用「綠綠賞」或在「綠在區區」回收站，可以81.5% 所需的「綠綠賞」積分，兌換禮品或電子禮券。"
2592007,啟德今晚起舉行演唱會　港鐵加強屯馬綫服務,https://www.881903.com/news/local/2592007,local,"啟德體育園今晚至星期日，以及下星期二至三舉行大型演唱會。港鐵指，預計乘客量增加，會在觀眾進場及離場時段相應加強屯馬綫列車服務，其中離場時段班次會加密到2至3分鐘一班車。港鐵提醒過境旅客，可於啟德或宋皇臺站，乘搭屯馬綫前往大圍站，轉乘東鐵綫前往羅湖站過關，呼籲旅客留意尾班車時間，提早計劃行程及預留足夠轉車時間。

啟德站及宋皇臺站接近體育園的D出入口將會較繁忙，港鐵會配合當局的人群管理措施，加派職員...",2025-08-15 10:19,cradio,2025-08-15 10:30,2025-08-15 10:19:00,"啟德體育園今晚至星期日，以及下星期二至三舉行大型演唱會。港鐵指，預計乘客量增加，會在觀眾進場及離場時段相應加強屯馬綫列車服務，其中離場時段班次會加密到2至3分鐘一班車。港鐵提醒過境旅客，可於啟德或宋皇臺站，乘搭屯馬綫前往大圍站，轉乘東鐵綫前往羅湖站過關，呼籲旅客留意尾班車時間，提早計劃行程及預留足夠轉車時間。

啟德站及宋皇臺站接近體育園的D出入口將會較繁忙，港鐵會配合當局的人群管理措施，加派職員、加強廣播和標示等協助乘客。公司會持續留意車站及列車服務運作，有需要時會適時作出相應調整。"
2592006,本港九九金開市跌125元,https://www.881903.com/news/finance/2592006,finance,本港金價方面，九九金開市31195元，跌125元,2025-08-15 10:17,cradio,2025-08-15 10:30,2025-08-15 10:17:00,本港金價方面，九九金開市31195元，跌125元
2592002,團體到日本駐港總領館外抗議　促就侵華事件道歉,https://www.881903.com/news/local/2592002,local,今日是日本戰敗投降80周年，有團體到日本駐港總領事館抗議，要求日方就侵華事件道歉。中國香港同心護港總會十多名代表，在總領館門外，拉起橫額，高叫打倒日本軍國主義口號，批評日軍侵華造成大量死傷，但至令仍未承認殘暴行為，形容日本才是真正的東亞病夫，是中國人民不會忘記的恥辱，要求日本政府應銘記歷史教訓，不應妄想軍國主義復辟。總領館未有派人接收請願信，抗議代表將信件貼於使館門外後離去。,2025-08-15 10:04,cradio,2025-08-15 10:15,2025-08-15 10:04:00,今日是日本戰敗投降80周年，有團體到日本駐港總領事館抗議，要求日方就侵華事件道歉。中國香港同心護港總會十多名代表，在總領館門外，拉起橫額，高叫打倒日本軍國主義口號，批評日軍侵華造成大量死傷，但至令仍未承認殘暴行為，形容日本才是真正的東亞病夫，是中國人民不會忘記的恥辱，要求日本政府應銘記歷史教訓，不應妄想軍國主義復辟。總領館未有派人接收請願信，抗議代表將信件貼於使館門外後離去。
2592005,內地7月零售按年增3.7%　固投增1.6%工業增5.7%勝預期,https://www.881903.com/news/finance/2592005,finance,"內地7月社會消費品零售總額3.88萬億元人民幣，按年增3.7%。首7個月總額28.42萬億元，按年增4.8%。7月規模以上工業增加值按年實際增長5.7%。按月增0.38%。首7個月按年增6.3%。

首7個月，全國固定資產投資28.82億元，按年增1.6%。其中，民間固定資產投資按年跌1.5%。",2025-08-15 10:03,cradio,2025-08-15 10:15,2025-08-15 10:03:00,"內地7月社會消費品零售總額3.88萬億元人民幣，按年增3.7%。首7個月總額28.42萬億元，按年增4.8%。7月規模以上工業增加值按年實際增長5.7%。按月增0.38%。首7個月按年增6.3%。

首7個月，全國固定資產投資28.82億元，按年增1.6%。其中，民間固定資產投資按年跌1.5%。"
2592003,內地7月70城市新建住宅樓價按年跌幅收窄　按月下跌,https://www.881903.com/news/finance/2592003,finance,"內地7月70個大中城市商品住宅銷售價格，按年降幅整體收窄，按月下降。一線城市新建商品住宅銷售價格按年跌幅收窄至1.1%，其中上海升6.1%，北京、廣州和深圳下降2.2%至4.6%。二線城市新樓價格按年跌2.8%，三線城市跌4.2%。

二手樓價格按月下跌0.55%，上個月則下跌0.61%。",2025-08-15 09:49,cradio,2025-08-15 10:15,2025-08-15 09:49:00,"內地7月70個大中城市商品住宅銷售價格，按年降幅整體收窄，按月下降。一線城市新建商品住宅銷售價格按年跌幅收窄至1.1%，其中上海升6.1%，北京、廣州和深圳下降2.2%至4.6%。二線城市新樓價格按年跌2.8%，三線城市跌4.2%。

二手樓價格按月下跌0.55%，上個月則下跌0.61%。"
2592000,金正恩首次在北韓解放日講話　強調朝俄團結無窮無盡,https://www.881903.com/news/international/2592000,international,北韓領袖金正恩首次在解放日發表講話，強調北韓與俄羅斯團結，但未有提及南韓與美國。朝中社報道，金正恩星期四在平壤凱旋門出席活動，紀念朝鮮半島脫離日本殖民統治80周年，俄羅斯國家杜馬主席沃洛金出席。金正恩指，朝俄友誼已發展成為前所未有的同盟，在共同遏制新納粹主義復活、維護國家主權等的鬥爭中愈加牢固，亦在爭取世界和平穩定的鬥爭中創造歷史，強調朝俄團結的力量無窮無盡。金正恩指，帝國主義罪行日益嚴重，侵犯其...,2025-08-15 09:47,cradio,2025-08-15 10:00,2025-08-15 09:47:00,"北韓領袖金正恩首次在解放日發表講話，強調北韓與俄羅斯團結，但未有提及南韓與美國。朝中社報道，金正恩星期四在平壤凱旋門出席活動，紀念朝鮮半島脫離日本殖民統治80周年，俄羅斯國家杜馬主席沃洛金出席。金正恩指，朝俄友誼已發展成為前所未有的同盟，在共同遏制新納粹主義復活、維護國家主權等的鬥爭中愈加牢固，亦在爭取世界和平穩定的鬥爭中創造歷史，強調朝俄團結的力量無窮無盡。金正恩指，帝國主義罪行日益嚴重，侵犯其他國家的主權和權利，但未有具體指明是哪些國家。

金正恩同日收到俄羅斯總統普京的賀信。普京指，相信去年在平壤簽訂的全面戰略夥伴關係條約全面履行，將繼續推動俄朝加強各領域的互利合作。金正恩回信指，朝俄兩國關係已達到「全面開花」的階段，未來會有更加紮實的發展，並祝願俄羅斯軍隊取得勝利和榮耀，相信能成功捍衛國家尊嚴。

金正恩星期四亦參謁錦繡山太陽宮，向父親金正日與祖父金日成的雕像獻花。"
2591999,普京乘坐專機已抵美國阿拉斯加,https://www.881903.com/news/international/2591999,international,"美俄首腦峰會將在當地周五下午，在美國阿拉斯加州舉行。俄羅斯傳媒引述飛行航班信息網站的數據顯示，俄羅斯特勤飛行大隊一架伊爾-96-300飛機，從俄羅斯莫斯科飛抵美國阿拉斯加安克雷奇機場，相信機上載有總統普京及隨行官員，包括外長拉夫羅夫及防長別洛烏索夫等。
俄羅斯總統助理烏沙科夫表示，普京和美國總統特朗普將首先舉行單獨會談，隨後雙方代表團加入，會談開始前，普京和特朗普將簡短致辭，結束後舉行新聞發佈會，...",2025-08-15 09:35,cradio,2025-08-15 09:45,2025-08-15 09:35:00,"美俄首腦峰會將在當地周五下午，在美國阿拉斯加州舉行。俄羅斯傳媒引述飛行航班信息網站的數據顯示，俄羅斯特勤飛行大隊一架伊爾-96-300飛機，從俄羅斯莫斯科飛抵美國阿拉斯加安克雷奇機場，相信機上載有總統普京及隨行官員，包括外長拉夫羅夫及防長別洛烏索夫等。

俄羅斯總統助理烏沙科夫表示，普京和美國總統特朗普將首先舉行單獨會談，隨後雙方代表團加入，會談開始前，普京和特朗普將簡短致辭，結束後舉行新聞發佈會，會議的主要議題是調解烏克蘭危機，並討論俄美經濟關係中，尚未開發的潛力，預計雙方將就進一步發展雙邊合作交換意見，包括在貿易和經濟領域。

俄羅斯傳媒引述前克里姆林宮高級官員表示，普京深知特朗普是用商業眼光看待國際事務，不排除提供經濟誘因，拉攏特朗普站在俄方立場。"
2591995,港股低開197點,https://www.881903.com/news/finance/2591995,finance,港股低開197點，恒生指數最新報25322點。,2025-08-15 09:29,cradio,2025-08-15 09:45,2025-08-15 09:29:00,港股低開197點，恒生指數最新報25322點。
2591993,人民幣兌美元中間價報7.1371下調34點子,https://www.881903.com/news/finance/2591993,finance,人民幣兌美元中間價報7.1371，下調34點子。離岸人民幣報7.1824。,2025-08-15 09:24,cradio,2025-08-15 09:30,2025-08-15 09:24:00,人民幣兌美元中間價報7.1371，下調34點子。離岸人民幣報7.1824。
2591989,黎智英案今起結案陳辭　法院外有警員戒備,https://www.881903.com/news/local/2591989,local,"壹傳媒創辦人黎智英及《蘋果日報》3間公司涉串謀勾結外國勢力案，今日起在西九龍裁判法院進行結案陳辭。

在法院外，有市民排隊輪候聽審。警方在法院附近部署警力，多輛警車停泊在法院一帶，近百名警員在法院外戒備，亦出動警犬巡邏，警方截查駛經法院的車輛，又用儀器檢查部分車輛的車底。",2025-08-15 08:58,cradio,2025-08-15 09:15,2025-08-15 08:58:00,"壹傳媒創辦人黎智英及《蘋果日報》3間公司涉串謀勾結外國勢力案，今日起在西九龍裁判法院進行結案陳辭。

在法院外，有市民排隊輪候聽審。警方在法院附近部署警力，多輛警車停泊在法院一帶，近百名警員在法院外戒備，亦出動警犬巡邏，警方截查駛經法院的車輛，又用儀器檢查部分車輛的車底。"
2591985,石破茂將向靖國神社獻祭品　小泉進次郎親身參拜,https://www.881903.com/news/international/2591985,international,今日是日本戰敗投降80周年。首相石破茂上午會到東京千鳥淵戰歿者墓獻花，預料亦會以自民黨總裁身份，向供奉二戰甲級戰犯的靖國神社獻上祭祀費，但不會親身參拜。農林水產大臣小泉進次郎早上現身靖國神社參拜。預計跨黨派國會議員上午會到神社集體參拜。部分內閣成員已明確表態不會參拜，包括外相岩屋毅、文部科學大臣阿部俊子等。自民黨幹事長森山裕昨日已參拜靖國神社，並獻上祭祀費。,2025-08-15 07:54,cradio,2025-08-15 08:15,2025-08-15 07:54:00,今日是日本戰敗投降80周年。首相石破茂上午會到東京千鳥淵戰歿者墓獻花，預料亦會以自民黨總裁身份，向供奉二戰甲級戰犯的靖國神社獻上祭祀費，但不會親身參拜。農林水產大臣小泉進次郎早上現身靖國神社參拜。預計跨黨派國會議員上午會到神社集體參拜。部分內閣成員已明確表態不會參拜，包括外相岩屋毅、文部科學大臣阿部俊子等。自民黨幹事長森山裕昨日已參拜靖國神社，並獻上祭祀費。
2591984,聯合國指去年全球衝突地區性暴力事件顯著增加,https://www.881903.com/news/international/2591984,international,"聯合國發表全長34頁的年報，指去年全球衝突地區的性暴力事件顯著增加，超過4600人淪爲性暴力受害者，增幅達到25%。受害者中女性佔92%。情況最嚴重的包括中非共和國、剛果民主共和國、海地、索馬里和南蘇丹。

報告將十多個國家合共63個政府及非政府團體列入黑名單，又提及以色列和俄羅斯部隊，表示有可靠資料顯示他們性虐待巴勒斯坦囚犯及烏克蘭戰俘，如果不採取預防措施，會在明年被列入黑名單。以色列駐聯合國大...",2025-08-15 07:51,cradio,2025-08-15 08:15,2025-08-15 07:51:00,"聯合國發表全長34頁的年報，指去年全球衝突地區的性暴力事件顯著增加，超過4600人淪爲性暴力受害者，增幅達到25%。受害者中女性佔92%。情況最嚴重的包括中非共和國、剛果民主共和國、海地、索馬里和南蘇丹。

報告將十多個國家合共63個政府及非政府團體列入黑名單，又提及以色列和俄羅斯部隊，表示有可靠資料顯示他們性虐待巴勒斯坦囚犯及烏克蘭戰俘，如果不採取預防措施，會在明年被列入黑名單。以色列駐聯合國大使批評有關指控充滿偏見，要求聯合國聚焦哈馬斯的戰爭罪行和性暴力，以及令所有人質獲釋。俄羅斯表示不予置評。"
2591981,警方粉嶺檢獲逾300萬元毒品　拘捕1人,https://www.881903.com/news/local/2591981,local,"警方在粉嶺檢獲黑巿價值超過300萬元毒品，拘捕一人。

警方根據線報及深入調查後，昨晚在馬適路一座住宅大廈展開反毒品行動。

在平台截查一名形跡可疑的20歲男子，在他身上搜出約500克氯胺酮，其後於男子住所內搜獲約5.8公斤氯胺酮、約4.9公升依托咪酯及一支伸縮棍。男子涉嫌販運危險藥物及管有攻擊性武器被捕，現正扣留調查。",2025-08-15 07:26,cradio,2025-08-15 07:45,2025-08-15 07:26:00,"警方在粉嶺檢獲黑巿價值超過300萬元毒品，拘捕一人。

警方根據線報及深入調查後，昨晚在馬適路一座住宅大廈展開反毒品行動。

在平台截查一名形跡可疑的20歲男子，在他身上搜出約500克氯胺酮，其後於男子住所內搜獲約5.8公斤氯胺酮、約4.9公升依托咪酯及一支伸縮棍。男子涉嫌販運危險藥物及管有攻擊性武器被捕，現正扣留調查。"
2591980,魯比奧：特朗普冀俄烏至少暫時休戰　為談判創造空間,https://www.881903.com/news/international/2591980,international,"美俄元首的阿拉斯加峰會備受關注。美國國務卿魯比奧表示，總統特朗普希望俄烏之間至少可以暫時休戰，為全面結束戰事的談判創造空間，因戰事持續時間愈長，就愈難結束，美方希望在停戰方面取得進展，為了實現俄烏持久和平，必須就安全保障、領土爭端及主權聲索等問題進行對話，有關問題將會成為俄烏和平協議的一部分，都是高度技術性的問題，需要時間解決，亦需要交戰雙方都同意協議內容。

魯比奧表示，美俄領導人今年已多次通電...",2025-08-15 07:18,cradio,2025-08-15 07:45,2025-08-15 07:18:00,"美俄元首的阿拉斯加峰會備受關注。美國國務卿魯比奧表示，總統特朗普希望俄烏之間至少可以暫時休戰，為全面結束戰事的談判創造空間，因戰事持續時間愈長，就愈難結束，美方希望在停戰方面取得進展，為了實現俄烏持久和平，必須就安全保障、領土爭端及主權聲索等問題進行對話，有關問題將會成為俄烏和平協議的一部分，都是高度技術性的問題，需要時間解決，亦需要交戰雙方都同意協議內容。

魯比奧表示，美俄領導人今年已多次通電話，相信特朗普與俄羅斯總統普京會晤的數分鐘內，就能評估是否有可能推動俄烏和談，重申特朗普希望結束戰事及實現和平。"
2591979,廣西南寧發現8宗基孔肯雅熱個案　稱感染風險持續上升,https://www.881903.com/news/china/2591979,china,"內地基孔肯雅熱疫情擴散。廣西通報，截至星期三，南寧市青秀區陸續發現8宗基孔肯雅熱病例，全部是輕症。廣西疾控中心發布倡議書，提到自治區內出現基孔肯雅熱疫情，主要傳播媒介白紋伊紋在全區廣泛分布，個人感染風險持續上升，宣布即日起在全境展開「愛國衛生運動」，呼籲全區各企事業單位、學校、建築工地、村社區、家庭及全體居民立即行動，清除蚊蟲滋生地和殺滅成蚊，做好屋內、屋外衛生及個人防護。

國家疾病預防控制局日...",2025-08-15 06:58,cradio,2025-08-15 07:15,2025-08-15 06:58:00,"內地基孔肯雅熱疫情擴散。廣西通報，截至星期三，南寧市青秀區陸續發現8宗基孔肯雅熱病例，全部是輕症。廣西疾控中心發布倡議書，提到自治區內出現基孔肯雅熱疫情，主要傳播媒介白紋伊紋在全區廣泛分布，個人感染風險持續上升，宣布即日起在全境展開「愛國衛生運動」，呼籲全區各企事業單位、學校、建築工地、村社區、家庭及全體居民立即行動，清除蚊蟲滋生地和殺滅成蚊，做好屋內、屋外衛生及個人防護。

國家疾病預防控制局日前將廣西，列為基孔肯雅熱風險最高的「防控一類地區」，連同廣東、浙江、福建、海南、雲南，目前全國有6個省區，被列為「防控一類地區」，即媒介蚊活躍期較長、以往報告登革熱本地病例較多、聚集性疫情發生風險相對較高。"
2591978,據報特朗普政府洽購英特爾股份　陳立武有望留任CEO,https://www.881903.com/news/international/2591978,international,"彭博社引述消息報道，美國特朗普政府正考慮入股晶片製造商英特爾。報道指，英特爾希望在俄亥俄州，興建全球最大的晶片工廠，但計劃一再被推遲，美國政府入股將有助英特爾落實有關計劃，但暫時未知政府實際參與規模。消息人士指，總統特朗普本周與英特爾行政總裁陳立武會晤時，曾討論入股計劃，但具體細節仍在商討中。英特爾正陷入財政困境，若獲政府入股，財務狀況將改善，陳立武亦有望繼續執掌公司。
白宮指，在正式公布前，任何...",2025-08-15 06:43,cradio,2025-08-15 06:45,2025-08-15 06:43:00,"彭博社引述消息報道，美國特朗普政府正考慮入股晶片製造商英特爾。報道指，英特爾希望在俄亥俄州，興建全球最大的晶片工廠，但計劃一再被推遲，美國政府入股將有助英特爾落實有關計劃，但暫時未知政府實際參與規模。消息人士指，總統特朗普本周與英特爾行政總裁陳立武會晤時，曾討論入股計劃，但具體細節仍在商討中。英特爾正陷入財政困境，若獲政府入股，財務狀況將改善，陳立武亦有望繼續執掌公司。

白宮指，在正式公布前，任何假設的討論都是猜測。英特爾指，公司堅定支持特朗普加強美國科技和製造業領導地位的努力，期待繼續與特朗普政府合作，推進共同的優先事項，但不會評論傳聞。受消息刺激，英特爾股價星期四最多升8.9%，收市升7.4%。"
