id,title,url,section,lead,date,source,scrape_time,last_update,news_content
2588246,啟德青年運動場及香港大球場今日起至月底設臨時限飛區,https://www.881903.com/news/local/2588246,local,"啟德青年運動場及香港大球場一帶，即日起至下周四將設立臨時限制飛行區，在兩個場地向外延伸兩公里範圍內，除了獲正式授權的小型無人機外，其他小型無人機限制進入。
警方提醒市民，在沒有許可的情況下，於限制飛行區內操作小型無人機，一經定罪，最高可被判罰款10萬元及監禁兩年。",2025-07-22 09:06,cradio,2025-07-22 09:15,2025-07-22 09:06:00,"啟德青年運動場及香港大球場一帶，即日起至下周四將設立臨時限制飛行區，在兩個場地向外延伸兩公里範圍內，除了獲正式授權的小型無人機外，其他小型無人機限制進入。

警方提醒市民，在沒有許可的情況下，於限制飛行區內操作小型無人機，一經定罪，最高可被判罰款10萬元及監禁兩年。"
2588244,貝森特促全面審查聯儲局　共和黨議員指控鮑威爾作假證供,https://www.881903.com/news/international/2588244,international,"美國財長貝森特認為，有需要對聯儲局進行全面的審視，包括聯儲局總部耗資25億美元的翻修工程，以及聯儲局的整體功能。他接受財經頻道CNBC訪問時，未有回應是否建議總統特朗普不要解僱聯儲局主席鮑威爾，只表示由特朗普決定，又認為要思考聯儲局是否成功履行在貨幣政策、監管和金融穩定的任務。
貝森特其後在社交平台發文，指聯儲局每年虧損逾千美元，應該審視翻新總部的決定，並對於非貨幣政策的運作情況進行內部檢視。他指...",2025-07-22 08:55,cradio,2025-07-22 09:00,2025-07-22 08:55:00,"美國財長貝森特認為，有需要對聯儲局進行全面的審視，包括聯儲局總部耗資25億美元的翻修工程，以及聯儲局的整體功能。他接受財經頻道CNBC訪問時，未有回應是否建議總統特朗普不要解僱聯儲局主席鮑威爾，只表示由特朗普決定，又認為要思考聯儲局是否成功履行在貨幣政策、監管和金融穩定的任務。

貝森特其後在社交平台發文，指聯儲局每年虧損逾千美元，應該審視翻新總部的決定，並對於非貨幣政策的運作情況進行內部檢視。他指偏離使命和機構擴張，可能已經危及聯儲局核心貨幣政策的獨立性，敦促聯儲局領導層進行全面的制度性審查，以增強公信力。

另外，共和黨眾議員盧納去信司法部，質疑鮑威爾在翻新總部問題上，在眾議院的委員會上作虛假陳述，要求展開刑事調查和檢控。盧納指，鮑威爾曾表示工程不包括增設貴賓宴會廳等豪華設施，以及聲稱聯儲局總部自1930年代落成以來，未進行過大規模翻新，質疑與事實不符。"
2588243,王國龍明年6月底前退任領展行政總裁,https://www.881903.com/news/local/2588243,local,"領展董事會宣布，加入領展逾16年的行政總裁王國龍將於明年6月底前，退任行政總裁及執行董事。董事會將啟動甄選程序，物色繼任人選。王國龍將在過渡期間協助集團交接。

王國龍指，對現有管理層充滿信心，相信已為領展邁向下一階段的發展，建立合適的團隊，將繼續與主席、董事會以及管理層緊密合作，進一步鞏固領展未來發展的根基。領展董事會主席歐敦勤表示，過去16年來，王國龍領導領展不斷成長和轉型，為基金單位持有人、...",2025-07-22 08:49,cradio,2025-07-22 09:00,2025-07-22 08:49:00,"領展董事會宣布，加入領展逾16年的行政總裁王國龍將於明年6月底前，退任行政總裁及執行董事。董事會將啟動甄選程序，物色繼任人選。王國龍將在過渡期間協助集團交接。

王國龍指，對現有管理層充滿信心，相信已為領展邁向下一階段的發展，建立合適的團隊，將繼續與主席、董事會以及管理層緊密合作，進一步鞏固領展未來發展的根基。領展董事會主席歐敦勤表示，過去16年來，王國龍領導領展不斷成長和轉型，為基金單位持有人、商戶、員工和服務的廣大社區帶來裨益，又指領展將堅守既定策略，繼續專注於積極管理和優化領展房託的物業組合，同時拓展房地產投資管理平台。"
2588242,伊朗多處持續高溫　南部布希爾省曾錄得攝氏50度,https://www.881903.com/news/international/2588242,international,伊朗全國多處持續高溫，多個城市發布高溫預警，部分地區停水停電。氣象部門數據顯示，南部布希爾省博拉茲詹市，過去一日錄得全國最高氣溫攝氏50度，首都德黑蘭過去兩日氣溫亦高達40度。為了節約水電，德黑蘭省周三停工停課一日，政府辦公室和銀行等將暫停運作，當局呼籲民眾留在室內。當地氣象專家指，入夏至今，伊朗全國平均氣溫較正常高約1.2度，德黑蘭正實施每日分區停電停水；鄰近的塞姆南省亦大幅縮減政府辦公室和銀行...,2025-07-22 08:13,cradio,2025-07-22 08:15,2025-07-22 08:13:00,"伊朗全國多處持續高溫，多個城市發布高溫預警，部分地區停水停電。氣象部門數據顯示，南部布希爾省博拉茲詹市，過去一日錄得全國最高氣溫攝氏50度，首都德黑蘭過去兩日氣溫亦高達40度。為了節約水電，德黑蘭省周三停工停課一日，政府辦公室和銀行等將暫停運作，當局呼籲民眾留在室內。當地氣象專家指，入夏至今，伊朗全國平均氣溫較正常高約1.2度，德黑蘭正實施每日分區停電停水；鄰近的塞姆南省亦大幅縮減政府辦公室和銀行等的工作時間，期望透過錯峰辦公，實現節能減耗。

全球暖化下，伊朗近年頻繁遭遇極端高溫天氣，地下水資源過度開發，加上管理不善，全國多處面臨缺水危機，南部省分尤其嚴重。氣象專家預計，伊朗全國8個省未來數日將繼續出現氣溫異常現象。"
2588240,北韓計劃明年10月前建造多一艘5000噸級驅逐艦,https://www.881903.com/news/international/2588240,international,"北韓計劃明年10月前，建造多一艘5000噸級驅逐艦。朝中社報道，負責建造軍艦的南浦造船廠星期一舉行員工大會，提出明年10月10日勞動黨建黨紀念日前，建造多一艘新型驅逐艦。船廠廠長呼籲員工，按時完成建造新艦，維護黨建設強大軍隊的計劃。

北韓今年4月公布，首艘5000噸級新型驅逐艦「崔賢號」已下水。另一艘同級的驅逐艦「姜健號」5月下水時發生傾側事故，經修復後上月中重新舉行下水禮。",2025-07-22 07:56,cradio,2025-07-22 08:15,2025-07-22 07:56:00,"北韓計劃明年10月前，建造多一艘5000噸級驅逐艦。朝中社報道，負責建造軍艦的南浦造船廠星期一舉行員工大會，提出明年10月10日勞動黨建黨紀念日前，建造多一艘新型驅逐艦。船廠廠長呼籲員工，按時完成建造新艦，維護黨建設強大軍隊的計劃。

北韓今年4月公布，首艘5000噸級新型驅逐艦「崔賢號」已下水。另一艘同級的驅逐艦「姜健號」5月下水時發生傾側事故，經修復後上月中重新舉行下水禮。"
2588239,美國研究指13歲以下兒童使用智能手機或損心理健康,https://www.881903.com/news/international/2588239,international,"美國一項研究指，父母如果讓子女在13歲前使用智能手機，可能有損他們的心理健康。負責研究的非牟利機構，分析來自163個國家、逾200萬人的自我反思報告，發現13歲以下兒童使用智能手機，較大機會有自殺念頭、情緒調節能力下降、自我認同降低，或感到自己與身邊環境脫節，特別是在女孩身上，推斷兒童每用1年智能手機，心理健康和幸福感就變得更差。

研究指，越來越多13歲以下兒童透過智能手機瀏覽社交平台，有機會因...",2025-07-22 07:51,cradio,2025-07-22 08:15,2025-07-22 07:51:00,"美國一項研究指，父母如果讓子女在13歲前使用智能手機，可能有損他們的心理健康。負責研究的非牟利機構，分析來自163個國家、逾200萬人的自我反思報告，發現13歲以下兒童使用智能手機，較大機會有自殺念頭、情緒調節能力下降、自我認同降低，或感到自己與身邊環境脫節，特別是在女孩身上，推斷兒童每用1年智能手機，心理健康和幸福感就變得更差。

研究指，越來越多13歲以下兒童透過智能手機瀏覽社交平台，有機會因而遭受網絡霸凌、與家人關係轉差，或影響睡眠，繼而導致焦慮和抑鬱情緒，呼籲各界思考是否要多加限制兒童使用智能手機，以及監管兒童所接觸到的網絡環境。研究機構亦指，由於今次只靠綜合受訪者的自我反思報告，意味結果未經研究人員的獨立驗證，亦無法解釋這些結果會如何隨著科技發展而改變。有關研究已刊登在國際期刊《人類發展與能力雜誌》。"
2588238,羅淑佩︰不應憧憬以往遊客大手消費模式,https://www.881903.com/news/local/2588238,local,"文化體育及旅遊局局長羅淑佩表示香港旅遊業發展不應憧憬以往遊客大手消費的模式，強調最重要是包容，要令旅客賓至如歸，吸引「回頭客」。她接受報章訪問時指，即使遊客只喜歡打卡，不太花錢，香港亦可以吸引旅客「打開荷包」，舉例指全運會的吉祥物非常暢銷。

羅淑佩指，近月海外旅客呈上升趨勢，佔整體訪港旅客約25%，相信10月舉行的美酒佳餚巡禮，會吸引很多來自東南亞、日韓、澳洲旅客來港。她透露今年的美酒佳餚巡禮將...",2025-07-22 07:49,cradio,2025-07-22 08:15,2025-07-22 07:49:00,"文化體育及旅遊局局長羅淑佩表示香港旅遊業發展不應憧憬以往遊客大手消費的模式，強調最重要是包容，要令旅客賓至如歸，吸引「回頭客」。她接受報章訪問時指，即使遊客只喜歡打卡，不太花錢，香港亦可以吸引旅客「打開荷包」，舉例指全運會的吉祥物非常暢銷。

羅淑佩指，近月海外旅客呈上升趨勢，佔整體訪港旅客約25%，相信10月舉行的美酒佳餚巡禮，會吸引很多來自東南亞、日韓、澳洲旅客來港。她透露今年的美酒佳餚巡禮將會升級，包括重設尊尚名酒區、引入更多波爾多葡萄酒等，期望活動成為促進中外文化交流及酒商貿易平台，又指可以透過巡禮，加強推廣中菜配葡萄酒甚至香檳，旅發局正在構思，例如觀眾買酒時，會提示菜式可以搭配的葡萄酒，以提升體驗。

羅淑佩︰政府對演唱會實明制「手不宜伸太長」

羅淑佩又表示，局方已約見多個大型演唱會主辦單位，了解對演唱會實名制的想法，但強調演唱會屬商業活動、「要計掂數」，並非政府行為可輕易改變，而香港亦是自由的地方，在不違法情況下，「政府隻手唔應該伸得太長」。她又指，西九文化區正構建自家購票平台，供西九各表演場地之用，若運行得宜，西九也願意將平台開放予其他項目使用。

對於有政黨提倡香港聯同大灣區城市申辦2036年奧運，羅淑佩表示，申辦奧運屬國家行為，辦賽亦「可勝不可敗」，要配合國家政策，同時審慎評估公共財政、資源等問題。"
2588235,美國政府解密馬丁路德金案調查紀錄　當局指會確保案件公開透明,https://www.881903.com/news/international/2588235,international,"美國特朗普政府無視已故黑人民權運動領袖馬丁路德金家人反對，解密聯邦調查局對馬丁路德金1968年遇刺案的調查紀錄，包括調查疑兇是單獨犯案，還是另有同謀。長達24萬頁的紀錄，自聯邦調查局1977年搜集線索，並移交國家檔案和記錄管理局以來，一直被法院頒令強制封存。國家情報總監加巴德強調，今次公開的紀錄規模史無前例，會按總統特朗普指示，確保案件公開透明。
特朗普今年1月重返白宮後簽署行政命令，公開馬丁路德...",2025-07-22 07:18,cradio,2025-07-22 07:30,2025-07-22 07:18:00,"美國特朗普政府無視已故黑人民權運動領袖馬丁路德金家人反對，解密聯邦調查局對馬丁路德金1968年遇刺案的調查紀錄，包括調查疑兇是單獨犯案，還是另有同謀。長達24萬頁的紀錄，自聯邦調查局1977年搜集線索，並移交國家檔案和記錄管理局以來，一直被法院頒令強制封存。國家情報總監加巴德強調，今次公開的紀錄規模史無前例，會按總統特朗普指示，確保案件公開透明。

特朗普今年1月重返白宮後簽署行政命令，公開馬丁路德金等人遇刺案的相關機密文件。馬丁路德金家人，包括2名在生兒子，都獲當局提前告知會解密文件，並事先檢視相關紀錄。2名兒子發聲明，指父親的案件數十年來引起公眾好奇，希望當局尊重家人的悲痛，又敦促各界根據完整的歷史背景，檢視這些文件。"
2588233,華府證實有員工於中國被禁止出境　正與中方接觸,https://www.881903.com/news/china/2588233,china,"美國國務院證實，商務部轄下專利及商標局一名員工，以私人身份到訪中國期間被禁止離境。發言人指，華府正密切貿意情況，並與中方官員接觸，以盡快解決事件。中國駐美大使館暫時未有回應。

《華盛頓郵報》日前報道，涉事的是一名美籍華裔男員工，在幾個月前到中國探親，被指在簽證申請中，未有披露美國政府員工的身分而被限制出境。報道指，美方極高層級的外交官員已經介入，要求中方放人。外交部發言人郭嘉昆昨日表示，沒有可以...",2025-07-22 07:11,cradio,2025-07-22 07:15,2025-07-22 07:11:00,"美國國務院證實，商務部轄下專利及商標局一名員工，以私人身份到訪中國期間被禁止離境。發言人指，華府正密切貿意情況，並與中方官員接觸，以盡快解決事件。中國駐美大使館暫時未有回應。

《華盛頓郵報》日前報道，涉事的是一名美籍華裔男員工，在幾個月前到中國探親，被指在簽證申請中，未有披露美國政府員工的身分而被限制出境。報道指，美方極高層級的外交官員已經介入，要求中方放人。外交部發言人郭嘉昆昨日表示，沒有可以提供的具體情況，強調中國是法治國家，依法處理出入境事務。"
2588232,特朗普稅改法案將增3.4萬億美元赤字,https://www.881903.com/news/international/2588232,international,"美國國會預算辦公室最新估算，總統特朗普近日簽署的稅收與支出《大而美法案》，將在未來10年為美國政府減少1.1萬億美元支出，但收入減少4.5萬億美元，財政赤字將達到3.4萬億美元。國會預算辦公室又估計，法案實施後，未來10年會多1千萬人失去醫療保險。最新分析未納入動態效應，包括法案可能對經濟增長或利率產生的影響。
美國國會參眾兩院上月通過特朗普力推的《大而美法案》，特朗普在7月4日簽署生效。法案內容...",2025-07-22 06:44,cradio,2025-07-22 07:00,2025-07-22 06:44:00,"美國國會預算辦公室最新估算，總統特朗普近日簽署的稅收與支出《大而美法案》，將在未來10年為美國政府減少1.1萬億美元支出，但收入減少4.5萬億美元，財政赤字將達到3.4萬億美元。國會預算辦公室又估計，法案實施後，未來10年會多1千萬人失去醫療保險。最新分析未納入動態效應，包括法案可能對經濟增長或利率產生的影響。

美國國會參眾兩院上月通過特朗普力推的《大而美法案》，特朗普在7月4日簽署生效。法案內容包括未來10年減稅4萬億美元，延長特朗普在首個任期的減稅措施，同時削減醫療、福利補助及綠色補貼等支出；聯邦政府債務上限將提高至5萬億美元。"
2588231,據報歐盟本周再開會商討應對美國關稅,https://www.881903.com/news/international/2588231,international,"外電報道，歐盟成員國代表快本周會面，討論一旦未能在8月1日限期前與美國達成貿易協議的應對方案。《彭博社》報道，歐盟傾向與華府保持磋商，但上周的談判未能取得進展；消息人士指美方期望對歐盟貨品徵收10%以上的關稅，只有少數可獲得豁免，包括航空、醫療器材、藥物、部份烈酒及美國有需要的特定製造設備等。據報雙方亦有討論鋼鋁等部份領域的出口數量限制。
另外，《路透社》報道，歐盟正探討更加廣泛的反制措施。外交官...",2025-07-22 06:30,cradio,2025-07-22 06:45,2025-07-22 06:30:00,"外電報道，歐盟成員國代表快本周會面，討論一旦未能在8月1日限期前與美國達成貿易協議的應對方案。《彭博社》報道，歐盟傾向與華府保持磋商，但上周的談判未能取得進展；消息人士指美方期望對歐盟貨品徵收10%以上的關稅，只有少數可獲得豁免，包括航空、醫療器材、藥物、部份烈酒及美國有需要的特定製造設備等。據報雙方亦有討論鋼鋁等部份領域的出口數量限制。

另外，《路透社》報道，歐盟正探討更加廣泛的反制措施。外交官員形容，愈來愈多成員國傾向採取廣泛的反脅迫措施，包括德國。措施可能包括限制美國企業投資，以及限制銷售部份化學品和食品等。德國總理默茲周一表示，談判正緊鑼密鼓地進行，但認為美方似乎未準備好與歐盟達成一份對等的協議，強調開放市場對各方都有利。"
2588230,伊朗外長：核設施遭美軍嚴重破壞　不放棄鈾濃縮計劃,https://www.881903.com/news/international/2588230,international,"伊朗外長阿拉格齊表示，美國上月空襲三處核設施後，伊朗的濃縮鈾設施遭嚴重破壞，所有鈾濃縮活動都要暫停，但強調德黑蘭不會放棄鈾濃縮計劃。阿拉格齊接受霍士新聞專訪時說，儘管伊朗面臨國際社會嚴厲制裁，但鈾濃縮是本國科學家的成就，關乎民族自豪感，對伊朗非常珍貴，伊朗不能放棄，相關項目亦沒有停止，認為美國透過封鎖濃縮能力、阻止德黑蘭進一步發展核武的最高目標，不太可能實現。
伊朗周五將與英法德三國官員，以及歐盟...",2025-07-22 06:25,cradio,2025-07-22 06:30,2025-07-22 06:25:00,"伊朗外長阿拉格齊表示，美國上月空襲三處核設施後，伊朗的濃縮鈾設施遭嚴重破壞，所有鈾濃縮活動都要暫停，但強調德黑蘭不會放棄鈾濃縮計劃。阿拉格齊接受霍士新聞專訪時說，儘管伊朗面臨國際社會嚴厲制裁，但鈾濃縮是本國科學家的成就，關乎民族自豪感，對伊朗非常珍貴，伊朗不能放棄，相關項目亦沒有停止，認為美國透過封鎖濃縮能力、阻止德黑蘭進一步發展核武的最高目標，不太可能實現。

伊朗周五將與英法德三國官員，以及歐盟外交與安全政策高級代表卡拉斯，在土耳其伊斯坦布爾舉行新一輪核談判。德黑蘭早前指，談判將以副外長級別進行，聚焦撤銷制裁和核計劃議題。"
2588229,貝森特︰特朗普將決定是否延長關稅寬限期　華府不倉促達成協議,https://www.881903.com/news/international/2588229,international,"美國特朗普政府對各國徵收對等關稅的寬限期將於8月1日屆滿，財長貝森特強調，不會為了達成協議而倉促行事，強調華府著重貿易協議的質素，多於時間。他接受財經頻道CNBC訪問時，被問到會否再延長寬限期，貝森特回應指，會由總統特朗普決定，又重申較高額的關稅會對其他國家造成壓力，有助達成更好的協議。
白宮發言人萊維特表示，可能會在限期前達成更多貿易協議，或發出更多關稅信件，知會關稅水平。她又指，菲律賓總統小馬...",2025-07-22 06:06,cradio,2025-07-22 06:15,2025-07-22 06:06:00,"美國特朗普政府對各國徵收對等關稅的寬限期將於8月1日屆滿，財長貝森特強調，不會為了達成協議而倉促行事，強調華府著重貿易協議的質素，多於時間。他接受財經頻道CNBC訪問時，被問到會否再延長寬限期，貝森特回應指，會由總統特朗普決定，又重申較高額的關稅會對其他國家造成壓力，有助達成更好的協議。

白宮發言人萊維特表示，可能會在限期前達成更多貿易協議，或發出更多關稅信件，知會關稅水平。她又指，菲律賓總統小馬可斯將於當地時間周二到訪白宮，與特朗普會面，雙方可能討論貿易議題。

華府仍然與多個國家就關稅磋商，日本經濟再生擔當大臣赤澤亮正在3個月內，第8次到訪華盛頓，商討關稅問題。另外，印度政府官員上周亦在華盛頓與美方磋商，但消息人士指，官員對於8月限期前達成協議，已經不抱期望。"
2588228,美股收市個別發展,https://www.881903.com/news/finance/2588228,finance,"美股收市個別發展，市場注視多間大型公司本周陸續公布的季度業績，會否受華府關稅措施的負面影響。電訊商Verizon最新季度純利好過預期，股價升4%。
道瓊斯工業平均指數收市報44323點，跌19點；
標準普爾500指數收市報6305點，升8點；
納斯達克指數收市報20974點，升78點。",2025-07-22 05:16,cradio,2025-07-22 05:30,2025-07-22 05:16:00,"美股收市個別發展，市場注視多間大型公司本周陸續公布的季度業績，會否受華府關稅措施的負面影響。電訊商Verizon最新季度純利好過預期，股價升4%。

道瓊斯工業平均指數收市報44323點，跌19點；

標準普爾500指數收市報6305點，升8點；

納斯達克指數收市報20974點，升78點。"
2588227,白宮：特朗普對以色列空襲敘利亞和加沙感措手不及,https://www.881903.com/news/international/2588227,international,"美國白宮發言人萊維特說，總統特朗普對以色列近日空襲敘利亞和加沙一座天主教堂，感到措手不及。她指特朗普與以色列總理內塔尼亞胡一直有著良好的工作關係，在兩宗襲擊後，特朗普亦迅速致電對方，要求糾正事態。
美國敘利亞問題特使巴拉克形容，以色列在非常差的時機空襲敘利亞，為地區局勢揭開非常混亂的新篇章。",2025-07-22 04:56,cradio,2025-07-22 05:00,2025-07-22 04:56:00,"美國白宮發言人萊維特說，總統特朗普對以色列近日空襲敘利亞和加沙一座天主教堂，感到措手不及。她指特朗普與以色列總理內塔尼亞胡一直有著良好的工作關係，在兩宗襲擊後，特朗普亦迅速致電對方，要求糾正事態。

美國敘利亞問題特使巴拉克形容，以色列在非常差的時機空襲敘利亞，為地區局勢揭開非常混亂的新篇章。"
2588226,伊俄海軍裏海展開3日聯合海上演習,https://www.881903.com/news/international/2588226,international,"伊朗和俄羅斯海軍在裏海展開3日聯合海上演習。
演習由伊朗北方艦隊主辦，分陸上和海上兩個階段，兩國海軍艦艇、伊朗革命衛隊海軍和伊朗警察都有參與，裏海沿岸多個國家的代表，就以觀察員身分出席。伊朗軍方期望促進沿岸國家間的合作和協調，確保商船安全。
伊朗防長納希爾扎德同日到訪莫斯科，與俄羅斯防長別洛烏索夫會面，討論加強軍事和防務合作。",2025-07-22 04:38,cradio,2025-07-22 04:45,2025-07-22 04:38:00,"伊朗和俄羅斯海軍在裏海展開3日聯合海上演習。

演習由伊朗北方艦隊主辦，分陸上和海上兩個階段，兩國海軍艦艇、伊朗革命衛隊海軍和伊朗警察都有參與，裏海沿岸多個國家的代表，就以觀察員身分出席。伊朗軍方期望促進沿岸國家間的合作和協調，確保商船安全。

伊朗防長納希爾扎德同日到訪莫斯科，與俄羅斯防長別洛烏索夫會面，討論加強軍事和防務合作。"
