id,title,url,section,lead,date,source,scrape_time,last_update,news_content
2604463,美國科技公司謀算力上太空 解決發電瓶頸,https://www.881903.com/news/international/2604463,international,"電力供應緊缺成為美國AI數據中心建設的關鍵瓶頸。多家科技公司正計劃效法中國的""星算計劃""，在太空構建數據中心，借助用之不竭的太陽能和太空的極低溫度營運。
富事高諮詢(FTI Consulting)預測，美國數據中心的能源需求，在2027年前將幾乎翻倍，大型數據中心的負載接入請求，已使公用事業公司與電網容量不堪重負。
Google的行政總裁皮查伊(Sundar Pichai)在社交媒體指，他們設計用...",2025-11-07 12:09,cradio,2025-11-07 12:15,2025-11-07 12:09:00,"電力供應緊缺成為美國AI數據中心建設的關鍵瓶頸。多家科技公司正計劃效法中國的""星算計劃""，在太空構建數據中心，借助用之不竭的太陽能和太空的極低溫度營運。

富事高諮詢(FTI Consulting)預測，美國數據中心的能源需求，在2027年前將幾乎翻倍，大型數據中心的負載接入請求，已使公用事業公司與電網容量不堪重負。

Google的行政總裁皮查伊(Sundar Pichai)在社交媒體指，他們設計用於人工智能的芯片TPU(張量處理器)即將進入太空。指Google啟動一項名為""太陽捕手""(Suncatcher)的計劃，探索在太空中構建可擴展的機器學習計算系統。

SpaceX的行政總裁馬斯克近日亦表示，SpaceX將在太空中建設數據中心。只需將配備高速激光鏈路的Starlink V3衛星規模擴大就可以。亞馬遜創始人貝索斯早前亦表示，未來10到20年，人類將能夠在太空建造吉瓦級數據中心。

Google同衛星圖像公司Planet Labs合作，計劃在2027年初發射2顆衛星，探索建設大規模太空數據中心集群的可能性。太空計算公司Starcloud計劃在今年11月，發射一顆載有輝達H100 GPU的衛星進入太空，衛星重約60公斤，體型與一台小型雪櫃接近，預計將提供比以往其他太空運算設施高出100倍的GPU算力。公司計劃未來建造一座5吉瓦的軌道數據中心，配備超大型太陽能和冷卻電池板，寬度和長度約4公里。

Google近日一篇論文分析，高昂的發射成本一直是建造大規模太空系統的主要障礙，但根據歷史數據和對發射價格的預測，到21世紀30年代中期，成本可能會下降到每公斤200美元以下，可能和同等規模的地面數據中心能源成本大致相當。

在剛剛開幕的2025年世界互聯網大會“互聯網之光”博覽會上，國星宇航自主研發的“零碳太空計算中心”脫穎而出，獲評本年度十大精品首發成果。彰顯了我國在“人工智能+商業航天”領域的全球競爭力。

至於中國，今年5月，國星宇航""星算計劃""首批12顆計算衛星，已成功發射入軌，是全球首個成功組網並投入運行的太空計算衛星星座，令中國在太空算力的實戰部署領先，運作以來，已經為之江實驗室，中國科學院空天信息創新研究院等多家科研機構，提供在軌計算服務。9月又和AI公司佳都科技，聯合開展交通行業模型算法上星運行，標誌零碳太空計算中心進入常態化商業運營。"
2604462,港股半日跌逾300點　快手泡泡挫5%信義光能升6%,https://www.881903.com/news/finance/2604462,finance,"港股半日跌逾300點，恒生指數低開135點，中午報26183點，跌302點，大市成交1151億元；國企指數9251點，跌104點；恒生科技指數5825點，跌118點。

科網平台股向下，騰訊(00700.HK)跌2%，報629.5元；阿里巴巴(09988.HK)跌近3%，報160.3元；京東(09618.HK)跌逾2%，報123.6元；美團(03690.HK)跌逾2%，報101元；快手(01024...",2025-11-07 12:03,cradio,2025-11-07 12:15,2025-11-07 12:03:00,"港股半日跌逾300點，恒生指數低開135點，中午報26183點，跌302點，大市成交1151億元；國企指數9251點，跌104點；恒生科技指數5825點，跌118點。

科網平台股向下，騰訊(00700.HK)跌2%，報629.5元；阿里巴巴(09988.HK)跌近3%，報160.3元；京東(09618.HK)跌逾2%，報123.6元；美團(03690.HK)跌逾2%，報101元；快手(01024.HK)跌逾5%，報68.45元，是半日跌幅最大藍籌。小米(01810.HK)跌3%，報42.08元。

晶片股回落，華虹半導體(01347.HK)第3季少賺42.6%，大行看法不一，股價跌近3%，報77.85元。中芯國際(00981.HK)跌2%，報75.25元。

泡泡瑪特(09992.HK)跌逾5%，報205.6元。

信義光能(00968.HK)升逾6%，報3.93元，是半日升幅最大藍籌。

大麥娛樂(01060.HK)發盈喜，預料半年純利最少5億，股價升3%，報0.97元。

大家樂(00341.HK.HK)發盈警，預料中期少賺7成，股價跌逾3%，報6.06元。

永利澳門(01128.HK)母企第3季澳門業務經調整物業EBITDAR按年增17%，股價跌斤2%，報6.52元。

新地(00016.HK)投得港鐵屯門第16區站第一期項目，預計總投資約60億元，股價升0.1元，報97.65元。"
2604461,特朗普指對撤銷伊朗制裁持開放態度,https://www.881903.com/news/international/2604461,international,"美國總統特朗普表示，伊朗一直有要求美方解除制裁，指德黑蘭面對華府的嚴厲限制，無法落實行動計劃，他願意聽取相關訴求，對撤銷制裁持開放態度。
伊朗最高精神領袖哈梅內伊早前表示，近期都不會考慮美國提出的合作請求，指除非美國徹底停止支持以色列、撤走中東部署的軍事基地，以及停止干涉伊朗內政，才會考慮與華府合作。 伊朗外交部確認，各方正通過不同渠道努力促成伊美接觸，雙方通過中間人傳遞信息，但不代表伊朗與美國已...",2025-11-07 11:50,cradio,2025-11-07 12:00,2025-11-07 11:50:00,"美國總統特朗普表示，伊朗一直有要求美方解除制裁，指德黑蘭面對華府的嚴厲限制，無法落實行動計劃，他願意聽取相關訴求，對撤銷制裁持開放態度。

伊朗最高精神領袖哈梅內伊早前表示，近期都不會考慮美國提出的合作請求，指除非美國徹底停止支持以色列、撤走中東部署的軍事基地，以及停止干涉伊朗內政，才會考慮與華府合作。 伊朗外交部確認，各方正通過不同渠道努力促成伊美接觸，雙方通過中間人傳遞信息，但不代表伊朗與美國已啟動談判進程。

美伊雙方今年曾舉行多輪間接核談判，但美國於6月與以色列聯手攻擊伊朗核設施，導致談判中止。"
2604459,達里奧：量寬變相回歸將吹大泡沫 重演流動性狂潮,https://www.881903.com/news/finance/2604459,finance,"橋水基金創辦人達里奧在社交網站發文，指聯儲局主席鮑威爾聲稱""將在適當時機重新增加儲備""，意味著量化寬鬆(QE)正在回歸，但當前市場已經存在大量泡沫，與以往經濟衰退時實行量寬完全不同，可能會導致1999年泡沫破裂前夕的流動性狂潮重演。
鮑威爾近日表示，隨著銀行體系和經濟規模擴大，聯儲局將在適當時機，重新增加儲備。達里奧認為，意味著QE正在回歸，只不過包裝成""技術性操作""。
達里奧強調，歷史上，量寬通...",2025-11-07 11:33,cradio,2025-11-07 11:45,2025-11-07 11:33:00,"橋水基金創辦人達里奧在社交網站發文，指聯儲局主席鮑威爾聲稱""將在適當時機重新增加儲備""，意味著量化寬鬆(QE)正在回歸，但當前市場已經存在大量泡沫，與以往經濟衰退時實行量寬完全不同，可能會導致1999年泡沫破裂前夕的流動性狂潮重演。

鮑威爾近日表示，隨著銀行體系和經濟規模擴大，聯儲局將在適當時機，重新增加儲備。達里奧認為，意味著QE正在回歸，只不過包裝成""技術性操作""。

達里奧強調，歷史上，量寬通常在經濟衰退或極度疲弱時實施，但當前情況完全相反。資產估值處於高位並持續上漲，標普500盈利收益率為4.4%，10年期美債名義收益率為4%，實際收益率約1.8%，股權風險溢價僅約0.3%。經濟相對強勁，過去一年實際增長率平均為2%，失業率僅4.3%。這種環境下實施量寬，構成了火上加油(stimulus into a bubble)的情況。

他再次警告，美國的""大債務周期""，已進入最危險階段，市場不應該忽視。他指，當美債供應量大於需求量，聯儲局""印鈔""購買債券，而財政部以出售縮債，彌補長債需求缺口，都是典型的""大債務周期""的後期現象。

達利歐指，短期市場或出現類似1999年互聯網泡沫破裂前夕，或2010至2011年量寬時期的""流動性狂歡""(liquidity melt-up)，但亦往往意味泡沫膨脹更快，通脹更難控制，風險累積加深。而當政策被迫反轉時，代價亦將更大。

他預期QE將推低實際利率，通過壓縮風險溢價增加流動性，推升市盈率倍數，特別有利於需要長期投資的資產(科技、AI、增長股)，和通脹對沖資產如黃金。一旦市場重新警覺通脹風險，礦業、基礎設施等有形資產公司，可能跑贏科技股。"
2604458,聯儲局官員對下月減息否見分歧　古爾斯比憂無數據哈瑪克憂通脹,https://www.881903.com/news/finance/2604458,finance,"市場注視美國聯儲局下月議息會議是否繼續減息，主席鮑威爾早前表明12月減息遠非定局，聯儲局官員對12月是否減息分歧加劇。
擁有今年聯儲局公開市場委員會投票權的芝加哥聯儲銀行行長古爾斯比（Austan Goolsbee）表示，政府停擺導致關鍵通脹數據不明，對進一步減息持謹慎態度。
他解釋，如果通脹出現問題，要相當長一段時間才能看到，但如果是就業市場開始惡化，幾近立即會知道，因此對提前減息並假設過去三月...",2025-11-07 11:24,cradio,2025-11-07 11:30,2025-11-07 11:24:00,"市場注視美國聯儲局下月議息會議是否繼續減息，主席鮑威爾早前表明12月減息遠非定局，聯儲局官員對12月是否減息分歧加劇。

擁有今年聯儲局公開市場委員會投票權的芝加哥聯儲銀行行長古爾斯比（Austan Goolsbee）表示，政府停擺導致關鍵通脹數據不明，對進一步減息持謹慎態度。

他解釋，如果通脹出現問題，要相當長一段時間才能看到，但如果是就業市場開始惡化，幾近立即會知道，因此對提前減息並假設過去三月所見通脹只是暫時性的觀點感到不安。

同樣擁有投票權的聯儲局理事巴爾(Michael Barr)表示，仍需努力將通脹降至聯儲局2%的目標水準，並且必須注意確保勞動力市場穩健。他指，在降低通脹方面已取得了很大進展，但仍有一些工作要做，目前經濟有點分化，大多數富裕家庭狀況良好，但許多低收入家庭卻舉步維艱。

巴爾表示，人工智能崛起帶來的勞動市場動盪，將在就業數據中反映，目前處於低招聘、低解僱的經濟形勢。不過他對AI前景持樂觀態度，長遠而言會出現新的就業機會，現有工作也會變得更具生產力，亦看好引入生成式AI，將幫助經濟更好地增長。

今年沒有投票權的克利夫蘭聯邦儲備銀行行長哈瑪克(Beth Hammack)主張貨幣政策應繼續對通脹施加下行壓力。她說，對聯儲局而言，通脹風險仍大於勞動力市場走弱，她預計通脹要到2026年後的一兩年才能達到聯儲局2%的目標，意味著聯儲局將在近十年時間裡無法實現價格目標，面臨著使高通脹長期存在於經濟中的風險。

哈瑪克說，應該對政策利率採取略具限制性的立場，以確保通脹率及時回落至2%，目前的利率設定幾乎不具有限制性。上月聯儲局減息四分一厘，聯邦基金利率回落至3.75至4厘。哈瑪克表示，她更傾向於維持利率不變。

紐約聯儲銀行行長威廉斯(John Williams)表示，模型對美國中性利率的估算低於債市的預期，他認為債市的估計值並不可靠，即使中性利率更高，不意味可以完全不再擔憂利率下限的問題，他認為低中性利率的時代仍未過去。

至於獲美國總統特朗普支持、最近才加入聯儲局的理事米蘭(Stephen Miran)

預計12月會繼續減息。他指，若以每次減息半厘的幅度，可達到中性利率，而聯儲局其他官局希望，以每次四分一厘的步伐調整，但有些不參與投票的官員則可能不希望減息，所以12月是否減息的最終結果並非絕對確定。"
2604457,內地10月出口以美元計跌1.1%進口升1%　均遜預期,https://www.881903.com/news/china/2604457,china,"內地10月份以美元計進出口總值5206.3億美元，按年跌0.3%，出口3053.5億美元，按年跌1.1%，差過市場預期升2.9%；進口2152.8億美元，按年增1%，少過市場預期升2.7%。貿易順差900.7億美元。
首10個月進出口總值52046億美元，按年多2.7%，出口30847.1億美元，按年多5.3%，進口21198.9億美元，按年跌0.9%。
以人民幣計，進出口總值3.7萬億元人民幣，...",2025-11-07 11:11,cradio,2025-11-07 11:15,2025-11-07 11:11:00,"內地10月份以美元計進出口總值5206.3億美元，按年跌0.3%，出口3053.5億美元，按年跌1.1%，差過市場預期升2.9%；進口2152.8億美元，按年增1%，少過市場預期升2.7%。貿易順差900.7億美元。

首10個月進出口總值52046億美元，按年多2.7%，出口30847.1億美元，按年多5.3%，進口21198.9億美元，按年跌0.9%。

以人民幣計，進出口總值3.7萬億元人民幣，按年增長0.1%。出口2.17萬億元人民幣，按年下降0.8%，而進口1.53萬億元人民幣，按年增長1.4%，已連續5個月增長。

今年前10個月貨物貿易進出口平穩增長，進出口總值37.31萬億元人民幣，按年增長3.6%。其中對共建一帶一路國家進出口19.28萬億元人民幣，按年增長5.9%，佔外貿總值的51.7%。"
2604455,OpenAI否認謀政府托底 科技股仍受壓,https://www.881903.com/news/finance/2604455,finance,"美國科技股引領大市下跌，OpenAI財務總監弗萊爾(Sarah Friar)在一場活動表示，公司正在尋求構建由銀行、私募基金，甚至聯邦政府""托底"" (backstop)或""擔保""(guarantee)組成的生態體系，為公司的巨額芯片投資，提供融資支持。弗萊爾的言論，引發市場憂慮AI行業估值的合理性。
納指收巿報23053點，下跌445點，跌幅1.9%。道指下跌0.84%，標普500指數下跌1.12...",2025-11-07 10:58,cradio,2025-11-07 11:15,2025-11-07 10:58:00,"美國科技股引領大市下跌，OpenAI財務總監弗萊爾(Sarah Friar)在一場活動表示，公司正在尋求構建由銀行、私募基金，甚至聯邦政府""托底"" (backstop)或""擔保""(guarantee)組成的生態體系，為公司的巨額芯片投資，提供融資支持。弗萊爾的言論，引發市場憂慮AI行業估值的合理性。

納指收巿報23053點，下跌445點，跌幅1.9%。道指下跌0.84%，標普500指數下跌1.12%。芯片股AMD跌超過7%，特斯拉、輝達、英特爾跌超3%，Meta、甲骨文、亞馬遜跌超過2%。

有""AI沙皇""之稱的白宮AI事務專員薩克斯(Davie Sacks)明確表態，美國政府不會為AI產業提供救助，指美國至少有5家主要的前沿AI模型公司，如果一家倒閉，其他公司將取而代之。但他同時表示，白宮的確希望簡化相關許可流程，並促進電力供應，以支持行業發展。

隨著輿情升溫，弗萊爾發帖澄清，強調OpenAI目前並沒有尋求政府承諾，為公司的基建投資""托底""，又指使用“托底”(backstop)一詞導致本意被混淆。

而OpenAI行政總裁奧爾特曼為了一步平息市場疑慮，亦在收市前發布超長帖文，回應市場一系列問題。他表示，OpenAI不想也不會尋求政府為其數據中心提供擔保，同時不會尋求""大到不能倒""的特殊地位，如果公司最終運營不善，應該倒閉就倒閉。

針對市場關注OpenAI如何支付承諾的1.4萬億美元投資，奧爾特曼以業績預期作回應，指OpenAI的年化收入預計將超過200億美元，並在2030年達到""數千億美元""，公司即將推出值得期待的""企業級產品""，同時預期在消費電子和機器人領域大展拳腳。

他又解釋弗萊爾的言論核心，是希望美國政府建立""國家戰略算力儲備""，通過大量簽訂算力採購協議，來支持行業發展，但相關舉措應服務於公共利益，而非幫助某家私營公司獲利。"
2604453,全運會單車公路賽明舉行　港珠澳大橋通關服務將暫停,https://www.881903.com/news/local/2604453,local,全運會公路單車賽男子個人賽明早舉行，賽道以港珠澳大橋串聯粵港澳三地，運輸署提醒明天需使用港珠澳大橋出入境的市民，要留意臨時交通管制及口岸通關特別安排，其中港珠澳大橋香港口岸離境通關服務，預計明日下午12時30分後恢復，交通將較繁忙，由於珠海市內道路因比賽需封閉至下午約2時30分，香港往珠海的金巴會在下午12時30分至1時30分提供有限度服務，呼籲旅客應避免急於前往香港口岸，至於珠海前往香港的金巴，...,2025-11-07 10:39,cradio,2025-11-07 10:45,2025-11-07 10:39:00,全運會公路單車賽男子個人賽明早舉行，賽道以港珠澳大橋串聯粵港澳三地，運輸署提醒明天需使用港珠澳大橋出入境的市民，要留意臨時交通管制及口岸通關特別安排，其中港珠澳大橋香港口岸離境通關服務，預計明日下午12時30分後恢復，交通將較繁忙，由於珠海市內道路因比賽需封閉至下午約2時30分，香港往珠海的金巴會在下午12時30分至1時30分提供有限度服務，呼籲旅客應避免急於前往香港口岸，至於珠海前往香港的金巴，預計下午2時30分恢復，而香港往來澳門的金巴下午12時30分恢復。運輪署已指示金巴預留足夠人和車，應對乘客需求，市民及旅客應盡量使用其他陸路口岸
2604451,日本自前年8月以來首次恢復對華出口水產,https://www.881903.com/news/china/2604451,china,"日本自中國前年8月實施禁令而來，首次恢復對華出口水產品。農林水產大臣鈴木憲和表示，約6噸的北海道冷凍扇貝前日已經出口到中國，下周二會再出口海參等產品。

中國在2023年8月，因應福島第一核電站把核污水排海而全面停止入口日本水產。中日雙方到今年6月達成共識，中方有條件放寬禁令，恢復進口宮城、福島等10個都縣以外的日本水產品。

在北京，外交部早前表示，是基於各方開展監測的數據等科學證據，及審慎分析...",2025-11-07 10:25,cradio,2025-11-07 10:45,2025-11-07 10:25:00,"日本自中國前年8月實施禁令而來，首次恢復對華出口水產品。農林水產大臣鈴木憲和表示，約6噸的北海道冷凍扇貝前日已經出口到中國，下周二會再出口海參等產品。

中國在2023年8月，因應福島第一核電站把核污水排海而全面停止入口日本水產。中日雙方到今年6月達成共識，中方有條件放寬禁令，恢復進口宮城、福島等10個都縣以外的日本水產品。

在北京，外交部早前表示，是基於各方開展監測的數據等科學證據，及審慎分析研究，並得到日方承諾採取一系列可信、可視措施，保障輸華水產品質量安全，才決定恢復進口，但同時重申中方反對核污水排海的立場沒有變化，將繼續同國際社會敦促日方，以長期實際行動切實管控排海風險。"
2604449,土瓜灣三關員遇襲案　據報警方拘捕兩名涉案男子,https://www.881903.com/news/local/2604449,local,"3名海關人員昨日在土瓜灣緝毒期間遇襲受傷的案件，消息指，警方凌晨分別在旺角及九龍城拘捕2名涉案疑犯，相信兩人並非斬人的兇徒，只是協助疑犯逃走，正扣留調查。

事發在昨日下午5時許，3名海關人員在安定大廈緝毒期間，截查一名男疑犯，並將他帶回一個單位內，準備搜查毒品。疑犯隨即進入廚房，用菜刀施襲，3名關員手腳被斬傷。疑犯在施襲後關上單位的門，警方其後破門進入，發現屋內空無一人，懷疑疑犯經廚房窗戶逃離現...",2025-11-07 10:12,cradio,2025-11-07 10:15,2025-11-07 10:12:00,"3名海關人員昨日在土瓜灣緝毒期間遇襲受傷的案件，消息指，警方凌晨分別在旺角及九龍城拘捕2名涉案疑犯，相信兩人並非斬人的兇徒，只是協助疑犯逃走，正扣留調查。

事發在昨日下午5時許，3名海關人員在安定大廈緝毒期間，截查一名男疑犯，並將他帶回一個單位內，準備搜查毒品。疑犯隨即進入廚房，用菜刀施襲，3名關員手腳被斬傷。疑犯在施襲後關上單位的門，警方其後破門進入，發現屋內空無一人，懷疑疑犯經廚房窗戶逃離現場。案件列作傷人、販運危險藥物及管有仿製槍械，交由西九龍總區重案組跟進。"
2604445,花旗上調華虹評級至買入　大摩看淡維持減持,https://www.881903.com/news/finance/2604445,finance,"華虹半導體(01347.HK)第3季純利2572.5萬美元，按年跌42.6%，期內銷售收入6.35億美元創新高，按年升20.7%。
花旗稱，華虹第3季純利略低於市場預期，但由於更高的產能利用率和更好的平均售價，毛利率13.5%好於10%至12%的指引，決定上調公司評級至買入，將目標價大幅上調約133%至105元。
花旗表示，內地需求仍是營收的主要貢獻來源，佔到82%，美國市場亦增長36%，歐洲也有...",2025-11-07 10:01,cradio,2025-11-07 10:15,2025-11-07 10:01:00,"華虹半導體(01347.HK)第3季純利2572.5萬美元，按年跌42.6%，期內銷售收入6.35億美元創新高，按年升20.7%。

花旗稱，華虹第3季純利略低於市場預期，但由於更高的產能利用率和更好的平均售價，毛利率13.5%好於10%至12%的指引，決定上調公司評級至買入，將目標價大幅上調約133%至105元。

花旗表示，內地需求仍是營收的主要貢獻來源，佔到82%，美國市場亦增長36%，歐洲也有13%增長，因考慮到客戶「在中國製造服務中國市場」的策略，公司短期營業利潤可能仍有壓力，但預計將有結構性改善。

摩根士丹利則看淡，指華虹短期利潤率正在回升，但競爭壓力和收購策略影響長期前景，在內地競爭壓力下，對中國成熟製程的持久性持謹慎態度。華虹2026年預測市淨率2.7倍，與2014至2025年的歷史均值相比看起來不具備吸引力。維持對華虹的減持評級，目標價60元。

華虹初段股價跌近3%，報77.95元。"
2604444,發展局管控處已節省近2千億元建造成本,https://www.881903.com/news/local/2604444,local,"發展局指，轄下的項目策略及管控處成立至今，已審視超過540項基本工程項目，從原本總預算約1.2萬億元中，成功節省約1,900億港元建造成本，節省比例約16%。發展局2019年成立管控處，以獨立第三方身份審視工程項目的預算，並提出優化方案，減省建造成本。
發展局去年完成了策略性研究，分析建造成本相對高的原因，並制定四大改革方向，包括優化項目採購模式；檢視建築設計標準和要求；應用科技及建造技術；以及精...",2025-11-07 09:57,cradio,2025-11-07 10:00,2025-11-07 09:57:00,"發展局指，轄下的項目策略及管控處成立至今，已審視超過540項基本工程項目，從原本總預算約1.2萬億元中，成功節省約1,900億港元建造成本，節省比例約16%。發展局2019年成立管控處，以獨立第三方身份審視工程項目的預算，並提出優化方案，減省建造成本。

發展局去年完成了策略性研究，分析建造成本相對高的原因，並制定四大改革方向，包括優化項目採購模式；檢視建築設計標準和要求；應用科技及建造技術；以及精簡審批流程，局方會以「一項推一項」方式逐步改革。

明年與前海推試行工程合約模式

發展局指，正與前海管理局探討於明年挑選試點項目，在建造階段採用香港的「新工程合約」（NEC）模式，倡議業主和承建商以夥伴合作精神互動。

本地方面，發展局將於明年上半年試行「中央集中採購」，率先應用於包括鋼筋和「組裝合成」構件等常用物料，以節省成本。亦將推出政策，明年內規定在工務工程項目，應用建造機械人及AI技術。"
2604443,本港九九金開市跌220元,https://www.881903.com/news/finance/2604443,finance,本港金價方面，九九金開市36970元，跌220元,2025-11-07 09:57,cradio,2025-11-07 10:00,2025-11-07 09:57:00,本港金價方面，九九金開市36970元，跌220元
2604442,內地股市初段向下,https://www.881903.com/news/finance/2604442,finance,內地股市初段向下，上證綜合指數報4001點，跌5點；深證成分指數報13394點，跌58點；兩市成交額3947億元人民幣。創業板指數跌18點。,2025-11-07 09:53,cradio,2025-11-07 10:00,2025-11-07 09:53:00,內地股市初段向下，上證綜合指數報4001點，跌5點；深證成分指數報13394點，跌58點；兩市成交額3947億元人民幣。創業板指數跌18點。
