id,title,url,section,lead,date,source,scrape_time,last_update,news_content
2591977,辛辛那堤網賽丨歌芙8強鬥寶莉妮,https://www.881903.com/news/sports/2591977,sports,"美國辛辛那堤網球公開賽，女單16強賽事，美國的歌芙與意大利的寶莉妮分別淘汰對手，將會在8強碰頭。

2號種子的歌芙在16強對另一位意大利球手邦薩迪，贏直落兩盤6-2及6-4。

7號種子的寶莉妮在另一場16強，以直落兩盤6-1及6-2，淘汰曾需暫停比賽接受治療的捷克球手卡積高娃。

歌芙與寶莉妮曾4次碰頭。歌芙先在硬地贏2次。寶莉妮今年兩次在泥地取勝。",2025-08-15 06:18,cradio,2025-08-15 06:30,2025-08-15 06:18:00,"美國辛辛那堤網球公開賽，女單16強賽事，美國的歌芙與意大利的寶莉妮分別淘汰對手，將會在8強碰頭。

2號種子的歌芙在16強對另一位意大利球手邦薩迪，贏直落兩盤6-2及6-4。

7號種子的寶莉妮在另一場16強，以直落兩盤6-1及6-2，淘汰曾需暫停比賽接受治療的捷克球手卡積高娃。

歌芙與寶莉妮曾4次碰頭。歌芙先在硬地贏2次。寶莉妮今年兩次在泥地取勝。"
2591959,消防犬隊加強訓練搜救犬專注力　並探討引入內地幼犬,https://www.881903.com/news/local/2591959,local,"上月獲頒「行政長官表揚榜」獎項的緬甸地震災區特區救援隊，除了有51名隊員，還有兩隻來自消防犬隊的搜救犬。犬隊透過地震救災經驗，加強訓練牠們的專注力和獨立性；年底會到國家搜救犬訓練基地交流，學習飼養和訓練方法，未來有機會引入內地幼犬。
 參與過兩次海外救災　獲行政長官表揚榜獎項

搜救犬Umi和Twix平日很安靜，只會在訓練時吠叫，代表找到傷者的警號。牠們隸屬消防處消防犬隊，早在兩年前土耳其地震時，...",2025-08-15 06:00,cradio,2025-08-15 06:15,2025-08-15 06:00:00,"上月獲頒「行政長官表揚榜」獎項的緬甸地震災區特區救援隊，除了有51名隊員，還有兩隻來自消防犬隊的搜救犬。犬隊透過地震救災經驗，加強訓練牠們的專注力和獨立性；年底會到國家搜救犬訓練基地交流，學習飼養和訓練方法，未來有機會引入內地幼犬。

參與過兩次海外救災　獲行政長官表揚榜獎項

搜救犬Umi和Twix平日很安靜，只會在訓練時吠叫，代表找到傷者的警號。牠們隸屬消防處消防犬隊，早在兩年前土耳其地震時，加入特區救援隊前赴當地救災，今年3月緬甸地震亦有參與救援，救援隊上月更榮獲「行政長官表揚榜」獎項。

Twix的領犬員蔣天朗說，災區情況惡劣，有些地方只能由身軀細小的搜救犬進入。「當時建築物3樓或以上已倒塌，搜索環境非常漆黑和狹窄。在那麼狹窄的空間中，只有搜救犬搜索到，我們領犬員都不能進入。緬甸天氣炎熱，避免日曬時出動，保留牠們的體力，留在夜晚時搜索。」

總結經驗　加強訓練專注力

蔣天朗說，搜救犬最重要的工作是靠靈敏的嗅覺，探查災區範圍內是否有生還者。不過緬甸此行發現，牠們容易被聲音和氣味干擾。領犬員回港後總結經驗，加強訓練搜救犬的專注力。「大型災區往往會出現很多干擾因素，所以訓練中加入聲音和氣味干擾因素，務求搜救犬在搜救時保持專注力，訓練後成效相當好，在訓練中保持專注力。」

蔣天朗由搜救犬Twix出生開始照顧牠，他說今次救災強化了人狗之間的信任，現在已把牠當作家人：「會不會見小狗多過家人？事實上是的，我每天早上8時回到消防處，和牠訓練和日常生活到下午5時 ，我回家對兒子和太太的時間，也只有幾小時。」

年底到昆明交流　未來或引進內地犬

兩隻搜救犬今年4歲，工作多4年就會退役，消防處會在牠們退役前兩年，開始培育新犬。會由誰接任？消防處指，有機會是來自內地的「同胞」。犬隊今年末會派員赴雲南昆明的國家搜救犬訓練基地，與中國救援雲南搜救犬機動專業支隊交流，學習飼養和搜救方法，亦會探討引入內地幼犬到港的可能性。

消防處代表高級消防隊長祝山珩：「因為國家搜救犬歷史比較悠久，有更加完整的體系，我們會學習飼養和搜救的科目。引入幼犬方面，他們也有用到現在消防處的是史賓格跳犬和拉布拉多尋回犬。我們也有與當地接洽，可以一起探討可能性。我們現在目標也是引入這兩款犬隻。」

消防犬隊現時一共有7隻犬，包括5隻搜救犬和2隻火警調查犬。除了地震救災，每當本港有山泥傾潟、樓宇倒塌等大型事故，牠們也有機會出動。"
2591976,辛辛那堤網賽丨辛納晉級4強,https://www.881903.com/news/sports/2591976,sports,"美國辛辛那堤網球公開賽，衛冕男單冠軍，一哥、意大利的辛納在8強以直落兩盤淘汰23號種子，加拿大的阿利亞森，取得4強席位。
辛納在2022年兩度對阿利亞森都落敗。他今場開局佔盡上風，以6-0橫掃阿利亞森，第二盤再贏6-2，用了71分鐘結束賽事。辛納賽後表示，今場接發球表現出色，在阿利亞森第二發球的得分率達到8成，是取勝的關鍵。",2025-08-15 05:41,cradio,2025-08-15 05:45,2025-08-15 05:41:00,"美國辛辛那堤網球公開賽，衛冕男單冠軍，一哥、意大利的辛納在8強以直落兩盤淘汰23號種子，加拿大的阿利亞森，取得4強席位。

辛納在2022年兩度對阿利亞森都落敗。他今場開局佔盡上風，以6-0橫掃阿利亞森，第二盤再贏6-2，用了71分鐘結束賽事。辛納賽後表示，今場接發球表現出色，在阿利亞森第二發球的得分率達到8成，是取勝的關鍵。"
2591975,以色列西岸定居點增建房屋　揚言葬送巴國構想,https://www.881903.com/news/international/2591975,international,"以色列極右翼財長斯莫特里奇宣布，在以色列佔領的約旦河西岸展開新的定居點建設項目，興建超過3000間房屋，切斷約旦河西岸與東耶路撒冷，揚言是葬送建立巴勒斯坦國的構想。

由於受到國際社會強烈反對，以色列多年來凍結有關計劃。斯莫特里奇表示，已獲總理內塔尼亞胡及美國總統特朗普同意重啟項目。美國國務院發言人回應指，穩定的西岸保障以色列的安全，亦符合實現地區和平的目標，又指華府目前仍專注結束加沙戰事。歐盟外...",2025-08-15 05:13,cradio,2025-08-15 05:30,2025-08-15 05:13:00,"以色列極右翼財長斯莫特里奇宣布，在以色列佔領的約旦河西岸展開新的定居點建設項目，興建超過3000間房屋，切斷約旦河西岸與東耶路撒冷，揚言是葬送建立巴勒斯坦國的構想。

由於受到國際社會強烈反對，以色列多年來凍結有關計劃。斯莫特里奇表示，已獲總理內塔尼亞胡及美國總統特朗普同意重啟項目。美國國務院發言人回應指，穩定的西岸保障以色列的安全，亦符合實現地區和平的目標，又指華府目前仍專注結束加沙戰事。歐盟外交與安全政策高級代表卡拉斯要求以色列停止推動計劃，警告會違反國際法，並對兩國解決方案的前景造成不可挽回的損害。"
2591974,美股個別發展　道指下跌11點,https://www.881903.com/news/finance/2591974,finance,"紐約股巿個別發展。美國上月生產者價格指數升幅高過市場預期。
道瓊斯工業平均指數收巿報44911點，下跌11點。
納斯達克指數收巿報21710點，下跌2點。
標普五百指數連續三日創新高，收巿報6468點，上升1點。",2025-08-15 04:34,cradio,2025-08-15 05:00,2025-08-15 04:34:00,"紐約股巿個別發展。美國上月生產者價格指數升幅高過市場預期。

道瓊斯工業平均指數收巿報44911點，下跌11點。

納斯達克指數收巿報21710點，下跌2點。

標普五百指數連續三日創新高，收巿報6468點，上升1點。"
2591973,紐約期油上升2.1%,https://www.881903.com/news/finance/2591973,finance,油價上升。紐約期油收巿報63.96美元，上升1.31美元，升幅2.1%。,2025-08-15 03:53,cradio,2025-08-15 04:15,2025-08-15 03:53:00,油價上升。紐約期油收巿報63.96美元，上升1.31美元，升幅2.1%。
2591972,梅拉尼婭發律師信　亨特拒收回涉愛潑斯坦言論,https://www.881903.com/news/international/2591972,international,被美國第一夫人梅拉尼婭發律師信的前總統拜登兒子亨特，無意收回有關梅拉尼婭，與涉及性交易案的已故富商愛潑斯坦的言論。亨特早前接受訪問，指梅拉尼婭是由愛潑斯坦介紹給總統特朗普認識，兩人並在2005年結婚。梅拉尼婭的律師指有關說法虛假、貶損、誹謗及具煽動性，要求亨特收回言論及道歉，否則賠償10億美元。亨特指有關威脅袛是想分散注意力。,2025-08-15 03:29,cradio,2025-08-15 03:45,2025-08-15 03:29:00,被美國第一夫人梅拉尼婭發律師信的前總統拜登兒子亨特，無意收回有關梅拉尼婭，與涉及性交易案的已故富商愛潑斯坦的言論。亨特早前接受訪問，指梅拉尼婭是由愛潑斯坦介紹給總統特朗普認識，兩人並在2005年結婚。梅拉尼婭的律師指有關說法虛假、貶損、誹謗及具煽動性，要求亨特收回言論及道歉，否則賠償10億美元。亨特指有關威脅袛是想分散注意力。
2591971,歐洲股巿上升,https://www.881903.com/news/finance/2591971,finance,"歐洲股巿上升。
英國股巿收巿報9177點，上升12點。
法國股巿收巿報7870點，上升65點。
德國股巿收巿報24377點，上升191點。",2025-08-15 01:11,cradio,2025-08-15 01:15,2025-08-15 01:11:00,"歐洲股巿上升。

英國股巿收巿報9177點，上升12點。

法國股巿收巿報7870點，上升65點。

德國股巿收巿報24377點，上升191點。"
2591970,特朗普預料與普京峰會有25%機會失敗,https://www.881903.com/news/international/2591970,international,"美國總統特朗普接受傳媒訪問，預料周五在阿拉斯加與俄羅斯總統普京舉行的峰會，有25%機會失敗，兩人亦不會召開聯合記者會。但如果會談順利，他會致電烏克蘭總統澤連斯基，安排另一次會面，指他的目標是與普京及澤連斯基舉行三方會談，他心目中有三個開會地點，包括阿拉斯加。
特朗普以棋局形容同普京的會談，指他不肯定會否令俄烏立即停火，但認為普京希望達成協議，結束戰事，又指俄羅斯及烏克蘭需要就邊界問題達成妥協。",2025-08-15 00:55,cradio,2025-08-15 01:00,2025-08-15 00:55:00,"美國總統特朗普接受傳媒訪問，預料周五在阿拉斯加與俄羅斯總統普京舉行的峰會，有25%機會失敗，兩人亦不會召開聯合記者會。但如果會談順利，他會致電烏克蘭總統澤連斯基，安排另一次會面，指他的目標是與普京及澤連斯基舉行三方會談，他心目中有三個開會地點，包括阿拉斯加。

特朗普以棋局形容同普京的會談，指他不肯定會否令俄烏立即停火，但認為普京希望達成協議，結束戰事，又指俄羅斯及烏克蘭需要就邊界問題達成妥協。"
2591951,門票詐騙成最常見網上買賣騙案　Carousell以多層防護阻截騙徒,https://www.881903.com/news/local/2591951,local,"線上買賣平台旋轉拍賣Carousell發布2024年地區詐騙趨勢報告，當中香港地區最常見的詐騙是門票詐騙，以低價出售熱門門票，但實際提供假票或根本無票，其次為假貨詐騙，以超低價出售冒充正貨的仿製品。亦有為數不少是釣魚騙案，騙徒假冒買家，發送模仿Carousell或銀行網站的釣魚連結，又或是透過聊天或短訊假冒Carousell客服，盜取個人及財務資料。

去年Carousell透過多層次安全防護措施...",2025-08-15 00:00,cradio,2025-08-15 00:15,2025-08-15 00:00:00,"線上買賣平台旋轉拍賣Carousell發布2024年地區詐騙趨勢報告，當中香港地區最常見的詐騙是門票詐騙，以低價出售熱門門票，但實際提供假票或根本無票，其次為假貨詐騙，以超低價出售冒充正貨的仿製品。亦有為數不少是釣魚騙案，騙徒假冒買家，發送模仿Carousell或銀行網站的釣魚連結，又或是透過聊天或短訊假冒Carousell客服，盜取個人及財務資料。

去年Carousell透過多層次安全防護措施，在聊天室中攔截128萬條外部連結、72.7萬個電郵地址及2萬個QR code，以減少用戶接觸釣魚詐騙的風險，一共封鎖42.2萬個可疑帳號，並審查了30.9萬宗由用戶提交的社群舉報，阻止騙徒採取進一步行動。

去年8月Carousell在香港推出附有「買家保障」的平台收款與送貨服務，透過與合作夥伴支付寶香港和順豐香港合作，賣家只有在買家確認收到商品後才會收到付款，從而降低買家遭遇未送達詐騙的風險。

勿亂提供個人資料　或轉至其他應用程式對話

Carousell地區業務策略高級經理郭琪藍認為，香港用戶對服務反應良好，亦可減少買賣雙方之間的糾紛。她建議，交易對話全程應該要留在平台溝通，不要胡亂向對方提供個人資料，或轉至其他應用程式對話，亦不要透過Carousell平台以外的連結確認付款。

郭琪藍指，現時平台上詐騙活動出現回落趨勢，收到詐騙訊息的用戶人數自今年5月中的高峰期下降85%，是一年以來最低水平，公司會持續保持警覺，希望確保用戶在平台交易安全。"
2591969,職訓局中華廚藝學院爆手足口病　9人受感染,https://www.881903.com/news/local/2591969,local,"職訓局薄扶林大樓的中華廚藝學院，爆發手足口病個案，最少9人受感染。
衛生署回覆本台查詢時確認，衛生防護中心周二錄得爆發，初步調查顯示，個案涉及6名學生及3名員工。包括8男1女，上周三起先後出現口腔潰瘍、手或腳出紅疹或水疱，及發燒等病徵，全部已經求醫。其中兩人曾入院，當中一人已出院，其餘患者病況輕微，情況穩定。
防護中心已派員實地視察中華廚藝學院，建議所需的感染控制和預防措施，並已為受影響人士安排樣...",2025-08-14 23:27,cradio,2025-08-14 23:30,2025-08-14 23:27:00,"職訓局薄扶林大樓的中華廚藝學院，爆發手足口病個案，最少9人受感染。

衛生署回覆本台查詢時確認，衛生防護中心周二錄得爆發，初步調查顯示，個案涉及6名學生及3名員工。包括8男1女，上周三起先後出現口腔潰瘍、手或腳出紅疹或水疱，及發燒等病徵，全部已經求醫。其中兩人曾入院，當中一人已出院，其餘患者病況輕微，情況穩定。

防護中心已派員實地視察中華廚藝學院，建議所需的感染控制和預防措施，並已為受影響人士安排樣本化驗，及對學院進行醫學監察，個案仍在調查。"
2591968,元朗唐狗被車撞死   九巴：查看駛經巴士片段未發現涉事,https://www.881903.com/news/local/2591968,local,"九巴關注網上有討論指，元朗大馬路前晚有狗隻懷疑被車輛撞到後死亡，查看當晚11時23分至33分，8輛駛經青山公路元朗段西行巴士的行車片段，並無發現九巴撞到狗隻。

九巴對事件中唐狗不幸離世深表難過。指事發現場為繁忙路段，有很多不同車輛經過，會繼續調查希望查出真相。",2025-08-14 23:23,cradio,2025-08-14 23:30,2025-08-14 23:23:00,"九巴關注網上有討論指，元朗大馬路前晚有狗隻懷疑被車輛撞到後死亡，查看當晚11時23分至33分，8輛駛經青山公路元朗段西行巴士的行車片段，並無發現九巴撞到狗隻。

九巴對事件中唐狗不幸離世深表難過。指事發現場為繁忙路段，有很多不同車輛經過，會繼續調查希望查出真相。"
2591966,亞洲盃男籃丨中國挫南韓   時隔10年再闖4強,https://www.881903.com/news/sports/2591966,sports,"在沙特阿拉伯吉達舉行的亞洲盃男子籃球賽，中國79:71擊敗南韓，時隔10年再次晉級四強。

中國半場領先46:35。下半場中國繼續領先，在第4節中段，南韓一度追近至落後6分，胡金秋在關鍵時刻，多次強攻內線得分，中國男籃最終贏8分完場。將會同新西蘭和黎巴嫩的勝方，爭奪決賽席位 。

胡金秋貢獻兩雙，攻入全最多的23分，同搶到11個籃板；20歲新星王俊傑，表現搶眼，全場14投9中，三分球4投3中，取得...",2025-08-14 22:46,cradio,2025-08-14 23:00,2025-08-14 22:46:00,"在沙特阿拉伯吉達舉行的亞洲盃男子籃球賽，中國79:71擊敗南韓，時隔10年再次晉級四強。

中國半場領先46:35。下半場中國繼續領先，在第4節中段，南韓一度追近至落後6分，胡金秋在關鍵時刻，多次強攻內線得分，中國男籃最終贏8分完場。將會同新西蘭和黎巴嫩的勝方，爭奪決賽席位 。

胡金秋貢獻兩雙，攻入全最多的23分，同搶到11個籃板；20歲新星王俊傑，表現搶眼，全場14投9中，三分球4投3中，取得效力國家隊以來最多的21分8籃板。"
2591962,美7月PPI按月意外升0.9%　創3年最大升幅,https://www.881903.com/news/finance/2591962,finance,"美國7月生產者價格指數（PPI）按月升0.9%，是自2022年以來最大升幅；6月是持平，按年亦上升3.3%。兩者都較前一個月高約1個百分點，並高過市場預期。

至於剔除食品和能源價格的核心PPI，按月升0.9%，按年則升3.7%，均高於預期。

服務業成本上升1.1%，為2022年3月以來的最大升幅。在服務業中，批發商和零售商的利潤率躍升2%。美國勞工部的報告指，今年上半年需求放緩，但企業仍在調整...",2025-08-14 22:04,cradio,2025-08-14 22:45,2025-08-14 22:04:00,"美國7月生產者價格指數（PPI）按月升0.9%，是自2022年以來最大升幅；6月是持平，按年亦上升3.3%。兩者都較前一個月高約1個百分點，並高過市場預期。

至於剔除食品和能源價格的核心PPI，按月升0.9%，按年則升3.7%，均高於預期。

服務業成本上升1.1%，為2022年3月以來的最大升幅。在服務業中，批發商和零售商的利潤率躍升2%。美國勞工部的報告指，今年上半年需求放緩，但企業仍在調整商品和服務定價，以抵消美國關稅上升帶來的成本壓力。"
2591960,美股早段向下,https://www.881903.com/news/finance/2591960,finance,"美股早段向下。美國7月生產者價格指數（PPI）高於預期，削弱市場對聯儲局今年內降息的預期。
道瓊斯工業平均指數報44789點，跌133點。
標普500指數報6450點，跌15點。
納斯達克指數報21686點，跌26點。",2025-08-14 21:52,cradio,2025-08-14 22:00,2025-08-14 21:52:00,"美股早段向下。美國7月生產者價格指數（PPI）高於預期，削弱市場對聯儲局今年內降息的預期。

道瓊斯工業平均指數報44789點，跌133點。

標普500指數報6450點，跌15點。

納斯達克指數報21686點，跌26點。"
2591958,警方東九龍打擊白牌車　拘捕2名司機,https://www.881903.com/news/local/2591958,local,"警方下午在東九龍打擊白牌車，警員喬裝乘客，截獲兩輛懷疑白牌車，拘捕兩名30及57歲男司機，涉嫌「利用汽車作非法出租或取酬載客用途」和「沒有第三者保險而使用車輛」；警方其後又在30歲男子車上，檢獲17盒含有尼古丁的煙彈，男子同時涉嫌「管有第一部毒藥」及「管有未完稅香煙」。
兩人正被扣留調查，他們的私家車亦已被扣查作進一步檢驗。",2025-08-14 21:30,cradio,2025-08-14 21:45,2025-08-14 21:30:00,"警方下午在東九龍打擊白牌車，警員喬裝乘客，截獲兩輛懷疑白牌車，拘捕兩名30及57歲男司機，涉嫌「利用汽車作非法出租或取酬載客用途」和「沒有第三者保險而使用車輛」；警方其後又在30歲男子車上，檢獲17盒含有尼古丁的煙彈，男子同時涉嫌「管有第一部毒藥」及「管有未完稅香煙」。

兩人正被扣留調查，他們的私家車亦已被扣查作進一步檢驗。"
2591956,農業部長臨時取消訪日　中方斥日本縱容林佳龍竄訪,https://www.881903.com/news/china/2591956,china,"日本傳媒報道，中國農業農村部長韓俊原定周二訪日，舉行中日農業部長會談，但行程臨時取消，相信與台灣外事機構首長林佳龍早前訪日有關。
在北京，外交部發言人林劍回覆傳媒時指，韓俊是延期訪日，具體原因建議向主管部門詢問。他指責日方縱容林佳龍以所謂「私人身份」竄訪，為「台獨」勢力從事反華分裂活動提供舞台，嚴重違反國際關係基本準則和中日四個政治文件原則，發出嚴重錯誤信號。中方敦促日方深刻反省歷史，汲取歷史教訓...",2025-08-14 21:29,cradio,2025-08-14 21:45,2025-08-14 21:29:00,"日本傳媒報道，中國農業農村部長韓俊原定周二訪日，舉行中日農業部長會談，但行程臨時取消，相信與台灣外事機構首長林佳龍早前訪日有關。

在北京，外交部發言人林劍回覆傳媒時指，韓俊是延期訪日，具體原因建議向主管部門詢問。他指責日方縱容林佳龍以所謂「私人身份」竄訪，為「台獨」勢力從事反華分裂活動提供舞台，嚴重違反國際關係基本準則和中日四個政治文件原則，發出嚴重錯誤信號。中方敦促日方深刻反省歷史，汲取歷史教訓，在台灣問題上謹言慎行，不得以任何形式損害中國主權，不得向「台獨」分裂勢力發出任何錯誤信號。日方如果有誠意同中方開展往來，就應拿出實際行動，切實恪守一中原則，維護中日關係政治基礎，而不是說一套做一套。"
2591955,東盟臨時觀察團視察柬泰邊境地區,https://www.881903.com/news/international/2591955,international,"東盟臨時觀察團今日視察泰柬邊境地區。柬埔寨國防部發言人呼籲泰國秉持停火精神，根據國際法原則和平解決爭端，確保公正、公平的結果。
泰柬因柏威夏古寺歸屬等爭議問題，上月24日在邊境爆發激烈武裝衝突，兩國部隊互相炮轟。泰國更出動F-16戰機實施空襲，兩國逾10萬民衆緊急疏散至安全地區。衝突持續5天，兩國在東盟輪任主席國、馬來西總理安華斡旋下同意停火，兩國今個月7日簽署停火協議。",2025-08-14 21:27,cradio,2025-08-14 21:30,2025-08-14 21:27:00,"東盟臨時觀察團今日視察泰柬邊境地區。柬埔寨國防部發言人呼籲泰國秉持停火精神，根據國際法原則和平解決爭端，確保公正、公平的結果。

泰柬因柏威夏古寺歸屬等爭議問題，上月24日在邊境爆發激烈武裝衝突，兩國部隊互相炮轟。泰國更出動F-16戰機實施空襲，兩國逾10萬民衆緊急疏散至安全地區。衝突持續5天，兩國在東盟輪任主席國、馬來西總理安華斡旋下同意停火，兩國今個月7日簽署停火協議。"
2591953,美俄首腦會晤前夕　俄烏再交換各84名戰俘,https://www.881903.com/news/international/2591953,international,"在美俄首腦會晤前夕，俄烏宣布交換各自84名戰俘。
俄羅斯國防部表示，交換行動是在阿聯酋協調下進行，獲釋的俄方戰俘目前身處白俄羅斯接受治療。烏克蘭總統澤連斯基則指，獲釋的烏方戰俘包括平民和軍人，部分分別自2014、16和17年起已經被俄方關押。",2025-08-14 21:09,cradio,2025-08-14 21:15,2025-08-14 21:09:00,"在美俄首腦會晤前夕，俄烏宣布交換各自84名戰俘。

俄羅斯國防部表示，交換行動是在阿聯酋協調下進行，獲釋的俄方戰俘目前身處白俄羅斯接受治療。烏克蘭總統澤連斯基則指，獲釋的烏方戰俘包括平民和軍人，部分分別自2014、16和17年起已經被俄方關押。"
