id,title,url,section,lead,date,source,scrape_time,last_update,news_content
2590320,李家超晤烏茲別克副總理  冀兩地開拓更多合作空間,https://www.881903.com/news/local/2590320,local,行政長官李家超會見到訪的烏茲別克副總理賈姆希德，就共同關注的議題交流意見。李家超說，近年香港和烏茲別克的經貿關係穩健增長，兩地可共同開拓更多合作空間。香港在「一國兩制」下擁有內聯外通的優勢，積極發揮作為「一帶一路」功能平台的角色。烏茲別克有很多基建發展，香港企業和人才在這方面富有經驗，可提供建造技術和融資渠道。他歡迎烏茲別克斯坦企業利用香港營商環境高度國際化、市場化和匯聚專業服務人才等優勢，拓展海...,2025-08-04 21:43,cradio,2025-08-04 21:45,2025-08-04 21:43:00,"行政長官李家超會見到訪的烏茲別克副總理賈姆希德，就共同關注的議題交流意見。李家超說，近年香港和烏茲別克的經貿關係穩健增長，兩地可共同開拓更多合作空間。香港在「一國兩制」下擁有內聯外通的優勢，積極發揮作為「一帶一路」功能平台的角色。烏茲別克有很多基建發展，香港企業和人才在這方面富有經驗，可提供建造技術和融資渠道。他歡迎烏茲別克斯坦企業利用香港營商環境高度國際化、市場化和匯聚專業服務人才等優勢，拓展海外和內地市場，互利共贏。

李家超又鼓勵來自「一帶一路」沿線國家或地區的學生來港就學，招攬人才。"
2590319,科學委員會：再現基孔肯雅熱輸入風險相   政府措施有效,https://www.881903.com/news/local/2590319,local,"衞生防護中心轄下的傳病媒介疾病科學委員會召開會議，檢視本港對基孔肯雅熱的防控策略；委員會認為，夏季氣溫及雨量上升，本港蚊患情況可能會加劇，加上市民在暑假會較頻繁前往蚊傳疾病流行的地區，因此再出現輸入個案的風險相當高，並有引致本地傳播的潛在風險。

委員會認同政府持續採取相應防控措施，包括加強監測，透過粵港澳三地傳染病通報機制，了解基孔肯雅熱的最新情況。提升本地檢測能力，確保懷疑個案可盡快獲得診斷。...",2025-08-04 21:24,cradio,2025-08-04 21:30,2025-08-04 21:24:00,"衞生防護中心轄下的傳病媒介疾病科學委員會召開會議，檢視本港對基孔肯雅熱的防控策略；委員會認為，夏季氣溫及雨量上升，本港蚊患情況可能會加劇，加上市民在暑假會較頻繁前往蚊傳疾病流行的地區，因此再出現輸入個案的風險相當高，並有引致本地傳播的潛在風險。

委員會認同政府持續採取相應防控措施，包括加強監測，透過粵港澳三地傳染病通報機制，了解基孔肯雅熱的最新情況。提升本地檢測能力，確保懷疑個案可盡快獲得診斷。部門與各個相關界別合作加強蚊媒監測和控制蚊患 。

委員會確認政府採取的多項應急措施，至今有效阻止基孔肯雅熱於本地傳播，並認為面對輸入個案風險，持續實施相關措施十分重要。"
2590318,天文台：未來兩、三小時內或有大驟雨,https://www.881903.com/news/local/2590318,local,"天文台發出特別天氣提示，指受活躍西南季候風及高空擾動影響，本港及鄰近海域持續有雷雨區發展，預料本港未來兩、三小時可能會受大驟雨影響，提醒市民留意天氣變化。
天文台預料，明日天氣仍然會不穩定，間中有大驟雨及狂風雷暴，初時部分地區雨勢可能特別大，提醒市民出門前留意天最新天氣消息及警告。",2025-08-04 21:12,cradio,2025-08-04 21:15,2025-08-04 21:12:00,"天文台發出特別天氣提示，指受活躍西南季候風及高空擾動影響，本港及鄰近海域持續有雷雨區發展，預料本港未來兩、三小時可能會受大驟雨影響，提醒市民留意天氣變化。

天文台預料，明日天氣仍然會不穩定，間中有大驟雨及狂風雷暴，初時部分地區雨勢可能特別大，提醒市民出門前留意天最新天氣消息及警告。"
2590317,克宮：不排除普京與美特使會面  核戰爭沒贏家,https://www.881903.com/news/international/2590317,international,"美國總統特朗普表示，中東問題特使威特科夫可能會在本周三或四訪問俄羅斯，爭取達成俄烏停火協議。俄羅斯總統新聞秘書佩斯科夫表示，不排除總統普京可能於本周與威特科夫會面，指俄方始終歡迎與威特科夫的接觸，認為此類接觸至關重要，內容充實，成效顯著。

佩斯科夫強調，俄方仍主張通過政治和外交手段，解決與烏克蘭的衝突，而美國正繼續致力尋求調解戰事的路徑很重要。

特朗普早前警告俄羅斯果在周五限期前，未能同烏克蘭...",2025-08-04 21:02,cradio,2025-08-04 21:15,2025-08-04 21:02:00,"美國總統特朗普表示，中東問題特使威特科夫可能會在本周三或四訪問俄羅斯，爭取達成俄烏停火協議。俄羅斯總統新聞秘書佩斯科夫表示，不排除總統普京可能於本周與威特科夫會面，指俄方始終歡迎與威特科夫的接觸，認為此類接觸至關重要，內容充實，成效顯著。

佩斯科夫強調，俄方仍主張通過政治和外交手段，解決與烏克蘭的衝突，而美國正繼續致力尋求調解戰事的路徑很重要。

特朗普早前警告俄羅斯果在周五限期前，未能同烏克蘭達成停火協議，美國會施加制裁；俄羅斯聯邦安全會議副主席梅德韋傑夫回應指，美國每一個最後通牒都是威脅，是邁向戰爭的一步。言論引起特朗普不滿，下令兩艘核潛艇部署到更靠近俄羅斯的位置。

佩斯科夫表示，俄羅斯認為，核戰爭不可能有贏家，俄方持負責任立場，密切關注不擴散核武器的問題，謹慎對待與核武器有關的言論。他指，美國潛艇本就處於戰鬥執勤狀態，是常態化存在。

至於普京與烏克蘭總統澤連斯基會面，佩斯科夫則指，在專家層面完成必要工作之後，普京亦不排除舉行會面。"
2590313,中國海警船在釣魚島海域驅離日本漁船,https://www.881903.com/news/china/2590313,china,"中國海警船在中日有主權爭議的釣魚島海域，驅離日本漁船；海警局發言人甘羽說，日本「三加丸號」漁船上周五至今日，非法進入釣魚島領海，中國海警艦艇依法採取必要管控措施並警告驅離。

甘羽強調，釣魚島及附屬島嶼是中國固有領土，敦促日方立即停止在有關海域的一切違法活動。中國海警將持續在釣魚島領海內開展維權執法活動，維護國家領土主權和海洋權益。",2025-08-04 19:54,cradio,2025-08-04 20:00,2025-08-04 19:54:00,"中國海警船在中日有主權爭議的釣魚島海域，驅離日本漁船；海警局發言人甘羽說，日本「三加丸號」漁船上周五至今日，非法進入釣魚島領海，中國海警艦艇依法採取必要管控措施並警告驅離。

甘羽強調，釣魚島及附屬島嶼是中國固有領土，敦促日方立即停止在有關海域的一切違法活動。中國海警將持續在釣魚島領海內開展維權執法活動，維護國家領土主權和海洋權益。"
2590312,本港逾400單簧管演奏家合奏　創健力士紀錄,https://www.881903.com/news/local/2590312,local,"本港448位單簧管演奏家進行合奏，成功打破「最大型單簧管合奏」的健力士世界紀錄。主辦單位通利琴行指，參與合奏的人士包括單簧管學生、老師、業餘及專業的演奏家。

 
 健力士世界紀錄官方認證官葉創偉指，對上一個「最大型單簧管合奏」的世界紀錄在2019年創下，當時美國一個「單簧管節」有367位單黃管演奏家合奏。",2025-08-04 19:45,cradio,2025-08-04 20:00,2025-08-04 19:45:00,"本港448位單簧管演奏家進行合奏，成功打破「最大型單簧管合奏」的健力士世界紀錄。主辦單位通利琴行指，參與合奏的人士包括單簧管學生、老師、業餘及專業的演奏家。

健力士世界紀錄官方認證官葉創偉指，對上一個「最大型單簧管合奏」的世界紀錄在2019年創下，當時美國一個「單簧管節」有367位單黃管演奏家合奏。"
2590311,澳門私家車撞鐵欄3死4傷  疑涉超載,https://www.881903.com/news/local/2590311,local,"澳門發生致命車禍，造成3死4傷，死傷者全部是澳門居民。

事發在早上約6時，一架私家車駛至近格蘭披治賽車大樓時，失控撞向左邊路旁，撞毀多個鐵欄、路牌同石級，全車嚴重損毀。警員到場時，發現司機及6名乘客意識模糊，送院搶救，其中20歲女司機及兩名20歲男乘客，送院後傷重死亡，其餘3男1女乘客仍在搶救，他們年齡19歲至21歲。

治安警初步調查後為，肇事私家車當時超載，正檢驗車輛零件，及事發時的車速等。...",2025-08-04 19:29,cradio,2025-08-04 19:45,2025-08-04 19:29:00,"澳門發生致命車禍，造成3死4傷，死傷者全部是澳門居民。

事發在早上約6時，一架私家車駛至近格蘭披治賽車大樓時，失控撞向左邊路旁，撞毀多個鐵欄、路牌同石級，全車嚴重損毀。警員到場時，發現司機及6名乘客意識模糊，送院搶救，其中20歲女司機及兩名20歲男乘客，送院後傷重死亡，其餘3男1女乘客仍在搶救，他們年齡19歲至21歲。

治安警初步調查後為，肇事私家車當時超載，正檢驗車輛零件，及事發時的車速等。"
2590309,本港今日未錄新增感染基孔肯雅熱個案,https://www.881903.com/news/local/2590309,local,"本港今日截至下午五時，沒有錄得新增感染基孔肯雅熱個案。衛生防護中心表示，會繼續就近日錄得的輸入個案加強監測。
港口衞生科人員今日聯同港鐵人員到落馬洲站及附近範圍視察，並建議防控蚊患措施。此外，人員亦為抵港人士進行體溫篩查，為發燒或出現相關病徵的旅客進行健康評估，並在有需要時轉介他們到醫院作出跟進。中心亦會與航空公司和旅遊業界等持份者保持緊密聯繫，適時更新疾病資訊和健康建議。
防護中心聯同食環署會在...",2025-08-04 19:13,cradio,2025-08-04 19:15,2025-08-04 19:13:00,"本港今日截至下午五時，沒有錄得新增感染基孔肯雅熱個案。衛生防護中心表示，會繼續就近日錄得的輸入個案加強監測。

港口衞生科人員今日聯同港鐵人員到落馬洲站及附近範圍視察，並建議防控蚊患措施。此外，人員亦為抵港人士進行體溫篩查，為發燒或出現相關病徵的旅客進行健康評估，並在有需要時轉介他們到醫院作出跟進。中心亦會與航空公司和旅遊業界等持份者保持緊密聯繫，適時更新疾病資訊和健康建議。

防護中心聯同食環署會在明晚8時至8時半在Facebook專頁舉行網上直播講座，講解有關預防蚊叮及控制蚊患的資訊及健康建議，並回應市民的相關查詢。"
2590306,烏茲別克投資促進局長：香港是絕佳融資地點,https://www.881903.com/news/local/2590306,local,"烏茲別克投資促進局局長拉蘇列夫在本港出席一個商務論壇，指香港和烏茲別克具合作潛力。香港為烏茲別克企業提供城市規劃及智慧城市等領域的專業知識，更是專案融資和發債的絕佳地點，能成為烏茲別克和其他地區之間的貿易橋樑，進入中國的門戶。
他表示，同香港的合作不注重達成數字上的目標，而是要追求一籃子的有利因素，包括便利投資和避免雙重稅收的協議，完成有關措施後，便能開始首次招股，吸引資金流入。他又指，烏茲別克國...",2025-08-04 18:54,cradio,2025-08-04 19:15,2025-08-04 18:54:00,"烏茲別克投資促進局局長拉蘇列夫在本港出席一個商務論壇，指香港和烏茲別克具合作潛力。香港為烏茲別克企業提供城市規劃及智慧城市等領域的專業知識，更是專案融資和發債的絕佳地點，能成為烏茲別克和其他地區之間的貿易橋樑，進入中國的門戶。

他表示，同香港的合作不注重達成數字上的目標，而是要追求一籃子的有利因素，包括便利投資和避免雙重稅收的協議，完成有關措施後，便能開始首次招股，吸引資金流入。他又指，烏茲別克國家的投資基金將會選擇成為其中一個國際上巿市場。

拉蘇列夫表示，烏茲別克已推行了數個基建、能源和交通項目，更多外資企落户當地，能推動相關項目發展。他指，烏茲別克是一個安全的避風港，維持中立外交政策，與歐洲等地關係良好，在美國關稅風波中，亦獲得全部國家中最低的關稅。"
2590305,何文田公主道貨車與的士相撞  北行線一度全封,https://www.881903.com/news/local/2590305,local,何文田公主道下午5時許發生交通意外，涉及一輛中型貨車及的士，無人受傷。受交通意外影響，公主道往獅子山隧道方向近培正道，全線一度要封閉，至傍晚近6時半完成清場解封，車龍有待消散。,2025-08-04 18:51,cradio,2025-08-04 19:15,2025-08-04 18:51:00,何文田公主道下午5時許發生交通意外，涉及一輛中型貨車及的士，無人受傷。受交通意外影響，公主道往獅子山隧道方向近培正道，全線一度要封閉，至傍晚近6時半完成清場解封，車龍有待消散。
2590301,滙豐上調內地全年GDP增長預測至4.9%,https://www.881903.com/news/finance/2590301,finance,"滙豐環球投資研究發表報告，上調今年全年内地GDP增長預測至4.9%，同時上調2026年預測至4.6%。
滙豐表示，更穩固的基礎使內地經濟有望達成今年5%的增長目標。上半年國內生產總值（GDP）增速加快至5.3%，顯示經濟已站穩腳跟。儘管外部不確定性仍存在，但中美關係出現穩定跡象，包括暫停加徵關稅，以及有關特朗普與習近平可能會面的報道。同時，中國正轉向高品質增長，意味著更多結構性措施將聚焦於消費、城...",2025-08-04 18:28,cradio,2025-08-04 18:45,2025-08-04 18:28:00,"滙豐環球投資研究發表報告，上調今年全年内地GDP增長預測至4.9%，同時上調2026年預測至4.6%。

滙豐表示，更穩固的基礎使內地經濟有望達成今年5%的增長目標。上半年國內生產總值（GDP）增速加快至5.3%，顯示經濟已站穩腳跟。儘管外部不確定性仍存在，但中美關係出現穩定跡象，包括暫停加徵關稅，以及有關特朗普與習近平可能會面的報道。同時，中國正轉向高品質增長，意味著更多結構性措施將聚焦於消費、城市化、技術升級，以及解決產能過剩問題。

滙豐又指，政治局會議釋出明確的促增長信號。在7月底的政治局會議有明確表示，支持經濟增長仍是下半年的主要任務。下半年的經濟政策將推動結構性改革，加快去產能進程，同時啟動大型項目與新型城市化計劃以促進消費。財政政策也可能加碼，包括大型基礎設施項目，例如最近的1.2萬億元人民幣西藏「雅下工程」。

滙豐認為，儘管「反內卷」政策短期內可能拖累增長，因為去產能將導致行業整合與裁員，但長期有助於提升生產力並改善供需平衡。與供給側改革1.0不同，內地今次採取更市場導向的方式，近期一系列法律與監管改革旨在保障公平競爭環境。滙豐指，如果落實得當，這些措施有望加快全國市場一體化，抑制地方保護主義並規範地方監管權力。

滙豐表示，刺激需求的政策仍然是關鍵。預計新型城鎮化計劃將成為政策主軸，可能重點推動城市更新項目，並鼓勵大型工程以改善區域內外的連接性，料即將於10月召開的四中全會將討論十五五規劃，屆時將揭示更多細節。滙豐預計，規劃亦將涵蓋「軟基礎設施」，包括內地目前正推出育兒與老年照護補貼，同時也在推動更多措施以促進服務消費。隨著城鎮化進程推進，特別是公共服務均等化後，新城鎮居民可能更願意增加可支配支出。"
2590298,工展會購物節共5.4萬人次入場　廠商會感滿意,https://www.881903.com/news/local/2590298,local,"一連4日在亞洲博覽館舉行的工展會購物節結束，主辦的廠商會表示有5.4萬人次入場，在連日暴雨下對成果感到滿意。比較去年，今年購物節入場人次減少一成。
廠商會會長盧金榮表示，天氣雖不似預期，但場內仍人頭湧湧，首日入場人次按年增加7%，相信由於新增的「家鄉風味區」和「荔園遊樂區」帶來全國各省市的特產及懷舊文化，加上大會繼續組織珠三角地區旅行團到場參觀，並首次提供交通津貼，令展會收穫滿意成果。",2025-08-04 18:22,cradio,2025-08-04 18:30,2025-08-04 18:22:00,"一連4日在亞洲博覽館舉行的工展會購物節結束，主辦的廠商會表示有5.4萬人次入場，在連日暴雨下對成果感到滿意。比較去年，今年購物節入場人次減少一成。

廠商會會長盧金榮表示，天氣雖不似預期，但場內仍人頭湧湧，首日入場人次按年增加7%，相信由於新增的「家鄉風味區」和「荔園遊樂區」帶來全國各省市的特產及懷舊文化，加上大會繼續組織珠三角地區旅行團到場參觀，並首次提供交通津貼，令展會收穫滿意成果。"
2590294,地球之友促政府評估氣候風險　制定應對極端天氣政策,https://www.881903.com/news/local/2590294,local,"天文台過去一周內兩度發出黑色暴雨警告信號。地球之友指出，隨着氣候變化加劇，出現極端天氣已逐漸成為「新常態」，促請政府進行全面氣候風險評估，結合大數據及人工智能，分析本港各區承受極端天氣的能力，制定科學化及具針對性的氣候政策，又認為天文台需強化預警系統，確保市民能及時做好準備。

地球之友又指，本港需強化沿海地區防洪設施，改善城市排水系統，並需將氣候變化預測，納入城市規劃和基建設計標準，政府亦應投放...",2025-08-04 18:06,cradio,2025-08-04 18:15,2025-08-04 18:06:00,"天文台過去一周內兩度發出黑色暴雨警告信號。地球之友指出，隨着氣候變化加劇，出現極端天氣已逐漸成為「新常態」，促請政府進行全面氣候風險評估，結合大數據及人工智能，分析本港各區承受極端天氣的能力，制定科學化及具針對性的氣候政策，又認為天文台需強化預警系統，確保市民能及時做好準備。

地球之友又指，本港需強化沿海地區防洪設施，改善城市排水系統，並需將氣候變化預測，納入城市規劃和基建設計標準，政府亦應投放更多資源推廣氣候教育，提升個人和社區的氣候意識。"
2590287,青年版畫藝術家展覽明天起 一連兩日會展舉行,https://www.881903.com/news/local/2590287,local,"文化體育及旅遊局與民政及青年事務局聯合主辦青年版畫藝術家扶持計劃，推選約100位青年版畫藝術家，以推動中國版畫藝術國際化發展。藝術家版畫展覽明日起一連2日在灣仔會展舉行。
全國政協委員李大宏致辭時表示，香港坐擁「⼀國兩制」優勢，深植中西文化合璧基因，是中國文化走向世界的「橋頭堡」，亦是世界文化融入中國的「試驗田」 ，希望透過計劃，讓香港成為青年版畫藝術家的創意樞紐，促進內地與香港的藝術新銳，以及國...",2025-08-04 17:37,cradio,2025-08-04 17:45,2025-08-04 17:37:00,"文化體育及旅遊局與民政及青年事務局聯合主辦青年版畫藝術家扶持計劃，推選約100位青年版畫藝術家，以推動中國版畫藝術國際化發展。藝術家版畫展覽明日起一連2日在灣仔會展舉行。

全國政協委員李大宏致辭時表示，香港坐擁「⼀國兩制」優勢，深植中西文化合璧基因，是中國文化走向世界的「橋頭堡」，亦是世界文化融入中國的「試驗田」 ，希望透過計劃，讓香港成為青年版畫藝術家的創意樞紐，促進內地與香港的藝術新銳，以及國際同行碰撞思想火花，並藉平台躋身全球視野，讓版畫藝術在多元對話中綻放異彩。"
2590285,李澤鉅：從沒打算出售深水灣道豪宅,https://www.881903.com/news/local/2590285,local,"長和系主席李澤鉅發聲明，澄清網上有傳言表示長和系創辦人李嘉誠，將以50億元售出位於深水灣道79號的豪宅，指有關資訊並非事實，從沒有打算出售有關物業。
李澤鉅在聲明指，有關報道及貼文全屬虛構、穿鑿附會，並無事實根據，又批評網上經常出現有關他與家人的消息，大部分是捏造、不符情理、不合邏輯，甚至涉及訛騙，呼籲各界切勿輕信或散播謠言，以免誤墮詐騙陷阱，招致損失。",2025-08-04 17:34,cradio,2025-08-04 17:45,2025-08-04 17:34:00,"長和系主席李澤鉅發聲明，澄清網上有傳言表示長和系創辦人李嘉誠，將以50億元售出位於深水灣道79號的豪宅，指有關資訊並非事實，從沒有打算出售有關物業。

李澤鉅在聲明指，有關報道及貼文全屬虛構、穿鑿附會，並無事實根據，又批評網上經常出現有關他與家人的消息，大部分是捏造、不符情理、不合邏輯，甚至涉及訛騙，呼籲各界切勿輕信或散播謠言，以免誤墮詐騙陷阱，招致損失。"
2590284,天文台：本港上半年雨量遠低於正常　熱帶氣旋和颱風帶來顯著降雨,https://www.881903.com/news/local/2590284,local,"天文台表示，本港上半年異常少雨，雨量遠低於正常，今年首七個月的累積雨量有1046.1毫米，較同期正常值少約29%，但受到本月初熱帶氣旋丹娜絲的殘餘雨帶、月中颱風韋帕，以及月內數度低壓槽及活躍西南季候風相關驟雨的影響，上月迎來較為顯著的降雨，總雨量為601.7毫米，較正常值高約56%。
天文台指，颱風韋帕吹襲本港期間，日間多處地區吹暴風至颶風，其中橫瀾島及長洲錄得的最高平均風速，分別為每小時131公...",2025-08-04 17:20,cradio,2025-08-04 17:30,2025-08-04 17:20:00,"天文台表示，本港上半年異常少雨，雨量遠低於正常，今年首七個月的累積雨量有1046.1毫米，較同期正常值少約29%，但受到本月初熱帶氣旋丹娜絲的殘餘雨帶、月中颱風韋帕，以及月內數度低壓槽及活躍西南季候風相關驟雨的影響，上月迎來較為顯著的降雨，總雨量為601.7毫米，較正常值高約56%。

天文台指，颱風韋帕吹襲本港期間，日間多處地區吹暴風至颶風，其中橫瀾島及長洲錄得的最高平均風速，分別為每小時131公里及115公里，超過33人在韋帕襲港期間受傷；而上月共有8個熱帶氣旋影響南海及北太平洋西部。"
2590283,央視曝光解放軍由訓轉戰登陸作戰演習片段,https://www.881903.com/news/china/2590283,china,"央視八一建軍節紀錄片《攻堅》最新一集，播出解放軍登陸作戰演習的片段，視頻提到，解放軍接獲上級命令，「即將執行登陸作戰，立即由訓轉戰，開始戰備等級轉進」。
演習片段，有殲35戰機的身影，及轟-6K同驅逐艦發射導彈的片段，以075型兩棲攻擊艦為首的艦艇編隊，接獲執行登陸作戰任務，在第一波次火力毀傷達成預期效果後，開始投入登陸兵力。士兵登上多架直升機， 登陸艇及兩棲戰車在小型無人機支援下，搶灘登陸，空降...",2025-08-04 17:13,cradio,2025-08-04 17:15,2025-08-04 17:13:00,"央視八一建軍節紀錄片《攻堅》最新一集，播出解放軍登陸作戰演習的片段，視頻提到，解放軍接獲上級命令，「即將執行登陸作戰，立即由訓轉戰，開始戰備等級轉進」。

演習片段，有殲35戰機的身影，及轟-6K同驅逐艦發射導彈的片段，以075型兩棲攻擊艦為首的艦艇編隊，接獲執行登陸作戰任務，在第一波次火力毀傷達成預期效果後，開始投入登陸兵力。士兵登上多架直升機， 登陸艇及兩棲戰車在小型無人機支援下，搶灘登陸，空降士兵就乘坐運-20進行空投。

有士兵表示，是他第一次看到陸海空戰力聚合在一起，解放軍戰場感知不再是單向透明，反制手段多種多樣，作戰方式也在不斷創新。又透露同航母編隊在大洋中不期而遇，戰士都感到振奮。似乎顯示航母也參與今次演練。"
