id,title,url,section,lead,date,source,scrape_time,last_update,news_content
2578711,美指使用華為晶片視屬違反出口管制  外交部指絕不接受,https://www.881903.com/news/china/2578711,china,"美國商務部工業與安全局日前發公告，警告在全球任何地方使用華為的昇騰晶片，都會視作違反美國的出口管制；若使用美國的人工智能晶片協助訓練中國的AI模型，亦可能有潛在後果。在北京，外交部發言人林劍批評美方泛化國家安全概念，濫用出口管制和長臂管轄，無端對中國晶片產品和人工智能產業進行惡意封鎖和打壓，嚴重違反市場規則，嚴重擾亂全球產供鏈穩定，嚴重損害中國企業正當權益，中方堅決反對，絶不接受。
他表示，中方敦...",2025-05-16 15:52,cradio,2025-05-16 16:00,2025-05-16 15:52:00,"美國商務部工業與安全局日前發公告，警告在全球任何地方使用華為的昇騰晶片，都會視作違反美國的出口管制；若使用美國的人工智能晶片協助訓練中國的AI模型，亦可能有潛在後果。在北京，外交部發言人林劍批評美方泛化國家安全概念，濫用出口管制和長臂管轄，無端對中國晶片產品和人工智能產業進行惡意封鎖和打壓，嚴重違反市場規則，嚴重擾亂全球產供鏈穩定，嚴重損害中國企業正當權益，中方堅決反對，絶不接受。

他表示，中方敦促美方停止對中國科技企業和人工智能產業的無底線打壓。中方將採取堅決措施，維護自身發展權利及中國企業正當權益。

另外，對於中國同意解除4月2日後的出口反制措施，是否亦計劃解除或調整稀土出口管制，林劍建議記者向中方的主管部門詢問。"
2578709,劉國中周日起訪瑞士和白俄　期間出席世界衛生大會,https://www.881903.com/news/china/2578709,china,外交部宣布，副總理劉國中應世衛總幹事譚德塞，以及瑞士和白俄羅斯政府邀請，周日起一連6日訪問瑞士，並在日內瓦出席第78屆世界衛生大會，之後會到白俄羅斯，主持中國與當地政府間合作委員會第6次會議。,2025-05-16 15:31,cradio,2025-05-16 15:45,2025-05-16 15:31:00,外交部宣布，副總理劉國中應世衛總幹事譚德塞，以及瑞士和白俄羅斯政府邀請，周日起一連6日訪問瑞士，並在日內瓦出席第78屆世界衛生大會，之後會到白俄羅斯，主持中國與當地政府間合作委員會第6次會議。
2578708,編寫漫畫稱日本7月大海嘯  龍樹諒籲勿過度解讀應參考專家意見,https://www.881903.com/news/international/2578708,international,日本一本26年前出版的漫畫，內容聲稱今年7月日本將有大海嘯，雖然毫無科學根據，但已影響部分旅客遊日意欲。日本氣象廳就指，能明確預知地震時間及地點的資訊，皆可視為謠言。編寫有關漫畫的漫畫家龍樹諒，近日書面回覆日本傳媒訪問，指她盡量抱持客觀立場，大家能提高防災意識是非常正面的現象，希望這些關心能轉化成安全對策。至於漫畫中描繪的預知夢，解釋部分交由大家自由判斷，但希望不要過度被影響，應參考專家意見，妥善...,2025-05-16 15:29,cradio,2025-05-16 15:45,2025-05-16 15:29:00,"日本一本26年前出版的漫畫，內容聲稱今年7月日本將有大海嘯，雖然毫無科學根據，但已影響部分旅客遊日意欲。日本氣象廳就指，能明確預知地震時間及地點的資訊，皆可視為謠言。編寫有關漫畫的漫畫家龍樹諒，近日書面回覆日本傳媒訪問，指她盡量抱持客觀立場，大家能提高防災意識是非常正面的現象，希望這些關心能轉化成安全對策。至於漫畫中描繪的預知夢，解釋部分交由大家自由判斷，但希望不要過度被影響，應參考專家意見，妥善行動。

出版社表示，漫畫內容絕對沒有故意引發大家不安的意圖，對於災害等事件，仍建議根據專家意見，謹慎妥善應對。"
2578707,恒瑞醫藥招股 孖展暫獲151億申購超額27倍,https://www.881903.com/news/finance/2578707,finance,"內地製藥公司恒瑞醫藥(01276.HK)啟動首次公開招股(IPO)，發行約2.25億H股，其中1234.86萬股在港公開發售。招股價介乎 41.45元至44.05元，最多集資98.9億元。一手200股，入場費約8898元。若全額行使超額配售權及發售量調整權，發行H股最高達2.97億股，最高集資額可達130.8億港元，將成為近5年港股醫藥企業IPO最高募資額。
據券商統計，截至下午3時，恒瑞醫藥孖展...",2025-05-16 15:26,cradio,2025-05-16 15:30,2025-05-16 15:26:00,"內地製藥公司恒瑞醫藥(01276.HK)啟動首次公開招股(IPO)，發行約2.25億H股，其中1234.86萬股在港公開發售。招股價介乎 41.45元至44.05元，最多集資98.9億元。一手200股，入場費約8898元。若全額行使超額配售權及發售量調整權，發行H股最高達2.97億股，最高集資額可達130.8億港元，將成為近5年港股醫藥企業IPO最高募資額。

據券商統計，截至下午3時，恒瑞醫藥孖展申購額達151.83億元，超額近27倍。股份下周二截止認購，預計下周五掛牌。按A股前日收市價比，公司今次IPO發行價比A股折讓約24%至27%。

恒瑞醫藥被形容為「藥中茅台」，招股書指出，集團是一間中國及全球領先的創新型製藥企業，根據弗若斯特沙利文資料，以2023年新分子實體創新藥收入、以及截至最新日期處於臨床或更後期階段的新分子實體在研創新藥數量而言，在中國製藥企業中均名列前茅。

恒瑞醫藥去年純利63.37億元人民幣，按年增長47.3%，營收279.85億元，按年增22.6%；毛利率提升1.6百分點至86.2%。公司核心增長引擎爲創新藥收入，創新藥銷售收入佔總收入的百分比由2022年的38.1%增至2023年的43.4%，並進一步增至2024年的46.3%。"
2578704,首季罪案按年減3%　詐騙案佔46％,https://www.881903.com/news/local/2578704,local,本港今年首季有20756宗罪案，按年減少3%。其中，詐騙案佔約46%，有9487宗，按年增加5.8%。而暴力、搶劫及爆竊案均有所減少。,2025-05-16 15:23,cradio,2025-05-16 15:30,2025-05-16 15:23:00,本港今年首季有20756宗罪案，按年減少3%。其中，詐騙案佔約46%，有9487宗，按年增加5.8%。而暴力、搶劫及爆竊案均有所減少。
2578703,國泰首屆見習機師培訓計劃34名學員畢業,https://www.881903.com/news/local/2578703,local,"國泰航空的見習機師培訓計劃，首屆有34名見習機師完成訓練，大部份正接受二副機師的飛行訓練。
參與學員需要接受約80星期培訓，先在國泰學院完成飛行理論課程考核，再到美國進行飛行訓練，及在國泰飛行訓練中心進行飛行模擬器操作訓練。",2025-05-16 15:21,cradio,2025-05-16 15:30,2025-05-16 15:21:00,"國泰航空的見習機師培訓計劃，首屆有34名見習機師完成訓練，大部份正接受二副機師的飛行訓練。

參與學員需要接受約80星期培訓，先在國泰學院完成飛行理論課程考核，再到美國進行飛行訓練，及在國泰飛行訓練中心進行飛行模擬器操作訓練。"
2578702,八達通：母親節零售及餐飲消費按年升6%,https://www.881903.com/news/local/2578702,local,"八達通公司數據顯示，母親節假期零售及餐飲消費較去年同期增長6%，其中個人及健康產品類別按年增長達15%，超市、咖啡店及酒樓類別亦錄得10%增長，反映部分市場領域在逆境中仍能找到發展空間。

八達通零售業務及合作夥伴總監李玉兒表示，在經濟環境充滿挑戰下，母親節零售消費穩健增長，展現本港經濟的韌性與活力，同時帶來了新的機遇。她說，商戶靈活應對市場變化，推出早鳥優惠及注重性價比的餐飲選擇，對香港家庭而言...",2025-05-16 15:19,cradio,2025-05-16 15:30,2025-05-16 15:19:00,"八達通公司數據顯示，母親節假期零售及餐飲消費較去年同期增長6%，其中個人及健康產品類別按年增長達15%，超市、咖啡店及酒樓類別亦錄得10%增長，反映部分市場領域在逆境中仍能找到發展空間。

八達通零售業務及合作夥伴總監李玉兒表示，在經濟環境充滿挑戰下，母親節零售消費穩健增長，展現本港經濟的韌性與活力，同時帶來了新的機遇。她說，商戶靈活應對市場變化，推出早鳥優惠及注重性價比的餐飲選擇，對香港家庭而言，不僅是增加消費，而是更理性及明智的消費態度。"
2578701,立法會小組委員會和政府均不就維護國安附屬法例提修正案,https://www.881903.com/news/local/2578701,local,"政府以「先訂立、後審議」方式，在《維護國家安全條例》下訂立兩項附屬法例，立法會的小組委員會昨日連開三節會議後，完成逐條審議。委員會主席廖長江在內會匯報工作，指小組委員會和政府當局均不會提交修正案，小組委員會稍後將提交書面報告。

廖長江指，委員都認同現時地緣政治複雜多變，國安風險往往突如其來，今次立法工作能夠做到未雨綢繆，在本地法律層面建立機制，更好支持和保障國安公署履行職責。",2025-05-16 15:17,cradio,2025-05-16 15:30,2025-05-16 15:17:00,"政府以「先訂立、後審議」方式，在《維護國家安全條例》下訂立兩項附屬法例，立法會的小組委員會昨日連開三節會議後，完成逐條審議。委員會主席廖長江在內會匯報工作，指小組委員會和政府當局均不會提交修正案，小組委員會稍後將提交書面報告。

廖長江指，委員都認同現時地緣政治複雜多變，國安風險往往突如其來，今次立法工作能夠做到未雨綢繆，在本地法律層面建立機制，更好支持和保障國安公署履行職責。"
2578700,5人涉電話及假冒官員騙案被捕,https://www.881903.com/news/local/2578700,local,"警方拘捕4人，涉嫌與5宗電話騙案有關，涉款約48萬元；4人正被扣查。警方調查發現，有「猜猜我是誰」電話騙案詐騙集團活躍於西九龍區，昨日趁集團成員上門向一名女受害人收取騙款時，將她拘捕。之後再拘捕集團一名28歲男骨幹成員，及2名14歲青年。

警方又偵破一宗假冒內地官員騙案，拘捕一名28歲無業女子。案中騙徒涉嫌利用假冒內地執法機關工作證，要求受害人簽署保密令。被捕女子將被控企圖以欺詐手段取得財產罪，...",2025-05-16 15:14,cradio,2025-05-16 15:30,2025-05-16 15:14:00,"警方拘捕4人，涉嫌與5宗電話騙案有關，涉款約48萬元；4人正被扣查。警方調查發現，有「猜猜我是誰」電話騙案詐騙集團活躍於西九龍區，昨日趁集團成員上門向一名女受害人收取騙款時，將她拘捕。之後再拘捕集團一名28歲男骨幹成員，及2名14歲青年。

警方又偵破一宗假冒內地官員騙案，拘捕一名28歲無業女子。案中騙徒涉嫌利用假冒內地執法機關工作證，要求受害人簽署保密令。被捕女子將被控企圖以欺詐手段取得財產罪，案件明日在西九龍裁判法院提堂。"
2578698,習近平促完善殘疾人社會保障制度和關愛服務體系,https://www.881903.com/news/china/2578698,china,"第7次全國自強模範暨助殘先進表彰大會在北京召開，中共總書記、國家主席習近平趁周日、第35個全國助殘日前夕，作出重要指示，要求進一步完善殘疾人社會保障制度和關愛服務體系，切實保障殘疾人平等權益，促進殘疾人事業全面發展。
習近平強調，各級黨委和政府要高度重視殘疾人工作，持續提升殘疾人公共服務質量，積極營造全社會理解、尊重、關心、幫助殘疾人的良好氛圍和環境；各級殘聯組織和廣大殘疾人工作者亦要不斷提高服務...",2025-05-16 15:09,cradio,2025-05-16 15:15,2025-05-16 15:09:00,"第7次全國自強模範暨助殘先進表彰大會在北京召開，中共總書記、國家主席習近平趁周日、第35個全國助殘日前夕，作出重要指示，要求進一步完善殘疾人社會保障制度和關愛服務體系，切實保障殘疾人平等權益，促進殘疾人事業全面發展。

習近平強調，各級黨委和政府要高度重視殘疾人工作，持續提升殘疾人公共服務質量，積極營造全社會理解、尊重、關心、幫助殘疾人的良好氛圍和環境；各級殘聯組織和廣大殘疾人工作者亦要不斷提高服務能力和水平。他希望廣大殘疾人從自強模範身上，汲取精神力量，勇敢克服困難挑戰，積極追求人生夢想，為以中國式現代化全面推進強國建設、民族復興偉業，積極貢獻。

全國人大常委會在1990年通過，將每年5月第3個周日，列為全國助殘日。今次大會共表彰了200名「全國自強模範」、200個「全國殘疾人工作先進集體」，以及60名「全國殘疾人工作先進個人」。"
2578697,內地股市收市偏軟,https://www.881903.com/news/finance/2578697,finance,內地股市偏軟，上證綜合指數3367點，跌13點；深證成分指數反覆向下，收報10179點，跌6點，兩市成交額10895億元人民幣。創業板指數跌0.2%。,2025-05-16 15:09,cradio,2025-05-16 15:15,2025-05-16 15:09:00,內地股市偏軟，上證綜合指數3367點，跌13點；深證成分指數反覆向下，收報10179點，跌6點，兩市成交額10895億元人民幣。創業板指數跌0.2%。
2578696,李成鋼籲APEC成員攜手維護國際經貿秩序穩定,https://www.881903.com/news/china/2578696,china,商務部副部長李成鋼在南韓濟州出席亞太經合組織(APEC)貿易部長會議表示，近期個別經濟體實施所謂「對等關稅」、挑起全球貿易摩擦，嚴重違反世貿組織規則，沖擊多邊貿易體制，引發全球經濟動蕩，很多貿易夥伴都表達強烈不滿和明確反對。APEC成員應攜手維護國際經貿秩序穩定，踐行真正的多邊主義，堅決反對單邊主義和保護主義，客觀看待、妥善處理單邊關稅措施引發的全球貿易失序，確保全球貿易在世貿組織框架下順暢運行。...,2025-05-16 15:09,cradio,2025-05-16 15:15,2025-05-16 15:09:00,"商務部副部長李成鋼在南韓濟州出席亞太經合組織(APEC)貿易部長會議表示，近期個別經濟體實施所謂「對等關稅」、挑起全球貿易摩擦，嚴重違反世貿組織規則，沖擊多邊貿易體制，引發全球經濟動蕩，很多貿易夥伴都表達強烈不滿和明確反對。APEC成員應攜手維護國際經貿秩序穩定，踐行真正的多邊主義，堅決反對單邊主義和保護主義，客觀看待、妥善處理單邊關稅措施引發的全球貿易失序，確保全球貿易在世貿組織框架下順暢運行。

身兼商務部國際貿易談判代表的李成鋼，早前亦有參與在日內瓦進行的中美高層經貿會談，他表示，APEC成員應在推動世貿組織改革上，採取有效行動。用新方法處理發展議題，推動部長級會議取得發展導向型成果，推動盡早將投資便利化協定、電子商務協定納入世貿組織法律框架，盡快恢復爭端解決機制正常運轉，完成有關加入談判，增強世貿組織代表性和權威性。

李成鋼指出，APEC各方要秉持開放、普惠、包容原則，深化貿易投資自由化便利化合作，大力推動區域經濟一體化進程。要發揮人工智能在促進貿易便利化方面的積極作用，為人工智能賦能貿易打造開放合作的產供鏈體系。要構建開放包容、高效穩定的全球產供鏈，為企業創造穩定、公平、透明、可預期的發展環境。要深化區域供應鏈互聯互通合作，促進標準對接，實現區域供應鏈深層次互聯互通。

會議期間，李成鋼又分別同多個經濟體代表團長，及世貿組織總幹事等舉行會談，就多邊及雙邊經貿議題交換意見。"
2578695,分析料泡泡瑪特升幅強勁　有望染藍,https://www.881903.com/news/finance/2578695,finance,"恒指公司今日公布季檢結果，有分析指，泡泡瑪特(09992.HK)有望在今次季檢中成為藍籌新貴。
Periscope Analytics創始人Brian Freitas報告指，泡泡瑪特股價過去一年的驚人升幅，令它具備加入恒指的潛力，目前淡倉也處於低位附近。今年以來泡泡瑪特股價已上升逾1。多位分析師亦提到，生物醫藥巨頭百濟神州(06160.HK)和意大利時尚品牌普拉達(01913.HK)也可能被納入恒...",2025-05-16 15:04,cradio,2025-05-16 15:15,2025-05-16 15:04:00,"恒指公司今日公布季檢結果，有分析指，泡泡瑪特(09992.HK)有望在今次季檢中成為藍籌新貴。

Periscope Analytics創始人Brian Freitas報告指，泡泡瑪特股價過去一年的驚人升幅，令它具備加入恒指的潛力，目前淡倉也處於低位附近。今年以來泡泡瑪特股價已上升逾1。多位分析師亦提到，生物醫藥巨頭百濟神州(06160.HK)和意大利時尚品牌普拉達(01913.HK)也可能被納入恒指。"
2578694,特朗普將於阿布扎比出席商界早餐會　並到訪「亞伯拉罕之家」,https://www.881903.com/news/international/2578694,international,"美國總統特朗普將展開中東之行的最後一日行程，會在阿聯酋首都阿布扎比，與商界舉行早餐會，之後會到訪集猶太會堂、基督教堂及伊斯蘭清真寺的跨宗教建築群「亞伯拉罕之家」。
特朗普在上屆總統任期推動《亞伯拉罕協議》，阿聯酋在2020年根據協議與猶太邦國以色列建交，成為繼埃及和約旦後，第三個與以色列建交的阿拉伯國家。
特朗普之後會乘住空軍一號專機離開，返回美國。",2025-05-16 14:50,cradio,2025-05-16 15:00,2025-05-16 14:50:00,"美國總統特朗普將展開中東之行的最後一日行程，會在阿聯酋首都阿布扎比，與商界舉行早餐會，之後會到訪集猶太會堂、基督教堂及伊斯蘭清真寺的跨宗教建築群「亞伯拉罕之家」。

特朗普在上屆總統任期推動《亞伯拉罕協議》，阿聯酋在2020年根據協議與猶太邦國以色列建交，成為繼埃及和約旦後，第三個與以色列建交的阿拉伯國家。

特朗普之後會乘住空軍一號專機離開，返回美國。"
2578693,華北地區將再落冰雹　北京亦受影響,https://www.881903.com/news/china/2578693,china,"內地華北地區預料將再出現冰雹天氣。中央氣象台發出強對流天氣藍色預警，預計現時至明早8時，特別是今日午後至前半夜，內蒙古中部、山西北部、河北中北部、北京、天津、遼寧中南部等地，部分地區將有8至10級以上雷暴大風或冰雹天氣，局部地區更有11級雷暴大風或大冰雹。而今次冰雹天氣範圍，較日前的一次更大，涉及東北部分地區。
北京市氣象台已在早上發出冰雹黃色預警，預計今日下午3時至晚上11時會受雷雨雲團影響，部...",2025-05-16 14:34,cradio,2025-05-16 14:45,2025-05-16 14:34:00,"內地華北地區預料將再出現冰雹天氣。中央氣象台發出強對流天氣藍色預警，預計現時至明早8時，特別是今日午後至前半夜，內蒙古中部、山西北部、河北中北部、北京、天津、遼寧中南部等地，部分地區將有8至10級以上雷暴大風或冰雹天氣，局部地區更有11級雷暴大風或大冰雹。而今次冰雹天氣範圍，較日前的一次更大，涉及東北部分地區。

北京市氣象台已在早上發出冰雹黃色預警，預計今日下午3時至晚上11時會受雷雨雲團影響，部分地區可能出現分散的冰雹。雷電橙色預警和大風黃色預警亦同時生效。"
2578692,美台貿易代表會晤　台方爭取下調關稅,https://www.881903.com/news/china/2578692,china,"台灣行政機關副首長鄭麗君指，到南韓濟州出席亞太經合組織(APEC)貿易部長會議的，經貿談判辦公室總談判代表楊珍妮，昨日與美國貿易代表格里爾舉行會談。鄭麗君指，雙方會談友好融洽，肯定首輪實體談判，並表達對未來經貿合作及再度磋商的期待。

鄭麗君指，談判小組的基本立場，是全力維護台灣和產業利益，守護民眾健康和糧食安全，因此目標只有一個，就是要談出最好結果，下調關稅。她強調台灣有信心，透過擴大對美採購和...",2025-05-16 14:22,cradio,2025-05-16 14:30,2025-05-16 14:22:00,"台灣行政機關副首長鄭麗君指，到南韓濟州出席亞太經合組織(APEC)貿易部長會議的，經貿談判辦公室總談判代表楊珍妮，昨日與美國貿易代表格里爾舉行會談。鄭麗君指，雙方會談友好融洽，肯定首輪實體談判，並表達對未來經貿合作及再度磋商的期待。

鄭麗君指，談判小組的基本立場，是全力維護台灣和產業利益，守護民眾健康和糧食安全，因此目標只有一個，就是要談出最好結果，下調關稅。她強調台灣有信心，透過擴大對美採購和投資，促進雙邊貿易的平衡。鄭麗君又指，早前已向美國提出意見書，若美方對台灣半導體產業加徵關稅，反而會令產業赴美布局能力落後，增加供應鏈中斷的風險。

美國總統特朗普上月初公布對等關稅，其中台灣稅率32%，其後特朗普宣布暫緩實施90日。"
2578691,內地最高法院核准3名性侵害未成年人罪犯執行死刑,https://www.881903.com/news/china/2578691,china,"內地最高人民法院公布，經法院核准，3名強姦未成年人罪成的罪犯被依法執行死刑。案情分別涉及有人在非法成立的「成長教育基地」，以教員身份，以毆打、辱罵、強迫勞動等方式，虐待和非法拘禁數十名未成年學員，並強姦未成年女性學員。有人冒充導演，以招募小演員的方式，通過網絡誘騙侵犯未成年人。亦有人冒充未成年人士，加入初中學生自建的社交媒體群組，以誘騙、脅迫等方式侵犯未成年女學生。

最高人民法院強調，對性侵害未...",2025-05-16 14:20,cradio,2025-05-16 14:30,2025-05-16 14:20:00,"內地最高人民法院公布，經法院核准，3名強姦未成年人罪成的罪犯被依法執行死刑。案情分別涉及有人在非法成立的「成長教育基地」，以教員身份，以毆打、辱罵、強迫勞動等方式，虐待和非法拘禁數十名未成年學員，並強姦未成年女性學員。有人冒充導演，以招募小演員的方式，通過網絡誘騙侵犯未成年人。亦有人冒充未成年人士，加入初中學生自建的社交媒體群組，以誘騙、脅迫等方式侵犯未成年女學生。

最高人民法院強調，對性侵害未成年人犯罪始終堅持「零容忍」態度，侵害孩子者必嚴懲不貸，又指性侵害未成年人犯罪的手段愈發隱蔽及多樣，強調要從源頭上做好防範，同時提示廣大家長和學校切實履行監護、教育職責，做好對未成年人的性教育、網絡安全教育和法治教育。"
