id,title,url,section,lead,date,source,scrape_time,last_update,news_content
2604394,特朗普歡迎佩洛西退休　指對方邪惡腐敗及被嚴重高估,https://www.881903.com/news/international/2604394,international,"美國總統特朗普歡迎主要政敵，85歲的眾議院前議長佩洛西宣布，不會在明年中期選舉尋求連任，結束在國會近40年的從政生涯。特朗普指佩洛西邪惡、腐敗，只關注對美國不利的事情，正迅速失去對所屬民主黨的控制，對她退休感到高興，認為對美國來說是件好事。
特朗普指，對首個總統任期，佩洛西領導眾議院兩度彈劾他感到榮幸。第一次是指控特朗普阻止美國對烏克蘭的軍事援助。第二次是在2021年國會山莊騷亂後，特朗普被指煽動...",2025-11-07 04:36,cradio,2025-11-07 04:45,2025-11-07 04:36:00,"美國總統特朗普歡迎主要政敵，85歲的眾議院前議長佩洛西宣布，不會在明年中期選舉尋求連任，結束在國會近40年的從政生涯。特朗普指佩洛西邪惡、腐敗，只關注對美國不利的事情，正迅速失去對所屬民主黨的控制，對她退休感到高興，認為對美國來說是件好事。

特朗普指，對首個總統任期，佩洛西領導眾議院兩度彈劾他感到榮幸。第一次是指控特朗普阻止美國對烏克蘭的軍事援助。第二次是在2021年國會山莊騷亂後，特朗普被指煽動叛亂。特朗普說，兩次彈劾都慘遭失敗，批評佩洛西是被嚴重高估的政治人物。"
2604393,WTA年終賽丨莎芭倫卡及柏古娜晉級4強,https://www.881903.com/news/sports/2604393,sports,"在沙特阿拉伯利雅得舉行的WTA國際女子網球協會年終賽，白俄羅斯的莎芭倫卡及美國的柏古娜晉級4強。
 莎芭倫卡在最後一場小組賽對衛冕冠軍美國的歌芙，贏直落兩盤7-6及6-2。柏古娜亦以6-2及6-3擊敗經已出局的意大利球手寶莉妮。

莎芭倫卡4強會對美國的安妮絲莫娃。柏古娜鬥哈薩克的列巴基娜。",2025-11-07 03:26,cradio,2025-11-07 03:45,2025-11-07 03:26:00,"在沙特阿拉伯利雅得舉行的WTA國際女子網球協會年終賽，白俄羅斯的莎芭倫卡及美國的柏古娜晉級4強。

莎芭倫卡在最後一場小組賽對衛冕冠軍美國的歌芙，贏直落兩盤7-6及6-2。柏古娜亦以6-2及6-3擊敗經已出局的意大利球手寶莉妮。

莎芭倫卡4強會對美國的安妮絲莫娃。柏古娜鬥哈薩克的列巴基娜。"
2604392,美國政府停擺｜40個主要機場削減10%航班,https://www.881903.com/news/international/2604392,international,"美國聯邦航空管理局因應政府持續停擺，強制航空公司由當地周五起，在全國40個最繁忙的機場，包括紐約、洛杉磯及芝加哥等機場削減10%航班，以減輕空中交通管制員的壓力，以及確保飛行安全。有分析估計，每日可能有多達1800班機受影響，涉及超過26萬名乘客。多間航空公司表示，會盡力減少對乘客的影響。其中聯合、達美及美國航空指，即使乘客購買的是通常不可退款的機票，如果他們選擇不乘搭航班亦可以獲得退款。

自1...",2025-11-07 02:36,cradio,2025-11-07 03:00,2025-11-07 02:36:00,"美國聯邦航空管理局因應政府持續停擺，強制航空公司由當地周五起，在全國40個最繁忙的機場，包括紐約、洛杉磯及芝加哥等機場削減10%航班，以減輕空中交通管制員的壓力，以及確保飛行安全。有分析估計，每日可能有多達1800班機受影響，涉及超過26萬名乘客。多間航空公司表示，會盡力減少對乘客的影響。其中聯合、達美及美國航空指，即使乘客購買的是通常不可退款的機票，如果他們選擇不乘搭航班亦可以獲得退款。

自10月1日政府停擺開始以來，空中交通管制員一直無薪工作。工會領袖說，每日都有空中交通管制員辭職。"
2604391,歐洲股巿下跌,https://www.881903.com/news/finance/2604391,finance,"歐洲股巿下跌。
英國股巿收巿報9735點，下跌41點。
法國股巿收巿報7964點，下跌109點。
德國股巿收巿報23734點，下跌315點。",2025-11-07 01:12,cradio,2025-11-07 01:15,2025-11-07 01:12:00,"歐洲股巿下跌。

英國股巿收巿報9735點，下跌41點。

法國股巿收巿報7964點，下跌109點。

德國股巿收巿報23734點，下跌315點。"
2604390,全運會跳水｜黃博文及謝思埸奪男子雙人3米板金牌,https://www.881903.com/news/sports/2604390,sports,晚上舉行的全運會跳水男子雙人3米板決賽，由廣東的黃博文及謝思埸奪冠，是廣東在今屆全運會跳水項目獲得的第四面金牌。兩人從預賽開始一路遙遙領先，最後以總分447.54奪冠。銀牌及銅牌分別由江蘇及山西組合奪得。,2025-11-07 00:47,cradio,2025-11-07 01:00,2025-11-07 00:47:00,晚上舉行的全運會跳水男子雙人3米板決賽，由廣東的黃博文及謝思埸奪冠，是廣東在今屆全運會跳水項目獲得的第四面金牌。兩人從預賽開始一路遙遙領先，最後以總分447.54奪冠。銀牌及銅牌分別由江蘇及山西組合奪得。
2604389,美前眾議長佩洛西宣布不覓連任　結束近40年國會生涯,https://www.881903.com/news/international/2604389,international,"美國眾議院前議長佩洛西宣布，不會在明年中期選舉尋求連任，結束在國會近40年的從政生涯。85歲的佩洛西在社交網站發放影片公布消息，指將懷著感恩的心，期待在國會服務的最後一年。

佩洛西在1987年第一次當選眾議員，曾2度擔任眾議院議長。她在3年前第19次連任後，決定卸下民主黨眾議院領袖職位，但仍持續在民主黨內扮演關鍵角色，包括去年勸退尋求連任的時任總統拜登，改由副總統賀錦麗出戰大選，最終大敗給共和黨...",2025-11-06 23:30,cradio,2025-11-06 23:45,2025-11-06 23:30:00,"美國眾議院前議長佩洛西宣布，不會在明年中期選舉尋求連任，結束在國會近40年的從政生涯。85歲的佩洛西在社交網站發放影片公布消息，指將懷著感恩的心，期待在國會服務的最後一年。

佩洛西在1987年第一次當選眾議員，曾2度擔任眾議院議長。她在3年前第19次連任後，決定卸下民主黨眾議院領袖職位，但仍持續在民主黨內扮演關鍵角色，包括去年勸退尋求連任的時任總統拜登，改由副總統賀錦麗出戰大選，最終大敗給共和黨的特朗普。

佩洛西在2022年8月不理會中方強烈反對，乘坐專機飛抵台北停留一晚，同時任台灣領導人蔡英文會面，引起軒然大波，北京提出強烈抗議，解放軍展開圍台軍演，不再承認台海中線。"
2604388,日產受特朗普關稅影響  5年首錄虧損半年蝕2219億日元,https://www.881903.com/news/international/2604388,international,"日產汽車5年來首度轉盈為虧，今年上半年錄得淨虧損2219億日元，折合14.45億美元。去年同期盈利為192億日元。主要是由於在全球銷售疲軟的同時，美國特朗普政府對汽車加徵關稅，令成本增加，壓低利潤。

日產說，由於裁減2萬名員工的費用仍在估算，暫未披露整個財年的淨損益預期。作為重建一環，公司將以970億日元出售位於橫濱市的總部大樓及土地。

日產在全球銷量下降7.3%，至148萬輛。當中以中國降幅...",2025-11-06 23:01,cradio,2025-11-06 23:15,2025-11-06 23:01:00,"日產汽車5年來首度轉盈為虧，今年上半年錄得淨虧損2219億日元，折合14.45億美元。去年同期盈利為192億日元。主要是由於在全球銷售疲軟的同時，美國特朗普政府對汽車加徵關稅，令成本增加，壓低利潤。

日產說，由於裁減2萬名員工的費用仍在估算，暫未披露整個財年的淨損益預期。作為重建一環，公司將以970億日元出售位於橫濱市的總部大樓及土地。

日產在全球銷量下降7.3%，至148萬輛。當中以中國降幅最大，超過1成7。其次是日本，下降超過1成6。美國市場小幅下跌，至44.5萬輛。按營業利潤來看，美國關稅造成1497億日元的利潤下滑。

日產又宣布，在墨西哥與德國平治集團的合資工廠，今個月起將停產日產車輛。"
2604387,美股早段偏軟,https://www.881903.com/news/finance/2604387,finance,"美股早段偏軟。美國關稅的不確定性、股市估值飆升，及經濟數據好壞參半，繼續引起市場擔憂。

道瓊斯工業平均指數報47255點，跌55點。

標普500指數報6787點，跌8點。

納斯達克指數報23461點，跌38點。",2025-11-06 22:46,cradio,2025-11-06 23:15,2025-11-06 22:46:00,"美股早段偏軟。美國關稅的不確定性、股市估值飆升，及經濟數據好壞參半，繼續引起市場擔憂。

道瓊斯工業平均指數報47255點，跌55點。

標普500指數報6787點，跌8點。

納斯達克指數報23461點，跌38點。"
2604384,外電：美國擬於大馬士革空軍基地駐軍,https://www.881903.com/news/international/2604384,international,"路透社報道，美國準備於敘利亞首都大馬士革一個空軍基地駐軍，推動敘利亞與以色列達成互不侵犯協議。消息被視為敘利亞自去年變天後，改為與美國結盟的跡象。

報道未有透露基地具體位置，但指將連接位於敘利亞南部、預料在以敘協議下劃設的非軍事區，將用作監督協議實施情況，技術磋商聚焦於基地的後勤、監視、入油和人道行動用途，而敘利亞將對基地保留全面主權。官員指，美方過去2個月正加快籌備，包括曾派出C-130「大力...",2025-11-06 21:14,cradio,2025-11-06 21:30,2025-11-06 21:14:00,"路透社報道，美國準備於敘利亞首都大馬士革一個空軍基地駐軍，推動敘利亞與以色列達成互不侵犯協議。消息被視為敘利亞自去年變天後，改為與美國結盟的跡象。

報道未有透露基地具體位置，但指將連接位於敘利亞南部、預料在以敘協議下劃設的非軍事區，將用作監督協議實施情況，技術磋商聚焦於基地的後勤、監視、入油和人道行動用途，而敘利亞將對基地保留全面主權。官員指，美方過去2個月正加快籌備，包括曾派出C-130「大力神」運輸機作測試，已確認基地長跑道可即時運作，但暫未清楚美方人員幾時會開始進駐。

由特朗普政府斡旋的以敘安全協議，原本有望在9月聯合國大會期間公布，但到最後一刻遇到障礙。報道指，華府正向敘利亞施壓，要求在今年底前達成協議，但亦可能會在敘利亞總統沙拉下周一訪美之前成事。"
2604383,教宗與阿巴斯首次會談　促落實「兩國方案」,https://www.881903.com/news/international/2604383,international,"教宗良十四世與巴勒斯坦自治政府主席阿巴斯，在梵蒂岡進行首次面對面會談。歷時約1小時，教廷形容氣氛友好，雙方同意急需向加沙人民提供援助，以及透過落實「兩國方案」結束地區衝突。
阿巴斯此行是為了紀念《聖座與巴勒斯坦全面協議》簽署10周年。他昨日抵達意大利羅馬，到聖母大殿向已故教宗方濟各的陵墓獻花，其後轉到梵蒂岡。",2025-11-06 21:13,cradio,2025-11-06 21:15,2025-11-06 21:13:00,"教宗良十四世與巴勒斯坦自治政府主席阿巴斯，在梵蒂岡進行首次面對面會談。歷時約1小時，教廷形容氣氛友好，雙方同意急需向加沙人民提供援助，以及透過落實「兩國方案」結束地區衝突。

阿巴斯此行是為了紀念《聖座與巴勒斯坦全面協議》簽署10周年。他昨日抵達意大利羅馬，到聖母大殿向已故教宗方濟各的陵墓獻花，其後轉到梵蒂岡。"
2604380,警務處代表出席東盟警察首長會議  交流打擊詐騙等,https://www.881903.com/news/local/2604380,local,"警務處隨國家公安部帶領的代表團，首次出席在泰國曼谷舉行的東盟警察首長會議，聚焦討論「協作行動：打擊詐騙、保護民眾」議題。

刑事及保安處處長陳東除出席會議外，分別與澳洲、柬埔寨、印尼、意大利、馬來西亞、緬甸、菲律賓、新加坡、南韓，以及越南的執法機構代表會面，或舉行雙邊會議，就打擊詐騙深入交流，推動協作打擊罪犯，加強保護民眾，深化與國際夥伴合作，鞏固香港警隊打擊跨境罪案的能力。",2025-11-06 20:49,cradio,2025-11-06 21:00,2025-11-06 20:49:00,"警務處隨國家公安部帶領的代表團，首次出席在泰國曼谷舉行的東盟警察首長會議，聚焦討論「協作行動：打擊詐騙、保護民眾」議題。

刑事及保安處處長陳東除出席會議外，分別與澳洲、柬埔寨、印尼、意大利、馬來西亞、緬甸、菲律賓、新加坡、南韓，以及越南的執法機構代表會面，或舉行雙邊會議，就打擊詐騙深入交流，推動協作打擊罪犯，加強保護民眾，深化與國際夥伴合作，鞏固香港警隊打擊跨境罪案的能力。"
2604379,王毅應約與英外相通電話  雙方同意對等解決各自合理關切,https://www.881903.com/news/china/2604379,china,"外長王毅應約同英國外交大臣顧綺慧通電話。王毅側重就加快解決影響中英關係的緊迫問題表明中方立場，雙方同意相向而行，對等解決各自合理關切。

王毅說，當前國際形勢變亂交織，中英關係不進則退。雙方應加強戰略溝通。中英兩國歷史文化各異，雙方存在分歧也很正常，但應本著相互尊重原則，努力增進相互了解，為雙邊關係穩定提供堅實保障。對於時而出現的雜音和干擾，尤要保持清醒頭腦，積極穩妥處理，保持兩國關係發展的主基調...",2025-11-06 20:37,cradio,2025-11-06 20:45,2025-11-06 20:37:00,"外長王毅應約同英國外交大臣顧綺慧通電話。王毅側重就加快解決影響中英關係的緊迫問題表明中方立場，雙方同意相向而行，對等解決各自合理關切。

王毅說，當前國際形勢變亂交織，中英關係不進則退。雙方應加強戰略溝通。中英兩國歷史文化各異，雙方存在分歧也很正常，但應本著相互尊重原則，努力增進相互了解，為雙邊關係穩定提供堅實保障。對於時而出現的雜音和干擾，尤要保持清醒頭腦，積極穩妥處理，保持兩國關係發展的主基調。

王毅表示，中方堅定維護聯合國憲章宗旨和原則，維護聯合國在國際體系主導地位，尊重各國主權和領土完整，主張以和平手段解決爭端，支持全球自由貿易和世貿組織規則，確保全球產供鏈穩定。中英在上述重大問題上立場總體一致，這是深化兩國戰略合作關係的重要內涵。中方願同英方共同努力，攜手應對全球性挑戰，促進世界和平與發展。

顧綺慧表示，英中兩國有很多共同利益，英方高度重視對華關係，期待同中方加強高層交往，拓展安全、發展和環境等領域合作。英中有必要保持常態化戰略溝通，共同應對氣候變化等全球性挑戰，共同維護聯合國憲章宗旨和原則，維護全球自由貿易，維護多邊體系。"
2604378,日防相小泉進次郎認為有必要發展核動力潛艇,https://www.881903.com/news/international/2604378,international,"日本防衛相小泉進次郎認為，日本有必要發展核動力潛艇；他接受日本傳 媒訪問時說，美國總統特朗普同意南韓建造核潛艇，由於周邊國家都擁有核潛艇，日本所處的安全環境已經嚴峻到必須認真討論是像過去一樣用柴油還是用核動力的程度。

根據日本戰後防衛政策提出的三不原則，日本不能擁有、生產或引進核武器。

小泉又透露，早前到馬來西亞出席東盟擴大防長會議時，有與會國對日本的二手潛艇表現出興趣。他希望能推動裝備轉移。...",2025-11-06 20:26,cradio,2025-11-06 20:45,2025-11-06 20:26:00,"日本防衛相小泉進次郎認為，日本有必要發展核動力潛艇；他接受日本傳 媒訪問時說，美國總統特朗普同意南韓建造核潛艇，由於周邊國家都擁有核潛艇，日本所處的安全環境已經嚴峻到必須認真討論是像過去一樣用柴油還是用核動力的程度。

根據日本戰後防衛政策提出的三不原則，日本不能擁有、生產或引進核武器。

小泉又透露，早前到馬來西亞出席東盟擴大防長會議時，有與會國對日本的二手潛艇表現出興趣。他希望能推動裝備轉移。"
2604377,張舉能明率司法機構代表團訪穗深 進行專業交流,https://www.881903.com/news/local/2604377,local,"終審法院首席法官張舉能，將於明日率領司法機構代表團前往廣州和深圳訪問兩天，其間將會出席座談會及參訪，與內地法官及相關人員就廣東省與香港的司法及法律重要發展和人工智能在內地法院的使用等，進行專業及技術交流。

今次訪問是司法機構與內地法院持續交流的其中一項安排。代表團成員包括高等法院上訴法庭副庭長朱芬齡、高等法院原訟法庭法官鄭蕙心、高等法院聆案官許家灝，以及司法機構政務長梁悅賢。在張舉能離港期間，由...",2025-11-06 20:11,cradio,2025-11-06 20:15,2025-11-06 20:11:00,"終審法院首席法官張舉能，將於明日率領司法機構代表團前往廣州和深圳訪問兩天，其間將會出席座談會及參訪，與內地法官及相關人員就廣東省與香港的司法及法律重要發展和人工智能在內地法院的使用等，進行專業及技術交流。

今次訪問是司法機構與內地法院持續交流的其中一項安排。代表團成員包括高等法院上訴法庭副庭長朱芬齡、高等法院原訟法庭法官鄭蕙心、高等法院聆案官許家灝，以及司法機構政務長梁悅賢。在張舉能離港期間，由終審法院常任法官李義署理終審法院首席法官職務。"
2604376,增1宗基孔肯雅熱輸入個案　青衣本地病例源頭與之前不同,https://www.881903.com/news/local/2604376,local,"本港新增1宗基孔肯雅熱輸入個案，73歲患者在東涌獨居，上月20至30日曾獨自到訪佛山，前日發燒及關節痛，昨日到北大嶼山醫院急症室求醫，目前情況穩定。

至於早前青衣曉峰園的本地個案，衛生防護中心已完成相關分析工作，顯示45歲男患者的病毒基因排序，與今年兩宗本地個案，或其他輸入病例並不一樣，反映感染源頭不同。防護中心不排除是病人活動的地區內，有未曾確診的患者將病毒傳播給蚊子，導致他受感染。

防護中...",2025-11-06 20:00,cradio,2025-11-06 20:15,2025-11-06 20:00:00,"本港新增1宗基孔肯雅熱輸入個案，73歲患者在東涌獨居，上月20至30日曾獨自到訪佛山，前日發燒及關節痛，昨日到北大嶼山醫院急症室求醫，目前情況穩定。

至於早前青衣曉峰園的本地個案，衛生防護中心已完成相關分析工作，顯示45歲男患者的病毒基因排序，與今年兩宗本地個案，或其他輸入病例並不一樣，反映感染源頭不同。防護中心不排除是病人活動的地區內，有未曾確診的患者將病毒傳播給蚊子，導致他受感染。

防護中心至今在曉峰園一帶，為逾4200人進行評估，當中4人因出現輕微病徵而接受抽血檢查，1人檢測結果呈陰性，其餘3人仍正等候結果。"
2604371,全運會跳水｜陳芋汐蔣敏潔雙人10米台奪金  全紅嬋王偉瑩第5,https://www.881903.com/news/sports/2604371,sports,"傍晚在廣州舉行的全運會跳水女子雙人10米台決賽，初組首名晉級的陳芋汐同掌敏潔，在由頭領放到尾，為上海贏得金牌。在初組第3晉級的廣東隊組合全紅嬋及王偉瑩，發揮失準，僅得第5，同獎牌無緣。

決賽進行5跳，陳芋汐同掌敏潔全部領先，以總分350.22分贏得金牌，四川隊的李芯汐及盧為，落後27.78分得銀牌；江蘇隊的劉軍熙及孟澤瑞得銅牌；全紅嬋及王偉瑩在第1跳位居第2，但在第2至第5跳失準，逐步落後，其中...",2025-11-06 19:21,cradio,2025-11-06 19:30,2025-11-06 19:21:00,"傍晚在廣州舉行的全運會跳水女子雙人10米台決賽，初組首名晉級的陳芋汐同掌敏潔，在由頭領放到尾，為上海贏得金牌。在初組第3晉級的廣東隊組合全紅嬋及王偉瑩，發揮失準，僅得第5，同獎牌無緣。

決賽進行5跳，陳芋汐同掌敏潔全部領先，以總分350.22分贏得金牌，四川隊的李芯汐及盧為，落後27.78分得銀牌；江蘇隊的劉軍熙及孟澤瑞得銅牌；全紅嬋及王偉瑩在第1跳位居第2，但在第2至第5跳失準，逐步落後，其中有兩跳排第5，最後一跳更排第6，最終同獎牌無緣。

18歲的全紅嬋在今年5月因傷，缺席全國跳水冠軍賽；由於訓練不足，今屆全運會只會參加團體賽及雙人賽，不會角逐個人賽。她星期日伙拍廣東隊友，奪得女團冠軍。"
2604370,海關土瓜灣掃毒時遇反抗　一名男子斬傷3名關員,https://www.881903.com/news/local/2604370,local,"土瓜灣發生傷人案，3名海關人員執行掃毒行動時遇襲，手腳被斬傷，清醒送往伊利沙伯醫院治理。海關關長陳子達將到醫院探望受傷關員。

事發在下午5時許，多名關員到土瓜灣道定安大廈一個單位掃毒時遇到反抗，一名男子向3名關員揮刀，其中兩人腳部受傷，一人手部受傷。施襲男子之後將自己反鎖在單位內。警方到場後圍封大廈並破門入屋，但疑犯已逃離現場。警方正追緝涉案男子。",2025-11-06 18:52,cradio,2025-11-06 19:00,2025-11-06 18:52:00,"土瓜灣發生傷人案，3名海關人員執行掃毒行動時遇襲，手腳被斬傷，清醒送往伊利沙伯醫院治理。海關關長陳子達將到醫院探望受傷關員。

事發在下午5時許，多名關員到土瓜灣道定安大廈一個單位掃毒時遇到反抗，一名男子向3名關員揮刀，其中兩人腳部受傷，一人手部受傷。施襲男子之後將自己反鎖在單位內。警方到場後圍封大廈並破門入屋，但疑犯已逃離現場。警方正追緝涉案男子。"
2604369,盧秀燕就台中豬瘟疫情鞠躬道歉  承認不足要承責,https://www.881903.com/news/china/2604369,china,"台中爆發台灣首宗非洲豬瘟，疫情受控，即日起恢復載運活豬，明日恢復屠宰售賣。市長盧秀燕召開記者會，兩度鞠躬道歉，承認防疫過程做得不好，須承擔全部責任並鄭重道歉，宣布啟動內部調查，市農業局長及環保局長因為防疫不力被免職。
盧秀燕被視為是2028年台灣領導人選舉國民黨熱門參選人；民進黨全力圍攻盧秀熱，批評台中市政府在疫情爆發後多次掩飾，導致防疫體系全面失靈。",2025-11-06 18:42,cradio,2025-11-06 18:45,2025-11-06 18:42:00,"台中爆發台灣首宗非洲豬瘟，疫情受控，即日起恢復載運活豬，明日恢復屠宰售賣。市長盧秀燕召開記者會，兩度鞠躬道歉，承認防疫過程做得不好，須承擔全部責任並鄭重道歉，宣布啟動內部調查，市農業局長及環保局長因為防疫不力被免職。

盧秀燕被視為是2028年台灣領導人選舉國民黨熱門參選人；民進黨全力圍攻盧秀熱，批評台中市政府在疫情爆發後多次掩飾，導致防疫體系全面失靈。"
2604365,新思維未有派人參選立法會　狄志遠：未獲足夠提名,https://www.881903.com/news/local/2604365,local,立法會選舉提名期結束，新思維未有派人參選。主席狄志遠回覆本台查詢指，經過努力，未能成功取得足夠選委提名，將以平常心看待。他說，新思維未來會繼續關注社會發展，積極向政府表達意見，並爭取下一次更好的機會。,2025-11-06 18:17,cradio,2025-11-06 18:30,2025-11-06 18:17:00,立法會選舉提名期結束，新思維未有派人參選。主席狄志遠回覆本台查詢指，經過努力，未能成功取得足夠選委提名，將以平常心看待。他說，新思維未來會繼續關注社會發展，積極向政府表達意見，並爭取下一次更好的機會。
