id,title,url,section,lead,date,source,scrape_time,last_update,news_content
2578666,大行看好未來阿里雲收入增長加快,https://www.881903.com/news/finance/2578666,finance,"摩根士丹利報告指，阿里巴巴(09988.HK)上季雲收入增長18%，符合預期，但低於市場增長20%的預期。管理層指出，考慮到供應鏈中斷和人民幣波動，上季業績並不完全具有代表性。由於互聯網、金融、教育和電動汽車等領域強勁而穩定的推理需求，阿里雲料將在未來幾季實現雲收入加速增長，預計公司2026年總收入增長8%，雲收入增長25%。

摩根士丹利認為，阿里巴巴是唯一一間主要專注於外部雲業務的雲服務提供商...",2025-05-16 11:55,cradio,2025-05-16 12:00,2025-05-16 11:55:00,"摩根士丹利報告指，阿里巴巴(09988.HK)上季雲收入增長18%，符合預期，但低於市場增長20%的預期。管理層指出，考慮到供應鏈中斷和人民幣波動，上季業績並不完全具有代表性。由於互聯網、金融、教育和電動汽車等領域強勁而穩定的推理需求，阿里雲料將在未來幾季實現雲收入加速增長，預計公司2026年總收入增長8%，雲收入增長25%。

摩根士丹利認為，阿里巴巴是唯一一間主要專注於外部雲業務的雲服務提供商，並將受益於行業繁榮。由於人工智能的投資，預計雲計算利潤率將基本保持穩定在高個位數，而上季度宣布的資本支出計劃沒有變化。

大摩維持對公司的「超配」評級，美股目標價180美元。

滙豐研究報告指，阿里巴巴上季客戶管理收入(CMR)增長強勁，將今個財年的CMR預期上調至8%，認為隨著阿里巴巴繼續取消對中小企業的服務費豁免，並在未來幾季進一步推出全平台廣告工具，這一增長軌跡仍有上升空間。另外，預計雲收入能夠繼續加速增長，實現今個財年底有20%的按年升幅。

滙豐又指，未來幾季淘寶天貓的利潤率將按年下降，短期內股價可能會在經歷了過去一個月的優異表現後稍作喘息，原因是貿易緊張局勢有所緩解，以及市場在競爭加劇和投資承諾增加的情況下，在2025財年第四季業績略低於預期後變得更加謹慎。滙豐維持「買入」評級，美股目標價176美元。"
2578664,張曼莉：網絡安全是香港繁榮穩定重要保障,https://www.881903.com/news/local/2578664,local,創新科技及工業局副局長張曼莉在一個網絡安全論壇致辭時表示，政府推出多項措施構建完善網絡安全體系，數字辦牽頭舉辦實境網絡安全攻防演練，提升政府部門及公營機構，面對網絡威脅時的應變能力。她表示，網絡安全是香港繁榮穩定的重要保障，數字辦會加強網絡安全人才培訓，鼓勵青年投身創科事業。,2025-05-16 11:47,cradio,2025-05-16 12:00,2025-05-16 11:47:00,創新科技及工業局副局長張曼莉在一個網絡安全論壇致辭時表示，政府推出多項措施構建完善網絡安全體系，數字辦牽頭舉辦實境網絡安全攻防演練，提升政府部門及公營機構，面對網絡威脅時的應變能力。她表示，網絡安全是香港繁榮穩定的重要保障，數字辦會加強網絡安全人才培訓，鼓勵青年投身創科事業。
2578663,日本經濟再陷收縮 對美貿易談判拖延或致衰退,https://www.881903.com/news/finance/2578663,finance,"日本經濟1年來再次出現萎縮，顯示在美國總統特朗普提出關稅措施前，當地經濟已經十分脆弱。日本經通脹調整後，首季國內生產總值折合年率環比下降0.7%，差過經濟學家預期的下降0.3%，原因是貿易表現疲弱，消費開支呆滯。
在美國關稅措施生效後，市場擔心日本會陷入衰退，民調顯示首相石破茂的支持率面臨壓力，今個月創下他出任首相以來的低點。在今年夏季舉行參議院選舉前，有關是否需要減稅或派發現金的爭論，可能會更加...",2025-05-16 11:40,cradio,2025-05-16 11:45,2025-05-16 11:40:00,"日本經濟1年來再次出現萎縮，顯示在美國總統特朗普提出關稅措施前，當地經濟已經十分脆弱。日本經通脹調整後，首季國內生產總值折合年率環比下降0.7%，差過經濟學家預期的下降0.3%，原因是貿易表現疲弱，消費開支呆滯。

在美國關稅措施生效後，市場擔心日本會陷入衰退，民調顯示首相石破茂的支持率面臨壓力，今個月創下他出任首相以來的低點。在今年夏季舉行參議院選舉前，有關是否需要減稅或派發現金的爭論，可能會更加激烈。

數據對日圓影響不大，兌美元徘徊145.3，市場認為特朗普希望美元匯價維持較低水平，令到日圓有支持。但預計日本央行會暫緩加息，央行早前下調今年經濟增長預測一半，同時監控徵稅的潛在影響。利率期貨顯示，市場預期7月前再次加息的機會只有12%，而在4月初特朗普提出關稅措施之前，市場對加息的預期約為78%。

日本智庫NLI研究院經濟研究部主管齊藤太郎，日本經濟極有可能在本季再度萎縮，出現技術性衰退的風險。他指，今次數據並未反映美國關稅的實質影響，措施今季開始生效，預計出口將會下降，資本支出也會放緩。

美國第一波關稅措施是在3月，特朗普對進口的鋼鐵和鋁材徵收25%的關稅。4月對汽車實施相同的稅率，同時對日本商品普遍徵收10%的關稅，若無貿易協議，幾個月後關稅將升至 24%。雖然美國財長貝森特上月表示，與日本的談判將優先進行，但相關談判進展甚微。商務部長盧特尼克月初更表示，與日本達成協議需要「大量時間」。

齊藤太郎說，不認為今次經濟數據會改變日本央行的政策立場，一切都取決於關稅談判結果，但日本央行可能會維時暫停加息，同時研究關稅的影響。

法國農業信貸證券首席經濟學家相田隆二表示，除非美日達成的協議，對日本幾乎沒有任何損害，否則很可能會造成負面影響，相信首相石破茂寧願無協議，好過一個壞的協議。日本正在尋求美國取消對日本汽車的關稅，汽車業是日本經濟的主要動力，僱用約8%的勞動力。"
2578662,大摩：網易業績超預期　具防禦性及獨特盈利上升,https://www.881903.com/news/finance/2578662,finance,"摩根士丹利表示，網易首季業績超預期，並分別上調今明兩年遊戲收入預測3.5%和2.4%；預計每股收益 (EPS) 增長13%和10% ，反映毛利率改善及嚴格的營運成本控制，考慮到新遊戲更好的盈利能力與利潤率，將遊戲業務的市盈率目標從14倍上調至15倍 。
大摩表示，網易不僅具有防禦性，而且在復蘇軌跡上具有巨大和獨特的盈利上行空間。大摩指，網易積極拓展海外市場，近期推出的遊戲亦取得成功 。對於網易關閉...",2025-05-16 11:38,cradio,2025-05-16 11:45,2025-05-16 11:38:00,"摩根士丹利表示，網易(09999.HK)首季業績超預期，並分別上調今明兩年遊戲收入預測3.5%和2.4%；預計每股收益 (EPS) 增長13%和10% ，反映毛利率改善及嚴格的營運成本控制，考慮到新遊戲更好的盈利能力與利潤率，將遊戲業務的市盈率目標從14倍上調至15倍 。

大摩表示，網易不僅具有防禦性，而且在復蘇軌跡上具有巨大和獨特的盈利上行空間。大摩指，網易積極拓展海外市場，近期推出的遊戲亦取得成功 。對於網易關閉了一些以單機角色扮演（RPG）遊戲為主的海外工作室，大摩認為屬於正常的產品調整過程，網易在領域內亦不具競爭優勢，預計公司未來將專注於在線多人遊戲的優勢領域上，並提高海外市場的遊戲內行銷能力 。大摩亦預計，網易於5月20日舉行的年度產品展將會成為下一個催化劑。

大摩將網易2025至2027年遊戲收入預測上調1.5%至3.5% ，主要受高於預期的移動端收入推動；毛利率上調2.8至5個百分點，反映更有利的收入組合；純利預測分別上調13.5%、10.5%及6.2% ，以反映網易強勁的營運槓桿與成本控制 。上調美股目標價18%至138美元，維持「增持」評級。"
2578659,副商務部長李成鋼：中方堅定不移推動高水平對外開放,https://www.881903.com/news/china/2578659,china,"國家商務部國際貿易談判代表兼副部長李成鋼在南韓濟州，出席中國與《數字經濟夥伴關係協定》DEPA成員部級會議。中方在2021申請加入DEPA，李成鋼在會上指，中方堅定不移推動高水平對外開放，積極對接國際高標準經貿規則，維護以規則為基礎的國際經貿秩序，並與DEPA成員持續開展各層級密切溝通，全面展示中方達到協定高標準的決心、能力和行動，相關談判取得積極進展。
李成鋼表示，中方加入DEPA將為各方企業帶...",2025-05-16 11:23,cradio,2025-05-16 11:30,2025-05-16 11:23:00,"國家商務部國際貿易談判代表兼副部長李成鋼在南韓濟州，出席中國與《數字經濟夥伴關係協定》DEPA成員部級會議。中方在2021申請加入DEPA，李成鋼在會上指，中方堅定不移推動高水平對外開放，積極對接國際高標準經貿規則，維護以規則為基礎的國際經貿秩序，並與DEPA成員持續開展各層級密切溝通，全面展示中方達到協定高標準的決心、能力和行動，相關談判取得積極進展。

李成鋼表示，中方加入DEPA將為各方企業帶來更多市場機遇，並為DEPA長遠發展和國際數字經濟規則構建作出積極貢獻。中方期待與DEPA成員採取創新方式，共同加快談判進程，取得更多實質性進展。"
2578655,本港4月破產呈請811宗按月跌8%,https://www.881903.com/news/local/2578655,local,"破產管理署數據顯示，本港4月破產呈請811宗，按年升9.3%，按月則回落8.5%。法庭發出接管令或破產令有941宗，按年升9.5%，按月則升46%。

4月強制公司清盤呈請有61宗，按年減少7.6%，按月減約9%。法院發出清盤令有66宗，按年升近74%，按月升22%。",2025-05-16 11:07,cradio,2025-05-16 11:15,2025-05-16 11:07:00,"破產管理署數據顯示，本港4月破產呈請811宗，按年升9.3%，按月則回落8.5%。法庭發出接管令或破產令有941宗，按年升9.5%，按月則升46%。

4月強制公司清盤呈請有61宗，按年減少7.6%，按月減約9%。法院發出清盤令有66宗，按年升近74%，按月升22%。"
2578654,魯比奧：所有北約成員國將同意防衛開支增至GDP的5%,https://www.881903.com/news/international/2578654,international,"美國國務卿魯比奧接受霍士新聞訪問時指，在6月底舉行北約峰會時，所有成員國的防衛開支，都將達到國內生產總值最少2%的目標，亦會同意在未來10年提升至GDP的5%。
新上任的德國外長瓦德富爾，早前在土耳其出席北約成員國外長會議時表示，支持由美國總統特朗普提出，北約成員國要將國內生產總值5%用於國防的目標，認為是美國對北約共同防衛的承諾。北約秘書長呂特就建議成員國，可以將3.5%的GDP用於國防，另外1...",2025-05-16 10:53,cradio,2025-05-16 11:00,2025-05-16 10:53:00,"美國國務卿魯比奧接受霍士新聞訪問時指，在6月底舉行北約峰會時，所有成員國的防衛開支，都將達到國內生產總值最少2%的目標，亦會同意在未來10年提升至GDP的5%。

新上任的德國外長瓦德富爾，早前在土耳其出席北約成員國外長會議時表示，支持由美國總統特朗普提出，北約成員國要將國內生產總值5%用於國防的目標，認為是美國對北約共同防衛的承諾。北約秘書長呂特就建議成員國，可以將3.5%的GDP用於國防，另外1.5%用於基建及網絡安全等。"
2578653,美韓貿易官員時隔3周再會面討論關稅問題,https://www.881903.com/news/international/2578653,international,"美韓貿易官員今日在南韓濟州舉行高級別雙邊會談，討論關稅事宜。出席的包括美國貿易代表格里爾，及南韓產業部長安德根。今次是美韓貿易官員上月24日在美國華盛頓舉行「2+2」高級別磋商後，兩人時隔3星期再會面。

格里爾正在濟州出席亞太經合組織貿易部長會議。他昨日曾與南韓產業部通商交涉本部長鄭仁教會面，並與南韓造船業巨頭HD現代重工及韓華海洋的代表閉門會面，商討美韓造船產業合作。",2025-05-16 10:51,cradio,2025-05-16 11:00,2025-05-16 10:51:00,"美韓貿易官員今日在南韓濟州舉行高級別雙邊會談，討論關稅事宜。出席的包括美國貿易代表格里爾，及南韓產業部長安德根。今次是美韓貿易官員上月24日在美國華盛頓舉行「2+2」高級別磋商後，兩人時隔3星期再會面。

格里爾正在濟州出席亞太經合組織貿易部長會議。他昨日曾與南韓產業部通商交涉本部長鄭仁教會面，並與南韓造船業巨頭HD現代重工及韓華海洋的代表閉門會面，商討美韓造船產業合作。"
2578652,Timiraos：聯儲局檢討政策制訂框架應對經濟變化,https://www.881903.com/news/finance/2578652,finance,"有""新美聯儲通訊社""之稱的知名財經記者Nick Timiraos撰文，談及聯儲局主席鮑威爾指，鑑於新冠疫情後的通脹和利率前景，發生重大變化，聯儲局正著手調整整體的政策制定框架。Timiraos指，面對不再確定是否有超低利率的世界，鮑威爾引導新的戰略，聯儲局調整利率制定框架，雖然不太可能影響當前的政策決策，但承認""長期低利率""時代可能已經結束。

Timiraos解釋，鮑威爾所講的""框架""，是指聯儲...",2025-05-16 10:49,cradio,2025-05-16 11:00,2025-05-16 10:49:00,"有""新美聯儲通訊社""之稱的知名財經記者Nick Timiraos撰文，談及聯儲局主席鮑威爾指，鑑於新冠疫情後的通脹和利率前景，發生重大變化，聯儲局正著手調整整體的政策制定框架。Timiraos指，面對不再確定是否有超低利率的世界，鮑威爾引導新的戰略，聯儲局調整利率制定框架，雖然不太可能影響當前的政策決策，但承認""長期低利率""時代可能已經結束。

Timiraos解釋，鮑威爾所講的""框架""，是指聯儲局制定利率政策的整體戰略。美國國會賦予聯儲局的職責是保持低且穩定的通脹，同時促進就業市場健康發展。如何實現這些目標，主要由聯儲局自行決定。自2012年以來，聯儲局通過一份框架聲明，來闡述他們實現這些目標的方式。

而聯儲局目前的政策框架，是在5年前採納的，並於今年開始進行檢討。Timiraos援引鮑威爾講話的重點，包括2020年疫情後出現更高的實際利率(即經通脹調整後的利率)，可能使當前框架中的某些要素失去意義。

而更高的實際利率，可能反映出未來通脹比2010年代的危機時期，更具波動性。現時可能正進入一個供應沖擊更加頻繁、而且可能更持久的時期。在上星期的討論中，聯儲局成員認為，應修訂5年前採納的""平均通脹目標""機制——即使模型建議更高的利率，他們也會保持較低利率，允許通脹略高於2%的目標。

Timiraos指，2021年疫情後的經濟重啟，使得2020年框架中的主要變革，失去適用性。2021年11月，美國通脹達到6%，主要由強勁需求和供應鏈混亂推動，這些情況並未在之前制訂框架時預見。聯儲局今次檢討，是反思2020年框架不足之處，尤其是框架未能適應一系列廣泛的經濟情境。

不過，這次檢討預計會保留聯儲局框架中的核心理念，包括2%的通脹目標，以及確保公眾相信聯儲局將維持通脹低且穩定這個關鍵任務。聯儲局成員認為，這種通脹預期具有自我實現的特性，是過去2年在就業穩定下，實現通脹下降的主要原因。"
2578651,據報美國擬將更多中國晶片公司列入出口管制清單,https://www.881903.com/news/international/2578651,international,"中美關稅戰降溫之際，英國《金融時報》引述消息報道，美國商務部正在考慮，將更多中國公司列入出口管制清單。據報商務部已起草名單，涉及的中國公司包括長鑫存儲，中芯國際與長江存儲的子公司亦上榜。

報道指，特朗普政府內部對有關出口管制出現分歧。部分官員認為，新管制將影響中美正進行的貿易談判，亦有官員提及共和黨人的批評，指前拜登政府推遲對中國採取競爭性行動，令中美外交接觸淪為「殭屍外交」。",2025-05-16 10:47,cradio,2025-05-16 11:00,2025-05-16 10:47:00,"中美關稅戰降溫之際，英國《金融時報》引述消息報道，美國商務部正在考慮，將更多中國公司列入出口管制清單。據報商務部已起草名單，涉及的中國公司包括長鑫存儲，中芯國際與長江存儲的子公司亦上榜。

報道指，特朗普政府內部對有關出口管制出現分歧。部分官員認為，新管制將影響中美正進行的貿易談判，亦有官員提及共和黨人的批評，指前拜登政府推遲對中國採取競爭性行動，令中美外交接觸淪為「殭屍外交」。"
2578649,日本上季GDP按季跌0.2%　按年收縮0.7%,https://www.881903.com/news/finance/2578649,finance,"日本上季全國生產總值GDP初值，剔除物價變動因素後，按季下跌0.2%，按年就收縮0.7%，是一年來首次出現負增長，表現差過市場預期。期內個人消費按季增長是0%；企業設備投資增長1.4%。

至於2024年度實際GDP，按年增長0.8%。",2025-05-16 10:44,cradio,2025-05-16 11:00,2025-05-16 10:44:00,"日本上季全國生產總值GDP初值，剔除物價變動因素後，按季下跌0.2%，按年就收縮0.7%，是一年來首次出現負增長，表現差過市場預期。期內個人消費按季增長是0%；企業設備投資增長1.4%。

至於2024年度實際GDP，按年增長0.8%。"
2578648,比亞迪將在匈牙利設立歐洲總部　投資額2.8億美元,https://www.881903.com/news/finance/2578648,finance,"比亞迪(01211.HK)董事長王傳福在布達佩斯，與匈牙利總理歐爾班會晤後宣布，比亞迪將在匈牙利設立歐洲總部。匈牙利外長西雅爾多在聲明中表示，這個地區中心將在布達佩斯創造2000個就業職位，投資額達2.8億美元。
比亞迪今次在匈牙利設立歐洲總部，是全球化戰略的重要一步。歐洲是全球新能源汽車的重要市場之一，比亞迪通過在匈牙利設立總部，可以更好服務歐洲客戶，提升品牌影響力，同時有助比亞迪進一步拓展全球...",2025-05-16 10:42,cradio,2025-05-16 10:45,2025-05-16 10:42:00,"比亞迪(01211.HK)董事長王傳福在布達佩斯，與匈牙利總理歐爾班會晤後宣布，比亞迪將在匈牙利設立歐洲總部。匈牙利外長西雅爾多在聲明中表示，這個地區中心將在布達佩斯創造2000個就業職位，投資額達2.8億美元。

比亞迪今次在匈牙利設立歐洲總部，是全球化戰略的重要一步。歐洲是全球新能源汽車的重要市場之一，比亞迪通過在匈牙利設立總部，可以更好服務歐洲客戶，提升品牌影響力，同時有助比亞迪進一步拓展全球業務，提升公司在全球新能源汽車產業的競爭力。"
2578646,特朗普：擬開發F-55戰機　改良F-22戰機,https://www.881903.com/news/international/2578646,international,"美國總統特朗普透露，正考慮將美軍現有的F-35戰機，升級為F-55，並將F-22戰機升級為「超級F-22」。特朗普在卡塔爾出席企業高層會議時指，F-55將配備雙引擎，若價格合理，就會進行研發。他又指，F-22是世上最漂亮的戰機，美國計劃改良F-22，變得更現代化。
特朗普未有提及計劃詳情。分析指出，F-55可能是海軍正在推動的F/A-XX計劃，用來取代F/A-18「超級大黃蜂」戰機。有英國國防分析...",2025-05-16 10:35,cradio,2025-05-16 10:45,2025-05-16 10:35:00,"美國總統特朗普透露，正考慮將美軍現有的F-35戰機，升級為F-55，並將F-22戰機升級為「超級F-22」。特朗普在卡塔爾出席企業高層會議時指，F-55將配備雙引擎，若價格合理，就會進行研發。他又指，F-22是世上最漂亮的戰機，美國計劃改良F-22，變得更現代化。

特朗普未有提及計劃詳情。分析指出，F-55可能是海軍正在推動的F/A-XX計劃，用來取代F/A-18「超級大黃蜂」戰機。有英國國防分析師指，若將單引擎的F-35加裝第二個引擎，將是全新的飛機，不太可能只是簡單衍生機型。F-22已停產，若進行大規模升級，成本將非常高昂。"
2578645,鮑威爾：長期利率可能更高 未來供應衝擊或更頻繁,https://www.881903.com/news/finance/2578645,finance,"美國聯儲局主席鮑威爾表示，隨著經濟變化和政策變動，長期利率可能會更高。他又在政策架構檢討會議表示，聯儲局上一次在2020年夏季進行檢討後，過去5年情況發生重大變化，聯儲局目睹了一段通脹飆升的時期，需要進行激進的加息。鮑威爾指，即使較長期的通脹預期基本符合聯儲局 2% 的目標，但接近零利率的時代，亦不可能很快回來。
鮑威爾指，較高的實際利率亦可能反映未來的通脹，可能會比2010年代的危機間期更不穩定...",2025-05-16 10:30,cradio,2025-05-16 10:45,2025-05-16 10:30:00,"美國聯儲局主席鮑威爾表示，隨著經濟變化和政策變動，長期利率可能會更高。他又在政策架構檢討會議表示，聯儲局上一次在2020年夏季進行檢討後，過去5年情況發生重大變化，聯儲局目睹了一段通脹飆升的時期，需要進行激進的加息。鮑威爾指，即使較長期的通脹預期基本符合聯儲局 2% 的目標，但接近零利率的時代，亦不可能很快回來。

鮑威爾指，較高的實際利率亦可能反映未來的通脹，可能會比2010年代的危機間期更不穩定，未來可能會進入一個""供應衝擊""更頻繁、也可能更持久的時期，對經濟和央行都是一個艱巨的挑戰。

聯儲局在2008年金融海嘯後，將基準借貸利率維持在接近零的水平達7年。但自去年12月以來，隔夜貸款利率一直在4.25%至4.5%之間，最近為4.33%。鮑威爾的説法和他過去幾星期發出的警告類似，即聯儲局可能在支持就業與控制通脹之間，陷入困境，難以取得平衡。

雖然鮑威爾的談話，無提及美國總統特朗普的關稅政策，但他在最近幾天提及，關稅可能會導致經濟增長放緩，並刺激通脹。聯儲局暫時採取觀望，在去年將基準利率調低1個百分點後，一直未有再放寬政策。

至於正在進行的架構檢討，鮑威爾表示，會考慮多項因素，包括聯儲局傳達對未來預期的方式，以及調整上次檢討的結果。聯儲局亦會探討現時通脹和就業目標的「不足之處」。

鮑威爾說，參與討論的聯儲局成員，認為適宜重新考慮他們傳達通脹和就業的措辭，對所謂""平均通貨膨脹目標""，看法亦類似。聯儲局將確保我們新的共識聲明，可以適應廣泛的經濟環境和發展。

鮑威爾說，雖然學術界和市場參與者普遍認為聯儲局的溝通是有效的，但總是有改善的空間。面對震盪更大、更頻繁或更分散的時期，有效的溝通，需要傳達他們對經濟前景和不確定性的理解。鮑威爾並未具體說明時間表，只是說預計將在未來幾個月內完成。"
2578642,小米本月發布自研手機芯片「玄戒O1」,https://www.881903.com/news/finance/2578642,finance,"小米(01810.HK)董事長雷軍在微博發文宣布，小米自主研發設計的手機SoC芯片，命名為「玄戒O1」，會在今個月下旬發布。雷軍表示，小米的造芯之路始於2014年9月，他又引用人民網對小米造芯的評價，指「只要堅定實幹，就沒有不可逾越的高山；只要奮起直追，後來者永遠有機會」。

內地網上消息指，小米自研芯片「玄戒O1」將會在小米15s旗艦手機系列上首發搭載，可見小米對於「玄戒O1」的性能表現充滿了信...",2025-05-16 10:15,cradio,2025-05-16 10:30,2025-05-16 10:15:00,"小米(01810.HK)董事長雷軍在微博發文宣布，小米自主研發設計的手機SoC芯片，命名為「玄戒O1」，會在今個月下旬發布。雷軍表示，小米的造芯之路始於2014年9月，他又引用人民網對小米造芯的評價，指「只要堅定實幹，就沒有不可逾越的高山；只要奮起直追，後來者永遠有機會」。

內地網上消息指，小米自研芯片「玄戒O1」將會在小米15s旗艦手機系列上首發搭載，可見小米對於「玄戒O1」的性能表現充滿了信心。"
