title,date,scrape_time,section,source,url,news_content
香港海關檢獲約四百二十萬元懷疑毒品（附圖）,2026-01-15 18:00,2026-01-15 18:30,Chi,gia,https://www.info.gov.hk/gia/general/202601/15/P2026011500499.htm,"香港海關昨日（一月十四日）在油塘搗破一個懷疑毒品儲存倉，檢獲約十三公斤懷疑毒品，估計市值共約四百二十萬元，並拘捕一名二十八歲男子。

海關人員昨日下午在油塘進行反毒品行動時截查一名男子，在該名男子的背包內檢獲約三公斤懷疑毒品，包括搖頭丸、海洛英、可卡因及迷幻蘑菇，遂把該男子拘捕。

其後，海關人員押解他到附近一個迷你儲存倉及一個住宅單位搜查，於單位內檢獲約十公斤懷疑毒品，包括搖頭丸、海洛英、可卡因、迷幻蘑菇、氯胺酮、依托咪酯煙彈、霹靂可卡因、大麻花和一批懷疑毒品包裝工具。

案件仍在調查中。

根據《危險藥物條例》，販運危險藥物屬嚴重罪行，一經定罪，最高可被判罰款五百萬元及終身監禁。

市民可致電海關二十四小時熱線182 8080，或透過舉報罪案專用電郵帳戶（crimereport@customs.gov.hk）或網上表格（eform.cefs.gov.hk/form/ced002）舉報懷疑販毒活動。"
民政及青年事務局推出「民青局青年初創實習計劃2026」,2026-01-15 18:00,2026-01-15 18:30,Chi,gia,https://www.info.gov.hk/gia/general/202601/15/P2026011500268.htm,"民政及青年事務局（民青局）與香港數碼港管理有限公司（數碼港）和香港科技園公司（科技園）合作，今日（一月十五日）推出「民青局青年初創實習計劃2026」，為青年提供本地初創企業實習的機會。

民青局致力推動青年發展，在二○二一年以試點形式推出實習計劃。基於試點計劃的成功，民青局於二○二三年恆常化並擴大計劃，每年與數碼港和科技園合作為青年人提供初創實習崗位，培養他們對創科事業的興趣，同時為業界培育人才，配合香港未來創科發展的大方向。

在民青局的資助下，數碼港和科技園在新一輪計劃繼續提供合共200個為期三至六個月的實習崗位，涵蓋數據分析、金融科技、生物科技、人工智能應用、業務拓展、市場推廣及設計等。參加計劃的初創企業可以全職、兼職或以混合模式聘請實習生。申請人須為18至30歲，（i）持有香港永久性居民身份證的全日制專上學生（包括副學位、學士學位或研究院課程）；或（ii）持有香港居民身份證的本地全日制專上學生（包括副學位、學士學位或研究院課程）。除實習工作外，數碼港和科技園亦會為實習生提供一系列的培訓和創業體驗活動，以及到內地的初創企業考察等。

​實習計劃的詳情及實習職位的資料已經上載於數碼港和科技園的計劃專頁。有興趣的青年可透過專頁內的電子申請系統向企業遞交申請。參與企業將會在接獲申請後負責招募評選工作和落實實習安排。




合辦機構
計劃專頁


數碼港
www.cyberport.hk/zh-hk/entrepreneurship/hyab_youth_start_up_internship_programme_2026/


科技園
www.hkstp.org/zh-hk/talent/early-career-and-internship/hyab-youth-start-up-internship-programme



"
Hong Kong Customs seizes suspected dangerous drugs worth about $4.2 million (with photo),2026-01-15 18:00,2026-01-15 18:30,Eng,gia,https://www.info.gov.hk/gia/general/202601/15/P2026011500501.htm,"Hong Kong Customs yesterday (January 14) shut down a suspected drug storage centre in Yau Tong and seized about 13 kilograms of suspected dangerous drugs with a total estimated market value of about $4.2 million. A 28-year-old man was arrested.
​
During an anti-narcotics operation conducted in Yau Tong yesterday afternoon, Customs officers intercepted a man and seized about 3kg of suspected drugs, including MDMA, heroin, cocaine and psilocybin mushrooms, inside a rucksack carried by him. The man was subsequently arrested.

Customs officers later escorted him to a mini-storage warehouse and residential premises nearby for a search and further seized about 10kg of suspected drugs, including MDMA, heroin, cocaine, psilocybin mushrooms, ketamine, etomidate capsules, crack cocaine, cannabis buds and a batch of suspected drug packaging paraphernalia.

An investigation is ongoing.

Under the Dangerous Drugs Ordinance, trafficking in a dangerous drug is a serious offence. The maximum penalty upon conviction is a fine of $5 million and life imprisonment.

Members of the public may report any suspected drug trafficking activities to Customs' 24-hour hotline 182 8080 or its dedicated crime-reporting email account (crimereport@customs.gov.hk) or online form (eform.cefs.gov.hk/form/ced002)."
​香港海關特別行動打擊售賣冒牌名牌時裝物品（附圖）,2026-01-15 17:30,2026-01-15 17:45,Chi,gia,https://www.info.gov.hk/gia/general/202601/15/P2026011500413.htm,"香港海關於一月六日至十四日在紅磡和鰂魚涌採取特別執法行動，打擊售賣冒牌名牌時裝物品活動，檢獲約一千件懷疑冒牌物品，包括服飾、鞋、手袋和首飾，估計市值約七百三十萬元，並拘捕兩人。

海關早前透過情報分析，發現一間位於紅磡的零售店鋪售賣懷疑冒牌名牌時裝物品。海關人員遂採取執法行動，突擊搜查該間零售店鋪及其儲存倉庫，共檢獲約四百件懷疑冒牌服飾，估計市值約七十萬元。

另外，海關於早前接獲舉報，指有一間位於鰂魚涌的零售店鋪售賣懷疑冒牌服飾。經過深入調查及在商標持有人的協助下，海關人員採取執法行動，突擊搜查該零售店鋪，共檢獲約六百件懷疑冒牌服飾，估計市值約六百六十萬元。

行動中，海關共拘捕兩名分別48歲和53歲的女店主。

案件仍在調查中，不排除會有更多人被捕。

農曆新年將至，海關會繼續加強巡查和執法，打擊不同售賣冒牌物品活動。

海關提醒消費者應光顧信譽良好的店鋪，如對產品真偽有懷疑，應先向有關商標持有人或其代理商查詢。商戶於採購物品時亦應小心謹慎，因售賣冒牌物品屬嚴重罪行，須負上刑責。

根據《商品說明條例》，任何人銷售或為售賣用途而管有冒牌物品，即屬違法。一經定罪，最高可被判罰款五十萬元及監禁五年。

市民可致電海關二十四小時熱線182 8080，或透過舉報罪案專用電郵帳戶（crimereport@customs.gov.hk）或網上表格（eform.cefs.gov.hk/form/ced002）舉報懷疑冒牌活動。"
Update on chikungunya fever,2026-01-15 17:30,2026-01-15 17:45,Eng,gia,https://www.info.gov.hk/gia/general/202601/15/P2026011500527.htm,"  The Centre for Health Protection (CHP) of the Department of Health announced that, as of 5pm today (January 15), no new cases of chikungunya fever (CF) had been recorded.

Latest surveillance data
---------------------------

  Hong Kong has recorded a total of 82 confirmed CF cases last year. Among them, 11 were local cases, and the rest were imported cases.

  Since the beginning of 2025, and as of December 10, 2025, a total of 502 264 CF cases and 186 CF-related deaths have been reported in over 40 countries/territories. Cases have been reported in the Americas, Africa, Asia, and Europe. Although the northern hemisphere has entered the winter season, temperatures in subtropical and some temperate regions remain elevated due to climate change, creating favourable conditions for mosquito breeding. In addition, CF outbreaks continue to occur in many countries worldwide. The risk of imported cases persists. Members of the public should check the situation of the destinations before travelling abroad, especially when travelling to Southeast Asian countries.

Government's comprehensive follow-up actions
-----------------------------------------------------

  Given that some local cases of CF have visited the Tsing Yi Nature Trails or the surrounding area in November last year, the trails are currently closed until further notice. Relevant government departments continue to conduct large-scale mosquito control and prevention efforts along the trails, and the CHP appeals to the public not to enter the area in order to reduce the risk of contracting CF and to avoid exposure to chemicals or interfering with the mosquito control operations. Since the confirmation on December 10, 2025, of a case involving a person who had visited the Tsing Yi Nature Trails on November 30, 2025, no further local cases have been recorded to date.

  The Food and Environmental Hygiene Department (FEHD) has been continuously conducting intensive fogging operations to eliminate adult mosquitoes along the Tsing Yi Nature Trails and the surrounding area. At suitable locations, large ultra-low volume foggers have been deployed, and a robot dog is being put on trial to enhance operational effectiveness. The FEHD has also set up new mosquito trapping devices, cleared discarded containers and garbage that could cause stagnant water, and applied larvicide oil or larvicides in areas with stagnant water that cannot be removed immediately. The FEHD has been collaborating with the Kwai Tsing District Office, the Lands Department and the Drainage Services Department to strengthen efforts in eliminating potential mosquito breeding sites along the Tsing Yi Nature Trails. Pamphlets have been distributed to hikers in the area, urging citizens to be vigilant against mosquito infestations and take personal protective measures. The FEHD has also held meetings of the interdepartmental task forces on anti-mosquito work across districts to discuss the latest developments regarding the situation and plan accordingly to co-ordinate relevant departments and stakeholders in strengthening mosquito prevention and control measures in areas under their purview.

Continuously strengthening prevention and control
---------------------------------------------------------

  The FEHD and relevant departments have comprehensively enhanced the mosquito control operations in Hong Kong since July last year, and this has continued. Among these, the FEHD has conducted vector investigations and targeted mosquito control operations against the imported and local cases. In light of the local case, the FEHD has immediately conducted follow-up actions, including:


carrying out intensive fogging in scrubby areas within a 250-metre radius of the relevant locations to kill adult mosquitoes;
carrying out inspections of the locations, removing stagnant water, applying insecticides and disposing of abandoned water containers every week with a view to preventing mosquito breeding; and
enhancing public education efforts through organising health talks, setting up mobile education stations, and distributing publicity leaflets.


​The abovementioned measures will be continued. Furthermore, the Government will further enhance the mosquito control efforts in addition to the existing measures.

Preventive measures to be taken by the public
----------------------------------------------------

  Members of the public should use DEET-containing insect repellents or other effective active ingredients properly to prevent mosquito bites, but the following precautions should be taken when using them:


read the label instructions carefully first;
apply right before entering an area with a risk of mosquito bites;
apply on exposed skin and clothing;
use DEET of up to 30 per cent for pregnant women and up to 10 per cent for children (for children who travel to countries or areas where mosquito-borne diseases are endemic or epidemic and where exposure is likely, those aged 2 months or above can use DEET-containing insect repellents with a DEET concentration of up to 30 per cent);
apply sunscreen first, then insect repellent;
reapply only when needed and follow the instructions; and
in addition to DEET, there are other insect repellents available on the market containing different active ingredients, such as IR3535 and picaridin. When using any insect repellent, the public should follow the usage instructions and precautions on the product label.


The FEHD also appeals to members of the public to continue to stay alert and work together to carry out mosquito prevention and control measures early, including inspecting their homes and surroundings to remove potential breeding grounds, changing water in vases and scrubbing their inner surfaces, removing water in saucers under potted plants at least once a week, and properly disposing of containers such as empty cans and lunch boxes. The FEHD also advises members of the public and property management agencies to keep drains free of blockage and level all defective ground surfaces to prevent the accumulation of water. They should also scrub all drains and surface sewers with an alkaline detergent at least once a week to remove any mosquito eggs.

​The public should call 1823 in case of mosquito problems, and may visit the following pages for more information: the CF page of theCHPand theTravel Health Service, the latestTravel Health News,tips for using insect repellents, and the CHPFacebook Page,Instagram AccountandYouTube Channel, and also theMosquito Prevention and Control dedicated pageof the FEHD."
Hong Kong Customs special operation combats sale of counterfeit luxury fashion products (with photo),2026-01-15 17:30,2026-01-15 17:45,Eng,gia,https://www.info.gov.hk/gia/general/202601/15/P2026011500414.htm,"Hong Kong Customs mounted a special operation in Hung Hom and Quarry Bay between January 6 and 14 to combat the sale of counterfeit luxury fashion products. About 1 000 suspected counterfeit goods, including apparel, shoes, handbags and jewellery, with an estimated market value of about $7.3 million, were seized. Two persons were arrested.

Through intelligence analysis, Customs earlier discovered a retail shop in Hung Hom selling suspected counterfeit luxury fashion products. Customs officers then took enforcement action and raided the retail shop and its storage facility. About 400 pieces of suspected counterfeit apparel, with an estimated market value of about $700,000, were seized.

In addition, Customs earlier received information alleging that suspected counterfeit apparel was put on sale at a retail shop in Quarry Bay. After detailed investigations and with the assistance of the trademark owners, Customs officers took enforcement action and raided the retail shop. About 600 suspected counterfeit apparel items, with an estimated market value of about $6,600,000, were seized.

During the operation, two female shop owners, aged 48 and 53, were arrested.

The investigation is ongoing, and the likelihood of further arrests is not ruled out.

With the Lunar New Year around the corner, Customs will continue to step up inspections and enforcement to vigorously combat different kinds of counterfeiting activities.

Customs reminds consumers to procure goods at reputable shops and to check with the trademark owners or their authorised agents if the authenticity of a product is in doubt. Traders should also be cautious and prudent in merchandising since selling counterfeit goods is a serious crime and offenders are liable to criminal sanctions.

Under the Trade Descriptions Ordinance, any person who sells or possesses for sale any goods with a forged trademark commits an offence. The maximum penalty upon conviction is a fine of $500,000 and imprisonment for five years.

Members of the public may report any suspected counterfeiting activities to Customs' 24-hour hotline 1828080 or its dedicated crime-reporting email account (crimereport@customs.gov.hk) or online form (eform.cefs.gov.hk/form/ced002)."
基孔肯雅熱最新情況,2026-01-15 17:30,2026-01-15 17:45,Chi,gia,https://www.info.gov.hk/gia/general/202601/15/P2026011500524.htm,"衞生署衞生防護中心（中心）表示，截至今日（一月十五日）下午五時，中心沒有錄得新增感染基孔肯雅熱個案。

最新監測數據
———————

本港去年累計錄得82宗基孔肯雅熱確診個案中，11宗屬本地個案，其餘全部屬輸入個案。

自二○二五年初至十二月十日，全球超過40個國家／地區呈報了502 264宗基孔肯雅熱病例及186宗相關死亡個案。個案分布在美洲、非洲、亞洲及歐洲。雖然北半球已進入冬季，但受氣候變化影響，亞熱帶及部分溫帶地區的氣溫仍然偏高，適合蚊媒滋生，加上基孔肯雅熱在全球多國持續爆發，輸入風險仍然存在，市民外遊前必須注意當地情況，尤其前往東南亞國家。

政府全方位跟進
———————

因應去年十一月有多宗基孔肯雅熱本地個案的患者曾到訪青衣自然徑一帶，該處目前暫停開放，直至另行通告。相關政府部門會繼續在該自然徑進行大規模的化學滅蚊及其他防控工作，中心忠告市民不應擅進，以減低感染基孔肯雅熱的風險，同時避免接觸化學劑或妨礙滅蚊工作。自二○二五年十二月十日確診一宗於二○二五年十一月三十日曾經前往青衣自然徑的個案後，至今再沒有錄得本地感染個案。

食物環境衞生署（食環署）持續在青衣自然徑一帶進行密集式霧化處理以殺滅成蚊，在合適的地方使用大型超低微量噴霧器及試用滅蚊機械狗，以提升工作成效。署方亦設置新型捕蚊器、清理可引致積水的棄置容器和垃圾，以及在無法即時處理的積水地方施放蚊油或殺幼蟲劑。食環署已聯同葵青民政事務處、地政總署及渠務署在青衣自然徑加強清除潛在蚊子滋生地，並向該處行山人士派發宣傳單張，呼籲市民提防蚊患及採取個人保護措施。食環署亦舉行跨部門地區滅蚊專責小組會議，討論有關情況的最新發展，並因應需要作出部署，協調各相關部門及持份者在其管轄範圍內加強防蚊滅蚊。

繼續加強防控
——————

食環署聯同相關部門自去年七月起已在全港各區全面加強控蚊工作，至今一直持續。其中，食環署已對早前所有輸入及本地個案進行病媒調查及針對性滅蚊工作。因應出現本地個案，食環署已立即採取跟進行動，包括：


在相關地點附近250米範圍內樹木茂密的地點進行密集式霧化處理工作，以殺滅成蚊；
巡查上述地點，清理積水，施放殺蟲劑及清除遺棄的水載容器，以防止蚊子滋生；及
加強宣傳教育，包括舉辦健康講座、設置流動教育中心及派發宣傳單張等。


上述措施會持續進行。此外，政府會在現有強化措施的基礎上，進一步加強全港控蚊工作。
​
市民應採取的防預措施
——————————

市民應使用含避蚊胺或其他有效活性成分的昆蟲驅避劑可有效防蚊，但使用時應注意以下事項：


先仔細閱讀標籤說明；
在進入可能被蚊叮的範圍前使用；
塗在外露皮膚及衣服；
孕婦使用避蚊胺的濃度上限是30%，兒童則為10%（如前往蚊傳疾病流行的國家或地區而有機會被蚊叮咬，兩個月或以上的兒童可使用濃度上限為30%的避蚊胺）；
先塗防曬霜，再塗昆蟲驅避劑；
遵照標籤說明，只於有需要時重複使用；及
除了避蚊胺之外，市面上亦有含其他活性成分的昆蟲驅避劑，例如IR3535、埃卡瑞丁（亦稱派卡瑞丁）等。公眾使用任何昆蟲驅避劑時，應遵從產品標籤上的使用說明及注意事項。


食環署亦呼籲市民繼續提高警覺及攜手合作，及早於家居及其他環境採取防蚊及滅蚊措施，包括視察家居及附近環境、徹底清除可供蚊子滋生的地方、每周最少一次徹底更換花瓶的水及擦洗內壁並清倒盆栽墊碟的水、妥善棄置空罐和飯盒等容器。此外，食環署亦建議市民和物業管理公司，應保持溝渠暢通及填平凹陷的地面，以防積水，並每周最少一次以鹼性清潔劑擦洗溝渠和排水明渠，除去可能積聚的蚊卵。

市民如發現蚊患，應致電1823，亦可參閱以下專題網頁，了解詳情：衞生防護中心及旅遊健康服務基孔肯雅熱專頁、最新旅遊情報、使用昆蟲驅避劑的注意事項、中心Facebook專頁、Instagram帳戶及YouTube頻道，以及食環署防控蚊患專頁。"
​一名入境旅客管有未完稅香煙罪成判囚（附圖）,2026-01-15 17:15,2026-01-15 17:30,Chi,gia,https://www.info.gov.hk/gia/general/202601/15/P2026011500541.htm,"一名入境女旅客因管有未完稅香煙和未有向海關人員作出申報，違反《應課稅品條例》（《條例》），今日（一月十五日）在粉嶺裁判法院被判處監禁三個月及罰款一千五百元。

海關人員於昨日（一月十四日）在羅湖管制站截查該名四十一歲抵港女旅客，在其攜帶的個人行李內檢獲五千一百八十一支未完稅香煙，估計市值約二萬一千元，應課稅值約一萬七千元。該名旅客隨即被捕。

海關對判刑表示歡迎，反映即使旅客屬初犯，亦可能被判處監禁，刑罰具相當阻嚇作用，並反映罪行的嚴重性。海關提醒市民，根據《條例》，煙草屬應課稅品。任何人士若處理、管有、售賣或購買私煙，即屬違法，一經定罪，最高可被判罰款二百萬元及監禁七年。

市民可致電海關二十四小時熱線182 8080，或透過舉報罪案專用電郵帳戶（crimereport@customs.gov.hk）或網上表格（eform.cefs.gov.hk/form/ced002）舉報懷疑私煙活動。"
Incoming passenger convicted and jailed for possession of duty-not-paid cigarettes (with photo),2026-01-15 17:15,2026-01-15 17:30,Eng,gia,https://www.info.gov.hk/gia/general/202601/15/P2026011500539.htm,"An incoming female passenger was sentenced to three months' imprisonment and fined $1,500 at the Fanling Magistrates' Courts today (January 15) for possessing duty-not-paid cigarettes and failing to declare them to Customs officers, in contravention of the Dutiable Commodities Ordinance (DCO).

Customs officers intercepted the incoming 41-year-old female passenger by the Lo Wu Control Point yesterday (January 14) and seized 5 181 duty-not-paid cigarettes with an estimated market value of about $21,000 and a duty potential of about $17,000 from her personal baggage. The passenger was subsequently arrested.

Customs welcomes the sentence, noting that even a first-time offender may still be imprisoned. The custodial sentence has imposed a considerable deterrent effect and reflects the seriousness of the offences. Customs reminds members of the public that under the DCO, tobacco products are dutiable goods to which the DCO applies. Any person who deals with, possesses, sells or buys illicit cigarettes commits an offence. The maximum penalty upon conviction is a fine of $2 million and imprisonment for seven years.

Members of the public may report any suspected illicit cigarette activities to Customs' 24-hour hotline 182 8080 or its dedicated crime-reporting email account (crimereport@customs.gov.hk) or online form (eform.cefs.gov.hk/form/ced002)."
"Lands Department releases figures on registered lease modifications, land exchanges, private treaty grants and lot extensions in fourth quarter of 2025",2026-01-15 17:05,2026-01-15 17:15,Eng,gia,https://www.info.gov.hk/gia/general/202601/15/P2026011500505.htm,"The Lands Department (LandsD) announced today (January 15) that it registered 12 lease modifications and two land exchanges in the Land Registry during the quarter ending December 2025, of which two were modifications of a technical nature involving nil premium.

Among these 14 land transactions, three are located on Hong Kong Island, six are in Kowloon and five are in the New Territories. The transactions exclude Small House cases.

Another lot was granted by private treaty for an electricity substation in Kwun Tong.

There were no lot extensions registered during the quarter.

The above land transactions realised a total land premium of about $3,571.61 million.

Transaction records of the lease modifications, land exchanges, private treaty grants and lot extensions, including those registered recently, are uploaded to the LandsD website (www.landsd.gov.hk/en/land-disposal-transaction/land-transaction.html) on a monthly basis. Details of the transactions may be obtained by searching the registered documents in the Land Registry."
地政總署公布二○二五年第四季註冊契約修訂、換地、私人協約批地及地段增批數字,2026-01-15 17:05,2026-01-15 17:15,Chi,gia,https://www.info.gov.hk/gia/general/202601/15/P2026011500503.htm,"地政總署今日（一月十五日）公布，在二○二五年十月至十二月季度內在土地註冊處共註冊了十二宗契約修訂及兩宗換地個案，其中兩宗為不涉及補地價金額的技術性契約修訂。

上述十四宗土地交易中，三宗位於港島、六宗位於九龍及五宗位於新界，有關數字並不包括小型屋宇個案。

該季度內有一個地段以私人協約方式批出。該幅土地位於觀塘，批作電力支站用途。

季度內並沒有地段增批的註冊。

上述土地交易所得的地價收入總額約為三十五億七千一百六十一萬元。

有關契約修訂、換地、私人協約批地及地段增批的土地交易記錄，包括新近註冊的個案，均會每月上載至地政總署網頁（www.landsd.gov.hk/tc/land-disposal-transaction/land-transaction.html）。如欲索取個別個案的進一步詳情，可向土地註冊處查閱。"
