id,title,date,last_update,scrape_time,section,source,url,lead,news_content
60241590,日本東部遭暴雨侵襲　德島及三重縣一度發山泥傾瀉警告,2025-05-25 10:42,2025-05-25 10:43,2025-05-25 10:45,即時國際,hk01,https://www.hk01.com/即時國際/60241590/日本東部遭暴雨侵襲-德島及三重縣一度發山泥傾瀉警告,日本東部地區受到低氣壓及雨帶影響，全國多個地方在5月24日晚上至25日清晨遭受大雨侵襲，部分地方更一度發出山泥傾瀉警告，氣象官員呼籲民眾提高警,"日本東部地區受到低氣壓及雨帶影響，全國多個地方在5月24日晚上至25日清晨遭受大雨侵襲，部分地方更一度發出山泥傾瀉警告，氣象官員呼籲民眾提高警覺。

日本放送協會（NHK）報道，氣象廳指，雨帶和低氣壓令四國及東海地區下起滂沱大雨，截至25日凌晨1時，三重縣鳥羽市在1小時內錄得71毫米雨量；靜岡縣御前崎市在同日凌晨3時的過去1小時內的降雨量則為31.5毫米。

受到降雨影響，德島和三重縣一度發出山泥傾瀉災害警報，宮崎縣則有道路一度需要封閉、鐵路服務受阻。氣象廳指，面向太平洋的東日本地區會在25日或有大雨，呼籲民眾提防山泥傾瀉及低窪地區水浸，和河流氾濫等情況。"
60241587,朝鮮調查軍艦下水事故　涉事造船廠總工程師等3名高層被捕,2025-05-25 10:38,2025-05-25 10:39,2025-05-25 10:45,即時國際,hk01,https://www.hk01.com/即時國際/60241587/朝鮮調查軍艦下水事故-涉事造船廠總工程師等3名高層被捕,朝鮮上周三（5月21日）在清津舉行一艘5000噸級軍艦的下水儀式時發生事故，朝中社形容事故嚴重，出席儀式的領導人金正恩要求嚴肅調查，25日報道則指,"朝鮮上周三（5月21日）在清津舉行一艘5000噸級軍艦的下水儀式時發生事故，朝中社形容事故嚴重，出席儀式的領導人金正恩要求嚴肅調查，25日報道則指司法機關已拘留3名涉事的船廠高層，包括總工程師姜正哲、船體總裝車間主任韓京學和行政副廠長金勇鶴。

朝中社報道，金正恩出席儀式時親眼目睹事故，指無法容忍，還形容關乎「國家權威」並責令限期修好軍艦。報道早前指軍艦底部「破損」，但之後引述調查組稱船體右舷受損，船尾部份的救生通道有海水流入，但船底沒有破穿。

朝鮮隨後成立調查組對事故進行全面調查，造船廠廠長洪吉浩在22日受傳召來到司法機關。

韓聯社引述朝鮮專家預料，抽出海水和修復艦船平衡需時2至3日，而修復工作需時10多日，認為能在金正恩限期在6月召開的勞動黨中央委員會全體會議前修好。"
60241585,哈佛放暑假中國留學生返美恐無期：天塌下來　沒想到成歷史一部分,2025-05-25 10:32,2025-05-25 10:32,2025-05-25 10:45,大國小事,hk01,https://www.hk01.com/大國小事/60241585/哈佛放暑假中國留學生返美恐無期-天塌下來-沒想到成歷史一部分,5月22日，美國國土安全部宣布，撤銷哈佛大學招收國際學生資格，約四分之一的國際學生面臨轉學困境，其中包括大量中國留學生。這輪制裁被視為對美國,"5月22日，美國國土安全部宣布，撤銷哈佛大學招收國際學生資格，約四分之一的國際學生面臨轉學困境，其中包括大量中國留學生。這輪制裁被視為對美國高校抗議巴以沖突的清算，亦是美國保守派與自由派「文化戰爭」的升級。美國一名聯邦法官其後緊急叫停有關措施，但事件仍持續發酵。

當地時間5月22日，美國國土安全部宣布，撤銷哈佛大學的學生與訪問學者項目（SEVP）認證，意味該校將不得再招收新的外國留學生。該認證涉及F-1（學術學生）、M-1（職業學生）及J-1（交流訪問）簽證，是國際學生赴美就讀的核心憑證。

據悉，該項禁令將自2025—2026學年生效，為美國首次對單一頂尖高校採取此類措施。過往SEVP認證多針對破產或欺詐學校，對哈佛等研究型大學出手，被外界視為「核選項」。

美國國土安全部長諾姆（Kristi Noem）指責哈佛未配合交出過去五年外國學生參與抗議活動的資料，包括影像紀錄，並稱哈佛「縱容反猶言論」。報道指，此次決定與2024年巴以衝突期間，美國高校爆發聲援巴勒斯坦抗議活動有關。

根據官方聲明，哈佛若欲恢復SEVP認證，需在72小時內交出涉事學生紀錄。哈佛方面強烈譴責此舉為「非法且具報復性」，並已於5月23日入稟波士頓聯邦法院提出訴訟。同日，美國加州聯邦法官懷特發出緊急禁令，暫時阻止相關措施生效，並禁止政府以移民理由拘留任何非美出生學生。案件仍在審理中。

中國留學生：學校放暑假返美恐無期天都塌了

據《封面新聞》報道，目前哈佛國際學生比例約佔27.2%，其中中國學生佔約四分之一，為該措施中受影響最深的群體之一。

哈佛學生李莎（化名）在接受訪問時說：「沒想到成為了歷史的一部分。」她形容消息傳出時，「像是天都塌了」。李莎原定下學期將赴肯尼亞、印度、烏克蘭進行訪學交流，惟現時行程已陷入不確定。

她坦言，若制裁成真，唯有選擇轉學、休學或暫時工作，等待政策轉變再回到校園。她又指出，因哈佛已進入暑假，離境學生恐怕最受影響，「可能將無法返美」。

李莎續稱：「校方可能會和政府協商相關條款，或通過法律渠道維護權利。」她已收到哈佛發給學生的郵件，表示將全力協助受影響學生。

而準備於今年8月入讀哈佛研究生課程的中國學生馬寧寧，亦對事件感到意外。她原正等待I-20表格（學生簽證所需文件），當看到「禁止哈佛招收國際學生」的新聞時，最初以為是舊聞重炒，「第一反應覺得很扯，這應該又是讓哈佛大學妥協的一種方式。」

面對突如其來的風波，馬寧寧表示父母曾建議她聯絡其他已拒絕的offer，「但我想等72小時塵埃落定後再做打算，況且全球學校的錄取已基本截止，極少有大學會補錄。」

她又提到，哈佛新生群一度活躍起來，「但說來說去也無非是一個『等』」。其後收到法官叫停政策的消息，她坦言「意料之中，但沒想到會這麼快。」

此次美國政府對哈佛出手，不單與巴以抗議有關，更被視為保守派與自由派「文化戰爭」的升級表現。而類似衝突可追溯至1950年代「麥卡錫主義」時期，彼時聯邦政府曾要求大學教授宣誓效忠，美國高校長期被右翼勢力視為「思想不正確」溫床。

近年來，隨着「覺醒文化」盛行，右翼智庫與輿論機構多次抨擊常春藤高校散播「左翼病毒」，呼籲政府「要麼馴服，要麼拆除」這些精英學府。特朗普在競選期間也多次強調，將對「敵視保守派」的大學採取措施。2025年3月，其政府成立「校園反猶太主義工作組」，開始調查全美多所高校的學生言論與集會行為。

哈佛因拒絕交出國際學生抗議資料，被視為重點打擊對象。據報道，美國教育部早前曾向哈佛發出調查清單，並威脅若不配合，將中止其外國學生招生資格。

據英國《衛報》評論，哈佛此次事件反映出，美國高等教育機構再度淪為政治試刀石。評論認為，這場文化戰爭結合移民、稅務、執法等多重政策工具，進一步升級為「政府主導的整肅行動」。

截至目前，哈佛學生及師生已發起抗議，並成立「哈佛學生自由聯盟」，呼籲保障國際學生權益。哈佛校方亦表明，將堅持學術自由與學生安全為首要原則，並訴諸法律捍衛校方與學生權益。"
60241582,何詩蓓200自不敵捷克泳手摘銀　何甄陶主項奪金｜環地中海泳賽,2025-05-25 10:18,2025-05-25 10:21,2025-05-25 10:30,即時體育,hk01,https://www.hk01.com/即時體育/60241582/何詩蓓200自不敵捷克泳手摘銀-何甄陶主項奪金-環地中海泳賽,環地中海泳賽魯西隆地區卡內站，港將續有佳績，當中何詩蓓在主項200米自由泳摘銀，何甄陶則在50自獲得金牌。何詩蓓在法國時間周六，在環地中海泳賽,"環地中海泳賽魯西隆地區卡內站，港將續有佳績，當中何詩蓓在主項200米自由泳摘銀，何甄陶則在50自獲得金牌。

何詩蓓在法國時間周六，在環地中海泳賽的女子200米自由泳初賽，以2分01.12秒的成績，第4名進入決賽A，到同晚的決賽A，她游出1分56.42秒，獲得銀牌，也是她今站首個獎牌；金牌落入捷克泳將施曼諾芙（Barbora Seemanova）手中，她的時間是1分56.05秒。

男將何甄陶也有好成績，他在主項50米自由泳初賽先以22.55秒第3名過關，進入決賽A，再游出22.17秒奪得金牌，也是他今站首面獎牌。"
60241584,哈佛中國學者：將赴美國以外大學工作　很高興能在此時離開美國,2025-05-25 10:03,2025-05-25 10:09,2025-05-25 10:15,即時國際,hk01,https://www.hk01.com/即時中國/60241584/哈佛中國學者-將赴美國以外大學工作-很高興能在此時離開美國,美國國土安全部（DHS）於5月22日發聲明，宣布取消哈佛大學招收國際學生的資格。官媒《環球時報》引述哈佛一名中國訪問學者稱，美國高校的優勢正在,"美國國土安全部（DHS）於5月22日發聲明，宣布取消哈佛大學招收國際學生的資格。官媒《環球時報》引述哈佛一名中國訪問學者稱，美國高校的優勢正在快速流失，他自己不久前剛接到了一個美國以外的大學的工作邀請，「我很高興，能夠在此時離開美國」。

報道引述這名匿名中國訪問學者稱，事實上，最近一段時間，在美國的學術界，很多人都開始考慮去加拿大工作，因為許多人對美國的科研環境感到悲觀。

這名中國學者認為，美國高校曾憑藉豐厚的科研資金和國際化環境吸引全球頂尖人才，但現在這些優勢正在快速流失：科研經費遭到壓縮，尤其是那些與當前政府政策立場不符的研究項目更被直接卡住，哈佛等大學更面臨嚴重的財政壓力，許多教授甚至捐出部分薪水支持學校渡過難關。

這名中國學者稱，「一個更大的問題是，現在的狀況究竟會持續多久，未來會不會有更多類似的政策？人們擔心，還會有更糟的情況發生。」

此外，報道引述正在哈佛做訪問學者的清華大學社會科學學院博士生毛克疾認為，美國政府針對哈佛的一系列舉動，更像是一種「反精英」的政治姿態，其對象是美國傳統精英階層代表的機構和理念。

毛克疾表示，「這更像是當前政府迎合其政治基本盤、獲取影響力，並滿足情緒的『政治表演』。」他表示，這些舉動雖然也許能為他贏得基本盤的「喝彩」，但卻是以犧牲美國高校聲譽乃至美國國家「軟實力」為代價的。"
60240502,免疫失調｜精神壓力大易誘免疫疾病！補充這些營養素恢復身體機能,2025-05-25 10:02,2025-05-25 10:02,2025-05-25 10:15,好生活,hk01,https://www.hk01.com/健康Easy/60240502/免疫失調-精神壓力大易誘免疫疾病-補充這些營養素恢復身體機能,現代人精神壓力大、飲食作息不正常，腸道免疫系統易受損，中年後荷爾蒙變化更可能誘發自體免疫疾病。這類疾病種類繁多，除了藥物治療，補充硒、鋅、,"現代人精神壓力大、飲食作息不正常，腸道免疫系統易受損，中年後荷爾蒙變化更可能誘發自體免疫疾病。

這類疾病種類繁多，除了藥物治療，補充硒、鋅、鎂、鈣等關鍵營養素，有助於調節免疫系統，使身體機能恢復平衡。

網友熱議9大自律神經失調煩惱（按圖👇👇👇）

相關文章：

常見免疫失調疾病治療有哪些？醫提醒副作用及治療新趨勢

自體免疫疾病種類繁多，正常情況下，免疫系統可保護身體抵禦外來侵襲，但某些情況下，人體出現異常免疫反應，就會攻擊自己的正常細胞或多個器官。台灣臻健康診所院長武真武醫師表示，常見如紅斑性狼瘡、風濕性關節炎、過敏性鼻炎、異位性皮膚炎和帶狀皰疹等，都屬於免疫失調疾病，治療上多使用抗組織胺、類固醇或單株抗體藥物，但也會有副作用的問題，若透過高劑量的營養補充，不僅能降低自體免疫攻擊的程度，也能大幅減少藥物用量。

武真武醫師臨床收治許多自體免疫疾病的患者，台灣有1名汗皰疹患者使用類固醇超過10年，嚴重甚至出現尿蛋白，由於工作是餐飲業，很難不接觸清潔劑和水，雖然有戴手套，但汗皰疹仍無法改善；另1名女高中生罹患異位性皮膚炎，皮膚爛成一片。上述2名患者在接受純營養素點滴後，逐漸獲得改善，其中女高中生治療半年，皮膚已恢復正常。

還有1位台灣父親背上「生蛇」嚴重，依照醫囑服用10天抑制病毒、消炎藥物，仍效果不彰，女兒不忍心，帶父親來看診，透過1次營養點滴，患部3天就結痂。顯示出針對患者量身訂做的營養素配方，能對身體修復帶來正面效益。

相關文章：

身體失調也會讓你生病！透過營養素的補強可幫助身體修復

台灣武真武醫師分析，人體生病除了疾病造成，也可能是身體失調所引起。然而，治療疾病常會採取吃藥、手術等方式；至於身體失調又可分為：自律神經失調、免疫系統失調、營養失調、荷爾蒙失調和循環失調（包括神經失調），這些情況則可透過營養素的補強來加以改善。

台灣武真武醫師以循環失調的個案為例，1位看診約半年的柏金遜症患者，因為肌肉僵硬，無法自主控制，從大門口到診間的短短路程都無法走到，長期服用7年藥物，甚至已有抑鬱症，透過精準的純營養素治療後，肌肉僵硬感大幅下降、睡眠獲得改善，目前除了用藥減少外，還能開心出國遊玩，也重拾運動興趣。另1名來自彰化腦出血患者，開完刀8個月仍臥床，透過補充營養素點滴，半年後已能坐起身、自己吃飯，生活品質明顯恢復。

武真武醫師強調，如果要運用營養治療疾病，必須經由專業醫師量身訂做、調配適當的補充劑量，調節身體進而趨向健康狀態，配合睡眠、運動等多管齊下，才能有效改善免疫失調問題。

相關文章：

營養點滴補充須依個別需求搭配營養元素以發揮最大效益

營養點滴補充的營養元素如穀胱甘肽和硒，鎂、鋅、鉻、維他命D等，須搭配使用，以發揮最大效益，補充劑量與胖瘦無關，主要是依照身體欠缺的量來調配。尤其初期介入營養點滴，會盡快補足所缺，經過一段時間的補充後，當數據顯示不再進步，呈現走平，則表示已達標準，使用上應謹慎斟酌。

上述多種透過營養點滴補充的營養元素中，「硒」是人體必需微量元素之一，當體內硒元素不足會生病，但過量也不行，應精準補充，以達最佳成效。穀胱甘肽是細胞內相當重要的抗氧化物質，伴隨硒蛋白中的穀胱甘肽過氧化物酶（GPx），藉由關鍵元素「硒」來產生其活性，有效清除導致體內慢性發炎的過氧化物或自由基，提升細胞抗氧化來改善發炎問題。

武真武醫師說明，日常保健可透過補充低劑量口服硒，倘若是疾病治療，則需高劑量補充硒營養點滴，須由專業醫師執行，可運用在自體免疫疾病；手術前後的病患術前補足、術後修復；癌症患者、循環失調如顏面神經麻痺患者，除給予神經修復，也需給予硒來調節免疫。

武真武醫師曾收治台灣1名顏面神經麻痺患者，追究原因發現，近2個月睡眠品質差，因為失眠導致自體免疫攻擊起自身顏面神經，引發眼歪口斜的症狀，因為不願使用類固醇，尋求專業醫師補充營養素點滴1次後症狀明顯改善，4次後已恢復7到8成。

慢性疼痛、急性疼痛兩者有何分別？（點擊下圖看清！）

相關文章：

硒元素目前以巴西豆存在的含量最多，燕麥、雞蛋和肉類也都含有硒元素，然而現代人飲食西化、生活習慣不良以致體內發炎問題，更需要硒營養來改善。武真武醫師建議，一般人日常除可適量補充口服高純度活性硒，若是因疾病不適困擾，可尋求專業醫師評估後補充硒營養素點滴，幫助身體快速修復。

延伸閱讀：

減重總是卡關？小心「瘦素阻抗」在搞怪！ 補充硒有解

經常後腳跟痛？ 復健科醫師教你7招緩解足底筋膜疼痛

【本文獲「"
60241533,41歲富二代導演對愛情極專一　拍拖逾10年女友一頭白髮冧爆表白,2025-05-25 10:00,2025-05-25 10:00,2025-05-25 10:15,即時娛樂,hk01,https://www.hk01.com/即時娛樂/60241533/41歲麥浚龍對愛情極專一-大兩歲女友滿頭白髮激罕曬彩色合照放閃,現年41歲的麥浚龍（Juno）與大兩歲的中英混血兒女友戴庚玲（Janine）拍拖逾10年，一向喜歡玩「暗黑浪漫」，二人的IG Post都是清一色黑白照。不過日,"現年41歲的麥浚龍（Juno）與大兩歲的中英混血兒女友戴庚玲（Janine）拍拖逾10年，一向喜歡玩「暗黑浪漫」，二人的IG Post都是清一色黑白照。不過日前（22日）Janine就激罕曬出與Juno的彩色合照，更情話綿綿指Juno對自己而言就像是清晨的陽光：「warm and bright, kind and gentle, lovely and necessary. （溫暖明亮，善良溫柔，可愛又不可或缺）」，又冧爆留言：「Big big love to you, boy.」

相片所見，麥浚龍和Janine一身全黑打扮，Janine一頭銀白色長髮，望落有點蒼老，但笑容燦爛可人；而背對鏡頭的Juno，側面都可見笑得很甜，被Janine的手輕輕挽傍住腰間，十分相襯。

Juno花近十年、耗資4億製作的電影《風林火山》日前在康城影展首映，有影評認為電影初剪長達近7小時，最終濃縮至2小時，致故事節奏不連貫，甚至無法理解，不少人未看完電影已離席。面對負評，Janine默默作出鼓勵，以英文寫道：「我每天都為你感到無比驕傲。無論是順境逆境都能堅持不懈，對所愛之事的熱情，對每件事傾盡努力，但最重要的是，為你擁有一顆溫柔的心而感到驕傲。在這個總是試圖讓你變得堅強的世界裏，你是保持溫柔的最佳典範，你每天都激勵我成為更好的人。我知道人們總是將你與陰暗冷酷的事物連接在一起，但對我來說，你永遠是清晨的陽光，溫暖明亮，善良溫柔，可愛又不可或缺。」而麥浚龍亦有點讚。

麥浚龍是名副其實的富二代，爸爸為中建電訊集團主席麥兆棠，身家億億聲。18歲初出道的Juno曾受冷言冷語，但多年來默默製作高質唱片及歌曲，年前執導電影《殭屍》反應不俗，盡展才華。而Juno對感情向來專一，眾所周知，他曾經勁冧鍾欣潼，當年阿嬌被陳冠希淫照事件弄致幾乎抑鬱，Juno一直以「稱職好朋友」身份浪漫地守護着她。

2010年，麥浚龍邀請Janine擔任歌曲MV女主角，二人火速撻着，拍拖不到10日便主動公告天下；兩個月後，女方更進駐男友位於淺水灣道的超級豪宅同居，但戀情曝光9個月後分手，當時有傳Juno搭上日本AV女優蒼井空，又有傳鄧麗欣介入，但Juno澄清「與別人無關」，強調再見亦是朋友。

結果，Juno與Janine在2013年復合，但戀情就變得低調，去年有傳二人已婚並育有一女，Juno急着否認，稱視3隻貓為「小朋友」，但暫時未有計劃結婚，並說：「如果有一日真係結婚，我唔介意畀大家知道， 冇乜唔畀得人知， 我唔係介意結婚，但暫時未想（結婚）住，做好工作先。」"
60241284,當開明夫母不易！女兒傷心爸媽「從不過問成績」　他們錯愕被誤解,2025-05-25 10:00,2025-05-25 10:00,2025-05-25 10:15,熱爆話題,hk01,https://www.hk01.com/親子/60241284/當開明夫母不易-女兒傷心爸媽-從不過問成績-他們錯愕被誤解,到底該麽做？一名母親在Dcard求救，透露女兒成績向來不錯，加上不希望給孩子太多壓力，她和先生不太會過問成績。近日女兒卻突然問起「為甚麼父母都,"到底該麽做？一名母親在Dcard求救，透露女兒成績向來不錯，加上不希望給孩子太多壓力，她和先生不太會過問成績。近日女兒卻突然問起「為甚麼父母都不要求成績，是不是其實不在意」，這讓事主很不知所措，詢問該怎麼做才能讓女兒安心，「總覺得跟這種年紀的孩子相處真的好困難」。

這位媽媽網民表示女兒今年升中二，一直以來主動積極也自律，以家長的角度也不希望給小孩太大壓力或成績至上的觀念，所以從未對成績有要求，但該給的鼓勵和獎勵沒少過，才藝、學習成績方面都有回饋，獎狀都有好好保存，重要的活動也從不缺席。然而不知道是因為升學壓力或是同儕關係，女兒吃飯時突然問，是不是因為不在意自己，所以爸媽都不問成績，突如其來的問題讓她非常錯愕。

她表示當下夫妻倆都愣住，想着為甚麼女兒會有這樣的想法，不過也立刻強調父母的關愛，像是父母在意她的部分並非成績或表現，希望可以安撫女兒的情緒。雖然女兒後來就沒有再提及這件事，也覺得可能是因為青春期情緒變得敏感，但為人父母難免忍不住檢討自身是不是做得不好，是不是應該要再多關心課業、會不會讓女兒有太大的壓力等等。

相關文章：

貼文曝光後不少過來人給建議：

家庭生活有在進步？靠的不是金錢「5件事」做對培養「家庭氣質」

教育｜要孩子「享受學習」是說笑嗎？搣甩5個心態改變將悄然而至

延伸閱讀：

女性一聽住婆家就想逃？他疑惑「我父母人很好」 過來人曝：有距離最美

父母憂高學歷姐姐懶散又沒錢「房子留給她」…20歲弟聽原因崩潰

【本文獲"
60240189,家中3大吃電怪獸　除冷氣機和雪櫃外　熱水器耗電可能才是最致命,2025-05-25 10:00,2025-05-25 10:00,2025-05-25 10:15,好生活,hk01,https://www.hk01.com/數碼生活/60240189/家中3大吃電怪獸-除冷氣機和雪櫃外-熱水器耗電可能才是最致命,家電達人486先生特別點名容易被忽略的3大「吃電怪獸」，其中「傳統儲水式熱水器」可能比冷氣更耗電。486先生指出，電熱水器的耗電量與容量、使用頻,"家電達人486先生特別點名容易被忽略的3大「吃電怪獸」，其中「傳統儲水式熱水器」可能比冷氣更耗電。

486先生指出，電熱水器的耗電量與容量、使用頻率和加熱效率具高度相關，建議依照家庭人口與用水需求，挑選適當機型，並設定適當水溫，以降低不必要的能耗。他建議可汰換成「即熱式或瓦斯型熱水器」既安全又省電且效率更高。

另外，全年無休的冰箱在夏月的用電量也顯著提升，除了天氣使冰箱內外溫差加大，頻繁開關冰箱拿取冰品或飲料，其實也增加壓縮機的啟動頻率，導致電費增加。486先生建議，一次拿齊需要的物品，熟記擺放位置，以縮短開門的時間和頻率；此外，冰箱內部維持7分滿，讓冷空氣循環流通，並注意門邊膠條是否密合，定期清理後方散熱孔，都能有效降低壓縮機的負擔，提升整體效能。

最後是炎炎夏日必備冷氣，486先生建議將溫度設定在26度至28度之間，並搭配循環扇加速空氣循環，能快速達到冷房效果還可省電。再來，進出冷氣房務必隨手關門，避免冷氣流失，否則溫度升高，壓縮機又得強力運轉，反而耗電。

延伸閲讀：

延伸閱讀：

幽默感帶來好人緣！命理師點名「4生肖」是社牛黃仁勳也上榜

【本文獲「"
