id,title,date,last_update,scrape_time,section,source,url,lead,news_content
60241519,張與辰租住凶宅舊樓得200幾呎　愈住愈旺唔捨得搬：唔覺屈就,2025-05-24 19:06,2025-05-24 19:11,2025-05-24 19:15,即時娛樂,hk01,https://www.hk01.com/即時娛樂/60241519/張與辰租住凶宅舊樓得200幾呎-愈住愈旺唔捨得搬-唔覺屈就,張與辰今日（24/5）現身尖沙咀出席《致敬詞聖盧國沾作品演唱會》記者會。對於他早前透露為了專心參加《中年好聲音3》歌唱比賽，要推掉所有工作，已,"張與辰今日（24/5）現身尖沙咀出席《致敬詞聖盧國沾作品演唱會》記者會。對於他早前透露為了專心參加《中年好聲音3》歌唱比賽，要推掉所有工作，已連續10個月零收入，損失6位數字。及後被爆出租住英皇道一幢67年有不少劏房的凶宅舊樓，惹起網上熱議。

張與辰就事件接受《香港01》訪問時表示：「其實我而家開始接騷，變咗遲啲就會有收入。冇收入呢段日子我係撐得到，因為之前工作都有啲積蓄。雖然呢10個月冇飛過去，但呢段時間我歌係照寫，變咗一樣賣歌，版權嗰啲我仲收緊，經濟方面我係Ok。（會唔會慳住使？）一定要慳住使，自己比較少使錢，但主要係使喺買衫同買黑膠唱片，而食就比較少，因為要Keep Fit。」

對於租住凶宅舊樓，張與辰表示：「嗰度租係平，對於外國人嚟講位置好方便，食嘢買嘢好方便。至於話我住嗰棟係凶宅舊樓，除咗一手樓，講真邊度冇死過人，佢唔嚟搞我咪得囉。同埋呢個地方都係旺我，成個過程好順利，咁快又上埋紅館，之前諗住搬，而家諗吓諗吓都係唔搬，哈哈。（面積幾大？）得2至3百尺左右。（夠唔夠空間？）一個人住係足夠。（而家有名氣會唔會屈就自己？）咁我又唔會咁覺嘅。因為自己覺得住得舒服就可以。不過我係有搵緊新嘅地方。（租金$6000？）冇咁平，太約8至9千蚊。但自己都有嘗試搵新嘅地方，想要多啲空間，setup一個自己嘅工作室。（而家住嗰度係咪隔開一間間嘅房間？）應該係，好似studio house細細，但乜都有晒。」"
60240571,櫻井翔原來是學霸　從Arashi跨界做新聞主播　曾為採訪遠赴阿富汗,2025-05-24 19:01,2025-05-24 19:01,2025-05-24 19:15,開罐,hk01,https://www.hk01.com/開罐/60240571/櫻井翔原來是學霸-從arashi跨界做新聞主播-曾為採訪遠赴阿富汗,日本國民男團「嵐」（Arashi）成員櫻井翔，因日本電視台新聞節目《NEWS ZERO》專訪賴清德，引發網路熱議。此次專訪櫻井翔以節目主播身份訪台，雙方,"日本國民男團「嵐」（Arashi）成員櫻井翔，因日本電視台新聞節目《NEWS ZERO》專訪賴清德，引發網路熱議。此次專訪櫻井翔以節目主播身份訪台，雙方就台日關係及兩岸議題深度對談。讓人看見櫻井翔不僅是個偶像，還是個高材生、新聞主播。

偶像男團嵐自1999年出道至今已成團26年，成員包括大野智、櫻井翔、相葉雅紀、二宮和也及松本潤。其中，櫻井翔以慶應義塾大學經濟學部高學歷背景，展現自律與學習能力，成為演藝圈罕見的學霸偶像。父親櫻井俊更曾任日本總務省總務事務次官，家庭教育開放，對櫻井翔影響深遠。

【圖輯】點圖放大看更多櫻井翔照片👇👇👇

櫻井翔2006年起擔任《NEWS ZERO》週一主播，不僅以偶像身份跨足新聞界，更親自參與採訪與新聞腳本撰寫，贏得專業肯定。他曾遠赴阿富汗、柬埔寨、東日本大震災災區及非洲迦納等地，深入報導社會議題及災後情勢，展現新聞人的責任感與行動力。

據《NEWS ZERO》節目19日起以「台灣有事」為題展開一週特別報導，櫻井翔親自赴台專訪賴清德。櫻井翔在訪談中表示：「讓人印象深刻的是，在長達一個半小時的訪談中，對方完全沒有看筆記，甚至在翻譯發言的時候，也始終與我保持目光接觸。」此舉顯示賴清德的專業與自信。

訪談中，賴清德親自迎接櫻井翔，兩人互動溫馨。櫻井翔以中文問候：「初次見面，我是櫻井翔。」賴清德則笑著回應：「認識你很久了，你在台灣非常受歡迎。」櫻井翔也指出，談及台日如家人般的羈絆，特別感受到溫暖印象，雙方合照也於社群平台網路引發熱烈討論。

儘管嵐自2021年休團，預計2026年春季巡演後結束團體活動，但成員們在各領域持續發光。櫻井翔表示，藝人不僅要娛樂大眾，更應肩負傳遞正確資訊與價值觀的責任。這次專訪也讓台日交流再創新高峰，成為兩國藝能與媒體合作的亮點。

【相關圖輯】

延伸閱讀：

白種元咖啡廳又出包！他吃到發霉蛋糕狂拉肚子怒：僅給退款

【本文獲「"
60241487,中國電商「搶灘」澳洲　民眾掃平貨　或有助抑通脹,2025-05-24 19:00,2025-05-24 19:00,2025-05-24 19:15,即時國際,hk01,https://www.hk01.com/即時國際/60241487/中國電商-搶灘-澳洲-民眾掃平貨-或有助抑通脹,全球企業對美國高關稅可能引發新一輪通貨膨脹憂心忡忡，但對澳洲這個國內幾乎不生產成品的經濟體來說，中國廉價商品的轉向流入反而給飽受物價壓力困,"全球企業對美國高關稅可能引發新一輪通貨膨脹憂心忡忡，但對澳洲這個國內幾乎不生產成品的經濟體來說，中國廉價商品的轉向流入反而給飽受物價壓力困擾的消費者和決策者帶來希望。

淘寶和京東是最新進軍澳洲市場的中國電商平台。澳洲儲備銀行說，來自中國的廉價商品不太可能衝擊澳洲本土生產，反而可能惠及那些依賴進口原材料的行業，比如服裝零售。

高盛估計，受美國關稅影響的中國商品轉向出口至澳洲，尤其是在玩具、家具和服裝領域，可能在未來一兩年使澳洲整體通脹率下降20到50個基點。這項預測是在中美本月同意互相擱置大部分關稅90天之前所做的。

正因為預期中國廉價商品會湧入，再加上通脹壓力近期趨緩，澳洲央行本週放心降息。

中國是澳洲最大貿易夥伴，澳洲去年進口中國商品總值1100億澳元（約5595億港元）。中國貿易數據顯示，4月份中國對澳出口環比增加9%，對美出口則下跌近18%。

中國電商平台在澳洲逐漸擴大版圖，例如Temu已在當地網絡銷售佔據顯著市場份額；快時尚電商Shein本月在悉尼設立一家快閃店；京東3月推出澳洲版網站。

墨爾本市民克拉克首次在淘寶購物，花了129澳元（約656港元）買了三個形似愛馬仕（Hermes）的手提包。她說：「如果在淘寶買比較便宜，我百分之百肯定會上淘寶買。」"
60241496,婚房裝修完尚未入住被糞水浸泡　業主親見崩潰：已漫過腳踝,2025-05-24 19:00,2025-05-24 19:00,2025-05-24 19:15,大國小事,hk01,https://www.hk01.com/大國小事/60241496/婚房裝修完尚未入住被糞水浸泡-業主親見崩潰-已漫過腳踝,廣西柳州市民羅先生早前斥資買下婚房，可令他始料未及的是，婚房在裝修完成後尚未入住，近日卻意外遭遇污水倒灌，讓他和家人感到無法接受。目前，羅,"廣西柳州市民羅先生早前斥資買下婚房，可令他始料未及的是，婚房在裝修完成後尚未入住，近日卻意外遭遇污水倒灌，讓他和家人感到無法接受。目前，羅先生已請定損公司評估損失，並計劃透過法律途徑維護自身權益。

據《南國今報》報道，羅先生的新房位於柳州市河西路榮和天築的13樓，去年5月交房，並於10月完成裝修。因為打算通風幾個月再搬進新家，他和家人並未立即入住。

然而，4月29日上午，羅先生接到物業管家的電話，告知其入戶門出現滲水情況。當他回到家中，驚愕地發現污水已漫過腳踝，並散發出刺鼻的臭味。

儘管物業已進行清理和消毒，但屋內仍可聞到難聞氣味。羅先生表示，裝修過程中未與工人發生矛盾，物業也已在去年11月檢查完畢並返還押金，因此懷疑污水問題與裝修無關。

羅先生與物業協商未果，最終選擇打開家門排放污水。物業隨後提供沙袋防止污水擴散，並於4月30日請來保潔公司清理污水。現場可以看到，羅先生的家具和電器已遭受損害，牆壁和門框出現明顯的污漬和翹邊。

羅先生心中憂慮，因為這套新房是他和女朋友的婚房，原本計劃在5月底喬遷，現在一切計劃都被打亂。

經調查，小區物業發現13樓與12樓之間的公用立管被卷紙堵塞，導致污水無法排出，最終倒灌至羅先生家中。物業負責人表示，根據服務合同，物業僅負責一樓至化糞池的排污管道疏通，而不負責樓棟內的管道。

針對羅先生的維權問題，廣西國觀律師事務所的王一辰律師指出，若無法查明具體責任人，則可能需要承擔連帶責任。物業若未及時通知其他住戶停止使用管道，則需承擔一定賠償責任。"
60241466,視后現身力撐林峯紅館騷　被網民捕捉搭巴士離開勁貼地,2025-05-24 19:00,2025-05-24 19:00,2025-05-24 19:00,即時娛樂,hk01,https://www.hk01.com/即時娛樂/60241466/視后現身力撐林峯紅館騷-被網民捕捉搭巴士離開勁貼地,視后楊茜堯（前名楊怡）、張美妮、徐榮和楊明等第13期「無綫電視藝員訓練班」多年來一向感情極好，日前他們相約一同欣賞同學仔林峯的紅館演唱會，,"視后楊茜堯（前名楊怡）、張美妮、徐榮和楊明等第13期「無綫電視藝員訓練班」多年來一向感情極好，日前他們相約一同欣賞同學仔林峯的紅館演唱會，完騷後更有網民捕捉到楊茜堯搭巴士離開，非常貼地！

楊茜堯亦有在IG分享一眾同學仔到後台打卡的照片，更留言：「超 High，超精彩的一晚！13期又多了一個美麗的回憶，全晚笑不停。@lam_fung_official繼續加油！」她更Hashtag「好耐冇坐過巴士大家一齊搭巴士」。有網民捕捉到楊茜堯搭巴士的時刻，她亦有親切地與對方打招呼，非常親切！"
60241520,結業潮｜台灣過江龍DazzlingCafe月底撤出香港　2014年攻港排長龍,2025-05-24 18:56,2025-05-24 18:58,2025-05-24 19:00,社會新聞,hk01,https://www.hk01.com/社會新聞/60241520/結業潮-台灣過江龍dazzlingcafe月底撤出香港-2014年攻港排長龍,【結業潮／餐飲業／Dazzling Cafe／尖沙咀／貴婦下午茶／台灣過江龍】又有台灣過江龍食肆全面撤出香港。由台灣名媛楊秀蓉創立的Dazzling Cafe日前,"【結業潮／餐飲業／Dazzling Cafe／尖沙咀／貴婦下午茶／台灣過江龍】又有台灣過江龍食肆全面撤出香港。由台灣名媛楊秀蓉創立的Dazzling Cafe日前公布，由於租約期滿，位於尖沙咀的最後一間香港門店，將營業至端午節（5月31日），結束在港長達11年的經營。

台灣過江龍Dazzling Cafe在社交媒體公布，由於尖沙咀The ONE店租約期滿，將於端午節（5月31日）結束營業，並感謝食客一直以來的支持，期望日後仍有機會與港人見面。

台灣名媛楊秀蓉2011年創立在台3年擴展至9間門店

翻查資料，Dazzling Cafe由台灣名媛楊秀蓉於2011年創立，旋即憑招牌甜品蜜糖吐司風靡年輕男女，因此又被形容為「貴婦下午茶」，當時在台灣僅開業3年已擴展至9間門店。

2014年6月攻入尖沙咀隨即大排長龍試食蜜糖吐司

直至2014年6月18日，Dazzling Cafe尖沙咀The ONE店開幕，坐擁九龍公園的景色，室內裝潢以少女系為主題，試營運期間已吸引大批港人到店品嚐蜜糖吐司，店外大排長龍。

銅鑼灣皇室堡分店疑不敵新冠疫情2023年8月29日最後營業

其後Dazzling Cafe在2016年3月24日再開設銅鑼灣皇室堡分店，更邀請明星金剛、小儀及岑麗香到場剪綵。惟該店已在2023年8月29日後結束營業。

換言之，Dazzling Cafe尖沙咀店在本月底結業後，將全面撤出香港，結束在港長達11年的經營。"
60241521,美政府冀滅貿赤　德銀稱若要成功美元需貶4成,2025-05-24 18:55,2025-05-24 18:56,2025-05-24 19:00,財經快訊,hk01,https://www.hk01.com/財經快訊/60241521/美政府冀滅貿赤-德銀稱若要成功美元需貶4成,美國總統特朗普自上台以來，一直表示要解決貿易逆差問題，更向眾多貿易伙伴徵收關稅，既希望增加關稅收入，亦藉以與其他國家進行貿易談判。德銀首席,"美國總統特朗普自上台以來，一直表示要解決貿易逆差問題，更向眾多貿易伙伴徵收關稅，既希望增加關稅收入，亦藉以與其他國家進行貿易談判。德銀首席經濟學家則認為，若美國政府要解決當地貿易赤字問題，美元或需要貶值40%。

據德銀最新報告指出，美國僅憑關稅措施應對貿易逆差的效果有限，更或引發物價上升與經濟降速的陣痛。該行首席經濟學家Peter Hooper分析，過去15年，美元實際匯率累升約4成，皆因美國財政擴張、貨幣政策周期及海外儲蓄行為所致。因此，美元實際匯率需逆轉過去升幅，才有機會消除貿易逆差，惟所需的政策或遠遠超出單純推行關稅的範疇。

德銀報告稱，美國長期貿易赤字與美元實際匯率波動有高度相關，該波動源自於財政及貨幣政策轉變，及海外私人部門及政府的儲蓄行為的變化。"
60241423,台男設計外掛程式狂賺百萬　法官親玩後因1理由認定未侵權判無罪,2025-05-24 18:30,2025-05-24 18:30,2025-05-24 18:30,好生活,hk01,https://www.hk01.com/台灣新聞/60241423/台男設計外掛程式狂賺百萬-法官親玩後因1理由認定未侵權判無罪,台灣一名電玩駭客葉姓男子為賺取利益，盯上手機網路遊戲「三國群英傳M」及「洛汗M」，開發輔助外掛，短短不到一年半就狂賺4百多萬元（台幣，約港幣,"台灣一名電玩駭客葉姓男子為賺取利益，盯上手機網路遊戲「三國群英傳M」及「洛汗M」，開發輔助外掛，短短不到一年半就狂賺4百多萬元（台幣，約港幣100萬元），遭遊戲廠商發現並提告違反著作權，不過法官實際開外掛玩遊戲，卻認為葉男沒有違反，因此判他無罪。

判決書指出，葉男2019年10月起架設遊戲外掛網站，提供自行撰寫的手遊外掛，讓「三國群英傳M」、「洛汗M」玩家能夠付費訂閱使用，玩家只需到蝦皮，依照1個月、3個月或半年期分別付費台幣300到台幣6600，就能訂閱外掛使用。

遊戲廠商發現後自行蒐證，打開遊戲及外掛後，畫面中會出現「三國群英傳M」、「ROHAN M」等字樣，認為葉男開發的外掛擅自重製使用到遊戲的美術著作，侵害遊戲廠商的著作權。

葉男辯稱沒有侵害著作權，因為執行外掛後遊戲中彈出的對話框，雖然出現「三國群英傳M」的圖示，但葉男稱那並非他寫入的外掛部分，而是遊戲系統本身自帶的圖示，所以並沒有使用到遊戲廠商的美術著作。

法官開庭後直接親自實際玩遊戲，並且啟動葉男開發的外掛，發現若是搭配遊戲啟動，確實會出現圖示，但若只是單獨啟動外掛，就不會出現遊戲圖示，經查發現是因為遊戲模擬器系統設計「超級使用者權限」所致，並非葉男所為。

法官也找來實際玩家作為證人，玩家也證實若單獨使用外掛，並不會出現遊戲的美術圖，而外掛本身的圖示是「水滴」圖案。

法官以此判斷，沒有證據表明葉男有使用到遊戲美術著作侵害遊戲廠商的著作權，因此判葉男無罪。

【延伸閱讀】母親節聚餐MMA｜兒子和陌生食客碰撞變街頭大互毆媽媽勸架無效（點圖放大瀏覽）：

【延伸閱讀】台壯男因｢洗牙太痛｣狂毆女牙醫致對方狂噴鼻血滿地血畫面曝光（點圖放大瀏覽）：

延伸閱讀：

「通靈」學姐交往半年閃婚 曬婚紗照圈外尪露正臉了

蔡依林、彭于晏爆復合6年！ 網挖3大曖昧互動：太甜蜜

【本文獲"
60241435,TheNextwave XX25 沙灘音樂節　周興哲領軍Kpop女團 ITZY強勢加盟,2025-05-24 18:30,2025-05-24 18:30,2025-05-24 18:45,即時娛樂,hk01,https://www.hk01.com/眾樂迷/60241435/thenextwave-xx25-沙灘音樂節-周興哲領軍kpop女團-itzy強勢加盟,耀榮文化主辦的《TheNextwave XX25 沙灘音樂節》，將於 2025年7月5日至6日在愉景 灣大白灣沙灘（Discovery Bay Tai Pak Beach）舉行，兩日都有不同,"耀榮文化主辦的《TheNextwave XX25 沙灘音樂節》，將於 2025年7月5日至6日在愉景 灣大白灣沙灘（Discovery Bay Tai Pak Beach）舉行，兩日都有不同表演嘉賓，分別由台灣天王周興哲及Kpop女團 ITZY領軍，要二選一定要晒！

兩日的表現陣容橫跨亞洲樂壇，包括 7月5日由新世代創作天王周興哲 領軍，攜手香港人氣歌手洪嘉豪、台灣嘻哈新星 Gummy  B，以及組合機車少女 I’mdifficult、療癒歌手鄭沐晴及 Patti 蔡宥綺。至於7月6日則由韓國大勢女團 ITZY 掀起韓流風暴，搭配「舞台女王」Chungha（請夏）、韓國 人氣新星樂隊 Dragon Pony 及台韓混血女團 GENBLUE 幻藍小熊，多元曲風滿足所有樂迷！

而今年更破天荒推出「配對手帶」社交互動環節，讓樂迷在享受音樂的同時，邂逅志同道合的新朋友！"
60241503,美國擬辦「增強運動會」允參賽者服藥　中方：籲全球齊反對,2025-05-24 18:25,2025-05-24 18:25,2025-05-24 18:30,即時國際,hk01,https://www.hk01.com/即時國際/60241503/美國擬辦-增強運動會-允參賽者服藥-中方-籲全球齊反對,美國明年5月將於拉斯維加斯（Las Vegas）舉辦「增強運動會」（Enhanced Games），該賽事允許參賽者服用藥物改善競賽表現，強調在重大比賽中禁止用,"美國明年5月將於拉斯維加斯（Las Vegas）舉辦「增強運動會」（Enhanced Games），該賽事允許參賽者服用藥物改善競賽表現，強調在重大比賽中禁止用藥物並不能保護運動員，反而會抑制他們表現。中國反興奮劑中心5月23日發聲明，堅決反對將使用興奮劑美化為「科技進步」的行為，並呼籲全球體育界保持一致立場，堅決反對「增強運動會」的舉辦。

路透社報道，「增強運動會」主辦單位21日宣布，運動會將於明年在拉斯維加斯首度登場，主打游泳、田徑、舉重等項目。

參賽運動員將爭奪每個項目高達50萬美元（約391萬港元）的獎金，打破世界紀錄的選手還可獲得自25萬元起跳的額外獎金。

「增強運動會」創辦人蘇薩（Aron D'Souza）表示，現時職業和業餘運動會中，興奮劑名義上雖被禁止但暗地裹依然猖獗，導致興奮劑在秘密且不安全的情況下被運動員使用。

他主張「增強運動會」反而解決上述問題，將使用興奮劑轉變成一個公平、透明的領域，以非常公開的方式展示創新，支持技術進步。

中國反興奮劑中心5月23日在新華社發布題為「美國反興奮劑機構，請亮明你的態度，承擔起你的責任！」的聲明，堅決反對舉辦「增強運動會」，敦促美國反興奮劑機構嚴格遵守《世界反興奮劑條例》和國際標準，採取堅決措施抵制該賽事的舉辦。

中國反興奮劑中心在聲明中指出，增強運動會雖以「科技成果應該被慶祝」為噱頭，實則是將純粹的體育競技異化為藥物比拼的畸形競賽，與《世界反興奮劑條例》的宗旨嚴重相悖，其舉辦將嚴重威脅着運動員身心健康與體育精神。

中國反興奮劑中心批評，該賽事在宣傳話術上暴露出背後資本操控的本質，賽事主辦方不斷通過拋出高額獎金、經濟贊助等利益引誘運動員和資本入局，誘導運動員用健康風險為商業利益「押注」，滿足外界部份人士觀看「角鬥士表演」的慾望，種種跡象表明，該賽事的出現正將體育運動的純潔性推向危機的深淵。"
60218653,免YouTube Premium背景播放音樂教學2025｜免開App+免訂閱,2025-05-24 18:22,2025-05-24 18:23,2025-05-24 18:30,好生活,hk01,https://www.hk01.com/數碼生活/60218653/youtube背景播放音樂教學-免開app-免訂閱-premium-4步設定即用,YouTube加價！YouTube背景播放音樂教學 2025｜4步設定即可使用 免開App+免訂閱 Premium｜YouTube又加價！YouTube 宣佈調整香港區 Premium 會員月費,"YouTube加價！YouTube背景播放音樂教學 2025｜4步設定即可使用 免開App+免訂閱 Premium｜YouTube又加價！YouTube 宣佈調整香港區 Premium 會員月費，家庭方案加幅驚見50%，由原本138暴漲至208，個人及學生方案亦加價逾10%如果平時用YouTube聽歌最想用背景播放功能，熄芒將手機收入口袋，釋出雙手又可節省電源；其實有方法不用花錢訂閱YouTube Premium 都能背景播歌，即睇4步設定即可使用，即睇教學。

早前YouTube最新公布方案，YouTube Premium 2025年香港收費調整如下：

個人方案：78→88（加$10，升幅12%）

家庭方案：138→208（加$70，升幅50%）

學生方案：48→58（加$10，升幅20%）

YouTube手機背景播音樂4步設定

1.在Safari進入Youtube.com網站，選擇想在背景播放的影片，然後點選左下角的圖示。

2.展開選單後點擊右下角的三點圖示。

3.打開「頁面選單」，選擇「切換為桌面版網站」

4.點擊播放，再鎖定畫面後再次播放即可。

在主畫面鎖定時或控制中心都可以播放"
60241505,林峯演唱會｜城寨四子合體做嘉賓　劉俊謙即場跳「凳舞」超爆笑,2025-05-24 18:15,2025-05-24 18:15,2025-05-24 18:30,即時娛樂,hk01,https://www.hk01.com/電影/60241505/林峯演唱會-城寨四子合體做嘉賓-劉俊謙即場跳-凳舞-超爆笑,林峯相隔九年再踏紅館舞台，一連七晚的《GO WITH THE FLOW 林峯演唱會LF LIVE IN HONG KONG 2025》昨晚（23/5）來到第二場，除了周秀娜、吳林峰每,"林峯相隔九年再踏紅館舞台，一連七晚的《GO WITH THE FLOW 林峯演唱會LF LIVE IN HONG KONG 2025》昨晚（23/5）來到第二場，除了周秀娜、吳林峰每晚固定登場外，更迎來同樣令人期待的三位好兄弟──「十二少」胡子彤、「四仔」張文傑、「信一」劉俊謙齊齊踏上紅館舞台，造就「城寨四子」再度同框。

是晚演出，林峯換上粉紅髮色繼續載歌載舞，並獻唱一連串首本名曲；當去到嘉賓環節，胡子彤、張文傑、劉俊謙升上台合唱《風的形狀》，全場立即歡呼，三子聯同「陳洛軍」相隔多時終於合體，更是「城寨四子」首次同台，林峯立即安排工作人員出動「表演凳」，由林峯即場教上次缺席澳門騷的劉俊謙大跳椅子舞，兩人一組，一個坐低，另一人則撐著凳扭腰擺動下半身，當輪到阿謙上陣，卻令林峯不禁爆笑：「呢個角度睇到你好好笑，好似鯉魚。」形容阿謙扭到就嚟反眼，阿謙即尷尬話：「唔好玩我啦！」尖叫聲震爆整個紅館。

之後，當林峯、張文傑、劉俊謙退場，子彤唱出個人單曲《兄弟打》，原來子彤家人亦有到場支持。今晚演出，同樣吸引了大批圈中人捧場，包括《九龍城寨之圍城》導演鄭保瑞、楊茜堯、楊明、徐榮、廖碧兒、樂易玲、吳若希、麥美恩、孔德賢、盧慧敏Amy Lo等等，楊明、徐榮一班第13屆藝員訓練班畢業生，更高舉「十三期同學仔」燈牌撐場。"
