id,title,date,last_update,scrape_time,section,source,url,lead,news_content
60294641,李夏茵：新界急症室需求高　北葵涌、沙田及屯門門診將加開夜診,2025-11-15 14:25,2025-11-15 14:27,2025-11-15 14:30,社會新聞,hk01,https://www.hk01.com/社會新聞/60294641/李夏茵-新界急症室需求高-北葵涌-沙田及屯門門診將加開夜診,醫管局行政總裁李夏茵今日（15日）接受電視節目訪問時表示，醫管局計劃加大家庭醫學門診的服務量，以應付急症室需求。她表示，全港目前擁有75間家,"醫管局行政總裁李夏茵今日（15日）接受電視節目訪問時表示，醫管局計劃加大家庭醫學門診的服務量，以應付急症室需求。她表示，全港目前擁有75間家庭醫學門診，其中23間提供夜診服務，未來將增設1間夜診服務，並將部分日間籌額調至夜間，以提升整體服務能力。李夏茵又說，新界區對急症室的需求特別高，計劃在北葵涌、沙田區及屯門加開夜診服務。

料9至10間門診夜診增加服務

李夏茵接受有線電視節目《有理有得傾》專訪時指出，新界區對急症室的需求特別高，計劃在北葵涌、沙田區及屯門加開夜診服務。她表示，醫管局將努力調整夜間服務的額度，預期將有9至10間門診在夜間增加服務。

針對專科門診的輪候時間，李夏茵認為現行新症預約制度有改善空間，但強調緊急個案仍可在2至8周內接受服務，而穩定的新症將將安排籌額由醫生以先到先得原則安排服務，他們樂觀地認為輪候時間可以縮短四分一至三分一。

研薪酬架構引入「優勞多得」就一籃子績效指標諮詢

李夏茵續指，病人在看醫生和抽血時需在同一地點的情況將會改善，希望未來市民能在不同地點接受檢查並獲得報告，但背後有很多流程要梳理。此外，醫管局計劃在薪酬架構中引入「優勞多得」理念，李夏茵稱正諮詢有關一籃子的績效指標，目標是提升病人服務。

醫管局早前公布公立醫院殮房收費措施。李夏茵指，遺體存放不屬醫療服務；本港殮房情況雖較國際好，但流轉速度較慢，仍然存在遺體存放時間過長的問題。對於能否增加殮房容量，她表示應將資源專注於醫療服務上。"
60294604,高瓴三季度美股持倉︰持股總市值暴增70億　重倉拼多多、阿里等,2025-11-15 14:21,2025-11-15 14:21,2025-11-15 14:30,財經快訊,hk01,https://www.hk01.com/財經快訊/60294604/高瓴三季度美股持倉-持股總市值暴增70億-重倉拼多多-阿里等,高瓴旗下專注二級市場投資的基金管理平台HHLR Advisors公布了截至2025年三季度末的美股持倉報告。數據顯示，三季末HHLR Advisors總共持有33只股票,"高瓴旗下專注二級市場投資的基金管理平台HHLR Advisors公布了截至2025年三季度末的美股持倉報告。數據顯示，三季末HHLR Advisors總共持有33只股票，持倉總市值達到41億美元，比二季度增加9.9億美元（近70億元人民幣），增長幅度為32%。

HHLR Advisors持倉中中概股市值佔比超過90%，繼續成為核心配置，凸顯其對中國優質資產的長期看好。

高瓴HHLR Advisors Ltd.三季度新進滿幫、百度、Sea Ltd.、巴里克礦業等。增持阿里巴巴、百度、拼多多等。清倉看準網/Boss直聘、理想汽車、唯品會、WNS、京東等。減持中通快遞、網易、富途控股、逸仙電商等。重倉拼多多、阿里、富途、Webull、百度、傳奇生物、網易等。"
60294643,有片｜機場三跑地盤驚現戰時炸彈　900人疏散　EOD現場引爆,2025-11-15 14:16,2025-11-15 19:04,2025-11-15 19:15,突發,hk01,https://www.hk01.com/突發/60294643/有片-機場三跑地盤驚現戰時炸彈-900人疏散-eod現場引爆,今日（15日）中午11時58分，警方接報指，有建築工人在機場三跑工程地盤掘地時，發現一枚約30厘米乘7厘米、呈酒樽形狀的戰時炸彈。警員到場疏散工人,"今日（15日）中午11時58分，警方接報指，有建築工人在機場三跑工程地盤掘地時，發現一枚約30厘米乘7厘米、呈酒樽形狀的戰時炸彈。警員到場疏散工人及圍封附近一帶，並召爆炸品處理課（EOD）前往協助；消防及救護車亦在場戒備。

警方證實涉事的是戰時英軍迫擊炮。爆炸品處理課人員於下午約4時20分即場引爆炸彈，現場於下午約4時35分解封。事件中無人受傷，但有約900人自行或由人員協助疏散至安全位置。

據知，發現戰時炸彈的位置，距離新建機場航班控制塔約600米，工人挖掘至約1米深時，發現該枚迫擊炮。

機管局回覆指，今天上午約10時，承建商工人於T2客運廊工地附近發現一件可疑物品並報警，機管局根據警方指示，將可疑物品附近範圍暫時封閉，以便警方進一步調查和處理。機場運作不受事件影響。"
60294645,高市早苗涉台言論後　中國發布航行警告：黃海中部將實彈射擊,2025-11-15 14:14,2025-11-15 14:15,2025-11-15 14:30,即時國際,hk01,https://www.hk01.com/即時中國/60294645/高市早苗涉台言論後-中國發布航行警告-黃海中部將實彈射擊,日本首相高市早苗近日發表「台灣有事論」後，中日緊張關係升溫。繼中國外交部領事司發布通告提醒公民近期暫勿前往日本後，海事局網站周六（15日）,"日本首相高市早苗近日發表「台灣有事論」後，中日緊張關係升溫。繼中國外交部領事司發布通告提醒公民近期暫勿前往日本後，海事局網站周六（15日）亦公布，鹽城海事局發布航行警告，11月17至19日，每日0時到24時，黃海中部部分海域進行實彈射擊，禁止駛入。

是次黃海中部實彈演習的座標範圍並未公開具體數據，惟演習區域接近中韓專屬經濟區（EEZ）重疊海域，戰略敏感性高，或對日、韓及駐韓、駐日美軍構成潛在戰略壓力。

解放軍對上一次舉行黃海中部的實彈演習，是在今年1月4至6日，為年度聯合軍事訓練一部分，重點在於提升實戰化與體系化作戰能力。當時實彈演習區域主要在黃海北部部分海域進行，尤其是遼寧省大連海事局所公布的禁航區域。"
60294644,比特幣今年升幅近蒸發　一日內9億美元撤出相關ETF,2025-11-15 14:09,2025-11-15 14:09,2025-11-15 14:15,財經快訊,hk01,https://www.hk01.com/財經快訊/60294644/比特幣今年升幅近蒸發-一日內9億美元撤出相關etf,"比特幣近六個月來首次跌破9.5萬美元，隨著避險情緒升溫，投資者從比特幣相關基金中撤出近9億美元。作為最大數字資產的比特幣一度下跌4.3%，至94,50","比特幣近六個月來首次跌破9.5萬美元，隨著避險情緒升溫，投資者從比特幣相關基金中撤出近9億美元。

作為最大數字資產的比特幣一度下跌4.3%，至94,508美元，幾乎抹去今年全部漲幅。今年10月初，比特幣創下126,251美元的歷史新高，2024年收於93,714美元。

CoinGlass數據顯示，過去24小時內超過13億美元的槓桿頭寸被強制平倉。

與此同時，比特幣相關ETF周四淨流出約8.7億美元，為上市以來單日資金流出量次高。

彭博報道指，本周早些時候，美國股市曾因政府停擺結束而短暫反彈，但隨後迅速回落。由於關鍵經濟數據推遲發布，交易員開始質疑聯儲會是否有充分理由在短期內降息，這令市場風險資產再度承壓。

「目前的拋售與其他風險資產完全同步，但由於波動性更高，加密貨幣的跌幅更大，」富蘭克林鄧普頓投資解決方案副首席投資官Max Gokhman表示，「在機構投資尚未大規模擴展至比特幣和以太坊之外前，加密貨幣市場對宏觀風險的敏感性(Beta)將持續保持高位。」

另外，流動性也急劇下降。Kaiko稱，衡量市場承接大額交易能力的「市場深度」指標較今年高點下滑約30%。"
60289686,37歲男強姦61歲晨運婦！1句話嚇到她阻夫報案　淫狼被捕內情心寒,2025-11-15 14:02,2025-11-15 15:02,2025-11-15 15:15,熱爆話題,hk01,https://www.hk01.com/人氣話題/60289686/37歲男強姦61歲晨運婦-1句話嚇到她阻夫報案-淫狼被捕內情心寒,色狼強姦晨運婦，被捕後驚揭是通緝犯！新加坡1名61歲婦人早上到樓下公園健身角落晨運，慘遭37歲陌生男子拖入草叢性侵，強迫她口交及肛交，完事後威,"色狼強姦晨運婦，被捕後驚揭是通緝犯！新加坡1名61歲婦人早上到樓下公園健身角落晨運，慘遭37歲陌生男子拖入草叢性侵，強迫她口交及肛交，完事後威脅如果敢報警就「殺了她全家」。受害人的丈夫得悉妻子受辱後想報警，但她因太害怕而一度阻止。

警方其後接報調查，揭發該名淫狼原來是正棄保潛逃的通緝犯，此期間還累計犯下33宗罪，包括4度傷害女友及闖入女廁偷看少女如廁。該色狼日前終被判監19年半及鞭刑12下。

新加坡傳媒報道，案發於2022年5月13日清晨，受害人到往所樓下的健身角落晨運，她正使用1部橢圓機時，1名男子行近「跟隊」，希望和受害人輪流使用。受害人同意並從機上走下來，馬上遭淫狠拖入草叢中，以左手掩住她的嘴，右手攬住其身體壓在地上。

受害人求饒謊稱70歲仍被迫口交肛交

受害人哀求被告住手，謊稱自己已經70歲，惟淫狼懶理求饒，先迫受害人為他口交，之後更強迫肛交。淫狠放縱獸慾後作出威嚇，指受害人敢報警就「殺她全家」。

受害人怕得等被告離去才敢回家，丈夫知道她被性侵後即想報警，但她怕連累家人，一度阻止報案，幸好丈夫堅持才揭發事件。受害人原本想在警察上門前洗澡，丈夫想起妻子身上會留下犯人涉案的「證據」，及時阻止妻子往洗澡。

警揭為通緝犯棄保潛逃襲女友偷看少女如廁

警方在案發當天即拘捕被告伊姆蘭 （音譯），驗尿發現含有甲基安非他命（俗稱冰毒）等成份。警方發現被告原來正棄保潛逃，此期間累計犯下33罪，接連發出了8個緊急通報通緝，落網後獲准保，其間又多犯強姦罪、4次蓄意傷害女友、闖入女廁偷看少女如廁等。

判囚19年半、鞭打12下

被告合共被控41罪，除強姦外還涉無牌駕駛、不誠實挪用他人財物、蓄意傷人、欺騙、吸毒等罪行，他承認其中10項。日前法官判他判監19年半、鞭打12下、出獄後吊銷駕照2年。

（綜合）"
60293058,電線捆綁在一起超危險　拖板勿插大功率電器　央視實測給出這答案,2025-11-15 14:00,2025-11-15 14:00,2025-11-15 14:15,好生活,hk01,https://www.hk01.com/實用教學/60293058/電線捆綁在一起超危險-拖板勿插大功率電器-央視實測給出這答案,在日常生活中，電氣線路和用電設備、器具是家庭電氣火災的主要風險點。電氣火災一般是指由於電氣線路、用電設備等發生故障釋放的電火花、高溫等熱能,"在日常生活中，電氣線路和用電設備、器具是家庭電氣火災的主要風險點。

電氣火災一般是指由於電氣線路、用電設備等發生故障釋放的電火花、高溫等熱能，以及未發生故障的電熱器具表面產生高溫，在具備燃燒條件下，引燃本體或其他可燃物而造成的火災。

據CCTV中央電視台最新報道，消防檢查發現在日常電器使用中，許多人習慣將電線捆紮或者纏繞在一起，這可能會導致聚熱升溫甚至引發火災。

模擬試驗中，將四個1800瓦的燒水壺插在功率2500瓦的插線板上，並把插線板的電線捆紮在一起，讓四個水壺同時工作。

僅僅2分鐘，插線板的溫度便從起初的21℃左右跳到了100℃。

在溫度達到189℃時，捆成一團的電線突然發出爆響聲，產生明火，最終將電線完全燒焦。

提醒：

在拖板使用過程中，一定要將插線板的連接線打開，以便散溫。

尤其是進入冬季居民家中各類取暖設備增多，在插線板上切勿同時插多個大功率電器使用，否則極易造成電線短路。

延伸閲讀：

家裡拖板潛藏定時炸彈？這些使用壞習與劣質品問題恐引發火災

（點擊連結看全文）

【本文獲「快科技」授權轉載，微信公眾號：mydrivers】"
60294620,泰國女柬埔寨旅遊遭賣豬仔　未達電騙KPI被迫做2000下深蹲慘死,2025-11-15 14:00,2025-11-15 14:00,2025-11-15 14:15,即時國際,hk01,https://www.hk01.com/即時國際/60294620/泰國女柬埔寨旅遊遭賣豬仔-未達電騙kpi被迫做2000下深蹲慘死,柬埔寨傳出詐騙園區受害者死亡案例，泰國26歲女子蘇達（Suda）因工作業績未達標遭懲罰致死。根據伊曼努爾基金會（Immanuel Foundation），蘇達生前,"柬埔寨傳出詐騙園區受害者死亡案例，泰國26歲女子蘇達（Suda）因工作業績未達標遭懲罰致死。

根據伊曼努爾基金會（Immanuel Foundation），蘇達生前遭受殘酷體罰，包括被迫做1000下至2000下深蹲。

Thaiger報道，蘇達與丈夫一起前往柬埔寨，但她隨後與家人失去聯繫，家人選擇報警。經查，蘇達被迫在柬埔寨巴比（Poipet）從事網路詐騙工作，因業績不佳遭懲罰死亡。

根據伊曼努爾基金會的報告，蘇達曾被迫做1000下至2000下深蹲等等的殘酷體罰。另據The Nation，在她失去意識昏迷之後，對方還使用高壓電擊想讓她甦醒過來，但未能成功。

就在13日，伊曼努爾基金會在金邊一處寺廟找到蘇達的遺體，只見當時火化程序即將開始，組織立刻介入阻止火化程序並通知泰國當局。

基金會表示，蘇達的遺體目前由泰國駐金邊大使館保管，正與泰國大使館合作進行相關安排，讓蘇達的遺體能被運回泰國，以便家屬舉行葬禮。

蘇達的丈夫目前仍下落不明。

【延伸閱讀】8名四川男被賣豬仔到柬埔寨詐騙園3人一原因「被退貨」逃出生天

【本文獲

「ETtoday」

授權轉載。】"
60294634,遭舞台電動座椅擠壓致肋骨斷裂　內地獨立樂隊女主音搶救無效身亡,2025-11-15 14:00,2025-11-15 14:00,2025-11-15 14:15,即時中國,hk01,https://www.hk01.com/即時中國/60294634/遭舞台電動座椅擠壓致肋骨斷裂-內地獨立樂隊女主音搶救無效身亡,近日，藝名「阿珍」的內地獨立樂隊「普通搖滾樂隊」女主音解惠鈞於浙江嘉興工作期間，遭舞台的電動座椅擠壓導致肋骨斷裂，送醫搶救10小時無效身亡,"近日，藝名「阿珍」的內地獨立樂隊「普通搖滾樂隊」女主音解惠鈞於浙江嘉興工作期間，遭舞台的電動座椅擠壓導致肋骨斷裂，送醫搶救10小時無效身亡。涉事場地負責人稱，事件屬意外，已和家屬協商。有業內人士則推測，事發時可能忘切電源。

周三（12日），「普通搖滾樂隊」發訃告表示，解惠鈞於周日（9日）上午工作期間，意外被電動座椅架擠壓胸腔，導致肋骨斷裂、呼吸困難，經搶救無效，於周一（10日）凌晨離世。

公開資料顯示，「普通搖滾樂隊」來自遼寧大連，已成立4年，於2022年尾發布首張專輯，並於2023年展開全國巡演。樂隊成員均為同事關係，解惠鈞是核心成員，並擔任小提琴手，參與創作多首作品。

周四（13日），阿珍在大連的一位友人透露，家屬已從大連趕到浙江省嘉興市處理身後事。

此前，阿珍經常在嘉興536藝術空間活動，負責人證實，阿珍確實被場館內的電動座椅擠壓致死，有關部門已上門調查。當地官媒曾介紹稱，536藝術空間的多功能廳內部設置了伸縮座椅，能在劇場、展廳、走秀、影院等不同功能模式間絲滑切換。

曾在北京奧運會、冬奧會等大型賽事中承擔體育場館座椅等設備研發與安裝的大豐公司區域銷售經理李先生認為，類似事故發生概率非常低，「這種情況很可能是忘記斷掉電源！」他表示，如果已經固定好了座椅系統，有觀眾和演員在上面，是不可能發生這樣的事故，座椅的電源處於切斷狀態。如果電源啟動後，轉換場地的時候，有人不小心還站在座椅現場，這有可能出現事故。

網民則呼籲場館盡快就事件給家屬一個合理解釋。"
60294636,One Piece海賊王動畫導演長峯達也逝世　名作有聖鬥士星矢Ω龍珠超,2025-11-15 13:58,2025-11-15 13:58,2025-11-15 14:15,即時國際,hk01,https://www.hk01.com/電影/60294636/one-piece海賊王動畫導演長峯達也逝世-名作有聖鬥士星矢ω龍珠超,日本知名動畫導演長峯達也14日傳出離世消息，而他生前的作品，包含《ONE PIECE海賊王》與《七龍珠超》（Dragon Ball Super）系列等等，廣為人知。,"日本知名動畫導演長峯達也14日傳出離世消息，而他生前的作品，包含《ONE PIECE海賊王》與《七龍珠超》（Dragon Ball Super）系列等等，廣為人知。

長峯達也的社交平台帳號昨天發布貼文，不過這次是由其家屬代為發文，文中寫道：

家屬也提到，追思會已在本月13日結束，這次是由東映動畫公司主辦的私人追思會：「我們還要感謝東映動畫公司的所有工作人員，感謝他們安排這次活動，並付出了辛勤的努力和準備。」

長峯達也是日本相當知名的動畫導演，除了海賊王之外，像是《聖鬥士星矢Ω》、《七龍珠超》、《Heartcatch光之美少女！》等等，都是他的作品。

長峯達也導演的動畫作品▼▼▼

延伸閱讀：

《航海王》真人版第二季名單公布！「巴洛克華克」成員是他們

【本文獲「

中天新聞網

」授權轉載。】"
60294633,珍惜生命︱屯門美樂花園英籍華僑墮樓　當場不治,2025-11-15 13:35,2025-11-15 13:36,2025-11-15 13:45,突發,hk01,https://www.hk01.com/突發/60294633/珍惜生命-屯門美樂花園英籍華僑墮樓-當場不治,今日（15日）早上7時12分，警方接獲報案，指屯門湖翠路2號美樂花園對開，發現一名男子倒臥在地，懷疑從高處墮下。人員接報到場，證實該名38歲英籍,"今日（15日）早上7時12分，警方接獲報案，指屯門湖翠路2號美樂花園對開，發現一名男子倒臥在地，懷疑從高處墮下。人員接報到場，證實該名38歲英籍華僑男子當場死亡。

警方經初步調查，相信事主為上址住戶，從一單位墮下。警方於現場沒有檢獲遺書，死因有待驗屍後確定。

求助網站和熱線：

即睇3分鐘情緒自救法呼吸間即可放鬆身心

「情緒通」精神健康支援熱線：18111

香港撒瑪利亞防止自殺會熱線：23892222

醫院管理局精神健康專線：24667350

東華三院芷若園熱線︰18281

撒瑪利亞會熱線︰28960000

社會福利署熱線︰23432255

生命熱線：23820000

明愛向晴熱線﹕18288

【不要放棄你的生命】請看看這些求助網站和熱線！"
60294630,愛潑斯坦案引爆MAGA分裂？　特朗普撤回對同黨眾議員盟友支持,2025-11-15 13:31,2025-11-15 13:31,2025-11-15 13:45,即時國際,hk01,https://www.hk01.com/即時國際/60294630/愛潑斯坦案引爆maga分裂-特朗普撤回對同黨眾議員盟友支持,有關現已故富豪淫媒愛潑斯坦（Jeffrey Epstein）的案件最近成為共和黨及MAGA派內部矛盾爭議點，隨着美國眾議院即將就公開所有愛潑斯坦文件進行投票,"有關現已故富豪淫媒愛潑斯坦（Jeffrey Epstein）的案件最近成為共和黨及MAGA派內部矛盾爭議點，隨着美國眾議院即將就公開所有愛潑斯坦文件進行投票，這一矛盾再度激化。美國總統特朗普（Donald Trump，又譯川普）11月14日撤回了對盟友、共和黨眾議員格林（Marjorie Taylor Greene）的支持，稱後者批評他的施政。支持公開文件的格林則表示，愛潑斯坦案才是導致2人決裂的主因。

路透社報道，特朗普14日在社交媒體Truth Social發文宣布撤回對格林的支持，稱自己上任以來達成多項成就，但後者卻只懂抱怨。眾議院議員格林長期來被外界視為特朗普的支持者，但在最近數週，她採取的立場與白宮以及部份共和黨黨友產生分歧。

特朗普聲稱，格林之所以會這樣，是因為自己早前曾將一份顯示她只有12%支持率的民調發給她，導致後者感不滿。另外，格林也向其他人表示，她不滿特朗普未有接聽其來電。

特朗普強調，一些保守派人士正打算在共和黨初選中挑戰格林，如果有合適的人選參選，他或會考慮全力支持。

對此，格林同日在社交媒體X發文批評特朗普說謊，並指愛潑斯坦案才是後者撤回支持的主因，「他（特朗普）現在正拼命攻擊我，想殺雞儆猴，嚇唬其他共和黨人，好讓他們在下周投票決定是否公布愛潑斯坦的文件前有所顧忌。他為了阻止愛潑斯坦文件公開竟然如此不擇手段，真是令人震驚。」

民主黨及共和黨眾院議員12日獲足夠票數提交請願，成功強迫眾院就公開所有愛潑斯坦文件啟動投票程序。議長約翰遜（Mike Johnson）其後稱，他們將於下周就相關議題進行

投票

。"
60293585,外賣奶茶袋「垃圾變珍品」掀收集潮　有人靠賣二手紙袋賺上千元,2025-11-15 13:30,2025-11-15 13:30,2025-11-15 13:45,熱爆話題,hk01,https://www.hk01.com/熱爆話題/60293585/外賣奶茶袋-垃圾變珍品-掀收集潮-有人靠賣二手紙袋賺上千元,大陸近日興起一股「奶茶袋收藏熱」，許多網友紛紛在社群上曬出自己珍藏的奶茶袋、紙杯套，各品牌、各款式應有盡有，從限量聯名到經典絕版，儼然成為,"大陸近日興起一股「奶茶袋收藏熱」，許多網友紛紛在社群上曬出自己珍藏的奶茶袋、紙杯套，各品牌、各款式應有盡有，從限量聯名到經典絕版，儼然成為新興收藏品。還有人表示，這原本只是隨手扔掉的垃圾，竟意外讓自己賺千元（人民幣，下同）。

據《紅星新聞》報導，記者在二手平台搜尋「奶茶袋子」時發現，已有大量賣家販售各類奶茶包裝，價格從1元至50元不等，部分限量款更被炒至上百元。

奶茶袋也能收藏專賣二手？有人已經賺上千元：

也有賣家推出「59.9元得50個」的打包優惠，內容包含單杯與雙杯袋。除了拿來分類、野餐或收納外，更多人是為了「限量」、「聯名」、「絕版」而收藏。例如某手搖飲品牌與動漫IP合作的杯套，在二手市場上開價高達40元，仍有不少買家願意入手。

一名大學生受訪時說，只收集過哪吒的聯名袋子：

他的同學王瀟瀟則表示，也會為蠟筆小新等聯名款買單。

26歲的上班族橘子則是資深收藏者。他透露，從去年4月起已蒐集上千個奶茶袋：

他甚至特地買了貨架來存放收藏。家人起初不理解，後來也逐漸接受這種收藏文化。重複的袋子，他則會掛上網轉售，普通款能賣2至3元，稀有款可達15元甚至30元，截至目前已靠賣袋子賺近800元。

橘子笑說，有些早期不火的品牌後來突然走紅，那些舊袋子就成了見證品牌成長的「歷史物證」。不過因工作搬遷離手搖飲店較遠，他的收藏熱情已漸漸減退。

90後上班族友友則收藏了近200個奶茶袋，還與同事互換：

她認為奶茶袋帶有圈層屬性，在平台上分享收藏，也能獲得認同感。她同樣會販售袋子，普通款約1元，限定款5至10元，部分品牌聯名特別款甚至可賣上百元。

廣告從業者順順分析，品牌透過「限量包裝」強化使用者認同，間接催生收藏文化：「聯名、季節限定的稀缺性，刺激部分消費者收藏或轉售，形成二手溢價。」

她預測，未來「包裝收藏」可能成為奶茶業新的行銷方向，已有品牌推出「周邊收集計畫」以迎合這股趨勢。

心理學從業者寧小姐則指出，收藏行為符合年輕人追求儀式感與情感寄託的需求：

延伸閱讀：

廣東新人擺酒不收人情新娘「1霸氣舉動」爆紅網民籲全國推廣

【本文獲「

ETtoday

」授權轉載。】"
