id,title,date,last_update,scrape_time,section,source,url,lead,news_content
60294646,金式森林大結局｜劇情反轉再反轉　陳曉華大戰敗家仔網民勁爽,2025-11-15 18:30,2025-11-15 18:30,2025-11-15 18:45,即時娛樂,hk01,https://www.hk01.com/即時娛樂/60294646/金式森林大結局-劇情反轉再反轉-陳曉華大戰敗家仔網民勁爽,無綫（TVB）劇集《金式森林》大結局日前（11月14日）播出。在接連反轉中，沉底鱷真身曝光，龔慈恩竟才是大反派。她設局令方仰天（郭晉安　飾）誤服,"無綫（TVB）劇集《金式森林》大結局日前（11月14日）播出。在接連反轉中，沉底鱷真身曝光，龔慈恩竟才是大反派。她設局令方仰天（郭晉安飾）誤服假藥惡化病情，並利用他簽空白紙偽造遺囑。原來家族恩怨源於舊事，方仰天成立信托基金，是為了測試子女及蔣煥秋（龔慈恩飾）真面目。林澄（陳曉華飾）犧牲最大，而高深（羅子溢飾）則助她反擊。最終，林澄為了愛人方仰天，經歷了多時設局算謀，終於擊退大反派蔣煥秋。大結局以林澄重回舊地食辣魚蛋作結。

對於《金式森林》大結局的鋪排，網民意見不一。有內地觀眾批評：「以一種短劇思維拍的爽劇，劇情非常離譜，尤其最後幾集的反轉與仁慈的反轉，實在是狗血且匪夷所思。當然做冇腦下飯，打發時間其實還不錯」、「老式TVB的味道，敗家子們大戰開了外掛的新進後媽，節奏輕快劇情狗血離譜，倒是能一路追下去看場熱鬧。標榜家庭爭產復仇題材，又總是走溫情路線，所以故事不夠癲不夠大膽不夠爽快，大結局草草收場。」

當然，也有內地網民欣賞《金式森林》的劇情，認為有十分「港劇味」，看得十分過癮。「看完了，改成五星，港味十足，跟我小時候看的港劇一個味道，導演看着也靠譜，比宣萱那個強一百倍」、「這部劇最能出彩和最有看頭、牽引了全劇劇情張力的角色，就是高深和林澄，他們的存在也呼應了最後大結局那段旁白。

香港觀眾方面，則普遍看重劇中演員的演出，尤其是陳曉華。「頭先睇咗大結局最後一幕，hera演繹得林澄好細膩，我都喊咗出嚟」、「最後大結局Hera 係咪都覺得自己係鯰魚，阿旺利用佢當工具人定唔係？」「谷氣要谷到最後一集大結局先有反轉」。"
60294710,幫手搵人 ｜67歲男子繆振雄離開古洞院舍失蹤　1日後被尋回無受傷,2025-11-15 18:09,2025-11-15 23:43,2025-11-15 23:45,突發,hk01,https://www.hk01.com/突發/60294710/幫手搵人-67歲男子繆振雄離開古洞院舍失蹤-1日後被尋回無受傷,【11月15日23︰40更新】警方表示，67歲男子繆振雄昨晚（14日）離開其位於河上鄉排峰路的院舍後便告失蹤，院舍職員遂向警方報案。該名男子今日（15,"【11月15日23︰40更新】警方表示，67歲男子繆振雄昨晚（14日）離開其位於河上鄉排峰路的院舍後便告失蹤，院舍職員遂向警方報案。該名男子今日（15日）晚上在上水圍內村被尋回。他沒有受傷，案件沒有可疑。

警方今日（15日）呼籲市民提供一名在古洞失蹤男子的消息。67歲男子繆振雄，昨晚（14日）離開其位於河上鄉排峰路的院舍後便告失蹤，院舍職員遂向警方報案。

繆振雄身高約1.6米，體重約48公斤，瘦身材，尖面型，黃皮膚及蓄短白髮。他最後露面時身穿藍色長袖外套、灰色長褲及啡色拖鞋。

任何人如有繆振雄的消息或曾見過他，請致電3661 3113，或電郵至rmpu-ntn-1@police.gov.hk與新界北總區失蹤人口調查組，或與任何一間警署聯絡。"
60294714,私家車藏764部舊手機圖走私　蓮塘口岸闖關被查,2025-11-15 18:02,2025-11-15 18:02,2025-11-15 18:15,社會新聞,hk01,https://www.hk01.com/即時中國/60294714/私家車藏764部舊手機圖走私-蓮塘口岸闖關被查,近日，一輛私家車經蓮塘口岸過關時，被查出走私舊手機764部。據「海關發布」消息，當日，蓮塘海關關員在對進境客車進行監管時，發現1輛白色私家車,"近日，一輛私家車經蓮塘口岸過關時，被查出走私舊手機764部。

據「海關發布」消息，當日，蓮塘海關關員在對進境客車進行監管時，發現1輛白色私家車的機檢圖像異常。

圖像顯示在該車的主駕駛和副駕駛的車門處有明顯陰影，有夾藏物品嫌疑，海關關員遂對該車進行人工查驗。

經進一步查驗，海關關員在打開該車主駕駛和副駕駛的車門夾層後，發現裏面藏有大量用透明膠袋裝着的舊手機，每袋均裝有2部，合共檢獲舊手機764部。"
60293781,小學生斑馬線90度鞠躬致謝　港男感動讚：有教養　網民：值得學習,2025-11-15 18:02,2025-11-15 18:02,2025-11-15 18:15,熱爆話題,hk01,https://www.hk01.com/熱爆話題/60293781/小學生斑馬線90度鞠躬致謝-港男感動讚-有教養-網民-值得學習,駕駛者要停在斑馬線前讓行人先過馬路。近日有車cam（行車記錄儀）片段，拍下有司機在駛近班馬線時，有3名小學生在等過馬路，司機停車，其中2人行到,"駕駛者要停在斑馬線前讓行人先過馬路。近日有車cam（行車記錄儀）片段，拍下有司機在駛近班馬線時，有3名小學生在等過馬路，司機停車，其中2人行到班馬線中間時，轉身對住司機90度鞠躬致謝，行為可愛。有港男轉載影片表示大為感動，在網上發文大讚「小朋友好有教養」。引來不少網民留言，「喺香港見到咁嘅禮儀真係感動」、「而家少咗司機會係黃波燈讓人，師兄都係個好司機」。

有港男在網上轉載Facebook群組「

車cam L（香港群組）

」發布的一段車cam（行車記錄儀）片。從影片可見，司機慢速行駛到班馬線前停車，當時有3名小學生正想橫過馬路，由於視線被泊在班馬線旁的七人車阻礙，他們要站出班馬線上睇車。

學生過班馬線90度鞠躬致謝

當三名學生行到班馬線的中間，其中兩人對住司機90度鞠躬致謝，之後便走上對面行人路離開。樓主發文大讚「小朋友好有教養，父母好有家教」、「好值得學習」，他又有感而發表示「學生時代個個都係純過蒸餾水㗎啦，當大家畢業離校出到去社會大學打工，接觸到大千世界之後，遇到啲惡魔妖怪」。而最令他大鬧泊近班馬線的七人車，「泊正喺斑馬綫部車正XK，阻人視線過馬路，危害路人安全囉」。

不少網民看過影片大讚學生有禮貌，「好cute」、「值得鼓勵」、「有家教，大家都以禮相待」、「應該要搵嗰兩個學生出嚟去學校讚佢哋，咁就可以令更多細路仔學到」。

網民大讚有家教：好cute

有人表示平時也會向停車司機致謝，「我依家有車讓我都會彎身點頭thank you，簡單動作大家開心，希望大人細路都做」、「我一向過斑馬都會向司機微微鞠躬道謝，掉返轉自己揸車時，見行人咁樣做都覺得受尊重」。亦有人鬧七人車，「泊之字線，阻到行人視野，班細路要行出幾步睇路」、「泊之字線，我見到一係報警，一係1823」。

（Facebook「車cam L（香港群組）」)"
60294692,泰王訪華｜王后出席國宴　黑色傳統泰服＋香爐造型手袋展端莊氣質,2025-11-15 18:01,2025-11-15 18:01,2025-11-15 18:15,即時國際,hk01,https://www.hk01.com/環球趣聞/60294692/泰王訪華-王后出席國宴-黑色傳統泰服-香爐造型手袋展端莊氣質,泰國國王哇集拉隆功（Maha Vajiralongkorn）11月13日起訪華，為自中泰自1975年建交50年來泰王首次訪華。隨同他出訪的泰國王后蘇提達（Queen Suthid,"泰國國王哇集拉隆功（Maha Vajiralongkorn）11月13日起訪華，為自中泰自1975年建交50年來泰王首次訪華。隨同他出訪的泰國王后蘇提達（Queen Suthida）14日晚上伴夫到達北京人民大會堂，盛裝出席由中國國家主席習近平主辦的國宴。蘇提達身穿黑色傳統泰服，手提黑色香爐造型手袋，展現端莊氣質。

蘇提達今次出席國宴晚會所穿着的泰服由深色泰絲縫製，還配搭金色條紋樣式，身上還斜跨金色鏈條如同首飾點綴其中，端莊且優雅。

泰服是泰國的傳統服裝，以黃色為主色調，具有華美、色彩鮮艷、裝飾繁複的特點，常搭配鑲黃色金屬飾品。歷史上，泰國的男性和女性都穿上一種叫做絆尾幔的纏腰布。男性的腰部至大腿的上半段會被絆尾幔覆蓋，而女性腰部至膝蓋以下都會被絆尾幔覆蓋。

泰國王太后詩麗吉（Queen Mother Sirikit）10月25日逝世，享壽93歲，泰國因此進入服喪期，民眾與政府官員須穿戴深色服裝表示哀悼。"
60294711,鍾嘉欣瘋傳婚變向加拿大法院起訴老公　親現身回應離婚傳聞,2025-11-15 18:00,2025-11-15 18:00,2025-11-15 18:15,即時娛樂,hk01,https://www.hk01.com/即時娛樂/60294711/鍾嘉欣瘋傳婚變向加拿大法院起訴老公-親現身回應離婚傳聞,鍾嘉欣（Linda）與脊醫老公Jeremy結婚10年，先後誕下大女梁愛晨（Kelly）、兒子梁志誠（Jared）及細女梁紫琳（Anika），一家五口生活幸福滿滿。婚,"鍾嘉欣（Linda）與脊醫老公Jeremy結婚10年，先後誕下大女梁愛晨（Kelly）、兒子梁志誠（Jared）及細女梁紫琳（Anika），一家五口生活幸福滿滿。婚後鍾嘉欣專心相夫教子，定居加拿大照顧家庭，但近年逐步復出工作，亦有返港出席活動，更在內地舉行巡迴演唱會，但今日（15日）微博熱搜驚見「港媒曝鍾嘉欣在加拿大起訴丈夫」，指鍾嘉欣於2025年10月28日透過Instagram直播公開婚前協議副本，指控協議中存在「欺騙性條款」，例如限制其婚後收入支配權，並聲稱已向加拿大法院提出離婚訴訟，要求重新分配財產及爭取子女撫養權。消息迅速傳播，令不少粉絲擔心她婚變。

今日（15/11）鍾嘉欣現身馬場出席活動接受《香港01》訪問時表示：「唔使理啦，唔係剩係我啦，個個結咗婚，就會有傳聞話散啦，拍緊拖又會話唔適合啦，我覺得唔需要理會呢啲小事，其實呢啲好正常啦，我哋喺娛樂圈裡面。最緊要我哋專注返我哋嘅成長，活好自己嘅世界咪得，其餘嘅花邊新聞，我就唔會為呢件事而瞓唔着。」"
60294403,來稿｜「綠色家居」指南：一文看懂如何慳電費、賺回贈、減垃圾,2025-11-15 18:00,2025-11-15 18:00,2025-11-15 18:15,社會新聞,hk01,https://www.hk01.com/01論壇/60294403/來稿-綠色家居-指南-一文看懂如何慳電費-賺回贈-減垃圾,來稿作者：曾善珩、陳凱婷、劉鋭業博士隨着氣候變化和能源危機成為全球焦點，市民越趨關注綠色、低碳的生活方式，讓環保家居成了近年興起的潮流。讓,"來稿作者：曾善珩、陳凱婷、劉鋭業博士

隨着氣候變化和能源危機成為全球焦點，市民越趨關注綠色、低碳的生活方式，讓環保家居成了近年興起的潮流。讓我們從智能家居、垃圾分類，以至屋頂安裝太陽能板，探討如何踏出「綠色家庭」的重要一步。

節能家居：LED與智能科技的力量

想打造綠色家居，不一定要花大錢，只要改變生活習慣。照明方面，LED燈比傳統鎢絲燈省電約80%，壽命可長達25,000小時。假設家庭每天開燈6小時，全面換成LED燈泡，一年可節省約100度電，減少約50公斤碳排放，既省電費又環保。

智能家居技術進一步提升能源效率。智能插座和智能冷氣可透過手機控制，外出後若忘記關電，也可一鍵操作；感應燈或定時開關則可在無人時自動關閉，避免長期浪費。這些裝置雖然初期投資稍高，但長遠能有效降低用電量。

太陽能板：免電費還是回本投資？

「上網電價計劃」（Feed-in Tariff，簡稱 FIT）是政府於2018年推出的再生能源政策，鼓勵市民在屋頂安裝太陽能系統，目前的回購價為每度電2.5至4元，計劃將持續至2033年底。屋主需支付自用電費，而由太陽能產出的電量則以較高價售回電力公司，收入再用作抵銷日常開支。

當然，能否透過太陽能板「零電費」會受日照、屋頂方向、系統效率與維修成本等影響，但長遠可穩定回報、降低碳排放，並讓家庭參與再生能源發展，確實是一項具環保與投資價值的選擇。

垃圾分類：從源頭減廢開始

根據環境及生態局公布的數據，本港於2023年每日人均產生1.44公斤都市固體廢物，雖較2022年的1.51公斤略為下降，但整體水平仍然偏高。以全港七百多萬人口計算，意味每日產生超過一萬公噸的垃圾，相當於數百輛雙層巴士的重量。然而，整體回收率僅約33%，即每日仍有近三分之二的廢物最終送往堆填區。

要改善這情況，並減少對堆填區的負擔，我們每人都可出一分力。現時全港十八區均設有「綠在區區」回收網絡，已由早期約160個收集點擴展至超過500個，未來更計劃增至800個，方便市民回收膠樽、玻璃樽、金屬罐及紙張等可再造物料。 當然，市民更可透過簡單改變行為支持減廢，例如購物時拒絕過度包裝、減少即棄用品、將舊衣物與玩具捐贈予慈善機構。這些小行動看似微不足道，卻能大幅減少進入堆填區的垃圾量。

綠色家居不只是潮流，更是實踐可持續生活的關鍵一步。無論是運用節能科技、安裝太陽能設備，還是培養減廢與回收的習慣，每個選擇都能為地球減輕負擔。當越來越多家庭願意以行動支持環保，城市的低碳轉型便能真正落地。打造綠色家園，其實就是為下一代創造更清潔、更宜居的未來。

作者曾善珩、陳凱婷是ESG平台創辨人；作者劉鋭業博士是香港理工大學專業及持續教育學院學生事務總監及高級講師。

文章僅屬作者意見，不代表香港01立場。

01論壇歡迎投稿。請電郵至01view@hk01.com，附上作者真實姓名、自我簡介及聯絡方法。若不適用，恕不另行通知。香港01保留最終編輯權。"
60294673,雙城論壇恐生變？陸委會：蔣萬安去上海沒問題,2025-11-15 18:00,2025-11-15 18:00,2025-11-15 18:15,台灣新聞,hk01,https://www.hk01.com/台灣新聞/60294673/雙城論壇恐生變-陸委會-蔣萬安去上海沒問題,台北市政府預定12月召開雙城論壇，惟近日傳出陸委會擬不核准上海市台辦副主任李驍東來台申請，令論壇恐有變數。對此，陸委會周六（15日）表示，台,"台北市政府預定12月召開雙城論壇，惟近日傳出陸委會擬不核准上海市台辦副主任李驍東來台申請，令論壇恐有變數。對此，陸委會周六（15日）表示，台北市長蔣萬安帶隊去上海，「目前看來不會有什麼問題」。

日前，國民黨副主席張榮恭在上海會晤上海市委書記陳吉寧，傳陸委會擬不核准李驍東來台申請，以此做為反制動作，令預定12月在上海舉辦的雙城論壇恐有變數。

陸委會回應指，對於雙城論壇都是站在協助的角度，「蔣（萬安）市長要帶隊去上海，目前看來不會有什麼問題」。

據國民黨文傳會新聞稿，張榮恭、陳吉寧昨天會晤，雙方對於在「九二共識、反對台獨」共同政治基礎上，加強兩黨政治互信、推動滬台交流合作、促進在滬台商台胞生活福祉與權益保障等方面有高度交集，特別是對於推動黨際交流和青年交流有共識。

而蔣萬安則指出，陸委會之前對雙城論壇都表達樂觀其成，「兩座城市行之多年的交流其實沒有必要這麼複雜」。"
60294705,沙田馬場墮馬　「超越夢想」起步後拋下騎師　馬會取消第8場,2025-11-15 17:50,2025-11-15 17:50,2025-11-15 18:00,突發,hk01,https://www.hk01.com/突發/60294705/沙田馬場墮馬-超越夢想-起步後拋下騎師-馬會取消第8場,"沙田馬場今日下午（15日）發生墮馬意外。第8場1,200米賽事期間，由騎師潘明輝策騎的14號「超越夢想」開閘起步不久，即突然將騎師拋下，「超越夢想","沙田馬場今日下午（15日）發生墮馬意外。第8場1,200米賽事期間，由騎師潘明輝策騎的14號「超越夢想」開閘起步不久，即突然將騎師拋下，「超越夢想」隨後更掉頭奔跑，幸好潘明輝未有大礙。其餘馬匹則繼續賽事，不過之後亦響起訊號和燈號，馬會宣布第8場賽事無效，投注可獲退款。"
60292537,模特兒女友外表完美！1習慣令他決定分手　網民力撐︰真係好難忍,2025-11-15 17:43,2025-11-15 17:43,2025-11-15 17:45,熱爆話題,hk01,https://www.hk01.com/人氣話題/60292537/模特兒女友外表完美-1習慣令他決定分手-網民力撐-真係好難忍,任何人都應該保持個人衛生，而且要有公德心。馬來西亞1名男子在網上表示，其女友擔任模特兒，形容對方外表完美，但有衛生問題，程度達到令人不堪入,"任何人都應該保持個人衛生，而且要有公德心。馬來西亞1名男子在網上表示，其女友擔任模特兒，形容對方外表完美，但有衛生問題，程度達到令人不堪入目，首次約會時登上其私家車時，便直接用剃鬚刀刮腋毛，任由腋毛散落在車內，令樓主啞口無言。之後交往時，樓主聞到女友身上有濃烈香水味，於是詢問為何如斯濃烈，她回答指沒有時間洗澡，所以用香水味掩味。

樓主一度自己的反映不滿，但女友拒絕改善，反指「如果一名男人真的愛我，就應該接受我原本的樣子」，最終令他忍無可忍決定分手。

大量網民支持樓主的決定，「幾靚都好，個人污糟都唔合格」、「恃住自己靚，以為幾污糟都得」、「希望佢搵到同佢『臭味相投』嘅男友」、「真係好難忍」。

直接在車內刮腋毛

當地媒體於11月報道，該名男子在網上表示，以前曾與1名模特兒交往，對方的容貌和身材都非常完美，但完全不注重個人衛生。首次約會時，女友登上樓主私家車，詢問有否剃鬚刀，樓主立即為她購買，沒料到女友竟手持剃鬚刀，直接在車內刮腋毛，而且沒有撿走腋毛。樓主大感驚訝，只能保持友善，「那時我才意識到，美貌並不一定與禮貌和教養相符」。

無沖涼噴香水掩味

交往1年期間，樓主盡力容忍女友衛生問題，而且善意提醒，但女友總是不肯改善，樓主有次相約女友出去，她早上已經打扮好，但身上散發濃烈香水氣味，達到近乎刺鼻級別，樓主立即詢問對方，女友回答沒有時間洗澡。

女友︰如果真的愛我，就應該接受我原本的樣子

雙方為此發生爭執，女友更指「如果1名男人真的愛我，就應該接受我原本的樣子」，最後樓主唯有分手。

網民︰睇字都覺得污糟

許多網民支持樓主，「幾靚都無用」、「睇字都覺得污糟」、「分手啦，唔好勉強自己」。

（綜合）"
60291261,恐怖！泰國水牛突襲擊7歲小主人　祖父稱平日關係好　疑1原因出事,2025-11-15 17:35,2025-11-15 17:35,2025-11-15 17:45,人氣話題,hk01,https://www.hk01.com/人氣話題/60291261/恐怖-泰國水牛突襲擊7歲小主人-祖父稱平日關係好-疑1原因出事,泰國發生水牛攻擊兒童事件。當地1戶家庭在住所外的牛棚養了3隻水牛，7歲男童早上如常去找牛玩耍時，突然遭攻擊整個人被撞拋到圍欄上，祖父見他臉及,"泰國發生水牛攻擊兒童事件。當地1戶家庭在住所外的牛棚養了3隻水牛，7歲男童早上如常去找牛玩耍時，突然遭攻擊整個人被撞拋到圍欄上，祖父見他臉及身體受傷馬上送院，幸好未有傷及腦部。祖父透露孫仔和該隻攻擊他的牛感情要好，因為附近沒有玩伴，每天都會去找牛玩，懷疑因早上太餓才攻擊人類。

和動物玩耍也要提高警覺！泰國傳媒報道，事發於東北部伊善地區武里南府，10月30日1名7歲兒童遭家養水牛襲擊，緊急送院救治。60歲祖父頌蓬（Somphong）早上6時許送孫仔斯塔姆（Stamp）到醫院，聲稱被自己所養的水牛阿通（Thong）襲擊，頭部和臉部受傷。由於怕傷及腦部，男童照X光後仍要留醫觀察一晚，幸好確認只是皮肉傷。

孫仔愛和水牛玩平日又抱又親

祖父接受泰媒訪問，他一共在住所外的牛棚養了3隻水牛，攻擊孫仔的阿通只有2歲，由他們一家養大，和孫仔關係要好，過去也未曾襲擊人類。由於孫仔沒有玩伴，牛棚就在住所旁，故他每天早上都去和水牛玩，又抱又親相安無事。

疑因太餓發怒孫仔被撞拋到圍欄上

當天早上祖父如常去準備水牛的飼料，孫仔起床走入牛棚玩耍，沒多久他聽到一聲尖叫，見到孫仔疑被撞拋到牛棚圍欄上，臉和身體瘀青，他立刻將孫仔拉出來送院。他猜測是水牛們太餓而容易煩躁，剛好孫仔去逗弄阿通，牠才會發怒，無奈指動物無論與人類多親近，都可能會因為生氣或意外而傷人。

今年9月份，泰國清邁同樣發生水牛襲擊事件，1頭由屠宰場逃走的水牛，闖入住宅區襲擊2名居民和1名急救人員，有傷者手臀和腿部骨折。涉事水牛其後被發現死在社區內，疑被路過汽車撞死，也有當地報道指牠被屠宰場的老闆開槍射殺。

（綜合）"
60294703,機場抵港旅客行李藏$13.5萬私煙被捕　判囚3個月罰款$1000,2025-11-15 17:34,2025-11-15 17:34,2025-11-15 17:45,突發,hk01,https://www.hk01.com/突發/60294703/機場抵港旅客行李藏-13-5萬私煙被捕-判囚3個月罰款-1000,"海關於11月13日在香港國際機場截查一名40歲抵港女旅客，在她的個人行李內檢獲30,200支未完稅香煙，市值約13.5萬元，應課稅值約9.9萬元。該名旅客隨","海關於11月13日在香港國際機場截查一名40歲抵港女旅客，在她的個人行李內檢獲30,200支未完稅香煙，市值約13.5萬元，應課稅值約9.9萬元。

該名旅客隨即被捕。她因進口未完稅香煙以及未有向海關人員作出申報，違反《應課稅品條例》，今日（15日）在西九龍裁判法院被判處監禁3個月和罰款1,000元。

海關表示歡迎判刑，認為監禁判刑具相當阻嚇作用，並反映罪行的嚴重性。海關提醒市民，根據《應課稅品條例》，煙草屬應課稅品。任何人若進口、處理、管有、售賣或購買私煙，即屬違法，一經定罪，最高可被判罰款200萬元及監禁7年。

市民可致電海關24小時熱線182 8080，或透過舉報罪案專用電郵帳戶（crimereport@customs.gov.hk）或網上表格（eform.cefs.gov.hk/form/ced002）舉報懷疑私煙活動。"
60294706,阿里天貓︰雙11購物節　實現4年來全周期最好增長,2025-11-15 17:34,2025-11-15 17:35,2025-11-15 17:45,財經快訊,hk01,https://www.hk01.com/財經快訊/60294706/阿里天貓-雙11購物節-實現4年來全周期最好增長,阿里巴巴(9988)旗下天貓公布，剔除退款後，天貓實現4年以來雙11全周期最好增長。淘寶公眾號發文指，今年天貓雙11是淘寶升級大消費平台、淘寶閃購全,"阿里巴巴(9988)旗下天貓公布，剔除退款後，天貓實現4年以來雙11全周期最好增長。

淘寶公眾號發文指，今年天貓雙11是淘寶升級大消費平台、淘寶閃購全面參與和AI全面應用的第一個雙11，新場景正在激活新增量。

天貓雙11全周期近600個品牌成交破億，34,091個品牌按年增長翻倍。其中，蘋果、海爾、美的、源氏木語、小米(1810)、斐樂、老鋪黃金(6181)、駱駝、華為、Nike等品牌成交破10億元人民幣。

天貓總裁家洛稱，「在扶持優質品牌和原創商家的戰略帶動下，同時得益於平台史上力度最大的消費者投資，天貓實現了4年以來雙11全周期最好的一次增長(剔除退款後成交)」。

數據顯示，融入淘天後的第一個雙11，飛豬成交創歷史新高，按年增長超過30%；淘寶閃購零售訂單按年增長超過兩倍，天貓品牌即時零售日均訂單按月增長1.98倍。

另外，AI紅包帶動品牌日均下單用戶數增長86%。"
