id,title,date,last_update,scrape_time,section,source,url,lead,news_content
60294047,蔡卓妍自爆靠課金「霸道總裁」養顏　有件事細個好鄙視現在做唔返,2025-11-15 22:30,2025-11-15 22:30,2025-11-15 22:45,即時娛樂,hk01,https://www.hk01.com/即時娛樂/60294047/蔡卓妍自爆靠課金-霸道總裁-養顏-有件事細個好鄙視現在做唔返,即將踏入43歲的阿Sa蔡卓妍，天生一副令人羨慕的童顏，最近更被傳出與健身教練Elvis撻著，在愛情滋潤下狀態大勇。除了天生麗質外，阿Sa向來也保養有,"即將踏入43歲的阿Sa蔡卓妍，天生一副令人羨慕的童顏，最近更被傳出與健身教練Elvis撻著，在愛情滋潤下狀態大勇。除了天生麗質外，阿Sa向來也保養有道，近日，她為師妹泳兒（Vincy）宣傳新歌《老殘遊戲》接受對方訪問時，便公開其另類凍齡秘訣。

訪問中，泳兒盛讚阿Sa在公司裡面，是「Top Of The Top」的童顏，阿Sa謙稱：「唉，大家俾面啫。」泳兒問有沒有一刻感到困擾？阿Sa直言：「細個嘅時候成日都好『趕火車』咁，好想快啲大，好鄙視又係做啲學生嘅角色，真係做到想嘔。」

不過，隨著年紀漸長，阿Sa的心態也隨之轉變：「但係到咗而家，真係會覺得...點解我以前唔做多啲呢？因為我而家做唔返呀嘛。」儘管泳兒覺得阿Sa現在也能勝任演學生，但阿Sa卻斷然拒絕：「唔好啦！」還自爆35歲之後，也花了兩年時間「去適應自己慢慢老去」這個事實，尤其體能上是會感覺到很不同。

阿Sa還特別推介女人最緊要的其中保養一環，除了多喝水、多睡覺和做運動外，她還有一個秘訣，就是看小說。泳兒好奇對方看什麼小說？阿Sa即一臉少女地說：「睇言情小說。」泳兒一頭霧水：「乜嘢言情小說啊？」阿Sa興奮道：「『霸道總裁』嗰啲咪言情小說。」

詠兒喜遇志同道合：「即係嗰啲One Minute Reels？我都勁鍾意睇啊！我係畀錢睇囉。」阿Sa也直言：「我都係啊！我有好多可以介紹畀你！」詠兒笑言沒想到阿Sa同自己一樣無聊，阿Sa笑著為其「美化」說：「所以我們皮膚都咁好！」不少網民留言：「勁。真係要學吓先。」、「真係冇變過！」、「真係冇老過，仲好可愛」、「Sa姐什麼時候分享幾套言情小說」，更有網民笑稱：「原來成條片係宣傳短劇」，令人哭笑不得。"
60292937,日本又變嚴了？沒買名牌　機場Check-in地勤仍要求出示免稅品收據,2025-11-15 22:30,2025-11-15 22:30,2025-11-15 22:45,熱爆話題,hk01,https://www.hk01.com/熱爆話題/60292937/日本旅遊注意-免稅品收據別丟-機場check-in被地勤要求出示,隨著日本觀光客增加，當地對免稅品的查驗也日趨嚴格。一名網友從日本回程時，在機場報到櫃台被地勤要求出示免稅品收據，即使沒有購買名牌品，仍被抽,"隨著日本觀光客增加，當地對免稅品的查驗也日趨嚴格。

一名網友從日本回程時，在機場報到櫃台被地勤要求出示免稅品收據，即使沒有購買名牌品，仍被抽查，提醒旅客務必妥善保存購物收據。

這位網友昨日在社群平台Threads分享經驗，表示這次從日本回台灣時，將購買的免稅商品放在隨身行李中，在搭機前被地勤要求查看購買收據。幸好當時有隨身攜帶收據，經檢查後順利通過。該網友透露，此行只購買了藥妝店商品，並非名牌品，不清楚為何會被抽查，推測可能是當時櫃台無人排隊而被隨機抽查。

此貼文引發熱烈討論，有經驗豐富的網友指出：

多位旅客也分享類似經驗：

「以前都懶得看，現在真的查很嚴」

「這次回來的時候也有被查」

「感覺最近被檢查的機率滿高的」

日前另有網友提到，在東京羽田機場準備返台時，看見海關人員要求前一組台灣旅客打開 行李箱確認免稅品。曾在日本擔任地勤的網友透露，海關一直都有在抽查，消費金額較大的旅客更容易被查驗。也有網友認為：「只要按照規定就沒有什麼好怕的」。

值得注意的是，日本政府計劃於明年11月實施免稅新制度，屆時旅客必須先以含稅價格購買商品，抵達機場才能辦理退稅，此舉意在防範遊客以免稅價格購入商品後轉賣的情況。

延伸閱讀：

日本旅遊注意｜專騙外國遊客！企街女2年狂騙過億円手法曝光

延伸閱讀：

一開門就遇到熊！日秋田縣一天內傳多起熊襲事件3人受傷送醫

【本文獲「

中天新聞網

」授權轉載。】"
60294726,全運會｜港隊累積5金牌創歷史佳績　何詩蓓奪雙金獲馬會150萬獎金,2025-11-15 22:29,2025-11-15 22:31,2025-11-15 22:45,社會新聞,hk01,https://www.hk01.com/社會新聞/60294726/全運會-港隊累積5金牌創歷史佳績-何詩蓓奪雙金獲馬會150萬獎金,港隊今日（15日）大豐收，獲得5面全運獎牌，當中有3面銅牌，包括三項鐵人個人賽的奧斯卡、女子重劍個人賽的佘繕妡，及男子200米蛙泳的麥世霆；港隊,"港隊今日（15日）大豐收，獲得5面全運獎牌，當中有3面銅牌，包括三項鐵人個人賽的奧斯卡、女子重劍個人賽的佘繕妡，及男子200米蛙泳的麥世霆；港隊劍擊選手何思朗則在男子佩劍個人賽奪銀牌；何詩蓓更在女子100米自由泳奪金，為她在全運會中第二面金牌。該5位運動員均會獲得由賽馬會贊助體院的「賽馬會優秀運動員獎勵計劃」獎金，其中以個人奪得兩面金牌的何詩蓓，可獲150萬獎金為暫時最高。

今屆全運會港隊氣勢如虹，至今累積奪得5金1銀4銅，創下歷史性佳績，其中5面獎牌更是今日賽事中囊括，包括在全運三項鐵人個人賽中奪得銅牌的奧斯卡，令港隊繼2009山東全運會後，終再有運動員奪得全運三項鐵人個人賽獎牌。其後，港隊泳將麥世霆在男子200米蛙泳以2分09秒93觸池奪銅，刷新其保持的香港紀錄之餘，更為港隊摘下男子游泳項目史上首面全運獎牌。

劍擊同日奪1銀1銅

全運會擊劍項目今日開打，佘繕妡在女子重劍個人賽晉級四強，雖然以8:14不敵福建老將林聲，但她重整旗鼓，在銅牌戰以15:9輕勝廣東的莫婉琳，勇奪銅牌，個人首次踏上全運會頒獎台。

而何思朗在男子佩劍個人賽從小組賽開始過關斬將，雖然決賽以7：15不敵山東的魏振浩，但一面銀牌已是香港佩劍歷來最佳戰績。

何詩蓓奪金即獲馬會75萬獎金

另外，何詩蓓出戰女子100米自由泳決賽，則以由頭帶到尾之勢衝線，奪得個人第二面全運金牌。

為了鼓勵在大型綜合運動會表現出色的香港運動員，今屆創下佳績的運動員都可以在賽馬會贊助體院推出的「賽馬會優秀運動員獎勵計劃」獲頒發獎金。個人項目的金牌得主可獲75萬元現金獎勵；團體項目金牌則可獲150萬元。

其中以個人奪得兩面金牌的何詩蓓，即共可獲發150萬元獎金，為暫時最高；帆船運動員貝俊龍在帆船ILCA7項目取得金牌，以及李思穎在公路自行車女子個人賽奪金，亦分別可獲75萬元獎金；香港男子七人欖球隊力爭奪得今屆全運會的首面金牌，可得150萬元獎金。

至於個人項目的銀牌和銅牌得主，分別可獲37.5萬及15萬元；團體項目銀牌、銅牌則獲75萬及30萬元。換言之，為香港佩劍奪得首面銀牌佳績的何思朗可獲37.5萬元；而取得銅牌的佘繕妡、麥世霆及奧斯卡，都可以各獲得該計劃頒發的15萬元獎金。

另外，香港教育大學（教大）祝賀精英運動員學生王柳懿和王芊懿於花樣游泳（韻律泳）女子雙人技術自選及自由自選項目中，以585.98總分奪得金牌，是教大學生於本屆全運會奪得的第三面金牌。"
60294742,美媒：Tesla美國廠要求供應商避用中國製零件,2025-11-15 22:24,2025-11-15 22:24,2025-11-15 22:30,即時國際,hk01,https://www.hk01.com/即時國際/60294742/美媒-tesla美國廠要求供應商避用中國製零件,美媒11月15日引述知情人士報道，特斯拉（Tesla）目前要求其供應商在美國生產汽車時避免使用中國製零件，此外特斯拉還計劃在未來一兩年內將所有其他,"美媒11月15日引述知情人士報道，特斯拉（Tesla）目前要求其供應商在美國生產汽車時避免使用中國製零件，此外特斯拉還計劃在未來一兩年內將所有其他零件都替換為中國以外地區生產的零件，凸顯中美地緣政治緊張局勢加劇。

《華爾街日報》指，自從疫情擾亂全球供應鏈以來，特斯拉便持續試圖降低其美國車款對中國製零件的依賴，並鼓勵供應商轉往墨西哥等地生產零件。

今年總統特朗普（Donald Trump，又譯川普）對中國進口商品加徵高額關稅後，特斯拉進一步加快其淘汰中國零件的策略。

報道引述消息人士稱，特斯拉及其供應商目前已將部份中國製造的零件替換為其他地區生產的零件。

知情人士並透露，特斯拉高層一直在努力應對中美貿易戰中關稅波動帶來的不確定性，這使得這家汽車製造商難以製定連貫的定價策略。"
60294505,女兒為亡父取消電話合約　客服要求「機主親身嚟」 1句話被鬧黐線,2025-11-15 22:12,2025-11-15 22:12,2025-11-15 22:15,熱爆話題,hk01,https://www.hk01.com/熱爆話題/60294505/女兒為亡父取消電話合約-客服要求-機主親身嚟-1句話被鬧黐線,親人仙遊，電訊公司仍要求由「本人」終止電話合約？有女生在網上分享經歷，指父親過世後為其處理後事，本想通過電訊商的電話客服終止亡父的合約，結,"親人仙遊，電訊公司仍要求由「本人」終止電話合約？有女生在網上分享經歷，指父親過世後為其處理後事，本想通過電訊商的電話客服終止亡父的合約，結果客服數次強調要「機主親身嚟」，她分別提出用死亡證代替，甚至問可否等合約到期「自動cut」，惟客服稱「會自動續約」。她氣得再打上熱線找另一名客服，「鬧爆佢先 cut 到個台」，無奈指自己仍正消化父親離世的傷痛，沒料到「仲要遇到個黐線嘅CS（客服）」。

不少網民分享經歷，指到門市處理同類事件，遠較打上電話找客服好，又希望事主可以「開名」，即公開相關公司名稱。

父離世cut電話台客服：終止合約要機主親身嚟

有網民在Threads上舉辦「threads史上客人講過最X癲嘅說話」比賽，有女生分享

經歷

，其內容隨即在網上瘋傳。女事主指爸爸過身後，原想經電訊商電話客服終止爸爸的合約，她表明「機主個囡」的身份，因機主已過身的關係想「cut台」，未料客服竟回應「終止合約要機主親身嚟喎」。

問可否等完約？客服：會自動續約

事主重複表示爸爸已離世，改問可否提供死亡證作實，客服繼續回覆「唔得，終止合約要機主親身嚟」。她再改問如不終止合約，是否等到完約「佢係咪會自己 cut ？」，沒想到客服再答「唔會㗎，會自動續約」。女事主再重申機主已離世，「佢點可能自己 cut 到台」，問有沒有其他辦法？客服解釋「公司規矩係咁，無其他方法」。事主無奈地再打上熱線找其他客服，「鬧爆佢先 cut 到個台。爸爸走咗己經唔開心啦，仲要遇到個黐線嘅CS」。

事件引起熱議，網民鬧爆該名客服「淨係識答model answer嘅員工，無用」、「個CS黐線啫！我今日先搞完，有死亡證就可以cut，火化紙都OK 」、「你下次同佢講：咁我叫爸爸回魂搵你整，畀你個全名我方便搵你」。

網民分享經歷質問客服「係咪要攞盅骨灰上去」

網民分享類似經歷，部份人順利處理，「我上星期幫我老豆整，去門市整，死亡證+打洞身份證，寫個終止合約及豁免申請就整好」、「我幾年前阿爸走咗，帶齊文件直接落門市同佢講。個哥仔好熟手，填form影印，搞完仲講左句sorry for your lost，真係有心」。但不少人和女事主一樣鬧得一肚子氣，「同樣遇過，我問CS叫咩名，對話係咪已經錄緊音。佢俾咗個名同答咗係之後，我就問佢『係咪我要攞盅骨灰上去同佢哋去cut先至得』，佢呆咗1秒，先發現自己好似真係講錯嘢」、「同你差不多，年年幫老豆搞寬頻續約都要勞氣。次次CS都會話叫本人接聽，我次次都要同佢講你睇番電腦record，我老豆聾啞人士，佢授權咗俾我傾」。

網民建議到門市處理

有網民指，為過世親人處理合約問題，到門市處理比打上客服好，「直接去門市搞，因為要門市經理去搞，CS 係做唔到」、「其實你帶住先人身份證 + 死亡證去是但一間分店。直接同職員講要cut照常理就做到，打去 CS 未必幫到你，但分店職員面對面處理文件就應該無問題（利申， 家人做分店職員） 」。

樓主未有公開電訊商名稱，網民則表示「呢啲公司值得開佢」、「呢啲真係有發生過嘅唔使驚佢可以照開名佢唔會告到你入」、「可能係個別電訊公司問題， 建議你同電訊管理局投訴」。

（Threads）"
60294748,網紅「橙子姐姐」柬埔寨失聯逾48小時　男友同步下落不明,2025-11-15 22:07,2025-11-15 22:07,2025-11-15 22:15,大國小事,hk01,https://www.hk01.com/大國小事/60294748/網紅-橙子姐姐-柬埔寨失聯逾48小時-男友同步下落不明,在抖音擁有11萬粉絲的網紅「橙子姐姐」於11月12日與親友失聯，自稱該博主姐姐的網友表示，妹妹原計劃13日從柬埔塞飛回中國，如今在西哈努克港失聯,"在抖音擁有11萬粉絲的網紅「橙子姐姐」於11月12日與親友失聯，自稱該博主姐姐的網友表示，妹妹原計劃13日從柬埔塞飛回中國，如今在西哈努克港失聯已超過48小時。如此同時，事主的男友「龍哥」也同步失聯，引發了各方的擔憂與猜測。

據家屬和粉絲提供的信息，橙子姐姐於11月初前往柬埔寨探望「龍哥」，並在社交平台上多次透露她已訂好13日的回國機票，IP地址也顯示她的行蹤符合自己的計劃。但在12日，她突然失聯，手機持續關機，男友的電話也轉為停機。更令人擔心的是，她並未按計劃入境中國，海關記錄也沒有相關數據。家人確認在失聯前，橙子姐姐的情緒正常，與親友之間也未有矛盾。

此次事件中，「龍哥」引發了輿論的關注。他自稱在西哈努克港經營飯店，但該地區以電信詐騙聞名，網友對他的職業提出質疑。雖然「龍哥」的朋友在社交平台上發布求助信息，但所提供的線索尚未得到獨立核實。有網友分析，若「龍哥」所述不實，橙子姐姐的失聯可能與她捲入非法活動有關；而若其所述屬實，則有可能遭遇突發意外或當地犯罪團夥的威脅。

事件被曝光後，橙子姐姐的姐姐通過抖音和微博發布了尋人啟事，並計劃向中國駐柬埔寨大使館及外交部尋求支持。同時，她的朋友和其他網紅也參與了擴散尋人信息的行動，並呼籲柬埔寨的華人提供線索，還嘗試聯繫民間救援組織。粉絲群體自發組織了眾籌，用於擴大尋人影響力，並支持家屬進行跨國溝通。抖音平台對相關話題進行了流量扶持，部分主播發起了「安全警示」的直播，提醒海外旅行者注意潛在風險。"
60294707,美軍據報向特朗普提交對委內瑞拉潛在行動方案　包括打擊陸地目標,2025-11-15 22:01,2025-11-15 22:01,2025-11-15 22:15,即時國際,hk01,https://www.hk01.com/即時國際/60294707/美軍據報向特朗普提交對委內瑞拉潛在行動方案-包括打擊陸地目標,美國與委內瑞拉關係愈見緊張，美國總統特朗普（Donald Trump，又譯川普）11月14日表示就如何處理與委內瑞拉問題已「差不多作出決定」，美媒引述知,"美國與委內瑞拉關係愈見緊張，美國總統特朗普（Donald Trump，又譯川普）11月14日表示就如何處理與委內瑞拉問題已「差不多作出決定」，美媒引述知情人士指，美方衡量的選項包括對委國動武，另有美媒引述消息人士報道，美軍高官已向特朗普提交對委潛在行動最新方案，包括打擊陸地目標。

《華盛頓郵報》指，在14日討論關於打擊委內瑞拉的高級別磋商中，一同參與的官員還有副總統萬斯（JD Vance）、防長赫格塞思（Pete Hegseth）、參謀長聯席會議主席凱恩（Dan Caine）、國務卿魯比奧（Marco Rubio）和白宮副幕僚長米勒（Stephen Miller）。

報道引述一位知情人士透露，已派往該地區的「福特號」航空母艦上的戰鬥機飛行員一直在研究委內瑞拉的防空系統，但他們尚不清楚是否會接到攻擊命令。另有2名知情人士透露，美國的潛在計劃也包括出動精銳部隊——三角洲特種部隊（Delta Force），這支作戰部隊負責執行各種抓捕和擊斃任務。

美國哥倫比亞廣播公司（CBS）則引述多位知情人士指，美軍高級軍官12日已向特朗普提交針對委內瑞拉的潛在軍事行動方案，包括對陸地目標發動打擊。

兩位消息人士強調，美方目前尚未作出最終決定。

《華郵》又指，特朗普政府對在委內瑞拉採取軍事行動的法律論點，是試圖將管轄毒品犯罪的法律與武裝衝突法結合起來，相關文件將毒品比作「化學武器」，還試圖為致命的船隻打擊行動辯護，聲稱美國是在與哥倫比亞、墨西哥等盟國展開「集體自衛」。

但一些立法者和許多法律專家認為這種比喻存在誤導，毒品走私是一種由疑似犯罪分子實施的平民犯罪行為，而不是由敵對作戰人員對美國公民構成迫在眉睫威脅的武裝攻擊。"
60294650,最後一次參加全運會？　十五運會或成蘇炳添、馬龍告別賽,2025-11-15 22:00,2025-11-15 22:00,2025-11-15 22:15,藝文中國,hk01,https://www.hk01.com/藝文中國/60294650/最後一次參加全運會-十五運會或成蘇炳添-馬龍告別賽,全運會是中國最高水平綜合性運動會，中國人對它有一份歸屬感和特別感情，所以有運動員特意在全運會賽場上謝幕，為比賽生涯寫上完美句號。第十五屆全,"全運會是中國最高水平綜合性運動會，中國人對它有一份歸屬感和特別感情，所以有運動員特意在全運會賽場上謝幕，為比賽生涯寫上完美句號。第十五屆全運會，或是這些頂級運動員的告別賽.....

家門口舉行蘇炳添：無論如何參加

早在十五運會舉行前很長一段時間，哪些運動員將在賽後退役，就成為體育迷關心的話題，大家各有猜想，而百米飛人「蘇神」蘇炳添，相信是最早確認告別賽的一位頂級運動員。

2024年因傷無緣巴黎奧運，當時35歲的蘇炳添想過就此放棄，畢竟對短跑運動員來說，這是有點「超齡」了。

然而十五運會在粵港澳舉行，廣東土生土長的他最終決定要堅持，「全運會在家門口舉辦，無論如何都希望能夠出現在賽場上」。

「特別希望能夠為我的家鄉、為粵港澳大灣區貢獻自己的一份力量，全力以赴去做好，將全運會作為自己體育生涯的一個句號。」蘇炳添說。

未達參賽門檻無緣100米跑個人賽

大家應該沒想到，蘇炳添雖然早已揚名，2011年已打破全國100米短跑紀錄；2015年成為第一個百米突破10米大關的亞裔運動員；他和隊友奪得奧運4X100米銅牌的比賽，是2021年8月舉行.......但直到2021年9月陝西舉行的十四運，他才奪得第一面全運會100米金牌。

沒想到吧？原來世界級運動員要奪全運金牌，也不容易。

那他能在十五運會的告別賽上蟬聯100米冠軍，再添一金嗎？奪金有機會，卻不會是100米了。曾感歎「真的跑不動了」的蘇炳添，因為賽前成績未能達到全運100米的門檻，只會代表廣東隊出戰4X100米接力。

當然，無論出戰哪個項目，蘇炳添都會在賽場上拼盡全力。他會全力以赴，亦說過希望全運會上能奪金。

「老將」馬龍當選中國乒協副主席

結束體育生涯，蘇炳添會做甚麼工作？其實他近些年已經「雙軌並行」，進行體育訓練的同時，還從事運動方面教育和研究。蘇炳添早已是廣州暨南大學體育學院的副教授、教授，2025年4月更獲任命為院長。未來，「蘇神」將會以另一個身份，為中國體育繼續作貢獻。

另外，體育迷還估計，乒乓球員馬龍亦非常大機率在十五運會後退役。

「六邊形戰士」馬龍叱咤乒壇超過20年，奪得破紀錄的31個世界冠軍名銜，國際奧委會官網和很多媒體形容他是歷史上最偉大乒乓球員。

自巴黎奧運結束，1988年出生馬龍不止一次被問及何時「掛拍」，特別是2025年4月他當選中國乒乓球協會副主席的消息傳出之後。

「甚麼規劃都不比做運動員精彩」

對此，低調的馬龍沒有給予明確的答案，只表示仍會出戰十五運會，這將是他參加的最後一屆全運會，而退役「交由時間來決定」，「無論做甚麼東西，或者做甚麼選擇規劃，都不會比做運動員精彩。」

馬龍又說：若真的退役，不會刻意舉辦發布會去告別，「希望某一次比賽完了之後，算是一個正式告別。賽場上告別我覺得挺好，就像軍人在戰場上一樣」。

「我相信球迷會相信我的抉擇。如果是正式告別儀式，我怕在大家面前哭，多彆扭。默默告別可能（我）也會哭，但別人看不見也行。」

無論如何，大家期待着代表北京隊的馬龍在十五運會登場，也為他成為中國乒壇「二把手」而高興。

還有乒壇名將在十五運會後退役？

還有沒有乒壇名將可能把十五運會作告別賽？宣布退出世界排名的樊振東、陳夢，還有已淡出國際賽一段時間的許昕，三位世界冠軍級人馬亦是體育迷的「猜測」。

其實與出生於1994的陳夢、1990年的許昕相比，1997年出生、未滿30歲的樊振東此刻是退役機率較低的一位。據傳媒報道，樊振東此前到了德國打職業聯賽，回國出戰十五運會之後，計劃於12月重返德國賽場。

必須一提，樊振東在十五運會將代表上海隊出戰，而在十四運，他代表的是家鄉廣東。

為何要「投奔」上海？樊振東早前已獲保送入讀上海交通大學，又當上上海市青聯常委、體育界別副主任，有傳媒認為，他未來退役後或在上海開展「仕途」。

本文

獲「當代中國」授權刊出，歡迎關注：

https://www.ourchinastory.com/

延伸閱讀：

躍動灣區｜「小女車神」李思穎延續傳奇當年如何發掘單車天賦？｜全運會人物篇"
60294668,不老男神拍TVB劇被指捱殘顏值跌Watt　曾兩度入院做手術停工休養,2025-11-15 22:00,2025-11-15 22:00,2025-11-15 22:15,即時娛樂,hk01,https://www.hk01.com/即時娛樂/60294668/張智霖拍tvb劇被指捱殘顏值跌watt-曾兩度入院做手術停工休養,現年54歲的影后袁詠儀 (靚靚) 與同齡的老公張智霖 (Chilam) 由拍拖到2001年結婚至今，多年來一直十分恩愛，是圈中出名的模範夫妻，經常出雙入對。,"現年54歲的影后袁詠儀 (靚靚) 與同齡的老公張智霖 (Chilam) 由拍拖到2001年結婚至今，多年來一直十分恩愛，是圈中出名的模範夫妻，經常出雙入對。張智霖出了名錫老婆，曾表示自己因為要買包包給老婆幾乎陷破產邊緣。而他們夫妻倆都有一個共通點，就是同樣擁有超凍齡樣貌，即使兩人都已經年過半百，卻依然顯得相當年輕，是不老男神女神代表人物。

最近張智霖正在澳門拍攝無綫新劇《璀璨之城》，資深藝人煒烈就於小紅書分享了幾張與同劇演員的相片，其中一張是他跟張智霖的合照。有網民就指相中戴住眼鏡的張智霖，看來面容憔悴，顏值魅力大趺watt，比起一貫的凍齡靚仔樣，彷彿老了十年，慨嘆他拍劇捱殘了，不過也有網民指他依然帥氣充滿男人味。張智霖3年前曾因膽囊炎緊急入院做手術，需停工休養。今年3月他又在上海一間醫院醫治膽石，手術後休息了一段時間，才再重新投入工作，網民都紛紛留言叮囑他不要過勞捱壞身體。"
