id,title,date,last_update,scrape_time,section,source,url,lead,news_content
60294784,伊朗革命衛隊扣押一艘油輪　將其引向伊朗領海,2025-11-16 09:56,2025-11-16 09:56,2025-11-16 10:00,即時國際,hk01,https://www.hk01.com/即時國際/60294784/伊朗革命衛隊扣押一艘油輪-將其引向伊朗領海,伊朗伊斯蘭革命衛隊扣押一艘行駛在阿曼灣的油輪，在油輪通過霍爾木茲海峽后，將它引向伊朗領海。彭博社引述船舶管理公司哥倫比亞船舶管理公司（Col,"伊朗伊斯蘭革命衛隊扣押一艘行駛在阿曼灣的油輪，在油輪通過霍爾木茲海峽后，將它引向伊朗領海。

彭博社引述船舶管理公司哥倫比亞船舶管理公司（Columbia Shipmanagement）的聲明說，這艘懸掛馬紹爾群島旗幟的塔拉拉號（Talara）油輪星期五（11月14日）在阿聯酋霍爾·法坎（Khor Fakkan）以東約20海裡處航行時，與公司失去聯繫。 提供海上情報的Vanguard Tech稱，油輪被伊朗伊斯蘭革命衛隊海軍攔截。

油輪失聯後，作為英國海軍在這個地區聯絡機構的英國海事貿易行動辦公室說，事件據信是國家行為。 美國一名防務官員稱，這是數月來在該戰略水道發生的首次此類攔截行動。官員指此舉違反國際法，但拒絕進一步說明。

新華社引述伊朗伊斯蘭革命衛隊星期六（15日）的聲明說，其海軍星期五在阿曼灣南部馬克蘭海岸附近扣押一艘懸掛馬紹爾群島旗幟的油輪，理由是油輪存在「違規行為」。

據革命衛隊官方新聞機構Sepah News發佈的聲明，革命衛隊海軍快速反應部隊於當地時間星期五上午7時30分（新加坡時間中午12時）追蹤並扣押油輪。 此次行動是根據伊朗司法部門的命令進行的，此前革命衛隊對其動向進行了監控。

聲明稱，油輪載有3萬噸石化產品，目的地為新加坡。 聲明還補充說，在檢查了油輪和其貨物和檔後，海軍部隊確認船隻因載有「未經授權」的貨物而「違反了相關規定」。 聲明稱，此次行動是為了「保護伊朗的國家利益和資源」。

本文獲《聯合早報》授權轉載"
60294781,高市早苗涉台言論後　中國海警將巡航釣魚島領海,2025-11-16 09:45,2025-11-16 09:45,2025-11-16 10:00,即時中國,hk01,https://www.hk01.com/即時中國/60294781/高市早苗涉台言論後-中國海警將巡航釣魚島領海,今日上午（11月16日）中國海警發布公告表示，將在釣魚島領海巡航。公告表示，11月16日，中國海警1307艦艇編隊在我釣魚島領海內巡航。這是中國海警,"今日上午（11月16日）中國海警發布公告表示，將在釣魚島領海巡航。

公告表示，11月16日，中國海警1307艦艇編隊在我釣魚島領海內巡航。這是中國海警依法開展的維權巡航活動。

近期，日本首相高市早苗發表「台灣有事論」後，中日緊張關係升溫。中國外交部領事司此前發布通告提醒公民近期暫勿前往日本；昨日（15日）海事局網站亦公布，鹽城海事局發布航行警告，11月17至19日，每日0時到24時，黃海中部部份海域進行實彈射擊，禁止駛入。"
60294773,有片｜牛池灣大排檔3食客擸梯掟櫈襲60歲漢　職員制止慘遭爆樽,2025-11-16 09:43,2025-11-16 09:43,2025-11-16 09:45,突發,hk01,https://www.hk01.com/突發/60294773/有片-牛池灣大排檔3食客擸梯掟櫈襲60歲漢-職員制止慘遭爆樽,牛池灣大排檔昨（15日）晚發生襲擊事件，一名60歲男子被至少3人毆打，期間有人擸鋁梯、掟櫈、舉啤酒樽施襲；53歲職員制止時同告受傷，2人送院治理,"牛池灣大排檔昨（15日）晚發生襲擊事件，一名60歲男子被至少3人毆打，期間有人擸鋁梯、掟櫈、舉啤酒樽施襲；53歲職員制止時同告受傷，2人送院治理。3名施襲者事後逃去，警方將案件列作「襲擊致造成身體傷害」處理。

網上流傳有關片段，帖文指「先係口角 繼而動武」，懷疑有食客起口角，之後打鬥。片段中有人用鋁梯、膠櫈及玻璃樽等作武器，一名男子疑受傷癱坐在地上。

事發於牛池灣龍池徑一大排檔，當時近角落的座位數人疑起衝突，一片混亂，多名食客圍觀。片段可見一名穿白衣的男子與數名男子推撞，期間有人利用鋁梯作武器揮舞，另一片段可見一名男子疑手持大排檔的櫈擲向地面方向，惟未拍到是否擲到人。期間有一名黑衣男取走桌上一樽啤酒，之後傳出爆玻璃聲，同時有人罵「Ｘ你老Ｘ」，拍片者即指「（有人）冧（倒地）咗、冧咗」，此時白衣男子癱坐在地上，上氣不接下氣，眼鏡亦已丟失，拍片者再補充指「爆咗樽喎、打咗落佢個頭度」。

警方昨（15日）晚11時27分接獲報案，指牛池灣龍池徑一大排檔有人打鬥，事件中2人受傷，一名姓葉男食客（60歲）左眼附近流血、鼻流血及心口痛 ，而另一名姓蘇男職員（53歲）則後頸受傷，兩人送往聯合醫院治理。

據了解，葉男與友人在上址吃飯，期間另一餐桌的3名男食客以拳腳攻擊葉男，在上址工作的蘇男見狀打算制止打鬥，惟期間遭人「爆樽」，與葉男雙雙受傷。3名年約50多歲的男子施暴後離開，警方將案件列作襲擊致造成身體傷害處理，暫未有人被捕。"
60284083,古代皇帝為何規定嫡長子繼位　唯獨清朝卻爭崩頭？揭2大重要因素,2025-11-16 09:30,2025-11-16 09:30,2025-11-16 09:45,熱爆話題,hk01,https://www.hk01.com/熱爆話題/60284083/古代皇帝為何規定嫡長子繼位-唯獨清朝卻爭崩頭-揭2大重要因素,在古代封建社會，歷代皇帝通常使用嫡長子繼承制來決定繼承人。不過嫡長子只是一種身分地位的象徵，並不能代表品德和治國能力，為何他們會堅持皇位只,"在古代封建社會，歷代皇帝通常使用嫡長子繼承制來決定繼承人。

不過嫡長子只是一種身分地位的象徵，並不能代表品德和治國能力，為何他們會堅持皇位只能由嫡長子繼承，而不是選賢與能呢？背後隱含了2個重要的政治因素。

嫡長子之所以為「嫡」有實際原因：

根據《藝述史》報導，封建時代的皇室嫡長子就算花天酒地、不學無術，還是很有可能登上皇位，就像晉朝嫡長子司馬衷普遍被認定智力不高，但依然順利登基，史稱「晉惠帝」，明末清初的政治思想家王夫之更曾評論「惠帝之愚，古今無匹，國因以亡」；而明成祖朱棣的嫡長子朱高熾有腿部殘疾，走路需要旁人攙扶，同樣坐上皇帝高位。

但建立起這樣的制度並非因古人昏庸，古代會採取立嫡不立賢，背後關乎2個重要因素，首先，封建時代已經建立起完整的官僚系統，在明朝以前，中央集權的狀況並不嚴重，就算脫離統治者的決策也能夠正常運作，所以嫡長子繼承制不是論繼任者的治理能力來決定，目的是為了維持國家系統的穩定，制定出統一的標準就能避免鬥爭。

其次是嫡長子之所以為「嫡」，正是因為他的母族家世背景比較好，背後有權勢、財力的靠山支持，這也是實力的一部份，同時還能有效避免家庭間的鬥爭，維護皇室內部穩定。

但是為何傳承了千百年的嫡長子繼承制，到了清朝就形同虛設呢？其實是因為清朝初期，宗室就展現出了強大的力量，例如努爾哈赤的弟弟就是他的好幫手。清朝統治者需要宗室的協助，所以不像前朝一樣拒絕宗室參政，最後造就一群有能力的兒子互相爭奪皇位，最有名的就是康熙時期的「九龍奪嫡」事件，而事實上，在清朝長遠的歷史中，成功即位的嫡長子只有道光皇帝一人。

相關文章：

古代皇帝想臨幸妃嬪月經來了怎辦？3種聰明解決法免「衝紅燈」

【本文經《風傳媒》授權轉載，原文：

古代皇帝孩子超多，為何一定要由嫡長子繼位？電視劇沒演的2大內幕，絕非因長幼有序

】"
60294779,加沙連日大雨引發洪災　臨時住所遭摧毀　聯合國機構呼籲更多物資,2025-11-16 09:30,2025-11-16 09:34,2025-11-16 09:45,即時國際,hk01,https://www.hk01.com/即時國際/60294779/加沙連日大雨引發洪災-臨時住所遭摧毀-聯合國機構呼籲更多物資,加沙地帶連日遭遇強降雨，引發洪澇災害，當地有部分民眾居住的帳篷營地遭淹浸。聯合國近東巴勒斯坦難民救濟和工程處主任專員拉扎里尼（Philippe La,"加沙地帶連日遭遇強降雨，引發洪澇災害，當地有部分民眾居住的帳篷營地遭淹浸。聯合國近東巴勒斯坦難民救濟和工程處主任專員拉扎里尼（Philippe Lazzarini）表示，加沙現時寒冷潮濕，流離失所者面臨嚴冬，民眾需要更多避難物資。

綜合外媒報道，加沙11月15日迎來冬季的第一場暴雨，洪水湧入加沙地帶的穆瓦西帳篷營地。當地民防部門發言人說，裂開、破損的房屋隨時可能坍塌，數以千計流離失所者的帳篷已受損，但救助資源有限。

有居民試圖挖溝渠來阻止洪水湧入帳篷，雨水從破損的帳篷和臨時住所中滲出。暴雨浸透了居民僅有的少量財物，強風也吹倒了帳篷，阻礙居民收集稀缺的食物和物資。

根據聯合國統計，穆瓦西早前已收容了多達42.5萬名流離失所的巴勒斯坦人，其中絕大多數住在臨時搭建的帳篷內。

負責加沙人道援助的以色列國防部表示，他們允許運送包括毯子和厚防水佈在內的冬季保暖物資，但援助組織警告說，當冬季氣溫驟降，地中海寒風凜冽時，這些物資遠遠不夠。"
60293724,內地日式料理餐廳「黃牙壽司」廣告醜到上熱搜　急換另一幅再出事,2025-11-16 09:30,2025-11-16 09:30,2025-11-16 09:45,熱爆話題,hk01,https://www.hk01.com/大國小事/60293724/內地日式料理餐廳-黃牙壽司-廣告醜到上熱搜-急換另一幅再出事,OMG！這是誰的一口大黃牙？！你見過醜到出圈的設計嗎？最近成都一家商場的日料店圍擋，徹底火了，靠一口「破碎大黃牙」成功刷屏全網！遠看以為是口,"OMG！這是誰的一口大黃牙？！你見過醜到出圈的設計嗎？最近成都一家商場的日料店圍擋，徹底火了，靠一口「破碎大黃牙」成功刷屏全網！

遠看以為是口腔健康廣告，近看才發現：好傢伙，是個鏡面大壽司？上面還配了句：

結果年輕人還沒吃上，先感受了一波視覺暴擊！

日料店「黃牙壽司」海報惹人嘲更換之後荒唐感還更甚：

設計師大概是想打造高端日料氛圍，沒想到直接翻車成「黃斑牙壽司」，飯沒宣傳成功，反手送上一波「餐後洗牙焦慮」。不少路人第一眼都愣住，還以為是「提醒大家好好刷牙」的公益廣告。

網友們的吐槽更是炸開了鍋，甚至還有熱心網友連夜出手，試圖挽救，但很遺憾，那股「黃牙感」依舊揮之不去。

但是，你說它失敗吧，它又挺成功，短短幾天「黃牙壽司」衝上熱搜，在各平台瘋狂刷屏。大概是輿論壓力太大？店家火速換上了新圍擋。結果，翻車2.0來了！

第二版想走簡約風，卻被辣評：

不過，有人覺得新版「至少正常了，不勸退」。也有人懷念舊版：

那麼，如果必須選一個，你站「黃牙壽司」還是「摺疊內褲」？

【延伸閱讀】

日本伸縮購物袋爆紅網民稱「激似一物」慨嘆使用「需要勇氣」

（按圖放大瀏覽）

【本文獲「日本設計小站」授權轉載，微信公眾號：japandesign】"
60294778,全運會游泳︱何詩蓓終與張雨霏交鋒　晉兩場短途準決賽再爭金,2025-11-16 09:16,2025-11-16 09:43,2025-11-16 09:45,即時體育,hk01,https://www.hk01.com/即時體育/60294778/全運會游泳-何詩蓓終與張雨霏交鋒-晉兩場短途準決賽再爭金,何詩蓓周六晚贏得女子100米自由泳金牌後，今早（16日）隨即轉戰餘下兩個參賽項目、女子50米自由泳及50米蛙泳，並均順利晉級今晚準決賽。她在今屆賽,"何詩蓓周六晚贏得女子100米自由泳金牌後，今早（16日）隨即轉戰餘下兩個參賽項目、女子50米自由泳及50米蛙泳，並均順利晉級今晚準決賽。她在今屆賽事已經先後贏得200自及100自兩金。

⬆️⬆️⬆️TVB Youtube頻道直播⬆️⬆️⬆️

50自初賽與張雨霏同場交鋒再有對手退賽

9時15分她先在50自出場，她在初賽第6個小組的第3線出賽，她身旁的原本是第4線、100自亞軍的楊浚瑄，以及第5線的張雨霏。可是楊浚瑄並未上陣（DNS）。

何詩蓓與張雨霏隔着一條空出的泳道較量，初段稍為落後，但到中段漸漸追上，至尾段已稍為佔優，並游出25.07秒率先觸池，獲小組第一名，力壓以25.27秒獲小組次名的張雨霏，以總成績第三名晉級今晚7時多上演的準決賽。

江西的程玉潔以24.75秒初賽首名晉級、浙江的吳卿風以24.90秒得初賽第二名。張雨霏以總成績第6名晉級，另一港將李芯瑤以第12名晉級。

何詩蓓首次參加全運會，雖然她在剛開賽時說有點緊張，但她愈游愈好，狀態大勇，以1分54.85秒贏得200米自由泳金牌，首次踏上全運頒獎台最高一格。繼而在100自再以52.89秒獲得今屆第二金。"
60293283,中國18歲獲救豬仔揭緬甸詐騙園駭人酷刑　銬在柱子暴曬　針插手指,2025-11-16 09:00,2025-11-16 09:00,2025-11-16 09:15,即時國際,hk01,https://www.hk01.com/大國小事/60293283/中國18歲獲救豬仔揭緬甸詐騙園駭人酷刑-銬在柱子暴曬-針插手指,今年7月，安徽省合肥市廬江縣18歲高中生胡一嘯被騙至緬甸，父親胡宗兵輾轉多地尋子的故事備受關注。最終，胡一嘯平安回國。胡一嘯是怎麼被騙至緬甸,"今年7月，安徽省合肥市廬江縣18歲高中生胡一嘯被騙至緬甸，父親胡宗兵輾轉多地尋子的故事備受關注。最終，胡一嘯平安回國。

胡一嘯是怎麼被騙至緬甸的？他在緬北又經歷了什麼？央視總台記者獨家採訪胡一嘯。

白天銬在外面柱子上暴曬詐騙園內部情況曝光：

嘗試打零工掙錢證明自己「長大了」

2025年4月，剛剛參加完會考的胡一嘯決定放棄高考，早點出來找份工作掙錢。因為學習成績不好，胡一嘯想用另一種方式向父母證明自己。他和同學相約去浙江的一家電子廠打零工，但是沒幹多久就離開了。

因為日結工作不穩定，胡一嘯有時會找不到活幹。那段時間，除去吃飯、房租，他手裏的錢所剩無幾。因此，胡一嘯幾乎每天都在手機上搜羅各種兼職訊息。 2025年6月的一天，一名博主發布的兼職訊息引起了胡一嘯的好奇。 「他推了一個背貨的，去邊境背黃金，大概10萬元錢（人民幣，下同）一趟，把貨拿回來之後要跟他分賬。只要冒險一次，就能賺到5萬元。然而，因為沒有護照，胡一嘯本想放棄，但是對方告訴他，沒有護照也沒關係。 」

記者：出發前你知不知道這是偷渡？

胡一嘯：知道。

記者：你有沒有問他怎麼出去？

胡一嘯：他說那邊有安排好的路線，跟着他的路線走就行。

多次換乘交通工具深夜出境

明知自己找的這份兼職存在風險，也明知要偷渡出國，可在「高薪」的誘惑下，胡一嘯依然想要冒險嘗試。在確認胡一嘯願意去緬北後，對方立即給他訂了當天飛往雲南西雙版納的機票，並且安排好了入住的賓館。

胡一嘯回憶，按照對方的要求，入住後他就再也沒出過門，直到第二天中午，那名博主突然給他發來訊息，要求他前往距離賓館兩公里外的一個公交車站匯合。「到車站之後給他發消息，沒多久一輛銀色轎車過來，上車了還要和司機對暗號。」

胡一嘯發現，車上除了司機，還有另外三名和自己一樣的年輕男子。他們一共換乘了四次，其中三次是汽車，一次是摩托車，一路上都是山間小路：

晚上七點多，胡一嘯和另外一名男子被送到了國境線附近，深夜在他人的帶領下翻過國境線上的鐵柵欄，進入緬甸。接着又是換了幾次車，直到第二天晚上，他們才在一家賓館門前停下。「在賓館裏他們說，我們到這裏就是被騙過來的，他們那裏是人販子窩點。 」

對方的話讓胡一嘯如夢初醒，原來那名博主口中所謂高薪背黃金的工作根本就不存在。胡一嘯和一同來的男子，被分別帶進兩個房間，房間裏還有兩個專門看守他的人。 待了兩天後，看守的人告訴胡一嘯，他被以10萬元的價格賣給了緬甸一家詐騙公司，這也是幾天來，胡一嘯第一次聽到自己所處的位置。

【延伸閱讀】8內地男偷渡去越南半途驚悉「正被賣豬仔去緬甸」劇情神展開（點圖放大閱讀）：

不服從就捱打直至被迫妥協

據胡一嘯回憶，離開這家賓館後，他和兩名看守一起上了一輛車，一路上不停地換車，走了兩天，中途還在山上住了一晚上，才到達被賣的詐騙園區。下車後，胡一嘯第一眼看見的是安裝着鐵絲網的圍牆，周圍有類似哨塔的建築，「上面有人站崗，都是拿槍的」。

直到此時，胡一嘯還沒有真正意識到自己將要面對的是什麼，甚至還在考慮回國後的事情。 「他們給安排了組長，組長問我們願不願意進行詐騙，如果不願意就先打我們，打到我們願意幹為止。」

考慮到如果從事詐騙可能就無法再回國，哪怕回去了也要面臨處罰，胡一嘯拒絕服從園區的安排，而這招來了一頓頓暴曬和毒打，他的腿上至今仍有當時被打的痕跡。

在被折磨了4天後，胡一嘯再也無法忍受，選擇了妥協。他拿到了一份詐騙話術，並在學了一周詐騙流程後，被組長分到「引流組」。在這裏，胡一嘯被包裝成軍人，並使用園區配發的「詐騙專用」手機，尋找詐騙目標。

胡一嘯回憶，他所在的園區非常大，裏面大概有兩三百人，被分成了不同的組。他所在的「引流組」每天就負責在短視頻平台上尋找目標，有30萬以上流動資金的，年齡在35—55周歲之間的女性，並把對方引入第三方平台。隨後由園區的其他組負責繼續詐騙。

因為內心對詐騙有所抗拒，幾十天下來，胡一嘯一個人也沒有騙到，也沒能拿到一分錢，這也就意味着他在園區裏只能吃最差的飯菜，渴了只能對着水龍頭喝自來水。 在詐騙園區的那段時間裏，胡一嘯身心俱疲，成宿地失眠。「想家，想回來，但是也沒有辦法。因為他們給的手機都是改過的，據說裏面裝了一些東西，可以查到我們發出去的消息。」

胡一嘯也不知道監控手機到底是真是假，但園區裏確實有人因為向國內傳遞消息被打或者被虐待。這些人被打時，犯罪團伙還會組織他們這些新入園區的年輕人觀看。「看到有人開槍，還看到他們把針插進傳消息的人手指裏。」

刷到父親尋人新聞他被園區釋放

某一天，胡一嘯在配發的手機上尋找詐騙目標時，突然刷到了父親胡宗兵尋找自己的新聞。當晚，胡一嘯被關進了一間小黑屋。三天後，組長告訴他，要送他離開園區。「組長說園區決定放我回去了，他拿了1000元錢讓我走，又把我送到國門附近。當時還有一個好心人，給我拿了手機讓我聯繫家裏。」

7月25日上午九點多，胡一嘯被詐騙分子送到一個路口後，自己走到入境口岸，這時他才知道，這裏是雲南普洱，並不是他當時出境前時的西雙版納。 因為涉嫌偷越國邊境，胡一嘯入境後被警方帶走接受調查。一天後，父親胡宗兵終於見到了失聯一個多月的胡一嘯。

回想在緬北的這51天，胡一嘯說彷彿是做了一場夢。夢醒之後，只有在身邊的家人是最真實的。談及未來，胡一嘯說，他最想做的，就是踏踏實實學一門手藝：

就在胡一嘯被騙出國的新聞被全國關注的同時，仍有不少懷揣暴富夢的年輕人奔赴緬北等境外涉詐地區。

通過梳理這些人的材料警方發現，很多年輕人都存在和父母關係緊張或是無法有效溝通的問題。警方特別提示，家長應引起注意，家庭的關愛和關注對於防止此類情況的發生至關重要。

【延伸閱讀】

緬甸詐騙營21歲男一個月業績｢僅｣157萬慘遭電棍打穿耳膜全身傷

（點圖放大瀏覽）："
60293838,百億千金入選最具影響力華人精英TOP100　名校雙碩士畢業又靚又叻,2025-11-16 09:00,2025-11-16 09:00,2025-11-16 09:15,即時娛樂,hk01,https://www.hk01.com/即時娛樂/60293838/林恬兒入選最具影響力華人精英top100-名校雙碩士畢業又靚又叻,已故富商林百欣孫女、林建岳與前妻謝玲玲的大女林恬兒（Emily）是城中知名的百億千金，2014年與前全國政協常委、富商何柱國兒子何正德（Kent）結婚,"已故富商林百欣孫女、林建岳與前妻謝玲玲的大女林恬兒（Emily）是城中知名的百億千金，2014年與前全國政協常委、富商何柱國兒子何正德（Kent）結婚，兩人育有一子一女，一家四口幸福美滿。近年致力於環保及女性工作的林恬兒，更入圍2025福布斯中國最具影響力華人精英TOP 100，日前她現身上海出席頒獎典禮，林恬兒以英文寫道：「這不僅是莫大的榮幸，也是對我們Empact 28能夠對世界產生影響的莫大鼓勵。但我們的使命遠未結束。這份認可將激勵我們開啟新的篇章，創造更大的影響力。」

林恬兒是已故麗新集團創辦人林百欣孫女，遺傳了媽媽優良基因的她外形出眾，更是一位學霸，獲美國哥倫比亞大學政治系雙碩士學位。貴為百億名媛的林恬兒家世顯赫，生活無憂，但其實她十分關心社會，早在17歲時就曾到非洲做義工，這段經歷亦令她體驗到當地人生活艱苦，她亦自此對扶貧及推廣環保、可持續發展更為重視。其後林恬兒與朋友一起合辦非牟利環保團體EcoDrive，其後又成立了綠色生活平台8Shades，分享環保小知識，以及推介一些好用又對環境友好的產品。

此外，林恬兒更創立Empact 28，投放資金予女企業家和有社會影響的公司，希望女性可以發揮所長、自力更生，更協助全職媽媽提供幫補家計的工作，從中獲得自信和財政獨立。林恬兒亦積極參與公益事業，曾與慈善機構仁人家園一起為有需要家庭維修家居，又隨慈善組織為有需要人士分派電風扇、到社區中心探訪居家老人，相當有心，去年7月更被正式委任為香港特別行政區的太平紳士(JP)！"
