title,date,url,source,section,scrape_time,news_content
港交所簽訂合作備忘錄 推動粵港澳大灣區碳市場發展,2025-09-23 17:34,https://www.metroradio.com.hk/news/default.aspx?SearchText=&NewsId=20250923173429&page=0,metro,,2025-09-23 17:45,"港交所(00388)宣布，與廣州碳排放權交易中心、 深圳綠色交易所，及澳門國際碳排放權交易所簽署合作備忘錄，攜手推動粵港澳大灣區碳市場及綠色金融生態圈的發展。

根據合作備忘錄， 四家交易所將探索碳市場及綠色金融領域的合作機遇， 促進經驗交流與知識共享，以提升相關機構及人員在碳市場運作、 綠色金融等方面的專業能力，推動區域碳市場深化發展。"
網信辦依法查處今日頭條及UC平台未落實內容管理責任,2025-09-23 17:28,https://www.metroradio.com.hk/news/default.aspx?SearchText=&NewsId=20250923172827&page=0,metro,,2025-09-23 17:45,"國家網信辦依法查處字節跳動旗下的今日頭條，以及優視科技旗下的UC平台，破壞網絡生態案件，針對兩個平台未落實信息內容管理主體責任，採取約談、責令限期改正、警告、從嚴處理責任人等處置處罰措施。

當中，今日頭條平台，在熱搜榜單主榜呈現不良信息內容，還在落地頁面置頂呈現相關話題，破壞網絡生態；UC平台在熱搜榜單主榜，扎堆呈現極端敏感惡性案事件詞條等非權威部門、權威媒體發布的信息，涉及網絡暴力、未成年人隱私等相關話題，破壞網絡生態秩序。"
談判達10年 印尼歐盟終簽定CEPA,2025-09-23 17:25,https://www.metroradio.com.hk/news/default.aspx?SearchText=&NewsId=20250923172546&page=0,metro,,2025-09-23 17:45,"印尼與歐盟簽署《全面經濟夥伴關係協定》(CEPA)，是繼新加坡和越南之後，歐盟與東南亞國家簽署的第三份同類協定。

歐盟委員會貿易專員謝夫喬維奇(Maros Sefcovic)在巴厘島，與印尼經濟事務統籌部長艾爾朗加(Airlangga Hartato)簽署協定後表示，這項貿易協定的敲定，向世界傳遞了強有力信號，表明歐盟與印尼團結一致，致力於開放、 基於規則且互惠互利的國際貿易。

歐盟委員會主席馮德萊恩(Ursula von der Leyen)在聲明中指出，歐盟出口商每年可因此節省約6億歐元的印尼市場進口關稅，印尼消費者則能以更實惠的價格，購得更多歐洲產品。

印尼2016年起與歐盟就貿易協定展開磋商，但談判初期進展緩慢。 專家指出，棕櫚油和森林砍伐等問題曾阻礙談判進度，但隨著美國總統特朗普推出全面關稅政策，歐盟與印尼達成貿易協定變得更為迫切。

艾爾朗加在簽署儀式表示，主要國家間「關稅戰和保護主義」引發的不確定，促使印尼和歐盟通過穩定的雙邊協議尋求確定性；這份協定將緩解全球關稅戰帶來的風險。

歐盟是印尼第五大貿易夥伴，去年雙邊貿易額達301億美元。"
澳門改發8號風球,2025-09-23 17:24,https://www.metroradio.com.hk/news/default.aspx?SearchText=&NewsId=20250923172413&page=0,metro,,2025-09-23 17:45,"超強颱風樺加沙逼近，澳門氣象局下午5時改發8號風球；明日凌晨零時至2時發出9號風球，以及凌晨4時至6時改發10號風球，機會都是高。 當地下午1時進入即時預防狀態，低窪地區居民需要疏散撤離。

氣象局預計，樺加沙明日凌晨至早上會相當接近珠江口，有機會在澳門100公里內掠過，屆時風力有機會達12級颶風或以上，最大風力持續時間較長。

澳門所有娛樂場關閉；澳門海關表示，經珠澳及琴澳有關部門協商一致，拱北口岸、青茂口岸、珠澳跨境工業區專用口岸，以及橫琴口岸旅檢大廳，將於晚上 7時起暫停通關服務。"
市監總局約談貨拉拉 要求嚴格遵守反壟斷法等法律法規,2025-09-23 17:23,https://www.metroradio.com.hk/news/default.aspx?SearchText=&NewsId=20250923172342&page=0,metro,,2025-09-23 17:45,"近日市場監管總局約談LALAMOVE旗下的貨拉拉，要求嚴格遵守反壟斷法等法律規定，落實反壟斷合規主體責任，及時規範經營行為，公平參與市場競爭，維護貨車司機、消費者等相關主體合法權益，推動平台規則和算法公平公正、公開透明，促進行業規範健康發展。

市監總局在2023年底曾約談過貨拉拉，指出其在經營管理方面的突出問題，要求各平台公司進一步健全經營策略調整評估機制，全面做好風險評估和論證，切實保障貨車司機合法權益。"
67歲男子涉停牌期間駕駛被捕,2025-09-23 17:09,https://www.metroradio.com.hk/news/default.aspx?SearchText=&NewsId=20250923170949&page=0,metro,,2025-09-23 17:30,"一名男子涉嫌停牌期間駕駛，以及駕駛時沒有第三者保險被捕。

警方中午約12時，在油塘高超道近茶果嶺道，截查一輛可疑私家車，67歲男司機懷疑停牌期間駕駛被捕，獲准保釋候查，須於10月下旬向警方報到。"
領展:王國龍年底退任 由宋俊彥與黃國祥臨時共同承擔CEO職責,2025-09-23 17:06,https://www.metroradio.com.hk/news/default.aspx?SearchText=&NewsId=20250923170604&page=0,metro,,2025-09-23 17:15,"領展(00823)公布，行政總裁王國龍將於今年12月31日或之前退任，集團首席投資總裁宋俊彥，將獲委任為執行董事，明年1月1日起生效，他將與首席財務總裁黃國祥，共同組成臨時領導架構，以承擔集團行政總裁職責，並向領展主席歐敦勤及董事會匯報。

歐敦勤將聯同由他及其他委員會主席組成之主席委員會，於執行策略及落實主要措施，為執行董事提供監督、支援及獨立非執行指引，確保維持適當管治及集團策略繼續取得進展。

歐敦勤表示，臨時安排讓王國龍得以實現退休意願，同時確保集團營運延續性，直至新任行政總裁履新，他代表董事會衷心感謝王國龍過去16年的卓越領導，並歡迎宋俊彥加入董事會，期待與領導團隊繼續攜手推動業務向前。

董事會的獨立成員，會繼續進行全面甄選程序，以物色下一任行政總裁，並將適時公布最新進展。"
中方批美日韓在台灣和涉海問題上說三道四 堅決反對,2025-09-23 17:00,https://www.metroradio.com.hk/news/default.aspx?SearchText=&NewsId=20250923170057&page=0,metro,,2025-09-23 17:15,"在北京，外交部批評美日韓3國，在台灣和涉海問題上說三道四，干涉中國內政，污衊抹黑中國，中方對此強烈不滿，堅決反對。

外交部發言人指，台灣是中國領土不可分割的一部分，台灣問題純屬中國內政，不容任何外來干涉，當前台海和平穩定的最大威脅，是台獨分裂行徑和外部勢力的縱容支持，維護台海和平穩定，就必須堅持一個中國原則，必須明確反對台獨。 有關國家應該恪守一個中國原則，停止以任何形式縱容台獨分裂活動，不得向台獨分裂勢力發出錯誤信號。

發言人又指，當前南海局勢總體保持穩定，中方始終堅定捍衛領土主權和海洋權益，同時致力於同有關當事國，通過對話協商妥善處理分歧；有關國家應該尊重地區國家，通過對話協商解決問題，維護和平穩定的共同努力，停止渲染緊張，挑動對抗。"
天文台評估是否需要晚上11時至凌晨3時改發更高信號,2025-09-23 16:59,https://www.metroradio.com.hk/news/default.aspx?SearchText=&NewsId=20250923165924&page=0,metro,,2025-09-23 17:15,"八號西北烈風或暴風信號現正生效。 天文台表示，會視乎超強颱風樺加沙與香港的距離，以及本地風力變化，評估是否需要在今晚11時至明日凌晨3時之間，改發更高熱帶氣旋警告信號。

按照現時預測，樺加沙會於明早最接近珠江口一帶，本港風力將進一步增強，樺加沙環流廣闊，風勢猛烈，其外圍雨帶已逐漸靠近珠江口一帶，而本港高地已經開始間中吹烈風，預料本港晚間天氣會急速轉壞，風力迅速上升，明日天氣持續惡劣，吹烈風至暴風，初時離岸及高地風力達颶風程度，有頻密狂風大驟雨及雷暴，海有極巨浪及湧浪，岸邊會出現越堤浪，東面及南面的海岸尤其顯著，市民應遠離岸邊及停止所有水上活動。

受顯著風暴潮影響，明日本港沿岸增水可達約2米，預計水位早上約6時後開始上升，並在早上較後時間至下午初時達至最高，普遍可達海圖基準面以上約3.5米至4米，而吐露港水位更可能高達海圖基準面以上4米至5米。"
訪華眾議員: 美中稀土磁鐵爭議未解 雙邊關係仍存摩擦,2025-09-23 16:45,https://www.metroradio.com.hk/news/default.aspx?SearchText=&NewsId=20250923164556&page=0,metro,,2025-09-23 17:00,"美國國會眾議院代表團結束對中國正式訪問，率領代表團的民主黨籍眾議員史密斯(Adam Smith)表示，美中針對北京控制稀土磁鐵供應的爭議尚未解決，顯示雙邊關係仍存在一個關鍵的摩擦因素。

史密斯在記者會表示，他認為美中未有解決稀土問題，要解決這個問題還需要努力。 但他並未具體說明癥結所在。

今年4月初，美國總統特朗普宣布對中國加徵高額對等關稅後，中國對7種稀土和相應的稀土磁體，實施出口管制作為反制手段。  兩國其後達成框架協議，其中包括中國承諾審查稀土磁鐵的輸出申請，但協議的細節尚未披露。

根據海關總署的最新數據，中國8月稀土磁鐵出口連3個月上升，達6146公噸，按月增百分之10.2，按年增百分之15.4，但對美出口減至590公噸，按月跌百分之4.7，按年跌百分之11.8，呈現「總量回升、對美降溫」的分歧走勢。"
樺加沙來襲 廣州市宣布「五停」,2025-09-23 16:33,https://www.metroradio.com.hk/news/default.aspx?SearchText=&NewsId=20250923163341&page=0,metro,,2025-09-23 16:45,"中央氣象台預計，超強颱風樺加沙明日中午或晚上，以颱風級或強颱風級，在廣東珠海到湛江一帶沿海登陸。 已經宣布「臨戰狀態」的廣東省，將防風應急響應提升至一級，並發布緊急動員令，全省動員投入防風防汛和搶險救災工作。

省內逾10個市相繼啟動「五停」措施。 深圳市昨晚已開始停課，今日下午停工、停業和停市，晚上8時起停運。 深圳地鐵全線服務今日提早結束，尾班車將在傍晚6時開出。

珠海亦啟動「五停」措施，並封閉部分路段；港珠澳大橋珠海公路口岸亦已經暫停出境通關服務，大橋主橋同步封關。

廣州市就指，預計樺加沙在今晚至周四期間，帶來的狂風暴雨和風暴潮，嚴重影響廣州市，防禦形勢極其嚴峻，所以決定採取「五停」措施。

國家防總決定，將廣東和海南的防汛防颱風應急響應，提升至三級。"
據報中國買家向阿根廷預訂至少10批大豆船貨,2025-09-23 16:33,https://www.metroradio.com.hk/news/default.aspx?SearchText=&NewsId=20250923163348&page=0,metro,,2025-09-23 16:45,"外電報道，在阿根廷星期一宣布，暫時取消對包括大豆在內的穀物及副產品徵收出口稅後，有來自中國的買家已經預訂至少10批大豆船貨。

《路透》引述兩名貿易商報道，有關大豆將會在以巴拿馬型船運載，計劃11月份裝船，每批裝運6萬5千噸，成本加運費報價為每蒲式耳較芝加哥期貨交易所11月大豆合約溢價2.15至2.3美元。

阿根廷早前宣布，暫停徵收穀物稅，將持續到10月，或者直到申報出口額達到70億美元為止，有分析指,措施令阿根廷大豆價格對中國買家更具吸引力，不過影響可能只是短暫，因為政策只持續一個多月，而且阿根廷的總體供應量有限。"
海關機場檢獲760萬元懷疑冰毒 拘東京抵港漢,2025-09-23 16:21,https://www.metroradio.com.hk/news/default.aspx?SearchText=&NewsId=20250923162112&page=0,metro,,2025-09-23 16:45,"海關在機場偵破行李藏毒案，檢獲約23公斤懷疑冰毒，市值約760萬元，拘捕1名男子。

海關昨日替1名，由日本東京飛抵本港的21歲男子清關時，在他的寄艙行李內發現該批懷疑冰毒。 被捕男子被控1項販運危險藥物罪，案件明日在西九龍裁判法院提堂。"
瑞典央行一如預期減息四分一厘,2025-09-23 16:20,https://www.metroradio.com.hk/news/default.aspx?SearchText=&NewsId=20250923162057&page=0,metro,,2025-09-23 16:45,"瑞典央行一如市場預期減息四分一厘，指標利率降至1.75厘。

瑞典央行表示，為進一步支持經濟活動，並在中期內將通脹率穩定在目標水平，決定減息四分一厘，如果通脹和經濟活動前景保持不變，預計指標利率將在未來一段時間內保持在有關水平。"
港股收市跌185點 報26159點,2025-09-23 16:19,https://www.metroradio.com.hk/news/default.aspx?SearchText=&NewsId=20250923161921&page=0,metro,,2025-09-23 16:30,"超強颱風樺加沙襲港「打風不停市」，港股先升後倒跌，大市高開91點後好快倒跌，之後跌幅持續擴大，恒生指數一度失守26100點水平，最多跌過340點，低見26003點，之後跌幅收窄，重上26100點水平，收市報26159點，跌185點，成交2946億元。

新經濟股普遍下跌，百度(09888)跌半成，是跌幅最大藍籌，京東集團(09618)跌百分之4，美團(03690)跌超過百分之2，快手(01024)靠穩，騰訊(00700)偏軟，阿里巴巴(09988)靠穩，但網易(09999)逆市升百分之1。

汽車股下跌，比亞迪(01211)跌百分之3，理想汽車(02015)及吉利(00175)跌百分之2，小鵬(09868)靠穩，蔚來(09866)跌近百分之6。

醫藥股下跌，石藥集團(01093)及中生製藥(01177)跌百分之4，藥明康德(02359)跌百分之3，藥明生物(02269)及翰森製藥(03692)跌百分之1。

金融股上升，滙控(00005)升百分之1，中銀香港(02388)、工行(01398)、恒生(00011)、建行(00939)及招行(03968)都上升。

雲智匯科技(01037)與優必選合作人形機械人業務，股價復牌後一度急升一倍，是升幅最大港股。

國企指數報9290點，跌80點。"
港鐵簽訂300億港元7年期綠色銀團貸款 共57家銀行參與,2025-09-23 16:18,https://www.metroradio.com.hk/news/default.aspx?SearchText=&NewsId=20250923161806&page=0,metro,,2025-09-23 16:30,"港鐵(00066)簽訂一筆總值300億元的七年期定期銀團貸款。

貸款獲15間國際牽頭銀行支持，並吸引共42間來自全球的銀行承諾參與，是香港企業在亞洲、中東及北非歷來規模最大的無抵押國際綠色七年期或以上年期貸款，充分體現市場肯定港鐵實力及市場地位，以及在本港鐵路基建中擔當關鍵角色。

貸款簽約儀式今天在港鐵行政總裁金澤培見證下，由財務總監樊米高與各牽頭安排行、簿記行及承銷商代表一同簽署協議，市場反應熱烈，牽頭銀行於發行程序前已承銷逾580億元貸款額，發行階段最終獲超額認購超過5倍，鑑於市場需求強勁，公司決定將貸款額由230億元提升至300億港元；另外，港鐵亦與韓國產業銀行簽訂7億8千萬元七年期雙邊綠色循環貸款。

金澤培表示，港鐵正全力推展多個大規模鐵路項目，當中包括北環綫的重大投資，港鐵會繼續以前瞻性財務規劃，以公司策略發展為依歸，研究適合融資形式，以逐步推進各個項目。

樊米高表示，今次貸款動用期為九個月，反映港鐵財務穩健以及周詳計劃，公司會繼續秉持審慎理財原則，確保實現長遠財務可持續性。

今次貸款及循環信貸項目所得款項，將用於為港鐵《可持續融資框架》下合資格的綠色投資項目提供融資及再融資。"
陳茂波指嚴陣以待確保金融市場暢順運作,2025-09-23 16:16,https://www.metroradio.com.hk/news/default.aspx?SearchText=&NewsId=20250923161620&page=0,metro,,2025-09-23 16:30,"超強颱風「樺加沙」逼近，八號信號現正生效，港股「打風不停市」。 財政司司長陳茂波表示，當局早已嚴陣以待並做好部署，包括啟動財經事務及庫務局轄下協調中心，確保在各種極端情況下，本港金融市場的各個環節都能暢順運作。

陳茂波在社交平台發文指，財經事務科正與各金融監管機構和持份者，保持緊密聯繫，密切監察市況，就天氣情況對金融市場運作的潛在影響作動態評估。 他又指，「打風不停市」實施至今剛滿一周年，在惡劣天氣下維持巿場交易的安排經過多次實踐，實行以來運作大致暢順，市場亦累積一定經驗。

港交所(00388)在官方微博發文指，根據惡劣天氣交易安排，香港的證券及衍生產品市場，包括滬深港通，在八號或以上信號、黑色暴雨警告或極端情況警告生效期間，將於正常交易時間維持運作，建議市場參與者盡早作出運營及人力資源調配，並參考既定的惡劣天氣交易運作安排，以支持市場平穩運作。"
據報萬科正與國內主要債權人談判冀降低借貸成本,2025-09-23 16:11,https://www.metroradio.com.hk/news/default.aspx?SearchText=&NewsId=20250923161115&page=0,metro,,2025-09-23 16:30,"外電報道，萬科企業(02202)正與國內主要債權人進行談判，希望可以降低利息成本。

《彭博》引述消息人士報道，萬科已經告知包括保險公司在內的一些債權人，將部分債務的利率從目前的4.3厘，降至3厘甚至更低，目前債權人正評估有關計劃，而作為談判的一部分，萬科最近已經決定不支付部分私募債券的利息。

根據數據，截至6月底，萬科的負責為3640億元人民幣，當中四成三會在一年內到期，銀行貸款佔總貸款額百分之72.5，消息人士指，萬科持續面對財務壓力，對銀行亦構成威脅，包括部分拒絕延長萬科債務期限的銀行。"
特朗普促孕婦避免服用止痛藥 專家批不負責任,2025-09-23 16:09,https://www.metroradio.com.hk/news/default.aspx?SearchText=&NewsId=20250923160933&page=0,metro,,2025-09-23 16:15,"美國總統特朗普(Donald Trump)呼籲孕婦，不要服用非處方止痛藥「泰諾」，因為其主要成份撲熱息痛，有可能令兒童患上自閉症的風險上升。

美國婦產科醫師學會指，特朗普的說法，缺乏完整的科學證據支持，而且簡化了兒童神經系統疾病的複雜成因，批評特朗普不負責任。

特朗普亦在沒有提供證據的情況下，指沒有理由讓新生嬰兒接種乙型肝炎疫苗，認為應該待孩子12歲、 身體發育成熟後才接種。

乙型肝炎具高度傳染性，母嬰感染是常見的傳播途徑，新生兒在出生後24小時內，會接種第一劑乙型肝炎疫苗，預防乙型肝炎病毒感染。 乙型肝炎感染是肝硬化和肝癌的主要原因。"
機場全日共382班航班取消 43班航班延誤,2025-09-23 16:06,https://www.metroradio.com.hk/news/default.aspx?SearchText=&NewsId=20250923160619&page=0,metro,,2025-09-23 16:15,"機管局表示，受超強颱風樺加沙影響，截至上午10時30分，機場全日共有382班航班取消，43班航班延誤。

機管局呼籲旅客先向航空公司查詢航班最新情況，在確定機位及航班時間後，才出發前往機場，旅客亦可以瀏覽機場網站，或流動應用程式「My HKG」，查閱最新航班資訊。"
衞生防護中心籲市民提高警覺預防感染類鼻疽,2025-09-23 15:57,https://www.metroradio.com.hk/news/default.aspx?SearchText=&NewsId=20250923155702&page=0,metro,,2025-09-23 16:15,"衞生防護中心提醒市民，特別是長者及長期病患者等高風險群組，在颱風或暴雨後，避免接觸土壤或泥水，以免感染類鼻疽。

中心指，根據海外文獻和本地數據，在颱風或暴雨後，土壤和泥水中的類鼻疽伯克氏菌，有機會曝露於地面，並隨着強風或暴雨，令類鼻疽病菌更容易散播，令感染個案於颱風或暴雨後較常出現。

中心又指，類鼻疽在香港屬風土病，因應2022年深水埗出現的類鼻疽群組個案，與水務署採取一系列預防及監察措施，至今包括於颱風及暴雨後所進行的監測結果，未有出現異常，而食水水質監測結果，一直符合香港食水標準。"
荃灣倫常命案 男子涉用刀刺死父親,2025-09-23 15:57,https://www.metroradio.com.hk/news/default.aspx?SearchText=&NewsId=20250923155706&page=0,metro,,2025-09-23 16:15,"荃灣發生倫常命案，一名男子懷疑被兒子用刀殺害。

警方下午約兩時接獲一名男子報案，指自己在荃灣三棟屋村，用刀刺死年約70歲的父親。 受傷男子被送往仁濟醫院搶救，其後證實不治。"
港鐵重鐵大部份路線維持5至6分鐘一班車,2025-09-23 15:56,https://www.metroradio.com.hk/news/default.aspx?SearchText=&NewsId=20250923155643&page=0,metro,,2025-09-23 16:15,"港鐵指，鐵路及港鐵巴士服務，正逐步調整至非繁忙時段班次，其中重鐵大部份路線維持5至6分鐘一班車，輕鐵 5至18分鐘一班車，港鐵巴士5至15分鐘一班車。

港鐵指， 8號風球發出三小時後，港鐵巴士會停止服務， 至於市區預辦登機服務，調整至航班起飛前120分鐘截止， 若改發九號或以上信號，露天段列車、輕鐵及港鐵巴士服務會即時暫停。"
博茨瓦納總統:冀下月底前增持De Beers股權至50%以上,2025-09-23 15:54,https://www.metroradio.com.hk/news/default.aspx?SearchText=&NewsId=20250923155445&page=0,metro,,2025-09-23 16:15,"博茨瓦納(Botswana)總統表示，希望下月底前完成收購鑽石公司戴比爾斯(De Beers)股權，以令當地政府的持股升至五成以上。

博茨瓦納在戴比爾斯大部分鑽石的開採地，目前由博茨瓦納持有百分之15的股份，其餘百分之85由英美資源集團(Anglo American Plc)擁有，英美資源集團計劃出售其持有的戴比爾斯股份，作為重組的一部份，已收到其他潛在買家表達興趣，與博茨瓦納的交易尚未決定。 集團發言人表示，將繼續與博茨瓦納合作，作為集團在戴比爾斯的合作夥伴。

博茨瓦納總統博科(Duma Boko)表示，正與阿曼(Oman)等國的主權基金商討，尋求融資，以收購戴比爾斯股權，將持股提升至五成以上，目前已為交易做好準備，必須在10月底前完成，又指，交易事關博茨瓦納的經濟主權。

鑽石佔博茨瓦納出口額的八成，貢獻當地政府約三分之一的收入，標普本月下調博茨瓦納的長期主權信用評級，認為鑽石價格下跌可能導致當地經濟連續第二年收縮。"
柴灣一家三口墮海獲救 女子和男童昏迷送院,2025-09-23 15:49,https://www.metroradio.com.hk/news/default.aspx?SearchText=&NewsId=20250923154933&page=0,metro,,2025-09-23 16:00,"在八號信號下，柴灣嘉業街有三人墮海獲救，其中兩人昏迷送院。

警方下午近3時半接報，指柴灣工業邨對出，有一家三口懷疑因為大浪墮海，其後獲救送上岸邊，女子與男童昏迷送院治理，另一名男子清醒。"
美禁伊朗外交官員到Costco購物,2025-09-23 15:28,https://www.metroradio.com.hk/news/default.aspx?SearchText=&NewsId=20250923152820&page=0,metro,,2025-09-23 15:45,"美國禁止派駐和訪問紐約的伊朗外交官員，到大型倉儲式超市購物，或在美國購買奢移品。

美國國務院發聲明，指國務院的外交使團辦公室認定，伊朗外交官員在Costco等大型倉儲式超市購物，以及購買手表、 皮草和汽車等物品，都屬於需要美國政府批准的「福利」。 聲明說，華府藉由阻止伊朗政府官員利用到聯合國進行外交活動，獲取伊朗民眾無法得到的商品，表明美國跟伊朗人民站在一起。

據報，派駐和訪問紐約的伊朗外交官員，都喜歡到Costco等大型倉儲式超市，以相對便宜的價格，大肆採購在伊朗無法獲得的產品，並將這些產品寄回國。"
仲量聯行:本港上月寫字樓租金按月微跌0.2%年內最小,2025-09-23 15:25,https://www.metroradio.com.hk/news/default.aspx?SearchText=&NewsId=20250923152528&page=0,metro,,2025-09-23 15:45,"仲量聯行指，本港8月寫字樓租金按月微跌百分之0.2，跌幅是今年以來最小，當中，港島東跌幅最大，錄得百分之0.6，九龍東跌百分之0.3，中環微跌百分之0.1。

仲量聯行發表《香港地產市場觀察》報告，8月整體寫字樓租賃市場錄得31萬4千呎的正淨吸納量，受惠於活躍的新股市場及持續增長的財富管理需求，核心區優質寫字樓的租賃意欲明顯提升。 截至8月底，整體寫字樓空置率僅微升至百分之13.5。 中環空置率改善至百分之11.2，尖沙咀空置率降至百分之7.6，但灣仔/銅鑼灣空置率則升至百分之12.2。

住宅方面，8月一手市場成交量回落至1781宗，但仍維持高位。 二手市場成交量亦跌至3510宗。 整體交易量按月下跌百分之8.2。 中小型住宅樓價持續波動，繼7月按月回升百分之0.3後，8月下跌百分之0.5。"
