title,date,url,source,section,scrape_time,news_content
港鐵簽300億元7年期綠色銀團貸款,2025-09-23 23:41,https://www.metroradio.com.hk/news/default.aspx?SearchText=&NewsId=20250923234104&page=0,metro,,2025-09-24 00:00,"港鐵(00066)公布，獲15間國際牽頭銀行支持，簽訂一筆300億元7年期綠色定期銀團貸款，為香港企業在亞洲、中東及北非歷來規模最大的無抵押國際綠色7年期或以上年期貸款。

貸款由57間銀行共同參與，牽頭銀行於一貫銀團發行程序前，已承銷了逾580億元的貸款額，隨後的發行階段亦反應熱列，貸款最終獲超額認購超過5倍。 鑑於市場需求強勁，公司決定將貸款額由230億元提升至300億元。 除是次銀團貸款外，港鐵亦與韓國產業銀行簽訂一項7.8億元的7年期雙邊綠色循環貸款。

港鐵行政總裁金澤培表示，公司正邁進發展新階段，全力推展多個大規模鐵路項目，當中包括北環線的重大投資。 港鐵會繼續以前瞻性的財務規劃，以公司的策略發展為依歸，研究適合的融資形式，以逐步推進各個項目."
九巴 : 所有深宵及通宵路線暫停服務,2025-09-23 23:20,https://www.metroradio.com.hk/news/default.aspx?SearchText=&NewsId=20250923232014&page=0,metro,,2025-09-23 23:45,"九巴及龍運公布，大部分日間路線已暫停服務，所有深宵及通宵路線亦會暫停。

龍運路線S1及S64將維持有限度服務至尾班車時間。"
天文台 : 考慮凌晨1時至3時改發8號風球,2025-09-23 23:10,https://www.metroradio.com.hk/news/default.aspx?SearchText=&NewsId=20250923231059&page=0,metro,,2025-09-23 23:30,"天文台考慮在明日凌晨1時至3時之間改發九號烈風或暴風風力增強信號。

按照現時預測，超強颱風樺加沙會於明日早上最接近本港，在本港南面100公里左右掠過。 預料其颶風區會逐漸接近本港，本港晚間風力會進一步上升。

樺加沙環流廣闊，風勢猛烈，預料晚間天氣會急速轉壞，明日天氣持續惡劣，有頻密狂風大驟雨及雷暴。 海有極巨浪及湧浪，岸邊會出現越堤浪，東面及南面的海岸尤其顯著。 市民應遠離岸邊及停止所有水上活動。

受顯著風暴潮影響，明日本港沿岸增水可達約2米，預計水位早上約6時後開始上升，並在早上較後時間至下午初時達至最高，普遍可達海圖基準面以上約3.5米至4米，而吐露港水位更可能高達海圖基準面以上4米至5米。

在過去一小時，大老山、橫瀾島及青洲分別錄得的最高持續風速為每小時92、76及67公里，最高陣風分別超過每小時116、92及82公里。"
美國9月標普製造業PMI初值低於預期,2025-09-23 22:55,https://www.metroradio.com.hk/news/default.aspx?SearchText=&NewsId=20250923225501&page=0,metro,,2025-09-23 23:15,"標普全球公布, 美國9月製造業採購經理指數(PMI)初值52，略低於市場預期的52.2。 

 

服務業採購經理指數(PMI)初值53.9，低於市場預期的54。 

 

綜合PMI初值53.6，低於市場預期的54。 "
人行行長潘功勝會見橋水基金創辦人,2025-09-23 22:27,https://www.metroradio.com.hk/news/default.aspx?SearchText=&NewsId=20250923222721&page=0,metro,,2025-09-23 22:45,"人民銀行行長潘功勝會見來訪的橋水基金創始人瑞．達利歐。 雙方就國際經濟形勢及金融市場動態等交換了看法。

會後，達利歐就債務周期等話題與人民銀行、國家外匯管理局工作人員進行了交流。"
機場今天已完成所有計劃航班  明日少量貨運航班運作,2025-09-23 22:20,https://www.metroradio.com.hk/news/default.aspx?SearchText=&NewsId=20250923222010&page=0,metro,,2025-09-23 22:45,"機管局指，在超強颱風樺加沙吹襲期間，香港國際機場今天已完成所有已計劃航班，共處理約600班航班。 客運大樓禁區內所有乘客已登機或離開。

惡劣天氣預計將持續影響航班升降，明天全日只有少量貨運航班運作。 機管局已啟動航班重新編配機制，航空公司將根據天氣情況準備在颱風減弱後恢復航班。

機管局繼續於機場緊急應變中心緊密協調機場各單位，包括民航處、航空公司等，保持溝通，做好應變措施及充分準備，包括固定登機橋，加強機場道路及附近工地的排水及防洪措施等。"
恒指夜期高水103點,2025-09-23 21:47,https://www.metroradio.com.hk/news/default.aspx?SearchText=&NewsId=20250923214732&page=0,metro,,2025-09-23 22:00,港股恒指夜期最新報26262點，升60點，高水103點。
道指早段升近200點  納指偏軟,2025-09-23 21:46,https://www.metroradio.com.hk/news/default.aspx?SearchText=&NewsId=20250923214622&page=0,metro,,2025-09-23 22:00,"華爾街股市早段個別發展。 上日造好的Nvidia，早段回吐約百分之2。 Tesla早段靠穩。

道瓊斯工業平均指數最新報46579點，升197點，升幅百分之0.43。

標普500指數最新報6695點，升1點，升幅百分之0.03。

納斯達克指數最新報22718點，跌70點，跌幅百分之0.31。"
當局至晚上8時接5宗塌樹及1宗山泥傾瀉報告,2025-09-23 21:16,https://www.metroradio.com.hk/news/default.aspx?SearchText=&NewsId=20250923211656&page=0,metro,,2025-09-23 21:30,"八號西北烈風或暴風信號現正生效。

民政事務總署在各區共開放48個臨時庇護中心，共有599人入住。

截至晚上8時，當局收到5宗塌樹及1宗山泥傾瀉報告。

醫管局指，截至晚上近8時，2男1女在風暴期間受傷，於公立醫院急症室接受診治。"
習近平抵烏魯木齊出席新疆自治區成立70周年慶祝活動,2025-09-23 21:13,https://www.metroradio.com.hk/news/default.aspx?SearchText=&NewsId=20250923211313&page=0,metro,,2025-09-23 21:30,"中共總書記，國家主席習近平，率領中央代表團抵達烏魯木齊，出席新疆維吾爾自治區成立70周年慶祝活動，是歷來首次。

習近平又分別接見新疆自治區及有關部門，各地州市代表，新疆生產建設兵團領導班子成員，以及駐烏魯木齊部隊上校以上領導幹部。 習近平接見新疆各族各界代表時，表示希望大家凝心聚力，團結奮進，在中國式現代化進程中，更好建設美麗新疆。"
美國第二季經常帳赤字少過預期,2025-09-23 21:13,https://www.metroradio.com.hk/news/default.aspx?SearchText=&NewsId=20250923211337&page=0,metro,,2025-09-23 21:45,"美國商務部公布，第二季經常帳赤字由上一季度的4398億美元，收窄至2,513億美元，為2023年以來最低，預期為赤字2,568億美元。

其中，商品和服務逆差收窄至1904億美元，上一季度為3855億美元；商品貿易逆差收窄至2700億美元，上一季度為4658億美元；服務貿易順差收窄至796億美元，上一季度為803億美元。"
華倫致函貝森特 稱對阿根廷的經濟支持承諾令人不安,2025-09-23 20:56,https://www.metroradio.com.hk/news/default.aspx?SearchText=&NewsId=20250923205624&page=0,metro,,2025-09-23 21:15,"美國民主黨籍參議員華倫(Elizabeth Warren)致函財長貝森特(Scott Bessent)，嚴重擔憂對美國承諾向阿根廷提供經濟支持是政治承諾，可能會為美國民眾帶來損失。

她表示，總統特朗普與阿根廷總統米萊(Javier Milei)的私人關係，以及貝森特宣布該消息的時機，令她感到擔憂；指責貝森特未能提供任何經濟依據，來解釋阿根廷比索，及其金融市場的進展，為何對美國經濟構成威脅。

貝森特上日在社交平台上發文表示，美國財政部已準備好在其職權範圍內，採取必要措施支持阿根廷，所有穩定局勢的選項都在考慮範圍內。

他指出，選項可能包括但不限於貨幣互換安排、 直接購匯，以及通過財政部的外匯穩定基金，購買以美元計價的政府債券。"
澳洲關鍵礦企看好美國市場 推進在美建廠計劃,2025-09-23 20:34,https://www.metroradio.com.hk/news/default.aspx?SearchText=&NewsId=20250923203408&page=0,metro,,2025-09-23 20:45,"隨著美國特朗普政府擴大關鍵礦產布局，以降低對華依賴，多家澳洲先進的關鍵礦產公司，正在推進在美國建立加工設施的計劃，即便澳洲政府正力推本土產業發展，但美國龐大的市場規模與政策激勵仍具強大吸引力。

一個由澳洲關鍵礦企組成的代表團，上周到華盛頓與紐約訪問，會晤美國政府高層及投資者，推進在美投資計劃。 其中，多家在澳交所上市的企業，正積極評估在美國設立加工或下游處理設施，以擴大營運與供應鏈布局。

業界人士指出，美國快速增長的電動車、 國防與先進製造產業帶來龐大需求，加上低廉的能源成本及巨額補貼，成為這些澳企在美擴充業務的主要驅動力。

其中，澳洲戰略材料公司法務總監伊姆斯(Annaliese Eames)透露，他們已確定六個州作為重點考察地，其中包括奧克拉荷馬州和南卡羅來納州，並強調美國不僅提供強有力的聯邦及州級支持，更展現了培育完整產業生態的決心。

離子稀土公司董事總經理哈里遜(Tim Harrison）表示，公司計劃在美國多州，複製其於北愛爾蘭開發的磁體回收技術，目前已與田納西州展開深入洽談。 他指出，部分州提供低廉電價和勞動力成本，並獲得政府巨額資金支持，吸引力極強。

同時，國際石墨公司行政總裁沃蘭德(Andrew Worland)則強調，企業除在西澳建設加工廠外，也計劃在美國及歐洲設廠，以更貼近客戶需求。"
荃灣39歲男子疑用刀刺死七旬父 涉謀殺被捕,2025-09-23 20:23,https://www.metroradio.com.hk/news/default.aspx?SearchText=&NewsId=20250923202319&page=0,metro,,2025-09-23 20:45,"荃灣發生倫常命案，1名70歲男子懷疑被兒子用刀殺害，39歲兒子涉嫌謀殺被捕。

下午近2時，警方接獲1名男子報案，指自己在荃灣三棟屋村一個村屋單位，殺死自己的父親。 警方到場，發現該名70歲男子倒臥於單位內，頭、頸、身體受傷，送往仁濟醫院後證實死亡。 警方在單位內，檢獲1把20厘米長生果刀，懷疑與案件有關。

警方稍後安排驗屍，以確定死者死因。"
關稅拖累經濟 經合組織料美國明年GDP為1.5%,2025-09-23 20:21,https://www.metroradio.com.hk/news/default.aspx?SearchText=&NewsId=20250923202113&page=0,metro,,2025-09-23 20:45,"經濟合作與發展組織(OECD)預測，2026年美國經濟增速將為百分之1.5。

經合組織在最新發布的《經濟展望中期報告》中，上調了2025年美國經濟增長預期，原因是人工智能熱潮帶動相關領域投資增加；但同時指出，關稅政策與凈移民人數減少，正對美國經濟造成壓力，並將導致其明年增速放緩。

經合組織表示，在實施對等關稅後，截至8月底，美國整體有效關稅率已升至百分之19.5左右，是1933年以來的最高水平。 此外，經合組織還提到美國勞動力市場正呈現疲弱態勢。

經合組織表示，預計2025年美國實際GDP為百分之1.8，高於6月份預測的百分之1.6；但這一數值仍遠低於2024年百分之2.8的實際GDP增速。 該組織還預測，2026年美國GDP僅將增長百分之1.5。"
徐直軍：華為將全力支持東風汽車轉型發展,2025-09-23 20:12,https://www.metroradio.com.hk/news/default.aspx?SearchText=&NewsId=20250923201203&page=0,metro,,2025-09-23 20:45,"東風汽車董事長楊青昨日到深圳，與華為創始人任正非，及華為徐直軍會談，雙方圍繞強化戰略互信、 深化戰略合作、 推進企業治理與運營機制創新等議題，進行了深入交流。

會談中，雙方回顧了東風汽車與華為多年來深化合作的歷程，並就行業競爭態勢、 企業機制創新等議題交換意見。

楊青表示，東風汽車正積極推動新能源、智能化躍遷，將與華為持續深化戰略協同，共同面對產業變革與市場挑戰。

任正非表示，汽車行業的根本是要把車造好，車的最高級別就是安全。

雙方並重點就持續推進全面戰略合作、企業管理、 人才培養等議題進行深入探討，共同探索產業升級新路徑。 徐直軍表示，華為將全力支持東風汽車轉型發展。"
商經局籲市民提防偽冒商經局局長訪談詐騙內容,2025-09-23 20:09,https://www.metroradio.com.hk/news/default.aspx?SearchText=&NewsId=20250923200959&page=0,metro,,2025-09-23 20:45,"商務及經濟發展局呼籲市民提高警覺，提防網上偽冒商經局局長，在訪談介紹高回報投資平台的詐騙廣告。

商經局發言人嚴正澄清，有關所謂訪談和內容全屬虛構，事件已轉交警方跟進調查，並提醒市民，切勿透過有關網頁，登入任何可疑交易平台或提供個人資料。"
平治中國與字節跳動升級戰略合作,2025-09-23 19:53,https://www.metroradio.com.hk/news/default.aspx?SearchText=&NewsId=20250923195355&page=0,metro,,2025-09-23 20:15,"梅賽德斯-奔馳(中國)投資與北京字跳網絡技術宣佈簽署升級戰略合作備忘錄，共同推動人工智能技術的跨業務融合。

此次戰略合作覆蓋從智能輔助駕駛、智能座艙、 智能化研發、數字化營銷到客户運營的各個業務領域。

此次簽約是2023年攜手火山引擎後，梅賽德斯-奔馳同字節跳動合作的戰略升級，搭載豆包大模型的首款奔馳車型--全新純電CLA即將於今秋上市。"
人行行長潘功勝會見橋水基金創始人達利歐,2025-09-23 19:50,https://www.metroradio.com.hk/news/default.aspx?SearchText=&NewsId=20250923195050&page=0,metro,,2025-09-23 20:15,"中國人民銀行行長潘功勝會見來訪的橋水基金創始人達利歐(Raymond Dalio)。 雙方就國際經濟形勢及金融市場動態等交換了看法。

會後，達利歐就債務周期等話題與中國人民銀行、 國家外匯管理局工作人員進行了交流。"
特朗普將晤民主黨領袖 討論政府停擺危機,2025-09-23 19:48,https://www.metroradio.com.hk/news/default.aspx?SearchText=&NewsId=20250923194829&page=0,metro,,2025-09-23 20:00,"美國總統特朗普(Donald Trump)將於周四，與國會民主黨領袖會晤，討論新一輪聯邦資金法案，以避免聯邦政府在10月1日再次陷入停擺危機。

美媒引述匿名消息人士透露，特朗普已同意會見參議院民主黨領袖舒默(Chuck Schumer)，和眾議院民主黨領袖傑弗里斯(Hakeem Jeffries)。 民主黨人堅持要進行談判。 現時未知參議院共和黨領袖圖恩(John Thune)，及眾議院議長強生(Mike Johnson)會否出席。

國會談判的核心爭議在於醫療支出。 民主黨希望藉此機會，延長將於年底到期的《平價醫療法案》(又稱奧巴馬醫保)補貼，並要求恢復之前被削減的醫療補助資金。  共和黨則強調控制財政赤字，反對在維持政府基本運作的臨時撥款中，夾帶大規模醫療支出條款，雙方分歧難以彌合。

參議院上周五否決了一項，由共和黨主導的短期撥款法案，該案原計劃延長政府運作至11月21日，維持現有經費並額外增加8800萬美元國會安保資金。"
應急管理部等向廣東調撥6萬件中央救災物資,2025-09-23 19:47,https://www.metroradio.com.hk/news/default.aspx?SearchText=&NewsId=20250923194703&page=0,metro,,2025-09-23 20:00,"國家防汛抗旱總指揮部，將針對廣東、海南的防汛防颱風應急響應，提升至三級，應急管理部等向廣東省，緊急調撥6萬件中央救災物資，包括帳篷，折疊床，夏涼被，應急照明燈，家庭應急包等，支持當地妥善做好，受災群眾避險轉移安置和救災救助工作。

應急管理部指，預計超強颱風樺加沙明日中午到晚上，在廣東珠海到湛江一帶沿海登陸，明日和後日，廣東沿海和南海北部，部分海域風力10至13級，陣風14至15級，廣東中東部，福建南部，浙江東南部等地，部分地區有大暴雨，前期派出的國家防總聯合工作組，正在廣東江門一線，協助指導防汛防颱風工作。"
樺加沙襲港 至下午5時當局接4宗塌樹及1宗山泥傾瀉報告,2025-09-23 19:21,https://www.metroradio.com.hk/news/default.aspx?SearchText=&NewsId=20250923192141&page=0,metro,,2025-09-23 19:45,"八號西北烈風或暴風信號現正生效。

民政事務總署在各區共開放48個臨時庇護中心，共有422人入住。

截至下午5時，當局收到4宗塌樹及1宗山泥傾瀉報告。

醫管局指，截至下午近5時，2男1女在風暴期間受傷，於公立醫院急症室接受診治。"
歐洲網約車平台Bolt進軍台灣 作為東亞市場首站,2025-09-23 19:17,https://www.metroradio.com.hk/news/default.aspx?SearchText=&NewsId=20250923191755&page=0,metro,,2025-09-23 19:30,"歐洲網約車平台Bolt宣佈進軍台灣市場，作為進軍東亞市場的首站。

Bolt台灣區總經理曾憲竑表示，進入台灣，代表Bolt在全球最具活力，與前瞻性的東亞市場邁出大膽的一步，Bolt不僅是一個叫車應用程式，而是結合全球視野與實戰成果，致力於優化交通生態系，同時為駕駛與乘客創造更高價值。 雖然Bolt帶來遍及歐洲、非洲與亞洲的國際最佳經驗，但仍致力於深度本土化。

Bolt已於全球50多個國家、 超過600個城市營運，憑藉其全球專業經驗與科技驅動的解決方案，為台灣市場帶來全新且具競爭力的選擇，也為過去由少數平台主導、 選擇相對有限的駕駛與乘客，提供更多元的方案。"
8號信號下一家3口柴灣觀浪墮海 母子昏迷送院,2025-09-23 19:16,https://www.metroradio.com.hk/news/default.aspx?SearchText=&NewsId=20250923191629&page=0,metro,,2025-09-23 19:30,"八號信號下，柴灣下午有一家3口墮海，其中2人昏迷送院。

警方下午近3時半接報，指3人於嘉業街柴灣工業邨對開海面遇溺，消防接報5分鐘後到場。 當時一艘舢舨將38歲母親及5歲兒子救起，父親就在海面等待救援，墮海母子目前正在東區醫院深切治療部留醫。 警方指初步了解，3人到防坡堤觀浪，其間一對母子被大浪捲落海，父親落海救人。

警方呼籲市民，不要到危險位置追風逐浪，如有市民不聽從警方指示，逗留在危險地方，警方會採取行動。

天文台前台長林超英在社交平台指，湧浪來得很隱秘，而且殺傷力遠超想像，市民觀浪期間隨時走不及，呼籲市民萬勿心存僥倖。"
經合組織：美國關稅衝擊的全面影響尚未顯現,2025-09-23 19:10,https://www.metroradio.com.hk/news/default.aspx?SearchText=&NewsId=20250923191010&page=0,metro,,2025-09-23 20:15,"經濟合作與發展組織(OECD)表示，全球經濟增長勢頭好於預期，但美國進口關稅沖擊的全面影響尚未完全顯現。 目前，人工智能(AI)領域投資支撐著美國經濟活動，財政支持也在緩沖經濟放緩的壓力。

在最新發布的《經濟展望中期報告》中，經合組織指出，美國徵收關稅的全面影響仍在逐步釋放，目前企業主要通過壓縮利潤空間，和消耗庫存緩沖來吸收大部分衝擊。

為應對特朗普政府徵收關稅的政策，許多企業提前囤積商品。 截至8月底，美國商品進口的有效稅率估計已升至百分之19.5，為1933年大蕭條最嚴重時期以來的最高水平。

當前預計，2025年全球經濟增速僅將從去年的百分之3.3 小幅放緩至百分之3.2，這一預期高於經合組織6月時預測的百分之2.9%。

不過，組織仍將2026年全球經濟增長預期維持在百分之2.9。 報告指出，企業囤貨對經濟的提振作用已在減弱，且徵收關稅預計將對投資和貿易增長構成壓力。"
經合組織：美國關稅沖擊的全面影響尚未顯現,2025-09-23 19:10,https://www.metroradio.com.hk/news/default.aspx?SearchText=&NewsId=20250923191010&page=0,metro,,2025-09-23 19:30,"經濟合作與發展組織(OECD)表示，全球經濟增長勢頭好於預期，但美國進口關稅沖擊的全面影響尚未完全顯現。 目前，人工智能(AI)領域投資支撐著美國經濟活動，財政支持也在緩沖經濟放緩的壓力。

在最新發布的《經濟展望中期報告》中，經合組織指出，美國徵收關稅的全面影響仍在逐步釋放，目前企業主要通過壓縮利潤空間，和消耗庫存緩沖來吸收大部分衝擊。

為應對特朗普政府徵收關稅的政策，許多企業提前囤積商品。 截至8月底，美國商品進口的有效稅率估計已升至百分之19.5，為1933年大蕭條最嚴重時期以來的最高水平。

當前預計，2025年全球經濟增速僅將從去年的百分之3.3 小幅放緩至百分之3.2，這一預期高於經合組織6月時預測的百分之2.9%。

不過，組織仍將2026年全球經濟增長預期維持在百分之2.9。 報告指出，企業囤貨對經濟的提振作用已在減弱，且徵收關稅預計將對投資和貿易增長構成壓力。"
港鐵重鐵維持10至20分鐘班車 巴士絕大部份已停駛,2025-09-23 18:20,https://www.metroradio.com.hk/news/default.aspx?SearchText=&NewsId=20250923182038&page=0,metro,,2025-09-23 18:45,"港鐵現時維持有限度服務，重鐵各路線維持10至20分鐘一班車，輕鐵 614綫及615綫服務暫停 ，其餘路綫15至20分鐘一班車，港鐵巴士已暫停服務。

港鐵指， 市區預辦登機服務，調整至航班起飛前120分鐘截止， 若改發九號或以上信號，露天段列車和輕鐵會即時暫停。

九巴及龍運大部分日間路線現已暫停服務，九巴路線B1、B9，龍運路線S1、S64系列，正維持有限度服務。

城巴日間路線已陸續有序暫停服務，B3X、粉嶺站來往香園圍口岸的B7，以及S1號線維持有限度服務。"
政府接獲4宗塌樹及一宗山泥傾瀉報告,2025-09-23 17:56,https://www.metroradio.com.hk/news/default.aspx?SearchText=&NewsId=20250923175641&page=0,metro,,2025-09-23 18:15,"在八號信號下，截至下午五時，政府接獲四宗塌樹報告，土木工程拓展署收到一宗山泥傾瀉報告，當局暫時沒有收到水浸報告

醫管局表示，截至下午4時50分，兩男一女在風暴期間受傷，在公立醫院急症室接受診治

民政事務總署在各區共開放47個臨時庇護中心，共有422人入住。"
中國—東盟成員國總檢察長會議在港舉行,2025-09-23 17:50,https://www.metroradio.com.hk/news/default.aspx?SearchText=&NewsId=20250923175038&page=0,metro,,2025-09-23 18:15,"第十五屆中國—東盟成員國總檢察長會議在香港舉行，中國與東盟成員國的總檢察長及檢察機關代表，共約80人來港出席會議。

中國首席大檢察官、 最高人民檢察院檢察長應勇致辭時指，中國—東盟全面戰略夥伴關係發展勢頭良好，雙方戰略互信持續增強，總檢察長會議在促進中國與東盟各國的和平、 安全、 繁榮和可持續發展中，發揮重要作用。

行政長官李家超感謝中央舉辦並支持香港特區承辦會議。 他指，香港作為一國兩制下，唯一實行普通法的雙語司法管轄區，致力維護法治，具備充分條件成為亞太區國際法律及爭議解決服務中心，而會議亦正好加強國家和東盟各國合作，打擊跨境犯罪活動。

律政司司長林定國就指，香港與各東盟成員國一直保持緊密的法律合作，並會加強合作打擊跨境犯罪，應對地區經濟和社會形勢的最新發展。"
市監總局約談貨拉拉 要求嚴格遵守反壟斷法,2025-09-23 17:42,https://www.metroradio.com.hk/news/default.aspx?SearchText=&NewsId=20250923174242&page=0,metro,,2025-09-23 18:00,"貨運服務平台貨拉拉涉違反壟斷法，遭國家市場監管總局約談。

市監總局官方微信公眾號公布，近日約談貨拉拉，要求貨拉拉嚴格遵守《中華人民共和國反壟斷法》等法律規定，落實反壟斷合規主體責任，及時規範經營行為，公平參與市場競爭，維護貨車司機、 消費者等相關主體合法權益，推動平台規則和算法公平公正、 公開透明，促進行業規範健康發展。

貨拉拉官網信息顯示，貨拉拉是一家拉貨搬家跑腿發長途信息服務平台，創立於2013年，是從事同城/跨城貨運、 企業版物流服務、搬家、零擔、 跑腿、冷運、汽車租售及車後市場服務的互聯網物流商城。

截至2025年4月，貨拉拉業務範圍覆蓋全球14個市場，其中在內地共覆蓋363座城市，月活躍司機達120萬，月活躍用戶1400萬。"
林超英指湧浪殺傷力遠超想像 籲市民勿心存僥倖,2025-09-23 17:40,https://www.metroradio.com.hk/news/default.aspx?SearchText=&NewsId=20250923174040&page=0,metro,,2025-09-23 18:00,"在八號信號下，柴灣嘉業街有三人墮海獲救，其中兩人昏迷送院。

警方下午近3時半接報，指柴灣工業邨對出，有一家三口懷疑因為大浪墮海，其後獲救送上岸邊，女子與男童昏迷送院治理，另一名男子清醒。

天文台前台長林超英在社交平台指，湧浪來得很隱秘，而且殺傷力遠超想像，市民觀浪期間隨時走不及，呼籲市民萬勿心存僥倖。"
