title,date,url,source,section,scrape_time,news_content
特朗普:烏克蘭邊界有望「恢復原狀」至俄烏戰事前,2025-09-24 06:58,https://www.metroradio.com.hk/news/default.aspx?SearchText=&NewsId=20250924065807&page=0,metro,,2025-09-24 07:15,"美國總統特朗普(Donald Trump)表示，烏克蘭在歐盟及北約支持下，有望贏回全部烏克蘭，並恢復原狀。

特朗普在旗下社交平台發文指，他了解烏克蘭和俄羅斯的軍事、經濟狀況，認為持續超過三年半的戰事給俄羅斯製造經濟困境，在歐盟財政支持，特別是北約軍事支持下，加上時間和耐心，回到戰爭開始時的原有邊界是一個完全可行的選擇，認為俄烏戰爭讓俄羅斯看起來似一隻「紙老虎」。

特朗普表示，普京及俄羅斯正面臨巨大經濟困境，現時是烏克蘭採取行動的時候，同時表示美國將繼續為北約盟國提供武器。"
截至6時共收90宗塌樹及1宗山泥傾瀉報告,2025-09-24 06:53,https://www.metroradio.com.hk/news/default.aspx?SearchText=&NewsId=20250924065336&page=0,metro,,2025-09-24 07:15,"十號颶風信號現正生效，截至清晨6時，民政事務總署在各區共開放49個臨時庇護中心，共有728人入住。

政府1823電話中心以及消防處，合共收到90宗塌樹報告，土木工程拓展署收到1宗山泥傾瀉報告，政府暫時無收到水浸報告。

醫院管理局表示，截至清晨6時，有五男三女市民在風暴期間受傷，於公立醫院急症室接受診治。"
公立醫院今日全日暫停所有非緊急服務,2025-09-24 06:50,https://www.metroradio.com.hk/news/default.aspx?SearchText=&NewsId=20250924065022&page=0,metro,,2025-09-24 07:15,"醫管局發言人宣布，公立醫院今日全日暫停所有非緊急服務，包括普通科門診、專科門診、專職醫療門診(例如物理治療及職業治療)、老人科及精神科日間醫院、各類日間服務、非緊急化驗及診斷服務。

發言人說，非緊急病人不應在風暴期間前往公立醫院或診所，以免發生危險。 公立醫院在八號熱帶氣旋警告信號取消後，會盡快恢復所有受影響的非緊急服務，並會在未來一星期陸續通知受影響的病人，盡快為病人另約診症日期。

公立醫院的緊急服務，包括急症室、住院及緊急手術服務等會維持正常。"
港股ADR個別發展  百度ADR較港股低近5%,2025-09-24 06:46,https://www.metroradio.com.hk/news/default.aspx?SearchText=&NewsId=20250924064648&page=0,metro,,2025-09-24 07:00,"港股ADR個別發展，熱門科技股中，百度(09888)ADR折合收報122.06港元，較港股上日收市低約百分之5。 網易(09999)ADR折合收報237.86港元，較港股上日收市高百分之0.3。

藍籌股中，滙控(00005)ADR折合收報109.18港元，較港股上日收市高百分之0.5。 港交所(00388)ADR折合收報437.96港元，較港股上日收市高百分之0.1。 友邦(01299)ADR折合收報70.94港元，較港股上日收市高百分之0.05。"
中國強調必須高度重視並加快解決巴勒斯坦問題,2025-09-24 06:22,https://www.metroradio.com.hk/news/default.aspx?SearchText=&NewsId=20250924062213&page=0,metro,,2025-09-24 06:45,"中國常駐聯合國副代表耿爽，在安理會巴勒斯坦問題高級別會議上發言，強調必須高度重視並加快解決巴勒斯坦問題。

耿爽說，巴勒斯坦問題是中東問題的核心，關乎中東和平穩定、國際和平與安全。 中東動蕩加劇，全球安全環境惡化，衝擊世界經濟發展前景，並不符合國際社會共同利益，因此必須高度重視並加快解決巴勒斯坦問題。

耿爽指，近年的衝突令加沙生靈塗炭、滿目瘡痍。 中方敦促以色列立即停止在加沙的軍事行動，履行佔領方的國際人道義務，全面恢復人道物資准入。

中方呼籲各方切實尊重中東國家的主權、安全和領土完整，呼籲以色列切實尊重中東人民的生存權、發展權，呼籲中東各國秉持共同安全理念，共建公平正義的地區秩序，共創和平發展的地區未來。"
所有學校今日停課,2025-09-24 06:20,https://www.metroradio.com.hk/news/default.aspx?SearchText=&NewsId=20250924062020&page=0,metro,,2025-09-24 06:45,"十號颶風信號現正生效，教育局宣布，所有學校今日停課。

社會福利署宣布，所有轄下福利服務單位、提供幼兒中心、長者服務中心、日間學前康復服務單位及日間康復服務單位將不會開放，當八號熱帶氣旋警告信號取消後，在天氣和情況許可下，各中心及單位將會在兩個小時內恢復正常服務。"
城巴所有日間路線暫停,2025-09-24 06:12,https://www.metroradio.com.hk/news/default.aspx?SearchText=&NewsId=20250924061246&page=0,metro,,2025-09-24 06:45,十號颶風信號現正生效，城巴今日所有日間路線暫停服務，直至另行通知。
截至5時共收55宗塌樹及1宗山泥傾瀉報告,2025-09-24 06:11,https://www.metroradio.com.hk/news/default.aspx?SearchText=&NewsId=20250924061130&page=0,metro,,2025-09-24 06:45,"十號颶風信號現正生效，截至凌晨5時，民政事務總署在各區共開放49個臨時庇護中心，共有727人入住。

政府1823電話中心以及消防處，合共收到55宗塌樹報告，土木工程拓展署收到1宗山泥傾瀉報告，政府暫時無收到水浸報告。

醫院管理局表示，截至凌晨5時，有四男兩女市民在風暴期間受傷，於公立醫院急症室接受診治。"
醫管局 : 6名市民在風暴期間受傷,2025-09-24 06:08,https://www.metroradio.com.hk/news/default.aspx?SearchText=&NewsId=20250924060850&page=0,metro,,2025-09-24 06:15,"天文台凌晨發出的十號颶風信號仍然生效。

截至凌晨5時，民政事務總署在各區開放49個臨時庇護中心，共有727人入住。

至於塌樹報告，政府1823電話中心收到9宗，而消防處收到46宗。

土木工程拓展署收到一宗山泥傾瀉報告。 政府暫時沒有收到水浸報告。

醫院管理局表示，6名市民(4男兩女)在風暴期間受傷，於公立醫院急症室接受診治。"
天文台發出新界北部水浸特別報告,2025-09-24 05:57,https://www.metroradio.com.hk/news/default.aspx?SearchText=&NewsId=20250924055756&page=0,metro,,2025-09-24 06:15,"天文台在上午5時35分，發出新界北部水浸特別報告。

新界北部，尤其是八鄉及錦田一帶，正受大雨影響，在過去4小時，該區錄得超過100毫米雨量，大雨可能引致山洪暴發，市民應遠離河道。"
港鐵自頭班車起隧道段提供有限度服務,2025-09-24 05:42,https://www.metroradio.com.hk/news/default.aspx?SearchText=&NewsId=20250924054203&page=0,metro,,2025-09-24 06:00,"十號颶風信號現正生效，由頭班車起，港鐵露天段的列車服務暫停，露天段的車站會暫時關閉，隧道段會提供有限度服務，輕鐵及港鐵巴士服務暫停。

由頭班車起，港鐵  荃灣綫 中環站至荔景站、  觀塘綫 黃埔站至彩虹站、港島綫 堅尼地城站至杏花邨站、南港島綫 海怡半島站至利東站、 將軍澳綫 北角站至寶琳站、東鐵綫金鐘站至紅磡站，以及屯馬線尖東站至荃灣西站，15分鐘一班車，屯馬綫鑽石山站至何文田站，以及將軍澳綫調景嶺站至康城站18及20分鐘一班車。

另外，港鐵收到內地鐵路單位通知，今天所有來往香港西九龍站及内地站點的高鐵列車班次取消，而明天亦有部分班次取消或有所更改，會繼續與內地鐵路單位協調相應列車服務安排。"
澳門改發10號風球,2025-09-24 05:35,https://www.metroradio.com.hk/news/default.aspx?SearchText=&NewsId=20250924053547&page=0,metro,,2025-09-24 05:45,"澳門清晨5時30分改發10號風球，預料將維持一段時間。

超強颱風樺加沙持續向西北偏西方向移動，穩定靠近珠江口一帶，預計會於澳門100公里內掠過。 受樺加沙的核心環流影響，會有狂風暴雨及雷暴，未來數小時，澳門風力會顯著增強，屆時風力有機會達12級颶風或以上，而且最大風力持續時間較長。

預料今天早上將出現顯著的風暴增水，並且與天文潮高潮位重疊，早上6時水位開始上升，預料低窪地區最高水浸高度達1.5至2.5米，如樺加沙正面吹襲澳門，不排除發出黑色風暴潮警告的可能性，樺加沙將會對澳門造成顯著的影響，帶來與「天鴿」、「山竹」相若的嚴重威脅。"
10號颶風信號現正生效 本港多處吹颶風或暴風,2025-09-24 05:33,https://www.metroradio.com.hk/news/default.aspx?SearchText=&NewsId=20250924053312&page=0,metro,,2025-09-24 05:45,"十號颶風信號現正生效。

在上午5時，超強颱風樺加沙集結在香港以南約120公里，預料向西或西北偏西移動，時速約22公里，靠近珠江口至廣東西部沿岸一帶。

在尖沙咀疏士巴利道，風雨交加，在中間道，有正進行裝修的商舖有木板被強風吹倒，消防正在現場處理。

樺加沙環流廣闊，風勢猛烈，會在未來數小時最接近本港，在本港南面100公里左右掠過，對本港構成嚴重威脅，現時本港南部及高地正吹颶風，隨著樺加沙進一步逼近，颶風區會影響本港更多地區，市民需保持高度警覺並留意破壞性的風力，十號颶風信號會維持一段時間。

在過去一小時，橫瀾島、青洲及大老山分別錄得的最高持續風速為每小時136、134及132公里，最高陣風分別超過每小時166、182及180公里。"
波音與Palantir合作  加速國防AI應用,2025-09-24 05:13,https://www.metroradio.com.hk/news/default.aspx?SearchText=&NewsId=20250924051349&page=0,metro,,2025-09-24 05:30,"波音及Palantir宣布，正就波音國防、航天與安全(BDS)項目中的人工智能(AI)系統進行整合。 波音的國防、航天與安全部門，經營超過十條主要生產線，用於生產軍用飛機、直升機、衛星、航天器、導彈和武器。 雙方的合作將有助分散各處的工廠，實現數據分析標準化。

波音亦會運用Palantir的人工智能專業知識和能力，重點支持軍事客戶最敏感的任務。"
華爾街股市下跌  標指結束三連升,2025-09-24 04:41,https://www.metroradio.com.hk/news/default.aspx?SearchText=&NewsId=20250924044140&page=0,metro,,2025-09-24 05:00,"華爾街股市下跌，標普500指數連升三日後回吐，市場憂慮人工智能相關熱潮能否持續，Nvidia回吐近百分之3，甲骨文跌百分之4，亞馬遜跌百分之3。

道瓊斯工業平均指數收報46292點，跌88點，跌幅百分之0.19。

標普500指數收報6656點，跌36點，跌幅百分之0.55。

納斯達克指數收報22573點，跌215點，跌幅百分之0.95。"
現貨金再創新高  期金升1%,2025-09-24 04:21,https://www.metroradio.com.hk/news/default.aspx?SearchText=&NewsId=20250924042124&page=0,metro,,2025-09-24 04:45,"金價再創新高。 市場對美國聯儲局的減息預期，繼續支持金價表現。

紐約期金收市報每安士3815.7美元，升百分之1。

現貨金高見每安士3791.1美元，再創新高，現報每安士3763.94美元，升17.02美元，升幅百分之0.45。"
澳門改發9號風球  5時30分掛10號,2025-09-24 04:12,https://www.metroradio.com.hk/news/default.aspx?SearchText=&NewsId=20250924041254&page=0,metro,,2025-09-24 04:30,"澳門4時改發9號風球，預料5時30分改發10號。

澳門氣象局指，超強颱風樺加沙持續向西北偏西方向移動，穩定靠近珠江口一帶，預計會於澳門100公里內掠過。 受樺加沙核心環流影響，會有狂風暴雨及雷暴，未來數小時澳門風力會顯著增強，屆時澳門風力有機會達12級颶風或以上，而且最大風力持續時間較長。

預料今天早上將出現顯著的風暴增水，並且與天文潮高潮位重疊，預測早上6時水位開始上升，預料低窪地區最高水浸高度達1.5至2.5米，如樺加沙正面吹襲澳門，不排除發出黑色風暴潮警告的可能性。

預料超強颱風樺加沙將會對澳門造成顯著的影響，帶來與「天鴿」、「山竹」相若的嚴重威脅。"
加拿大央行行長 : 特朗普嘗試影響聯儲局  令人質疑其獨立性,2025-09-24 03:56,https://www.metroradio.com.hk/news/default.aspx?SearchText=&NewsId=20250924035600&page=0,metro,,2025-09-24 04:15,"加拿大央行行長麥克勒姆表示，美國總統特朗普試圖影響美國聯儲局決策，引起外界質疑美國貨幣政策的獨立性，削弱美元的避險吸引力。

麥克勒姆又指，部分由關稅引起的全球不確定性，突顯加拿大有必要提升生產力、開拓新的海外市場，問題是，隨著美國在貿易方面更偏向保護主義，並出現大規模財政赤字，美國在全球金融流動中的主導地位是否會減弱。

他指出，自特朗普今年4月發起關稅攻勢以來，美元已下跌近一成，令美元的避險作用受到質疑。 在可見將來，美元仍然是全球儲備貨幣，但美元作為對沖工具的價值已被削弱。"
恒指夜期收報26188點  高水29點,2025-09-24 03:47,https://www.metroradio.com.hk/news/default.aspx?SearchText=&NewsId=20250924034725&page=0,metro,,2025-09-24 04:00,恒指夜期收報26188點，跌14點，高水29點。
油價升逾1%,2025-09-24 03:46,https://www.metroradio.com.hk/news/default.aspx?SearchText=&NewsId=20250924034601&page=0,metro,,2025-09-24 04:00,"油價上升，伊拉克庫爾德地區恢復石油出口的磋商受阻，緩和部分投資者對全球供應過剩的憂慮。

倫敦    布蘭特期油收報每桶67.63美元，升1.06美元，升幅百分之1.6。

紐約期油收報每桶63.41美元，升1.13美元，升幅百分之1.8。"
天文台發出黃色暴雨警告信號,2025-09-24 02:52,https://www.metroradio.com.hk/news/default.aspx?SearchText=&NewsId=20250924025239&page=0,metro,,2025-09-24 03:15,"天文台在上午2時45分發出黃色暴雨警告信號。

暴雨警告信號現時為黃色，表示香港廣泛地區已錄得或預料會有每小時雨量超過30毫米的大雨，且雨勢可能持續。

一些低窪地帶及排水欠佳的地區會出現水淹，可能受大雨及水浸影響之市民應採取適當的預防措施。"
醫管局 : 5名市民風暴期間受傷,2025-09-24 02:46,https://www.metroradio.com.hk/news/default.aspx?SearchText=&NewsId=20250924024604&page=0,metro,,2025-09-24 03:00,"天文台改發10號颶風信號，截至凌晨2時，民政事務總署在各區共開放49個臨時庇護中心，共有718人入住。

至於塌樹報告，截至凌晨2時，政府1823電話中心收到5宗，而消防處收到10宗。 土木工程拓展署收到1宗山泥傾瀉報告。 政府暫時沒有收到水浸報告。

醫院管理局表示，截至凌晨2時，5名市民(3男兩女)在風暴期間受傷，於公立醫院急症室接受診治。

 

渠務署呼籲市民，若發現街道水浸，盡快致電24小時渠務熱線報告，電話為23001110。"
10號颶風信號已發出  市民切勿外出,2025-09-24 02:42,https://www.metroradio.com.hk/news/default.aspx?SearchText=&NewsId=20250924024253&page=0,metro,,2025-09-24 03:00,十號颶風信號在上午2時40分發出。 天文台預料本港平均風速每小時118公里或以上，市民現時切勿外出，遠離當風的門窗，在安全的地方躲避，同時留意風向轉變。
澳門4時改發9號風球,2025-09-24 02:38,https://www.metroradio.com.hk/news/default.aspx?SearchText=&NewsId=20250924023804&page=0,metro,,2025-09-24 02:45,"澳門凌晨4時改發九號風球，清晨5時至7時改發十號風球機會為高。

澳門氣象局指，超強颱風樺加沙持續向西北偏西方向移動，穩定靠近珠江口一帶，預計會於澳門100公里內掠過。 受樺加沙的核心環流影響，會有狂風暴雨及雷暴，未來數小時風力會顯著增強，屆時澳門風力有機會達12級颶風或以上，且最大風力持續時間較長。"
據報OpenAI與甲骨文將於美國得州擴建數據中心,2025-09-24 02:32,https://www.metroradio.com.hk/news/default.aspx?SearchText=&NewsId=20250924023208&page=0,metro,,2025-09-24 02:45,"美國科技媒體《The Information》引述消息指，ChatGPT開發商OpenAI與甲骨文，將會宣布擴張他們在美國得州的數據中心。 甲骨文正在當地營運數據中心，預期OpenAI在未來十年，將投資幾千億美元租賃數據中心的服務器。

早前OpenAI與Nvidia簽署合作意向，由Nvidia向OpenAI投資1000億美元，協助開發數據中心。"
哈梅內伊 : 伊朗與美國談判並無好處,2025-09-24 02:25,https://www.metroradio.com.hk/news/default.aspx?SearchText=&NewsId=20250924022516&page=0,metro,,2025-09-24 02:45,"伊朗最高領袖哈梅內伊發表電視講話，他指，在當前形勢下，與美國政府談判對伊朗沒有任何好處，亦無法為伊朗化解任何傷害。

哈梅內伊指，談判會帶來無法彌補的損失，美國方面聲稱將進行談判，但結果是要求伊朗關閉核工業並停止鈾濃縮，這並非談判。 美國方面聲稱伊朗不應該擁有導彈，意味伊朗受到攻擊時，將無法反擊。

哈梅內伊重申，伊朗沒有亦不打算使用核武器。"
各區開放49個臨時庇護中心,2025-09-24 02:12,https://www.metroradio.com.hk/news/default.aspx?SearchText=&NewsId=20250924021223&page=0,metro,,2025-09-24 02:30,"風暴期間，民政事務總署在各區開放49個臨時庇護中心，有711人入住。 政府1823電話中心收到5宗塌樹報告，消防處收到10宗。 土木工程拓展署收到1宗山泥傾瀉報告。

所有學校停課，學校暫停接收小一入學自行分配學位的紙本申請，截止日期延至下星期二。"
美聯儲博斯蒂克 : 美國仍存通脹上升風險,2025-09-24 01:46,https://www.metroradio.com.hk/news/default.aspx?SearchText=&NewsId=20250924014618&page=0,metro,,2025-09-24 02:15,"美國亞特蘭大聯儲銀行行長博斯蒂克表示，雖然總統特朗普增加進口關稅的措施，未如預期推高物價，但通脹風險仍然存在，聯儲局要繼續警惕物價壓力。

博斯蒂克接受訪問時表示，企業明顯感受到成本壓力，而且越來越難阻止這些壓力，傳導至消費者及客戶面臨的價格層面。 他認為通脹仍有上行空間，聯儲局必須密切關注高通脹如何影響未來價格預期。

博斯蒂克表示，目前勞動力市場難以解讀，企業普遍表示，在不確定性環境下，未有顯著招聘，亦未有大規模裁員。

博斯蒂克今年在聯邦市場公開委員會並無投票權。"
天文台發出9號烈風或暴風風力增強信號,2025-09-24 01:43,https://www.metroradio.com.hk/news/default.aspx?SearchText=&NewsId=20250924014334&page=0,metro,,2025-09-24 02:15,天文台於1時40分發出九號烈風或暴風風力增強信號，預料本港風力顯著增強，市民現時切勿外出，遠離當風的門窗，在安全的地方躲避。
城巴預計今日所有日間路線暫停服務,2025-09-24 01:31,https://www.metroradio.com.hk/news/default.aspx?SearchText=&NewsId=20250924013155&page=0,metro,,2025-09-24 01:45,"城巴所有日間路線已暫停服務，所有通宵路線將暫停服務。 因應天文台將於凌晨1時40分改發九號烈風或暴風風力增强信號，城巴預計今日所有日間路線將暫停服務，直至另行通知。

城巴將密切留意颱風動向及路面狀況，公佈最新服務安排。"
鮑威爾 : 勞工市場疲弱促使聯儲局減息,2025-09-24 01:26,https://www.metroradio.com.hk/news/default.aspx?SearchText=&NewsId=20250924012646&page=0,metro,,2025-09-24 01:45,"美國聯儲局主席鮑威爾表示，近期通脹風險偏向上行，而就業風險偏向下行，情況相當具挑戰性，意味未來的道路並非無風險。

鮑威爾在一個經濟展望午餐會上發表演說，他指，勞動力市場疲弱的負面影響，蓋過對持續通脹的擔憂，促使聯儲局上星期決定減息，以保持經濟增長不受阻礙。

他表示，聯儲局的職責是在雙重使命中保持平衡，即是穩定物價及降低失業率，重申實現百分之2通脹目標及支援就業的重要性，未來如何在矛盾中尋找解決方案，是聯儲局的重要挑戰。

鮑威爾認為，目前略顯限制性的政策立場，讓聯儲局能夠靈活應對潛在的經濟變化，若果有必要，可能進一步減息。"
澳門預料凌晨2時至4時改發9號風球機會高,2025-09-24 01:14,https://www.metroradio.com.hk/news/default.aspx?SearchText=&NewsId=20250924011426&page=0,metro,,2025-09-24 01:30,"澳門八號西北風球仍然生效，預料在凌晨2時前維持，2時至4時改發九號風球機會為高，清晨4時至7時改發十號風球機會亦高。

澳門氣象局指，超強颱風樺加沙持續向西北偏西方向移動，穩定靠近珠江口一帶，澳門風勢正開始逐漸增強，受樺加沙的外圍雨帶影響，驟雨會較為頻密及有幾陣雷暴。

預測樺加沙凌晨至早上將會相當接近珠江口，於澳門100公里內掠過，屆時澳門風力有機會達12級颶風或以上，最大風力持續時間較長，有狂風暴雨及雷暴，高層樓宇需提防因颶風或以上風力所帶來的嚴重影響。 如樺加沙正面吹襲，不排除發出黑色風暴潮警告的可能性，預料將對澳門造成顯著的影響，帶來與「天鴿」、「山竹」相若的嚴重威脅。"
柴灣觀浪墮海母子情況危殆  父親情況嚴重,2025-09-24 00:56,https://www.metroradio.com.hk/news/default.aspx?SearchText=&NewsId=20250924005602&page=0,metro,,2025-09-24 01:30,"昨日下午八號風球期間，柴灣下午有一家3口墮海，其中2人昏迷送院，情況危殆。

警方下午近3時半接報，指3人於嘉業街柴灣工業邨對開海面遇溺，消防接報5分鐘後到場。 當時一艘舢舨將38歲母親及5歲兒子救起，父親就在海面等待救援，墮海母子情況危殆。 父親情況嚴重。 9歲女兒在岸上無恙。

初步了解，3人到防坡堤觀浪，其間一對母子被大浪捲落海，父親落海救人。

警方呼籲市民，不要到危險位置追風逐浪，如有市民不聽從警方指示，逗留在危險地方，警方會採取行動。

天文台前台長林超英在社交平台指，湧浪來得很隱秘，而且殺傷力遠超想像，市民觀浪期間隨時走不及，呼籲市民萬勿心存僥倖。"
港鐵維持現時列車及輕鐵服務直至收車,2025-09-24 00:47,https://www.metroradio.com.hk/news/default.aspx?SearchText=&NewsId=20250924004724&page=0,metro,,2025-09-24 01:00,"天文台將於凌晨1時40分改發九號烈風或暴風風力增強信號。 港鐵會維持現時的列車及輕鐵服務直至收車。

為保障乘客和港鐵人員的安全，如稍後早上頭班車開出時間，九號信號或更高颱風信號仍然生效，港鐵露天段會暫停列車服務，露天段的車站會暫時關閉，輕鐵亦會暫停服務。"
歐洲股市個別發展  Kingfisher升近15%,2025-09-24 00:44,https://www.metroradio.com.hk/news/default.aspx?SearchText=&NewsId=20250924004454&page=0,metro,,2025-09-24 01:00,"歐洲股市個別發展。 英國家居建材零售商Kingfisher因應本地需求上升，上調前景展望，股價升一成半。

英國富時指數收報9223點，跌3點，跌幅百分之0.04。

德國DAX指數收報23611點，升84點，升幅百分之0.36。

法國CAC指數收報7872點，升41點，升幅百分之0.54。"
天文台 : 凌晨1時40分改發9號風,2025-09-24 00:39,https://www.metroradio.com.hk/news/default.aspx?SearchText=&NewsId=20250924003954&page=0,metro,,2025-09-24 01:00,"天文台會在凌晨1時40分改發九號烈風或暴風風力增強信號。

現時本港部分地區已受烈風影響，預料超強颱風樺加沙會於今早最接近本港，在本港南面100公里左右掠過，其颶風區將會逐漸接近本港。

樺加沙環流廣闊，風勢猛烈。 本港今日天氣會持續惡劣，有頻密狂風大驟雨及雷暴，海有極巨浪及湧浪，岸邊會出現越堤浪，東面及南面的海岸尤其顯著，市民應遠離岸邊及停止所有水上活動。

受顯著風暴潮影響，今日本港沿岸增水可達約2米，預計水位早上約6時後開始上升，並在早上較後時間至下午初時達至最高，普遍可達海圖基準面以上約3.5米至4米，而吐露港水位更可能高達海圖基準面以上4米至5米。

在過去一小時，大老山、橫瀾島及長洲分別錄得的最高持續風速為每小時93、83及55公里，最高陣風分別超過每小時111、101及103公里。"
