title,date,url,source,section,scrape_time,news_content
加拿大央行維持利率於2.75厘不變  符合預期,2025-07-30 21:55,https://www.metroradio.com.hk/news/default.aspx?SearchText=&NewsId=20250730215537&page=0,metro,,2025-07-30 22:15,"加拿大央行宣布，維持指標利率於2.75厘不變，符合市場預期。

央行指，維持利率不變是明確共識，若果符合條件，可能需要減息，又指美加貿易談判將會影響下半年經濟表現。"
恒指夜期低水82點,2025-07-30 21:50,https://www.metroradio.com.hk/news/default.aspx?SearchText=&NewsId=20250730215053&page=0,metro,,2025-07-30 22:00,港股恒指夜期最新報25095點，跌83點，低水82點。
華爾街股市早段微升  等待議息結果,2025-07-30 21:49,https://www.metroradio.com.hk/news/default.aspx?SearchText=&NewsId=20250730214947&page=0,metro,,2025-07-30 22:00,"美國第二季GDP初值增長百分之3，好過市場預期 ；市場等待聯儲局議息結果及主席鮑威爾講話，華爾街三大主要指數早段微升。

道瓊斯工業平均指數最新報44636點，升3點，升幅百分之0.01。

標普500指數最新報6379點，升8點，升幅百分之0.14。

納斯達克指數最新報21153點，升55點，升幅百分之0.26。

星巴克季績勝預期，股價升半成。 微軟及Meta收市後派成績表，兩股早段微升。

新東方上季少賺近七成四，其ADR跌一成。"
特朗普宣布周五起向印度進口商品加徵25%關稅,2025-07-30 21:42,https://www.metroradio.com.hk/news/default.aspx?SearchText=&NewsId=20250730214224&page=0,metro,,2025-07-30 22:00,"美國總統特朗普宣布，周五起向印度進口商品，加徵25%關稅。

特朗普在社交媒體表示，雖然印度是美國的朋友，但多年來美國與印度的貿易相對有限，因為他們的關稅過高，是全球最高之一，而且他們擁有最繁瑣而令人反感的非貨幣貿易壁壘。

特朗普批評，印度絕大多數的軍備，一直向俄羅斯購買，並且與中國一樣，是俄羅斯能源的最大買家，又指在全球都希望俄羅斯停止攻擊烏克蘭之際，印度這些行為都非常不妥。

印度暫時未有回應。"
普拉達中期盈利按年微升0.6%,2025-07-30 21:40,https://www.metroradio.com.hk/news/default.aspx?SearchText=&NewsId=20250730214047&page=0,metro,,2025-07-30 22:00,"普拉達(01913)公布，截至6月底止中期，盈利3億8600萬歐元，按年增長百分之0.6，每股盈利0.151歐元，不派息。

收益淨額27億4000萬歐元，按固定匯率計，按年增加百分之9，零售銷售淨額按固定匯率計增加百分之10。 Prada品牌的零售銷售淨額減少百分之2，Miu Miu的零售銷售淨額增加百分之49。

所有地區的零售銷售淨額按固定匯率計均錄得增長，中東升百分之26，美洲升百分之12，亞太區升百分之10，歐洲升百分之9，日本升百分之4。"
據報Prosus近期減持美團約2.5億美元股份,2025-07-30 21:30,https://www.metroradio.com.hk/news/default.aspx?SearchText=&NewsId=20250730213050&page=0,metro,,2025-07-30 21:45,"南非Naspers旗下Prosus近期減持騰訊(00700)之外，《彭博》報道，Prosus近期亦開始出售所持價值40億美元的美團(03690)股份，在過去兩星期，減持了價值約2億5000萬美元美團。

2023年騰訊向股東分派美團，當時Prosus獲得2億5800萬股美團股份。"
「阿信屋」母企全年度虧損擴大,2025-07-30 21:18,https://www.metroradio.com.hk/news/default.aspx?SearchText=&NewsId=20250730211826&page=0,metro,,2025-07-30 21:30,"經營零售店「759阿信屋」的CEC國際(00759)公布，截至4月底止年度虧損4383萬元，對比上年度虧損2981萬元。

期內每股虧損6.58仙，不派息，收益14億4439萬元，按年跌百分之1.7。

零售業務分部收益13億9417萬元，下降約百分之2，佔總收益約九成七。

管理層歸納零售業務正面對的3項最重大挑戰：市民外遊意欲高漲，每逢週末各關口都出現擁擠人潮，若遇上節假日如復活節長假期，情況更為誇張；晚間8時後人流仍然未見起色，明顯地本港市民晚間消費活動尚未回復至疫情前水平；利息高企及樓市波動促使顧客消費更趨審慎。

根據目前市場形勢，管理層認為，尋求收益增長擴充計劃之可行性極低且風險極高。"
中俄海軍下月海參崴附近舉行海上聯合演習,2025-07-30 21:15,https://www.metroradio.com.hk/news/default.aspx?SearchText=&NewsId=20250730211546&page=0,metro,,2025-07-30 21:30,"中俄海軍下月會在海參崴附近海空域，舉行海上聯合演習。

中國國防部表示，中方參演兵力，分別來自東部和北部戰區海軍，包括導彈驅逐艦紹興艦和烏魯木齊艦等。 俄方派出特里布茨海軍上將號大型反潛艦，響亮號輕型護衛艦，以及別洛烏索夫號救生船等參演。 演習分兵力集結，聯合籌劃和聯合演習3個階段進行，兩國將開展援潛救生，聯合反潛，防空反導，對海作戰等演練。

國防部又指，演習結束後，雙方部分兵力將前往太平洋相關海域，組織海上聯合巡航，強調這是中俄兩軍年度合作計劃內安排，不針對第三方，亦與當前國際和地區局勢無關。"
美國7月ADP就業職位增加10.4萬個,2025-07-30 21:09,https://www.metroradio.com.hk/news/default.aspx?SearchText=&NewsId=20250730210956&page=0,metro,,2025-07-30 21:30,美國人力資源公司ADP公布，7月私人企業就業職位增加10萬4000個，高於市場原預期的8萬個。
美國第二季國內生產總值增長3%  勝預期,2025-07-30 21:07,https://www.metroradio.com.hk/news/default.aspx?SearchText=&NewsId=20250730210723&page=0,metro,,2025-07-30 21:30,"美國商務部公布，第二季國內生產總值(GDP)年率按季初值增長百分之3，高於市場預期的百分之2.4。

個人消費支出(PCE)物價指數初值增長百分之2.1，低於市場預期的百分之2.9，核心PCE物價指數初值增長百分之2.5，高於市場預期的百分之2.3。

第二季消費者支出初值升百分之1.4。"
王文濤: 中美經貿關係歷經風雨 平等對話協商是解決分歧關鍵,2025-07-30 21:05,https://www.metroradio.com.hk/news/default.aspx?SearchText=&NewsId=20250730210509&page=0,metro,,2025-07-30 21:30,"商務部長王文濤在北京，會見美中貿易全國委員會董事會代表團。 他指中美經貿關係歷經風雨，雙方仍互為重要經貿夥伴，「脫鈎斷鏈」行不通，平等對話協商才是解決分歧的關鍵。

王文濤指，近兩天中美雙方團隊已在瑞典舉行經貿會談，希望美方與中方相向而行，共同維護中美經貿關係穩定、健康、可持續發展。

他又指，對外開放是中國的基本國策，中國開放的大門只會愈開愈大，利用外資政策沒有變也不會變，中國消費市場規模穩居全球前列，極具增長潛力和創新活力，中國歡迎包括美資企業在內的各國企業投資中國，共享發展機遇。"
美聯 : 若落實放寬內地人才買樓  將加速資金流入樓市,2025-07-30 20:51,https://www.metroradio.com.hk/news/default.aspx?SearchText=&NewsId=20250730205153&page=0,metro,,2025-07-30 21:00,"財政司司長陳茂波表示，正與相關中央機構研究，能否在合適的範圍中，放寬內地來港人才調動資金在香港買樓，同時避免出現資本外流。

美聯集團行政總裁(住宅)馬泰陽回應指，以上建議可以配合政府目前積極實施的一系列「人才計劃」措施，更便利內地「人財」到港，刺激資金流入樓市。 馬泰陽相信，如果措施落實，將增加來港人才的置業需求，對香港樓市起進一步提振作用，預期伴隨近期股市強勢、樓市供應減少、一手熱銷及減息憧憬等多重利好因素，帶動香港整體樓市穩中向好，樓價亦有望加速回穩。

美聯指，政府積極吸納外來人才，截至6月底，所有人才入境計劃合共收到近50萬宗申請，當中近33萬宗獲批，近22萬人已經到港。 自政府於2022年底推出「高端人才通行證計劃」及優化原有各項人才入境措施，帶來新增住屋需求，但大部份來港人才先選擇租住，租金至今累積升幅高達一成四，樓價同期下跌約一成三，走勢與租金明顯背馳。

美聯又指，內地買家向來較鍾情一手物業，根據美聯物業研究中心綜合土地註冊處資料，按已知買家姓名作分析，今年上半年內地買家(以買家姓名的英文拼音鑒別)佔個人買家於香港樓市一手私宅註冊量比率約三成一，高於二手約一成七的水平。"
俄羅斯遠東外海8.8地震 日本各地海嘯警報全面解除,2025-07-30 20:50,https://www.metroradio.com.hk/news/default.aspx?SearchText=&NewsId=20250730205034&page=0,metro,,2025-07-30 21:15,"俄羅斯遠東地區的堪察加半島外海，早上發生8.8級地震，並引發海嘯。

堪察加半島有幼兒園牆壁倒塌，無人傷亡，多名居民前往醫療機構求醫，混亂期間有人受傷，地震亦造成部分地區停電，路面汽車劇烈晃動；鄰近震央的堪察加邊疆區，沿岸監測到3至4米高的海嘯。

地震亦引發了向外擴散的海嘯波，日本，美國等多國發布海嘯警報或預警，其中日本岩手縣錄得最高1.3米高海嘯。 氣象廳晚上將向北海道，以及青森，岩手，宮城，福島的海嘯警報，改為海嘯提醒，日本其餘各地警報全面解除。

本港天文台指，首一兩個抵達香港的海嘯波波幅很小，未能觀察得到，但傍晚在石壁潮汐站，觀察到約7厘米的水位異常，估計是由隨後抵達的海嘯波所引起。"
申萬宏源香港料中期除稅後溢利最多6500萬元,2025-07-30 20:46,https://www.metroradio.com.hk/news/default.aspx?SearchText=&NewsId=20250730204634&page=0,metro,,2025-07-30 21:00,"申萬宏源香港(00218)預期截至6月底止六個月，除稅後溢利在5500萬元至6500萬元之間，而去年同期除稅後虧損3700萬元。

上半年集團抓住市場機會，通過優化資產配置、審慎管理市場風險敞口，以及積極控制營運成本，推動機構服務及交易業務、財富管理、企業融資等核心業務收益顯著提升，帶動上半年溢利大幅增長。"
通達集團料中期盈利增長最多4倍,2025-07-30 20:44,https://www.metroradio.com.hk/news/default.aspx?SearchText=&NewsId=20250730204422&page=0,metro,,2025-07-30 21:00,"通達集團(00698)預期，截至6月底止中期，公司擁有人應佔溢利介乎約6000萬元至6500萬元之間，按年增加約3.67倍至4倍，主要由於2024年提早償還大部分長期銀行貸款，導致期內財務費用及銀行收費較去年同期大幅減少；2024年4月完成出售精密零部件業務後，不再產生與該業務有關的任何研究與開發開支。 加上集團採取嚴謹的發展策略，將研發資源集中於核心業務，以及去年應客戶要求開發的新材料及產品已開始逐步推出。 該等因素共同促使集團於期內的研發成本較去年同期大幅下降。

儘管集團的營運受到激烈市場競爭的影響，但2024年進行的固定資產減值令期內的折舊開支大幅減少。"
保監局主席拜會夏寶龍,2025-07-30 20:37,https://www.metroradio.com.hk/news/default.aspx?SearchText=&NewsId=20250730203728&page=0,metro,,2025-07-30 21:00,"保險業監管局公布, 主席姚建華和行政總監張雲正今天在北京拜會中央港澳工作辦公室主任、國務院港澳事務辦公室主任夏寶龍，及分管日常工作的副主任徐啟方。"
金發局 : 政府營商報告展現本港作為金融中心實力,2025-07-30 20:34,https://www.metroradio.com.hk/news/default.aspx?SearchText=&NewsId=20250730203415&page=0,metro,,2025-07-30 21:00,"香港金融發展局對於特區政府今日發布的香港營商環境報告表示歡迎。 該報告充分展現香港作為國際領先金融中心的地位和實力，包括全球100大銀行中有70間在香港營運；香港股票市場為亞洲第三、全球第六；在全球119個金融中心中排名第三，亞太區繼續居首；同時為亞洲領先的債券樞紐，在亞洲國際債券發行方面，於過去十年內九度排名市場首位。

金發局主席洪丕正表示，報告突顯香港在全球金融體系中的獨特優勢，尤其是在融資平台、資產及財富管理和金融科技等領域的全球領先地位。 憑藉穩健的法治及監管制度、便利的資金流通、優秀的國際人才，香港不僅是國際資本的聚集地，更是推動國際貿易、投資及金融合作的重要平台。

他續稱，香港在金融發展方面可以充分發揮引進來、走出去的雙向平台角色，連接中國與全球供應鏈，成為面向南方的區域財資中心。 同時香港亦具備全球領先風險管理中心的優勢，推動貨幣多元化及資產配置，進一步提升作為全球頂尖國際金融中心的競爭力。"
衛健委要求全國採果斷措施 防基孔肯雅熱疫情擴散,2025-07-30 20:27,https://www.metroradio.com.hk/news/default.aspx?SearchText=&NewsId=20250730202725&page=0,metro,,2025-07-30 20:45,"廣東省基孔肯雅熱疫情持續，累計病例逾5千宗，其中佛山順德新增408宗確診個案，全部輕症。

國家衛健委召開全國基孔肯雅熱疫情防治工作電視電話會議，要求加強基孔肯雅熱疫情風險研判，採取果斷防控措施，要強化區域聯動和部門協同，開展多渠道監測預警，防範疫情外溢擴散和境外輸入，亦要加強環境衛生整治，科學有效滅蚊防蚊避蚊。

會議又提出，要加強醫療衛生機構，檢驗檢測質控和門診急診管理，提高「早發現」能力，全力防範重症和死亡，規範發布疫情信息，科學引導個人防護，增強公眾信心。"
大欖涌1男工由村屋高處墮下身亡,2025-07-30 20:15,https://www.metroradio.com.hk/news/default.aspx?SearchText=&NewsId=20250730201550&page=0,metro,,2025-07-30 20:30,"大欖涌發生致命工業意外，一名男工人在一間村屋由高處墮下身亡。

下午大約3時半，1名40多歲的男工人，在大欖涌村一間村屋的3樓天台工作期間，懷疑意外失足墮樓，他重傷昏迷，送往屯門醫院搶救後證實不治。

勞工處接報後已派員到現場，正調查意外原因。"
寧德時代中期多賺33%  中期息每10股派10.07元人幣,2025-07-30 20:09,https://www.metroradio.com.hk/news/default.aspx?SearchText=&NewsId=20250730200922&page=0,metro,,2025-07-30 20:30,"寧德時代(03750)公布，截至6月底止中期純利305億1222萬元人民幣，按年升三成三，每股盈利6.92元人民幣，每10股派中期息10.07元人民幣，收入1788億8625萬元人民幣，按年升百分之7，主要因為動力電池需求持續增長。

期內毛利率百分之25.02，按年升1.57個百分點。

集團指，新能源領域的科技創新和市場應用空間廣闊，智能技術的快速發展和廣泛應用，加速各領域的創新，將進一步增強新能源車的吸引力，促進交通電動化進程，並大幅提升數據中心等儲能配置及應用需求。"
荃灣「紅磚屋」美港貨倉放售  意向價5億元,2025-07-30 19:51,https://www.metroradio.com.hk/news/default.aspx?SearchText=&NewsId=20250730195100&page=0,metro,,2025-07-30 20:15,"第一太平戴維斯表示，獲委任為獨家代理，公開邀約出售荃灣青山公路荃灣段364至372號及美環街13至19號，美港貨倉及美港第二倉。 物業地盤面積約7萬零498平方呎，現狀總批則面積約18萬3405平方呎 以現狀交吉形式出售，公開邀約截止日期為10月10日正午12時。

美港貨倉為一幢三層高貨倉，每層約2萬8044平方呎，總建築面積約8萬4132平方呎，樓層高度約3.93至4.95米，樓面負重能力每平方呎300磅；而美港第二倉則為一幢四層高工業大廈，每層約2萬4539至2萬5656平方呎，總建築面積約9萬9273平方呎，樓層高度約3.03至3.66米，樓面負重能力為每平方呎150磅。

物業坐落荃灣市中心核心地段，步行約5分鐘即可抵達荃灣港鐵站，第一太平戴維斯投資部首席資深董事溫武忠表示，物業出售的意向價為5億元，買家短線可翻新改裝現有樓面作多元工業用途。

美港貨倉因紅色外牆而被外界稱為「紅磚屋」，已荒廢多年，去年招標放售時，據報市值約20億元。"
總商會 : 香港核心優勢依然穩固,2025-07-30 19:41,https://www.metroradio.com.hk/news/default.aspx?SearchText=&NewsId=20250730194154&page=0,metro,,2025-07-30 20:15,"香港總商會認同財政司司長陳茂波今天發表的意見，香港仍然是卓越的商業和金融樞紐，匯聚來自世界各地的企業。 儘管地緣政治挑戰持續、經濟轉型及消費模式轉變對企業造成影響，尤其是零售和餐飲業，香港的核心優勢依然穩固。

總商會指，多項在全球備受認可的調查亦證明了這一點，香港一直位居全球最自由開放及最具競爭力的商業樞紐之列。 主席陳瑞娟表示，加強商界信心及與世界各地的商家加強聯繫，對香港鞏固及提升作為全球最重要商業樞紐之一的地位尤關重要。

她指，總商會將繼續與訪港代表團和海外夥伴會面交流，加強推廣香港在「一國兩制」下能為國際商界帶來的眾多益處和確定性。"
歐洲股市中段窄幅上落  滙控倫敦現跌2.5%,2025-07-30 19:38,https://www.metroradio.com.hk/news/default.aspx?SearchText=&NewsId=20250730193801&page=0,metro,,2025-07-30 20:15,"歐洲股市中段窄幅上落，諾和諾德下調全年盈利預測、上日大跌兩成三後，今日再跌百分之2。 滙控倫敦跌幅略為收窄至百分之2.5，最新報945.3便士，折合約99.15港元。

英國富時指數最新報9111點，跌24點，跌幅百分之0.27。

德國DAX指數最新報24254點，升37點，升幅百分之0.15。

法國CAC指數最新報7891點，升33點，升幅百分之0.43。"
財庫局 : 積極把握增長勢頭  持續推動政策措施,2025-07-30 19:28,https://www.metroradio.com.hk/news/default.aspx?SearchText=&NewsId=20250730192842&page=0,metro,,2025-07-30 19:45,"政府發表新一份香港營商環境報告，闡述香港作為國際城市在「一國兩制」下所展現的營商優勢。 今年來，香港金融市場的表現穩步向上，繼去年恒生指數上升百分之18，今年以來上升超過百分之25，股市上半年每日成交額上升1.2倍至2400億元。 證監會的調查顯示，本港資產管理業務進一步增長，截至去年底資產管理總值超過35萬億元，按年增加百分之13。

財經事務及庫務局指出，將積極把握增長勢頭，持續推動多項政策措施，包括進一步優化上市制度，提升市場競爭力；促進股票市場流動性；發展金融創新，推動數字資產與實體經濟深度融合；以及吸引更多具潛力的優質企業來港上市，同時便利企業在港設立財資管理中心，拓展全球業務。"
金管局 : 香港銀行體系穩健  信貸風險可控,2025-07-30 19:21,https://www.metroradio.com.hk/news/default.aspx?SearchText=&NewsId=20250730192157&page=0,metro,,2025-07-30 19:45,恒生銀行(00011)公布業績時提及，上半年作出較多撥備，主要由於商業房地產壓力。 金管局回應指，不評論個別機構的事宜，金管局一直要求銀行審慎管理信貸風險，整體而言，香港銀行體系維持穩健，信貸風險可控，撥備充足，香港銀行也有充裕資本以應對市場波動。
政府發言人 : 香港營商環境報告說明一國兩制下優勢,2025-07-30 19:19,https://www.metroradio.com.hk/news/default.aspx?SearchText=&NewsId=20250730191946&page=0,metro,,2025-07-30 19:30,"特區政府繼2021年後，再度發表香港營商環境報告，向社會各界和海內外投資者詳細介紹香港的最新發展和優勢，說明香港開放、安全、穩定、高效和國際化的營商環境。

政府發言人表示，報告詳述香港在「一國兩制」下的制度優勢，並說明政府推動經濟高質量發展的政策重點與成果，包括持續提升競爭力，以及吸引資金流入、匯聚企業、吸納人才的成績等，並展示香港在金融、貿易、航空、航運、創科、知識產權貿易、法律服務，以及文化、體育和旅遊等領域的最新發展和潛力。

發言人說，這幾年來《香港國安法》和《維護國家安全條例》的實施，讓香港重建安全穩定的環境，不僅保障了市民大眾的權利和自由，同時也讓香港成為更能吸引國際資金和投資的安全港。 從資金持續流入、股市穩步上揚、海內外企業紛紛落戶香港、人才踴躍來港發展，以至香港在多項國際排名中名列前茅等，種種事實說明香港開放、安全、穩定和高效的營商環境在國際間獲得廣泛認同，國際投資者和企業對香港的信心正進一步提升。

發言人說，面對複雜多變的外圍環境，香港經濟結構正在升級轉型，但機遇大於挑戰。 香港有國家作為強大後盾，政府、各界和市民共同努力，用好「一國兩制」的獨特優勢，把握國家發展機遇，大力發展科技創新和培育新質生產力，深化國際和區域交往合作，必定可以發展新的增長點，為香港開創新局面。"
地產代理監管局 : 下半年密切留樓市發展,2025-07-30 19:15,https://www.metroradio.com.hk/news/default.aspx?SearchText=&NewsId=20250730191501&page=0,metro,,2025-07-30 19:30,"地產代理監管局指，上半年共有2560名考生參加資格考試，按年減少百分之2，截至6月底，個人牌照數目3萬7792個，較去年同期減少百分之2.9，亦較去年底減少百分之1.8，反映持牌人數基本持平，但出現輕微流失情況。 監管局於上半年開立128宗投訴個案，較去年同期上升六成，當中有17宗涉及一手住宅物業，整體投訴錄得較大升幅的主要原因，是涉及「發出違規廣告」的投訴數字上升。

監管局指，下半年將繼續密切留意樓市最新發展，及政府推出的新措施，適時向地產代理發出新指引及推出相關教育工作，亦會繼續就政府各項涉及地產代理的政策或立法建議，促進政府與地產代理業界的溝通。 同時局方會繼續致力教育消費者，在租樓及買樓時要注意的事項，並會加強網上巡查，減低消費者受騙的機會，同時打擊不合規的物業廣告。"
警破2毒品案檢約810萬元毒品 拘2女,2025-07-30 19:04,https://www.metroradio.com.hk/news/default.aspx?SearchText=&NewsId=20250730190446&page=0,metro,,2025-07-30 19:30,"警方破獲2宗毒品案，檢獲市值約810萬元的毒品，拘捕2名女子。

其中警方經過深入調查，鎖定1名外籍女子，懷疑她負責協助販毒集團管控及儲存毒品，之後在尖沙咀1間酒店，檢查她存放的行李，發現約20公斤懷疑大麻，市值約400萬元。 警方周一在機場，拘捕1名從越南抵港的61歲外籍女子，她被控一項販運危險藥物罪，明日提堂。

另外，警方昨日搜查牛頭角一住宅單位，檢獲約10公斤懷疑氯胺酮及相關毒品包裝工具，市值約410萬元，拘捕1名18歲本地女子，相信她負責協助販毒集團儲存及運送毒品。 她同樣被控販運危險藥物罪，明日提堂。"
投資推廣署 : 政府營商報告展示香港優勢,2025-07-30 18:57,https://www.metroradio.com.hk/news/default.aspx?SearchText=&NewsId=20250730185717&page=0,metro,,2025-07-30 19:15,"投資推廣署署長劉凱旋表示，政府最新發表的《營商環境報告》全面展示香港的制度優勢與營商信心，亦充分反映投資推廣署作為香港對外招商引資的專責部門，在推動外來直接投資過程中所觀察到的正面發展趨勢與企業信心。

今年該署走訪多個主要市場，與商界領袖會面交流，普遍共識是香港在通關復常後不僅重拾活力，更是亞洲區內最理想的業務發展基地。 無論是擴充現有業務、設立地區總部，還是在港開展研發、財資管理或家族辦公室等業務，企業普遍認為香港不僅是通往內地和亞洲市場的樞紐，更是一個擁有完善法治、資金自由流動及人才匯聚的理想營商基地。

該署將繼續全力推動以策略性產業為重點的招商工作，配合政府政策方向，包括發展低空經濟、推動綠色轉型及拓展烈酒貿易等，致力吸引更多具潛力的企業和資金來港。

展望未來，將聚焦發展四大策略產業：金融服務與金融科技、創新科技、供應鏈管理與物流，以及可持續發展與綠色經濟。 同時將積極推廣香港豐富的軟實力和文化魅力，向全球展示香港獨特優勢。 透過香港穩健的資本市場，將協助企業進行資本對接，進一步鞏固香港作為「引進來」和「走出去」的重要雙向平台地位。"
