title,date,url,source,section,scrape_time,news_content
許正宇出訪倫敦 向英國各界展示香港拓展國際金融合作決心,2025-06-11 16:39,https://www.metroradio.com.hk/news/default.aspx?SearchText=&NewsId=20250611163937&page=0,metro,,2025-06-11 17:00,"財經事務及庫務局局長許正宇出訪英國倫敦，他表示，香港站在全球金融和數碼資產變革的前沿，與英國在追求創新和可持續發展的世代擁有共同願景，可優勢互補透過轉型取得經濟增長。

許正宇在當地時間星期二，出席英國香港工商協會舉辦的午餐會，之後與英國金融城協會領導委員會主席Bruce Carnegie-Brown，共同見證金發局與英國金融城協會簽署諒解備忘錄，建立合作夥伴關係。

在簽署儀式前，許正宇亦與英國金融城協會的成員舉行圓桌會議，並在同日較早時間，與倫敦金融城市長靳翊偉舉行雙邊會議，並與普華永道英國Chief Markets Officer Carl Sizer會面。

另外，許正宇在星期一上午出席英國獨立智庫「亞洲之家」的成員分享會，中午出席工銀標準銀行的午餐會議，下午與英國財政部經濟事務秘書Emma Reynolds及其他金融官員會面，另外，許正宇亦拜會中國駐英國使館公使王起。

許正宇在完成英國行程後，許正宇將會在今日轉往挪威奧斯陸繼續訪問行程。"
喜馬拉雅承諾被騰訊音樂併購後「四不變」,2025-06-11 16:35,https://www.metroradio.com.hk/news/default.aspx?SearchText=&NewsId=20250611163511&page=0,metro,,2025-06-11 17:00,"騰訊音樂(01698)擬以現金和股份發行方式，全資收購內地在線音頻平台喜馬拉雅控股，喜馬拉雅承諾，將保持現有品牌、 公司戰略發展方向等四不變。

喜馬拉雅以聯合創始人陳小雨和余建軍的名義發文表示，這次併購事項，將在滿足各項前置條件後正式交割，雙方後續會共同推進相關流程。

喜馬拉雅承諾合作夥伴與喜馬拉雅簽署的各類合同均會如約履行，每一位客戶權益也依法受到保護。   喜馬拉雅也將保持現有品牌不變、現有產品獨立運營不變、 核心管理團隊不變、公司戰略發展方向不變。

喜馬拉雅內部今早，在線上線下同步舉行員工溝通會，喜馬拉雅創始人兼聯席CEO余建軍發言，據報發言期間，余建軍情緒一度激動。

騰訊音樂昨晚公布，本次收購的交易對價為12億6000萬美元現金，及騰訊音樂發行的不超總股本約百分之5.2的A類普通股，喜馬拉雅創始股東亦將在交割時及之後，分批獲得騰訊音樂發行的不超過百分之0.37的A類普通股。

以騰訊音樂昨日收市價73.65元計算，這次交易的現金和股份發行的總對價，預計將不超過28億9000萬美元。"
一對姻親兄弟因虛假交易罪成押後至7月8日判刑,2025-06-11 16:29,https://www.metroradio.com.hk/news/default.aspx?SearchText=&NewsId=20250611162920&page=0,metro,,2025-06-11 17:00,"早前在證監會提出的檢控中，林泰豐及其姊夫柯俊年被裁定，於2017年4月9日至2018年3月7日期間，就百信國際控股股份串謀進行虛假交易罪成，東區裁判法院頒令索取二人的社會服務令適合性報告，法院押後至7月8日判刑。

二人獲准以2萬元保釋金及5萬元人事擔保保釋。

除了被裁定串謀進行虛假交易罪成外，林泰豐亦承認並無向聯交所披露於百信股份的股權水平變動的控罪。"
[本港股市]收市升204點 報24366點,2025-06-11 16:19,https://www.metroradio.com.hk/news/default.aspx?SearchText=&NewsId=20250611161923&page=0,metro,,2025-06-11 16:30,"中美在倫敦就貿易框架協議達成共識，港股升超過200點，大市高開28點後升幅好快擴大，午後升幅曾經擴大至276點，恒生指數創近三個月高位，收市報24366點，升204點，成交2352億元。

中資金融股上升，中人壽(02628)升百分之4，平保(02318)、工行(01398)、建行(00939)及招行(03968)升百分之2。

新經濟股普遍上升，阿里巴巴(09988)、京東(09618)、百度(09888)及快手(01024)升百分之1，網易(09999)升百分之2，騰訊(00700)靠穩，但美團(03690)偏軟。

多間車企承諾將供應商支付帳款期間限制在60日內，吉利(00175)靠穩，比亞迪(01211)升百分之3，理想汽車(02015)下跌，蔚來(09866)升百分之4，小鵬(09868)升百分之3，長城汽車(02333)無升跌。

其他汽車相關股都上升，中升控股(00881)升百分之2，寧德時代(03750)升近百分之3，浙江世寶(01057)升百分之3，耐世特(01316)升百分之2。

康師傅(00322)今日除淨，股價逆市跌百分之3，是跌幅最大藍籌，農夫山泉(09633)都跌百分之2。

鋼鋁股繼續上升，中國宏橋(01378)升百分之4，是升幅最大藍籌，中國鋁業(02600)升近百分之3，馬鋼(00323)升百分之，鞍鋼(00347)升百分之4。

稀土股繼續炒上，中國石墨(02237)升三成二，南方錳業(01091)升一成六，中國鐵鈦(00893)升三成，中國稀土(00769)升一成八，金力永磁(06680)升百分之1，稀美科技(00601)升半成，烯石電車新材料(06128)升一成三。

國企指數報8865點，升98點。"
哈薩克公布習近平下周到訪 中國外交部:將及時公布消息,2025-06-11 16:14,https://www.metroradio.com.hk/news/default.aspx?SearchText=&NewsId=20250611161444&page=0,metro,,2025-06-11 16:30,"哈薩克宣布，國家主席習近平將在下周一及周二，到哈薩克首都阿斯塔納訪問，同哈薩克總統舉行會談。 據報，習近平亦將出席下周二舉行的第二屆中亞-中國峰會。

在北京，外交部發言人在例行記者會上， 被問到訪問的細節時，說將及時發布消息。"
日土木學會:南海海槽大地震或造成1466萬億日圓經濟損失,2025-06-11 16:03,https://www.metroradio.com.hk/news/default.aspx?SearchText=&NewsId=20250611160317&page=0,metro,,2025-06-11 16:15,"日本一個組織估算，南海海槽地震可能會造成日本1466萬億日圓，折合超過79萬億港元的經濟損失。

日本土木學會發布最新的估算數據，說如果發生南海海槽大地震，之後20年的經濟損失，將達到1466萬億日圓，這個數字較上次2018年的估算結果，多出56萬億日圓；亦高出日本政府在今年3月公布的估算結果，當時政府表示，地震可能會造成近30萬人死亡，以及292萬億日圓經濟損失。 土木學會說，它們估算的損失金額較高，是因為計算了災後20年的損失，而政府只是計算災後1年。

日本政府預測，南海海槽未來30年，將有80%機率發生大地震。"
馬斯克:對一些關於特朗普帖文感到後悔,2025-06-11 15:55,https://www.metroradio.com.hk/news/default.aspx?SearchText=&NewsId=20250611155500&page=0,metro,,2025-06-11 16:15,"美國億萬富豪、Tesla行政總裁馬斯克(Elon Musk)，上星期在旗下社交平台X連發多個帖文，與美國總統特朗普(Donald Trump)隔空罵戰，他今日在X上發文指，對上星期發布有關特朗普的一些帖文感到後悔，部份內容太過過份(They went too far  )。

在馬斯克帖文後，Tesla股價在美股收市後交易時段抽升百分之2。

馬斯克上星期多次發文批評特朗普推動的「大而美」減稅及支出法案，又指特朗普全靠他才能勝出總統大選，而特朗普亦反擊指將會取消馬斯克旗下SpaceX的聯邦政府合約。

馬斯克又一度表示，特朗普的名字在故淫媒富豪愛潑斯坦(Jeffrey Epstein)名單上，但有關帖文已被刪除。"
Temu因虛假廣告在韓被罰款逾200萬元,2025-06-11 15:51,https://www.metroradio.com.hk/news/default.aspx?SearchText=&NewsId=20250611155111&page=0,metro,,2025-06-11 16:00,"跨境電商平台Temu被指發布虛假廣告，被南韓反壟斷執法機構「公正交易委員會」下達整改命令，並處以3億5700萬韓圜(約204萬港元)的罰款，是Temu首次被公正交易委員會制裁。

韓聯社報道，Temu涉嫌從2023年9月至近期，進行抽獎贈品活動，但沒有明確標記具體規則，令消費者誤解，以為可以輕易獲得積分或贈品。 公正交易委認為，Temu的廣告阻礙公平交易，屬於欺騙性廣告。

此外，Temu在官網設彈窗廣告，聲稱向首次安裝移動應用程式的用戶，提供價值相當於15萬韓圜的優惠券。 優惠券頁面長期存在，Temu卻在廣告中標記「剩餘時間」，阻礙消費者合理決策，因此公正交易委認為此舉是違法行為。

另外，Temu還因涉嫌違反《關於在電商等平台保護消費者權益的法律》，被處以100萬韓圜的罰款。"
金力永磁:已獲出口許可證依法依規出口磁材等,2025-06-11 15:41,https://www.metroradio.com.hk/news/default.aspx?SearchText=&NewsId=20250611154110&page=0,metro,,2025-06-11 16:00,"金力永磁(06680)表示，在中重稀土相關物項出口管制措施出台後，公司已按照規定開展出口申報工作，並已陸續獲得國家主管部門頒發的出口許可證，出口區域包括美國、歐洲及東南亞等，出口產品包括磁材、組件及電機轉子。

金力永磁在深交所互動平台上表示，今年首季出口銷售收入3億1200萬元人民幣，對美國出口的銷售收入為1億2200萬元人民幣，佔營業收入百分之6.94，公司不涉及軍工業務，將繼續嚴格遵照國家法律法規及相關政策，對於涉及出口管制公告相關類別的產品，將依照規定向相關主管部門進行申請，並在獲得許可後進行出口。

中美在倫敦舉行的貿易磋商進展順利，美國商務部長盧特尼克(Howard Lutnick)表示，美國與中國達成的貿易框架和落實計劃，應能解決稀土和磁材的限制問題。

商務部早前表示，中國充分考慮各國在民用領域的合理需求與關切，依法依規對稀土相關物項出口許可申請進行審查，已依法批準一定數量的合規申請，並將持續加強合規申請的審批工作。"
過去五年131名學童疑輕生 中學生佔逾九成,2025-06-11 15:38,https://www.metroradio.com.hk/news/default.aspx?SearchText=&NewsId=20250611153856&page=0,metro,,2025-06-11 16:00,"教育局局長蔡若蓮表示，過在5年中、小學生懷疑輕生個案共有131宗，前年和去年分別有32宗和28宗，中學生佔九成一。

蔡若蓮回覆立法會議員書面質詢時指，局方十分重視教師及學生的精神健康，並持續加強識別和支援有精神健康風險的學生，例如在今個學年增辦約40個主題式的教師培訓工作坊，介紹支援有精神健康需要的學生的實用技巧、 輔導方法和介入策略，並且為家長舉辦主題講座。

她又指，如果學校懷疑學生有輕生危機，會安排輔導人員及早支援，並在需要時尋求專業支援，確保能採取適當的介入措施，而在全港中學推行的「三層應急機制」已經延長至今年底，並且有所優化。"
據報美國上屆政府曾監視馬斯克的訪客,2025-06-11 15:32,https://www.metroradio.com.hk/news/default.aspx?SearchText=&NewsId=20250611153231&page=0,metro,,2025-06-11 15:45,"《華爾街日報》報道，美國上屆政府曾監視拜訪億萬富豪馬斯克(Elon Musk)的外國人，擔心外國勢力試圖影響馬斯克。

馬斯克擁有5間大型企業及敏感的政府合約，同時掌握可接觸世界各國高級官員的渠道。 《華爾街日報》引述消息人士報道，2022至23年，包括國土安全部和司法部等美國政府部門，追蹤出入馬斯克名下房產的外國人，調查重點在於判斷他有沒有受到來自東歐及其他地區的外部勢力影響。 報道指，有關部門並未提出任何指控，調查進展不明，但聯邦調查局等多個部門的官員，已聽取調查的簡報。

《華爾街日報》去年10月曾引述匿名消息人士報道，馬斯克一直跟俄羅斯總統普京(Vladimir Putin)定期聯繫，俄羅斯否認。"
[歐洲股市]早段個別發展,2025-06-11 15:25,https://www.metroradio.com.hk/news/default.aspx?SearchText=&NewsId=20250611152537&page=0,metro,,2025-06-11 15:45,"歐洲股市早段個別發展。

英國富時100指數報8864點，升11點，升幅百分之0.13。

德國DAX指數報24007點，跌26點，跌幅百分之0.11。

法國CAC指數報7821點，升17點，升幅百分之0.22。"
[內地股市]收市上升,2025-06-11 15:23,https://www.metroradio.com.hk/news/default.aspx?SearchText=&NewsId=20250611152302&page=0,metro,,2025-06-11 15:45,"內地股市收市上升。

上證綜合指數收市報3402點，升17點，升幅百分之0.52。

深證成分指數收市報10246點，升83點，升幅百分之0.83。

滬深300指數收市報3894點，升29點，升幅百分之0.75。"
[日本股市]收市升0.55%,2025-06-11 15:21,https://www.metroradio.com.hk/news/default.aspx?SearchText=&NewsId=20250611152103&page=0,metro,,2025-06-11 15:45,"日本股市收市上升。

日經平均指數收市報38421點，升209點，升幅百分之0.55。"
[台灣股市]收市升1.02%,2025-06-11 15:19,https://www.metroradio.com.hk/news/default.aspx?SearchText=&NewsId=20250611151926&page=0,metro,,2025-06-11 15:45,"台灣股市收市上升。

加權指數收市報22470點，升227點，升幅百分之1.02。"
中汽協:內地5月汽車銷量268.6萬部按年升11.2%,2025-06-11 15:19,https://www.metroradio.com.hk/news/default.aspx?SearchText=&NewsId=20250611151900&page=0,metro,,2025-06-11 15:45,"中國汽車工業協會公布，5月汽車銷量268萬6千部，按月上升百分之3.7，按年上升百分之11.2，當中，新能源汽車銷量130萬7千部，按年上升百分之36.9，佔整體銷量百分之48.7。

今年首5個月，內地汽車總銷量1274萬8千部，按年上升百分之10.9，新能源汽車銷量560萬8千部，按年增長百分之44，佔總銷量的百分之44。

中汽協表示，當前中國汽車行業整體運行呈現穩中向好態勢，市場活力不斷釋放，但行業盈利水平持續下滑，增量不增利的局面未有改善，以無序價格戰為主要表現形式的內捲式競爭，是行業效益下降的重要因素。   。

在出口方面，5月汽車出口55萬1千部，按月上升百分之6.6，按年上升百分之14.5，當中新能源汽車出口21萬2千部，環月上升百分之6.1，按年上升百分之1.2倍。"
[澳紐股市]收市上升,2025-06-11 15:18,https://www.metroradio.com.hk/news/default.aspx?SearchText=&NewsId=20250611151850&page=0,metro,,2025-06-11 15:45,"澳紐股市收市上升。

標普澳洲200指數收報8592點，升4點，升幅百分之0.06。

新西蘭50隻成份股指數收報12605點，升41點，升幅百分之0.33。"
天文台指「蝴蝶」已增強為熱帶風暴,2025-06-11 15:15,https://www.metroradio.com.hk/news/default.aspx?SearchText=&NewsId=20250611151540&page=0,metro,,2025-06-11 15:45,"一號戒備信號現正生效，並會在今日大部分時間維持。 天文台會評估是否需要在明日稍後至星期五，改發三號強風信號。

天文台指，熱帶低氣壓「蝴蝶」已增強為熱帶風暴，目前集結在香港之西南偏南約640公里，預料向西移動，時速約12公里，橫過南海中部，大致移向海南島。 按照現時預測路徑，蝴蝶今日仍與本港保持約600至700公里距離，預料本港今日尚未普遍吹強風，但其相關外圍雨帶引致的狂風驟雨，間中影響南海北部及廣東沿岸。

天文台預料，蝴蝶會在今明兩日逐漸增強並大致移向海南島，隨後移至雷州半島一帶，天文台會視乎其強度、 與本港的距離及本地風力變化，評估是否需要在明日稍後至星期五，改發三號強風信號。 隨著蝴蝶靠近沿岸地區，本周後期風勢頗大，間中有狂風大驟雨，海有湧浪，市民應遠離岸邊及停止所有水上活動。"
陳美寶指個別隧道減價對巴士成本影響輕微,2025-06-11 15:05,https://www.metroradio.com.hk/news/default.aspx?SearchText=&NewsId=20250611150501&page=0,metro,,2025-06-11 15:45,"政府早前收回大欖隧道專營權，並將雙層巴士的隧道費由213元大減至43元。 運輸及物流局局長陳美寶預計，巴士營辦商每年可節省約1億9千萬元隧道費開支，但有關費用佔巴士整體營運成本少於百分之7，個別隧道減價對成本影響輕微。

陳美寶回覆立法會議員書面質詢時指，政府一直把關巴士收費水平，去年處理加價申請時，已經特別考慮到大欖隧道減價後，營辦商整體成本會稍為下降的情況，並同時透過「豁免隧道費基金」盡量抵消車費加幅，當中以九巴為例，在計及「基金」0.9個百分點的紓緩作用後,整體票價加幅由百分之5.2降至百分之4.3。"
[本港股市]午後續升逾200點,2025-06-11 14:58,https://www.metroradio.com.hk/news/default.aspx?SearchText=&NewsId=20250611145819&page=0,metro,,2025-06-11 15:15,"中美在倫敦就貿易框架協議達成共識，港股午後升幅曾經擴大至276點，恒生指數創近三個月高位，最新報24382點，升219點。

中資金融股上升，中人壽(02628)升近半成，平保(02318)、工行(01398)、建行(00939)及招行(03968)升百分之1。

新經濟股普遍上升，阿里巴巴(09988)、百度(09888)及快手(01024)升百分之1，京東(09618)、網易(09999)升約百分之2，騰訊(00700)靠穩，但美團(03690)偏軟。

多間車企承諾將供應商支付帳款期間限制在60日內，吉利(00175)上升，比亞迪(01211)升百分之4，理想汽車(02015)偏軟，蔚來(09866)升百分之4，小鵬(09868)升百分之2，長城汽車(02333)上升。

其他汽車相關股都上升，中升控股(00881)升近百分之3，寧德時代(03750)升百分之3，浙江世寶(01057)升百分之3，耐世特(01316)升百分之2。

康師傅(00322)今日除淨，股價逆市跌百分之3，農夫山泉(09633)都跌百分之2。

鋼鋁股繼續上升，中國宏橋(01378)升百分之4，中國鋁業(02600)升百分之3，馬鋼(00323)及鞍鋼(00347)升百分之4。

稀土股繼續炒上，中國石墨(02237)升三成六，南方錳業(01091)及中國鐵鈦(00893)升兩成，中國稀土(00769)升一成四，金力永磁(06680)升百分之3，稀美科技(00601)升一成三，烯石電車新材料(06128)升半成。

國企指數報8869點，升101點。"
新世界等「滶晨」暫收約3000票 超購近21倍,2025-06-11 14:54,https://www.metroradio.com.hk/news/default.aspx?SearchText=&NewsId=20250611145402&page=0,metro,,2025-06-11 15:00,"新世界(00017)夥拍帝國集團、資本策略(00497)、麗新發展(00488)與港鐵合作的黃竹坑港島南岸「滶晨」星期六將以價單形式發售138伙，新世界營業及市務部總監何家欣表示，截至昨晚，已經累收約3000票，按首張銷售安排138伙計，超額認購近21倍，超過一半是港島區買家，也有內地及海外買家，例如日本等 ，項目星期五下午2時截票，B組將於同日下午5時進行第一輪抽籤，暫時未有加推計劃，若有消息將會在稍後公布。

她表示，項目早前招標出售35伙，合共套現逾18億元，每伙平均成交價逾5000萬元，平均呎價逾3萬8千元。"
景順趙耀庭:中美關稅不確定性最差況已過,2025-06-11 14:39,https://www.metroradio.com.hk/news/default.aspx?SearchText=&NewsId=20250611143953&page=0,metro,,2025-06-11 15:00,"中美兩國就貿易框架達成共識，景順亞太區環球市場策略師趙耀庭表示，是良好訊號，意味兩國間關稅不確定性已走過最差情況，預計整體關稅水平趨於緩和，但中國出口至美國將呈下降趨勢，兩國間貿易會繼續減少，或影響美國經濟狀況。

他表示，內地有足夠刺激工具應對關稅不利因素及支持今年經濟增長，過去一段時間推出減息降準等措施，認為總規模顯著，預計內地下半年再推出支持消費及房地產措施。

趙耀庭表示，美國聯儲局是否減息陷入兩難，大部份常規硬數據反映利率應保持不變，但軟數據顯示經濟可能放緩，說明應該減息，相信美國利率可能較長時間內保持不變，並在經濟活動出現顯著放緩情況下大幅減息。

他表示，貿易戰全部潛在影響尚未浮現，美國經濟放緩及物價上升的幅度仍然不明朗，所以看好歐洲、英國、亞洲股票，美國除外的企業及主權債券、新興市場當地貨幣債券、歐元及英鎊這類型的資產，投資者應對投資組合的風險持審慎態度，可藉此機會將投資組合分散部署至不同地區及資產類別，降低集中度以應對市場波動。"
陳美寶:對增加長期佔用咪錶位重犯者罰則持開放態度,2025-06-11 14:36,https://www.metroradio.com.hk/news/default.aspx?SearchText=&NewsId=20250611143647&page=0,metro,,2025-06-11 15:00,"對於路邊停車位被部份商舖長期佔用，以及未有入錶的情況，運輸及物流局局長陳美寶表示，運輸署的咪錶營辦商會派員每日巡查，過去三年每年向警務處及其他相關部門轉介，以非車輛物品佔用泊車位個案有超過200宗，轉介至警方的未付款的個案每年平均有12萬宗。

她在回應立法會議員質詢時表示，運輸署已計劃在第四季，在咪錶位需求較大、非法佔用咪錶比率較高的地點，進行為期兩個月的試點計劃，測試人工智能感光元件，視乎成效進一步推展計劃，並對引入車牌辨識系統技術持開放態度，並會研究系統的可靠性，連同更新咪錶系統硬件和軟件的成本效益一併考慮對香港的適用性。

有議員關注如何針對長期非法佔用車位的重犯者，陳美寶表示，會持開放態度考慮是否增加罰則的阻嚇作用。"
世邦魏理仕邀請財團就新田科技城提交參與意向,2025-06-11 14:27,https://www.metroradio.com.hk/news/default.aspx?SearchText=&NewsId=20250611142757&page=0,metro,,2025-06-11 14:45,"世邦魏理仕獲科技園公司，委任為新田科技城項目的商業、營運及投資模式首席顧問，將就項目邀請有興趣的發展商及財團提交計劃參與意向，6月21日中午截止。

由科技園公司主導的新田科技城項目，預計於2027年動工，項目位於創新科技區的策略性位置，將組成創科發展樞紐，並成為綜合創科生態圈，促進人工智能與數據科學、生命與健康科技、新材料、新能源、微電子、電子及先進製造等領域的發展。

世邦魏理仕香港估值及諮詢服務部主管鄭亥延表示，整個新田科技城為香港新型工業化的主要驅動力，並以第二大經濟引擎助力香港實現「南金融、北創科」的新產業布局，項目為打造跨境創新樞紐提供難得的機遇，邀請發展商表達對項目的興趣及看法，共同打造一個互利共贏的公私合作模式，以實現豐厚的投資回報和長期資本增值的強大潛力。"
澳航旗下捷星亞洲7月底停運,2025-06-11 14:24,https://www.metroradio.com.hk/news/default.aspx?SearchText=&NewsId=20250611142428&page=0,metro,,2025-06-11 14:30,"澳洲航空(Qantas)旗下廉航--捷星亞洲(Jetstar Asia)將會在7月底停止營運，並裁員約500人，在停運前會逐歩減少航班，受影響的乘客可以獲全額退款；另外兩間以捷星為名的廉航--捷星航空及捷星日本就不受影響。

總部位於新加坡的捷星亞洲發聲明指，近年供應商成本、機場費用等不斷上漲，加上競爭日益激烈，公司面臨越來越大挑戰，對提供廉價機票造成難以承受壓力，行政總裁塔利指，公司營運20年來只有6年實現盈利，預計今個財政年度虧蝕3500萬澳元。

澳洲航空行政總裁哈德森形容決定艱難，又指「捷星亞洲」部份供應商成本上漲兩倍，改變公司的成本基礎，結束捷星亞洲會帶來1億7500萬澳元的一次性支出。

捷星亞洲2004年成立，主要營運來往新加坡和周邊地區的航班，目前有16條航線，是以璋宜機場為基地的第三大航空公司，樟宜機場發聲明指，對捷星亞洲停運感到失望，當務之急是支援受影響乘客。"
加州州長紐森炮轟特朗普激化洛杉磯局勢,2025-06-11 14:12,https://www.metroradio.com.hk/news/default.aspx?SearchText=&NewsId=20250611141213&page=0,metro,,2025-06-11 14:30,"美國加州州長紐森(Gavin Newsom)就洛杉磯局勢發表講話，他炮轟總統特朗普(Donald Trump)激化原本已經緊張的局勢，令衝突升級。

紐森批評執法機構不加區別地針對移民家庭，洛杉磯民眾因而走上街頭，行使憲法賦予的言論自由和集會權利。 之後，特朗普未徵詢加州執法部門，就擅自調動加州2000名國民警衛隊，並非法地部署在街上，紐森批評特朗普的做法，激化原本就緊張的局勢，令部分人開始採取暴力及破壞的行為；他說，當局不會容忍這些行為，並同時指出，國民警衛隊和海軍陸戰隊，接受的是海外作戰，而非國內的執法訓練，強調加州會持續奮戰，呼籲民眾不要向特朗普屈服。"
