title,date,url,source,section,scrape_time,news_content
[美股收市]個別發展:道指跌0.38% 納指升0.15% 標指跌0.12%,2025-07-31 08:27,https://www.metroradio.com.hk/news/default.aspx?SearchText=&NewsId=20250731082759&page=0,metro,,2025-07-31 08:45,"美股收市個別發展，三大指數中，道指及標普500指數下跌；納指上升；但整體變動不大。

美國聯儲局無應總統特朗普(Donald Trump)要求減息，繼續維持利率不變，但有兩名決策官員傾向減息0.25厘。 聯儲局主席鮑威爾(Jerome Powell)表示，評估關稅影響仍處於相當早期階段，他預計需時了解貿易關稅如何影響通脹。

道瓊斯工業平均指數收報44461點，跌171點，跌幅近百分之0.4。

納斯達克指數收報21129點，升31點，升幅約百分之0.15。

標準普爾500指數收報6362點，跌7點，跌幅百分之0.12."
鮑威爾:關稅對部分商品構成壓力廣泛影響未確定 獨立的央行對公眾有益,2025-07-31 07:42,https://www.metroradio.com.hk/news/default.aspx?SearchText=&NewsId=20250731074239&page=0,metro,,2025-07-31 08:00,"美國聯儲局主席鮑威爾(Jerome Powell)表示，大多數長期通脹預期指標與聯儲局目標一致。 他指出，關稅對部分商品構成壓力，但更廣泛的影響尚未確定，自6月會議到現時，不確定性並未進一步減弱，有待解決很多不確定因素，而評估關稅影響，仍處於相當早期階段，他預計了解貿易關稅如何影響通脹，是一個緩慢的過程，完全了解需要時間。 另外，他說，獨立的央行，對公眾有益。

鮑威爾說，尚未就9月的貨幣政策作出任何決定，而下次聯儲局會議，將獲得兩份就業和通脹報告，局方正拭目以待。"
聯儲局會後聲明:美國經濟前景不確定性仍高企通脹仍略高,2025-07-31 07:26,https://www.metroradio.com.hk/news/default.aspx?SearchText=&NewsId=20250731072642&page=0,metro,,2025-07-31 08:00,美國聯儲局公開市場委員會發表會後聲明，指美國經濟前景不確定性仍然高企，通脹仍略高，失業率維持低位，就業市場狀況仍然穩健；而近期指標顯示，美國今年上半年經濟活動增長放緩。 委員會尋求實現充分就業及百分之2的較長期通脹目標。 另外，委員會將繼續減持美國國債、機構債和機構抵押貸款支持證券。
港匯觸及弱方兌換保證 金管局入市買入39.25億港元,2025-07-31 06:55,https://www.metroradio.com.hk/news/default.aspx?SearchText=&NewsId=20250731065517&page=0,metro,,2025-07-31 07:15,"港匯持續偏弱，觸及7.85弱方兌換保證，金管局入市買港元。

金管局在星期三紐約市尾段，承接39億2500萬港元沽盤，沽出美元，令本港銀行體系結餘在明日跌至825億5200萬港元。"
特朗普: 美國將由8月1日起對印度加徵25%關稅 蘋果股價應聲下跌,2025-07-31 06:51,https://www.metroradio.com.hk/news/default.aspx?SearchText=&NewsId=20250731065120&page=0,metro,,2025-07-31 07:00,"美國總統特朗普(Donald Trump)表示，美國將由8月1日起，對從印度進口的商品加徵兩成半關稅，印度還將於8月1日面臨一項罰款，但未有說明是哪種罰款，亦未有說明罰款金額和原因。 去年印度對美國的商品出口額約870億美元，其中包括服裝、藥品、寶石和珠寶及石化產品等勞動密集型產品。     目前美國對印度的貿易逆差457億美元。

特朗普說，雖然印度是美國的朋友，但多年來美國與印度的貿易往來相對較少，因為印度的關稅太高，是世界上最高關稅的其中一個國家，而且他們的非貨幣貿易壁壘是所有國家中最嚴格，亦最令人討厭。 印度一直以來都向俄羅斯購買絕大多數軍事裝備，並且與中國一樣，都是最大的俄羅斯能源買家。

印度被加徵關稅消息傳出後，蘋果公司股價在美股開市前已應聲下跌，蘋果將銷往美國的iPhone生產早前由中國轉移至印度，此舉招致特朗普更多批評。"
美國宣布8月1日起對進口銅產品徵收50%關稅,2025-07-31 06:43,https://www.metroradio.com.hk/news/default.aspx?SearchText=&NewsId=20250731064300&page=0,metro,,2025-07-31 07:00,"美國宣布8月1日起對進口銅產品徵收五成關稅。

美國總統特朗普(Donald Trump)當地星期三簽署公告，由8月1日起，對進口的銅半成品及銅含量高的衍生品，統一徵收五成關稅"
天文台早上6點10分取消雷暴警告,2025-07-31 06:40,https://www.metroradio.com.hk/news/default.aspx?SearchText=&NewsId=20250731064021&page=0,metro,,2025-07-31 07:00,天文台在早上6點10分取消雷暴警告。
鮑威爾:了解貿易關稅如何影響通脹需時過程緩慢,2025-07-31 06:18,https://www.metroradio.com.hk/news/default.aspx?SearchText=&NewsId=20250731061813&page=0,metro,,2025-07-31 06:30,美國聯儲局主席鮑威爾(Jerome Powell)預計，了解貿易關稅如何影響通脹，是一個緩慢的過程，完全了解需要時間。
特朗普在聯儲局宣布利率決定前再呼籲減息 指維持高利率是傷害民眾,2025-07-31 06:11,https://www.metroradio.com.hk/news/default.aspx?SearchText=&NewsId=20250731061153&page=0,metro,,2025-07-31 07:15,"美國總統特朗普(Donald Trump)在美國聯儲局宣布利率決定前，再度呼籲減息，認為維持高利率是在傷害民眾。

特朗普指出，早前公布的數據顯示，美國第二季經濟增長百分之3，反彈幅度超出預期，通脹並無上升，認為現在必須減息，讓民眾購買房屋，對房屋貸款進行再融資。"
特朗普在聯儲局宣布利率決定前再呼籲減息,2025-07-31 06:11,https://www.metroradio.com.hk/news/default.aspx?SearchText=&NewsId=20250731061153&page=0,metro,,2025-07-31 06:30,"美國總統特朗普(Donald Trump)在美國聯儲局宣布利率決定前，再度呼籲減息。

特朗普指出，早前公布的數據顯示，美國第二季經濟增長百分之3，反彈幅度超出預期，通脹並無上升，認為現在必須減息，讓民眾購買房屋，對房屋貸款進行再融資。"
[歐洲股市收市]全線上升:英股升0.01% 德股升0.19% 法股升0.06%,2025-07-31 05:53,https://www.metroradio.com.hk/news/default.aspx?SearchText=&NewsId=20250731055341&page=0,metro,,2025-07-31 06:15,"歐洲三大股市收市全線上升，升幅輕微。 德國股市表現最好，升近百分之0.2；法國股市升百分之0.06；英國股市升百分之0.01。

投資者評估美國關稅對企業盈利的影響，歐股靠穩。

倫敦富時100指數收報9136點，升0.62點，升幅百分之0.01。

法蘭克福DAX指數收報24262點，升44點，升幅百分之0.19。

巴黎CAC指數收報7861點，升4點，升幅百分之0.06."
[期貨夜市]8月恒指夜期收報24934點 低水243點,2025-07-31 05:49,https://www.metroradio.com.hk/news/default.aspx?SearchText=&NewsId=20250731054912&page=0,metro,,2025-07-31 06:00,"港股低收；恒生指數昨日收報25176點，跌347點，跌幅百分之1.36，大市成交3196億幾。

港股下跌，期指夜市亦跟隨下跌。

8月恒指夜期收報24934點，跌244點，低水243點，合約成交15639張.

8月國指夜期收報8955點，跌86點，低水83點，合約成交20362張。"
國際調解院總部大樓竣工 明日交付國際調解院籌備辦公室,2025-07-31 05:41,https://www.metroradio.com.hk/news/default.aspx?SearchText=&NewsId=20250731054148&page=0,metro,,2025-07-31 06:00,"國際調解院總部大樓的翻新工程完成，律政司司長林定國和外交部駐香港特區特派員公署特派員崔建春，昨日到總部大樓參觀，標誌着大樓配套，已準備好供國際調解院日後作總部和相關用途。 林定國和崔建春參觀國際調解院總部大樓的主大堂、會議廳、調解室和展覽區等，並聽取建築署署長李翹彥介紹大樓的活化過程和各項設施。

國際調解院總部大樓，由屬於二級歷史建築的舊灣仔警署改建而成，工程保留原有主要建築特色，並採取最少及可還原改動為設計原則，配合國際調解院總部的形象和功能。

國際調解院作為世界上首個專門以調解方式解決國際爭端的政府間國際法律組織，總部座落香港商業中心區的地標建築，除彰顯獨特國際地位和配合運作需要，同時亦保育和活化舊灣仔警署，彰顯政府對保育和活化歷史建築的重視和決心。 隨著國際調解院總部大樓竣工，總部大樓明日正式交付國際調解院籌備辦公室，為國際調解院成立和開幕作好準備。"
鄧炳強:各紀律部隊及輔助部隊善用無人機執法提升工作效率,2025-07-31 05:34,https://www.metroradio.com.hk/news/default.aspx?SearchText=&NewsId=20250731053451&page=0,metro,,2025-07-31 06:00,"保安局局長鄧炳強表示，各紀律部隊及輔助部隊因應工作需要，配備不同大小的無人機及相關的儀器系統，以提升工作效率，從而更有效調配人力資源。

治安巡邏及預防罪案方面，警務處在今年5月，正式推行小型無人機行動調配先導計劃，在邊界警區及西九龍總區，使用無人機執行巡邏任務。 先導計劃自推出至今，已經協助警方拘捕3人，並偵破4宗案件。

另外，鄧炳強表示，警務處會檢視相關工作的進行情況及成效，並會研究優化先導計劃，進一步擴大試行範圍至長洲分區及中環警區，預計在今年第四季推行。 警務處現時亦有就特定行動使用無人機，包括在鄉郊地區運用小型無人機進行反爆竊巡邏。 如果偵測到其他違法行為，例如非法傾倒廢物活動 ,會轉介相關部門跟進。"
天文台:雷暴警告生效延長至今早7點半 預料香港有幾陣狂風雷暴,2025-07-31 05:27,https://www.metroradio.com.hk/news/default.aspx?SearchText=&NewsId=20250731052724&page=0,metro,,2025-07-31 05:45,"天文台凌晨1點15分發出的雷暴警告，有效時間延長至今早7點半，預料香港有幾陣狂風雷暴。

雷暴發生時，應請採取有關預防措施，包括如身處室外，應到安全地方躲避；離開水面，切勿在戶外游泳或進行其他戶外水上運動；切勿站立於高地或接近導電的物體、樹木或桅杆。"
美國終止對所有低價值包裹的關稅豁免,2025-07-31 05:19,https://www.metroradio.com.hk/news/default.aspx?SearchText=&NewsId=20250731051924&page=0,metro,,2025-07-31 05:30,"美國終止對所有低價值包裹的關稅豁免。

美國白宮表示，根據總統特朗普(Donald Trump)當地星期三簽署的一項行政命令，由8月29日起，通過非國際郵政網絡寄往美國、申報價值在800美元及以下的包裹，將被徵收所有適用的關稅。

自今年5月2日起，特朗普政府已暫停對來自中國內地和香港的低價值包裹，適用最低限度關稅豁免待遇。 而最近簽署的《大而美稅收與支出法案》，廢除了最低限度關稅豁免的法律依據。 由2027年7月1日起，來自全球的低價值包裹將不再享受關稅豁免，特朗普比《大而美法案》的要求更早採取行動，暫停最低限度關稅豁免，以應對國家緊急情況，拯救美國人民和企業。

通過郵政系統寄送的貨物將面臨兩種關稅中的其中一種，「從價稅」是按寄件國的有效關稅稅率徵收；又或者在為六個月內，徵收每件貨物80至200美元不等的特定關稅，具體視乎寄件國的關稅水平而定。"
加拿大央行宣布基準利率維持目前2.75厘不變,2025-07-31 04:21,https://www.metroradio.com.hk/news/default.aspx?SearchText=&NewsId=20250731042138&page=0,metro,,2025-07-31 04:30,"加拿大銀行央行宣布，基準利率維持目前2.75厘不變。

央行指，加拿大第一季度為應對關稅問題而提前出口，經濟實現強勁增長，但第二季度國內生產總值可能下降約百分之1.5，這種收縮主要由於提前出口後出口急劇逆轉，以及關稅威脅，導致美國對加拿大商品需求下降。 多項經濟指標表明，自1月份以來，加拿大經濟供應過剩局面有所加劇。 雖然近幾個星期美國貿易政策有所明朗 ,但美國貿易行動難以預測，貿易談判仍然充滿變數，新的行業關稅威脅持續存在。

加拿大央行預測，在目前關稅條件下，隨著出口企穩和家庭支出逐步增加，加拿大經濟增速今年下半年將回升至約百分之1，但經濟疲軟將持續到明年。 若關稅問題緩和，加拿大經濟增長反彈速度將更快；若關稅問題升級，經濟將在今年內持續萎縮。

今年3月，加拿大央行宣布將基準利率下調0.25厘，降至2.75厘。 4月和6月維持基準利率不變。"
天文台:雷暴警告生效延長至清晨5點半 預料香港有幾陣狂風雷暴,2025-07-31 04:13,https://www.metroradio.com.hk/news/default.aspx?SearchText=&NewsId=20250731041343&page=0,metro,,2025-07-31 04:30,"天文台凌晨1點15分發出的雷暴警告，有效時間延長至清晨5點半，預料香港有幾陣狂風雷暴。

雷暴發生時，應請採取有關預防措施，包括如身處室外，應到安全地方躲避；離開水面，切勿在戶外游泳或進行其他戶外水上運動；切勿站立於高地或接近導電的物體、樹木或桅杆。"
天文台:短期內香港廣泛地區或受大雨影響,2025-07-31 04:10,https://www.metroradio.com.hk/news/default.aspx?SearchText=&NewsId=20250731041031&page=0,metro,,2025-07-31 04:30,天文台凌晨2點45分發出特別天氣提示，指短期內香港廣泛地區可能受大雨影響，市民應提高警覺。
安哥拉多地發生騷亂22死197傷 目前當地治安已回復穩定,2025-07-31 03:46,https://www.metroradio.com.hk/news/default.aspx?SearchText=&NewsId=20250731034631&page=0,metro,,2025-07-31 04:00,"非洲西南部國家安哥拉多地星期三發生騷亂，造成22人死亡，197人受傷，目前當地治安已回復穩定。

安哥拉全國出租車司機協會在本周一開始為期3天的罷工，抗議燃油價格上漲和出行票價調整。 罷工導致首都羅安達所在的羅安達省多個區域交通癱瘓，街道被封。 一群不法分子利用今次罷工，攻擊車輛並洗劫商鋪，之後騷亂蔓延至萬博省、本格拉省和威拉省。

安哥拉內政部長奧梅姆表示，安哥拉內政部正全力恢復和維持公共秩序，目前羅安達省的公共交通系統已恢復營運。 他強調，安哥拉政府將維護國家公共安全，防止任何可能影響社會正常生活的事件發生。 截至目前，共有1214人因為參與破壞和搶劫被捕。"
俄羅斯堪察加半島近海再次發生強震,2025-07-31 03:34,https://www.metroradio.com.hk/news/default.aspx?SearchText=&NewsId=20250731033434&page=0,metro,,2025-07-31 04:00,"俄羅斯堪察加半島近海再次發生強震。

 

俄羅斯科學院的統一地球物理局堪察加分部消息指，堪察加半島繼星期三發生黎克特制8.8級強震後，同日再次發生6.5級地震，地震發生在距離位於千島群島的北庫里爾斯克區178公里處，震源深度68公里，之後該區域又記錄到一次5.3級地震；已伴隨發生了100多次5級及以上的餘震。"
美國聯儲局一如市場預期維持聯邦基金利率目標範圍4.25厘至4.5厘不變,2025-07-31 03:23,https://www.metroradio.com.hk/news/default.aspx?SearchText=&NewsId=20250731032332&page=0,metro,,2025-07-31 03:45,"美國聯邦儲備局公開市場委員會結束一連兩日的貨幣政策會議，委員會以9票對2票議決通過維持利率不變，符合市場預期。 投反對的兩票，是聯儲局理事沃勒及鮑曼，兩人都傾向減息0.25厘。

聯邦基金利率目標範圍，維持4.25厘至4.5厘不變，是聯儲局今年以來，連續第五次會議無調整利率。

聯儲局下次貨幣政策會議，將於9月16日至17日舉行。 利率期貨顯示，市場目前估計，聯儲局9月會議將繼續維持利率不變的機會率約三成八，減息0.25厘的機會率約五成半。"
天文台凌晨1點15分發出雷暴警告有效至凌晨3點半 預料香港幾陣狂風雷暴,2025-07-31 02:31,https://www.metroradio.com.hk/news/default.aspx?SearchText=&NewsId=20250731023114&page=0,metro,,2025-07-31 02:45,"天文台凌晨1點15分發出雷暴警告，有效時間至凌晨3點半，預料香港有幾陣狂風雷暴.

雷暴發生時，應請採取有關預防措施，包括如身處室外，應到安全地方躲避；離開水面，切勿在戶外游泳或進行其他戶外水上運動；切勿站立於高地或接近導電的物體、樹木或桅杆。"
天文台:廣闊低壓槽令珠江口一帶有雷雨區 未來一兩小時本港雨勢較大,2025-07-31 02:27,https://www.metroradio.com.hk/news/default.aspx?SearchText=&NewsId=20250731022735&page=0,metro,,2025-07-31 02:45,天文台凌晨2點發出特別天氣提示，指受廣闊低壓槽影響，珠江口一帶持續有雷雨區發展，預料未來一兩小時本港雨勢較大，市民應留意天氣變化。
天文台:昨傍晚石壁潮汐站觀察到約7厘米水位異常,2025-07-31 01:58,https://www.metroradio.com.hk/news/default.aspx?SearchText=&NewsId=20250731015806&page=0,metro,,2025-07-31 02:15,"天文台昨晚8點發出的海嘯報告，指昨日上午7點24分在堪察加東面離岸海域發生8.8級的猛烈地震，這次地震已產生海嘯。

第一兩個抵達香港的海嘯波的波幅很小,並未能觀察得到。 隨後天文台在昨晚約6點40分，在石壁潮汐站觀察到約7厘米的水位異常，估計是由隨後抵達的海嘯波所引起，亦是今次海嘯最後一個海嘯報告。"
天文台 : 晚上石壁潮汐站錄得7厘米水位異常,2025-07-30 23:58,https://www.metroradio.com.hk/news/default.aspx?SearchText=&NewsId=20250730235817&page=0,metro,,2025-07-31 00:15,"天文台科學主任發表網誌指，俄羅斯堪察今早發生8.8級大地震，屬於淺層地震，由於香港與震中距離較遠，因此並無震感。

地震引發海嘯，首一兩個抵達香港的海嘯波的波幅很小，並未能觀察得到，其後於今日下午約6時40分及7時16分左右，於石壁潮汐站觀察到約7厘米的水位異常，估計是由隨後抵達的海嘯波所引起的，之後海嘯波幅逐漸減弱。

天文台指，如果港人外遊，萬一遇到海嘯的前兆現象，應盡快遠離岸邊或淺水水域，前往內陸或高地。"
美國6月NAR未完成交易二手樓銷售指數按月跌0.8%,2025-07-30 23:49,https://www.metroradio.com.hk/news/default.aspx?SearchText=&NewsId=20250730234919&page=0,metro,,2025-07-31 00:15,美國全美不動產協會(NAR)公布，6月未完成交易二手樓銷售指數按月跌百分之0.8，市場原先預期升百分之0.3。 按年跌百分之2.8。
萬科再獲深鐵最多8.69億元人幣貸款支持,2025-07-30 23:44,https://www.metroradio.com.hk/news/default.aspx?SearchText=&NewsId=20250730234453&page=0,metro,,2025-07-31 00:15,"萬科(02202)公布，與主要股東深圳地鐵集團訂立貸款協議及資產抵押，深鐵同意向公司提供總額不超過8億6900萬元人民幣貸款，同時公司以深鐵為受益人，抵押若干投資性房地產、固定資產及非上市附屬公司之股權，以提供價值不超過12億9720萬元人民幣資產抵押，作為貸款協議擔保。

萬科指，貸款所得款項將用於償還公開市場發行債券的本金與利息，以及經貸款人同意的指定借款利息。

深鐵持有萬科約百分之27.18股權。"
山西大同一輛巴士暴雨中失蹤  尋回10人遺體,2025-07-30 23:27,https://www.metroradio.com.hk/news/default.aspx?SearchText=&NewsId=20250730232731&page=0,metro,,2025-07-30 23:45,"山西省大同市天鎮縣一輛載有14人的巴士，日前在暴雨中失聯，當地政府展開大規模搜索，今日(30日)傍晚尋回10人遺體，救援人員正全力搜尋其他失蹤人士。

涉事巴士星期日清晨駛經谷前堡鎮附近，在暴雨中被洪水沖走，當地傳媒報道，巴士所載的人，大多是中老年人，他們是外來務工人員, 早起坐巴士到大棚摘辣椒，其中年紀最小的失蹤人士是做暑期工的學生，年齡19歲。"
王毅 : 中國對美政策始終保持連續性及穩定性,2025-07-30 22:49,https://www.metroradio.com.hk/news/default.aspx?SearchText=&NewsId=20250730224904&page=0,metro,,2025-07-30 23:15,"中共中央政治局委員、外交部長王毅，在北京會見美中貿易全國委員會董事會代表團。 王毅表示，當前世界處於一個動蕩時代，中美關係既受到國際亂局的影響，亦深刻影響著全球大勢演變，但無論風雲如何變化，中國對美政策始終保持連續性和穩定性，中國將按照國家主席習近平提出的相互尊重、和平共處、合作共贏三個原則，處理和推進中美關係。

他指，美國總統特朗普就任以來，習近平兩次同他通話，就改善和發展中美關係達成重要共識。 中方願同美方加強接觸、避免誤判、管控分歧、探索合作，落實好兩國元首的共識，推動中美關係實現穩定、健康、可持續發展。 中美要建立更多溝通協商渠道，以客觀、理性、務實態度看待對方，樹立正確的戰略認知。 要尊重彼此核心和重大利益，避免引發對抗衝突。 要本著尊重、平等、互惠原則，不搞單邊霸道，多做一些有利於兩國和世界的大事、實事、好事。

王毅表示，今年上半年，中國經濟迎難而上，穩中向好。 中國將擴大高水平對外開放，打造市場化、法治化、國際化的一流營商環境，期待美國企業繼續看好中國、投資中國，實現互利共贏、共同成長。 希望美國工商界做正確對華認知的解讀者、中美民間友好的播種者和中美互利共贏的踐行者，為中美關係發展和兩國人民友好作出新的積極貢獻。

代表團成員包括美中貿委會董事會主席芮思博(Rajesh Subramaniam)  、高盛集團總裁溫澤恩(John Waldron)、波音高級副總裁兼全球集團總裁納爾遜(Brendan Nelson)、蘋果公司營運長薩比赫汗(Sabih Khan)等."
玉淵譚天 : 王文濤會見波音及蘋果等美國企業代表,2025-07-30 22:32,https://www.metroradio.com.hk/news/default.aspx?SearchText=&NewsId=20250730223235&page=0,metro,,2025-07-30 22:45,"《央視》旗下新媒體專欄「玉淵譚天」報道，國家商務部部長王文濤今日(30日)在北京會見十間美國企業代表，包括波音及蘋果等，就中美經貿關係、美資企業在華發展等議題交換意見。

會面結束後，美中貿易全國委員會會長譚森向中方表達感謝。"
貿發局 : 香港營商環境報告繼續積極推廣香港優勢,2025-07-30 22:16,https://www.metroradio.com.hk/news/default.aspx?SearchText=&NewsId=20250730221648&page=0,metro,,2025-07-30 22:30,"貿易發展局對特區政府今天發布香港營商環境報告表示歡迎。 貿發局主席馬時亨表示。 報告詳述香港的營商環境和多個領域的優勢，並以實例和數字具體分析本港營商環境和機遇，有助進一步吸引環球商界利用香港的商貿平台和專業服務。

馬時亨指，香港在「一國兩制」下具備內聯外通的獨特優勢，能夠發揮「超級聯繫人」及「超級增值人」的重要作用。 香港作為國際投融資中心，能為內地、以至其他地區的基建項目提供多元化的融資渠道和選擇，進一步貢獻一帶一路高質量發展。

第十屆「一帶一路高峰論壇」將於9月10至11日舉行，多角度推動多邊合作。 貿發局會繼續配合特區政府施政，積極向環球商界推廣香港的營商優勢，促進本港的國際貿易和商業活動，並為商界，特別是中小企，提供全面商貿支援。"
林文健訪廣州 深化粵港基孔肯雅熱聯防聯控工作,2025-07-30 22:09,https://www.metroradio.com.hk/news/default.aspx?SearchText=&NewsId=20250730220926&page=0,metro,,2025-07-30 22:30,"衞生署署長林文健，與廣州市衞健委主任陳斌會面，討論及深化兩地基孔肯雅熱聯防聯控工作。

林文健表示，衞生防護中心按粵港澳三地，建立的傳染病通報機制，充分掌握廣東省基孔肯雅熱最新情況；署方早前派遣2名現場流行病學醫生，前往佛山市疾控中心，參與當地流行病學調查及防控工作，包括蚊媒監測，社區滅蚊行動和患者管理等，今日再增派1位傳染病處流行病學首席醫生到訪佛山市，與廣東省疾病預防控制局等人員，深入交流基孔肯雅熱的防控工作。

林文健又指，是次基孔肯雅熱的聯防聯控工作，充分體現粵港澳三地，在傳染病防控及緊急應變等方面的持續深化合作。"
利嘉閣 : 若放寬內地人才置業  將為樓市注入新動能,2025-07-30 22:08,https://www.metroradio.com.hk/news/default.aspx?SearchText=&NewsId=20250730220825&page=0,metro,,2025-07-30 22:30,"財政司司長陳茂波表示，正與相關中央機構研究，在合適範圍內相對放寬限制，便利內地來港人才調配資金來港買樓。 利嘉閣地產研究部主管陳海潮表示，若果中央與港府能在短期內落實資金調配放寬措施，將為香港樓市注入新動能，尤其在目前「價升量弱」的過渡期，有望成為催化劑，推動樓市進入新一輪穩健復甦。

他指，總體而言，這項新政策將對香港樓市帶來多方面的潛在好處，包括需求增長、激活市場、 吸引人才及提升經濟效益的長期穩定作用。"
