title,date,url,source,section,scrape_time,news_content
陳美寶:5的士車隊將設中央召喚平台 縮短等候時間,2025-07-30 11:23,https://www.metroradio.com.hk/news/default.aspx?SearchText=&NewsId=20250730112303&page=0,metro,,2025-07-30 11:45,"5支的士車隊已全部投入服務，有市民反映難以召喚，等候平台回覆時間長。 運輸及物流局局長陳美寶指，車隊處於起步階段，已設立熱線，處理客人反饋，相信在過渡階段後，車隊的表現會更好。

陳美寶在本台節目表示，正計劃設立一個大型中央平台，集中5支車隊的電召應用程式，方便市民透過一個平台選取服務。 又指目前八達通公司已與當中兩支車隊簽署協議，方便市民用八達通所屬程式召喚的士。

她指，留意到有大量旅客抵港後，偏向召喚點對點服務車輛出行，已提修訂方案，以附屬法例，規定所有的士，至少增設兩種電子支付系統，最快明年初落實.

就網約車規管方案，陳美寶認為司機須通過嚴格考核，熟悉路況，但強調不會設立過高要求，以免令他們卻步，不敢加入.又指已參考海外發牌規則，訂立網約車齡上限，並在市民及司機建議之間，作出平衡。"
發改委就《政府投資基金佈局規劃和投向工作指引》等徵求意見,2025-07-30 11:17,https://www.metroradio.com.hk/news/default.aspx?SearchText=&NewsId=20250730111718&page=0,metro,,2025-07-30 11:45,"國家發改委就《政府投資基金佈局規劃和投向工作指引》，以及《加強政府投資基金投向指導評價管理辦法》徵求意見。

文件擬規定，政府投資基金的投資領域，應符合國家級產業目錄中的鼓勵類企業，符合國家發展規劃及國家級專項規劃、區域規劃要求，並在基金設立方案中，明確訂立重點投資的產業領域。

文件提出，政府投資基金要著力增加高端產能供給，聚焦產業技術創新和關鍵核心技術攻關，推動加快實現高水平科技自立自強。 當中，產業投資類基金要在產業發展方面發揮引領帶動作用，圍繞完善現代化產業體系，支持改造提升傳統產業、培育壯大新興產業、佈局建設未來產業。 創業投資類基金要圍繞發展新質生產力，通過市場化方式投資種子期、初創期企業，兼顧早中期中小微企業，支持科技創新，解決重點關鍵領域「卡脖子」難題。"
發改委擬規定政府投資基金不得以明股實債增加地方政府隱性債務,2025-07-30 11:16,https://www.metroradio.com.hk/news/default.aspx?SearchText=&NewsId=20250730111606&page=0,metro,,2025-07-30 11:45,"國家發改委就《政府投資基金佈局規劃和投向工作指引》徵求意見。

文件提出，政府投資基金應控制對單個企業投資金額或比例上限，並在設立方案或相關法律文件中明確列出。 政府投資基金不得通過明股實債等方式，變相增加地方政府隱性債務，除併購重組、定向增發、戰略配售外，不得從事公開交易類股票投資，不得直接或間接從事期貨等衍生品類交易，不得為被投資企業之外的企業或項目提供擔保，不得開展承擔無限責任的投資。 若基金監管部門另有規定，須跟從基金監管部門規定。"
安聯投資料日本央行維持利率不變 今年稍後加息的可能性升溫,2025-07-30 10:57,https://www.metroradio.com.hk/news/default.aspx?SearchText=&NewsId=20250730105735&page=0,metro,,2025-07-30 11:15,"日本央行今明兩日議息，安聯投資預料，日本央行將維持利率不變，會延續偏向加息的立場，但短期內不太可能進一步加息。

安聯投資表示，自四月以來，日本央行關注美國的關稅政策對日本及全球經濟的潛在影響，最新達成的貿易協議消除了一項主要外部不確定性，根據協議，日本出口商品將面臨百分之15的固定關稅，將對經濟增長構成一定程度的壓力。 然而，整體貿易談判結果優於市場預期，對汽車產業而言更是相對正面，日本央行可能會視之為一項有利發展。 因為近年汽車產業的強勁表現帶動薪資顯著上升，是推動通脹穩定上行的關鍵條件之一，在這種背景下，日本央行今年稍後恢復加息的可能性正逐步升溫。

安聯投資對日本股市保持溫和樂觀的立場，對日本政府債券維持減持評級，對日圓則維持中立立場。"
施紀賢:除非以色列實現加沙停火 否則將於9月承認巴勒斯坦國,2025-07-30 10:49,https://www.metroradio.com.hk/news/default.aspx?SearchText=&NewsId=20250730104946&page=0,metro,,2025-07-30 11:00,"英國首相施紀賢(Keir Starmer)表示，如果以色列不採取實質性行動，結束加沙地帶的慘況，並承諾實現長期可持續和平，否則英國將在9月聯合國大會開幕上，承認巴勒斯坦的國家地位。

施紀賢在聲明中表示，英國的目標仍然是有一個安全穩定的以色列，以及一個可行且擁有主權的巴勒斯坦國，強調英國政府一直以來都打算承認巴勒斯國，並且要在兩國方案能達到最大影響力的時刻實現。

以色列外交部發表聲明，拒絕英國方面擬承認巴勒斯坦國的聲明，認為英國政府的立場變化，實際上是在獎勵哈馬斯的恐怖主義，破壞實現加沙停火和推動被扣押人員釋放框架所作努力。

以色列總理內塔尼亞胡表示，在以色列邊境建立一個聖戰主義國家，將會威脅英國自身，注定失敗。

法國總統馬克龍早前亦宣布，法國會在9月召開的聯合國大會上，正式承認巴勒斯坦國。"
古特雷斯:加沙地帶正處於饑荒邊緣,2025-07-30 10:40,https://www.metroradio.com.hk/news/default.aspx?SearchText=&NewsId=20250730104011&page=0,metro,,2025-07-30 11:00,"聯合國秘書長古特雷斯(Antonio Guterres)發表聲明，形容加沙地帶正處於饑荒邊緣。

世界糧食計劃署等機構，發布糧食安全階段綜合分類報告指出，加沙地帶的糧食消費和營養指標，已處於本輪衝突開始以來的最低水平，加沙地帶正面臨嚴重饑荒風險，古特雷斯表示，報告證實國際社會的擔憂，加沙地帶的巴勒斯坦人正在經歷史無前例的人道主義災難。

他呼籲各方需要盡最大努力，立即實現永久的人道主義停火、立即無條件釋放所有被扣押人員，以及在加沙地帶全面、不受阻礙地提供人道主義援助。"
貝森特:料美中官員約90日內再舉行會談,2025-07-30 10:35,https://www.metroradio.com.hk/news/default.aspx?SearchText=&NewsId=20250730103541&page=0,metro,,2025-07-30 11:00,"中美經貿團隊結束在瑞典斯德哥爾摩舉行的新一輪會談，雙方同意繼續推動暫緩向對方實施對等關稅措施。

美國財長貝森特(Scott Bessent)會後形容，美中貿易對話廣泛、深入及非常令人滿意，美中官員很可能在大約90天內再次舉行會談。

他指出，在美中日內瓦和倫敦會談後，關於中國稀土出口的協議正在逐步完善，預計星期三將在華盛頓與總統特朗普(Donald Trump)會面，由特朗普決定是否延長下月12日到期的關稅暫緩期。

另外，特朗普訪問蘇格蘭後返回華盛頓時表示，貝森特已向他通報與中方會談情況，說貝森特對這次會談感覺非常好，比昨天還樂觀。"
中超聯賽原董事長劉軍受賄案一審判囚11年,2025-07-30 10:33,https://www.metroradio.com.hk/news/default.aspx?SearchText=&NewsId=20250730103319&page=0,metro,,2025-07-30 11:00,"中超聯賽有限責任公司原董事長劉軍，受賄、非國家工作人員受賄案，在湖北省通山縣人民法院公開宣判，合共判處有期徒刑11年，並罰款110萬元人民幣，受賄所得財物及孳息依法予以追繳上繳國庫。

另外，中國足協紀律委員會原主任王小平受賄案，在湖北省松滋市人民法院公開宣判，判處有期徒刑10年6個月罰款70萬元人民幣。"
港股下跌 恒生指數低開189點,2025-07-30 10:16,https://www.metroradio.com.hk/news/default.aspx?SearchText=&NewsId=20250730101636&page=0,metro,,2025-07-30 10:30,"港股下跌，大市低開189點後，早段曾經跌過200點，恒生指數最新報25396點，跌128點。

理想汽車(02015)新款電動車型開價遠低於日前公布的預售價，股價跟隨美股急跌百分之9，是跌幅最大藍籌，市場擔心內地汽車價格戰重臨，比亞迪(01211)跌百分之3，吉利汽車(00175)跌百分之1，小米(01810)偏軟，小鵬(09868)跌百分之4，蔚來(09866)及零跑(09863)跌百分之2。

新經濟股下跌，阿里巴巴(09988)及京東(09618)跌百分之2，百度(09888)跌百分之1，騰訊(00700)及美團(03690)偏軟，網易(09999)變動不大。

滙控(00005)今日公布業績前上升，恒生(00011)就偏軟。

晶片股下跌，中芯國際(00981)跌百分之4，華虹半導體(01347)跌近半成，ASMPT(00522)跌百分之2，上海復旦(01385)跌百分之3。

粵港灣控股(01396)獲注入AI業務，股價復牌急升兩成。

國企指數報9097點，跌48點。"
俄羅斯堪察加清晨8.7級地震 首波海嘯到達北海道根室市,2025-07-30 10:14,https://www.metroradio.com.hk/news/default.aspx?SearchText=&NewsId=20250730101407&page=0,metro,,2025-07-30 10:30,"俄羅斯堪察加半島對開海域，今早發生多次強烈地震，最強一次達到8.7級，俄羅斯當局指，今次地震的強度是1952年以來最強，預計強度達到7.5級的餘震將會持續至少一個月。

地震在今早7時24分發生，震央位於堪察加半島東面海域，震源深度約10公里，之後發生多次強烈餘震。

本港天文台亦都錄得今次地震，強度為8.5級。

多個太平洋沿岸國家都發出海嘯警報，日本氣象廳對太平洋沿岸多個地區，發佈海嘯警報和海嘯注意預警，

預計會有3米高的海嘯，首波海嘯在當地時間10時17分，到達北海道根室市，浪高約30厘米，現場有大量民眾在大廈屋頂暫避。

另外，美國海嘯預警系統就對加州、俄勒岡州及華盛頓州發布海嘯預警。

菲律賓及太平洋對岸的智利都發出海嘯警報，遠至南半球的新西蘭亦警告，新西蘭沿海地區可能會出現強烈的異常洋流，以及不可預測的湧浪，民眾應遠離海灘和海岸地區。"
京東七鮮小廚上線首周日均訂單逾1000單,2025-07-30 10:10,https://www.metroradio.com.hk/news/default.aspx?SearchText=&NewsId=20250730101034&page=0,metro,,2025-07-30 10:30,"京東(09618)旗下餐飲合營製作平台「七鮮小廚」，首店上線首周，日均訂單超過1000單。 啟動「菜品合夥人」招募後，首周報名量突破6萬6千份。

京東表示，報名情況反映中小商家難以規模化、連鎖化的經營困境，以及廚師技藝傳承的難題。 而七鮮小廚首店上線三日複購率，較行業平均值高2.2倍，並帶動周邊3公里商圈的數千家餐廳，整體總體訂單環比增長百分之12。 七鮮小廚的核心是與商家、廚師共生共榮，租金、人力、運營成本全由京東承擔，合夥人僅需專注菜品研發與協同打造品質食材供應鏈，強調絕不讓合夥商家虧損，不讓百萬餐廳為平台白白打工，不借平台之名為幽靈外賣打造遮羞布。

京東又指，過去15年外賣市場深陷劣幣驅逐良幣困局，今年京東的持續創新已推動行業重煥活力，將加速落地七鮮小廚合營模式的創新實踐，幫助消費者吃到有品質又實惠的食物，幫助餐飲商家獲得更多的銷量。"
內地股市早段個別發展,2025-07-30 10:04,https://www.metroradio.com.hk/news/default.aspx?SearchText=&NewsId=20250730100416&page=0,metro,,2025-07-30 10:30,"內地股市早段個別發展。

上證綜合指數報3626點，升16點，升幅百分之0.47。

深證成份指數報11283點，跌5點，跌幅百分之0.05。

滬深300指數報4171點，升19點，升幅百分之0.47。"
陳美寶:將嚴格考核網約車司機 確保乘客安全,2025-07-30 10:04,https://www.metroradio.com.hk/news/default.aspx?SearchText=&NewsId=20250730100449&page=0,metro,,2025-07-30 10:30,"運輸及物流局局長陳美寶表示，正擬定規管網約車方案，當中司機須進行嚴格的考核，對路況有一定熟悉程度，確保乘客安全。

陳美寶在本台節目強調，不會對平台或司機設立過高入場要求，以免令他們卻步，不敢進行市場。

她又指，已參考海外領牌規則訂立網約車齡上限，亦都收到市民及司機建議，並在各地標準和不同持份者的建議之間取得平衡。"
台灣股市早段上升,2025-07-30 10:01,https://www.metroradio.com.hk/news/default.aspx?SearchText=&NewsId=20250730100100&page=0,metro,,2025-07-30 10:15,"台灣股市早段上升。

加權指數報23389點，升187點，升幅百分之0.81。"
澳紐股市早段上升,2025-07-30 09:59,https://www.metroradio.com.hk/news/default.aspx?SearchText=&NewsId=20250730095954&page=0,metro,,2025-07-30 10:15,"澳紐股市早段上升。

標普澳洲200指數報8752點，升47點，升幅百分之0.55。

新西蘭50隻成份股指數報12955點，升19點，升幅百分之0.15。"
南韓股市早段上升,2025-07-30 09:58,https://www.metroradio.com.hk/news/default.aspx?SearchText=&NewsId=20250730095823&page=0,metro,,2025-07-30 10:15,"南韓股市早段上升。

首爾綜合指數報3248點，升17點，升幅百分之0.54。"
日本股市早段下跌,2025-07-30 09:57,https://www.metroradio.com.hk/news/default.aspx?SearchText=&NewsId=20250730095752&page=0,metro,,2025-07-30 10:15,"日本股市早段下跌。

日經平均指數報40630點，跌43點，跌幅百分之0.11。"
俄羅斯堪察加清晨8.7級地震 多個太平洋沿岸國家發海嘯警報,2025-07-30 09:56,https://www.metroradio.com.hk/news/default.aspx?SearchText=&NewsId=20250730095608&page=0,metro,,2025-07-30 10:15,"俄羅斯堪察加半島對開海域，今早發生多次強烈地震，最強一次達到8.7級，俄羅斯當局指，今次地震的強度是1952年以來最強，預計強度達到7.5級的餘震將會持續至少一個月。

地震在今早7時24分發生，震央位於堪察加半島東面海域，震源深度約10公里，之後發生多次強烈餘震。

本港天文台亦都錄得今次地震，強度為8.5級。

多個太平洋沿岸國家都發出海嘯警報，日本氣象廳對太平洋沿岸多個地區，發佈海嘯警報和海嘯注意預警，預計會有3米高的海嘯，美國海嘯預警系統就指，帛琉及菲律賓等部分海岸可能出現最高1米的海嘯，日本放送協會報道，海嘯已經到達北海道，浪高約30厘米。

菲律賓及太平洋對岸的智利都發出海嘯警報，遠至南半球的新西蘭亦警告，新西蘭沿海地區可能會出現強烈的異常洋流，以及不可預測的湧浪，民眾應遠離海灘和海岸地區。"
IMF略微上調今明兩年全球經濟增長預測 但指仍受關稅風險阻窒,2025-07-30 09:51,https://www.metroradio.com.hk/news/default.aspx?SearchText=&NewsId=20250730095117&page=0,metro,,2025-07-30 10:15,"國際貨幣基金組織(IMF)略微上調今明兩年全球經濟增長預測，預計今年全球經濟增長百分之3，4月時的預測增長百分之2.8；因為美國8月1日加徵關稅前出現超出預期的採購潮，而且美國實際關稅稅率由百分之24.4降至百分之17.3；但警告全球經濟仍面臨重大風險，包括關稅稅率可能反彈、地緣政治緊張和財政赤字擴大，可能推高利率，並收緊全球金融環境。

國際貨幣基金組織指，全球總體通脹率預計將在今年降至百分之4.2，明年降至百分之3.6，但同時指出，由於關稅將在今年下半年轉嫁給美國消費者，美國的通脹率可能仍將高於目標值。     以關稅收入佔進口商品比重衡量的美國實際關稅稅率，自4月以來雖然有下降，但仍遠高於1月初百分之2.5的水平。 美國未來上調關稅的前景，尚未反映在國際貨幣基金組織預測中。 若進一步提高實際關稅稅率，可能造成供應鏈樽頸並放大高關稅的負面衝擊。 美國新出台的減稅和支出法案，預計將使財政赤字增加1.5個百分點，而關稅收入約可抵銷其中半數影響.     至於歐元區今年經濟增長預測，被上調0.2個百分點至百分之1，對明年的預測維持百分之1.2不變。"
IMF略微上調今明兩年全球經濟增長預測 但指關稅風險仍阻礙經濟前景,2025-07-30 09:51,https://www.metroradio.com.hk/news/default.aspx?SearchText=&NewsId=20250730095117&page=0,metro,,2025-07-30 10:00,"國際貨幣基金組織(IMF)略微上調今明兩年全球經濟增長預測，預計今年全球經濟增長百分之3，4月時的預測增長百分之2.8；因為美國8月1日加徵關稅前出現超出預期的採購潮，而且美國實際關稅稅率由百分之24.4降至百分之17.3；但警告全球經濟仍面臨重大風險，包括關稅稅率可能反彈、地緣政治緊張和財政赤字擴大，可能推高利率，並收緊全球金融環境。

國際貨幣基金組織指，全球總體通脹率預計將在今年降至百分之4.2，明年降至百分之3.6，但同時指出，由於關稅將在今年下半年轉嫁給美國消費者，美國的通脹率可能仍將高於目標值。     以關稅收入佔進口商品比重衡量的美國實際關稅稅率，自4月以來雖然有下降，但仍遠高於1月初百分之2.5的水平。 美國未來上調關稅的前景，尚未反映在國際貨幣基金組織預測中。 若進一步提高實際關稅稅率，可能造成供應鏈樽頸並放大高關稅的負面衝擊。 美國新出台的減稅和支出法案，預計將使財政赤字增加1.5個百分點，而關稅收入約可抵銷其中半數影響.     至於歐元區今年經濟增長預測，被上調0.2個百分點至百分之1，對明年的預測維持百分之1.2不變。"
巨星傳奇與宇樹科技訂合作協議 開發具社交屬性機器人,2025-07-30 09:39,https://www.metroradio.com.hk/news/default.aspx?SearchText=&NewsId=20250730093922&page=0,metro,,2025-07-30 10:15,"「周杰倫概念股」巨星傳奇(06683)公布，與宇樹科技訂立合作協議書，開發具社交屬性機器人產品。

雙方將互為全球範圍內的戰略合作夥伴關係，並將首先在具有陪伴功能與社交屬性的四足機器狗或機器人開發，以及商業化領域，包括但不限於演藝領域等開展合作，共同打造具有較強IP屬性的消費級機器人產品。 巨星傳奇將負責合作產品核心的IP規劃、設計、AI交互，並將主導全球化營銷策略等；宇樹科技將負責技術、硬件研發及生產，以及相關應用程式的研發等。

巨星傳奇表示，透過今次合作，可依託宇樹科技於機器人研發方面的資源及經驗，並結合自身IP創造與運營資源及能力，打造新形態IP產品，合作範圍涵蓋集團旗下藝人資源，更會延伸至廣泛的藝人以拓展IP合作機會。 公司也將深度挖掘智能機器人在演唱會、表演秀等場景的商業化價值。"
巨星傳奇與宇樹科技訂立合作協議 將開發具社交屬性機器人,2025-07-30 09:39,https://www.metroradio.com.hk/news/default.aspx?SearchText=&NewsId=20250730093922&page=0,metro,,2025-07-30 10:00,"「周杰倫概念股」巨星傳奇(06683)公布，與宇樹科技訂立合作協議書，開發具社交屬性機器人產品。

雙方將互為全球範圍內的戰略合作夥伴關係，並將首先在具有陪伴功能與社交屬性的四足機器狗或機器人開發，以及商業化領域，包括但不限於演藝領域等開展合作，共同打造具有較強IP屬性的消費級機器人產品。 巨星傳奇將負責合作產品核心的IP規劃、設計、AI交互，並將主導全球化營銷策略等；宇樹科技將負責技術、硬件研發及生產，以及相關應用程式的研發等。

巨星傳奇表示，透過今次合作，可依託宇樹科技於機器人研發方面的資源及經驗，並結合自身IP創造與運營資源及能力，打造新形態IP產品，合作範圍涵蓋集團旗下藝人資源，更會延伸至廣泛的藝人以拓展IP合作機會。 公司也將深度挖掘智能機器人在演唱會、表演秀等場景的商業化價值。"
港股ADR收市普遍下跌 騰訊收報550.51港元,2025-07-30 09:38,https://www.metroradio.com.hk/news/default.aspx?SearchText=&NewsId=20250730093822&page=0,metro,,2025-07-30 10:00,"在美國上市的主要港股預託證券(ADR)價格，與港股收市價比較，普遍下跌。

藍籌股當中，長和(00001)ADR折合港元計，收報52.52元，較本港收市低0.58元；滙控(00005)ADR收報102.14元，高1.14元；港交所(00388)ADR收報435.83元，低8.17元；騰訊(00700)ADR收報550.51，低4.49元；友邦(01299)ADR收報74.75元，高0.75元。

賭業股方面，銀河娛樂(00027)ADR收報36.45元，低2.45元；金沙中國(01928)ADR收報19.08元，高0.56元。

內銀股方面，建設銀行(00939)ADR收報8.16元，低0.03元；工商銀行(01398)ADR收報6.03元，低0.07元.

(1美元兌7.8499)"
松景科技開市前停牌未知原因,2025-07-30 09:32,https://www.metroradio.com.hk/news/default.aspx?SearchText=&NewsId=20250730093231&page=0,metro,,2025-07-30 09:45,"松景科技(01079)開市前停牌，暫未知原因。

股份上日收報0.137元。"
人民幣兌美元中間價上升70點子,2025-07-30 09:31,https://www.metroradio.com.hk/news/default.aspx?SearchText=&NewsId=20250730093121&page=0,metro,,2025-07-30 09:45,"人民幣兌美元中間價上升。

人民幣兌美元中間價報7.1441，較上日中間價上升70點子。"
[油市收市]紐約期油升3.75% 布蘭特期油升3.53%,2025-07-30 09:29,https://www.metroradio.com.hk/news/default.aspx?SearchText=&NewsId=20250730092950&page=0,metro,,2025-07-30 10:00,"油價收市上升，紐約期油及布蘭特期油都升超過百分之3。

美國對俄羅斯施壓，加上貿易協議前景樂觀，油價反彈。

紐約9月期油收報每桶69.21美元，升2.5美元，升幅百分之3.75。

倫敦9月布蘭特期油收報每桶72.51美元，升2.47美元，升幅百分之3.53。"
人行今進行1585億元人民幣逆回購操作,2025-07-30 09:29,https://www.metroradio.com.hk/news/default.aspx?SearchText=&NewsId=20250730092901&page=0,metro,,2025-07-30 09:45,"人民銀行今日進行1585億元人民幣七天期的逆回購操作，操作利率維持在1.4厘。

由於今日有1505億元人民幣的逆回購操作到期，人行公開市場資金淨投放80億元人民幣。"
港股下跌 恒生指數低開189點,2025-07-30 09:25,https://www.metroradio.com.hk/news/default.aspx?SearchText=&NewsId=20250730092500&page=0,metro,,2025-07-30 09:45,"港股下跌，恒生指數低開189點，開市報25335點。

國企指數低開90點，開市報9055點。"
[金市收市]紐約8月期金收報每安士3324美元升0.4%,2025-07-30 09:21,https://www.metroradio.com.hk/news/default.aspx?SearchText=&NewsId=20250730092114&page=0,metro,,2025-07-30 09:30,"金價收市上升。

投資者等待中美貿易談判和美國聯儲局政策會議的結果，市場普遍預計會維持利率不變，將密切關注聯儲局的評論，以尋找有關未來可能減息的時機和步伐的任何信號，  金價上升。

交投最活躍的紐約8月期金收報每安士3324美元，升14美元，升幅百分之0.4.

紐約現貨金報每安士3327.69美元，升幅百分之0.4。"
[歐洲股市收市]全線上升:英股升0.6% 德股升1.03% 法股升0.72%,2025-07-30 09:16,https://www.metroradio.com.hk/news/default.aspx?SearchText=&NewsId=20250730091604&page=0,metro,,2025-07-30 09:30,"歐洲三大股市收市全線上升，德國股市表現最好，升超過百分之1；法國股市升約百分之0.7；英國股市升百分之0.6。

倫敦富時100指數收報9136點，升54點，升幅百分之0.6。

法蘭克福DAX指數收報24217點，升247點，跌幅百分之1.03。

巴黎CAC指數收報7857點，升56點，升幅百分之0.72."
[美股收市]全線下跌:道指跌0.46% 納指跌0.38% 標指跌0.3% 納指標指曾創歷史新高,2025-07-30 09:12,https://www.metroradio.com.hk/news/default.aspx?SearchText=&NewsId=20250730091231&page=0,metro,,2025-07-30 09:30,"美股收市全線下跌，三大指數跌幅不大，當中道指表現最差，跌近百分之0.5；納指及標普500指數一度創出歷史新高，但之後倒跌。 納指收市跌近百分之0.4；標普500指數收市跌百分之0.3.

多家道瓊斯工業指數成分股企業公布業績，其中    聯合健康集團的盈利預測令人失望，股價跌百分之7.5，是對道指造成最大拖累的個股.波音公布的第二季虧損雖然有所收窄，但股價仍跌百分之4.4，道指受壓。

投資者正觀望美國聯儲局當地周三的議息結果和政策聲明，以及一系列美國經濟指標，入市態度審慎。

道瓊斯工業平均指數最多升46點；收報44632點，跌204點，跌幅百分之0.46。

納斯達克指數高見21303點，創歷史新高，最多升125點；收報21098點，跌80點，跌幅百分之0.38。

標準普爾500指數高見6409點，創歷史新高，最多升19點；收報6370點，跌18點，跌幅百分之0.3。"
