title,date,url,source,section,scrape_time,news_content
[港股夜期]低水94點,2025-06-11 21:51,https://www.metroradio.com.hk/news/default.aspx?SearchText=&NewsId=20250611215133&page=0,metro,,2025-06-11 22:00,美股開市早段變動不大，港股恒指夜期最新報24273點，跌70點，低水94點。
[美股]道指早段變動不大,2025-06-11 21:50,https://www.metroradio.com.hk/news/default.aspx?SearchText=&NewsId=20250611215032&page=0,metro,,2025-06-11 22:00,"美股早段變動不大，儘管美國通脹數據差過預期，而且美國和中國就貿易框架協議達成共識。

道瓊斯工業平均指數最新報42833點，跌33點，跌幅百分之0.08。

標普500指數最新報6043點，升4點，升幅百分之0.07。

納斯達克指數最新報19761點，升46點，升幅百分之0.24。

輝達(Nvidia)正與歐洲多國以及技術和行業領袖合作，構建Blackwell AI基礎設施，股價偏軟。

Tesl初步計劃6月22日開始，在得州奧斯汀推出無人駕駛的士( Robotaxi)服務。股價升近百分之2。

Google啟動全公司範圍的「肥雞餐」自願離職方案，涉及搜索等核心業務部門。股價靠穩。

據報Meta Platforms同意支付148億美元收購人工智能初創公司Scale AI的49%股份。Meta偏軟。

波音公司5月實現737 MAX月產量目標，交付45架飛機，獲得新訂單303架。股價下跌。

通用汽車計劃未來兩年向美國工廠投資40億美元，以提高暢銷油車產量。股價升百分之1。

禮來與遠程醫療機構達成協議，嚴禁其銷售減肥仿制藥Zepbound。股價上升。"
許正宇指香港與英國擁有共同願景可優勢互補,2025-06-11 21:46,https://www.metroradio.com.hk/news/default.aspx?SearchText=&NewsId=20250611214659&page=0,metro,,2025-06-11 22:00,"正在英國倫敦訪問的財經事務及庫務局局長許正宇表示，香港站在全球金融和數碼資產變革的前沿，與英國擁有共同願景，可以優勢互補，透過轉型取得經濟增長。

許正宇當地星期二在一個午餐會上致辭時指，在地緣政治和內地科技飛躍的驅動下，香港的資本市場蓬勃向好，為包括英國投資者在內的全球投資者提供門戶和通道，讓他們借助香港流動性高的巿場環境，以及穩健的監管框架，涉足亞洲科技行業。

他又指，本港較早時獲納入倫敦金屬交易所的全球倉庫網絡，不但強化香港的大宗商品基礎設施，亦為英國企業帶來機遇，強調香港毗鄰亞洲工業市場，可以與英國在新能源金屬巿場合作，並支持全球產業轉型和可持續發展。"
[歐洲股市]中段個別發展,2025-06-11 21:39,https://www.metroradio.com.hk/news/default.aspx?SearchText=&NewsId=20250611213948&page=0,metro,,2025-06-11 22:00,"歐洲股市中段個別發展。

英國富時100指數最新報8862點，升9點，升幅百分之0.1。

德國DAX指數最新報23974點，跌59點，跌幅百分之0.25。

法國CAC指數最新報7795點，跌8點，跌幅百分之0.11。"
立法會三讀通過修例加強打擊濫用公屋,2025-06-11 21:38,https://www.metroradio.com.hk/news/default.aspx?SearchText=&NewsId=20250611213805&page=0,metro,,2025-06-11 22:00,"立法會三讀通過修訂房屋條例，引入嚴重濫用公屋的新罪行、 賦權獲授權人員要求可疑人士提供個人資料，並且延長虛假陳述、拒絕提供資料等罪行的檢控時效，明年3月底起生效。

房屋局局長何永賢表示，公屋是寶貴社會資源，必須編配給真正有需要人士，並且合理善用，一系列措施反映當局打擊濫用公屋的決心，房委會將持續優化政策，確保公營房屋資源聚焦協助最有需要的人。

另外，條例亦賦權房屋署署長指明定額罰款通知書及繳款通知書的格式，提升房委會在打擊屋邨範圍內非法使用道路的效率和靈活性，將於下星期五條例刊憲後生效。"
其士國際發盈警 料年度虧損擴大至約4億至5億元,2025-06-11 21:37,https://www.metroradio.com.hk/news/default.aspx?SearchText=&NewsId=20250611213736&page=0,metro,,2025-06-11 22:00,"其士國際(00025)公布，與去年度錄得公司股東應佔除稅後虧損約為3億7000萬元相比，預計截至2025年3月31日止年度，將錄得公司股東應佔除稅後虧損約4億至5億元。

期內虧損主要由於集團於2025年3月31日，確認按公允值列入損益處理之投資虧損，及對於發展中物業之撥備所致。 然而，公司股東及有意投資者應注意，上述提及之因素均為會計虧損，對集團的現金流並無即時影響。 儘管集團預計截至2025年3月31日止年度將錄得虧損，但集團的財務狀況仍然保持穩健。"
台灣氣象部門料未來幾日或有5至5.5級餘震,2025-06-11 21:13,https://www.metroradio.com.hk/news/default.aspx?SearchText=&NewsId=20250611211303&page=0,metro,,2025-06-11 21:30,"台灣花蓮東部海域，晚上發生黎克特制6.4級地震，當局未有接獲災情報告。

地震發生在晚上7時，當地氣象部門表示，震央位於花蓮縣政府以南約70公里，震源深度約31公里，屬於淺層地震，幾乎全台灣都有感，預計未來幾日可能會發生5至5.5級的餘震。  台北市和新北市震感明顯，捷運和台鐵一度需要減速行駛，檢查確認設備並無異常，服務恢復正常。

本港天文台初步分析，指地震規模是6.1級，震源深度約10公里。 天文台接獲多名市民報告，表示感到這次地震，震動維持數秒。"
一間收數公司直接促銷罪成被判罰款5千元,2025-06-11 21:06,https://www.metroradio.com.hk/news/default.aspx?SearchText=&NewsId=20250611210628&page=0,metro,,2025-06-11 21:30,"一間收數公司違反《私隱條例》中的直接促銷罪，在西九龍裁判法院被判罰款5千元。

私隱專員公署在2023年接獲投訴，事主接獲涉案收數公司的促銷信件，公司職員表示知悉事主曾經入稟區域法院提出索償，於是聯絡他了解是否需要債務催收服務。 事主質疑公司在未經同意情況，使用他的個人資料發出直接促銷訊息，並向私隱專員公署投訴。

私隱專員鍾麗玲歡迎法庭裁決，強調使用個人資料作任何直接促銷前，必須獲得資料當事人同意，並應告知當事人有權在不收費的情況下，要求停止在直接促銷中使用有關個人資料。"
機管局歡迎擴大飛機乘客離境稅豁免範圍,2025-06-11 20:57,https://www.metroradio.com.hk/news/default.aspx?SearchText=&NewsId=20250611205702&page=0,metro,,2025-06-11 21:15,"政府刊憲修例，將於2025年10月1日起，對48小時內於香港國際機場過境的旅客豁免飛機乘客離境稅。機管局表示歡迎。

機管局表示，香港國際機場位處於大灣區核心，一直提供全面的多式聯運交通服務，包括於大灣區設置七個口岸提供快船服務、 約30個城市候機樓提供值機及接駁巴士服務，和點對點的轎車服務等。機管局認為有關豁免將有助香港國際機場持續發揮多式聯運交通樞紐的角色，繼續提升機場競爭力以及鞏固其亞洲航空樞紐地位。

此外，擴大豁免範圍亦將鼓勵更多轉機乘客到訪香港各個景點，有助促進香港旅遊業，並惠及零售、餐飲、酒店業等。

為配合擴大豁免範圍，機管局將積極與政府跟進執行細節，為旅客提供一站式的退款處理，包括設立新電子申請平台等。"
美國5月核心CPI按年升2.8% 低於預期,2025-06-11 20:49,https://www.metroradio.com.hk/news/default.aspx?SearchText=&NewsId=20250611204925&page=0,metro,,2025-06-11 21:00,"美國通脹意外低於預期.

美國勞工部公布，美國5月份消費者價格指數(CPI)，按月上升百分之0.1，市場預期升百分之0.2；按年升百分之2.4，預期為上升百分之2.5.

剔除食品和能源價格的5月核心CPI，按月上升百分之0.1，市場預期升百分之0.3；按年升百分之2.8，預期升百分之2.9。

分析指，美國核心CPI升幅連續第四個月低於預期，這表明企業正在想方設法，限制將關稅帶來的成本上升轉嫁給消費者。"
李家超指歐盟是香港最重要的貿易夥伴之一,2025-06-11 20:42,https://www.metroradio.com.hk/news/default.aspx?SearchText=&NewsId=20250611204252&page=0,metro,,2025-06-11 21:00,"行政長官李家超表示，歐盟一直是香港最重要的貿易夥伴之一，而香港一直是、 亦將繼續是一個自由港，深信歐盟與香港擁有巨大潛力深化經貿和發展合作，在優勢領域協同發展。

李家超為歐盟駐港辦事處主任，以及15個歐盟成員國駐港總領事舉辦午餐會。 他在社交平台發文指，當今世界瞬息萬變、 保護主義抬頭，變幻莫測的地緣政治為世界帶來不確定性，而全球貿易的成功關鍵在於合作，並非孤立，香港堅決推動自由開放的貿易。

他又指，香港擁有低稅率和簡單稅制、 世界級基建、 多元文化匯聚的人才庫，以及豐富的專業服務，是連繫東西的理想門戶，歡迎包括歐盟在內的全球企業來港探索機遇，開拓內地市場。"
特朗普: 中國將供應稀土 美國將允許中國學生入讀,2025-06-11 20:39,https://www.metroradio.com.hk/news/default.aspx?SearchText=&NewsId=20250611203952&page=0,metro,,2025-06-11 21:00,"美國總統特朗普(Donald Trump)表示，美國與中國的協議已完成，中國政府將供應磁鐵和稀土礦，同時美國將允許中國學生進入美國高等院校學習。

特朗普在其社交平台以大寫字母發文強調，美國將獲得總計百分之55的關稅，中國將獲得百分之10的關稅。 關係非常好。

特朗普補充表示，該協議尚需得到他和中國國家主席習近平的最終批准。

中美兩國連續兩日在倫敦進行貿易會談，就貿易框架達成共識。

中美經貿中方牽頭人、國務院副總理何立峰表示，雙方下一步會進一步發揮好中美經貿磋商機制作用，不斷增進共識、 減少誤解、 加強合作。

美國商務部長盧特尼克(Howard Lutnick)亦表示，今次達成的框架是第一步，必須消除消極因素，預計稀土和磁鐵問題將可以解決。"
政府反對外國及反華組織就黃之鋒案的抹黑言論,2025-06-11 20:20,https://www.metroradio.com.hk/news/default.aspx?SearchText=&NewsId=20250611202047&page=0,metro,,2025-06-11 20:30,"前香港眾志秘書長黃之鋒早前被控「串謀勾結外國或者境外勢力危害國家安全」，案件押後至8月再訊。  特區政府強烈譴責及反對部分美西方國家、 反華組織和政客等，就黃之鋒案件以及特區維護國家安全工作，發表抹黑詆毀和錯誤言論，批評是全然漠視法治精神。

政府表示，黃之鋒所涉及案件的法律程序尚在進行，任何人都不應評論，強調任何國家、 組織或個人企圖利用政治力量，干預香港特區的司法程序，以促使任何被告人不能獲得應有的公平審訊，都是破壞特區法治的行為。

政府又指，有國家、 組織或個人似乎作出持某種政治理念的人，應不受法律制裁的言論，甚至要求立即釋放疑犯，當局對此感到震驚，強烈敦促立即停止干預特區內部事務，以及法院獨立行使的審判權。"
特朗普: 對與伊朗達成核協議的信心越來越小,2025-06-11 20:17,https://www.metroradio.com.hk/news/default.aspx?SearchText=&NewsId=20250611201705&page=0,metro,,2025-06-11 20:30,"美國與伊朗將於星期日，舉行第六輪核談判。 美國總統特朗普(Donald Trump)表示，他無信心可以令到伊朗同意放棄鈾濃縮活動。

特朗普在訪問中，被問到是否認為能讓伊朗同意，關閉其核設施時直言不知道。 他補充說，他以前確實會這麼想，但現在已越來越沒有信心。

特朗普一直尋求，與伊朗達成一項新的核協議，以限制伊朗的核活動，並威脅說如果達不成協議，就轟炸伊朗首都德黑蘭。

他在訪問中表示，與伊朗人的談判很「艱難」。    他指出，伊朗方面似乎正採取拖延戰術。 他重申，無論是否達成協議，美國都不會允許伊朗擁有核武器。 但希望以和平方式解決，從而避免軍事行動。 但他不認為伊朗有同樣的熱情來達成協議。

美國和伊朗自4月至今，已舉行過五輪談判，但近期陷入僵持。 德黑蘭方堅持伊朗擁有鈾濃縮權利，並強調只用於和平項目，無意製造核武器。"
廉署提出主動削減一個首長級編外職位,2025-06-11 20:08,https://www.metroradio.com.hk/news/default.aspx?SearchText=&NewsId=20250611200847&page=0,metro,,2025-06-11 20:30,"廉政公署在立法會人事編制小組委員會上，提出主動削減一個高級助理處長的首長級編外職位，只是保留一個有時限的助理處長職位至2027年，負責由廉政專員出任主席的國際反貪局聯合會的秘書處工作，並會同時刪減廉署國際合作及機構事務處中，有關聯合會工作的相關職位。

廉政專員胡英明表示，署方依然重視國際反貪聯繫和合作，但考慮到現時政府的財政狀況，必定與政府共渡時艱。 他指，署方不會因人手減少而影響工作，將會透過內部重組架構，靈活調配部門人手和資源，共同分擔國際反貪工作。"
台灣7時發生6.4級地震 本港多名市民有感,2025-06-11 19:45,https://www.metroradio.com.hk/news/default.aspx?SearchText=&NewsId=20250611194559&page=0,metro,,2025-06-11 20:00,"台灣花蓮縣東部海域，晚上發生黎克特制規模6.4級地震。

台北市明顯有感，台北捷運公布，因發生地震，目前全線列車慢速行駛，建議趕時間的旅客改搭其他交通工具。

據本港天文台的初步分析，地震發生於晚上7時正，規模為6.1級，震中位於花蓮之南約67公里，震源深度約10公里。

天文台接獲多名市民報告，表示感到這次地震，震動維持數秒。"
新疆兵團疑參與哈佛培訓 魯比奧倡調查哈佛,2025-06-11 19:29,https://www.metroradio.com.hk/news/default.aspx?SearchText=&NewsId=20250611192931&page=0,metro,,2025-06-11 19:45,"據報哈佛大學與中國合辦的培訓項目，與會者可能包括受美國政府制裁的新疆生產建設兵團官員。 美國國務卿魯比奧(Marco Rubio)正推動調查，哈佛大學是否違反聯邦制裁。

《紐約時報》引述知情人士和相關文件報道，魯比奧上月去信美國財政部建議展開調查。 目前未清楚調查是否已展開，但預計哈佛大學將面臨重大法律風險。

據哈佛大學陳曾熙公共衛生學院網站資料，該項目名為「衛生籌資旗艦項目培訓班」，始於2019年，由哈佛大學、 世界銀行和中國國家醫療保障局聯合舉辦。 哈佛大學關於首次會議的資料顯示，參加培訓的人員包括新疆生產建設兵團。 但2020年後，即特朗普首屆政府實施制裁後，有關兵團的提及已被刪除。 不過， 中國政府網站資料顯示，2023年的培訓，與會者包括新疆生產建設兵團的代表。

該報又補充指，哈佛大學一直有就新疆生產建設兵團，參與此次會議的情況進行內部審查，但未清楚審查結果。 哈佛大學的一名發言人拒絕對《紐約時報》發表評論。"
粵港澳三地在南丫島對開進行聯合演習,2025-06-11 19:13,https://www.metroradio.com.hk/news/default.aspx?SearchText=&NewsId=20250611191353&page=0,metro,,2025-06-11 19:30,"本港聯同廣東及澳門搜救單位，在南丫島下尾灣對開海面進行海上搜索及救援演習。

演習模擬一艘載有約70名乘客的跨境高速客輪由澳門前往香港途中，於石鼓洲以北水域與一艘本地油船發生碰撞，兩名乘客墮海失蹤及多名乘客受傷，油船在碰撞後起火，一名船員被困。 演習歷時約三小時，出動17艘搜救單位船隻、 一架直升機，動員超過230人。

海事處表示，演習目的是測試粵港澳三地搜救單位的溝通效率、 協調能力及資源調配，並加強本港與鄰近地區搜救中心的合作，提升日後海上發生重大緊急事故時的應變能力。"
海關紅磡檢約值100萬元疑可卡因拘一男,2025-06-11 18:52,https://www.metroradio.com.hk/news/default.aspx?SearchText=&NewsId=20250611185211&page=0,metro,,2025-06-11 19:00,"海關在紅磡檢獲值100萬元懷疑可卡因，一名男子嫌涉販毒被捕，明日在九龍城裁判法院提堂。

海關昨日下午在紅磡進行反毒品行動，截查一名形跡可疑的33歲男子，在他的背包內檢獲約1.3公斤懷疑可卡因，其後將他押解到附近一個住宅單位搜查，再檢獲一批懷疑毒品包裝工具。"
灣仔廢料回收商「呃秤」被判罰共8千元,2025-06-11 18:20,https://www.metroradio.com.hk/news/default.aspx?SearchText=&NewsId=20250611182003&page=0,metro,,2025-06-11 18:30,"灣仔一間廢料回收商的東主及操作員，使用不準確的電子磅作商業用途，違反《度量衡條例》，在東區裁判法院各被判罰款4千元。

海關早前接獲舉報，指涉案回收商涉嫌使用不準確的電子磅秤量廢銅，其派員喬裝賣家，發現商販所用的電子磅不準確，經檢測證實所顯示的重量，較實際輕兩成三，以支付較低的回收價。"
颱風「蝴蝶」或將兩次登陸內地,2025-06-11 17:52,https://www.metroradio.com.hk/news/default.aspx?SearchText=&NewsId=20250611175234&page=0,metro,,2025-06-11 18:00,"中央氣象台預計，今年第1號颱風「蝴蝶」，將於周五凌晨至上午，登陸海南島，並可能出海後，在周五晚再次登陸廣西。

氣象台表示，「蝴蝶」於今早，在南海中西部海面上生成；下午其中心位於海南三沙市附近的海面上，中心附近最大風力8級。

預計「蝴蝶」將以每小時15公里左右的速度，向西偏北方向移動，強度逐漸加強並靠向海南島南部沿海，周五凌晨至上午在海南島沿海登陸，風力達到10至12級，並可能於周五夜間，在廣東西部至廣西沿海再次登陸，風力預計減弱至8至10級，登陸後轉向東北方向移動，強度逐漸減弱。"
何立峰指要發揮好中美經貿磋商機制減少誤解,2025-06-11 17:48,https://www.metroradio.com.hk/news/default.aspx?SearchText=&NewsId=20250611174847&page=0,metro,,2025-06-11 18:00,"中美兩國連續兩日在倫敦進行貿易會談，就貿易框架達成共識。 中美經貿中方牽頭人、國務院副總理何立峰表示，雙方下一步會進一步發揮好中美經貿磋商機制作用，不斷增進共識、 減少誤解、 加強合作。

何立峰指，中方對中美經貿問題的態度和立場明確和一貫，中美經貿關係的本質是互利共贏，雙方在經貿領域合則兩利、鬥則俱傷，貿易戰沒有贏家，中方不願打，但也不怕打，雙方應通過平等對話、 互利合作解決經貿分歧。

他強調，中方對經貿磋商是有誠意，亦是有原則，雙方應相向而行，言必行、行必果，拿出恪守承諾的誠信精神和切實履行共識的努力行動，共同維護來之不易的對話成果，繼續保持溝通對話，推動中美經貿關係行穩致遠。

美國商務部長盧特尼克 (Howard Lutnick)表示，已同中方達成一個框架，若獲得總統特朗普(Donald Trump)批准就會實施，而今次達成的框架是第一步，必須消除消極因素，預計稀土和磁鐵問題將可以解決。"
受風暴影響 港航宣布取消明日往返三亞航班,2025-06-11 17:42,https://www.metroradio.com.hk/news/default.aspx?SearchText=&NewsId=20250611174205&page=0,metro,,2025-06-11 18:00,"受熱帶風暴蝴蝶影響，香港航空宣布，取消明日往返海南三亞的兩班航班。

取消的航班編號分別為HX161，及對開的HX162。

香港航空將豁免受影響航班之更改預訂、 重新簽發及退票費用，此措施僅適用於所有已獲取香港航空確認機位之機票。

港航表示，旅客前往機場前，應留意香港航空網站實時「航班狀態」，或於起飛時間4小時前，註冊「航班提示」服務，以短訊/電郵接收航班狀態提示，亦可使用官網「在線諮詢」服務，或「聯繫我們」電話查詢最新航班情況。"
天文台會評估是否需在周五改發三號強風信號,2025-06-11 17:10,https://www.metroradio.com.hk/news/default.aspx?SearchText=&NewsId=20250611171034&page=0,metro,,2025-06-11 17:30,"一號戒備信號現正生效。 天文台表示，除非熱帶風暴蝴蝶迅速增強及本地普遍持續吹強風，一號戒備信號會在今晚及明早維持， 將會評估是否需要在星期五改發三號強風信號。

蝴蝶目前集結在香港之西南偏南約650公里，預料向西北偏西移動，時速約12公里，大致移向海南島並逐漸增強，隨後移向雷州半島至北部灣一帶。 天文台指，與蝴蝶相關的狂風驟雨正影響廣東沿岸，而蝴蝶正在整合，在其廣闊環流與中國東南沿岸高壓脊的共同影響下，本港今晚至明日初時部分地區間中吹偏東強風。

按照現時預測，本港星期五初時的風力會稍為減弱，但隨後將逐漸轉吹偏南風，並間中有狂風大驟雨，普遍地區可能會吹強風，天文台會視乎蝴蝶屆時的強度、 與本港的距離及本地風力變化，評估是否需要在星期五改發三號強風信號。"
摩通上調人民幣匯率目標價 料年底升至7.15兌一美元,2025-06-11 17:00,https://www.metroradio.com.hk/news/default.aspx?SearchText=&NewsId=20250611170021&page=0,metro,,2025-06-11 17:15,"摩根大通上調人民幣匯率預期。

摩通表示，美國貿易戰風險有所緩和，以及全球開始去美元化，將年底人民幣兌美元即期目標價，由7.3升至7.15，估計人民幣兌美元將處於溫和上升趨勢，到明年年中估計會升至7.1。"
港鐵古洞站料第四季平頂 智慧工程管控增效率,2025-06-11 16:54,https://www.metroradio.com.hk/news/default.aspx?SearchText=&NewsId=20250611165403&page=0,metro,,2025-06-11 17:00,"港鐵表示，多個新鐵路項目進度良好，東鐵綫古洞站預計今年第四季平頂，2027年峻工，將會成為北環綫的主要轉車站，大堂及月台層板已經完工。

至於東涌綫延綫工程，港鐵指，東段往香港方向的路軌已經完成鋪設，正安裝軌旁設備，西段隧道預計今年內完成；小蠔灣站正進行地基工程；屯門南延綫正建造地基及橋墩，預料年底開始興建橋身；而屯馬綫洪水橋站亦即將展開探土工程。

港鐵表示，已經設立兩個「智慧工程管控中心」，綜合管理及監控各個項目，中心具備中央管理、 遙距監測和共享資訊等功能，有助提升工程管理、 施工效率和人員安全，監管人員可以透過在地盤的鏡頭，以及智能穿戴式裝置，實時監察工程及工人狀況，一旦工人在未獲授權下進入管制區域，系統會立即發出警示。"
金發局與TheCityUK簽署諒解備忘錄 深化金融合作,2025-06-11 16:52,https://www.metroradio.com.hk/news/default.aspx?SearchText=&NewsId=20250611165206&page=0,metro,,2025-06-11 17:00,"金發局與TheCityUK簽署諒解備忘錄，加強英國與香港之間的金融領域合作，深化雙方的策略夥伴關係。

諒解備忘錄昨日由金發局行政總監區景麟，與TheCityUK公共事務、政策及研究總監John Godfrey簽署，並由財經事務及庫務局局長許正宇，及TheCityUK領導委員會主席Bruce Carnegie-Brown共同見證。

區景麟表示，合作充份體現兩個全球領先金融中心的緊密聯繫，將結合各自的專業知識、創新能力及全球網絡，攜手推動可持續增長，塑造國際金融的未來，期待探索新興市場和商業機遇，為實現長期經濟繁榮奠定堅實基礎。

John Godfrey表示，備忘錄體現雙方進一步加強金融服務領域合作的決心，作為全球兩大國際金融中心，將通過知識分享與密切合作，尋求創新的解決方案，共同應對當前的挑戰與機遇，實現互利共贏。"
星巴克CEO:不少買家有興趣收購中國業務部份股份,2025-06-11 16:42,https://www.metroradio.com.hk/news/default.aspx?SearchText=&NewsId=20250611164251&page=0,metro,,2025-06-11 17:00,"Starbucks星巴克行政總裁尼可(Brian Niccol)表示，星巴克計劃出售中國業務的部份股份，已有不少買家表示有興趣。

尼可接受英國《金融時報》訪問時表示，市場看到星巴克品牌的價值，包括咖啡品類銷售正在增長，認為他們很願意合作，共同探討如何將星巴克門店數量，從8千間增加到2萬間。

《路透》2月報道，包括KKR、方源資本Fountainvest，以及太盟投資PAG在內的私募基金，都有意收購星巴克中國業務部份股份。"
