title,date,url,source,section,scrape_time,news_content
天文台:料蝴蝶今日仍與本港保持約600至700公里距離,2025-06-11 12:53,https://www.metroradio.com.hk/news/default.aspx?SearchText=&NewsId=20250611125302&page=0,metro,,2025-06-11 13:00,"一號戒備信號現正生效。

天文台說，下午一時，熱帶低氣壓蝴蝶集結在香港西南偏南約640公里，預料向西北偏西移動，時速約12公里，橫過南海中部，大致移向海南島。

按照現時預測路徑，蝴蝶今日仍與本港保持約600至700公里距離，預料本港今日尚未普遍吹強風，但與其相關的外圍雨帶，正影響南海北部及廣東沿岸。 一號戒備信號會在今日大部分時間維持，預料蝴蝶今明兩日逐漸增強，並大致移向海南島，隨後移至雷州半島一帶。

天文台會視乎其強度、 與本港的距離及本地風力變化，評估是否需要在明日稍後至星期五，改發三號強風信號。 隨著蝴蝶靠近沿岸地區，本周後期風勢頗大，間中有狂風大驟雨，海有湧浪，市民應遠離岸邊及停止所有水上活動。"
陳美寶:粵港政府將不時檢視跨境貨車配額數目,2025-06-11 12:36,https://www.metroradio.com.hk/news/default.aspx?SearchText=&NewsId=20250611123614&page=0,metro,,2025-06-11 13:00,"運輸及物流局局長陳美寶表示，局方一向重視改善陸路跨境貨運安排，並在處理與跨境貨車有關的事宜時，緊守「保運力、保穩定」政策原則，確保陸路跨境貨運暢通和運力充足。

陳美寶在書面回應立法會議員質詢時表示，來往內地與香港的跨境貨車，受粵港兩地政府共同管理的配額制度所規管，由2022年至今年4月，持有有效許可證的跨境貨車數目保持約一萬輛，當中來自內地的貨車數目有增長，粵港雙方一直保持緊密聯繫，視乎兩地貨運物流發展情況、本地交通承載力和業界反應，適時檢視和優化跨境貨車便利措施，不時檢視跨境貨車配額數目，如內地有關單位提出增加配額，港方會提效加快批核，運輸署亦已優化跨境貨車的車輛評定安排，一般申請所需時間大幅縮短至最快三至四星期內。

她表示，保監局一直有就跨境車輛的保險安排，與有關當局及保險業界商討，致力提供便利和適切保險產品，包括「港車北上」的「等效先認」安排，政府會繼續留意跨境貨運物流業的發展，適時檢視有關措施。"
謝展寰:政府無計劃設立公營寵物醫療設施,2025-06-11 12:29,https://www.metroradio.com.hk/news/default.aspx?SearchText=&NewsId=20250611122955&page=0,metro,,2025-06-11 12:45,"環境及生態局局長謝展寰表示，政府並無計劃設立公營寵物醫療設施。

謝展寰在書面回覆立法會議員質詢時表示，漁農署透過公眾宣傳和教育，提醒市民在飼養寵物前必須謹慎思量，評估是否能履行飼養責任，滿足寵物在食物、住所和日常護理，以及醫療等方面的基本需求，而目前註冊獸醫數目達到1364名，涵蓋眾多專科資格，動物主人應能為其寵物找到合適的獸醫服務，市民亦可按需要購買市面上的寵物保險產品，以應對突發的醫療開支，同時香港城市大學和一些動物福利組織亦有提供獸醫服務，故此政府沒有計劃再另外設立公營寵物醫療設施。

他又指，漁護署和政府統計處會在今年下旬，再次就全港住戶飼養寵物進行主題性統計調查，以收集香港家庭飼養寵物的趨勢和偏好的最新數據，調查結果有助業界了解飼養寵物的最新趨勢，讓其按市場需求提供產品和服務。"
[本港股市]半日升229點 稀土股炒上,2025-06-11 12:23,https://www.metroradio.com.hk/news/default.aspx?SearchText=&NewsId=20250611122327&page=0,metro,,2025-06-11 12:30,"中美在倫敦就貿易框架協議達成共識，港股半日升超過200點，大市高開28點後升幅好快擴大，半日最多升過252點，恒生指數再創兩個半月高位，中午收報24392點，升229點，成交1321億元。

中資金融股上升，中人壽(02628)升百分之3，招行(03968)、平保(02318)升百分之2，工行(01398)及建行(00939)升百分之1。

新經濟股上升，阿里巴巴(09988)、百度(09888)及快手(01024)升百分之1，京東(09618)、網易(09999)升百分之2，騰訊(00700)及美團(03690)上升。

多間車企承諾將供應商支付帳款期間限制在60日內，吉利(00175)升近百分之1，比亞迪(01211)升百分之3，理想汽車(02015)偏軟，蔚來(09866)升百分之3，小鵬(09868)升百分之1，長城汽車(02333)上升。

其他汽車相關股都上升，中升控股(00881)升百分之3，寧德時代(03750)升近百分之3，浙江世寶(01057)升百分之4，耐世特(01316)升百分之1。

康師傅(00322)今日除淨，股價逆市跌百分之2，農夫山泉(09633)都跌百分之2。

鋼鋁股繼續上升，中國宏橋(01378)升百分之4，是升幅最大藍籌，中國鋁業(02600)升百分之3，馬鋼(00323)升半成，鞍鋼(00347)升百分之4。

稀土股繼續炒上，中國石墨(02237)升四成，南方錳業(01091)升兩成六，中國鐵鈦(00893)升一成八，中國稀土(00769)升一成三，金力永磁(06680)升百分之7，稀美科技(00601)升一成二，烯石電車新材料(06128)升兩成二。

國企指數報8861點，升93點。"
香港快運8月起開通吉隆坡(梳邦)航線,2025-06-11 12:13,https://www.metroradio.com.hk/news/default.aspx?SearchText=&NewsId=20250611121320&page=0,metro,,2025-06-11 12:30,"香港快運宣布，8月1日起開通來往香港與吉隆坡(梳邦)航線，每日一班直達蘇丹阿都阿兹沙機場。

吉隆坡(梳邦)是繼檳城後香港快運在馬來西亞的第二個航點，旅客出關後最快30分鐘即可快捷抵達吉隆坡市中心。"
被傳是下任聯儲局主席候選人  貝森特:已有了最棒的工作,2025-06-11 12:08,https://www.metroradio.com.hk/news/default.aspx?SearchText=&NewsId=20250611120859&page=0,metro,,2025-06-11 12:30,"彭博報道，美國財長貝森特(Scott Bessent)成為接替美國聯儲局主席鮑威爾(Jerome Powell)的熱門人選。 白宮否認。

美國總統特朗普(Donald Trump)上周曾表示，將很快任命鮑威爾的繼任人。 彭博引述知情人士指，下任聯儲局主席的面試程序，目前尚未展開，但貝森特帶領特朗普政府全面改革貿易、 稅務和監管，令他成為下任聯儲局主席的熱門競爭人選；其他被列入考慮名單的人選，還有聯儲局前理事沃什(Kevin Warsh)，特朗普在去年11月曾徵詢他擔任財長的意願；上周亦曾指，外界對沃什評價很高。

白宮官員回應彭博的報道時指，報道失實。 貝森特就說，他在華府已經有最好的工作，總統將決定誰是對經濟和美國民眾最有利的人選。

鮑威爾的聯儲局主席任期，將在明年5月屆滿，他同特朗普在減息問題上，有明顯分歧，特朗普多次公開向鮑威爾施壓，要求他減息，但鮑威爾拒絕。"
李在明視察南韓證券交易所,2025-06-11 11:58,https://www.metroradio.com.hk/news/default.aspx?SearchText=&NewsId=20250611115808&page=0,metro,,2025-06-11 12:30,"南韓總統李在明視察南韓證券交易所。

李在明在競選期間承諾，透過監管改革及監善上市公司治理，扭轉「南韓折讓」的情況，南韓傳媒報道，李在明在今日視察南韓證券交易所，成為少數在上任初期就到訪交易所的總統之一。

南韓股市繼續上升，首爾綜合指數一度升穿2900點，創2022年1月以來最高。"
華僑銀行上調本港今年GDP增長預測至2.3%,2025-06-11 11:45,https://www.metroradio.com.hk/news/default.aspx?SearchText=&NewsId=20250611114559&page=0,metro,,2025-06-11 12:00,"華僑銀行表示，受惠於中美貿易休戰帶動第二及第三季提前出貨，香港出口表現強勁，但相信在第四季或會開始回軟，考慮到今季GDP增長較預期好，金融市場交投活躍，以及內地刺激措施等短期支援因素，將今年本港GDP增長預測，由百分之2上調至百分之2.3，處於政府預測百分之2至3的範圍內，但由於外圍不確定性及中國經濟放緩風險，明年GDP增長預測由百分之2.4，下調至百分之1.9。

通脹方面，華僑銀行將今明兩年的整體通脹率預測，由百分之1.9及2，略為下調至百分之1.8及1.9。

另外，華僑銀行認為，美國的關稅政策具有高度不確定性，美國總統特朗普如要重施4月時超高關稅水平面臨障礙甚高，加上正面臨法律挑戰，限制加徵關稅的權力，預期下半年全球貿易戰將逐步降溫，資本撤離美國資產的趨勢或將放緩，減輕美元的下行壓力，市場焦點將重新回到貨幣政策，仍然預期聯儲局將分別於9月、10月及12月各減息25點子，美元匯價將繼續下跌，預測年底時會處於98.4，明年中跌至96.5。"
專家料喉管經清洗及加裝隔網後再現黑點機會低,2025-06-11 11:36,https://www.metroradio.com.hk/news/default.aspx?SearchText=&NewsId=20250611113645&page=0,metro,,2025-06-11 12:00,"粉嶺皇后山邨及山麗苑食水混雜瀝青和樹脂，專家指，經過清洗和加裝隔網後，相信再出現黑點的機會很低。

國際管線專業學會執行會長黃敬在本台節目表示，20年前的水管使用瀝青塗層，瀝青不溶於水，剝落後有機會掉入家居用水系統，房屋署已根據水務署提示，加裝隔網，相信經清洗和加裝隔網後，未來再出現黑點的機會很低。

他表示，當局公布現時仍有700公里的瀝青塗層管道，這些管道下游亦已安裝隔網，強調雖然出現黑點，但皇后山邨及山麗苑的水質本身沒有問題。 若市民不放心，可自行安裝濾水器，活性碳濾水器的效果最理想。

他認為，治本的方法是更換所有使用瀝青塗層的鋼喉，但成本會更高，需時也更長，本港2000至2015年間進行水喉復修計劃，當時處理約3千公里、使用50年或以上的喉管，現時25年過去，又有一批喉管達到年限，估計有2千至3千公里，建議應進行復修。"
任天堂Switch 2開售4日累計銷量逾350萬部,2025-06-11 11:25,https://www.metroradio.com.hk/news/default.aspx?SearchText=&NewsId=20250611112552&page=0,metro,,2025-06-11 11:45,"日本任天堂(Nintendo)新一代遊戲機Switch 2開售4日，已售出超過350萬部，相信能夠達成明年3月前售出1500萬部的目標。

Switch 2的需求持續強勁，社長古川俊太郎就消費者空手而回的Switch 2抽獎活動道歉，任天堂亦已要求合作夥伴加快生產速度，同時與樂天集團等日本線上市場營運商達成協議，阻止經銷商利用供應不足來牟利。"
暖心行動慈善基金推免費心臟篩查及資助通波仔手術,2025-06-11 11:20,https://www.metroradio.com.hk/news/default.aspx?SearchText=&NewsId=20250611112001&page=0,metro,,2025-06-11 11:30,"心臟病是本港主要致命殺手，每年導致超過7千人死亡， 「暖心行動慈善基金」宣布舉辦多一場免費心臟超聲波篩查，以及資助冠心病患者在嘉諾撒醫院進行通波仔手術，希望及早發現隱型患者並提供適切支援，紓緩公私營醫療失衡。

基金副主席陳文偉表示，繼今年4月舉辦一場免費心臟超聲波篩查後，基金將會在8月舉行第二場活動，名額100人，先到先得，歡迎慈善機構合作參與，同時會捐出140萬予嘉諾撒醫院，資助冠心病患者進行通波仔手術，預計惠及100位患者。

嘉諾撒醫院總經理許小虎表示，資助通波仔手術的對象，為在公立醫院排期進行「通波仔」手術的病人，即日起接受申請，市民可於暖心行動網站報名，及早把握治療機會。"
洛杉磯市中心實施宵禁 特朗普揚言會解放洛杉磯,2025-06-11 11:10,https://www.metroradio.com.hk/news/default.aspx?SearchText=&NewsId=20250611111004&page=0,metro,,2025-06-11 11:30,"美國洛杉磯市長巴斯(Karen Bass)宣布，當地進入緊急狀態，在洛杉磯市中心約3平方公里範圍內，實施宵禁，包括自上周五起爆發示威的區域。 巴斯說，預計宵禁會持續數天，其間，每晚8時至翌日早上6時，除獲豁免人士，所有在宵禁區域內的人都可能被捕，。 巴斯說，在有20多間商舖遭搶掠後，情況已去到臨界點，為遏止蓄意破壞和搶掠，所以在市中心實施宵禁。

洛杉磯警察局局長麥克唐納(Jim McDonnell)就說，過去幾天，已有378人被捕；又指洛杉磯的動盪局面不斷加劇，違法和危險行為不斷升級，情況令人擔憂，宵禁是保護生命財產的必要措施。

美國總統特朗普(Donald Trump)就指洛杉磯的騷亂，是一群暴徒對和平、 公共秩序和國家主權的全面攻擊，目的是持續對美國進行「外國侵略」。 他批評加州州長紐森(Gavin Newsom)和巴斯無能，掦言將持續在洛杉磯部署軍隊，直至出現和平。

美國移民與海關執法局等聯邦機構，上周出動大批執法人員，在洛杉磯縣多地搜捕非法移民，並同當地民眾爆發衝突。 特朗普在紐森沒有提出要求下，下令向洛杉磯地區派出2000名國民警衛隊人員；另外約700名海軍陸戰隊人員已抵達當地，保護聯邦政府機權和人員。 加州政府入稟法院，要求撤銷特朗普的命令，法官拒絕，但會在本月12日就此舉行聽證會。"
港足啟德主場館出戰逾4.2萬人入場 鄭泳舜:應發展主場經濟,2025-06-11 10:53,https://www.metroradio.com.hk/news/default.aspx?SearchText=&NewsId=20250611105359&page=0,metro,,2025-06-11 11:00,"港隊昨晚首次在啟德體育園主場館作賽，在亞洲區足球外圍賽，最終以1比0戰勝印度，入場人數超過4萬2000人破歷來紀錄。

大型體育活動事務委員會副主席、立法會議員鄭泳舜表示，他昨晚有到場，形容現場氣氛非常好，形容是「一片紅海」，認為昨晚入場觀眾群，很多都是支持港隊及本地體育發展，過往有很多人指，本港要舉辦盛事需要邀請外國球隊或歌手來港，今次賽事引證有市民願意入場支持本地運動，希望各方面都可以把握契機，令本港可以發展「主場經濟」及「應援經濟」。

鄭泳舜表示，可以考慮成立專門針對啟德體育園的委員會，研究體育園未來產業化發展，而大型體育活動事務委員會正努力尋找不同國際賽事來港舉行，其中一個大型電競賽事11月會重返香港，預計可吸引3萬多人來港。

浸大運動及健康科學系教授劉永松表示，昨晚賽事非常成功，形容是前所未有的主場氣氛，認為與賽事票價實惠，場館新淨及交通方便，增加入場吸引力有關，相信本港有很多運動可以產業化發展，包括獨木舟及風帆等水上運動，可以聯同東南亞及大灣區等舉辦賽事。"
陳茂波:正排隊上市公司隊伍非常強大,2025-06-11 10:45,https://www.metroradio.com.hk/news/default.aspx?SearchText=&NewsId=20250611104521&page=0,metro,,2025-06-11 11:00,"財政司司長陳茂波表示，外資之前低配中國資產，而今年DeepSeek崛起，令外資重新評估內地的技術實力和創新潛力，資金陸續回流，不少新股亦都準備上市，估計股市將會繼續維持強勁。

陳茂波在一個論壇上表示，在地緣政治局勢緊張下，內地科技股到美國上市難度增加，如果要尋求國際融資，香港是自然選擇，同時中央支持內地龍頭企業來港上市，形容目前正籌備在港上市的「隊伍」非常強大，已提醒證監會及港交所(00388)做好中概股回港上市的工作準備。

陳茂波又表示，內地國際國內大循環戰略需要激活內需，同時中央政府推動企業出海，如果內地可以通過布局東南亞等新興市場，既能分散產業鏈風險，又可結合文化相近優勢，內地企業出海趨勢勢不可擋，將帶動區域經濟增長。"
據報印度及美國會談就達成臨時貿易協議取得進展,2025-06-11 10:21,https://www.metroradio.com.hk/news/default.aspx?SearchText=&NewsId=20250611102112&page=0,metro,,2025-06-11 10:30,"印度和美國談判代表在新德里就雙邊貿易協議舉行最新一輪談判,重點討論工業品和部份農產品的市場準入、降低關稅和非關稅壁壘等問題，據報談判取得進展。

《路透》引述    消息人士指，與美方舉行的談判富有成效，朝著達成互利和平衡的協議取得進展，兩國貿易官員在閉門談判上，討論通過改善海關和貿易便利化措施，增加雙邊數字貿易，談判將會繼續進行，以早日達成首批貿易協定，預計雙方將在月底前簽署臨時協議，即是特朗普暫緩對等關稅期間屆滿前。

報道又引述消息人士指，下一階段談判可能會處理更複雜的問題，目標是在9月或10月簽署第一批雙邊貿易協定，當中，印度拒絕美國的要求，開放小麥、乳製品和玉米市場，但會降低杏仁、開心果和核桃等高價值美國產品的關稅。"
中國國家副主席韓正抵達西班牙展開為期四天訪問,2025-06-11 10:13,https://www.metroradio.com.hk/news/default.aspx?SearchText=&NewsId=20250611101353&page=0,metro,,2025-06-11 10:30,"中國國家副主席韓正周二抵達西班牙，開始為期四天的訪問，期間他將會見西班牙國王費利佩六世(Felipe VI)及首相桑切斯(Pedro Sanchez)。

桑切斯辦公室表示，韓正周三上午將在馬德里會見桑切斯。 根據王室的日程安排，費利佩國王將於周四接見韓正。 費利佩並計劃於今年較後時間訪問中國，以紀念中西戰略夥伴關係簽署20周年。

兩個月前桑切斯訪問中國，是三年內第三次訪華。 在美國特朗普關稅政策影響全球貿易之際，爭取與北京建立更緊密的經濟和政治關係。   桑切斯希望讓西班牙扮演中國與歐盟之間的對話人，並吸引更多中國在電池、電動汽車和氫能等先進技術領域的投資。"
馬斯克:暫定本月22日起向公眾提供Robotaxi服務,2025-06-11 10:11,https://www.metroradio.com.hk/news/default.aspx?SearchText=&NewsId=20250611101110&page=0,metro,,2025-06-11 10:30,"Tesla特斯拉行政總裁馬斯克(Elon Musk)表示，暫定6月22日開始在德州奧斯汀向公眾提供自動駕駛的士服務Robotaxi。

馬斯克在社交平台表示，公司對安全問題非常執著，因此最終日期可能會改變，Robotaxi首次由Tesla工廠開往客戶家的試駕將在本月28日進行。

《路透》分析指，馬斯克將Tesla的未來押注在自動駕駛汽車，  放棄打造更便宜電動車平台，Tesla的估值很大程度上取決於自動駕駛願景，但由於安全隱患、嚴格的監管和不斷飆升的投資，自動駕駛汽車的商業化一直充滿挑戰，  許多人對馬斯克的計劃持懷疑態度。"
[內地股市]早段上升,2025-06-11 10:07,https://www.metroradio.com.hk/news/default.aspx?SearchText=&NewsId=20250611100733&page=0,metro,,2025-06-11 10:30,"內地股市早段上升。

上證綜合指數最新報3408點，升23點，升幅百分之0.7。

深證成份指數最新報10274點，升112點，升幅百分之1.11。

滬深300指數最新報3904點，升39點，升幅百分之1.01。"
[澳紐股市]早段上升,2025-06-11 10:06,https://www.metroradio.com.hk/news/default.aspx?SearchText=&NewsId=20250611100635&page=0,metro,,2025-06-11 10:30,"澳紐股市早段上升。

標普澳洲200指數最新報8620點，升33點，升幅百分之0.39。

新西蘭50隻成份股指數最新報12619點，升54點，升幅百分之0.44。"
[台灣股市]早段上升,2025-06-11 10:05,https://www.metroradio.com.hk/news/default.aspx?SearchText=&NewsId=20250611100537&page=0,metro,,2025-06-11 10:30,"台灣股市早段上升。

加權指數最新報22354點，升112點，升幅百分之0.51。"
[南韓股市]早段上升,2025-06-11 10:05,https://www.metroradio.com.hk/news/default.aspx?SearchText=&NewsId=20250611100506&page=0,metro,,2025-06-11 10:30,"南韓股市早段上升。

首爾綜合指數最新報2887點，升15點，升幅百分之0.53。"
[日本股市]早段上升,2025-06-11 10:04,https://www.metroradio.com.hk/news/default.aspx?SearchText=&NewsId=20250611100437&page=0,metro,,2025-06-11 10:15,"日本股市早段上升。

日經平均指數最新報38378點，升166點，升幅百分之0.44。"
美國加州請求法院阻止特朗普政府向加州派兵,2025-06-11 10:01,https://www.metroradio.com.hk/news/default.aspx?SearchText=&NewsId=20250611100113&page=0,metro,,2025-06-11 10:15,"美國加州州長紐森(Gavin Newsom)及總檢察長邦塔(Rob Bonta)，星期二向法院提交臨時限制令動議，請求法院立即採取行動，阻止特朗普(Donald Trump)政府動用美軍及加州國民警衛隊，在加州各社區巡邏及參與其他執法活動。 原告是加州政府和州長紐森，被告是總統特朗普、國防部長赫格塞斯(Pete Hegseth)及國防部。 加州總檢察長辦公室表示，加州政府認為聯邦政府動用軍隊的行為是非法，剝奪州政府調動國民警衛隊的權利，加劇緊張局勢，而非平息眾騷亂。

加州政府之前一日已向法院提出訴訟，請求法院裁定特朗普上周六發布的總統備忘錄和美國國防部調遣加州國民警衛隊進駐洛杉磯地區的命令違法，請求法院撤銷相關命令。 當地媒體報道，法院有可能在星期二就加州相關訴訟和動議作出初步裁決。"
[本港股市]早段升近200點,2025-06-11 09:58,https://www.metroradio.com.hk/news/default.aspx?SearchText=&NewsId=20250611095808&page=0,metro,,2025-06-11 10:15,"港股上升，大市高開28點後升幅好快擴大，恒生指數最新報24351點，升188點。

新經濟股上升，阿里巴巴(09988)、京東(09618)及網易(09999)升百分之1，騰訊(00700)、快手(01024)、美團(03690)靠穩，百度(09888)亦升百分之1。

多間車企承諾將供應商支付帳款期間限制在60日內，吉利(00175)升百分之2，比亞迪(01211)急升半成，理想汽車(02015)跌百分之1，蔚來(09866)升百分之3，小鵬(09868)升百分之2，長城汽車(02333)升百分之1。

其他汽車相關股都上升，中升控股(00881)升百分冖13，寧德時代(03750)升百分之3，浙江世寶(01057)升半成，耐世特(01316)升百分之4。

康師傅(00322)今日除淨，股價跌百分之3，是跌幅最大藍籌。

國企指數報8851點，升94點。"
天文台:現時在南海中部的熱帶低氣壓已命名為蝴蝶,2025-06-11 09:56,https://www.metroradio.com.hk/news/default.aspx?SearchText=&NewsId=20250611095630&page=0,metro,,2025-06-11 10:15,"一號戒備信號現正生效。

天文台說，位於南海中部的熱帶低氣壓已命名為蝴蝶。 上午10時，蝴蝶集結在香港以南約680公里，預料向西北偏西移動，時速約12公里，橫過南海中部，大致移向海南島。

按照現時預測路徑，蝴蝶今日仍與本港保持約700公里距離，預料本港今日尚未普遍吹強風，但與其相關的外圍雨帶，正影響南海北部及廣東沿岸。 一號戒備信號會在今日大部分時間維持，預料蝴蝶會在未來一兩日逐漸增強，並大致移向海南島，隨後移至廣東西部沿岸一帶。

天文台會視乎其強度、與本港的距離及本地風力變化，評估是否需要在明日稍後至星期五，改發三號強風信號。 隨著蝴蝶靠近沿岸地區，本周後期風勢頗大，間中有狂風大驟雨，海有湧浪，市民應遠離岸邊及停止所有水上活動。"
海天味業今起招股 入場費約3667元,2025-06-11 09:52,https://www.metroradio.com.hk/news/default.aspx?SearchText=&NewsId=20250611095242&page=0,metro,,2025-06-11 10:15,"內地醬油生產商龍頭--海天味業(03288)今起招股。

公司計劃全球發售2億6323萬7500股H股，當中百分之6在本港公開發售。 招股價介乎每股35至36.3元，每手100股，入場費3666.62元。 本月16日截止認購，預計19日在主板掛牌。

以招股中間價35.65元計，所得款項淨額約92億7120萬元。 當中，三成用於產能擴張、採納新技術及供應鏈的數字化升級；兩成用於產品開發以及前沿技術的研發和工藝升級；兩成用於建立全球品牌形象、拓展銷售渠道以及提升海外供應鏈能力；兩成用於增強銷售網絡及提升其滲透能力。

公司引入8名基石投資者，包括高瓴集團、新加坡外匯儲備管理者GIC、瑞銀資產管理、博裕、佛山市國資委控制的佛山發展等，合共投資5億9500萬美元。

聯席保薦人中金、高盛及摩根士丹利。

海天味業於上交所上市，A股市值約2320億元人民幣。 以去年收入計，公司在中國調味品市場排行首位，市場份額百分之4.8，全球排名第五，市場份額百分之1.1。 主要產品是醬油，在中國市場佔有率百分之13.2，全球市場佔有率百分之6.2。 公司今年首季純利22億元人民幣，按年增長一成半，營業額83億元人民幣，上升百分之8。"
