title,date,url,source,section,scrape_time,news_content
港股半日跌254點 百度挫7%京東挫4%,2025-09-23 12:14,https://www.metroradio.com.hk/news/default.aspx?SearchText=&NewsId=20250923121419&page=0,metro,,2025-09-23 12:30,"港股先升後倒跌，大市高開91點後好快倒跌，之後跌幅持續擴大，恒生指數失守26100點水平，半日最多跌過283點，中午收市報26090點，跌254點。

新經濟股普遍下跌，百度(09888)跌超過百分之7，是跌幅最大藍籌，京東集團(09618)跌超過百分之4，美團(03690)跌百分之2，快手(01024)跌百分之1，騰訊(00700)跌近百分之1，阿里巴巴(09988)亦偏軟，但網易(09999)逆市上升。

汽車股下跌，比亞迪(01211)跌百分之3，理想汽車(02015)及吉利(00175)跌百分之2，小鵬(09868)下跌，蔚來(09866)跌百分之7。

醫藥股下跌，石藥集團(01093)及中生製藥(01177)跌半成，藥明康德(02359)跌百分之4，藥明生物(02269)跌百分之2，翰森製藥(03692)跌百分之1。

金融股上升，中銀香港(02388)、工行(01398)、恒生(00011)升百分之1，建行(00939)及招行(03968)上升。

雲智匯科技(01037)與優必選合作人形機械人業務，股價復牌後一度急升一倍，半日升七成九。

國企指數報9261點，跌109點。"
樺加沙正面登陸 廣東省發布緊急動員令防禦,2025-09-23 11:53,https://www.metroradio.com.hk/news/default.aspx?SearchText=&NewsId=20250923115353&page=0,metro,,2025-09-23 12:15,"超強颱風樺加沙逼近，廣東省將防風應急響應提升至一級，並發布緊急動員令。

中央氣象台繼續發布颱風橙色預警。 預計樺加沙將於明日，在廣東深圳到徐聞一帶沿海登陸。 受樺加沙影響，未來三天，南海及華南等地將出現強風雨天氣。

已經宣布進入「臨戰狀態」的廣東省，發布緊急動員令，全省動員投入防風防汛和搶險救災工作，並加強監測預警。 省內城市相繼宣布，啟動「五停」措施。 其中深圳市，昨晚已開始停課，今日下午2時起會停工、停業和停市， 晚上8時起停運。 深圳地鐵宣布，全線服務會今日將提早結束，尾班車將在今晚6時開出。

當局又預計，樺加沙會在今晚開始，對深圳市造成嚴重風雨浪潮洪影響，會在今晚6時起，在全市啟動防颱風和防汛一級應急響應。 當局呼籲，除搶險人員和民生保障人員外，其他人切勿隨意外出。"
天文台料明有極巨浪 雨帶開始影響廣東東部,2025-09-23 11:52,https://www.metroradio.com.hk/news/default.aspx?SearchText=&NewsId=20250923115240&page=0,metro,,2025-09-23 12:15,"三號強風信號現正生效，天文台預料本港今日稍後，天氣開始急速轉壞，將於下午2時20分改發八號烈風或暴風信號。

超強颱風樺加沙今早繼續穩定地移近廣東沿岸，其外圍雨帶開始影響廣東東部，樺加沙環流廣闊，風勢猛烈，對廣東沿岸構成嚴重威脅。 按照現時預測，樺加沙會維持超強颱風的強度，明早最接近珠江口一帶，天文台會視乎樺加沙與香港的距離，以及本地風力變化，評估今晚較後時間至明日初時，是否需要改發更高熱帶氣旋警告信號。

受顯著風暴潮影響，明日本港沿岸增水可達約2米，預計水位早上約6時後開始上升，並在早上較後時間至下午初時達至最高，普遍可達海圖基準面以上約3.5米至4米，而吐露港水位更可能高達海圖基準面以上4米至5米。

天文台預料本港明日天氣持續惡劣，吹烈風至暴風，初時離岸及高地達颶風，有頻密狂風大驟雨及雷暴，海有極巨浪及湧浪，市民應遠離岸邊及停止所有水上活動。"
公立醫院非緊急服務下午起暫停,2025-09-23 11:47,https://www.metroradio.com.hk/news/default.aspx?SearchText=&NewsId=20250923114716&page=0,metro,,2025-09-23 12:00,"教育局宣布所有學校今明兩日停課；社署呼籲市民不要送子女或家人到日間服務單位，八號信號生效後，相關單位將不會開放。

公立醫院非緊急服務下午起暫停，醫管局呼籲非緊急病人，不應在風暴或惡劣天氣期間，前往公立醫院或診所，以免發生危險，醫院會在八號信號取消後，盡快恢復非緊急服務，並在未來一星期通知受影響的病人，另約診症日期。

衞生署宣布，除了美沙酮診所按照正常服務時間開放外，其餘衞生署診所下午服務暫停。"
深圳地鐵今日提早結束營運 尾班車6時開出,2025-09-23 11:46,https://www.metroradio.com.hk/news/default.aspx?SearchText=&NewsId=20250923114620&page=0,metro,,2025-09-23 12:00,"超強颱風樺加沙逼近，廣東省將防風應急響應提升至一級；深圳下午起實施「五停」措施，深圳地鐵全線提前結束營運。

中央氣象台繼續發布颱風橙色預警。 預計樺加沙將於明日，在廣東深圳到徐聞一帶沿海登陸。 受樺加沙影響，未來三天，南海及華南等地將出現強風雨天氣。

繼江門和珠海宣布「五停」措施後，深圳、 東莞、 茂名和湛江等多個城市，亦啟動「五停」措施，包括停課、停工、停產、停運和停業。

其中深圳市，昨晚已開始停課，今日下午2時起會停工、停業和停市， 晚上8時起停運。 深圳地鐵宣布，全線服務會今日將提早結束營運，尾班車將在今晚6時開出。

當局又預計，樺加沙會在今晚開始，對深圳市造成嚴重風雨浪潮洪影響，會在今晚6時起，在全市啟動防颱風和防汛一級應急響應。 當局呼籲，除搶險人員和民生保障人員外，其他人切勿隨意外出，全市會開放全部室内避險場所，供民眾避險。"
何永賢指當局對重啟租置計劃持開放態度,2025-09-23 11:34,https://www.metroradio.com.hk/news/default.aspx?SearchText=&NewsId=20250923113413&page=0,metro,,2025-09-23 11:45,"房屋局局長何永賢表示，公屋租置計劃有其價值，很多公屋住戶都希望政府重啟計劃，當局持開放態度，但要考慮定價、 重啟時機，以及混合業權等問題。

何永賢在電台節目指，現時39個租置屋邨，仍有3萬個單位未售出，房委會每年收回約2300個單位，納入居屋和綠置居計劃出售。 她說，有政黨期望當局以兩折出售單位，當局未必計到數，而即使公屋輪候時間下降，但重啟計劃會令可回收編配的單位便會減少，需要考慮推出的正確時機。

她又指，未來5年資助出售單位有近5萬9千伙，不同資助出售項目如何分野，以及最終效果是豐富置業階梯，抑或爭奪同一批人購買，當局都要小心研究。"
德勤料本港首三季新股集資逾1800億 續居全球第一,2025-09-23 11:29,https://www.metroradio.com.hk/news/default.aspx?SearchText=&NewsId=20250923112916&page=0,metro,,2025-09-23 11:45,"會計師事務所德勤表示，本港首三季有66隻新股上市，按年升四成七，集資1823億港元，按年升2.28倍，繼續排名全球第一。 首三季全球十大新股中，有4隻在本港上市。

至於紐約及納斯達克交易所分別排名第二、三位，印度交易所排名第四。 上交所以25隻新股、集資493億港元排名第五，深交所就排名第八。

德勤表示，受惠於內地龍頭企業來港上市的政策，及本港優化新上市申請審批流程，同時國際資金回流本港，流動性顯著改善，市場估值穩步回升，帶動首三季本港新股市場勢頭強勁，約六成融資額來自6隻超大型新股，整體融資額較去年同期急升超過兩倍。"
GUM:9月首18日強積金人均賺逾9000元,2025-09-23 11:27,https://www.metroradio.com.hk/news/default.aspx?SearchText=&NewsId=20250923112703&page=0,metro,,2025-09-23 11:45,"強積金顧問GUM的數據顯示，本港強積金在9月首18日，人均賺超過9000元。

GUM表示，9月首18日本港強積金基金平均投資回報百分之2.9，人均賺9044元，以股票基金表現最好，回報達到百分之4.5，混合資產基金回報百分之2.5，固定收益基金回報亦有百分之0.2。

大中華基金投資回報最高，達到百分之7.3，香港股票基金、追蹤指數的香港股票基金，以及亞洲股票基金回報都超過百分之6。

年初至今強積金基金平均回報百分之15.2，人均賺41460元，當中，大中華基金、香港股票基金，以及追蹤指數的香港股票基金回報超過介乎百分之34.5至35.5，表現是15年以來同期最好。"
廣西將推組建一家關鍵金屬產業發展國有企業集團,2025-09-23 11:21,https://www.metroradio.com.hk/news/default.aspx?SearchText=&NewsId=20250923112145&page=0,metro,,2025-09-23 11:45,"廣西壯族自治區人民政府官網表示，自治區黨委書記陳剛，主持召開自治區黨委全面深化改革委員會第十四次會議，專題研究廣西有色金屬，特別是關鍵金屬產業高質量發展工作，會議強調要推動有色金屬特別是關鍵金屬產業高質量發展，要重點抓好「十個一」，包括組建一家廣西關鍵金屬產業發展國有企業集團，開展資產評估，優化股權結構，加快完成集團組建並投入營運。

會議又強調，要引入並培育壯大一批龍頭企業，健全政策支持體系，引領帶動全區有色金屬優質企業發展，推出精准化支持政策舉措，創新融資模式，優化要素配置，著力營造有利於有色金屬產業高質量發展的環境及條件。

會議又提出，要建立廣西有色金屬產業高質量發展五年規劃、關鍵金屬產業創新發展五年規劃，以及鋁産業發展規劃和八個具體實施方案，高質量打造一個南丹關鍵金屬綜合試驗區，集中開展一次礦權整合和「小散亂」企業綜合治理專項行動，完善礦權管理體系。"
工信部:開闢人形機器人及腦機接口等新賽道,2025-09-23 11:16,https://www.metroradio.com.hk/news/default.aspx?SearchText=&NewsId=20250923111659&page=0,metro,,2025-09-23 11:30,國家工信部部長李樂成，在第25屆中國國際工業博覽會開幕式上致辭時表示，要實施培育新興産業打造新動能行動，統籌技術創新、規模化發展和應用場景建設，加快打造一批新興支柱產業，建立未來產業投入增長機制，加強前沿技術研發和應用推廣，開闢人形機器人、腦機接口、元宇宙、量子信息等新賽道，創建一批未來產業先導區。
樺加沙在台灣釀30多宗災情 6人受傷,2025-09-23 11:13,https://www.metroradio.com.hk/news/default.aspx?SearchText=&NewsId=20250923111343&page=0,metro,,2025-09-23 11:30,"超強颱風樺加沙在台灣，最少造成34宗災情，6人受傷。

恆春半島已脫離樺加沙的暴風圈，當局已解除陸上警報，但受樺加沙的外圍環流豪雨影響，氣象署提醒14縣市要留意雨勢，其中高雄市和宜蘭縣可能有大豪雨；屏東縣、 花蓮縣和台東縣，更可能有超大豪雨。 當局擔心，花蓮縣的馬太鞍溪堰塞湖，有溢流風險，疏散附近1800多戶居民，花蓮縣特搜隊待命。

台鐵就宣布，晚上6時前，南迴線、 北迴線和台東線停駛，其餘路線服務正常。"
羅淑佩:旅客在演唱會等消費意欲高願留港,2025-09-23 11:10,https://www.metroradio.com.hk/news/default.aspx?SearchText=&NewsId=20250923111005&page=0,metro,,2025-09-23 11:30,"文化體育及旅遊局局長羅淑佩表示，現時旅客消費金額確實有所下降，由於經濟面對挑戰，全球的奢侈品需求都減少，並非香港獨有現象，而旅客在演唱會、球賽、周邊紀念品等方面的消費意欲高，亦願意在港過夜。

羅淑佩在本台節目表示，本港舉辦演唱會，通常提供約100至110班跨境巴士，但上月中一名內地歌迷基礎較大的女歌手，在港舉辦演唱會，雖然是平日，但最終只需動用80班跨境巴士，反映內地旅客除了看演唱會，也會留港過夜及參與其他活動，包括看球賽、參觀展覽、探訪熊貓等。

對於新一份施政報告提出發展遊艇經濟，羅淑佩表示，遊艇旅遊可帶來高端旅客，未來可考慮開放租借遊艇及遊艇自駕遊。 郵輪方面，今年郵輪航次按年增加兩成，達到188班，平均隔天一班，認為恢復情況良好，但要更加活用郵輪碼頭，例如舉辦時尚展、作藝術孵化基地等，當局將於年底為2028年郵輪碼頭營辦商招標，希望中標者及早籌劃業務，以免出現空白期。"
何永賢指當局嚴陣以待已視察屋邨防風措施,2025-09-23 10:58,https://www.metroradio.com.hk/news/default.aspx?SearchText=&NewsId=20250923105839&page=0,metro,,2025-09-23 11:15,"超強颱風樺加沙逼近，房屋局局長何永賢表示，當局嚴陣以待，已經分別前往位於最高點及最低點的公共屋邨，視察應對措施。 其中，屬於最高點的安達臣道安泰邨，大廈天台太陽能板已經加固， 而位於最低點的黃大仙邨，前往港鐵站的通道已經安裝大部份水閘，餘下部份能夠因應天氣情況，在15至20分鐘內完成安裝。

何永賢在電台節目指，因應強風吹襲，地盤棚架的網需要收好，以免受風倒塌，其他物料亦紮緊，並將天秤鬆開。 她又指，當局已經開始計劃善後工作，包括呼籲地盤團隊在颱風過後，協助清理附近街道的倒塌樹木及淤泥。"
中行協助深圳市政府在港發行40億離岸人民幣地方政府債券,2025-09-23 10:49,https://www.metroradio.com.hk/news/default.aspx?SearchText=&NewsId=20250923104959&page=0,metro,,2025-09-23 11:15,"中國銀行(03988)在香港再度協助深圳市人民政府，發行總值40億元的離岸人民幣地方政府債券，並首次引入大灣區主題可持續發展債券品種，資金將投向清潔交通、水治理等項目。

中國銀行為此次發行的結算交割行、聯席主承銷商兼聯席賬簿行，並以綠色、社會責任和可持續發展結構顧問身份，協助相關債券獲得香港品質保證局綠色和可持續金融發行前階段的認證。

今次深圳市政府在港發行的債券，包括15億元的2年期、10億元的5年期，以及15億元的10年期債券，當中2年期為普通債券，5年期為大灣區主題可持續發展債券，10年期為社會責任債券，定價利率分別為1.61、1.8及2.08厘，訂單簿峰值規模達186億7千萬元人民幣，訂單倍數高達4.7倍，受到各類型投資者的廣泛關注和積極參與。

中銀香港(02388)副總裁王化斌表示，深圳市人民政府連續第五年來港發債，加上早前在澳門市場首次發債，充分彰顯深圳市進一步推動粵港澳大灣區金融市場互聯互通的決心，今年在港發行的債券首次引入大灣區主題可持續發展債券品種，進一步豐富離岸人民幣債券種類，體現深圳市人民政府在金融創新與社會責任方面的前瞻性佈局，同時反映境外投資者對人民幣債券資產的持續需求，有助進一步鞏固香港作為全球離岸人民幣業務樞紐的地位，在穩慎扎實推進人民幣國際化方面發揮積極作用。"
深圳下午起實施「五停」措施,2025-09-23 10:25,https://www.metroradio.com.hk/news/default.aspx?SearchText=&NewsId=20250923102521&page=0,metro,,2025-09-23 10:45,"超強颱風樺加沙逼近，深圳下午起實施「五停」措施。

中央氣象台繼續發布颱風橙色預警。 預計樺加沙將於明日，在廣東深圳到徐聞一帶沿海登陸，登陸後，轉向偏西方向移動，強度逐漸減弱。 受樺加沙影響，未來三天，南海及華南等地將出現強風雨天氣。

繼江門和珠海宣布「五停」措施後，即停課、停工、停產、停運和停業，深圳、 東莞、 茂名和湛江等多個城市，亦啟動「五停」措施。

其中深圳市，昨晚已開始停課，今日下午2時起會停工、停業和停市， 晚上8時起停運。 當局又預計，樺加沙會在今晚開始，對深圳市造成嚴重風雨浪潮洪影響，會在今晚6起起，在全市啟動防颱風和防汛一級應急響應。 當局呼籲，除搶險人員和民生保障人員外，其他人切勿隨意外出，全市會開放全部室内避險場所，供民眾避險。"
人行今進行2761億元人民幣逆回購操作,2025-09-23 10:24,https://www.metroradio.com.hk/news/default.aspx?SearchText=&NewsId=20250923102415&page=0,metro,,2025-09-23 10:45,"人民銀行今日進行2761億元人民幣的7天期逆回購操作，操作利率維持在1.4厘。

由於今日有2870億元人民幣的逆回購操作到期，人行公開市場今日資金淨回籠109億元人民幣。

†"
人民幣兌美元中間價報7.1057 上升49點,2025-09-23 10:23,https://www.metroradio.com.hk/news/default.aspx?SearchText=&NewsId=20250923102304&page=0,metro,,2025-09-23 10:45,"人民幣中間價上升。

人民幣兌美元中間價報7.1057，較上日中間價上升49點子。"
內地股市早段下跌,2025-09-23 10:21,https://www.metroradio.com.hk/news/default.aspx?SearchText=&NewsId=20250923102138&page=0,metro,,2025-09-23 10:45,"內地股市早段下跌。

上證綜合指數報3802點，跌26點，跌幅百分之0.69。

深證成份指數報13084點，跌73點，跌幅百分之0.56。

滬深300指數報4512點，跌10點，跌幅百分之0.23。"
台灣股市早段上升,2025-09-23 10:20,https://www.metroradio.com.hk/news/default.aspx?SearchText=&NewsId=20250923102031&page=0,metro,,2025-09-23 10:45,"台灣股市早段升超過百分之1，再創紀錄新高。

加權指數報26160點，升280點，升幅百分之1.08。"
南韓股市早段上升,2025-09-23 10:19,https://www.metroradio.com.hk/news/default.aspx?SearchText=&NewsId=20250923101933&page=0,metro,,2025-09-23 10:45,"南韓股市早段上升。

首爾綜合指數報3477點，升9點，升幅百分之0.25。"
日本股市早段上升,2025-09-23 10:15,https://www.metroradio.com.hk/news/default.aspx?SearchText=&NewsId=20250923101523&page=0,metro,,2025-09-23 10:45,"日本股市早段上升。

日經平均指數報45493點，升447點，升幅百分之1。"
衞生署除美沙酮診所外其餘診所下午暫停服務,2025-09-23 10:13,https://www.metroradio.com.hk/news/default.aspx?SearchText=&NewsId=20250923101313&page=0,metro,,2025-09-23 10:30,"教育局宣布所有學校今明兩日停課；社署呼籲市民不要送子女或家人到日間服務單位，八號信號生效後，相關位將不會開放。

公立醫院早上維持正常的非緊急服務，八號信號後生效後，所有非緊急服務會暫停。

衞生署宣布，除了美沙酮診所按照正常服務時間開放外，其餘衞生署診所下午服務暫停。"
港股早段先升後跌 百度挫6%,2025-09-23 10:10,https://www.metroradio.com.hk/news/default.aspx?SearchText=&NewsId=20250923101029&page=0,metro,,2025-09-23 10:30,"港股先升後回，大市高開91點後好快倒跌，一度跌過百點，恒生指數最新報26297點，跌46點。

新經濟股個別發展，阿里巴巴(09988)升百分之2，網易(09999)升百分之1，騰訊(00700)偏軟，百度(09888)跌百分之6，京東(09618)跌百分之3，美團(03690)跌百分之2。

汽車股下跌，比亞迪(01211)跌百分之2，理想汽車(02015)跌百分之1，吉利(00175)偏軟，小鵬(09868)下跌，蔚來(09866)跌百分之6。

雲智匯科技(01037)與優必選合作人形機械人業務，股價復牌急升一倍。

國企指數報9301點，跌69點。"
天文台料水位明早約6時後開始上升,2025-09-23 10:05,https://www.metroradio.com.hk/news/default.aspx?SearchText=&NewsId=20250923100549&page=0,metro,,2025-09-23 10:15,"三號強風信號現正生效，天文台預料本港今日稍後，天氣開始急速轉壞，將於下午2時20分改發八號烈風或暴風信號。

過去數小時，超強颱風樺加沙繼續移近廣東沿岸，樺加沙環流廣闊，風勢猛烈，對廣東沿岸構成嚴重威脅。 按照現時預測，樺加沙會維持超強颱風的強度，明早最接近珠江口一帶，天文台會視乎樺加沙與香港的距離，以及本地風力變化，評估今晚較後時間至明日初時，是否需要改發更高熱帶氣旋警告信號。

受顯著風暴潮影響，明日本港沿岸增水可達約2米，預計水位早上約6時後開始上升，並在早上較後時間至下午初時達至最高，普遍可達海圖基準面以上約3.5米至4米，而吐露港水位更可能高達海圖基準面以上4米至5米。

天文台預料本港明日天氣持續惡劣，吹烈風至暴風，離岸及高地可能達颶風，有頻密狂風大驟雨及雷暴，海有非常巨浪及湧浪，市民應遠離岸邊及停止所有水上活動。"
以色列稱將採取行動 回應各國承認巴勒斯坦國,2025-09-23 10:03,https://www.metroradio.com.hk/news/default.aspx?SearchText=&NewsId=20250923100301&page=0,metro,,2025-09-23 10:15,"多個西方大國承認巴勒斯坦國，但以巴和平前景仍然不明朗。 以色列表明，會採取行動，回應各國的「承認潮」。

以色列常駐聯合國代表達農(Danny Danon)批評，在聯合國總部召開的落實「兩國方案」會議，只是一場各國為了滿足內部政治的戲，以色列會繼續反恐行動；又指已經沒有「兩國方案」。 達農說，總理內塔尼亞胡(Benjamin Netanyahu)會在訪美後，宣布採取甚麼行動，回應多國承認巴勒斯坦國。

內塔尼亞胡在與軍方高層舉行，猶太新年祝酒活動時說，未來一年，以色列決心實現所有戰爭目標，而目標不限於加沙地帶，還要在各領域開闢安全、 勝利與和平的新機遇。 他強調，以色列必須、 而且有能力，摧毀「伊朗軸心」.

美國白宮就說，總統特朗普(Donald Trump)明確反對承認巴勒斯坦國，認為無助於確保人質獲釋，亦不能結束以巴衝突。"
羅淑佩:已呼籲酒店業界惡劣天氣下維持合理價錢,2025-09-23 09:55,https://www.metroradio.com.hk/news/default.aspx?SearchText=&NewsId=20250923095507&page=0,metro,,2025-09-23 10:15,"超強颱風「樺加沙」襲港，網上旅遊平台顯示，有位於機場附近的酒店，一晚房價高達五位數。

文化體育及旅遊局局長羅淑佩在本台節目上表示，已呼籲酒店業界維持合理價錢，不要趁天氣惡劣時將價錢抬得過高，重申今次颱風「非同小可」，呼籲市民不要到海灘或進行水上活動。

羅淑佩在本台節目表示，施政報告提出在康文署場所引入市場營運模式，可將康文署場地出租予商業活動，舉例巴黎奧運時劍擊比賽在當地的博物館舉行，而本港早前也在故宮博物館舉辦劍擊表演賽，大眾認為有新意，也藉此讓場地物盡其用，增加收入，並提升博物館的地位，局方大力支持。

她又表示，當局周四會到立法會回答有關「香港國際熱氣球節」的口頭質詢，強調本屆政府的角色是促進者，會拆牆鬆綁，但活動必須符合安全標準和技術要求。 若獲批牌照方面有困難，主辦方應提早及如實公告，會對消費者有更好保障，也可減少影響旅客對香港觀感。"
多條渡輪航線下午起陸續停航,2025-09-23 09:52,https://www.metroradio.com.hk/news/default.aspx?SearchText=&NewsId=20250923095259&page=0,metro,,2025-09-23 10:15,"因強風關係，港珠澳大橋香港連接路下午3時起封閉。

九巴和龍運大部分路線會在八號信號生效後約兩小時內陸續暫停，大嶼山巴士、 城巴大部份日間服務將維持至約下午4時20分，隨後有序暫停。

噴射飛航上環至澳門外港尾班船早上11時半開出，其他航線已經停航。

新渡輪中環往來長洲尾班船下午3時15開出，中環至梅窩，尾班船分別下午3時10分和2時50分開出；橫水渡已經停航。

港九小輪下午陸續停航，中環來往榕樹灣以及中環往來坪洲的尾班船，下午3時15分開出；中環至索罟灣，尾班船分別下午3時20分和2時35分開出；坪洲至喜靈洲，尾班船分別下午3時45分和2時15分開出。

昂坪360宣佈，受到熱帶氣旋及惡劣天氣影響，纜車服務暫停。"
不同集團首掛開市報100.4元 較上市價高41%,2025-09-23 09:28,https://www.metroradio.com.hk/news/default.aspx?SearchText=&NewsId=20250923092850&page=0,metro,,2025-09-23 09:45,"內地育兒產品設計及銷售商--不同集團(06090)今日首掛，開市報100.4元，較上市價高四成一。

股份以招股價範圍上限71.2元定價，每手100股，一手中籤率百分之1，認購5490手才穩獲一手。 公開發售部分獲超額認購3316.47倍，國際部份獲超額認購6.37倍。

所得款項淨額7億1826萬元。"
港股上升 恒生指數高開91點,2025-09-23 09:28,https://www.metroradio.com.hk/news/default.aspx?SearchText=&NewsId=20250923092828&page=0,metro,,2025-09-23 09:45,"港股上升，恒生指數高開91點，開市報26435點。

新經濟股個別發展，網易(09999)升百分之1，阿里巴巴(09988)及騰訊(00700)上升，百度(09888)回吐百分之2，京東(09618)跌百分之1。

雲智匯科技(01037)與優必選合作人形機械人業務，股價復牌急升四成半。

國企指數高開21點，開市報9392點。"
