title,date,url,source,section,scrape_time,news_content
陳茂波 : 與中央機構研究放寬內地來港人才調配資金在港置業,2025-07-30 18:54,https://www.metroradio.com.hk/news/default.aspx?SearchText=&NewsId=20250730185405&page=0,metro,,2025-07-30 19:15,"財政司司長陳茂波表示，正與相關中央機構研究，能否在合適的範圍中，放寬內地來港人才調動資金在香港買樓，同時避免出現資本外流。

陳茂波指，內地來港人才買樓需要資金，而現時將內地資金調配來香港有限制，特區政府正與相關中央機構研究，在合適範圍內相對放寬限制，便利資金調配。"
立法會通過明年1月起違泊罰款增至400元,2025-07-30 18:40,https://www.metroradio.com.hk/news/default.aspx?SearchText=&NewsId=20250730184045&page=0,metro,,2025-07-30 19:00,"立法會通過調高交通違例罰則的兩項決議案，明年1月1日起，違例泊車定額罰款由320元，增至400元，另外包括超速駕駛等19項罪行，罰款額上調5成。

運輸及物流局局長陳美寶表示，違例泊車和大部分交通違例事項定額罰款，31年來維持不變，同期消費物價指數上升逾7成，而香港相關定額罰款水平，亦遠較多個海外地區為低，因此有必要提高罰款額。

陳美寶指，過去3年全港新增超過1.5萬個泊車位，預計未來2年可再增加超過1.2萬個，加上私人發展項目和短期租約停車場泊位，政府會積極令泊車位供應會持續改善。 至於執法方面，警方會視乎現場實際環境靈活判斷，或就個別情況酌情處理。"
財政部:今年育兒補貼補資金初步預算900億人民幣,2025-07-30 17:56,https://www.metroradio.com.hk/news/default.aspx?SearchText=&NewsId=20250730175649&page=0,metro,,2025-07-30 18:15,"國家財政部社會保障司司長郭陽表示，按照部署，中央財政將設立「育兒補貼補助資金」，今年初步安排預算900億元人民幣左右。

他表示，發放國家基礎標準補貼所需資金，中央財政按照一定比例對地方予以補助，中央總體承擔約百分之90。

國家衛健委人口家庭司司長王海東表示，按照工作計劃，各地將在8月下旬陸續開放育兒補貼申領，主要通過網上平台申領，同時支付寶及微信等第三方服務平台亦會設置育兒補貼申領入口。

衛健委又指，地方要制定具體政策銜接方案，確保各地之前已經實施育兒補貼政策，與國家制度有序銜接，在此過程中要切實保障群眾切身利益，地方此前補貼標準高國家基礎標準，按規定做好評估和備案工作後，可以繼續執行。"
陳茂波 : 不評論個別銀行撥備  銀行體系非常穩健,2025-07-30 17:55,https://www.metroradio.com.hk/news/default.aspx?SearchText=&NewsId=20250730175503&page=0,metro,,2025-07-30 18:15,"恒生銀行(00011)公布業績時提及， 上半年作出較多撥備，主要由於商業房地產壓力。 財政司司長陳茂波表示，不評論個別銀行的處理，銀行之間有各自的重點，部分銀行經營利潤比較好，在撥備方面比較進取，作出審慎處理，不過整體銀行壞帳撥備處於穩健水平，銀行業資本充足率仍然高於環球標準，本港金融體系及銀行體系非常穩健。

地產市場方面，陳茂波說，住宅樓價趨向平穩，但商業及辦公樓宇可能需要時間改善，因為市場有一定供應，而疫情後辦公方式有變化，政府已經給予時間，讓市場消化供應，同時在需求方面著手，鼓勵有需要的非政府機構購買辦公地點，他又認為，市場對於辦公樓宇仍有一定需求。"
聖貝拉料中期扭虧為盈,2025-07-30 17:45,https://www.metroradio.com.hk/news/default.aspx?SearchText=&NewsId=20250730174521&page=0,metro,,2025-07-30 18:00,"聖貝拉(02508)預期截至6月底止中期淨利潤不低於3億2000萬元人民幣，對比去年同期錄得淨虧損4億8000萬元人民幣。

收入將不低於4億4800萬元人民幣，按年增長將不低於百分之25，受託管理的月子中心收入將不低於7200萬元人民幣(並不構成集團收入)，按年增長將不低於百分之156。

經調整淨利潤不低於3800萬元人民幣，按年增長將不低於百分之122。"
銀行公會 : 政府營商報告肯定銀行業貢獻,2025-07-30 17:33,https://www.metroradio.com.hk/news/default.aspx?SearchText=&NewsId=20250730173337&page=0,metro,,2025-07-30 18:00,"銀行公會主席禤惠儀表示，歡迎特區政府公布最新一份《香港營商環境報告》，肯定銀行業對香港發展的貢獻。 作為世界領先的國際金融中心，香港的金融服務向來表現卓越，極具競爭力。 銀行體系的穩健及韌性，充分體現在盈利、資本充足比率及風險管理等多方面，為企業提供便利穩定的營商環境，有利企業長遠發展。

她指，展望未來，香港銀行業將繼續與各界緊密合作，發揮香港獨特的優勢，並推動行業創新，把握包括金融科技、綠色金融等新興領域帶來的發展機遇，吸引更多人才及頂尖企業落戶香港，助力經濟高質量發展。"
新東方上季少賺近74%至710萬美元,2025-07-30 17:31,https://www.metroradio.com.hk/news/default.aspx?SearchText=&NewsId=20250730173113&page=0,metro,,2025-07-30 17:45,"新東方(09901)公布，截至5月底止的季度，純利710萬美元，按年下跌百分之73.7，經調整純利9808萬美元，按年上升百分之59.4。

不包括東方甄選(01797)的淨營收上升百分之18.7，至10億8850萬美元，出國考試準備和出國諮詢業務營收分別增長百分之14.6及8.2。

總結截止5月底止的季度，純利3億7171萬美元，按年上升百分之20.1，經調整純利5億7107萬美元，按年上升百分之11.4，淨營收49億美元，按年上升百分之13.6。"
警首破以信託服務洗黑錢的三合會 涉400億港元,2025-07-30 17:29,https://www.metroradio.com.hk/news/default.aspx?SearchText=&NewsId=20250730172904&page=0,metro,,2025-07-30 18:00,"警方多個刑偵部門，聯手追查兩年半，首次瓦解一個以信託服務公司清洗不同犯罪得益的黑幫 ，涉款近400億港元，拘捕82人，包括有三合會背景的主腦，他的家人和黨羽，凍結11.3億港元資產、 862萬現金、 及700萬元的奢移品。

有組織及三合會調查表示，兩年半前關注到一名黑社會頭目，積極擴張版圖，追查下發現他在九龍灣開設信託服務公司，掩飾其犯罪行為，以及利用家人、 朋友和門生，以不同公司和銀行戶口，虛假交易，清洗黑錢。

在聯合行動中，財富情報及調查科發現集團在2022至2024年間的21個月，利用信託公司與多個沒有實質業務的空殼公司，透過銀行戶口轉移396億懷疑黑錢，又以不同個人名義的傀儡戶口，購買虛擬資產，清繳董事購買奢侈品的信用卡欠款。

商業罪調查科則發現集團開設貿易公司，與本地及海外公司以虛假交易文件，騙取本港一間銀行96筆，共涉及1.35億美元、 約10.6億港元貸款。"
旅發局歡迎政府發表香港營商報告,2025-07-30 17:28,https://www.metroradio.com.hk/news/default.aspx?SearchText=&NewsId=20250730172833&page=0,metro,,2025-07-30 17:45,"政府發表最新一份《香港營商環境報告》，旅遊發展局主席林建岳表示歡迎。 他指，《香港營商環境報告》清楚闡述香港坐擁背靠祖國、聯通國際的獨特優勢，對香港吸引大型會議、展覽及獎勵活動落戶香港，吸引高增值會展旅客；開拓具潛力中東和東盟市場，加強人文交流；推動盛事活動在香港舉行，提升旅客體驗；以至聯同大灣區城市推動「一程多站」聯遊，發揮優勢互補等等，都起着非常關鍵的作用。

林建岳指，在上半年，香港錄得2400萬旅客人次，較去年同期上升百分之12，當中非內地旅客增長達百分之17，達到584萬人次。 旅發局會繼續乘著這個良好勢頭，並充份用好、說好香港獨特的優勢，推出不同宣傳吸引旅客來港，推動旅遊業發展，深化香港擔當深化國際交往的重要角色。"
中方敦促日方加快日遺化武處理進程,2025-07-30 17:19,https://www.metroradio.com.hk/news/default.aspx?SearchText=&NewsId=20250730171955&page=0,metro,,2025-07-30 17:30,"今日是中日銷毀中國境內，日本遺棄化學武器的備忘錄簽署26周年。 中方指日方截至目前，已挖掘回收日遺化武逾16萬枚，銷毀約13萬枚，但處理進程總體嚴重滯後。

外交部發言人郭嘉昆表示，日本遺棄在華化學武器，是日本軍國主義，在侵華戰爭期間犯下的嚴重罪行之一，時至今日，日遺化武仍對中國人民生命財產，以及生態環境安全造成嚴重威脅；日方在歷史問題上負有不容推卸的責任，中方敦促日方，嚴肅對待中國和國際社會關切，深刻反省侵略罪責，恪守承諾，切實加快日遺化武處理進程，早日還中國人民以淨土，還國際社會以正義，徹底銷毀相關化武。"
艾橋智:港商業房地產短期受壓 相關風險敞口不足15億美元,2025-07-30 16:58,https://www.metroradio.com.hk/news/default.aspx?SearchText=&NewsId=20250730165800&page=0,metro,,2025-07-30 17:15,"滙控(00005)行政總裁艾橋智表示，觀察到香港住宅樓市已出現穩定跡象，受惠政策支持及強勁的市場趨勢，但商業房地產方面存在供應過剩問題，短期內面臨一定壓力，政府已採取行動限制寫字樓土地供應，估計在中期可起到支撐作用。

艾橋智指，集團關注商業房地產佔集團的香港房地產風險敞口不足百分之5，涉及不足15億美元，已就這方面計提約5億美元的預期信貸損失準備，認為已有效控制潛在的極端下行風險，對借款人質素保持信心。

他又指，滙控簡化組織結構，以及出售非核心資產等取得成效，上半年已經完成7億美元的節省措施，預計2027年可實現全年節省15億元的目標。"
中共中央召開黨外人士座談會 要保持政策連續性穩定性,2025-07-30 16:51,https://www.metroradio.com.hk/news/default.aspx?SearchText=&NewsId=20250730165154&page=0,metro,,2025-07-30 17:00,"中共中央於7月20日，在中南海召開黨外人士座談會，就當前經濟形勢和下半年經濟工作聽取各民主黨派中央、全國工商聯和無黨派人士代表的意見建議，中共總書記習近平主持座談會，並發表重要講話。

習近平強調，做好下半年經濟工作，要堅持穩中求進工作總基調，完整準確保持政策連續性穩定性，增強靈活性預見性，著力穩就業、穩企業、穩市場、穩預期，有力提振消費、破除內捲，暢通國內大循環，促進國內國際雙循環，努力完成全年經濟社會發展目標任務。

習近平表示，當前中國經濟運行依然面臨不少風險挑戰，要正確把握形勢，增強憂患意識，堅持底線思維，用好發展機遇、潛力和優勢，鞏固拓展經濟回升向好勢頭，下半年要在宏觀政策上持續發力、適時加力，重點做好全方位擴大內需，堅定不移深化改革擴大開放，推動科技創新和産業創新深度融合發展，持續防範化解重點領域風險，多措並舉保障改善民生等工作。"
拒推商用物業稅務寬減 許正宇:差餉徵收率合理,2025-07-30 16:42,https://www.metroradio.com.hk/news/default.aspx?SearchText=&NewsId=20250730164233&page=0,metro,,2025-07-30 17:00,"選委界立法會議員江玉歡建議，政府推出臨時非住宅物業差餉寬減措施，以及分期支付印花稅等，減輕商用物業業主壓力，財經事務及庫務局局長許正宇在立法會回應指，現時並無計劃允許分期繳付非住宅物業交易印花稅，而非住宅物業差餉徵收率屬合理水平，而每年應課差餉租值重估，亦有效反映物業市場最新情況。

他指，新資本投資者入境計劃容許申請人投資房地產，獲計算入投資總額上限1千萬港元，已經佔計劃最低投資要求三分之一，政府會持續檢視申請人投資情況，適時檢討相關安排，又表示，目前無計劃為吸引外來投資而調整印花稅。

另外，選委界議員蘇長荣質疑，政府是否任由非住宅市場疲弱，許正宇指，經濟持續增長但私人寫字樓或商業樓宇出現空置的情況，並非香港獨有，主要是受到疫後在家工作或零售層面的電商興起影響，政府在供求方面推措施非無視數據，而是通過基礎核心手段處理，包括停止推出商業地，讓市場消化現有供應，同時推出一系列措施吸納更多計劃，例如資本投資或家族辦公室。"
泰國中部有煙花廠爆炸 至少9死2傷,2025-07-30 16:25,https://www.metroradio.com.hk/news/default.aspx?SearchText=&NewsId=20250730162547&page=0,metro,,2025-07-30 16:45,"泰國中部有煙花廠發生爆炸，造成至少9死2傷。

事發在素攀府。 當局指，煙花廠在當地早上11時左右發生爆炸，廠房變成一堆瓦礫，並不斷冒出濃煙。 救援人員將傷者送到附近醫院救治。 搜救人員正在現場搜索是否有生還者。 當地警方正調查爆炸原因。"
港股收市跌347點  滙控績後挫4%,2025-07-30 16:21,https://www.metroradio.com.hk/news/default.aspx?SearchText=&NewsId=20250730162131&page=0,metro,,2025-07-30 16:30,"港股連跌第二日，大市低開189點後持續弱勢，午後跌幅一度擴大至442點，低見25082點，恒生指數收報25176點，跌347點，成交增至3197億元。

滙控(00005)上季稅前利潤下跌三成，股價跌約百分之4，恒生(00011)上半年少賺三成、不良貸款率上升，股價跌百分之7。

理想汽車(02015)新款電動車型開價遠低於日前公布的預售價，股價急跌一成二，是跌幅最大藍籌，市場擔心內地汽車價格戰重臨，比亞迪(01211)跌半成，吉利汽車(00175)跌百分之4，小米(01810)跌百分之1，小鵬(09868)跌百分之6，蔚來(09866)跌半成，零跑(09863)先跌後回穩。

新經濟股下跌，阿里巴巴(09988)、京東(09618)及百度(09888)跌百分之2至3，騰訊(00700)及美團(03690)跌百分之1，網易(09999)偏軟。

晶片股下跌，中芯國際(00981)跌近百分之6，華虹半導體(01347)亦跌半成，ASMPT(00522)跌百分之3，上海復旦(01385)跌百分之3。

石油石化股上升，中石油(00857)升近百分之4，中石化(00386)升百分之3，中海油(00883)升百分之1。

國企指數收報9038點，跌107點。"
中美新一輪經貿會談結束 外交部: 盼爭取更多雙贏成果,2025-07-30 16:12,https://www.metroradio.com.hk/news/default.aspx?SearchText=&NewsId=20250730161215&page=0,metro,,2025-07-30 16:30,"中美新一輪經貿會談結束。 兩國同意繼續暫緩對等關稅和反制措施，包括美方暫停徵收中國入口貨品24%關稅部分， 以及中方延期實施反制措施，並會繼續磋商，但未有其他突破。

在北京，外交部發言人郭嘉昆表示，中方希望美方同中方一道，按照兩國元首通話達成的重要共識，發揮好中美經貿磋商機制作用，在平等、尊重、互惠基礎上，通過對話溝通增進共識、減少誤解、加強合作，爭取更多雙贏成果，共同推動中美關係健康、穩定、可持續發展。"
恒隆地產:下半年零售物業收入或可微升 辦公樓業務不感樂觀,2025-07-30 15:54,https://www.metroradio.com.hk/news/default.aspx?SearchText=&NewsId=20250730155408&page=0,metro,,2025-07-30 16:15,"恒隆地產(00101)半年基本純利15億8700萬元，按年下跌百分之8.5，中期息維持在12仙；恒隆集團(00010)半年基本純利11億9100萬元，按年跌百分之7，中期息維持在21仙。

行政總裁盧韋柏表示，今年以來內地和香港股市更暢旺，樓市亦趨向穩定，或可增強消費者信心，有望帶動公司下半年零售物業收入錄得輕微升幅，至於辦公樓業務就不感樂觀，因辦公樓業務主要受到宏觀環境影響，而宏觀環境不會很快改變，除非內地經濟強勁反彈，或是中美之間沒有爭拗，預計辦公樓業務的低迷將持續一段時間，將呈現「L型」走勢。

他表示，上半年旗下香港商場銷售，略好於零售業大市，商場人流較去年年底增加，認為香港零售業的確面對很多結構性問題，例如港人北上消費的趨勢不會改變，若要改善香港零售業，要視乎能否提升餐飲業的性價比，或將內地租戶帶來香港等。

至於本港物業銷售方面，盧韋柏表示，高尚住宅銷售一般與新股活動活動成正比，股市暢旺之下，對下半年物業銷售審慎樂觀，高價住宅價格應會慢慢回升。"
天文台:海嘯衝擊力較大不容忽視,2025-07-30 15:51,https://www.metroradio.com.hk/news/default.aspx?SearchText=&NewsId=20250730155140&page=0,metro,,2025-07-30 16:00,"俄羅斯堪察加半島外海今早發生8.8級地震，引發向外擴散的海嘯波，天文台指，預計海嘯波在下午5點左右到達本港，預計屆時水位高度只會較平常潮水高度高出約0.1米或以下，對本港影響不大.

天文台表示，海嘯波同樣影響日本，當地可錄到的最高海嘯高度為1.3米，強調不容忽視，海嘯的衝擊力較大，即使高度約一米仍可推倒一架貨車，建議市民如近日希望前往沿岸地區旅遊，應事先諮詢專業人士建議，保障個人安全.

天文台指，雖然震區距離本港逾5千公里，但海嘯波的波動較長，減弱速度亦會較慢，因此海嘯波仍然可抵達本港，並且海嘯波將持續抵達本港，但預計所造成影響將會越來越少。"
國防部: 菲律賓是南海麻煩製造者危險製造者,2025-07-30 15:50,https://www.metroradio.com.hk/news/default.aspx?SearchText=&NewsId=20250730155055&page=0,metro,,2025-07-30 16:00,"菲律賓國防部長指，將堅定應對中國在南海的侵略行為，菲方正與美澳日印加強防務合作。

在北京，國防部表示，菲方有關言論完全是顛倒黑白，倒打一耙，菲律賓的領土範圍，早由一系列國際條約所確定，中國南海諸島在菲律賓領土範圍之外，又指菲方不僅非法侵佔中國南沙群島部分島礁，頻繁在海上對中方進行挑釁滋擾，還迎合域外勢力在南海攪局作亂，是不折不扣的麻煩製造者，危險製造者，中方維護國家領土主權和海洋權益的決心意志堅定不移，將繼續依法依規堅決反制菲方侵權挑釁行徑。"
陳茂波 : 本港經濟面對轉型  創新科技推動下一步增長,2025-07-30 15:45,https://www.metroradio.com.hk/news/default.aspx?SearchText=&NewsId=20250730154540&page=0,metro,,2025-07-30 16:00,"政府發表《香港營商環境報告》，藉此向外界說好香港故事，並向國際社會闡明香港在一國兩制下的優勢，以及香港未來的發展前景。 報告序言指，世界正處於百年未有之大變局，香港正在洪流中前行，積極創新尋求突破，而香港的核心競爭力穩固，新的優勢正在形成。

財政司司長陳茂波在發布會上表示，本港經濟維持增長，但正面對經濟轉型，作為國際金融中心及貿易中心，相信推動下一步增長的是創新科技，不過各經濟體之間存在競爭，創新科技亦需要時間培育。

他指，近期本港零售餐飲業面對壓力，政府希望支援，例如努力舉辦活動，希望提升旅客在港消費。 目前住宅物業市場已穩定，雖然利率下調的幅度較市場預期慢，但近幾個月外來資金來港，銀行同業拆息下跌，企業經營資金壓力減輕。"
中泰柬代表上海會晤 泰柬重申遵守停火共識,2025-07-30 15:37,https://www.metroradio.com.hk/news/default.aspx?SearchText=&NewsId=20250730153716&page=0,metro,,2025-07-30 16:00,"中國，柬埔寨，泰國三方非正式會晤在上海舉行，外交部次長孫衛東，與柬埔寨和泰國代表共同出席。

外交部在網頁指，柬泰雙方重申將遵守停火共識，並讚賞中國迄今，為平息事態所發揮的積極作用，又指會議是在坦誠，友好和融洽的氣氛中進行，中國持續為支持柬泰雙方和平解決邊境爭端，發揮建設性作用，而舉行這場三方非正式會晤，是中國最新的外交努力。

泰國和柬埔寨上周四起在邊境地區交火，造成至少34人死亡，雙方在昨日宣布同意停火。 柬埔寨國防部發言人表示，柬泰邊境轉趨平靜，至今停火有效和和平地執行。"
譚仔國際首度進駐馬來西亞 於雪蘭莪開設「譚仔香港米線」,2025-07-30 15:36,https://www.metroradio.com.hk/news/default.aspx?SearchText=&NewsId=20250730153609&page=0,metro,,2025-07-30 16:00,"譚仔國際(02217)宣布，首度進駐馬來西亞，當地首間「譚仔香港米線」門店於7月29日，在雪蘭莪州的雙威金字塔廣場開業。

有關門店是透過與大資集團旗下的大資零售的戰略夥伴合作而設立，標誌著譚仔國際拓展東南亞市場，以及採用夥伴合作模式推動國際業務增長的又一里程碑。

新店佔地約136平方米，最多可容納57位顧客，譚仔國際主席、執行董事兼行政總裁劉達民表示，譚仔國際在馬來西亞的首間餐廳開業，標誌著集團在快速增長的東南亞市場踏出重要一步，相信譚仔品牌理念將會獲得馬來西亞消費者喜愛。"
俄羅斯8.8級地震 日本岩手縣久慈港錄1.3米高海嘯,2025-07-30 15:31,https://www.metroradio.com.hk/news/default.aspx?SearchText=&NewsId=20250730153108&page=0,metro,,2025-07-30 15:45,"俄羅斯堪察加半島對開海域，今早發生8.8級強烈地震，全球多國都發布海嘯預警。

日本氣象廳指出，岩手縣久慈港當地下午1點52分，錄得1.3米高海嘯、北海道根室市花咲錄得80厘米、宮城縣石卷港錄得70厘米、北海道濱中町錄得60厘米，其他地區亦陸續出現湧浪，提醒海嘯可能反覆來襲且浪高持續增加，民眾應立即撤離至高地或遠離海岸的安全區域。

天文台發出海嘯報告指出，若海嘯持續，將會於今日下午5時左右到達香港，並會每5至60分鐘再次出現，預計只會比正常潮水高度高出約0.1米或以下，對香港的影響很小。

國家自然資源部發布海嘯黃色警報，預計海嘯於下午1時30分到達台灣沿岸，下午5至8時先後到達浙江及上海沿海海域，估計海嘯最高40及30厘米。"
滙控旗下瑞士私人銀行正接受瑞士及法國當局調查,2025-07-30 15:25,https://www.metroradio.com.hk/news/default.aspx?SearchText=&NewsId=20250730152500&page=0,metro,,2025-07-30 15:45,"《彭博》引述滙控一份聲明指，滙控(00005)旗下的瑞士私人銀行，正因涉嫌洗錢而接受瑞士及法國執法機構的調查，警告可能會造成重大影響，但目前無法預測具體影響。

瑞士金融市場監理局去年表示，發現滙豐私人銀行未能對政治敏感人士持有的高風險帳戶，進行充分的洗錢檢查，並已發現在2002年至2015年期間進行，銀行有合計超過3億美元的交易存在嚴重違法行為，責令滙豐審視反洗錢系統，以及所有高風險業務關係，以及與政治敏感客戶的往來，在審查工作完成之前，不得再接受任何政治敏感人士作為客戶。"
歐洲股市早段下跌  滙控倫敦跌4%,2025-07-30 15:24,https://www.metroradio.com.hk/news/default.aspx?SearchText=&NewsId=20250730152424&page=0,metro,,2025-07-30 15:45,"歐洲股市早段下跌。 滙控公布業績後，倫敦股價最新報927.2便士，跌百分之4.41，折合約97.28港元，與港股現價相若。

英國富時指數最新報9132點，跌3點，跌幅百分之0.04。

德國DAX指數最新報24165點，跌52點，跌幅百分之0.22。

法國CAC指數最新報7845點，跌11點，跌幅百分之0.15。"
內地股市窄幅上落  上證收市微升,2025-07-30 15:09,https://www.metroradio.com.hk/news/default.aspx?SearchText=&NewsId=20250730150931&page=0,metro,,2025-07-30 15:30,"內地股市窄幅上落。

上證綜合指數收報3615點，升6點，升幅百分之0.17。

深證成分指數收報11203點，跌86點，跌幅百分之0.77。

滬深300指數收報4151點，跌0.79點，跌幅百分之0.02。"
澳紐股市個別發展,2025-07-30 15:06,https://www.metroradio.com.hk/news/default.aspx?SearchText=&NewsId=20250730150651&page=0,metro,,2025-07-30 15:30,"澳紐股市個別發展。

標普澳洲200指數收報8756點，升51點，升幅百分之0.6。

新西蘭50隻成分股指數收報12855點，跌80點，跌幅百分之0.62。"
台灣股市回升1%,2025-07-30 15:04,https://www.metroradio.com.hk/news/default.aspx?SearchText=&NewsId=20250730150442&page=0,metro,,2025-07-30 15:30,"台灣股市回升。 加權指數收報23461點，升260點，升幅百分之1.12。

台積電收報1155元新台幣，升百分之1.8。"
