title,date,url,source,section,scrape_time,news_content
人行今日開展1640億元人民幣七天期逆回購操作,2025-06-11 09:51,https://www.metroradio.com.hk/news/default.aspx?SearchText=&NewsId=20250611095123&page=0,metro,,2025-06-11 10:15,"人民銀行今日開展1640億元人民幣七天期逆回購操作，操作利率持平於1.4厘。

由於今日有2149億元人民幣逆回購到期，今日資金淨回籠509億元人民幣。"
人民幣兌美元中間價報7.1815 上調25點子,2025-06-11 09:51,https://www.metroradio.com.hk/news/default.aspx?SearchText=&NewsId=20250611095130&page=0,metro,,2025-06-11 10:15,"人民幣兌美元中間價上升。

人民幣兌美元中間價報7.1815，上調25點子。"
據報美墨正在討論削鋼鐵關稅協議,2025-06-11 09:48,https://www.metroradio.com.hk/news/default.aspx?SearchText=&NewsId=20250611094835&page=0,metro,,2025-06-11 10:15,"據報美國及墨西哥正就削減部份鋼鐵關稅進行談判，包括對一定數量進口美國的鋼鐵產品免徵百分之50關稅。

《路透》引述一位熟悉談判情況的行業消息人士指，雙方的談判結果可能會包括達成配額安排，允許一定數量的墨西哥產品，可以免稅或以較低稅率進入美國市場，而超過配額的產品才需要徵收百分之50全額關稅。

報道引述消息人士指，目前未清楚協議會是完全取消配額內墨西哥鋼鐵進口的關稅，還是將稅率降至較低水平，配額具體數量亦尚未確定，而由於以往來自墨西哥的進口激增，美國相關官員迫切要求針對墨西哥制定明確鋼鐵配額安排。

《    彭博》早前報道，美墨雙方已接近達成協議，初步方案是只要總數量保持歷史平均貿易量水平，美國企業就可以免關稅進口墨西哥鋼鐵。

墨西哥經濟部長埃布拉德(Marcelo Ebrard)表示，墨西哥政府已向美國官員提出，徵收關稅並不合理，而美國在鋼鋁方面對墨西哥存在貿易順差，認為英國等國已得到豁免，敦促美國亦對墨西哥採取相同做法，警告關稅會對兩國就業和供應鏈造成損害。"
世界銀行最新一期全球經濟展望報告:下調今年全球經濟增長預測至2.3%,2025-06-11 09:37,https://www.metroradio.com.hk/news/default.aspx?SearchText=&NewsId=20250611093735&page=0,metro,,2025-06-11 10:15,"世界銀行發布最新一期《全球經濟展望》報告，將今年全球經濟增長預測，由今年1月份的百分之2.7下調至百分之2.3，近七成經濟體的增速被下調。 全球經濟在2026年和2027年將出現疲弱反彈。 新興市場和發展中經濟體在縮小與發達經濟體人均收入差距和減少極端貧困方面的進展，仍將會不足，其前景很大程度上依賴全球貿易政策的變化。

   世銀表示，全球經濟增長因貿易壁壘和不確定的全球政策環境而放緩，與6個月前經濟看起來會實現「軟著陸」相比，目前全球經濟正再次陷入動蕩。

報告預計，今年發達經濟體經濟將增長百分之1.2，比早前預測低0.5個百分點。 其中，美國經濟增速由早前的百分之2.3大幅下調至百分之1.4。 今年歐元區和日本經濟增速都被下調至百分之0.7。 今年新興市場和發展中經濟體預計增長百分之3.8，較早前預測低0.3個百分點。

世銀同時預測，今年和明年全球貿易量增速分別是百分之1.8及百分之2.4，較1月預測分別低1.3及0.8個百分點。"
[本港股市]恒生指數高開28點,2025-06-11 09:23,https://www.metroradio.com.hk/news/default.aspx?SearchText=&NewsId=20250611092303&page=0,metro,,2025-06-11 09:30,"港股上升，恒生指數高開28點，開市報24191點。

國企指數高開18點，開市報8786點。"
洛杉磯市長宣布進入緊急狀態 市中心實施宵禁,2025-06-11 09:21,https://www.metroradio.com.hk/news/default.aspx?SearchText=&NewsId=20250611092115&page=0,metro,,2025-06-11 09:30,"美國洛杉磯市長巴斯宣布，當地進入緊急狀態，在洛杉磯市中心實施宵禁。

美國加州一名聯邦法官同日駁回加州要求，立即阻止特朗普政府向洛杉磯地區，派遣美軍和國民警衛隊的動議。

加州州長紐森和總檢察長邦塔早前向法院提交臨時限制令動議，指聯邦政府動用軍隊的行為是非法，剝奪了州政府調動國民警衛隊的權利，將加劇而非平息民間騷亂。 法官拒絕加州的要求，但批准給予特朗普政府更多時間，回應加州動議的申請，會於12日就此舉行聽證會。

搜捕非法移民的美國聯邦機構人員，連日來與洛杉磯民眾發生衝突。 在加州州長沒有請求支援的情況下，特朗普下令，向洛杉磯地區派出2000名加州國民警衛隊人員；國防部將根據特朗普的命令，增派2000名國民警衛隊人員前往洛杉磯地區。 據報，約700名海軍陸戰隊士兵已抵達當地，保護當地的聯邦機構和人員."
[油市收市]紐約期油跌0.47% 布蘭特期油跌0.25%,2025-06-11 09:18,https://www.metroradio.com.hk/news/default.aspx?SearchText=&NewsId=20250611091840&page=0,metro,,2025-06-11 09:30,"油價收市下跌，紐約期油及布蘭特期油都低收。

美國上星期原油庫存減幅遠少過市場預期，期內汽油庫存增加，都令油價下跌.

紐約7月期油收報每桶64.98美元，跌31美仙，跌幅百分之0.47.

倫敦8月布蘭特期油收報每桶66.87元，跌17美仙，跌幅百分之0.25."
[金市收市]紐約8月期金收報每安士3343.4美元跌0.3%,2025-06-11 09:13,https://www.metroradio.com.hk/news/default.aspx?SearchText=&NewsId=20250611091348&page=0,metro,,2025-06-11 09:30,"金價收市下跌.

美國表示美中貿易會談順利，市場避險需求下降，金價回落。

交投最活躍的紐約8月期金，收報每安士3343.4美元，跌11.5美元，跌幅百分之0.3.

紐約現貨金報每安士3323.69美元，跌百分之0.08."
港股ADR收普遍下跌 騰訊收報515.85港元,2025-06-11 09:08,https://www.metroradio.com.hk/news/default.aspx?SearchText=&NewsId=20250611090821&page=0,metro,,2025-06-11 09:30,"在美國上市的主要港股預託證券(ADR)價格，與港股收市價比較，普遍下跌。

藍籌股當中，長和(00001)ADR折合港元計，收報45.6元，較本港昨日收市低0.45元；滙控(00005)ADR收報93.49元，低0.36元；港交所(00388)ADR收報415.48元，高0.68元；騰訊(00700)ADR收報515.85元，高2.35元；友邦(01299)ADR收報69.95元，高0.25元。

賭業股方面，銀河娛樂(00027)ADR收報30.22元，低2.88元；金沙中國(01928)ADR收報15.84元，低0.04元。

內銀股方面，建設銀行(00939)ADR收報7.46元，低0.03元；工商銀行(01398)ADR收報5.98元，低0.04元.

(1美元兌7.8481)"
[美股收市]全線上升: 道指升0.25% 納指升0.63% 標指升0.55%,2025-06-11 09:02,https://www.metroradio.com.hk/news/default.aspx?SearchText=&NewsId=20250611090236&page=0,metro,,2025-06-11 09:15,"美股收市全線上升，三大指數中，以納指表現最好，升約百分之0.6；標普500指數近百分之0.6；道指升近百分之0.3。

受到電動車生產商Tesla股價大升百分之5.6，加上多位美國官員表示美中貿易會談富有成果，推動投資者買盤入市，美股造好。

道瓊斯工業平均指數收報42866點，升105點，升幅百分之0.25.

納斯達克指數收報19714點，升123點，升幅百分之0.63.

標準普爾500指數收報6038點，升32點，升幅百分之0.55；連升第三個交易日。

標普500指數的11個板塊中，有10個板塊上升，其中能源股領漲，升幅百分之1.77，其次是非必需消費品股，升幅百分之1.19。"
[歐洲股市收市]個別發展:英股升0.24% 德股跌0.77% 法股升0.17%,2025-06-11 08:49,https://www.metroradio.com.hk/news/default.aspx?SearchText=&NewsId=20250611084954&page=0,metro,,2025-06-11 09:00,"歐洲三大主要股市收市個別發展，英國及法國股市上升；德國股市下跌。

倫敦富時100指數收報8853點，升20點，升幅百分之0.24。

法蘭克福DAX指數收報23987點，跌186點，跌幅百分之0.77。

巴黎CAC指數收報7804點，升12點，升幅百分之0.17。"
[期貨夜市]即月恒指夜期收報24111點 低水52點,2025-06-11 08:45,https://www.metroradio.com.hk/news/default.aspx?SearchText=&NewsId=20250611084537&page=0,metro,,2025-06-11 09:00,"港股低收；恒生指數昨日收報24162點，跌18點，跌幅百分之0.08，大市成交2503億幾。

港股下跌，期貨夜市則上升。

即月恒指夜期收報24111點，升37點，低水52點，合約成交13477張.

即月國指夜期收報8752點，升19點，低水15點，合約成交14068張."
中美就貿易框架達成共識 將向各自的領導人匯報,2025-06-11 08:24,https://www.metroradio.com.hk/news/default.aspx?SearchText=&NewsId=20250611082452&page=0,metro,,2025-06-11 09:45,"中美兩國在倫敦的第二日貿易會談，就貿易框架達成共識。 

第二日的會談持續到深夜，商務部國際談判代表兼副部長李成鋼，在當地時間11時許步出會場向傳媒表示，中美團隊在過去兩天進行很深入的交流，雙方的溝通是非常專業、理性、深入和坦誠，雙方原則上就落實兩國元首上周四通話共識，以及日內瓦會談共識達成了框架，雙方將把會談情況向各自領導人匯報。李成鋼表示，希望這次倫敦會談取得的進展，有利於中美之間進一步增進信任，進一步推動中美經貿關係穩定健康發展，亦為全球經濟發展注入積極正能量。

美國商務部長盧特尼克 (Howard Lutnick)亦表示，已同中方達成一個框架，將日內瓦共識和兩國元首通話成果結合起來，若獲得總統特朗普(Donald Trump)批准就會實施。盧特尼克又說，特朗普與國家主席習近平的通話，改變了結果，而今次達成的框架是第一步，必須消除消極因素，預計稀土和磁鐵問題將可以解決。貿易代表格里爾(Jamieson Greer)就說，美方會繼續與中方保持溝通。

中美這輪談判始於周一，中方參與的, 除了李成鋼，還有副總理何立峰和商務部長王文濤；美國則除了盧特尼克和格里爾，還有財長貝森特(Scott Bessent)。 "
中美倫敦貿易會談:達成框架協議 美商務部長:應能解決稀土和磁性材料限制問題,2025-06-11 08:24,https://www.metroradio.com.hk/news/default.aspx?SearchText=&NewsId=20250611082452&page=0,metro,,2025-06-11 08:45,"中美兩國在倫敦的貿易會談，中國商務部副部長李成鋼表示，中美貿易談判達成框架協議。 美國商務部長盧特尼克(Howard Lutnick)表示，美國與中國在倫敦達成的貿易框架和落實計劃，應能解決稀土和磁性材料的限制問題。

盧特尼克又說，美國談判團隊會將框架內容匯報給總統特朗普(Donald Trump)以獲得批准，然後希望落實新協議。"
李成鋼:中美就貿易談判框架達成一致,2025-06-11 08:21,https://www.metroradio.com.hk/news/default.aspx?SearchText=&NewsId=20250611082118&page=0,metro,,2025-06-11 08:30,"中美兩國在倫敦進行第二日貿易會談，中國商務部國際談判代表兼副部長李成鋼表示，兩國的談判團隊已就貿易框架達成共識，將向各自的領導人匯報。

第二日的會談持續到深夜，李成鋼在當地時間11時許步出會場，向傳媒表示， 中美團隊在過去兩天進行很深入的交流，雙方的溝通是非常專業、理性、 深入和坦誠，雙方原則上就落實兩國元首在本月5日通話共識，以及日內瓦會談共識達成了框架，雙方將把會談情況向各自領導人匯報。

李成鋼表示，希望這次倫敦會談取得的進展，有利於中美之間進一步增進信任，進一步推動中美經貿關係穩定健康發展，亦為全球經濟發展注入積極正能量。

中美這輪談判始於周一，中方參與的，除了李成鋼，還有副總理何立峰和商務部長王文濤；美國則有財長貝森特(Scott Bessent)、商務部長盧特尼克 (Howard Lutnick)和貿易代表格里爾(Jamieson Greer)。"
一號戒備信號現正生效 會在今日大部分時間維持,2025-06-11 08:17,https://www.metroradio.com.hk/news/default.aspx?SearchText=&NewsId=20250611081725&page=0,metro,,2025-06-11 08:30,"一號戒備信號現正生效，會在今日大部分時間維持。

在上午8點，位於南海中部的熱帶低氣壓，集結在香港以南約740公里，預料向西北偏西移動，時速約12公里，橫過南海中部，大致移向海南島。

按照現時預測路徑，該熱帶低氣壓今日仍與本港保持超過700公里距離，預料本港今日尚未普遍吹強風，但與其相關的外圍雨帶，正影響南海北部及廣東沿岸。 一號戒備信號會在今日大部分時間維持，預料該熱帶低氣壓會在未來一兩日逐漸增強並大致移向海南島，隨後移至廣東西部沿岸一帶。

天文台會視乎其強度、與本港的距離及本地風力變化，評估是否需要在明日稍後至星期五改發三號強風信號。 隨著熱帶氣旋靠近沿岸地區，本周後期風勢頗大，間中有狂風大驟雨，海有湧浪，市民應遠離岸邊及停止所有水上活動。"
澳門氣象局今早6點發出一號風球將於今日維持 明日日間發出三號風球可能性中等,2025-06-11 07:52,https://www.metroradio.com.hk/news/default.aspx?SearchText=&NewsId=20250611075219&page=0,metro,,2025-06-11 08:00,"澳門氣象局在今早6點發出一號風球，將會在今日維持；明日日間發出三號風球的可能性是中等。

澳門氣象局指，位於南海中部的熱帶低氣壓移動較緩慢，預料未來一兩日移向海南島附近。 受其外圍環流影響，澳門今明兩日風勢將有所增強，有幾陣驟雨及雷暴，明日週四日間開始風力間中達6級，因此發出三號風球機會中等。

按照現時預測，預料該熱帶氣旋移向海南島後，將轉向北至東北方向靠近廣東西部沿岸，疊加西南氣流影響，本周五稍後至周日初時，澳門會有頻密大驟雨及雷暴，累積降雨量較顯著，低窪地區可能因持續降雨而造成水浸。 另一方面，由於未來幾日正值天文大潮，疊加風力較大，明日日間內港以南一帶可能出現輕微水浸。 由於熱帶氣旋移動路徑仍存在不確定性，巿民應留意最新天氣資訊，並提早做好防風及防水浸措施。"
國安處提醒市民切勿下載「逆統戰: 烽火」流動應用程式 下載課金或推介都屬犯罪,2025-06-11 07:22,https://www.metroradio.com.hk/news/default.aspx?SearchText=&NewsId=20250611072200&page=0,metro,,2025-06-11 07:30,"國安處提醒市民 ,切勿下載一個叫伎「逆統戰：烽火」的流動應用程式。 如果下載、推介或課金資助這個應用程式開發商，從事危害國家安全的行為和活動，都屬犯罪。 經保安局局長批准，國安處已根據《香港國安法第四十三條實施細則》附表4，就有關「逆統戰：烽火」的電子信息作出禁制行動。

國安處指，這個應用程式以遊戲作為包裝推出，目的為宣揚「台獨」及「港獨」等分裂國家的主張，鼓吹武裝革命，推翻中華人民共和國根本制度，並意圖引起對中央及香港特區政府的憎恨。 任何人或組織明知而發布這應用程式或相關內容，包括透過互聯網向他人分享或推薦這應用程式，都有機會干犯《香港國安法》煽動分裂國家罪、煽動顛覆國家政權罪，及《維護國家安全條例》煽動意圖的相關罪行」。 若任何人已下載這應用程式，應立即刪除。"
"一號戒備信號生效今早維持 預料該熱帶低氣壓,未來一兩日漸增強移向海南島後移至廣西",2025-06-11 06:53,https://www.metroradio.com.hk/news/default.aspx?SearchText=&NewsId=20250611065358&page=0,metro,,2025-06-11 07:00,"一號戒備信號現正生效，會在今早維持。

在早上7點，位於南海中部的熱帶低氣壓，集結在香港以南約750公里，預料向西北偏西移動，時速約12公里，橫過南海中部。

按照現時預測路徑，該熱帶低氣壓今日仍與本港保持超過700公里距離，預料本港今日尚未普遍吹強風，但與其相關的外圍雨帶，正影響南海北部及廣東沿岸。

一號戒備信號會在今日早上維持，預料該熱帶低氣壓，會在未來一兩日逐漸增強並大致移向海南島，隨後移至廣東西部沿岸一帶。

天文台會視乎其強度、與本港的距離及本地風力變化，評估是否需要在明日稍後至星期五改發三號強風信號。 隨著熱帶氣旋靠近沿岸地區，本周後期風勢頗大，間中有狂風大驟雨，海有湧浪，市民應遠離岸邊及停止所有水上活動。"
亞洲盃外圍賽第三圈C組:港隊主場補時射入12碼1比0擊敗印度隊 球迷指氣氛好,2025-06-11 06:46,https://www.metroradio.com.hk/news/default.aspx?SearchText=&NewsId=20250611064648&page=0,metro,,2025-06-11 07:00,"亞洲盃外圍賽第三圈C組分組賽，昨晚8點在啟德體育園舉行，超過4萬2千人入場觀賽。 港隊首次在啟德主場館比賽，並憑補時射入12碼，1比0擊敗印度隊。

球賽開始前，大會首先播放印度國歌，之後播放中國國歌，期間多名便衣探員向觀眾席錄影，大部分觀眾都有肅立。 警務處處長周一鳴亦到場視察。

大批球迷穿上港隊球衣或代表主場顏色的紅色球衣，現場一片「紅海」，主場球迷區掛起支持港隊的大型旗幟，亦有人揮動香港區旗,並不時大叫支持港隊的口號，為港隊打氣。 雖然印度隊球迷不及港隊，但兩隊球員都落力作賽，觀眾都非常滿意，港隊球迷最滿意一定是見證港隊主場入波。 在補時12碼，港隊憑史提芬彭利拿補時5分鐘射入12碼，1比0贏印度。 港隊將於10月9日，客場對戰孟加拉隊。

現場球迷由開場至散場仍然情緒高漲，離場時繼續歡呼，又稱讚啟德主場館氣氛好。 球賽臨完場前約十多分鐘，港鐵屯馬綫荃灣西站附近一度發生信號設備故障，全綫行車時間一度延長，但未有影響啟德主場館散場人潮。"
印度海域一艘集裝箱貨輪爆炸 18人獲救4人失蹤,2025-06-11 05:33,https://www.metroradio.com.hk/news/default.aspx?SearchText=&NewsId=20250611053343&page=0,metro,,2025-06-11 05:45,"中國駐印度大使館證實，當地時間星期一在印度喀拉拉邦附近海域，一艘在新加坡註冊的集裝箱貨輪發生爆炸，船上共載有22名船員，其中18人獲救，包括6名台灣船員；4人失蹤，當中包括2名台灣船員。

中國駐印度使館發言人，感謝印度海軍及孟買海岸警衛隊的快速反應，希望進一步救援行動取得成功，祝願受傷船員早日康復。

   印度媒體報道，涉事貨輪在上星期六，從斯里蘭卡首都科倫坡出發，原本計劃在今個星期二抵達印度孟買。"
美國商務部長盧特尼克:中美貿易談判進展順利但有可能持續到周三,2025-06-11 04:58,https://www.metroradio.com.hk/news/default.aspx?SearchText=&NewsId=20250611045817&page=0,metro,,2025-06-11 05:15,"中美兩國在倫敦的貿易會談進入第二日。 美國商務部長盧特尼克(Howard Lutnick)表示，與中國官員貿易會談進展順利，但拒絕提供細節。 盧特尼克期望會談能夠在當地星期二晚間結束，但亦可能持續到星期三。

美國財政部發言人向記者表示，會談暫停，雙方稍事休息，將於當地時間星期二晚上約8點繼續，目前尚未公布任何細節。

據報今次會談議題聚焦關稅、科技及稀土。 中美兩個超級大國力爭在出口管制問題上取得突破，但這問題可能會破壞關稅休戰。

正在英國訪問的中共中央政治局委員、國務院副總理何立峰率領團隊與會，美方代表包括財長貝森特(Scott Bessent)、商務部長盧特尼克及貿易代表格里爾(Jamieson Greer)。 中方代表團首日會談後未有向記者發表談話。"
美國白宮:彭博新聞指貝森特或接替鮑威爾出任美國聯儲局主席的報道不實,2025-06-11 04:35,https://www.metroradio.com.hk/news/default.aspx?SearchText=&NewsId=20250611043552&page=0,metro,,2025-06-11 05:00,"彭博新聞星期二引述知情人士指，美國財長貝森特(Scott Bessent)成為接替美國聯儲局主席鮑威爾(Jerome Powell)的一個可能人選。 美國白宮隨即指出彭博報道不實。

報道又指，聯儲局主席職位的正式面試尚未開始；而    貝森特正在領導特朗普大刀闊斧的全球貿易改革，並參與推動稅收及監管調整。 另外，報道提及其他聯儲局主席候選人，包括前聯儲局理事瓦爾許(Kevin Warsh)，他早前曾獲得美國總統特朗普(Donald Trump)就財長職位的面試。     特朗普上周五表示，他將很快任命鮑威爾的繼任人。"
天文台凌晨3點45分取消雷暴警告,2025-06-11 03:54,https://www.metroradio.com.hk/news/default.aspx?SearchText=&NewsId=20250611035451&page=0,metro,,2025-06-11 04:15,天文台凌晨3點45分取消雷暴警告。
美國科技顧問委員會主席警告美國在AI領域過度監管或損害美國在AI行業的創新,2025-06-11 03:42,https://www.metroradio.com.hk/news/default.aspx?SearchText=&NewsId=20250611034225&page=0,metro,,2025-06-11 04:00,"美國科技顧問委員會主席薩克斯(David Sacks)在華盛頓特區的一次活動上表示，中國在人工智能(AI)領域，僅落後美國3至6個月。

被指是人工智能及加密貨幣沙皇的薩克斯，警告美國在人工智能領域的過度監管，可能會損害美國在人工智能行業的創新。"
以軍:可能成功攔截了也門胡塞武裝向以色列發射的一枚導彈,2025-06-11 02:51,https://www.metroradio.com.hk/news/default.aspx?SearchText=&NewsId=20250611025115&page=0,metro,,2025-06-11 03:00,"以軍表示，可能成功攔截了也門胡塞武裝向以色列發射的一枚導彈。

以色列國防軍發表聲明，指在星期二導彈未進入以色列前，以色列本土守備司令部發布了導彈襲擊預警。 由於攔截導彈過程可能產生導彈碎片，以方發射了更多攔截彈。

   以色列中部及約旦河西岸部分猶太人定居點社區，響起防空警報。 耶路撒冷聽到防空系統實施攔截所產生的多次爆炸聲。"
天文台凌晨2點25分發出雷暴警告:有效至凌晨4點半 預料新界北部局部地區有雷暴,2025-06-11 02:39,https://www.metroradio.com.hk/news/default.aspx?SearchText=&NewsId=20250611023928&page=0,metro,,2025-06-11 03:00,"天文台在凌晨2點25分發出雷暴警告，有效時間至今日凌晨4點半，預料新界北部局部地區有雷暴。

雷暴發生時，應採取預防措施。 如身處室外，應到安全地方躲避；離開水面，切勿在戶外游泳或進行其他戶外水上運動；切勿站立於高地或接近導電的物體、樹木或桅杆。"
海事處:一號戒備信號生效 提醒船東船主及船舶負責人立即採取防風措施,2025-06-11 02:23,https://www.metroradio.com.hk/news/default.aspx?SearchText=&NewsId=20250611022309&page=0,metro,,2025-06-11 02:30,"海事處表示，由於一號戒備信號已發出，提醒船東、船主及船舶負責人，應立即採取防風措施，將船隻妥善繫固於安全地方。

遇有意外事故，須立即向船隻航行監察中心報告，電話是2233 7801。"
一號戒備信號生效今早維持 天文台視乎低氣壓強度距離評估需否明日至周五改發三號信號,2025-06-11 02:14,https://www.metroradio.com.hk/news/default.aspx?SearchText=&NewsId=20250611021436&page=0,metro,,2025-06-11 02:30,"一號戒備信號現正生效，會在今早維持。

在凌晨2點，位於南海中部的熱帶低氣壓，集結在香港以南約780公里，預料向西北偏西移動，時速約10公里，橫過南海中部。

按照現時預測路徑，該熱帶低氣壓今日仍與本港保持超過700公里距離，預料本港今日尚未普遍吹強風，但與其相關的外圍雨帶會影響南海北部。

一號戒備信號會在今日早上維持，預料該熱帶低氣壓會在未來一兩日，逐漸增強並大致移向海南島，隨後移至廣東西部沿岸一帶。

天文台會視乎其強度、與本港的距離及本地風力變化，評估是否需要在明日稍後至星期五，改發三號強風信號。 隨著熱帶氣旋靠近沿岸地區，本周後期風勢頗大，間中有狂風大驟雨，海有湧浪，市民應遠離岸邊及停止所有水上活動。"
民政事務總署: 酷熱天氣警告生效期間 全日開放19間臨時避暑中心,2025-06-11 01:08,https://www.metroradio.com.hk/news/default.aspx?SearchText=&NewsId=20250611010830&page=0,metro,,2025-06-11 01:45,"民政事務總署開放19間社區會堂和社區中心作臨時避暑中心，中心會在酷熱天氣警告生效期間，全日開放予市民避暑。 另外，由昨晚10點半至今早8點，中心亦會供應被鋪和睡覺的地方予有需要人士。 中心內有人員當值。

為確保入住臨時避寒中心的人士可以在寧靜及不受干擾的環境下休息，任何市民或團體如希望送贈物品給入住者，須先聯絡中心職員進行登記，然後將物品放置在指定的室內地點。 中心職員會協助通知入住者有關安排，讓他們自行領取所需物品。

如需進一步資料，可致電民政事務總署熱線2572 8427查詢。"
