title,date,url,source,section,scrape_time,news_content
富譽控股執董袁曉桐獲委任為主席,2025-09-30 19:22,https://finance.mingpao.com/fin/instantf/20250930/1759231691335/%e5%af%8c%e8%ad%bd%e6%8e%a7%e8%82%a1%e5%9f%b7%e8%91%a3%e8%a2%81%e6%9b%89%e6%a1%90%e7%8d%b2%e5%a7%94%e4%bb%bb%e7%82%ba%e4%b8%bb%e5%b8%ad,mingpao,經濟,2025-09-30 19:45,"富譽控股（8269）公布，執行董事袁曉桐已獲委任為董事會主席，即日（9月30日）起生效。

現年39歲的袁曉桐於8月20日獲委任為公司執董。據公司介紹，袁曉桐於2012年創辦OPS Global Limited，於2016年創辦倍升控股有限公司及倍升學院，其學院學生人數逾3000人，於2017年創辦名望有限公司，及於2018年創辦網上財經平台「MoneyKOL」。目前，他為多家金融媒體平台的主持人及專欄作家，並著有投資策略與市場洞察相關書籍。

於今日公告日期，袁曉桐於公司1.87億股股份中擁有權益，相當於公司已發行股本約20.97%。其他報道OK便利店二維碼及信用卡支付回復正常服務 EPS及繳費服務續停中國高精密上半年轉賺1745萬人幣 不派中期息快手生活服務部門易帥 重組電商等業務加強協同互補港交所就優化結構性產品上市制度 推六星期諮詢證監會就廣駿涉操縱活動 尋求法庭頒令凍結3.94億元資產周創建收購東莞物流物業 為大灣區首個物流項目金管局：港元8月存款跌2.1% 人民幣存款升3.2%和電：古星輝辭任執董兼行政總裁 何偉榮接任寧德時代宜春鋰礦儲量報告據報獲批政府：本財年首5月赤字676億元金管局：8月新批按揭貸款額按月跌6.3%全日沽空金額減7% 比率兩周低 阿里沽空減34%財經花生丨周凱旋入股美職女子足球隊Angel City FC恒指收市升232點 科指創逾3年高 北水流入兩周最多 港股連升5個月及3季 創逾4年最長升浪 阿里、晶片股表現最佳杜嘉祺離任 匯控仍未決定正式繼任人 遭英國監管機構施壓泡泡瑪特：借鑑迪士尼 將Labubu塑造長期成功IP華府面臨停擺風險 嘉信理財：或與勞動力報告同發酵調查：逾半內地富裕旅客「十一」出遊首選香港 人均消費預2.8萬人幣

其他報道

OK便利店二維碼及信用卡支付回復正常服務 EPS及繳費服務續停中國高精密上半年轉賺1745萬人幣 不派中期息快手生活服務部門易帥 重組電商等業務加強協同互補港交所就優化結構性產品上市制度 推六星期諮詢證監會就廣駿涉操縱活動 尋求法庭頒令凍結3.94億元資產周創建收購東莞物流物業 為大灣區首個物流項目金管局：港元8月存款跌2.1% 人民幣存款升3.2%和電：古星輝辭任執董兼行政總裁 何偉榮接任寧德時代宜春鋰礦儲量報告據報獲批政府：本財年首5月赤字676億元金管局：8月新批按揭貸款額按月跌6.3%全日沽空金額減7% 比率兩周低 阿里沽空減34%財經花生丨周凱旋入股美職女子足球隊Angel City FC恒指收市升232點 科指創逾3年高 北水流入兩周最多 港股連升5個月及3季 創逾4年最長升浪 阿里、晶片股表現最佳杜嘉祺離任 匯控仍未決定正式繼任人 遭英國監管機構施壓泡泡瑪特：借鑑迪士尼 將Labubu塑造長期成功IP華府面臨停擺風險 嘉信理財：或與勞動力報告同發酵調查：逾半內地富裕旅客「十一」出遊首選香港 人均消費預2.8萬人幣

OK便利店二維碼及信用卡支付回復正常服務 EPS及繳費服務續停

中國高精密上半年轉賺1745萬人幣 不派中期息快手生活服務部門易帥 重組電商等業務加強協同互補港交所就優化結構性產品上市制度 推六星期諮詢證監會就廣駿涉操縱活動 尋求法庭頒令凍結3.94億元資產周創建收購東莞物流物業 為大灣區首個物流項目金管局：港元8月存款跌2.1% 人民幣存款升3.2%和電：古星輝辭任執董兼行政總裁 何偉榮接任寧德時代宜春鋰礦儲量報告據報獲批政府：本財年首5月赤字676億元金管局：8月新批按揭貸款額按月跌6.3%全日沽空金額減7% 比率兩周低 阿里沽空減34%財經花生丨周凱旋入股美職女子足球隊Angel City FC恒指收市升232點 科指創逾3年高 北水流入兩周最多 港股連升5個月及3季 創逾4年最長升浪 阿里、晶片股表現最佳杜嘉祺離任 匯控仍未決定正式繼任人 遭英國監管機構施壓泡泡瑪特：借鑑迪士尼 將Labubu塑造長期成功IP華府面臨停擺風險 嘉信理財：或與勞動力報告同發酵調查：逾半內地富裕旅客「十一」出遊首選香港 人均消費預2.8萬人幣

中國高精密上半年轉賺1745萬人幣 不派中期息

快手生活服務部門易帥 重組電商等業務加強協同互補港交所就優化結構性產品上市制度 推六星期諮詢證監會就廣駿涉操縱活動 尋求法庭頒令凍結3.94億元資產周創建收購東莞物流物業 為大灣區首個物流項目金管局：港元8月存款跌2.1% 人民幣存款升3.2%和電：古星輝辭任執董兼行政總裁 何偉榮接任寧德時代宜春鋰礦儲量報告據報獲批政府：本財年首5月赤字676億元金管局：8月新批按揭貸款額按月跌6.3%全日沽空金額減7% 比率兩周低 阿里沽空減34%財經花生丨周凱旋入股美職女子足球隊Angel City FC恒指收市升232點 科指創逾3年高 北水流入兩周最多 港股連升5個月及3季 創逾4年最長升浪 阿里、晶片股表現最佳杜嘉祺離任 匯控仍未決定正式繼任人 遭英國監管機構施壓泡泡瑪特：借鑑迪士尼 將Labubu塑造長期成功IP華府面臨停擺風險 嘉信理財：或與勞動力報告同發酵調查：逾半內地富裕旅客「十一」出遊首選香港 人均消費預2.8萬人幣

快手生活服務部門易帥 重組電商等業務加強協同互補

港交所就優化結構性產品上市制度 推六星期諮詢證監會就廣駿涉操縱活動 尋求法庭頒令凍結3.94億元資產周創建收購東莞物流物業 為大灣區首個物流項目金管局：港元8月存款跌2.1% 人民幣存款升3.2%和電：古星輝辭任執董兼行政總裁 何偉榮接任寧德時代宜春鋰礦儲量報告據報獲批政府：本財年首5月赤字676億元金管局：8月新批按揭貸款額按月跌6.3%全日沽空金額減7% 比率兩周低 阿里沽空減34%財經花生丨周凱旋入股美職女子足球隊Angel City FC恒指收市升232點 科指創逾3年高 北水流入兩周最多 港股連升5個月及3季 創逾4年最長升浪 阿里、晶片股表現最佳杜嘉祺離任 匯控仍未決定正式繼任人 遭英國監管機構施壓泡泡瑪特：借鑑迪士尼 將Labubu塑造長期成功IP華府面臨停擺風險 嘉信理財：或與勞動力報告同發酵調查：逾半內地富裕旅客「十一」出遊首選香港 人均消費預2.8萬人幣

港交所就優化結構性產品上市制度 推六星期諮詢

證監會就廣駿涉操縱活動 尋求法庭頒令凍結3.94億元資產周創建收購東莞物流物業 為大灣區首個物流項目金管局：港元8月存款跌2.1% 人民幣存款升3.2%和電：古星輝辭任執董兼行政總裁 何偉榮接任寧德時代宜春鋰礦儲量報告據報獲批政府：本財年首5月赤字676億元金管局：8月新批按揭貸款額按月跌6.3%全日沽空金額減7% 比率兩周低 阿里沽空減34%財經花生丨周凱旋入股美職女子足球隊Angel City FC恒指收市升232點 科指創逾3年高 北水流入兩周最多 港股連升5個月及3季 創逾4年最長升浪 阿里、晶片股表現最佳杜嘉祺離任 匯控仍未決定正式繼任人 遭英國監管機構施壓泡泡瑪特：借鑑迪士尼 將Labubu塑造長期成功IP華府面臨停擺風險 嘉信理財：或與勞動力報告同發酵調查：逾半內地富裕旅客「十一」出遊首選香港 人均消費預2.8萬人幣

證監會就廣駿涉操縱活動 尋求法庭頒令凍結3.94億元資產

周創建收購東莞物流物業 為大灣區首個物流項目金管局：港元8月存款跌2.1% 人民幣存款升3.2%和電：古星輝辭任執董兼行政總裁 何偉榮接任寧德時代宜春鋰礦儲量報告據報獲批政府：本財年首5月赤字676億元金管局：8月新批按揭貸款額按月跌6.3%全日沽空金額減7% 比率兩周低 阿里沽空減34%財經花生丨周凱旋入股美職女子足球隊Angel City FC恒指收市升232點 科指創逾3年高 北水流入兩周最多 港股連升5個月及3季 創逾4年最長升浪 阿里、晶片股表現最佳杜嘉祺離任 匯控仍未決定正式繼任人 遭英國監管機構施壓泡泡瑪特：借鑑迪士尼 將Labubu塑造長期成功IP華府面臨停擺風險 嘉信理財：或與勞動力報告同發酵調查：逾半內地富裕旅客「十一」出遊首選香港 人均消費預2.8萬人幣

周創建收購東莞物流物業 為大灣區首個物流項目

金管局：港元8月存款跌2.1% 人民幣存款升3.2%和電：古星輝辭任執董兼行政總裁 何偉榮接任寧德時代宜春鋰礦儲量報告據報獲批政府：本財年首5月赤字676億元金管局：8月新批按揭貸款額按月跌6.3%全日沽空金額減7% 比率兩周低 阿里沽空減34%財經花生丨周凱旋入股美職女子足球隊Angel City FC恒指收市升232點 科指創逾3年高 北水流入兩周最多 港股連升5個月及3季 創逾4年最長升浪 阿里、晶片股表現最佳杜嘉祺離任 匯控仍未決定正式繼任人 遭英國監管機構施壓泡泡瑪特：借鑑迪士尼 將Labubu塑造長期成功IP華府面臨停擺風險 嘉信理財：或與勞動力報告同發酵調查：逾半內地富裕旅客「十一」出遊首選香港 人均消費預2.8萬人幣

金管局：港元8月存款跌2.1% 人民幣存款升3.2%

和電：古星輝辭任執董兼行政總裁 何偉榮接任寧德時代宜春鋰礦儲量報告據報獲批政府：本財年首5月赤字676億元金管局：8月新批按揭貸款額按月跌6.3%全日沽空金額減7% 比率兩周低 阿里沽空減34%財經花生丨周凱旋入股美職女子足球隊Angel City FC恒指收市升232點 科指創逾3年高 北水流入兩周最多 港股連升5個月及3季 創逾4年最長升浪 阿里、晶片股表現最佳杜嘉祺離任 匯控仍未決定正式繼任人 遭英國監管機構施壓泡泡瑪特：借鑑迪士尼 將Labubu塑造長期成功IP華府面臨停擺風險 嘉信理財：或與勞動力報告同發酵調查：逾半內地富裕旅客「十一」出遊首選香港 人均消費預2.8萬人幣

和電：古星輝辭任執董兼行政總裁 何偉榮接任

寧德時代宜春鋰礦儲量報告據報獲批政府：本財年首5月赤字676億元金管局：8月新批按揭貸款額按月跌6.3%全日沽空金額減7% 比率兩周低 阿里沽空減34%財經花生丨周凱旋入股美職女子足球隊Angel City FC恒指收市升232點 科指創逾3年高 北水流入兩周最多 港股連升5個月及3季 創逾4年最長升浪 阿里、晶片股表現最佳杜嘉祺離任 匯控仍未決定正式繼任人 遭英國監管機構施壓泡泡瑪特：借鑑迪士尼 將Labubu塑造長期成功IP華府面臨停擺風險 嘉信理財：或與勞動力報告同發酵調查：逾半內地富裕旅客「十一」出遊首選香港 人均消費預2.8萬人幣

寧德時代宜春鋰礦儲量報告據報獲批

政府：本財年首5月赤字676億元金管局：8月新批按揭貸款額按月跌6.3%全日沽空金額減7% 比率兩周低 阿里沽空減34%財經花生丨周凱旋入股美職女子足球隊Angel City FC恒指收市升232點 科指創逾3年高 北水流入兩周最多 港股連升5個月及3季 創逾4年最長升浪 阿里、晶片股表現最佳杜嘉祺離任 匯控仍未決定正式繼任人 遭英國監管機構施壓泡泡瑪特：借鑑迪士尼 將Labubu塑造長期成功IP華府面臨停擺風險 嘉信理財：或與勞動力報告同發酵調查：逾半內地富裕旅客「十一」出遊首選香港 人均消費預2.8萬人幣

政府：本財年首5月赤字676億元

金管局：8月新批按揭貸款額按月跌6.3%全日沽空金額減7% 比率兩周低 阿里沽空減34%財經花生丨周凱旋入股美職女子足球隊Angel City FC恒指收市升232點 科指創逾3年高 北水流入兩周最多 港股連升5個月及3季 創逾4年最長升浪 阿里、晶片股表現最佳杜嘉祺離任 匯控仍未決定正式繼任人 遭英國監管機構施壓泡泡瑪特：借鑑迪士尼 將Labubu塑造長期成功IP華府面臨停擺風險 嘉信理財：或與勞動力報告同發酵調查：逾半內地富裕旅客「十一」出遊首選香港 人均消費預2.8萬人幣

金管局：8月新批按揭貸款額按月跌6.3%

全日沽空金額減7% 比率兩周低 阿里沽空減34%財經花生丨周凱旋入股美職女子足球隊Angel City FC恒指收市升232點 科指創逾3年高 北水流入兩周最多 港股連升5個月及3季 創逾4年最長升浪 阿里、晶片股表現最佳杜嘉祺離任 匯控仍未決定正式繼任人 遭英國監管機構施壓泡泡瑪特：借鑑迪士尼 將Labubu塑造長期成功IP華府面臨停擺風險 嘉信理財：或與勞動力報告同發酵調查：逾半內地富裕旅客「十一」出遊首選香港 人均消費預2.8萬人幣

全日沽空金額減7% 比率兩周低 阿里沽空減34%

財經花生丨周凱旋入股美職女子足球隊Angel City FC恒指收市升232點 科指創逾3年高 北水流入兩周最多 港股連升5個月及3季 創逾4年最長升浪 阿里、晶片股表現最佳杜嘉祺離任 匯控仍未決定正式繼任人 遭英國監管機構施壓泡泡瑪特：借鑑迪士尼 將Labubu塑造長期成功IP華府面臨停擺風險 嘉信理財：或與勞動力報告同發酵調查：逾半內地富裕旅客「十一」出遊首選香港 人均消費預2.8萬人幣

財經花生丨周凱旋入股美職女子足球隊Angel City FC

恒指收市升232點 科指創逾3年高 北水流入兩周最多 港股連升5個月及3季 創逾4年最長升浪 阿里、晶片股表現最佳杜嘉祺離任 匯控仍未決定正式繼任人 遭英國監管機構施壓泡泡瑪特：借鑑迪士尼 將Labubu塑造長期成功IP華府面臨停擺風險 嘉信理財：或與勞動力報告同發酵調查：逾半內地富裕旅客「十一」出遊首選香港 人均消費預2.8萬人幣

恒指收市升232點 科指創逾3年高 北水流入兩周最多 港股連升5個月及3季 創逾4年最長升浪 阿里、晶片股表現最佳

杜嘉祺離任 匯控仍未決定正式繼任人 遭英國監管機構施壓泡泡瑪特：借鑑迪士尼 將Labubu塑造長期成功IP華府面臨停擺風險 嘉信理財：或與勞動力報告同發酵調查：逾半內地富裕旅客「十一」出遊首選香港 人均消費預2.8萬人幣

杜嘉祺離任 匯控仍未決定正式繼任人 遭英國監管機構施壓

泡泡瑪特：借鑑迪士尼 將Labubu塑造長期成功IP華府面臨停擺風險 嘉信理財：或與勞動力報告同發酵調查：逾半內地富裕旅客「十一」出遊首選香港 人均消費預2.8萬人幣

泡泡瑪特：借鑑迪士尼 將Labubu塑造長期成功IP

華府面臨停擺風險 嘉信理財：或與勞動力報告同發酵調查：逾半內地富裕旅客「十一」出遊首選香港 人均消費預2.8萬人幣

華府面臨停擺風險 嘉信理財：或與勞動力報告同發酵

調查：逾半內地富裕旅客「十一」出遊首選香港 人均消費預2.8萬人幣

調查：逾半內地富裕旅客「十一」出遊首選香港 人均消費預2.8萬人幣"
亞洲影藝創意大獎｜阮浩棕首奪最佳男配角：好開心好突然,2025-09-30 19:19,https://ol.mingpao.com/ldy/showbiz/latest/20250930/1759230959207/%e4%ba%9e%e6%b4%b2%e5%bd%b1%e8%97%9d%e5%89%b5%e6%84%8f%e5%a4%a7%e7%8d%8e-%e9%98%ae%e6%b5%a9%e6%a3%95%e9%a6%96%e5%a5%aa%e6%9c%80%e4%bd%b3%e7%94%b7%e9%85%8d%e8%a7%92-%e5%a5%bd%e9%96%8b%e5%bf%83%e5%a5%bd%e7%aa%81%e7%84%b6,mingpao,娛樂,2025-09-30 19:45,"無綫電視奪得「2025亞洲影藝創意大獎」（中國香港地區）13項殊榮，涵蓋劇集、綜藝節目、新聞及資訊內容節目等，所有獎項亦已自動入圍角逐亞洲地區冠軍大獎，成績斐然。

去年憑《異空感應》中的立體角色及出色演技而贏盡好評的阮浩棕，亦憑該劇奪得人生首個演技獎項「最佳男配角」；對於演技獲得肯定，阮浩棕開心回應：「好開心、好突然！本身都冇諗過自己有份角逐呢一個獎，𠵱家仲要攞到香港地區最佳男配角嘅認可，更加係好大鼓舞，成個感覺好唔真實。之後我會繼續努力，以後嘅演出都要對得住呢一份認可。」

除了大製作，小品式劇集同樣傳來喜訊，由新晉幕後製作人林瑋澄監製的《奔跑吧！勇敢的女人們》，除令吳若希榮獲最佳喜劇演員，劇集亦同樣獲得最佳喜劇節目殊榮。憑《中年好聲音》系列的主持工作，獲得不少網民及家庭觀眾喜愛的車婉婉，亦成功憑節目勇奪「最佳娛樂節目主持」。

相關新聞：亞洲影藝創意大獎｜無綫奪13獎 張振朗傅嘉莉膺視帝視后"
亞洲影藝創意大獎｜無綫奪13獎 張振朗傅嘉莉膺視帝視后,2025-09-30 19:13,https://ol.mingpao.com/ldy/showbiz/latest/20250930/1759230484616/%e4%ba%9e%e6%b4%b2%e5%bd%b1%e8%97%9d%e5%89%b5%e6%84%8f%e5%a4%a7%e7%8d%8e-%e7%84%a1%e7%b6%ab%e5%a5%aa13%e7%8d%8e-%e5%bc%b5%e6%8c%af%e6%9c%97%e5%82%85%e5%98%89%e8%8e%89%e8%86%ba%e8%a6%96%e5%b8%9d%e8%a6%96%e5%90%8e,mingpao,娛樂,2025-09-30 19:45,"無綫電視奪得「2025亞洲影藝創意大獎」（中國香港地區）13項殊榮，涵蓋劇集、綜藝節目、新聞及資訊內容節目等，所有獎項亦已自動入圍角逐亞洲地區冠軍大獎，成績斐然。

去年憑《反黑英雄》在《萬千星輝頒獎典禮2024》勇奪視帝的張振朗，這次憑《奪命提示》再奪視帝。憑《刑偵12》首奪視后的傅嘉莉，在劇集中的「炸彈人質」事件、以及在大結局中的被揭頭紗後，與陳自瑤「Face off」的名場面，不但令觀眾留下了深刻印象，尤其她被林保怡揭開頭紗一幕，滿目淚光的傅嘉莉在短短數個鏡頭，已演活了因長期飽受折磨，整個人像沒靈魂狀態。

傅嘉莉感激總監製鍾澍佳（佳導）：「首先多謝大會，亞洲影藝創意大獎，同埋多謝大家支持，今次係我第一個女主角獎，本身有Fans同我講呢個消息時，我都唔敢相信，直到鍾澍佳總監製同我講，我先知係真，好開心亦都好感恩、好感動。首先第一個最大感受，一定係好多謝佳導，我這幾年拎嘅所有獎都係因為佢，多謝佢和編劇畀我咁好嘅角色，我真係好鍾意楊芷菲呢個角色，我會繼續努力，珍惜每一個演出機會，做得更加好。」傅嘉莉續說：「期待《刑偵12》之後拎更加多獎，亦都恭喜YoYo（陳自瑤）拎最佳女配角，同埋劇集主題曲拎咗最佳主題曲。」"
