title,date,url,source,section,scrape_time,news_content
國慶餐飲優惠2025　太興、錦麗堂食七折　海港酒家燒鵝七折例牌$89【附名單連結】,2025-10-01 08:44,https://news.mingpao.com/ins/%e7%86%b1%e9%bb%9e/article/20251001/s00024/1759140475153/%e5%9c%8b%e6%85%b6%e9%a4%90%e9%a3%b2%e5%84%aa%e6%83%a02025-%e5%a4%aa%e8%88%88-%e9%8c%a6%e9%ba%97%e5%a0%82%e9%a3%9f%e4%b8%83%e6%8a%98-%e6%b5%b7%e6%b8%af%e9%85%92%e5%ae%b6%e7%87%92%e9%b5%9d%e4%b8%83%e6%8a%98%e4%be%8b%e7%89%8c-89%e3%80%90%e9%99%84%e5%90%8d%e5%96%ae%e9%80%a3%e7%b5%90%e3%80%91,mingpao,熱點,2025-10-01 09:00,"為慶祝10月1日國慶76周年，全港超過3000間食肆及不同商場推出餐飲及消費折扣優惠，本文精選部分優惠。食肆優惠詳情可按此。

太興集團旗下的太興、敏華冰廳（機場分店除外）、茶木、亞參雞飯、靠得住粥麵小館、錦麗、點煲、餃子駅及TOKENYO韓式烤肉料理，10月1日全日堂食可享七折優惠。

大快活：10月1日晚市惠顧「鐵板二人餐」可享七折優惠價$97（原價$139）

上海姥姥：即日至10月1日，堂食拉麵類及川菜類七折，優惠設$9品茶/水費用，並按原價計算加一服務費

意粉屋：即日至10月1日，堂食薄餅類及意粉類，可享七折優惠，加一服務費按原價計算

海港飲食集團：10月1日上午11時後，海港酒家、海港燒鵝海鮮酒家、海王漁港燒鵝皇七折優惠：例牌$89（原價$128，2至4人）、半隻$166（原價$238，5至7人）、一隻$327（原價$468，8人或以上），售完即止【詳情】

大家樂：10月1日午市及茶市，$39燒味台式肉燥飯配茶啡汽水（零售價$56），燒腩需另加錢；部分分店食得樂輕嚥料理便當可享七折優惠價$41

牛奶冰室：即日至10月7日下午2時至6時，$76套餐價可享：芝士火腿肉醬焗通粉、雪菜肉絲炆米、五香脆雞翼（2隻）、2杯特飲（雪糕特飲除外）

百份百餐廳：即日至10月7日下午2時至6時，$76套餐價可享：魚肉春卷花甲蕃茄湯米線、花生醬金磚西多士、五香脆雞翼拼牛奶卷（各兩件）配經典原味紅豆冰冰2杯

薄餅博士：10月1至31日，於PHD堂食/外賣自取惠顧滿$180或以上，並出示指定社交網站帖文，即送千島夏威夷普通批一個，送完即止。2025年10月6至7日、29日不適用

Chicken Factory：即日至10月1日下午2時至6時，$76套餐價可享：百里香原隻烤雞（1隻）、1款小食及1款飲品

肯德基：10月1日上午11時後，$10可享家鄉雞/香辣脆雞/狂惹香燒雞1件

包點先生/喜點：10月1日，所有糖水買一送一"
政府舉行升旗儀式慶祝國慶76周年,2025-10-01 08:28,https://news.mingpao.com/ins/%e6%b8%af%e8%81%9e/article/20251001/s00001/1759277975839/%e6%94%bf%e5%ba%9c%e8%88%89%e8%a1%8c%e5%8d%87%e6%97%97%e5%84%80%e5%bc%8f%e6%85%b6%e7%a5%9d%e5%9c%8b%e6%85%b676%e5%91%a8%e5%b9%b4,mingpao,港聞,2025-10-01 08:30,"特區政府今早（10月1日）在灣仔金紫荊廣場舉行升旗儀式，慶祝中華人民共和國成立76周年。特首李家超與政府一眾高層官員、全國政協副主席梁振英、前特首林鄭月娥及曾蔭權出席；中聯辦主任周霽、行會成員及一眾立法會議員亦在場，全國政協副主席董建華則無現身。

升旗儀式上午8時開始舉行，現場不設立公眾觀禮區。儀式由警察樂隊奏樂、歌唱家林國浩和李洋領唱，何東中學和英皇書院合唱團亦聯合獻唱國歌。政府飛行服務隊直升機懸掛國旗在廣場上空飛過、消防輪等在維港海面射水敬禮。"
天氣｜天文台：大致天晴　日間酷熱及乾燥,2025-10-01 08:17,https://news.mingpao.com/ins/%e7%86%b1%e9%bb%9e/article/20251001/s00024/1759277906112/%e5%a4%a9%e6%b0%a3-%e5%a4%a9%e6%96%87%e5%8f%b0-%e5%a4%a7%e8%87%b4%e5%a4%a9%e6%99%b4-%e6%97%a5%e9%96%93%e9%85%b7%e7%86%b1%e5%8f%8a%e4%b9%be%e7%87%a5,mingpao,熱點,2025-10-01 08:45,"上午8時，天文台錄得氣溫28.3°C，相對濕度85%。黃色火災危險警告和酷熱天氣警告現正生效。

高空反氣旋正為華南帶來大致良好的天氣。本港地區今日（10月1日）天氣預測大致天晴。日間酷熱及乾燥，市區最高氣溫約33°C，新界再高一兩度。今晚部分時間多雲。吹微風。

展望未來一兩日大致天晴及持續酷熱。周六（10月4日）稍後至下周日（10月5日）驟雨逐漸增多，風勢頗大，海有大浪及湧浪。中秋節（10月6日）及翌日（10月7日）天色逐步好轉。（天文台）

"
消費者在京東買到假美心月餅 店舖商品已被下架,2025-10-01 00:00,https://news.mingpao.com/ins/%e5%85%a9%e5%b2%b8/article/20251001/s00004/1759245717471/%e6%b6%88%e8%b2%bb%e8%80%85%e5%9c%a8%e4%ba%ac%e6%9d%b1%e8%b2%b7%e5%88%b0%e5%81%87%e7%be%8e%e5%bf%83%e6%9c%88%e9%a4%85-%e5%ba%97%e8%88%96%e5%95%86%e5%93%81%e5%b7%b2%e8%a2%ab%e4%b8%8b%e6%9e%b6,mingpao,兩岸,2025-10-01 00:15,"中秋將至，內地又出現偽冒香港月餅的投訴。上海「澎湃新聞」9月30日報道，消費者蔣先生9月5日花364.16元（人民幣，下同）在京東商城一家名為「瑔蕨買手店」購買了2盒美心四式流心月餅，9月9日到貨後，發現掃防偽碼提示為假冒。

蔣先生向平台反饋，先行退貨退款並獲得賠付200元。但他對該處理結果不滿，認為應按照食品安全法相關規定「退一賠十」，並要求商家下架許可範圍外的商品，關店整改。

「瑔蕨買手店」認證主體是義烏市瑔蕨電子商務商行，2025年1月21日成立，2025年2月4日註冊了該網店。目前店舖商品已被下架。

中秋將至，網絡上存在大量銷售山寨美心月餅的商家，內媒發布多篇相關報道。山寨美心月餅不僅模仿正品包裝的整體設計，甚至還偽造了防偽驗證系統。

「香港美心月餅與節日食品」微博官方帳號8月26日曾發布公告，稱公司發現市場上存在美心流心奶黃月餅的假冒產品，呼籲消費者從官方及正品授權渠道購買。

此外，根據電子商務法第11條規定，電子商務平台經營者應當履行對平台內經營者的管理責任，如果平台未能盡到義務導致消費者買到假貨，可能需要承擔連帶責任。（澎湃新聞）"
網民因跛腳第一天返工被要求辭職 得力集團發聲明致歉,2025-09-30 23:59,https://news.mingpao.com/ins/%e5%85%a9%e5%b2%b8/article/20250930/s00004/1759247970753/%e7%b6%b2%e6%b0%91%e5%9b%a0%e8%b7%9b%e8%85%b3%e7%ac%ac%e4%b8%80%e5%a4%a9%e8%bf%94%e5%b7%a5%e8%a2%ab%e8%a6%81%e6%b1%82%e8%be%ad%e8%81%b7-%e5%be%97%e5%8a%9b%e9%9b%86%e5%9c%98%e7%99%bc%e8%81%b2%e6%98%8e%e8%87%b4%e6%ad%89,mingpao,兩岸,2025-10-01 00:15,"內地有網民9月29日在社交平台發帖稱，第一天到浙江寧波得力集團上班即被人事部門要求主動辭職，懷疑是因為自己腿部有殘疾遭歧視。得力集團9月30日發布致歉聲明，表示會妥善處理事件，問責涉事人員，修改可能存在的歧視性制度，加強企業內部反歧視培訓。

網民「小值錢12138」9月29日在社交平台小紅書發帖稱，5月到得力集團報到時被人事部門要求主動辭職。該網民強調，她通過3輪面試後獲錄用，雖有跛足但行動無須輪椅、拐杖，更不會影響其工作能力，過往多年職場履歷也證明她可以勝任職務。

該網民9月30日表示，已經拒絕得力挽留，不會考慮繼續在得力工作，又呼籲僱主給殘疾人更多公平對待的機會。

得力是內地最大的文具、辦公用品生產商之一。

該網民表示，早前滴滴發生的類似事件讓她有勇氣披露自己遭受的不公待遇。內地網約車巨頭滴滴有新員工稱因腿部殘疾遭人事部門勸退，人事部門揚言，「別人走路30秒你可能要3分鐘」，「即便留下也過不了試用期」。事件曝光後，滴滴開除了涉事的人事部門職員，重新邀請當事人入職其他崗位，並承諾加强企業內部管理和價值觀宣傳引導。（綜合報道）"
消費者在京東買到假美心月餅  店舖商品已被下架,2025-09-30 23:59,https://news.mingpao.com/ins/%e5%85%a9%e5%b2%b8/article/20250930/s00004/1759247970753/%e6%b6%88%e8%b2%bb%e8%80%85%e5%9c%a8%e4%ba%ac%e6%9d%b1%e8%b2%b7%e5%88%b0%e5%81%87%e7%be%8e%e5%bf%83%e6%9c%88%e9%a4%85-%e5%ba%97%e8%88%96%e5%95%86%e5%93%81%e5%b7%b2%e8%a2%ab%e4%b8%8b%e6%9e%b6,mingpao,兩岸,2025-10-01 00:00,"中秋將至，內地又出現偽冒香港月餅的投訴。上海「澎湃新聞」9月30日報道，消費者蔣先生9月5日花364.16元（人民幣，下同）在京東商城一家名為「瑔蕨買手店」購買了2盒美心四式流心月餅，9月9日到貨後，發現掃防偽碼提示為假冒。

蔣先生向平台反饋，先行退貨退款並獲得賠付200元。但他對該處理結果不滿，認為應按照食品安全法相關規定「退一賠十」，並要求商家下架許可範圍外的商品，關店整改。

「瑔蕨買手店」認證主體是義烏市瑔蕨電子商務商行，2025年1月21日成立，2025年2月4日註冊了該網店。目前店舖商品已被下架。

中秋將至，網絡上存在大量銷售山寨美心月餅的商家，內媒發布多篇相關報道。山寨美心月餅不僅模仿正品包裝的整體設計，甚至還偽造了防偽驗證系統。

「香港美心月餅與節日食品」微博官方帳號8月26日曾發布公告，稱公司發現市場上存在美心流心奶黃月餅的假冒產品，呼籲消費者從官方及正品授權渠道購買。

此外，根據電子商務法第11條規定，電子商務平台經營者應當履行對平台內經營者的管理責任，如果平台未能盡到義務導致消費者買到假貨，可能需要承擔連帶責任。（澎湃新聞）"
易會滿被撤銷全國政協委員資格,2025-09-30 23:37,https://news.mingpao.com/ins/%e5%85%a9%e5%b2%b8/article/20250930/s00004/1759246665595/%e6%98%93%e6%9c%83%e6%bb%bf%e8%a2%ab%e6%92%a4%e9%8a%b7%e5%85%a8%e5%9c%8b%e6%94%bf%e5%8d%94%e5%a7%94%e5%93%a1%e8%b3%87%e6%a0%bc,mingpao,兩岸,2025-09-30 23:45,"政協第十四屆全國委員會第四十一次主席會議9月30日下午在京召開。會議審議通過關於免去易會滿政協第十四屆全國委員會經濟委員會駐會副主任職務，撤銷其委員資格的決定，提請全國政協十四屆常委會第十四次會議追認。

中紀委9月6日通報，易會滿涉嫌嚴重違紀違法，接受中央紀委國家監委紀律審查和監察調查。

易會滿出生於1964年12月，是二十屆中央委員。他曾在中國工商銀行工作多年，擔任過中國工商銀行副董事長、行長、黨委副書記等職，2016年5月任中國工商銀行董事長、黨委書記。

2019年1月，易會滿任中國證券監督管理委員會主席、黨委書記，2024年2月被免職，同年6月增補為第十四屆全國政協委員，並擔任經濟委員會駐會副主任。（綜合報道）"
網稱疫苗接種計劃個人資料用作配對器官捐贈或研究   衛生防護中心：指控子虛烏有,2025-09-30 23:23,https://news.mingpao.com/ins/%e6%b8%af%e8%81%9e/article/20250930/s00001/1759246057758/%e7%b6%b2%e7%a8%b1%e7%96%ab%e8%8b%97%e6%8e%a5%e7%a8%ae%e8%a8%88%e5%8a%83%e5%80%8b%e4%ba%ba%e8%b3%87%e6%96%99%e7%94%a8%e4%bd%9c%e9%85%8d%e5%b0%8d%e5%99%a8%e5%ae%98%e6%8d%90%e8%b4%88%e6%88%96%e7%a0%94%e7%a9%b6-%e8%a1%9b%e7%94%9f%e9%98%b2%e8%ad%b7%e4%b8%ad%e5%bf%83-%e6%8c%87%e6%8e%a7%e5%ad%90%e8%99%9b%e7%83%8f%e6%9c%89,mingpao,港聞,2025-09-30 23:45,"有社交平台帖文稱，《2025/2026疫苗資助計劃》同意書條款中，個人資料會被轉交至「人類生殖科技管理局」以及「人體器官移植委員會」，質疑資料會用作器官捐贈的配對或相關研究。衞生防護中心今晚發稿表示，相關指控子虛烏有，有關條款是確保衞生署能夠迅速有效地調查在季節性流感疫苗接種計劃中可能出現的任何罕見異常事件，例如嚴重醫療事故。

衛生防護中心表示，有關的條款是確保衞生署能夠迅速有效地調查在季節性流感疫苗接種計劃中可能出現的任何罕見異常事件，例如供相關的機構調查涉及疫苗接種者的嚴重醫療事故。衞生署絕不會將有關資料用於器官捐贈或作配對移植的研究。紙本和電子同意書一般會在7年內銷毀，衞生署亦不會保存相關的個人資料。有關做法完全符合相關法例和保障個人資料私隱等要求。

中心呼籲市民切勿因謠言而猶豫是否接種季節性流感疫苗。"
雅居樂：擬今年底前與境外債權人達成初步重組  有14.92億人幣貸款獲延長,2025-09-30 23:11,https://finance.mingpao.com/fin/instantf/20250930/1759245277602/%e9%9b%85%e5%b1%85%e6%a8%82-%e6%93%ac%e4%bb%8a%e5%b9%b4%e5%ba%95%e5%89%8d%e8%88%87%e5%a2%83%e5%a4%96%e5%82%b5%e6%ac%8a%e4%ba%ba%e9%81%94%e6%88%90%e5%88%9d%e6%ad%a5%e9%87%8d%e7%b5%84-%e6%9c%8914-92%e5%84%84%e4%ba%ba%e5%b9%a3%e8%b2%b8%e6%ac%be%e7%8d%b2%e5%bb%b6%e9%95%b7,mingpao,經濟,2025-09-30 23:30,"雅居樂（3383）表示，就解決核數師無法表示意見，就推進境外債務重組，爭取在2025年底前與其境外多數主要債權人達成初步重組條款，較8月份公告擬在今年第三季提交初步重組方案，遲了一季。其更自4月29日至今日，已成功與多家金融機構達成初步協議，並獲批本金總額約14.92億元（人民幣、下同）之借款還款期延長，較8月份公告時的4.72億元大幅增加。

該集團又指，回收工作步伐亦已加快。自4月29日至今日，已收回約12.01億元，亦較8月時宣布收回7.64億元為多，主要用於支付支出及退回保交樓監管賬戶。其正積極與相關方磋商，以回收餘下未償還結餘，並承諾按需要調配額外資源，以加強回收力度。

在推進成本控制方面，繼其於8月份宣布，在第一季度減少行政成本1.59億元後，最新公布第二季度再減行政成本約2.21億元，按年減少約23.9%。所有高級、中級及初級管理層員工已分別接受57%、40%及20%的減薪。在普通員工中，54%員工已接受減薪，減薪幅度為10%。有關措施令員工成本減少1.12億元，較2024年同期減少約28.2%，亦較今年首季減少員工成本約4300萬元為多。

繼其於8月份公告，已就當地政府回購八個涉及商品房單位的項目與當地政府進行接洽後，最新公布顯示，仍與當地政府進行持續磋商，並額外透露，其積極探索外部渠道以處置其他資產，包括但不限於土地、商品房單位以及於公司及合營企業的股本權益。同時其正處理各項目之具體挑戰以實現處置，包括解決訴訟、解除資產凍結以及重組或結清債務責任。"
澳博上葡京十一推活動吸遊客  擬在澳門半島推社區活動,2025-09-30 23:07,https://finance.mingpao.com/fin/instantf/20250930/1759245073185/%e6%be%b3%e5%8d%9a%e4%b8%8a%e8%91%a1%e4%ba%ac%e5%8d%81%e4%b8%80%e6%8e%a8%e6%b4%bb%e5%8b%95%e5%90%b8%e9%81%8a%e5%ae%a2-%e6%93%ac%e5%9c%a8%e6%be%b3%e9%96%80%e5%8d%8a%e5%b3%b6%e6%8e%a8%e7%a4%be%e5%8d%80%e6%b4%bb%e5%8b%95,mingpao,經濟,2025-09-30 23:30,"十一黃金周將至，澳門博彩（0880）旗下澳娛綜合串連起玩樂、文化與美食等元素，把澳門上葡京綜合度假村與新馬路一帶打造成旅客於節日期間的必遊勝地。當中包括在上葡京推出「畢加索：縱情尋美」全球首展、G-DRAGON帶來的《MEDIA EXHIBITION : Übermensch》澳門站全球首展。

另該集團擬推出一系列社區活動，延伸至澳門半島康公廟前地，設有燈藝作品「筆映雙嶼 月照金山」，同場更設「書法互動體驗」，猜燈謎遊戲及燈籠工作坊。其亦首次透露，會在十六浦戶外廣場設有雜耍和舞蹈表演、高爾夫球推桿挑戰。"
德議員前華裔助理間諜罪成 囚4年9個月,2025-09-30 23:00,https://news.mingpao.com/ins/%e5%9c%8b%e9%9a%9b/article/20250930/s00005/1759243389742/%e5%be%b7%e8%ad%b0%e5%93%a1%e5%89%8d%e8%8f%af%e8%a3%94%e5%8a%a9%e7%90%86%e9%96%93%e8%ab%9c%e7%bd%aa%e6%88%90-%e5%9b%9a4%e5%b9%b49%e5%80%8b%e6%9c%88,mingpao,國際,2025-09-30 23:15,"德國德累斯頓的薩克森州高等法院周二（9月30日）宣判，一名另類選擇黨（AfD）議員的德籍華裔助理涉及為中國做間諜罪成，判囚4年零9個月。中國外交部表示不了解判決的具體內容，但中方堅決反對「誇大其詞、聳人聽聞」的「中國間諜威脅」，敦促有關人士停止散播誹謗中國的謠言。

被告譯名郭健（Jian Guo），原是在布魯塞爾歐洲議會擔任德國另類選擇黨議員克拉（Maximilian Krah）的助理。他涉嫌於2002年至去年被捕之前，向中國間諜提供有關另類選擇黨及中國異見人士的情報，並為中國當局對那些海外反對派展開監控。

同案另一被告、在萊比錫/哈勒機場物流公司工作的中國籍女子Jaqi X.（或譯Yaqi X.）因協助郭健蒐集班機資料，包含軍用飛機、部隊與無人機的細節，甚至包括運往以色列的裝備，被判緩刑1年零9個月。

此兩被告有權於宣判後的一星期內向聯邦法院提出上訴。

至於克拉原是另類選擇黨歐洲選舉活動主要候選人。他涉嫌收受中國賄賂、洗錢，上月被褫奪刑事檢控豁免權，正在接受調查。惟他聲稱是間諜案受害者，對他的指控是「荒謬、捏造、純粹出於政治動機」，希望法庭判決還他清白。

另類選擇黨的德國柏林國會黨團沒有即時回應事件。"
國慶76周年招待會舉行  習近平：支持港澳更好發展經濟、改善民生,2025-09-30 22:57,https://news.mingpao.com/ins/%e5%85%a9%e5%b2%b8/article/20250930/s00004/1759244254234/%e5%9c%8b%e6%85%b676%e5%91%a8%e5%b9%b4%e6%8b%9b%e5%be%85%e6%9c%83%e8%88%89%e8%a1%8c-%e7%bf%92%e8%bf%91%e5%b9%b3-%e6%94%af%e6%8c%81%e6%b8%af%e6%be%b3%e6%9b%b4%e5%a5%bd%e7%99%bc%e5%b1%95%e7%b6%93%e6%bf%9f-%e6%94%b9%e5%96%84%e6%b0%91%e7%94%9f,mingpao,兩岸,2025-09-30 23:00,"慶祝中華人民共和國成立76周年招待會9月30日晚在人民大會堂舉行。國家主席出席招待會並發表講話強調，實現中華民族偉大復興是前無古人的偉大事業，「憧憬和挑戰，都激發我們只爭朝夕、永不懈怠的奮鬥精神」。

國務院總理李強主持招待會，趙樂際、王滬寧、蔡奇、丁薛祥、李希、韓正出席招待會。

習近平指出，前不久隆重紀念中國人民抗日戰爭暨世界反法西斯戰爭勝利80周年，極大振奮了民族精神、激發了愛國熱情、凝聚了奮鬥力量。

習近平強調，今年以來，面對複雜形勢，我們進一步全面深化改革，扎實推動高質量發展，着力保障和改善民生，縱深推進全面從嚴治黨，黨和國家各項事業取得新進展新成效。下個月，我們黨將召開二十屆四中全會，研究制定「十五五」規劃建議；要緊緊圍繞新時代新征程黨的中心任務，把「十五五」發展的目標任務和戰略舉措規劃好實施好，確保基本實現社會主義現代化取得決定性進展。

習近平指出，要堅定不移貫徹「一國兩制」方針，支持港澳更好融入國家發展大局，更好發展經濟、改善民生；要深化兩岸交流合作，堅決反對「台獨」分裂行徑和外部勢力干涉，堅決捍衛國家主權和領土完整。

習近平強調，面對百年變局加速演進的國際形勢，我們要大力弘揚全人類共同價值，踐行真正的多邊主義，推動落實全球發展倡議、全球安全倡議、全球文明倡議、全球治理倡議，同各國攜手構建人類命運共同體。（新華社）"
中國K字簽證惹關注吸引印度人才 人民日報：曲解誤導公眾,2025-09-30 22:53,https://news.mingpao.com/ins/%e5%85%a9%e5%b2%b8/article/20250930/s00004/1759244054013/%e4%b8%ad%e5%9c%8bk%e5%ad%97%e7%b0%bd%e8%ad%89%e6%83%b9%e9%97%9c%e6%b3%a8%e5%90%b8%e5%bc%95%e5%8d%b0%e5%ba%a6%e4%ba%ba%e6%89%8d-%e4%ba%ba%e6%b0%91%e6%97%a5%e5%a0%b1-%e6%9b%b2%e8%a7%a3%e8%aa%a4%e5%b0%8e%e5%85%ac%e7%9c%be,mingpao,兩岸,2025-09-30 23:15,"中國將从10月1日起新增針對外國青年科技人才的K字簽證，引發海內外關注，有中國網民認爲新政將衝擊國內本來就嚴峻的就業形勢，更出現不少反對移民、仇視印度的聲音，相關話題連日衝上社交平台熱搜。《人民日報》旗下帳號「人民日報評論」9月30日發文稱有關言論「對政策存在誤讀誤解，誤導公眾、引發不必要的焦慮」。

目前反對K字簽證的主要觀點包括，國內擁有充足的本土人才儲備，引進外國人才是「舍近求遠」；K字簽證門檻不夠高，搶佔本土勞動者飯碗；歐美多國受移民問題困擾，中國不應重蹈覆轍；有混入間諜影響國家安全的風險。還有網民盛傳印度人才看上中國的K字簽證。

「人民日報評論」批評上述觀點是「無稽之談」、「視野過於狹隘」，強調吸引的是青年才俊而非「低素質勞動力」，而且不能將K字簽證和移民劃等號；文章表示，中國有足夠能力和信心應對，「不能因噎廢食」。

《環球時報》前總編輯胡錫進9月29日發文稱，政府有關部門有必要就設置K簽證的目的、將如何執行、對該簽證啟動後實際效果的初步評估，以及防止它走向偏差的管控措施等向公眾說明，「以安人心，以正視聽」。胡錫進表示，移民問題相當敏感，日後可能影響中國社會團結，各界不應輕視。"
國慶76周年招待會舉行  習近平：支持港澳更好發展經濟、改善民生,2025-09-30 22:53,https://news.mingpao.com/ins/%e5%85%a9%e5%b2%b8/article/20250930/s00004/1759244054013/%e5%9c%8b%e6%85%b676%e5%91%a8%e5%b9%b4%e6%8b%9b%e5%be%85%e6%9c%83%e8%88%89%e8%a1%8c-%e7%bf%92%e8%bf%91%e5%b9%b3-%e6%94%af%e6%8c%81%e6%b8%af%e6%be%b3%e6%9b%b4%e5%a5%bd%e7%99%bc%e5%b1%95%e7%b6%93%e6%bf%9f-%e6%94%b9%e5%96%84%e6%b0%91%e7%94%9f,mingpao,兩岸,2025-09-30 23:00,"慶祝中華人民共和國成立76周年招待會9月30日晚在人民大會堂舉行。國家主席出席招待會並發表講話強調，實現中華民族偉大復興是前無古人的偉大事業，「憧憬和挑戰，都激發我們只爭朝夕、永不懈怠的奮鬥精神」。

國務院總理李強主持招待會，趙樂際、王滬寧、蔡奇、丁薛祥、李希、韓正出席招待會。

習近平指出，前不久隆重紀念中國人民抗日戰爭暨世界反法西斯戰爭勝利80周年，極大振奮了民族精神、激發了愛國熱情、凝聚了奮鬥力量。

習近平強調，今年以來，面對複雜形勢，我們進一步全面深化改革，扎實推動高質量發展，着力保障和改善民生，縱深推進全面從嚴治黨，黨和國家各項事業取得新進展新成效。下個月，我們黨將召開二十屆四中全會，研究制定「十五五」規劃建議；要緊緊圍繞新時代新征程黨的中心任務，把「十五五」發展的目標任務和戰略舉措規劃好實施好，確保基本實現社會主義現代化取得決定性進展。

習近平指出，要堅定不移貫徹「一國兩制」方針，支持港澳更好融入國家發展大局，更好發展經濟、改善民生；要深化兩岸交流合作，堅決反對「台獨」分裂行徑和外部勢力干涉，堅決捍衛國家主權和領土完整。

習近平強調，面對百年變局加速演進的國際形勢，我們要大力弘揚全人類共同價值，踐行真正的多邊主義，推動落實全球發展倡議、全球安全倡議、全球文明倡議、全球治理倡議，同各國攜手構建人類命運共同體。（新華社）"
時富金融股權獲潛在買方洽購,2025-09-30 22:35,https://finance.mingpao.com/fin/instantf/20250930/1759243096884/%e6%99%82%e5%af%8c%e9%87%91%e8%9e%8d%e8%82%a1%e6%ac%8a%e7%8d%b2%e6%bd%9b%e5%9c%a8%e8%b2%b7%e6%96%b9%e6%b4%bd%e8%b3%bc,mingpao,經濟,2025-09-30 23:00,"時富金融（0510）發表公布指，董事會注意到其股份之價格及成交量於今日均有所上升。時富金融及時富投資（1049）之董事會指，據時富投資旗下，並在時富金融持股64.47%的Celestial Investment Group Ltd告知，正與一名獨立第三方為首的潛在買方，就涉及時富金融之若干股權之潛在交易磋商。

兩家公司指，倘交易落實，其根據收購守則可能構成時富投資之須予公佈交易，並可能對時富金融之股東產生影響。截至愈日，概無就潛在交易事項訂立確實協議，因此，潛在交易事項不一定會進行。兩家公司的股份將於本周四復牌買賣。

時富金融今日停牌前，股價大升40.9%，成交額達422萬元。其母公司時富投資今日停牌前收報0.95元，升10.47%，成交額約1.79萬元。"
