title,date,url,source,section,scrape_time,news_content
聯想集團全年多賺37% 末期息30.5港仙,2025-05-22 12:09,https://finance.mingpao.com/fin/instantf/20250522/1747887686948/%e8%81%af%e6%83%b3%e9%9b%86%e5%9c%98%e5%85%a8%e5%b9%b4%e5%a4%9a%e8%b3%ba37-%e6%9c%ab%e6%9c%9f%e6%81%af30-5%e6%b8%af%e4%bb%99,mingpao,經濟,2025-05-22 12:30,"聯想集團（0992）公布，截至今年3月底止全年股東應佔溢利13.84億（美元，下同），按年增長37%，派末期股息每股30.5港仙。

單計今年3月底止第四財季，聯想股東應佔溢利按年下降64%至9000萬元，集團解釋，盈利顯著倒退主要是由於非現金認股權證公允值虧損所致；排除非現金費用，非香港財務報告準則的股東應佔溢利則上升25%。

聯想全年收入錄690.77億元，升21%，創歷史第二高，基礎設施方案業務集團的收入同按年增長 63%，並於下半財年轉虧為盈，主要受伺服器訂單增加和企業業務復甦所推動。智能設備業務集團的收入及溢利分別增長13%及14%，主要受惠於智能手機、人工智能個人電腦產品擴充、商業需求及高端產品銷售，同時擴大全球市場份額第一的地位；智能手機業務創下自併購以來歷史新高收入。

全年研發支出增長13%，以促進混合人工智能的增長，推動基礎設施、邊緣設備、服務及人工智能應用的創新等。

其他報道
LVMH擬報向投資者稱 需求仍疲軟 本季表現並無改善
OpenAI以65億美元收購Jony Ive創辦的AI初創企業io
瑞銀：貿易戰爆發前 超級富豪計劃增加對華投資
國泰11.11復飛阿德萊德每周三班直航
滬深三大指數半日個別走 滬指近平收
沃爾瑪據報擬裁員約1500人
1個月HIBOR跌至0.66613% 港元升值幅度逾1個月最大 港美拆息差續創紀錄
摩通料中國經濟廣泛復蘇 外資興趣濃厚
中間價見1個月最強 人民幣升值創一周最強
新城發展據報擬發債籌15至20億人幣
比特幣升穿110000美元 創新高
據報Nike最快本周加價
大摩料百度第二季核心廣告進一步放緩
嗶哩嗶哩發售6億美元可換股優先票據
手回集團IPO 入場費3264.59元
被David Webb指H股流通股數量過低 寧德時代曾跌3.7% 惟仍較招股價高逾24%
匯豐英國員工辦公室出席率不足或被扣獎金
雅居樂建議更換核數師 安永將退任
滬深三大指數今早個別發展 人行進行1545億人幣逆回購
恒指低開79點 科指跌0.11% 百度、恒安跌2%
特朗普：正認真考慮讓房利美和房地美重新上市
榮昌生物折讓約9%配股 籌7億

其他報道

LVMH擬報向投資者稱 需求仍疲軟 本季表現並無改善

OpenAI以65億美元收購Jony Ive創辦的AI初創企業io

瑞銀：貿易戰爆發前 超級富豪計劃增加對華投資

國泰11.11復飛阿德萊德每周三班直航

滬深三大指數半日個別走 滬指近平收

沃爾瑪據報擬裁員約1500人

1個月HIBOR跌至0.66613% 港元升值幅度逾1個月最大 港美拆息差續創紀錄

摩通料中國經濟廣泛復蘇 外資興趣濃厚

中間價見1個月最強 人民幣升值創一周最強

新城發展據報擬發債籌15至20億人幣

比特幣升穿110000美元 創新高

據報Nike最快本周加價

大摩料百度第二季核心廣告進一步放緩

嗶哩嗶哩發售6億美元可換股優先票據

手回集團IPO 入場費3264.59元

被David Webb指H股流通股數量過低 寧德時代曾跌3.7% 惟仍較招股價高逾24%

匯豐英國員工辦公室出席率不足或被扣獎金

雅居樂建議更換核數師 安永將退任

滬深三大指數今早個別發展 人行進行1545億人幣逆回購

恒指低開79點 科指跌0.11% 百度、恒安跌2%

特朗普：正認真考慮讓房利美和房地美重新上市

榮昌生物折讓約9%配股 籌7億"
陳凱琳獲邀飛紐約與湯告魯斯見面 鄭嘉穎留港湊仔超妒忌,2025-05-22 12:03,https://ol.mingpao.com/ldy/showbiz/latest/20250522/1747886869634/%e9%99%b3%e5%87%b1%e7%90%b3%e7%8d%b2%e9%82%80%e9%a3%9b%e7%b4%90%e7%b4%84%e8%88%87%e6%b9%af%e5%91%8a%e9%ad%af%e6%96%af%e8%a6%8b%e9%9d%a2-%e9%84%ad%e5%98%89%e7%a9%8e%e7%95%99%e6%b8%af%e6%b9%8a%e4%bb%94%e8%b6%85%e5%a6%92%e5%bf%8c,mingpao,娛樂,2025-05-22 12:30,"陳凱琳（Grace）昨天（21日）在社交平台發文，分享她飛到美國紐約出席荷李活巨星湯告魯斯（Tom Cruise）新戲《職業特工隊：最終清算》活動的相和影片，她更在活動上與湯告魯斯合照及聊天。

Grace說︰「『告魯斯先生，有件事我想告訴你…』我叫 Grace，我飛行了16個小時從香港到紐約，帶著我自己的《不可能的任務》：有機會親自見到你，跟你握手，告訴這位不可思議的演員，你對我來說意味著什麼。我衷心感謝您進行所有這些宣傳巡演，讓我們有機會與您面對面見面。我等不及要看這部電影了！」

她表示仍然為能跟湯告魯斯見面感到驚嘆，並透露當日成為對方上台前最後一個有機會跟他合照的人。Grace最後透露丈夫鄭嘉穎為此十分妒忌，因為嘉穎需留在香港照顧幾個兒子。她說︰「我老公真的妒忌了。感謝您在我離開期間照顧孩子們！」"
Epic遊戲《要塞英雄》重返蘋果美App Store   ( 國際金融 ) ,2025-05-22 12:00,https://news.mingpao.com/pns/%e7%b6%93%e6%bf%9f/article/20250522/s00004/1747848314182/epic%e9%81%8a%e6%88%b2%e3%80%8a%e8%a6%81%e5%a1%9e%e8%8b%b1%e9%9b%84%e3%80%8b%e9%87%8d%e8%bf%94%e8%98%8b%e6%9e%9c%e7%be%8eapp-store,mingpao,finance,2025-05-22 04:30,"【明報專訊】Epic Games熱門遊戲《要塞英雄》（Fortnite）時隔近5年，周二終於恢復在蘋果美國App Store上架。美國加州地方法院法官Yvonne Gonzalez Rogers上月作出有利於Epic的裁決，禁止蘋果限制軟件開發商採用第三方支付渠道。Epic Games於5月9日向美國App Store提交《要塞英雄》重新上架的申請，但蘋果的審核流程遠超一般的24小時，Epic為此上周再次入稟法院，向蘋果提出法律挑戰。

法官本周一要求蘋果解釋為何《要塞英雄》 的上架申請尚未獲批。蘋果至周二批准了《要塞英雄》上架。蘋果正對法院命令提出上訴，希望可撤銷對App Store的支付形式修改。

2020年，Epic Games修改了《要塞英雄》的應用程式內購買機制，繞過App Store接收客戶付款，被App Store下架，雙方繼而展開漫長的訟戰。App Store收費已成為蘋果服務業務中，愈來愈重要的部分。包括廣告、保養、訂閱服務收費等的服務業務收入，在截至3月底的財季，為蘋果貢獻近270億美元收入。"
Grand YOHO兩房848萬沽 創近兩年新高 ,2025-05-22 12:00,https://news.mingpao.com/pns/%e7%b6%93%e6%bf%9f/article/20250522/s00004/1747848316960/grand-yoho%e5%85%a9%e6%88%bf848%e8%90%ac%e6%b2%bd-%e5%89%b5%e8%bf%91%e5%85%a9%e5%b9%b4%e6%96%b0%e9%ab%98,mingpao,finance,2025-05-22 04:30,"【明報專訊】拆息連番下跌，部分地區二手交投轉活，樓價亦有從低位反彈之勢，其中元朗本月暫錄約88宗二手成交，較上月同期增約19%，當中Grand YOHO一個兩房戶以848萬元售出，做價創屋苑兩房2023年7月後近兩年新高。

中原地產副區域營業經理王勤學表示，元朗睇樓量上升約兩成，其中Grand YOHO交投最多，錄得12宗成交，較上月全月3宗大增3倍，更為近4年來最旺的月份。王續稱，Grand YOHO 5座高層A室，實用534方呎，兩房間隔，可遠眺深圳一帶，以848萬元沽出，實呎15,880元，做價創屋苑兩房2023年7月後近兩年新高。

惟原業主2018年9月以1039萬元一手買入，持貨約5年，帳面仍蝕191萬元或18%，不過，由於發展商當年有為買家提供不同現金回贈，故實際蝕幅可能較小。

投資客631萬購KENNEDY 38連約戶

另市場亦吸引投資者入市。利嘉閣分區董事黃祥湧稱，堅尼地城KENNEDY 38低層N室，實用面積約300方呎，採1房兼開放式廚房設計，原以680萬元連租約放售，最終獲外區投資客以631萬元成交，實呎約21,033元，新買家即享約4厘租金回報。原業主2021年以約809萬元一手買入，帳面蝕約178萬元或22%，若連使費料實蝕約210多萬元或26%。利嘉閣地產高級營業董事謝國勳稱，荔枝角美孚新邨蘭秀道30號高層D室連車位，實用910方呎，3房1套間隔，獲首置客以1040萬元連車位承接，實呎11,429元。

原業主2019年約1476萬元連車位買入，持貨6年貶值436萬元或約三成，若連使費料實蝕約510多萬元或35%。"
工程界稱罕見 料無即時危險 議員促另查人為疏忽 嚴懲阻嚇 ,2025-05-22 12:00,https://news.mingpao.com/pns/%e8%a6%81%e8%81%9e/article/20250522/s00001/1747850774511/%e5%b7%a5%e7%a8%8b%e7%95%8c%e7%a8%b1%e7%bd%95%e8%a6%8b-%e6%96%99%e7%84%a1%e5%8d%b3%e6%99%82%e5%8d%b1%e9%9a%aa-%e8%ad%b0%e5%93%a1%e4%bf%83%e5%8f%a6%e6%9f%a5%e4%ba%ba%e7%82%ba%e7%96%8f%e5%bf%bd-%e5%9a%b4%e6%87%b2%e9%98%bb%e5%9a%87,mingpao,major,2025-05-22 04:45,"【明報專訊】安達臣道住宅項目鋼筋工程被揭「偷工減料」，有工程界代表認為今次事件實屬罕見，但相信有屋宇署把關，涉事樓宇結構不會有即時危險；有立法會議員建議，除了被捕者，政府及相關專業團體亦須跟進事件，嚴懲有疏忽的人員，強調處理是次事件時須具足夠阻嚇力，以免令業界誤以為不涉貪污便毋須負責。

香港工程師學會結構分部前主席陳世昌稱，涉事地盤工程不但未依圖則要求，亦有不少扣件出現缺失，但相信在屋宇署把關下，樓宇不會有即時危險，並可透過重新計算每個位置的安全系數，按缺失情况加固扣件。

至於缺少鋼筋數量少於10%，長遠會否有結構安全風險，陳世昌指出，除了要視乎鋼筋缺失情况，樓宇落成後，「可能某一時候使用時會超出（樓宇）荷載」，或引起安全風險；但他補充稱，住宅項目超出荷載的情况較寫字樓或商場少，因缺少鋼筋引致的結構安全風險亦較低。

註冊結構工程師倪學仁指出，不少發展商為控制樓宇品質，會自行為地盤提供鋼筋，加上政府已加強監察建築安全，承建商與分判商難藉偷工減料來謀取利潤，故今次事件實屬罕見。

本身是工程師的立法會議員張欣宇認為，除涉案懷疑貪污人員，亦需調查是否涉及人為疏忽，例如監督人員是否未有到地盤驗收，卻已簽名認可，冀政府及相關專業學會能嚴懲有關人等，藉此收阻嚇力，以免有業界人士誤以為不涉貪污便毋須負責。

香港建造商會昨日亦發稿譴責有關貪污行為，強調大多業界人士秉持誠信，少數害群之馬的貪污行徑嚴重破壞建造業聲譽。商會表示，經初步了解，雖然涉案分判商並非香港建造商會會員，商會對其行為無直接管轄權，但任何違法及違反行業道德的行為均應受到譴責。"
屋宇署抽查鋼筋配置加倍至25% ,2025-05-22 12:00,https://news.mingpao.com/pns/%e8%a6%81%e8%81%9e/article/20250522/s00001/1747850774371/%e5%b1%8b%e5%ae%87%e7%bd%b2%e6%8a%bd%e6%9f%a5%e9%8b%bc%e7%ad%8b%e9%85%8d%e7%bd%ae%e5%8a%a0%e5%80%8d%e8%87%b325,mingpao,major,2025-05-22 04:45,"【明報專訊】因應安達臣道興建中住宅項目被揭發全部6幢樓宇出現鋼筋配置嚴重偏離批准圖則事件，屋宇署總結構工程師高美儀昨日在記者會表示，會從今次個案檢討經驗，加倍抽樣檢查各地盤澆注混凝土前的鋼筋配置，由目前每年抽查最少12%項目增加至最少25%。至於已完成澆注混凝土的工程，亦會恒常每年抽查25%項目，並採用鋼筋面層測厚儀科技做抽樣檢查，進一步加強監管機制。

另外，今次涉事安達臣道住宅項目的總承建商，現同時是另外5個尚未竣工的私人發展項目的註冊一般建築承建商，當中3個為住宅項目、1個為商業用途、1個是商住用途項目。高美儀表示，因應安達臣道項目鋼筋問題，屋宇署過去一段時間亦主動加強對該5個私人發展項目的巡查，包括加倍突擊視察地盤次數，亦運用鋼筋面層測厚儀科技，以非破壞性的方式抽查已完成澆注混凝土結構構件，未有發現鋼筋數量和位置與批准圖則不符或明顯結構安全問題。

不過，高美儀稱，為確保樓宇安全，屋宇署會立即去信該5個發展項目的發展商，要求委任註冊結構工程師全面複查相關地盤鋼筋安裝的監督紀錄，在兩個月內向屋宇署提交複查報告及檢查鋼筋配置的檢測方案；當檢測方案獲屋宇署同意後，發展商須聘請獨立認可的實驗所做檢測，並提交獨立檢測報告。"
美減稅恐增財赤 美元資產受壓  美匯指數再失守100關  今年累跌逾8%   ( 國際金融 ) ,2025-05-22 12:00,https://news.mingpao.com/pns/%e7%b6%93%e6%bf%9f/article/20250522/s00004/1747848313938/%e7%be%8e%e6%b8%9b%e7%a8%85%e6%81%90%e5%a2%9e%e8%b2%a1%e8%b5%a4-%e7%be%8e%e5%85%83%e8%b3%87%e7%94%a2%e5%8f%97%e5%a3%93-%e7%be%8e%e5%8c%af%e6%8c%87%e6%95%b8%e5%86%8d%e5%a4%b1%e5%ae%88100%e9%97%9c-%e4%bb%8a%e5%b9%b4%e7%b4%af%e8%b7%8c%e9%80%be8,mingpao,finance,2025-05-22 04:30,"【明報專訊】美國總統特朗普的減稅法案取得重大進展。眾議院議長約翰遜（Mike Johnson）表示，共和黨人已就州和地方稅（SALT）抵扣上限提升至4萬美元達成協議，有望為減稅法案掃除障礙。市場恐美國預算赤字擴大，美元資產受壓。美匯指數昨失守100關口，見兩周低位。今年以來，美匯指數累計跌逾8%。日圓兌每美元升穿144；每百日圓兌港元升至5.4算。美國國債價格昨跌勢加劇，10年期國債孳息率再升穿4.5厘，30年期國債孳息率再突破5厘關口。

市場等待周四凌晨，美國拍賣20年期國債的反應，作為衡量長期美國債務需求的指標。受彭博系統昨天下午發生故障影響，交易員無法取得實時報價及市場數據，英國和歐盟昨天的債券拍賣競標時間延長。美股三大指數昨早段下滑。摩根士丹利策略師發表報告，建議買入「美元以外的美國資產」，理由是美國相對於其他主要國家的經濟增長溢價逐漸消退，令美元繼續轉弱。另一方面，比特幣觸及10.95萬美元，創歷史新高。

大摩報告指出，市場對聯儲局的減息預期不足，相信聯儲局放寬政策將為美股和美債帶來支持，將美國股票及國債評級，由「中性」上調至「增持」，預期到明年第二季，標普500指數將達到6500點，較周二收市的5940點，有近一成水位，而美國10年期國債孳息率將降至3.45厘，較目前的4.5厘以上高位下調超過1厘。

歐洲央行周三指出，金融市場可能正發生「根本性變化」，投資者似乎正重新評估美國資產的風險，以應對關稅政策的不確定性。該央行最新的《金融穩定評估》報告，討論了由美國關稅政策引發的全球貿易緊張局勢，導致近期市場波動加劇。該報告指出，市况動盪期間，歐元區金融市場運作保持良好，金融資產可迅速交易而價格不會過度波動，儘管出現了資金從美國國債和美元等傳統避險資產轉移的「非典型」現象。

歐洲央行稱，美國資產風險被重新評估，可能導致全球資本流動發生更廣泛轉變，對全球金融體系產生深遠影響。歐洲央行副行長Luis de Guindos警告，市場存在回調風險。

美國投行Brown Brothers Harriman（BBH）指出，美元跌勢，反映金融市場正對美國政策失去信心。滯脹風險升，加上特朗普隱晦地支持美元轉弱，為美元帶來壓力。韓國財政部稱，與美國正進行外匯談判，未作出任何決定。在七國集團（G7）財長會議舉行之際，市場尋找特朗普政府是否有意讓美元轉弱迹象，令美元跌勢持續。

美元回落，有利以美元計價大宗商品。加上中東緊張形勢加劇，刺激資金流入金市避險。美國有線電視新聞網（CNN）援引美國知情官員的消息稱，以色列準備襲擊伊朗核設施，推動金價昨升穿每盎司3300美元水平，是接近兩周高位。市場憂慮伊朗原油供應受阻，國際油價昨晚升逾1%，布蘭特期油升穿每桶66美元水平。

自穆迪上周五下調美國信評以來，市場情緒一直脆弱。分析師估計，倘特朗普的減稅法案獲通過，將令美國聯邦政府目前的36萬億美元債務，再增3萬億至5萬億美元。新加坡銀行外匯策略師Moh Siong Sim指出，市場對美國財政的擔憂加劇，導致美國長期國債孳息率上升。此外，日本債市繼續受壓，30年期和40年期國債孳息率維持歷史高位。"
美加澳日香港內地申多項專利   ( 新經濟新天地 ) ,2025-05-22 12:00,https://news.mingpao.com/pns/%e7%b6%93%e6%bf%9f/article/20250522/s00004/1747848313748/%e7%be%8e%e5%8a%a0%e6%be%b3%e6%97%a5%e9%a6%99%e6%b8%af%e5%85%a7%e5%9c%b0%e7%94%b3%e5%a4%9a%e9%a0%85%e5%b0%88%e5%88%a9,mingpao,finance,2025-05-22 04:30,"【明報專訊】寰科創新有限公司（Ecoinno）共同創辦人兼行政總裁陳大仁透露，寰科創新有很多關鍵技術都來自其中一名創辦人Alexander Bismarck。原來後者乃奧地利維也納大學的化學系教授，也是英國倫敦帝國學院化學工程系的客座教授，乃研究纖維素和聚合物的國際有名專家。該公司已在美國、加拿大、澳洲、日本、香港和中國大陸成功申請多項專利。有關專利技術涵蓋物料、生產設備、工藝佈局和模具，全部都是該公司自主設計和研發，大大提高了競爭對手抄襲的難度。而該公司特別在日本成立分公司，負責產品設計工作，也頗有成效。在今年的德國紅點設計大獎中，該公司就有3款產品獲得金獎。

該公司除了獲得阿里巴巴台灣及香港創業者基金投資之外，其他機構性投資者還包括醫藥集團和某些家族辦公室。

現時，該公司的產品已出口到歐洲、日本、台灣等多個國家和地區。該公司還會在今年內，在東南亞推出無塑的茶紙囊。沙特阿拉伯和阿聯酋等中東國家未來也會逐步開拓。另外，該公司將會推出全球加盟計劃，授權各地的合作公司使用其專利技術和生產設備，以及附近的農業廢品，來就地生產植物纖維素餐具和容器。"
百度首季少賺8% 勝預期  李彥宏：AI收入三位數增 ,2025-05-22 12:00,https://news.mingpao.com/pns/%e7%b6%93%e6%bf%9f/article/20250522/s00004/1747848311997/%e7%99%be%e5%ba%a6%e9%a6%96%e5%ad%a3%e5%b0%91%e8%b3%ba8-%e5%8b%9d%e9%a0%90%e6%9c%9f-%e6%9d%8e%e5%bd%a5%e5%ae%8f-ai%e6%94%b6%e5%85%a5%e4%b8%89%e4%bd%8d%e6%95%b8%e5%a2%9e,mingpao,finance,2025-05-22 04:30,"【明報專訊】百度（9888）今年首季收入324.52億元（人民幣，下同），按年升3%。經調整純利64.69億元，按年跌8%。兩項關鍵財務數據均勝預期。百度聯合創始人兼首席執行官李彥宏認為，智能雲收入按年大增42%推升公司收入，同時相關分部經營利潤持續為正，經營利潤率則已逾10%，同時AI相關收入呈現三位數按年增長。

港股百度績前收跌1.9%，美股（美：BIDU）早段則升1%。

期內，百度核心收入255億元，按年增長7%。其中在線營銷收入160億元，減少6%；非在線營銷收入94億元，增長40%，主要由智能雲業務帶動。此外愛奇藝收入72億元，按年減少9% 。

李彥宏表示，雲業務表現強勁，並透露公司已在研究下一代模型，會持續加快模型迭代，且隨着技術升級，公司旗下模型的推理成本料可持續下降。

至於AI與百度本業即搜索業務結合及貨幣化層面，李彥宏透露，在4月份，百度約35%移動端搜索結果頁面包含AI生成內容，1月時則為22%，預計今年第二季相關比例將持續向上。他稱百度正進一步提升搜索體驗，優先展示多模態內容，包括圖片、影片、數字人和直播等。

至於百度旗下自動駕駛業務蘿蔔快跑，今年首季提供的自動駕駛訂單超過140萬單，按年增75%。截至今年5月，蘿蔔快跑累計為公眾提供的自動駕駛出行服務訂單超過1100萬單。李彥宏稱，蘿蔔快跑目前已覆蓋全球15座城市，部署逾1000輛無人車。

被問及蘿蔔快跑盈利時間表時，李彥宏指已看到清晰盈利道路，原因是相關成本持續下降，且相關業務運營規模持續擴大、效率提高。

百度今年首季資本開支按年大升42%至28.69億元，被問及相關開支用途時，該公司首席財務官何俊傑指出，公司將着力投資AI及雲基建、自動駕駛及AI搜索貨幣化等。他坦言AI搜索貨幣化仍處初期階段，短期內對公司利潤會構成一定壓力，但相信是百度實現長期增長的必要步驟。

百度自今年首季起已回購4.45億美元股份，何俊傑預期今年整體公司回購將維持與今年首季相近力度。百度2023年股份回購計劃項下的累計回購金額則達21億美元。"
百分百擔保貸款  壞帳率升至15.6% ,2025-05-22 12:00,https://news.mingpao.com/pns/%e7%b6%93%e6%bf%9f/article/20250522/s00004/1747848313040/%e7%99%be%e5%88%86%e7%99%be%e6%93%94%e4%bf%9d%e8%b2%b8%e6%ac%be-%e5%a3%9e%e5%b8%b3%e7%8e%87%e5%8d%87%e8%87%b315-6,mingpao,finance,2025-05-22 04:30,"【明報專訊】政府於2020年推出「百分百擔保貸款」，為受新冠疫情影響企業紓困。商務及經濟發展局長丘應樺昨書面回覆立法會議員查詢表示，截至4月底，百分百擔保貸款累計壞帳率15.6%，高於金管局早前披露截至4月中時的14.8%，亦較2月初披露的13.5%進一步上升，不過仍較推出時的假設整體壞帳率25%為低。

一旦貸款拖欠90天以上，並已進入或完成違約索賠程序，相關貸款便會被視為壞帳，「中小企融資擔保計劃」另外兩項產品，八成擔保貸款的累計壞帳率為5.2%，九成擔保貸款為4.2%，亦低於假設整體壞帳率12%和16%。

百分百擔保貸款已於去年3月底停止接受申請，累計批出超過6.71萬宗，涉及金額約1437億元。丘應樺稱，貸款機構正就約5400宗壞帳個案採取追討行動，另有3500宗已經或正在採取法律行動，上述合計8900宗個案當中，逾三成在採取行動後收到全部或部分欠款。丘又稱截至4月底有3159宗申請疑涉及不法行為，包括使用虛假文書、提供虛假或失實聲明等，涉貸款約105億元。他續稱有1512宗個案或約50億元貸款申請，在審查時被拒，2007宗個案或約55億元貸款在提取後才被發現，按證公司或貸款機構已採取適當行動，包括向執法機構舉報及提供相關資料。

丘應樺表示政府於上個財年（24/25）執行計劃的預算為125億元，包括壞帳償付、向貸款機構和按證公司支付的費用等。當局會繼續密切監察情况，適時調節每年預算。"
瑞銀：今年新股平均回報18％ 跑贏恒指   ( 新股 ) ,2025-05-22 12:00,https://news.mingpao.com/pns/%e7%b6%93%e6%bf%9f/article/20250522/s00004/1747848311811/%e7%91%9e%e9%8a%80-%e4%bb%8a%e5%b9%b4%e6%96%b0%e8%82%a1%e5%b9%b3%e5%9d%87%e5%9b%9e%e5%a0%b118-%e8%b7%91%e8%b4%8f%e6%81%92%e6%8c%87,mingpao,finance,2025-05-22 04:30,"【明報專訊】今年香港IPO市場氣氛轉佳，瑞銀投資銀行中國股票策略研究主管王宗豪表示，年初至今的新股募資總額按年增長320%至90億美元（約702億港元），IPO平均回報率達到18%，跑贏恒指的13%回報率，亦高於前幾年IPO上市後3個月平均回報率4%，反映上市公司質素提升，內地IPO限制收緊，香港市場流動性改善及海外投資者對中國核心資產的偏好提升。

王宗豪指出，隨着藍籌A股公司湧入和中概股回歸，香港股票的多元化程度亦有所提高。雖然今年港股IPO融資總額仍低於2020年的峰值，但南向資金累計流入達530億美元，H股迄今盈利表現穩健，且AI相關股票佔比較高，相較於A股，瑞銀繼續看好H股表現。

A股與H股溢價方面，王宗豪表示，AH股溢價目前為33%，約為10年平均水平，但低於近5年平均水平。他預期AH股溢價短期內將有收窄空間，主要由於關稅下調後地緣政治緊張局勢有所緩和、Deepseek模型若反覆運算出新或將重新激發對AI的樂觀情緒，以及中國AI股票相對於美國同業的估值折價增加。由於A股僅佔MSCI中國指數的13%，香港股票將更能受益於流動性改善及外資流入。王宗豪續稱，雖然總體AH溢價將保持不變，不過若個別股票被視為海外投資者優質核心持股，以及香港的流動性高於A股，將出現A股較H股折價。此外，在港上市的藍籌A股或進一步受益於被動資金流入。"
湯文亮：銀行call loan損互信   ( 湯文亮 茶餐廳手記 ) ,2025-05-22 12:00,https://news.mingpao.com/pns/%e7%b6%93%e6%bf%9f/article/20250522/s00004/1747848315925/%e6%b9%af%e6%96%87%e4%ba%ae-%e9%8a%80%e8%a1%8ccall-loan%e6%90%8d%e4%ba%92%e4%bf%a1,mingpao,finance,2025-05-22 04:30,【明報專訊】星期三早上去到茶餐廳，有客人話近幾個月畀銀行call loan call到失魂，在賣走幾個物業與同業拆息大幅下調之後，希望銀行call loan可以告一段落，大家回復正軌去做生意，否則失業率會繼續上升，非香港之福。
