title,date,url,source,section,scrape_time,news_content
資金避險情緒升温  金價創新高直撲3900美元,2025-10-01 16:05,https://finance.mingpao.com/fin/instantf/20251001/1759306279171/%e8%b3%87%e9%87%91%e9%81%bf%e9%9a%aa%e6%83%85%e7%b7%92%e5%8d%87%e6%b8%a9-%e9%87%91%e5%83%b9%e5%89%b5%e6%96%b0%e9%ab%98%e7%9b%b4%e6%92%b23900%e7%be%8e%e5%85%83,mingpao,經濟,2025-10-01 16:15,"美國政府停擺，國際投資者暫避美元資產，資金避險情緒升温，部份避險資金流向黃金，國際金價歐洲市早段直迫3900美元，再創紀錄新高。

本港時間約下午4時，現貨金價升破3880元水平，再創紀錄新高。"
國慶優惠賣半價戲票　多區戲院旺場,2025-10-01 15:58,https://news.mingpao.com/ins/%e6%b8%af%e8%81%9e/article/20251001/s00001/1759305156658/%e5%9c%8b%e6%85%b6%e5%84%aa%e6%83%a0%e8%b3%a3%e5%8d%8a%e5%83%b9%e6%88%b2%e7%a5%a8-%e5%a4%9a%e5%8d%80%e6%88%b2%e9%99%a2%e6%97%ba%e5%a0%b4,mingpao,港聞,2025-10-01 16:00,"內地國慶黃金周假日今（1日）開始，本港戲院、食肆亦推出國慶優惠。本報記者前往油尖旺區觀察，當區戲院幾近滿座，有市民趁優惠一個下午看兩套戲，戲院職員表示較平日多賣五成票。至於食肆七折優惠，有市民及遊客表示並不知道有關優惠存在。

為慶祝國慶76周年，全港超過3000食肆及不同商場推出餐飲及消費折扣優惠，戲院亦推出半價戲飛。本報記者於午間12時半及1時許，到旺角朗豪坊GALA CINEMA及油麻地百老匯電影中心觀察，發現當日票部分已售罄，餘下場次最多只剩前兩排位置。於朗豪坊GALA Cinema購票的施小姐表示，她平日每個禮拜都看戲，但今日特為半價優惠前來買票，笑稱旺角附近戲院很多戲票都售罄，相當「旺場」。

單先生和賴小姐今日前往油麻地百老匯電影中心看戲，平日他們每個月看一場戲，今次趁半價優惠一日看兩場。單先生表示，並非只因半價而看戲，而是剛巧有心儀電影上映，加上有足夠優惠，因此連看兩場。同樣於電影中心看戲的梁女士一家向本報表示，她們平日較少看戲，約半年看一場，今次是因為碰巧有假期，並非因半價優惠而到場。梁女士又稱，本身並不知道食肆有七折優惠，適逢假日，無論是否有優惠都會光顧食肆。"
Belgravia Place首宗二手 兩房戶1年半升值9%,2025-10-01 15:58,https://finance.mingpao.com/fin/instantp/20251001/1759305774588/belgravia-place%e9%a6%96%e5%ae%97%e4%ba%8c%e6%89%8b-%e5%85%a9%e6%88%bf%e6%88%b61%e5%b9%b4%e5%8d%8a%e5%8d%87%e5%80%bc9,mingpao,地產,2025-10-01 16:15,"多個入伙盤，繼續錄得短炒獲利個案。中原地產分行經理吳家俊表示，現正陸續入伙的長沙灣巴域街Belgravia Place，新錄屋苑首宗二手成個文；單位為實用面積335方呎的第1A座高層20室，屬兩房間隔，原業主叫價620萬元放售，議價後減5萬元或近1%，最終以615萬易手、實呎18358元；原業主於2024年3月一手購入，當時作價565萬元，持貨約年半沽出，現帳面獲利50萬元，賺幅約9%。

"
8歲女童涉推嬰兒落地　警拘施虐者母親,2025-10-01 15:53,https://news.mingpao.com/ins/%e6%b8%af%e8%81%9e/article/20251001/s00001/1759303589128/8%e6%ad%b2%e5%a5%b3%e7%ab%a5%e6%b6%89%e6%8e%a8%e5%ac%b0%e5%85%92%e8%90%bd%e5%9c%b0-%e8%ad%a6%e6%8b%98%e6%96%bd%e8%99%90%e8%80%85%e6%af%8d%e8%a6%aa,mingpao,local,2025-10-01 16:00,"警方昨日（9月30日）接獲紅磡紅樂道9號過渡性房屋「善匯」職員報案，指發現一名女嬰及一名男童懷疑曾被一名印度裔女童不恰當對待。警員在上址以涉嫌「對所看管兒童或少年人虐待或忽略」拘捕涉案8歲女童的37歲母親，她已獲准保釋候查。

涉事11個月大女嬰頭及腳受傷，清醒由其母自行帶往屯門醫院求醫，另2歲男童則沒有受傷。案件交由九龍城警區刑事調查隊跟進。

網上流傳片段所見，女嬰兒坐在過渡性房屋範圍內的長櫈，另一小童坐在嬰兒車，一名非華裔女童在女嬰旁邊，女嬰不斷哭喊，女童曾抱起嬰兒嘗試「氹」她，其後女童多次將女嬰從長椅上推落地，女嬰墮地後，女童又拉起她再放手扔落地。

據住戶陳小姐稱，涉案女童時常單獨走到樓下玩，女嬰住在同層單位。"
中指院：內地百城二手樓價按年跌近7.4%  新樓價升2.7%,2025-10-01 15:46,https://finance.mingpao.com/fin/instantf/20251001/1759305444390/%e4%b8%ad%e6%8c%87%e9%99%a2-%e5%85%a7%e5%9c%b0%e7%99%be%e5%9f%8e%e4%ba%8c%e6%89%8b%e6%a8%93%e5%83%b9%e6%8c%89%e5%b9%b4%e8%b7%8c%e8%bf%917-4-%e6%96%b0%e6%a8%93%e5%83%b9%e5%8d%872-7,mingpao,經濟,2025-10-01 16:00,"內地房地產研究機構中指研究院報告指，百城二手住宅均價9月按月跌0.74%，已是連續第41個月報跌，跌至每平方米13381元人民幣，按年亦跌7.38%。

第3季二手樓價則下跌2.26%，跌幅比第2季擴大0.14個百分點，首3季累跌5.79%。

新樓價格方面，踏入傳統銷售旺季，部分核心城市加大推盤力度，帶動9月百城新建住宅平均價格升至每平方米16926元，按月續微升0.09%，惟升幅較8月收窄0.11個百分點；按年則上升2.68%。

第三季新樓價格升0.47%，升幅比第2季收窄0.17個百分點，首3季累升1.63%。

中指研究院表示，為實現全年經濟增長5%左右的目標，預料宏觀政策有望於第四季加力，短期房地產政策繼續以止跌回穩為目標，增量政策亦有一定預期，觀望10月召開的二十屆四中全會。"
巨塔之后｜與蕭正楠角色僅1集離世 馬國明回應,2025-10-01 15:43,https://ol.mingpao.com/ldy/showbiz/latest/20251001/1759303799269/%e5%b7%a8%e5%a1%94%e4%b9%8b%e5%90%8e-%e8%88%87%e8%95%ad%e6%ad%a3%e6%a5%a0%e8%a7%92%e8%89%b2%e5%83%851%e9%9b%86%e9%9b%a2%e4%b8%96-%e9%a6%ac%e5%9c%8b%e6%98%8e%e5%9b%9e%e6%87%89,mingpao,娛樂,2025-10-01 16:00,"宣萱、劉佩玥、鍾鎮濤、湯鎮業、馬國明、蕭正楠、吳若希、張頴康、蔣家旻等，合演的無綫劇《巨塔之后》昨晚（30日）播出第2集，劇情一開始即揭示震撼轉折，王家男主人、大兒子及二兒子（鍾鎮濤、馬國明、蕭正楠飾）與長孫遭遇空難，釀成三死一重傷。王家大嫂陳麗雪（吳若希飾）、二嫂文以珈（劉佩玥飾）及以珈女兒王海淳（樂珈嘉飾）於滂沱大雨中等待救援，吳若希與劉佩玥情緒崩潰的哭戲展現強烈感染力。

劇情描寫救援隊發現首具遺體時，吳若希神情徬徨，望向劉佩玥並輕搖頭，流露無助。劉佩玥的角色較為堅毅，最終鼓起勇氣檢視遺體，鏡頭聚焦她顫抖的手拉開屍袋拉鏈，盡顯遲疑與痛楚。當她確認遺體是兒子後，情緒瞬間崩潰，哭至五官扭曲，跌坐地上。救援隊宣布現場有生還者時，剛失去兒子的劉佩玥流露痛中帶慰的複雜情緒，吳若希則滿眼希望。得悉生還者為老爺王進濤（鍾鎮濤飾）後，劉佩玥強忍悲痛，安排女兒陪同入院，直至女兒登上救護車才顯露擔憂。兩位新抱繼續冒雨等候，當救援隊再度抬出遺體，吳若希憑婚戒認出亡夫王啟智（馬國明飾），瞬間崩潰，跪地痛哭。吳若希說︰「多謝大雨令到我哋個氣氛更加慘、更加容易投入到，個環境幫助到呢場喊戲更加容易，因為真實感好強。」

蕭正楠及馬國明的角色僅一集便離世，令不少觀眾難以置信。馬國明表示：「我後尾會唔會出番嚟？大家就要繼續留意《巨塔之后》喇！自己作為演員，唔會介意戲分多少，只要公司認為我適合，而又覺得演呢個角色可以帶到某啲感覺畀觀眾，自己就會去做。」"
客貨車北角剷上行人路撞工廈保安,2025-10-01 15:41,https://news.mingpao.com/ins/%e6%b8%af%e8%81%9e/article/20251001/s00001/1759305239461/%e5%ae%a2%e8%b2%a8%e8%bb%8a%e5%8c%97%e8%a7%92%e5%89%b7%e4%b8%8a%e8%a1%8c%e4%ba%ba%e8%b7%af%e6%92%9e%e5%b7%a5%e5%bb%88%e4%bf%9d%e5%ae%89,mingpao,local,2025-10-01 16:15,下午1時許，一輛客貨車駛至北角英皇道499號北角工業大廈對開，懷疑失控衝上行人路巴士站，撼向大廈外牆，撞向一名男保安員，客貨車一度冒煙，男司機受傷。保安員受輕傷，在場治理後拒絕送院，男司機則由救護車送往東區醫院。客貨車左車頭損毁嚴重，泵把飛脫。
妮歌潔曼入稟申請離婚 要求兩女兒306日撫養權,2025-10-01 15:36,https://ol.mingpao.com/ldy/showbiz/latest/20251001/1759304173345/%e5%a6%ae%e6%ad%8c%e6%bd%94%e6%9b%bc%e5%85%a5%e7%a8%9f%e7%94%b3%e8%ab%8b%e9%9b%a2%e5%a9%9a-%e8%a6%81%e6%b1%82%e5%85%a9%e5%a5%b3%e5%85%92306%e6%97%a5%e6%92%ab%e9%a4%8a%e6%ac%8a,mingpao,娛樂,2025-10-01 16:00,昨日英美傳媒鋪天蓋地報道金像影后妮歌潔曼（Nicole Kidman）婚姻觸礁，指與她結婚19年的鄉謠歌手Keith Urban今年初夏已搬離兩人在田納西州納什維爾的大宅，另置業居住；今日報道指妮歌潔曼已正式入稟田納西州納什維爾法院申請離婚，從英國《每日郵報》取得的法庭文件顯示，妮歌要求成為兩名女兒：17歲Sunday Rose和14歲Faith Margaret的首要監護人，她與Keith同意共同撫養權計劃，當中妮歌一年裏可有306日跟女兒同住的撫養權，Keith則享有59天，報道指這安排並不尋常，文件顯示兩女兒在每周六及周日從上午10時至下午6時可跟Keith一起，其餘時間則由妮歌照顧。
大手客1.56億購凱玥兩伙4房 呎價逾3萬,2025-10-01 15:35,https://finance.mingpao.com/fin/instantp/20251001/1759304831189/%e5%a4%a7%e6%89%8b%e5%ae%a21-56%e5%84%84%e8%b3%bc%e5%87%b1%e7%8e%a5%e5%85%a9%e4%bc%994%e6%88%bf-%e5%91%8e%e5%83%b9%e9%80%be3%e8%90%ac,mingpao,地產,2025-10-01 16:00,"市區一手豪宅新盤買賣持續活躍，內房合景泰富（1813）與龍光（3380）合作、已屆現樓的鴨脷洲凱玥，今日連錄3宗成交，共涉逾2.2億元，其中第2座21樓A、B室，據悉由同一組買家購入，作價約1.56億元，當中A室實用面積2236方呎，4房4套間隔，連車位以7093.9萬元售出、實呎31726元，而同屬4房4套的B單位，實用面積2604方呎，連車位以8493.9萬元售出，實呎32619元，買家同樣選用30天付款。

此外，同座實用面積2236方呎的19樓A室，不連車位以約6581.67萬元售出、實呎29435元，買家選用60天付款期。

"
美國政府陷停擺  股匯債齊受壓,2025-10-01 15:20,https://finance.mingpao.com/fin/instantf/20251001/1759303474686/%e7%be%8e%e5%9c%8b%e6%94%bf%e5%ba%9c%e9%99%b7%e5%81%9c%e6%93%ba-%e8%82%a1%e5%8c%af%e5%82%b5%e9%bd%8a%e5%8f%97%e5%a3%93,mingpao,經濟,2025-10-01 16:00,"美國政府於本港時間今日中午正式停擺，國際投資者對美元資產轉趨審慎，美匯及美股三大指數期貨及美債，在亞洲時段午後全線受壓。

本港時間約下午3時，美匯指數約跌0.3%，低見97.48。美股三大指數期貨同向下，納指期指最多跌約1%。

各年期美國債券全線價跌息升，10年期美債息曾升逾100點子（1萬點子等於1厘），高見4.1658厘。"
內地專才2萬租藝里坊．1號一房 呎租77元,2025-10-01 15:20,https://finance.mingpao.com/fin/instantp/20251001/1759303535863/%e5%85%a7%e5%9c%b0%e5%b0%88%e6%89%8d2%e8%90%ac%e7%a7%9f%e8%97%9d%e9%87%8c%e5%9d%8a-1%e8%99%9f%e4%b8%80%e6%88%bf-%e5%91%8e%e7%a7%9f77%e5%85%83,mingpao,地產,2025-10-01 16:00,"市區私宅租務仍然活躍，中原高級資深分區營業經理盧宏基表示，內地專才繼續成為私宅租賃市場的重要客源，其中西營盤藝里坊．1號一伙中層D室，實用面積259方呎1房間隔，最新以2萬元租出、實用呎租高逾77元；業主於2018年以792萬元一手購入單位，持貨7年，享逾3厘租金回報。

"
緹外頂層相連戶5.8億售 實呎逾6.8萬,2025-10-01 15:16,https://finance.mingpao.com/fin/instantp/20251001/1759303132392/%e7%b7%b9%e5%a4%96%e9%a0%82%e5%b1%a4%e7%9b%b8%e9%80%a3%e6%88%b65-8%e5%84%84%e5%94%ae-%e5%af%a6%e5%91%8e%e9%80%be6-8%e8%90%ac,mingpao,地產,2025-10-01 16:00,"剛踏入第四季，新盤市場即錄得超級豪宅成交；嘉里（0683）旗下、已屬現樓的九龍半山龍駒道緹外，今日國慶日假期，透過招標售出第5座7樓頂層特色全層相連大戶，實用面積8444方呎、5房5套房連4間工人房間隔、並附設5550方呎天台及1265方呎前庭，連全屋裝修家俬，連兩個車位成交價5.8億元、折合實呎68,688元。

就成交紀錄冊所見，買家需於今年12月中前完成交易，並享發展商提供的提早佔用優惠，以及樓價4.25%印花稅津貼優惠。另外，項目頂層特色全層相連大宅已悉數售出，樓盤迄今累售40伙，佔全盤64伙逾六成，總成交金額逾128億元，平均成交實呎約6萬元。

"
文旅部、中國氣象局：假期氣象總體適宜旅遊　華北、東北地區達「舒適」等級,2025-10-01 15:14,https://news.mingpao.com/ins/%e5%85%a9%e5%b2%b8/article/20251001/s00004/1759301899227/%e6%96%87%e6%97%85%e9%83%a8-%e4%b8%ad%e5%9c%8b%e6%b0%a3%e8%b1%a1%e5%b1%80-%e5%81%87%e6%9c%9f%e6%b0%a3%e8%b1%a1%e7%b8%bd%e9%ab%94%e9%81%a9%e5%ae%9c%e6%97%85%e9%81%8a-%e8%8f%af%e5%8c%97-%e6%9d%b1%e5%8c%97%e5%9c%b0%e5%8d%80%e9%81%94%e3%80%8c%e8%88%92%e9%81%a9%e3%80%8d%e7%ad%89%e7%b4%9a,mingpao,兩岸,2025-10-01 15:15,"國慶及中秋節假期來臨，文化和旅遊部與中國氣象局聯合發布假期旅遊氣象提示，預計假日期間全國大部氣溫偏高，總體適宜旅遊出行。其中，華北、東北大部地區多數時間氣候舒適度達「舒適」或「最舒適」等級。

提示指出，假期中前期華南大部、雲南中北部、貴州等地，可正常規劃旅遊出行，但需注意防暑降溫；西北大部地區多數時段無強降水干擾，天氣狀況較穩定。

10月1日至6日，華西及黃淮地區多降雨，四川東北部、重慶北部、陜西中南部、湖北西部、河南中南部、山東南部、蘇皖中北部等地有大雨或暴雨，局部地區有大暴雨，發生山洪和地質災害的氣象風險較高，對旅遊出行影響較大，建議遊客盡量避免前往氣象風險較高的濱水、山地等旅遊景區。

5日至6日，南海北部、瓊州海峽、北部灣及華南南部、雲南南部有明顯風雨天氣，局地發生中小河流洪水、山洪和地質災害、城市暴雨積澇的氣象風險較高，對旅遊出行、戶外活動及船隻航行可能造成不利影響。（新華社）"
20校今年沒參與流感疫苗學校外展接種　英基、女拔今年改參與　培生學校連續兩年沒參加,2025-10-01 15:08,https://news.mingpao.com/ins/%e6%b8%af%e8%81%9e/article/20251001/s00001/1759305682756/20%e6%a0%a1%e4%bb%8a%e5%b9%b4%e6%b2%92%e5%8f%83%e8%88%87%e6%b5%81%e6%84%9f%e7%96%ab%e8%8b%97%e5%ad%b8%e6%a0%a1%e5%a4%96%e5%b1%95%e6%8e%a5%e7%a8%ae-%e8%8b%b1%e5%9f%ba-%e5%a5%b3%e6%8b%94%e4%bb%8a%e5%b9%b4%e6%94%b9%e5%8f%83%e8%88%87-%e5%9f%b9%e7%94%9f%e5%ad%b8%e6%a0%a1%e9%80%a3%e7%ba%8c%e5%85%a9%e5%b9%b4%e6%b2%92%e5%8f%83%e5%8a%a0,mingpao,local,2025-10-01 16:15,"衛生防護中心今年改以「選擇退出」機制向學校發出季節性流感疫苗學校外展計劃邀請，未參與計劃的學校由上季度168間、減至今年20間，英基幼稚園多間分校、陳瑞祺（喇沙）小學、以及拔萃女書院均改參與。不過小蜜蜂幼稚園、培生學校等續拒參與。

衛生防護中心上季度季節性流感疫苗學校外展計劃中，一度公布「拒絕安排」流感疫苗到校學校名單，一度引起學界爭議，後來調整名單的字眼為「沒有安排接種」學校名單，相關措施於今年延續。今年新增「選擇退出」機制，不參與的學校要交代原因，

於昨日（30日）公布的名單中，幼稚園及幼兒中心方面，未有接種的學校由100間、減少至今年18間。其中香港保護兒童會兩間轄下的幼稚園、小蜜蜂幼稚園等續拒參與，不過多間較大規模辦學機構的幼稚園，包括英基、維多利亞、朗思等分校均改為參與。

上個季度被列入名單傳統中小學名校，例如陳瑞祺（喇沙）小學、九龍塘學校、拔萃女書院、香港中國婦女會中學、以及聖保羅男女中學等，均未有列入名單中。至於今年中學及小學名單中，只有培生學校未安排流感疫苗接種。該校截至今年1月10日的上個季度名單當中，仍未安排上個季度流感疫苗接種計劃予學生。

另外，今個年度衛生防護中心亦增設「季節性流感疫苗學校外展嘉許計劃」，旨在表揚致力鼓勵學生接種季節性流感疫苗及學生接種率高的學校及幼兒中心。全港590間小學當中388間獲「嘉許」，可以獲發嘉許狀。幼稚園則有366間及50間獲「嘉許」。"
谷祖琳兒時參加亞視歌唱比賽 奪冠片段曝光,2025-10-01 15:02,https://ol.mingpao.com/ldy/showbiz/latest/20251001/1759300613732/%e8%b0%b7%e7%a5%96%e7%90%b3%e5%85%92%e6%99%82%e5%8f%83%e5%8a%a0%e4%ba%9e%e8%a6%96%e6%ad%8c%e5%94%b1%e6%af%94%e8%b3%bd-%e5%a5%aa%e5%86%a0%e7%89%87%e6%ae%b5%e6%9b%9d%e5%85%89,mingpao,娛樂,2025-10-01 15:15,"谷祖琳去年憑電影《爸爸》獲得香港電影金像獎最佳女配角，入行27年的她既是演員，亦曾簽約唱片公司，出過個人專輯。原來，谷祖琳早在7、8歲時已有表演慾，曾參加電視台的兒童歌唱比賽，並贏得冠軍。谷祖琳日前（9月29日）在社交網分享當年參賽時的電視片段，她說︰「朋友突然傳來這段片段，睇真啲原來係兒時嘅我，大概7、8 歲左右吧，我仲記得當日我自己一個人睇緊電視，兒童節話接受唱歌比賽報名，嗰個年代有兩套卡通片好Hit，一套係橙路，另一套係Touch，嗰陣時純粹試吓打電話報名，點知電視台真叫我面試。比賽嗰件戰衣係我自己襯㗎，Ralph Lauren仲企晒領添，結果我贏了冠軍！成件事我都冇話到俾屋企聽，我記得屋企人好似喺電視睇到先知道我參加咗呢個比賽。原來我由細到大都咁無厘頭。片中嘅我同我個細女係一模一樣樣，不過我細女係我嘅可愛版。」

導演谷德昭是谷祖琳的叔叔，他亦在社交網談及這件事︰「聽過這件事接近半個世紀，今天終於看到畫面。當時我在加拿大讀書，有一天收到家姐的來信，說我親愛的姪女谷祖琳，當時大約七、八歲，自己幫自己用電話報名，參加了亞洲電視的兒童歌唱比賽，比賽完了家人才知道，仲要攞咗個冠軍，當年的參賽歌曲是卡通片《橙路》的主題曲。原來當時已經幾靚女，套衫自己仲襯得幾靚添，好似恤埋個髮，唱得又幾好。純天分，冇學過，原來注定食幕前飯。另一個感觸是，原來我在加拿大那八年，Miss了谷祖琳的大部分童年。當年兩叔姪冇好好哋做朋友，希望今天有緣分補番數。好彩同佢嘅女兒我嘅姪孫都幾好傾，在她們身上學到好多嘢。I am dear Suk Kung﹗」

在 Instagram 查看這則貼文            谷祖琳 Jo Koo（@jo_koo）分享的貼文

谷祖琳 Jo Koo（@jo_koo）分享的貼文

"
國慶｜「天問二號」新影像：五星旗與地球同框,2025-10-01 15:00,https://news.mingpao.com/ins/%e5%85%a9%e5%b2%b8/article/20251001/s00004/1759300972283/%e5%9c%8b%e6%85%b6-%e3%80%8c%e5%a4%a9%e5%95%8f%e4%ba%8c%e8%99%9f%e3%80%8d%e6%96%b0%e5%bd%b1%e5%83%8f-%e4%ba%94%e6%98%9f%e6%97%97%e8%88%87%e5%9c%b0%e7%90%83%e5%90%8c%e6%a1%86,mingpao,兩岸,2025-10-01 15:15,"國家航天局今日（10月1日）發布行星探測工程「天問二號」任務探測器在軌飛行期間獲取的探測器與地球合影圖像，同時「神舟二十號」乘組在中國空間站發送祝福賀國慶［央視新聞片段］。

天問二號探測器已在軌飛行125天，其間開展了採樣裝置展開、電子設備自檢等在軌測試，各項狀態正常；空間環境載荷開機探測，獲取有效科學數據。當前，探測器與地球距離約4300萬公里，與小行星2016HO3距離約4500萬公里，在軌飛行正常。

此次發布的天問二號與地球合影圖像，由安裝在探測器機械臂上的監視相機拍攝，鮮艷的五星紅旗、白色的返回艙和遠處藍色的地球構成一幅美妙畫面。（中新社/央視新聞）"
印尼東爪哇寄宿學校倒塌　至少91人仍被困瓦礫,2025-10-01 14:49,https://news.mingpao.com/ins/%e5%9c%8b%e9%9a%9b/article/20251001/s00005/1759301334253/%e5%8d%b0%e5%b0%bc%e6%9d%b1%e7%88%aa%e5%93%87%e5%af%84%e5%ae%bf%e5%ad%b8%e6%a0%a1%e5%80%92%e5%a1%8c-%e8%87%b3%e5%b0%9191%e4%ba%ba%e4%bb%8d%e8%a2%ab%e5%9b%b0%e7%93%a6%e7%a4%ab,mingpao,國際,2025-10-01 15:00,"印尼東爪哇一間伊斯蘭寄宿學校周一（9月29日）突然倒塌，當局周二（9月30日）表示，相信至少有91人仍被困瓦礫下，救援人員持續搜救生還者。

這座伊斯蘭學校為多層建築，周一事發時，大批學生聚集在校內的禮拜場所祈禱。該校當時正進行未經許可的擴建工程。塌樓後，至少3名學生被確認死亡，另有100人受傷，其中多人頭部受傷或骨折。國家災害應變署周二將失蹤人數從先前38人上調至91人，表示根據學生出席資料，估計有91人被埋瓦礫下。

當局表示，瓦礫堆下至少還有6名學生還，但搜救行動因大片的混凝土塊和建築體其他沉重且不穩定的構件而面臨重重困難。雖然有重型設備可供使用，但因擔心可能造成進一步倒塌而暫未使用。救援人員正透過狹窄縫隙，向困在瓦礫下的生還者輸送氧氣、食物和水，以維持他們的生命，其中有些人被壓住動彈不得。受困學生大多是7至12年級的男生，年齡介12歲至18歲。有生還者表示，當時在建築物的不同區域進行禮拜，因此得以逃生。（法新社/中央社）"
維港‧灣畔1A期連沽兩伙海景3房 吸金5542萬,2025-10-01 14:30,https://finance.mingpao.com/fin/instantp/20251001/1759302439738/%e7%b6%ad%e6%b8%af-%e7%81%a3%e7%95%941a%e6%9c%9f%e9%80%a3%e6%b2%bd%e5%85%a9%e4%bc%99%e6%b5%b7%e6%99%af3%e6%88%bf-%e5%90%b8%e9%87%915542%e8%90%ac,mingpao,地產,2025-10-01 15:15,"今日為十‧一國慶公眾假期，發展商主力促銷餘貨；中海外（0688）牽頭、已屆現樓的啟德跑道區維港‧灣畔，於國慶節以招標形式，售出兩伙第1A期3房海景大戶，包括第1A座22樓A室，實用面積819方呎，成交價2934.4萬元、實呎35,829元；及第1A座11樓B室，實用面積818方呎，成交價2608.1萬元、實呎31,884元，兩伙總成交價5542.5萬元。

"
圖看國慶中秋假期前夕　多地火車站人潮湧動　車道嚴重堵塞,2025-10-01 14:24,https://news.mingpao.com/ins/%e7%86%b1%e9%bb%9e/article/20251001/s00024/1759292731245/%e5%9c%96%e7%9c%8b%e5%9c%8b%e6%85%b6%e4%b8%ad%e7%a7%8b%e5%81%87%e6%9c%9f%e5%89%8d%e5%a4%95-%e5%a4%9a%e5%9c%b0%e7%81%ab%e8%bb%8a%e7%ab%99%e4%ba%ba%e6%bd%ae%e6%b9%a7%e5%8b%95-%e8%bb%8a%e9%81%93%e5%9a%b4%e9%87%8d%e5%a0%b5%e5%a1%9e,mingpao,熱點,2025-10-01 14:45,今日（10月1日）是國慶、中秋雙節假期第一天。假期前夕，全國多地火車站迎來客流高峰，車站內人潮湧動，浙江杭州東火車站於昨日（9月30日）及今日，下周二（10月7日）及下周三（10月8日）通宵營運，以應付大量旅客。此外，多地行車道路現「車龍」，部分道路在下午及晚上等時段堵塞嚴重。（中新社/新華社）
江若琳38歲生日 兒子畫抽象卡送祝福,2025-10-01 14:15,https://ol.mingpao.com/ldy/showbiz/latest/20251001/1759299168740/%e6%b1%9f%e8%8b%a5%e7%90%b338%e6%ad%b2%e7%94%9f%e6%97%a5-%e5%85%92%e5%ad%90%e7%95%ab%e6%8a%bd%e8%b1%a1%e5%8d%a1%e9%80%81%e7%a5%9d%e7%a6%8f,mingpao,娛樂,2025-10-01 14:30,"江若琳（Elanne）昨天（9月30日）38歲生日，與丈夫蕭唯展（Oscar）及兩歲兒子立鈞（Owen）一同慶祝，但所有慶祝活動都以兒子開心為大前提。Oscar表示︰「媽媽生日，兒子最開心，所有節目都是兒子喜歡的，媽媽真偉大。」

Owen在爸爸幫忙下送上親手繪畫的抽象生日卡。Owen在社交平台分享兒子畫卡時的影片及成品圖片，他說︰「老婆，生日快樂﹗祝你夢想成真﹗身體健康﹗今年阿仔終於識得溝通喇，仲畫在一張生日卡送畀你。我拍低咗佢畫畫嘅片段畀你慢慢欣賞。我同奧雲會繼續愛你、保護你。無論你幾多歲，我都會當你細路女咁看待的，放心﹗Happy birthday﹗I love you﹗」

Elanne亦在社交網分享慶祝照片，她表示︰「930的一天，感謝大家滿滿的祝福與愛﹗38歲把最好的還給自己了！望見眼前擁有的一切！無憾！過往的一切是美好的，每一個故事每一個章節都值得感恩。未來我要更快樂地活出一直在夢想裡的樣子。謝謝我的孩子，謝謝我的先生，謝謝我的朋友，謝謝我的家人，謝謝一直愛著我的每一位。從此許下的願望都是快樂的。」"
