id,title,date,last_update,url,lead,section,source,scrape_time,news_content
bkn-20250809075154047-0809_00822_001,醫管局CEO冀擴專科門診電子化　加強醫護「敢言文化」助改善服務,2025-08-09 07:51,2025-08-09 07:51,https://hk.on.cc/cnt/news/20250809/bkn-20250809075154047-0809_00822_001.html,醫管局CEO冀擴專科門診電子化　加強醫護「敢言文化」助改善服務,香港,oncc,2025-08-09 10:15,"新任醫院管理局行政總裁李夏茵上任近一周。她昨日會見傳媒指，希望將個別醫院或聯網推出的改善服務措施擴大至各聯網，例如將軍澳醫院所早前為專科門診引入自家設計的電子系統，讓病人到醫院後自行登記，看完醫生後再將藥單直接傳至藥房，同時透過「自動服務機」提供預約下次覆診、抽血時間，以及繳費等功能。局方希望可透過科技，為病人提供更方便的服務，並希望從病人角度出發制訂醫療服務，探討更多一站式、「有溫度」的服務，並加強與病人、病人組織的聯繫。

李認為，要處理醫院輪候時間問題，需要妥善安排人手分別處理新症及舊症，故「下游」、即將穩定病人釋出至基層醫療服務非常重要，惟目前仍需就輪候時間的指標再作討論。同時亦會考慮推出內部系統，提供所有醫院的輪候情況，以便研究如何在現有資源下釋出更多服務量。

未來醫院聯網將會重整，其中港島兩個聯網將會合併。李形容是項工程是將服務「執整」而非「執笠」，強調合併後不會減少服務點，而是希望提高服務質素及效率，並減省重複的行政程序。

另外，醫管局明年元旦起加價，李強調，目前正檢視執行細節，尤其是豁免制度方面，以便推出時一切順暢。醫療事故方面，她就認為有人的地方就會有失誤，故醫院出現事故無法避免，重點是預防下次事故重演。她亦希望加強「敢言文化」，讓局內同事多反映意見，協助改善醫療服務。"
bkn-20250809070603932-0809_00822_001,尖沙咀巴籍假難民遭棍毆　惡漢逞兇後登私家車逃去,2025-08-09 07:06,2025-08-09 07:06,https://hk.on.cc/cnt/news/20250809/bkn-20250809070603932-0809_00822_001.html,尖沙咀巴籍假難民遭棍毆　惡漢逞兇後登私家車逃去,香港,oncc,2025-08-09 07:45,今日(9日)凌晨3時19分，執法部門接獲途人報案，指途經尖沙咀中間道18號對開，發現一名南亞漢手腳受傷，懷疑他被人襲擊。警員接報到場，經初步調查，相信該名持「行街紙」的巴基斯坦漢在上址對開被2至3名男子用棍襲擊，兇徒其後登上一輛私家車逃去。案件列「襲擊致造成身體傷害」，暫未有人被捕。遇襲巴漢，清醒被送往廣華醫院治理。
bkn-20250809070348448-0809_00822_001,退休老翁利用醫保轉賣藥品　罰款1.3萬人民幣,2025-08-09 07:03,2025-08-09 07:03,https://hk.on.cc/cnt/news/20250809/bkn-20250809070348448-0809_00822_001.html,退休老翁利用醫保轉賣藥品　罰款1.3萬人民幣,上海,oncc,2025-08-09 07:15,"上海市醫療保障局周四（7日）發布一宗在醫保基金管理突出問題專項整治期間發現的典型案例，一名職工醫保退休參保人員利用享受醫療保障待遇的機會轉賣藥品獲取非法利益，被處以罰款並接受警方調查。

醫保部門今年2月透過大數據分析發現，74歲老翁胡某某去年11月12日在上海某醫院門診部購買的4盒藥品，於今年1月18日在外省市某藥店二次結算，存在倒賣藥品嫌疑。

經審核詢問，胡某某承認轉賣穩心顆粒等藥品，並為他人開具糖尿病等相關用藥。依據《醫療保障基金使用監督管理條例》規定，醫保部門追回其違規金額5,223元（人民幣，下同，約5,693港元），並根據上海相關規定對其處以罰款1.3萬元（約1.4萬港元）。"
bkn-20250809065530322-0809_00822_001,東頭邨女子墮樓　當場死亡,2025-08-09 06:55,2025-08-09 06:55,https://hk.on.cc/cnt/news/20250809/bkn-20250809065530322-0809_00822_001.html,東頭邨女子墮樓　當場死亡,香港,oncc,2025-08-09 07:15,"黃大仙有女子高處墮下。今日(9日)清晨6時許，一名女子被發現昏迷倒臥在東頭邨富東樓對開，懷疑從高處墮下。救護員到場證實事主已不治，警員正調查其身份及墮樓原因。

防止自殺求助熱線：

香港撒瑪利亞防止自殺會： 2389 2222

生命熱線： 2382 0000

社會福利署： 2343 2255

撒瑪利亞會熱線(多種語言)： 2896 0000

醫管局精神健康專線： 2466 7350

明愛向晴軒： 18288

東華三院芷若園： 18281

「情緒通」熱線： 18111

賽馬會青少年情緒健康網上支援平台「Open噏」： http://www.openup.hk"
bkn-20250809063347430-0809_00822_001,酷熱天氣警告仍然生效　市民應慎防中暑,2025-08-09 06:33,2025-08-09 11:54,https://hk.on.cc/cnt/news/20250809/bkn-20250809063347430-0809_00822_001.html,酷熱天氣警告仍然生效　市民應慎防中暑,香港,oncc,2025-08-09 12:00,"香港天文台在昨日(8日)上午6時45分發出酷熱天氣警告，持續至今仍然生效，在今日(9日)上午6時天文台錄得氣溫攝氏28度，相對濕度百分之88。天文台預料今日本港天氣酷熱，市民應慎防中暑。長者、孕婦、嬰兒及小童、慢性病如心臟病或高血壓患者，以及過胖人士均較易中暑，應及時觀察是否出現中暑徵兆。

在炎熱天氣下或高溫環境中工作的人士，請參照勞工處的預防工作時中暑指引，採取所需的防暑措施。在戶外活動的人士，應多補充水分和不要過度勞累。於感覺不適時，應盡快到陰涼的地方休息。戶外活動宜安排在早上或下午較後的時間進行。在室內活動時，亦應適時補充水分。如室內沒有空調設備，應盡量打開窗戶及以風扇保持空氣流通，亦可使用可供避暑的公共設施。"
bkn-20250809060324073-0809_00822_001,慈善團體獲發公開籌款許可證　今日進行賣旗活動,2025-08-09 06:03,2025-08-09 06:03,https://hk.on.cc/cnt/news/20250809/bkn-20250809060324073-0809_00822_001.html,慈善團體獲發公開籌款許可證　今日進行賣旗活動,香港,oncc,2025-08-09 06:15,社會福利署發言人表示，仁愛堂有限公司獲發公開籌款許可證在今日（9日）由上午7時至下午12時30分，進行全港賣旗活動。獲發許可證於公眾地方進行的慈善籌款活動詳情，包括任何更新的資料，已透過香港政府一站通網頁發布，而賣旗日許可證亦已上載至社署網頁，以供查閱賣旗機構的聯絡方法及已獲准舉行的賣旗日活動資料。
bkn-20250809060238650-0809_00822_001,智能鎖存安全隱患　男子要求更換遭拒,2025-08-09 06:02,2025-08-09 06:02,https://hk.on.cc/cnt/news/20250809/bkn-20250809060238650-0809_00822_001.html,智能鎖存安全隱患　男子要求更換遭拒,安徽,oncc,2025-08-09 06:15,"安徽省蕪湖市一名男子近日反映，其家中安裝某品牌智能鎖在設計及安裝方面存在安全隱患，關門時手指極易被夾傷，他要求品牌方更換一把不會夾手電子鎖，卻遭到拒絕。

事主范先生表示，這把電子鎖是去年10月他和妻子在蕪湖某商場購買，買兩天後便有師傅上門安裝。該鎖為長條形一體結構，無傳統把手，下方設計為鏤空，用戶需伸手握住鏤空處關門。關門時若用左手握鏤空處，左手四個手指根部極易被門夾到；若用右手整體握住，手指公則容易被門夾到。品牌方回應指，門鎖品質無問題不支持退換，師傅上門安裝時，都會告訴戶主正確的使用方式，之所以被夾手，是關門方式不當所致。

律師表示，雖然智能鎖品質本身無問題，但如果是因設計導致使用中存在安全隱患並對消費者造成傷害，商家應承擔一定責任。消費者在購買產品時，商家有義務充分告知產品可能存在的風險及正確使用方法。如果商家未履行告知義務，消費者有權要求商家採取措施消除隱患，如更換產品或提供有效的安全解決方案。若商家拒絕，消費者可向消協等相關部門投訴，必要時可通過法律途徑維護自身權益。"
bkn-20250809053630282-0809_00822_001,男子深水埗街頭遇襲被盜走數百元現金　獨行賊逃遁,2025-08-09 05:36,2025-08-09 05:36,https://hk.on.cc/cnt/news/20250809/bkn-20250809053630282-0809_00822_001.html,男子深水埗街頭遇襲被盜走數百元現金　獨行賊逃遁,香港,oncc,2025-08-09 06:15,"今日(9日)清晨5時14分，1名男子途經深水埗醫局街121號對開，突撲出1名大漢向事主揮拳襲擊，並盜去其身上數百元現金後逃去。

警員接報到場，男事主報稱受傷，他清醒被送往明愛醫院治理，經調查後，案件列「襲擊致造成身體傷害」及「盜竊」，暫時未有人被捕。"
bkn-20250809051251064-0809_00822_001,兩度誤洩民眾資料　市立醫院懲處,2025-08-09 05:12,2025-08-09 05:12,https://hk.on.cc/cnt/news/20250809/bkn-20250809051251064-0809_00822_001.html,兩度誤洩民眾資料　市立醫院懲處,新北,oncc,2025-08-09 05:15,"台灣新北市立聯合醫院去年兩度發生員工誤洩民眾資料事件，被該市審計處批評缺乏人員資訊安全維護與病患隱私保護意識。台媒周五（8日）報道，院方已將相關案件提報考績會懲處，並告誡同仁傳送資料務必謹慎。

審計處報告指出，聯合醫院歷年陸續導入多項智慧醫療服務，建置輔助醫療服務管理系統，並強化醫療資訊安全，但2023年僅有62.86％員工完成線上資通安全教育訓練課程，截至2024年10月24日，完成人數僅佔39.79％。2024年新北市資訊中心辦理防範惡意電子郵件社交工程演練，聯合醫院也未達演練目標、排名140名。

民眾黨新北市議員陳世軒表示，公共聯合醫療機構承載著市民對「專業與信任」的雙重期待，一旦資料外洩，不僅違法，更傷害病患與家屬的安全感與尊嚴，這不只是行政疏失，而是整體資安文化尚未建立的警訊。院方應從根本強化，包含將資安訓練納入必修項目並建立追蹤系統，確保全員參與與時效性；並建立單位主管責任制，將資安落實視為管理評鑑指標的一環，強化層級責任與橫向協調。"
bkn-20250809044235753-0809_00822_001,藍田「母子戀」情侶與友人瑣事爭執捱打施襲男子被捕,2025-08-09 04:42,2025-08-09 11:33,https://hk.on.cc/cnt/news/20250809/bkn-20250809044235753-0809_00822_001.html,"藍田「母子戀」情侶與友人瑣事爭執捱打　施襲男子被捕


今日(9日)凌晨2時13分，1名23歲男子及1名43歲女子在藍田碧雲道一便利店報案，指與1名男子在上址因瑣事爭執，期間遭對方出言恐嚇及用手襲擊。<br/><br/>警員接報到場，兩男女事主分別頭痛及臉部擦傷，清醒被送往基督教聯合醫院治理。經初步調查，姓張(4",香港,oncc,2025-08-09 14:15,"今日(9日)凌晨2時13分，1名23歲男子及1名43歲女子在藍田碧雲道一便利店報案，指與1名男子在上址因瑣事爭執，期間遭對方出言恐嚇及用手襲擊。

警員接報到場，兩男女事主分別頭痛及臉部擦傷，清醒被送往基督教聯合醫院治理。經初步調查，姓張(42歲)男子涉嫌「刑事恐嚇」及「普通襲擊」被捕，現正被扣留調查。據了解，涉案遇襲男女為情侶關係，而被捕男子則為兩人的友人。"
bkn-20250809042359170-0809_00822_001,慈正邨男子住所暈倒　昏迷送院後回復清醒,2025-08-09 04:23,2025-08-09 04:23,https://hk.on.cc/cnt/news/20250809/bkn-20250809042359170-0809_00822_001.html,慈正邨男子住所暈倒　昏迷送院後回復清醒,香港,oncc,2025-08-09 04:30,昨日(8日)晚上10時55分，一名姓莊(30歲)男子，在黃大仙慈正邨正安樓住所懷疑暈倒，其父親發現報案。救護員接報到場，莊男昏迷被送往伊利沙伯醫院治理，其後回復清醒。
bkn-20250809040508384-0809_00822_001,教師毆打患自閉症學生　校方拒絕開除,2025-08-09 04:05,2025-08-09 04:05,https://hk.on.cc/cnt/news/20250809/bkn-20250809040508384-0809_00822_001.html,教師毆打患自閉症學生　校方拒絕開除,湖北,oncc,2025-08-09 04:15,"湖北省恩施市一名17歲自閉症少年早前在特殊教育學校遭教師毆打，教師事後被行政拘留10日，校方拒絕開除。來鳳縣教育局辦公室周四（7日）透露，教育部門已處分該名教師，其曾因打學生受罰。

患有自閉症的17歲少年小星（化名）今年5月16日上課時與女教師張某爭執，小星抓張女的頭髮，張女則暴力反擊，毆打小星。張女向家長堅稱，當時舉行屬自衞，小星的母親尹女士報警，經鑑定小星受皮外傷，張女被依法行政拘留，此後復職。有指張女曾發文披露與學生對打，更揚言不會打架都勿來其校上班。

來鳳縣特殊教育學校校長李士方回應稱，事發時是小星先拉扯張女頭髮，張女情緒失控下還手，儘管教師打學生有錯，但此案未達到開除教師的程度，張女已賠禮道歉，當地教育局也作出相應處理。"
bkn-20250809033556356-0809_00822_001,苦主對措施有保留　斥管理落後,2025-08-09 03:35,2025-08-09 03:35,https://hk.on.cc/cnt/news/20250809/bkn-20250809033556356-0809_00822_001.html,苦主對措施有保留　斥管理落後,香港,oncc,2025-08-09 04:00,"運輸署牌照事務處「排隊黨」亂象令市民辦證苦不堪言，市民李小姐早前耗近10小時辦理免試換領駕駛執照，質疑運輸署職員和保安未有履行職守。運輸署昨宣布下周三（13日）起推行實名登記派籌新措施，李小姐對於新措施仍有保留，斥治標不治本，批評運輸署管理落後，促請限制代辦數量及加快電子化服務，徹底解決問題根源。

李形容新措施猶如「官腔答覆」，恐無法杜絕「排隊黨」亂象。她指出，牌照事務處每日派駐5至6名職員及兩至3名保安，親眼目睹「排隊黨」霸位及兜售籌號，卻從不作為，她強調，相關亂象一年前已有報道，運輸署卻視若無睹，直至現在才推出新政，慨嘆政府的心態和處事得過且過。

她續稱，運輸署未能在問題初現時採取臨時對策，相反一拖再拖：「但凡有少少智慧，見到爭議即應解決。」她建議當局將委託代辦數量由每籌最多5人減至3人，認為已能應付公司辦理牌照，並應要求代辦人輸入完整身份證號碼，嚴格限制取籌及代辦數量。她憶述辦理時頻聞職員重複呼叫代辦人如「王婆婆」3至4次，足證代辦問題嚴重，嚴重影響親身申請者權益。

李表示，支持牌證服務電子化，認為該政策是可以接受的，這樣可使市民在家辦理手續且毋須依賴代辦，並減少輪候時間及亂象。她促請運輸署加快電子化進程，確保公平高效服務，免市民繼續受困於冗長輪候及「排隊黨」滋擾。"
bkn-20250809033058626-0809_00822_001,東方日報A1：本報踢爆排隊黨擾民黑手　急推實名籌　運署未解憂,2025-08-09 03:30,2025-08-09 03:30,https://hk.on.cc/cnt/news/20250809/bkn-20250809033058626-0809_00822_001.html,東方日報A1：本報踢爆排隊黨擾民黑手　急推實名籌　運署未解憂,香港,oncc,2025-08-09 04:00,"金鐘運輸署牌照事務處出現「排隊黨」佔據服務名額、甚至以此牟利等亂象，事件經《東方日報》獨家揭露，曝光疑有蛇頭集團每日清晨安排長者搶籌，每月估計收入高達60萬元後，運輸署昨日終「補鑊」，宣布下周三（13日）起對代辦申請免試簽發香港正式駕駛執照或臨時駕駛執照實施新派籌要求，籌號要輸入申辦人的部分個人身份資料，不能轉讓，以遏止招攬生意等行為。不過，議員質疑運輸署新措施無法根治「排隊黨」問題，促加快電子化服務及分流不同服務，徹底解決亂象根源。

運輸署向內地及海外駕駛者推出的免試換領香港駕駛執照需求急增，金鐘運輸署牌照事務處經常水洩不通，針對部分人士在領取即日籌後招攬代辦服務並影響現場秩序，運輸署表示，下周三起，所有獲委託遞交申請的代辦在領取即日籌時，除須於系統輸入其個人身份證明文件號碼首四位數字或字母（如K123）外，亦須同時輸入各名免試簽發申請人的身份證明文件號碼首四位數字或字母，有關資料會列印於其籌號。

當使用櫃位服務時，櫃位人員會核對籌號持有人及申請人身份證明文件號碼。如任何資料與籌號所印不符，該籌即告無效，所有申請一概不獲受理，亦不會補發籌號。

署方強調，若發現擾亂公共秩序者將交由執法部門跟進。為進一步提升服務效率，運輸署計劃自9月起與駕駛執照簽發機構合作，查核網上預約內地駕駛證申請人資料，取消不真確預約，釋放名額予其他申請人。署方會透過現場告示、人員、網頁及社交媒體宣傳新措施，並持續檢視成效，適時調整。

而簡化程序的安排，署方正積極推動牌證服務電子化，釋放櫃位資源處理，如免試簽發等必須親辦的申請。至於一般駕駛執照服務的取籌及輪候安排則維持不變。署方亦回應指，已加強派員巡查牌照事務處，維持輪候秩序，並於圍欄標示輪候籌號次序以防止插隊。

議員江玉歡批評新措施不足以杜絕「排隊黨」亂象，因為問題根源在於申請程序繁複及電子化滯後。她質疑，運輸署允許內地申請人委託代辦，是否辦理的程序太複雜，令到需要找人代辦？她不明白政府為何不直接推行電子化，且未有明確的推行時間表，政府部門已擁有電子軟件技術，推行電子化並非難事。她認為，運輸署應為親身辦理的申請人開設專屬櫃位，可要求出示身份證核對，確保親身申請人不受代辦影響；委託辦理及親身辦理應分開排隊，在電子化全面推行前，此短期措施可鼓勵市民親自辦理，減少對代辦的依賴。

至於運輸署將加強巡查，江強調排隊黨只是整個問題的「症狀」，整個「病」其實是目前申請程序複雜，缺乏電子化。她認為，加強巡查只是浪費人手，倘若有資源這樣做，應花更多的資源去盡快推行電子化，簡化程序。

議員林順潮歡迎新的派籌安排，認為回應了社會關注，有助打擊濫用行為，確保服務公平有序。他又肯定運輸署9月起查核網上預約資料的計劃，認為有助提升系統透明度及效率。林期望運輸署持續推動電子化流程，配合現場秩序管理及系統升級，保障市民便捷使用服務。

更多新聞，請瀏覽東方日報網頁：

http://orientaldaily.on.cc/"
bkn-20250809033035458-0809_00822_001,《東方日報》今日要聞,2025-08-09 03:30,2025-08-09 03:30,https://hk.on.cc/cnt/news/20250809/bkn-20250809033035458-0809_00822_001.html,《東方日報》今日要聞,香港,oncc,2025-08-09 04:00,一貼睇晒《東方日報》A1新聞頭條、B1財經要聞及C1娛樂最爆，以及東網嚴選的本港、兩岸及國際重點新聞，名家評論，讓你在最短時間掌握最重要資訊。
bkn-20250809031050042-0809_00822_001,詐騙團夥要求拍片罵賴清德　防止成員拒從命令,2025-08-09 03:10,2025-08-09 03:10,https://hk.on.cc/cnt/news/20250809/bkn-20250809031050042-0809_00822_001.html,詐騙團夥要求拍片罵賴清德　防止成員拒從命令,台灣,oncc,2025-08-09 03:15,"台灣有詐騙團夥為確保兩名車手（負責提領及運送贓款成員）服從命令，要求他們錄製影片，痛批賴清德並威脅將在機場放置炸彈。兩名車手上月被拘提到案，直至周五（8日）被桃園地檢署依違反散布危害飛航安全之不實訊息罪、恐嚇公眾罪等起訴移審。

案情指，姓廖、黃男子均因財務狀況不佳，今年7月先後透過網絡應徵高薪非法工作或擔任車手，詐騙團夥要求兩人錄製炸彈恐嚇影片，威脅若兩人日後不從，將散布影片。由於兩人之後仍然拒絕工作，團夥於是將影片放上通訊軟件群組。

檢方表示，暑假旅遊旺季也是就業高峰期，犯罪集團正以上述新形態手法招募詐騙車手，散布不實訊息。兩名車手所為危害機場等場所安全維護，導致民眾對於該等場所安全質疑及不信任，影響甚鉅，建請從重量刑，速辦嚴懲，以儆效尤。"
bkn-20250809030753306-0809_00822_001,旺角16歲女被偷拍裙底春　母親嬲爆報案拘變態男,2025-08-09 03:07,2025-08-09 12:14,https://hk.on.cc/cnt/news/20250809/bkn-20250809030753306-0809_00822_001.html,旺角16歲女被偷拍裙底春　母親嬲爆報案拘變態男,香港,oncc,2025-08-09 12:15,"旺角偷拍男當場斷正。昨日(8日)晚上接近8時，一名16歲少女在旺角西洋菜南街一商場乘扶手電梯時，懷疑被1名男子偷拍裙底春，其母親報案求助。

警員接報到場，經初步調查，姓曾(42歲)男子涉嫌「非法拍攝或觀察私密部位」被捕，現正被扣留調查。"
bkn-20250809023403336-0809_00822_001,印度漢銅鑼灣劏房猝逝　死因待查,2025-08-09 02:34,2025-08-09 02:34,https://hk.on.cc/cnt/news/20250809/bkn-20250809023403336-0809_00822_001.html,印度漢銅鑼灣劏房猝逝　死因待查,香港,oncc,2025-08-09 03:15,昨日(8日)晚上9時45分，銅鑼灣禮頓道128-138號希雲大廈一單位住戶報案，指懷疑一名男住戶在上址一劏房暈倒。救援人員接報到場，該名43歲印度漢現場被證實死亡，其死因有待驗屍後確定。
bkn-20250809020923575-0809_00822_001,登打士街飛鏢用品專門店遭淋白油　歹徒動機待查,2025-08-09 02:09,2025-08-09 02:09,https://hk.on.cc/cnt/news/20250809/bkn-20250809020923575-0809_00822_001.html,登打士街飛鏢用品專門店遭淋白油　歹徒動機待查,香港,oncc,2025-08-09 02:45,"油麻地發生刑毀事件，現場在登打士街32至34A號歐美廣場3樓，今日(9日)凌晨零時許，數名大漢抵3樓一飛鏢用品專門店淋白油，歹待得逞後逃去，職員報案求助。

警員接報到場調查，並翻看「天眼」片段搜證，案件列「刑事毀壞」，暫時未有人被捕。"
bkn-20250809020224017-0809_00822_001,男童院爆連串性侵涉6人　衞福部稱互侵常見,2025-08-09 02:02,2025-08-09 02:02,https://hk.on.cc/cnt/news/20250809/bkn-20250809020224017-0809_00822_001.html,男童院爆連串性侵涉6人　衞福部稱互侵常見,新北,oncc,2025-08-09 02:15,"台灣新北市一處兒童安置機構爆發連串性侵案，市議員周四（7日）揭露至少6名男童捲入，部分人從被害人變成加害人。衞福部保護司周五（8日）認為，安置機構的兒童和少年可能經常出現互相性侵情況，政府將向被害人和加害人提供教育輔導。

因原生家庭無力撫養，社會局今年4月安排一名小學生入住安置機構二人房，他被室友性侵、逼其口交和手淫，前後犯行高達數十次，該室友亦對其他多人出手。小學生最終向教師揭露事件，並在社工陪同下報案。家人希望起訴該名室友，社工卻拒絕提供相關幫助。市議員鄭宇恩調查發現，性侵事件最早今年2月發生，院舍內12名男童至少6人是性侵的被害人或加害人，她批評社政單位未落實獨立居住措施，導致安置機構成為性侵溫床。

衞福部保護司司長張秀鴛指，青春期孩子會出現性探索行為，安置機構兒童和少年同住，可能出現摸下體、口交、肛交等行為，當被性侵的孩子從中得到快感，可能不會覺得是被性侵，並慢慢覺得快感也可以與他人分享，覺得這種行為是造福別人，最後從被害轉為加害，但這種觀念非常錯誤。社家署代理署長周道君透露，此案確實有多名小朋友原本是被害人，受到環境影響而成為加害人，新北目前正在調查機構是否涉及知情不報。"
