id,title,date,last_update,url,lead,section,source,scrape_time,news_content
bkn-20260422141100559-0422_00822_001,日媒揭AI反華影片產業鏈　壓縮兩國關係改善空間,2026-04-22 14:11,2026-04-22 14:11,https://hk.on.cc/cnt/news/20260422/bkn-20260422141100559-0422_00822_001.html,日媒揭AI反華影片產業鏈　壓縮兩國關係改善空間,中國,oncc,2026-04-22 14:15,"影片分享平台近年出現不少惡意醜化中國人的煽動性影片，日媒早前報道，一些日本博主利用人工智能（AI）批量生產反華虛構影片，從中牟利。有學者表示，這類反華影片內容往往偽裝成「新聞」或「真實故事」，將嚴重侵蝕日本社會的對華認知基礎，壓縮兩國關係改善空間。

據報道，這類反華影片的製作者可通過兼職平台接單，招聘條件註明熱愛日本、反感中國的人士。一名從事製作反華影片的60多歲日本男子曾是政府公務員，他接受日媒訪問時透露，製作反華影片的單價約1,000日圓（約49港元），加上這類影片的完播率更高，收益最多時每月約60萬日圓（約2.9萬港元），而且很穩定。他自言從未去過中國，也沒跟中國人打過交道，但就是「討厭中國人」。另一名20多歲男上班族原本以製作「吹捧日本類」影片為副職，自去年秋天起，「批判中國類」的訂單明顯變多。

遼寧大學美國與東亞研究院院長呂超表示，日本AI反華影片產業鏈絕非個別的網絡亂象，而是日本政治生態與社會心理交織作用的產物。高市早苗涉台言論不僅導致中日關係惡化，更形成所謂「政治正確」的示範，這與二戰前日本社會的輿論操控存在相似性。"
bkn-20260422140803960-0422_00822_001,菲防長指華圖佔菲領土　中方批信口雌黃,2026-04-22 14:08,2026-04-22 14:08,https://hk.on.cc/cnt/news/20260422/bkn-20260422140803960-0422_00822_001.html,菲防長指華圖佔菲領土　中方批信口雌黃,中國,oncc,2026-04-22 15:30,"菲律賓防長特奧多羅近日指中國挑戰航行自由和國際準則，有擴張計劃，試圖非法佔據屬於菲律賓的領土。中國駐菲律賓大使館周三（22日）批評菲方信口雌黃、顛倒黑白，對中國肆意抹黑，對此堅決反對。

特奧多羅批評中國的意圖陰險且不透明，其行為限制菲律賓實行獨立外交政策，而菲律賓與美國舉行聯合軍演是對中國的集體威懾。中國駐菲大使館指摘過去幾年菲方一些勢力不斷在海上挑釁滋事，拉攏域外國家介入地區事務，直接導致南海問題持續升溫，中菲關係面臨嚴重困難。近段時間，經過雙方共同努力，中菲恢復外交對話並已成功舉行三輪對話，人員往來增加，直航愈開愈多，經貿合作面臨新的機遇。

然而，一些反華勢力便急不可耐跳出來，毫不掩飾地動用各種手段干擾破壞，目的非常直白，就是中菲關係必須搞壞不能搞好，兩國人民必須仇視不能走近。惟他們的圖謀和伎倆最終是不可能得逞的，因為他們站在中菲人民的對立面，站在歷史錯誤的一邊。大使館續指，單邊主義和霸權霸淩已經給世界造成深重災難，當前能源危機就是最好例證。老百姓需要的是和平安寧發展，不需要引入外部力量狐假虎威、挑起更多衝突對抗，那些依靠域外勢力試圖挑動大國博弈並從中漁利的人，很可能引火燒身、變成炮灰，奉勸他們好自為之，給自己留條後路。"
bkn-20260422140006101-0422_00822_001,國家審批趨嚴　深圳地鐵18號線未獲批覆,2026-04-22 14:00,2026-04-22 14:00,https://hk.on.cc/cnt/news/20260422/bkn-20260422140006101-0422_00822_001.html,國家審批趨嚴　深圳地鐵18號線未獲批覆,廣東,oncc,2026-04-22 14:15,"近日有網民呼籲將18號線納入深圳市軌道交通五期建設規劃，並盡快報批。深圳市發展和改革委員會周一（20日）回應稱，深圳地鐵18號線一期（沙井至白花段）已於2022年底納入上述規劃上報國家，但經國家評估後未獲批准。

網民指出，18號線作為串聯東西部的大外環，建成後不僅有利於沿線區域發展，而且對整個深圳的發展也將起到巨大的助推作用。網民認為，18號線能激活光明科學城、平湖北中心、阪田華為總部等區域的經濟活力和發展潛力，切實推動各區域資源調配與融合發展，希望深圳推動18號線重新報批。

市發改委回應時提到，近年國家對城市軌道交通建設提出了新要求，深圳之後將結合軌道覆蓋、客流需求等因素，進一步深化研究論證18號線的必要性和可行性。市發改委強調，將繼續加大力度與國家溝通對接，全力做好符合條件項目的申報工作。"
bkn-20260422135805967-0422_00822_001,消防水缸嚴重損壞人員巡視無檢查消防隊長承認依賴承建商資料,2026-04-22 13:58,2026-04-22 17:05,https://hk.on.cc/cnt/news/20260422/bkn-20260422135805967-0422_00822_001.html,"消防水缸嚴重損壞　人員巡視無檢查　消防隊長承認依賴承建商資料


就大埔宏福苑火災成立的獨立委員會今日(22日)舉行第17場聽證會。大埔消防局高級消防隊長伍永光下午作供，他於火災當日是值班指揮官。伍永光在書面證供中提及，他曾處理一名麥先生的投訴。投訴人擔心工程相關的安全問題，包括工人在地盤吸煙。伍永光與麥先生通電話後，將個案定性為「查詢」而非「投",香港,oncc,2026-04-22 18:15,"就大埔宏福苑火災成立的獨立委員會今日(22日)舉行第17場聽證會。大埔消防局高級消防隊長伍永光下午作供，他於火災當日是值班指揮官。伍永光在書面證供中提及，他曾處理一名麥先生的投訴。投訴人擔心工程相關的安全問題，包括工人在地盤吸煙。伍永光與麥先生通電話後，將個案定性為「查詢」而非「投訴」。他解釋，因為投訴內容涉及工程範圍或工地監督，消防處不會啟動投訴處理機制，因此他建議麥先生向屋宇署或勞工處投訴。

代表獨立委員會的資深大律師杜淦堃問及，消防處是否有清晰指引區分「投訴」與「查詢」，以及若內容涉及工程項目或工地監督，是否一律列為查詢。伍永光表示，自己是從累積經驗及指引作出建議，一直理解「投訴」是指可以處理或直接跟進的事項；若涉及工程範圍，則歸類為查詢。他補充，消防處指引說明大廈外牆，例如廣告牌覆蓋外牆由屋宇署跟進，故認為兩個個案有相似地方，故交由屋宇署跟進。至於伍為何當時未有將吸煙問題轉介勞工處，反而建議直接投訴。他解釋，當時建議對方經1823投訴，因為認為是最直接，且可通知各部門。

就消防在承辦商通知停消防系統後兩次巡視宏福苑，伍指消防承建商會通知前線消防人員到場視察，消防會給予補救措施建議。杜淦堃質疑承建商稱漏水，消防處定義為消防水缸嚴重損壞，但無核實是否準確。伍稱會與管理公司溝通確認，但不會直接檢查消防水缸。他承認，消防人員是依賴承建商的資料，到現場時會與管理公司溝通並核實情況，而處方沒有要求核實承建商的資料是否準確。

委員會主席陸啟康指出，消防處有較多證人作供。杜淦堃解釋指，因為這是火災的調查，故會給予消防處較多問題。他形容「答不到出多少封信給消防，可能多到數不到」。他透露，消防處遵守一項原則，即每一個有資料的消防人員都做出一份證人供詞，而有多位提供證人供詞的證人，亦沒有被要求作供。

就火災前消防處雖有到場巡查，杜淦堃問及處方會不會核實承建商提供資料是否準確。伍稱會跟管理公司溝通確認，但不會直接檢查水缸，亦承認無核實承建商所說的是否準確。杜直言：「既然落得去，點解不去確實吓，我相信你都未必答到。」伍表示同意。"
bkn-20260422132749644-0422_00822_001,輔警涉駕的士載客時自瀆　辯稱患濕疹30年　案件押5.14裁決,2026-04-22 13:27,2026-04-22 17:34,https://hk.on.cc/cnt/news/20260422/bkn-20260422132749644-0422_00822_001.html,輔警涉駕的士載客時自瀆　辯稱患濕疹30年　案件押5.14裁決,香港,oncc,2026-04-22 18:00,"正職是的士司機的58歲男輔警涉於去年9月駕駛的士載客期間露出陰莖自瀆，被55歲女乘客X發現並報案。該男輔警否認一項在公眾地方的猥褻行為罪，案件今日(22日)於東區裁判法院開審，控方傳召X作供指，案發當天早上她乘搭的士途中見到司機疑似自瀆，不久後確認他右手抓軚盤，左手捉陽具套弄，遂報警。該司機被警員帶上警車時更對她目露兇光，說她看錯了。X形容被告當時「好兇猛」。被告則自辯確認自己患有濕疹30年，並強調他絕對沒有在車上自瀆和暴露性器官，辯方亦傳召醫生證人指被告從1998年起曾數次因濕疹求醫。裁判官高偉雄將案件押後至5月14日裁決以待其審視案中證據。

被告吳咏文(現58歲，報稱的士司機)，據悉案發時是隸屬香港仔分區的休班輔警。控罪指被告於2025年9月1日在香港跑馬地馬場外，無合法權限或辯解，而在公眾地方或公眾可見的情況下猥褻暴露他的部分身體，即其陰莖。

X今在屏風後作供指，案發當天早上她在中環環球大廈廣場外乘搭一輛的士，坐在後座左方並跟司機說要到跑馬地養和醫院，隨後便看手機。惟的士在行駛中「好chok」，她感覺暈車浪便不再看手機，卻見司機好像在自瀆，她以為自己看錯，後來一直觀察司機。當的士駛至時代廣場時，對方又在自瀆。他一隻手抓軚盤，一隻手捉陽具上下套弄，而當時陽具是勃起的。她隨即以不小的聲線報警，在電話中說了司機的名字、車牌等資訊。

的士轉入奕蔭街後，司機跟她說「差佬到咗」，X以現金結帳後下車。她後來跟在場警員講述發生何事，其中一警問她有沒有看錯，X表示「我咁大個人，無可能手指公同陽具分唔到」。

吳自辯指出他從1991年起擔任輔警職位，直至本年3月應上司要求主動辭職；並表示自己患有濕疹30年。X報警時，吳並不清楚她為何報警，但聽見她說出「unsafe」字眼，以為車輛機件出現故障並看向倒後鏡，看車輛有沒有漏出甚麼。吳更在X報警期間說「我等埋佢啦」，意指他也會等待警員來到，希望X安心點。辯方亦傳召證人羅君葆醫生，他確認吳在1998年、2016年及2020年因濕疹求診，而吳在2025年尾亦再次求診，羅在報告中指吳於髀罅及陰囊位置均有濕疹。

案件編號：ESCC 3269/2025"
bkn-20260422132711852-0422_00822_001,宏福苑火災令社會更關注防火　議員冀投放資源提升救人自救能力,2026-04-22 13:27,2026-04-22 13:27,https://hk.on.cc/cnt/news/20260422/bkn-20260422132711852-0422_00822_001.html,宏福苑火災令社會更關注防火　議員冀投放資源提升救人自救能力,香港,oncc,2026-04-22 13:45,"宏福苑火災造成嚴重傷亡，議員陳凱欣今日(22日)在立法會上表示，火災令社會更關注防火等議題，她指本年度政府就防火工作預留約10.6億港元，按年增加約17.9%，期望可投放更多資源在社區及校園教育，提升市民在災難中「救人自救」的能力，例如心肺復甦法及使用心臟除顫器等，將有關技能變成一種肌肉記憶。

她認為在普及「救人自救」教育上做更多規劃，相信可提升社會在應對災難的能力，將悲劇發生的機率減到最低。"
bkn-20260422132606867-0422_00822_001,打擊東九龍白牌車　拘2本地男司機扣查兩Tesla,2026-04-22 13:26,2026-04-22 13:26,https://hk.on.cc/cnt/news/20260422/bkn-20260422132606867-0422_00822_001.html,打擊東九龍白牌車　拘2本地男司機扣查兩Tesla,香港,oncc,2026-04-22 14:15,"東九龍區警員今日（22日）上午在區內進行打擊非法駕駛汽車作出租或載客取酬用途的行動。

行動中，人員喬裝乘客，成功截獲2輛懷疑涉及非法載客取酬的Tesla電動車。2名分別48歲及51歲的本地男司機分別在將軍澳及牛頭角涉嫌「利用汽車作非法出租或取酬載客用途」及「沒有第三者保險而使用車輛」被捕。他們現正被扣留調查。上述2輛涉案車輛亦已被扣留調查及作進一步檢驗。

根據《道路交通條例》，除非汽車獲發有效的出租汽車許可證，否則任何人不得駕駛或使用車輛作出租或載客取酬之用。首次定罪可處罰款1萬元及監禁6個月，再干犯則可處罰2.5萬元及監禁12個月。

執法部門呼籲市民，出行時應選擇合法公共交通工具。如搭乘相關車輛的用途為非法載客取酬，有關車輛的第三者風險保險或會失效，一旦發生意外，其他道路使用者包括乘客及行人均會失去應有保障。"
bkn-20260422132003426-0422_00822_001,東部戰區編隊完成西太平洋演訓　經與西水道返回,2026-04-22 13:20,2026-04-22 13:20,https://hk.on.cc/cnt/news/20260422/bkn-20260422132003426-0422_00822_001.html,東部戰區編隊完成西太平洋演訓　經與西水道返回,中國,oncc,2026-04-22 13:30,"中國人民解放軍東部戰區新聞發言人徐承華陸軍大校周三（22日）宣布，當日東部戰區組織133編隊完成西太平洋海域演訓活動，經與西水道返回，有效檢驗了部隊遠海作戰能力。

東部戰區日前組織133號艦艇編隊過航橫當水道，赴西太平洋海域開展演訓活動。專家指出，133號艦艇編隊的主角是舷號「133」的052DL改進型導彈驅逐艦包頭號，被形容為能文能武的「航母帶刀侍衞」。

美媒指出，橫當水道較傳統通道宮古海峽更逼近日本本土，在中日關係緊張之際更受關注。但東部戰區強調，今次是根據年度計劃組織的例行性訓練，不針對特定國家和目標。"
bkn-20260422131405568-0422_00822_001,美台簽HIMARS等6項軍購案發價書　涉逾2千億新台幣,2026-04-22 13:14,2026-04-22 13:14,https://hk.on.cc/cnt/news/20260422/bkn-20260422131405568-0422_00822_001.html,美台簽HIMARS等6項軍購案發價書　涉逾2千億新台幣,台灣,oncc,2026-04-22 13:30,"台灣地區防務部門周三（22日）公布，已與美方簽署6項軍購案發價書，包括遠程精準火力打擊系統、導彈戰備存量補充、大口徑彈藥共同合作生產等項目，總金額達2,087.7億元（新台幣，下同，約519億港元）。

軍購案發價書包括遠程精準火力打擊系統，即M142高機動多管火箭系統（HIMARS），涉約1,235億元（約307億港元），佔總額逾半。其次為M109A7自走炮、台灣陸軍使用的導彈戰備存量補充、海軍使用的反裝甲導彈、軍備局負責的大口徑彈藥共同合作生產，以及涉及參謀本部的整合防空服務技術顧問案。

台媒預計，今次一口氣簽署多項軍購案發價書，將為總額1.25萬億元（約3,100億港元）軍購特別條例及預算案的審查發揮助推劑效果。報道提到，有關台政府打造「台灣之盾」的防衞計劃，美方尚未公布出售相關武器系統，台方先行與美簽署整合防空服務技術顧問案，將由美方顧問赴台協助規劃及整合，疑為下一波大型軍售熱身。"
bkn-20260422131101743-0422_00822_001,曾接工人吸煙投訴無轉介勞工處　大埔前消防局長：工地有人監管,2026-04-22 13:11,2026-04-22 13:11,https://hk.on.cc/cnt/news/20260422/bkn-20260422131101743-0422_00822_001.html,曾接工人吸煙投訴無轉介勞工處　大埔前消防局長：工地有人監管,香港,oncc,2026-04-22 13:30,"就大埔宏福苑火災成立的獨立委員會今日(22日)舉行第17場聽證會。大埔消防局前局長賀俊維作供，其書面證供中提到曾處理一宗由工程公司(宏業)以電郵形式發出的通知，內容涉及預計擺放竹棚的位置。他表示，這並非投訴，而是承建商主動通知消防局即將進行的工程及物料擺放。他收到電郵後，處方派出一名消防隊長到場評估，以確定會否阻塞消防通道或影響逃生途徑及緊急車輛通行。賀俊維指出，如果消防處收到有關阻礙逃生通道的投訴，消防處會按服務承諾，在24小時內派員到場視察。

賀俊維提及有宏福苑居民曾就宏福苑的火警風險作投訴，包括工人吸煙問題，稱當時是依靠消防判斷將投訴轉介予哪一部門，又指曾探討可如何幫助居民。他承認，吸煙投訴多數會與有關方面溝通，但消防處認知中主要責任不在消防處。他解釋，當時依靠自己判斷將投訴轉介給哪一部門，但又指「我係呢個case冇做到轉介勞工處，原因是知道工地有人監管」。

另外，賀俊維確認，消防處曾在宏福苑舉辦一場消防講座，約有80人參加。他解釋，市民可向消防處申請講座，前線消防局收到申請後，當值隊長會與申請人溝通安排時間及內容要求，消防處會盡量滿足。他續指，這類講座在前線管理中是相當頻密的工作，但並非因應大型維修工程而主動安排，而是基於市民申請。

杜淦堃指出，宏福苑是大埔區大型居屋，多座同時維修，工程歷時長。他問賀俊維，當時消防處有否因應此大型維修工程主動加強巡查或採取特別措施，要求加強對宏福苑的消防監管。賀俊維回應，大火前消防處並無特別加強巡查，稱「加強嘅話係冇」。他承認，對於火警風險高的大型維修工程，日後可考慮主動舉辦講座或加強巡查，因為這類情況確實有需要。"
bkn-20260422130107036-0422_00822_001,華海軍力量快速增長　美印太司令籲擴艦隊規模,2026-04-22 13:01,2026-04-22 13:01,https://hk.on.cc/cnt/news/20260422/bkn-20260422130107036-0422_00822_001.html,華海軍力量快速增長　美印太司令籲擴艦隊規模,中國,oncc,2026-04-22 13:15,"美國參議院軍事委員會周二（21日）舉行聽證會，多名美軍司令出席。其中，印太司令部司令帕帕羅指出，由於中國海軍力量快速增長，印太司令部需加強部署，而目前轄下的軍艦數量不足。

帕帕羅表示，印太司令部艦隊規模不夠大，兩棲攻擊艦、驅逐艦和攻擊型潛艇不足，正朝着錯誤的方向發展。他呼籲加強印太司令部的部署，有必要增加各類艦艇數量，包括中型和大型無人艦艇。

另外，日本自衞隊近日首次正式全面參加美國和菲律賓主導的「肩並肩」聯合軍事演習，帕帕羅指美日菲的導彈正以一體化的方式使用，對此表示歡迎，展現了盟友火力的顯著提升。"
bkn-20260422125809430-0422_00822_001,斥政府碌卡惜錢度日　議員：最終由哪一代埋單,2026-04-22 12:58,2026-04-22 12:58,https://hk.on.cc/cnt/news/20260422/bkn-20260422125809430-0422_00822_001.html,斥政府碌卡惜錢度日　議員：最終由哪一代埋單,香港,oncc,2026-04-22 13:15,"立法會今日(22日)恢復辯論《2026年撥款條例草案》，議員管浩鳴指因為政府繼續「一刀切」每年節省政府2%經常開支，意味要繼續削減社福機構撥款，在香港老齡人口不斷攀升，但機構資源被削、人手減少，「如何令逐年增加的長者都得到適切照顧呢？」他認為短期內對領取社會保障金的合資格者發放「雙糧」，對社福長遠發展又幫助不大。他指社福機構的儲備會有用完的一日，屆時服務很大機會出現斷層，希望政府就措施作出調整，更具針對性地幫助社福機構。

他又指《預算案》呈現公共財政狀況有「重大的結構性風險」，表面上今年錄得29億港元盈餘，「盈餘」背後值得警惕和深入探討。他指外界認為近年預算案「發債當收入」，「憑實力借返來嘅錢，點可以當收入計算呢？」他指政府聲稱的盈餘當中，有高達 1,033 億港元是透過債券得來的貸款，如果撇除這筆款項，政府實際面臨高達 1,004億港元的嚴重赤字。

他說：「做法如同一個人用信用卡借錢來填補日常開支，然後指自己有儲蓄，這種會計處理手法，實際上有待商榷。」他又關注：「未來又要還債、又要還利息，這筆款項最終如何填補？」他認為未來5年發債規模提升至 9,000億港元，來年開始每年還逾千億的債，還款壓力之大，會直接蠶食香港庫房未來的財政實力。他關注若回報差於預期，「儲備所能提供的緩衝還餘下多少呢，最終要由哪一代『埋單』呢？」

對於政府計劃由外匯基金中調撥 1,500億港元，支持北部都會區及其他基建項目。他指外匯基金是香港金融穩定的最後防線，主要用於支持聯繫匯率同應對金融危機，外匯基金是「救命錢」。他認為萬一再遇到金融風暴，外匯基金流動性不足，後果不堪設想。他又稱，有人擔心今次是打開「潘朵拉的盒子」，下次政府缺錢就向外匯基金「埋手」。 他指外匯基金關乎公共財政和金融安全，並非「豬仔錢甖」，亦並非「過年逗多啲利是，見鬆動就抽少少出嚟使」。"
bkn-20260422123844061-0422_00822_001,「開生口」消防風險　消防處助理處長同意是明顯漏洞,2026-04-22 12:38,2026-04-22 12:38,https://hk.on.cc/cnt/news/20260422/bkn-20260422123844061-0422_00822_001.html,「開生口」消防風險　消防處助理處長同意是明顯漏洞,香港,oncc,2026-04-22 13:15,"就大埔宏福苑火災成立的獨立委員會今日(22日)舉行第17場聽證會，消防處助理處長(消防安全)翁錦雄作供。代表獨立委員會的資深大律師杜淦堃引用消防處內部政策文件，指出消防處須於24小時內處理有火警風險的情況，問「開生口」是否構成消防風險。翁錦雄坦言「我哋做了31年，都無留意過此情況。」他同意是「很明顯及很大的漏洞」。他指，基於部門分工，要找最合適的部門處理，重申涉及建築結構改動的問題應由屋宇署處理，因其具備工程專業知識。消防處的職責範圍僅限於消防裝置、設備及火警危險，而「開生口」屬建築結構改動，並非消防處的直接執法範圍。

杜淦堃追問，消防處所說的分工，有否任何政策文件或指引清楚列明。翁錦雄表示，印象中沒有正式文件記錄這類分工。他指，主要是依靠部門一直以來的合作及認知，例如會議及相關討論。翁認同事件反映部門之間溝通不理想，各部門就法例下的權責演繹不一致。然而，杜淦堃指出，從吸煙投訴的例子可見，勞工處和消防處對同一投訴的歸屬有不同演繹，勞工處曾將涉及火警風險的吸煙投訴轉介消防處，而消防處則認為應由勞工處處理。這反映部門之間的理解並不一致。翁錦雄認同事件反映部門之間溝通不理想。

杜淦堃指出，若發現僭建物，消防處現行做法是會透過格式備忘錄轉介屋宇署處理，讓署方執法。同時，消防處亦可根據《消防條例》，就因應火警風險發出「消除火警危險通知書」。他問及，對於宏福苑逃生樓梯的「生口」問題，消防處是否有責任發出該通知書，要求拆除開口並還原窗戶。翁錦雄回應表示不同意，解釋指消防處無專業去界定工程是否需要有關改動，故應由專業部門跟進，以避免不同部門之間做出互相牴觸的決定。"
