id,title,date,last_update,url,lead,section,source,scrape_time,news_content
bkn-20250929162029729-0929_00822_001,參與黑導黃牛活動　清華教職員學生多人遭處理,2025-09-29 16:20,2025-09-29 16:20,https://hk.on.cc/cnt/news/20250929/bkn-20250929162029729-0929_00822_001.html,參與黑導黃牛活動　清華教職員學生多人遭處理,北京,oncc,2025-09-29 16:30,"北京清華大學保衞處周一（29日）在官方微信發布消息稱，近期發生多宗校內人員違規報備、違規載客入校的情況，部分人員參與「黑導」（不法導遊）、「黃牛」活動牟利。學校已聯動公安機關，依法依規依紀處理相關人員。

消息指，有教職工與校外黑導勾連，通過違規報備方式組織團隊入校參觀並非法牟利，涉案金額大，被公安機關行政拘留10日。學校同時根據相關管理規定，對該教職工予以解聘處理。另有教職工在網上發布招攬遊客訊息，其家屬通過校內有證車輛搭載遊客入校並非法牟利，涉案人數多，其本人及家屬均被公安機關行政拘留7日。校方已取消其校園車證及家屬入校權限。

其餘兩宗涉及學生的案例中，一名學生在匿名交流平台看到預約入校研學的「求助文」後，聯絡發文者及自稱研學機構工作人員的非法中介，為20多名校外人員違規報備入校並牟利，組織其他同學共同為校外人員報備入校並支付報酬。該學生除被公安機關行政處罰，亦連同其他涉事學生被校方紀律處分，上繳違法所得，並暫停處分期內的報備權限。另一名學生在大三期間受同學、好友等校外人員請託，為10多名與本人無直接關聯的校外人員違規報備入校並牟利，及後受到警告處分，在處分解除前取消獎學金、榮譽稱號、免試推薦研究生等申請資格。"
bkn-20250929161438658-0929_00822_001,年輕及遲確診乳癌患者易「遠端復發」　組織倡分階段落實全民篩查,2025-09-29 16:14,2025-09-29 16:14,https://hk.on.cc/cnt/news/20250929/bkn-20250929161438658-0929_00822_001.html,年輕及遲確診乳癌患者易「遠端復發」　組織倡分階段落實全民篩查,香港,oncc,2025-09-29 16:45,"香港乳癌基金會今日（29日）公布《香港乳癌資料庫第17號報告》，指出年輕或確診期數較高的乳癌患者，出現「遠端復發」，即復發時擴散至其他器官的風險會更高。資料庫督導委員會成員、臨床腫瘤科專科醫生宋崧指出，不同乳癌類型雖不影響遠端復發的風險，但影響擴散出現的時間，其中一直被視為「最惡」的「三陰性」乳癌的復發時間較短，而遠端復發後三年的存活率亦明顯較差，估算中位數僅為14個月。基金會就建議政府分三階段，逐步實施全民乳癌篩查。

新一期《報告》比對611名於10年內出現遠端復發的乳癌患者，以及3,619名10年內無復發患者的數據，發現出現遠端復發的患者，其確診期數明顯較高，逾四成人確診時屬第三期。40歲以下的年輕患者，或癌細胞及腫瘤較嚴重的患者，其遠端復發風險亦會上升。

根據本地最新數據，本港於2022年錄得5,182宗乳癌新症。乳癌基金會管治委員會成員、臨床腫瘤科專科醫生李沛基表示，有約8成患者確診時屬於第一至三期乳癌，這些患者的遠端復發風險會隨時間上升，而遠端復發期最長可達15年。由於癌細胞擴散至不同器官後難以透過局部手術消除，加上癌細胞不斷變異，可能會產生抗藥性，導致擴散後患者痊癒機會極低。。

基金會主席霍何綺華表示，政府已將乳癌篩查先導計劃恒常化，今年會推行第二階段計劃，現時有512人符合資格，當中有443人接受檢查，其中2人確診乳癌。她建議政府逐步推展乳癌篩查計劃，先為高危女性提供篩查，再於低收入地區啟動試點計劃，最後再落實全民乳癌篩查。"
bkn-20250929161206234-0929_00822_001,十一長假萬宜東壩小巴加車及班次北潭涌設顯示屏發布交通情況,2025-09-29 16:12,2025-09-29 16:12,https://hk.on.cc/cnt/news/20250929/bkn-20250929161206234-0929_00822_001.html,"十一長假萬宜東壩小巴加車及班次　北潭涌設顯示屏發布交通情況


8天十一內地長假期間料較多遊人前往西貢萬宜水庫東壩一帶郊遊，港府今日(9月29日)表示採取多項措施應對，其中往返東壩至北潭涌的9A號專線小巴將安排不少於30輛車行走，較一般周末多6倍；北潭涌漁護署關閘前亦設置顯示屏，發布通往東壩一帶的道路交通情況。<br/><br",香港,oncc,2025-09-29 17:00,"8天十一內地長假期間料較多遊人前往西貢萬宜水庫東壩一帶郊遊，港府今日(9月29日)表示採取多項措施應對，其中往返東壩至北潭涌的9A號專線小巴將安排不少於30輛車行走，較一般周末多6倍；北潭涌漁護署關閘前亦設置顯示屏，發布通往東壩一帶的道路交通情況。

萬宜水庫東壩近年一到假期人滿為患，早前端午節及五一內地長假期更「逼爆」。因應十一內地長假期後日(10月1日)便展開。運輸署已與第9A號線的小巴營辦商協調，會在10月1日至8日的長假期加開平日服務及配合需求加班，由一般的星期六、日及公眾假期的4輛小巴，大增至不少於30輛小巴，並預留後備車輛及司機，亦會配合交通管制措施靈活加班。

運輸署亦會在北潭涌漁護署關閘前方設置信息顯示屏，發布通往東壩一帶的道路交通情況。執法部門會針對部署，包括調派軍裝人員在北潭涌、西貢萬宜路及東壩的位置巡邏，有需要時採取臨時交通管制及人流管理措施，以疏導交通及保障遊客安全，並繼續打擊的士司機違法行為。

水務署則已完成萬宜路個別位置的臨時改善工程，方便來往車輛通過或避車；漁護署則會加強東壩一帶郊野公園範圍的管理，包括加派人員巡邏、維持秩序及加強清潔服務。漁護署另會聯同旅發局在其網頁公布東壩一帶的人流資訊，以便旅客規劃行程。"
bkn-20250929160526658-0929_00822_001,中日韓環境部長會面　簽署5年聯合行動計劃,2025-09-29 16:05,2025-09-29 16:05,https://hk.on.cc/cnt/news/20250929/bkn-20250929160526658-0929_00822_001.html,中日韓環境部長會面　簽署5年聯合行動計劃,山東,oncc,2025-09-29 16:15,"第26次中日韓環境部長會議周日（28日）在山東省煙台市舉行，通過並簽署新一期《中日韓環境合作聯合行動計劃（2026—2030）》，圍繞八大優先合作領域設計了一系列合作活動。

中國生態環境部部長黃潤秋、日本環境省大臣淺尾慶一郎及南韓環境部部長金星煥出席會議。黃潤秋表示，本次會議圍繞三國環境保護的最新政策舉措和工作成效進行了深入交流，就空氣質量改善、沙塵暴研究、應對氣候變化、生物多樣性保護等重要多邊環境進程交換意見，並通過新一期聯合行動計劃，達成廣泛共識，為三方持續深化環境合作奠定基礎。他期待在三方共同努力下，中日韓環境合作取得更豐碩成果，持續改善區域環境質量，推動構建公平合理、合作共贏的全球環境治理體系。

會議召開期間，黃潤秋分別與淺尾慶一郎、金星煥舉行中日、中韓雙邊會談。黃潤秋與淺尾慶一郎會面時表示，中方願與日方在應對氣候變化、塑膠污染國際文書談判、生物多樣性保護、中日雙邊合作等領域加強交流，共同推動契合新時代要求的中日環境合作。黃潤秋與金星煥時會面中，就大氣污染防治、應對氣候變化、塑膠污染治理等議題深入交流。黃潤秋表示，中韓兩國在生態環境領域一直保持密切聯繫，期待雙方在現有基礎上繼續深化合作，有效應對區域環境挑戰。"
bkn-20250929153949395-0929_00822_001,創新科技嘉年華下月18日起舉辦設近165場工作坊或講座,2025-09-29 15:39,2025-09-29 18:50,https://hk.on.cc/cnt/news/20250929/bkn-20250929153949395-0929_00822_001.html,"創新科技嘉年華下月18日起舉辦　設近165場工作坊或講座


創新科技嘉年華將於下月18至26日在科學園舉行，主題為「創科點亮夢想」，屆時將會展示各項本地科研成果。嘉年華活動十分多元化，包括舉辦近150場工作坊，例如以磁力和電池感應原理製作懸浮燈，及15場網上講座，嘉年華舉行期間設有免費穿梭巴士，來往港鐵大學站，或大圍站至科學園，歡迎市民參與",香港,oncc,2025-09-29 21:00,"創新科技嘉年華將於下月18至26日在科學園舉行，主題為「創科點亮夢想」，屆時將會展示各項本地科研成果。嘉年華活動十分多元化，包括舉辦近150場工作坊，例如以磁力和電池感應原理製作懸浮燈，及15場網上講座，嘉年華舉行期間設有免費穿梭巴士，來往港鐵大學站，或大圍站至科學園，歡迎市民參與。

嘉年華匯聚各大學、研發中心和政府部門等約50個夥伴，展示各項創新科研成果，例如浸大的「觀舌辨食」人工智能(AI)應用程式，以舌頭特徵篩查早期糖尿病。

創新科技署署長李國彬表示，根據世界知識產權組織最新公布的全球創新指數，深圳、香港、廣州這個創科集群，今年首次獲排名全球第一，不僅是對我們科研實力的肯定，亦是對整個創科生態圈的讚譽。成績背後，正正是無數科研人員勇敢追夢、不斷創新的成果。李又稱，希望透過創科嘉年華這個平台，令更多年輕人感受到創科的力量，亦在這個全球領先的創科集群之中，看到自己將來的可能性、實現夢想。"
bkn-20250929153522051-0929_00822_001,八旬婦藏1400支香煙落馬洲入境遭檢控　被判囚兩個月及罰款2千元,2025-09-29 15:35,2025-09-29 15:35,https://hk.on.cc/cnt/news/20250929/bkn-20250929153522051-0929_00822_001.html,八旬婦藏1400支香煙落馬洲入境遭檢控　被判囚兩個月及罰款2千元,香港,oncc,2025-09-29 15:45,"一名入境旅客因管有未完稅香煙和未有向海關人員作出申報，違反《應課稅品條例》（《條例》），今日（29日）在粉嶺裁判法院被判處監禁兩個月及罰款2,000港元。

海關人員於9月21日在落馬洲支線管制站截查一名80歲抵港女旅客，並在其身上檢獲1,400支未完稅香煙，估計市值約5,000港元，應課稅值約4,000元。該名旅客隨即被捕。

海關對判刑表示歡迎，監禁刑罰具相當阻嚇作用，並反映罪行的嚴重性。海關提醒市民，根據《條例》，香煙屬應課稅品。任何人士若進口、處理、管有、售賣或購買私煙，即屬違法，一經定罪，最高可被判罰款二百萬元及監禁七年。"
bkn-20250929152556568-0929_00822_001,4成6港人抑鬱或焦慮　僅3%尋專業輔導或治療,2025-09-29 15:25,2025-09-29 15:25,https://hk.on.cc/cnt/news/20250929/bkn-20250929152556568-0929_00822_001.html,4成6港人抑鬱或焦慮　僅3%尋專業輔導或治療,香港,oncc,2025-09-29 15:45,"香港社會壓力大，不少人面臨精神健康問題。本地精神健康慈善機構「香港心聆」早前與一間本地保險公司進行調查，發現受訪的1,000名年滿18歲的港人中，有46%人有臨床抑鬱或焦慮徵狀，其中逾16%情況屬於中等至嚴重，而18至29歲人士情況最為嚴峻。原因方面，有40%受訪者反映，重大財政困難對其精神健康構成影響；有35%人認為與關係離異有關；亦有33%人的情況與失業或裁員有關。不過，整體受訪者當中，僅得3%表示會優先尋求專業心理輔導或治療支援。機構認為，此反映公眾在尋求專業協助方面仍頗有顧慮。

機構引述調查結果，指出有72%受訪者認為，於人生轉捩點獲得情緒支援十分重要，惟大部分人需要幫助的情況下，卻未能獲得適切的支援，例如在過去12個月內經歷流產的受訪者中，有25% 人表示完全未獲任何支援。

香港心聆將於今年11月6至8日舉辦「香港國際心理健康研討會2025」，以「如何應對生命中的變幻無常」為題， 邀請多位專家，共同探討重大人生轉變中所面臨的心理健康挑戰，預計可吸引超過800位參加者。"
bkn-20250929152510535-0929_00822_001,當局目標全政府應用AI　強調屬輔助工具　不能代替人手及問責,2025-09-29 15:25,2025-09-29 15:25,https://hk.on.cc/cnt/news/20250929/bkn-20250929152510535-0929_00822_001.html,當局目標全政府應用AI　強調屬輔助工具　不能代替人手及問責,香港,oncc,2025-09-29 15:45,"施政報告提出成立「AI效能提升組」，推動人工智能（AI）在政府部門的應用。創新科技及工業局局長孫東今日（29日）表示，已選定公司註冊處、運輸署及屋宇署三個部門作試點，期望日後增至十多個部門，並以所有部門參與為最終目標，強調AI只是輔助工具，不能代替人員工作及問責。他又預計今年內推出本地自主研發聊天機械人「港話通」，免費供市民下載使用。

孫東重申，AI只是輔助工具，不能替代人員工作及問責。他舉例指，利用「港會通」系統製作會議紀錄，只需數分鐘即可完成，以往則需時長達兩小時，顯示AI能顯著提升效率，但人員角色仍然重要。

政府亦正與本地大學合作，成立香港生成式人工智能研發中心，預計今年內推出自主研發聊天機械人「港話通」，免費供市民下載使用。孫東形容其功能與ChatGPT類似，但更具「本土特色」。孫東坦言系統初期或存不足之處，冀市民體諒並積極使用，期望政府率先帶頭，推動全社會利用AI轉型升級。

施政報告亦提出加快河套深港科技創新合作區建設，首期三座大樓已經落成，餘下五座將由2027年起分階段完工。孫東形容項目進入「提速提量」階段，政府成立18個部門和機構參與的「跨部門審批專班」以加快進度，並考慮「邊建設、邊進駐」模式，先為有意的企業提供空間。目前已有近30間企業與河套科技園公司商討進駐，部分已簽約及遷入，政府計劃今年內舉行開園儀式。"
bkn-20250929152259773-0929_00822_001,尖沙咀載客無按錶收貴3倍車資　六旬的哥判監4周及停牌罰款,2025-09-29 15:22,2025-09-29 15:22,https://hk.on.cc/cnt/news/20250929/bkn-20250929152259773-0929_00822_001.html,尖沙咀載客無按錶收貴3倍車資　六旬的哥判監4周及停牌罰款,香港,oncc,2025-09-29 15:45,"一名68歲的士司機於上月28日涉嫌「濫收車資」等被檢控。他上周五(26日)在九龍城裁判法院承認相關控罪，被法庭判處即時入獄4周、停牌3個月及罰款3,000港元。

案情顯示，執法人員當日喬裝乘客，由尖沙咀區乘的士前往油麻地一文化區，該名被捕男子沒有按計程錶收費，最後收取較原定車資高出3倍的款項，涉嫌「濫收車資」、「沒有展示的士計程錶指示器」、「沒有展示的士司機證於證件架上」及「使用一輛座椅安全帶有缺陷的車輛」，被拘捕並檢控。"
bkn-20250929152112902-0929_00822_001,涉立法會衝突案　林卓廷不認罪　裁判官裁定案件表證成立,2025-09-29 15:21,2025-09-29 17:10,https://hk.on.cc/cnt/news/20250929/bkn-20250929152112902-0929_00822_001.html,涉立法會衝突案　林卓廷不認罪　裁判官裁定案件表證成立,香港,oncc,2025-09-29 17:15,"前立法會議員林卓廷涉嫌於2019年立法會審議修訂《逃犯條例》草案時，與3名議員發生衝突，被控兩項「襲擊、妨礙或騷擾在會議廳範圍內的議員」罪。林不認罪，案件於西九龍裁判法院開審，控方今(29日)傳召立法會議員陳恒鑌作供。陳稱案發當日見到林卓廷不斷在主持會議的立法會議員石禮謙旁邊不斷說話，他認為林當時是騷擾石。辯方律師質疑，陳當時根本聽不到林說甚麼，騷擾石的說法只是陳的揣測，陳則稱這是常識。另一立法會議員周浩鼎於下午亦出庭作供，周作供完畢後，裁判官裁定案件表證成立。

現年48歲的被告林卓廷，被指違反《立法會（權力及特權）條例》。兩項控罪指他連同郭家麒及區諾軒，於2019年5月11日在立法會綜合大樓會議室1，襲擊、妨礙或騷擾在會議廳範圍內的議員陳恒鑌及周浩鼎。陳恒鑌供稱，當時法案委員會進行選主席程序，最初兩次會議由涂謹申議員主持，但一直未能選出主席。內會同日提供指引，由石禮謙取代涂主持會議，指引獲通過採納。當日早上石與他及其他建制派議員一同到會議室，遭多人包圍，部分民主派議員持續阻撓，當中亦包括當時身為議員助理的黃之鋒。

陳恒鑌稱，他們成功進入會議室後，議員范國威曾一路向前推，推跌了陳的眼鏡，當時他站在石禮謙左面，見到林卓廷不斷在石身後說話，他認為林可能在滋擾石，但因太嘈吵，他聽不到林在說甚麼。陳稱及後他被范爬上膊頭壓住，之後范亦跌倒在地，陳則行開，並於事後到瑪麗醫院就醫。陳接受辯方盤問時被質疑，陳聲稱林滋擾石只是其揣測，陳反駁是常識，但他承認不知道石是否覺得被林滋擾。辯方又指當時現場嘈吵，需要靠近石才可以聽到他說甚麼，陳不同意此說法並稱石當時已「好大聲嗌」。

周浩鼎下午供稱，他當日護送石禮謙到場開會，當時有人阻止會議進行，包括「搶咪」，而他當時的位置與林卓廷相距比較遠，他聽到林「講嘢」，但「未必聽得晒」。周又指見到林曾拉石禮謙，但未能說出林拉石的哪個部位。辯方質疑周看不到案發過程，又質疑周與泛民主派素有積怨，故作供時誇大其詞，他則稱不會因為政治取態而影響作供。

案件編號：ESCC 2514/2019"
bkn-20250929151451893-0929_00822_001,李強在京會見崔善姬願深化合作維護共同利益,2025-09-29 15:14,2025-09-29 16:24,https://hk.on.cc/cnt/news/20250929/bkn-20250929151451893-0929_00822_001.html,"李強在京會見崔善姬　願深化合作維護共同利益


中國國務院總理李強周一（29日）在北京人民大會堂會見北韓外相崔善姬，指出中方始終從戰略高度和長遠角度看待和推動中朝關係發展，願同朝方繼續深化協作，更好維護中朝共同利益，希望兩國外交部門加強對接，穩步推進各項工作。<br/><br/>李強表示，中朝山水相鄰、世",北京,oncc,2025-09-29 17:30,"中國國務院總理李強周一（29日）在北京人民大會堂會見北韓外相崔善姬，指出中方始終從戰略高度和長遠角度看待和推動中朝關係發展，願同朝方繼續深化協作，更好維護中朝共同利益，希望兩國外交部門加強對接，穩步推進各項工作。

李強表示，中朝山水相鄰、世代友好，有着歷久彌堅的深厚友誼，願同朝方一道落實兩黨兩國最高領導人共識，進一步弘揚傳統友好，加強戰略溝通，共同推進兩國社會主義事業，更好造福兩國人民。中方願同朝方密切各層級交流互動，加深相互了解和友誼，開展各領域務實合作，攜手促進共同發展。中方讚賞朝方在涉及中國核心利益和重大關切問題上，始終給予中方堅定支持。

崔善姬表示，鞏固和發展對華關係是朝方堅定不移的立場，符合兩國和兩國人民的根本利益。朝方完全支持中方的構建人類命運共同體理念和四大全球倡議，將繼續在台灣、涉疆、涉藏、涉港等涉及中國核心利益問題上堅定支持中方立場。朝方期待同中方共同落實兩黨兩國最高領導人重要共識，加強高層往來，密切兩國外交部門溝通，促進務實合作，深化多邊協作。

周一在北京舉行的中國外交部記者會上，被問中方是否支持北韓為自衞使用和發展核武器時，發言人郭嘉昆表示，中方在朝鮮半島問題上的立場和政策保持連續性穩定性，將繼續以自己的方式，為維護半島和平穩定、推動半島問題政治解決進程發揮建設性作用。"
bkn-20250929150555019-0929_00822_001,重慶政協前副主席及南京人大前主任　涉受賄遭雙開,2025-09-29 15:05,2025-09-29 15:05,https://hk.on.cc/cnt/news/20250929/bkn-20250929150555019-0929_00822_001.html,重慶政協前副主席及南京人大前主任　涉受賄遭雙開,中國,oncc,2025-09-29 15:15,"中央紀委國家監委周日（28日）通報，分別對重慶市政協前黨組成員、副主席段成剛，以及江蘇省南京市人大常委會前黨組書記、主任龍翔嚴重違紀違法問題立案審查調查，決定開除兩人的黨籍和公職。

調查指，段成剛結交政治騙子，接受可能影響公正執行公務的宴請和旅遊安排；違規收受禮金，違規從事營利活動，違規干預和插手政府採購；大搞權錢交易，利用職務便利為他人在企業經營、工程承攬等方面謀利，並非法收受巨額財物。龍翔亦被發現違規收受禮品、禮金，利用職權為親友經營活動謀取利益，大搞權錢交易和錢色交易；違規干預和插手司法活動和執紀執法活動，侵吞公共財物；徇私舞弊、濫權妄為，致使公共財產、國家和人民利益遭受重大損失。

兩人的行為均構成嚴重職務違法並涉嫌受賄犯罪，且在黨的十八大後不收斂、不收手，性質嚴重，影響惡劣。除了雙開，段成剛亦遭終止其重慶市第六次黨代會代表資格。當局收繳兩人的違紀違法所得，將其涉嫌犯罪問題移送檢察機關審查起訴，所涉財物一併移送。"
bkn-20250929150017645-0929_00822_001,王文濤晤俄經濟發展部長　願推動貨物貿易升級,2025-09-29 15:00,2025-09-29 15:00,https://hk.on.cc/cnt/news/20250929/bkn-20250929150017645-0929_00822_001.html,王文濤晤俄經濟發展部長　願推動貨物貿易升級,北京,oncc,2025-09-29 15:15,"中國商務部周一（29日）發布消息，商務部部長王文濤周日（28日）與俄羅斯經濟發展部部長列舍特尼科夫在北京，共同主持召開中俄總理定期會晤委員會經貿合作分委會第28次會議，表示願推動兩國貨物貿易等不斷升級。

王文濤指出，近年在兩國元首戰略引領下，中俄經貿關係持續健康發展。中方願推動兩國貨物貿易、服務貿易不斷提質升級，拓展數字經濟、電子商務等新興領域合作，增進地方間經貿交往，共同維護以世貿組織為核心的多邊貿易體制。

列舍特尼科夫表示，俄方願保持雙邊貿易穩定發展，通過跨境電商擴大對華出口俄優質產品，歡迎中國企業來俄投資，加強在金磚、上海合作組織、二十國集團（G20）等區域合作機制內的溝通、協調。會議期間，分委會下設各工作組分別匯報相關領域合作進展，雙方會後共同簽署《會議紀要》。"
bkn-20250929144735498-0929_00822_001,家教推廣計劃今起接受申請　參與機構需舉辦家庭相關主題活動,2025-09-29 14:47,2025-09-29 14:47,https://hk.on.cc/cnt/news/20250929/bkn-20250929144735498-0929_00822_001.html,家教推廣計劃今起接受申請　參與機構需舉辦家庭相關主題活動,香港,oncc,2025-09-29 15:00,"由民政及青年事務局及家庭議會推出、2025至26年度的「家庭教育推廣計劃」，今日（29日）起至下月28日期間接受非牟利機構申請。參與機構需舉辦與家庭相關的主題活動，例如新手父母教育、親子教育、增強家庭凝聚力，以及一些與婚姻有關的主題等，以照顧不同家庭的需要。每項為期12個月及18個月的項目，資助上限分別為80萬港元及120萬港元。

當局表示，「家庭教育推廣計劃」於去年10月推出，資助民間推行非牟利的家庭教育項目。參與機構的建議項目可同時涵蓋多於一個主題，但所有主題必須與家庭相關。除上述的主題之外，申請機構亦可因應社會關注的議題或需要，就其他與家庭相關的主題申請資助，以舉辦合適的項目。"
