id,title,date,last_update,url,lead,section,source,scrape_time,news_content
bkn-20260105114807898-0105_00822_001,冬季季候風將殺到　明早最低12°C　周三周四持續寒冷,2026-01-05 11:48,2026-01-05 12:30,https://hk.on.cc/cnt/news/20260105/bkn-20260105114807898-0105_00822_001.html,冬季季候風將殺到　明早最低12°C　周三周四持續寒冷,香港,oncc,2026-01-05 12:45,"冬季季候風會在今日稍後逐漸影響廣東沿岸地區。天文台在今早(5日)11時40分發出特別天氣提示，指本港晚間天氣轉冷，明日(6日)早上市區最低氣溫會在攝氏12度左右。天文台預料季候風影響華南的時間相對較長，周三、四(7日及8日)早上仍會持續寒冷，市區最低氣溫在攝氏11、12度左右，新界再低幾度，日間非常乾燥。

根據分區天氣預報，明日打鼓嶺最低氣溫跌至攝氏7度，上水及石崗亦只得攝氏9度。周三持續寒冷，7區降至個位數，打鼓嶺最低氣溫進一步降至攝氏6度，上水及石崗跌1度至攝氏8度，流浮山、大埔、沙田及將軍澳亦只得攝氏9度。"
bkn-20260105113940381-0105_00822_001,Botox命案九旬名醫另涉21罪　因身體不適合答辯　獲撤全部罪名,2026-01-05 11:39,2026-01-05 11:39,https://hk.on.cc/cnt/news/20260105/bkn-20260105113940381-0105_00822_001.html,Botox命案九旬名醫另涉21罪　因身體不適合答辯　獲撤全部罪名,香港,oncc,2026-01-05 13:15,"2018年11月發生香港首宗打肉毒桿菌針奪命個案，52歲女銀行家張淑玲懷疑在接受肉毒桿菌針(Botox)注射兩小時後昏迷，送院後不治。當時作為主診醫生的名醫李宏邦被控一項誤殺罪，他於去年10月被裁定有做出誤殺罪中行為，但因精神狀況而獲無條件釋放。他就上述誤殺案涉誤導警員及違反《危險藥物規例》的案件今(5日)在九龍城裁判法院再訊，裁判官應控方申請撤回針對李的所有控罪。

被告李宏邦現年93歲。他原被控2項企圖誤導警員罪，12項「沒有備存有關危險藥物的登記冊」罪，及7項「沒有以附表一指明的格式備存有關危險藥物的登記冊」罪。

控方今表示已再索取法律意見，因李的身體狀況不適合答辯，申請撤銷針對他的所有指控，裁判官撤回針對李的所有控罪。

控罪指被告於2018年11月11日在尖沙咀堪富利士道格蘭中心的「李宏邦美容整形集團」，指稱張淑玲於當日下午因哮喘病到訪被告的診所，企圖誤導高級警員劉樹生及警署警長方志強。另外，被告被指身為獲授權管有及供應危險藥物的人，沒有根據該條例制訂的《危險藥物規例》備存登記冊，並沒以該規例的指明格式記下他所獲得或由他供應的危險藥物。涉及的危險藥物當中含有安定、咪達唑侖、氟硝西泮、甲基苯丙胺及氯胺酮等成分。

案件編號：KCCC 1283/2019"
bkn-20260105112229359-0105_00822_001,內地擬修訂人民警察法　增保障制度等規定,2026-01-05 11:22,2026-01-05 11:22,https://hk.on.cc/cnt/news/20260105/bkn-20260105112229359-0105_00822_001.html,內地擬修訂人民警察法　增保障制度等規定,中國,oncc,2026-01-05 11:30,"公安部起草《中華人民共和國人民警察法（修訂草案稿）》，以加強人民警察隊伍建設，規範和保障人民警察依法履行職責、行使職權，周日（4日）起向社會公開徵求意見。其中，草案稿增加了人民警察隊伍建設的指導思想、人民警察保障制度、中國人民警察節等原則性規定。

修訂草案稿共103條，分為總則、職責和職權、組織管理、警務和職業保障、教育訓練、執法監督、紀律和懲戒、附則8章。根據人民警察隊伍變化實際，從人民警察範圍中刪去勞動教養管理機關的人民警察，增加司法行政機關的戒毒人民警察。草案稿完善公安機關的人民警察職責職權規定，同時增加國家安全機關的人民警察、司法行政機關的監獄、戒毒人民警察和人民法院、人民檢察院的司法警察職責職權內容；優化交通和現場管制、行政強制和行政處罰、採取刑事措施等現有規定，增加服務人民、報警服務平台、警力調動使用、職權行使適度原則等內容。

此外，草案稿明確應承擔紀律法律責任的行為及終身追究責任或問責的規定，完善停止執行職務和禁閉規定，增加人民警察機關責任和對未依法履行職責、超越法定職責範圍行使職權相關人員的懲戒等規定。起草說明指出，進入新時代，國際國內形勢和人民警察擔負的使命任務發生新的複雜深刻變化，黨和人民對人民警察隊伍建設提出新的更高要求，現行人民警察法已不能適應新時代新要求，有必要全面修改完善。"
bkn-20260105111737082-0105_00822_001,北部都會區統籌辦主任今日履新　蘇惠思：將藍圖細化提速提質,2026-01-05 11:17,2026-01-05 11:17,https://hk.on.cc/cnt/news/20260105/bkn-20260105111737082-0105_00822_001.html,北部都會區統籌辦主任今日履新　蘇惠思：將藍圖細化提速提質,香港,oncc,2026-01-05 12:45,北部都會區統籌辦主任蘇惠思今日(5日)履新。她表示，北部都會區已有發展藍圖，上任後的首要任務是將藍圖細化、提速、提質，盡量做到最好，為香港及國家帶來最大的利益。
bkn-20260105111012755-0105_00822_001,元朗商廈不遵清拆令　3共同業主被判罰逾23萬元,2026-01-05 11:10,2026-01-05 11:10,https://hk.on.cc/cnt/news/20260105/bkn-20260105111012755-0105_00822_001.html,元朗商廈不遵清拆令　3共同業主被判罰逾23萬元,香港,oncc,2026-01-05 13:15,"元朗褔德街一幢商住大廈3名共同業主由於不遵從根據《建築物條例》(第123章)發出的清拆令，於上周五(2日)在屯門裁判法院被定罪及判罰款合共230,820港元，當中221,820港元屬就罪行持續的日數所判的罰款。

個䅁涉及元朗褔德街一幢商住大廈天井的一個面積約7平方米的搭建物及一個金屬架，以及外牆附建的一個面積約3平方米的伸建物、3個金屬架及2個帆布篷。該等僭建物並無事先獲得屋宇署的批准及同意，屋宇署根據《建築物條例》第24(1)條向業主發出一張清拆令。他們沒有履行清拆令，故遭屋宇署檢控。

根據《建築物條例》，任何人無合理辯解而沒有遵從清拆令是嚴重罪行，一經定罪，最高可處罰款200,000港元及監禁1年，及可就罪行持續的每一天，另處罰款最高20,000港元。"
bkn-20260105110226024-0105_00822_001,西九龍公路兩車相撞　 一司機受傷被困獲救送院,2026-01-05 11:02,2026-01-05 11:02,https://hk.on.cc/cnt/news/20260105/bkn-20260105110226024-0105_00822_001.html,西九龍公路兩車相撞　 一司機受傷被困獲救送院,香港,oncc,2026-01-05 11:30,西九龍公路發生交通意外。今日(5日)早上10時46分，一輛吊臂車及一輛泥頭車沿路往西隧方向行駛，至近大角咀港鐵奧運站對開時，吊臂車因應交通情況收慢車速，尾隨泥頭車收掣不及撞向前車車尾。泥頭車司機受傷被困，救援人員接報到場將清醒傷者救出，交救護車送院治理，人員圍封部分行車線，調查肇事原因。
bkn-20260105110133117-0105_00822_001,特朗普：不認為在委行動會影響對華關係,2026-01-05 11:01,2026-01-05 11:01,https://hk.on.cc/cnt/news/20260105/bkn-20260105110133117-0105_00822_001.html,特朗普：不認為在委行動會影響對華關係,中國,oncc,2026-01-05 11:15,"美國總統特朗普周日（4日）在專機空軍一號向隨行記者表示，不認為在委內瑞拉的行動會影響他與北京的關係。

特朗普指自己與北京有非常好的關係，美國有關稅權力，北京也有其他權力可以制約美國。他重申，計劃今年4月訪問中國。

美軍上周六（3日）突襲委內瑞拉首都加拉加斯抓捕該國總統馬杜羅及其妻子，中方呼籲美國立即釋放馬杜羅夫婦，對美國公然對一個主權國家使用武力深感震驚，強烈譴責。中國是委內瑞拉石油的主要買家，兩國關係長期以來保持密切。"
bkn-20260105110017754-0105_00822_001,李在明出席中韓商務論壇　擴大兩國經濟合作,2026-01-05 11:00,2026-01-05 11:00,https://hk.on.cc/cnt/news/20260105/bkn-20260105110017754-0105_00822_001.html,李在明出席中韓商務論壇　擴大兩國經濟合作,北京,oncc,2026-01-05 11:15,"南韓總統李在明周一（5日）繼續訪華行程，他將在北京出席中韓商務論壇，強調擴大兩國經濟合作的重要性，並促進民間領域展開積極交流。南韓大企業集團掌門人將悉數出席，與中方工商界人士共同探討今後合作交流方向。

青瓦台公布出席論壇的兩國企業代表名單，韓方包括三星電子會長李在鎔、SK集團會長崔泰源、現代汽車會長鄭義宣、LG集團會長具光謨、POSCO集團會長張仁和、GS集團會長許兌秀、LS集團會長具滋殷、希傑（CJ）集團會長李在賢等人出席。中方則有中國貿易促進委員會會長任鴻斌、中石化集團董事長侯啟軍、中國能源建設集團董事長倪真、中國工商銀行董事長廖林、TLC科技集團董事長李東生、寧德時代董事長曾毓群等人與會。

今年正值南韓獨立運動家金九誕辰150周年暨大韓民國上海臨時政府成立100周年，李在明將於周三（7日）前往上海訪問大韓民國臨時政府舊址。分析認為，日本首相高市早苗上台後在歷史問題上的強硬立場，對韓日關係構成挑戰，李在明選擇在此地點與中國共同追溯抗日歷史記憶，是在向日本表明歷史問題並未翻篇。"
bkn-20260105102122303-0105_00822_001,樓宇維修貪污　物管界籲業主親身出席　法團有責任核實授權票,2026-01-05 10:21,2026-01-05 10:21,https://hk.on.cc/cnt/news/20260105/bkn-20260105102122303-0105_00822_001.html,樓宇維修貪污　物管界籲業主親身出席　法團有責任核實授權票,香港,oncc,2026-01-05 11:15,"廉政公署早前先後拘捕共21名人士，打擊一個有黑社會背景人士操縱的樓宇維修貪污團夥。香港物業管理公司協會發言人陳志球今日(5日)提醒市民，如法團審議涉及大維修等切身議題，業主最好親身出席，而法團或管理公司有責任核實授權票的真確性，包括核對業主身份。

陳志球指出，過往有不法分子冒充法團代表或關愛隊，以取得業主信任。他認為，業主應避免將投票權授權給不認識的人，而法團或管理公司有責任核實授權票的真確性，包括核對業主身份，收到授權書後亦要將回條放到業戶信箱內，相關授權書要保留至少12個月，以便日後跟進。

據悉，樓宇維修貪污案件涉及翠屏(北)邨及合和大廈的相關工程。翠屏北邨較多老年人口，加上早前法團主席病逝，原本今月將召開業主大會填補委員出缺。九龍東立法會議員鄧家彪表示，在廉署介入後，相關會議不應再進行，房署及民政事務署亦應介入。

鄧家彪預料政府會因應近日涉及圍標的爭議，修訂建築物管理條例，現時法例就同一人可獲多少授權票未有設限，有聲音要求簽署授權書時需有第三方在場，但當局擔心會增加取得授權票的難度，導致未能召開業主大會。他建議，日後授權票應列明議程內需投票的項目，又認為政府應增加法團事務主導權，包括設招標系統，或推薦法團使用政府指定的承辦商等。"
bkn-20260105100212617-0105_00822_001,內地網紅受騙赴柬賺錢　雙腿骨折遭丟棄西港街頭,2026-01-05 10:02,2026-01-05 10:02,https://hk.on.cc/cnt/news/20260105/bkn-20260105100212617-0105_00822_001.html,內地網紅受騙赴柬賺錢　雙腿骨折遭丟棄西港街頭,中國,oncc,2026-01-05 10:15,"內地一名20歲女網紅據報被男友騙至柬埔寨賺錢，慘受折磨，雙腿疑似骨折，遭丟棄在西港街頭，當時她臉上污黑，頭髮凌亂打結，與之前光鮮亮麗的形象相比判若兩人。中國駐柬使館周一（5日）回應指，使館駐西哈努克領辦已在當地醫院找到她，並聯絡其家屬赴柬辦理接她回國事宜。

近日多名網民發文稱，福建籍女網紅吳甄楨（Umi）在柬埔寨街頭流浪，面目憔悴，腿部疑受傷，手中拿着一張電腦斷層掃描（CT）照片。網傳她的短片平台抖音帳號顯示，她有2.4萬名粉絲，去年4月14日她在抖音發布第二條影片，當時IP位址已標記為柬埔寨，背景疑在一間酒吧，之後發布10段片，IP全都在柬埔寨，上月6日發布最後一段片後失聯。有知情網民透露，她是跟福建男友赴柬賺錢，剛到埗時常在社交帳號展示穿新裙、吃美食、唱K等日常。

中國駐柬使館回應指，得知吳女情況後立即聯絡柬埔寨警方等多個部門及當地熱心人士了解核實，上周六（3日）下午在西港一間醫院找到她，當時身體狀況很差，領辦當即協調將她轉送至另一間醫院救治。吳女透露，她受「高薪工作」誘惑赴柬，後流落街頭，目前身體狀況有所好轉。使館提醒中國公民，所謂海外「高薪招聘」訊息，很多涉及網賭電詐、黃賭毒等灰黑產業，切勿輕易聽信傳言，以自身安全甚至生命為代價鋌而走險。"
bkn-20260105100123832-0105_00822_001,網售茅台每日限購量減半　首日賣逾10萬瓶,2026-01-05 10:01,2026-01-05 10:01,https://hk.on.cc/cnt/news/20260105/bkn-20260105100123832-0105_00822_001.html,網售茅台每日限購量減半　首日賣逾10萬瓶,貴州,oncc,2026-01-05 11:15,"貴州茅台元旦日起在官方銷售平台「i茅台」推出飛天茅台酒，掀起搶購熱潮。春節將至，i茅台宣布調整每人每日可購買新飛天茅台數量，由12瓶減至6瓶，以滿足更多客戶需求。

貴州茅台早前發布消息，元旦當日上午9時，53度/500毫升飛天貴州茅台酒在i茅台App上正式開賣，售價每瓶1,499元人民幣（約1,680港元），每人每日最多可買12瓶。雖然貴州茅台方面未公布新飛天茅台的具體投放量，但據「小茅i茅台」微信公號透露，元旦假期超過10萬名客戶購買到產品。上述產品推出後，連續多日遭瘋搶，每日上午9時起產品隔5分鐘放貨一次，但多輪補貨均售罄，不到半小時購買頁面顯示產品「已售罄」。

內地企業資訊查詢平台顯示，貴州愛茅台數字科技有限公司已於上周四（1日）註冊成立，從事互聯網和相關服務為主，由貴州茅台酒股份有限公司全資持股。有酒類分析師表示，新公司成立可能負責專門整合營運i茅台相關業務，有助茅台強化私域營運、精準營銷能力，加速渠道扁平化，構建線上線下融合的銷售生態。"
bkn-20260105095020838-0105_00822_001,機場出境行李藏胡椒噴霧及伸縮棍　17歲赴美本地女被捕,2026-01-05 09:50,2026-01-05 09:50,https://hk.on.cc/cnt/news/20260105/bkn-20260105095020838-0105_00822_001.html,機場出境行李藏胡椒噴霧及伸縮棍　17歲赴美本地女被捕,香港,oncc,2026-01-05 10:15,"機場區警員昨日(4日)接獲機場保安人員報案，指為出境旅客進行安全檢查期間，發現有一件手提行李內藏有懷疑違禁物品，而該件手提行李屬於一名打算前往美國的17歲本地女子。

警員接報到場並作出調查，及後該名女子因涉嫌違反《火器及彈藥條例》及《航空保安條例》被捕。調查顯示，該名女子涉嫌於其手提行李內藏有一枝懷疑胡椒噴霧及一枝懷疑伸縮棍，她已獲准保釋候查。"
bkn-20260105094549258-0105_00822_001,夏冬流感會否重疊　劉宇隆：無講得準　惟凍加假後復課料感染增,2026-01-05 09:45,2026-01-05 10:20,https://hk.on.cc/cnt/news/20260105/bkn-20260105094549258-0105_00822_001.html,夏冬流感會否重疊　劉宇隆：無講得準　惟凍加假後復課料感染增,香港,oncc,2026-01-05 10:30,"衞生防護中心指，自去年9月初開始的夏季流感季節，有機會於未來一至兩周完結。疫苗可預防疾病科學委員會主席、港大兒童及青少年科學系講座教授劉宇隆表示，夏季流感季節與即將來臨的冬季流感季節會否重疊「無講得準」，又指天氣轉冷有機會令流感病毒活躍，加上學生假後復課，感染有機會再回升，建議市民外出時戴口罩，未接種流感疫苗的市民盡快接種。他相信能有效降低冬季流感高峰期的峰值，減低對醫療系統的壓力。

劉宇隆今日(5日)在電台節目上表示，夏季流感由去年9月初開始，但當局安排的疫苗接種計劃由9月中下旬開始，導致夏季流感高峰間學校及院舍個案大幅增加至約1,200宗，令醫療系統衝擊。他補充指，基於世衞組織公布新疫苗和採購物流等因素下，流感針難以提早開始安排採購接種。

衞生防護中心表示，截至元旦，夏季流感高峰期錄得25宗涉及兒童流感嚴重個案，包括3宗死亡個案。劉宇隆指，大部分嚴重和死亡個案都未接種疫苗，6個月大至2歲幼兒接種率只有22%。他稱疫苗可預防流感嚴重或死亡個案，呼籲家長盡快安排子女接種。

學校方面，資助小學校長會主席陳淑儀在同一節目上表示，去年10至12月，老師及學生感染流感個案有增加，零星班別出現爆發，同時不少學校10至11月已安排到校注射疫苗。為預防流感，陳淑儀指學校已加強管控傳染病及做好衞生措施，要求學生每日量度體溫，也有透過通告呼籲家長做好家居衞生。學校亦會每日留意缺席情況，問清楚學生缺席是否涉及感染流感，如有班別有較多學生感染，會立即通知衞生防衞中心。"
bkn-20260105092540137-0105_00822_001,日間乾燥和暖最高22°C　今晚顯著轉涼,2026-01-05 09:25,2026-01-05 09:25,https://hk.on.cc/cnt/news/20260105/bkn-20260105092540137-0105_00822_001.html,日間乾燥和暖最高22°C　今晚顯著轉涼,香港,oncc,2026-01-05 09:45,"廣東地區天色大致良好。此外，華南北部的氣壓正在上升，預料一股冬季季候風會在今日(5日)稍後逐漸影響廣東沿岸。今早9時天文台錄得氣溫攝氏17度，相對濕度百分之77。過去一小時，京士柏錄得的平均紫外線指數是0.6，強度屬於低。

天文台預測今日天晴，日間乾燥及和暖，最高氣溫約攝氏22度，吹和緩北至東北風，稍後風勢清勁，今晚顯著轉涼。展望未來兩三日早上市區最低氣溫在攝氏12、13度左右，新界再低幾度，天晴及非常乾燥，日夜溫差頗大。"
bkn-20260105091019934-0105_00822_001,台立委倡改兩岸關係定位　國台辦斥推動「法理台獨」,2026-01-05 09:10,2026-01-05 09:10,https://hk.on.cc/cnt/news/20260105/bkn-20260105091019934-0105_00822_001.html,台立委倡改兩岸關係定位　國台辦斥推動「法理台獨」,中國,oncc,2026-01-05 09:15,"台灣民進黨逾20名立委聯署提案修改《兩岸人民關係條例》，將法律名稱改為《台灣與中華人民共和國人民關係條例》，又主張刪除原條文中「國家統一前」字眼及以「地區」稱呼兩岸。大陸國台辦發言人陳斌華周日（4日）回應批評，該提案赤裸裸推動「法理台獨」，蓄意升高兩岸緊張局勢，破壞台海及地區和平穩定。

陳斌華表示，陸方高度關注有關動向，指摘該提案罔顧台灣社會主流民意和台灣同胞平安福祉，公然挑戰台灣是中國一部分的歷史和法理事實，妄圖改變世界上只有一個中國、大陸和台灣同屬一個中國的台海現狀，用心險惡、性質惡劣，充分說明賴清德當局和民進黨是不折不扣的「和平破壞者」、「危機製造者」、「戰爭煽動者」。

陳斌華警告，「台獨」意味戰爭，是死路、是絕路，陸方有充分信心和足夠能力粉碎任何形式的「法理台獨」圖謀，決不允許「台獨」分裂勢力以任何名義、任何方式把台灣從中國分裂出去。他又指，如「台獨」分裂勢力膽敢鋌而走險、觸碰紅線，陸方必將依據《反分裂國家法》，採取斷然措施，予以迎頭痛擊。"
bkn-20260105090212444-0105_00822_001,美襲委致周邊多地航班取消華人被攆下機　在委華企暫歇業,2026-01-05 09:02,2026-01-05 14:43,https://hk.on.cc/cnt/news/20260105/bkn-20260105090212444-0105_00822_001.html,美襲委致周邊多地航班取消華人被攆下機　在委華企暫歇業,中國,oncc,2026-01-05 14:45,"美軍上周六（3日）空襲委內瑞拉並扣押該國總統馬杜羅，周邊航空交通大受影響，多個機場航班取消。有從波多黎各赴美的華人透露，登機後被攆下飛機。委內瑞拉加拉加斯華人商會會長聶均常則指，華使館已通知當地所有中資企業暫時歇業。

在波多黎各進行新年旅行的顧女士向內媒透露，自己乘搭從聖胡安飛往美國費城的航班，起飛時間為當地時間上周六凌晨3時，她登機後就在座位上睡了，後來突然被身邊的人搖醒，說現在要立刻下飛機，然後去取走行李離開機場。被攆下飛機的乘客不停追問航班臨時取消的原因，機組人員沒正面回答，僅不斷重覆「去看新聞吧」。顧女士稱，當時機場航班資訊屏上顯示，全部目的地是美國的航班均已取消。

委內瑞拉康維亞薩航空上周六宣布，由於不可抗力因素，原定周一（5日）凌晨3時起飛、由廣州飛往加拉加斯的V0771航班已取消。該航線為中國唯一直飛委內瑞拉的航線，加拉加斯飛往廣州的V0770次航班則已於周日（4日）安全降落，之後將以空機不載客的形式返委。廣東恩平籍僑領聶均常表示，美軍攻擊時當地很多中資企業都放假，加拉加斯的中國僑民暫未傳出傷亡，但被轟炸地區陷入停水停電，未來如何將聽大使館及僑社指令。"
bkn-20260105082105479-0105_00822_001,廈門首條直飛釜山包機航線開通　每周4班,2026-01-05 08:21,2026-01-05 08:21,https://hk.on.cc/cnt/news/20260105/bkn-20260105082105479-0105_00822_001.html,廈門首條直飛釜山包機航線開通　每周4班,福建,oncc,2026-01-05 09:45,"由空中巴士A321客機執飛的釜山航空BX3795航班，周日（4日）搭載200多名旅客從南韓釜山飛抵福建廈門高崎國際機場，標誌着廈門首條直飛往返釜山國際航線開通，也是廈門機場今年首條新增國際航線。

廈門高崎國際機場原本已有廈門航空、大韓航空兩間航空公司營運往來南韓航線，其中廈門航空MF871/872航班與大韓航空KE125/126航班每周合計執飛廈門至首爾航線28架次。此次新增的廈門直飛往返釜山航線，為南韓旅行社旅遊包機性質，計劃從周日執飛至3月1日，每周執飛4架次。

廈門邊檢總站高崎邊檢站數據顯示，去年廈門口岸出入境旅客量超600萬人次，同比增長近20%；其中往來中韓兩國的旅客量近19萬人次，同比增長超45%。"
bkn-20260105080233060-0105_00822_001,公路多車追尾車禍　大巴驚險懸空橋外,2026-01-05 08:02,2026-01-05 08:02,https://hk.on.cc/cnt/news/20260105/bkn-20260105080233060-0105_00822_001.html,公路多車追尾車禍　大巴驚險懸空橋外,河南,oncc,2026-01-05 08:15,"河南省開封市祥符區上周五（2日）能見度降低，S220線黃河公路大橋北段先後發生3宗交通事故。網傳照片可見，在其中一宗為6車連環相撞車禍，一輛巴士車頭損毀嚴重，前半截車身甚至衝破護欄懸空，所幸未造成人命傷亡。

車禍發生後，當地交警與公路部門迅速到場處置，實施交通管控並設置警示標誌。上述巴士一共載有6人，包括司機在內，當時正由長垣縣開往商丘市。直至上周五中午，事故處理完畢，大橋交通恢復正常。

開封市氣象台事前曾發布大霧黃色預警，交警亦多次發出警示。有專家提醒，冬季大霧天氣行車需特別注意安全，應合理使用燈光、控制車速及保持車距，避免急煞及盲目超車，如遇事故務必遵循「車靠邊，人撤離，即報警」原則。"
