id,title,date,last_update,url,lead,section,source,scrape_time,news_content
bkn-20250930080858173-0930_00822_001,玄學大師詐騙團夥落網　逾3000人受騙,2025-09-30 08:08,2025-09-30 08:08,https://hk.on.cc/cnt/news/20250930/bkn-20250930080858173-0930_00822_001.html,玄學大師詐騙團夥落網　逾3000人受騙,江蘇,oncc,2025-09-30 08:15,"江蘇省泰州市姜堰區警方近日成功破獲一個以玄學大師為名詐騙團夥，抓獲陳某等71名疑犯，同時凍結超過2,000萬元（人民幣，下同，約2,180萬港元）涉案資金，估計全國超過3,000人受騙。上述71人目前因涉嫌詐騙罪而被依法採取刑事強制措施，案件仍在偵辦當中。

姜堰居民傅女士6月在手機上看到免費算命廣告，聲稱能提供消災解厄課程。由於家人健康出現問題，她添加對方聊天軟件帳號，先後支付3,999元（約4,359港元）及1.98萬元（約2.16萬港元）購買風水課程。由於對方隨後進一步索要10萬元（約10.9萬港元）現金作法消災，她在家人提醒下報警。

警方經調查發現，該詐騙團夥分工明確，形成「推廣引流—線上詐騙—售後服務」詐騙鏈條，又以「奇門遁甲」為名，兜售天價課程並誘騙受害者。執法人員分赴多地，搗毀兩處詐騙窩點，查扣逾800件涉案物品，凍結146個涉案帳戶。"
bkn-20250930080019439-0930_00822_001,「東華‧南昌匯」活力青年聚居地　共享空間共創生活,2025-09-30 08:00,2025-09-30 08:00,https://hk.on.cc/cnt/news/20250930/bkn-20250930080019439-0930_00822_001.html,「東華‧南昌匯」活力青年聚居地　共享空間共創生活,香港,oncc,2025-09-30 08:15,"越來越多年輕人渴望擁有屬於自己的居住空間，與知己伴侶共居成長、分享人生。由東華三院營運的「東華‧南昌匯」正好滿足了這份期望，為青年租戶提供安全、舒適、具社區感的居住選擇。

東網記者日前走訪位於深水埗的「東華‧南昌匯」青年宿舍，深入了解這個專為年輕人打造的嶄新生活空間。「東華‧南昌匯」設有一至四人宿位，配備多元化，靈活滿足不同青年住戶的生活需求。透過與多位住戶交流，記者感受到他們充滿活力、快樂自主的生活氛圍——有人與愛犬在平台草地享受陽光；有年輕伴侶攜手打造溫馨居所，從家居布置到露台賞景，樂享二人世界；還有與貓共居的青年，除單位寬敞讓人與貓都生活寫意外，還可飽覽開揚海景，生活質素大大提升，還可以感受與社區的連結。

自由工作與社群連結的理想生活

剛搬進「東華‧南昌匯」的黃穗琛（Akina），經常帶着陪伴她12年的迷你松鼠狗「小飛」在屋苑內玩樂。Akina與男友皆為自由工作者，一直渴望擁有舒適獨立的居住空間，好讓二人能專注工作，同時享受自在的生活節奏。對她而言，年長的「小飛」不只是寵物，更是家人，因此她特別希望找到寵物友善的居所。

「我知道『東華‧南昌匯』是唯一可以養狗的青年宿舍，便馬上申請入住！」她笑言。「小飛」體型小巧，性格溫馴，迅速適應新環境，每次到平台散步都顯得格外自在。除了能與愛犬共居，Akina亦分享，透過「東華‧南昌匯」結識了不少同齡住戶，逐漸建立起良好的鄰里關係。「大家年紀相近，很容易聊得來，現在我們會相約一同到社區買東西，邊走邊談，是非常難得的體驗。」她形容，這種鄰里間的互動，讓生活更添趣味。

安心共築二人世界的理想天地

拍拖四年的情侶何智仁（Ronald）與鄭佩妍（Athena），在一個雅緻的一房單位共築二人世界。甫進門，記者即被簡約而溫馨的佈置吸引。Ronald表示，他們理想的家居需具備獨立房間、乾濕分離的洗手間及交通便利，而「東華‧南昌匯」不但滿足這些要求，租金亦合理，因此很快便遞交申請。

「由於我們心儀九龍區，要交通便利，而租住的單位最好要『新淨』，不用花太多預算整理佈置。「東華‧南昌匯」鄰近深水埗站和南昌站，步行至港鐵站只需約五至八分鐘，平日上班或出外都非常方便，而且單位超級『新淨』，價錢亦在我們的預算範圍內，既舒適又不會造成太大負擔。」Athena對宿舍的地理位置相當滿意。

她亦特別喜歡單位設有開放式煮食空間，讓她下班後可一展廚藝。談到最喜愛的部分，她指室內擺設由租戶自定，當中她最喜歡的是放在客廳的特製屏風，既可遮擋陽光，又能分隔空間，令整體更具層次感。

Ronald則認為宿舍眾多設施中，健身室最為吸引。住戶可免費使用健身設施，不受地理及時間限制。雖然他平日不常運動，但入住後便萌生建立「運動人生」的念頭，期望在新環境中培養健康生活方式。

空間感升級　迎接生活新體驗

除了情侶合租，也有年輕人選擇在「東華‧南昌匯」體驗新生活。謝東燃（Tim）現居於面向開揚海景的單位，陽光開朗的他笑言，搬進來後最喜歡的就是窗外的景致：「看到海景整個人都舒服很多，每天放工回來就已經很開心了。」

Tim本身有養貓，過往與家人同住時空間有限，貓咪常困在籠中。「以前牠只能做『籠貓』，現在來到這裡，空間感大大提升，牠的活動空間也多了，亦開心了很多！」

他又分享，選擇「東華‧南昌匯」的其中一個原因，是希望與更多年輕人互動交流，嘗試不同生活體驗。他打算完成家居佈置後邀請朋友到家中聚會，也期望之後與鄰居一起健身，養成規律鍛鍊的生活方式。訪問當日，Tim亦換上一身運動服，與另一住戶Ronald一同到健身室鍛鍊，展現鄰里融洽、青年活力的一面。

活力社群　共建理想生活

「東華‧南昌匯」項目負責人鄭敏光（Mac）經常參與青年住戶的活動，了解他們對項目的看法與建議。他表示，項目至今已收到逾2,500個申請，反應非常踴躍。首批青年住戶入住短短兩個月，已深度投入這裡的生活，不僅喜歡舒適的居住環境，更積極參與各種活動。

「每次我們舉辦的活動都『超額認購』，有時甚至超過一倍。有些青年住戶更會自發組織街市買餸團、宵夜聚會、Board Game(桌遊)活動等。我們期望入住的年輕人有更多互動，感受到充實與歡樂的生活。」

縱向型青年社區概念

「東華‧南昌匯」不只是年輕人的家，更引入「縱向型青年社區」(Vertical Community) 概念，鼓勵青年住戶在共享空間認識朋友、交流互動，逐步建立一個互助互信的社交網絡，讓居住生活既快樂又有歸屬感。在入伙短短兩個月裡，「東華‧南昌匯」已舉辦多項活動凝聚住戶，並透過「V-Mile」計劃推動各類自我提升，社交及社區探索活動，如夜遊深水埗、MBTI性格工作坊及手沖咖啡體驗等，讓青年發掘興趣同潛能，在互動中共同成長。

Mac指，「東華‧南昌匯」的住戶對共居生活十分投入。8月23日的迎新聚會，約30名住戶齊聚6樓公共空間，享用到會美食，同時互相交流認識，氣氛良好。除了迎新活動，Mac笑言年輕人現時愛好咖啡文化，最近亦將舉辦手沖咖啡活動。住戶間也會自發舉辦糖水會，相約吃宵夜，增進感情。若他們要瞭解深水埗這個社區，就可參與「夜遊深水埗」，他形容每一次都有很多住戶報名，反應熱烈，「大家年紀相若又有共同話題，住在這裡真的多了一份人情味，大家生活都變得更開心、有趣。」

配套設施完善

「東華‧南昌匯」提供逾600個宿位(詳見圖表)，設有多個房型，適合一至四人申請入住。項目設有寵物友善單位，青年住戶可帶同寵物共住，建立和諧共融社區。

屋苑設施完善，除了提供獨立的住屋空間外，亦具備各項會所設備，包括器材齊全的健身室、隔音BAND 房、燒烤場，以至可遠眺社區景致的綠化公共空間，讓青年住戶相約三五知己，隨時隨地談天說地。

健身室更設連接電視屏幕的跑步機，既可鍛鍊身體又能遊戲競賽，寓運動於娛樂，促進健康生活習慣。

詳情請瀏覽：https://tnresidence.tungwahcsd.org/

(資訊及部分相片由客戶提供)"
bkn-20250930080014306-0930_00822_001,今日大致天晴　日間酷熱　最高氣溫33°C,2025-09-30 08:00,2025-09-30 08:00,https://hk.on.cc/cnt/news/20250930/bkn-20250930080014306-0930_00822_001.html,今日大致天晴　日間酷熱　最高氣溫33°C,香港,oncc,2025-09-30 08:15,"高空反氣旋正為廣東及南海北部帶來普遍晴朗的天氣。今日(30日)上午8時，天文台錄得氣溫攝氏28度，相對濕度85%。過去一小時，京士柏錄得的平均紫外線指數是0.5，強度屬於低。

酷熱天氣警告現正生效。預測今日大致天晴。日間酷熱，市區最高氣溫約攝氏33度，新界再高一兩度。吹微風。展望未來兩三日大致天晴及持續酷熱。周末期間風勢頗大及有驟雨。"
bkn-20250930070127482-0930_00822_001,醫保局披數據異常案　精準監管大數據,2025-09-30 07:01,2025-09-30 07:01,https://hk.on.cc/cnt/news/20250930/bkn-20250930070127482-0930_00822_001.html,醫保局披數據異常案　精準監管大數據,中國,oncc,2025-09-30 07:15,"內媒周一（29日）報道，依託全國統一醫保信息平台，國家醫保局近日查處多宗異常數據案例，展現大數據精準監管效能。

報道指，有醫院因數據填報不規範，出現「未知醫生」大量開藥，觸發系統報警；另有73歲老人被誤錄「無痛取卵」，實為「無痛胃腸鏡」，為醫生輸入錯誤所致。此外，一名醫生一分鐘內為多人開具司美格魯肽，經查實為醫藥代表冒用社保卡集中開藥，涉嫌違法違規，已移交查處。還有醫院因編碼對應錯誤，導致男性患者出現宮腔鏡紀錄，引起邏輯矛盾預警。

國家醫保局強調，定點醫藥機構須嚴格把控數據質量，醫保部門也將強化智能監測，共同築牢醫保基金防線，守護群眾「看病錢」及「救命錢」。"
bkn-20250930070057960-0930_00822_001,工聯會爭取擴大「一簽多行」　以盛事吸引旅客,2025-09-30 07:00,2025-09-30 07:00,https://hk.on.cc/cnt/news/20250930/bkn-20250930070057960-0930_00822_001.html,工聯會爭取擴大「一簽多行」　以盛事吸引旅客,香港,oncc,2025-09-30 07:15,"旅遊業是香港四大支柱行業之一，特區政府近年積極推動旅遊產業轉型，針對「深度遊」發展及「無處不旅遊」理念的樹立，推出系列配套措施。工聯會支持特區政府持續大力振興香港旅遊業，透過實地考察、訪問相關領域專家、訪港旅客問卷調研、設街站收集市民意見等，提出了多項針對性建議，挖掘本土歷史文化深度遊潛力及建設18區旅遊熱點。

強化國際旅遊城市樞紐美譽

國家為支持香港特區發展，多次出台惠港措施，2024年12月恢復並擴展深圳「一簽多行」個人遊簽注安排後，訪港旅客人次屢創新高，2025年1至8月共錄得約3,300萬訪港旅客人次，按年增加12%。

工聯會會長、立法會議員吳秋北，理事長、立法會議員黃國，立法會議員陸頌雄、郭偉强、梁子穎、鄧家彪及陳穎欣等，在《施政報告》諮詢期間與行政長官李家超會晤，就推動香港旅遊業的發展建言獻策，在產品、服務、體驗、制度、措施等方面持續創新完善，以提升國際競爭力，包括︰爭取擴大「一簽多行」至大灣區內更多城市及內地重點城市，以盛事吸引旅客；善用海島海岸旅遊資源大力發展海上旅遊，推動遊艇自由行；同時加強旅遊從業人員培訓，全面提升服務品質，讓遊客更深入感受香港文化，吸引世界各地遊客多來、常來。

壯大攤販經濟 促進多元創業

為振興小販經濟，活化文旅經濟，工聯會舉行「市」現新文旅「集」活小經濟攤販經濟圓桌會議，邀請不同業界代表共同探討如何結合香港本地特色與文化元素，提升市集吸引力；同時透過優化現有政策，鼓勵和支持市民透過開拓新型態攤販創業，促進攤販經濟的長遠發展。

工聯會立法會議員郭偉强表示，小販是城市活力的生動體現，承載著基層市民自食其力的拼搏精神，更是香港獨特的文化旅遊名片，卻受限於諸多條例規管。政府應提供切實支持，為打造香港特色旅遊體驗賦能。工聯會建議政府︰適度放寬攤販規管、完善牌照繼承機制、活化閒置攤位、試行特色主題街區、鼓勵多元業態組合，並推動智慧小販管理等，務求在秩序與活力間取得平衡，全面提升香港市集吸引力與競爭力。

挖掘本土歷史文化深度遊潛力

為培育和拓展具有香港及國際特色的旅遊項目，開拓多元化客源市場，進一步提升香港旅遊業的競爭力。工聯會立法會議員陸頌雄、郭偉强、梁子穎、鄧家彪和陳穎欣聯同工聯會區議員，透過地區服務網絡，以問卷、訪談、實地考察等方式，廣泛收集了各區居民、旅遊業相關協會及旅遊業工會的意見，篩選整理出62個旅遊熱點，從宣傳、翻新、改建、交通、設施配套、智慧旅遊平台以及旅遊路線等方面，整理《十八區旅遊熱點研究報告》，遞交至政府相關部門並提出切實可行的建議。

工聯會立法會議員吳秋北亦與團隊以香港島為研究樣本，實地考察多個地點及訪問相關領域專家，了解其旅遊偏好、出行習慣及消費意願等信息，就歷史文化資源的善用、旅遊設施配套、主題路線、業界支援等方面進一步向政府提出多項聚焦香港歷史文化深度遊發展的建議，包括︰加強保護霓虹燈、老字號店舖以及未獲得評級的特色建築等；將文學轉化為旅遊發展資源；推出一站式應用程式，完善資訊內容；持續激勵業界開發優質產品，激發體驗經濟潛能；設立高質量旅遊培訓課程及完善景點交通配套。

發展以愛國教育為主的紅色研學旅遊

工聯會立法會議員吳秋北曾在立法會上提出，政府應整合大灣區紅色資源，推動「一程多站」式愛國主義研學旅遊。他以東江縱隊當年對文化人士的大營救為例，指出該歷史事件的路線與多個內地城市密切相關，建議政府加強與大灣區內地城市合作，共同打造粵港澳紅色文化地圖。

工聯會樂見政府接納相關建議，並將其列入《2025年施政報告》，與深圳合作推廣以「中國文化名人大營救」為主題的紅色體驗研學新路線。而值得指出的是，工聯會的工會前輩曾親身參與當時的文化人士營救行動，保存大量珍貴史料與口述歷史。為此，工聯會建議政府應整合與善用工聯會豐富的紅色資源和人物故事，並結合實地研學，讓學生可親身走訪歷史遺址，感受先賢的愛國情操。工聯會認為推動紅色研學不應止於紀念歷史，更應融入課程與社區教育，讓愛國主義精神代代相傳。

(資訊及相片由客戶提供)"
bkn-20250930070008566-0930_00822_001,酷熱天氣警告仍然生效　巿民應慎防中暑,2025-09-30 07:00,2025-09-30 07:00,https://hk.on.cc/cnt/news/20250930/bkn-20250930070008566-0930_00822_001.html,酷熱天氣警告仍然生效　巿民應慎防中暑,香港,oncc,2025-09-30 07:30,"天文台在昨日（29日）中午12時20分發出酷熱天氣警告，至今仍然生效。在今日(30日)上午7時，天文台錄得氣溫攝氏27度，相對濕度百分之90。

本港受持續高溫天氣影響，市民應提高警惕，慎防中暑或因酷熱而引起不適，並需留意身體狀況。若出現頭暈、頭痛、惡心、氣促及神志不清等徵狀，應立刻休息和求助，並盡快求醫。長者、孕婦、嬰兒及小童、慢性病如心臟病或高血壓患者，以及過胖人士均較易中暑，應及時觀察是否出現中暑徵兆。

在炎熱天氣下或高溫環境中工作的人士，請參照勞工處的預防工作時中暑指引，採取所需的防暑措施。在戶外活動的人士，應多補充水分和不要過度勞累。於感覺不適時，應盡快到陰涼的地方休息。戶外活動宜安排在早上或下午較後的時間進行。"
bkn-20250930061349885-0930_00822_001,女子執意嫁年輕男友　父母憂受騙反目,2025-09-30 06:13,2025-09-30 06:13,https://hk.on.cc/cnt/news/20250930/bkn-20250930061349885-0930_00822_001.html,女子執意嫁年輕男友　父母憂受騙反目,河南,oncc,2025-09-30 06:15,"內媒周一（29日）報道，為了與年輕6歲男友結婚，河南省鄭州市王姓女子近日與父母爆發激烈衝突，雙方更在家中互毆、砸門摔爛古董，關係徹底破裂。

31歲的王女稱，父母指摘其25歲男友是騙子，令其感到窒息，正打算前往英國尋找男方。惟王女父母表示，女兒戀愛3個月內已被騙走100萬元（人民幣，下同，約109萬港元），還賣掉3套房產，如今竟提出要先給男友30萬元（約32.7萬港元）作為嫁妝，對方隨後將返還60萬元（約65.4萬港元）彩禮。

王女父親透露，女兒此前已索要超過30萬元，購買新車不久後便消失，逾20萬元（約21.8萬港元）同時蒸發。更不安的是，他們從未見過男方家人，對方聲稱父母在英國，還始終拒絕接聽電話，故強烈懷疑愛女遭遇「殺豬盤」騙局。"
bkn-20250930060220341-0930_00822_001,中國常駐聯合國代表呼籲　盡快平息加薩衝突,2025-09-30 06:02,2025-09-30 06:02,https://hk.on.cc/cnt/news/20250930/bkn-20250930060220341-0930_00822_001.html,中國常駐聯合國代表呼籲　盡快平息加薩衝突,中國,oncc,2025-09-30 06:15,"中國常駐聯合國代表傅聰周一（29日）在安理會以巴問題公開會上發言，呼籲盡快平息加薩衝突。

傅聰指，在第80屆聯大一般性辯論、落實兩國方案高級別會議等重要場合，國際社會就巴勒斯坦問題再次發出強有力的呼聲，要求立即停止殺戮、拯救生命、實現和平；這是維護公道正義的最基礎要求，更是人類道德良知的最基本底線。他又指，面對當前緊急局勢，國際社會應當團結起來，凝聚共識，秉持客觀公正立場，為解決巴勒斯坦問題作出更大努力。

傅聰強調，要以最大的緊迫感平息加薩衝突，當前以色列執意推進接管加薩城計劃，每天都有大量無辜平民喪生。中方敦促以色列立即停止在加薩地帶的一切軍事行動，切實履行佔領方義務，支持聯合國等人道機構開展援助。對以色列有特殊影響的國家應切實負起責任。

傅聰指出，要以有力行動緩解約旦河西岸緊張局勢。以色列吞並西岸的危險企圖將徹底葬送兩國方案前景，直接沖擊中東地區穩定，國際社會必須予以明確抵制和堅決反對。中方敦促以色列立即停止定居點活動、遏制定居者暴力、停止蠶食約旦河西岸領土、停止破壞巴勒斯坦民族權力機構的治理基礎。"
bkn-20250930051933730-0930_00822_001,油麻地執法部門車輛與的士撼撞　幸無人受傷,2025-09-30 05:19,2025-09-30 05:19,https://hk.on.cc/cnt/news/20250930/bkn-20250930051933730-0930_00822_001.html,油麻地執法部門車輛與的士撼撞　幸無人受傷,香港,oncc,2025-09-30 06:00,油麻地發生交通意外。今日(30日)凌晨4時28分，一輛警車沿海泓道往深水埗方向行駛、駛至麗翔道交界時，與一輛沿麗翔道往果欄方向行駛之的士相撞。警車車頭損毀，泵把亦近甩脫，的士則右車身受損，意外中無人受傷。的哥在場協助調查，意外原因有待進一步查證。據悉，警車事發時正在執勤中。
bkn-20250930051032373-0930_00822_001,富泰邨女子昏迷　送院後死亡,2025-09-30 05:10,2025-09-30 05:10,https://hk.on.cc/cnt/news/20250930/bkn-20250930051032373-0930_00822_001.html,富泰邨女子昏迷　送院後死亡,香港,oncc,2025-09-30 05:30,"昨日(29日)晚上11時18分，屯門富泰邨美泰樓一單位，上址住戶報案，指其妻姓黃(50歲)，懷疑在上址暈倒。

救援人員接報到場，發現女事主倒卧在上址一房間內昏迷。人員隨即將其由救護車送往屯門醫院救治，其後被證實死亡。案件列「送院時死亡」跟進，其死因有待驗屍後確定。"
bkn-20250930050106006-0930_00822_001,耗資1.8億人民幣鋪路　未滿一年塌陷,2025-09-30 05:01,2025-09-30 05:01,https://hk.on.cc/cnt/news/20250930/bkn-20250930050106006-0930_00822_001.html,耗資1.8億人民幣鋪路　未滿一年塌陷,四川,oncc,2025-09-30 05:15,"四川省綿陽市三台縣古井鎮至魯班水庫新建的公路，耗資1.8億元人民幣（約2億港元）建造，不過鋪好未滿一年已出現數十米塌陷，目前仍在施工修復之中。三台縣交通運輸局一名負責人澄清，該條公路並未通車，由於還在施工期，尚未驗收交付。

該條公路自2021年開始修建，古井鎮工作人員強調實際是一邊通車一邊建設，還未交付驗收。在前數天降雨過程中，有落石滾落砸毀公路，需封閉搶修。該鎮工作人員表示，搶修時間大概需要一個月。

另有村民表示，此前持續向古井鎮政府爭取修路佔地補償費，如今補償費問題尚未解決，路已出現問題。也有多名村民指出，公路早於2024年已竣工通車，不過鎮政府只向青苗等方面賠償，還未支付土地徵用及安置補償。該鎮政府則解釋，村道建設佔地無土地補償費，該鎮只是按照相關文件規定賠償。"
bkn-20250930044236163-0930_00822_001,屯門男子涉藏毒被捕　檢500元貨,2025-09-30 04:42,2025-09-30 04:42,https://hk.on.cc/cnt/news/20250930/bkn-20250930044236163-0930_00822_001.html,屯門男子涉藏毒被捕　檢500元貨,香港,oncc,2025-09-30 05:30,"昨日(29日)晚上10時02分，現場為屯門仁政街及德政圍交界，警員在上址對開巡邏期間發現1名男子形跡可疑，遂上前截查。其間疑人懷疑企圖逃跑，其後被人員制服。

人員在該名姓康(37歲)男子身上發現兩粒懷疑含有依托咪酯成份的煙彈及1支電子煙，毒品市值約500元。經初步調查，被捕男子涉嫌「管有危險藥物」被捕。

該名男警和康男於拘捕期間受傷，兩人分別手腳擦傷，清醒被送往屯門醫院治理。康男經治理後已經出院，他現正被扣留調查。"
bkn-20250930042138976-0930_00822_001,粉嶺外傭單位廁所內暈倒　 昏迷送院救治,2025-09-30 04:21,2025-09-30 04:21,https://hk.on.cc/cnt/news/20250930/bkn-20250930042138976-0930_00822_001.html,粉嶺外傭單位廁所內暈倒　 昏迷送院救治,香港,oncc,2025-09-30 04:30,"粉嶺有人暈倒昏迷。今日(30日)凌晨零時39分，上水聯捷街2號聯捷街榮輝中心一單位，一名住戶報案，指其僱用的印尼籍外傭，於上址單位內暈倒。

救援人員接報到場，發現該名52歲女傭，倒卧在上址單位廁所內。救護員立即將昏迷的女事主，經由救護車送往北區醫院救治，案件列作「有人暈倒」跟進。"
bkn-20250930040553731-0930_00822_001,開放合作月下月開幕　辦60場交流活動,2025-09-30 04:05,2025-09-30 04:05,https://hk.on.cc/cnt/news/20250930/bkn-20250930040553731-0930_00822_001.html,開放合作月下月開幕　辦60場交流活動,中國,oncc,2025-09-30 04:15,"中國科協2025年「開放合作月」新聞發布會周日（28日）介紹10月全面拉開帷幕，主題為「科技為舟載天下，人文作楫濟未來」。另外，2025世界科技與發展論壇亦將於10月27日至30日在北京舉辦，會在開幕式上發布10項共識性成果，設置10場專題論壇。

中國科協國際合作部副部長張斌表示，約60場民間國際科學技術交流活動，將在北京、上海、浙江等15省市區及法國、巴西等5個海外國家舉行。活動內容主要分為4大板塊，其中民間科技外交主場會議板塊，主要包括世界新能源汽車大會、世界工程組織聯合會全體大會暨全球工程大會、世界青年科學家峰會及世界科技與發展論壇等中國科協牽頭主辦重要國際科技會議。

至於科技引領未來發展板塊，主要包括全國學會開展的聚焦科學未來、產業未來、綠色未來、共享未來國際交流活動。在人文促進開放信任合作板塊，主要包括科協系統組織的以科學家、工程師、青年科技人員等為主體的多雙邊科技人文交流活動。最後，創新促進文明互鑒板塊，主要包括在華發起設立的國際科技組織、科學計劃所舉辦的各類交流活動。"
