id,title,date,last_update,url,lead,section,source,scrape_time,news_content
bkn-20260210171156417-0210_00822_001,海南航空波音機機械故障　安全備降,2026-02-10 17:11,2026-02-10 17:11,https://hk.on.cc/cnt/news/20260210/bkn-20260210171156417-0210_00822_001.html,海南航空波音機機械故障　安全備降,海南,oncc,2026-02-10 17:15,"海南航空一架波音737客機周一（9日）從海南省瓊海飛往河北省石家莊期間，因機械故障緊急備降湖北宜昌三峽國際機場。

海南航空指，涉事航班周一下午3時左右在瓊海起飛，途中發生機械故障，下午5時47分改降宜昌三峽國際機場。公司更換飛機接載乘客，並於晚上10時30分抵達石家莊正定機場。目前未知航班載有多少人。

此前，海南航空編號HU492航班上周五（6日）從比利時布魯塞爾起飛，原定前往北京，起飛後不久因機械故障需折返布魯塞爾。航班由波音787-9型客機執飛。"
bkn-20260210171155284-0210_00822_001,去年搗破深偽技術詐騙集團多9人被控　累計共14人遭起訴,2026-02-10 17:11,2026-02-10 17:11,https://hk.on.cc/cnt/news/20260210/bkn-20260210171155284-0210_00822_001.html,去年搗破深偽技術詐騙集團多9人被控　累計共14人遭起訴,香港,oncc,2026-02-10 17:30,"執法部門透過情報及調查分析，發現有詐騙集團成員，懷疑在社交平台，以虛假的人物設定和深偽技術，誘騙海外事主投資虛擬貨幣，相信騙款逾3400萬港元。遂於2025年1月2日至3日展開反詐騙行動，打擊以「深偽」技術犯案的詐騙集團，以涉嫌「串謀詐騙」及「洗黑錢」等罪拘捕31人(20至34歲)，包括一名港超足球員。

經進一步調查及徵詢法律意見後，執法部門再落案起訴多9名被捕男女。連同較早前已被落案起訴的5名男女，包括集團主腦、詐騙中心負責人及3名骨幹成員，至今共有14名疑犯被落案起訴。

該14名疑犯被起訴「串謀詐騙」罪，其中4人被加控「洗黑錢」罪，案件將於明日(11日)在東區裁判法院提堂。"
bkn-20260210170911461-0210_00822_001,制度參與「肥佬」上流信心僅及格　逾60%青年感壓力因教育發展,2026-02-10 17:09,2026-02-10 17:09,https://hk.on.cc/cnt/news/20260210/bkn-20260210170911461-0210_00822_001.html,制度參與「肥佬」上流信心僅及格　逾60%青年感壓力因教育發展,香港,oncc,2026-02-10 17:45,"香港貧富差距問題嚴峻，兒童及青少年貧窮率持續上升。最新一項調查發現，年輕人對社會流動的看法及各類生活資本水平的平均分僅屬「剛合格」。研究強調「制度參與能動性」的重要性，亦指出穩健而公平的「努力與回報」社會機制，能強化青年的「工具式希望感」。此外，心理健康問題被揭示為跨教育與生活兩個場域的高頻障礙，多達61.9%受訪青年認為「心理健康壓力」是教育發展的限制。

關注學童發展權利聯席於2025年7月至9月期間進行問卷調查，探討資本、不平等及制度障礙如何影響青年的生活經驗、社會流動機會及對未來的希望感，共收集168份12至24歲青年回應。研究發現五大要點，並顯示所有研究範疇的平均分均僅徘徊於合格邊緣。

研究強調「制度參與能動性」的重要性。調查顯示，青年愈覺得自己能透過創意平台表達、在公共政策過程中有發言權並能被聽見，以及愈能在制度不公下找到前路的人，愈傾向相信教育與勞動市場仍存在「可行的上流通道」，反映「能動性不是抽象意志，而是能否被制度聽見、能否把表達轉成參與」。相反，「集體能動性」與對制度性社會流動的信心關係不顯著，反映單有批判意識與集體取向，未必能提升對制度能提供向上流動的信心。然而，數據顯示青年的「制度參與能動性」得分不合格(4.74分)，致使他們對向上流動的信心僅停留在剛合格水平(5.1分)）。

研究亦指出，穩健而公平的「努力與回報」社會機制，能強化青年的「工具式希望感」(即相信努力能換取更好生活)，進而使其相信社會仍有向上流動機會。這種希望感是影響「社會流動印象」最核心的要素。然而，青年的工具式希望感同樣僅得剛合格水平(5.39分)。研究進一步分析，經濟資本幾乎不直接驅動向上流動的希望感及能動性，其作用更像「底盤/緩衝器」與「轉換條件」，其功能是間接、情景性、以及透過轉化為其他資本與機制去發揮向上流動和強化希望感的作用。

此外，心理健康問題被揭示為跨教育與生活兩個場域的高頻障礙，多達61.9%受訪青年認為「心理健康壓力」是教育發展的限制；數據分析顯示，在教育場域感到壓力的104位青年中，當中有65位(62.5%)同時認為心理健康是生活向上流動的障礙。研究指出，心理健康更像是普遍存在的「結構性耗損與摩擦機制」，會在資本轉換過程中消耗青年的時間、精力與情緒容量，從而影響其能動性、策略選擇與希望感的形態。"
bkn-20260210165649169-0210_00822_001,兼職女友禁錮勒索改囚4年　上訴庭指參與勒索及從旁協,2026-02-10 16:56,2026-02-10 16:56,https://hk.on.cc/cnt/news/20260210/bkn-20260210165649169-0210_00822_001.html,兼職女友禁錮勒索改囚4年　上訴庭指參與勒索及從旁協,香港,oncc,2026-02-10 17:15,"時年16歲的兼職女友於2021年夥同4男，禁錮一名原進行性交易的男子約10小時，拍其裸照，更強迫該漢摸她胸部，並攝錄「非禮」影片勒索，令他損失逾130萬港元及5隻名錶。該女否認兩罪，經審訊後被裁定罪成並被判囚18個月。律政司不滿刑罰過輕提出刑期覆核，申請早前被上訴庭接納，該女原有刑期被撤銷，改判監禁4年。上訴庭今日(10日)頒下判詞指該女不單參與此勒索事件，更從旁協助，其參與程度不屬相對輕微，且原審法官錯誤地將答辯人的犯案年齡及醫療背景納入量刑基準考慮。

答辯人張羽妍(現年20歲)早前被控一項非法禁錮罪及一項勒索罪，同案兩名認罪被告張煒賢及梁正賢，早前分別被判囚3年4個月及3年。

判詞指出律政司的覆核理由是原審法官的量刑起點明顯過輕，及在訂立量刑基準時錯誤地將答辯人的犯案年齡及醫療背景納入考慮，亦指出不同意原審法官認為她的參與程度相對輕微及被動。

判詞指案發時，答辯人在酒店房間中先指示X前往洗澡，然後為共犯開啟房門，令他們進入浴室拍攝X的裸照等情節，顯示她不單參與此勒索事件，更從旁協助，法庭認為恰當的量刑起點應為4年9個月。

判詞同意申請方指原審法官錯誤地將答辯人的犯案年齡及醫療背景納入量刑基準考慮，指出若案件性質嚴重，被告年輕及身體欠佳等個人因素在判刑時作為求情的比重是極有限的。而犯案時年僅16歲的答辯人因精神狀態不穩，而失去被判往教導所的機會；且在覆核聆訊當天，答辯人只差3天就服畢18個月的原判期，大幅度的刑期提升對她而言是個打擊，故給予減刑，綜以上所述，終改判其4年的即時監禁。

案件編號：CAAR 6/2025"
bkn-20260210164041340-0210_00822_001,議員憂出現狗隻大細入餐廳爭拗　當局指社會需磨合　會宣傳教育,2026-02-10 16:40,2026-02-10 16:40,https://hk.on.cc/cnt/news/20260210/bkn-20260210164041340-0210_00822_001.html,議員憂出現狗隻大細入餐廳爭拗　當局指社會需磨合　會宣傳教育,香港,oncc,2026-02-10 16:45,"立法會食物安全及環境衞生事務委員會今日(10日)討論容許狗隻進入獲批准的餐廳。當局預計今年首季修例建議，首階段會批出500至1000間食肆申請。有議員表示，多數客人不清楚食肆可以自行制定相關規則，擔心日後出現狗隻大細數量相關的爭拗。當局指，會針對有興趣的食肆作出介紹，推出線上線下分享會；又認為社會需要磨合，食環署會提供宣傳教育。

環境及生態局局長謝展寰表示，預計今年年中可實時相關措施，實施時會根據4項原則制定方案，包括食肆自願申請；市民可選擇是否光顧。他說獲批食肆必須時刻在入口當眼處貼上自訂樣式標示，食肆名單亦會上載至網站。他說當局會以保障食物安全環境衞生，及食客員工寵物安全為前提，兼顧業界認為彈性；又會減少業界遵守規定的成本，穩妥推展。

飲食界議員梁進表示，多數客人不清楚食肆可以自行制定相關規則，擔心日後出現狗隻大細數量相關的爭拗。他期望政府多推廣，讓食肆張貼規則。他又表示有食肆不清楚規則，誤以為只要不是開放狗隻的時段便不用遵守，認為政府要多講解。他又關注當局日後會如何調整相關餐廳數目。

謝展寰說，當局每6個月會對出一次新申請，認為容易處理、方式切合市場。對於不清楚規則的問題，他說政府會針對有興趣的食肆作出介紹，推出線上線下分享會；又認為社會需要磨合，食環署會提供宣傳教育。

有議員關注若狗隻打鬥，責任誰屬，以及保險問題。謝展寰說狗隻行為必定是由狗主負責，無論是咬人或傷害其他狗隻。他說具體情況要視乎個案而定，但責任上狗主需要約束狗隻，而非由餐廳約束狗隻。他說情況與狗隻在公眾地方咬人相同，不會因為在餐廳發生，而把責任轉移至餐廳。"
bkn-20260210163855834-0210_00822_001,高市早苗擬自衞隊入憲　華批謀求軍事鬆綁,2026-02-10 16:38,2026-02-10 16:38,https://hk.on.cc/cnt/news/20260210/bkn-20260210163855834-0210_00822_001.html,高市早苗擬自衞隊入憲　華批謀求軍事鬆綁,中國,oncc,2026-02-10 17:00,"中國國防部周二（10日）舉行記者會，新聞發言人蔣斌大校就中日關係、台海和南海爭議作出回應。對於日本首相高市早苗稱應把自衞隊寫入憲法，蔣斌認為日本政府明目張膽謀求把自衞隊寫入憲法，這不是完善法律，而是掏空「和平憲法」根基，謀求軍事鬆綁，甚至妄圖重走軍國主義邪路。

蔣斌表示，日本政府長期以來為「再軍事化」披上虛偽的「法治」外衣，種種迹象表明日本右翼勢力處心積慮從軍事、輿論、法律等多方面入手，挑戰二戰戰後國際秩序，國際社會應高度警惕並堅決遏制，攜手維護二戰勝利成果和地區和平穩定。

至於台灣問題，早前有指台軍計劃把海馬斯多管火箭系統前進部署至澎湖與東引，打擊範圍能覆蓋福建、浙江等地解放軍陣地，蔣斌認為從前述武器部署到發動所謂「先制打擊」，「台獨」分子的想法愈來愈荒誕不經、自不量力，若膽敢挑起戰端，必遭滅頂之災。

在南海問題，菲律賓海警發言人曾表示為落實「新漁民英雄計劃」，海岸防衞隊部署艦機向在黃岩島附近作業的本國漁船提供安全保障，保護主權權利和漁民生計。蔣斌回應指，黃岩島是中國固有領土，菲方有關部門採取誘騙鼓動手段，把無辜漁民推到一線作為侵權挑釁的工具，甚至人為製造摩擦以便對中方炒作抹黑，說明他們不在意漁民的生計福祉和生命安全。中方奉勸菲方停止不擇手段的政治操弄和自導自演的海上鬧劇。

此外，高市早苗曾指對與中方開展對話持開放態度，中國外交部發言人林劍周二回應稱，對方嘴裏喊對話，手上卻忙着對抗，這樣的對話沒人會接受。日方如果真心想發展中日戰略互惠關係，很簡單明確的方法就是撤回高市早苗的錯誤涉台言論，恪守中日四個政治文件和日方作出的政治承諾，以實際行動展現對話的誠意。"
bkn-20260210163011659-0210_00822_001,雙程證女涉假學歷申來港　控方已索筆迹專家報告　案件4.9再訊,2026-02-10 16:30,2026-02-10 16:30,https://hk.on.cc/cnt/news/20260210/bkn-20260210163011659-0210_00822_001.html,雙程證女涉假學歷申來港　控方已索筆迹專家報告　案件4.9再訊,香港,oncc,2026-02-10 16:45,"39歲持雙程證女子涉嫌於去年底透過「優才計劃」申請在港居留時，訛稱自己擁有泰國先皇理工大學的畢業證書。該女子其後被控一項「安排使用虛假文書」罪，案件今日(10日)於沙田裁判法院再訊。控方申請押後待律政司提供全面的法律意見，並透露已索取筆迹專家報告。裁判官最終將案件押後至4月9日再訊，但指由於被告並非本港居民，控方須盡快處理。被告續准保釋，期間依然不准離港。

被告劉碧璇(39歲，控罪書沒列出報稱職業)，被控於2024年12月25日或該日前後，在香港明知或相信有關虛假文書，即一張看似是先皇理工大學的畢業證書，屬於虛假，而安排使用該文書，意圖誘使入境處處長及其人員接受該文書，並因接受該文書為真文書，而作出或不作某些作為，以致對該人或其他人不利。

控方今申請將案件再押後，並解釋上次申請押後的原因，為入境處需時調查，而控方在上周已收到筆迹專家報告等，現就調查所得向律政司索取進一步意見；辯方不反對押後申請。裁判官關注，案件下次聆訊時，控方是否準備好答辯？控方則稱「理論上係」。裁判官指由於被告並非香港居民，故控方須盡快處理。

案件編號：STCC 4008/2025"
bkn-20260210161037148-0210_00822_001,涉嚴重違紀違法　全國人大財政經濟委員會副主任受查,2026-02-10 16:10,2026-02-10 16:10,https://hk.on.cc/cnt/news/20260210/bkn-20260210161037148-0210_00822_001.html,涉嚴重違紀違法　全國人大財政經濟委員會副主任受查,中國,oncc,2026-02-10 16:15,"中央紀委國家監委周二（10日）公布，十四屆全國人大財政經濟委員會副主任委員易煉紅涉嫌嚴重違紀違法，目前正接受中央紀委國家監委紀律審查和監察調查。

易煉紅於1959年9月出生，湖南漣源人，研究生學歷，經濟學碩士學位，教授。二十屆中央委員。他曾任湖南省岳陽市委書記，湖南省委常委、秘書長，長沙市委書記，遼寧省委常委、瀋陽市委書記，遼寧省委副書記、瀋陽市委書記等職。

2018年易煉紅轉任江西省省長，2021年任江西省委書記；2022年任浙江省委書記，直至2024年10月卸任。2024年11月，易煉紅出任全國人大財政經濟委員會副主任委員。"
bkn-20260210155802913-0210_00822_001,錦綉花園業主政總請願　冀發展局介入屋苑維修爭議,2026-02-10 15:58,2026-02-10 15:58,https://hk.on.cc/cnt/news/20260210/bkn-20260210155802913-0210_00822_001.html,錦綉花園業主政總請願　冀發展局介入屋苑維修爭議,香港,oncc,2026-02-10 16:15,"元朗錦綉花園失水風波持續發酵，錦綉花園小業主權益聯會因不滿水務署未能釐清屋苑失水疑點，並質疑署方涉嫌違反地契及與發展商存在私下協議，導致屋苑供水系統維修責任在居民不知情下被轉嫁逾40年。聯會又指署方發布的數據前後矛盾，公信力受損，因此於今日(10日)到政府總部請願，要求發展局介入。

聯會成員向局方代表遞交請願信，要求當局介入屋苑水管維修工程，包括安排水務署及專家小組等與業主會面，並且調查失水問題。聯會亦希望相關工程完成後，水務署可根據地契條款接收所有公用地下供水喉管。

而水務署日前曾就屋苑失水問題回應指，由於發現屋苑內部供水系統出現滲漏，該署根據《水務設施條例》第7條賦予的權力，要求註冊代理人跟進處理。然而，聯會一再把擔當規管角色的該署，錯誤定性為責任方，並不斷要求該署承擔屋苑內部供水系統的保養維修責任，包括詳細檢查及負責更換水管等工程。

事實上，錦綉花園雖於去年成功叫停5億天價維修方案，惟屋苑失水源頭至今未明，水管及有關路段的權責問題亦未被解決，因此錦綉花園小業主權益聯會上月便邀請各個持份者，一同開會商討各項事宜，惟水務署、元朗民政事務處、發展商俊業集團及管理公司均沒有派代表出席。"
bkn-20260210154610650-0210_00822_001,赤鱲角機場機房失火　3登機橋暫時關閉　後備儲電器短路肇禍,2026-02-10 15:46,2026-02-10 20:12,https://hk.on.cc/cnt/news/20260210/bkn-20260210154610650-0210_00822_001.html,赤鱲角機場機房失火　3登機橋暫時關閉　後備儲電器短路肇禍,香港,oncc,2026-02-10 20:15,"今日(10日)下午3時03分，赤鱲角香港國際機場近D212閘口，有機房冒煙起火，消防接報後迅速趕至現場，並出動兩隊煙帽隊及開動兩條喉撲救。據悉，接駁車暫停，大量旅客滯留200號閘口。至下午4時01分，消防將火救熄，約30人需要疏散，事件列作二級火警跟進。

經初步調查後，相信後備儲電器短路引致火警，現階段並無證據顯示案件涉及刑事成分。

機管局表示，今午約3時，T1中場客運廊近212登機閘口的停機坪電機房發生火警，消防員到場將火救熄，事件中無人受傷。212、214及216登機橋需要暫時關閉，三個機位均沒有飛機停泊。為維持航班運作，部分原本安排停泊T1中場客運廊的航機，改為於遠方停機位繼續運作。機管局現正與消防處跟進事件。"
bkn-20260210154012452-0210_00822_001,元朗過渡屋往返大埔免費巴士首班車明起提早至清晨6時半,2026-02-10 15:40,2026-02-10 16:35,https://hk.on.cc/cnt/news/20260210/bkn-20260210154012452-0210_00822_001.html,"元朗過渡屋往返大埔免費巴士　首班車明起提早至清晨6時半


《東方日報》日前就有宏福苑災民關注過渡性房屋的交通安排，報導過災民正面對交通、經濟與精神等多重壓力，且孩子上學時的交通路程相當迂迴。房屋局向東網回覆詳細說明多項服務調整，包括元朗「路德會」過渡屋往返大埔墟站的免費居民巴士，將於明日(11日)提早首班車至清晨6時30分開出。就有「七星",香港,oncc,2026-02-10 18:15,"《東方日報》日前就有宏福苑災民關注過渡性房屋的交通安排，報導過災民正面對交通、經濟與精神等多重壓力，且孩子上學時的交通路程相當迂迴。房屋局向東網回覆詳細說明多項服務調整，包括元朗「路德會」過渡屋往返大埔墟站的免費居民巴士，將於明日(11日)提早首班車至清晨6時30分開出。就有「七星薈」居民提及的服務日期，局方解釋指「路德會」早前發放的海報上所列日期，是指慈善組織贊助的期限，並非居民巴士服務的營運結束日期。

房屋局表示，元朗「路德會七星薈」和「路德會雙魚薈」已於去年12月增設免費居民巴士服務NR977，往返項目與大埔墟站，現時服務時間為每日早上7時至晚上8時。為便利居民出行，服務將於明日起提早首班班次至清晨6時30分。就海報上最新穿梭巴士時間表標示為早上6時15分，房屋局又提醒，標示時間是「建議到達候車處時間」，所有開出時間均為所標示的15分鐘以後。

對於有居民提及的服務日期，局方解釋，項目營運機構香港路德會早前發放的宣傳海報上所列日期，是指慈善組織贊助該服務的期限，並非居民巴士服務的營運結束日期。局方補充，路德會在提供服務1個月後，已收集並考慮居民意見，並正作出班次調整以滿足出行需求。

除了居民巴士服務，房屋局指「七星薈」附近已設有多條公共交通路線供居民使用，包括九巴54、77K、251B及251M線，分別前往元朗、上水及荃灣；以及專線小巴608及608S線，分別前往元朗及港鐵錦上路站，方便居民轉乘前往各區，其中，九巴77K線已於去年12月起加強服務。

此外，房屋局指，運輸署會持續協助督導公共運輸服務營辦商加強專營巴士、專線小巴和居民巴士服務，加派車輛和人手，照顧入住各區過渡性房屋和房協項目的宏福苑居民的出行需要。其中，就大埔策誠軒而言，往返策誠軒及大埔墟站的居民巴士NR50已進一步加密班次，調整後的服務時間為每日清晨5時40分至凌晨40分，平均約每20分鐘一班。"
bkn-20260210153235490-0210_00822_001,英媒：解放軍圍台軍演殲16戰機曾向F16戰機射熱燄彈,2026-02-10 15:32,2026-02-10 15:32,https://hk.on.cc/cnt/news/20260210/bkn-20260210153235490-0210_00822_001.html,"英媒：解放軍圍台軍演　殲16戰機曾向F16戰機射熱燄彈


中國人民解放軍東部戰區去年12月底在台灣周邊海域舉行「正義使命-2025」演習，期間殲16戰機曾作出不止一次危險舉動，包括向台灣空軍F16戰機發射熱燄彈，且非常貼近F16後方的射擊位置。<br/><br/>英國《金融時報》周二（10日）援引知情人士指，「高風",台灣,oncc,2026-02-10 17:30,"中國人民解放軍東部戰區去年12月底在台灣周邊海域舉行「正義使命-2025」演習，期間殲16戰機曾作出不止一次危險舉動，包括向台灣空軍F16戰機發射熱燄彈，且非常貼近F16後方的射擊位置。

英國《金融時報》周二（10日）援引知情人士指，「高風險且具挑釁意味」行為發生在去年12月29日。第一起事件中一架F16緊急升空，攔截即將越過台灣海峽中線的解放軍戰機，一架殲16向F16發射熱燄彈。熱燄彈產生更強紅外輻射，可干擾追蹤紅外線導彈，從而令導彈偏離原本目標。

在第二起事件，一架殲16非常靠近F16後方，基本上處於射擊位置。第三起事件發生在台灣西北方，一架殲16緊貼在友軍轟6K轟炸機下方飛行，目的是讓雷達難以發現行蹤。當殲16行蹤曝光後，飛行員將戰機側翻，展示機腹掛載的導彈。對於《金融時報》報道，中國駐外大使館暫未回應。"
bkn-20260210152934955-0210_00822_001,呃110萬服務費　藥業公司前總經理及秘書公司男董事認罪,2026-02-10 15:29,2026-02-10 15:29,https://hk.on.cc/cnt/news/20260210/bkn-20260210152934955-0210_00822_001.html,呃110萬服務費　藥業公司前總經理及秘書公司男董事認罪,香港,oncc,2026-02-10 16:00,"一名藥業公司時任總經理及其下屬，虛報由該下屬營運的秘書公司曾提供顧問及其他服務，詐騙服務費共約110萬港元，涉案秘書公司的男董事亦涉協助洗黑錢約18萬港元。廉政公署早前落案起訴該總經理、其下屬及秘書公司男董事，其中的總經理和男董事今(10日)於區院分別承認兩項欺詐及一項洗黑錢罪。法官決定將判刑押後至7月24日，其間兩名被告還押。

兩名被告分別是邱偉臣(56歲)，金活藥業健康發展有限公司時任總經理及周柏豪(41歲)，基德服務有限公司董事兼股東。邱承認兩項欺詐罪，餘下的一項欺詐罪存檔法庭。周柏豪則承認一項洗黑錢罪。另一名被告，即邱的下屬余遠濤之案件將於7月6日開審。

2人承認的案情指，邱約於2017年2月11日至2022年4月22日向金活提交7份付款通知書，以結清基德服務的總額約53萬港元顧問服務費。邱另於2019年要求香港靈鋒廣告有限公司按與金活之間的年度合約，代其結清來自基德服務的顧問費發票。邱約於2019年3月13日至2023年9月16日，向靈鋒廣告提交6份發票，以結清總額約54萬港元服務費。

邱在警誡下承認，他曾向人查詢是否有公司可幫助他報銷費用；該人推介基德服務。邱遂利用基德服務的發票，向金活報銷開支，但他明知基德服務沒向金活藥業提供服務。金活藥業及靈鋒廣告支付的款項均存入基德服務的帳戶，邱其後指示他人轉帳予他。周則承認，基德帳戶由他單獨操作。邱共取得逾106萬港元利益，但已於2024年向金活支付逾76萬港元賠償。

案件編號：DCCC 227/2025"
