id,title,date,last_update,url,lead,section,source,scrape_time,news_content
bkn-20260105152830817-0105_00822_001,警員涉偷拍裙底罪脫後遭革職　提司法覆核要求推翻決定,2026-01-05 15:28,2026-01-05 15:28,https://hk.on.cc/cnt/news/20260105/bkn-20260105152830817-0105_00822_001.html,警員涉偷拍裙底罪脫後遭革職　提司法覆核要求推翻決定,香港,oncc,2026-01-05 15:30,"一名曾被指休班時穿上鞋帶內藏有鏡頭的鞋偷拍女子裙底的時任警員，經審訊後於2018年被裁定作出有違公德行為罪罪及不成立。該時任警員在案發後一直被停職，並接受紀律聆訊，最終於去年10月被革職。該前警員不服其被革職的決定，於上周五(2日)向高院提出司法覆核許可申請，指警務處處長把他革職的決定不合法且不合理，要求法庭推翻決定。

申請人為英裕泰，擬答辯人為警務處處長。申請人於其自行撰寫的申請書上指，他要求法庭推翻擬答辯人於2025年10月6日就其紀律聆訊作出把他革職的決定，指該紀律聆訊嚴重及根本性違反程序公義及自然公義，對他造成無法彌補的損害。他認為警務處處長把他革職的決定屬不合法又不合理，處分亦不合比例，超出合理決策者在相關情況下可作出的判斷範圍。不過其申請書並無列出當中的詳細理據。

資料顯示，今次覆核的申請人曾被指休班期間穿上鞋帶內藏有鏡頭之「蠱惑的鞋」，在港鐵站內偷拍女生裙底春光，因而被控作出有違公德行為罪，但於2018年8月，裁判官認為目擊警員未必清楚看到該休班警的鞋子有否掛着拍攝器材，而獲判處罪名不成立。而該申請人亦曾於2022年入稟高院申請司法覆核，挑戰處理其紀律聆訊的警司否決他申請擱置聆訊的決定，指有關決定違反程序，並要求法庭頒令推翻該警司的決定，暫時擱置其紀律聆訊。惟高院於同年9月頒發判詞拒絕批出司法覆核許可。

案件編號：HCAL13/2026"
bkn-20260105150900355-0105_00822_001,男警涉元朗寮屋串謀製毒　再被拒保釋,2026-01-05 15:09,2026-01-05 15:09,https://hk.on.cc/cnt/news/20260105/bkn-20260105150900355-0105_00822_001.html,男警涉元朗寮屋串謀製毒　再被拒保釋,香港,oncc,2026-01-05 15:30,"一名男警被指在去年1月開始，在元朗一間寮屋跟其他人串謀製毒。他於早前在街上被截停，始揭發事件。該男警被控一項串謀製造危險藥物罪，案件早前於裁判法院提訊，裁判官把案件押後至1月30日再訊，以等待毒品化驗報告，及證明案發現場為製毒工場的專家報告，期間被告須還押。被告於今日(5日)再到高院申請保釋，法官黎婉姫聽畢控辯雙方陳辭後拒絕申請，被告須繼續還押。

34歲被告孫程遠，控罪書上沒有報稱職業。據悉，他是一名警員，現已被停職。他被控於2025年1月24日與2025年4月23日之間，首尾兩日包括在內，在新界元朗大樹下東路崇山新村丈量區1648寮屋，與其他不知名人士，串謀製造危險藥物。

案件編號：HCCP 1025/2025"
bkn-20260105150549467-0105_00822_001,「中國版特朗普」抵美　與當地人打趣交流,2026-01-05 15:05,2026-01-05 15:05,https://hk.on.cc/cnt/news/20260105/bkn-20260105150549467-0105_00822_001.html,「中國版特朗普」抵美　與當地人打趣交流,中國,oncc,2026-01-05 15:15,"以模仿美國總統特朗普而知名的中國重慶網紅陳睿，上周六（3日）經香港轉機抵達美國加州洛杉磯，與當地人交流。

陳睿在片中提到，香港是他最喜歡的中國城市之一，又指他將在加州逗留數天，然後將到內華達州拉斯維加斯參加國際消費電子產品展覽，並指那裏很多產品來自中國。他到橙縣歐文（Irvine）一間美式快餐店用膳，以特朗普腔調與收銀員互動交流，期間打趣道可以作為中國代理人為該店開拓中國市場，收銀員則笑稱他捐出的找贖將用於打擊人口販運。

陳睿周日（4日）與NBA球迷交流時繼續模仿特朗普，獲讚賞扮演得維肖維妙。陳睿則推介對方對往中國旅遊，對方回應稱「中國很酷」。"
bkn-20260105145742258-0105_00822_001,海皇粥店母公司認拖糧　33項控罪共被判罰6.6萬元,2026-01-05 14:57,2026-01-05 14:57,https://hk.on.cc/cnt/news/20260105/bkn-20260105145742258-0105_00822_001.html,海皇粥店母公司認拖糧　33項控罪共被判罰6.6萬元,香港,oncc,2026-01-05 15:15,"開業33年的海皇粥店於去年5月突然宣布結束全部業務並終止員工的僱傭合約，其母公司海皇國際及後亦被債權人入稟高院提出清盤呈請。海皇國際與兩名創立人於早前亦被指拖欠10名員工薪金共逾56萬港元，共被票控沒有在到期日內支付工資等99項傳票控罪。該案今(5日)於東區裁判法院再訊，海皇國際承認33項控罪，被暫委裁判官莊靜敏判處每項控罪罰款2,000港元，合共6.6萬港元，繳款限期會在兩周後決定。至於兩名創立人則否認控罪，案件將排期審訊，並於3月2日先處理審前覆核。

被告分別為海皇國際有限公司及兩名創立人蔡汪浩及蕭楚基。海皇國際由清盤人代表出庭答辯，蔡及蕭則沒有到庭，並由法律代表應訊。3名被告共被票控99項控罪，海皇國際承認沒有在僱傭合約終止時在到期日屆滿前付給工資，和沒有在到期日內付給工資等33項傳票罪，蔡及蕭則各否認33項傳票控罪。海皇國際最終被判罰款合共6.6萬港元，由於清盤人需時索取法律意見，決定繳交罰款的限期，裁判官遂應申請，將案件押後至1月19日再訊。

控罪指3名被告分別作為案中10名僱員的僱主，故意及無合理辯解而沒有在切實可行範圍內盡快，但在任何情況下不得於工資期最後一天，及僱傭合約終止後7天支付僱員工資；以及作為法團海皇國際有限公司的董事，該法團故意及無合理辯解而沒有在切實可行範圍內盡快，在上述僱員的工資期最後一天完結後7天內，及在僱傭合約終止後7天內，支付該些僱員於2025年1月1日至4月30日的工資，款額合共逾56.4萬港元，而該法團所犯的罪行，是在蔡及蕭的同意或縱容下犯的，或歸因於他們本身的疏忽。

海皇粥店創立於1992年，高峰期曾坐擁超過30間分店。自前年8月起，粥店先後結束元朗、上水、沙田等5間分店，至去年4月，全港只餘下7間門市。直至5月初，海皇粥店突然結束業務。翻查資料，海皇國際有限公司董事局於去年5月亦向員工發信，稱經營環境及公司財務狀况惡化等因素下，決定終止全部業務，隨後將以債權人自願清盤的方式清盤。勞工處其後收到近100名該店僱員求助，主要涉及欠薪及解僱補償等，追討金額共約為1,500萬港元。

案件編號：ESS 25230-25328/2025"
bkn-20260105144335119-0105_00822_001,近年消防出動次數攀升　前議員：應整合火警資料讓社會準備,2026-01-05 14:43,2026-01-05 14:43,https://hk.on.cc/cnt/news/20260105/bkn-20260105144335119-0105_00822_001.html,近年消防出動次數攀升　前議員：應整合火警資料讓社會準備,香港,oncc,2026-01-05 15:00,"昨日(4日)石硤尾發生火災，釀成一死多傷、數百人需要疏散。有前議員指出，消防人員出動數字近年攀升，火警主要發生在密度高的公屋或居屋的屋苑。她說本港人口及高樓大廈密集，加上超老齡化來臨；在大部分住宅樓宇缺消防花灑系統的情況下，防火及逃生變得尤其重要。她又說大埔火災敲起了警號，望政府對大小火警也要同樣關注，對於火警的資料要整合分析，讓社會更有準備。

前議員江玉歡在社交平台貼文，指上翻查記錄，消防處過去3年接獲火警出動的次數呈增加的趨勢，2022年有31,111次，2023年36,103次，2024年37,828次，當中包括火警鐘誤鳴及大小火警。

她說不少地方對於火警的統計資料非常詳盡，除了數字亦對於火警的原因、樓宇種類、傷亡人數及死傷者年齡等資料，每年也有專業及科學化的分析，並對外公布，部門亦會制訂針對性的措施防止火警發生，及降低傷亡的機會。

她舉例，近年不少住宅火警都是因電器產生的，於是有些地方加強監管入口電器，禁售未有通過測試的電器。她又舉例，有些城市發現老齡化與火警數量有關連，不少的火災死者也是長者，因為他們在冬天喜愛用暖爐，屋內雜物多、逃生時走動較慢。有見及此，很多地方在長者人口特多的社區做大量防火工作。

她關注新建住宅大廈的公共地方是否有足夠的防火設施，與其興建美輪美奐的會所或大堂，是否應適度投放在防火安全的設施上。她認為，近年公屋愈起得高和密，住戶有不少是長者及殘疾人士，對於公屋的防火設計要更加着重。她認為幸福設計當中，防火應是重點，而非只是加張椅，或在外牆畫畫，我們要做的是更實在的工作。

她期望區議員及立會議員今後在地區工作時，要有更高的防火意識。她舉例西環一幢又密集又舊的商住大廈，有議員及區議員的聯合辦事處門外的大廈走廊天花已有不少縱橫交錯的電線。她質疑：「地下大堂是這樣，樓上會怎樣呢？」"
bkn-20260105141109516-0105_00822_001,內地發布實施綠色消費推進行動　減用即棄膠製品,2026-01-05 14:11,2026-01-05 14:11,https://hk.on.cc/cnt/news/20260105/bkn-20260105141109516-0105_00822_001.html,內地發布實施綠色消費推進行動　減用即棄膠製品,中國,oncc,2026-01-05 14:45,"商務部等9個部門周一（5日）對外發布《關於實施綠色消費推進行動的通知》，提出加大綠色農產品供應、發展綠色餐飲、推廣綠色消費積分、減少即棄塑膠製品使用、推動廢舊物品回收再利用、發展二手商品流通、加大信貸投放等20條具體舉措。

上述通知對「十五五」時期綠色消費工作作出安排，從豐富綠色產品供給、提升綠色服務消費、創新綠色消費模式、推動綠色循環回收、優化綠色消費環境、鞏固綠色消費基礎、加大政策支持力度7方面發力，圍繞健全綠色消費激勵機制提出具體舉措，涵蓋農產品、家電家裝、餐飲住宿等多個領域，同時明確金融等支持政策，優化綠色消費環境。

通知強調培育綠色消費新增長點，提出打造綠色供應鏈，開展供應鏈碳足迹評價，推廣綠色採購、綠色產品、綠色包裝；鼓勵推廣綠色消費積分，探索建立線上線下通兌通用的綠色消費積分體系，推廣綠色產品認證與標識，規範零售端綠色消費積分採集，支持公共服務主體對綠色消費積分用戶給予便利或優惠；並創新綠色共享，發展綠色租賃服務，鼓勵出行共享、空間共享、物品共享，促進資源高效利用。通知亦強調推動綠色循環回收，構建「減量-回收-再利用」的資源循環體系。"
bkn-20260105140527992-0105_00822_001,華軍媒警告日全面解禁武器出口　必將玩火自焚,2026-01-05 14:05,2026-01-05 14:05,https://hk.on.cc/cnt/news/20260105/bkn-20260105140527992-0105_00822_001.html,華軍媒警告日全面解禁武器出口　必將玩火自焚,中國,oncc,2026-01-05 14:15,"中國軍媒《解放軍報》周一（5日）刊文，提到日本首相高市早苗上台以來，不斷推動取消對武器出口的5種類型限制，計劃下月提交相關動議，4月修改「防衞裝備轉移三原則」運用指南。文章警告，高市政府大幅鬆綁武器出口的行徑，將使日本走向販賣戰爭、借戰牟利的危險道路，國際社會尤其是亞洲鄰國須高度警惕。

由於陣營對抗意識急劇上升，武器出口成了日本推進對外軍工合作、強化軍事外向型發展的重要抓手。除成品武器出口外，日本大部分武器出口限制已被變相撤銷，一旦廢除上述5種類型限制，日本武器出口範圍將事實上實現全面放開，殺傷性裝備也可能被納入其中。文章認為，高市政府的舉動充分暴露了她試圖藉此徹底掃除「和平憲法」所剩限制，加速軍事鬆綁的右翼政客本色。

文章指摘，高市上台後，日本一意孤行地在邪路上疾馳狂奔，在日本大力推銷兜售下，新西蘭繼澳洲後也準備採購日本最上級新型護衞艦，日本還向美國返銷了愛國者導彈等。文章批評，日本一再放寬武器出口限制，企圖為修憲、擴軍、拓盟和對外干預張目造勢，達到提振國內軍工關聯產業、綁定域內外關鍵戰略支點、圍堵戰略對手、提升對外軍事影響力等目的，然而歷史終會證明，這種做法必將玩火自焚。"
bkn-20260105135725806-0105_00822_001,馬術教練涉藏偉哥與冰毒　留院缺席聆訊押後1.8再訊,2026-01-05 13:57,2026-01-05 13:57,https://hk.on.cc/cnt/news/20260105/bkn-20260105135725806-0105_00822_001.html,馬術教練涉藏偉哥與冰毒　留院缺席聆訊押後1.8再訊,香港,oncc,2026-01-05 14:00,"一香港賽馬會馬術教練涉在酒店房間內持有冰毒及「偉哥」，被控三罪。案件今(5日)於九龍城裁判法院首次提堂，控方表示被告現正留醫中無法出庭，裁判官將案件押後至本月8日或被告最快出院日，期間被告將由警方看管。

被告MCCULLOCK Kyle（36歲，報稱Equestrian Coach of HKJC，即香港賽馬會馬術教練）被控管有危險藥物、管有第I級毒藥及管有適合用作服食危險藥物的器具罪，分別指他於本月2日，在香港九龍尖沙咀彌敦道118號至130號美麗華酒店16樓1648室管有危險藥物，即甲基苯丙胺；第I部毒藥西地那非及適合於及擬用作服食危險藥物，即3支管和36支針筒。

案件編號：KCCC 29/2026"
bkn-20260105135139462-0105_00822_001,宏福苑大火亡妻捨身救人　家屬辨告別禮送別最後一程,2026-01-05 13:51,2026-01-05 13:51,https://hk.on.cc/cnt/news/20260105/bkn-20260105135139462-0105_00822_001.html,宏福苑大火亡妻捨身救人　家屬辨告別禮送別最後一程,香港,oncc,2026-01-05 15:00,"大埔宏福苑五級大火無情奪去多條人命，其中災民葉先生的妻子在大火中捨身救人，最後搭上性命。葉先生今日(5日)在社交平台上發文表示，為亡妻準備了一場寧謐而莊嚴的告別禮，並感謝各位親朋好友、舊同事、宏福苑街坊，在百忙之中抽空出席，送別亡妻最後一程。

葉先生表示，感謝非牟利機構「毋忘愛」為亡妻準備一場寧謐而莊嚴的告別禮，亦感謝到場的親朋好友，相信亡妻會感受到各位的關懷愛護；而葉先生一家人亦按照亡妻生前意願，選用簡單而安靜的告別儀式，希望她會滿意相關安排。

葉生早前曾接受《東方日報》訪問，他指葉太在火災發生當天，接獲葉生的逃亡電話後沒有即時逃離現場，而是逐一拍門通知鄰居，鄰居4人一狗成功逃出生天，但葉太卻留了在家中未能 逃走，最終不幸身亡。"
bkn-20260105132958196-0105_00822_001,花卉展3月維園舉行　主題花紫羅蘭,2026-01-05 13:29,2026-01-05 13:29,https://hk.on.cc/cnt/news/20260105/bkn-20260105132958196-0105_00822_001.html,花卉展3月維園舉行　主題花紫羅蘭,香港,oncc,2026-01-05 14:15,"今年香港花卉展覽將於3月20日至29日，於維多利亞公園舉行。今屆花展以紫羅蘭為主題花，並以「花語尋『香』— 細味城市特色」為主題。至今屆花展獲超過200個本地、內地及海外機構及團體參與，期間數十個參展機構將展出各類盆栽、花藝擺設以及園景設計。

展覽時間為每日上午9時至晚上9時，入場費正價14港元，而4至14歲兒童、全日制學生、60歲或以上長者，以及殘疾人士及其照顧者則收取優惠價7港元入場費，每名殘疾人士只可與一名同行照顧者同享優惠。周一至周五，60歲或以上長者、殘疾人士及其照顧者可免費參觀，而30人或以上的團體可享優惠收費(須一同進場)。

另外，康樂及文化事務署就是次花展舉行「賽馬會學生繪畫比賽」，而比賽分成5個組別進行，分別為初小組(小一至小三)、高小組(小四至小六)、初中組(中一至中三)、高中組(中四至中六)及大專組。康文署表示，比賽旨在透過同學的筆觸，在作品中展現會場內的花卉展品或園林景點，藉此提高同學愛護植物和自然環境的意識。而比賽主題同為「花語尋『香』— 細味城市特色」，參賽者可以用任何繪畫方式表達主題。"
bkn-20260105132240454-0105_00822_001,長沙灣「FT」車牌Tesla與旅遊巴相撞　意外原因有待調查,2026-01-05 13:22,2026-01-05 13:22,https://hk.on.cc/cnt/news/20260105/bkn-20260105132240454-0105_00822_001.html,長沙灣「FT」車牌Tesla與旅遊巴相撞　意外原因有待調查,香港,oncc,2026-01-05 14:00,長沙灣發生交通意外。今午(5日)12時許，一輛粵車南下掛「FT」車牌的Tesla電動車與一輛旅遊巴沿青沙公路往西隧方向行駛，至西九龍公路近海麗邨對開一匯合處時意外相撞。救援人員接報到場，證實事件中無人受傷，意外原因有待調查。受意外影響，現場交通一度受阻。
bkn-20260105131242076-0105_00822_001,元旦冒險穿越小鰲太線　4人失聯僅1人下山,2026-01-05 13:12,2026-01-05 13:12,https://hk.on.cc/cnt/news/20260105/bkn-20260105131242076-0105_00822_001.html,元旦冒險穿越小鰲太線　4人失聯僅1人下山,陝西,oncc,2026-01-05 13:15,"近日有不少網民發文稱，元旦期間5人穿越位於陝西省秦嶺山脈的「小鰲太」徒步路線，惟4人失聯，僅一人下山。有接近當地救援隊的知情人士周日（4日）向內媒表示，目前正在救援；家屬則稱，尚未找到失聯人士。

根據尋人啟事資訊，失聯人士最後一次手機信號出現在青峰峽。另有相關尋人的聊天紀錄截圖顯示，涉事一行人上周四（1日）晚6時在當地領隊帶領下，包車從陝西省體育館出發，當晚10時有人還聯絡過家人，此後再無音信。當中僅一人在上周六（3日）凌晨下山，失聯人士家屬同日早上報警求助。

鰲太線被稱為國內死亡率最高的徒步路線，《中國鰲太穿越事故調查報告》統計顯示，2012年至2017年夏季不足5年內，累計46人失蹤或死亡。"
bkn-20260105130509943-0105_00822_001,愛爾蘭總理相隔14年再訪華　料談經貿合作,2026-01-05 13:05,2026-01-05 13:05,https://hk.on.cc/cnt/news/20260105/bkn-20260105130509943-0105_00822_001.html,愛爾蘭總理相隔14年再訪華　料談經貿合作,北京,oncc,2026-01-05 13:15,"愛爾蘭總理馬丁周日（4日）飛抵北京首都國際機場，開啟為期5天的訪華行程，這次是愛爾蘭總理相隔14年再次訪華。除北京外，馬丁還將訪問上海。

中國外交部發言人上周六（3日）稱，馬丁這次訪華將與多名國家領導人會面，就雙邊關係和共同關心的問題深入交換意見。發言人又表示，近年中愛互惠戰略夥伴關係穩健發展，雙方堅持相互尊重、平等相待，通過開放合作實現優勢互補、共同發展，成果惠及兩國人民。中方願與愛方增進政治互信，拓展互利合作，為新時代雙方實現高質量發展和中歐關係健康穩定前行增添新動能。

馬丁上月接受愛爾蘭媒體訪問時表示，計劃訪問中國推動雙邊經貿合作，中國將是一個非常重要的世界強國，這一點短期內不會改變。他指出，中國過去40年顯著提升了其全球經濟影響力，而歐洲則常陷於短期主義，他不希望最終陷入一個貿易保護主義盛行、世界走向兩極分化的局面。"
bkn-20260105123533752-0105_00822_001,尖沙咀老翁墮海昏迷　熱心市民救起送院治理,2026-01-05 12:35,2026-01-05 12:35,https://hk.on.cc/cnt/news/20260105/bkn-20260105123533752-0105_00822_001.html,尖沙咀老翁墮海昏迷　熱心市民救起送院治理,香港,oncc,2026-01-05 13:15,"尖沙咀有人墮海。今午(5日)12時22分，有市民報案，指一名老翁於梳士巴利道九龍香格里拉酒店對開海面載浮載沉，救護車接報到場將已被救回岸上，陷入昏迷老翁送院搶救。人員正了解事主身份及墮海原因。

據熱心市民陳先生講述，當時正沿海濱長廊跑步，至上址時赫見一名老翁在海中漂浮，陳隨即落海拯救，終在約20米對開海面成功將昏迷老翁救回岸上，並替其施行急救，至救護車到場交救援人員接手處理。

防止自殺求助熱線：

香港撒瑪利亞防止自殺會： 2389 2222

生命熱線： 2382 0000

社會福利署： 2343 2255

撒瑪利亞會熱線(多種語言)： 2896 0000

醫管局精神健康專線： 2466 7350

明愛向晴軒： 18288

東華三院芷若園： 18281

「情緒通」熱線： 18111

賽馬會青少年情緒健康網上支援平台「Open噏」： http://www.openup.hk"
bkn-20260105122820166-0105_00822_001,油麻地食環署女工遭貨車撞斃　遺下不良於行丈夫及兒子,2026-01-05 12:28,2026-01-05 12:28,https://hk.on.cc/cnt/news/20260105/bkn-20260105122820166-0105_00822_001.html,油麻地食環署女工遭貨車撞斃　遺下不良於行丈夫及兒子,香港,oncc,2026-01-05 14:00,"除夕夜(12月31日)油麻地發生致命車禍，一名57歲食環署清潔女工被一輛重型貨車撞斃。死者家屬今日(5日)早上由工業傷亡權益會人員陪同下，抵達葵涌公眾殮房辦理認屍手續。

事發於上月(31日)晚上7時許，女事主李海英在廣東道一帶清潔街道，期間將垃圾運至窩打老道與渡船街交界時，遭一輛貨車撞倒送院搶救後終告不治。

李生前為食環署二級工人，隸屬油尖區環境衞生辦事處，主要負責街道清潔工作。在食環署服務逾9年。事主遺下丈夫及一名兒子，惟丈夫因工傷導致不良於行無法工作，現時由兒子獨力承擔辦理後事及家庭經濟開支。"
bkn-20260105120323079-0105_00822_001,夾公仔機放小動物捱轟　兒童遊樂場急撤下,2026-01-05 12:03,2026-01-05 12:03,https://hk.on.cc/cnt/news/20260105/bkn-20260105120323079-0105_00822_001.html,夾公仔機放小動物捱轟　兒童遊樂場急撤下,上海,oncc,2026-01-05 12:30,"上海浦東新區一個商場內的兒童遊樂場，近日被發現有夾公仔機放了兔子等活體小動物，顧客質疑機器內不適宜動物長期生存。內媒周日（4日）引述商場回應指，涉事門店已將相關機器撤走。

位於LCM置匯旭輝廣場4層的湯姆熊歡樂世界門店內，有三台夾公仔機內放置了活體小動物。網傳照片顯示，三台娃娃機內分別放置了倉鼠、兔子、恐龍魚。有網民擔心，雖然搖桿區域和小動物活動區域隔開，抓夾並不會直接觸碰到動物，但機器的震動、聲響、燈光仍會對動物產生影響。

門店負責人強調，並不是直接夾取動物，夾公仔機也經過改造，隔離動物區與操作區，並安排專人看管飼養動物。商場則表示，已與品牌公司積極溝通，該門店正在整改，已將涉事夾公仔機撤走，動物則轉到辦公區飼養，並由專人看管。"
bkn-20260105120008426-0105_00822_001,曾稱美不敢對馬杜羅輕舉妄動　華專家預測頻落空惹議,2026-01-05 12:00,2026-01-05 12:00,https://hk.on.cc/cnt/news/20260105/bkn-20260105120008426-0105_00822_001.html,曾稱美不敢對馬杜羅輕舉妄動　華專家預測頻落空惹議,中國,oncc,2026-01-05 12:15,"內地軍事評論家、國防大學教授李莉一個月前曾稱，委內瑞拉有俄羅斯的防空導彈，美國不敢輕舉妄動，委國總統馬杜羅「不慌」。惟美國近日空襲委內瑞拉並帶走馬杜羅後，引發網民對李莉分析評論的熱議，調侃「吹誰誰倒楣」。

李莉曾在一檔電視台的軍事節目中，大誇委內瑞拉的軍事實力不弱，當時更有題為《李莉：有S-300的委內瑞拉，美國就不敢輕舉妄動》的報道。另一內地軍事評論員、研究員杜文龍也曾稱，「美國不會派地面部隊推進，害怕陷入委內瑞拉人民戰爭的汪洋大海之中，不能自拔」。復旦大學國際關係與公共事務學院國際政治系教授沈逸亦多次分析稱，「美國不敢對委內瑞拉動武」、特朗普「關閉委領空」是虛張聲勢。

輿論批評這些專家預測再次讓民眾大跌眼鏡，甚至有網民揶揄，「這不是專家，實為文藝工作者」。李莉此前已有不少公開預測落空，如在俄烏戰爭開始時大膽拋出「俄羅斯速勝烏克蘭」論，以及在去年美以轟炸伊朗時預測伊朗半小時滅掉以色列，最終均自我打臉。"
