id,title,date,last_update,url,lead,section,source,scrape_time,news_content
bkn-20250809151016565-0809_00822_001,傳雷軍向海外轉移50億美元資產　小米否認,2025-08-09 15:10,2025-08-09 15:10,https://hk.on.cc/cnt/news/20250809/bkn-20250809151016565-0809_00822_001.html,傳雷軍向海外轉移50億美元資產　小米否認,中國,oncc,2025-08-09 15:15,"近日網傳小米集團董事長雷軍向海外轉移50億美元（約390億港元）資產，小米周五（8日）否認。

消息聲稱，雷軍通過美國富國銀行茅晨月向海外轉出50億美金。小米集團公關部總經理王化回應稱，經核實，小米集團在全球範圍內沒和富國銀行以及「茅XX」開展過任何合作，也未有任何形式上接觸。相關言論均已取證，並已啟動司法程序追究造謠傳謠者法律責任。

茅晨月是富國銀行高管，上月傳出被禁止離開中國。外交部發言人郭嘉昆上月21日證實，茅晨月涉及在辦的一宗刑事案件，被執法部門依法採取限制出境措施，根據中國法律，案件正在調查中，茅晨月女士暫時不能離境，並且有義務配合調查工作。"
bkn-20250809150454814-0809_00822_001,因大浪關係　大埔龍尾泳灘懸掛紅旗,2025-08-09 15:04,2025-08-09 15:04,https://hk.on.cc/cnt/news/20250809/bkn-20250809150454814-0809_00822_001.html,因大浪關係　大埔龍尾泳灘懸掛紅旗,香港,oncc,2025-08-09 15:15,康樂及文化事務署今日（9日）宣布，由於大浪關係，大埔龍尾泳灘已懸掛紅旗，顯示在該處游泳會有危險，市民請勿在該處游泳。
bkn-20250809145010396-0809_00822_001,基孔肯雅熱傳播風險低　病情亦輕微　醫管局前高層籲日清積水,2025-08-09 14:50,2025-08-09 14:50,https://hk.on.cc/cnt/news/20250809/bkn-20250809145010396-0809_00822_001.html,基孔肯雅熱傳播風險低　病情亦輕微　醫管局前高層籲日清積水,香港,oncc,2025-08-09 15:45,"基孔肯雅熱來勢洶洶，近日已有多人外遊後確診，令人擔心在香港爆發。醫管局港島東聯網前總監陸志聰表示，病毒透過蚊傳播，但傳染性較低，而即使被感染，患者的病症亦不算嚴重，呼籲市民毋須過慮，但說人人都要出分一力控蚊，包括清理家中盆栽的積水等。

陸志聰在電視台節目上指，本港近期錄得的基孔肯雅熱輸入個案，雖然需要隔離治療，但與新冠肺炎或流感等呼吸道傳染病不同，其傳染性相對較低。他指除非病蚊能走過全部障礙，又叮咬患者再叮咬他人，否則引發社區傳播的機會不大。

不過他提到市民仍需提高警覺，尤其近期天氣較差，家中不同位置可能會積水，舉例盆栽等，建議加密清理次數，由每周改為每日倒水，配合政府防蚊。

另一方面，公立醫院急症室將在迎來的元旦加價，冀減少輕症患者人數。不過坊間有意見指夜間門診不足，陸志聰認為，私家醫院分布不均，集中在香港及九龍中，建議借助私營醫療集團解決夜診需求。陸回顧過去曾嘗試增加公營夜診服務，現階段政府正積極發展基層醫療體系，若能明確劃分急診與門診服務定位，將更有利於相關政策的推行。

翻查資料，基孔肯雅熱潛伏期通常為3至8天。病人通常會發燒和關節痛，亦有可能會肌肉疼痛、頭痛、惡心、疲倦和紅疹。大部分病人可以自行痊愈，甚少引致的嚴重症狀及死亡，死亡率低於千分之一，但個別病人的關節痛會持續數月甚至數年。"
bkn-20250809143627763-0809_00822_001,西區城巴車門破裂　疑遭碎石擊中,2025-08-09 14:36,2025-08-09 14:36,https://hk.on.cc/cnt/news/20250809/bkn-20250809143627763-0809_00822_001.html,西區城巴車門破裂　疑遭碎石擊中,香港,oncc,2025-08-09 15:15,西區發生巴士玻璃爆裂事件。今午(9日)2時24分，一輛來往長沙灣海麗邨至香港仔石排灣的971路線的城巴，巴士由山道車站駛往堅彌地城海旁的車站期間，車長留意到車身傳出「呯」一聲。巴士駛至堅彌地城海旁36號對開車站後，車長檢查車身，發現落客位的車門破裂，留下一個細小的洞，懷疑遭碎石擊中。車長通知公司及報案求助。警員正調查巴士車門碎裂的原因。
bkn-20250809143043070-0809_00822_001,土力處陸續收山泥傾瀉報告　倡市民暫停登山保平安,2025-08-09 14:30,2025-08-09 14:30,https://hk.on.cc/cnt/news/20250809/bkn-20250809143043070-0809_00822_001.html,土力處陸續收山泥傾瀉報告　倡市民暫停登山保平安,香港,oncc,2025-08-09 15:15,"縱使最近數天的天氣變得晴朗，沒再下暴雨，但土力工程處指最近仍收到山泥傾瀉報告，並解釋山坡在暴雨期間吸收大量雨水，令泥土鬆動，而地下水緩慢流下，或改變山坡水壓而引發山泥傾瀉，倡市民暫登山或進入山泥傾瀉受影響範圍，以保障自身安全。

處方在社交平台「土力場」上載多張山泥傾瀉，部分相信是位於山徑，個別山坡「舖上」黃泥土，另有山坡倒塌，疑令路面路陷。該處指出，雖然天氣變得稍為穩定，但仍然陸續收到山泥傾瀉報告，部分影響一些山區的道路。

土力處解釋，經過連日暴雨，山坡吸收大量雨水，會令泥土變得鬆動和令地下水位持續上升。即使雨勢暫緩，上升了的地下水仍然會緩慢向山下流動，造成滯後效應，有機會改變山坡的水壓而引發山泥傾瀉。"
bkn-20250809142905986-0809_00822_001,東涌東站部分結構採用預製組件　首條行人天橋已完成安裝,2025-08-09 14:29,2025-08-09 14:29,https://hk.on.cc/cnt/news/20250809/bkn-20250809142905986-0809_00822_001.html,東涌東站部分結構採用預製組件　首條行人天橋已完成安裝,香港,oncc,2025-08-09 14:45,"東涌綫延綫東涌東站正進行結構工程，港鐵表示，東涌東站部分結構採用大型預製組件，當中最具標誌性、鋼架結構像英文字母「V」的兩條行人天橋已開始安裝，其中一條行人天橋已完成安裝。

港鐵在社交平台指，兩條行人天橋的鋼架結構已在工場製造好，運送到工地進行組裝，以自行式模塊運輸車，把整條500噸重的行人天橋架設到預定位置，再進行固定，一步到位。兩條行人天橋將連接東涌東站車站大堂及兩個出入口，接駁到未來東涌東新發展區。第一條行人天橋已順利安裝，第二條天橋將用同樣方法進行吊運及安裝。

東涌綫延綫將現有的東涌綫從東涌站向西伸延約1.3公里，並於逸東邨附近新設東涌西站，以及在東涌綫欣澳站與東涌站之間增設東涌東站，當中涉及對現有一段約1.2公里長的鐵路線進行改道。東涌綫延綫主要是為東涌新市鎮擴展區提供鐵路服務，項目已於2023年5月動工，預計於2029年竣工。"
bkn-20250809140739395-0809_00822_001,葵涌25歲男子許卓軒2月離家失蹤　家人報案尋人,2025-08-09 14:07,2025-08-09 14:07,https://hk.on.cc/cnt/news/20250809/bkn-20250809140739395-0809_00822_001.html,葵涌25歲男子許卓軒2月離家失蹤　家人報案尋人,香港,oncc,2025-08-09 14:15,25歲男子許卓軒2月離開其位於葵涌石籬（一）邨的住所後便告失蹤，其家人昨日（8日）向報案。許身高約1.65米，中等身材，尖面型，黃皮膚及蓄短黑髮。任何人如有該失蹤男子的消息或曾見過他，請與執法部門聯絡。
bkn-20250809140010689-0809_00822_001,持續打擊犯罪集團　多區掃黃拘67人,2025-08-09 14:00,2025-08-09 14:00,https://hk.on.cc/cnt/news/20250809/bkn-20250809140010689-0809_00822_001.html,持續打擊犯罪集團　多區掃黃拘67人,香港,oncc,2025-08-09 15:00,"7月29日執法部門展開一個代號「伏箭」 的行動， 目標是打擊一個勢力日益膨脹的三合會高層頭目及其犯罪集團。在那次行動中，執法部門成功拘捕了該名高層頭目和他的團夥，合共超過80人，亦凍結了超過11億港元。承接「伏箭」的執法行動，執法部門在本周四(7日)，展開了代號「天堡」 的反三合會拘捕行動。目標是打擊同一名三合會高層頭目和他們的犯罪集團，所操控或牽涉的一些傳統犯罪活動。

在今年3月份，執法部門派出臥底接近這個犯罪集團的成員，開始搜集情報和證據。調查發現犯罪集團藉著經營私人會所和樓上酒吧，或者透過一些他們認識的酒吧職員向顧客介紹性工作者提供服務，並且從中收取大筆佣金。這些性工作者絕大部分都是犯罪集團從外地招攬來香港，當中包括台灣、泰國及內地女士。初步的調查顯示出大部分性工作者都是透過一些社交媒體被招攬 。在性工作者留港期間，犯罪集團會提供住宿，也會每日安排七人車接送他們往返住宿的地方和穿梭不同的娛樂場所接客。每一次性交易的費用大約為是由5千至1萬港元不等。而收費絕大部分成為犯罪集團的收入。

除了操控賣淫外，有集團成員趁機向顧客兜售一些包括依托咪酯等毒品。至到本周四，警員認為時機成熟，於是聯同相關部門人員突擊搜查灣仔、中環和大埔的多個地點，包括由犯罪集團所經營或有聯絡的私人會所和酒吧。行動中，共拘捕67人，包括22男45女(20至62歲)。當中有20名持護照入境的台灣女子、1名台灣男子、4名泰國女子和17名持雙程證的內地女子，以及25名持香港身份證的人士。涉嫌「控制他人賣淫」、「依靠他人賣淫的收入為生」、「違反逗留條件」及「經營無牌酒吧」。行動亦檢獲了逾28萬港元現金、大量的單據和數簿，扣押8輛犯罪集團用來接載性工作者的七人車。而部分持護照或雙程證人士，已轉交相關部門跟進處理，而其他被捕人士正被扣留調查。"
bkn-20250809133007031-0809_00822_001,石籬一邨長者外地染基孔肯雅熱　房署邨內噴蚊油及清潔,2025-08-09 13:30,2025-08-09 13:30,https://hk.on.cc/cnt/news/20250809/bkn-20250809133007031-0809_00822_001.html,石籬一邨長者外地染基孔肯雅熱　房署邨內噴蚊油及清潔,香港,oncc,2025-08-09 14:15,"石籬一邨石俊樓低座有女長者從外地染上基孔肯雅熱，房屋署表示接獲衞生署通知後，已即時採取行動，減低蚊患風險，包括針對重點區域噴灑蚊霧及全面清潔與消毒石俊樓低座及周邊公共地方。

署方今日(9日)在社交專頁上載多張相片，見到身穿白色保護衣的工人拖着藍色的車，向渠口、草叢噴灑蚊油，亦有工人抹大廈信箱及升降機扶手等。該署說今日會繼續檢查渠口、清理積水及改善環境衞生，亦將與食環署聯合加強石籬邨內外的滅蚊，深入檢查及清理高風險地點。

房署又說，已向居民發出通告，提醒檢查檢查花盆托盤、容器及其他積水位置，倒置空置容器，避免積水，避免蚊蟲孳生。"
bkn-20250809132351659-0809_00822_001,華漢抵金邊被帶往網賭園區跳車亡　兩疑犯落網,2025-08-09 13:23,2025-08-09 13:23,https://hk.on.cc/cnt/news/20250809/bkn-20250809132351659-0809_00822_001.html,華漢抵金邊被帶往網賭園區跳車亡　兩疑犯落網,中國,oncc,2025-08-09 14:45,"一名中國籍男子上月底從香港飛抵柬埔寨金邊後僅數小時就陳屍郊外，警方周二（5日）逮捕兩名柬籍疑犯，他們涉嫌非法拘禁死者，並試圖把他送往網上賭博園區，他期間跳車身亡。案件背後疑涉人口販運網絡，且有中國人士參與操控，警方仍在調查事件。

柬埔寨警方上月31日凌晨3時15分接報，在金邊市3號公路17公里處一間小學附近發現一具男性屍體，頭部有明顯鈍器撞擊痕迹。24歲死者姓名拼音Wu YongLong，其隨身背囊內裝有護照、身份證、3張銀行卡、洗漱用品、一張由香港飛往金邊的機票，入境簽證繳費單顯示其於上月30日晚上11時剛抵埗。事發地周邊閉路電視畫面顯示，一輛黑色汽車凌晨2時36分高速行駛，車上人員拖拽屍體並迅速逃離現場。

金邊市警察局指出，死者並非遭殺害，而是在途中企圖逃脫時跳車，因頭部重擊導致當場死亡。疑犯供稱，他們在金邊國際機場附近接走死者，準備把他帶到貢布省卜哥山的網上賭博園區工作，途中搶走他的手機引發強烈反抗。死者趁機打開車門跳車逃跑，卻不幸身亡。"
bkn-20250809131304576-0809_00822_001,教育局停崇正中學營辦　深圳「摘星」中止招生活動,2025-08-09 13:13,2025-08-09 13:13,https://hk.on.cc/cnt/news/20250809/bkn-20250809131304576-0809_00822_001.html,教育局停崇正中學營辦　深圳「摘星」中止招生活動,香港,oncc,2025-08-09 13:45,"深圳補習社「摘星教育」被指「借殼」本港私校崇正中學營辦課程，令內地生可在港升學。不過，香港教育局昨(8日)暫停該學校營辦。深圳補習機構摘星教育今日(9日)隨即宣布，決定中止代理崇正中學的招生活動，今日內立即退還已收取的相關入學測驗費用。

深圳補習社「摘星教育」早前聲稱與崇正中學合辦中學文憑試課程，宣傳學生可用香港「學校考生」身份報考香港中學文憑試(DSE)。摘星昨改口指，「僅代理崇正中學招生」，並無在該中學舉辦課程，而擬招收的學生均需在崇正中學校址上課，教學人員均為該中學老師。

不過，崇正中學校監黃華安及校長董福分別指，從沒跟「摘星」合作，亦沒收到邀請，以及「完全不知道這件事」。摘星則再解畫，其教學人員均有與崇正中學簽合約，又展示授權書，顯示與崇正中學於上月18日簽署文件，代其招生。

教育局昨晚表示，鑑於常任秘書長覺得崇正中學校董的行為並不令人滿意，已按《教育條例》暫停該校在校舍內或校舍內任何部分營辦。局方又會繼續跟進事件，若發現學校有違法行為，定必嚴肅處理。"
bkn-20250809124318385-0809_00822_001,綠綠賞下周五換禮品815折　換超市禮券則不適用,2025-08-09 12:43,2025-08-09 14:17,https://hk.on.cc/cnt/news/20250809/bkn-20250809124318385-0809_00822_001.html,綠綠賞下周五換禮品815折　換超市禮券則不適用,香港,oncc,2025-08-09 14:45,"「綠綠賞」積分明年4月全面電子化前，環保署下周五(15日)推出「特別折日」活動，當日會員可以815折(18.5% OFF)積分換領禮品，但優惠不適用於換領超市現金券及餐飲美食禮券，而每款禮品只限享有一次折扣。

署方今日(9日)在「大嘥鬼」社交專頁指，8月15日是第3屆「全國生態日」，特別在當日推出綠綠賞特別折日活動。市民透過「綠綠賞」手機應用程式，或在環保署轄下「綠在區區」的回收環保站和回收便利點，可以815折積分兌換心儀禮品，或以優惠折扣兌換「易賞錢」積分。

而每款禮品只限1件享折扣優惠，積分折扣會於稍後以回贈方式發放至「綠綠賞」帳戶。根據英文版條款，折扣率為18.5%，當日換禮品只需原價的81.5%積分，相等於815折。"
bkn-20250809121743399-0809_00822_001,8月第一批白紋伊蚊指數　屯門掃管笏最高達16.4%,2025-08-09 12:17,2025-08-09 12:17,https://hk.on.cc/cnt/news/20250809/bkn-20250809121743399-0809_00822_001.html,8月第一批白紋伊蚊指數　屯門掃管笏最高達16.4%,香港,oncc,2025-08-09 13:00,"食環署今日(8日)公布8月份第一批白紋伊蚊誘蚊器指數，當中屯門區掃管笏的指數最高達16.4%，其次尖沙咀東7.4%，而北角則7.1%。

食環署表示會按因應基孔肯雅熱情況而實施的安排（即將原先在分區誘蚊器指數達20%時進行的強化控蚊工作，擴展至誘蚊器指數介乎10%至20%的區域），聯同有關部門及持份者攜手強化滅蚊工作，找出蚊患情況較高的地點，進行密集且具針對性的控蚊工作。食環署亦會舉辦宣傳展覽、派發宣傳單張及海報，並通知各訂閱快速通報系統的屋苑，建議管理公司和住戶提高警覺，共同採取防蚊滅蚊措施。"
bkn-20250809121116834-0809_00822_001,七國集團指國安處通緝「香港議會」成員涉鎮壓港府斥不實及「雙標」,2025-08-09 12:11,2025-08-09 12:11,https://hk.on.cc/cnt/news/20250809/bkn-20250809121116834-0809_00822_001.html,"七國集團指國安處通緝「香港議會」成員涉鎮壓　港府斥不實及「雙標」


國安處上月通緝在境外籌組「香港議會」的16名成員及潛逃者，美國及七國集團快速反應機制成員國日前指上述行為涉鎮壓，政府發言人今日(9日)強烈不滿和反對上述不實和偏頗言論，稱本港依法緝捕潛逃境外危害國家安全分子，任何外國或外部勢力企圖詆毀香港情況，只會理屈詞窮，絕不會得逞。<br",香港,oncc,2025-08-09 15:45,"國安處上月通緝在境外籌組「香港議會」的16名成員及潛逃者，美國及七國集團快速反應機制成員國日前指上述行為涉鎮壓，政府發言人今日(9日)強烈不滿和反對上述不實和偏頗言論，稱本港依法緝捕潛逃境外危害國家安全分子，任何外國或外部勢力企圖詆毀香港情況，只會理屈詞窮，絕不會得逞。

發言人指，國安處向潛藏境外的潛逃者發出通緝令，是執行法院發出的拘捕令，及相關人士在當地繼續公然從事危害國家安全的勾當，並非因為他們「行使發表的自由」。

港府強調，危害國家安全是非常嚴重的罪行，可能造成極為嚴重的後果，特區政府有責任依法追究在境外涉嫌干犯《香港國安法》及其他危害國家安全罪行的人，任何外部勢力及別有用心人士，在特區政府提出相關措施後，詆毀盡責、忠誠和依法維護國家安全的香港特區，實乃典型的虛偽「雙標」。

國安處於7月25日公布懸紅通緝16名潛逃者，以及2024年6月及12先後被指明為潛逃者的袁弓夷、霍嘉誌及蔡明達，19人在境外籌組、成立或參與一個名為「香港議會」的顛覆組織。"
bkn-20250809120102700-0809_00822_001,酒店四工人通渠期間一氧化碳中毒　送院搶救情況穩定,2025-08-09 12:01,2025-08-09 12:01,https://hk.on.cc/cnt/news/20250809/bkn-20250809120102700-0809_00822_001.html,酒店四工人通渠期間一氧化碳中毒　送院搶救情況穩定,澳門,oncc,2025-08-09 12:45,"澳門孫逸仙大馬路一間大型酒店發生一氧化碳中毒事件，4名男員工中毒送院搶救後情況穩定。該4名員工(31至38歲)均為澳門居民，其中3人為酒店工程部人員，事發於酒店的員工區域內，昨日(8日)下午2時30分，該3名工程部人員在地庫層隔油房內開展通渠工作，其中一人於下午3時30分突然感到頭暈並跌倒地上，曾意識不清，其餘兩人相繼出現頭暈、心悸等不適症狀。隨後一名工作人員進入室內協助時也感頭暈不適，遂傳召救護車送至鏡湖醫院搶救。

4人在醫院經檢測血液一氧化碳血紅蛋白（COHb）濃度後，診斷為一氧化碳中毒並高壓氧治療，其後情況穩定。衞生局指，現場房間設有空調及抽風設備，但工作期間經常閉門，並曾使用通渠機器燃燒運作10分鐘至15分鐘，機器運作時會產生煙霧。今次事件初步懷疑為使用燃燒設備時，通風不良造成有害氣體積聚所致，酒店內該空間已停止使用。"
bkn-20250809120034140-0809_00822_001,二戰終戰日臨近　石破茂將不參拜靖國神社,2025-08-09 12:00,2025-08-09 12:00,https://hk.on.cc/cnt/news/20250809/bkn-20250809120034140-0809_00822_001.html,二戰終戰日臨近　石破茂將不參拜靖國神社,中國,oncc,2025-08-09 13:15,"日本知情人士周五（8日）透露，日本首相石破茂基本確定不會在8月15日二戰終戰日參拜靖國神社，將以自民黨總裁身份自費獻上祭祀費。

農林水產大臣小泉進次郎被問及會否參拜時，他稱不便發表作為閣僚的評論，作為個人會妥善判斷。他2020年和2021年擔任環境大臣時，曾在二戰終戰日參拜靖國神社。內閣官房長官林芳正、防衞大臣中谷元等亦表示，會妥善判斷。

明確表態不會參拜的閣僚包括總務相村上誠一郎、外相岩屋毅、文部科學相阿部俊子、國土交通相中野洋昌、數字相平將明、兒童政策擔當相三原順子、沖繩北方擔當相伊東良孝、經濟產業相武藤容治。"
bkn-20250809114232958-0809_00822_001,廣州及東莞今起清積水滅蚊　防範基孔肯亞熱,2025-08-09 11:42,2025-08-09 11:42,https://hk.on.cc/cnt/news/20250809/bkn-20250809114232958-0809_00822_001.html,廣州及東莞今起清積水滅蚊　防範基孔肯亞熱,廣東,oncc,2025-08-09 13:15,"廣東省多地出現基孔肯亞熱疫情，廣州和東莞周六（9日）開展愛國衞生運動統一行動，清理積水和消除蚊蟲孳生環境等，防範疫情。

東莞周六至下周日（10日）在全市範圍組織機關企業單位、村落、社區和工廠企業等共同做好環境衞生整治等工作，開展潔淨城市活動，確保全市全覆蓋、無死角。廣州周六亦在全市範圍開展愛國衞生運動統一行動，要求市民和單位共同行動。

湛江霞山區近日有家長投訴，當地村委會等工作人員於凌晨時份上門給獨自在家的兩名孩子抽血。衞生健康局周五（8日）解釋，因當地近日出現基孔肯亞熱確診病例，需緊急排查，該戶人家的一名孩子近期有發燒求醫紀錄，需盡快確認是否染疫，故採取「特殊情況特殊處理」。經檢測，兩名孩子確診感染基孔肯亞熱。至於孩子抽血後身體不適，相關部門已安排醫護人員上門查看。"
bkn-20250809113020818-0809_00822_001,打擊西九龍非法電動單車拘42人　包括巴裔假難民外賣員,2025-08-09 11:30,2025-08-09 11:30,https://hk.on.cc/cnt/news/20250809/bkn-20250809113020818-0809_00822_001.html,打擊西九龍非法電動單車拘42人　包括巴裔假難民外賣員,香港,oncc,2025-08-09 12:45,"西九龍總區人員在上周一(4日)起一連五日，在區內進行代號為「閃步」的打擊非法駕駛電動可移動工具的行動。 行動中，執法部門分別派出便裝和軍裝人員，在深水埗、油尖旺和九龍城區內一共拘捕42人（18至66歲），包括29名本地男子、3名本地女子和10名非華裔男子。在被捕人士中，其中11人被捕時正在使用電動單車送外賣。所有被捕人士已經被獲准保釋候查，行動中共檢獲42輛電動單車。 

據了解，被捕10名非華裔男子包括巴基斯坦裔、印度裔、埃及裔及孟加拉裔，其中5人持「行街紙」留港。 

被捕人分別涉嫌「在行人路上駕駛電單車」、「駕駛未有登記車輛」、「駕駛時沒有駕駛執照」、「沒有第三者保險而使用車輛」及「駕駛時沒有戴上認可防護頭盔」。其中一名持「行街紙」 的36歲巴基斯坦裔男子，因被捕時正在送外賣。據悉，外賣平台的外賣員需要以香港身份證進行註冊，而被捕巴漢使用別人的外賣平台帳號進行工作，可能涉嫌詐騙外賣平台公司。該名巴漢另涉嫌「串謀詐騙」及「禁止接受僱傭工作」被捕。

執法部門指在市區使用電動單車不僅違法，而且是非常危險的行為。電動單車的最高速度可以輕易達到時速50公里或以上，其實已經與一輛普通電單車速度相若。電動單車亦不受任何第三者保險保障，一旦發生交通意外，其他道路使用者包括行人和駕駛人士都得不到保障。

除了執法行動之外，執法部門一直與香港主流的外賣平台保持良好合作關係，如果外賣平台發現他們的外賣員在送外賣時違反了嚴重的交通規例，包括使用電動單車， 平台是會主動凍結他們的平台帳號。"
