id,title,date,last_update,url,lead,section,source,scrape_time,news_content
bkn-20260210091127148-0210_00822_001,機電署抽查石油氣品質化驗樣本符合車用石油氣規格,2026-02-10 09:11,2026-02-10 09:11,https://hk.on.cc/cnt/news/20260210/bkn-20260210091127148-0210_00822_001.html,"機電署抽查石油氣品質化驗　樣本符合車用石油氣規格


機電工程署（機電署）今日（9日）公布，該署於2026年1月以隨機抽樣的方式從石油氣加氣站和儲藏庫抽取了9個石油氣樣本化驗，結果顯示所有樣本品質均符合車用石油氣規格，詳細化驗結果載於機電署網頁。",香港,oncc,2026-02-10 14:15,機電工程署（機電署）今日（9日）公布，該署於2026年1月以隨機抽樣的方式從石油氣加氣站和儲藏庫抽取了9個石油氣樣本化驗，結果顯示所有樣本品質均符合車用石油氣規格，詳細化驗結果載於機電署網頁。
bkn-20260210090545831-0210_00822_001,KK園區630多幢建築物拆除　逾1500疑犯押返華,2026-02-10 09:05,2026-02-10 09:05,https://hk.on.cc/cnt/news/20260210/bkn-20260210090545831-0210_00822_001.html,KK園區630多幢建築物拆除　逾1500疑犯押返華,中國,oncc,2026-02-10 09:15,"中國公安部周一（9日）通報，中國、緬甸和泰國近期在緬甸妙瓦底賭詐園區行動中抓獲的1,500多名疑犯已押解返華，KK園區630多幢相關建築物已全部拆除。

通報稱，山東省、廣西自治區公安機關近日按照公安部統一部署組織警力，將近期中緬泰聯合清剿緬甸妙瓦底賭詐園區行動中抓獲的疑犯押解回國，截至目前，妙瓦底KK園區相關涉電騙疑犯均已被押解回國。公安部指出，聯合清剿行動取得階段性成效。

公安部赴緬、泰工作組今年以來在駐緬、駐泰使館支持下，與兩國外交、移民、軍警等相關部門展開多輪次磋商會談，持續推動集中清剿工作，連續展開10次聯合遣返行動。公安機關將推動更多聯合打擊清剿行動，堅決剷除犯罪窩點，全力緝捕疑犯。"
bkn-20260210082652803-0210_00822_001,假冒內地官員又得手37歲男戶口逾2千萬被轉走,2026-02-10 08:26,2026-02-10 15:31,https://hk.on.cc/cnt/news/20260210/bkn-20260210082652803-0210_00822_001.html,"假冒內地官員又得手　37歲男戶口逾2千萬被轉走


本月(2日)一名37歲男子報案，指他在2025年9月25日收到聲稱為內地官員的來電，指其涉及一宗內地刑事案件，要求其下載一手機應用程式及提供銀行帳戶資料協助調查。事主其後發現其帳戶內約2,280萬元、被人先後26次轉帳至6個本地銀行戶口，懷疑受騙報案求助。警員經初步調查，案件列「以",香港,oncc,2026-02-10 17:15,"本月(2日)一名37歲男子報案，指他在2025年9月25日收到聲稱為內地官員的來電，指其涉及一宗內地刑事案件，要求其下載一手機應用程式及提供銀行帳戶資料協助調查。事主其後發現其帳戶內約2,280萬元、被人先後26次轉帳至6個本地銀行戶口，懷疑受騙報案求助。警員經初步調查，案件列「以欺騙手段取得財產」處理，暫未有人被捕。

據了解，受騙男子姓鄭，去年9月25日收到訛稱深圳市人力資源和社會保障局職員騙徒來電，對方聲稱鄭男涉及一宗內地洗黑錢案，電話其後轉駁到另有2名扮演公安的騙徒，要求他提供銀行戶口資料協助調查。

鄭男按對方指示，於去年10月中下載了一個應用程式，並進行網上銀行服務。至今年2月2日，鄭男收到銀行信息指其銀行戶口操作不尋常，因此發現由去年10月20日至今年1月31日期間，其戶口內約2,280萬港元，被人先後分26次轉賬至6個銀行戶口。鄭男與騙徒失聯後才知道上當受騙報案。"
bkn-20260210082621108-0210_00822_001,招遠金礦墜罐釀7死企業涉嫌瞞報遭調查,2026-02-10 08:26,2026-02-10 08:26,https://hk.on.cc/cnt/news/20260210/bkn-20260210082621108-0210_00822_001.html,"招遠金礦墜罐釀7死　企業涉嫌瞞報遭調查


山東省招遠市蠶莊金礦上莊礦段一盲豎井上周六（7日）發生墜罐事故，造成7人死亡。事發後礦井沒有及時上報，應急、公安等相關部門已對事故原因及企業涉嫌瞞報等問題同步展開調查，控制礦長等11人。<br/><br/>蠶莊金礦是招金礦業股份有限公司成員企業，成立於200",山東,oncc,2026-02-10 16:45,"山東省招遠市蠶莊金礦上莊礦段一盲豎井上周六（7日）發生墜罐事故，造成7人死亡。事發後礦井沒有及時上報，應急、公安等相關部門已對事故原因及企業涉嫌瞞報等問題同步展開調查，控制礦長等11人。

蠶莊金礦是招金礦業股份有限公司成員企業，成立於2009年，下設上莊礦區、黃埠嶺礦區。運送工人的罐籠深入井下第三礦段時因鋼繩斷裂墜入240米下井底，事故直接原因是雙重保險鋼繩同時斷裂，情況非常少見。

招遠市應急局周一（9日）接到舉報後才知悉發生事故，蠶莊金礦礦長、總工程師、安全副礦長、生產副礦長、機電副礦長，以及蠶莊金礦上莊段礦長、總工程師、安全副礦長、生產副礦長、機電副礦長、車間主任已被控制。招金礦業職員回應指，事故對營收暫不會造成影響。但對於涉事金礦是否已停業、涉嫌瞞報等關鍵問題，職員則稱要諮詢公司相關職能部門，而其提供的聯繫電話始終無人接聽。

招遠市應急管理局去年12月罰款蠶莊金礦處3萬元（人民幣，下同，約3.3萬港元），違規行為包括上莊礦段-460米中段4601採場下口放礦穿漏斗以裏15米獨頭倒車巷未安裝局部通風機通風；上莊礦段-860米中段中央水泵房配電所電力變壓器的容量為630KVA，當一台變壓器停止運行時，另一台變壓器無法承擔全部負荷。

此外，蠶莊金礦應急救援庫內止血帶、三角巾、挎包數量少於應急預案規定的應急救援物資數量，違反《生產安全事故應急預案管理辦法》第三十八條，去年8月遭招遠市應急管理局罰款2.5萬元（約2.7萬港元）。"
bkn-20260210082502198-0210_00822_001,泰國抵港航班男子失值15萬港元外幣　內地漢涉盜竊被捕,2026-02-10 08:25,2026-02-10 08:25,https://hk.on.cc/cnt/news/20260210/bkn-20260210082502198-0210_00822_001.html,泰國抵港航班男子失值15萬港元外幣　內地漢涉盜竊被捕,香港,oncc,2026-02-10 08:45,機場區警員昨日(9日)接獲報案，指一名男乘客在一班由泰國飛往香港的航班上將手提行李放在座位上方的置物櫃，其後發現行李內價值約15萬元港元的外幣現金不翼而飛，懷疑被人盜去。人員接報到場，經初步調查後拘捕一名41歲的內地男子，涉嫌「盜竊」，他現正被扣留調查。
bkn-20260210080455564-0210_00822_001,公安部下發通知　嚴打涉網食品安全犯罪,2026-02-10 08:04,2026-02-10 08:04,https://hk.on.cc/cnt/news/20260210/bkn-20260210080455564-0210_00822_001.html,公安部下發通知　嚴打涉網食品安全犯罪,中國,oncc,2026-02-10 08:15,"內媒周一（9日）報道，公安部環境資源和食品藥品犯罪偵查局近日下發通知，要求各地部門依法嚴厲打擊涉網食品安全犯罪，切實淨化網絡食品消費環境，並針對網絡平台製售假劣食品、保健品虛假宣傳等突出問題，強化責任擔當，維護民眾飲食安全。

通知要求相關部門緊盯電商、直播、外賣等重點平台，聚焦假劣保健品、肉製品及「幽靈外賣」等多發問題，持續展開網上巡查與線索排查，對涉嫌犯罪堅決立案。針對此類犯罪地域分散、隱蔽性強等特點，須堅持打早打小、快偵快破，消除風險隱患。同時對跨區域系列案件展開集群打擊，堅決摧毀犯罪窩點與非法利益鏈條。

通知強調，有關部門需進一步加強與市場監管、農業農村等部門協作，推動行政執法與刑事司法有效銜接，配合落實直播電商食品安全主體責任規定，加強資訊共享與案件移送。此外，須強化與法檢機關溝通，準確適用法律武器，全面提升打擊效能。"
bkn-20260210080115660-0210_00822_001,今日大致多雲　早上清涼　最高氣溫約20°C,2026-02-10 08:01,2026-02-10 08:01,https://hk.on.cc/cnt/news/20260210/bkn-20260210080115660-0210_00822_001.html,今日大致多雲　早上清涼　最高氣溫約20°C,香港,oncc,2026-02-10 08:15,"東北季候風正影響廣東沿岸。同時，一道廣闊雲帶覆蓋該區。今日(10日)上午8時，天文台錄得氣溫攝氏17度，相對濕度百分之75。過去一小時，京士柏錄得的平均紫外線指數是0.0，強度屬於低。

預測今日大致多雲。早上清涼，日間最高氣溫約攝氏20度。吹和緩東風，初時風勢間中清勁。展望明日(11日)日間部分時間有陽光，隨後一兩日風勢較大。周末至下周初日間溫暖，早晚較為潮濕。"
bkn-20260210070045213-0210_00822_001,傳統療法下50%患者5年內亡　組織盼肺動脈高壓新藥納資助名冊,2026-02-10 07:00,2026-02-10 07:00,https://hk.on.cc/cnt/news/20260210/bkn-20260210070045213-0210_00822_001.html,傳統療法下50%患者5年內亡　組織盼肺動脈高壓新藥納資助名冊,香港,oncc,2026-02-10 07:15,"肺動脈高壓是一種嚴重的罕見病，情況嚴重者即使留在家中都會氣喘。現時對於此症的藥物以紓緩病徵、延緩惡化為主，惟效果並不理想，即使已使用現有治療，仍有一半患者於5年內死亡。去年一款新藥「活化素訊號抑制劑」就被引進本港，有望透過新機制逆轉肺動脈高壓的血管重塑情況。有患者在接受新藥治療後，不再感頭暈，步行能力顯著提升，效果良好。有病人組織指新藥助病友會員改善病情，希望該藥能納入醫管局藥物名冊或安全網，令病友重拾生活期盼。

肺動脈高壓會令病人肺部血管壁增生變厚、血管變窄，使心臟需要更為用力將血送到肺部，右心及血管的壓力增加，血氧含量降低，患者更易出現疲勞、胸痛及呼吸困難，甚至導致右心衰竭及死亡。香港先天性及結構性心臟病學會理事會成員、心臟科專科醫生阮嘉駿指出，部分肺動脈高壓個案成因涉及遺傳，亦有個案成因未明，以女性患者較常見。

現年30多歲的王小姐在新冠疫情期間發病，初時因徵狀輕微而未有理會，惟及後病情不斷惡化，藥物只能延緩惡化。幸好近年以該新藥治療，在6分鐘步行測試中，由最初評定為只可以行十幾米，增加至100多米，甚或有望痊愈。

香港罕見疾病聯盟代理會長賴家衞表示，以新藥治療後，部分病人由以往不能出門，到可以自己外出，轉變極大，惟目前該藥物未納入醫管局藥物名冊或安全網，醫生要以「指定病人」形式為每位病人處方藥物，病人亦要自費用藥，而該新藥藥價一個月約需數萬元，雖非「天價」，但對一般家庭來說仍是沉重負擔，期望政府在資助方面可多作考慮，加快審視將新藥納入藥名冊和安全網，讓患者更易負擔合適藥物。"
bkn-20260210061339218-0210_00822_001,巨石突然滑落　砸中貨車損毀嚴重,2026-02-10 06:13,2026-02-10 06:13,https://hk.on.cc/cnt/news/20260210/bkn-20260210061339218-0210_00822_001.html,巨石突然滑落　砸中貨車損毀嚴重,台灣,oncc,2026-02-10 06:15,"台灣一名菲律賓籍勞工周日（8日）晚駕駛貨車，載送生病的62歲同鄉自泰安鄉山區就診後返程，行經大安產業聯絡道路2公里處彎道期間，邊坡突然崩落數顆巨石，其中一塊與擋風玻璃面積相近的巨石直接砸中車頭。所幸貨車結構堅固才抵擋撞擊，卻損毀嚴重，車內兩人並未受傷。

事發於周日6時許，轄區大湖警方周一（9日）表示，落石造成車輛前擋風玻璃及駕駛座嚴重損毀，現場交通一度受阻。警方到場後協助初步清理零星落石，並對司機實施酒測，結果為零。救護人員檢視後確認兩人無礙，毋須送醫。車輛後續待維修處理。

大湖警分局指，將通報相關單位加強巡查該路段，維護用路人安全，同時呼籲民眾行經山區道路時應提高警覺，注意邊坡狀況，以防落石意外，確保行車安全。"
bkn-20260210060226352-0210_00822_001,中環男子高處墮下　當場斃命,2026-02-10 06:02,2026-02-10 06:02,https://hk.on.cc/cnt/news/20260210/bkn-20260210060226352-0210_00822_001.html,中環男子高處墮下　當場斃命,香港,oncc,2026-02-10 06:30,"中環有人墮樓亡。今晨(10日)5時57分，有途人報案，指金鐘道88號對開，有一名男子倒臥在行人路上，懷疑從高處墮下。救援人員接報到場，該男子被證實當場氣絕，警員於現場沒有檢獲遺書。其死因有待驗屍後確定。

防止自殺求助熱線：

香港撒瑪利亞防止自殺會： 2389 2222

生命熱線： 2382 0000

社會福利署： 2343 2255

撒瑪利亞會熱線(多種語言)： 2896 0000

醫管局精神健康專線： 2466 7350

明愛向晴軒： 18288

東華三院芷若園： 18281

「情緒通」熱線： 18111

賽馬會青少年情緒健康網上支援平台「Open噏」： http://www.openup.hk"
bkn-20260210041825544-0210_00822_001,網上湧現抑鬱測試　專家警告誤導心理健康,2026-02-10 04:18,2026-02-10 04:18,https://hk.on.cc/cnt/news/20260210/bkn-20260210041825544-0210_00822_001.html,網上湧現抑鬱測試　專家警告誤導心理健康,中國,oncc,2026-02-10 04:30,"內媒周一（9日）報道，內地社交平台最近出現大量宣稱能快速診斷抑鬱症等心理問題的低價在線測試，吸引不少網友付費嘗試。惟有專家指，網絡流傳的測試缺乏並不嚴謹，甚至形成一條引流牟利的灰色利益鏈。

報道指，此類測試往往聲稱只需數分鐘和數元人民幣，即可通過答題或看圖評估心理健康狀態。然而，專家指出，網絡流傳的測試多屬正規量表的簡化版，缺乏科學嚴謹性，結果並不可靠，且背後已形成利用偽心理學吸引流量、售賣測試鏈接的灰色利益鏈。

專家警告，隨意使用未經驗證的心理測試可能帶來雙重風險，包括可能造成錯誤自我暗示，加重心理負擔，亦可能延誤真正問題的及時發現與干預，呼籲網絡平台加強內容審核，阻斷偽心理學資訊的傳播。中國心理學會註冊督導師沈家宏強調，這些測試不能替代精神科醫生的專業診斷，只可視為娛樂，切勿當真。"
bkn-20260210041501622-0210_00822_001,港島半山單位露台燒烤　焫着罐裝氣體陷火海　戶主撲熄無人傷,2026-02-10 04:15,2026-02-10 08:31,https://hk.on.cc/cnt/news/20260210/bkn-20260210041501622-0210_00822_001.html,港島半山單位露台燒烤　焫着罐裝氣體陷火海　戶主撲熄無人傷,香港,oncc,2026-02-10 08:45,"港島半山發生火警。昨晚(9日)7時23分，干德道41號聯邦花園一高層單位，戶主於露台與友人燒烤聯歡期間，疑火舌焫着旁邊罐裝氣體引起火警，露台瞬間陷入火海，附近多名街坊見狀恐有人受傷慌忙報案求助。

消防接報到場時火勢已被姓蕭(48歲)男戶主撲熄，事件中幸無人受傷，亦無需疏散。經初步調查相信，火警由燒烤火舌焫着罐裝氣體所致，起因無可疑。"
bkn-20260210041416133-0210_00822_001,屯門無業婦煮食煲殺夫被捕　疑夫妻長期關係惡劣犯案,2026-02-10 04:14,2026-02-10 17:59,https://hk.on.cc/cnt/news/20260210/bkn-20260210041416133-0210_00822_001.html,屯門無業婦煮食煲殺夫被捕　疑夫妻長期關係惡劣犯案,香港,oncc,2026-02-10 18:15,"屯門發生謀殺案。昨晚(9日)6時41分，屯門新秀街井頭中村一名姓陳(63歲)男子，被發現倒臥床上反應全無，經檢查後證實已明顯死亡。警員發現陳男頭部有嚴重傷勢，疑被鈍物襲擊所致。今日(10日)凌晨3時許，案件被暫列作「謀殺」跟進，並拘捕死者的妻子，其女兒被帶返署協助調查，死者遺體由仵工舁送殮房安放。

執法部門表示，涉案村屋約300呎，案發時除陳男外，其妻子和女兒也在場，調查期間陳妻報稱身體不適，出現頭暈和嘔吐，她被送到屯門醫院治理。陳男一家三口居住上址超過20年，他任職清潔工人，妻子51歲報稱無業，二人的24歲女兒為學生。調查顯示，陳男與妻子俱有長期病患，他有心臟病，妻子則有腎病，夫妻長期關係緊張，經濟亦非常拮据，因此不時發生糾紛。

調查相信，兇案發生於昨日清晨時分，陳女指在清晨2時見過父親在屋內使用電話，然後她回房睡覺。至清晨時分，陳女突然聽到撞擊聲，但不以為意繼續睡覺，早上7時她亦如常起床回學校上課。及晚上6時許她放學回家，始發現父親躺臥床上毫無反應，頭部有明顯傷痕兼滿布血漬，隨即報案。法醫和政府化驗師經檢驗後，相信陳男已死去一段時間，死亡時間亦與女兒的證供脗合，同時在現場檢獲相信是行兇的兇器，一個約19厘米直徑不銹鋼煮食煲，現己將其交政府化驗所作進一步化驗。

今早執法部門以涉嫌「謀殺」罪拘捕陳妻，她因為身體不適繼續留醫，稍後將會暫控她「謀殺」罪，陳男的死因有待法醫進一步驗屍才能確認。據了解，陳男於百貨公司任職清潔工，因生肖屬蛇而人稱「水蛇」。

執法部門續指，疑兇沒有任何精神病紀錄，夫妻的關係長期緊張，並且素有積怨，根據夫妻的女兒透露，夫妻長期有拗撬，例如經常為生活瑣碎事、陋習及經濟問題等發生爭執。"
bkn-20260210033543222-0210_00822_001,充公黎不法財產　《蘋果》3公司撤登記名單,2026-02-10 03:35,2026-02-10 03:35,https://hk.on.cc/cnt/news/20260210/bkn-20260210033543222-0210_00822_001.html,充公黎不法財產　《蘋果》3公司撤登記名單,香港,oncc,2026-02-10 04:00,"國安處就黎智英案判刑會見傳媒，指歡迎法庭重判黎智英囚20年，顯示其罪行嚴重，凸顯其罪魁禍首和幕後推手的角色，並指黎智英稱其欠佳的健康情況誇大其詞。另外，政府發言人稱，將會依法充公黎智英罪行的相關財產，並將會啟動程序，將《蘋果日報》3間相關公司自公司登記冊中剔除。

國安處指出黎智英勾結外國勢力對自己國家進行制裁，並表示他利用自己的傳媒及其一手培植的激進分子作出煽動，行為極度卑劣。同時國安處就案中5名從犯證人被判囚6年3個月至7年3個月，對比餘下3名被告被判10年監禁，表示此體現出國安法第33條中揭發他人犯罪行為，若查證屬實，被告可獲從輕發落的情節。

對於黎智英早前以年老、身體狀況欠佳及單獨囚禁作為求情理由，國安處表示黎智英明顯地沒有對香港做過甚麼好事，可作為其在庭上求情的因素。國安處回應記者提問指，黎智英稱其欠佳的健康情況誇大其詞，雖法庭就此給予其小量減刑，但此純屬法庭格外施恩，不代表黎智英沒有誇大；至於會否對案中被告的刑期作覆核上訴，國安處表示須再跟律政司商討，暫時沒有意見。

外交部則回應指，黎智英被重判入獄20年，彰顯法治，伸張正義，大快人心，又指黎危害國家安全的惡行，傷害國家及香港特區的利益，傷害市民的利益。當局續指，法庭經過156天公平公正的公開聆訊，審視多達2,220項證物、超過8萬頁文件、14名控方證人的證供，鐵證如山，證實黎智英的反中亂港主腦角色，行為齷齪無恥。"
bkn-20260210033037074-0210_00822_001,東方日報A1：黎智英重判20年監禁　恐鐵窗度餘生,2026-02-10 03:30,2026-02-10 03:30,https://hk.on.cc/cnt/news/20260210/bkn-20260210033037074-0210_00822_001.html,東方日報A1：黎智英重判20年監禁　恐鐵窗度餘生,香港,oncc,2026-02-10 04:00,"壹傳媒黎智英連同《蘋果日報》旗下3間公司，涉串謀勾結外國或者境外勢力危害國家安全及發布煽動刊物等共3罪，違反《港區國安法》，包括黎在內的4名被告早前被裁定全部控罪罪成，昨與認罪的《蘋果》6名高層及「重光團隊」兩名成員在西九龍法院（暫代高院）接受判刑。黎智英判囚20年，當中18年與被控欺詐的區院案件分期執行。包括張劍虹在內的《蘋果》6名高層分別被判監6年9個月至10年；「重光團隊」兩人被判監6年3個月及7年3個月。3間《蘋果》公司各判罰款3,004,500元。法官指本案不僅經精心策劃，而且早有預謀，黎是各項串謀的幕後主腦和推動者，案件屬嚴重及涉重大犯罪行為。

涉案12名被告包括黎智英、蘋果日報有限公司、蘋果日報印刷有限公司及蘋果日報互聯網有限公司；壹傳媒高層張劍虹、陳沛敏、羅偉光、林文宗、馮偉光及楊清奇；「重光團隊」成員陳梓華及李宇軒。9人中只有黎作不認罪抗辯，受審後連同該3間公司被裁定罪成，8名認罪被告承認串謀勾結外國或者境外勢力危害國家安全罪。

法官昨頒發長達47頁的判刑書指，參考了《國安法》相關案例，認為在考慮當時社會氣氛、罪行規模、被告請求制裁的目標、涉案行為是否成功導致外國制裁等，本案勾結外國勢力的罪行屬「罪行重大」。根據《國安法》，刑期不應少於監禁10年。法官另強調，《國安法》不具追溯力，故各被告不應因其在法例實施前的行為或政治思想而受到懲處，在法例實施前的事僅構成犯案背景的一部分。

判詞指，本案勾結外國勢力的串謀不僅是經精心策劃，更是早有預謀，並透過使用網上平台去觸及本地和海外受眾。此外，涉案「重光團隊」的國際游說活動在香港境內和境外進行，被告請求外國實施制裁、封鎖或者採取其他敵對行動，促成外國政府針對香港及中國政府官員採取制裁等措施。因此法官就勾結罪採用監禁15年作量刑起點，涉案公司量刑起點則訂於罰款300萬元。至於串謀發布煽動刊物罪，法官指煽動文章以實體版刊印及在網上平台發布，考慮到文章數量、參與發布文章的各方人數及罪行持續時間，裁定屬最嚴重級別；單就該罪，法官採納監禁21個月作為黎智英的量刑起點，涉案公司則以罰款4,500元作量刑起點。

黎智英方面，法庭裁定黎是各項串謀的幕後主腦和推動者，並將其量刑起點提高，串謀發布煽動刊物罪增至監禁23個月，另外兩罪則增至監禁18年。辯方提出以黎的高齡、健康狀況及單獨囚禁等作減刑因素，法官指明白黎有高血壓、糖尿病及指甲脫落等問題，但據最新醫療報告顯示，該些問題並不致命，而單獨囚禁亦是黎自行要求。法官在考慮後認為該些情況令黎的獄中生活比其他囚犯更艱難，給予酌情減刑，就部分控罪同期執行下，終就3罪判囚20年。

黎早前在區院因欺詐罪成被判囚5年9個月且正服刑，法庭考慮到該案與本案性質完全不同且毫無關連，故把黎在本案刑期中的18年與欺詐案分期執行。至於《蘋果》3間公司，法官指其沒有有力求情理由，就兩項控罪3間公司均須罰款3,004,500元。案件編號：HCCC 147/2021、HCCC 51、52/2022

更多新聞，請瀏覽東方日報網頁：

http://orientaldaily.on.cc/"
bkn-20260210033023170-0210_00822_001,《東方日報》今日要聞,2026-02-10 03:30,2026-02-10 03:30,https://hk.on.cc/cnt/news/20260210/bkn-20260210033023170-0210_00822_001.html,《東方日報》今日要聞,香港,oncc,2026-02-10 04:00,一貼睇晒《東方日報》A1新聞頭條、B1財經要聞及C1娛樂最爆，以及東網嚴選的本港、兩岸及國際重點新聞，名家評論，讓你在最短時間掌握最重要資訊。
bkn-20260210021803257-0210_00822_001,跨部門油尖區掃黃及打擊黑工　拘33人年齡介乎18歲至65歲,2026-02-10 02:18,2026-02-10 02:18,https://hk.on.cc/cnt/news/20260210/bkn-20260210021803257-0210_00822_001.html,跨部門油尖區掃黃及打擊黑工　拘33人年齡介乎18歲至65歲,香港,oncc,2026-02-10 02:45,"油尖區執法部門聯同相關部門人員，昨日（9日）在區內展開代號「冠軍」的打擊非法勞工及掃黃行動，突擊搜查區內多個地點，共拘捕33人。

行動中，人員拘捕年齡介乎18歲至65歲，25名內地女子、1名內地男子、6名外籍女子及1名本地女子，分別涉嫌「逾期居留」、「違反逗留條件」、「協助及教唆他人違反逗留條件」、「非法勞工」 及「藏有他人身份證明文件」。 所有被捕人現正被扣留調查，部分被捕人稍後將交由相關部門跟進。"
