id,title,date,last_update,url,lead,section,source,scrape_time,news_content
bkn-20260402082211468-0402_00822_001,中電第五度推消費券計劃　60萬家庭受惠　試行以電子形式發放,2026-04-02 08:22,2026-04-02 08:22,https://hk.on.cc/cnt/news/20260402/bkn-20260402082211468-0402_00822_001.html,中電第五度推消費券計劃　60萬家庭受惠　試行以電子形式發放,香港,oncc,2026-04-02 10:15,"中華電力再次推出「中電消費券計劃」，向約共60萬個享有長者電費優惠或低用量用戶家庭，每戶派發100元的消費券。中電企業發展總裁莊偉茵表示，市民消費模式轉變，零售及餐飲業界面對一定營運壓力。中電冀藉消費券所產生的乘數效應，刺激本地市道，釋放消費潛力，助力經濟提速發展。

中電消費券計劃自2021年起至今第五度推出，總共派發超過3.3億元消費券。今次試行，合資格的低用量住宅用戶於本月底，透過中電「度度賞」平台獲發電子中電消費券，可用於網上購物，以及於超過4,000間參與商戶使用。而享有長者電費優惠的合資格用戶，就繼續以郵遞方式收到實體消費券。"
bkn-20260402081858849-0402_00822_001,呂梁市煤礦冒頂事故　4工人受困遇難,2026-04-02 08:18,2026-04-02 08:18,https://hk.on.cc/cnt/news/20260402/bkn-20260402081858849-0402_00822_001.html,呂梁市煤礦冒頂事故　4工人受困遇難,山西,oncc,2026-04-02 09:15,"山西省呂梁市興縣一處煤礦周三（1日）晚發生冒頂事故，4名礦工被困，周四（2日）獲救出後證實遇難。

興縣有關部門發布消息，中煤關家崖煤業有限公司周三晚9時15分發生冒頂事故，救援隊伍抵達現場，展開救援工作。至周四凌晨2時46分，全部受困礦工獲救援升井，惟已無生命迹象。

資料顯示，涉事企業隸屬中國中煤能源集團旗下中煤集團山西有限公司，年生產能力達150萬噸。冒頂事故是指煤礦採掘過程中，因多種原因導致巷道上方或採煤工作面岩層坍塌的事故。"
bkn-20260402080725117-0402_00822_001,灣仔17歲少女單位內暈倒父親揭發惜已天人永隔,2026-04-02 08:07,2026-04-02 08:07,https://hk.on.cc/cnt/news/20260402/bkn-20260402080725117-0402_00822_001.html,"灣仔17歲少女單位內暈倒　父親揭發惜已天人永隔


今日(2日)早上7時59分，一名男子報案指，其17歲女兒在灣仔謝斐道415號一單位內暈倒。人員接報到場，將昏迷事主被送往律敦治醫院治理，其後被證實死亡，少女死因有待驗屍後確定。",香港,oncc,2026-04-02 13:15,今日(2日)早上7時59分，一名男子報案指，其17歲女兒在灣仔謝斐道415號一單位內暈倒。人員接報到場，將昏迷事主被送往律敦治醫院治理，其後被證實死亡，少女死因有待驗屍後確定。
bkn-20260402080443369-0402_00822_001,青銅器專家為牟利　修復被盜文物獲刑,2026-04-02 08:04,2026-04-02 08:04,https://hk.on.cc/cnt/news/20260402/bkn-20260402080443369-0402_00822_001.html,青銅器專家為牟利　修復被盜文物獲刑,河南,oncc,2026-04-02 08:15,"內媒周一（3月30日）報道，河南洛陽市西工區檢察院近日通報，青銅器修復專家高大山在明知3面漢代銅鏡為盜掘所得的情況下，仍收取1萬元（人民幣，下同，約1.14港元）報酬為對方修復。法院近日以掩飾、隱瞞犯罪所得罪判處10個月有期徒刑，緩刑1年，並處罰款5,000元（約5,692港元）。

報道指，高大山雖自學成材且技藝精湛，曾無償向博物館捐贈文物，卻在2020年為「掙快錢」鋌而走險，運用獨創技法修復破碎銅鏡，最終在文物倒賣案發後被警方查獲。經鑒定，涉案銅鏡均為國家三級文物。檢察機關審查認定，根據修復難度、異常高價及高大山從業經驗，他應明知文物來源非法。他在庭審中認罪認罰，懺悔稱毀了積攢幾十年的名聲，修復行為因使用現代材料改變文物表層成分，被認定造成歷史信息破壞。

除刑事責任外，法院還判令高大山賠償文物修復費用1.9萬元（約2.16萬港元），並在國家級媒體上公開賠禮道歉。檢察機關提醒，專業人士參與文物犯罪危害尤甚，該案為文博行業從業人員敲響了警鐘。"
bkn-20260402080039664-0402_00822_001,今日大致多雲　有幾陣驟雨　日間氣溫徘徊在23°C左右,2026-04-02 08:00,2026-04-02 08:00,https://hk.on.cc/cnt/news/20260402/bkn-20260402080039664-0402_00822_001.html,今日大致多雲　有幾陣驟雨　日間氣溫徘徊在23°C左右,香港,oncc,2026-04-02 08:15,"一股偏東氣流正影響廣東沿岸。同時，一道雲帶覆蓋該區。今日(2日)上午8時，天文台錄得氣溫攝氏25度，相對濕度百分之82。過去一小時，京士柏錄得的平均紫外線指數是0.2，強度屬於低。

預測今日大致多雲，有幾陣驟雨。日間氣溫徘徊在攝氏23度左右。吹和緩至清勁東風，稍後轉吹東南風。展望明日(3日)稍後驟雨逐漸增多，週末期間及星期一間中有驟雨及幾陣狂風雷暴。隨後一兩日驟雨逐漸減少。"
bkn-20260402080033706-0402_00822_001,東華三院乙巳年及丙午年董事局交代就職典禮　曾慶業榮膺新屆主席,2026-04-02 08:00,2026-04-02 08:00,https://hk.on.cc/cnt/news/20260402/bkn-20260402080033706-0402_00822_001.html,東華三院乙巳年及丙午年董事局交代就職典禮　曾慶業榮膺新屆主席,香港,oncc,2026-04-02 08:15,"東華三院扎根香港逾一個半世紀，一直與時並進，配合社會轉變和市民需求，持續優化各項服務。東華三院乙巳年及丙午年董事局交代就職典禮，昨日於東華醫院地下禮堂舉行，由勞工及福利局局長孫玉菡太平紳士主禮及民政及青年事務局副局長梁宏正BBS太平紳士主持監誓。

丙午年董事局主席曾慶業發表就職演詞時表示，丙午年董事局矢志以「仁澤和衷 善道同行」為管治理念，積極推展多元服務的發展，惠澤社群，將跨越世紀的慈善福利事業發揚光大。曾慶業分享，董事局已在東華三院周年計劃報告中，為未來一年定下全面及精準的服務計劃，回應各項民生需要。目前該院服務單位已增至401個，來年連同醫院服務的經常性開支將增至超過130億元。

推展醫療服務  惠及市民大眾 

醫療服務方面，東華三院將繼續提供免費醫院病床及豁免中西醫普通科門診的診金和藥物費用；並透過20多項病人助醫計劃，資助有經濟困難的病人接受各類治療。曾慶業透露，該院正籌劃及開展多個大型建設項目，包括廣華醫院第二期重建工程，以及廣華醫院全新的數位病理學中心；又研究將中銀香港社區藥房遷移至中西區，與東華三院中西區地區康健中心協作等。東華三院亦將參與香港大學主導的肺癌篩查研究計劃；亦會繼續全力支持中西區地區康健中心及三間樂妍站的工作。

培育未來人才  豐富學習體驗

曾慶業表示，東華三院將重點推行將軍澳86區三個校舍重置計劃，九龍塘聯福道兩所新校舍預計於2026年底投入運作，用於調遷暫設於旺角臨時校舍的包玉星學校；並成立全新的包丁秀鳳學校，以回應特殊教育學習及住宿名額的需求。該院亦積極推動多元化境外交流，包括「一帶一路」倫敦文化體驗團、小學「有品足球大使」倫敦交流團及「學生大使溫哥華參訪團」，並組織姊妹學校交流活動，拓展學生視野。另將舉辦「長征勝利90周年」紀念活動、珠海航空航天博覽會研學，以及孫中山誕辰160周年聯校專題活動，引領學生認識國家歷史與發展。

東華三院除推行STEAM教育，亦會將人工智能定位為「教學賦能者」，透過AI實踐適應性教學，啟發學生創造力與批判思維。東華學院亦正進行香港學術及職業資歷評審局的機構評審，期望於年內獲行政長官會同行政會議批准，授予大學及應用科學大學名銜。

強化社區支援  滿足多元需要

曾慶業指出，來年東華三院將推進多項大型建設，包括大口環安老院舍改建綜合服務大樓工程，以及嚴重殘疾人士護理院小欖峻庭進入第三階段營運；同時展開荷李活道青年宿舍的上蓋建設工程。該院亦將推行「內視鏡吞嚥檢查先導計劃」及逐步改裝舊式安老院舍；推廣「終‧有得揀」教育計劃，並積極籌備參與「廣東院舍照顧服務計劃」，為有意於大灣區養老的長者提供選擇。

此外，東華三院將於九龍西新設「歇一歇」照顧者資源中心，並提升「家長學院」服務；為年滿18歲需離開兒童之家的青少年推出「共居同行」離舍支援計劃。該院亦將推展「東華 x 中銀『U-LEAD』青年領袖培育計劃」，拓展青年視野。另一方面，將於上環總部附近開設東華餐廳，作為青年職涯平台。該院亦計劃在油麻地「社區客廳」推出增值服務，扶助弱勢社群；並於轄下三個過渡性房屋及元朗攸壆路簡約公屋舉辦活動，以增強基層市民的幸福感與歸屬感。

優化公共服務　推動文化保育

曾慶業表示，東華三院正逐步翻新及更換轄下殯儀館設施，並計劃於今年起更新電動靈車，同時安排殯儀前線員工前往湖南長沙民政職業技術學院接受專業培訓，以提升服務水平。該院亦會持續舉辦傳統及創新廟宇活動，並預計於下半年開放東華義莊多媒體展示室，以嶄新方式介紹義莊的服務與歷史。該院又計劃於九月參加國家檔案局工作坊，準備申報將東華義莊文獻納入「中國檔案文獻遺產名錄」。該方亦會持續優化檔案管理，推動文化保育與傳承。"
bkn-20260402061347344-0402_00822_001,太原醫美機構員工公器私用　倒賣客戶信息,2026-04-02 06:13,2026-04-02 06:13,https://hk.on.cc/cnt/news/20260402/bkn-20260402061347344-0402_00822_001.html,太原醫美機構員工公器私用　倒賣客戶信息,山西,oncc,2026-04-02 06:15,"山西太原迎澤區公安網安部門近日查處一宗侵犯公民個人訊息案，一間美容整形醫院職員利用工作便利，於2020年10月至去年11月期間與某訊息公司勾結，從醫院內部系統盜取和販賣包含客戶電話、醫美項目需求等敏感信息。

涉事職員郝某杰僅在去年販賣的信息便超過8,000條，導致大量公民信息用於精準電話推銷，嚴重侵擾他人正常生活。他涉嫌侵犯公民個人信息罪，已依法刑事拘留。根據相關規定，情節嚴重者可處3年以下有期徒刑或拘役，情節特別嚴重的可處3年至7年以下有期徒刑。

警方提醒，行業從業者應嚴守職業底線，相關單位需強化信息安全管理，市民若發現個人信息洩露，請及時留存證據並報警，共同守護信息安全。"
bkn-20260402041812794-0402_00822_001,泉州中學熱水收費惹議　評論：不能肆意割韭菜,2026-04-02 04:18,2026-04-02 04:18,https://hk.on.cc/cnt/news/20260402/bkn-20260402041812794-0402_00822_001.html,泉州中學熱水收費惹議　評論：不能肆意割韭菜,福建,oncc,2026-04-02 04:30,"福建泉州市一中學飲水收費引起爭議，學生需刷卡方能飲用熱水，變相強制消費。泉州市教育局明確表態嚴禁收費，並啟動專項檢查。有評論指出，校園不能肆意割韭菜。

中學目前已停止收費，設備亦貼出「免費供應」標識，營運成本改由學校承擔。《光明日報》旗下光明網評論指，問題看似妥善解決，但喝熱水都收費做法已觸碰教育公益性底線。國家發改委、教育部早有明文，中小學飲水嚴禁納入服務性收費和代收費事項，多地亦明令禁止。

然而，違規收費並非個例，從飲水、冷氣到趴桌午休均被明碼標價，暴露出部分學校將基礎服務異化為市場化交易的不良傾向。底線一旦失守，失掉的不僅是熱水，更是學生與家長對教育最基本的信任。文章呼籲學校要守住教育初心，強調學校不是商場，亂象亟需長效監管，防止公益屬性在「小錢」中一再流失。"
bkn-20260402033513173-0402_00822_001,被指無助疏散即逃命　物管職員哭訴澄清,2026-04-02 03:35,2026-04-02 03:35,https://hk.on.cc/cnt/news/20260402/bkn-20260402033513173-0402_00822_001.html,被指無助疏散即逃命　物管職員哭訴澄清,香港,oncc,2026-04-02 03:45,"宏福苑火災發生當天，有聲音指物管公司職員「第一時間離開」，多名物管公司職員昨日在聽證會上作供時哭訴，澄清公司職員有盡力拍門及留守協助疏散居民。置邦興業有限公司（ISS）文員駱倩盈表示，網上有許多不公平言論，認為大眾不應太快下定論認為他們想卸責；而獨立委員會主席高等法院原訟法庭法官陸啟康則稱，委員會不打算將聽證會做網上直播，便是擔心會有人乘機「起底」公審，呼籲大眾要理性客觀分析事件。

駱倩盈表示，日前作供後見網上出現許多對物管公司職員不公平的言論，她希望和居民交代，雖然其證供與另一職員，ISS電工羅國瑞有出入，但事件「過咗咁耐」，不排除自己或羅國瑞的記憶出錯，不應在羅未作供前便斷定他們想卸責，也不可斷定他們是火災製造者。她又指，火災當日管理處除用「大聲公」通知居民疏散，亦有接聽居民電話叫他們盡快逃生，每座保安員均有跑上未有危險的樓層拍門，只是部分樓層已有濃煙便無法再上樓拍門，而管理處在撤離時亦拿走了全苑業主的兩本聯絡簿，以供警員聯絡居民之用，重申無因火災而不理居民。

另一ISS管理員鍾瑞霞作供時亦哭訴，她擔任宏福苑日間座頭保安，對於有街坊指保安員在火災第一時間離開，她強調自己一邊協助居民離開，一邊疏散其他座數的人逃走，澄清「我唔係走得最快。」"
bkn-20260402033049484-0402_00822_001,東方日報A1：宏福消防總電掣　電工認接單關閉,2026-04-02 03:30,2026-04-02 03:30,https://hk.on.cc/cnt/news/20260402/bkn-20260402033049484-0402_00822_001.html,東方日報A1：宏福消防總電掣　電工認接單關閉,香港,oncc,2026-04-02 03:45,"大埔宏福苑火災當日火警鐘無響，原來物管公司置邦興業有限公司（ISS）電工誤將全苑消防系統總電掣（刀掣）關上，最終延誤多人逃生時機。獨立委員會昨日舉行第7場聽證會，ISS駐宏福苑電工羅國瑞作供時承認，知道消防裝置不應由他處理，但他關閉刀掣是為協助處理消防水缸放水工程。而其主管ISS工程主任林文欣則稱，羅關刀掣時他不在職，但即使他在職也有可能不會獲悉羅關刀掣，坦言工作流程如此，「如果出事咪覺得有問題，一般無事咪唔係。」令全場嘩然。獨立委員會主席陸啟康法官隨即對林文欣工作範疇感疑惑，質疑「咁你做咩嘢㗎？」

ISS駐宏福苑木工李承富昨日作供時表示，他與羅國瑞兩人曾協助大維修承建商宏業建築工程有限公司，處理消防水缸放水事宜。在接到消防水缸放水的工作單當日，他曾質疑應找消防持牌承建商才可以做，但羅當刻便回覆他「接到工作單就根據工作單執行。」李又稱，不知道加壓泵房內具體發生了何事，他只在門外看守並無入內，之後二人與宏業工人去主泵房後，因「唐環」需數人合力扭鬆，故有幫手處理「唐環」並將消防水缸內的水排走。李確認全屋苑8座大廈均有如此處理。

羅國瑞則表示，關閉刀掣是因為工作單要求他協助宏業完成消防水缸放水工程，而他曾聽消防承辦商講過消防水缸放水流程，得知「如果個泵照行，無水就會燒泵」，所以關掉刀掣以防燒泵，但不知道關刀掣會令火警鐘失效，否則一定不會關掉刀掣。

羅又提到，李承富曾向他指，消防缸放水要由持消防牌照人士處理，故他亦有「攞張單去管理處問駱小姐（ISS文員駱倩盈）」，但駱認為他持有電工牌所以要協助宏業，「駱小姐咁講，咪照張單做，因為張單出咗，（唔跟工作單做）驚工作有處分。」惟此處證供與李承富及駱倩盈有矛盾之處。

ISS處理工程的工作流程亦被質疑有問題。林文欣表示，一般而言管理處發出有關屋苑維修需求的工作單時，會放在打卡機上面，而李承富及羅國瑞上班便會從打卡機上取走工作單處理，除非有困難，否則不會向他匯報，他亦不會知道二人一般無困難的工作內容。雖然他在羅國瑞關掉刀掣時不在職，但他承認即使他在任，若羅不向他求助，他不會知道刀掣被關，此工作流程「如果出事咪覺得有問題，一般無事咪唔係。」

林文欣在2025年4月1日至10月7日曾離職一段時間。林作供時曾數次沉默，難以回答獨立委員會首席大律師杜淦堃的提問，而陸啟康亦對林文欣工作範疇感疑惑，質疑「咁你做咩嘢㗎？」多名人士笑聲。林文欣重申工作單由李承富及羅國瑞二人負責處理，但當二人遇到「好kam（有困難的工作單）就我（林文欣）處理」，強調自己不是「廢物」，因「工程上出標係我做paper」，陸啟康繼續質疑「工程流程無經你，我覺得有啲奇怪。」

更多新聞，請瀏覽東方日報網頁：

http://orientaldaily.on.cc/"
bkn-20260402033042991-0402_00822_001,《東方日報》今日要聞,2026-04-02 03:30,2026-04-02 03:30,https://hk.on.cc/cnt/news/20260402/bkn-20260402033042991-0402_00822_001.html,《東方日報》今日要聞,香港,oncc,2026-04-02 03:45,"一貼睇晒《東方日報》A1新聞頭條、B1財經要聞及C1娛樂最爆，以及東網嚴選的本港、兩岸及國際重點新聞，名家評論，讓你在最短時間掌握最重要資訊。

            "
bkn-20260402020732703-0402_00822_001,動力電池「身份證」上線　全生命周期可追溯,2026-04-02 02:07,2026-04-02 02:07,https://hk.on.cc/cnt/news/20260402/bkn-20260402020732703-0402_00822_001.html,動力電池「身份證」上線　全生命周期可追溯,中國,oncc,2026-04-02 02:15,"全國新能源汽車動力電池溯源信息平台周三（1日）正式上線，為新能源汽車產業綠色循環發展提供國家級信息支撐。平台以動力電池數字身份信息為核心，通過為每塊電池獨立編碼，整合產業鏈上下遊數據，實現對電池流向的鏈式追溯。

平台涵蓋4大核心功能，全面打通動力電池從生產、裝車、銷售到報廢、回收、利用等全環節的信息壁壘。中國汽車技術研究中心專家表示，產業鏈相關企業須按規定上傳全環節信息，推動責任鏈條閉環。下游回收企業可精準查詢技術信息，提升殘值評估效率，促進供應鏈透明化。

有專家指，政府主管部門將借助平台實現實時監管、風險預警與數據統籌，有效打擊非法拆解行為，規範市場秩序，從而推動行業向規範化、數碼化、綠色化方向高質量發展。"
bkn-20260402005735012-0402_00822_001,港男涉多次盜竊教會堂區善款離境時被截獲拘捕,2026-04-02 00:57,2026-04-02 00:57,https://hk.on.cc/cnt/news/20260402/bkn-20260402005735012-0402_00822_001.html,"港男涉多次盜竊教會堂區善款　離境時被截獲拘捕


香港男子涉嫌多次盜竊澳門教會堂區的善款被捕。涉案香港男子姓莫(29歲)，曾任職案中教會堂區的活動協調員，2023年離職後，未交還相關鎖匙。該教會堂區代表日前發現一連數月捐款額減少，於是報案。<br/><br/>執法部門調查後，鎖定莫為嫌疑，有人去年初開始，平",澳門,oncc,2026-04-02 09:00,"香港男子涉嫌多次盜竊澳門教會堂區的善款被捕。涉案香港男子姓莫(29歲)，曾任職案中教會堂區的活動協調員，2023年離職後，未交還相關鎖匙。該教會堂區代表日前發現一連數月捐款額減少，於是報案。

執法部門調查後，鎖定莫為嫌疑，有人去年初開始，平均每月到澳門一次，疑在凌晨時分使用保留的鎖匙潛入教會堂區及辦公室，盜取捐款箱內現金，每次偷3,000至4,000澳門元不等。懷疑有人至今以上述方式作案至少十次，共偷約5萬澳門元。他前日 (3月31日)經外港碼頭離境時被截獲，執法人員在他身上搜出懷疑涉案的1.6萬元現金及一批鎖匙。有人聲稱贓款已用於日常開銷。案件涉加重盜竊，莫被移送法辦。"
bkn-20260402001003937-0402_00822_001,東方日報B1：恒指4月開局彈505點越兩萬五,2026-04-02 00:10,2026-04-02 00:10,https://hk.on.cc/cnt/news/20260402/bkn-20260402001003937-0402_00822_001.html,"東方日報B1：恒指4月開局彈505點　越兩萬五


美伊衝突擾攘一個月後出現曙光，隨着美國總統特朗普放話指「兩三周內結束戰事」，伊朗總統佩澤希齊揚又釋出和談意願，市場押注美伊衝突步入尾聲。亞太區股市周三(1日)承接美股強勢，其中港股甫開市，恒生指數已經重越25,000點大關和250天牛熊線(即25,135點)，埋單進帳505點或2.",產經,oncc,2026-04-02 09:00,"美伊衝突擾攘一個月後出現曙光，隨着美國總統特朗普放話指「兩三周內結束戰事」，伊朗總統佩澤希齊揚又釋出和談意願，市場押注美伊衝突步入尾聲。亞太區股市周三(1日)承接美股強勢，其中港股甫開市，恒生指數已經重越25,000點大關和250天牛熊線(即25,135點)，埋單進帳505點或2.04%，收報25,294點，成交逾2,914億元，惟港股長假臨近，「北水」趁高減磅，走資逾126億元。

恒指裂口高開569點後維持強勢，午後曾升641點，高見25,429點，大市兩日累漲543點或2.19%。新舊經濟股均表現亮麗，傳統金融股滙豐控股(00005)和友邦保險(01299)分別收升3.57%和3.12%，報130.3元和87.5元，合共貢獻恒指112點。

4大內銀繼續衝高，中國銀行(03988)突破5元大關，收升0.8%，報5.01元，撇除除淨因素是2015年7月以來最高；建設銀行(00939)股價重返去年7月以來高位，收升0.23%，報8.41元；工商銀行(01398)股價也見8年高位，收升0.29%，報6.88元。

摩根士丹利直言，看到內銀股去年第四季淨息差有回穩迹象，手續費收入也呈健康增長，認為建行、中行和中信銀行(00998)年內有望錄得高於同業的收入和利潤增長，而且均予四大內銀「增持」評級。

另邊廂，恒生科技指數收升106點或2.29%，報4,756點。不過，科技股龍頭走勢各異，騰訊控股(00700)500元關口得而復失，收升2.6%，報496.6元；阿里巴巴(09988)漲3.1%，收報122.7元；惟美團(03690)逆市跌1.2%，收報81.95元。

要留意，資金再追捧一批人工智能(AI)大模型和晶片半新股，其中內地「AI六小虎」之一的MiniMax(00100)收升14.04%，報1,060元；極視角(06636)和壁仞科技(06082)各升15.27%和9.64%，報83元和31.6元；另有「詞元(Token)第一股」之稱的迅策(03317)收升1.75%，報203.2元。

至於升幅首5大藍籌，其中兩隻是資源金礦股，洛陽鉬業(03993)收升8.38%，膺藍籌升幅王；紫金礦業(02899)則上升近6%。另外，靈寶黃金(03330)和赤峰黃金(06693)分別反彈10.46%和7.01%，收報28.5元和44.24元。

此消彼長，石油股因油價回落而下挫，中國海洋石油(00883)和中國石油(00857)跌3.71%和1.86%，報26.96元和10.55元，是跌幅首兩大藍籌。

此外，摩根士丹利最新發表中國市場報告，由16個產業挑選出26家具備最強競爭優勢與護城河的中國「最佳商業模式」股份名單，涵蓋中石油、騰訊、福耀玻璃(03606)、英矽智能(03696)、中國平安(02318)、華潤置地(01109)等。

恒指公司稱，將於5月22日公布首季恒生指數系列檢討結果，變動6月8日生效。"
bkn-20260402000600986-0402_00822_001,玩具店主買賣槍枝案兩人各獲16萬人民幣賠償,2026-04-02 00:06,2026-04-02 05:16,https://hk.on.cc/cnt/news/20260402/bkn-20260402000600986-0402_00822_001.html,"玩具店主買賣槍枝案　兩人各獲16萬人民幣賠償


甘肅省有玩具店主涉嫌非法買賣槍枝罪被羈押279天，武威涼州區法院近日對兩名當事人作出國家賠償決定，兩人各獲逾16萬元（人民幣，下同，約18.2萬港元）賠償，同案另有5人曾刑拘後取保。<br/><br/>法院向聶鵬立和劉新，各支付侵犯人身自由賠償金約13.3萬",甘肅,oncc,2026-04-02 10:15,"甘肅省有玩具店主涉嫌非法買賣槍枝罪被羈押279天，武威涼州區法院近日對兩名當事人作出國家賠償決定，兩人各獲逾16萬元（人民幣，下同，約18.2萬港元）賠償，同案另有5人曾刑拘後取保。

法院向聶鵬立和劉新，各支付侵犯人身自由賠償金約13.3萬元（約15萬港元），以及3萬元（約3.42萬港元）精神損害撫慰金。此前，兩人因涉嫌非法買賣槍枝罪被刑拘，一審判有罪後，二審發回重審，檢方最終以證據不足撤訴並作出不起訴決定。聶鵬立接受賠償結果，指雖訴訟花費超過40萬元（約45.5萬港元），但不願再折騰。"
