id,title,date,last_update,url,lead,section,source,scrape_time,news_content
bkn-20251103200031404-1103_00822_001,疑曾偷內褲被逮　男子闖民宅縱火報復致母女1死1傷,2025-11-03 20:00,2025-11-03 20:00,https://hk.on.cc/cnt/news/20251103/bkn-20251103200031404-1103_00822_001.html,疑曾偷內褲被逮　男子闖民宅縱火報復致母女1死1傷,台中,oncc,2025-11-03 20:15,"台灣台中市烏日區一處民宅周一（3日）凌晨2時發生火警，釀成屋內母女1死1重傷。警方初步調查，一名64歲許姓前男租客，過去曾涉嫌偷走林姓女子內褲而遭報警抓走，隨後被退租，疑懷恨在心，於是駕駛貨車倒車撞進民宅內縱火。

台中市消防局周一凌晨2時15分獲報，烏日區五光路一處2層樓鐵皮民宅發生火警，到場時猛烈火勢從1樓竄出。人員迅速滅火並進屋搜尋，於2樓房間內發現受困的母女，50歲吳姓母親全身有約80%燒燙傷，17歲林姓女兒則有20%燒燙傷，緊急送醫急救，母親仍在搶救，女兒則已失去生命迹象。

警方趕抵時，發現有輛貨車以倒插的方式撞進屋內，研判案情不單純，隨後確認到該屋為6口之家，現任屋主為6口之家男主人的母親，前屋主為現任屋主離世的丈夫。前屋主先前把隔壁的房子租給許男，但某天拍到他行竊林姓女兒內褲的畫面，遂報警抓人、提告性騷擾，也不再讓許男續租，請他離開。

許男與妻女在該屋居住逾20年，不願離開，後續開始在半夜燒舊衣服、樹葉，甚至拿起鐮刀到處走動，騷擾行徑讓屋主一家再次報警。屋主一家忍無可忍，提起訴訟想讓許男強制退租，該案預計將在本月11日開庭，豈料他周一凌晨返回犯案。警方鎖定許男身份，並在環東路發現疑有自戕行為的他，已將人送院治療，無生命危險，待狀況穩定將帶回警局進行訊問。"
bkn-20251103194218556-1103_00822_001,天氣轉涼易低溫燙傷　醫生：可致皮膚組織壞死,2025-11-03 19:42,2025-11-03 22:06,https://hk.on.cc/cnt/news/20251103/bkn-20251103194218556-1103_00822_001.html,天氣轉涼易低溫燙傷　醫生：可致皮膚組織壞死,香港,oncc,2025-11-03 22:15,"天氣轉涼，市民使用電暖爐、暖包不當，容易跌入「温暖陷阱」，易致低溫燙傷。《東呼即應》邀請醫生及中醫師，講解預防低溫燙傷的注意事項。有皮膚科醫生就提醒，使用暖爐時要保持適當距離，使用暖貼最好隔着衣物，就可以降低被低溫燙傷的風險。亦有中醫師提供保暖食療配方，以及教導穴位按摩，以提防低溫燙傷。

皮膚科專科醫生陳湧表示，低溫燙傷是指皮膚較長時間接觸比體溫高的一些熱源，通常是40多度，這個溫度已經足夠燙傷皮膚，因為不是真的很熱，皮膚接觸時並沒有很大的疼痛感，所以大家或會覺得沒問題便長時間接觸，但接觸時間長就會讓皮膚像受「慢煮」，使傷害更為深層。

陳指，日常使用的家電也有可能導致低溫燙傷，例如將電暖爐放近腳邊，或將暖包貼在皮膚上，當貼得太近和太久也可以讓人灼傷，至於蒸氣眼罩發熱時也能達40至50度，若戴上後睡覺，幾小時就有機會燙傷。

陳湧指出，長者、有神經性疾病或糖尿病等人士，由於感官通常較差，容易認為發熱源不算很熱便忽略其帶來的傷害，最終導致燙傷程度較嚴重。一些人認為沒有變鮮紅色或出現水泡，便自己處理傷口，但陳表示，低溫燙傷會令深層的組織壞死，甚至可能破壞真皮層或以下，容易有疤痕，也可能因傷口較深所以愈合速度較慢，更容易遭受細菌感染，因此應盡快求醫。

註冊中醫師庾亭嘉則分享有助保暖的食療，例如當歸生薑羊肉湯，有溫通氣血、補陽氣作用，但如果有大便乾結、易口乾口苦就不適合。肉桂紅棗茶亦有溫通作用，因肉桂可引火歸元，紅棗可養心安神、補中益氣，兩者結合可以補陽氣。

庾又指，冬天可按湧泉穴，湧泉穴在足底位置，大約在腳底上方1/3的穴位，可以激發全身的腎氣，起溫通作用。第二個穴位是足三里穴，在外膝眼下3寸的地方，有健脾補氣同時增強抵抗力，是很好的保健穴位。冬天可趁有太陽散步及曬背部，可增強陽氣，陽氣充足自然不怕冷。"
bkn-20251103194205576-1103_00822_001,怪男隨街剝男人鞋捽腳　搭巴士鋤人下體仲Lam Lam脷,2025-11-03 19:42,2025-11-03 22:10,https://hk.on.cc/cnt/news/20251103/bkn-20251103194205576-1103_00822_001.html,怪男隨街剝男人鞋捽腳　搭巴士鋤人下體仲Lam Lam脷,香港,oncc,2025-11-03 22:15,"《東呼即應》近日發現網上流傳兩宗陌生人騷擾事件，一名男子經常於晚上6時半至7時在葵涌運動場至葵盛泳池一帶出現，問人着幾號鞋，並要求脫鞋撫摸腳部；另一網民搭巴士時鄰座男子大髀壓腿，雙方暗中較勁，可謂奇人異事到處皆是。

有網友拍攝到於葵涌運動場至葵盛泳池一帶，一名背着背囊的男子正詢問一名正使用戶外健身設施的短褲男着幾號鞋，然後再要求對方脫鞋，在短褲男同意脫鞋後，該男子便蹲下撫摸其腳部，又用手指按壓對方腳底，貌似為對方按摩。有網民就表示，在現今社會女性固然要好好保護自己，但男性亦不應對來自陌生人的奇怪要求太過妥協與逆來順受，對於陌生人的奇怪舉動，要懂得高呼「唔好」，採取相應的反抗。

而另一短片顯示，有網民搭巴士期間鄰座坐了一個男人，整條大髀壓向他。片中可見拍片者穿着長褲，其左方乘客擘開雙腳，右腳「過界」之餘更不斷緊逼，佔用拍片者的座位前方約1/3空間，拍片者只得雙腿發力才能守住剩餘空間。事發後該位網民表示，其實自己應該直接攻擊對方生下體。但當然，這種行為會被控襲擊，並不是理想的處理方法。"
bkn-20251103192947347-1103_00822_001,德法波蘭南韓爆禽流感　 疫區禽產品禁供港,2025-11-03 19:29,2025-11-03 19:29,https://hk.on.cc/cnt/news/20251103/bkn-20251103192947347-1103_00822_001.html,德法波蘭南韓爆禽流感　 疫區禽產品禁供港,香港,oncc,2025-11-03 19:45,"食物環境衞生署食物安全中心今日(3日)宣布，因應世界動物衞生組織通報，指德國、法國、波蘭和南韓部分地區爆發高致病性H5N1禽流感，中心即時指示業界暫停從有關地區進口禽肉及禽類產品包括禽蛋，以保障本港公眾健康。

有關地區為德國下薩克森州的Rotenburg(Wümme)區；法國的馬恩省及科多爾省；波蘭大波蘭省的Środa Wielkopolska區；及南韓光州。

中心發言人說，根據政府統計處的資料，本港今年首9個月從德國進口約60公噸冷藏禽肉、從法國進口約830公噸冰鮮和冷藏禽肉及約5萬隻禽蛋、從波蘭進口約1,870公噸冷藏禽肉，以及從南韓進口約350公噸冰鮮和冷藏禽肉及約2,614萬隻禽蛋。

中心已就事件聯絡德國、法國、波蘭和南韓當局，並會繼續密切留意世界動物衞生組織及有關當局發出關於爆發禽流感的消息，因應當地疫情發展，採取適當行動。"
bkn-20251103191016163-1103_00822_001,舉中指辱罵球員　中超2球迷遭禁看比賽1年,2025-11-03 19:10,2025-11-03 19:10,https://hk.on.cc/cnt/news/20251103/bkn-20251103191016163-1103_00822_001.html,舉中指辱罵球員　中超2球迷遭禁看比賽1年,四川,oncc,2025-11-03 19:15,"中超聯賽第29輪上周五（10月31日）成都蓉城隊主場比賽期間，有主隊球迷向客隊的加納外援球員阿奇姆彭舉中指，並作出具種族歧視的辱罵。四川省成都市公安局金牛區分局上周六（11月1日）通報，對涉事兩人作出行政拘留的處罰決定，並責令兩人在12個月內不得進入體育場館觀看同類比賽。

通報指，上述比賽期間，個別觀眾無視法律法規及賽場管理規定，出現展示侮辱性物品、做出侮辱性動作、辱罵等行為，嚴重擾亂賽事秩序。發現後，警方開展調查取證，迅速鎖定涉案人員。41歲男子申某和37歲男子黃某在觀賽期間為發洩情緒，實施上述行為，已違反規定，構成擾亂大型活動秩序，公安機關遂依法對兩人作出上述處罰。

通報強調，公安機關對任何擾亂公共秩序、挑戰法律底線的行為始終堅持「零容忍」態度，堅決依法從嚴查處，絕不姑息。警方提醒廣大球迷自覺遵法守法，共同維護文明、健康、有序的賽事環境。"
bkn-20251103185314711-1103_00822_001,咖啡店藉問路摸女子大髀　網紅「劉馬車」認罪11.25判刑,2025-11-03 18:53,2025-11-03 18:53,https://hk.on.cc/cnt/news/20251103/bkn-20251103185314711-1103_00822_001.html,咖啡店藉問路摸女子大髀　網紅「劉馬車」認罪11.25判刑,香港,oncc,2025-11-03 19:00,"本名劉駿軒的網絡紅人「劉馬車」，涉嫌於今年9月初在天水圍一間咖啡店內向一名女子假裝問路，並突然觸碰對方大腿後逃去。事主追着他至頌富輕鐵站，劉突然又閃縮地給事主200港元。「劉馬車」最終被捕並被控一項非禮罪，案件今日(3日)於屯門裁判法院再訊，控方將控罪修訂為普通襲擊罪，劉承認控罪。裁判官把案件押後至11月25日在九龍城裁判法院判刑，期間被告續須還押。

被告劉駿軒(29歲，無業)原被控一項非禮罪，控方今把控罪修訂為普通襲擊罪。控罪指被告於2025年9月3日，在香港新界天⽔圍天華路30號頌富廣場第一期1樓N126號舖「星巴克咖啡」襲擊女⼦X。

案情指，X與被告並不認識，案發當日約下午3時許，穿短褲的X在案發咖啡店等待其補習學生，被告則於下午3時44分突然坐在X旁邊，並假裝問路，期間突以左手觸碰X的右大腿約2秒。X大聲喝止被告，被告不發一言隨即逃去。X一路緊追被告至頌富輕鐵站，並嘗試確認被告身份。被告其後舉止閃縮，並拿出200港元給予X，X其後報案。警員翻查閉路電視片段，確認被告身份後，於翌日將他被捕，他在警誡下稱因衝動犯案。

案件編號：TMCC 900049/2025"
bkn-20251103183658734-1103_00822_001,東九文化中心啟用　本月至明年2月推出開幕季節目,2025-11-03 18:36,2025-11-03 18:36,https://hk.on.cc/cnt/news/20251103/bkn-20251103183658734-1103_00822_001.html,東九文化中心啟用　本月至明年2月推出開幕季節目,香港,oncc,2025-11-03 19:15,"東九文化中心於今日(3日)正式啟用，今年11月至明年2月推出開幕季節目，包括原創粵語音樂劇。政府表示，該中心是香港最新旗艦表演場地，與尖沙咀的香港文化中心都是大型場地，不單是推動文化藝術發展的重要里程碑，更是鞏固香港作為中外文化藝術交流中心的關鍵一環。

東九文化中心前身為牛頭角下邨第11至14座，政府高官出席揭幕典禮致詞時指，中心建築設計融入昔日牛頭角下邨的社區元素，做到新舊交融、傳承創新。中心設5個分別可容納120至1,200個座位的表演設施，配備先進舞台設備，以支援各類型演出需要，並將劇院將預留用作長期演出，讓業界能夠持續發展。

政府說，自去年8月該場館已舉辦20套，一共500場「東九開箱」試場節目活動，超過200名藝術及科技專才參與，吸引超過13,000人次觀眾入場。政府說接下來為期3個月的開幕季，亦會呈現一系列本地及國際的演出，及藝術科技節目，包括人機舞蹈、光雕投影等。"
bkn-20251103183320363-1103_00822_001,涉將自住按揭樓宇出租　兩男女警被控欺詐11.20再訊,2025-11-03 18:33,2025-11-03 18:33,https://hk.on.cc/cnt/news/20251103/bkn-20251103183320363-1103_00822_001.html,涉將自住按揭樓宇出租　兩男女警被控欺詐11.20再訊,香港,oncc,2025-11-03 18:45,"執法部門於今年1月，在多處拘捕8男4女共12人，當中7名男子為休班警員，指他們涉嫌「洗黑錢」，在2017年至2024年期間利用22個銀行戶口清洗由犯罪活動所得的懷疑犯罪得益，涉案金額約1,050萬港元。部門其後再拘捕一名休班女警，指她涉與上述7名休班警的其中一人，將自住按揭樓宇出租而涉嫌詐騙。案件今日(3日)於東區裁判法院再訊，2人共被控兩項欺詐罪，案件被轉介往區院處理，將於11月20日再訊，2人續准以7,000港元保釋外出。

兩名被告分別是高文迪(39歲)及林頴倩(女，38歲)，其控罪書並沒有報稱職業，據悉2人為夫婦，均為警員且正停職。案件被轉介至區院處理，2人保釋候審。

高文迪獨自被控一項欺詐罪，並與林頴倩同被控一項欺詐罪。首項控罪指高於2021年1月18日至3月9日，在香港藉欺騙，即虛假地表示高完成購買天水圍濕地公園路9號Wetland Season Park 1期第20座6樓B1室後，物業將由高佔用，並意圖詐騙而誘使中國建設銀行及香港按證保險有限公司批准物業的按揭貸款申請，貸款額為524.1萬港元；和誘使按證公司批准該貸款申請附帶的按揭保險計劃申請，導致高獲利或導致銀行及/或按證公司蒙受不利或有相當可能蒙受不利。

案件編號：ESCC 2593/2025"
bkn-20251103182056323-1103_00822_001,向補習社洩試題　德信前校長郭超群囚4年3個月,2025-11-03 18:20,2025-11-03 18:20,https://hk.on.cc/cnt/news/20251103/bkn-20251103182056323-1103_00822_001.html,向補習社洩試題　德信前校長郭超群囚4年3個月,香港,oncc,2025-11-03 18:30,"政府資助小學德信學校的前校長郭超群，涉嫌隱瞞自己在一間補習社的財務利益；另涉與該補習社一名前女董事在學校考試和測驗前，洩露機密試題予該補習社。郭超群及該女董事被廉政公署分別起訴公職人員行為失當及串謀公職人員行為失當罪。兩人不認罪受審，結果雙雙被裁定罪成。案件今日(3日)於在區院判刑，法官謝沈智慧判刑時痛批郭作為公職人員泄露學校試題，嚴重違背誠信，判郭囚4年3個月，彭囚3年。

被告郭超群(51歲，報稱無業)被控一項公職人員行為失當罪。而被告彭詠嫺(47歲，報稱補習中心經營者)與郭同為勤舍學習中心有限公司的前董事兼股東。他們同被控一項串謀觸犯公職人員行為失當罪。

法官判刑時指，郭作為校長，在校內擁有日常營運的最高權力，卻為個人利益泄露學校試題，高度違背誠信，更利用彭掩飾自己在補習社的投資。此行為令願意付補習費的學生能提前獲得考試試題和答案，鼓勵了學生作弊，更令公眾對考試制度有負面觀感。

辯方早前求情指郭曾得過卓越教育奬，而彭被補習社的家長稱讚其有專業性和友善，專注令學生進步而非只看分數，但法官指這是他們工作的責任，並不代表他們有好的人格，更指兩名被告犯案後毫無悔意，郭被教育局調查時仍然選擇隱暪，刪除與彭相關的文字訊息，直至被廉署調查時才承認犯罪事實；彭的兒子對母親的行為感到悔意，但彭本人並沒有悔意，最終判囚郭4年3個月，彭3年。

案情指，彭兒子為德信學校舊生，兩名被告因此相識。有德信學校家長在2018年10月投訴，指補習中心與學校考試試題相似，質疑有人洩露試題。兩名被告於2021年6月被捕。廉署人員在彭手機中，發現11份德信試卷，亦在涉案補習社檢獲內容與德信試卷相似的練習。警誡下，男被告稱與女被告為「親密朋友」，互有好感，會一同慶祝生日。郭超群與彭詠嫺的關係，以及郭超群出資開設補習社的行為構成利益衝突，但郭超群明知有利益衝突卻沒有向學校作出申報。

案件編號：DCCC 616/2023"
bkn-20251103182054812-1103_00822_001,日本進口食品藏受管制水產　食安封存宮城縣冷凍帶子及千葉縣鯖魚,2025-11-03 18:20,2025-11-03 18:20,https://hk.on.cc/cnt/news/20251103/bkn-20251103182054812-1103_00822_001.html,日本進口食品藏受管制水產　食安封存宮城縣冷凍帶子及千葉縣鯖魚,香港,oncc,2025-11-03 19:00,"食物環境衞生署食物安全中心今日(3日)公布，中心檢查日本進口食品時，發現於《命令》發出後在宮城縣製造和加工的兩批共4包冷凍帶子及在千葉縣製造、加工和包裝的兩批共24罐罐頭鯖魚，有關進口商涉嫌違反相關《命令》。涉事產品已被中心封存，沒有流出市面，中心正跟進事件。中心會繼續跟進事件和採取適當行動，包括就事件通知日本有關當局。

根據該《命令》，凡源自日本東京、福島、茨城、宮城、千葉、群馬、栃木、新潟、長野和埼玉10個都／縣，並在2023年8月24日或之後收穫、製造、加工或包裝的活生、冷凍、冷藏、乾製或以其他方式保存的水產、海鹽，以及未經加工或經加工的海藻，一律禁止輸入香港和在香港境內供應。"
bkn-20251103181636580-1103_00822_001,涉拍女下屬臀部及捉手　高級督察辯稱攤開雙手指導事主,2025-11-03 18:16,2025-11-03 18:16,https://hk.on.cc/cnt/news/20251103/bkn-20251103181636580-1103_00822_001.html,涉拍女下屬臀部及捉手　高級督察辯稱攤開雙手指導事主,香港,oncc,2025-11-03 18:30,"警隊高級督察被指在紅磡警署性侵女下屬，包括捉住她的雙手及拍打她臀部等，他被控一項普通襲擊罪及一項非禮罪，被告不認罪，案件今日(3日)於觀塘裁判法院續審，被告出庭自辯。他否認案發時與事主曾有身體接觸，並指當時就案件事宜攤開雙手向事主作指導時，她表現得垂頭喪氣且不服氣。控辯雙方將於明日(4日)作結案陳詞。

56歲被告梁閏成，報稱任職警務高級督察。他現時已停職。他被控於2025年2月18日，在紅磡公主道99號紅磡警署1樓103室內襲擊女子X。他另被控於同日同地猥褻侵犯女子X。被告自辯稱他在1987年加入警隊，當日X進入他房間提及一宗案件的拘捕行動，他曾詢問對方有關案中證據，X感不知所措，他續指導X，她則表現無助和有壓力，被告認為她垂頭喪氣，但其實該案的檢控限期是同年3月，不理解X為何要急着完成。

被告稱他當時曾攤開雙手向X作示範，向她稱左手代表調查科，右手代表刑事調查科，並舉疏忽職守、沒有牌照而從事保安工作和做假帳等數個例子，問X屬於哪個範疇，X分別搖動左右手示意。其後因有警司呼喊他，他遂停止對話，而與X沒有物理上的接觸。至於非禮罪，被告否認與X有肢體接觸。

案件編號：KCCC 1245/2025"
bkn-20251103180539268-1103_00822_001,中大推早發性糖尿病篩查　料4年內驗9000人,2025-11-03 18:05,2025-11-03 18:05,https://hk.on.cc/cnt/news/20251103/bkn-20251103180539268-1103_00822_001.html,中大推早發性糖尿病篩查　料4年內驗9000人,香港,oncc,2025-11-03 18:30,"除了長者會有三高、糖尿病問題，亦有部分病人會出現「早發性糖尿」，即40歲之前發病，患者的死亡率會比一般病人高近兩倍。香港中文大學早前獲得資助，於去年11月起，展開一項為期4年的基因檢測計劃，目標為9,000名18至44歲市民進行篩查，識別未來10年患上糖尿病的高風險人士。計劃目前已有逾5,400名市目參與，其中超過3,300人接受基因檢測，結果發現有45%為高風險人士，當中一半人經進一步檢測後，有8.5%人確診。

中大醫學院內科及藥物治療學系教授陸安欣表示，本港每10名成年人中，便有1人患有糖尿病。每5名糖尿病患者中，就有1人是「早發性糖尿」。此類患者往往會因併發各種身體和精神疾病，需要反覆入院，其死亡率會較遲發病患者高1.5倍至兩倍，其心血管疾病和慢性腎病的發病率，也會高出3至4成。

中大香港糖尿病及肥胖症研究所所長陳重娥說，糖尿病是一種較為隱性的疾病，其患病風險會隨年齡增長，故有不少年輕人就算驗出血糖水平上升，亦未能察覺患病風險。她解釋，若患者的糖尿病有早發傾向，在發病6年前，病人體內的胰島素便已不足維持正常血糖水平，故可以透過篩查識別出高風險人士，並及早透過藥物和改善生活習慣，減低患病風險。

參與研究的高風險人士均會獲轉介接受資助治療，包括獲基層醫療人員定期跟進及治療，而團隊亦正招募更多參加者。參加者必需未曾確診糖尿病，以及有最少一個糖尿病風險因素，例如中央肥胖或超重、有糖尿病家族史、吸煙史、曾有高血壓或脂肪肝等。"
bkn-20251103180329440-1103_00822_001,東風着陸場完成最後演練　迎接神舟二十號航天員,2025-11-03 18:03,2025-11-03 18:03,https://hk.on.cc/cnt/news/20251103/bkn-20251103180329440-1103_00822_001.html,東風着陸場完成最後演練　迎接神舟二十號航天員,內蒙古,oncc,2025-11-03 18:15,"因應神舟二十號載人飛船近日將返回地球，酒泉衞星發射中心東風着陸場周日（2日）完成最後一次全系統綜合演練，全面檢驗夜間搜救回收任務組織指揮、協同配合以及應急保障能力。

東風着陸場在演練中重點檢驗複雜條件下發現和處置返回艙的能力，同時強化指揮協同、空地協同、通信協同、力量協同，最大限度提升搜救回收效率。透過構建空地一體、立體協同多維搜救體系，空中分隊、地面分隊、資訊支援分隊和搭載照明設備的無人機分隊緊密配合，在着陸場區指揮部的統一指揮下，依次開展返回艙搜索、航天員救援、返回艙處置、警戒區建立等工作。

為應對寒冷天氣，東風着陸場對3台醫監醫保車進行低溫環境適應性改造，車內溫度可穩定維持在25°C左右，同時搭載緊急供氧系統及生命體征監測設備，確保航天員出艙後維持體溫正常。另外，3架搭載高功率LED燈組的繫留無人機在目標區域上空組成照明陣列，覆蓋半徑達300米左右，亮度能夠充分滿足返回艙作業照明需求，為航天員出艙、返回艙處置等各項工作開展提供可靠保障。"
bkn-20251103180217850-1103_00822_001,馬鞍山私家車自炒翻側　司機乘客共5人受傷,2025-11-03 18:02,2025-11-03 18:02,https://hk.on.cc/cnt/news/20251103/bkn-20251103180217850-1103_00822_001.html,馬鞍山私家車自炒翻側　司機乘客共5人受傷,香港,oncc,2025-11-03 18:15,"今午(3日)3時15分，一輛私家車沿馬鞍山鞍駿街駛至雅典居對開時，懷疑失控自炒向左翻側，途經司機見狀報案。

救援人員接報到場，證實男司機、2名女乘客和1男1女小童己離開車廂，他們僅受輕傷，由救護車送院救治。警員圍封現場，並調查意外起因。"
bkn-20251103174706321-1103_00822_001,私家車遇查撞開前兩車飆逃　無業男認7罪判囚25個月　停牌6個月,2025-11-03 17:47,2025-11-03 17:47,https://hk.on.cc/cnt/news/20251103/bkn-20251103174706321-1103_00822_001.html,私家車遇查撞開前兩車飆逃　無業男認7罪判囚25個月　停牌6個月,香港,oncc,2025-11-03 18:15,"一輛平治私家車於今年4月在長沙灣深盛路被警員截查期間，司機突然踩油逃逸，期間撞到兩輛私家車，導致乘客及司機受傷，其後該司機再被揭發涉嫌無牌駕駛及管有虛假車牌。肇事司機其後被控危險駕駛、妨礙警員和偽造文件等7罪，他於早前承認控罪，今(3日)在西九龍裁判法院被判囚25個月，另須停牌6個月。裁判官朱文瀚指本案情節非常嚴重，被告罔顧道路使用者及警察安全，監禁無可避免，而控方原本控告被告狂亂駕駛，之後改控較輕的危險駕駛，已屬非常寬大。

男被告鍾禮傑(31歲，報稱無業)早前承認各一項危險駕駛、妨礙警務人員、駕駛時無駕駛執照、意外後沒有停車、意外後沒有報告罪，以及兩項偽造文件罪。被告過往有有10次出庭判刑紀錄和42項定罪紀錄，辯方求情則指曾多次出入懲教院所的被告，現明白其行為自私，並承諾日後會奉公守法，並希望將來能再考取駕駛執照。

案情指，警員於今年4月17日在長沙灣深盛路發現被告的私家車違法停泊，被告則在駕駛座睡覺。警員敲車窗弄醒被告，他立刻駕車逃走，但駛至興華街西和深旺道交界遇上交通擠塞，他倒車並加快車速，撞上旁邊一輛私家車，該車再撞向另一輛私家車。警員用警棍敲打被告車窗，被告仍駕車逃走。他意外後未有停車，亦未在24小時內報案，駕駛方式遠遜於合理駕駛者應有的水平。事件中一名司機和一名乘客扭傷頸部，需送院治療。

事發兩日後，有市民在青衣城的停⾞場發現涉事私家車。警方於當晚將被告拘捕，車上搜出兩把槌子、屬不知名男子的身分證和信用卡等。警方調查發現，被告持有駕駛執照已經到期，涉事私家車曾經7次出入隧道，惟車牌從未登記在車輛名下。

案件編號：WKCC 1699/2025"
