id,title,date,last_update,url,lead,section,source,scrape_time,news_content
bkn-20260105070344848-0105_00822_001,總部易手 民主黨上月瓦解　仍未拆黨徽水牌,2026-01-05 07:03,2026-01-05 07:03,https://hk.on.cc/cnt/news/20260105/bkn-20260105070344848-0105_00822_001.html,總部易手 民主黨上月瓦解　仍未拆黨徽水牌,香港,oncc,2026-01-05 07:15,"繼多個民主黨派及組織解散，民主黨去年12月14日召開特別會員大會通過解散及清盤，同日停止運作。新一年已過數天，本報記者到場視察，發現大廈大堂該黨的「水牌」，總部門外的黨徽仍未拆去。「末代」主席羅健熙向本報確認，該物業去年12月31日已經「交吉」，但「黨徽甚麼時候拆走，新業主自己應該可以去處理。」

相隔特別會員大會約半個月後，應是該黨總部交吉的日子。羅元旦在社交平台上載一段短片，顯示他「舊地重遊」，拍攝了沿商業大廈走進該黨總部的過程，總部內部的家具已清走，地上放了多個紙箱。本報記者曾到現場視察，發現仍有民主黨的「水牌」，而總部門外仍掛有黨徽，但不見有任何人出入。

羅解釋，去年12月31日已經「交吉」，拆除了其中一個徽章。至於何時拆走其他黨徽，他認為「新業主自己應該可以去處理。」他說單位內部分櫃及其他家具位置是固定的，目前按照和新業主商討的安排處理，「新業主都沒有說甚麼時候一定會拆。」

羅在影片的貼文指：「2025的回顧還沒有寫好。但無論如何，這都必然是我人生的一大轉變。走了20年回總部的樓梯不需要再走了，但總會習慣的。之前立法會大樓如是，後來區議會會議室亦如是。雖然sound like好傷感，不過其實14/12後感覺唔算好強烈，或許真係心理準備做得太充足了？」

多名前黨友亦有留言，大多表示傷感，甚至說不知不覺留下眼淚，而已遠赴英國多年的前副主席李永達亦有留言指，「5年無上總部。留下。記憶」。李永達在違法佔領行動案被判入獄8個月、緩刑兩年，並於2021年8月初前赴英國。

民主黨在上月中旬召開特別會員大會討論解散及清盤事宜，共有121人投票，當中117票贊成，4張白票，接近全票通過解散及清盤決定。有份出席會員大會的創黨成員、前議員李華明更在會後一度落淚，對解散感不捨，又指「不曾預料今天局面」。羅當日指清盤人會跟進後續工作，估計清盤程序一年內能完成，具體剩餘資產要在清盤人完成工作後才知道實際數額，暫時無法回答。

外界曾估計該黨總部的售價為1,400萬港元，但羅沒有透露。據民主黨黨章規定，清盤後黨內剩餘資產，須捐贈予與黨宗旨相似的機構或慈善團體。至於具體黨產金額，他當時稱暫時沒有數字，要待清盤人完成程序，又指清盤完成後，若有剩餘資產，會捐給工業傷亡權益會。"
bkn-20260105070042941-0105_00822_001,反覆拗柴處理不妥善　長遠恐演變踝關節炎,2026-01-05 07:00,2026-01-05 07:00,https://hk.on.cc/cnt/news/20260105/bkn-20260105070042941-0105_00822_001.html,反覆拗柴處理不妥善　長遠恐演變踝關節炎,香港,oncc,2026-01-05 07:15,"不少人試過俗稱「拗柴」的足踝扭傷，若反覆扭傷或曾經骨折未有妥善處理，長遠或演變成踝關節炎。有骨科醫生指，踝關節炎原因當中，創傷後佔約80%，有機會導致足踝不穩定，痛症亦會愈趨嚴重，甚至要長期靠拐杖行走，呼籲市民切勿掉以輕心。治療方面，早期可採用非手術方法，包括支架治療、護踝、減重或游泳等活動調整；至於較後期的踝關節炎患者，則可採用踝關節融合術或全踝關節置換術。

香港港安醫院─司徒拔道骨科顧問醫生陳子釗介紹，足踝關節位於下肢3大關節最下端，需承受全身所有的重量並維持下肢的穩定性，同時兼具靈活的跑跳功能。足踝關節主要由脛骨、腓骨及距骨3塊骨頭組成，關節軟骨則負責吸收震動；當軟骨長期磨損或因舊患導致關節不穩，便會逐步退化。「足踝是人體承受最多負重的關節，一旦軟骨磨損，骨頭與骨頭直接摩擦，就會出現機械性疼痛、僵硬、腫脹， 甚至內翻畸形，嚴重影響日常生活。」

他指出，踝關節炎原因當中，創傷後佔約80%，其次是原發性佔約10%，其餘包括炎症性、骨壞死、神經性、感染性及血友病等。「很多人以為拗柴是小事，若反覆扭傷或曾經骨折而未有好好康復，很大機會引發創傷後踝關節炎。」症狀可包括機械性疼痛、僵硬、關節卡頓、活動範圍受限、腫脹、骨性腫大及關節發出摩擦聲，患者每日或每周情況均可能不同。他提醒，踝關節炎會令足踝不穩定，痛楚逐漸加劇，甚至要長期靠拐杖行走，嚴重影響生活質素。

踝關節炎的診斷，主要靠負重X光、電腦掃描及磁力共振，嚴重程度分為4期。治療方面，早期可採用非手術方法，包括減重或游泳等活動調整、支架治療、止痛藥或消炎藥、護踝、矯形鞋，亦可考慮注射透明質酸或高濃度血小板血漿，減輕炎症及痛楚。當非手術治療效果不理想，或患者因痛楚而導致行動不便，則需考慮手術方案。

陳子釗表示，手術選擇視乎病情階段，早期可進行微創關節清創或骨刺切除；中期的可同時進行復位手術矯正骨骼角度；至於後期則主要考慮踝關節融合術或全踝關節置換術，有需要人士應盡早諮詢骨科專科醫生，評估合適的治療方案。他呼籲，曾經拗柴或反覆扭傷的市民切勿掉以輕心，慢性踝關節不穩是引發踝關節炎最常見原因之一，及早處理不穩問題，可有效預防關節退化，避免日後需要接受大型手術。"
bkn-20260105061350300-0105_00822_001,男子輕信高薪搬豬肉　幾乎被賣到緬甸,2026-01-05 06:13,2026-01-05 06:13,https://hk.on.cc/cnt/news/20260105/bkn-20260105061350300-0105_00822_001.html,男子輕信高薪搬豬肉　幾乎被賣到緬甸,廣西,oncc,2026-01-05 06:15,"廣西自治區一名男子去年輕信網絡「日薪數千元（人民幣，下同）」招聘廣告，以為前往邊境搬運豬肉，險被騙往緬甸。他中途警覺報案，配合警方抓捕司機，最終逃過一劫。

31歲朱姓男子去年底透過社交平台應徵日薪可達2,000至4,000元（約2,220至4,440港元）、毋須出國所謂「搬貨」工作。他上車後發現被載往靠近越南的憑祥市，更收到對方誤發訊息，內容提及「4個中國人車到了」，於是想到自己可能遭遇販運，隨即選擇報警。

警方布控後逮捕接應司機，並告知朱男已被轉賣。案件目前由廣西崇左及憑祥市公安局邊境管理部門偵辦。朱男表示，司機被捕後犯罪團夥仍持續聯繫他，甚至偽裝外賣員探問其位置，令他倍感受到威脅。"
bkn-20260105052353634-0105_00822_001,日媒：駐韓美軍將擴大行動範圍　應對台灣突發事態,2026-01-05 05:23,2026-01-05 08:48,https://hk.on.cc/cnt/news/20260105/bkn-20260105052353634-0105_00822_001.html,日媒：駐韓美軍將擴大行動範圍　應對台灣突發事態,中國,oncc,2026-01-05 09:30,"日本傳媒周日（4日）指，駐南韓的美軍將擴大行動範圍至朝鮮半島之外，以建立因應台灣突發事態的戰備系統。華府此舉是尋求加強阻嚇力，不僅對北韓，也針對日益強勢的中國。

日經亞洲報道，駐韓美軍司令布倫森去年12月29日在首爾一場論壇上表示，南韓不僅是應對朝鮮半島的威脅。考慮到可能發生的台灣突發事態，駐韓美軍最近在官網發布一張呈現倒置的東亞地圖，據傳布倫森已經下令內部使用這張地圖。該地圖顯示，駐韓美軍與平壤、北京、台北、馬尼拉等附近主要城市的距離，這展現美國軍隊駐紮韓國的更廣泛戰略優勢。基於美韓兩國同盟，駐韓美軍的主要任務是阻嚇北韓。

美國國防部長海格塞斯去年11月訪問南韓時暗示，如果台海出現危機，美軍可能介入，指美方與同盟攜手捍衞朝鮮半島穩定的意志堅定，但有必要提高戰略靈活性，以因應區域內其他緊急情況。"
bkn-20260105041852747-0105_00822_001,戰國青銅器驚現刻字　由民間流轉造成,2026-01-05 04:18,2026-01-05 04:18,https://hk.on.cc/cnt/news/20260105/bkn-20260105041852747-0105_00822_001.html,戰國青銅器驚現刻字　由民間流轉造成,四川,oncc,2026-01-05 04:30,"內地遊客近日在四川省綿陽市博物館參觀「鳳兮楚兮——荊楚文物菁華展」時發現，一件戰國青銅敦表面刻有「李世民」。博物館工作人員上周六（3日）解釋，有關刻字並非近年所為，而是文物出土後及入藏博物館之前，在民間流轉過程中被他人刻上，館方接收時已存在刻字。

照片可見，該件黑色青銅敦上刻有「李世民」，刻痕顯得鮮明白皙。資料顯示，該青銅敦為是次特展借自荊州博物館戰國時期文物，屬於國家二級文物。綿陽市博物館工作人員表示，青銅敦出土於江陵李家台4號墓。

是次展覽為四川首個楚文化專題展，匯聚湖北多間博物館珍藏，逾八成展品屬珍貴文物。展覽旨在展示楚文化特色，作為重要禮器青銅敦亦在其中。"
bkn-20260105034022699-0105_00822_001,紙皮放走廊防煙門常開　住戶屢勸不改,2026-01-05 03:40,2026-01-05 03:40,https://hk.on.cc/cnt/news/20260105/bkn-20260105034022699-0105_00822_001.html,紙皮放走廊防煙門常開　住戶屢勸不改,香港,oncc,2026-01-05 03:45,"石硤尾邨美如樓火警中，約250名住客疏散，由於受到宏福苑5級火災的影響，不少住戶警覺性明顯提高，多名住戶憶述逃生經過時猶有餘悸。與起火單位同層的周姓男鄰居表示，當時家中的犬隻不停吠叫，他好奇下開門往外查看，即時有濃煙攻入屋，並因走廊煙霧太大而無法逃生。他與妻子及4隻狗被困家中。

為了抵禦濃煙入屋，周先生首先叫妻子入房間，他則於客廳以毛巾封閉門罅，同時開動抽氣扇抽走屋內濃煙，不過其後電力中斷，抽氣扇無法再開動，整個客廳遭煙籠罩，幸好消防其後到場。周先生又指，「這幢樓有很多消防隱患，很多住戶如何勸說都唔聽，開了防煙門，將紙皮擺喺走廊」。

另外，居於33樓住戶陳先生謂，最初以為是測試火警鐘，其後發現有煙及燒焦氣味。他立即帶同濕毛巾、手機、外套、身份證離開寓所。他又指自從大埔宏福苑火警後，他提高了警覺。居於26樓的黃小姐說，當時她曾經考慮留在家中，惟有燒焦氣味入屋，而宏福苑火警後，她比較擔心，遂決定帶兩隻家貓一齊逃生，「無諗過自己要走火警，今次咪當練習，身前身後各孭一隻貓行樓梯落樓，原來我都OK」。"
bkn-20260105033515302-0105_00822_001,否認壞喉轆　消防：須正確使用,2026-01-05 03:35,2026-01-05 03:35,https://hk.on.cc/cnt/news/20260105/bkn-20260105033515302-0105_00822_001.html,否認壞喉轆　消防：須正確使用,香港,oncc,2026-01-05 03:45,"在今次火警中，有住戶投訴美如樓的消防喉無水出。居於22樓的姓鄺男住客表示，大廈警鐘響起初期，他以為是演習，其後家傭發現窗外有煙，他遂跑落21樓察看，發現兩名少年正協助救火，惟他們說水喉沒有水，當時升降機也停了。他隨即折返住所，抬住坐輪椅的母親行樓梯逃生，當他們逃至21樓梯間時，一打開防煙門即有濃煙湧入，幸好此時消防已到場救火，在早前遇見的兩名救火少年幫助下，他們成功把母親抬至地下疏散，此時他才鬆一口氣，並感謝兩名熱心街坊。

對於消防喉「冇水出」問題，消防處回應稱，人員到場未有發現防煙門被打開，涉事樓層的消防喉轆亦正常運作，因此呼籲市民要學習使用喉轆，了解正確使用方法及位置。事後，消防處在社交網專頁發布使用喉轆的正確方法。

貼文指，當火警發生時，在安全情況下可以使用消防喉轆救火，使用方法依次分4步驟，一是破，按動火警鐘掣；二是轉，逆時針轉動來水掣；三是拉，在消防喉轆絞盤拉出膠喉；四是射，開啟喉嘴掣，射向火源底部。學識了正確使用消防喉轆，就可以於火警初起時有效控制甚至撲熄火勢，減低人命傷亡及財物損失。"
bkn-20260105033027752-0105_00822_001,《東方日報》今日要聞,2026-01-05 03:30,2026-01-05 03:30,https://hk.on.cc/cnt/news/20260105/bkn-20260105033027752-0105_00822_001.html,《東方日報》今日要聞,香港,oncc,2026-01-05 03:45,一貼睇晒《東方日報》A1新聞頭條、B1財經要聞及C1娛樂最爆，以及東網嚴選的本港、兩岸及國際重點新聞，名家評論，讓你在最短時間掌握最重要資訊。
bkn-20260105033025264-0105_00822_001,東方日報A1：石硤尾邨烈燄焚　250人逃生　輪椅翁斷魂,2026-01-05 03:30,2026-01-05 03:30,https://hk.on.cc/cnt/news/20260105/bkn-20260105033025264-0105_00822_001.html,東方日報A1：石硤尾邨烈燄焚　250人逃生　輪椅翁斷魂,香港,oncc,2026-01-05 03:45,"石硤尾發生一死8傷奪命火！石硤尾邨一高層單位，昨晨突然失火冒煙兼噴出火舌，滾滾黑煙湧出屋外席捲半空，一時間現場火警鐘聲大鳴，住戶驚聞火警紛紛報案兼逃生。消防趕至開動一條喉和出動一隊煙帽隊灌救，近一小時後將火撲滅，起火單位付之一炬，疑不良於行、平常以電動輪椅代步的七旬男戶主葬身屋內。火警中約250名住戶需要疏散，包括起火單位女戶主在內共8人受傷或不適，被分送兩間醫院救治。消防循包括電力故障等方面調查原因後，初步相信單位內有充電器起火肇禍，起火原因無可疑。

現場為石硤尾邨美如樓21樓一單位，有鄰居稱，該單位住有一對長者夫婦，男戶主平日以電動輪椅代步，並由妻子照顧。另外，單位內放置了不少櫃、木器及燈條。昨晨8時許上址突然起火，濃煙及火舌竄出窗外，驚動多名住戶及街坊報案，住戶得悉火警後，紛紛扶老攜幼落樓逃生。消防處表示，昨早8時01分接獲報案，人員在4分鐘內已經到達現場，消防處出動13輛消防車、13輛救護車，以及91名消防及救護人員，同時動用一條消防喉及派出一隊煙帽隊進行灌救，火警於早上8時54分大致被救熄。

火場面積約5米乘4米，消防在單位發現一具男性屍體，經核實他為姓梁（73歲）男戶主。起火單位窗戶及外牆俱熏黑，消防一直調查起火原因，包括循電力故障等方向進行追查，相信屋內有充電器起火引發火警，起火原因無可疑。火警中，約250人自行疏散，其中22人由消防協助下疏散，另有一男7女共8名（49歲至93歲）傷者，當中包括起火單位的66歲女戶主，其中兩人由消防救出，部分傷者需要戴上氧氣罩及氧氣面罩，救援人員在現場為傷者進行初步治理，包括提供高濃度氧氣。當中6名傷者被送往明愛醫院救治，餘下兩人則被送往廣華醫院治理。火警後，附近一間學校開放禮堂給疏散的住戶休息及避寒。

消防處表示，人員在滅火及救援中遇到困難，包括抵達走廊時已經濃煙密布，而起火單位內雜物比較多，增加了救援難度。自宏福苑火災發生後，消防處已由內部人手調配成立了「快速應變專隊」，當火警發生時，會即時出動協助前線人員檢查大廈消防裝置的效能及工作狀態。如果發現大廈消防裝置裝置不妥當，或有其他消防安全違規的情況，人員會即時採取執法行動，而美如樓亦持有有效的大廈消防裝置周年檢查證書。火警發生後，消防處的「快速應變專隊」也在美如樓測試大廈的消防裝置，沒有發現不妥當的地方，包括涉事樓層21樓。此外，在上月16日，消防處亦為美如樓進行自願警鐘檢查，結果發現大廈警鐘運作正常。

昨日下午，起火的21樓解封，多名居民返回寓所打點。現場所見，該樓層的走廊天花及牆身俱嚴重熏黑，且有工作人員在電錶房檢查電力裝置。與此同時，部分樓層的防煙門打開，房委會也於大半年前張貼告示，提醒住戶保持防煙門關閉。"
bkn-20260105024151282-0105_00822_001,荃灣中心單位夜半起火　200人驚魂疏散　女住戶受傷送院,2026-01-05 02:41,2026-01-05 02:41,https://hk.on.cc/cnt/news/20260105/bkn-20260105024151282-0105_00822_001.html,荃灣中心單位夜半起火　200人驚魂疏散　女住戶受傷送院,香港,oncc,2026-01-05 03:45,"荃灣發生火警。今日（5日）凌晨2時22分，荃灣中心太原樓33樓一個單位突然起火，濃煙滾滾直衝上空，嚇煞大批住客。

 

消防接報趕至，隨即開喉灌救，並協助大廈逾200名住戶疏散到地面暫避。救援人員其後於火場救出一名女住戶，她受輕傷清醒，經救護員即場治理後，送往瑪嘉烈醫院檢查。"
bkn-20260105020700304-0105_00822_001,球證判決惹議　女籃球隊發不還口獎金,2026-01-05 02:07,2026-01-05 02:07,https://hk.on.cc/cnt/news/20260105/bkn-20260105020700304-0105_00822_001.html,球證判決惹議　女籃球隊發不還口獎金,湖北,oncc,2026-01-05 02:15,"在中國女子籃球聯賽（WCBA）去年12月31日舉辦例行賽中，武漢盛帆女籃質疑球證在最後不足10分鐘內吹罰10多次。當賽事結束後，球隊向全體球員發放10萬人民幣（約11.1萬港元）「罰不還口獎」獎金，獎勵眾人面對上述情況仍展現紀律、克制及職業態度。

比賽由武漢盛帆女籃對陣浙江女籃，前者一度領先18分，在第4節最後9分07秒內，因球證一連串吹罰而改寫戰局。經整理，武漢盛帆女籃發現球證在該時段出現10次以上不利吹罰，場上球員與教練團並未失控，亦未與球證發生正面衝突。

武漢盛帆女籃賽後宣布設立「罰不還口獎」，並指無法改變比賽結果，設立獎項並非妥協，而是肯定球員精神層面。球隊公開呼籲相關部門正視比賽引發爭議，希望能全面調查球證吹罰行為，給予一個清楚交代，好讓中國籃球回到公平競爭軌道之上。"
bkn-20260105020601222-0105_00822_001,李在明稱對朝鮮半島和平與統一中國是重要夥伴,2026-01-05 02:06,2026-01-05 02:06,https://hk.on.cc/cnt/news/20260105/bkn-20260105020601222-0105_00822_001.html,"李在明稱對朝鮮半島和平與統一　中國是重要夥伴


在中國進行國事訪問的南韓總統李在明，周日（4日）晚上在北京舉行的在中韓人座談會上致詞提到，為了朝鮮半島的和平與統一，中國是無比重要的合作夥伴，強調中國在兩韓問題上扮演的角色重要性。<br/><br/>李在明在致詞中表示，希望這次訪中能補足兩國關係中不足之處，",中國,oncc,2026-01-05 09:30,"在中國進行國事訪問的南韓總統李在明，周日（4日）晚上在北京舉行的在中韓人座談會上致詞提到，為了朝鮮半島的和平與統一，中國是無比重要的合作夥伴，強調中國在兩韓問題上扮演的角色重要性。

李在明在致詞中表示，希望這次訪中能補足兩國關係中不足之處，成為使韓中關係正常化並進一步發展的出發點。他提到，位於北京的釣魚台國賓館是當年針對北韓核問題舉行6方會談的地點，彰顯中國對朝鮮半島和平的重要性。

李在明指，韓中雙邊領袖如此快速的互訪前所未見，這也反映了雙邊希望在最快的時間內使兩國關係正常化的鄭重認知。李在明也提及了中國在經濟方面的發展與雙邊合作的可能性。他指出，中國在支付寶等金融技術日常化，及包括電動車普及的環保政策上取得相當大的變化。"
bkn-20260105005754904-0105_00822_001,土瓜灣男子企跳　救援人員游說逾2小時勸服送院,2026-01-05 00:57,2026-01-05 00:57,https://hk.on.cc/cnt/news/20260105/bkn-20260105005754904-0105_00822_001.html,土瓜灣男子企跳　救援人員游說逾2小時勸服送院,香港,oncc,2026-01-05 01:45,"昨日(4日)晚上10時50分，一名年約50歲男子在北帝街67號企圖跳樓，他危站於上址天台，有住客報案求助。消防員趕至在大廈對開張開救生氣墊戒備，救援人員向事主展開游說。受事件影響，北帝街介乎馬頭角道與新山道全線需臨時封閉。

至今日(5日)凌晨零時48分，事主態度軟化，終被勸服返回安全位置，由救護車送往伊利沙伯醫院檢查。警員正調查其輕生原因。"
bkn-20260105000656843-0105_00822_001,王毅晤巴基副總理　稱不認為任何國家可充當國際警察,2026-01-05 00:06,2026-01-05 00:06,https://hk.on.cc/cnt/news/20260105/bkn-20260105000656843-0105_00822_001.html,王毅晤巴基副總理　稱不認為任何國家可充當國際警察,中國,oncc,2026-01-05 01:15,"中共中央政治局委員兼外長王毅周日（4日）在北京跟巴基斯坦副總理兼外長達爾舉行第7次中巴外長戰略對話。王毅表示中方從不認為哪一個國家可以充當國際警察，也不認同哪一個國家可以自詡為國際法官，各國的主權和安全都應受到國際法的充分保護。

王毅表示，新的一年，中方願同巴方一道落實兩國領導人共識，鞏固戰略互信，拓展務實合作，深化安全合作，加強多邊協調，推動中巴戰略夥伴關係更具時代價值，加快構建更加緊密的中巴命運共同體。

王毅又指，當前國際局勢更加變亂交織，單邊霸凌現象愈演愈烈，委內瑞拉形勢突變引發國際社會高度關注，中國外交部發言人已表明了中方立場，中方一貫反對在國際關係中使用或威脅使用武力，反對將一國的意志強加於別國，中方願同包括巴基斯坦在內國際社會一道，堅定捍衞《聯合國憲章》，堅守國際道義底線，堅持各國主權平等，共同維護世界和平與發展，共同推動構建人類命運共同體。

達爾表示，巴方重申恪守一個中國原則，將繼續在所有涉及中國核心利益問題上堅定支持中方，當前國際秩序受到嚴重衝擊，巴方高度讚賞中方堅持多邊主義，願同中方加強多邊協作，攜手應對全球性挑戰。"
bkn-20260105000238940-0105_00822_001,男子酒後砸椅鬧事　誤傷男童獲刑兩年,2026-01-05 00:02,2026-01-05 00:02,https://hk.on.cc/cnt/news/20260105/bkn-20260105000238940-0105_00822_001.html,男子酒後砸椅鬧事　誤傷男童獲刑兩年,雲南,oncc,2026-01-05 00:30,"雲南省昆明市一名男子去年7月酒後鬧事，誤傷一名8歲路過男童，導致對方右側頂骨凹陷性骨折，損傷程度達到輕傷一級。他日前被昆明市官渡區人民法院裁定尋釁滋事罪罪成，被判兩年有期徒刑。

案情指，徐某某去年7月在一間飯店與同鄉聚餐醉酒後，未喝完酒就發生爭執，期間拿起塑膠椅砸向他人，結果誤傷路過男童小明，對方事後需接受顱骨修復手術。公訴機關事後指控徐某某行為構成尋釁滋事罪，法院審理查明，被告曾有兩次酒後鬧事被行政拘留經歷。

法院一審指出，徐某某事後主動到案並如實供述，案件具有自首情節，且自願認罪認罰及墊付醫療費，量刑時予以綜合考慮，根據其犯罪事實、情節及悔罪表現，遂作出上述判決。"
bkn-20260104230051018-0104_00822_001,哈爾濱冰雪大世界　網紅冰瀑玫瑰獲讚美到犯規,2026-01-04 23:00,2026-01-04 23:00,https://hk.on.cc/cnt/news/20260104/bkn-20260104230051018-0104_00822_001.html,哈爾濱冰雪大世界　網紅冰瀑玫瑰獲讚美到犯規,黑龍江,oncc,2026-01-04 23:15,黑龍江知名景點哈爾濱冰雪大世界的冰瀑玫瑰打卡點於2025年底建成，近日驚艷亮相，數不盡的紅玫瑰綻放在緊密相依的心形冰川上，被網民形容「美到犯規」，吸引大批遊客前往。園區客服上周五（2日）介紹，該打卡點將瀑布形狀冰雕加玫瑰裝飾，另有將玫瑰凍在冰塊內的「冰扇藏花」。
