id,title,date,last_update,url,lead,section,source,scrape_time,news_content
bkn-20260402162608322-0402_00822_001,私隱署拘45歲男子　疑因樓宇裝修爭拗　涉「起底」前女友。,2026-04-02 16:26,2026-04-02 16:26,https://hk.on.cc/cnt/news/20260402/bkn-20260402162608322-0402_00822_001.html,私隱署拘45歲男子　疑因樓宇裝修爭拗　涉「起底」前女友。,香港,oncc,2026-04-02 16:30,"起底刑事化後，相關的事件仍時有發生。個人資料私隱專員公署今日(2日)指出，拘捕一名45歲男子，涉嫌「起底」前女友。

私隱署的調查顯示，被捕人與已分手的女友因為樓宇裝修問題爭拗，涉嫌去年底至今年初，先後3次在社交平台的一個個人帳戶貼文，以及4次在不同地方張貼單張，披露前女友的個人資料，包括她的照片、中文姓名、身份證號碼、住址及手機號碼，並作出負面評論。該署提醒「起底」屬嚴重罪行，最高可判罰100萬港元及監禁5年。"
bkn-20260402162210361-0402_00822_001,大埔截獲28歲販毒男　搜屋檢可卡因大麻等20萬元貨,2026-04-02 16:22,2026-04-02 16:35,https://hk.on.cc/cnt/news/20260402/bkn-20260402162210361-0402_00822_001.html,大埔截獲28歲販毒男　搜屋檢可卡因大麻等20萬元貨,香港,oncc,2026-04-02 16:45,"執法部門根據線報及經深入調查後，今日(4月2日)凌晨在大埔展開反毒品行動。行動中，警員截查一名姓馬(28歲)本地男子，並在其身上檢獲2包各約重20克的懷疑霹靂可卡因。其後，警員利用在馬男身上搜出的門匙，再搜查魚角村一個懷疑毒品儲存倉，並檢獲約84克懷疑霹靂可卡因、約360克懷疑大麻草及27支懷疑大麻精油。

行動中檢獲的毒品總市值約20萬港元。該名男子涉嫌「販運危險藥物」被捕，現正被扣留調查。"
bkn-20260402161630790-0402_00822_001,全港反黑工搜查餐廳裝修單位　拘22人包括兩名僱主,2026-04-02 16:16,2026-04-02 16:16,https://hk.on.cc/cnt/news/20260402/bkn-20260402161630790-0402_00822_001.html,全港反黑工搜查餐廳裝修單位　拘22人包括兩名僱主,香港,oncc,2026-04-02 16:30,"相關部門於3月27日至4月1日在全港多區展開反非法勞工行動。行動中，調查人員搜查了多個目標地點，包括餐廳、工廠大廈及裝修單位等，共拘捕20名懷疑非法勞工及2名涉嫌聘用非法勞工的僱主。

被捕的懷疑非法勞工為15男5女(25至57歲)，當中一男一女持有不允許僱傭工作的擔保書（俗稱「行街紙」）。因涉嫌聘用非法勞工被捕的僱主為2名男子(36及60歲)。有關涉嫌聘用上述非法勞工的僱主的調查仍然在進行中，不排除有更多人被捕。

入境處表示，任何人違反對他有效的逗留條件，即屬犯罪。同時，所有旅客在未獲入境處處長批准前，無論受薪與否，均不得在港從事任何僱傭工作。違例者會遭檢控，一經定罪，最高刑罰為罰款5萬港元及監禁2年。協助及教唆他人違反逗留條件者同罪。"
bkn-20260402161555740-0402_00822_001,類鼻疽增2宗　75歲翁屬復發,2026-04-02 16:15,2026-04-02 16:15,https://hk.on.cc/cnt/news/20260402/bkn-20260402161555740-0402_00822_001.html,類鼻疽增2宗　75歲翁屬復發,香港,oncc,2026-04-02 16:30,"衞生署衞生防護中心今日(4月2日)公布，過去一周(3月27日至4月1日)錄得兩宗新增類鼻疽個案。其中一名75歲男子於2024年9月確診類鼻疽，不排除是次為復發感染，中心將為病人樣本進行基因分析。兩宗個案屬散發個案，沒有資料顯示與本港早前錄得的其他確診個案有流行病學關連。截至昨日(4月1日)，本港今年錄得5宗類鼻疽個案。去年共錄得21宗類鼻疽個案。

首宗個案涉及1名有長期病患的75歲男子。他居於西貢區，自上月22日出現發燒、咳嗽和氣促，同日到將軍澳醫院急症室求診，需留院治療，目前情況穩定。病人的臨床診斷為肺炎，臨床樣本經化驗證實感染類鼻疽伯克氏菌。病人於2024年9月亦曾確診類鼻疽，入院治療後已康復，不排除是次為復發感染，中心將為病人樣本進行基因分析。根據科學文獻，即使接受了完整的抗生素治療，類鼻疽仍有復發風險，類鼻疽伯克氏菌可能未被完全根除，而潛伏於人體內多年。一旦抵抗力下降，細菌有機會再次引發感染。

第2宗個案涉及1名有長期病患的71歲男子。他居於元朗區，上月23日因雙腳無力跌倒被送往天水圍醫院急症室治理，在急症室出現發高燒及寒顫，需留院治療。病人的臨床診斷為敗血症，臨床樣本經化驗證實感染類鼻疽伯克氏菌。病人目前情況穩定，已轉往博愛醫院繼續接受治療。"
bkn-20260402161550804-0402_00822_001,提升網絡食品安全　國家市監總局展開一年行動,2026-04-02 16:15,2026-04-02 16:15,https://hk.on.cc/cnt/news/20260402/bkn-20260402161550804-0402_00822_001.html,提升網絡食品安全　國家市監總局展開一年行動,浙江,oncc,2026-04-02 16:30,"中國國家市場監督管理總局周二（3月31日）在浙江省杭州市啟動網絡食品安全合規提質系列行動。行動為期一年，目標實現網絡食品經營主體資質更透明、經營行為更規範、監管效能更顯著、消費環境更放心。

活動召集電商企業、協會學會、監管部門、新聞媒體、消費者等多方代表，聚焦網絡食品領域突出問題，展開政策宣講、發布合規指引、組織專家點評、平台企業交流體會並聯合簽署《網絡食品交易平台經營者食品安全管理自律公約》。國家市監總局相關司局負責人指，為確保行動取得實效、保持長效，將建立監管部門、平台企業、協會學會、技術機構等共同參與的網絡食品安全協同共治機制。

行動以重點解決直播帶貨亂象、入網主體資質失查、虛假宣傳氾濫等三大突出問題為切入口，通過嚴厲打擊網絡食品經營違法違規行為、嚴格規範平台企業食品安全管理行為、持續推動平台企業提升食品安全管理水平等三方面舉措，營造安全、放心、便捷的網絡食品消費環境。"
bkn-20260402160451098-0402_00822_001,遺屬悼念戰時被強徵受害者　要求日本政府賠償,2026-04-02 16:04,2026-04-02 16:04,https://hk.on.cc/cnt/news/20260402/bkn-20260402160451098-0402_00822_001.html,遺屬悼念戰時被強徵受害者　要求日本政府賠償,河北,oncc,2026-04-02 16:30,"清明節下周日（4月5日）將至，二戰時期被日本強徵的中國籍受害者遺屬等約100人，周二（3月31日）在河北省石家莊市舉行悼念儀式，並要求日本政府賠償。

在悼念儀式上，被強徵中國籍受害者遺屬等發表了請願書，要求日本政府向受害者和遺屬作出賠償。儀式結束後，遺屬等在當地舉行了強徵問題相關討論會。

戰時強徵勞工的日本三菱材料等企業與受害者曾達成和解，但部分人拒絕和解。家住兵庫縣神戶市、常年參與受害者訪談調查的87歲在日華人二代林伯耀批評，日本政府對歷史不反省、不認責。"
bkn-20260402154210436-0402_00822_001,威爾斯親王醫院實驗室疑洩漏氣體　25人疏散　兩女職員不適,2026-04-02 15:42,2026-04-02 16:57,https://hk.on.cc/cnt/news/20260402/bkn-20260402154210436-0402_00822_001.html,威爾斯親王醫院實驗室疑洩漏氣體　25人疏散　兩女職員不適,香港,oncc,2026-04-02 17:00,今日(4月2日)下午3時24分，執法部門接獲報案，指沙田威爾斯親王醫院特別大樓一實驗室內，懷疑有氣體洩漏傳出異味。大批孭上氧氣樽的消防員趕至大樓，正搜索氣體源頭，暫時未知氣體性質。受事件影響，大樓內有4男21女需要疏散，另有兩名實驗室女職員報稱不適，需要檢查治理。
bkn-20260402151502808-0402_00822_001,國有博物館逐件清點館藏文物　排查安全隱患,2026-04-02 15:15,2026-04-02 15:15,https://hk.on.cc/cnt/news/20260402/bkn-20260402151502808-0402_00822_001.html,國有博物館逐件清點館藏文物　排查安全隱患,中國,oncc,2026-04-02 15:30,"國家文物局近日印發通知並召開電視電話會議，部署推進全國國有博物館館藏文物安全管理專項行動，全面開展國有館藏文物盤庫清點和安全隱患排查整治工作，今次集中行動為期一年。

當局組織全國國有博物館逐件清點館藏文物，全面核實帳物相符情況，推動形成常態化、規範化的館藏文物盤庫機制，同步啟動第二次全國可移動文物普查的試點工作；並集中排查整治館藏文物安全隱患，進一步強化防範措施，提高安全管理和應急處置能力，確保館藏文物安全。

當局要求各地、各博物館樹立和踐行正確政績觀，以此次專項行動為契機，完善館藏文物管理制度，以紮實的工作成效築牢館藏文物安全防線，提升館藏文物安全管理整體水平。"
bkn-20260402150018923-0402_00822_001,華否認利用LinkedIn滲透北約歐盟　促停政治操弄,2026-04-02 15:00,2026-04-02 15:00,https://hk.on.cc/cnt/news/20260402/bkn-20260402150018923-0402_00822_001.html,華否認利用LinkedIn滲透北約歐盟　促停政治操弄,中國,oncc,2026-04-02 15:15,"比利時和法國媒體日前引述消息指，中國利用在美國求職平台領英（LinkedIn）的虛假帳號，試圖透過向北約和歐盟機構工作人員索取資料，竊取敏感訊息。中國駐比利時大使館周四（2日）回應指，有關媒體報道純屬無中生有，敦促有關各方尊重事實與真相。

使館發言人批評，有關媒體報道是張冠李戴，誰家的帽子誰自己戴，中方戴不了，也不想戴。中方一貫堅持在相互尊重、互不干涉內政的基礎上，與各國發展友好關係，堅決反對捕風捉影式地散布虛假訊息、誤導公眾輿論。

發言人提到，此前有媒體誣稱一名比利時政界人士被中國收買從事間諜活動，當地檢察機關最終因未發現確鑿證據而終止相關司法調查。中方敦促有關各方尊重最起碼的法律和道德底線，停止反華的政治操弄和惡意詆毀，多為增進中比相互理解、信任、合作和雙方福祉做些有益的事。"
bkn-20260402143321186-0402_00822_001,聯合國秘書長任命新任駐華協調員　杰思衡履新,2026-04-02 14:33,2026-04-02 14:33,https://hk.on.cc/cnt/news/20260402/bkn-20260402143321186-0402_00822_001.html,聯合國秘書長任命新任駐華協調員　杰思衡履新,中國,oncc,2026-04-02 15:15,"聯合國周三（4月1日）發布公告，聯合國秘書長古特雷斯任命愛爾蘭籍官員杰思衡（Stephen Jackson）為聯合國新任駐華協調員，即日開始任期，已正式履新。對上一任聯合國駐華協調員常啟德卸任後，周二（3月31日）在北京宣布「退休」，將選擇留在中國。

公告指出，杰思衡在國際發展、建設和平及人道主義事務領域，擁有超過30年經驗，曾出任肯尼亞常駐協調員、聯合國政策規劃與指導處處長、聯合國布隆迪辦事處辦公室主任等職務。他早年從事人道主義與學術工作，擁有美國普林斯頓大學文化人類學博士學位和公共事務碩士學位，以及愛爾蘭都柏林三一學院數學學士學位。

聯合國駐華協調員是聯合國在中國的最高級別常駐代表，負責統籌聯合國工作隊伍的在華工作，協調各機構資源與項目，對接中國政府推進國家發展優先事項，落實可持續發展目標，並促進與各方夥伴合作。"
bkn-20260402142606144-0402_00822_001,收緊資助專上學額　87內地生不滿過渡須居港1年　入稟高院申覆核,2026-04-02 14:26,2026-04-02 14:26,https://hk.on.cc/cnt/news/20260402/bkn-20260402142606144-0402_00822_001.html,收緊資助專上學額　87內地生不滿過渡須居港1年　入稟高院申覆核,香港,oncc,2026-04-02 15:00,"政府於2025年7月修例，由2028/29學年起不滿18歲的簽證持有人須在港居留2年才能被視作本港學生，有權申請獲資助的大學學位。87名由家長代表的內地學生不滿政策中2027/28學年的學生須居港1年的過渡安排，早前入稟高院申請司法覆核。案件今日(4月2日)於高院開審，申請方認為上述一年政策不合理，新政策公布在2025/26學年即將開始前，而這時機意味著將於2027年畢業生中的特定群體沒有合理時間來制定自己的計劃，以符合新的居住要求。

申請人為87名由家長代表的內地學生，答辯人為教育局。入稟狀指出2025年7月31日前，18歲以下的簽証持有人將被視作本地學生，而他們有權申請政府資助的大學學位。經政府修例後，2028/29學年起，上述簽証持有人在入讀專上課程前須至少在港居留2年，才能被視作本地學生。作為過渡政策，2027/28學年的簽証持有人只須在入讀專上課程前在港居留1年。

本案87名申請人均是在海外或內地學校就讀，並會在2027年完成其中學課程，現正準備英國高級程度考試(下稱AL)及美國大學先修課程考試(下稱AP)，並希望在2027/28學年入讀香港的專上課程。因應政策修改，申請人父母查詢了香港各校，但學校均表示2025/26學年已沒有或幾乎沒有AL或AP的課程名額。他們認為即使轉學是可能的，亦會對申請人有不利影響，且這須居港1年的政策對他們具歧視性。

案件編號：HCAL 2434/2025"
bkn-20260402142109004-0402_00822_001,宏業消防指水缸無水　置邦物業主任傳送照片卻顯示已入水,2026-04-02 14:21,2026-04-02 14:21,https://hk.on.cc/cnt/news/20260402/bkn-20260402142109004-0402_00822_001.html,宏業消防指水缸無水　置邦物業主任傳送照片卻顯示已入水,香港,oncc,2026-04-02 15:00,"大埔宏福苑火災當日消防喉轆無水出，矛頭直指消防水缸無水，惟今日（2日）有新證據顯示，疑似消防水缸有裝水，令人詫異。置邦興業有限公司(ISS)物業主任鄭芷盈今日作供時提供新證據指出，她曾在催促消防系統承辦商宏泰消防工程有限公司董事及工程師鍾傑文盡快進行執修工程時，向鍾傳送一批聲稱是消防水缸的照片，照片日期為8月底及9月底，顯示水缸有水，鄭供稱傳送照片予鍾是希望讓鍾了解消防水缸情況及讓鍾看看是否可以盡快展開工程，以在完成後提交消防證書SF251。

根據鄭芷盈與鍾傑文的WhatsApp對話紀錄，鄭稱自己在「安排電檢後的執修，有野要整追佢快啲整」，而在2025年10月22日，當時宏福苑收到消防處信件，鄭將信件傳給鍾；後於10月28日，她再追問鍾何時開始執修工程，當時鍾曾向鄭表示消防水缸無水，要待宏福苑的消防水缸有水工程才可進行，否則只可「整少少」，故鄭芷盈向鍾傳送數張照片，顯示水缸已入水，而其中兩張照片的日期列明為8月30日及9月29日。

獨立委員會首席大律師杜淦堃對此感到十分奇怪，他指目前證據指明，宏福苑8座大廈的消防水缸，均在2025年7月至8月期間被宏業工人聯同ISS工程人員放水，故消防水缸應是無水在水缸內。但最新證據卻指出，鄭向鍾傳送消防水缸有水的照片，杜問鄭是否知道水缸有水，以及如何取得照片，鄭則稱是問其同事ISS文員駱倩盈取得相片，並解釋自己將照片傳給鍾傑文是因應鍾的疑問，並希望向鍾確認「（水缸）個情況咁樣ok嗎？」，又補充指曾聽說過「入返水係要養水。」"
bkn-20260402141441413-0402_00822_001,中學黨委書記被指性侵15歲女生　圖付20萬人民幣私了,2026-04-02 14:14,2026-04-02 14:14,https://hk.on.cc/cnt/news/20260402/bkn-20260402141441413-0402_00822_001.html,中學黨委書記被指性侵15歲女生　圖付20萬人民幣私了,河北,oncc,2026-04-02 14:15,"內媒周三（4月1日）披露，河北省邯鄲市一間中學的黨委書記涉嫌性侵15歲女高中生，被家長發現後試圖以20萬元人民幣（約22.8萬港元）「私了」被拒，周一（3月30日）被檢方批准逮捕。但部分內媒其後下架相關報道，官方暫未有通報。

受害人李婷（化名）的母親王芳（化名）透露，女兒中考前看到該校黨委書記喬某軍在網絡平台發布的學校介紹後被吸引，與對方互相關注，中考時報考了該校並獲錄取。今年春節假期內，喬某軍通過上述網絡平台聯絡李婷，讓她去學校練習乒乓球，期間在辦公室性侵她。她其後變得抑鬱，甚至半夜哭泣。王芳上月在女兒手機看到其網購避孕藥的紀錄，詢問後才獲悉其遭遇。

王芳之後到學校找了喬某軍，但對方未有道歉，只願付錢「私了」。王芳希望追究喬某軍的刑事與民事責任，上月18日報警，對方4日後被邯鄲市某區公安機關刑拘。邯鄲市某區人民檢察院第一辦案組一名工作人員周三回應指，喬案屬於該院未成年人辦案組的案件，便對無關人員透露案情。"
bkn-20260402140532145-0402_00822_001,社會組織假冒行業協會　民政部公布8宗典型案例,2026-04-02 14:05,2026-04-02 14:05,https://hk.on.cc/cnt/news/20260402/bkn-20260402140532145-0402_00822_001.html,社會組織假冒行業協會　民政部公布8宗典型案例,中國,oncc,2026-04-02 14:15,"中國民政部周二（3月31日）公布8宗非法社會組織典型案例，涉案組織未經登記但打着行業協會等旗號活動，均被依法取締或責令解散。

其中，「粵港澳大灣區低空經濟無人機協會」未經登記，對外宣稱為區域性、非營利社會團體，設有會長、執行會長、名譽會長、高級顧問等職務，曾舉行成立大會。該組織面向無人機領域企業、專家、從業人員等發展會員，先後召開行業峰會、專家主題演講、圓桌對話等活動，並面向低空經濟領域相關機構、人員開展投資對接、合作洽談。廣東省深圳市福田區民政局2025年11月責令該組織解散。

「中華志願者協會永康鄉村振興惠民服務站」未經依法設立，冒用中華志願者協會地方代表機構名義，以支持「國家鄉村振興戰略」為名展開宣講活動，並以「繳納99元人民幣（約113港元）享受助學、助老等項目服務」欺騙部分學生家長、長者交錢入會。2025年7月遭浙江省永康市民政局取締。其餘案例涉及「河北省女書法家協會」、「中國中小企業發展管理協會」、「中國低空經濟聯盟」、「中國聯合國採購促進會國際商務工作委員會」、「中國頂級烹飪大師匠傳委員會」、「山東省老酒收藏協會」。"
bkn-20260402140529831-0402_00822_001,置邦接投訴無跟進　物業主任：控制唔到宏業工人　無能力炒佢哋,2026-04-02 14:05,2026-04-02 14:22,https://hk.on.cc/cnt/news/20260402/bkn-20260402140529831-0402_00822_001.html,置邦接投訴無跟進　物業主任：控制唔到宏業工人　無能力炒佢哋,香港,oncc,2026-04-02 14:30,"宏福苑大維修物管公司責任難避。置邦興業有限公司(ISS)物業主任鄭芷盈證實，或多或少都會接獲居民投訴大維修工人食煙、發泡膠、棚架等有垃圾的投訴，但無印象收到天井垃圾投訴。獨立委員會首席大律師杜淦堃指出，似乎ISS在跟進投訴方面，「在某一個階段停左」，即便向大維修承建商宏業反映，ISS也無進一步行動跟進問題，再次形容ISS似「傳聲筒」。鄭芷盈則指「因為我哋控制唔到宏業工人，無能力炒佢哋。」

就垃圾問題，杜指起火當日源頭似乎和104至105室間的光井有關。鄭作供時確認，維修前光井應有鎖上，或多或少會有垃圾，但清潔工會定時清理光井；在大維修後則沒有由清潔工整理，因該處改為工人可進入，大維修致堆積垃圾，但清潔工人上不到該位清潔，故管理處內部也有討論過，光井位情況不太理想，宏業工人「唔係咁密去清。」

杜向鄭指出，明白未必屬鄭的個人責任，但公司有責任向政府部門跟進，不能只靠宏業去跟進食煙等火警風險問題。杜續指，就火警風險而言 似乎ISS有獨立責任，包括ISS有保安工作指引，在棚架圍住的地方，ISS保安應特別留意敏感地點，進行突擊檢查，並給員工相關培訓。

此外，一般而言管理處有借匙簿，若入泵房應問座頭取匙以記錄在案，鄭透露，她在火災事發後才知ISS電工及木工師傅持有鎖匙，正常來說所有承建商來屋苑都要做臨時工作紀錄，但杜指出翻查大廈借匙簿，部分承建商有進出紀錄但不見有借匙紀錄。鄭確認有可能因為保養承辦商來工作會通知工程主任，故ISS工程部或會自行協助宏業工人開泵房門。

杜淦堃又問鄭芷盈，是否承辦商到場入泵房未必會有書面借匙紀錄，鄭稱若見承建商來一定會填臨時工作紀錄，之後再落登記簿，控制室同事會蓋印確認。但宏業工人則不同，因宏業是大維修承建商，在屋苑內有駐場辦公室，不需要做登記，宏業工人已有着制服，就不用簽文件，同意此舉會影響紀錄流程。鄭芷盈亦是在火災後才得知消防警鐘被關，火災當日她曾去宏昌閣叫保安座頭打破警鐘，看看火警鐘會否響，惟打破玻璃後無聲響，故她叫ISS工程主任林文欣問宏福苑消防系統承辦商宏泰消防工程有限公司董事及工程師鍾傑文為何警鐘失效，坦言自己「當時唔知發生咩事。」"
bkn-20260402140232171-0402_00822_001,元公貨車切入路肩撞工程車　司機受傷一度被困,2026-04-02 14:02,2026-04-02 16:02,https://hk.on.cc/cnt/news/20260402/bkn-20260402140232171-0402_00822_001.html,元公貨車切入路肩撞工程車　司機受傷一度被困,香港,oncc,2026-04-02 16:30,"元朗公路發生交通意外。今午(2日)1時54分，一輛貨車沿路往上水方向行駛，至丹桂村對開時意外撞向一輛工程車車尾，貨車司機受傷被困車內。救援人員接報趕至將傷者救出交救護車送院治理，人員圍封部分行車線，調查肇事原因。

網上流傳由途經車輛拍攝的車Cam影片，見到該輛貨車本來沿慢線前行，駛至出事位置時突然切入路肩，然後與停在路肩的工程車相撞。片主當時亦感到莫名其妙，不斷「嘩、嘩」驚呼，並發出疑問道：「做乜嘢呀佢？」之後影片便告結束。"
bkn-20260402140001042-0402_00822_001,監委會討論陳家珮逆線行車　會否處分？　主席：暫沒進一步訊息,2026-04-02 14:00,2026-04-02 14:00,https://hk.on.cc/cnt/news/20260402/bkn-20260402140001042-0402_00822_001.html,監委會討論陳家珮逆線行車　會否處分？　主席：暫沒進一步訊息,香港,oncc,2026-04-02 14:15,"議員陳家珮早前被揭發在灣仔逆線行車，及後被判罰款及停牌1個月。立法會監察委員會今日(2日)舉行閉門會議，身兼監委會主席的立法會主席在會議後被問及會否對陳家珮作出處分。

主席指在監委會會議上，議員們都認真討論，並按相關規則和既定程序處理個案，暫時未有進一步訊息可以透露，合適時會再作交代。

陳家珮早前在灣仔逆線行車，事後被票控，她在法庭承認一項「不小心駕駛」罪，判處罰款2000元，停牌1個月。"
bkn-20260402131804872-0402_00822_001,王毅與巴林外相通電話　願推動平息中東戰火,2026-04-02 13:18,2026-04-02 13:18,https://hk.on.cc/cnt/news/20260402/bkn-20260402131804872-0402_00822_001.html,王毅與巴林外相通電話　願推動平息中東戰火,中國,oncc,2026-04-02 13:30,"中東戰火持續之際，中共中央政治局委員、外交部長王毅周四（2日）與海灣合作委員會輪值主席、巴林外交大臣扎耶尼通電話，表明願與巴方一道推動平息戰火、恢復和平，實現地區持久穩定，維護全球南方國家尤其是中小國家的正當權益。

扎耶尼介紹中東局勢最新進展和巴方立場，表示當前海灣國家安全面臨嚴峻挑戰，霍爾木茲海峽航行受阻。巴方願通過聯合國安理會發揮作用，解決海峽通航問題，同時希望與中方加強溝通協調。

王毅闡明中方反對侵略、倡導和平的原則立場，提到中國和巴基斯坦最近發表恢復海灣和中東地區和平穩定五點倡議，包括呼籲停止對平民和非軍事目標攻擊、確保霍爾木茲海峽安全、恢復正常通航等內容。他指出，停火止戰是國際社會共同呼聲，聯合國安理會的行動應有助緩和局勢，止戰復談，而不能為非法戰爭行為背書，更不能火上澆油。"
