id,title,date,last_update,url,lead,section,source,scrape_time,news_content
bkn-20250826091952340-0826_00822_001,冀一個多月內完成山寨水招標審查　審計署：若涉違法交執法部門,2025-08-26 09:19,2025-08-26 12:51,https://hk.on.cc/cnt/news/20250826/bkn-20250826091952340-0826_00822_001.html,冀一個多月內完成山寨水招標審查　審計署：若涉違法交執法部門,香港,oncc,2025-08-26 13:00,"「山寨水」招標風波，負責領導專責小組進行調查的財經事務及庫務局，主動邀請審計署審查採購招標程序。審計署長林智遠指在收到財庫局邀請調查前已關注事件，期望在一個多月內完成審查工作，若涉公職人員違法將轉交執法部門跟進。

審計署早前已邀包括政府物流署署長陳嘉信在內等多名官員會面，了解物流署招標的程序及細則。政府日前亦指物流署「把關不力」。

被問及如何理解「把關不力」，林智遠對傳媒重申，需要保密調查進度及細節，亦早於獲邀前已要求團隊審計政府帳目時，查找部門在「內部控制」的不足，形容為部門的「分內事」。

林智遠指考慮到社會高度關注事件，但衡工量值式的審計需時甚長，帳目審計則更靈活多變，因此要求同事審計政府帳目時加強審查「內部控制」，追溯過往缺失；若發現「大件事」，不排除後續再展開衡工量值式審計。

對於物流署長陳嘉信批准是次標書不用評分制，是否調查方向之一，林智遠沒有正面回應，僅指審計署一向關注招標事宜，亦是「民有所呼，我有所應」。

至於由誰公布調查結果及公布報告形式，他相信受多重因素影響，不能切實指明，但若發現內部缺失必定先與相關部門溝通，促請對方即時改善；倘發現公職人員違法會轉交執法部門。

他又引述財庫局局長許正宇已表明，會公布調查報告內容，之後提交立法會，相信立法會政府帳目委員會也會跟進報各告。

最初指專責小組的調查需時3個月，不少議員批評時間太長，政府應先向公眾交代基本的資料，而許正宇早前指會作出中期報告或提出改善措施。"
bkn-20250826091927026-0826_00822_001,元朗院舍男子李啟然上周五失蹤　昨在大嶼山被尋回,2025-08-26 09:19,2025-08-26 09:19,https://hk.on.cc/cnt/news/20250826/bkn-20250826091927026-0826_00822_001.html,元朗院舍男子李啟然上周五失蹤　昨在大嶼山被尋回,香港,oncc,2025-08-26 10:00,29歲男子李啟然於上周五（22日）在元朗白沙村一院舍最後露面後便告失蹤，院舍職員報案。該名男子昨日（25日）晚上在大嶼山北達東路被尋回。他沒有受傷，案件沒有可疑。
bkn-20250826090617732-0826_00822_001,「折疊男孩」4次手術終伸直身體　盼繼續學業,2025-08-26 09:06,2025-08-26 09:06,https://hk.on.cc/cnt/news/20250826/bkn-20250826090617732-0826_00822_001.html,「折疊男孩」4次手術終伸直身體　盼繼續學業,山東,oncc,2025-08-26 09:15,"山東00後男子姜延琛因患罕見的先天性肌肉病，身體向後「摺曲」，頸向後仰接近180度，頭和臀部曾經只有不到一隻手掌的距離，人稱「折疊男孩」。從去年12月到今年6月，他先後接受4次手術，身體終於被「打開」，現在終能站直。

姜延琛是山東德州夏津縣人，其母于梅英表示，兒子小時因頭部朝天，基本上穿襪子穿褲都看不見，因此別人用5分鐘穿好衣服，他需要15分鐘。儘管姜延琛從小學三、四年級就是跪着上課，但他從未放棄學習，後來更考上大學，希望自己有一天能夠站起來。他的病因無可借鑑的成功治療病例，手術風險極高，但他堅持接受治療。2024年，8月他找到了四川成都的極重度脊柱矯正專家梁益建，進行新階段的治療。

2024年12月，姜延琛接受了反向截骨矯形手術。今年2月、4月，他再接受頸椎截骨矯形翻修、髖關節鬆解手術。最後一次手術則在6月進行。這四次手術令姜延琛的身體整體矯正了170度左右。內媒周一（25日） 從成都京東方醫院獲悉，姜延琛順利康復出院。姜延琛表示，第一次站起來的時候很激動也很累，「感覺重獲新生」，之後會回老家繼續康復訓練。因病休學了一年的他表示，心中一直有考研的想法，不過最終要根據身體和學習情況而定。"
bkn-20250826090347664-0826_00822_001,趙樂際晤俄國家杜馬主席強調捍衞二戰勝利成果,2025-08-26 09:03,2025-08-26 12:46,https://hk.on.cc/cnt/news/20250826/bkn-20250826090347664-0826_00822_001.html,"趙樂際晤俄國家杜馬主席　強調捍衞二戰勝利成果


俄羅斯國家杜馬主席沃洛金（Vyacheslav Volodin）周一至周二（25日至26日）率團訪華，首天與全國人大常委會委員長趙樂際在北京人民大會堂共同主持中俄議會合作委員會第十次會議。趙樂際表示，雙方要密切在各國議會聯盟、金磚國家議會論壇等多邊機制內的溝通協調，發出共同聲音，堅",北京,oncc,2025-08-26 14:15,"俄羅斯國家杜馬主席沃洛金（Vyacheslav Volodin）周一至周二（25日至26日）率團訪華，首天與全國人大常委會委員長趙樂際在北京人民大會堂共同主持中俄議會合作委員會第十次會議。趙樂際表示，雙方要密切在各國議會聯盟、金磚國家議會論壇等多邊機制內的溝通協調，發出共同聲音，堅決捍衞二戰勝利成果，弘揚正確二戰史觀。

趙樂際表示，中國全國人大願與俄聯邦會議一道充分發揮合作機制平台作用，持續加強交流合作，助力中俄新時代全面戰略協作夥伴關係深入發展。他認為，雙方要保持密切往來的良好勢頭，增進了解和互信；並拓展機制交流的內容和形式，互學互鑑治國理政和立法、監督等方面經驗；及時批准有關雙邊條約和協定，為兩國務實合作提供法律保障；發揮人大代表和議員的特點優勢，為經貿合作、人文交流牽線搭橋；活躍婦女、青年代表和議員的交流，形成更多接地氣、惠民生的合作成果。

沃洛金表示，在兩國元首戰略引領下，俄中新時代全面戰略協作夥伴關係深入發展。俄國家杜馬願加強同中國全國人大友好交往，圍繞落實兩國元首重要共識，發揮俄中議會合作委員會機制平台作用，為促進俄中全方位合作，優化營商環境，深化人文交流，共同弘揚正確二戰史觀，維護多邊主義作出立法機構的貢獻。

中國領導人周二（26日）在北京人民大會堂會見沃洛金，指出中俄關係是動盪變革的當今世界最穩定、最成熟、最富戰略內涵的一組大國關係，並提到下周中方將舉行紀念中國人民抗日戰爭暨世界反法西斯戰爭勝利80周年活動，中國和蘇聯分別作為二戰亞洲和歐洲主戰場，為贏得勝利作出重大貢獻。他強調，雙方要繼續傳統友誼，深化戰略互信，加強各領域交流合作，攜手捍衞兩國安全和發展利益，團結全球南方國家，堅持真正的多邊主義，推動國際秩序朝更公正合理方向發展。"
bkn-20250826082216582-0826_00822_001,牛頭角彩興路簡約公屋　創香港高層建築最快興建紀錄,2025-08-26 08:22,2025-08-26 08:22,https://hk.on.cc/cnt/news/20250826/bkn-20250826082216582-0826_00822_001.html,牛頭角彩興路簡約公屋　創香港高層建築最快興建紀錄,香港,oncc,2025-08-26 09:30,"屬於首個高層簡約公屋的牛頭角彩興路簡約公屋，兩座大廈分別於今年6月底及7月底開始入伙。房屋局副局長戴尚誠接受傳媒訪問表示，採用組裝合成技術MiC興建簡約公屋，令建築時間縮短，牛頭角彩興路簡約公屋第1座18層高大廈，用了不足18個月便完成地基及上蓋工程，而最終兩座大廈分別只需536日及562日就建好，創下香港高層建築最快興建紀錄。

戴指出，截至今年6月底，公屋綜合輪候時間由上季的5.3年下降至5.1年，當中未反映彩興路項目的入伙情況，有信心2026/27年將會降至4.5年，正朝着目標去做。他又稱，簡約公屋總體工程造價，已降至210.5億港元。建築署解釋因為簡約公屋項目共約3萬個單位，均大量採用相同設計，故能做到大量生產，加上鋼鐵成本下降，大大節省建築成本。

彩興路項目總共有2,290個單位，有三款類型，包括1至2人、3至4人及4至5人單位，每月租金介乎1,290元到2,990元。該簡約公屋有專線小巴接駁至鄰近港鐵站，車程只需約15分鐘，營辦商亦計劃下月中延長服務時間至晚上10:40分，邨內亦設有便利商店和自助洗衣店等設施，供住戶應付日常生活所需。"
bkn-20250826082056203-0826_00822_001,陽江市幼兒園爆沙門氏菌食物中毒　130人發病,2025-08-26 08:20,2025-08-26 10:14,https://hk.on.cc/cnt/news/20250826/bkn-20250826082056203-0826_00822_001.html,陽江市幼兒園爆沙門氏菌食物中毒　130人發病,廣東,oncc,2025-08-26 10:30,"廣東省疾病預防控制局近日公布上月全省突發公共衞生事件資訊，其中陽江市江城區報告一宗發生在幼兒園的沙門氏菌食物中毒事件，130人發病。

當局表示，該省上月報告3宗一般及以上級別突發公共衞生事件，累計報告事件相關病例5,447宗，無死亡病例。除上述幼兒園沙門氏菌食物中毒事件為一般事件級別外，佛山市順德區報告的一宗本地基孔肯雅熱疫情，發病5,295宗，為較大事件級別；中山市市區報告一宗本地基孔肯雅熱疫情，發病22宗，事件級別為一般。

沙門氏菌病為人畜均可感染的感染性疾病，可引發急性腸胃炎，典型症狀包括發燒、腹瀉、嘔吐等，病情可持續4至7天，嚴重時甚至會導致患者死亡。在內地，沙門氏菌食物中毒多年來一直位居細菌性食物中毒的首位，此菌致病在廣東很常見。"
bkn-20250826080555837-0826_00822_001,天價雞菜式1999人民幣　餐廳稱實際是雞煲翅,2025-08-26 08:05,2025-08-26 08:05,https://hk.on.cc/cnt/news/20250826/bkn-20250826080555837-0826_00822_001.html,天價雞菜式1999人民幣　餐廳稱實際是雞煲翅,上海,oncc,2025-08-26 08:15,"上海一家餐廳近日被指售賣天價「廣東清遠雞」，半隻雞收費1,999元（人民幣，下同，約2,200港元）。餐廳職員事後回應，該道菜實際上是雞煲翅，包含很多材料。

博主發影片稱，在上海一家餐廳吃到上述天價雞。店內工作人員稱，該道菜「選的是365天的廣東清遠雞，是半隻」。店方隨後補充，該道菜還加入魚翅，是主廚精選的上等金鈎翅。影片發布引發熱議。有自稱在清遠的網民表示，「本地一隻清遠雞賣48元（約53港元）。」

內媒周日（24日）就此事致電相關餐廳，工作人員稱，餐廳確有一道名叫廣府雞煲翅的菜式，分小煲和大煲，小煲售價是1,999元（約3,300港元），可供4到6位用；大煲售2,999元（約2,200港元），可供8到10位食用。該工作人員指，該道菜主要的食材除走地雞外，還有9寸的金鈎翅，「佔了整道菜價格的大頭（大部分）」。另翅湯配料也包括龍骨（中藥）、豬腳、鳳爪、豬皮等，要熬製6個小時以上，含豐富膠原蛋白。"
bkn-20250826080014782-0826_00822_001,今日部分時間有陽光　有一兩陣驟雨　最高氣溫32°C,2025-08-26 08:00,2025-08-26 08:00,https://hk.on.cc/cnt/news/20250826/bkn-20250826080014782-0826_00822_001.html,今日部分時間有陽光　有一兩陣驟雨　最高氣溫32°C,香港,oncc,2025-08-26 08:15,"一道高壓脊正覆蓋中國東南部。今日(26日)上午8時，天文台錄得氣溫攝氏29度，相對濕度78%。過去一小時，京士柏錄得的平均紫外線指數是0.6，強度屬於低。

預測今日部分時間有陽光，有一兩陣驟雨。日間炎熱，市區最高氣溫約攝氏32度，新界再高一兩度。吹輕微至和緩偏東風。展望明日(27日)天氣炎熱，亦有幾陣驟雨。隨後一兩日天氣漸轉不穩定，驟雨增多，風勢頗大。

另外，強烈熱帶風暴劍魚已減弱為熱帶風暴。在今日上午8時，劍魚集結在萬象之東北偏東約190公里，預料向西北偏西移動，時速約18公里，移入中南半島內陸並逐漸消散。"
bkn-20250826074139430-0826_00822_001,王文濤會晤南韓總統特使團　歡迎南韓對華貿易順差,2025-08-26 07:41,2025-08-26 07:41,https://hk.on.cc/cnt/news/20250826/bkn-20250826074139430-0826_00822_001.html,王文濤會晤南韓總統特使團　歡迎南韓對華貿易順差,中國,oncc,2025-08-26 07:45,"中國商務部長王文濤周一（25）跟南韓總統李在明日前派出的訪華特使團舉行會晤。王文濤對南韓對華貿易順差表示歡迎。

王文濤當天在中國北京的商務部辦公樓與特使團會面時表示，中國去年對韓貿易逆差達到353億美元，中方對此樂見其成，認為這是兩國貿易結構下的正常現象。王文濤強調，中韓互為重要鄰國及合作夥伴，去年貿易額超過3,820億美元（約3萬億港元），南韓已超越日本成為中國第二大貿易夥伴國。

王文濤還指出，中間品和資本品佔兩國貿易商品的90%以上，體現兩國的緊密合作關係。兩國領導人在通話中就發展雙邊關係達成了重要共識，中國商務部將與韓方一道，切實推動落實兩國領導人的共識。

訪華特使團團長、前國會議長朴炳錫表示，美國發起的貿易戰正在重塑全球經貿格局，在這一關鍵時期，韓中兩國保持合作動能、通過密切溝通謀求共同利益尤為重要。他指出，如果過去的韓中關係呈現縱向型格局，那麽未來將趨於橫向型發展。朴炳錫強調，希望韓中自貿協定第二階段談判能夠盡快達成協議，並打通包括稀土在內的關鍵礦產供應鏈，同時推動建立出口快速通道與綠色通道機制。"
bkn-20250826070932354-0826_00822_001,大埔白石角女子墮海　獲救昏迷送院救治,2025-08-26 07:09,2025-08-26 07:09,https://hk.on.cc/cnt/news/20250826/bkn-20250826070932354-0826_00822_001.html,大埔白石角女子墮海　獲救昏迷送院救治,香港,oncc,2025-08-26 07:45,"大埔有人墮海。今晨(26日)6時51分，白石角海濱長廊近公眾碼頭對開約5至10米海面，有一名女子載浮戴沉，由途人發現報案。救援人員接報趕至現場，將事主救起，惟她已陷入昏迷，由救護車送院救治。事主身份及墮海原因有待調查。

防止自殺求助熱線：

香港撒瑪利亞防止自殺會： 2389 2222

生命熱線： 2382 0000

社會福利署： 2343 2255

撒瑪利亞會熱線(多種語言)： 2896 0000

醫管局精神健康專線： 2466 7350

明愛向晴軒： 18288

東華三院芷若園： 18281

「情緒通」熱線： 18111

賽馬會青少年情緒健康網上支援平台「Open噏」： http://www.openup.hk"
bkn-20250826070731759-0826_00822_001,住宅水龍頭流出黑水　水管爆裂致渾濁已恢復,2025-08-26 07:07,2025-08-26 07:07,https://hk.on.cc/cnt/news/20250826/bkn-20250826070731759-0826_00822_001.html,住宅水龍頭流出黑水　水管爆裂致渾濁已恢復,山東,oncc,2025-08-26 07:30,"山東省煙台棲霞市近日驚傳住宅水龍頭流出黑色自來水，引發食水污染疑慮。當地官方微信號事後通報，事件起因為自來水管爆裂，到周日（24日）已恢復正常供水。

上周六（23日）晚上至周日，多名網友通過社交媒體反映，山東煙台棲霞市桃村鎮自來水出現問題。當地一名居民表示，自來水有臭味，有人早上開車來賣水，住戶購買後提上樓使用。棲霞市桃村鎮一名工作人員周日表示，上周六晚有水管壞了，專業人員正在維修。該名工作人員強調事件不是水污染。

上周六深夜11時許，官方微信號「掌上桃村」發布自來水公司公告稱，因水廠自來水管突然爆裂，造成部分住戶自來水出現渾濁現象。正積極組織隊伍進行搶修。到周日深夜，當地再透過微信發公告，指自來水管經過搶修、清洗，已恢復正常供水，水質明顯改善。鎮政府下一步將督促自來水公司完善相關預案，及時有效處置問題，加強日常管理，確保水質達標。"
bkn-20250826060607272-0826_00822_001,傳拖欠全體教職員工資　大連科技學院稱已解決,2025-08-26 06:06,2025-08-26 06:06,https://hk.on.cc/cnt/news/20250826/bkn-20250826060607272-0826_00822_001.html,傳拖欠全體教職員工資　大連科技學院稱已解決,遼寧,oncc,2025-08-26 06:15,"遼寧省大連科技學院近日爆出欠薪風波，網上流傳該校「全員停發工資，開學面臨停擺」。該校周日（24日）回應稱，7月份的確曾有欠薪情況，但現在已經解決完畢。對於學校欠薪一事，在校生似乎不十分了解。

近日在網上評論區出現疑為「大連科技學院工會委員會」發給教職員的信件，內容指該校各類相關帳戶被法院凍結，導致7月工資未能如期發放，工會承諾為全體員工發放臨時困難補貼和慰問補貼。據了解，該所民辦院校於2002年7月建校，前身為大連交通大學信息工程學院。內媒發現，該校背後的企業大連陽光世紀教育同樣官司纏身。企業工商資訊查詢平台資料顯示，大連科技學院目前共有2條被執行人訊息，被執行總金額超過2.3億元（人民幣，下同，約2.53億港元），歷來被執行人資訊共35條，被執行總金額超過35億元（約38.6億港元）。

大連科技學院本科專業學費為每年2.6萬元至2.8萬元（約2.86萬至3.09萬港元），專科學費為每年1.8萬元（約1.98萬港元）。上月17日，該校官方微信公眾號稱，今年已錄取本科新生2,900多人。此外，該校近期新裝修了宿舍樓，又招聘專任教師、專業帶頭人、輔導員等42人。"
bkn-20250826055600791-0826_00822_001,屯門越南女倒臥蝴蝶灣石灘　送院搶救不治,2025-08-26 05:56,2025-08-26 12:14,https://hk.on.cc/cnt/news/20250826/bkn-20250826055600791-0826_00822_001.html,屯門越南女倒臥蝴蝶灣石灘　送院搶救不治,香港,oncc,2025-08-26 12:30,屯門有人倒臥石灘亡。今晨(26日)5時11分，現場為蝴蝶灣望海觀音廟對開石灘，有途人發現一名女子昏迷倒臥於上址石隙中，遂報案求助。救援人員趕至現場，將事主救起交救護車送往屯門醫院，惟經搶救後證實不治。警員經調查後，證實事主為一名持「行街紙」留港的越南籍(31歲)女子，案件列作「送院時死亡」，事主死因有待驗屍後確定。
bkn-20250826054431052-0826_00822_001,特朗普警告華須向美供應磁鐵　否則面臨200%關稅,2025-08-26 05:44,2025-08-26 11:14,https://hk.on.cc/cnt/news/20250826/bkn-20250826054431052-0826_00822_001.html,特朗普警告華須向美供應磁鐵　否則面臨200%關稅,中國,oncc,2025-08-26 11:30,"美國總統特朗普周一（25日）警告，在美中暫緩加徵關稅期間，中國必須向美國供應磁鐵，否則會向中國徵收200%關稅。他同日另威脅，若各國不撤銷數碼稅法規，將對相關國家出口至美國的商品加徵後續額外關稅。

特朗普在白宮會見南韓總統李在明時指，中國已壟斷全球磁鐵市場，華府認為磁鐵供應問題對美國國家安全至關重要，尤其是航空領域，200%關稅實際上意味美國不會與中國做任何生意。他指中方有一些牌，美國亦有不可思議的牌，但美國不想打那些牌，如打了就會摧毀中國。但他認為，美中經濟關係有所改善，又提到最近曾與中國領導人通話，預計自己可能在今年或之後不久訪華，認為中美將建立良好關係，美國會繼續容許中國留學生到美國。他更稱，李在明或可跟他一起訪華，指共同乘坐一架飛機可節省能源。

特朗普另在社群媒體上發文，指控數碼稅相關立法旨在損害或歧視美國科技企業，並變相庇護中國等競爭對手，特朗普政府早前曾考慮對歐盟官員實施制裁。此前報道指，歐盟計劃對美國科企Google和另一科企Meta經營的社交平台Facebook等徵收數碼服務稅，該議題已成為歐美長期貿易爭端焦點。"
bkn-20250826050537980-0826_00822_001,電影《731》演員控訴劇組欠薪　遭片方除名,2025-08-26 05:05,2025-08-26 05:05,https://hk.on.cc/cnt/news/20250826/bkn-20250826050537980-0826_00822_001.html,電影《731》演員控訴劇組欠薪　遭片方除名,中國,oncc,2025-08-26 05:15,"以侵華日軍「731部隊」在中國展開生物戰、細菌戰及人體實驗為背景的中國電影《731》，早前因上映檔期牽動中日關係而引起關注。出演該電影的演員王尊上周五（22日）在社交平台舉報劇組欠薪。劇組尚未回應。

王尊聲稱於2020年5月與電影《731》簽訂演員聘用合約，合約寫明演員勞務以及結款時間，之後劇組提出延遲付款和延遲拍攝。拍攝過程中，他多次提醒劇組按時付款，但劇組一直以各種理由拖延，他直到現在仍未獲片酬，總計69萬元人民幣（約75萬港元）。他和劇組對簿公堂，片方將其除名，其角色和參演資訊已從購票平台和演職人員名單刪去。

王尊附上自己舉着法院開庭傳票的照片、雙方簽署的演員聘用合約、當時片場的通告，以及他和劇組工作人員合影等作為證據，又稱自己「要交房租、要吃飯」，同時控訴導演趙林山「在劇組抽雪茄、喝茅台、將孩子送到國際學校念書」。"
bkn-20250826040107434-0826_00822_001,網約車開冷氣另收費　消保委稱或違規,2025-08-26 04:01,2025-08-26 04:01,https://hk.on.cc/cnt/news/20250826/bkn-20250826040107434-0826_00822_001.html,網約車開冷氣另收費　消保委稱或違規,江蘇,oncc,2025-08-26 04:15,"江蘇省近日有網約車要求乘客支付3元人民幣（約3.27港元）才可享受車上冷氣，江蘇省消保委上周五（22日）強調，乘客車資應視為已包含冷氣等基礎服務成本。

有關投訴貼文集中在今年7月，部分網約車掛出收費告示，備註「特惠訂單沒有空調，自願消費」。有網民認為可以理解，因為開空調有成本壓力，但更多網民認為大熱天時，開冷氣為乘客基本權利，不應另外收費。有網民願意支付，但作為營運車輛的收費項目，必須提供發票。

江蘇省消保委認為，平台和司機若未提前明確告知並取得乘客同意而擅自加收費用，既違反合約約定，也違反法律關於禁止收取未標明費用的規定。即使車內張貼自願消費告示，若未在乘客下單前明確提示，仍屬單方面變更服務內容，消費者有權拒絕支付。部分平台推出低價活動，未充分考慮司機營運成本問題，不該將經營壓力轉嫁給司機和消費者。"
bkn-20250826035414082-0826_00822_001,元朗兩車遭縱火焚毀　追緝涉案歹徒,2025-08-26 03:54,2025-08-26 03:54,https://hk.on.cc/cnt/news/20250826/bkn-20250826035414082-0826_00822_001.html,元朗兩車遭縱火焚毀　追緝涉案歹徒,香港,oncc,2025-08-26 05:15,"元朗發生縱火燒車案。今日(26日)凌晨3時24分，現場為朗屏路一露天停車場，附近居民報案指有2輛私家車着火焚燒，消防接報到場開喉灌救把火救熄，經調查後認為起原因有可疑。

據稱，事發前有一名男子駕駛私家車駛入該露天停車場，停在涉事車輛旁邊有所動作，未幾該兩車隨即起火焚燒，該名疑人見狀立即駛離現場。警員正翻查現場閉路電視，追緝涉案歹徒。案件列作「縱火」，暫未有人被捕。"
