id,title,date,last_update,url,lead,section,source,scrape_time,news_content
bkn-20260422173034553-0422_00822_001,南丫海難39死裁定「非法被殺」　遺屬提覆核要求重開死因研訊,2026-04-22 17:30,2026-04-22 17:30,https://hk.on.cc/cnt/news/20260422/bkn-20260422173034553-0422_00822_001.html,南丫海難39死裁定「非法被殺」　遺屬提覆核要求重開死因研訊,香港,oncc,2026-04-22 18:00,"2012年10月1日發生的南丫海難，造成39人罹難。死因庭自去年5月起就事件召開死因研訊，並於今年1月，由死因裁判官周慧珠裁定死者屬「非法被殺」，並同時裁定其中一艘肇事船隻「南丫Ⅳ」沒裝水密門屬設計決定，並非造船的船廠疏忽，該船廠亦沒有違規。在事隔約3個月後，其中4名遇難者家屬不服死因庭就有關沒裝水密門不屬疏忽的裁決，今日(22日)入稟高院提出司法覆核，要求推翻死因庭裁決，並要求就針對水密門設計重開死因研訊。

是次司法覆核申請人為死者梁家杰的胞姊梁淑玲及胞妹梁家欣、趙少琼的胞弟趙炳全、徐志偉的父親Tsui Keung。4人並沒有律師代表，並親自撰寫入稟狀。2012年10月1日發生的南丫海難，造成39人罹難，當中包括8名兒童。遇難者的家屬一直堅持要查找事件真相，其中3名死難者家屬於2022年6月，亦曾入稟高院申請司法覆核，要求法庭頒令召開死因研訊。最初高院原訟庭拒絕家屬的申請，其後經上訴，上訴庭於2023年7月裁定家屬上訴得直，死因庭最終於去年5月就事件召開死因研訊。

就該次死因研訊，除了須裁定眾死者的死因外，亦有6項議題需作出裁決，當中包括其中一艘肇事船隻「南丫Ⅳ」，負責造船的財利船廠是否得知要為船隻安裝水密門。死因裁判官周慧珠於裁決時，形容財利船廠董事羅愕瑩屬誠實可靠的證人，相信財利確實不知要裝水密門，不裝水密門並非財利的疏忽或過失。周官另稱，即使專家認為裝水密門會更安全，但船隻是符合標準，故沒有任何法規要求「南丫Ⅳ」要滿足更高規格的安全標準。

案件編號：HCAL 788/2026"
bkn-20260422173013121-0422_00822_001,打擊網上販毒拘9男女　破牛頭角毒品倉檢冰毒依托咪酯,2026-04-22 17:30,2026-04-22 17:30,https://hk.on.cc/cnt/news/20260422/bkn-20260422173013121-0422_00822_001.html,打擊網上販毒拘9男女　破牛頭角毒品倉檢冰毒依托咪酯,香港,oncc,2026-04-22 18:00,"執法部門於前日(20日)至今日(22日)展開代號「力剿」的反毒品行動，打擊透過網上平台進行毒品交易。

警員喬裝成毒品買家，於社交媒體上向毒品賣家購買依托咪酯、大麻、氯胺酮(俗稱K仔)及可卡因等毒品，其後經深入調查及情報分析後，分別於前日及今日在全港多區拘捕6男3女(17至53歲)，涉嫌「販運危險藥物」及「藏有危險藥物」。

 

行動中，警員搗破一個位於牛頭角的毒品儲存單位，並在該單位內檢獲懷疑依托咪酯煙彈及冰毒，毒品總市值約1萬港元。

 

其中一名被捕人士已被落案起訴一項「販運危險藥物」罪。其餘被捕人已獲准保釋候查，須於5月上旬報到。

 

執法部門重申，販賣、供應或使用毒品屬刑事罪行，根據《危險藥物條例》，販運及非法製造有關毒品，最高可被判終身監禁及罰款500萬港元。"
bkn-20260422172751750-0422_00822_001,西隧等部分路段擬今年重鋪　政府將定期檢查隧道設施,2026-04-22 17:27,2026-04-22 17:27,https://hk.on.cc/cnt/news/20260422/bkn-20260422172751750-0422_00822_001.html,西隧等部分路段擬今年重鋪　政府將定期檢查隧道設施,香港,oncc,2026-04-22 18:00,"香港在1970至1980年代相繼落成及啟用多條行車隧道，有議員關注，政府有否計劃重鋪現有行車隧道路面或更換其他設備。運輸及物流局局長陳美寶今日(22日)表示，路政署已計劃今年繼續在西區海底隧道、東區海底隧道、獅子山隧道及機場隧道的合適路段，展開路面重鋪工程。至於隧道內的其他設施，包括隧道牆身及混凝土縱向護欄，路政署會根據定期進行的檢查結果及專業人員的建議，適時安排所需的維修工作。

陳美寶書面回覆議員質詢時指，路政署會視乎隧道連接路段的車流量及車速限制，每天或每星期進行一次例行巡查，以及每半年進行一次詳細巡查；亦會每兩年為隧道進行一次綜合檢查，落成時間較早的行車隧道，包括海底隧道、香港仔隧道、啟德隧道和獅子山隧道，會加密至每半年至一年進行一次。綜合檢查主要透過近距離觀察，對隧道內的結構及附屬構件的狀況進行全面的檢查。

對於有關注指部分行車隧道的路面經修補後，短時間內再出現路面損耗。陳美寶表示，路政署於去年4月1日起，已全面推行於合適位置採用另一種物料作鋪路之用，有關物料在抗變形、抗老化及抗疲勞方面的表現，均優於傳統瀝青。"
bkn-20260422172533088-0422_00822_001,268萬人已領樂悠咭　電子化仍無期,2026-04-22 17:25,2026-04-22 17:25,https://hk.on.cc/cnt/news/20260422/bkn-20260422172533088-0422_00822_001.html,268萬人已領樂悠咭　電子化仍無期,香港,oncc,2026-04-22 18:00,"政府推行2元優惠計劃實名制超過一年半，目前長者及殘疾人士必須持「樂悠咭」方可享用優惠。今日(22日)有議員關注，現今社會數碼支付普及，但樂悠咭仍未推出電子版本，令習慣使用手機八達通的長者大感不便。政府回覆指正研究開發手機樂悠咭的可行性，但強調必須滿足多方面要求，包括要具備可靠且有效的防偽及身份識別功能等。

勞工及福利局局長表示，截至今年2月底，樂悠咭申請共有約268萬宗，當中60至64歲申請人佔129萬，65歲或以上則佔139萬。根據統計處預測，由今年起至2030年，符合申請資格的新增居民分別有10.9萬、11.1萬、11.7萬、11.1萬及12萬人，合共56.8萬人將踏入「2元優惠門檻」

議員林琳指，學生八達通早已具備手機版本，認為樂悠咭電子化的技術已具基礎。目前不少長者需將手機八達通內的服務被迫轉移至實體樂悠咭，與政府推動數碼便利的方向相反。不過，政府指並不掌握香港居民使用手機八達通的數字，或樂悠咭持有人在申請前曾長期使用手機八達通的數字。

對於電子化方案，政府回覆指正研究開發手機樂悠咭的可行性，但強調必須滿足多方面要求。首要考慮是具備可靠且有效的防偽及身份識別功能，確保執法人員與交通營辦商前線職員能快捷核實身份，防止優惠被濫用。政府將持續與各相關機構溝通，研究相關技術規格及系統配套，務求在提升便利度與防止濫用之間取得適當平衡。"
bkn-20260422171434359-0422_00822_001,過去3年接83宗工廈寵物火化投訴　有8個案違例被「釘契」,2026-04-22 17:14,2026-04-22 17:14,https://hk.on.cc/cnt/news/20260422/bkn-20260422171434359-0422_00822_001.html,過去3年接83宗工廈寵物火化投訴　有8個案違例被「釘契」,香港,oncc,2026-04-22 17:30,"近年本港飼養寵物的人數持續增加，令動物善終服務的需求日漸上升。議員陳恒鑌在立法會向當局提書面質詢，指一些動物善終服務營辦商(服務營辦商)在工業大廈內進行寵物火化服務，導致違反地契條款、空氣污染及衞生滋擾等問題。當局回覆指，過去3年涉及相關投訴逾80宗，當中以違反地契佔最多，也有8宗個案最終被「釘契」。

當局綜合回覆指，現時各政府部門會根據法例或地契條款規管寵物火化營運處所。如收到這些處所涉及衞生滋擾、環境污染、火警危險或違反地契條款的投訴時，食環署、環保署、消防處或地政總署會進行巡查，並按需要採取執法或執管行動，政府沒有計劃另行制定專門法例或牌照制度。

根據《空氣污染管制條例》(第311章)已就焚化爐、火爐或烘爐運作時所產生的空氣污染物排放實施管制。《條例》規定，操作裝置能力超過每小時0.5公噸的焚化爐屬「指明工序」，焚化爐的擁有人必須事先向環保署申領並獲取「指明工序」牌照。其擁有人必須在安裝相關火爐、烘爐、煙囱或煙道前不少於28天，向環保署呈交有關圖則及規格，並須在獲得該署批准圖則及規格後，方可安裝和操作有關設備。

　　 

過去3年，食環署、環保署、消防處及地政總署合共接獲83宗有關寵物火化服務的投訴，當中以地政總署接到的投訴最多，佔46宗，主要涉及違反地契條款，該署稱，巡查後，在2023和2024年分別有5宗和4宗個案證實違契，署方於年內發出警告信。另外，2023年和2024年分別有5宗和3宗個案涉及把警告信送交土地註冊處註冊(俗稱「釘契」)。"
bkn-20260422170524842-0422_00822_001,廣東今晚迎暴雨及強對流天氣　或下冰雹,2026-04-22 17:05,2026-04-22 17:05,https://hk.on.cc/cnt/news/20260422/bkn-20260422170524842-0422_00822_001.html,廣東今晚迎暴雨及強對流天氣　或下冰雹,廣東,oncc,2026-04-22 17:15,"中央氣象台周三（22日）早上發布暴雨藍色預警，預計至周四（23日）江南、華南等地仍有較強降雨。其中，廣東周三至周五（24日）強對流和強降水天氣趨於明顯，周三晚至周四有一次大雨到暴雨、局部大暴雨的降水過程，並伴有8級、局部10級的雷雨大風、短時強降水、冰雹等強對流天氣。

據預測，周三早上8時至周四早上8時，雲南西北部、廣西西部和東北部、廣東北部、湖南南部、江西中南部和東北部、浙江南部、福建西部和北部等地部分地區有大到暴雨，其中湖南南部、廣東北部等地局地有100至130毫米大暴雨。上述部分地區伴有短時強降水，局地可超過50毫米，或有雷暴大風或冰雹等強對流天氣。

在弱冷空氣和降水共同影響，廣東各地周四至周五最高氣溫下降到24至28℃之間，體感清涼。至於周三晚至周四，南部市縣最高氣溫介乎25至28℃，其餘市縣則只有22至25℃。"
bkn-20260422170259842-0422_00822_001,空降旅遊界議席江旻憓已完成放棄加拿大護照手續,2026-04-22 17:02,2026-04-22 17:02,https://hk.on.cc/cnt/news/20260422/bkn-20260422170259842-0422_00822_001.html,"空降旅遊界議席　江旻憓已完成放棄加拿大護照手續


「空降」旅遊界議員席位的奧運劍擊金牌得主江旻憓，去年11月宣布參選時，承諾申請放棄加拿大護照。有傳媒指江旻憓議員辦事處今天（22日）接受傳媒查詢時確認，江已完成放棄加拿大護照。<br/><br/>去年立法會換屆選舉提名期間，政界盛傳江會報名參選新界北直選，惟",香港,oncc,2026-04-22 18:15,"「空降」旅遊界議員席位的奧運劍擊金牌得主江旻憓，去年11月宣布參選時，承諾申請放棄加拿大護照。有傳媒指江旻憓議員辦事處今天（22日）接受傳媒查詢時確認，江已完成放棄加拿大護照。

去年立法會換屆選舉提名期間，政界盛傳江會報名參選新界北直選，惟因持有加拿大護照最後告吹。江旻憓小時候隨家人移居加拿大，持有外國居留權，故不符合參戰地區直選的資格，短期內亦難以放棄外國居留權。

不過，立法會有12個功能界別容許擁外國居留權參戰，其中一個是旅遊界。任職馬會的她當時稱曾參與「賽馬旅遊生態圈」項目，以證與旅遊界的密切聯繫，獲選舉主任信納並容許她參選。江旻憓報名參選當天，被傳媒問到持有加拿大護照一事，她當時正在正在申請放棄，但未透露更多細節。"
bkn-20260422165011159-0422_00822_001,冷鋒料明日殺到　驟雨漸增有狂風雷暴　周五市區最低20°C,2026-04-22 16:50,2026-04-22 16:50,https://hk.on.cc/cnt/news/20260422/bkn-20260422165011159-0422_00822_001.html,冷鋒料明日殺到　驟雨漸增有狂風雷暴　周五市區最低20°C,香港,oncc,2026-04-22 17:15,"現時位於廣東內陸的一道冷鋒會，預料會在明日(23日)日間橫過沿岸地區，天文台今日(22日)表示，屆時該區驟雨會逐漸增多及有幾陣狂風雷暴。受隨後的東北季候風影響，明日本港氣溫將會逐步下降至午夜約攝氏23度。

另外，受高空擾動影響，本周五(24日)香港雨勢較大，市區最低氣溫約攝氏20度，新界再低一兩度。未來一兩日天氣轉為不穩定，以及氣溫明顯下降，大家記得留意最新天氣。"
bkn-20260422164827231-0422_00822_001,同步推居屋綠置居白居二　4.30接受申請,2026-04-22 16:48,2026-04-22 16:48,https://hk.on.cc/cnt/news/20260422/bkn-20260422164827231-0422_00822_001.html,同步推居屋綠置居白居二　4.30接受申請,香港,oncc,2026-04-22 17:15,"香港房屋委員會今日(22日)宣布，「出售居者有其屋計劃(居屋)單位2025」、「出售綠表置居計劃(綠置居)單位2025」及「白表居屋第二市場計劃(白居二)2025」3項計劃，將由本月30日上午8時至下月20日晚上7時同步接受合資格人士申請，為期3個星期。房委會表示，為精簡申請安排以便利申請者，3項計劃將同步推出。合資格申請者可經網上遞交申請、親身遞交申請或郵寄紙本申請。

為決定「居屋2025」與「綠置居2025」的選樓優先次序，及「白居二2025」的配額分配，3項計劃將於今年第2季同日分別進行攪珠。「居屋2025」與「綠置居2025」預計分別於今年第4季及今年第3/4季開始選樓；而白居二則預計於今年第4季向成功申請者發出批准信，以申請「購買資格證明書」。

「居屋2025」推售五個分別位於啟德、錦田、將軍澳、屏山及東涌的新居屋發展項目，提供接近7,000個單位。單位實用面積介乎約281平方呎至約560平方呎。「居屋2025」折扣率定於評定市值折減30%，5個新居屋發展項目單位的售價介乎約150萬港元至約480萬港元。

綠置居推售位於九龍灣的新綠置居發展項目盛緻苑，提供超過800個新單位，單位實用面積介乎280平方呎至約469平方呎。此外，「綠置居2025」亦會推售新一批租者置其屋計劃回收單位。綠置居折扣率定於評定市值折減40%，售價介乎約168萬港元至約354萬港元。39個租置計劃屋邨中所有未售單位的定價介乎約16萬港元至137萬港元，折扣率為評定市值折減79%至83%。

房委會表示，未來五年整體公營房屋供應預期穩步上升，居屋供應大幅增加，下一個5年期(2026/27至2030/31年度)的居屋供應量預計高達59,000個單位。"
bkn-20260422164607347-0422_00822_001,宏新高層住戶料單位物品燒毀　仍希望「睇下仲有啲咩」,2026-04-22 16:46,2026-04-22 16:46,https://hk.on.cc/cnt/news/20260422/bkn-20260422164607347-0422_00822_001.html,宏新高層住戶料單位物品燒毀　仍希望「睇下仲有啲咩」,香港,oncc,2026-04-22 17:15,"不少居民在上樓之前都透過社工傳來的相片，大概知道單位情況，其中宏新閣24樓住戶林女士上樓前表示，本來已經知道其單位深陷火海，起火後翌日(2025年11月27日)正午12時多單位仍見着火，而及後收到社工傳來的相片亦可見單位被燒個精光，故此被問到會否擔心財物遭盜取時，她無奈道不擔心，因為單位物品相信已盡數燒毀，「應該係乜都冇」。但林仍希望可以取回一些由投身職場以來收藏至今的物品，又表示自己心情現已平復，因此還是決定上樓，「純粹睇吓仲有啲咩」。

另一居民麥先生表示，由於母親已年逾70，因此由他登上25樓單位。而透過社工傳來的相片，可見單位雖已熏黑，但屋內物品看似未被燒毀並且尚在原位，因此他相信能將不少物品帶走，而他最希望帶走寵物貓的骨灰。至於會否擔心上樓體力不支，他則表示「辛苦都要上」，又指問過同層已上樓的街坊，獲告知「唔算辛苦」。

至於住戶吳小姐則與年屆七旬的父親一同上樓，她表示，雖然雙親年邁，但由於對住家充滿感情，因此都希望親自上樓，又指其父親曾試用外骨骼裝置，惟後來借用裝置的相關計劃取消，對此吳只能表示「冇辦法」。而由於單位位處近30樓的高層，為此她亦事前行樓梯鍛煉。至於上樓前由於沒有收到社工傳來的相片，因此對單位情況一無所知，到單位後則會盡量搜索些貴重物品，包括金器和現金，亦希望能帶走昔日的信件和手工產品，同時亦會與其母親視頻通話，讓對方了解單位現況。"
bkn-20260422164528454-0422_00822_001,控煙修訂條例年初實施　今年首季發2198張罰款通知書　按年跌30%,2026-04-22 16:45,2026-04-22 16:45,https://hk.on.cc/cnt/news/20260422/bkn-20260422164528454-0422_00822_001.html,控煙修訂條例年初實施　今年首季發2198張罰款通知書　按年跌30%,香港,oncc,2026-04-22 17:15,"《2025年控煙法例(修訂)條例》今年1月1日起生效。有議員關注新措施推出後，當局打擊違例吸煙的執法情況。政府表示，今年首季控煙酒辦就有關吸煙的罪行共進行近1.2萬次巡查，按年急增52%；期內就違例吸煙行為發出2,198張定額罰款通知書及15張傳票，按年分別減少30%及增加26%。政府認為，巡查數字上升而發出的通知書數量下跌，反映控煙酒辦鼓勵市民自願守法，亦維持執法力度。

衛生官員今日(22日)書面回覆議員提問時指，控煙新措施今年1月1日生效後，定額罰款金額提高至每張3,000港元；禁煙區範圍擴大至指定處所的出入口3米範圍，包括幼兒中心、院舍、學校、醫院等，全港因而新增逾3,000個禁煙地點；以及在排隊時禁止吸煙的規定生效，包括禁止在指定登上交通工具地點輪候公共交通工具時吸煙等，全港新增至少2,000個指定地方。

政府數據顯示，去年首季控煙酒辦就有關吸煙的罪行共進行7,687次巡查，並就違例吸煙發出3,161張定額罰款通知書及11張傳票；而今年首季，即新措施推出後，控煙酒辦就有關吸煙的罪行共進行11,699次巡查，並就違例吸煙行為發出2,198張通知書及15張傳票。衛生官員認為，巡查數字上升而發出的通知書數量下跌，反映控煙酒辦加強巡查，既為推廣及教育公眾認識新的控煙措施，亦維持執法力度。他提到，期內發出的傳票數字較去年同期增加，顯示政府在新措施實施後，對個別不合作的違規人士仍會果斷檢控。

此外，過去3年，即2023年至2025年間，控煙辦就有關吸煙的罪行發出通知書分別有10,261、13,488及10,357張，而傳票則分別有48、64及37張。提到去年發出的通知書及傳票數目按年分別大減23%及42%，衛生官員指出，修訂條例去年9月通過後，控煙酒辦在市面加強巡查以推廣新的控煙措施，特別是今年1月1日起生效的新增吸煙罪行，有關巡查重點在於教育與鼓勵守法，而非為了採取嚴厲的執法行動，故發出通知書和傳票的數目因而下跌。官員補充，隨着公眾對新措施逐漸熟悉，執法行動將適時調整。"
bkn-20260422163841118-0422_00822_001,屯門超市廚房爐頭過熱起火　廚師撲救燒傷面,2026-04-22 16:38,2026-04-22 17:22,https://hk.on.cc/cnt/news/20260422/bkn-20260422163841118-0422_00822_001.html,屯門超市廚房爐頭過熱起火　廚師撲救燒傷面,香港,oncc,2026-04-22 17:30,今晨(22日)8時56分，一名姓鍾(45歲)廚師在屯門巿廣場內一間超巿的廚房煮食時，懷疑爐頭過熱着火，他在撲救時燒傷面部，由同事協助報案。事主其後由救護車送往屯門醫院治理。執法部門經調查後，將案件列作「工業意外」跟進，事件中毋須疏散。
bkn-20260422163129441-0422_00822_001,全港戲院日周六舉行　有院線一度現人龍　網上購票逾4000人排隊,2026-04-22 16:31,2026-04-22 16:31,https://hk.on.cc/cnt/news/20260422/bkn-20260422163129441-0422_00822_001.html,全港戲院日周六舉行　有院線一度現人龍　網上購票逾4000人排隊,香港,oncc,2026-04-22 17:15,"今年「全港戲院日」將於本周六(25日)舉行，優惠戲票則於今日(22日)正午12時起公開發售，所有電影票價劃一30港元。由今日正午12時起，優惠戲票陸續於各戲院票房及網上售票，東網記者下午到其中一間戲院所見，現場未見排隊人龍，惟開賣初期各院線均有人排隊，網上購票系統亦「大塞車」，有網站顯示一度有超過4,000人在排隊。

香港戲院商會早前宣布，「全港戲院日2026」訂於本周六舉行， 一如既往，當日全港共52間商業戲院參與，所有場次不論任何放映格式及影院類型，票價劃一30港元。至於優惠戲票於今日中午起公開發售，戲迷可在各大戲院票房，以及網上售票系統購票；如經戲院購票，每人限購4張，以各院線購票限制為準。

東網記者下午到旺角一間戲院了解，只見有市民在駐足觀看電影海報，排隊買票的人不算多。然而，中午開售後不久，各大戲院均現長長的排隊人龍，有院線的網頁亦顯示前面有超過4,000人排隊，而記者測試其中一院線的系統，亦要等候逾20分鐘。現場可見，一些特色影院例如IMAX或貴賓院等，門票較快售罄。"
bkn-20260422162726544-0422_00822_001,薄扶林道住宅失竊　疑前菲傭盜走29萬元首飾,2026-04-22 16:27,2026-04-22 16:27,https://hk.on.cc/cnt/news/20260422/bkn-20260422162726544-0422_00822_001.html,薄扶林道住宅失竊　疑前菲傭盜走29萬元首飾,香港,oncc,2026-04-22 17:15,香港仔發生盜竊案。今日（22日）早上10時54分，執法部門接獲一名男子報案，指其姓姚(51歲)妻子放在薄扶林道180號薄扶林花園的住所內、總值約29萬港元的首飾不翼而飛，懷疑被人盜去。警員接報到場，經初步調查後，懷疑事件是該單位的42歲菲律賓籍前女傭所為，正設法緝拿她歸案。
