id,title,date,last_update,url,lead,section,source,scrape_time,news_content
bkn-20260422161949603-0422_00822_001,宏福苑火災消防接373求助　霍振明指滅火困難檢視後發現消防系統失效,2026-04-22 16:19,2026-04-22 16:45,https://hk.on.cc/cnt/news/20260422/bkn-20260422161949603-0422_00822_001.html,宏福苑火災消防接373求助　霍振明指滅火困難檢視後發現消防系統失效,香港,oncc,2026-04-22 17:15,"就大埔宏福苑火災成立的獨立委員會今日(22日)舉行第17場聽證會。消防處副消防總長(機構策略)霍振明作供，講述大火當日成立「處長指揮室」(DCP)的經過及資源調配情況。他透露，DCP制度自2017年後首次啟動，當日共動用8架鋼梯及14隊搜救隊，印象中從未試過如此規模。對於消防處何時發現宏福苑消防系統關閉，他稱一開始不知道宏福苑有消防裝置失效，惟收到訊息指前線滅火救援有困難，處方檢視電腦系統，才發現宏福苑消防系統失效。

霍振明1998年加入消防處，2024年起任副消防總長。他指，大火當日下午3時20分，消防處處長指示成立DCP，由他指揮，是當日最高指揮中心，負責協助處長監察現場及調配資源，並可向前線增援。他表示，DCP制度一直存在，上次檢討是2017年，今次是2017年後首次啟動。他形容「呢個係一個唔尋常嘅火警」，又指一般三級火警不會啟動，只有在大型火警或引起公眾關注的火警，按處長指示才會啟動。DCP一般由低兩級的高級消防區長處理，但今次情況特別，由他直接指揮。

被問及消防處何時發現宏福苑消防系統關閉，霍振明稱，起初不知道有消防裝置失效，收到訊息指前線滅火救援有困難，處方檢視電腦系統後，才發現宏福苑消防系統失效。

霍振明詳細交代資源調配情況。他指，消防通訊中心初時已額外派出兩隊搜救隊，連同標準配置，合共4隊；其後DCP再派出額外10隊，即共有14隊搜救隊。他解釋，一隊搜救隊包括一輛小型消防車及一輛泵車，共12人，扣除兩名司機，約10人可組成5隊兩人一隊的呼吸器隊。

對於有意見質疑應多派鋼梯直接向高位射水，霍振明表示，一般三級火警都會調派鋼梯，當日消防共動用8架鋼梯，在他印象中從未試過，亦未有試過在火警早期派出10隊搜救隊到場。他強調，起火初段已較一般情況多派很多消防車，當時已知消防系統關閉維修，已額外增援，並因應樓宇大維修預案再加派車輛。

霍振明指，當日消防共收到373宗求助紀錄，其中33宗由DCP接收。他續指，求助渠道包括前線單位的電話和無線電通訊、緊急事故及支援中心、999或消防求助熱線、現場流動指揮車，以及傳真求助。他解釋，警方傳真是其中一個溝通方法，因消防只有30條線，若收不到警方轉駁電話，傳真是另一途徑，但消防亦可與警方電話或電郵聯繫。

霍振明透露，現場無線電溝通非常頻密，火災初期因通訊過度密集而「jam線」，要靠電話或親身傳遞資料，但後期情況改善。他解釋收集求助的流程，稱DCP可透過無線電、消防內部即時通訊系統接收訊息，消防通訊中心收到的求助個案，可用Excel方式匯出，再經政府網絡傳送至現場指揮中心核對，而他當日則直接用電話與現場指揮溝通。

霍振明解釋消防處如何區分投訴與查詢。他指出，前線人員接獲公眾來電或電郵後，會先界定屬於投訴還是查詢，又需判斷是否屬消防處職權範圍。若不屬，便轉介相關部門；若屬且涉及懷疑違反《消防條例》，則以投訴形式處理，並須巡查、取證及跟進；否則歸類為一般查詢，交由相關部門處理。

霍振明負責的總區設有投訴組，他稱轄下每個工作單位均有機會收到公眾投訴或查詢，前線人員需判斷屬哪一類別。他亦指出，工地吸煙問題的基本做法是轉介勞工處，但如果消防人員給予意見或跟進，他亦不覺得有問題。

他提到，政府1823熱線於2024年推出新機制，當出現權責不清、沒有部門可即時主動處理的個案時，會由當區民政事務專員負責處理。倘若民政專員發現問題亦無法解決，便會交由政務司副司長作出最終決策。他續指，如果消防處收到1823的轉介，而個案涉及跨部門，消防處亦會進行檢視，有需要時會派員巡查。"
bkn-20260422161659823-0422_00822_001,6年「穿櫃桶底」近6350萬作家庭支出建材公司女會計經理重囚8年,2026-04-22 16:16,2026-04-22 16:16,https://hk.on.cc/cnt/news/20260422/bkn-20260422161659823-0422_00822_001.html,"6年「穿櫃桶底」近6350萬作家庭支出　建材公司女會計經理重囚8年


建築材料公司時任女會計經理，涉於6年間利用職務之便虧空公款近6,350萬港元，今日(22日)於高院承認7項盜竊罪。高院暫委法官李頌然指，女被告嚴重違反僱主信任，有計劃地長期濫用職權，盜取公司資產用作支付一家人的醫藥費、子女留學費用、旅行及租樓費用等。李官指考慮到涉案金額龐大，被告承",香港,oncc,2026-04-22 17:15,"建築材料公司時任女會計經理，涉於6年間利用職務之便虧空公款近6,350萬港元，今日(22日)於高院承認7項盜竊罪。高院暫委法官李頌然指，女被告嚴重違反僱主信任，有計劃地長期濫用職權，盜取公司資產用作支付一家人的醫藥費、子女留學費用、旅行及租樓費用等。李官指考慮到涉案金額龐大，被告承諾還錢但未能履行，最終僅接納其認罪可獲三分之一的刑期扣減，就7罪共判囚8年。

現年46歲與前夫育有一對已成年子女的女被告李翠英，承認7項盜竊罪，指她於2017年8月至2023年12月，偷取利泰建築材料有限公司的款項，合共6,348萬多港元。辯方求情指，被告還押期間有抑鬱和焦慮問題，她正申請破產，無能力償還涉款。法官則指，被告於案發時負責公司的會計事務，亦可使用公司的銀行戶口，屬違反誠信，並且有預謀犯案，期間亦曾使用虛假的收據。法官指被告為個人利益犯案，在6年間偷取逾6,300萬港元，她曾向公司承諾還款，最終亦未有兌現。考慮到各種情況後，法官最終就7罪共判處被告監禁8年。

案情指，被告於2016手8月受聘於涉案公司，任職會計經理。若該公司透過網上理財，向銀行發出指示進行轉帳時，需要使用兩個保安編碼器，被告獲發其中一個編碼器，她同時擅取另一部門的編碼器，從而發出轉帳指示。被告於2017年至2023年間，利用該些編碼器共偷取近6,350萬港元，並利用虛假收據，訛稱向內地客戶支付款項，實際上把款項轉帳至她友人的戶口。她亦曾把部分偷取的款項，直接支付在大坑租住物業的租金，或用於支付家人的旅遊開支、子女留學和醫療費用等。

2023年12月6日，公司其中一名董事發現沒有足夠資金支付貨款，着被告取消存放在銀行的定期存款。被告回應指處理需時，惟其後失去聯絡。同月8日，被告向董事傳送語音訊息，指她身處一個無法引渡返港的地方，並承認偷取公司1,500萬港元至2,000萬港元。她曾承諾先還部分款項，董事同意讓她繼續工作，惟被告最終未能還款，事件最終報案。

案件編號：HCCC 336/2025"
bkn-20260422161041210-0422_00822_001,呂武欽任公安部部長助理　曾掌食品藥品犯罪偵查局,2026-04-22 16:10,2026-04-22 16:10,https://hk.on.cc/cnt/news/20260422/bkn-20260422161041210-0422_00822_001.html,呂武欽任公安部部長助理　曾掌食品藥品犯罪偵查局,中國,oncc,2026-04-22 16:15,"據人社部官網周二（21日）消息，國務院任免國家工作人員，呂武欽新任公安部部長助理，接替今年初到齡退休的劉忠義。公安部官網顯示，公安部現有兩名部長助理，另一人為公安部網安局局長譚權。

呂武欽於1967年出生，有大學學歷。2019年，公安部新組建了內設機構食品藥品犯罪偵查局，統一承擔打擊食品、藥品和知識產權、生態環境、森林草原、生物安全等領域犯罪職責，由呂武欽出任首任局長。他其後接替到齡退休的公安部新聞宣傳局前局長戰俊，去年底轉任海關總署緝私局黨組書記、局長，目前仍分管海關緝私工作。

國務院另免去周亮的國家金融監督管理總局副局長職務。中央紀委國家監委上月通報，周亮涉嫌嚴重違紀違法，接受紀律審查和監察調查。"
bkn-20260422160108993-0422_00822_001,港府抽查日本進口水產輻射水平暫無發現超標,2026-04-22 16:01,2026-04-22 16:01,https://hk.on.cc/cnt/news/20260422/bkn-20260422160108993-0422_00822_001.html,"港府抽查日本進口水產　輻射水平暫無發現超標


日本當局自2023年8月24日起將福島核污水排放入大海，港府即日禁止當地10都縣海產進口，並每日檢測其餘地區的水產。食物環境衞生署轄下食物安全中心表示，由昨日(21日)中午截至今日(22日)中午，食安中心已對211個進口日本「水產及其製品、海藻及海鹽」的食物樣本作輻射水平檢測，未有",香港,oncc,2026-04-22 17:15,"日本當局自2023年8月24日起將福島核污水排放入大海，港府即日禁止當地10都縣海產進口，並每日檢測其餘地區的水產。食物環境衞生署轄下食物安全中心表示，由昨日(21日)中午截至今日(22日)中午，食安中心已對211個進口日本「水產及其製品、海藻及海鹽」的食物樣本作輻射水平檢測，未有發現輻射水平超出安全標準。

同時，漁農自然護理署已對50個本地魚產品樣本作輻射水平檢測，全部樣本的檢測同樣合格。香港天文台亦已加強監測本港水域的環境輻射水平，至目前為止，並沒有發現異常情況。

由2023年8月24日起至今日中午，食安中心及漁護署分別檢測了共221,864個日本進口食物樣本及共48,234個本地魚產品樣本作輻射水平檢測，全部樣本檢測合格。"
bkn-20260422153012496-0422_00822_001,出差遭老闆性侵　女高層向公司索償250萬人民幣,2026-04-22 15:30,2026-04-22 15:30,https://hk.on.cc/cnt/news/20260422/bkn-20260422153012496-0422_00822_001.html,出差遭老闆性侵　女高層向公司索償250萬人民幣,天津,oncc,2026-04-22 15:45,"天津市一間汽車核心零部件製造商的女高層崔麗麗2023年出差期間，參加宴會後醉酒，遭公司老闆性侵。後來崔麗麗患創傷後應激障礙獲認定工傷，但被公司開除，她於是向公司提告索償。該案周四（23日）將再次開庭，她透露共求償250多萬元人民幣（約289萬港元）。

崔麗麗周二（21日）在微博發文稱，其精神工傷待遇案將在天津市津南區人民法院八里台人民法庭開庭。庭上將審理其精神工傷待遇的賠償標準，包括停工留薪期工資、工傷醫療費、一次性傷殘待遇、加班費、未休年假工資等。法庭亦將審理職工遭受工傷後企業應當承擔甚麼責任，以及企業在她停工留薪期強制開除，是否構成違法解除等共計13項訴請。

作為全國首例職場性侵獲精神工傷認定的當事人，崔麗麗知道這一路走來不僅為自己而戰，更是為所有遭遇不公的勞動者，為所有在黑暗中苦苦掙扎的受害者，爭取一份應有的法律保障和尊嚴。據早前報道，崔麗麗公司的實控人兼總經理王豪因強姦罪名成立，2024年4月被判處有期徒刑4年。"
bkn-20260422152426616-0422_00822_001,疑藍田超市偷海鮮斷正　光頭漢遭拍攝大怒爆粗　疑曾亮刀反抗,2026-04-22 15:24,2026-04-22 20:56,https://hk.on.cc/cnt/news/20260422/bkn-20260422152426616-0422_00822_001.html,疑藍田超市偷海鮮斷正　光頭漢遭拍攝大怒爆粗　疑曾亮刀反抗,香港,oncc,2026-04-22 21:00,"今日(22日)中午12時28分，執法部門接獲藍田啟田商場一超市的職員報案，指一名男子企圖在未付款的情況下取走3箱總值約750港元的海鮮。警員到場了解後，以涉嫌「店舖盜竊」拘捕一名姓何（52歲）男子，將他帶走扣查。

有市民拍攝現場情況，將影片上傳到社交平台。影片所見，一名光頭男子坐在地面，身旁有一名警員。拍片者邊拍邊詢問：「頭先睇住佢偷嘢吖嘛，係咪呀？」光頭漢聞言大怒，立即爆粗大罵：「關你X事咩！......你唔好X影我呀，影我乜X嘢呀！」然後激動站起身，作勢衝向拍片者，惟被警員及超市職員制止。

消息指，疑犯事敗後曾經激烈反抗，並且一度掏出一把摺刀，但是亮出刀鋒前已被超市職員奪走。有市民見情況危險，於是跑出超市向附近警員求助，終於成功制服疑犯。

網民見到疑犯惡形惡相，留言指事件大快人心：「影得佢越嬲 我就越開心」、「唔想人影咪唔好做賊囉」、「你唔偷嘢咪唔影你囉」、「咁惡咁好中氣。就唔好做賊啦。」"
bkn-20260422152032132-0422_00822_001,水務署技工認啟鑽苑縱火5.6判刑　官直斥案件嚴重可囚終身,2026-04-22 15:20,2026-04-22 15:20,https://hk.on.cc/cnt/news/20260422/bkn-20260422152032132-0422_00822_001.html,水務署技工認啟鑽苑縱火5.6判刑　官直斥案件嚴重可囚終身,香港,oncc,2026-04-22 15:30,"居於黃大仙啟鑽苑的水務署技工，於前年年中懷疑因多次向物管投訴垃圾處理不當問題不果，先後在大廈的4層垃圾房以打火機燃燒紙張以表不滿，幸好居民及時發現，消防到場將火種撲熄。該技工被控4項縱火罪，今日(22日)於區院承認全部控罪。法官練錦鴻直斥案件嚴重，可判囚終身，並直言一旦火勢蔓延「後果將不堪設想」，慶幸本案的火勢沒有蔓延。練官指必須判處阻嚇性刑罰，但先提取被告的背景、精神及心理醫生報告，被告須還押至5月6日判刑。

被告陳家俊(27歲，報稱水務署機械技工)，被控4項縱火罪，指他於2024年8月4日在香港黃大仙啟鑽苑啟慈閣，無合法辯解而用火損壞20樓垃圾房，意圖損壞該財產或罔顧該財產是否會被損壞；另於同月11日分別3度無合法辯解而用火損壞19樓、18樓及11樓垃圾房，意圖損壞該財產或罔顧該財產是否會被損壞。辯方求情指，被告在案發前與家人搬入涉案屋苑，發現垃圾房衞生環境惡劣，曾多次投訴不獲受理，因情緒用事才犯案。辯方又指被告現已失去公務員工作，被告願意賠償3萬港元維修費，而本案亦不涉及恐嚇、報復或社會事件，望法庭輕判。

案情指，被告居於涉案大廈21樓，案發當日下午4時許，20樓的住客嗅到燒焦氣味，及後發現該層的垃圾房有垃圾在燃燒，報案後消防到場撲熄火種。同月11日上午，該大廈的保安檢查樓層時發現11樓、18樓和19樓的垃圾房起火遂報案，消防到場後撲熄火種。垃圾房的瓷磚和牆壁都被熏黑，而4層垃圾房的維修費用需3萬港元。警員翻查閉路電視後於同年12月拘捕被告，他在警誡下稱，因為管理處不肯處理投訴，遂到涉案樓層的垃圾房燃燒紙張，以表達對管理處不作為的不滿，引起注意，迫使對方處理問題。

案件編號：DCCC 1512/2024"
bkn-20260422150551345-0422_00822_001,人口老化家庭縮細　拖累住戶入息增幅,2026-04-22 15:05,2026-04-22 15:05,https://hk.on.cc/cnt/news/20260422/bkn-20260422150551345-0422_00822_001.html,人口老化家庭縮細　拖累住戶入息增幅,香港,oncc,2026-04-22 15:30,"香港就業與貧窮狀況備受關注，今日(22日)有議員質疑本港最近10年(2016至2025年)的家庭入息中位數增幅僅20%，較前10年的45%大幅萎縮。勞工及福利局局長孫玉菡書面回覆時表示，工資增長並未明顯放緩，數據下滑全因長者戶激增及住戶縮減規模所致。

議員黃國表示，數據顯示，由2006至2015年的10年間，家庭住户每月入息中位數由16,700港元增至24,500港元，增幅超過45%，惟最近10年，即2016至2025年的入息中位數僅由25,000港元增至30,000港元，增幅下滑至20%。

孫回應指，2016年至2025年間，本港就業人士月入中位數累計增幅約39%，與2006至2015年的43%大致相若。家庭住戶入息中位數增幅放緩，受人口結構拖累。過去10年間，長者住戶由32萬戶增至51萬戶，增幅近60%；而非從事經濟活動的長者戶亦同步上升，由29萬戶增至43萬戶。加上家庭住戶平均人數在過去20年持續下降，分別由2006年的2.9人下降至2015年的2.7人，及由2016年的2.7人下跌至2025年的2.5人。

數據亦顯示非從事經濟活動的非長者住戶由2006年的15萬戶，增至2025年的24萬戶。局方分析指，全退休人士住戶數目增加約3.9萬戶，由2006年的3.3萬戶增加至2025的7.2萬戶，部分涉及非長者人士選擇在65歲前提早退休。另有1.5萬戶全學生住戶，部分為來港升學的非本地學生。這兩類住戶的增加，已佔期內非從事經濟活動的非長者住戶總增幅六成。

黃國又指，觀塘、葵青及黃大仙區的勞動人口參與率普遍較低，於女性中尤其明顯。孫稱，政府已擴展「在校課後託管服務計劃」，於2025/26學年取消名額上限。截至今年2月，已有205間小學參與，提供逾萬個名額。另外，為推動受助人自力更生，社會福利署自去年10月起試行計劃，強制15至59歲失業健全綜援受助人每周進行最少1小時無償工作。同時，政府將於今年下半年推出限時現金獎勵，鼓勵領取職津的住戶脫離綜援。"
bkn-20260422150512481-0422_00822_001,美通用電氣醫療集團CEO晤何立峰　願推動中美經貿合作,2026-04-22 15:05,2026-04-22 15:05,https://hk.on.cc/cnt/news/20260422/bkn-20260422150512481-0422_00822_001.html,美通用電氣醫療集團CEO晤何立峰　願推動中美經貿合作,北京,oncc,2026-04-22 15:30,"中共中央政治局委員、國務院副總理何立峰周二（21日）下午在北京，會見美國通用電氣醫療集團全球總裁兼行政總裁安杜尼（Peter Arduini）。安杜尼表示，對在華長期發展充滿信心，將繼續深耕中國市場，並願為推動美中經貿合作貢獻力量。

何立峰指出，今年中國經濟實現良好開局，發展韌性和活力進一步彰顯。他強調「十五五」時期，中國將堅定不移擴大高水平對外開放，持續打造一流營商環境，歡迎包括通用電氣醫療集團在內的更多美資企業持續深化對華互利合作，共享中國超大規模市場和高質量發展機遇。

北京市委書記尹力同日亦分別會見英國保誠集團董事長范德娜和全球董事會成員及高管團隊、安杜尼及其高管團隊。安杜尼表示，中國市場對於該集團至關重要，將持續加大在京投資力度，與北京在醫療科技創新、人工智能技術應用等方面攜手探索實踐，推出更多全球領先的醫療器械產品，為中國乃至全球患者帶來更多福祉。"
bkn-20260422150036161-0422_00822_001,福田山姆店購烏冬現活蛆　消費者獲賠1000人民幣,2026-04-22 15:00,2026-04-22 15:00,https://hk.on.cc/cnt/news/20260422/bkn-20260422150036161-0422_00822_001.html,福田山姆店購烏冬現活蛆　消費者獲賠1000人民幣,廣東,oncc,2026-04-22 15:30,"山姆超市再爆食安風波，消費者廖先生日前在廣東省深圳市福田區香蜜湖山姆會員店購買一款烏冬，小孩食用時發現烏冬裏有蛆蟲。廖先生周二（21日）表示雙方已溝通，最終獲賠1,000元（人民幣，下同，約1,150港元）並獲贈兩箱藍莓。

廖先生表示，自己是山姆十多年的會員。事發後聯絡門店，誰知對方僅提出400元賠償，且態度傲慢。內媒前往福田山姆會員店核實，發現同款烏冬仍在發售。內媒又聯絡產品生產廠家，對方表示車間平時有蟲害消殺，產品需經過兩次高溫攪拌殺菌，按工藝處理後蟲子不應保持完整鮮活狀態，暫不清楚蛆蟲由來，正排查蟲源。

事件經報道後，廖先生周二表示山姆副總經理已與他溝通，態度較好。山姆方面稱，已第一時間核查全國門店同款預包裝商品，暫未發現異常，並已安排第三方機構全鏈路調查生產廠家，後續將加強包裝管理和配送服務。"
bkn-20260422150024355-0422_00822_001,假冒官員誘騙留學生返港買金粒「助查」3男被捕涉款710萬元,2026-04-22 15:00,2026-04-22 16:50,https://hk.on.cc/cnt/news/20260422/bkn-20260422150024355-0422_00822_001.html,"假冒官員誘騙留學生返港買金粒「助查」　3男被捕涉款710萬元


執法部門於前日(20日)及昨日(21日)展開代號「捕帥」行動，成功瓦解一個專門針對中國內地海外留學生的假冒官員電話詐騙集團。<br/><br/>調查人員表示，今年截至目前為止，旺角區執法部門接獲7宗騙案，其受害人均為外地留學生，騙款總額高達710萬港元。執法",香港,oncc,2026-04-22 18:00,"執法部門於前日(20日)及昨日(21日)展開代號「捕帥」行動，成功瓦解一個專門針對中國內地海外留學生的假冒官員電話詐騙集團。

調查人員表示，今年截至目前為止，旺角區執法部門接獲7宗騙案，其受害人均為外地留學生，騙款總額高達710萬港元。執法部門目前已偵破其中4宗涉款共約500萬港元的騙案，起回全部贓物。行動至今，警員一共拘捕3人，並正追緝2名人士。

人員講解騙徒手法，指騙徒會假冒上海公安局致電海外留學生，聲稱他們涉嫌洗黑錢等刑事罪行，要求配合調查，然後再指示受害人立即前往香港，並到連鎖珠寶店購買金粒。其後，騙徒再假冒香港廉政公署(ICAC)人員，約定受害人在香港會面，收取其所購金粒。得手後，騙徒會將金粒變賣套現，或者是轉換為虛擬貨幣。

據了解，案中受害者有6人在澳洲留學，1人就讀英國院校，他們受騙時向家人聲稱要支付學費，然後將款項用於購買金粒，損失金額介乎約74萬至157萬元。由於他們返回外地才察覺受騙，於是以電子方式向香港執法部門報案。

調查顯示，騙徒會指示受害人以少數目、高頻率的形式購買金粒，而且每次的金額均不會超過12萬港元，故此毋須登記購買者的名字，以減低被懷疑的風險。為了拖延騙局被揭穿，騙徒和受害人交收黃金後，仍會繼續與受害人保持聯絡，從而博取他們的信任，增取更多時間處理贓物。

警員翻查閉路電視影片及分析大量資料，循線拘捕3名男子(25至37歲)，涉嫌「以欺騙手段取得財產」及「處理贓物」。疑犯的角色主要是接贓，警員亦在他們的工作地點起回約500萬港元的贓物。案件仍在調查中，包括假扮官員的騙徒仍然在逃，相信之後會有進一步拘捕行動。"
bkn-20260422141501547-0422_00822_001,免費送禮當誘餌　市民填「驗證碼」變轉帳　5分鐘失逾3萬元,2026-04-22 14:15,2026-04-22 15:19,https://hk.on.cc/cnt/news/20260422/bkn-20260422141501547-0422_00822_001.html,免費送禮當誘餌　市民填「驗證碼」變轉帳　5分鐘失逾3萬元,香港,oncc,2026-04-22 15:30,"不少市民喜歡追劇，但執法部門分享一宗騙案，指最近有一名熱門劇集的忠實粉絲，在社交平台Threads上看見聲稱免費贈送劇集紀念品的貼文，因而主動私訊騙徒，結果在短短5分鐘內被騙走超過3萬港元。

該部門拆解騙徒手法，指騙徒會在社交平台發布貼文，用「免費」字眼做餌，引誘事主離開平台繼續溝通，並聲稱索要紀念品要支付運費及填寫資料。其後，騙徒用假連結誘導事主進入假網站，惟事主一進入網站，便會彈出「訂單被鎖，請找LINE客服解鎖」的視窗提示。

騙徒緊接假扮客服人員，用通訊軟件Line致電聯絡事主，聲稱3至5分鐘內依從步驟照做即可解鎖。首先，騙徒指示事主打開電子支付工具「PayMe」，輸入指定銀行號碼及户口名；再讀出一串聲稱是「驗證碼」的數字，要求事主於「港幣後空白位置」輸入來解鎖認證。事實上，相關「驗證碼」是轉帳金額，騙徒收到騙款後，即時去如黃鶴。"
