id,title,date,last_update,url,lead,section,source,scrape_time,news_content
bkn-20260210151559528-0210_00822_001,公務員認偷拍女子臀部　求情指初犯望免監禁　案件2.26判刑,2026-02-10 15:15,2026-02-10 15:15,https://hk.on.cc/cnt/news/20260210/bkn-20260210151559528-0210_00822_001.html,公務員認偷拍女子臀部　求情指初犯望免監禁　案件2.26判刑,香港,oncc,2026-02-10 15:30,"現任小巴司機涉於去年11月在九龍城一間文具店內偷拍女子X的私密部位，因而被捕，並被控一項「非法拍攝或觀察私密部位」罪。案件今日(10日)於九龍城裁判法院再訊，被告承認控罪，辯方求情指被告屬初犯，望法庭判處非監禁刑罰，秦淑君暫委裁判官將案件押後至2月26日判刑，以待索取社會服務令報告，期間被告續准保䆁候判。

被告吳永倫(51歲，報稱公務員)，被控一項「非法拍攝或觀察私密部位」罪。控罪指被告於2025年11月11日，在香港九龍城獅子石道36號地下「光雅文具」內拍攝X的私密部位，而拍攝情況是若非遭拍攝，該部位本來不是可讓人看到的，及被告為了性目的或不誠實地作出上述行為，及不理會以上述行為是否獲得X同意。

辯方庭上求情指，被告現時任職小巴司機，兼職敎車師傅。他在案發後已進行了5次心理輔導，積極面對問題，且他屬初犯，希望法庭判處非監禁刑罰，秦官將案件押後至2月26日判刑。

案情指，案發當日下午1時許，X走進文具店內購物，她身穿緊身牛仔褲。她的同行者發現被告用手機從後拍攝X的臀部，隨後被告翻查手機螢幕，並再次拍攝X的臀部。被告被截停，他的手機相簿中被發現1條拍攝X臀部的片段。被告在警誡下表示他見X長得挺漂亮才起色心，忍不住拍攝她的臀部。

案件編號：KCCC 3173/2025"
bkn-20260210151134916-0210_00822_001,最低工資調升至43.1元　立法會通過後5月1日起實施,2026-02-10 15:11,2026-02-10 15:11,https://hk.on.cc/cnt/news/20260210/bkn-20260210151134916-0210_00822_001.html,最低工資調升至43.1元　立法會通過後5月1日起實施,香港,oncc,2026-02-10 15:30,"福工及福利局今日(2月10日)表示，行政會議已接納最低工資委員會的建議，將法定最低工資水平由現行每小時42.1元調升至43.1元，增幅為1.0元或2.38%。

政府將於下周五（20日）在憲報刊登《2026年最低工資條例（修訂附表3）公告》，並於2月25日提交立法會。如獲立法會通過，經修訂的法定最低工資水平將於今年5月1日起實施。

勞工及福利局局長孫玉菡表示，政府經審慎考慮，認為委員會已適當地履行檢討法定最低工資水平的法定職能。委員會的建議符合法定最低工資的政策目標，在防止工資過低與盡量減少低薪職位流失之間取得適當平衡，並顧及維持香港的經濟發展及競爭力。"
bkn-20260210150530133-0210_00822_001,測量師學會冀強化「樓宇醫生」角色　提升維修標準及公眾信心,2026-02-10 15:05,2026-02-10 15:05,https://hk.on.cc/cnt/news/20260210/bkn-20260210150530133-0210_00822_001.html,測量師學會冀強化「樓宇醫生」角色　提升維修標準及公眾信心,香港,oncc,2026-02-10 15:15,"香港測量師學會上月宣布成立樓宇維修工作組，從測量專業角度全面檢視本港樓宇維修市場的運作、監管及相關法規，並提出改善建議，以改善市場生態。測量師學會會長温偉明表示，學會會強化「樓宇醫生」角色，改善滲水及歷史建築保育等專家服務名單，提升維修標準及公眾信心

温偉明又指，學會會推廣物業設施管理行業實務準則，協助更多業主和法團進行工程管理及設施檢查工作，從而達致物業保值乃至增值的目標，同時亦支持推行建造業付款保障條例，並在最新公布的標準建築合約內，加入相關的條例元素。而對於本港現時有10個樓齡超過50年的舊型公共屋邨，涉及2.7萬個單位需要重建，溫建議政府制訂清晰的搬遷和安置的時間表，研究靈活運用新建的公屋作暫住房，以短期租約形式出租公屋。

樓宇維修工作組由前會長何鉅業擔任主席，成員包括學會內各專業範疇的資深測量師。主要工作方向包括檢視現行市場運作與監管機制、研究優化相關法例及作業指引、推動提升專業服務水平與工程管理透明度，以及加強公眾教育。學會表示，工作組將廣泛收集業界及持份者意見，在完成檢視後向政府及相關機構提交專業意見和建議，以推動樓宇維修市場持續健康發展，促進業界專業水平提升，從而保障樓宇安全與工程質素。"
bkn-20260210150151021-0210_00822_001,送貨無人機墜落大街　市民憂安全隱患,2026-02-10 15:01,2026-02-10 15:01,https://hk.on.cc/cnt/news/20260210/bkn-20260210150151021-0210_00822_001.html,送貨無人機墜落大街　市民憂安全隱患,廣東,oncc,2026-02-10 15:15,"內媒周一（9日）報道，廣東深圳市近日有一架執行配送任務的無人機從街道上空跌落地面，吸引不少市民圍觀。有人擔憂若無人機意外砸在人身上會是大問題，認為要規劃好航徑，最好避開人群密集區域以降低風險。

無人機事發時在龍華區觀瀾街道觀湖園附近作業，期間跌落地面。無人機自動打開降落傘，機身整體保持完整。內媒指涉事的是豐翼物流無人機，機型為「方舟80」 ，是新一代升力翼多旋翼中型物流無人機，最大巡航速度每小時90公里。

市民盧先生表示，公園上空經常見到無人機送貨，特別是周末無人機送餐更為頻繁。他沒有遇到過無人機失誤情況，也相信無人機作業相對安全。有保安則指，如遇此類情況，會第一時間疏散圍觀群眾，防止人員聚集造成二次風險。"
bkn-20260210145852131-0210_00822_001,JPEX詐騙案　其中一名30歲男子被控4項洗黑錢罪　准保至5.14再訊,2026-02-10 14:58,2026-02-10 14:58,https://hk.on.cc/cnt/news/20260210/bkn-20260210145852131-0210_00822_001.html,JPEX詐騙案　其中一名30歲男子被控4項洗黑錢罪　准保至5.14再訊,香港,oncc,2026-02-10 15:15,"虛擬資產交易平台JPEX詐騙案，有80名人士被捕，當中16人被落案起訴，並被分成多宗案件處理。其中一名30歲男子被指於兩年半間透過4個銀行帳戶處理約2,450萬港元的犯罪得益，被控4項洗黑錢罪。案件今(10日)於區域法院提訊，涉案男被告暫毋須答辯，以待辯方索取文件及法律意見，控方則確認已發出加刑通知書。法官最終把案件押後至5月14日再訊，期間被告續准保釋。

被告劉玉恒(30歲)被控4項氾洗黑錢罪。控罪指，被告於2021年6月至2023年12月期間，知道或有合理理由相信恒生銀行、眾安銀行、Mox Bank及匯立銀行的4個戶口內共約2,450萬港元為可公訴罪行的得益，而仍處理上述財產。

案件編號：DCCC 198/2026"
bkn-20260210145744735-0210_00822_001,沙田圓洲角體育館六旬男工遭墮下鐵枝擊傷頭送院,2026-02-10 14:57,2026-02-10 14:57,https://hk.on.cc/cnt/news/20260210/bkn-20260210145744735-0210_00822_001.html,"沙田圓洲角體育館六旬男工　遭墮下鐵枝擊傷頭送院


今午(10日)2時03分，沙田銀城街圓洲角體育館，一名姓謝(66歲)男清潔工人，協助安裝一個排球架時，遭一支墮下的鐵枝打中頭部受傷，留下約1厘米乘1厘米傷口。他被送往威爾斯親王醫院治理，案件列作「有人意外受傷」處理。",香港,oncc,2026-02-10 16:15,今午(10日)2時03分，沙田銀城街圓洲角體育館，一名姓謝(66歲)男清潔工人，協助安裝一個排球架時，遭一支墮下的鐵枝打中頭部受傷，留下約1厘米乘1厘米傷口。他被送往威爾斯親王醫院治理，案件列作「有人意外受傷」處理。
bkn-20260210145220668-0210_00822_001,訛稱車禍呃「車手獎」　無業女因身體狀況改判緩刑,2026-02-10 14:52,2026-02-10 14:52,https://hk.on.cc/cnt/news/20260210/bkn-20260210145220668-0210_00822_001.html,訛稱車禍呃「車手獎」　無業女因身體狀況改判緩刑,香港,oncc,2026-02-10 15:15,"無業的26歲女子於前年向社署提交交通意外援助申請表格，及多張醫生紙，使社署向她發放俗稱「車手獎」的「交通意外援助金」，但被發現表格及醫生紙的內容並非屬實。該無業女早前承認一項企圖欺詐罪，被判200小時社會服務令。惟她因其身體狀況而無法履行餘下社會服務令，案件今(10日)再交往東區裁判法院處理。主任裁判官張志偉接納被告的醫療報告之內容，應申請改判監禁4個月，緩刑24個月，另擱置社服令。

被告劉昭言(26歲)早前承認一項企圖欺詐罪。控罪指被告於2024年3月26日至4月19日，向社會福利署人員謊稱所交的交通意外援助申請表格，及9張醫生證明書上的資料屬實，誘使社署向其發放交通意外援助金。

裁判官今表示案件嚴重，若被告成功詐騙社署，可獲得近5萬港元援助，上次判刑時法庭給予被告一次機會，判以200小時社會服務令。但由於被告的身體狀況未能完成社服令，故需重新判刑。裁判官考慮到被告認罪，早前已完成24小時的社會服務，故決定改判監禁4個月，緩刑24個月。

案件編號：ESCC 801/2025"
bkn-20260210144916453-0210_00822_001,美眾院通過台灣保護法案陸行動威脅台可逐出金融機制,2026-02-10 14:49,2026-02-10 14:49,https://hk.on.cc/cnt/news/20260210/bkn-20260210144916453-0210_00822_001.html,"美眾院通過台灣保護法案　陸行動威脅台可逐出金融機制


美國眾議院周一（9日）通過《台灣保護法案》（Protect Taiwan Act），法案要求當台灣安全受到中國大陸行動威脅，美國應全力排除大陸於國際金融機制與組織之外。法案將送交參議院審議，若獲通過，則交由總統特朗普簽署生效。<br/><br/>《台灣保護法",台灣,oncc,2026-02-10 16:30,"美國眾議院周一（9日）通過《台灣保護法案》（Protect Taiwan Act），法案要求當台灣安全受到中國大陸行動威脅，美國應全力排除大陸於國際金融機制與組織之外。法案將送交參議院審議，若獲通過，則交由總統特朗普簽署生效。

《台灣保護法案》案由共和黨籍眾議員盧卡斯（Frank Lucas）提出，以395票贊成、2票反對的壓倒性票數獲得通過。法案要求，如果大陸的行動對台灣人民安全、社會或經濟制度造成威脅，美國應在最大可行範圍內把大陸代表排除於二十國集團（G20）、國際清算銀行及金融穩定委員會國際金融機制與組織之外。

盧卡斯強調，法案意在表明如果大陸意圖與台灣發生衝突，就必須準備承擔後果。共和黨眾議員希爾（French Hill）指出，只要美國國會通知總統宣告台灣面臨威脅，法案就能確保大陸付出重大金融與外交代價，美國必須表明大陸攻台灣是不可、也不會被容忍。"
bkn-20260210142518106-0210_00822_001,土瓜灣兩餸飯店爐頭搶火　焫着油煙槽油漬起火冒煙,2026-02-10 14:25,2026-02-10 14:25,https://hk.on.cc/cnt/news/20260210/bkn-20260210142518106-0210_00822_001.html,土瓜灣兩餸飯店爐頭搶火　焫着油煙槽油漬起火冒煙,香港,oncc,2026-02-10 15:15,土瓜灣發生火警。今日(10日)下午2時18分，多名市民報案，指譚公道2至10號後巷有大量濃煙冒出。消防接報到場開喉射水撲救，同時派出搜救隊協助救援，火勢迅速被撲熄。事件中無人受傷，亦毋須疏散，經初步調查相信，兩餸飯店廚房工人烹煮食材時，爐頭搶火焫着油煙槽油漬引起火警。
bkn-20260210141720945-0210_00822_001,全國人大常委會月底開會　審議代表資格及任免案,2026-02-10 14:17,2026-02-10 14:17,https://hk.on.cc/cnt/news/20260210/bkn-20260210141720945-0210_00822_001.html,全國人大常委會月底開會　審議代表資格及任免案,北京,oncc,2026-02-10 15:15,"十四屆全國人大常委會第六十一次委員長會議周二（10日）上午在北京人民大會堂舉行，由全國人大常委會委員長趙樂際主持會議。會議決定，十四屆全國人大常委會第二十一次會議於本月25日至26日召開，審議全國人大常委會代表資格審查委員會關於個別代表的代表資格報告和有關任免案等。

全國人大常委會秘書長劉奇在委員長會議上，匯報常委會第二十一次會議議程草案、日程安排，以及十四屆全國人大四次會議議程草案、日程安排、主席團和秘書長名單草案、列席人員名單草案等。

委員長會議建議，常委會第二十一次會議審議全國人大常委會工作報告稿，以及提請審議十四屆全國人大四次會議議程、主席團、秘書長和列席人員名單草案的議案。其他審議項目還將包括社會救助法草案，國務院關於提請審議註冊會計師法修正草案和國家消防救援人員法草案的議案，審議全國人大常委會關於法律清理工作情況和有關法律及決定處理意見的報告稿。

此外，委員長會議審議了關於2025年度全國人大機關群眾信訪工作情況的報告，全國人大機關進一步完善監督法實施工作機制的辦法稿。"
bkn-20260210140550731-0210_00822_001,大橋坍塌釀5死交通運輸部掛牌督辦,2026-02-10 14:05,2026-02-10 14:05,https://hk.on.cc/cnt/news/20260210/bkn-20260210140550731-0210_00822_001.html,"大橋坍塌釀5死　交通運輸部掛牌督辦


江蘇省鹽城市月港大橋上周一（2日）施工期間發生塌落繫桿拱樑塌落導致5死，交通運輸部周二（10日）決定對事故實施掛牌督辦。<br/><br/>大橋建設單位為江蘇港航投資發展有限公司，施工單位為中鐵十二局集團有限公司。設計單位為華設設計集團股份有限公司，監理單位",江蘇,oncc,2026-02-10 16:45,"江蘇省連申線黃響河至淮河入海水道段航道整治工程月港大橋，周一（2日）發生繫桿拱樑塌落事故，造成5人死亡。交通運輸部周二（10日）宣布對大橋坍塌事故掛牌督辦。

大橋的建設單位為江蘇港航投資發展有限公司，施工單位是中鐵十二局集團有限公司。交通運輸部督辦要求地方交通運輸主管部門依職責組織專家盡快查明原因，針對性抓好問題整改，依法依規對責任單位和人員進行處罰。同時，要深入開展風險隱患排查整治，有效壓實參建各方安全責任，堅決防範遏制群死群傷事故發生。

交通運輸部安委會向全國交通運輸行業警示通報，要求各部門、各單位增強工程建設質量安全紅線意識，深入開展風險隱患排查整治，加大超危大工程監督管理力度，切實加強航道工程橋樑安全管理。多部門需嚴格重大危險源節假日期間提級管控，加強應急值守，及時妥善應對各類突發事件，確保春運春節等重點時段交通運輸安全生產形勢穩定。"
bkn-20260210140549739-0210_00822_001,昂坪360去年客量減6%　因天氣暫停纜車近萬分鐘,2026-02-10 14:05,2026-02-10 14:05,https://hk.on.cc/cnt/news/20260210/bkn-20260210140549739-0210_00822_001.html,昂坪360去年客量減6%　因天氣暫停纜車近萬分鐘,香港,oncc,2026-02-10 14:15,"昂坪360公布去年的營運狀況，去年全年共接待147萬名賓客，較2024年的156萬名賓客，減少近6%。昂坪360董事總經理董沛銓解釋，去年受惡劣天氣及纜車保養維修日數的影響，總營運日數降至304日，較2024年減少19日；因天氣因素而暫停服務的分鐘達9,589分鐘，較2024年多3,280分鐘。他直言，在傳統旺季時間出現惡劣天氣，對營運有很大影響，形容面對的壓力很大。

董沛銓表示，去年平均每日有4,850名賓客到訪，較2024年的4,843有所上升。去年賓客佔比重最多的為短途地區市場，佔39%；其次為中國內地，佔25%；本地賓客及長途地區市場，分別佔20%及16%。其中，增長最多的市場為台灣地區、美國及菲律賓，分別增長38%、37%及20%。

人均消費方面，共增長約4.5%，當中纜車消費以及纜車以外的人均消費，分別較2024年增加約1.5%及約20.6%。問到為何纜車以外的人均消費大增，董沛銓表示，昂坪市集設有5間不同商店，分別針對不同客群，其中擺設類、食品手信類，以至影相服務等，較受賓客歡迎。同時，昂坪360平均纜車可靠度繼續維持歷史最高水平，達99.98%，相等於每日8小時的營運時間中，平均只有少於1分鐘的延誤。

此外，為慶祝開幕20周年，昂坪360將由下月起至12月，每月選定1日，推出88港元「回到開幕價」，讓本地居民乘坐成人來回標準纜車，詳情稍後公布。董沛銓補充，因要核對香港居民身份證，故不會在網上售票，賓客需親身到售票處購票。同時，昂坪360亦會舉辦一系列日夜連場慶祝活動，包括將於暑假期間的特定周末加開夜間纜車、於昂坪市集加入充富本地情懷的霓虹燈裝飾，以及舉辦夜間音樂會。"
bkn-20260210140221477-0210_00822_001,港鐵年廿九通宵行駛　初一初二晚加密部分鐵路綫班次,2026-02-10 14:02,2026-02-10 14:02,https://hk.on.cc/cnt/news/20260210/bkn-20260210140221477-0210_00822_001.html,港鐵年廿九通宵行駛　初一初二晚加密部分鐵路綫班次,香港,oncc,2026-02-10 15:15,"農曆新年將至，港鐵表示，將於本周五(13日)至農曆新年期間，於不同時段加強多條重鐵綫的服務，總共增加600多班列車。其中在農曆年廿九(16日)，港鐵將提供通宵服務。

另外，年初一(17日)及初二(18日)晚上，亦會加密部分鐵路綫的班次，方便市民觀賞花車巡遊及維港兩岸的煙花匯演。而迪士尼綫亦會在初一至初七(23日)，加密早上時段的列車班次。至於機場快綫，年廿七（14日）至年廿九頭班車將提前於上午5時35分，由香港站開出；初三（19日）及初六（22日）尾班車將延後至凌晨1時，由博覽館站開出。高鐵香港段則會加強來往香港西九龍站及福田站，以及來往北京西站的臥鋪列車服務。"
bkn-20260210134029945-0210_00822_001,車CAM直擊:醉客行車期間向的哥「起飛腳」　涉襲擊被捕,2026-02-10 13:40,2026-02-10 13:40,https://hk.on.cc/cnt/news/20260210/bkn-20260210134029945-0210_00822_001.html,車CAM直擊:醉客行車期間向的哥「起飛腳」　涉襲擊被捕,香港,oncc,2026-02-10 15:15,"本周日(8日)早上9時38分，一名姓陳(40歲)的哥於香港輔警總部報案，指其於上環接載了一名帶有酒氣的男乘客，他上車不久後便熟睡。當的士駛至近啟晴邨時，男乘客睡醒後突然發狂，從後襲擊其頭部和頸部。警員接報到場，經初步調查，以涉嫌「襲擊」拘捕該名姓高(63歲)男乘客，他其後獲准保釋候查。姓陳的哥前額、頸部及面部受傷，高男則處於醉酒狀態及語無倫次，兩人俱由救護車送往聯合醫院治理。

涉事車CAM片段曝光，片中可見坐在的士後座的男乘客用右腳襲擊的哥，再撲向前雙手箍著的哥頸部，期間的哥伸手抵擋一度需要單手控制軚盤。過程中的哥並無停車，片尾當的士駛至香港輔警總部後始停下，的哥隨即落車報案大喊「救命，打人」，而高男則一臉茫然坐在車廂內，其後更側身閉眼入睡，長約2分24秒的影片自此結束。

片段上傳至社交平台引來不少網民留言，認為的哥遇襲後沒有停車非常危險，又指「睇咗幾次真係好犀利。(的哥)俾人追住個頭嚟打，都可以隻隻彎響住胎咁入。仲可以將乘客安全感(咁)送到目的地。真係高手中嘅高手。」"
bkn-20260210132516349-0210_00822_001,2026年對台工作會議召開　王滬寧重申打擊台獨分裂,2026-02-10 13:25,2026-02-10 13:25,https://hk.on.cc/cnt/news/20260210/bkn-20260210132516349-0210_00822_001.html,2026年對台工作會議召開　王滬寧重申打擊台獨分裂,北京,oncc,2026-02-10 14:30,"2026年對台工作會議周一（9日）至周二（10日）在北京召開，由中共中央政治局委員、中央外辦主任王毅主持會議。中共中央政治局常委、全國政協主席王滬寧出席並發表講話，強調要堅定不移推動兩岸關係和平發展、推進祖國統一大業。

王滬寧表示，要堅持一個中國原則和「九二共識」，堅決打擊「台獨」分裂勢力、反對外部勢力干涉，維護台海和平穩定。同時，秉持「兩岸一家親」理念，暢通和便利兩岸人員往來，擴大兩岸民間、基層交流，支持台灣民眾特別是青年來大陸學習、工作、生活，推動兩岸共同弘揚中華文化，促進兩岸同胞心靈契合。

此外，王滬寧認為要支持大陸台商台企發展，完善惠及台胞台企政策措施，深化兩岸融合發展，讓兩岸同胞共享中國式現代化機遇和成果。"
bkn-20260210130753266-0210_00822_001,晤美國商會會長　謝鋒指經貿合作推動中美關係,2026-02-10 13:07,2026-02-10 13:07,https://hk.on.cc/cnt/news/20260210/bkn-20260210130753266-0210_00822_001.html,晤美國商會會長　謝鋒指經貿合作推動中美關係,中國,oncc,2026-02-10 13:45,"中國駐美大使館周一（9日）指，中國駐美大使謝鋒上周四（5日）與美國商會會長兼首席執行官克拉克一行人座談交流。

謝鋒會上指出，中國將繼續是世界經濟的穩定錨和動力源，中國大市場、世界大機遇，正日益成為各方廣泛共識。對於跨國企業來說，中國不是可選項而是必選項。擁抱中國，就是擁抱機會；接軌中國，就是接軌世界；贏在中國，也就是贏得未來。

謝鋒認為經貿合作將繼續是中美關係的壓艙石和推進器，中美關係的本質是互利共贏，這一點在兩國經貿合作中得到充分體現，更為歷史和現實一再證明。中美在經貿領域存在分歧，但辦法總比問題多，只要雙方平等對話磋商，照顧彼此關切，就能夠找到妥善的解決方案。他也期待工商界繼續成為中美經貿合作和兩國關係發展的參與者和貢獻者，中美關係發展與工商界利益息息相關，希望各方為交流合作持續供能，為民心相通添磚加瓦，為理解互信播種共識，推動中美經貿合作收獲更豐富果實，助力中美構建新時期正確相處之道。"
bkn-20260210125118131-0210_00822_001,天水圍天瑞邨女子偷單車事敗　逃至河邊企跳被帶返安全位置,2026-02-10 12:51,2026-02-10 12:51,https://hk.on.cc/cnt/news/20260210/bkn-20260210125118131-0210_00822_001.html,天水圍天瑞邨女子偷單車事敗　逃至河邊企跳被帶返安全位置,香港,oncc,2026-02-10 13:30,"天水圍有人偷單車事敗後企圖跳河。今晨(10日)11時38分，一名女子於天瑞邨企圖盜去一輛單車，店舖職員發現後喝止並報案求助。女子見事敗慌忙逃去，職員從後追截該女子至天瑞邨瑞輝樓對開一段天水圍河畔徑時。女子見逃跑不果後，於河邊一石壆危站並聲稱將會跳河。至中午12時05分，救援人員接報後趕往現場，將女子被帶返安全位置。警員正對事件展開調查。

防止自殺求助熱線：

香港撒瑪利亞防止自殺會： 2389 2222

生命熱線： 2382 0000

社會福利署： 2343 2255

撒瑪利亞會熱線(多種語言)： 2896 0000

醫管局精神健康專線： 2466 7350

明愛向晴軒： 18288

東華三院芷若園： 18281

「情緒通」熱線： 18111

賽馬會青少年情緒健康網上支援平台「Open噏」： http://www.openup.hk"
bkn-20260210124707997-0210_00822_001,東部戰區「海空雄鷹團」　多次與外機空中較量,2026-02-10 12:47,2026-02-10 12:47,https://hk.on.cc/cnt/news/20260210/bkn-20260210124707997-0210_00822_001.html,東部戰區「海空雄鷹團」　多次與外機空中較量,中國,oncc,2026-02-10 14:15,"內地軍報周二（10日）披露，有「海空雄鷹團」稱號的解放軍東部戰區空軍航空兵某旅曾多次與外機空中較量。

該支部隊組建於抗戰時期，歷經多次調整轉隸，1965年獲國防部授予「海空雄鷹團」稱號。部隊於去年底迎來授稱60周年，選取了組建以來不同時期的60張照片製成照片牆，記錄執行演訓任務的場景，當中包括與外機較量的情況。

在一次應對過程中，外軍飛機採取低空低速的方式，飛到了一個比較有威脅的位置。該旅副教導員與隊友根據以往經驗，預判了對手的動作，提前搶佔有利陣位，迫使外機改變航向飛離。此外，解放軍戰機有一次在遠海某空域與外軍飛機形成某種對峙陣型，當時參與任務的解放軍飛行員姚國祥稱與隊友面對對手的數量和質量優勢，在預警機、地面雷達等體系支撐下，果斷搶佔陣位，有力釋放了宣示主權的信號。

飛行員楊林還分享，幾天前與隊友駕機到指定空域執行任務時，突然與外軍編隊迎頭相遇。當時，空域態勢不明，外軍在數量上佔優，楊林按照應對規範做出一系列動作，緊緊咬住外軍其中一架飛機，迫使對方離開所在空域。"
