id,title,date,last_update,url,lead,section,source,scrape_time,news_content
bkn-20250826124534214-0826_00822_001,新冠後兒童抵抗力跌　專家籲慎防流感手足口等傳染病,2025-08-26 12:45,2025-08-26 12:45,https://hk.on.cc/cnt/news/20250826/bkn-20250826124534214-0826_00822_001.html,新冠後兒童抵抗力跌　專家籲慎防流感手足口等傳染病,香港,oncc,2025-08-26 13:15,"近期流感、呼吸道合胞病毒、手足口病等多種傳染病的活躍程度俱升，衞生防護中心於開學前提醒學校提高警覺，預防校內出現傳播情況。香港大學醫學院曹延洲基金兒科教授葉柏強指出，據近年經驗，兒童的抵抗力及抗體水平均較新冠疫情前降低，一旦感染，病徵或較嚴重。若需住院，留院時間亦可能較長。開學在即，學童之間的接觸將會增加，導致校園內有較高風險爆發傳染病，故校方及家長亦要提高警覺，做好預防措施。

同時，蚊傳疾病「基孔肯雅熱」的風險仍然存在，本港今年已錄得9宗病例。醫學會傳染病顧問委員會聯席主席曾祈殷表示，本港暫時錄得的所有個案均為輸入個案，反映病毒尚未植根。由於本地的白紋伊蚊亦能傳播該種病毒，故一旦出現病例，便需盡快隔離患者及加強防蚊措施。

另外，內地近日有兩名兒童懷疑游水或浸溫泉後遭「食腦蟲」感染而死。曾指，「食腦蟲」是主要存活於淡水湖泊及河流的「阿米巴蟲」，是其中一種寄生蟲，市民跳水或潛水時感染風險會較高。雖然感染「食腦蟲」的情況相當罕見，惟一旦感染，死亡率可高達98%。

他續指，當這種寄生蟲直接接觸人類鼻腔，便會透過嗅覺神經，快速進入患者的中樞神經。感染後，潛伏期約為9日，早期病徵與腦炎相近，包括發燒及頭痛，其後病情急劇惡化，甚至會令患者陷入昏迷。"
bkn-20250826121506494-0826_00822_001,早前受罷工影響　港寄往斯里蘭卡郵件派遞服務現恢復正常,2025-08-26 12:15,2025-08-26 12:15,https://hk.on.cc/cnt/news/20250826/bkn-20250826121506494-0826_00822_001.html,早前受罷工影響　港寄往斯里蘭卡郵件派遞服務現恢復正常,香港,oncc,2025-08-26 12:30,香港郵政今日（26日）宣布，接獲斯里蘭卡郵政機關通知，早前受罷工影響的郵件派遞服務現已恢復正常。
bkn-20250826121313442-0826_00822_001,休斯敦機場頻查中國留學生華籲慎選入境航線,2025-08-26 12:13,2025-08-26 12:13,https://hk.on.cc/cnt/news/20250826/bkn-20250826121313442-0826_00822_001.html,"休斯敦機場頻查中國留學生　華籲慎選入境航線


中國駐美國大使館周一（25日）提醒中國赴美留學生，謹慎選擇赴德州休斯敦航線入境，稱近期有數名中國留學生自該市喬治布殊洲際機場入境時，遭美國海關邊境執法人員無端盤查滋擾、檢查所攜電子設備，甚至有人被限制人身自由長逾80小時，最終被無理遣返回國，嚴重損害他們的合法權益。<br/&",中國,oncc,2025-08-26 14:00,"中國駐美國大使館周一（25日）提醒中國赴美留學生，謹慎選擇赴德州休斯敦航線入境，稱近期有數名中國留學生自該市喬治布殊洲際機場入境時，遭美國海關邊境執法人員無端盤查滋擾、檢查所攜電子設備，甚至有人被限制人身自由長逾80小時，最終被無理遣返回國，嚴重損害他們的合法權益。

使館提醒擬來美留學人員謹慎選擇入境機場，並慎重考慮來美留學入境時可能遇到的問題。使館建議留學生提前準備好有效護照及簽證，確保護照有效期在6個月以上、留學簽證及留學身份狀態證明有效；又提到美國海關邊境執法人員近期還增加對留學生社交媒體的審查，故應確保自身言行合法合規。

如遇美國海關邊境執法人員盤查，使館呼籲留學生客觀如實回答相關問題；如遇不公正對待，可記下現場執法人員資料並留存必要證據等用於日後投訴；如遇入境受阻，可嘗試與執法人員協商申請中止入境，以免留下被拒入境及遣返紀錄。"
bkn-20250826120035813-0826_00822_001,憂西藏大壩「武器化」　印度加快建國內水壩減影響,2025-08-26 12:00,2025-08-26 12:00,https://hk.on.cc/cnt/news/20250826/bkn-20250826120035813-0826_00822_001.html,憂西藏大壩「武器化」　印度加快建國內水壩減影響,西藏,oncc,2025-08-26 12:15,"英媒周一（25日）引述知情人士及政府分析指，中國計劃在西藏修建的巨型水壩引發印度憂慮，恐令旱季主要河流流量減少達85%，印方為減輕影響推進建設國內最大水壩計劃，總理莫迪辦公室上月曾召開會議，討論加快施工進度。

據報道，印度政府本世紀初以來一直考慮修建水壩項目，控制來自西藏昂色冰川的水流，但因阿魯納恰爾邦居民激烈反對而受阻。中方去年12月宣布將在雅魯藏布江入境印度前的邊境縣修建全球最大水壩，令印度擔心中國會將該河段控制權「武器化」。印度最大水電公司今年5月在武裝警察護送下，將勘測設備運至上桑朗多用途蓄水壩的擬建工地附近。

印度政府估算，該中國大壩可調水多達400億立方米，略高於有關關鍵邊境口岸年接水量的三分之一，在非季候風季節影響將更嚴重。消息人士透露，印度擬在任何時候保持其大壩有30%庫容可用，以應對突發洪峰。中國外交部回應查詢時強調，這些水力發電項目不會對下游國家的水資源、生態或地質造成不利影響，中方與印度、孟加拉等國保持溝通與合作。"
bkn-20250826114807621-0826_00822_001,天文台發出酷熱天氣警告　巿民應慎防中暑,2025-08-26 11:48,2025-08-26 11:48,https://hk.on.cc/cnt/news/20250826/bkn-20250826114807621-0826_00822_001.html,天文台發出酷熱天氣警告　巿民應慎防中暑,香港,oncc,2025-08-26 12:00,"天文台在今日(26日)上午11時30分發出酷熱天氣警告。在今日上午11時天文台錄得氣溫31度，相對濕度百分之69。過去一小時，京士柏錄得的平均紫外線指數是7，強度屬於高。

預料今日本港天氣酷熱，市民應慎防中暑。長者、孕婦、嬰兒及小童、慢性病如心臟病或高血壓患者，以及過胖人士均較易中暑，應及時觀察是否出現中暑徵兆。

在炎熱天氣下或高溫環境中工作的人士，請參照勞工處的預防工作時中暑指引，採取所需的防暑措施。在戶外活動的人士，應多補充水分和不要過度勞累。於感覺不適時，應儘快到陰涼的地方休息。戶外活動宜安排在早上或下午較後的時間進行。"
bkn-20250826114050205-0826_00822_001,運輸署上年度處理194宗申訴　近40%以調解解決,2025-08-26 11:40,2025-08-26 11:40,https://hk.on.cc/cnt/news/20250826/bkn-20250826114050205-0826_00822_001.html,運輸署上年度處理194宗申訴　近40%以調解解決,香港,oncc,2025-08-26 12:00,"運輸署在2024至25年度共處理194宗申訴個案，其中74宗以調解解決，佔近40%，主要涉及各類牌證、運輸設施及運輸服務營辦商的表現，例如有市民反映「港車北上」續期通知電郵跌入垃圾郵件夾，錯過遞交續期申請的時段；有「易通行」用戶以為退款不果，但其實已完成退款；及有乘客不滿個別專線小巴路線的服務。

運輸署在社交平台表示，調解之道，在於用心聆聽，從用家角度出發，盡力改善體驗。例如，積極改善「港車北上」計劃，除發出續期通知電郵外，再以手機短訊提示按時續期，同時將續期申請時段由6日延長至13日，便利市民。

至於公交服務投訴，署方強調，每次均即時跟進調查，要求營辦商聚焦改善，並持續監察營運表現，定期交代具體跟進工作和進度，保持透明。署方強調，會繼續以早發現、早介入、早解決問題的策略，正面看申訴，又感謝申訴專員公署以第三方角度中立分析，促成不少調解個案。"
bkn-20250826112105275-0826_00822_001,紅磡大廈電錶房起火傳巨響　火勢撲熄原因待查,2025-08-26 11:21,2025-08-26 11:21,https://hk.on.cc/cnt/news/20250826/bkn-20250826112105275-0826_00822_001.html,紅磡大廈電錶房起火傳巨響　火勢撲熄原因待查,香港,oncc,2025-08-26 12:00,紅磡發生火警。今日(26日)早上11時，新柳街1A至1J號大廈地下一電錶房起火並傳出多聲巨響，大量白煙湧出，驚動多人報案。消防接報到場迅速將火救熄，事件中無人受傷，起火原因有待調查。
bkn-20250826111818961-0826_00822_001,壹傳媒黎智英案續結案陳詞　辯方稱媒體作用是促進社會討論,2025-08-26 11:18,2025-08-26 16:39,https://hk.on.cc/cnt/news/20250826/bkn-20250826111818961-0826_00822_001.html,壹傳媒黎智英案續結案陳詞　辯方稱媒體作用是促進社會討論,香港,oncc,2025-08-26 16:45,"壹傳媒黎智英連同集團旗下3間公司，涉嫌串謀勾結外國或者境外勢力危害國家安全及發布煽動刊物等共3罪，違反《港區國安法》，審訊今（26日）在西九龍法院（暫代高院）繼續。辯方結案陳詞時力陳，黎智英無法律及道德責任叫同案被告陳梓華不要犯法；又謂政府在修訂《逃犯條例》一事上遭誤導，犯下錯誤。法官反指似乎是媒體製造假象，令公眾被誤導。

審訊今踏入第154日。代表黎智英的資深大律師彭耀鴻指，2019年港府面對大量反對聲音，仍堅持推動修訂《逃犯條例》，或是因為政府被誤導而犯下的錯誤，構成煽動罪免責條款。法官質疑，就修例一事，看來是大多數公眾被誤導，而非政府被誤導。而公眾之所以被誤導，正是由於媒體製造假象，混淆視聽，誤以為修例會使疑犯被即時被引渡。惟事實上，是否引渡要經過司法程序。

彭耀鴻回應指，誰遭誤導並非法庭需處理的議題。政治無分對錯，需要公眾討論，而媒體的作用正是促進社會討論。法官要求彭舉例說明，《蘋果日報》如何促進或提倡公共討論，彭以本案被告、主筆馮偉光（筆名盧峯）所撰寫的文章〈以響亮的怒吼喝退「送中例」〉作例子，同時強調《蘋果》屬於公眾討論的一部分。

就黎智英被指跟「香港故事」成員李宇軒及法律助理陳梓華等人串謀犯案，同樣代表黎智英的新西蘭御用大律師Marc Corlett則稱，控方單單證明李宇軒及陳梓華在國安法後，有意圖繼續跟黎進行串謀計劃是不足夠，還要證明黎有意繼續行事。證據顯示，李宇軒在國安法後所做的事，是出於個人意志，跟黎智英甚至陳梓華無關。黎亦沒有法律及道德責任叫陳梓華不要犯法。

Marc Corlett強調，黎智英在國安法前，不知道進行制裁、封鎖或者採取其他敵對行動屬犯法。國安法後，他沒有把相關Twitter（現稱X）帳戶貼文及線上節目「Live Chat With Jimmy Lai」下架，不等同他必定在鼓勵違法行為。正如店主停止出售違禁品，但保留海報，難以指控他提倡不守法。另外，2020年 5月，陳梓華曾傳訊息給黎智英說「國安法主要針對境外內勇武人士，港獨分子及煽惑群眾人士，你務必謹慎」，黎智英回應稱「準備好戰鬥到最後」。Marc Corlett說，黎的回應不等於他會繼續做明知犯法的事。法官質疑，這似乎意味着黎鼓勵對方繼續行事，即使人身安全面對風險；謂法庭可以在字理行間中作出推論。Marc Corlett回應道，這不會是唯一無可抗拒推論。

涉案4名被告包括黎智英（77歲）、蘋果日報有限公司、蘋果日報印刷有限公司及蘋果日報互聯網有限公司。4名被告同被控一項串謀刊印、發布、邀約發售、分發、展示及或複製煽動刊物罪，及一項串謀勾結外國或者境外勢力危害國家安全罪。黎另單獨被控一項串謀勾結外國或者境外勢力危害國家安全罪。

案件編號：HCCC 51/2022"
bkn-20250826111206273-0826_00822_001,粉嶺村屋起火冒濃煙射水撲熄起因待查,2025-08-26 11:12,2025-08-26 11:12,https://hk.on.cc/cnt/news/20250826/bkn-20250826111206273-0826_00822_001.html,"粉嶺村屋起火冒濃煙　射水撲熄起因待查


粉嶺發生火警。今日(26日)早上10時52分，沙頭角公路河壩村多名村民報案，指一村屋起火冒出大量濃煙。消防接報派出一隊煙帽隊開喉灌救，同時搜救隊到場協助救援，火勢迅速被撲熄，事件中無人受傷，起火原因有待調查。",香港,oncc,2025-08-26 13:00,粉嶺發生火警。今日(26日)早上10時52分，沙頭角公路河壩村多名村民報案，指一村屋起火冒出大量濃煙。消防接報派出一隊煙帽隊開喉灌救，同時搜救隊到場協助救援，火勢迅速被撲熄，事件中無人受傷，起火原因有待調查。
bkn-20250826111038794-0826_00822_001,廣州女持刀追趕男童遭壯漢制服警拒公開案情,2025-08-26 11:10,2025-08-26 14:13,https://hk.on.cc/cnt/news/20250826/bkn-20250826111038794-0826_00822_001.html,"廣州女持刀追趕男童遭壯漢制服　警拒公開案情


網傳廣東省廣州市海珠區有年輕女子持刀追趕男童，被兩名男途人制服。警方周一（25日）拒絕公開情況，僅稱會加強巡邏。<br/><br/>年輕女子在街邊地攤前追趕男童，旁邊一名男途人上前控制女子雙手，大呼「她手上有刀」並奪取它。女子情緒激動尖叫並不斷反抗，大喊「還",廣東,oncc,2025-08-26 15:45,"網傳廣東省廣州市海珠區有年輕女子持刀追趕男童，被兩名男途人制服。警方周一（25日）拒絕公開情況，僅稱會加強巡邏。

年輕女子在街邊地攤前追趕男童，旁邊一名男途人上前控制女子雙手，大呼「她手上有刀」並奪取它。女子情緒激動尖叫並不斷反抗，大喊「還（刀）給我」。另一名壯碩男途人其後上前合力制服女子，直至警員趕到現場。

廣州市公安局海珠區分局官洲派出所工作人員稱，已對涉事小區周邊轄區加強巡邏，具體案件資訊不便透露。"
bkn-20250826111038389-0826_00822_001,職啟未來招聘會本周四及周五舉行　提供超過3100個職位空缺,2025-08-26 11:10,2025-08-26 11:10,https://hk.on.cc/cnt/news/20250826/bkn-20250826111038389-0826_00822_001.html,職啟未來招聘會本周四及周五舉行　提供超過3100個職位空缺,香港,oncc,2025-08-26 11:30,"勞工處於本周四(28日)及周五(29日)在旺角麥花臣場館（室內）舉行職啟未來招聘會，為求職人士提供大量飲食、零售及其他不同行業的職位空缺。

為期兩日的招聘會由勞工處和民主建港協進聯盟合辦，招聘會共有超過60間機構參加，合共提供超過3,100個不同行業的優質職位空缺，其中逾2,000個來自飲食業、零售業及運輸業。招聘會每日分別約有30間機構於會場設置櫃位，進行即場招聘。招聘會提供的職位類別相當廣泛，包括店務經理、當值工程師、會計主任、船務文員、行政助理、廚師、咖啡師、店務助理、收銀員、顧客服務助理、的士司機、清潔員和保安員等。求職人士如欲進一步了解空缺詳情，可瀏覽勞工處的互動就業服務網站。

在是次招聘會中，約82%為全職空缺，大部分月薪介乎1.2萬港元至2.6萬港元。約95%職位空缺學歷要求為中七或以下，約60%職位空缺毋需相關工作經驗。求職人士可即場遞交職位申請，有機會即場接受面試，亦可在勞工處設於場內的櫃位查詢該處提供的就業服務。招聘會將於上午11時至下午5時30分在旺角奶路臣街38號麥花臣場館一樓舉行（近旺角港鐵站E2出口），費用全免。每日截止入場時間為下午5時。"
bkn-20250826110110297-0826_00822_001,日面臨高門檻　對華出口水產欠進展,2025-08-26 11:01,2025-08-26 11:01,https://hk.on.cc/cnt/news/20250826/bkn-20250826110110297-0826_00822_001.html,日面臨高門檻　對華出口水產欠進展,中國,oncc,2025-08-26 11:45,"日本東京電力公司啟動福島第一核電站核污水排海作業周日（24日）滿兩年，共同社周一（25日）報道指，雖然中國政府已解除暫停進口日本水產品的措施，但貿易所需設施重新註冊登記和放射性物質檢測成為高門檻，實際出口方面未見進展。

中國政府今年6月宣布恢復37個道府縣水產品進口，但要求提交日本官方出具的衞生證明和放射性物質檢測合格證明。有水產業者指出，檢測結果還沒出來，質疑是否真的能出口。此外，中方對10個都縣的進口禁令仍未解除，水產企業仍感憂慮。

報道指出，恢復進口是中日政府協商的成果，有人擔憂政治因素造成開倒車的局面。日本農相小泉進次郎原定本月與中國農業農村部部長韓俊在日本舉行會談，惟疑受台灣官員上月訪日影響而未能實現，雙方圍繞農水產品磋商的進展仍存不確定性。"
bkn-20250826103624005-0826_00822_001,因大浪關係　港島大浪灣泳灘及離島貝澳泳灘懸掛紅旗,2025-08-26 10:36,2025-08-26 10:36,https://hk.on.cc/cnt/news/20250826/bkn-20250826103624005-0826_00822_001.html,因大浪關係　港島大浪灣泳灘及離島貝澳泳灘懸掛紅旗,香港,oncc,2025-08-26 10:45,康樂及文化事務署今日（26日）宣布，由於大浪關係，港島南區的大浪灣泳灘，以及離島區的貝澳泳灘已懸掛紅旗，顯示在該處游泳會有危險，市民請勿在該處游泳。
bkn-20250826102236791-0826_00822_001,屯門命案男子伏屍橋底　疑涉私煙利益糾紛8人落網,2025-08-26 10:22,2025-08-26 15:22,https://hk.on.cc/cnt/news/20250826/bkn-20250826102236791-0826_00822_001.html,屯門命案男子伏屍橋底　疑涉私煙利益糾紛8人落網,香港,oncc,2025-08-26 15:30,"昨日（25日）一名姓曾(51歲)本地男子頭部受傷、滿身鮮血，伏屍於屯門藍地亦園路近港深西部公路橋底，其附近停泊的一輛七人車亦染有血漬，案件列作「謀殺」。消息指，執法部門經調查後拘捕8人，他們分別涉嫌「謀殺」、「非法禁錮」及「協助罪犯」，初步相信涉私煙利益糾紛。

據悉，事主居住在兇案現場附近，懷疑他曾被人用刀襲擊，其後腦有明顯傷痕，不排除是致命傷，而他被發現的地點估計並非案發第一現場。現場停泊的一輛七人車內和車尾，以及地面發現血漬，估計與案有關。"
bkn-20250826100230126-0826_00822_001,「美人魚」現身永暑礁　內地科學家首次發現,2025-08-26 10:02,2025-08-26 10:02,https://hk.on.cc/cnt/news/20250826/bkn-20250826100230126-0826_00822_001.html,「美人魚」現身永暑礁　內地科學家首次發現,中國,oncc,2025-08-26 10:15,"內地科研人員近期在南沙群島永暑礁近岸海域，發現人稱「美人魚」的國家一級保護動物儒艮。這不只是科研人員首次在永暑礁近岸海域發現極度瀕危物種儒艮的持續活動蹤迹，更是近30年來南沙群島及南海中部海域首次有科學影像佐證的儒艮活體紀錄。

南沙群島永暑礁駐島環保部門與中國科學院島礁綜合研究中心上周三（20日）發布消息稱，7月8日，永暑礁駐島環保部門巡視人員首次在海島西南方海域發現浮在海面換氣的儒艮，並在其後近一個月內持續觀測到其在該海域的活動。8月2日至3日，巡視人員與駐島科研人員兩次近距離觀測到儒艮在該海域活動，並拍下影像。

儒艮是海牛目儒艮科唯一現存海洋物種，因雌獸懷抱幼崽哺乳的姿態被民間稱為「美人魚」，是地球上最古老的海洋哺乳動物之一，主要分布於印度洋和西太平洋的淺海區域，在國際自然保護聯盟瀕危物種紅色名錄中被列為易危物種。中國科學院南海海洋研究所研究員表示，此次發現為研究全球變化和人類活動雙重影響下該物種的跨海域遷徙擴散提供了關鍵線索。連同早前在永暑礁附近發現國家一級保護動物綠海龜、玳瑁的活動蹤迹，凸顯了永暑礁島礁生態系統的獨特價值。另儒艮常以2至3頭的家族群形式出現，此次為何單獨「流浪」，尚待監測研究。"
bkn-20250826100129113-0826_00822_001,據報李成鋼本周赴美　開展新一輪貿易會談,2025-08-26 10:01,2025-08-26 10:01,https://hk.on.cc/cnt/news/20250826/bkn-20250826100129113-0826_00822_001.html,據報李成鋼本周赴美　開展新一輪貿易會談,中國,oncc,2025-08-26 10:45,"美國《華爾街日報》周二（26日）引述消息報道，中國商務部國際貿易談判代表兼副部長李成鋼將於本周赴美，與美國貿易及財政部官員舉行新一輪貿易會談，並與美國商界代表交流。

知情人士透露，李成鋼將前往美國首都華盛頓，參加預計在當地舉行的首輪談判，會見美國貿易代表格里爾或其副手，以及美國財政部高級官員。中美雙方正尋求在延長的關稅休戰期內，建立定期對話機制。

知情人士預計，李成鋼將與美方討論大豆採購問題，並敦促美方放寬對華技術出口限制。在有關大豆和波音飛機的談判中，中方可能繼續要求特朗普普政府取消與鴉片類藥物芬太尼相關的20%關稅。"
bkn-20250826095059410-0826_00822_001,山寨水中標公司財務狀況差　議員：應交盡職調查報告防粉飾數據,2025-08-26 09:50,2025-08-26 09:50,https://hk.on.cc/cnt/news/20250826/bkn-20250826095059410-0826_00822_001.html,山寨水中標公司財務狀況差　議員：應交盡職調查報告防粉飾數據,香港,oncc,2025-08-26 10:30,"「山寨水」招標涉詐騙政府事件，對於外界質疑為何沒有調查相關公司的財務情況，政府解畫後仍然未能釋疑。會計界議員黃俊碩指建議中標公司在開標後的3至4個月內需要提交由獨立會計師提供的盡職調查報告，防止有關公司為求中標「粉飾」財務數據，確保中標公司的可靠性。

黃俊碩在一個電視節目中指出，今次事件中有人懷疑向政府提交懷疑虛假的水質測試證明書，顯示採購程序中的報告核實環節存在風險，故政府有需要優化檢查機制，並政府有需要優化檢查機制，如要求檢測報告內要加入二維碼等科技標識，讓相關人員掃描後連結至獨立系統，核實提交報告的機構及內容是否屬實，從而遏止造假行為。

針對處理招標程序，他認為政府日後應採取一個風險為本的審批原則，即是除在審批標書時要加強查核投標公司的背景，以及其提交的資料真偽外，對於新中標而未有往績的公司，以及涉及金額較大的合約，批出合約後亦應繼續進行更為深入的審核，確保提供的貨品或服務符合標書要求。

他建議可倣效不少海外國家及地區的做法，日後物流署向新中標的供應商批出標書後，中標公司在開標後的3至4個月內需要提交由獨立會計師提供的盡職調查報告，防止有關公司為求中標「粉飾」財務數據，確保中標公司的可靠性。

另一議員何敬康指政府應盡快檢視招標程序，當看到制度上有問題時，市民會說有沒有官員需要問責，而他認為當務之急不是追究責任之時，未來上至大型基建，下至廁所買廁紙，均應使用同一個招標制度。"
