id,title,date,last_update,url,lead,section,source,scrape_time,news_content
bkn-20250826033538367-0826_00822_001,奪命工業意外頻繁　今歲至少10單,2025-08-26 03:35,2025-08-26 03:35,https://hk.on.cc/cnt/news/20250826/bkn-20250826033538367-0826_00822_001.html,奪命工業意外頻繁　今歲至少10單,香港,oncc,2025-08-26 03:45,"本港致命工業意外不斷，2021年至2024年間每年均逾20宗，其中2021年及2022年皆為25宗，2023年及2024年則分別為24宗和22宗，反映工業安全未見明顯改善。而本年至今已錄至少10宗致命工業意外，其中過半數都與建造業相關，涉及從高處墮下、被物件擊中及機械意外。

今年1月20日，一名工人在跑馬地獨立屋天台進行冷氣工程時，從木梯墮地導致重創頭部死亡。同月24日，一名燒焊工人於火炭一個地盤工作期間，下方支撐的工字鐵突然斷裂，事主雖已繫上安全帶，卻仍連人帶車一同墮下，安全帶亦告斷開，最終由4米高墮地死亡。翌月一名工人於屯門遭一台挖土機的剷斗擊中，3天後終告不治。相隔3個月，一名工人於粉嶺一幢大廈外牆的竹棚上懸掛尼龍網時，從金屬雨篷墮下致死。不足兩周，另一名男子於上水一間獨立屋約3米高簷篷維修時，疑失足跌落泳池遇溺，送院後不治。

時至7月，一名黃姓男工人於赤鱲角順匯路一個地盤工作期間，被倒塌的工字鐵擊中後當場死亡，當時紅色暴雨警告正在生效，疑因惡劣天氣導致工字鐵倒塌。同月27日，薄扶林瑪麗醫院臨床大樓地盤，一名梁姓男工在地牢攀爬升降機槽至地面維修電力裝置時，被突然下降的升降機壓在槽內動彈不得且陷入昏迷，經搶救後證實不治。"
bkn-20250826033034521-0826_00822_001,東方日報A1：地盤淪墳場　催工致命傷,2025-08-26 03:30,2025-08-26 03:30,https://hk.on.cc/cnt/news/20250826/bkn-20250826033034521-0826_00822_001.html,東方日報A1：地盤淪墳場　催工致命傷,香港,oncc,2025-08-26 03:45,"本港近年工業意外傷亡數字持續高企，當中建築工地更是每月幾乎出現一宗死亡個案，情況令人憂慮。根據去年工作期間猝死個案分析，全港67宗個案中，有18宗發生在建造業，佔整體個案近30%，而今年至今已發生至少8宗致命意外（詳見表）。建造業議會在昨日舉行的「建造業安全周2025開幕典禮暨研討會」上，公布早前進行的問卷調查結果，發現「趕工」、「催工」文化對建造安全影響最大，不足六成人不接受不安全施工，更有7.5%人認為趕工要緊而忽視安全方案。其次為前線人員及管理人員心態，因此希望建造業持份者推廣及加強宣揚「零意外」的目標，並鼓勵業界全面落實建造安全早會。

有關問卷訪問2,200名工人及前線管理人員，發現對安全構成最大危害的因素，依次為工程趕急催工文化、前線人員及管理人員心態、忽略安全施工方案、忽略實際施工方法、高層參與安全管理方式及態度，以及惡劣天氣工地環境。當中，只有58.6%人在地盤趕工的情況下，不接受不安全施工方法，反映有近半工人將趕工凌駕於安全之上。

問卷亦設有發現空洞及有工具掉入空洞時的處理方式等情景題，結果有13.8%工友選擇明顯錯誤的答案，例如近一成人（9.1%）在工地尋找覆蓋孔洞的物料後就繼續開工，甚至有4.7%人當無事發生，繼續開工，可見前線員工安全意識有待加強。

至於建造安全文化的自身義務方面，14%工人認為沒有義務執行「動態風險評估」，6%前線管理人員認為沒有義務帶領工人執行該評估，4%前線管理人員認為沒有義務監督工人安全地施工。同時，超過90%受訪者同意引入建築設計安全、建立鼓勵及表揚制度，以及提供安全培訓等措施均可提升安全水平。

建造業議會主席何安誠表示，讓建築設計安全成為習慣，可從源頭消除或降低風險，當中以物理上移除危害成效最高，使用個人防護裝備僅為最後防線。何亦鼓勵業界全面落實建造安全早會，例如進行伸展運動、分析業界意外成因，以及提出安全建議。發展局局長甯漢豪表示，政府鼓勵建造業界全面採用安全智慧工地系統「4S」以加強安全管理，而建造業創科基金去年9至11月，將合資格申請安裝系統資助的對象擴展至機械租賃公司，至今已有超過85%參與公私營工程的流動機械及塔式起重機擁有人申請基金安裝警報系統。甯又指至今有超過600個工地地盤獲得「4S」標誌。

勞工界議員林振昇則認為，發生意外往往不是單方面責任，有時一些散工短時間內到多個工地工作，未必太了解各工地的安全措施，而地盤監工亦可能假定對方有足夠經驗而未有詳細解說。林又提及現時小型工程如外牆防漏工程，因涉及俗稱「飛棚」的搭建吊棚工序，有一定意外風險但卻毋須申報，因此建議要求有關工程亦需向勞工處申報，以便巡查和監管。

此外，勞工處去年修訂《密閉空間工作的安全與健康工作守則》，加強密閉空間工作的安全及健康，林認為，處方應檢視更多其他工作守則，例如吊運工作，並作出與時並進的修訂，以改善各類工作的安全指引。

更多新聞，請瀏覽東方日報網頁：

http://orientaldaily.on.cc/"
bkn-20250826033028695-0826_00822_001,《東方日報》今日要聞,2025-08-26 03:30,2025-08-26 03:30,https://hk.on.cc/cnt/news/20250826/bkn-20250826033028695-0826_00822_001.html,《東方日報》今日要聞,香港,oncc,2025-08-26 03:45,一貼睇晒《東方日報》A1新聞頭條、B1財經要聞及C1娛樂最爆，以及東網嚴選的本港、兩岸及國際重點新聞，名家評論，讓你在最短時間掌握最重要資訊。
bkn-20250826030209373-0826_00822_001,青少年極限減肥成風　衍生一系列健康問題,2025-08-26 03:02,2025-08-26 03:02,https://hk.on.cc/cnt/news/20250826/bkn-20250826030209373-0826_00822_001.html,青少年極限減肥成風　衍生一系列健康問題,北京,oncc,2025-08-26 03:15,"暑假期間，部分內地青少年採取通過極端節食、偏執運動等盲目減肥，衍生一系列身體問題。同時部分減肥產品商家和機構把目光瞄向未成年人，讓正成長發育的未成年人追求過度瘦。

14歲北京初中少女王婷（化名）在暑假剛開始時制定減肥目標，至少瘦到35公斤。她一開始只戒掉零食，克制只吃三餐，減少每餐飯量，堅決不盛第二碗。由於減肥進展不明顯，她漸漸對米飯產生恐懼，「連正餐也不敢吃，吃一小塊肉，我會焦慮一整天」。經過一個多月，她雖達到預定體重目標，但走兩步路就喘氣，晚上失眠，做任何事都提不起精神。

讓王婷燃起減肥念頭的，是她在社交平台上頻繁看到的「女孩要有小蠻腰，超過兩指寬就是粗腰了」、「白幼瘦才是極品審美」之類的貼文和短片。四川某減重機構推出暑期減重活動，強調身材體重對青少年的重要性，着重展示胖瘦前後對比圖，配有口號「到學校都自信了」等。更有減肥博主倡導青少年斷食，每天要長時間保持飢餓狀態。"
bkn-20250826023558758-0826_00822_001,觀塘女子家中暈倒　送院不治,2025-08-26 02:35,2025-08-26 02:35,https://hk.on.cc/cnt/news/20250826/bkn-20250826023558758-0826_00822_001.html,觀塘女子家中暈倒　送院不治,香港,oncc,2025-08-26 03:00,觀塘女子家中暈倒亡。今(26日)零時12分，高超道32號一單位有男子報案，指懷疑其(46歲)妻子在上址一洗手間暈倒。人員接報到場，女事主昏迷被送往聯合醫院治理，其後被證實死亡。其死因有待驗屍後確定。
bkn-20250826020335343-0826_00822_001,傳男客刁難致空姐離職　川航稱是兩件事,2025-08-26 02:03,2025-08-26 02:03,https://hk.on.cc/cnt/news/20250826/bkn-20250826020335343-0826_00822_001.html,傳男客刁難致空姐離職　川航稱是兩件事,四川,oncc,2025-08-26 02:15,"近日網傳四川航空一名白金卡男會員要求協助擺餐遭拒後刁難乘務組，並多次騷擾乘務員導致一名空姐離職。川航工作人員周日（24日）透露，辭職乘務員並非擺餐事件當事人。

網傳消息指，男會員多次找乘務組聊天要求添加聯絡方式，如不通過申請就會投訴；他之前多次乘坐川航航班，用各種理由投訴乘務組，並騷擾在職乘務員，逼得對方離職。川航官方客服工作人員確認，該旅客確實為白金卡會員，航空公司初步核查，乘務員當時拒絕旅客提出關於協助晚餐不合理訴求後，航空安全員接到乘務組反饋並介入處置，旅客回到座位。

川航其後回應稱，當班機組在事件過程中操作符合公司規範，並呼籲廣大旅客文明乘機，遵守客艙秩序，共同維護安全有序的出行環境。"
bkn-20250826015015724-0826_00822_001,黃大仙私家車逆線行駛　揭男司機藏依托咪酯被捕,2025-08-26 01:50,2025-08-26 10:00,https://hk.on.cc/cnt/news/20250826/bkn-20250826015015724-0826_00822_001.html,黃大仙私家車逆線行駛　揭男司機藏依托咪酯被捕,香港,oncc,2025-08-26 10:15,今日(26日)凌晨1時許，警員巡邏期間在黃大仙沙田㘭道近彩虹道交界，發現一輛私家車逆線行駛，遂把其截停調查，30餘歲男司機神色慌張，人員在其身上搜出一支「依托咪酯」電子煙彈，其後人員帶同緝毒犬到場協助搜查，惟再無發現任何毒品。涉案男子被捕帶署扣查。
bkn-20250826012624431-0826_00822_001,長洲復康舍兩院友爭執　一人涉持刀傷人被捕,2025-08-26 01:26,2025-08-26 01:26,https://hk.on.cc/cnt/news/20250826/bkn-20250826012624431-0826_00822_001.html,長洲復康舍兩院友爭執　一人涉持刀傷人被捕,香港,oncc,2025-08-26 02:00,"長洲發生持刀傷人案。昨午(25日)6時44分，現場為石鼓洲一間復康院舍，有職員報案，指一名姓潘(40歲)與另一名姓李(29歲)院友，在上址發生言語衝突，期間潘懷疑以一把長約28厘米廚房刀的刀柄襲擊李；李的肩部在混亂間被刀峰割到受傷，清醒被送往長洲醫院治理。

人員接報到場，經初步調查，潘涉嫌傷人被捕，現正被扣留調查。"
bkn-20250826010545206-0826_00822_001,原北京軍區司令員李新良病逝　終年89歲,2025-08-26 01:05,2025-08-26 01:05,https://hk.on.cc/cnt/news/20250826/bkn-20250826010545206-0826_00822_001.html,原北京軍區司令員李新良病逝　終年89歲,北京,oncc,2025-08-26 01:30,"內地官媒周一（25日）報道，正大軍區職退休幹部、原北京軍區司令員李新良，因病醫治無效，於8月13日在北京離世，終年89歲。

李新良是山東萊陽人，1953年入伍，歷任排長、參謀、科長、團參謀長、副師長、師長、廣西軍區司令員、廣州軍區副司令員，瀋陽軍區政治委員、司令員等職。

李新良是中國共產黨第十三次、十四次、十五次全國代表大會代表，中國共產黨第十三屆、十五屆中央委員會委員，第九屆、十屆全國人民代表大會代表，第十屆全國人民代表大會常務委員會委員、內務司法委員會副主任委員。他1988年獲授少將軍銜，1993年晉升為中將軍銜，1998年晉升為上將軍銜。"
bkn-20250826001600887-0826_00822_001,葵涌截毒品快餐車　檢近3萬貨,2025-08-26 00:16,2025-08-26 00:16,https://hk.on.cc/cnt/news/20250826/bkn-20250826001600887-0826_00822_001.html,葵涌截毒品快餐車　檢近3萬貨,香港,oncc,2025-08-26 00:45,"警員昨日（25日）在葵青區內進行反毒品行動，在葵涌邨截查一名可疑男子，並在其駕駛的輕型貨車內檢獲約8克懷疑可卡因、約30克懷疑氯胺酮、約13克懷疑「冰」毒及一個「冰」壺。行動中檢獲的毒品總市值約29,500港元。

該名姓張(43歲)本地男子涉嫌「販運危險藥物」及「藏有工具可作吸食用途」被捕，現正被扣留調查。"
bkn-20250826000036304-0826_00822_001,國家育兒補貼即將發放　部分母嬰用品漲價,2025-08-26 00:00,2025-08-26 00:00,https://hk.on.cc/cnt/news/20250826/bkn-20250826000036304-0826_00822_001.html,國家育兒補貼即將發放　部分母嬰用品漲價,中國,oncc,2025-08-26 00:15,"內地近期發布育兒補貼政策，每年向符合條件的3歲以下嬰幼兒發放3,600元（人民幣，下同，約3,920港元）。在補貼即將兌現之際，眾多父母發現奶粉、紙尿片等母嬰用品價格上漲，不少知名品牌被指借機牟利。

湖北武漢的韓女士透露，一直購買的嬰幼兒配方奶粉近兩個月漲價，一款從每罐200元（約217港元）漲到260元（約283港元），另一款從每罐145元（約157港元）漲到190元（約206港元）。她近日在小區附近一家母嬰店選購奶粉，上午付款時，商家承諾次日調貨到位，結果當天下午突然說要退款，並建議加錢換新包裝產品，理由是貨源緊張。

部分商家否認漲價，武漢3家母嬰門店店員均表示店內奶粉價格近2個月並無波動。網購平台某國產知名品牌客服指，官方從未主動調價，價格波動是因為平台促銷活動結束，優惠力度變化導致。業內人士透露，線上平台價格體系複雜，同一時段漲跌現象並存。此輪母嬰用品調價時間與育兒補貼政策發布時段較為接近，難免引發公眾聯想。"
bkn-20250825230016687-0825_00822_001,鎢合金加熱至逾3100℃　刷新世界紀錄,2025-08-25 23:00,2025-08-25 23:00,https://hk.on.cc/cnt/news/20250825/bkn-20250825230016687-0825_00822_001.html,鎢合金加熱至逾3100℃　刷新世界紀錄,中國,oncc,2025-08-25 23:15,"中國空間站航天員近日成功利用無容器材料實驗櫃，將鎢合金加熱至超過3,100℃，刷新世界紀錄之餘，亦幫助科學家收集到極端耐熱材料在超高溫下的寶貴數據，為中國新型耐熱材料的設計鋪路。

無容器材料實驗櫃位於天和核心艙，過去4年被航天員用來研究能抵禦火箭發動機烈燄的鎢合金、鈮合金等新型材料，是次加熱溫度幾乎接近太陽表面溫度的一半，意味未來太空材料實驗樣品選擇範圍也將進一步擴大，未來不僅能幫助火箭抵禦極度高溫，也可以化作火箭發動機的「心臟」。在今次實驗中，中國空間站已取得兩大關鍵技術突破，實驗櫃透過靜電場產生的力能將金屬穩穩地托住、懸在半空，確保金屬完全脫離容器的接觸，既不沾染雜質也不被干擾；實驗櫃的雙波長激光系統可以利用半導體激光強攻金屬表面，二氧化碳激光負責滲透加熱內部，再配合300瓦的大功率輸出突破鎢合金熔點。

西北工業大學物理科學與技術學院教授胡亮介紹，在空間站做鎢合金實驗，主要是兩方面原因。空間站提供的微重力條件，可以使金屬鎢熔化之後達到一個非常標準的球形狀態，這對於精確獲取物理化學性質非常有利；因為鎢的密度非常高，如果加上其他元素之後，在地面上製備會出現分層、不均勻的現象，在空間站則不會出現類似問題。"
bkn-20250825224558895-0825_00822_001,東九龍反黑工　20人被捕包括僱主,2025-08-25 22:45,2025-08-25 22:45,https://hk.on.cc/cnt/news/20250825/bkn-20250825224558895-0825_00822_001.html,東九龍反黑工　20人被捕包括僱主,香港,oncc,2025-08-25 23:15,東九龍區執法部門聯同相關部門人員今日(25日)展開代號「冠軍」的反非法勞工聯合行動，突擊搜查區內多個罪案黑點。行動中，3男3女本地人、10男3女內地人、以及一名印尼籍男子，年齡介乎19至68歲，分別涉嫌「僱用不可合法受僱的人」、「違反逗留條件」及「協助及教唆他人違反逗留條件」等罪名被捕。所有被捕人現正被扣留調查，部分被捕人稍後交由相關部門跟進。
bkn-20250825222511653-0825_00822_001,慈雲山搗賣淫場所　拘3女主持檢按摩油,2025-08-25 22:25,2025-08-25 22:25,https://hk.on.cc/cnt/news/20250825/bkn-20250825222511653-0825_00822_001.html,慈雲山搗賣淫場所　拘3女主持檢按摩油,香港,oncc,2025-08-25 22:45,"黃大仙區警員經深入調查後，今日(25日)下午約5時半展開掃黃行動，突擊搜查慈雲山銀鳳街一單位，搗破一個懷疑賣淫場所，拘捕一名52歲本地女子，涉嫌「管理賣淫場所」；另外2名本地女子(43及48歲)，則涉嫌「協助管理賣淫場所」被捕。行動中，檢獲按摩油、一次性床單及毛巾等證物。所有被捕人現正被扣留調查。

根據香港法例第200章《刑事罪行條例》第139條《經營賣淫場所》，任何人將任何處所、船隻或地方經營作賣淫場所，或管理或協助管理，或以其他方式掌管或控制經營作賣淫場所的處所、船隻或地方，即屬犯罪，一經定罪，最高刑罰可處罰監禁10年。"
bkn-20250825222015554-0825_00822_001,黃大仙生果店閉門失火　冒出大量濃煙,2025-08-25 22:20,2025-08-25 22:20,https://hk.on.cc/cnt/news/20250825/bkn-20250825222015554-0825_00822_001.html,黃大仙生果店閉門失火　冒出大量濃煙,香港,oncc,2025-08-25 23:15,今晚(25日)近10時，黃大仙雙鳳街2號一間生果店，閉門失火兼冒出大量黑煙，途人發現報案。消防到場後，以電鋸鎅開鐵閘，然後入內開喉灌救，且把火撲滅，起火原因待查。
bkn-20250825221747831-0825_00822_001,跨部門灣仔掃黃　6內地女違逗留條件被捕,2025-08-25 22:17,2025-08-25 22:17,https://hk.on.cc/cnt/news/20250825/bkn-20250825221747831-0825_00822_001.html,跨部門灣仔掃黃　6內地女違逗留條件被捕,香港,oncc,2025-08-25 22:30,"灣仔區警員聯同相關部門人員，根據線報及經深入調查後，今日(25日)下午於區內展開代號「虎尾」、「雷霆」、「捍衞者」及「智鼓」的掃黃行動，突擊搜查灣仔道、告士打道及駱克道多個樓上單位。行動中，人員共拘捕6名內地女子(20至53歲)，涉嫌「違反逗留條件」。所有被捕人現正被扣留調查，稍後將交由相關部門跟進。

根據香港法例115章《入境條例》第38AA條，非法入境者、受遣送離境令或遞解離境令規限的人、逾期逗留或被拒絕入境人士不得接受有薪或無薪的僱傭工作、開辦或參與任何業務，一經定罪，最高可被判罰款5萬港元及監禁3年。另外，僱主若僱用不可合法受僱的人，而該人是非法入境者、受遣送離境令或遞解離境令規限的人、逾期逗留或被拒入境人士，最高刑罰為罰款50萬港元及監禁10年。"
bkn-20250825220101694-0825_00822_001,罵信訪市民「老糊塗」　官員遭批評教育,2025-08-25 22:01,2025-08-25 22:01,https://hk.on.cc/cnt/news/20250825/bkn-20250825220101694-0825_00822_001.html,罵信訪市民「老糊塗」　官員遭批評教育,湖南,oncc,2025-08-25 22:15,"湖南省岳陽市湘陰縣早前有七旬老人信訪申訴，遭鎮政府及信訪辦官員多次被用「老東西」、「老不死」、「老糊塗」等侮辱性字眼攻擊。當地政府回應稱，已對涉事官員進行嚴肅批評教育。

本月12日有市民反映，湘陰縣新泉鎮紀委書記與信訪辦主任吳某在青龍橋村委會，對72歲的信訪人李某某進行「回訪」時，對該老人破口大罵，呼籲當局立即介入調查，公開涉事幹部的處理結果。

新泉鎮人民政府上周五（22日）回應稱，經調查核實，新泉鎮紀委書記及信訪辦主任吳某在向李某某解釋國家信訪條例相關政策時，由於吳某和李某某在主觀認識上存在差異，再加上雙方溝通方式不夠細緻周全，進而產生分歧。鎮分管信訪工作的領導和鎮紀委書記已責令吳某深刻反省，其已上門向李某某賠禮道歉。"
bkn-20250825214558833-0825_00822_001,「支付平台客服」詐騙案猖獗　過去3日17人共被呃逾340萬元,2025-08-25 21:45,2025-08-25 21:45,https://hk.on.cc/cnt/news/20250825/bkn-20250825214558833-0825_00822_001.html,「支付平台客服」詐騙案猖獗　過去3日17人共被呃逾340萬元,澳門,oncc,2025-08-25 22:00,"假冒「支付平台客服」詐騙案頻生，澳門執法部門上周五至昨日(22日至24日)期間接獲17宗相關案件。17名事主接獲騙徒電話並按指示提供銀行及個人資料，最終被騙3,000澳門元至130萬澳門元不等，合共損失超過340.5萬澳門元。

案中17名事主分別為16名當地居民（6男10女）及1名內地女子，年齡介乎18歲至70歲，各人上周四至前日(21日至23日)先後收到「淘寶客服」電話，被指平台「支付安全保障保險」到期，並轉接至另一「客服」協助辦理取消保險手續。各事主按指示點擊特定網址，在網站內填寫個人及銀行賬戶資料，騙徒又以驗證賬戶為由，要求各事主同屏交易及轉賬截圖。

各事主銀行賬戶及信用卡被轉賬及消費，懷疑被騙向執法人員報案，各人損失3,000澳門元至130萬澳門元不等，17宗案件合共涉及3,405,920澳門元，案件有待人員調查。"
bkn-20250825211710947-0825_00822_001,青衣婦人住所燒炭　丈夫發現救唔番,2025-08-25 21:17,2025-08-25 21:17,https://hk.on.cc/cnt/news/20250825/bkn-20250825211710947-0825_00822_001.html,青衣婦人住所燒炭　丈夫發現救唔番,香港,oncc,2025-08-25 21:45,"今日(25日)傍晚6時09分，青衣青敬路75號宏福花園，一名男子報案指其姓黎(59歲)妻子，在寓所廁所內燒炭。救援人員接報到場，在黎婦身旁發現2盆燒過的炭，她亦陷入昏迷，被送往仁濟醫院經搶救後宣布死亡。警員於現場檢獲遺書，得悉黎婦有情緒病，不排除她因病厭世。案件列「自殺」處理。

防止自殺求助熱線：

香港撒瑪利亞防止自殺會： 2389 2222

生命熱線： 2382 0000

社會福利署： 2343 2255

撒瑪利亞會熱線(多種語言)： 2896 0000

醫管局精神健康專線： 2466 7350

明愛向晴軒： 18288

東華三院芷若園： 18281

「情緒通」熱線： 18111

賽馬會青少年情緒健康網上支援平台「Open噏」： http://www.openup.hk"
