id,title,date,last_update,url,lead,section,source,scrape_time,news_content
bkn-20260210200438005-0210_00822_001,荊州李埠長江公鐵大橋主塔封頂　預計2028年通車,2026-02-10 20:04,2026-02-10 20:04,https://hk.on.cc/cnt/news/20260210/bkn-20260210200438005-0210_00822_001.html,荊州李埠長江公鐵大橋主塔封頂　預計2028年通車,湖北,oncc,2026-02-10 20:15,"湖北省荊州李埠長江公鐵大橋南北主塔周一（9日）全部封頂，這項工程下一步正式轉入上部結構施工階段。

荊州李埠長江公鐵大橋主跨1,120米，是世界最大跨度雙層斜拉—懸索協作體系橋樑。大橋採用「一橋三用」的分層設計：上層搭載二廣高速改線，按雙向六車道高速公路標準建設，設計時速100公里；下層中間預留荊州至岳陽雙線高速鐵路，兩側為一級公路，兼顧城市交通功能，其中鐵路採用時速350公里高速鐵路標準（跨江主橋時速250公里)，公路採用雙向四車道一級公路標準，設計時速60公里。

大橋預計2027年5月份合龍，2028年建成通車，屆時將串聯起二廣高速、荊荊高鐵與荊州城市路網。"
bkn-20260210200033132-0210_00822_001,東網直播六合彩攪珠　今期頭獎1900萬元！,2026-02-10 20:00,2026-02-10 20:00,https://hk.on.cc/cnt/news/20260210/bkn-20260210200033132-0210_00822_001.html,東網直播六合彩攪珠　今期頭獎1900萬元！,香港,oncc,2026-02-10 20:15,"「on.cc東網」今晚9:30直播六合彩攪珠，9:15就截止投注喇，大家快快把握機會，頭獎估計1注獨中，彩金可達1900萬港元。記得睇喇！

收看直播，請按直播ICON，或按下面鏈結：

https://tv.on.cc/newslive2　"
bkn-20260210195318240-0210_00822_001,波蘭美國部分地區爆禽流感　疫區禽產品禁進口本港,2026-02-10 19:53,2026-02-10 19:53,https://hk.on.cc/cnt/news/20260210/bkn-20260210195318240-0210_00822_001.html,波蘭美國部分地區爆禽流感　疫區禽產品禁進口本港,香港,oncc,2026-02-10 20:15,"食物環境衞生署食物安全中心今日(10日)宣布，因應世界動物衞生組織通報，指波蘭和美國部分地區爆發高致病性H5N1禽流感，中心即時指示業界暫停從有關地區進口禽肉及禽類產品包括禽蛋，以保障本港公眾健康。

有關地區為波蘭的庫亞維波美拉尼亞省Bydgoszcz區、瓦爾米亞馬祖里省Giżycko區、西波美拉尼亞省Stargard區；美國的新澤西州Burlington縣、蒙大拿州Carbon縣及愛荷華州Kossuth縣。

根據政府統計處的資料，本港去年從波蘭進口約2,890公噸冷藏禽肉，以及從美國進口約54,830公噸冰鮮和冷藏禽肉及約433萬隻禽蛋。

中心已就事件聯絡波蘭和美國當局，並會繼續密切留意世界動物衞生組織及有關當局發出關於爆發禽流感的消息，因應當地疫情發展，採取適當行動。"
bkn-20260210194033888-0210_00822_001,輕鐵蔡意橋站不慎跌落路軌　輪椅婦受傷送院,2026-02-10 19:40,2026-02-10 19:40,https://hk.on.cc/cnt/news/20260210/bkn-20260210194033888-0210_00822_001.html,輕鐵蔡意橋站不慎跌落路軌　輪椅婦受傷送院,香港,oncc,2026-02-10 20:15,屯門輕鐵蔡意橋站有人跌落路軌，今日(10日)下午4時29分，一名姓崔(44歲)輪椅女子在該輕鐵站月台操作輪椅不當跌落路軌，她左腳、下巴及前額受傷，清醒送屯門醫院治理。案件列為有人意外受傷。
bkn-20260210193235192-0210_00822_001,沙田電單車的士相撞　鐵騎士受傷送院,2026-02-10 19:32,2026-02-10 19:32,https://hk.on.cc/cnt/news/20260210/bkn-20260210193235192-0210_00822_001.html,沙田電單車的士相撞　鐵騎士受傷送院,香港,oncc,2026-02-10 20:00,"沙田發生交通意外。今日(10日)傍晚6時許，一輛的士及一輛電單車均沿大埔公路沙田嶺段往深水埗方向，行至畢架．金峰對開位置相撞，其中鐵騎士受傷清醒，被送往沙田威爾斯親王醫院治理。

網傳圖片所見，電單車意外後嚴重損毀，連同的士脫落的尾泵把橫亘路中，零件碎片等散落一地。涉事路段一度需臨時改為單線雙程行車。"
bkn-20260210191241374-0210_00822_001,網紅食品自嗨鍋遭申請破產　曾10分鐘售500萬桶,2026-02-10 19:12,2026-02-10 19:12,https://hk.on.cc/cnt/news/20260210/bkn-20260210191241374-0210_00822_001.html,網紅食品自嗨鍋遭申請破產　曾10分鐘售500萬桶,浙江,oncc,2026-02-10 19:15,"內地自熱火鍋龍頭品牌自嗨鍋的關聯公司浙江杭州金羚羊企業管理諮詢有限公司（杭州金羚羊）近日被申請破產。自嗨鍋曾創出10分鐘內售出500萬桶的紀錄，公司估值亦一度升至75億元（人民幣，下同，約85億港元）。

內媒上周五（6日）報道，杭州金羚羊近日新增一則破產審查案件，申請人馬某去年11月與該公司陷入勞動爭議案，該公司及其法定代表人蔡紅亮被限制高消費。蔡紅亮曾創立百草味，2018年又成立了杭州金羚羊，正式創立自嗨鍋品牌。自嗨鍋一度受到資本熱捧，2018年至2021年杭州金羚羊完成五輪融資，總額逾5.5億元（約6.2億港元）。2023年，自嗨鍋市場份額大縮水，杭州金羚羊2024年因拖欠其他公司1,125萬元（約1,280萬港元）被強制執行。

截至上周五，杭州金羚羊有6條被執行人資訊，被執行金額超過1.4億元（約1.6億港元）。目前，蔡紅亮名下有16家關聯公司，僅3家處於存續狀態，包括杭州金羚羊、海南金羚羊國際貿易有限公司、金華金羚羊貿易有限公司，其餘均已被注銷。"
bkn-20260210190340181-0210_00822_001,車尾掛「法器」加舊款手機　網民問係咪防撞新招,2026-02-10 19:03,2026-02-10 19:03,https://hk.on.cc/cnt/news/20260210/bkn-20260210190340181-0210_00822_001.html,車尾掛「法器」加舊款手機　網民問係咪防撞新招,香港,oncc,2026-02-10 19:30,"在路上駕駛，經常會留意到有些車的車尾位置，掛上許多不同的裝飾或標記。近日網上討論區一張照片便引起廣泛討論。一輛私家車的車牌下方，左邊是類似「法器」的一個牌，右邊則是某款經典手提電話。

網民對此有不同揣測。有人認為「法器」尚且容易理解，可能是出於司機的宗教信仰，求「一路平安」；至於擺放舊款手機，有人就指這款手機素有「地上最強」、 「刀槍不入」甚至「防彈」的傳說。有網民甚至開玩笑說，「金牌加手機」雙重加持，絕對堪稱「地表最強泵把」。

有網民則表示，該古董手機可能是絕版貨，萬一後面有車追撞，對方分分鐘「賠到破產」。不過亦非所有人都欣賞這個「創意」。有人就質疑，萬一「法器」和手提電話，高速行駛期間鬆脫，再打向後面的車輛或電單車司機，後果不堪設想。而談及「防撞」方法，有人則認為始終離不開「小心駕駛」。"
bkn-20260210190240075-0210_00822_001,外遊雪地自駕極高危　裝雪胎增煞車距離可保命,2026-02-10 19:02,2026-02-10 19:02,https://hk.on.cc/cnt/news/20260210/bkn-20260210190240075-0210_00822_001.html,外遊雪地自駕極高危　裝雪胎增煞車距離可保命,香港,oncc,2026-02-10 19:30,"雪地自駕遊導致的意外時有所聞。去年12月有港人在日本北海道自駕遊期間，懷疑路面結冰跣胎越過對面行車線，迎頭猛撼一輛私家車，導致日本男司機受傷。有日本租車公司負責人向《東呼》表示，當地部分高速公路或特定路段，規定必需配備雪胎才能通行；又提醒若在雪地行駛，應盡量爭取早上出發，下午日落前抵達目的地。

香港工程師學會機械界別發言人梁耀彰解釋，在寒冷地區駕駛，一般會改用雪胎，而雪胎與一般輪胎的最大不同，是後者在氣溫低於攝氏7度時，物料會變硬甚至變脆，輪胎抓着力會大幅下降，若路面有積雪會很容易跣胎；反觀雪胎在低溫時不會變硬，較一般輪胎柔軟，由於柔軟物料的摩擦力較大，因此抓着力亦會更強，從而減低跣胎機會。

梁耀彰續指，雖然雪胎同樣是採用橡膠，但改用特別配方，胎紋與一般輪胎不同，雪胎的紋路較多且深，可更容易抓緊雪面。就工程角度而言，一般輪胎全新時胎紋深度約為7毫米，雪胎胎紋深度則可達9至10毫米。但如果下大雪令積雪變硬，即使使用雪胎，抓着力亦可能不足，特別是在雪山上斜，這時候就必需在輪胎上加裝雪鏈，以增加抓着力。

他又提醒，在雪地駕駛，一般建議車速應保持在時速50公里以下，並切忌突然轉向，必需緩慢轉向以減低跣胎機會。在香港，行駛通常預留三個車位的距離煞車，但在雪地至少應預留1.5至2倍的煞車距離。

日本租車公司負責人Alan表示，當地一般租車公司都會準備雪胎，但大型連鎖租車公司由於有大量車輛，不可能每一輛都配備雪胎；反而小型公司可能只有10多輛車，每輛車都提供雪胎，如客人有意租用，應事前加以確認，相關附加費因公司而異，每套每天租金約為1,500至3,000日圓。

Alan又建議，每年12月至3月期間，駕駛時均以選用雪胎，該公司甚至會強制客戶租用雪胎，因為部分高速公路或特定路段，規定必需配備雪胎才能通行，若沒有準備恐會延誤行程；另一方面，安裝雪鏈需要一定技巧，並非隨手就能安裝，不論租車時配備抑或自備雪鏈，客人應事先詢問租車公司，特別是釐清安裝雪鏈一旦導致車輛損毀，責任屬哪一方。

至於安裝雪鏈的位置亦有講究。每條公路有指定地方讓大家安裝雪鏈，換雪鏈的難度取決於雪地駕駛的經驗、時間及安裝環境是否惡劣，建議如果即將在雪地駕駛，應在正常環境下先行練習熟悉。Alan估計，今年寒流預料會持續至二月中旬，三月則主要集中在高地及北面的地方，開車前往滑雪或溫泉區時若沒有配備雪胎或雪鏈，將會很麻煩，因為積雪會掩蓋路面劃線地下排水渠、暗斜路甚至沒有欄杆的地方，建議駕駛者仔細觀察路況，事先查看地圖路線，並盡量避免夜間駕駛，最好是提早至早上7時出發，盡可能趕及下午3時或以前抵達目的地。"
bkn-20260210183653524-0210_00822_001,跨境直通救護車試行計劃　首次進行北向轉運演練,2026-02-10 18:36,2026-02-10 18:36,https://hk.on.cc/cnt/news/20260210/bkn-20260210183653524-0210_00822_001.html,跨境直通救護車試行計劃　首次進行北向轉運演練,香港,oncc,2026-02-10 19:00,"港府聯同廣東省及深圳市政府，今日(10日)就「大灣區跨境直通救護車試行計劃」進行首次北向轉運演練，模擬在載送病人的情況下，救護車跨境由伊利沙伯醫院至香港大學深圳醫院的行車路線及出入境安排。港府表示測試過程暢順，期望可於今年第一季內正式實施跨境直通救護車雙向轉運。

是次演練期間，深圳救護車先從港大深圳醫院出發，經深圳灣口岸前往伊利沙伯醫院接載病人，再經同一口岸將病人轉運至港大深圳醫院接受治療。衞生當局表示，粵港兩地政府部門順利進行由香港至深圳的首次北向轉運演練，為擴展試行計劃至雙向轉運安排奠下基礎，特區政府會繼續與相關內地部門保持緊密溝通和合作，期望可於今年第一季內正式實施跨境直通救護車雙向轉運，加快實現大灣區醫療高度融合，推動「健康灣區」發展。

「大灣區跨境直通救護車試行計劃」自2024年11月啓動以來，至今已有23名病人由深圳、珠海、南沙和澳門的指定派送醫院，即港大深圳醫院、珠海市人民醫院、中山大學附屬第一醫院南沙院區和澳門仁伯爵綜合醫院，轉運到香港指定公立醫院接受治療。而試行計劃將會持續至今年11月29日，港府指及後安排會適時公布。"
bkn-20260210182232322-0210_00822_001,秀茂坪安達邨男住戶高處墮下　當場斃命　現場檢獲遺書,2026-02-10 18:22,2026-02-10 18:22,https://hk.on.cc/cnt/news/20260210/bkn-20260210182232322-0210_00822_001.html,秀茂坪安達邨男住戶高處墮下　當場斃命　現場檢獲遺書,香港,oncc,2026-02-10 18:45,秀茂坪有人墮樓亡。今午(10日)約3時36分有途人報案，指發現一名男子倒臥在安達邨俊達樓對開，懷疑從高處墮下。救護人員接報到場，男子現場被證實死亡。警員經初步調查，相信39歲姓黃男子從上址一單位墮下。黃男為俊達樓住戶。警員於現場檢獲遺書。其死因有待驗屍後確定。
bkn-20260210182222148-0210_00822_001,東涌火炭搗2非法加油站拘2男子檢1400公升汽油,2026-02-10 18:22,2026-02-10 18:22,https://hk.on.cc/cnt/news/20260210/bkn-20260210182222148-0210_00822_001.html,"東涌火炭搗2非法加油站　拘2男子檢1400公升汽油


香港海關昨日（9日）在全港多區進行突擊巡查，打擊非法汽油活動，並偵破2宗相關案件，檢獲共約1,400公升懷疑未完稅汽油，估計市值約4.2萬港元，應課稅值約8,700港元，拘捕2人及檢取一輛涉案車輛。<br/><br/>海關人員昨午在東涌進行巡查期間，在一個鄰",香港,oncc,2026-02-10 21:00,"香港海關昨日（9日）在全港多區進行突擊巡查，打擊非法汽油活動，並偵破2宗相關案件，檢獲共約1,400公升懷疑未完稅汽油，估計市值約4.2萬港元，應課稅值約8,700港元，拘捕2人及檢取一輛涉案車輛。

海關人員昨午在東涌進行巡查期間，在一個鄰近馬路的鐵皮場內搗破一個非法加油站，檢獲約600公升懷疑未完稅汽油及一批入油工具。案件仍在調查中，不排除會有人被捕。

此外，關員昨晚在火炭進行反私油行動，於一處偏僻馬路旁破獲一個非法加油站，檢獲約800公升懷疑未完稅汽油和一批入油工具，並拘捕2名男子，分別為該非法加油站的38歲操作員、及光顧該非法加油站的32歲私家車司機，該輛私家車亦被檢取。2名被捕男子已被落案控以非法處理應課稅品的罪名。"
bkn-20260210182020948-0210_00822_001,瞞洪門宴行蹤罪成　茶行太子女上訴遭駁回,2026-02-10 18:20,2026-02-10 18:20,https://hk.on.cc/cnt/news/20260210/bkn-20260210182020948-0210_00822_001.html,瞞洪門宴行蹤罪成　茶行太子女上訴遭駁回,香港,oncc,2026-02-10 18:45,"城中名人官員於2022年1月在灣仔灣景中心一餐廳參加全國人大代表洪為民的生日派對，事後因有人染上新冠肺炎令事件曝光，更揭發部分賓客違反口罩令和無使用「安心出行」。有份出席聚會的榮源茶行太子女王詩雅事後確診，她被指隱瞞行蹤被起訴。她否認4項傳票控罪，審訊後被裁定4罪罪成，判處160小時社會服務令。王不服定罪提上訴，經早前開庭後，高院暫委法官李俊文今(10日)頒下判詞，駁回王的上訴並維持原判。李官不認同上訴方指控方須證明王要知悉要求她提供資料参衞生人員的身分，認為是有違條例的立法原意。

39歲上訴人王詩雅，原被控8項傳票控罪，其中4罪獲撤控，她現面對4項明知而向獲授權人員或衞生主任提供任何在要項上屬虛假的資料罪受審，涉及虛報2022年1月3日晚赴宴當日的行蹤。控方案情指，上訴人聲稱由家中前往灣景中心一餐廳，但其實她是從另一處前往涉案餐廳。辯方其中一個抗辯理由，是上訴人患新冠，影響認知功能。原審裁判官最終裁定，上訴人沒有因新冠肺炎而患認知障礙，她必然知道來電者是衞生署職員，判上訴人所面對的4項控罪全部罪成。

上訴方的理據指，裁判官錯誤認為控方毋須證明上訴人清楚知道致電要求提供資料的是獲授權人員；及控方未能證明致電人士確告知上訴人其身份及是依據相關法例要求她提供資料。但法官指出，《預防及控制疾病(披露資料)規例》並沒有要求上訴人須確切知悉對方法定身份。《規例》字眼僅限定資料提供對象為法定人員，而非上訴人主觀認知其身份，若要強制證明確切身份只會導致荒謬結果，有違立法原意。另外，法官又指，雖然致電者確未明言其法定身份及所依據條文，但已指明是衞生署或防護中心職員，並說明不提供資料會有法律責任，故認為已足夠。

案件編號：HCMA 145/2024"
bkn-20260210180520948-0210_00822_001,男子祭祖誤觸電網亡　民眾為捕獵擅自架設遭刑拘,2026-02-10 18:05,2026-02-10 18:05,https://hk.on.cc/cnt/news/20260210/bkn-20260210180520948-0210_00822_001.html,男子祭祖誤觸電網亡　民眾為捕獵擅自架設遭刑拘,重慶,oncc,2026-02-10 18:15,"重慶市巫山縣一名男子上周五（6日）在祭祖途中誤觸非法捕獵電網裝置身亡，警方周日（8日）指一名40歲男子於本月1日為捕獵野生動物而在山林間擅自架設涉事裝置，且未設置任何警示標誌，目前被依法刑事拘留。

死者是54歲王姓男子，遺屬指他是家庭的頂樑柱，事發當日他上山祭祖，家人發現他倒臥路邊，身旁有捕獵電網，其膝蓋處的褲子被燒破，皮膚呈現紫色。現場還有一個裝着高壓電瓶的藍色盒子，家屬聲稱電瓶電壓高達上萬伏。

警方通報，目前已會同相關部門對案發地周邊區域開展全面排查，清除非法捕獵裝置，及時消除安全隱患。"
bkn-20260210180104822-0210_00822_001,文憑試准考證今起派發　局方籲考生小心核對證上資料,2026-02-10 18:01,2026-02-10 18:01,https://hk.on.cc/cnt/news/20260210/bkn-20260210180104822-0210_00822_001.html,文憑試准考證今起派發　局方籲考生小心核對證上資料,香港,oncc,2026-02-10 18:15,"香港考試及評核局今日(10日)起，開始派發2026年香港中學文憑考試的准考證。學校考生將經所屬學校獲發准考證，而自修生的准考證則會透過郵遞方式寄出。

考評局提醒考生，收到准考證後，必須小心核對證上的個人資料、報考科目／卷別／單元及應考語文、試場名稱及地址等是否正確。考生務必依照准考證上列明的日期及時間，前往指定的試場應考。

此外，考生在應考各科考試時，必須同時出示准考證正本及香港身份證(或其他有效的身份證明文件)正本。考評局亦指，自修生若於2026年2月20日仍未收到准考證，應立即向考評局查詢。"
bkn-20260210175330070-0210_00822_001,曾被標籤「讀唔成書」陷迷惘　泳隊女將幸獲師友支持考入U,2026-02-10 17:53,2026-02-10 17:53,https://hk.on.cc/cnt/news/20260210/bkn-20260210175330070-0210_00822_001.html,曾被標籤「讀唔成書」陷迷惘　泳隊女將幸獲師友支持考入U,香港,oncc,2026-02-10 18:15,"每年都有職場新鮮人投身社會，關注學童發展權利聯席今日(10日)公布研究，揭示年輕人感到出路受限及承受巨大心理壓力。有青年親述自身經歷，曾因學業挫敗被標籤，亦有人在職場初期陷入自我懷疑。有青年呼籲，政策與社會應正視青年一代的現實處境，提供更具體實際的支援，而非僅停留在「努力就有回報」的論述。

22歲青年阿源分享其成長低谷與對未來的憂慮。她於初中至高中期間兩度留班，雖曾是游泳校隊及區隊成員，卻因學業成績被貼上「讀唔成書」標籤，感到被學校放棄，亦因辜負父母期望而深感內疚。她形容，當時校園壓力沉重，部分老師缺乏耐性，家庭回應亦未能真正理解其困境，令她一度陷入迷惘。

阿源指，幸得朋友陪伴及少數願意聆聽的老師支持，才逐步走出低谷，現已完成高級文憑並升讀學士課程。然而，她指出，即使持續升學，青年仍面對社會機會狹窄、出路受限、外勞競爭及政策支援不足等結構性困難，令不少人對前景感到不安。她呼籲，政策與社會應正視青年一代的現實處境，提供更具體實際的支援，而非僅停留在「努力就有回報」的論述，讓青年能重拾希望，面對未來。

另一名20歲、剛畢業入職的社工井川龍一分享，升上大專後，學習模式的轉變讓其難以適應。大專實習時因失誤與指摘陷入低潮。當時他對人際關係失去信心，情緒每況愈下，甚至自覺不配擔任社工。

幸而在師友鼓勵下，井川龍一勇敢求助，情況才開始好轉。隨後在一次大型社會事故的支援工作中，他親歷了自己的進步，從中找回初心，決定正式註冊為社工。他指，這段經歷讓他深信青少年需要的除了一個遠景，更是一個能容許他們學習、表達情緒與自由呼吸的當下空間。"
bkn-20260210174201420-0210_00822_001,中菲外交官員會面　同意溝通妥處涉海分歧,2026-02-10 17:42,2026-02-10 17:42,https://hk.on.cc/cnt/news/20260210/bkn-20260210174201420-0210_00822_001.html,中菲外交官員會面　同意溝通妥處涉海分歧,中國,oncc,2026-02-10 17:45,"中國和東盟國家日前就落實《南海各方行為宣言》舉行高官會，各方同意加強對話。中國外交部發言人林劍周二（10日）表示，中國和菲律賓外交官員近日會面，同意保持溝通妥處涉海分歧。

中國外交部周二舉行例行記者會，有記者問及此會談是否有助於緩解南海緊張局勢，以及菲方有否表現出解決南海問題的意願。林劍表示，中菲外交部官員近日在菲律賓宿霧舉行了雙邊會見，就涉海等共同關心的問題坦誠深入交換了意見。

林劍強調，中菲雙方同意繼續通過外交渠道保持溝通，妥善處理涉海分歧，管控好海上局勢。"
bkn-20260210173102542-0210_00822_001,港府抽查日本進口水產　輻射水平暫無發現超標,2026-02-10 17:31,2026-02-10 17:31,https://hk.on.cc/cnt/news/20260210/bkn-20260210173102542-0210_00822_001.html,港府抽查日本進口水產　輻射水平暫無發現超標,香港,oncc,2026-02-10 17:45,"日本當局自2023年8月24日起將福島核污水排放入大海，港府即日禁止當地10都縣海產進口，並每日檢測其餘地區的水產。食物環境衞生署轄下食物安全中心表示，由昨日(9日)中午截至今日(10日)中午，食安中心已對187個進口日本「水產及其製品、海藻及海鹽」的食物樣本作輻射水平檢測，未有發現輻射水平超出安全標準。

同時，漁農自然護理署已對50個本地魚產品樣本作輻射水平檢測，全部樣本的檢測同樣合格。香港天文台亦已加強監測本港水域的環境輻射水平，至目前為止，並沒有發現異常情況。

由2023年8月24日起至今日中午，食安中心及漁護署分別檢測了共203 537個日本進口食物樣本及共44 772個本地魚產品樣本作輻射水平檢測，全部樣本檢測合格。"
bkn-20260210172654979-0210_00822_001,鑽石山蒲崗村道聯營油電站啟用　私家車限時充電優惠每度2.8元,2026-02-10 17:26,2026-02-10 17:26,https://hk.on.cc/cnt/news/20260210/bkn-20260210172654979-0210_00822_001.html,鑽石山蒲崗村道聯營油電站啟用　私家車限時充電優惠每度2.8元,香港,oncc,2026-02-10 17:45,"位於鑽石山蒲崗村道的聯營油電站今日(10日)啟用，可同時為汽車提供入油及充電服務。站內最新加設兩台高速充電椿，為電動私家車、以及小巴、的士等商用車提供服務。即日起至下月15日，車主可享開幕限時優惠，私家車每度電收費2.8港元，的士每度電2.5港元。

汽車代理商英之傑與能源公司雪佛龍合作，改建位於蒲崗村道的加德士加油站，加設兩台120千瓦直流電高速充電樁，為電動車提供服務，包括私家車，以及的士、小巴等商用車。收費方面，私家車每度電收費3.8港元，的士則每度電2.66港元；油電站亦提供開幕限時優惠，即日起至下月15日，私家車每度電收費2.8港元，的士每度電收費2.5港元。此外，油電站會在每日繁忙時間，即下午3時至6時，為每支充電樁預留6個時段，供電動的士預約充電，以減省輪候時間，其餘時間則開放予所有司機使用。

環境及生態局副局長黃淑嫻在出席啟用儀式時表示，為配合電動車的增長，政府已修訂現有油站土地契約條款，為油站加裝高速充電樁提供誘因，包括批出有條件短期續約，以及豁免因為安裝充電樁而要繳交修改契約的應繳地價。她續指，根據政府評估，現有約60個油站符合安全及技術要求，當中20多個油站獲批加裝合共70支高速充電樁。"
