id,title,date,last_update,url,lead,section,source,scrape_time,news_content
bkn-20250809112200421-0809_00822_001,美國及G7盟國譴責香港緝捕潛逃者港府表示強烈不滿和反對,2025-08-09 11:22,2025-08-09 11:22,https://hk.on.cc/cnt/news/20250809/bkn-20250809112200421-0809_00822_001.html,"美國及G7盟國譴責香港緝捕潛逃者　港府表示強烈不滿和反對


​港府今日（9日）就美國、七國集團快速反應機制成員國(包括加拿大、法國、德國、意大利、日本、英國及歐盟)和關聯成員國就有關特區依法緝捕潛逃境外危害國家安全分子的不實和偏頗言論，表示強烈不滿和反對。<br/><br/>港府表示，國家安全處已於7月25日公布懸紅",香港,oncc,2025-08-09 15:45,"​港府今日（9日）就美國、七國集團快速反應機制成員國(包括加拿大、法國、德國、意大利、日本、英國及歐盟)和關聯成員國就有關特區依法緝捕潛逃境外危害國家安全分子的不實和偏頗言論，表示強烈不滿和反對。

港府表示，國家安全處已於7月25日公布懸紅通緝16名潛逃者，以及已於2024年6月和12月先後被指明為潛逃者的袁弓夷、霍嘉誌及蔡明達。這19名潛逃者在境外籌組、成立或參與一個名為「香港議會」的顛覆組織，涉嫌干犯《香港國安法》罪行。法院已應執法部門的申請，就上述19名在逃人士發出拘捕令。當局亦已於8月4日行使《維護國家安全條例》所賦予的權力，藉在憲報刊登公告，指明上述16名潛逃者，並指明針對這16名有關潛逃者施行的措施。

港府表示，該等潛藏境外的潛逃者被通緝和被法院發出拘捕令，並非因為他們「行使發表的自由」，而是因為他們在當地繼續公然從事危害國家安全的勾當。任何外部勢力及別有用心人士，在特區政府提出相關措施後，詆毀盡責、忠誠和依法維護國家安全的香港特區，實乃典型的虛偽「雙標」。"
bkn-20250809110619956-0809_00822_001,醫生疑遭網暴墮樓亡　醫療糾紛當事人曾發逾千影片及評論,2025-08-09 11:06,2025-08-09 11:06,https://hk.on.cc/cnt/news/20250809/bkn-20250809110619956-0809_00822_001.html,醫生疑遭網暴墮樓亡　醫療糾紛當事人曾發逾千影片及評論,河南,oncc,2025-08-09 12:15,"河南省周口市第六人民醫院婦產科一名女醫生日前跳樓身亡，生前疑遭遇醫療糾紛網絡暴力。短片平台抖音周五（8日）確認，3宗醫療糾紛當事人曾發表過千條相關影片及評論，近半因違反平台規則而受限制，未發現其他用戶持續規模化攻擊或不友善言論。

57歲邵醫生於8月1日晚間墜樓，最終因傷勢過重在8月2日凌晨死亡。她的丈夫指，邵醫生生前捲入3宗醫療糾紛，一宗涉及一名產婦羊水栓塞，家屬同意切除子宮保命，但在產婦誕下女嬰後，家屬要求醫院和醫生賠償100萬元（人民幣，下同，約109萬港元）。另一宗是一名產婦無視風險拒絕剖腹產，簽署風險同意書，最終子宮破裂，胎兒窒息死亡。第三宗是一名產婦的孩子出生兩天後突然因缺氧導致皮膚青紫，經搶救後治愈出院，但兩年後被確診為腦癱，醫院出示當年標準且完備的手術紀錄，但家屬認定是醫生失誤，並指控醫院篡改手術紀錄。丈夫指，面對連續7個多月網暴，妻子陷入極度無助，求告無門。

抖音公布，疑似上述醫療糾紛當事人及家屬的15個帳號，分別在2024年12月1日至2025年8月2日的4個周期內，發布89條與醫療糾紛相關影片，內容包括講述個人就醫經歷、表達維權訴求、指摘或攻擊醫院及醫生，其中76條因違反平台規則，在發布後即被平台處置限制流量不予推薦、下架、好友可見或僅自己可見。涉事帳號亦發布962條與醫療糾紛有關的評論，其中457條違反平台規則，在發布後即被平台處置為僅發布者自己可見、好友可見或置底。

此外，抖音在去年12月至今年1月共收到邵醫生及其代理人發起的48次侵權舉報，其中32次平台判定舉報成功，下架對應的19條內容，對一個重複侵權帳號給予禁投稿處罰，8次舉報處置前對應內容已刪除。近8個月內，邵醫生本人帳號共收到1.09萬多條評論，內容多為正常互動或對其醫術醫德的誇讚及支持言論。平台共排查到60條攻擊或不友善評論，其中51條均於發布當日或次日獲處置。"
bkn-20250809105501396-0809_00822_001,因大浪關係　離島區貝澳泳灘懸掛紅旗,2025-08-09 10:55,2025-08-09 10:55,https://hk.on.cc/cnt/news/20250809/bkn-20250809105501396-0809_00822_001.html,因大浪關係　離島區貝澳泳灘懸掛紅旗,香港,oncc,2025-08-09 11:15,康樂及文化事務署今日（9日）宣布，由於大浪關係，離島區的貝澳泳灘已懸掛紅旗，顯示在該處游泳會有危險，市民請勿在該處游泳。
bkn-20250809104736566-0809_00822_001,黃大仙六旬清潔男工　行人天橋頂掃落葉猝死,2025-08-09 10:47,2025-08-09 15:33,https://hk.on.cc/cnt/news/20250809/bkn-20250809104736566-0809_00822_001.html,黃大仙六旬清潔男工　行人天橋頂掃落葉猝死,香港,oncc,2025-08-09 15:45,"今晨(9日)10時08分，兩名工人於黃大仙彩竹街馬仔坑遊樂場對開行人天橋頂上，進行掃樹葉工作期間，其中一名姓黎(63歲)男工人突然暈倒昏迷，工友見狀大驚報案求助。救援人員趕至現場，登上天橋頂將事主移送至地面，交由救護車送院，惜最終不治，死因有待驗屍確定。據了解，黎居於葵涌葵芳邨。

工業傷亡權益會指，據報事主屬路政署外判道路維修合約工程雜工，日常工作包括清潔，當時正進行天橋上蓋清潔工作。家屬稱事主生前數月經常加班，每日只休息3、4小時，要求僱主交代事件。該會亦要求勞工處徹查，是否涉及工作過勞。

路政署表示，今日接獲承建商報告，一名承建商工人上午10時許，在該署轄下黃大仙馬仔坑遊樂場附近的行人天橋（結構編號：KF60）進行清理工作期間暈倒，送院搶救後不治。路政署對事件感到非常難過，並對死者家屬致以深切慰問，而事發後承建商已即時聯絡死者家屬，以提供所需協助。"
bkn-20250809103001803-0809_00822_001,男童機上頂椅背前座女子責罵爆爭執,2025-08-09 10:30,2025-08-09 10:30,https://hk.on.cc/cnt/news/20250809/bkn-20250809103001803-0809_00822_001.html,"男童機上頂椅背　前座女子責罵爆爭執


在南方航空一班周四（7日）下午從廣東省深圳市飛往遼寧省大連市航班上，一名女乘客疑因不滿後座男童連串過份行為而與對方一家爆發肢體衝突。大連機場公安派出所民警周五（8日）證實，事件正處調查階段。<br/><br/>涉事航班編號是CZ6164，於周四下午4時半左右",遼寧,oncc,2025-08-09 15:45,"在南方航空一班周四（7日）下午從廣東省深圳市飛往遼寧省大連市航班上，一名女乘客疑因不滿後座男童連串過份行為而與對方一家爆發肢體衝突。大連機場公安派出所民警周五（8日）證實，事件正處調查階段。

涉事航班編號是CZ6164，於周四下午4時半左右從深圳寶安國際機場出飛，約3個半小時後抵達大連周水子國際機場。機上乘客透露，當客機飛抵目的地時，一名女乘客與另外一家人發生爭執，即使機艙服務員及其他乘客勸阻亦都無效，事件起因是女子多次警告後排男童不要再頂椅背無果，之後再被對方故意撞到丟失耳機。

根據網上流出片段，女子被男童一家打得倒在地上，要求報警。男童家人大喊太過分，強調：「他還是個孩子！」南航客服事後回應，飛機上打架一般都會報警，最後交由警方處理，不了解現場情況。"
bkn-20250809101209945-0809_00822_001,澳洲童黨圍毆華生致重傷昏迷　華總領館促加強防範,2025-08-09 10:12,2025-08-09 10:12,https://hk.on.cc/cnt/news/20250809/bkn-20250809101209945-0809_00822_001.html,澳洲童黨圍毆華生致重傷昏迷　華總領館促加強防範,中國,oncc,2025-08-09 11:15,"澳洲再發生童黨襲擊華人事件，一名中國留學生周二（5日）在塔斯馬尼亞省霍巴特市購物中心遭到多名青少年群毆，頭部重傷一度昏迷，留醫深切治療部（ICU）。中國駐墨爾本總領館周五（8日）再次提醒中國公民加強人身安全防範。

遇襲的33歲男事主憶述，周二駕車到格倫諾基購物中心接配偶下班，下午3時泊車時，一群青少年走來朝他身上丟垃圾，他很生氣，警告青少年停止卻立刻被包圍。保安呼籲事主立即離開，但20至30名青少年開始圍攏，用拳頭毆打事主頭部。一男一女保安拉開青少年，女保安試圖用身體遮擋保護事主。群毆持續半分鐘左右，保安報警並呼叫救護車。事主嚴重內出血、腦震盪、顱骨骨折，陷入深度昏迷，眼部及臉部亦骨折，在深切治療部搶救30多個小時後，至周四（7日）才脫離生命危險，下周仍需接受臉部和骨折手術。

警方周三（6日）拘捕4名年齡介乎14至15歲的涉案少年，控以刑事襲擊罪，獲准保釋。兩名少女周五自首，同樣被控襲擊罪。警方證實，所有涉案者均已被起訴。塔斯馬尼亞省警察、消防和緊急管理部長埃利斯（Felix Ellis）強烈譴責事件，表明社區中絕對不能容忍這種行為。地方議員托馬斯（Bec Thomas）指出，居民已厭倦青少年違法後屢屢逃脫懲罰的現象。

中國駐墨爾本總領館指出，近期塔斯馬尼亞省相繼發生中國遊客、中國留學生在霍巴特市無端遭當地未成年人毆打、襲擊事件，對中國公民人身安全造成嚴重威脅。近日，又有一名中國留學生在霍巴特市區購物中心無故遭到數名未成年人群毆，造成重傷被送醫救治，所幸目前已脫離生命危險。館方提醒中國公民、留學生，密切關注當地新聞動態、留意治安形勢，盡量減少夜間出行，同時提高自身安全防範意識，加強自我保護能力。"
bkn-20250809100438653-0809_00822_001,上月底至本月初暴雨無「超前部署」　政府稱不開會不代表少保護,2025-08-09 10:04,2025-08-09 14:47,https://hk.on.cc/cnt/news/20250809/bkn-20250809100438653-0809_00822_001.html,上月底至本月初暴雨無「超前部署」　政府稱不開會不代表少保護,香港,oncc,2025-08-09 15:00,"當局上月初因預估熱帶氣旋「丹娜絲」殘餘而決定「超前停課」，結果當日無風無雨變成「超前冇雨」。港府及天文台均被網民鬧爆，質疑決定太輕率。至上月底至本月初再有暴雨，更四度發出黑色暴雨警告信號，當局卻未有再「超前部署」，不少打工仔早上冒着暴雨上班，令打工仔不滿質疑。政府今日（9日）表示，因暴雨發展難以預測，無人預計到本周二黑雨維持11小時，當時無特別召開應對極端天氣督導委員會，不代表少了保護，強調已有成熟的機制面對極端天氣。

政府稱，黑雨及八號風球時，緊急事故監測中心會即時運作，有首長級官員當值，能直接指揮工作應對塌樹及水浸等。在預測到極端天氣對社會帶來廣泛及嚴重影響時，才會召開督導委員會，提前作出部署，「極端情況」並非停工令，市面仍受塌樹及水浸等影響，要時間恢復及清理，改善交通情況，才會考慮發出「極端情況」。

政府今日(9日)再次解釋，指當時天文台預計會有暴雨，適逢中一入學註冊登記，不忍心見到學生家長冒雨叩門，擔心有危險，在平衡各方因素後認為不能冒險，決定停課。理解有學生因停課取消結業禮感到不開心，希望市民明白，保護絕大部分市民安全，是政府首要考慮，指「寧願估錯，都不要後悔」。"
bkn-20250809095627657-0809_00822_001,九龍城電單車遇查　鐵駕士涉酒後駕駛被捕,2025-08-09 09:56,2025-08-09 09:56,https://hk.on.cc/cnt/news/20250809/bkn-20250809095627657-0809_00822_001.html,九龍城電單車遇查　鐵駕士涉酒後駕駛被捕,香港,oncc,2025-08-09 10:45,今晨(9日)9時16分，警員巡經九龍城太子道東近打鼓嶺道時，發現一輛電單車行駛時左搖右擺，遂上前截查，警員發現司機身上有酒氣，遂進行酒精呼氣測試，結果超出法定標準，鐵騎士涉嫌「酒後駕駛」被捕。
bkn-20250809093625719-0809_00822_001,本港累計5宗基孔肯雅熱輸入及一宗可能個案　政府稱有信心受控,2025-08-09 09:36,2025-08-09 09:36,https://hk.on.cc/cnt/news/20250809/bkn-20250809093625719-0809_00822_001.html,本港累計5宗基孔肯雅熱輸入及一宗可能個案　政府稱有信心受控,香港,oncc,2025-08-09 10:45,"本港至今累積5宗基孔肯雅熱輸入及一宗可能個案。港府今日(9日)表示，廣東省佛山爆發基孔肯雅熱疫情，而香港和內地接觸緊密，出現輸入病例不出奇，政府會加強滅蚊工作，呼籲市民要清理家居環境積水，有信心基孔肯雅熱可受到控制。

港府稱，內地佛山出現基孔肯雅熱疫情時，特區政府便即時做好準備，當局早前已在口岸加強滅蚊工作，相關部門亦加強滅蚊，以往蚊患指數達到20，食環署會到相關地點滅蚊，現時當蚊患指數達到10，已經會提早滅蚊工作。相關部門亦會在患者住所附近250米範圍，大規模滅蚊，患者則會在無蚊環境接受治療。專家指出基孔肯雅熱致命率並非很高、不會人傳人。"
bkn-20250809092932550-0809_00822_001,內地下月起強制交社保餐飲業嘆無力承擔,2025-08-09 09:29,2025-08-09 09:29,https://hk.on.cc/cnt/news/20250809/bkn-20250809092932550-0809_00822_001.html,"內地下月起強制交社保　餐飲業嘆無力承擔


內地最高法《勞動爭議司法解釋（二）》的社會保障新規將於9月1日起實施，明確強制繳納社保，任何員工與老闆的「自願放棄協議」均無效。新規要求未來所有企業職工都要繳交社保，包括餐廳服務員、外賣騎手、個體戶等。任何用人單位想逃避「繳社保」的責任，都可能被追責、罰款。<br/>&",廣東,oncc,2025-08-09 13:45,"內地最高法《勞動爭議司法解釋（二）》的社會保障新規將於9月1日起實施，明確強制繳納社保，任何員工與老闆的「自願放棄協議」均無效。新規要求未來所有企業職工都要繳交社保，包括餐廳服務員、外賣騎手、個體戶等。任何用人單位想逃避「繳社保」的責任，都可能被追責、罰款。

內地社保涵蓋養老、醫療、失業、工傷和生育保險的「五險」，新規要求任何「協商放棄」或「自願不繳」的協議一律無效，全面落實「應保盡保」原則。這標誌着餐飲行業用工將會更規範化，可能對行業用工和經營帶來衝擊。

廣東廣州一間快餐店的老闆表示，店內6名全職員工，若按照廣州社保繳納基準，每名員工約多支付1,000元（人民幣，下同，約1,103港元）的人力成本。老闆直言，今年生意不好，扣除房租、人工和水電等成本後，每月僅剩幾千元利潤，承擔社保費用的話店舖只能勉強保本。有早餐店老闆則說，並非不願為員工繳納社保，而是無力承擔。"
bkn-20250809090702823-0809_00822_001,患腎癌律師批體檢存疏漏　遭健康管理機構起訴,2025-08-09 09:07,2025-08-09 09:07,https://hk.on.cc/cnt/news/20250809/bkn-20250809090702823-0809_00822_001.html,患腎癌律師批體檢存疏漏　遭健康管理機構起訴,上海,oncc,2025-08-09 09:15,"內地律師張曉玲上月公開表示，她連續10年在健康管理機構愛康國賓體檢，從未被檢出患癌風險，直至去年發現患有晚期腎癌，質疑愛康國賓體檢涉嫌誤檢、漏檢。內媒周五（8日）報道，愛康國賓已向上海市浦東新區人民法院提起名譽權糾紛訴訟，起訴張曉玲侵犯名譽權，索賠經濟損失及維權費用1,000萬元人民幣（約1,090萬港元）。

起訴書顯示，張曉玲於2023年10月在原告處體檢，去年10月被北大國際醫院診斷為腎癌早期。張曉玲誇大事實，稱一年後被診斷為腎癌晚期，故意捏造並大肆散播原告做假體檢，實質損害了原告名譽權。愛康國賓公關人員表示，後續將交給司法程序處理。

張曉玲表示，她已收到上海市浦東新區人民法院發來的傳票、民事起訴狀及證據目錄，傳票顯示該案將於9月11日在陸家嘴第三法庭進行庭審。她稱自己將積極應訴，由於她一直在北京居住、北京體檢，也是跟愛康國賓在北京獨立的法人公司有糾紛，後續將提出管轄異議。"
bkn-20250809084923581-0809_00822_001,高齡職業司機1年1檢未落實　當局目標明年首季提立法會審議,2025-08-09 08:49,2025-08-09 14:54,https://hk.on.cc/cnt/news/20250809/bkn-20250809084923581-0809_00822_001.html,高齡職業司機1年1檢未落實　當局目標明年首季提立法會審議,香港,oncc,2025-08-09 15:00,"荃灣如心酒店周二(5日)發生八旬的士老司機撞斃遊客事件，社會再度關注職業司機高齡化問題，政府2023年前提出，建議商用車司機提交體格證明的年齡門檻，由70歲降低至65歲，並由三年一檢改為一年一檢，但至今落實無期。運輸及物流局局長陳美寶今日(9日)在電台節目表示，諮詢一直進行，諮詢工作目前已大致完成，調整細節會再調整，目標不遲於明年第一季提上立法會審議，也會探索加快立法的空間。

陳稱，運輸署有就建議成立包括有業界和醫學界的專家小組，他們建議未來可針對檢驗司機的視力和體格，日後商業司機的視力要求將更嚴格，期望增加指定檢查範圍，例如涵蓋青光眼、聽力和認知障礙等，部分高齡人士服用治療慢性疾病藥物，亦可能影響肌肉反應，因此亦需要特別小心。希望制訂醫生名冊，方便商用車司機在體檢時尋找合適醫生。

陳美寶續稱，商用車司機涉及交通意外頻率較高，部分地區會限制指定年紀的司機駕駛個別車種，但香港人口老化，60歲以上的商用車司機現時約12萬人，而在20萬名的士司機中，65歲或以上的有8.6萬人，佔約4成，若一刀切限制，或涉及司機生計等問題，同時亦要考慮人力供應，很多年長司機經驗豐富，仍然有活力，故現階段冀先在體檢方面改革，從嚴緊和全面檢查角度，確保司機在安全情況下駕駛，年齡限制暫未必是優先處理範圍。"
bkn-20250809083844443-0809_00822_001,暴雨成災　甘肅地質災害防禦響應升級,2025-08-09 08:38,2025-08-09 08:38,https://hk.on.cc/cnt/news/20250809/bkn-20250809083844443-0809_00822_001.html,暴雨成災　甘肅地質災害防禦響應升級,甘肅,oncc,2025-08-09 10:15,"甘肅省蘭州市榆中縣周四（7日）引發泥石流及山洪，造成至少10死、33人失蹤。自然資源部周六（9日）將甘肅省地質災害防禦響應等級由Ⅳ級提升為Ⅱ級，增派中央專家組6人趕赴災區，協助指導地方做好工作，安排專人加強應急值班值守、風險趨勢研判、會商調度等。省組織部同日公布撥款300萬元人民幣（約331萬港元），用於慰問救災人員和受災群眾。

甘肅省政府新聞辦周五（8日）召開榆中縣山洪災害新聞發布會，現場全體起立，向遇難人員默哀。省應急廳政治部主任巨鴻文在會上表示，強降雨主要集中在榆中縣南部地區，其中興隆山在15小時內錄得最高超過220毫米雨量，極端暴雨天氣極為罕見，是有紀錄以來的歷史極值。受災區域8個鄉鎮、485戶共2,002人受災，其中5個鄉鎮遭遇山洪災害。基礎設施方面，道路、供電、通訊等設施受損嚴重，山洪也導致部分農地淹水、房屋損毀。

暴雨引發山洪災害，省長任振鶴等官員進入受災組嚴重的村落指揮搶險救災，了解人員搜救、道路疏通、轉移安置、生活保障等情況，強調全力做好傷員救治，轉移受災民眾，加強居住、飲食和醫療等保障，也要加快搶修交通、通訊、電力等受損基礎設施。當地目前正進行河道和路面清理工作，爭取在周六將道路修通。"
bkn-20250809080818655-0809_00822_001,觀塘男子危坐窗邊　被勸服送院檢查,2025-08-09 08:08,2025-08-09 08:08,https://hk.on.cc/cnt/news/20250809/bkn-20250809080818655-0809_00822_001.html,觀塘男子危坐窗邊　被勸服送院檢查,香港,oncc,2025-08-09 09:00,"觀塘有人企跳。今晨(9日)7時40分，天香街1號祥園一名男住客危坐在窗邊，由保安員發現報案。救援人員到場游說，將事主勸服返回安全位置。事主沒有受傷，由救護車送院檢查。警員正調查事主企跳原因。

防止自殺求助熱線：

香港撒瑪利亞防止自殺會： 2389 2222

生命熱線： 2382 0000

社會福利署： 2343 2255

撒瑪利亞會熱線(多種語言)： 2896 0000

醫管局精神健康專線： 2466 7350

明愛向晴軒： 18288

東華三院芷若園： 18281

「情緒通」熱線： 18111

賽馬會青少年情緒健康網上支援平台「Open噏」： http://www.openup.hk"
bkn-20250809080029271-0809_00822_001,燒烤店衝突竟是劇本　7人擾亂秩序行拘,2025-08-09 08:00,2025-08-09 08:00,https://hk.on.cc/cnt/news/20250809/bkn-20250809080029271-0809_00822_001.html,燒烤店衝突竟是劇本　7人擾亂秩序行拘,四川,oncc,2025-08-09 08:15,"四川省成都市兩名女子上月17日在燒烤店爆發激烈衝突，過程被人直播至網上，警方追查揭發衝突是精心設計的表演，旨在吸引關注。內媒周五（8日）報道，涉案7人已全部落網，因以其他方法故意擾亂公共秩序，分別行政拘留5日至7日不等。

直播畫面中，數名年輕人坐在餐桌旁，兩名女子突然起衝突，分別擲啤酒瓶和施以掌摑，隨即扭打。救護人員到場接走其中一名打架女子。接診護士向警方供稱，該女報警時聲稱酒精中毒、醉酒摔傷，即場檢查卻發現她意識清醒，身上雖有血漬但無傷口，血漬顏色有異。當醫生建議她進一步檢查，女子卻拒絕並匆匆離開。燒烤店老闆透露，涉事年輕人當時討論維持直播熱度的話題，眾人離開後遺留一排血膠囊，是影視行業專用的特效道具。

警方鎖定涉案人員，並從直播帳號擁有人李某的手機中發現，他事前曾與兩名打架女子討論如何激化矛盾，讓衝突升級。李某承認鬥毆是表演，事前策劃「兩女爭一男」的情感糾紛劇本，先通過直播間爭吵製造衝突，再利用線下打架事件炒作，使用血膠囊等道具營造傷情，最後報警試圖吸引網民持續關注。警方統計，事件相關影片播放量超過70萬次。"
bkn-20250809080003265-0809_00822_001,今日天晴　日間酷熱　最高氣溫34°C,2025-08-09 08:00,2025-08-09 08:00,https://hk.on.cc/cnt/news/20250809/bkn-20250809080003265-0809_00822_001.html,今日天晴　日間酷熱　最高氣溫34°C,香港,oncc,2025-08-09 08:30,"高空反氣旋正覆蓋華南，該區天色普遍晴朗。此外，位於南海東北部的低壓區正為該區帶來不穩定天氣。今日(9日)上午8時，天文台錄得氣溫攝氏29度，相對濕度85%。過去一小時，京士柏錄得的平均紫外線指數是0.7，強度屬於低。

酷熱天氣警告現正生效，高溫天氣持續！預測今日天晴，日間酷熱，市區最高氣溫約攝氏34度，新界再高一兩度。吹微風。展望未來數日持續酷熱，但有一兩陣驟雨。下周中後期驟雨增多。"
bkn-20250809075854256-0809_00822_001,青衣長康邨單位男子暈倒　送院不治,2025-08-09 07:58,2025-08-09 07:58,https://hk.on.cc/cnt/news/20250809/bkn-20250809075854256-0809_00822_001.html,青衣長康邨單位男子暈倒　送院不治,香港,oncc,2025-08-09 08:15,今日(9日)凌晨5時48分，青衣長康邨康盛樓一單位一名姓林(55歲)男住戶暈倒，由母親發現報案。警員接報到場，發現事主倒臥於一房間的床上。事主昏迷被送往仁濟醫院治理，其後被證實死亡，其死因有待驗屍後確定。
