id,title,date,last_update,url,lead,section,source,scrape_time,news_content
bkn-20250929125517354-0929_00822_001,議員憂遊艇不用預留泊位或霸佔避風塘空間當局期望給予更多彈性,2025-09-29 12:55,2025-09-29 12:55,https://hk.on.cc/cnt/news/20250929/bkn-20250929125517354-0929_00822_001.html,"議員憂遊艇不用預留泊位或霸佔避風塘空間　當局期望給予更多彈性


立法會經濟發展事務委員會今日(29日)召開會議討論運輸及物流局局長就《施政報告》作出簡報。對於推展遊艇經濟方面，有議員指業界擔心未來遊艇不用先預留泊位，或霸佔避風塘空間。當局指即使遊艇未裝動態監測系統，仍然可以預約泊位，但政府期望給予更多彈性。<br/><br/&",香港,oncc,2025-09-29 17:00,"立法會經濟發展事務委員會今日(29日)召開會議討論運輸及物流局局長就《施政報告》作出簡報。對於推展遊艇經濟方面，有議員指業界擔心未來遊艇不用先預留泊位，或霸佔避風塘空間。當局指即使遊艇未裝動態監測系統，仍然可以預約泊位，但政府期望給予更多彈性。

航運交通界議員易志明提出機場人手不足，期望當局「盡快畀埋爭我嗰一半人手」。另外，對於遊艇動態監測系統，他指業界擔心未來遊艇不用先預留泊位，或霸佔避風塘空間。

運輸及物流局局長陳美寶表示，政府機場是香港快速增長引擎，會和機管局積極做內部人力調查。她又指，即使遊艇未裝相關係統，仍然可以預約泊位，但政府期望給予更多彈性。

議員林健鋒關注港深西部鐵路及北灣支線，在環評、顧問等方面需要多少資金，能否縮短時間等安排。陳美寶回應稱，相關法定程序會同步加快做，不會讓企業落戶後再做。她說會吸納國家建築標準，及時運用。"
bkn-20250929125253068-0929_00822_001,藍田平田邨男子梯間上吊　女住客揭發證實當場氣絕,2025-09-29 12:52,2025-09-29 12:52,https://hk.on.cc/cnt/news/20250929/bkn-20250929125253068-0929_00822_001.html,藍田平田邨男子梯間上吊　女住客揭發證實當場氣絕,香港,oncc,2025-09-29 14:00,"藍田有人上吊亡。今午(19日)12時49分，平田邨平旺樓一名女住戶報案，指發現一名男子在梯間上吊。救援人員接報到場將事主解下，惟經檢驗證實當場氣絕，警員正調查男子身份及自縊原因。

防止自殺求助熱線：

香港撒瑪利亞防止自殺會： 2389 2222

生命熱線： 2382 0000

社會福利署： 2343 2255

撒瑪利亞會熱線(多種語言)： 2896 0000

醫管局精神健康專線： 2466 7350

明愛向晴軒： 18288

東華三院芷若園： 18281

「情緒通」熱線： 18111

賽馬會青少年情緒健康網上支援平台「Open噏」： http://www.openup.hk"
bkn-20250929123315392-0929_00822_001,議員倡推金融旅遊　當局：國金2期金管局可考慮讓旅客參觀,2025-09-29 12:33,2025-09-29 12:33,https://hk.on.cc/cnt/news/20250929/bkn-20250929123315392-0929_00822_001.html,議員倡推金融旅遊　當局：國金2期金管局可考慮讓旅客參觀,,oncc,2025-09-29 12:45,"在增加景點方面，金融服務界議員李惟宏今日(29日)在立法會一個事務委員會上建議發展金融旅遊及金融博物館，又舉例美國紐約華爾街有銅牛雕塑。文化、體育及旅遊局局長羅淑佩指香港金融機構如國金2期及金管局，大廈對出的景色懾人，但門禁森嚴，可以考慮安排旅行團「團進團出」，或開放名額讓個人遊旅客預約參觀。

羅淑佩又透露，正檢視幻彩詠香江的演出，認為除了燈光外，還有好多其他展示方式，政策上可能要拆牆鬆綁，目前已有初步構思，暫時未能公布。 她又預計今年訪港郵輪有188班，按年多兩成，啟德郵輪碼頭營運合約將在2028年到期，當局將在今年年底招標。"
bkn-20250929123130855-0929_00822_001,天文台發出酷熱天氣警告　下午1時錄氣溫32°C,2025-09-29 12:31,2025-09-29 13:18,https://hk.on.cc/cnt/news/20250929/bkn-20250929123130855-0929_00822_001.html,天文台發出酷熱天氣警告　下午1時錄氣溫32°C,香港,oncc,2025-09-29 13:30,"天文台在今日（29日）中午12時20分發出酷熱天氣警告，在下午1時，天文台錄得氣溫攝氏32度，相對濕度百分之68。過去一小時，京士柏錄得的平均紫外線指數是9，強度屬於甚高。

天文台預料今日本港天氣酷熱，市民應慎防中暑。長者、孕婦、嬰兒及小童、慢性病如心臟病或高血壓患者，以及過胖人士均較易中暑，應及時觀察是否出現中暑徵兆。在炎熱天氣下或高溫環境中工作的人士，請參照勞工處的預防工作時中暑指引，採取所需的防暑措施。

在戶外活動的人士，應多補充水分和不要過度勞累。於感覺不適時，應盡快到陰涼的地方休息。戶外活動宜安排在早上或下午較後的時間進行。"
bkn-20250929123141965-0929_00822_001,粉嶺唐樓單位起火　救援人員撲熄無人傷,2025-09-29 12:31,2025-09-29 12:31,https://hk.on.cc/cnt/news/20250929/bkn-20250929123141965-0929_00822_001.html,粉嶺唐樓單位起火　救援人員撲熄無人傷,香港,oncc,2025-09-29 13:30,粉嶺發生火警。今日(29日)早上11時25分，聯和墟聯興街29號一唐樓單位起火，烈燄由窗戶噴出，多名途人見狀報案求助。消防接報到場開喉將火撲熄，幸事件中無人受傷，起火原因有待調查。
bkn-20250929121234818-0929_00822_001,促進就業帶動銀髮經濟　69%中高齡再就業至少6個月,2025-09-29 12:12,2025-09-29 12:12,https://hk.on.cc/cnt/news/20250929/bkn-20250929121234818-0929_00822_001.html,促進就業帶動銀髮經濟　69%中高齡再就業至少6個月,香港,oncc,2025-09-29 12:30,"港府有意帶動銀髮經濟，即針對年長消費者及其為養老需求，提供的一系列產品、服務及經濟活動。而勞工處日前於立法會公布就帶動銀髮經濟所採取的跟進措施詳情，相關措施主要針高齡人士就業事宜，其中勞工處去年全年舉辦12場適合中高齡人士的招聘會，供僱主及求職人士直接會面，求職人士可即場申請職位及面試，並錄得1,256宗就業個案，今年1月至7月共舉辦42場招聘會，並錄得1,090宗就業個案。

勞工處去年7月推出為期三年的「再就業津貼試行計劃」，以鼓勵40歲或以上人士重投就業市場，每名連續完成12個月工作的合資格參加者，於計劃推行期間最高可獲2萬港元再就業津貼。勞工處亦鼓勵 參加「中高齡就業計劃」，聘用40歲或以上人士並提供3至12個月在職培訓，提升其工作技能。而就「中高齡就業計劃」進行的調查顯示，截至今年6月，在計劃下接受在職培訓的僱員，約82%個案的留任期為4個月或以上，69%個案留任6個月或更長時間，至於留任期較短的僱員主要因覓得其他工作或因私人理由提早離職。

勞工處又表示，會收集「再就業計劃」參加者及就業個案的資料及數據，並於明年第一季進行中期檢討，並配合「中高齡就業計劃」探討進一步鼓勵銀髮族就業的措施。"
bkn-20250929121222700-0929_00822_001,內地大學升學資助計劃]　10月13日截止申請,2025-09-29 12:12,2025-09-29 12:12,https://hk.on.cc/cnt/news/20250929/bkn-20250929121222700-0929_00822_001.html,內地大學升學資助計劃]　10月13日截止申請,香港,oncc,2025-09-29 12:15,"教育局今日（29日）表示，有意申請2025╱26學年內地大學升學資助計劃的合資格香港學生，須於10月13日或之前透過內地大學升學資助計劃網上申請平台遞交申請，或把填妥的申請表格以郵寄方式遞交教育局。 

教育局發言人表示，資助計劃預期可惠及絕大多數到內地修讀學士學位課程而有不同經濟需要的香港學生。合資格的學生可申領資助計劃的「經入息審查資助」或「免入息審查資助」，前者只提供予通過入息審查的學生。資助計劃的資助款項會按年發放，資助年期為有關學生於指定內地院校就讀的學士學位課程的正常修業期。符合資格的申請人只可在同一學年內，接受「經入息審查資助」或「免入息審查資助」二者其一。有關資助計劃的詳情已上載至教育局網頁。教育局預計於2026年第一季起分階段通知個別申請人其申請結果。"
bkn-20250929121029797-0929_00822_001,內地食安新規　禁連鎖餐廳只收錢不擔責,2025-09-29 12:10,2025-09-29 12:10,https://hk.on.cc/cnt/news/20250929/bkn-20250929121029797-0929_00822_001.html,內地食安新規　禁連鎖餐廳只收錢不擔責,中國,oncc,2025-09-29 12:30,"市場監管總局周日（28日）舉行新聞發布會，正式發布《餐飲服務連鎖企業落實食品安全主體責任監督管理規定》，今年12月1日起施行。當局要求餐飲連鎖企業，不能只開店、不管店，只收錢卻不承擔食品安全責任。

上述規定明確，門店數量在逾1萬家、1,000到9,999家、999家以下的餐飲服務連鎖企業總部的食品安全監管工作，分別由省級、市級、縣級市場監管部門負責；明確省級市場監管部門的工作統籌職責，要求其根據餐飲服務連鎖企業總部管理的門店數量變化情況，在每年1月確定本行政區域內各級市場監管部門負責監督管理的企業總部。

規定要求，餐飲服務連鎖企業實行貫通式管理，建立總部每月調度、分支機構每周排查、門店每日管控的工作制度和機制；同時強調夯實企業總部管理責任，明確企業總部「管甚麽」、「怎麽管」，細化其在考核評價、人員培訓、「互聯網+明廚亮竈」、標準化管理、食品採購、食品安全投訴處置等方面的責任義務。

規定亦細化罰則以增強制度的剛性約束，包括餐飲服務連鎖企業未按要求建立食品安全管理制度、未配備食品安全管理人員、進貨時未查驗許可證和食品合格證明文件、未向市場監管部門報告有關情況，以及企業總部轉嫁自身應承擔的食品安全責任等違法情形。"
bkn-20250929120924909-0929_00822_001,山頂僑福道一單位遇竊戶主失值500萬元珠寶首飾,2025-09-29 12:09,2025-09-29 12:09,https://hk.on.cc/cnt/news/20250929/bkn-20250929120924909-0929_00822_001.html,"山頂僑福道一單位遇竊　戶主失值500萬元珠寶首飾


山頂發生爆竊案。今日(29日)早上11時16分，僑福道10號一單位外籍家傭通知保安員報案，指屋內一片零亂有搜掠痕迹，懷疑遭賊人爆竊。人員接報到場翻查閉路電視片段，並在附近一帶搜索，惜暫未有發現賊人蹤影。戶主經初步點算，確定有約值500萬元珠寶首飾遭賊人盜去。<br/>&",香港,oncc,2025-09-29 14:15,"山頂發生爆竊案。今日(29日)早上11時16分，僑福道10號一單位外籍家傭通知保安員報案，指屋內一片零亂有搜掠痕迹，懷疑遭賊人爆竊。人員接報到場翻查閉路電視片段，並在附近一帶搜索，惜暫未有發現賊人蹤影。戶主經初步點算，確定有約值500萬元珠寶首飾遭賊人盜去。

現場消息指，涉事單位大廈外牆搭有棚架，暫未確定賊人是否從棚架爬入單位，犯案後沿路逃去。"
bkn-20250929120539729-0929_00822_001,上水半小時內3宗交通意外區內多處大塞車,2025-09-29 12:05,2025-09-29 12:05,https://hk.on.cc/cnt/news/20250929/bkn-20250929120539729-0929_00822_001.html,"上水半小時內3宗交通意外　區內多處大塞車


今日(29日)早上10時起，上水發生至少3宗交通意外，導致區內多條主要幹道擠塞。當中粉嶺公路、掃管埔路近雞嶺迴旋處等多條道路大塞車。九巴及⿓運巴⼠途經掃管埔路近雞嶺迴旋處的服務否受影響。<br/><br/>至下午1時23分，受影響途經掃管埔路(雞嶺迴旋處)的",香港,oncc,2025-09-29 14:15,"今日(29日)早上10時起，上水發生至少3宗交通意外，導致區內多條主要幹道擠塞。當中粉嶺公路、掃管埔路近雞嶺迴旋處等多條道路大塞車。九巴及⿓運巴⼠途經掃管埔路近雞嶺迴旋處的服務否受影響。

至下午1時23分，受影響途經掃管埔路(雞嶺迴旋處)的九巴及龍運巴士服務陸續回復正常。"
bkn-20250929120452147-0929_00822_001,早前因超強颱風「樺加沙」暫停開放　貝澳營地現已重開,2025-09-29 12:04,2025-09-29 12:04,https://hk.on.cc/cnt/news/20250929/bkn-20250929120452147-0929_00822_001.html,早前因超強颱風「樺加沙」暫停開放　貝澳營地現已重開,香港,oncc,2025-09-29 13:15,康樂及文化事務署今日（29日）宣布，離島區早前因超強颱風樺加沙而暫停開放的貝澳營地已經重開。
bkn-20250929120339053-0929_00822_001,內地十一客流或破3.4億人次　籲出境加強安全防範,2025-09-29 12:03,2025-09-29 16:40,https://hk.on.cc/cnt/news/20250929/bkn-20250929120339053-0929_00822_001.html,內地十一客流或破3.4億人次　籲出境加強安全防範,中國,oncc,2025-09-29 16:45,"國務院新聞辦公室周日（9月28日）說明十一、中秋8天假期的交通運輸服務保障有關情況，交通運輸部預計假期去程客流高峰出現在周三（10月1日），單日或超3.4億人次，將突破今年春節創下的3.39億歷史峰值。外交部領事保護中心周一（9月29日）提醒假期出境中國遊客，要樹牢安全意識，防範各類風險。

內地鐵路十一中秋假期運輸自周一啟動，至下周五（10月10日）結束，為期12天。全國鐵路預計發送旅客2.19億人次，日均計劃開行約1.3萬列旅客列車；其中國鐵廣州局料發送3,350萬人次，同比增逾一成。假期臨近，旅遊出行市場漸入熱潮，今年文旅消費市場有望再創新高。多個在線旅遊平台預測數據顯示，今年「雙節」旅遊市場呈多維度熱度，遊客出遊意願顯著提升。中旅社協會副秘書長龍飛指出，數據顯示遠途旅遊需求持續釋放，3小時交通圈周邊遊、省內遊同樣受青睞。

外交部領事保護中心提醒出境中國遊客，出行前需做好行前準備，了解目的地安全形勢、社會治安和流行疫病等訊息，妥善安排出行計劃，避免前往高風險國家和地區。遊客也要強化風險意識，避免前往偏僻、未開發、缺乏安全保障等區域；另需重視交通安全，慎防電詐陷阱，妥善處理突發事件，也要掌握應急聯絡方式。應急管理部自然災害防治研究院城市災害研究中心副主任朱月琴周一呼籲，假期出遊不私自進入未開發區域，不盲信網上非專業攻略。

另外，中宣部副部長、文旅部部長孫業禮周一在國新辦舉行的新聞發布會上介紹，去年文化產業實現營業收入19.14萬億元（人民幣，下同，約21萬億港元），比2020年增長37.7%。國內居民出遊人次、總花費保持較高增長速度，今年上半年國內居民出遊32.85億人次、總花費3.15萬億元（約3.5萬億港元）。"
bkn-20250929115551161-0929_00822_001,逾170個路口安裝新電子行人過路發聲裝置　料2027年底遍及全港,2025-09-29 11:55,2025-09-29 11:55,https://hk.on.cc/cnt/news/20250929/bkn-20250929115551161-0929_00822_001.html,逾170個路口安裝新電子行人過路發聲裝置　料2027年底遍及全港,香港,oncc,2025-09-29 12:30,"為方便視障人士過馬路，運輸署自今年4月起陸續更換全港電子行人過路發聲裝置，至今已在超過170個路口完成安裝，包括約100個較多視障人士使用的路口。運輸署今日（29日）在社交平台上發文表示，新裝置獲得不少好評，有視障人士反映能進一步便利他們無障礙出行，運輸署將會繼續更換餘下路口的發聲裝置，預計整個更換工程於2027年底完成。

運輸署表示，新裝置以人為本，當視障人士夜間過馬路時，可使用專用無線裝置，靈活地短暫提高正以夜間減音模式運作的發聲裝置音量，協助他們安全過馬路，同時平衡其他市民的需要。運輸署亦透過 香港盲人輔導會HKSB，一次過免費派發專用裝置予視障人士使用，部分視障人士已領取並開始試用該「遙控器」。

除以遙控器「提聲」外，運輸署手機應用程式「香港出行易」的功能也有同時提升，署方於9月中在「出行易」中增加「過路易」遙控提聲功能，功能和用法與「遙控器」相似，視障人士只要利用已啟動屏幕閱讀功能的流動電話，便可透過「出行易」短暫提高發聲裝置的音量，以科技助力出行，過馬路更安心。"
bkn-20250929114928101-0929_00822_001,首8月3320萬人次訪港增12%　議員促推措施把過境客變過夜客,2025-09-29 11:49,2025-09-29 15:38,https://hk.on.cc/cnt/news/20250929/bkn-20250929114928101-0929_00822_001.html,首8月3320萬人次訪港增12%　議員促推措施把過境客變過夜客,香港,oncc,2025-09-29 15:45,"立法會經濟發展事務委員會今日(29日)召開會議，討論文化體育及旅遊局局長就新一份《施政報告》作出簡報。文體旅局局長羅淑佩表示，截至今年8月底訪港旅客數字為3,320萬人次，較去年同期上升12%，當中內地旅客佔2,550萬人次；非內地旅客為765萬人次，分別上升11%及16%。

委員會主席葉劉淑儀關注，當局是否有按地區的數字分析，讓外界聚焦旅客。遊艇經濟方面，她關注內地遊艇從何而來，又認為現時旅發局成員10年來沒有外籍人士，期望當局考慮穆斯林或其他人士，以便聯繫世界。

羅淑佩回應稱，原則上同意旅發局成員組成相關的建議，會在更新成員名單時考慮。遊艇來源方面，她指有人或「買咗遊艇放喺香港」，因為本港在稅收較好，亦能享受出海樂趣。文化體育及旅遊局旅遊事務專員張馮泳萍補充，整體過夜旅客消費金額為5,400港元、和去年相若；內地旅客金額約為5,000多港元，外地旅客約為6,300港元，中東旅客可超過1萬港元，會展旅客超過7,000港元。

旅遊界議員姚柏良認為本港應該推動更多措施，把過境客變成入境客，期望這些旅客不在港過夜亦能消費。他又認為施政報告對這方面着墨較少，期望當局聯同各界推出措施。羅淑佩指施政報告沒提及並不代表政府沒做，指機管局疫情後銳意重新成為航空樞紐，舉例迪士尼及昂坪360有類似的聯乘合作。她又指現時「盛事」、演唱會等特別活動，都是吸引旅客過夜的活動，當局鼓勵旅遊業議會和機管局就旅行團客合作，以及本地地接社的選擇。

委員會副主席嚴剛認為要先吸引過境客才能讓他們變成過夜客，指出國家240小時免簽政策仍未涵蓋香港至深圳的口岸，導致部分旅客轉飛其他國內城市。他期望政府繼續爭取國家惠港政策，讓更多旅客來港過境。羅淑佩回應指政府會繼續向中央爭取適當時機。"
bkn-20250929114407790-0929_00822_001,銷毀安排學生入讀電話訊息　助理校長及家長涉妨礙司法公正提訊,2025-09-29 11:44,2025-09-29 17:22,https://hk.on.cc/cnt/news/20250929/bkn-20250929114407790-0929_00822_001.html,銷毀安排學生入讀電話訊息　助理校長及家長涉妨礙司法公正提訊,香港,oncc,2025-09-29 17:30,"廉政公署今早(29日)落案起訴一名政府資助中學助理校長及一名家長妨礙司法公正，控告2人涉嫌銷毀該名家長就安排兒子入讀中二的貪污證據，干擾廉署刑事調查。案件今日下午在屯門裁判法院提訊，兩名被告暫時毋須答辯，控方不反對兩名被告的保釋申請，但要求新增不得離港及不得干預證人等條件。裁判官最終把案押後至12月11日再訊，2人獲准保釋。

兩名被告為孔少丹，50歲，廠商會蔡章閣中學(蔡章閣中學)助理校長，及居於深圳市的蔡鈺，38歲，學生家長，同被控一項妨礙司法公正。控罪指2人於2024年9月12日在香港，意圖妨礙司法公正而作出一項有妨礙司法公正傾向的作為，即銷毀及干擾廉政公署就該蔡鈺被指稱貪污而進行的刑事調查的資料。孔於今午自行到庭，蔡則被押解往法院應訊。裁判官批准孔及蔡分別以1萬港元和3,000港元保釋，期間均不得離港、須居於報稱地址、有住所更改須通知廉署以及不得干預控方證人。由於蔡沒有香港居所，她須在本周四(10月2日)或之前提供替代地址。

據廉署披露，案發時，蔡鈺的兒子獲分配2024/2025學年蔡章閣中學的中二學位。該校助理校長孔少丹於2024年7月底審閱蔡鈺兒子的學歷文件後，要求他入學試合格方可入讀該校中二。蔡的兒子因拒絕應考而獲安排入讀中一。蔡於同年8月初透過電話通訊軟件發送訊息，要求孔安排兒子入讀中二。基於學位情況，孔後來告訴蔡鈺，只要其兒子出席考試便可入讀中二。蔡得知安排後透過支付工具向孔發送1萬元人民幣，孔拒絕接受，並於8月下旬向校長匯報事件。

廉署接獲貪污投訴後展開調查。廉署人員於同年8月26日會見孔少丹，指他與蔡鈺之間的電話訊息是貪污證據，提醒他切勿刪除有關訊息。不過，於同年9月12日，蔡應孔的要求見面時，2人涉嫌商討刪除蔡鈺的電話訊息。與孔會面後，蔡刪除2人先前所有電話訊息。

案件編號：TMCC 2001/2025"
bkn-20250929114227718-0929_00822_001,黃大仙下邨男子家中暈倒　胞兄揭發證當埸氣絕,2025-09-29 11:42,2025-09-29 11:42,https://hk.on.cc/cnt/news/20250929/bkn-20250929114227718-0929_00822_001.html,黃大仙下邨男子家中暈倒　胞兄揭發證當埸氣絕,香港,oncc,2025-09-29 12:15,黃大仙有人暈倒亡。今日(29日)上午10時06分，一名男子報案，指懷疑其胞弟於黃大仙下邨龍昌樓一單位內暈倒。救護員接報到場，發現姓蘇(40歲)男事主倒臥上址一房間，經檢驗後證實事主已當場氣絕。案件列作「屍體發現」，死因有待驗屍後確定。
bkn-20250929112716953-0929_00822_001,上水地盤工室外等落貨中暑亡家屬赴殮房認屍,2025-09-29 11:27,2025-09-29 11:27,https://hk.on.cc/cnt/news/20250929/bkn-20250929112716953-0929_00822_001.html,"上水地盤工室外等落貨中暑亡　家屬赴殮房認屍


上周六(27日)早上10時許，酷熱天氣警告生效下，上水古洞河上鄉路近石仔嶺一地盤，一名姓葉（64歲）男工人在室外等候貨車落貨，期間懷疑中暑暈倒，工友發現報案求助。葉男由救護車送往北區醫院，經搶救後惜告不治。<br/><br/>至今日(29日)死者多名親友由工",香港,oncc,2025-09-29 13:30,"上周六(27日)早上10時許，酷熱天氣警告生效下，上水古洞河上鄉路近石仔嶺一地盤，一名姓葉（64歲）男工人在室外等候貨車落貨，期間懷疑中暑暈倒，工友發現報案求助。葉男由救護車送往北區醫院，經搶救後惜告不治。

至今日(29日)死者多名親友由工會人員協助下，抵達富山殮房辦理認屍手續，逗留至早上近11時許完成。家屬其後乘車離開，期間各人神情凝重，黯然神傷，對事件沒有任何回應。

葉妻早前接受訪問表示，丈夫為家庭經濟支柱，兒子20多歲，現時正在找工作，家庭經濟暫未有困難。她續稱，丈夫以前在街市做小販賣生果，後來街市重新裝修，因租金昂貴及需要負擔裝修費用，因此轉行任職清潔工作。她又指，丈夫身體正常，無長期病患，每天工作時間正常朝8晚6，事發當日亦如常早上6時半出門上班。"
