id,title,date,last_update,url,lead,section,source,scrape_time,news_content
bkn-20250929211528592-0929_00822_001,涉空運走私80萬元犀牛角　39歲男子被捕明日提堂,2025-09-29 21:15,2025-09-29 21:15,https://hk.on.cc/cnt/news/20250929/bkn-20250929211528592-0929_00822_001.html,涉空運走私80萬元犀牛角　39歲男子被捕明日提堂,香港,oncc,2025-09-29 22:15,"香港海關上周六(27日)在香港國際機場檢獲約2公斤懷疑受管制犀牛角，估計市值約80萬港元。跟進調查後，人員拘捕一名39歲的懷疑涉案男子，他將會被落案控以「非法進口附錄I瀕危物種」罪，明日(30日)在九龍城裁判法院提堂。

案發當日，海關透過風險評估，檢查一件從法國抵港、報稱為「陶瓷禮品」的空運郵包。經檢查後，人員發現該批懷疑受管制屬瀕危物種的犀牛角與陶瓷製品混雜擺放於紙箱內。

根據《保護瀕危動植物物種條例》，任何人如非按照條例規定進出口或管有瀕危物種均屬違法，一經定罪，最高可被判罰款1,000萬港元及監禁10年，有關物品亦會被充公。"
bkn-20250929211032391-0929_00822_001,官津數人頭後淨減3小一6中一　長洲官中剩1班危危乎,2025-09-29 21:10,2025-09-29 21:10,https://hk.on.cc/cnt/news/20250929/bkn-20250929211032391-0929_00822_001.html,官津數人頭後淨減3小一6中一　長洲官中剩1班危危乎,香港,oncc,2025-09-29 22:15,"中小學「縮班殺校」危機似乎有放緩，教育局本月中到各官立及津貼中學和小學「數人頭」後表示，相比之前發出開班信內所批核的班數總和，公營小學一共需增加9班小一，而公營中學則一共需減少6班，其中長洲官立中學僅得1班中一，學校需是否考慮申請「救校方案」，作為該校辦學團體的教育局說會審慎考慮各因素，適時公布決定。

教育局月中起透過電子系統收集學生資料，並到個別學校實地點算，核實實際在學人數，並於今日(29日)發信通知所有須調整其本學年班級結構及教職員編制的學校。在本學年中一「開班線」提高至27人後，相對本年3月和5月分別發出的2025/26學年開班信內所批核的班數總和，公營小學一共增加9班小一。不過，扣除根據月初出版的《小學概覽》統計全港官津小學小一班數，當時整體已比上學年減共12班，一加一減後料「淨減」減3班小一。

而公營中學則一共減少6班中一，其中長洲官立中學於上學年(2024/25學年)獲核准開辦兩班中一，本學年則僅獲准開1班。教育局說該校的後續發展將取決學校會否申請俗稱「救校方案」的發展方案，以及申請是否獲批。而局方作為官立學校的辦學團體，在審慎考慮各因素後，會訂定學校的長遠發展方案，例如逐步停辦長期收生不足的學校、合併將位處有較多剩餘學位地區的學校，或重置到需求較殷切的地區等，適時會公布。

教育局表示，學校的核准班數受多項因素影響，數字調整往往反映適齡學童人口的整體變化及學生人口的流動情況，包括搬遷、家長選擇，以及移入或移出本港的學童人口。因調整班數出現的超額教師，可按既定機制獲保留至2025/26學年完結。

而因應香港學生人口結構性下降，政府在規劃教育的未來發展時，考慮學生的福祉，並以「軟著陸」為目標，檢視政策及公共資源運用的效能，逐步有序調節學校數目，確保教育生態健康和學校可持續發展，公共資源得以善用。局方會繼續密切留意學生人口的變化並與業界保持緊密溝通。"
bkn-20250929210444112-0929_00822_001,馬太鞍溪堰塞湖溢堤增至18死　紅色警戒未除,2025-09-29 21:04,2025-09-29 21:04,https://hk.on.cc/cnt/news/20250929/bkn-20250929210444112-0929_00822_001.html,馬太鞍溪堰塞湖溢堤增至18死　紅色警戒未除,花蓮,oncc,2025-09-29 21:15,"台灣花蓮縣馬太鞍溪堰塞湖上周二（23日）溢堤導致下游光復鄉洪災，截至周一（29日）上午增至18人死亡、7人失聯、107人受傷，目前紅色警戒尚未解除。

台灣災害應變中心周一舉行工作匯報時指出，當日上午光復鄉加里洞花蓮溪河道旁再尋獲一具罹難者遺體，至於死者是否失蹤者之一仍有待釐清。該中心又指，若堰塞湖集水區有明顯降雨、河道水位異常及發生地震，將以防空警報系統，對照海嘯警報發布程序發布堰塞湖警報。

農業部表示，經無人機空拍初判，目前堰塞湖壩頂高度為82米，溢流後已下切118米深，湖區面積13公頃，蓄水量為610萬噸，約為原來量體的6.7%。因周圍崩塌坡面不穩定，且集水區仍有水量匯入，現維持紅色警戒。在確認殘餘壩體安全、溢流水量及河道泥沙等綜合條件，評估安全無虞後，才會將警戒降級或解除。"
bkn-20250929203353977-0929_00822_001,超強颱風之下　你有冇好似佢哋咁黐,2025-09-29 20:33,2025-09-29 20:58,https://hk.on.cc/cnt/news/20250929/bkn-20250929203353977-0929_00822_001.html,超強颱風之下　你有冇好似佢哋咁黐,香港,oncc,2025-09-29 21:00,"《東呼即應》在網上發現多張相片，均顯示在超強颱風襲港期間，市民為玻璃窗貼上膠紙時展創意。有人表示「搵工中」；有人則問「有人打麻將嗎？」。有網民發現菜檔亦盡展「求變」精神，轉賣膠紙。

網上流傳多張相片顯示，不少家庭將膠紙貼成「交叉」，有人更幽默地寫上「搵工中」，道出待業心聲；另有市民以極粗字標示「WFH」，宣示自己在家工作。更有趣的是，有人順便約人開枱打麻將，玩味十足。

即使店舖位於商場內，也有店主貼上交叉膠紙以示謹慎，避免大風損壞玻璃；膠紙需求大增，網民發現有菜檔趁機轉售，笑言檔主會否落力推銷「靚女，今日啲膠紙好靚呀，買啲返去加餸貼啦」。

雖然坊間對貼膠紙的防風效用各有討論，但此舉早已成為「打風儀式」一部分，賦予市民幽默與創意，也讓防風行為更添趣味。"
bkn-20250929203018249-0929_00822_001,搭飛機做呢種行為　會有當地警察接你機,2025-09-29 20:30,2025-09-29 20:58,https://hk.on.cc/cnt/news/20250929/bkn-20250929203018249-0929_00822_001.html,搭飛機做呢種行為　會有當地警察接你機,香港,oncc,2025-09-29 21:00,"香港航空一班由本港飛往大阪的航班，於本月21日晚上降落關西機場期間，右邊機身一扇緊急逃生門竟意外打開，逃生梯同時彈出，嚇壞在場乘客。事件無人受傷，但因涉事逃生梯報廢，約70名原定翌日返港旅客須改乘其他航班。前空姐及法律界人士向《東呼即應》拆解一些機上禁忌行為，包括私自轉到商務艙、擅自取走機上物品等。法律界人士指，「貪玩」在法律上從來不是抗辯理由，如果導致他人有損失，同樣須賠償。

前空姐Tracy表示，誤開逃生門的新聞多發生於窄體客機的航班。例如A320這類小型飛機，中間的逃生門旁邊就是客人的座位，因此空服員會在登機時向坐在該處的客人講解，強調只有逃生時才可觸碰，而一旦觸碰逃生門，警示燈便會亮起。大型飛機的逃生門則通常設於廚房旁邊並有空姐看守，故很少出現客人誤觸。

除了緊急逃生門遭不當開啟，機艙內還有其他禁忌。Tracy指，在飛航途中餐飲服務後熄燈休息時，常有「別有用心的旅客」趁黑走到商務艙或頭等艙休息，這種情況在長途客機上很常見。此外，醉酒鬧事亦是嚴重問題。空服員在飛行途中會觀察客人的反應來提供酒精飲品，若發現有醉酒迹象，會減少或停止供應。但如果真的發生酒醉鬧事、動手打人或騷擾其他客人，影響到飛航安全，機組人員有權勸告、報警，甚至使用束帶綑綁鬧事者。

另一個常見的禁忌是機艙吸煙。Tracy指，吸煙情況多發生於長途或中長途客機，客人通常躲在廁所擋着煙霧探測器。若空姐聞到煙味或有人舉報，就會直接發出警告，甚至通知執法部門。最後是取走或破壞飛機上設施的行為，過去曾有人故意將硬幣放入飛機引擎，或用東西撬出氧氣面罩。Tracy憶述，曾試過一班往馬爾代夫的航班，因有旅行團誤以為機上所有東西都可拿走，導致經濟艙逾100個座位下的救生衣都不見了。

在機艙上違法，由哪一個國家或地區管轄向來是乘客們的一大迷思。大律師陸偉雄解釋，一般來說，若飛機在香港仍未起飛，由香港法律管轄；若已到達目的地降落，則交由當地執法部門跟進。最重要是考慮與香港有沒有連繫，若航班在香港起飛或目的地是香港，都與香港有連繫，香港法例第494章《航空保安條例》仍然生效。

機艙內最高權力的人是機長，陸指出根據《東京公約》，飛機機門關上後，機長的權力就立刻發揮，負責管治飛機上的秩序或所有操作事宜。若發現乘客有違規行為，輕則會勸喻，重則可使用果斷手段，甚至使用軟手銬綁起滋擾者。滋事人士有兩個後果，一是可能被航空公司列入黑名單；二是在整個過程當中，若令飛機有任何損失，包括飛機延誤或乘客有其他的損失，航空公司仍可向滋事者進行民事索償。至於違法後能否以「貪玩」作為藉口，他提醒「貪玩」在法律上從來不是抗辯理由，如果導致他人有損失，同樣須賠償。"
bkn-20250929202904116-0929_00822_001,母女檔毒餐車牛頭角斷正　檢值100萬元大麻製品等,2025-09-29 20:29,2025-09-29 20:29,https://hk.on.cc/cnt/news/20250929/bkn-20250929202904116-0929_00822_001.html,母女檔毒餐車牛頭角斷正　檢值100萬元大麻製品等,香港,oncc,2025-09-29 21:30,"今日(29日)傍晚6時許，九龍東執法人員在牛頭角上邨常滿樓外發現兩名女子形迹可疑於是上前截查，並從一輛Tesla電動車內檢獲500克的懷疑大麻製成品，包括大麻煙、大麻糖及大麻花，市值100萬港元。行動中一對母女被捕。

被捕女兒(33歲)負責駕車及把風，母親(約56至59歲)則負責派貨，兩人到埗後落車並站在路邊，懷疑準備交收毒品。案情指，執法人員搜查涉案車輛期間，發現車內有異常氣味，隨後在車尾位置檢獲約一批小包裝的懷疑大麻製成品，並藏於快遞包裝袋以掩飾。"
bkn-20250929201128021-0929_00822_001,屯門42歲男子溫金寶失蹤　院舍報案尋人,2025-09-29 20:11,2025-09-29 20:11,https://hk.on.cc/cnt/news/20250929/bkn-20250929201128021-0929_00822_001.html,屯門42歲男子溫金寶失蹤　院舍報案尋人,香港,oncc,2025-09-29 20:30,"屯門一名42歲男子溫金寶上周六(27日)上午在康寶路一院舍最後露面後便告失蹤，院舍職員同日報案。

失蹤男子身高約1.65米，體重約60公斤，中等身材、尖面型、黃皮膚及蓄短黑髮。他最後露面時身穿灰色短袖上衣、米黃色短褲、白色球鞋及攜有一個黑色背包。任何人如有該失蹤男子的消息或曾見過他，請與執法部門聯絡。"
bkn-20250929200613551-0929_00822_001,空警600預警機偵測力強　助福建號遠海攻防作戰,2025-09-29 20:06,2025-09-29 20:06,https://hk.on.cc/cnt/news/20250929/bkn-20250929200613551-0929_00822_001.html,空警600預警機偵測力強　助福建號遠海攻防作戰,中國,oncc,2025-09-29 20:15,"中國人民解放軍海軍有關部門早前宣布，殲15T、殲35和空警600三型艦載機已成功完成在福建號航母上的首次彈射起飛和着艦訓練。內地軍事專家表示，空警600固定翼預警機是航母編隊的「千里眼」和「空中大腦」，極大提高了航母編隊遠程探測預警和指揮引導能力，從而大幅度提升海軍航母編隊遠海攻防作戰能力。

空警600是中國第一型艦載固定翼預警機，支持彈射起飛，能遂行預警探測、指揮引導、目標指示和作戰協同等任務，被譽為「海空司令部」，能為航母戰鬥群提供更長的預警時間，大大提高攔截效率。由於要在航母甲板上完成起飛降落，空警600體積較空警500A小，最大特點是機翼可摺疊，以便停放更多飛機在航母上，同時有利於起飛和作戰方面的發揮。跟艦載戰鬥機一樣，艦載預警機也安裝了尾鈎，令飛機着艦時更安全穩定。

空警600比直升機和驅逐艦上的雷達發現來襲目標的距離更遠，尤其對於超低空掠海飛行的導彈，能克服地球曲率的影響。該艦載預警機又保留螺旋槳設計，因螺旋槳飛機適應性強，低速性能更勝噴射機，非常適合預警機在低空低速飛行時執行空中偵察、預警、巡邏等任務，其維護成本也低於噴射機。"
bkn-20250929200251778-0929_00822_001,機場明推新e-道　免身份證或二維碼　容貌識別7秒完成自助入境,2025-09-29 20:02,2025-09-29 20:02,https://hk.on.cc/cnt/news/20250929/bkn-20250929200251778-0929_00822_001.html,機場明推新e-道　免身份證或二維碼　容貌識別7秒完成自助入境,香港,oncc,2025-09-29 20:15,"機場將於明日（30日）推出「容易飛e-道」，港人只需透過容貌識別，即可自助完成入境手續，毋須出示身份證或手機二維碼，整個流程約7秒完成，比傳統e-道快13%。

當局指，服務適用於年滿11歲並持有香港特區護照、簽證身份書、俗稱「回鄉證」的港澳居民來往內地通行證，以及非中國籍港澳居民來往內地通行證的旅客。未來將考慮把適用年齡下調至7歲以上，並擴展至其他出入境管制站。

使用者先於離境時透過「登機易」完成容貌核驗，返港時在e-道閘門前望向鏡頭確認資格，再進入e-道核實身份即可完成入境。每年預計有約800萬人次使用，仍須攜帶有效身份證或旅行證件，但毋須預先登記。

現時機場共有26條e-道，其中10條已升級「容易飛」功能，其餘16條將於明年起逐步改裝，並計劃於2027年底增設26條新閘機，屆時新e-道總數將達52條。服務未來或下調至7歲以上港人，並擬擴展至其他管制站。當局又稱，對於雙胞胎及整容人士，系統可準確辨識身份。"
bkn-20250929195422654-0929_00822_001,旺角檢2500隻鹹碟　拘六旬漢,2025-09-29 19:54,2025-09-29 19:54,https://hk.on.cc/cnt/news/20250929/bkn-20250929195422654-0929_00822_001.html,旺角檢2500隻鹹碟　拘六旬漢,香港,oncc,2025-09-29 20:00,"今日(29日)晚上7時52分，旺角區執法人員根據線報及經深入調查後，在區內展開掃黃行動，突擊搜查亞皆老街83號一廣場店舖，檢獲近2,500隻約值4.8萬港元的懷疑色情光碟及小量現金。人員於該店舖內以涉嫌「管有淫褻物品以供發布用途」及「發布淫褻物品」拘捕一名65歲本地男子，現正被扣留調查。"
bkn-20250929194750452-0929_00822_001,2.1萬名50歲以上南區居民眼科檢查　港大揭27.2%有輕度視力障礙,2025-09-29 19:47,2025-09-29 19:47,https://hk.on.cc/cnt/news/20250929/bkn-20250929194750452-0929_00822_001.html,2.1萬名50歲以上南區居民眼科檢查　港大揭27.2%有輕度視力障礙,香港,oncc,2025-09-29 20:15,"年紀老化，眼疾風險也會逐漸上升。香港大學李嘉誠醫學院臨床醫學學院眼科學系今日（29日）宣布完成「南區社區眼科檢查計劃」，為21,637名50歲或以上的南區居民進行全面眼科檢查，結果發現當中有27.2%人雙眼患有輕度視力障礙（即視力低於20/40），同時成功轉介5,843名，即約27%參與者至眼科專科門診跟進及治療，當中就包括2,564宗有機會威脅視力的白內障個案；2,338宗青光眼或具有高風險青光眼的個案，以及1,840宗黃斑或視網膜病變。

港大醫學院臨床醫學學院眼科學系系主任兼臨床教授梁啟信解釋，被發現有輕度視力障礙的27.2%人當中，其實只需配戴合適眼鏡，比率便可從27.2%大幅降至11.1%。他形容指，今次計劃的發現，為香港的眼科保健系統敲響警鐘，反映社會需要加強推廣視力檢查及提升市民有關方面的認知，以助預防或治療眼疾。 

眼科學系臨床實務副教授兼南區社區眼科檢查計劃總監施愷廸表示，有近半的老年人口無法以正常視力生活，而他們所面對的不僅是健康問題，更是生活質素及獨立自主能力的挑戰。今次計劃就反映，透過適當的篩查及基本干預，便能有效改善市民視力、提升生活福祉，同時減輕家庭和醫療系統的負擔。"
bkn-20250929193643174-0929_00822_001,事主證供自相矛盾　男子非禮女兒罪名不成立,2025-09-29 19:36,2025-09-29 19:36,https://hk.on.cc/cnt/news/20250929/bkn-20250929193643174-0929_00822_001.html,事主證供自相矛盾　男子非禮女兒罪名不成立,香港,oncc,2025-09-29 19:45,"一名男子涉嫌在2022年間，3度在觀塘單位，非禮當時只有年約12歲的女兒，包括摸女兒私處、吸啜她兩邊乳頭，及用陰莖摩擦她陰道外邊。涉案男子否認3項非禮罪，案件經開審後，區院法官謝沈智慧今(29日)裁定3項控罪均罪名不成立。法官指事主的證供自相矛盾，她分別向醫生、老師和社工所作出的投訴更出現重大分歧，認為並非誠實可靠。法官又批評主控沒有盡責檢視證供及評估是否有合理定罪機會，在庭上更出現不專業行為，包括曾在庭上嚎哭，故下令將裁決副本抄送律政司跟進。

匿名被告現年47歲，以英文字母「L.W.H.」作代號。法官裁決指，事主向不同人士作投訴並描述事發經過時，均出現不同的版本，當中包括案發日期、次序和非禮細節都出現分歧，而且部份投訴是在一日內向不同人士提及同一件事，但投訴只隔數小時卻已出現不同版本。而且事主指稱遭被告侵犯的時間，根據被告的出入境紀錄，他根本不在港。法官又指，事主亦承認曾為了獲得朋友認同而隨意撒謊，亦曾付款給他人代她做功課，她明顯並非誠實可靠的證人，故拒絕接納其證供，並裁定罪名不成立。

另外，法官又指主控曾向法庭指事主的證供清晰直接、盤問下沒有動搖，法官認為主控是漠視證供、強詞奪理，誤導法庭。法官又指主控無法對事主證供的分歧作合理解釋，沒有盡力履行其責任。法官更指主控曾在庭上嚎哭，又聲稱沒有服藥及在庭上突然服藥，認為其行為不專業及令人咋舌。

控方案情指，被告是内地永久居民且是難X的生父。X於2010年6月在內地出生，在2018年來港，與母親同住觀塘某單位，被告平均每星期會來港探X。X指，2022年某下午，X在睡房醒來時，看到被告隔着衣服撫弄她胸部，然後摸她下體。X指被告亦曾在房間內脫去她衣服，再摸她胸部，及用下體摩擦其私處；最後一次事件則是被告以下體觸碰X私處。2023年3月，X向朋友透露自己被性侵；同年5月，有老師發現X不開心及手指有不尋常的傷口，與X交談後獲告知X曾被父親性侵，遂通知學校報警。

案件編號：DCCC 1091/2023"
bkn-20250929190309682-0929_00822_001,「博羅依」殘餘環流續影響　內地發颱風暴雨雙預警,2025-09-29 19:03,2025-09-29 19:03,https://hk.on.cc/cnt/news/20250929/bkn-20250929190309682-0929_00822_001.html,「博羅依」殘餘環流續影響　內地發颱風暴雨雙預警,中國,oncc,2025-09-29 19:15,"據內地中央氣象台周一（29日）消息，熱帶風暴「博羅依」雖已於當日凌晨1時30分左右在越南河靜省沿海登陸，其殘餘環流帶來的強降雨當日料仍影響廣西、雲南等地，為部分地區帶來暴雨或大暴雨。 

博羅依的中心周一上午位於老撾波里坎塞省境內，預計將以每小時35公里的速度向西偏北方向移動，強度快速減弱。受其影響，南海西部、西沙群島附近海域、北部灣、瓊州海峽、廣東西部沿海、海南島及沿海、廣西沿海周一有6至8級大風、陣風9至10級，北部灣偏南海域的風力9至10級、陣風11至12級。中央氣象台發布颱風藍色和暴雨藍色預警。

早前超強颱風「樺加沙」吹襲廣東，中國人民銀行廣東省分行周一表示，轄內金融業務在「五停」期間平穩運行，截至上周四（25日）廣東國庫系統配合財政部門及時劃撥救災款99筆，涉額4.27億元（人民幣，下同，約4.72億港元），該行轄內受災地區地市分行預計本月投放支持三農和小微企再貸款合計49億元（約54億港元）。保險機構同時高效開展救援理賠工作，如人保財險陽江市分公司快速完成打風期間首筆車險賠付的查勘定損環節，陽光農險陽江中心支公司一天內完成當地種鴿養殖戶羽種鴿死亡的理賠處理。"
bkn-20250929184813359-0929_00822_001,觀塘冚工廈地下賭檔　主持賭客共11人被捕,2025-09-29 18:48,2025-09-29 18:48,https://hk.on.cc/cnt/news/20250929/bkn-20250929184813359-0929_00822_001.html,觀塘冚工廈地下賭檔　主持賭客共11人被捕,香港,oncc,2025-09-29 19:00,觀塘區警員根據線報及經深入調查後，今日（29日）下午約2時，突擊搜查駿業里10號一工業大廈單位，搗破一個懷疑非法賭檔。在該單位內拘捕一名姓黃(50歲)本地男子，涉嫌「經營賭博場所」；另外，該單位內8男1女本地人士(35至67歲)、及一名45歲持雙程證內地男子，則涉嫌「在賭博場所內賭博」被捕，11名疑犯現正被扣留調查。警員亦檢獲10部懷疑釣魚機、一部讀卡機及一批遊戲卡。
bkn-20250929184703733-0929_00822_001,手提袋及附近2劏房單位檢獲約28萬支私煙　66歲無業女子囚10個月,2025-09-29 18:47,2025-09-29 18:47,https://hk.on.cc/cnt/news/20250929/bkn-20250929184703733-0929_00822_001.html,手提袋及附近2劏房單位檢獲約28萬支私煙　66歲無業女子囚10個月,香港,oncc,2025-09-29 19:00,"一名女子因處理未完稅香煙，違反《應課稅品條例》，今日(29日)在西九龍裁判法院被判處監禁10個月。

　　 

海關人員於去年9月12日在深水埗巴域街進行的反私煙行動中，截查一名66歲報稱無業的女子，並在其手提袋及附近兩個劏房單位內檢獲共約28萬支私煙，估計市值約125萬元，應課稅值約92萬元。  

　　 

根據《條例》，任何人若處理、管有、售賣或購買私煙即屬違法，一經定罪，最高可被判罰款二百萬元及監禁七年。"
bkn-20250929184048206-0929_00822_001,公眾街市198個攤檔　10月公開競投,2025-09-29 18:40,2025-09-29 18:40,https://hk.on.cc/cnt/news/20250929/bkn-20250929184048206-0929_00822_001.html,公眾街市198個攤檔　10月公開競投,香港,oncc,2025-09-29 18:45,"食物環境衞生署今日(29日)公布，轄下25個公眾街市共198個攤檔將於10月進行公開競投。是次公開競投的攤檔種類涵蓋凍肉、鮮肉、鮮魚、冷凍(冰鮮)家禽、水果、蔬菜、食物類乾貨及濕貨、非食物類乾貨及濕貨、燒味和鹵味、報紙等。租約為三年的固定租期，由11月1日起生效，租期屆滿後承租人(即檔戶)沒有租約續期權利。

每月租金競投底價視乎個別檔位的大小、位置和空置期而定。若攤檔持續空置達半年以上，署方會先以市值租金的80%作競投底價推出公開競投；如攤檔持續空置8個月以上，則會以市值租金的60%作競投底價推出公開競投。"
