id,title,date,last_update,url,lead,section,source,scrape_time,news_content
bkn-20260402110214640-0402_00822_001,網紅「劉馬車」再捲風化案　涉4日犯11宗非禮被捕,2026-04-02 11:02,2026-04-02 13:14,https://hk.on.cc/cnt/news/20260402/bkn-20260402110214640-0402_00822_001.html,網紅「劉馬車」再捲風化案　涉4日犯11宗非禮被捕,香港,oncc,2026-04-02 13:15,"曾因風化案罪成入獄的網絡紅人「劉馬車」(本名劉駿軒)，懷疑再涉同類案件。消息指，劉馬車涉嫌於（3月29日至4月1日）4日內在九龍及新界區多處，向11名年齡介乎12至26歲女子非禮，包括摸大髀及從後抱女事主大腿。當中有人認出是劉馬車遂報案求助。

人員經調查後，昨日(4月1日)下午在旺角區一商場將劉馬車拘捕。相信所有受害女子並不認識被捕人，其中一宗案件發生在3月29日晚上10時45分，被捕人與受害女子於天水圍一輕鐵車廂內並排而坐當事主離座時遭劉用手摸大腿非禮。大部分案件被閉路電視拍下犯案過程。"
bkn-20260402110157674-0402_00822_001,加拿大財長訪華　盼吸引投資建戰略夥伴關係,2026-04-02 11:01,2026-04-02 11:01,https://hk.on.cc/cnt/news/20260402/bkn-20260402110157674-0402_00822_001.html,加拿大財長訪華　盼吸引投資建戰略夥伴關係,北京,oncc,2026-04-02 11:15,"加拿大財政部長、中加經濟財金戰略對話加方聯合牽頭人商鵬飛周三至周六（1日至4日）訪華，將會見中國政府對口官員和商界領袖。

加拿大財政部發聲明指，商鵬飛將在北京與中方政商界人士會面，以建立戰略夥伴關係並吸引新投資，作為加拿大貿易多元化戰略的一部分。聲明強調，此次訪問建立在加拿大總理卡尼今年1月成功訪華的基礎之上。

商鵬飛日前受訪指，七大工業國集團（G7）成員都找到了與中國戰略性接觸的方式，中國是全球第二大經濟體，也是加拿大第二大貿易夥伴，加方必須參與其中。加媒指出，美國總統特朗普的貿易政策迫使其傳統盟友尋找新的夥伴關係，並加強與華合作。"
bkn-20260402103954011-0402_00822_001,港島區連環淋油刑毀　同集團4食肆遭紅油濺污,2026-04-02 10:39,2026-04-02 13:51,https://hk.on.cc/cnt/news/20260402/bkn-20260402103954011-0402_00822_001.html,港島區連環淋油刑毀　同集團4食肆遭紅油濺污,香港,oncc,2026-04-02 14:00,"港島區發生連環淋油案。今日(2日)早上10時31分，灣仔謝斐道414號地下一火鍋店職員報案，指店舖櫥窗及大門遭紅色油漆沾污懷疑遭人刑毀。人員接報到場調查期間，先後再接獲駱克道405至419號、天樂里2至4號及勿地臣街10號3食肆職員報案，指店舖被淋紅油。

人員分別在4食肆調查，翻查店舖閉路電視片段，追查歹徒去向及了解犯案動機，初步相信涉事店舖屬於同一集團經營，正向負責人了解事件原委。"
bkn-20260402101439236-0402_00822_001,通過霍爾木茲海峽船隻不足法料華遲早更直接介入,2026-04-02 10:14,2026-04-02 14:20,https://hk.on.cc/cnt/news/20260402/bkn-20260402101439236-0402_00822_001.html,"通過霍爾木茲海峽船隻不足　法料華遲早更直接介入


伊朗持續封鎖霍爾木茲海峽影響全球能源供應，法國海軍參謀長沃茹爾（Nicolas Vaujour）周三（1日）表示，中國遲早都要更直接地參與恢復該海峽的石油運輸，因目前通過船隻數量應該不足夠。<br/><br/>沃茹爾在巴黎舉行的戰爭與和平安全會議上表示，目前",中國,oncc,2026-04-02 16:30,"伊朗持續封鎖霍爾木茲海峽影響全球能源供應，法國海軍參謀長沃茹爾（Nicolas Vaujour）周三（1日）表示，中國遲早都要更直接地參與恢復該海峽的石油運輸，因目前通過船隻數量應該不足夠。

沃茹爾在巴黎舉行的戰爭與和平安全會議上表示，目前尚未看到中國海軍出面，讓霍爾木茲海峽重新開放。另一方面中國和伊朗直接政治對話，以確保一定數量的船隻能通過，但他不認為足以讓運輸流量恢復正常，因此中國可能要更直接參與討論，並對海峽持續封鎖表達不滿。

沃茹爾又指，法國正努力促成多個國家先在政治層面開展對話，確定霍爾木茲海峽可持久開放的條件。他認為，最終需要軍隊來監督海峽重開，正研究先前由歐盟主導在海峽開展的「Agenor」護航行動模式。法國軍方仍在評估海峽中是否布設了水雷，以及是否需要清除。

另外，英媒周三（1日）引述知情人士透露，美國總統特朗普3月要求北約協助重新開放霍爾木茲海峽未果後，曾威脅停止「烏克蘭優先需求清單」（PURL）機制，阻止北約國家採購美國武器援助烏克蘭。多國最終在3月19日倉促發表聲明，表態願意為確保霍爾木茲海峽安全通航作出適當貢獻。

英國首相施紀賢周三預告，將於本周召集簽署上述聲明的35個國家開會，商討在戰事停止後重新開放霍爾木茲海峽，討論事項包括評估可行採取與政治手段，以恢復航行自由、保障受困船隻及海員的安全，並恢復重要物資的運輸。英國軍事規劃人員將於會後再研究如何調動英國能力，在戰事停止後使海峽恢復通航並確保安全。"
bkn-20260402101328156-0402_00822_001,復活節長假期前夕打擊交通違例　拘9名司機扣查13車,2026-04-02 10:13,2026-04-02 10:13,https://hk.on.cc/cnt/news/20260402/bkn-20260402101328156-0402_00822_001.html,復活節長假期前夕打擊交通違例　拘9名司機扣查13車,香港,oncc,2026-04-02 10:30,"西九龍區警員在復活節長假期前夕(3月28日至4月2日）在區內進行針對性執法行動，打擊包括「酒後駕駛」、「非法賽車」、「超速駕駛」及「非法改裝」等罪行。

行動期間，警員拘捕9名本地男子，年齡介乎26至58歲，分別涉嫌「酒後駕駛」，調查期間，人員亦發現當中3名男子為被通緝人士。

執法部門利用隱形戰車在區內，例如大埔道、龍翔道、呈祥道、西九龍公路及西九龍走廊等主要路段及快速公路進行巡邏，以重點打擊非法賽車及超速駕駛等相關罪行。人員亦於西九龍區內多個地點設置數碼雷達偵測（俗稱影快相），共偵察到175輛車輛涉及超速行駛，執法部門稍後將會向有關司機發出傳票。

另外，在行動中警員共發現13輛私家車懷疑被非法改裝或其車身構造違反《道路交通(車輛構造及保養)規例》。經初步檢驗後，有關車輛懷疑涉及的改裝包括：改裝「死氣喉」、車尾定風翼突出車身、改裝軚盤及擋風玻璃破裂等。有關車輛已被扣留在九龍灣車輛扣留及檢驗中心內，等待被進一步檢驗。另外，人員亦向4部車輛發出欠妥車輛報告。"
bkn-20260402101114519-0402_00822_001,「純牛奶」倒出後透明如水　市場部門召回檢測,2026-04-02 10:11,2026-04-02 10:11,https://hk.on.cc/cnt/news/20260402/bkn-20260402101114519-0402_00822_001.html,「純牛奶」倒出後透明如水　市場部門召回檢測,青海,oncc,2026-04-02 10:15,"內地網民近日發影片顯示，一款包裝標註「純牛奶」的乳製品，拆開後倒出的液體透明如水、味道發苦，引發消費者擔憂該產品質素。青海省共和縣市場監督管理局周二（3月31日）通報，已成立調查組進駐生產企業開展全面調查，並啟動同批次產品召回封存工作，對企業純牛奶系列備樣產品抽樣送驗，後續將根據調查和檢測結果，違法違規行為立案查處。

發布影片的黃先生周一（3月30日）表示，涉事奶製品親戚在過年期間送來的年貨，他連續打開4盒同批次產品，結果均出現上述異常情況。涉事乳製品為青海湖牌高原純牛奶，生產日期為2026年1月20日，保質期6個月，產品包裝配料表中僅標有生牛乳。

涉事產品生產廠家青海雪峰犛牛乳業有限公司周一宣布，消費者凡在線上或線下購買批次為20260120的青海湖純牛奶，如認為產品異常、尚未食用、存在顧慮，均可憑消費購貨紀錄截圖選擇退貨、退款或換貨服務。"
bkn-20260402100857152-0402_00822_001,置邦物業主任推翻宏泰消防董事供詞　稱無接獲對方索取掛牌紙請求,2026-04-02 10:08,2026-04-02 13:47,https://hk.on.cc/cnt/news/20260402/bkn-20260402100857152-0402_00822_001.html,置邦物業主任推翻宏泰消防董事供詞　稱無接獲對方索取掛牌紙請求,香港,oncc,2026-04-02 14:00,"就大埔宏福苑火災成立的獨立委員會今日（2日）舉行第8場聽證會。對於日前宏泰消防工程有限公司董事及工程師鍾傑文日前作供時稱曾數次向置邦興業有限公司(ISS)物業主任鄭芷盈詢問有關掛牌紙，即「消防裝置關閉通知書」，而鄭向他表明已有申請，但沒有提供予鍾。不過，鄭芷盈今日作供時反駁，不記得火災前數天鍾向她索要掛牌紙，其中有證據顯示鍾聲稱曾致電給鄭的通話，鄭原來並無接聽電話，故沒有接獲鍾索取掛牌紙的請求，雙方證供矛盾。

鍾傑文日前作供指，曾於2025年10月17日，中午12時06分曾致電與鄭芷盈交談，內容是講消防水缸無水，詢問有無掛牌紙，做完工程後需提供掛牌紙，但鄭稱對對話內容無記憶，但「應該無講過掛牌紙。」而後來在10月22日，鄭芷盈曾WhatsApp鍾傑文，向鍾展示一封消防處的信件，內容為消防裝置設備損壞，及後又催鍾盡快派員到屋苑進行消防系統執修，但內容無提及掛牌紙。

而在2025年11月21日，下午3時29分，鍾查閱電訊公司紀錄顯示，該電話時間為9秒，鍾稱該通話曾向鄭芷盈查詢有關掛牌紙問題。不過，鄭芷盈的電話紀錄顯示，該電話為「Miss call（沒有接聽）」，故鄭確認沒有與鍾發生對話。

而宏泰消防工程有限公司電工黃健華曾供稱，在11月19日到宏福苑維修時，曾向鄭芷盈當面查詢，得知宏福苑共8座大廈正進行大維修，包括消防水缸維修，已向消防處掛牌。但鄭芷盈今日亦否認此事，直指無提及過有關消防系統總電掣一事，亦無提及過有掛牌紙一事。"
bkn-20260402100552905-0402_00822_001,網上罵審裁官「垃圾」兼洩案件謄本　潘焯鴻藐視法庭判囚一個月,2026-04-02 10:05,2026-04-02 15:28,https://hk.on.cc/cnt/news/20260402/bkn-20260402100552905-0402_00822_001.html,網上罵審裁官「垃圾」兼洩案件謄本　潘焯鴻藐視法庭判囚一個月,香港,oncc,2026-04-02 15:30,"曾揭發沙中綫工程鋼筋不合標準的「中科監察」主席潘焯鴻，於2024年初分別在Facebook發布有關庭審內容謄本的貼文，及於YouTube節目內發布涉嫌攻擊審裁官的內容，被律政司入稟高院， 以民事及刑事控告他藐視法庭。潘早前表示放棄抗辯，案件今日（2日）於高等法院判刑，法官歐陽桂如判刑時指雖潘犯案時相關案件的原審程序已結束，但當時仍有上訴許可申請待決，他明顯是意圖拉攏他人影響上訴結果，不接納其因一時衝動犯案，終判其囚1個月，並須就本案支付約26萬港元的訟費。辯方表示將就此案申請上訴。

律政司方早前指出2024年3月，潘分別在YouTube上及在Facebook上發布了兩個片段及2個貼文，內容涉及藐視法庭。庭上播放了涉案片段，在片段一中潘就他名下公司被潘麒智追討欠薪案件敗訴的案件，直斥勞資審裁處審裁官「垃圾」，而在片段二中則提及與該案庭審相關的謄本。而潘在Facebook貼文中公開了部分上述謄本，而該謄本只可用作與訴訟相關的用途。

案件編號：HCMP 2386/2024"
bkn-20260402094836766-0402_00822_001,上水男子私家車內暈倒　當場證實氣絕,2026-04-02 09:48,2026-04-02 09:48,https://hk.on.cc/cnt/news/20260402/bkn-20260402094836766-0402_00822_001.html,上水男子私家車內暈倒　當場證實氣絕,香港,oncc,2026-04-02 10:45,今日(2日)早上8時35分，有途人報案指，行經上水河上鄉路近鳳崗山一露天貨倉對開時，發現一名男子懷疑在私家車內暈倒。救援人員接報到場，經檢驗證實事主已氣絕，警員正聯絡死者家屬，了解男子生前狀況。
bkn-20260402094613465-0402_00822_001,向洪水橋產業園公司注資百億　當局不認為「政府出雞、企業出豉油」,2026-04-02 09:46,2026-04-02 09:46,https://hk.on.cc/cnt/news/20260402/bkn-20260402094613465-0402_00822_001.html,向洪水橋產業園公司注資百億　當局不認為「政府出雞、企業出豉油」,香港,oncc,2026-04-02 11:15,"政府加快北部都會區建設，預計今年中投入運作的洪水橋產業園公司，負責發展及營運23公頃產業用地。政府將尋求立法會撥款，向洪水橋產業園公司注資100億元作起始資金。發展局局長甯漢豪接受電台訪問表示，注資100億元是很值得的投資，不認為是「政府出雞、企業出豉油」。

甯稱，起始資金只負責發展8公頃土地，餘下的15公頃要靠產業園公司，例如透過物色合作夥伴發展，亦可發債或運用地皮賺取資金，強調政府投放100億元是一個起動，若干年後可帶來每年近40億元經濟收益，其後增加至每年110億元。

至於日後北都的園區公司會否要求政府加碼財政支援，甯回應稱，對產業園公司有期望，政府不會輕易再注資，但也不至於走到極端表明「以後免問」，經濟環境會轉變，若日後發展得好，需要更多資金才可「做大做強」，也毋須關上門，強調會審時度勢。她續稱，洪水橋產業園公司有5名董事局成員是政策局長，會為園公司定出績效指標，園公司每年需交報告，亦受立法會監察。又指產業園公司以市場模式運作，需要彈性，不適宜納入審計署衡工量值監管。"
bkn-20260402094334883-0402_00822_001,加強版招標妥下月公布　當局冀屋宇署暫不催促維修令到期樓宇,2026-04-02 09:43,2026-04-02 09:43,https://hk.on.cc/cnt/news/20260402/bkn-20260402094334883-0402_00822_001.html,加強版招標妥下月公布　當局冀屋宇署暫不催促維修令到期樓宇,香港,oncc,2026-04-02 10:45,"為減低樓宇維修工程的圍標風險，市建局將會推出加強版「招標妥」，除提供更嚴謹的預審名單外，亦為業主就聘請顧問和承建商提供專業意見及支援。發展局局長甯漢豪接受電台訪問表示，下月會公布加強版「招標妥」細節，今年稍後正式推出。若有樓宇維修令已到期，已要求屋宇署給予空間，盡量不要催促未展開工程的業主立案法團，以等待加強版「招標妥」出台。

甯稱，個別有即時危險的樓宇，屋宇署會想辦法協助業主先處理。加強版「招標妥」包括制訂更嚴謹的顧問及承建商預審名單，交市建局評標及招標，目前正與市建局敲定有關方案的細節。

在檢討「樓宇更新大行動2.0」方面，甯透露，考慮在資助計劃中加入條件，要求領取資助的業主，要繼續做好日常維修，例如撥備資源，並做好管理計劃，避免若干年後樓宇老化後，再次要做大維修，又認為申請維修資助是一個機會，讓當局加入有關要求。至於會否檢討強制驗樓計劃，甯表示，並非所有樓宇到30年樓齡就收到強制驗樓令，屋宇署會按風險為本決定，措施生效以來，約七成收到驗樓令的樓宇，當時已屆50年樓齡。"
bkn-20260402092008176-0402_00822_001,恒指跌177點　阿里、小米齊挫逾3%　內銀、吉汽逆市揚,2026-04-02 09:20,2026-04-02 16:18,https://hk.on.cc/cnt/news/20260402/bkn-20260402092008176-0402_00822_001.html,恒指跌177點　阿里、小米齊挫逾3%　內銀、吉汽逆市揚,產經,oncc,2026-04-02 16:30,"長假期前夕，恒生指數低開39點於25,254點後維持跌勢，午後曾跌392點至24,901點，尾市跌幅收窄，全日跌177點或0.7%，報25,116點；國企指數跌47點或0.56%，報8,456點；科技指數跌77點或1.62%，報4,679點。大市成交2,436億元。

科技股向下，騰訊跌1.4%；阿里巴巴跌3.4%；美團跌2%；小米集團跌3.5%；京東集團跌0.8%；快手跌2.8%。

金融股個別發展，滙豐控股跌0.2%；友邦保險跌1.5%；中國平安跌0.6%；香港交易所跌1.1%；建設銀行升0.4%；工商銀行升1.1%；中國銀行升0.9%。

油服股受捧，山東墨龍升16.3%；百勤油服升9.2%。

吉利汽車逆市升8.3%，為表現最好藍籌，有券商指集團首季汽車銷量勝預期。

恒指全周累升164點或0.65%。

港灣家族辦公室業務發展總監郭家耀表示，恒指暫時在24,000點附近有較強支持，只要局勢沒有進一步惡化，暫時跌穿的壓力未必太大；但要恒指彈上25,500以上，可能要有新的條件配合，例如油價進一步回落。"
bkn-20260402090122916-0402_00822_001,鄭麗文稱訪陸符合國際期待　將反台獨寫入黨章,2026-04-02 09:01,2026-04-02 10:13,https://hk.on.cc/cnt/news/20260402/bkn-20260402090122916-0402_00822_001.html,鄭麗文稱訪陸符合國際期待　將反台獨寫入黨章,中國,oncc,2026-04-02 10:15,"國民黨主席鄭麗文下周二（7日）起將率團訪問大陸6天，她周三（1日）在中常會上表示，此訪是國共論壇相隔十年後再度重啟，而兩岸關係正是在這十年間急速惡化。她宣布，將把「堅守九二共識」和「反對台獨」兩點寫入黨章，強調國民黨有不可推卸的歷史任務。

鄭麗文認為，只要回歸九二共識、反對台獨，台海真的不需要打仗。其率團訪陸消息公布後，美國跨黨派參議員率團訪台，表示對話一定是好事，支持大陸能跟台灣所有黨派都進行對話交流，也對她此訪樂觀其成。她又指，不希望看到零和遊戲、你死我活，希望雙贏、共好共榮，國民黨推動的和平、和解包括台灣內部的朝野和解、兩岸的和平，也由衷希望看到美陸和解和合作。她深信此訪不但符合憲法和台灣人民共同的安全福祉，也符合兩岸共同的意願和國際社會共同的期待。

鄭麗文曾公開表示，不管是出訪前或返台後，都願與台灣地區領導人賴清德溝通。國民黨文傳會主委尹乃菁周三表示，賴清德方面至今未有回應，故為鄭麗文再向對方喊話，稱國民黨黨部離賴清德辦公室「沒那麼遙遠」，對方指定任何地方，鄭麗文都願見面溝通。"
bkn-20260402090000413-0402_00822_001,廣東實施高層建築消防新規　禁電動單車上樓,2026-04-02 09:00,2026-04-02 09:00,https://hk.on.cc/cnt/news/20260402/bkn-20260402090000413-0402_00822_001.html,廣東實施高層建築消防新規　禁電動單車上樓,廣東,oncc,2026-04-02 09:15,"《廣東省高層建築消防安全管理規定》周三（1日）正式施行，用13條條款細化火災預防措施，梳理出9類明確的禁止性行為，聚焦高層建築高發風險點，強化事前預防，從源頭上堵住安全漏洞。當中包括禁止攜帶俗稱「電雞」的電動單車、電動電單車及其電池進入升降機，鼓勵設置阻止「電雞」上樓的智能裝置等。

廣東目前有逾17萬幢高層建築，涵蓋住宅、辦公、商業、工業等業態。上述規定在高層建築全覆蓋管理、消防安全責任制、火災風險預防機制等方面進一步完善，將各地經驗轉化為制度規範，推動高層建築消防安全管理從「事後處置」向「事前預防」轉型。將「高層工業建築」納入適用範圍是新規的亮點，要求相關產權人、使用人落實專門管理機構或管理人員，規範動火作業、易燃易爆危險品管控、消防設施維護等關鍵環節，從立法層面破解高層工業建築監管缺位、責任不清的難題。

將建設中的高層建築納入管理範圍是新規的另一創新點，目的在於防範高層建築的動態風險。新規要求施工期間，建設單位、產權單位或其委託管理單位應與施工單位明確施工現場的消防安全責任，施工單位應落實相關消防安全措施。"
bkn-20260402085640385-0402_00822_001,馬鞍山男子清潔露台玻璃失足墮樓倒臥草叢清醒送院,2026-04-02 08:56,2026-04-02 08:56,https://hk.on.cc/cnt/news/20260402/bkn-20260402085640385-0402_00822_001.html,"馬鞍山男子清潔露台玻璃失足墮樓　倒臥草叢清醒送院


馬鞍山有人墮樓。今日(2日)早上8時25分，耀沙路8號一屋苑保安員報案，指一名男子懷疑從高處墮下，倒臥上址一草叢上。救護車接報到場將清醒男子送往威爾斯親王醫院治理。人員經初步調查，相信姓許(48歲)事主於上址一單位清潔露台玻璃時失足墮下。",香港,oncc,2026-04-02 13:30,馬鞍山有人墮樓。今日(2日)早上8時25分，耀沙路8號一屋苑保安員報案，指一名男子懷疑從高處墮下，倒臥上址一草叢上。救護車接報到場將清醒男子送往威爾斯親王醫院治理。人員經初步調查，相信姓許(48歲)事主於上址一單位清潔露台玻璃時失足墮下。
bkn-20260402085524799-0402_00822_001,2內地漢涉偷機艙行李財物被捕　手提行李藏胡椒噴霧拘本地女子,2026-04-02 08:55,2026-04-02 08:55,https://hk.on.cc/cnt/news/20260402/bkn-20260402085524799-0402_00822_001.html,2內地漢涉偷機艙行李財物被捕　手提行李藏胡椒噴霧拘本地女子,香港,oncc,2026-04-02 09:30,"執法部門昨日(1日)接報指，指一名男乘客在一班由越南飛往香港的航班上，將手提行李放在座位上方置物櫃，其後發現行李內的財物不翼而飛，包括共價值約1000港元的港幣和外幣現金，懷疑被人盜去。

警員接報到場，初步調查後，拘捕2名分別34歲及52歲的內地男子，涉嫌「盜竊」。兩名被捕人現正被扣留調查。

另外，執法部門於同日接獲另一宗報案，指機場保安人員為出境旅客進行安全檢查期間，發現有一件屬於一名打算前往上海的37歲本地女子的手提行李內藏有懷疑胡椒噴霧的違禁物品。經調查後，拘捕該名女子，涉嫌違反《火器及彈藥條例》。該名女子獲准保釋候查。"
bkn-20260402083537599-0402_00822_001,宏福苑單位現燈光　調查證實物件反光引致,2026-04-02 08:35,2026-04-02 08:35,https://hk.on.cc/cnt/news/20260402/bkn-20260402083537599-0402_00822_001.html,宏福苑單位現燈光　調查證實物件反光引致,香港,oncc,2026-04-02 09:45,大埔宏福苑去年11月發生五級大火，上月初更爆出有工人涉嫌在大廈內進行加固工程期間，於單位內偷竊財物。至昨日(4月1日)晚上，有大埔居民發現宏福苑宏盛閣中層一單位晚上疑有燈光，懷疑有人進入單位犯案，立即將相關照片上載至社交平台群組。並有市民以電子報案方式舉報事件；亦有街坊通知現場駐守警員。人員經調查後證實大廈單位沒有燈光，相信事件屬有物件反光引致，屬誤會一場。
bkn-20260402082439513-0402_00822_001,土瓜灣護老院男院友高處墮下受傷被困外牆冷氣機架獲救送院,2026-04-02 08:24,2026-04-02 12:46,https://hk.on.cc/cnt/news/20260402/bkn-20260402082439513-0402_00822_001.html,"土瓜灣護老院男院友高處墮下　受傷被困外牆冷氣機架獲救送院


土瓜灣有人墮樓。今日(2日)早上8時09分，有途人報案指，一名手部受傷流血男子懷疑被困於落山道與馬頭圍道交界一後巷2樓位置冷氣機架上。消防接報到場架起長梯將被困清醒老翁救回安全位置，交救護車送院治理。人員經調查後證實，老翁為馬頭圍道360號一護老院院友，相信老翁由院舍3樓平台墮下，",香港,oncc,2026-04-02 14:30,"土瓜灣有人墮樓。今日(2日)早上8時09分，有途人報案指，一名手部受傷流血男子懷疑被困於落山道與馬頭圍道交界一後巷2樓位置冷氣機架上。消防接報到場架起長梯將被困清醒老翁救回安全位置，交救護車送院治理。人員經調查後證實，老翁為馬頭圍道360號一護老院院友，相信老翁由院舍3樓平台墮下，擱在2樓外牆冷氣機架上被困，其墮下原因有待調查。

現場消息指，事主過去亦曾有尋短紀錄，今晨懷疑老翁企圖擅自離開護老院，攀爬平台外牆期間失足墮下。

防止自殺求助熱線：

香港撒瑪利亞防止自殺會： 2389 2222

生命熱線： 2382 0000

社會福利署： 2343 2255

撒瑪利亞會熱線(多種語言)： 2896 0000

醫管局精神健康專線： 2466 7350

明愛向晴軒： 18288

東華三院芷若園： 18281

「情緒通」熱線： 18111

賽馬會青少年情緒健康網上支援平台「Open噏」： http://www.openup.hk"
