id,title,date,last_update,url,lead,section,source,scrape_time,news_content
bkn-20250808194023308-0808_00822_001,廣東道車來車往小個便　尿尿小童罰款5千元,2025-08-08 19:40,2025-08-08 21:15,https://hk.on.cc/cnt/news/20250808/bkn-20250808194023308-0808_00822_001.html,廣東道車來車往小個便　尿尿小童罰款5千元,香港,oncc,2025-08-08 21:45,"有人三急，有人選擇就地解決，「民間洩洪」可謂防不勝防。《東呼即應》近日在網上發現短片，顯示一名小童在尖沙咀廣東道，車來車往之際尿尿。另有片段顯示，一名男子向停泊於錶位的私家車後輪射尿。根據《公眾潔淨及防止妨擾規例》，在公眾地方隨地便溺屬違法行為，初犯者可被罰款5,000港元，再犯者罰款更高達1萬港元。

近日網上有廣傳片段，有網民拍到在尖沙咀廣東道，竟然有位真人版「尿尿小童」，眾目睽睽下於車來車往的路邊小解，民間洩洪的舉動「嚇窒99.9%香港人」。對於廣東道名店林立，竟然有小童來趟當街「洩洪」，實在大煞風景，有人或者會問，「這個是哪裏來的小孩啊」，會不會是「入鄉隨俗」。

此外，有另一名男子亦被拍到，向一部私家車的後轆射尿，又一次的沒有預警的「民間洩洪」，值得留意的是，片段中有人長時間拿着手機，究竟是低頭族要機不離手，小便也沒有稍息，抑或是想將過程拍下，向某些他需要交代的單位展示呢？

根據《公眾潔淨及防止妨擾規例》，在公眾地方隨地便溺屬違法行為，初犯者可被罰款5,000港元，再犯者罰款更高達1萬港元；法例同時規定，負責照顧12歲以下兒童的人士，在沒有合理因由下，容許兒童在公眾地方便溺，同樣需要承擔法律責任。"
bkn-20250808190735095-0808_00822_001,重推消費券助刺激消費　廠商會稱長遠仍需經濟轉型,2025-08-08 19:07,2025-08-08 19:07,https://hk.on.cc/cnt/news/20250808/bkn-20250808190735095-0808_00822_001.html,重推消費券助刺激消費　廠商會稱長遠仍需經濟轉型,香港,oncc,2025-08-08 19:15,"香港廠商會向政府提交施政報告建議書，廠商會會長盧金榮強調，面對全球經濟劇變及本地經濟結構加速轉型，香港須靈活轉型，拓展新興產業與經濟增長動能。他對重推消費券持開放態度，但認為僅能短期刺激經濟，長遠需業界升級轉型，應對消費模式轉變。盧指出，本港經濟轉型對海外及內地人才有需求，惟當局須確保勞工政策優先保障本地勞工權益。

廠商會副會長、餐飲聯業協會會長黃家和表示，近期連鎖食肆結業反映市民消費力下降，雖訪港旅客人次按年上升，但人均消費額下降，促請重推針對食肆及零售業的消費券，助業界渡難關。他指，疫前本港需28萬餐飲前線人員，去年底僅剩22萬，勞工短缺影響服務質量。他補充，雖然補充勞工優化計劃惹部分人憂慮影響本地就業，但當局已推出措施堵截招聘違規行為，外勞可補足人手不足，長遠提升服務質量。又指將與勞工處探討優化輸入外勞措施。

廠商會建議設立北都產業園管理公司，於北都建立「香港食品產業園」，聚焦銀髮食品、清真食品及本土特色食品等產業，同時延長「還息不還本」安排，及考慮重推「百分百信用限額提升計劃」，紓緩中小企壓力。"
bkn-20250808190353972-0808_00822_001,台菲商漁業執法合作　落實「1小時通報機制」,2025-08-08 19:03,2025-08-08 19:03,https://hk.on.cc/cnt/news/20250808/bkn-20250808190353972-0808_00822_001.html,台菲商漁業執法合作　落實「1小時通報機制」,台灣,oncc,2025-08-08 19:15,"台灣與菲律賓上月底在台北，舉行《台菲有關促進漁業事務執法合作協定》第7次技術工作小組會議。台外事部門周四（7日）表示，雙方同意更新漁業熱線聯繫資訊，承諾落實前述協定的「1小時通報機制」。

台菲2015年簽署上述協定，在今次技術工作小組會議上，就今年涉及海上漁業爭議事件交換意見。會上又廣泛討論共同合作打擊非法、未報告、不受規範漁撈行為、水產養殖合作，以及引進菲律賓魚種增加台方種原庫多樣性等議題。

台外事部門指出，本次會議由台駐菲代表周民淦、菲律賓駐台代表葛若菲共同主持，台農業部、外交部、海委會海巡署等有關單位均指派代表出席。該部門形容會議成果豐碩，認為此平台深化兩地漁業作業合作交流，增加互信，為雙方漁業發展拓展互惠互利空間。"
bkn-20250808183214787-0808_00822_001,7月白紋伊蚊指數為1.2%　當局擴展控蚊區域降低基孔肯雅熱風險,2025-08-08 18:32,2025-08-08 18:32,https://hk.on.cc/cnt/news/20250808/bkn-20250808183214787-0808_00822_001.html,7月白紋伊蚊指數為1.2%　當局擴展控蚊區域降低基孔肯雅熱風險,香港,oncc,2025-08-08 18:45,"食環署今日(8日)公布，為進一步降低基孔肯雅熱的傳播風險，食環署會將原先在分區指數達20%時啓動的強化控蚊工作，擴展至指數介乎10%至20%的區域。具體而言，食環署會在有關區域進行詳細風險評估，找出蚊患情況較高的地點，聯同各部門及持份者進行密集且具針對性的控蚊工作，亦會通知附近的屋苑，建議管理公司和住戶提高警覺，共同採取防蚊滅蚊措施。

食環署自上月起已在全港各區加強防控蚊患措施，以降低基孔肯雅熱等蚊傳疾病的傳播風險。因應日前出現的基孔肯雅熱輸入個案，食環署已即時在病者的住所，及於感染期曾到訪的地點250米範圍內進行病媒調查及針對性滅蚊工作包括清除蚊蟲滋生地、於不能清除的積水處施放殺幼蟲劑，以及於成蚊棲息處如樹木茂密、陰暗隱蔽的地點和荒廢結構進行超低微量霧化處理，以殺滅成蚊。

7月份白紋伊蚊密度指數為1.2，表示在發現白紋伊蚊的誘蚊器中，白紋伊蚊的平均數量為1.2隻，顯示整體監察地區內的白紋伊蚊成蚊數量並不多。7月份全港白紋伊蚊誘蚊器指數為8.1%，較6月份的9.5%為低，屬於二級水平，顯示監察地區內白紋伊蚊的分布情況頗為廣泛。相關政府部門持續加緊採取防蚊及滅蚊行動，令本月的整體蚊患情況比上月有所改善。此外，食環署將加強白紋伊蚊誘蚊器指數的資訊發放，讓更多市民可以更快掌握蚊患情況，並會進一步加強控蚊工作，降低基孔肯雅熱的傳播風險。

另外，7月份，64個監察地區中，只有馬灣的分區誘蚊器指數高於20%的警戒水平，較6月份的兩個監察地區為少。有關的誘蚊器大多位於區內的康樂設施及公眾地方，食環署已聯同其他政府部門及相關持份者，在陽性誘蚊器的100米半徑範圍加強防蚊滅蚊工作。7月份的每月誘蚊器指數及分區誘蚊器指數高於警戒水平的監察地區數目減少，是由於各政府部門及持份者加緊防蚊及滅蚊，亦有機會受天氣等因素影響。7月份的總雨量為601.7毫米，比6月份的237.3毫米大幅上升。"
bkn-20250808182359373-0808_00822_001,再錄3宗登革熱輸入個案　防護中心：氣溫及雨量上升蚊患恐加劇,2025-08-08 18:23,2025-08-08 18:23,https://hk.on.cc/cnt/news/20250808/bkn-20250808182359373-0808_00822_001.html,再錄3宗登革熱輸入個案　防護中心：氣溫及雨量上升蚊患恐加劇,香港,oncc,2025-08-08 18:45,"香港過去一周再錄得3宗外地傳入的登革熱感染個案。衞生署衞生防護中心今日(8日)公布，病人於潛伏期內曾到柬埔寨、菲律賓及泰國。截至昨日(7日)，今年錄得39宗外地傳入登革熱個案。

中心傳染病處主任歐家榮醫生提醒市民，由於在夏季期間氣溫及雨量上升，本港蚊患情況可能會加劇，加上市民在暑假會較頻繁前往登革熱流行地區，因此本地登革熱的風險正在上升。

世界衞生組織資料顯示，登革熱的全球發病率在過去20年顯著上升，構成重大公共衞生挑戰。在2023年，持續傳播加上登革熱個案突發性急增，導致全球80多個國家及地區共呈報逾650萬宗病例及7,300多宗登革熱相關死亡個案。世衞於去年更錄得超過1,400萬宗個案，創歷史新高。"
bkn-20250808182128606-0808_00822_001,火炭工廈男子監守自盜　偷走120萬元電腦晶片被捕,2025-08-08 18:21,2025-08-08 18:21,https://hk.on.cc/cnt/news/20250808/bkn-20250808182128606-0808_00822_001.html,火炭工廈男子監守自盜　偷走120萬元電腦晶片被捕,香港,oncc,2025-08-08 18:30,"今日(8日)中午12時34分，沙田火炭坳背灣街34-36號一單位，姓麥(40歲)男負責人報案，指發現一批電腦晶片不翼而飛，懷疑被人盜去。警員到場經點算，證實一批共值約120萬港元的電腦晶片被盜走。

經初步調查後，相信有職員監守自盜，遂以「涉嫌」罪拘捕一名姓邵(41歲)男職員，他現正被扣留調查。"
bkn-20250808181517115-0808_00822_001,涉違規借殼爭議　教育局不滿崇正中學校董行為　已暫停該校營辦,2025-08-08 18:15,2025-08-08 19:41,https://hk.on.cc/cnt/news/20250808/bkn-20250808181517115-0808_00822_001.html,涉違規借殼爭議　教育局不滿崇正中學校董行為　已暫停該校營辦,香港,oncc,2025-08-08 19:45,"深圳補習社「摘星教育」被指「借殼」本港崇正中學、讓內地生可以香港學籍在港升學一事續有新發展。教育局今日(8日)表示一直就崇正中學的管理問題與其校監及辦學團體聯絡，得悉有多宗關於香港崇正總會管理權的民事訴訟案件正在進行，鑑於常任秘書長覺得該校校董的行為並不令人滿意，故此按《教育條例》（第279章）第83條，已暫停該校在其校舍內或該校舍內任何部分營辦。教育局會繼續跟進事件，如發現學校有任何違法行為，定必嚴肅處理。

「摘星」今日(8日)在微信公眾號直播解畫，指深圳摘星僅代理崇正中學招生，並沒有在崇正中學舉辦課程，又指摘星教學人員均有與崇正中學簽合約，故師資是崇正老師，負責直播的人更稱自己「既是崇正又是摘星的員工」，該機構又直播中展示一份授權書，指機構與崇正中學於7月18日簽署文件，代其招生。

摘星與崇正今日各有表態，摘星更在網上直播，一名聲稱為「崇正中學招生及行政主任」的駱老師指，教育局已聯絡崇正校方，如果雙方的做法不符合規定，他們會向學生退回入學考試的費用，「如果教育局認為有問題，會停下來，會積極與教育局溝通，不會做違法事情」。

她續指，深圳摘星僅代理崇正中學招生，相關宣傳均在深圳進行，未有在香港進行宣傳或招生活動，目前僅舉行入學考試，未有取錄任何一位學生，又指崇正中學擬招收的學生均會在崇正中學校址上課，教學人員均是崇正中學職員。席間，她又稱自己亦有與崇正簽合約，是崇正中學的員工。

直播中，駱展示了一份授權書，指「崇正中學授權摘星教育進行2026-2028年度招生工作」，上有「深圳摘星文化傳播有限公司」及「香港崇正中學」於7月18日的蓋章。而日前聲稱「摘星DSE負責全科DSE課程教學、教材研發及升學輔導」的宣傳貼文已下架，駱指該貼文的用字不好，「有一些用字讓大家誤會了」，指之後會再發布另一個修改過的宣傳貼文。

駱老師在直播中又透露崇正中學分了兩派人，「管理公司是以校董為主的，校監跟校長的話就不在有控制權的一方，他們沒有控制權」。"
bkn-20250808180504368-0808_00822_001,秀茂坪21歲男子家中暈倒　親友發現已太遲,2025-08-08 18:05,2025-08-08 18:05,https://hk.on.cc/cnt/news/20250808/bkn-20250808180504368-0808_00822_001.html,秀茂坪21歲男子家中暈倒　親友發現已太遲,香港,oncc,2025-08-08 18:30,今午(8日)近4時，秀茂坪順緻街3號順緻苑一名姓張(21歲)男住戶在寓所房間內暈倒，其親友發現報案。救護員接報到場，證實事主已經死亡。警員將案件列屍體發現，其死因有待驗屍後確定。據了解，張男有身體病紀錄。
bkn-20250808180454659-0808_00822_001,省委整治形式主義　解散逾1.9萬個工作群,2025-08-08 18:04,2025-08-08 18:04,https://hk.on.cc/cnt/news/20250808/bkn-20250808180454659-0808_00822_001.html,省委整治形式主義　解散逾1.9萬個工作群,江西,oncc,2025-08-08 18:15,"江西省委機關報章周三（6日）報道，當地整治形式主義為基層減負，包括累計解散1.9萬多個不必要的工作群等。不少基層幹部近日在工作調研中反映，以前層出不窮的形式主義做法已大幅減少。

報道指，在全省上下共同努力下，有效糾治突出問題，例如今年上半年，省委全口徑發文同比減少28.2%，省級層面直達基層的會議同比減少80%；「三項工程」專項整治中，明確的83項「當下改」舉措已全部完成；全省綜合考核一級指標數量再減少9個；全面開展清理規範借調幹部「回頭看」，防止反彈回潮；集中整治涉企執法中的亂收費、亂罰款、亂檢查等問題，截至上月底共摸排2,912條問題線索，移送紀檢監察機關1,038條、處理351人。

為鞏固減負成果、實現長效常治，江西省委將嚴格落實製發文件與為基層減負一致性評估，凡發文必開展前置審核、效果評估；深化零基預算改革，明確省市各部門不得自行對縣級提出資金配套等要求；推動典型問題核查通報常態化，今年省級層面已通報3批9個典型問題，帶動設區市通報36個問題。"
bkn-20250808170311352-0808_00822_001,台中市長訪澳洲新省議會　因應全球經濟挑戰尋求支持,2025-08-08 17:03,2025-08-08 17:03,https://hk.on.cc/cnt/news/20250808/bkn-20250808170311352-0808_00822_001.html,台中市長訪澳洲新省議會　因應全球經濟挑戰尋求支持,台灣,oncc,2025-08-08 17:15,"台灣台中市市長盧秀燕周二（5日）深夜率團出訪澳洲一周，周四（7日）拜會新南威爾士省議會上議院重要成員。她表示，台中希望藉由城市互訪增加雙邊互動，另因應全球經濟挑戰，希望未來澳洲政府也能持續給予支持。

在台駐悉尼辦事處長吳正偉陪同下，盧秀燕與新南威爾士省議會上議院議長富蘭克林（Benjamin Franklin）、副議長羅伯茨（Rod Roberts）等人舉行早茶會，交流雙方推動民主成果。她為台灣參與《跨太平洋夥伴全面及進步協定》（CPTPP）、國際民航組織、世界衞生大會發聲，強調台灣與澳洲理念相近、重視民主，感謝省議會對台友好和支持。

盧秀燕又邀請澳方代表參加大墩美展開幕式，並邀請富蘭克林議長等人未來親訪台中，感受城市文化與觀光魅力，更希望雙方於智能製造、科技融合及永續城市等方面深化合作。"
bkn-20250808170034145-0808_00822_001,非法出售及購買墮胎藥　11外傭被捕檢10藥丸,2025-08-08 17:00,2025-08-08 17:46,https://hk.on.cc/cnt/news/20250808/bkn-20250808170034145-0808_00822_001.html,非法出售及購買墮胎藥　11外傭被捕檢10藥丸,香港,oncc,2025-08-08 18:00,"執法部門於今年6月2日接獲市民報案，指其外傭於天水圍住所房間內暈倒，下半身染有血漬。救護員到場後，在女傭床邊的洗衣籃內，發現一個35厘米長胎兒，經檢查後證實胎兒已經死亡。警員在該女傭房間內檢獲呈陽性驗孕棒，及懷疑是墮胎藥的包裝，經調查後，發現該外傭於今年5月底向朋友購買藥物，並服食及進行墮胎，隨即以涉嫌「殺胎」罪，拘捕該名39歲外傭。

法醫經解剖胎兒，證實28周大，沒有迹像顯示是活產。警員其後鎖定該名朋友的身份，並於7月6日在香港國際機場，截獲一名外籍傭工，於其工作地點找到墮始藥的包裝和10粒藥丸。初步調查發現，該些藥丸屬處方藥，以涉嫌「意圖導致墮胎而供應藥物」及「非法管有第1部毒藥」罪，拘捕該名32歲外傭。

經過深入調查後，揭發該名32歲外傭，於2024年5月至今年5月期間，向其他外傭出售同款墮胎藥。因此，執法部門於7月29日至今日(8月8日)，在全港多區以涉嫌「施用藥物以促致墮胎」罪拘捕9名(30至46歲)女子，當中5人已被落案控訴，5人獲准保釋候查，1人仍被扣查。據悉，相信墮胎藥在其他國家購買，外傭經朋友介紛購買，相信外傭墮胎目的是為了保住工作，每粒藥墮胎藥售價數百港元。"
bkn-20250808165056239-0808_00822_001,21「劏房」業主違反法例被定罪差估署已檢控1143宗個案,2025-08-08 16:50,2025-08-08 16:50,https://hk.on.cc/cnt/news/20250808/bkn-20250808165056239-0808_00822_001.html,"21「劏房」業主違反法例被定罪　差估署已檢控1143宗個案


21名俗稱「劏房」的分間單位業主因違反《業主與租客(綜合)條例》第IVA部的相關規定，於上周五(1日)及今日(8日)在東區裁判法院承認有關控罪，並被判處罰款共88,100元。自《條例》生效以來，差餉物業估價署（估價署）持續加強採取執法行動，至今已合共檢控1,143宗個案，而就法庭已",香港,oncc,2025-08-08 20:00,"21名俗稱「劏房」的分間單位業主因違反《業主與租客(綜合)條例》第IVA部的相關規定，於上周五(1日)及今日(8日)在東區裁判法院承認有關控罪，並被判處罰款共88,100元。自《條例》生效以來，差餉物業估價署（估價署）持續加強採取執法行動，至今已合共檢控1,143宗個案，而就法庭已處理的803宗個案，均全數成功定罪，共涉及696名分間單位業主，罰款介乎400元至41,600元，合計總罰款共2,104,910元，另有340宗個案則正等待進行聆訊。

這些業主的罪行包括，沒有在規管租賃的租期開始後的60日內，向估價署署長提交租賃通知書(表格AR2)；要求租客付還經分攤的水及／或電費時沒有出示繳費單副本及提供書面帳目；及要求租客支付不屬《條例》所准許的種類的款項(包括要求租客支付的次期租賃租金超過《條例》所准許的最高租金款額)。其中一名業主觸犯上述首項共16宗罪行而被判處罰款16,000元。

估價署於早前發現這些業主涉嫌違反《條例》的相關規定。經深入調查及搜集證據後，估價署向這些業主提出檢控。"
bkn-20250808164528918-0808_00822_001,物業空置率證來港人才無落戶香港　勞福局：先租住物業屬正常,2025-08-08 16:45,2025-08-08 16:45,https://hk.on.cc/cnt/news/20250808/bkn-20250808164528918-0808_00822_001.html,物業空置率證來港人才無落戶香港　勞福局：先租住物業屬正常,香港,oncc,2025-08-08 17:30,"早前有政界人士稱本港私樓入住量近年變化不大，說明絕大多數來港人才家庭沒有落戶香港。勞工及福利局局長孫玉菡發表文章，稱物業空置率大致不變，皆因本港20至34歲年齡層人口下跌，幸有搶人才措施才大致平穩「幸保不失」，又說人才子女是香港未來生力軍，形容措施「育才」的長線投資。孫另說「高才通」計劃剛迎來首批續簽申請，續簽情況相當理想，兩周內會公布相關統計數字。

孫玉菡今日(8日)在社交平台發表「以數據說話　招攬人才效益顯著」的文章，指自2022年底推出了一系列「搶人才」措施，截至上月底，各項人才入境計劃共收到約51萬宗申請，其中約34萬宗獲批，超過22萬名人才已經抵港。而人才來港樂業也要安居，但孫說他們選擇先租住物業屬正常不過，而2022年12月至今年6月，香港私人住宅租金指數累計上升逾10%。

對於有人質疑外來人才有住房需要，住宅物業空置率理應下降，但最新數字卻大致不變，孫解釋，情況由於20至34歲人口普遍隨着就業、結婚而會另置居所，但此年齡層人口10年間下跌約24萬，令住宅需求減少，幸有「搶人才」措施帶來新客源，空置率才大致平穩，形容是「幸保不失」。

孫續指，新來港的人才大多處於工作年齡，正值「打拚黃金期」，以30至44歲年齡層來看，去年的勞動人口較2022年累計升1.7%，遠比整體勞動人口同期0.3%的增長率快。而部分抵港人才更攜同家眷來港落戶，其中從2023年初到今年6月底，已經有逾10萬名高才通受養人「生力軍」抵港，扭轉本地勞動人口跌勢。而人才的子女是香港未來生力軍，有望改善人口結構，形容「搶人才」措施是「育才」的長線投資。

另外，孫指欣悉大部分來港人才已在香港成功就業，主要投身金融、創新及資訊科技和商貿等行業。而高才通計劃下發出的首批簽證去年12月底起陸續到期，至今續簽情況亦相當理想，將在未來兩星期內公布相關統計數字。

香港在去年底有753萬人，而按政府統計處最新推算至2046年中，人口將增至819萬人，但65歲或以上長者屆時會佔整體人口的36%，即每3個人便有1個是銀髮族，而勞動人口參與率也會從2024年的55%，下降到2046年的52%。"
bkn-20250808164310967-0808_00822_001,墮「假冒電訊商客服」騙局　市民損失550萬存款,2025-08-08 16:43,2025-08-08 16:43,https://hk.on.cc/cnt/news/20250808/bkn-20250808164310967-0808_00822_001.html,墮「假冒電訊商客服」騙局　市民損失550萬存款,香港,oncc,2025-08-08 18:15,"近日有市民收到「假冒電訊商客服」騙徒來電，訛稱事主的大灣區數據計劃試用期結束，將要開始每月扣費。事主表示無意購買，於是「假冒電訊商客服」轉介相關銀行，以協助取消自動轉帳服務。

事主不虞有詐，接聽「假冒銀行客服」畫面全黑的WhatsApp視像通話，期間事主按騙徒指示開啟「分享屏幕」功能，在個人手機上操作網上理財銀行。事主的個人資料被一覽無遺，並向騙徒提供「一次性交易密碼」及「驗證碼」以提供協助，過程中迫使事主在未經思考的情況下做出反應，最終被騙徒轉走逾550萬銀行存款。"
bkn-20250808164108290-0808_00822_001,扮芝士圖蒙混過關　機場檢7.7公斤可卡因　葡萄牙返港男明日提堂,2025-08-08 16:41,2025-08-08 16:41,https://hk.on.cc/cnt/news/20250808/bkn-20250808164108290-0808_00822_001.html,扮芝士圖蒙混過關　機場檢7.7公斤可卡因　葡萄牙返港男明日提堂,香港,oncc,2025-08-08 17:15,"香港海關昨日(7日)在香港國際機場偵破一宗行李藏毒的販毒案件，檢獲約7.7點公斤懷疑可卡因，市值約610萬港元。經調查後，該名被捕人士已被控以一項販運危險藥物罪，案件明日(9日)在九龍城裁判法院提堂。

　　 

一名20歲男旅客昨日從葡萄牙里斯本經法國巴黎飛抵本港。海關人員替他進行清關時，在其寄艙行李內發現偽裝成芝士的懷疑可卡因，重約7.7公斤，遂把該名男子拘捕。

根據《危險藥物條例》，販運危險藥物屬嚴重罪行，一經定罪，最高可被判罰款500萬元及終身監禁。

　　"
bkn-20250808163033698-0808_00822_001,偽冒交通補貼計劃網站　圖呃信用卡賬戶及個人資料　運輸署籲提防,2025-08-08 16:30,2025-08-08 16:30,https://hk.on.cc/cnt/news/20250808/bkn-20250808163033698-0808_00822_001.html,偽冒交通補貼計劃網站　圖呃信用卡賬戶及個人資料　運輸署籲提防,香港,oncc,2025-08-08 16:45,"運輸署今日(8日)呼籲市民提高警覺，留意偽冒公共交通費用補貼計劃的虛假網站，企圖騙取市民提供信用卡賬戶及其個人資料。運輸署澄清有關虛假網站與補貼計劃沒有任何關係，已把事件交執法部門跟進。

運輸署重申，市民領取補貼計劃的補貼並不需要提供信用卡賬戶及其個人資料，有關領取補貼的詳情可瀏覽補貼計劃網站。市民如接獲不明來歷的短訊，應保持警覺，切勿登入可疑網站及提供個人資料。任何市民若曾向該網站提供個人資料，應與執法部門聯絡。"
