id,title,date,last_update,url,lead,section,source,scrape_time,news_content
bkn-20251103130159715-1103_00822_001,港大天文與天體物理研究所今成立　 冀未來5年每年聘1位國際學者,2025-11-03 13:01,2025-11-03 13:01,https://hk.on.cc/cnt/news/20251103/bkn-20251103130159715-1103_00822_001.html,港大天文與天體物理研究所今成立　 冀未來5年每年聘1位國際學者,香港,oncc,2025-11-03 13:15,"香港大學今日（3日）成立香港天文與天體物理研究所 （HKIAA）。香港天文與天體物理研究所所長張冰表示，本港擁有連接內地和西方國家獨特地位，能成為全球交流協作的橋樑，而研究所會與內地緊密合作，學習製作大型射電望遠鏡等技術，而未來計劃每年舉辦3至4個國際研討會，並在未來5年每年均引進一位國際學者。

張又指，研究所目前有港大6名物理學系教授及3名地球與行星科學系教授，亦有14名來自其他本地院校學者加入，而研究工作不只著重學術理論，更要觀察第一手數據，以在世界頂尖科學期刊發表工作成果。至於研究所首5年經費將由港大提供，期後將申請本地基金及在內地爭取經費，未來會進一步研究大型項目的可行性，至於研究所在數碼港的新設施，將在明年初啟用。

港大校長張翔指，天文及天體學是前沿科學，亦是國家未來的發展方向，研究所除了會與香港各院校合作，亦會和大灣區約10至20所大學合作進行天體和天文學研究。而創新科技及工業局局長孫東則表示，研究所有來自世界各地的科研人員，為本港天體物理研究和技術創新邁出重要一步，亦強化香港和內新興產業合作，而研究所的成立與政府建立研究與開發生態圈，以建立太空經濟的方向一致，相信研究所會為香港開通一條光明道路。"
bkn-20251103124854017-1103_00822_001,洪水橋新區收地補償機制脫節居民被要求出示數十年前文件,2025-11-03 12:48,2025-11-03 19:20,https://hk.on.cc/cnt/news/20251103/bkn-20251103124854017-1103_00822_001.html,"洪水橋新區收地　補償機制脫節　居民被要求出示數十年前文件


為推動洪水橋/厦村新發展區第二期發展，政府近期正式展開收地行動，不少居民需遷出居住多年的住所。議員狄志遠自去年6月起受理居民有關收地政策的查詢和投訴，並於今日(3日)公布相關研究報告，當中有90%個案均涉及土地安置問題，揭示現行土地補償機制存在嚴重結構性缺陷，包括補償審查繁瑣不透明",香港,oncc,2025-11-03 22:15,"為推動洪水橋/厦村新發展區第二期發展，政府近期正式展開收地行動，不少居民需遷出居住多年的住所。議員狄志遠自去年6月起受理居民有關收地政策的查詢和投訴，並於今日(3日)公布相關研究報告，當中有90%個案均涉及土地安置問題，揭示現行土地補償機制存在嚴重結構性缺陷，包括補償審查繁瑣不透明、補償標準與實際情況脫節、溝通機制模糊等。狄志遠指出，基層民眾對政策執行透明度及公正性不滿，批評現行收地制度在人文關懷與公共參與層面不足，大多居民需要議員幫忙「同政府拗」才可獲安置，形容情況不理想，促政府即時「人性化」止血。

狄志遠發表《香港收地政策是否合理？——以洪水橋受影響居民為例的政策檢視》，報告研究了32個受收地影響的居民個案，當中有逾90%問題牽涉土地安置問題，其中包括43.75%的個案涉及房屋安置爭議；25%與登記及地址證明有關；21.9%屬補償爭議及行政延誤，反映現行收地與安置政策在制度設計與實際執行之間的明顯落差。

參與研究報告的香港城市大學亞洲及國際研究學系學生曹承祐指出，現行制度過度依賴文件及凍結日期，忽視居民的真實生活情境與變化，有部分居民或被要求出示數十年前的信件或文件；甚至部分居民因沒有信箱，一向使用鄰居、村口士多、親戚朋友的信箱收信，故政府不接受信件地址作為居民的住址證明。曹認為，若政府未能簡化登記程序、引入實況證明機制、提升行政透明度，並建立更具彈性及人本導向的安置制度，居民將持續面臨制度邊緣化的困境，造成發展與民生之間的矛盾難以化解。

同樣參與研究的城大公共政策與政治學系學生霍威信表示，洪水橋收地範圍內約有800至1,000隻動物受影響，許多村民無法在新安置屋飼養原有寵物，大型犬隻更被禁止進入公屋，造成情感與生活斷層；而文化層面亦受威脅，北部多條擁有百年歷史的鄉村及宗祠、書室、炮樓等文化載體面臨清拆，其中包括10幢具評級歷史建築及如姚聖母廟等地點。祖堂土地補償制度混亂，傳統祭祀與族群活動空間流失，文化傳承難以延續。

狄志遠批評，現行政府收地政策僵硬、無效率和缺乏溝通，他接觸的受影響村民均支持發展，只希望得到合理安置，他舉例指有元朗區獨居長者在當地住了40多年，身體不好，本以為遷拆可獲賠償，豈料獲政府告知因寮屋屬僭建，不能被安置只能清拆。狄又指自去年起接觸了很多居民，協助居民與政府開了數次大會作直接對話，目前仍有30多個個案跟進當中，部分個案仍未解決。

研究團隊建議，在資格認定與補償標準上，可引入「雙軌資格認定制度」，保留現行文件正規軌，同時新增「實況證明軌」以加權佐證評分；又建議設立「一站式收地與安置聯絡辦公室」及跨部門「收地事務工作委員會」，由發展局統籌，地政、房屋、房協、社署共同參與，貫徹「先安置後清拆」原則，收地前須經房屋署確認安置到位、社署核實弱勢支援後方可執行；並修訂《收回土地條例》，加入最低準備期、安置到位門檻與強制暫停機制，任何續效未達標即禁止進入下一階段。"
bkn-20251103122316967-1103_00822_001,KK園區近1600名外籍人員逃入泰國　中國籍佔185人,2025-11-03 12:23,2025-11-03 12:23,https://hk.on.cc/cnt/news/20251103/bkn-20251103122316967-1103_00822_001.html,KK園區近1600名外籍人員逃入泰國　中國籍佔185人,中國,oncc,2025-11-03 12:30,"緬甸軍方早前清剿位於妙瓦底的電信詐騙KK園區，大批外籍人員逃入泰國境內。泰國軍方上周六（1日）表示，目前全天候監控達府湄索縣一帶的接壤緬甸邊境，嚴格篩查入境人員，確保邊境安全。達府泰緬邊境聯合指揮中心統計，至今有1,595人越境進入泰國，其中185人是中國籍。

泰國軍方通過泰緬邊境委員會正式向緬甸提出抗議，要求在接管上述區域時採取謹慎措施，避免波及兩國邊境地區。

目前越境進入泰國境內的人員當中有1,330名，265名女性265。他們大多數為外籍人員，包括印度籍465人、菲律賓籍220人、中國籍185人、越南籍151人、埃塞俄比亞籍130人，另有來自肯尼亞、巴基斯坦、尼泊爾、烏克蘭、印尼、老撾、南非等20多地的人員。泰國已拘捕並起訴680名外籍人員，其中439人繳交罰款後遣返，23人納入國家保護機制審查程序，等待確認是否涉及人口販賣案件。"
bkn-20251103122124837-1103_00822_001,啟德主場館煙頭引發火警　217人自行疏散無人受傷,2025-11-03 12:21,2025-11-03 20:31,https://hk.on.cc/cnt/news/20251103/bkn-20251103122124837-1103_00822_001.html,啟德主場館煙頭引發火警　217人自行疏散無人受傷,香港,oncc,2025-11-03 20:45,"啟德體育園發生火警。今早(3日)11時31分，啟德主場館職員報案，指上址館內一工具房有濃煙冒出，懷疑有雜物起火。救援人員接報到場，消防將火警列為二級，並派出一隊煙帽隊及開動一條喉灌救。

至中午12時35分將火救熄，事件中無人受傷，217人自行疏散。據了解，涉事工具房位於館內7樓，主要擺放枱櫈。消防經初步調查後，相信毋熄煙頭引致火警。

啟德體育園表示，今早啟德主場館7樓一處冒煙觸發警鐘響起，消防控制中心收到信號後立即派員到場處理事件。啟德體育園已即時啟動既定的應變機制疏散場內職員。火警已救熄，事件中無人受傷，員工現已返回主場館工作崗位。

啟德體育園會配合執法部門及消防處調查事件起因。事件並無影響在啟德體藝館進行的全運會手球賽事，亦不會對即將舉辦的全運會七人制橄欖球及其他賽事造成影響。"
bkn-20251103121005316-1103_00822_001,多地迎強降雨降雪降溫氣溫或創立秋後新低,2025-11-03 12:10,2025-11-03 15:37,https://hk.on.cc/cnt/news/20251103/bkn-20251103121005316-1103_00822_001.html,"多地迎強降雨降雪降溫　氣溫或創立秋後新低


內媒周一（3日）報道，全國本周將開啟「雨雨雪雪冷冷」的天氣「大亂鬥」模式，多地迎強降雨降雪降溫。其中南方有大範圍降雨東擴，西北有新一輪強降雪登場，前有霧和霾打游擊，後有較強冷空氣橫掃中東部，還將受目前為強烈熱帶風暴的今年第25號颱風「海鷗」影響。南方地區下周前期先經歷陰雨帶來的濕冷",中國,oncc,2025-11-03 16:30,"內媒周一（3日）報道，全國本周將開啟「雨雨雪雪冷冷」的天氣「大亂鬥」模式，多地迎強降雨降雪降溫。其中南方有大範圍降雨東擴，西北有新一輪強降雪登場，前有霧和霾打游擊，後有較強冷空氣橫掃中東部，還將受目前為強烈熱帶風暴的今年第25號颱風「海鷗」影響。南方地區下周前期先經歷陰雨帶來的濕冷，多地最高氣溫料創立秋後新低，隨後大部氣溫整體會快速回升。

降雨方面，雲南到江西、福建西部一線周一將普遍有中到大雨，周二（4日）西南地區降雨基本結束，降水進一步向東轉移，強度明顯減弱，江南、華南以小到中雨為主，只有廣東、海南部分地區仍有大雨。南方降雨剛停，西北的強降雪將接力上場，預計周二至周四（6日）新疆西部和北部先後出現大範圍雨雪天氣，天山沿線以及阿勒泰周邊地區有大到暴雪。新一股較強冷空氣周三至下周日（5日至9日）自西向東影響國內大部地區，氣溫普遍下降4至8℃，局地降溫逾10℃。

受「海鷗」和冷空氣的共同影響，周二夜間到周五（7日）南海大部將先後出現明顯風雨天氣。「海鷗」的中心周一上午位於菲律賓馬尼拉東偏南方向約950公里的西北太平洋洋面上，料於周一晚至周二凌晨登陸菲律賓中部沿海，周三移入南海東南部海面並逐漸加強，之後趨向越南中部沿海。"
bkn-20251103120023760-1103_00822_001,菲加簽軍隊互訪地位協定批華奉行擴張主義,2025-11-03 12:00,2025-11-03 16:09,https://hk.on.cc/cnt/news/20251103/bkn-20251103120023760-1103_00822_001.html,"菲加簽軍隊互訪地位協定　批華奉行擴張主義


菲律賓防長特奧多羅與加拿大防長麥堅迪周日（2日）在菲律賓馬卡蒂舉行會談，會後簽署《軍隊互訪地位協定》，擴大聯合軍演並深化安全合作。此舉被視為對中國在區內，尤其是在南海爭議地區日益強硬姿態的回應。<br/><br/>這是加拿大與印太區域國家簽署的首份同類協定，",中國,oncc,2025-11-03 18:15,"菲律賓防長特奧多羅與加拿大防長麥堅迪周日（2日）在菲律賓馬卡蒂舉行會談，會後簽署《軍隊互訪地位協定》，擴大聯合軍演並深化安全合作。此舉被視為對中國在區內，尤其是在南海爭議地區日益強硬姿態的回應。

這是加拿大與印太區域國家簽署的首份同類協定，也是菲律賓繼美國、澳洲、日本和新西蘭後，與外國簽署的第5份同類協定。麥堅迪指出，菲加《軍隊互訪地位協定》讓兩國更緊密相連，加拿大希望參與更多區域聯演，強調穩定源自合作而非對抗。

特奧多羅則指，該協定將加強兩國在人道危機和自然災害期間的聯合訓練、資訊共享和協調，維護亞太地區以規則為基礎的國際秩序。他又指摘中國奉行擴張主義，是霸權主義者，企圖在世界上擴張領土。

中國外交部發言人毛寧周一（3日）回應指，中方一貫認為國家之間的防務安全合作不得針對第三方或損害第三方的利益，炫耀武力、挑動對抗不利於地區和平穩定。"
bkn-20251103115159180-1103_00822_001,全運會義工制服未收齊　統籌辦：分配額未滿足香港賽區需求,2025-11-03 11:51,2025-11-03 11:51,https://hk.on.cc/cnt/news/20251103/bkn-20251103115159180-1103_00822_001.html,全運會義工制服未收齊　統籌辦：分配額未滿足香港賽區需求,香港,oncc,2025-11-03 12:15,"第15屆全國運動會香港賽區委任超過1.6萬名市民擔任義工，主辦單位早前亦於社交平台上提醒義工，登記取件訊息以收取制服速遞，又指制服會於本月上旬送抵，然而全運會開幕在即、部分競賽項目已經開始的情況下，不少義工仍表示尚未收到制服。就該情況，全國運動會香港賽區統籌辦公室表示，粵港澳三地的運動服，包括運動員、工作人員和義工的制服由廣東省執委會統一進行市場開發，而廣東今年初通知，會由一家統一開發合作夥伴贊助企業贊助，提供全運會所需的制服予三地。但是由於分配額不足以滿足香港賽區的制服需求，香港賽區的義工制服須其後通過採購程序，向相關贊助企業另外付款採購，才能有足夠數量分配，服裝生產與送遞亦因而有所延遲，而香港賽區一直催促贊助企業加快生產，並向廣東執委會反映問題。

 

統籌辦公室又表示，最近已陸續收到贊助企業分批交付的制服，預期可在本星期內開始，逐步以整套形式分發給各位義工。由於義工人數眾多，將採用合約物流服務平台進行分發程序，務求在短時間內迅速將制服分發到義工所選擇、位於全港不同位置的自提點，以便加快派發流程和方便義工領取制服，同時亦一直與義工團體緊密聯繫，務求將包括有關制服分發的訊息適時傳達給義工，並感謝全體義工團隊的配合。"
bkn-20251103114945682-1103_00822_001,煽惑他人披露當事人個人資料罪成　新聞編輯判120小時社服令,2025-11-03 11:49,2025-11-03 11:49,https://hk.on.cc/cnt/news/20251103/bkn-20251103114945682-1103_00822_001.html,煽惑他人披露當事人個人資料罪成　新聞編輯判120小時社服令,香港,oncc,2025-11-03 12:15,"早前有人於網上討論區留言，籲一宗非禮案罪脫的男被告公開涉案女子資料，其後一名商人及一名新聞編輯被指涉案被捕，並各被控一項煽惑他人未獲資料當事人同意下披露其個人資料罪。該新聞編輯早前承認控罪，該案件今（3日）於東區裁判法院判刑，裁判官指被告有悔意且重犯可能性低，判其120小時社會服務令。

被告黃樂（36歲，報稱新聞編輯），被控一項煽惑他人未獲資料當事人同意下披露其個人資料罪，指他於2024年5月7日至8月7日期間，在香港非法煽惑他人在未經資料當事人女子X的相關同意下去披露X的個人資料，即其姓名，意圖導致該X或其家人蒙受指明傷害，或罔顧該披露是否會或相當可能會導致X或其家人蒙受指明傷害。

裁判官判刑時指，雖黃罪名嚴重但此案件不是同類型中最嚴重，而黃也沒有令事主X的個人資料暴露。同時，他接納黃在網上見到一宗非禮案相關報導，以為該被捕人是受害者，不加思考下而犯案的說法，念在其有悔意且初犯，加上黃在審訊開始前已認罪節省法庭的時間，而其亦因本次事件辭去工作受到深刻教訓，故接納感化官建議，判其120小時社會服務令。

案件編號：ESCC 3400/2024"
bkn-20251103113934506-1103_00822_001,深圳灣口岸3的士相撞　2的哥受傷送院,2025-11-03 11:39,2025-11-03 11:39,https://hk.on.cc/cnt/news/20251103/bkn-20251103113934506-1103_00822_001.html,深圳灣口岸3的士相撞　2的哥受傷送院,香港,oncc,2025-11-03 12:45,深圳灣口岸發生交通意外。今早(3日)11時13分，一輛市區的士於深圳灣口岸的士站意外攔腰撞向一輛新界的士，並將其推至撞及另一輛市區的士。意外中，兩名的哥受傷清醒，由救護車送往屯門醫院治理。意外原因有待調查。
bkn-20251103111246263-1103_00822_001,華促日將有關實體　移出出口管制最終用戶清單,2025-11-03 11:12,2025-11-03 11:12,https://hk.on.cc/cnt/news/20251103/bkn-20251103111246263-1103_00822_001.html,華促日將有關實體　移出出口管制最終用戶清單,中國,oncc,2025-11-03 11:15,"中國商務部部長王文濤上月30日在南韓慶州會見日本經濟產業大臣赤澤亮正，討論中日經貿關係等議題。中國商務部周日（2日）發布消息，王文濤敦促日方，盡快將中方有關實體移出出口管制最終用戶清單。

王文濤表示，當前單邊主義、保護主義衝擊國際經貿秩序，雙方應相向而行，用好出口管制對話等機制，共同維護產業鏈供應鏈穩定暢通。中方希望中日雙方，共同維護以世貿組織為核心的多邊貿易體制，推動區域經濟合作進程，為世界經濟注入更多穩定性。

赤澤亮正表示，日方重視發展對華經貿關係，願與中方構建建設性、穩定的關係，積極開展政策對話，增進理解互信，拓展務實合作，共同維護以規則為基礎的國際經濟秩序。此前報道指，他亦要求中方撤銷對日本水產品的進口限制，並強烈關切中國稀土出口管制。"
bkn-20251103111158391-1103_00822_001,單車租賃舖阻街持續　相關部門每月僅巡1次　申訴署提17建議,2025-11-03 11:11,2025-11-03 11:11,https://hk.on.cc/cnt/news/20251103/bkn-20251103111158391-1103_00822_001.html,單車租賃舖阻街持續　相關部門每月僅巡1次　申訴署提17建議,香港,oncc,2025-11-03 11:45,"沙田區有單車租賃店舖，長期把大量單車放置在店舖外的行人通道，對行人構成阻礙甚至潛在安全隱患，要求相關部門跟進行動。申訴專員陳積志今日(3日)公布，申訴專員公署完成政府就單車租賃店舖違泊單車問題的規管機制的全面調查。留意到申訴人自2024年5月向民政總署投訴，然而，申訴人指問題並無改善，並認為各部門沒有妥善處理單車租賃店舖的違泊情況。聯合行動前和行動後，事涉地點仍然放置逾百輛單車，顯示單車違泊情況確實持續嚴重。有關問題只是在相關部門執法期間得到短暫改善，不久違泊問題便故態復萌。

公署調查發現，工作小組確實就申訴事涉地點制訂行動指引，而各部門按指引的規定採取聯合行動。就申訴人的投訴，2024年7月至2025年6月，進行6次聯合行動，在現場張貼總共近1,000張法定通知及清理違泊單車。工作小組更特別增加於事涉地點聯合行動頻次，自2025年6月起，由平均每兩個月1次增加至每月1次。工作小組亦有制訂違泊黑點，針對違泊嚴重的地點增加聯合行動。民政處更8月起陸續在違泊黑點安裝告示牌，提醒商戶及有關人士不要違規停泊單車。

就單車違泊情況，公署對工作小組提出了17項改善建議包括，繼續進行跨部門協作，緊密監察單車違泊情況；在事涉違泊地點持續執行每月至少一次的大規模聯合行動；考慮由以往每半年加強至每季甚至每月在聯合行動後檢討成效，並在有需要時適當地調整執法策略；在日常巡查中，如發現有嚴重阻礙行人通道或對行人構成危險的情況，考慮即時或至少優先清理違泊的單車。

公署又建議有關部門研究引入創新科技智能監察系統，試驗在事涉地點安裝智能鏡頭，利用人工智能辨識違規停泊單車，提升執法成效；考慮在事涉地點附近增加或擴闊現有的單車泊車處，便利有需要的市民和店舖使用；參考汽車停車場的管理，研究在單車泊車處採用雙層泊架的可行性；以及加強與當區商戶的溝通及諮詢，亦要聽取營運者的意見，研究就違泊情況制訂具體及有效的改善方案。公署的所有建議已得到工作小組接受並落實。

政府就處理違例停泊單車的問題，相關地區的處理違例停泊單車工作小組內各部門包括民政事務總署轄下的分區民政事務處、地政總署轄下的分區地政處、食物環境衞生署及運輸署，會因應單車的停泊位置及情況，根據法例賦予的權力和既定程序，適時採取跨部門聯合行動，清理在政府土地上違泊的單車。如接獲有關單車違泊的投訴，地政處、食環署及運輸署會轉介民政處根據工作小組有關清理違例停泊單車的聯合行動指引處理，由當區民政處統籌工作小組進行聯合行動。"
bkn-20251103110216577-1103_00822_001,嚴重違紀違法　中證監原黨委委員副主席王建軍被雙開,2025-11-03 11:02,2025-11-03 11:02,https://hk.on.cc/cnt/news/20251103/bkn-20251103110216577-1103_00822_001.html,嚴重違紀違法　中證監原黨委委員副主席王建軍被雙開,北京,oncc,2025-11-03 11:45,"中國證券監督管理委員會原黨委委員、副主席王建軍涉嚴重違紀違法，經中央紀委常委會會議研究並報中共中央批准，決定給予王建軍開除黨籍處分，由國家監委給予其開除公職處分。

經查，王建軍喪失理想信念，背棄初心使命，對抗組織審查；違反中央八項規定精神，接受可能影響公正執行公務的宴請；不按規定報告個人有關事項，在組織談話時不如實說明問題；利用職權或職務上的影響，為親屬謀取利益；「靠監管吃監管」，將公權力異化為謀取個人私利的工具，大搞權錢交易，利用職務便利為他人在公司上市、融資等方面謀利，並非法收受巨額財物。王建軍嚴重違反黨的政治紀律、組織紀律和廉潔紀律，構成嚴重職務違法並涉嫌受賄犯罪，將收繳其違紀違法所得；將其涉嫌犯罪問題移送檢察機關依法審查起訴，所涉財物一並移送。

另外，四川省人大常委會原黨組成員、副主任宋朝華及國家發展和改革委員會原黨組成員、副主任徐憲平亦因嚴重違紀違法，被開除黨籍處分。"
bkn-20251103102055262-1103_00822_001,明年1.25起商用車座位乘客須戴安全帶　杜絕司機位「孔雀開屏」,2025-11-03 10:20,2025-11-03 10:20,https://hk.on.cc/cnt/news/20251103/bkn-20251103102055262-1103_00822_001.html,明年1.25起商用車座位乘客須戴安全帶　杜絕司機位「孔雀開屏」,香港,oncc,2025-11-03 10:45,"運輸署今日(3日)表示，由2026年1月25日起，所有公共交通工具和商用車的座位乘客均須佩戴安全帶。同日起，任何司機在駕駛時均不可使用多於兩部流動電訊裝置。

由明年1月25日起，所有新登記的公共及私家巴士(包括專營巴士及學生服務車輛)的所有乘客座位；私家小巴(包括學生服務車輛)和貨車的後排乘客座位；及特別用途車輛的司機和所有乘客座位，均須安裝安全帶。同日起，乘坐這些車輛時，如座位已安裝安全帶，不論車輛是否新登記，座位乘客均須佩戴。任何車主、司機或乘客如違反安裝或佩戴安全帶的規定，最高可處罰款5,000元及監禁三個月。司機需注意，15歲以下乘客如在貨車後座或特別用途車輛乘客座位未佩戴安全帶但司機仍駕駛，司機最高可處罰款2,000元。所有乘客則須為佩戴安全帶自行負責。

為加強保障學童並平衡業界的營運需要，現有學生服務車輛須於2028年12月31日前，在所有乘客座位加裝安全帶及保護式座椅。由該日起，如車輛未符合此規定，將不可接載學生。至於專營巴士，所有新購巴士自2018年7月起已於所有座位安裝安全帶，營辦商亦已為約1,900輛現有巴士的所有上層座位加裝安全帶。

由明年1月25日起，任何司機駕駛時不可在前方放置多於兩部流動電訊裝置，即流動電話、平板或手提電腦，而有關裝置的屏幕對角長度不可超過19厘米。流動電訊裝置不能阻礙司機目視道路及交通情況，以及對觀察路況用的鏡、裝置或攝像顯示器的視線。違反上述規定的司機最高可判處罰款2,000元。"
