id,title,date,last_update,url,lead,section,source,scrape_time,news_content
bkn-20260402000208604-0402_00822_001,橫頭磡邨女子與母爭執危坐壆邊兩小時後被勸服送院,2026-04-02 00:02,2026-04-02 09:38,https://hk.on.cc/cnt/news/20260402/bkn-20260402000208604-0402_00822_001.html,"橫頭磡邨女子與母爭執危坐壆邊　兩小時後被勸服送院


昨日(4月1日)晚上8時許，一名姓黃(31歲)女子，在橫頭磡邨宏祖樓住所與母親疑因故爭執，她情緒激動揚言跳樓，及至晚上9時51分，黃女攀出窗外危坐壆邊，其母制止不果報案求助。<br/><br/>救援人員到場向事主展開游說，消防在大廈對開張開救生氣墊，「飛將軍",香港,oncc,2026-04-02 12:00,"昨日(4月1日)晚上8時許，一名姓黃(31歲)女子，在橫頭磡邨宏祖樓住所與母親疑因故爭執，她情緒激動揚言跳樓，及至晚上9時51分，黃女攀出窗外危坐壆邊，其母制止不果報案求助。

救援人員到場向事主展開游說，消防在大廈對開張開救生氣墊，「飛將軍」則在上層戒備；談判專家奉召到場協助。至晚上11時32分，黃女態度終軟化被勸服，由『飛將軍』協助返回住所，再送院檢驗。

防止自殺求助熱線：

香港撒瑪利亞防止自殺會： 2389 2222

生命熱線： 2382 0000

社會福利署： 2343 2255

撒瑪利亞會熱線(多種語言)： 2896 0000

醫管局精神健康專線： 2466 7350

明愛向晴軒： 18288

東華三院芷若園： 18281

「情緒通」熱線： 18111

賽馬會青少年情緒健康網上支援平台「Open噏」： http://www.openup.hk"
bkn-20260401234050107-0401_00822_001,毒男女黃大仙遇查斷正　檢海洛英及藍精靈,2026-04-01 23:40,2026-04-01 23:40,https://hk.on.cc/cnt/news/20260401/bkn-20260401234050107-0401_00822_001.html,毒男女黃大仙遇查斷正　檢海洛英及藍精靈,香港,oncc,2026-04-02 00:00,黃大仙區警員經深入調查後，今日（4月1日）在區內展開打擊毒品行動。警員在育群街截查1男1女，並在現場檢獲39.1克懷疑海洛英及8粒懷疑咪達唑侖（俗稱「藍精靈」），毒品總市值約2.5萬港元。經初步調查後，該名62歲本地男子及該名54歲本地女子分別涉嫌「販運危險藥物」及「管有危險藥物」被捕，2人現正被扣留調查。
bkn-20260401233117481-0401_00822_001,屯門村屋遭撬門爆竊　失12萬現金,2026-04-01 23:31,2026-04-01 23:31,https://hk.on.cc/cnt/news/20260401/bkn-20260401233117481-0401_00822_001.html,屯門村屋遭撬門爆竊　失12萬現金,香港,oncc,2026-04-02 00:00,"屯門發生爆竊案，現場在青磚圍路一村屋，今日(4月1日)晚上8時許，一名姓杜(32歲)女住戶報案，指懷疑上址遭爆竊。

警員接報到場，發現露台門鎖有被撬過的痕迹。經初步點算，相信放置於睡房衣櫃內的12萬港元現金失去。經初步調查，案件列「爆竊」，暫未有人被捕。"
bkn-20260401233039522-0401_00822_001,跨部門出動無人機搗將軍澳工業區「鬼油站」　21歲男子被捕,2026-04-01 23:30,2026-04-01 23:30,https://hk.on.cc/cnt/news/20260401/bkn-20260401233039522-0401_00822_001.html,跨部門出動無人機搗將軍澳工業區「鬼油站」　21歲男子被捕,香港,oncc,2026-04-02 00:00,"鑑於非法流動加油活動有上升趨勢，將軍澳區及東九龍區警員的小型無人機小隊今日（4月1日）晚上聯同消防處打擊非法燃油轉注隊人員，於區內一帶進行針對性打擊非法加油活動的行動，並於將軍澳工業區駿日街搗破一個懷疑非法加油站，共檢獲約257公升汽油，市值約8,200港元。

行動中，警員以及消防處人員於上址發現大批入油工具，並截查一名21歲本地男子，懷疑與案件有關。他涉嫌違反《消防（消除火警危險）規例》、《危險品條例》及《危險品（管制）規例》，將會被檢控。

同時，消防處已將涉案的汽油檢走，並會向法庭申請充公。經初步調查，相信該涉案車輛已營運約一星期，並用即時通訊應用程式接訂單。"
bkn-20260401230729004-0401_00822_001,NeurIPS撤美制裁對象投稿禁令　中國科協重申不資助與會,2026-04-01 23:07,2026-04-01 23:07,https://hk.on.cc/cnt/news/20260401/bkn-20260401230729004-0401_00822_001.html,NeurIPS撤美制裁對象投稿禁令　中國科協重申不資助與會,中國,oncc,2026-04-01 23:15,"全球人工智能與機器學習領域頂尖學術會議「神經訊息處理系統」（NeurIPS）早前宣布，不再接受進入美國特別指定制裁者名單的機構及關聯機構論文投稿，引發中方多個機構抵制後道歉並撤回相關條款。中國科學技術協會周二（3月31日）重申，將不資助學者參加上述會議。

中國科協在上周五（3月27日）首次發布聲明，停止受理學者參加今年的NeurIPS大會資助申請。該協會周二再發布告示，進一步解釋此前發表有關NeurIPS會議的聲明，提到發表聲明本意是為了盡力維護中國關涉學者正當利益，其措施原則清晰而適當，沒有發生變化。

告示重申，學者參加今年NeurIPS會議不納入中國科協資助範圍，其原有項目如包含該國際會議預算，將轉用於符合條件的其他國際會議項目，或全額轉入國內項目資助，學者從科協以外渠道獲得經費支持或自費與會則不受影響。中國科協不干涉學者投稿與發表行為，其聲明明確的安排不影響其他機構和單位的自主管理行為，亦不影響中國科協主管業務的各全國學會在自身職權範圍內的獨立決策。"
bkn-20260401224453116-0401_00822_001,宏福苑業主租客爭上樓執拾名額　租戶嘆一家三口僅兩人獲准,2026-04-01 22:44,2026-04-01 22:44,https://hk.on.cc/cnt/news/20260401/bkn-20260401224453116-0401_00822_001.html,宏福苑業主租客爭上樓執拾名額　租戶嘆一家三口僅兩人獲准,香港,oncc,2026-04-01 23:00,"宏福苑居民將可於本月20日起分批上樓執拾，然而相關安排引發業主與租客的爭議，有租戶反映，上樓登記須由業主簽名及分配名額，導致租客無法按實際居住人數使用全部名額，經斡旋後最後業主同意雙方各派兩人。而該名租戶希望當局能讓居民分數次返回單位執拾，或將名額決定權交予租戶。

租住宏道閣30樓單位的丘先生表示，與太太及14歲兒子一家三口居住，火警後一直無法返回單位。他引述「一戶一社工」指，上樓安排須由業主登記作實，而業主表明會佔用兩個名額，但不會進入單位，只會在走廊等候，故丘先生一家只能派兩人上樓。丘先生無奈表示，業主同時要求他在執拾時協助取回單位內一件電器，為求上樓只能答應。

丘先生指，單位內屋內「有98%的東西是我們的」，認為上樓安排原意是讓住戶執拾個人物品，應由居住者決定名額。他擔心只得兩人難以在限時內完成執拾，又指規定要求上樓人士「同進同出」，故業主若提早離開亦只能跟隨，恐進一步縮短時間。他期望當局給予彈性，讓居民分兩至三次返回單位執拾，或將名額決定權交予租戶。"
bkn-20260401220223131-0401_00822_001,華製電單車WSBK兩回合奪冠　湖南漢勵志經歷引共鳴,2026-04-01 22:02,2026-04-01 22:02,https://hk.on.cc/cnt/news/20260401/bkn-20260401220223131-0401_00822_001.html,華製電單車WSBK兩回合奪冠　湖南漢勵志經歷引共鳴,中國,oncc,2026-04-01 22:30,"周日（3月29日）結束的世界超級電單車錦標賽（WSBK）葡萄牙站WorldSSP組別中，法國車手駕駛中國製造商「張雪機車」生產的電單車在兩個回合中相繼奪冠，引起全球關注。製造商老闆張雪的奮鬥歷程被起底，奪冠當晚發文形容，做事並不只旨在結果，而是因為熱愛，才有更多可能性。

內媒周三（4月1日）報道，張雪出生於湖南懷化農村，家中並不富裕，自小對電單車產生濃厚興趣，遂從14歲初中輟學後在電單車修理鋪擔任學徒。他每天10幾個小時做掃地、擦工具、拆洗沾滿油污的引擎等工作，也會對拆下來的零件研究到深夜。20多年如一日鑽研技術，他用「拆車-修車-造車」的笨功夫，把「不可能」化為現實。

張雪20年前的採訪畫面也被翻出，強調自己真的很喜歡電單車，認為年輕時沒有去做，老了肯定後悔，即使失敗，日後也不會後悔。時間匆匆流逝，張雪奪冠後表示不怕失敗，想到就即時做，做錯就即刻調整。他的堅持、對夢想的執着和熱愛，引發共鳴。"
bkn-20260401214210282-0401_00822_001,大埔上水粉嶺掃黃行動　拘8內地女子涉違逗留條件,2026-04-01 21:42,2026-04-01 21:42,https://hk.on.cc/cnt/news/20260401/bkn-20260401214210282-0401_00822_001.html,大埔上水粉嶺掃黃行動　拘8內地女子涉違逗留條件,香港,oncc,2026-04-01 22:00,執法部門聯同相關部門人員，今日(4月1日)下午約4時在大埔大埔墟、上水石湖墟及粉嶺聯和墟一帶街道及多個單位展開代號「火石」的掃黃行動。行動中，人員在大埔同茂坊、上水新豐路、新發街及粉嶺聯發街的單位內拘捕8名內地女子(26至45歲)，涉嫌「違反逗留條件」。所有被捕人士現正被扣留調查，稍後將交由相關部門跟進。
bkn-20260401213556491-0401_00822_001,華女留學回國當職業掃墓人　放下恐懼傳遞情感,2026-04-01 21:35,2026-04-01 21:35,https://hk.on.cc/cnt/news/20260401/bkn-20260401213556491-0401_00822_001.html,華女留學回國當職業掃墓人　放下恐懼傳遞情感,河南,oncc,2026-04-01 21:45,"清明節將至，不少離鄉別井的打工仔或留學生，無法親自到墓地拜祭親人，「職業掃墓人」的工種應運而生。河南洛陽一名「00後」女子從英國留學修讀音樂回國後，選擇了一份令人意外的職業，成為一名代行掃墓人，每天鞠躬上百次，為客戶傳遞對親人的思念和情感。

內媒周二（3月31日）報道，女子小白（化名）近日頻繁穿梭在墓碑間，手捧鮮花，神情莊重，先向墓碑謙遜鞠躬，再輕輕擦拭碑面，擺放供品，由同事拍下祭拜過程，讓屏幕後的家屬安心。臨近清明節，小白平均每天要代祭10位先人，需要鞠躬上百次，以賺取每個月逾4,000元人民幣（約4,553港元）工資。

小白工作時會替遠在異國他鄉的子女祭奠父母，有時會幫不良於行的年邁老人拜祭離世子女或伴侶。她認為代客掃墓不只是形式，更要用心服務，甚至將先人當成親人，家屬既交給她這份託付，就必須對得起對方信任。她見過太多眼淚，聽過太多哽咽，明白每一份委託背後都藏着思念與遺憾。

不少人問小白在墓地工作是否會怕，她直言最近已獨自住在山上，一點也不怕。她更相信「你害怕而避之不及的，可能是別人朝思暮想，做夢都夢不到的人。」她正是理解這份思念，才真正放下恐懼，將每一次代祭都當作一次莊重的情感傳遞。

清明節期間，另有孝子賢孫會燒不同祭品拜祭先人，內地廠商每年都會趕潮流推新品，今年推出人工智能（AI）的「AI紙紮全家桶」系列。紙紮AI大模型採用一體機設計，包括OpenClaw、ChatGPT等AI大模型的紙紮單品，十分精緻。"
bkn-20260401210306284-0401_00822_001,少年攢錢翻新舊屋　祖母倍感窩心,2026-04-01 21:03,2026-04-01 21:03,https://hk.on.cc/cnt/news/20260401/bkn-20260401210306284-0401_00822_001.html,少年攢錢翻新舊屋　祖母倍感窩心,四川,oncc,2026-04-01 21:15,"內媒周一（3月30日）報道，四川達州市一名19歲少年自幼在農村長大，眼見家中數十年舊屋破舊漏水，生活不便，便從讀書時期起默默攢下生活費，加上工作一年，共積蓄7萬至8萬元（人民幣，下同，約7.9萬至9萬港元），全數用於祖房翻修材料費，並與父親和哥哥一同改造。

小侯（化名）表示，該幢土瓦房已有60至70年歷史，他連續4年在農曆新年前一個月動工，逐年翻修部分舊屋，包括在原有基礎上加蓋二樓，新增客廳、主臥與次臥，方便親友留宿。廚房亦全面翻新，包括粉牆、增設櫥櫃與櫃枱。整修總材料費約13萬元（約14.8萬港元），小侯獨自負擔其中大半。

如今舊屋煥然一新，不僅空間充裕，居住品質也大幅提升。小侯指祖母是最高興的人，一家人住得開心又舒適，直言一切努力都值得。"
bkn-20260401200657596-0401_00822_001,稅局今發出25/26年度利得稅報稅表　下月初發277萬份個人報稅表,2026-04-01 20:06,2026-04-01 20:06,https://hk.on.cc/cnt/news/20260401/bkn-20260401200657596-0401_00822_001.html,稅局今發出25/26年度利得稅報稅表　下月初發277萬份個人報稅表,香港,oncc,2026-04-01 20:30,"留意報稅。稅務局今日(1日)發出約27萬份2025至26課稅年度利得稅報稅表、12萬份物業稅報稅表及34萬份僱主報稅表，並將於5月4日發出約277萬份個別人士報稅表。

納稅人及僱主一般須於報稅表發出日起一個月內填報。就已委任稅務代表的個案，提交報稅表期限載列於稅務局網站的「整批延期提交報稅表的通函」。

稅務局鼓勵納稅人透過「稅務易」提交報稅表。個人用戶可以使用「智方便」登入及簽署報稅表，亦可透過在流動裝置安裝「eTAX」流動應用程式，使用「稅務易」處理個人稅務事宜。

首階段強制性利得稅電子報稅亦由今日起實施。受全球最低稅制度涵蓋的跨國企業集團，相關實體必須由2025至26課稅年度起以電子方式提交利得稅報稅表。

稅務局提醒納稅人及僱主，如以郵遞方式交付報稅表，須支付足額郵資及確保郵遞準時無誤。稅務局不會接收郵資不足的郵件。"
bkn-20260401200627067-0401_00822_001,網民訂房帶狗度假　收酒店短訊推薦吃狗肉,2026-04-01 20:06,2026-04-01 20:06,https://hk.on.cc/cnt/news/20260401/bkn-20260401200627067-0401_00822_001.html,網民訂房帶狗度假　收酒店短訊推薦吃狗肉,貴州,oncc,2026-04-01 20:15,"內地網民近日反映，早前打算帶同小狗一起度假，並預訂了貴州省貴定縣一家寵物友善酒店。誰知酒店竟傳來訊息，推薦到當地吃狗肉，令網民決定取消預訂，並在網上公開經歷，提醒其他人「避坑」。

該網民發文指，在平台上發現貴定縣盤江鎮一家酒店有「寵物友好」標籤，但預結後收到酒店短訊，內容主動推薦了盤江特色狗肉，還寫了相關功效。網民稱，作為養寵人，一邊帶狗入住，一邊看見這樣的飲食推薦，感覺很難接受。

內媒周一（3月30日）聯絡該酒店，工作人員稱該店的確是寵物友善酒店，顧客可帶寵物入住。他們推薦住客到盤江鎮上吃狗肉，因這是當地特色，但強調酒店本身並無狗肉出售。工作人員表示，客人入住前如詢問能否帶寵物，酒店不會推薦吃狗肉，相反如沒詢問，酒店就會發推薦短訊。貴定縣文旅局工作人員稱，狗肉是盤江鎮的特色飲食，當地也有「狗肉一條街」，但未正面回應酒店推薦吃狗肉是否合適。"
bkn-20260401193025110-0401_00822_001,15間資助小學派0班　4間逐步停辦最遲2029/30學年結束,2026-04-01 19:30,2026-04-01 19:30,https://hk.on.cc/cnt/news/20260401/bkn-20260401193025110-0401_00822_001.html,15間資助小學派0班　4間逐步停辦最遲2029/30學年結束,香港,oncc,2026-04-01 19:45,"下學年有15所官津小學不獲資助開辦小一，即俗稱「派0班」。教育局表示，15間「派0班」的小學已向局方遞交意向回條，當中9間學校申請與其他學校合併、1間學校申請在2026/27學年以私營方式開辦小一班級、4間學校將逐步停辦或最遲於2029/30學年結束營辦。另有1間學校受惠於教育局早前為合併學校提供的便利措施而可豁免選擇方案並參加2027年度的「小一入學統籌辦法」。

教育局表示，「支援學校持續發展專責小組」，日前分別與有關學校的辦學團體及學校代表會面，了解他們的關注事宜，並就學校的意見轉達教育局考慮。申請方案的學校需於本月底或之前，就方案向教育局提交詳細計劃書。專責小組成員會繼續與有關學校保持緊密聯繫，協助學校敲定及落實方案的詳細計劃。教育局會審核有關計劃的詳情及各項細節，以考慮是否批准有關申請，並適時公布結果。

教育局表示，辦學團體及學校可考慮與其他屬於相同或不同辦學團體的學校合併，以繼續於未來學年營辦資助小一班級。參與合併的學校中，最少有一間學校獲批於下學年營辦資助小一班，以加強協同效應，提升學與教質素，確保學生福祉。就不同營運模式的合併建議，教育局會仔細研究。"
bkn-20260401191615662-0401_00822_001,政府逢周三公布車用燃油價格變化　公眾假期順延,2026-04-01 19:16,2026-04-01 20:16,https://hk.on.cc/cnt/news/20260401/bkn-20260401191615662-0401_00822_001.html,政府逢周三公布車用燃油價格變化　公眾假期順延,香港,oncc,2026-04-01 20:30,"受中東地區局勢影響，國際油價波動加劇。環境及生態局由今日（1日）起，每逢周三在其網站公布各油公司車用燃油的折扣後零售價，並與國際成品油價走勢作比較，以提升價格透明度，協助公眾監察本地燃油價格變化。

環境局網站現已上載本港各間油公司，由去年12月29日至今的車用燃油零售價格走勢圖。當局表示，由於原油與成品油屬不同產品，國際原油價格變動與車用燃油零售價調整未必同步，故其網站上展示的油價走勢圖，採用國際成品油市場指標價格作比較，除了顯示各油公司無鉛汽油及柴油的零售牌價外，亦顯示門市折扣後的7天移動平均零售價，即扣除即時入油折扣後的價格，讓公眾比較不同油公司的門市售價水平。

至於走勢圖未有計算只提供予指定顧客的額外折扣，例如信用卡或油公司積分卡優惠，當局指，相關資訊已上載至環境局網站，當局將於每周三下午公布過去一周的走勢圖表，如當日為公眾假期，則順延至下一個工作天發布。

當局又表示，由於本港石油產品約八成來自內地，因此在全球部分地區能源供應緊張下，本港仍能維持穩定供應，而就近期中東局勢，已向本地主要油公司重申能源對本港經濟及社會運作的重要性，要求保持車用燃油供應穩定。各油公司均表示目前供應正常，會繼續維持穩定供應。"
bkn-20260401191240215-0401_00822_001,「性商教母」換帳號重啟直播　官方稱已完成處罰,2026-04-01 19:12,2026-04-01 19:12,https://hk.on.cc/cnt/news/20260401/bkn-20260401191240215-0401_00822_001.html,「性商教母」換帳號重啟直播　官方稱已完成處罰,湖南,oncc,2026-04-01 19:15,"自稱「中國性商教母」的內地女網紅周媛今年1月因低俗內容被檢舉，多個社交帳號遭永久封鎖。她近日疑換帳號重啟直播，引發關注。湖南省長沙市雨花區市場監督管理局周二（3月31日）稱，此前因周媛廣告方面有違法行為，已處罰她。

周媛曾自創「黑白顛性商學院」，開設所謂「魅力女性修煉班」，內容被指尺度大、討好男性，引發廣泛爭議。她的實名主帳號「黑白顛周媛」今年1月被封，長沙多部門對她立案調查，責令停止線上線下活動。不過，她近日疑以「你好周大寶」的新帳號悄然重啟直播，再次售賣課程。

雨花區市監局工作人員周二表示，該局的確對周媛立案調查並處罰，是從市監領域對她進行監管，「因為當時她是這個廣告方面有違法」。對於周媛能否開直播等其他問題，工作人員解釋，她以個人名義直播，該局職責上無法干涉，因為他們只能監管公司。至於應由哪個部門介入處理，工作人員表示不是很清楚。"
bkn-20260401190115274-0401_00822_001,香港往上海高鐵車廂現大量蚊蟲　乘客難忍提前落車,2026-04-01 19:01,2026-04-01 19:01,https://hk.on.cc/cnt/news/20260401/bkn-20260401190115274-0401_00822_001.html,香港往上海高鐵車廂現大量蚊蟲　乘客難忍提前落車,香港,oncc,2026-04-01 19:15,"多名網民周二（3月31日）在社交平台反映，當天從香港西九龍開往上海虹橋的G386次高鐵列車車廂內，出現大量蚊蟲。廣鐵集團廣九客運段周三（4月1日）回應指，經初步分析，該車廂出現蚊蟲與近期粵港地區持續降雨和悶熱潮濕等導致蚊蟲孳生較快有關。鐵路衞生防疫部門已啟動排查，並組織有針對性應對防範。

網傳畫面顯示，有旅客和乘務員在列車車廂連接處、通道內揮手趕蚊，不時可見蚊蟲飛過。網民稱，乘務員有安撫乘客情緒，並將情況上報，但未給出具體解決措施。列車員又解釋，列車前一日停在潮汕檢修時開了一整晚的車窗，導致蚊子飛進藏匿。據指有乘客無法忍受，中途直接提前落車，重新買票換乘後續列車。

廣鐵集團廣九客運段通報，G386次列車於周二下午2時05分從香港西九龍站發車，隨後發現車廂內有蚊蟲，列車工作人員迅速採取用電蚊拍滅殺、停站開門時驅蚊、調低車內溫度降低蚊蟲活躍度等措施。通報又證實，該列車曾於開行日前一夜，按流程在位處郊區的潮州動車檢修基地檢測保養。"
bkn-20260401184841111-0401_00822_001,員工戴手套拖地兼處理食材　米粉店引發衞生爭議捱轟,2026-04-01 18:48,2026-04-01 18:48,https://hk.on.cc/cnt/news/20260401/bkn-20260401184841111-0401_00822_001.html,員工戴手套拖地兼處理食材　米粉店引發衞生爭議捱轟,香港,oncc,2026-04-01 19:15,"市民外出用膳，除了追求美味亦會講究環境衞生。不過近日就有網傳影片，指屯門某餐廳的員工先在廚房拖地清潔，及後協助同事處理食材。但期間就有眼利網民發現，涉事職員全程均使用同一對手套，結果引發熱議，質疑食材有可能被細菌污染，批評店舖欠缺衞生意識。

據拍片網民表示，涉事餐廳位於屯門，並主打出售「湖南非遺手工米粉」。畫面可見，店舖職員戴着藍色手套，並將米粉放進機器切割，但期間遇上客人要結帳，職員便交託後面正在拖地，身穿廚師制服的阿姨來接手。不過，阿姨剛才才戴着清潔用的勞工手套接觸地拖及水桶，其後沒有更換手套便直接接觸食材；至於剛才收錢的職員，其後再加入一起處理食材，但手上的藍色手套亦同樣是剛觸碰過收銀機不久。

事件引來大眾爭議，認為片中兩人再工作交替期更，理應要更換手套後才可進行另一程序的工作，擔心剛出爐的米粉會有細菌感染。有網民留言指，「香港做飲食的人，大部分都無衞生意識」、「戴手套仲污糟過唔帶，戴手套嗰啲食店甚少人除低洗手，(都係)少去為妙」，亦有人分享自己外出用膳的「中伏」經歷，「出街食嘢有時啲食物直頭有洗潔精味」，甚至有人表示見過「員工戴住對手套去廁所」。"
