id,title,date,last_update,url,lead,section,source,scrape_time,news_content
bkn-20260104220124304-0104_00822_001,2026首個超級月亮　昨晚現身夜空,2026-01-04 22:01,2026-01-04 22:01,https://hk.on.cc/cnt/news/20260104/bkn-20260104220124304-0104_00822_001.html,2026首個超級月亮　昨晚現身夜空,中國,oncc,2026-01-04 22:15,"2026年首月多個特別天象在中國輪番上演，今年首個超級月亮上周六（3日）晚上6時03分率先現身夜空，在晴好天氣下，公眾肉眼可見。同日晚至周日（4日）清晨，今年首場象限儀座流星雨更與之同框，形成罕見的天文現象疊加。

超級月亮是月球運行至近地點時出現的滿月現象，此時月亮會比平常更大更亮。本輪滿月月面紋路清晰可見，旁有木星相伴，形成雙月爭輝視覺效果，為今年僅有兩次超級月亮之一，另一次將於12月24日出現，將是年度最大滿月。

象限儀座流星雨周日清晨迎來極大，儘管滿月對流星雨觀測造成一定影響，但民眾仍能捕捉到明亮火流星。滿月與流星雨極大值重合概率約12分之1，在西方占星學被視為天降好運的吉祥之兆，上次同現於2018年1月，下次預計2034年1月。周二（6日）晚至周三（7日）淩晨，天宇將出現月亮遮掩恒星軒轅十四天象。"
bkn-20260104210051330-0104_00822_001,華運首批緊急人道物資　駐柬大使出席,2026-01-04 21:00,2026-01-04 21:00,https://hk.on.cc/cnt/news/20260104/bkn-20260104210051330-0104_00822_001.html,華運首批緊急人道物資　駐柬大使出席,中國,oncc,2026-01-04 21:15,"中國首批緊急人道主義物資交付儀式上周六（3日），分別在柬埔寨班叠棉吉省和馬德望省舉辦。中國駐柬大使汪文斌表示，中方將一如既往支持柬埔寨保持穩定和發展，邁向繁榮和振興，將繼續為柬泰雙方落實撫仙會晤成果、建立持久和平發揮積極建設性作用。

汪文斌指出，柬泰邊境沖突爆發後，中國政府先後兩次宣布向柬提供緊急人道主義援助。中國是率先向柬提供援助的國家，也是向柬提供援助最多的國家，生動體現了中柬鐵桿友誼。交付的首批援助物資上月28日陸續運抵，第二批援助物資即將運抵。

柬埔寨國務大臣官金代表首相洪瑪奈，對中方援助深表感謝，稱中方援助將極大助力柬民眾早日重返家園、恢復正常生活。"
bkn-20260104200722994-0104_00822_001,箭板古鎮火災　歷史建築燒毀,2026-01-04 20:07,2026-01-04 20:07,https://hk.on.cc/cnt/news/20260104/bkn-20260104200722994-0104_00822_001.html,箭板古鎮火災　歷史建築燒毀,四川,oncc,2026-01-04 20:15,"四川樂山沐川縣箭板古鎮上周五（2日）晚發生火災，大火於翌日凌晨撲滅，無人員傷亡及文物受損報告。公安部門目前已設置警戒區，受災民眾亦全數安全轉移並妥善安置，正在調查起火原因。

事發於上周五晚上9時50分左右，火災導致老街多幢房屋受損，鄰近新街未受影響。有居民痛心指，老街不少建築具有一定歷史價值，焚毀令人感到惋惜。附近商戶稱，現場已封鎖，短期內無法參觀遊覽。

箭板古鎮是沐川縣千年古鎮，以保存完好的明清吊腳樓群和豐富歷史遺迹聞名，曾獲「四川最美街道」稱號。據史料記載，古鎮可能始於唐宋或更早時期。"
bkn-20260104200607843-0104_00822_001,三級歷史建築前皇家空軍飛機庫重置後改動　環團憂影響評級,2026-01-04 20:06,2026-01-04 20:06,https://hk.on.cc/cnt/news/20260104/bkn-20260104200607843-0104_00822_001.html,三級歷史建築前皇家空軍飛機庫重置後改動　環團憂影響評級,香港,oncc,2026-01-04 21:00,"被稱為「大磡村三寶」的機槍堡、前皇家空軍飛機庫及「大觀園」四號石寓(已故影星喬宏故居)，現於鑽石山活水公園重置。當中屬三級歷史建築的前皇家空軍飛機庫，有環團指重置後有明顯改動，包括重新設計了飛機庫的結構，明顯與原本不同，且原有結構的鋼材僅保留小部分以掛件方式展示，擔心因無法呈現原有結構，影響其三級歷史建築評級。

該環團認為，被評為三級歷史建築的飛機庫，其建築最有價值的地方屬金屬結構，即使重置亦應盡量「原汁原味」，包括保留外觀和重現原有建築結構。

房屋署表示，受沙中線工程影響，飛機庫在2013年由港鐵在獲得古物古蹟辦事處批准後，逐件拆下於臨時位置保存。及後，經港鐵、房屋署及顧問工程師的考察研究後，發現由於大部分飛機庫鋼結構組件已經嚴重生銹、老化及破損，並不適合用作重置的主結構，房屋署工程團隊於是參照原有飛機庫大小，設計了新的「飛機庫」。

而為盡可能保持原有鋼結構的舊貌，工程團隊用了新支撐框架來承載較完整的鋼結構組件，包括桁架、約6米高大型趟門之滑輪及軌道組件等，大幅度減少原有構件的更換，並把部分鋼結構翻新後，重置於新結構中，用作展示用途。古物古蹟辦事處亦認同方案能適當保存建築構件予公眾欣賞。

發展局則表示，由於飛機庫的原有金屬結構已生銹老化，房委會建議將其重置並加固，以確保可以適當保存，此做法與一般處理三級歷史建築的原則相符，亦同時令該歷史建築得以適當保存，並供公眾欣賞。"
bkn-20260104190848424-0104_00822_001,沙田乙明邨49歲男子昏迷　父親發現救唔番,2026-01-04 19:08,2026-01-04 19:08,https://hk.on.cc/cnt/news/20260104/bkn-20260104190848424-0104_00822_001.html,沙田乙明邨49歲男子昏迷　父親發現救唔番,香港,oncc,2026-01-04 21:30,今午(4日)4時47分，沙田乙明邨明耀樓一名姓盧(49歲)男子，被父親發現在房間床上昏迷。救援人員接報到場，經檢查證實盧男已經死亡，毋須送院，死因有待驗屍後確定。案件列作「屍體發現」處理。
bkn-20260104190136541-0104_00822_001,財政廳提前撥167億人民幣　保障困難群眾生活,2026-01-04 19:01,2026-01-04 19:01,https://hk.on.cc/cnt/news/20260104/bkn-20260104190136541-0104_00822_001.html,財政廳提前撥167億人民幣　保障困難群眾生活,廣西,oncc,2026-01-04 19:15,"廣西財政廳近日提前下達2026年中央和自治區資金167.65億元（人民幣，下同，約188億港元），重點加強對元旦春節期間困難群眾生產生活保障。其中118.7億元（約133億港元）屬困難群眾救助補助資金，較上年同期增長27%，將為廣西約376萬城鄉低保、特困、孤兒、殘疾人士等困難群眾，保障基本生活。

在保障就業方面，廣西財政廳提前下達2026年就業補助資金29.71億元（約33億港元），加強對農民工、就業困難人員和脫貧勞動力等重點群體就業援助和幫扶，持續配合開展治理欠薪冬季行動。其中農民工就業創業方向資金2.47億元（約2.8億港元），支持開展「春暖農民工」行動、農民工專場招聘會等服務活動，強化就業公共服務促進供需對接，全力服務好農民工春節返鄉實際就業需求。

廣西財政廳又提前下達2026年優撫對象補助經費18.84億元（約21億港元），並持續健全幫扶解困機制，提前下達600萬元（約672萬港元）做好關心關愛幫扶工作，為患重大疾病、遭遇突發災害等困難優撫對象提供臨時性、過渡性幫扶援助，不斷夯實優撫對象保障體系。"
bkn-20260104180043025-0104_00822_001,華使館指日治安不靖　籲公民避免前赴,2026-01-04 18:00,2026-01-04 18:00,https://hk.on.cc/cnt/news/20260104/bkn-20260104180043025-0104_00822_001.html,華使館指日治安不靖　籲公民避免前赴,中國,oncc,2026-01-04 18:15,"中國駐日本大使館上周六（3日）發通知指，日本部分地區治安環境近日不靖，福岡縣、靜岡縣、愛知縣等多地發生殺人未遂、報復社會案件，中國公民近期應避免前往日本。

大使館指出，多名旅日中國公民報告遭到無端辱罵毆打並受傷。在去年12月31日，東京新宿區發生汽車撞人事件，兩名中國公民被嚴重撞傷，獲緊急送院救治。當獲悉上述有關案情後，中國大使館第一時間向受傷中國公民及其家屬表示慰問並提供協助，同時向日本警方交涉，敦促盡快破案，切實保護中國公民合法權益。

館方表示，出行在外，安全最重要，值此歲末年初、農曆新年將至之際，中國公民近期應避免前往日本，要注意安全，密切關注當地治安形勢，切實提高安全防範意識，加強自我保護。如遇針對性、歧視性案件，應保存證據，及時報警並聯繫中國駐日使領館尋求協助。"
bkn-20260104180017156-0104_00822_001,溫州河道擠滿羅非魚　疑因寒冷上水曬太陽,2026-01-04 18:00,2026-01-04 18:00,https://hk.on.cc/cnt/news/20260104/bkn-20260104180017156-0104_00822_001.html,溫州河道擠滿羅非魚　疑因寒冷上水曬太陽,浙江,oncc,2026-01-04 18:15,"浙江溫州蒼南縣靈溪鎮某小區旁的河道內，上周五（2日）有大量羅非魚在水面游動，數量驚人。拍攝者驚訝羅非魚氾濫成災，疑因近兩日天氣寒冷，牠們紛紛浮出水面曬太陽。

周先生上周六（3日）表示，前一日與兒子在河邊散步，看到很多白鷺盤旋，才留意到河中異常情況。他對河中聚集大量羅非魚感到疑惑，由於蒼南靠海主要食用海魚，河魚多選擇鯽魚等。

小區物業工作人員證實近日河道內確實出現大量羅非魚，清晨還吸引許多白鷺前來覓食。若有人捕魚或垂釣都會勸阻，因水深危險。工作人員強調，羅非魚都是自然生長，無人投餵。"
bkn-20260104174710361-0104_00822_001,高鐵香港段　開通至今客量突破1億人次　去年載客量增17%,2026-01-04 17:47,2026-01-04 17:47,https://hk.on.cc/cnt/news/20260104/bkn-20260104174710361-0104_00822_001.html,高鐵香港段　開通至今客量突破1億人次　去年載客量增17%,香港,oncc,2026-01-04 18:30,"高鐵香港段自2018年開通以來乘客量持續上升，迄今已突破1億人次。港鐵表示，高鐵香港段去年載客量亦再創新高，超過3,000萬人次，按年增加17%。單日人次方面，在去年12月27日，高鐵西九龍站錄得近14萬人次，刷新單日乘客人次記錄。

港鐵表示，目前高鐵乘客多為短途，佔整體約8成，而香港市民佔整體客運人次，由通車初期約3成，陸續增加至約4成半，其餘為內地及海外旅客，反映高鐵促進了兩地人員的互動與交流。

為慶祝高鐵人次突破1億人次的里程碑，港鐵今日(4日)於香港西九龍站向旅客派發紀念品，現場有不少乘客領取相關禮品，並與港鐵職員合照。港鐵行政總裁楊美珍指，自通車以來，港鐵積極參與內地鐵路單位及兩地政府緊密協作，增加站點、提升服務，未來會繼續與相關單位緊密協調，提升出行體驗、擴展網絡。"
bkn-20260104173616854-0104_00822_001,河套香港園區上月開幕　當局冀以白名單簡化審批程序,2026-01-04 17:36,2026-01-04 17:36,https://hk.on.cc/cnt/news/20260104/bkn-20260104173616854-0104_00822_001.html,河套香港園區上月開幕　當局冀以白名單簡化審批程序,香港,oncc,2026-01-04 18:30,"河套香港園區上月開幕，促進兩地數據流通，創新科技及工業局局長孫東出席電視節目時指，期望可透過採取綠色通道「白名單」的方式簡化審批程序，甚至最終可採用報備的形式縮短批准時間，又透露未來開放的力度會愈來愈大，有關創科要素的流動甚至可延伸至鄰近新田科技城的發展。

另外，元朗工業邨重新定位為創新園，同樣會用作推動創科發展，建構微電子生態圈。孫東指出，微電子研發院在該處設立的兩條第三代半導體中試生產線，將於今年上半年運作，兩條線分別為氮化鉀及碳化硅的技術路線，他指本港現時尚在落實與國家工信部簽署，在香港建立國家級的製造業創新中心，不過未來仍可以有其他布局，例如建立較大的新能源的產業。

孫又透露，當局打算於新田科技城設立專屬的「平台公司」發展，常秘會在公司架構之內，惟他自己則未必會在內。"
bkn-20260104173238542-0104_00822_001,網友借錢救母騙局　中年婦被呃14.7萬元,2026-01-04 17:32,2026-01-04 18:55,https://hk.on.cc/cnt/news/20260104/bkn-20260104173238542-0104_00822_001.html,網友借錢救母騙局　中年婦被呃14.7萬元,澳門,oncc,2026-01-04 19:15,"一名非澳門中年女子墮交友騙局，在某交友平台認識一名女子並保持聯絡，雙方建立朋友關係後，「女網友」兩度以「親友及母親手術費」為由向事主借款，事主信以為真，合共借出12.8萬元人民幣。至上月下旬向醫院查詢時發現並無「網友母親」的入院記錄，懷疑被騙向澳門報法部門報案，報稱損失折合14.7萬澳門元。

澳門報法部門上月28日接獲案中女事主報案，事主稱去年3月上網認識一名「當地女子」，之後轉至微信聯絡並保持朋友關係。經過3個月，女網友以有親戚在天津某醫院需接受心臟手術為由向事主借錢。事主基於對朋友的信任，去年6月9日至7月9日期間多次向對方提供的銀行帳戶轉帳合共3.8萬元人民幣，而女網友承諾10月連本帶利歸還。

去年8月10日，有人故技重施，聲稱母親將到鏡湖醫院接受手術，再次向事主借錢，8月10日至12月24日期間合共轉帳9萬元人民幣，雖女網友歸還首次借款的承諾未兌現，但事主為「幫朋友」未有追問。

兩次借款後，事主多次要求見面，但均被對方以不同理由推搪。上月27日，事主再聯絡對方了解見面及還款情況，再被女網友拒絕並引起事主懷疑，自行到鏡湖醫院查詢後發現並無女網友母親入院治療的記錄，同時亦無法與對方聯絡，懷疑被騙向澳門執法部門報案，報稱損失折合14.7萬澳門元。"
bkn-20260104170056207-0104_00822_001,高鐵增至5.04萬公里　規模領先全球,2026-01-04 17:00,2026-01-04 17:00,https://hk.on.cc/cnt/news/20260104/bkn-20260104170056207-0104_00822_001.html,高鐵增至5.04萬公里　規模領先全球,中國,oncc,2026-01-04 17:15,"國鐵集團周日（4日）表示，鐵路「十四五」規劃圓滿收官。全國鐵路營業里程由14.63萬公里增至16.5萬公里，增長12.8%。高鐵由3.79萬公里增至5.04萬公里，增長32.98%，中國國建成世界規模最大、先進發達的高速鐵路網。

去年全國鐵路完成固定資產投資9,015億元人民幣（約9,804億港元），按年增長6%。投產新線3,109公里，其中高鐵2,862公里，鐵路投資拉動作用充分顯現。去年國鐵集團以國家「十四五」規劃綱要確定的102項重大工程鐵路項目和「兩重」項目為重點，長贛高鐵等8個項目開工建設，瀋白高鐵等25個項目開通營運，並建成鐵路專用線52條。

「十五五」規劃期間，國鐵集團將進一步推進鐵路網建設。到2030年，全國鐵路營業里程達到18萬公里左右，其中高鐵6萬公里左右，複線率和電氣化率分別達到64%和78%，戰略骨幹通道全面加強，「八縱八橫」高鐵系統成網，區域互聯互通水平顯著提升，貨運網絡能力大幅增強，基本建成世界一流的現代化鐵路網。"
bkn-20260104165611294-0104_00822_001,黑熊連日闖工棚　政府籲妥善管理食物,2026-01-04 16:56,2026-01-04 16:56,https://hk.on.cc/cnt/news/20260104/bkn-20260104165611294-0104_00822_001.html,黑熊連日闖工棚　政府籲妥善管理食物,嘉義,oncc,2026-01-04 17:30,"台灣嘉義縣阿里山鄉達邦村一處工棚上月遭台灣黑熊闖入後，已安裝紅外線監測相機。台灣林業及自然保育署嘉義分署近日接報，再有黑熊上周四至上周六（1至3日）連續3天進入工棚覓食，破壞雪櫃與儲水桶，行為相當粗暴。有專家研判，由於當地氣溫急降，該隻體形中等健壯黑熊冒險進入人類活動範圍。

為了確保安全，嘉義分署已緊急宣導附近居民與露營區，並指導屋主透過不規律聲光作出干擾，同時安裝「防熊電踏墊」及「防熊電圍籬」，利用輕微電擊引導黑熊遠離、回歸山林。當局也提醒民眾若與黑熊正面相遇，應保持冷靜及緩慢退離，切勿奔跑或驚叫。

嘉義分署強調，食物管理是防範黑熊靠近核心，戶外垃圾、廚餘、肥料及寵物飼料應妥善收在室內，露營烤肉後須立即清理殘渣，避免氣味吸引黑熊。"
bkn-20260104164143357-0104_00822_001,元朗搗毒倉製毒工場檢770萬貨　拘歌手羅啟聰等3人,2026-01-04 16:41,2026-01-04 18:23,https://hk.on.cc/cnt/news/20260104/bkn-20260104164143357-0104_00822_001.html,元朗搗毒倉製毒工場檢770萬貨　拘歌手羅啟聰等3人,香港,oncc,2026-01-04 18:30,"執法部門指最近有販毒集團以搵快錢作招徠，招攬年輕人作為死士進行販毒活動，包括利用日常運輸工具，例如的士、貨車作掩飾派送毒品，更會利用村屋作為製毒中心和毒品儲存倉。經情報分析和深入調查後，再追查可疑車輛車牌和型號，成功鎖定一個販毒集團主腦和骨幹成員身份。

昨日(3日)警員在元朗一帶執行掃毒行動，突擊搜查一村屋單位，以涉嫌「販運危險藥物」、「製造危險藥物」、「串謀販運危險藥物」罪，拘捕2名本地男子和1名內地女子(21至35歲)，並在單位內檢獲逾10公斤毒品和大量製毒工具，毒品包括7.9公斤懷疑可卡因、1.2公斤懷疑冰毒、741克懷疑霹靂可卡因、598克懷疑氯胺酮(K仔)和259粒含「依托咪酯」電子煙彈，市值約774萬港元。製毒工具則包括電磁爐、煲、溫度計和大量可再封透明膠袋。

經調查顯示，該個製毒中心和毒品儲存倉運作約一個月，3名疑犯扮演不同角色，分別為製毒、包裝和運送毒品給本地毒品拆家，他們報稱職業為學生、歌手和無業，相信有人因欠債鋌而走險，被販毒集團以數萬元至10幾萬港元酬勞招攬進行犯毒。3名疑犯現正被扣留調查，稍後各被暫控一項「販運危險藥物」、「製造危險藥物」及「串謀販運危險藥物」罪，案件將於明日(5日)下午在觀塘裁判法院提堂。

據了解，被捕男歌手姓羅(35歲)，曾經參加過歌唱比賽，有關毒主要供應東九龍區。其中一名疑犯利用加密軟件認識「上線」，對方透過遙距方式教授製毒知識，然後指示他們到某處地方取貨，故一直沒有與「上線」見面。

執法部門提醒市民，製毒過程中通常會釋放刺鼻氣味，如發現任何處所傳出電油或酸性氣味，應提高警覺，如有懷疑，應該報案。販毒及製毒均屬嚴重罪行，一經定罪，最高可判處終身監禁及罰款500萬港元，市民切勿以身試法。市民特別是年輕人切勿以身試法。以今次案件為例，量刑起點會是終身監禁。"
bkn-20260104164105744-0104_00822_001,基金公會料今年銷售續增　籲退休族善用強積金滾存,2026-01-04 16:41,2026-01-04 16:41,https://hk.on.cc/cnt/news/20260104/bkn-20260104164105744-0104_00822_001.html,基金公會料今年銷售續增　籲退休族善用強積金滾存,香港,oncc,2026-01-04 17:15,"香港投資基金公會主席余振聲今日(4日)出席電視節目時指出，預期今年本港基金銷售有望延續去年的上升動力，並指將加強教育，鼓勵退休人士善用強積金供款滾存投資，避免一次性提取後遭騙或浪費。

余指，去年本港零售基金銷售額超越2024年成績，淨流入亦見十年高。他預期今年增長將持續，指從行業做的調查或大環境可見，認為2026年會向好，債券、股票、混合型基金、貨幣市場基金、指數基金全部都有增長，可見香港市場胃納恢復。

就本港正積極開拓東盟等新興市場，余振聲認為基金業界應把握當中機遇。他解釋，東南亞地區近年已累積不少財富，對基金管理等專業服務有相當需求。他補充，我們可以發揮這方面的專長，幫助當地投資者觀察投資胃納和風險程度，商機是很大的。

余振聲展望今年基金公會的工作，期望在港人退休保障方面加強宣傳教育。他關注到，不少市民在65歲可提取強積金時，選擇一次性取回全部供款，故容易面臨風險。余指，坊間經常聽到有人被騙，公會希望能幫到投資者或市民，讓他們清楚想想拿回供款後應該怎樣使用。他強調，很多退休人士誤以為供滿強積金後不應再投資，但其實可考慮交由專業人士繼續投資滾存，以定期賺取利息，作為退休後的穩定收入來源。"
bkn-20260104162513642-0104_00822_001,城大與巴黎學院推雙聯學士　畢業生同時獲頒兩校學位,2026-01-04 16:25,2026-01-04 16:25,https://hk.on.cc/cnt/news/20260104/bkn-20260104162513642-0104_00822_001.html,城大與巴黎學院推雙聯學士　畢業生同時獲頒兩校學位,香港,oncc,2026-01-04 16:45,"香港城市大學工學院與巴黎薩克雷大學中央理工-高等電力學院早前簽署合作協議，公佈將於2026/27學年推出雙聯學士學位課程，計劃涵蓋城大工學院9個學士學位課程，以及巴黎中央高電的創新工程與創業工學士課程，學生可選擇於城大或巴黎中央高電完成首兩年課程，再轉至另一間學校完成另外兩年課程，畢業生將同時獲頒發兩校的學士學位。

城大表示，2026/27學年起合資格的非聯招申請人可以經巴黎中央高電直接申請此雙聯學士學位課程，此課程亦適用於城大工學士(創新與企業工程)的學生，首席及常務副校長李振聲稱，雙聯學士學位課程將進一步強化學生的國際視野，為全球工程界培養更多未來人才。

工學院院長呂堅則指出，此課程著重培養學生的創新、創業及跨學科思維，並希望通過跨文化的學習環境，讓學生探索多元思維方式、提升解難能力，從而增強他們在全球市場的競爭力。巴黎中央高電校長Romain Soubeyran補充亦指期待與城大加強合作，使兩校學生能夠在課程中受益於兩地的專業知識和文化底蘊，展現創新潛力。"
bkn-20260104161832009-0104_00822_001,「FV」牌內地車涉違規裝閃燈　運輸署稱已交執法部門跟進,2026-01-04 16:18,2026-01-04 16:18,https://hk.on.cc/cnt/news/20260104/bkn-20260104161832009-0104_00822_001.html,「FV」牌內地車涉違規裝閃燈　運輸署稱已交執法部門跟進,香港,oncc,2026-01-04 16:45,"網上流傳片段顯示，一輛掛有內地車牌和英文字母「FV」開頭香港車牌的私家車，在香港行駛期間，疑違規在車頂安裝紅色閃燈，且未有在擋風玻璃的左面展示「國際通行許可證」。運輸署指，涉事車輛為持有粵港常規配額的內地私家車，已將個案轉介予執法部門跟進，亦已要求涉事車輛驗車。

有網民在社交平台上載一段行車記錄影片，片中一輛黑色私家車在香港道路行駛，車尾掛有「粵B」開頭的內地車牌及「FV」開頭的香港車牌；該私家車行駛時，安裝在車頂左後方的紅色閃燈不停閃爍，網民質疑其「是否公安車？」。片中可見，該私家車正尾隨一輛載有貨物的重型貨車，有網民留言推測，該私家車可能為護送用途的「安全車」。此外，該私家車似乎亦未按規定，在擋風玻璃左側展示其國際通行許可證。

運輸署回覆指，涉事車輛為持有粵港常規配額的內地私家車。按照《道路交通（車輛登記及領牌）規例》規定，有關車輛在道路上行駛時，須將國際通行許可證展示在該車輛擋風玻璃的左邊，違者最高可被罰款2,000港元及監禁3個月。另外，根據許可證的發證條件，持有許可證的車輛在本港行駛時，不可裝設非用作顯示轉向的閃燈或緊急響號。

運輸署續指，已將個案轉介予執法部門跟進，同時已去信提醒許可證持有人，須遵守展示許可證的規定。至於有關車輛涉嫌違反許可證條件，在車上裝設閃燈或響號裝置，署方亦已要求許可證持有人安排有關車輛前往本署驗車中心進行車輛檢驗。若許可證持有人未能提供合理的回覆，運輸署會考慮以有關車輛違反許可證條件而撒銷其許可證。"
