title,date,summary,scrape_time,section,source,url,news_content,link,description
黃澤林期待於啟德體育園作賽　今年目標爭取排名世界前100,2025-03-31 14:57,,2025-03-31 15:15,local,rthk,https://news.rthk.hk/rthk/ch/component/k2/1798253-20250331.htm,"香港網球「一哥」黃澤林表示，昨日到啟德體育園觀看七欖賽事，氣氛很好，自己很期待日後可以在這個香港主場進行網球比賽，相信到時會很震撼。

黃澤林接受訪問表示，香港是他的家，完成邁阿密網球公開賽後，這星期回港「差一差電」、看一看家人朋友，讓他可以在往後密集賽程前，稍作休息。

黃澤林早前在邁阿密公開賽，爆冷淘汰美國球手舒爾頓，歷史性打入32強。黃澤林說事前沒有想過可以擊敗世界排名14的球手，對自己的成績感到很驕傲。他又說，當時覺得對手輕視自己，他不喜歡這種感覺，於是以「搏盡無悔」的心態，希望用成績令其他球手對香港網球運動員改觀。

現時世界排名182的黃澤林又說，今年的目標是打入世界前100名，4月會出戰巴塞羅那和馬德里公開賽，期望到時取得好成績，爭取更高排名。",,
韓股失守2500點　3月跌2%　首季升逾3%,2025-03-31 14:51,,2025-03-31 15:15,cfinance,rthk,https://news.rthk.hk/rthk/ch/component/k2/1798252-20250331.htm,"南韓股市低收3%，失守2500點關口。

首爾綜合指數低見2479點，創近2個月即市低位，收市報2481點，跌76點。

韓股在3月累計下跌2%，結束連續2個月升勢。首季升3.4%，結束2個季度跌勢。

另外，南韓股市今日起解除沽空禁令，是5年來首次全面恢復沽空。",,
日股低收約4.1%　首季累計急挫10.7%,2025-03-31 14:49,,2025-03-31 15:15,cfinance,rthk,https://news.rthk.hk/rthk/ch/component/k2/1798250-20250331.htm,"日股急挫，日經指數低見35541點，創逾半年新低，收市報35617點，跌1502點，跌幅4.05%。

日股3月累計跌逾4.1%，連跌3個月。首季累計跌10.7%，扭轉前季升勢。",,
"Data breach of 128,000 'due to system fix and neglect'",2025-03-31 14:45,,2025-03-31 15:15,elocal,rthk,https://news.rthk.hk/rthk/en/component/k2/1798251-20250331.htm,"The Office of the Privacy Commissioner for Personal Data says a data breach incident by ImagineX has led to nearly 128,000 people’s information being compromised. 

Failing to delete temporary accounts in a timely manner and the use of end-of-support operating systems were the main factors leading to the breach, the Office of the Privacy Commissioner for Personal Data (PCPD) said on Monday. 

The privacy watchdog said in May it received a report from ImagineX Management, a brand management company, about a ransom note related to stolen personal data. 

After an investigation, the office found that the hacker had exploited a temporary user account and then used it to access the company’s intranet. 

Around 68GB of personal data – involving names, email addresses, phone numbers, birth months, genders and nationalities – of the nearly 128,000 people were compromised. 

The PCPD said those affected were mostly from brands who participated in ImagineX Management ‘s two membership programmes. 

So far, there’s no evidence indicating the stolen data is being circulated or misused, it said. 

Chief personal data officer Brad Kwok said the company had set up a temporary account with remote access to fix a system problem but forgot to delete it afterwards. 

“This allowed the threat actor to exploit the account to compromise the network 10 days after the account was set up,” he said. 

“In the investigation, we also found that ImagineX lacked standard procedures for creating and managing temporary accounts. 

""This made the deletion of the temporary account solely dependent on measures taken by individual staff members.”

He noted the company had also used an operating system that had no longer been updated since 2020, making it vulnerable to attacks. 

It is also accused of having inefficient detection measures and not conducting sufficient security risk reviews and audits for its system. 

The PCPD said it issued an enforcement notice to ImagineX as it contravened the data protection principle and urged the company to take measures to prevent similar contraventions.",,
台股低收4.2%　跌穿21000點　創近8個月新低,2025-03-31 14:24,,2025-03-31 14:45,cfinance,rthk,https://news.rthk.hk/rthk/ch/component/k2/1798246-20250331.htm,"台股急挫收市，跌穿21000點水平，創近8個月新低，連跌4個交易日。

加權指數收報20695點，跌906點，跌幅4.2%。",,
南丫島深灣劃定限制區保護海龜產卵　公眾7個月內禁止進入,2025-03-31 14:20,,2025-03-31 14:30,local,rthk,https://news.rthk.hk/rthk/ch/component/k2/1798249-20250331.htm,"漁護署提醒市民，明日起至10月31日期間切勿進入南丫島深灣限制地區，包括0.5公頃的深灣沙灘及98.2公頃毗連該沙灘的海灣水域，以保護綠海龜產卵。限制期為7個月。
 
漁護署發言人說，綠海龜是瀕危物種，在本港受《野生動物保護條例》保護，亦是唯一在本港產卵的海龜品種。南丫島深灣的沙灘是本港唯一不時有綠海龜上岸產卵的地點，也是南中國海內少有的綠海龜產卵地之一。綠海龜產卵前及產卵期間，會在出生的沙灘附近水域活動，而預備產卵的綠海龜對人為干擾極為敏感，容易因受驚而放棄產卵。指定深灣限制地區有助保護瀕危綠海龜及其繁殖地，長遠對綠海龜的存活及繁衍有正面作用。
 
漁護署人員會在區內巡邏，以防止未經許可者進入深灣限制地區，並監察綠海龜出沒及產卵的情況。任何人士未經許可進入限制地區，一經定罪，最高可被判罰5萬元。",,
世衞指急需8百萬美元為緬甸地震傷者提供創傷護理並預防疾病爆發,2025-03-31 14:19,,2025-03-31 14:30,cinternational,rthk,https://news.rthk.hk/rthk/ch/component/k2/1798248-20250331.htm,"世界衞生組織形容強烈地震已摧毀緬甸中部，擾亂衞生服務，大批民眾處於危及生命的傷害及疾病爆發風險當中，世衞正以最高級別的緊急行動應對，並作出緊急呼籲，表示迫切需要800萬美元資金，在未來一個月為傷者提供創傷護理、預防疾病爆發及恢復基本衞生服務。

世衞在通報中指出，已向受災最嚴重的內比都及曼德勒的醫院，提供近3噸醫療物資，同時正組織全球緊急醫療團隊，到緬甸開展救援行動，包括創傷包和多功能帳篷在內的物資已從仰光的儲存倉，運抵內比都一間有一千個床位的醫院，曼德勒的醫院亦將很快得到物資。

世衞又指地震前評估緬甸今年將有1290萬人需要人道主義醫療援助，地震令情況雪上加霜。",,
Privacy watchdog issues AI guidelines for employees,2025-03-31 14:18,,2025-03-31 14:30,elocal,rthk,https://news.rthk.hk/rthk/en/component/k2/1798247-20250331.htm,"The Office of the Privacy Commissioner for Personal Data (PCPD) on Monday issued a checklist to guide organisations in regulating their employees’ use of generative artificial intelligence. 

Privacy Commissioner Ada Chung said the checklist is important as the secure use of AI is an essential part of national security. 

“In the areas of technological development and industrial innovation, the country has all along stressed the equal importance of development and safety,” she said. 

“In order to implement the spirit of the Two Sessions … and in order to facilitate the safe and healthy development and use of AI in Hong Kong, my office published the checklist on guidelines for the use of generative AI by employees today.” 

Organisations must specify tasks in which employees are allowed to use AI, with examples including drafting documents, summarising information and creating video and audio content. 

They should also clearly define which AI tools employees can use, which may include publicly-available or internally developed systems. 

The devices that can access the AI tools should also be regulated, the PCPD noted, as organisations are advised to establish clear distinctions between work devices and personal devices.  

Organisations should also spell out the penalties or review mechanisms for employees who don’t adhere to the guidelines. 

Chung said organisations need to be particularly careful if they want to train their AI models with data from clients.

“For example, when you first collect the data, you did not tell them that it would be used for training AI but subsequently you want to [do so],” she said. 

“And you will need to obtain the customer's expressed and voluntary consent to do that under the Privacy Ordinance.” 

The full checklist of the newly released guidelines is available for download on the  PCPD’s website.

The office said a hotline has been set up for organisations to make enquiries about how to use AI safely and properly.

Chung also pointed out that the privacy watchdog has initiated compliance checks on 60 private-sector organisations and government departments to assess how responsibly they are using AI.

The results will be finalised by summer.",,
荃景圍院舍失蹤男子已尋回　並沒有受傷,2025-03-31 13:54,,2025-03-31 14:15,local,rthk,https://news.rthk.hk/rthk/ch/component/k2/1798245-20250331.htm,"日前在荃灣失蹤的38歲男子林嘉良已被尋回。

他於本月26日離開荃景圍的院舍後失蹤，院舍職員之後報案。他昨日下午在河背街被尋回，沒有受傷，案件沒有可疑。",,
港鐵爭取年內完成東鐵綫安裝月台閘門　外判客服中心不涉裁員,2025-03-31 13:52,,2025-03-31 14:15,local,rthk,https://news.rthk.hk/rthk/ch/component/k2/1798244-20250331.htm,"立法會一個委員會討論港鐵提升設施的最新進展。港鐵常務總監楊美珍表示，現時東鐵綫只餘下3個車站未完成安裝月台閘門，形容安裝進度順利，會爭取在年內盡快完成。

議員周小松關注港鐵準備將東涌站、迪士尼站、機場快綫及東鐵綫的客務中心服務外判，擔心會影響服務質素，同時打擊員工的士氣。他表示，九大工會聯署反對港鐵的做法，質疑港鐵為何一意孤行。

楊美珍回應說希望解決人手問題，已向現有員工承諾不會裁員，亦不會將他們調離現有車站，港鐵現時亦無計劃再將其他工作外判。

實政圓桌議員田北辰表示，港鐵將於輕鐵試行「貓狗同行」計劃，有市民向他反映由於輕鐵只有一列車卡，可能會影響部分對動物毛髮和氣味敏感的乘客。楊美珍表示，選擇在輕鐵推行計劃是考慮到輕鐵在戶外路面行駛，可能對動物來說是較好的開始，強調會在收集意見和營運實際情況後，再檢討及思考下一步工作。",,
CityU strikes global research deal with Cambridge,2025-03-31 13:52,,2025-03-31 14:15,elocal,rthk,https://news.rthk.hk/rthk/en/component/k2/1798243-20250331.htm,"The City University of Hong Kong (CityU) and the University of Cambridge signed a global research collaboration deal on Monday. 

As part of the deal, 18 top post-doctoral researchers from around the world will be based in Cambridge, taking advantage of its laboratories and resources under supervision by principal investigators from both universities for three years. 

CityU council chairman Michael Ngai said the collaboration aligns with the strategic goals of the Hong Kong government.

'It serves as a vital step in further establishing Hong Kong as a premier international hub of higher education,"" he said.
 
Six colleges and departments from each university will be collaborating together. 

Key research areas range from 3D medical data to creativity in an age of intelligent machines.

CityU president Freddy Boey said the two institutions plan to offer attractive assistant professorship positions to postdoctoral fellows upon the completion of their research contracts. 

""This collaboration now represents a singular largest postdoctoral fellowship programme between University of Cambridge in Asia and an Asian university,"" he said.

At the signing ceremony, University of Cambridge vice-chancellor Deborah Prentice said ""this partnership will enable these outstanding scholars to have the freedom to continue to push the frontiers of research in addressing global challenges.""

She added that CityU has recently been recognised as the world's most international university by Times Higher Education in both 2024 and 2025.",,
衞生黑點大減8成半至約100個　卓永興感謝各部門配合,2025-03-31 13:49,,2025-03-31 14:00,local,rthk,https://news.rthk.hk/rthk/ch/component/k2/1798242-20250331.htm,"政府更新衞生黑點名單，大幅剔除630多個衞生黑點，佔整體衞生黑點數目八成半。黑點數目由730多個減至約100個。由於更新黑點名單中計及情況已獲改善但仍未達兩年的60多個衞生黑點，因此實際上94%曾出現在黑點名單的地點，整體情況已得到改善。
 
政務司副司長卓永興表示，今年2月的地區治理專組會議，指示各部門要仔細審視738個衞生黑點的情況，以確定適合從名單剔除的黑點，並繼續積極跟進情況尚待改善的黑點。根據各個部門檢視的結果，名單上94%，即696個黑點的衞生情況已大有改善，可考慮從黑點名單移除，但其中8%，即64個黑點尚未達致須持續兩年得到改善的標準，仍需保留在黑點名單內。

他感謝各部門在過去兩年多同心協力和積極配合，持續整頓巡查，令打擊衞生黑點計劃收效顯著。",,
"'Design, build, run model possible for new link to SZ'",2025-03-31 13:34,,2025-03-31 14:00,elocal,rthk,https://news.rthk.hk/rthk/en/component/k2/1798240-20250331.htm,"The government is looking into the possibility of having a single contractor design, build and operate a planned cross-border railway in the northwestern New Territories and says officials will start gauging developers' interest later this year. 

The Hong Kong-Shenzhen Western Rail Link, which is a key component of the Northern Metropolis, is aimed at connecting Hung Shui Kiu with Qianhai. 

Estimated to come into operation in 2035, the proposed 18-kilometre cross-border railway is expected to take residents from one place to the other in 15 minutes. 

Transport minister Mable Chan said the administration is considering different options for the project, including a ""design, build and operate"" contract.

""In the second half of the year when we invite intentions and expressions, we will then know whether [it can be] a design, build and operate [model] or whether it is [having] design and build as a contract and then operation as another contract,"" Chan told lawmakers on Monday. 

""Experienced operators can take up the operation solely, or they can partner up with other operating companies.""

Three stations along the proposed link will be in Hong Kong and two will be across the border. A co-location arrangement is expected to be adopted for immigration and customs facilities on the Shenzhen side. 

While some lawmakers called for both of the stations in Shenzhen to have checkpoints, the transport chief said officials are still hammering out details of the arrangement with mainland counterparts.",,
港深西部鐵路下半年邀請意向書　陳美寶：對招標持開放態度,2025-03-31 13:18,,2025-03-31 13:45,local,rthk,https://news.rthk.hk/rthk/ch/component/k2/1798241-20250331.htm,"運輸及物流局局長陳美寶表示，就連接洪水橋至深圳前海的港深西部鐵路，將於下半年邀請意向書，了解市場反應，包括是否可以採取「計劃，建造，營運」一站式合約，強調希望「摸一摸市場脈搏」，至於鐵路日後採取「一地兩檢」，口岸會設在深圳灣還是前海就仍在與深圳方面商討。就鐵路的成本效益方面，已做了兩期研究，就乘客量的評估，估計2038年本地及跨境客量介乎29萬至35萬人次，到2046年估計有38萬至46萬人次。

實政圓桌的田北辰關注，港深西部鐵路日後會否交由港鐵營運。陳美寶表示，港鐵在營運鐵路方面具有豐富經驗，在鐵路接駁方面亦對市民有利，因此在招標方面，會持開放態度，歡迎港鐵參與，又或者夥拍其他營辦商組隊競投。

陳美寶又說，是否就項目的「計劃，建造，營運」分開獨立招標持開放態度，強調最重要的考慮是能夠做到「強強聯手」，各自發揮優勢，同時要看清楚財務評估，研究哪一種招標組合能發揮最佳效果。

工聯會議員陸頌雄質詢時提到，在興建港深西部鐵路時，會否同時一併考慮興建連接洪水橋至港島西的鐵路綫。陳美寶表示，會在興建港深西部鐵路時預留彈性，例如轉車站、訊號系統、列車安排等，當日後做到有關項目時，可以連接得更好。",,
特區救援隊抵達曼德勒　將與國家隊分工展開搜救,2025-03-31 13:13,,2025-03-31 13:45,local,rthk,https://news.rthk.hk/rthk/ch/component/k2/1798239-20250331.htm,"保安局表示，特區救援隊剛抵達緬甸地震災區曼德勒，立即與中國救援隊會合，聽取國家隊對當地災情的簡介。沿途見到不少房屋倒塌，災民在空地搭建臨時帳篷。

特區救援隊隨後與國家隊分工，整裝待發往不同災區展開搜救，並會在國家隊旁紮營，設置行動基地。",,
恒指下午開市後跌逾300點,2025-03-31 13:13,,2025-03-31 13:45,local,rthk,https://news.rthk.hk/rthk/ch/component/k2/1798238-20250331.htm,"港股下午開市初段跌幅稍為收窄，恒生指數較早時報23086點，跌339點，跌幅1.45%。

科技指數報5371點，跌135點，跌幅2.45%。",,
大酒店去年轉蝕9.4億元　基本虧損約1.8億元,2025-03-31 13:09,,2025-03-31 13:15,cfinance,rthk,https://news.rthk.hk/rthk/ch/component/k2/1798237-20250331.htm,"大酒店去年由盈轉虧，虧損9.43億元，不派末期息；前年盈利1.46億元。

撇除開業前及項目費用、未變現物業重新估值變動及減值撥備的除稅後影響，基本虧損1.76億元，而前年基本盈利2.77億元。

期內，總收入升26%至109.91億元，當中包括出售7套倫敦半島住宅公寓所得收入34.52億元，以及倫敦半島酒店全年投入服務所錄得的收入。

酒店分部收入增長19%至56.8億元，商用物業分部收入升40%至43.4億元，山頂纜車、零售及其他業務分部收入增加17%至9.7億元。

單計第4季，位於香港、上海及北京的大中華區半島酒店出租率69%，按年和按季分別升11及15個百分點。平均房租4265元，按年跌7.7%，按季升10.6%。平均可出租客房收入2937元，按年和按季升9.2%和41.1%。

其他亞洲地區及歐美半島酒店，出租率介乎56%至69%，以美國的出租率最高。",,
大新銀行去年盈利升約11%　大新金融多賺5%,2025-03-31 13:07,,2025-03-31 13:15,cfinance,rthk,https://news.rthk.hk/rthk/ch/component/k2/1798235-20250331.htm,"大新銀行去年盈利20.6億元，按年升約11%。末期息0.39元。去年營運收入升17%至69.3億元，信貸減值虧損升逾1倍至17.9億元。

集團去年淨利息收入升約10%至52.9億元。受惠於較高利率環境，淨息差2.17厘，按年擴闊16個基點，但核心市場貸款需求低迷，總貸款結餘按年跌3%。

淨服務費及佣金收入急升53%至13.3億元，由於與永明金融已完成首個年度在香港分銷對方旗下產品的獨家協議，帶動大新的銀行保險業務增長。

去年應佔聯營公司重慶銀行盈利約6.8億元，就重慶銀行投資減值虧損大減97%至1600萬元。

另外，母公司大新金融去年盈利16.7億元，按年升約5.1%，派末期息每股1.18元。",,
星展香港：四大行增加核心一級資本屬支持經濟政策跟進措施,2025-03-31 12:50,,2025-03-31 13:00,greater_china,rthk,https://news.rthk.hk/rthk/ch/component/k2/1798234-20250331.htm,"中國銀行、建設銀行、交通銀行及郵儲銀行，星期日發通告，計劃向財政部等機構發行A股集資，總規模不超過5200億元人民幣，用於增加核心一級資本，更好服務實體經濟。四家銀行A股發行價，較上星期五收市溢價約9%至近22%。

星展香港高級經濟師周洪禮表示，面對外部環境不明朗，今次注資可向整體銀行體系提供更多緩衝，以配合往後穩定樓市、促進內需消費、支持高新科技產業等政策，認為是支持經濟政策的跟進措施。

周洪禮指出，近年內地利率持續下調，當前銀行淨息差處於低位，加上銀行面對壞帳風險，以及需要購買中央及地方政府債券，相信注資有一定急切性。

他預計，內地可能進一步降低借貸成本，但美國等環球主要央行減息步伐仍然是關鍵。中央暫時需採取減息以外措施，強化經濟及銀行體系，未來可能著手加快處理銀行壞帳問題，包括研究將部分不良貸款打包予資產管理公司處理，透過撇帳改善銀行資產負債表質素，以提升銀行放貸意欲。",,
特朗普：出售TikTok協議將在限期前敲定,2025-03-31 12:49,,2025-03-31 13:00,greater_china,rthk,https://news.rthk.hk/rthk/ch/component/k2/1798233-20250331.htm,"美國總統特朗普表示，中國公司字節跳動出售旗下短片分享平台TikTok的協議，將在4月5日期限前敲定。

路透社報道，特朗普在1月設定最後期限，要求字節跳動須在4月5日前出售TikTok予非中國買家，否則將在美國被禁。

特朗普在空軍一號專機上說，有很多潛在買家對TikTok非常有興趣。他又說希望TikTok能繼續存在。

在美國有1億7千萬名用戶的TikTok未有作出回應。

特朗普日前提出以降低關稅來換取將TikTok出售予美國公司的建議，但中國外交部拒絕，發言人指中方已多次闡明立場，中方反對加徵關稅的立場也是一貫的、明確的。",,
中國海外去年盈利跌約39%　末期息減少33%,2025-03-31 12:32,,2025-03-31 13:00,cfinance,rthk,https://news.rthk.hk/rthk/ch/component/k2/1798232-20250331.htm,"中國海外去年盈利156.4億元人民幣，按年跌約39%。派發末期息每股30港仙，全年派息60港仙，按年分別跌33%和25%。

剔除稅後投資物業重估增值及匯兌淨損益等影響後，核心盈利157.2億元人民幣。

期內，收入1851.5億元，按年跌近9%。房地產開發業務收入跌逾9%至1747.2億元，合約物業銷售額上升0.3%至3106.9億元；商業物業運營業務收入升12%至約71.3億元。

集團表示，去年持續縮減非人民幣淨負債敞口，降低外幣債務，並增加人民幣融資。至去年底，人民幣借貸佔比提升至82.3%，按年上升12個百分點。

集團說，匯率管理以自然對沖為主，沒有參與任何衍生金融工具投機交易，但將審慎考慮是否於適當時候進行貨幣和利率掉期安排，以對沖相應風險，又認為集團的匯率及利率風險相對可控。",,
西藏愈來愈多老年人日間照料中心為長者服務,2025-03-31 12:28,,2025-03-31 12:45,greater_china,rthk,https://news.rthk.hk/rthk/ch/component/k2/1798231-20250331.htm,今年是西藏自治區成立60周年，記者到西藏採訪，了解當地民生及社會發展情況。中國人口老齡化問題日益加劇，西藏自治區政府近年著力健全養老服務體系，發展銀髮經濟，當地愈來愈多老年人日間照料中心建成，為長者提供集養護、醫療、教育、娛樂、創業於一身的服務。,,
內地學者稱「TikTok難民」現象未必持續,2025-03-31 12:26,,2025-03-31 12:45,greater_china,rthk,https://news.rthk.hk/rthk/ch/component/k2/1798230-20250331.htm,"美國前總統拜登任內要求短片分享平台TikTok的美國業務，要脫離中國母公司字節跳動，否則禁用；到總統特朗普上任，就將有關行政命令暫緩至4月初。當時衍生出被形容為「TikTok難民」的外國人士，轉用中國社交平台「小紅書」。

在北京，有網民製作英語短片，收穫大批海外網民追隨，互相交流日常生活及文化。有學者分析，「TikTok難民」現象未必持續，但至少讓不同國家的民眾增進了解。",,
港股半日跌近2%　長和跌約4%,2025-03-31 12:15,,2025-03-31 12:30,local,rthk,https://news.rthk.hk/rthk/ch/component/k2/1798228-20250331.htm,"港股連續兩日向下，中午收市前跌幅擴大，創近1個月低位。恒生指數今早低開逾200點後，跌幅一度收窄至不足30點，中午收市報23022點，跌404點，跌幅1.73%，主板半日成交約1438億元。

科技指數半日跌約3.1%，拖累大市向下。

長和半日跌約4%，集團表示，到目前為止，未有就全球電訊業務有關的任何交易作出決定。

中行、建行、郵儲銀行及交行計劃向財政部等機構發行A股集資合共不多於5200億元人民幣，以增加核心一級資本。4隻內銀A股造好，但H股個別發展，其中建行升逾3%，中行升逾2%，郵儲行跌2%，交行偏軟。",,
