title,date,summary,scrape_time,section,source,url,news_content
人民日報：任何通過施壓迫使中國做出原則性讓步都是不切實際,2025-09-21 08:52,,2025-09-21 09:15,greater_china,rthk,https://news.rthk.hk/rthk/ch/component/k2/1823820-20250921.htm,"美國白宮發言人萊維特表示，美中未來就TikTok達成的協議，包括董事會將有七名成員，美國人佔當中六席，中國字節跳動公司委任一人。

路透社引述白宮高級官員透露，協議將要求所有TikTok美國用戶數據，儲存在由美國科企甲骨文營運的雲端之中。而日後控制TikTok的合資公司，字節跳動將持有少於20%股份。 

在北京，《人民日報》發表「鐘聲」評論文章，中美在西班牙馬德里會談，就以合作方式妥善解決TikTok問題達成基本框架共識。在TikTok問題上，中國政府尊重企業意願，樂見企業在符合市場規則基礎上做好商業談判，達成符合中國法律法規、利益平衡的解決方案。美方應同中方相向而行，為中國企業到美國投資提供開放、公平、非歧視的營商環境。中方始終強調，對話磋商是有原則的，合作的氛圍需要共同營造與維護。中國的發展權利不容損害，維護自身正當權益的決心堅定不移，任何通過施壓迫使中國做出原則性讓步的想法，都是不切實際的。美方應取消單方面貿易限制措施，防止衝擊雙方來之不易的磋商成果。"
天文台：未來一兩小時香港廣泛地區可能受大雨影響,2025-09-21 08:51,,2025-09-21 09:15,local,rthk,https://news.rthk.hk/rthk/ch/component/k2/1823821-20250921.htm,天文台發出特別天氣提示，表示未來一兩小時香港廣泛地區可能受大雨影響，市民應提高警覺。
英超曼聯2:1挫車路士　利物浦2:1擊敗愛華頓,2025-09-21 06:55,,2025-09-21 07:15,csport,rthk,https://news.rthk.hk/rthk/ch/component/k2/1823818-20250921.htm,"英超矚目大戰，曼聯主場迎戰車路士，在半場各有球員被逐之下，曼聯2:1擊敗對手。

利物浦主場2:1擊敗愛華頓，開季5連勝。

熱刺作客白禮頓，要靠對手尾段「送禮」，驚險2:2逼和對手，搶回1分。

積分榜，榜首的利物浦開季5連勝得15分，領先第二的熱刺5分，阿仙奴9分排第三，曼聯5戰2勝1和得7分排第十位。

德甲方面，拜仁慕尼黑4:1大勝賀芬咸，射手哈利卡尼大演帽子戲法。拜仁開季4戰全勝，12分排榜首。

意甲祖雲達斯失分，作客維羅納，在先開紀錄的情況下被逼和1:1。賽後以4戰3勝1和得10分，1分領先次席的拿坡里。"
巴黎聖母院南北兩座塔樓正式重新對外開放,2025-09-21 06:55,,2025-09-21 07:15,cinternational,rthk,https://news.rthk.hk/rthk/ch/component/k2/1823819-20250921.htm,"法國巴黎聖母院南北兩座塔樓，當地星期六正式重新對外開放，是自2019年火災發生以來，巴黎聖母院塔樓首次恢復公眾參觀。

重新開放後，塔樓遊覽路線有所調整，參觀者從南側塔樓底部進入，攀登台階，抵達69米高的塔頂平台，可欣賞巴黎全景及重生的教堂尖塔。隨後，參觀者可步行至連接南北兩座塔樓的露天平台，觀賞巴黎聖母院大教堂頂部的石雕和修復後的木質屋頂結構。遊覽結束後，參觀者從北側塔樓落樓。今次重新開放正值法國慶祝第42屆歐洲遺產日。

巴黎聖母院始建於12世紀，是法國最具代表性的古跡之一。2019年4月15日發生火災，屋頂和尖塔等結構損毀，塔樓隨後暫停開放。經歷5年修復，大教堂主體於去年12月重新開放，但整體修復工程仍繼續，預計將持續至2030年左右。"
"Shing Mun, Aberdeen Tunnel tolls rise to HK$8",2025-09-21 06:19,,2025-09-21 06:30,elocal,rthk,https://news.rthk.hk/rthk/en/component/k2/1823805-20250921.htm,"Tolls for the Aberdeen and Shing Mun runnels rise from HK$5 to HK$8 from Sunday.

In a statement, the Transport Department said the new tolls are to help tunnel operations to ""largely attain break-even"".

The department also reminded the public that charges for metered parking spaces will be up from HK$2 to HK$4 per 15 minutes starting next Sunday.

It added fees for metered parking spaces for goods vehicles, buses and coaches would remain unchanged."
白宮官員稱美中協議將要求TikTok在美用戶數據存於美國雲端,2025-09-21 05:31,,2025-09-21 05:45,cinternational,rthk,https://news.rthk.hk/rthk/ch/component/k2/1823817-20250921.htm,"路透社引述美國白宮一名高級官員表示，美國與中國就短片分享程式TikTok未來將達成的協議，要求將所有美國用戶的數據，都儲存在由美國科企甲骨文營運的美國雲端運算基礎設施中。

白宮發言人萊維特較早時表示，美中有關協議將包括一個監管TikTok在美業務的董事會，董事會將有七名成員，美國人佔當中六席。該名白宮高級官員就透露，第七名成員將由中國字節跳動公司委任，又指協議意味TikTok的演算法在美營運時，可重新受訓及安全，不受字節跳動控制，美國用戶仍可使用TikTok與世界各地的內容互動。

在北京，商務部新聞發言人昨日就TikTok問題回應記者提問時表示，希望美方與中方相向而行，切實履行相應承諾，為包括TikTok在內的中國企業在美持續運營，提供開放、公平、公正和非歧視的營商環境，推動中美經貿關係穩定、健康、可持續發展。"
歐洲幾個主要機場續處理登機及託運系統遭網絡攻擊所引致問題,2025-09-21 03:49,,2025-09-21 04:00,cinternational,rthk,https://news.rthk.hk/rthk/ch/component/k2/1823815-20250921.htm,"歐洲幾個主要機場仍在處理預辦登機手續及託運行李系統遭受網絡攻擊引致的問題。英國倫敦希斯路機場表示，為幾間航空公司提供服務的軟件，出現技術問題，多班周六航班延誤。

比利時布魯塞爾機場表示，當地周五晚間遭受網路攻擊，必須人手辦理乘客報到及登機手續，建議旅客透過官方渠道，實時獲取航班更新信息。德國柏林勃蘭登堡機場亦在官網公布，由於系統服務供應商技術故障，旅客辦理登機手續須等待的時間延長。機場網站信息顯示一些航班順利起飛，但部分航班短暫延誤，有航班就延誤時間較長。德國傳媒報道，法蘭克福及漢堡機場未受影響，運作正常。

涉事柯林斯航空航天公司為多間航空公司於多國機場提供預辦手續及登機服務。母公司表示，已知悉柯林斯的系統在部分機場出現與網絡相關的中斷情況，正努力盡快解決問題，又指影響僅限於電子報到及行李托運，可透過人工操作紓緩情況。"
美國土安全部要求三個州配合遣返服刑完畢非法移民罪犯,2025-09-21 02:41,,2025-09-21 03:00,cinternational,rthk,https://news.rthk.hk/rthk/ch/component/k2/1823813-20250921.htm,"美國國土安全部向加州、紐約州及伊利諾州發出警告，要求這三個州配合，遣返服刑完畢的非法移民罪犯。

國土安全部助理部長麥克勞克林表示，該部門早前已致函這三個州的民主黨檢察總長，要求協助移民與海關執法局，拘留非法移民。

報道指伊利諾州及紐約州拒絕在非法移民罪犯出獄或刑滿獲釋後，通知移民與海關執法局執行遣返，加州未作出回應。"
天文台預測樺加沙中心不經菲律賓及台灣　料以超強颱風強度進南海,2025-09-21 02:32,,2025-09-21 02:45,local,rthk,https://news.rthk.hk/rthk/ch/component/k2/1823812-20250921.htm,"強颱風樺加沙目前集結在馬尼拉之東北偏東。天文台在天氣隨筆中指該處的熱帶氣旋潛熱較高，加上配合良好的高空輻散及偏弱的垂直風切變，預料樺加沙會增強至超強颱風強度。

按現時預測，樺加沙會橫過呂宋海峽進入南海，由於中心不會經過菲律賓及台灣等陸地，預料屆時有機會保持超強颱風強度，而且樺加沙環流相當廣闊，雖然各預測模式對其掠過香港南面時與本港的距離仍有一定差異，但預料猛烈風力會對本港帶來相當大威脅。

天文台又指若樺加沙以超強颱風強度在本港以南近距離掠過，配合最高天文潮時間，沿岸水位會上升得更高。按現時評估，屆時水位高度可能會與2017年天鴿及2018年山竹吹襲時相若，實際水位升幅度取決於樺加沙的強度，以及最接近本港的距離及時間。"
天文台發出局部地區大雨提示　指新界北區有可能出現嚴重水浸,2025-09-21 02:16,,2025-09-21 02:30,local,rthk,https://news.rthk.hk/rthk/ch/component/k2/1823811-20250921.htm,"天文台發出局部地區大雨提示，指出新界北區的雨勢特別大，有可能出現嚴重水浸，可能受影響的市民應採取適當預防措施，防止水浸可能引致的損失，有關區域已錄得、或預料會有每小時雨量超過70毫米的大雨。

天文台說與米娜殘餘相關驟雨，正逐漸影響本港，提醒市民留意天氣變化。

另外，天文台預料熱帶氣旋樺加沙會在今明兩日移向呂宋海峽一帶，並顯著增強，有機會以超強颱風強度在本周中期，靠近廣東沿岸。按照現時預測，本港星期二、三天氣逐漸轉壞，星期三吹烈風至暴風，天氣惡劣，有狂風大驟雨及雷暴，海有巨浪及湧浪。由於受顯著風暴潮影響，屆時沿岸水位可能與2017年的天鴿及2018年的山竹相若。"
俄羅斯譴責英法德試圖強行推動安理會恢復制裁伊朗的決議,2025-09-21 01:55,,2025-09-21 02:30,cinternational,rthk,https://news.rthk.hk/rthk/ch/component/k2/1823810-20250921.htm,"俄羅斯外交部發表聲明，譴責英國、法國及德國試圖強行推動聯合國安理會恢復制裁伊朗的決議。

央視新聞報道，俄羅斯外交部的聲明說俄方已多次指出，參與伊核協議的歐洲國家，行動具有挑釁性及非法性，有關行動只會進一步加劇圍繞伊朗核計劃的緊張局勢。

聯合國安理會日前未能通過繼續解除對伊朗制裁措施的決議草案。"
澳洲有網絡商故障令緊急召喚服務一度中斷導致4死　監管機構調查,2025-09-21 01:44,,2025-09-21 02:00,cinternational,rthk,https://news.rthk.hk/rthk/ch/component/k2/1823809-20250921.htm,"澳洲第二大電信網絡服務商奧普圖斯通信公司，日前發生長達13小時的網絡故障，緊急召喚服務一度中斷，導致4人死亡。

報道指故障始於當地過去星期四凌晨時份，影響範圍包括南澳大利亞州、西澳大利亞州及北領地區。南澳州和西澳州警方確認，一名8周大男嬰、一名68歲女子，一名49歲男子、一名74歲男子，因緊急救護電話無法撥通，最終死亡。

澳洲通信部長威爾斯說，奧普圖斯在最關鍵時刻讓澳洲人失望，不可接受，強調電信企業按法例必須保障緊急召喚暢通，目前監管機構展開調查。奧普圖斯就事件致歉，承諾全面配合調查，又指故障發生在一次常規網路防火牆升級期間，最初監測並未顯示通信中斷，警報系統亦未發出警告。公司發現問題後隨即停止升級，恢復緊急召喚服務。"
央視引評論指美方不能一邊指望中方照顧其關切一邊持續損中方利益,2025-09-21 01:33,,2025-09-21 02:00,greater_china,rthk,https://news.rthk.hk/rthk/ch/component/k2/1823808-20250921.htm,"央視新聞在國際銳評文章中指出，早前結束的中美經貿馬德里會談，中美就妥善解決短片分享程式TikTok相關問題等，達成基本框架共識，但同時美方無停止單方面對華實施經貿打壓限制措施的錯誤做法，仍在不斷擴大對中國實體的制裁清單，中方對此已向美方提出嚴正關切。

文章引述有評論認為，國家主席習近平於過去的星期五晚與美國總統特朗普通電話，預示中美向著達成TikTok解決協議，取得重要進展，但同時中方明確告誡美方，不能一邊指望中方照顧美方關切，一邊又持續打壓中國企業、損害中方利益，中美合作必須建立在平等、尊重、互惠的基礎上。

文章引述中國社會科學院國家全球戰略智庫國際政治研究部主任趙海認為，中美如能解決有突出分歧的TikTok問題，將為各自企業到對方市場經營發展創造條件，並有助於中美推進解決其他經貿問題。"
白宮稱TikTok協議將包括七人董事會　美國人佔六席,2025-09-21 00:56,,2025-09-21 01:30,greater_china,rthk,https://news.rthk.hk/rthk/ch/component/k2/1823807-20250921.htm,"美國白宮發言人萊維特表示，美中未來就TikTok達成的協議，將包括一個監管這款短片分享程式在美業務的董事會，董事會將有七名成員，美國人佔當中六席。

在北京，商務部較早時重申，中方在TikTok問題的立場清楚，希望美方與中方相向而行，切實履行相應承諾，為包括TikTok在內的中國企業在美持續運營，提供開放、公平、公正及非歧視的營商環境，推動中美經貿關係穩定、健康、可持續發展。"
南非警方收到有農場散發可疑化學氣味舉報後搗破冰毒加工場拘6人,2025-09-21 00:46,,2025-09-21 01:00,cinternational,rthk,https://news.rthk.hk/rthk/ch/component/k2/1823806-20250921.htm,"南非警方公布，日前在姆普馬蘭加省進行的一次突擊檢查中，搗破一個冰毒加工場，拘捕6人。

警方發言人表示，收到這座農場散發出可疑化學氣味的舉報，於是採取行動，搜查期間發現大量用於制毒的前體化學品、設備及冰毒，這些物品被包裝在餐盒及膠桶中，存放於冰櫃。

警方未有透露被捕的6名疑犯具體來自哪個國家，報道就指當中5人相信來自北美國家，1人是農場管理員。"
香港仔隧道及城門隧道加價　運輸署稱隧道營運可大致達到收支平衡,2025-09-21 00:12,,2025-09-21 00:30,local,rthk,https://news.rthk.hk/rthk/ch/component/k2/1823803-20250921.htm,"香港仔隧道及城門隧道今日起加價，所有車種全日劃一收費由5元調整至8元。

運輸署預計，新收費對交通造成的影響輕微，隧道營運亦可大致達到收支平衡。

另外，停車收費錶、亦即俗稱的「咪錶」泊車位，將於本月28日星期日起實施新收費，最高收費由每15分鐘2元調整至4元，即每小時最多收16元。貨車、巴士及旅遊巴士泊車位的現有咪錶收費水平，維持不變。"
樺加沙有機會以超強颱風強度下周中期靠近廣東沿岸,2025-09-20 23:02,,2025-09-20 23:30,local,rthk,https://news.rthk.hk/rthk/ch/component/k2/1823802-20250920.htm,"樺加沙已增強為強颱風，預料向西北偏西移動，移向呂宋海峽一帶並繼續增強。

天文台預料，星期一天色短暫好轉及酷熱，隨後一兩日天氣逐漸轉壞，星期三吹烈風至暴風，天氣惡劣，有狂風大驟雨及顯著風暴潮。

天文台科學主任麥佩緹說，樺加沙有機會以超強颱風的強度下周中期靠近廣東沿岸，預測本港星期二、三天氣逐漸轉壞。由於受顯著風暴潮影響，屆時沿岸水位可能與2017年的天鴿及2018年的山竹相若。"
東京警方拘捕3名越南人　涉嫌在超市偷取白米和其他商品,2025-09-20 22:34,,2025-09-20 23:00,cinternational,rthk,https://news.rthk.hk/rthk/ch/component/k2/1823800-20250920.htm,"日本東京警方拘捕3名越南人，他們涉嫌在群馬縣兩間超級市場偷取白米和其他商品，並出售予第三方。

被捕3人年齡由28歲至45歲，東京警方說，3人分別進入超市，在大約3至4分鐘內偷走白米等商品，然後坐接應的車輛逃去。

日本傳媒報道，被捕3名越南人是以技術研修生身分到日本，但他們的簽證已經過期。"
政府稱鰂魚涌民眾撤離及拆彈行動展現專業團結及各界支援協助,2025-09-20 22:20,,2025-09-20 22:45,local,rthk,https://news.rthk.hk/rthk/ch/component/k2/1823799-20250920.htm,"政府表示，在鰂魚涌發現戰時炸彈的民眾撤離及拆彈行動，啓動應急機制，緊密協作，展現出高度專業與團結精神，安全有序地化解危機，期間社會各界積極支援協助，市民表現出高度秩序、充分理解和積極配合，令這次危機得以有序妥善處理。

保安局動員近500名警務處、消防處、民安隊及醫療輔助隊人員，參與緊急應變行動，並即時啓動緊急事故監察及支援中心，全力協調及支援跨部門應急工作。

發言人說，警方在行動前作周詳準備和部署，疏散附近18幢商住大廈居民，以確保公眾安全及將對市民的影響減至最低；爆炸品處理課人員由昨晚起處理該枚炸彈，至今早成功妥善處理，並隨即解封現場。

消防處在事件中共出動消防及救護車輛58架次，動員224名消防及救護人員，又部署一條消防喉及一隊煙帽隊，以及調派滅火機械人和額外調派災難應變救援隊在場戒備。消防處亦配合警方大規模疏散行動，最後協助疏散了共2887名居民。

另外，消防處亦聯同醫療輔助隊及香港聖約翰救護機構，一同協助有特別需要的居民，共運送了5名身體不適的居民到醫院，以及6名有需要市民到適合地方安頓。消防處在拆彈行動完成後，又統籌及協調相關部門，調派新引進的大型救護車，將8名有需要及行動不便的市民送回家中。

東區35隊關愛隊全數出動，灣仔區關愛隊亦跨區作出支援。民政總署合共開設19個臨時庇護中心，昨晚有近450名居民入住，相關民政處人員和關愛隊成員及義工於中心通宵提供支援，並為他們提供床鋪和飲食。

民安隊在整個行動中，共動員超過100名隊員積極協助疏散工作；醫療輔助隊調派5輛救護車及47名隊員，於市民疏散期間在現場候命，並在完成爆炸品拆除工作及現場解封後，協助載送6名行動不便的市民返回住所。

運輸署緊急事故交通協調中心24小時運作，因應鰂魚涌一段英皇道來回方向一度全線封閉，署方通宵督導和協調公共運輸服務營辦商做好穩妥部署和應變，調整受影響的服務，務求把對乘客出行的影響減至最低。隨着受影響道路分階段重開，署方聯繫專營巴士營辦商和電車公司迅速跟進，在確保安全穩妥後，安排受影響服務在中午過後陸續恢復行走正常路線。"
美國上調H-1B簽證費至每年10萬美元　多間大型企業表示關注,2025-09-20 21:32,,2025-09-20 22:00,cinternational,rthk,https://news.rthk.hk/rthk/ch/component/k2/1823797-20250920.htm,"美國總統特朗普簽署公告，以企業濫用H-1B簽證為由，宣佈將這類簽證的費用大幅提高至每年10萬美元，當地星期日起生效。

H-1B簽證是美國政府為高技術外國專業人才設立的臨時工作簽證，公告指這個簽證項目存在「系統性濫用」，導致美國工人被外籍勞動力替代，削弱美國的經濟和國家安全。

路透社報道，金融機構摩根大通呼籲持H-1B簽證入境美國的員工近期避免離境；正身處國外的員工就應該立即返回美國。科技企業微軟和亞馬遜亦向員工發出類似提示。

印度科技業表示關注，認為措施突然推出，為全球企業、專業人士和學生帶來顯著不確定性。

南韓外交部就表示，將會評估簽證費用上調，對有意進入美國市場的南韓公司和專業人士的影響。"
王毅與摩洛哥外相會談　強調願共同開闢兩國關係更美好前景,2025-09-20 20:35,,2025-09-20 21:15,greater_china,rthk,https://news.rthk.hk/rthk/ch/component/k2/1823795-20250920.htm,"中共中央政治局委員、外交部長王毅昨日在北京同摩洛哥外交大臣布里達舉行會談。 

王毅表示，摩洛哥是最早同新中國建交的阿拉伯、非洲國家之一。明年將迎來中摩建立戰略伙伴關係10周年，中方願同摩方秉持建交初心，保持高層交往，規劃好各領域合作，共同開闢中摩、中阿關係更美好前景。

布里達說，摩方堅定恪守一個中國原則，全面支持中方維護國家的主權和安全。摩方願同中方深化「一帶一路」合作，擴大旅遊、教育及人文等各領域交流，持續推進兩國戰略伙伴關係。

會談後，雙方簽署兩國外交部建立戰略對話機制的諒解備忘錄。"
彭麗媛：中國一直高度重視發展女性科學教育,2025-09-20 20:21,,2025-09-20 20:45,greater_china,rthk,https://news.rthk.hk/rthk/ch/component/k2/1823794-20250920.htm,"國家主席習近平夫人、聯合國教科文組織促進女童和婦女教育特使彭麗媛，昨日出席2025年聯合國教科文組織女童和婦女教育獎頒獎儀式暨獎項設立十周年慶祝活動。她致辭時表示，十年來，來自世界各國的獲獎者和各界有識之士通過教育幫助女童和婦女適應社會發展變化、實現自身發展。

彭麗媛強調，要把女性科學教育擺在更加重要位置，幫助更多女性掌握科學知識、學會運用新技術、增強創新能力，努力讓廣大女性擁抱科技革命、創造精彩人生。她又說，中國一直高度重視發展女性科學教育，期待同教科文組織及有關各方不斷深化合作，全面加強女性科學教育能力建設，共同提升女性科學教育水平。"
樺加沙增強為強颱風　天文台料下周三最接近本港,2025-09-20 19:48,,2025-09-20 20:15,local,rthk,https://news.rthk.hk/rthk/ch/component/k2/1823793-20250920.htm,"颱風樺加沙已增強為強颱風，天文台預料樺加沙有機會以超強颱風強度在下周中期靠近廣東沿岸，預測本港星期二、三天氣逐漸轉壞，樺加沙會在下周三最接近本港，屆時會吹烈風至暴風，天氣惡劣，有狂風大驟雨及顯著風暴潮。

天文台又說，由於受顯著風暴潮影響，屆時沿岸水位可能與2017年的天鴿及2018年的山竹相若，提醒市民留意最新天氣消息，及做好防風防水浸準備。"
澤連斯基下周晤特朗普　討論烏克蘭安保及制裁俄羅斯,2025-09-20 18:52,,2025-09-20 19:15,cinternational,rthk,https://news.rthk.hk/rthk/ch/component/k2/1823790-20250920.htm,"烏克蘭總統澤連斯基表示，他下周會與美國總統特朗普會面。

澤連斯基說，下星期出席聯合國大會期間，將與特朗普會面，他將在會上提出，討論烏克蘭的安全保障、以及制裁俄羅斯等議題。

澤連斯基重申，他準備好與俄羅斯總統普京會面，可以透過雙邊或有美國加入的三邊會談形式。

澤連斯基又說，烏克蘭和美國的第一夫人，預料也會在下星期會面，討論兒童等人道危機議題。"
警方中午前完成鰂魚涌地盤戰時炸彈銷毀工作　居民回家　道路重開,2025-09-20 18:43,,2025-09-20 19:45,local,rthk,https://news.rthk.hk/rthk/ch/component/k2/1823791-20250920.htm,"鰂魚涌濱海街地盤昨日發現戰時炸彈，警方通宵處理，拆彈工作至中午前完成，回復安全，居民獲准返回住所，道路重開。

警方說，該炸彈威力具破壞力，事前要做好疏散及保護工作，確保公眾安全，而因天氣惡劣，處理時間較預期長。"
警方中午前完成鰂魚涌地盤戰時炸彈拆毀工作　居民回家　道路重開,2025-09-20 18:43,,2025-09-20 19:00,local,rthk,https://news.rthk.hk/rthk/ch/component/k2/1823791-20250920.htm,"鰂魚涌濱海街地盤昨日發現戰時炸彈，警方通宵處理，拆彈工作至中午前完成，回復安全，居民獲准返回住所，道路重開。

警方說，該炸彈威力具破壞力，事前要做好疏散及保護工作，確保公眾安全，而因天氣惡劣，處理時間較預期長。"
【重溫】2025年9月20日新聞天地,2025-09-20 18:28,,2025-09-20 19:00,local,rthk,https://news.rthk.hk/rthk/ch/component/k2/1823789-20250920.htm,詳盡報道本地時事、大中華消息、國際局勢等新聞，緊貼最新熱話。
卓永興︰「AI效能提升組」會先考慮與市民接觸面較大部門,2025-09-20 18:21,,2025-09-20 19:00,local,rthk,https://news.rthk.hk/rthk/ch/component/k2/1823786-20250920.htm,《施政報告》提出成立「AI效能提升組」，擔任組長的政務司副司長卓永興說，會先考慮與市民接觸面較大的部門，提升效能。
