title,date,summary,scrape_time,section,source,url,news_content
"Trump targets Apple, EU in new trade threats",2025-05-23 20:24,,2025-05-23 20:45,efinance,rthk,https://news.rthk.hk/rthk/en/component/k2/1806009-20250523.htm,"US President Donald Trump cranked up his trade threats on Friday, targeting both smartphone giant Apple along with imports from the entire European Union, sending the global market roiling after weeks of de-escalation provided some reprieve.

Trump threatened to impose a 25 percent tariff on Apple for any iPhones sold, but not manufactured, in the United States. More than 60 million phones are sold in the United States annually, but the country has no smartphone manufacturing. He also said he would recommend a 50 percent tariff on the European Union to begin on June 1, which would result in stiff levies on luxury items, pharmaceuticals and other goods produced by European manufacturers.

Markets dropped on the news. S&P 500 futures lost 1.5 percent in premarket activity and the Eurostoxx 600 fell two percent. Shares of Apple fell 3.5 percent in premarket trading, along with shares of other technology bellwethers. Trump did not give a time frame for his warning to Apple.

""I have long ago informed Tim Cook of Apple that I expect their iPhones that will be sold in the United States of America will be manufactured and built in the United States, not India, or anyplace else,"" Trump said in a post on Truth Social. ""If that is not the case, a Tariff of at least 25% must be paid by Apple to the U.S.""

The White House has been in negotiations with numerous countries over trade issues, but progress has been unsteady.

Trump's aggressive tariffs in April, which would have raised the rate consumers and businesses would have to pay for imported goods by roughly 25 percent, sparked a selloff in US assets, including stocks, the dollar and Treasury bonds. Markets have since rebounded.

It is not clear if Trump can levy a tariff on an individual company. (Reuters)"
許正宇：公司遷冊機制並無特別針對哪個行業,2025-05-23 20:05,,2025-05-23 20:15,local,rthk,https://news.rthk.hk/rthk/ch/component/k2/1806006-20250523.htm,"財經事務及庫務局局長許正宇表示，公司遷冊機制並無特別針對哪個行業，任何企業如果在海外成立，有興趣搬到香港，遷冊機制就是幫助企業很方便和很簡單地搬過來，政府當然希望不同企業都會用到機制。

許正宇在活動後向記者表示，相信企業遷冊到香港時，會將部分業務搬到香港，不單幫助專業人士，亦幫助整個經濟。他認為，無論疫情前、疫情期間、疫情後，香港整體營商環境及專業人士人才匯聚的優勢，都是企業考慮在哪裏成立公司，或遷冊公司到哪裏的主要考慮之一。

他又說，一直以來，有很多公司有興趣來香港，無論公司之前是不是搬走，或是外面的新公司。他表示，香港屬於自由經濟，吸引公司直接把資金投放到香港，他們的資金自由進出，在這裏亦有方便的平台，讓公司投資不同地方資產。

另外，財庫局表示，近日公司註冊處已陸續接獲有關公司遷冊的查詢。處方將以一貫高效率處理申請，一般情況下，會在申請人遞交所有所需文件和資料的兩星期內完成審批。"
特朗普建議對歐盟商品徵50%關稅　英法德股市跌1%至2%以上,2025-05-23 20:05,,2025-05-23 20:15,cfinance,rthk,https://news.rthk.hk/rthk/ch/component/k2/1806008-20250523.htm,"美國總統特朗普建議，由6月1日起，對歐盟商品徵收50%關稅，若產品在美國製造或生產則可免徵，又表示蘋果公司要對非美國製造的手機支付25%關稅。

他的言論令美股3大指數期貨跌逾1%，英法德股市跌1%至2%以上。

金價升逾1.5%，現貨金較早時報每盎司3347.3美元。美元指數回落逾0.5%。"
特朗普建議下月起對來自歐盟商品徵收50%關稅,2025-05-23 20:00,,2025-05-23 20:15,cinternational,rthk,https://news.rthk.hk/rthk/ch/component/k2/1806007-20250523.htm, 
李強主持國務院常務會議　審議通過製造業綠色低碳發展行動方案,2025-05-23 19:56,,2025-05-23 20:15,greater_china,rthk,https://news.rthk.hk/rthk/ch/component/k2/1806005-20250523.htm,"國務院總理李強主持召開國務院常務會議，審議通過《製造業綠色低碳發展行動方案（2025－2027年）》，研究進一步健全橫向生態保護補償機制有關舉措，討論《中華人民共和國食品安全法（修正草案）》，並決定將修正草案提請全國人大常委會審議。

會議指出，推進製造業綠色低碳發展是大勢所趨，要健全綠色製造和服務體系，更好支持和幫助企業轉型升級。

會議又指出，要健全獎罰分明的制度機制，堅持「誰污染、誰治理，誰保護、誰受益」，研究完善激勵約束政策，吸引更多社會資本參與生態文明建設。

會議又指出，食品安全關係生命健康，要強化監督抽查結果處理，對發現的問題依法嚴懲、絕不姑息，持續完善食品安全體系。
　　"
陳美寶與港鐵管理層會面　敦促全面為整個鐵路網絡作風險評估,2025-05-23 19:51,,2025-05-23 20:15,local,rthk,https://news.rthk.hk/rthk/ch/component/k2/1806004-20250523.htm,"就港鐵將軍澳綫昨日發生的列車事故，運輸及物流局局長陳美寶傍晚與港鐵管理層會面，親身表達對港鐵接連發生事故的關注，要求從不同方面跟進事件。

運輸及物流局在社交平台表示，局長在會上敦促港鐵全面和有系統地為整個鐵路網絡作風險評估，加快善用科技，強化「預測性檢測及維修」能力，以加強鐵路系統的靭性。她又要求港鐵改善緊急應變包括乘客疏導和發放資訊等安排。

她亦指示運輸署仔細檢視如何加強協調各公共交通營辦商在突發情況下的緊急應變工作，在類似事件發生時，作出最適切及迅速的調配，協助減低對市民的影響。"
Toddler found next to mother's body in Ngau Tau Kok,2025-05-23 19:43,,2025-05-23 20:00,elocal,rthk,https://news.rthk.hk/rthk/en/component/k2/1806000-20250523.htm,"A woman was found dead in Ngau Tau Kok on Friday, with her young daughter discovered next to her body. 

Police said housing officials, who suspected the girl, 3, was being mistreated in a flat in Lok Wah North Estate, called the force after 11am. 

When officers arrived, they found the 40-year-old woman lying on a bed. She was certified dead at the scene. 

The force said the girl did not suffer any ill treatment, and was taken to United Christian Hospital for examination. 

They said the mother had an undisclosed illness, and an autopsy will be performed to determine the cause of her death.

The case has been classified as ""dead body found""."
拉扎羅獲任命為菲律賓外長,2025-05-23 19:37,,2025-05-23 20:00,cinternational,rthk,https://news.rthk.hk/rthk/ch/component/k2/1806003-20250523.htm,"菲律賓外交部副部長拉扎羅將會出任外長，接替辭職的馬納羅。

總統小馬可斯日前要求全體內閣部長辭職，以便改革政府。外長馬納羅昨日宣布辭職，小馬可斯今天任命拉扎羅接任。至於馬納羅，預料會出任菲律賓駐聯合國大使。

另一方面，菲律賓政府發言人證實，五名主管貿易、金融及經濟規劃的內閣官員將會留任，不參與內閣總辭。政府強調，仍在審視內閣改組，不排除有更多變動。"
重溫作品｜港台《奪命工傷》系列奪紐約節廣播大獎入圍獎,2025-05-23 19:14,,2025-05-23 19:30,local,rthk,https://news.rthk.hk/rthk/ch/component/k2/1806001-20250523.htm,"香港電台新聞部製作的《奪命工傷》系列報道，在今屆紐約節廣播大獎（New York Festivals Radio Awards）「社會公義報告組別」獲頒入圍獎。

致命工業意外接連發生，港台去年透過一連兩集專題報道深入剖析意外成因，記者接觸多名地盤安全主任及前線工人，揭發業界有「通水」習慣，應對勞工處安全巡查，隱瞞不安全狀況。

有安全主任在趕工期被要求「放大假」；亦有工人指僱主未有提供足夠安全設備，但為了生活，無奈接受。部分人不願意接受錄影訪問，亦有人冀揭露業界陋習，以化名及聲音經過處理方式接受訪問。

記者亦訪問了工業意外死者家屬，失去至親的家人情緒深受困擾，質疑分判商未有做好安全評估，令家庭破碎。工業傷亡權益會建議公開所有嚴重職場意外調查結果，讓各界汲取教訓。

記者翻查勞工處相關數據，並向勞工處跟進致命工業意外調查進展。勞工處其後優化「職安警示」發放方式及內容。

《奪命工傷》系列由港台新聞部記者崔蔚恩及陳曉筠聯合製作，冀透過報道協助解開「死結」，避免悲劇再發生。"
總商會：難判斷關稅戰最壞時間是否過去　強調本港經濟基調良好,2025-05-23 19:01,,2025-05-23 19:15,local,rthk,https://news.rthk.hk/rthk/ch/component/k2/1805999-20250523.htm,"香港總商會主席陳瑞娟表示，現時難以判斷關稅戰最壞時間是否已過去，因為目前難以評估有關方面日後有何政策出台，很多國家談判中，各方靜觀其變，會密切留意相關發展。

陳瑞娟提到，總商會有意在第四季訪美。總商會原定4月訪美。陳瑞娟表示，當時貿易戰升溫，有團員表達關注。

香港方面，陳瑞娟說，過去一年全球局勢變化迅速，香港憑着一國兩制優勢，與內地緊密連接，亦與國際市場接軌，發揮超級聯繫人和超級增值人角色，透過創新思維和靈活策略，香港可進一步鞏固國際金融及商業中心地位，展現持續發展能力。

她表示，總商會維持對本港今年經濟增長2.3%的預測，強調本港經濟基調良好，趨向復蘇，但全球投資環境受關稅戰影響，不確定性增加，影響投資及消費信心，本港作為外向型經濟，難免短期波動。

政府今日起接受公司遷冊申請，陳瑞娟表示，有很多客戶表達興趣，認為措施有助企業遷來香港，對本港總部經濟有幫助。"
警方調查青衣南灣隧道入口致命意外　運輸署稱工作人員有穿反光衣,2025-05-23 18:55,,2025-05-23 19:15,local,rthk,https://news.rthk.hk/rthk/ch/component/k2/1805998-20250523.htm,"青衣南灣隧道入口凌晨發生致命交通意外，凌晨零時許，一名40歲男子駕駛私家車沿青沙公路往九龍方向行駛，當駛至南灣隧道入口時，撞倒一名61歲隧道職員，他腿部嚴重受傷，昏迷被送往瑪嘉烈醫院治理，凌晨2時許證實死亡。運輸署初步調查顯示，事故現場所有工作人員均有穿着反光衣，並遵從承辦商制定的指引。

運輸署對營辦商員工工作期間離世深表難過，向家屬致以最深切慰問，已敦促承辦商盡力為家屬提供一切可行協助。

運輸署說，該名員工為配合隧道管道內慢線的故障車輛救援工作，在往九龍方向入口已封閉的慢線上執行交通管理。運輸署非常重視工作安全，一直嚴格要求營辦商遵守相關工作指引。

警方正調查事故原因，涉事司機涉嫌危險駕駛引致他人死亡被捕。運輸署已要求營辦商全面配合警方調查，並就事件提交詳細報告。署方會按報告結果作適當跟進。"
《九龍城寨光影之旅》周六開放展期三年,2025-05-23 18:44,,2025-05-23 19:00,local,rthk,https://news.rthk.hk/rthk/ch/component/k2/1805983-20250523.htm,"《九龍城寨光影之旅》電影場景展，在九龍寨城公園重構多個《九龍城寨之圍城》經典場景，今次新增入口處的傳統花牌、九龍城寨鐵牌坊、魚蛋工場和製膠廠等，展期三年，星期六起開放予公眾參觀。

政務司副司長卓永興表示，政府會繼續與電影業界合作，開發以電影為主題的旅遊項目，吸引更多旅客來港和推廣香港電影文化。"
New companies law brings right moves for growth,2025-05-23 18:43,,2025-05-23 19:00,efinance,rthk,https://news.rthk.hk/rthk/en/component/k2/1805988-20250523.htm,"Secretary for Financial Services and the Treasury Christopher Hui said on Friday that a new law allowing overseas firms to re-domicile to Hong Kong will inject new momentum into growth.

His comments came as the SAR started accepting applications from firms incorporated overseas to relocate to the city while maintaining their legal identity and business continuity.

The company re-domiciliation regime was passed by the Legislative Council on May 14 and took effect from Friday.

Previously, companies that wanted to move to the city were required to wind up existing operations and shift all assets and transactions to the Hong Kong entity. 

Under the new law, firms can move to the city while maintaining their legal identity and business continuity, which will help save on complex and costly legal procedures. 

Following the move, French insurance giant AXA's Hong Kong and Macau arm was among the first batch of firms applying for such relocation.

Hui said in a post on his official blog he is glad that some firms have already reported they are actively preparing to apply for a relocation to Hong Kong.

""The new law has opened up a convenient path for interested companies to relocate to Hong Kong, while ensuring the safety and stability of the relocation process,"" he said.

""The continuous uncertainties in the global political and economic situation and the development of international market regulations have made Hong Kong's advantages more prominent.

""Relocating to Hong Kong will help enterprises cope with adverse factors in the external business environment."" 

Such applications, according to Hui, shall be examined and approved within two weeks if all required documents and materials are submitted.

He added that authorities will also provide appropriate support to the firms, while communicating with offshore jurisdictions to facilitate relocations. 

Companies that are given approvals for the relocation will have a 120-day transitional period to complete the deregistration in its original place of incorporation."
港鐵將軍澳綫早上列車服務正常　政府要求港鐵就昨日事故交報告,2025-05-23 18:41,,2025-05-23 19:00,local,rthk,https://news.rthk.hk/rthk/ch/component/k2/1805982-20250523.htm,"港鐵將軍澳綫昨日傍晚一度全線暫停服務大約5小時，至晚上10時半全面恢復服務。港鐵指是因為有架空電欖組件移位同短路，運輸及物流局局長陳美寶表示，對港鐵接二連三發生事故極度關注，要求港鐵要就事件交報告。

至於今早將軍澳綫列車服務正常，有乘客指，雖然港鐵表示已經修復，但擔心有突發情況，特意提早15至20分鐘出門。"
外交部：反對將教育合作政治化　科大邀哈佛國際生轉校入讀　,2025-05-23 18:41,,2025-05-23 19:00,local,rthk,https://news.rthk.hk/rthk/ch/component/k2/1805985-20250523.htm,"中國留學生佔哈佛的外國學生約兩成，在北京，外交部發言人被問到，如何看得這些留學生需要轉校一事，發言人表示，反對將教育合作政治化，中方堅定維護海外中國學生及學者的正當合法權益。

在本港，科技大學公開邀請現正就讀美國哈佛大學的國際本科生和研究生，及已獲哈佛大學學位課程確認錄取的學生到科大繼續升學，校方將提供無條件取錄和學術支持，簡化入學程序，及提供簽證和住宿等支援。"
有本地升學顧問接獲哈佛大學就讀本港留學生家長求助,2025-05-23 18:39,,2025-05-23 18:45,local,rthk,https://news.rthk.hk/rthk/ch/component/k2/1805997-20250523.htm,"有本地升學顧問說，接獲正在哈佛大學就讀的本港留學生家長求助，擔心子女轉到其他院校，課程未能銜接，也憂慮畢業後難以尋找工作。

科技大學向正就讀哈佛大學的國際留學生發出公開邀請，校方將提供無條件錄取。

有立法會議員認為，本港資助大學應聯手吸引頂尖人才來港。"
韋爾半導體擬發行H股在港上市,2025-05-23 18:36,,2025-05-23 18:45,cfinance,rthk,https://news.rthk.hk/rthk/ch/component/k2/1805990-20250523.htm,"韋爾半導體表示，正籌劃發行H股並在香港上市，以加快公司國際化戰略及海外業務展，增強境外融資能力，提高綜合競爭力。

公司說，正積極與中介機構商討發行相關工作。"
香港電台多個報道及節目奪今屆紐約節共8個獎項,2025-05-23 18:33,,2025-05-23 18:45,local,rthk,https://news.rthk.hk/rthk/ch/component/k2/1805996-20250523.htm,"香港電台在今屆紐約節廣播大獎（New York Festivals Radio Awards）及紐約節電視電影大獎（New York Festivals TV & Film Awards)，共奪取8個獎項。

由港台電台部文教組製作的《月光書情》在「有聲書 — 單人敘述組別」獲得銀獎。《月光書情》選讀香港已故作家西西的經典作品《浮城誌異》，糅合輕音樂等多種聲音元素。

港台電視部憑以香港舞蹈家為主題的節目《 一舞一世界》獲「工藝節目組別— 最佳剪接」銅獎。

港台多個節目及報道亦在不同組別獲頒入圍獎。新聞部製作的《奪命工傷》系列報道在「社會公義報告組別」獲獎。電台部製作的兒童廣播劇《畢得鳥劇場 — 重陽網絡爭霸戰》則在「娛樂 — 兒童及青少年節目組別」奪獎。

電視節目方面，《香港故事 — 師傅來了2︰古籍重生》、《睇得見。聽得到 — 我是話題終結者，你還愛我嗎?》一集，以及短片《 擁抱人工智能》，分別在「娛樂節目 — 教育/教學組別」、「紀錄片— 人文關懷組別」、「企業形象組別 — 品牌形象」奪獎。節目《一舞一世界》亦有在「娛樂特輯 — 短片系列組別」獲獎。

紐約節廣播大獎及紐約節電視電影大獎由多個國家及地區的廣播從業員擔任評審，美國時間星期四晚在紐約舉行廣播大獎頒獎禮。"
Flood-control work 'allows HK to stay resilient',2025-05-23 18:26,,2025-05-23 18:45,elocal,rthk,https://news.rthk.hk/rthk/en/component/k2/1805986-20250523.htm,"The Development Bureau said on Friday that ongoing flood-mitigation  work across Hong Kong should enable the city to remain resilient in the face of serious floods and storm surges amid climate change.

At the end of last year, drainage and civil engineering officials completed separate studies on how the SAR can cope with problems in the long run, with projections made until the year 2100.

A bureau spokesperson said they determined that the current anti-flooding strategy is suitable for the coming decades, as officials carry out improvement works to the current infrastructure.

There are 25 ongoing projects that cost some HK$17.3 billion, such as the installation of wave protection walls, underground stormwater storage tanks and drainage tunnels.

Some of the tanks are near Shing Mun and Lam Tsuen Rivers in the New Territories, as well as in Kwun Tong, Tsim Sha Tsui and Wong Tai Sin.

They'll be completed in phases, starting from next year until 2030.

The bureau said the Civil Engineering and Development Department is also making advanced preparation plans for 11 coastal locations, including in Sai Wan Ho and Chai Wan.

The spots were identified based on the likelihood of disasters and consequences.

A spokesman stressed that following the historic downpour of September 2023 that saw 158 millimetres of rain within an hour, local flood-mitigation parameters have been updated.

""We are sure that the new designs can allow us to handle a greater amount of rain compared to what we saw during the historic black rainstorm,"" he said.

The spokesman added that the local anti-flooding system is comparable or better than those in other major cities on the mainland and overseas, such as Guangzhou, London and New York."
惠譽維持香港AA-信用評級　政府：肯定了香港強勁信貸基本面,2025-05-23 18:20,,2025-05-23 18:45,local,rthk,https://news.rthk.hk/rthk/ch/component/k2/1805995-20250523.htm,"評級機構惠譽發表報告，維持香港「AA-」的信用評級，以及「穩定」的評級展望。特區政府回應，惠譽肯定了香港強勁的信貸基本面，包括有龐大的財政緩衝空間、良好的對外金融狀況，以及政府債務水平依然處於低位等；同時亦指出，香港銀行體系具有相當的韌性，資本和流動性充裕。

政府發言人說，香港的金融體系保持穩健，銀行體系的總體資產質素按國際標準一直處於良好水平。銀行存款持續增長，截至今年3月底，本港銀行存款總額接近18萬億港元，同比增長11%。

數據充分顯示，環球投資者對香港的信心正在增強。新股市場相當暢旺，市場累計集資超過600億港元，香港交易所本周就迎來了今年以來全球最大型的首次公開招股活動。

發言人又說，特區政府財政情況保持穩健，在今個財政年度已經會大致平衡，並從下一財政年度起恢復盈餘。

特區政府又說，國際貿易摩擦近期稍為緩和，加上內地經濟在更積極的財政政策和適度寬鬆的貨幣政策支持下繼續穩步增長，有利於香港及區內的貿易表現。內地持續推進高水平雙向對外開放，加上大力推動綠色轉型、創新科技和數字經濟發展，將持續為香港帶來商業和投資機遇。"
中海外逾8.6億元中標市建局山東街/地士道街發展項目,2025-05-23 18:11,,2025-05-23 18:30,cfinance,rthk,https://news.rthk.hk/rthk/ch/component/k2/1805993-20250523.htm,"市建局公布，中國海外發展中標九龍山東街/地士道街發展計劃，中標金額約8.61億元。

項目上星期二截標，接獲6份標書。

項目可發展總樓面面積上限約16.1萬平方呎，住宅樓面可達15.2萬平方呎，預計提供約380個單位，另要提供約3.1萬平方呎樓面作為政府、機構及社區設施用途。

市場對項目估值約6.4億至9.3億元，每平方呎樓面地價約4000至5800元。"
習近平與德國總理默茨通電話　冀德方為中國企業提供公平營商環境,2025-05-23 18:07,,2025-05-23 19:15,greater_china,rthk,https://news.rthk.hk/rthk/ch/component/k2/1805994-20250523.htm,"國家主席習近平下午應約同德國總理默茨通電話。

習近平指出，中國視德國為夥伴，樂見德國發展繁榮，願意與德方密切高層交往，尊重彼此核心利益，鞏固兩國關係政治基礎。雙方既要繼續做大汽車、機械製造、化工等傳統領域合作存量，亦要培育人工智能、量子技術等前沿領域合作增量，加強在氣候變化、綠色發展等領域交流合作。

習近平又說，雙方要增添合作動能，中方願意與德方分享高水平對外開放帶來的發展機遇，希望德方為兩國雙向投資合作，提供更多政策支援和便利，為中國企業提供公平、透明、非歧視的營商環境。

新華社報道，默茨表示德中關係發展良好，合作深入、成果豐碩，在當前國際形勢下，作為世界兩大主要經濟體，德中合作尤其具有重要意義。"
國家主席習近平應約與德國總理默茨通電話,2025-05-23 18:07,,2025-05-23 18:15,greater_china,rthk,https://news.rthk.hk/rthk/ch/component/k2/1805994-20250523.htm,國家主席習近平下午應約同德國總理默茨通電話。
民政事務總署開放19間臨時避暑中心,2025-05-23 18:02,,2025-05-23 18:15,local,rthk,https://news.rthk.hk/rthk/ch/component/k2/1805992-20250523.htm,"民政事務總署繼續開放19間社區會堂和社區中心作臨時避暑中心。
 
臨時避暑中心會在酷熱天氣警告生效期間全日開放予市民避暑。在晩上10時半至翌晨8時，臨時避暑中心亦供應被鋪及睡覺的地方予有需要人士。中心內有人員當值。"
蔡若蓮：已聯繫哈佛大學香港校友會　為獲錄取赴哈佛學生提供支援,2025-05-23 18:00,,2025-05-23 18:15,local,rthk,https://news.rthk.hk/rthk/ch/component/k2/1805991-20250523.htm,"美國政府宣布禁止哈佛大學招收國際學生。教育局局長蔡若蓮表示，已聯繫哈佛大學香港校友會，為獲錄取赴哈佛大學升學的同學提供全面支援。

蔡若蓮在社交網站說，已呼籲全港所有大學，為合資格者提供便利措施，維護學生和學者的正當合法權益，按多元招生及人才政策，吸引頂尖人才。 

蔡若蓮又指，本港各大學均積極回應及密切留意情況，充份善用政府支持本地專上院校擴容提質的便利措施，包括已放寬的非本地學生上限，吸引全球優秀學子來港升學，進一步打造「留學香港」品牌。"
30 evacuated after Central Government Offices fire,2025-05-23 17:59,,2025-05-23 19:15,elocal,rthk,https://news.rthk.hk/rthk/en/component/k2/1805984-20250523.htm,"Around 30 people were evacuated from the Central Government Offices in Tamar on Friday following a fire. 

Police received reports at around 12.15 pm that a computer had caught fire at the West Wing and firefighters were dispatched.

Faulty cables are suspected to have sparked the blaze.

Online footage showed flames and smoke billowing behind a computer screen, next to a landline telephone, and staff leaving the scene. 

No casualties have been reported so far."
