title,date,summary,scrape_time,section,source,url,news_content
澤連斯基稱烏克蘭獲安全保障後可考慮於頓涅茨克設立自由經濟區,2025-12-25 01:31,,2025-12-25 01:45,cinternational,rthk,https://news.rthk.hk/rthk/ch/component/k2/1837441-20251225.htm,"烏克蘭總統澤連斯基表示，在烏克蘭獲得安全保障後，可以考慮在頓涅茨克地區設立自由經濟區。

澤連斯基會見記者時說，如果作出設立自由經濟區的決定，烏克蘭、美國及俄羅斯將另行簽署一項協議，以確定該經濟區的具體地位、規定戰事雙方於對等基礎上撤出各自部隊的措施等。

主要由頓涅茨克及盧甘斯克組成、位於烏克蘭東部的頓巴斯，一直是俄羅斯與烏克蘭激烈爭奪控制權的地區。

另外，澤連斯基說旨在結束俄烏戰事的和平計劃草案，並未規定美國要解除對俄羅斯的制裁，但烏方認為美國計劃在戰事結束後，逐步解除對俄制裁。"
人民日報文章指日本一些人違背國際共識　對戰後秩序構成嚴峻挑戰,2025-12-25 00:54,,2025-12-25 01:15,greater_china,rthk,https://news.rthk.hk/rthk/ch/component/k2/1837440-20251225.htm,"人民日報發表文章，指出在中國人民抗日戰爭暨世界反法西斯戰爭勝利80周年的特殊年份，作為二戰戰敗國的日本，本應深刻反省軍國主義犯下的戰爭罪行，然而日本一些人及勢力不單止變本加厲對侵略罪惡進行掩蓋、美化及翻案，甚至妄圖推動軍國主義借屍還魂，這種與國際社會歷史認知背道而馳的錯誤行徑，嚴重違背國際共識與人類良知，嚴重危害地區和世界和平穩定，對戰後國際秩序構成嚴峻挑戰。

文章又指如果日本首相高市早苗的言行得不到糾正，將為其他國家樹立惡劣先例，一些勢力或將跟風效倣，挑戰既定國際規則及秩序。這樣不單止侵蝕國際治理的根基，更可能對全球的主權平等、不干涉內政等國際關係基本準則造成衝擊，影響更廣泛地區的和平穩定。"
歐盟委員會強烈譴責美國對幾名歐洲人士實施旅行限制　或有反制,2025-12-25 00:40,,2025-12-25 00:45,cinternational,rthk,https://news.rthk.hk/rthk/ch/component/k2/1837439-20251225.htm,"歐盟委員會強烈譴責美國決定對包括歐盟委員會前委員佈雷東在內的5名歐洲人士實施旅行限制，可能將採取反制措施。發言人接受新華社訪問時說，歐方已要求美方澄清，並將繼續保持溝通，如有需要歐方將迅速並堅決回應，捍衛監管自主權，反制不合理措施。

歐盟委員會執行副主席塞茹爾內在社交媒體上表示，美國的制裁不會讓歐洲沉默，佈雷東始終以歐洲公共利益為出發點行事，任何制裁都無法讓歐洲各國人民沉默。塞茹爾內對佈雷東及所有受影響的歐洲人表示完全聲援及團結。法國總統馬克龍就在社交媒體上說，法國譴責美方有關簽證限制，形容等同於恐嚇與脅迫，旨在破壞歐洲數碼主權。

美國國務院較早時發公告，禁止佈雷東進入美國。佈雷東於2019年開始擔任歐盟委員會負責內部市場的委員，2024年9月辭職。輿論認為美國有關措施可能與美國及歐盟在數碼監管等領域的摩擦有關。"
塞內加爾西部附近海域有移民船翻側逾十人遇難　載客人數仍未確定,2025-12-25 00:17,,2025-12-25 00:30,cinternational,rthk,https://news.rthk.hk/rthk/ch/component/k2/1837438-20251225.htm,"一艘移民船於當地星期三凌晨在塞內加爾西部姆布爾省附近海域翻側，目前找到12具遇難者遺體。

塞內加爾通訊社引述安全部門消息報道，憲兵在事發後趕赴現場一帶海域實施管控，發現35名倖存者，相關人員正配合事故調查工作。

涉事船隻實際載客人數仍未確定，事故具體原因還在調查中。"
市民平安夜外出慶祝  多個地點有「飄雪」匯演,2025-12-25 00:09,,2025-12-25 00:15,local,rthk,https://news.rthk.hk/rthk/ch/component/k2/1837437-20251225.htm,"不少市民平安夜外出慶祝。在西九文化區的聖誕小鎮，入夜後人頭湧湧，另一邊的海濱西草坪，化身「西九聖誕森林」，有超過60棵聖誕樹，包括一棵超過12米高的巨型聖誕樹，並有「飄雪」體驗，亦可以與聖誕老人合照。

在灣仔利東街亦滿布聖誕裝飾，有音樂燈光及「飄雪」匯演，不少市民打卡留念。"
澤連斯基公布最新版俄烏和平計劃草案　稱大程度反映烏美共同立場,2025-12-24 23:51,,2025-12-25 00:15,cinternational,rthk,https://news.rthk.hk/rthk/ch/component/k2/1837435-20251224.htm,"烏克蘭總統澤連斯基公布最新版俄烏和平計劃草案的20點內容，強調該文件仍然是草案，當中條款可能在談判過程中有所修改。

新華社引述烏克蘭通訊社報道，澤連斯基在傳媒簡報會上說這份文件被稱為框架文件，很大程度上反映烏克蘭與美國的共同立場，部分反映了美方立場，但仍有一些問題需要解決，不過在最終敲定文件方面已取得顯著進展。

他介紹草案內容，當中包括烏克蘭主權將得到重申；為維持俄烏長期和平，將建立接觸線監督機制；烏克蘭武裝部隊在和平時期的規模將保持在80萬人；美國、北約及歐洲將向烏克蘭提供類似北約第五條集體防禦條款的保障；俄羅斯將不侵略歐洲及烏克蘭的政策寫入所有必要的文件中；烏克蘭成為歐盟成員國，並有入盟明確時間框架等。"
男子涉透過社交媒體發表反猶主義言論於澳洲珀斯被捕,2025-12-24 23:43,,2025-12-25 00:00,cinternational,rthk,https://news.rthk.hk/rthk/ch/component/k2/1837434-20251224.htm,"澳洲警方在西澳大利亞州首府珀斯拘捕一名男子，他涉嫌透過社交媒體發表反猶主義言論。

警方在聲明中指涉案男子39歲，在家中被捕。他有合法持槍許可，並擁有數支登記在冊的槍支及一定數量彈藥，這些物品已被警方查扣。警方將對他的持槍許可進行資格審查。

警方提出三項指控，包括意圖進行種族騷擾行為、攜帶或持有違禁武器，以及未按規定存放槍支或相關物品。"
特區政府不滿和反對個別所謂人權專家對「黎智英案」不實批評,2025-12-24 22:57,,2025-12-24 23:15,local,rthk,https://news.rthk.hk/rthk/ch/component/k2/1837433-20251224.htm,"特區政府對個別所謂人權專家就黎智英被控危害國家安全罪行及特區法庭嚴格依照法律和證據作出定罪判決作出的不實批評，表示強烈不滿和反對。

特區政府發言人指出，留意到有個別所謂人權專家，根本沒有尊重特區法庭基於事實和證據就案件所作的獨立審判，拒絕正視裁決理由羅列的各項證據，並拒絕理解法庭的考慮和裁決理由，就肆意發動攻擊，污衊和攻擊特區政府，及以卑劣的政治操弄，不斷渲染黎智英應立即獲釋，批評他們完全是以政治凌駕法治，顛倒是非，其干預法庭判刑的卑劣用心昭然若揭，必須嚴厲直斥其非，以正視聽。發言人指，法庭在裁決理由中清楚表明，黎智英並非因其政治觀點或信念受審。法庭的定罪裁決有理有節，充分展現法庭嚴格依照法律和證據作出裁決，不受任何干涉，更絕無任何政治考慮。

發言人指出，所謂人權專家又將「黎智英案」的犯罪行為與言論和新聞自由混為一談，目的是混淆視聽，污衊香港特區，事實是「黎智英案」與言論和新聞自由完全無關，各被告多年來只是利用新聞報道為幌子，行禍國害港之實。

發言人重申，特區政府將繼續堅定不移全面準確實施《香港國安法》、《維護國家安全條例》及香港特區其他維護國家安全的相關法律，依法有效防範、制止和懲治危害國家安全的行為和活動，同時依法保障香港市民的權利和自由，確保「一國兩制」實踐行穩致遠。特區政府促請有關所謂人權專家認清事實，停止作出任何毫無根據的批評。"
台東縣地震有中學玻璃及水管破裂　台東監獄圍牆裂無人逃獄或受傷,2025-12-24 22:49,,2025-12-24 23:00,greater_china,rthk,https://news.rthk.hk/rthk/ch/component/k2/1837432-20251224.htm,"台灣台東縣下午發生黎克特制6.1級地震。縣消防局表示，截至晚上7時未有接獲人員傷亡通報。

地震發生時正值用餐時段，很多人衝出家門躲避。台東有特賣場的物品散滿一地。台東市一間中學的多處建築有天花掉落，玻璃與水管破裂，無人受傷。台東監獄圍牆龜裂，獄方指已第一時間全面巡查，無任何在囚人士逃獄或受傷，家屬、社會及大眾可以安心。

台鐵公布，一度受變電站跳電影響而暫停服務的關山至台東之間列車，晚上7時30分完成路線及電車線巡查，確認安全，恢復正常行車；台東至金崙之間仍在持續巡查。新華社報道，根據中國地震台網正式測定，台東縣的地震為5.8級，震源深度為10公里。"
美股半日市　3大指數初段變動不大,2025-12-24 22:47,,2025-12-24 23:00,cfinance,rthk,https://news.rthk.hk/rthk/ch/component/k2/1837431-20251224.htm,"美股在平安夜半日市，3大指數初段變動不大。

道瓊斯指數較早時報48520點，升77點，升幅0.16%。

標普500指數報6912點，升3點，升幅0.04%。

納斯達克指數報23537點，跌24點，跌幅0.11%。"
One more arrest over Wang Fuk Court inferno,2025-12-24 22:44,,2025-12-24 23:00,elocal,rthk,https://news.rthk.hk/rthk/en/component/k2/1837430-20251224.htm,"The police said on Wednesday one more person has been arrested on suspicion of manslaughter in connection with last month's Wang Fuk Court fire in Tai Po that killed 161 people. 

In a statement, officers said the 48-year-old suspect was the person-in-charge of the external wall repair subcontractor. 

He has been released on bail. 

Earlier, police arrested 15 people on suspicion of manslaughter over the deadly blaze. All of them have been freed on bail.

The Regional Crime Unit of New Territories North is investigating the case."
平安夜不少市民到西九文化區聖誕小鎮　有旅客訪港感受節日氣氛,2025-12-24 22:42,,2025-12-24 23:00,local,rthk,https://news.rthk.hk/rthk/ch/component/k2/1837429-20251224.htm,"不少市民在平安夜外出慶祝，其中西九文化區的聖誕小鎮人頭湧湧，有市民帶同寵物打卡留念。有旅客表示會留港一星期，到不同地點感受節日氣氛。

另外，蘭桂坊協會總監張素媚預計，酒吧及餐廳整體氣氛及生意都能達到預期。"
宏福苑五級火｜警方再拘一男涉誤殺　為外牆工程分判商負責人,2025-12-24 22:33,,2025-12-24 23:00,local,rthk,https://news.rthk.hk/rthk/ch/component/k2/1837428-20251224.htm,"警方就大埔宏福苑五級火，再拘捕一名48歲男子，涉嫌誤殺，他是相關外牆工程分判商負責人。案件至今有15男1女涉嫌誤殺被補，年齡介乎40至77歲。

警方表示，今日在天水圍拘捕該名涉案男子，他已獲准保釋候查。新界北總區重案組繼續積極調查案件。"
FSD aims to boost fire safety at commercial buildings,2025-12-24 22:17,,2025-12-24 23:00,elocal,rthk,https://news.rthk.hk/rthk/en/component/k2/1837427-20251224.htm,"The Fire Services Department said nearly half of the city's commercial buildings it inspected in the past two days might have failed to examine their fire service installation or equipment every year.

Officers said they conducted a territory-wide special fire safety inspection and enforcement operation covering 132 commercial buildings deemed to have higher fire risks, in the wake of the deadly Wang Fuk Court blaze in Tai Po. They believed more people would visit commercial buildings with many licensed premises such as restaurants during the holiday season.

The department said 57, or 43 percent, of the buildings were suspected of lacking annual inspections for fire service installation or equipment, and that it will follow up on the matter.

Officers also said 376 Fire Hazard Abatement Notices were issued against, for example, smoke stop doors being wedged open and means of escape being obstructed or locked, and 53 prosecutions were initiated.

The Fire Services Department said fire prevention publicity and education were carried out during the operation to raise awareness among property owners and the public. 

The department added that it will boost communication with the Property Management Services Authority, the Association of Property Management Companies and other relevant stakeholders to further strengthen fire safety management at commercial buildings."
FSD aims to boost safety at commercial buildings,2025-12-24 22:17,,2025-12-24 22:30,elocal,rthk,https://news.rthk.hk/rthk/en/component/k2/1837427-20251224.htm,"The Fire Services Department said nearly half of the city's commercial buildings it inspected in the past two days might have failed to examine their fire service installation or equipment every year.

Officers conducted a territory-wide special fire safety inspection and enforcement operation covering 132 commercial buildings deemed to have higher fire risks, in the wake of the Wang Fuk Court in Tai Po. They also believe more people would visit commercial buildings with many licensed premises such as restaurants during the holiday season.

The department said 57, or 43 percent of the buildings, were suspected of lacking annual inspections for fire service installation or equipment, and that it will follow up on the matter.

Officers also said 376 Fire Hazard Abatement Notices were issued against, for example, smoke stop doors being wedged open and means of escape being obstructed or locked, and 53 prosecutions were initiated.

The Fire Services Department said fire prevention publicity and education were carried out during the operation to raise awareness among property owners and the public. 

The department added that it will boost communication with the Property Management Services Authority, the Association of Property Management Companies and other relevant stakeholders to further strengthen fire safety management at commercial buildings."
美國上星期新申領失業救濟人數出乎意料減至21.4萬人,2025-12-24 21:47,,2025-12-24 22:00,cfinance,rthk,https://news.rthk.hk/rthk/ch/component/k2/1837423-20251224.htm,"美國上星期新申領失業救濟人數21.4萬人，按星期減少1萬人，市場原先估計維持於22.4萬人。

4星期平均值約21.7萬人，按星期減少750人。

截至12月13日止，該星期持續申領失業救濟人數192.3萬人，多於預期，按星期增加3.8萬人。

分析認為，招聘仍較疲弱，12月失業率可能仍高企，又指假期臨近，失業救濟申請人數波動可能較大，就業市場可能仍處於「不請人，亦不裁員」的局面。"
大灣區航空電郵包含3百多客戶電郵地址　公司致歉並通報私隱公署,2025-12-24 21:47,,2025-12-24 22:00,local,rthk,https://news.rthk.hk/rthk/ch/component/k2/1837425-20251224.htm,"大灣區航空於昨日向376名在早前推廣活動中獲贈50港元優惠的客戶，透過電子郵件發送優惠碼及相關資訊，由於負責發送電郵的員工誤將客戶的電郵地址，填入收件者一欄，而非密件副本（Bcc）一欄，以致他們所收到的郵件包含了其他客戶的電郵地址。

大灣區航空表示十分關注事件，並向受影響客戶衷心致歉，公司在發現事件後，已於今日將事件通報個人資料私隱專員公署，並發信向相關客戶致歉，以及按公署的指引，建議他們將該電郵刪除。事件並不涉及客戶的其他個人資料。

大灣區航空又說，已就發送電郵的流程加強覆核程序，以避免同類事件再次發生。"
日本長崎四個核爆受害者團體抗議首相官邸人士擁核言論,2025-12-24 21:46,,2025-12-24 22:00,cinternational,rthk,https://news.rthk.hk/rthk/ch/component/k2/1837424-20251224.htm,"日本長崎四個核爆受害者團體代表在長崎市召開記者會，抗議首相官邸人士主張擁有核武器的言論，呼籲堅持「無核三原則」，轉變依賴核嚇阻的安全保障政策。

團體發表聲明說，核爆受害者不允許這種踐踏他們自艱難時代走過來80年的言論，質疑有關言論是否不會令日本成為被世界疏遠的國家，認為首相高市早苗應親自明確否認擁核，強調絕不能允許日本成為核加害國，又說要遏止這股趨勢，國民的團結很重要，也要將和平運動傳承給不曾經歷戰爭的人。

共同社報道，記者會現場陳列了在原子彈爆炸中遇難者的照片，並懸掛了寫有「不要再有核爆受害者」的橫幅。"
諾和工程疑偽造儀器校正證書　據了解警方多拘6人至今共9人被捕,2025-12-24 21:35,,2025-12-24 21:45,local,rthk,https://news.rthk.hk/rthk/ch/component/k2/1837422-20251224.htm, 
韓國特檢組以涉嫌違反政治資金法等罪起訴尹錫悅,2025-12-24 21:21,,2025-12-24 21:45,cinternational,rthk,https://news.rthk.hk/rthk/ch/component/k2/1837421-20251224.htm,"負責調查韓國前第一夫人金建希案件的特檢組，以涉嫌違反政治資金法等罪名，對前總統尹錫悅及政治中介人明泰均，提出起訴。

特檢組認為尹錫悅與金建希涉嫌合謀，自2021年6月至2022年3月從明泰均無償接受共58次、總值約2億7千萬韓元的民意調查服務。作為回報，尹錫悅夫婦幫助國民力量黨前議員金映宣在2022年國會議員補選中，獲得該黨的候選人推薦。明泰均就涉嫌提供非法民調被起訴。

尹錫悅夫婦亦涉嫌接受一間建築公司的會長李鳳官、前國家教育委員會委員長李培鎔等多人的人事請托，並收受昂貴珠寶等財物作為回報。韓聯社報道，今次是去年12月3日緊急戒嚴事件後，尹錫悅第七次被起訴。"
據測算內地上月美元計價對外非金融類ODI按年轉跌兩成,2025-12-24 21:13,,2025-12-24 21:30,cfinance,rthk,https://news.rthk.hk/rthk/ch/component/k2/1837420-20251224.htm,"商務部數據顯示，內地今年首11個月對外非金融類直接投資(ODI)規模9446.4億元人民幣，按年增長3.2%；以美元計1320.9億美元，按年增長2.7%。

外電根據商務部數據計算，11月對外非金融類ODI規模101.9億美元，創9個月新低，按月減少8.7%，按年跌20.4%，結束4個月升勢，並創3年來最大按年跌幅。

另外，首11個月中國全行業對外直接投資逾1.13萬億元人民幣，按年升7.5%；以美元計1582.1億美元，增長6.9%。"
人行季度會議：發揮增量及存量政策集成效應　關注長期收益率變化,2025-12-24 21:10,,2025-12-24 21:30,cfinance,rthk,https://news.rthk.hk/rthk/ch/component/k2/1837418-20251224.htm,"人民銀行近日召開季度例會，建議發揮增量政策及存量政策的集成效應，綜合運用多種工具，加強貨幣政策調控，從宏觀審慎角度觀察、評估債市運行情況，關注長期收益率變化。

人行刊登會議內容指，要根據國內外經濟金融形勢及金融市場運行情況，把握好政策實施的力度、節奏及時機，增強宏觀政策前瞻性、針對性、協同性，著力擴大內需、優化供給、做優增量、盤活存量。

會議指出，增強外匯市場韌性，穩定市場預期，防範匯率超調風險，保持人民幣匯率在合理均衡水平上基本穩定。有效落實好各類結構性貨幣政策工具，用好證券、基金、保險公司互換便利及股票回購增持再貸款，探索常態化制度安排，維護資本市場穩定。

會議亦強調，要繼續實施適度寬鬆貨幣政策，加大逆周期及跨周期調節力度；保持流動性充裕，令社會融資規模、貨幣供應量增長與經濟增長、價格總水平預期目標相匹配，促進社會綜合融資成本低位運行。"
全國人大委員長會議下午舉行　聽取草案和議案審議情況匯報,2025-12-24 21:01,,2025-12-24 21:15,greater_china,rthk,https://news.rthk.hk/rthk/ch/component/k2/1837419-20251224.htm,"全國人大委員長會議下午在北京人民大會堂舉行。

新華社報道，會議聽取人大秘書長劉奇匯報關於召開十四屆全國人大四次會議的決定草案審議情況，關於個別代表的代表資格的報告、中央軍事委員會關於提請審議批准增補解放軍選舉委員會組成人員的議案和任免案審議情況等，審議相關決定草案修改稿等。

會議亦聽取人大副秘書長劉俊臣匯報新增人事任免事項。委員長會議決定，將上述議案代擬稿、草案修改稿等提交人大常委會會議審議。"
澤連斯基稱烏克蘭不放棄加入北約　冀有加入歐盟具體時間,2025-12-24 20:54,,2025-12-24 21:15,cinternational,rthk,https://news.rthk.hk/rthk/ch/component/k2/1837417-20251224.htm,"烏克蘭總統澤連斯基表示，烏克蘭不同意新版20點和平計劃中提出、要求烏克蘭放棄加入北約的要求，強調烏方不會放棄加入北約。

澤連斯基在首都基輔會見記者時指出，結束俄烏戰事的協議是美國、烏克蘭、歐洲及俄羅斯之間的協議，而是否讓烏克蘭加入北約就是北約成員國需要作出的選擇。

他又說，烏克蘭與美國討論了烏克蘭加入歐盟的具體時間，但這個時間未得到歐盟確認，烏方希望能有一個加入歐盟的具體時間，這樣才是真正給予烏克蘭安全保障，美方應支持這一點。"
消防處就132幢商廈展開巡查與執法行動　提出53宗檢控,2025-12-24 20:45,,2025-12-24 21:00,local,rthk,https://news.rthk.hk/rthk/ch/component/k2/1837416-20251224.htm,"消防處昨日起一連兩日，針對全港有較高火警風險的商業大廈展開特別消防安全巡查與執法行動，以確保公眾安全。

由於預期聖誕假期時，設有較多持牌處所的商業大廈的人流將顯著上升，消防處在全港揀選共132幢此類商業大廈，就各類火警危險共發出376張「消除火警危險通知書」，並提出53宗檢控。而就其中57幢懷疑未有為大廈消防裝置或設備進行年檢的商業大廈，消防處已嚴肅跟進，並會就違規情況採取執法行動。

另外，消防處將與物業管理業監管局、香港物業管理公司協會有限公司及其他相關持份者加強溝通，以引入具針對性的監管與宣傳措施。相關協作旨在強化政府與業界的協作機制，確保大廈內消防設施維持良好運作狀態，同時鼓勵業主、租戶及物業管理方妥善做好大廈管理，避免出現火警危險。"
北京再度放鬆樓市政策　放寬限購及優化信貸,2025-12-24 20:22,,2025-12-24 20:45,cfinance,rthk,https://news.rthk.hk/rthk/ch/component/k2/1837412-20251224.htm,"北京繼今年8月，再度放鬆樓市政策，是中央經濟工作會議、全國住房城鄉建設工作會議後，首個優化樓市措施的一線城市。

今次措施包括放寬限購、優化信貸、加大公積金支持住房消費力度；調整二套房公積金貸款最低首付比例，由30%降至25%。

非北京籍家庭購買五環內商品房的社保或個人所得稅繳納年限，由現時的3年減至兩年；購買五環外商品房的，繳納年限亦由兩年減至一年。

兩孩及以上的多子女家庭，可於五環內多購買一套商品房，意味著總共可購買3套商品房；在北京連續兩年繳納社保或個人所得稅的非北京籍多子女家庭，可於五環內買二套商品房。

分析認為，措施有助釋放市場需求，有利成交價量回穩，減緩對經濟的拖累，但亦不排除有進一步放鬆。亦有分析指，單靠地方政府難以有效管理預期，中央降低按揭利率，可能有助穩定樓價。"
感染麻疹7個月大男嬰母親同樣確診　正隔離治療情況穩定,2025-12-24 20:21,,2025-12-24 20:45,local,rthk,https://news.rthk.hk/rthk/ch/component/k2/1837415-20251224.htm,"衞生防護中心正調查一宗由外地傳入的麻疹個案，病人是昨日公布一宗外地傳入個案的母親。

最新個案涉及一名22歲女病人，上星期四起出現發燒，但沒有其他病徵，她亦沒有求診。由於她7個月大的兒子經檢測後證實對麻疹病毒核酸檢測呈陽性反應，中心在個案追蹤和流行病學調查時發現女病人出現病徵，之後安排她入院檢測。

病人臨床樣本經檢測後證實亦對麻疹病毒核酸檢測呈陽性反應，正在瑪嘉烈醫院接受隔離治療，現時情況穩定。她於10月1日至上星期二逗留在外地，整個潛伏期都不在香港，因此列為外地輸入個案，流行病學調查顯示，她不曾接種麻疹疫苗。

由於有關兩名有流行病學關連的病人曾於上星期五到過一間私家診所，中心已聯絡同一時段到訪該診所的接觸者，以找出是否涉及高危人士，並評估他們對麻疹是否具備免疫力，及安排未具備免疫力的接觸者接種疫苗，暫時沒有發現接觸者中有孕婦、免疫力弱或1歲以下嬰兒，亦沒有接觸者出現麻疹病徵。"
