title,date,summary,scrape_time,section,source,url,news_content
港銀向金管局貼現窗借取14億港元　近兩星期以來首次,2025-09-02 09:42,,2025-09-02 10:00,cfinance,rthk,https://news.rthk.hk/rthk/ch/component/k2/1820816-20250902.htm,"金管局數據指，本地銀行昨日向貼現窗借取14億港元，是近兩星期以來首次，亦是近兩個月以來最大操作規模。

港元隔夜拆息昨日急升約65個基點，升至4.647厘，創今年新高，連升5個交易日。

港元匯價近期偏強，較早時徘徊7.8兌1美元關口附近。"
《環看天下》：習近平倡盡快建成上海合作組織開發銀行,2025-09-02 09:41,,2025-09-02 10:00,greater_china,rthk,https://news.rthk.hk/rthk/ch/component/k2/1820817-20250902.htm,"國家主席習近平昨日在天津主持上海合作組織成員國元首理事會第二十五次會議，並發表主旨講話。習近平表示，當前，上海合作組織已經成長為26國參與、在50多個領域開展合作、經濟總量接近30萬億美元的世界最大區域組織，國際影響力和感召力日益增強。

習近平強調，展望未來，世界動蕩變革，組織仍須遵循「上海精神」，腳踏實地砥礪奮進；堅持務實高效，包括盡快建成上海合作組織開發銀行，為成員國安全和經濟合作提供更有力支撐。"
內地股市初段上升,2025-09-02 09:35,,2025-09-02 10:00,cfinance,rthk,https://news.rthk.hk/rthk/ch/component/k2/1820815-20250902.htm,"內地股市初段向上。

上證指數較早時報3877點，升2點，升幅0.06%。

深證成份指數報12838點，升8點，升幅0.07%。

創業板指數報2973點，升16點，升幅0.57%。"
人行逆回購2557億元人民幣　連續兩日淨回籠,2025-09-02 09:32,,2025-09-02 10:00,cfinance,rthk,https://news.rthk.hk/rthk/ch/component/k2/1820814-20250902.htm,"人民銀行公開市場開展2557億元人民幣7天期逆回購操作，利率維持1.4厘。

對沖到期量後，單日淨回籠1501億元，連續兩日淨回籠。"
港股競價時段回吐29點　奧克斯電氣掛牌低開約8%,2025-09-02 09:24,,2025-09-02 09:45,cfinance,rthk,https://news.rthk.hk/rthk/ch/component/k2/1820812-20250902.htm,"港股回落，但開市跌幅有限。恒生指數競價時段報25587點，跌29點，跌幅0.11%。

科技指數報5792點，跌6點，跌幅0.11%。

內地冷氣機製造商奧克斯電氣首日主板掛牌，開市報16.1元，跌約8%。"
人民幣中間價跌17點子　連跌兩日,2025-09-02 09:23,,2025-09-02 09:45,cfinance,rthk,https://news.rthk.hk/rthk/ch/component/k2/1820811-20250902.htm,人民幣中間價報7.1089，比昨日中間價跌17點子，連續兩日向下。
台股初段升約0.7%,2025-09-02 09:12,,2025-09-02 09:30,cfinance,rthk,https://news.rthk.hk/rthk/ch/component/k2/1820810-20250902.htm,台灣股市初段造好，加權指數較早時報24234點，升162點，升幅0.68%。
南韓8月通脹率放緩至1.7%　創9個月新低,2025-09-02 09:09,,2025-09-02 09:15,cfinance,rthk,https://news.rthk.hk/rthk/ch/component/k2/1820808-20250902.htm,"南韓8月消費價格指數(CPI)按年升幅放緩至1.7%，創9個月新低，比7月放緩0.4個百分點，放緩程度超出市場預期。

通脹顯著回落，受到通訊資費下調的一次過因素影響。上月通訊價格跌13.3%，由於當地最大移動通訊服務商SK Telecom在數據洩露事件後，為全數2400萬名用戶提供大額優惠。

撇除波動較大的食品及能源價格後，核心CPI按年升1.3%，放緩0.7個百分點，是4年來最慢增速。"
捷克前總理參加競選活動時遇襲　送院檢查後已出院,2025-09-02 08:51,,2025-09-02 09:15,cinternational,rthk,https://news.rthk.hk/rthk/ch/component/k2/1820809-20250902.htm,"捷克下月舉行國會眾議院選舉，前總理巴比什在東部多布拉參加競選活動時遇襲，被一名男子以拐杖打中頭部，巴比什之後被送院接受檢查，已經出院。

巴比什當地星期一晚在社交平台表示，檢查結果需進一步評估，醫生建議他休息，因此決定取消星期二的競選行程。

警方事後拘捕疑犯，事件中還有一名女子受傷。總理菲亞拉和內政部長拉庫尚譴責襲擊。拉庫尚強調，任何形式的暴力都不可接受。"
海南擬本月在港發行不多於50億元離岸人民幣地方債,2025-09-02 08:28,,2025-09-02 08:45,greater_china,rthk,https://news.rthk.hk/rthk/ch/component/k2/1820806-20250902.htm,"海南省政府計劃本月擇機在香港發行不超過50億元離岸人民幣地方政府債券，是海南連續4年在港發債。

海南省財政廳在微信公眾號公布，今次發債期限包括3、5、10年期，其中3年期為可持續發展債券，5年期為藍色債券，10年期為航天主題債券，為國際投資者提供更多人民幣資產配置選擇。

債券將於聯交所掛牌上市，發債募集資金主要投向海洋保護、民生保障及航天領域相關重點科研及基礎設施項目。"
10個公共運輸設施前日列為指定禁煙區　控煙酒辦發1張告票,2025-09-02 08:24,,2025-09-02 08:45,local,rthk,https://news.rthk.hk/rthk/ch/component/k2/1820807-20250902.htm,"政府於上月31日起，新增10個公共運輸設施為指定禁煙區，衞生署控煙酒辦公室主任林民聰接受訪問時表示，新增禁煙區範圍當日，當局共進行了10次巡查，發出1張定額罰款通知書。對於有煙民反映於灣仔會展站公共運輸交匯處，告示不夠清晰，林民聰說在法例生效前，當局已做了很多宣傳工作，現場有充足指示和警告的標語 ，使用人士應該很容易知道那個地方是指定禁煙區，巡查當日市民亦清楚知道禁煙區位置。

林民聰又說，執法行動最主要目的是希望提高公眾對相關法例的關注和認識，並不是要訂立一些硬指標去檢控多少人，又重申控煙酒辦只會在發現有實際違法情況下，才會執法。

控煙辦由上星期一起，一連6日在全港公共運輸設施法定禁煙區採執法行動，加強打擊違例吸煙行為。行動進行270次巡查，發出45張定額罰款通知書，林民聰表示，行動成功引起公眾關注和提高市民對於禁煙措施的認知及守法意識，認為已達到一定成效。

他又提到本港吸煙率雖然已經降至9.1%，屬全世界最低吸煙率的地方之一，但根據統計，本港仍然有超過57萬人每天都吸煙。如果他們繼續吸煙，當中有半數人很大機會會被煙草引致的疾病奪去性命，因此政府未來會繼續進行不同的宣傳和推廣，鼓勵煙民戒煙。"
韓股初段升0.6%,2025-09-02 08:20,,2025-09-02 08:30,cfinance,rthk,https://news.rthk.hk/rthk/ch/component/k2/1820804-20250902.htm,南韓股市早段向上，首爾綜合指數較早時報3161點，升18點，升幅0.6%。
日股初段曾升近200點　其後升幅收窄,2025-09-02 08:19,,2025-09-02 08:30,cfinance,rthk,https://news.rthk.hk/rthk/ch/component/k2/1820803-20250902.htm,日股初段靠穩，日經指數開市後曾升195點，高見42384點，其後升幅收窄，較早時報42284點，升95點，升幅0.23%。
李家超出發前往北京　參加抗戰勝利80周年紀念活動,2025-09-02 08:19,,2025-09-02 08:30,local,rthk,https://news.rthk.hk/rthk/ch/component/k2/1820805-20250902.htm,"行政長官李家超早上出發前往北京，他將率領由香港各界人士組成的代表團，參加明日舉行的中國人民抗日戰爭暨世界反法西斯戰爭勝利80周年紀念活動，包括明日上午的紀念大會和閱兵，以及文藝晚會。李家超亦會出席大會在中午舉行的招待會。

香港特區代表團共約360人，包括政府主要官員，來自司法機構、立法會和區議會的代表，參與抗戰愛國人士、老戰士及其遺屬，以及來自地區、商界及中資企業、教育、創科、專業服務、社福、傳媒、宗教、文化、出版、藝術及體育界、青年、學生和市民等不同社會界別人士。

李家超將於星期四返港。"
抗戰勝利80周年｜李家超率團出發前往北京　參加閱兵等紀念活動,2025-09-02 08:19,,2025-09-02 09:30,local,rthk,https://news.rthk.hk/rthk/ch/component/k2/1820805-20250902.htm,"行政長官李家超早上出發前往北京，他將率領由香港各界人士組成的代表團，參加明日舉行的中國人民抗日戰爭暨世界反法西斯戰爭勝利80周年紀念活動，包括明日上午的紀念大會和閱兵，以及文藝晚會。李家超亦會出席大會在中午舉行的招待會。

香港特區代表團共約360人，包括政府主要官員，來自司法機構、立法會和區議會的代表，參與抗戰愛國人士、老戰士及其遺屬，以及來自地區、商界及中資企業、教育、創科、專業服務、社福、傳媒、宗教、文化、出版、藝術及體育界、青年、學生和市民等不同社會界別人士。

李家超將於星期四返港。"
Nestle dismisses CEO over undisclosed relationship,2025-09-02 07:58,,2025-09-02 08:15,efinance,rthk,https://news.rthk.hk/rthk/en/component/k2/1820802-20250902.htm,"Nestle has abruptly dismissed its CEO Laurent Freixe for failing to disclose a romantic relationship with a subordinate, the Swiss food giant said on Monday, a dramatic removal exactly a year after he took the reins.

The maker of products ranging from KitKat to Nesquik said that it had appointed veteran insider Philipp Navratil, who had headed the Nespresso coffee unit, as Freixe's successor with immediate effect.

The shock departure threatens more volatility for Nestle amid a tough consumer environment and the disruptive US trade tariffs.

Nestle said Freixe's departure follows an investigation overseen by Chairman Paul Bulcke and Lead Independent Director Pablo Isla into an undisclosed romantic relationship with a direct subordinate, which breached the company's code of business conduct.

""This was a necessary decision,"" Bulcke said in a statement. ""Nestle's values and governance are strong foundations of our company. I thank Laurent for his years of service.""

The firm announced in June that Bulcke, its long-standing chairman, would stand down next year.

A company spokesman told Reuters concerns about a possible relationship between Freixe and a direct report first emerged in the spring through an internal company hotline. The board of directors immediately opened an investigation into the matter, which was however inconclusive, this person added.

As the concerns persisted, the company launched a second probe, overseen by Bulcke and Isla and with the help of an external firm, which confirmed the relationship. Freixe had initially denied the relationship to the board, the spokesperson added.

The ousted executive will not receive an exit package after his dismissal,Nestle told Reuters.

The CEO's abrupt removal comes exactly one year after Nestle ousted his predecessor Mark Schneider, raising questions on its next course of action even though the company said it would not change course on strategy and targets.

""This new change is likely to keep afloat the question mark about the mid-term direction of the company,"" JP Morgan analysts said in a note to clients.

Nestle shares have fallen 17 percent over the past year, lagging its rivals and the broader market.

The sudden exit is the latest management reshuffle at a global consumer goods and food company this year, including Nestle rival Unilever, Diageo and Hershey.

The conduct of senior executives has come under intense scrutiny recently, particularly in the United States. Kohl's fired CEO Ashley Buchanan in May after an investigation found he had pushed for deals with a vendor with whom he had a personal relationship, after little more than 100 days in the position.

And Astronomer CEO Andy Byron resigned in July after being caught on camera embracing a staffer at a Coldplay concert. (Reuters)"
貝森特：秋季或宣布全國住房緊急狀態　探討多個方法增加供應,2025-09-02 07:47,,2025-09-02 08:15,greater_china,rthk,https://news.rthk.hk/rthk/ch/component/k2/1820800-20250902.htm,"美國財長貝森特表示，政府計劃未來數星期出台新措施，秋季或宣布全國住房緊急狀態，以解決住房成本高企問題。他接受路透社訪問時指出，一旦利率開始下降，房地產交易及房屋銷售將會增加。政府亦正探索簡化許可及鼓勵標準化方法，以提振房屋建築活動，增加供應。

另外，貝森特為總統特朗普辭退聯儲局理事庫克辯護，認為如果針對庫克的按揭貸款欺詐指控屬實，她就應該被解僱或辭職，又指庫克並沒有否認有關指控。

他強調，聯儲局應保持獨立，但聯儲局犯了很多錯誤。他又敦促參議院盡快確認白宮經濟顧問委員會主席米蘭，臨時擔任聯儲局理事的任命。

貝森特又提到，政府就關稅政策向最高法院上訴，他說有信心最高法院會支持特朗普的關稅政策，財政部正在準備相關文件，提交給法律團隊。他又說，除了《國際緊急經濟權力法》，政府還可以引用其他法規，為關稅政策提供正當理由，不過這些法規效力較弱、效率也不夠高。"
美網女單　大坂直美和施維雅迪克分別晉級8強,2025-09-02 06:54,,2025-09-02 07:15,csport,rthk,https://news.rthk.hk/rthk/ch/component/k2/1820795-20250902.htm,"美國網球公開賽女單，23號種子、日本的大坂直美以盤數6:3和6:2，擊敗3號種子、美國的歌芙，2021年以來首次晉級大滿貫8強。

大坂直美狀態甚好只是用了64分鐘就輕鬆淘汰歌芙，她說自己在場上非常專注，期望每個人都可以睇到一場精彩的比賽，她將會同11號種子、捷克的梅高娃爭入4強。

2號種子、波蘭的施維雅迪克亦以直落兩盤6:3和6:1，擊敗13號種子、俄羅斯的阿歷山杜娃晉級，8強將再次遇上7月溫網決賽對手、美國的安妮絲莫娃。"
利物浦以1.25億英鎊簽入瑞典國腳阿歷山大伊沙克,2025-09-02 06:53,,2025-09-02 07:15,csport,rthk,https://news.rthk.hk/rthk/ch/component/k2/1820794-20250902.htm,"英超轉會窗關閉前，利物浦以創英國轉會費紀錄的1億2500萬英鎊，從紐卡素簽入阿歷山大伊沙克。

英國廣播公司報道，雙方簽約6年，並引述紐卡素消息人士說，這筆交易加上附加條款，價值可能高達1億3千萬英鎊。

伊沙克將會穿上9號球衣。他在接受利物浦官網採訪時表示，進入職業生涯的下一步，他非常高興獲得這個機會，會好好利用佢去創造歷史，期望為紅軍贏得獎盃。

25歲的瑞典國腳伊沙克2022年以6000萬英鎊，從西甲皇家蘇斯達轉會至紐卡素，上季各項賽事上陣42次，攻入27球，並協助球隊在英格蘭聯賽盃決賽擊敗利物浦，終止球會56年來的錦標荒。"
屯門怡樂花園清晨發生火警　約80名住客疏散,2025-09-02 06:31,,2025-09-02 07:00,local,rthk,https://news.rthk.hk/rthk/ch/component/k2/1820792-20250902.htm,"屯門清晨發生火警，約80名住客疏散，另外現場有一名男子懷疑從高處墮下死亡。

警方清晨近5時接報，屯門怡樂花園第一座發生火警，現場傳出大量濃煙及燒焦味，大批住客疏散到地面暫避。

另外，火警現場有一名男子，被發現倒臥在怡樂花園第一座和第二座之間，當場死亡，懷疑從高處墮下，警方正調查兩宗案件是否有關。"
美元指數曾跌0.3%,2025-09-02 06:10,,2025-09-02 06:45,cfinance,rthk,https://news.rthk.hk/rthk/ch/component/k2/1820790-20250902.htm,"美元指數偏軟，一度跌0.3%，較早時回穩至97.695，跌0.14%。

歐元兌美元貼近1.171，英鎊兌美元徘徊1.354，澳元兌美元處於0.655以上。

美元兌日圓較早時報147.17，美元兌離岸人民幣略高於7.131。"
布蘭特期油高收約1%　憂慮俄羅斯供應中斷,2025-09-02 06:10,,2025-09-02 06:30,cfinance,rthk,https://news.rthk.hk/rthk/ch/component/k2/1820789-20250902.htm,"憂慮俄羅斯供應中斷，加上美元偏軟，帶動油價造好。內地8月製造業活動重新擴張，亦支撐油價表現。另外，市場關注9月7日舉行的OPEC+會議。

倫敦布蘭特期油收報每桶68.15美元，升67美仙，升幅約1%。

紐約期油較早時徘徊64.6美元附近，升逾0.9%。但由於美國勞動節假期，紐約期油並無結算價，假期因素亦導致英美期油交投淡靜。"
紐約期金創新高　白銀升至14年高位,2025-09-02 05:50,,2025-09-02 06:15,cfinance,rthk,https://news.rthk.hk/rthk/ch/component/k2/1820788-20250902.htm,"金價造好，市場預料聯儲局9月重啟減息機會接近90%。

紐約期金12月合約高見每盎司3557.1美元，創新高，升近1.2%。

現貨金迫近3500美元關口，高見3489.51美元，升逾1.2%，創逾4個月新高。

現貨銀升至每盎司40美元以上，創14年新高，較早時徘徊41.7美元附近，升逾2%。

分析指，預期美國減息，加上市場供應偏緊，均利好白銀價格。而美國金融市場假期，交投淡靜加劇黃金及白銀波幅。"
北韓證實領袖金正恩昨日乘坐專列前往中國,2025-09-02 05:39,,2025-09-02 06:00,cinternational,rthk,https://news.rthk.hk/rthk/ch/component/k2/1820787-20250902.htm,"北韓證實領袖金正恩，昨日啟程前往中國，出席在北京舉行的中國人民抗日戰爭暨世界反法西斯戰爭勝利80周年紀念活動。

朝中社報道，金正恩昨日乘坐專列，啟程前往中國，北韓外務相崔善姬等黨政領導幹部隨行。朝中社並發放圖片，見到金正恩與隨行人員，坐在相信是專列內的會議室。

今次是金正恩執政以來第5次訪華，預料他抵達北京後將受到中方迎接，前往釣魚台國賓館。分析相信，金正恩在華期間，將分別與國家主席習近平及俄羅斯總統普京會面。"
歐洲股市靠穩　德國DAX指數高收約0.6%,2025-09-02 05:32,,2025-09-02 05:45,cfinance,rthk,https://news.rthk.hk/rthk/ch/component/k2/1820786-20250902.htm,"歐洲股市靠穩，市場觀望美國經濟數據，以及聯儲局本月會否一如預期重啟減息。

英國富時100指數結束4個交易日跌勢，早段最多升0.4%，高見9226點，尾市一度轉跌，收報9196點，升9點，升幅0.1%。

德國DAX指數於24000點水平爭持，收報24037點，升135點，升0.57%，結束5日跌勢。

法國CAC指數顯著回吐早段升幅，全日僅升4點，收報7707點。"
阿富汗地震搜救行動繼續　公共衛生部長視察重災區,2025-09-02 05:19,,2025-09-02 05:30,cinternational,rthk,https://news.rthk.hk/rthk/ch/component/k2/1820785-20250902.htm,"阿富汗東部的6級地震，增加至超過800人遇難，大約2800人受傷。

重災區庫納爾省的救災部門負責人說，仍有不少人被困在瓦礫中，不排除死傷人數會進一步上升。搜救行動通宵進行，但部分偏遠地區的道路在地震後受損，加上地震前當地曾落暴雨，山泥傾瀉風險增加，令救援進度受影響。

阿富汗公共衛生部長賈拉利，率領官員視察庫納爾省及鄰近的楠格哈爾省，了解民眾受災情況。發言人說，首都喀布爾及四個最受地震影響的省份，已經進入醫療緊急狀態，並呼籲國際社會提供援助。

印度外長蘇傑生表示，印度已向阿富汗提供1000頂大型帳篷，亦正向庫納爾省運送15噸食物，並承諾未來幾天會運送更多物資。"
烏克蘭和北約官員會面　烏方促請北約成員國提供更多軍事援助,2025-09-02 03:50,,2025-09-02 04:00,cinternational,rthk,https://news.rthk.hk/rthk/ch/component/k2/1820784-20250902.htm,"烏克蘭和北約的官員會面，討論俄羅斯近日對烏克蘭多個城市的攻擊，烏克蘭促請北約提供更多軍事援助。

烏克蘭外長瑟比加在社交媒體發文，說因應俄羅斯近日大規模空襲烏克蘭，烏方要求北約的烏克蘭理事會，星期一舉行特別會議，商討採取聯合措施，應對的俄羅斯的升級行動。

烏克蘭外交部在特別會議後發聲明，說與北約官員討論了烏方對於加強防衛的需求，聲明說，烏方促請北約成員國，協助提供愛國者防空系統和導彈等裝備，又強調烏克蘭對遠程導彈的需求。"
聯合國人權辦事處關注印尼示威　籲當局保障和平集會權利,2025-09-02 02:21,,2025-09-02 02:45,cinternational,rthk,https://news.rthk.hk/rthk/ch/component/k2/1820782-20250902.htm,"聯合國人權事務高級專員辦事處關注印尼近日的示威，呼籲當局保障和平集會的權利和言論自由。

發言人沙姆達薩尼表示，正密切關注印尼全國的抗議活動，強調透過對話解決公眾關注議題的重要性，又提到要允許傳媒自由、獨立地報道事件。

沙姆達薩尼又說，關注執法人員在處理示威時，懷疑使用不必要或過度武力，她強調，所有安全部隊，包括履行執法任務的軍隊，都必須遵守使用武力和槍械的基本指引。她呼籲迅速、徹底和透明地，對所有涉及違反國際人權法的行為，包括使用武力，進行調查。"
王毅晤印尼外長蘇吉約諾　希望印尼切實保障中方人員機構安全,2025-09-02 01:48,,2025-09-02 02:00,greater_china,rthk,https://news.rthk.hk/rthk/ch/component/k2/1820781-20250902.htm,"中共中央政治局委員、外長王毅，日前應約與印尼外長蘇吉約諾會晤。

外交部公布，兩人在剛過去的星期日，在天津會面。蘇吉約諾轉交印尼總統普拉博沃，致國家主席習近平的信函，蘇吉約諾表示，印尼高度重視發展對華友好關係，印尼政府承諾全力保障在印尼的中國人員和機構安全。

王毅則表示，印尼是中國的友好鄰邦，雙方不只是全面戰略夥伴，也是命運共同體。中方歡迎蘇吉約諾作為總統代表，來華出席上合組織峰會和中國人民抗日戰爭暨世界反法西斯戰爭勝利80周年紀念活動，理解並尊重印尼政府因為國內需要作出的調整，希望印尼切實保障在印尼中方人員和機構安全及合法權益。"
印尼多個主要城市仍有示威　雅加達至今拘逾1200人,2025-09-02 01:35,,2025-09-02 01:45,cinternational,rthk,https://news.rthk.hk/rthk/ch/component/k2/1820780-20250902.htm,"印尼多個主要城市仍有示威活動，首都雅加達警方公布，至今拘捕超過1200人。

超過500名示威者，星期一在雅加達的國會大樓外聚集，部分人手持橫額、或揮舞旗幟，大批警員和軍人在場戒備。當局顯著加強市面安保，設立多個檢查站、加派人手巡邏。

雅加達警方表示，示威至今拘捕了超過1200人，分別涉及破壞公物、搶掠、及其他暴力犯罪行為，強調警方不會針對和平示威者。至於印尼財政部長及多名議員的住所遭到示威者搶掠，警方說已經鎖定部分疑犯的身分，很快會採取拘捕行動。

雅加達省長普拉莫諾就說，持續多日的示威，估計造成的經濟損失達到550億印尼盾、折合港幣大約2600萬元。"
歐洲多國領導人周四在巴黎會晤　討論烏克蘭安全保障,2025-09-02 00:49,,2025-09-02 01:00,cinternational,rthk,https://news.rthk.hk/rthk/ch/component/k2/1820779-20250902.htm,"歐洲多國領導人，星期四將會在巴黎參與峰會，討論烏克蘭安全保障，據報烏克蘭總統澤連斯基將會出席。

法國愛麗舍宮公布，峰會由總統馬克龍和英國首相施紀賢共同主持，有大約30個歐洲等國家的領導人出席；部分國家的領導人會親身出席峰會，部分就透過視像形式參與。愛麗舍宮又說，各國領導人將討論近期為烏克蘭安全保障所展開的工作，以及評估俄羅斯拒絕停火可能造成的後果。

法新社引述消息人士報道，澤連斯基將會出席峰會，至於美國總統特朗普就預計不會參與。"
馮德萊恩專機飛行期間遭信號干擾　事件疑涉俄羅斯,2025-09-02 00:36,,2025-09-02 01:00,cinternational,rthk,https://news.rthk.hk/rthk/ch/component/k2/1820778-20250902.htm,"歐盟委員會主席馮德萊恩的專機，飛行途中遭到信號干擾，飛機安全降落保加利亞。保加利亞政府表示，事件懷疑與俄羅斯有關，俄羅斯未有回應。

歐盟發言人表示，馮德萊恩當地星期日乘坐專機前往保加利亞，但機上的全球定位系統，在飛行途中遭到干擾，飛機最後安全降落保加利亞。歐盟事後接獲保加利亞當局通報，說懷疑事件涉及俄羅斯刻意干擾。

保加利亞政府說，馮德萊恩的飛機，在南部城市普羅夫迪夫上空，失去全球定位系統信號，控制塔人員隨即切換到地面導航系統，以確保飛機安全降落。

這次事件，正值馮德萊恩展開為期四天的歐盟成員國訪問，歐盟重申，會加強防禦能力和對烏克蘭的支援；俄羅斯就暫時未回應事件。"
