title,date,summary,scrape_time,section,source,url,news_content
李家超：維護國家安全白皮書具一錘定音指導意義,2026-02-14 13:41,,2026-02-14 14:00,local,rthk,https://news.rthk.hk/rthk/ch/component/k2/1843847-20260214.htm,"行政長官李家超在政府總部出席《「一國兩制」下香港維護國家安全的實踐》白皮書專題研討會，他致辭時分享三點《白皮書》的重要啓發和體會，表示《白皮書》對香港特區至為重要，具有一錘定音的指導意義。

李家超表示，《白皮書》闡明中央在香港維護國家安全方面的原則立場，明確香港維護國家安全是「一國兩制」的最高原則，也是全面準確、堅定不移貫徹「一國兩制」方針應有之義，發揮一錘定音的作用。而《白皮書》發布的時間節點十分關鍵，具有立足現實的警示意義。他表示《白皮書》發布之日，是黎智英被法庭重判入獄20年的翌日。《白皮書》在這個時候發布，警醒必須牢記，香港曾因國家安全中門大開導致政治亂象不斷，最終是在維護香港國家安全法律制度護佑下，實現由亂到治走向由治及興，必須深刻總結經驗和教訓，對國家安全風險時刻警惕，全方位做好香港維護國家安全的工作。

李家超表示，白皮書與去年5月國務院辦公室發布的《新時代的中國國家安全》白皮書一脈相承，具有承先啟後的意義。而當前世界百年未有之大變局加速演進，地緣政治局勢日趨複雜，全球不穩定因素增加，香港面對的國家安全風險變化莫測。他強調今天安定繁榮的良好局面來之不易，必須倍加珍惜。

他又說，《白皮書》用「六個堅持」，包括「堅持中央的根本責任和特區的憲制責任相統一」、「堅持把特區管治權牢牢掌握在愛國者手中」、「堅持尊重和保障人權」、「堅持在法治軌道上維護安全」、「堅持統籌發展與安全」、「堅持在開放中維護安全」，系統論述以高水平安全護航「一國兩制」事業高質量發展，具有實踐落實的行動意義。他強調要繼續一起維護國家安全和推動發展經濟，並要以總體國家安全觀為指引，把握《白皮書》指出「一國兩制」下維護國家安全「六個堅持」，特區政府會繼續透過不同渠道，持續加強宣傳教育，帶領和鼓勵社會各界深入學習和領會《白皮書》的重要內涵和要求，增強市民的國家安全意識。



編輯：譚佩貞"
截至今早10時　13.6萬人次出境最多經機場8.4萬人次入境,2026-02-14 13:37,,2026-02-14 14:00,local,rthk,https://news.rthk.hk/rthk/ch/component/k2/1843846-20260214.htm,"農曆新年將至，入境處預計今日是陸路出境高峰期。截至早上10時，入境處數字顯示，有22萬1千多人次經各口岸出入境本港，包括約13萬6千多人次出境，8萬4千多人次入境。

最多人選擇在機場離境，有3萬1千人次，其次是西九高鐵站，有近2萬人次。在入境方面，最多內地旅客利用西九高鐵站來港，有8500多人次，其次是深圳灣及香園圍口岸，分別均有6700多人次。



編輯：譚佩貞"
截至早上10時　13.6萬人次出境　8.4萬人次入境,2026-02-14 13:37,,2026-02-14 17:00,local,rthk,https://news.rthk.hk/rthk/ch/component/k2/1843846-20260214.htm,"農曆新年將至，入境處預計今日是陸路出境高峰期。截至早上10時，入境處數字顯示，有22萬1千多人次經各口岸出入境本港，包括約13萬6千多人次出境，8萬4千多人次入境。

最多人選擇在機場離境，有3萬1千人次，其次是西九高鐵站，有近2萬人次。在入境方面，最多內地旅客利用西九高鐵站來港，有8500多人次，其次是深圳灣及香園圍口岸，分別均有6700多人次。



編輯：譚佩貞"
習近平：2026年是十五五開局之年　要堅持穩中求進工作總基調,2026-02-14 13:22,,2026-02-14 14:15,greater_china,rthk,https://news.rthk.hk/rthk/ch/component/k2/1843844-20260214.htm,"中共中央、國務院上午在人民大會堂舉行春節團拜會。

中共中央總書記、國家主席、中央軍委主席習近平發表講話，代表黨中央和國務院，向全國各族人民，向香港和澳門特別行政區同胞、台灣同胞和海外僑胞拜年。

習近平強調，即將過去的蛇年，面對複雜多變的國際國內形勢，國家迎難而上，全年經濟社會發展主要目標任務順利完成，「十四五」圓滿收官，經濟、科技、國防、綜合國力躍上新台階，中國式現代化邁出新的堅實步伐。

習近平強調，只要保持戰略定力，一步一個腳印堅定朝前走，一個階段一個階段紮實推進，黨和國家事業就一定會不斷積小勝為大勝，目標一定能實現。

習近平指出，2026年是中國共產黨成立105周年，是十五五開局之年。要堅持穩中求進工作總基調，完整準確全面貫徹新發展理念，加快構建新發展格局，著力推動高質量發展，保持社會和諧穩定，持之以恆推進全面從嚴治黨，努力實現十五五良好開局。

習近平說，丙午馬年希望全國各族人民更加緊密地團結在黨中央周圍，堅定必勝信心，保持昂揚鬥志，在中國式現代化新征程上策馬揚鞭、勇往直前，共同開創更加美好的未來。



編輯：方潤南"
Political acumen preferred in top FEHD job applicants,2026-02-14 13:22,,2026-02-14 13:45,elocal,rthk,https://news.rthk.hk/rthk/en/component/k2/1843841-20260214.htm,"Secretary for Environment and Ecology Tse Chin-wan said on Saturday that ongoing open recruitment efforts could help put the Food and Environmental Hygiene Department in good hands with a director who has an innovative bent and political acumen. 

Tse was speaking after the government on Wednesday launched, in a first, an open-recruitment drive to fill the position as well as the top job at the Information Services Department. 

Requirements for the top FEHD job for applicants include having a ""strong political acumen to manage political sensitivities adeptly"" while having  ""knowledge and experience in law enforcement work"" was preferred. 

""The scope of the department's work is extensive, and it involves contact with the public and is closely tied to law-enforcement duties,"" Tse said on a TV programme. 

""It also involves dealing with situations where potential conflicts of interest may arise. 

""As a senior civil servant, keen political acumen and law enforcement experience can help drive continuous innovation and improvement within the department."""
More CCTV 'puts police streets ahead in crime fight',2026-02-14 13:07,,2026-02-14 13:15,elocal,rthk,https://news.rthk.hk/rthk/en/component/k2/1843836-20260214.htm,"Police Commissioner Joe Chow on Saturday said expanding the closed-circuit television network on Hong Kong's streets would help keep crime rates under control.

In documents submitted to the Legislative Council on Friday, the government revealed plans to install an extra 6,500 CCTV cameras under its “SmartView” programme over the next five years, bringing the city’s total to around 66,500.

The expansion will cost about HK$4 billion, while recurrent monitoring and maintenance expenses associated with the network are also set to rise, from HK$73 million next year to more than HK$240 million within a decade.

Speaking after appearing on a radio programme, Chow said the SmartView system had already proven its worth.

According to police figures, the system has helped with 899 cases since its implementation in April 2024.

“More money will be spent, for sure, for the recurrent costs, but we will make sure that every dollar of this public money is well spent to protect citizens and everyone in Hong Kong,” Chow said.

The force also plans to develop an AI-powered video analysis toolbox to enhance the use of CCTV footage.

Chow said the adoption of artificial intelligence in CCTV monitoring systems wasn't unique to Hong Kong but part of a trend that had seen its possibilities explored in other developed cities as well.

He added that there was no concrete timetable for its roll-out as yet, as legal and infrastructure issues had to be resolved first. However, he said the public would be well informed before implementation.

On new ""crash-for-cash"" scams, the police chief said the force would carry out a new round of enforcement action as soon as possible.

Four people - a local couple and two doctors - have been arrested in connection with fraudulent insurance claims linked to at least 22 staged traffic accidents, with the largest single claim exceeding HK$300,000."
香港駐新加坡經貿辦舉辦三場商務及投資研討會　逾260人參與,2026-02-14 12:50,,2026-02-14 13:15,local,rthk,https://news.rthk.hk/rthk/ch/component/k2/1843842-20260214.htm,"香港駐新加坡經貿辦上月共舉辦三場以創科為主題的商務及投資研討會，吸引超過260名對香港以至大灣區發展機遇感興趣的企業家、高級人員及業界人士參與。

其中上月28日駐新加坡經貿辦與粵港澳大灣區企業家聯盟於越南胡志明市合辦「越中人工智能與綠色科技合作論壇2026」，吸引超過120名來自政府機構、商會、科技企業及專業界別的代表出席。

候任駐新加坡經貿辦處長熊佩玲開幕致辭時表示，香港與越南的連繫日益緊密，強調香港在「一國兩制」原則下具備獨特優勢，能夠連接中國內地與全球市場，並發揮國際金融中心、國際貿易中心及國際創科中心的角色。她又介紹特區政府推動人工智能發展與應用，以及促進綠色科技發展的各項措施，包括預留資源設立香港人工智能研發院。而香港擁有高度國際化的營商環境、世界級專業服務、與國際接軌的普通法制度、簡單低稅制及完善的物流網絡。這些優勢令香港成為內地企業「出海」的理想平台，同時吸引國際資本及人才把握大灣區及其他地區的發展機遇。



編輯：譚佩貞"
食環署加強巡查全港售賣盆菜食物業處所　農曆新年期間持續進行,2026-02-14 11:51,,2026-02-14 12:15,local,rthk,https://news.rthk.hk/rthk/ch/component/k2/1843839-20260214.htm,"食環署表示，已加強巡查全港售賣盆菜的食物業處所，有關行動會在農曆新年期間持續進行，保障食物安全和市民健康。

發言人說，盆菜的食材種類繁多，製作和貯存程序亦較為複雜，食環署特別關注食物的製備、貯存、翻熱和運送過程，確保符合食物安全標準及相關法例。如發現違規情況，署方定必嚴肅跟進。

另外，食物安全中心早前完成有關盆菜微生物含量的時令食品調查，從不同零售商，包括網上零售商，抽取盆菜樣本，檢測引致食物中毒的致病菌含量，包括蠟樣芽孢桿菌、產氣莢膜梭狀芽孢桿菌、沙門氏菌、凝固酶陽性葡萄球菌和副溶血性弧菌等，全部樣本通過測試。



編輯：譚佩貞　"
香港國際懲教應變戰術訓練學院首批內地及海外學員來港完成訓練,2026-02-14 11:37,,2026-02-14 11:45,local,rthk,https://news.rthk.hk/rthk/ch/component/k2/1843838-20260214.htm,"香港國際懲教應變戰術訓練學院上月底開幕，為國內及海外執法部隊提供理論和實踐並重的訓練課程，首批29名來自內地、澳門、文萊、斐濟、馬來西亞、菲律賓、韓國和越南的學員，最近來港參加課程，完成為期6天訓練。

政府新聞網報道表示，課程由懲教署制定，並獲香港資歷架構第三級別認證，目的是教授前線執法人員應用低傷害自衞及控制術，以減少執法人員和被控制一方受傷的機會。課程亦提供應用學習的機會，包括提供小組戰術訓練，模擬制服不合作在囚人士。 

懲教署助理署長陳少恒表示，課程融入不同武術內容，其中太極具以柔制剛的特點，有效減低執法人員和被控制一方的受傷機會。學院教官選自懲教署區域應變隊，曾在海外接受訓練，部分人擁有國際認可的教官資格。署方亦成立跨界別專家顧問團，成員包括運動醫學及科學專家、中醫教授、物理治療師等，他們會為課程內容提供意見和改進建議，提升戰術訓練的整體效能和安全性。

香港國際懲教應變戰術訓練學院設於歌連臣角懲教所舊址，設有各種訓練設施，並提供真實的懲教院所環境。



編輯：譚佩貞"
大批市民機場出發新春外遊　機場櫃位現人龍秩序大致正常,2026-02-14 11:33,,2026-02-14 11:45,local,rthk,https://news.rthk.hk/rthk/ch/component/k2/1843837-20260214.htm,"農曆新年將至，早上在機場客運大樓，陸續有市民出發到外地旅遊，不少航空公司的櫃位出現等候辦理登機手續的人龍，秩序大致正常。

有市民表示，擔心假期人多出行，提早4小時到達機場，準備與太太到澳洲自駕遊9日，到訪黃金海岸等著名景點，又說新年的機票比平時貴，預計整個行程花費共6萬元。

亦有市民與朋友到韓國旅遊4日，認為當地較有冬天氣氛，又說帶了半個空的行李箱，準備購買化妝品及體驗穿韓服，預計花費1萬元。有市民一家大小到馬來西亞，體驗當地華人的新年氣氛。

有在香港工作的內地人啟程回西安過年，形容很久沒有回鄉，心情興奮，已預留9日時間探親及到陝西一帶遊。

入境處預料由今日至本月23 日，約有1138萬人次包括香港居民及訪客，經各海、陸、空管制站進出香港。預計今日是陸路出境高峰期，出境人次約636000，而入境高峰期為本月22日，入境人次約663000。


編輯：譚佩貞"
Taxi driver held as 80-year-old dies in accident,2026-02-14 11:26,,2026-02-14 11:45,elocal,rthk,https://news.rthk.hk/rthk/en/component/k2/1843832-20260214.htm,"An 80-year-old man has died after being knocked down by a taxi in Ngau Tau Kok on Friday night. 

Police said the incident happened just before 9.15 pm near Ngau Tau Kok Road as the taxi was heading along Kwun Tong Road towards Kwun Tong. 

The man was rushed to Queen Elizabeth Hospital with serious head and limb injuries. 

He was certified dead just after 10.30 pm. 

The 46-year-old taxi driver was arrested on suspicion of dangerous driving causing death."
Food-poisoning link taints Spanish oyster sales,2026-02-14 11:22,,2026-02-14 11:45,elocal,rthk,https://news.rthk.hk/rthk/en/component/k2/1843831-20260214.htm,"The government on Friday linked a Spanish company to a raw oyster food-poisoning outbreak, ordering Hong Kong's food and beverage industry to stop trading with it. 

Since the beginning of the month, 37 people have fallen ill after eating raw oysters, prompting the government to stop imports from four companies. 

In a statement, the Centre for Food Safety and the Food and Environmental Hygiene Department said they had ordered a halt to the importation and sale of oysters from the Spanish company Mariscos Escacha. They also said they had contacted Spanish authorities about the matter.

Authorities here have already ordered a stop to oyster imports from Seojun Mulsan of South Korea, Jeton International, and 88 Investments. 

Inspections have also been stepped up, with a focus on storage temperatures and conditions, supply sources, and staff personal hygiene.

The Centre for Food Safety reminded the public that oysters feed by filtering seawater, and viruses may accumulate in them if they are grown in contaminated water."
Student quota for non-locals may adjust further,2026-02-14 11:04,,2026-02-14 11:15,elocal,rthk,https://news.rthk.hk/rthk/en/component/k2/1843827-20260214.htm,"Secretary for Education Christine Choi on Saturday said the government might consider further adjusting its ceiling for the number of non-local students attending universities in Hong Kong.

There are currently, she pointed out, more than 30,000 such students in the city and some universities have already filled up their quota. 

The government had doubled enrolment caps for non-locals to 40 percent from the 2024/25 academic year, and the limit will be increased to 50 percent from 2026/27. 

Speaking on a radio programme, Choi said there would be no impact on local enrolment, no matter how many non-locals were admitted to the SAR's tertiary institutions. 

""The 15,000 spots for our local students will remain unchanged. Our school-age population is decreasing, but we never adjusted the number of first-degree places offered for locals,"" she pointed out. 

""Moreover, universities admit non-locals on an over-enrolment basis, which means the institutions admit our local students first, followed by non-locals."" 

Choi said the number of hostel places would rise to around 14,300 in the 2027/28 academic year, as part of the government's efforts to accommodate increasing demand for student accommodation, following the establishment of the Hostel Development Fund in 2018 to that end. 

As for teaching staff in universities, Choi said, non-locals account for 70 percent, which makes Hong Kong's institutions attractive as it reflects internationalisation and diversity."
