title,date,summary,scrape_time,section,source,url,news_content
英國9月通脹率維持3.8%令市場意外,2025-10-22 17:48,,2025-10-22 18:30,cfinance,rthk,https://news.rthk.hk/rthk/ch/component/k2/1828280-20251022.htm,"英國9月通脹率連續3個月維持3.8%，服務業通脹率亦維持4.7%，市場原先估計兩者分別升至4%及4.9%。

數據公布後，英鎊兌美元偏軟，較早時徘徊1.331附近。

有分析指出，英國通脹問題較數周前稍微緩和，市場預期英倫銀行將可能提早在明年2月減息。

不過，英國財政大臣李韻晴對新公布的通脹數據仍未滿意，表示正準備在預算案採取措施，幫助降低生活成本，指出長期以來，英國經濟一直停滯不前，民眾感覺付出多、得到少，必須改變這種情況。"
英國9月通脹率意外維持於3.8%,2025-10-22 17:48,,2025-10-22 18:00,cfinance,rthk,https://news.rthk.hk/rthk/ch/component/k2/1828280-20251022.htm,"英國9月通脹率連續3個月維持3.8%，服務業通脹率亦維持4.7%，市場原先估計兩者分別升至4%及4.9%。

數據公布後，英鎊兌美元偏軟，較早時徘徊1.331附近。

英國財政大臣李韻晴不滿新公布的通脹數據，她正準備在預算案採取措施，幫助降低生活成本。她指，長期以來，英國經濟一直停滯不前，民眾感覺付出多、得到少，必須改變這種情況，政府支持央行降低通脹。"
在岸人民幣兌美元低收74點子　創近1星期新低,2025-10-22 17:44,,2025-10-22 18:00,cfinance,rthk,https://news.rthk.hk/rthk/ch/component/k2/1828283-20251022.htm,"在岸人民幣收市報7.1245兌1美元，較昨日收市價跌74點子，創近1星期新低。日內高低波幅只得55點子。

人民幣中間價亦脫離逾1年高位，報7.0954兌1美元，較市場預測偏強約270點子。

有交易員指，中美即將新一輪貿易談判，市場觀望氣氛濃厚，預料短期人民幣匯價持續整固。市場亦關注四中全會、美國通脹數據等。"
財庫局：首宗遷冊來港申請獲批　近月收到大量查詢,2025-10-22 17:41,,2025-10-22 18:00,cfinance,rthk,https://news.rthk.hk/rthk/ch/component/k2/1828285-20251022.htm,"中油國際投資（香港）有限公司旗下子公司，獲公司註冊處發出遷冊證明書，是公司遷冊制度5月底生效以來首宗獲批個案。

財經事務及庫務局引述公司指，選擇遷冊到香港，不僅有助整合企業架構，提升營運效率，亦能享受到香港簡單稅制及專業服務多重好處。

財庫局局長許正宇表示，公司註冊處收齊申請人所需文件及資料後，兩星期內已迅速完成審批工作。市場對遷冊制度反應十分正面，公司註冊處近月陸續收到遷冊申請及大量查詢，預期日後會累積更多成功案例。"
貨機滑出跑道致兩死　陳美寶：全力跟進並為家屬提供適切協助,2025-10-22 16:58,,2025-10-22 17:15,local,rthk,https://news.rthk.hk/rthk/ch/component/k2/1828282-20251022.htm,"一架來自阿聯酋的貨機前日抵港時滑出跑道，導致機場巡邏車上兩人死亡。運輸及物流局局長陳美寶表示，正全速全力跟進及善後，會透過政府部門，為家屬提供適切協助。

工業傷亡權益會總幹事蕭倩文說，家屬希望能盡快知道意外成因，解開疑問，但相信調查過程需時。她認為應召開死因庭才能知道事件經過，對家屬有一個交代，以及避免同類事件再發生。

她在一個電台節目表示，目前主要需處理後事及緩解經濟壓力。由於兩名死者均是家庭經濟支柱，與父母同住，及有年幼小孩，賠償金至少要一至兩年後才能獲取，兩個家庭面臨經濟壓力。她又說，家屬昨日曾與公司商討經濟援助，但與理想有距離。

蕭倩文認為今次屬於比較罕見的空難，有別於一般涉及職業安全，希望政府各部門能夠徹底調查。她又說，家屬希望航空公司至少要問候他們，表達最基本的關懷，家屬又擔心涉事機組人員會離開香港，影響調查。"
法國羅浮宮搶劫案事發三日後恢復開放,2025-10-22 16:51,,2025-10-22 17:15,cinternational,rthk,https://news.rthk.hk/rthk/ch/component/k2/1828276-20251022.htm,"法國羅浮宮在經歷搶劫事件三日後恢復開放，供遊客參觀。

大批遊客當地星期三排隊進入羅浮宮，有現場工作人員表示，博物館當日正常對公眾開放。不過有法國傳媒報道，博物館內的案發地點阿波羅長廊仍然關閉。

羅浮宮在過去的星期日發生搶劫事件，數名蒙面人在幾分鐘內搶走9件珠寶，羅浮宮隨即疏散人員宣布閉館，疑犯逃離時遺棄了其中一頂王冠，另外8件珠寶仍然下落不明，當局說搶劫案中失竊品的估計價值約8800萬歐元，從法國歷史遺產的角度來說，損失更加重大。總統馬克龍日前表示，正竭盡全力追回被盜珍寶，並會將犯案者繩之於法，重申會加強遺產保護。"
田北辰：海洋公園虧損情況主要來自資產估值　只屬「虛驚一場」,2025-10-22 16:49,,2025-10-22 17:00,local,rthk,https://news.rthk.hk/rthk/ch/component/k2/1828281-20251022.htm,"海洋公園截至6月30日的2024/2025財政年度，虧損2億7470萬元，較上個年度虧損多超過2億元。公園總收入按年增長9%至大約12億8810萬元，經營盈餘轉虧為盈，錄得超過4200萬元。不過，由於物業、機器及設備減值撥回較上年度減少超過2億，致虧損擴大。

實政圓桌立法會議員田北辰認為，海洋公園的虧損情況只屬「虛驚一場」，因為超過2億元的虧損，主要來自海洋公園的資產估值，較重要的是經營狀況。

他說海洋公園由去年度錄得經營虧損約1700萬，到今年錄得盈利4200萬元，已由負變正，他向海洋公園給予高分，相信公園不用再到立法會申請注資。

不過，田北辰表示，水上樂園一方虧蝕超過1.4億元，如果加上政府扣2.8億的保育及教育補助，海洋公園會在經營上錄得虧損。他認為最重要是政府如何看待海洋公園，明年之後是否再繼續給予支持，他認為很多香港人對海洋公園都有「情意結」。"
"HK, mainland stocks down as gold loses a bit of lustre",2025-10-22 16:46,,2025-10-22 17:00,efinance,rthk,https://news.rthk.hk/rthk/en/component/k2/1828279-20251022.htm,"Stocks in the mainland and Hong Kong ended lower on Wednesday, dragged by gold shares, while lingering Sino-US trade tensions also weighed on sentiment.

The benchmark Hang Seng Index ended trading on Wednesday down 245 points, or 0.94 percent, at 25,781 while the city's tech index fell 1.41 percent.

Across the border, the benchmark Shanghai Composite Index ended down 0.07 percent at 3,913 while the Shenzhen Component Index closed 0.62 percent lower at 12,996.

The ChiNext Index, tracking China's Nasdaq-style board of growth enterprises, lost 0.79 percent to close at 3,059.

Gold stocks were among the biggest losers in morning deals, following plunging bullion prices in global markets, with the CSI non-ferrous metal industry sub-index closing down 1.34 percent. Western Region Gold slumped 4.93 percent.

The precious metal has had a blockbuster run this year, climbing more than 50 percent as broader geopolitical and economic uncertainty, as well as expectations of US interest rate cuts, spurred demand for the safe-haven asset.

US President Donald Trump said he will discuss a lot of things with his Chinese counterpart Xi Jinping in two weeks but also conceded that the potential meeting may not happen.

Meanwhile, some global investment banks said they no longer expect major monetary stimulus measures in the remainder of this year.

""China could still be on track to hit its 'around 5 percent' growth target with the growth achieved in the first three quarters of this year,"" Citi analysts said in a note.

""With smaller room to cut for the People's Bank of China, we no longer expect a policy rate cut or reserve requirement ratio cut in the fourth quarter. Meanwhile, the focus could be on deployment of fiscal and quasi-fiscal policies.""

Analysts at Standard Chartered said they expect another 10-basis-point rate cut in the fourth quarter, with ""risk that the rate cut may not happen this year"".

Separately, the elite central committee of the Communist Party of China is holding the Fourth Plenum, which ends on Thursday. It will outline the government's economic, political and social agenda as well as its development plans for the next five years. A communique is expected to be published on Thursday. (Reuters/Xinhua)"
Legco president: turnover rate lower than past terms,2025-10-22 16:35,,2025-10-22 17:00,elocal,rthk,https://news.rthk.hk/rthk/en/component/k2/1828277-20251022.htm,"Outgoing Legislative Council President Andrew Leung said on Wednesday that the turnover rate of lawmakers this term is lower than that in the past several terms. 

So far, 22 out of 89 serving lawmakers have said they are not running again, or a little under a quarter of the council. 

Leung noted that the percentage for all other Legco terms had always been higher, and said it is only natural for people to come and go.

""There's nothing strange. Of course last term was special, more than 60 percent of councillors left. This was Hong Kong, but in other legislatures, a shift in political landscape could see half the members gone,"" he said at a press conference wrapping up the current legislative term.

""There's no need to make a big fuss about this. If eighty of our 89 serving members actually stayed on, what would you say then?""

While some long-serving councillors will be gone, Leung said it doesn't matter whether the public can recognise every lawmaker.

He said even if the council was a movie, it would be hard for the audience to recognise all 90 lead actors, adding that councillors are obviously not in the chamber to act, but to get things done. 

Leung said lawmakers passed 130 bills in the past four years, 60 percent more than the previous term.

The most important, he said, was the domestic national security law, but he noted there were also bills passed that improved people's livelihoods.

Those included reforming district councils to improve governance, making the reporting of child abuse mandatory, and changing tolls for harbour crossings.

The council, he said, has changed from past friction to becoming rational and pragmatic.

Leung said he has served as a lawmaker for 21 years, the past nine as president. 

He said he is proud to have witnessed Hong Kong reaching the new heights of moving from chaos to order and advancing from stability to prosperity.

Leung called on future lawmakers to remember that they are like ""fish in a fish tank"" in the chamber, that they ought to be careful with their work and that they also have to serve as role models both in their public and private lives."
港股低收245點　再失守26000點關口　成交創兩周新低,2025-10-22 16:33,,2025-10-22 17:00,cfinance,rthk,https://news.rthk.hk/rthk/ch/component/k2/1828275-20251022.htm,"港股連升兩日後回吐，再次失守26000點關口。恒生指數最多跌逾370點，低見25653點，收市報25781點，跌245點，跌幅逾0.9%。全日主板成交額減至2275.4億元，是兩星期以來最少。

科技指數、地產及工商業分類指數都跌逾1%，科指收報5923點。ATMXJ都跌，表現較差的阿里巴巴跌近2%。

金價下跌，拖累黃金相關股份受壓，紫金礦業、紫金黃金國際、招金、山東黃金跌近2%或以上。周大福跌近6%，是跌幅最大藍籌股。

金融、地產、公用股偏軟，石油股逆市升，醫藥股個別發展。另外，泡泡瑪特反彈逾2%。

新股廣和通收報18.98元，較招股價跌約12%。"
康文署擬選出不少於8個設施引入商業元素　出租場地舉辦商業活動,2025-10-22 16:31,,2025-10-22 17:00,local,rthk,https://news.rthk.hk/rthk/ch/component/k2/1828278-20251022.htm,"文化體育及旅遊局局長羅淑佩表示，康文署計劃於明年內選出不少於8個轄下設施，包括博物館和公園，引入商業元素及靈活地提供增值活動，例如在博物館閉館日出租場地舉辦商業或私人活動，推出收費的旅客團體導賞、開發更多文創產品等。

羅淑佩書面回覆立法會議員質詢表示，康文署計劃委聘專業營辦商，例如活動策劃公司，運用其市場和專業知識，向目標客戶推廣合適的場地、為活動提供技術和後勤支援、為目標群體安排康文署博物館大型展覽的導賞專場，以及提供客戶管理服務，政府正擬備各項細節。
　　 
她又說，康文署會透過邀請有興趣的商業機構或非牟利機構提交建議，以商業方式營運鯉魚門公園度假營，和發展試點泳灘成新興康樂休閒及水上活動設施，政府鼓勵有意的營運者提出可行方案。康文署正研究具體的市場營運模式，各項具體安排和收費需視乎活動性質和內容、場地條件等。有關計劃尚在研究階段，康文署會適時評估成效。"
Panda fever feeds new revenue shoots at Ocean Park,2025-10-22 16:26,,2025-10-22 17:00,elocal,rthk,https://news.rthk.hk/rthk/en/component/k2/1828260-20251022.htm,"Ocean Park has seen revenues rise for a fourth consecutive year, up by 9 percent, with visitor numbers soaring as the preservation-focused theme park leveraged on the ""Panda mania"" to create green shoots of business growth.

However, a statement released by the park on Wednesday also showed that its total deficit continues to widen to HK$274.7 million, up from HK$71.6 million a year earlier, partly due to higher expenses and losses from its Water World attraction.

Total revenues rose to HK$1.28 billion for the period ending in June, with income from consumption, which includes food and beverage as well as experiential services such as closer interactions with giant panda bears, reaching HK$110 million, up 35 percent.

Revenue from commodities such as souvenirs reached HK$173 million, an increase of 20 percent.

The park recorded an operating surplus of HK$42.4 million, a return to the black from the HK$17.2 million deficit of a year earlier.

Chairman Paulo Pong said the park had ""reached important breakthroughs"" in operations, conservation and education, while an ""unprecedented panda craze"" had helped boost consumption and extra income.

""The six giant pandas from three generations living in the park have brought a leverage effect to our conservation and education efforts.

""It also enables the park to connect with a wider audience and creates unprecedented opportunities for business growth, "" he said.

Noting that the park has seen the number of its giant pandas increasing rapidly over ""just several months"", Pong said the number of panda-themed products also soared to be over 600, tripling the previous number, while accounting for 39 percent of the park's total sales of souvenirs.

The park, he added, had also leveraged its self-developed intellectual property called ""Panda Friends"" by collaborating with 24 brands or companies to produce merchandise. 

The six pandas, including the locally-born cubs, Jia Jia and De De, as well as their mother Ying Ying and father Le Le, along with another pair that Beijing gifted to the SAR earlier, have also given the park a higher international profile that has brought in more visitors.

In total, it has attracted 3.46 million visitors in the 2024-25 financial year, up 10 percent from 3.14 million previously.

Of these, about two thirds were locals, with their numbers rising to 2.21 million, up 9 percent. 

Non-local visitors rose by 12 percent to reach 1.25 million, with those from the United States, Australia and India seeing the highest growth.

To celebrate its upcoming 50th anniversary in 2027, the park expects to further build on the momentum generated by panda fever and expand exhibition areas for the giant pandas while introducing new facilities, such as upgrades to the ones featuring sloths.

A brand new Adventure Zone is also expected to open in 2028.

Putting a dampener on things was Water World's continuing to be in the red, with the latest deficit from operations hitting HK$148.3 million, but the losses narrowed by almost 20 percent."
印尼央行出乎意料維持利率不變,2025-10-22 16:25,,2025-10-22 17:00,cfinance,rthk,https://news.rthk.hk/rthk/ch/component/k2/1828272-20251022.htm,"印尼央行出乎意料維持指標利率於4.75厘不變，市場原先估計減息0.25厘。隔夜存款利率、貸款利率，分別維持於3.75厘及5.5厘。

央行指，利率決定與通脹前景一致，預料直至明年，通脹仍將保持於目標區間。通脹受控，未來仍有進一步減息空間，但減息時機將逐月決定。

央行又說，將評估至今貨幣政策傳導的有效性、經濟及通脹前景、印尼盾的穩定性，以確定進一步減息空間。"
梁君彥回顧本屆立法會稱扭轉過去多年內耗和困局　重回理性務實,2025-10-22 16:21,,2025-10-22 17:00,local,rthk,https://news.rthk.hk/rthk/ch/component/k2/1828274-20251022.htm,"立法會主席梁君彥回顧本屆立法會的工作，表示今屆議會是完善選制、落實愛國者治港原則後產生的首屆立法會，形容成功扭轉過去多年的內耗和困局，重回理性務實的正軌，他以「志不求易、事不避難、建言有為、實幹有成」來總結今屆立法會的表現。

梁君彥說，4年會期共通過130項法案，比上屆81項多出超過六成，提到今屆立法會政府就法案提出的修正案，有近一半是吸納了議員意見，顯示行政機關從善如流，而立法會做到「配合不制肘，監察不刁難」，是行政立法良性互動的最佳示範。其中在今年會期，立法會共通過41項政府法案和兩項議員法案，部分是處理香港「老大難」問題，包括規管簡樸房及網約車服務。而《同性伴侶關係登記條例草案》雖然未獲通過，但過程公開透明，彰顯法治精神，體現行政、立法和司法機構各司其職、互相尊重和制衡。

梁君彥表示，立法會議員守則將在下屆立法會實施，相信立法會能更好發揮憲制職能，協助特區政府提升治理水平。他說自己出任議員21年，其中9年擔任立法會主席，見證由亂到治、由治及興的新境界，他感到無比光榮，一定銘記於心。

對於內會主席李慧琼早前撤回動議「告別議案」，惜別午宴取消，有意見認為議會發表意見的空間不大或「低氣壓」。梁君彥說，在「愛國者治港」下議員有很多空間，議員應聚焦民生，配合政府施政，又認為議會內外議員都能暢所欲言，相信所謂「氣壓低」，議員可能只是離愁別緒。他又認為議員只要見到今屆立法會成績表亮麗，真正為市民做事，相信他們會感到開心。

被問到換屆選舉投票率，梁君彥認為並無硬指標，呼籲市民盡公民責任投票。對於有多名現任議員不競逐連任，他重申每屆選舉都有議員不尋求連任，並非特別，亦不需要大做文章。"
今年至9月緝獲97宗非法出租或取酬載客個案　比去年全年倍增,2025-10-22 16:15,,2025-10-22 17:00,local,rthk,https://news.rthk.hk/rthk/ch/component/k2/1828273-20251022.htm,"運輸及物流局局長陳美寶表示，警方持續在各區採取執法行動，打擊非法出租或取酬載客，今年至9月已緝獲97宗個案，相比去年全年的47宗已倍增。有39宗案件已經由法庭定罪，涉及39名司機。另外7宗已進入司法程序，其餘51宗案件正在調查。

陳美寶書面回覆立法會議員質詢表示，在被定罪的案件當中，涉案司機被判罰款1200元至6000元不等。其中個別涉及違反逗留條件的司機，除了罰款，更加被判監禁兩星期至兩個月不等。另外，有24名司機被取消駕駛執照12至15個月不等。在被判定罪的個案中，有20輛車輛已被扣押或已排期扣押6個月。

她又說，政府將透過剛通過的規管網約車服務條例草案，進一步加強針對非法出租或取酬載客的罰則，訂明被定罪的司機須被取消駕駛執照至少12個月，並可長達3年；以及強化暫時吊銷相關車輛牌照及扣押車輛的安排，讓政府在未能識辨涉事司機以作出刑事檢控的情況下，仍然有機制可扣押涉案車輛，加強阻嚇力。"
特朗普稱未必會晤習近平　外交部：兩國元首保持著密切交往溝通,2025-10-22 16:09,,2025-10-22 17:30,greater_china,rthk,https://news.rthk.hk/rthk/ch/component/k2/1828270-20251022.htm,"美國總統特朗普表示，預計在下周舉行的亞太經合組織峰會上中美會在貿易問題達成協議，但中美元首未必會晤。

在北京，外交部發言人郭嘉昆回應說，元首外交對中美關係發揮著不可替代的戰略引領作用，中美兩國元首保持著密切的交往和溝通。"
特朗普稱美中元首未必會晤　外交部：兩國元首保持著密切交往溝通,2025-10-22 16:09,,2025-10-22 17:00,greater_china,rthk,https://news.rthk.hk/rthk/ch/component/k2/1828270-20251022.htm,"美國總統特朗普表示，預計在下周舉行的亞太經合組織峰會上中美會在貿易問題達成協議，但中美元首未必會晤。

在北京，外交部發言人郭嘉昆回應說，元首外交對中美關係發揮著不可替代的戰略引領作用，中美兩國元首保持著密切的交往和溝通。"
陳美寶：現階段無計劃為的士行業輸入外勞,2025-10-22 16:07,,2025-10-22 17:00,local,rthk,https://news.rthk.hk/rthk/ch/component/k2/1828269-20251022.htm,"運輸及物流局局長陳美寶表示，由於的士司機要熟悉本地道路網絡及交通系統，同時需要與乘客溝通調整路線，與擁有固定站點和路線的小巴或非專營巴士不同，現階段政府無計劃為的士行業輸入外勞。

陳美寶出席立法會大會回覆議員質詢表示，截至今年8月，40歲以下的士駕駛執照持有人約為18200人，較2019年增加超過5成。現時活躍的士司機約為46000人，至於持有的士駕駛執照人士是否選擇成為活躍的士司機，涉及多方面因素，政府會繼續留意行業人手，推出多項措施吸引新人加入。

另外，陳美寶說，政府一直按需要為的士車隊提供支援，包括安排車隊營運者參加由勞工處舉辦的地區及招聘會。有關招聘會及措施，吸引來自的士行業以外的求職者查詢，並成功招聘超過100名新人改行加入車隊，政府將繼續支援車隊招聘司機。"
外交部：中方希望歐方恪守支持自由貿易　反對貿易保護主義的承諾,2025-10-22 15:51,,2025-10-22 16:15,greater_china,rthk,https://news.rthk.hk/rthk/ch/component/k2/1828268-20251022.htm,"商務部部長王文濤應約與歐盟委員會貿易和經濟安全委員謝夫喬維奇通話。

路透社報道，謝夫喬維奇說，王文濤接受邀請本星期到布魯塞爾訪問，就中國收緊稀土出口管制措施，尋求緊急解決方案。

在北京，外交部發言人郭嘉昆說，中歐經貿關係的本質是優勢互補、互利共贏。中方希望歐方恪守支持自由貿易、反對貿易保護主義的承諾，為各國企業提供公平透明、非歧視的營商環境，以實際行動維護市場經濟和世貿組織規則，堅持通過對話協商妥善解決貿易分歧。"
海關打擊跨境轉運冒牌波鞋　檢1.8萬件懷疑冒牌貨市值1千萬元,2025-10-22 15:47,,2025-10-22 16:15,local,rthk,https://news.rthk.hk/rthk/ch/component/k2/1828267-20251022.htm,"海關本月6至17日採取特別執法行動，打擊跨境轉運冒牌鞋類物品活動，偵破9宗案件，檢獲1.8萬多件懷疑冒牌物品，估計市值1000萬元。

版權及商標調查科版權及商標跨境調查組調查主任楊鐵楓說，得到物流業界充分支持和合作，在多個物流中心偵破7宗轉運冒牌鞋類物品案件，亦在港珠澳大橋香港口岸偵破2宗涉及入境貨車轉運冒牌物品案，拘捕2名分別59和65歲男司機，有關物品全部運往海外，目的地為美洲和歐洲地區。

他表示，留意到檢獲的物品和不法分子作案趨勢有3個特點，首先是對應國際波鞋展覽盛事，冒牌波鞋絕大部分是不同運動及奢侈品的品牌，屬於非常熱門及炒賣款式，個別款式價格可達到原價5至10倍，部分罕有款式價錢甚至是10倍以上，而且仿真度極高、造工仔細，一般消費者難以分辨真假，部分鞋款包裝盒更有僞造專門店單據，意圖降低消費者警覺性。

他又說，第二是冒牌波鞋有連同其他配件，抄襲不同國際知名奢侈品交易平台的已認證標簽或索帶，以欺騙和誤導消費者；第三是發現尚未正式推出市場或剛推出市場一、兩個星期的款式，反映不法分子對市場需求有一定掌握，捕捉消費者追新款心理，將相關款式快速流入市面應市。"
