title,date,summary,scrape_time,section,source,url,news_content
十五運會｜陳百里深信港台定能發揮專業精神宣揚國家高水平運動,2025-10-30 16:16,,2025-10-30 16:45,local,rthk,https://news.rthk.hk/rthk/ch/component/k2/1829387-20251030.htm,"署理商務及經濟發展局局長陳百里表示，今屆全運會意義非凡，是首次由廣東、香港、澳門三地共同承辦，不單是粵港澳大灣區合作融合的重要里程碑，更是突破邊界的創新實踐，除了體現香港統籌賽事和跨境協作能力，亦展示灣區一小時生活圈互聯互通的優勢，推動粵港澳大灣區體育產業的聯動發展。

香港電台舉行「全城起動　港台啟航　十五運會、殘特奧會啟動禮」，陳百里致辭時說，今屆全運會香港承辦8個競賽項目，不單帶來非常寶貴大型賽事經驗，也有利香港運動員把握主場之利衝擊獎牌。他說，全運會作為國家最高水平的運動會，除了吸引大批旅客來港欣賞賽事，也可帶動香港市民外出消費，帶旺場館周邊的餐飲和零售等行業。

陳百里說，全運會期間，港台會廣泛播放不同賽事，深信港台團隊一定能夠發揮一貫的專業精神和高水準的製作，向廣大市民宣揚國家高水平的競技運動。

廣播處長關婉儀在啟動禮致辭時表示，香港電台兩年多前已陸續在設備和節目製作方面著手準備，朝著智慧廣播大方向投入資源，提升硬件配套及傳播系統，包括在中山紀念公園傳媒體育中心設立配備齊全的製作間，以光纖、5G和雲端技術即時和穩定地接收和傳送各個賽區的比賽情況。另外，港台電視大樓一號和二號錄影廠也做了優化，全面應用了AR、融合了XR的技術，大大提升製作質素和效率，為觀眾帶來嶄新觀賽體驗。

關婉儀說，港台將由11月2日開始在32台直播重點賽事及港隊參與的賽事。11月9日開幕日起，港台電視三個頻道就會分途出擊。32台全日直播賽事；31台每晚送上1小時賽事精華；新增的36台是共融頻道，提供有口述影像的賽事直播，亦有手語傳譯的一小時賽事精華，照顧不同需要觀眾。

關婉儀又說，全運會期間，港台也肩負另一項很重要工作，就是協助宣傳今年立法會選舉，舉辦選舉論壇、製作節目介紹候選人，並推廣立法會選舉相關資訊。"
按揭中介稱本港銀行減息0.125厘供樓人士每月節省1.6%,2025-10-30 16:14,,2025-10-30 16:45,local,rthk,https://news.rthk.hk/rthk/ch/component/k2/1829386-20251030.htm,"美國聯儲局減息0.25厘。本港3家發鈔銀行先後公布減息0.125厘，最優惠貸款利率（P）降到5厘至5.25厘。

中原按揭董事總經理王美鳳表示，減息後按息減至3.25厘計，貸款額100萬元，還款期30年，每月供款將減少69元或1.6%。

她指出，去年以來銀行減P幅度已累計達0.875厘，完全抵銷上一次加息周期的加幅，銀行基本活期存款息率亦降至零水平，相信減P周期已完成。但若美國進一步減息，將逐步推低港元拆息，當1個月拆息低於1.95厘，H按息將跌穿封頂息，預期明年按息或進一步下跌。另外，存款利率歸零將推動資金尋求較好回報，預料可鞏固樓市走勢。

星之谷按揭轉介行政總裁莊錦輝形容，P重返5厘已達到2008年金融海嘯後維持近十年的低位平台，將是今輪減息周期堅實底部。他認為，個別銀行早前推出首3年或5年2.73厘定息按揭計劃具吸引力。"
按揭中介稱最優惠利率下降周期已完成　按息或跟隨港元拆息下調,2025-10-30 16:14,,2025-10-30 16:30,cfinance,rthk,https://news.rthk.hk/rthk/ch/component/k2/1829386-20251030.htm,"美國聯儲局減息0.25厘。本港3家發鈔銀行先後公布減息0.125厘，最優惠貸款利率（P）降到5厘至5.25厘。

中原按揭董事總經理王美鳳表示，減息後按息減至3.25厘計，貸款額100萬元，還款期30年，每月供款將減少69元或1.6%。

她指出，去年以來銀行減P幅度已累計達0.875厘，完全抵銷上一次加息周期的加幅，銀行基本活期存款息率亦降至零水平，相信減P周期已完成。但若美國進一步減息，將逐步推低港元拆息，當1個月拆息低於1.95厘，H按息將跌穿封頂息，預期明年按息或進一步下跌。另外，存款利率歸零將推動資金尋求較好回報，預料可鞏固樓市走勢。

星之谷按揭轉介行政總裁莊錦輝形容，P重返5厘已達到2008年金融海嘯後維持近十年的低位平台，將是今輪減息周期堅實底部。他認為，個別銀行早前推出首3年或5年2.73厘定息按揭計劃具吸引力。"
明年第4季有4區開展社區藥房服務　醫管局病人可預約覆配藥物,2025-10-30 16:14,,2025-10-30 16:45,local,rthk,https://news.rthk.hk/rthk/ch/component/k2/1829385-20251030.htm,"社區藥房計劃明年第四季推行，基層醫療署公布社區藥物名冊運作機制，並推出《基層醫療社區藥房指引》。醫務衞生局公布，社區藥房首階段招標會在未來1至2個月進行，先為東區、油尖旺、沙田及元朗區招聘，預計明年第四季，有關4區可開展社區服務。到2027年第四季，全港18區各有4至5間社區藥房。

醫管局的病人屆時求醫後，可先領取首8周藥物，然後病人可聯絡自行選定的社區藥房預約覆配藥物，每次取8周藥物。費用與醫管局藥物收費一致。

社區藥房亦會為「慢病共治計劃」及其他基層醫療健康計劃參加者提供服務。社區藥物名冊主要從醫管局藥物名冊中選取，初期以「慢病共治計劃」藥物名單為基礎，涵蓋逾100項藥物，長遠可望涵蓋達400項藥物，包括預防性藥物、糖尿病及高血壓等慢性疾病管理藥物，以及偶發性疾病藥物。

藥物會以三層分類，第一層以非專利藥物為主，預計可包含逾八成以上的藥種，將按藥項及配發期設單一共付費用；第二層涵蓋個別專利藥物及指定藥物類別，按藥項及配發量會有不同費用；第三層則為特別藥物類別，共付模式待定。

社區藥房的藥物會由醫管局集中採購，確保與公立醫院的藥物一樣安全有效，亦有助降低成本。實際共付額費用將於明年下半年公布，政府將提供資助，確保費用屬市民可負擔水平，比市場價格便宜。"
政府與內地部門舉行會議　交流發展「單一窗口」經驗及加強合作,2025-10-30 15:54,,2025-10-30 16:15,local,rthk,https://news.rthk.hk/rthk/ch/component/k2/1829384-20251030.htm,"商務及經濟發展局和香港海關上星期五與國家口岸管理辦公室、廣東省商務廳及其他相關內地部門，在珠海舉行內港單一窗口合作專家小組首次會議，交流發展「單一窗口」的經驗和加強雙方合作。

商經局發言人表示，政府一直就「單一窗口」的發展與內地當局保持緊密聯繫，繼商經局今年5月與國家海關總署簽訂關於《「單一窗口」的合作安排》，優化交流合作機制，今次專家小組會議重點討論兩地「單一窗口」的最新發展和落實進一步合作，並探討下階段深化合作的建議。

雙方又探討在下一階段將「一單兩報」安排擴展至海運貿易文件的可行性，以省卻重新輸入數據的時間，進一步便利業界。"
立法會選舉｜勞顧會全力支持立法會換屆選舉　籲打工仔踴躍投票,2025-10-30 15:50,,2025-10-30 16:00,local,rthk,https://news.rthk.hk/rthk/ch/component/k2/1829382-20251030.htm,"勞工顧問委員會表示，全力支持立法會換屆選舉。

身兼勞顧會主席的勞工處處長許澤森表示，勞顧會呼籲全港機構及企業積極響應政府倡議，為僱員提供便利，協助他們履行投票的公民責任。同時呼籲所有打工仔當日踴躍投票，選任賢能，共建美好香港。
　　　"
植田和男冀多觀察美國關稅對日本經濟影響　並關注薪酬談判,2025-10-30 15:40,,2025-10-30 15:45,cfinance,rthk,https://news.rthk.hk/rthk/ch/component/k2/1829379-20251030.htm,"日本央行維持短期利率目標0.5厘不變。央行總裁植田和男表示，海外經濟和貿易政策不確定性仍高，因此會議未有加息。

他表示，必須關注美國關稅政策對金融、外匯市場、日本經濟及物價的影響，特別是對汽車行業薪酬談判的影響。

他又表示，基礎通脹將逐步上升，並在預測期後半段達到價格穩定目標水平。日本經濟溫和復蘇，但仍存在一些疲弱跡象，認為寬鬆貨幣政策將支持經濟。但他對下次加息時間沒有預設想法，指出需要更多數據才能決定調整貨幣政策的寬鬆程度。

植田和男提到，如果經濟和物價走勢符合預期，隨著兩者改善，將繼續提高政策利率。"
特派員公署邀請10國官員訪港　陳國基與代表團交流意見,2025-10-30 15:37,,2025-10-30 16:00,local,rthk,https://news.rthk.hk/rthk/ch/component/k2/1829380-20251030.htm,"政務司司長陳國基表示，在國家外交部及外交部駐香港特別行政區特派員公署的邀請和安排下，來自孟加拉國、不丹、吉爾吉斯斯坦、緬甸、土庫曼斯坦、烏茲別克斯坦、東帝汶、蒙古、塔吉克斯坦和汶萊共10個國家的官員正訪問香港。他今天與代表團共進午宴，就不同議題暢談並交流意見。

陳國基在社交專頁說，他向代表團介紹香港的最新發展與未來機遇，特別強調香港在「一國兩制」下，擁有背靠祖國、聯通世界的獨特優勢，既是連接內地與「一帶一路」國家之間的「超級聯繫人」，更是具增值能力的「超級增值人」。

他說，鼓勵代表團成員善用香港國際化、市場化和便利的營商環境，以及專業服務人才匯聚的優勢，開拓全球商機。午宴後代表團轉到西九文化區參觀，為未來進一步推動文化藝術以至人文交流合作奠定基礎。"
證監會：內地與香港監管機構攜手努力下　京港發展帶來強大新動能,2025-10-30 15:35,,2025-10-30 15:45,cfinance,rthk,https://news.rthk.hk/rthk/ch/component/k2/1829377-20251030.htm,"證監會主席黃天祐表示，深信在內地與香港監管機構攜手努力下，兩地資本市場必能把握歷史機遇，構建更強韌、更創新、更多元的發展平台，更有效服務企業、金融機構和廣大投資者，為京港發展帶來強大新動能。

黃天祐指出，內地與香港市場互聯互通進入第11年，有效促進資金雙向流動。同時，內地企業善用香港強大的國際集資平台，今年前9個月在香港招股上市集資1400億港元，突顯香港在「一國兩制」下獨特優勢，以及國際資金對內地發展高度認可。

他又說，北京企業在港股市值與數量均佔重要地位。未來歡迎更多創新及傳統產業企業，進一步利用香港國際融資平台，在獲得資金的同時，透過股東結構更多元化來提升公司治理，進一步促進績效管理以釋放價值，並且推動核心價值傳承。"
滬指失守4000點關口收市　創指跌近2%,2025-10-30 15:23,,2025-10-30 15:45,cfinance,rthk,https://news.rthk.hk/rthk/ch/component/k2/1829373-20251030.htm,"內地股市反覆低收，滬指失守4000點關口，創業板指數跌近2%。煤炭開採加工、遊戲、證券相關股份下跌；能源金屬、風電設備、港口航運等股份則上升。

上證綜合指數收市報3986點，跌29點，跌幅0.73%。

深證成份指數報13532點，跌159點，跌幅1.16%。

創業板指數報3263點，跌61點，跌幅1.84%。"
商務部：美方取消對中國商品加徵10%芬太尼關稅,2025-10-30 15:20,,2025-10-30 15:30,greater_china,rthk,https://news.rthk.hk/rthk/ch/component/k2/1829375-20251030.htm, 
立法會選舉｜鄧炳強：勸人投白票或不投票或違國安法　會果斷執法,2025-10-30 15:14,,2025-10-30 15:30,local,rthk,https://news.rthk.hk/rthk/ch/component/k2/1829374-20251030.htm, 
習近平稱中美團隊應不斷壓縮問題清單　強調對話比對抗好,2025-10-30 14:54,,2025-10-30 15:15,greater_china,rthk,https://news.rthk.hk/rthk/ch/component/k2/1829372-20251030.htm,"國家主席習近平在南韓釜山與美國總統特朗普舉行會晤。習近平指出，兩國經貿團隊就重要經貿問題，深入交換意見，形成解決問題的共識，雙方團隊要盡快細化及敲定後續工作，將共識維護好、落實好，以實實在在的成果，為中美兩國和世界經濟吃下一顆「定心丸」。

習近平說經貿應該繼續成為中美關係的壓艙石及推進器，而不是絆腳石和衝突點，雙方應該算大賬，多看合作帶來的長遠利益，而不應陷入相互報復的惡性循環。雙方團隊可繼續本著平等、尊重、互惠的原則談下去，不斷壓縮問題清單，拉長合作清單。習近平強調對話比對抗好，中美之間各渠道、各層級應保持溝通，增進了解。

新華社報道，特朗普表示美中關係一直很好，將來會更好，希望中美未來都更加美好，又說中國是美國最大的伙伴，兩國攜手可以在世界上做成很多大事，未來美中合作會取得更大成就。"
十五運會｜入境處代表團出席重慶舉行出入境聯繫協作機制會議,2025-10-30 14:54,,2025-10-30 15:15,local,rthk,https://news.rthk.hk/rthk/ch/component/k2/1829371-20251030.htm,"入境處處長郭俊峯率領入境處代表團，出席在重慶市舉行的內地與港澳特區出入境管理部門「1+2」聯繫協作機制會議，與中華人民共和國出入境管理局、澳門特別行政區治安警察局及身份證明局，就十五運會出入境管理服務工作及證件簽發、口岸通關及人才流動等多個出入境工作範疇進行交流。
　　 
郭俊峯在會議上表示，為確保十五運會在安全有序的環境下舉行，入境處將全面加強與內地及澳門出入境部門的協作，提前做好出入境管理服務工作部署，為參賽及辦賽人員提供安全高效的出入境服務，保障賽事順利舉行。
　　 
會議上，三地機關亦就便利內地與港澳居民的往來以及運用創新科技提升服務等重點議題進行交流，達成系列共識。當中包括研究擴大往來港澳人才簽注政策實施範圍、進一步提升證件辦理便利度和通關效率、完善居留及服務配套安排，為三地民眾提供更便捷、高效及優質的出入境服務。"
警方國安處落案起訴兩名男子串謀煽惑暴動等罪　下午提堂,2025-10-30 14:48,,2025-10-30 15:00,local,rthk,https://news.rthk.hk/rthk/ch/component/k2/1829370-20251030.htm,"警方國安處落案起訴前日被捕的兩名32歲及34歲男子。兩人合共被控一項「串謀煽惑暴動」罪，其中32歲男子另被控以一項「煽惑暴動」罪。案件於今日下午在西九龍裁判法院提堂。

國安處昨日下午突擊搜查九龍一個單位，檢獲3把複合弓，連同12支箭及兩把武士刀。一名46歲男子因涉嫌「管有攻擊性武器並有所意圖」罪名被捕，正被扣查。"
​文昌運輸涉貨物裝卸碼頭致命工業意外　被罰20萬元,2025-10-30 14:46,,2025-10-30 15:00,local,rthk,https://news.rthk.hk/rthk/ch/component/k2/1829369-20251030.htm,"​文昌運輸有限公司因違反《工廠及工業經營條例》的規定，被勞工處檢控，今日在觀塘裁判法院被判罰款20萬元。
 
案情涉及一宗於去年9月在油麻地一個貨物裝卸碼頭發生的致命意外。一名工人協助將一台重型烹飪設備從貨車的尾板卸下時，該設備突然翻倒，並從尾板墮下，將工人砸斃。"
韓股高收0.1%創新高,2025-10-30 14:46,,2025-10-30 15:00,cfinance,rthk,https://news.rthk.hk/rthk/ch/component/k2/1829368-20251030.htm,南韓股市創新高，首爾綜合指數高見4146點，收市報4086點，升5點，升幅0.14%。
APEC 2025 ｜丘應樺發言稱須確保科技發展惠及所有產業,2025-10-30 14:41,,2025-10-30 15:00,local,rthk,https://news.rthk.hk/rthk/ch/component/k2/1829367-20251030.htm,"商務及經濟發展局長丘應樺在南韓慶州出席APEC亞太經合組織的部長級會議。

丘應樺在會上發言時表示，數碼技術、特別是人工智慧快速發展，中國香港代表團支持深化亞太經合組織經濟體成員之間的數碼合作，促進經濟成長，共同應對挑戰。

丘應樺說推動數碼科技可持續發展，需要加強基礎建設，並推動人工智慧在經濟各領域的深度整合，香港特區一直有採取實際行動，包括去年在數碼港設立的人工智能超算中心、為金融機構推出人工智能「沙盒」、推動中小微型企數碼轉型等。

他提到，必須確保科技發展成果能夠惠及所有產業，香港正致力應對科技發展帶來的「數碼鴻溝」和就業機會流失等問題，包括推出加強就業再培訓措施等，並充分利用亞太經合組織的創新概念「孵化器」能力，推動數碼科技合作。"
日股創新高　收市靠穩,2025-10-30 14:40,,2025-10-30 15:00,cfinance,rthk,https://news.rthk.hk/rthk/ch/component/k2/1829366-20251030.htm,日本股市創新高，日經平均指數高見51657點，收市報51325點，升17點。
許正宇：京港兩地金融合作前景非常廣闊　機遇無限,2025-10-30 14:32,,2025-10-30 15:00,local,rthk,https://news.rthk.hk/rthk/ch/component/k2/1829362-20251030.htm,"財經事務及庫務局局長許正宇表示，京港兩地金融合作前景非常廣闊、機遇無限。香港將繼續發揮「超級聯繫人」和「超級增值人」角色，助力國家「走出去」和「引進來」戰略實施。

許正宇在金融街論壇年會「京港聯動　共贏未來」平行論壇上致辭，表示國家強調金融服務實體經濟，加快構建現代化金融市場體系，並持續推進金融業對外開放，京港在這一進程中擁有廣闊合作空間。他提到，截至9月底，接近230家北京企業在香港上市，總市值近13萬億港元，佔香港股票市場市值大約四分之一，累計融資超過3萬億港元。北京企業來港上市，既滿足自身融資需要，亦推動香港資本市場發展。

他提到，本港合資格企業財資中心享有利得稅減半優惠，吸引不少總部位於北京的內地企業到香港設立財資中心，管理現金、融資、外匯及對沖業務，降低財務成本。逾140間企業，當中包括40多間總部位於北京的企業，計劃或已在香港設立財資中心。政府正研究優化稅務寬減，預計明年上半年完成。

許正宇又指出，內地與香港基金互認安排認可82個基金，截至今年7月銷售淨額超過1100億元人民幣。政府亦鼓勵內地企業在香港設立專屬自保保險公司，在內地10家自保公司中，6家在香港成立，包括中海油、中石化及中廣核等國企，體現香港作為自保保險中心的吸引力。"
台股收市變動不大,2025-10-30 14:24,,2025-10-30 15:00,cfinance,rthk,https://news.rthk.hk/rthk/ch/component/k2/1829365-20251030.htm,台灣股市收市變動不大。加權指數收市報28287點，跌7點。
StanChart 'to hit key profit target a year earlier',2025-10-30 14:18,,2025-10-30 14:30,efinance,rthk,https://news.rthk.hk/rthk/en/component/k2/1829363-20251030.htm,"Standard Chartered said it would hit a key profitability target a year earlier than expected after posting a 3 percent increase in third-quarter earnings on the back of strong revenue in its wealth, global banking and markets businesses.

The London-headquartered lender, which earns most of its revenue in emerging markets in Asia and Africa, reported on Thursday a pretax profit for the third quarter of US$1.77 billion. That compared with US$1.72 billion a year earlier and beat the US$1.52 billion average of 14 analyst estimates compiled by the bank.

StanChart said it now expected income growth this year to be at the top end of its 5 percent to 7 percent guidance range, whereas in July it had forecast results around the bottom end.

That means it will reach its goal of a 13 percent return on tangible equity, a key profitability metric, in 2025 rather than an earlier forecast of 2026.

The bank's Hong Kong-listed shares extended gains after the results release, rising more than 3 percent.

StanChart's results showed strong performance across its businesses, particularly in wealth management, and suggested the bank will likely upgrade its medium-term targets for 2026 and beyond when it reports full-year results in February, Jefferies analyst Joe Dickerson said.

StanChart CEO Bill Winters said in a statement that a ""sharper strategic focus on servicing our clients' cross-border and affluent banking needs is paying off"" with double-digit growth in wealth solutions and global banking.

Wealth management income shot up by 27 percent in the third quarter, with inflows and the number of new accounts rising on demand for wealth advice amid market volatility.

StanChart has said it will target US$200 billion in new assets and double-digit growth in income from its wealth business over the next five years as part of its wider strategy to shift to higher-fee-earning businesses.

Non-interest income for the quarter rose 12 percent to US$2.4 billion from a year ago, ahead of analysts' consensus of US$2.3 billion.

The bank's capital markets and advisory fee income grew 33 percent during the period, as a rebound in corporate confidence drove increased mergers and acquisitions this year, despite tariffs and economic uncertainty.

StanChart's London-listed shares have risen 53 percent this year, outpacing a 37 percent gain for rival HSBC. (Reuters)"
習近平指中美可共同展現大國擔當　特朗普稱下調對華進口商品關稅,2025-10-30 14:16,,2025-10-30 14:30,greater_china,rthk,https://news.rthk.hk/rthk/ch/component/k2/1829364-20251030.htm,"國家主席習近平與美國總統特朗普在南韓釜山的會晤結束，歷時約1小時40分鐘。兩人離開會談場地、金海國際機場貴賓室會見廳時再握手。

習近平在會晤時說，中美時而有摩擦很正常，面對風浪挑戰，他與特朗普作為掌舵人應當把握好方向，駕馭大局，讓中美關係這艘大船平穩前行，兩國可共同展現大國擔當，攜手多辦有利於兩國及世界的大事、實事、好事。習近平之後乘坐專車前往慶州，繼續亞太經合組織領導人非正式會議及國事訪韓行程。

特朗普就結束訪韓行程。他在空軍一號說會談非常好，作出很多決定，對華進口商品徵收的關稅將從57%下調至47%，又說中方將大力遏止芬太尼出口，美方會將與芬太尼相關的中國商品關稅從20%降至10%。特朗普指中國將立即開始購買大量美國大豆及其他農產品，雙方亦就稀土問題達成為期一年的協議，一年後將延期。"
