title,date,summary,scrape_time,section,source,url,news_content,link,description
Govt to step up national security education,2025-03-29 14:12,,2025-03-29 14:30,elocal,rthk,https://news.rthk.hk/rthk/en/component/k2/1798009-20250329.htm,"Secretary for Constitutional and Mainland Affairs Erick Tsang said on Saturday the government will step up its promotion on national security education next month, to achieve patriotism everywhere. 

His remarks came as the SAR prepares to mark National Security Education Day on April 15.

In an interview with a local newspaper, Tsang pointed out that the Constitutional and Mainland Affairs Bureau will coordinate with relevant departments to promote national security at various levels.

The minister pointed out that since the Working Group on Patriotic Education was set up last year, it has strengthened national history and culture, as well as national affairs education on different fronts to widely promote the spirit of patriotism.

Looking ahead, the group will adopt short-, medium- and long-term goals and measures, Tsang said, adding that his bureau will continue to attach great importance and enhance national security education.",,
報道指緬甸首都內比都國際機場航空管制塔倒塌估計至少5死,2025-03-29 13:48,,2025-03-29 14:15,cinternational,rthk,https://news.rthk.hk/rthk/ch/component/k2/1798010-20250329.htm,"緬甸中部7級以上強烈地震，軍政府說死亡人數超過1千人，逾2千人受傷。

有傳媒說，首都內比都國際機場航空管制塔倒塌，估計至少5名人員死亡。

緬甸領導人敏昂萊上午乘坐直升機，抵達重災區曼德勒省視察災情。

中方表示，暫時未有中國公民死亡報告。中國派出多支救援隊伍趕赴災區協助搜救。國家主席習近平向敏昂萊致慰問電。習近平表示，對遇難者表示深切哀悼，向遇難者家屬、傷者和災區民眾致以誠摯慰問。

地震亦波及泰國，在曼谷翟道翟正在興建中的審計署辦公大樓倒塌，大約100名建築工人下落不明，當局發現至少15名被困人士的生命跡象，但礙於倒塌的規模和瓦礫重量，搜救行動面臨重大挑戰。",,
特區政府救援隊前赴緬甸　李家超及多名官員將到機場送行,2025-03-29 13:25,,2025-03-29 13:45,local,rthk,https://news.rthk.hk/rthk/ch/component/k2/1798008-20250329.htm,"特區政府派出保安局、消防處、入境處和醫管局人員組成的救援隊前往緬甸，協助地震災區的搜救工作。
　　 
行政長官李家超、保安局局長鄧炳強、醫務衞生局局長盧寵茂及消防處處長楊恩健下午將到機場送行。",,
緬甸強烈地震死亡人數超過1千人,2025-03-29 13:10,,2025-03-29 13:15,cinternational,rthk,https://news.rthk.hk/rthk/ch/component/k2/1798006-20250329.htm, ,,
157人涉太空油毒品被捕　蕭澤頤稱不擔心採用試紙令個案變隱蔽,2025-03-29 13:09,,2025-03-29 13:15,local,rthk,https://news.rthk.hk/rthk/ch/component/k2/1798005-20250329.htm,"政府上月14日刊憲將太空油毒品主要成分依托咪酯及3種類似物列為毒品。警務處處長蕭澤頤表示，刊憲後至到前日，警方共拘捕120宗與太空油毒品有關案件，拘捕157人。當中37人是21歲以下人士，其中16人是學生。

蕭澤頤表示，這些個案有70宗發生在街上或公共場所，其餘則在非公眾地方。他說，去年吸食太空油情況比前一年嚴重很多，警方已採取不同措施，包括更多情報主導行動、加強巡邏，並在今年1月利用試紙去測試藏有或吸食太空油毒品的嫌疑人。他不擔心刊憲及採用試紙會令個案變得更隱蔽，選擇到隱蔽場所吸食。

他又說，除了靠警方執法或蒐集情報，也要靠學校、社工或家長等持分者，共同合作處理太空油毒品問題。",,
Hong Kong sends rescue team to quake-stricken Myanmar,2025-03-29 13:06,,2025-03-29 13:15,elocal,rthk,https://news.rthk.hk/rthk/en/component/k2/1798001-20250329.htm,"Chief Executive John Lee on Saturday said Hong Kong will send a search and rescue team to Myanmar, after a magnitude 7.7 earthquake struck the country.

The massive quake which struck central Myanmar on Friday, also affected neighbouring Thailand, and has killed more than 700 people in both countries so far.
 
In a Facebook post, the CE expressed condolences to the victims on behalf of all Hongkongers and the government.   

He said his administration would provide the rescue team the support they need to ensure they complete their task safely and smoothly. 

“The search and rescue team will do their utmost to help save lives on the ground,” he wrote.

“Upon receiving the order, this group of elite rescuers quickly assembled and will head to the disaster area in a short period of time, demonstrating their selfless and professional spirit.”",,
七欖移師啟德舉行　蕭澤頤稱整體運作暢順已與運輸署商討改善安排,2025-03-29 13:05,,2025-03-29 13:15,local,rthk,https://news.rthk.hk/rthk/ch/component/k2/1798004-20250329.htm,"一連三日的香港國際七人欖球賽昨日首度移師啟德體育園主場館舉行，警務處處長蕭澤頤表示，昨日的交通管制、人流進場或離場等整體運作非常暢順。

蕭澤頤表示，昨日全日人流約33000人左右，整體秩序暢順；當中可能缺乏的士等交通工具，當局已即時與運輸署商討，如何改善今日和明日的安排。他說，在人群管理方面，昨日試用新的公共安全管理系統，利用人工智能並透過園區閉路電視的影像，分析人流和車流密度。

緬甸昨日發生地震，蕭澤頤向所有可能失去家人的人以及傷者致以深切慰問。他說，目前尚有3宗涉及緬甸電騙案被困當地的港人個案，保安局聯同入境處及警隊成立的專責小組正密切跟進案件，已聯繫到並知道剩餘港人目前安全，希望能盡快安排他們回港與家人團聚。

蕭澤頤的任期下月屆滿，他說，警務處處長的任免由行政長官提名，要等待中央政府去決定任命，目前會繼續努力做好處長的工作。",,
緬甸領導人視察重災區　曼谷倒塌大樓發現至少15人生命跡象,2025-03-29 12:51,,2025-03-29 13:15,cinternational,rthk,https://news.rthk.hk/rthk/ch/component/k2/1798003-20250329.htm,"緬甸中部7級以上強烈地震，在重災區曼德勒省造成至少694人死亡，1670人受傷，暫時未有中國公民死亡報告，緬甸領導人敏昂萊上午乘坐直升機，抵達曼德勒省視察災情。中國派出多支救援隊伍趕赴災區協助搜救。

地震導致泰國曼谷出現強烈震感，其中翟道翟正在興建中的審計署辦公大樓倒塌，大約100名建築工人下落不明，當局發現至少15名被困人士的生命跡象，但礙於倒塌的規模和瓦礫重量，搜救行動面臨重大挑戰。有失蹤者家屬到場等候消息。

位於中緬邊境的雲南瑞麗亦受地震影響，近850戶房屋受損，涉及2840人，有兩人受輕傷。",,
有來自泰國旅客對地震感到震驚　有轉機旅客指曼谷機場有較多旅客,2025-03-29 12:45,,2025-03-29 13:00,local,rthk,https://news.rthk.hk/rthk/ch/component/k2/1798002-20250329.htm,"緬甸中部7級以上強烈地震，泰國曼谷出現強烈震感。機管局表示，截至今早10時半，有5班來往泰國的航班，包括2班到港及3班離港航班延誤，未有航班取消。

在機場，有抵港的泰國旅客表示，地震發生時在25樓，當時感到震驚，而到今日巿面情況已經較昨日好。

亦有旅客表示，昨日是人生首次遇到地震，當時見到窗簾都晃動。亦有經曼谷轉機到港的旅客表示，機場的人數較多，相信部份是滯留旅客，一度擔心航班受影響，最終都順利返港。",,
高拔陞稱會細化公營醫療收費改革流程　聽取市民員工意見多做解說,2025-03-29 12:39,,2025-03-29 12:45,local,rthk,https://news.rthk.hk/rthk/ch/component/k2/1798000-20250329.htm,"政府公布公營醫療收費改革，包括提出急症室收費方面，第三至五類病人的費用升至400元，第一、二類危殆危急的病人獲得豁免。另外，住院門診費用就新設1萬元收費上限。改革方案明年起生效。

醫管局行政總裁高拔陞表示，現在距離生效時間還有大半年，醫管局會利用這段時間，細化各項目的流程和配套，同步聽取市民和員工意見，多做解說，流程亦會盡量簡化和電子化。

高拔陞在一個電視節目又說，1萬元收費上限合適，相信相關申請亦不多，但他舉例，一些急性中風病人，或許真的要住院較長時間，負擔會很重。至於有聲音擔心，由於收費封頂，有人或許認為長者長期留院，較住院舍更好，高拔陞則強調，病人如無醫療需要、根本毋須住院但仍堅持留院，是不太合適。如有病人即使無醫療需要、但因為種種原因，仍要住院一段時間，現時醫管局都有機制處理。

對於今次改革，目標在5年內將政府資助率下調至九成，是否意味未來兩次檢討會再上調公營醫療收費，高拔陞回應說，方案是循序漸進，今日難以知道5年後的情況，強調要視乎市民實際反應，再作決定。",,
"Some people need to seek alternatives to A&E, Lo says",2025-03-29 12:36,,2025-03-29 12:45,elocal,rthk,https://news.rthk.hk/rthk/en/component/k2/1797998-20250329.htm,"The Secretary for Health Lo Chung-mau says he hopes some people can find alternatives to accident and emergency wards at public hospitals at all times when new fees take effect.

From next year, non-critical and non-emergency patients - or those who are classified as category three to five patients - will have to pay HK$400 when they visit A&E, up from the current flat rate of HK$180. 

Authorities hope higher fees for non-critical and non-emergency patients will deter them, so urgent cases can receive prompt care. 

Lo said some patients abused A&E services, such as heading there to get a sick leave certificate.

""Apart from the low charges, A&E are open 24 hours a day, 365 days a-year. It's very convenient, and people don't need to make a booking in advance. You only need to go straight to the wards, which is very convenient. This is necessary for those who are critically ill or need resuscitation,"" he told a Commercial Radio show.

""I said a small group of people abused the system, but some people really misused it... I believe the public need to change this mindset.""

Lo pointed out that if A&E doctors - who were specially trained to save critically ill patients - had to take care of patients with mild illnesses, that would be a waste of resources.

Patients with minor problems should head to their family doctors instead, the health chief said.

Lo also told an RTHK radio programme that almost half of the semi- and non-urgent - or category four and five patients - showed up at A&E between 8am and 4pm. 

During this period, there are definitely other choices than A&E, he said.

Lo emphasised that the revamp was not aimed at helping the government tackle its budget deficit.

We are only aiming to better safeguard patients and reduce wastage, he added.",,
緬甸強震增至694人死逾1600人傷　習近平向敏昂萊致慰問電,2025-03-29 12:32,,2025-03-29 12:45,greater_china,rthk,https://news.rthk.hk/rthk/ch/component/k2/1797999-20250329.htm,"緬甸中部7級以上強烈地震，在當地增至最少694人死亡，1670人受傷，暫時未有中國公民死亡報告，多處有建築物受損，中國派出救援隊趕赴震區。

國家主席習近平向緬甸領導人敏昂萊致慰問電。

地震亦導致泰國曼谷至少10人喪生，約100人仍然失蹤，當局通宵在倒塌建築物的瓦礫堆中搜救。",,
"'Amazing, crazy' action at day two of Rugby Sevens",2025-03-29 12:18,,2025-03-29 12:30,elocal,rthk,https://news.rthk.hk/rthk/en/component/k2/1797997-20250329.htm,"The Hong Kong Sevens entered day two at the new Kai Tak Stadium on Saturday, with both the Hong Kong, China men's and women's squads in action.

Fans are in for a treat for more rugby action at the new venue after organisers said more than 33,700 people filed through the gates on Friday. 

They expect a total attendance of more than 130,000 for the three-day event. 

New Zealand, France and Australia are unbeaten in the women's competitions.

And in the men's, Argentina, Fiji and New Zealand are looking to extend their winning streak.

The SAR's women's squad will face Thailand at 2pm, while the men's side face Japan at 3pm.

France's Valentine Lothoz spoke to RTHK after team France's women's beat Ireland 17-12.

""It was a difficult match because Ireland brought a lot of intensity. We will focus on the tournament, the next game and we will come back stronger.""

The captain of Spain's men's squad, which crushed Great Britain 26-12, described the atmosphere at the new stadium as ""amazing"".

Pol Pla said he looks forward to his side's match later in the day. ""It will be crazy and the atmosphere will be great"".",,
"'Amazing, crazy' action on day two of Rugby Sevens",2025-03-29 12:18,,2025-03-29 16:45,elocal,rthk,https://news.rthk.hk/rthk/en/component/k2/1797997-20250329.htm,"Both the men’s and women’s squads for the SAR on Saturday kept their winning streak alive on day two of the Hong Kong Sevens, which is being played at the brand new Kai Tak Stadium.

The Hong Kong China men’s squad beat Japan 43-21 in the Melrose Claymores competition.

The team’s captain, James Christie – who came up big in the second half – said team effort played a big role in their victory.

“You know it’s all about scoring tries and we all got people who could finish them off, you know, but it’s nice to come on on the end of a nice team try, and that’s what makes us good,” men’s captain James Christie told RTHK after the match.

Earlier, the women’s squad easily saw off their Thai opponents 47-0, with the crowd “absolutely pumping from start to finish,"" Pete Laverick, RTHK's sports correspondent who watched the match at Kai Tak Stadium, said.

Both squads have secured a spot in the Melrose tournament’s finals which will be held on Sunday. 

In the main Sevens tournament, the New Zealand men's squad took down South Africa 17-7 in one of the biggest match ups of the event so far. 

Meanwhile, Australia beat Uruguay in the pool games, winning 28-12. 

Organisers said more than 33,700 people filed through the gates on Friday. 

They expect a total attendance of more than 130,000 for the three-day event.

Hong Kong China men’s captain James Christie described the atmosphere at the new stadium, which has a retractable roof, as “crazy”.

“With the roof open, it’s still as loud, so it’s pretty crazy, especially some of [the people] at the South Stand [who have been here] since 8am I think…Thank you all for coming out, means the world to us.” 
_____________________________
Last updated: 2024-03-29 HKT 16:13",,
特區政府救援隊赴緬甸助搜救　李家超：短時間應召集結展無私精神,2025-03-29 12:11,,2025-03-29 13:15,local,rthk,https://news.rthk.hk/rthk/ch/component/k2/1797996-20250329.htm,"行政長官李家超表示，特區政府將派遣一隊救援隊，今天前往緬甸地震災區協助搜救，盡全力協助當地拯救生命。

李家超在社交專頁表示，緬甸發生強烈地震，多人死傷，他代表特區政府和市民向遇難者表示沉痛哀悼，並向遇難者家屬和災民致以深切慰問。而救援隊接獲指令後，短時間內應召集結前往災區，展現出無私和專業精神。

他說，緬甸災區現時情況仍未穩定，因此救援隊必須做好充分準備，亦要注重自身安全，特區政府將支援救援隊一切所需，支持救援隊安全順利完成工作。",,
李家超：特區政府救援隊前往緬甸地震災區協助搜救,2025-03-29 12:11,,2025-03-29 12:30,greater_china,rthk,https://news.rthk.hk/rthk/ch/component/k2/1797996-20250329.htm,"行政長官李家超表示，特區政府將派遣一隊救援隊，今天前往緬甸地震災區協助搜救，盡全力協助當地拯救生命。

李家超在社交專頁表示，緬甸發生強烈地震，多人死傷，他代表特區政府和市民向遇難者表示沉痛哀悼，並向遇難者家屬和災民致以深切慰問。而救援隊接獲指令後，短時間內應召集結前往災區，展現出無私和專業精神。

他說，緬甸災區現時情況仍未穩定，因此救援隊必須做好充分準備，亦要注重自身安全，特區政府將支援救援隊一切所需，支持救援隊安全順利完成工作。",,
習近平向緬甸領導人敏昂萊致慰問電,2025-03-29 12:10,,2025-03-29 12:30,greater_china,rthk,https://news.rthk.hk/rthk/ch/component/k2/1797994-20250329.htm,"國家主席習近平就緬甸遭受地震，向緬甸領導人敏昂萊致慰問電。

習近平表示，驚悉緬甸遭受強烈地震災害，造成重大人員傷亡和財產損失，代表中國政府和中國人民，對遇難者表示深切哀悼，向遇難者家屬、傷者和災區民眾致以誠摯慰問。

習近平說，中國和緬甸是同甘共苦的命運共同體，兩國人民胞波情誼深厚。中方願意向緬方提供需要的幫助，支持災區人民早日戰勝災害、重建家園。

國務院總理李強同日亦向敏昂萊致慰問電。",,
5班來往香港與曼谷航班延誤　未有航班取消,2025-03-29 11:19,,2025-03-29 11:30,local,rthk,https://news.rthk.hk/rthk/ch/component/k2/1797993-20250329.htm,緬甸中部7級以上強烈地震，泰國曼谷出現強烈震感。機管局表示，截至今早10時半，有5班來往泰國的航班，包括2班到港及3班離港航班延誤，未有航班取消。,,
緬甸強震增至694死逾千六人傷　曼谷當局續搜索倒塌大樓失蹤者,2025-03-29 11:18,,2025-03-29 11:30,cinternational,rthk,https://news.rthk.hk/rthk/ch/component/k2/1797992-20250329.htm,"緬甸中部7級以上強烈地震，官方公布在曼德勒地區造成694人死亡，1670人受傷，多處有建築物受損，電力和通訊亦受阻，軍政府預計死傷人數仍會上升，罕有地要求國際援助。中方表示，暫時未有中國公民死亡報告。

中國雲南救援醫療隊共37人攜帶應急救援物資，從昆明機場坐包機趕赴震區。中國藍天救援雲南隊16名隊員，亦帶同救援裝備物資，從雲南瑞麗經陸路前往緬甸救災。外交部說，中方願意根據緬方需要，盡己所能向緬甸災區提供緊急人道主義救援和支持。

地震亦導致泰國曼谷至少10人喪生，約100人失蹤，其中翟道翟正在興建的審計署辦公大樓倒塌，救援人員通宵搜索，部分失蹤者家屬到場等候消息。",,
美國聯邦航空管理局調查達美客機險些與美軍飛機相撞事件,2025-03-29 11:11,,2025-03-29 11:30,cinternational,rthk,https://news.rthk.hk/rthk/ch/component/k2/1797990-20250329.htm,"美國聯邦航空管理局將調查達美航空客機與美軍飛機險些相撞事件。

當地時間星期五下午三時許，一架達美航空A319客機，在從華盛頓列根國家機場起飛時，差點與一架美國軍機相撞，駕駛艙內碰撞警報響起。

報道指事發時，達美客機上有2名機師、3名機組人員和131名乘客，客機正按照預定計劃，飛往明尼阿波利斯的機場。

根據飛行跟蹤網站資料，涉事的美軍飛機是T-38飛機，在美國空軍作為教練機，用於軍事訓練。當時飛機飛行高度為800英尺。",,
有在曼谷旅遊港人稱地震後到室外暫避　未見有餘震暫不會縮短行程,2025-03-29 11:11,,2025-03-29 11:30,local,rthk,https://news.rthk.hk/rthk/ch/component/k2/1797991-20250329.htm,"緬甸中部7級以上強烈地震，泰國曼谷出現強烈震感，有正在興建中的大樓整幢倒塌。有在當地旅遊的港人表示，地震後撤出室內，其後返回酒店，由於巿面未見有太大影響，暫時應該不會縮短行程。

港人蕭先生與太太到曼谷旅遊，地震時在室內購物，地震後現場人士包括店員都顯得慌張及立即撤離，並在室外等候，事後包括鐵路交通都暫時停頓，於是他們步行回酒店。他說，之後一段時間未見有餘震情況，就返回酒店房間，一度考慮是否要縮短行程，但考慮到要更改機票未必順利，加上巿面交通恢復，應該會照原定計劃於星期日返港。

他又表示，透過網上看到航空公司表示會就航班會有安排，但他未有收到航空公司的資訊。",,
'Longer grace period doesn't mean landlords can relax',2025-03-29 11:07,,2025-03-29 11:15,elocal,rthk,https://news.rthk.hk/rthk/en/component/k2/1797986-20250329.htm,"Secretary for Housing Winnie Ho on Saturday said she hoped landlords of subdivided flats would take action to upgrade them, even though they now had a longer grace period to comply with new criteria.

Under the Housing Bureau's latest proposal for a regulatory framework to manage the city’s subdivided units, landlords will be given a 36-month grace period to make necessary improvements so they can be certified as Basic Housing Units.   

The grace period was previously proposed as 12 - or up to 24 months - after a 12-month registration period.

The administration has also introduced a countdown period, starting six months before the end of the grace period.  

During the countdown period, landlords who enter new tenancy contracts for units that haven’t been certified may face a maximum fine of HK$300,000 and be jailed for up to three years.  

Ho told a Commercial Radio programme that she hoped landlords wouldn't leave their renovations until the last minute.

“Just like when we were in university and the lecturer gave us two extra weeks to finish our coursework, some students would just go watch a movie, thinking they had plenty of time. We want to avoid that with landlords. Even though the grace period is extended, we need to introduce some kind of enforcement to ensure they stay on track and don’t get too relaxed,” said Ho.  

Landlords also have to hire a certified professional to assess their units in order to obtain the Basic Housing Unit recognition, which will be valid for five years.  

Ho noted that the list of certified professionals has been expanded to include some 8,000 engineers, which now also feature specialists under the disciplines of fire and building services. 

A fee is payable to the government for the certification process and the housing minister said the charge would be around a few thousand dollars, although the exact amount has yet to be finalised. 

The government’s revised Basic Housing Units legislation will be discussed in Legco's housing panel on Monday.

Meanwhile, the first group of 50 light public housing tenants moved into their flats in Yuen Long on Friday. 

Ho said about 50 to 100 tenants would move in every day and the plan is to get all 2,156 tenants for the Yau Pok Road project to move in by the end of May.",,
陳美寶：本港航運物流3月份於「提量」「提質」均有不少進展,2025-03-29 10:43,,2025-03-29 11:15,local,rthk,https://news.rthk.hk/rthk/ch/component/k2/1797989-20250329.htm,"運輸及物流局局長陳美寶表示，本港3月份在航運物流「提量」及「提質」上均有不少進展，會繼續致力增強香港貨物中轉樞紐角色，積極研究將航空貨物轉運計劃延伸至其他多式轉運模式，吸引更多貨物來港中轉，提升香港的航運物流競爭力。

陳美寶於網誌提到，去年第四季，香港港口與廣西北部灣的港口吞吐量按年上升47.4%、至接近6萬標箱，佔香港總載貨貨櫃吞吐量超過2%。而本港的現代貨箱碼頭於3月中旬，與廣西北部灣國際港務集團在現時兩地「天天班」的基礎上簽訂合作協議，將中西部地區貨物以鐵路運至廣西，再以駁船轉運到香港上遠洋船，為香港港口帶來更多貨物。當局亦正積極落實港口物流綠色化，業界亦傳來好消息，包括繼上月香港水域內首次液化天然氣加注順利完成後，本月再有兩次商業化的液化天然氣加注作業在香港水域成功完成。

陳美寶提到，立法會財委會昨天批出2億1508萬元的撥款，讓局方全速在今年年底完成構建港口社區系統，聯通航運、港口、物流、貿易業界，透過信息共享實現各方同步實時追蹤貨物，打破現時信息碎片化的困局，為香港創造條件與其他港口對接，增強香港港口的國際競爭力。她相信，透過利用香港優勢的「提質」和「提量」措施，香港航運物流業可以穩中求進，發掘出新增長點。",,
