title,date,summary,scrape_time,section,source,url,news_content
宏福苑火災獨立委員會下月19日舉行首場聽證會,2026-02-05 18:13,,2026-02-05 18:45,local,rthk,https://news.rthk.hk/rthk/ch/component/k2/1842823-20260205.htm,政府就大埔宏福苑火災成立的獨立委員會召開指示會議，委員會主席陸啟康表示，計劃在下月19日舉行首場公開聽證會。他形容今次事故非常嚴重，公眾對調查工作盡快完成及得出結果有很高期望。
金管局：物業電子支付安排月底擴展至二手住宅買賣,2026-02-05 18:11,,2026-02-05 18:30,cfinance,rthk,https://news.rthk.hk/rthk/ch/component/k2/1842821-20260205.htm,"金管局、銀行公會等宣布，由2月底開始，將物業電子支付安排，擴展至二手住宅物業買賣，並命名為「置易付」。

金管局表示，在「置易付」的安排下，交易更加直接和安全，同時可減低銀行業進行按揭業務時，面對的信用和操作風險。"
醫衞局歡迎申訴專員公署報告　將制訂《醫生註冊條例》修例方案,2026-02-05 18:05,,2026-02-05 19:00,local,rthk,https://news.rthk.hk/rthk/ch/component/k2/1842820-20260205.htm,"醫務衞生局表示，歡迎申訴專員公署的主動調查行動報告，會參考公署意見及報告內容，制訂《醫生註冊條例》的詳細修訂方案，務求令醫委會及其秘書處，在專業自主的原則下，能更有效履行維持醫生專業操守、持續提升醫療專業水平的職責。

醫衞局於今年1月就修訂《條例》開展一系列的諮詢，將進一步參考公署報告及各持份者的建議，並按醫委會的運作需要制訂修訂《條例》建議，亦會提出措施強化衞生署醫委會秘書處職能。醫衞局稍後會向立法會衞生事務委員會介紹建議方向和完善《條例》方案，目標在今年上半年向立法會提交《條例》修訂草案。

另外，衞生署回應報告表示，接納和積極跟進公署的建議，致力協助醫委會優化投訴處理機制，提升工作效率，改善服務質素。

對於公署在報告中對醫委會現行投訴處理機制及進度表示關注，並提出多項改善建議，當中部份涉及修訂現行法例，醫務衞生局早前已表示會因應醫委會提交的檢討報告及運作需要而提出修訂《醫生註冊條例》，以確保制度與時並進，符合社會需求。

至於公署提出的其他涉及醫委會及其秘書處行政安排的建議，衞生署會邀請醫委會參考公署的建議，以檢視及完善現有安排。就秘書處的整體行政支援績效、人手及資源需求及人事表現管理等方面，衞生署日後會進一步加強與醫委會溝通，以提升秘書處的工作效率。　　"
衞生署稱致力協助醫委會優化投訴處理機制　提升工作效率,2026-02-05 18:05,,2026-02-05 18:15,local,rthk,https://news.rthk.hk/rthk/ch/component/k2/1842820-20260205.htm,"衞生署回應申訴專員公署的調查報告，表示接納和積極跟進公署的建議，致力協助醫委會優化投訴處理機制，提升工作效率，改善服務質素。
　　 
對於公署在報告中對醫委會現行投訴處理機制及進度表示關注，並提出多項改善建議，當中部份涉及修訂現行法例，醫務衞生局早前已表示會因應醫委會提交的檢討報告及運作需要而提出修訂《醫生註冊條例》，以確保制度與時並進，符合社會需求。
　　 
至於公署提出的其他涉及醫委會及其秘書處行政安排的建議，衞生署會邀請醫委會參考公署的建議，以檢視及完善現有安排。就秘書處的整體行政支援績效、人手及資源需求及人事表現管理等方面，衞生署日後會進一步加強與醫委會溝通，以提升秘書處的工作效率。　　"
Medical Council slow to handle complaints: Ombudsman,2026-02-05 17:59,,2026-02-05 18:15,elocal,rthk,https://news.rthk.hk/rthk/en/component/k2/1842815-20260205.htm,"Ombudsman Jack Chan on Thursday said there have been ""systemic problems and inadequacies"" in how the Medical Council and its secretariat handle and monitor complaints against doctors. 

This came following his office’s direct probe, stemming from media reports last October revealing that the council had delayed the handling of a complaint involving an infant with cerebral palsy by 15 years. 

Chan said the investigation found that in the past six years, it took the council more than a decade to finish handling 11 complaints. 

For another 260 or so cases, three quarters of them took less than five years. 

The Ombudsman said the council had already been able to conclude proceedings quicker recently than in past years.

Still, he said the figures indicate the council's complaint-handling was too slow, and could have serious implications while being unfair to both complainants and complainees.

""Overall speaking, the current investigations and disciplinary proceedings into complaints against medical practitioners are excessively long and fall far short of public expectations,"" Chan said at a press conference.

""Cases involving serious professional misconduct, if such misconduct actually exists, may even pose a risk to patient safety.""

The Ombudsman proposed a series of recommendations, which were accepted by the authorities.

These include amending the law such that when a doctor is subject to an inquiry, his or her licence should be suspended. 

Chan's office also proposed introducing a mediation mechanism between parties. 

""The government should also urge the council to critically explore any scope to streamline procedures — such as adopting the facts established by the court, or inviting experts who have testified at an inquest to serve as expert witnesses in the council's disciplinary inquiry,"" he said.

The Ombudsman went on to propose that the council should have a higher ratio of lay members, but whether or not this is recommendation is acted upon is a matter for authorities to decide, it said."
Thailand deports man wanted over 1989 murder,2026-02-05 17:47,,2026-02-05 18:45,elocal,rthk,https://news.rthk.hk/rthk/en/component/k2/1842810-20260205.htm,"A man wanted for a murder in Sai Kung nearly four decades ago was arrested by Hong Kong police on Thursday after being deported from Thailand. 

Two other people have already been jailed over the killing of a man whose body was found on Lung Ha Wan beach in 1989.

Following a request and intelligence provided by the Hong Kong authorities, the suspect, 62, was first arrested by Thai officers during a raid at his home in Bangkok on Monday.

Speaking to reporters at Hong Kong airport after returning from a duty visit to Thailand, Police Commissioner Joe Chow said there were no records of the suspect leaving the SAR and this had made it extremely challenging to identify his exact whereabouts.

“Intelligence suggested the suspect was in Thailand. The Thai police carried out meticulous investigation for some time to verify if they had the right person,” he said.

Chow added that a fingerprint analysis was also carried out to confirm the suspect's identity.

He said the man was deported from Thailand being as he had no valid identification documents.

Separately, the police chief said he had held exchange sessions with the Thai police during his visit, on using technology such as drones and CCTV to combat crime."
Police chief thanks Thailand for arresting fugitive,2026-02-05 17:47,,2026-02-05 18:15,elocal,rthk,https://news.rthk.hk/rthk/en/component/k2/1842810-20260205.htm,"Police Commissioner Joe Chow on Thursday expressed gratitude to Thai police for the arrest of a man wanted for a murder that took place in Hong Kong nearly four decades ago.

Two other people have already been jailed over the killing of a man whose body was found on Lung Ha Wan beach in Sai Kung in 1989.

Following a request and intelligence provided by the Hong Kong authorities, the suspect, 62, was arrested by Thai officers during a raid at his home in Bangkok on Monday.

Speaking to reporters at Hong Kong airport after returning from a duty visit to Thailand, Chow said the man was being escorted back to the SAR.

The police chief said there were no records of the suspect leaving Hong Kong and this had made it extremely challenging to identify his exact whereabouts.

“Intelligence suggested the suspect was in Thailand. The Thai police carried out meticulous investigation for some time to verify if they had the right person,” he said. 

“Since so many years have passed, the man’s appearance has changed with age and he no longer looks exactly the same as before. So after some time for analysis and verification, the Thai police confirmed the arrested man was the right person.”

Chow said a fingerprint analysis has also been conducted to confirm the suspect's identity. 

The police chief added that since the suspect had no valid identification documents, he had been deported from Thailand. 

Separately, the police chief said he had held exchange sessions with the Thai police during his visit, on using technology such as drones and CCTV to combat crime."
警方交代1989年龍蝦灣兇殺案　相信被捕男子為案件主謀,2026-02-05 17:42,,2026-02-05 18:00,local,rthk,https://news.rthk.hk/rthk/ch/component/k2/1842818-20260205.htm, 
在岸人民幣兌美元低收32點子,2026-02-05 17:39,,2026-02-05 17:45,cfinance,rthk,https://news.rthk.hk/rthk/ch/component/k2/1842814-20260205.htm,"在岸人民幣收市報6.9408兌1美元，較上日跌32點子，中間價跌至6.957兌1美元，較市場預測偏弱逾百點子。

市場人士指，近日美元企穩反彈，人民幣升值勢頭放緩，不過累計結匯需求較多，預計升勢不會改變。隨著農曆新年臨近，當結匯需求減弱，匯價短期或重返區間波動。"
柬埔寨否認今天早上向泰國境內發射榴彈,2026-02-05 17:38,,2026-02-05 17:45,cinternational,rthk,https://news.rthk.hk/rthk/ch/component/k2/1842817-20260205.htm,"柬埔寨否認今天早上向泰國境內發射榴彈。

泰國傳媒早前引述泰軍通報指，柬埔寨一方今天早上10時左右，發射了一枚40毫米榴彈，落在泰國邊境四色菊府一處軍事基地。泰方表示已經聯絡柬方，對方回應說事件是意外，是新部署到該地區的士兵違反紀律。

柬埔寨國防部發言人馬莉淑潔達否認說法，指柬埔寨第四軍區和泰國第二軍區已經取得聯繫，不存在泰國媒體所報道的情況，重申柬方將全面尊重並執行兩國達成的停火協議。"
學者稱習近平分別與普京及特朗普對話　三國鼎足世界局面成形,2026-02-05 17:37,,2026-02-05 17:45,local,rthk,https://news.rthk.hk/rthk/ch/component/k2/1842816-20260205.htm,"國家主席習近平昨日先後透過視像及致電方式，分別與俄羅斯總統普京及美國總統特朗普對話。彼此談及多方範疇，強調加強合作，妥善管控好分歧等。

香港大學政治與公共行政學系名譽教授盧兆興認為，今次對話象徵中國以大國地位與俄國及美國，共同成形三國鼎足世界的局面。從國家對俄的取態，強調雙方戰略協作夥伴關係長達30年，包括能源、貿易、農業、能源等方面有合作，亦利用上合組織、金磚國家等平台加強彼此關係，從整個格局可見，中俄關係比中美關係更為密切、友好。

盧兆興又分析，中美關係以經濟為主，中國透過輸入美國產品，巧妙地牽制美國以關稅作為懲罰性外交工具的做法。

對於今次中俄、中美對話，盧兆興估計，歐洲亦會解讀為三國鼎立世界的局面，將會調整對華政策，不再視中國為威脅；至於習近平與特朗普討論伊朗問題，中東國家估計中國會提出以和平外交為主，影響美國免用武力解決問題。"
Hong Kong stocks close higher,2026-02-05 17:25,,2026-02-05 17:45,efinance,rthk,https://news.rthk.hk/rthk/en/component/k2/1842808-20260205.htm,"Hong Kong stocks ended higher on Thursday with the Hang Seng Index up 0.1 percent at 26,885.

The Shanghai Composite Index finished down 0.6 percent at 4,075, while the Shenzhen Component Index closed 1.4 percent lower at 13,952. (Xinhua)"
烏克蘭、美國和俄羅斯展開第二日三方會談　形式與首日相同,2026-02-05 17:25,,2026-02-05 17:45,cinternational,rthk,https://news.rthk.hk/rthk/ch/component/k2/1842813-20260205.htm,"烏克蘭、美國和俄羅斯，正在展開第二日的會談。

烏克蘭國家安全與國防委員會秘書烏梅羅夫，在社交媒體發文表示，三方代表在阿聯酋首都阿布扎比展開第二天的會談。他說會談的形式與昨天相同，分別是三方磋商、分組討論及後續立場協調。

烏梅羅夫早前形容首日會談內容充實，富有成效，重點關注具體行動及實際解決方案，烏克蘭談判團隊正按照總統澤連斯基的明確指示開展工作，爭取實現公正持久的和平。

阿聯酋外交部則表示，這輪會談的啟動，表明有關各方繼續致力於透過外交途徑解決問題，期待在首輪會談的基礎上，本輪會談能進一步增進相互理解，推動政治進程取得進展。"
法援署截至上月底接359宗宏福苑災民申請　六成涉物業損毀索償,2026-02-05 17:23,,2026-02-05 17:45,local,rthk,https://news.rthk.hk/rthk/ch/component/k2/1842812-20260205.htm,"法律援助署表示，截至1月底，收到359宗涉及大埔宏福苑災民的法援申請，其中六成涉及物業損毀索償、約一至兩成涉及人身傷亡索償，預計約3個月會有決定。

法援署署長陳澤銘與傳媒茶聚時表示，由上月底起，在7個地點安排職員向居民及受影響人士解釋法援服務，並在現有法律框架下，兼顧法、理、情，提供法律援助。他表示，已成立10多人的特別專責組處理宏福苑相關事宜，亦因應有不少災民遺失文件，所以簡化申請程序。在經濟審查方面，會豁免涉及火災後的捐款等。

被問到如有災民申請向政府索償，會如何處理，陳澤銘表示，法援的宗旨是協助沒有經濟能力的市民，只要案情合埋就會提供協助，不會理會被控告的對象，而以往亦有政府作為被告的案例。"
Think tank makes suggestions for upcoming budget,2026-02-05 17:22,,2026-02-05 19:00,elocal,rthk,https://news.rthk.hk/rthk/en/component/k2/1842811-20260205.htm,"A local think tank on Thursday said the government should consider increasing taxes on the wealthy in this month's budget.

The Our Hong Kong Foundation is forecasting a consolidated deficit of around HK$5 billion to HK$10 billion this fiscal year, down from last year’s deficit of HK$80.3 billion.

But it said the city’s public finances continue to face challenges due to an ageing population as well as major infrastructure projects that are underway. 

As such, the foundation put forward 18 suggestions, which it believes could bring an additional HK$64 billion in revenue.

One of these is to introduce a three-tier standard tax rate for personal income, raising it to 17 percent, from the current 16 percent, for those whose annual income exceeds HK$7.5 million. 

“We have tried to look into Hong Kong’s tax rate compared to other jurisdictions, for example Singapore, people are paying a progressive tax rate, with the highest tax bracket at 24 percent,” said Pascal Siu, senior research manager at the foundation. 

“Even with our minor adjustment of up to 17 percent, that would not hugely affect our competitiveness... the impact on Hong Kong’s competitiveness is very small,” he added. 

The foundation also suggested increasing the duty rate for the Mark Six lottery from 25 to 30 percent and lowering the prize fund ratio from 54 to 49 percent, generating an extra HK$500 million. 

On the other hand, to cut expenses, the think tank said the HK$2 subsidised transport fares, for those aged 60 or above, should be further reduced to 120 trips per month from the current 240 trips, saying that those eligible for the scheme take less than an average of 1.5 trips per day. 

“We believe there is still a bit of room to adjust [the scheme] and we also hope that by adjusting it, it could match the actual usage better... currently, up to 88 percent of users recorded a use of less than 120 trips per month,” said researcher Katie Ho. 

“Rather than giving out benefits to everyone, we hope to switch our approach to a more targeted approach, supporting people who are in need and supporting people who are underprivileged,” she added. 

As for the Public Transport Fare Subsidy Scheme, it said the subsidy threshold should be raised from HK$500 to HK$600, and the monthly subsidy cap should be lowered from HK$400 to HK$300, to offer more targeted resource allocation to citizens.

In terms of public health resources, it urged the government to enhance medical price transparency within the private healthcare sector, so as to guide those who are more financially capable to transfer from public healthcare to private. 

Civil servant pay should be adjusted according to work performance, the foundation said, with the goal of leveraging AI to boost departmental efficiencies."
Think tank makes suggestions for upcoming Budget,2026-02-05 17:22,,2026-02-05 17:45,elocal,rthk,https://news.rthk.hk/rthk/en/component/k2/1842811-20260205.htm,"A local think tank on Thursday said the government should consider increasing taxes on the wealthy in this month's Budget.

The Our Hong Kong Foundation is forecasting a consolidated deficit of around HK$5 billion to HK$10 billion this fiscal year, down from last year’s deficit of HK$80.3 billion. 

But it said the city’s public finances continue to face challenges due to an ageing population as well as major infrastructure projects that are underway. 

As such, the foundation put forward 18 suggestions, which it believes could bring an additional HK$64 billion in revenue.

One of these is to introduce a three-tier standard tax rate for personal income, raising it to 17 percent, from the current 16 percent, for those whose annual income exceeds HK$7.5 million. 

“We have tried to look into Hong Kong’s tax rate compared to other jurisdictions, for example Singapore, people are paying a progressive tax rate, with the highest tax bracket at 24 percent,” said Pascal Siu, senior research manager at the foundation. 

“Even with our minor adjustment of up to 17 percent, that would not hugely affect our competitiveness... the impact on Hong Kong’s competitiveness is very small,” he added. 

The foundation also suggested increasing the duty rate for the Mark Six lottery from 25 to 30 percent and lowering the prize fund ratio from 54 to 49 percent, generating an extra HK$500 million. 

On the other hand, to cut expenses, the think tank said the HK$2 subsidised transport fares, for those aged 60 or above, should be further reduced to 120 trips per month from the current 240 trips, saying that those eligible for the scheme take less than an average of 1.5 trips per day. 

“We believe there is still a bit of room to adjust [the scheme] and we also hope that by adjusting it, it could match the actual usage better... currently, up to 88 percent of users recorded a use of less than 120 trips per month,” said researcher Katie Ho. 

“Rather than giving out benefits to everyone, we hope to switch our approach to a more targeted approach, supporting people who are in need and supporting people who are underprivileged,” she added. 

As for the Public Transport Fare Subsidy Scheme, it said the subsidy threshold should be raised from HK$500 to HK$600, and the monthly subsidy cap should be lowered from HK$400 to HK$300, to offer more targeted resource allocation to citizens.

In terms of public health resources, it urged the government to enhance medical price transparency within the private healthcare sector, so as to guide those who are more financially capable to transfer from public healthcare to private. 

Civil servant pay should be adjusted according to work performance, the foundation said, with the goal of leveraging AI to boost departmental efficiencies."
銀行公會：過去6個月平均超過75%轉按交易採用「置易付」,2026-02-05 17:05,,2026-02-05 17:15,local,rthk,https://news.rthk.hk/rthk/ch/component/k2/1842809-20260205.htm,"今年2月底開始，物業交易支付安排「置易付」擴展至二手住宅物業買賣。有關安排得到消費者委員會支持。

金管局副總裁阮國恒表示，過去3年住宅物業轉按交易的電子支付安排運作一直非常暢順，市民選用比率亦穩步上升，至今大部份住宅物業轉按交易已採用新的電子支付。建基於轉按市場上成功經驗，金管局及銀行公會過去一段時間著手研究如何將「置易付」電子支付安排，擴展到二手住宅物業買賣，但涉及持份者較多，流程更加複雜，亦要多方持份者同意及改變採用多年的流程和習慣，形容商討過程不容易。

銀行公會主席孫煜說，「置易付」安排在2022年推出至今，獲得市場及客戶認可，數據顯示，過去6個月平均超過75%轉按交易採用「置易付」。他說，銀行業界在「置易付」操作系統，流程及內部指引等方面已全面就緒，正為前線員工提供倍訓，亦已準備一系列宣傳及教育工作。

律師會會長湯文龍表示，「置易付」安排在轉按交易中順利運行3年，並已處理逾1.5萬宗交易，律師會支持將安排擴展到二手住宅物業買賣，又強調安排不是強制性要求，市民可按個別交易情況、金額等，與代表律師商議最合適處理方式，指出傳統模式的銀行本票和律師行支票交收，仍然可以進行。

地產代理監管局規管及法律總監梁德麗表示，地監局今日稍後會向地產代理發出函件，提醒業界「置易付」是買方需要按揭貸款完成二手住宅物業買賣交易時，在現有支付安排以外另一種支付方式，選擇採用與否，要由買賣雙方決定。"
港股高收37點　科指升逾0.7%　騰訊連跌4日後回穩,2026-02-05 16:52,,2026-02-05 17:15,local,rthk,https://news.rthk.hk/rthk/ch/component/k2/1842805-20260205.htm,"港股朝早曾跌近440點，尾段收復全部失地，恒生指數收市報26885點，升37點，全日高低點數波幅逾500點。主板成交約3151億元。

科技指數重上5400點關口，收市報5406點，升0.74%。ATMXJ向好，小米升近3%表現較好，騰訊連跌4日後回穩。晶片股受壓，中芯國際及華虹分別跌近2%或以上。

內需、內銀股上升，海底撈升4%，是表現最好藍籌；百勝中國績後升逾11%。保險股下跌，中人壽及友邦跌近3%。

資源及貴金屬股下跌，紫金礦業跌近5%，是表現最差藍籌股。"
周一鳴感謝泰國警方協助兩宗案件　包括37年前龍蝦灣兇殺案,2026-02-05 16:46,,2026-02-05 17:00,local,rthk,https://news.rthk.hk/rthk/ch/component/k2/1842807-20260205.htm, 
HK aims for Davis Cup World Group I return,2026-02-05 16:45,,2026-02-05 17:00,elocal,rthk,https://news.rthk.hk/rthk/en/component/k2/1842806-20260205.htm,"Hong Kong has set its sights on a return to Davis Cup World Group I for the first time in 33 years, but must first overcome top-seeded Finland in a World Group I Play-off tie to get there. 

The winner of the clash will advance to World Group I in September, moving one step closer to the coveted World Group Qualifiers.

Captained by Yu Hiu-tung, the Hong Kong, China team features a young squad of six: Coleman Wong, Kai Thompson, Wong Tsz-fu, Nicholas Cheng, Jack Cheng and Walter Tam. 

With an average age of just 18, 21-year-old Coleman Wong is the team’s most experienced Davis Cup campaigner.

""This time, we have a very young team. They don't have much experience at the Davis Cup, except for Coleman,"" Yu said.

""We try to give more advice on how it feels when playing the Davis Cup. We will see what happens during the tie."" 

Despite their youth, the team carry momentum from recent successes. 

Coleman Wong made history last month by reaching the quarter-finals of the Hong Kong Tennis Open, the first local player to do so at an ATP Tour event. 

Meanwhile, Kai Thompson, the city’s top-ranked junior, advanced to the final eight in the Australian Open junior championships.

Yu acknowledges the challenge ahead but believes home support could be decisive. 

“We know that our opponents will be tough, so we are depending on the home crowd energy to push us to victory,” he said.

Finland, led by captain Jarkko Nieminen, arrive as favourites but are taking nothing for granted. Nieminen said the team arrived on Saturday to acclimatise and prepare.

""Like always, we try to focus on playing as well as possible and we try to scout and find the right tactics before or during the match,"" he said.

""The main focus is always to get in good shape and hopefully our players can play their best tennis during the weekend, and then we will see how far [that takes us] and if it is enough or not.""

The stage is now set at Victoria Park from February 7 to 8."
