title,date,summary,scrape_time,section,source,url,news_content
立法會選舉提名期明日展開　李家超稱選出有擔當賢能人士至關重要,2025-10-23 12:25,,2025-10-23 12:45,local,rthk,https://news.rthk.hk/rthk/ch/component/k2/1828405-20251023.htm,"第八屆立法會選舉提名期明日展開，特區政府和選舉管理委員會舉行立法會換屆選舉啟動禮。

行政長官李家超說，今日香港站在邁向由治及興的關鍵節點，選出有能力、有擔當及熱誠的賢能人士擔任立法會議員，至關重要。

選管會主席陸啟康表示，每一張選票都可能影響到特區施政、經濟發展和市民的生活，投票是選民對未來的一個選擇。"
恒指半日跌22點　科指跌0.8%,2025-10-23 12:20,,2025-10-23 12:30,cfinance,rthk,https://news.rthk.hk/rthk/ch/component/k2/1828406-20251023.htm,"港股缺乏方向，恒生指數中午收市報25759點，跌22點，半日主板成交額約1348億元。

科技指數跌0.8%，報5875點。ATMXJ個別發展，美團升逾1%，小米跌近1%。

醫藥和晶片股下跌，石藥集團跌逾5%，華虹半導體跌逾6%。

泡泡瑪特急跌逾9%，是表現最差的藍籌股。

石油股上升，中石油和中海油升逾1%至2%。金融股多數靠穩。

金沙中國公布季度業績後，半日升逾3%。李寧升近6%，是表現最好的恒指成份股。"
本屆立法會完成最後會議　梁君彥祝願各議員事事順利,2025-10-23 12:14,,2025-10-23 12:30,local,rthk,https://news.rthk.hk/rthk/ch/component/k2/1828407-20251023.htm, 
滬股半日跌近0.7%　再失守3900點　創業板指數跌逾1%,2025-10-23 11:53,,2025-10-23 12:15,cfinance,rthk,https://news.rthk.hk/rthk/ch/component/k2/1828402-20251023.htm,"內地股市跌勢持續，貴金屬、半導體、CPO概念股受壓，深圳國企改革概念、煤炭、影視、港口航運、旅遊及酒店股造好。

上證指數再度失守3900點水平，半日報3888點，跌25點，跌幅0.66%。

深證成份指數報12883點，跌112點，跌幅0.87%。

創業板指數險守3000點關口，低見3003點，半日報3025點，跌33點，跌幅1.1%。"
葉劉淑儀回應會否對議會不捨　稱「不要當成永別，會常常回來」,2025-10-23 11:39,,2025-10-23 11:45,local,rthk,https://news.rthk.hk/rthk/ch/component/k2/1828403-20251023.htm,"本屆立法會最後一次大會，早上舉行續會。新民黨主席、立法會議員葉劉淑儀表示，完成本屆工作感到很開心，自問做了很多事，包括審議很多重要的條例，如《維護國家安全條例》、政府改組等，自己曾參與，自問已完成任務。

至於參選問題，葉劉淑儀說，稍後會有公布。被問到有無對議會感到不捨，葉劉淑儀說，不要當成永別，會常常回來。"
選委界蘇長荣不競逐連任,2025-10-23 11:38,,2025-10-23 11:45,local,rthk,https://news.rthk.hk/rthk/ch/component/k2/1828401-20251023.htm,"立法會換屆選舉提名期明天展開，再有現任議員宣布不競逐連任，選委界議員蘇長荣表示，不計劃參選。

他說希望集中精力和時間在其他公職，包括全國政協委員等，以發揮更好作用，同時可安排更多時間參與自己企業集團的事務。

蘇長荣形容，今次是水到渠成的決定。"
Ocean Park may pull the plug on Water World: chairman,2025-10-23 11:24,,2025-10-23 11:45,elocal,rthk,https://news.rthk.hk/rthk/en/component/k2/1828399-20251023.htm,"Ocean Park's Water World attraction has underperformed since opening four years ago and it might have to be shut down, chairman  Paulo Pong said on Thursday.

Pong told RTHK he was satisfied with the park's overall operations, following a growth in revenue for the fourth straight year.

But the total deficit has increased to HK$274.7 million, partly due to losses from Water World.

The park will need to talk to stakeholders about the way forward, Pong said, as the attraction's performance has not met expectations even though they have tried various measures to boost attendance.

""Initially, the idea was to be open all year round. However, after two years, we discovered that the number of visitors in winter was not ideal. In order to save costs, the facility was closed in winter in both 2024 and 2025. We're doing the same now, closing on October 15 and hoping to reopen in May. This is one of the steps we have taken to reduce expenses,"" he said.

""We have tried pricing adjustments and drawing in visitors with DJs and night-time events, but the numbers are still lower than we had hoped.""

Pong said he does not rule out the possibility that Water World could be shut down.

Meanwhile, the park will talk to the government about extending an annual HK$280 million grant for conservation and education work which is due to end next year.

Pong said conservation and education expenses account for about 30 percent of total operating costs and if the subsidy is not continued, some of the ongoing projects might have to be cut."
日央行前理事料最快12月加息　明年夏季利率上調至1厘,2025-10-23 11:22,,2025-10-23 12:00,cfinance,rthk,https://news.rthk.hk/rthk/ch/component/k2/1828400-20251023.htm,"日本央行前理事前田榮治表示，央行可能最快於12月加息至0.75厘，到明年夏季再加息至1厘，隨後可能慢慢加息，以觀察經濟對借貸成本上升的反應。

他指，央行在應對通脹風險方面可能已經有些落後於形勢，導致大城市樓價急升、日圓疲弱亦令家庭生活成本上升，認為央行應穩步推進加息，並同時警惕經濟下行及物價上行風險。

前田榮治預計，日本經濟將繼續溫和擴張，因美國關稅對經濟增長的打擊被證明較最初擔心的小，預計企業在資本支出和加薪計劃保持樂觀。

日本央行下周三至周四議息。有分析認為，央行可能推遲加息，避免與新任首相高市早苗可能推出的刺濟經濟政策產生矛盾。"
亞青運開幕　霍震霆勉勵青年運動員透過運動廣結友誼,2025-10-23 11:09,,2025-10-23 11:15,csport,rthk,https://news.rthk.hk/rthk/ch/component/k2/1828398-20251023.htm,"巴林亞青運於當地時間昨晚正式揭幕，開幕禮上，中國香港代表團成員由持旗手單車運動員羅靖喬及跆拳道運動員鄭裕禮引領下進場。

港協暨奧委會會長霍震霆以亞奧理事會代理主席身份主禮，他在開幕禮致辭時，感謝巴林全力籌辦亞青運，並勉勵青年運動員勇於追尋夢想，透過運動廣結友誼。

今屆開幕禮首度移師室內舉行，亞青運開幕後將舉行至本月31日，有來自45個亞洲國家和地區、超過4千名14至18歲青年運動員參與，在26個大項賽事中角逐獎牌。港隊派出超過180人的代表團參與包括田徑、羽毛球、公路單車、電子競技、馬術、五人足球、高爾夫球、手球、柔道、游泳、乒乓球、跆拳道、三項鐵人和排球共14個大項的賽事，人數是歷年之冠。"
狄志遠：新思維計劃派人參選　冀下屆議會監察政府,2025-10-23 11:06,,2025-10-23 11:30,local,rthk,https://news.rthk.hk/rthk/ch/component/k2/1828396-20251023.htm,"已決定不爭取連任的社福界立法會議員、新思維主席狄志遠希望，下屆立法會有多元聲音，議員繼續監察的角色，亦期望政府要聽不同聲音，包括反對聲音。

狄志遠在立法會見記者時說，行政與立法曾有一段時間為爭拗而爭拗，令社會停擺，現時理性互動回來，認為是好事，但認為行政立法無縫配合之外，需要議會監察。

立法會換屆選舉12月7日舉行，狄志遠說，有人認為投票無用而不願投票，但他希望市民明白，手上一票得來不易，投票是對社會的承擔，認為「不應將失望交給冷漠」。

狄志遠說，新思維計劃派人參選換屆選舉，但仍未決定，稍後會公布，目標是參與地區直選。"
美軍首次在太平洋打擊販毒擊沉兩艘船　打死5名涉嫌販毒疑犯,2025-10-23 10:56,,2025-10-23 11:15,cinternational,rthk,https://news.rthk.hk/rthk/ch/component/k2/1828394-20251023.htm,"美軍首次在太平洋展開打擊販毒的軍事行動，擊斃5名涉嫌販毒的疑犯。

國防部長赫格塞思表示，美軍星期二在太平洋東部國際水域擊沉一艘販毒船，打死兩人，行動是在總統特朗普指示下實施，被擊沉船隻由美國政府認定的恐怖組織營運，在東太平洋從事毒品販運。

赫格塞思數小時後再表示，美軍星期三在東太平洋襲擊另一艘船，造成三人死亡。他說，情報部門已知悉這艘船參與販毒，當時載有毒品。

連同最新兩次，自9月初以來，美國已針對南美近海的販毒行動進行九次襲擊。"
學者分析鄰近地區競爭及天氣因素導致海洋公園水上樂園營運困難,2025-10-23 10:55,,2025-10-23 11:15,local,rthk,https://news.rthk.hk/rthk/ch/component/k2/1828395-20251023.htm,"海洋公園於2024/2025財政年度，虧損約2億7千萬元，較上一個年度虧損多超過2億元。經營盈餘就轉虧為盈，錄得超過4200萬元。

香港專業教育學院酒店及旅遊系系主任黃家榮在本台節目《千禧年代》表示，海洋公園的入場人數及遊客消費都有增長，而海洋公園有教育及保育角色，當中亦涉及成本。他又提到現時內地旅客都以自由行模式較多，而在樂園最高峰時期，海洋公園是旅行團必到景點，現時旅行團數目亦大減，亦影響入場人數。

他認為，現時公園經營方向正確，數字上亦證明過去幾年，包括宣傳策略、吸引旅客的模式，以及商品策略都奏效，包括「熊貓熱」成功吸引一班粉絲。至於水上樂園的虧損情況，黃家榮認為，除了天氣問題，同時面對鄰近地區的水上樂園的競爭，因此造成營運困難。"
陸啟康：每張票可影響施政　選民投票不只選人或政綱亦選擇未來,2025-10-23 10:50,,2025-10-23 11:00,local,rthk,https://news.rthk.hk/rthk/ch/component/k2/1828393-20251023.htm, 
日本富士山迎來初冠雪　是有紀錄以來第四遲,2025-10-23 10:50,,2025-10-23 11:00,cinternational,rthk,https://news.rthk.hk/rthk/ch/component/k2/1828384-20251023.htm,"日本富士山迎來初冠雪，較往年平均遲了21日，但比去年錄得的最遲紀錄早15日，是有紀錄以來第四遲。

距離富士山山頂約40公里的甲府地方氣象台工作人員，當地早上6時左右觀測到富士山山頂附近出現積雪，宣布觀測到初冠雪。"
李家超：本月初啟動內地企業出海專班　協助內地企業拓展國際市場,2025-10-23 10:49,,2025-10-23 11:00,local,rthk,https://news.rthk.hk/rthk/ch/component/k2/1828392-20251023.htm,"行政長官李家超在一個大灣區論壇上視像致辭表示，上月在施政報告中宣布成立「內地企業出海專班」，本月初已正式啟動，協助內地企業拓展國際市場，為國家及香港創造重要價值，共同邁向更美好的明天。

李家超亦指，政府正加快建設成為國際創科中心，將提供土地資源，促進科技迅速發展及技術轉型。他又說，河套深港科技創新合作區香港園區，今年正式進入營運階段，特區政府正與內地有關部門緊密聯繫，在合作區內試行促進創新要素高效流通措施。

他又說，今年《全球創新指數》世界百強創新集群排名中，「深圳—香港—廣州」創新集群升至榜首，他對大灣區結集的力量充滿信心，將進一步提升國家的全球競爭力。

李家超說，十五動會將於不足三星期後舉行，希望大家能藉此發掘並感受香港的活力及好客精神。"
李家超強調選出有能力有擔當賢能之士至關重要,2025-10-23 10:49,,2025-10-23 11:00,local,rthk,https://news.rthk.hk/rthk/ch/component/k2/1828390-20251023.htm, 
今早本港氣溫普遍在18度左右　天文台料未來兩三日氣溫回升,2025-10-23 10:49,,2025-10-23 11:00,local,rthk,https://news.rthk.hk/rthk/ch/component/k2/1828391-20251023.htm,"受強烈東北季候風影響，今早廣東地區天氣仍然稍涼。今早本港氣溫普遍在18度左右。

天文台說，隨著季候風在未來兩三日逐漸緩和，華南天色好轉，日間乾燥，氣溫回升。而一股偏東氣流會在下週初至中期影響廣東，該區雲量增多。熱帶氣旋風神會在今日移向越南中部並逐漸消散。此外，現時位於呂宋海峽附近的低壓區正為該區帶來不穩定天氣。"
HK stocks little changed as investors turn cautious,2025-10-23 10:47,,2025-10-23 11:15,efinance,rthk,https://news.rthk.hk/rthk/en/component/k2/1828386-20251023.htm,"Asian stocks fell for a second day on Thursday as lacklustre earnings reports from tech megacap stocks deepened a sell-off on Wall Street, while US sanctions against Russia and China revived fears around geopolitics and pushed oil prices higher.

In Hong Kong, the benchmark Hang Seng Index fell 63 points, or 0.25 percent, to open at 25,718.

On the mainland, the benchmark Shanghai Composite Index opened down 0.25 percent at 3,904, while the Shenzhen Component Index was 0.29 percent lower at 12,959.

The ChiNext Index, tracking China's Nasdaq-style board of growth enterprises, was down 0.28 percent at 3,050.

MSCI's broadest index of Asia-Pacific shares outside Japan was last off 0.3 percent, while Japan's Nikkei 225 sank 1.5 percent.

Chinese stocks declined in Hong Kong following reports that the White House is considering a plan to curb an array of software-powered exports to China to retaliate against Beijing's latest round of rare earth export restrictions.

""With no fresh macro data to anchor sentiment, investors are leaning defensive while US President Donald Trump’s Asia visit stirs geopolitical nerves,"" said Charu Chanana, chief investment strategist at Saxo Bank in Singapore. 

""The chatter around US software export curbs to China has hit tech sentiment right where it hurts, and renewed sanctions on Russia are a reminder that geopolitical risks aren’t going away either.""

Global equity markets are easing off record highs as corporate earnings season kicks off. While results or outlooks from the megacaps have disappointed investors, most of the companies that have reported so far have beaten analysts' estimates.

South Korean stocks fell 0.2 percent after the Bank of Korea kept rates on hold, as expected by analysts.

Brent crude was last up 2.3 percent at US$64 per barrel after Trump on Wednesday imposed Ukraine-related sanctions for the first time in his second term, targeting Russian oil companies Lukoil and Rosneft. The move came the same day as EU countries approved a 19th package of sanctions on Moscow that included a ban on Russian liquefied natural gas imports.

S&P 500 e-mini futures edged up 0.1 percent after a second day of declines for US stocks overnight as earnings reports from tech megacaps underwhelmed analysts on Wall Street. (Reuters/Xinhua)"
日股半日跌逾1%,2025-10-23 10:47,,2025-10-23 11:00,cfinance,rthk,https://news.rthk.hk/rthk/ch/component/k2/1828389-20251023.htm,日本股市半日跌逾1%，日經平均指數報48664點，跌643點，跌幅1.3%。
HK markets little changed as investors turn cautious,2025-10-23 10:47,,2025-10-23 11:00,efinance,rthk,https://news.rthk.hk/rthk/en/component/k2/1828386-20251023.htm,"Asian stocks fell for a second day on Thursday as lacklustre earnings reports from tech megacap stocks deepened a sell-off on Wall Street, while US sanctions against Russia and China revived fears around geopolitics and pushed oil prices higher.

In Hong Kong, the benchmark Hang Seng Index fell 63 points, or 0.25 percent, to open at 25,718.

On the mainland, the benchmark Shanghai Composite Index opened down 0.25 percent at 3,904, while the Shenzhen Component Index was 0.29 percent lower at 12,959.

The ChiNext Index, tracking China's Nasdaq-style board of growth enterprises, was down 0.28 percent at 3,050.

MSCI's broadest index of Asia-Pacific shares outside Japan was last off 0.3 percent, while Japan's Nikkei 225 sank 1.5 percent.

Chinese stocks declined in Hong Kong following reports that the White House is considering a plan to curb an array of software-powered exports to China to retaliate against Beijing's latest round of rare earth export restrictions.

""With no fresh macro data to anchor sentiment, investors are leaning defensive while US President Donald Trump’s Asia visit stirs geopolitical nerves,"" said Charu Chanana, chief investment strategist at Saxo Bank in Singapore. 

""The chatter around US software export curbs to China has hit tech sentiment right where it hurts, and renewed sanctions on Russia are a reminder that geopolitical risks aren’t going away either.""

Global equity markets are easing off record highs as corporate earnings season kicks off. While results or outlooks from the megacaps have disappointed investors, most of the companies that have reported so far have beaten analysts' estimates.

South Korean stocks fell 0.2 percent after the Bank of Korea kept rates on hold, as expected by analysts.

Brent crude was last up 2.3 percent at US$64 per barrel after Trump on Wednesday imposed Ukraine-related sanctions for the first time in his second term, targeting Russian oil companies Lukoil and Rosneft. The move came the same day as EU countries approved a 19th package of sanctions on Moscow that included a ban on Russian liquefied natural gas imports.

S&P 500 e-mini futures edged up 0.1 percent after a second day of declines for US stocks overnight as earnings reports from tech megacaps underwhelmed analysts on Wall Street. (Reuters/Xinhua)"
李家超：香港全力做好超級聯繫人角色　助力內地企業「走出去」,2025-10-23 10:45,,2025-10-23 11:00,local,rthk,https://news.rthk.hk/rthk/ch/component/k2/1828388-20251023.htm,"行政長官李家超出席一個論壇致辭時表示，香港是全球最自由經濟體，營商環境被評為世界前列，在最新的全球金融中心技術報告中，香港繼續位列全球第三、亞太區第一。

他說，香港要充分發揮這些優勢，繼續深化國際交往合作，積極拓展國際「朋友圈」，全力做好超級聯繫和超級增值人角色，成為內地企業「走出去」、將海外企業「引進來」的雙向跳板，政府將積極爭取更多國際機構落戶香港，包括亞洲基礎設施投資銀行。

李家超提到，即將成立駐吉隆坡經濟貿易辦事處，深化在東盟及周邊國家的經貿推廣，並將經貿辦覆蓋範圍擴展至拉丁美洲、中亞地區等；亦將加速擴展航空版圖，積極吸引航空公司開辦更多航班，爭取訂立更多新民航協議及擴展航權，優先聚焦南美洲、中亞、非洲及中東等具潛力市場。

李家超亦指，一國兩制下，香港享有國家機遇和國際機遇的雙重疊加優勢，國家作為全球第二大經濟體，貢獻全球經濟增長超過三分一，是香港發展的最大機遇及最強後盾。他說，新一份施政報告就融入國家發展大局及深化國際交往合作提出措施，他在論壇上「抛磚引玉」，希望激發更多創新思路和務實建議， 將機遇轉化為實在的發展成果。"
本屆立法會最後一次大會　議員稱早餐會氣氛好並一洗近日情況,2025-10-23 10:39,,2025-10-23 11:00,local,rthk,https://news.rthk.hk/rthk/ch/component/k2/1828387-20251023.htm,"本屆立法會最後一次大會，今早續會，辯論議員議案。

在會議前，多名議員在宴會廳食早餐，期間議員向主席梁君彥送上一張大心意卡，卡上有88名議員的簽名。梁君彥向每名議員送上一張印有手繪全體議員樣貌及會議廳的心意卡。

自由黨主席邵家輝說，感謝梁君彥過去帶領議會面對重重挑戰，形容早餐會氣氛非常好，一洗近日的情況，眾人都很開心。民建聯的陳勇形容，梁君彥所贈送的心意卡是很好的紀念。

另外，多名議員仍未表態是否競逐連任，包括選委界的謝偉俊、洪雯、林筱魯等。其中林筱魯說仍考慮中，有決定後會公布，他指出立法會是一個團隊，團隊中人有不同背景和長處，他要思量自己能扮演甚麼角色。"
調查：香港僱員今年平均加薪2.5%　大灣區內薪酬加幅均放緩,2025-10-23 10:36,,2025-10-23 11:00,local,rthk,https://news.rthk.hk/rthk/ch/component/k2/1828385-20251023.htm,"浸會大學公布「粵港澳大灣區薪酬及福利調查」結果，顯示區內各城市的企業加薪幅度有所放緩，今年香港僱員的平均薪酬加幅為2.5%，較去年低1個百分點，三分之一受訪香港企業預測明年的平均加薪幅度為2.8%，其餘大多機構仍未作出預測。

調查由浸大工商管理學院人力資源策略及發展研究中心、華南理工大學、香港人才管理協會等機構，在7至9月期間進行，共有來自大灣區的258間機構參與，涵蓋逾24萬名僱員。

調查發現，澳門和廣東省九個城市今年平均加薪幅度分別為1.6%和1.8%，低於去年的2.7%和2.3%。

調查亦發現，今年香港的大學本科畢業生平均起薪點未有增長，維持在19500元，終止連續5年的升勢，僅資訊科技和財務會計行業錄得輕微升幅。

香港企業「中層/主任/專業人員」，以及「管理/經理級僱員」流失率由去年的12.5%和9.1%，分別回落至今年的9.8%和8.3%，反映近年移民潮對香港企業中高層管理人員離職的影響，自2018年起首次紓緩。"
龐建貽滿意海洋公園營運　六隻大熊貓是強心針,2025-10-23 10:32,,2025-10-23 11:00,local,rthk,https://news.rthk.hk/rthk/ch/component/k2/1828383-20251023.htm,"海洋公園昨日公布2024/2025年度業績，總收入按年增長9%，經營盈餘轉虧為盈，但包括水上樂園虧損等因素，整體虧蝕大約2億7千萬元。海洋公園主席龐建貽說，滿意整體營運情況。

龐建貽在出席本台節目《千禧年代》表示，公園入場人數及收入逐年攀升，特別是現時公園有六隻大熊貓，對公園是強心針，本地及非本地旅客到訪數字分別上升9%及12%。對於整體虧蝕超過2億元，龐建貽表示，有關數字涉及折舊及回撥等因素，認為應該留意公園錄得經營盈餘，由對上一個年度虧蝕1700萬到今年賺到4200萬元，形容值得鼓舞。他說公園的現金流有進步，期望財政可以繼續穩健。

被問到政府提供4年、每年2.8億元的保育及教育補助，將於2025/26年度屆滿，龐建貽表示，公園投放三成支出進行教育及保育工作，希望同政府繼續磋商，以維持有關工作，否則部分項目可能要減少。

對於水上樂園的經營情況，龐建貽承認面對困難，要考慮如何繼續改善，團隊會與持份者及政府討論如何扭轉情況。"
古巴據報拘捕一名從墨西哥逃脫華人芬太尼毒梟　他同時遭美墨通緝,2025-10-23 10:22,,2025-10-23 10:45,cinternational,rthk,https://news.rthk.hk/rthk/ch/component/k2/1828382-20251023.htm,"法新社引述墨西哥安全消息，古巴拘捕一名華人芬太尼毒梟，他今年7月在墨西哥關押期間逃脫，同時被美國與墨西哥通緝。

報道說，被捕男子譯音姓張，綽號「王大哥」，他將被扣留在古巴，等待當局就其引渡作出決定。

報道說，男子與墨西哥兩個販毒集團有密切合作，這兩個集團被美國政府列為外國恐怖組織。

他去年10月在墨西哥被捕，被關押在墨西哥城一座監獄，等待引渡至美國的聽證會，他曾獲准家居監禁，但在今年7月逃脫。

墨西哥安全部長去年曾指控男子是主要的國際洗錢操盤手，負責與其他販毒集團建立聯繫，將芬太尼從中國轉運至中美洲、南美洲、歐洲及美國。"
明略科技首日招股　集資最多近10.2億元,2025-10-23 09:56,,2025-10-23 10:15,cfinance,rthk,https://news.rthk.hk/rthk/ch/component/k2/1828372-20251023.htm,"內地數據智能應用軟件公司明略科技今日起公開招股，集資最多近10.2億元。

公司計劃發行721.9萬股A類股份，10%在香港公開發售。每股發售價141元，每手40股，入場費約5697元。

集資所得計劃用於提升技術研發能力、產品開發、營銷、品牌推廣及銷售團隊擴張等。

股份下星期二中午截止認購，11月3日在主板買賣。股份代號2718。

騰訊現時是公司股東及核心關連人士，騰訊旗下Huang River Investment Limited亦是今次股份發售基石投資者。"
