title,date,summary,scrape_time,section,source,url,news_content
孫東稱政府全方位推動AI發展　打造香港成國際算力樞紐,2026-02-05 12:54,,2026-02-05 13:15,local,rthk,https://news.rthk.hk/rthk/ch/component/k2/1842777-20260205.htm,"創新科技及工業局局長孫東出席在「AI with HKPC」智慧AI方案展開幕禮致辭表示，特區政府一直循科研、算力、數據、人才以及資金等方面全方位推動AI發展，穩步推進多項政策措施。現有的AIR@InnoHK研發平台，目前已經累積資助16間聚焦人工智能與機械人的實驗室，當中包括研發與推出港產大模型的香港生成式人工智能研發中心。另外，正在積極籌備於今年內正式成立香港人工智能研發院，全面促進AI上游研發、中下游成果轉化及開拓應用場景。

在算力基礎方面，孫東說，現時香港的整體算力已達5000 PFLOPS，數碼港人工智能超算中心佔3000 PFLOPS算力，是支持香港AI發展的關鍵要素。另外，位於北區沙嶺的數據園區發展項目將進一步提升香港整體算力的規模和水準，推動數據及AI相關產業發展，打造香港成為國際算力樞紐。

他表示，特區政府亦一直支持企業擁抱AI所帶來的機遇，推出30億元的人工智能資助計劃，支援本地院校、研發機構和企業充分利用超算中心的算力，目前已經有約20個項目獲批資助。為加強企業支援，數字政策辦公室會在今年內推出「數碼企業身份」，並配備「AI助手」，為企業用戶提供更貼心的政務服務及協助降低營運成本。數碼轉型支援先導計劃將加入AI及網絡安全數碼方案，鼓勵中小企應用AI提升競爭力。

他說，人工智能正以前所未有的速度改變世界。香港擁有得天獨厚的科研基礎、國際化人才與開放的市場環境，正是推動AI產業化的最佳土壤。"
宏福苑火災獨立委員會指示會議　陸啟康稱9個月內完成報告是挑戰,2026-02-05 12:48,,2026-02-05 13:15,local,rthk,https://news.rthk.hk/rthk/ch/component/k2/1842776-20260205.htm,"政府就大埔宏福苑火災成立的獨立委員會早上召開指示會議，歷時約1個半小時。委員會主席陸啟康表示，根據現時要調查的文件及方向，要在9個月內完成報告，確實是挑戰，委員會計劃盡快進行聽證會，首場聽證會定於下月19日早上10時在中環展城館舉行，聽證會將持續進行，但委員會可不時按需要考慮押後。

陸啟康形容今次事故非常嚴重，公眾對調查工作盡快完成及得出結果有很高期望，雖然委員會沒有法定權力，但現階段不排除任何可能性，如果在搜集文件期間，遇到解決不到的問題，會保留向行政長官要求成立法定調查委員會的權力，但不論委員會是法定與否，聽證都應該盡量公開。

委員會代表大律師杜淦堃表示，現階段聽證會的具體安排仍存在不確定性，很難確定哪一個團體或個人會參與，又說相信公眾都很想知道證人數目及文件範疇等，但目前仍在搜集資料階段，不能作出進一步披露。

杜淦堃指出，由於調查工作涉及公眾利益，聆訊基本上會公開，確保有透明度。但如聆訊牽涉敏感資料，會考慮是否有需要以其他安排進行。"
國台辦稱民進黨當局將赴大陸和港澳警示「橙色」是政治操弄,2026-02-05 12:44,,2026-02-05 13:00,greater_china,rthk,https://news.rthk.hk/rthk/ch/component/k2/1842775-20260205.htm,"文化和旅遊部宣布近期將恢復上海居民赴金門和馬祖旅遊，促進兩岸人員交流往來。在北京，國台辦發言人陳斌華表示，大陸旅遊部門於2024年恢復福建居民赴金門、馬祖旅遊，受台灣旅遊業界和民眾歡迎，自恢復以來福建居民赴金門、馬祖旅遊人數超過20萬人次，展現兩岸旅遊交流合作成果。國家文旅部昨日的宣布，是順應兩岸同胞熱切期盼加強交流往來的切實舉措，回應台灣社會要和平、要發展、要交流、要合作的主流民意。

陳斌華說，將會與有關部門認真落實國共兩黨智庫論壇形成的共同意見，爭取盡快將有關成果落地，也希望民進黨當局盡快取消種種人為限制和禁令，為兩岸旅遊交流合作恢復正常排除障礙。

另外，陳斌華回應台灣有關方面將港澳地區旅遊警示維持「橙色」，建議民眾避免非必要旅遊，表示民進黨當局於2024年起將赴大陸和港澳地區旅遊警示提升為「橙色」，是不折不扣的政治操弄，已被事實證明是徒勞無功的逆勢操作。

陳斌華提到，去年台灣居民到訪港澳的人數，比2024年大幅增長，充分表明廣大台灣同胞不認同民進黨當局的倒行逆施，批評民進黨當局仍然一「橙」不變，將港澳地區根本不存在的旅遊風險「說事」，結果必然是被事實再度打臉。"
Hearings on deadly Tai Po fire to begin in March,2026-02-05 12:39,,2026-02-05 13:15,elocal,rthk,https://news.rthk.hk/rthk/en/component/k2/1842772-20260205.htm,"A string of hearings by an independent committee set up to look into the cause of the deadly Wang Fuk Court blaze will begin next month, with the judge leading the efforts acknowledging the challenge in wrapping up work before a nine-month deadline. 

The committee's direction conference began at 10am on Thursday with a minute of silence to mourn the 168 victims of the Tai Po fire last November.

Judge David Lok, who chairs the committee, gave an overview of the committee's work leading up to the conference at City Gallery in Central, such as inspecting the site of the fire and learning about the use of bamboo and metal scaffolding. 

He said the first hearing relating to the devastating inferno will take place on March 19. 

Lok told Thursday's session that it would be challenging to complete the work within nine months – a deadline set by the chief executive – judging by the information at hand. 

He also noted that the tragedy was ""very serious"" and said he understands members of the public have high expectations of the committee's work in uncovering the cause of the blaze. 

Former Bar Association chairman Victor Dawes, who was among six barristers appointed as counsel for the committee, said information the panel received would be presented to the public during subsequent hearings. 

Current examinations had shown a range of existing ""systemic issues"", according to Dawes, who said the matters were ""unacceptable"" and should not be overlooked. 

Representatives of government departments and statutory bodies, as well as Wang Fuk Court's property manager and the firm that provided consultancy for the estate's renovation at the time of the tragedy, were also present. A total of 400 seats had been reserved for the public. 

The committee, which was set up in December following the fire, is expected to examine a number of issues and make recommendations to the authorities.

Two people injured in the blaze remain in hospital in a stable condition, while 77 others have been discharged. 

Officials said healthcare staff would continue to provide appropriate treatment and care to the patients, adding that the Hospital Authority had provided services to around 2,000 residents affected by the fire."
Authorities smash illegal workers syndicate,2026-02-05 12:36,,2026-02-05 13:15,elocal,rthk,https://news.rthk.hk/rthk/en/component/k2/1842773-20260205.htm,"The Immigration Department on Thursday said it had smashed a cross-boundary syndicate involved in forgery and the hiring of illegal workers. 

The department also said a record 102 people had been arrested as part of the operation.

It said the syndicate had been actively recruiting mainland residents through online communication groups, luring them to work illegally in Hong Kong.

Officers said once the recruits arrived in the SAR, the syndicate provided forged Hong Kong identity cards, arranged dormitories, and assisted with job seeking. 

The department said the syndicate profited by charging mainlanders for the forged IDs, collecting rent from the arranged accommodation, and taking a cut from their salaries.

After about one year of operation, the syndicate is estimated to have earned more than  HK$20 million — the highest amount recorded when compared with similar cases.

The department launched a joint-operation with mainland law enforcement bodies between October and January, nabbing 119 people across both sides of the boundary. 

During raids at multiple locations across Hong Kong, including at suspected dormitories and workplaces employing the illegal workers, 102 people aged between 32 and 74 were arrested. 

Among those arrested were two individuals believed to be the masterminds and core members of the syndicate, 83 suspected illegal workers, and 17 employers who allegedly hired them.

Senior Principal Immigration Officer Tang Ka-fai said the syndicate had hidden the forged identity cards well, making detection difficult for enforcement officers. 

“When they raided the hideout of the illegal workers, some of the forged Hong Kong identity cards were hidden in some very hidden places, for example, inside books or some cans,” he said.

“Our investigators spent quite a lot of time taking out all the forged Hong Kong identity cards in the hideout.”

He said the forged ID cards seized were of inferior quality and lack security features. 

The officer added that, with careful observation, employers should be able to easily tell the difference between real and forged ID cards."
恒指半日跌340點　金融及晶片股向下,2026-02-05 12:22,,2026-02-05 13:15,cfinance,rthk,https://news.rthk.hk/rthk/ch/component/k2/1842771-20260205.htm,"港股向下，恒指半日收報26506點，跌340點，跌幅1.27%，主板半日成交約1683億元。

科技指數在5300點關口附近反覆，中午收市報5304點，跌62點，跌幅1.16%。晶片股受壓，華虹半導體及中芯國際分別跌近6%及逾3%。

金融股亦下跌。"
​SmartPLAY康體通下周一晚11時至翌晨6時暫停服務,2026-02-05 12:22,,2026-02-05 13:15,local,rthk,https://news.rthk.hk/rthk/ch/component/k2/1842770-20260205.htm,"康文署宣布，SmartPLAY康體通將於本月9日星期一晚上11時至翌日上午6時暫停服務，以便進行系統維護。

用戶如需於上述期間使用系統，請預早安排，在服務暫停時段之前或後使用系統。"
宏福苑火災獨立委員會指示會議　有參與居民冀有平台表達意見,2026-02-05 12:06,,2026-02-05 13:15,local,rthk,https://news.rthk.hk/rthk/ch/component/k2/1842769-20260205.htm,"因應大埔宏福苑火災成立的獨立委員會早上10時舉行指示會議，就委員會日後的聽證會安排，給予指示。

有參與指示會議的宏昌閣居民朱女士表示，大火起因有很多不確定性，能夠查出真相當然好，但未抱很大期望。她又希望當局或委員會另外設立一個場合，讓宏福苑居民表達意見和訴求，包括居民安置及政府是否回購單位等問題。

居民鄧婆婆說，自己年紀大，希望政府盡快處理居民的居住問題，個人希望在大埔原區以「樓換樓」形式安置，居屋或綠置居也可以。"
內地股市半日向下　創業板指數跌近2%,2026-02-05 11:51,,2026-02-05 12:15,cfinance,rthk,https://news.rthk.hk/rthk/ch/component/k2/1842767-20260205.htm,"內地股市半日跌逾1%。貴金屬、電網設備及煤炭股下跌，消費、傳媒及銀行股向好。

上證綜合指數半日收市報4059點，跌42點，跌幅1.03%。

深證成份指數報13900點，跌255點，跌幅1.81%。

創業板指數報3247點，跌64點，跌幅1.94%。"
市監總局：今年兩新政策方面聚焦優化提升傳統產業　大力提振消費,2026-02-05 11:48,,2026-02-05 12:00,cfinance,rthk,https://news.rthk.hk/rthk/ch/component/k2/1842768-20260205.htm,"市場監督管理總局標準技術管理司司長劉洪生表示，今年在兩新政策方面會聚焦優化提升傳統產業，促進服務業優質高效發展，大力提振消費等，包括布局一批新專項行動，推動傳統產業標準更新，圍繞石化、機械、 汽車、電力等十大傳統產業高質量發展需求，推動標準制修訂，幫助產業轉型發展，又會推進消費品標準升級，聚焦消費者對安全、質量，綠色、健康等新需求，研究制定加快推進消費品國家標準升級工作方案。

市場監督管理總局副局長鄧志勇表示，去年啟動的《優化消費環境三年行動方案》已取得階段性成效，公布家電、傢俱、服裝等大宗消費品以及體育健身、文化旅遊餐飲等服務消費國家標準逾200項，亦制定和推廣養老服務標準體系、旅遊服務質量評價體系等。

他說，市場監管總局將推出放心消費標準、放心消費主體培育等政策文件，培育一大批帶動面廣、顯示度高的放心商圈、放心市場、放心景區，讓消費者可感可及。"
SMEs should embrace AI for competitiveness,2026-02-05 11:30,,2026-02-05 12:00,elocal,rthk,https://news.rthk.hk/rthk/en/component/k2/1842759-20260205.htm,"Secretary for Innovation, Technology and Industry Sun Dong has urged small and medium enterprises (SMEs) to adopt artificial intelligence to boost their competitiveness, as the government pushes to deepen AI integration across industries.

Speaking at the opening of the “Empowering SMEs for the AI Era” Solution Day - an event gathering industry leaders and tech experts - Sun said authorities are keen to strengthen AI infrastructure and application-driven growth. 

The two-day event is designed to offer SMEs one-stop support in governance, technology and talent, guiding them from pilot AI projects to full implementation.

""The government has been comprehensively advancing AI development in areas such as research, computing power, data, talent and funding, steadily implementing various policy measures."" Sun said.

He highlighted a HK$3 billion AI subsidy scheme launched to help local universities, research institutions and enterprises access the city’s supercomputing centre, with nearly 20 projects having been funded so far.

To further support businesses, the Digital Policy Office will launch a Digital Corporate Identity platform this year, featuring an AI assistant to provide more personalised government services and help lower operational costs.

Sun also confirmed that the Digital Transformation Support Pilot Programme will now include AI and cybersecurity solutions, explicitly encouraging SMEs to use AI to strengthen their market position.

""Artificial intelligence is changing the world at an unprecedented pace,"" he said. 

""Hong Kong possesses unique strengths in its research foundation, international talent and open market environment, making it the ideal ground for promoting AI industrialisation.""

He emphasised that AI is a key industry for the city’s transformation into an international innovation and technology hub.

The event, organised by the Hong Kong Productivity Council, features multiple booths showcasing practical AI tools aimed at optimising operations, improving customer experience, automating sales and marketing and strengthening risk management. 

Sunny Tan, the council's chairman, said AI is a strategic industry that can help businesses accelerate smart transformation, boost innovation and enhance competitiveness."
周思傑稱地盤禁煙定額罰款3千元具有阻嚇性,2026-02-05 11:24,,2026-02-05 12:00,local,rthk,https://news.rthk.hk/rthk/ch/component/k2/1842765-20260205.htm,"政府計劃地盤全面禁煙，香港建造業總工會理事長周思傑在本台節目《千禧年代》表示，歡迎政府考慮將對工人罰則改為定額罰款3000元，認為體現政府聽取市民意見及緩解工友憂慮。他說，罰款3000元對普通市民來說有阻嚇性，亦不排除有地盤會有額外規定或有「更辣」的措施處理。

周思傑指出，目前絕大部分地盤已實施禁煙，雖然並非法例要求，但相信對工友而言已成為習慣，將來會有相關法例及罰款作為阻嚇。他又相信，地盤可以透過加強人手管理，加上政府推動智慧工地，亦已安裝攝影攝錄器材，可以借助高科技監管。"
跨境偽證黑工集團119人被捕　入境處稱檢獲偽造身份證造工差劣,2026-02-05 11:22,,2026-02-05 12:00,local,rthk,https://news.rthk.hk/rthk/ch/component/k2/1842764-20260205.htm,"入境處聯同內地執法機關搗破一個跨境偽證及黑工集團，共拘捕119人，檢獲大批偽造香港身份證。入境處表示，今次拘捕人數及檢獲的偽造身份證數目，是同類案件中最高，相信已經瓦解有關集團。

高級首席入境事務主任鄧家輝表示，內地執法機關去年8月發現有不法集團透過內地手機通訊應用程式，招攬內地居民來港非法工作，他們表示會安排偽造身份證、提供宿舍及協助找工作等一條龍服務，並製作偽造香港身份證。

他說，不法集團製作偽造香港身份證後，會有人親身運送來港，以隱蔽方式例如收藏於鞋底，逃避口岸執法人員檢查。當有關內地居民來港後，集團會將偽證分發及協助找工作，並提供宿舍。集團每張偽證會收取約3200港元，每個床位每月收約1600至1800港元。

鄧家輝又說，有關偽造香港身份證的質素及造工差劣，欠缺防偽特徵，例如真證有「香港」字眼的觸覺浮雕，偽證的觸覺浮雕則相當粗糙和不完整。部分偽證更有些披口及表層有破爛。

入境處在港共拘捕102人，包括兩名集團主腦及成員、83名懷疑黑工和17名涉嫌聘用非法勞工的僱主。至於內地執法部門則拘捕17人。"
'Mulled building site smoking fine helps adaptation',2026-02-05 11:22,,2026-02-05 12:00,elocal,rthk,https://news.rthk.hk/rthk/en/component/k2/1842754-20260205.htm,"The Labour Department on Thursday said a proposed HK$3,000 fixed penalty for smoking at construction sites instead of the earlier proposal of up to HK$150,000 would help with law enforcement.

Commissioner for Labour Sam Hui told an RTHK radio programme that the previous plan took reference from existing legislation that allows the labour commissioner to order a smoking ban at high-risk sites, such as those that store flammable liquid.

The new proposal, he said, aligns with the Smoking (Public Health) Ordinance that prohibits smoking at designated places and allows workers to adapt to the rule easier.

""Adopting a fixed penalty means that a fixed penalty notice will be issued. The fact that needs to be addressed is very straightforward – whether or not there is evidence showing someone smoked or not. It's a black and white issue,"" he said.

""The site environment is not a main factor leading to the issuance of the notice. So in terms of law enforcement, it will be simpler.""

As for the plan to amend the law to suggest a maximum penalty of HK$400,000 for employers and subcontractors for smoking at construction sites, Hui said the amount is appropriate, and the court can decide on the punishment based on the severity of each case.

He went on to say that as long as the person in charge of a site has done his or her best to implement measures to ban smoking, their chances of getting prosecuted won't be high.

The commissioner hoped relevant amendments could be tabled to Legco in the first half of this year.

Chau Sze-kit, chairman of the Hong Kong Construction Industry Employees General Union, told the same programme that he welcomed the new proposal, saying that it carries a deterrent effect.

On the possibility of workers hiding to smoke, he said various ways such as beefing up manpower to promote the ban, and installing surveillance cameras at sites could help deal with the issue."
香港建造業總工會稱臨近「收爐」易忽略施工安全　籲勿貪一時之快,2026-02-05 11:20,,2026-02-05 12:00,local,rthk,https://news.rthk.hk/rthk/ch/component/k2/1842763-20260205.htm,"香港建造業總工會表示，歲晚臨近，不少建築及裝修地盤準備「收爐」，安全隱患容易被忽略，以往長假期前後，曾發生過多宗工業意外，呼籲工友勿因一時之快，造成身體傷害或錢財損失。

總工會表示，總結經驗，節日前部分地盤為趕工交付而加快進度，工序密度提高，如果監督和檢查不足，加上貪快等，容易出現事故。至於節日後，如工友和管理人員仍懷著節日心態上班，並無察覺工作環境變化就可能發生意外。

另外，總工會留意到騙徒藉工友急於求職心態，以「假工」利誘工友交出身份證、工人註冊證及平安卡等資料，擔心工友的個人資料可能成為「新黑工」的新個人身份憑藉，呼籲他們提高警覺。"
勞工處稱地盤禁煙以定額罰款處理執法較簡單　工友更易適應,2026-02-05 11:18,,2026-02-05 12:00,local,rthk,https://news.rthk.hk/rthk/ch/component/k2/1842762-20260205.htm,"政府計劃在地盤全面禁煙，考慮將罰則改為定額罰款3000元。勞工處處長許澤森在本台節目《千禧年代》解釋，現行禁煙法例針對有明顯火災風險地盤，相關最高刑罰是判罰15萬元，當初構思在地盤實施全面禁煙時，考慮沿用同一個罰則處理。但後來聽到部分工友意見，加上全面禁煙要求將會在所有地盤實施，因此認為有空間可以調整，考慮以定額罰款的方式處理，相信對在地盤工作人士來說會更易適應。他指出，暫時研究的方向是修訂部分附屬法例，期望可在今年上半年完成。

被問到以定額罰款處理是否較易執行，許澤森說實際上是，又說定額罰款亦即發出罰款通知書，只是牽涉有無證據顯示某人在地盤吸煙，形容「黑白很分明」，相信執法會簡單些。

對於工會的調查反映，工友普遍認為介乎3000至5000元的定額罰款可以接受。許澤森表示，當局有參考主要持份者，包括工友及工會組織對法例修訂細則的意見，同時要考慮地盤在處理職安健的法例框架下，是否有足以處理不同情況。因應部分地盤的風險程度較高，當局仍會採取法律手段提出起訴，再交予法庭處理。

被問到是否擔心有工人偷偷在地盤吸煙，令情況變得隱蔽，他表示，當局鼓勵工人配合職安健措施，將來也會與地盤管理人員和承建商商討如何在執法過程中合作，部分地盤的設備較齊全，亦有監控等紀錄，有助當局執法。"
市監總局：有效遏制平台亂收費、亂罰款等現象,2026-02-05 11:13,,2026-02-05 12:00,cfinance,rthk,https://news.rthk.hk/rthk/ch/component/k2/1842760-20260205.htm,"市場監督管理總局網絡交易監督管理司司長朱劍橋表示，平台經濟是社會經濟重要組成部分，近年快速發展的同時，亦面臨諸多挑戰，去年在平台經濟生態治理取得重要進展。

他表示，去年重點整治平台規則和收費突出問題，包括開展約談整改和排查整治，有力糾治「僅退款」、「強制運費險」、「全網最低價」等濫用規則問題，有效遏制平台亂收費、亂罰款等現象。

另外，重拳打擊直播電商亂象，針對假冒偽劣、虛假營銷等問題進行專項整治，集中發佈4批30件直播電商領域典型案例。他透露，將組織查辦並曝光一批網路交易典型案件，進一步規範網路交易，維護公平競爭秩序。

他又說，當局著力規範外賣平台非理性競爭，針對去年以來外賣行業出現的「口水仗」、「補貼戰」等擾亂市場競爭秩序的問題，對主要外賣平台企業加強調研指導，行政約談，劃出監管紅線，推動外賣平台規範促銷、理性競爭、守法經營。

他說，下一步將繼續壓實平台主體責任、健全監管制度、強化監管執法約束等完善平台經濟監管。"
宏福苑火災77名傷者已康復出院　餘下2人情況穩定,2026-02-05 11:13,,2026-02-05 12:00,local,rthk,https://news.rthk.hk/rthk/ch/component/k2/1842761-20260205.htm,"大埔宏福苑火災，醫衞局表示，共有79名傷者在不同的公立醫院接受治療，截至前日，已經有77名傷者先後康復出院。餘下兩名傷者均情況穩定。

醫管局表示，宏福苑共8座樓宇的所有居民、包括外籍家庭傭工，均可享有全額醫療費用豁免安排至今年12月31日，涵蓋醫管局轄下的住院、家庭醫學及專科門診、急症室、日間醫院、日間程序、社區服務及中醫診所暨教研中心。截至前日，醫管局已為約2000名受影響居民提供所需醫療服務。

另外，有超過300名私營家庭醫生參加義診計劃，涵蓋超過450個服務點，當中包括8間私家醫院，累計已處理105宗轉介。中醫義診服務則已有超過360名中醫師參加，涵蓋超過620個服務點，累計已處理64宗轉介。牙醫免費鑲配假牙服務有超過110名私營牙醫參加，涵蓋超過150個服務點，累計已處理33宗轉介。"
Local stocks open lower,2026-02-05 10:49,,2026-02-05 11:00,efinance,rthk,https://news.rthk.hk/rthk/en/component/k2/1842758-20260205.htm,"Local stocks opened lower on Thursday with the Hang Seng Index falling 219 points, or 0.82 percent, at 26,627.

Mainland stocks also opened lower on Thursday, with the Shanghai Composite Index down 0.66 percent to open at 4,075 and the Shenzhen Component Index losing 0.96 percent at 14,020. (Xinhua)"
