title,date,summary,scrape_time,section,source,url,news_content
HK airport closes runway as plane salvage works begin,2025-10-23 09:44,,2025-10-23 10:00,elocal,rthk,https://news.rthk.hk/rthk/en/component/k2/1828381-20251023.htm,"The Airport Authority said on Thursday that the north runway had been temporarily closed from 8 am to facilitate the removal of a cargo plane that veered off course and ended up in the sea after landing at Hong Kong International Airport (HKIA) three days ago.

The airport operator said the operation is expected to take a few days, with the assistance of the Guangzhou Salvage Bureau and Chu Kong passenger transport company. 

""Salvage vessels 'Nan Tian Xiang' and 'Nan Tian Peng', with maximum lifting capacity of 350 and 500 tonnes respectively, will arrive at the waters adjacent to HKIA these two days, bringing with them specialist equipment and a crew of about 80 professionals, including divers, machinists, boatmen and engineers,"" the authority said in a statement.

Authorities are still investigating why the Emirates cargo plane from Dubai skidded off the tarmac moments after landing on Monday morning.

The aircraft crashed into a security patrol vehicle and pushed it into the sea, killing two staff members on board."
南韓央行維持利率不變　符合預期,2025-10-23 09:42,,2025-10-23 10:00,cfinance,rthk,https://news.rthk.hk/rthk/ch/component/k2/1828380-20251023.htm,"南韓央行維持基準利率2.5厘不變，符合市場預期。自去年10月以來，南韓央行已累計減息1厘。

分析認為，樓價回升，韓元兌美元匯率下跌，都縮小進一步放寬政策的空間。

市場大多預期南韓11月再度減息。分析相信，房地產市場過熱，與美國貿易協議不確定，決策者將更重視與金融穩定相關的風險。"
內地股市初段偏軟,2025-10-23 09:38,,2025-10-23 10:00,cfinance,rthk,https://news.rthk.hk/rthk/ch/component/k2/1828379-20251023.htm,"滬深股市初段偏軟。

上證指數較早時報3911點，跌2點。

深證成份指數報12959點，跌36點。

創業板指數報3049點，跌10點。"
人行開展2125億元人民幣逆回購操作,2025-10-23 09:33,,2025-10-23 10:00,cfinance,rthk,https://news.rthk.hk/rthk/ch/component/k2/1828378-20251023.htm,"人民銀行公開市場開展2125億元人民幣7日期逆回購操作，利率維持於1.4厘。

對沖到期量後，單日錄得淨回籠235億元。"
恒指競價時段跌63點,2025-10-23 09:25,,2025-10-23 09:45,cfinance,rthk,https://news.rthk.hk/rthk/ch/component/k2/1828377-20251023.htm,"港股競價時段下跌，恒生指數報25718點，跌63點，跌幅0.25%。

科技指數報5882點，跌40點，跌幅0.68%。"
人民幣兌美元中間價創逾1年新高,2025-10-23 09:20,,2025-10-23 09:45,cfinance,rthk,https://news.rthk.hk/rthk/ch/component/k2/1828376-20251023.htm,人民幣中間價報7.0918兌1美元，較上日中間價升36點子，創逾1年新高。
《環看天下》：白宮東翼建宴會廳　政府停擺之際大興土木惹爭議,2025-10-23 09:18,,2025-10-23 10:00,cinternational,rthk,https://news.rthk.hk/rthk/ch/component/k2/1828375-20251023.htm,"美國白宮正式啟動一項大規模改建工程，包括改建位於東翼的建築，用來興建大型宴會廳，可以容納近一千人。白宮預計項目將於2029年1月前、即是總統特朗普第二個任期結束前完工。

新項目的造價估計約為2億5千萬美元。總統特朗普強調，資金完全來自私人募捐，不涉及任何公帑。不過，有意見關注項目會否觸發潛在利益衝突，亦質疑白宮在正值美國聯邦政府停擺之際大興土木，會否影響民眾觀感。"
機場北跑道暫時關閉　配合失事貨機打撈工作,2025-10-23 09:08,,2025-10-23 09:45,local,rthk,https://news.rthk.hk/rthk/ch/component/k2/1828374-20251023.htm,"機管局表示，為配合打撈及移走日前失事貨機的工作，香港國際機場北跑道今日早上8時起暫時關閉，相關工作預計持續數天。

打撈工作由機管局統籌，廣州打撈局聯同珠江客運受委託，派出兩艘專業打撈船，進行貨機打撈及移離工作。

打撈船「南天翔」及「南天鵬」將今明兩日陸續到達機場水域範圍，吊重能力分別達350及500噸。打撈船將帶同器材及專業團隊，包括潛水員、機械操作人員、船員、工程師等約80人。"
台股開市後向下,2025-10-23 09:06,,2025-10-23 09:15,cfinance,rthk,https://news.rthk.hk/rthk/ch/component/k2/1828373-20251023.htm,台灣股市下跌。加權指數較早時報27448點，跌200點，跌幅0.73%。
金沙中國上季盈利升近1.5%,2025-10-23 08:50,,2025-10-23 09:15,cfinance,rthk,https://news.rthk.hk/rthk/ch/component/k2/1828371-20251023.htm,"金沙中國公布，根據美國公認會計原則，上季盈利按年升近1.5%至2.72億美元，收入增加7.5%至19億美元。

期內，經調整物業EBITDA為6億美元，按年升2.7%。"
北韓證實昨日試射新的高超音速導彈,2025-10-23 08:19,,2025-10-23 08:30,cinternational,rthk,https://news.rthk.hk/rthk/ch/component/k2/1828370-20251023.htm,"北韓證實昨日試射新的高超音速導彈。

朝中社報道，導彈總局昨日主導進行重要武器系統試驗，從平壤市力浦區向東北方向發射兩枚高超音速飛行器，擊中位於咸鏡北道的目標。報道說，今次試射是國防力量發展項目的一環，旨在確保針對潛在敵人的戰略威懾持續有效。

朝中社的報道只提及新的武器系統，未介紹導彈類型等資料。韓聯社報道，鑒於朝方稱它為高超音速飛行器，朝方試射的可能是本月早前亮相勞動黨建黨80周年閱兵式的KN-23系列短程彈道導彈火星-11戊。這款導彈搭載形似高超音速滑行飛行器的彈頭。"
韓股初段跌逾1%,2025-10-23 08:08,,2025-10-23 08:15,cfinance,rthk,https://news.rthk.hk/rthk/ch/component/k2/1828368-20251023.htm,南韓股市在開市初段跌逾1%，首爾綜合指數較早時報3832點，跌51點，跌幅1.33%。
日股初段跌逾1%,2025-10-23 08:07,,2025-10-23 08:15,cfinance,rthk,https://news.rthk.hk/rthk/ch/component/k2/1828367-20251023.htm,日本股市在開市初段跌1%，日經平均指數較早時報48780點，跌527點，跌幅1.07%。
Tesla上季收入創新高　但經調整每股盈利遜預期,2025-10-23 08:00,,2025-10-23 08:15,cfinance,rthk,https://news.rthk.hk/rthk/ch/component/k2/1828365-20251023.htm,"電動車生產商Tesla公布，上季盈利按年跌37%至13.7億美元，經調整每股盈利50美仙，低過市場預期的54美仙，受電動車售價下調，以及營運成本增加約50%拖累，增加的成本與人工智能及其他研發項目有關。

期內，收入升12%至281億美元，創新高，高過市場預期的263.7億美元，結束連續兩季跌勢。季內汽車業務收入升6%至212.1億美元，亦好過預期，由於7500美元的聯邦電動車買車稅收抵免於9月底到期，帶動電動車銷量創新高。

上季能源發電與儲能業務收入升44%至近34.2億美元。

上季整體毛利率為18%，高過市場預期的17.5%。但市場關注的汽車業務毛利率為15.4%，略低過預期的15.6%。

公司未有公布今年全年業績指引。公司計劃明年啟動Cybercab自動駕駛出租車、重型電動卡車Semi，及新型儲能系統Megapack 3的量產，並正在建設人形機械人Optimus的首代生產線。

公司股價在收市後延長交易時段跌近4%。"
SpaceX切斷緬甸電騙園區周邊逾2500部星鏈設備的運作,2025-10-23 07:27,,2025-10-23 07:45,cinternational,rthk,https://news.rthk.hk/rthk/ch/component/k2/1828362-20251023.htm,"美國太空探索技術公司SpaceX副總裁德雷爾表示，公司已經在緬甸電騙園區周邊識別出超過2500部星鏈設備，並切斷它們的運作。

緬甸官方傳媒日前報道，軍方日前對邊境地區的KK電騙園區展開清剿行動，救出超過2000名工人，並查獲30套SpaceX的星鏈接收器及配件。

德雷爾在社交平台說，公司致力確保星鏈服務繼續成為一種向善的力量，並在全球範圍內維護信任，當發現存在違規行為，就會立即採取行動。"
特朗普取消與普京於布達佩斯的會面　美方制裁兩大俄羅斯石油公司,2025-10-23 07:17,,2025-10-23 07:45,cinternational,rthk,https://news.rthk.hk/rthk/ch/component/k2/1828358-20251023.htm,"美國總統特朗普宣布取消與俄羅斯總統普京在布達佩斯的會面，美方同時宣布對俄羅斯兩大石油公司，包括俄羅斯石油公司和盧克石油公司實施新制裁，尋求迫使莫斯科就烏克蘭問題舉行和平談判。

特朗普說，與普京每次談話都很愉快，但始終未能取得進展，他認為現在與普京會晤並不合適，雖然看起來雙方無法達成目標，但未來會再次舉行會晤。

特朗普在白宮橢圓形辦公室與到訪的北約秘書長呂特會晤時又說，他認為是時候對俄羅斯實施新制裁，形容已經等了俄方很長時間，但希望制裁不會持續很久。

美國財長貝森特說，由於普京拒絕結束這場毫無意義的戰爭，新制裁是必要的，指兩間石油公司為克里姆林宮的戰爭機器提供資金。"
利物浦歐聯反勝法蘭克福　終止在各項賽事四連敗頹勢,2025-10-23 06:53,,2025-10-23 07:15,csport,rthk,https://news.rthk.hk/rthk/ch/component/k2/1828359-20251023.htm,"歐聯第三輪賽事，利物浦作客5:1反勝德甲法蘭克福，終止在各項賽事四連敗的頹勢。

車路士主場以同樣比數贏阿積士，三位年輕球員取得入球。

另一支英超球隊熱刺作客摩納哥，在門將域卡利奧連番撲救下保持不失，與對手互交白卷。

皇家馬德里在主場憑比寧咸下半場一箭定江山，1:0擊敗祖雲達斯。

拜仁慕尼黑主場4:0贏布魯日。"
港股美國預託證券普遍較本港收市下跌,2025-10-23 06:46,,2025-10-23 07:00,cfinance,rthk,https://news.rthk.hk/rthk/ch/component/k2/1828355-20251023.htm,"港股美國預託證券（ADR）普遍較本港收市下跌。

金融股方面，港交所和友邦ADR較本港收市跌逾0.3%至逾0.4%；滙控則升約0.8%。

至於科技股，ATMXJ中除了美團ADR較本港收市微升近0.1%之外，其餘跌幅介乎逾0.3%至逾0.5%。"
特朗普：計劃在南韓與習近平長時間會談　相信能夠達成協議,2025-10-23 06:26,,2025-10-23 07:00,cinternational,rthk,https://news.rthk.hk/rthk/ch/component/k2/1828356-20251023.htm,"美國總統特朗普說，計劃在南韓與中國國家主席習近平進行一次長時間會談，相信兩人能夠達成協議，並不排除會討論俄羅斯石油以及結束俄烏衝突等議題。

路透社就引述多名美國知情人士報道，特朗普政府正在考慮，限制一系列軟件驅動產品出口到中國，以回應中方的新一輪稀土出口管制，受影響產品可能包括手提電腦及飛機引擎等。

消息人士估計，美方可能會宣佈措施，但不會推進落實，目的只是向中方施壓。消息人士又強調，這並非美方的唯一選擇，透露政府內部有人主張較溫和、影響範圍較小的措施。

中國駐美大使館回應路透社提問時，未有就任何具體措施發表評論，重申反對美國實施單邊長臂管轄措施。"
US mulls curbs on software-related exports to China,2025-10-23 06:24,,2025-10-23 06:45,efinance,rthk,https://news.rthk.hk/rthk/en/component/k2/1828354-20251023.htm,"The Trump administration is considering a plan to curb an array of software-powered exports to China, from laptops to jet engines, to retaliate against Beijing's latest round of rare earth export restrictions, according to a US official and three people briefed by US authorities.

While the plan is not the only one being deliberated, it would make good on President Donald Trump's threat earlier this month to bar ""critical software"" exports to China by restricting global shipments of items that contain US software or were produced using US software.

On October 10, Trump said in a social media post that he would impose additional tariffs of 100 percent on China's US-bound shipments, along with new export controls on ""any and all critical software"" by November 1 without further details. To be sure, the measure, details of which are being reported for the first time, may not move forward, the sources said.

But the fact that such controls are being considered shows the Trump administration is weighing a dramatic escalation of its showdown with China, even as some within the US government favor a gentler approach, according to two of the sources.

""I will confirm that everything is on the table,"" US Treasury Secretary Scott Bessent told reporters at the White House on Wednesday when asked about software curbs on China.

""If these export controls – whether it's software, engines or other things – happen, it will likely be in coordination with our G7 allies.""

US stock indexes dipped following the Reuters report, before paring losses. The S&P 500 closed down 0.5 percent while the Nasdaq was about 0.9 percent lower at the market's close.

Emily Kilcrease, a former trade official now at the Center for a New American Security, said software was a natural point of leverage for the US. Still, such controls would be extraordinarily difficult to implement and would lead to blowback for US industry, she said.

""You would hope they are only putting threats on the table that they would carry out and stick with,"" Kilcrease said.

The White House declined to comment. The Commerce Department, which oversees export controls, did not respond to requests for comment.

A spokesperson for the Chinese embassy did not comment on the specific US measures under consideration but said China opposed the US ""imposing unilateral long-arm jurisdiction measures"" and vowed to ""take resolute measures to protect its legitimate rights and interests"" if the US proceeds down what it views as a wrong path. (Reuters)"
國際油價升逾2%　美國原油庫存下降,2025-10-23 06:21,,2025-10-23 06:45,cfinance,rthk,https://news.rthk.hk/rthk/ch/component/k2/1828353-20251023.htm,"國際油價升逾2%，美國能源信息署（EIA）數據顯示，上周美國原油、汽油和蒸餾油庫存減少。

倫敦布蘭特期油收市報每桶62.59美元，升1.27美元，升幅近2.1%。

紐約期油報每桶58.5美元，升1.26美元，升幅2.2%。"
Stocks mostly fall on lacklustre results from Netflix,2025-10-23 06:12,,2025-10-23 06:30,efinance,rthk,https://news.rthk.hk/rthk/en/component/k2/1828350-20251023.htm,"Gold prices sank further on Wednesday while major stock markets mostly fell following some disappointing corporate earnings amid lingering worries over trade tensions.

Major US indices fell, with the Dow retreating from a record the prior day, as lacklustre results from Netflix added to angst that upcoming reports from other tech giants may also fall short.

""Any time you've got stocks that are priced with high expectations, if you're not meeting those expectations, then the market is going to struggle with that,"" said Dave Grecsek, a partner at wealth management firm Aspirant.

More broadly, the market is wondering if ""we are overextended here in this artificial intelligence trade,"" he added.

Further earnings reports from US tech giants and other blue chips in the coming days, including from Tesla, were also keeping investors wary as they gauged the business outlook and the impacts of US President Donald Trump's tariffs.

Late on Wednesday, Tesla reported a 37 percent drop in profits to US$1.4 billion, in results that missed analyst forecasts. The company cited a drag from tariffs and other expenses.

Gold was once again a major focus after plunging six percent on Tuesday, a sell-off from record highs that rattled investor confidence in what is traditionally a safe-haven asset.

Traders are ""desperately trying to gauge whether... (Tuesday's) historical collapse was indicative of a new period of weakness or simply a case of blowing off steam after a dramatic surge into record highs"", said Joshua Mahony, chief market analyst at Scope Markets.

Gold fell a further 1.4 percent to around US$4,060 an ounce on Wednesday after chalking up a record peak above US$4,381 on Monday.

The retreat hit the share prices of gold miners, while individual companies were impacted by earnings updates.

On the upside, Barclays and UniCredit posted positive results, easing fears of a new banking crisis emerging in the United States.

Among individual companies, Netflix slumped more than 10 percent after the streaming giant reported earnings that missed estimates.

Netflix executives told financial analysts on an earnings call that absent the hefty cost in Brazil due to a tax dispute, it would have exceeded its operating margin forecast in the quarter.

The Dow Jones fell 0.7 percent, to 46,590, the S&P 500 slipped 0.5 percent, to 6,699, and the Nasdaq lost 0.9 percent, to 22,740. (AFP)"
金價跌勢持續　紐約期金低收逾1%,2025-10-23 06:11,,2025-10-23 06:30,cfinance,rthk,https://news.rthk.hk/rthk/ch/component/k2/1828352-20251023.htm,"金價跌勢持續，投資者在美國通脹數據公布前沽貨獲利。

現貨金一度跌向每盎司4000美元關口，低見4003.39美元，較早時報4099.45美元，跌幅近0.6%。

紐約12月期金收市報每盎司4065.4美元，跌幅近1.1%。"
美元回軟　英鎊因英國通脹低過預期而下跌,2025-10-23 06:11,,2025-10-23 06:30,cfinance,rthk,https://news.rthk.hk/rthk/ch/component/k2/1828351-20251023.htm,"美元回軟，美元指數在紐約尾市報98.91，跌幅近0.1%。

英國9月通脹率維持於3.8%，低過市場預期，英鎊兌美元一度跌逾0.4%，尾市跌幅收窄至近0.1%，報1.3355美元。

歐元兌美元尾市升近0.1%，報1.1608美元。

美元兌日圓變動不大，尾市報151.95日圓。"
道指低收334點　納指跌近1%　Netflix急挫10%,2025-10-23 06:11,,2025-10-23 06:30,cfinance,rthk,https://news.rthk.hk/rthk/ch/component/k2/1828349-20251023.htm,"美股3大指數收市下跌，因企業業績差過市場預期，加上有報道指，特朗普政府正考慮限制對華出口含有或使用美國軟件製造的產品，都拖累大市走勢。

道瓊斯指數一度跌逾460點，收市報46590點，跌334點，跌幅0.7%。納斯達克指數曾跌1.9%，收市報22740點，跌213點，跌幅0.9%。標準普爾500指數報6699點，跌35點，跌幅0.5%。

Netflix急跌10%，因上季盈利不及預期。德州儀器跌5.6%，公司上季業績差過預期，拖累同業股價向下，美光科技跌近2%，AMD跌逾3%。

反映中概股表現的納斯達克中國金龍指數跌0.9%。

Tesla收市後公布，上季經調整盈利每股50美仙，低過市場預期的54美仙。但收入按年升12%至281億美元，高過預期的263.7億美元，結束連續兩季跌勢。季內汽車業務收入升6%至212.1億美元，亦好過預期。股價在收市後延長交易時段跌近2%。

另外，IBM上季經調整每股盈利2.65美元，高過預期的2.45美元，收入按年升9%至163.3億美元，高過預期的160.9億美元。公司上調按固定匯率計算的全年收入預測，由之前預計至少增長5%，上調增幅至逾5%，但盤後股價仍跌逾5%。"
歐盟通過新一輪對俄制裁　包括禁止進口俄羅斯天然氣,2025-10-23 05:42,,2025-10-23 06:00,cinternational,rthk,https://news.rthk.hk/rthk/ch/component/k2/1828348-20251023.htm,"歐盟通過新一輪對俄制裁，措施包括禁止進口俄羅斯天然氣。

歐盟輪值主席國丹麥宣佈，已經啟動書面批准程序，預計措施當地星期四通過後生效。

此輪將是歐盟對俄羅斯的第19輪制裁，措施包括禁止進口俄羅斯天然氣、對俄羅斯外交人員的入境限制、及將俄羅斯影子艦隊中過百艘艦艇列入制裁名單；其中天然氣進口禁令將會分兩階段生效。

路透社引述歐盟外交消息人士報道，此輪制裁還會包括四間中國石油業相關實體，但具體名單尚未公開。"
歐股收市個別發展,2025-10-23 05:20,,2025-10-23 05:45,cfinance,rthk,https://news.rthk.hk/rthk/ch/component/k2/1828347-20251023.htm,"歐洲主要股市收市個別發展。

德國DAX指數報24151點，跌178點，跌幅0.7%。

法國CAC指數報8206點，跌51點，跌幅0.6%。

英國富時100指數報9515點，升88點，升幅0.9%，連升3日。"
聯合國國際法院促以色列履行義務　為人道援助進入加沙提供便利,2025-10-23 05:18,,2025-10-23 05:45,cinternational,rthk,https://news.rthk.hk/rthk/ch/component/k2/1828346-20251023.htm,"聯合國國際法院表示，以色列必須履行國際人道法義務，為人道援助進入加沙地帶提供便利。

國際法院應聯合國大會要求，發佈諮詢意見，表示以色列作為佔領國，不得以安全為由，阻止被佔領土的人道援助活動，敦促以色列必須確保加沙平民獲得基本生活物資以及醫療服務。國際法院又表示，以色列要為各聯合國機構、其他國際組織及第三國開展的救援計劃提供便利。

聯合國秘書長古特雷斯透過發言人表示，希望以色列遵守國際法院的諮詢意見。不過以色列外交部表示堅決拒絕，批評是試圖對以色列施加政治制裁。"
特朗普否認授權放寬烏克蘭使用西方遠程導彈,2025-10-23 04:42,,2025-10-23 05:00,cinternational,rthk,https://news.rthk.hk/rthk/ch/component/k2/1828345-20251023.htm,"美國總統特朗普否認授權放寬烏克蘭使用西方遠程導彈。

《華爾街日報》較早時引述美國官員報道，表示美國政府已經解除限制，允許烏克蘭使用西方盟友提供的遠程導彈，以增強烏克蘭對俄羅斯境內目標的打擊能力。

特朗普隨後在社交媒體發文否認，批評報道是假新聞，說這些遠程導彈無論由哪個國家提供、烏克蘭用於甚麼用途，都與美國無關。

另外，烏克蘭武裝部隊總參謀部當地星期二表示，對俄羅斯布良斯克州一間化工廠進行大規模空中打擊，並表示行動中使用了英國提供的風暴之影巡航導彈，成功突破俄方防空系統，打擊這個俄方生產火藥和火箭彈燃料的關鍵設施。"
羅浮宮館長承認閉路電視有盲點及部分監控設備老舊　承諾升級系統,2025-10-23 04:20,,2025-10-23 05:00,cinternational,rthk,https://news.rthk.hk/rthk/ch/component/k2/1828344-20251023.htm,"法國羅浮宮日前發生藏品失竊案，羅浮宮館長卡爾到參議院出席聽證會。

卡爾強調，羅浮宮內外安裝了大量閉路電視，案發時監控及警報系統正常運作，但她承認安保系統有漏洞，未能及早發現可疑人士。卡爾解釋，案發地點阿波羅長廊的閉路電視鏡頭存在盲點，未能完整拍攝疑匪爬梯進入羅浮宮的情況。至於博物館外圍的閉路電視，部分已經老舊，監控力度不足。

卡爾承諾升級閉路電視系統、在館內設立警察站、以及禁止車輛在羅浮宮附近停泊。卡爾又說，案發後曾經向文化部請辭但被拒。

盜竊案涉及9件珠寶，估計價值約8800萬歐元，其中一頂屬於拿破崙三世妻子歐仁妮皇后的王冠，在現場附近尋回，相信是疑匪逃離時遺下。卡爾說，疑匪在玻璃展櫃切割出小缺口，再伸手入內取出珠寶，期間擠壓到這頂王冠，令其損毀。博物館人員初步評估，認為這頂鑲嵌了1300多顆鑽石的王冠，應該能夠修復。

羅浮宮在案發後三天重新開放遊客參觀，但阿波羅長廊仍然關閉。政府發言人布雷容說，當局正在循行政和司法兩方面調查，並表示總統馬克龍在內閣會議中，要求有關部門加快部署羅浮宮的安全保障措施。"
美國國防部在太平洋東部打擊運毒船隻　擊斃兩名恐怖分子,2025-10-23 02:21,,2025-10-23 02:45,cinternational,rthk,https://news.rthk.hk/rthk/ch/component/k2/1828341-20251023.htm,"美國再次採取行動，打擊運毒船隻。

美國國防部長赫格塞思在社交媒體，發放美軍行動的片段，表示在總統特朗普指示下，國防部在太平洋東部，對一艘運毒船隻採取致命打擊行動。

赫格塞思說，根據情報，這艘船與恐怖組織有關聯，當時載有毒品，正沿一條已知的毒品販運路線過境，懷疑企圖走私毒品。

赫格塞思強調，今次打擊行動發生在國際水域，船上兩名涉嫌運毒的恐怖分子被擊斃，沒有美軍人員在行動中受傷。"
據報美國政府考慮限制對華出口　使用美國軟件製造的產品,2025-10-23 01:36,,2025-10-23 02:00,cinternational,rthk,https://news.rthk.hk/rthk/ch/component/k2/1828339-20251023.htm,"據報美國政府正在考慮，限制對華出口使用美國軟件製造的產品。

美國總統特朗普早前表示，下月1日起將對所有美國關鍵軟件實施新的出口管制。路透社引述多名美國政府消息人士報道，特朗普政府正在考慮限制一系列軟件驅動產品出口到中國，以回應中方的新一輪稀土出口管制，受影響產品可能包括手提電腦及飛機引擎等。

消息人士強調措施並非美方的唯一選項，並透露政府內部有人主張較溫和、影響範圍較小的措施。消息人士估計，美方可能會宣佈措施，用作向中方施壓，但不會落實，白宮和商務部都未有回應報道。

中國駐美大使館回應路透社提問時表示，反對美國實施單邊長臂管轄措施，並說如果美國繼續沿著錯誤道路前進，中國將堅決採取措施，維護自身合法權益。"
