title,date,summary,scrape_time,section,source,url,news_content
富麗敦海洋公園酒店有員工受傷　酒店指客人所聘外判布置期間發生,2026-02-14 20:05,,2026-02-14 20:15,local,rthk,https://news.rthk.hk/rthk/ch/component/k2/1843870-20260214.htm,"香港富麗敦海洋公園酒店下午發生工業意外，一名女工被木板擊中頭部受傷，一度昏迷送院治理。酒店回覆查詢時表示，受傷員工已清醒，由於警方已接手調查，暫未能提供進一步資料。

酒店在回覆中表示，是婚宴客人聘用的外判公司在搬運場地布置物資期間發生意外，該名酒店員工途經時受傷。

警方表示，在下午近4時半接報，一名年約50多歲的女工在酒店工作期間，被木板擊中頭部，正調查事故原因。


編輯：陳曉慶"
截至下午4時共近69萬人次經各管制站出入境,2026-02-14 20:03,,2026-02-14 20:45,local,rthk,https://news.rthk.hk/rthk/ch/component/k2/1843869-20260214.htm,"農曆新年將至，入境處預計今日是陸路出境高峰期，截至下午4時，共有近69萬人次經各管制站出入境，當中有近44萬人次出境，以及近25萬人次入境。

在出境方面，超過37萬1千人次是香港居民，最多人經羅湖口岸出境，其次是深圳灣口岸。

在入境方面，超過12萬人次是內地訪客，最多內地旅客經高鐵西九龍站入境，其次是落馬洲支線口岸。


編輯：陳曉慶"
截至下午4時共逾69萬人次經各管制站出入境,2026-02-14 20:03,,2026-02-14 20:15,local,rthk,https://news.rthk.hk/rthk/ch/component/k2/1843869-20260214.htm,"農曆新年將至，入境處預計今日是陸路出境高峰期。截至下午4時，共有超過69萬人次經各管制站出入境，當中有超過44萬人次出境，以及超過25萬人次入境。

在出境方面，近37萬2千人次是香港居民，最多人經羅湖口岸出境，其次是落馬洲支線口岸。

在入境方面，超過12萬人次是內地訪客，最多內地旅客經高鐵西九龍站入境，其次是落馬洲支線口岸。


編輯：陳曉慶"
周霽稱要始終堅守一國兩制最高原則　董經緯指維護國安鬥爭從未停,2026-02-14 20:01,,2026-02-14 20:15,local,rthk,https://news.rthk.hk/rthk/ch/component/k2/1843868-20260214.htm,"特區政府上午在政府總部，舉辦《「一國兩制」下香港維護國家安全的實踐》白皮書專題研討會。

中聯辦主任周霽致辭時說，《白皮書》對於正本清源、凝聚共識、鞏固香港「由亂到治」走向「由治及興」的良好局面，具有重大深遠意義。他分享3點體會，包括深刻把握香港維護國家安全的歷史邏輯，要始終堅守「一國兩制」的最高原則，要始終在法治軌道上切實維護國家安全，要持續推進以高水平安全護航「一國兩制」事業高質量發展。

中央駐港國安公署署長董經緯致辭時說，《白皮書》意義重大，香港維護國家安全的鬥爭從未停止，中央政府在香港問題上始終將維護國家安全擺在重要位置。有了安全的護航，「一國兩制」得以堅持和完善，必將繼續行穩致遠。公署將一如既往堅定依法履職，全力支持特區全面準確實施香港國安法律，堅決防範打擊外部勢力干擾破壞。

清華大學法學院教授王振民發言時說，《白皮書》實際上是國家關於香港維護國家安全鬥爭歷史的全面總結和系統疏理，並形容國家安全猶如空氣、陽光，受益而不覺，失之則難存。他又說，在香港維護國家安全，就是維護全球產業鏈、供應鏈、資金鏈安全，維護國際經濟金融安全，維護經濟全球化的基本秩序，強調投資者可以放心，香港不會再亂，既保安全，又保發展，有活力，有自由，長期保持資本主義制度和生活方式不變，嚴格保護私有財產和營商環境。
 
基本法委員會前副主任譚惠珠說，中央和香港特區合力平定了2019年黑暴、港版「顏色革命」之亂，訂立《香港國安法》和《維護國家安全條例》，歷史性築牢香港維護國家安全的法律長城、創設「一國兩制」模式的維護國安機制；把愛國者治港原則法律化、完善香港的選舉制度等成果。


編輯：陳曉慶"
王毅：日本軍國主義陰魂不散,2026-02-14 18:32,,2026-02-14 18:45,greater_china,rthk,https://news.rthk.hk/rthk/ch/component/k2/1843867-20260214.htm,"中共中央政治局委員、外長王毅在德國出席慕尼黑安全會議的對談環節。他表示，德國在戰後全面清算了納粹，但日本完全不一樣，政要仍絡繹不絕參拜供奉甲級戰犯的神社，說明日本軍國主義陰魂不散。

王毅表示，當年日本就是以所謂「危機存亡事態」對中國發動侵略，如果不思悔改，勢必重蹈覆轍，警告日本如走回頭路，屬自取滅亡。



編輯：梁家奇"
蔡若蓮：不排除再檢視專上院校非本地生上限,2026-02-14 18:26,,2026-02-14 18:45,local,rthk,https://news.rthk.hk/rthk/ch/component/k2/1843858-20260214.htm,"本港資助專上院校非本地生自費就學人數上限，在本學年已放寬至相當於本地資助學額的40%，教育局局長蔡若蓮出席一個電台節目時表示，不排除有需要時再檢視上限，但強調不會影響本地生升學機會。

另外， 對於建議引入的教師執業證書制度，須每3年續牌一次，蔡若蓮認為是比較合適，亦考慮了實際需要和行政安排。



編輯：梁家奇"
李家超出席維護國安白皮書專題研討會,2026-02-14 18:26,,2026-02-14 18:45,local,rthk,https://news.rthk.hk/rthk/ch/component/k2/1843859-20260214.htm,"行政長官李家超和中聯辦主任周霽等，在政府總部出席《「一國兩制」下香港維護國家安全的實踐》白皮書專題研討會。

李家超表示，《白皮書》對香港有一錘定音的指導意義；發布時間正值黎智英被法庭重判翌日，具有立足現實的警示意義；同時又系統論述了以高水平安全護航「一國兩制」事業高質量發展，具有實踐落實的行動意義。



編輯：劉景輝"
【重溫】2026年2月14日新聞天地,2026-02-14 18:25,,2026-02-14 18:45,local,rthk,https://news.rthk.hk/rthk/ch/component/k2/1843866-20260214.htm,詳盡報道本地時事、大中華消息、國際局勢等新聞，緊貼最新熱話。
警方接約百宗疑「新型碰瓷黨」案件　周一鳴稱會有下一浪行動,2026-02-14 18:22,,2026-02-14 18:45,local,rthk,https://news.rthk.hk/rthk/ch/component/k2/1843857-20260214.htm,"警方至今接獲約100宗懷疑「新型碰瓷黨」交通意外索償詐騙案，早前已搜查一間律師行，拘捕兩名醫生及一對夫婦。警務處處長周一鳴表示，一定有下一浪行動，呼籲專業人士勿作失德行為，形容是「天理不容」。  

周一鳴出席本台節目時又表示，處理大埔宏福苑火災的跨部門小組希望加快工作進度，但因為仍有很多科學鑑證工作要做，暫時難以確定何時有調查結果。



編輯：劉景輝"
It's the twelfth of never for some at Flower Market,2026-02-14 18:16,,2026-02-14 18:45,elocal,rthk,https://news.rthk.hk/rthk/en/component/k2/1843860-20260214.htm,"The Flower Market in Prince Edward was crowded on Saturday as hundreds of people packed the place in search of the best bouquets for their loved ones on Valentine's Day.

One romantic, Kwan, said he had been buying flowers every year for more than two decades. 

""I picked 12 roses and the colour is a bit special this time, light red, because I don't want it to be just normal red roses every year. It represents everlasting love,"" he said. 

""For us, every day is Valentine's Day. My wife keeps telling me there is no need to buy flowers and not to waste money, but I insist on buying them. 

""I think it is a small token of my affection and this will never change.""

A couple, the Tangs, were shopping for flowers for the Lunar New Year, with the husband saying he would hand over cash to mark the day instead of a bouquet.

""I take a more practical approach, and cash is the most practical of all. She can buy whatever she wants,"" he said. 

The Tangs shared their secrets to keeping the chemistry in their 45-year-old marriage alive – generous doses of give and take and a perennial desire to keep the wife happy. 

In spite of the crowds, a vendor, Wong, said business was down 30 percent this year due to Valentine's Day falling so close to Lunar New Year. 

""Some married couples prefer to buy flowers for the New Year rather than for Valentine's Day,"" she said. 

""Supplies were also very expensive. For example, prices for roses have doubled... and it's also hard to find wrappers as some of them may refuse to wrap Valentine's Day bouquets if they have to deal with the ones for the New Year."""
漁護署義工隊聯同各界到西貢清理垃圾推廣「自己垃圾自己帶走」,2026-02-14 17:48,,2026-02-14 18:15,local,rthk,https://news.rthk.hk/rthk/ch/component/k2/1843864-20260214.htm,"漁護署聯同來自企業、非政府組織及其他政府部門的義工隊，未來數月將在麥理浩徑進行一系列清理垃圾及公眾教育活動，推廣「自己垃圾自己帶走」的環保理念。

漁護署發言人說，自2015年起開始推廣這個理念，過去10年見到遠足人士處理垃圾的習慣已逐漸改善；資料亦顯示2025年郊野公園棄置垃圾量較2015年已減少超過40%。

漁護署義工隊今日就聯同一間企業的義工隊，合共約30人到西貢西灣山附近一帶清理垃圾，義工亦向遊人講解在偏遠路段自行帶走垃圾，能夠直接改善環境衞生，鼓勵市民為維護郊野公園的潔淨環境出一分力。


編輯：陳曉慶"
漁護署義工隊聯同各界到西貢清理垃圾並推廣「自己垃圾自己帶走」,2026-02-14 17:48,,2026-02-14 18:00,local,rthk,https://news.rthk.hk/rthk/ch/component/k2/1843864-20260214.htm,"漁護署聯同來自企業、非政府組織及其他政府部門的義工隊，未來數月將在麥理浩徑進行一系列清理垃圾及公眾教育活動，推廣「自己垃圾自己帶走」的環保理念。

漁護署發言人說，自2015年起開始推廣這個理念，過去10年見到遠足人士處理垃圾的習慣已逐漸改善；資料亦顯示2025年郊野公園棄置垃圾量較2015年已減少超過40%。

漁護署義工隊今日就聯同一間企業的義工隊，合共約30人到西貢西灣山附近一帶清理垃圾，義工亦向遊人講解在偏遠路段自行帶走垃圾，能夠直接改善環境衞生，鼓勵市民為維護郊野公園的潔淨環境出一分力。


編輯：陳曉慶"
富麗敦海洋公園酒店有女工被木板擊中頭部昏迷,2026-02-14 17:28,,2026-02-14 17:45,local,rthk,https://news.rthk.hk/rthk/ch/component/k2/1843863-20260214.htm,"香港仔有酒店發生工業意外，一名工人被木板擊中頭部昏迷，送院救治。

警方表示，下午近4時半接報，一名年約50多歲的女工在香港富麗敦海洋公園酒店內工作期間，被木板擊中頭部暈倒，送往瑪麗醫院治理。警方正調查事故原因。



編輯：譚佩貞"
警方打擊「搵快錢」罪案拘59人包括電話騙案骨幹成員,2026-02-14 17:08,,2026-02-14 17:30,local,rthk,https://news.rthk.hk/rthk/ch/component/k2/1843862-20260214.htm,"警方自上月25日起進行打擊「搵快錢」相關罪案行動，合共拘捕59人，當中一人為電話騙案集團骨幹成員。

被捕人士包括50男9女，年齡介乎17至76歲，他們涉及串謀欺詐、店舖盜竊、爆竊、扒竊、雜項盜竊等罪被捕，案件涉款407萬元。其中兩名男子涉及8宗電話騙案被捕，涉款126萬元。

警方表示，深水埗警區去年的「搵快錢」相關案件佔整體罪案約四分一，「猜猜我是誰」電話詐騙案件上月有上升趨勢。警方在行動中，打擊一個活躍在深水埗區內的電話騙案集團，拘捕8名成員，經翻查包括銳眼計劃下的閉路電視系統，鎖定並拘捕一名骨幹成員，以及一名負責收取受害人金錢的傀儡。兩人早前已被暫控一項串謀欺詐罪，已於西九龍裁判法院提堂。



編輯：陳曉慶"
卓永興到大圍美林邨探訪居民　送上賀年食品及福袋,2026-02-14 17:01,,2026-02-14 17:30,local,rthk,https://news.rthk.hk/rthk/ch/component/k2/1843861-20260214.htm,"政府主要官員繼續落區家訪。政務司副司長卓永興今日與幾位司局長，分別探訪長者、基層和少數族裔等家庭。

卓永興先後到大圍美林邨探訪一家三口、一名獨居長者、以及一名年過90歲的婆婆，向他們送上沙田民政事務處準備的福袋，包括有即燉湯包、鮑魚麵、冬菇、米及蛋卷，關愛隊就送上曲奇餅。卓永興亦送上年糕、蘿蔔糕等傳統賀年食品。

卓永興表示，有居民向他表示，有特殊教育需要的女兒參加了關愛隊舉辦的免費籃球班，亦十分滿意現時的居住環境。



編輯：陳曉慶"
Call to learn from past at seminar on white paper,2026-02-14 16:42,,2026-02-14 17:00,elocal,rthk,https://news.rthk.hk/rthk/en/component/k2/1843845-20260214.htm,"The government on Saturday held a special seminar after the State Council issued a white paper on the ""persistent"" fight to safeguard national security in Hong Kong on Tuesday.

Delivering speeches at the seminar were Chief Executive John Lee, Liaison Office director Zhou Ji and Office for Safeguarding National Security head Dong Jingwei.

Other senior officials as well as members of the Legislative and Executive Councils were also present. 

Lee said the white paper made it clear that the central government bore fundamental responsibility for Hong Kong’s national security and that the SAR had to also actively fulfil its constitutional responsibility to safeguard national security. 

The timing of the release was also crucial, he said, noting that the document came a day after Apple Daily founder Jimmy Lai was sentenced to 20 years in prison over national security charges. 

Lee said Hong Kong previously faced political chaos due to its national security being left wide open and that it had to learn a lesson from that and remain vigilant at all times against national security risks.

Speaking after the seminar, Legislative Council president and the city's sole delegate to the National People's Congress Standing Committee Starry Lee said the talks had been insightful and provided a comprehensive review of the SAR's national security efforts.

""The white paper systematically reviews the challenges Hong Kong has faced regarding national security in the past and also reminds us that national security risks still exist; we need to remain vigilant at all times,” she said.  

She quoted Tsinghua University professor Wang Zhenmin, one of the speakers at the seminar, as saying that the white paper had been released to dispel any concerns over “misunderstandings or inaccuracies” that the international community had after the National Security Law was implemented in the SAR.

Executive councilor Jeffery Lam said the five-chapter, 17-page document was essential.

“We have seen that ... because Article 23 failed to be legislated in 2003, the opposition joined forces with some foreign powers to take that opportunity to create chaos in Hong Kong, he said. 

""For instance, the 2014 Occupy Central and the 2019 anti-extradition bill unrest are all bloody examples. 

“These events have also told us very clearly that national security has never been a distant concept; rather, it is closely linked to the daily lives of everyone of us in Hong Kong and the operations of our businesses.”

Lam said the city needed to step up its explanatory work over how implementation of the National Security Law and Article 23 of the Basic Law had made the city more stable, stressing that some reports by foreign media might not have accurately reflected reality in the city."
工聯會全國兩會提案倡高鐵西九站增開直達列車班次,2026-02-14 16:37,,2026-02-14 16:45,local,rthk,https://news.rthk.hk/rthk/ch/component/k2/1843856-20260214.htm,"一年一度的全國人大會議和全國政協會議，將分別於3月5日和3月4日在北京開幕。工聯會提出多項建議和提案。

港區全國人大代表、工聯會會長吳秋北提出，目前從香港西九龍站乘坐高鐵前往部分內地城市，仍需在中轉站轉車，建議增開直達列車班次，優先加密短途路線，可考慮在周末、節慶假日等高峰時段，增加「對開班次」列車。

他又建議，逐步提高內地綠色能源輸港比例，研究興建由深圳至香港北部都會區的跨境高壓輸電通道，為科創發展提供穩定電力供應。

全國政協提案委員會副主任、工聯會理事長黃國提出，加強大灣區專業人才執業認可清單，將執業認可地點範圍擴展至大灣區不同城市。

他又表示，今年是「十五五規劃」開局之年，認為香港可打造成為國際醫療中心，透過本港的醫藥認證，將內地和香港的醫藥科研成果，進一步拓展至世界其他地方。


編輯:陳曉慶"
"FTU pushes for rail integration, green power",2026-02-14 16:29,,2026-02-14 17:30,elocal,rthk,https://news.rthk.hk/rthk/en/component/k2/1843855-20260214.htm,"The Federation of Trade Unions (FTU) unveiled on Saturday a series of proposals for consideration at the upcoming Two Sessions meetings in Beijing next month, with a focus on strengthening connectivity in the Greater Bay Area. 

FTU president Stanley Ng, also a deputy to the National People's Congress, said the proposals had been designed with active participation by Hong Kong in the country's 15th-Five-Year Plan .

""I personally will focus on proposals that better connect the high-speed rail network in Hong Kong with those on the mainland and on gradually increasing transmissions of electricity generated from environmentally friendly sources from the mainland to Hong Kong,” he said. 

“Once Hong Kong’s high-speed rail network is better integrated into the national network, connectivity between the two places will be strengthened and drive Hong Kong to better integrate into overall national development, thereby bringing new opportunities in trade, tourism and professional sectors.”

Ng wants the frequency of short-haul services to be ramped up, especially during peak periods such as weekends and public holidays, and more stops along the way. 

Authorities should also regularly analyse ticketing data and passenger flow trends between West Kowloon station and mainland cities, Ng said, to enable more flexible deployments of railway capacity.

On the proposal to import more green energy from the mainland, Ng said such a move offered a stability to power supply that the SAR would need to develop innovative technologies and the artificial intelligence sector, which requires massive energy consumption. 

He also suggested the construction of a high-voltage power grid connecting Shenzhen to Hong Kong's Northern Metropolis development project."
食安中心巡視年宵快餐攤位檢取碗仔翅、臭豆腐、咖喱魚蛋等檢測,2026-02-14 15:43,,2026-02-14 16:00,local,rthk,https://news.rthk.hk/rthk/ch/component/k2/1843854-20260214.htm,"食環署食物安全中心派員巡視年宵市場快餐攤位，派發小冊子，提醒檔主注意食物安全。中心亦在年宵市場快餐攤位檢取食物樣本，包括碗仔翅、臭豆腐、咖喱魚蛋和小籠包等，以作各項微生物檢測。

發言人表示，為保障食物安全和市民健康，食安中心人員在多個年宵市場向快餐攤位負責人提供食物安全和衞生教育，提醒他們在營運時須多加注意食物安全和環境衞生，採取食物安全措施，以製作和供應合乎衞生和安全的食物。


編輯：譚佩貞"
習近平就非洲聯盟峰會致賀電　稱非盟堅定捍衛非洲正當權益,2026-02-14 15:41,,2026-02-14 16:00,cinternational,rthk,https://news.rthk.hk/rthk/ch/component/k2/1843853-20260214.htm,"國家主席習近平向非洲聯盟輪值主席、安哥拉總統洛倫索，以及非洲聯盟委員會主席優素福致賀電，就第39屆非洲聯盟峰會召開，向非洲國家和人民表示熱烈祝賀。

習近平指出，當前世界百年變局加速演進，全球南方卓然壯大。過去一年，非洲聯盟團結帶領非洲國家，積極推進一體化進程，堅定捍衛非洲正當權益，國際地位和影響持續提升。

習近平強調，面對變亂交織的國際形勢，中國堅定致力於維護世界和平、促進共同發展，推動構建人類命運共同體。



編輯：羅宇光"
駐港特派員公署約見歐美駐港機構負責人就黎智英案言論嚴正交涉,2026-02-14 15:11,,2026-02-14 15:45,greater_china,rthk,https://news.rthk.hk/rthk/ch/component/k2/1843851-20260214.htm,"外交部駐香港特派員公署日前約見英國、美國、澳洲等國和歐盟駐港機構負責人，針對其官方和政客就黎智英案量刑裁決發表負面言論提出嚴正交涉，表達強烈不滿和堅決反對，敦促有關國家、組織及有關政客切實尊重中國主權和香港法治，立即停止對香港國安案件審理發表不負責任言論，立即停止以任何形式干預香港事務、干涉中國內政。

公署表示，香港特區高等法院就反中亂港分子黎智英涉嫌違反香港國安法等案件，在本月9日作出宣判，判處黎智英20年有期徒刑。多個美西方國家、反華媒體、組織及政客等，借此針對香港特別行政區作出污蔑抹黑和攻擊，甚至詆毀法庭依法獨立作出的裁決及判刑。香港特區政府發言人已表示，堅決反對此等卑劣行徑，並予以強烈譴責。



編輯：譚佩貞"
情人節接近農曆新年　花店稱已婚人士傾向買年花料生意減約三成,2026-02-14 14:27,,2026-02-14 14:45,local,rthk,https://news.rthk.hk/rthk/ch/component/k2/1843850-20260214.htm,"今日是情人節，不少市民到旺角花墟選購花束。有男士買了兩束玫瑰花送給太太和媽媽，表示今年情人節花束比以往貴了約兩成，但仍希望趁特別日子送花，表達心意。

亦有男士花200多元買3支紅玫瑰送給太太，寓意「我愛你」，希望愛情能長長久久，又說已經在餐廳訂枱，準備與太太慶祝。除了送花，亦有男士說準備了手作禮物送給女朋友，適逢新年會留港過節。

有年長夫婦選購年花，丈夫表示會以現金代替情人節送花，讓太太選購心儀禮物，更加實際。

有花店負責人說，今年情人節接近農曆新年，不少已婚人士傾向買年花而不買情人節花束，預料整體生意額減少約3成，花材及聘人包花的成本亦比以往高，要相應上調花束價格。



編輯：譚佩貞"
李慧琼：白皮書詳細講述香港維護國家安全歷史及發展方向,2026-02-14 13:55,,2026-02-14 14:15,local,rthk,https://news.rthk.hk/rthk/ch/component/k2/1843848-20260214.htm,"《「一國兩制」下香港維護國家安全實踐》白皮書專題研討會在政府總部舉行，一批立法會議員及行政會議成員等出席，身兼全國人大常委的立法會主席李慧琼於研討會後表示，行政長官李家超、中聯辦主任周霽、駐港國安公署署長董經緯及清華大學法學院教授王振民出席及分別發言，其中王振民清楚講述發布白皮書的背景。

研討會舉行約兩小時，李慧琼表示，據她了解，白皮書的發布是國家重要舉措，是因為社會上，特別是國際社會，對於香港國安法實施存在誤解，又或者有部分失實的言論。白皮書的發布是深受國際社會關注，而白皮書詳細講述香港維護國家安全的歷史和過去所面對的挑戰，以至未來的發展路向。

對於白皮書在黎智英案判刑後發布，李慧琼表示，黎智英案是依照法庭掌握的證據嚴肅地判決，彰顯一國兩制，香港維護國家安全方面，法庭裁決起到維護國家安全的角色，強調總體來說，本港一直堅持在法治軌道下維護國家安全。

出席研討會的行政會議成員林健鋒表示，自從國安法的落實及23條通過後，香港變得更加安定，很多外國人問及香港情況，因為他們看到一些外媒報道和宣傳未必很真實地說出實況。他認為在這方面如果做得更多，在行政長官李家超領導下，香港會繼續安定。



編輯：譚佩貞"
