title,date,summary,scrape_time,section,source,url,news_content
截至上午10時本港逾19萬人次出入境　入境內地旅客佔逾4萬,2026-02-15 12:21,,2026-02-15 12:45,local,rthk,https://news.rthk.hk/rthk/ch/component/k2/1843916-20260215.htm,"入境處表示，截至早上10時，共有約19萬2千多人次經各管制站出入境。入境有7萬7千多人次，其中內地旅客逾4萬人次。至於離境人次約11萬5千多人次，本港居民佔近9萬5千人次。

入境方面，最多人從機場入境，有1萬4千多人，其次是高鐵西九龍站，有9千多人次。

出境方面，最多人從機場離境，有2萬8千多人次，其次是高鐵西九龍站，有1萬6千多人次。



編輯：汪溟曦"
Tourist arrivals edge up more than 1pc in January,2026-02-15 11:28,,2026-02-15 12:45,elocal,rthk,https://news.rthk.hk/rthk/en/component/k2/1843910-20260215.htm,"The Tourism Board on Sunday said Hong Kong saw a near 1.5 percent rise in total tourist arrivals last month compared with a year ago. 

It said there were more than 4.8 million overall arrivals in January, boosted by stronger non-mainland tourist figures.

Non-mainland arrivals jumped 15 percent to nearly 1.2 million, with a surge of nearly 29 percent in long-haul visitor arrivals to 280,000.

Meanwhile, mainland visitors last month dipped by a little more than two percent, but the board noted that back in 2025, the Lunar New Year was in January, and that might have been a reason why last year's numbers were higher."
Tourist arrivals edge up over 1pc in January,2026-02-15 11:28,,2026-02-15 11:45,elocal,rthk,https://news.rthk.hk/rthk/en/component/k2/1843910-20260215.htm,"The Tourism Board on Sunday said Hong Kong saw a near 1.5 percent rise in total tourist arrivals last month compared with a year ago. 

It said there were more than 4.8 million overall arrivals in January, boosted by stronger non-mainland tourist figures.

Non-mainland arrivals jumped 15 percent to nearly 1.2 million, with a surge of nearly 29 percent in long-haul visitor arrivals to 280,000.

Meanwhile, mainland visitors last month dipped by a little more than two percent, but the board noted that back in 2025, the Lunar New Year was in January, and that might have been a reason why last year's numbers were higher."
日本大阪發生持刀傷人案　中方再次提醒中國公民近期避免赴日,2026-02-15 11:23,,2026-02-15 11:45,greater_china,rthk,https://news.rthk.hk/rthk/ch/component/k2/1843914-20260215.htm,"日本大阪市中央區道頓堀發生持刀傷人案，據報造成1死2傷，警方扣留一名男子。

事發在當地凌晨零時左右，日本傳媒引述警方消息報道，警方接報指多人被刺傷，警員到場後發現三名男子受傷，其中一人昏迷，另外兩人傷勢不明。警方說，不排除疑兇認識傷者，疑兇施襲後逃離現場。警方調查後扣留一名20多歲男子，懷疑與案件有關。

中國駐大阪總領事館就再次提醒中國公民近期避免前往日本，指近期日本部分地區治安環境不靖，類似惡性案件多發頻發，再次提醒領區公民加強安全防範，密切關注當地治安形勢，切實提高安全防範意識，加強自我保護。



編輯：盧曉珊"
醫管局舉辦多項活動讓病人感受新春氣氛,2026-02-15 11:21,,2026-02-15 11:45,local,rthk,https://news.rthk.hk/rthk/ch/component/k2/1843913-20260215.htm,"農曆新年將至，香港兒童醫院、明愛醫院及北區醫院的醫護人員與義工，為病人安排活動讓他們感受節日氣氛。

香港兒童醫院在大堂舉行音樂會，與病童及家人共迎新春。有醫院職員獻唱賀年歌、醫管局中樂團演奏傳統曲目，及義工團體的手鈴表演。病童可以在現場寫揮春，以及獲發禮物。

明愛醫院健康資源中心的義工團隊早前為病人特製印有小馬圖案的新年掛飾，並帶同掛飾到病房探訪住院病人，送上心意卡。

北區醫院義工設計和佈置新春禮物車，聯同醫院管理團隊到病房為病友送上小禮物與祝福。"
旅發局︰1月訪港旅客約481萬人次　按年增約1%,2026-02-15 11:17,,2026-02-15 11:30,local,rthk,https://news.rthk.hk/rthk/ch/component/k2/1843912-20260215.htm,"旅發局表示，1月訪港旅客約481萬人次，即使今年1月並非如去年般正值內地春節假期，訪港旅客量仍按年增長約1%。

其中，非內地旅客約117萬人次，按年增加約15%，當中長途市場升幅較顯著。至於內地旅客人次則錄得約364萬人次。



編輯：汪溟曦"
內地春節長假期展開　有旅客指留港5天並期待煙花匯演,2026-02-15 11:10,,2026-02-15 11:30,local,rthk,https://news.rthk.hk/rthk/ch/component/k2/1843911-20260215.htm,"內地一連9日春節假期今日展開，早上西九龍高鐵站有不少旅客抵港。

有抵港旅客表示，過關需要排隊，人流較多，但沒有預期多，本來預計過關可能需要花一至兩小時，最終只用了20分鐘就完成，又留意到香港的過年氣氛不錯。

有來自新疆的湯小姐一家大小坐了5小時飛機到深圳，再轉高鐵來港。她表示，以前從來沒有試過在香港過年，今次留港5天，特意來感受香港新年氣氛，對維港煙花匯演、花車巡遊、黃大仙頭炷香等都很期待，希望可以順道祈福，為家人在馬年祈求一個好開始。她又提到，過年旅遊的整體成本較平時高，機票和酒店價格上升，酒店房價約2000元一晚，預計整個旅程大約會花費3至4萬元，但認為是合理和值得。

有第一次來港、來自深圳的旅客王小姐表示，出發前透過網上社交平台做了「攻略」，今次行程以觀光為主，包括到訪中環一帶。她會在港留宿一晚，既可到訪較多景點，又可節省即日來回交通的時間。她說，今年農曆新年前的酒店房價，較過年期間便宜800元左右，所以特意選擇提前到訪，減低住宿成本開支。

亦有內地旅客表示會即日往返，有來自上海的旅客表示，在港逗留一天，晚上就離開，因為要回鄉過年，與家人共度新歲。



編輯：汪溟曦"
入境處指昨逾118萬人次經各口岸出入境,2026-02-15 11:02,,2026-02-15 11:15,local,rthk,https://news.rthk.hk/rthk/ch/component/k2/1843909-20260215.htm,"農曆新年將至，入境處數字顯示，昨日逾118萬人次經各口岸出入境；當中出境人次逾72萬，入境人次逾45萬。

出境方面，香港居民佔約53萬9千人次，最多人經羅湖出境，約11萬5千多人次；其次經落馬洲支線及深圳灣口岸出境。

入境方面，內地旅客佔近15萬人次，最多人由高鐵西九龍站入境，佔3萬人次；其次是機場，約有2萬4千多人次。至於其他訪客，逾2萬3千多人次經機場入境。



編輯：汪溟曦"
警方於西貢打擊的士濫收車資　7人被捕,2026-02-15 10:58,,2026-02-15 11:15,local,rthk,https://news.rthk.hk/rthk/ch/component/k2/1843908-20260215.htm,"警方過去兩日在西貢郊野公園一帶採取行動，在農曆新年前夕打擊的士濫收車資，共拘捕6男1女，介乎40至71歲。

東九龍總區交通部執行及管制組特遣隊督察潘俊豪表示，涉案司機涉嫌於一般約60元車資的路程，收取高達200元；他們警覺性相當高，警員行動前經長時間觀察，記錄相關車牌和犯案手法，再喬裝成乘客及設置策略性路障，以濫收車資、企圖濫收車資、沒有展示的士計程錶指示器及沒有將的士司機證擺放在證件架上等罪名，將7人拘捕。有關的士被扣留作進一步檢驗。

警方指出，有關司機的行為除了損害個別旅客權益，亦打擊香港作為國際旅遊城市的聲譽。警方會在農曆新年期間，繼續嚴厲打擊有關行為，提醒市民若懷疑有的士拒載或濫收車資等，可記下司機姓名、車牌、時間及地點等資料作舉報。



編輯：汪溟曦"
陳美寶稱未來數天共約500粵車訪港　平日配額仍有空間,2026-02-15 10:54,,2026-02-15 11:15,local,rthk,https://news.rthk.hk/rthk/ch/component/k2/1843907-20260215.htm,"運輸及物流局局長陳美寶表示，希望「粵車南下」政策順暢，讓社會接受，因此要小心、審慎，確保落實到位和順利。目前粵車進入市區每日100個配額，在周末或長假期情況不錯，但平日工作天仍有一些空間，希望與內地方面多宣傳，才有基礎增加配額，並進一步將政策延伸至廣東更多城市。

陳美寶在一個電台節目表示，在「粵車南下」安排下，入境市區部分目前有超過3000名申請者通過審批獲得資格，有超過1500人預約出行。她說，今日預約數額有近100個，未來幾天亦合共有近500個，當中一半私家車將留港一至兩天，整體反應符合預期。至於「口岸停車場」方面有大約7000輛內地車輛申請賬戶，當中約一半已經預約出行，帶動本港機場轉機客亦有所增加。

陳美寶又說，「粵車南下」實施後首兩個星期，有個別司機未必適應本港環境，前往不該去的地方甚至啟動自動駕駛系統，當局已經發出電子通知提醒。至於有無內地司機被列入黑名單，她說，個別司機未必符合相關條款，廣東和本港警方已經分別按相關管理辦法跟進以及在現場處理個案。

陳美寶強調，「左軚車」在香港意外率遠低於本港整體意外率，對此很有信心，但會密切留意情況。



編輯：汪溟曦"
日本大阪道頓堀持刀傷人案據報造成1死2傷　警方扣留一名男子,2026-02-15 10:46,,2026-02-15 11:15,cinternational,rthk,https://news.rthk.hk/rthk/ch/component/k2/1843906-20260215.htm,"日本大阪市中央區道頓堀發生持刀傷人案，據報造成1死2傷，警方扣留一名男子。

事發在當地凌晨零時左右，日本傳媒引述警方消息報道，警方接獲市民報案，指有多人被刺傷，警員到場後發現三名男子受傷，其中一人昏迷，另外兩人傷勢不明。

警方說，不排除疑兇認識傷者，疑兇施襲後逃離現場。警方調查後扣留一名20多歲男子，懷疑與案件有關。



編輯：盧曉珊"
法國巴黎預料將有大範圍降雪　民航部門指示機場削減航班,2026-02-15 10:05,,2026-02-15 10:30,cinternational,rthk,https://news.rthk.hk/rthk/ch/component/k2/1843903-20260215.htm,"法國北部預料今天會有大範圍降雪，民航部門指示巴黎兩個機場削減航班。

法國氣象部門預計，巴黎等地今天將有顯著降雪，可能影響陸空交通。

民航局指示巴黎的戴高樂機場和奧利機場，星期日分別縮減繁忙時段30%和20%的航班。當局提醒旅客，前往機場前，先向航空公司確認航班狀況。



編輯：盧曉珊"
陳美寶︰全面重新檢視巴士安全帶規定　訂立平衡建議方案,2026-02-15 09:42,,2026-02-15 10:00,local,rthk,https://news.rthk.hk/rthk/ch/component/k2/1843902-20260215.htm,"運輸及物流局局長陳美寶表示，有關在巴士佩戴安全帶的規定，乘客表達很多不同意見，一定要小心認真聆聽、逐一研究，政府將認真、審慎和全面重新檢視相關規定，最重要是廣泛諮詢社會意見，訂立優化、全面、平衡的建議方案選項，與立法會商討。

陳美寶在一個電台節目表示，重新檢視相關規定的工作要實事求是，已經要求運輸署、專營巴士公司等循四方面進行工作，首先是要求巴士公司將安全帶裝置、設計和保養落實到位，讓市民安全、便利使用。其次是委託專家就巴士座位或路線種類，作仔細風險評估，做到切實可行的建議方案。

陳美寶又說，運輸署和道路安全議會要加強宣傳活動，培養乘客安全意識和責任，亦特別就執行、豁免和罰則細節重新檢視，希望兼備「法理情」。



編輯：汪溟曦"
北角渣華道七旬女子疑被的士撞倒　司機被捕,2026-02-15 09:24,,2026-02-15 10:00,local,rthk,https://news.rthk.hk/rthk/ch/component/k2/1843901-20260215.htm,"北角渣華道凌晨發生交通意外，一輛的士懷疑撞倒一名74歲女子， 她頭部受傷，半昏迷送院。

警方表示，凌晨2時許接報，渣華道有途人懷疑被的士撞倒，事發時據報傷者推著手推車。79歲男司機涉嫌危險駕駛引致他人身體受嚴重傷害被捕，他通過酒精測試。



編輯：汪溟曦"
王毅晤挪威外交大臣　指多極化不是少數大國主導,2026-02-15 09:00,,2026-02-15 09:15,greater_china,rthk,https://news.rthk.hk/rthk/ch/component/k2/1843900-20260215.htm,"中共中央政治局委員、外長王毅，與挪威外交大臣艾德會面。

王毅表示，多邊主義是今次慕尼黑安全會議的討論共識，但多邊主義不是自行其是，多極化也不是少數大國主導，各方都應遵守聯合國憲章宗旨，維護國際法治體系。中國和挪威都支持多邊主義和自由貿易，應該進一步加強溝通協作，希望挪方為中歐關係穩定發展，發揮建設性作用。

中方引述艾德表示，王毅外長在慕尼黑安全會議的發言，清晰闡述了中方關於改革完善全球治理的主張，與挪方立場高度契合。挪方高度重視對華關係，希望持續加強兩國對話與合作，在世界貿易組織等多邊機制密切協作，共同維護多邊主義和自由貿易。



編輯：盧曉珊"
賽馬會3間公眾騎術學校提供參觀或騎術課程助市民認識馬匹,2026-02-15 08:27,,2026-02-15 08:45,local,rthk,https://news.rthk.hk/rthk/ch/component/k2/1843898-20260215.htm,"農曆新年將至，送蛇迎馬。市民想增進對馬匹的認識，可以選擇到公眾騎術學校參觀馬房或報名參與騎術課程。賽馬會轄下有3間公眾騎術學校，分別位於屯門、鯉魚門及薄扶林。其中，自1978年創建的薄扶林公眾騎術學校，去年秋季完成重建，該學校設有38個馬格，約一半為新馬。

馬術事務助理吳湋源表示，馬匹每天要進食多餐，會為牠們提供草和飼料，亦會為牠們擦身及清理馬格。他說，馬匹好奇時會探頭四處張望，高興時耳朵會傾前，而馬匹性格各異，有些乖巧聽話，有些容易與人類相處但與其他馬匹不合。如果首次與馬匹接觸，他建議先保持一定距離，不要站在馬的嘴前或馬後。

青少年馬術隊成員羅梓然現年16歲，已學習騎馬10年。與馬術運動結緣，是由於她小時候與家人到薄扶林行山，途經騎術學校，對馬匹感興趣，之後開始學習騎馬。羅梓然說從這項運動中，學習到面對失敗及克服困難。 

賽馬會資料顯示，年滿6歲的小朋友可參與騎馬課程。從事相關教練工作30年的馬術高級經理陳世健說，學員來自不同層面，有學生、有退休人士，課程可以訓練身心，帶來愉悅，同時可以減壓。他形容馬是具靈性的動物，但上馬期間要專注，否則有一定風險。他說，馬術運動愈來愈普及，其中屯門公眾騎術學校每年設開放日，讓公眾近距離接觸馬匹。



編輯：譚佩貞"
中加外長會面　王毅指加拿大新政府奉行對華新政策符合兩國利益,2026-02-15 08:22,,2026-02-15 08:45,greater_china,rthk,https://news.rthk.hk/rthk/ch/component/k2/1843897-20260215.htm,"中共中央政治局委員、外長王毅，出席慕尼黑安全會議期間，與加拿大外長阿南德會面。

王毅表示，加拿大總理卡尼訪華成果豐碩，證明加拿大新政府奉行對華新政策，符合兩國共同利益，是完全正確的選擇。中方願與加方一起努力，落實好兩國領導人重要共識，排除干擾，重啟各領域交流合作，推動中加關係健康、穩定、可持續發展。

中方引述阿南德表示，卡尼訪華十分成功，開啟加中關係的新時代。加方感謝中方給予加拿大公民免簽待遇，希望雙方密切對話合作，加強人文交流，推動加中關係積極穩定向前發展。



編輯：盧曉珊"
