title,date,summary,scrape_time,section,source,url,news_content
Rublev rematch awaits Coleman 'The Chosen Wong',2025-09-02 17:33,,2025-09-02 18:00,elocal,rthk,https://news.rthk.hk/rthk/en/component/k2/1820873-20250902.htm,"Hong Kong tennis star Coleman Wong will join the Ultimate Tennis Showdown (UTS) to be held at Kai Tak Arena on October 15 and 15. 

Wong will be competing alongside seven other players, including Andrey Rublev, who ended his historic run at the US Open.

UTS tour founder Patrick Mouratoglou said the organisers are delighted to have the star play world-class rivals on home ground.

""While finalising Hong Kong as the host of UTS' Asian debut, we witnessed a local superstar enjoying incredible form this year.""

""His remarkable recent achievements prompted us to ask – why not extend a special invitation?""

Wong returned home yesterday after making history by becoming the first Hong Kong player to reach the third round of the US Open.

He said on Tuesday that the Kai Tak Arena being indoors means that competitions will be faster paced, which is advantageous for him.

""This is a very new experience, so I will really enjoy it,"" Wong said.

""I played Rublev in [the] US Open, also talked with other players as well, so definitely helped [gear up for the UTS] and to prepare for other tournaments as well.""

As per UTS tradition, he has chosen the nickname ""The Chosen Wong"" for the competition.

He said that he settled on that instead of ""The Chosen one"" because he is the only Hong Kong player at the tournament.

""Even though Hong Kong is such a small place, we can still produce tennis players,"" Wong said, adding that he hopes Hong Kong fans will continue to support him regardless of whether he wins or not."
19間社區會堂和社區中心繼續開放作臨時避暑中心,2025-09-02 17:21,,2025-09-02 17:45,local,rthk,https://news.rthk.hk/rthk/ch/component/k2/1820878-20250902.htm,"民政事務總署繼續開放19間社區會堂和社區中心，作臨時避暑中心。

臨時避暑中心會在酷熱天氣警告生效期間全日開放。此外，在晩上10時30分至翌晨8時，臨時避暑中心亦供應被鋪及睡覺的地方予有需要人士。

中心內有人員當值，如需進一步資料，可於午夜前致電民政事務總署熱線2572 8427查詢。"
上月第11批白紋伊蚊誘蚊器指數　長沙灣較高達9.6%,2025-09-02 17:20,,2025-09-02 17:45,local,rthk,https://news.rthk.hk/rthk/ch/component/k2/1820877-20250902.htm,"食環署公布，上月第11批涵蓋11個監察地區的白紋伊蚊誘蚊器指數及密度指數，全部都在10%以下，其中長沙灣較高，達9.6%。

署方表示，上月11批白紋伊蚊誘蚊器指數，涵蓋共64個監察區，與7月分區白紋伊蚊誘蚊器指數相比，有44個監察地區的指數下跌或保持不變；另有15區的指數輕微上升，但指數低於10%。"
Lawmaker urges students to learn from wartime spirit,2025-09-02 17:16,,2025-09-02 17:30,elocal,rthk,https://news.rthk.hk/rthk/en/component/k2/1820875-20250902.htm,"Federation of Trade Unions lawmaker Bill Tang said on Tuesday that young people in Hong Kong should learn more about history and the spirit of resistance during the war against Japan.

He made the comments while giving a talk at a secondary school to mark the 80th anniversary of the victory in the Chinese People's War of Resistance Against Japanese Aggression and the World Anti-Fascist War.

Tang called on the younger generation to better understand the nation’s history, including the contributions made by Hong Kong during the war. He said they should learn from the wartime spirit, work hard, and help make the country safer.

“Teaching history only in the classroom may put pressure on students,” Tang said. 

“We should use different methods, like field trips, film screenings, and watching tomorrow’s live broadcast of the military parade. The aim is to first spark interest and curiosity, so students can see history as part of their daily life and strengthen their sense of national identity.”

Around 120 students at Buddhist Hung Sean Chau Memorial College joined the session."
Chris Tang 'excited' to attend military parade,2025-09-02 17:13,,2025-09-02 17:30,elocal,rthk,https://news.rthk.hk/rthk/en/component/k2/1820872-20250902.htm,"Security minister Chris Tang said on Tuesday that he is excited to be in Beijing to attend the country's military parade on Wednesday, as part of events commemorating the 80th anniversary of V-Day in the war against Japan.

Tang is part of a 360-strong delegation from Hong Kong, led by Chief Executive John Lee, which is in the capital to mark the anniversary of the Chinese People's War of Resistance Against Japanese Aggression and the World Anti-Fascist War.

Arriving at a hotel in Beijing, the minister told reporters that he was looking forward to the occasion.

""I'm excited. It's my first time in the capital attending a military parade. I'm really honoured to take part in such an occasion,"" he said.

""I believe the parade will be visually stunning.""

Election Committee lawmaker Chow Man-kong said he believed the parade will demonstrate the country's determination to safeguard national sovereignty and safety.

""The international environment is indeed going through dramatic changes,"" he told RTHK.

""I think we can demonstrate to the world that, in terms of defence capabilities, we have both the ability and determination to safeguard our sovereignty, security, and developmental interests.""

War veteran Lam Zhen, who fought as a member of the Hong Kong-Kowloon Independent Battalion of the East River Column, is also part of the delegation.

""We can't forget this part of history, about our struggles. We need to be able to tell the actual circumstances of this history with full clarity,"" she told RTHK.

""In doing so, we can let our descendants pass down the legacy of the struggles for future generations.""

Other delegation members who arrived in Beijing include the police commissioner, Joe Chow, and Olympic gold medallist, former fencer Vivian Kong."
96 arrested for suspected drug trafficking,2025-09-02 17:02,,2025-09-02 17:15,elocal,rthk,https://news.rthk.hk/rthk/en/component/k2/1820870-20250902.htm,"Police and customs officers say they arrested 96 people in a joint anti-drugs operation over the past three months. 

Officers said they also seized 1,219 kilogrammes of drugs with an estimated street value of HK$479 million.

At a press briefing on Tuesday, Wong Ngar-lun who heads customs' airport investigation group said they detected 65 suspected drug trafficking cases at the airport, 3.6 times the number during the same period last year.

“I think criminals will use any tricks they can think of because, from their perspective, their primary goal is to make money in the most effective, fastest and easiest way possible,” he said. 

“With the increase in air passengers during summer, criminals may see this surge as an opportunity, believing that the higher volume of people entering or exiting the airport creates a concealing effect for their activities.” 

Wong said officers have started engaging in real-time intelligence sharing with overseas and mainland counterparts, enabling arrest operations to be planned better. 

Police superintendent Kwan Chun-hin, meanwhile, said traffickers no longer hide drugs in suitcases like in the past. 

“They do not use secret compartments in their luggage. Instead of using food packaging or other items to conceal the drugs, they openly place them in the suitcase,” he said.  

Kwan said more mainlanders and foreigners are being recruited to smuggle drugs into the SAR because of their lack of local connections, making it harder for the authorities to identify them."
阿富汗地震增至逾1120人死　車輛難以通過狹窄山路成救援障礙,2025-09-02 16:56,,2025-09-02 17:15,cinternational,rthk,https://news.rthk.hk/rthk/ch/component/k2/1820876-20250902.htm,"阿富汗東部星期日晚發生的6級地震，有當地人道組織表示，增至超過1120人遇難，3200多人受傷，當局憂慮死傷人數仍會上升。

救援人員今日嘗試前往庫納爾省東部的偏遠村莊，省災害管理部門表示，車輛難以在狹窄的山路上通行是救援工作的主要障礙，救援人員使用機械清理道路上的碎石。目前無法準確預測多少人可能被困在瓦礫堆下，當局會盡快搜救。

當局派遣直升機往來災區，運送救援物資，並將傷者送往鄰近的楠格哈爾省及首都喀布爾的醫院治理。塔利班士兵亦在當地提供協助及維持秩序。

聯合國兒童基金會警告，當地有數千名兒童處於危險之中，組織正向災區運送藥物、保暖衣物、帳篷及衛生用品等援助物資。"
人道組織：阿富汗6級地震增至逾1120人遇難,2025-09-02 16:43,,2025-09-02 17:00,cinternational,rthk,https://news.rthk.hk/rthk/ch/component/k2/1820874-20250902.htm,"阿富汗東部的6級地震，在當地的人道組織表示，增至超過1120人遇難，3200多人受傷。重災區庫納爾省部分道路受阻，令救援工作難度增加。

阿富汗公共衛生部長賈拉利，率領官員視察庫納爾省及鄰近的楠格哈爾省，當局呼籲國際社會提供援助。印度向阿富汗提供帳篷和食物，外長蘇傑生承諾未來幾天會運送更多物資。"
恒指低收120點　科指跌逾1%　內銀股逆市造好,2025-09-02 16:37,,2025-09-02 16:45,cfinance,rthk,https://news.rthk.hk/rthk/ch/component/k2/1820869-20250902.htm,"港股結束2個交易日升勢，恒生指數初段曾升近110點，午後最多跌約200點，收市報25496點，跌120點，跌幅近0.5%，主板成交額跌至逾3281億元。

科技指數在5700點水平上落，收市報5728點，跌幅1.2%。ATMXJ除小米升逾3%，其餘跌近1%至近2%。

半導體股向下，中芯國際跌近5%，華虹跌近6%，分別是跌幅最大恒指和科指成份股。

手機設備和內房股受壓，舜宇光學跌近4%，龍湖集團跌近3%。

金融股個別發展，友邦跌近2%，港交所和中人壽跌近1%或以上，但內銀股逆市造好，招行升逾2%，四大行以農行升近3%幅度較大。

內地冷氣機製造商奧克斯電氣首日主板掛牌，收報16.48元，較招股價低逾5%。"
海關及警方3個月偵破74宗旅客販毒案　檢逾4億元毒品拘96人,2025-09-02 16:35,,2025-09-02 17:00,local,rthk,https://news.rthk.hk/rthk/ch/component/k2/1820871-20250902.htm,"海關聯同警方與內地及其他海外執法機構合作，展開大型緝毒行動，過去3個月共偵破74宗涉及航空旅客的販毒案，檢獲1219公斤懷疑毒品，市值約4億7900萬元，共拘捕96人，包括兩名販毒集團主腦及4名骨幹成員。警方相信，行動瓦解並重創4個活躍於本地的販毒集團。

海關表示，緝獲的懷疑毒品包括大麻、可卡因、冰毒等，被捕人士年齡介乎16至69歲，涉及不同國籍。估計不法分子趁暑假期間機場旅客多，以作掩飾。

警方指出，涉案毒品主要來自東南亞及歐美，相信用作供應本港市場。販毒集團利用不同手法，嘗試擾亂調查方向，包括利用內地及海外居民攜帶毒品入境，令執法機關無法掌握有關人士的身份及背景資料。

警方又表示，不法分子會利用迂迴飛行路線逃避追查，並採用「接力」方式運輸毒品，例如毒販來港時，會將藏有毒品的行李箱寄倉，但抵港後不會取回行李，會交由另一人取走有關行李，增加追查難度。

警方留意到，部分毒販不再刻意掩飾行李箱內的毒品，形容有關行為囂張，目無法紀，強調是想法天真，最終亦會被繩之於法。"
一名南韓男子涉嫌在東京用刀刺死前女友　被日本警方拘捕,2025-09-02 16:17,,2025-09-02 16:30,cinternational,rthk,https://news.rthk.hk/rthk/ch/component/k2/1820867-20250902.htm,"日本東京警方拘捕一名30歲南韓男子，他涉嫌在東京用刀刺死同樣來自南韓的前女友。

日本放送協會報道，一名40歲南韓女子昨日下午被發現倒臥在東京世田谷區一個住宅區的街道上，頸部疑似被刺傷流血，送院後不治，懷疑行兇的一名男子事後逃離現場。警方展開追捕，昨晚在羽田機場拘捕疑犯，指控疑犯在南韓女子被發現的地點附近一座辦公大樓內，用刀襲擊她。

東京警方說，疑犯4月開始與涉案女子約會，女子上月底曾向東京警方報案，稱與疑犯提出分手後遭對方毆打，警方其後將女子轉移到安全地方，並口頭警告疑犯，敦促他離境返回南韓。警方相信涉案女子事發時似乎是因工作需要前往現場，其後遭到殺害。"
海關抽查內地抵港貨櫃檢逾7千件冒牌貨物市值約127萬元,2025-09-02 15:54,,2025-09-02 16:15,local,rthk,https://news.rthk.hk/rthk/ch/component/k2/1820866-20250902.htm,"海關早前在屯門內河船碼頭海關驗貨場檢獲約7700件懷疑冒牌貨物，包括球鞋、手袋和球衣，估計市值約127萬元。
　　 
海關上月中透過風險評估，抽查一個從內地抵港的40呎貨櫃。經檢查後，海關人員在貨櫃內檢獲該批懷疑冒牌貨物。
　　 
初步調查顯示，該批懷疑冒牌貨物將會轉口至海外地區。"
抗戰勝利80周年｜香港特區代表團抵京　鄧炳強對觀看閱兵感興奮,2025-09-02 15:47,,2025-09-02 16:15,local,rthk,https://news.rthk.hk/rthk/ch/component/k2/1820865-20250902.htm,"行政長官李家超率領由香港各界人士組成的代表團到北京，參加於明日舉行的中國人民抗日戰爭暨世界反法西斯戰爭勝利80周年紀念活動。李家超下午抵達入住的酒店，代表團成員包括政府主要官員及立法會議員等。保安局局長鄧炳強接受訪問時表示，是首次來北京觀看閱兵，感到光榮及興奮，相信屆時畫面震憾。

選委界立法會議員周文港表示，國際環境風雲變幻，透過今次閱兵可向外展示中國有足夠的國防力量，以及有能力和決心維護國家主權、安全和發展利益，他感到期待和興奮。他認為，透過今次活動，可讓學生重温80年前發生的事情，反思國家民族責任。

吸煙與健康委員會主席湯修齊作為代表團的宗教界代表，他對於能見證盛大閱兵儀式感到光榮，認為可以向香港學生說明和平的重要性，亦可以體現出國家安全、領土完整的重要性和決心。

抗戰老兵林珍亦是代表團成員。林珍表示，當年將破壞世界和平的力量剷除，認為不可忘記奮鬥歷史，要讓年輕一輩代代相傳，以保衞國家民族獨立和全球和平。

抵京的代表團成員亦包括警務處處長周一鳴，以及巴黎奧運金牌得主江旻憓等。"
深證成指低收逾2%　創業板指數挫近3%,2025-09-02 15:29,,2025-09-02 15:45,cfinance,rthk,https://news.rthk.hk/rthk/ch/component/k2/1820861-20250902.htm,"內地股市收市下跌，深證成份指數及創業板指數急挫逾2%。通信設備、算力硬件等股份下跌；銀行、貴金屬股造好。

上證綜合指數初段一度逼近逾10年高位，高見3885點，其後一度跌逾1%，收市報3858點，跌17點，跌幅0.45%。

深證成指最多曾跌近3%，收市報12553點，跌275點，跌幅2.14%。

創業板指數一度挫近4%，收市報2872點，跌84點，跌幅2.85%。"
本港上月總雨量較正常值多一倍　為有紀錄以來8月份第三高,2025-09-02 15:27,,2025-09-02 15:45,local,rthk,https://news.rthk.hk/rthk/ch/component/k2/1820863-20250902.htm,"天文台表示，主要受8月上旬與活躍西南季候風及高空擾動相關的大雨及8月中旬數個熱帶氣旋影響，8月遠較正常多雨。天文台錄得全月總雨量939.2毫米，較8月正常值453.2毫米高超過一倍，是有紀錄以來8月份的第三高。

天文台說，雖然首半年雨量遠低於正常，但由於7月及8月出現連場大雨，本年首8個月累積雨量為1985.3毫米，追上同期正常值的1921.5毫米。

8月5日天文台總部錄得破紀錄368.9毫米的日雨量，是自1884年有紀錄以來8月份的最高日雨量。這單日雨量已是八月雨量正常值的八成以上。8月2日至5日這四日，天文台的累積雨量接近600毫米，而將軍澳及慈雲山的雨量更超過800毫米。

另外，雖然8月平均氣溫29度只較正常高0.3度，但連同氣溫高於正常的6月及7月，本年6月至8月的夏季較正常炎熱。夏季平均最低氣溫27.2度、平均最高氣溫31.9度及平均氣溫29.1度，分別是有紀錄以來同期的其中一個第6高、其中一個第7高及其中一個第9高。"
香港公開羽毛球錦標賽頒授「M」品牌認可,2025-09-02 15:07,,2025-09-02 15:15,local,rthk,https://news.rthk.hk/rthk/ch/component/k2/1820860-20250902.htm,"大型體育活動事務委員會向於本月9至14日在紅磡香港體育館舉行的「李寧二零二五香港公開羽毛球錦標賽 滙豐世界羽聯世界巡迴賽超級500」頒授「M」品牌認可。
　　 
委員會主席吳守基表示，這項世界級賽事雲集奧運獎牌得主和來自世界各地的羽毛球精英，將吸引許多本地、海外和內地的羽毛球愛好者，有助推廣旅遊和促進經濟。相信屆時中國香港隊將會在主場全力以赴，爭取佳績。
　　
政府表示，「M」品牌計劃旨在鼓勵及協助本地體育總會、私人或非政府機構舉辦更多大型國際體育活動，並加以扶植，使有關活動得以持續舉行。各類符合審批準則的體育活動有機會獲委員會授予「M」品牌認可，部分活動更會獲得撥款資助。"
抗戰勝利80周年｜鄧家彪稱年輕人須加強認識歷史學習抗戰精神,2025-09-02 15:05,,2025-09-02 15:15,local,rthk,https://news.rthk.hk/rthk/ch/component/k2/1820859-20250902.htm,"今年是中國人民抗日戰爭暨世界反法西斯戰爭勝利80周年，工聯會立法會議員鄧家彪到佛教孔仙洲紀念中學主持講座，約120名學生參與。

鄧家彪在講座表示，抗戰勝利後的和平只是一剎那，期望世界秩序恢復理性，但國家自身也要自強，避免再受欺凌。他說宣傳抗戰勝利的原因，是希望說明中國是世界舞台的參與者，世界需要承認中國面對過的苦難，因此民間交流十分重要。

鄧家彪在講座後表示，年輕人需要加強認識國家歷史，明白香港在抗戰作出的貢獻和參與，希望學習抗戰精神，奮發圖強，令國家更安全。他又說，講解抗戰歷史時，純粹授課可能會為學生帶來壓力，以多元化的手法，包括實地考察、電影欣賞和明日觀看閱兵直播，讓學生明白歷史為生活的一部份，先建立興趣和好奇，再去感受，以加強國民身分認同。

有出席的學生表示，透過講座可以深入認識抗戰歷史，形容獲益良多，亦有學生說可讓同學代入歷史。"
「UTS香港2025」下月舉行　黃澤林稱屬新嘗試感期待,2025-09-02 15:01,,2025-09-02 15:15,local,rthk,https://news.rthk.hk/rthk/ch/component/k2/1820858-20250902.htm,"香港將於下月中舉行新型網球賽事「UTS香港2025」，是首度進軍亞洲，並以本港作為首站，賽事將於啟德體育園啟德體藝館上演，獲邀參賽的香港網球「一哥」黃澤林表示期待，他指賽事模式及賽制都有別傳統網球賽，很有娛樂性，屬於新嘗試，由於賽事首次在亞洲舉行，相信對香港及亞洲球迷之言都屬於很好的體驗。

黃澤林日前在美國網球公開賽32強不敵世界排名15位、俄羅斯球手魯布列夫。魯布列夫亦會參與UTS香港站賽事，黃澤林見傳媒時說，上次已大約知道對方打法，而在不同賽制下如有機會再次對戰，會令人幾期待。他又提到，UTS賽事在啟德室內場進行，節奏較快，相信適合他的打法。

黃澤林又說，打完美網後感到疲累，目前會多些時間陪伴家人，稍作休息，之後會與港隊隊友備戰台維斯盃。至於11月舉行的全運會，他說暫時未想得太遠，屆時再部署，強調有比賽就打，每場比賽都「搏盡」。黃澤林提到，在台維斯盃後會展開亞洲賽季，他會繼續努力，活在當下和享受比賽，希望無論輸贏港人都繼續支持他，並在全運會期間為港隊運動員打氣。"
韓股高收逾0.9%,2025-09-02 14:39,,2025-09-02 15:00,cfinance,rthk,https://news.rthk.hk/rthk/ch/component/k2/1820857-20250902.htm,南韓股市收市上升，首爾綜合指數報3172點，升29點，升幅0.94%。
日股高收約0.3%,2025-09-02 14:36,,2025-09-02 15:00,cfinance,rthk,https://news.rthk.hk/rthk/ch/component/k2/1820856-20250902.htm,日本股市收市靠穩，日經平均指數報42310點，升121點，升幅0.29%。
長沙灣順寧道公務員建屋合作社計劃項目本月進行強拍,2025-09-02 14:32,,2025-09-02 15:00,local,rthk,https://news.rthk.hk/rthk/ch/component/k2/1820850-20250902.htm,"仲量聯行宣佈獲委任為拍賣人，公開拍賣長沙灣順寧道308號、310號及312號、314號物業，底價1.23億元。

物業屬公務員建屋合作社計劃項目，佔地約4800平方呎，由兩幢5層高唐樓組成，每幢均設有一條公用樓梯，一梯兩伙，兩幢物業合共提供20個住宅單位。

物業於本月23日拍賣，將以部分交吉、部分連現有租約及現有建築物命令，以「現狀」為基礎出售。"
警方及消防調查屯門火警成因　案件列作縱火及自殺處理,2025-09-02 14:20,,2025-09-02 14:30,local,rthk,https://news.rthk.hk/rthk/ch/component/k2/1820855-20250902.htm,"屯門怡樂花園發生火警，另外現場有一名51歲男子懷疑從高處墮下死亡，警方在現場檢獲遺書，死因有待驗屍確定，案件列作縱火及自殺處理。

事發在清晨近5時，警方接報上址有懷疑燒焦氣味傳出。消防破門入屋，將火救熄，約120名住客疏散。警方及消防調查火警成因。"
習近平︰中俄蒙要排除外部干擾　攜手推動三方合作高質量發展,2025-09-02 13:59,,2025-09-02 14:30,greater_china,rthk,https://news.rthk.hk/rthk/ch/component/k2/1820849-20250902.htm,"國家主席習近平同俄羅斯總統普京、蒙古總統呼日勒蘇赫在北京人民大會堂舉行中俄蒙三國元首第七次會晤。

習近平指出，中方願同俄方、蒙方一道，堅守合作初心，排除外部干擾，攜手推動三方合作高質量發展，並就推進中俄蒙合作提出3點建議，包括夯實政治互信、深化互利合作和密切在上海合作組織框架內協作。

習近平指出，上海合作組織是地區國家共護安全、共謀發展的主要平台。要用好天津峰會期間中方推動成立的各種合作平台和中心，拓展更廣闊合作空間。

普京表示，俄方願同中、蒙開展平等互利、面向未來的戰略合作，使三方合作同雙邊合作相互補充、相互促進。三方要密切發展戰略對接，加強互聯互通。

呼日勒蘇赫表示，中俄是蒙古的重要鄰國，蒙方致力於密切雙邊關係，拓展三方合作，推進中蒙俄經濟走廊建設，增進人文交流。"
習近平晤巴基斯坦總理　強調加強產業等領域合作,2025-09-02 13:56,,2025-09-02 14:30,greater_china,rthk,https://news.rthk.hk/rthk/ch/component/k2/1820854-20250902.htm,"國家主席習近平在北京人民大會堂，會見巴基斯坦總理夏巴茲。 

習近平指出，世界百年變局加速演進，強有力的中巴關係有利於維護地區和平與發展。他強調，中方願同巴方共同努力，打造中巴經濟走廊「2.0升級版」和中巴自貿協定升級版，加強產業、農業、礦業等領域合作，助力提升巴方自主發展能力。

習近平又說，中方支持巴方打擊恐怖主義，希望巴方採取切實有效舉措保障中方在巴人員、項目和機構安全，為兩國合作營造安全環境。

夏巴茲表示，沒有任何力量能够撼動牢不可破的巴中友誼。巴方堅定奉行一個中國原則，期待推進各領域合作，並將不遺餘力保護在巴中國人員、項目和機構安全。"
台股低收0.23%　險守24000點,2025-09-02 13:54,,2025-09-02 14:30,cfinance,rthk,https://news.rthk.hk/rthk/ch/component/k2/1820852-20250902.htm,"台灣股市先升後回，險守24000點關口。

加權指數收市報24016點，跌54點，跌幅0.23%。"
