title,date,summary,scrape_time,section,source,url,news_content
30 put out by small Central Government Offices fire,2025-05-23 17:59,,2025-05-23 18:15,elocal,rthk,https://news.rthk.hk/rthk/en/component/k2/1805984-20250523.htm,"Around 30 people were evacuated from the Central Government Offices in Tamar on Friday following a fire. 

Police received reports at around 12.15 pm that a computer had caught fire at the West Wing and firefighters were dispatched.

Faulty cables are suspected to have sparked the blaze.

Online footage showed flames and smoke billowing behind a computer screen, next to a landline telephone, and staff leaving the scene. 

No casualties have been reported so far."
40歲女子倒斃樂華北邨單位　3歲女兒被送院檢查,2025-05-23 17:41,,2025-05-23 18:15,local,rthk,https://news.rthk.hk/rthk/ch/component/k2/1805989-20250523.htm,"一名40歲女子被發現倒斃在牛頭角樂華北邨秉華樓一個單位，死者的3歲女兒被送院檢查。

今早11時許，房屋署職員報案，指懷疑女童被不恰當對待，人員接報到場發現女童的母親在睡房床上，現場證實死亡，死因有待驗屍後確定。

3歲女童無表面傷痕，清醒被送被送往聯合醫院檢查。警方說，證實女童無被不恰當對待，至於倒斃的母親則有患病紀錄。"
Local students not on board as Harvard dream slips,2025-05-23 17:40,,2025-05-23 17:45,elocal,rthk,https://news.rthk.hk/rthk/en/component/k2/1805979-20250523.htm,"An overseas education consultant in Hong Kong said on Friday some students are delaying plans to attend boarding schools in the United States that often serve as feeder schools to Harvard University. 

Her comments came after Donald Trump's administration revoked Harvard's ability to enroll foreign nationals, which make up around 27 percent of the student body. 

Julianna Yau, founder and director of Ampla Education, told RTHK that her centre received two enquiries about the announcement so far. 

""We have some students who are planning to go to the United States in the next few years who are expressing some concerns,"" she said. 

""So they're actually planning to go to boarding schools first, but now they might be postponing their plans.

""So at least for our students, usually they wouldn't just be applying to the United States on their own. 

""They would also apply to the other countries like Canada and UK. 

""I think that would be a safer choice – to apply to a few extra universities."" 

Yau added that applicants should continue with their Harvard application preparations but also come up with backup plans.

Another education consultant, Samuel Chan, said he received 20 requests for help from current and prospective Harvard students and their parents. 

They expressed worries about potential curriculum misalignment when transferring to other institutions and a possible reluctance on the part of employers with government contracts to hire graduates from Harvard. 

Meanwhile, the University of Science and Technology (HKUST) said it welcomes international Harvard students to transfer or enroll in its degree programmes.

In a statement, HKUST said it will provide ""unconditional offers, streamlined admission procedures and academic support"" to make the transition seamless for interested students.

""We are prepared to welcome Harvard students into our community, offering them the resources and vibrant environment needed to thrive in their fields,"" said HKUST provost Guo Yike."
一艘台灣漁船被日方扣押繳保釋金後獲釋　毛寧：中方向日方交涉,2025-05-23 17:39,,2025-05-23 17:45,greater_china,rthk,https://news.rthk.hk/rthk/ch/component/k2/1805987-20250523.htm,在北京，外交部在例行記者會回應一艘台灣漁船被日本公務船以違反漁業法規為由扣押，在繳納巨額保釋金後獲釋事件，發言人毛寧說，中國政府高度重視維護包括台灣地區在內的中國漁民合法權益。根據《中日漁業協定》，日方無權在有關水域對中方漁船採取執法措施。針對此次日方抓扣「紅彩頭6號」漁船，中方已向日方提出嚴正交涉，要求立即糾正錯誤做法，並採取有效措施防止類似事件再次發生。
名創優品上季經調整盈利按年跌近半成,2025-05-23 17:38,,2025-05-23 17:45,cfinance,rthk,https://news.rthk.hk/rthk/ch/component/k2/1805980-20250523.htm,"名創優品上季盈利逾4.16億元人民幣，按年跌近29%。經調整盈利5.87億元，按年跌近半成。

集團季內收入44.3億元，按年升19%，受惠平均門店數量按年增長16.5%。毛利率升至44.2%，上升0.8個百分點。

公司說，內地同店銷售跌幅已顯著收窄為中個位數。

截至3月底，集團層面門店總數7768家，按年淨新開978家。名創優品門店數量7488家，淨新開858家。"
政府完成水浸風險研究　制定本地紀中至末防洪和海岸管理策略,2025-05-23 17:24,,2025-05-23 17:45,local,rthk,https://news.rthk.hk/rthk/ch/component/k2/1805981-20250523.htm,"政府完成在不同氣候變化情況下的水浸風險研究，制定本世紀中和本世紀末的防洪和海岸管理策略。

發展局發言人表示，一直用「疏浚」、「蓄洪」和「節流」三招，改善雨水排放系統，成效顯著，但極端天氣事件越來越頻繁，不能掉以輕心，渠務署正進行15個排水改善工程，涉及超過170億元，將於2030年前陸續完成。

發言人表示，有關工程遍布新界、九龍和港島，包括元朗明渠防洪壩計劃，亦涉及旺角、黃大仙等9個地下蓄洪池等，可處理的容量超過30萬立方米。

發言人表示，土拓署在26個地點改善沿岸措施，涉及開支約3億元，包括興建防洪牆和活動式擋水設施，當中計劃超前部署的地點佔11個，包括西灣河、小西灣和柴灣等，當局解釋，識別有關地點的原則是地理環境受災的機會率和造成的後果。"
印尼蘇門答臘島西南海域6級地震　約140間房屋受損,2025-05-23 17:13,,2025-05-23 17:30,cinternational,rthk,https://news.rthk.hk/rthk/ch/component/k2/1805978-20250523.htm,"印尼蘇門答臘島西南海域發生6級地震，造成大約140間房屋和多處公共設施受損，至今沒有傷亡報告。

地震在當地凌晨接近3時發生，震央位於蘇門答臘島明古魯市西南47公里的海域，震源深度84公里。

印尼總統普拉博沃已指示國家抗災署盡快趕往現場，開展災情核查與應急援助。

當局表示，已向災區發放首批援助物資，並搭建帳篷和指揮救援中心。"
何立峰會見花旗及凱雷投資高層　歡迎外資金融機構來華投資興業,2025-05-23 17:13,,2025-05-23 17:30,greater_china,rthk,https://news.rthk.hk/rthk/ch/component/k2/1805975-20250523.htm,"新華社報道，國務院副總理何立峰在人民大會堂，分別會見美國花旗集團董事長杜頌安、凱雷投資集團首席執行官施瓦茨。 

何立峰表示，當前中國經濟運行延續回升向好態勢，中國正著力構建全國統一大市場，堅定不移擴大高水平對外開放，持續對標國際高標準經貿規則，不斷優化營商環境，大力鼓勵外商投資，為跨國公司在華長期穩定發展提供廣闊空間，歡迎包括花旗、凱雷在內外資金融機構來華投資興業，共同參與中國資本市場建設，深化對華合作，共享發展機遇。 

杜頌安表示，花旗將繼續深耕中國市場，願進一步加強對華投資合作，圍繞證券、期貨、金融衍生品等領域在華積極佈局相關新業務。

施瓦茨表示，凱雷看好中國經濟發展前景，願致力對華長期合作，不斷擴大在華投資新佈局。"
HK stocks end up for sixth straight week of gains,2025-05-23 17:01,,2025-05-23 17:30,efinance,rthk,https://news.rthk.hk/rthk/en/component/k2/1805971-20250523.htm,"Hong Kong stocks closed roughly flat on Friday, logging a sixth straight weekly gain, underpinned by renewed listing momentum and signs of easing Sino-US trade tensions. 

The benchmark Hang Seng Index edged up by 56.95 points, or 0.24 percent, to end the day and trading week at 23,601.26.

The Hang Seng China Enterprises Index rose 0.31 percent to end at 8,583.86 while the Hang Seng Tech Index fell 0.09 percent to end at 5,246.87.

China's blue-chip CSI300 Index ended 0.8 percent lower, while the Shanghai Composite Index lost 0.9 percent. 

For the week, the Hang Seng Index was up 1.1 percent, while the CSI300 index lost 0.2 percent.

Hong Kong's listing market showed signs of revival in 2025, buoyed by the strong debut of battery giant CATL, which raised US$4.6 billion in the world's largest listing so far this year.

Shares of pharma giant Jiangsu Hengrui soared 25 percent in their Hong Kong debut. 

The CSI Healthcare Index edged up 0.3 percent, bucking a broader market decline as most other sectors ended in losses.

BYD shares jumped as much as 4.6 percent after reports showed the Chinese automaker sold more electric vehicles in Europe than Tesla. 

Auto shares tracked gains and were up 1.7 percent. Li Auto's shares rose 1.1 percent.

Weakness in China's property sector is expected to persist this year with home prices falling nearly 5 percent and set to remain stagnant in 2026, a poll showed.

China has lowered the ceiling of deposit rates, as authorities seek to protect banks' profit margins and discourage savings. The CSI Bank Index finished 1 percent lower.

Xiaomi said it will start selling its YU7 electric vehicle in July. Its shares were roughly flat after the news. (Reuters/Xinhua)"
在岸人民幣創逾半年新高,2025-05-23 17:00,,2025-05-23 17:15,cfinance,rthk,https://news.rthk.hk/rthk/ch/component/k2/1805973-20250523.htm,"在岸人民幣收報7.1895兌1美元，創逾半年最高，升145點子。

市場人士表示，美元指數走弱，帶動人民幣升勢擴大，料短期後市仍以區間波動為主。"
過去一周本港新增一宗外地傳入登革熱感染個案,2025-05-23 16:55,,2025-05-23 17:15,local,rthk,https://news.rthk.hk/rthk/ch/component/k2/1805974-20250523.htm,"衞生防護中心公布，過去一周錄得一宗外地傳入的登革熱感染個案。病人於潛伏期內曾到印度尼西亞。

截至昨日，今年錄得22宗外地傳入登革熱個案。

衞生防護中心說，印度尼西亞、馬來西亞、泰國及越南今年至今已各錄得超過一萬宗個案，新加坡亦錄得接近2000宗個案。另外，根據廣東省疾病預防控制中心的資料，自佛山在3月錄得今年首例本地病例後，廣東省今年於佛山和中山共錄得6宗本地病例。

中心建議，市民如從受登革熱影響地區回港，應在14日內繼續使用昆蟲驅避劑。若感到不適，應盡快求醫，並告知醫生外遊細節。"
德國首季經濟向上修訂至按季增長0.4%,2025-05-23 16:53,,2025-05-23 17:15,cfinance,rthk,https://news.rthk.hk/rthk/ch/component/k2/1805963-20250523.htm,"德國首季經濟按季增幅向上修訂0.2個百分點，至增長0.4%。

當局表示，3月經濟表現良好，製造業產出和出口長都高於初值。"
一艘台灣漁船被日方扣押繳保釋金後獲釋　毛寧：中方向日方交涉,2025-05-23 16:47,,2025-05-23 17:00,greater_china,rthk,https://news.rthk.hk/rthk/ch/component/k2/1805972-20250523.htm,在北京，外交部在例行記者會回應一艘台灣漁船被日本公務船以違反漁業法規為由扣押，在繳納巨額保釋金後獲釋事件，發言人毛寧說，中國政府高度重視維護包括台灣地區在內的中國漁民合法權益。根據《中日漁業協定》，日方無權在有關水域對中方漁船採取執法措施。針對此次日方抓扣「紅彩頭6號」漁船，中方已向日方提出嚴正交涉，要求立即糾正錯誤做法，並採取有效措施防止類似事件再次發生。
工作暑熱警告取消,2025-05-23 16:47,,2025-05-23 17:45,local,rthk,https://news.rthk.hk/rthk/ch/component/k2/1805972-20250523.htm,黃色工作暑熱警告在下午4時40分取消。
美國哈佛被禁收國際學生　有本港升學顧問稱今早收到約20宗求助,2025-05-23 16:38,,2025-05-23 16:45,local,rthk,https://news.rthk.hk/rthk/ch/component/k2/1805970-20250523.htm,"美國政府取消哈佛大學招收國際學生的資格，並要求現有的外國學生轉學。本港升學顧問陳思銘表示，今早收到大約20個求助，有正就讀或計劃到哈佛深造的學生家長，憂慮當地與政府有工作來往的僱主或不願聘請該校的畢業生，即使在頂尖學府畢業也難以尋找工作，亦有家長和學生擔心轉到其他院校繼續學業，課程未能銜接。

但陳思銘認為毋須過份擔心，能夠獲哈佛取錄的學生質素高，具有非常高的競爭力，其他國際知名院校會願意錄取，甚至歡迎他們申請報讀。

立法會教育事務委員會主席周文港說，事件對美國學術自由造成影響，對於當地國際留學生帶來信心危機，本港八間資助大學可以在這段時間合作，為受影響學生提供支援，吸引他們來港升學，推動香港發展成為國際專業教育樞紐，加強深化國際合作。"
恒指全日升56點　午後曾跌近60點,2025-05-23 16:30,,2025-05-23 17:45,local,rthk,https://news.rthk.hk/rthk/ch/component/k2/1805969-20250523.htm,"港股午後一度跟隨內地股市轉跌，曾跌近60點，收市升56點，報23601點，成交額近2037億元。

科技指數最多升逾1%，收市只升近0.1%，報5246點。ATMXJ個別發展。

中資金融股表現較好，建行、工行及中人壽升近1%或以上。內需、汽車股個別發展，理想汽車及比亞迪升1%至近2%，小鵬汽車跌近4%。3桶油升約0.6%至1%。

首日上市的恒瑞醫藥較招股價高出約25%，收報55.15元；Mirxes升近29%，收報30元。

總結全星期，恒指升約1%，科指跌約0.7%。"
恒指升56點　午後曾跌近60點,2025-05-23 16:30,,2025-05-23 16:45,local,rthk,https://news.rthk.hk/rthk/ch/component/k2/1805969-20250523.htm,"港股午後一度跟隨內地股市轉跌，曾跌近60點，收市升56點，報23601點，成交額近2037億元。

科技指數最多升逾1%，收市只升近0.1%，報5246點。ATMXJ個別發展。

中資金融股表現較好，建行、工行及中人壽升近1%或以上。內需、汽車股個別發展，理想汽車及比亞迪升1%至近2%，小鵬汽車跌近4%。3桶油升約0.6%至1%。

首日上市的恒瑞醫藥較招股價高出約25%，收報55.15元；Mirxes升近29%，收報30元。

總結全星期，恒指升約1%，科指跌約0.7%。"
本港二手樓價按周跌逾0.3%,2025-05-23 16:19,,2025-05-23 16:45,cfinance,rthk,https://news.rthk.hk/rthk/ch/component/k2/1805967-20250523.htm,"反映本港二手樓價走勢的中原城市領先指數(CCL)最新報136.24，按周跌0.34%，仍處於逾8年半低位。

中小型單位及大型單位分別按周跌0.23%及0.81%。4區樓價中，新界西跌近2%，跌幅是10周以來最大；九龍樓價連升兩周後偏軟，跌0.11%；港島及新界西樓價分別升0.13%及2.59%。

中原地產表示，整體樓價繼續好淡爭持，CCL連續8周於136水平窄幅波動，雖然拆息掛鈎按揭（H按）實際按息跌穿2厘，創近3年新低，但二手買家仍持觀望態度，加上發展商以低價策略促銷多個新盤，相信短期二手樓價受壓，走勢反覆調整。"
Three nabbed in HK$61m money laundering probe,2025-05-23 16:17,,2025-05-23 16:45,elocal,rthk,https://news.rthk.hk/rthk/en/component/k2/1805968-20250523.htm,"Customs officials have arrested two women and a man for suspected money laundering involving HK$61 million.

The arrests were made following a dangerous drug investigation last year and the discovery of suspicious transactions in the personal bank accounts of one of those arrested. 

Further investigations then found large amounts of money had flowed through the bank accounts of the other two suspects, a 55-year-old woman and a 30-year-old man.

Acting senior inspector Au Wing-cheung of the Customs Financial Investigation Bureau said on Friday that transactions amounting to HK$61 million in suspected crime proceeds were recorded at bank accounts that the three had in seven local banks last year. 

They could not provide reasonable explanations, he said.

""The suspects' bank transactions did not match their financial backgrounds,"" Au said.

""The three who were arrested claimed to be a catering employee, a housewife and a clerk when opening the bank accounts and to be on monthly salaries of HK$10,000 to HK$30,000. 

""They also reportedly lived in public housing estates and did not own any properties. 

""However, their bank accounts recorded more than 10,000 suspicious transactions amounting to HK$61 million,"" he said.

Two of them have been released on bail pending investigation, while the third involved in the drug case has been remanded in custody.

Au said Customs officers seized three mobile phones during the operation and that further arrests could be made."
周一鳴：首季涉太空油毒品被捕人數　超越大麻和冰毒,2025-05-23 15:58,,2025-05-23 17:45,local,rthk,https://news.rthk.hk/rthk/ch/component/k2/1805965-20250523.htm,"警務處處長周一鳴表示，今年首季涉及太空油毒品的被捕人數，佔涉及毒品的總被捕人數一成八，超越大麻和冰毒，被捕的青少年當中，涉及太空油毒品的佔比達到三成，遠高於大麻和可卡因。

周一鳴出席在亞洲國際博覽館兒童書展，他致辭時提醒年輕人不要被矇蔽，以為一試無妨，太空油是一種毒品，會將人推向萬劫不復的深淵，摧殘吸食者的前途和生命，過往有不少吸食者在公眾場所做出一些失常或危險的舉動，當中更有被性侵的個案。

他又指出，隨著兒童使用互聯網和社交媒體愈來愈普及，涉及兒童網上性誘識的性罪行個案，在國際及本地層面都有上升趨勢，警方會針對涉及兒童和青少年的毒品問題及性罪行，繼續加強情報主導的執法及宣傳教育工作。

周一鳴提到，警務處公共關係部在今次展覽中設有攤位，包括小警察制服體驗站，亦有攤位遊戲及提子親子互動合影，並送出提子動畫廊主題的繪本，以寓教於樂的方式，宣傳提防騙子的資訊。"
周一鳴：首季涉太空油毒品被捕人數　佔涉毒總被捕人數18%,2025-05-23 15:58,,2025-05-23 16:15,local,rthk,https://news.rthk.hk/rthk/ch/component/k2/1805965-20250523.htm,"警務處處長周一鳴表示，今年首季涉及太空油毒品的被捕人數，佔涉及毒品的總被捕人數一成八，超越大麻和冰毒，被捕的青少年當中，涉及太空油毒品的佔比達到三成，遠高於大麻和可卡因。他又指出，隨著兒童使用互聯網和社交媒體愈來愈普及，涉及兒童網上性誘識的性罪行個案，在國際及本地層面都有上升趨勢。

周一鳴出席在亞洲國際博覽館兒童書展，他致辭時說，針對涉及兒童和青少年的毒品問題及性罪行，警方會繼續加強情報主導的執法及宣傳教育工作，但需要持份者的齊心參與，才能事半功倍。他強調除了要提升青少年對相關罪行和犯案手法的認知，亦要教導他們建立戒心，抗拒誘惑，同時要加強對年輕一輩的溝通和關懷，令他們在遇到困惑時主動向可信的人求助。

周一鳴提到，警務處公共關係部在今次展覽中設有攤位，包括小警察制服體驗站，亦有攤位遊戲及提子親子互動合影，並送出提子動畫廊主題的繪本，以寓教於樂的方式，宣傳提防騙子的資訊。"
美當局要求哈佛提交海外生示威紀錄換取重獲招收國際學生認證,2025-05-23 15:48,,2025-05-23 16:00,cinternational,rthk,https://news.rthk.hk/rthk/ch/component/k2/1805964-20250523.htm,"美國總統特朗普政府與哈佛大學的矛盾惡化。國土安全部宣布撤銷哈佛的學生與交流訪客項目認證，禁止校方招收國際學生，並要求現有國際學生轉學，否則將失去合法身份。

國土安全部部長諾姆在致哈佛的信中表示，政府給予哈佛重新獲得認證的機會，就是校方要在72小時內，提交大量有關海外學生的紀錄，包括過去5年他們參與抗議活動的任何片段或錄音檔案。諾姆又指其他大學亦可能被審查，針對哈佛的措施是對全美高校的警告。

哈佛批評政府此舉是非法。國會有民主黨眾議員亦指責政府對哈佛的獨立性及學術自由作出不可容忍的攻擊，質疑是因為哈佛之前抵制當局做法，所以遭到政府報復。

特朗普重返白宮以來，與美國精英大學矛盾不斷，一直猛烈批評有關學府是左翼意識形態堡壘。他的政府之前已對包括哈佛在內的60多所高校啟動審查，並暫停聯邦撥款。

今年3月起，美國政府先後要求哈佛廢除「多元化、平等、包容」政策、削弱管理人員權力、調整招生標準等，遭哈佛拒絕後，凍結對哈佛22億美元撥款及6000萬美元合約款項。"
韓股收市微跌,2025-05-23 15:33,,2025-05-23 15:45,cfinance,rthk,https://news.rthk.hk/rthk/ch/component/k2/1805955-20250523.htm,"南韓股市微跌。

首爾綜合指數收報2592點，跌1點。

全星期計，韓股跌逾1%。"
滬深股市轉跌收市　低收近1%或以上,2025-05-23 15:30,,2025-05-23 15:45,cfinance,rthk,https://news.rthk.hk/rthk/ch/component/k2/1805957-20250523.htm,"內地股市尾市轉跌，3大指數以全日低位收市。遊戲、算力概念股、港口航運股向下；貴金屬、醫療服務板塊股上升。

上證指數收報3348點，跌31點，跌幅0.94%。

深證成份指數報10132點，跌87點，跌幅0.85%。

創業板指數報2021點，跌24點，跌幅1.18%。

全星期計，3大指數跌約0.5%至0.9%。"
食安中心時令食品調查　113個粽子樣本全部通過檢測,2025-05-23 15:25,,2025-05-23 15:45,local,rthk,https://news.rthk.hk/rthk/ch/component/k2/1805962-20250523.htm,"端午節將至，食物安全中心公布，最近完成一項有關粽子的時令食品調查。113個粽子樣本全部通過檢測。

中心從不同零售商包括網上零售商、網上送餐平台、食肆和食物製造廠抽取粽子樣本，進行化學、微生物和營養成分測試。化學檢測包括染色料、防腐劑、金屬雜質、礦物油、抗氧化劑、甜味劑及除害劑殘餘；微生物檢測則包括沙門氏菌、凝固酶陽性葡萄球菌、產氣莢膜梭狀芽孢桿菌及蠟樣芽孢桿菌的致病菌。

中心亦檢測樣本的營養成分包括能量值、蛋白質、碳水化合物、總脂肪、飽和脂肪酸、反式脂肪酸、鈉和糖，含量與其營養標籤上的標示值是否相符。

中心發言人提醒市民在選購粽子向可靠的店鋪購買粽子； 購買非預先包裝粽子時，挑選用粽葉包裹妥當的；及留意食用日期及檢查包裝是否完好。

至於自製粽子，食安中心建議向可靠的供應商購買粽葉，避免挑選顏色異常青綠或帶有化學劑氣味的粽葉；徹底清潔雙手及用具；及分開處理生熟食物，避免交叉污染。"
張舉能明天率團訪問西安及銀川,2025-05-23 15:22,,2025-05-23 15:45,local,rthk,https://news.rthk.hk/rthk/ch/component/k2/1805960-20250523.htm,"終審法院首席法官張舉能明日率領司法機構代表團前往陝西省西安市和寧夏回族自治區銀川市訪問，期間將與最高人民法院常務副院長鄧修明和副院長茅仲華會面，並與其他內地法官進行專業交流，以及參觀當地不同層級的法院。 
 
代表團其他成員包括高等法院首席法官潘兆初、高等法院上訴法庭副庭長朱芬齡、高等法院上訴法庭法官林雲浩、高等法院原訟法庭法官梁俊文，以及司法機構政務長梁悅賢。
    
代表團將於5月31日回港。在張舉能首席法官離港期間，由終審法院常任法官李義署理終審法院首席法官職務。"
中方回應美國政府針對哈佛行動　稱將堅定維護留學生及學者權益,2025-05-23 15:22,,2025-05-23 15:45,greater_china,rthk,https://news.rthk.hk/rthk/ch/component/k2/1805961-20250523.htm,"在北京，外交部發言人毛寧表示，美國政府針對哈佛大學的行動，將損害美國形象及國際信譽，中方將堅定維護海外中國學生及學者的正當合法權益，強調中美教育合作是互利，中方一貫反對將教育合作政治化。

較早時，美國政府宣布撤銷哈佛的學生與交流訪客項目認證，禁止招收國際學生，現有的外國學生亦須轉學，否則將失去合法地位。"
科大公開邀請哈佛國際學生入讀　提供無條件取錄和學術支持,2025-05-23 15:20,,2025-05-23 15:45,local,rthk,https://news.rthk.hk/rthk/ch/component/k2/1805958-20250523.htm,"香港科技大學宣布，公開邀請現正就讀哈佛大學的國際本科生和研究生，以及已獲哈佛大學學位課程確認錄取的學生，到科大繼續升學。校方將提供無條件取錄和學術支持，並簡化入學程序，方便有興趣的學生順利轉校過渡。

科大表示，將優先和加快處理入學申請、學分轉移，以及提供簽證和住宿等支援，確保順利過渡，校方已成立專門團隊協助學生辦理相關事宜。

科大說，希望為優秀的學生提供更多機會，讓他們不受干擾地追求學習目標，相信可以響應全球學術格局的變化，強化科大致力創造多元化和世界級學習環境的承諾。"
