title,date,summary,scrape_time,section,source,url,news_content
稅務總局：6月底外資涉稅經營主體戶數比2020年增近13%,2025-07-28 10:45,,2025-07-28 11:00,greater_china,rthk,https://news.rthk.hk/rthk/ch/component/k2/1815404-20250728.htm,"國家稅務總局總結十四五時期稅收改革與發展情況，局長胡靜林表示，期間，中國對外開放力度進一步加大，外商來華投資穩步增長。至今年6月底，外資涉稅經營主體戶數比2020年增長12.7%，銷售收入平穩增長。

出口退稅數據顯示，全國稅務部門辦理出口退稅年均增長6.6%，可比口徑今年上半年增速提升至7.1%，胡靜林說，反映在錯綜複雜形勢下，中國外貿出口的韌性。

他又指，消費需求持續增長，2021年至2024年全國商品消費年均增長6.8%，今年上半年增長加快至7.7%。

此外，新質生產力加速增長，2021年至2024年高技術產業銷售收入平均增長13.9%，今年上半年增長加快至14.3%。高技術製造業佔全部製造業的比重由2020年的15.3%，提升至今年上半年的16.9%。

胡靜林表示，2021年至2024年，全國數字經濟核心產業銷售收入年均增長10.8%，反映創新產業勢頭強勁，實體經濟與數字經濟融合加深。綠色轉型不斷加快，風力、水力、太陽能等清潔能源發電行業銷售收入年均增長13.1%。"
立會續審議同性伴侶登記草案　曾國衞稱有關機制與婚姻屬兩碼子事,2025-07-28 10:44,,2025-07-28 11:00,local,rthk,https://news.rthk.hk/rthk/ch/component/k2/1815403-20250728.htm,"立法會《同性伴侶關係登記條例草案》委員會，繼續就條例進行逐條審議。

再有議員質疑條例草案容許遙距註冊的海外關係在港登記的做法，經民聯主席盧偉國指出，有心人可在海外開設網上公司，並遙距註冊同性婚姻或伴侶關係，其後就可在港登記，獲法律所承認，實際等同承認有關婚姻。盧偉國又認為，在登記制度下，同性伴侶可享有醫療及處理身後事宜等核心權利，關注稍後會否擴展至申請公屋等社會福利。

政制及內地事務局局長曾國衞重申，整個登記制度及賦予的權利，與婚姻屬於兩碼子事。

政制及內地事務局副秘書長施金獎說，同性伴侶在海外註冊，必須是當地官方登記的認可機構，香港才會認可，不是隨便一間機構都可以。他又說，在條例草案下，政府制訂的核心權利及責任包括登記、撤銷登記、醫療及處理身後事宜，如涉及其他福利例如申請公屋等，就會根據法庭的裁決跟進。

選委界議員梁毓偉提出，香港會否只承認親身註冊的海外關係在港登記，不承認遙距的形式。

施金獎回應說，無論是親身或透過遙距方式註冊，特區政府考慮的最關鍵因素是有關方式，是否屬於該司法管轄區所提供的官方及合法承認註冊安排，而政府留意到大部分司法管轄區的註冊方式都是親身註冊為主。

另外，條例草案容許雙方同意下申請撤銷同性伴侶關係登記。新民黨主席葉劉淑儀關注，如有同性伴侶因吵架而申請撤銷登記，但及後又不想撤銷，政府會否批准。

施金獎說，如同性伴侶「耍花槍」申請撤銷登記，只要登記官未正式註銷，當局會酌情處理。但他強調，無論申請登記或撤銷登記，都應該考慮清楚。"
US-EU trade deal lifts local stocks,2025-07-28 10:42,,2025-07-28 11:00,efinance,rthk,https://news.rthk.hk/rthk/en/component/k2/1815394-20250728.htm,"The Hang Seng Index gained 70 points, or 0.28 percent, to open at 25,458 points on Monday.  

Across the border, the benchmark Shanghai Composite Index rose 0.57 percent to 3,594 while the Shenzhen Component Index was up 0.02 percent at 11,176.

Stocks rose after a trade agreement between the United States and the European Union lifted sentiment and provided clarity in a pivotal week headlined by the US Federal Reserve and the Bank of Japan policy meetings.

Countries are looking to finalise trade deals ahead of an August 1 deadline, with talks between the US and China set for Monday in Stockholm. (Agencies)"
日股半日跌逾300點,2025-07-28 10:41,,2025-07-28 11:00,cfinance,rthk,https://news.rthk.hk/rthk/ch/component/k2/1815401-20250728.htm,日本股市半日下跌，日經平均指數上午收市報41148點，跌308點，跌幅0.74%。
國家發展改革委安排5千萬元中央預算內投資支持河北洪災後恢復,2025-07-28 10:40,,2025-07-28 11:00,greater_china,rthk,https://news.rthk.hk/rthk/ch/component/k2/1815402-20250728.htm,"河北暴雨引發洪澇災害。國家發展改革委緊急安排5000萬元人中央預算內投資，支持災後應急恢復。

按照《國家自然災害救助應急預案》，這筆款項用於支持河北做好暴雨洪澇災害的災後應急恢復，重點包括受損道路橋樑、水利堤防、學校醫院等基礎設施，以及公共服務設施，推動盡快恢復正常生產生活秩序。

從過去的星期五以來，受強降雨影響，河北省承德、保定、張家口等多地受災較重，影響嚴重。"
深水埗北河街女子遭斬傷　男子涉傷人被捕,2025-07-28 10:37,,2025-07-28 11:00,local,rthk,https://news.rthk.hk/rthk/ch/component/k2/1815399-20250728.htm,"深水埗早上發生持刀傷人案，一名女子受傷送院。

事發在早上約7時半，有目擊者報案指，一名男子在北河街持刀襲擊一名女子。警方到場在北河街街市制服該男子，並以涉嫌傷人將他拘捕。

被斬傷的女子清醒送院，目擊事件的一名60歲女子亦感不適，連同女傷者及被捕男子送往明愛醫院。"
恒指升幅擴大至逾200點　保險及券商股造好,2025-07-28 10:30,,2025-07-28 10:45,cfinance,rthk,https://news.rthk.hk/rthk/ch/component/k2/1815397-20250728.htm,"港股造好，恒生指數較早時報25627點，升239點，升幅0.9%。科技指數報5693點，升幅近0.3%。

保險和券商股升幅較大，中人壽升近7%、平保和友邦升5%或以上。時富金融升10%，耀才和國泰君安升逾5%。

醫藥股和博彩股亦造好。汽車股個別發展。

油股下挫，中海油和中石油跌逾1%。另外，中升控股跌近4%。"
內地十四五期間累計徵收稅費收入預計逾155萬億元人民幣,2025-07-28 10:23,,2025-07-28 10:45,greater_china,rthk,https://news.rthk.hk/rthk/ch/component/k2/1815398-20250728.htm,"國家稅務總局局長胡靜林表示，十四五期間，內地經濟平穩增長，經濟社會活力進一步增強。稅務部門累計徵收稅費收入預計逾155萬億元人民幣，佔全口徑財政收入80%左右。其中，稅收收入將超過85萬億元，比十三五期間稅收總額增加13萬億元。期間，累計徵收社會保險費及土地出讓金等收入將逾70萬億元。

他又表示，十四五期間，出台一系列減稅降費政策，全國累計新增減稅降費預計達10.5萬億元，辦理出口退稅逾9萬億元，有利促進經濟社會向好向新。

截至今年上半年，全國涉稅經營主體突破1億戶，比2020年淨增加3000萬戶，反映內地市場活力足、韌性強，發票數據亦顯示實體經濟穩中提質。此外，市場營商環境進一步優化，稅收營商環境亦不斷改善。"
山西省大同市有客車疑遇大雨墮河　1人遇難13人失蹤,2025-07-28 10:21,,2025-07-28 10:45,greater_china,rthk,https://news.rthk.hk/rthk/ch/component/k2/1815395-20250728.htm,"山西省大同市天鎮縣有客車行駛期間，懷疑因為大雨墮河，暫時救出1名遇難人員、仍有13人失蹤。

省長盧東亮趕赴現場，指揮部署救援工作。"
國家防災減災救災委針對河北洪澇啟動國家四級救災應急響應,2025-07-28 10:21,,2025-07-28 10:45,greater_china,rthk,https://news.rthk.hk/rthk/ch/component/k2/1815396-20250728.htm,"國家防災減災救災委員會針對河北省嚴重暴雨洪澇災害影響，啟動國家四級救災應急響應，派出工作組趕赴災區，實地查看災情，指導並協助地方做好受災群眾基本生活保障等災害救助工作。

央視新聞報道，受連續強降雨影響，北京懷柔多處地點受損及出現塌方情況，懷柔北部的琉璃廟鎮的災情最嚴重地區，山洪過後村內淤泥非常嚴重，很多車輛被大水沖到四處翻側，在村民的庭院內可以見到之前洪水在沖入庭院時至少有一米多高，屋內的傢俱都被沖出庭院。

消防人員在鎮政府向民眾解說清理淤泥及提供臨時安置點的詳情。由於部分村落分布在高山上，目前上山的道路因山泥傾瀉及洪水沖刷，車輛無法通行，消防員只能徒步爬山前往救援。"
內地股市初段個別發展,2025-07-28 09:38,,2025-07-28 09:45,cfinance,rthk,https://news.rthk.hk/rthk/ch/component/k2/1815393-20250728.htm,"滬深股市在開市初段個別發展。

上證綜合指數較早時報3584點，跌9點，跌幅0.25%。

深證成份指數報11127點，跌40點，跌幅0.36%。

創業板指數報2340點，升不足1點。"
人行開展4958億元人民幣逆回購,2025-07-28 09:37,,2025-07-28 09:45,cfinance,rthk,https://news.rthk.hk/rthk/ch/component/k2/1815392-20250728.htm,"人民銀行公開市場開展4958億元人民幣逆回購操作，期限為7日，利率維持於1.4厘。

對沖到期量後，單日淨投放3251億元，連續兩日淨投放。"
恒指競價時段升70點,2025-07-28 09:25,,2025-07-28 09:45,cfinance,rthk,https://news.rthk.hk/rthk/ch/component/k2/1815391-20250728.htm,"港股競價時段上升，恒生指數報25458點，升70點，升幅0.28%。

科技指數報5699點，升21點，升幅0.37%。"
人民幣兌美元中間價創1周低位,2025-07-28 09:24,,2025-07-28 09:45,cfinance,rthk,https://news.rthk.hk/rthk/ch/component/k2/1815390-20250728.htm,人民幣兌美元中間價報7.1467兌1美元，較上周五中間價跌48點子，創1星期低位，市場預測仍偏強近190點子。
台股初段上升,2025-07-28 09:07,,2025-07-28 09:45,cfinance,rthk,https://news.rthk.hk/rthk/ch/component/k2/1815387-20250728.htm,台灣股市在開市初段上升，加權指數較早時報23516點，升152點，升幅0.65%。
澳門青年稱理想長工不易找　人力資源會冀政府博企合作助就業機會,2025-07-28 09:07,,2025-07-28 09:15,greater_china,rthk,https://news.rthk.hk/rthk/ch/component/k2/1815388-20250728.htm,"每逢暑假都有新一批畢業生投入職場，澳門近年多了年輕人以兼職或做外賣車手謀生，部分人說尋找全職工作不易。澳門人力資源協會分析，與澳門疫後職場變化、產業仍然單一，以及輸入外勞等因素有關。

有從事外賣車手的青年說，一年前入行，高中畢業後一直找不到長工，亦不願在賭場輪夜班工作，故選擇送外賣，時間較自由，勤力多接單下收入也不錯。

有兩年前師範畢業的市民說，勞損休養後希望重返職場，但教師職位基本飽和，好難競爭。寄出多封求職信及參加招聘會都無回音，近一年惟有做兼職謀生。

澳門人力資源協會會長徐展文說，青年就業問題包括疫後職場起變化，一些過往較受歡迎的崗位，例如娛樂場貴賓廳等職位消失，公職崗位則僧多粥少。澳門推動產業多元，暫時只有文旅會展業較好，其他未見顯著成績，令畢業生或未能學以致用。

徐展文說，澳門最新總體失業率僅1.9%，近乎全民就業。18萬外勞雖然對工資和崗位上有些影響，但澳門的確缺乏人力。他建議政府和博彩休閒企業努力，適時讓部分外勞退場，騰出適合澳門人的工作崗位，以及為缺乏工作經驗的年輕人提供職業培訓。他亦呼籲年輕人不要躺平，先就業再擇業，累積經驗有利未來發展。"
日本擬容許大學招收更多國際學生促增長和提高教育水平,2025-07-28 08:57,,2025-07-28 10:30,cinternational,rthk,https://news.rthk.hk/rthk/ch/component/k2/1815386-20250728.htm,"有日本傳媒報道，日本文部科學省計劃放寬大學招收更多國際學生的人數限制，希望提高日本本科專業的國際學生比例，有助於日本增長，並提高教育和研究水平。

讀賣新聞引述消息人士報道，當局計劃2026年4月開始的下一學年，開始實施有關措施。

報道說，日本大學的國際學生比例，低於其他主要國家的大學，根據現行制度，包括國際學生在內的大學，總人數超過招生限額一定比例時，就會受到處罰，懲罰措施包括削減政府補貼。"
日本擬容許大學招收更多國際學生促進增長和提高教育水平,2025-07-28 08:57,,2025-07-28 09:15,cinternational,rthk,https://news.rthk.hk/rthk/ch/component/k2/1815386-20250728.htm,"有日本傳媒報道，日本文部科學省計劃放寬大學招收更多國際學生的人數限制，希望提高日本本科專業的國際學生比例，有助於日本增長，提高教育和研究水平。

《讀賣新聞》引述消息人士報道，當局計劃2026年4月開始的下一學年開始實施。

報道說，日本大學的國際學生比例低於其他主要國家的大學，根據現行制度，包括國際學生在內的大學總人數超過招生限額一定比例時，就會受到處罰，懲罰措施包括減少政府補貼。"
泰柬今日於大馬會談　魯比奧稱美國官員提供協助,2025-07-28 08:30,,2025-07-28 08:45,cinternational,rthk,https://news.rthk.hk/rthk/ch/component/k2/1815385-20250728.htm,"泰國與柬埔寨今日下午將於馬來西亞會談，討論化解兩國邊境爭議。

泰國總理府發言人表示，代理總理普坦上午將會率團到馬來西亞，討論地區和平方案，會談當地下午3時開始。

柬埔寨首相洪瑪奈其後證實，今日將會率團到吉隆坡，參加由馬來西亞主辦、美國協辦、中國參與的特別會議，目的是達成立即停火。

美國國務卿魯比奥表示，國務院官員正在馬來西亞協助和平。國務院聲明說，總統特朗普和魯比奧與每個國家的官員接觸，並密切監視情況，魯比奧說，希望這場衝突盡快結束。

在北京，外交部發言人說，希望泰柬雙方秉持以和為貴、與鄰為善精神，保持冷靜克制，盡快停火止戰，透過對話協商和平解決分歧，早日恢復邊境地區和平穩定。"
韓股初段變動不大,2025-07-28 08:24,,2025-07-28 08:45,cfinance,rthk,https://news.rthk.hk/rthk/ch/component/k2/1815384-20250728.htm,南韓股市在開市初段變動不大，首爾綜合指數較早時報3196點，升不足1點。
長和擬邀內地投資者加入購港口財團　預留充分時間討論新安排,2025-07-28 08:22,,2025-07-28 08:45,cfinance,rthk,https://news.rthk.hk/rthk/ch/component/k2/1815382-20250728.htm,"長和表示，有關涉及和記港口集團之交易，集團與一財團之間的獨家磋商期已屆滿，但集團仍在與財團成員進行討論，打算邀請來自內地的主要策略投資者，加入成為財團重要成員。

公告指，為使交易能夠獲得所有相關監管機構和部門批准，財團的成員以及交易架構將需要進行變更，集團打算預留充分的時間進行相關討論，以達成新安排。

公告又指，集團已多次聲明，在未獲得所有相關監管機構和部門批准前，公司將不會進行任何交易。"
日股初段下跌,2025-07-28 08:21,,2025-07-28 08:45,cfinance,rthk,https://news.rthk.hk/rthk/ch/component/k2/1815383-20250728.htm,日本股市在開市初段下跌，日經平均指數較早時報41214點，跌241點，跌幅0.58%。
金與正重申北韓不會同南韓面對面坐下協商,2025-07-28 08:01,,2025-07-28 08:15,cinternational,rthk,https://news.rthk.hk/rthk/ch/component/k2/1815381-20250728.htm,"北韓勞動黨中央委員會副部長金與正發表談話，重申今後不會同南韓面對面坐下協商的立場，指出平壤對首爾方面採取的政策、提出何種提議均不感興趣。

金與正在朝中社發表題為「朝韓關係完全脫離同族概念的時區」談話。她指出，無論李在明政府採取何種姿態，雙方敵對立場不會發生變化，無法挽回已從本質上惡化的兩韓關係。

金與正強調，雖然李在明在執政的50多天，多次說出緩和朝鮮半島緊張、改善兩韓關係等悅耳之言，但其盲目信從韓美同盟、針對朝方搞對抗的風格，與歷任領導人如出一轍。"
中大測試出11種「蟹敏感」致敏原　為過敏者提供更精準診治方案,2025-07-28 07:33,,2025-07-28 10:30,local,rthk,https://news.rthk.hk/rthk/ch/component/k2/1815378-20250728.htm,"中大醫學院針對市面上6種最常食用的蟹進行分析，測試出11種與蟹過敏相關的致敏原，並發現皇帝蟹獨有的致敏原。研究團隊認為今次發現，可以為海鮮過敏患者提供更全面、更精準的個人化診治方案，以免患者不必要地戒口。

中大團隊從6種常見蟹，包括花蟹、藍花蟹、青蟹、松葉蟹、大閘蟹及皇帝蟹的蟹鉗中抽取蟹肉，萃取肌肉蛋白以配合64名蟹過敏患者的血清樣本進行致敏原分析，成功測試出11種蟹致敏原，及其不同的抗原表位同源性和致敏性，其中8種致敏原更是首次發現。研究團隊說，每個蟹過敏患者的血清樣本對不同致敏原所呈現的致敏反應不一，反映蟹過敏存在特異性。

研究團隊表示，皇帝蟹在生物分類中不屬於螃蟹，獨立鑑定特異性過敏原後，鎖定蘋果酸脫氫酶為其獨有的致敏原，並於世界衞生組織和國際免疫學聯盟致敏原命名資料庫中註冊為 「Para c 11」。

全球約有2%人口患有甲殼類及貝殼類海鮮過敏，亦是本港青少年和成人出現過敏性休克的主要食物過敏成因。蟹是繼蝦之後第二普遍的致敏原，過敏反應包括蕁麻疹、血管性水腫、喘鳴，嚴重可導致過敏性休克。"
中大測試出11種與蟹過敏相關致敏原　助過敏者作個人化診治方案,2025-07-28 07:33,,2025-07-28 08:00,local,rthk,https://news.rthk.hk/rthk/ch/component/k2/1815378-20250728.htm,"中大醫學院針對市面上6種最常食用的蟹進行分析，測試出11種與蟹過敏相關的致敏原，並發現皇帝蟹獨有的致敏原。研究團隊認為今次發現，可以為海鮮過敏患者提供更全面、更精準的個人化診治方案，以免患者不必要地戒口。

中大團隊從6種常見蟹，包括花蟹、藍花蟹、青蟹、松葉蟹、大閘蟹及皇帝蟹的蟹鉗中抽取蟹肉，萃取肌肉蛋白以配合 64名蟹過敏患者的血清樣本進行致敏原分析，成功測試出11種蟹致敏原，及其不同的抗原表位同源性和致敏性，其中8種致敏原更是首次發現。研究團隊說，每個蟹過敏患者的血清樣本對不同致敏原所呈現的致敏反應不一，反映蟹過敏存在特異性。

研究團隊表示，皇帝蟹在生物分類中不屬於螃蟹，獨立鑑定特異性過敏原後，鎖定蘋果酸脫氫酶為其獨有的致敏原，並於世界衞生組織和國際免疫學聯盟致敏原命名資料庫中註冊為 「Para c 11」。

全球約有2%人口患有甲殼類及貝殼類海鮮過敏，亦是本港青少年和成人出現過敏性休克的主要食物過敏成因。蟹是繼蝦之後第二普遍的致敏原，過敏反應包括蕁麻疹、血管性水腫、喘鳴，嚴重可導致過敏性休克。"
環法單車賽普加卡四奪總冠軍,2025-07-28 07:18,,2025-07-28 07:30,csport,rthk,https://news.rthk.hk/rthk/ch/component/k2/1815375-20250728.htm,"環法單車賽在雨中落幕，斯洛文尼亞的普加卡奪得總冠軍，是他第四度奪標。

最後一個賽段星期日在首都巴黎舉行，帶著超過4分鐘優勢的普加卡，在最後一個爬坡路段，被比利時車手雲艾特超越，最後只得第四。雲艾特就奪得香榭麗舍大道的冠軍。

普加卡在今屆比賽已獲得四個賽段冠軍，最終以4分24秒的優勢，繼2020、2021和2024年第四度奪得總冠軍。

今屆環法單車賽共有21個賽段，歷時23天，總路程3400公里。

普加卡賽後說，對奪標的感受無法形容，但對能夠穿上黃色戰衣感到無比驕傲。他指今屆賽事可能是最艱難的一屆，上星期開始感到疲倦，暫時未有下一步計劃，目前只想好好享受在巴黎的時刻。"
地產代理：周末二手樓市成交增加　一手暢旺帶動樓市氣氛,2025-07-28 06:37,,2025-07-28 06:45,cfinance,rthk,https://news.rthk.hk/rthk/ch/component/k2/1815373-20250728.htm,"地產代理表示，剛過去的周六、日，10大二手指標屋苑成交量重上雙位數水平。

中原地產和美聯物業上周末均錄得10宗成交，按星期增加3宗。中原表示，一手市場造好帶動整體樓市氣氛，港島區新盤周五首張價單推售接近沽清，部分向隅客隨即轉投鄰近二手市場，進一步刺激交投。

美聯表示，周末二手交投雖然上升，但仍未重返高位，因暑假多人外遊，加上近期樓價回穩，更令個別業主叫價轉趨強硬，拖慢部份成交節奏。但相信隨著新學年臨近及專才來港，預計暑假期間租金及租務宗數將維持升勢，或形成租買齊升局面。"
Man dies in accident at QMH redevelopment project,2025-07-28 05:43,,2025-07-28 06:00,elocal,rthk,https://news.rthk.hk/rthk/en/component/k2/1815370-20250728.htm,"The Hospital Authority says a man has died in an industrial accident at a redevelopment project at Queen Mary Hospital. 

In a statement, the authority said a worker employed by a lift engineering subcontractor became trapped on Sunday in one of the lift shafts. It said site management immediately called the Fire Services Department to rescue him. 

The man, 58, was sent to Queen Mary Hospital's accident and emergency department, where he was certified dead.

The Architectural Services Department has suspended the relevant works at the site and has instructed the main contractor to conduct a thorough investigation into the cause of the incident. The Labour Department has also launched an investigation."
美股本周焦點在於關稅談判　聯儲局議息、就業數據及科技股業績,2025-07-28 05:43,,2025-07-28 06:00,cfinance,rthk,https://news.rthk.hk/rthk/ch/component/k2/1815371-20250728.htm,"美股上星期納斯達克及標準普爾500指數屢創新高，連同道瓊斯指數均累計上升逾1%。本周關注多項重要事件，包括美國與各國的關稅談判進展、聯儲局議息、最新就業及通脹數據，以及大型科技股業績。

美國與歐盟宣布達成貿易協議，美國將會向歐盟大部分輸美產品徵收15%關稅，歐盟亦會大幅增加對美投資，並採購美國能源產品及軍事裝備。市場亦關注中美今日起在瑞典斯德哥爾摩舉行新一輪經貿會談，由中共中央政治局委員、國務院副總理何立峰，以及美國財長貝森特共同主持。

此外，聯儲局將於本港時間周四凌晨公布議息結果，其後主席鮑威爾將會見傳媒。市場普遍估計將維持利率不變，以確認關稅會否令通脹升溫。日本央行亦將同日宣布議息結果，市場估計將按兵不動。

數據方面，美國將於周五公布7月非農就業新增職位數據，市場估計增長11萬個，少過6月的14.7萬個；失業率估計上升0.1個百分點至4.2%。周四將公布6月核心個人消費支出（PCE）物價指數，市場估計按月升幅略為擴闊至0.3%；按年升幅則維持於2.7%。

業績方面，大型科技股及道指成份股屬焦點，微軟、Meta、蘋果和亞馬遜將於周三及周四收市後公布季績。另外，Visa、波音、聯合健康、默沙東、雪佛龍等企業都將於本周公布成績表。"
俄羅斯重開莫斯科至平壤的飛機直航航線,2025-07-28 04:44,,2025-07-28 05:15,cinternational,rthk,https://news.rthk.hk/rthk/ch/component/k2/1815369-20250728.htm,"俄羅斯重開首都莫斯科至北韓首都平壤的飛機直航航線。

從莫斯科飛往平壤的航班，莫斯科時間星期日晚上7時許，從謝列梅捷沃機場起飛。俄羅斯聯邦航空運輸署說，航班由俄羅斯北風航空公司營運，預計飛行時間約8小時。至於從平壤返回莫斯科的航班，預計星期二起飛。

登上復航後首班航班的俄羅斯自然資源和環境部長科茲洛夫表示，未來將根據客流量分析結果，確定莫斯科至平壤的航班數量，未來亦可能開通俄羅斯至北韓元山的直航。"
美歐達成貿易協議　馮德萊恩稱15%稅率是歐方能達成的最佳結果,2025-07-28 04:38,,2025-07-28 05:15,cinternational,rthk,https://news.rthk.hk/rthk/ch/component/k2/1815368-20250728.htm,"美國總統特朗普與歐盟委員會主席馮德萊恩在蘇格蘭會晤後，共同宣布美歐達成貿易協議，美國將會歐盟大部分輸美產品徵收15%關稅，歐盟亦會大幅增加對美投資，並採購美國能源及軍事裝備。

特朗普形容是有史以來最大的協議，協議對所有人都有好處，有利於汽車和農業。馮德萊恩就說，包括汽車在內的各類商品將適用於有關稅率，協議為市場帶來穩定性。

路透社報道，與歐盟最初提出的零關稅目標相比，15%的稅率仍然有落差，但較美國早前威脅徵收30%好。馮德萊恩承認，在當前形勢下，15%的關稅水平是歐盟委員會能夠達成的最佳結果。"
