title,date,summary,scrape_time,section,source,url,news_content
"Race for 16,000 columbarium niches begins on Monday",2025-05-14 18:16,,2025-05-14 18:30,elocal,rthk,https://news.rthk.hk/rthk/en/component/k2/1804613-20250514.htm,"Officials said applications for more than 16,000 new niches will open on Monday, including spaces at the newly-constructed Shek Mun Columbarium in Sha Tin, which is set to begin operations this year.

The Food and Environmental Hygiene Department will offer a total of 16,150 extendable niches: 4,000 standard and 50 large ones at Wo Hop Shek Columbarium Phase VI; 6,000 standard and 50 large ones at Cape Collinson-San Ha Columbarium; and 6,000 standard and 50 large ones at Shek Mun Columbarium.

The initial interment period for the allocated public niches is 20 years, with an option to extend for an additional 10 years after that. 

At the end of the period, users can keep their niche by extending the interment period and paying the required fee.

Jacqueline Ho, the department's assistance director of grade management and development, said that while the Wo Hop Shek and Cape Collinson-San Ha facilities have designated areas for burning joss sticks and offerings, the Shek Mun complex will be completely smoke-free.

""If [people] want to conduct the burning of offerings or of joss sticks [at Shek Mun Columbarium], we will ask them to leave,"" she said. 

""We've already made a note on the application form and highlighted that the burning of offerings and the incense are prohibited,"" she said.

""In the application form, we have three venues, so you have to make the right choice to choose what you want.""

Ho added that the department consulted residents nearby as well as the Sha Tin district council before deciding to make the new columbarium smoke-free, given its proximity to residential areas.

In terms of pricing, the department said standard niches will cost HK$2,400, while large niches are HK$3,000, with renewals every 10 years costing HK$1,200 and HK$1,500 respectively. 

It added that applications will close on June 18 and ballot draws will be held in the third quarter."
Tencent posts 13pc rise in revenue for first quarter,2025-05-14 17:50,,2025-05-14 18:00,efinance,rthk,https://news.rthk.hk/rthk/en/component/k2/1804610-20250514.htm,"Chinese tech giant Tencent on Wednesday reported a 13 percent rise in its revenue in the first quarter, fuelled by accelerated growth in its key gaming business. 

Revenue topped 180 billion yuan, beating analysts' forecasts of 174 billion yuan. 

Net profit rose 14 percent year on year to 47.8 billion yuan, falling short of analyst expectations of 52.2 billion yuan.

As one of the world's largest gaming companies, the group saw revenues from its hit titles driving overall performance, benefiting from the regulatory easing in the country's gaming industry following the stringent restrictions of previous years.

Domestic gaming revenues rose 24 percent year on year to 42.9 billion yuan – thanks to the performance of ""Honor of Kings"" and ""Peacekepper Elite"", as well as that of newer titles such as ""DnF Mobile"".

Revenue from its global gaming business, meanwhile, totalled 16.6 billion yuan, representing a 23 percent annual increase.

The group, operator of China's largest messaging app WeChat with over 1.4 billion monthly active users, also saw revenue from marketing services jump 20 percent year on year to 31.9 billion yuan, thanks to the ""robust demand"" from advertisers on WeChat's Mini Program product.

Un a statement, the Shenzhen-headquartered company noted that capital expenditures for the first quarter amounted to 27.5 billion yuan, up 91 percent, as it continues to invest in artificial technology and develops products such as an AI chatbot called Yuanbao.

“AI capabilities already contributed tangibly to our businesses, such as performance advertising and evergreen games,” Tencent said in its earnings release. 

""We also stepped up our spending on new AI opportunities, such as the Yuanbao application and AI in Weixin.

“We believe operating leverage from our existing high-quality revenue streams will help absorb the additional costs associated with these AI-related investments and contribute to healthy financial performance during this investment phase,"" it said.

The company said it expects strategic AI investment will generate considerable returns in the long term."
特首中東行｜李家超：香港與科威特就24項成果達共識將簽備忘錄,2025-05-14 17:46,,2025-05-14 18:00,local,rthk,https://news.rthk.hk/rthk/ch/component/k2/1804612-20250514.htm,"正在科威特訪問的行政長官李家超宣布，香港與科威特已就24項具體成果達成共識，將簽署諒解備忘錄及相關協議落實，協議涵蓋貿易經濟、投資推廣、金融服務、航空與海事產業、高等教育、法律專業、體育等。

李家超出席在當地舉行的高層商務午餐會並致辭，他表示，兩地海關部門會就雙邊經貿互認展開談判，漁護署與科威特相關機構，亦會合作加強漁業與海洋保育等領域的協作與交流，機管局將與科威特航空簽署新諒解備忘錄，加強兩地航空聯繫，並推動航空業人才培養；一系列協議將為兩地長遠合作奠下堅實基礎。

李家超又提到，特區政府正考慮在海灣阿拉伯國家合作委員會（GCC）地區開設第二所香港經濟貿易辦事處，相信特區與GCC持續增長的貿易與投資合作，將有助推動兩地未來達成自由貿易協定。

李家超強調，香港與中東的關係正不斷深化和多元化，相信香港可以為科威特帶來豐厚機遇，自由貿易是香港引為為傲的競爭優勢，亦是過去兩個世紀成功的基石，即使當前保護主義和地緣政治緊張局勢加劇，香港與國家一樣，仍會堅定支持多邊、以規則為基礎的全球經濟。

他指出，香港的經濟與普通法制度及獨立行使司法權的法院密不可分，相關法律體制與全球多個領先金融中心相似，為包括科威特在內的國際企業和投資者提供充分信心，讓他們放心在香港及內地開展業務。"
Med students to take lead in getting people going,2025-05-14 17:31,,2025-05-14 17:45,elocal,rthk,https://news.rthk.hk/rthk/en/component/k2/1804601-20250514.htm,"The University of Hong Kong faculty of medicine said on Wednesday it is going to send students out into the community to help get people exercising as apart of its newly launched sports health initiative. 

The move is in response to the World Health Organization’s Global Action Plan on physical activity and Chief Executive John Lee’s proposals to promote sports medicine and science in his Policy Address in October. 

Under the plan, students would be required to participate in the promotion of health education at the primary healthcare level, on top of existing courses.

Clinical assistant professor Amy Ng says the move will remind students and the public alike of the importance of exercise. 

""We do plan for students to actually need to go out into the community and serve society with respect to exercise,"" she said. 

""One of the things we are planning is to have students lead an exercise programme at district health centres. 

""We want them to actually participate and have some contributions."" 

The faculty said students could also attend orthopaedic and traumatology practicums at the university’s Shenzhen Hospital. 

Apart from strengthening the sports science component in its medicine programme, the faculty said the initiative also includes research projects that aims to enhance health levels among locals. 

One of them focuses on incorporating physical activity into kindergarten curricula to improve cardiopulmonary function in wake of a finding that around 90 percent of students in Hong Kong had not attained physical activity level standards set by the World Health Organization."
受疫情與承建商表現影響　聯合醫院日間醫療大樓今年底分階段完成,2025-05-14 17:30,,2025-05-14 17:45,local,rthk,https://news.rthk.hk/rthk/ch/component/k2/1804609-20250514.htm,"醫務衞生局局長盧寵茂說，聯合醫院的擴建工程原本計劃去年完成，但由於工期延誤，日間醫療大樓預計將於今年底起分階段完成，並最早於明年中分階段投入運作。

盧寵茂在立法會回覆議員質詢時說，由於工程是在聯合醫院現有運作期間進行，並且需要將新建大樓與現有院舍接駁，因此需因應各種施工限制對工程作出調整，影響整體進度，又指其他原因包括新冠疫情、工程環境限制、顧問及承建商表現不理想有關。

有議員關注，工程延誤是否涉及承建商的財政問題。 盧寵茂回應，2022年起醫管局總共發出139封書面提醒和警告，並向承建商及分包商發出9份不良表現報告，以及相關工程顧問分別發出5份不良表現報告。顧問公司亦多次向承建商發出多封警告信，但他說暫時看不到可能涉及財政問題。

盧寵茂又說，當局汲取經驗後，日後發展計劃會盡量爭取在醫院鄰近的空置用地進行，減少對原有醫院運作的影響。"
內地4月新增人民幣貸款2800億元　大幅少過預期　9個月最低,2025-05-14 17:30,,2025-05-14 17:45,greater_china,rthk,https://news.rthk.hk/rthk/ch/component/k2/1804607-20250514.htm,"人民銀行公布，今年首4個月新增人民幣貸款10.06萬億元，外電測算，4月新增人民幣貸款2800億元，大幅少過市場預期中間值的7000億元，並創去年7月以來最低。根據外電統計，3月新增貸款3.64萬億元。

截至4月底，廣義貨幣供應量（M2）按年增長8%，高於市場預期的7.3%。月底人民幣貸款餘額按年增長7.2%，低於預期。

人行數字又顯示，截至4月底，社會融資規模增量1.16萬億元，低於預期的逾1.2萬億元。首4個月社會融資規模增量累計16.34萬億元，按年多3.61萬億元。"
新一輪16150個新建可續期公眾骨灰龕位下周一起接受申請,2025-05-14 17:24,,2025-05-14 18:45,local,rthk,https://news.rthk.hk/rthk/ch/component/k2/1804608-20250514.htm,"食環署新一輪公眾骨灰龕位將於本月19日至下月18日接受申請，提供16150個新建可續期龕位，其中哥連臣角新廈有6050個，粉嶺和合石有4050個，當中禁香和非禁香各佔約一半；另外，預計今年第三季啟用的石門靈灰安置所採用環保理念，有6050個龕位，各樓層和公共地方全面禁止燃燒香燭祭品，安置所內也不設任何供燃燒祭品的設施。

署方說，獲編配的龕位最初安放期為20年，標準和大型龕位收費分別為2400元及3000元，之後每10年續期一次，分別1200及1500元。申請人可以在網上提交申請，隨即會收到載有編號的確認電郵，申請人可隨時在署方網頁查詢申請狀況；署方批核申請後，會發出抽籤紙號碼，並於今年第三季公開攪珠和隨機抽籤，即日公布和通知結果，中籤人可使用署方網頁查看龕位的位置，又強調所有龕位不設自行揀選。

署方提到，如果網上申請人同時為已故人士申請火化服務，毋須夾附所需文件副本，確認資格後即日自動批核，中籤後可於網上繳費和完成編配手續；其他中籤者則須在指定日期前往公眾骨灰龕位編配辦事處辦理手續和繳費。

署方又指，考慮到區議會和當區居民意見，石門靈灰安置所全面禁香，將加強保安巡邏，未來也會研究使用科技加強監管。"
新一輪16150個可續期公眾骨灰龕位下周一起接受申請,2025-05-14 17:24,,2025-05-14 17:45,local,rthk,https://news.rthk.hk/rthk/ch/component/k2/1804608-20250514.htm,"食環署新一輪公眾骨灰龕位將於本月19日至下月18日接受申請，提供16150個可續期龕位，其中哥連臣角新廈有6050個，粉嶺和合石有4050個，當中禁香和非禁香各佔約一半；另外，預計今年第三季啟用的石門靈灰安置所採用環保理念，有6050個龕位，各樓層和公共地方全面禁止燃燒香燭祭品，安置所內也不設任何供燃燒祭品的設施。

署方說，獲編配的龕位最初安放期為20年，標準和大型龕位收費分別為2400元及3000元，之後每10年續期一次，分別1200及1500元。申請人可以在網上提交申請，隨即會收到載有編號的確認電郵，申請人可隨時在署方網頁查詢申請狀況；署方批核申請後，會發出抽籤紙號碼，並於今年第三季公開攪珠和隨機抽籤，即日公布和通知結果，中籤人可使用署方網頁查看龕位的位置，又強調所有龕位不設自行揀選。

署方提到，如果網上申請人同時為已故人士申請火化服務，毋須夾附所需文件副本，確認資格後即日自動批核，中籤後可於網上繳費和完成編配手續；其他中籤者則須在指定日期前往公眾骨灰龕位編配辦事處辦理手續和繳費。

署方又指，考慮到區議會和當區居民意見，石門靈灰安置所全面禁香，將加強保安巡邏，未來也會研究使用科技加強監管。"
在岸人民幣下跌　料保持區間波動,2025-05-14 17:15,,2025-05-14 17:30,cfinance,rthk,https://news.rthk.hk/rthk/ch/component/k2/1804605-20250514.htm,"在岸人民幣收報7.2083兌1美元，較上日收市價跌71點子。中間價再升至近1個半月新高，較外電預測偏離約143點子，是去年11月初以來首次，反映監管意圖維穩人民幣匯率。

市場人士表示，中美達成貿易協議，但貿易前景仍不確定，美元買盤偏多，結匯盤保持觀望，市場繼續關注談判後續進展，而貿易戰降溫後，市場料增量宏觀政策暫緩推出，中間價保持穩定，預計人民幣將保持區間波動。"
施永青料今年本港樓市見底機會增加,2025-05-14 17:14,,2025-05-14 17:30,local,rthk,https://news.rthk.hk/rthk/ch/component/k2/1804606-20250514.htm,"供樓相關的1個月銀行同業拆息跌至約1.33厘，連跌7日，累計跌2.65厘，令H按息率降至約2.63厘。中原集團主席施永青表示，若果按息繼續下行，加上市場租盤持續短缺，會見到更多市民轉租為買；另一方面，銀行存款利率下跌，投資者或轉為買樓收租。隨著美國未來兩個月減息步伐更清晰，今年樓價找到支持位後或會逆轉。 

施永青指，發展商仍有貨尾單位待售，但整體空置率不足5%，樓價亦已較歷史高位下跌近30%，加上經濟仍維持增長、失業率低企及人均收入上升，市民供樓負擔能力持續改善，相信今年樓市見底機會增加。 

他又認為，美國政策或持續影響全球，降低投資美國的吸引力，若美元持續回落，香港地產市場吸引力將上升，又指出中美關係影響中國留學生到美國留學，同時香港政府增加留學生學額，將帶動本港租賃需求及租金回報。

中原集團公布成立新學生公寓品牌，將酒店改建而成的項目位於尖沙咀，預計8月可供首批學生入住，提供121個床位，目標未來2至3年提供約3000個牀位。

中原表示，目前本港有約8萬名留學生，預計5年後逾14萬人，大學宿舍供應不足，未來5年學生公寓市場規模或達750億至近1000億元。"
中國駐英使館接獲多宗中國公民失聯求助　籲加強安全防範,2025-05-14 17:06,,2025-05-14 17:15,greater_china,rthk,https://news.rthk.hk/rthk/ch/component/k2/1804602-20250514.htm,"中國駐英國使館近期接獲多宗中國公民失蹤失聯相關求助，提醒在英中國公民及親屬，加強安全防範。

使館建議定期與家人保持聯繫，如果去旅行或出差等，尤其前往通訊信號較差等地區，應事先告知家人或身邊親友，並約定溝通聯繫的暗號，及時以暗號向家人通報情況或求救。

使館又建議，如果判斷在英親屬因遇險失聯，應第一時間向英國警方報案，有需要亦可聯絡中國駐英國使領館求助。"
HK stocks end the day on strong note amid tech hopes,2025-05-14 16:59,,2025-05-14 17:15,efinance,rthk,https://news.rthk.hk/rthk/en/component/k2/1804604-20250514.htm,"Stocks fluctuated on Wednesday, with investors struggling to track a strong day on Wall Street as euphoria over the China-US trade detente petered out.

In Hong Kong, the benchmark Hang Seng Index ended the day up 532.38 points, or 2.3 percent, higher at 23,640.65, thanks to healthy buying of Chinese tech firms ahead of earnings releases from market heavyweights Alibaba and Tencent.

Investors are hoping the reports will provide an idea about how the sector's two biggest firms are coping with the trade upheaval and uncertainty in the world's number two economy. 

Tencent jumped 3 percent, while Alibaba and rival ecommerce giant JD.com put on even more.

The Hang Seng China Enterprises Index rose 2.47 percent to end at 8,593.07, and the Hang Seng Tech Index rose 2.13 percent to end at 5,381.78.

Across the border, the benchmark Shanghai Composite Index closed up 0.86 percent at 3,403.95.

The Shenzhen Component Index closed 0.64 percent higher at 10,354.22.

The ChiNext Index, tracking China's Nasdaq-style board of growth enterprises, gained 1.01 percent to close at 2,083.14.

But while the days of breathtaking volatility seen through April appear to be over for now, analysts warned that more work was needed for Washington to reach tariff deals with countries and instill a sense of stability.

Data showing US inflation unexpectedly slowed last month provided some cheer, though observers pointed out that the real impact of Donald Trump's ""Liberation Day"" tolls will not likely be felt until May's readings.

There were also gains in Sydney, Seoul, Taipei, Mumbai and Jakarta but Singapore, Wellington, Manila and Bangkok fell. Tokyo ended down.

London, Paris and Frankfurt fell in morning trade.

Analysts said that while the China deal was welcome, investors were now bracing for the next developments in the US president's trade standoff with the world as countries look to strike deals with the White House to avert stiff tariffs.

""Remember it's an armistice not a peace treaty – and the tariffs are still at these levels worse than we had before,"" Neil Wilson at Saxo Markets said.

""Let's be honest, the market knows this script by heart: Trump escalates. Markets tumble. Back-channels open. China blinks. A deal gets made. Risk rallies,"" added Stephen Innes at SPI Asset Management.

""The fog has lifted – for now. Whether this cycle brings more sustainable upside or just sets up the next tantrum remains to be seen,"" he said. (AFP/Xinhua)"
立法會三讀通過中醫醫院條例草案　盧寵茂稱肩負五大發展任務,2025-05-14 16:55,,2025-05-14 17:15,local,rthk,https://news.rthk.hk/rthk/ch/component/k2/1804603-20250514.htm,"立法會三讀通過《香港中醫醫院條例草案》。

醫務衞生局局長盧寵茂在二讀辯論發言時說，香港中醫醫院將於今年年底分階段開展服務，標誌香港中醫藥發展重要的里程碑。香港中醫醫院將肩負五大發展任務，包括提供政府資助及市場導向的醫療服務、教學培訓、科研創新、多方協作及創造健康價值。香港中醫醫院亦會擔當「轉化者」的角色，與中醫藥業界及持份者合作，推動中醫藥在本港、粵港澳大灣區，以至國際間的整體發展。

盧寵茂說，香港中醫醫院是一所全新的機構，沒有營運歷史背景，公眾需要時間了解其角色和服務，其名稱被濫用或挪用的風險相對較高。《條例草案》訂明位於新界將軍澳百勝角路1號的醫院中文名稱為「香港中醫醫院」、英文名稱為The Chinese Medicine Hospital of Hong Kong，並會載有條文保障有關中英文名稱由該院專用。任何未經授權而使用該名稱或與之產生聯繫，一經定罪，可處第3級罰款，即港幣1萬元。

另外，政府已為香港中醫醫院制定相應的監控機制，包括營運許可的申請程序及營運規定。政府在服務契約中亦訂明全面的要求，涵蓋醫院系統及架構、管治、質素及風險管理，以確保香港中醫醫院病人的安全。"
特朗普晤敘利亞過渡總統　稱探索與敘利亞新政府恢復正常關係,2025-05-14 16:52,,2025-05-14 17:15,cinternational,rthk,https://news.rthk.hk/rthk/ch/component/k2/1804600-20250514.htm,"美國總統特朗普在沙特阿拉伯與敘利亞過渡總統沙拉會面，是兩國領導人自2000年以來首次外交會晤。

特朗普於當地星期三早上在沙特首都利雅得出席美國海灣合作委員會峰會前，先在當地一間酒店與沙拉見面，兩人握手，沙特王儲兼首相穆罕默德亦有在場，土耳其總統埃爾多安透過視像方式與會。

特朗普表示，正探索與敘利亞新政府恢復正常關係，解除對敘利亞的制裁為當地提供一個新開始。白宮發言人表示，特朗普促請沙拉簽署亞伯拉罕協議，即是美國希望促成以色列與其他海灣國家達成關係正常化的協議、驅逐巴勒斯坦恐怖份子，以及幫助美國防止極端組織伊斯蘭國死灰復燃。沙拉則說，邀請美國公司投資敘利亞石油和天然氣。

沙拉去年12月領導反對派武裝推翻前總統敘利亞巴沙爾政權。沙拉基於過往與阿蓋達組織的聯繫，曾被華盛頓列為恐怖份子，他在2016年與阿蓋達斷絕關係。外界觀望特朗普與沙拉這次會面，從而判斷華盛頓對重啟與大馬士革關係的認真程度。"
騰訊上季經調整後盈利按年升22%,2025-05-14 16:49,,2025-05-14 17:15,cfinance,rthk,https://news.rthk.hk/rthk/ch/component/k2/1804599-20250514.htm,"騰訊控股首季盈利478.2億元人民幣，按年升14%，按季跌7%。經調整後盈利613.3億元，按年升22%，按季升11%。

上季收入1800億元，按年升13%，按季升4%。增值服務收入按年升17%，至921億元，當中本土市場遊戲收入429億元，增長24%，國際市場遊戲收入166億元，增長23%，兩者按季分別增29%及4%。社交網絡收入326億元，按年增長7%，按季上升10%。

上季營銷服務收入按年增長20%，至319億元，因為廣告客戶對視頻號、小程序及微信搜一搜廣告庫存的強勁需求；金融科技及企業服務收入按年增長5%，至549億元。

首季毛利率升3個百分點至56%。

騰訊表示，AI（人工智能）能力已經對效果廣告與長青遊戲等業務產生實質貢獻，已加大對元寶應用與微信內的AI等投入，相信在AI戰略投入階段，現有高質量收入帶來的經營槓桿，有助消化額外成本，保持財務穩健。

集團預期，戰略性AI投入，將為用戶與社會創造價值，並產生長期、可觀的增量回報。"
騰訊控股上季經調整後盈利按年升22%,2025-05-14 16:49,,2025-05-14 17:00,cfinance,rthk,https://news.rthk.hk/rthk/ch/component/k2/1804599-20250514.htm,"騰訊控股首季盈利478.2億元人民幣，按年升14%，按季跌7%。經調整後盈利613.3億元，按年升22%，按季升11%。

上季收入1800億元，按年升13%，按季升4%。增值服務收入按年升17%，至921億元，當中本土市場遊戲收入429億元，增長24%，國際市場遊戲收入166億元，增長23%，兩者按季分別增29%及4%。社交網絡收入326億元，按年增長7%，按季上升10%。

上季營銷服務收入按年增長20%，至319億元，因為廣告客戶對視頻號、小程序及微信搜一搜廣告庫存的強勁需求；金融科技及企業服務收入按年增長5%，至549億元。

首季毛利率升3個百分點至56%。"
立法會通過修例引入公司遷冊機制　許正宇稱有助積極招商引資,2025-05-14 16:39,,2025-05-14 16:45,local,rthk,https://news.rthk.hk/rthk/ch/component/k2/1804598-20250514.htm,"立法會三讀通過公司修訂條例草案，以在香港引入公司遷冊機制，政府表示歡迎。

財經事務及庫務局局長許正宇表示，修例為公司遷冊設立簡單便捷的機制，既滿足了在外地成立而主要業務在港的公司，希望遷冊來港的需求，亦有助政府積極招商引資，為本地不同專業服務帶來業務，增加投資和工作機會。

在公司遷冊機制下，非香港成立公司只要符合公司背景、誠信、成員和債權人保障及償付能力等要求，便可申請遷冊來港，並保留其法律上的法人團體身分及確保業務持續性。過程中，公司財產、權利、義務和法律責任，以至相關合約和法律程序均不受影響。如公司遷冊後就實際的同類利潤在港亦被徵稅，政府會為公司提供單邊稅收抵免，以消除雙重課稅。

政府表示，一般而言，經遷冊公司會被視為等同於在香港成立的公司，享有與本地成立的同類型公司相同的權利，並須遵從《公司條例》的規定。修訂條例將於本月23日起生效，公司遷冊機制亦會於同日起接受申請。"
