title,date,summary,scrape_time,section,source,url,news_content
習近平與普京會談　稱中俄關係是互利合作共贏的大國關係典範,2025-09-02 13:52,,2025-09-02 14:30,greater_china,rthk,https://news.rthk.hk/rthk/ch/component/k2/1820851-20250902.htm,"國家主席習近平在北京人民大會堂同來華出席上海合作組織峰會和紀念中國人民抗日戰爭暨世界反法西斯戰爭勝利80周年活動的俄羅斯總統普京舉行會談。習近平指出，中俄關係經受住了國際風雲變幻的考驗，樹立了永久睦鄰友好、全面戰略協作、互利合作共贏的大國關係典範。他強調，中方願同俄方密切高層交往，支持彼此發展振興，在涉及兩國核心利益和重大關切問題上及時協調立場，推動中俄關係取得更大發展。

習近平指出，中俄兩國元首相互出席對方國家舉辦的紀念世界反法西斯戰爭勝利慶典，充分彰顯作為第二次世界大戰主要戰勝國，和聯合國安理會常任理事國的大國擔當，展示維護二戰勝利成果、捍衛正確二戰史觀的堅定決心。他說，中俄兩國都強調主權平等、國際法治、多邊主義，要繼續在聯合國、上海合作組織、金磚國家、二十國集團等多邊平台加強協作，攜手推動構建人類命運共同體。

普京表示，在他同習近平引領下，俄中關係體現高度的戰略性，達到歷史最高水平。俄方願同中方保持戰略協作，密切高層交往，加強各領域務實合作，推動兩國關係繼續高水平發展。"
外電指快倉智能科技最快明年在港掛牌,2025-09-02 13:25,,2025-09-02 13:45,cfinance,rthk,https://news.rthk.hk/rthk/ch/component/k2/1820846-20250902.htm,"彭博引述消息人士指，快倉智能科技已秘密申請在香港進行首次公開發售(IPO)，最快明年掛牌，集資至少1億美元。

報道指，有關討論仍繼續，交易規模及時間可能有變。

快倉成立於2014年，製造自動駕駛叉車及其他倉庫機器人，有逾千家客戶，包括華為、「穆勒—馬士基(APMM)」等集團。阿里巴巴旗下菜鳥物流、沙特阿美旗下一家風投基金，均有投資。快倉去年在一輪融資籌集了超過1億美元。"
泰國今年首8個月外國遊客入境人數按年跌逾7%,2025-09-02 13:12,,2025-09-02 13:30,cinternational,rthk,https://news.rthk.hk/rthk/ch/component/k2/1820844-20250902.htm,"泰國旅遊部表示，今年1至8月外國遊客入境人數按年下跌7.16%，降至2190萬人次；中國成為最大客源市場，達310萬人次。

泰國上月將今年外國遊客預測從3700萬人次，下調至3300萬人次。疫情爆發前，泰國在2019年曾創下近4000萬人次遊客接待紀錄。"
港股下午初段跌逾百點,2025-09-02 13:12,,2025-09-02 13:30,local,rthk,https://news.rthk.hk/rthk/ch/component/k2/1820845-20250902.htm,"港股下午初段下跌，恒生指數較早時報25499點，跌118點，跌幅0.46%。

科技指數報5710點，跌88點，跌幅1.52%。"
Dozens evacuated after fire in Tuen Mun,2025-09-02 12:47,,2025-09-02 13:00,elocal,rthk,https://news.rthk.hk/rthk/en/component/k2/1820838-20250902.htm,"About 120 people were evacuated on Tuesday after a fire broke out in Tuen Mun.

Police were alerted at about 5am that there was a fire in a flat in Block 1 of Elegance Garden.

Officers found smoke and a burning smell and classified the case as arson.

A short time later, a man was found lying on the ground between blocks 1 and 2 at the residential complex.

He was certified dead at the scene and was believed to have fallen from height.

The force said the death and the fire were connected."
保監局公開譴責泰禾人壽並罰款1000萬元,2025-09-02 12:47,,2025-09-02 13:00,local,rthk,https://news.rthk.hk/rthk/ch/component/k2/1820840-20250902.htm,"保監局公開譴責泰禾人壽，並施加1000萬元罰款，由股東基金承擔，保單持有人不會受到紀律行動影響。

當局指，2019年7月至2020年4月期間，泰禾人壽未獲保監局事先同意，與Tahoe Group Global (Co.) Limited進行關聯交易。時任泰禾人壽董事黃其森、葛勇，不再被視為適當人選出任有關職位，他們亦已放棄擔任主要管理職位。

保監局為保障保單持有人利益，早前施加一連串監管措施，包括分隔資產、加強內部管控、投資限制等，並在去年7月26日委任共同及各別經理，接管泰禾人壽的事務、業務及資產。"
習近平晤蒙古總統　強調中方繼續做蒙方可信賴和倚重的伙伴,2025-09-02 12:44,,2025-09-02 13:00,greater_china,rthk,https://news.rthk.hk/rthk/ch/component/k2/1820841-20250902.htm,"國家主席習近平在北京人民大會堂，會見蒙古總統呼日勒蘇赫。

習近平強調，不論國際形勢如何變化，中方都將繼續做蒙方可以信賴和倚重的伙伴。雙方要悉心維護兩國關係的政治基礎，深化發展戰略對接，在實現各自現代化建設道路上攜手並進。中方提出全球治理倡議是為了更好應對全球性挑戰，願同蒙方共同落實倡議，破解治理赤字難題。

呼日勒蘇赫表示，蒙方繼續奉行一個中國原則，在涉台、涉藏、涉疆、涉港等問題上堅定支持中方立場。蒙方願同中方在國際舞台上相互支持，密切合作，維護發展中國家共同利益。

雙方簽署海關、計量、媒體等領域多份雙邊合作文件。"
分析：美國減息預期增強推高金價,2025-09-02 12:39,,2025-09-02 13:00,cfinance,rthk,https://news.rthk.hk/rthk/ch/component/k2/1820839-20250902.htm,"金價在亞洲時段創新高，現貨金升至每盎士3500美元以上，紐約12月期金較早時報3576美元，升幅逾1%，曾升至3578.4美元。

美國上周公布的個人消費支出（PCE）物價指數符合市場預期，增強市場減息信心。美國利率期貨顯示，市場預計聯儲局9月減息0.25厘的可能性升至90%，刺激金價在亞洲時段創新高。

僑鑫金融集團大宗商品主管張強生指出，金價上周至今已累升100美元，受具實力的大型基金和保險公司追捧，認為黃金基本已進入「大牛市」，短期可進一步升穿3600美元，未來6個月更有機會上望4000美元大關。

他說，紐約商品交易所現時黃金期貨持倉，與此前紀錄長倉仍相差約1000萬盎司，若持倉量重上紀錄水平，可刺激每盎司金價至少升多200美元，相信年底前升至3600美元的難度不大。

張強生指出，美國總統特普的政策引發訴訟等內部矛盾，政府赤字亦未見改善，加上美國與其他國家關係不穩，多地央行正加快吸納黃金作為儲備，削弱市場對美元資產的信心，相信黃金牛市行情將維持一段時間，到特朗普政策在刺激經濟方面見到實質成效，金價才會有緩和的空間。"
抗戰勝利80周年｜學者稱中方倡睦鄰友好　閱兵以和平方式展國力,2025-09-02 12:26,,2025-09-02 12:45,greater_china,rthk,https://news.rthk.hk/rthk/ch/component/k2/1820836-20250902.htm,"紀念中國人民抗戰勝利80周年的閱兵，明天早上在北京舉行，國家主席習近平將發表重要講話，並檢閱部隊。

這次閱兵展示的武器都是國產現役主戰裝備，包括多款新型武器和智能裝備。

有內地軍事專家說，閱兵可以展示中國的國力和震懾力。

有內地國際關係學者表示，中方秉持睦鄰友好原則，以閱兵、不動武的和平方式展示國力。"
習近平在北京與多位來華外賓會談包括俄羅斯總統普京,2025-09-02 12:23,,2025-09-02 13:00,cinternational,rthk,https://news.rthk.hk/rthk/ch/component/k2/1820837-20250902.htm,"國家主席習近平在北京分別與多位來華出席中國人民抗戰勝利80周年紀念活動的外賓會談，包括俄羅斯總統普京。兩人又與蒙古總統呼日勒蘇赫舉行中俄蒙三國元首會晤。

應邀出席明日中國人民抗日戰爭暨世界反法西斯戰爭勝利80周年紀念活動的北韓領袖金正恩，據報乘坐專列進入中國境內。"
港股半日跌157點　晶片及手機設備股捱沽,2025-09-02 12:13,,2025-09-02 12:30,cfinance,rthk,https://news.rthk.hk/rthk/ch/component/k2/1820835-20250902.htm,"港股臨近中午跌幅擴大，恒生指數中午收市報25460點，跌157點，跌幅0.6%，半日主板成交額縮減至1836億元。

科技指數失守5700點水平，半日報5695點，跌約1.8%。科指成份股近乎全數下跌，ATMXJ跌約0.2%至3%，美團表現較差。

晶片及手機設備股沽壓大，華虹及中芯跌近6%或以上，舜宇及ASMPT跌近4%。

醫藥股亦跌，金融股個別發展，內銀股逆市造好，工行、招行、建行升近2%至近3%。

新世界發展繼昨日急升近7%後，今早回吐逾3%，集團否認收到控股股東注資方案。

內地冷氣機製造商奧克斯電氣首日主板掛牌失守招股價，半日報16.2元，較招股價低7%。"
滬股半日跌約0.8%　創業板失守2900點,2025-09-02 11:51,,2025-09-02 12:15,cfinance,rthk,https://news.rthk.hk/rthk/ch/component/k2/1820834-20250902.htm,"內地股市微升後轉跌，算力硬件、軍工、消費電子、數字貨幣概念股受壓；黃金、銀行、旅遊、酒店股上升。

上證指數連升3日後回軟，半日報3844點，跌30點，跌幅0.79%。

深證成份指數報12545點，跌283點，跌幅2.21%

創業板指數顯著回吐，跌穿2900點，半日報2870點，跌85點，跌幅2.9%。"
習近平晤烏茲別克總統　稱要共同落實全球治理倡議,2025-09-02 11:42,,2025-09-02 12:00,greater_china,rthk,https://news.rthk.hk/rthk/ch/component/k2/1820833-20250902.htm,"國家主席習近平在北京人民大會堂，會見來華出席上海合作組織峰會和紀念中國人民抗日戰爭暨世界反法西斯戰爭勝利80周年活動的烏茲別克總統米爾濟約耶夫。

習近平強調，目前國際形勢變亂交織，做實做強上海合作組織，有利於各國維護共同利益、助力各自發展。中烏雙方要堅定維護以聯合國為核心的國際體系，踐行真正的多邊主義，共同落實全球治理倡議，捍衛二戰勝利成果，守護來之不易的和平安寧。

米爾濟約耶夫表示，烏方高度重視對華關係，感謝中方長期以來為烏經濟社會發展、民生改善給予的寶貴支持，願同中方一起相互尊重、相互支持，深化各領域合作，深入推進兩國新時代全天候全面戰略夥伴關係發展。"
港元隔夜拆息急跌至2.9厘以下　1個月拆息連跌3日,2025-09-02 11:38,,2025-09-02 12:00,local,rthk,https://news.rthk.hk/rthk/ch/component/k2/1820832-20250902.htm,"港元短期拆息顯著回落，隔夜拆息單日急跌1.76厘，回落至約2.887厘，創1星期新低，結束5個交易日升勢。

1星期、2星期拆息分別跌逾15及約11個基點，處於3.1厘以上。

樓按相關1個月拆息微跌不足1個基點，跌至3.148厘，連跌3日。

其餘期限拆息有1個基點以上升幅，3、6、12個月拆息都在3.21厘以上。"
抗戰勝利80周年｜新聞中心安排國際友人及遺屬代表介紹歷史,2025-09-02 11:27,,2025-09-02 11:45,local,rthk,https://news.rthk.hk/rthk/ch/component/k2/1820831-20250902.htm,"中國人民抗日戰爭暨世界反法西斯戰爭勝利80周年紀念活動新聞中心，安排中國抗戰勝利作出貢獻的國際友人或其遺屬代表，介紹對中國人民抗日戰爭的認識。

日本籍八路軍老戰士小林清的兒子小林陽吉表示，父親1939年在青島登陸，之後與八路軍作戰期間負傷被俘，曾逃跑想回到日本軍隊，但得知已被日方宣告死亡，失去回到日本軍隊或回家的可能，他輾轉被安排到延安學習，明白到日本發動戰爭是不正確的侵略行為，於是寫下反省文章並在報章刊登，並與中國人民一起抗日。小林陽吉認為，是他父親人生輝煌篇章，亦是他和家人引以為榮的地方。

蘇聯元帥瓦・伊・崔可夫的孫兒尼・弗・崔可夫表示，當年俄中兩國人民付出巨大犠牲。目前世上有多種潮流試抹黑歷史，強調歷史不容篡改與歪曲，要宣傳二戰的歷史真相，保衛得來不易的和平。"
Retail heads say July sales growth within expectations,2025-09-02 11:27,,2025-09-02 11:45,elocal,rthk,https://news.rthk.hk/rthk/en/component/k2/1820824-20250902.htm,"The Hong Kong Retail Management Association said on Tuesday the 1.8 percent growth in retail sales to an estimated total value of HK$29.7 billion chalked up in July fell within its expectations.

The growth marked the third consecutive month of gains after the 14-month losing streak ended in May.

Speaking on an RTHK radio show, association chairwoman Annie Yau Tse attributed the growth to an increase in the number of visitors.

""The government has been stepping up the promotion of mega events and working to restore visitor numbers,"" she said. 

""This has had a positive impact on the retail industry. Now we are starting to see tourists coming to Hong Kong, and this has helped business in some areas.

""Although the effect was not universal, some tourism-related categories, such as cosmetics, jewellery and personal care products, have benefited.""

Tse also noted that the sector is confident of sales in September.

This is because there is no long public holiday during the month, she said, and the industry will carry out promotions to boost local spending. 

Looking ahead, Tse expects the full-year retail figure, which has so far declined 2.6 percent in the first seven months compared to the same period in 2024, would remain flat, with a slight variation possible."
衞生署稱為期1年牙科實習計劃讓參與畢業生迅速適應工作環境,2025-09-02 11:22,,2025-09-02 11:45,local,rthk,https://news.rthk.hk/rthk/ch/component/k2/1820830-20250902.htm,"首批75名應屆本地牙科畢業生加入衞生署，展開為期12個月實習。衞生署牙科顧問醫生李筱雯表示，為期1年的牙科實習計劃，目的是讓畢業生有系統地於短時間內涉獵不同的牙醫執業工作範疇，讓他們日後執業時有更加紮實的經驗。

李筱雯在本台節目《千禧年代》表示，實習計劃由昨日開始，衞生署會提供為期兩星期的入職培訓，讓他們先了解本港公共牙科服務的各大範疇，協助迅速適應牙醫工作環境，訓練包括感染控制、職安健知識、病人溝通，及不同臨床工具和技巧需要等。他們之後會在衞生署、醫管局及菲臘牙科醫院輪轉工作，在資深牙醫的督導陪伴下，提供牙科服務，亦會觀察牙醫工作。

李筱雯又說，在實習期內，他們可以在真實場景工作，接觸不同年齡及種類的病人，12個月足以讓他們學習及經歷不同體驗。"
"Gold prices pull back after hitting record US$3,500",2025-09-02 11:15,,2025-09-02 11:30,efinance,rthk,https://news.rthk.hk/rthk/en/component/k2/1820828-20250902.htm,"Gold prices climbed to an all-time high on Tuesday, extending gains to a sixth session on the back of a weaker dollar and rising bets of a US interest rate cut this month.

Spot gold was up 0.5 percent at US$3,492 per ounce after hitting a record high of US$3,508. US gold futures for December delivery gained 1.4 percent to US$3,563.

""A corollary of the weaker economic backdrop and expectations of US rate cuts is boosting precious metals,"" said Kyle Rodda, Capital.com's financial market analyst.

""Another factor is the festering confidence crisis in dollar assets because of US President Donald Trump's attack on Fed independence.""

Trump has criticised the Federal Reserve and its chair, Jerome Powell, for months for not lowering rates, and recently took aim at Powell over a costly renovation of the central bank's Washington headquarters.

On Monday, Treasury Secretary Scott Bessent said the Fed is and should be independent but added that it had ""made a lot of mistakes"" and defended Trump's right to fire Fed governor Lisa Cook over allegations of mortgage fraud.

Traders are currently pricing in a 90 percent chance of a 25-basis-points Fed rate cut on September 17, according to the CME FedWatch tool.

Non-yielding gold typically performs well in a low-interest-rate environment.

Rate-cut expectations and worries over the Fed's independence have weighed on the US dollar, which is languishing near a more than one-month low against its rivals, making gold less expensive for overseas buyers.

Data on Friday showed that the US personal consumption expenditures price index rose 0.2 percent month on month, and 2.6 percent year on year, both in line with expectations.

Investors are now looking forward to the US non-farm payrolls data due on Friday to determine the size of an expected Fed rate cut this month. (Reuters)"
謝邱安儀稱零售數據穩定下來　業界對本地市場信心增加,2025-09-02 10:56,,2025-09-02 11:15,local,rthk,https://news.rthk.hk/rthk/ch/component/k2/1820829-20250902.htm,"本港7月零售業總銷貨價值的臨時估計為297億元，按年上升1.8%，較6月的0.7%升幅稍為加快，亦是連續3個月錄得升幅。香港零售管理協會主席謝邱安儀表示，不會形容是有復蘇跡象，但零售數據確實穩定下來。雖然不算是十分理想的數字，但至少比去年好，也是好事。

謝邱安儀在本台節目《千禧年代》表示，政府過去一段時間大力推動盛事及加強旅遊推廣，對零售業有正面影響，帶動某些旅遊相關類別的生意，例如化妝品、珠寶首飾及個人護理產品等。雖然增幅不算大，只是輕微好轉，但是一個正面方向。不少商場推出暑假折扣優惠及活動，對生意也有幫助。

展望方面，謝邱安儀說9月沒有長假期，業界對本地市場信心增加，會趁著港人減少外遊而多做推廣，希望可以吸引市民留港消費。她預期全年會是一個持平，又或微升或微跌的狀況。她又說，以往有「五窮六絕七翻身」的說法，但自從2019年後，市場出現新現象，7月的數據表現會較6月略低。零售業界會按照新常態，再評估市場走勢。"
屯門怡樂花園火警約120人疏散　警列縱火案調查,2025-09-02 10:44,,2025-09-02 11:00,local,rthk,https://news.rthk.hk/rthk/ch/component/k2/1820827-20250902.htm,"警方及消防繼續調查屯門凌晨發生的火警，暫列作縱火案處理。

警方清晨近5時接報，屯門怡樂花園第一座發生火警，約120名住客疏散到地面。

另外，現場有一名男子被發現倒臥在怡樂花園第一座和第二座之間，當場死亡，懷疑從高處墮下，警方正調查兩宗案件是否有關。"
日股半日升逾百點,2025-09-02 10:40,,2025-09-02 11:15,cfinance,rthk,https://news.rthk.hk/rthk/ch/component/k2/1820826-20250902.htm,日股回升，日經指數今早最多升近0.7%，半日報42292點，升104點，升幅0.25%。
習近平將與普京在北京會談,2025-09-02 10:34,,2025-09-02 11:00,greater_china,rthk,https://news.rthk.hk/rthk/ch/component/k2/1820825-20250902.htm,"國家主席習近平在北京人民大會堂，將與俄羅斯總統普京會談。

普京在天津出席完上海合作組織峰會後，抵達北京，出席明日舉行的中國人民抗日戰爭暨世界反法西斯戰爭勝利80周年紀念活動。

俄羅斯衛星通訊社報道，普京今日在北京除了與習近平會談外，還會與習近平及蒙古領導人舉行三方會晤，以及與其他國家的領導人舉行馬拉松式雙邊會晤。"
習近平與普京在北京會談,2025-09-02 10:34,,2025-09-02 11:00,cinternational,rthk,https://news.rthk.hk/rthk/ch/component/k2/1820825-20250902.htm, 
抗戰勝利80周年｜香港特區代表團往北京包括官員及立法會代表等,2025-09-02 10:23,,2025-09-02 10:45,local,rthk,https://news.rthk.hk/rthk/ch/component/k2/1820823-20250902.htm,"行政長官李家超早上率領代表團前往北京，參加明日舉行的中國人民抗日戰爭暨世界反法西斯戰爭勝利80周年紀念活動，包括上午的紀念大會和閱兵，以及文藝晚會。李家超亦會出席大會在中午舉行的招待會。

李家超與太太林麗嬋早上約8時抵達機場，全國政協副主席梁振英、財政司司長陳茂波、律政司司長林定國、政務司副司長卓永興、民政及青年事務局局長麥美娟、文化體育及旅遊局局長羅淑佩等隨行。

另外，立法會主席梁君彥、立法會議員林健鋒、張宇人、劉國勳等亦會隨團。香港特區代表團共約360人，除了政府主要官員和立法會代表，亦包括司法機構、區議會代表，參與抗戰愛國人士、老戰士及其遺屬，以及來自地區、商界等不同社會界別人士。

李家超將於星期四返港。"
習近平就越南社會主義共和國成立80周年向越方領導人致賀電,2025-09-02 09:59,,2025-09-02 10:15,greater_china,rthk,https://news.rthk.hk/rthk/ch/component/k2/1820821-20250902.htm,"中共中央總書記、國家主席習近平就越南社會主義共和國成立80周年向越共中央總書記蘇林、國家主席梁強致賀電。

習近平指出，今天的越南，政治社會穩定，經濟快速發展，人民生活持續改善，國際和地區影響力不斷增強。相信在越共中央堅強領導下，越南一定能走好符合本國國情的社會主義道路。

習近平又說，今年4月，他對越南進行國事訪問，同越南領導同志就加快構建具有戰略意義的中越命運共同體達成重要共識，共同為新時期中越關係發展擘畫藍圖。中方始終將越南作為周邊外交優先方向，願同越方一起，加強團結協作，推動中越全面戰略合作走深走實，更好造福兩國人民，為人類和平與進步事業作出更大貢獻。"
現貨金突破3500美元創新高,2025-09-02 09:56,,2025-09-02 10:15,cfinance,rthk,https://news.rthk.hk/rthk/ch/component/k2/1820819-20250902.htm,"金價在亞洲時段持續上升，現貨金突破每盎司3500美元水平，創新高，較早時報3504美元，升逾0.8%。

紐約期金12月合約升至3568美元以上，再創新高，升約1.5%。"
朝媒稱金正恩乘坐專列進入中國境內,2025-09-02 09:49,,2025-09-02 10:00,cinternational,rthk,https://news.rthk.hk/rthk/ch/component/k2/1820813-20250902.htm,"北韓傳媒報道，領袖金正恩乘坐的專列已經進入中國境內，他將應國家主席習近平邀請，出席明日在北京舉行的中國人民抗日戰爭暨世界反法西斯戰爭勝利80周年紀念活動。

朝中社報道，金正恩昨日乘坐專列，啟程前往中國，北韓外務相崔善姬等黨政領導幹部隨行。朝中社並發放圖片，見到金正恩與隨行人員坐在相信是專列內的會議室。

今次是金正恩執政以來第5次訪華，預料他抵達北京後將受到中方迎接，前往釣魚台國賓館。分析相信，金正恩在華期間，將分別與國家主席習近平及俄羅斯總統普京會面。"
抗戰勝利80周年｜專家指閱兵加強人民凝聚力　料無人機將成焦點,2025-09-02 09:48,,2025-09-02 10:00,local,rthk,https://news.rthk.hk/rthk/ch/component/k2/1820818-20250902.htm,"中國人民抗日戰爭暨世界反法西斯戰爭勝利80周年閱兵，明早在北京舉行，受閱部隊會在長安街列陣，屆時中共中央總書記、國家主席、中央軍委主席習近平，將發表重要講話並檢閱部隊。

今次閱兵會有45個方隊和梯隊，按空中護旗梯隊、徒步方隊、戰旗方隊、裝備方隊、以及空中梯隊，依次通過天安門廣場。參與閱兵的武器裝備都是國產現役主戰裝備，以新型四代裝備為主體，包括新型坦克、艦載機、殲擊機等，並會展示「無人智能」和網絡電子作戰裝備，例如新型無人機、電子干擾系統等，首次亮相的新型裝備佔比亦很大。

內地軍事專家宋忠平表示，今次閱兵將會展示過去十年國家軍事體制改革的成果，「無人機」會是其中一個焦點，相信美國亦會很關注中國新型武器技術發展到甚麼水平。

宋忠平又說，閱兵對內可以加強國家人民的凝聚力，對外就可以展示國力，做到孫子兵法所講的「不戰而屈人之兵」，有強大的國力和震懾力便能加強中國在國際社會的維和角色，亦有助維護國家自身發展利益。

今次抗戰紀念活動，將有26位外國國家元首和政府首腦出席，包括俄羅斯總統普京，北韓勞動黨總書記、國務委員長金正恩，以及多個東盟、中亞、東歐等國家領袖。

中國人民大學國際關係學院國際事務研究所所長王義桅表示，這些國家都是中國的鄰居，中方一直保持睦鄰友好原則，新中國成立後沒有主動挑起一場戰爭，中國以「閱兵不動武」的和平方式展示先進武器，沒有將武器用於戰場上殺人。

王義桅說，現時世界格局已呈現「東升西降」，今次閱兵將會展示多種新型先進武器，中國是徹底脫胎換骨，相信西方國家會對中國的整體國力重新評估，亦令其他國家不敢對中國造次。"
