title,date,summary,scrape_time,section,source,url,news_content
涉3宗地盤致命事故　協興建築被罰108.8萬元,2025-05-23 14:50,,2025-05-23 15:15,local,rthk,https://news.rthk.hk/rthk/ch/component/k2/1805956-20250523.htm,"屋宇署表示，​註冊承建商紀律委員會早前完成對承建商「協興建築」就3宗地盤致命事故的紀律研訊，裁定「協興建築」因被法庭定罪，須予以紀律處分，罰款合共108萬8千元，亦須支付紀律委員會及屋宇署合共17萬1700元的研訊費用。

3宗事故分別發生在2020年和2022年，共導致3名工人死亡。「協興建築」事發後被勞工處檢控，並先後被法庭定罪和判處罰款。屋宇署其後根據《建築物條例》，通知紀律委員會考慮向「協興建築」採取紀律行動。

屋宇署重申，根據《建築物條例》，如果註冊承建商就建築工程有關的罪行被法庭定罪，或在建築工程方面犯有疏忽或行為不當，該承建商可被紀律處分。"
日本警方將重新審視以外國駕駛執照換發日本駕照的規定,2025-05-23 14:48,,2025-05-23 15:00,cinternational,rthk,https://news.rthk.hk/rthk/ch/component/k2/1805953-20250523.htm,"日本警方因應近期發生多宗涉及外籍司機的交通意外，將會重新審視以外國駕駛執照換發日本駕照的規定。

根據現行規定，短期訪日旅客可以將下榻酒店或其他住宿設施列為住址，以便申請日本駕駛執照，雖然他們同時要接受知識及駕駛技巧測試，但申請人只需在十條問題中答對七條就可以過關，合格率約九成，部分國會議員質疑考試內容太簡單。

日本警察廳長官楠芳伸表示，根據現行轉換制度取得駕駛執照的外國人，所涉及的事故有所增加，當局將制定修改計劃，並採取必要措施。

共同社報道，當局計劃要求申請人提交日本居住證的副本，並考慮增加試題的題數。"
日股高收174點,2025-05-23 14:45,,2025-05-23 15:00,cfinance,rthk,https://news.rthk.hk/rthk/ch/component/k2/1805954-20250523.htm,"東京股市上升。

日經指數收報37160點，升174點，升幅0.47%。

全星期計，日股累跌約1.6%。"
台股收市變動不大,2025-05-23 14:43,,2025-05-23 15:00,cfinance,rthk,https://news.rthk.hk/rthk/ch/component/k2/1805952-20250523.htm,"台灣股市變動不大。

加權指數收報21652點，跌18點。

全星期計，台股累計跌0.9%。"
"Lights, camera, action as Walled City show lives on",2025-05-23 14:17,,2025-05-23 14:30,elocal,rthk,https://news.rthk.hk/rthk/en/component/k2/1805947-20250523.htm,"SAR tourism officials and film veterans on Friday hailed the launch of a new exhibition that allows people to take a deep dive into iconic 1980s life at Kowloon Walled City using replica movie sets, saying the attraction will create new economic benefits.

The launch of the three-year show – ""Kowloon Walled City: A Cinematic Journey"" – came after the government on Tuesday unveiled a total of nine tourism hotspots, including the exhibition, to woo tourists for in-depth tours.

In an opening ceremony for the exhibition, Deputy Chief Secretary Warner Cheuk said the show – which is located at Kowloon Walled City Park, the site of the original slum city – is much bigger than two earlier versions of the exhibition that were held at the airport and Kai Tak.

The exhibition features replica movie sets from last year's ""Twilight of the Warriors: Walled In"" hit film.

""The film scene exhibition not only attracts more visitors to the park but also connects to scenic spots in Kowloon City, such as the Kai Tak Sports Park, urban views and Thai-style cuisine in the district,"" Cheuk said.

""Through various tourist routes within the area, tourists can experience the authentic culture of Hong Kong and taste different delicacies.

""At the same time, this can boost consumption in the area and create economic benefits."" 

The exhibition is the third to feature the hit movie and will present more iconic sets from the film, including a barber, tailor and fish-ball shops as well as a bing sutt precursor to today's cha chan teng.

Visitors will be able to explore the exhibition using interactive technology to experience the lives of residents living in the walled city back in the 1980s.

Officials will also roll out designs using augmented technology in the district from the third quarter of this year.

Hong Kong Film Development Council chairman Wilfred Wong said the show will allow visitors to learn more about Hong Kong's history.

He added that large projection screens installed on rooftops will give people a sense of what days and nights are like living in Kowloon Walled City, with special sound effects, such as of planes reverberating over the district."
習近平：要透過推動精神文明建設高質量發展,2025-05-23 13:53,,2025-05-23 14:15,greater_china,rthk,https://news.rthk.hk/rthk/ch/component/k2/1805951-20250523.htm,"中共中央總書記、國家主席、中央軍委主席習近平強調，要透過推動精神文明建設高質量發展，為強國建設、民族復興提供強大精神力量。

習近平對精神文明建設工作作出指示，指物質文明和精神文明相協調，是中國式現代化的重要特徵。他強調，要堅持不懈用新時代中國特色社會主義思想凝心鑄魂，強化理想信念教育，廣泛踐行社會主義核心價值觀。要更注重以文化人、以文育人，不斷豐富人民精神世界，促進人的全面發展。

習近平又說，要推進城鄉精神文明建設融合發展，加強公民道德建設，發揮先進典型示範作用，進一步形成向上向善的社會風尚。要加強組織領導，深化改革創新，廣泛動員社會參與。"
長飛光纖建立起本土化製造和供應　冀有效化解貿易或關稅風險,2025-05-23 13:43,,2025-05-23 14:00,cfinance,rthk,https://news.rthk.hk/rthk/ch/component/k2/1805950-20250523.htm,"從事生產及銷售光纖相關產品的長飛光纖，執行董事兼總裁莊丹表示，公司發展屬於典型中外合資企業，從引進技術消化吸收，再到技術創新輸出，現時已實現原材料和裝備國產化，並形成非常完整產業鏈，能自研生產光纖預製棒、光纖塗層等相關的關鍵原材料。除出口光纖產品，公司亦正向東南亞等國家輸出完整「光纖入屋」解決方案。 

莊丹指出，各國在光纖通訊技術上都有自身核心技術和競爭力，不存在公司「卡別人脖子」或限制別人。公司作為對外開放的成功典範，希望在全球化下能有更多合作交流。

被問到關稅戰影響，莊丹說，集團支持所有公開市場政策，認為有利企業向不同市場提供更好產品，強調合作在對外開放中十分重要。公司現時在全球6個國家設置8個生產基地，建立起本土化製造和供應，相信能有效化解貿易或關稅風險，現時關稅戰對公司影響整體可控。

長飛光纖總部位於湖北武漢，當地擁有大量科研人才，加上簡稱「中國光谷」的東湖開發區有不少支持科技創新政策，不少客戶亦落戶光谷，形成「產、學、研、用」一體化體系。"
保監局：將刊發通函　為有意遷冊來港保險公司提供指引,2025-05-23 13:18,,2025-05-23 13:30,local,rthk,https://news.rthk.hk/rthk/ch/component/k2/1805949-20250523.htm,"公司遷冊制度今日正式生效。

保監局表示，有關制度為尋求遷冊來港的公司，提供簡單且具成本效益的框架，當局將刊發通函，為有意遷冊至香港的獲授權保險公司提供指引。

保監局指，本地具規模但於海外註冊的保險公司，一直熱切期待有關制度落實，它們選擇香港作為據點，顯示業界力求捕捉粵港澳大灣區互聯互通帶來的龐大機遇。

當局正與有興趣遷冊的保險公司保持密切溝通，協助它們在新制度下，盡快啟動遷冊進程。"
恒指下午初段升逾100點,2025-05-23 13:09,,2025-05-23 13:30,cfinance,rthk,https://news.rthk.hk/rthk/ch/component/k2/1805948-20250523.htm,"港股在下午開市初段上升，恒生指數較早時報23675點，升131點，升幅0.56%。

科技指數報5280點，升28點，升幅0.55%。"
德勤料不少公司有意遷册來港以減低合規成本及稅務負擔,2025-05-23 12:57,,2025-05-23 13:15,local,rthk,https://news.rthk.hk/rthk/ch/component/k2/1805946-20250523.htm,"政府今日起接受公司遷册申請。會計師行德勤表示，約10個客戶計劃委託分析遷册來港。

德勤民營企業與私人客戶服務香港主管合夥人劉明揚表示，隨著全球稅收環境出現重大變化，很多公司有意遷册來港，成為香港公司，以減低合規成本，減輕稅務負擔，它們遷册來港後亦可能進行合併，減少內部公司數目。公司遷册來港後可以成為稅務居民，享受本港稅務協定網絡。

他認為，公司遷册來港可帶來很多商機和機遇，例如公司要進行合規申報，會惠及本港專業服務；公司在香港有業務，可能要租用辦公室或聘請員工，有利本地經濟。"
政總有電腦起火　30人需疏散暫時未有受傷報告,2025-05-23 12:46,,2025-05-23 13:00,local,rthk,https://news.rthk.hk/rthk/ch/component/k2/1805945-20250523.htm,"政府總部發生火警，30人需要疏散，暫時未有受傷報告。

事發在中午12時許，警方接報指政總西翼大樓內有電腦起火，消防到場後發現有冒煙，懷疑是電線有問題。"
DAB urges MTR to offer free rides as compensation,2025-05-23 12:46,,2025-05-23 13:00,elocal,rthk,https://news.rthk.hk/rthk/en/component/k2/1805936-20250523.htm,"The DAB has urged MTR Corporation to offer free rides to compensate passengers hit by the long suspension of services along the entire Tseung Kwan O line that began with the evening rush hour on Thursday . 
  
The party’s lawmaker, Stanley Li, said on Friday the MTRC would likely be fined more than HK$10 million due to the incident but stressed that this does not have a strong enough deterrent effect. 
  
“We think yesterday’s service disruption was far too serious,"" he said. 

""We hope that the MTR can offer affected passengers, especially residents of Tseung Kwan O, a free return journey on weekdays as compensation.”
  
Li also said the government and the MTR should have enhance their cooperation and initiated emergency measures earlier, noting that many passengers were still stranded at Tiu Keng Leng station on Thursday night. 
  
He further called for the government to initiate a study on building a fourth cross-harbour tunnel in Area 137 – an area located near the Tseung Kwan O Industrial Estate that is currently being used as a fill bank – saying it could ease traffic jams during major railway service disruptions. 
  
The DAB also urged the MTR to review its guidelines on emergency handling and enhance staff training for better emergency response capabilities. 
  
Sai Kung district councillor Sze Pan-pan said she had observed that MTR staff were not armed with walkie-talkies on Thursday night while directing crowds to alternative means of transport, which made the distribution of real-time information highly inefficient. 
  
The party also urged the MTR to explain the cause of the major disruption during the railway subcommittee meeting in the Legislative Council on Monday and to submit a thorough investigation report within a week."
湖北料今年全省新能源汽車產量有望突破100萬輛,2025-05-23 12:40,,2025-05-23 12:45,greater_china,rthk,https://news.rthk.hk/rthk/ch/component/k2/1805944-20250523.htm,湖北省表示，當地經濟具有韌性，會以拓展多元化國際市場等方式，支持外貿發展，又會因地制宜發展新質生產力，預料今年全省新能源汽車產量，有望突破100萬輛。
衞生防護中心：本港新冠活躍程度升幅放緩惟短期內仍維持較高水平,2025-05-23 12:38,,2025-05-23 12:45,local,rthk,https://news.rthk.hk/rthk/ch/component/k2/1805943-20250523.htm,"衞生防護中心表示，有早期跡象顯示本港新冠病毒活躍程度的升幅開始放緩，但預計短期內仍會維持在較高水平。

中心總監徐樂堅表示，本港自上起，錄得的新冠個案顯著上升，距離對上一次在去年7至8月期間出現的上升，已超過半年，今次上升屬預期之內，未見異常。雖然部分監測指標顯示，上一周新冠上升的趨勢開始減弱，但預料新冠活躍程度在未來數周仍然維持在較高水平。

徐樂堅提到，根據最新的監測數據，污水監測新冠病毒含量及呼吸道樣本檢測陽性率，在過去一周的升幅有所放緩，當中呼吸道樣本對新冠病毒檢測陽性的比率，較對上一周輕微上升。污水監測方面，人均新冠病毒含量由每公升約71萬拷貝，升至77萬拷貝，但升幅較前兩周明顯下降。"
將軍澳綫服務正常有市民提早出門　有工程師促港鐵加快更新系統,2025-05-23 12:34,,2025-05-23 12:45,local,rthk,https://news.rthk.hk/rthk/ch/component/k2/1805940-20250523.htm,"港鐵將軍澳綫服務昨日傍晚起受阻約5小時，一度全線暫停。將軍澳綫早上服務正常，有市民特意提早出門。

有工程師分析，事件因電力系統故障影響信號系統，又促請港鐵加快系統更新工作。"
《九龍城寨光影之旅》電影場景展開幕　展現多個經典場景,2025-05-23 12:34,,2025-05-23 12:45,local,rthk,https://news.rthk.hk/rthk/ch/component/k2/1805941-20250523.htm,"《九龍城寨光影之旅》電影場景展開幕，重構多個電影《九龍城寨之圍城》的經典場景，展期為期3年。

政務司副司長卓永興在開幕儀式致辭表示，今次展覽的規模比之前更大，增加不少場景及手藝元素，更多姿多彩。而電影在海內外大受歡迎，相信可以吸引更多人到訪，政府未來會繼續與電影業界合作，開展更多以電影為主題的旅遊項目。

香港電影發展局主席王英偉表示，電影是香港文化寶藏，希望透過展覽，讓更多人了解香港80年代的歷史和生活細節，同時讓各界更支持香港電影。

今次展覽將重構電影中多個經典場景，包括「七記冰室 」、「龍城髮 廊」`「士多」、「跌打館」、「魚蛋工場」、窄行內街的「裁縫店」等。天台有大型投映屏幕，展示九龍城寨的日與夜 ，並配以特別聲效 ，讓參觀者感受當時居民在飛機飛過九龍城時的聲浪。"
衞生署「六月．戒煙月」活動　派發戒煙藥物協助消減退癮徵狀,2025-05-23 12:28,,2025-05-23 12:45,local,rthk,https://news.rthk.hk/rthk/ch/component/k2/1805939-20250523.htm,"衞生署推出「六月．戒煙月」活動，鼓勵吸煙人士戒煙。

衞生署控煙酒辦公室主任林民聰表示，世衞將每年5月31日訂為「世界無煙日」，當局過去幾年都有響應，加強戒煙宣傳活動。他說由本月30日起，會在250個地點，包括在有駐店藥劑師的藥房、社區健康中心及衞生署診所等，免費派發戒煙藥物，協助消減退癮徵狀，以提升戒煙成功率；吸煙人士可領取中醫耳穴貼，協助戒煙，相關機構由1個增至3個，涉及50間中醫診所、200多個服務地點。由今日開始，當局會透過電視和社交媒體等渠道，分享戒煙經驗及提示。

當局建議實施全煙害警示包裝，減低煙包的吸引力和宣傳效果。中大醫學院那打素護理學院教授李浩祥表示，學院早前做研究，收集了1253名吸煙者的意見，超過3成半受訪者表示支持實施全煙害警示包裝，17.5% 認同有助降低吸煙意欲。"
民建聯批港鐵多方面存有漏洞　將軍澳綫事故不能接受,2025-05-23 12:26,,2025-05-23 12:45,local,rthk,https://news.rthk.hk/rthk/ch/component/k2/1805938-20250523.htm,"港鐵將軍澳綫昨日傍晚起服務受阻約5小時，一度全線暫停。民建聯新界東南立法會議員李世榮表示，今次事態嚴重，港鐵在應急處置、設備維護和風險預警上存有漏洞，認為港鐵今年接二連三發生事故，情況不能接受，影響市民對港鐵服務的信心，港鐵和相關政策局要認真嚴肅探討如何改善，港鐵應交代涉事電力裝置，對上一次檢查的日子。

李世榮表示，港鐵昨日派出百多人為受影響乘客提供協助，但事故涉及港島綫和將軍澳綫的多個車站，平均每站的職員人手，不足以應付現場大批滯留乘客。

李世榮要求港鐵詳細調查事件，一星期內提交報告，期望港鐵在下周一的立法會鐵路事宜小組委員會作出交代，包括架空電纜組件移動的原因，又認為港鐵應盡快完成全面設備檢查，避免再有同類事故發生，以及提高危機應對指引，以及員工應變能力，完善疏導乘客和資訊發放的工作。

李世榮又促請港鐵提供上班日免費來回車票，向受影響人士提供賠償。"
孫東：將推出「創科加速器先導計劃」吸引初創服務來港設立基地,2025-05-23 12:26,,2025-05-23 12:45,local,rthk,https://news.rthk.hk/rthk/ch/component/k2/1805937-20250523.htm,"創新科技及工業局局長孫東表示，為吸引更多風險投資基金與本地創科初創企業共同投資，政府優化「創科創投基金」，調撥15億港元與業界以配對形式成立聯合基金，投資策略性產業的初創企業。政府亦將推出「創科加速器先導計劃」，吸引在香港及其他地區具有成功經驗的專業初創服務提供者，來港設立加速器基地，促進初創企業的蓬勃發展，並進一步完善本地創科生態系統。

孫東出席城大「HK Tech 300」創科博覽活動致辭表示，政府、業界、學界、科研及投資界的互動合作，對香港創科發展至關重要。香港必須繼續共同努力，支持年輕企業家，為他們提供所需的資源、指導及機遇，幫助他們將創意轉化為具影響力的解決方案，進一步推動香港發展成為國際創科中心。"
恒指半日升135點　兩隻新股升近三成或以上,2025-05-23 12:20,,2025-05-23 12:45,cfinance,rthk,https://news.rthk.hk/rthk/ch/component/k2/1805935-20250523.htm,"港股先低後高，恒生指數初段微跌至23500點邊緣後，最多倒升近200點，之後升幅收窄，中午收市報23679點，升135點，升幅近0.6%，半日主板成交額約1094億元。

科技指數在5300點關口附近上落，半日報5283點，升31點，升幅0.6%。ATMXJ上升，美團升逾1%。嗶哩嗶哩升逾5%，公司額外發售9000萬美元可換股優先票據。

醫藥股造好，石藥集團升近5%，藥明康德升近3%。

汽車股上升，比亞迪股份創新高，半日升4%；吉利和理想汽車升近3%或以上。

金融股普遍向上，工行和中人壽升逾1%至逾2%，港交所和滙控升近1%，但友邦跌近1%。

首日掛牌的恒瑞醫藥高見60.5元，較招股價高37%，中午收市報57.65元，高招股價約31%。同日上市的新加坡生物技術公司MIRXES半日報29.8元，較招股價高約28%。"
Call to minimise fallout from builder's projects ban,2025-05-23 12:17,,2025-05-23 12:30,elocal,rthk,https://news.rthk.hk/rthk/en/component/k2/1805926-20250523.htm,"A lawmaker says the government had ""no choice"" but to pull the plug on a major contractor in charge of several public construction projects, saying work-site safety must come first when renewing the registration of firms.

Lo Wai-kwok, who represents the engineering sector, also said he hopes authorities would do their best to ensure that existing subcontractors and staff can stay on when projects being handled by the major contractor are passed on to new firms.

Lo made the call following an announcement by Secretary for Development Bernadette Linn on Thursday that Aggressive Construction will be removed from the government's list of approved general building contractors from June 20.

The firm was involved in multiple construction incidents between 2020 and 2023, resulting in five deaths. 

Speaking on RTHK's Hong Kong Today programme on Friday, Lo explained why it took the government years to make up its mind.

""The time taken seems to be quite long, but we have to understand that to deal with such an application is indeed not an easy task,"" he said.

""The Buildings Department and the Contractor Registration Committee had to verify all the data submitted and analyse the incidents and the track record of the company, their submission.

""And they have to interview the authorised signatories and the project directors involved...So these really take time and it's not an easy decision.""

Aggressive Construction has been given one month to wrap up its work. 

Lo said the firm is in charge of six public projects, including four housing estates.

""This, unfortunately, will cause delays for these projects, but I think we've got no choice,"" he said.

To speed up the transition, the lawmaker expects the government to directly engage ""trustworthy"" contractors, instead of inviting interested firms to lodge tenders."
Nam Wan Tunnel staff killed in traffic accident,2025-05-23 11:52,,2025-05-23 12:15,elocal,rthk,https://news.rthk.hk/rthk/en/component/k2/1805923-20250523.htm,"Police are investigating a traffic accident in Tsing Yi early on Friday in which a Nam Wan Tunnel staff member was killed.

In a statement, the police said the accident occurred at 12.40 am when a car driven by a 40-year-old man was travelling along Tsing Sha Highway towards Kowloon.

As the car approached the entrance of Nam Wan Tunnel, it reportedly hit a 61-year-old male tunnel staff.

The man was unconscious as he was taken to Princess Margaret Hospital with serious injuries. 

He was pronounced dead at 2.17 am.

Police said the driver has been arrested for dangerous driving causing death.

He is being detained to help a special traffic investigation team from New Territories South with its investigation into the incident.

The force also appealed for witnesses to come forward."
啟德體育園明後晚舉行演唱會　運輸署將實施特別交通及運輸安排,2025-05-23 11:52,,2025-05-23 12:15,local,rthk,https://news.rthk.hk/rthk/ch/component/k2/1805932-20250523.htm,"運輸署表示，為配合本月24及25日晚上於啟德體育園舉行的演唱會，將實施特別交通及運輸安排便利觀眾往返。

署方表示，體育園附近一帶的交通預期會較繁忙，觀眾應乘搭公共交通工具，避免駕車前往，活動期間，體育園將不設私家車上落客位予公眾使用。運輸署已協調本地及跨境公共運輸服務營辦商在散場時段加強服務。港鐵將會加密屯馬綫的班次，專營巴士公司將於宋皇臺道上落客區提供共11條特別巴士路線，分別前往落馬洲（新田）公共運輸交匯處、港珠澳大橋香港口岸/機場及港九新界各主要地區。

另外，園方將於散場時段安排過境巴士服務，便利旅客經落馬洲/皇崗口岸返回內地。乘客需預先購票，散場後不設現場售票。至於的士服務，宋皇臺道上落客區在活動日子每日下午3時至午夜12時開放予的士上落客。 

根據活動主辦單位提供的資料，今次演唱會預計較過往活動稍晚開始和完結，而經港鐵大圍站接駁東鐵綫往羅湖站的最後一班列車將於晚上10時59分由宋皇臺站及11時01分由啟德站開出。旅客亦可乘搭東鐵綫往上水站轉乘九巴第276B或N73號線，或直接在宋皇臺道上落客區乘搭特別巴士第SP12號線往落馬洲（新田）公共運輸交匯處，轉乘落馬洲—皇崗過境穿梭巴士返回內地。"
星光大道部分路段因應活動周日中午12時至晚上9時暫停開放,2025-05-23 11:50,,2025-05-23 12:15,local,rthk,https://news.rthk.hk/rthk/ch/component/k2/1805931-20250523.htm,"康文署宣布，由於有團體舉行活動，星光大道部分路段本月25日中午12時至晚上9時暫停開放。

如有需要通過該區域，請按場地工作人員指示改用梳士巴利道。"
滬指半日靠穩　深證成指升0.5%,2025-05-23 11:44,,2025-05-23 12:00,cfinance,rthk,https://news.rthk.hk/rthk/ch/component/k2/1805930-20250523.htm,"滬深股市半日靠穩，醫療服務、化學製藥板塊上升；港口航運、遊戲相關股份下跌。

上證綜合指數報3382點，升2點，升幅0.08%。

深證成份指數報10271點，升51點，升幅0.5%。

創業板指數報2055點，升9點，升幅0.48%。"
