title,date,summary,scrape_time,section,source,url,news_content
李家超早上於釜山迎接習近平　下午與在南韓港人及港企交流,2025-10-30 17:55,,2025-10-30 18:15,local,rthk,https://news.rthk.hk/rthk/ch/component/k2/1829407-20251030.htm,"行政長官李家超展開在南韓訪問行程。早上在釜山迎接將會出席亞太經合組織領導人非正式會議並對南韓進行國事訪問的國家主席習近平。
 
李家超下午與在南韓的港人和港企代表於釜山會面和交流，了解他們在當地的生活和發展情況。李家超鼓勵他們發揮自身所長，說好香港故事，為兩地的經貿合作與人文交流貢獻力量。
 
李家超在商務及經濟發展局局長丘應樺陪同下，晚上與亞太經合組織商貿諮詢理事會中國香港代表於慶州餐敘，就推廣香港優勢、加強區域合作等議題交流意見。他明日將出席亞太經合組織領導人與東道主嘉賓非正式對話、亞太經合組織商貿諮詢理事會成員對話，以及會議主辦方為與會領袖所設的歡迎晚宴。"
建行上季盈利升逾4%　首9個月升近1%,2025-10-30 17:46,,2025-10-30 18:00,cfinance,rthk,https://news.rthk.hk/rthk/ch/component/k2/1829402-20251030.htm,"中國建設銀行第3季盈利按年升逾4%至952.8億元人民幣。期內利息淨收入按年跌近3%至近1409億元，手續費及佣金淨收入升近9%至224.5億元。信用減值損失收窄近36%至141.1億元。

建行今年首9個月盈利按年升近1%至2573.6億元。利息淨收入按年跌3%至4276.1億元，淨利息收益率按年跌16個基點至1.36%。非利息淨收入升近19%至逾1326.7億元，其中手續費及佣金淨收入升逾5%至896.7億元。信用減值損失擴大逾11%至1217.6億元。

截至9月底，建行不良貸款3654.7億元，較去年底增加6%。不良貸款率1.32%，下跌 0.02個百分點。撥備覆蓋率235.05%，升1.45個百分點。貸款撥備率3.11%，跌0.01個百分點。"
林大輝：香港背靠祖國面向國際　要善用「內聯外通」橋樑作用,2025-10-30 17:39,,2025-10-30 18:00,local,rthk,https://news.rthk.hk/rthk/ch/component/k2/1829405-20251030.htm,"理工大學舉辦「中國外交理論與實踐」專題講座，理大校董會主席林大輝表示，中國的外交事業，不僅關乎國家的發展，更與香港的未來息息相關。香港是國際大都會，擁有「一國兩制」的獨特優勢。香港背靠祖國，面向國際，要善用「內聯外通」的橋樑作用。在融入國家發展大局的同時，要深化國際交往合作，充分發揮「超級聯繫人」和「超級增值人」的角色，為國家的外交事業貢獻香港力量。

林大輝在活動上致辭時表示，中國外交正是在理論與實踐之中，走出了一條中國特色的大國外交之路。當前國際形勢錯綜複雜，世界正處於百年未有之大變局。以美國為首的霸權主義、單邊主義和保護主義無處不在，已經嚴重危害到世界的正常發展，引起不少地區的衝突，帶來經濟、民生和和平的問題。他表示，透過改革開放，中國已經發展成為世界第二大經濟體系。國家在高速發展過程中，始終堅持互利共贏、開放包容平等的理念，堅持維護世界和平發展，堅持推動多邊主義，致力推動構建人類命運共同體。

他希望透過今次講座，讓學生更加深入了解國家的外交工作，增強他們的歸屬感、認同感和自豪感。"
中美元首會面經貿取得進展　特朗普明年4月訪華,2025-10-30 17:38,,2025-10-30 17:45,cinternational,rthk,https://news.rthk.hk/rthk/ch/component/k2/1829404-20251030.htm,"到了南韓的國家主席習近平，今早與美國總統特朗普會面，是雙方近6年來首次會面。兩國在解決經貿問題上取得一些進展，其中，美方同意即時將對中國徵收的關稅，由57%降至47%，中方答應恢復採購美國大豆，並將稀土管制措施押後最少一年。特朗普表示，習近平答應採取強有力行動打擊芬太尼出口問題。

習近平對特朗普表示，中美兩國國情不同，難免有分歧，雙方分別作為中美掌舵人，應當把握好方向、駕馭住大局，讓中美關係這艘大船平穩前行。會面歷時約1小時40分鐘，特朗普表示，將在明年4月訪華，並邀請習近平之後訪美。"
孫東：未來兩個月重點工作　確保河套香港園區年底正式運作,2025-10-30 17:36,,2025-10-30 18:00,local,rthk,https://news.rthk.hk/rthk/ch/component/k2/1829403-20251030.htm,"中共二十屆四中全會上星期在北京閉幕，全會審議通過「十五五」建議。創新科技及工業局局長孫東今日主持團隊會議，指未來兩個月重點工作，包括加快河套深港科技創新合作區香港園區建設，確保園區於今年年底正式投入運營；同時於年内完成河套香港園區第二期發展規劃工作。

當局亦會持續推進沙嶺數據園區用地的公開招標工作；並於年內公布《新田科技城創科產業發展規劃概念綱要》，明確頂層設計、產業定位與布局、各片區統籌發展及引導市場資源投入策略等。即將推出「創科加速器先導計劃」，會以配對資助式吸引海內外具豐富經驗的專業初創企業服務機構，在香港建立加速器基地等。

孫東在社交專頁說，「十五五」規劃明確支持香港建設國際創新科技中心，顯示國家對香港在未來科技強國建設中發揮更積極作用的期盼及信心，體現國家對香港特區政府致力創科發展的肯定。"
專家指中國在軌期間監察小鼠空間行為屬非常大突破,2025-10-30 17:32,,2025-10-30 18:00,local,rthk,https://news.rthk.hk/rthk/ch/component/k2/1829399-20251030.htm,"神舟二十一號載人飛船預計明晚11時44分發射，飛船入軌後將採用自主快速交會對接模式，約3.5小時後對接於天和核心艙前向端口，形成三船三艙組合體。

中國載人航天工程辦公室高級工程師周亞強表示，以往的對接模式需時約6.5小時，今次加快至3.5小時，是由於採用多項技術，包括火箭入軌精度、空間調向精度，以及飛船的變軌等，工程的管理模式亦有優化改進。

神舟二十一號航天員乘組在軌期間，將新開展27項科學與應用項目，中國將首次在軌實施國內嚙齒類哺乳類動物空間科學實驗。中國科學院空間應用與工程中心高級工程師韓培形容是非常大的突破，在軌期間將監察小鼠的空間行為，研究失重、密閉等空間條件對小鼠行為模式的影響，從而掌握空間小型哺乳動物飼養和監測關鍵核心技術。

另外，港澳載荷專家預計明年首次執行飛行任務。中國載人航天工程航天員系統副總設計師吳斌表示，港澳航天員進入航天員中心訓練以來，訓練非常刻苦，他們非常努力。他們要接受包括救生與生存訓練，涉及沙漠生存和發射場的緊撤離訓練等。吳斌表示，港澳航天員的訓練內容，與中國航天員載荷專家訓練基本相似，包括基礎理論、體能及心理訓練等。載荷專家亦要接受航天知識的學習、飛船基本操作，以及科學實驗訓練等。"
APEC 2025 ｜丘應樺稱開放穩定貿易環境較以往更重要,2025-10-30 17:27,,2025-10-30 17:45,local,rthk,https://news.rthk.hk/rthk/ch/component/k2/1829400-20251030.htm,"商務及經濟發展局局長丘應樺在南韓慶州出席亞太經合組織部長級會議。他在題為「創新與繁榮」的討論環節上，與其他部長分享香港致力推動數字化以促進人民及未來世代繁榮發展。

丘應樺表示，數字技術特別是人工智能的急速發展，正以前所未有的速度從根本改變社會。為充分利用其效益並順利轉型，香港堅定支持深化亞太經合組織的數字合作，以促進經濟增長和應對共同挑戰。他指出，加強基建和採用應用導向策略，對促進人工智能深度融入各行業十分重要。香港一直採取實際行動，包括增建高性能數據園區，以先進算力推動創新；通過加快中、小及微型企業數字轉型以促進人工智能的應用；以及運用人工智能提升香港的貿易架構等。

在另一場題為「連接」的討論環節上，丘應樺重申，在應對日益複雜的局勢時，以世貿組織為基礎的多邊貿易制度繼續發揮關鍵作用。他強調世貿組織秉持不歧視和協作的核心原則，加上其各種重要的角色和功能，在過去數十年引領全球貿易蓬勃發展。在這前所未有的嚴峻時期，相信開放、穩定、透明、包容、可預測和以規則為本的國際貿易環境，較以往任何時候都更為重要，特別是對發展中經濟體而言，不但能助它們生存，更可讓它們乘著新興機遇蓬勃發展。

在部長級會議期間，丘應樺分別與國家商務部副部長兼國際貿易談判副代表凌激、韓國產業通商資源部通商事務次官補樸鍾元、秘魯外貿和旅遊部長、新西蘭貿易及投資部長和印尼貿易部部長會面，就雙方關注的議題交換意見。"
在岸人民幣兌美元收市跌近120點子,2025-10-30 17:19,,2025-10-30 17:30,cfinance,rthk,https://news.rthk.hk/rthk/ch/component/k2/1829398-20251030.htm,"在岸人民幣兌美元收市報7.1107兌1美元，較上日收市跌116點子。中間價亦自1年多高位回落，報7.0864，較市場偏強逾190點子。

交易員指，聯儲局政策基調偏鷹支持美元指數，人民幣受壓，預計短期維持區間上落。"
交行上季盈利按年升逾2%,2025-10-30 17:16,,2025-10-30 17:30,cfinance,rthk,https://news.rthk.hk/rthk/ch/component/k2/1829396-20251030.htm,"交通銀行第3季盈利按年升逾2%，升至近240億元人民幣。今年首9個月盈利按年升近2%至近700億元。

集團首3季利息淨收入升逾1%至1286.5億元，淨利息收益率按年跌8個基點至1.2厘。手續費及佣金淨收入升逾0.1%至近294億元。貸款信用減值損失按年收窄近2%至413.3億元。

截至9月底，交行不良貸款餘額1145.5億元，較去年底增加近3%；不良貸款率1.26%，跌0.05個百分點；撥備覆蓋率209.97%，升8.03個百分點。

交行表示，不良貸款率較去年底下降，關注類貸款率和逾期貸款率分別較去年底持平和略有上升，但較上季尾下降。"
恒生銀行私有化計劃文件寄發最後期限延至12月17日,2025-10-30 17:11,,2025-10-30 17:30,local,rthk,https://news.rthk.hk/rthk/ch/component/k2/1829393-20251030.htm,"滙控、滙豐亞太及恒生銀行發出聯合公告，表示由於需要時間為私有化恒生銀行的建議編制計劃文件內的資料，包括恒生銀行獨立財務顧問的意見及恒生銀行獨立董事委員會的建議，以及進行高等法院對計劃的程序，因此已根據收購守則相關規則，向執行人員申請，而執行人員已同意將寄發計劃文件的最後期限，由今日延長至12月17日。

公告提到，基於計劃文件12月17日或之前寄發，在條件達成或獲豁免前提下，目前預計建議將於明年第一季度內完成實施。"
New pharmacy programme to improve healthcare access,2025-10-30 17:11,,2025-10-30 17:30,elocal,rthk,https://news.rthk.hk/rthk/en/component/k2/1829397-20251030.htm,"In a step to make primary healthcare more accessible and affordable, health officials have introduced a new framework for community pharmacies and a centralised drug list, paving the way for a comprehensive Community Pharmacy Programme (CPP) set to launch next year.

The Primary Healthcare Commission on Thursday launched the Community Drug Formulary (CDF) mechanism and new Guidelines for Community Pharmacies, which are the foundational elements of the upcoming CPP. 

The programme, expected to launch in phases in the fourth quarter of next year, aims to provide easier access to safe, affordable drugs and expert advice for everyday health needs.

According to Cheung Wai-lun, director of strategic purchasing office at the Health Bureau, the new CDF draws directly from the existing Hospital Authority (HA)'s formulary. 

He said the HA will lead the bulk procurement of these medicines through a government partnership, a strategy designed to ensure the drugs are safe, effective and cheaper due to large-scale purchasing. 

The CDF will cover a range of medicines, including preventative medications, chronic disease treatments and short-term therapies, which are split into three tiers: non-patented, patented or specific drugs and special categories.

The dispensing of CDF drugs will launch in the second half of 2026, which will allow patients in schemes like the Chronic Disease Co-Care Pilot to get prescription CDF drugs from family doctors or CPP pharmacies for a co-payment.

“Drug supply will be a very important factor to enable the patient to have a comprehensive service. We hope that through the community drug formulary, by its design and also the procurement process, we can provide the patients, especially chronic disease patients, an affordable cost for getting the supply of drugs,” Cheung said. 

Concurrently, the Commissioner for Primary Healthcare Pang Fei-chau said new guidelines for community pharmacies establish clear rules to ensure the delivery of high-quality and consistent care. 

These guidelines cover areas such as management and staff training, facility requirements, daily procedures and service scope, he said, noting that they will serve as the fundamental standard for the CPP. 

In the long term, Pang said only registered pharmacies that have been vetted by the government and are confirmed to meet the service standards and quality assurance requirements outlined in the guidelines will be officially recognised as community pharmacies under the primary healthcare service network."
農行上季盈利按年升近4%　首9個月升3%,2025-10-30 17:05,,2025-10-30 17:15,cfinance,rthk,https://news.rthk.hk/rthk/ch/component/k2/1829394-20251030.htm,"中國農業銀行第3季盈利按年升近4%至813.5億元人民幣。

期內，淨利息收入跌1%至逾1448.3億元，手續費及佣金淨收入升近24%至184.4億元。信用減值損失收窄近2%至294.5億元。

今年首9個月，農行盈利升3%至2208.6億元。淨利息收入跌2%至4273.1億元，淨利息收益率1.3厘。手續費及佣金淨收入升逾13%至698.8億元。信用減值損失收窄近3%至1274億元。

截至9月底，不良貸款餘額3414億元，較去年底增加192.4億元；不良貸款率1.27%，下跌0.03個百分點。撥備覆蓋率295.08%，跌4.53個百分點。"
巴黎羅浮宮劫案增至7人被捕,2025-10-30 17:00,,2025-10-30 17:15,cinternational,rthk,https://news.rthk.hk/rthk/ch/component/k2/1829395-20251030.htm,"法國巴黎羅浮宮劫案，檢察當局表示，再多5名疑犯被捕，包括一名主要嫌疑人，令被捕人數增至7人。

當地傳媒報道，繼先前落網的兩名疑犯，巴黎當局在當地星期三晚間，再展開逮捕行動。

早前拘捕的兩名男疑犯，分別34歲及39歲，都有案底，兩人已承認參與案件。檢方表示，將會以盜竊罪和共謀犯罪正式起訴兩人，並已提出對他們繼續實施臨時羈押。"
甯漢豪：積極保育自然和歷史文化資源　成為北都重要部分,2025-10-30 16:50,,2025-10-30 17:00,local,rthk,https://news.rthk.hk/rthk/ch/component/k2/1829392-20251030.htm,"發展局局長甯漢豪上周參與財政司司長率領的特區代表團，考察北京城市副中心及河北雄安新區，了解兩區在城市規劃、重點設施建設、產業發展及環境保育等方面的經驗。

代表團參觀了北京朝陽區亮馬河及城市副中心大運河的文旅項目，感受兩個新區如何保留自然水系、活化歷史文化資源，打造市民喜愛的休閒空間。甯漢豪表示，在香港構建北部都會區的過程，會著力環境綠化，積極保育自然和歷史文化資源，讓這些要素成為北都的重要部分，踐行可持續發展理念及提升生活質素。

代表團亦考察了人民大學通州校區及北京科技大學雄安校區的建設，並與校方交流經驗。甯漢豪說，大學城是北都發展的重點內容。最近提出洪水橋大學城用地由5公頃增加至9公頃，牛潭尾大學用地由46公頃增至52公頃，連同新界北新市鎮一帶預留的約40公頃，北都大學城用地約達100公頃。通州和雄安「校城融合」的理念，引證本港將大學用地與周邊配套協調發展的重要性。

甯漢豪又說，在北京城市副中心及雄安新區，都看到既有宏觀的空間用途規劃，亦重視微觀的項目落地安排，對設施建設及設計，以至企業進駐的先後次序作出精心部署。隨着北都進入建設階段，這亦是特區政府要多加留意的範疇。"
HK shares slip amid 'same trade talks playbook' fears,2025-10-30 16:44,,2025-10-30 17:00,efinance,rthk,https://news.rthk.hk/rthk/en/component/k2/1829390-20251030.htm,"Chinese shares pulled back from a decade high on Thursday as President Xi Jinping and his US counterpart Donald Trump concluded a high-stakes meeting in South Korea with a trade-war truce that investors had broadly expected.

In Hong Kong, the benchmark Hang Seng Index ended trading for the day down 63 points, or 0.24 percent, at 26,282.

Up north, the benchmark Shanghai Composite Index hit its highest level since 2015 at the start of the session but closed down 0.73 percent at 3,986 while the Shenzhen Component Index ended 1.16 percent lower at 13,532.

The ChiNext Index, tracking China's Nasdaq-style board of growth enterprises, lost 1.84 percent to close at 3,263.

Investors appeared heartened by signs of cooling tensions between the world's top two economies after recent escalations, while also positioning defensively with a sense of deja vu that the real deal may offer far less to celebrate.

Previous trade negotiations have seen promising starts followed by setbacks.

The market reaction was choppy with traders trying to make sense of the information released so far. The yuan retreated from near a one-year high against the dollar after the meeting.

The Commerce Ministry in Beijing confirmed that China and the United States had agreed to extend their temporary trade truce for another year as part of an agreement they reached after top economic officials met in Malaysia last week.

China's CSI Rare Earth Industry Index rose more than 2 percent, while defensive plays such as liquor and banking pared earlier gains. The AI sector index was down nearly 2 percent.

""The response from markets has been cautious in contrast to Trump's enthusiastic characterisation of the meeting with Xi as 'a 12 out of 10',"" said Besa Deda, chief economist at advisory firm William Buck in Sydney.

""There are still some structural issues that have been left unresolved, which could be contributing to the market's response and takes some shine off the truce.""

The meeting on Thursday looked like an attempt to reset the US-China narrative by reopening selective trade channels to restore confidence, rather than a fundamental reset of geopolitical relations, analysts say.

""It's hard to call this a clean risk-on,"" said Charu Chanana, chief investment strategist at Saxo in Singapore. ""Equity traders have seen this playbook before – upbeat tone, little follow-through.""

There are plenty of gaps still left, though, in the Trump-Xi headlines with no timeline on rare earths, soybeans not a huge win if China's crushers don't need imports, and no mention of Nvidia's Blackwell chips, she added.

Partial tariff rollbacks may also do little to help loss-making Chinese exporters and manufacturers, or reverse weak consumer demand at home.

""Overall, this looks like a tactical pause rather than a strategic breakthrough,"" said Tareck Horchani, head of prime brokerage dealing at Maybank Securities. (Reuters/Xinhua)"
環保署臨時點篩選樺加沙襲港塌樹　410公噸物料可回收再造,2025-10-30 16:42,,2025-10-30 17:00,local,rthk,https://news.rthk.hk/rthk/ch/component/k2/1829391-20251030.htm,"超強颱風樺加沙早前吹襲香港，環保署試行在近市區的3個地點，包括沙田、青衣及金鐘，設立「樹木臨時處理點」。署方說，共接收超過570公噸塌樹物料，當中篩選出約410公噸物料適合回收再造。物料經破碎處理後，運輸所需車次由原本約130車次，大幅縮減至現時約90車次，效率提升外，也減少碳排放。

環境及生態局說，可回收塌樹中，體積較大的樹幹及粗樹枝會送往Y·PARK [林．區]，再造成可製作木製傢具、飾物、藝術品等的木板、木方及木頭；樹枝經木材破碎機轉化成木碎後，可用作製造生物炭的木料、養殖菇菌的基質、堆填區覆蓋物料、種植，以及園藝用的護根覆蓋物等，有助減少雜草、蚊蟲和矇的滋生。不適合回收的物料，包括樹樁、幼枝及樹葉、受感染或蟲害的樹木會被送到堆填區處理。"
港隊於亞青運單車及游泳項目共取得四金三銀獎牌,2025-10-30 16:37,,2025-10-30 17:00,local,rthk,https://news.rthk.hk/rthk/ch/component/k2/1829389-20251030.htm,"在巴林舉行的亞洲青年運動會，港隊於單車和游泳項目，合共取得4金3銀共7面獎牌。

港隊泳手馬紫玲及徐奕祺，分別在女子200米自由泳、男子100米蛙泳，以打破亞青運紀錄的成績奪金，文薈喬在女子100米蛙泳亦為港團增添金牌。

同日較早時間，單車代表李昀俊在男子個人公路賽，為港團取得今屆第8面金牌。中國香港代表團至今已得11金9銀8銅，共28面獎牌，暫時排名獎牌榜第六。

亞青運中國香港代表團團長莫君逸表示，泳隊繼續在賽場上展現無比鬥志，馬紫玲、徐奕祺和文薈喬在決賽憑穩定發揮，摘下金牌，令人印象深刻，代表團在獎牌榜登上新高位置，已寫下歷史，最後一個比賽日，希望運動員能盡情享受比賽。"
'RTHK ready to broadcast National Games',2025-10-30 16:30,,2025-10-30 16:45,elocal,rthk,https://news.rthk.hk/rthk/en/component/k2/1829383-20251030.htm,"RTHK is ready to broadcast the National Games live to the public, Director of Broadcasting Angelina Kwan said on Thursday. 

During the Games – which officially begins on November 9 – RTHK TV 32 will be showing live matches during the day, while RTHK TV 31 will provide one hour of highlights in the evening. 

A new RTHK TV 36 channel will also be launched to offer broader coverage. 

Broadcasts will include Cantonese and Putonghua commentary, as well as audio description and sign language services.

At a ceremony to mark the launch of the Games, Kwan noted that RTHK has made comprehensive preparations for the event. 

“In preparation for this highly anticipated event, RTHK began making preparations more than two years ago, focusing on equipment and programme production,” she said. 

“We have invested in upgrading our hardware and communication systems, including setting up a fully equipped studio in the media centre at Sun Yat Sen Memorial Park. We also have optical fibre, 5G, and cloud technologies in place to ensure real-time and stable reception and transmission of matches from other regions.”

RTHK will also broadcast the National Games for Persons with Disabilities and the National Special Olympic Games, which will be held in December. 

Speaking at the same event, Acting Secretary for Commerce and Economic Development Bernard Chan said Hong Kong will showcase its vitality and charm to the mainland and the world by co-hosting the National Games with Guangdong and Macau.

Hong Kong is hosting eight competition events for the Games, including beach volleyball, men’s handball, men’s U22 basketball, rugby sevens, golf, track cycling, triathlon, and fencing.

Chan also said he hopes visitors will take time to explore the city and spend money. 

“Besides attracting a large number of tourists and local residents to watch the Games, people will also go out to spend, which we hope will boost the economy, especially the catering and retail industries around the venues,” he said.

Competitions in Hong Kong kick off on Friday with beach volleyball at Victoria Park."
恒指低收63點　銀行股個別發展　地產股向下,2025-10-30 16:22,,2025-10-30 16:45,cfinance,rthk,https://news.rthk.hk/rthk/ch/component/k2/1829388-20251030.htm,"港股跟隨內地股市先升後回，恒生指數午後最多跌近210點，收市報26282點，跌63點，主板成交額重上3000億元，升至3538億元，創逾兩星期以來最高。

本港銀行跟隨美國減息，銀行股個別發展，滙控升逾1%，中銀香港跌近1%，中午公布季度業績的渣打高收逾4%。

地產分類指數跌逾2%，長實、新地和恒地跌逾1%至近3%；內房及物管股亦下跌。

科技指數在尾市一度失守6000點關口，收市報6051點，跌幅約0.7%。舜宇光學跌近5%，是表現最差的恒指及科指成份股。

金屬相關股份造好，紫金礦業升近5%，中國宏橋急升逾8%，是表現最好的兩隻藍籌股。"
