title,date,summary,scrape_time,section,source,url,news_content
日本10月核心通脹率升至2.8%超出預期,2025-10-31 09:17,,2025-10-31 09:30,cfinance,rthk,https://news.rthk.hk/rthk/ch/component/k2/1829495-20251031.htm,"東京10月核心通脹率升至2.8%，高於9月的2.5%，亦高於市場預期的2.6%。

通脹率持續超出日本央行2%的目標，市場仍預期央行仍然存在加息機會。"
亞太經合組織領導人會議揭幕　習近平與李在明握手合照並步入會場,2025-10-31 09:15,,2025-10-31 09:30,greater_china,rthk,https://news.rthk.hk/rthk/ch/component/k2/1829494-20251031.htm,"亞太經合組織第三十二次領導人非正式會議第一階段會議上午在南韓慶州和白會議中心舉行。國家主席習近平出席會議，並發表重要講話。

在揭幕儀式上，東道主南韓總統李在明在會場門外，迎接各經濟體領導人及代表，逐一與他們握手。國家主席習近平壓軸進場，與李在明握手和合照後，兩人一同步入會場。行政長官李家超進場時，亦有與李在明握手及短暫交談。

美國總統特朗普昨日已離開南韓，美國由財長貝森特出席會議。其他出席會議的經濟體領導人，包括日本首相高市早苗、 新加坡總理黃循財、泰國總理阿努廷、馬來西亞總理安華等。"
蘋果上季iPhone收入創新高　庫克：仍在解決供應緊張問題,2025-10-31 09:11,,2025-10-31 09:30,cfinance,rthk,https://news.rthk.hk/rthk/ch/component/k2/1829487-20251031.htm,"蘋果上季業績勝預期，美股盤後股價較早時升逾2%。

蘋果公布，財政年度最後一季盈利274.7億美元，按年急升86%。每股經調整盈利1.85美元，超出市場預期。

上季收入升約8%至1024.7億美元，創新高，好過預期。其中，iPhone收入升6%至490.3億美元，服務收入升15%至287.5億美元，兩者都創新高，但iPhone收入不及市場預期。

其他產品表現，Mac收入升約13%至87.3億美元，iPad收入近乎持平於69.5億美元，可穿戴設備、家居及配件收入微跌0.3%至90.1億美元。

大多數地區收入都升，美洲升6%至441.9億美元，歐洲亦升15%至287億美元，但大中華則跌逾3.5%至144.9億美元。

分析認為，供應緊張及中國市場出貨延遲，對蘋果上季表現有影響，但其他業務表現強勁彌補。

行政總裁庫克表示，仍在努力解決供應緊張問題，而受新型號訂單帶動，預計今季手機收入按年有雙位數增長，整體收入亦有望升10%至12%，兩者都超出市場預期。"
台股初段升約0.3%,2025-10-31 09:09,,2025-10-31 09:30,cfinance,rthk,https://news.rthk.hk/rthk/ch/component/k2/1829493-20251031.htm,台灣股市初段靠穩，加權指數較早時報28359點，升71點，升幅0.25%。
英王正式啟動程序剝奪安德魯王子尊號與頭銜及榮譽,2025-10-31 08:55,,2025-10-31 09:15,cinternational,rthk,https://news.rthk.hk/rthk/ch/component/k2/1829492-20251031.htm,"英國王室發聲明表示，國王查理斯三世已正式啟動程序，剝奪安德魯王子的尊號、頭銜及榮譽，並已通知安德魯搬離王室住所。

聲明說安德魯王子此後名為安德魯-蒙巴頓-溫莎，並將搬至私人住所居住，又指雖然安德魯持續否認涉及他的指控，但有關措施仍被視為必要之舉。
　　
安德魯是已故女王伊利沙伯二世的次子，近年他因與已故美國富商、性犯罪者愛潑斯坦關係密切而醜聞纏身。安德魯堅稱自己與愛潑斯坦早已劃清界限，亦極力否認曾經在愛潑斯坦名下豪宅，與未成年女子發生性關係。"
習近平將出席亞太經合組織領導人非正式會議並發表重要講話,2025-10-31 08:36,,2025-10-31 08:45,cinternational,rthk,https://news.rthk.hk/rthk/ch/component/k2/1829491-20251031.htm,"亞太經合組織第三十二次領導人非正式會議第一階段會議，上午在南韓慶州和白會議中心舉行。

國家主席習近平將出席會議，並發表重要講話。"
韓股初段變動不大,2025-10-31 08:24,,2025-10-31 08:45,cfinance,rthk,https://news.rthk.hk/rthk/ch/component/k2/1829490-20251031.htm,南韓股市早段變動不大，首爾綜合指數較早時報4085點，跌1點，跌幅0.04%。
日股初段升逾1%　首次升穿52000點創新高,2025-10-31 08:24,,2025-10-31 08:45,cfinance,rthk,https://news.rthk.hk/rthk/ch/component/k2/1829489-20251031.htm,"日股初段再創新高，日經指數首次升穿52000點關口。

日經指數較早時報52014點，升689點，升幅1.34%。"
亞馬遜上季雲計算業務增速勝預期　盤後股價急升逾13%,2025-10-31 08:24,,2025-10-31 08:45,cfinance,rthk,https://news.rthk.hk/rthk/ch/component/k2/1829483-20251031.htm,"亞馬遜上季畔業務收入按年增長20%至330億美元，是2022年以來最快增速，好過市場預期，帶動美股盤後時段股價急升逾13%。

亞馬遜上季盈利211.9億美元，按年升38%。每股經調整盈利1.95美元，遠高於預期的1.57美元。

期內，收入升13%至1801.7億美元，高於預期。集團預計今季收入介乎2060億至2130億美元，按年升10%至13%，中值2095億美元，高於市場預期。

管理層說，人工智能(AI)及核心基礎設施需求持續強勁，集團一直專注加快擴大產能。"
十五運會｜男子手球港隊主場迎戰　期望小組出線再爭獎牌,2025-10-31 08:20,,2025-10-31 08:45,local,rthk,https://news.rthk.hk/rthk/ch/component/k2/1829488-20251031.htm,"十五運會男子手球項目是香港賽區承辦的8個競賽項目之一，將於明日在啟德體藝館展開，港隊教練以小組出線為目標，如果成功打入四強，會力爭獎牌。有球員表示，近年與隊友為配合出外訓練及比賽，調整工作時間，部份人更加全職工作改以兼職去配合訓練，甚至跟球隊去北京、以至德國訓練同比賽，反映全隊團結一致。

香港男子隊8年前於十三運歷史性以第6名完成，上屆有計劃參賽，但最終未有成行，今屆陣容橫跨兩代球員，有份參與十三運的港隊隊長謝永輝表示，隊友都全心投入訓練，展現出團結精神。

同樣屬於十三運代表的許文邦，現時擔任港隊主教練，他認為今屆港隊實力，除了攻守以至後備力量都屬歷來最強，港隊於分組賽有四隊對手，五隊當中爭取到排名前四，就可以晉級八強，許文邦期望港隊在主場觀眾掌聲之下，有更好發揮。會先以出線小組為目標，若能夠晉身四強，將力爭獎牌。

全運會手球男子項目決賽將於下月10日舉行。"
Amazon shares soar as cloud growth beats expectations,2025-10-31 07:53,,2025-10-31 08:15,efinance,rthk,https://news.rthk.hk/rthk/en/component/k2/1829482-20251031.htm,"Amazon's cloud revenue rose at the fastest clip in nearly three years, helping the company forecast quarterly sales above estimates and driving its shares up 14 percent in after-market trading.

The company projected increased capital spending next year. The online retailer benefited as businesses continue to spend relentlessly on artificial intelligence software development.

Massive cloud demand is helping the tech company ease the pressure from softer growth at its e-commerce business, which is gearing up for the critical holiday season amid weakness in consumer confidence stemming from global trade uncertainty.

Amazon's rally in extended trading lifted the company's market value by about US$330 billion. A stock rally of the same size in Friday's official trading session would make it Amazon's biggest one-day percentage gain since 2015.

“AWS is growing at a pace we haven’t seen since 2022,"" CEO Andy Jassy said in a statement. ""We continue to see strong demand in AI and core infrastructure, and we’ve been focused on accelerating capacity.""

Amazon Chief Financial Officer Brian Olsavsky said he expected full-year capital expenditures to be around US$125 billion, and higher next year, without providing details.

The company booked US$89.9 billion in capital expenditures through the first three quarters, largely on AI projects.

Its cloud unit, Amazon Web Services, reported a 20 percent rise in revenue in the third quarter ending in September, compared with estimates of a 17.95 percent increase.

Amazon shrugged off a tough prior week when an extended outage at AWS felled many of the most popular websites and consumer apps.

Amazon has been the worst-performing stock among the ""Magnificent 7"" megacap tech companies, due in part to a nagging reputation as a laggard in AI development.

""The report confirms Amazon’s operations are firing on all cylinders after a year of relative underperformance,"" said Ethan Feller, stock strategist at Zacks Investment Research.

He said despite the stock's nearly flat growth this year, ""the company’s fundamentals never meaningfully weakened.""

Amazon projected total net sales of between US$206 billion and US$213 billion for the fourth quarter, while analysts on average were expecting revenue of US$208.12 billion, according to data compiled by LSEG.

Normally subdued, Jassy adopted an exuberant tone on the call with analysts.

""I look at the momentum we have right now, and I believe that we can continue to grow and click like this for a while,"" he said.

""I think there are multiple places where we can expect to continue to grow,"" he added, referring to advertising and retail sales. (Reuters)"
《環看天下》：中國與荷蘭就安世爭議影響全球汽車晶片供應鏈,2025-10-31 07:52,,2025-10-31 08:15,greater_china,rthk,https://news.rthk.hk/rthk/ch/component/k2/1829481-20251031.htm,"中國與荷蘭近期關係出現波折，導火線是荷蘭政府引用冷戰時期制定的法律，全面接管當地由中資企業全資擁有的半導體生產商安世，凍結資產並開除公司高層。

中方隨即回應，限制安世在中國的晶片出口，導致倚賴相關晶片供應的多間海外車廠，生產線出現問題，當中包括日產和大眾汽車。

中方在限制措施生效後不久，放寬限制，但只容許國內分銷商買入安世晶片並可以出口，相關晶片交易必須要以人民幣計價結算。"
Sales of services help Apple beat earnings forecasts,2025-10-31 07:45,,2025-10-31 08:00,efinance,rthk,https://news.rthk.hk/rthk/en/component/k2/1829480-20251031.htm,"Apple on Thursday reported profit of US$27.5 billion in the recently ended quarter, powered by iPhone and services revenue.

The net income, along with revenue of US$102.5 billion, beat market expectations, despite a hefty financial hit from US tariffs and a slight ebbing of revenue in China when compared with the same period a year earlier.

""Apple is very proud to report a September quarter revenue record,"" chief executive Tim Cook said in a release.

Apple shares were up more than 2 percent in after-hours trade that followed release of the earnings figures.

Overall sales of iPhones, the heart of Apple's business, fell shy of market expectations, bringing in US$49 billion in an increase from the same quarter last year.

The slight miss in iPhone revenue was still ""encouraging given the successful iPhone 17 line-up launch"" in September, CFRA Research vice president Angelo Zino said in a note to investors.

Apple's services business, which sells digital content and subscriptions to users of its coveted gadgets, generated US$28.8 billion in revenue, an increase of some US$3 billion from the same quarter last year.

Analyst Zino described the performance of Apple's services business as ""standout.""

""These results come at the close of an extraordinary year for Apple in which we achieved an all-time revenue record of US$416 billion for the fiscal year,"" Cook said.

""We set an all-time revenue record for iPhone, and in services we achieved all-time records across every geographic segment.""

Cook predicted that the current fiscal quarter would be the best ever for Apple.

Cook touted the latest Apple devices and the tech giant's custom chips and efforts to enhance products and services with artificial intelligence.

""As we continue to expand our investment in AI, we're bringing intelligence to more of what people already love about our products and services,"" Cook said on an earnings call.

""At the heart of it all is Apple silicon...these incredibly advanced chips make Apple products the very best place to experience the power of AI.""

Apple has been under pressure to show it is not being left behind when it comes to artificial intelligence, with the potential to change how people engage with the internet and computers.

Cook touted new ""Apple Intelligence"" features such as real-time language translation during iPhone calls and promised to release a more personalised Siri digital assistant next year.

Demand for several iPhone 16 and iPhone 17 models outstripped supply, in the quarter, and Apple remains ""constrained"" on some models, according to executives.

Not being able to meet demand was cited by Cook as among reasons for sales in China coming in lower that the market expected.

Cook expects sales in China to pick up in the current quarter as supply improves.

""That is largely based on the reception of the iPhone there,"" Cook said.

""I couldn't be more pleased with how things are going (in China).""

Apple Chief Financial Officer Kevan Parekh said the company's gross margin was higher than forecast in the quarter, despite about US$1.1 billion in tariff-related costs.

Trump's tariffs have cost Apple near US$2 billion in the last two fiscal quarters, according to earnings figures.

Apple kept prices of iPhones unveiled last month unchanged from last year's equivalent models, raising concerns about its profit margin given the added expense. (AFP)"
友邦第3季新業務價值固定匯率計升25%　香港創單季表現新高,2025-10-31 07:43,,2025-10-31 08:00,cfinance,rthk,https://news.rthk.hk/rthk/ch/component/k2/1829479-20251031.htm,"友邦保險第3季新業務價值14.8億美元，按年升27%，以固定匯率計增長25%，創歷來第3季新高。

18個市場有11個都錄得雙位數增長，其中，香港增長40%，季度表現創新高；內地增長27%，東盟增長15%，南韓及印度等亦有雙位數升幅。

期內，以固定匯率計，整體新業務價值利潤率58.2%，提高5.7個百分點，年化新保費升14%至25.5億美元。

以固定匯率計，首3季新業務價值升18%至43.1億美元，年化新保費升10%至74.9億美元。

首席執行官兼總裁李源祥表示，分銷平台具競爭優勢，代理及伙伴分銷渠道均錄得強勁增長，有信心新業務疊加將擴大有效保單組合，未來多年將推動盈利增長及現金流產生。"
巴黎網球大師賽冼拿挫對手晉級八強,2025-10-31 07:36,,2025-10-31 08:00,csport,rthk,https://news.rthk.hk/rthk/ch/component/k2/1829478-20251031.htm,"冼拿在巴黎網球大師賽，直落兩盤擊敗塞倫多洛晉級。

兩盤比分分別是7:5先6:1。賽後冼拿稱讚對手非常有天賦，水平好高，很高興能打入下一圈。"
美國10年期債息創近3星期新高,2025-10-31 07:09,,2025-10-31 07:30,cfinance,rthk,https://news.rthk.hk/rthk/ch/component/k2/1829477-20251031.htm,"美債孳息率持續向上，市場對聯儲局12月會議再次減息預期降低，另外，Meta發債接獲大額認購，創公開市場公司債紀錄新高，部分國債出於對沖目的而被拋售。

美國10年期及30年期債息都創近3星期新高，10年期債息高見4.116厘，升5.8個基點，尾市報4.097厘。

30年期債息高見4.665厘，升6.6個基點，尾市徘徊4.65厘。

兩年期債息亦創逾1個月高位，高見3.635厘，升4.9個基點，尾市企穩3.6厘。"
美元兌日圓升穿154　逾8個半月以來首次,2025-10-31 07:07,,2025-10-31 07:30,cfinance,rthk,https://news.rthk.hk/rthk/ch/component/k2/1829476-20251031.htm,"美元兌日圓升穿154水平，是逾8個半月以來首次，高見154.44，較早時報154.05。

分析認為，日本央行維持利率不變，內部意見分歧程度與9月相若，對下次加息時機沒有提供更多細節，令日圓受壓。

美元指數創近3個月新高，高見99.724，升約0.6%，較早時貼近99.52。

聯儲局主席鮑威爾表示，內部政策分歧，加上缺乏政府數據，12月會否減息未有定論。減息預期降溫，美元匯價向上。

歐元兌美元跌至1.1565，歐洲央行連續3次會議按兵不動，總裁拉加德表示不急於改變政策。但外電引述消息指，12月會議委員分歧或升溫，若通脹持續低於目標，會議或討論減息，但亦有委員認為要保持謹慎。

另外，英鎊兌美元徘徊1.315，澳元兌美元徘徊0.655附近。"
港股美國預託證券大多下跌　阿里巴巴跌近2%,2025-10-31 07:03,,2025-10-31 07:30,cfinance,rthk,https://news.rthk.hk/rthk/ch/component/k2/1829474-20251031.htm,"港股美國預託證券(ADR)大多下跌。

阿里巴巴ADR比本港昨日收市價跌近2%，以港元計折合報168.9元。

京東集團、中國銀行、美團ADR都跌近1%。小米、騰訊、港交所、平保、工行、友邦ADR都偏軟。

滙控ADR則升逾1%，折合報109.3元。建行ADR亦微升。"
英美期油高收0.1%　連升兩日,2025-10-31 07:02,,2025-10-31 07:30,cfinance,rthk,https://news.rthk.hk/rthk/ch/component/k2/1829472-20251031.htm,"國際油價連升兩日，但升幅有限。中美元首在南韓會面，經貿問題磋商有進展，包括美國降低對華關稅，中方恢復採購美國大豆、延後實施稀土管制等，市場正評估中美貿易休戰。

英美期油同樣升0.1%收市，倫敦布蘭特期油收報每桶65美元，升8美仙。

紐約期油收報60.57美元，升9美仙。"
現貨金升逾2%　重上4000美元,2025-10-31 07:01,,2025-10-31 07:15,cfinance,rthk,https://news.rthk.hk/rthk/ch/component/k2/1829471-20251031.htm,"金價顯著向上，現貨金重上4000美元以上，每盎司高見4026.92美元，升約2.5%，較早時徘徊4023美元。

紐約期金12月合約收報4015.9美元，升15.2美元，升幅約0.4%。"
德法股市創約半個月新低　英股續創新高但升幅有限,2025-10-31 07:00,,2025-10-31 07:15,cfinance,rthk,https://news.rthk.hk/rthk/ch/component/k2/1829470-20251031.htm,"歐洲股市大多偏軟，市場關注美國聯儲局及歐洲央行12月會議或有較大分歧，利率不確定影響市場情緒。

德法股市連跌3日，德國DAX指數收報24118點，跌5點，跌幅0.02%，創近兩星期新低。

法國CAC指數收報8157點，跌43點，跌幅0.53%，是半個月收市新低。

至於英國富時100指數微升3點，收報9760點，連升9日，再創新高。"
加方稱總理卡尼今午在南韓與習近平會面,2025-10-31 06:45,,2025-10-31 07:15,cinternational,rthk,https://news.rthk.hk/rthk/ch/component/k2/1829473-20251031.htm,"加拿大總理辦公室表示，正在南韓的總理卡尼將於當地今日下午4時與中國國家主席習近平會面。

卡尼本星期較早時抵達亞洲，致力深化與區內國家的貿易和安全關係。中國是加拿大僅次於美國的第二大貿易夥伴，卡尼曾強調有必要重啟與中國的廣泛接觸。

加拿大在一年前宣布將對中國進口電動車徵收100%關稅，中方今年8月亦宣布對加拿大進口油菜籽徵收初步反傾銷稅。渥太華方面表示，兩國高級官員本月較早時曾就有關爭端進行磋商，但未有跡象顯示雙方立即取得任何突破。

加拿大外長阿南德早前到訪北京，與外長王毅會面。王毅當時說，中方願意同加拿大重啟各層級對話交往，推進解決各自合理關切，推動中加關係早日步入健康、穩定、可持續發展軌道。"
九龍城一間酒店有男子在房內暈倒　送院後不治,2025-10-31 06:23,,2025-10-31 06:45,local,rthk,https://news.rthk.hk/rthk/ch/component/k2/1829475-20251031.htm,"一名男子在九龍城一間酒店房內暈倒，送院後不治。

事發在昨晚9時許，警方接獲男事主友人報案，指男事主在沙浦道30-38號富豪東方酒店一個房間內懷疑暈倒。警方到場後，發現一名52歲男子昏迷，遂送往廣華醫院治理，其後證實死亡。

警方表示，床上有懷疑血跡，死因有待驗屍後確定，現場沒有檢獲遺書。"
特朗普：中方領導人已授權開始大量採購美國大豆及高粱等農產品,2025-10-31 06:17,,2025-10-31 06:30,cinternational,rthk,https://news.rthk.hk/rthk/ch/component/k2/1829467-20251031.htm,"美國總統特朗普星期四在南韓釜山與國家主席習近平會面近兩小時後，在社交平台表示，中方領導人已授權開始大量採購美國大豆、高粱和其他農產品。

財長貝森特表示，作為與中國達成的貿易協議一部分，中方已同意在截至1月的本種植年度，購買1200萬噸美國大豆，並承諾在未來三年每年購買2500萬噸。

貝森特又說，雙方經貿團隊在吉隆坡完成有關短片分享程式TikTok的協議，中方已經批准TikTok的轉讓協議，預計協議將在未來幾星期和幾個月內得到推進。

特朗普上月簽署行政命令，宣布將TikTok美國業務出售給美國和全球投資者財團的計劃，符合國家安全要求，給予有關方面120日時間完成交易。母公司中國字節跳動將在TikTok美國業務中持股低於20%，以符合法律的要求。中國商務部在兩國元首會談後表示，將與美方妥善解決TikTok相關問題。"
"Wall Street indexes fall as Meta, Microsoft drag",2025-10-31 06:17,,2025-10-31 06:30,efinance,rthk,https://news.rthk.hk/rthk/en/component/k2/1829465-20251031.htm,"Wall Street's three major indexes lost ground on Thursday with the Nasdaq Composite and the S&P 500 leading losses as Meta and Microsoft shares tumbled on worries over surging AI spending, while investors also digested a more hawkish tone from the US Federal Reserve.

Meta shares sank 11.3 percent for their biggest one-day drop in three years after the social media company forecast ""notably larger"" capital expenses next year, thanks to investments in artificial intelligence.

Microsoft shares ended down 2.9 percent after the software company reported a record capital expenditure of nearly US$35 billion for its fiscal first quarter and warned that spending would rise this year.

In contrast, however, Google-parent Alphabet finished up 2.5 percent as steady growth in advertising and cloud computing powered better-than-expected results.

The results followed the Federal Reserve's delivery on Wednesday of a widely expected quarter-point rate cut but it raised doubts about future policy moves when Chair Jerome Powell said that another cut in December was not a ""foregone conclusion.""

This had led traders to pare back the odds of another cut in December to about 70 percent, down from more than 90 percent earlier in the week.

""Investors are in a risk-off mood after the market's been on a run. The S&P 500's near a record high but these technology earnings didn't meet the elevated expectations,"" said Lindsey Bell, chief strategist at 248 Ventures in Charlotte, North Carolina, also pointing to investor worries about the economic data vacuum due to the government shutdown and a more hawkish Fed.

Bell noted that neither Microsoft, Meta nor Alphabet ""was able to significantly clarify when we're going to get a return on the AI investments.""

However, after closing the regular session down 3 percent, Amazon shares were up 9 percent in late trading as strong demand for its cloud computing services countered weaker growth in its e-commerce business.

Apple shares rose in choppy after-the-bell trading following its report, which showed strong iPhone sales with some supply constraints.

The Dow Jones Industrial Average fell 109 points, or 0.2 percent, to 47,522, the S&P 500 lost 68 points, or 1 percent, to 6,822 and the Nasdaq Composite lost 377 points, or 1.6 percent, to 23,581.

Thursday's pullback followed record highs in the three major indexes during the past four sessions, lifted by optimism around quarterly earnings and expectations for a more accommodative monetary policy stance.

Meanwhile, a widely anticipated trade agreement between President Xi Jinping and US leader Donald Trump appeared to do little to boost stocks on the day.

Trump agreed to roll back some tariffs on Chinese imports in exchange for Beijing resuming soybean purchases, keeping rare earth exports flowing, and cracking down on fentanyl trafficking.

""When you get good news and markets don't react to it that tells you it's probably already discounted,"" said Jack McIntyre, portfolio manager at Brandywine Global. (Reuters)"
