title,date,summary,scrape_time,section,source,url,news_content
一名男子昨晚在金鐘被人用刀襲擊　施襲者逃去,2025-10-23 01:14,,2025-10-23 01:30,local,rthk,https://news.rthk.hk/rthk/ch/component/k2/1828338-20251023.htm,"金鐘昨晚發生傷人案，一名男子受傷。

昨晚10時許，一名男子在金鐘巴士總站被人用刀襲擊，施襲者逃去，男事主手部及背部受傷，送往瑪麗醫院治理。

警方表示，初步了解兩人互不相識，正在調查案件，暫時未有人被捕。"
英王查理斯三世國事訪問梵蒂岡　據報將與教宗良十四世公開祈禱,2025-10-23 01:09,,2025-10-23 01:15,cinternational,rthk,https://news.rthk.hk/rthk/ch/component/k2/1828337-20251023.htm,"英王查理斯三世啟程國事訪問梵蒂岡，期間將會晤教宗良十四世，據報兩人將會罕有地在公開場合一起祈禱。

查理斯三世與王后卡米拉當地星期三乘坐專機抵達意大利，隨後前往梵蒂岡，展開兩天的國事訪問行程。

路透社報道，查理斯三世與良十四世星期四將在西斯汀教堂參與彌撒，期間兩人將會一同禱告，是英國聖公會與羅馬天主教的領袖數百年來首次一起公開祈禱。

白金漢宮的聲明表示，查理斯三世此行標誌著英國聖公會與羅馬天主教關係的重要時刻。"
法國羅浮宮館長承認安保漏洞　稱閉路電視覆蓋範圍有盲點,2025-10-23 00:27,,2025-10-23 00:45,cinternational,rthk,https://news.rthk.hk/rthk/ch/component/k2/1828335-20251023.htm,"法國羅浮宮日前發生失竊事件，館長卡爾到參議院出席聽證會，承認羅浮宮的監控系統出現漏洞。

卡爾接受議員質詢時表示，羅浮宮內外安裝了大量閉路電視，案發時閉路電視正常運作，但閉路電視的覆蓋範圍不足，疑匪從監視盲點爬梯進入羅浮宮，導致失竊案發生。

卡爾承認館方未能及早發現可疑人士，案件亦揭露了羅浮宮的安保薄弱，她又說案發後曾經請辭，但被文化部拒絕。"
普京指揮海陸空戰略核力量演習　期間試射洲際彈道導彈,2025-10-22 23:51,,2025-10-23 00:15,cinternational,rthk,https://news.rthk.hk/rthk/ch/component/k2/1828334-20251022.htm,"俄羅斯舉行海陸空戰略核力量演習，由總統普京指揮，演習期間試射了多枚導彈、包括洲際彈道導彈。

俄羅斯克里姆林宮公布，軍方星期三舉行海陸空戰略核力量演習，由總統兼武裝力量最高統帥普京指揮。

演習期間，軍方在普列謝茨克航天發射場，向位於堪察加半島的庫拉靶場發射了一枚亞爾斯洲際彈道導彈；另外布良斯克號戰略核潛艇也發射了一枚深藍洲際彈道導彈。

軍方總參謀長格拉西莫夫向普京彙報演習的進展，俄方強調今次演習是例行訓練，旨在檢驗軍隊戰備水平，所有演習任務順利完成。"
鱷魚恤「二供一」供股集資逾5千萬元　作價折讓約23%,2025-10-22 23:17,,2025-10-22 23:30,cfinance,rthk,https://news.rthk.hk/rthk/ch/component/k2/1828333-20251022.htm,"鱷魚恤宣布以「二供一」方式供股集資，每2股獲發1股供股股份，供股價1.5元，較今日收市價折讓約23%。

公司預料，向合資格股東發行最多逾3553萬股供股股份，相當於經擴大後股份總數約33.3%。集資最多約5330萬元，扣除雜項開支後，集資淨額約5160萬元。

供股集資所得擬用於償還銀行借款及償付利息，公司認為，供股後可增強資本狀況，提供必要財務資源以應對未來挑戰。鑑於金融市場持續波動，以非包銷基準進行供股，可節省潛在包銷成本。

參與供股截止日期為11月13日，11月25日至12月2日可買賣未繳股款供股股份，12月12日公布供股結果，12月16日開始買賣繳足股款供股股份。"
警方於港島東區打擊非法駕車作出租或載客取酬   兩名男子被捕,2025-10-22 23:01,,2025-10-23 00:45,local,rthk,https://news.rthk.hk/rthk/ch/component/k2/1828332-20251022.htm,"港島總區交通部執行及管制組人員，在區內打擊非法駕駛汽車作出租或載客取酬用途，拘捕兩名男子，獲准保釋候查，下月下旬向警方報到。

管制組人員在東區喬裝乘客，截獲兩架懷疑涉嫌非法載客取酬的私家車，兩名本地男子涉嫌「利用汽車作非法出租或取酬載客用途」及「沒有第三者保險而使用汽車」被捕，兩部涉案私家車已被扣留作進一步檢驗。

根據《道路交通條例》，除非汽車獲發有效的出租汽車許可證，否則任何人不得駕駛或使用車輛作出租或載客取酬之用。首次定罪可判罰款1萬元及監禁6個月，再干犯則可處罰25000元及監禁12個月。"
港島總區交通部打擊非法駕駛汽車作出租或載客取酬　拘兩男,2025-10-22 23:01,,2025-10-22 23:15,local,rthk,https://news.rthk.hk/rthk/ch/component/k2/1828332-20251022.htm,"港島總區交通部執行及管制組人員，在區內打擊非法駕駛汽車作出租或載客取酬用途，拘捕兩名男子，獲准保釋候查，下月下旬向警方報到。

管制組人員在東區喬裝乘客，截獲兩架懷疑涉嫌非法載客取酬的私家車，兩名本地男子涉嫌「利用汽車作非法出租或取酬載客用途」及「沒有第三者保險而使用汽車」被捕，兩部涉案私家車已被扣留作進一步檢驗。

根據《道路交通條例》，除非汽車獲發有效的出租汽車許可證，否則任何人不得駕駛或使用車輛作出租或載客取酬之用。首次定罪可判罰款1萬元及監禁6個月，再干犯則可處罰25000元及監禁12個月。"
美國上星期原油庫存出乎意料減少近百萬桶,2025-10-22 22:58,,2025-10-22 23:15,cfinance,rthk,https://news.rthk.hk/rthk/ch/component/k2/1828331-20251022.htm,"美國能源信息署(EIA)公布，美國上星期原油庫存減少約96萬桶，市場原先估計增加逾120萬桶。

上星期汽油庫存減少約215萬桶，減幅遠高於預期的約81萬桶。

蒸餾油庫存減少約148萬桶，減幅低於預期的193萬桶。"
Beyond Meat早段再升逾1倍　曾觸發熔斷,2025-10-22 22:58,,2025-10-22 23:15,cfinance,rthk,https://news.rthk.hk/rthk/ch/component/k2/1828330-20251022.htm,"植物肉製造商Beyond Meat股價持續急升，一度觸發熔斷，股價較早時曾升1.1倍，過去兩個交易日股價都升逾1倍，連升4日累計升約13.8倍。

公司早前宣布，擴大在沃爾瑪的銷售網絡，並獲投資公司納入迷因主題ETF。

有分析認為，股價急升或因為平倉盤所致，但警告公司經營狀況仍面臨挑戰，近數年植物肉需求下降影響銷售，公司需要裁員及管理債務。分析指，考慮到公司財務指標，市場炒作或存在巨大風險。"
鱷魚恤：李寶安獲委任為主席林煒珊替任董事,2025-10-22 22:45,,2025-10-22 23:00,cfinance,rthk,https://news.rthk.hk/rthk/ch/component/k2/1828327-20251022.htm,"鱷魚恤公布，李寶安獲主席、執行董事兼行政總裁林煒珊，委任為她的替任董事，即日起生效，不會收取任何酬金。

李寶安現年69歲，他在2007年2月加入電視廣播有限公司，曾擔任行政總裁、副主席等職務，2021年5月辭任後至今，一直協助已故的麗新集團創始人林百欣，以及他的兒子已故林建名，處理兩人遺產事宜，並一直為香港及澳門一些家族辦公室管理投資。

李寶安在1987年底至2007年初，曾出任麗新集團執行董事，1992年至1996年亦曾擔任集團之前關聯公司亞洲電視行政總裁。"
全國勞動模範代表團與中學生交流　參觀數碼港及啟德體育園,2025-10-22 22:41,,2025-10-22 23:00,local,rthk,https://news.rthk.hk/rthk/ch/component/k2/1828329-20251022.htm,"全國勞動模範和大國工匠代表團繼續訪港行程，與中學生和市民交流，並前往數碼港及啟德體育園，了解香港在各領域的最新發展。

代表團早上到訪中華基金中學，在教育局副局長施俊輝陪同下，與該校學生對話，鼓勵認清目標，勇於追夢。代表團其後在創新科技及工業局副局長張曼莉陪同下到訪數碼港，並參觀了園區企業，了解香港人工智能產業的最新發展和成果。

代表團下午在體育專員蔡健斌及啟德體育園有限公司總監鄧竟成陪同下，參觀啟德體育園，了解體育園在推動香港體育發展和促進盛事經濟的重要角色；其後在晚上前往摩頓臺活動中心與市民會面，互動交流。

代表團明日上午將結束訪港行程，並前往澳門訪問。"
引進辦稱企業在港設研發中心可享稅務優惠加快技術落地商業化進程,2025-10-22 22:38,,2025-10-22 22:45,local,rthk,https://news.rthk.hk/rthk/ch/component/k2/1828328-20251022.htm,"引進重點企業辦公室主任任景信說，香港作為國際化城市，擁有成熟的科研基礎、健全的法治制度及多元人才環境，具備吸引全球頂尖科研人員的優勢，企業如在港設立研發中心，除可享受研發開支稅務優惠外，亦可申請創新及科技基金的資助，進一步降低研發成本，加快技術落地及商業化進程。

任景信聯同團隊星期日至今日訪問北京，他表示，引進辦的工作方向與施政報告高度契合，訪京行程緊扣政策重點，聚焦人工智能與數據科學以及先進製造及新能源，他又到訪一家市值逾人民幣4000億元的半導體頂尖企業，與企業代表進行深入交流，探討在香港設立區域研發中心的可能性，並建議以下一代處理器架構、人工智能芯片及高性能計算等技術為研發重點。

任景信又先後走訪多家專注於人工智能與數據科學的企業，期間到訪一家早前曾到港與引進辦交流的自動駕駛技術企業，邀請企業考慮在港設立國際總部，善用香港作為全球金融和研發中心的獨特優勢，加快拓展國際業務。

引進辦團隊今日下午結束訪問行程，任景信繼續留京，隨同財政司司長率領的訪問團前往北京城市副中心和河北雄安新區考察，了解當地在智慧城市建設及空間規劃方面的最新進展。"
Man with chronic illnesses and chikungunya fever dies,2025-10-22 22:15,,2025-10-22 22:45,elocal,rthk,https://news.rthk.hk/rthk/en/component/k2/1828319-20251022.htm,"A 77-year-old man with chronic illnesses who was earlier confirmed with chikungunya fever died on Wednesday, health authorities said. 

The man developed fever, joint pain and a rash after returning to Hong Kong from the mainland more than a week ago and sought medical attention at a private hospital. 

His condition deteriorated and the patient was transferred to the intensive care unit of Ruttonjee Hospital. 

The Centre for Health Protection said it’s extremely rare to see severe symptoms and deaths caused by the mosquito-borne disease, which has a mortality rate of less than one in a thousand.

“The occurrence of severe complications is mostly related to the patients' underlying health conditions. Elderly persons, young children, pregnant women and persons with chronic illnesses are at higher risk of developing complications after contracting chikungunya fever and may require a longer recovery period,” a spokesman said.

Hong Kong has recorded 42 chikungunya fever cases so far this year, all of which imported."
16歲少年疑「搵快錢」販毒被捕　警方另拘捕一男一女集團主腦,2025-10-22 21:51,,2025-10-22 22:15,local,rthk,https://news.rthk.hk/rthk/ch/component/k2/1828326-20251022.htm,"警方拘捕三人包括一名16歲少年，他們涉嫌「販運危險藥物」及「串謀販運危險藥物」，警方檢獲市值約1100萬元毒品。

警方西九龍總區重案組昨晚約8時，在深水埗通州街一幢大廈外截查一名形跡可疑的少年，並在他身上檢獲少量懷疑霹靂可卡因及懷疑氯胺酮。警方其後搜查該大廈一個單位，檢獲約1.3公斤懷疑霹靂可卡因及約22.3公斤懷疑氯胺酮，並拘捕這名16歲少年。

警方又在旺角亞皆老街拘捕一名58歲男子及一名43歲女子。調查顯示，兩人是販毒集團主腦，該集團涉嫌在網上以「搵快錢」作招徠，招募他人販運毒品，包括被捕少年。"
塞爾維亞議會外發生槍擊及縱火案　總統武契奇指事件為恐怖襲擊,2025-10-22 21:48,,2025-10-22 22:00,cinternational,rthk,https://news.rthk.hk/rthk/ch/component/k2/1828325-20251022.htm,"塞爾維亞首都貝爾格萊德國民議會大廈外發生槍擊和縱火案，造成1人重傷，一名男疑犯被警方拘捕。

衛生部長隆查爾在記者會表示，一群民眾原本在議會大廈外搭設帳篷，主張保持塞爾維亞社會正常運轉、反對全國封鎖。一名男子當地星期三到場向民眾開槍，他明顯經過訓練，多次開槍，隨後又縱火，引發帳篷起火。襲擊造成一人中槍重傷，要送院搶救，情況危急，火勢其後已受控。

襲擊發生後，總統武契奇提早從一個活動離開，他指事件是恐怖襲擊。當局正進一步調查案件。"
美股初段偏軟　蘋果回吐近1%　Netflix績後急挫逾8%,2025-10-22 21:40,,2025-10-22 22:00,cfinance,rthk,https://news.rthk.hk/rthk/ch/component/k2/1828324-20251022.htm,"美股3大指數初段偏軟，但跌幅有限。

道瓊斯指數較早時報46862點，跌62點，跌幅0.13%。

標普500指數報6727點，跌7點，跌幅0.11%。

納斯達克指數報22886點，跌67點，跌幅0.29%。

蘋果創新高後回吐，早段跌0.8%。

Netflix上季每股盈利遜預期，拖累股價急挫逾8%。"
國泰：未來數月續增加航班航點　快運日本航線需求未追上運力增幅,2025-10-22 21:26,,2025-10-22 21:45,local,rthk,https://news.rthk.hk/rthk/ch/component/k2/1828315-20251022.htm,"國泰航空及香港快運上月合共載客逾270萬人次，按年升20%。單計國泰載客量升21%至219.8萬人次，快運升逾16%至52.9萬人次。

首9個月國泰載客量升約27%至約2100萬人次，快運升約31%至580.8萬人次。期內，國泰乘客運載率升1.9個百分點至84.9%，快運則跌6.2個百分點至78.7%。

集團預料，隨著聖誕節及新年假期臨近，出行需求將持續增長，未來數月繼續增加航班及航點；今年冬季亦將增加北京、廣州、成都及上海航線班次，每周將營運逾330對往返香港與內地的航班。

至於快運方面，集團指，9月表現相對淡靜，但國慶假期臨近，帶動月底出行需求明顯回升。日本航線上月載客量超越去年同期，但需求仍未追上運力增長幅度。

另外，上月載貨量13.5萬公噸，按年升逾1%，因為運力增加，但按月則受颱風影響而回落。首9個月升逾10%至121.6萬公噸，貨物運載率跌1.1個百分點至58.2%。"
Turkey promises to help probe cargo plane crash: govt,2025-10-22 21:26,,2025-10-22 21:45,elocal,rthk,https://news.rthk.hk/rthk/en/component/k2/1828312-20251022.htm,"Secretary for Transport and Logistics Mable Chan said Turkish authorities have promised to support and cooperate in the investigation into a deadly cargo plane crash in Hong Kong on Monday.

The incident involved an Emirates cargo plane from Dubai which veered off the runway before crashing into a security patrol vehicle and pushing it into the sea, killing two staff members on board.

The aircraft was operated by Turkish freight carrier ACT Airlines on behalf of Emirates.

The transport minister said four crew members of the cargo plane have remained in Hong Kong to assist with the investigation, and she has met with Turkish officials to discuss further cooperation.

Chan said Turkish authorities have pledged to fully support the investigation and help Hong Kong communicate with the involved crew members and airline, and will also send experts to the SAR to assist with the probe. 

The US National Transportation Safety Board will also send investigators to the SAR to support the probe into the case. 

Fay Siu, who heads the Association for the Rights of Industrial Accident Victims, said the government should confiscate the crew members’ travel documents until the investigation is complete.

“In some situations, if the accused have not had their travel documents confiscated, they may leave Hong Kong, making it impossible for the government to process with the prosecution,” she said. 

“This allows those who violate the law to escape, which is very unfair to the family and does not let us see justice.” (Additional reporting by Reuters)"
30歲男子確診猴痘情況穩定　潛伏期內曾在台灣有高風險接觸,2025-10-22 21:25,,2025-10-22 21:45,local,rthk,https://news.rthk.hk/rthk/ch/component/k2/1828323-20251022.htm,"一名30歲男子確診猴痘，他本月11日出現皮膚潰瘍，本周一到衞生署容鳳書社會衞生科診所求診，現於瑪嘉烈醫院進行隔離，情況穩定。

衞生防護中心表示，患者沒有接種猴痘疫苗，他於潛伏期內曾在台灣有高風險接觸，中心暫未發現任何資料顯示這宗個案與本港早前錄得的其他猴痘確診個案有流行病學關連。

自2022年至今，本港共錄得81宗猴痘個案，當中今年錄得13宗，全部病人均為男性。流行病學調查顯示，絕大部分個案曾進行高風險性行為，香港至今未有發現新型猴痘病毒株的個案。"
九巴7條巴士線包括2條新路線將途經中九龍繞道油麻地段,2025-10-22 21:23,,2025-10-22 21:45,local,rthk,https://news.rthk.hk/rthk/ch/component/k2/1828322-20251022.htm,"九巴表示，根據巴士路線發展計劃，將有7條路線途經中九龍繞道油麻地段，包括開辦2條新路線33X往來荃灣西站至油塘、252S往來恒順園至觀塘碼頭；以及安排5條現行路線258X、259S、259X、268P及269S改行繞道。

九巴正為中九龍繞道油麻地段開通作最後準備，包括安排巴士測試路面和訓練車長，期望在有關路段啟用後盡快安排相關巴士路線行駛。

九巴相信，中九龍繞道油麻地段能夠有效減少來往九龍東與九龍西、新界西的行車時間，正研究將其他包括行駛將軍澳及新界西的巴士路線改經繞道，讓將軍澳及其他地區居民亦能受惠。"
丘應樺稱致力優化清關程序便利貿易　促進數字貿易與跨境電商發展,2025-10-22 21:20,,2025-10-22 21:45,local,rthk,https://news.rthk.hk/rthk/ch/component/k2/1828321-20251022.htm,"商務及經濟發展局局長丘應樺說，全球貿易體制轉變，監管制度碎片化及物流瓶頸對貿易流動構成窒礙，香港一直致力優化清關程序以便利貿易，並正推出「貿易單一窗口」，把貿易文件提交方式電子化。

丘應樺由土耳其轉抵格魯吉亞第比利斯，出席第五屆第比利斯絲綢之路國際論壇。他在專題討論環節表示，香港一直積極推動企業及貿易的數字化改革，持續推動國際社會參與有關數字經濟發展的討論，並在雙邊貿易協定談判中探討在協定內加入相關條文，以促進數字貿易和跨境電商的發展。

他與當地葡萄酒業界舉行商業圓桌會議，介紹香港作為葡萄酒及烈酒貿易樞紐的優勢，以及透過引進雙層烈酒稅制調低烈酒稅，促進高價值烈酒貿易和拍賣。雙方亦就探討兩地在葡萄酒和烈酒推廣方面進一步合作交換意見，讓格魯吉亞酒商利用香港作為平台，開拓中國內地市場。

丘應樺與格魯吉亞魯吉亞工商會代表會面時，介紹香港的最新發展及各項吸引投資和推動經濟發展的措施，鼓勵當地企業透過香港，把握「一帶一路」倡議和大灣區帶來的龐大商機。

結束當地行程後，丘應樺將轉赴北京，參與由財政司司長陳茂波率領的代表團展開訪問。"
Schools 'extra cautious amid flu outbreak',2025-10-22 21:10,,2025-10-22 21:45,elocal,rthk,https://news.rthk.hk/rthk/en/component/k2/1828307-20251022.htm,"Schools are raising their alertness and increasing the frequency of sanitation amid the current influenza outbreak, which has resulted in at least one fatality, the chair of the Hong Kong Direct Subsidy Scheme (DSS) Schools Council said.

The remarks by Dion Chen, also the principal of Ying Wah College, came after health officials on Wednesday reported that more than 580 schools encountered various degrees of a flu outbreak since the start of the academic year in September. 

Health Secretary Lo Chung-mau warned that the winter and summer flu seasons could overlap and called on parents to get flu jabs for their kids as soon as possible, saying the vaccination rate among infants remains relatively low.

""Since September, when the summer flu season began and schools reopened, there have been 12 children who, in less than two months, required hospitalisation due to severe flu, including admission to the intensive care unit, and one of them died,"" Lo said.

""This once again highlights the need for more schools to promptly arrange for pupils to receive the flu vaccine, and parents should do the same for their children.""

Chen said schools are taking extra precautions by following the Centre for Health Protection’s (CHP) advice and closely monitoring any potential outbreaks. 

“Especially like students when they come into the school, we need to take their temperature and also advise the parents to take the temperature before the students leave home,” he said.  

“And at the same time, we also closely observe the attendance rate and see how many students are absent due to flu symptoms. If it is a situation that we see a possible outbreak, we have to report to the CHP and let them know and then also ask them for advice.”"
美貿易代表：周三與財長赴馬來西亞　與中方會面討論稀土管制問題,2025-10-22 21:05,,2025-10-22 21:15,cinternational,rthk,https://news.rthk.hk/rthk/ch/component/k2/1828320-20251022.htm,"美國貿易代表格里爾表示，他和財長貝森特會在當地星期三前往馬來西亞，與中國官員會面，討論中國為限制稀土出口而採取的激進措施。

格里爾說，中方的舉措違反美中官員幾個月前作出、繼續供應高科技技術所需稀土的承諾，但仍有空間讓兩國以更平衡的方式進行貿易。

另外，貝森特接受美國財經頻道CNBC訪問時表示，總統特朗普與中國國家主席習近平的會晤日程中仍有空檔，但是否舉行會晤將由雙方共同決定。

在北京，外交部日前回應美方批評中國政府實施稀土出口管制時表示，中方出台的出口管制措施符合國際的通行做法，目的是更好地維護世界和平與地區穩定，履行防擴散等國際義務。"
日本爆發本季首宗禽流感疫情,2025-10-22 20:42,,2025-10-22 21:00,cinternational,rthk,https://news.rthk.hk/rthk/ch/component/k2/1828318-20251022.htm,"日本北海道一個家禽農場爆發高致病性禽流感疫情，是今個禽流感流行季以來日本報告的第一宗疫情。

農林水產省在公報中表示，北海道相關部門昨日接到白老町一個飼養了超過45萬隻蛋雞的農場報告，指出雞隻的死亡數量增加，禽流感簡易檢測結果呈陽性，今日經基因檢測確認這個農場的雞感染了高致病性禽流感病毒。

北海道地方政府表示，即日起採取防疫措施，包括撲殺染疫農場所有雞，並對農場周邊半徑3至10公里區域範圍內另外幾個農場的家禽採取不同程度限制措施。當局又會加強監控染疫農場周邊半徑10公里範圍內的野鳥。"
內地9月不包括在校生的16至24歲青年失業率跌至17.7%,2025-10-22 20:39,,2025-10-22 20:45,cfinance,rthk,https://news.rthk.hk/rthk/ch/component/k2/1828317-20251022.htm,"國家統計局數據顯示，9月全國城鎮不包括在校生的16至24歲勞動力失業率降至17.7%，創3個月新低。

9月全國城鎮不包含在校生的25至29歲勞動力失業率7.2%，維持8月時觸及的5個月高位；至於不包含在校生的30至59歲勞動力失業率連續3個月維持3.9%，連續3個月處於同一水平。

國家統計局本周一公布的數據顯示，9月全國城鎮調查失業率降至5.2%，按月回落0.1個百分點。"
