title,date,summary,scrape_time,section,source,url,news_content
許正宇赴斯洛文尼亞將出席雲集多國財金官員高級別會議,2025-09-21 14:37,,2025-09-21 15:15,local,rthk,https://news.rthk.hk/rthk/ch/component/k2/1823848-20250921.htm,"財經事務及庫務局局長許正宇晚上啟程出訪斯洛文尼亞和波蘭。
　　　
許正宇此行是應斯洛文尼亞副總理兼財政部長邀請，出席一個雲集歐洲聯盟委員會和歐元集團成員、多國財政部長或高級財金官員，以及財金專家的高級別會議，並參與專題討論。許正宇亦會出席當地最大商會舉辦的活動，推介香港的金融巿場優勢，吸引歐洲企業和投資者來港，並借助香港作為走入亞洲和中國巿場的理想地。
　　 
許正宇其後會轉往波蘭，到訪華沙證券交易所，與官員和商界人士會面。他也會參觀兩家已「出海」的中國企業，了解香港如何能更好發揮專業服務和作為國際三大金融中心之一的優勢，助力更多企業「出海」。
　　 
許正宇將於本月27日返抵香港。他離港期間，副局長陳浩濂將署任財經事務及庫務局局長。"
國際貨櫃碼頭及現代貨箱碼頭明天中午起停止所有貨櫃交收,2025-09-21 14:32,,2025-09-21 15:15,local,rthk,https://news.rthk.hk/rthk/ch/component/k2/1823847-20250921.htm,"香港國際貨櫃碼頭有限公司宣布，由於超強颱風樺加沙接近本港，四、六、七及中遠國際、亞洲貨櫃，明天中午12時停止所有貨櫃交收。

現代貨箱碼頭亦宣布，星期一中午12時開始暫停所有吉櫃及重櫃交收服務。"
澳門政府籲市民提前儲備3日用水和食品　留意疏散撤離路線,2025-09-21 14:21,,2025-09-21 14:45,greater_china,rthk,https://news.rthk.hk/rthk/ch/component/k2/1823846-20250921.htm,"澳門政府呼籲市民提前做好防風防災準備。

當局呼籲市民提前儲備足夠3日飲用的瓶裝水、生活用水，以及易保存的食品；颱風期間可能發生停電，請提前為手機等電子設備充電，以便及時獲取最新的颱風及應急資訊。市民應留意疏散撤離路線，以及附近避險中心位置，確保在有需要時能夠迅速安全撤離。

當局又提醒市民提前準備輕便應急包，包含證件、藥物、飲用水、乾糧及重要財物，以便迅速撤離；如居住區域已有水浸情況，應避免使用地下通道及地下停車場，並盡早撤離至安全地點。

當局表示，樺加沙正逐漸逼近，預計將於星期三影響廣東省及澳門地區，有機會出現與「天鴿」和「山竹」水平相若的風暴潮水浸。"
樺加沙將影響澳門　當局籲市民提前儲備3天飲用水和食品,2025-09-21 14:21,,2025-09-21 15:15,greater_china,rthk,https://news.rthk.hk/rthk/ch/component/k2/1823846-20250921.htm,"澳門當局表示，超強颱風樺加沙正逐漸逼近，預計將於星期三影響廣東省及澳門地區，有機會出現與「天鴿」和「山竹」水平相若的風暴潮水浸，呼籲市民提前做好防風防災準備。

當局呼籲市民提前儲備足夠3日飲用的瓶裝水、生活用水，以及易保存的食品；颱風期間可能發生停電，請提前為手機等電子設備充電，以便及時獲取最新的颱風及應急資訊。市民應留意疏散撤離路線，以及附近避險中心位置，確保在有需要時能夠迅速安全撤離。

當局又提醒市民提前準備輕便應急包，包含證件、藥物、飲用水、乾糧及重要財物，以便迅速撤離；如居住區域已有水浸情況，應避免使用地下通道及地下停車場，並盡早撤離至安全地點。"
天文台：大埔區雨勢特別大　可能嚴重水浸　市民應採預防措施,2025-09-21 14:12,,2025-09-21 14:30,local,rthk,https://news.rthk.hk/rthk/ch/component/k2/1823845-20250921.htm,天文台發出局部地區大雨提示，表示大埔區的雨勢特別大，有可能出現嚴重水浸。可能受影響之市民，應採取適當的預防措施，以防止水浸可能引致的損失。上述區域已錄得或預料會有每小時雨量超過70毫米的大雨。
廣東氣象部門料樺加沙以強颱風或超強颱風級在廣東中西部沿海登陸,2025-09-21 13:50,,2025-09-21 14:15,greater_china,rthk,https://news.rthk.hk/rthk/ch/component/k2/1823844-20250921.htm,"廣東氣象部門預計，超強颱風樺加沙將於明日凌晨進入南海東北部海面，趨向廣東。受其影響，星期二至四廣東海陸將有一次嚴重風雨影響。

樺加沙較大可能星期三凌晨至下午，以強颱風或超強颱風級，在廣東中西部沿海地區登陸。

氣象部門提醒，樺加沙強度極強、風圈範圍大，具有極端性，將為南海中北部海面、廣東海面及市縣帶來嚴重風雨浪潮影響，需提前做好巨災防禦準備。"
HK can excel in offshore RMB business: FS,2025-09-21 13:40,,2025-09-21 14:00,elocal,rthk,https://news.rthk.hk/rthk/en/component/k2/1823834-20250921.htm,"Financial Secretary Paul Chan on Sunday said Hong Kong should work on developing its offshore renminbi trading sector amid the increased international use of the currency.

The SAR’s unique contribution to national development is to serve as an international financial hub under the “One Country, Two Systems” principle, which cannot be replicated by any other mainland city, he said.

Speaking on a Commercial Radio programme on Sunday, Chan said more countries are now using the renminbi.

“We are the largest offshore renminbi business hub in the world. The renminbi can be exchanged freely here with various investment tools and products. Investors can buy stocks using renminbi in Hong Kong and vitalise their money via the Southbound Scheme,” he said.

“There are also different risk management tools as well... we should do well in the offshore renminbi business.”

Meanwhile, Chan said Hong Kong has sufficient land supply in the coming 10 years and the government was also building up its land reserves to ensure a stable supply of land depending on the market’s demand.

He also said in a blog post that a Northern Metropolis working group led by him, which focuses on devising development and operation models, would hold its first meeting this month.

The government would also shift to a “two-envelope approach” for tendering from the conventional “highest bidder wins,” Chan said.

Such an approach would require enterprises to submit their development plans so the government could consider their potential economic benefits, he said."
Northern Metropolis investment will pay off: CE,2025-09-21 13:28,,2025-09-21 14:00,elocal,rthk,https://news.rthk.hk/rthk/en/component/k2/1823838-20250921.htm,"Chief Executive John Lee on Sunday said investment in the Northern Metropolis would bring long-term benefits to the public, stressing that such spending would pay off for citizens.

Speaking on a TVB programme about his Policy Address, Lee said the government would speed up the development of the Northern Metropolis, but acknowledged there are bottlenecks, including funding. 

He called for more market participation in the project. 

He added that despite the government’s fiscal deficit, it must continue to push ahead with large-scale developments. 

He cited the Science Park as an example. 

“If we didn’t invest, then there wouldn’t be a Science Park here allowing us to have today’s innovation and technology development. So these investments have returns, and the dividends will also go back to the citizens,” he said.

Asked how the government would ensure the Northern Metropolis does not become just another property project, Lee said the government has the final say on land use. 

“Agree or not, the power rests with me. For housing units, we will be very strict. For industries, it’s different — industries are measured by value. If a production line creates, for example, 5,000 jobs, I can calculate the income per worker, the economic impact on upstream and downstream sectors — I have experts for that. When I approve a piece of land for a project, of course the decision rests with me,” he said."
施政報告2025｜特首稱曾考慮增濫用輸入外勞罰則但憂殺錯良民,2025-09-21 13:12,,2025-09-21 14:00,local,rthk,https://news.rthk.hk/rthk/ch/component/k2/1823843-20250921.htm,"施政報告提出，僱主透過「補充勞工優化計劃」申請輸入侍應生及初級廚師，本地招聘時間延至6星期。行政長官李家超在一個電視節目被問到，能否提高濫用有關機制的罰則，例如徵收罰款。李家超回應，曾經有考慮，但關注會否「殺錯良民」，加上食肆經營困難，將「百上加斤」。

他強調，會動態檢視，相信濫用有關機制的情況會減少，但不會「鐵板一塊」，需要靈活。

另外，施政報告提出建立部門首長責任制，並完善教師註冊機制。李家超說，公務員一向都要問責，但為何市民仍認為並無問責，他分析後相信是由於過往機制不清晰。

被問到完善教師註冊機制會否擴展至律師、醫護等專業人士，李家超強調，不會「為做而做」。"
施政報告2025｜李家超稱北都投資有回報紅利落於市民,2025-09-21 13:03,,2025-09-21 13:15,local,rthk,https://news.rthk.hk/rthk/ch/component/k2/1823842-20250921.htm,"新一份施政報告表明加快北部都會區發展。行政長官李家超在一個電視節目表示，北都發展有數個瓶頸，包括涉及資金及土地開發。

李家超指出，北都佔整個香港約三分之一土地面積，以當年發展機場為例，佔地不多於全港2%，形容有如「巨人與普通人」，因此施政報告提出重點發展北都，需要引入不同資金。

他以機場發展為例，成立並注資法定機構機管局，屬成功發展模式。若按北都土地面積計算，意味或要成立不少類似機管局的法定機構，以助發展。對於現時政府面對財赤，李家超強調，投資是有回報，紅利落於市民，又以科學園情況為例，認為有助本港的創科發展。

至於如何避免北都淪為住宅項目，李家超強調，會採取「產業綁定」，批地決定權在政府，會考慮整體經濟效益；強調北都並非「房樓政策」，屬「升好多呢」的重要發展項目。

李家超又希望項目越快達標越好，同時會訂立優次。他說，由於項目龐大，現階段任何估算均不會正確，在集中精力發展下，相信能加快速度。他指出，北都項目有如提供「滿漢全席」，不是只煮「一碟菜」。"
逾200名藥劑師完成基礎培訓　將在社區藥房接種疫苗,2025-09-21 12:59,,2025-09-21 13:15,local,rthk,https://news.rthk.hk/rthk/ch/component/k2/1823841-20250921.htm,"港大醫學院與藥廠簽訂合作備忘錄推展藥劑師疫苗接種培訓，超過200名藥劑師已完成基礎培訓，當中超過30人獲得證書，將會在社區藥房提供疫苗接種服務，以流感疫苗為主。

根據計劃，藥劑師完成指定時數工作坊及網上自學，通過測驗及評估，再在監督下成功為5名患者接種疫苗，可獲發為期2年的證書。

港大醫學院藥理及藥劑學系教授黃志基表示，藥劑師在全球疫苗接種工作中的角色不斷擴展，全球已經有36個國家立法支持藥房提供疫苗接種服務。研究亦顯示藥劑師參與可以顯著提升疫苗覆蓋率。黃志基相信，藥劑師介入可將疫苗接種可能性提高近60%，社區藥房接種可增加17%至20%。"
南韓指北韓籌備下月建黨80周年舉行閱兵儀式,2025-09-21 12:50,,2025-09-21 13:00,cinternational,rthk,https://news.rthk.hk/rthk/ch/component/k2/1823839-20250921.htm,"南韓政府消息人士說，政府捕捉到北韓在平壤美林機場附近籌備勞動黨建黨80周年紀念閱兵儀式的跡象。

消息人士表示，衛星7月初起在美林機場附近閱兵訓練場的上空，捕捉到疑似為隊列、移動式發射台的車輛和設備等，推測平壤可能在籌備下月10日，勞動黨建黨80周年紀念閱兵。從人員和設備規模推測，閱兵規模將遠超以往。
另外，南韓政府掌握到多國高層人士已接受邀請，預計出席相關紀念活動。據悉，北韓自年初起向多國政要發出邀請。領袖金正恩月初出席中國舉行的抗戰勝利紀念活動，中國國家主席習近平是否會對北韓進行回訪，備受關注。"
白宮稱美中就分拆TikTok美國業務達協議　中方暫時未有回應,2025-09-21 12:32,,2025-09-21 13:00,greater_china,rthk,https://news.rthk.hk/rthk/ch/component/k2/1823837-20250921.htm,"美國白宮表示，美中就分拆TikTok美國業務達成協議，可能在數日內簽署。

發言人萊維特說，日後TikTok的美國董事會七名成員當中美國人佔六席，美國用戶的數據會儲存在美國，演算工具也會由美國控制。

中方暫時未有回應。《人民日報》就發表評論文章，強調任何通過施壓迫使中國做出原則性讓步的想法，都是不切實際。美方應取消單方面貿易限制措施，防止衝擊雙方來之不易的磋商成果。"
施政報告2025｜特首：北都發展樽頸包括資金　冀市場更多投入,2025-09-21 12:24,,2025-09-21 12:45,local,rthk,https://news.rthk.hk/rthk/ch/component/k2/1823835-20250921.htm,"行政長官李家超表示，北都發展有幾個樽頸包括資金等，希望市場有更多投入。至於財赤下推進大型發展項目，李家超強調投資是有回報，紅利將落於市民。

對於如何避免北都淪為住宅項目，李家超說，會採取「產業綁定」，重申批地決定權在政府。"
天文台：本港周三吹烈風至暴風　離岸及高地可能達颶風,2025-09-21 11:35,,2025-09-21 12:00,local,rthk,https://news.rthk.hk/rthk/ch/component/k2/1823832-20250921.htm,"天文台表示，按照目前預測，超強颱風樺加沙會在未來一兩日繼續增強，橫過呂宋海峽一帶並進入南海北部，逐漸靠近廣東沿岸。雖然星期一本港天色短暫好轉及酷熱，但海有湧浪。星期二稍後天氣開始轉壞，星期三吹烈風至暴風，離岸及高地可能達颶風，天氣惡劣，有狂風大驟雨及雷暴，海有非常巨浪及湧浪。

由於受顯著風暴潮影響，屆時沿岸水位可能與2017年的天鴿及2018年的山竹相若。市民請密切留意天文台的最新天氣消息，並儘快做好一切防風、防水浸準備。"
施政報告2025｜陳茂波：雙信封制是北都實現產業綁定重要手段,2025-09-21 11:17,,2025-09-21 11:30,local,rthk,https://news.rthk.hk/rthk/ch/component/k2/1823831-20250921.htm,"財政司司長陳茂波在網誌表示，「北都發展委員會」下設三個工作組，由他帶領的「發展及營運模式設計組」將於本月召開首次會議，強調工作組目標是按北都各指定發展區的性質及規模，設計發展及營運模式，包括會適當將相關土地招標由「價高者得」轉向採用「產業綁定」的「雙信封制」。

陳茂波解釋，「雙信封制」有別於傳統一般土地招標「價高者得」，將要求投標企業提交技術方案及發展計劃，讓政府能更全面考慮相關企業落戶發展帶來的投資與技術、經濟與稅收貢獻等，是北都實現「產業綁定」的重要手段。

他又說，工作組會設計不同融資方案，包括政府注資及「土地參股」等；以「土地參股」為例，其中方式是為個別項目成立公司，由政府注入土地、企業負責資金及建築等，以共同開發，充分利用市場資源，加速項目推進，亦減輕政府在土地平整及基建等前期工作的財政承擔。

對於政府會制訂促進產業和投資的「優惠政策包」，陳茂波說，全球爭取優質及龍頭企業落戶競爭激烈，在香港簡單低稅制基礎上，可透過政策創新、彈性靈活與目標企業洽談，並按個別情況運用「優惠政策包」內工具，例如批撥土地、優惠地價、稅務優惠等。

他指出，處理個別個案時，包括重點考慮相關企業落戶能為本港經濟、以至日後稅收能帶來多大效益。投資推廣署及引進重點企業辦公室會跟相關企業洽談，進行盡職審查及取得有關政策局支持，最後向他匯報以作決定。他又說，引進辦很快將公布新一批伙伴企業，當中不少是世界級的醫藥企業。"
施政報告2025｜陳茂波：港股向好但未在零售餐飲業完全反映,2025-09-21 11:12,,2025-09-21 11:30,local,rthk,https://news.rthk.hk/rthk/ch/component/k2/1823830-20250921.htm,"財政司司長陳茂波表示，近期住宅樓價穩住了，申請補地價發展項目也增加，開工再次活躍，尤其是近日一些一手樓賣得不錯，開始消化部分住宅庫存，相信再加上減息，當大家有信心，二手市場再次活躍，市面氣氛會所改善，市民就會放心些消費。

談及土地儲備，陳茂波在電台節目說，「明日大嶼不做」，但同時間未來十年的土地供應已物色並推展中，政府開始建立一些土地儲備，但同時不需要太多土地儲備，因為會綁著不少資金。他認為，建立了土地儲備，要把土地有節奏按著市場情況推出，令供應穩定，同時不會擔心突然之間會不會「超多供應」，以致對市場有太負面影響，因此當局會很謹慎。

陳茂波承認，近期本港股市向好，但未曾在零售餐飲業完全反映、給予帶動作用，不過，他說，近幾個月零售業情況平穩了，季節性波幅不超過1%。

他說，近來市場氣氛好轉，多了外國遊客來港，本港未來幾月會有很多盛事活動，這是本港努力方向。"
天文台：大埔區雨勢特別大　有可能出現嚴重水浸,2025-09-21 10:35,,2025-09-21 10:45,local,rthk,https://news.rthk.hk/rthk/ch/component/k2/1823829-20250921.htm,黃色暴雨警告信號生效。天文台發出局部地區大雨提示，表示大埔區的雨勢特別大，有可能出現嚴重水浸。可能受影響之市民，應採取適當的預防措施，以防止水浸可能引致的損失。有關區域已錄得或預料會有每小時雨量超過70毫米的大雨。
施政報告2025｜孫東：針對與市民生活痛點最集中範疇應用AI,2025-09-21 10:25,,2025-09-21 10:45,local,rthk,https://news.rthk.hk/rthk/ch/component/k2/1823827-20250921.htm,"施政報告提出在2026年内推出涵蓋100個政務環節的人工智能工具。創新科技及工業局局長孫東表示，數字政策辦公室正準備相關的AI技術方案，會優先選擇與市民接觸面最大及最廣的部門先做，例如根據1823服務的數據，分析哪些部門收到最多市民的投訴或建議，針對與市民生活痛點最集中的範疇應用AI。

孫東在電台節目說，現時已有超過24000名公務員正使用本港自主研發的人工智能大模型「港文通」，大部分部門開始使用「港會通」，亦有一部分公務員正試用「港話通」進行搜索或生成解決方案，計劃今年内透過智方便平台，將「港話通」推出市場，盡快讓市民使用。

對於施政報告中特別提到，運用創科基金引入新科研技術義肢，推出兩年計劃，全額資助在本港截肢的人士免費配置使用新科技義肢。孫東說，行政長官李家超去年出訪杭州期間，向杭州六小龍企業發出邀請，希望他們來港發展，其中宇樹科技已與本港一間大學簽署合作協議，建立聯合實驗室，強腦科技亦在香港成立公司，準備建立研發中心及在港上市。

孫東說，政府是採取「場景招商」的模式，希望為來港企業提供應用場景，今次是透過公營機構進行試用計劃，通過強腦科技與本地大學合作，醫管局及勞福局協助轉介個案，為本港合資格患者免費提供義肢，每個義肢價格約10萬元，患者一般透過兩個月的訓練就可以使用，形容是一項拉近高科技與市民需求距離的項目。"
施政報告2025｜陳茂波：本港要做好離岸人民幣業務,2025-09-21 10:15,,2025-09-21 10:30,local,rthk,https://news.rthk.hk/rthk/ch/component/k2/1823826-20250921.htm,"財政司司長陳茂波強調香港要做好離岸人民幣業務。

他出席電台節目時表示，過去幾年不同國家考慮到新一屆美國政府的行徑，地緣政治因素，要分散風險，多了人儲蓄黃金及人民幣。香港的角色是做全球最大離岸人民幣中心，因為在香港可自由兌換人民幣，亦有不同的投資工具、投資產品可以人民幣買賣，亦可以通過「南向通」來盤活。

陳茂波又說，進一步強化股票市場，要開拓更多好的上市公司、國際企業來港上市，包括中東及東南亞公司。他自己外訪時，亦鼓勵交易所跟對方簽多些互認協議，令這些公司來港上市時，也可以同時在其他地方上市，例如同時在香港及新加坡上市。"
澤連斯基指烏克蘭多處受俄軍空襲　至少3死30多人傷,2025-09-21 09:43,,2025-09-21 10:15,cinternational,rthk,https://news.rthk.hk/rthk/ch/component/k2/1823825-20250921.htm,"烏克蘭總統澤連斯基表示，俄羅斯發動大規模空襲，造成至少3人死亡，30多人受傷。

他表示，烏克蘭各地區都成為襲擊目標，批評是一項蓄意戰略，目的是要恐嚇平民並摧毀基礎設施。有報道指，一枚導彈直接擊中一座住宅大樓。

烏克蘭空軍稱，莫斯科發射6百多架無人機和導彈。

俄羅斯國防部表示，今次大規模襲擊使用了精確武器，瞄準軍事設施。

俄羅斯又指，薩馬拉地區受到烏克蘭無人機襲擊，造成4人死亡。基輔方面說，攻襲當地一座大型煉油廠。"
施政報告2025｜孫東：香港適合發展「中試產業」,2025-09-21 09:34,,2025-09-21 10:15,local,rthk,https://news.rthk.hk/rthk/ch/component/k2/1823823-20250921.htm,"施政報告提出要加快引進境外新興產業，帶動經濟多元發展。創新科技及工業局局長孫東表示，以產業發展為導向是本屆政府施政的重要方向，但香港地方少、人工貴，發展先進製造業的成本較高，必須要找真正適合香港發展的產業落戶。他說團隊引進企業時，會嚴格要求企業的價值、對本港經濟的促進作用，亦要為本地提供就業職位。

孫東在電台節目指出，香港適合發展「中試產業」，即是處理產業大量生產前的最關鍵技術，既符合香港的特點，也能為本港帶來一定收入。他又提到，特區政府扶植的企業，從去年的200多家已增加至今年近500家，當中包括本地企業及從外地引進的企業。

施政報告提出加快發展北部都會區，包括靈活批撥土地，推動企業落戶和投資。孫東表示，希望在不影響土地價值的大前提下，通過一些合理安排，使企業能以可承受的價格先入場，當局正以幾個項目作為試點，相信今年會有幾間企業採用這種優惠措施，隨著創科產業未來發展愈趨成熟，還有會與勞工相關的政策陸續推出。"
施政報告2025｜孫東：香港適合發展「終試產業」,2025-09-21 09:34,,2025-09-21 09:45,local,rthk,https://news.rthk.hk/rthk/ch/component/k2/1823823-20250921.htm,"施政報告提出要加快引進境外新興產業，帶動經濟多元發展。創新科技及工業局局長孫東表示，以產業發展為導向是本屆政府施政的重要方向，但香港地方少、人工貴，發展先進製造業的成本較高，必須要找真正適合香港發展的產業落戶。他說團隊引進企業時，會嚴格要求企業的價值、對本港經濟的促進作用，亦要為本地提供就業職位。

孫東在電台節目指出，香港適合發展「終試產業」，即是處理產業大量生產前的最關鍵技術，既符合香港的特點，也能為本港帶來一定收入。他又提到，特區政府扶植的企業，從去年的200多家已增加至今年近500家，當中包括本地企業及從外地引進的企業。

施政報告提出加快發展北部都會區，包括靈活批撥土地，推動企業落戶和投資。孫東表示，希望在不影響土地價值的大前提下，通過一些合理安排，使企業能以可承受的價格先入場，當局正以幾個項目作為試點，相信今年會有幾間企業採用這種優惠措施，隨著創科產業未來發展愈趨成熟，還有會與勞工相關的政策陸續推出。"
天文台發出黃色暴雨警告信號,2025-09-21 09:10,,2025-09-21 09:30,local,rthk,https://news.rthk.hk/rthk/ch/component/k2/1823822-20250921.htm,天文台早上9時10分發出黃色暴雨警告信號。
