title,date,summary,scrape_time,section,source,url,news_content
議政四方｜林健鋒稱香港可聯同內企將產業或服務帶往中東,2025-05-14 11:39,,2025-05-14 11:45,local,rthk,https://news.rthk.hk/rthk/ch/component/k2/1804553-20250514.htm,"本屆特區政府積極推動招商引資，行政長官李家超正率領代表團在中東訪問。日前有份隨團的行政會議成員、商界立法會議員林健鋒表示，香港是一個非常好的平台，將資金帶到香港，亦能協助內地企業「走出去」。

林健鋒接受本台節目《議政四方》時說，中東國家例如卡塔爾希望到不同地方投資，而香港可提供平台，特別香港低稅制、行普通法等，都很有優勢，同時香港亦可聯同內地企業，將產業或服務帶到卡塔爾或其他中東國家。

另外，法國領先航空服務公司早前與機管局簽訂合作備忘錄，有意在港拓展業務，林健鋒說，該公司的業務廣泛，除了飛機拆卸工程，亦包括環保服務等。他透露該公司決定落戶香港前經過一些討論及交流，現時正考慮在港設立家族辦公室。

林健鋒認為，法國領先航空服務公司在港落戶，能加強香港國際航空樞紐的地位，例如在港設立航空訓練學院，培訓相關人才，同時由於國家正大力發展航空事業，需要大量人才，相信香港可為國家作出貢獻。"
Govt to cut quarantine period for pets from mainland,2025-05-14 11:27,,2025-05-14 11:45,elocal,rthk,https://news.rthk.hk/rthk/en/component/k2/1804550-20250514.htm,"The government said the quarantine period for cats and dogs entering Hong Kong from the mainland will be cut from 120 days to 30, starting early next month. 

The Agriculture, Fisheries and Conservation Department said pet owners will need to submit proof the animals have been chipped and vaccinated for rabies -- as well as an animal health certificate issued by vets on the mainland.

Speaking on RTHK's Hong Kong Today programme, chairwoman of the Animal Rights and Welfare Association, Susan Lai, told Carol Musgrave that she welcomed the decision to shorten quarantine for pets.

""Reducing the quarantine duration [reduces] the stress and discomfort animals may experience during the long periods of confinement, promoting better welfare for pets... and shortening the quarantine aims to create a clearer lawful pathway for pet owners, which can help reduce illegal importation.""

Lai also said the government should strengthen legislation to deter the smuggling of pets and animals in general.

""The government must still strengthen regulation like increasing [the] smuggling penalty and strengthening enforcement to prevent smuggling while continuing to improve the quarantine policies that balance public health, animal welfare, and also pet-friendly practices."""
立法會內會明早討論審議《維護國家安全條例》附屬法例工作,2025-05-14 11:20,,2025-05-14 11:45,local,rthk,https://news.rthk.hk/rthk/ch/component/k2/1804547-20250514.htm,"立法會內會明早召開特別會議，討論有關審議《維護國家安全條例》附屬法例工作。

特區政府根據國安條例110條訂立兩項附屬法例，就駐港國安公署的職責條文訂明具體細節，同時將公署的履職場所列為禁地。兩項附例昨日已刊憲，並即時生效。

附屬法例將會在立法會進行「先訂立，後審議」程序，特區政府表示會推動盡快完成審議。"
國台辦指民進黨當局向美國下跪求饒　稱兩岸應攜手維護民族尊嚴,2025-05-14 11:14,,2025-05-14 11:45,greater_china,rthk,https://news.rthk.hk/rthk/ch/component/k2/1804546-20250514.htm,"在北京，國台辦新聞發言人陳斌華回應近日新台幣匯率暴漲情況。被問到有輿論認為或是美方要求台幣主動升值，以降低對台貿易逆差，陳斌華說面對美國對台關稅霸凌、極限壓榨，民進黨當局早已高舉白旗下跪求饒，批評賴清德提出的應對策略，包括對美大採購、大投資的討好方案是「賣台跪美」，強調面對共同風險挑戰，兩岸中國人應攜手維護發展權利和民族尊嚴。

被問到有報道指，民進黨當局加緊採購愛國者導彈，陳斌華說無論民進黨當局買多少武器、搞多少演習，都改變不了「台獨」死路一條的下場，更阻擋不了祖國必然統一的歷史大勢，又批評民進黨當局及政客為了謀取政治私利，一方面鼓噪「抗中保台」，一再「挑釁引戰」，全然不顧民眾死活，形容是拉台灣同胞為「台獨」墊背。"
「最窮總統」烏拉圭前總統穆希卡病逝,2025-05-14 11:10,,2025-05-14 11:15,cinternational,rthk,https://news.rthk.hk/rthk/ch/component/k2/1804544-20250514.htm,"烏拉圭前總統穆希卡病逝，終年89歲。

現任總統奧爾西在社交平台宣布消息，感謝他對人民的愛。

多個南美洲地區領袖悼念穆爾卡。巴西總統盧拉形容穆希卡捍衛民主，從未停止倡導社會正義和消除不平等。

穆爾卡2010年至2015年擔任烏拉圭總統，任內推行多項在當地具有開創性的公民自由議題，包括簽署容許同性婚姻和懷孕早期墮胎的法律，並支持大麻銷售合法化。

有別與一般國家元首，穆爾卡生活簡撲，任內拒絕入住總統官邸，擇居於首都郊區一個農場，捐出絕大部分總統薪金，被傳媒形容為最窮總統，但他深受烏拉圭民眾愛戴。

穆希卡於2024年確診食道癌，今年初癌細胞擴散後決定停止治療，最終在日前病逝。"
衞生署稱社區牙科支援計劃聚焦幫助弱勢社群,2025-05-14 10:51,,2025-05-14 11:15,local,rthk,https://news.rthk.hk/rthk/ch/component/k2/1804543-20250514.htm,"衞生署將於本月26日推出社區牙科支援計劃。

衞生署社區牙科服務高級牙科醫生王詠詩在本台節目《千禧年代》表示，計劃希望聚焦幫助較難獲得服務的弱勢社群，特別是有經濟困難的群組。參與計劃人士須持有香港身份證，並已登記加入醫健通，長者生活津貼的受惠人或其他指定社署受助人士，以至獲醫管局全數或部分減免醫療費用的病人。

王詠詩提到，參與計劃人士可透過計劃網頁，尋找服務機構，聯絡相關牙科診所預約，服務包括X光檢查、有需要時提供止牙痛藥物，以至補牙或拔牙，每人每180日有3個限額。

她表示，計劃中現時於全港18區有77個服務點，署方期望參與人士能夠於一個月內取得服務，參加者每次補牙或拔牙，每隻牙要繳付50元行政費，至於合資格人士則可獲豁免。

被問到部分地區較少診所，例如南區、北區及屯門區，各只得一間診所，王詠詩解釋，今次計劃是邀請非政府組織參與，所以未必平均分配18區，署方會繼續視乎使用量，倘部分地區有需要，不排除再邀請非政府組織參加。"
日股半日倒跌0.8%　失守38000點水平,2025-05-14 10:41,,2025-05-14 11:15,cfinance,rthk,https://news.rthk.hk/rthk/ch/component/k2/1804537-20250514.htm,日股先升後回，日經指數失守38000點水平，半日收報37874點，跌308點，跌幅0.81%。
《環看天下》：美國容許南非白人以難民身份入境　措施惹爭議,2025-05-14 10:41,,2025-05-14 11:15,cinternational,rthk,https://news.rthk.hk/rthk/ch/component/k2/1804541-20250514.htm,"首批獲美國給予難民身份的南非白人，日前抵達華盛頓。

美國總統特朗普今年1月再度入主白宮，之後一方面收緊移民政策，另一方面放寬南非白人透過難民申請移居美國，做法引起爭議。

美國同南非關係近月明顯轉差。特朗普政府早前指控南非當局更改土地政策，損害白人地主的權益，甚至形容當地白人正面臨「種族滅絕」。南非否認白宮的指控。"
特朗普透露已有與中國達成「非常強大」貿易協議的藍圖,2025-05-14 10:39,,2025-05-14 10:45,greater_china,rthk,https://news.rthk.hk/rthk/ch/component/k2/1804540-20250514.htm,"美國總統特朗普透露，美國已經描繪出藍圖，與中國達成一項「非常強大」的貿易協議，這項協議將令中國向美國企業開放。

特朗普接受霍士新聞訪問時表示，他們已經與中國就一個非常強大協議定出範圍。當中最令人振奮的部分，是中國對美國企業開放，但他沒有詳細說明。

他又說，可以預見自己與中國國家主席習近平，就中美貿易協定的最終細節直接交涉。"
港股曾升逾300點　恒生銀行股價反覆,2025-05-14 10:38,,2025-05-14 10:45,local,rthk,https://news.rthk.hk/rthk/ch/component/k2/1804536-20250514.htm,"港股升逾300點後升幅收窄，恒生指數曾升逾340點，較早時報23361點，升253點，升幅1.1%。

科技指數較早時升約1.5%。騰訊音樂績後升12%，暫時是升幅最大科指成份股。

國家市場監管總局就市場競爭問題，約談京東集團、美團、阿里巴巴旗下餓了麼等外賣平台，相關發展備受市場關注。

另外，汽車、金融股造好，內房、公用股偏軟。

據報恒生銀行多個部門裁員，股價走勢反覆。"
孫玉菡稱廣東計劃如果口碑好　參與人數會有不少增長空間,2025-05-14 10:37,,2025-05-14 10:45,local,rthk,https://news.rthk.hk/rthk/ch/component/k2/1804539-20250514.htm,"勞工及福利局局長孫玉菡說，今年年中左右會推出計劃，為廣東院舍照顧服務計劃下長者分擔醫療費用，購買了內地醫保、居住在15間指定院舍的長者，每年可獲1萬元門診費用資助，住院費用資助就有3萬元。

孫玉菡在本台電視節目《盤點政策》表示，內地醫藥費較香港便宜，相關資助額已夠長者應付開支，同時希望提供更大誘因讓長者選擇北上到院舍養老。他表示，截至去年底有300多名長者參與廣東院舍計劃，比起他上任時的100多人已大幅增加，相信如果計劃的口碑好，參與人數會有不少增長空間。

當局早前建議修例，在本地院舍新增「護理保健師」職級，孫玉菡說，該職級在一般「保健員」之上，差不多等同登記護士，工資較高，職務亦更專業。過去院舍保健員有如「崛頭進士」，沒有晉升機會，他期望「護理保健師」職級為院舍員工提供晉升階梯，吸引更多年輕人入行。

孫玉菡又提到，明年會開辦「護理保健師」課程，先針對現有院舍保健員作培訓，當局亦正與院校商討在中長期開辦課程讓年輕人修讀。"
澤連斯基稱除非普京出席伊斯坦布爾和談　否則不赴當地,2025-05-14 10:36,,2025-05-14 10:45,cinternational,rthk,https://news.rthk.hk/rthk/ch/component/k2/1804538-20250514.htm,"烏克蘭總統澤連斯基計劃到訪土耳其首都安卡拉。

澤連斯基說在安卡拉期間，會與土耳其總統埃爾多安會面，又提到烏俄可能於星期四在土耳其伊斯坦布爾舉行的和平談判，指出如果俄羅斯總統普京出席這場和談，他亦會前往伊斯坦布爾。

澤連斯基又說將盡力確保與普京的會談能夠舉行，希望透過談判達成30日停火，作為結束戰事的第一步，如果普京拒絕出席談判，美國應該對莫斯科實施最嚴厲制裁。

克里姆林宮未有透露普京是否會親自出席會談。發言人說俄方繼續準備周四在伊斯坦布爾的談判，會適時宣布參與的俄方代表人選。烏克蘭總統辦公室顧問波多利亞克較早時說，除了普京，澤連斯基不會與其他俄方代表會談。"
盧拉希望巴西與中國貿易取得平衡　冀中國於技術發展提供協助,2025-05-14 10:30,,2025-05-14 10:45,greater_china,rthk,https://news.rthk.hk/rthk/ch/component/k2/1804535-20250514.htm,"巴西總統盧拉今天結束訪華行程，他舉行記者會交代此行成果。盧拉說看到巴中貿易有成長跡象，期望兩國貿易取得平衡，這也是他訪華的主要目的，並希望中國在技術發展方面，向巴西提供協助。

盧拉提到昨日與國家主席習近平的會談，表示他向習近平提出派遣中方官員訪問巴西，以便雙方討論影片分享式TikTok等科技議題。

被問到巴西加強與中國的關係，會否影響巴西與美國的關係；盧拉說巴西不懼怕美國可能作出的報復。

盧拉是應習近平邀請，上周六起一連五天對中國進行國事訪問。"
業界料暫緩關稅期間船運空運需求增　中小企覓新市場分散投資,2025-05-14 10:21,,2025-05-14 10:45,local,rthk,https://news.rthk.hk/rthk/ch/component/k2/1804534-20250514.htm,"中美經貿高層會談日前達成共識，互相下調對進口貨品徵收的關稅，其中24%的關稅將暫緩實施90日，內地將於今日中午12時01分起實施。有香港物流業界歡迎安排，預料很多廠商和出口商會於暫緩措施的90天內盡快出貨，令出貨量暴升。

香港貨運物流業協會主席劉浩然，在本台節目《千禧年代》表示，由於關稅和小型包裹的稅項，令很多貨源包括電商平台在本月1日之前已經暫停，廠商亦積存一些庫存。

劉浩然說，在暫緩關稅期間，船運及空運需求會增加，因成本關係相信大量商戶會選擇船運，如果轉用空運，費用高最少四至五成，相信只有很趕急的貨物才會轉用空運。對於美國降低對華小額郵遞品關稅至54%，他認為，稅項仍然偏高，相信要兩國政府再有優惠措施，才可以回到以往正常的物流往來。

香港中小型企業聯合會會長郭志華在同一節目表示，會部署爭取把握這三個月時間出貨，船期方面相信這一、兩個月會比較緊張。他表示，這段期間可能比過往出口大量增加，所以要與船廠預訂位置，亦期望政府能夠協助，作特事特辦的安排。

對於小額郵遞品關稅降至54%，郭志華認為，並非能夠負擔的水平，今年2月及3月曾跟商務及經濟發展局溝通，將會盡量分散投資，並開始接觸沙特阿拉伯及阿聯酋等市場。"
Hang Seng Index opens higher on rate cut prospects,2025-05-14 09:57,,2025-05-14 10:15,efinance,rthk,https://news.rthk.hk/rthk/en/component/k2/1804532-20250514.htm,"The Hang Seng Index rose 208.18 points, or 0.9 percent, to open at 23,316.45 points on Wednesday.

Stocks are being underpinned by the prospect of more interest rate cuts, after a benign inflation report yesterday in the US. (Xinhua, AFP)"
滬深股市初段變動不大,2025-05-14 09:47,,2025-05-14 10:00,cfinance,rthk,https://news.rthk.hk/rthk/ch/component/k2/1804531-20250514.htm,"內地股市初段變動不大。

上證指數較早時報3374點，跌不足1點。

深證成份指數報10284點，跌3點。

創業板指數報2064點，升2點。"
人行逆回購920億元人民幣　連續兩日淨回籠,2025-05-14 09:41,,2025-05-14 10:00,cfinance,rthk,https://news.rthk.hk/rthk/ch/component/k2/1804529-20250514.htm,"人民銀行公開市場開展920億元人民幣7天期逆回購操作，中標量與投標量相同，利率維持於1.4厘。

對沖到期量後，公開市場單日淨回籠1035億元，連續兩日淨回籠。"
希臘東南部海域6級地震　暫無傷亡損毀報告,2025-05-14 09:31,,2025-05-14 10:00,cinternational,rthk,https://news.rthk.hk/rthk/ch/component/k2/1804530-20250514.htm,"希臘東南部卡索斯島附近海域，凌晨發生黎克特制6級地震，目前未有人員傷亡和財產損毀報告。

美國地質勘探局表示，地震發生在當地時間星期三凌晨接近2時，震央位於卡索斯島首府弗里的東南偏南23公里海域，震源深度74公里。"
港股競價時段回升208點　科指升約1.6%,2025-05-14 09:24,,2025-05-14 10:00,cfinance,rthk,https://news.rthk.hk/rthk/ch/component/k2/1804528-20250514.htm,"港股回升，恒生指數競價時段報23316點，升208點，升幅0.9%。

科技指數報5352點，升83點，升幅1.58%。"
據報恒生多個部門裁員　發言人：不時檢視業務組合並作出適切調整,2025-05-14 09:22,,2025-05-14 10:00,local,rthk,https://news.rthk.hk/rthk/ch/component/k2/1804527-20250514.htm,"據星島日報引述消息指，恒生銀行多個部門自3月陸續裁員，涉及後勤支援部門、策略及企業發展部、資訊科技部、企業傳訊部、恒生指數公司等。報道指，裁員行動預料6月底前完成，涉及部門裁員幅度約10%至20%，個別部門裁減約一半員工。

發言人回覆查詢時表示，為應對瞬息萬變的市場環境及客戶日益多元化的需求，該行不時檢視業務組合及營運，並會作出適切的調整，包括優化或創新新職能、調整業務架構，以及提升員工技能等，以更好為客戶提供優質服務。"
人民幣中間價升35點子　創近1個半月新高,2025-05-14 09:22,,2025-05-14 10:00,cfinance,rthk,https://news.rthk.hk/rthk/ch/component/k2/1804525-20250514.htm,人民幣中間價延續上日升勢，報7.1956兌1美元，較昨日中間價升35點子，創4月3日以來新高。
金正恩觀摩戰術綜合訓練　強調堅守「反帝階級戰線」,2025-05-14 09:20,,2025-05-14 10:00,cinternational,rthk,https://news.rthk.hk/rthk/ch/component/k2/1804526-20250514.htm,"北韓朝中社報道，領袖金正恩觀摩各兵種戰術綜合訓練，強調建立科學化戰鬥訓練體系的重要性，指出革命武力最迫切的任務是完成戰爭準備。

金正恩表示，國家革命武裝力量負責堅守的最重要戰線，就是「反帝階級戰線」。

分析認為，金正恩所指的是與美國等國家對抗，目的可能要為平壤派兵援俄參戰正當化。

另外，報道中的圖片，出現北韓士兵操作無人機，以及狙擊手穿著軍服等場面，推測北韓有意宣傳在俄烏戰場學到的戰術和武器裝備運用方法。"
台股初段升逾1%,2025-05-14 09:04,,2025-05-14 09:15,cfinance,rthk,https://news.rthk.hk/rthk/ch/component/k2/1804524-20250514.htm,台灣股市初段造好，加權指數較早時報21624點，升294點，升幅1.38%。
中石化母公司發行77.5億元可交換債券　以中石化Ｈ股為標的,2025-05-14 08:42,,2025-05-14 09:00,cfinance,rthk,https://news.rthk.hk/rthk/ch/component/k2/1804523-20250514.htm,"中國石化公布，母公司中國石化集團發行總額77.5億元可交換債券，可交換為持有的中石化H股，集資為接續到期中長期境外債務。

有關債券年期7年，由本月20日起的第3年及第5年，投資者有一次性回售權。票面利率0.75厘，初始換股價6元，較中石化昨日收市溢價47%。債券於聯交所掛牌。

中石化說，發行可交換債券不會導致實際控制權變更，不會影響公司生產經營及公司治理。"
韓股初段升0.7%,2025-05-14 08:05,,2025-05-14 08:30,cfinance,rthk,https://news.rthk.hk/rthk/ch/component/k2/1804521-20250514.htm,南韓股市早段造好，首爾綜合指數較早時報2626點，升18點，升幅0.7%。
日股初段升逾0.1%,2025-05-14 08:05,,2025-05-14 08:30,cfinance,rthk,https://news.rthk.hk/rthk/ch/component/k2/1804520-20250514.htm,日股初段靠穩，日經指數較早時報38232點，升49點，升幅0.13%。
阿爾巴尼亞執政社會黨在國會選舉獲勝,2025-05-14 07:16,,2025-05-14 07:45,cinternational,rthk,https://news.rthk.hk/rthk/ch/component/k2/1804518-20250514.htm,"阿爾巴尼亞執政社會黨在國會選舉獲勝，將再次擁有單獨組閣權，贏得第四個連續任期。

阿爾巴尼亞中央選舉委員會公佈，在已點算的超過99%國內選票和近40%海外選票，現任總理拉馬領導的社會黨贏得近53%的選票，將獲得83個議會席位。主要反對黨民主黨領導的政黨聯盟得票率近34%，將獲得50席。

當地星期日舉行國會選舉，共有11個政黨和政黨聯盟參選。

今次是阿爾巴尼亞2022年7月啟動加入歐盟談判以來，首次舉行國會選舉。"
華連卡獲法國網球公開賽發出外卡參賽,2025-05-14 06:52,,2025-05-14 07:15,csport,rthk,https://news.rthk.hk/rthk/ch/component/k2/1804517-20250514.htm,"法國網球公開賽本月底舉行。

現年40歲，2015年男單冠軍，瑞士的華連卡獲大會發出外卡參賽。

華連卡現時世界排名跌至132，他在2015年打足四盤，擊敗祖高域，捧起個人三個大滿貫錦標的第二冠。

華連卡去年法網打入次圈。他自 2020 年澳洲網球公開賽以來，沒有進入過大滿貫的第二周賽事。

另外，38 歲的法國球手加斯基特亦獲得外卡，參加主賽圈。他將在賽後掛拍退休。

法國公開賽將於本月25日至6月8日舉行。"
特首中東行｜李家超冀與海灣阿拉伯國家合作委員會國家簽自貿協定,2025-05-14 06:41,,2025-05-14 07:00,local,rthk,https://news.rthk.hk/rthk/ch/component/k2/1804516-20250514.htm,"正在科威特訪問的行政長官李家超，與科威特領導人會面。李家超表示，希望和「海灣阿拉伯國家合作委員會」國家簽署自由貿易協定，希望科威特作為「海合會」輪值主席國，支持和協助促成談判。

代表團之後探訪了一間在科威特十分成功的跨國企業。李家超認為，在建立網絡方面達到預期效果。"
美元指數失守101　美國10年期債息曾升穿4.5厘,2025-05-14 06:37,,2025-05-14 07:00,cfinance,rthk,https://news.rthk.hk/rthk/ch/component/k2/1804515-20250514.htm,"美元指數失守101水平，較早時報100.93，跌約0.8%。

美元兌日圓較早時徘徊147.35，英鎊兌美元處於1.33，歐元兌美元報1.1189。

美國4月消費物價數據低於預期，中美貿易緊張局勢緩和，經濟衰退可能性下降，市場下調聯儲局今年重啟減息時間及幅度預測。

美國總統特朗普再次呼籲聯儲局減息，指汽油、食品雜貨等，幾乎所有東西價格都在下降。

另外，美國10年期債息一度升穿4.5厘，觸及4.505厘，創逾1個月新高，升4.8個基點，尾市徘徊4.47厘附近。"
港股美國預託證券大多造好　京東集團績後急升約6%,2025-05-14 06:17,,2025-05-14 06:45,cfinance,rthk,https://news.rthk.hk/rthk/ch/component/k2/1804513-20250514.htm,"港股美國預託證券(ADR)大多造好。

京東集團業績公布後，ADR比本港昨日收市價急升約6%，以港元計折合報145.2元。

ATMXJ其餘股份ADR亦升逾1%至約3%。

滙控、友邦、港交所、平保ADR升1%以上，工行及中行ADR偏軟。"
金價反彈　現貨金曾升約1%,2025-05-14 06:17,,2025-05-14 06:45,cfinance,rthk,https://news.rthk.hk/rthk/ch/component/k2/1804512-20250514.htm,"金價反彈，受到有買盤趁低吸納支持。

現貨金高見每盎司3265.18美元，升約1%，較早時徘徊3248美元。

紐約期金收報3247.8美元，升19.8美元，升幅0.6%。"
油價升近3%　布蘭特期油迫近67美元,2025-05-14 06:16,,2025-05-14 06:45,cfinance,rthk,https://news.rthk.hk/rthk/ch/component/k2/1804511-20250514.htm,"油價延續上日升勢，曾觸及半個月高位，受到中美暫時削減關稅、美國通脹數據好過預期帶動。

分析認為，貿易戰緩和令到經濟衰退風險下降，降低油價大跌的可能性，但石油輸出國組織及盟友組成的OPEC+，計劃於5月及6月增加石油出口，或限制油價升勢。。

倫敦布蘭特期油收報每桶66.63美元，升1.67美元，升幅2.6%。

紐約期油收報63.67美元，升1.72美元，升幅2.8%。

另外，外電據消息人士引述美國石油協會(API)數據，美國上星期原油庫存出乎意料大幅增加430萬桶，蒸餾油庫存亦意外減少370萬桶；汽油庫存減少140萬桶，減幅超出預期。"
德股升0.3%再創收市新高　英股缺乏方向,2025-05-14 06:15,,2025-05-14 06:45,cfinance,rthk,https://news.rthk.hk/rthk/ch/component/k2/1804510-20250514.htm,"歐洲股市普遍上升，英國股市缺乏方向，富時100指數收報8602點，跌2點。

德法股市同樣反覆靠穩，連升4日。德國DAX指數再創收市新高，收報23638點，升72點，升幅0.31%。

法國CAC指數收報7873點，升23點，升幅0.3%。"
道指低收269點　納指升1.6%　波音連升4日,2025-05-14 05:47,,2025-05-14 06:15,cfinance,rthk,https://news.rthk.hk/rthk/ch/component/k2/1804508-20250514.htm,"美股3大指數個別發展，標普500指數及納指同樣創近3個月收市新高。美國4月通脹率回落至2.3%，創近4年新低，但分析認為數據未反映關稅對價格的影響，預料年中開始浮現。另外，隨著中美貿易戰降溫，市場預料美國經濟衰退風險下降。

道瓊斯指數收市報42140點，跌269點，跌幅0.6%。

標普500指數收報5886點，升42點，升幅0.7%，連升兩日，今年累計轉升，是自2月下旬以來首次。

納斯達克指數升穿19000點水平，收報19010點，升301點，升幅1.6%，連升5日。

重磅科技股大多造好，Nvidia急升近6%，Tesla升近5%，Meta升約3%。獲納入標普500指數的Coinbase再升近24%。另外，波音升約2.5%，連升4日，據報中國取消對波音飛機的交付禁令。

聯合健康急挫近18%，受累於公司暫停公布全年業績指引、行政總裁辭任。"
