title,date,summary,scrape_time,section,source,url,news_content
韓股單日跌0.4%　全星期挫近6%,2026-03-27 14:43,,2026-03-27 15:00,cfinance,rthk,https://news.rthk.hk/rthk/ch/component/k2/1849023-20260327.htm,"韓國股市延續上日跌勢，首爾綜合指數收報5438點，跌21點，跌幅0.4%。

韓股全星期累計跌近6%。



編輯：宋家樑"
日股低收逾0.4%　全星期變動不大,2026-03-27 14:37,,2026-03-27 15:00,cfinance,rthk,https://news.rthk.hk/rthk/ch/component/k2/1849022-20260327.htm,"日股早段最多跌約1090點，日經指數低見52516點，午後跌幅顯著收窄，重上53000點以上，收市報53373點，跌230點，跌幅0.43%。

日股本周累計升不足1點，之前3星期都跌。



編輯：宋家樑"
平保：黃金作為核心策略資產之一　今年仍有很多不確定性,2026-03-27 14:32,,2026-03-27 15:15,cfinance,rthk,https://news.rthk.hk/rthk/ch/component/k2/1849021-20260327.htm,"中國平安副總經理郭曉濤表示，平保自去年初起積極布局一定數量黃金資產，目前已到達預期效果，未來將持續關注黃金走勢，作為核心策略資產之一。他估計，今年有很多不確定性，資本市場亦較為波動，全年整體向好，又認為在投資過程中，短期波動對公司不重要，更重要是如何能夠穿越周期，為客戶、股東提供長期可持續回報，今年核心投資思路是在不確定性中尋找確定性。

平保去年綜合投資收益率6.3%，是近5年最高。首席財務官付欣表示，為未來利潤穩定釋放和積累價值打下非常好的水平。她又表示，有900億元人民幣權益類投資帳面盈利未在利潤中反映，公司有穩健可持續派息能力。她強調，公司業績穩健，利潤及未來利潤的前瞻性指標保持良好，又認為平保估值仍處於低位。

對於外電指內地監管當局考慮放鬆商業銀行「兩參一控」規則，會否影響平保相關投資。管理層表示，當局在銀行體系投資方面相關政策可能變化，對整個金融行業、資本市場健康發展，都是正向而且積極。集團將密切與當局溝通，若有新政策推出，將積極研究。集團在人工智能方面亦將持續投入。



編輯：宋家樑"
平保：黃金將作為核心策略資產之一　今年仍有很多不確定性,2026-03-27 14:32,,2026-03-27 15:00,cfinance,rthk,https://news.rthk.hk/rthk/ch/component/k2/1849021-20260327.htm,"中國平安副總經理郭曉濤表示，平保自去年初起積極布局一定數量黃金資產，目前已到達預期效果，未來將持續關注黃金走勢，作為核心策略資產之一。他估計，今年有很多不確定性，資本市場亦較為波動，全年整體向好，又認為在投資過程中，短期波動對公司不重要，更重要是如何能夠穿越周期，為客戶、股東提供長期可持續回報，今年核心投資思路是在不確定性中尋找確定性。

平保去年綜合投資收益率6.3%，是近5年最高。首席財務官付欣表示，為未來利潤穩定釋放和積累價值打下非常好的水平。她又表示，有900億元人民幣權益類投資帳面盈利未在利潤中反映，公司有穩健可持續派息能力。

平保第4季新業務價值增速放緩，付欣說是受到監管預定利率下跌，客戶購買力在首3季度釋放，加上公司亦審慎調整一些假設，都影響當季新業務價值。她強調，公司業績穩健，利潤及未來利潤的前瞻性指標保持良好，又認為平保估值仍處於低位。

對於外電指內地監管當局考慮放鬆商業銀行「兩參一控」規則，會否影響平保相關投資。管理層表示，當局在銀行體系投資方面相關政策可能變化，對整個金融行業、資本市場健康發展，都是正向而且積極。集團將密切與當局溝通，若有新政策推出，將積極研究。集團在人工智能方面亦將持續投入。



編輯：宋家樑"
龍湖集團去年盈利跌約90%　收入跌近24%,2026-03-27 14:16,,2026-03-27 14:30,cfinance,rthk,https://news.rthk.hk/rthk/ch/component/k2/1849020-20260327.htm,"龍湖集團去年盈利10.2億元人民幣，按年倒退約90%；扣除投資物業及其他衍生金融工具公平值變動，核心虧損17億元。不派末期息。

集團去年收入973.1億元，減少近24%。開發業務收入705.4億元，下跌30%，交付物業總建築面積592.5萬平方米，減少22%。合同銷售631.6億元，減少近38%，合同銷售面積518.6萬平方呎，減少逾27%。

運營業務收入141.9億元，增長1.6%，服務業務收入125.8億元，下跌1.3%。

截至去年底，龍湖集團綜合借貸總額1528.1億元，按年下降235.1億元，手頭現金292億元，淨負債率52.2%。平均融資成本年利率3.51厘，平均合同借貸年期12.12年。



編輯：李意琴"
台股本周累跌逾1%,2026-03-27 13:50,,2026-03-27 14:00,cfinance,rthk,https://news.rthk.hk/rthk/ch/component/k2/1849018-20260327.htm,"台灣股市收市跌近1%，加權指數報33112點，跌225點，跌幅0.68%。

全星期計，台股累跌近1.3%。



編輯：宋家樑"
拉夫羅夫否認俄羅斯向伊朗提供情報,2026-03-27 13:44,,2026-03-27 14:15,cinternational,rthk,https://news.rthk.hk/rthk/ch/component/k2/1849019-20260327.htm,"俄羅斯外長拉夫羅夫表示，美國及其盟友對中東局勢的每次干涉都使情況變得更加「嚴峻」，又否認俄方向伊朗提供情報。

拉夫羅夫接受法國傳媒訪問，他譴責美國政府大肆吹噓對伊朗領導層成員的刺殺行動是非常虛偽。他指出，美國利用設在波斯灣地區阿拉伯國家的軍事基地襲擊伊朗，卻把大部分美軍從軍事基地撤出，是對盟友的背叛。

拉夫羅夫說，伊朗和海灣合作委員會國家正遭受美國和以色列侵略造成的嚴重後果，俄方堅定支持伊朗和波斯灣地區所有國家的利益。

拉夫羅夫表示，俄羅斯與伊朗簽署了軍事技術合作協議，俄方向伊方提供軍事產品，但絕不接受俄方向伊朗提供情報的指控。他表示，中東地區的美國軍事基地所處位置並非秘密，而是公開信息，對伊朗將美國軍事基地作為打擊目標，並不感到意外。



編輯：方潤南"
嘉華國際去年轉蝕約8.7億元　核心虧損近13億元,2026-03-27 13:36,,2026-03-27 13:45,cfinance,rthk,https://news.rthk.hk/rthk/ch/component/k2/1849017-20260327.htm,"嘉華國際去年業績由盈轉虧，錄得約8.7億元虧損，前年盈利近3.4億元。派末期息每股1仙，按年少80%；全年派每股3仙，按年少67%。

扣除投資物業除稅後公平值變動，核心虧損12.9億元，主要來自發展物業因市場狀況而進行減值撥備，以及因項目銷售價格壓力而出現負毛利率的合營企業應佔虧損。

期內，營業額按年減少72%至19.9億元。去年已簽約的應佔銷售有57億元；截至去年底，已簽約但未確認的應佔銷售為65億元，預計於今年起入帳。

截至去年底的負債比率為17%，按年升5個百分點。

集團預計，本港住宅物業市場今年將持續復甦趨勢。在利率穩定、內地買家持續需求，以及單位供應回復正常等因素的支持下，預計一般住宅樓價將會上升約5%至7%，但商業物業板塊可能繼續遇到阻力。集團將繼續審慎有序地於香港、珠三角及長三角地區尋求機遇，適時補充土地儲備。



編輯：張詩民"
沙田小瀝源交通意外涉3車相撞　小巴8人受傷,2026-03-27 13:35,,2026-03-27 13:45,local,rthk,https://news.rthk.hk/rthk/ch/component/k2/1849016-20260327.htm,"沙田小瀝源中午發生交通意外，涉及3架車，至少8人受傷。

警方表示，中午約12時半接報，小瀝源路與廣善街交界發生3車相撞意外，涉及小巴、巴士及私家車。

8名傷者均來自小巴，包括司機及7名乘客，需要送院治理。



編輯：黃佩珊"
李家超與訪港新加坡總理黃循財會面　雙方期望未來更多合作,2026-03-27 13:15,,2026-03-27 13:30,local,rthk,https://news.rthk.hk/rthk/ch/component/k2/1849015-20260327.htm,"行政長官李家超在禮賓府與訪港的新加坡總理兼財長黃循財會面。

李家超與多名特區政府主要官員，包括財政司司長陳茂波、財經事務及庫務局局長許正宇、發展局局長甯漢豪、創新科技及工業局局長孫東等，在禮賓府外迎接，黃循財與他們逐一握手。

李家超在會面中表示，歡迎黃循財到訪香港，形容對方今次到訪有重要意義，因今次是黃循財就任新加坡總理以來，首次正式訪港。李家超說，自己第一次訪問新加坡是在2023年，當時他剛就任行政長官，那時起已希望兩地領導人和高層官員能夠經常互訪。他形容黃循財訪港，象徵彼此的鞏固聯繫和友誼。

李家超又說，香港和新加坡長期友好，同時有許多共同信念，雙方均信奉自由貿易、多邊主義，亦信奉以聯合國、世貿組織等以規則為基礎的組織。雙方致力搭建對話及合作橋樑、相信雙贏、創造更大利益，他相信黃循財此行會有豐富成果。

黃循財在會面中表示，上次以官式身份訪港是2019年，好高興今次以總理身份首次訪港，亦兌現了2023年李家超訪問新加坡時，自己曾說過會訪問香港的承諾。

黃循財說，香港有很多新發展想多了解，例如香港的五年規劃，以及北部都會區發展等，探討新加坡可如何參與這些發展機遇。他又說，期待新加坡和香港之間有更緊密的合作。"
趙樂際分別會見新加坡總理黃循財及斯里蘭卡議長,2026-03-27 13:13,,2026-03-27 13:30,cinternational,rthk,https://news.rthk.hk/rthk/ch/component/k2/1849013-20260327.htm,"全國人大常委會委員長趙樂際在海南博鰲，分別會見來華出席博鰲亞洲論壇的新加坡總理黃循財，以及斯里蘭卡議長維克拉馬拉特納。

在會見黃循財時，趙樂際表示，中新全方位高質量的前瞻性伙伴關係不斷取得新進展。中方願同新方一道，持續夯實中新關係政治基礎，深化經貿、科技、人文、立法等領域高水平合作，加強交流互鑒，增進民心相通，攜手推進各自現代化進程，共同維護國際公平正義，為地區和世界和平繁榮作出更大貢獻。

黃循財表示，新方堅定奉行一個中國政策，反對「台獨」。願深化經濟、自貿港建設、新興領域、立法、人文等領域合作。

趙樂際在會見維克拉馬拉特納時表示，中方願同斯方共同「十五五」規劃同「數字斯里蘭卡」等規劃對接，深化共建「一帶一路」等各領域合作。



編輯：方潤南"
恒指下午初段於25000點以上,2026-03-27 13:11,,2026-03-27 13:30,local,rthk,https://news.rthk.hk/rthk/ch/component/k2/1849012-20260327.htm,"港股在下午開市初段在25000點以上，恒生指數較早時報25031點，升175點，升幅0.71%。

科技指數報4822點，升60點，升幅1.28%。



編輯：宋家樑"
Profits up 15.2pc for China's major industrial firms,2026-03-27 13:07,,2026-03-27 13:30,efinance,rthk,https://news.rthk.hk/rthk/en/component/k2/1849006-20260327.htm,"Profits at China's major industrial firms increased 15.2 percent year on year in the first two months of 2026, with emerging sectors such as equipment manufacturing and high-tech manufacturing serving as major growth drivers, official data showed on Friday.

Industrial firms with an annual main business revenue of at least 20 million yuan saw their combined profits hit 1.02 trillion yuan during the period, the National Bureau of Statistics said.

Various regions and departments intensified the implementation of more proactive and effective macro policies, focusing on leveraging the integrated effects of existing and new policies, it said.

As a result, profits of major industrial firms accelerated in growth, with most industries seeing a rebound in profits, according to the bureau. (Xinhua)


Edited by Tony Sabine"
政府預料新皇崗口岸聯檢大樓啟用後　過關時間縮至僅需5分鐘,2026-03-27 13:00,,2026-03-27 13:30,local,rthk,https://news.rthk.hk/rthk/ch/component/k2/1849010-20260327.htm,"保安局表示，新皇崗口岸的聯檢大樓主體結構施工建設已基本完成，口岸採用「合作查驗、一次放行」模式，過關時間由以前30分鐘，大幅縮減至僅需約5分鐘，預計初期已可以每日處理20萬人次流量。

保安局局長鄧炳強在立法會一個委員會表示，「合作查驗、一次放行」新模式非常便利，重建後的沙頭角口岸也會採用，希望日後適用於所有新建陸路口岸。但機場並非只有內地航班，難以設置只處理乘搭內地航班出入境旅客的關口通道，短期內難以實行。

選委界議員范駿華問到「合作查驗、一次放行」模式是否可擴展適用於深圳灣口岸，鄧炳強說，每個口岸建設時面對一定地方規限，深圳灣口岸的地形未必容許，當局會一直去研究，但短期內未必可以實行。

至於新皇崗口岸聯檢大樓的啟用時間，鄧炳強說，有待港深兩地政府進一步商討，特區政府會爭取提早於本屆政府任期內，讓口岸具備落成啟用條件的目標，但可以提早多久，視乎雙方建築和裝修進度、法例通過等情況，強調盡早啟用仍然是雙方目標。



編輯：黃佩珊"
Singapore races ahead with plans for gold trading hub,2026-03-27 12:56,,2026-03-27 13:30,efinance,rthk,https://news.rthk.hk/rthk/en/component/k2/1849003-20260327.htm,"Singapore set out plans on Friday to turn the city-state into a gold trading hub for the whole of Asia, with regulators and industry players working together to strengthen the market's trading, clearing and storage infrastructure.

Singapore is one of a number of Asian financial centres now racing to capture more flows of bullion and boost their gold trading business, with Hong Kong also pushing to expand its gold market links with Shanghai.

The Monetary Authority of Singapore, the city-state's central bank, and the Singapore Bullion Market Association said they had identified four areas that they would focus on, including the broadening of gold-related capital market products and setting up a trusted clearing and settlement system.

The other two areas are strengthening vaulting and logistics standards and studying vaulting services for foreign central banks ⁠and sovereign entities.

""We are not placing bets on whether the prices in the short term will go up or go down,"" Chee Hong Tat, Singapore's minister for national development and MAS deputy chairman, said on Friday.

""What we are doing is to create the ecosystem for gold trading activity based out of Singapore.""

Chee said the plan was based on industry feedback and was aimed at bringing more gold and high-value activity into Singapore and creating jobs.

The central bank and the association set up the working group in January.

Its members include DBS, ICBC Standard Bank, JPMorgan, UBS, UOB, SGX and the ⁠World Gold Council.

In February, a lender, OCBC, said it was exploring  physical gold custody for institutional and wealthy clients.

Demand for gold has remained firm in an uncertain global environment, even after a sharp fall in prices in recent weeks triggered by a stronger dollar, a jump in oil prices and concerns that interest rates could ⁠stay higher for longer as a result of the war in the Middle East. (AFP)


Edited by Tony Sabine"
馬杜羅在紐約再次出庭　撤案申請遭駁回,2026-03-27 12:53,,2026-03-27 13:30,cinternational,rthk,https://news.rthk.hk/rthk/ch/component/k2/1849009-20260327.htm,"遭美國強行控制的委內瑞拉總統馬杜羅，當地星期四上午在紐約一個聯邦地區法院再次出庭，他提出的撤案請求被法官駁回。

馬杜羅的辯護律師在庭上說，由於美國政府針對委內瑞拉政府實施制裁，導致委內瑞拉政府無法支付律師費用，而馬杜羅夫婦無力獨自承擔辯護所需費用，違反美國憲法涉及個人權利的相關規定，要求駁回檢方指控。

總統特朗普同日表示，將對馬杜羅提出更多訴訟，但他未透露具體罪名。

有馬杜羅的支持者聚集在法院外，高呼口號，要求釋放馬杜羅，反對美國政府軍事干涉委內瑞拉。



編輯：方潤南"
內地文創 IP蓬勃　揚洲生產商指要擺脫傳統代工生產模式,2026-03-27 12:32,,2026-03-27 13:00,cinternational,rthk,https://news.rthk.hk/rthk/ch/component/k2/1849005-20260327.htm,"內地近年文創 IP產業發展越來越蓬勃，有江蘇的大型毛公仔設計及生產商表示，最大難題是產品很容易被人抄襲，業界亦要擺脫傳統「代工生產」模式。

集團又表示，美國關稅戰令中國產品價格競爭力下降，出口遭遇嚴峻挑戰，需要透過優化工藝等方法應對。"
新皇崗口岸將採用合作查驗一次放行模式　鄧炳強稱機場未必適用,2026-03-27 12:32,,2026-03-27 12:45,local,rthk,https://news.rthk.hk/rthk/ch/component/k2/1849004-20260327.htm,"保安局局長鄧炳強表示，新皇崗口岸將採用「合作查驗、一次放行」模式，開通初期已經可每日處理20萬人次旅客，也會設應變計劃，安排技術人員處理系統故障事件。

有議員關注會否將「合作查驗、一次放行」模式擴展至其他口岸。鄧炳強說，希望日後適用於所有新建陸路口岸，但機場未必適用。




編輯：譚佩貞"
Cruise terminal tender deadline extended to June 26,2026-03-27 12:25,,2026-03-27 12:45,elocal,rthk,https://news.rthk.hk/rthk/en/component/k2/1849000-20260327.htm,"The deadline for the submission of tender applications to operate and manage Kai Tak Cruise Terminal has been extended by more than a month from May 22 to June 26, the government announced on Friday.

A spokesperson for the Culture, Sports and Tourism Bureau (CSTB) said the extension had been granted to give potential operators more time to prepare tender documents.

""The CSTB has decided to extend the tender closing date in response to prospective tenderers' requests to the Government for more time to prepare the tender documents, in view of the consolidation of the management scope the terminal operator is responsible for and the introduction of new Key Performance Indicators under the tenancy agreement of this tender,"" the spokesperson said.

The tenancy agreement with the current terminal operator will expire on May 31, 2028."
港股半日升135點,2026-03-27 12:17,,2026-03-27 12:30,local,rthk,https://news.rthk.hk/rthk/ch/component/k2/1849002-20260327.htm,"港股反覆靠穩，恒生指數半日高低點數波幅約280點，中午收市接近半日高位，報24992點，升135點，升幅0.55%，半日主板成交額近1358億元。

科技指數升1%，報4811點。ATMXJ多數上升，美團在公布業績後升近2%，小米升逾1%，騰訊偏軟。

多數醫藥及生物科技股造好，石藥集團升逾9%，信達生物升近6%。

消費股個別發展。



編輯：宋家樑"
道路貨物資料系統5月1日起停運　用戶毋須重新登記新電子平台,2026-03-27 12:05,,2026-03-27 12:15,local,rthk,https://news.rthk.hk/rthk/ch/component/k2/1849001-20260327.htm,"政府宣布「貿易單一窗口」於5月1日起，取代現有「道路貨物資料系統」，供業界提交道路預報貨物資料。「道路貨物資料系統」的用戶資料將自動轉移至「單一窗口」系統，用戶只需以原有帳戶登入，即可無縫銜接至新服務，毋需重新登記。

「單一窗口」提供一站式電子平台，供業界提交「企業對政府」貿易文件作報關及貨物清關之用。平台精簡提交文件的流程，節省時間和成本。

海關提醒業界，為配合系統轉換，「道路貨物資料系統」於5月1日凌晨零時起停止服務，轉換工作預計同日清晨完成。系統切換期間，仍在運作的陸路邊境管制站會維持正常的貨物清關服務。如需於5月1日系統切換期間進行跨境運輸，業界應預早規劃並提交相關資料。


編輯：譚佩貞"
配合物流發展　陳美寶建議擴大空運轉運貨物豁免計劃,2026-03-27 11:51,,2026-03-27 12:15,local,rthk,https://news.rthk.hk/rthk/ch/component/k2/1848999-20260327.htm,"運輸及物流局局長陳美寶在立法會經濟發展事務委員會表示，現時海運、空運、物流面對挑戰，包括鄰近機場和港口競爭、受不穩定的國際政治形勢影響，尤其近日中東局勢，為物流、供應鏈帶來不穩定性及挑戰，香港必須把握先機及機遇，做好轉口港、補給港、補時港位置。

她又說，香港航空貨運的成功，其中一個因素是推出「空運轉運貨物豁免計劃」，讓多種貨物以「空轉空」聯運模式在香港機場禁區轉運時，毋須申請進出口許可證。因應物流發展，建議將相關豁免計劃進一步擴大。

在海空及空海聯運方面，她表示，機管局已在東莞設立香港國際機場東莞空港中心，並以海空多式聯運模式將貨物運往機場出口。該中心去年處理超過3萬2千噸貨物，按年上升84%，貨值達350億元。

另外，在低空經濟方面，陳美寶表示，正與內地城市積極探索跨境物流的可溯性，考慮將洪水橋現代物流圈部分地點作為試點，讓物流業界利用無人機配送高增值、需要快速運送的物件，正研究在深圳前海、南沙、 深圳灣口岸等試行，運輸及物流局、土木工程拓展署及海關會積極探討。



編輯：譚佩貞"
滬指半日靠穩　深股升近1%,2026-03-27 11:41,,2026-03-27 12:15,cfinance,rthk,https://news.rthk.hk/rthk/ch/component/k2/1848997-20260327.htm,"滬深股市先低後高，深證成份指數和創業板指數半日升近1%。鋰電、醫藥醫療、化工等股份上升；電力、煤炭、保險和銀行股下跌。

上證綜合指數上午收市報3899點，升10點，升幅0.26%。

深證成份指數報13732點，升125點，升幅0.93%。

創業板指數報3299點，升27點，升幅0.83%。



編輯：宋家樑"
大灣區跨境直通救護車計劃　即日起本港與三城市實施雙向轉運安排,2026-03-27 11:39,,2026-03-27 12:15,local,rthk,https://news.rthk.hk/rthk/ch/component/k2/1848998-20260327.htm,"政府公布，「大灣區跨境直通救護車試行計劃」即日起正式與深圳、珠海和澳門實施雙向轉運安排。

行政長官在去年《施政報告》中提出，香港特區政府聯同粵澳政府有序擴展救護車跨境轉運病人安排，包括救護車雙向轉運。特區政府繼2月聯同廣東省和深圳市政府進行首次北向轉運演練後，本月20日再聯同珠海和澳門進行雙向轉運演練，測試在模擬載送病人情況下的救護車跨境轉運安排。

演練期間，珠海和澳門救護車先分別由珠海和澳門指定接收醫院，即珠海市人民醫院和澳門仁伯爵綜合醫院出發，經港珠澳大橋口岸前往香港指定派送醫院，即瑪嘉烈醫院和香港兒童醫院接載病人，再經同一口岸將病人轉運至上述醫院接受治療，測試過程順暢。

醫務衞生局局長盧寵茂說，試行計劃為區內有特定需要的病人提供更安全、及時和便捷的轉運安排，是實現大灣區優質醫療衞生合作、推動健康灣區高質量發展的重要里程碑。

試行計劃自2024年11月30日啓動以來，整體運作良好，並會延續至今年11月29日。

截至3月下旬已有25名病人由深圳、珠海、南沙和澳門的指定派送醫院，轉運到香港指定公立醫院接受治療。根據專業醫療評估，有關病人有持續住院的治療需要，情況相對穩定，但無法自行跨境，亦不適合經現有口岸轉乘救護車。


編輯：譚佩貞"
漁護署呼籲郊外掃墓人士謹慎處理火種　倘有違規將會執法,2026-03-27 11:19,,2026-03-27 11:30,local,rthk,https://news.rthk.hk/rthk/ch/component/k2/1848996-20260327.htm,"漁護署呼籲，清明節期間前往郊外掃墓的市民謹慎處理火種，防止山火發生。

發言人表示，根據法例任何人在郊區留下火種或隨意燃燒冥鏹可被檢控。一經定罪，最高可被判罰款2萬5千元及監禁1年。

清明節期間，漁護署人員會加強巡邏郊野墓地，如發現違規情況會採取執法行動。

發言人指，大部分在郊外發生的山火均由人為疏忽引致。掃墓人士只要遵從簡單守則可避免意外發生，包括，使用工具清除雜草，切勿以火燃燒野草；在化寶盆或鐵桶內燃燒香燭及冥鏹；切勿遺下尚在燃燒的祭品；以及離開墓地時確保所有火種已熄滅。

清明節期間，漁護署會在郊野公園適當地點向有需要的掃墓人士派發鐵桶供焚燒冥鏹；亦會聯同民安隊在山火黑點巡邏。



編輯：黃佩珊"
