title,date,summary,scrape_time,section,source,url,news_content
醫健通「跨境健康紀錄」功能即日起擴展至全港約630萬用戶,2025-12-24 09:59,,2025-12-24 10:15,local,rthk,https://news.rthk.hk/rthk/ch/component/k2/1837334-20251224.htm,"醫務衞生局公布，醫健通流動應用程式的「跨境健康紀錄」功能即日起，由目前限於合資格使用醫療券的長者，擴展至全港約630萬醫健通用戶，便利更多市民安全地於指定境外醫療機構，跨境使用電子健康紀錄，以獲得更連貫的醫療服務。

由即日起，全港所有醫健通用戶在20間指定境外醫療機構接受診症前，可預先透過醫健通流動應用程式的「跨境健康紀錄」功能，申請過去3年存放在醫健通的電子健康紀錄，用戶隨即會在流動應用程式收到「申請二維碼」和「密碼二維碼」。用戶在指定醫療機構求診時，可向當地醫護人員展示二維碼，讓其在指定網絡瀏覽器上開啟及瀏覽相關健康紀錄，以助診斷和治療。指定醫療機構每次取覽時，用戶均會透過選擇的通訊方式，例如手機短訊或電郵收到通知，以保障個人醫健通戶口的資料私隱及安全。用戶亦可透過流動應用程式的「照顧者」功能，為家人申請使用服務。

醫衞局發言人說，因應香港市民在粵港澳大灣區使用醫療服務的情況越趨普遍，政府一直與內地相關部門及醫療機構緊密溝通，今次擴展「跨境健康紀錄」功能的受惠對象至全港市民，是推動跨境醫療協作的重要里程碑。

市民如欲了解更多「跨境健康紀錄」功能的詳情，可瀏覽醫健通專題網站或致電熱線 3467 6300查詢。"
莫斯科南部凌晨有汽車爆炸兩人受傷,2025-12-24 09:58,,2025-12-24 10:15,cinternational,rthk,https://news.rthk.hk/rthk/ch/component/k2/1837333-20251224.htm,"俄羅斯傳媒報道，首都莫斯科南部凌晨發生汽車爆炸，兩人受傷。

報道說，爆炸發生在莫斯科南部一個警局附近的停車場，距離一名高級軍官
日前遇襲身亡的地點不遠。

有目擊者稱，看到有人投擲爆炸物後逃離現場。

汽車爆炸導致兩名警察受傷，其中一人傷勢嚴重。
　
當地星期一晚，一個汽車爆炸裝置被引爆，聯邦武裝力量總參謀部作戰訓練局局長薩爾瓦羅夫被炸死。"
滬深股市初段變動不大,2025-12-24 09:34,,2025-12-24 10:00,cfinance,rthk,https://news.rthk.hk/rthk/ch/component/k2/1837332-20251224.htm,"滬深股市開市初段變動不大。

上證綜合指數較早時報3916點，跌3點。

深證成份指數報13374點，升5點。

創業板指數報3207點，升2點。"
人行逆回購260億元人民幣,2025-12-24 09:31,,2025-12-24 10:00,cfinance,rthk,https://news.rthk.hk/rthk/ch/component/k2/1837331-20251224.htm,"人民銀行公開市場進行260億元人民幣7日期逆回購操作，利率維持在1.4厘不變。

對沖今日到期量後，單日淨投放208億元，連續3日淨回籠。"
港股競價時段靠穩,2025-12-24 09:26,,2025-12-24 09:45,cfinance,rthk,https://news.rthk.hk/rthk/ch/component/k2/1837330-20251224.htm,"港股競價時段靠穩。恒生指數報25780點，微升5點。

科技指數報5492點，升3點。"
日央行10月會議記錄：維持現時政策以確認薪酬趨勢是否受到干擾,2025-12-24 09:26,,2025-12-24 09:45,cfinance,rthk,https://news.rthk.hk/rthk/ch/component/k2/1837328-20251224.htm,"日本央行10月會議記錄顯示，多數委員認為經濟及物價預測的可能性上升，但指出要維持目前政策，以進一步確認薪酬制定的積極趨勢是否受到干擾。

有委員認為加息時機已經臨近，但應再等一段時間，以觀察政府政策走向，亦有委員指要適時加息。

另外，有決策者認為，近期日圓下跌或推高進口成本，令通脹上升。

日本在10月會議維持利率不變。"
人民幣兌美元中間價創近15個月高位,2025-12-24 09:22,,2025-12-24 09:45,cfinance,rthk,https://news.rthk.hk/rthk/ch/component/k2/1837329-20251224.htm,人民幣中間價報7.0471兌1美元，較上日中間價升52點子，創去年9月30日以來新高。
台股初段靠穩,2025-12-24 09:14,,2025-12-24 09:30,cfinance,rthk,https://news.rthk.hk/rthk/ch/component/k2/1837326-20251224.htm,"台灣股市初段靠穩。

加權指數較早時報28387點，升77點，升幅0.27%。"
利比亞一名軍方領袖在土耳其墜機身亡,2025-12-24 09:06,,2025-12-24 09:15,cinternational,rthk,https://news.rthk.hk/rthk/ch/component/k2/1837325-20251224.htm,"利比亞軍隊總參謀長哈達德結束對土耳其的訪問後，在回國途中在土耳其境內墜機身亡。

土耳其總統府說，飛機失事前報告出現電力故障。

利比亞民族統一政府總理德拜巴發表聲明說，另有4人一同遇難，包括陸軍參謀長，指事件是利比亞國家和軍隊的沉重損失。

土耳其內政部長在社交平台說，在安卡拉省哈伊馬納區一座村莊附近發現飛機殘骸，並已告知利比亞方面，已找到遇難人員遺骸。

土耳其表示，哈達德等5人乘坐一架「獵鷹-50」型飛機，從安卡拉的機場起飛，前往利比亞首都的黎波里，飛機在約40分鐘後失聯。聲明說，飛機一度要求緊急降落，但隨後未能與地面重新建立通訊。

多間土耳其傳媒播出的電視畫面顯示，飛機失事前發出信號的地點附近發生爆炸。

土耳其將就空難啟動調查，利比亞方面亦說會派出代表團跟進。"
《環看天下》：韓方推進韓中元首會晤　傳四大企業領袖明年初訪華,2025-12-24 08:57,,2025-12-24 09:15,greater_china,rthk,https://news.rthk.hk/rthk/ch/component/k2/1837324-20251224.htm,"韓國外交部長趙顯日前證實韓方正推動韓中兩國領導人明年初舉行會晤，相信很快公布確實日期，若果元首會談成行，雙方屆時將就促進東北亞地區和平穩定等事宜，交換意見。

另一方面，韓國傳媒亦引述消息說，當地商會正在組織商界代表團，當中包括四大企業的領袖，有意在明年年初訪華。外界關注韓國近年持續錄得對華貿易逆差，政商界正不斷尋求同北京互動，希望守住來自中國市場的龐大收入來源。"
US delays China semiconductor tariffs until 2027,2025-12-24 08:52,,2025-12-24 09:15,efinance,rthk,https://news.rthk.hk/rthk/en/component/k2/1837323-20251224.htm,"US President Donald Trump's administration on Tuesday said it will slap tariffs on Chinese semiconductor imports over Beijing's ""unreasonable"" pursuit of chip industry dominance, but would delay the action until June 2027.

The tariff rate will be announced at least 30 days in advance, according to the filing, which follows a year-long ""Section 301"" unfair trade practices investigation ‍into China's exports of ""legacy,"" or older-technology chips to the US, launched by former ⁠President Joe Biden's administration.

""China’s targeting of the semiconductor industry for dominance is unreasonable and burdens ‍or restricts US commerce and thus is actionable,"" the US Trade Representative said in its release.

The Chinese Embassy in Washington expressed opposition to any tariffs. ""To politicise, instrumentalise and weaponise trade and tech issues and destabilise the global industrial and supply chains will benefit no one and will eventually backfire,"" it said in a statement to Reuters. ""We will take all measures necessary to firmly safeguard our lawful rights and interests,"" it added.

The ‍move, which preserves Trump's ability to impose the duties, seeks to dial down tensions with Beijing in the face of Chinese export curbs on the rare earth metals that global tech companies rely on and which China controls.

As part of negotiations with China to delay those curbs, Washington pushed back a rule to restrict US tech exports to units of already-blacklisted Chinese companies.

It has also launched a review that could result in the first shipments to China of Nvidia's second-most powerful AI chips, Reuters reported.

The chip industry is awaiting the ‍administration's decision on a much broader tariff investigation into global chip imports.

That probe, under the ""Section 232"" national security statute, could heap more tariffs on Chinese semiconductors and a vast array of electronics devices containing them from all countries. But US officials are privately saying that they might not levy them anytime soon, Reuters has reported.

Biden already imposed an additional 50 percent tariff on ⁠Chinese semiconductors that started on January 1, 2025. (Reuters)"
S&P 500 surges to record after strong US GDP report,2025-12-24 08:43,,2025-12-24 09:15,efinance,rthk,https://news.rthk.hk/rthk/en/component/k2/1837310-20251224.htm,"The S&P 500 powered to a fresh record on Tuesday following data showing surprisingly robust third-quarter US economic growth as markets hope for a year-end ""Santa Claus Rally.""

All three major Wall Street indices advanced, shaking off early choppiness after the strong US gross domestic product report sparked talk that the Federal Reserve could refrain from further interest rate cuts.

""The GDP number was unambiguously good and eventually markets come around to the realisation that good news is good news,"" said Art Hogan of B Riley Wealth Management.

""Unfortunately, the knee-jerk reaction was: 'If the economy is that strong, does the Fed need to cut anymore?'"" said Hogan. ""Luckily today, we shed that thought process.""

US GDP came in at 4.3 percent, the highest reading in two years, easily topping expectations for 3.3 percent growth.

Heather Long, chief economist at the Navy Federal Credit Union, wrote that the report shows the resiliency of US consumers, boding ""well for 2026.""

""If the economy can avoid widespread layoffs, most American consumers can keep spending,"" she said.

Separate data showed US consumer confidence fell in December, as a slowing job market offset better sentiment after the government shutdown ended, according to a Conference Board survey.

eToro investment analyst Bret Kenwell noted the headline figure has now declined for five straight months, and the component showing the confidence of consumers in their present situation is at its lowest since February 2021.

""Simply put, despite solid GDP figures and a stock market at record highs, consumers are feeling some anxiety,"" he said.

Gold jumped to a high above US$4,497 per ounce, while silver surged above US$70 an ounce, with the US blockade against Venezuela and the Ukraine conflict adding support.

Copper, which is used in electric vehicle batteries and solar panels, hit a record price of US$12,159.50 per ton.

""Silver and above all copper are benefiting from structural support from the energy transition, electrification and the colossal needs for digital infrastructure and artificial intelligence,"" said John Plassard, an analyst at Cite Gestion Private Bank.

In company news, shares in Danish pharmaceutical giant Novo Nordisk jumped more than eight percent after the US approved its popular GLP-1 anti-obesity drug Wegovy to be administered in pill form for weight loss.

The S&P 500 rose 0.5 percent, to 6,909, surpassing the record set earlier this month. The Dow rose 0.2 percent, to 48,442, while the Nasdaq rose 0.6 percent, to 23,561. (AFP)"
委內瑞拉全國代表大會通過法律應對美國海上攔截與封鎖,2025-12-24 08:37,,2025-12-24 08:45,cinternational,rthk,https://news.rthk.hk/rthk/ch/component/k2/1837322-20251224.htm,"委內瑞拉全國代表大會通過法律，應對美國海上攔截與封鎖。

這項名為《保護航行和貿易自由免受海盜行為、封鎖和其他國際非法行為侵害法》的法律規定，煽動、唆使、支持、資助或參與以上非法行為者，最高可判處20年監禁。全國代表大會主席羅德里格斯表示，法律將為維護國家航行自由、貿易往來及主權利益提供法律保障。

傳媒認為法律主要是為應對美國近期在加勒比海域，針對涉委內瑞拉油輪採取的扣押、攔截行動。
　
自本月以來，美國已三次在委內瑞拉附近海域，攔截涉及委內瑞拉的油輪。總統美國特朗普早前下令，對所有進出委內瑞拉的受美國制裁油輪實施全面徹底封鎖。有油輪追蹤網站數據指出，目前有數十艘被列入美國制裁名單的油輪停留在委內瑞拉附近海域。"
US economic growth surges in 3rd quarter,2025-12-24 08:30,,2025-12-24 09:15,efinance,rthk,https://news.rthk.hk/rthk/en/component/k2/1837291-20251224.htm,"US economic growth in the third quarter came in at 4.3 percent on an annualised basis, easily topping expectations, according to US Commerce Department data released on Tuesday.

The report, which also showed an acceleration in inflation, provides reassurance about the world's largest economy after other recent data showing a weakening labour market. 

It comes as worries have moderated over US President Donald Trump's tariffs and as large tech companies advance massive investments to build new artificial intelligence infrastructure.

The gross domestic product report – delayed for nearly two months due to a government shutdown – reflects increases in consumer spending, exports and government spending, partially offset by a decrease in investment, according to the department's Bureau of Economic Analysis.

The reading, an initial estimate expected to be updated in early 2026, marks the highest GDP in two years. Analysts had expected 3.2 percent growth, according to consensus estimates from MarketWatch and Trading Economics.

The report also showed the price index for domestic purchases rose 3.4 percent, a much higher inflation reading compared with 2.0 percent in the second quarter.

The data suggest faster growth and higher inflation than markets had expected – potentially changing the calculus for upcoming US monetary policy decisions.

Other recent data has shown a weakening job market that has prompted the US Federal Reserve to cut interest rates at the last three meetings, viewing the employment picture as its prime concern even as inflation has lingered above two percent.

US stock futures fell following the GDP data, likely reflecting lower odds that the Fed will again cut next month.

""I think the implication is that with the GDP numbers being as strong as they are, that gives the Fed additional reason to be on hold at the January (Fed) meeting,"" said CFRA Research's Sam Stovall.

While inflation remains well above the Fed's two percent target, Fed Chair Jerome Powell and other policymakers have described the weakening employment market as the greater concern at the moment.

The Fed's median 2026 GDP forecast is 2.3 percent, up from 1.7 percent projected in 2025, according to a summary of the central bank's outlook. (AFP)"
日股初段上升,2025-12-24 08:07,,2025-12-24 08:15,cfinance,rthk,https://news.rthk.hk/rthk/ch/component/k2/1837320-20251224.htm,"東京市初段上升。

日經指數較早時報50475點，升62點，升幅0.12%。"
現貨金續破頂　首次升穿4500美元,2025-12-24 08:07,,2025-12-24 08:15,cfinance,rthk,https://news.rthk.hk/rthk/ch/component/k2/1837319-20251224.htm,"金價持續創新高。現貨金首次升穿每盎司4500美元，一度升至逼近每盎司4510美元，較早時報每盎司4500.5美元，升約0.3%。

2月紐約期金報每盎司4535.5美元，升近0.7%。

受到避險需求及減息預期帶動，年底金價延續升勢。"
韓股初段升逾0.2%,2025-12-24 08:07,,2025-12-24 08:15,cfinance,rthk,https://news.rthk.hk/rthk/ch/component/k2/1837321-20251224.htm,"韓國股市初段靠穩。

首爾綜合指數較早時報4126點，升9點，升幅0.22%。"
韓國首爾有公寓起火　兩人心臟停頓,2025-12-24 08:00,,2025-12-24 08:15,cinternational,rthk,https://news.rthk.hk/rthk/ch/component/k2/1837318-20251224.htm,"韓國首爾松坡區一座公寓清晨起火，造成兩人心臟停頓。

韓聯社報道，火警發生在當地清晨5時半。警方說，消防員救出4名居民，其中兩人處於心臟驟停狀態，被送往附近醫院。

另外有35名居民自行撤離。火警已被撲滅。"
英聯盃阿仙奴互射12碼淘汰水晶宮,2025-12-24 07:17,,2025-12-24 07:45,csport,rthk,https://news.rthk.hk/rthk/ch/component/k2/1837317-20251224.htm,"英格蘭聯賽盃八強，阿仙奴同水晶宮在法定時間踢成1:1，要互射12碼，兵工廠贏8:7晉級。

兵工廠80分鐘靠水晶宮的麥桑斯拿卡「擺烏龍」領先1:0。水晶宮在95分鐘才由基爾扳平。

1:1比數維持到完場，要互射12碼決勝。

兩隊頭7輪都射入，到第8輪阿仙奴的沙利巴射入，但麥桑斯拿卡的施射，被阿仙奴門將艾利沙巴拿加「捉到路」，最終阿仙奴12碼贏8:7晉級，將面對車路士。"
美宣布對華半導體加徵關稅　中方稱將經貿問題政治化對各方無好處,2025-12-24 07:03,,2025-12-24 07:15,greater_china,rthk,https://news.rthk.hk/rthk/ch/component/k2/1837315-20251224.htm,"美國政府指北京方面不合理地追求晶片產業的主導地位，宣布將對中國半導體進口產品加徵關稅，但會推遲到2027年6月才實施。

中國駐華盛頓大使館表示，反對任何關稅措施，指出將經貿科技問題政治化、工具化和武器化，破壞全球產供鏈的穩定，對各方都沒有好處，而且最終會適得其反。中方將採取一切必要措施，堅決維護中方的合法權益。"
特朗普：任何不同意其觀點人士永不會成為聯儲局主席,2025-12-24 07:00,,2025-12-24 07:15,cinternational,rthk,https://news.rthk.hk/rthk/ch/component/k2/1837314-20251224.htm,"美國總統特朗普在當地星期二表示，任何不同意他觀點的人永遠不會成為聯儲局主席，希望新任聯儲局主席在市場表現良好的情況下降低利率，而不是無緣無故破壞市場。

聯儲局現任主席鮑威爾的任期將於明年5月屆滿，根據相關法律規定，美國總統提名聯儲局主席人選後，需獲參議院批准。雖然在是否減息方面長時間遭到特朗普批評，但鮑威爾拒絕辭職並強調聯儲局貨幣政策的獨立性。"
烏克蘭遭俄空襲能源設施受損　基輔等多地實施緊急停電,2025-12-24 06:42,,2025-12-24 08:15,cinternational,rthk,https://news.rthk.hk/rthk/ch/component/k2/1837304-20251224.htm,"烏克蘭多地包括首都基輔星期二遭俄軍大規模空襲，造成至少3人死亡，包括一名兒童，多地能源設施和民用基礎設施受損，烏克蘭各地要實施緊急停電措施。烏克蘭國家電力公司通報，基輔、基輔州及多個地區已實施緊急停電。

與烏克蘭西部接壤的北約成員國波蘭表示，在俄羅斯空襲邊境附近地區後，波蘭及盟國的飛機已部署到位，保護波蘭領空。

另外，俄羅斯西南部斯塔夫羅波爾邊疆區州長表示，烏克蘭無人機的夜間襲擊導致區內一個工業設施起火。鄰近的克拉斯諾達爾邊疆區亦有燃油供應管道發生火災。"
烏多地遭俄空襲能源設施受損　基輔等多地實施緊急停電,2025-12-24 06:42,,2025-12-24 07:00,cinternational,rthk,https://news.rthk.hk/rthk/ch/component/k2/1837304-20251224.htm,"烏克蘭多地包括首都基輔星期二遭俄軍大規模空襲，造成至少3人死亡，包括一名兒童，多地能源設施和民用基礎設施受損，烏克蘭各地要實施緊急停電措施。烏克蘭國家電力公司通報，基輔、基輔州及多個地區已實施緊急停電。

與烏克蘭西部接壤的北約成員國波蘭表示，在俄羅斯空襲邊境附近地區後，波蘭及盟國的飛機已部署到位，保護波蘭領空。

另外，俄羅斯西南部斯塔夫羅波爾邊疆區州長表示，烏克蘭無人機的夜間襲擊導致區內一個工業設施起火。鄰近的克拉斯諾達爾邊疆區亦有燃油供應管道發生火災。"
哈西特：大量之前處觀望勞動力正重返市場,2025-12-24 06:25,,2025-12-24 06:45,cfinance,rthk,https://news.rthk.hk/rthk/ch/component/k2/1837313-20251224.htm,"美國上季經濟以年率計按季增長4.3%，高於預期，亦快過第2季。

白宮經濟顧問哈西特認為上季經濟數據非常好，是特朗普政府的貿易政策和對人工智能投資的結果，亦預示未來就業增長速度將更快。

他接受CNBC訪問時表示，經濟復甦勢頭強勁，大量之前處於觀望狀態的勞動力正重返市場，若新一年經濟增長保持4%增速，每月新增職位會重回10萬至15萬水平。

不過有報告顯示，美國消費者信心在12月惡化，因對就業和收入的擔憂加劇。哈西特認為，消費者信心往往與實際經濟數據無關，又指消費者有理由對通脹放緩和工資上升保持樂觀。"
港股ADR較本港昨日收市價個別發展,2025-12-24 06:19,,2025-12-24 06:30,cfinance,rthk,https://news.rthk.hk/rthk/ch/component/k2/1837312-20251224.htm,"港股美國預託證券(ADR)走勢不一。

滙控ADR延續升勢，較本港昨日收市價升逾0.8%。友邦及騰訊ADR升近0.2%或以上。

阿里巴巴、港交所及建行ADR偏軟。京東ADR升近0.3%。"
美元指數失守98關口　分析料明年聯儲局仍會減息,2025-12-24 06:18,,2025-12-24 06:30,cfinance,rthk,https://news.rthk.hk/rthk/ch/component/k2/1837311-20251224.htm,"美元指數偏軟，失守98關口，較早時報97.939，跌近0.3%。雖然美國上季經濟增長高於預期，但市場估計聯儲局明年仍會減息，但時間會推遲至明年6月。

美元兌日圓156.26日圓 ，下跌0.5%。

歐元兌美元報1.1779美元 ，上升0.2%。英鎊兌美元亦上升0.2%，至1.3483美元。"
現貨金逼近4500美元　銀價突破71美元　兩者與銅價均創新高,2025-12-24 06:15,,2025-12-24 06:30,cfinance,rthk,https://news.rthk.hk/rthk/ch/component/k2/1837309-20251224.htm,"金價、銀價及銅價都創新高。

現貨金一度升至每盎司4497.55美元，較早時報4492.3美元，升約1.1%。

2月紐約期金升穿每盎司4500美元，收報4505.7美元，上升0.8%。

現貨白銀曾升至每盎司71.08 美元，較早時報每盎司 71.06 美元，上升3%。

至於銅價突破每噸12000美元大關，之後升勢略為回順至每噸11911美元。
 
受地緣政治緊張局勢、美國減息、央行買入黃金和強勁投資需求推動，今年以來金價已上升約70%。

銀價則升近1.5倍。分析指，市場過去數年一直處於短缺情況，加上日益增長的工業需求，而避險因素、美元下跌預期等亦利好銀價，下一個目標是每盎司75美元，但年底投資者先行獲利，或引發回調。"
油價升0.5%或以上　連升多日,2025-12-24 06:14,,2025-12-24 06:30,cfinance,rthk,https://news.rthk.hk/rthk/ch/component/k2/1837307-20251224.htm,"原油期貨價格連升第5個交易日。投資者關注委內瑞拉和俄羅斯石油供應中斷的風險。

倫敦布蘭特期油收報每桶62.38美元，上升31美仙，升幅0.5%。

紐約期油收報每桶58.38美元，上升37美仙，升幅0.64%。

另外，巴克萊銀行的報告預計，明年上半年石油市場將保持供應充足，但到第4季，石油過剩量將縮減至每天只有70萬桶。"
澤連斯基：烏美周末磋商富成效　俄續施襲顯示普京對和談無誠意,2025-12-24 06:09,,2025-12-24 06:30,cinternational,rthk,https://news.rthk.hk/rthk/ch/component/k2/1837305-20251224.htm,"美國官員過去的周末在邁阿密分別與烏克蘭和歐洲代表，以及俄羅斯代表舉行和平談判，尋求達成和解的可能性。

澤連斯基在聽取代表團匯報與美方的會談結果後表示，磋商富有成效，目前已準備好數份文件草案，主要涉及烏克蘭安全保障、國家重建以及結束當前衝突的基本框架。

不過澤連斯基說，在烏克蘭人準備與家人共度聖誕節之際，俄羅斯星期二對至少13個地區施襲，顯示俄羅斯總統普京仍然無法接受必須停止殺戮的事實，對和平談判毫無誠意，意味世界對俄施加的壓力未夠，呼籲現在是時候作出回應。"
江西有車輛墮入池塘 　造成8人死亡,2025-12-24 05:38,,2025-12-24 05:45,greater_china,rthk,https://news.rthk.hk/rthk/ch/component/k2/1837308-20251224.htm,"江西有車輛墮入池塘 ，造成8人死亡。

彭澤縣公安局通報，定山鎮響水村鄉村道路昨日下午4時許發生一宗車輛落水事故，調查後發現，一名49歲女子駕駛車輛至事發路段時 ，墮入路邊池塘，造成包括這名女子在內車上共8人死亡。當局正進行事故調查及善後處置等工作。"
美股上升　標普500指數創收市新高,2025-12-24 05:31,,2025-12-24 05:45,cfinance,rthk,https://news.rthk.hk/rthk/ch/component/k2/1837306-20251224.htm,"美股先低後高，標普500指數創收市新高。

美國上季經濟以年率計按季增長4.3%，高於預期，亦快過第2季，強化明年首季不會減息預期，但市場料聯儲局明年仍會減息。

道瓊斯指數收報48442點，升79點，升幅0.16%。

標準普爾500指數升穿6900點，報6909點，升31點，升幅0.46%。

納斯達克指數收報23561點，升133點，升幅0.57%。
 
Nvidia升3%，是表現最好標指成份股。其他大型科技股普遍向好。"
