title,date,summary,scrape_time,section,source,url,news_content
恒指全日高位收市　升532點　中資金融股造好,2025-05-14 16:31,,2025-05-14 16:45,local,rthk,https://news.rthk.hk/rthk/ch/component/k2/1804595-20250514.htm,"港股尾市升幅擴大，中美互減關稅中午正式生效。恒指以全日高位收市，報23640點，是大約1個半月以來最高，升532點，升幅2.3%，成交金額逾2228億元。

科技指數升逾2%，報5381點。ATMXJ升逾1%至3%以上。公布業績後的京東健康及京東物流，分別升逾半成及跌近4%。

中資保險股及內銀股顯著造好，中人壽升近6.6%，是表現最好恒指成份股，招行、建行、中行及平保升近2%至4%以上。另外，友邦升逾半成亦支持大市表現。汽車股包括比亞迪、理想升近半成。

內需、資源股亦有資金追捧。不過部分高息及公用股向下。"
港大啟動計劃將運動發展醫學教育科研創新與臨床服務結合,2025-05-14 16:20,,2025-05-14 16:45,local,rthk,https://news.rthk.hk/rthk/ch/component/k2/1804594-20250514.htm,"港大醫學院啟動「運動健康」計劃，目標是透過計劃將運動發展、醫學教育、科研創新與臨床服務結合，構建更健康、更具動力的社區。

香港大學臨床醫學學院矯形及創傷外科學系臨床教授黃德民說，希望通過結合運動科學、復康科學和臨床研究，推動實證為本及具實際效益的創新方案，致力於推動公眾教育和知識交流活動，在社區中培養運動文化。

他又說，年底本港將協辦全運會，港大醫學院會尋求合作機會，例如是提供醫療輔助工作。

港大醫學院公共衞生學院教授及運動學分部主任蕭明輝表示，計劃亦包括外展及研究項目，其中一項由政府資助，為期5年的研究正在進行，因本港有九成學童的運動量都不符世衞建議標準，研究就透過在幼稚園課程中加入不同活動，希望令學童在學校的運動量達標，最終令學童的心肺功能得以提升，有關研究有3000名學童參與，仍要進行多兩年才完成。

蕭明輝希望，透過實證科技，為政策制訂者提供更多數據，再製定革新方法幫助兒童改善身心健康。"
中方：針對美方以芬太尼為藉口對華加徵關稅的反制舉措仍然有效,2025-05-14 16:11,,2025-05-14 16:30,greater_china,rthk,https://news.rthk.hk/rthk/ch/component/k2/1804592-20250514.htm,"在北京，外交部發言人林劍回應有關中美日內瓦經貿高層會談的提問時表示，中美雙方在日內瓦的經貿會談，達成多項積極共識，同意大幅降低雙邊關稅水平，美方承諾取消91%關稅，暫停實施24%的「對等關稅」，相應地中方亦取消91%反制關稅，暫停實施24%的反制關稅，雙方各自保留10%的關稅。

林劍指出，美方以芬太尼為藉口，對中國無理加徵兩輪關稅，中方均第一時間採取包括關稅和非關稅措施在內的反制舉措，堅定維護自身正當權益。這些反制措施仍然有效。"
尖沙咀女子疑遭剪刀刺傷　涉案另一女子被捕,2025-05-14 16:10,,2025-05-14 16:30,local,rthk,https://news.rthk.hk/rthk/ch/component/k2/1804591-20250514.htm,"尖沙咀下午發生傷人案，一名女子懷疑持剪刀刺傷另一名女子，懷疑施襲者被捕，正被扣查；傷者咀部及手部受傷，送往廣華醫院治理。

現場是廣東道與北京道交界附近，事發下午近2時45分，警方接報到場，其後在新太陽廣場拘捕涉案女子。"
立法會通過法例落實公司遷冊制度　保監局表示歡迎,2025-05-14 16:02,,2025-05-14 16:15,local,rthk,https://news.rthk.hk/rthk/ch/component/k2/1804590-20250514.htm,"保險業監管局歡迎立法會通過《2024年公司（修訂）（第2號）條例草案》，為尋求遷冊來港的公司提供簡單且具成本效益的框架。

保監局行政總監張雲正表示，本地具規模而在外地註冊的獲授權保險公司熱切期待《草案》通過，認為公司選擇香港作為據點，反映本地市場受粵港澳大灣區城巿間互聯互通的優勢和吸引力。

他說，保監局將與所有相關持份者緊密合作，讓有興趣的保險公司在新制度下啟動遷冊進程。"
"1,700 job cuts loom at Burberry in wake of loss",2025-05-14 15:38,,2025-05-14 16:30,efinance,rthk,https://news.rthk.hk/rthk/en/component/k2/1804588-20250514.htm,"British luxury fashion label Burberry said on Wednesday it could shed almost one fifth of its global workforce over two years to reduce costs as it fell into an annual net loss.

The troubled group is in the midst of a turnaround plan to help boost sales and cut costs as the global luxury sector struggles with weak consumer demand, notably from China.

Net loss stood at £75 million in the 12 months to the end of March, compared to a profit of £270 million one year earlier.

Further cost-saving measures were announced on Wednesday, targeting an additional saving of £60 million by 2027, which would impact around 18 percent of its workforce, or 1,700 people.

Revenue also fell 17 percent to £2.46 billion.

""While we are operating against a difficult macroeconomic backdrop and are still in the early stages of our turnaround, I am more optimistic than ever that Burberry's best days are ahead,"" said chief executive Joshua Schulman.

Schulman was appointed CEO in July, replacing Jonathan Akeroyd, on a pledge to win back customers with a renewed focus on outerwear, including its famed trench coats.

The group also warned that the economic environment has become ""more uncertain in light of geopolitical developments."" (AFP)"
"1,700 job cuts look at Burberry in wake of loss",2025-05-14 15:38,,2025-05-14 15:45,efinance,rthk,https://news.rthk.hk/rthk/en/component/k2/1804588-20250514.htm,"British luxury fashion label Burberry said on Wednesday it could shed almost one fifth of its global workforce over two years to reduce costs as it fell into an annual net loss.

The troubled group is in the midst of a turnaround plan to help boost sales and cut costs as the global luxury sector struggles with weak consumer demand, notably from China.

Net loss stood at £75 million in the 12 months to the end of March, compared to a profit of £270 million one year earlier.

Further cost-saving measures were announced on Wednesday, targeting an additional saving of £60 million by 2027, which would impact around 18 percent of its workforce, or 1,700 people.

Revenue also fell 17 percent to £2.46 billion.

""While we are operating against a difficult macroeconomic backdrop and are still in the early stages of our turnaround, I am more optimistic than ever that Burberry's best days are ahead,"" said chief executive Joshua Schulman.

Schulman was appointed CEO in July, replacing Jonathan Akeroyd, on a pledge to win back customers with a renewed focus on outerwear, including its famed trench coats.

The group also warned that the economic environment has become ""more uncertain in light of geopolitical developments."" (AFP)"
人才辦全球線上招聘會逾2.6萬人次瀏覽　收約3千份履歷表,2025-05-14 15:35,,2025-05-14 15:45,local,rthk,https://news.rthk.hk/rthk/ch/component/k2/1804587-20250514.htm,"人才辦上星期舉辦全球線上招聘會，兩日錄得超過26000人次瀏覽，收到約3000份履歷表，線上一對一面談錄得約4800次人才與企業直接對話，參與企業表示當中約一半會有後續跟進。

人才辦發言人表示，線上招聘會上星期三及四舉行，聯同近50家香港知名企業，提供超過700個與會計、金融、顧問服務、法律合規及工程等領域相關職位空缺。

參與人才來自超過12個國家或地區，包括內地、新加坡、印度、英國、澳洲、美國、馬來西亞、法國及加拿大等，當中62%更擁有碩士學位。

人才辦會繼續推出針對全球不同地區及不同專業的線上招聘會，以及在本地舉辦招聘活動，協助人才順利來港就業，推動香港經濟長遠發展。"
特首中東行｜李家超晤科威特投資當局　探討推動科技與創新合作,2025-05-14 15:32,,2025-05-14 16:00,local,rthk,https://news.rthk.hk/rthk/ch/component/k2/1804586-20250514.htm,"正在中東訪問的行政長官李家超與科威特直接投資促進局會面，了解當地自由貿易區的運作，他相信今次會面將為兩地長期合作奠定堅實基礎，進一步推動雙方關係邁向新台階。

李家超在社交專頁表示，去年科威特位居香港在中東地區第六大貿易夥伴，科威特是首個與香港簽署促進和保護投資協定的海灣阿拉伯國家，充分體現雙方對營造有利投資環境的共同承諾。

他指出，香港作為國際金融中心，在綠色金融領域發展迅速，可為科威特發展綠色能源等新興產業提供有力支持。雙方在證券市場、資產及財富管理等金融服務領域的合作前景亦十分廣闊。

李家超又說，樂意與科威特直接投資促進局探討共同推動科技發展與創新合作。"
李家超晤科威特當局了解自貿區運作　探討推動科技發展與創新合作,2025-05-14 15:32,,2025-05-14 15:45,local,rthk,https://news.rthk.hk/rthk/ch/component/k2/1804586-20250514.htm,"正在中東訪問的行政長官李家超與科威特直接投資促進局會面，了解當地自由貿易區的運作，他相信今次會面將為兩地長期合作奠定堅實基礎，進一步推動雙方關係邁向新台階。

李家超在社交專頁表示，去年科威特位居香港在中東地區第六大貿易夥伴，科威特是首個與香港簽署促進和保護投資協定的海灣阿拉伯國家，充分體現雙方對營造有利投資環境的共同承諾。

他指出，香港作為國際金融中心，在綠色金融領域發展迅速，可為科威特發展綠色能源等新興產業提供有力支持。雙方在證券市場、資產及財富管理等金融服務領域的合作前景亦十分廣闊。

李家超又說，樂意與科威特直接投資促進局探討共同推動科技發展與創新合作。"
內地股市升近1%或以上　滬指重上3400點,2025-05-14 15:27,,2025-05-14 15:45,cfinance,rthk,https://news.rthk.hk/rthk/ch/component/k2/1804583-20250514.htm,"內地股市下午轉強，3大指數升近1%或以上。金融、港口航運及稀土類股份持續強勢，軍工、光伏及人型機器人股份回調。

上證指數收復3400點收市，是超過1個半月以來首次，報3403點，升29點，升幅0.86%。

深證成份指數報10354點，升66點，升幅0.64%。

創業板指數報2083點，升20點，升幅1.01%。"
加路連山道「創新廚房」食物室不潔及非法擴展營業範圍被取消牌照,2025-05-14 15:14,,2025-05-14 15:30,local,rthk,https://news.rthk.hk/rthk/ch/component/k2/1804585-20250514.htm,"銅鑼灣加路連山道「創新廚房」因食物室不潔及非法擴展營業範圍，屢次違反《食物業規例》，被食環署署長取消牌照，須即時停業。

相關食肆位於加路連山道7號地下，署方發言人表示持牌人去年3月和11月兩次被法庭定罪，共罰款4700元，在違例記分制下被記15分，食肆因此被取消牌照。

有關持牌人亦因非法擴展營業範圍，於 2023年7月至去年6月期間四次被法庭定罪，共罰款10700元，被記下60分，分別被暫時吊銷牌照7和14天。"
太子道西往九龍城方向近荔枝角道有食水管滲漏,2025-05-14 15:11,,2025-05-14 15:30,local,rthk,https://news.rthk.hk/rthk/ch/component/k2/1804584-20250514.htm,"水務署表示，下午接獲報告指太子道西往九龍城方向，近荔枝角道有水管滲漏，經了解後確認涉事水管為一條直徑250毫米食水供水管，經供水調度後，食水供應不受影響。

水務署已聯絡當區區議員及關愛隊，在有需要時提供適切協助，署方就有關事故對市民構成不便表示抱歉。

受事故影響，太子道西往九龍城近荔枝角道部分行車線須暫時封閉，以配合緊急維修工作。 

水務署說，工程團隊正全力搶修，以盡快恢復相關供水及重開受影響的道路。"
疑與他人爭執駕小巴撞私家車　涉事司機及乘客共四人被捕,2025-05-14 15:09,,2025-05-14 15:15,local,rthk,https://news.rthk.hk/rthk/ch/component/k2/1804582-20250514.htm,"元朗大棠路上星期六有小巴及私家車相撞，小巴司機與私家車司機及乘客爭執，有人破壞小巴車身，警方經調查後拘捕4名涉事男子。

元朗警區反三合會行動組高級督察葉穎豪說，警方事發當日上午近11時接報，指一輛私家車沿大棠路往大棠方向行駛，在近水蕉新村時截停一輛小巴，數名男子落車與小巴司機理論，小巴突然駛前及倒車，又兩度撞向私家車，一名從私家車下車的男子，用硬物擊打小巴車身三次。

警方調查發現，涉案小巴司機曾與同一小巴線的司機，因駕駛態度問題爭執，案發當日被相關人士截停理論，期間小巴司機情緒失控蓄意撞向私家車後逃去。

警方其後分別在大樹下西路及十八鄉路，起回涉事小巴及私家車，並在元朗及天水圍拘捕3名本地男子及1名非華裔男子，年齡介乎17至41歲，包括涉案小巴司機，他涉嫌企圖傷人，正被扣查。另外3名被捕人士是私家車司機及乘客，涉嫌刑事毀壞。

警方事後聯同新界北總區，在小巴途經路線進行交通違例事項執法。"
疑與他人爭執駕小巴撞私家車　涉事兩車司機及乘客共四人被捕,2025-05-14 15:09,,2025-05-14 15:45,local,rthk,https://news.rthk.hk/rthk/ch/component/k2/1804582-20250514.htm,"元朗大棠路上星期六有小巴及私家車相撞，小巴司機與私家車司機及乘客爭執，有人破壞小巴車身，警方經調查後拘捕4名涉事男子。

元朗警區反三合會行動組高級督察葉穎豪說，警方事發當日上午近11時接報，指一輛私家車沿大棠路往大棠方向行駛，在近水蕉新村時截停一輛小巴，數名男子落車與小巴司機理論，小巴突然駛前及倒車，又兩度撞向私家車，一名從私家車下車的男子，用硬物擊打小巴車身三次。

警方調查發現，涉案小巴司機曾與同一小巴線的司機，因駕駛態度問題爭執，案發當日被相關人士截停理論，期間小巴司機情緒失控蓄意撞向私家車後逃去。

警方其後分別在大樹下西路及十八鄉路，起回涉事小巴及私家車，並在元朗及天水圍拘捕3名本地男子及1名非華裔男子，年齡介乎17至41歲，包括涉案小巴司機，他涉嫌企圖傷人，正被扣查。另外3名被捕人士是私家車司機及乘客，涉嫌刑事毀壞。

警方事後聯同新界北總區，在小巴途經路線進行交通違例事項執法。"
據報寧德時代以最高發售價每股263元定價,2025-05-14 15:07,,2025-05-14 15:15,cfinance,rthk,https://news.rthk.hk/rthk/ch/component/k2/1804581-20250514.htm,"外電引述消息人士報道，新股寧德時代以最高發售價定價， 每股H股263港元，並擴大發行規模，集資約46億美元，預料是今年全球最大規模上市交易。

報道指，公司將行使發售量調整權，增加發售股數約1770萬股，令上市價值達到356.6億港元，即大約45.7億美元。

寧德時代H股將在本周二至本周五中午期間定價，最高發售價263元，每手100股，下星期二在香港上市。"
Hong Kong liquor imports surge 40pc after duty cut,2025-05-14 14:58,,2025-05-14 15:15,elocal,rthk,https://news.rthk.hk/rthk/en/component/k2/1804574-20250514.htm,"Financial Secretary Paul Chan said on Wednesday that Hong Kong saw a 40 percent surge in liquor imports in the first four months since a reduction in their duties in October.  

Speaking at the opening ceremony of Hofex, an international food and hospitality tradeshow, he said the city's status as a free port, coupled with its efficient customs and logistics networks, positions Hong Kong as a prime location for the industry. 

Chan said that ""Hong Kong is not just opening doors. We are opening more bottles, too.""

""Every day, over 1,000 flights connect us to more than 200 destinations,"" he said. 

""This city simply gives you the best connectivity to the broader market in the Asian region. 

""For wines, we impose no duty, a policy that has been toasting success for years. 

""Last year, we imported approximately 39 million bottles of wines and consumed some 30 million of them. 

""Recently, we have also lowered duties on liquor. The results are encouraging.""

Chan also said Hong Kong is committed to exploring new markets and strengthening ties with Asean and the Middle East, recognising their abundant resources and untapped potential.

He said the number of overall visitors rose 10 percent in the first four months of the year, surpassing 16 million, while the rate of growth for international visitors was even better at 17 percent.

Moves are afoot, he added, to organise more international events to attract high-value visitors.

""If you are thinking of extending the reach of your products and services, Hong Kong is your showroom,"" he said.
 
""Come to Hong Kong, and you will find opportunities."""
韓股升逾1%,2025-05-14 14:39,,2025-05-14 14:45,cfinance,rthk,https://news.rthk.hk/rthk/ch/component/k2/1804580-20250514.htm,"南韓股市升逾1%收市。

首爾綜合指數收報2640點，升32點，升幅1.23%。"
Logistics and SME firms brace for boom in shipments,2025-05-14 14:39,,2025-05-14 14:45,elocal,rthk,https://news.rthk.hk/rthk/en/component/k2/1804571-20250514.htm,"Representatives from the logistics sector and small and medium-sized companies said on Wednesday Hong Kong can expect a sharp rise in outbound shipments as exporters seize the window of opportunity presented by a truce over the next 90 days in the tariffs trade war to send goods to the United States. 

The temporary Sino-US truce took effect at noon on Wednesday. 

Under the deal, the United States agreed to lower its tariffs on Chinese goods to 30 percent while China will reduce its own to 10 percent over the next 90 days. 

Speaking on an RTHK programme, Gary Lau, chairman of the Hong Kong Association of Freight Forwarding and Logistics, said he expects export volumes and demand to pick up as early as next week.

""I think we might still need about four or five more days to digest the new measures as we have to go through the logistical procedures after all and coordinate with importers overseas,"" he said.

""[But] I believe there'll be a more obvious turnaround next week as demand will soar significantly for local exporters during the 90-day grace period. 

""And there could be more demand for air freight due to increased requests from e-commerce platforms.""

The logistics veteran also noted that while a majority of the firms will opt to ship by sea due to cost factors, businesses with more urgent transport needs might turn to air freight, but air transport costs could soar by at least 40 to 50 percent.

Following the truce, the United States also more than halved the duties for small parcels shipped from the mainland, Hong Kong and Macau to 54 percent.  Such charges are under ""de minimis"" duties on small packages valued at less than US$800.

""Now you say that the tariffs are reduced to about 50 percent, but we have a saying 'wool comes from the sheep's back', so those tariffs are still borne by consumers,"" Lau said.

"" And the tariffs are actually still too high."" 

Lau estimated that the volume of small parcels being sent over to the United States from China under the new 54 percent tariff would only reach 70 to 80 percent of levels just before the tariff war and called for more reductions.

""Our industry is currently asking that these tax rates be lowered to 20 to 30 percent, which will be within our expectations,"" he said. 

""That's why we hope the governments from the two sides might have further preferential measures for us.""

For his part, Andrew Kwok, president of The Hong Kong Small and Medium Enterprises Association, said he expects more positive news soon, as US President Donald Trump has said he might speak with President Xi Jinping at the end of the week.

""Of course it's difficult to predict Trump's moves as he could change his mind in a couple of days,"" said the head of the SME body. 

""But I believe that it is very unpleasant for US residents to see tariffs being increased to such an abnormal level. 

""So from this viewpoint, I believe it's not very likely that the tariffs will return to the high level. 

""For us, we are very optimistic as China has been proved strategically right in dealing with the United States, and we are looking forward to better news emerging [when Trump speaks with Xi]. 

Kwok also noted that the small and medium-sized enterprises in Hong Kong have been exploring new markets, such as Saudi Arabia and United Arab Emirates."
日股低收55點,2025-05-14 14:37,,2025-05-14 14:45,cfinance,rthk,https://news.rthk.hk/rthk/ch/component/k2/1804579-20250514.htm,"東京股市偏軟收市。

日經指數收報38128點，跌55點，跌幅0.14%。"
台股高收逾2%,2025-05-14 14:15,,2025-05-14 14:45,cfinance,rthk,https://news.rthk.hk/rthk/ch/component/k2/1804578-20250514.htm,台灣股市顯著上升。加權指數收市報21782點，升452點，升幅2.12%。
HK to help mainland firms pivot amid tariff war,2025-05-14 14:14,,2025-05-14 14:45,elocal,rthk,https://news.rthk.hk/rthk/en/component/k2/1804567-20250514.htm,"The SAR administration has pledged to assist mainland enterprises in repositioning themselves  while offering a ""certain and foreseeable"" operating environment for firms in Hong Kong amid current geopolitical uncertainties.

Acting Secretary for Commerce and Economic Development Bernard Chan also emphasised, in the face of questions by lawmakers on Hong Kong's response to the trade and tariff wars, a need to capitalise on economies' wanting to de-risk in the face of external uncertainties. 

""This is a time when many economies are looking to [diversify] their risks,"" Chan told the legislature.

""We will attract foreign enterprises and investments to come to Hong Kong with an innovative approach.

""We'll adopt a new mindset in helping mainland enterprises to reposition themselves and adjust their plans for world markets by offering them supply chain management services. 

""We can become a regional or [global] headquarters for these enterprises.""

Chan also assured companies in the SAR that they would be operating in a stable environment. 

""We will be steadfast in our position as a free port with zero tariffs,"" he said. 

""We need to provide a certain and foreseeable operating environment for businesses.

""We will deepen connections with our traditional markets while tapping opportunities in emerging markets...so as to expand our 'circle of friends'.""

Chan noted that the government's investment promotion agency helped 223 companies to establish or expand their businesses in Hong Kong in the first four months of the year, up 13 percent from the same period in 2024. 

These firms, brought in through InvestHK, are expected to inject over HK$22.3 billion into the economy and create more than 4,900 jobs. 

More than a quarter of them would like to set up their global or regional headquarters in the SAR."
本港至3月近10萬車位設充電基礎設施　謝展寰稱將多管齊下增量,2025-05-14 14:00,,2025-05-14 14:15,local,rthk,https://news.rthk.hk/rthk/ch/component/k2/1804577-20250514.htm,"環境及生態局局長謝展寰表示，截至今年3月，香港已經有近10萬個停車位設有充電基礎設施。公共充電設施則有11180個，當中約2000個是快速和高速充電設施。政府將繼續多管齊下增加充電設施，包括將傳統油站改建為高速充電站或加裝高速充電設施等。

謝展寰在立法會回覆議員質詢時說，2022年施政報告提出，會在額外7000個政府建築物停車位提供充電設施。截至今年3月，近4160支充電樁已完成安裝工程，其中27支屬於快速或高速充電樁，有關部門已審視其餘工程的進度，今年底可達標。

他又提到，截至今年4月，「EV屋苑充電易資助計劃」下將42000個停車位，已完成安裝電動車充電基礎設施，預計今年年底完成安裝工程的停車位，會增至約77000個，資助計劃於2027至28財政年度完結時，可為約14萬個現有私人住宅樓宇或屋苑停車場內的停車位，完成安裝電動車充電基礎設施。

另外，去年施政報告宣布投入3億元推出高速充電設施鼓勵計劃，目標是提供3000支高速充電樁，以額外支援約16萬輛電動車，預計所有高速充電樁可望陸續由明年至2028年年底前投入服務。政府正最後敲定計劃的實施細節，預計下月推出並開始接受申請。"
