title,date,summary,scrape_time,section,source,url,news_content
交行去年盈利升逾2%　不良貸款率微跌,2026-03-27 17:10,,2026-03-27 17:15,cfinance,rthk,https://news.rthk.hk/rthk/ch/component/k2/1849053-20260327.htm,"交通銀行去年盈利956.2億元人民幣，按年升逾2%。末期息每10股派1.684元人民幣。

去年利息淨收入升1.9%至近1731億元；非利息淨收入925.2億元，上升2.3%，當中手續費及佣金淨收入升3.4%至近382億元，以代理類、理財等財富管理收入增長較好。淨利差1.08厘，按年收窄3個基點；淨利息收益率1.2厘，按年收窄7個基點，因資產端收益率下降較多。

截至去年底，不良貸款餘額近1170億元，按年增加約53億元；不良貸款率1.28%，按年下降0.03個百分點。撥備覆蓋率208.38%，按年上升6.44個百分點。資產減值損失564.42億元，下跌4.1%，其中貸款信用減值損失537.2億元，上升約7.4%。

集團表示，今年會重點支持集成電路、生物醫藥、人工智能等先導產業及國家戰略性新興產業，會持續加強風險管理，聚焦重點領域風險化解，持續加強對房地產、地方政府債務等領域風險監測、排查與化解，保持充足撥備計提，確保風險抵禦能力始終高於監管要求和潛在風險水平。



編輯：宋家樑"
商務部堅決反對美方301調查　中方對美發起兩項貿易壁壘調查,2026-03-27 17:09,,2026-03-27 17:15,greater_china,rthk,https://news.rthk.hk/rthk/ch/component/k2/1849051-20260327.htm,"在北京，商務部表示強烈不滿及堅決反對美國貿易辦公室以產能過剩及未有效禁止強迫勞動產品進口為由，對中國等經濟體發起「301調查」。

發言人表示，為堅決維護中國相關產業利益，依據中國相關法例和規則有關規定，針對美國對華兩項「301調查」，商務部分別就美國破壞全球產供鏈相關做法及措施、美國阻礙綠色產品貿易相關做法與措施，對等發起兩項貿易壁壘調查。

商務部表示，下一步將推進對美壁壘調查工作，並根據調查情況採取相應措施，堅決捍衛自身正當權益。



編輯：羅宇光"
兩健身中心職員涉誘使顧客兌換禮品其後強迫簽署合約　被海關拘捕,2026-03-27 17:07,,2026-03-27 17:15,local,rthk,https://news.rthk.hk/rthk/ch/component/k2/1849050-20260327.htm,"海關採取執法行動打擊健身中心不良營商手法，拘捕兩名連鎖健身中心職員，涉嫌使用具威嚇性營業行為銷售健身服務，違反《商品說明條例》。

海關早前接獲舉報，指一間位於旺角的連鎖健身中心有職員以中獎為由，分別誘使兩名顧客前往健身中心兌換禮品，其後強迫顧客付款和簽署健身合約後，方能離開。他們涉嫌在銷售健身服務的過程中，對顧客施加不當影響，以具威嚇性的銷售手法迫使顧客購買健身服務。

經調查後，關員拘捕一名30歲男子和一名31歲女子。案件仍在調查。



編輯：任順熙"
疑有人進入東鐵綫路軌範圍　東鐵綫服務受阻,2026-03-27 16:59,,2026-03-27 17:15,local,rthk,https://news.rthk.hk/rthk/ch/component/k2/1849048-20260327.htm,"港鐵表示，由於懷疑有人進入東鐵綫路軌範圍，東鐵綫服務受阻，現時東鐵綫來往旺角東至大圍站暫停服務。

東鐵綫其他路段維持服務，其中來往金鐘至旺角東站8分鐘一班車；來往大圍至羅湖站8分鐘一班車；來往大埔墟至落馬洲站為12分鐘一班車。

港鐵呼籲乘客為行程預留充裕時間。



編輯：任順熙"
在岸人民幣兌美元創近3周新低,2026-03-27 16:57,,2026-03-27 17:15,cfinance,rthk,https://news.rthk.hk/rthk/ch/component/k2/1849042-20260327.htm,"在岸人民幣收市報6.9105元兌1美元，較昨日收市價下跌64點子，創近3周新低；中間價報6.9141，跌85點子，下試近3周低位。

市場人士指出，市場對美伊緊張局勢可能持續推高油價的憂慮加劇，美元指數繼續在100關口附近徘徊，人民幣匯率短期預料繼續受壓，但中期仍具較強韌性。



編輯：方嘉莉"
伊朗總統稱決心繼續防禦應對一切侵略行為,2026-03-27 16:57,,2026-03-27 17:15,cinternational,rthk,https://news.rthk.hk/rthk/ch/component/k2/1849047-20260327.htm,"美國總統特朗普於當地星期四在社交媒體發文說，應伊朗政府請求，摧毀伊朗能源設施的行動將推遲10日，期限延至美國東部時間4月6日晚上8時。他說相關談判正在進行中，進展非常順利。

不過，《華爾街日報》就引述美國國防部官員報道，五角大樓正考慮向中東增派多達一萬人的地面部隊，暫時不清楚具體部署地點，但很可能處於能夠對伊朗及伊朗石油出口樞紐哈爾克島實施打擊的範圍內。

伊朗總統佩澤希齊揚在與伊拉克總統拉希德的通話中強調，伊朗決心繼續進行正當而有力的防禦，應對一切侵略行為。伊朗外長阿拉格齊與聯合國秘書長古特雷斯通電話時就指出，阻止敵對國家及其盟友的船隻通過霍爾木茲海峽是伊朗的合法權利。



編輯：羅宇光"
中共中央政治局會議強調地方黨委領導要堅定不移推進全面從嚴治黨,2026-03-27 16:55,,2026-03-27 17:15,greater_china,rthk,https://news.rthk.hk/rthk/ch/component/k2/1849046-20260327.htm,"中共中央政治局召開會議，審議《中國共產黨地方委員會工作條例》。中共中央總書記習近平主持會議。
　　
會議指出，地方黨委要堅決維護以習近平為核心的黨中央權威及集中統一領導，將貫徹落實黨中央決策部署作為重中之重，對黨中央定下來的事扭住不放、狠抓落實，同時緊密結合本地區實際，增強工作主動性、創造性。

會議強調，地方黨委領導班子成員要提高專業素質，著力提高領導能力，堅定不移推進全面從嚴治黨，鍥而不捨嚴格貫徹中央八項規定及實施細則精神，深入整治形式主義為基層減負，依法依規用權，守好廉潔底線，推動形成風清氣正的政治生態。



編輯：羅宇光"
15 airlines to begin relocating counters to T2,2026-03-27 16:52,,2026-03-27 17:15,elocal,rthk,https://news.rthk.hk/rthk/en/component/k2/1849039-20260327.htm,"The airport on Friday said 15 airlines, including Hong Kong Express, will start relocating their check-in counters from Terminal One to Terminal Two in phases. 

Passenger departure facilities at the expanded T2 are set to commence operations on May 27. 

In a statement, the airport noted that other carriers involved, including Hong Kong Airlines and Greater Bay Airlines, primarily operate regional routes. 

It added the relocation process is expected to wrap up by June 10 before the summer travel season starts. 

""To ensure smooth relocation and operations at T2, the Airport Authority has undertaken comprehensive preparations and will maintain close communication with the relevant airlines, business partners and stakeholders,"" it said in the statement.

""Other passenger facilities of T2 will be commissioned in accordance with passenger traffic demand.""

It also noted that the new terminal's departures level is ""seamlessly"" connected to the Airport Express platform, as well as other types of public and private transport, including 29 bus routes.

A new six-storey car park offering more than 1,000 spaces, is also directly linked to the terminal via a short covered walkway. 

Hong Kong Express said it welcomes the relocation plan, adding that it looks forward to enhancing customer experience through the new terminal's ""state-of-the-art"" facilities.

""These would facilitate more seamless self-service at check-in and boarding and support further passenger growth,"" it said.


Edited by Aaron Tam"
依據票價調整機制　港鐵今年連續第二年凍結票價,2026-03-27 16:51,,2026-03-27 17:15,local,rthk,https://news.rthk.hk/rthk/ch/component/k2/1849043-20260327.htm,"按港鐵票價調整機制計算，港鐵今年將連續第二年凍結票價。

政府統計處公布運輸業名義工資指數最新數字，連同早前公布的綜合消費物價指數按年變動，套進方程式計算，計及生產力因素帶來的減幅，得出今年票價調整幅度為1.4%，較啟動加價的門檻1.5%為低。

另外，票價加幅亦設「封頂」機制，不可高於相應期間「家庭住戶每月入息中位數」變動，而去年因凍結票價，屬「滾存年度」，因此今年計算入息中位數變動時，需以去年第四季與2023年第四季比較。據統計處早前公布，兩者同為3萬元，變動為0%，因此港鐵今年需要凍結票價。

至於今年票價調整機制計算得出的加幅，將連同過去的累積加幅，一併延後處理。


編輯：譚佩貞"
龍湖集團料明年業務恢復增長　內地樓價今年跌幅有望大幅收窄,2026-03-27 16:35,,2026-03-27 16:45,cfinance,rthk,https://news.rthk.hk/rthk/ch/component/k2/1849041-20260327.htm,"內房商龍湖集團去年錄得核心淨虧損17億元人民幣，前一年核心盈利69.7億元，並且自2009年上市以來首次不派發末期息。集團指出，去年開發業務銷售毛利率明顯受壓，並在去年及今年集中體現，形容為公司低點，預料明年將恢復增長。

董事長陳序平在業績記者會上說，整個市場已歷時5年深度調整，政策亦持續加碼，今年樓價跌幅有望大幅收窄，實現止跌回穩。

他表示，今年開發業務仍然聚焦去庫存等，並繼續以經營現金流驅動增長，全年力爭實現50億至100億元淨現金流，最遲至2028年，集團運營及服務業務收入超過土地開發收入，徹底完成債務結構轉型。



編輯：方嘉莉"
港股高收95點　惟未能企穩25000點　本周累計挫逾1%,2026-03-27 16:29,,2026-03-27 16:45,cfinance,rthk,https://news.rthk.hk/rthk/ch/component/k2/1849038-20260327.htm,"港股回升，但未能企穩25000點關口，恒生指數最多升約240點，高見25095點，收市報24951點，升95點，升幅約0.4%，主板成交額約2631億元。

主要分類指數靠穩，科技指數升0.35%，報4778點。ATMXJ個別發展，小米升近2%，美團跌近1%。中芯績後跌逾1%。

醫藥股造好，信達生物及石藥分別急升約8%及約14%，是表現最好兩隻藍籌股。

金融股個別發展，平保績後升近2%，中銀及友邦跌約1%或以上。

海爾智家績後跌逾4%，是表現最差恒指及科指成份股。

地產股受壓，新地跌逾1%，龍湖跌近4%。

總結全星期，恒指累計跌約1.3%，連跌4星期；科指跌近2%。



編輯：李意琴"
中原城市領先指數按星期跌0.11%　結束兩星期升勢,2026-03-27 16:28,,2026-03-27 16:45,cfinance,rthk,https://news.rthk.hk/rthk/ch/component/k2/1849040-20260327.htm,"反映本港二手樓價走勢的中原城市領先指數（CCL）最新報150.88，按星期跌0.11%。

中原地產表示，中東緊張局勢升溫，引發港股下挫，金融市場波動，CCL連升兩星期後回軟，但指數仍處於逾兩年來的第2高水平，今年以來累計升4.7%。

大型屋苑、中小型單位樓價指數，按星期都跌約0.2%，同樣結束兩星期升勢；大型單位則升0.2%，連升3星期。

各區樓價個別發展，新界西及九龍分別按星期跌0.5%及1%，新界東及港島分別升0.2%及0.9%。

中原指，港股近期失守25000點關口、港元1個月拆息跌穿2厘、有中小型銀行推出H+0.6厘的拆息掛鈎按揭計劃，預料對二手樓價的影響將於4月開始反映。



編輯：宋家樑"
居民上樓需經有蓋通道進出　部分損毀嚴重單位只可一名住戶進入,2026-03-27 15:54,,2026-03-27 16:15,local,rthk,https://news.rthk.hk/rthk/ch/component/k2/1849037-20260327.htm, 
張曼莉出席中關村論壇　強調京港澳三地科技互補性強合作空間廣闊,2026-03-27 15:51,,2026-03-27 16:15,local,rthk,https://news.rthk.hk/rthk/ch/component/k2/1849036-20260327.htm,"中關村論壇正在北京舉行，在京港澳科技創新論壇上，有來自三地的機構就科創合作項目簽約，涉及人工智能企業出海及智能機器人場景落地。

創新科技及工業局副局長張曼莉出席活動致辭表示，京港澳三地的科技互補性強，合作空間廣闊，北京科研實力深厚、產業生態完善；香港有聯通國際、科研體系、全球資本與人才；澳門則有多元化應用場景等優勢。她表示，將推動三地更多聯合科研攻關、成果轉化、資本市場對接和國際市場開拓等多方面的協作。

她說，本港正全力將人工智能打造成引領未來的核心產業，並推出一籃子政策舉措，加強產業基礎和強化創新動能。早前推出的100億元創科產業引導基金，將爭取於年內投入，引導更多資本投向人工智能、機器人等未來產業等。

生產力局首席數碼總監、內地業務首席執行官黎少斌，在北京接受訪問時表示，正推動新質生產力方面與北京企業加強合作，特別是具身智能和人工智能領域，香港可以協助北京企業尋找海外應用場景，認為香港與國際接軌方面有優勢。

黎少斌說，本港的融資渠道優勢吸引不少企業發展，今年將更關注協助企業融資工作，多與金融機構來往，舉辦活動時會特別邀請風險投資基金參與等，讓更多投資者找到有潛力企業。如有投資機構需要建議，包括評估前景等，生產力局亦會配合。他又歡迎「出海」企業來港成立業務，包括建立智能生產線。


編輯：譚佩貞"
鄧炳強：宏福苑居民上樓需登記核實身份　現場設聯合指揮中心協調,2026-03-27 15:43,,2026-03-27 16:00,local,rthk,https://news.rthk.hk/rthk/ch/component/k2/1849034-20260327.htm, 
John Lee welcomes Singapore PM to Hong Kong,2026-03-27 15:40,,2026-03-27 16:00,elocal,rthk,https://news.rthk.hk/rthk/en/component/k2/1849027-20260327.htm,"Chief Executive John Lee welcomed Singapore's Prime Minister Lawrence Wong to Hong Kong on Friday, hailing the Singaporean leader's first official trip to the SAR since taking office as highly significant.

Lee received Wong at Government House and underscored the deep ties between the two cities at the meeting.

""Hong Kong and Singapore grow as the heartbeats of Asia and we have a long-standing friendship,"" Lee said, adding that both share a commitment to free trade, multilateralism and rules-based organisations such as the United Nations and the World Trade Organization.

""We believe in building bridges, dialogue and collaboration. We believe in win-win, creating a bigger cake for everybody.""

Lee recalled making his own first official trip to Singapore as Chief Executive in 2023. 

He expressed the hope for more frequent exchanges between leaders and senior officials of the two governments.

Wong for his part said he is looking forward to learning about Hong Kong’s latest developments, including its five-year plan and the Northern Metropolis project.

“I'd like to see what Hong Kong is doing and how Singapore can participate in some of these opportunities too,” he said.

Wong noted that the occasional competition between the cities is ultimately ""healthy"".

""When we connect with one another, the pie grows, and we both benefit because we both believe in free trade, we both believe in rules-based multilateralism,"" he said.

He added that closer cooperation between Singapore and Hong Kong is especially vital in an increasingly fragmented world.

Senior officials, including Financial Secretary Paul Chan, Secretary for Financial Services and the Treasury Christopher Hui, Secretary for Development Bernadette Linn, Secretary for the Civil Service Ingrid Yeung and Secretary for Innovation, Technology and Industry Sun Dong also attended the meeting.


Edited by Aaron Tam"
李家超稱粵港合作迎來多個里程碑　見證粵港並肩前行堅實步伐,2026-03-27 15:39,,2026-03-27 15:45,local,rthk,https://news.rthk.hk/rthk/ch/component/k2/1849033-20260327.htm,"行政長官李家超在香港廣東社團總會活動視像致辭，表示過去一年，粵港合作迎來多個里程碑，從粵港澳首次共同承辦十五運會和殘特奧會，成功呈獻一場「簡約、安全、精彩」的體育盛會；到河套深港科技創新合作區香港園區正式開園，為大灣區協同創新注入強大動能；再到「粵車南下」順利實施，讓兩地居民往來更便捷緊密；每一個里程碑都見證粵港並肩前行的堅實步伐。
 
李家超表示，今年是國家「十五五」規劃的開局之年，規劃強調要鞏固提升粵港澳大灣區動力源作用，深化大灣區建設。他又說，會馬不停蹄，深化規則銜接和機制對接，促進人流、物流、資金流、數據流跨境便捷流動；會馬力全開，加快北部都會區建設，用好河套香港園區，加強與廣東的產學研協同發展。在這過程中，廣總憑藉在大灣區的深厚根基，定能在促進兩地互通、推動大灣區城市創科產業協同發展當中，發揮積極作用、貢獻更大力量。
 
他又說，今年亦是亞太經合組織「中國年」。國家作為東道主，將會在廣州、深圳、澳門等不同城市舉辦一系列會議活動，當中財政部長會議將於10月在香港舉行，政府會全力促成會議順利舉行。香港廣東社團總會擁有龐大的鄉親網絡，定能與政府攜手，向世界各地的訪客展現中華文化，呈現香港作為國際大都會的獨特魅力和無限機遇，共同說好國家和香港故事。



編輯：任順熙"
One-stop immigration clearance set for Huanggang Port,2026-03-27 15:36,,2026-03-27 15:45,elocal,rthk,https://news.rthk.hk/rthk/en/component/k2/1849011-20260327.htm,"The new Huanggang Port will introduce a ""collaborative inspection and joint clearance"" model that allows travellers to complete both Hong Kong and mainland immigration procedures in a single stop, Secretary for Security Chris Tang said on Friday.

Speaking at a Legislative Council panel meeting, he said the new system was expected to cut the average crossing time from 30 minutes to roughly five.

Of the 134 automated e-channels, he said, travellers can choose between document-reading or face-scanning clearance.

The document-reading mode will see users – Hong Kong residents aged seven or above, home-return permit holders, mainland travel-permit holders and those registered for the mainland e‑channel – place their travel papers on a reader at the channel entrance, then provide facial and fingerprint verification inside the channel, in which immigration authorities on both sides are then able to verify identities simultaneously.

""Residents holding a Hong Kong identity card and a home-return permit will need to present their permit when travelling north to Shenzhen,"" Tang said.

""When travelling back to Hong Kong, they just need to present their Hong Kong identity card.

""We will continue to discuss these arrangements with the relevant mainland authorities and explore the possibility of optimising the arrangements.""

The face-scanning mode, available to Hong Kong residents aged 14 and above after a one-time registration, requires no physical travel document.

All travellers need to do, Tang said, is look into a camera at the entrance for information retrieval and then go through a second scan along with fingerprint capture inside the channel.

For travellers who prefer assistance with making the crossing, there will be 68 counters along the boundary line.

Drivers, Tang said, will follow a different procedure, with vehicles entering a “joint one-stop” lane equipped with an integrated information collection device on the outbound side.

Drivers undergo a single, simultaneous collection of body temperature, travel document data, facial image and fingerprints, which is instantly transmitted to both Hong Kong and Shenzhen authorities for concurrent inspection.

Passengers in cars and cross-boundary coaches will generally disembark and go to the clearance halls while the driver handles vehicle clearance.

Tang said the new port would not have sufficient on-site parking for cars and tourist coaches.

""However, we are planning to find a site near by. The location has yet to be confirmed, possibly the existing San Tin Interchange, where we could maybe build a carpark,"" he said.

""People can park, and then take a shuttle bus service that will take a few minutes to reach the new Huanggang Port. From there, they can transfer to transportation facilities on the mainland.

""This is part of what we are planning. The details are still being worked out.""

Tang also said the government will strive to achieve the goal of having the port ready for commissioning within the term of the current administration.

The exact commissioning timeline and operational details, he said, remain subject to further discussion between the two governments.



Edited by Altis Wong"
宏福苑7幢樓居民4月20至5月4日可回單位執拾　最多留3小時,2026-03-27 15:34,,2026-03-27 15:45,local,rthk,https://news.rthk.hk/rthk/ch/component/k2/1849032-20260327.htm, 
立法會強烈譴責英國發表報告詆毁香港　促立即停止政治操作　,2026-03-27 15:27,,2026-03-27 15:45,local,rthk,https://news.rthk.hk/rthk/ch/component/k2/1849031-20260327.htm,"立法會強烈譴責英國發表「香港半年報告」詆毁香港發展，抹黑香港社會、法治、人權等狀況，當中對香港特區立法會選舉和立法會工作的描述不盡不實，斷章取義，敦促英方正視事實，切實尊重中國主權，立即停止就香港事務指手畫腳，停止政治操作，多作有利香港同英國交流合作的好事、實事。

發言人表示，自2021年完善選舉制度、落實「愛國者治港」原則後，立法會選舉均在公平、公正及公開的原則下順利完成，並體現廣泛代表性與社會均衡參與。現時立法會已徹底擺脫以往對立內耗、失序失效的亂象，重回理性、高效、務實的正軌，各項立法工作有序推進，協助特區政府持續推動經濟發展、改善民生福祉，成績有目共睹。

發言人指出，立法會是香港特區憲制下獨一無二的立法機關，是特區管治團隊重要一員。議員必須由愛國者出任，是世界通行的政治原則。任何對本港完善選舉制度的惡意貶損，都顯然別有用心，罔顧香港特區的實際情況，立法會對此表示強烈反對。

聲明又指出，為令立法會更高質高效發揮憲制職能，全體議員以更高標準要求自己，制訂《立法會議員守則》，以進一步訂明議員履職盡責的標準，當中要求議員應真誠支持行政長官和特區政府依法施政，以建設性態度履行職務，建言獻策，不故意貶損行政長官和特區政府管治威信，不刻意破壞或削弱行政主導的施政效能，相關《守則》經全體議員同意修訂，更是體現行政立法同心治港的新格局，任何人不應對《守則》斷章取義， 貶損立法會成效。



編輯：任順熙"
滬深股市高收近1%或以上　本周累計都跌,2026-03-27 15:17,,2026-03-27 15:30,cfinance,rthk,https://news.rthk.hk/rthk/ch/component/k2/1849026-20260327.htm,"滬深股市低開高走，全日升近1%或以上。創新藥、化肥、電池等股份造好；保險、銀行、電力、煤炭股偏軟。

上證指數重返3900點水平，收報3913點，升24點，升幅0.63%。

深證成份指數報13760點，升153點，升幅1.13%。

創業板指數於3300點水平上落，收報3295點，升23點，升幅0.71%。

總結本星期，滬股累計跌約1.1%，連跌4星期；深證成指跌約0.8%，創業板指數跌約1.7%。



編輯：宋家樑"
位於珠江口以西雷雨區逐漸靠近　料未來一兩小時影響本港,2026-03-27 15:16,,2026-03-27 15:30,local,rthk,https://news.rthk.hk/rthk/ch/component/k2/1849028-20260327.htm,天文台發出特別天氣提示，表示現時位於珠江口以西的雷雨區正逐漸靠近，並預料會在未來一兩小時影響本港。市民請留意天氣變化。
機場二號客運樓離港設施5月啟用　多間航空公司分段搬遷登記櫃檯,2026-03-27 14:50,,2026-03-27 15:15,local,rthk,https://news.rthk.hk/rthk/ch/component/k2/1849024-20260327.htm,"香港國際機場二號客運大樓旅客離港設施，今年5月27日投入服務。15間航空公司由當日起，將其設於一號客運大樓的登記櫃檯，分階段遷至二號客運大樓。

該15間主要營運區域航線的航空公司，包括3間本地航空公司：香港快運、香港航空及大灣區航空。整個搬遷安排於6月10日完成，迎接暑假旅遊旺季。

旅客可使用不同公共交通工具前往二號客運大樓，機場快綫月台無縫接駁二號客運大樓離港層與一號客運大樓；29條巴士路線將停靠二號客運大樓離港層。

二號客運大樓亦由一條短程有蓋行人通道連接三號停車場，該6層高新停車場提供逾1000個車位，已開放予公眾使用。

為確保搬遷工作及二號客運大樓運作暢順，機管局已作準備，繼續與航空公司、業務夥伴及持份者保持緊密溝通。二號客運大樓的其他旅客設施，將按旅客需求逐步啟用。



編輯：任順熙"
