title,date,summary,scrape_time,section,source,url,news_content
益豐大廈仍有兩座未復電　管理處料今日稍後可復電,2025-07-27 17:16,,2025-07-27 17:45,local,rthk,https://news.rthk.hk/rthk/ch/component/k2/1815328-20250727.htm,"土瓜灣益豐大廈停電事故，其中兩座仍未恢復供電，管理處在大堂貼出通知指，預計今日稍後可恢復供電。

署任九龍城民政事務專員胡皓文表示，各單位正在搶修，A、C座大廈電掣被水浸濕、損毁程度較大，因此不會等電掣完成維修後才恢復供電，搶修團隊會以臨時搭建物取代原有電掣，希望先恢復供電再完成整個電掣的維修工作。今日亦會開放紅磡及啟德社區會堂庇護中心，讓有需要居民使用。

有在大廈內的護老院，有長者留在護老院內。民建聯立法會議員李慧琼表示，社會福利署已多次上門探訪護老院，了解長者狀況，並擺放臨時電力及通風設施於護老院內。她說，根據早前會議，各方都以盡快供電為最大前提，認為管理公司作為專業的管理單位，在維修事務上應付最大責任。

九龍城區議員關浩洋引述中電說，會搭建臨時總掣，大廈法團及電力公司配合進行拉線、組裝零件，將大廈電力接駁至中電的臨時總掣，預計工程要到黃昏才有最新進展。"
特區政府反對抹黑警方依法緝捕潛逃境外危害國安分子,2025-07-27 17:08,,2025-07-27 17:15,cinternational,rthk,https://news.rthk.hk/rthk/ch/component/k2/1815327-20250727.htm,"特區政府強烈反對和不滿美國、加拿大、澳洲等地的官員政客、以及反華組織等歪曲事實，抹黑特區依法緝捕潛逃境外危害國家安全分子的行動，認為有關外國官員、政客及反華組織漠視不法分子的犯罪行為，更刻意抹黑特區政府依法採取的措施及行動，並發表不負責任言論，試圖混淆視聽。

發言人表示，「香港議會」是一個旨在顛覆國家政權的組織，目標包括推動「自決」、制定所謂「香港憲法」，以非法手段推翻、破壞《中華人民共和國憲法》所確立的中華人民共和國根本制度，或推翻中華人民共和國中央政權機關或者特區政權機關等，涉嫌干犯《香港國安法》，警方依法向法院申請拘捕令，並通緝有關人士，強調任何妄顧事實而以失實言論抹黑香港特區維護國家安全工作，都是偽善和不負責任，不得人心。

發言人又指，《香港國安法》和《維護國家安全條例》均明確規定維護國家安全應當尊重和保障人權，亦依法保護香港居民根據《基本法》，以及《公民權利和政治權利國際公約》和《經濟、社會與文化權利的國際公約》適用於香港特區的有關規定下享有的權利和自由，但針對極少部分危害國家安全的組織和個人，特區政府對這犯罪行為絕不姑息。"
克宮發言人稱確定俄烏未來互動原則前須先確認軍事任務已完成,2025-07-27 16:55,,2025-07-27 17:15,cinternational,rthk,https://news.rthk.hk/rthk/ch/component/k2/1815326-20250727.htm,"俄羅斯克里姆林宮發言人佩斯科夫表示，特別軍事行動後的俄烏關係，目前仍是過於理論化的問題，在確定莫斯科和基輔未來互動原則之前，必須先確認軍事任務已經完成。

佩斯科夫又說，俄羅斯更傾向透過政治與外交手段，與烏克蘭實現和平，但基輔及烏克蘭的西方盟友，拒絕所有關於和平對話的提議，因此特別軍事行動仍然繼續。

另外，美國國務卿魯比奧說，總統特朗普對於等待俄羅斯採取行動、結束俄烏衝突的耐心，正在逐漸消退。他說雖然與俄羅斯總統普京保持良好互動與通話，但始終未能取得實質進展，令特朗普越來越感到挫敗，認為現在到了必須採取行動的時候。"
北京河北等地暴雨　中央氣象台繼續發布暴雨黃色預警,2025-07-27 16:26,,2025-07-27 16:45,greater_china,rthk,https://news.rthk.hk/rthk/ch/component/k2/1815325-20250727.htm,"北京及河北等地落暴雨，中央氣象台繼續發布暴雨黃色預警，預計未來幾天，華北和東北等地仍然會有雨。

央視報道，陝西、山西、河北、北京、浙江、福建等地，出現大雨或暴雨，其中北京懷柔和密雲兩個區，局部地區出現特大暴雨。北京市當局發布山洪災害黃色預警，指今明兩日北京多地發生山洪的可能性高，提醒公眾遠離河道，暫停涉山涉水戶外活動。

水利部亦針對北京市，啟動洪水防禦四級應急響應，要求地方水利部門和相關機構密切監察天氣變化，及時發布預警信息，做好調度和防禦工作。

另外央視報道，山西省大同市有一架小型貨車，在暴雨下行駛，期間遇險失聯，當局正在搜救。"
海泓道新橋今啟用　部分巴士線改道,2025-07-27 16:01,,2025-07-27 16:15,local,rthk,https://news.rthk.hk/rthk/ch/component/k2/1815324-20250727.htm,"油麻地海泓道往西區海底隧道及連翔道北行方向的新建行車橋今日早上6時起開放，九巴城巴有3條聯營路線相應改道行駛，包括914、914P，及914X號線，現有車站不受影響。

因應中九龍繞道油麻地路段的接駁工程，西九龍公路南行方向油麻地出口，下月3日凌晨1時起將會封閉。往油麻地的車輛須經連翔道南行方向或其他路線前往目的地；往旺角或經紅隧往香港的車輛，可沿東京街西、通州街天橋及按現有指示前往目的地。

運輸署表示，有關路段的行車時間可能會略為延長，呼籲駕駛人士應保持忍讓，市民亦應預早計劃行程，預留足夠時間出行。"
民建聯到英國駐港領事館請願　反對抹黑香港國安法,2025-07-27 15:32,,2025-07-27 16:00,local,rthk,https://news.rthk.hk/rthk/ch/component/k2/1815323-20250727.htm,"民建聯副主席陳勇、陳學鋒、立法會議員梁熙、顏汶羽等聯同多名成員，到英國駐港領事館請願，強烈反對英國官員及美西方政客蓄意抹黑《香港國安法》。

民建聯強調，堅定支持警方國安處懸紅通緝19名反中亂港分子，並對該等人士假借「香港議會」名義組織非法選舉活動，圖謀顛覆國家政權，予以最嚴厲譴責。

民建聯說，香港警方今次通緝各名反中亂港分子，明確列出了相關的法律依據和基本事實，證據確鑿，對於個別英國及美西方政客無視事實真相，公然詆譭香港警方依法執法行動，刻意抹黑《香港國安法》，並持續干預香港事務及中國內政的行徑，表示強烈不滿與堅決反對。"
國家農業農村部等發布方案擴大農產品消費　釋出拓消費擴內需信號,2025-07-27 15:16,,2025-07-27 16:30,greater_china,rthk,https://news.rthk.hk/rthk/ch/component/k2/1815322-20250727.htm,"國家農業農村部等十個部門，發布促進農產品消費實施方案，釋放消費潛力，有力、有效擴大農產品消費。

在優化供給方面，方案提出優化綠色優質產品的供給，滿足多層次消費需求，並從推進品質評價與質量分級、開發新型加工產品，以及創新地方特色食品等，進行部署。方案亦提出發揮電商平台優勢，提升網絡消費質效，以及開展產銷區域合作，加強協作以促消費。

新華社報道，方案釋出拓消費、擴內需的積極信號，對持續推動經濟穩中向好，具有重要意義，又指依託農業農村的特色資源，開發農業多種功能、挖掘鄉村多元價值，推動產業融合發展，令更多優質土產走向大市場，拓闊鄉村振興新路。"
國家農業農村部等部門發布方案以釋放潛力擴大農產品消費,2025-07-27 15:16,,2025-07-27 15:30,greater_china,rthk,https://news.rthk.hk/rthk/ch/component/k2/1815322-20250727.htm,"國家農業農村部等十個部門，發布促進農產品消費實施方案，釋放多樣化、品質化、差異化的消費潛力，有力、有效擴大農產品消費。

在優化供給方面，方案提出優化綠色優質產品的供給，滿足多層次消費需求，並從推進品質評價與質量分級、開發新型加工產品，以及創新地方特色食品等，進行部署。

方案亦提出發揮電商平台優勢，提升網絡消費質效，以及開展產銷區域合作，加強協作以促消費。方案強調要加強部門之間的協同，在完善配套、強化財政金融支持、推進全鏈條協同監管等方面，作出部署。"
荃灣悅來酒店謀殺及自殺案　警方稱涉事家庭沒家暴紀錄及財困,2025-07-27 14:36,,2025-07-27 15:00,local,rthk,https://news.rthk.hk/rthk/ch/component/k2/1815321-20250727.htm, 
印度北部一間寺廟發生人踩人　至少6死25傷,2025-07-27 14:14,,2025-07-27 14:30,cinternational,rthk,https://news.rthk.hk/rthk/ch/component/k2/1815319-20250727.htm,"印度北部北阿肯德邦一間寺廟發生人踩人，造成至少6人死亡、25人受傷。

事發在當地星期日，官員說，警方和其他救援隊已抵達現場救援，傷者已被送往當地醫院。

據報事件是由於有高壓電線跌落在寺廟附近的道路上，引發大批信徒恐慌，事後紛紛逃生。"
以色列國防軍稱將於加沙部分地區戰術性暫停軍事活動,2025-07-27 14:12,,2025-07-27 14:30,cinternational,rthk,https://news.rthk.hk/rthk/ch/component/k2/1815320-20250727.htm,"以色列宣布國防軍將從今日起，於上午10時到晚上8時，在加沙地帶部分人口稠密的地區，戰術性暫停軍事活動。

以色列國防軍發聲明表示，出於人道主義目的，會在非任務區域，包括馬瓦西、代爾巴拉赫及加沙城，暫停軍事活動，時間為上午10時至晚上8時，直至另行通知，有關決定是與聯合國及國際組織商討後作出。央視報道，以軍確認除指定區域外，戰鬥不會停止，國防軍將繼續行動，消除行動區域內的武裝份子及其基礎設施，警告民眾勿返回行動區域。

較早時，以色列國防軍說進行了一次人道主義援助空投，並指這是允許及協助物資進入加沙的持續努力一部分。"
HK GDP to grow for tenth quarter: FS,2025-07-27 13:55,,2025-07-27 14:15,elocal,rthk,https://news.rthk.hk/rthk/en/component/k2/1815312-20250727.htm,"Financial Secretary Paul Chan said Hong Kong's Gross Domestic Product is expected to grow for a tenth consecutive quarter, as estimates for the second quarter this year will be announced later in the week. 

Writing on his blog on Sunday, Chan said the city's economic growth is supported by export activity, investments and private consumption. 

He said government efforts to promote mega-events and high value-added tourism, along with support from the private sector, had improved market sentiment. 

Chan said this was reflected in retail sales figures for May, which recorded the first year-on-year growth in 14 months. He said he was also 'cautiously optimistic' about June's figures.

The minister added that the Football Festival at Kai Tak and the Animation-Comic-Game fair at the Convention and Exhibition Centre in Wan Chai both attracted local and overseas fans, boosting product sales and creating business opportunities. 

Meanwhile, the finance chief said the labour market remained stable, with the median monthly salary of full-time employees this March-to-May increasing to HK$25,000, an almost seven percent rise from the same period last year. 

Chan added that during economic transformation, different industries experience varying challenges, with labour-intensive industries such as retail and catering facing pressure. 

He said he expected the labour market to remain stable, and the government would strengthen its retraining programmes."
施政報告2025｜首場地區諮詢會　市民關注北都及青年發展等,2025-07-27 13:54,,2025-07-27 14:15,local,rthk,https://news.rthk.hk/rthk/ch/component/k2/1815318-20250727.htm,"行政長官李家超率領官員出席首場施政報告地區諮詢會，聽取市民意見。

其中一名出席地區諮詢會的市民高先生，本身是測量學系學生，他在會上表示非常關注北部都會區的發展，期望政府能夠盡快公開該發展時間表。高先生說，公開發展時間表有助建築界、測量界的學生了解該區的發展進度，以投身工作，又說對香港未來抱很大期待，認為本地及大灣區有許多發展空間。

另一名市民黃小姐，是一間非華語小學的校長，她關注非華語人士在港的權益，希望政府給予他們公平的升學及就業機會。她在會上建議在公營機構內增加有關非華語人士的支援。

洪小姐認為是次諮詢會是一個很好的平台，讓地區人士與司局長直接交流，她最關心青年發展與福利，又說最深刻的是李家超表示，地區工作是每區都很獨特，每個區都有不同的需要。"
"CE urged to support ethnic minorities, boost birthrate",2025-07-27 13:45,,2025-07-27 14:15,elocal,rthk,https://news.rthk.hk/rthk/en/component/k2/1815317-20250727.htm,"Shoring up support for Hong Kong's ethnic minority population and boosting the fertility rate were among a number of appeals to Chief Executive John Lee as he attended a meeting in Hung Hom on Sunday to gather views for his upcoming policy blueprint. 

Dozens among the more than 100 people attending put forward their suggestions and concerns in the two-hour televised forum, including a kindergarten teacher representing ethnic minorities who called for better learning and career opportunities for the population. 

""How would the government help ethnic minority families and their next generation for them to have a fairer and more equal learning environment, while providing them with appropriate support both inside and outside of school?"" she asked. 

In response, the city's leader said his administration is working to build a more inclusive community.

""I understand very well that we need to provide support for them in many aspects, such as language, especially Cantonese and learning Chinese. Every year, the Education Bureau has a number of subsidies and measures [on that front],"" Lee said. 

""There are also care teams dedicated to ethnic minorities to better understand their culture and background.""

Some other issues covered focused on addressing the city's low birth rate and assisting young people. 

The Chief Executive said the government had rolled out a number of measures to encourage childbirth, such as a HK$20,000 handout and tax reduction.

Lee was also urged to roll out support measures for the elderly, provide resources to the arts, and provide more funding for the development of innovation and technology. 

""When formulating policies, the government has to take care of things on both the macro and micro level. On the macro level, we need to make the pie bigger. When the pie is bigger, everyone benefits from it. It's equally important to ensure each person has a larger share of the pie,"" he said. 

Lee will hold another town hall meeting next week, before delivering his fourth annual Policy Address in September."
CE gathers views for his Policy Address,2025-07-27 13:45,,2025-07-27 17:45,elocal,rthk,https://news.rthk.hk/rthk/en/component/k2/1815317-20250727.htm,"Shoring up support for Hong Kong's ethnic minority population and boosting the fertility rate were among a number of appeals to Chief Executive John Lee as he attended a meeting in Hung Hom on Sunday to gather views for his upcoming policy blueprint. 

Dozens among the more than 100 people attending put forward their suggestions and concerns in the two-hour televised forum, including a kindergarten teacher representing ethnic minorities who called for better learning and career opportunities for the population. 

""How would the government help ethnic minority families and their next generation for them to have a fairer and more equal learning environment, while providing them with appropriate support both inside and outside of school?"" she asked. 

In response, the city's leader said his administration is working to build a more inclusive community.

""I understand very well that we need to provide support for them in many aspects, such as language, especially Cantonese and learning Chinese. Every year, the Education Bureau has a number of subsidies and measures [on that front],"" Lee said. 

""There are also care teams dedicated to ethnic minorities to better understand their culture and background.""

Some other issues covered focused on addressing the city's low birth rate and assisting young people. 

The Chief Executive said the government had rolled out a number of measures to encourage childbirth, such as a HK$20,000 handout and tax reduction.

Lee was also urged to roll out support measures for the elderly, provide resources to the arts, and provide more funding for the development of innovation and technology. 

""When formulating policies, the government has to take care of things on both the macro and micro levels. On the macro level, we need to make the pie bigger. When the pie is bigger, everyone benefits from it. It's equally important to ensure each person has a larger share of the pie,"" he said. 

Lee will hold another town hall meeting next week, before delivering his fourth annual Policy Address in September."
CE gathers views for his Policy Address in Hung Hom,2025-07-27 13:45,,2025-07-27 14:30,elocal,rthk,https://news.rthk.hk/rthk/en/component/k2/1815317-20250727.htm,"Shoring up support for Hong Kong's ethnic minority population and boosting the fertility rate were among a number of appeals to Chief Executive John Lee as he attended a meeting in Hung Hom on Sunday to gather views for his upcoming policy blueprint. 

Dozens among the more than 100 people attending put forward their suggestions and concerns in the two-hour televised forum, including a kindergarten teacher representing ethnic minorities who called for better learning and career opportunities for the population. 

""How would the government help ethnic minority families and their next generation for them to have a fairer and more equal learning environment, while providing them with appropriate support both inside and outside of school?"" she asked. 

In response, the city's leader said his administration is working to build a more inclusive community.

""I understand very well that we need to provide support for them in many aspects, such as language, especially Cantonese and learning Chinese. Every year, the Education Bureau has a number of subsidies and measures [on that front],"" Lee said. 

""There are also care teams dedicated to ethnic minorities to better understand their culture and background.""

Some other issues covered focused on addressing the city's low birth rate and assisting young people. 

The Chief Executive said the government had rolled out a number of measures to encourage childbirth, such as a HK$20,000 handout and tax reduction.

Lee was also urged to roll out support measures for the elderly, provide resources to the arts, and provide more funding for the development of innovation and technology. 

""When formulating policies, the government has to take care of things on both the macro and micro levels. On the macro level, we need to make the pie bigger. When the pie is bigger, everyone benefits from it. It's equally important to ensure each person has a larger share of the pie,"" he said. 

Lee will hold another town hall meeting next week, before delivering his fourth annual Policy Address in September."
Power back at half of I-Feng Mansions,2025-07-27 13:36,,2025-07-27 14:15,elocal,rthk,https://news.rthk.hk/rthk/en/component/k2/1815315-20250727.htm,"CLP on Sunday said the electricity supply has resumed at two of the four blocks at I-Feng Mansions in To Kwa Wan, following a power outage on Saturday evening. The power company said it was still working on reconnecting power to the remaining blocks.

In a social media statement, the Home Affairs Department said the power supply was suspended for all four blocks of the residential estate due to water leakage, and that some 2,000 residents from 800 households had been affected.

The power supply resumed at 3.30 am for blocks B and D, as well as for the complex’s public facilities, with residents of the two blocks returning to their homes.

The department said some 20 residents are still staying at government shelters, adding that officers and care teams were on hand..

The Water Supplies Department said it helped repair the leaking flush water pipe at 2.30 am and that it had arranged a temporary fresh water supply to affected residents."
