title,date,summary,scrape_time,section,source,url,news_content
阿富汗地震增至至少1400死　山區地形和惡劣天氣構成救災挑戰,2025-09-02 20:53,,2025-09-02 21:15,cinternational,rthk,https://news.rthk.hk/rthk/ch/component/k2/1820904-20250902.htm,"阿富汗東部星期日晚發生的6級地震，塔利班當局表示，遇難人數增至至少1400人，超過3100人受傷，超過5400間房屋損毀。

救援人員星期二嘗試前往地震重災區庫納爾省東部的偏遠村莊救援，山區地形和惡劣天氣為偏遠地區的救援工作帶來挑戰，當局憂慮死傷人數仍會上升。聯合國官員表示，正努力迅速處理動物屍體，降低水資源受污染的風險。

世界衛生組織表示，道路受損、持續的餘震以及很多村莊位置偏遠，嚴重阻礙援助物資的運送。英國撥款100萬英鎊，支持聯合國及國際紅十字會向災區提供關鍵的醫療和緊急物資。鄰國巴基斯坦、中國等都已承諾提供協助。"
朝中社證實金正恩已抵達北京,2025-09-02 20:52,,2025-09-02 21:15,greater_china,rthk,https://news.rthk.hk/rthk/ch/component/k2/1820903-20250902.htm,"北韓領袖金正恩抵達北京，準備出席紀念中國人民抗日戰爭暨世界反法西斯戰爭勝利80周年活動。

朝中社報道，金正恩乘坐的專列下午約4時抵達北京。中共中央政治局常委、中央書記處書記蔡奇，中共中央外辦主任兼外長王毅，到北京站迎接。金正恩表示，很高興時隔六年再次訪問中國，對國家主席習近平的熱情接待表示感謝。

根據朝中社發放的相片，金正恩的女兒金主愛亦有隨行。"
庫務署籲市民慎防冒認欺詐電郵　企圖套取帳戶登入資料,2025-09-02 20:22,,2025-09-02 21:00,local,rthk,https://news.rthk.hk/rthk/ch/component/k2/1820902-20250902.htm,"庫務署呼籲市民，慎防冒認庫務署發出的欺詐電郵。該電郵顯示的發件人電郵地址與庫務署發放領款通知書使用的電郵地址（pa@try.gov.hk）一樣，但並非由庫務署發出。

署方指出，該電郵聲稱向收件人發送庫務署的領款通知書，邀請收件人打開電郵內的附件，企圖套取他們的帳戶登入資料。

庫務署強調，與該電郵並無任何關係，並已把事件交由警方作進一步調查。庫務署提醒市民切勿開啓可疑電郵及其附件。庫務署不會透過電郵收集市民的帳戶登入資料。"
抗戰勝利80周年｜何永賢拜訪抗日老兵　甯漢豪訪黃毛應玫瑰小堂,2025-09-02 20:14,,2025-09-02 21:00,local,rthk,https://news.rthk.hk/rthk/ch/component/k2/1820901-20250902.htm,"北京明日將舉行中國人民抗日戰爭暨世界反法西斯戰爭勝利80周年大型紀念活動和閱兵。部分特區政府官員跟隨行政長官李家超率領的代表團出席活動；部分官員則透過社交平台分享有關抗日歷史的訊息。

房屋局局長何永賢表示，昨日到過西貢檳榔灣五塊田，參觀港九大隊市區中隊部駐地舊址，期間拜訪了一名92歲抗日老兵，形容慶幸有機會上了一堂寶貴的口述歷史課。

何永賢又說，有到檳榔灣村公所外看民政事務總署豎立的資訊牌，了解當年事蹟，並向該資訊牌獻上由房屋局人員親手插的花，表達對抗日戰士的敬意、感激和追思。她說，鼓勵大家銘記及了解相關歷史，珍惜得來不易的和平。

發展局局長甯漢豪早前亦到訪曾經作為抗日游擊隊基地、位於西貢的黃毛應玫瑰小堂；而這座建築在2013年，被古物諮詢委員會列為第二級歷史建築。
 
發展局在社交平台指出，在1942年，廣東人民抗日游擊隊港九大隊在小堂內成立，游擊隊成員在內定居及駐紮，以儲備補給、武器和軍火；其後日軍得悉基地存在，圍攻黃毛應村。甯漢豪說，能夠過著安穩和平生活，全賴80年前無數奮勇抗日的烈士，必須牢記歷史。"
抗戰勝利80周年｜何永賢拜訪抗日老　甯漢豪到訪黃毛應玫瑰小堂,2025-09-02 20:14,,2025-09-02 20:30,local,rthk,https://news.rthk.hk/rthk/ch/component/k2/1820901-20250902.htm,"北京明日將舉行中國人民抗日戰爭暨世界反法西斯戰爭勝利80周年大型紀念活動和閱兵。部分特區政府官員跟隨行政長官李家超率領的代表團出席活動；部分官員則透過社交平台分享有關抗日歷史的訊息。

房屋局局長何永賢表示，昨日到過西貢檳榔灣五塊田，參觀港九大隊市區中隊部駐地舊址，期間拜訪了一名92歲抗日老兵，形容慶幸有機會上了一堂寶貴的口述歷史課。

何永賢又說，有到檳榔灣村公所外看民政事務總署豎立的資訊牌，了解當年事蹟，並向該資訊牌獻上由房屋局人員親手插的花，表達對抗日戰士的敬意、感激和追思。她說，鼓勵大家銘記及了解相關歷史，珍惜得來不易的和平。

發展局局長甯漢豪早前亦到訪曾經作為抗日游擊隊基地、位於西貢的黃毛應玫瑰小堂；而這座建築在2013年，被古物諮詢委員會列為第二級歷史建築。
 
發展局在社交平台指出，在1942年，廣東人民抗日游擊隊港九大隊在小堂內成立，游擊隊成員在內定居及駐紮，以儲備補給、武器和軍火；其後日軍得悉基地存在，圍攻黃毛應村。甯漢豪說，能夠過著安穩和平生活，全賴80年前無數奮勇抗日的烈士，必須牢記歷史。"
習近平：中方將續主持公道　推動達成兼顧各方的伊核問題解決方案,2025-09-02 20:07,,2025-09-02 20:15,greater_china,rthk,https://news.rthk.hk/rthk/ch/component/k2/1820900-20250902.htm,"國家主席習近平在北京人民大會堂會見來華出席上海合作組織峰會和紀念中國人民抗日戰爭暨世界反法西斯戰爭勝利80周年活動的伊朗總統佩澤希齊揚。

習近平表示，中方始終把發展對伊關係置於中國中東外交重要位置，願同伊方賡續友好，深化互信。他強調，武力不是解決分歧的正確方式，溝通對話才是實現持久和平的正確路徑。中方重視伊方多次重申不尋求發展核武器的承諾，尊重伊方和平利用核能權利。中方將繼續主持公道，推動達成兼顧各方合理關切的伊朗核問題解決方案，為實現中東持久和平不懈努力。

佩澤希齊揚表示，伊方高度重視兩國關係，無論國際形勢如何變化，都將堅持對華友好，願同中方密切協調，共同反對單邊主義和強權政治，維護中東地區和平穩定。"
習近平晤土庫曼總統　稱要擴大天然氣合作規模　加強互聯互通,2025-09-02 19:53,,2025-09-02 20:15,greater_china,rthk,https://news.rthk.hk/rthk/ch/component/k2/1820899-20250902.htm,"國家主席習近平在北京人民大會堂會見來華出席上海合作組織峰會及紀念中國人民抗日戰爭暨世界反法西斯戰爭勝利80周年活動的土庫曼總統別爾德穆哈梅多夫。

習近平指出，中國和土庫曼是相互信賴的好夥伴，中方願同土方深化合作交流，構建中土命運共同體。中方支持土方奉行永久中立政策，維護國家獨立、主權和領土完整。雙方要擴大天然氣合作規模，持續拓展非資源領域合作，加強互聯互通。中土兩國要堅決捍衛二戰勝利成果，共同維護世界和平。

新華社報道，別爾德穆哈梅多夫表示，中國是土庫曼可靠的朋友和夥伴，土方復興絲綢之路戰略同中方一帶一路倡議相得益彰，土方願同中方加強能源等領域合作交流。"
蔚來上季經調整虧損少過預期　料本季交付量最多9.1萬輛創新高,2025-09-02 19:34,,2025-09-02 19:45,cfinance,rthk,https://news.rthk.hk/rthk/ch/component/k2/1820898-20250902.htm,"蔚來上季股東應佔虧損51.41億元人民幣，按年擴大約0.3%，按季收窄25%；經調整虧損近41.3億元，按年收窄9%，按季收窄34%，好過市場預期的虧損65.6億元。

期內，收入總額近190.1億元，按年升9%，按季升約58%，差過市場預期的199.2億元。其中汽車銷售額161.4億元，按年升約3%，按季升62%。

公司季內毛利率10%，按年升30基點，按季升240基點；汽車毛利率10.3%，按年跌190基點，按季升10基點。

上季汽車交付量逾7.2萬輛，按年升近26%，按季升71%。公司7月及8月分別交付2.1萬及3.1萬輛汽車。截至8月底，今年已交付逾16.6萬輛汽車，並預期第3季收入總額介乎218.1億元至228.8億元，按年增長約17%至逾22%；汽車交付量介乎8.7萬至9.1萬輛，按年增加約41%至47%，創公司歷史新高。

蔚來表示，全面降本增效措施已開始取得成效，扣除組織優化費用，按非公認會計準則計算經營虧損，按季收窄逾30%。公司正迎來財務結構性拐點，進入良性循環，持續改善財務表現。"
中方宣布對俄羅斯持普通護照人員試行免簽政策,2025-09-02 18:53,,2025-09-02 19:15,greater_china,rthk,https://news.rthk.hk/rthk/ch/component/k2/1820868-20250902.htm,"國家主席習近平在北京人民大會堂，與俄羅斯總統普京會談後，中方宣布，對俄羅斯持普通護照人員試行免簽政策。

外交部發言人郭嘉昆在例行記者會表示，為進一步便利中外人員往來，中方決定擴大免簽國家範圍，自今年9月15日至明年9月14日，對俄羅斯持普通護照人員試行免簽政策。俄羅斯持普通護照人員來華經商、旅遊觀光、探親訪友、交流訪問、過境不超過30日，可免辦簽證入境。

郭嘉昆說，在兩國元首戰略引領下，中俄關係維持高水平運行。中方高度重視兩國人員往來便利化議題，支持兩國民眾加強交往，為推動中俄新時代全面戰略協作夥伴關係作出積極貢獻。歡迎俄羅斯朋友多來中國，常來中國。"
【重溫】2025年9月2日新聞天地,2025-09-02 18:47,,2025-09-02 19:00,local,rthk,https://news.rthk.hk/rthk/ch/component/k2/1820895-20250902.htm,詳盡報道本地時事，大中華消息、國際局勢等新聞，緊貼最新熱話。
中俄元首會晤　習近平：中俄樹立大國關係典範,2025-09-02 18:44,,2025-09-02 19:00,greater_china,rthk,https://news.rthk.hk/rthk/ch/component/k2/1820879-20250902.htm,"在北京，國家主席習近平會見來華出席2025年上海合作組織峰會及在紀念中國人民抗日戰爭暨世界反法西斯戰爭勝利80周年活動的俄羅斯總統普京。習近平以「老朋友」稱呼普京，他表示，中俄樹立了永久睦鄰友好、全面戰略協作、互利合作共贏的大國關係典範，中方願與俄方密切高層交往，在涉及兩國核心利益，和重大關切問題上，及時協調立場，推動中俄關係取得更大發展。

普京表示，習近平提出的全球治理倡議，是非常及時和必要，將為解決全球治理赤字發揮重要作用，俄方願與中方加強各領域務實合作，推動兩國關係繼續高水平發展。"
黃澤林下月參加UTS網球賽　稱期待再與盧布列夫交手,2025-09-02 18:43,,2025-09-02 19:00,local,rthk,https://news.rthk.hk/rthk/ch/component/k2/1820883-20250902.htm,"創新網球賽事UTS下月在本港啟德體育園首次亮相，也是首次進軍亞洲地區。賽事有八名球手參加，包括本港球手黃澤林，以及世界排名15的魯布列夫等。

黃澤林指，今次賽事有不同玩法，很有娛樂性，對球手和球迷也是很新的體驗。

黃澤林剛在美網32強僅敗予盧布列夫，他指對手打足五盤，大概知道對手打法等，加上今次比賽賽制不同，期待再次交手。"
抗戰勝利80周年｜疑似接載金正恩專列今年抵達北京,2025-09-02 18:40,,2025-09-02 19:00,greater_china,rthk,https://news.rthk.hk/rthk/ch/component/k2/1820882-20250902.htm,"一輛疑似接載北韓領袖金正恩的專列，下午抵達北京站附近。應國家主席習近平邀請，金正恩到北京，出席紀念中國人民抗日戰爭暨世界反法西斯戰爭勝利80周年紀念活動。

另外，國家主席習近平今早在北京人民大會堂，分別會見來華出席2025年上海合作組織峰會，和紀念中國人民抗日戰爭暨世界反法西斯戰爭勝利80周年活動的外國領袖，包括巴基斯坦總理夏巴茲、烏茲別克總統米爾濟約耶夫等。夏巴茲及米爾濟約耶夫均表示，支持習近平提出的全球治理倡議，並會積極落實。"
海關及警方打擊航空旅客販毒　3個月檢近5億元毒品拘96人,2025-09-02 18:36,,2025-09-02 19:00,local,rthk,https://news.rthk.hk/rthk/ch/component/k2/1820894-20250902.htm,"海關及警方首次聯同內地及海外相關部門，透過即時資訊互換及討論研判，合作追蹤和攔截販毒分子，在6月至8月聯合執法，破獲74宗涉及航空旅客販毒案件，合共緝獲約1219公斤懷疑毒品，估計市值近4.8億元，拘捕96人，相信已成功瓦解並重創4個活躍於本地的販毒集團。

警方指，近月不法分子藉航空旅客運毒趨勢上升，形容毒犯企圖以不同方式運毒來港，以擾亂調查方向的想法非常天真，強調在執法機構緊密溝通合作下，假扮旅客的毒犯蹤跡可說是無所遁形。"
抗戰勝利80周年｜李家超率團抵京將出席閱兵等活動,2025-09-02 18:27,,2025-09-02 18:45,local,rthk,https://news.rthk.hk/rthk/ch/component/k2/1820881-20250902.htm,"行政長官李家超率領代表團抵達北京，參加中國人民抗日戰爭暨世界反法西斯戰爭勝利80周年紀念活動，包括明日的紀念大會和閱兵。

隨團的保安局局長鄧炳強在北京表示，感到光榮及興奮，相信閱兵的畫面會很震憾。

另外，抗戰老兵林珍對能夠出席閱兵表示既期待，又興奮激動。她指出，不能夠忘記抗戰歷史，要代代相傳，以保衞國家民族獨立和全球和平。"
宇樹科技擬第4季向交易所提交上市申請,2025-09-02 18:23,,2025-09-02 18:45,cfinance,rthk,https://news.rthk.hk/rthk/ch/component/k2/1820897-20250902.htm,"宇樹科技在社交媒體發文指，正積極籌備上市（IPO），預計將於10月至12月期間向交易所提交文件，到時將正式披露公司營運數據。

外電7月時引述中國證監會披露的文件報道，宇樹科技已遞交首次公開發行（IPO）並上市輔導備案報告。

公司在最新社交媒體的發文又表示，以去年為例，公司四足機械人、人形機械人和組件產品銷售比例，分別佔65%、30%和5%。

公司又指，約80%四足機械人應用於研究、教育和消費領域；餘下20%用於工業範疇，例如檢查和消防。至於人形機械人則用於研究、教育和消費領域。"
HK stocks end down amid profit-taking on tech,2025-09-02 18:06,,2025-09-02 18:15,efinance,rthk,https://news.rthk.hk/rthk/en/component/k2/1820896-20250902.htm,"Mainland and Hong Kong stocks ended lower on Tuesday, weighed by technology shares as investors locked in profits following a sharp rally in AI-related names and ahead of President Xi Jinping's speech on Wednesday.

The benchmark Hang Seng Index closed 120 points, or 0.47 percent, down at 25,496.

The Hang Seng China Enterprises Index lost 0.15 percent to end at 9,108 while the Hang Seng Tech Index slumped 1.22 percent to 5,728.

China's blue-chip CSI300 Index declined 0.7 percent, while the Shanghai Composite Index lost 0.5 percent. 

Tech shares have been a key driving force behind China's bull run this year, with tech-focused Star50 index jumping 34 percent so far.

Despite the sharp gains, tech valuations remain relatively contained, said analysts at Dongxing Securities.

""A moderate degree of bubble may be necessary to spur innovation, with China's focus on artificial intelligence as a core driver of industrial development seen as a clear strategic direction,"" they said.

Meanwhile, China's outstanding margin financing touched a record high of 2.29 trillion yuan, surpassing the previous peak set a decade ago, as investors ramped up leveraged bets to chase the stock market rally.

The start-up board ChiNext Composite Index declined 2.8 percent. The index had advanced 15 percent over the past month.

Shares of Chinese chip firm Cambricon Technologies, which had doubled since the end of July, rose 2.2 percent.

While China is still catching up on software applications, optimism is rising thanks to a growing talent pool and rapidly evolving downstream AI models, panelists said at a UBS A-share conference on Monday.

Investors are now focussed on the military parade on Wednesday, which Xi is scheduled to address. (Reuters/Xinhua)"
本港今日無新增基孔肯雅熱個案　衞防中心稱廣東省個案進一步減少,2025-09-02 17:58,,2025-09-02 18:15,local,rthk,https://news.rthk.hk/rthk/ch/component/k2/1820893-20250902.htm,"衞生防護中心表示，截至下午5時，本港沒有錄得新增感染基孔肯雅熱個案。
　　
中心總監徐樂堅說，過去一周廣東省新增225宗基孔肯雅熱個案，較過去兩周分別為830宗及336宗進一步減少，全部均為輕症病例，沒有嚴重或死亡個案。雖然廣東省佛山市的新增病例數字過去一個月一直持續下降，但市民應留意今年全球多國爆發基孔肯雅熱。

徐樂堅呼籲學校按照食環署的滅蚊指引，加強防止校園範圍積水的工作及清除蚊子滋生的地方，務必提醒教職員及學生，應時刻做好防蚊及個人保護措施，防範蚊傳疾病在校園傳播。本港今年累計錄得13宗基孔肯雅熱確診個案，全部屬輸入個案。"
外交部：願同非方一起推動中非衛生合作與友好事業深入發展,2025-09-02 17:57,,2025-09-02 18:15,greater_china,rthk,https://news.rthk.hk/rthk/ch/component/k2/1820892-20250902.htm,"在北京，外交部發言人郭嘉昆表示，中非同屬全球南方，是志同道合的好夥伴，發展前行的同路人。中國願意同非方一起，推動中非衛生合作與友好事業深入發展，共築新時代全天候中非命運共同體。

對於吉布提總理向中國援吉醫療隊授予獨立日國家勳章，坦桑尼亞總統亦向中國援桑醫療隊授勳，郭嘉昆祝賀中國援非醫療隊再獲殊榮，指出1963年以來，中國醫療隊足跡遍布40多個非洲國家，診治患者近3億人次，還通過臨床教學等多種形式授人以漁。援非醫療隊用實際行動甚至寶貴生命，詮釋了不畏艱苦、甘於奉獻、救死扶傷、大愛無疆的中國醫療隊精神，贏得非洲人民的口碑，亦樹立了中非友好的豐碑。"
教育局更新學校行政手冊　參與外間組織活動須不涉危害國安內容,2025-09-02 17:54,,2025-09-02 18:15,local,rthk,https://news.rthk.hk/rthk/ch/component/k2/1820891-20250902.htm,"教育局在新學年更新《學校行政手冊》，當中提及學校安排學生參與外間組織或人士安排的活動，必須全面審視有關活動性質、背景、形式、安全性、服務提供者、合作人士、獲邀嘉賓、獲邀表演者的身份和背景等，確保活動能配合學習宗旨；更須確保活動完全不會有涉及危害國家安全的內容、不涉及政治宣傳、不恰當的價值觀，以及任何敏感和富爭議的議題。

教育局鼓勵學校進一步整合各跨課程價值觀教範疇的學習活動，更新版列明例子，例如國民教育包括《憲法》和《基本法》教育、國家安全教育及愛國主義教育、生命教育、性教育、公民教育、可持續發展教育、健康生活教育、媒體和資訊素養教育等。在教師發展課程的章節亦加入相同內容的「價值觀教育」。

教育局於新學年起，將3項現有津貼合為「全方位學習及姊妹學校津貼」，提高運用津貼的靈活性。手冊指出，津貼可舉辦學生、教師和學校管理層面的姊妹學校交流活動；推動愛國主義教育、數字教育、人工智能、STEAM教育及學生精神健康。

手冊在學習評估章節指出，學校可探討以其他的評估模式代替傳統的紙筆評估，減少默書和測考次數或取消個別年級的學期考試，尤其是小一上學期應以多元化評估代替測驗和考試，新加入內容提到，應盡量避免在緊接長假期後安排測考。"
團結香港基金：機構對穩定幣牌照反應超預期或因監管方向清晰,2025-09-02 17:51,,2025-09-02 18:15,local,rthk,https://news.rthk.hk/rthk/ch/component/k2/1820885-20250902.htm,"金管局表示，截至8月底表達意向申請穩定幣牌照的個案有77宗，包括銀行、科技企業、證券/資產管理/投資公司、電商、支付機構等。發言人指出，已經陸續安排會面，讓機構認真評估發行穩定幣的必要性和成熟程度，從而決定是否提出正式申請。金管局亦再次提醒市民，必須對無牌穩定幣宣傳推廣保持警惕。

團結香港基金大灣區發展研究主管麥穎聰表示，機構對穩定幣牌照反應超出預期，相信因為香港的監管及政策方向清晰，以及企業希望搶佔發行先機：擁有大量內地用戶的大型科技企業，希望發行穩定幣用於電商支付；傳統金融機構則用於跨境結算等。

被問到應否增加穩定幣牌照數量，麥穎聰認為，由於法例剛實施，當局希望以合理和謹慎態度處理市場需求，相信當首批發行人的營運情況、技術和系統運作穩定後，當局會有更大信心擴大牌照數量。

麥穎聰認為，香港的監管框架的確較謹慎，當中包括域外管轄權力，覆蓋層面廣，相信當局希望先做好以風險為本。他建議，當機制運作穩定後，監管機構應持續檢視其他地區的監管情況，可透過適當調整監管，令香港在全球市場保持吸引力。"
分析指近月美國勞工市場顯著放緩　聯儲局本月減息機會高,2025-09-02 17:49,,2025-09-02 18:00,cfinance,rthk,https://news.rthk.hk/rthk/ch/component/k2/1820889-20250902.htm,"美國將於本周五公布上月非農就業新增職位數據，路透調查顯示，預計8月新增7.5萬個職位，較7月多2000個；8月失業率4.3%，較前1個月升0.1個百分點。

東亞銀行首席經濟師卓亮同意近月美國勞工市場顯著放緩，預計上月非農新增職位維持在10萬個以下的水平，失業率或微升至4.3%，相信聯儲局本月減息的機會甚高。

他不排除統計局會再度修訂數據，因為過往7月份數據通常會較波動，方向上亦不改市場對恢復減息的預期。但除非修訂後的數據跌至極差水平，否則本月減息0.25厘的可能性依然較大。

卓亮預計，聯儲局下半年將累計減息半厘，並於明年再減息1厘，又認為過往非農數據出現大幅修訂，主要與統計方法和調查的回覆率偏低有關，未來是否仍會出現類似修訂，則取決於接任的統計局長會否改革統計方法。"
英國氣象局稱今夏是英國有記錄以來最熱夏季,2025-09-02 17:48,,2025-09-02 18:00,cinternational,rthk,https://news.rthk.hk/rthk/ch/component/k2/1820888-20250902.htm,"英國氣象局公布的臨時統計數據證實，今年夏季是英國1884年有記錄以來最熱的夏季。

英國氣象局發表的公報顯示，英國今年6月至8月的平均氣溫是攝氏16.10度，比1991年至2020年的同期平均值高出1.51度，超過2018年夏季創下平均氣溫15.76度的紀錄。

英國氣象局說，這項最新結果將1976年夏季排除出有記錄以來最熱的5個夏季之外，由此英國最熱的5個夏季均出現在2000年後。

英國氣象局氣候科學家的分析認為，在不久的將來，英國可能會經歷更炎熱夏季，表明在氣候不斷變化過程中，極端天氣將越來越普遍。"
習近平：中俄關係是大國關係典範　普京：俄中關係達歷史最高水平,2025-09-02 17:40,,2025-09-02 18:00,greater_china,rthk,https://news.rthk.hk/rthk/ch/component/k2/1820887-20250902.htm,"國家主席習近平在北京分別與多位來華出席中國人民抗戰勝利80周年紀念活動的外賓會談。

習近平與俄羅斯總統普京會面時表示，中俄關係是互利合作共贏的大國關係典範。兩國元首相互出席對方國家舉辦的紀念戰爭勝利慶典，充分彰顯大國擔當，展示捍衛正確二戰史觀的堅定決心。

普京表示，在他同習近平引領下，俄中關係達到歷史最高水平。俄方願同中方加強各領域務實合作，推動兩國關係繼續高水平發展。

兩人舉行雙邊會談前，先與蒙古總統呼日勒蘇赫舉行中俄蒙三國元首會晤。習近平說，中俄蒙要鞏固政治互信，排除外部干擾。

 預料習近平亦會同到訪的北韓領袖金正恩會面。路透社引述目擊者報道，金正恩乘坐的專列已經抵達北京。"
在岸人民幣兌美元創近1周低位收市,2025-09-02 17:38,,2025-09-02 18:00,cfinance,rthk,https://news.rthk.hk/rthk/ch/component/k2/1820880-20250902.htm,"在岸人民幣兌美元創近1星期低位收市，報7.1476兌1美元，較上日收市跌144點子。中間價亦回落至近1星期低位，報7.1089兌1美元，較市場預測偏強約240點子。

交易員表示，午後美元反彈，內地股市高位調整，令人民幣受壓，預料短期或區間上落。"
