title,date,summary,scrape_time,section,source,url,news_content
法國巴黎預料將有大範圍降雪　民航部門指示機場削減航班,2026-02-15 10:05,,2026-02-15 10:30,cinternational,rthk,https://news.rthk.hk/rthk/ch/component/k2/1843903-20260215.htm,"法國北部預料今天會有大範圍降雪，民航部門指示巴黎兩個機場削減航班。

法國氣象部門預計，巴黎等地今天將有顯著降雪，可能影響陸空交通。

民航局指示巴黎的戴高樂機場和奧利機場，星期日分別縮減繁忙時段30%和20%的航班。當局提醒旅客，前往機場前，先向航空公司確認航班狀況。



編輯：盧曉珊"
陳美寶︰全面重新檢視巴士安全帶規定　訂立平衡建議方案,2026-02-15 09:42,,2026-02-15 10:00,local,rthk,https://news.rthk.hk/rthk/ch/component/k2/1843902-20260215.htm,"運輸及物流局局長陳美寶表示，有關在巴士佩戴安全帶的規定，乘客表達很多不同意見，一定要小心認真聆聽、逐一研究，政府將認真、審慎和全面重新檢視相關規定，最重要是廣泛諮詢社會意見，訂立優化、全面、平衡的建議方案選項，與立法會商討。

陳美寶在一個電台節目表示，重新檢視相關規定的工作要實事求是，已經要求運輸署、專營巴士公司等循四方面進行工作，首先是要求巴士公司將安全帶裝置、設計和保養落實到位，讓市民安全、便利使用。其次是委託專家就巴士座位或路線種類，作仔細風險評估，做到切實可行的建議方案。

陳美寶又說，運輸署和道路安全議會要加強宣傳活動，培養乘客安全意識和責任，亦特別就執行、豁免和罰則細節重新檢視，希望兼備「法理情」。



編輯：汪溟曦"
北角渣華道七旬女子疑被的士撞倒　司機被捕,2026-02-15 09:24,,2026-02-15 10:00,local,rthk,https://news.rthk.hk/rthk/ch/component/k2/1843901-20260215.htm,"北角渣華道凌晨發生交通意外，一輛的士懷疑撞倒一名74歲女子， 她頭部受傷，半昏迷送院。

警方表示，凌晨2時許接報，渣華道有途人懷疑被的士撞倒，事發時據報傷者推著手推車。79歲男司機涉嫌危險駕駛引致他人身體受嚴重傷害被捕，他通過酒精測試。



編輯：汪溟曦"
王毅晤挪威外交大臣　指多極化不是少數大國主導,2026-02-15 09:00,,2026-02-15 09:15,greater_china,rthk,https://news.rthk.hk/rthk/ch/component/k2/1843900-20260215.htm,"中共中央政治局委員、外長王毅，與挪威外交大臣艾德會面。

王毅表示，多邊主義是今次慕尼黑安全會議的討論共識，但多邊主義不是自行其是，多極化也不是少數大國主導，各方都應遵守聯合國憲章宗旨，維護國際法治體系。中國和挪威都支持多邊主義和自由貿易，應該進一步加強溝通協作，希望挪方為中歐關係穩定發展，發揮建設性作用。

中方引述艾德表示，王毅外長在慕尼黑安全會議的發言，清晰闡述了中方關於改革完善全球治理的主張，與挪方立場高度契合。挪方高度重視對華關係，希望持續加強兩國對話與合作，在世界貿易組織等多邊機制密切協作，共同維護多邊主義和自由貿易。



編輯：盧曉珊"
賽馬會3間公眾騎術學校提供參觀或騎術課程助市民認識馬匹,2026-02-15 08:27,,2026-02-15 08:45,local,rthk,https://news.rthk.hk/rthk/ch/component/k2/1843898-20260215.htm,"農曆新年將至，送蛇迎馬。市民想增進對馬匹的認識，可以選擇到公眾騎術學校參觀馬房或報名參與騎術課程。賽馬會轄下有3間公眾騎術學校，分別位於屯門、鯉魚門及薄扶林。其中，自1978年創建的薄扶林公眾騎術學校，去年秋季完成重建，該學校設有38個馬格，約一半為新馬。

馬術事務助理吳湋源表示，馬匹每天要進食多餐，會為牠們提供草和飼料，亦會為牠們擦身及清理馬格。他說，馬匹好奇時會探頭四處張望，高興時耳朵會傾前，而馬匹性格各異，有些乖巧聽話，有些容易與人類相處但與其他馬匹不合。如果首次與馬匹接觸，他建議先保持一定距離，不要站在馬的嘴前或馬後。

青少年馬術隊成員羅梓然現年16歲，已學習騎馬10年。與馬術運動結緣，是由於她小時候與家人到薄扶林行山，途經騎術學校，對馬匹感興趣，之後開始學習騎馬。羅梓然說從這項運動中，學習到面對失敗及克服困難。 

賽馬會資料顯示，年滿6歲的小朋友可參與騎馬課程。從事相關教練工作30年的馬術高級經理陳世健說，學員來自不同層面，有學生、有退休人士，課程可以訓練身心，帶來愉悅，同時可以減壓。他形容馬是具靈性的動物，但上馬期間要專注，否則有一定風險。他說，馬術運動愈來愈普及，其中屯門公眾騎術學校每年設開放日，讓公眾近距離接觸馬匹。



編輯：譚佩貞"
中加外長會面　王毅指加拿大新政府奉行對華新政策符合兩國利益,2026-02-15 08:22,,2026-02-15 08:45,greater_china,rthk,https://news.rthk.hk/rthk/ch/component/k2/1843897-20260215.htm,"中共中央政治局委員、外長王毅，出席慕尼黑安全會議期間，與加拿大外長阿南德會面。

王毅表示，加拿大總理卡尼訪華成果豐碩，證明加拿大新政府奉行對華新政策，符合兩國共同利益，是完全正確的選擇。中方願與加方一起努力，落實好兩國領導人重要共識，排除干擾，重啟各領域交流合作，推動中加關係健康、穩定、可持續發展。

中方引述阿南德表示，卡尼訪華十分成功，開啟加中關係的新時代。加方感謝中方給予加拿大公民免簽待遇，希望雙方密切對話合作，加強人文交流，推動加中關係積極穩定向前發展。



編輯：盧曉珊"
米蘭冬奧會　谷愛凌晉級自由式大跳台決賽,2026-02-15 06:19,,2026-02-15 06:30,csport,rthk,https://news.rthk.hk/rthk/ch/component/k2/1843896-20260215.htm,"米蘭冬奧會自由式滑雪女子大跳台資格賽，爭取衛冕的中國選手谷愛凌與隊友劉夢婷鎖定決賽席位。

谷愛凌在資格賽第一個出場，首輪A組動作得到86.00分。第二跳她嘗試B組動作，但落地跌倒，只得20.75分。第三輪動作與第二輪相同，谷愛凌順利完成，並得到84.75分。

根據規則，資格賽三跳中取不同起跳方向的兩跳最好成績總和，排名前12的選手晉級決賽。谷愛凌最終以總分170.75分排名第二，劉夢婷以160.00分名列第九，兩人順利晉級，加拿大選手奧爾德姆以首名晉級。





編輯：許敬軒"
利物浦三球淨勝白禮頓　晉級英格蘭足總盃第五圈,2026-02-15 06:08,,2026-02-15 06:30,csport,rthk,https://news.rthk.hk/rthk/ch/component/k2/1843895-20260215.htm,"英格蘭足總盃第四圈，利物浦主場3:0大勝白禮頓。

居迪斯鍾斯上半場末段為紅軍先開紀錄。換邊後11分鐘，蘇保斯拿爾接應沙拿傳送建功，主隊優勢擴大至兩球。

沙拿在68分鐘射入十二碼，為利物浦埋齋，晉級第五圈。





編輯：許敬軒"
哈利卡尼成為首位在正式比賽攻入500球的英格蘭球員,2026-02-15 05:16,,2026-02-15 05:30,csport,rthk,https://news.rthk.hk/rthk/ch/component/k2/1843894-20260215.htm,"哈利卡尼創造歷史，成為首位在正式比賽中攻入500個入球的英格蘭球員。

這名效力德甲拜仁慕尼黑的前鋒，在星期六對戰雲達不來梅的賽事中梅開二度，令他在職業生涯，包括為球會和英格蘭代表隊的總入球數目達到500球的里程碑。

哈利卡尼向記者表示，500是一個了不起的數字，背後凝聚著無數的努力和奉獻，感謝歷年來所有隊友和教練，期待著下一個50球或100球。





編輯：許敬軒"
丹麥首相：特朗普仍渴望擁有格陵蘭,2026-02-15 04:46,,2026-02-15 05:00,cinternational,rthk,https://news.rthk.hk/rthk/ch/component/k2/1843893-20260215.htm,"丹麥首相弗雷澤里克森表示，雖然美國總統特朗普近期收回武力奪取格陵蘭的威脅，但她認為特朗普在格陵蘭問題上的立場未有改變，對方仍然渴望擁有這個丹麥自治領地。

弗雷澤里克森出席慕尼黑安全會議期間，被問到是否可以為格陵蘭標價時明確回應說當然不可以，美國、丹麥和格陵蘭現在成立了一個工作小組，各方將努力尋求解決方案，但有些底線是不能逾越。

她重申，必須尊重主權國家和人民的自決權，丹麥王國是主權國家，格陵蘭人民已表明立場，不希望成為美國人，而是希望繼續作為格陵蘭人存在。





編輯：許敬軒"
孟加拉民族主義黨主席冀孟中繼續攜手合作共同發展,2026-02-15 04:26,,2026-02-15 04:45,cinternational,rthk,https://news.rthk.hk/rthk/ch/component/k2/1843892-20260215.htm,"在孟加拉國民議會選舉中獲勝的孟加拉民族主義黨主席拉赫曼表示，中國長期以來被孟加拉視為重要發展夥伴，希望兩國未來繼續攜手合作、共同發展。

孟加拉民族主義黨在日前的國民議會選舉中勝出，黨主席、前總理齊亞的兒子拉赫曼，有望出任新一屆政府總理。

在北京，外交部發言人早前說，願與孟方共同努力，弘揚傳統友誼，深化高質量共建一帶一路及各領域務實合作，推動中孟全面戰略合作夥伴關係不斷向前發展。





編輯：許敬軒"
英足總盃第四圈　曼城兩球擊敗沙福特城　維拉反負紐卡素,2026-02-15 04:19,,2026-02-15 04:30,csport,rthk,https://news.rthk.hk/rthk/ch/component/k2/1843891-20260215.htm,"英格蘭足總盃第四圈，曼城以2:0擊敗乙組的沙福特城晉級。

曼城在上屆足總盃第三圈亦遇上沙福特城，當時大炒對手八隻光蛋。今屆在第四圈碰頭，開賽早段就憑對手的烏龍波領先。

雖然曼城佔優，但一直找不到第二個入球，門將查福特更作出幾次撲救，阻止客隊扳平比數。

去到下半場戰至81分鐘，中堅基爾攻入上月從水晶宮加盟後的首個入球，協助曼城淨勝兩球過關。

阿士東維拉主場領先一球情況下，被下半場踢多一人的紐卡素反勝3:1。

般尼主場爆冷1:2不敵甲組球隊曼斯菲，另一支英超球隊韋斯咸踢到加時，靠森馬維一箭定江山淘汰甲組的伯頓。





編輯：許敬軒"
瑞士稱美伊本周日內瓦會談　美軍據報為軍事行動持續數周做準備,2026-02-15 04:16,,2026-02-15 04:30,cinternational,rthk,https://news.rthk.hk/rthk/ch/component/k2/1843890-20260215.htm,"瑞士外交部表示，阿曼本周將於日內瓦主持美國與伊朗的會談，瑞士隨時準備協助斡旋，促進美伊對話。

伊朗外長阿拉格齊本月6日在阿曼，與美國特使威特科夫及總統特朗普的女婿庫什會間接會談，商討伊朗核問題。特朗普早前證實，將會向中東派遣第二支航母戰鬥群，進一步向德黑蘭施壓。

路透社較早時引述美國官員透露，美軍正為特朗普一旦下令攻擊伊朗，軍事行動可能持續數星期做準備。

官員表示，這次行動的規劃比去年攻擊伊朗核設施的行動更複雜，美軍可能打擊伊朗的國家與安全設施，不單止是核設施，美方完全預期伊朗會報復，導致雙方在一段時間內出現來回打擊與報復的局面。





編輯：許敬軒"
歐洲五國稱納瓦爾尼死於箭毒蛙體內毒素　俄方否認指控,2026-02-15 03:35,,2026-02-15 03:45,cinternational,rthk,https://news.rthk.hk/rthk/ch/component/k2/1843889-20260215.htm,"英國、法國、德國、瑞典和荷蘭發表聯合聲明，指兩年前死於獄中的俄羅斯反對派領袖納瓦爾尼，是被一種存在於箭毒蛙皮膚中的神經毒素殺死。

聲明說，只有俄羅斯政府才有能力、有動機、有機會在納瓦爾尼被關押在西伯利亞俄羅斯監獄期間，使用這種致命毒素來對付他。

納瓦爾尼的遺孀尤利婭表示，從一開始就確信丈夫是被毒害，現在有了證據，俄羅斯總統普京必須承擔責任。

俄羅斯外交部發言人扎哈羅娃否認指控，批評是西方的宣傳騙局。

納瓦爾尼前年2月在俄羅斯位於北極圈的監獄去世，獄方指納瓦爾尼是在散步期間不適倒地，之後失去意識，最終搶救無效不治，死於自然原因。克里姆林宮一再否認與納瓦爾尼的死有關。





編輯：許敬軒"
英揆宣布在北大西洋和高北地區部署航母戰鬥群,2026-02-15 03:12,,2026-02-15 03:30,cinternational,rthk,https://news.rthk.hk/rthk/ch/component/k2/1843888-20260215.htm,"英國首相施紀賢宣布，英國今年將會在北大西洋和高北地區部署航母戰鬥群，威爾斯親王號將參與部署，與美國、加拿大和其他北約盟國並肩，以強而有力的行動展現對歐洲-大西洋安全的承諾。

施紀賢出席慕尼黑安全會議時形容，歐洲是沉睡的巨人，擁有巨大的防務能力，但這些能力往往未能形成合力，俄羅斯已經證明了侵略的慾望，歐洲必須準備好戰鬥。

他又說，英國已經不是脫歐時的英國，沒有歐洲就沒有英國的安全，沒有英國就沒有歐洲的安全，英國將履行北約成員國的集體防禦義務。





編輯：許敬軒"
大阪道頓堀發生持刀傷人案三人傷　疑犯在逃,2026-02-15 02:33,,2026-02-15 02:45,cinternational,rthk,https://news.rthk.hk/rthk/ch/component/k2/1843887-20260215.htm,"日本大阪市中央區道頓堀發生持刀傷人案，三人受傷，疑犯在逃。

事發在當地凌晨零時左右，日本傳媒引述警方消息報道，警方接獲多人報案，指有幾個人被刺傷，警員到場後發現三名男子受傷，其中一人昏迷，疑犯懷疑與傷者相識，犯案後逃離現場，警方正全力追捕疑犯，並調查事件。





編輯：許敬軒"
歐洲五國稱納瓦爾尼被箭毒蛙體內毒素殺害　俄政府應為事件負責,2026-02-15 02:25,,2026-02-15 02:45,cinternational,rthk,https://news.rthk.hk/rthk/ch/component/k2/1843885-20260215.htm,"英國、法國、德國、瑞典和荷蘭發表聯合聲明，指兩年前死於獄中的俄羅斯反對派領袖納瓦爾尼，是被一種存在於箭毒蛙皮膚中的神經毒素殺死。

聯合聲明指出，在納瓦爾尼遺體樣本中，發現這種名為依匹巴汀的毒素，依匹巴汀天然存在於南美洲野生箭毒蛙體內，人工飼養的箭毒蛙不會產生這種毒素，俄羅斯境內亦不存在這種毒素，納瓦爾尼體內出現這種毒素沒有任何合理解釋。聲明說，只有俄羅斯政府才有能力、有動機、有機會在納瓦爾尼被關押在西伯利亞俄羅斯監獄期間，使用這種致命毒素來對付他。

五國表示，將會向禁止化學武器組織舉報俄羅斯違反《化學武器公約》。

納瓦爾尼前年2月在俄羅斯位於北極圈的監獄去世，獄方指納瓦爾尼是在散步期間不適倒地，之後失去意識，最終搶救無效不治，死於自然原因。克里姆林宮一再否認與納瓦爾尼的死有關。





編輯：許敬軒"
澤連斯基冀本周烏美俄談判有實質進展　指烏方被要求讓步太多,2026-02-15 02:10,,2026-02-15 02:30,cinternational,rthk,https://news.rthk.hk/rthk/ch/component/k2/1843884-20260215.htm,"烏克蘭總統澤連斯基表示，希望本周在瑞士日內瓦舉行的烏美俄三方談判取得實質進展，但同時指出烏方被要求作出太多讓步。

澤連斯基在慕尼黑安全會議發表演講時說，希望三方談判能夠嚴肅、認真，而且富有實質意義，對各方都有幫助，他又指責莫斯科企圖透過更換首席談判代表來拖延談判進程。

澤連斯基承認，自己感受到來自美國總統特朗普的一些壓力，指美方經常把讓步問題掛在嘴邊，他更想聽下莫斯科願意作出哪些妥協，因為烏克蘭已經作出很多妥協。





編輯：許敬軒"
美軍據報為可能持續數星期的對伊軍事行動做準備,2026-02-15 01:41,,2026-02-15 02:15,cinternational,rthk,https://news.rthk.hk/rthk/ch/component/k2/1843883-20260215.htm,"路透社引述美國官員透露，如果總統特朗普下令攻擊伊朗，美軍正為可能持續數星期的軍事行動做準備。

官員表示，這次行動的規劃比去年攻擊伊朗核設施的行動更為複雜，在一場持續的軍事行動中，美軍可能打擊伊朗的國家與安全設施，不單止是核設施，美方完全預期伊朗會報復，導致雙方在一段時間內出現來回打擊與報復的局面。

白宮發言人凱利回應有關美國可能持續進行軍事行動的準備工作時重申，特朗普在伊朗問題上擁有所有選項，會聽取各方意見，但最終決定會基於對美國和美國國家安全最有利的原則。

伊朗革命衛隊早前警告，如果伊朗領土遭到攻擊，他們將會對美軍基地採取報復行動。





編輯：許敬軒"
王毅晤默茨　期待德國成為中歐務實合作的推進器,2026-02-15 00:41,,2026-02-15 01:00,greater_china,rthk,https://news.rthk.hk/rthk/ch/component/k2/1843880-20260215.htm,"出席慕尼黑安全會議的中共中央政治局委員、外長王毅，與德國總理默茨會面。

王毅表示，中德應展現大國擔當，為促進世界和平與發展作出新的貢獻，亦期待德國成為中歐務實合作的推進器、中歐戰略關係的穩定錨。加強合作是基於兩國現實需求的戰略選擇，中國堅持高水平對外開放，將為德國企業投資興業提供巨大機遇，希望德方亦為中國企業提供更公平公正的營商環境。

王毅說，中方願與德方籌備好下階段高層交往，加強各領域務實合作，探討展開三方合作，推動中德全方位戰略夥伴關係邁上新水平。

中方引述默茨表示，鼓勵德國企業加大對華投資合作，期待與中方密切高層交往，推進各領域合作，推動德中關係取得更大發展。





編輯：許敬軒"
王毅稱支持歐洲與俄羅斯就烏克蘭問題對話,2026-02-15 00:40,,2026-02-15 00:45,greater_china,rthk,https://news.rthk.hk/rthk/ch/component/k2/1843879-20260215.htm,"中共中央政治局委員、外長王毅出席慕尼黑安全會議，在中國專場被問到中國在解決地區衝突，尤其是烏克蘭問題上發揮什麼作用。王毅表示，中國的立場很清楚，就是一切地區熱點都應該透過對話協商尋求政治解決，烏克蘭問題亦如是，但中國不是當事方，能夠做的就是勸和促談。

王毅說，近期各方已啟動對話，特別是開始聚焦烏克蘭危機的實質性問題。中方表示歡迎。他又說，美俄去年年初啟動對話，中方支持歐洲與俄羅斯對話，提出自己的主張和解決方案，通過解決根源性問題，形成更均衡、有效、可持續的歐洲安全架構，防止類似事件再發生，實現歐洲的長治久安。





編輯：許敬軒"
王毅：中歐應行君子之事走君子之道　差異不是成為對手的理由,2026-02-15 00:38,,2026-02-15 00:45,greater_china,rthk,https://news.rthk.hk/rthk/ch/component/k2/1843878-20260215.htm,"中共中央政治局委員、外長王毅出席慕尼黑安全會議時表示，中歐是夥伴而不是對手，更不是制度性對手。制度性對手是負面思維和錯誤認知，如果繼續渲染或炒作，會對中歐關係未來產生有害干擾和影響。

王毅在中國專場回應中歐關係的提問時說，中歐之間當然有差異和分歧，但差異不是成為對手的理由，分歧更不是對抗的依據。正確做法是相互尊重、相互欣賞、相互借鑒，實現共同發展，共同照亮世界。

王毅強調，中歐應該都行君子之事，走君子之道，特別是面對當前變亂交織的國際形勢，中歐更應攜手共同踐行多邊主義，共同維護聯合國權威，共同反對單邊霸凌，共同抵制陣營對抗。





編輯：許敬軒"
警方無人機上周發現疑與家人失散男童　短時間內找到其母親,2026-02-14 22:54,,2026-02-14 23:30,local,rthk,https://news.rthk.hk/rthk/ch/component/k2/1843877-20260214.htm,"警方表示，上星期在啟德站附近進行無人機反罪惡巡邏期間，發現一名3歲男童懷疑與家人失散，隨即通知地面人員到場，並在短時間內找到男童母親。

警方東九龍總區行動部，本月5日在啟德一帶進行市區無人機巡邏，期間透過無人機高空視角，發現這名男童獨自騎滑板車在啟德車站廣場四處遊走，神情慌張，懷疑與家人失散。

警方表示，這次行動除展現出無人機在市區巡邏的靈活性與行動效率，亦體現科技應用於前線警務工作的實際成果，無人機能協助巡邏人員及早發現潛在需要協助的市民。



編輯：陳曉慶"
中環裝修工一度被塌牆壓住　消防救出清醒送院,2026-02-14 22:52,,2026-02-14 23:30,local,rthk,https://news.rthk.hk/rthk/ch/component/k2/1843876-20260214.htm,"中環榮華大廈一個單位裝修期間有牆壁倒塌，一名56歲裝修工人受傷。

下午3時許，警方接報指這名男工友在榮華大廈一個單位鑽牆期間，一幅大約1.5米乘2.2米的牆壁突然塌下，將他壓住。消防到場將他救出，事主腰部、腳部和手部受傷，清醒送往瑪麗醫院治理。


編輯:陳曉慶"
王毅指美國有些勢力千方百計打壓中國　中方做好應對各種風險準備,2026-02-14 22:31,,2026-02-14 22:45,greater_china,rthk,https://news.rthk.hk/rthk/ch/component/k2/1843875-20260214.htm,"中共中央政治局委員，外長王毅在德國出席慕尼黑安全會議。王毅演說時說，美國總統特朗普非常尊重國家主席習近平及中國人民，他對此感到欣慰，但可能不是美國所有人都有同樣想法，有些勢力仍在千方百計打壓、遏制中國，令中美關係面臨兩種前景，其一是相向而行，不斷擴大共同利益，另一種是對華脫鉤斷鏈、逢中必反，甚至在台灣問題上分裂中國，踩踏中國的紅線。他說中方做好應對各種風險的準備，認為歷史總是在曲折中向前發展，對中美關係前景仍然有信心。

在對談環節談及日本時，王毅指德國在戰後全面清算了納粹，但日本完全不一樣，政要仍絡繹不絕參拜供奉甲級戰犯的神社，說明日本軍國主義，陰魂不散。他說當年日本就是以所謂「危機存亡事態」對中國發動侵略，如果不思悔改，勢必重蹈覆轍，警告日本如果走回頭路，屬自取滅亡。"
習近平出席春節團拜會　要求努力實現「十五五」良好開局,2026-02-14 20:46,,2026-02-14 21:15,greater_china,rthk,https://news.rthk.hk/rthk/ch/component/k2/1843873-20260214.htm,"中共中央、國務院今早舉行春節團拜會。中共中央總書記、國家主席、中央軍委主席習近平代表黨中央和國務院，向全國各族人民，港澳台同胞和海外僑胞拜年。

習近平指出，2026年是中國共產黨成立105周年，是「十五五」開局之年，要堅持以新時代中國特色社會主義思想為指導，深入貫徹黨的二十大和二十屆歷次全會精神，認真落實四中全會部署，堅持穩中求進工作總基調，完整準確全面貫徹新發展理念，加快構建新發展格局，著力推動高質量發展，保持社會和諧穩定，持之以恆推進全面從嚴治黨，努力實現「十五五」良好開局。


編輯：羅宇光"
多名主要官員續參與民政事務總署所統籌18區歲晚家訪,2026-02-14 20:09,,2026-02-14 20:15,local,rthk,https://news.rthk.hk/rthk/ch/component/k2/1843872-20260214.htm,"多名特區政府主要官員繼續參與由民政事務總署統籌的18區歲晚家訪，走訪多區包括中西區、沙田區、東區、九龍城區和深水埗區，探訪區內不同家庭，了解他們的居住和生活狀況，並送上賀年福袋，分享節日歡樂，共慶新春。
 
財政司司長陳茂波在署理中西區民政事務專員周卓瑩陪同下，聯同當區區議員和關愛隊代表，探訪堅尼地城的年青家庭和長者家庭，了解他們的生活情況，向他們表達問候。
 
財政司副司長黃偉綸在東區民政事務專員黎旨軒陪同下，聯同區議員和關愛隊代表，探訪耀東邨的年青家庭和獨居長者，送上新春祝願。
 
財經事務及庫務局局長許正宇在九龍城民政事務專員蔣志豪陪同下，聯同區議員和關愛隊代表，探訪德朗邨的年青家庭和雙老家庭。

教育局局長蔡若蓮就在深水埗民政事務專員王浩宇陪同下，聯同區議員和關愛隊代表，探訪當區的長者家庭和少數族裔家庭。



編輯：陳曉慶"
入境旅客涉販毒被捕下周一在西九龍裁判法院提堂,2026-02-14 20:07,,2026-02-14 20:15,local,rthk,https://news.rthk.hk/rthk/ch/component/k2/1843871-20260214.htm,"海關在機場拘捕一名27歲的入境旅客，涉嫌販毒，檢獲約16公斤懷疑可卡因，估計市值約1400萬元。
　　 
被捕的男旅客今日從美國洛杉磯飛抵本港，海關人員清關時在他的寄艙行李箱中，發現這批懷疑毒品。
　　 
他被控一項販運危險藥物罪，下星期一在西九龍裁判法院提堂。


編輯：陳曉慶"
