title,date,summary,scrape_time,section,source,url,news_content
阿仙奴贈韋根4蛋　晉級英足盃第5圈,2026-02-16 07:21,,2026-02-16 07:45,csport,rthk,https://news.rthk.hk/rthk/ch/component/k2/1843983-20260216.htm,"阿仙奴在英格蘭足總盃，開賽30分鐘內連入4球，最終4:0狂數甲組隊伍韋根，輕鬆晉級，自2020年以來首次殺入第5圈。

富咸下半場連入兩球，2:1反勝英冠的史篤城。

另一支英冠球隊伯明翰對列斯聯，在法定時間及加時後打成1:1平手，要互射12碼決勝，最終列斯聯贏4:2晉級。

狼隊對著英乙球隊甘士比，靠辛迪亞高般奴一箭定江山，僅勝1:0。

新特蘭同樣1:0少勝英冠的牛津聯。"
地產代理：蛇年最後周末二手交投回軟　市民趁農曆年假外遊,2026-02-16 06:08,,2026-02-16 06:15,cfinance,rthk,https://news.rthk.hk/rthk/ch/component/k2/1843981-20260216.htm,"地產代理表示，蛇年最後一個周末二手交投顯著回軟，受農曆新年節日因素影響。

中原地產表示，在剛過去的周六、日，10大二手屋苑錄得5宗成交，按星期減少3宗，創26周新低，當中有5個屋苑零成交。中原指，市民趁假期外遊導致樓市淡靜，今年樓市小陽春已提前於1月出現，預計年初四起樓市將迅速復常，交投回升。

美聯物業表示，上周末10大二手屋苑錄得6宗成交，按星期減少3宗，創45周新低。美聯預計，短期二手交投將於低位橫行，相信隨著多個新盤農曆新年後推出，刺激購買力重新釋放，樓市將迅速重回正軌，樓價受到支持。





編輯：張詩民"
美股本周焦點於聯儲局會議紀錄　通脹及GDP數據,2026-02-16 06:07,,2026-02-16 06:15,cfinance,rthk,https://news.rthk.hk/rthk/ch/component/k2/1843979-20260216.htm,"美股本周只有4日市，周一假期休市。本周市場焦點於上月聯儲局會議紀錄、最新通脹及GDP數據。

美國聯儲局將於本港時間周四凌晨公布上月貨幣政策會議紀錄，市場關注支持按兵不動的官員，與主張減息官員之間的分歧。本周亦有多名官員發表講話。

周五將會公布聯儲局關注的通脹指標個人消費開支（PCE）物價指數，市場預計去年12月按月升幅輕微擴大至0.3%，按年則維持2.8%升幅；核心數據估計按月和按年分別稍為擴闊至0.3%和2.9%。

同日將公布去年第4季GDP按季年率初值，市場預測增速將達到3%，較第3季的4.4%放慢，但數據可能受美國政府停擺影響。

其他數據亦包括去年12月耐用品訂單、建築批則、新屋動工、新屋銷售；1月工業生產、二手樓臨時買賣合約指數、2月標普全球製造業、服務業採購經理指數（PMI）初值，以及密歇根大學消費者信心指數終值等。

另外，沃爾瑪將於周四公布上季業績。





編輯：張詩民"
捲入涉貪醜聞的烏國前能源部長試圖離境時被捕,2026-02-16 05:28,,2026-02-16 06:00,cinternational,rthk,https://news.rthk.hk/rthk/ch/component/k2/1843978-20260216.htm,"烏克蘭前能源部長加盧申科試圖離境時被捕，已被送往首都基輔接受進一步訊問。

加盧申科曾任能源部長三年，是涉嫌參與1億美元挪用公款案的多名政府官員之一，去年11月被總統澤連斯基免職。

有報道指，加盧申科是在一列離開烏克蘭的火車上被捕，目前不清楚他原本的目的地。報道又說，邊境人員事前接獲指示，指若果加盧申科試圖離境，應立即通知當局。





編輯：許敬軒"
天文台料今日市區最高約27度　初一氣溫稍降初二初三早上清涼,2026-02-16 05:16,,2026-02-16 06:00,local,rthk,https://news.rthk.hk/rthk/ch/component/k2/1843976-20260216.htm,"今日年廿九大除夕，天文台預測日間部分時間有陽光及相當溫暖，市區最高氣溫大約27度，新界再高兩三度。

天文台預料，一股清勁至強風程度的東北季候風會在今晚至年初一抵達華南沿岸，年初一初時有一兩陣微雨及風勢頗大，氣溫稍為下降，年初二及年初三早上清涼，隨後兩三日日間溫暖。





編輯：許敬軒"
美官員稱過千名移民執法人員已撤出明州雙城地區,2026-02-16 04:50,,2026-02-16 05:00,cinternational,rthk,https://news.rthk.hk/rthk/ch/component/k2/1843974-20260216.htm,"被美國總統特朗普派往明尼蘇達州接管當地聯邦執法行動的美國政府邊境事務主管霍曼表示，過千名移民執法人員已撤出明尼蘇達州雙城地區，即是明尼阿波利斯市和聖保羅市，未來幾日還會有數百人離開，一支小型安全部隊將短期駐留，保護剩餘的移民執法人員。

美國聯邦執法人員去年12月初在國土安全部授權下，陸續進入明尼蘇達州展開大規模移民執法行動，部署人數多達3000人。今年1月，聯邦執法人員在明尼阿波利斯市的移民執法行動中，先後開槍打死兩名美國公民，引發當地緊張局勢升級，聯邦政府與地方政府的衝突加劇。





編輯：許敬軒"
以總理：任何協議須包含拆除伊朗核設施　哈馬斯須徹底解除武裝,2026-02-16 03:46,,2026-02-16 04:15,cinternational,rthk,https://news.rthk.hk/rthk/ch/component/k2/1843972-20260216.htm,"美國與伊朗本周在瑞士日內瓦舉行第二輪間接核談判。以色列總理內塔尼亞胡表明，任何協議都必須包含拆除伊朗的核基礎設施，而不單止是暫停鈾濃縮進程，必須確保伊朗沒有任何鈾濃縮的能力，要求將相關設備和基礎設施徹底拆除，並運出伊朗。

另外，對於有報道指，美方草擬的加沙和平方案可能容許巴勒斯坦武裝組織哈馬斯保留部分輕武器的條款，內塔尼亞胡重申，哈馬斯必須徹底解除武裝，他們必須交出武器，而不單止是重型武器。他說，據估算哈馬斯手中仍掌握約6萬支步槍，這些武器連同火箭彈及火箭發射器等，必須全部被收繳或運出加沙。





編輯：許敬軒"
特朗普促哈馬斯解除武裝　和平委員會承諾為加沙重建提供50億,2026-02-16 03:21,,2026-02-16 03:45,cinternational,rthk,https://news.rthk.hk/rthk/ch/component/k2/1843971-20260216.htm,"美國總統特朗普敦促巴勒斯坦武裝組織哈馬斯依照他為戰後加沙提出的計劃推動解除武裝，又說美方倡導成立的和平委員會成員國，已經承諾為加沙重建提供50億美元。

美國計劃本周四在首都華盛頓舉行和平委員會首次正式會議，預計將有來自20多個國家的代表出席。特朗普星期日在社交平台發文說，和平委員會擁有無限潛力，屆時將會正式宣布成員國承諾的這50億美元援助資金，各國亦已經承諾派遣數千名人員加入國際穩定部隊和當地警察部隊，維護加沙的安全與和平。和平委員會亦會與聯合國合作，將成為史上最具影響力國際機構。

特朗普又說，非常重要的是，哈馬斯必須堅守全面並立即去軍事化的承諾。

解除武裝是美國斡旋以色列與哈馬斯達成停火協議當中第二階段的關鍵部分，規定以軍逐步撤出加沙，而哈馬斯應解除武裝，並部署一支國際穩定部隊以確保安全。

哈馬斯一再表示解除武裝是紅線，但亦暗示可能考慮將武器移交未來的巴勒斯坦治理機構。




編輯：許敬軒"
神二十乘組透露以40倍的顯微鏡看清楚舷窗裂紋,2026-02-16 02:45,,2026-02-16 03:15,greater_china,rthk,https://news.rthk.hk/rthk/ch/component/k2/1843970-20260216.htm,"神舟二十號航天員乘組接受央視訪問，講述發現舷窗裂紋的過程。

神二十乘組原本按計劃去年11月5日返回地球，但載人飛船懷疑被太空微小碎片撞擊，舷窗玻璃出現細微裂紋，需要推遲返回，最終在11月14日乘坐神舟二十一號飛船返回地球。

指令長陳冬表示，當時是他去檢查，用肉眼看的過程中，發現舷窗上有一個三角形的東西，最初懷疑是不是玻璃外面粘了一片小樹葉，但後來馬上就意識到在太空不可能有落葉。航天員陳中瑞亦表示，當時的第一反應有點像樹葉在外邊粘著。

為了看清楚舷窗上究竟是什麼，神二十號乘組嘗試利用空間站內能夠找到的各種設備，對異常位置拍照記錄，先後以平板和手機拍攝，最終透過40倍的顯微鏡看清楚。

陳冬其後將情況報告地面，最終他們押後返回計劃。




編輯：許敬軒"
年廿九大除夕　全港多處有封路或改道　公共交通增加班次,2026-02-16 02:20,,2026-02-16 02:45,local,rthk,https://news.rthk.hk/rthk/ch/component/k2/1843968-20260216.htm,"今日年廿九大除夕，為配合節慶活動，港九新界多處將會分階段實施封路及交通改道，公共交通將會增加班次。

港鐵機場快線及迪士尼線，下午3時起分階段加密班次；港島線、南港島線、荃灣線、觀塘線、東涌線、屯馬線、北角至寶琳段及調景嶺至康城段的將軍澳線、金鐘至上水段的東鐵線，以及多條輕鐵線，將會通宵行駛；機場快線及部份港鐵巴士線，亦會延長服務時間。

8條特別巴士路線，包括城巴38S，九巴N43、N64P、N243、N272，以及過海巴士N116、N600、N601，會於年初一凌晨提供特別班次服務。港九新界共9條專線小巴路線，會延長服務時間。電車亦會按乘客需求加強班次。




編輯：許敬軒"
房屋署：葵涌邨夏葵樓電力供應已於凌晨約1時半回復正常,2026-02-16 02:10,,2026-02-16 02:30,local,rthk,https://news.rthk.hk/rthk/ch/component/k2/1843967-20260216.htm,"房屋署表示，經工程人員及承辦商努力搶修後，葵涌邨夏葵樓的電力供應已於凌晨約1時半回復正常。

夏葵樓由昨晚9時許開始一度停電，期間大約800個單位受影響，初步相信是喉管滲水令大廈電機房出現短路所致。





編輯：許敬軒"
江蘇東海有煙花爆竹店爆炸八死兩傷　應急管理部要求排查安全隱患,2026-02-16 01:54,,2026-02-16 02:15,greater_china,rthk,https://news.rthk.hk/rthk/ch/component/k2/1843966-20260216.htm,"江蘇連雲港東海縣一間煙花爆竹零售店昨日下午發生爆炸，造成八人死亡、兩人受傷。

應急管理部要求全面清查排查、核實核清傷亡人數，全力救治傷者，盡快查明原因，並派出工作組趕赴現場指導工作，要求全面排查煙花爆竹安全風險隱患，堅決防範現場超量儲存、違規燃放等行為。

應急管理部緊急召開應急、消防系統調度會，通報爆炸情況，警示各地深刻汲取教訓，加強煙花爆竹生產、運輸、銷售、燃放各環節安全監管和安全宣傳，堅決避免類似事件再發生。





編輯：許敬軒"
美卿稱沒理由質疑歐洲五國指責俄方毒殺納瓦爾尼的報告,2026-02-16 01:45,,2026-02-16 02:15,cinternational,rthk,https://news.rthk.hk/rthk/ch/component/k2/1843964-20260216.htm,"美國國務卿魯比奧表示，留意到歐洲五國指責俄羅斯政府使用箭毒蛙毒素殺害反對派領袖納瓦爾尼的報告，形容是一份令人不安的報告，美方沒有提出質疑的理由。

被問到美國為何沒有參與發表報告，魯比奧說，有關調查是由相關國家自行協調，美國不參與並不意味不同意結果，華盛頓方面不會就此事與相關國家爭論或衝突。

俄羅斯外交部發言人扎哈羅娃較早時駁斥納瓦爾尼被毒害的說法，批評是西方對迫切問題轉移視線的宣傳。





編輯：許敬軒"
房屋署：喉管滲水令夏葵樓電機房短路　爭取早上6時前恢復電力,2026-02-16 00:54,,2026-02-16 01:15,local,rthk,https://news.rthk.hk/rthk/ch/component/k2/1843960-20260216.htm,"葵涌邨夏葵樓昨晚9時許停電，房屋署表示，約800個單位受影響，初步相信是喉管滲水令大廈電機房出現短路所致，正繼續積極跟進緊急維修工程，以期盡快在今早6時前恢復大廈電力供應。

房屋署表示，保安員發現停電後，已立即安排電器及升降機工程人員到場緊急維修。署方人員亦即時到場，關心居民的情況，後備發電機亦已啓動，大廈地下大堂及梯間照明現時正常，樓層大堂亦已恢復部分照明，各樓層均有一部升降機提供服務。

房屋署已接觸大廈內數戶有特別需要的居民，知悉他們的情況暫時安全，包括一名要使用呼吸機的居民，已經由家人陪同到親人位於鄰座大廈的單位。

房屋署同時已經將事件通知當區區議員及關愛隊，他們已到場為居民提供協助。





編輯：許敬軒"
伊朗外長赴瑞士談判　官員稱尋求達成為伊美帶來經濟利益的協議,2026-02-16 00:47,,2026-02-16 01:00,cinternational,rthk,https://news.rthk.hk/rthk/ch/component/k2/1843959-20260216.htm,"伊朗外長阿拉格齊啟程前往瑞士，準備本周與美國舉行的第二輪談判。

伊朗外交部在聲明中表示，阿拉格齊星期日率領外交與技術代表團離開德黑蘭前往日內瓦，參與第二輪伊美談判及其他外交活動。在阿曼的斡旋下，伊朗和美國將於星期二舉行間接核會談。

除了參加談判，阿拉格齊還會與瑞士外長、阿曼外交大臣、國際原子能機構總幹事格羅西等官員會晤。

消息指，包括美國特使威特科夫和總統特朗普女婿庫什納在內的美國代表團，將於日內瓦時間星期二上午與伊朗方面談判，阿曼的代表將協調雙方接觸。

伊朗半官方法爾斯通訊社報道，伊朗外交部負責經濟事務的副部長甘巴里表示，德黑蘭正尋求與華盛頓達成一項能夠為兩國帶來經濟利益的協議，尤其是在航空、採礦及石油與天然氣等領域。

甘巴里認為，2015年與世界大國達成的核協議，並未保障美國的經濟利益，為了確保協議的持久性，必須讓美國在經濟回報高和快的領域獲益。

伊朗副外長拉萬奇接受英國廣播公司訪問時說，德黑蘭願意在核計劃方面作出妥協，換取解除制裁，伊朗方面提出稀釋60%濃縮鈾的提議。他說，球在美國一邊，他們需要證明自己想達成協議。





編輯：許敬軒"
卡拉斯：歐盟成員國未準備好向烏克蘭提供具體入盟日期,2026-02-16 00:16,,2026-02-16 00:30,cinternational,rthk,https://news.rthk.hk/rthk/ch/component/k2/1843958-20260216.htm,"歐盟外交與安全政策高級代表卡拉斯認為，歐盟成員國未準備好向烏克蘭提供具體入盟日期。

卡拉斯在慕尼黑安全會議一場小組討論上表示，歐盟擴大始終是一項地緣政治決策，最終促使歐盟作出決定的將會是地緣政治格局。她認為，烏克蘭加入歐盟還有大量工作要做，當務之急是採取行動，表明烏克蘭是歐洲的一部分。

出席慕尼黑安全會議的烏克蘭總統澤連斯基日前表示，需要歐盟提供一個烏克蘭入盟的日期，作為與俄羅斯達成最終和平協議的安全保障一部分。





編輯：許敬軒"
美軍再在印度洋攔截運油輪　是近期第二次,2026-02-16 00:11,,2026-02-16 00:30,cinternational,rthk,https://news.rthk.hk/rthk/ch/component/k2/1843957-20260216.htm,"美軍再在印度洋攔截運油輪，是近期第二次。

美國國防部發布的影片顯示，美軍士兵登上「韋羅妮卡III號」檢查。五角大樓說，運油輪試圖違反總統特朗普下達的隔離令，美軍從加勒比海一直追蹤到印度洋，最終將它截停。

美國財政部外國資產管制辦公室網站顯示，韋羅妮卡III號懸掛巴拿馬國旗，因伊朗相關問題受到華府制裁。

船隻追蹤網站資料顯示，運油輪上月3日離開委內瑞拉，當日是委內瑞拉總統馬杜羅被美方拘捕的日子，運油輪自2023年以來一直參與俄羅斯、伊朗和委內瑞拉的石油運輸。

特朗普去年12月宣布，對所有進出委內瑞拉的受美國制裁運油輪，實施全面封鎖。





編輯：許敬軒"
葵涌邨夏葵樓停電約760戶受影響　大廈電工正搶修,2026-02-15 23:33,,2026-02-15 23:45,local,rthk,https://news.rthk.hk/rthk/ch/component/k2/1843956-20260215.htm,"葵涌邨夏葵樓晚上停電，大批居民自行疏散。現場所見，整幢大廈除逃生梯及大堂部份位置外，均一片漆黑。

中電表示，晚上約9時13分，夏葵樓懷疑因設備故障，影響約760名用戶的電力供應。中電隨即派員到場檢查，確認中電供電設備及供電正常。大廈電工正進行搶修。

警方接報指，有長者的呼吸機處於低電量，亦有人報稱被困升降機。



編輯：陳樂謙"
截至晚上9時　本港逾86.4萬人次出入境,2026-02-15 23:24,,2026-02-15 23:45,local,rthk,https://news.rthk.hk/rthk/ch/component/k2/1843955-20260215.htm,"入境處表示，截至晚上9時，共有超過86萬4千人次經各管制站出入境。

入境有超過37萬7千人次，其中內地旅客有超過13萬5千人次，最多人從高鐵西九龍站入境，其次是機場。

至於離境人次約48萬6千，本港居民有約34萬5千多人次，最多人從羅湖口岸離境，其次是深圳灣口岸。



編輯：陳樂謙"
葵涌邨夏葵樓晚上停電　居民自行疏散,2026-02-15 23:09,,2026-02-15 23:15,local,rthk,https://news.rthk.hk/rthk/ch/component/k2/1843954-20260215.htm,"葵涌邨夏葵樓晚上停電，大批居民自行疏散，整幢大廈除逃生梯及大堂部份位置外，均一片漆黑。

警方9時許接報指，有長者的呼吸機處於低電量，亦有人報稱被困升降機。

中電回覆查詢時表示，大廈的供電正常。房屋署暫時未有回應。



編輯：陳樂謙"
機場上月客運量按年升4.5%　料農曆年高峰單日達21萬人次,2026-02-15 22:44,,2026-02-15 23:00,local,rthk,https://news.rthk.hk/rthk/ch/component/k2/1843953-20260215.htm,"機管局公布，機場在今年1月的客運量達551萬人次，飛機起降量達34445架次，分別按年上升4.5%及2.4%。至於轉機或過境旅客量，較去年同期錄得雙位數增幅，其中往來中國內地、東南亞及北美的旅客量增長最為顯著。

另外，機管局指，貨運量按年增長5.4%至41.5萬公噸，所有貨運類別均錄得增長，其中轉口貨運成爲主要增長動力，按年上升18.2%至93000公噸，主要貿易地區中，往來歐洲、東南亞及中國內地的貨運量升幅最顯著。

至於在農曆年假期期間，機管局預料高峰日的單日總客運量達到21萬人次，最熱門的航點為台北、曼谷及東京。



編輯：陳樂謙"
將軍澳有狗隻疑從高處墮下死亡　28歲男子涉殘酷對待動物被捕,2026-02-15 22:25,,2026-02-15 22:45,local,rthk,https://news.rthk.hk/rthk/ch/component/k2/1843952-20260215.htm,"將軍澳有狗隻懷疑從高處墮下後死亡，一名28歲男子涉嫌殘酷對待動物被捕，他正被扣留調查。

警方下午4時許接報，在厚德邨德澤樓對開發現一隻狗懷疑從高處墮下。警方經初步調查，相信狗隻從德澤樓一個單位墮下，其後拘捕一名男住戶，案件交由將軍澳警區刑事調查隊第三隊跟進。狗隻屍體已由相關機構人員撿走。



編輯：陳樂謙"
伊朗副外長稱伊美下一輪核談判將於星期二在日內瓦舉行,2026-02-15 20:50,,2026-02-15 21:00,cinternational,rthk,https://news.rthk.hk/rthk/ch/component/k2/1843951-20260215.htm,"伊朗副外長拉萬希表示，伊朗與美國的第二輪核談判，將於本月17日在瑞士日內瓦舉行。

他接受英國廣播公司訪問時形容，目前球在美國那邊，美方需要證明願意達成協議；而伊方提出稀釋純度為60%嘅濃縮鈾，這是伊朗願意妥協的明證。

美方官員多次強調，阻礙談判進程的是伊朗，不是美國。美國國務卿魯比奧較早時表示，總統傾向於達成協議，但他認為與伊朗達成協議是非常困難。



編輯：羅宇光"
15歲少年感染甲型流感併發肺炎及心臟衰竭　目前情況嚴重,2026-02-15 19:56,,2026-02-15 20:15,local,rthk,https://news.rthk.hk/rthk/ch/component/k2/1843950-20260215.htm, 
深圳灣公路大橋旅遊巴失事17人輕傷　司機涉危駕被捕,2026-02-15 18:52,,2026-02-15 19:15,local,rthk,https://news.rthk.hk/rthk/ch/component/k2/1843948-20260215.htm,"深圳灣公路大橋下午發生交通意外，一輛旅遊巴懷疑失控撞向欄杆，17人受輕傷。63歲司機涉嫌危險駕駛引致他人身體受嚴重傷害被捕，現正被扣留調查。

警方在下午近兩時接報，涉事旅遊巴沿深圳灣公路大橋往香港方向行駛，期間懷疑失控撞向欄杆。旅遊巴上17名乘客，包括8男9女受傷，年齡介乎25至64歲，他們清醒分別被送往屯門及天水圍醫院治理。



編輯：陳樂謙"
中方自本月17日起對加拿大及英國持普通護照人員實施免簽政策,2026-02-15 18:48,,2026-02-15 19:00,greater_china,rthk,https://news.rthk.hk/rthk/ch/component/k2/1843947-20260215.htm,"為進一步便利中外人員往來，中方決定自本月17日起，對加拿大、英國持普通護照人員，實施免簽政策，兩國持普通護照人員來華經商、旅遊觀光、探親訪友、交流訪問、過境不超過30日，可免辦簽證入境。有關免簽政策實施至今年12月31日。



編輯：羅宇光"
多名特區主要官員繼續進行18區歲晚家訪,2026-02-15 18:37,,2026-02-15 18:45,local,rthk,https://news.rthk.hk/rthk/ch/component/k2/1843946-20260215.htm,"多名特區政府主要官員繼續參與由民政事務總署統籌的18區歲晚家訪，走訪多區包括南區、屯門區、葵青區、元朗區和黃大仙區，探訪區內不同家庭，並送上賀年福袋。

醫務衞生局局長盧寵茂在南區民政事務專員張佩珊陪同下，聯同南區區議員和關愛隊代表，探訪居於海怡半島的雙老長者和跨代家庭。

房屋局局長何永賢在屯門民政事務專員關可臨陪同下，聯同屯門區區議員和關愛隊成員探訪居於三聖邨的基層家庭、少數族裔家庭和獨居長者。

民政及青年事務局局長麥美娟在葵青民政事務專員梁乘龍陪同下，聯同葵青區區議員和關愛隊代表探訪居於長安邨的中產家庭和雙老家庭。

運輸及物流局局長陳美寶在元朗民政事務專員馬富威陪同下，聯同元朗區區議員和關愛隊代表探訪居於天耀邨的在學青年家庭和雙老家庭；署理勞工及福利局局長何啟明在黃大仙民政事務專員胡鉅華陪同下，聯同黃大仙區區議員和關愛隊代表探訪居於黃大仙上邨的年青家庭和雙老家庭。

特區政府主要官員明日會繼續探訪不同家庭。"
【重溫】2026年2月15日新聞天地,2026-02-15 18:27,,2026-02-15 18:45,local,rthk,https://news.rthk.hk/rthk/ch/component/k2/1843945-20260215.htm,詳盡報道本地時事、大中華消息、國際局勢等新聞，緊貼最新熱話。
警方拘捕7人涉及的士濫收車資,2026-02-15 18:19,,2026-02-15 18:30,local,rthk,https://news.rthk.hk/rthk/ch/component/k2/1843943-20260215.htm,"警方在西貢郊野公園一帶採取行動，拘捕7人，涉及的士濫收車資，又強調在農曆新年期間會繼續嚴厲打擊濫收車資行為。



編輯：王濱南"
陳茂波：今年訪港旅客人次暫有723萬按年增加9.6%,2026-02-15 18:18,,2026-02-15 18:30,local,rthk,https://news.rthk.hk/rthk/ch/component/k2/1843942-20260215.htm,"財政司司長陳茂波，昨天到訪維園年宵市場，向市民送上新年祝福和支持消費。

他說，今年截至上星期五，訪港旅客人次達723萬，比去年同期增加9.6%。



編輯：王濱南"
內地春節假期展開　有旅客來港感受氣氛,2026-02-15 18:18,,2026-02-15 18:30,local,rthk,https://news.rthk.hk/rthk/ch/component/k2/1843940-20260215.htm,"內地一連9日春節假期今日展開，當局早前預計今日是出境高峰期。在高鐵香港西九龍站，早上有不少內地旅客抵港。有旅客說來港過年，感受這裡的新年氣氛，期待欣賞維港煙花匯演、花車巡遊等，亦有旅客一家來港跨年，準備到迪士尼樂園遊玩。



編輯：王濱南"
截至下午4時　本港逾58萬人次出入境,2026-02-15 17:55,,2026-02-15 18:15,local,rthk,https://news.rthk.hk/rthk/ch/component/k2/1843944-20260215.htm,"入境處表示，截至下午4時，共有超過58萬人次經各管制站出入境。入境有超過24萬人次，其中內地旅客有近11萬3千人次。至於離境人次約34萬，本港居民有約27萬1千多人次。

入境方面，最多人從高鐵西九龍站入境，有2萬7千多人次，其次是深圳灣口岸有1萬6千多人次。

出境方面，最多人從羅湖口岸離境，有4萬8千多人次，其次是深圳灣口岸，有4萬1千多人次。"
