title,date,summary,scrape_time,section,source,url,news_content
外交部駐港公署反對英國所謂香港半年報告詆毀抹黑特區發展,2026-03-27 11:14,,2026-03-27 11:30,local,rthk,https://news.rthk.hk/rthk/ch/component/k2/1848995-20260327.htm,"外交部駐港公署發言人對英國政府再次發表所謂「香港問題半年報告」，詆毀抹黑香港特區發展，對香港事務說三道四，表示強烈不滿和堅決反對。

發言人重申，《中英聯合聲明》的核心要義是中國恢復對香港行使主權，沒有賦予英方干預回歸後香港事務的權利。中國政府治理香港特區的法律依據是中國憲法和香港基本法，英方對回歸後的香港無主權、無治權、無監督權。

公署指出，特區司法機關依法獨立審理危害國家安全案件，執法機關依法打擊危害國家安全犯罪，是維護法治權威、捍衛公平正義的必然之舉，不容外部勢力置喙。

發言人敦促英方正視現實，摒棄殖民主義和「教師爺」心態，切實尊重中國主權，立即停止就香港事務指手畫腳，立即停止政治操弄，多做有利於中英關係發展以及香港同英國交流合作的好事、實事。



編輯：方潤南"
Goodwill envoys to ease elderly into HK$2 fare changes,2026-03-27 11:12,,2026-03-27 11:30,elocal,rthk,https://news.rthk.hk/rthk/en/component/k2/1848980-20260327.htm,"The government will deploy staff at various places to assist commuters once revisions to the HK$2 fare scheme come into effect, according Secretary for Labour and Welfare Chris Sun.

Starting from April 3, people aged 60 or above and the disabled will pay a flat HK$2 fare for journeys costing HK$10 or less and 20 percent of fares above that.

Speaking on RTHK’s Backchat programme on Friday, Sun said “goodwill ambassadors” would be sent to help beneficiaries during the first three weeks of implementation.

“In the first three weeks, starting from April 3, we're going to deploy what we call the goodwill ambassadors across Hong Kong,” he said.

“So when the elderly people... come into a bus terminal, there will be people around to help them and let them know the new arrangement.”

Sun said he believed the scheme would still achieve its aim of encouraging beneficiaries to go out and socialise with friends in spite of the changes, saying the scheme has been very successful and popular since it was first implemented.

He reiterated that the changes would help ensure the scheme wasn't unsustainable, adding that it could potentially help the government save HK$550 million in the next financial year.

“The objectives are twofold. Number one: is to make sure that the scheme will be fiscally sustainable in the long term,"" Sun said.

""Secondly, as always there are complaints about people taking a long-haul bus trip just for a very, very short ride.

""So we looked at the issue, and we have decided the best way forward is to revise the HK$2 scheme into what we call a HK$2 flat rate or 80 percent off.”


Edited by Tony Sabine"
Zero 10 spotlights HK's rising digital-art scene,2026-03-27 11:07,,2026-03-27 11:15,elocal,rthk,https://news.rthk.hk/rthk/en/component/k2/1848993-20260327.htm,"Once a niche corner of collecting, digital art is now gaining real traction in Hong Kong’s art market, finding resonance among the city’s galleries, collectors and institutions. 

With Art Basel Hong Kong opening its doors on Friday, that shift takes centre stage with the Asia debut of Zero 10 — a global initiative dedicated to digital-era art, following its launch at Art Basel Miami Beach in December 2025.

The programme has been carefully re-contextualised for a city that curator Eli Scheinman believes possesses a unique fluency in new media.

""From the very beginning, Hong Kong has been one of the additions we saw as having this regional context that imbues the presentation of work with a very specific texture,"" he told RTHK. 

""There’s a fluidity and a literacy here that does frankly not exist across some of our other editions.""

That local fluency, he believes, makes the city an ideal testing ground for an initiative designed to reshape how digital art is exhibited, contextualised and collected.

Rather than a static travelling exhibition, Zero 10 has been tailored to regional sensibilities. 

It features 14 exhibitors, with works ranging from blockchain-based provenance projects to hybrid installations that blend traditional ink painting with artificial intelligence. 

The approach, he said, addresses a persistent challenge in the digital art market: collector hesitancy. 

Scheinman said he has structured Zero 10 to act as a bridge, showcasing not only purely digital works but also physical manifestations of digital practices — sculpture, painting and ink on paper.

""That’s very intentional so that we can have a conversation and a dialogue with collectors that digital practices do not necessarily only mean video-based works, and that you can collect and experience digital practices in many different ways,"" he said.

That hybrid model resonates with Tim Yip, the Hong Kong-based artist and Oscar-winning costume designer, who is presenting a work from his “Lili” series within the Zero 10 sector. 

His installation pairs a 4.5-metre-high mannequin-like sculpture — a mirror for human experience in a dystopian, artificially shaped future — with two AI films exploring identity and layered realities. 

""We have to find a more mature and creative mind to create how to express ourselves, not even culture-wise, but every step of life to sharing what we can feel,"" Yip said.

Both he and Scheinman acknowledge the challenges posed by generative AI. 

Yip warns that as AI accelerates cultural mixing, ""originality will become more and more unclear. So for Hong Kong, it really needs to strongly express themselves different from the others"". 

His answer is a return to the personal: ""Calm down, get away from the concept, go back to experience or your personal speciality.""

Art Basel will take place from March 27 to 29 at the Hong Kong Convention and Exhibition Centre.



Edited by Tony Sabine"
港投公司：內部回報率已達雙位數　每1元投資帶動逾8元資本跟投,2026-03-27 11:00,,2026-03-27 11:15,cfinance,rthk,https://news.rthk.hk/rthk/ch/component/k2/1848992-20260327.htm,"港投公司行政總裁陳家齊表示，港投公司2024年全面營運，當年年底已錄得正面的投資回報，至今內部回報率達到雙位數，每1元的投資帶動超過8元的資本跟投，當中很多是海外資金，期望未來港投公司能更好地扮演引資角色。

她在海南出席博鰲亞洲論壇的一個分論壇時說，港投公司現時超過50%資金投資內地項目，30%投資香港項目，20%投資海外項目，認為投資前瞻性的前沿技術板塊時，很多機遇都在內地及香港。

她又說，港投公司會幫助被投企業對接不同資本、客戶及應用場景，提到投資項目當中，有一間去年年底在港股上市，港投公司幫助該企業對接很多海外客戶，現時其產品服務已銷售到全球超過90個地區。同時投資項目經港投公司盡職審查，其他資金亦會對項目進行審查，形成互相背書。 

她會後向記者表示，港投公司投資時都是視乎創投的板塊，近期她分別到訪上海及海南，關注當地高增長、高影響力的創新企業，尤其人工智能、生命科技、綠色能源等領域。她又說，投資組合不乏來自海南的企業，亦有很多項目由不同城市協作推動產業發展。



編輯：張詩民"
政府下午交代宏福苑7幢樓宇受災居民回單位執拾安排,2026-03-27 10:55,,2026-03-27 11:15,local,rthk,https://news.rthk.hk/rthk/ch/component/k2/1848991-20260327.htm,"政務司副司長卓永興、保安局局長鄧炳強、房屋局局長何永賢和民政及青年事務局局長麥美娟，下午3時半會就大埔宏福苑7幢受災樓宇居民返回單位執拾的安排，會見傳媒。


編輯：譚佩貞"
內地首2月全國規模以上工業企業利潤按年升15.2%,2026-03-27 10:52,,2026-03-27 11:15,cfinance,rthk,https://news.rthk.hk/rthk/ch/component/k2/1848978-20260327.htm,"國家統計局公布，今年首2個月，全國規模以上工業企業利潤總額逾1.02萬億元人民幣，按年增長15.2%，增速較去年全年加快14.6個百分點，其中製造業利潤增長18.9%，較去年全年加快13.9個百分點；採礦業利潤升9.9%，去年全年跌26.2%。

首兩月規模以上工業企業營業收入20.84萬億元，按年增長5.3%，較去年全年加快4.2個百分點，受生產加快、產品價格回暖等因素帶動。

統計局表示，期內各地區各部門加緊實施更加積極有為的宏觀政策，著力發揮存量政策和增量政策的集成效應，規模以上工業企業利潤增長加快，多數行業利潤回升，裝備製造業和高技術製造業利潤快速增長，工業企業效益狀況呈現持續恢復態勢。



編輯：宋家樑"
日股半日跌近1%,2026-03-27 10:43,,2026-03-27 11:00,cfinance,rthk,https://news.rthk.hk/rthk/ch/component/k2/1848989-20260327.htm,"日本股市半日跌近1%，日經平均指數上午收市報53145點，跌458點，跌幅0.86%。



編輯：宋家樑"
HK stocks slip as China mulls easing rules for lenders,2026-03-27 10:41,,2026-03-27 11:00,efinance,rthk,https://news.rthk.hk/rthk/en/component/k2/1848983-20260327.htm,"Mainland banking stocks outperformed the broader market on Friday after news that Beijing is considering easing shareholder restrictions to broaden ⁠capital-raising options for lenders.

In Hong Kong, the benchmark Hang Seng Index fell 87 points, or 0.35 percent, to open at 24,768.

The China enterprises index was down 12 points, or 0.1 percent, at 8,377 while the tech index was 20 points, or 0.4 percent, lower at 4,740.

Gains for the mainland lending sector came after the banking regulator said it was weighing allowing some bank shareholders to become major investors – defined as holding a 5 percent stake or more – in one to two additional banks, on top of ⁠an upper limit of two currently, ⁠sources have said.

The potential relaxation ""has a positive impact on China banks,"" ‌Citi said in a note to clients.

It would help accelerate banks' loan growth, drive management incentives to boost earnings ⁠and ‌share price, and prod incremental ‌buying from institutional investors including insurers, Citi added.

The move ""could broaden ‌the investor base for China banks, and would thus be positive for the sector in ⁠general,"" JPMorgan said in a report.

The Shanghai Composite Index opened down almost 37 points, or 0.95 percent, at 3,852.

The Shenzhen Component Index was down close to 183 points, or 1.34 percent, at 13,423 while the ChiNext Index, tracking China's Nasdaq-style board of growth enterprises, was down 1.1 percent at 3,236.

In Tokyo, the 225-issue Nikkei Stock Average opened down 364 points, or 0.68 percent, at 53,239. The index was at 53,131 at one point before noon.

In Seoul, the Korea Composite Stock Price Index opened down 159 points, or 2.93 percent, at 5,300. The Kospi edged back up to 5,328 at one point before lunch. (Reuters & Xinhua)



Edited by Raymond Yeung"
社保基金：成立以來年均投資收益率7.39%　跑贏通脹,2026-03-27 10:38,,2026-03-27 11:00,cfinance,rthk,https://news.rthk.hk/rthk/ch/component/k2/1848988-20260327.htm,"社保基金副理事長金犖表示，社保基金投資策略取得非常穩健收益，成立25年來，年均投資收益率達7.39%，不僅跑贏通脹水平，累計投資收益額達到1.9萬億元人民幣，超過現有基金規模的一半。

金犖在海南出席博鰲亞洲論壇的一個分論壇時說，社保基金作為長期資金，會投資生命周期較長的股權投資項目，包括優質的央企，以及收益、現金流較穩定的基礎設施，股權基金投資亦覆蓋戰略新興產業、科技創新和經濟轉型，部分參與的直接股權投資項目持有時間接近20年，反映社保基金是真正長期投資的「踐行者」。

她提到，過去5年，公募權益類基金年均換手率約370%，平均持股周期3.25個月；同期社保基金主動股票委託組合換手率不足100%，平均持股周期超出12個月，認為是實踐其長期投資價值投資和責任投資理念。

金犖說，影響長期資金入市的主要原因在於對退出的擔憂，近期一些明星企業在香港上市，的確對內地創投帶來很好的啟發，但亦反映當前資本退出途徑仍過於依賴IPO，認為要豐富非上市退出渠道，為創新型中小企提供股權流轉渠道，完善有限合伙份額轉讓時的估值及定價環節



編輯：張詩民"
營運及管理啟德郵輪碼頭租約公開招標期限　延長至6月26日,2026-03-27 10:36,,2026-03-27 10:45,local,rthk,https://news.rthk.hk/rthk/ch/component/k2/1848987-20260327.htm,"政府宣布，營運和管理啟德郵輪碼頭的租約公開招標期限，由原定今年5月22日延長至今年6月26日。

文化體育及旅遊局發言人表示，因應有意投標者陸續向政府反映，今次招標的租約整合碼頭營運商需要負責的管理範圍和引入新的關鍵績效指標，希望政府能讓他們有更充裕的時間準備投標文件，文體旅局決定延長招標期限。



編輯：譚佩貞"
人工智能發展迅速　陳茂波認為風險挑戰並存須快著手應對挑戰,2026-03-27 10:31,,2026-03-27 10:45,local,rthk,https://news.rthk.hk/rthk/ch/component/k2/1848986-20260327.htm,"財政司司長陳茂波表示，過去幾年人工智能急速發展，超出很多人的預期，今天可以說再一次站在發展的轉折點，人工智能正從被動回應，走向主動行動，正從工具轉變為行動者。他認為任何技術都會伴隨風險與挑戰，在多個領域尤其值得關注。

陳茂波出席第一屆Web4.0國際峰會致辭表示，智能體具備自主決策的能力，意味著必須確保它的行為是可測、可追溯、可干預。他表示，安全的速度才是最快的速度。另外，智能體的運作高度依賴數據，如何在安全合規軌道上讓數據流動，守護個人權益與公眾信心，是技術應用不可迴避的前提。

陳茂波又說，當一個智能體能自主完成交易，自行操作，甚至做出決定，當出了問題責任誰屬，如果權責不清就會形成治理真空，阻礙技術的健康發展。他認為這些問題不是遙遠的未來議題，而是必須趕快著手應對的現實挑戰。



編輯：譚佩貞"
補選19個鄉郊代表席位　提名期4月2日至17日,2026-03-27 10:23,,2026-03-27 10:45,local,rthk,https://news.rthk.hk/rthk/ch/component/k2/1848985-20260327.htm,"政府就鄉郊補選刊憲，19個鄉郊代表席位需要進行補選，候選人提名期為4月2日至17日。

今次補選將為9條現有鄉村各選出1名居民代表，並為10條原居鄉村各選出1名原居民代表。9條現有鄉村為上嶺皮、低埔、沙頭角墟（西下）、禾寮坑、塔門、石碧新村、蓮花地、水田村及山貝涌口（一）；而10條原居鄉村則為榕樹下、新塘莆、吉澳、華山村、下洋、沙螺洞張屋、大埔尾、馬灣大街、關門口及金錢圍村。

參與原居民代表選舉的候選人必須是該原居鄉村的原居民，並已登記為該村的選民和通常在香港居住。至於居民代表的候選人則必須是該現有鄉村的居民，在緊接提名之前的6年內一直在該村居住，並已登記成為該村選民。


編輯：黃佩珊"
職工會登記局刊憲　教協3月24日解散　,2026-03-27 10:12,,2026-03-27 10:30,local,rthk,https://news.rthk.hk/rthk/ch/component/k2/1848984-20260327.htm,"勞工處轄下的職工會登記局刊憲，根據《職工會條例》公布，香港教育專業人員協會已於本月24日解散。


編輯：譚佩貞"
本港上月私人住宅樓價指數按月升約1.6%　連升9個月,2026-03-27 10:11,,2026-03-27 10:30,local,rthk,https://news.rthk.hk/rthk/ch/component/k2/1848982-20260327.htm,"差餉物業估價署公布，2月私人住宅售價指數升至307.6，創22個月新高，連升9個月，按月升幅加快至1.58%。



編輯：李意琴"
美國據報擬向中東增派1萬名地面部隊,2026-03-27 10:06,,2026-03-27 10:30,cinternational,rthk,https://news.rthk.hk/rthk/ch/component/k2/1848981-20260327.htm,"美國《華爾街日報》報道，美國國防部官員透露，正考慮向中東增派多達1萬人的地面部隊。

報道說，這支部隊預計包括步兵和裝甲車輛，目前未知在中東的具體部署地點，但很可能處於能夠對伊朗及其石油出口樞紐哈爾克島實施打擊的範圍內。

報道說，美軍中央司令部發言人拒絕發表評論。白宮表示，所有關於部隊部署的公告都將由國防部發佈。總統特朗普始終掌握所有的軍事選項。



編輯：方潤南"
金正恩與盧卡申科會談　雙方簽署友好合作條約,2026-03-27 09:57,,2026-03-27 10:15,cinternational,rthk,https://news.rthk.hk/rthk/ch/component/k2/1848979-20260327.htm,"朝中社報道，朝鮮勞動黨總書記、國務委員長金正恩昨日在平壤，同到訪的白俄羅斯總統盧卡申科會談，簽署兩國友好合作條約。

報道說，兩人在會談中討論加強朝鮮和白俄高層交往等各領域交流合作的一系列計劃，並就共同關心的國際及地區問題交換意見。

雙方還簽署外交、新聞、農業、教育、衛生保健等多個領域合作協議文件。

這是盧卡申科首次對朝鮮進行正式訪問，為期兩天。朝中社又報道，盧卡申科昨晚乘專機回國。



編輯：方潤南"
內地股市初段下跌,2026-03-27 09:42,,2026-03-27 10:15,cfinance,rthk,https://news.rthk.hk/rthk/ch/component/k2/1848977-20260327.htm,"滬深股市在開市初段向下。

上證綜合指數較早時報3869點，跌19點，跌幅0.49%。

深證成份指數報13518點，跌87點，跌幅0.64%。

創業板指數報3246點，跌26點，跌幅0.8%。



編輯：李意琴"
人行開展1462億元人民幣逆回購,2026-03-27 09:40,,2026-03-27 10:15,cfinance,rthk,https://news.rthk.hk/rthk/ch/component/k2/1848976-20260327.htm,"人民銀行公開市場開展1462億元人民幣7日期逆回購操作，利率維持於1.4厘。

對沖到期量後，單日淨投放1257億元，連續3日淨投放。

本周公開市場淨投放2319億元。



編輯：李意琴"
恒指競價時段跌87點,2026-03-27 09:28,,2026-03-27 09:45,cfinance,rthk,https://news.rthk.hk/rthk/ch/component/k2/1848975-20260327.htm,"港股在競價時段下跌，恒生指數報24768點，跌87點，跌幅0.35%。

科技指數報4740點，跌20點，跌幅0.44%。

美團公布業績後，開市微跌逾0.6%。



編輯：李意琴"
人民幣兌美元中間價跌逾80點子,2026-03-27 09:21,,2026-03-27 09:45,cfinance,rthk,https://news.rthk.hk/rthk/ch/component/k2/1848974-20260327.htm,"人民幣中間價報6.9141兌1美元，較上日中間價跌85點子，創近3星期低位。



編輯：宋家樑"
《環看天下》：中東局勢波及氦氣供應牽連全球AI產業,2026-03-27 09:13,,2026-03-27 09:45,cinternational,rthk,https://news.rthk.hk/rthk/ch/component/k2/1848973-20260327.htm,"中東局勢持續緊張。伊朗據報較早時對卡塔爾天然氣出口設施發動攻擊，影響到天然氣副產品之一、氦氣的供應大減。

氦氣的工業用途廣泛，對半導體在內的高端科技產業，極為關鍵。分析指，中東的戰事一旦持續到5月，包括氦氣在內的關鍵原材料會開始出現斷供，阻礙半導體生產，連帶科技相關的下游產業發展的問題亦會陸續浮現。"
台股初段跌逾1%,2026-03-27 09:11,,2026-03-27 09:45,cfinance,rthk,https://news.rthk.hk/rthk/ch/component/k2/1848972-20260327.htm,"台灣股市在開市初段跌逾1%，加權指數較早時報32814點，跌523點，跌幅1.57%。



編輯：宋家樑"
內地IP產業愈趨蓬勃   揚州毛公仔企業投放資源應對侵權,2026-03-27 09:03,,2026-03-27 09:15,greater_china,rthk,https://news.rthk.hk/rthk/ch/component/k2/1848971-20260327.htm,"江蘇揚州被譽為「中國毛絨玩具禮品之都」，根據揚州當局資料，去年全市毛絨玩具產值突破300億元人民幣，佔全國市場份額超過三成，全球市場份額亦接近兩成。

內地和香港近年文創公仔等 IP產業的發展越來越蓬勃，成立超過25年的揚州安貝斯公司是內地其中一間大型毛公仔企業，由設計到生產，為客戶度身訂造原創 IP公仔。內地大型茶飲品牌、江蘇的「蘇超」足球隊等，以至韓國即時通訊軟件企業都是他們的客戶。

安貝斯人力資源經理施巧燕說，IP 產業面對的最大難題是產品很容易被抄襲，公司每年都投入很多資源在版權維護上。她又認為，IP產業著重產品背後故事，內地業界要擺脫傳統「代工生產」模式，才可以走得更遠。

近年美國的關稅戰影響全球貿易，施巧燕表示，出口到歐美的訂單佔公司業務大約四成，去年4月開始，關稅成本上升、產品價格競爭力下降，出口遭遇嚴峻挑戰，公司從三個層面應對，包括簡化工藝、提高原材料性價比、優化客戶議價流程。她又說，未來會繼續借助香港作為平台，進一步拓展海外市場。



編輯：譚佩貞"
王文濤晤格里爾　稱中美應妥處競爭與合作,2026-03-27 08:36,,2026-03-27 08:45,cinternational,rthk,https://news.rthk.hk/rthk/ch/component/k2/1848969-20260327.htm,"商務部部長王文濤在喀麥隆雅恩德，出席世貿組織第14屆部長級會議期間，會見美國貿易代表格里爾。雙方就中美經貿關係、多邊和區域經貿合作等問題深入交換意見。

王文濤表示，國家主席習近平指出，經貿應該繼續成為中美關係的壓艙石和推進器，而不是絆腳石和衝突點。雙方應共同落實好兩國元首釜山會晤和歷次通話重要共識，妥處競爭與合作、過去與未來的關係，加強互利合作，避免惡性競爭，保持密切溝通，共同向前看，推動雙邊經貿關係健康、穩定、可持續發展。

他強調，中方願與美方加強多邊與區域經貿合作，共同推進世貿組織改革，推動世貿組織第14屆部長級會議取得務實成果，支援亞太經合組織和二十國集團會議取得積極成果。王文濤還就美方以所謂「產能過剩」和「未禁止進口強迫勞動產品」為由，對包括中國在內的多個經濟體發起301調查等表達嚴正關切。

根據商務部網站報道，格里爾說，過去一年，美中雙方開展建設性的經貿磋商，保持密切溝通合作。美方願與中方一道，以兩國元首共識為指引，加強對話，推動美中經貿關係保持持續穩定，實現經貿領域互利共贏。美方願與中方加強世貿組織和區域框架下的溝通交流。



編輯：方潤南"
伊朗總統：伊朗致力全面結束戰爭　從未尋求擁有核武器,2026-03-27 08:21,,2026-03-27 08:45,cinternational,rthk,https://news.rthk.hk/rthk/ch/component/k2/1848968-20260327.htm,"伊朗總統佩澤希齊揚表示伊朗致力於全面結束戰爭，並強調伊朗從未尋求擁有核武器。

伊朗伊斯蘭共和國通訊社報道，佩澤希齊揚與馬來西亞總理安華通電話，就美國和以色列對伊朗發動襲擊以來的地區和國際局勢交換意見。

佩澤希齊揚表示，伊朗打擊中東地區美軍基地是對侵略者的正當回應，並強調伊斯蘭國家不應讓敵人借機在地區製造分裂和戰火。他指出，關於伊朗謀求核武器的指控是對伊朗實施「非法、不人道侵略」的藉口。伊朗致力於全面結束戰爭，實現地區安全與穩定，希望在伊斯蘭國家幫助下，使本地區擺脫敵人企圖製造的災難。

報道又說，安華強調，馬來西亞反對和譴責任何侵犯伊朗國家主權和領土完整的行為。他強調伊斯蘭國家應繼續外交努力，以實現地區穩定與安全。



編輯：方潤南"
聯儲局理事關注中東緊張局勢及油價上升推高通脹,2026-03-27 08:17,,2026-03-27 08:30,cfinance,rthk,https://news.rthk.hk/rthk/ch/component/k2/1848964-20260327.htm,"美國聯儲局兩名理事都關注中東緊張局勢所帶來的通脹風險。

其中一名理事巴爾表示，油價上升帶來的物價衝擊可能引發通脹預期上升，認為聯儲局在進一步減息前應花時間評估經濟狀況。

他指，如果中東戰事持續一段時間，能源價格和其他大宗商品價格急升，可能對物價和經濟活動產生更廣泛影響，憂慮再一次物價衝擊會推高長期通脹預期，令整體通脹更難控制，要實現聯儲局2%的通脹目標變得更為複雜。

另一名理事庫克表示，受中東戰事影響，目前聯儲局物價穩定與充分就業的雙重使命，風險平衡已向通脹方向傾斜。而勞動力市場正處於平衡狀態，但並不穩定。



編輯：張詩民"
韓股初段跌逾3%,2026-03-27 08:16,,2026-03-27 08:30,cfinance,rthk,https://news.rthk.hk/rthk/ch/component/k2/1848967-20260327.htm,"韓國股市在開市初段跌逾3%，首爾綜合指數較早時報5271點，跌189點，跌幅3.47%。



編輯：張詩民"
