title,date,summary,scrape_time,section,source,url,news_content
李家超稱北部都會區需要具前瞻性基礎設施　中電支持對北都很重要,2026-03-26 21:49,,2026-03-26 22:00,cfinance,rthk,https://news.rthk.hk/rthk/ch/component/k2/1848930-20260326.htm,"中電舉行成立125周年酒會，行政長官李家超透過視像致辭，形容中電一直是建設能源基礎設施的重要夥伴。而北部都會區佔全港土地面積約三分之一，作為香港經濟發展的新引擎需具有前瞻性的基礎設施，中電的支持對北都發展是很重要。他期待大家一起合作，建設更美好、更環保、更具活力的香港。

中電控股主席米高嘉道理表示，中電保障本港能源安全，並支持經濟與社會長遠發展。而香港的獨特優勢，包括穩定的營商環境、健全的法治制度，以及鼓勵長遠投資的政策，為中電的發展提供堅實基礎。中電將繼續為香港提供可靠、可持續的能源服務。



編輯：任順熙"
中芯國際去年盈利升39%　目標今年資本開支大致持平,2026-03-26 21:38,,2026-03-26 22:00,cfinance,rthk,https://news.rthk.hk/rthk/ch/component/k2/1848926-20260326.htm,"中芯國際去年盈利6.9億美元，按年升39%，不派息。

去年收入93.3億美元，按年升逾16%，由於晶圓銷量增加約21%至約969.7萬片。平均售價907美元，按年跌約3%。

晶圓產能方面，去年折合8吋標準邏輯的月產能規模超過100萬片。

集團表示，在外部環境無重大變化前提下，今年業績指引為銷售收入增幅高於可比同業平均值，資本開支與去年大致持平。



編輯：方嘉莉"
中芯國際去年盈利升39%　今年資本開支大致持平,2026-03-26 21:38,,2026-03-26 21:45,cfinance,rthk,https://news.rthk.hk/rthk/ch/component/k2/1848926-20260326.htm,"中芯國際去年盈利6.9億美元，按年升39%，不派息。

去年收入93.3億美元，按年升逾16%，由於晶圓銷量增加約21%至約969.7萬片。平均售價907美元，按年跌約3%。

晶圓產能方面，去年折合8吋標準邏輯的月產能規模超過100萬片。

集團表示，在外部環境無重大變化前提下，今年業績指引為銷售收入增幅高於可比同業平均值，資本開支與去年大致持平。



編輯：方嘉莉"
美國上星期新申領失業救濟人數增至21萬人　符合預期,2026-03-26 21:37,,2026-03-26 21:45,cfinance,rthk,https://news.rthk.hk/rthk/ch/component/k2/1848924-20260326.htm,"美國上星期新申領失業救濟人數增至21萬人，按星期增加5000人，符合市場預期。

4星期平均值21.05萬人，按星期減少250人。

截至3月14日止，該星期持續申領失業救濟人數181.9萬人，低於預期，按星期減少3.2萬人。



編輯：方嘉莉"
道指初段跌逾200點　納指跌逾1%,2026-03-26 21:36,,2026-03-26 21:45,cfinance,rthk,https://news.rthk.hk/rthk/ch/component/k2/1848927-20260326.htm,"美股3大指數初段下跌。

道瓊斯指數較早時報46172點，跌257點，跌幅0.55%。

標普500指數報6538點，跌53點，跌幅0.81%。

納斯達克指數報21687點，跌242點，跌幅1.11%。



編輯：方嘉莉"
大埔回收場火警6人燒傷其中1人情況危殆　1名消防員亦感不適,2026-03-26 21:12,,2026-03-26 21:45,local,rthk,https://news.rthk.hk/rthk/ch/component/k2/1848925-20260326.htm,"大埔鳳園路附近一個回收場早上發生火警，6人燒傷，當中一人情況危殆。1名消防員參與救援時亦感到不適，7人全部送院治理。另外有1名回收場女職員目擊事故後受驚，拒絕送院。

消防處表示，現場用作回收及處理廢物的地方發生火警，起火位置是一個廢鐵壓縮裝置，起火原因懷疑有人不小心及不安全處理回收小型噴霧氣瓶，在現場發現懷疑過量風煤樽，正進行調查，如發現有過量儲存，消防會執法。

警方表示，現階段並無證據顯示案件涉及刑事成分。



編輯：任順熙"
銅鑼灣利舞臺廣場女廁發現男嬰　34歲印傭涉隱暪嬰兒出生被捕,2026-03-26 20:32,,2026-03-26 20:45,local,rthk,https://news.rthk.hk/rthk/ch/component/k2/1848923-20260326.htm,"銅鑼灣利舞臺廣場一個女廁，本月23日發現一名初生男嬰，送院後證實不治。警方經進一步調查，今日在東區拘捕一名34歲外籍女子，她涉嫌「隱瞞嬰兒的出生」，正被扣查。

警方表示，該外籍女子是印傭，相信是男嬰母親。

警方本月23日接獲清潔工人報案，指在女廁內垃圾桶發現一名初生嬰兒，男嬰送院後證實死亡。



編輯：任順熙"
中海油：將透過不同措施降本增效,2026-03-26 19:50,,2026-03-26 20:15,cfinance,rthk,https://news.rthk.hk/rthk/ch/component/k2/1848922-20260326.htm,"中國海洋石油表示，近期油價上升利好公司業績，至於會否影響未來投資，高級副總裁閻洪濤表示，要看形勢發展，例如油價在較高水平可以持續多久，目前仍不確定，將不斷跟蹤和評估整體形勢發展，現時按照規劃工作。

市場關注，中海油如何應對中東局勢導致成本上升。首席財務官穆秀平表示，將透過不同措施，包括技術創新、無人平台、無人機運輸等降本增效。

副董事長黄永章表示，當前地緣政治風險加劇，油價波動，增加國際能源格局不確定性，指出周期起伏是行業常態，要以自身發展的確定性，應對外部環境的不確定性。集團去年利潤跌幅低於布蘭特期油跌幅，相信受到「增儲上產」和提質增效帶動。

管理層又表示，公司現金流仍然比較充裕，國際上有好的機會、對公司效益和長遠發展有幫助，都會積極抓住，為長遠發展持續提供動能，又計劃國內未來原油產量，由現時6100萬噸，朝向6500至7000萬噸。



編輯：宋家樑"
中國平安去年盈利升6.5%　收入基本持平,2026-03-26 19:42,,2026-03-26 20:15,cfinance,rthk,https://news.rthk.hk/rthk/ch/component/k2/1848906-20260326.htm,"中國平安去年盈利1347.8億元人民幣，按年升6.5%，營運利潤升逾10%至1344.2億元。末期息每股1.75元，全年派息2.7元，升約6%，派息比率36.4%。

平保去年營業收入逾1.14萬億元，按年基本持平。壽險及健康險業務新業務價值升29%至約369億元，新業務價值率升5.8個百分點至28.5%。

總投資收益及淨投資收益，按年分別升逾13%及逾7%。綜合投資收益率6.3%，按年升0.5個百分點。淨投資收益率3.7%，按年跌0.1個百分點。



編輯：宋家樑"
王毅：美伊釋放談判信息　出現和平曙光,2026-03-26 19:03,,2026-03-26 19:15,greater_china,rthk,https://news.rthk.hk/rthk/ch/component/k2/1848913-20260326.htm,"中共中央政治局委員、外長王毅，分別與埃及以及土耳其外長通電話。王毅表示，美國及伊朗都在釋放談判信息，出現一線和平曙光。國際社會應積極推動衝突當事方開啟對話，只要談起來，和平就有希望。



編輯：王濱南"
醫管局稱醫生流失率下降　繼續聘請醫護人員配合服務增長,2026-03-26 19:02,,2026-03-26 19:30,local,rthk,https://news.rthk.hk/rthk/ch/component/k2/1848921-20260326.htm,"醫院管理局主席范鴻齡表示，醫管局整體人手保持穩定，截至上月底，醫生流失率4.5%、繼續下降，情況有改善。

范鴻齡表示，雖然現時流失率穩定和下降，人手亦不斷有正增長，但未來幾年醫護需求仍然非常大，因為十年建院計劃如火如荼進行，必須繼續聘請醫護人員，配合醫院落成和不斷增長的服務。

他說，公營醫療收費改革成效顯著正面，初步達到預期效果，以急症室為例，整體求診人數減少超過一成，次緊急和非緊急的病人減少差不多兩成，危殆和危急病人診治更接近服務承諾，做到集中資源救急扶危。

對於港島東和港島西醫院聯網下月起合併為香港島醫院聯網，醫管局行政總裁李夏茵表示，最主要是整合管治架構，理順服務流程，而部分服務需要整合，例如兒科和婦產科，但強調服務不會減少。



編輯：任順熙"
'EMs struggle to access digital public services',2026-03-26 19:02,,2026-03-26 19:15,elocal,rthk,https://news.rthk.hk/rthk/en/component/k2/1848920-20260326.htm,"The Equal Opportunities Commission has released new research showing that while ethnic minorities in Hong Kong are highly connected online, language and digital-literacy barriers prevent many of them from fully benefiting from the city’s digital public services.

The study, conducted along with the University of Hong Kong between July 2024 and March 2025, surveyed 412 ethnic minority residents – among them Pakistani, Indian, Nepalese and Filipino – aged mainly between 20 and 49. 

It used field experiments and focus groups to evaluate their access to digital public information and services.

Smartphone ownership among the respondents reached 99.27 percent, with over 70 percent having used the government’s iAM Smart app and about 64 percent having used public service platforms such as HA Go and eHealth.

The study also found that about 60 percent of the respondents prefer walk‑in appointments and telephone booking, instead of app or web‑based booking.

While 87 percent of those surveyed have native English standard or speak fluent English, just 18 percent reported comparable Chinese proficiency, and public information and social media content is often found to be available only in Chinese.

Linda Lam, who chairs the commission, pointed out that some ethnic minority members are not proficient in English either.

""For the government application, only Chinese and English are available, but there are still a small community of individuals who may not be as proficient in both languages,"" she said.

The study also found that some older ethnic minority members struggled to access online government services due to low digital literacy, even if they have a smartphone.

The commission proposed a number of recommendations to the government, among them establishing a digital inclusion working group, expanding AI‑powered translation and multilingual options across apps, as well as simplifying iAM Smart registration.

It also proposed that technology developers involve ethnic minority communities in service design, and schools and NGOs strengthen digital literacy training.


Edited by Edmond Fong"
陳茂波：香港可為國家綠色轉型貢獻,2026-03-26 19:02,,2026-03-26 19:30,local,rthk,https://news.rthk.hk/rthk/ch/component/k2/1848912-20260326.htm,"財政司司長陳茂波在「香港氣候周2026」開幕禮致辭，指出中東持續衝突，突顯多元能源供應，不僅是減碳的必要措施，更是國家安全的關鍵。

他又表示，綠色轉型是國家發展戰略，香港可以利用國際金融中心等獨特優勢作出貢獻。



編輯：王濱南"
香港在《全球金融中心指數》穩居第三　整體評分上升,2026-03-26 19:00,,2026-03-26 19:15,local,rthk,https://news.rthk.hk/rthk/ch/component/k2/1848919-20260326.htm,"英國Z/Yen集團與中國（深圳）綜合開發研究院聯合發布《全球金融中心指數》報告，香港在全球120個金融中心中，繼續位列第三，亞太區第一，整體評分進一步上升1分至765分，與位列第一的紐約和第二的倫敦，分別相差2分及1分。

政府發言人表示，報告再次肯定香港作為國際金融中心的領先地位和優勢，在金融科技的全球排名繼續位居榜首，在各金融行業領域從業員的評價中，排名普遍提升。

發言人說，香港會以創新思維對應當前複雜多變的環球政經環境，同時主動對接國家「十五五」規劃，因地制宜發展新質生產力，繼續善用在「一國兩制」下獨特優勢，發揮「超級聯繫人」和「超級增值人」角色，把握世界投資版圖重塑所帶來的機遇。香港作為領先的國際金融中心，會透過推進「金融+」，用好香港穩健金融體系去服務實體經濟與優勢產業，並加快推進金融與創科相互賦能，以香港所長服務國家所需。

發言人又指出，上月《財政預算案》內公布的一系列政策措施，將可助力香港金融服務做得更大更強。



編輯：任順熙"
【重溫】2026年3月26日新聞天地,2026-03-26 18:57,,2026-03-26 19:15,local,rthk,https://news.rthk.hk/rthk/ch/component/k2/1848917-20260326.htm,詳盡報道本地時事、大中華消息、國際局勢等新聞，緊貼最新熱話。
宏福苑居民供稱大維修時曾見工人吸煙　競委會代表指續查圍標事件,2026-03-26 18:54,,2026-03-26 19:15,local,rthk,https://news.rthk.hk/rthk/ch/component/k2/1848918-20260326.htm,"大埔宏福苑火災獨立委員會完成首輪第4場聽證會，共傳召12名證人作供。多名作供的宏福苑居民表示，大維修期間曾經見到有工人吸煙，又或者曾經聞到煙味。

競委會代表陳詞表示，宏福苑的圍標事件，可能涉及兩個以上圍標集團，調查仍然繼續，不排除有進一步檢控，又指以往坊間指圍標最多只是民事罰款的思維已不再適用。



編輯：任順熙"
白宮：特朗普14/5至15/5訪華　外交部：中美保持溝通,2026-03-26 18:51,,2026-03-26 19:15,greater_china,rthk,https://news.rthk.hk/rthk/ch/component/k2/1848911-20260326.htm,"美國白宮表示，總統特朗普將於5月14至15日訪華，並與國家主席習近平會晤。

在北京，外交部未有確認特朗普訪華日程，指元首外交對中美關係發揮著不可替代的戰略引領作用，中美雙方就特朗普訪華的事保持溝通。



編輯：王濱南"
趙樂際籲構建亞洲安全模式　中國將穩步擴大制度型開放,2026-03-26 18:49,,2026-03-26 19:00,greater_china,rthk,https://news.rthk.hk/rthk/ch/component/k2/1848910-20260326.htm,"中共中央政治局常委、全國人大常委會委員長趙樂際，於海南博鰲亞洲論壇年會發表主旨演講。他表示當今世界地緣衝突此起彼伏、霸權主義及強權政治威脅上升，呼籲亞洲各國，要構建求同存異、對話協商的亞洲安全模式。

他又強調，中國將穩步擴大制度型開放，維護及發展開放型世界經濟。



編輯：王濱南"
趙樂際指地緣衝突此起彼伏　攜手前行才能應對全球風險挑戰,2026-03-26 18:49,,2026-03-26 19:00,greater_china,rthk,https://news.rthk.hk/rthk/ch/component/k2/1848916-20260326.htm,"中共中央政治局常委、全國人大常委會委員長趙樂際在海南的博鰲亞洲論壇全體大會發表主旨演講，表示當今世界地緣衝突、局部戰爭此起彼伏，只有同心協力，攜手前行，才能應對全球性風險挑戰。

他又說，中國將準確全面貫徹新發展理念，進一步擴大高水平對外開放。



編輯：譚佩貞"
特朗普稱美伊續談判　伊朗稱「交流信息」不代表談判,2026-03-26 18:48,,2026-03-26 19:00,cinternational,rthk,https://news.rthk.hk/rthk/ch/component/k2/1848914-20260326.htm,"美國總統特朗普再次提到伊朗正與美方談判，白宮發言人重申，美方過去三天與伊朗進行有建設性的對話，伊朗應正視現實，切勿再次誤判形勢，應抓住最後機會與美方合作。

伊朗外長阿拉格齊表示，美方近日透過友好國家傳遞各種信息，伊朗亦有所回應，但強調這些「交流信息」不代表美伊有談判。



編輯：王濱南"
《全球金融中心指數》香港穩居第三　陳茂波稱香港成為資金安全港,2026-03-26 18:45,,2026-03-26 19:00,local,rthk,https://news.rthk.hk/rthk/ch/component/k2/1848915-20260326.htm,"英國Z/Yen集團與中國（深圳）綜合開發研究院公布最新《全球金融中心指數》報告，香港繼續排名全球第三，亞太區第一，整體評分亦進一步上升，繼續緊貼紐約和倫敦。

財政司司長陳茂波在社交網頁表示，在評分細項中，香港在「銀行業」和「融資」躍居全球首位，在金融科技和「保險業」繼續穩居全球第一，「投資管理」則攀升至全球第二。這些都反映香港國際金融中心的地位不斷鞏固提升，功能作用更趨多元。

他表示，國際地緣政局加速深刻變化、資產市場波動更為頻繁，香港在國家的堅實支持下，憑著「一國兩制」獨特優勢，正成為全球資金更為重視的安全港。

他說，今個星期「裕澤香港」峰會圓滿舉行、反應熱烈，全球各地家族辦公室有更大的興趣落戶香港，要抓緊當前的歷史機遇，在「十五五」開局之年，積極對接和服務國家發展大局，透過「金融+」發展策略，以金融更好賦能實體經濟與優勢產業的發展，並加速新興產業的培育，把科技發展、綠色發展等的需要與金融投資的需求更緊密對接，為國家和整個地區實現更美好的發展貢獻力量。



編輯：任順熙"
海南省政府稱香港作為超級聯繫人超級增值人　海南可多方面學習,2026-03-26 18:25,,2026-03-26 18:45,local,rthk,https://news.rthk.hk/rthk/ch/component/k2/1848909-20260326.htm,"海南省政府新聞發言人蔡強表示，香港與海南雙方都是自由港，但所處的歷史階段、發展階段不同，功能定位不同，產業基礎也不同，形成一種相互補充、共同發展的局面。

他相信，海南未來要在很多方面學習香港，認為香港作為超級聯繫人、超級增值人，海南將會從與香港的合作當中獲得成長機會，同時香港可以充分利用海南資源和發展機會，實現兩個自由港共同發展和進步。

海南自貿港自去年12月18日啟動全島封關運作，即將迎來封關的第100日。海南省新聞辦公室在博鰲亞洲論壇期間舉行記者會。蔡強指，封關運作實際取得的成效比預期好，新增市場主體大幅度增加，人流、物流和資金流增幅顯著。

他說，封關以來，零關稅商品的稅目比例從21%提高到了74%，共6637項商品實現零關稅；截止昨日，新增備案外貿企業7503家，按年增長65.7%；外貿進出口超過800億元人民幣，按年增長32.9%；累計新增外資企業737戶，按年增長33.5%，世界500強企業西門子能源在海南建立首個燃機總裝基地和服務中心，全國首家外商獨資醫院「博鰲富隆心血管醫院」獲批執業。

他又說，封關以來，進出境旅客86.1萬人次，增長36.3%，其中免簽入境21.7萬人次，增長54.2%。離島免稅銷售額達156億元，按年增長27.6%，新增市場主體8.5萬戶，增長39.87%，新增企業7.01萬戶，增長90.8%。



編輯：任順熙"
李慧琼：議員結合北都考察第一手資料　向政府反映意見,2026-03-26 18:22,,2026-03-26 18:45,local,rthk,https://news.rthk.hk/rthk/ch/component/k2/1848908-20260326.htm,"立法會主席李慧琼聯同40多名議員，在發展局局長甯漢豪、教育局局長蔡若蓮、運輸及物流局局長陳美寶和署理政制及內地事務局局長胡健民陪同，考察北部都會區。

他們下午在洪水橋／厦村新發展區聽取有關洪水橋產業及大學城發展的講解，亦到天水圍了解北都整體布局及相關策略運輸基建。之後再參觀洪水橋／厦村新發展區社區聯絡中心暨展廳。

李慧琼與多名議員在參觀後見記者，感謝政府多個部門安排，讓議員實地考察了解北都的實質建設進度，亦可與政府部門直接溝通，了解最新情況。她相信議員會結合考察所掌握的第一手資料，繼續與政府溝通；並匯聚社會各界的意見並向政府反映。



編輯：任順熙"
消委會與機電署安全測試　兩款USB插座萬能蘇有潛在觸電風險,2026-03-26 18:19,,2026-03-26 18:30,local,rthk,https://news.rthk.hk/rthk/ch/component/k2/1848907-20260326.htm,"消委會測試10款有USB插座的萬能插蘇，並聯同機電工程署進行安全測試，發現其中兩款樣本安全表現未如理想，長時間使用後，內部組件有機會出現移位，有潛在觸電風險。機電署已聯絡供應商跟進。供應商指，受影響適配接頭在生產時有瑕疵，因此決定回收產品及退款，機電署會密切監察產品的回收情況。另有一款萬能插蘇的標示有不足之處。

JHE牌萬能插蘇的代理商說，經調查後發現個別批次在生產過程中，有部分工人遺漏以膠水固定電源線在指定位置，雖然沒有即時漏電的風險，為確保使用者安全，該公司已全面回收該型號產品，生產商已修改生產流程，確保產品有足夠的絕緣距離。

Super牌萬能插蘇的生產商承認，該型號的絕緣措施未盡完善，代理商決定全面回收該型號產品，並會加強產品監控，維護用戶權益及產品安全。

EI8HT的代理商指會改善 USB 輸出電流標示及聲稱吻合度。

另外消委會測試發現不少樣本無法同時快充。當其中一個插座已啟動快充後，如再接上其他裝置，4款樣本的快充會被終止並降為5V基本充電，建議用戶應留意產品標示是否存在快充限制。



編輯：任順熙"
立法會議員考察北都　甯漢豪稱洪水橋未來5年產出250公頃熟地,2026-03-26 18:15,,2026-03-26 18:30,local,rthk,https://news.rthk.hk/rthk/ch/component/k2/1848905-20260326.htm,"立法會主席李慧琼聯同40多名議員考察北部都會區，包括在天水圍俯瞰洪水橋/厦村新發展區，到訪當中的大學城用地和展館。

陪同參觀的發展局局長甯漢豪表示，洪水橋/厦村是北都起步發展比較快的新發展區，已經有房屋進行建設，未來5年預計提供大約250公頃熟地，當中100公頃與產業相關，佔北都未來5年目標熟地900公頃的大約三成。目前正加快推展工程以便利企業進駐，最近已推出北都專屬法例建議，並正就該新發展區的片區開發作招標，亦期望新成立的「洪水橋產業園有限公司」於年中開始運作。

運輸及物流局局長陳美寶表示，國家十五五規劃綱要提出推進港深西部鐵路前期工作，目前勘查和設計香港段，目標明年就詳細設計和建造招標，2034年完成建造、2035年開通。至於重鐵項目之一的古洞站建造如火如荼，預計明年落成，洪水橋站則於2030年完成，目前亦正建造港鐵北環綫主綫，期望2034年與支綫同步開通。



編輯：任順熙"
HK exports up by 29.6pc in first two months,2026-03-26 18:14,,2026-03-26 18:30,efinance,rthk,https://news.rthk.hk/rthk/en/component/k2/1848899-20260326.htm,"Hong Kong's exports have shown ""strong performance"" in the first two months of the year, with their value up by 29.6 percent, according to official statements on Thursday.

The value of outbound shipments grew at a slower pace year on year in February, 24.7 percent, after earlier reaching a five-year high of 33.8 percent in January – partly due to the low base last year.

A government statement noted that it would be more appropriate to analyse the figures for the two-month period together – due to the different months that the Chinese New Year holidays fell in 2025 and 2026.

Looking ahead, a government spokesman said the city's foreign trade should continue to be supported by ""vibrant"" global demand for AI-related electronic products, though rising uncertainties might cloud the outlook.

""Uncertainty surrounding the global economic outlook has increased markedly of late amid the heightened geopolitical tensions in the Middle East,"" the spokesman warned, adding that the government would closely monitor the situation.

""Shifts in trade policies among major advanced economies have also posed another source of lingering uncertainty.""

For February alone, the value of total exports of goods stood at HK$408.8 billion, beating estimates, while that for imports came in at HK$472.9 billion, an increase of 29.9 percent year on year.

The latest figures left the city with a trade deficit of HK$64.2 billion, or about 13.6 percent of the value of the imports.


Edited by Tony Sabine"
美團上季經調整虧損約151億元　新業務經營虧損按年擴大1倍,2026-03-26 18:12,,2026-03-26 18:30,cfinance,rthk,https://news.rthk.hk/rthk/ch/component/k2/1848904-20260326.htm,"美團去年業績由盈轉虧，股東應佔虧損233.5億元人民幣，不派股息。去年經調整虧損186.5億元。去年收入升逾8%至3648.5億元。

單計去年第4季，虧損151.4億元，經調整虧損150.8億元，兩者按年均轉盈為虧，按季分別收窄約19%及約6%。上季收入近921億元，按年升4%，按季跌3%。

按業務劃分，上季核心本地商業業務由盈轉虧，經營虧損100.5億元，新業務經營虧損擴大1.1倍至46.5億元。

美團表示，行業競爭加劇，導致去年核心本地商業業務轉為經營虧損69億元。海外業務投資增加，導致新業務經營虧損擴大近39%至101億元。



編輯：宋家樑"
