title,date,summary,scrape_time,section,source,url,news_content
Police rank and file 'accountable under old system',2025-09-20 18:10,,2025-09-20 18:15,elocal,rthk,https://news.rthk.hk/rthk/en/component/k2/1823783-20250920.htm,"Civil service chief Ingrid Yeung said on Saturday that police, unlike other disciplinary forces, would not need to face the scrutiny of an independent panel for any serious problems found, as they already have their own body monitoring complaints against officers. 

That is an exception to the two-tier accountability system rule, laid out in this week's Policy Address, under which problems identified within government departments will be handled based on their severity. 

General issues will be investigated by heads of department while serious or systemic problems, or cases involving the heads themselves, will be handled by an independent panel. 

Yeung said the investigations conducted by the Public Service Commission into more widespread problems would not cover the force. 

That is because, she said, ""the police force has its own mechanism, with the Independent Police Complaints Council looking into complaints and operational issues in the unit.""

Yeung added: ""But the concept of holding department heads accountable and the first tier of the investigation mechanism will still apply to the police force.""

The commission, she said, would be able to request any civil servants for information and review all relevant documents to carry out a comprehensive and thorough investigation."
樺加沙增強為颱風　天文台料下周三最接近本港,2025-09-20 17:36,,2025-09-20 18:00,local,rthk,https://news.rthk.hk/rthk/ch/component/k2/1823785-20250920.htm,"強烈熱帶風暴樺加沙已增強為颱風，天文台預料樺加沙會在未來一兩日移向呂宋海峽一帶並顯著增強，有機會以超強颱風強度在下周中期靠近廣東沿岸，預測本港星期二、三天氣逐漸轉壞，樺加沙會在下周三最接近本港。

天文台又說，由於受顯著風暴潮影響，屆時沿岸水位可能與2017年的天鴿及2018年的山竹相若，提醒市民留意最新天氣消息，及做好防風防水浸準備。"
施政報告2025｜數字辦「AI工具箱」列出可即時購買程式,2025-09-20 17:18,,2025-09-20 17:30,local,rthk,https://news.rthk.hk/rthk/ch/component/k2/1823784-20250920.htm,"施政報告提出設立「AI效能提升組」，推動政府部門使用AI技術。數字政策專員黃志光表示，各部門應用人工智能程式時，可以動用內部資源進行小範圍測試，數字政策辦公室會推出「AI工具箱」，列出可以在市場即時購買，啟動成本較低，按用量及戶口收費的程式，亦會推出免費AI工具予其他部門使用，如果涉及大型的AI系統，部門可透過政府恆常資源分配機制向數字辦申請撥款。

對於有報道引述消息指，內地汽車品牌「紅旗汽車」計劃落戶北部都會區，創新科技及工業局局長孫東在施政報告措施記者會說，政府《創新科技發展藍圖》涵蓋人工智能、新能源汽車和芯片等，部分需要相當多的時間準備，認為大龍頭企業的落戶，沒有一年時間談不下來，期間有很多問題需要商討，包括選址、地價、水電和人手，以及日後如何在全球定位發展等。

孫東又說，政府會一如既往在北都發展先進製造業，希望盡快引入具代表性的龍頭企業，很多事情瓜熟蒂落時就會公布，形容「好事多磨、希望再耐心等候」。

對於施政報告提出，下調「新型工業加速計劃」申請門檻，將項目總成本最低要求由3億元調低至1億5千萬元，創新科技署署長李國斌說，有業界反映過往入場門檻較高，部分項目總投資額未必達標，因此考慮修訂總成本要求。"
商務部：中方在TikTok問題立場清楚　冀美方切實履行承諾,2025-09-20 16:50,,2025-09-20 17:00,greater_china,rthk,https://news.rthk.hk/rthk/ch/component/k2/1823782-20250920.htm,"在北京，商務部重申，中方在TikTok問題的立場清楚，希望美方切實履行相應承諾。

商務部新聞發言人回應記者提問時表示，中方在TikTok問題的立場是清楚的，中國政府尊重企業意願，樂見企業在符合市場規則基礎上，做好商業談判，達成符合中國法律法規、利益平衡的解決方案。希望美方與中方相向而行，切實履行相應承諾，為包括TikTok在內的中國企業，在美持續運營提供開放、公平、公正和非歧視的營商環境，推動中美經貿關係穩定、健康、可持續發展。"
習近平致電尼泊爾總統鮑德爾　稱高度重視中尼關係發展,2025-09-20 16:43,,2025-09-20 17:00,greater_china,rthk,https://news.rthk.hk/rthk/ch/component/k2/1823780-20250920.htm,"國家主席習近平致電尼泊爾總統鮑德爾，祝賀尼泊爾國慶。

習近平指出，中尼建交70年來，兩國始終秉持和平共處五項原則，真誠相待、相互尊重、相互支持，雙邊關係保持健康穩定發展。

習近平表示，高度重視中尼關係發展，願意同鮑德爾一起努力，賡續傳統友誼，鞏固政治互信，深化互利合作，推動中尼面向發展與繁榮、世代友好的戰略合作夥伴關係，不斷取得新發展，更好造福兩國人民。"
快手及微博涉破壞網絡生態　被國家網信辦約談,2025-09-20 16:25,,2025-09-20 17:00,greater_china,rthk,https://news.rthk.hk/rthk/ch/component/k2/1823779-20250920.htm,"內地短片應用程式快手及社交平台微博涉及炒作明星個人動態等行為，被國家網信辦約談、責令限期改正。

國家網信辦先後發聲明，指快手及微博未有落實信息內容管理主體責任，在熱搜榜單呈現炒作明星個人動態和瑣事類詞條等不良信息內容，破壞網絡生態。

國家網信辦指導北京市網信辦，依據《網絡信息內容生態治理規定》等，對兩個平台採取約談、責令限期改正、警告、從嚴處理責任人等處置處罰措施。

當局強調，網信部門將持續聚焦破壞網絡生態違法違規突出問題，發揮網絡執法利劍作用，督促網站平台履行主體責任和社會責任，切實維護清朗網絡空間。"
李家超︰互聯網有不良資訊令思想或「走埋一邊」　學生可回家傾談,2025-09-20 16:23,,2025-09-20 16:45,local,rthk,https://news.rthk.hk/rthk/ch/component/k2/1823777-20250920.htm,"行政長官李家超，出席本台節目時說，很關心精神健康問題，認為互聯網有一些欺凌和不良資訊，令思想可能「走埋一邊」，建議學生遇到困難可以在家庭或和朋輩等傾談。

李家超又說，建立「部門首長責任制」，可以做到制度化和清晰化，推動部門首長強化和「健身」。"
因應樺加沙下周靠近　大灣區航空作出特別票務安排,2025-09-20 16:16,,2025-09-20 16:30,local,rthk,https://news.rthk.hk/rthk/ch/component/k2/1823778-20250920.htm,"因應強烈熱帶風暴樺加沙將於下周靠近廣東沿岸並顯著增強，大灣區航空宣布作出特別票務安排，以減低對乘客的不便。

大灣區航空表示，原定9月23日至25日出發的乘客，可於原定出發日期7天內更改機票，新出發日期須為原定出發日期10天內。

至於原定於9月24日出發的乘客，亦可於原定出發日期14 天內安排退票，所有相關費用將獲豁免。如欲更改機票或辦理退款，可與相關售票代理聯絡。"
歐洲多個主要機場登機系統遭網絡攻擊　大量航班延誤或取消,2025-09-20 15:59,,2025-09-20 16:15,cinternational,rthk,https://news.rthk.hk/rthk/ch/component/k2/1823775-20250920.htm,"歐洲多個主要機場的登機系統遭到網絡攻擊，涉及倫敦、布魯塞爾、柏林等主要城市，有航班延誤或取消。

比利時布魯塞爾的機場表示，辦理航班報到和登機手續的電腦系統，遭到網絡攻擊，目前只能人手處理報到和登機手續，將會導致大量航班延誤或取消。機場方面又說，電腦系統服務提供者正在處理事件，希望盡快解決問題。

英國倫敦希斯路機場、以及德國柏林機場也提醒旅客，預料需要較長時間辦理航班報到和登機手續，建議旅客前往機場前，先向航空公司查詢航班狀況。"
天文台料樺加沙將以超強颱風強度靠近　沿岸水位或與天鴿山竹相若,2025-09-20 15:42,,2025-09-20 16:15,local,rthk,https://news.rthk.hk/rthk/ch/component/k2/1823774-20250920.htm,"天文台表示，預料熱帶氣旋樺加沙會在未來一兩日移向呂宋海峽一帶並顯著增強，有機會以超強颱風強度在下周中期靠近廣東沿岸。按照現時預測，本港星期二、三天氣逐漸轉壞，星期三吹烈風至暴風，天氣惡劣，有狂風大驟雨及雷暴，海有巨浪及湧浪。

天文台強調，由於受顯著風暴潮影響，屆時沿岸水位可能與2017年的天鴿及2018年的山竹相若。市民請留意天文台最新天氣消息及做好防風防水浸準備。"
鄧炳強稱跨部門迅速處理戰時炸彈體現紀律部隊守護市民使命與決心,2025-09-20 15:29,,2025-09-20 15:45,local,rthk,https://news.rthk.hk/rthk/ch/component/k2/1823773-20250920.htm,"警方成功順利銷毀在鰂魚涌發現的戰時炸彈，保安局局長鄧炳強說，跨部門迅速應變，經過通宵專業處理，即使在惡劣天氣下，成功解除炸彈危機，感謝警隊、消防處、民安隊同醫療輔助隊人員，再次體現香港紀律部隊時刻守護市民的使命與決心。

鄧炳強在社交網頁亦感謝民政事務處及社區服務機構的協助，令疏散行動迅速有序。

民政及青年事務局就在社交網頁表示，因應鰂魚涌濱海街一帶陸續解封，民政處、區議員、關愛隊隨即陸續接送居民返家。

民政處昨晚為近450名有需要居民入住各區臨時庇護中心，並提供床舖、飯盒等。多隊關愛隊、民安隊及紅十字會等義工亦通宵照料居民。民青局局長麥美娟感謝市民的理解和配合，以及各團隊成員的付出。"
施政報告2025｜部門首長責任制調查機制第二級不涵蓋警隊,2025-09-20 15:25,,2025-09-20 15:45,local,rthk,https://news.rthk.hk/rthk/ch/component/k2/1823772-20250920.htm, 
警方指因惡劣天氣導致處理炸彈時間較預期長一至兩小時,2025-09-20 15:22,,2025-09-20 15:45,local,rthk,https://news.rthk.hk/rthk/ch/component/k2/1823771-20250920.htm,"在鰂魚涌一個地盤發現的1000磅二戰時期炸彈，警方表示今日近中午12時成功完成處理，現場回復安全，安排居民有序返回住所，附近道路經已解封。

警方爆炸品處理課高級炸彈處理主任李展超表示，炸彈內有500磅炸藥，當附近居民疏散後，爆炸品處理課在凌晨2時開始拆彈程序，以4小時切割出一個一呎長的洞以接觸內裡炸藥，但因惡劣天氣，導致處理時間較預期長一至兩小時。他形容炸彈威力猛烈及具破壞力，如果在處理期間保護工作不足，可對附近建築物構成嚴重破壞。

他形容，相關炸彈作為二戰期間作殺傷用途，製作嚴謹，至今仍保持有效狀態，埋藏地下80年仍然有效。因應本港地少人多，如果要轉移爆炸品才進行處理會構成風險，因此警方會優先以原地處理。

李展超說，通宵拆彈期間下大雨，爆炸品所處的地盤水位上升至小腿，地面濕滑亦影響視野，不便處理重型工具，因此處理爆炸品的時間相應減慢。

因應事件，昨晚要緊急疏散18幢大廈約6000名居民，有463人入住港島的11個社區會堂，消防處救護人員運送5名不適市民到醫院治理。"
