title,date,summary,scrape_time,section,source,url,news_content
古特雷斯指非洲取得進展非奇跡　透過穩定務實努力解決現實問題,2026-02-15 17:52,,2026-02-15 18:15,cinternational,rthk,https://news.rthk.hk/rthk/ch/component/k2/1843941-20260215.htm,"聯合國秘書長古特雷斯重申，聯合國將與非洲聯盟繼續合作，共同應對非洲面臨的挑戰。

非盟峰會在位於埃塞俄比亞首都亞的斯亞貝巴的非盟總部開幕。古特雷斯在記者會上說，從推動區域一體化到加大投資在清潔能源及基礎設施，非洲大陸正取得進展，這個不是奇跡，而是在一個不可預測、充滿動蕩的國際環境中，透過穩定而務實的努力，解決現實問題。

古特雷斯又說，非洲雖擁有全球增長最快的一些經濟體，卻面臨沉重的債務負擔、高企的借貸成本和有限的融資渠道，阻礙了教育、醫療和就業發展，國際社會應加大對非洲和平與安全努力的支持。



編輯：羅宇光"
天文台總部下午錄得最高氣溫26.9度　平了年廿八最高紀錄,2026-02-15 17:37,,2026-02-15 17:45,local,rthk,https://news.rthk.hk/rthk/ch/component/k2/1843939-20260215.htm,"截至下午4時，天文台總部錄得最高氣溫26.9度，平了有記錄以來年廿八最高紀錄，亦即是2010年的紀錄，而流浮山錄得31.6度、石崗30.8度、上水29.3度。

天文台在社交專頁表示，預計明天日間繼續比較暖，市區最高氣溫約27度，新界再高兩、三度。至於年初一會比較大風，氣溫稍為下降。



編輯：陳樂謙"
SJ visits public housing estate ahead of CNY,2026-02-15 17:33,,2026-02-15 18:00,elocal,rthk,https://news.rthk.hk/rthk/en/component/k2/1843938-20260215.htm,"Secretary for Justice Paul Lam visited a public housing estate to spread the Lunar New Year cheer with residents.

Writing on social media, Lam said he visited two families living in Lai Tak Estate in Tai Hang.

Lam said he first visited a family of three, which included the father, Shi, who works as a security guard, and his son who is in Secondary Five.

He noted that they are satisfied with their living environment, after having moved from a transitional housing unit. Prior to that, they were living in a subdivided flat. 

Lam commended Shi's dedication in providing a comfortable and stable living environment for his family.

The second household Lam visited was an elderly couple surnamed Poon.

He wished them a healthy, peaceful and happy Lunar New Year."
伊朗副外長稱如美方願討論解除制裁伊方準備好考慮於核協議妥協,2026-02-15 17:18,,2026-02-15 17:30,cinternational,rthk,https://news.rthk.hk/rthk/ch/component/k2/1843937-20260215.htm,"伊朗一名外交官員接受英國廣播公司訪問時表示，如果美國願意討論解除制裁，德黑蘭亦已準備好考慮在與美方達成核協議方面妥協。

伊朗副外長拉萬希在透問中形容，現時球已在美方的半場，他們需要證明願意達成協議，如果美方有誠意，他相信雙方就能達成協議。

拉萬希又說，伊方提出稀釋純度為60%的濃縮鈾，這是伊朗願意妥協的明證，如果美方願意討論制裁問題，德黑蘭亦準備好討論濃縮鈾問題及伊方計劃下的其他議題。



編輯：羅宇光"
Mainland visitors flock to HK in LNY travel rush,2026-02-15 17:09,,2026-02-15 17:30,elocal,rthk,https://news.rthk.hk/rthk/en/component/k2/1843934-20260215.htm,"Hong Kong saw tens of thousands of mainland tourists visiting the city to celebrate the Year of the Horse as the festive period across the border began on Sunday.

The official Lunar New Year holiday on the mainland lasts for nine days, and Hong Kong officials had earlier estimated that total arrivals and departures through the city's border crossings during the festive period to reach almost 11.4 million. 

Among those arriving in the SAR was a tourist from Xinjiang surnamed Tang, who first flew to Shenzhen before taking the high-speed rail to the West Kowloon terminus. She plans to stay in the city for five days. 

""We will go watch the fireworks, and also the float parade. We also hope to visit the temple to burn the first incense stick of the year to pray for good fortune for my family in the Year of the Horse,"" Tang told RTHK. 

For a Shenzhen visitor surnamed Wang, she decided to stay a night in Hong Kong and said accommodations cost less before the Lunar New Year. 

""I noticed that accommodations became more expensive in the coming few days...costing about 800 yuan more,"" she said. 

Also arriving via the high-speed rail was a traveller surnamed Zhao, who said: ""We thought it would take one to two hours to pass through immigration. But it was quite fast. It only took 20 minutes.""

Immigration authorities recorded over 77,000 arrivals as of 10am, with more than 40,000 of them coming from the mainland."
內地春節黃金周展開　運輸署指已加強公共運輸服務,2026-02-15 17:03,,2026-02-15 17:30,local,rthk,https://news.rthk.hk/rthk/ch/component/k2/1843936-20260215.htm,"內地春節黃金周展開，運輸署預計會有大量市民、訪港旅客及跨境車輛使用各陸路口岸，提醒市民跨境出行應盡量使用公共交通工具，並及早計劃行程，預留充裕交通時間。

運輸署在社交網站說，本地和跨境公共運輸已加強服務，包括港鐵東鐵綫加密金鐘至羅湖或落馬洲站列車班次；年廿九大部分本地鐵路線提供通宵服務；年初一花車巡遊和年初二煙花匯演，亦會加強相關鐵路線服務。

運輸署又說，市民和旅客可透過「口岸通」網站或「香港出行易」應用程式，查閱最新口岸資訊、港鐵服務情況及輪候時間等。



編輯：汪溟曦"
警方大嶼山南反走私拘兩男　檢獲市值共約1460萬懷疑私煙,2026-02-15 16:49,,2026-02-15 17:00,local,rthk,https://news.rthk.hk/rthk/ch/component/k2/1843935-20260215.htm,"警方在大嶼山南一帶海域及陸上道路進行反走私行動，在兩輛貨車內共檢獲324萬支懷疑私煙，估計市值約1460萬元，應課稅值約1070萬元，行動中拘捕兩名男子。

警方懷疑近日有人在大嶼山南一帶進行走私活動，昨晚採取行動，發現三艘沒有亮起航行燈的快艇，駛至大嶼山南一帶岸邊，於是展開海上追截及於陸上作部署，涉案快艇最終逃離香港西南面水域，往內地方向駛去。

探員在東涌道截停兩輛載有懷疑私煙的貨車，在車內檢獲上述懷疑私煙，拘捕涉案的兩名20歲及53歲本地男子，涉案貨車被扣查。



編輯：汪溟曦"
Two men held on suspicion of smuggling cigarettes,2026-02-15 16:49,,2026-02-15 17:00,elocal,rthk,https://news.rthk.hk/rthk/en/component/k2/1843933-20260215.htm,"Police said on Sunday they arrested two men on Lantau Island on suspicion of smuggling more than three million sticks of illicit cigarettes – with a street value of some HK$14.6 million. 

The force said they suspected there had recently been smuggling activities on the south side of the island, and officers found three speedboats which had their lights turned off on Saturday. 

Police said while the boats ended up fleeing to waters southwest of Hong Kong, officers were able to stop two vans on Tung Chung Road and found the suspected illicit cigarettes.

The arrestees are aged 20 and 53, and officers have held the vehicles for investigation."
深圳灣大橋車禍涉一輛旅遊巴　增至17人傷,2026-02-15 16:27,,2026-02-15 16:45,local,rthk,https://news.rthk.hk/rthk/ch/component/k2/1843932-20260215.htm,"深圳灣公路大橋下午發生交通意外，增至17人受傷。消防澄清，事件涉及一輛旅遊巴。

事發在接近下午2時，一架旅遊巴在深圳灣公路大橋失事，10男7女受輕傷，當中9人送屯門醫院，8人送天水圍醫院治理。



編輯：汪溟曦"
17 hurt in coach crash on Shenzhen Bay Bridge,2026-02-15 16:13,,2026-02-15 17:00,elocal,rthk,https://news.rthk.hk/rthk/en/component/k2/1843928-20260215.htm,"At least 17 people sustained minor injuries from a crash on a cross-border link between Hong Kong and Shenzhen on Sunday afternoon. 

The incident happened shortly before 2pm on Shenzhen Bay Bridge after the driver of a Hong Kong-bound coach lost control and crashed.

The Transport Department said some of the bridge's Tuen Mun-bound lanes had been closed to traffic."
17 hurt as two coaches crash on Shenzhen Bay Bridge,2026-02-15 16:13,,2026-02-15 16:45,elocal,rthk,https://news.rthk.hk/rthk/en/component/k2/1843928-20260215.htm,"At least 17 people sustained minor injuries from a crash on a cross-border link between Hong Kong and Shenzhen on Sunday afternoon. 

The incident happened shortly before 2pm on Shenzhen Bay Bridge after the driver of a Hong Kong-bound coach lost control and crashed.

The Transport Department said some of the bridge's Tuen Mun-bound lanes had been closed to traffic."
15 hurt as two coaches crash on Shenzhen Bay Bridge,2026-02-15 16:13,,2026-02-15 16:30,elocal,rthk,https://news.rthk.hk/rthk/en/component/k2/1843928-20260215.htm,"At least 15 people sustained minor injuries from a crash on a cross-border link between Hong Kong and Shenzhen on Sunday afternoon. 

The incident happened on Shenzhen Bay Bridge when two coaches collided on a lane leading into the SAR. 

The Transport Department said some of the bridge's Tuen Mun-bound lanes had been closed to traffic."
FS: More mainland visitors expected this CNY,2026-02-15 16:07,,2026-02-15 16:15,elocal,rthk,https://news.rthk.hk/rthk/en/component/k2/1843931-20260215.htm,"Financial Secretary Paul Chan on Sunday said he expects 1.43 million mainland travellers to visit the SAR during the Lunar New Year holiday period, a six percent year-on-year increase compared to the previous year.

In his weekly blog, Chan noted that there were 7.23 million arrivals since January 1, up 9.6 percent, in which overseas visitor arrivals saw a 16.4 percent surge. 

""Hong Kong's Lunar New Year is rich in atmosphere, blending tradition and modern elements, with plenty of mega events and performances, providing exciting options and drawing in many tourists,"" he wrote.

On Saturday, Chan went to the Victoria Park flower market to give Lunar New Year blessings. 

He talked to vendors, which included secondary school and university students.

He praised them for their creativity in coming up with Year of the Horse-themed products and blending trendy sayings with New Year blessings.

The finance secretary noted that a series of events will be launched across the city during the three-day Lunar New Year holiday, including a float parade at Tsim Sha Tsui on Tuesday, a fireworks display over Victoria Harbour on Wednesday, and the New Year horse races on Thursday.

Chan said Hong Kong will be buzzing with festive excitement throughout the Lunar New Year period."
《求是》雜誌發表習近平重要文章　闡述當前經濟工作重點任務,2026-02-15 15:45,,2026-02-15 16:15,greater_china,rthk,https://news.rthk.hk/rthk/ch/component/k2/1843929-20260215.htm,"明天出版的《求是》雜誌將發表中共中央總書記、國家主席、中央軍委主席習近平的重要文章，文章指今年經濟工作頭緒多，要抓住關鍵、綱舉目張。

文章是習近平去年在中央經濟工作會議上講話的部分內容，指要堅持內需主導，建設強大國內市場，統籌促消費和擴投資，用好超大規模市場優勢。包括擴大優質商品和服務供給，釋放文旅等服務消費潛力，推動投資止跌回穩，適當增加中央預算內投資規模，繼續發揮新型政策性金融工具作用等。

文章指出，要堅持創新驅動，加緊培育壯大新動能。建設北京（京津冀）、上海（長三角）、粵港澳大灣區國際科技創新中心，打造世界級科技創新策源地，深化拓展「人工智能+」，完善人工智能治理等。

文章亦指，深入整治「內卷式」競爭，制定和實施進一步深化國資國企改革方案，完善民營經濟促進法配套法規政策，有序擴大服務領域自主開放，扎實推進海南自由貿易港建設，推動商簽更多區域和雙邊貿易投資協定，著力穩定房地產市場等。



編輯：汪溟曦"
林定國近日到訪勵德邨　籲新一年多關心鄰里並送暖社區,2026-02-15 15:17,,2026-02-15 15:30,local,rthk,https://news.rthk.hk/rthk/ch/component/k2/1843927-20260215.htm,"律政司司長林定國表示，早前到大坑勵德邨探訪居民，提早拜年。

林定國在社交專頁表示，其中一戶一家三口，他們從劏房到過渡性房屋，再在年前搬到勵德邨，很滿意現在的居住環境。

他表示，農曆新年將近，大家準備過年時，不妨多關心左鄰右里，把迎接新一年的溫暖和朝氣送到社區。



編輯：陳樂謙"
大埔新娘潭路單車意外　49歲男子死亡,2026-02-15 15:07,,2026-02-15 15:30,local,rthk,https://news.rthk.hk/rthk/ch/component/k2/1843926-20260215.htm,"一名49歲男子在大埔新娘潭路騎單車期間失事，倒地昏迷，送院後證實不治。

警方早上約10時半接報，事主在大埔新娘潭路騎單車，期間單車失控，男子倒地昏迷，被送往那打素醫院搶救，其後證實不治。警方將涉事單車取走檢驗，以調查事故起因。



編輯：汪溟曦"
上月訪港旅客按年升1%　有德國旅客稱香港景點吸引,2026-02-15 15:07,,2026-02-15 15:30,local,rthk,https://news.rthk.hk/rthk/ch/component/k2/1843925-20260215.htm,"旅發局表示，上月訪港旅客約481萬人次，按年升1%，其中非內地旅客升約15%至117萬人次。在尖沙咀一帶，有不少外地遊客到訪。

有來自德國的旅客表示，因為轉機而留港兩日一夜，可惜未能在香港感受農曆新年的節日氣氛。他表示，40年前曾經到過香港，形容建築物、景色等已有很大轉變；又指香港對旅客來說，無論景點或美食都有很大吸引力。

亦有愛爾蘭旅客表示，今次第一次訪港，到過山頂等景點，又認為維港景色很漂亮。



編輯：陳樂謙"
Cyclist dies in Tai Po after apparently losing control,2026-02-15 15:05,,2026-02-15 15:30,elocal,rthk,https://news.rthk.hk/rthk/en/component/k2/1843923-20260215.htm,"A 49-year-old cyclist died on Sunday following an apparent crash in Tai Po after losing control of his bike. 

Police said they received a call at around 10.30am that the man had lost consciousness after the crash on Bride's Pool Road. 

The man was taken to Nethersole Hospital, where he was certified dead. 

Officers took the bicycle away as part of their investigation."
深圳灣大橋兩輛旅遊巴相撞　初步15人輕傷,2026-02-15 15:00,,2026-02-15 15:30,local,rthk,https://news.rthk.hk/rthk/ch/component/k2/1843924-20260215.htm,"深圳灣公路大橋發生交通意外，事發在下午1時許，兩輛旅遊巴於其中一條往香港方向的行車線上相撞，初步造成15人輕傷。

運輸署表示，深圳灣公路大橋往屯門方向的部分行車線已封閉。



編輯：陳樂謙"
內地新春長假期展開　有即日來回旅客稱旅程購物為主,2026-02-15 14:47,,2026-02-15 16:30,local,rthk,https://news.rthk.hk/rthk/ch/component/k2/1843922-20260215.htm,"內地農曆新年長假期今日展開，在尖沙咀一帶，部分店舖外有旅客及市民排隊購物。

來自深圳的旅客劉小姐表示，今次行程即日來回，目標購買衣服和鞋。她說之前曾到訪維港等景點，今次不會再去。

有即日來回、來自深圳的旅客帶同行李箱購物，她表示過往曾經多次到訪香港，今次唯一目標是購物，到埗後已經購入一雙鞋。她表示，香港貨品種類較多和較新，一般新出的款式都會優先在香港上架。另外，匯率亦是吸引之處，例如購買一件價值兩萬元的貨品，相較內地，在香港買會大約便宜2000元。

亦有旅客表示，10年前曾經跟父母到過香港，形容香港變化很大，今次除了在香港旅遊亦到訪過澳門；今天是最後一天行程，主要會購物，亦成功買到「戰利品」，花了大約一萬多元買了一個手袋。



編輯：汪溟曦"
內地新春長假期展開　有即日來回旅客稱旅程主要購物,2026-02-15 14:47,,2026-02-15 15:30,local,rthk,https://news.rthk.hk/rthk/ch/component/k2/1843922-20260215.htm,"內地農曆新年長假期今日展開，在尖沙咀一帶，部分店舖外有旅客及市民排隊購物。

來自深圳的旅客劉小姐表示，今次行程即日來回，目標購買衣服和鞋。她說之前曾到訪維港等景點，今次不會再去。

有即日來回、來自深圳的旅客帶同行李箱購物，她表示過往曾經多次到訪香港，今次唯一目標是購物，到埗後已經購入一雙鞋。她表示，香港貨品種類較多和較新，一般新出的款式都會優先在香港上架。另外，匯率亦是吸引之處，例如購買一件價值兩萬元的貨品，相較內地，在香港買會大約便宜2000元。

亦有旅客表示，10年前曾經跟父母到過香港，形容香港變化很大，今次除了在香港旅遊亦到訪過澳門；今天是最後一天行程，主要會購物，亦成功買到「戰利品」，花了大約一萬多元買了一個手袋。



編輯：汪溟曦"
周一鳴︰正與部分商場商討　閉路電視接駁至銳眼系統,2026-02-15 13:21,,2026-02-15 13:45,local,rthk,https://news.rthk.hk/rthk/ch/component/k2/1843921-20260215.htm,"政府預計2028年全港會安裝約6萬支閉路電視鏡頭。警務處處長周一鳴表示，警方正與部分商場商討，將閉路電視接駁至「銳眼計劃」系統，獲正面回覆，目標今年內進行；初步會選擇人流多、較有策略性位置的地點。他又說，希望不久將來，例如今年或明年，可加入人臉識別功能。他強調開始前一定會向市民公布，亦需讓執法人員適應，考慮市民接受程度及法律框架要求等。

本港去年錄得約4.3萬宗詐騙案。周一鳴在一個電視節目時說，內地打擊電騙工作很有成效，本港的假冒客服個案亦有所下降；至於去年整體騙案損失金額減少約10億元，但投資騙案損失金額則上升至35億元。周一鳴認為，需要重點宣傳，提醒市民慎防受騙；考慮到約8成投資騙案與港人常用的社交媒體有關，警方會與相關社交媒體公司商討，嘗試將有問題用戶或群組剔除。

國際刑警組織全體大會將於今年由國家承辦，於11月在本港召開。周一鳴表示，全球警隊面對的問題相似，例如與科技相關的罪行、跨境罪行等。他說，在地緣政局下，較多本港逃犯會到亞洲或東盟地區，有需要與這些地區有更多合作。



編輯：汪溟曦"
Police hope to adopt CCTV facial recognition this year,2026-02-15 12:51,,2026-02-15 13:15,elocal,rthk,https://news.rthk.hk/rthk/en/component/k2/1843919-20260215.htm,"Police chief Joe Chow on Sunday said he hopes the force can adopt facial recognition technology this year or the next for their network of CCTV cameras around Hong Kong. 

The Security Bureau had said that at the end of last year, there were some 11,000 surveillance cameras in use, of which 5,000 were installed by the force and 6,000 from other government departments.

The plan is to have 60,000 cameras under its SmartView programme covering the entire city in two years, with more to be added down the line. 

Speaking on a TVB programme, Chow stressed that factors in play regarding the use of facial recognition include technical issues, the public's level of acceptance level as well as the legal framework.

He noted that many places around the world already use facial recognition, and for crime prevention and detection, the more cameras the better. 

""I think say some 20, 30 years ago, we looked into this matter [regarding privacy issues], and the society broadly opposed the cameras,"" the police chief said.

""But times have changed. You can see that, not just on the mainland, you can see surveillance cameras installed within a couple of steps in many other places around the world.""

Chow also said that police are looking to incorporate CCTV at shopping malls into its network this year, as some corporations have given positive feedback.

""We're looking at malls where there are many people, or that we think their locations are rather strategic,"" he said.

""After all, I don't necessarily talk about what happens inside the malls, but when people pass by the area, they're already strategic locations.""

The police commissioner went on to say that cameras for some malls might not be useful at first, but the force might incorporate them into the network when officers think they are needed later."
陳茂波︰今年至本月13日訪港旅客人次達723萬　按年增近一成,2026-02-15 12:40,,2026-02-15 13:00,local,rthk,https://news.rthk.hk/rthk/ch/component/k2/1843920-20260215.htm,"財政司司長陳茂波在網誌表示，今年1月至本月13日，訪港旅客人次達723萬，比去年同期增加近一成，當中海外旅客顯著增加約16%；預料春節假期將有143萬人次內地旅客訪港，日均訪客人數預料按年上升約6%。

陳茂波說，本港農曆新年氣氛濃厚，有不少盛事活動及表演，包括年初一尖沙咀花車巡遊、年初二煙花匯演、年初三賀歲賽馬、年初五足球賀歲盃等，讓香港在新年期間盛事連連、區區熱鬧，市民有豐富精彩選擇，亦吸引不少旅客到來體驗。

陳茂波昨日到過維園年宵市場，提及曾與部分年宵攤檔商戶傾談，並引述商戶指今年氣氛比去年好。陳茂波逛年宵期間，買了利是封及公仔等，與市民合照並提早拜年。他昨日亦探訪了兩個家庭，送上新年祝賀。



編輯：汪溟曦"
"'Seatbelt law exemptions, penalties under scrutiny'",2026-02-15 12:38,,2026-02-15 12:45,elocal,rthk,https://news.rthk.hk/rthk/en/component/k2/1843915-20260215.htm,"Transport secretary Mable Chan on Sunday said officials would study details of the mandatory seatbelt rule on buses, including its exemptions and penalties, before reintroducing it. 

The government earlier repealed the legislation making buckling-up obligatory, with the authorities saying there were deficiencies in the clauses of the law. 

Chan said the administration would draw up an improved proposal to consult the public on the matter after conducting a review of the legislation.

""We will particularly re-examine details of the rule's execution, such as on the enforcement, exemptions, and penalties, throughout our review. We hope to handle the issue with law, reason and compassion,"" she said.

With the official Lunar New Year holiday on the mainland starting on Sunday, the transport minister said close to 100 private cars from Guangdong were expected to enter Hong Kong's urban areas under the Southbound Travel Scheme on the first day of the nine-day period. 

""Over the next few days, there will be nearly 500 [bookings] for vehicles coming to Hong Kong. Half of them will stay in the city for a day or two,"" Chan said, adding that the numbers overall fall within expectations. 

Under the Southbound Travel for Guangdong Vehicles scheme, up to 100 private cars are allowed to enter the territory's urban areas daily for a stay of up to three days. 

While the number of Guangdong motorists travelling to Hong Kong via the scheme has been promising on weekends and on long holidays, Chan said there is still a certain amount of slots available on weekdays. 

The minister said authorities would step up promotion of the scheme on the mainland so that the existing slots are better utilised, before they seek to expand the scheme and increase the number of vehicles allowed into urban areas."
陳茂波指本港農曆新年氣氛濃厚　相信可吸引旅客來港,2026-02-15 12:26,,2026-02-15 12:45,local,rthk,https://news.rthk.hk/rthk/ch/component/k2/1843918-20260215.htm,"財政司司長陳茂波表示，今年1月至本月13日，訪港旅客人次達723萬，比去年同期增加近一成；預料在春節假期，將有143萬人次內地旅客訪港。

陳茂波說，本港農曆新年氣氛濃厚，有不少盛事活動，相信可吸引不少旅客來港。他昨日到訪維園年宵及探訪家庭，向市民送上新年祝福。




編輯：汪溟曦"
粵車南下入境市區今日預約數額近100個　陳美寶指反應符合預期,2026-02-15 12:25,,2026-02-15 12:45,local,rthk,https://news.rthk.hk/rthk/ch/component/k2/1843917-20260215.htm,"運輸及物流局局長陳美寶說，「粵車南下」入境市區部分，今日預約數額有近100個，未來幾天亦合共有近500個，當中一半私家車將留港一至兩天，整體反應符合預期，期望將政策擴展至廣東省更多城市。

她又說，會審慎和實事求是，重新檢視有關巴士乘客戴安全帶的規定，最重要是廣泛諮詢社會意見，並透露會特別檢視執行、豁免和罰則等細節。



編輯：汪溟曦"
