title,date,summary,scrape_time,section,source,url,news_content
McDonald's reportedly to sell 8 Hong Kong properties,2025-07-28 13:17,,2025-07-28 13:30,efinance,rthk,https://news.rthk.hk/rthk/en/component/k2/1815430-20250728.htm,"Fast food giant McDonald's is planning to sell eight prime retail properties in Hong Kong with a total market value of HK$1.2 billion, according to property firm JLL.

In a statement on Monday, JLL said it has been appointed as the sole agent for the sales, which will be conducted via public tender on September 16.

The agency said the properties are in Tsim Sha Tsui, Causeway Bay, Mong Kok, Kennedy Town, Tai Kok Tsui, Yuen Long, Tsuen Wan and Tsz Wan Shan, and range from 6,800 to 19,000 square feet in size.

The largest is the ground floor and basement of Star House on Salisbury Road in Tsim Sha Tsui.

The company said the properties are all secured with long-term McDonald's leases and will be available for purchase either individually or as a portfolio.

Eunice Tang, executive director of capital markets at JLL in Hong Kong, said the sites will be supported by high rental yields with a full occupancy rate.

""Most of these McDonald's restaurants have been iconic dining destinations for over 30 years, with some operating 24/7, which underscores the strength and resilience of the tenants' businesses,"" she said.

Tang said there are no changes planned to the chain's restaurants in those locations and they remain operational."
恒指下午初段升逾百點,2025-07-28 13:10,,2025-07-28 13:30,local,rthk,https://news.rthk.hk/rthk/ch/component/k2/1815432-20250728.htm,"港股下午開市初段上升，恒生指數較早時報25522點，升134點，升幅0.53%。

科技指數報5652點，跌25點，跌幅0.44%。"
恒指下午初段升幅收窄至100多點,2025-07-28 13:10,,2025-07-28 13:15,cfinance,rthk,https://news.rthk.hk/rthk/ch/component/k2/1815432-20250728.htm,"港股下午開市初段上升，但升幅收窄，恒生指數較早時報25522點，升134點，升幅0.53%。

科技指數報5652點，跌25點，跌幅0.44%。"
地產代理預期現樓佔一手樓成交比例持續上升,2025-07-28 12:57,,2025-07-28 13:15,local,rthk,https://news.rthk.hk/rthk/ch/component/k2/1815431-20250728.htm,"根據地產代理數字，截至本月24日，本港今年一手住宅成交達10750宗，相當於去年全年約72%。今年到目前為止現樓成交佔整體一手成交47%，樓花佔53%。單計7月，一手住宅成交錄得1450宗，當中現樓佔逾80%。

美聯物業首席分析師劉嘉輝表示，現樓成交佔比上升，原因是發展商積極去庫存，全年計，現樓與樓花佔比可能各佔一半。他說，發商展在今年餘下時間會繼續去庫存。

利嘉閣地產研究部主管陳海潮則分析，目前是租務旺季，租盤需求殷切，加上經濟亦屬平穩，資金尋找出路，而現樓可即時放租，較受投資者歡迎。

美聯認為，全年一手成交有望升至19000宗，較去年多逾20%，二手宗數就輕微上升至45000宗。

利嘉閣就說，拆息仍然偏低，美國年內仍有減息機會，加上中美貿易戰有望進一步緩和，本地樓價或有見底跡象。"
衞生署稱香港乙肝感染率大降　如市民不確定是否感染應及早測試,2025-07-28 12:50,,2025-07-28 13:15,local,rthk,https://news.rthk.hk/rthk/ch/component/k2/1815429-20250728.htm,"衞生署表示，經過政府30多年來的推動和努力，香港乙型肝炎感染率已大幅降低，現時35歲以下年齡組別的乙肝感染率已少於1%，並逐步邁向「無乙肝新一代」的目標。

每年7月28日為「世界肝炎日」，衞生署提醒市民若不確定是否患有慢性乙型肝炎，應及早進行測試。早發現、早治療可有效減低乙肝所引發的嚴重肝臟疾病的風險。市民如不確定是否乙肝患者，特別是較高感染風險人士，例如不曾接種疫苗者、家庭成員或性伴侶為慢性乙肝患者等，應及早進行測試，了解自己的身體狀況，並採取適切預防措施，包括接種乙肝疫苗。

署方說，乙肝測試除透過傳統靜脈抽血化驗外，現時亦可透過指尖採血快速測試，於15至30分鐘內獲得結果，乙肝測試於不同醫療機構均有提供。如確診患有慢性乙肝，應諮詢醫生的建議並定期接受跟進和檢查，以實踐「早驗早處理」。

另外，政府今年內將公布《2025-2030年香港病毒性肝炎行動計劃》，制訂措施以進一步減輕病毒性肝炎的公共衞生負擔。"
Four more taxi fleets issued licences,2025-07-28 12:49,,2025-07-28 13:00,elocal,rthk,https://news.rthk.hk/rthk/en/component/k2/1815428-20250728.htm,"Four more taxi fleets - Big Boss Taxi, Amigo, Big Bee and Joie - have been issued with five-year licences by the Transport Department. 

In a statement on Monday, the department said that fleet taxi plates have to be displayed on both the front and rear of the vehicles, along with a fleet certificate on the windshields. 

Passengers can book a taxi trip for a higher price on the fleets' mobile applications, but fleets have to charge the same fares as general taxis for trips hailed on the street. 

The fleets must also provide multiple electronic payment options, with safety devices including dash cameras, in-vehicle cameras and global navigation systems installed.

The government has rolled out the taxi fleet system in a bid to revamp the industry and enhance service quality, with five companies operating fleets of up to 1,000 cabs initially. 

Another fleet, SynCab, was granted a licence earlier this month."
澳門有人力資源組織倡政府與休閒企業共同釋放有利當地人就業職位,2025-07-28 12:47,,2025-07-28 13:00,greater_china,rthk,https://news.rthk.hk/rthk/ch/component/k2/1815424-20250728.htm,"踏入暑假，新一批畢業生準備投入職場。

澳門近年不少畢業的年輕人，選擇做兼職謀生或新興的送外賣行業。澳門人力資源協會會長徐展文分析，與疫情後職場變化、澳門產業結構仍然單一，以及輸入外勞等因素影響有關。

他建議政府與休閒企業共同努力，適時釋放有利當地人就業的職位，提供培訓機會助缺乏經驗的年輕人較易進入職場。"
中大醫學院分析最常食用蟹　新發現助推動食物敏感精準診斷,2025-07-28 12:44,,2025-07-28 13:00,local,rthk,https://news.rthk.hk/rthk/ch/component/k2/1815420-20250728.htm,"中大醫學院針對市面上6種最常食用的蟹，進行分析，測試出11種與蟹過敏相關的致敏原，並發現皇帝蟹獨有的致敏原。

研究團隊認為新發現有助推動食物敏感的精準診斷，以免患者不必要地戒口。"
政府爭取全運時放寬內地居民赴港簽注　旅遊界冀可多次往返觀賽,2025-07-28 12:43,,2025-07-28 13:00,local,rthk,https://news.rthk.hk/rthk/ch/component/k2/1815419-20250728.htm,"特區政府正積極爭取於11月全運會期間，放寬內地居民赴港簽注便利措施。

旅遊界人士希望，屆時的內地旅客簽注，可多次往返內地、香港及澳門觀賽，簽注時效亦延長，又指旅遊業議會正與相關部門，商討門票安排。"
立會完成逐項審議同性伴侶登記草案　政府冀盡早恢復二讀辯論,2025-07-28 12:30,,2025-07-28 12:45,local,rthk,https://news.rthk.hk/rthk/ch/component/k2/1815427-20250728.htm,"立法會《同性伴侶關係登記條例草案》委員會完成條文的逐項審議。

政制及內地事務局局長曾國衞表示，由於終審法院要求政府確立替代框架的暫緩期，在今年10月27日屆滿，他感謝立法會的支持及配合，法案委員會高效完成審議工作。為履行政府的積極義務，在暫緩期內完成設立替代框架，政府希望法案委員會可以盡快將報告呈交內會，並盡早恢復條例草案的二讀辯論。

另外，政府表示，將會在立法會全體委員會階段提出3項修正案，涉及一些字眼修訂。"
河北承德市灤平縣山泥傾瀉初步造成4人死亡8人失蹤,2025-07-28 12:28,,2025-07-28 12:45,greater_china,rthk,https://news.rthk.hk/rthk/ch/component/k2/1815425-20250728.htm,"河北暴雨引發洪澇災害。承德市灤平縣發生山泥傾瀉，初步造成4人死亡，8人失蹤。

國家防災減災救災委員會啟動國家四級救災應急響應，國家發改委緊急調撥5000萬元人民幣，支持河北做好災後恢復。

北京密雲區西北部地區過去兩日亦出現強降雨，引發山洪及山泥傾瀉，多條村莊受災。"
港元1個月拆息重返1厘　隔夜拆息飆至近3個月新高,2025-07-28 12:26,,2025-07-28 12:45,local,rthk,https://news.rthk.hk/rthk/ch/component/k2/1815418-20250728.htm,"港元拆息近乎全線上升，短期拆息急升。

隔夜、1星期、2星期拆息升幅介乎約26至35個基點，隔夜拆息單日升30個基點，升至0.569厘，連升3日，創近3個月新高。

1個月拆息重返1厘以上，報1.023厘，升近11個基點，連升兩日，創逾1星期以來最高。

反映銀行資金成本的3個月拆息則跌約5個基點，連跌7個交易日，跌至1.703厘，是近1個月低位。"
益豐大廈恢復供電惟區議員稱臨時系統「跳掣」致供電斷斷續續,2025-07-28 12:21,,2025-07-28 12:45,local,rthk,https://news.rthk.hk/rthk/ch/component/k2/1815423-20250728.htm,"土瓜灣益豐大廈日前發生大規模停電，經搶修後4座大廈先後於昨日及今日清晨陸續恢復供電；不過，今早有部分居民表示，單位仍然沒有電力供應。

中電發言人表示，中電為大廈提供臨時接駁點，但A、C兩座的供電設施受鹹水淹浸嚴重損壞，全力支援下已於凌晨約2時39分為A座住戶復電，及於凌晨約3時41分為C座住戶復電。

九龍城區議員關浩洋表示，A及C座部分單位出現漏電情況，臨時電力系統受影響出現「跳掣」，部分樓層供電變得斷斷續續，目前機電署及中電現正進行排查，找出哪些單位出現漏電，益豐大廈B及D座，以及公用設施則沒有受到影響。

住客甄先生說，凌晨約4時曾經恢復電力供應，但約半小時後便斷電，然後持續復電斷電，直到早上6時供電才相對穩定。他說由於家中有長者，出入不方便，沒有去社區會堂暫住。

有C座住客表示，有收到通知已經恢復電力，但自己單位整晚未有復電，他希望能夠盡快有確切時間恢復電力。"
恒指半日升102點　保險和醫藥股造好,2025-07-28 12:14,,2025-07-28 12:30,cfinance,rthk,https://news.rthk.hk/rthk/ch/component/k2/1815421-20250728.htm,"港股造好，恒生指數一度升近280點，高見25667點，中午收市報25490點，升102點，升幅0.4%，半日主板成交額逾1497億元。

科技指數轉跌近0.6%，報5644點。ATMXJ個別發展，阿里巴巴升近2%，小米跌逾1%。

保險股上升，友邦升逾4%，平保和中人壽升逾3%。醫藥股造好，中生製藥升5%，是半日表現最好藍籌股。

本地地產股向上，新世界一度急升8%，半日升5%。新地和恒隆地產升近2%或以上，九龍倉置業升逾4%。

三桶油下跌，以中石化跌近2%幅度較大。另外，農夫山泉和中升控股都跌逾4%，是跌幅最大兩隻恒指成份股。"
運輸署發出4個正式的士車隊牌照為期5年　車隊今日起投入服務,2025-07-28 12:12,,2025-07-28 12:30,local,rthk,https://news.rthk.hk/rthk/ch/component/k2/1815422-20250728.htm,"運輸署公布，向4支的士車隊發出正式的士車隊牌照，為期5年，分別為「Big Boss Taxi」、「Amigo」、「大黃蜂愛心車隊」和「樂行車隊」。4支車隊由今日起正式投入服務。署方已批准4支車隊的士車身設計和標記。

為方便乘客識別，所有車隊的士均須於車身前方及後方展示車隊的士識別牌，並在前方擋風玻璃展示車隊的士證明書。運輸署發言人說，所有車隊均提供網約服務，乘客可透過車隊的手機應用程式或其他網約渠道預約。車隊亦有提供熱線，以處理乘客查詢及投訴。

另外，所有車隊的士均提供多項電子支付方式，並配置安全設備，包括行車記錄儀、車廂攝錄機及全球衞星導航系統，以及司機監察系統等。車隊的士可就預定行程自訂車費，但要預先與乘客協定。車隊的士可視乎預約時的情況和乘客要求的車輛類別，調整預定行程車費，例如在繁忙時段或當乘客指定豪華的士時，費用可能較高。至於在街頭截乘的行程，則與一般的士一樣，須按同一現行收費表收費。

另外，運輸署已於機場、部分跨境口岸、高鐵香港西九龍站、部分機鐵站、啟德郵輪碼頭和香港迪士尼樂園等13個地點，設置約80個車隊的士停車處，並加裝資訊牌。署方亦已於部分地點加裝指示牌和展示板，並透過單張和海報，向市民和旅客展示網約服務二維碼，便利乘客預約。"
澳門君怡娛樂場因業務情況決定將衛星賭場提前本月底結束營運,2025-07-28 12:05,,2025-07-28 12:30,greater_china,rthk,https://news.rthk.hk/rthk/ch/component/k2/1815417-20250728.htm,"澳門有衛星賭場提前在本月30日午夜結束營運，澳門博彩監察協調局早上發出新聞稿，指位於氹仔的君怡娛樂場，因業務情況與簡稱澳娛的賭牌持有人協商後，決定將衛星賭場原本在年底屆滿的「過渡期」，提前在本月30日晚上11時59分停止營運。

屆時博監局將派員到場，實地監察整個停運程序，確保澳娛按照已制定並提交的方案，妥善處理帳房內的現金及籌碼、未兌換現金券及籌碼的兌換等工作。

博監局表示，會與勞工局保持密切聯繫，確保場內全部的159名派駐僱員，按早前提交方案妥善安排，保障他們應有的薪金福利和工作條件；而衛星場自聘的7名僱員，澳娛亦需履行承諾，提供轉職機會。

澳門現時在6大賭牌公司屬下有約10間俗稱衛星場的外判賭場，將會營運到今年底過渡期結束。當中在澳娛屬下的衛星場就有9間，其中公司有意購回當中兩間酒店內的賭場設施，在過渡期後轉為自主場繼續經營。"
滬深股市半日變動不大,2025-07-28 11:54,,2025-07-28 12:15,cfinance,rthk,https://news.rthk.hk/rthk/ch/component/k2/1815414-20250728.htm,"內地股市半日變動不大，煤炭和鋼鐵股下跌；元件及軍工等股份向好。

上證綜合指數中午收市報3587點，跌5點，跌幅0.17%。

深證成份指數報11150點，跌17點，跌幅0.16%。

創業板指數報2342點，升2點，升幅0.1%。"
黃色工作暑熱警告生效,2025-07-28 11:48,,2025-07-28 12:00,local,rthk,https://news.rthk.hk/rthk/ch/component/k2/1815416-20250728.htm,"黃色工作暑熱警告在上午11時30分生效。

勞工處表示，部分工作環境的熱壓力頗高，僱主應參照勞工處指引，在合理地切實可行的情況下，採取所需的防暑措施。"
中國佛教協會同意註銷少林寺方丈釋永信的戒牒,2025-07-28 11:44,,2025-07-28 12:00,greater_china,rthk,https://news.rthk.hk/rthk/ch/component/k2/1815415-20250728.htm,"中國佛教協會發佈公告，指協會根據有關規定，同意對少林寺方丈釋永信的戒牒予以註銷。

釋永信涉嫌刑事犯罪，挪用侵佔項目資金和寺院資產，長期與多名女性保持不正當關係並育有私生子，嚴重違反佛教戒律。目前正在接受多部門聯合調查。

協會認為，釋永信的所作所為性質十分惡劣，嚴重敗壞佛教界的聲譽，損害出家人的形象，協會堅決擁護和支持對釋永信的依法處理決定。"
仲量聯行：8項連麥當勞租約物業公開招標出售　總市值約12億元,2025-07-28 11:30,,2025-07-28 12:00,local,rthk,https://news.rthk.hk/rthk/ch/component/k2/1815413-20250728.htm,"物業顧問仲量聯行獲業主獨家代理，公開招標出售8項連麥當勞長期租約的零售物業，總市值約12億元，將於9月16日中午截標，買家可選擇競投整批物業或任何一項物業。

仲量聯行表示，物業組合涵蓋8間麥當勞餐廳，分別位於尖沙咀、銅鑼灣、旺角、堅尼地城、大角咀、元朗、荃灣及慈雲山，市場建築面積介乎約6800至1.9萬平方呎，面積最大為尖沙咀星光行地下連地庫。

物業組合整體出租率達100%，將以連租約形式出售，除部分物業由麥當勞獨家承租，亦有舖位同時引入其他零售租戶。

仲量聯行指，賣方是總部設於美國的麥當勞企業，持有該批資產數十年。仲量聯行強調，麥當勞餐廳將在這些物業繼續營運，並無任何計劃變更。"
當局就河北暴雨啟動四級救災應急響應　北京發洪水紅色預警,2025-07-28 11:24,,2025-07-28 12:00,greater_china,rthk,https://news.rthk.hk/rthk/ch/component/k2/1815412-20250728.htm,"國家防災減災救災委員會針對河北省嚴重暴雨洪澇災害影響，啟動國家四級救災應急響應，派出工作組赴災區實地查看災情，指導和協助地方做好受災群眾基本生活保障等災害救助工作。

北京市早上發佈洪水紅色預警，薊運河流域桑園斷面已出現紅色預警級別洪水。 

國家發改革緊急調撥5000萬元人民幣，支持河北做好災後恢復。

山西省大同市天鎮縣有客車行駛中遇險，目前搜救出1名遇難人員、仍有13人失聯。省長盧東亮趕赴現場，指揮部署救援工作。"
國家稅務總局：內地稅收與經濟增長大致匹配,2025-07-28 11:19,,2025-07-28 11:30,greater_china,rthk,https://news.rthk.hk/rthk/ch/component/k2/1815410-20250728.htm,"國家稅務總局局長胡靜林表示，內地稅收收入與國內生產總值（GDP）增速大致匹配，經濟決定稅收，但亦有部分因素造成經濟與稅收不完全同步。

他指，內地近年減稅降費力度較大，拉動經濟增長，有利長期稅收，但會減少當期稅收。GDP增速以不變價計算，稅收收入則以現價計算，過去10年看，工業生產者出廠價格指數（PPI）的增減，會為稅收帶來同幅度增減，尤其近兩年PPI對稅收影響較直接。

胡靜林指出，經濟稅源發生結構性、趨勢性變化，對稅收貢獻較大的房地產等傳統行業增速下降，導致相應稅收增速放緩，甚至減收。新三樣等新興行業發展勢頭好，但稅收總體規模小，而且享受的優惠政策比較多，現階段對稅收增長的拉動作用仍不夠大。

他又指，十四五時期，內地稅收收入規模穩步增長，稅制結構優化，以製造業為主的實體經濟，在稅收上起到壓艙石作用，佔比最大的製造業稅收近年來佔比均保持30%左右。而增速最快的信息軟件技術服務等現代服務業，去年稅收佔比較2020年提高1.6個百分點。另外，直接稅比例逾40%，比十三五提高1個百分點，反映稅收調節分配功能增強。

另外，稅務總局指，2021年至今年上半年，全國累計新增減稅降費9.9萬億元人民幣，預料至今年底將達到10.5萬億元，年增新增減稅降費逾2萬億元。中小微企業共享有減稅降費6.3萬億元，佔比達64%。當局又指，民營經濟穩步壯大，民營經濟銷售收入佔全國比重由2020年的68.9%，提高至今年上半年的71.7%。"
'Crab allergen study augurs better advice to patients',2025-07-28 11:06,,2025-07-28 11:30,elocal,rthk,https://news.rthk.hk/rthk/en/component/k2/1815405-20250728.htm,"Researchers from Chinese University have identified eight previously-unknown allergens in some commonly-consumed species of crab, in a breakthrough that will enable doctors to give more specific advice to people who suffer from shellfish allergies.

The team isolated 11 types of proteins from six crab species, which were found to trigger allergies in blood samples from a group of more than 60 patients.

Three of the isolated proteins were previously known to be allergens, while eight were new discoveries, said Professor Leung Ting-fan from CUHK's Faculty of Medicine.

""Why is [the research] important? Because shellfish commonly cause severe allergic reactions, including anaphylaxis,"" he said.

""Shellfish allergies actually rank the top among all the foods that cause severe allergic reactions that [require] the patient to seek emergency care in hospitals.""

He noted that many patients are allergic only to specific types of shellfish, and the new research will allow doctors to give more tailored advice to patients.

""By understanding the specific pattern, we can appropriately advise them to avoid specific types of crab or seafood. This allows us to tailor make our advice and management for patients,"" he said.

Leung said researchers were particularly interested in one protein identified in the king crab called malate dehydrogenase (MDH), which caused allergic responses in blood samples.

""Of course, other crabs have this MDH, but the MDH in those crabs do not trigger any allergic reaction in the cells of patients, whereas for this king crab, MDH is unique in the sense that patients are really allergic... so we call this a unique kind of crab allergen,"" he said.

Leung added that one factor may be that king crabs aren't ""true crabs"" in a taxonomic sense and are more closely related to hermit crabs."
南韓總統辦公室：南韓將繼續為實現朝鮮半島永久和平努力,2025-07-28 11:06,,2025-07-28 11:15,cinternational,rthk,https://news.rthk.hk/rthk/ch/component/k2/1815409-20250728.htm,"南韓總統辦公室表示，南韓將繼續為實現朝鮮半島永久和平而努力。

總統室表示，注意平壤就李在明政府成立後首次發表的立場，並指出過去幾年不斷的敵對、對抗政策，南北韓之間的互不信任根深蒂固。總統室強調，政府將始終致力於建設不敵對、不生戰的朝鮮半島。

北韓勞動黨中央委員會副部長金與正在朝中社發表談話指，朝方對首爾制定何種政策、提出何種提議均不感興趣，重申今後不會同南韓面對面協商的立場。她指李在明政府的盲目信從韓美同盟、針對朝方搞對抗的風格與歷任領導人如出一轍。

南韓統一部發言人回應，政府不會被朝方的表態干擾，將堅定不移推動兩韓建立和解與合作關係。又指金與正的談話正是朝方密切關注首爾對朝政策的證明，談話內容並無特別敵對或抹黑南韓。"
CK Hutchison seeks mainland partner in ports deal,2025-07-28 11:01,,2025-07-28 11:15,efinance,rthk,https://news.rthk.hk/rthk/en/component/k2/1815400-20250728.htm,"CK Hutchison on Monday said it is seeking a mainland partner to join a consortium bidding for its ports business outside China.

In a filing to the Hong Kong stock exchange, the Hong Kong-based conglomerate noted that the period for exclusive negotiations with the the consortium has expired, but it remains in discussions with members of the group ""with a view to inviting (a) major strategic investor from the mainland to join as a significant member of the consortium.""

""Changes to the membership of the consortium and the structure of the transaction will be needed for the transaction to be capable of being approved by all relevant authorities,"" the firm said.

""The Group intends to allow such time as is required for such discussions to achieve [that].""

CK Hutchison reiterated that it will not proceed with any transaction without the approval of all relevant authorities."
崔定邦倡全運會期間內地旅客簽注可放寬至多次往返香港,2025-07-28 10:51,,2025-07-28 11:15,local,rthk,https://news.rthk.hk/rthk/ch/component/k2/1815406-20250728.htm,"本港今年上半年錄得約2400萬訪港旅客人次，按年增長12%，其中內地旅客增加一成，非內地旅客則增加17%。有立法會議員認為，本港應引入更多年度盛事；旅遊界人士建議，全運會期間放寬內地旅客簽注，方便旅客多次往返內地及港澳觀賽。

新民黨立法會議員何敬康在本台節目《千禧年代》表示，香港最大優勢是海港，應充分利用，過去本港曾舉辦國際帆船比賽，認為可再度引入，吸引高端旅客來港。他又指出，韓國大型頒獎禮MAMA AWARDS今年回歸香港，應爭取每年在港舉行，吸引內地及國際旅客訪港。

另外，政務司司長陳國基早前指出，為方便內地旅客來香港觀賞全運會賽事，正積極爭取內地居民赴港簽注利便措施，讓旅客可跟著賽事去旅遊。

香港旅遊促進會總幹事崔定邦指出，現時內地旅客訪港後再赴澳門，之後就必須向內地走，在同一簽注下，不能回頭再訪港。他希望全運會期間，內地旅客簽注可放寬至多次往返香港，簽注時間亦延長，方便工作人員及購買了全運會賽事門票的旅客，可進出到大灣區城市觀賽。據他所知，旅遊業議會連同酒店業界，與相關政府部門正討論門票安排。"
