title,date,summary,scrape_time,section,source,url,news_content
十五運會｜手球項目參賽隊伍到啟德熟習場地　楊德強籲市民入場,2025-10-30 20:43,,2025-10-30 21:00,local,rthk,https://news.rthk.hk/rthk/ch/component/k2/1829434-20251030.htm,"全運會香港賽區統籌辦公室主任楊德強表示，來港參與全運會手球項目的10支隊伍已經抵港，分批入住酒店，並已分批到舉行比賽的啟德體藝館熟習場地。他表示，各支球隊對場地設施反應相當好。

楊德強表示，手球項目還有兩日就開賽，而賽事的準決賽和決賽門票銷售情況理想，而分組賽仍有門票可供選購。他說香港手球代表隊近年進步快，在內地和國際賽都有好成績，他期望有更多港人入場觀賞賽事。

港隊男子手球代表連潤滔表示，球隊已進入作戰狀態，強調每一場比賽都會盡力去打，爭取勝利，對於能夠在主場作賽，他說更有親切感，至今球隊目標是取得獎牌。"
比亞迪股份上季盈利按年跌近33%,2025-10-30 20:39,,2025-10-30 21:00,cfinance,rthk,https://news.rthk.hk/rthk/ch/component/k2/1829428-20251030.htm,"比亞迪股份公布，上季盈利按年跌近33%至78.2億元人民幣，營業收入跌3%至1949.8億元。

今年首9個月，盈利按年跌近8%至233.3億元，營業收入升近13%至5662.7億元。"
中石油上季盈利按年跌約4%　按季升近14%,2025-10-30 20:39,,2025-10-30 21:00,cfinance,rthk,https://news.rthk.hk/rthk/ch/component/k2/1829427-20251030.htm,"中石油公布，上季盈利422.9億元人民幣，按年跌約4%，按季升近14%。營業收入升逾2%至7191.6億元。

今年首9個月，集團盈利跌約5%至1262.9億元，營業收入跌約4%至2.17萬億元。

期內，集團油氣當量產量約13.8億桶，按年增長近3%。"
鳳德邨6700居民評估34人現輕微病徵　未發現感染基孔肯雅熱,2025-10-30 20:38,,2025-10-30 21:00,local,rthk,https://news.rthk.hk/rthk/ch/component/k2/1829433-20251030.htm,"衞生防護中心表示，早前確診基孔肯雅熱但感染源頭有待確定的55歲女子，病毒基因分析工作仍在進行。截至今日下午5時，沒有錄得新增感染基孔肯雅熱個案。
　　 
首宗本地個案居住的鳳德邨，中心已為約6700名居民評估，當中發現34人出現輕微病徵，需抽血檢查，化驗工作正陸續進行，暫時已完成檢驗的樣本全部對基孔肯雅病毒呈陰性。

中心正繼續聯同政府多個部門和相關機構採取適當防控措施，並建議到訪受基孔肯雅熱影響的地區後出現發燒、關節劇痛及皮疹等病徵的市民盡快求醫。

中心晚上亦舉行第二場網上講座，由醫生講解基孔肯雅熱的最新情況、如何預防受感染等。"
中人壽首9個月盈利升逾60%　總保費規模創同期新高,2025-10-30 20:15,,2025-10-30 20:30,cfinance,rthk,https://news.rthk.hk/rthk/ch/component/k2/1829426-20251030.htm,"中國人壽公布按中國會計準則第3季盈利1268.7億元人民幣，按年升91.5%，營業收入升約55%至2986.6億元。

今年首9個月，盈利按年升60.5%至1678億元，營業收入升近26%至近5379億元。

中人壽首3季總保費升10%至6696億元，規模創歷史同期新高；續期保費按年升10%，增速創2021年以來同期新高。總投資收益增長41%至3685.5億元，總投資收益率6.42%，按年提升104個基點。

截至9月底，公司償付能力持續保持較高水平，核心償付能力充足率達137.5%，綜合償付能力充足率達183.94%。"
卓永興：AI是強化公共治理的重要工具　目標半年後陸續推展項目,2025-10-30 20:06,,2025-10-30 20:30,local,rthk,https://news.rthk.hk/rthk/ch/component/k2/1829432-20251030.htm,"政務司副司長卓永興主持AI效能提升組首次會議，統籌決策局和部門以AI技術賦能提升政府效能及科技革新的工作，並商討工作計劃及時間表。

卓永興表示，AI是當今最具影響力的信息技術之一，是推動新質生產力、智慧城市及高質量發展的要素，亦是強化公共治理的重要工具。他說，提升組會循幾個方向去物色可藉AI提升效能的部門，包括部門的服務範疇與市民接觸面較大、其服務特別受市民關注、改善能令部門的工作效率顯著提升，及有關部門的效能提升能令市民看到明顯的改變。

他又說，提升組會首先重點挑選若干個與民生息息相關的部門，並與相關部門就落實工作計劃制定細節，目標半年後陸續推展相關項目。"
外國政府官員代表團結束訪港行程　進一步認識香港優勢和機遇,2025-10-30 20:01,,2025-10-30 20:30,local,rthk,https://news.rthk.hk/rthk/ch/component/k2/1829431-20251030.htm,"由10位外國政府官員組成的代表團，結束在香港的訪問，其間進一步認識香港在「一國兩制」下的優勢、潛力和機遇。

代表團由國家外交部安排，邀請了亞洲10個國家的外交部官員，包括孟加拉、不丹、文萊、吉爾吉斯、蒙古、緬甸、塔吉克、東帝汶、土庫曼和烏茲別克。
 
在港期間，代表團與政務司司長陳國基、署理財政司司長黃偉綸和署理律政司司長張國鈞會面交流，了解香港在「一國兩制」下內聯外通的獨特優勢，以及「超級聯繫人」和「超級增值人」的角色。
 
代表團亦訪問了深圳，進一步了解粵港澳大灣區的融合發展。"
渣打香港業務首3季稅前基本盈利按年升16%,2025-10-30 19:58,,2025-10-30 20:30,cfinance,rthk,https://news.rthk.hk/rthk/ch/component/k2/1829430-20251030.htm,"渣打第3季稅前基本盈利19.9億美元，以固定匯率計按年升9%，按季跌18%，首3季稅前基本盈利66.65億美元，增長17%。

香港繼續是最大盈利貢獻來源，第3季稅前基本盈利5.3億美元，按年跌近5%，按季跌約28%。信貸減值6900萬美元，按年減少15%，按季減少13%。至於首3季稅前基本盈利按年增加16%，基本經營收入增加24%。

渣打中國上季稅前基本盈利8600萬美元，按年跌近35%，按季跌近47%。信貸減值1400萬美元，按年減少61%，按季減少36%。

渣打其他主要市場上季均錄得盈利，英國業務按年扭虧為盈，轉賺逾2億美元。"
流感活躍程度維持高水平　污水病毒監測將涵蓋季節性流感病毒,2025-10-30 19:49,,2025-10-30 20:00,local,rthk,https://news.rthk.hk/rthk/ch/component/k2/1829429-20251030.htm,"衞生署衞生防護中心表示，本港現時流感活躍度仍維持在較高水平。中心總監徐樂堅稱，按目前流感活躍程度和趨勢分析，預計流感活躍程度未來幾星期仍會維持在較高水平。而今次夏季流感季節可能與下一個冬季流感重疊，導致因流感住院的人數較以往多，呼籲市民盡快接種流感疫苗。

中心最新監測數據顯示，本月19日至25日期間，呼吸道樣本中流感病毒檢測呈陽性百分比為12.01%，與前一周相若，已超越今年初冬季流感季節最高一周。9月開學以來，共有693宗學校爆發個案，16宗兒童流感嚴重個案，當中1人死亡。

中心去年底起開展的先導計劃，確認污水監測有效反映本地季節性流感情況，比目前使用基於診所、醫院等醫療機構的監測指標，更早發現趨勢變化。中心的「全港性污水病毒監測計劃」將涵蓋季節性流感病毒，以提升監測及預警能力。作為傳統流感監測系統的補充指標，中心自本周起，每星期都會發布相關監測數據，給醫護和公眾參考。"
青山禪院工人被電動鏈鋸割傷死亡　勞工處調查並發暫時停工通知書,2025-10-30 19:16,,2025-10-30 19:30,local,rthk,https://news.rthk.hk/rthk/ch/component/k2/1829425-20251030.htm,"屯門青山禪院昨日發生一宗工業意外，一名63歲男工人死亡。勞工處表示高度關注，指意外中男工在修剪樹木時被電動鏈鋸割傷，其後被發現時已證實死亡。對於在意外中有工友身故，處方十分難過，並對其家屬致以深切慰問。

勞工處發言人說，在得知意外發生後，已即時派員到意外現場展開調查，亦已向有關僱主發出「暫時停工通知書」，停止其使用電動鏈鋸進行樹木相關的工作，直至處方信納有關僱主已採取適當的措施消除有關危害，才可復工。

發言人說，處方正全速進行調查，以確定意外成因，查找有關持責者的法律責任，以及提出改善措施。若調查發現有違例事項，定會依法處理。"
外交部：中方冀美方以實際行動維護國際核裁軍與核不擴散體系,2025-10-30 19:11,,2025-10-30 19:30,greater_china,rthk,https://news.rthk.hk/rthk/ch/component/k2/1829423-20251030.htm,"美國總統特朗普表示，基於其他國家的核試驗計劃，已經指示國防部在平等基礎上，即時重啟美國核武器試驗。

在北京，外交部新聞發言人郭嘉昆表示，中方希望美方切實遵守《全面禁止核試驗條約》的義務和暫停核試驗的承諾，以實際行動維護國際核裁軍與核不擴散體系，維護全球戰略平衡與穩定。"
十五運會｜貝俊龍稱金牌屬於整個團隊　冀能取得下屆奧運參賽資格,2025-10-30 19:11,,2025-10-30 19:30,local,rthk,https://news.rthk.hk/rthk/ch/component/k2/1829424-20251030.htm,"為港隊取得十五運會首面金牌的男子帆船代表貝俊龍凱旋返港，中國香港帆船運動總會和香港遊艇會晚上為中國香港帆船隊舉行慶功酒會。

貝俊龍在祝捷會上表示，過往香港帆船隊未在全運會中取得獎牌，對於今次能夠贏得金牌感到很開心，認為是很大成就。他說，這面金牌不止是屬於他個人，而是屬於整個團隊及帆船界。

貝俊龍表示，這面金牌增強了他的信心，亦為今個賽季畫上完美句號。他說，下個目標是明年的亞運會，以及奧運資格賽，期望自己能夠取得下屆奧運的參賽資格。他指，今次全運會的比賽過程充滿挑戰，風和浪都很大，令他意識到日後要加強這方面的訓練。

被問到會如何慶祝，貝俊龍說未有任何打算，但未來將會有兩週假期，11月中之後就會重投訓練。"
立法會選舉｜范鴻齡向醫管局員工發信籲踴躍投票　將提供可行便利,2025-10-30 19:08,,2025-10-30 19:15,local,rthk,https://news.rthk.hk/rthk/ch/component/k2/1829422-20251030.htm,"醫院管理局主席范鴻齡向員工發信表示，12月7日立法會選舉投票日，醫管局作為管理全港公立醫院的法定機構，有義務及責任支持這次選舉，呼籲所有員工履行公民責任，當日踴躍投票，管理層會盡量提供一切可行便利。

范鴻齡說，若員工因輪班時間未能配合投票，鼓勵各部門主管透過彈性及不影響病人服務安排，讓同事前往投票，一盡公民責任。

范鴻齡指出，今次選舉意義重大，醫管局會透過不同平台鼓勵和推動所有員工在選舉日投票，亦會協助不同界別候選人，在公平、公正原則下接觸在公立醫院工作的選民。他又說，投票選出最合適議員與每位醫管局員工有切身關係，本港公共醫療衞生政策以至醫管局的撥款，必須經過立法會仔細審核及通過才可落實，因此必須用好手上重要一票，選出有能力、有抱負、有熱誠及做實事的候選人，成為立法會議員。"
渣打料貸款需求增長有助抵消利率下行挑戰,2025-10-30 18:50,,2025-10-30 19:00,cfinance,rthk,https://news.rthk.hk/rthk/ch/component/k2/1829415-20251030.htm,"渣打集團上調今年業績指引，預期今年收入增長接近5-7%範圍上限，先前指引為接近範圍下限；今年有形股東權益回報約13%，提前一年達標。

行政總裁溫拓思表示，今年作為盈利增長動力的業務表現出色，特別是銀行和金融市場業務，交易銀行業務受利率走勢左右，但整體仍算良好，預期今年打下的基礎和動力可延續至明年，目前提供的業績指引已經算謹慎。

財務總監杜智高認為，近期市場流動性十分充裕，集團可以在存款管理方面更有選擇，對今季淨利息收入表現樂觀。

他說，明年淨利息收入仍可能面對市場利率下行挑戰，但今年以來客戶貸款錄得4%增長，相信貸款需求增長有助抵消影響。"
房委會在白田邨公營房屋重建項目首次應用AI天秤系統,2025-10-30 18:49,,2025-10-30 19:00,local,rthk,https://news.rthk.hk/rthk/ch/component/k2/1829421-20251030.htm,"房委會在白田邨公營房屋重建項目首次應用人工智能天秤系統，天秤操作員可於配備AI天秤系統的地面智能駕駛艙，遙距操控吊運工作，無需每日上落天秤並長時間在高空工作。

有AI天秤操作員說，引入新系統後，可改善工作環境。房屋署表示，應用AI天秤系統令吊運效率提升約3成，可提高建屋效率。"
工行上季盈利按年升逾3%,2025-10-30 18:47,,2025-10-30 19:00,cfinance,rthk,https://news.rthk.hk/rthk/ch/component/k2/1829406-20251030.htm,"中國工商銀行第3季盈利按年升逾3%至1018億元人民幣。利息淨收入跌近2%至1598.4億元，手續費及佣金淨收入升4%至238.5億元。

今年首9個月，工行盈利升0.3%至2699.1億元。利息淨收入跌0.7%至4734.2億元，年化淨利息收益率跌15個基點至1.28厘。非利息收入升逾12%至1375.5億元，其中手續費及佣金淨收入升0.6%至908.7億元。

首3季計提各類資產減值損失1270.9億元，跌約1.7%，其中，貸款減值損失1374.7億元，增長12%。

截至9月底，不良貸款餘額4048.38億元，較去年底增加近7%；不良貸款率1.33%，跌0.01個百分點。撥備覆蓋率217.21%，上升2.30個百分點。"
陳茂波在沙特最後一日行程將出席商務晚宴並發表主題演講,2025-10-30 18:45,,2025-10-30 19:00,local,rthk,https://news.rthk.hk/rthk/ch/component/k2/1829420-20251030.htm,"率團在沙特阿拉伯利雅得訪問的財政司司長陳茂波展開最後一日行程，將會出席商務晚宴，並發表主題演講。

代表團昨日出席未來投資倡議大會活動，並到沙特國家銀行訪問及交流，又考察當地創科機構和城市規劃及保育項目。陳茂波表示，香港正積極促進與沙特之間雙向的投資和資金流動，期望雙方加強合作，拓展更大商機。"
維園年宵市場攤位競投結束　競投總收入約903萬元,2025-10-30 18:44,,2025-10-30 19:00,local,rthk,https://news.rthk.hk/rthk/ch/component/k2/1829419-20251030.htm,"維園明年農曆年宵市場攤位公開競投結束，攤位競投總收入約903萬元。

食環署發言人表示，維園年宵市場共有400個攤位在3日的公開競投中租出，包括170個普通型乾貨攤位、46個大型乾貨攤位、180個濕貨攤位及4個快餐攤位。
　　 
總結競投結果，普通型乾貨攤位的成交價由8540元至6萬元，平均競投價為17847元，最高成交價為6萬元，約為底價8540元的七倍。而大型乾貨攤位的成交價則由12810元至51000元，平均競投價為22561元，最高成交價為51000元，約為底價12810元的四倍。
　　"
中海油上季盈利按年跌12%　油氣銷售收入跌3%,2025-10-30 18:43,,2025-10-30 19:00,cfinance,rthk,https://news.rthk.hk/rthk/ch/component/k2/1829408-20251030.htm,"中海油公布，上季盈利按年跌12%至324.4億元人民幣。

期內，營業收入升近6%至近1049億元，油氣銷售收入跌3%至837.4億元。

今年首9個月，盈利跌近13%至1019.7億元，營業收入跌4%至3125億元，油氣銷售入跌6%至2554.8億元，主要原因是實現油價下降近14%至每桶68.29美元。

期內，公司油氣淨產量達5.78億桶油當量 ，按年升近7%，其中天然氣升幅近12%。

首9個月資本支出約860億元，按年減少約10%，主要原因是在建項目工作量按年降低。"
中方暫停稀土出口管制措施一年　美方取消對華加徵一成芬太尼關稅,2025-10-30 18:43,,2025-10-30 19:00,greater_china,rthk,https://news.rthk.hk/rthk/ch/component/k2/1829418-20251030.htm,"中美元首在南韓釜山會談後，中方公布，美方將取消對中國商品加徵的10%「芬太尼關稅」，對中國商品加徵的24%對等關稅將繼續暫停一年。中方將暫停實施稀土出口管制措施一年。

美國總統特朗普就表示，中國會立即開始購買大量美國大豆，美國對華進口商品徵收的關稅會下調至47%。他將於明年4月訪問中國。"
民航處處長廖志勇訪成都及上海　出席論壇闡述香港航空樞紐優勢,2025-10-30 18:42,,2025-10-30 19:00,local,rthk,https://news.rthk.hk/rthk/ch/component/k2/1829417-20251030.htm,"民航處處長廖志勇到訪成都及上海，其間分別拜訪中國民用航空西南地區管理局局長歐陽霆及華東地區管理局局長張軍平，就共同關注的議題交換意見，並探討提升協作效率及深化合作關係。

廖志勇在成都期間，出席由中國民用航空飛行學院與香港國際航空學院合作開辦的首屆見習飛行員培訓課程啓動儀式，及參觀中飛院天府校區的新校舍。他亦參觀了當地一家專門研發電動垂直起降飛機的企業單位。

廖志勇在上海期間，應邀出席由上海交通大學舉辦的國際民航論壇2025，並發表專題演講，闡述香港如何善用國際航空樞紐的優勢，充分發揮「背靠祖國、聯通世界」的重要角色，以推動民航發展。"
【重溫】2025年10月30日新聞天地,2025-10-30 18:41,,2025-10-30 19:00,local,rthk,https://news.rthk.hk/rthk/ch/component/k2/1829401-20251030.htm,詳盡報道本地時事、大中華消息、國際局勢等新聞，緊貼最新熱話。
假資料申請澳門博彩公司賭博信貸賬戶　3名港人涉詐騙被捕,2025-10-30 18:39,,2025-10-30 18:45,greater_china,rthk,https://news.rthk.hk/rthk/ch/component/k2/1829416-20251030.htm,"澳門司警拘捕4名男女，包括3名港人及1名澳門人，涉嫌偽造銀行記錄，騙取賭場貴賓廳批出賭博信貸賬戶申請，其取走俗稱的「泥碼」。有2間賭博公司報稱合共損失1700多萬港元。4人涉嫌以相當巨額詐騙及偽造文件罪，下午移交檢察院偵訊。

司警表示，接到一間位於路氹城區的賭博公司報案，本月中有一名67歲報稱從事工程公司的香港男子，以公司報表及有4800多萬元的銀行月結單等資料，申請貴賓廳1000萬港元博彩信貸賬戶，並獲批出。他之後多次與其餘3人到賭場提取少量額度的「泥碼」，在賭枱作小額賭博，贏輸1萬至10萬元後離開，並將大額「泥碼」交給其他人帶走。

至本周一，賭博公司要求他們交還未有下注的「泥碼」或以現金結賬，他們只交回148多萬元「泥碼」及曾贏取的10萬港元籌碼，亦無法以現金結賬。經查核後，所提供的銀行賬戶只有幾萬元。博彩公司懷疑受騙報警，報稱損失超過841萬元「泥碼」。

司警經調查發現，相信該名聲稱工程公司商人的男子為集團骨幹成員，本月初起用類似手法，曾經向4間博彩公司申請賭博信貸賬戶。2間未有批出，另一間就批出900萬港元額度「泥碼」。"
李家超於南韓迎接習近平　下午與在南韓港人等代表會面,2025-10-30 18:32,,2025-10-30 19:00,local,rthk,https://news.rthk.hk/rthk/ch/component/k2/1829414-20251030.htm,"到南韓出席亞太經合組織領導人非正式會議的行政長官李家超，於釜山迎接抵埗的國家主席習近平。

李家超下午與在南韓港人和港企代表，於釜山會面和交流，了解他們在當地的生活和發展情況。李家超鼓勵他們發揮自身所長，說好香港故事，為兩地經貿合作與人文交流貢獻力量。

商務及經濟發展局局長丘應樺出席部長級會議時提到，香港一直推動人工智能快速發展，期待與各成員經濟體，分享經驗。"
李家超：繼續強化股票市場　協助內地科技企業來港融資,2025-10-30 18:32,,2025-10-30 18:45,cfinance,rthk,https://news.rthk.hk/rthk/ch/component/k2/1829413-20251030.htm,"行政長官李家超表示，金融是現代經濟的核心，唯有持續創新、主動變革、勇於重塑，才能在變局中開創新局。

李家超在2025金融街論壇閉幕式視像致辭時表示，會繼續強化股票市場。特區政府會通過新設立的「科企專線」，協助內地科技企業來港融資，為國家建設科技強國貢獻金融力量，也會鼓勵及協助在海外上市的中概股回流，讓香港成為它們的首選回歸地。

另外，亦會繼續深化香港與內地金融市場的互聯互通，爭取盡快落實將人民幣交易櫃台納入「港股通」，同時鼓勵更多上市公司增加人民幣股票交易櫃台。

他說，會加強香港作為全球最大離岸人民幣業務中心的優勢，為了強化香港離岸人民幣市場的樞紐功能，會優化目前的人民幣流動資金安排，讓銀行業有更大的空間和彈性，管理短期人民幣流動性。

李家超指，香港一直積極發揮「引進來、走出去」的雙向平台作用，會強化香港的出海平台優勢，攜手更多內地企業創造商機。特區政府已成立內地企業出海專班，匯聚各界專業人士的力量，為內地企業提供全方位支援，讓更多內地企業以香港作為跳板，走向世界。政府會研究優化稅務寬減措施，吸引更多內地企業在香港設立財資中心，同時推動銀行業，尤其是內地銀行在香港設立區域總部，用香港的專業服務，開拓東南亞和中東等新興地區市場。"
"CE greets Xi, meets Hongkongers in South Korea",2025-10-30 18:26,,2025-10-30 18:30,elocal,rthk,https://news.rthk.hk/rthk/en/component/k2/1829411-20251030.htm,"Greeting President Xi Jinping at the airport and meeting Hongkongers in South Korea were on Chief Executive John Lee’s agenda on Thursday, as part of the SAR leader’s trip for the Asia-Pacific Economic Cooperation (Apec) forum in Gyeongju.

Footage from state broadcaster CCTV and the Hong Kong government showed Lee shaking hands and exchanging words with Xi on the tarmac at Gimhae airport in Busan. 

A closely-watched meeting between the Chinese leader and US President Donald Trump was held in Busan.

The chief executive was also in Busan to meet Hong Kong people and business representatives based in South Korea “to learn more about their daily lives and developments” in the afternoon, a government statement said. 

“Mr Lee encouraged them to leverage their strengths to tell the good stories of Hong Kong and contribute to the economic and trade co-operation, as well as people-to-people exchanges, between the two places,” the statement read.

Lee, along with Secretary for Commerce and Economic Development Algernon Yau, was also to join a dinner in Gyeongju with the SAR’s representative to the Apec Business Advisory Council. 

Lee will continue his visit on Friday, attending a series of Apec-related meetings and events."
銀行公會：美息走向存在不確定性　中美元首會面釋放正面訊息,2025-10-30 17:57,,2025-10-30 18:15,local,rthk,https://news.rthk.hk/rthk/ch/component/k2/1829409-20251030.htm,"美國聯儲局一如市場預期減息0.25厘，3家發鈔銀行亦先後下調最優惠利率0.125厘。

銀行公會署理主席陳銘僑表示，聯儲局主席鮑威爾稱仍要觀察數據，市場對12月繼續減息的預期降溫，未來美息走向仍存在不確定性。此外，中美兩國元首今日會面釋放很多正面訊息，並預告稍後時間簽署經貿協議，消除市場一大不明朗因素，認為中美貿易磨擦降溫，有助紓緩通脹壓力，亦有利更寬鬆貨幣政策。

他續指，在聯匯制度下，港息跟隨美息走，也會受本港資金供求影響，但最近銀行體系結餘已跌至約540億元較緊張水平，估計銀行同業拆息（HIBOR)目前只會窄幅上落。他預計，1個月拆息年內將維持在3厘至3.5厘範圍。

他相信，未來港美息差將逐步收窄，有利本港經濟發展。今年以來港股發展蓬勃，日均交投額超過2500億元，投資氣氛明顯改善，認為在種種利好政策下，預料本港今年經濟增長2%至3%，符合政府預測。

陳銘僑說，最優惠利率的調整屬個別銀行商業決定，取決於銀行資金成本、資產負債表組成及業務策略，但在上一次2022年的加息周期，美國累計加息幅度達5.25厘，香港只跟加0.875厘，若美國減息持續，相信最優惠利率未必跟足。他估計，HIBOR將跟隨美息回落，對企業客戶資金成本有幫助。"
