title,date,summary,scrape_time,section,source,url,news_content,link,description
蕭澤頤任期至下月1日稱百感交集　信香港治安將繼續改善,2025-03-29 10:42,,2025-03-29 11:15,local,rthk,https://news.rthk.hk/rthk/ch/component/k2/1797988-20250329.htm,"警務處處長蕭澤頤出席警察學院結業會操，擔任檢閱官。他致辭時表示，作為執法者，要時刻堅守有法必依，違法必究的大原則，執法不偏不倚，秉持公正及中立；要待人以嚴，也要嚴以律己。

今次共有29名見習督察及158名學警結業。蕭澤頤說，不論警員是否穿著制服、是否正在執勤，要時刻謹記「君子慎其獨」。個人行為操守一定要對得住自己，對得住家人，對得住警隊，對得住市民。蕭澤頤強調，專業不僅是「做了份工」，更重要的是「做好份工」。他又說，警員每日遇到很多挑戰，也未必能夠每件事均圓滿達到每一市民的心意，但只要本著真心誠心去做，深信市民一定會感受到。

蕭澤頤的任期至下月1日，蕭澤頤說百感交集，回想36年前加入警隊，做警察對他而言不只是一份工，更加是他的嗜好、興趣，帶給他無限滿足感，時至今日心中團火仍然生生不息。他說，能夠成為警隊一員，和所有人員並肩作戰、甘苦與共，形容此生無憾。他深信香港的治安將會繼續改善，邁向更穩定、更理想的局面，希望警隊不辱使命，不負市民所託，確保香港繼續成為世界上最安全和最穩定的城市。",,
盧寵茂質疑言論指急症室增收費會導致私營醫療加價是否真確或誤導,2025-03-29 10:27,,2025-03-29 10:45,local,rthk,https://news.rthk.hk/rthk/ch/component/k2/1797987-20250329.htm,"醫務衞生局局長盧寵茂在一個電台節目表示，對於有言論指，急症室收費增至400元會導致私營醫療加價，他質疑這個言論是真確抑或誤導引致公眾恐慌。

盧寵茂表示，公立醫院門診每年有200萬診症人次，當中約六成是第四及第五類病人，超過一半在日間到急症室，認為他們有空間可以看私家醫生。他說，如果最終有10%的第四及第五類病人轉看私家醫生，相信這個門診量不會令到私營診所即時生意好而加價。

盧寵茂形容「急症室是門常開」，24小時提供服務，毋須預約，非常方便，第四及第五類病人相對不危急，有部分人更是濫用，包括為取得病假紙，期望透過共付收費，導向市民考慮另一些醫療選擇。

盧寵茂提到，兒童發高燒屬於第三類病人，相信他們的父母不會因為收費增至400元而不帶子女看病，而第三類病人當中，部分需要入院治療，由於急症室人手有限，如果能夠減少第四及第五類病人可以令到第三類病人更快獲得診治。",,
南部戰區南海海域例行巡航　發言人斥菲方拉攏域外國家破壞和平,2025-03-29 10:10,,2025-03-29 10:30,greater_china,rthk,https://news.rthk.hk/rthk/ch/component/k2/1797985-20250329.htm,"解放軍南部戰區新聞發言人田軍里表示，南部戰區昨日在南海海域進行例行巡航。

他說，菲律賓頻繁拉攏域外國家組織所謂「聯合巡航」，鼓噪散播南海非法主張，製造南海不穩定因素，蓄意破壞地區和平穩定。中方正告菲方停止在南海挑起事端、升級緊張局勢，引入外部勢力撐腰註定徒勞無益。戰區部隊持續保持高度戒備，堅決捍衛國家主權安全和南海地區和平穩定。",,
何永賢稱社會認為需調整公屋富戶政策　將資源交更有需要市民,2025-03-29 09:48,,2025-03-29 10:15,local,rthk,https://news.rthk.hk/rthk/ch/component/k2/1797984-20250329.htm,"房屋局局長何永賢表示，「簡樸房」規管制度的最新方案建議，登記期為12個月，寬限期延長至36個月，合共4年，為避免業主因寬限期延長而拖延不處理違規劏房，在「倒數期」6個月內若單位仍然不合規格，就不能與租客簽訂新合約，違法的業主可被罰款30萬、監禁3年，認為有足夠阻嚇性。

何永賢出席一個電台節目時又說，新方案放寬對單位窗戶面向四邊圍封天井的規定，指政府收到意見及視察後，認為部份天井面積大、通風不錯，衛生情況不差，認為不應該一刀切禁止。

另外，房委會收緊公屋富戶政策，額外租金水平調高至2.5倍至4.5倍租金。何永賢表示，現時富戶繳交的租金只佔家庭入息比例7%，社會各界都認為需要調整，將公屋資源交給更有需要的市民，預計新安排明年10月1日起生效。

何永賢又說，現時處於最高一級的富戶約有4000戶，當中有400戶已經住了4年，新計劃之下處於最高級別4年或以上的住戶需要遷出，可以用「綠表」購買居屋。",,
《環看天下》：南韓歷來最嚴重山火　救援隊伍高齡化惹關注,2025-03-29 09:39,,2025-03-29 09:45,cinternational,rthk,https://news.rthk.hk/rthk/ch/component/k2/1797983-20250329.htm,"南韓東南部的山林大火，持續至今一個星期。截至昨日，山火累計範圍據報增至4萬8千公頃，相當於香港面積四成，規模打破了當地紀錄；傷亡人數增至28人，亦是歷來最嚴重。數以萬計居民緊急疏散。

有當地專家認為，災區近日天氣異常乾燥大風、加上樹木品種特别易燃，增加撲救難度。亦有意見關注，參與救火的臨時救援隊伍嚴重高齡化，加上裝備有限，阻礙救火進度。",,
盧寵茂：醫療改革非加價彌補財赤　強調政府承擔無減少,2025-03-29 09:12,,2025-03-29 09:30,local,rthk,https://news.rthk.hk/rthk/ch/component/k2/1797982-20250329.htm,"醫務衞生局局長盧寵茂在本台節目《星期六問責》表示，醫療改革不是加價彌補財赤，強調政府的承擔沒有減少，期望透過輕症的病人共付費用，以達致增加保障、減少浪費。

被問到日後每兩年檢討是否意味會繼續加價，他指出，改革肯定會持續，不是一時三分，形容「改革永遠在路上」，現時的目標是爭取5年後資助率減至90%，至於將來如何做，會視乎市民的負擔程度，每走一步都是循序漸進，會通過解說和實踐，令市民認同推進改革。

盧寵茂表示，急症室收費增至400元是要發揮導向作用，期望輕症病人會減少使用急症服務。他說，不同意外界指「收錢就是道德唔正確」，重申第一及第二類危重病人毋須收費是要反映急症室的功能。他提到，目前第三類病人有約三成需要入院，第四類病人只有不足一成需要住院。

對於有意見說，半夜找不到醫生，盧寵茂指出，第四及第五類病人當中超過一半是在早上8時至下午4時到急症室求診，這段時間肯定有其他醫療選擇。他表示，第三類病人佔所有病人的約四成，服務承諾是30分鐘內可以為他們診症，但目前只有77%達到服務指標，如果能夠減到第四及第五類病人，有望令第三類病人能更快看症。",,
何永賢：簡約公屋居民儲蓄數年或可能足夠支付購買居屋首期,2025-03-29 08:56,,2025-03-29 09:15,local,rthk,https://news.rthk.hk/rthk/ch/component/k2/1797981-20250329.htm,"位於元朗攸壆路的首個簡約公屋項目昨日起陸續入伙，房屋局局長何永賢表示，預計每日有50至100戶居民入伙，到5月底全部2100個單位會全部入伙。

何永賢出席一個電台節目時表示，現時公屋平均輪候時間為5.3年，簡約公屋可以讓市民輪候公屋期間，有幾年時間安心籌劃未來的住屋階梯。她舉例，一個330呎的簡約公屋單位月租1600元，比租住劏房每月可節省幾千元，一年就數萬元，儲蓄幾年後甚至可能足夠支付購買居屋的首期，日後位於北部都會區的居屋，價錢可能較便宜。

何永賢又提到，攸壆路簡約公屋有不少巴士和小巴服務，方便居民出入，營運機構推出居民家電交換、技能互助等計劃，附近亦有中學組織學生幫居民製作窗簾，認為這個社區非常人情味。",,
曾國衞：將藉下月全民國家安全教育日大力推廣國安知識,2025-03-29 08:42,,2025-03-29 09:00,local,rthk,https://news.rthk.hk/rthk/ch/component/k2/1797980-20250329.htm,"下月15日是「全民國家安全教育日」，政制及內地事務局局長曾國衞表示，局方將協調統籌各相關部門，藉此機會大力推廣國家安全知識，從學校、社區、公務員、商界及國際等層面做好宣傳工作，形容力求無死角，全方位達至「無處不愛國」。

曾國衞接受報章專訪時說，憲法和基本法推廣督導委員會下的愛國主義教育工作小組去年成立後，從不同層面加強國家歷史文化和國情教育，廣泛弘揚愛國主義精神。他說，工作小組成立以來，成果非常豐碩，有效提升社會各界的愛國主義意識。

曾國衞說，工作小組未來會按照香港實際情況，因地制宜採取各項短、中、長期愛國主義教育政策和措施。政制及內地事務局作為憲法及基本法推廣督導委員會的秘書處，將持續重視並強化國家安全教育，積極協調、統籌各相關政策局及部門資源，透過多元形式全面推動相關工作。",,
南韓山火部分地區復燃　男子涉掃墓留下火種正被調查,2025-03-29 08:22,,2025-03-29 08:45,cinternational,rthk,https://news.rthk.hk/rthk/ch/component/k2/1797979-20250329.htm,"南韓慶尚北道的山火有死灰復燃跡象，繼安東市之後，義城郡部分地區山火復燃，消防部門派出6架直升機等前往撲救。

山火燃燒百多小時後，昨晚一度受到控制。

另外，一名50多歲男子在山火發生後，主動向林業部門報告，指自己上星期六掃墓時留下火種，接受警方調查。

這宗南韓史上規模最大、損失最嚴重的山火，至今造成28人死亡，幾十人受傷，火場面積超過4萬5千公頃，相當於6萬3千多個標準足球場。",,
緬甸地震災區大量基礎設施遭受破壞　中國派出救援醫療隊救災,2025-03-29 07:50,,2025-03-29 08:00,cinternational,rthk,https://news.rthk.hk/rthk/ch/component/k2/1797978-20250329.htm,"緬甸中部7級以上強烈地震，至少144人死亡，732人受傷，暫時未有中國公民死亡報告，緬甸當局已經請求國際社會提供援助。

在重災區曼德勒省、實皆省、首都內比都等地，大量基礎設施遭受破壞，數百幢房屋損毀和倒塌，救援和醫療物資嚴重缺乏，大批民眾無家可歸，急需帳篷和毛毯等物資，部分醫院暫停接收病人，曼德勒國際機場跑道受損，部分道路無法通行。

中國雲南救援醫療隊共37人攜帶大量緊急搜救設備及救援物資，早上從昆明長水國際機場乘坐包機趕赴震區。外交部說，中方願意盡己所能向災區提供緊急人道主義救援和支持，幫助緬甸人民抗震救災、度過難關。",,
美元指數曾失守104　美國10年期債息創1星期新低,2025-03-29 07:25,,2025-03-29 07:45,cfinance,rthk,https://news.rthk.hk/rthk/ch/component/k2/1797973-20250329.htm,"憂慮經濟增長前景，美股、美元、美債孳息率都跌，資金流入日圓等避險資產。

美元指數一度跌穿104水平，低見103.89，是今個星期低位，跌逾0.3%，尾市報104.01。

美元兌日圓回落至150以下，較早時徘徊149.8附近，跌0.8%。英鎊兌美元報1.2938，歐元兌美元報1.0827。

商品貨幣受壓，新西蘭元兌美元徘徊0.571，跌約0.5%。

美國10年期債息低見4.247厘，是1星期低位，跌12.2個基點，尾市徘徊4.253厘。30年期債息低見4.627厘，跌10.2個基點。

兩年期債息創逾半個月新低，日內低位3.904厘，跌9.4個基點，尾市處於3.91厘以上。",,
港股美國預託證券普遍偏軟　長和跌約4%,2025-03-29 07:24,,2025-03-29 07:45,cfinance,rthk,https://news.rthk.hk/rthk/ch/component/k2/1797970-20250329.htm,"港股美國預託證券(ADR)普遍偏軟。

長和ADR比本港昨日收市價跌約4%，以港元計折合報43.4元。

阿里巴巴、京東集團、小米ADR跌近2%，美團、港交所ADR跌1%。

滙控ADR則升約0.5%，折合報89.9元。工行ADR亦升0.3%，折合報5.5元。",,
積金局就強積金「全自由行」諮詢公眾1個月,2025-03-29 07:23,,2025-03-29 07:45,local,rthk,https://news.rthk.hk/rthk/ch/component/k2/1797977-20250329.htm,"積金局就強積金「全自由行」展開為期1個月的公眾諮詢，公眾可於4月28日前提交回應。

積金局提出的兩個建議方案，在今年5月1日或之後入職的新聘僱員，可選擇每年1次，將現職的「僱主強制性供款強積金權益」，由僱主參與的供款帳戶，全數轉移至僱員自選計劃下的個人帳戶，方案與現時「半自由行」設計相同。

由於今年5月1日實施取消強積金「對沖」安排，考慮到5月1日前入職的現有僱員，「僱主強制性供款強積金權益」仍有機會用作「對沖」遣散費或長期服務金，積金局建議新設專項帳戶，讓現有僱員可選擇每年1次，將現職的「僱主強制性供款強積金權益」全數轉移至僱員自選的強積金計劃下的專項帳戶。

積金局表示，兩個方案分別涉及不同程度的法例修訂及系統配套工作，當中，適用於現有僱員的方案可能需要較長的籌備時間；當局亦會考慮分階段實施「全自由行」方案。

行政總監鄭恩賜表示，建議的「全自由行」落實後，計劃成員的強積金已歸屬權益中，可自由調動比例將由現時的逾70%，提升至近100%，加強僱員管理強積金的自主度，有助激活強積金市場競爭，從而推動受託人減費及提升表現等。",,
"Wall Street tumbles over economy, inflation fears",2025-03-29 07:06,,2025-03-29 07:15,efinance,rthk,https://news.rthk.hk/rthk/en/component/k2/1797974-20250329.htm,"Stock markets plunged Friday as a closely watched US inflation reading heated up amid intensifying concerns over fallout from US President Donald Trump's incoming wave of tariffs.

Shares in automakers fell further as they brace for 25 percent US tariffs due to kick in next week along with a raft of ""reciprocal"" surcharges tailored to different countries.

The market mood has soured over fears that Trump's plans will trigger tit-for-tat measures that would rekindle inflation, which could put the brakes on interest rate cuts and spark a recession.

""Investors remain nervous over the economic repercussions from President Trump's tariff threats, just days before he unleashes his 'reciprocal tariffs'"" on April 2, said David Morrison, senior market analyst at financial services provider Trade Nation.

In Europe, London just about held the line, closing barely off in the week's final session. But Paris, Frankfurt and Milan all slid around one percent.

On Wall Street, all three major indexes closed sharply lower, with the Dow tumbling 1.7 percent, the S&P 500 losing 2.0 percent and Nasdaq diving 2.7 percent.

The slide came after official data showed the Federal Reserve's preferred inflation measure, the personal consumption expenditures (PCE) price index, remained unchanged last month at 2.5 percent.

But another key figure, core inflation, which strips out volatile food and energy costs, rose more than expected at 2.8 percent in February on an annual basis, up from the month before.

In Europe, automakers Volkswagen, Renault and Stellantis, whose brands include Jeep, Peugeot and Fiat, fared particularly badly. Shares in General Motors and Ford also slumped on Wall Street. (AFP)",,
巴西足總宣布解僱國家隊教練杜利華,2025-03-29 06:58,,2025-03-29 07:15,csport,rthk,https://news.rthk.hk/rthk/ch/component/k2/1797972-20250329.htm,"巴西足總宣布解僱國家隊教練杜利華。

巴西隊日前在世界盃南美洲區外圍賽，被提早取得明年決賽周入場券的阿根廷大炒4:1。

巴西足總在一份簡短聲明中說，祝福杜利華在未來的職業生涯中取得成功。董事會將尋找國家隊主帥人選。

巴西輸波後在小組排第4，但出線機會仍高。

62歲的杜利華去年1月執教巴西國家隊，首場領軍同英格蘭踢友誼賽，少勝對手1:0。之後16場賽場取得7勝6和3負。",,
祖高域晉身邁亞密網賽男單決賽,2025-03-29 06:57,,2025-03-29 07:15,csport,rthk,https://news.rthk.hk/rthk/ch/component/k2/1797971-20250329.htm,"邁亞密網球公開賽，37歲的祖高域晉身男單決賽，只差一步就能拿下職業生涯第100個ATP錦標。

現時世界排名第5的祖高域，在四強輕鬆以6:2和6:3淘汰保加利亞的迪米卓夫。

祖高域在第一個發球局就被迪米卓夫打破，但這位「前一哥」立即打破對手發球局扳平，之後更連贏5局，以6:2先拔頭籌。

到第二盤祖高域乘勝追擊，以6:3取勝，淘汰迪米卓夫晉級。這位6屆冠軍全場只有5次無壓力犯錯，對手就有32次。

祖高域賽後表示，不失一盤進入決賽的感覺太好。

祖高域以37歲10個月，成為ATP1000分賽事，年齡最大的決賽球手。",,
Police arrest three more in Yuen Long murder case,2025-03-29 06:56,,2025-03-29 07:15,elocal,rthk,https://news.rthk.hk/rthk/en/component/k2/1797963-20250329.htm,"Police have arrested three more suspects linked to a January 22 murder and wounding case in Yuen Long. 

A 20-year-old and a 42-year-old were charged with murder and wounding with intent, while a 23-year-old faces charges in suspicion of assisting offenders.

The case, in which a 24-year-old man was killed and a 28-year-old injured, will be heard at Tuen Mun Magistrates’ Court on March 29.

Earlier, police arrested 13 people, aged 18 - 31, for offences including suspicion of murder, wounding, assisting offenders, and drug trafficking. 

Seven men have been charged, while four men and two women were released on bail, required to report back in late April.",,
金價再創新高　紐約期金升穿3100美元,2025-03-29 06:15,,2025-03-29 06:30,cfinance,rthk,https://news.rthk.hk/rthk/ch/component/k2/1797968-20250329.htm,"金價再創新高，美國關稅措施引發全球貿易戰擔憂，資金流向黃金避險。

現貨金高見每盎司3086.7美元，升幅1%，較早時徘徊3084美元附近。全星期計，連升4星期。

紐約期金升穿3100美元關口，高見3124.4美元，收報3114.3美元，升23.4美元，升幅約0.8%；本周累計升3.1%。",,
油價低收　全周累計連升3星期,2025-03-29 06:15,,2025-03-29 06:30,cfinance,rthk,https://news.rthk.hk/rthk/ch/component/k2/1797967-20250329.htm,"國際油價轉跌，由於憂慮美國關稅措施引發全球經濟衰退，但美國加大對委內瑞拉及伊朗施壓，以致油價全周累計連升3星期。

倫敦布蘭特期油收報每桶73.63美元，跌40美仙，跌幅0.5%；本周累計升約2%。

紐約期油收報69.36美元，跌56美仙，跌幅0.8%；本周升1.6%。",,
歐洲股市普遍低收近1%　英股全日跌7點,2025-03-29 06:14,,2025-03-29 06:30,cfinance,rthk,https://news.rthk.hk/rthk/ch/component/k2/1797966-20250329.htm,"歐洲股市低收，德國、法國、意大利、西班牙股市都跌近1%。

德法股市同樣連跌3日，德國DAX指數收報22461點，跌217點，跌0.96%，創近3星期新低。

法國CAC指數收報7916點，跌74點，跌幅0.93%，創近兩個月收市低位。

英國富時100指數表現反覆，收報8658點，跌7點，跌幅0.08%，連跌兩日。

全星期累計，英股升逾0.1%，連升兩星期；法股本周轉跌約1.6%；德股亦跌約1.9%，連續3星期向下。",,
美股低收近2%或以上　數據加劇通脹升溫及經濟疲弱擔憂,2025-03-29 05:57,,2025-03-29 06:15,cfinance,rthk,https://news.rthk.hk/rthk/ch/component/k2/1797965-20250329.htm,"美股連續3日低收，3大指數跌至近兩星期或以上的低位。

美國上月消費者開支增長不及預期，核心個人消費開支(PCE)物價指數則按月升0.4%，創13個月新高，消費者對未來1年通脹預期升至近兩年半新高。數據加劇市場對通脹升溫及經濟疲弱的擔憂，拖累大市向下，科技股沽壓大。

道瓊斯指數最多跌約770點，收市跌幅收窄至715點，收報41583點，全日跌幅約1.7%。

標普500指數跌穿5600點水平，收報5580點，跌112點，跌幅約2%。

納斯達克指數收報17322點，跌481點，跌幅2.7%。

科技及汽車股受壓，美股七雄跌近2%至近5%，通用汽車及福特跌逾1%至近2%。

另外，Lululemon急瀉逾14%，公司下調全年表現預測，受到關稅不確定影響。貿易戰擔憂，推高金價，帶動黃金相關股份表現。

總結全星期，道指累計跌約1%，標普500指數跌1.5%，納指跌2.6%，全部都扭轉前星期升勢。",,
緬甸及泰國當局徹夜於地震災區尋找倖存者,2025-03-29 05:32,,2025-03-29 06:00,cinternational,rthk,https://news.rthk.hk/rthk/ch/component/k2/1797964-20250329.htm,"緬甸中部大地震後，緬甸及有強烈震感的泰國，徹夜在災區尋找倖存者。

在緬甸第二大城市、曼德勒省省會曼德勒，有救援隊伍成員說正徒手挖掘，希望救出生還者。緬甸領導人敏昂萊較早時說，當地最少144人死亡，傷者數以百計，鄭重邀請所有國家、組織及民眾，只要願意幫助受災群眾，緬方都真誠歡迎。

至於在泰國，當局在一座倒塌的在建樓宇現場，出動無人機、犬隻及挖掘機器搜尋生命跡象。事故最少造成6人死亡，過百名建築工人仍下落未明。",,
萬斯指對格陵蘭島人民來說丹麥辦事不力　美國需介入,2025-03-29 04:14,,2025-03-29 04:30,cinternational,rthk,https://news.rthk.hk/rthk/ch/component/k2/1797962-20250329.htm,"美國副總統萬斯抵達丹麥自治領地格陵蘭島，探訪美軍基地駐軍。他發表演說時表示，美國毋須動用軍事力量擴大在格陵蘭島的存在，因為當地人會選擇與美國同一陣營，而不是丹麥。他指對格陵蘭島人民來說，丹麥辦事不力，美國需要介入，又指俄羅斯與中國正擴大在區內的足印，形容世界對此不能視而不見，將頭埋在白雪中。

在北京，外交部發言人上月回應有關格陵蘭島的提問時表示，就美方涉及格陵蘭島的言論，中國一貫主張按照聯合國憲章處理國與國之間關係，強調在北極事務方面，中國是重要利益攸關方，一貫本著尊重、合作、共贏、可持續的基本原則參與，與各方維護北極和平穩定與可持續發展。俄羅斯總統普京日前出席論壇時就說俄羅斯從未威脅北極地區任何國家，正密切關注北極地區局勢，不允許任何侵犯俄羅斯主權的行為。",,
卡尼與特朗普通話　揚言美方額外貿易行動後加方會實施報復式關稅,2025-03-29 03:16,,2025-03-29 03:30,cinternational,rthk,https://news.rthk.hk/rthk/ch/component/k2/1797961-20250329.htm,"加拿大總理卡尼與美國總統特朗普通話，討論兩國關係及關稅等問題。

卡尼辦公室發表聲明說，卡尼告知特朗普，美方下月2日採取額外貿易行動後，加拿大政府將實施報復式關稅，以保護加拿大工人及經濟。聲明又說，兩國領導人就兩國關係進行非常有建設性的對話，雙方同意在加拿大聯邦眾議院選舉後，立即開始就新的經濟及安全關係，進行全面談判。

較早時，特朗普在社交媒體上形容這次通話的成果極為豐碩，他與卡尼在很多問題上達成共識，兩人將在加拿大選舉後立即會面，共同推動政治、商業及其他各方面合作，有關工作最終對美國及加拿大都有好處。

卡尼是在過去的星期日宣布解散議會，並將於4月28日提前舉行第45屆聯邦眾議院選舉。",,
雲南瑞麗多處房屋受損涉1700人　德宏州停電區域已全恢復供電,2025-03-29 02:23,,2025-03-29 02:45,greater_china,rthk,https://news.rthk.hk/rthk/ch/component/k2/1797960-20250329.htm,"緬甸大地震導致位於中緬邊境的雲南省瑞麗市內多處房屋受損，截至昨晚7時，已發現有450多戶受損，涉及超過1700人。

瑞麗市距離震央約300公里，是雲南省內震感最強烈的地區。新華社報道，在瑞麗景成醫院急診症室，兩名傷者在病床上休養，均無生命危險。

地震發生後，雲南省德宏州當局快速開展抗震救災工作，及時疏散風險地區人員，瑞麗對全市範圍內的醫院、學校、水庫等重點區域，進行風險評估。經搶修後，德宏州內因地震停電的區域，已全部恢復供電，瑞麗市有序進行應急救援、災情排查、群眾安置等工作。",,
