title,date,summary,scrape_time,section,source,url,news_content
醫衞局收到醫委會關於完善投訴處理機制報告　盧寵茂稱局方正審視,2025-12-24 16:56,,2025-12-24 17:30,local,rthk,https://news.rthk.hk/rthk/ch/component/k2/1837385-20251224.htm,"醫務衞生局收到醫委會關於完善投訴處理機制的報告。局長盧寵茂說，醫衞局正詳細審視醫委會的報告，並會就報告內容要求醫委會進一步澄清及提供資料，包括醫委會監察各初步偵訊委員會和研訊小組處理投訴個案進度的機制，以及初偵會和研訊小組各自在監督個案進度的角色。

盧寵茂表示，如醫委會就秘書所提供行政支援的工作表現提出意見，衞生署亦會按醫委會的報告內容進行調查，包括是否需要就個別員工展開紀律程序。政府會適時公布下一階段工作。

醫衞局會因應報告的建議及醫委會的運作需要而提出修訂《醫生註冊條例》，目標在明年上半年向立法會提交條例草案。醫衞局將於下月就修訂條例及強化醫委會投訴處理機制開展業界和持份者諮詢工作，與專業團體和病人組織等持份者會面，聆聽意見。"
分析料年結因素過後資金回籠　但港元拆息回落幅度或有限,2025-12-24 16:40,,2025-12-24 17:30,cfinance,rthk,https://news.rthk.hk/rthk/ch/component/k2/1837383-20251224.htm,"港元拆息普遍上升，樓按相關的1個月拆息報3.289厘，升逾18點子，結束4日跌勢，創7個星期新高；隔夜拆息重上4厘，升至近4.024厘，急升逾107點子，創近3個月最高；反映銀行資金成本的3個月拆息升至近3.095厘，升逾6點子。

渣打香港投資策略主管陳正犖表示，拆息上升，主要與臨近年結資金需求緊張有關，推高港元兌美元匯價。他預計，明年初資金回籠後，金融體系資金相對充裕，拆息亦會回落，但下降幅度可能有限。

陳正犖預期，聯儲局明年仍有3次共75點子減息空間，聯邦基金利率目標區間將由目前的3.5厘至3.75厘，降至約3厘水平。隨著港美息差逐漸收窄，套息交易將會減少，港元拆息及匯率亦將趨向穩定，估計1個月拆息將於2厘至3厘水平徘徊。

聯儲局現任主席鮑威爾的任期將於明年5月屆滿，美國總統特朗普早前預計，很快會就繼任人選作出決定。陳正犖指，如果下任主席人選立場偏鴿派，將進一步鞏固市場減息預期，但假若未來減息決定建基於政治因素，而非經濟因素，可能導致債券收益率等市場利率不跌反升，影響港元拆息明年較波動。"
西九文化區料大批巿民前往　今起一連三日根據需要實施人潮管理,2025-12-24 16:33,,2025-12-24 17:30,local,rthk,https://news.rthk.hk/rthk/ch/component/k2/1837382-20251224.htm,"西九文化區管理局預計，平安夜及聖誕節假期將有大批市民前往西九文化區，今日起一連三日，即直至本月26日會根據需要實施人潮管理措施，建議公眾盡量乘搭公共交通工具，避免駕車前往西九，並呼籲訪客屆時互相忍讓。

西九聖誕市集由今日至後日下午2時至晚上11時開放；西九聖誕森林則由中午12時開放至凌晨1時。西九附近道路，包括博物館道過去數天均非常繁忙。警方或會因應實際交通情況於博物館道實施臨時交通管制措施。行經西九的小巴及巴士路線會因應情況加強服務。

至於連接西九碼頭和中環9號碼頭的「西九渡輪」服務，今晚至本月30日將加強服務及延長服務時間。尾班船會在晚上11時，由西九碼頭開出。而31日除夕當晚「西九渡輪」服務將延至晚上11時30分，元旦凌晨將加開特別班次疏導參與倒數活動的訪客。"
本港二手樓價按周跌1%　代理料明年首季樓價有望再升逾2%,2025-12-24 16:26,,2025-12-24 16:45,cfinance,rthk,https://news.rthk.hk/rthk/ch/component/k2/1837380-20251224.htm,"反映本港二手樓價走勢的中原城市領先指數(CCL)最新報143.56點，按周跌1%，結束連續2星期升勢，是11月底大埔火災後首周市況。今年樓價暫時累計升4.3%。

各項指數都下跌，大型屋苑及中小型單位樓價按周都跌近1%，結束2周連升。大型單位跌1.07%，結束3周連升。

分區樓價普遍向下，港島按周跌3.65%，跌幅是今年3月初以來最大，九龍及新界西亦跌超過0.3%；但新界東升0.48%，連升6周共3.78%。

中原地產表示，隨著樓價上升，業主反價，買家需時適應，加上聖誕將至，二手市況開始拉鋸，不過樓市氣氛仍維持向好，短期上升方向未變，明年首季樓價有望較現時再升2.4%。"
當局就虛擬資產交易及託管服務提供者發牌制度發表諮詢總結,2025-12-24 16:24,,2025-12-24 16:45,cfinance,rthk,https://news.rthk.hk/rthk/ch/component/k2/1837377-20251224.htm,"財經事務及庫務局與證監會，就設立虛擬資產交易及託管服務提供者發牌制度的立法建議發表諮詢總結。為期2個月的公眾諮詢合計收到194份意見書，大部分回應都明確表示，支持在虛擬資產交易平台發牌制度擴展監管範圍，認為是促進香港數字資產生態圈穩健及可持續發展的關鍵一步。回應者亦普遍支持擬議的監管要求及實施安排的整體方向，並提出優化建議及尋求釐清。

此外，財庫局及證監會因應諮詢所得的意見，今日同時就另外設立就虛擬資產提供意見的服務提供者，以及虛擬資產管理服務提供者的發牌制度，展開進一步公眾諮詢，為期一個月。

當局原先建議將相關虛擬資產活動納入虛擬資產交易服務提供者的發牌制度之下，經修訂的監管方案，改為以傳統證券市場上同類服務的監管制度為藍本，為市場參與者釐清不同虛擬資產發牌制度下受監管活動的涵蓋範圍。

財庫局局長許正宇表示，為虛擬資產交易和託管服務提供者建立發牌制度，是完善數字資產法律框架的重要一步，在促進巿場發展、管理風險及保障投資者之間，穩慎地取得平衡，有助實現構建值得信賴及可持續數字資產生態圈的願景，打造香港為數字資產創新的全球中心。

證監會行政總裁梁鳳儀表示，本港在建立虛擬資產監管框架方面，取得重大進展，透過構建可信、具競爭力及可持續的生態圈，確保香港在數字資產市場發展中，繼續處於全球領先地位。"
有粵車南下車主停泊天星碼頭停車場轉乘水上的士到西九感便利,2025-12-24 16:19,,2025-12-24 17:30,local,rthk,https://news.rthk.hk/rthk/ch/component/k2/1837379-20251224.htm,"「粵車南下」入境市區昨日起實施，首日預定出行的車輛接近滿100個名額。有粵車停泊在中環天星碼頭的停車場，停車場有自動識別車牌系統，收費可用不同電子支付方式，包括支付寶、微信，八達通、信用卡等。車主表示，指引及流程暢順，效率很好，便利南下商務或探親等。

他又說，對行程感到開心，感受到粵車南下及轉乘的便利，在停車場泊車後，乘水上的士到西九文化區，認為非常便利，西九的規劃及設施非常好，現場有聖誕樹佈置，老少皆宜，晚上會到不同的地方消費，為家人購買聖誕禮物，而所住的酒店有國標的電動車充電設施，相信日後會多來港消費、商務及旅遊。"
有粵車南下車主停泊天星碼頭停車場轉乘水上的士到西九感便利　,2025-12-24 16:19,,2025-12-24 16:30,local,rthk,https://news.rthk.hk/rthk/ch/component/k2/1837379-20251224.htm,"「粵車南下」入境市區昨日起實施，首日預定出行的車輛接近滿100個名額。有粵車停泊在中環天星碼頭的停車場，停車場有自動識別車牌系統，收費可用不同電子支付方式，包括支付寶、微信，八達通、信用卡等。車主表示，指引及流程暢順，效率很好，便利南下商務或探親等。

他又說，對行程感到開心，感受到粵車南下及轉乘的便利，在停車場泊車後，乘水上的士到西九文化區，認為非常便利，西九的規劃及設施非常好，現場有聖誕樹佈置，老少皆宜，晚上會到不同的地方消費，為家人購買聖誕禮物，而所住的酒店有國標的電動車充電設施，相信日後會多來港消費、商務及旅遊。"
中方堅決反對美方對中國半導體產業徵關稅　指擾亂全球產供鏈穩定,2025-12-24 16:19,,2025-12-24 16:30,greater_china,rthk,https://news.rthk.hk/rthk/ch/component/k2/1837378-20251224.htm,"在北京，外交部針對美國計劃於自2027年起，對中國半導體產業徵收關稅，指出中方堅決反對美方濫施關稅，無理打壓中國產業。

發言人林劍在例行記者會上表示，美方的做法擾亂全球產供鏈穩定，阻礙各國半導體產業發展，損人害己。

他又說，中方敦促美方盡快糾正錯誤做法，以兩國元首達成的重要共識為引領，在平等、尊重、互惠的基礎上，透過對話解決各自關切，妥善管控分歧，維護中美關係穩定健康可持續發展。如果美方一意孤行，中方必將堅決採取相應措施，維護自身正當權益。"
HK stocks go into Christmas break with slight gains,2025-12-24 16:18,,2025-12-24 16:30,efinance,rthk,https://news.rthk.hk/rthk/en/component/k2/1837376-20251224.htm,"Asian markets went into the Christmas break on Wednesday with mostly light gains as investors struggled to track a record day on Wall Street fuelled by forecast-topping US economic data.

In Hong Kong, the benchmark Hang Seng Index was 44 points, or 0.17 percent, up at 25,818 while the Hang Seng Tech Index was up 10 points, or 0.19 percent, at 5,499. The China Enterprises Index crept up just over one point, or 0.01 percent, to 8,915.

The benchmark Shanghai Composite Index ended close to 21 points, or 0.53 percent, higher at 3,940 while the Shenzhen Component Index was 117 points, or 0.88 percent, up at 13,486. The ChiNext Index, tracking China's Nasdaq-style board of growth enterprises, put on 24 points, or 0.77 percent, to hit 3,229.

Trading in Asia was thin, with many global markets due to be closed Thursday for Christmas. US markets will end early on Christmas Eve and stay closed for Christmas.

Tokyo’s Nikkei 225 fell 68 points, or 0.1 percent, to 50,344 while South Korea's Kospi slipped nine points, or 0.21 percent to 4,108. (AP/Xinhua)"
牌照處突擊巡查48處所　6處所涉無牌經營酒店或賓館,2025-12-24 15:46,,2025-12-24 16:15,local,rthk,https://news.rthk.hk/rthk/ch/component/k2/1837374-20251224.htm,"民政事務總署轄下牌照事務處，上星期一起一連五日，在油尖旺區、灣仔區及中西區，突擊巡查懷疑無牌經營的酒店或賓館，以及嚴厲打擊違規經營的持牌會社。

牌照處發言人表示，行動中突擊巡查48個處所，當中有6個處所涉嫌無牌經營酒店或賓館，及兩間持牌會社涉嫌違反發牌條件。如在完成調查後有足夠證據，牌照處會作出檢控。"
韓國總統辦公室下周一正式重返青瓦臺　將懸掛鳳凰旗,2025-12-24 15:43,,2025-12-24 16:00,cinternational,rthk,https://news.rthk.hk/rthk/ch/component/k2/1837373-20251224.htm,"韓國總統辦公室發言人表示，懸掛在首爾龍山總統府的「鳳凰旗」將於下周一零時降下，同一時刻位於首爾鐘路區的青瓦臺將懸掛「鳳凰旗」，總統室名稱亦正式改回「青瓦臺」。

「鳳凰旗」是韓國國家元首象徵，在青瓦臺升起可被解讀為總統府遷回工作基本完成。總統室亦決定將工作標誌，改回青瓦臺時期的版本，並在官網、各種辦公擺設和印刷品及職員名片上，統一使用新標誌。

目前，總統李在明辦公室未遷回青瓦臺，但部分秘書室人員已遷入青瓦臺辦公。記者辦公區及新聞發布廳所在的青瓦臺春秋館，日前已開放運作，國家安保室室長魏聖洛已在該處舉行過公開記者會，介紹近期出訪成果。"
中國駐洛城總領事郭少春稱乒乓外交清晰表達中美人民加強交流願望,2025-12-24 15:39,,2025-12-24 15:45,greater_china,rthk,https://news.rthk.hk/rthk/ch/component/k2/1837372-20251224.htm,"紀念中美「乒乓外交」54周年、中美建交46周年論壇暨晚宴，當地過去的星期一在美國加州洛杉磯舉行，兩國體育界、政界和商界等數百人參加活動。

中國駐洛杉磯總領事郭少春在致辭中強調，「乒乓外交」對中美關係的重要意義，不單止是歷史中的標誌性時刻，而且已變成一盞明燈，繼續照亮中美友誼之路，清晰有力地表達了兩國人民加強交流與理解的願望和熱情。
　　
美國聯邦眾議員趙美心、加州參議員杜拉佐及國際乒聯主席索林等嘉賓，致辭時不約而同地回顧「乒乓外交」的獨特歷史意義，都強調「乒乓外交」精神的影響遠超體育範疇，不單止仍在不斷塑造中美雙邊關係，同時激勵民眾創造一個更和諧的世界。"
馮忠華接替郭永航任廣州市委書記,2025-12-24 15:11,,2025-12-24 15:30,greater_china,rthk,https://news.rthk.hk/rthk/ch/component/k2/1837370-20251224.htm,"中央批准馮忠華任廣州市委書記，免去郭永航的廣東省委常委、廣州市委書記職務，中央另有任用。

現年55歲的馮忠華是遼寧人，早年長期任職中央部門，包括住建部。他曾任十三屆全國人大常委會專職委員，一年多後升任海南省副省長，其後當選為省委常委，並接替徐啟方兼任省委組織部長，去年調任廣東省委常委、組織部長。

至於郭永航是山東人，曾經在深圳、珠海工作，現年60歲。"
政府就營運管理啟德郵輪碼頭租約公開招標　將引入關鍵績效指標,2025-12-24 14:53,,2025-12-24 15:15,local,rthk,https://news.rthk.hk/rthk/ch/component/k2/1837368-20251224.htm,"政府今日就營運和管理啟德郵輪碼頭的租約公開招標，在租約作出兩項主要調整，包括整合現時碼頭範圍的管理安排，以及就碼頭營運商的工作引入關鍵績效指標，提升啟德郵輪碼頭的吸引力和競爭力。

文化體育及旅遊局表示，為改善郵輪碼頭管理及提升營運效率，下一份租約的營運商除負責處理郵輪事務外，將需要負責管理碼頭的公共空間，包括位於二樓的平台花園及天台的啟德郵輪碼頭公園。政府早前已收到14份由商業機構、文創產業和體育組織，以及青年創業者提交如何善用郵輪碼頭空間的意向書，大部分表示有興趣同時租用碼頭附屬商業區以及公共空間。私人機構或非牟利團體可租用碼頭的公共空間舉辦商業及其他活動，藉此推動更多非郵輪和商業活動在郵輪淡季及較少郵輪停泊的日子在郵輪碼頭舉行，以善用郵輪碼頭的空間。

為加強監察碼頭營運商的表現，政府在下一份租約中，會引入4個關鍵績效指標，包括每年郵輪停泊次數、每年非郵輪活動次數、每年非郵輪活動的訪客人數以及附屬商業區的租用率。而考慮到碼頭營運商需時調整和適應碼頭運作，因營運商的表現未能達到指標而須向政府作出補償的條款將於租約第3年起生效。

局方表示，今次招標會採用「雙信封」投標安排。在評審標書時，非價格建議和價格建議的比重分別為70%和30%。非價格建議除有關的關鍵績效指標外，亦包括碼頭營運和管理的執行計劃。標書必須符合招標文件內的條款規定。評審準則已詳細列於招標文件內。

文體旅局發言人表示，《香港旅遊業發展藍圖2.0》中的《郵輪旅遊發展行動計劃》指出，政府的願景是推動香港作為亞洲國際郵輪樞紐。啟德郵輪碼頭的暢順運作對吸引更多郵輪停泊香港及推動郵輪業發展十分重要。政府亦致力提升郵輪碼頭服務大眾的功能，善用碼頭設施。"
Record sharing of eHealth extends to all users,2025-12-24 14:49,,2025-12-24 15:00,elocal,rthk,https://news.rthk.hk/rthk/en/component/k2/1837359-20251224.htm,"The Health Bureau is expanding the availability of the ""Cross-boundary Health Record"" function in Hong Kong's eHealth app to all 6.3 million registered users of the mobile application. 

This service, previously offered only to Elderly Health Care Voucher Scheme recipients, now allows the general public to securely share their electronic health records with designated medical institutions across the border.

In a statement, the bureau said the move is aimed at enhancing the continuity of care for Hong Kong residents, particularly for those seeking medical services within the Greater Bay Area. 

Starting immediately, users can apply via the eHealth app to share their medical records from the past three years before visiting any of the 20 participating medical institutions across the border.

Upon application, users will instantly receive, via the app, an application QR code and a password QR code. 

The bureau said presenting these codes to healthcare professionals at a designated institution grants secure, temporary access that allows its medics to browse health records through a dedicated web browser to help them in diagnostics and treatment.

""The extension of the 'Cross-boundary Health Record' function to all Hong Kong citizens marks a significant milestone in advancing cross-boundary healthcare collaboration,"" said a spokesperson. 

""We will continue to take forward the sharing of cross-boundary medical records in an orderly manner, with a view to supporting citizens' cross-boundary healthcare needs more effectively.""

The bureau stressed that the rollout adheres strictly to the legal frameworks in both Hong Kong and the mainland, with data security and patient privacy upheld as paramount principles throughout the process."
韓股回吐0.2%收市　守住4100點,2025-12-24 14:46,,2025-12-24 15:00,cfinance,rthk,https://news.rthk.hk/rthk/ch/component/k2/1837367-20251224.htm,"韓國股市連升3日後回吐，但跌幅有限。

首爾綜合指數守住4100點水平，收報4108點，跌8點，跌幅0.21%。"
日股先升後回　全日跌約0.1%,2025-12-24 14:44,,2025-12-24 15:00,cfinance,rthk,https://news.rthk.hk/rthk/ch/component/k2/1837366-20251224.htm,"日股先升後回，結束3日升勢。

日經指數早段最多升逾220點，尾市轉跌，收報50344點，跌68點，跌幅0.14%。"
台股升0.2%收市　連升4日,2025-12-24 14:34,,2025-12-24 14:45,cfinance,rthk,https://news.rthk.hk/rthk/ch/component/k2/1837363-20251224.htm,"台灣股市連升4日。

加權指數收報28371點，創兩星期新高，升61點，升幅0.22%。"
黃汝榮獲委任為香港演藝學院校董會主席　任達榮為副主席,2025-12-24 13:47,,2025-12-24 14:00,local,rthk,https://news.rthk.hk/rthk/ch/component/k2/1837364-20251224.htm,"行政長官委任黃汝榮為香港演藝學院校董會主席、任達榮為校董會副主席和陳遠秀為校董會司庫，以及校董會成員，委任為期兩年，明年1月1日起生效。

文化體育及旅遊局局長羅淑佩說，黃汝榮現為校董會副主席，熟悉香港演藝學院的運作，並具備豐富公共服務經驗，期待與他緊密合作。她又歡迎陳遠秀、梁蘊莊、伍婉婷及胡偉成加入校董會。期望在校董會領導下，學院將更創輝煌。

羅淑佩衷心感謝即將卸任的香港演藝學院校董會主席楊傳亮，於過去9年出任校董會成員期間所作的卓越貢獻。"
林詩棋獲委任為旅遊業監管局主席　接替馬豪輝,2025-12-24 13:38,,2025-12-24 13:45,local,rthk,https://news.rthk.hk/rthk/ch/component/k2/1837362-20251224.htm,"行政長官委任林詩棋接替馬豪輝為旅遊業監管局主席，並委任15名新成員及再度委任12名現有成員，任期兩年，明年1月1日起生效。
　　 
文化體育及旅遊局發言人說，期望主席及各成員能繼續運用專業知識和經驗，助力旅監局貫徹監管與服務職能，又感謝即將卸任的主席馬豪輝及其他成員，在任內竭誠服務，對旅監局作出卓越貢獻。

旅監局是根據《旅遊業條例》成立的旅遊業法定監管機構，主要負責有關旅行代理商、導遊和領隊的發牌和規管事宜。"
楊淑芬料有約1500旅行團離港　六成屬往內地高鐵團,2025-12-24 13:36,,2025-12-24 13:45,local,rthk,https://news.rthk.hk/rthk/ch/component/k2/1837361-20251224.htm,"旅遊業議會總幹事楊淑芬表示，聖誕節假期是外遊旺季，估計有約1500個旅行團離港，其中6成是前往內地的高鐵團，以3至4天高鐵團較為熱門，例如前往桂林、潮汕或肇慶等。

她在本台節目《千禧年代》表示，聖誕期間航班價錢較貴，旅行團以短途為主，韓國較受歡迎，日本早前因為有熊襲擊人事件或地震，稍微下跌。整體東南亞團數則下跌近兩成，但越南則較受歡迎，當地新增一些目的地，例如富國島，消費相對較低，酒店舒適，很多市民喜歡前往受享輕鬆假期。

至於入境方面，楊淑芬表示，上月有逾6000內地團來港，預料本月有4000多團，主要因為旺季，酒店房價較高。內地客自由行方面，由於交通便利，相信有一半以上是即日往返。

她又說，11月底本港發生大火悲劇，除夕煙花匯演取消，但本港仍有倒數活動，亦看不到很多旅客因此而取消行程。"
中方敦促美方立即停止針對委內瑞拉的行動,2025-12-24 13:21,,2025-12-24 13:45,cinternational,rthk,https://news.rthk.hk/rthk/ch/component/k2/1837360-20251224.htm,"委內瑞拉總統馬杜羅表示，聯合國安理會舉行會議，「壓倒性支持」委內瑞拉維護航行自由和貿易自由的權利。

應委內瑞拉政府請求，聯合國安理會就問題舉行緊急會議。馬杜羅表示，安理會的立場體現對委內瑞拉合法權利的支持。他再次譴責美國查扣涉委內瑞拉油輪的行為是「海盜行徑」，並表示沒有人能夠擊敗委內瑞拉。

中國常駐聯合國副代表孫磊在安理會的會議上公開發言，呼籲美方立即停止針對委內瑞拉的行動。

孫磊說，美方行徑嚴重侵犯他國主權安全和合法權益，嚴重違反《聯合國憲章》和國際法，威脅拉美和加勒比地區和平與安全。越來越多的地區國家和域外國家對美方行徑表示嚴重關切和強烈譴責。

孫磊說，中方呼籲美方立即停止有關行動，避免緊張局勢進一步升級。中方願同地區國家一道，加強團結合作，堅持公平正義，共同維護拉美和加勒比地區的和平與穩定。"
Tertiary student among 20 held for fraud,2025-12-24 13:01,,2025-12-24 13:30,elocal,rthk,https://news.rthk.hk/rthk/en/component/k2/1837349-20251224.htm,"Twenty people have been arrested on suspicion of money laundering, fraud and wasting police resources in cases involving more than HK$2 million, the police said on Wednesday. 

In the most serious case, a 19-year-old tertiary student allegedly swindled five people out of more than HK$1.5 million between June and December after accusing them of committing economic crimes on the mainland.

Chief Inspector Cheung Wai-shan said the suspect posed as a secret mainland agent and showed up in person to win credibility with victims.

“To gain their trust, the suspect would first claim to be a secret agent and use coded messages to identify himself to victims,"" she said.

""These codes, or strings of numbers, would be provided when the suspect met up with victims.

“The suspect would also show the victims a confidentiality order, which appeared to be issued by the mainland's Public Security Bureau. The order would have the victims’ names printed on it to make it look more credible.”

Senior inspector Wong Wai-ting reminded the public that mainland and overseas officers would not be able to enforce their laws within Hong Kong.

She urged people to call the police’s anti-fraud hotline 18222 if they suspect they are being scammed. 

She also said the frequency of police patrols would increase during the Christmas and New Year holidays."
