title,date,summary,scrape_time,section,source,url,news_content
希臘在熱浪下多處發生山火　政府請求歐盟支援,2025-07-28 04:28,,2025-07-28 04:45,cinternational,rthk,https://news.rthk.hk/rthk/ch/component/k2/1815367-20250728.htm,"希臘全國多處在熱浪襲擊下發生山火，導致消防力量告急。

希臘南部島嶼、伯羅奔尼撒地區及首都雅典以北的東阿提卡地區，星期六起發生猛烈山火，強勁陣風加劇救火難度，當局疏散大批居民，希臘政府已經向歐盟民事保護機制請求提供支援。

希臘等地中海沿岸國家，自上周初以來持續遭受熱浪侵襲，希臘氣象局部門數據顯示，熱浪令全國多處氣溫突破攝氏42度，位於伯羅奔尼撒麥西尼亞地區的斯卡拉，更創下45.8度的高溫紀錄。

鄰國土耳其東南部城市西洛皮星期六錄得50.5度，多個地區山火肆虐，林業部長預計，火勢需要幾日才能夠完全控制，一些地方政府已宣布限制用水。"
英格蘭互射十二碼擊敗西班牙　成功衛冕女子歐洲國家盃,2025-07-28 03:46,,2025-07-28 04:00,csport,rthk,https://news.rthk.hk/rthk/ch/component/k2/1815366-20250728.htm,"英格蘭互射十二碼擊敗西班牙，成功衛冕女子歐洲國家盃。

決賽在瑞士巴塞爾舉行，西班牙上半場25分鐘先開紀錄。半場落後一球的英格蘭，換邊後12分鐘追成平手，將比賽帶到加時。

兩隊在加時都未有入球，最終英格蘭互射十二碼贏3:1，繼2022年後再次捧盃。"
德國西南部有載客火車出軌至少三死,2025-07-28 03:31,,2025-07-28 04:00,cinternational,rthk,https://news.rthk.hk/rthk/ch/component/k2/1815365-20250728.htm,"德國西南部巴登-符騰堡州有載客火車出軌，當局說，至少三人死亡，多人重傷。

事發在當地星期日傍晚6時許，德國傳媒報道，這列載有大約100人的客運火車，從德國西格馬林根開往烏爾姆途中，至少兩節車廂在叢林中出軌。

現場相片顯示，有列車車廂翻側，救援人員嘗試救出被困乘客，暫時不清楚事故原因。

總理默茨對遇難者表示哀悼，向家屬致以深切慰問。他說，正與內政部長及交通部長密切聯繫，要求他們為緊急部門提供一切所需支援。"
中美今日起舉行新一輪經貿會談　特朗普稱非常接近與中國達成協議,2025-07-28 03:06,,2025-07-28 03:15,cinternational,rthk,https://news.rthk.hk/rthk/ch/component/k2/1815364-20250728.htm,"中美今日起在瑞典斯德哥爾摩舉行新一輪經貿會談，由中共中央政治局委員、國務院副總理何立峰，以及美國財長貝森特共同主持。

美國總統特朗普星期日在蘇格蘭與歐盟委員會主席馮德萊恩一同見記者時表示，非常接近與中國達成貿易協議，未有透露詳情。

南華早報引述消息人士報道，預計中美雙方將會再度延長暫緩加徵關稅的期限三個月，期間不加徵新關稅或採取其他可能進一步升級貿易戰的行動。

路透社引述中美貿易分析人士認為，美中談判較為複雜，需要更多時間，斯德哥爾摩會談不太可能取得突破，但可能阻止局勢進一步升級，並為國家主席習近平與特朗普今年稍後會晤創造條件。"
美國與歐盟達成貿易協議　美國將向歐盟商品徵收15%關稅,2025-07-28 01:39,,2025-07-28 02:30,cinternational,rthk,https://news.rthk.hk/rthk/ch/component/k2/1815363-20250728.htm,"美國總統特朗普在蘇格蘭與歐盟委員會主席馮德萊恩會晤，雙方會後共同宣布達成美歐貿易協議，美國將會向歐盟商品徵收15%關稅。

特朗普形容，協議對所有人都有好處，亦令美歐夥伴關係更緊密。他說，歐盟將會再增加對美投資6000億美元，亦會大量採購美國的軍事裝備及7500億美元的美國能源產品。協議有利於汽車產業，對農業亦會產生重大影響。

馮德萊恩表示，經過艱巨談判達成一項重大協議，包括汽車在內的各類卜4品將適合於有關關稅稅率，協議有助重新平衡雙方的貿易關係，並為市場帶來穩定性。

路透社報道，雖然與歐盟最初提出的零關稅目標相比，15%的關稅稅率仍然有落差，但較美國早前威脅徵收30%好。

特朗普又提到，美國正考慮與另外三至四個國家達成協議，大部分協議都會涉及確定的關稅，美國會對其他國家保持低關稅，各國會在未來一星期收到澄清或確認關稅的信函。"
美國與歐盟達成貿易協議,2025-07-28 01:39,,2025-07-28 02:00,cinternational,rthk,https://news.rthk.hk/rthk/ch/component/k2/1815363-20250728.htm,美國總統特朗普在蘇格蘭與歐盟委員會主席馮德萊恩會晤，雙方在會後共同宣布達成美歐貿易協議。
泰柬今日稍後大馬討論化解兩國邊境爭議　中方冀雙方盡快停火止戰,2025-07-28 00:51,,2025-07-28 01:30,cinternational,rthk,https://news.rthk.hk/rthk/ch/component/k2/1815362-20250728.htm,"泰國與柬埔寨今日下午將於馬來西亞會談，討論化解兩國邊境爭議。

泰國總理府發言人表示，應東盟輪值主席國馬來西亞總理安華邀請，泰國代理總理普坦上午將會率團到馬來西亞，討論地區和平方案，會談當地下午3時開始，泰方代表團成員還包括外長瑪里等。發言人強調，泰方不會在主權問題讓步。

柬埔寨洪瑪奈其後證實，今日將會率團到吉隆坡，參加由馬來西亞主辦、美國協辦、中國參與的特別會議，目的是達成立即停火。

在北京，外交部發言人說，希望泰柬雙方秉持以和為貴、與鄰為善精神，保持冷靜克制，盡快停火止戰，透過對話協商和平解決分歧，早日恢復邊境地區和平穩定。中方讚賞東盟方面積極推動停火，並會秉持公道公允立場，繼續與兩國密切溝通，積極勸和促談，為推動停火止戰發揮建設性作用。"
約旦阿聯酋空投加沙　以總理否認援助受阻　哈馬斯斥以虛假做騷,2025-07-28 00:17,,2025-07-28 00:30,cinternational,rthk,https://news.rthk.hk/rthk/ch/component/k2/1815361-20250728.htm,"以色列軍方宣布對加沙重啟空投，並每日在指定地區實施戰術性軍事活動暫停後，人道物資陸續送達加沙。

約旦國營電視台報道，約旦皇家空軍兩架C-130運輸機和一架阿聯酋飛機，向加沙多個地點空投了25噸糧食援助及基本人道物資，約旦亦會派出60架運載基本食物的貨車前往加沙。

埃及消息人士透露，大約100架援助貨車星期日由拉法口岸埃及一側啟程，經凱雷姆沙洛姆口岸接受以方檢查後進入加沙，車上載有大量麵粉、各類食品、嬰兒配方奶粉和樽裝水。

以色列總理內塔尼亞胡表示，以色列一直容許最低限度的人道主義物資進入加沙，否認援助受阻，批評聯合國對以色列進行失實宣傳。

巴勒斯坦武裝組織哈馬斯說，以色列空投援助至加沙，不過是虛假做騷、掩蓋真相的手段。聲明強調，結束加沙飢餓的唯一出路，是立即停止侵略、徹底解除封鎖，並全面及持久地開放陸路通道，確保援助按聯合國機制順利流通，並送達民眾。"
廣東省過去一星期新增2940宗基孔肯雅熱病例　全部輕症,2025-07-27 22:28,,2025-07-27 22:45,greater_china,rthk,https://news.rthk.hk/rthk/ch/component/k2/1815360-20250727.htm,"廣東省疾控局通報，過去一星期，廣東省新增2940宗基孔肯雅熱本地病例，全部是輕症。

當局表示，7月20日至7月26日，廣東省新增2940宗基孔肯雅熱本地病例，當中沒有重症或死亡病例。絕大部分患者在佛山、有2882宗；廣州22宗，中山18宗；東莞、珠海、河源等也有零星病例。

廣東省疾控中心傳染病預防控制所所長康敏表示，基孔肯雅熱通過感染病毒的伊蚊叮咬傳播，症狀以發熱、關節劇痛和皮疹為主，多數人症狀輕微，但少數患者可能會出現慢性關節疼痛。"
勞工處就瑪麗醫院致命工業意外展開調查,2025-07-27 22:12,,2025-07-27 22:45,local,rthk,https://news.rthk.hk/rthk/ch/component/k2/1815359-20250727.htm,"瑪麗醫院傍晚發生升降機致命工業意外，一名57歲維修工人一度被困𨋢底，送院證實不治。勞工處表示，接報後已即時派員到現場，現正就意外原因展開調查。

警方傍晚近6時接報，指該名工人在地盤進行升降機工程，期間升降機突然郁動，工人受困，消防到場用了大約一個多小時將他救出，當時已經昏迷。"
醫管局關注瑪麗醫院致命工業意外　稱重視工程安全,2025-07-27 22:08,,2025-07-27 22:45,local,rthk,https://news.rthk.hk/rthk/ch/component/k2/1815358-20250727.htm,"瑪麗醫院重建工程地盤發生致命工業意外，一名57歲工人死亡。醫管局表示，工程由建築署負責進行，局方下午接獲建築署通知，指一名受僱相關升降機工程分判商的工人，在工作期間被困其中一條升降機槽。承建商地盤負責人隨即召喚消防員救出工人，送院搶救，其後證實死亡。
　　 
醫管局說，對事件感到難過，並對家屬致以深切慰問，已要求建築署確保工程承建商必須為家屬提供適切協助、妥善照顧家屬及處理工人的後事。
　　 
發言人又說非常關注事件，鑑於工程內的升降機尚未完成工序及調整，目前並未交付瑪麗醫院使用及管理。醫管局知悉建築署駐地盤人員在意外發生後，隨即向工程承建商了解及跟進事件，已敦促工程承建商必須嚴肅跟進，盡快採取一切必要措施，確保地盤安全，並要求工程承建商徹查事件成因，盡快向建築署及醫管局提交報告，避免再發生類似意外。
　　 
發言人指出，一直非常重視轄下醫院工程的工業安全，承建商會向勞工處呈報事件，當局亦會督促建築署及承建商全力配合勞工處及相關執法部門的調查。"
男子西貢划獨木舟失蹤　消防及飛行服務隊搜救,2025-07-27 21:51,,2025-07-27 22:30,local,rthk,https://news.rthk.hk/rthk/ch/component/k2/1815357-20250727.htm,"一名男子在西貢划獨木舟期間失蹤，救援人員正進行搜索。

警方傍晚近6時接報，指一名40歲男子原計劃中午由白腊出發前往破邊洲，但其後不知所蹤。

消防出動蛙人，政府飛行服務隊也有參與協助。"
荃灣命案男死者為前海關督察　海關：本月中離職,2025-07-27 21:49,,2025-07-27 22:00,local,rthk,https://news.rthk.hk/rthk/ch/component/k2/1815356-20250727.htm,"荃灣一名男子在酒店懷疑墮樓死亡，他的妻子及兩名兒子被發現倒斃在酒店房內，警方列作謀殺及自殺案。

警方表示，男死者在案發前曾在社交媒體透露患有情緒病，呼籲社會正視情緒病，有需要時應盡早求助。

海關得悉事件涉及一名前海關督察，部門對事件深表難過，並向家屬致以深切慰問。海關又表示，男死者早前是因私人理由請辭，5月中起休假，本月中離職。"
益豐大廈院舍負責人稱長者行動不便難撤離　有住戶冀加快復修進度,2025-07-27 21:24,,2025-07-27 21:45,local,rthk,https://news.rthk.hk/rthk/ch/component/k2/1815355-20250727.htm,"土瓜灣益豐大廈昨晚因私人鹹水管漏水，鹹水湧入電掣房令電力裝置故障，一度全面大停電。工程人員搶修後，B、D兩座住戶以及4幢大廈的公用設施今日凌晨恢復供電，機電署表示，全力爭取A、C座大廈住戶單位以及大廈內的護老中心在今晚10時前恢復電力供應，並爭取C座住戶明日凌晨2時前恢復供電。

益豐大廈的安老院舍負責人說，由於不少院友行動不便，難以撤離至臨時庇護中心，因此整晚留在大廈內，院舍煮食系統使用石油氣，院友膳食沒有受太大影響，但停電導致泵水系統受阻，院友暫時缺水洗澡。她又提到，政府為院舍提供了電箱、風扇等物資，區議員及社會福利署亦有關注院友狀況。

在未有供電的C座，有居民表示，由於明天要上班，因此今晚會留在家中過夜，以及沖凍水涼，亦準備幾把小型風扇降溫。

另一名C座住戶表示，會到朋友家中留宿，她認為天氣又熱又焗，想回家洗澡但不方便，停電影響頗大，希望能夠加快復修進度。"
少林寺方丈釋永信涉嫌刑事犯罪　被內地多個部門聯合調查　,2025-07-27 20:56,,2025-07-27 21:15,greater_china,rthk,https://news.rthk.hk/rthk/ch/component/k2/1815353-20250727.htm,"少林寺方丈釋永信涉嫌挪用侵佔寺院資產、以及嚴重違反佛教戒律，被內地多個部門調查。

央視新聞引述少林寺官方網頁公布，釋永信涉嫌刑事犯罪，挪用、侵佔項目資金和寺院資產，以及嚴重違反佛教戒律，長期與多名女性維持不正當關係並育有私生子，正在接受多部門聯合調查，少林寺表示將會及時公布有關情況。

根據少林寺的官方介紹，現年60歲的釋永信，俗名劉應成，是安徽人。他1981年加入少林寺，1999年起出任方丈至今。"
瑪麗醫院工人被困升降機底　救出送院證實不治,2025-07-27 20:47,,2025-07-27 21:00,local,rthk,https://news.rthk.hk/rthk/ch/component/k2/1815352-20250727.htm, 
施政報告2025｜許正宇稱走入社區聽民意有助打造更貼地政策,2025-07-27 20:45,,2025-07-27 21:00,local,rthk,https://news.rthk.hk/rthk/ch/component/k2/1815351-20250727.htm,"行政長官李家超出席首場《施政報告》地區諮詢會，有份出席諮詢會的財經事務及庫務局局長許正宇表示，走入社區傾聽民意，有助掌握市民真切所需，打造更有溫度、更貼地的政策。

局方在社交專頁表示，政府近年積極推動變革創新，持續鞏固香港作為國際金融中心的地位，近年亦積極完善上市制度，今年以來新股市場活躍並領跑全球。財庫局未來將持續推動多方面工作，包括繼續優化上市制度，促進股票市場流動性，發展金融創新，吸引更多具潛力的優質企業來港上市，同時便利企業在港成立財資管理中心。"
剛果民主共和國一間教堂遭武裝分子襲擊　最少38人死亡,2025-07-27 20:28,,2025-07-27 20:45,cinternational,rthk,https://news.rthk.hk/rthk/ch/component/k2/1815350-20250727.htm,"剛果民主共和國一間天主教堂遭到武裝分子襲擊，最少38人死亡、15人受傷。

事發在剛果民主共和國東北部的伊圖里省，當地公民組織說，反政府武裝「民主同盟軍」的成員，星期日凌晨一時左右，闖入一間天主教堂，開槍殺死裡面多名參與深夜彌撒的信徒。武裝分子其後在附近的商店及民居縱火，當局正在搜捕武裝分子。

反政府武裝「民主同盟軍」被列為恐怖組織，與極端組織「伊斯蘭國」有聯繫。公民組織譴責襲擊，要求軍方介入，維持當地安全。組織又說，當地有民眾憂慮人身安全，已經開始撤離。"
瑪麗醫院工業意外被困工人已救出　昏迷送院,2025-07-27 20:22,,2025-07-27 20:45,local,rthk,https://news.rthk.hk/rthk/ch/component/k2/1815349-20250727.htm,"瑪麗醫院一名工人傍晚維修升降機期間，升降機突然郁動，工人一度被困，消防到場將他救出，昏迷送院治理。

警方傍晚近6時接報，指一名年約50多歲的男子在地盤進行升降機工程，期間升降機突然郁動，工人受困。

工業傷亡權益會表示關注事件，促請勞工處、建築署及醫管局調查意外原因是否涉及機件故障，並要求總承建商和升降機公司等，向工人及家屬提供可行協助。"
雲南普洱市山泥傾瀉掩埋汽車　初步指5人被困,2025-07-27 19:56,,2025-07-27 20:15,greater_china,rthk,https://news.rthk.hk/rthk/ch/component/k2/1815348-20250727.htm,"雲南省普洱市發生山泥傾瀉，掩埋一架車，初步消息指有5人被困。

普洱市政府表示，連接瀾滄縣和西盟縣的公路，今天發生山泥傾瀉，有一架車被掩埋，初步了解有5人被困。當局隨即組織相關力量展開救援，仍在了解具體事故情況。"
瑪麗醫院有工人進行升降機工程時被困　消防到場救援,2025-07-27 19:31,,2025-07-27 20:00,local,rthk,https://news.rthk.hk/rthk/ch/component/k2/1815346-20250727.htm,"瑪麗醫院一個地盤傍晚發生工業意外，一名工人昏迷，消防到場救援。

警方傍晚近6時接報，指一名年約50多歲的男子在地盤進行升降機工程，期間升降機突然郁動，導致工人受困。"
泰國外交部證實泰柬代表周二於馬來西亞會晤,2025-07-27 19:26,,2025-07-27 19:45,cinternational,rthk,https://news.rthk.hk/rthk/ch/component/k2/1815345-20250727.htm,"泰國外交部發言人尼康德證實，泰國與柬埔寨雙方星期二，將在馬來西亞會晤。

馬來西亞外長穆罕默德較早前表示，泰國和柬埔寨已同意由今屆東盟輪值主席國馬來西亞，調停雙方的邊境衝突，預料柬埔寨首相洪瑪奈和泰國代總理普坦，明日傍晚訪問馬來西亞。穆罕默德說，已與柬埔寨和泰國外長交談，雙方一致認為，其他國家不應介入事件。

馬來西亞總理安華星期五提出停火建議，美國總統特朗普表示，泰柬雙方應該同意停火。"
男子酒店疑墮樓亡其妻兒倒斃房內　警方稱男子曾透露患情緒病,2025-07-27 18:56,,2025-07-27 19:15,local,rthk,https://news.rthk.hk/rthk/ch/component/k2/1815344-20250727.htm,"荃灣一名男子在酒店懷疑墮樓死亡，他的妻子及兩名兒子被發現倒斃在酒店房內，警方列作謀殺及自殺案。

警方表示，男死者在案發前曾在社交媒體透露患有情緒病，呼籲社會正視情緒病，有需要時應盡早求助。"
陳茂波稱本港經濟中長期前景穩中有進　預期勞工市場大致穩定,2025-07-27 18:52,,2025-07-27 19:15,local,rthk,https://news.rthk.hk/rthk/ch/component/k2/1815342-20250727.htm,"財政司司長陳茂波表示，本星期將公布的第二季本地生產總值預估數字，上升勢頭可望持續。

陳茂波說，本港經濟中長期前景穩中有進，但個別行業面對挑戰，預期勞工市場大致穩定，政府會加強推動職業再培訓等，協助市民就業，又形容本港就業市場尚算穩定。"
馬來西亞外長稱泰柬領導人明訪大馬討論邊境衝突,2025-07-27 18:50,,2025-07-27 19:15,cinternational,rthk,https://news.rthk.hk/rthk/ch/component/k2/1815338-20250727.htm,"馬來西亞外長穆罕默德表示，泰國和柬埔寨已同意由今屆東盟輪值主席國馬來西亞，調停雙方的邊境衝突。

柬埔寨首相洪瑪奈和泰國代總理普坦，明日訪問馬來西亞。穆罕默德說，已與柬埔寨和泰國外長交談，雙方一致認為，其他國家不應介入事件。

泰國與柬埔寨連續第4日在邊境爆發衝突，泰國軍方今日再出動戰機與無人機，並聯合地面部隊展開密集炮擊，雙方互相指責對方違反國際法。"
【重溫】2025年7月27日新聞天地,2025-07-27 18:43,,2025-07-27 19:00,local,rthk,https://news.rthk.hk/rthk/ch/component/k2/1815341-20250727.htm,詳盡報道本地時事，大中華消息、國際局勢等新聞，緊貼最新熱話。
澳門司警拘2名港人涉於當地機場販運冰毒,2025-07-27 18:37,,2025-07-27 19:00,greater_china,rthk,https://news.rthk.hk/rthk/ch/component/k2/1815340-20250727.htm,"澳門司警傍晚在機場拘捕一男一女港人，他們涉嫌販毒。司警表示，情報顯示有跨境販毒集團會在澳門國際機場犯案。經調查後鎖定嫌犯身份，發現他們上午10時許先後經港珠澳大橋入境後，到澳門機場的出境大廳等候。

司警截查兩人，並分別在51歲報稱廚師的男人和63歲無業的女子的內衣褲內，各搜出500克冰毒，市值約300萬港元。司警表示，兩人承認合共收取55000元報酬，按集團指示到澳門將冰毒帶離境。被捕男女涉嫌不法販賣麻醉品及精神藥物罪，稍後將移送檢察院。"
施政報告2025｜李家超稱政策宏觀微觀都要照顧　強化執行力量,2025-07-27 18:37,,2025-07-27 19:00,local,rthk,https://news.rthk.hk/rthk/ch/component/k2/1815339-20250727.htm,"行政長官李家超出席首場《施政報告》地區諮詢會，與大約120名市民見面。有市民向他提出建立社區創新實驗室，亦有人關注生育率低的問題，有大學生就希望政府協助科研融資。

李家超說，上任後已改變政策，推出組合拳措施推動生育，又指會研究創科專利融資。他說，政府政策不論宏觀或微觀都要照顧，要「做大個餅」，令人人都受益，同時要強化執行力量。"
機電署：爭取晚上10時前恢復益豐大廈A座住戶及老人院電力供應,2025-07-27 18:08,,2025-07-27 18:30,local,rthk,https://news.rthk.hk/rthk/ch/component/k2/1815337-20250727.htm, 
食環署選定30個冷氣機滴水黑點　發出約700張妨擾事故通知,2025-07-27 18:02,,2025-07-27 18:30,local,rthk,https://news.rthk.hk/rthk/ch/component/k2/1815336-20250727.htm,"食環署表示，冷氣機滴水投訴個案近年呈上升趨勢，由2023年約3.1萬宗，增至去年約3.4萬宗，深水埗、油尖旺等舊區屬重災區。署方5月至9月期間會在全港展開執法行動，鎖定部分大廈主動加強巡查。截至本月中，當局針對冷氣機滴水黑點，共發出約700張相關的妨擾事故通知。

食環署助理署長溫智舜接受《政府新聞網》訪問說，已選定全港各區30個冷氣機滴水黑點，每星期最少一次，在早、午、晚不同時段以「洗樓」形式採取執法行動。針對黑點較多的地區，署方會額外派出人手支援。

署方又在全港多區引入新科技，利用紅外線夜視鏡攝錄裝置協助團隊在晚間追查滴水源頭，大幅提高夜間偵查效率。署方又引入第二代裝置，用於觀察最高位處40層樓高的滴水源頭。
 
私人屋苑方面，食環署一直推行計劃，邀請物管公司在夏季協助處理屋苑內的冷氣機滴水投訴。過去5年，每年平均有超過80間物管公司及200多個私人屋苑參與計劃，並通過計劃成功處理超過4000宗投訴個案。"
工作暑熱警告取消,2025-07-27 17:50,,2025-07-27 18:15,local,rthk,https://news.rthk.hk/rthk/ch/component/k2/1815335-20250727.htm,工作暑熱警告在下午5時50分取消。
AC米蘭4:2利物浦　觀眾冀啟德多辦同類賽事,2025-07-27 17:39,,2025-07-27 17:45,csport,rthk,https://news.rthk.hk/rthk/ch/component/k2/1815334-20250727.htm,"意甲傳統勁旅AC米蘭，昨晚在啟德主場館舉行的友誼賽，以4:2擊敗英超的利物浦。賽事有超過4.9萬觀眾入場觀賞，有觀眾希望啟德主場館日後可多舉辦這類型高水平賽事。

文化體育及旅遊局局長羅淑佩滿意活動安排，相信可讓大家有好球賽觀看之餘，亦可帶動「夜經濟」。"
陳茂波：第二季本地生產總值預估料持續上升勢頭,2025-07-27 17:26,,2025-07-27 17:45,local,rthk,https://news.rthk.hk/rthk/ch/component/k2/1815332-20250727.htm,"財政司司長陳茂波表示，將在本周公布今年第二季本地生產總值預估數字，在增長受出口活動、整體投資和私人消費帶動下，可望持續上升勢頭，連續第十個季度有增長。

另外，他預計已經連跌4季的私人消費，在今年第二季可望止跌回升。"
醫管局推高流量白內障手術服務　縮短病人留院及輪候時間,2025-07-27 17:24,,2025-07-27 17:45,local,rthk,https://news.rthk.hk/rthk/ch/component/k2/1815331-20250727.htm,"大埔那打素醫院去年底開始，試行「高流量白內障手術服務模式」，加快手術流程，病人平均留院時間由以往接近6小時，縮短至2個多小時。

醫管局計劃下月起，在所有聯網增設高流量白內障手術節數，期望可縮短平均輪候時間。"
俄羅斯突以安全理由取消海軍節閱兵,2025-07-27 17:23,,2025-07-27 17:45,cinternational,rthk,https://news.rthk.hk/rthk/ch/component/k2/1815330-20250727.htm,"俄羅斯突然宣布因安全理由，取消原定今日在聖彼得堡舉行的海軍節主閱兵式。

塔斯社引述克里姆林宮發言人佩斯科夫表示，取消閱兵與整體局勢有關，安全原因是最重要。不過，他未有交代具體威脅的詳情。

俄羅斯總統普京今日透過視像方式，向海軍官兵致以節日祝賀。他說正全面提升核潛艇編隊，海軍的核力量不斷提升。俄羅斯今年批准新的海軍發展戰略，是俄羅斯史上首次將海軍發展規劃設定為到2050年的長期戰略，直接反映了俄羅斯對自身實力和能力的信心。"
民政事務總署開放臨時避暑中心,2025-07-27 17:17,,2025-07-27 17:45,local,rthk,https://news.rthk.hk/rthk/ch/component/k2/1815329-20250727.htm,"民政事務總署繼續開放19間社區會堂和社區中心作臨時避暑中心。
 
當局說，臨時避暑中心會在酷熱天氣警告生效期間全日開放予市民避暑。此外，在晩上10時30分至翌日早上8時，臨時避暑中心亦供應被鋪及睡覺的地方予有需要人士。"
