title,date,summary,scrape_time,section,source,url,news_content
海關檢獲懷疑氯胺酮及大麻花估計市值逾千萬元　一名男子被捕,2025-05-14 21:08,,2025-05-14 21:15,local,rthk,https://news.rthk.hk/rthk/ch/component/k2/1804637-20250514.htm,"海關分別在香港國際機場和秀茂坪檢獲約21公斤懷疑氯胺酮及約1.1公斤懷疑大麻花，估計市值共約1025萬元。

海關本月12日在機場檢查一批從比利時抵港並報稱音響線的空運貨物，收貨地址為秀茂坪一個住宅單位。經檢查後，關員發現該批空運貨物內藏約21公斤懷疑氯胺酮。關員昨日採取監控遞送行動，在秀茂坪相關住宅單位拘捕一名24歲的收貨男子，關員在該單位進行搜查，再檢獲約1.1公斤懷疑大麻花。

這名被捕人士已被控兩項販運危險藥物罪，明日在觀塘裁判法院提堂。"
特首中東行｜特首稱積極考慮訪阿曼和巴林　爭取不同國家給予免簽,2025-05-14 21:02,,2025-05-14 21:15,local,rthk,https://news.rthk.hk/rthk/ch/component/k2/1804636-20250514.htm,"行政長官李家超總結中東外訪行程時表示，會積極考慮將「海合會」餘下兩國，即阿曼和巴林，放於他的出訪計劃內。他強調自己的出訪計劃，既會針對歐美等傳統市場，亦會針對新興市場，包括東盟，以至中亞、非洲等「一帶一路」國家。

被問到特區政府會否爭取科威特給予特區護照免簽待遇，以及來往香港及科威特的直航航班。李家超說，特區政府希望爭取不同國家給予特區護照免簽，以盡量方便商貿人士和旅客。他指出，特區護照已獲得百多個國家免簽待遇，而特區護照在入境方面出現問題的情況較其他護照少，證明特區護照的可信性和代表性。

至於直航航班方面，李家超表示，較遠程的直航航班，的確可以方便不同國家的人士往來，現時香港已有來往多哈，杜拜及利雅得等中東地區的直航航班。他明白航空公司亦要確保商業性可以持續，但他相信隨著交往愈來愈多，香港與多個中東國家簽署了多份諒解備忘錄，相信人民交流及商務合作會愈來愈多，能夠確保商業效益得以鞏固。"
證監會與愛爾蘭央行更新合作框架　加強公募基金分銷合作,2025-05-14 20:58,,2025-05-14 21:15,cfinance,rthk,https://news.rthk.hk/rthk/ch/component/k2/1804633-20250514.htm,"香港證監會與愛爾蘭中央銀行，簽署關於基金互認安排的諒解備忘錄，容許合資格的香港及愛爾蘭公募基金，透過更精簡程序在對方市場分銷，以配合全球金融市場持續增長，及跨境資產管理活動日益增加。

今次是兩家監管機構繼1997年就監管跨境投資管理活動簽署備忘錄後，簽訂協議作為更新合作框架。更新的框架允許合資格的香港公眾集體投資計劃，首次在愛爾蘭進行跨境銷售，並允許符合特定標準的愛爾蘭可轉讓證券集體投資計劃，根據加快的審批程序，經證監會認可在香港作跨境銷售。

證監會行政總裁梁鳳儀歡迎愛爾蘭成為第11個加入證監會基金互認安排的司法管轄區，認為反映國際間認可香港就投資基金制訂的監管標準，將繼續致力擴大相關安排，作為證監會深化香港與海外市場聯繫的核心策略之一部分。

愛爾蘭中央銀行消費者及投資者保障副行長Derville Rowland表示，新安排除了透過增加投資選擇，為投資者帶來更多投資機會和提升投資多元性外，亦彰顯加強兩家機構在監管合作方面的承諾，期待與證監會緊密合作。"
特首中東行｜李家超稱訪中東行程成功　加強合作等方面取得好結果,2025-05-14 20:55,,2025-05-14 21:15,local,rthk,https://news.rthk.hk/rthk/ch/component/k2/1804635-20250514.htm,"行政長官李家超結束中東訪問，他在科威特總結行程時形容，今次率領香港及內地的商貿代表團訪問卡塔爾和科威特，訪問行程整體成功，在加強政府、商貿、人文合作等6方面取得很好成果。

李家超說，在推進政府之間關係方面，今次與兩國合共達成59項合作備忘錄和協議，卡塔爾佔35項、科威特佔24項，涵蓋政府合作、市場貿易、投資市場發展、金融、科研、法律專業、工程等。

李家超又說，今次訪問發揮香港在一國兩制下「內聯外通」優勢，深化國際交往合作，展現香港和內地優勢互補的協同效應，今次首次邀請20多位內地企業代表參加訪問團，展現香港作為「超級聯繫人」和「超級增值人」的角色，發揮香港「引進來、走出去」的橋樑作用。

他又說，連同上次訪問中東的沙特和阿聯酋，他已經訪問了海合會6個國家中的4個國家，佔海合會成員國的三分之二，人口佔海合會總人口九成，特區政府正積極探討與海合會簽署自由貿易協議，明日起阿聯酋會給予香港30天免簽安排，阿曼亦會延長免簽入境期限，由最長10日增加至14日。

李家超又指，卡塔爾和科威特都是發展蓬勃、資金充裕、經濟不斷增長的國家，現時中東國家正積極分散風險，並尋求投資中國和香港特區的機遇，認為在全球經濟重心東移的大趨勢，香港機遇無限。"
克宮：俄方代表團將在伊斯坦布爾等候烏方　據報拉夫羅夫出席,2025-05-14 20:54,,2025-05-14 21:15,cinternational,rthk,https://news.rthk.hk/rthk/ch/component/k2/1804634-20250514.htm,"俄羅斯克里姆林宮發言人佩斯科夫表示，俄方代表團星期四會在土耳其伊斯坦布爾等候烏克蘭代表團，在總統普京下達命令後，將會公布參與俄烏會談的俄羅斯代表團名單。

俄羅斯總統助理烏沙科夫表示，俄方代表團計劃討論政治和技術問題，將根據這兩方面需要，決定代表團成員名單。

有俄羅斯及美國傳媒報道，俄羅斯外長拉夫羅夫及烏沙科夫將前往伊斯坦布爾，準備與烏克蘭外長會面。

曾經表示考慮前往土耳其參與俄烏談判的美國總統特朗普，乘坐空軍一號前往卡塔爾訪問時表示，如果他不出席俄烏會談，他不知道普京會否出席。

烏克蘭總統澤連斯基早前表示，他星期四將在土耳其等候普京，尋求達成30日停火。如果普京拒絕出席會談，美國應該對莫斯科實施最嚴厲的制裁。"
紫光集團原董事長趙偉國貪污案一審判死緩　剝奪政治權利終身,2025-05-14 20:24,,2025-05-14 20:45,greater_china,rthk,https://news.rthk.hk/rthk/ch/component/k2/1804632-20250514.htm,"紫光集團原董事長趙偉國貪污、為親友非法牟利及損害上市公司利益罪，一審被判處死刑，緩期兩年執行。

案件今天在吉林市中級人民法院公開宣判，趙偉國另被剝奪政治權利終身，並罰款1200萬元人民幣，沒收個人全部財產。

當局經審理查明，趙偉國在2018年至2021年間，利用擔任紫光集團董事長的職務便利，與特定關係人李祿媛共謀，由李祿媛控制的公司低價購買原本應由紫光集團購買的房產，獲取房產溢價利益，非法佔有國有資產價值4億7千萬元人民幣；又將盈利業務交由李祿媛等特定關係人經營，或者以高於市場的價格向李祿媛的公司購買代建管理服務，造成國家直接經濟損失人民幣超過8億9千萬元。

法院認為趙偉國貪污金額特別巨大，並使國家利益遭受特別重大損失，應當判處死刑，鑑於他到案後如實供述罪行，主動交代辦案機關尚不掌握的犯罪事實，亦有積極退贓，有重大立功表現，對其所犯貪污罪判處死刑，可不立即執行。"
中國與烏茲別克互免簽證協定6月起正式生效,2025-05-14 20:18,,2025-05-14 20:30,greater_china,rthk,https://news.rthk.hk/rthk/ch/component/k2/1804631-20250514.htm,"央視報道，中國與烏茲別克互免簽證的協定，將於6月1日起正式生效。

持有效的中國公務、公務普通及普通護照的人員，以及烏茲別克普通護照的人員，在另一方入境、出境或過境，單次停留不超過30日、每180日累計停留不超過90日，可免辦簽證。

如需單次停留逾30日或在境內定居，從事工作、學習、新聞報道等須事先獲批准的活動，則應在入境前申請相應簽證。"
中新海上聯合演習在新加坡舉行　為期兩日海上實兵演練展開,2025-05-14 20:15,,2025-05-14 20:30,greater_china,rthk,https://news.rthk.hk/rthk/ch/component/k2/1804630-20250514.htm,"「中新合作-2025」海上聯合演習在新加坡舉行，展開為期兩日的海上實兵演練。

中國海軍參演艦艇獵掃雷艦赤水艦、導彈護衛艦許昌艦，以及新加坡海軍參演艦艇堅信號護衛艦，早上在新方拖船和軍港保障人員配合下，從新加坡樟宜海軍基地啟航，駛往預定演練區域進行兵力集結，與新方掃雷艇會合。演習通過水雷威脅區、艦炮對海射擊、聯合搜救與醫療後送等內容，檢驗港岸籌劃期間計劃研討交流成果。

海軍代表表示，中新雙方秉持務實高效的原則，先後進行了三輪會議，圍繞兵力行動、協同配合等細節進行深入交流與探討，以嚴謹態度優化行動方案，充分彰顯雙方共築海上安全的責任與擔當。"
市監總局：個體工商戶生存發展仍面臨壓力和挑戰,2025-05-14 20:12,,2025-05-14 20:30,greater_china,rthk,https://news.rthk.hk/rthk/ch/component/k2/1804628-20250514.htm,"國家市場監督管理總局副局長白清元主持召開平台企業支持個體工商戶發展座談會。會議指出，個體工商戶是民營經濟重要組成部分，促進個體工商戶發展是促進民營經濟發展壯大重要舉措，是落實「著力穩就業、穩企業、穩市場、穩預期」要求重要環節。

會議指出，當前內地經濟持續回升向好基礎還需要進一步穩固，個體工商戶生存發展仍面臨壓力和挑戰。平台企業同為民營經濟重要組成部分，能夠為個體工商戶發展提供廣闊空間，能夠在數字賦能、流量扶持、市場拓展等各方面幫助及支持個體工商戶發展。會議鼓勵平台企業結合自身特點推出更多支持個體工商戶發展的務實舉措。

來自北京、上海、浙江、四川等地個體工商戶代表，中國（義烏）個體經濟發展研究中心以及小紅書、支付寶、抖音、拼多多、中國銀行等企業及機構代表出席會議及交流發言。"
特首中東行｜明起阿聯酋予香港30天免簽　阿曼延長逗留時間,2025-05-14 19:51,,2025-05-14 20:15,local,rthk,https://news.rthk.hk/rthk/ch/component/k2/1804629-20250514.htm, 
李浩然：國安公署履職場所列禁地有迫切性　附屬法例盡快立法合適,2025-05-14 19:36,,2025-05-14 19:45,local,rthk,https://news.rthk.hk/rthk/ch/component/k2/1804627-20250514.htm,"立法會內會明早召開特別會議，討論有關審議《維護國家安全條例》附屬法例工作。保安局局長鄧炳強在致立法會主席梁君彥的函件中，邀請立法會內會舉行特別會議，以盡快考慮成立附屬法例小組委員會，展開審議附屬法例的工作。

全國人大常委會香港基本法委員會委員李浩然表示，《維護國家安全條例》已訂立一段時間，附屬法例只是訂出一些具體執行原則，範圍不會超出原本已訂立的法例，因此現時盡快就附屬法例立法是合適做法。

他又說，就駐港國安公署的履職場所列為禁地，具有一定迫切性，因有關地方是國家安全部門辦公地點，不能夠開放予市民進入，這一點很重要。

至於附屬法例的審議工作是否能夠在短時間內完成，李浩然說目前較難估計，一方面要視乎立法會內會明天是否會隨即成立附屬法例小組委員會，另外亦要看議員對於兩項附屬法例是否仍有其他意見要討論。"
萬科再獲深鐵集團股東貸款逾15億元人民幣,2025-05-14 19:29,,2025-05-14 19:45,cfinance,rthk,https://news.rthk.hk/rthk/ch/component/k2/1804626-20250514.htm,"萬科企業獲第一大股東深圳市地鐵集團貸款，規模不超過15.52億元人民幣，用於償還在公開市場發行的債券本金及利息。

萬科表示，今次借款期限36個月，可提前還款或展期，定價基準是每筆借款提款日前一個交易日公布的1年期貸款市場報價利率（LPR）減76個基點，目前是2.34厘。

集團表示，今次股東借款利率遵循市場化原則，並低於目前從金融機構借款的利率水平，充分體現大股東支持。深鐵集團今年已向萬科提供3筆貸款，合共103億元，借款利率及質押利率均優於市場慣例水平。

萬科首季度已償還98.9億元債務，但今年餘下時間仍有逾200億元境內債務到期。"
衞生署接獲149宗仁滙疑停運查詢　為受影響嬰幼兒家長提供建議,2025-05-14 19:10,,2025-05-14 19:45,local,rthk,https://news.rthk.hk/rthk/ch/component/k2/1804625-20250514.htm,"提供疫苗接種服務的仁滙醫務集團懷疑停運，衞生署表示，由本月3日至今日下午5時共接獲149宗查詢，絕大部分關於兒童疫苗或其他年齡組別疫苗，亦有一宗關於化驗服務查詢。

截至昨日，衞生署母嬰健康院已為54名受事件影響的嬰幼兒家長提供健康建議，或安排其子女接種疫苗。

衞生署指，得悉涉事機構曾使用本地私家醫院化驗服務後，已主動聯繫受影響的私家醫院，協助院方將11份檢查報告送達醫生，讓相關市民個案可獲適當跟進。"
特首中東行｜香港與科威特達成24項合作　李家超形容成果豐碩,2025-05-14 19:04,,2025-05-14 19:15,local,rthk,https://news.rthk.hk/rthk/ch/component/k2/1804624-20250514.htm,"行政長官李家超表示，香港與科威特連同昨日簽署的兩份合作備忘錄，共達成24項合作備忘錄及合作協議，涵蓋貿易與經濟、投資推廣、金融服務、航空與海事、高等教育、法律專業、體育等領域，形容成果豐碩。

李家超在社交專頁表示，與代表團在科威特出席由特區政府及香港貿發局主辦、科威特直接投資促進局及當地工商協會協辦的高層商務午宴，共同見證兩地合作邁向新里程。 

他又說，兩地海關將啟動各自「認可經濟營運商計劃」的相互認可談判，為企業創造更暢通的國際商貿環境；香港機場管理局與科威特航空簽署新備忘錄，提升兩地航空連繫，推動人才培訓。

李家超認為，隨著貿易與投資關係持續深化，相信將為香港與海灣阿拉伯國家合作委員會商討自由貿易協定注入新動力，並期待與海合會進一步推進相關討論。"
分析：內地上月金融數據反映企業及家庭融資需求仍較弱,2025-05-14 18:56,,2025-05-14 19:15,cfinance,rthk,https://news.rthk.hk/rthk/ch/component/k2/1804623-20250514.htm,"法國外貿銀行亞太區高級經濟學家吳卓殷表示，上月金融數據反映人民幣貸款有減速情況，企業及家庭在實體經濟融資需求較弱，信貸需求仍由政府主導措施帶動。

吳卓殷預計，人民幣銀行減息降準後，人民幣貸款增速或會較為平穩，認為要留意居民可支配收入是否明顯反彈，股市及房地產帶動的財富效應，以及企業盈利在未來一至兩季會否反彈。

另外，澳新銀行表示，關稅的擔憂抑制企業融資活動，在一攬子金融政策和中美互減關稅後，未來數月有望修復。而上月減息為穩預期的預防性減息，未來仍要觀望財政發力，預計政府開支會顯著加快。"
日本航空自衛隊一架訓練機墜機　未知是否有人受傷,2025-05-14 18:54,,2025-05-14 19:15,cinternational,rthk,https://news.rthk.hk/rthk/ch/component/k2/1804622-20250514.htm,"日本航空自衛隊一架載有2人的訓練機起飛後不久，在中部愛知縣犬山市墜機，當局正展開救援和調查，未知道是否有人受傷。

共同社報道，這架T-4型訓練機下午3時左右從愛知縣小牧基地起飛，原定前往宮崎縣新田原基地，但在犬山市上空時，信號從雷達上消失。

犬山市消防部門接到目擊者報告，指市內有疑似飛機的物體墜落，墜落地點是一個大型人工農業灌溉蓄水池。愛知縣警方接獲消息指，蓄水池水面似乎有油污漂浮。

內閣官房長官林芳正表示，訓練機在起飛後不久墜落，防衛省正確認具體情況。"
虎豹別墅導賞將增虛擬實境展覽　探索昔日萬金油花園十王殿,2025-05-14 18:49,,2025-05-14 19:00,local,rthk,https://news.rthk.hk/rthk/ch/component/k2/1804621-20250514.htm,"虎豹別墅導賞活動周五起增設虛擬實境展覽新環節，參加活動的市民，不單可以參觀別墅的私人花園及大部分室內空間，亦可以利用虛擬實境裝置，探索昔日的萬金油花園「十王殿」。
　　 
展覽使用香港恒生大學和香港珠海學院製作的虛擬實境元宇宙平台項目，聚焦重現昔日的萬金油花園「十王殿」。參加者戴上虛擬實境裝置後，可探索「十王殿」浮雕的細節，並利用互動介面，認識相關歷史文化背景。除虛擬實境外，現場亦有介紹「十王殿」的展板和項目短片。
　　 
導賞團費用全免，市民可於古蹟辦網頁預約參加。"
蔡若蓮與亞太經合組織經濟體系教育部長交流介紹香港教育優勢,2025-05-14 18:46,,2025-05-14 19:00,local,rthk,https://news.rthk.hk/rthk/ch/component/k2/1804620-20250514.htm,"教育局局長蔡若蓮出席在南韓濟州舉行的第七屆亞太區經濟合作組織教育部長會議，與亞太經合組織經濟體系的教育部長交流，介紹香港的教育優勢。
 
蔡若蓮在專題環節上表示，香港致力發展成為國際專上教育樞紐和人才搖籃。香港五所公帑資助大學名列世界百強，泰晤士高等教育二○二五年度全球最國際化大學排名首四名，亦是香港公帑資助大學。
 
特區政府已將公帑資助專上院校的非本地學生限額，由百分之20提升一倍至百分之40，並設立獎學基金，資助「一帶一路」沿線國家或地區的學生來港就讀，以及資助本地學生參與國際研習活動。
 
蔡若蓮亦與南韓代總統、副總理兼教育部長官李周浩及其他亞太經合組織經濟體系的教育部長會面，就各地教育政策進行交流。她亦在亞太經合組織國際教育改革會議發表演講，就資訊科技教育和建設國際專上教育樞紐，分享香港的實踐經驗。同日，她與南韓教育部副部長吳碩煥會面，就加強韓港教育合作交換意見。
 
蔡若蓮明日繼續南韓行程。"
長者醫療券大灣區試點計劃增12醫療機構　擴展至大灣區9個城市,2025-05-14 18:44,,2025-05-14 19:00,local,rthk,https://news.rthk.hk/rthk/ch/component/k2/1804619-20250514.htm,"衞生署與12間新納入「長者醫療券大灣區試點計劃」的內地醫療機構簽署服務協議，令納入試點的醫療機構數目，由現時7間增至19間，實現施政報告提出擴展計劃至粵港澳大灣區9個內地城市的目標。當局力爭在今年第四季或之前，陸續在新增試點機構開展相關安排。

新增的12間醫院，分佈於廣州、深圳、珠海、佛山、惠州、中山、江門及肇慶；連同之前香港大學深圳醫院的一院兩點，合資格申領醫療券的香港長者，將可在合共21個大灣區服務點，使用醫療券支付門診醫療護理費用。
 
衞生署將根據協議，積極與各新增試點落實後續安排，包括人員培訓、財務安排、系統對接等。

衞生署署長林文健在簽署儀式上，感謝廣東省衞健委和相關城市的衞生部門，積極支持和協助特區政府進一步擴大「試點計劃」，為合資格香港長者提供更大便利和靈活性，以保障及滿足他們的醫療需求，同時進一步促進大灣區的醫療合作，攜手共建「健康灣區」。 

「試點計劃」自去年開通後，截至今年3月底，約13350名合資格長者曾在計劃下的醫療機構，使用醫療券支付護理服務費用，交易宗數超過24600宗，申領交易總額約3216萬元。"
"HK has a lot to offer Kuwait, says CE",2025-05-14 18:37,,2025-05-14 18:45,elocal,rthk,https://news.rthk.hk/rthk/en/component/k2/1804617-20250514.htm,"Chief Executive John Lee on Wednesday said the SAR has much to offer Kuwait, as the two sides agreed to work together in various areas such as trade and financial services.

""I'm pleased to note that during our visit, Hong Kong and Kuwait have reached consensus on 24 concrete deliverables, through [memoranda of understanding] and related agreements,"" Lee told a business luncheon in the Gulf country on the last day of his Middle East tour.

""The agreements cover a broad range of collaboration, from trade and the economy, to investment promotion, financial services, aviation and the maritime industries, post-secondary education, the legal profession, sports and more.""

He added that Hong Kong customs officials, conservation authorities and airport bosses would hold exchanges with their Kuwaiti counterparts to further boost cooperation.

The chief executive noted that ties between the SAR and the Middle East are continuing to grow, while hailing the city as a ""trusted partner"" of Kuwait.

""Free trade is among our great competitive advantages, fuelling our success for the past two centuries. Hong Kong is a free port and we will continue to be a free port,"" Lee said. 

""Like our country, we are a vocal advocate of a multilateral, rules-based global economy, in spite of mounting protectionism and geopolitical tensions.""

Lee also said Hong Kong is seeking to open a second trade office in the Gulf Cooperation Council region.

He added the ""burgeoning trade and investment cooperation"" would help the two sides reach a free trade agreement."
菲國中期選舉初步結果顯示總統小馬可斯所在陣營參議院選情遜預期,2025-05-14 18:36,,2025-05-14 18:45,cinternational,rthk,https://news.rthk.hk/rthk/ch/component/k2/1804618-20250514.htm,"菲律賓傳媒報道，中期選舉初步點票結果顯示，總統小馬可斯所在的陣營，參議院選情不及預期，前總統杜特爾特家族多人，贏得地方選舉。

根據超過97%的點票統計，小馬可斯陣營在今次中期選舉中，獲得參議院12個改選議席中的6席，杜特爾特陣營緊隨其後，獲得5席。其中一名當選議員，同時獲得兩個陣營支持，雙方均將其歸納為己方勝選議席；剩餘兩席由其他黨派獲得。當地之前多個民調機構預測，小馬可斯陣營有望贏得7至8個參議院席位。

在地方選舉中，杜特爾特在達沃市市長選舉中，以壓倒性優勢勝出，第八次當選該市市長。杜特爾特家族另有4名成員，分別贏得達沃市副市長、國會議員、市議員等職。

今年3月，杜特爾特在馬尼拉國際機場被捕，目前羈押在荷蘭海牙的國際刑事法院。根據菲律賓選舉法，候選人被捕，不會導致其失去參選資格，因此杜特爾特今次勝選具有法律效力。

傳媒分析，參議院選舉結果直接影響副總統莎拉的政治前途。莎拉於今年2月被眾議院彈劾，新一屆參議院將在今年稍後，對莎拉的彈劾案進行表決。彈劾案若要通過，需要在參議院獲得三分之二及以上議員支持。

除參議院選舉外，今次中期選舉亦改選眾議院全部議席，並將決定全國各省市地方官員職位人選。當局仍在點算餘下選票，選舉委員會表示，最終官方結果有望在本周內公布。"
孫玉菡：年中起落實分擔粵院舍服務計劃長者醫療費用,2025-05-14 18:30,,2025-05-14 18:45,local,rthk,https://news.rthk.hk/rthk/ch/component/k2/1804615-20250514.htm,勞工及福利局局長孫玉菡表示，今年年中起，會落實為廣東院舍照顧服務計劃下的長者分擔醫療費用。他說比較兩地院舍住宿及醫療成本，特區政府沒有因為這樣增加開支。至於在本地院舍新增「護理保健師」職級，孫玉菡說，明年會開辦相關課程，亦涉及修例，期望完善院舍員工晉升階梯，吸引新人入行。
習近平：旗幟鮮明反對單邊主義和霸凌行徑,2025-05-14 18:23,,2025-05-14 18:45,greater_china,rthk,https://news.rthk.hk/rthk/ch/component/k2/1804614-20250514.htm,國家主席習近平分別會見智利、哥倫比亞及巴西總統。其中，習近平會見國事訪問中國的巴西總統盧拉時表示，中國與巴西作為東、西半球兩大發展中國家，要加強在多邊機制協調配合，旗幟鮮明反對單邊主義，保護主義和霸凌行徑。另外，習近平重申，關稅戰、貿易戰沒有贏家。
警方拘4漢　涉大棠路小巴私家車相撞,2025-05-14 18:22,,2025-05-14 18:45,local,rthk,https://news.rthk.hk/rthk/ch/component/k2/1804616-20250514.htm,元朗大棠路上星期六有小巴及私家車相撞，小巴車身被人用硬物擊打案件，警方共拘捕4名男子，包括涉案小巴司機。警方指案件涉及同一小巴線的司機，因駕駛態度爭執，期間有人懷疑情緒失控，蓄意撞向私家車後逃去。
