title,date,summary,scrape_time,section,source,url,news_content
港鐵：來往堅尼地城站及柴灣站行車須額外多5至8分鐘,2026-02-06 08:28,,2026-02-06 09:00,local,rthk,https://news.rthk.hk/rthk/ch/component/k2/1842881-20260206.htm,港鐵表示，由於杏花邨站附近有信號設備運作不暢順，列車經過該路段要減慢車速，來往堅尼地城站及柴灣站的行車時間預計需要額外5至8分鐘。乘客請為行程預留充裕時間。
韓股早段急瀉5%　跌至4900點水平,2026-02-06 08:25,,2026-02-06 09:00,cfinance,rthk,https://news.rthk.hk/rthk/ch/component/k2/1842880-20260206.htm,"韓國股市連續兩日大幅下挫，首爾綜合指數失守5000點關口，創逾1星期新低。

指數較早時報4901點，跌261點，跌幅5.07%。"
日股沽壓持續　日經指數初段曾失守53000點,2026-02-06 08:25,,2026-02-06 09:00,cfinance,rthk,https://news.rthk.hk/rthk/ch/component/k2/1842879-20260206.htm,"日股連續3日捱沽，日經指數早段一度失守53000點關口，最多跌近870點，低見52950點。

指數較早時跌幅收窄至637點，報53181點，跌幅1.18%。"
趙民忠：市場不明朗持續　信保局見招拆招為中小企提供支援措施,2026-02-06 08:18,,2026-02-06 08:30,local,rthk,https://news.rthk.hk/rthk/ch/component/k2/1842878-20260206.htm,"政府近年積極協助中小企升級轉型，香港出口信用保險局擴大對本港電商的融資支援。信保局總監趙民忠接受本台節目《財經新思維》訪問時表示，有關支援計劃推出短短一年多，市場反應熱烈，累計發放貸款逾24億元。

趙民忠說，近年信保局與多家金融科技公司、再保險公司及銀行合作，為中小企在電商貿易貸款提供保障，由接單、買貨、付運至收帳，整個過程都受保，以鼓勵及支持港商獲得貿易融資，發展跨境電子商貿。

他又表示，中小企資產負債規模小，傳統貸款模式下，難以獲取融資，反而利用平台交易數據、物流等替代數據，能夠釐定適合的融資條件。他認為，未來傳統放貸模式與替代數據結合，風險控制條件會更好，信保局與銀行掌握不同數據並互相引證，有利信貸審批。

今年是信保局成立60周年，趙民忠指，過往信保局承保時嚴控風險，協助企業發展外貿。近年市場不明朗情況持續，面對不同風險，形容信保局「見招拆招」，為中小企提供支援措施。"
亞馬遜今年資本開支急增至2000億美元　盤後股價挫逾一成,2026-02-06 07:54,,2026-02-06 08:15,cfinance,rthk,https://news.rthk.hk/rthk/ch/component/k2/1842875-20260206.htm,"亞馬遜今年資本開支預算增至2000億美元，按年大增近53%，遠超市場預期的約1450億美元，拖累股價在美股收市後時段急挫逾一成。

微軟、Google母公司Alphabet、Meta相繼披露今年資本開支，顯示科技巨企短期內不會減慢人工智能(AI)大額投資，觸發市場憂慮。其中，Alphabet資本開支預算1750億至1850億美元，Meta介乎1150億至1350億美元。

亞馬遜上季盈利211.9億美元，按年升約6%，每股經調整盈利增至1.95美元，低於預期。收入升近14%至2133.9億美元，略高於預期。當中，雲業務AWS升約24%至355.8億美元，增速超出預期，是逾3年來最快。

集團預料，今季收入介乎1735億至1785億美元，經營利潤介乎165億至215億美元。"
乒乓球亞洲盃黃鎮廷和林兆恒在小組兩連勝,2026-02-06 07:30,,2026-02-06 07:45,csport,rthk,https://news.rthk.hk/rthk/ch/component/k2/1842873-20260206.htm,"在海南舉行的乒乓球亞洲盃，香港的黃鎮廷，以局數3:1擊敗日本球手張本智和，在男單取得小組兩連勝。

雙方在首兩局打成均勢，黃鎮廷把握力較佳，連贏兩局11:9，張本智和在第三局發揮出色，以11:3追回一局，但黃鎮廷在第四局再以11:8勝出，總比數3:1取勝。

林兆恒就以11:5、11:4及11:5，直落三局擊敗馬來西亞的對手，同樣在小組取得兩連勝。但隊友關文皓和何鈞傑，就不敵同組選手，錄得兩連敗。 

女單方面，杜凱琹以11:7、8:11、4:11和6:11，總局數1:3不敵國家隊的陳幸同；蘇籽童就在另一組以直落3局11:2、11:2和11:5，橫掃黎巴嫩的對手。

國家隊方面，孫穎莎3:0橫掃印度的巴特拉。王曼昱同樣3:0輕取日本的赤江夏星。王藝迪面對日本小將長崎美柚，就以1:3不敵對手。小將陳熠同樣以1:3輸予日本「削球手」橋本帆乃香。

男子隊方面，王楚欽3:1擊敗中國台北的馮翊新。在主場之利的林詩棟3:0戰勝17歲的中國台北隊小將郭冠宏。"
美元指數創近兩星期新高　英鎊及歐元議息後偏軟,2026-02-06 07:08,,2026-02-06 07:15,cfinance,rthk,https://news.rthk.hk/rthk/ch/component/k2/1842872-20260206.htm,"美元指數上試98關口，高見97.963，升約0.3%，創近兩星期新高。

英倫銀行及歐洲央行一如預期維持利率不變，英倫銀行以5比4票通過利率決定，反映委員看法分歧大。英鎊兌美元失守1.36水平，低見1.3518，跌約1%，較早時徘徊1.353。

歐元兌美元跌穿1.18，跌至1.177附近，跌約0.2%。

在紐約尾市，澳元及新西蘭元兌美元跌近0.9%，分別報0.693及0.595。美元兌加拿大元於1.37水平上落。

美元兌日圓升穿157關口，高見157.33，升0.3%，反映日圓弱勢持續。

另外，美國就業數據疲弱程度超出預期，美國10年期債息跌穿4.2厘，低見4.186厘，跌逾9個基點，創近3星期新低。30年期債息跌至4.843厘。兩年期債息失守3.5厘，低見3.459厘，跌10個基點，創約1個月低位。"
英美期油低收近3%　美伊快將舉行會談　紓緩供應擔憂,2026-02-06 07:07,,2026-02-06 07:15,cfinance,rthk,https://news.rthk.hk/rthk/ch/component/k2/1842868-20260206.htm,"國際油價顯著回吐，結束兩日升勢。美國與伊朗同意在阿曼舉行會談，紓緩市場對原油供應的擔憂。

倫敦布蘭特期油4月合約收報每桶67.55美元，跌1.91美元，跌幅逾2.7%。

紐約期油3月合約收報每桶63.29美元，跌1.85美元，跌幅逾2.8%。"
港股美國預託證券急挫　ATMXJ跌逾1%至逾3%,2026-02-06 07:07,,2026-02-06 07:15,cfinance,rthk,https://news.rthk.hk/rthk/ch/component/k2/1842866-20260206.htm,"港股美國預託證券(ADR)顯著下挫。

阿里巴巴ADR比本港昨日收市價急跌逾3%，以港元計折合報154.1元。ATMXJ其餘股份ADR跌幅介乎逾1%至逾2%。

金融股沽壓亦大，滙控ADR跌約2%，折合報135.8元。友邦及平保ADR跌逾1%，內銀股ADR跌約1%或以上。"
金價失守4800美元　銀價急挫近兩成,2026-02-06 07:07,,2026-02-06 07:15,cfinance,rthk,https://news.rthk.hk/rthk/ch/component/k2/1842867-20260206.htm,"黃金及白銀價格再度下挫，美元升至近兩星期高位，拖累金價表現。貴金屬價格近期劇烈波動，摩根大通警告，白銀估值過高，或引發更大幅度回調。

現貨金結束兩日升勢，失守每盎司4800美元，較早時報4759.17美元，跌4%。

紐約期金4月合約收報每盎司4889.5美元，跌1.2%。

現貨白銀跌至每盎司70美元水平，低見70.63美元，急挫近20%。"
英股回吐0.9%　德股連跌3日,2026-02-06 07:06,,2026-02-06 07:15,cfinance,rthk,https://news.rthk.hk/rthk/ch/component/k2/1842865-20260206.htm,"歐洲股市下挫，意大利及西班牙股市沽壓較大，跌近2%。企業業績參差，另外，歐洲央行一如預期維持利率不變，強化市場對政策維持穩定一段時間的預期。

英國富時100指數自紀錄高位回吐，收報10309點，跌93點，跌幅0.9%。

德國DAX指數收報24491點，跌111點，跌幅近0.5%，連跌3日，創1星期低位。

法國CAC指數先升後回，收報8238點，跌23點，跌幅約0.3%。"
比特幣急挫至約6.22萬美元　年內累計跌27%,2026-02-06 07:06,,2026-02-06 07:15,cfinance,rthk,https://news.rthk.hk/rthk/ch/component/k2/1842871-20260206.htm,"貴金屬及科技股被拋售，風險偏好轉弱，比特幣價格亦持續下挫。

比特幣一度跌至約6.22萬美元，創2024年10月中以來最低，跌幅逾14%，較早時徘徊6.37萬美元，今年累計跌27%。

按市值計第二大加密貨幣以太幣較早時亦跌13%。

外電引用數據供應商CoinGlass數據指，過去24小時有約10億美元比特幣倉位被強制平倉。

另一市場數據指，全球加密貨幣市值自高位累計蒸發2萬億美元，單是過去1個月已蒸發約8000億美元。"
Amazon shares dive as costs climb along with revenue,2026-02-06 07:03,,2026-02-06 07:15,efinance,rthk,https://news.rthk.hk/rthk/en/component/k2/1842869-20260206.htm,"Amazon shares dove more than 8 percent on Thursday as the computing and retail titan reported strong sales but raised spending estimates.

Amazon reported a profit of US$21.2 billion on net sales of US$213.4 billion in the recently ended quarter as its AWS cloud computing, retail, advertising, and chips businesses thrived.

""With such strong demand for our existing offerings and seminal opportunities like AI, chips, robotics, and low-earth orbit satellites, we expect to invest about US$200 billion in capital expenditures across Amazon in 2026,"" said Amazon chief executive Andy Jassy.

Market analysts had forecast that Amazon capital expenditures would reach about US$147 billion this year, mostly due to AI spending initiatives.

Amazon Web Services (AWS) unit sales in the quarter tallied US$35.6 billion, a 24 percent jump from the same period a year earlier, according to earnings figures.

Like other tech giants, Amazon is making massive investments to grab a slice of the AI revolution pie.

It is particularly banking on the performance of AWS, the world's leading cloud provider, which is engaged in a race against its fast-growing rivals, Microsoft Azure and Google Cloud.

Spending on developing new AI-based chips and services is growing exponentially. In December, Amazon announced that it would invest more than US$35 billion in India.

The earnings release comes on the heels of Alphabet and Microsoft reporting that they are seeing cloud computing demand surge and are continuing to invest heavily on infrastructure supporting the technology.

Both Alphabet and Microsoft shares have suffered despite robust quarterly earnings as investors focused on billions of dollars they are pumping into cloud computing and artificial intelligence.

The tech giants are all making huge investments to build up their AI computing capabilities, money that the companies insist will be justified by increasing adoption of AI tools and applications by customers across the globe.

Amazon announced last week that it would be cutting 16,000 jobs worldwide as part of a restructuring, as it focuses spending on artificial intelligence.

The job cuts, which follow already flagged plans to cut its workforce by 14,000 posts, are aimed at ""reducing layers, increasing ownership, and removing bureaucracy,"" senior vice president Beth Galetti said in a statement.

An overall elimination of 30,000 jobs would amount to nearly 10 percent of the 350,000 office jobs at Amazon, where distribution and warehouse workers make up the bulk of its 1.5 million employees. (AFP)"
European Central Bank keeps rates unchanged,2026-02-06 06:53,,2026-02-06 07:15,efinance,rthk,https://news.rthk.hk/rthk/en/component/k2/1842852-20260206.htm,"The European Central Bank left interest rates on hold as expected on Thursday, playing down the impact of dollar moves on its future policy choices and stressing that its inflation outlook remained largely unchanged.

The euro zone's central bank has been on hold since ending a year-long run of rate cuts in June, and surprisingly resilient growth coupled with easing price pressures have taken nearly all pressure off policymakers to provide any further support.

In a statement, the ECB acknowledged continued uncertainties around global trade policy and geopolitical tensions but said an updated assessment ⁠still saw inflation stabilising at its 2 percent target in the medium term.

""We are in a broadly balanced situation at the moment,"" ECB President Christine Lagarde told a press conference of upside and downside risks to that outlook, reaffirming that monetary policy remained in a ""good place"".

Asked what impact on its outlook last week's dollar tumble and rebound might have, Lagarde said the rate-setting Governing Council had discussed the matter but noted that dollar depreciation was not new and went back as far as March 2025.

""In the last few weeks, in fact since the summer, it has fluctuated in a range,"" she said, adding policymakers had therefore concluded that foreign exchange rate moves since last year were ""incorporated in our baseline"".

A strong euro relative to the dollar lowers import costs, especially for energy, curbing inflation at a time when it is already below target, if only temporarily. With the dollar dip unwinding in recent days, the euro is actually weaker on a trade-weighted basis than at the ECB's December ⁠meeting, reinforcing market and economist expectations for no interest rate changes in 2026, followed by some policy tightening later in 2027. 

Lagarde repeated the bank's official line that policy would be data-dependent and that it had no pre-determined rate path.

Inflation, the ECB's primary focus, slipped to 1.7 percent across the euro zone last month on lower energy costs, and could dip further before a forecast rebound next year, stirring memories of the ECB's struggle to rekindle price growth for the decade before the Covid pandemic.

But if anything, longer-term inflation expectations have been inching up, not down, on solid activity data and energy price rises.

The euro zone has proven surprisingly resilient to trade strife as domestic consumption seems to be taking up the slack created by weak exports and poor industrial production.

Given exceptionally high domestic savings and a strong labour market, economists expect consumption to keep ⁠the bloc growing, with the German government's planned fiscal splurge on defence and infrastructure a further push to expansion. (Reuters)"
US stocks fall on tech valuation fears,2026-02-06 06:24,,2026-02-06 06:45,efinance,rthk,https://news.rthk.hk/rthk/en/component/k2/1842864-20260206.htm,"Stocks on Wall Street fell broadly on Thursday, pulled down again by growing worries that hefty AI investments by tech heavyweights may not pay dividends as soon as hoped.

Risk aversion also spilled into Bitcoin, which slumped to around US$65,000 and is now down nearly 50 percent from its record high above US$126,000 in October.

In Europe, the Bank of England and the European Central Bank both kept benchmark interest rates on hold as expected, as inflation pressures ease.

The euro retreated modestly against the dollar, but the British pound slid as Prime Minister Keir Starmer fights for his political life due to a storm of protest at his appointment of Peter Mandelson as ambassador to the United States, despite knowing about his close ties to convicted sex offender Jeffrey Epstein.

On equity markets, investor caution remains high after AI company Anthropic unveiled a tool that could be used by firms to carry out legal work.

The announcement on Tuesday hit numerous software stocks, underscoring investor fears that AI advances could render current technologies obsolete.

But analysts have called the sell-off indiscriminate and noted that there had already been a general shift out of tech following years of eye-watering gains.

Financial updates from Alphabet, ARM and Microsoft have fuelled that move, as questions are raised about the wisdom of pumping hundreds of billions into artificial intelligence projects with little idea about the timing of returns.

""The market continues to scream: stop spending,"" said Swissquote analyst Ipek Ozkardeskaya.

Big Tech companies are saying they need to spend more to meet expected AI computing demand, ""but at the end of the day, investors have the last word,"" she added.

Most of the so-called ""Magnificent Seven"" equities that led stocks in 2025 faltered on Thursday. The biggest losers in the group were Microsoft and Amazon, which slumped 5.0 percent and 4.4 percent respectively.

""It'll take something to break this fever,"" B Riley Wealth Management's Art Hogan said of the pullback in tech, adding that a rebound might need to wait until investors conclude the selling is ""overdone.""

Silver prices tanked around 14 percent on Thursday as a sell-off in precious metals resumed after a brief spell of calm following massive selling when records were reached last week.

Gold, traditionally seen as a safe haven, lost more than two percent.

Oil prices dropped nearly three percent after Iran and the United States said nuclear talks would go ahead in Oman this week.

The news soothed investor concerns sparked by a report on Wednesday that the bitter foes would not meet owing to a row about the format and the venue, which sent the price of both main contracts up more than three percent.

The S&P 500 fell 1.2 percent, to 6,798, the Dow also fell 1.2 percent, to 48,908, while the tech-heavy Nasdaq fell 1.6 percent, to 22,540. (AFP)"
美股低收逾1%　納指創逾兩個月新低　AI相關股份捱沽,2026-02-06 05:56,,2026-02-06 06:15,cfinance,rthk,https://news.rthk.hk/rthk/ch/component/k2/1842863-20260206.htm,"美股3大指數跌逾1%收市，納指及標普500指數連跌3日。科技企業大額資本開支觸發憂慮，人工智能(AI)相關股份被拋售，黃金、白銀、石油、比特幣價格亦急挫。

美國去年12月JOLTS職位空缺減至654.2萬個，創逾5年新低，遠低於預期，11月數字亦下調；美國企業上月計劃裁員人數亦急升至約17年來同月新高，就業市場有降溫跡象。

道瓊斯指數失守49000點水平，最多跌逾670點，低見48829點，收報48908點，跌592點，跌幅1.2%，創約1星期新低。

納斯達克指數收報22540點，跌363點，跌幅1.59%，創逾兩個月新低。

標普500指數收報6798點，跌84點，跌幅1.23%，創逾半個月低位。繼納指之後，標普指數亦全數蒸發今年以來升幅，轉跌約0.7%，納指跌幅擴大至3%。

Alphabet預料今年資本開支倍增至最多1850億美元，股價跌0.5%收市。亞馬遜低收逾4%，收市後公布的業績披露，今年資本開支高達2000億美元，遠超預期，拖累盤後股價急瀉近9%。

AI相關股份、記憶體晶片股沽壓大，Nvidia跌逾1%，創近兩個月低位。AMD、微軟、Palantir、甲骨文、高通跌近4%至約8.5%。

比特幣價格急挫至6.2萬美元，拖累相關股份表現。Coinbase Global跌逾13%收市。

消費類股份普遍造好，寶潔、強生、可口可樂升逾1%。"
新油麻地公眾貨物裝卸區無人躉船起火　消防正滅火,2026-02-06 05:51,,2026-02-06 06:15,local,rthk,https://news.rthk.hk/rthk/ch/component/k2/1842862-20260206.htm,"新油麻地公眾貨物裝卸區有躉船起火，船上無人。

事發在凌晨4時許，警方接報指該處一艘躉船上有金屬物料起火，當時船上無人。

消防處表示正進行滅火行動，提醒市民如受到隨風飄散的煙霧和異味影響，可關閉門窗及保持鎮定。"
特朗普談及新削減戰略武器條約　稱應著手制定改進而現代化新條約,2026-02-06 05:49,,2026-02-06 06:15,cinternational,rthk,https://news.rthk.hk/rthk/ch/component/k2/1842861-20260206.htm,"美國總統特朗普在社交媒體發文說，與其延長在星期四到期的美俄新削減戰略武器條約，更應該著手制定一項改進而現代化，並能長期有效的新條約。

俄羅斯克里姆林宮發言人佩斯科夫較早時表示，俄方對新削減戰略武器條約到期，表示遺憾，又說在戰略穩定的問題上，俄羅斯將一如既往地遵循自身國家利益。

俄美兩國在2010年簽署新削減戰略武器條約，旨在限制兩國部署的核彈頭及運載工具數量。條約於2011年2月5日正式生效，原定有效期10年，後經協商延長至今年2月5日。"
施紀賢稱輕信謊言　向愛潑斯坦案受害者致歉,2026-02-06 05:12,,2026-02-06 05:45,cinternational,rthk,https://news.rthk.hk/rthk/ch/component/k2/1842859-20260206.htm,"英國首相施紀賢就執政工黨原重要人物文德森，牽涉美國已故富商愛潑斯坦案引發的風波發表講話，指他先前輕信文德森的謊言，並任命對方為駐美大使，為此向愛潑斯坦案受害者致歉。

施紀賢就在英格蘭東薩塞克斯郡一場講話中表示，外界之前已知文德森與美國已故富商愛潑斯坦相識，但最新披露的資料顯示，雙方關係的密切程度遠超想像，令人擔憂。他說理解國會內外的質疑及不滿情緒，將認真應對相關問題。

施紀賢又說希望在不影響警方調查的前提下，公布當初任命文德森時所依據的安全審查意見，強調不會採取任何可能妨礙司法程序的行動。"
俄烏美三方新一輪會談結束　俄烏於核心問題未取得實質進展,2026-02-06 03:32,,2026-02-06 03:45,cinternational,rthk,https://news.rthk.hk/rthk/ch/component/k2/1842858-20260206.htm,"俄羅斯、烏克蘭與美國三方於當地星期四在阿聯酋首都阿布扎比，結束為期兩日的新一輪會談。俄烏在領土、停火等核心問題上，未取得實質進展，亦未就相關政治與安全議題，發表聯合聲明。

會談結束當日，俄烏雙方完成新一輪交換被俘虜人員。根據雙方通報，俄烏各向對方移交157名被俘虜人員，共有314人，是近5個月來雙方首次進行大規模交換被俘虜人員。烏克蘭總統澤連斯基說，獲釋人員包括軍人和平民，已返回烏克蘭。

美國總統特使威特科夫表示，美烏俄三方代表就交換被俘虜人員問題，達成共識，又指會談具體並有建設性，但同時承認推動衝突全面解決，仍需付出更多努力。"
古巴國家主席稱已確立部署全民防禦準備計劃為優先事項,2026-02-06 01:50,,2026-02-06 02:15,cinternational,rthk,https://news.rthk.hk/rthk/ch/component/k2/1842855-20260206.htm,"古巴國家主席迪亞斯卡內爾表示，古巴已經將部署全民防禦準備計劃，確立為優先事項，計劃涵蓋古巴整個國土防禦體系的準備工作，涉及所有層級，目的在於全面提升古巴防禦準備水平。

迪亞斯卡內爾召開記者會公布有關決定。他說古巴正為可能在某個時刻需要進入戰爭狀態，作好準備，國家國防委員會已分析，並批准相關計劃與措施。

迪亞斯卡內爾又說，古巴願意在美國停止施壓、尊重古巴主權、獨立及自決權的前提下，就任何希望討論或交流的議題，與美國開展對話。"
美軍歐洲司令部稱美俄同意恢復高級別軍事對話,2026-02-06 01:26,,2026-02-06 01:45,cinternational,rthk,https://news.rthk.hk/rthk/ch/component/k2/1842853-20260206.htm,"美軍歐洲司令部發聲明表示，美國與俄羅斯於當地星期四在阿聯酋首都阿布扎比達成協議，同意恢復高級別軍事對話。

聲明說這條軍事溝通渠道，自烏克蘭危機升級前的2021年秋季暫停，近期在阿布扎比舉行的三方會談中，美軍歐洲司令部司令格林克維奇，與俄烏高級軍事官員進行討論，決定重啟該渠道。

聲明又指恢復軍事對話，為增加透明度及降低緊張局勢提供途徑。格林克維奇將作為北約歐洲盟軍最高司令，與俄羅斯武裝力量總參謀長格拉西莫夫保持溝通。"
印度有煤礦爆炸最少18死　疑似非法運作,2026-02-06 01:08,,2026-02-06 01:30,cinternational,rthk,https://news.rthk.hk/rthk/ch/component/k2/1842851-20260206.htm,"印度東北部梅加拉亞邦一個煤礦發生爆炸，最少18名工人死亡。

爆炸發生在星期四。當地傳媒引述警方表示，煤礦疑似非法運作，目前煤礦中仍有多人被困，事故原因仍在調查中。

印度總理莫迪在社交媒體發文，對在事故中喪生的工人表示哀悼，並表示會向死者家屬提供撫恤金。"
美俄據報正就繼續遵守新削減戰略武器條約談判　接近達協議,2026-02-06 00:18,,2026-02-06 00:30,cinternational,rthk,https://news.rthk.hk/rthk/ch/component/k2/1842850-20260206.htm,"美國與俄羅斯據報正就繼續遵守新削減戰略武器條約進行談判，接近達成協議。

美國一個新聞網站引述消息人士報道，美俄雙方在阿聯酋首都阿布扎比進行談判，協議草案仍需兩國總統批准。俄羅斯克里姆林宮發言人佩斯科夫表示，俄方對新削減戰略武器條約到期，表示遺憾，又說在戰略穩定的問題上，俄羅斯將一如既往地遵循自身國家利益。

俄美兩國在2010年簽署新削減戰略武器條約，旨在限制兩國部署的核彈頭及運載工具數量。條約於2011年2月5日正式生效，原定有效期10年，後經協商延長至今年2月5日。"
