title,date,summary,scrape_time,section,source,url,news_content
湖北官員稱當地經濟具韌性　今年全省新能源汽車產量可望破百萬輛,2025-05-23 07:12,,2025-05-23 07:30,greater_china,rthk,https://news.rthk.hk/rthk/ch/component/k2/1805888-20250523.htm,"中美經貿高層早前就降低雙邊關稅水平達成共識。在湖北省中外記者會上，被問到貿易戰的影響，湖北省商務廳一級巡視員陳華榮表示，湖北作為經濟大省，堅決落實國家以國內大循環為主體，國內國際雙循環相互促進的戰略部署，堅定不移擴大開放，以自身的高質量發展的確定性，來應對外部環境的不確定性。

陳華榮指出，今年首4個月，湖北進出口總值按年增長27.5 %，其中出口增長36.6%，彰顯當地經濟具有較強韌性。他說未來將拓展多元化國際市場、推進內外貿一體化、推動跨境電商創新發展，和增強產業國際競爭力，以支持當地外貿穩中求進發展。  

副省長程用文說，湖北製造業底子厚實，始終圍繞經濟發展的新領域、新賽道，會因地制宜培育和發展新質生產力。

程用文表示，湖北產業發展重點之一，是傳統產業升級轉型，推進數字賦能和繼續改造換新，形容要打好鋼鐵、化工和汽車的轉型攻堅戰，提到今年全省的新能源汽車產量有望突破100萬輛。

他又說，當地同時不斷壯大新興產業，實施「產業倍增計劃」，數字經濟規模佔整體GDP超過50%，並已形成集成電路、新型顯示、下一代信息網絡及生物醫藥四個國家級戰略性新興產業群，亦前瞻佈局人形機器人、6G、氫能、生物製造等25個重點領域。

湖北省發改委副主任毛明天提到，未來將積極支持新能源汽車產業的發展，加大對電池技術、智能駕駛等的研發投入，打造全國重要的新能源與智能網聯汽車產業基地。"
莫迪歷宣布世冠盃後離開皇馬　般奴稱若曼聯需要他套現或離隊,2025-05-23 07:06,,2025-05-23 07:15,csport,rthk,https://news.rthk.hk/rthk/ch/component/k2/1805889-20250523.htm,"效力了西甲皇家馬德里13個球季的莫迪歷宣布，將於今夏世界冠軍球會盃之後，離開這支豪門。

曼聯隊長般奴費蘭迪斯說，如果球會需要他套現，可能會離隊。"
港股美國預託證券與本港收市比較個別發展,2025-05-23 06:28,,2025-05-23 06:45,cfinance,rthk,https://news.rthk.hk/rthk/ch/component/k2/1805887-20250523.htm,"港股美國預託證券（ADR）與本港收市比較個別發展。

金融股方面，滙控ADR較本港收市升逾0.4%。

至於科技股，ATMXJ的ADR多數較本港收市下跌，騰訊跌近1%。"
油價下跌　市場關注OPEC+考慮增產,2025-05-23 06:26,,2025-05-23 06:45,cfinance,rthk,https://news.rthk.hk/rthk/ch/component/k2/1805885-20250523.htm,"國際油價下跌，市場關注石油輸出國組織及其盟友（OPEC+）可能進一步增產。

倫敦布蘭特期油收市報每桶64.44美元，跌47美仙，跌幅0.7%。

紐約期油報每桶61.2美元，跌37美仙，跌幅0.6%。"
金價回落　因美元上升及投資者沽貨獲利,2025-05-23 06:26,,2025-05-23 06:45,cfinance,rthk,https://news.rthk.hk/rthk/ch/component/k2/1805884-20250523.htm,"金價回落，因美元上升，加上投資者在高位沽貨獲利。

現貨金一度升至每盎司3345美元以上，較早時報3294.1美元，跌幅0.6%。

紐約期金收市報每盎司3295美元，跌幅逾0.5%。"
以駐美使館2名工作人員遭槍擊身亡　30歲疑犯被控一級謀殺,2025-05-23 06:20,,2025-05-23 06:30,cinternational,rthk,https://news.rthk.hk/rthk/ch/component/k2/1805886-20250523.htm,"以色列駐美國使館兩名工作人員，在首都華盛頓中槍身亡，30歲、來自芝加哥的疑犯羅德里格斯，星期四在聯邦法院被控兩項一級謀殺罪。另外，他又被指控謀殺外國官員、持槍致他人死亡以及在暴力犯罪中使用槍支。

事發在當地星期三晚，兩名以色列大使館工作人員出席完博物館活動離開時遭到槍擊身亡。華盛頓警方說，羅德里格斯開槍後走入博物館，被保安人員制服時高叫支持巴勒斯坦自由的口號，當局將調查他與恐怖主義有否聯繫。

槍擊事件發生後，以色列要求所有駐外機構外交官暫停公共活動，並加強駐世界各地大使館的安全工作。總理內塔尼亞胡表示，為受害者家屬感到心痛，要盡最大努力打擊反猶太主義和針對以色列的野蠻煽動行徑。"
美股收市個別發展　美債息回順,2025-05-23 06:18,,2025-05-23 06:30,cfinance,rthk,https://news.rthk.hk/rthk/ch/component/k2/1805882-20250523.htm,"美股3大指數走勢反覆，收市個別發展，美國國債孳息率自近期高位回落，大型科技股多數造好。

道瓊斯指數初段最多曾跌近150點，尾市重上42000點水平，升230點，但最終蒸發全數升幅，收市報41859點，跌1點，連跌3個交易日。納斯達克指數一度升1%，收市報18925點，升53點，升幅約0.3%。標準普爾500指數報5842點，跌2點。

Tesla升近2%，Nvidia和亞馬遜升近1%。Alphabet一度創3個月高位，收市升約1.4%。但蘋果偏軟。

市場近期憂慮美國債務情況推高美債息，令股市受壓。在美國眾議院通過總統特朗普的稅收和支出議案後，債息回落紓緩股市壓力。10年期債息一度高見4.629厘，創逾3個月高位，其後回落至4.5厘水平。30年期債息高見5.161厘，創2023年10月以來高位，其後回軟至5厘水平。"
美元回升　歐元受經濟數據疲弱拖累,2025-05-23 06:18,,2025-05-23 06:30,cfinance,rthk,https://news.rthk.hk/rthk/ch/component/k2/1805883-20250523.htm,"美元回升，歐元因經濟數據疲弱而受壓，美國眾議院通過總統特朗普大規模稅收與支出削減議案，市場謹慎態度限制美元升幅。

美元指數曾重上100水平，高見100.11，在紐約尾市升逾0.3%，報99.921。

歐元兌美元尾市跌0.4%，報1.128美元，數據顯示，歐元區5月企業活動出乎市場預期收縮。

美元兌日圓一度跌逾2星期低位，低見142.81日圓，在紐約尾市回升逾0.2%，報143.98日圓。

英鎊兌美元大致持平，較早時報1.3414美元。

比特幣再創新高，一度升至逾11.19萬美元，其後在11.1萬美元附近徘徊。"
英德股市結束5日升勢　債息上升及經濟數據弱令大市受壓,2025-05-23 05:17,,2025-05-23 05:30,cfinance,rthk,https://news.rthk.hk/rthk/ch/component/k2/1805880-20250523.htm,"歐洲主要股市收市下跌，德國和英國股市結束連續5日升勢。德國長債息創2個月新高，歐元區債息亦微升，加上歐元區綜合採購經理指數（PMI）初值跌至收縮水平，都令股市受壓。

德國DAX指數報23999點，跌123點，跌幅0.5%。

英國富時100指數報8739點，跌47點，跌幅0.5%。

法國CAC指數報7864點，跌46點，跌幅近0.6%。"
港鐵︰將軍澳綫今日維持正常服務,2025-05-23 05:16,,2025-05-23 05:30,local,rthk,https://news.rthk.hk/rthk/ch/component/k2/1805881-20250523.htm,港鐵表示，將軍澳綫今日維持正常服務。
US stocks mixed as bond yields moderate,2025-05-23 04:53,,2025-05-23 05:15,efinance,rthk,https://news.rthk.hk/rthk/en/component/k2/1805877-20250523.htm,"Wall Street stocks finished mixed on Thursday as US Treasury bond yields moderated following House passage of US President Donald Trump's mammoth tax cut legislation.

A spike on Wednesday in yields on 10- and 30-year US bonds sent stocks sharply lower amid revived worries about a sell-off in US assets comparable to one earlier this spring before Trump retreated from some of his most onerous tariffs.

But bond yields retreated somewhat later on Thursday, boosting equities a little.

The Dow Jones finished flat at 41,859.

The S&P 500 lost less than 0.1 percent at 5,842, while the Nasdaq climbed 0.3 percent to 18,925.

The rise in yields had ""gone a little bit too far,"" said Victoria Fernandez, chief market strategist at Crossmark Global Investments.

The bill extends for 10 years tax cuts enacted under Trump's 2017 legislation, while enacting cuts to social safety net programmes.

While investors welcome the tax cuts, they have been unnerved by forecasts that the proposal will add trillions of dollars in US debt.

Fernandez noted that the Senate will now weigh in on the bill, which could mean big changes.

""I still think we're quite a ways from seeing what actually happens,"" she said.

Jack Ablin of Cresset Capital Management said the shift in the bond market also reflects short-term dynamics after Wednesday's poor US Treasury auction sent yields sharply higher.

""Investors are turning their attention back to the day rather than the structural dynamics,"" Ablin said.

Among individual companies, Nike rose 2.2 percent after announcing it will increase prices on many items in the United States next month, but did not blame President Donald Trump's tariffs for the move. (AFP)"
英國簽署協議將查戈斯群島主權移交毛里求斯,2025-05-23 04:49,,2025-05-23 05:00,cinternational,rthk,https://news.rthk.hk/rthk/ch/component/k2/1805879-20250523.htm,"英國首相施紀賢簽署協議，正式將查戈斯群島主權移交給毛里求斯。

根據協議，位於該地區的迪戈加西亞軍事基地，將由毛里求斯租借給英國和美國。施紀賢說，作出簽署決定的原因屬高度機密，又說如果不達成協議，毛里求斯可能會將英國告上國際法庭，而英國可能會敗訴，並面臨額外處罰。

英國高等法院星期四凌晨一度臨時叫停有關協議的簽署，但禁令到當日下午撤銷。美國國務卿魯比奧對協議的簽署表示歡迎。毛里求斯亦歡迎歸還查戈斯群島的協議，總理拉姆古蘭形容是偉大勝利。

查戈斯群島位於毛里求斯東北面的印度洋西南海域，毛里求斯1965年向英國殖民當局割讓。英國其後將主島迪戈加西亞租給美國建空軍基地，驅逐大約2000名居民。"
美國加州小型飛機墜毀　最少2死8傷,2025-05-23 03:53,,2025-05-23 04:15,cinternational,rthk,https://news.rthk.hk/rthk/ch/component/k2/1805878-20250523.htm,"一架小型飛機星期三在美國加州聖迭戈一個軍事住宅區墜毀，造成最少2人死亡，8人輕傷，多處房屋被毀。

當地消防說，事發時，一架塞斯納550型號飛機撞毀大約15棟房屋，引發多處住宅和車輛起火。當局說，由於墜機造成燃油泄漏，附近社區近100人撤離。"
以色列要求所有駐外機構外交官暫停公共活動,2025-05-23 03:36,,2025-05-23 03:45,cinternational,rthk,https://news.rthk.hk/rthk/ch/component/k2/1805875-20250523.htm,"以色列駐美國使館兩名工作人員，在首都華盛頓猶太博物館外中槍身亡後，以色列要求所有駐外機構外交官暫停公共活動，以色列駐世界各地的大使館亦加強安全工作。

事發在當地星期三晚，一男一女以色列大使館工作人員出席完博物館活動離開時遭到槍擊殺害，疑犯其後走入博物館，被制服時高叫支持巴勒斯坦自由的口號。警方確認，拘捕來自芝加哥的30歲疑犯羅德里格斯，將調查他與恐怖主義有否聯繫。

聯合國秘書長古特雷斯強烈譴責針對外交官員的襲擊行為令人髮指。白宮發言人萊維特說，總統特朗普星期四與以色列總理內塔尼亞胡通話，雙方討論包括華盛頓槍擊案等。特朗普認為，事態正朝著正確方向發展。"
七國集團財長會結束　歐盟官員稱氣氛積極富建設性,2025-05-23 03:11,,2025-05-23 03:30,cinternational,rthk,https://news.rthk.hk/rthk/ch/component/k2/1805874-20250523.htm,"七國集團財長會結束在加拿大班夫為期三天的會議，外電報道，會議淡化各國盟友之間就美國特朗普政府貿易關稅問題產生的分歧，並就烏克蘭問題尋求共識。

法新社引述一名外交消息人士報道，預料七國集團將在會議結束時發表聯合聲明，將聚焦能否克服貿易戰引發的緊張局勢。

歐盟經濟事務主管東布羅夫斯基斯形容，會議氣氛積極及富有建設性。他說，官員在許多問題上都取得進展，包括全球經濟、解決不平衡問題以及應對俄烏戰事問題。

烏克蘭財長馬爾琴科敦促七國集團繼續對俄羅斯施壓。"
美國宣布取消哈佛大學招收國際學生資格　現有外國學生須轉學,2025-05-23 02:49,,2025-05-23 03:00,cinternational,rthk,https://news.rthk.hk/rthk/ch/component/k2/1805873-20250523.htm,"美國國土安全部發表聲明，表示美國政府已經取消哈佛大學招收國際學生的資格，並要求現有的外國學生轉學，否則將失去合法身份。

聲明說，國土安全部長諾姆下令終止哈佛大學學生和交流訪客計劃的認證。

哈佛大學回應說，政府的行為是非法，屬報復性行動，可能對大學造成嚴重損害。校方在聲明表示，將全力維持哈佛大學接收國際學生和學者的能力，目前這些學生和學者來自140多個國家，為哈佛大學乃至整個國家帶來巨大貢獻。"
美國中情局總部外保安人員開槍擊傷1名女子,2025-05-23 02:21,,2025-05-23 02:45,cinternational,rthk,https://news.rthk.hk/rthk/ch/component/k2/1805872-20250523.htm,"美國中情局保安人員在位於弗吉尼亞州的總部外，開槍擊傷一名女子，這名女子已經被拘留。

美國傳媒報道，當地星期四凌晨，一名女子駕駛汽車接近中情局正門時，被中情局保安人員開槍擊傷，暫時不清楚開槍原因。

警方說，槍擊屬非致命性，中情局正調查事件。中情局表示，這宗是安全事件，執法部門已經作出相應行動，總部大樓已經關閉。"
土耳其將向敘利亞供應大量電力和天然氣,2025-05-23 01:42,,2025-05-23 02:00,cinternational,rthk,https://news.rthk.hk/rthk/ch/component/k2/1805870-20250523.htm,"土耳其能源部長巴伊拉克塔爾在敘利亞首都大馬士革宣布，土耳其將向敘利亞供應大量電力和天然氣，以緩解敘利亞能源短缺問題。

巴伊拉克塔爾當地星期四訪問敘利亞，同能源部門負責人巴希爾就加強兩國能源合作簽署協議。巴伊拉克塔爾說，土耳其希望在未來幾個月大幅增加對敘利亞電力出口，又會每年向敘利亞供應20億立方米天然氣。

巴希爾表示，敘土兩國正致力完成一項天然氣管道建設，希望下月開始運營，將有助於增加敘利亞的發電量。"
伊朗外長︰毫不猶豫對任何侵犯行為作出強力回應,2025-05-23 01:13,,2025-05-23 01:45,cinternational,rthk,https://news.rthk.hk/rthk/ch/component/k2/1805869-20250523.htm,"伊朗外長阿拉格齊表示，伊朗將毫不猶豫地對任何侵犯行為作出強力回應，並將不惜一切代價保護其利益和人民。

阿拉格齊在社交平台回應有關以色列計劃攻擊伊朗及其核設施的報道，形容計劃令人震驚，聯合國安理會和國際原子能機構應該嚴厲譴責。他說，已就事件致函聯合國秘書長古特雷斯和國際原子能機構總幹事格羅西，強調做法是對以色列的嚴正警告。他又說，伊朗將採取特別措施保護核設施。

伊朗傳媒引述武裝部隊總參謀長巴蓋里警告，伊朗武裝部隊目前正在生產一系列無人機和微型飛機，伊朗將對任何威脅作出相稱的回應。"
美國加州一架小型飛機墜毀　暫未知傷亡情況,2025-05-23 00:42,,2025-05-23 01:00,cinternational,rthk,https://news.rthk.hk/rthk/ch/component/k2/1805868-20250523.htm,"一架小型飛機星期三在美國加州聖迭戈一個軍事住宅區墜毀，暫時未知傷亡情況。

當地消防說，一架塞斯納550型號飛機撞毀大約15棟房屋，引發多處住宅和車輛起火。救援人員仍在搜尋機上人員和房屋的居民。當局說，由於墜機造成燃油泄漏，多個社區要疏散。"
日本自衛隊上周墜機事故　兩名失蹤飛行員確認死亡,2025-05-23 00:13,,2025-05-23 00:30,cinternational,rthk,https://news.rthk.hk/rthk/ch/component/k2/1805866-20250523.htm,"日本航空自衛隊確認，本月14日在愛知縣訓練機墜毀事故中失蹤的兩名機組人員已經死亡，兩人都是宮崎縣新田原基地第5航空團的飛行員。

事發在當日下午，航空自衛隊一架T-4型訓練機，從愛知縣小牧基地起飛約2分鐘後從雷達畫面消失，隨後墜入愛知縣犬山市的一處農業灌溉用的大型蓄水池。防衛省初步判斷飛機起飛後不久即發生故障。

目前，搜救人員已經打撈出疑似失事飛機的主翼、水平尾翼等殘骸，並在水中發現疑似飛機引擎的物體。事故原因仍在調查。"
消防指將軍澳綫事故沒人受傷　將檢查涉事列車,2025-05-23 00:09,,2025-05-23 00:15,local,rthk,https://news.rthk.hk/rthk/ch/component/k2/1805865-20250523.htm,"就港鐵將軍澳綫故障事宜，消防處表示，事故中沒有人受傷，會繼續聯同港鐵公司了解事故發生原因，稍後亦與港鐵工程人員檢查涉事列車。

發言人表示，在下午5時16分接報，指港鐵鰂魚涌站至油塘站隧道管道內有火警發生，其後派出消防車到油塘站及鰂魚涌站調查，救護車亦到場戒備。

消防處人員與港鐵職員在來往油塘站至鰂魚涌站兩條管道內徹底檢查，均沒有發現任何曾有火警發生的跡象，在下午7時31分發出停止動員訊息。"
'Short circuit triggers major disruption on TKO Line',2025-05-22 23:49,,2025-05-23 00:00,elocal,rthk,https://news.rthk.hk/rthk/en/component/k2/1805864-20250522.htm,"MTR officials on Thursday apologised for the inconvenience caused by the five-hour disruption of the Tseung Kwan O Line and revealed there were signs of a short circuit in overhead cable components. 

Speaking at a press briefing, the railway company said the disruption began at 5.15pm when a circuit breaker tripped in the tunnel between Yau Tong and North Point stations.

The incident led to a cascade of failures affecting signal systems across the line, including routes to Po Lam and Lohas Park, the MTR said.  

KH Lee, the MTR's chief of operations engineering maintenance, said preliminary investigations showed signs of a short circuit in overhead cable components, with passengers reporting flashes, smoke, and noise. 

""As there are a number of trains involved in the particular section of the traction stone, we have to remove the train one by one. And in the course of the train removal, we also found the flashover, and causing the overhead line to trip again,"" he said. 

""After all the trains were removed from the site, we have a detailed inspection on the concerned section, and we also find the flashover mark. We will have a further investigation and inspection on the concerned section.""  

Cheris Lee, who heads the corporation's operating and metro segment, said the situation was complicated by a traffic accident in the tunnel area. 

""The incident happened during the late peak hours and there was very serious traffic congestion outside the Tseung Kwan O area, especially through the tunnel,"" she said. 

""That's why traffic congestion in the area was very serious and also delaying the arrival of the shuttle buses. So we apologise for the inconvenience caused again."" 

Lee noted that more than 130 staff were deployed for crowd control and passenger assistance.

The Transport and Logistics Bureau said it has asked the MTR to thoroughly review its system and report to the Legislative Council on Monday."
陳美寶極度關注港鐵接二連三發生事故　要求全面檢視系統靭性,2025-05-22 23:29,,2025-05-22 23:45,local,rthk,https://news.rthk.hk/rthk/ch/component/k2/1805863-20250522.htm,"受到電力供應和信號系統故障影響，港鐵將軍澳綫服務受阻約5小時，一度全線暫停。運輸及物流局局長陳美寶表示，一向引以為傲香港的公共交通服務，對於港鐵近月接二連三發生事故，對市民大眾造成不便，表示極度關注。

陳美寶在社交網站表示，要求港鐵今晚收車後全速詳細檢察，確保明早服務全面恢復正常，並於日內就事故涉及架空電纜及訊號系統出現故障提交報告，以及全面檢視系統靭性以及風險評估、應變通報機制、維修保養等範疇，以避免事故再次發生。她又要求港鐵在下周一立法會鐵路事宜小組委員會就事件一併向議員及公眾交代。

她同時感謝巴士公司經運輸署協調下，在事故期間加開特別巴士路線及班次疏導人潮，並已指示運輸署今晚持續緊密與港鐵公司保持聯絡，以確保明早鐵路服務正常運作，及做好一切預案及應變措施的超前部署，加強向市民的訊息發放。"
王楚欽和孫穎莎晉級多哈世乒賽混雙4強,2025-05-22 23:23,,2025-05-22 23:45,greater_china,rthk,https://news.rthk.hk/rthk/ch/component/k2/1805862-20250522.htm,"在多哈舉行的世界乒乓球錦標賽混雙8強，國家隊組合王楚欽和孫穎莎，在先失一局下，3:1反勝日本組合松島輝空/張本美和，晉級4強。

王楚欽和孫穎莎首局先輸6:11，但兩人之後頂住壓力，連取3局11:9反勝晉級，繼續向「三連冠」的目標邁進。

兩人在4強將面對南韓的林鍾勛/申裕斌，這對南韓組合在8強賽中，以局數3:2擊敗中國台北組合林昀儒/鄭怡靜。"
食環署向冷氣機滴水造成衞生滋擾處所業主或住戶共發180張通知,2025-05-22 23:10,,2025-05-22 23:45,local,rthk,https://news.rthk.hk/rthk/ch/component/k2/1805861-20250522.htm,"政務司副司長卓永興主持「地區治理專組」第八次會議，跟進部分項目的實施進度及成果。

其中在打擊大廈冷氣機滴水方面，截至本月15日，食環署已視察306座私人樓宇和屋苑，向冷氣機滴水造成環境衞生滋擾的處所業主或住戶發出共180張「妨擾事故通知」。另外，路政署為36條行人天橋及隧道進行翻新和美化工程，當中26座構築物的工程已經完成。

「專組」在會議上亦檢視慶祝香港特別行政區成立28周年展示宣傳品的安排。卓永興表示，今年是回歸28周年，亦是《港區國安法》公布實施5周年，期望各部門同心同德，發揮完善地區治理的優勢，為節慶活動和盛事共同營造熱鬧歡樂氣氛，厚植愛國情懷。"
何立峰會見摩通行政總裁戴蒙　歡迎美資企業持續深化對華互利合作,2025-05-22 23:00,,2025-05-22 23:15,greater_china,rthk,https://news.rthk.hk/rthk/ch/component/k2/1805859-20250522.htm,"中共中央政治局委員、國務院副總理何立峰在釣魚台國賓館，會見美國摩根大通行政總裁戴蒙。

何立峰表示，近日中美經貿會談取得實質性進展，為兩國繼續開展經貿合作創造了條件，又指中國正著力構建全國統一大市場、形成新發展格局，將持續擴大高水平對外開放，歡迎包括摩通在內的美資企業，持續深化對華互利合作，繼續助力推動中美經貿關係健康穩定持續發展。

新華社報道，戴蒙積極評價美中經貿會談成果，表示願繼續深耕中國資本市場，更好服務跨國公司來華展業和中國公司海外發展。"
房委會：盡快安排承建商接手精進餘下工程　房協：協調善後工作,2025-05-22 22:58,,2025-05-23 09:00,local,rthk,https://news.rthk.hk/rthk/ch/component/k2/1805860-20250522.htm,"精進建築下月20日起從一般建築承建商名冊上除名。房委會表示，由「精進」負責而仍在建造階段的建築合約共三個，當中白田邨第十期項目約900個公屋單位大部份已入伙，部分非住用設施的工程有待完成。另外兩個項目，屯門第29區（西）及東涌第100區，共約6200個公屋單位的建築工程仍在進行。

房委會回覆查詢時表示，當「精進」從名册中除名，將不得繼續在房委會工地進行建築工程。房屋署會盡快安排其他合資格能勝任的承建商，接手仍在施工的餘下工程，以期在切實可行情況下盡快完成受影響房屋項目，並透過嚴謹機制監察承建商，確保建築的標準及質素完全符合法例規定及合約要求。若更換承建商涉及額外開支，房委會會保留向「精進」追討賠償的權利。

房委會表示，三個工程項目早前已延誤，加上現時終止合約和更換承建商，估計落成日期會再有延誤，難免對公屋綜合輪候時間有壓力。房委會會繼續以多方面措施提速落成其他公屋工程項目，以盡量降低影響。隨着「簡約公屋」項目今年第一季起陸續落成及可供編配，公屋綜合輪候時間會逐步下降，在2026/27年度降至4.5年的目標不變。

另外，房協表示，「精進」現時承造安達臣道R2-2資助出售房屋項目地盤的上蓋工程。房協爭取安排新承建商盡快在精進建築離場後兩個月內進場，接手完成餘下工程，預計對完成項目的時間影響不大。房協會做好風險及安全管理，協調善後工作，包括要求「精進」清楚交代已完成的建築工程範圍和相關紀錄，以及妥善處理和移交未完成的工程。
 
安達臣道R2-2地盤屬資助出售房屋項目，將提供約1400 個單位。在新承建商正式進場後，房協會繼續密切監察建築安全、質量和工程進度。房協亦會鼓勵接手的承建商優先考慮聘用原工友及分判商，以減低對他們的影響。"
