title,date,summary,scrape_time,section,source,url,news_content
趙偉仁：釐定醫委會業外委員比例要平衡專業自主及各界參與,2026-02-05 23:02,,2026-02-05 23:15,local,rthk,https://news.rthk.hk/rthk/ch/component/k2/1842848-20260205.htm,"申訴專員公署就醫委會秘書處工作及衞生署相關監管公布主動調查結果，指出數字反映醫委會處理投訴個案進度仍過於緩慢，個案長期積壓情況持續，有迫切需要認真檢討，徹底改善投訴處理流程，共提出21項改善建議。

申訴專員陳積志認為，包括可考慮借鏡其他地方處理有關投訴經驗，例如增加業外委員比例。

現時醫委會由24名醫生及8名業外委員組成。中大醫學院院長趙偉仁認為，釐定業外委員比例時，要平衡專業自主及各界參與；又認為醫委會可定期與社會分享工作進展，加強與市民溝通，有助提升醫委會的透明度，減少公眾對醫護界「醫醫相衛」的觀感。

對於公署建議，應完善法例，加強醫委會覆檢個案的機制，包括容讓投訴人直接向醫委會提出覆檢要求。趙偉仁認為，需要考慮有關安排會否增加醫委會的工作量，以免影響處理投訴時間，如要完善覆檢個案，須考慮設立較清晰的覆檢標準。他亦建議可考慮引入科技，協助秘書處加快處理有關工作。

社區組織協會表示，同意公署建議訂立「時間指標」，促進紀律程序在合理時間內完成；並期望有關修例令紀律程序涉及的調查、研訊及懲處，更公正處理對醫生的投訴。"
美股初段下跌,2026-02-05 22:50,,2026-02-05 23:00,cfinance,rthk,https://news.rthk.hk/rthk/ch/component/k2/1842846-20260205.htm,"美股初段下跌。

道瓊斯指數較早時報49274點，跌227點，跌幅0.46%。

納斯達克指數報22763點，跌140點，跌幅0.62%。

標普500指數報6843點，跌39點，升幅0.58%。"
九龍城關愛隊通訊程式疑被入侵　23名服務使用者個人資料或外洩,2026-02-05 22:48,,2026-02-05 23:00,local,rthk,https://news.rthk.hk/rthk/ch/component/k2/1842847-20260205.htm,"九龍城常樂小區關愛隊懷疑被黑客入侵即時通訊應用程式帳戶，有機會導致23名服務使用者的姓名、電話及住址等個人資料外洩，當中包括7名服務使用者的完整或部分身份證號碼。承辦團體已向警方報案及通報個人資料私隱專員公署，並已通知所有受影響的服務使用者提高警覺。

九龍城常樂小區關愛隊的承辦團體，即何文田居民協進會，昨晚向九龍城民政事務處通報事件。承辦團體正檢視並會加強保安措施。九龍城民政處對受影響人士造成不便致歉，並已設立熱線2712 9182供有關人士查詢。

九龍城民政處已就事件向該關愛隊發信，要求該關愛隊提高警覺及加強保安措施，並嚴格按指引妥善處理及保密個人資料。民政事務總署亦已向所有關愛隊作出了提醒。"
美國上周新申領失業援助人數按周增加2.2萬人,2026-02-05 21:48,,2026-02-05 22:15,cfinance,rthk,https://news.rthk.hk/rthk/ch/component/k2/1842845-20260205.htm,"美國上周新申領失業援助人數按周增加2.2萬人，升至23.1萬人，多於市場預期的21.2萬人。

截至1月24日，持續申領失業援助人數增加2.5萬人，升至184.4萬人，少過預期。"
據報伊朗在波斯灣法爾斯島附近水域扣押兩艘走私船,2026-02-05 21:45,,2026-02-05 22:00,cinternational,rthk,https://news.rthk.hk/rthk/ch/component/k2/1842844-20260205.htm,"據報伊朗在波斯灣法爾斯島附近水域，扣押兩艘走私船，檢獲超過100萬升的走私燃油，15名外籍船員移交司法部門。

伊朗傳媒引述伊朗革命衛隊海軍表示，是根據情報識別並攔截這兩艘船，指它們涉嫌參與法爾斯島周邊水域的有組織燃油走私。報道並無提及船隻的註冊地、或船員的國籍。"
歐洲央行一如預期維持利率不變,2026-02-05 21:36,,2026-02-05 22:15,cfinance,rthk,https://news.rthk.hk/rthk/ch/component/k2/1842843-20260205.htm,"歐洲央行公布，維持利率不變，符合市場預期，連續5次會議按兵不動。

央行表示，維持存款工具利率在2厘不變，主要再融資利率和邊際貸款利率，分別維持在2.15厘和2.4厘不變。 

當局指，通脹在中期應穩定地保持在2%的目標水平，又認為歐元區內失業率低、私營部門資產負債表穩健、防務和基礎設施開支逐步增加等，有助支持經濟增長，但面對全球貿易政策不確定及地緣政治緊張，前景仍面臨不確定。"
調查：美國企業1月計劃裁員逾10.8萬人　創17年來同月最高,2026-02-05 21:35,,2026-02-05 22:15,cfinance,rthk,https://news.rthk.hk/rthk/ch/component/k2/1842842-20260205.htm,"人力資源服務公司Challenger, Gray & Christmas報告顯示，美國企業1月宣布裁員人數逾10.8萬人，按年急升1.18倍，按月亦急升2.05倍，是自2009年全球經濟衰退接近尾聲以來的1月份最高紀錄。

報告指，今次裁員增幅主要來自運輸行業，單計聯合包裹相關的裁員計劃已高達逾3.1萬人；科技行業則裁員逾2.2萬人，醫療保健行業亦出現明顯的計劃性裁員。

報告指，上月企業裁員高企，反映僱主對今年前景不樂觀，主要是業務合約減少，其次是市場和經濟狀況，涉及人工智能的裁員佔總數7%。

另外，上月企業公布5306個招聘計劃，創2009年有紀錄以來1月份最低。"
衞生防護中心：近日進食生蠔相關食物中毒個案升　市民應提高警覺,2026-02-05 21:25,,2026-02-05 21:45,local,rthk,https://news.rthk.hk/rthk/ch/component/k2/1842841-20260205.htm,"衞生防護中心正調查兩宗有流行病學關連的食物中毒個案群組，共涉及1男3女。他們上月31日及本月1日，在沙田新城市廣場一期6樓Odelice晚膳後，出現腹痛、嘔吐、腹瀉和發燒等病徵，其中3人已求醫，1人須留院治理，其糞便樣本經化驗後證實對諾如病毒呈陽性反應。全部人目前情況穩定。初步調查顯示，受影響人士於有關食肆進食的共同食物為生蠔。中心說，近日與進食生蠔相關的食物中毒個案大幅上升，市民應提高警覺，盡量避免進食生蠔或未徹底煮熟的雙殼類海產。

食環署人員已到涉事餐廳調查並抽取食物樣本作化驗，食安中心已即時指示有關餐廳暫停供應涉事食物、清潔消毒處所，並向餐廳員工提供食物安全和環境衛生教育。調查仍然繼續。
 
衞生防護中心總監徐樂堅說，近月錄得的食物中毒個案顯著增加，由去年12月底每周錄得平均1宗個案，上升至上月每周平均4宗，本月首5天更急增至16宗個案。自1月18日至今，已錄得23宗食物中毒個案，共影響69人。當中20宗與諾如病毒相關，共影響57人。流行病學調查發現全部個案與食用生蠔有關。當中5人須留院治理，全部情況穩定。

除了食物中毒，諾如病毒亦是引致急性腸胃炎的主要原因之一。今年截至昨日，本港暫已錄得29宗院舍和學校的急性腸胃炎爆發個案，涉及206人。實驗室檢測顯示，超過6成是諾如病毒引致。根據中心的傳染病定點監測數據，家庭醫學門診、私家醫生診所、幼兒中心或幼稚園的急性腸胃炎活躍程度近期呈上升趨勢。日本及韓國等地近日諾如病毒活躍程度亦持續上升。中心提醒外遊市民要提高警覺，注意個人、環境及食物衛生。"
英倫銀行維持利率於3.75厘不變,2026-02-05 21:20,,2026-02-05 22:15,cfinance,rthk,https://news.rthk.hk/rthk/ch/component/k2/1842837-20260205.htm,"英倫銀行公布，維持指標利率3.75厘不變，合乎市場預期，利率決定以5比4票通過。

行長貝利預計，春季通脹率將回落至2%左右，通脹持續升溫的風險已經降低，若一切順利，今年仍有減息空間，但他強調，服務通脹、工資增長仍須進一步放緩，才能令當局有信心將通脹保持在目標水平。"
烏美俄第二日會談　威特科夫透露俄烏同意交換314名被俘人員,2026-02-05 21:10,,2026-02-05 21:15,cinternational,rthk,https://news.rthk.hk/rthk/ch/component/k2/1842838-20260205.htm,"烏克蘭、美國和俄羅斯，正在展開第二日的會談。

烏克蘭國家安全與國防委員會秘書烏梅羅夫，在社交媒體發文表示，三方代表在阿聯酋首都阿布扎比展開第二天的會談。他說會談的形式與昨天相同，分別是三方磋商、分組討論及後續立場協調。

美國總統特使威特科夫就表示，俄烏在會上同意交換314名被俘人員，是相隔5個月雙方再交換被俘人員。威特科夫說，雖然仍有很多工作要做，但他認為，持續的外交努力正在取得實際成果，各方將會繼續對話，預計未來幾星期會有更多進展。

阿聯酋外交部早前表示，這輪會談的啟動，表明有關各方繼續致力於透過外交途徑解決問題，期待在首輪會談的基礎上，本輪會談能進一步增進相互理解，推動政治進程取得進展。"
食安中心指示業界暫停進口及在港出售一款韓國供應生蠔,2026-02-05 20:49,,2026-02-05 21:00,local,rthk,https://news.rthk.hk/rthk/ch/component/k2/1842836-20260205.htm,"食安中心指示業界暫停進口韓國Seojun Mulsan Co., Ltd.供應的生蠔，指業界如持有受影響產品，應立即停止使用或出售。

食安中心發言人表示，近日接獲衞生防護中心有關食物中毒個案的通報後，隨即派員在食肆和供應商層面跟進調查，發現個案所涉人士曾進食由韓國Seojun Mulsan Co., Ltd.供應的生蠔，為審慎起見，即時指示業界暫停進口及在港出售由韓國Seojun Mulsan Co., Ltd.供應的生蠔。

食安中心已通知韓國當局有關事宜，亦會知會本地業界，並繼續跟進事件及採取適當行動。"
PAPT plan to expedite property sale transactions,2026-02-05 20:35,,2026-02-05 21:00,efinance,rthk,https://news.rthk.hk/rthk/en/component/k2/1842830-20260205.htm,"The Hong Kong Monetary Authority (HKMA) on Thursday announced that a pilot plan, allowing the transfer of proceeds of residential property sales in as fast as one day, will be extended to cover the secondary market from the end of the month.

Currently, a buyer's mortgage loan proceeds are settled via lawyers' accounts using physical cheques, taking two working days for the property seller to receive the funds after the transaction.

But under the Payment Arrangements for Property Transactions (PAPT), such proceeds would be transferred to the property seller's bank electronically, enabling the seller to receive the sale proceeds on the completion day at the earliest. 

The PAPT previously covered the refinancing of mortgage transactions, but is set to be extended to cover the proposed sales and purchase transactions of residential properties in the secondary market from February 28.

Speaking at a press briefing, Arthur Yuen, deputy chief executive of the HKMA, described the move as a milestone for Hong Kong.

""Under the PAPT arrangement, the transactions become more direct and safer. At the same time, it can also reduce the credit and operational risks faced by the banking industry when handling such transactions,"" he said.

Also speaking at the event was Sun Yu, chairperson of the Hong Kong Association of Banks (HKAB), who noted that the PAPT arrangement has been gaining popularity since it launched in 2022. 

He added that data showed that over 75 percent of the eligible refinancing transactions had been carried out through PAPT over the past six months.

""Currently, we are providing training for all frontline units to ensure the smooth implementation of the service,"" he told reporters.

""We are fully confident that the PAPT would provide a reliable electronic payment solution for both parties involved in the property sale and purchase transactions, while facilitating the digitalisation of the mortgage loan process,"" he said.

Separately, Roden Tong, the president of the Law Society of Hong Kong (LSHK), noted that PAPT has so far handled over 15,000 transactions over the past three years, but stressed that it is voluntary for citizens to use this service.

""When citizens are choosing the payment methods, they can also consider about the specific circumstances of each transaction, the arrangements of the bank, and factors such as the amount involved, etc, and to discuss with their lawyers to see which way is the most suitable one,"" he said.

When asked if the arrangement could be further extended to cover the primary residential market, the commercial property market, as well as subsidised housing units in the future,  the HKMA said that there is no timeline for now.

The PAPT plan was jointly announced by the HKMA, HKAB, the LSHK, as well as the Estate Agents Authority. It is also supported by the Consumer Council."
47歲男子承認行賄運輸署考牌主任被判監8個月,2026-02-05 20:25,,2026-02-05 20:45,local,rthk,https://news.rthk.hk/rthk/ch/component/k2/1842835-20260205.htm,"一名47歲男子承認在商用車輛駕駛考試中，以600元人民幣行賄運輸署考牌主任，違反《防止賄賂條例》，今日在屯門裁判法院被判囚8個月。

裁判官判刑時表示，廉潔是香港社會非常重要的價值，任何人均不能試圖行賄公職人員。被告在駕駛考試中犯下嚴重錯誤，因而企圖行賄考牌主任以換取考試及格，行為絕對不為社會接受。法庭須判處具阻嚇性刑罰，以監禁12個月為量刑起點，考慮到他認罪，將刑期扣減三分一至8個月。

案情透露，被告周二下午在香港駕駛學院的駕駛考試中心參加駕駛考試，他認為自己考試期間犯了嚴重錯誤，應該不能通過考試，於是向運輸署考牌主任提供600元人民幣現金，以求獲取及格成績。該考牌主任拒絕受賄，並向運輸署匯報事件。廉署接獲運輸署轉介貪污投訴，同日下午當場拘捕被告。"
太古地產：去年太古廣場寫字樓租金按年跌13%,2026-02-05 19:52,,2026-02-05 20:15,cfinance,rthk,https://news.rthk.hk/rthk/ch/component/k2/1842833-20260205.htm,"太古地產旗下太古廣場及太古坊寫字樓去年租金分別下跌13%及15%。截至去年底太古廣場租用率升至96%，太古坊則降至89%。太古在香港整體寫字樓物業租用率91%，按年跌2個百分點。

另外，截至去年底，太古在本港3個主要零售物業均全部租出，全年零售銷售額按年升幅介乎1.6%至5.6%。"
財政預算案2026｜立法會G19倡研究提高個人基本免稅額,2026-02-05 19:34,,2026-02-05 20:15,local,rthk,https://news.rthk.hk/rthk/ch/component/k2/1842834-20260205.htm,"立法會G19共17名議員與財政司司長陳茂波會面，就新一份財政預算案提交建議，分為10個主題，合共49點建議。

G19建議研究提高個人基本免稅額，由13.2萬元增至14萬元、研究提高子女免稅額、延長初生子女額外免稅額至3年；研究增設託兒服務、樂齡產品、聘請外傭及學校書簿開支免稅額；及研究對超過100萬港元的車輛加徵「豪車稅」等。G19又提出，調高遲交稅項附加罰款，由5%及逾6個月的10%，提升至10%和15%。

在主動對接國家「十五五」規劃方面，G19建議深化「融入國家發展大局督導組」職能，要求各政策局定期匯報對接「十五五」規劃的措施與成果等。G19亦建議增發中長期債券以支持北都發展；提供地價優惠等誘因，鼓勵本地大學與商界聯手開發北都大學城等。

另外，G19又建議資助18區舉辦本地特色遊；靈活調整「粵車南下」駛入市區名額；激活電影、電視及出版等傳統優勢文創產業等。"
美伊將舉行核問題談判　據報美國要求以色列期間勿採取軍事行動,2026-02-05 19:25,,2026-02-05 19:45,cinternational,rthk,https://news.rthk.hk/rthk/ch/component/k2/1842832-20260205.htm,"美國和伊朗預計明天舉行核問題談判，新華社引述以色列傳媒報道，美國要求以色列在美伊會談期間避免採取單方面軍事行動。另外報道引述以色列官員表示，以方認為美伊雙方存在根本性分歧，估計雙方達成協議的可能性不大。

較早時有報道指，明天在阿曼首都馬斯喀特舉行的間接談判，由伊朗外長阿拉格齊與美國總統特使威特科夫分別率團參加，談判聚焦伊朗核問題，亦涉及美國解除對伊制裁。

去年在阿曼斡旋下，伊朗與美國舉行多輪間接談判，但核心分歧難解。美國要求伊朗完全放棄鈾濃縮，伊朗強調和平利用核能的權利不可剝奪。去年6月，以色列突襲伊朗引發雙方「12日戰爭」，期間美國轟炸伊朗關鍵核設施。伊美談判自此中斷。"
美團近7.2億美元收購「叮咚」生鮮食品雜貨電商業務,2026-02-05 19:23,,2026-02-05 19:45,cfinance,rthk,https://news.rthk.hk/rthk/ch/component/k2/1842819-20260205.htm,"美團公布，計劃斥資近7.2億美元，收購內地生鮮電商企業「叮咚」旗下生鮮食品雜貨領域電商業務全部已發行股份。交易仍有待完成內地反壟斷審查，以及向國家發改委申報等條件。

根據條款，「叮咚」可在8月底或之前，從出售業務提取不超過2.8億美元資金，但要確保被提取後淨現金不低於1.5億美元。

美團表示，截至去年9月「叮咚」在國內營運超過1000個前置倉，月購買用戶超過700萬，認為「叮咚」具備一流供應鏈能力，生鮮產地直採率高，自有品牌產品豐富，複購率高，相信交易有助發揮雙方在商品力、技術、營運等方面優勢。"
澳門司警局重視涉及國安案件　倘現跡象即立案調查,2026-02-05 19:22,,2026-02-05 19:45,greater_china,rthk,https://news.rthk.hk/rthk/ch/component/k2/1842831-20260205.htm,"澳門身兼維護國家安全委員會委員的司法警察局局長薛仲明強調，司警局非常重視涉及國家安全的案件，倘發現有任何跡象會即時開立案件展開調查，若有足夠證據會採取拘捕行動。

薛仲明在司警與傳媒迎春座談會後，被記者問及澳門首宗涉及國家安全案件的進展時說，這宗去年七月底偵破的國安案，證據相對充份，已進入訴訟階段。

另外，薛仲明表示，港澳雙方合力打擊跨境犯罪，尤其在毒品方面，有機制互相聯絡。近年在打擊不少跨境販毒集團過程中，得到香港警方提供的信息而得以偵破，也是雙方努力達致的成果。"
金管局認為「置易付」已覆蓋近90%二手住宅交易,2026-02-05 19:14,,2026-02-05 19:30,local,rthk,https://news.rthk.hk/rthk/ch/component/k2/1842829-20260205.htm,"金管局同銀行公會等宣布，物業交易支付安排「置易付」本月28日起，擴展至二手住宅物業，有關物業不可以有轉讓限制，意味資助房屋未被納入，物業不可以多過一按、或涉及釘契等。

銀行會評估個案是否符合資格，而在授信文件上附上相關條款，不會對按揭審批機制或條款有任何影響。

「置易付」暫時亦不適用於一手住宅同商業物業等。金管局助理總裁（銀行操守）區毓麟表示，一手樓的樓花按揭與二手樓買賣按揭條款、流程不同，法律條款需要兼顧的地方亦不同，現時會先集中精力將安排擴展至二手樓，希望有更多人使用，適當時間會考慮擴至一手樓。

他說，去年4萬多宗二手住宅物業交易，資助房屋佔約10%，涉及二按等宗數亦少，認為今次安排已經覆蓋接近90%二手住宅交易。

他表示，擴展安排更加快捷、安全，物業按揭貸款款項能夠在銀行間以電子方式直接轉帳，減低支付風險和提高支付效率，賣家最快成交當日收錢。"
鄭新聰勉勵澳門經濟發展需取新突破　岑浩輝堅持及完善行政主導,2026-02-05 18:57,,2026-02-05 19:15,greater_china,rthk,https://news.rthk.hk/rthk/ch/component/k2/1842828-20260205.htm,"澳門中聯辦舉行2026年新春酒會，澳門中聯辦主任鄭新聰在致辭時提到，2025年是國家「十四五」規劃收官之年，亦是澳門極不平凡的一年。

他勉勵澳門作為國家的掌上明珠，今年要做好四點，包括在推動經濟適度多元發展方面要取得新突破，在提升特區治理效能方面要邁出新步伐，在發展壯大愛國愛澳力量方面要展現新氣象，在維護國家安全和社會穩定方面要有新作為。

出席酒會的澳門行政長官岑浩輝致辭就表示，將會緊扣堅持和完善行政主導、深化公共行政改革，以及紥實推動經濟適度多元發展和務實推進橫琴合作區建設兩條主軸，促進澳門長期繁榮穩定。

他說2026年是對接國家戰略、搶抓發展機遇和持續深化改革的關鍵一年。澳門將以第三個五年規劃，主動對接國家「十五五」規劃，更好融入和服務國家發展大局。他說會切實提升治理效能，加強行政立法、司法的良性互動和高效協作，破解民生難題，並全支力持愛國愛澳力量壯大發展，為青年成長成才創造廣闊舞台，以確保「一國兩制」事業後繼有人。"
中國古巴外長會談　王毅指中方堅定支持古巴維護國家主權安全,2026-02-05 18:52,,2026-02-05 19:15,greater_china,rthk,https://news.rthk.hk/rthk/ch/component/k2/1842827-20260205.htm,"中共中央政治局委員、外長王毅，與古巴外長羅德里格斯會談。

王毅表示，拉美地區形勢正經歷複雜深刻變化，中方堅定支持古巴維護國家主權和安全，反對外部勢力無理干涉，反對剝奪古巴人民生存權和發展權。

王毅說，中方願同古方落實好兩國元首共識，繼續提供力所能及的支持和幫助，鞏固好、發展好中古友好關係，與志同道合國家一起，為增進全球南方團結、維護地區及世界和平，作出新的努力。

羅德里格斯感謝中方堅定支持古巴人民反對外部封鎖制裁，並為古巴經濟社會發展提供寶貴幫助。他又說，古方支持人類命運共同體理念和四大全球倡議，恪守一個中國原則，反對「台獨」。"
【重溫】2026年2月5日新聞天地,2026-02-05 18:46,,2026-02-05 19:00,local,rthk,https://news.rthk.hk/rthk/ch/component/k2/1842800-20260205.htm,詳盡報道本地時事、大中華消息、國際局勢等新聞，緊貼最新熱話。
建造業總工會收多宗地盤欠薪諮詢包括將軍澳一大型地盤,2026-02-05 18:40,,2026-02-05 18:45,local,rthk,https://news.rthk.hk/rthk/ch/component/k2/1842804-20260205.htm,"香港建造業總工會表示，近一個月收到20多宗有關地盤拖欠薪金的諮詢，包括將軍澳一個大型地盤涉嫌拖欠3個月薪金，涉款金額達500萬至600萬元。工會指市道不佳，很多工友不敢採取大型工業行動，擔心被列入地盤黑名單，不能再到地盤工作。

另外，私隱專員公署早前接獲42宗懷疑透過虛假招聘廣告，誘騙建築工人提供「地盤三寶」等個人資料。總工會相信大部分涉零散工和地盤雜工，擔心資料可能協助黑工取得個人身分，呼籲提高警覺。"
米蘭冬奧「中國之家」開館,2026-02-05 18:38,,2026-02-05 19:00,greater_china,rthk,https://news.rthk.hk/rthk/ch/component/k2/1842802-20260205.htm,米蘭科爾蒂納冬奧即將揭幕，由中國奧委會設立運營的「中國之家」在意大利米蘭正式開門。
1989年兇殺案疑犯由泰國押回港　周一鳴：感謝泰國警方協助,2026-02-05 18:37,,2026-02-05 19:15,local,rthk,https://news.rthk.hk/rthk/ch/component/k2/1842822-20260205.htm,涉及1989年一宗兇殺案的疑犯，由泰國押回港。警務處處長周一鳴說，感謝泰國警方協助。
1989年兇殺案疑犯由泰國押回港  周一鳴：感謝泰國警方協助,2026-02-05 18:37,,2026-02-05 18:45,local,rthk,https://news.rthk.hk/rthk/ch/component/k2/1842822-20260205.htm,涉及1989年一宗兇殺案的疑犯，由泰國押回港。警務處處長周一鳴說，感謝泰國警方協助。
入境處與內地聯手破黑工集團拘119人,2026-02-05 18:36,,2026-02-05 18:45,local,rthk,https://news.rthk.hk/rthk/ch/component/k2/1842826-20260205.htm,入境處聯同內地執法部門，搗破一個跨境偽證黑工集團，拘捕119人，包括集團主腦及骨幹成員、多名懷疑非法勞工及涉嫌聘用這批人的僱主，行動中亦檢獲一批偽造香港身份證。
市監總局：有效推動「價格戰」、「補貼戰」及時降溫,2026-02-05 18:17,,2026-02-05 18:30,cfinance,rthk,https://news.rthk.hk/rthk/ch/component/k2/1842825-20260205.htm,國家市場監督管理總局說，去年綜合整治「內捲式」競爭，有效推動「價格戰」、「補貼戰」及時降溫，在平台經濟方面，亦有效遏制平台亂收費、亂罰款等現象，會維護公平競爭秩序，推動平台經濟在服務高質量發展大局中發揮更大作用。
申訴專員公署：醫委會處理投訴過於緩慢,2026-02-05 18:15,,2026-02-05 18:45,local,rthk,https://news.rthk.hk/rthk/ch/component/k2/1842824-20260205.htm,申訴專員公署說，醫委會處理投訴的監察機制，在管理和運作上有不少系統性問題及不足之處，處理投訴個案進度仍然過於緩慢，有迫切認真檢討並徹底改善投訴處理的流程。
