id,title,date,url,section,source,last_update,scrape_time,news_content
3525216.0,恒指輕微高開 阿里升逾1% 小米回購 海天調味擬派特別息｜港股開市,2025-12-09 09:24,https://www.stheadline.com/stock-market/3525216/恒指輕微高開-阿里升逾1-小米回購-海天調味擬派特別息港股開市,"
        股市
    ",singtao,2025-12-09 09:24,2025-12-09 09:30,"美國聯儲局周二起一連兩日議息前夕，美股三大指數周一全線向下，道指跌215點或0.45%，報47739點；標指跌23點或0.35%，報6846點；納指則跌32點或0.14%，報23545點。至於反映中概股走勢的金龍指數，周一升0.08%至7837點。目前市場已高度預期聯儲局將於本周減息，但美國債息持續向上，其中10年期債息最新升至4.172厘。

Nvidia盤後升逾2%

焦點股中，美國允許英偉達（Nvidia）在符合條件並獲批准下，向中國及其他國家客戶出口其高效能AI晶片H200，但必須支付25%交易收益給美國政府。消息刺激Nvidia（NVDA）股價向上，周一收升1.7%後，盤後再升2.3%至189.9美元。

相關文章：特朗普准Nvidia H200晶片銷華 美政府需「收稅」25%

小米昨斥逾兩億回購股份

港股方面，恒指今早高開15點，報25780點。科網股個別發展，騰訊（700）升0.7%；阿里巴巴（9988）升1.1%；美團（3690）無起跌；京東（9618）升0.2%。至於小米（1810）昨日（8日）斥資約2.04億元回購480萬股，惟今早股價跌0.2%。

周大福系內股權變動

個股消息中，周大福系內股權變動，周大福資本（CTF Capital）將所持周大福珠寶（1929）近54%股權，轉讓予一家由周大福企業和CTF Capital分別持有65%和35%股權的子公司持有，以有效持股計算，周大福企業持有周大福珠寶35.1%股權；同時，周大福企業目前亦持股73.98%周大福創建（659）及45.24%新世界發展（017）。上述3間上市公司之中，周大福珠寶及周大福創建今早股價無起跌，新世界則跌0.6%。

相關文章：周大福系大變動 CTF Capital所持周大福珠寶近54%股權 轉讓予周大福企業

海天調味考慮派發特別股息

此外，海天調味（3288）擬於12月18日舉行董事會會議，考慮派發特別股息及審議未來3年股東回報規劃；該股開市報31.9元，升0.4%。

北水動向方面，昨日淨買入港股15.4億元，其中小米（1810）、中芯（981）及泡泡瑪特（9992）分別獲淨買入11.73億元、4.67億元及4.32億元；而騰訊（700）、華虹半導體（1347）及中國平安（2318）分別遭淨賣出7.62億元、2.09億元及1.8億元。"
3525215.0,790億「非洲手機之王」闖港IPO上市 傳音擬拓資本研發AI相關技術,2025-12-09 09:23,https://www.stheadline.com/society/3525215/790億非洲手機之王闖港IPO上市-傳音擬拓資本研發AI相關技術,"
        社會
    ",singtao,2025-12-09 09:23,2025-12-09 09:30,"據《星島環球網》報道，近日，傳音控股（688036.SH，簡稱「傳音」）向香港聯交所遞交H股上市申請，再度引發市場對這家「非洲手機之王」的關注。

早在2019年，傳音控股就已登陸上交所科創板，而此次謀求港股上市，籌劃構建「A+H」雙融資平台，其實也並不令人意外——既是拓展國際資本市場的重要一步，也為應對日益嚴峻的行業競爭儲備更多「彈藥」。

但在光鮮數據的招股書背後，該公司面臨的利潤下滑，以及來自小米、榮耀等對手的磨刀霍霍，壓力亦不容小覷。此番赴港，這家曾靠「本土化」絕技橫掃非洲市場的手機霸主，能否繼續贏得另一資本市場的青睞？

從中國走出的「非洲之王」

對國內消費者而言，「傳音」這個名字稍顯陌生，但在遙遠的非洲大陸，它卻是家喻戶曉的手機品牌。

傳音控股的創辦人、董事長兼總經理竺兆江，曾是波導手機的海外業務負責人。 2006年，國內手機市場進入山寨機的「黃金混戰期」，深圳手機廠商一度接近4,000家。彼時，這位已在海外跑遍90多個國家的銷售老兵，決定另闢蹊徑，離開波導創立傳音科技，即現在傳音控股的前身，並瞄準巨頭們忽視的非洲市場，尋找增量富礦。

公司成立不久便推出了中高端品牌TECNO。而竺兆江深知「本土化」才是製勝法門，他率領團隊深挖非洲市場通訊基礎設施薄弱營運商多、電力供應不穩定等特點，推出了TECNO T201，支援「雙卡雙待」、超長待機等功能。 TECNO一推出，便成功擊中了非洲消費者的痛點，迅速成為市場爆款。

此後，傳音科技又陸續推出了針對基層消費者的大眾品牌itel、面向年輕消費者的時尚科技品牌Infinix，形成手機三大品牌矩陣。

在「本土化」創新的過程中，傳音最廣為人知的是針對深膚色美顏技術。早期進入非洲市場，傳音發現在主流手機鏡頭中，深膚色在暗光及強光等極限複雜光照環境下難以得到良好的渲染與呈現。為此，公司自研了深膚色人臉偵測辨識技術、深膚色人像分割等核心技術，解決了夜間拍照難題，讓傳音在非洲市場贏得了廣泛口碑。

隨著公司業務向南亞、東南亞、中東、拉丁美洲等新興市場擴張，傳音搭建了覆蓋全膚色、全場景的行動影像技術平台，在不同場景下，不同膚色的用戶在合照時也能得到正確的曝光和真實呈現。

2015年，傳音在非洲出貨量突破5,000萬部；2017年超越三星，登頂非洲手機市場銷冠。

2019年9月30日，傳音正式上交所科創板，上市首日大漲64.44%，市值飆升至462億元，位列當天科創板總市值的第三把交椅。

可以說，非洲市場是傳音賴以起家的糧倉。 「我們深耕以非洲為代表的新興市場。憑藉著領先的市場佔有率和廣泛的品牌影響力，我們在手機行業內有著『非洲之王』的美譽。」傳音招股書中表示。

根據弗若斯特沙利文的統計，以2024年手機銷售量計算，傳音手機銷售量超2億部，在全球新興市場排名第一。

業績變臉：營收與獲利雙降

然而近幾個季度，傳音的財務數據顯現出業績下行的訊號。招股書顯示，2022年-2024年，公司營收持續成長，但此趨勢在今年上半年戛然而止。今年上半年，公司營收290.77億元，年減15.86%；淨利更是腰斬，從去年同期的28.64億元下降56.65%至12.42億元。

根據公司三季報，今年前三季度，傳音營收495.43億元，年減3.33%；歸母淨利21.48億元，年減44.97%；扣非歸母淨利下降17.31億元，年減46.71%。「受市場競爭以及供應鏈成本綜合影響，營業收入及毛利額減少所致。」傳音在三季報中表示。

公司毛利率從2023年的23.2%下降到今年上半年的19%。

對於營收的下降，公司解釋為智慧型手機及功能手機產生的收入減少。具體來看，功能手機收入減少與消費者需求下降有關。 「根據弗若斯特沙利文的資料，在新興市場，手機產業正從功能手機轉向智慧型手機，且消費者越來越多購買智慧型手機。」功能手機的平均售價由去年上半年的56.6元/部下降至今年上半年的50.1元/部，降幅11.5%。

而智慧型手機的毛利率由2023年的22.5%下降至2024年的19.6%，則與其單位營業成本增加有關，主要是智慧型手機的主要原料之一記憶體晶片的採購價格上漲。根據Counterpoint硬體成本拆解報告顯示，記憶體晶片在中低階手機成本中佔比約15%-25%。原物料價格的波動侵蝕了有限的利潤空間。

對此，公司在招股書中進行了相關風險提示：「如部分原材料短缺或成本增加，我們的產品成本或會增加。我們的毛利率或會因該等成本增加而減少。」

競爭加劇：對手環伺，專利存短板

除原料外，傳音的存貨還包括在製品、製成品及委外加工物資。值得注意的是，該公司的存貨週轉天數近年來逐漸延長，從2023年的64.6天延長至今年上半年的70.9天。

「存貨週轉天數的任何波動及延長均可能對我們的現金流量及流動性產生不利影響。」本公司在招股書中表示。

而同樣增加的還有貿易應收款項及對應的周轉天數。2022年-2024年及2025年上半年，公司的貿易應收款項分別為12.87億元、19.65億元、33.77億元及38.63億元，貿易應收款項平均週轉天數也從2022年的11.0天下降至2023年的10.6天，之後延長至2024年的15.2天，到今年上半年已經達到23.6天。

「貿易應收款項週轉天數的波動及延長可能會對我們的現金流量及流動資金產生不利影響。」傳音表示。

事實上，傳音的現金流已出現了較大幅度的變動。根據招股書，近年來公司經營活動所得現金流量淨額不斷下滑，2024年，該數據從2023年的118.49億元下降76.41%至27.95億元。今年上半年則僅267.6萬元。

值得一提的是，傳音在非洲市場的地位正遭遇挑戰。根據市場研究機構Omdia發布的最新報告，2025年第三季度，傳音在非洲智慧型手機市場的出貨量達1,160萬台，市佔率為51%；小米以13%的份額位居第三，增速為34%；OPPO與榮耀以4%的份額，分列第四和第五年增長率158%的榮耀來。

與小米、OPPO等對手相比，傳音的專利數量明顯薄弱，這是其需要直面的現實問題。根據招股書，截至2025年6月30日，傳音在全球獲授權專利2,800多項，包括1,200多項發明專利。而截至2023年底，小米全球授權專利數就已超過3.7萬項，同時正在申請的專利還有3萬項；截至2024年3月31日，OPPO的全球專利申請量已超過10.1萬項，授權專利超過5.5萬項，其中發明專利申請數量超過9.1萬項。

面對市場與財務上的雙重壓力，傳音正試圖建構更豐富的商業生態。除手機外，傳音已佈局行動網路業務，同時，也開拓了數位配件、家用電器等領域。目前，傳音擁有物聯網產品品牌oraimo、家用電器品牌Syinix。

在儲能賽道，傳音推出了大眾家庭及小型商業用戶的itel Energy，以及針對高端家庭和商業用戶的DYQUE Energy系列產品。其也涉足了出行領域，推出了面向個人用戶的輕型電動出行設備Revoo，以及面向有客運及貨運需求的小型企業經營者的TankVolt。不過這些業務尚處在培育期，業績貢獻還比較微弱。

此次赴港IPO，傳音計畫將募款作為研發AI相關技術以加速產品迭代，重點加強技術能力、擴充產品組合及鞏固競爭優勢；用於市場推廣及品牌建設，以提升公司的品牌知名度、改善用戶參與度及支持持續業務擴展；同時加強行動互聯網服務及物聯網產品及其他方面，以及補充營運資金及一般企業用途。

從憑藉雙卡手機闖蕩非洲，並異軍突起，到如今面臨競爭升級、奮力構建新生態，傳音的發展軌跡是中國企業出海的一個典型縮影。衝刺港股，或許只是其新一輪長途競賽的開始。

截至12月8日收盤，傳音控股A股收盤於68.36元/股，總市值為786.95億元。"
3525218.0,羅浮宮工會下周一發動輪流罷工 抗議人手短缺設施老化,2025-12-09 09:22,https://www.stheadline.com/realtime-world/3525218/羅浮宮工會下周一發動輪流罷工-抗議人手短缺設施老化,"
        即時國際
    ",singtao,2025-12-09 09:22,2025-12-09 09:30,"巴黎羅浮宮博物館的工會周一宣布，將於下周一（15日）起發動輪流罷工，抗議工作條件惡劣、非歐洲遊客門票價格上漲以及保安漏洞，令本已備受驚天劫案打擊的羅浮宮雪上加霜。若羅浮宮2100名員工大多響應，該館有可能在聖誕假期前夕關閉，屆時將影響巴黎大批節慶遊客。

聖誕節前夕恐閉館

CFDT工會代表鮑德（Valerie Baud）表示，CGT、Sud與CFDT三大工會宣布，約200名員工出席的員工會議全票通過發動罷工。工會在罷工通知中表示，陳舊的設施和人手不足正在影響遊客體驗，迫使部分展覽關閉。他們要求將資源集中用於建築改造，並保障博物館、收藏品、遊客和員工的安全。

相關新聞：羅浮宮禍不單行 管線漏水損及數百份文獻

三大工會也聯名致函文化部長達蒂，指出羅浮宮部分展區經常因「人手不足、技術故障及館舍老化」被迫關閉。

工會在信中聲稱，對於數百萬前來欣賞羅浮宮浩瀚藝術藏品的遊客來說，「參觀羅浮宮已變成一場真正的障礙賽，我們需要改變現狀」。

參觀羅浮宮成真正障礙賽

工會表示：「現在，民眾僅能有限接觸藝術品，參觀動線也困難重重，令參觀羅浮宮變成真正的障礙賽。」

羅浮宮副館長斯坦博克周日坦承，供暖和通風系統內一個閥門未關，導致埃及館約300至400份期刊、書籍及文件受損。

斯坦博克補充說，遭損毀的館藏可追溯至19世紀末至20世紀初，是「極為有用」但「並非僅有」的文獻。

10月19日，4名賊人大白天闖入羅浮宮，僅花7分鐘便搶走價值約1.2億美元的珠寶，隨後騎電單車逃逸。被竊物品至今仍未尋回，包括拿破崙贈予瑪麗-路易絲皇后的鑽石祖母綠項鍊、與兩位19世紀皇后瑪麗-阿梅莉和奧唐斯相關的珠寶，以及歐仁妮皇后的珍珠鑽石冠冕。

驚天劫案凸顯重大保安漏洞

這宗驚天劫案凸顯羅浮宮重大保安漏洞，也讓政府任命的館長德卡爾承受更大壓力。她形容這是「對我們造成的巨大創傷」。

德卡爾與工會早在竊案發生前已多次警告，館內管理狀況與維護龐大博物館的成本已成隱憂。

管線漏水損埃及文獻

收藏達文西名畫《蒙娜麗莎》的羅浮宮，去年吸引870萬人次參觀。今年6月16日，羅浮宮亦曾因畫廊導覽員、售票員及保安人員自發罷工，抗議人手短缺與擁擠問題，被迫暫時關閉。

另外，11月26日的一次漏水事故損壞了博物館圖書館中數百本專門收藏埃及文物的刊物，其中包括19世紀和20世紀的評論文章和文獻。博物館方面表示，閥門開啟導致水管網絡洩漏，水管網絡預計明年進行更換。"
3525212.0,大棋盤︱立選結果四看點 新丁「埋位」上雞精班,2025-12-09 09:17,https://www.stheadline.com/politics/3525212/大棋盤立選結果四看點-新丁埋位上雞精班,"
        政情
    ",singtao,2025-12-09 09:17,2025-12-09 09:30,"立法會選舉塵埃落定，今屆地區直選投票率比上屆高1.7個百分點，投票人數則少3萬多人，但在大埔火災慘劇的社會氣氛下，愛國陣營已經「收貨」，港澳辦更形容三大界別投票率均「大幅超越上屆」，反映社會對選舉重視。綜合政圈人士分析，今次選舉有幾個看點，值得歸納一下。

1. 地區效應明顯，落選者戰鬥力增強

今次選舉奉行「自由搏擊」，沒祝福名單，為營造競爭氣氛，各政團大舉派兵，包括向來主打功能界別的經民聯。10個地方選區平均5至6人爭兩席，部分人原以為是陪跑居多，得票卻有驚喜，例如激戰區港島東，自由黨阮建中僅以358票之差，敗於民建聯植潔鈴。

從最終得票分析，落選者得票普遍「見得人」，大部分獲過萬票，例如上屆新界東北只得5000多票的黃頴灝，今屆得票翻倍至近1.2萬；參選九龍東的觀塘區議員梁思韻，與次席當選的民建張培剛僅差282票，選情緊湊。地區人士透露，梁思韻獲有份量人士「加持」，吸納大部分非民建聯、工聯會樁腳的票源。10區中，只有九龍東陳進雄得票未及總有效票數3%，被沒收選舉保證金。

事實上，部分政團派人出戰直選，勝算不一定是首要考慮，工聯會吳秋北昨日指不少新人參與是為鞏固基本盤，了解支持工聯會的票源，否則便難以積蓄力量。

2. 工聯會選委界再吃敗仗

今次立會大換血，工聯會是唯一一個毋須「交人頭」的政團，惹來其他建制派微言，來屆雖保持7席不變，但兩名議員陸頌雄、郭偉强齊齊落馬。選委界方面，近年工聯會多次滑鐵盧，今次派4人出選，只得兩名現任議員當選，其中身兼全國政協的工聯會理事長黃國，僅排第28；梁子穎排第33「低空掠過」。

有建制中人指，工聯會近年就勞資議題與商界針鋒相對，關係欠佳，而選委大多有工商專業背景，自然不會賣帳；即使工聯會派出身兼全國政協的副會長馬光如，亦一樣「唔畀面」，另一工聯副會長曾志文得票更包尾。

3. 民建聯選舉策略操作 「暗中歸邊」難禁止

民建聯今次在三個直選區同時派兩隊出戰，口徑是給予選民更多選擇，但「谷票」用意更明顯，最終九龍東、港島東候選人皆贏得驚險，未釀成「攬炒」實有幸運成分。有民記中人透露，雖然黨內指示禁談「棄保」，必須公平對待，但到了選戰後期，三區都有候選人明顯跑出，黨友自然會「歸邊」，這也是選舉常態。

亦有地區人士說，雖說沒有正式「棄保」，但現實上難以禁止黨友傾向某候選人，例如植潔鈴選前一日已貼出重量級人士撐場影片，現任議員梁熙更呼籲「集中票源」，相較之下，另一民記候選人李清霞顯得勢弱。

4. 「明星效應」接班有效果

今次改選，年屆七十議員退位，接班人悉數成功接棒，其中實政圓桌田北辰為徒弟莊豪鋒抬轎，最終獲3.4萬票當選，擺贏工聯會及鄉事派。實政圓桌主打中產，有力吸納中間、淺黃票，今屆即使多了競爭，「甩票」情況不嚴重，只比田北辰少了約5000票。從票站「細數」分析，莊豪鋒在屯門置樂花園、大興花園等居屋或私人屋苑得票較高，且看他躋身議會後，又能否繼承田二少的敢言作風。

此外，新民黨陳家珮由選委界轉跑道，成功保住該黨港島西一席；林健鋒、張宇人在商界一及飲食界，亦順利交棒予徒弟，可見政圈「師徒制」仍有一定效果。

選舉過後，大主席梁君彥今早率領新舊議員見傳媒，就跟進火災事件集體表態，以示團結一致。新議會多達40名新丁，據聞一眾資深議員亦傾向在本周內開班，教授新人議會入門技巧，減少「甩轆」機會。

聶風"
3525214.0,法國第一夫人訪川意外帶火「中國最美女保鑣」  嚴月霞冷峻氣場走紅　,2025-12-09 09:14,https://www.stheadline.com/realtime-world/3525214/法國第一夫人訪川意外帶火中國最美女保鑣-嚴月霞冷峻氣場走紅,"
        即時國際
    ",singtao,2025-12-09 09:14,2025-12-09 09:30,"法國總統馬克龍與夫人布麗吉特近日訪華行程中，在北京及四川成都多場公開活動備受矚目，而其中吸引中國網民討論的焦點之一，是一名始終緊貼在法國第一夫人身側、眼神銳利的中國女保鑣——嚴月霞（工作名），被網民封為「中國最美女保鏢」。

冷峻眼神全程警戒網民直呼：我願意被她壓制逮捕

根據澎湃新聞報道，自布麗吉特踏出專機梯級開始，嚴月霞便始終保持警戒姿態，眼神緊盯周遭環境，毫無懈怠。在大熊貓基地亮相時，她俐落步伐、俯身戒備的姿態，更令不少中國網民直呼「氣場太強了」。

不少網友留言形容她「美貌與殺氣並存」、「帥到犯規」、「這才是真正的玫瑰有刺」，甚至有人半開玩笑表示：「我願意被她壓制逮捕。」

專門負責外國女性領導人？多次護衞名人曝光

據報，40歲的嚴月霞，本是中國安全部門內的精英人員，負責保護外國女性領導人及夫人級人物。過去影像比對可見，她曾護衞泰國前首相貝東塔，以及敘利亞總統夫人阿斯瑪等，其專業形象多次引起外界好奇。

真名疑為「徐瑾」傳少林俗家弟子、擊敗空手道冠軍？

部分內地媒體如中新網報道，有網民稱「嚴月霞」並非真名，而是任務代號，她本名為「徐瑾」。更有小粉紅聲稱她「少林寺俗家弟子」、「曾撂倒五名日本空手道冠軍」。

不過，相關說法沒有官方證實，多為民間流傳的傳奇式渲染。

12月5日，布麗吉特在成都大熊貓繁育研究基地與大熊貓「圓夢」見面，嚴月霞全程貼身保護。由於動作果斷、神情冷峻，網民紛紛表示：「比電影女特工更有氣場」。

亦有人打趣稱：「外交看馬克龍，花絮看嚴月霞。」

專家表示，她之所以能在社交平台「出圈」，源於其身形敏捷、警戒範圍控制得當，相當符合高危安保任務標準。

一名退休安保人員直言：「真正的貼身護衛不是做明星，而是要做到任何風險都比本人先一步察覺。」

不管如何，嚴月霞此次因陪同法國第一夫人亮相，再次登上熱搜，成了網民熱議焦點。

"
3525213.0,特朗普准Nvidia H200晶片銷華 美政府需「收稅」25%,2025-12-09 09:07,https://www.stheadline.com/realtime-finance/3525213/特朗普准Nvidia-H200晶片銷華-美政府需收稅25,"
        商業創科
    ",singtao,2025-12-09 09:07,2025-12-09 09:15,"美國總統特朗普周三於自家社交媒體Truth Social發文表示，已親自告知中國國家主席習近平，美國將允許英偉達（Nvidia）在符合條件並獲批准下，向中國及其他國家客戶出口其高效能AI晶片H200。不過，當中交易收益的25%必須支付給美國政府。特朗普亦透露，習近平對此作出了「積極的回應」。受利好消息刺激，英偉達盤後最高見190.99美元，升2.93%。

值得注意的是，雖然H200晶片獲准放行，但特朗普強調，英偉達目前最先進的Blackwell晶片及即將推出的Rubin架構晶片，均不在本次協議之列。

特朗普表示，商務部目前正在敲定細節，有關原則亦將適用於AMD、英特爾（Intel）及其他美國晶片巨頭。

批拜登逼推降級版 「根本無人需要」

特朗普在帖文中亦批評，上任拜登政府曾迫使美國企業投入數十億美元去生產「降級」版本，直斥這些產品「根本沒人需要」，是一個「糟糕的主意」，不僅拖慢了創新，更傷害了美國工人。"
3525210.0,全球首名︱AI女演員Tilly Norwood  已簽60份合約,2025-12-09 09:01,https://www.stheadline.com/world-topics/3525210/全球首名AI女演員Tilly-Norwood-已簽60份合約,"
        趣聞熱話
    ",singtao,2025-12-09 09:01,2025-12-09 09:15,"世界首名人工智能（AI）生成的演員Tilly Norwood數個月前正式亮相，引發荷里活演員的批評浪潮，擔心真人演員失業、電影的藝術價值遭破壞。但該名AI演員的創造者、荷蘭裔女演員維爾登（Van der Velden）在昨日《華爾街日報》刊登的訪問中聲稱，已為Tilly簽了60份合約。維爾登並披露創造Tilly的過程。

荷里活一片撻伐聲

39歲的維爾登利用聊天機械人ChatGPT創造AI演員，她先是向ChatGPT簡要描述了她理想中的形象：「一位魅力四射，具國際化吸引力的女性名人。她五官對稱、肌膚光滑明亮，擁有一雙迷人的綠色眼睛。她有一頭長髮。」隨後Tilly的第一張圖像誕生了：卡通風格，嘴唇豐滿，眼睛呈奇異果顏色，種族特徵模糊不清。

長居英國的維爾登想要一個真實的鄰家女孩，一朵英倫玫瑰。維爾登說，很清楚荷里活會選甚麼樣的女孩。

在接下來的六個月，維爾登與她的15人團隊精心打磨女主角的形象。他們在不限制任何外表、年齡或天賦的前提下，共製作了2000個版本。

但Tilly9月底正式亮相後，荷里活爆發一片撻伐聲。《阿凡達》導演占士金馬倫稱Tilly「令人毛骨悚然」。 《科學怪人》導演哥連慕迪多奴說，他「寧願死」也不願和AI一起拍電影。美國演員工會反應激烈，指：「Tilly Norwood並不是演員，只是由電腦程式生成的角色，而這個程式訓練過程中參考了無數專業表演人才的作品，但既未事先取得許可，也未支付報酬。」演員工會抨擊，AI演員不僅威脅真人演員的生計，更會貶低影視作品的藝術價值。

但維爾登表示，私底下人們對她的接受度更高。最近幾周，她簽署了約60份保密協議，涉及有真人演員參與的混合電影、全AI製作的電影，以及Tilly專項項目，其中大部分的投資額在1000萬美元至5000萬美元之間。

"
