title,date,url,lead,source,section,scrape_time,news_content
俄烏戰爭｜澤連斯基邀特朗普訪烏 「與俄達成任何協議前請來看看」,2025-04-14 20:52,https://std.stheadline.com/realtime/article/2063949/即時-國際-俄烏戰爭-澤連斯基邀特朗普訪烏-與俄達成任何協議前請來看看,,singtao,international,2025-04-14 21:00,"

烏克蘭總統澤連斯基（Volodymyr Zelensky）邀請美國總統特朗普（Donald Trump），在與俄羅斯達成任何結束戰爭的協議之前，訪問他的國家。

澤連斯基接受CBS電視台《60分鐘》節目訪問時說：「請在任何形式的決定、任何形式的談判之前，來看看被摧毀或死亡的人們、平民、戰士、醫院、教堂、兒童。」這段訪問是在俄羅斯導彈襲擊蘇梅市，造成34人死亡前拍攝的。

相關新聞：俄導彈襲擊烏克蘭蘇梅市釀31死 84傷包括10小童

俄羅斯聲稱只會攻擊軍事目標或相關目標。德國候任總理默茨（Friedrich Merz）指控俄羅斯獲下戰爭罪行。

特朗普則表示，這次襲擊「很可怕」，他「被告知他們犯了一個錯誤」，但沒有說明是誰告訴他的。較早前，特朗普的俄烏問題特使凱洛格（Keith Kellogg）表示，這次襲擊跨越了「任何禮貌的底線」。

不過，未知特朗普會否接受澤連斯基的邀請。

相關新聞：特朗普稱對普京「非常生氣」 威脅對俄石油徵收「二級關稅」"
英國會議員來港探孫被拒入境  中國外交部回應：特區政府有權按法律處理,2025-04-14 20:41,https://std.stheadline.com/realtime/article/2063948/即時-中國-英國會議員來港探孫被拒入境-中國外交部回應-特區政府有權按法律處理,,singtao,greater_china,2025-04-14 21:00,"

早前，英國65歲自由民主黨國會議員、歐洲議會和多國議會「對中政策跨國議會聯盟」成員賀候絲（Wera Hobhouse）來港探親時被拒入境。中國外交部今日回應事件。

賀候絲一度被扣留5小時

相關新聞：英國會議員來港探孫遭遣返 外相林德偉促中港政府解釋

在周一（14日）舉行的外交部例行記者會上，外交部發言人林劍表示，香港特區政府已就此作出表態，我想強調入境事務是一國主權範圍內的事，香港特區政府有權按照相關的法律和政策處理入境的個案。

《星期日泰晤士報》報道，賀候絲上周四（10日）與丈夫到香港探望初生的孫兒，但入境時被截停問話，包括她的工作及來港目的，賀候絲的行李亦被搜查，護照被沒收。扣留5小時後，賀候絲在4名香港入境處人員陪同到登機口，經另一班飛機遣送回英國，只有她丈夫獲准入境。

英國外交大臣拉米昨日（13日）曾表示，對事件深表關切，並表示將緊急與中國政府交涉。"
愉景灣食肆兩印度男被捕 涉無牌賣酒,2025-04-14 20:14,https://std.stheadline.com/realtime/article/2063945/即時-港聞-愉景灣食肆兩印度男被捕-涉無牌賣酒,"大嶼山北分區雜項調查隊及軍裝巡邏小隊人員根據線報及深入調查後，今日（4月14日）下午約5時在東涌區打擊無牌賣酒。行動中，警員在愉景灣一食肆拘捕兩名印度裔男子，分別47及57歲，涉嫌「無牌售賣酒類飲品」，現正被扣留調查。警方亦在食肆內檢獲一些酒精飲品及酒杯。

警方強調，無牌賣酒屬嚴重罪行，一經定罪最高可判罰款100萬元及監禁兩年，而市民於無領取牌照的地方飲酒，亦屬違法，一經定罪，最高可判罰款2000元，警方呼籲市民切勿以身試法。",singtao,local,2025-04-14 20:30,"

大嶼山北分區雜項調查隊及軍裝巡邏小隊人員根據線報及深入調查後，今日（4月14日）下午約5時在東涌區打擊無牌賣酒。行動中，警員在愉景灣一食肆拘捕兩名印度裔男子，分別47及57歲，涉嫌「無牌售賣酒類飲品」，現正被扣留調查。警方亦在食肆內檢獲一些酒精飲品及酒杯。

警方強調，無牌賣酒屬嚴重罪行，一經定罪最高可判罰款100萬元及監禁兩年，而市民於無領取牌照的地方飲酒，亦屬違法，一經定罪，最高可判罰款2000元，警方呼籲市民切勿以身試法。"
美國關稅︱香港物流發展局開會  陳美寶 : 將帶領物流企業循五大策略應對,2025-04-14 20:13,https://std.stheadline.com/realtime/article/2063944/即時-港聞-美國關稅︱香港物流發展局開會-陳美寶-將帶領物流企業循五大策略應對,"香港物流發展局今日（14日）召開會議。運輸及物流局局長兼香港物流發展局主席陳美寶在會上就美國濫施關稅包括進一步調高所謂對等關稅的舉措，聽取物流業界的意見，並商討如何共同應對。

陳美寶表示，美國早前宣布對不同貿易夥伴濫收所謂對等關稅，無視香港在《基本法》下是單獨的關稅區，以及作為自由港從來不設關稅的事實。當局在今日的會議上與業界深入及坦誠交流，業界雖對持續不明朗的貿易格局感到擔憂，但仍遇強越強，並積極探討應對方案。


      
      
              



      
            
      
    
        
    
  



她續說，",singtao,local,2025-04-14 20:30,"

香港物流發展局今日（14日）召開會議。運輸及物流局局長兼香港物流發展局主席陳美寶在會上就美國濫施關稅包括進一步調高所謂對等關稅的舉措，聽取物流業界的意見，並商討如何共同應對。

陳美寶表示，美國早前宣布對不同貿易夥伴濫收所謂對等關稅，無視香港在《基本法》下是單獨的關稅區，以及作為自由港從來不設關稅的事實。當局在今日的會議上與業界深入及坦誠交流，業界雖對持續不明朗的貿易格局感到擔憂，但仍遇強越強，並積極探討應對方案。

她續說，運輸及物流局將與業界團結一致，以堅定的意志和堅強的信心共同應對為香港和業界帶來的挑戰。局方會擔當帶領的角色，就行業的發展提供更多具體導向，協助業界配合市場轉型。

運輸及物流局將帶領香港物流企業循五大策略應對，包括（一）開拓新興市場、（二）加強與粵港澳大灣區港口協作共同開拓新貨源、（三）豁免部份貨物的出入口許可證要求以吸引更多中轉貨物、（四）深化與國際港口和船舶合作，以及（五）擴大航運及航空網絡，以期為香港物流業尋找新增長點，鞏固及提升香港作為國際航運中心、國際航空樞紐和國際物流樞紐的地位和競爭力。同時，運輸及物流局亦會與其他相關政府部門包括香港海關等共同協作，以推行更多便利業界發展舉措，例如擴展跨境一鎖計劃、自由貿易協定中轉貨物便利計劃和空陸鮮活產品專屬快線等貿易便利措施，以加強香港的貨運中轉樞紐功能。"
"房協居屋2025｜「聚然」「峻然」收近17,000份申請表  超額認購9.6倍",2025-04-14 20:04,https://std.stheadline.com/realtime/article/2063942/即時-港聞-房協居屋2025-聚然-峻然-收近17-000份申請表-超額認購9-6倍,"【房協/住房/居屋/峻然/聚然】香港房屋協會推出的資助出售房屋項目「峻然」及「聚然」共約1,604個單位今日( 14日 )截止申請。房協回覆《星島頭條》查詢指，截至今天( 14日 )下午5時，房協合共收到近17,000份申請表，數目尚未計算部分以郵寄方式及經由屋邨辦事處遞交的申請表。",singtao,local,2025-04-14 20:15,"

【房協/住房/居屋/峻然/聚然】香港房屋協會推出的資助出售房屋項目「峻然」及「聚然」共約1,604個單位今日( 14日 )截止申請。房協回覆《星島頭條》查詢指，截至今天( 14日 )下午5時，房協合共收到近17,000份申請表，數目尚未計算部分以郵寄方式及經由屋邨辦事處遞交的申請表，換言之至少超額認購9.6倍。



 








 








 








 








 






 兩項目共提供1604個單位

「峻然」位於觀塘安達臣道R2-4用地，「聚然」則位於粉嶺馬會道，兩個項目合共提供1,604個單位。「峻然」是房協第二個推售位於觀塘安達臣道的項目，合共提供960個單位，單位實用面積介乎302至664平方呎，售價介乎249.7萬至636.7萬港元。「聚然」是房協首個坐落北部都會區的資助出售房屋項目，合共提供644個單位，單位實用面積介乎302至616平方呎，售價介乎230.7萬至547.1萬港元。

兩個項目售價約市值7折，並首次引入「家有長者」及「家有初生」優先選樓安排。一般申請人的綠表及白表配額比率為 40:60。"
泰國潑水節開鑼  總理佩通坦回故鄉清邁「參戰」,2025-04-14 20:03,https://std.stheadline.com/realtime/article/2063940/即時-國際-泰國潑水節開鑼-總理佩通坦回故鄉清邁-參戰,,singtao,international,2025-04-14 20:15,"

泰國總理佩通坦（Paetongtarn Shinawatra）周一回到故鄉清邁過潑水節（泰國的傳統新年），在舊城區帕邢寺參加浴佛儀式後，為泰韓合作活動「2025年清邁宋干節×保寧泥漿節」揭幕，還拿起水槍與民眾「激戰」，現場熱氛非常熱鬧。

佩通坦周一與丈夫和父親他信，一起回到故鄉清邁。一行人上午到帕邢寺參加沐佛儀式，並與寺廟住持親切交流。隨後一行人前往塔佩門，為「清邁宋干節×保寧泥漿節」揭幕，與民眾一起玩水。

相關新聞：泰國潑水節｜連假首日27死、201傷5萬人力加強管制

佩通坦拿起一把大水槍，他信則直接出動水喉潑水，與遊客互動合影，佩通坦還對着鏡頭比「手指愛心」，盡顯親民風範。

佩通坦說：「宋干節（潑水節）是大家回家與親人團聚的日子。我希望大家都能充分利用這個特殊的時刻，平安出行。值此泰國新年之際，祝願各位心情愉快，精力充沛，滿懷朝氣地重返工作崗位。」"
美國關稅︱中華出入口商會提14項建議  促香港轉型為「全球供應鏈服務中心」,2025-04-14 19:57,https://std.stheadline.com/realtime/article/2063938/即時-港聞-美國關稅︱中華出入口商會提14項建議-促香港轉型為-全球供應鏈服務中心,"香港中華出入口商會今日（14日）發布《推動香港貿易發展升級轉型》研究報告成果，指在目前全球經貿格局劇變與科技革命浪潮下，香港貿易行業正面臨「三變兩轉」的結構性挑戰，提出14項建議促進香港從「轉口貿易樞紐」轉型為「全球供應鏈服務中心」。

全球供應鏈碎片化迫使香港從「中間人」升級「供應鏈管理者」

研究指出，在國際層面，全球貿易保護主義抬頭與跨境電商「小額豁免」政策衝擊並削弱本港傳統轉口貿易優勢；在商業模式層面，全球供應鏈碎片化迫使香港須從「中間人」角色升級為「供應鏈管理者」；在技術層面，利用智能物流、大數據供應鏈及自動化倉儲等創新科技，重塑貿易產業鏈生態。",singtao,local,2025-04-14 20:15,"

香港中華出入口商會今日（14日）發布《推動香港貿易發展升級轉型》研究報告成果，指在目前全球經貿格局劇變與科技革命浪潮下，香港貿易行業正面臨「三變兩轉」的結構性挑戰，提出14項建議促進香港從「轉口貿易樞紐」轉型為「全球供應鏈服務中心」。

全球供應鏈碎片化迫使香港從「中間人」升級「供應鏈管理者」

研究指出，在國際層面，全球貿易保護主義抬頭與跨境電商「小額豁免」政策衝擊並削弱本港傳統轉口貿易優勢；在商業模式層面，全球供應鏈碎片化迫使香港須從「中間人」角色升級為「供應鏈管理者」；在技術層面，利用智能物流、大數據供應鏈及自動化倉儲等創新科技，重塑貿易產業鏈生態。

香港中華出入口商會會長貝鈞奇表示，香港需加速構建「空港經濟」新動能，發展高時效性、高附加值的航空貨運樞紐，同步推動從貨物轉口向「貿易服務中心」躍升，整合金融、法律、保險等專業服務優勢，提供全周期貿易支援。

立法會議員（進出口界）黃英豪表示，國際貿易到了前所未有的格局，世貿組織所制定的規則被某個國家單方面推翻，但一定有更多區域內的自由貿易協定出現並替補原有體系，香港在這過程中要找到正確定位，提供高端的供應鏈服務。他又指，香港是亞洲金融中心，相信將來中國與其他國家的貿易需用離岸人民幣結算，而香港正是離岸人民幣結算中心，對香港的未來感到樂觀。

香港中華出入口商會秘書長、項目統籌人温幸平表示，商會將聯同業界代表短期內向政府有關部門、社會各界及工商機構提交政策建議書，推動落實關鍵舉措。

記者 郭穎彤"
服裝配飾貿易商行賄罪成  法院頒令充公犯罪得益235萬元,2025-04-14 19:43,https://std.stheadline.com/realtime/article/2063936/即時-港聞-服裝配飾貿易商行賄罪成-法院頒令充公犯罪得益235萬元,"一名服裝配飾貿易公司董事在一宗廉署案件中承認在2014至2019年間，分別向兩間製衣公司的職員行賄，以換取多張採購訂單，早前被判囚22個月。區域法院今日(14日)頒令充公犯罪得益235萬元，即被告涉案的利潤。

何國榮，49歲，寶原行有限公司(寶原行)獨資股東兼董事，於2022年10月在區域法院承認一項串謀使代理人接受利益罪名及兩項串謀向代理人提供利益罪名，違反《防止賄賂條例》第9(1)(a)條及第9(2)(a)條以及《刑事罪行條例》第159A條，被判入獄22個月。

區域法院暫委法官劉綺雲今日批准控方申請，就其中兩項控罪頒令充公被告犯罪得益235萬元，即他從案中獲取的利潤。被告須於6個月內履",singtao,local,2025-04-14 20:00,"

一名服裝配飾貿易公司董事在一宗廉署案件中承認在2014至2019年間，分別向兩間製衣公司的職員行賄，以換取多張採購訂單，早前被判囚22個月。區域法院今日(14日)頒令充公犯罪得益235萬元，即被告涉案的利潤。

何國榮，49歲，寶原行有限公司(寶原行)獨資股東兼董事，於2022年10月在區域法院承認一項串謀使代理人接受利益罪名及兩項串謀向代理人提供利益罪名，違反《防止賄賂條例》第9(1)(a)條及第9(2)(a)條以及《刑事罪行條例》第159A條，被判入獄22個月。

區域法院暫委法官劉綺雲今日批准控方申請，就其中兩項控罪頒令充公被告犯罪得益235萬元，即他從案中獲取的利潤。被告須於6個月內履行充公令的要求，否則可遭加監35個月。被告早前已就餘下一項控罪向涉案製衣公司償還款項。

案情透露，寶原行是一家服裝配飾貿易公司，被告案發時與一名睡衣和泳裝製造商高級採購員達成協議，向對方支付賄款以換取增加向寶原行訂貨。期間該製造商向寶原行發出的購貨訂單大增，寶原行更成為其主要供應商。

被告又以相類貪污手法獲取一家牛仔服裝製造商的訂單。他同意向該公司一名採購文員提供賄款，以換取該採購文員向寶原行訂貨。

控方今日由署理高級檢控官許珉諾代表出庭，並由廉署人員劉顯傑及郭保強協助。"
乙明邨80X巴士泊街被鎖 九巴指車長短暫如廁 返回即交罰款解鎖,2025-04-14 19:26,https://std.stheadline.com/realtime/article/2063930/即時-港聞-乙明邨80X巴士泊街被鎖-九巴指車長短暫如廁-返回即交罰款解鎖,"網上今日（4月14日）流傳，指沙田乙明邨內一部九巴車胎被鎖。九巴回覆查詢時表示，早上約8時，九巴一輛繁忙時間特別班次路線80X巴士，正等候在乙明邨街巴士站開出，由於該處附近並無其他合適停泊巴士位置，車長曾短暫將巴士停在乙明邨街使用洗手間，返回巴士後立即繳交罰款解鎖，對巴士服務無任何影響。


      
      
              



      
            
      
    
        
    
  


乙明邨街為房協私家路

據區議會2020年12月31日文件資料顯示，運輸署回覆時任區議員時表示，乙明邨街為香港房屋協會（房協）管理的私家路。",singtao,local,2025-04-14 20:00,"

網上今日（4月14日）流傳，指沙田乙明邨內一部九巴車胎被鎖。九巴回覆查詢時表示，早上約8時，九巴一輛繁忙時間特別班次路線80X巴士，正等候在乙明邨街巴士站開出，由於該處附近並無其他合適停泊巴士位置，車長曾短暫將巴士停在乙明邨街使用洗手間，返回巴士後立即繳交罰款解鎖，對巴士服務無任何影響。



 






乙明邨街為房協私家路

據區議會2020年12月31日文件資料顯示，運輸署回覆時任區議員時表示，乙明邨街為香港房屋協會（房協）管理的私家路。據署方了解，乙明邨街已根據私家路守則劃設為限制泊車區，有關私家路的擁有人或獲授權人員已可根據法例第 374O 章《道路交通 (私家路上泊車 )規例》，行使鎖上、移走及處置在限制泊車區內停泊的車輛的權力，從而減少違例停泊造成的交通阻塞 。

香港房屋協會當時亦提到，乙明邨街毗連乙明邨，屬乙明邨地契範圍的私家路，由房協擁有。然而實際上乙明邨街儼如一條公共車道，須開放予公眾及公共交通工具使用。現時，有多條經政府及巴士公司協商安排的路線行經乙明邨街，加上附近兩所學校的校巴，以及駕車接送子女的家長亦會使用乙明邨街，該道路的日常交通非常繁忙。一般而言，當停車場營運商發現有違例泊車情況，會先發出口頭勸告，提醒駕駛人士盡快駛走車輛；若車內並無司機或乘客，營運商會發出書面警告；倘若在再次巡查時，有關車輛仍未離開，便會鎖車。"
深圳「洗衫板式」減速路壆網民誤解取笑   原來另有內情……,2025-04-14 19:20,https://std.stheadline.com/realtime/article/2063796/即時-中國-深圳-洗衫板式-減速路壆網民誤解取笑-原來另有內情,,singtao,greater_china,2025-04-14 19:30,"

近日，有網民在社交媒體平台上發帖反映，深圳龍崗區大運AI小鎮綠道，被鋪設密密麻麻的減速帶（路壆），外觀有如「洗衫板」。有網民調侃設計之餘，更笑言「可震膽結石」，甚至「反人類」。

據網上照片所見，涉事的龍崗區綠道上，每間隔一小段距離就鋪設有一條減速帶。數十米的距離內，減速帶的數量幾乎有近百條。

內地傳媒報道，龍崗區橫崗街道辦事處與相關部門現場核查後表示，大運AI小鎮綠道分主線與支線，其中支線總長3.37公里、寬1.5至2.5米。今次市民反映問題所涉區域位於支線，長度263米。經現場實測，該路段最大坡度達15度（坡度比27%），遠超深圳地方標準。

路段禁單車使用

為保障行人的出行安全，路段按照步行道標準進行建設，並明確禁止自行車（單車）騎行。

因初期管理疏漏，個別騎行人員誤入步行道，影響體驗。該街道已責成管養單位即日強化入口值守及全路段巡查和勸導，完善相關標識標牌，為市民徒步綠道提供更好的體驗。"
北都大學城︱劉國勳倡動態規劃洪水橋/廈村土地 優先發展教育用途,2025-04-14 19:20,https://std.stheadline.com/realtime/article/2063933/即時-港聞-北都大學城︱劉國勳倡動態規劃洪水橋-廈村土地-優先發展教育用途,"特區政府去年《施政報告》提出在北部都會區預留91公頃土地發展「北都大學教育城」，民建聯新界北立法會議員劉國勳今日（14日）聯同高力國際香港團隊召開記者會，建議動態調整洪水橋/厦村新發展區規劃，整合土地讓大學城優先上馬，將區內24至48公頃工業及社區用地改劃為教育用途。

劉國勳指出，洪水橋作為高端專業服務及物流樞紐的定位源於2018年規劃，但目前規劃與實際發展步伐有落差，引述去年多層現代產業大樓用地招標及原址換地申請都因市場反應要延期，強調需採用「動態規劃」機制，定期檢視土地用途，將需求疲弱的工業物流用地轉型為教育用途，既解決專上院校擴張需求，又能帶動北都人口與產業集聚。",singtao,local,2025-04-14 19:30,"

特區政府去年《施政報告》提出在北部都會區預留91公頃土地發展「北都大學教育城」，民建聯新界北立法會議員劉國勳今日（14日）聯同高力國際香港團隊召開記者會，建議動態調整洪水橋/厦村新發展區規劃，整合土地讓大學城優先上馬，將區內24至48公頃工業及社區用地改劃為教育用途。

劉國勳指出，洪水橋作為高端專業服務及物流樞紐的定位源於2018年規劃，但目前規劃與實際發展步伐有落差，引述去年多層現代產業大樓用地招標及原址換地申請都因市場反應要延期，強調需採用「動態規劃」機制，定期檢視土地用途，將需求疲弱的工業物流用地轉型為教育用途，既解決專上院校擴張需求，又能帶動北都人口與產業集聚。

高力香港董事總經理劉振江補充，香港高校非本地生比例放寬及全球百強院校優勢，已成為去年房地產市道中的主要交易驅動力，建議政府可乘勢頭，迎合市場急增的需求外，亦借此動能提速北都發展，最大程度發揮土地價值。

目前政府規劃的三大教育城選址中，洪水橋是唯一已完成收地的區域，而港鐵洪水橋站預計於2030年落成，在毗鄰建設大學城，將可充分利用該一帶地段周邊交通配套，便利學生及市民，有條件締造完整生活圈。劉國勳認為，考慮到整體發展時機、土地準備情況及交通配套等，洪水橋無疑是3個選址中，最有優勢發展大學城的地方。

劉國勳建議在重新規劃教育用地時，應融合「學研產居」的社群概念，引入企業和研究所﹑宿舍及商業配套等，以增強設施間的協同作用，而洪水橋規劃的住宅及產業，可與大學城產生協同效應。洪水橋站南面約24公頃土地適合發展綜合性大學城，北面約24公頃的物流用地若轉型為教育用途，將可促進學界與業界之間的深度融合，提升產業鏈競爭力。

劉國勳指，將與高力代表約見大學、教育局及發展局介紹倡議。"
荃灣多層停車場七旬翁墮下 倒卧行人天橋頂 送院搶救後不治,2025-04-14 18:58,https://std.stheadline.com/realtime/article/2063928/即時-港聞-荃灣多層停車場七旬翁墮下-倒卧行人天橋頂-送院搶救後不治,"今日（14日）下午5時許，一名70多歲男子於青山公路-荃灣段174-208號的荃灣多層停車場的高處墮下，倒卧對開行人天橋頂部，保安發現後報警。消防到場升起雲梯，將事主救回地面，當時他已陷昏迷，送往仁濟醫院搶救後不治。

消息指，男子疑從停車場7樓一躍而下，現場遺下一個袋及一張寫有遺言的字條，警方正調查意外原因。",singtao,local,2025-04-14 19:15,"

今日（14日）下午5時許，一名70多歲男子於青山公路-荃灣段174-208號的荃灣多層停車場的高處墮下，倒卧對開行人天橋頂部，保安發現後報警。消防到場升起雲梯，將事主救回地面，當時他已陷昏迷，送往仁濟醫院搶救後不治。

消息指，男子疑從停車場7樓一躍而下，現場遺下一個袋及一張寫有遺言的字條，警方正調查意外原因。

自殺求助熱線：

「情緒通」精神健康支援熱線：18111 
香港撒瑪利亞防止自殺會： 2389 2222
生命熱線： 2382 0000
明愛向晴軒： 18288
社會福利署： 2343 2255
撒瑪利亞會熱線(多種語言)： 2896 0000
東華三院芷若園： 18281
醫管局精神健康專線： 2466 7350
賽馬會青少年情緒健康網上支援平台「Open 噏」：http://www.openup.hk

"
