title,date,url,lead,source,section,scrape_time,news_content
太空旅行｜藍色起源「全女班」順利升空  貝索斯未婚妻親自設計太空服  樂壇天后Katy Perry隨隊出發,2025-04-14 16:14,https://std.stheadline.com/realtime/article/2063879/即時-國際-太空旅行-藍色起源-全女班-順利升空-貝索斯未婚妻親自設計太空服-樂壇天后Katy-Perry隨隊出發,"亞馬遜創辦人貝索斯的「藍色起源」（Blue Origin）公司14日執行全女性成員的太空任務。參與者包括貝索斯的未婚妻桑切斯（Lauren Sánchez）和樂壇天后凱姬蒂·派莉（Katy Perry）等6名女性。這是自1963年人類史上第一位女太空人獨自完成太空飛行以來，首次全女性成員的太空任務。

「全女班」進行11分鐘亞軌道飛行",singtao,international,2025-04-14 23:30,"

亞馬遜創辦人貝索斯的「藍色起源」（Blue Origin）公司14日執行全女性成員的太空任務。參與者包括貝索斯的未婚妻桑切斯（Lauren Sánchez）和樂壇天后凱姬蒂·派莉（Katy Perry）等6名女性。這是自1963年人類史上第一位女太空人獨自完成太空飛行以來，首次全女性成員的太空任務。

「全女班」進行11分鐘亞軌道飛行

相關新聞：藍色起源預告全女班太空之旅 貝索斯未婚妻帶Katy Perry等5人飛行

除了桑切斯和姬蒂·派莉，此趟飛行人員還包括哥倫比亞廣播公司記者蓋爾·金（Gayle King）、科學家艾莎·布朗（Aisha Brown）、民權活動家兼生物宇航研究員阿曼達·阮（Amanda Nguyen）以及電影製片人兼活動家凱麗安·弗林（Kerianne Flynn）。

她們將乘坐藍色起源公司的新謝潑德號火箭，從德州範霍恩（Van Horn）的發射場起飛，進行11分鐘的亞軌道飛行。亞軌道飛行相當於一次太空飛行，飛船將飛越卡門線（距離地面大約100公里）到達大氣外層空間，但速度不足以讓其停留在太空。

相關新聞：太空競賽｜藍色起源新格倫火箭成功進入軌道 貝索斯太空生意起飛


 








 








 








 








 








 








 








 








 








 






全妝上太空 太空服特別設計

6名飛行員早前為《Elle》雜誌拍攝封面，以黑色為主的穿衣風格，雜誌稱這是首次有人以完整妝髮飛上太空。桑切斯稱：「誰不想在飛行前打扮呢？」派莉補充道：「太空終於將要變美，如果我能在太空上變美，我會這麼做。我們會盡全力做宇航員。」蓋爾·金則表示，她「有很多恐懼」，「但我知道同時感到恐懼和興奮非常有趣，這會讓我走出舒適區。自分娩以來，我就沒有這種感覺。」

桑切斯還與設計師合作，為此次任務設計了專門的宇航服。桑切斯表示：「通常這些是為男性設計的服裝，然後才會為女性量身定制。」5個月前，她和紐約時裝品牌Monse的創始人費爾南多·加西亞（Fernando Garcia）、勞拉·金（Laura Kim）取得聯繫，邀請兩人與「藍色起源」合作，立即得到了同意的答復。桑切斯認為，本次任務的宇航服「很優雅，看起來既專業又女性化，讓太空變得更具吸引力」。"
關稅戰︱外交部回應美政策反復修改,2025-04-14 16:13,https://std.stheadline.com/realtime/article/2063884/即時-中國-關稅戰︱外交部回應美政策反復修改,,singtao,greater_china,2025-04-14 16:45,"

外交部今日例行記者會上，發言人林劍回應有記者就美國關稅政策反復修改的查詢。

相關新聞：特朗普稱豁免電子產品為短暫措施 將考慮徵收另一類關稅

林劍對此表示，商務部的新聞發言人已就此表明了中方的態度，事實已經並將繼續證明關稅戰、貿易戰沒有贏家，保護主義沒有出路，美國濫施關稅，損人害己。我們敦促美方放棄極限施壓的錯誤做法，在平等尊重互惠的基礎上，通過對話解決問題。

相關新聞：關稅戰︱特朗普沒等到習近平來電  美貿易代表：美中未安排通話

自美國總統特朗普宣佈向全球各國及地區加徵關稅，其標準不斷反復修改，更改變涵蓋範圍，令當地政府或企業可謂無所適從。其中，美國早前宣布智能手機和電腦將免除特朗普的「對等關稅」，美國總統特朗普周日澄清他對中國加徵「對等關稅」政策的最新訊息，指對智能手機與電腦的豁免將僅為短暫措施，並承諾將對半導體產業展開國家安全貿易調查。"
極端天氣︱渠務署加大緊急應變隊規模  引進排水機械人防水浸,2025-04-14 16:00,https://std.stheadline.com/realtime/article/2063878/即時-港聞-極端天氣︱渠務署加大緊急應變隊規模-引進排水機械人防水浸,"【雨季/渠務署/水浸/排水機械人】本港雨季即將來臨，渠務署署長莫永昌表示，該署已經趕在今年雨季前檢查過往曾經發生水浸的地點，及時清渠；緊急應變隊伍規模亦會增加20隊，強化水浸應變能力。他提到，該署近年引入機械人協助渠務工作，今年就最新引入4部強力排水機械人，加快水浸事故處理效率。

極端天氣帶來特大暴雨和超強颱風  為香港帶來前所未有挑戰

莫永昌今日（14日）在記者會上表示，近年極端天氣帶來的特大暴雨和超強颱風，為香港帶來前所未有的挑戰。他回顧去年2024年總降雨量為2310毫米，比正常值2431毫米低5%，去年全年沒有發出過黑色暴雨警告，但37次黃色暴雨比往年多，另有4次紅雨警告。渠務署緊",singtao,local,2025-04-14 16:30,"

【雨季/渠務署/水浸/排水機械人】本港雨季即將來臨，渠務署署長莫永昌表示，該署已經趕在今年雨季前檢查過往曾經發生水浸的地點，及時清渠；緊急應變隊伍規模亦會增加20隊，強化水浸應變能力。他提到，該署近年引入機械人協助渠務工作，今年就最新引入4部強力排水機械人，加快水浸事故處理效率。

極端天氣帶來特大暴雨和超強颱風  為香港帶來前所未有挑戰

莫永昌今日（14日）在記者會上表示，近年極端天氣帶來的特大暴雨和超強颱風，為香港帶來前所未有的挑戰。他回顧去年2024年總降雨量為2310毫米，比正常值2431毫米低5%，去年全年沒有發出過黑色暴雨警告，但37次黃色暴雨比往年多，另有4次紅雨警告。渠務署緊急事故控制中心去年共啟用7次，所有水浸個都能夠在1至2小時之內完成清理，恢復道路正常使用。

莫永昌指，天文台已預測2025年全年降雨量約為2100至2700毫米，屬正常水平。但他強調，水浸與否還要視乎降雨密度等，即使總降雨量高亦不代表會出現嚴重水浸。渠務署今年進一步強化緊急事故控制中心的應變能力，緊急應變隊由160隊增加至180隊，應變運作基地亦增至逾30個。預防水浸的恆常巡查地點由2024年的220個，提升至2025年的240個。

被問到2023年世紀暴雨後當局的改善措施，莫永昌指渠務署去年已更新設計手冊，將當時世紀暴雨的每小時158毫微米降雨量納入標準，「所以今日設計的主要防洪工程或設施，係會採用2023年500年一遇的標準做設計。」他又提到，當年發生嚴重水浸的地方，例如黃大仙、柴灣等都作了各項針對性改善惜施，例如加建入水口或排水沙井，黃大仙港鐵站及商場亦安裝了擋水裝置。

記者 趙克平"
48歲家庭主婦涉高等法院內拍攝 准保釋至6月9日再訊,2025-04-14 15:59,https://std.stheadline.com/realtime/article/2063877/即時-港聞-48歲家庭主婦涉高等法院內拍攝-准保釋至6月9日再訊,"【法院拍攝/高等法院/潘焯鴻/藐視法庭】中年婦人涉嫌於去年11月在高等法院3樓的會議室外拍攝，當時同層的法庭正審理中科監察主席潘焯鴻藐視法庭一案。婦人被控一項禁止在法庭內攝影等罪，案件今於東區裁判法院提堂。控方擬修改控罪內容，被告暫時毋須答辯，主任裁判官蘇文隆將案件押後至6月9日再訊，以待被告聘請律師並獲取法律意見，期間被告獲准以500元保釋候訊，不得接觸控方證人或前往案發地點。

48歲被告余淑萍，報稱家庭主婦，被控於2024年11月25日在高等法院3樓會議室外，在法庭內拍攝或企圖拍攝任何照片。

案件編號：ESCC3245/2024
本報記者",singtao,local,2025-04-14 16:30,"

【法院拍攝/高等法院/潘焯鴻/藐視法庭】中年婦人涉嫌於去年11月在高等法院3樓的會議室外拍攝，當時同層的法庭正審理中科監察主席潘焯鴻藐視法庭一案。婦人被控一項禁止在法庭內攝影等罪，案件今於東區裁判法院提堂。控方擬修改控罪內容，被告暫時毋須答辯，主任裁判官蘇文隆將案件押後至6月9日再訊，以待被告聘請律師並獲取法律意見，期間被告獲准以500元保釋候訊，不得接觸控方證人或前往案發地點。

48歲被告余淑萍，報稱家庭主婦，被控於2024年11月25日在高等法院3樓會議室外，在法庭內拍攝或企圖拍攝任何照片。

案件編號：ESCC3245/2024
本報記者"
八旬翁認以清潔刷手柄戳死兩鳥囚8周 官形容手法殘暴 患認知障礙仍可判監,2025-04-14 15:48,https://std.stheadline.com/realtime/article/2063873/即時-港聞-八旬翁認以清潔刷手柄戳死兩鳥囚8周-官形容手法殘暴-患認知障礙仍可判監,"【虐畜/認知障礙/暴力傾向/殘酷對待動物】87歲退休老翁去年在黃大仙慈樂邨服務設施大樓虐待兩隻雀鳥致死，他早前承認一項殘酷對待動物罪，案件今於九龍城裁判法院判刑。署理主任裁判官黃雅茵閱畢被告的心理科及精神科報告，並且考慮到被告坦白認罪、求情及案情後，最終判被告入獄8星期。黃官指案件嚴重性高，又形容被告手法殘暴，使雀鳥傷勢嚴重地慘死，認為即使被告患初期認知障礙，都可判監禁式刑罰。

報告指被告或患初期認知障礙致現暴力傾向

辯方求情時，引述被告的心理科報告，指被告能辨對錯，但很有可能患上初期認知障礙，導致決策能力和解難能力受損，因此無法作出適當的決定，今次犯案很可能與患病有關。辯方續指，進一步測",singtao,local,2025-04-14 16:00,"

【虐畜/認知障礙/暴力傾向/殘酷對待動物】87歲退休老翁去年在黃大仙慈樂邨服務設施大樓虐待兩隻雀鳥致死，他早前承認一項殘酷對待動物罪，案件今於九龍城裁判法院判刑。署理主任裁判官黃雅茵閱畢被告的心理科及精神科報告，並且考慮到被告坦白認罪、求情及案情後，最終判被告入獄8星期。黃官指案件嚴重性高，又形容被告手法殘暴，使雀鳥傷勢嚴重地慘死，認為即使被告患初期認知障礙，都可判監禁式刑罰。

報告指被告或患初期認知障礙致現暴力傾向

辯方求情時，引述被告的心理科報告，指被告能辨對錯，但很有可能患上初期認知障礙，導致決策能力和解難能力受損，因此無法作出適當的決定，今次犯案很可能與患病有關。辯方續指，進一步測試發現被告有輕微暴力傾向，而暴力傾向有可能由認知障礙導致，如若病情惡化，被告有機會繼續出現暴力行為。辯方指若有社工或輔導員介入，減緩被告病情惡化，可以降低重犯機會，遂希望法庭判處感化令，讓被告根據感化官安排接受輔導。

官指患認知障礙仍可判監

黃官判刑時，信納心理科報告指被告因認知障礙導致判斷能力、解難能力及控制情緒的能力有損。而心理醫生評估被告重犯機會屬中度偏低，黃官則表示難以判斷被告將來會否重犯，因與病情惡化有關。黃官強調本案嚴重性高，涉及不只一隻，而是兩隻雀鳥，且被告手法殘暴，利用對雀鳥而言體積較大的物品虐待雀鳥，導致牠們傷勢嚴重而慘死。黃官認為即使被告患初期認知障礙，都可以判處監禁式刑罰，考慮到被告年事已高、患病以及坦白認罪後，終判囚8星期。

87歲馮松年，報稱退休人士，被控於2024年9月7日在黃大仙慈樂邨服務設施大樓2樓殘酷地折磨兩隻雀鳥，使它們遭受不必要的痛苦。

用廚房清潔刷手柄反覆戳雀鳥頭部

案情指，被告於去年9月7日在慈樂邨服務設施大樓的共用廚房中，捉住兩隻從窗口飛進室內的雀鳥，並用廚房清潔刷的竹制手柄反覆戳雀鳥的頭部，目擊事件的住客通報大樓的舍監。舍監向被告查詢時，被告展示裝有兩具雀鳥屍體的塑膠袋，舍監其後向被告發出警告。

警誡下稱被飛進室內兩雀鳥激怒

當日晚上，警方到場調查並拘捕被告，他在警誡下承認用廚房清潔刷打死兩隻雀鳥，稱因為雀鳥飛進廚房會弄髒地方，故而作出如此草率的行為。被告稱討厭雀鳥亂飛令環境骯髒，並承認殺死兩隻雀鳥。被告又指自己被飛進來的雀鳥激怒，因此捉住牠們並用清潔刷反覆戳牠們的頭部，直到兩隻雀鳥死亡。為了確保雀鳥已死，被告再重覆擊打雀鳥的頭部十多次，之後將兩具屍體放入塑膠袋內，掉入垃圾桶。經檢驗後，兩具雀鳥屍體分別為珠頸斑鳩及紅耳鵯。

案件編號：KCCC449/2025
法庭記者：雷璟怡"
美國關稅︱陳茂波 : 關稅戰影響世界貿易秩序  香港聯動內企拼船出海招商引資,2025-04-14 15:37,https://std.stheadline.com/realtime/article/2063870/即時-港聞-美國關稅︱陳茂波-關稅戰影響世界貿易秩序-香港聯動內企拼船出海招商引資,"財政司司長陳茂波今日( 14日 )表示，美國單邊發動的關稅戰正在影響世界的貿易秩序，環球產業鏈、供應鏈正面臨巨大的割裂風險。在美國的霸凌極限施壓下，香港會用好「一國兩制」下「內聯外通」的獨特優勢，擔當好「超級聯繫人」和「超級增值人」的角色，聯動更多內地企業拼船出海，招商引資，在全力開拓新市場之際，也吸引更多外資來華投資興業。

香港正全速推進國際創新科技中心建設

陳茂波出席2025江蘇—香港技術創新合作大會致辭表示，香港作為粵港澳大灣區的中心城市，正全速推進國際創新科技中心的建設，因地制宜發展新質生產力，在人工智能、生命科技、金融科技、先進製造和新能源等賽道全力奮進。因應人工智能的飛躍發展和",singtao,local,2025-04-14 15:45,"

財政司司長陳茂波今日( 14日 )表示，美國單邊發動的關稅戰正在影響世界的貿易秩序，環球產業鏈、供應鏈正面臨巨大的割裂風險。在美國的霸凌極限施壓下，香港會用好「一國兩制」下「內聯外通」的獨特優勢，擔當好「超級聯繫人」和「超級增值人」的角色，聯動更多內地企業拼船出海，招商引資，在全力開拓新市場之際，也吸引更多外資來華投資興業。

香港正全速推進國際創新科技中心建設

陳茂波出席2025江蘇—香港技術創新合作大會致辭表示，香港作為粵港澳大灣區的中心城市，正全速推進國際創新科技中心的建設，因地制宜發展新質生產力，在人工智能、生命科技、金融科技、先進製造和新能源等賽道全力奮進。因應人工智能的飛躍發展和普及應用，在最近的《財政預算案》中，提出要全力發展人工智能為關鍵產業，並賦能傳統產業升級轉型，包括善用「一國兩制」下的獨特優勢及國際化的特點，讓香港成為人工智能產業國際交流協作的匯聚地。

他指蘇港兩地在創科的領域各具優勢，互補性強。今天稍後兩地的科研教育單位將會簽署多份合作協議，進一步深化在科研和技術創新方面的合作，加速科研成果轉化應用。他期待與江蘇企業加強合作，也歡迎它們來港設立國際業務總部、財資中心、研發中心，通過香港這個平台，發展國際業務，共同把握好大變局中的新機遇。他形容香港的獅子山與江蘇的紫金山交遇相依，將帶來無限亮麗的合作前景。





"
安達臣道冧天秤慘劇3死6傷 其中一名死者家屬入稟高院 向精進建築等七公司索償,2025-04-14 15:23,https://std.stheadline.com/realtime/article/2063868/即時-港聞-安達臣道冧天秤慘劇3死6傷-其中一名死者家屬入稟高院-向精進建築等七公司索償,"2022年安達臣道天秤倒塌三死六傷奪命意外，其中一名死者許文明的遺孀許太2023年亦因末期乳癌病逝，令許家兩名女兒無依無靠。許文明的家人上周五入稟高等法院，代死者及死者的受養人，向涉案地盤總承建商「精進建築有限公司」等7間公司提出傷亡索償，但入稟狀未有列明索償金額。根據司法機構網頁顯示，案件已排期於9月19日提訊。

7被告包括精進建築等

原告為死者許文明及其家人許有哲（代表他本人及死者的其他受養人），七名被告依次為精進建築有限公司、永茂機械（香港）有限公司、東泰工程有限公司、忠誠公証行有限公司、新科試驗有限公司、王董建築師事務有限公司和邵賢偉建築工程師有限公司。

入稟狀指，死者許文明於2",singtao,local,2025-04-14 15:30,"

2022年安達臣道天秤倒塌三死六傷奪命意外，其中一名死者許文明的遺孀許太2023年亦因末期乳癌病逝，令許家兩名女兒無依無靠。許文明的家人上周五入稟高等法院，代死者及死者的受養人，向涉案地盤總承建商「精進建築有限公司」等7間公司提出傷亡索償，但入稟狀未有列明索償金額。根據司法機構網頁顯示，案件已排期於9月19日提訊。

7被告包括精進建築等

原告為死者許文明及其家人許有哲（代表他本人及死者的其他受養人），七名被告依次為精進建築有限公司、永茂機械（香港）有限公司、東泰工程有限公司、忠誠公証行有限公司、新科試驗有限公司、王董建築師事務有限公司和邵賢偉建築工程師有限公司。

入稟狀指，死者許文明於2022年9月7日在西貢安達臣道石礦場第R2-2號工地地盤工作時身亡，死因是7名被告疏忽或違反謹慎責任。原告遂向7名被告連本帶利索償，惟入稟狀並沒有列明索償金額。

遺孀癌病過世遺兩年幼女兒需照顧

根據早前報道指，電工許文明因2022年9月7日天秤倒塌意外身亡，終年41歲，當時已證實患有末期乳癌的許太為爭取更多時間陪伴5歲及8歲的女兒，一直積極接受抗癌治療，最終不幸於2023年10月18日辭世，兩名女兒交由爺爺和姑媽照顧。

另一方面，35歲時任地盤總承建商「精進建築有限公司」男項目經理簡浩楷，因涉案安達臣道塌天秤事故被控以3項誤殺罪及被票控1項「進行工程方式導致有人受傷/財產損毀」罪。簡浩楷被控於2022年9月7日，在香港九龍秀茂坪安達臣道9號至11號安達臣道石礦場發展計劃R2-2地盤內非法殺死男子許文明、潘浩鈺及徐學培。根據司法機構網頁顯示，此案將於7月31日提訊，以進行交付程序。

案件編號：HCPI77/2025
法庭記者：劉曉曦"
《北京的金山上》首唱者、韓紅母親雍西逝世 享年78歲,2025-04-14 15:15,https://std.stheadline.com/realtime/article/2063867/即時-中國-北京的金山上-首唱者-韓紅母親雍西逝世-享年78歲,,singtao,greater_china,2025-04-14 15:30,"

據「西藏發布」消息，著名藏族歌唱家、原成都軍區戰旗歌舞團國家一級演員雍西，於2025年4月13日22時19分在北京逝世，享年78歲。

因演唱《北京的金山上》為人熟知

今日（4月14日），西藏自治區文學藝術界聯合會發佈訃告稱，雍西1946年12月1日出生於西藏自治區昌都市，藏族歌唱家、中共黨員、國家一級演員、成都軍區戰旗歌舞團副軍級文職軍官，曾任中國文聯委員、全國政協委員、中國音協理事，《北京的金山上》首唱者，其代表作有《一個媽媽的女兒》、《卓瑪駕起拖拉機》、《世界屋脊換了人間》等，曾多次獲得文化部、總政治部優秀演員獎、優秀表演獎。

相關新聞：西藏地震︱歌手韓紅率基金會抵現場 任賢齊王一博迪麗熱巴等藝人捐款破570萬

雍西18歲時曾在昌都被服廠當工人，1964年加入解放軍西藏軍區歌舞團，在全國少數民族群眾業餘藝術觀摩演出會上為毛澤東、周恩來等國家領導人獻唱歌曲《北京的金山上》，受到了周總理的稱讚，後來雍西也因演唱該首歌曲而被大眾熟知。曾先後進入中國音樂學院和上海音樂學院深造，期間加入了成都軍區戰旗歌舞團。2003年在女兒韓紅的「唱紅平安夜」個人演唱會上，與韓紅共同演唱了歌曲《歸來》。

韓紅今日表示，遵照母親遺願，不設靈堂、不辦儀式，遵照母親的囑咐做好善後事宜。"
日本7月大地震？ 中國駐日使館發文提醒公民防範,2025-04-14 15:11,https://std.stheadline.com/realtime/article/2063866/即時-中國-日本7月大地震-中國駐日使館發文提醒公民防範,,singtao,greater_china,2025-04-14 15:15,"

日本將發生百年一遇大地震傳聞不絕於耳。連中國駐日本大使館也發文，提醒公民防範地震災害。

發文引述日政府評估報告

相關新聞：311大地震14周年︱北海道千島海溝正累積能量 專家：或引9級地震

中國大使館於周一（14日）發文指出，日本是地震多發國家。去年8月位於南海海槽西端的宮崎縣發生7.1級地震，日本政府發布「巨大地震提醒」。日本媒體報道，3月31日，日本政府公布最新南海海槽大地震風險評估報告，將未來30年日本發生南海海槽大地震的概率從70%提升至80%，稱地震可能波及西起沖繩、東至福島的廣大區域，導致29.8萬人死亡，造成1.8萬億美元經濟損失。

進行「海外公民登記」以備不時之需

相關新聞：日本大地震先兆？專家：這三縣已見徵兆須警惕  其中一處港人常到

中國駐日本大使館提醒旅日同胞注意防範地震災害：

一、切實增強防範意識，及時了解掌握地震自救知識，適當儲備飲用水、食品、防災急救用品等應急物資。
二、通過電視、網絡、廣播等方式密切關注地震動態、氣像預警和防災信息，利用手機APP等設置災害提醒，災害發生後第一時間避難。
三、災後只有在避難所才能穩定獲得飲食、休息、通訊等基本保障。建議提前確認附近避難場所信息，遵循當地政府發布的預防、避難指令，盡快轉移至避難所等安全地帶。
四、積極通過「中國領事APP」或者微信「中國領事」小程序進行「海外公民登記」，以便災害發生時及時聯繫、獲得救助。
五、綜合考慮有關因素，建議穩妥安排赴日旅遊、留學，慎重選擇購置房產等。

相關新聞：全球10天10強震 台灣大地震醞釀中？專家籲隨身帶一物保命 日本等震區都管用

緬甸3月28日發生規模7.9級大地震，令人關注其他地區會否也陷強震風險危機，當中包括港人常前往旅遊的日本。日本政府專家小組早前再警告，北海道東面「千島海溝」未釋放的壓力來源，恐怕足以引發9級（M9クラス）大地震，呼籲外界檢討對地震與海嘯的防範措施。"
