title,date,url,lead,source,section,scrape_time,news_content
習近平抵達越南訪問 撰文強調關稅戰無贏家,2025-04-14 12:45,https://std.stheadline.com/realtime/article/2063768/即時-中國-習近平抵達越南訪問-撰文強調關稅戰無贏家,,singtao,greater_china,2025-04-14 13:00,"

央視新聞消息，當地時間4月14日中午，中共中央總書記、國家主席習近平乘專機抵達河內，應越共中央總書記蘇林、越南國家主席梁強邀請，開始對越南進行國事訪問。

習近平在赴河內對越南進行國事訪問之際，在越南《人民報》發表題為《志同道合攜手前行繼往開來續寫新篇》的署名文章。文章強調，關稅戰沒有贏家，保護主義沒有出路。要堅定維護多邊貿易體制，維護全球產業鏈供應鏈穩定。

文章全文如下：

志同道合攜手前行繼往開來續寫新篇
中共中央總書記、中華人民共和國主席習近平

暮春時節，生機盎然。在中越建交75週年之際，應越共中央總書記蘇林同志和越南國家主席梁強同志邀請，我即將對越南進行國事訪問。這是我擔任中共中央總書記、中華人民共和國主席以來第四次踏上這片美麗的土地，我期待同越南領導人暢敘友誼、共商合作，擘畫新時代中越命運共同體建設新藍圖。

中國和越南是社會主義友好鄰邦，擁有共同理想信念和廣泛戰略利益。在探索符合各自國情的社會主義道路和推進各自現代化進程中，兩黨兩國人民早年結下的深厚友誼不斷昇華。構建具有戰略意義的中越命運共同體符合兩國共同利益，有利於地區乃至世界和平穩定和發展繁榮，是歷史的選擇、人民的選擇。

中越命運共同體傳承於鮮明的紅色基因。兩國革命先驅攜手探尋救亡圖存道路，為世界取得反抗殖民主義、帝國主義鬥爭的勝利作出了重要貢獻。中國廣州的越南青年革命同志會、廣西靖西「越盟」辦事處等革命舊址是中越革命友誼的歷史見證。中國人民抗日戰爭時期，胡志明主席先後在延安、桂林、重慶、昆明等地參與和支持中國抗戰。中國派出軍事顧問團和政治顧問團支持越南人民抗法鬥爭，中國黨、政府和人民全力支援越南抗美救國正義事業。「越中情誼深、同志加兄弟」，成為永不磨滅的紅色記憶。

中越命運共同體發軔於深厚的政治互信。近年來，我同阮富仲總書記、蘇林總書記等越南領導人多輪互訪，為中越命運共同體建設定向把舵。兩黨兩國高層密切互動，中越雙邊合作指導委員會、兩黨理論研討會、邊境國防友好交流、兩國公安部合作打擊犯罪會議等機制有效運轉，兩國立法機構聯委會等高級別機制建立，兩國外交、國防、公安「3+3」戰略對話成功舉行。在許多國際和地區問題上，中越兩國立場相近、協作密切。

中越命運共同體植根於豐厚的合作沃土。在世界經濟復甦乏力背景下，中越產業鏈供應鏈合作更趨緊密。中國連續20多年是越南第一大貿易夥伴，2024年中越雙邊貿易額突破2600億美元。榴槤、椰子等越來越多越南優質農產品走進中國千家萬戶。兩國鐵路互聯互通和智慧口岸建設有序推進，光伏、垃圾發電等清潔能源項目有力保障越南電力供應，中國企業承建的河內輕軌2號線方便了市民日常出行。中越兩國相互成就、共同發展，生動詮釋了全球南方國家團結合作的意蘊。

中越命運共同體推進於密切的人文交流。這些年，中越人文交流步子越邁越大，兩國民眾越走越親。2024年中國赴越遊客超過370萬人次，德天（板約）瀑布跨境旅遊合作區正式運營、多條跨境自駕遊路線開通，讓「一日遊兩國」成為現實。中國影視作品、電子遊戲成為越南青年熱議話題，帶動越南「中文熱」持續升溫。不少越南歌曲登上中國互聯網熱搜，河粉等越南美食吸引不少中國民眾品嚐。

當前，世界之變、時代之變、歷史之變正以前所未有的方式展開，世界進入新的動盪變革期。面對單邊主義、保護主義抬頭，中國經濟迎難而上，2024年實現5%的增長，對世界經濟增長貢獻率保持在30%左右，繼續成為世界經濟重要引擎。中國新能源產業、人工智慧和動畫影視全球矚目。中國將堅持以高水準對外開放為世界提供更多機遇，以自身高品質發展助推各國共同發展。

亞洲是全球合作發展的高地，正站在實現整體振興新起點上，面臨前所未有的機遇和挑戰。中國將保持周邊外交政策的延續性和穩定性，堅持親誠惠容理念和與鄰為善、以鄰為伴方針，深化同周邊國家友好合作，共同推進亞洲現代化進程。

中國正在以中國式現代化全面推進強國建設、民族復興偉業，越南即將開啟民族發展新紀元、朝著建黨建國「兩個一百年」奮鬥目標邁進。中國始終將越南視為周邊外交優先方向。我們要全面深化中越命運共同體建設，為亞洲乃至世界和平穩定和發展繁榮作出積極貢獻。

——深化戰略互信，推動社會主義事業發展壯大。要堅持高層引領，發揮中越雙邊合作指導委員會統籌協調作用，深化黨際、政府、軍隊、執法安全等對口部門合作，攜手應對外部風險挑戰，共同維護政治安全。中方願同越方深化治國理政經驗交流，共同探索和豐富社會主義理論和實踐，推動兩國社會主義事業行穩致遠。

——堅持合作共贏，增進兩國人民福祉。要深化發展戰略對接，落實好兩國政府關於共建「一帶一路」與「兩廊一圈」框架對接的合作規劃，打造更多經濟、技術合作平臺。中方願同越方推進越南北部3條標準軌鐵路項目合作，建設智慧口岸。中方歡迎更多越南優質商品進入中國市場，鼓勵更多中國企業赴越投資興業。雙方要加強產業鏈供應鏈合作，拓展5G、人工智慧、綠色發展等新興領域合作，更好造福兩國人民。

——加強人文交流，拉緊民心相通紐帶。要以今年舉辦「中越人文交流年」為契機，開展豐富多元的人文交流。中方歡迎越南民眾多到中國各地「串門」，也鼓勵中國遊客到越南風景名勝「打卡」。要共同辦好中越青年友好會見、邊民大聯歡等有溫度、接地氣、聚民心的人文交流活動，深挖紅色資源，講好兩國人民友好故事，把中越友好接力棒一代代傳下去。

——密切多邊協作，促進亞洲繁榮振興。今年是中國人民抗日戰爭暨世界反法西斯戰爭勝利80週年，也是聯合國成立80週年。要堅定維護以聯合國為核心的國際體系和以國際法為基礎的國際秩序，積極落實全球發展倡議、全球安全倡議、全球文明倡議，推動平等有序的世界多極化、普惠包容的經濟全球化，同廣大全球南方國家一道，捍衛發展中國家共同利益。貿易戰、關稅戰沒有贏家，保護主義沒有出路。要堅定維護多邊貿易體制，維護全球產業鏈供應鏈穩定，維護開放合作的國際環境。要加強在東亞合作、瀾湄合作等機制內協調配合，為變亂交織的世界注入更多穩定性和正能量。

——妥善管控分歧，維護地區和平穩定。中越兩國解決陸地邊界和北部灣劃界的成功實踐表明，雙方完全有能力、有智慧通過協商談判解決好海上問題。雙方要落實兩黨兩國高層共識，發揮好海上談判機制作用，妥善管控海上分歧，持續擴大海上合作，為最終解決爭議積累條件。要全面有效落實《南海各方行為宣言》，積極推進“南海行為準則”磋商，排除干擾、聚同化異，將南海真正打造成和平之海、友誼之海、合作之海。

站在新的歷史起點上，中國願同越南一道，攜手前行、繼往開來，續寫中越命運共同體建設新篇章，為推動構建人類命運共同體作出新的更大貢獻。"
大阪世博 | 首日逼爆排隊逾2小時 網絡癱瘓「藏壽司」要等8小時,2025-04-14 12:44,https://std.stheadline.com/realtime/article/2063836/即時-國際-大阪世博-首日逼爆排隊逾2小時-網絡癱瘓-藏壽司-要等8小時,,singtao,international,2025-04-14 13:00,"

在日本大阪人工島夢洲主辦的大阪世博，首日開放就吸引超過14萬人排隊入場，門口網絡幾乎癱瘓，增加排隊入場的等候時間，導致訪客無法順利預約入場場館，排隊時間超過2小時，且廁所也是大排長龍。會場內標榜有全球最長迴轉帶的連鎖壽司餐廳「藏壽司」，竟要等候8小時才能入座，而會場走到最近的地鐵站也要2小時，不過仍擋不住絡繹不絕的訪客。

入口塞滿等入場民眾

大阪世博在周日上午正式開放參觀，雖然天公不作美，不過東口、西口早已擠滿等待入場的民眾，地鐵夢洲站到會場入口滿是人潮，警員與工作人員忙著維持秩序，估計訪客人數高達14萬。

相關新聞：
大阪世博︱首日湧逾14萬遊客 中國館展月壤備受關注

主辦單位雖然標榜本屆世博免排隊，不過在門口除了要掃門票QR碼，還得停下來接受安檢才能入場，速度並沒有提高許多。附近基地台也難以應付大量湧入的人潮，官方App甚至提醒民眾，指由於大門口手機連線不佳，請盡量別看影片。

中午時間，「藏壽司」早已擠滿用餐民眾，中午想入座竟要等8小時到晚上8點；另一間「壽司郎」也顯示目前有「279組客人等位」。

無現金交易反造成不便

另外，世博標榜會場內「無現金交易」，卻讓許多人必須拿現金儲值「西瓜卡」（Suica）才能購物，反而造成不便，會場內便利店同樣人滿為患。

下午3時左右有人陸續離開，社交媒體上就有人貼文指東口擠滿人，完全不能動。地鐵站附近也聽到有人抱怨，從開始排隊到進入地鐵站入口花了2小時，下雨好冷，擠不上電車。"
國安教育日︱港澳辦主任夏寶龍 明日將以視頻方式出席開幕禮 並發表主旨講話,2025-04-14 12:43,https://std.stheadline.com/realtime/article/2063835/即時-港聞-國安教育日︱港澳辦主任夏寶龍-明日將以視頻方式出席開幕禮-並發表主旨講話,"特區國安委指，明日（4月15日）是第十個「全民國家安全教育日」，今年亦是全國人大常委會公布實施《香港國安法》五周年和《維護國家安全條例》立法生效一周年，意義重大。國安委當日早上將於香港會展中心舉辦「全民國家安全教育日」開幕典禮暨主題講座。

中央港澳工作辦公室主任、國務院港澳事務辦公室主任夏寶龍將以視頻方式出席開幕典禮，並發表主旨講話。行政長官、國安委主席李家超表示熱烈歡迎，衷心感謝夏寶龍主任一直對香港的關心、指導和支持。


      
      
              



      
            
      
    
        
    
  


李",singtao,local,2025-04-14 13:00,"

特區國安委指，明日（4月15日）是第十個「全民國家安全教育日」，今年亦是全國人大常委會公布實施《香港國安法》五周年和《維護國家安全條例》立法生效一周年，意義重大。國安委當日早上將於香港會展中心舉辦「全民國家安全教育日」開幕典禮暨主題講座。

中央港澳工作辦公室主任、國務院港澳事務辦公室主任夏寶龍將以視頻方式出席開幕典禮，並發表主旨講話。行政長官、國安委主席李家超表示熱烈歡迎，衷心感謝夏寶龍主任一直對香港的關心、指導和支持。

李家超指出：「全國人大常委會於2015年通過《中華人民共和國國家安全法》，以法律形式確立了『總體國家安全觀』的指導地位，規定每年4月15日為『全民國家安全教育日』，今年4月15日將迎來第十個『全民國家安全教育日』，今年也是全國人大常委會公布實施《香港國安法》五周年和《維護國家安全條例》立法生效一周年，意義重大。」

李家超續指：「當前，世界百年未有之大變局正加速演進，地緣政治局勢日趨複雜，局部地區衝突頻繁，環球經濟增長放緩，單邊主義、保護主義抬頭，全球不穩定因素增加，香港面對的國家安全風險變化莫測，香港特區政府會堅定不移全面貫徹『一國兩制』方針，深入理解『總體國家安全觀』，不斷完善維護國家安全的法律制度和執行機制，深入推廣全民國家安全教育。」

他又提到，全民國家安全教育日開幕典禮及統籌一系列學校和社區活動，有助國家安全的宣傳教育，鼓勵全民參與，不斷提升社會自覺維護國家安全的意識和氛圍。「在全面拼經濟、謀發展、惠民生的同時，我們要竭力維護國家主權、安全和發展利益，為國家更高水平對外開放，作出更大貢獻。」"
無業男認旺角街頭身藏「太空油」押後判 官指修例前後皆屬禍害並具嚴重性,2025-04-14 12:35,https://std.stheadline.com/realtime/article/2063831/即時-港聞-無業男認旺角街頭身藏-太空油-押後判-官指修例前後皆屬禍害並具嚴重性,"【太空油/管有第I部毒藥】中年無業漢於去年11月在旺角管有俗稱「太空油」的毒藥，案件今早在西九龍裁判法院首次提堂。涉案男子承認管有第I部毒藥罪，裁判官李志豪斥「太空油」極具禍害性，不論在修例前或後都具嚴重性，下令將案件押後至4月24日求情及判刑，待索取戒毒所報告，期間被告須還押。

裁判官李志豪斥，案件一旦涉及「太空油」因素，不論是在修例前或後，都存在一定的嚴重性及損害，基於考慮「太空油」的禍害，決定將案件押後至4月24日，待索取戒毒所報告才聽取求情及判刑，期間被告須還押候懲。

旺角街頭形跡可疑遭警截停搜出「太空油」

44歲被告蘇勇威，報稱無業，被控管有第I部毒藥罪。控罪指，他於2024年",singtao,local,2025-04-14 12:45,"

【太空油/管有第I部毒藥】中年無業漢於去年11月在旺角管有俗稱「太空油」的毒藥，案件今早在西九龍裁判法院首次提堂。涉案男子承認管有第I部毒藥罪，裁判官李志豪斥「太空油」極具禍害性，不論在修例前或後都具嚴重性，下令將案件押後至4月24日求情及判刑，待索取戒毒所報告，期間被告須還押。

裁判官李志豪斥，案件一旦涉及「太空油」因素，不論是在修例前或後，都存在一定的嚴重性及損害，基於考慮「太空油」的禍害，決定將案件押後至4月24日，待索取戒毒所報告才聽取求情及判刑，期間被告須還押候懲。

旺角街頭形跡可疑遭警截停搜出「太空油」

44歲被告蘇勇威，報稱無業，被控管有第I部毒藥罪。控罪指，他於2024年11月9日，在旺角豉油街新興大廈外並非按照藥劑業及毒藥條例條文的規定，管有毒藥表第I部所列毒藥一個煙匣內有0.54克液體內有依托咪酯及0.84克液體內有尼古丁。

案情指，警方在2024年11月9日下午1時許在旺角巡邏期間，發現被告形跡可疑，因而截停被告。在搜查期間，揭發被告身上藏有依托咪酯及尼古丁等毒藥，警方繼而落案起訴被告。惟被告其後失聯，警方下達通輯令後，在今年4月將被告緝拿歸案。

案件編號：WKCC1603/2025
法庭記者：黃巧兒"
每日雜誌‧人物誌｜破傳統開班授徒逾百人 鍾氏父子「驅邪」 舞貔貅靈動重生,2025-04-14 12:30,https://std.stheadline.com/realtime/article/2063830/即時-港聞-每日雜誌-人物誌-破傳統開班授徒逾百人-鍾氏父子-驅邪-舞貔貅靈動重生,"《客韻流轉》系列——貔貅舞影承薪火

香港像座遺忘之島，城市節奏太快，潮流轉眼變成回憶，隨歲月凋零而散。在時代的夾縫中，有些文化卻如老榕般扎根，在靜默中長出新芽，隱於貔貅揚起的塵土，縈於山歌歎息的呢喃，藏於青磚縫隙的苔蘚，從未離開。傳統不僅是過去的遺產，也是未來的種子，近年本港推出鄉郊保育資助計劃活化客家村落、復育客家文化，贏得不少掌聲。本報將以系列報道，訪問本港客家文化的守護者，回望他們在保育路上的成敗得失，細數當中的變遷與點滴，並思考未來的傳承之路。

首篇探討年前幾近失傳的客家舞貔貅，在舞貔貅傳人鍾浩聲及其兒子鍾焯嵐的努力下，如何在保留傳統中創新，突破不傳外的規條，改良及推廣技藝，讓貔貅",singtao,local,2025-04-14 12:45,"

《客韻流轉》系列——貔貅舞影承薪火

香港像座遺忘之島，城市節奏太快，潮流轉眼變成回憶，隨歲月凋零而散。在時代的夾縫中，有些文化卻如老榕般扎根，在靜默中長出新芽，隱於貔貅揚起的塵土，縈於山歌歎息的呢喃，藏於青磚縫隙的苔蘚，從未離開。傳統不僅是過去的遺產，也是未來的種子，近年本港推出鄉郊保育資助計劃活化客家村落、復育客家文化，贏得不少掌聲。本報將以系列報道，訪問本港客家文化的守護者，回望他們在保育路上的成敗得失，細數當中的變遷與點滴，並思考未來的傳承之路。

首篇探討年前幾近失傳的客家舞貔貅，在舞貔貅傳人鍾浩聲及其兒子鍾焯嵐的努力下，如何在保留傳統中創新，突破不傳外的規條，改良及推廣技藝，讓貔貅舞得以延續。

45歲的鍾浩聲及22歲的鍾焯嵐，是本港客家舞貔貅的第6代及第7代傳人。貔貅是傳說中招財辟邪的瑞獸，性情兇猛，過去多於節慶，或麻雀館和賭場開業時舞動。客家舞貔貅傳入香港逾100年，鍾浩聲於13歲學習武術和客家舞貔貅，他指舞貔貅較舞龍和舞獅更注重腿法和下盤功夫，舞者須同時晃動貔貅頭，展現俯視、發怒等動作和神態，成功的舞者能盡顯貔貅的靈動及霸氣。鍾浩聲自言愛好挑戰，身材高䠷的他每每做到高難度動作，獲得極大滿足感，自此迷上舞貔貅，亦努力鑽研。

紮作技師襄助重紮貔貅頭

對近年客家舞貔貅從瀕臨失傳中延續下來，他感謝上天賜予機緣。現時鍾浩聲於1間中學及1間小學教授舞貔貅及龍獅，亦兼任非遺辦事處舉辦的客家舞貔貅訓練班導師。這次逆轉始於10年前，但真正的轉機出現在2022年——他獲准向公眾教授舞貔貅。過去3年他招收逾100名學員，直言成績理想，「若最後有10多名學員於未來繼續教授傳藝，已很不錯。」

曾經歷90年代習武及舞龍獅黃金時代的鍾浩聲，有一份武人的執着，他多番強調，擔心舞貔貅來到這一代失傳。他憶述，90年代進行一次舞貔貅表演後再無登場機會，早視那次為「最後一舞」，其後專注表演及教授舞龍和舞獅。至2014年，「舞貔貅」被列入「香港非物質文化遺產清單」的「表演藝術」項目，漸受重視，相熟的本地紮作技師何湛源邀他再舞貔貅，但他指當時已無現成的貔貅頭，亦難找表演機會，便推說「你紮作到貔貅頭，我便再舞」。

何湛源是有心人，說到做到，未幾交來紮作好的貔貅頭。一直未忘推廣舞貔貅的鍾浩聲，翌年找到於上水洪聖誕的表演機會，讓舞貔貅重現公眾場合。可是，他發現不少市民仍抗拒舞貔貅，對有人形容貔貅為「怪物」，更感不是味兒。往後數年，他仍致力推廣，惟時機未到。

真正令舞貔貅再次「落地」的機緣在2022年，他獲非遺辦邀請舉辦客家舞貔貅的訓練班。他指，當時客家舞貔貅瀕臨失傳，懂該技藝者全港只餘不足5人，認為若能辦公開課程有助推廣，但礙於舞貔貅的傳統是「傳內不傳外」，便向恩師歐紹永垂詢意見。歐師傅是南鷹爪門名師，德高望重亦思想開明，他理解已到傳承的關鍵時刻，毅然允許開班授課，打破缺口。



 








 








 








 








 






螢光粉紅盼改觀 助技藝普及

鍾浩聲為了讓舞貔貅普及，花盡心思。傳統舞貔貅展現舞者技藝，往往霸氣外露，動作懾人，而貔貅頭像顏色不吸引，造型兇猛，更有骰子、金錢及天九牌圖案，容易給人負面印象。他深信，若令外界對貔貅的印象改觀，可望在推廣上邁出重要一步。他深深明白，「時代巨輪不停轉，要在保留傳統中加入新思維，才能傳承下去」，並定下底線，不可改動舞貔貅的傳統禮規及儀式，但可因應時勢改良其造型及舞法。

鍾浩聲育有兩子，自小跟他學習舞龍獅及貔貅的技法，其中次子焯嵐更協助改良貔貅頭造型。焯嵐現職廚師，公餘練習舞獅及貔貅，亦是舞貔貅教練。他建議，除去骰子等圖案，並將貔貅頭的用色改為粉紅色及螢光色，甚至在頭像添上閃粉，讓貔貅頭變得親和可愛，又將表演的照片及短片上載社交媒體，以作推廣。

2022年正值第5波疫情襲港，中小學校停課，不少家長讓子女參加舞貔貅班，其後更有父母陪同子女一起報讀。鍾浩聲指，過去學習舞貔貅欠缺課程內容，但要辦公眾課程，便要制訂適合小學生、成年人到退休人士的統一教學模式，同時引入貔貅頭道具，協助學員練習時拿着舞動。



 






易學難精 傳承路漫長

可是當真正授課時，還是遇上不少考驗。鍾浩聲指，過去自己學習舞貔貅時已有武功底子，較易掌握踢腿等技法，只需揣摩表現神態。相比下，現時學員均未曾習武，亦視舞貔貅為課外活動或親子活動，難以要求他們即時做出高難度動作，但意外得着是現時的貔貅舞少了霸氣，多了可愛。他又把基本功融入熱身運動，讓學員慢慢鍛煉。鍾焯嵐自言，早年覺得舞貔貅極度困難，「當努力晃動貔貅頭展現神態，卻忽略馬步及舞法，完全不協調。」直至近年掌握徹底掌握技巧，拿捏好分寸，終能揮灑自如，展現出貔貅的靈動神態。

傳承，在於「有人傳授，有人繼承」，鍾浩聲希望未來吸納更多學員，亦鼓勵學員表演及參賽磨練，寄望未來能把客家舞貔貅傳到華人社區。他指，舞貔貅易學難精，舞者能否融會貫通，端視個人毅力及恆心，惟置身速食文化的年代，客家舞貔貅未來發展難料，他能做的只有播下種子，靜待開花結果。



 








 








 








 








 






技巧內涵兩並重 啟發舞出新章

對客家舞貔貅力求變革傳承，鍾浩聲極表贊成，因為早年他曾引入「南獅北舞」的技法，幸獲歐紹永師傅開明接納，才讓獅藝表演走出新里程。在推動客家舞貔貅上，他已籌劃在訓練步法外加入文化元素，豐富內涵。

談到歐紹永師傅，鍾浩聲態度恭敬，恪守武者尊師重道的禮規。他憶述，90年代學習傳統舞南獅，風格強調紮實的功夫架式，講究「硬橋硬馬」，但他希望引入北獅的跳樁技法，增加可觀性，亦展現武者的技藝。他憶述，當時曾有前輩反對，認為「南獅北舞」不倫不類，但最後獲歐紹永師傅及其他開明前輩首肯，最終於保留傳統南獅腰馬步法下，結合北獅跳樁動作，開創獅藝新風氣。近年各項有關改良舞貔貅的建議，他亦必定先徵詢歐師傅的意見。

在「南獅北舞」的經驗中，他得到啟發，要在保留傳統中創新，傳承之路才能走得更遠。在客家舞貔貅上，他除傳授舞步技巧，亦堅持灌輸客家舞貔貅由清末南傳香港的歷史，以及招財引福的歷史源流。他指，儘管如今的技法舞步與先祖輩時不相同，但核心價值仍能保留，如對貔貅頭的尊敬，故即使近年進行改良，他亦堅持保留頭像背面「貔貅座（坐）鎮」的字句，務求讓傳承兼具技巧與內涵。

隨時代轉變，舞龍和舞獅亦成為國際體育賽事項目，市民逐漸改觀，惟他指現時若要在公眾場合表演舞龍獅貔貅，即使活動以學校名義舉辦，事前仍要向警方申請，活動期間警方更會到來查閱證件。他理解執法人員亦是走程序，但擔憂相關行動為公眾帶來負面印象，長遠恐阻礙發展，盼當局檢視放寬。

兩子隨他學藝，對他亦以「師傅」相稱，他指，一日為師，擔子不輕，需糾正徒弟學員的品行，負一輩子的責任。早前，鍾浩聲父子獲邀拍攝港台節目《守藝薪傳》，盼以不同渠道，向公眾推廣技藝。

記者：關英傑

--

《客韻流轉》系列"
