id,title,date,url,section,source,last_update,scrape_time,news_content
3524978.0,每日雜誌｜ 防火用品銷量飆10倍  劏房清雜物避災  港人防災意識急升  跟風購買存隱憂,2025-12-08 12:30,https://www.stheadline.com/society/3524978/每日雜誌-防火用品銷量飆10倍-劏房清雜物避災-港人防災意識急升-跟風購買存隱憂,"
        社會
    ",singtao,2025-12-08 12:30,2025-12-08 12:45,"大埔宏福苑火災後，不少市民自行購備防火用品。多間消防設備公司近日生意倍增，有公司指煙霧感應器、滅火筒及防煙面罩生意額錄得10倍增長，較輕便的1公斤裝乾粉式滅火筒出現缺貨。對市民自行購買防火用品，業界認為市民自救意識提高，但強調遇到火警，市民應以逃生為先，勿高估能力自行救火。居於劏房及天台屋的居民，近日忙於清理家居雜物，亦有人睡前關掉電器的電源。關注團體正籌辦防火講座，並募捐派發防火用品，提醒提防火患。

本報聯絡市面多間售賣消防設備公司，相關負責人均指，過去1星期接獲市民就手提滅火筒及滅火氈等防火用品的查詢激增20%，連帶銷售額亦以倍計。

油麻地一間消防設備公司的負責人阿華指，大火後至今，每日接獲10多至20個電話查詢，主要希望了解家居防火用品的價格及功能，當中以手提式滅火筒最暢銷。他指，市面有售的滅火筒包括二氧化碳氣體式滅火筒、水式滅火筒、乾粉式滅火筒及泡沫式滅火筒；乾粉式滅火筒適用於大多數火警，如電器或易燃液體引發的火警。

阿華續稱，乾粉式滅火筒由1公斤至5公斤的5款，現時熱賣的是較輕便、適合家居使用的1公斤及2公斤裝，銷量較平日增加1倍。他稱，最高銷量是單日賣出合共60支，近日需求增加，逐漸賣清存貨，正向供應商補充貨源。

屬消防處註冊消防裝置承辦商的安利消防器材有限公司，其負責人陳國燊指，過去1星期，不少市民來電查詢防火產品，亦有市民「上網」了解後，直接到門市購買。他稱，市民主要購買3類防火產品，包括具警示作用的煙霧感應器、滅火用品如滅火筒及滅火氈，和可用於火警逃生的防煙面具。他稱，近日上述3類貨品的整體銷量增加達10倍及以上。

陳解釋，煙霧感應器於偵測到煙或火時會發出警號，提示居民逃生，可安裝於牆壁或天花，售價由250元至400元。至於近日熱賣的乾粉式滅火筒，售價由300元至450元。另有市民購買滅火氈，除可用於滅火，亦可於逃生時披在身上；每張滅火氈售價介乎300元至450元。至於僅供一次性使用的防煙面具，只有3年期效，每個售價達400元，亦有一定銷量。

陳國燊指，近年港人防火意識提高，乾粉式滅火筒一直有固定銷量，不乏市民購買自用及公司訂購；近年亦有貿易公司定期訂購逾百個防煙面具派發給員工，以備不時之需。他稱，大火後上述多項貨品連日需求大增，當中乾粉式滅火筒供應出現緊張。

售賣消防用品的五金店負責人Alex則提醒市民不宜「跟風」購買相關用品，除擔心因儲存及使用不當引致反效果，亦不希望市民建立錯誤的信心，遇到火警時嘗試自行救火，而錯過逃生時機。

Alex指，市民要認識所添置防火用品的特性，舉例乾粉式滅火筒儲存上要注意，不可接近火源、不能受到陽光直接照射，並要遠離潮濕水氣。他續稱，該類滅火筒一般有效期是3至5年，市民要定期檢視，並留意滅火筒的「撞針」有否「移位」，以免影響效能。他特別提到，乾粉式滅火筒所噴出的乾粉會減低能見度，令人難以辨別方向，若市民遇上火警時，自以為可用乾粉式滅火筒撲救，可能因視線受阻而影響逃生，後果嚴重。

Alex語重心長說，救火是消防員的專業，反而希望市民提高安全意識，「聽到火警鐘響，應出門口看看發生甚麼事，事事提高警覺。」他又留意到，有市民購買俗稱「豬咀」的防毒面具，作防火用途，有關面具確可過濾有毒氣體，但不能供氧，若被困火警時戴上防毒面具，雖可過濾毒氣，但可能會在濃煙密布的火場缺氧昏迷、甚至死亡。

大火亦令不少基層住戶注重防火，深水埗唐樓劏房戶陳太近日忙於清理家中雜物，認為要從消除火源做起，以避免雜物助燃火勢。家住葵涌天台屋的黃太亦指，家中唯一逃生通道是大廈樓梯，留意到有住客在樓梯放雜物及垃圾，日前已向業主立案法團投訴，亦希望其他住客自律。

有前線社工關注「三無大廈」居民的安危，他稱「三無大廈」不設業主立案法團，消防安全設施簡陋及失修，無法符合《消防法例》要求，如定期由註冊消防裝置承辦商每年最少1次保養樓宇內的裝置。他稱雖然當局推動「樓宇消防裝置及設備周年檢查支援服務」，近年曾為深水埗部分「三無大廈」完成年檢及更新消防設備，但希望相關劏房業主拿出良心，主動為劏房戶提供煙霧感應器等防火用品。

不少劏房坐落失修舊樓，社區組織協會副主任施麗珊指，電器火警是另一火警隱患。她稱，有劏房戶反映，業主不肯維修單位的電線，憂慮電線殘舊影響電力負荷，竟禁止住客使用冷氣及雪櫃等消耗電量較大的電器。

深水埗唐樓劏房戶陳太亦指，早前曾有鄰居關掉電磁爐電源後外出，但爐具失靈險釀火警。她稱，近日睡前必定拔掉電磁爐及電視機等電器的電掣，斷絕電源，避免失火。施麗珊亦指，定期家訪會提示居民防火，未來考慮舉辦防火講座，並為有需要居民募捐防火用品。

劏房支援連線成員賴建國亦指，《簡樸房條例》明年生效，現時條例有一定防火要求，如每間簡樸房內應設獨立火警偵測器、簡樸房的分隔牆、室內走廊兩旁牆壁及入口門須耐火不少於1小時等。他指，人命可貴，希望當局考慮在每間簡樸房內增設自動灑水系統，阻止火勢蔓延，為住客爭取逃生時間。

除了基層居民關注防火，毗連鬧市民居的小販排檔是本港地標式旅遊熱點，有旺角「女人街」及廟街夜市的檔主稱，近日接獲食環署提醒提高防火意識，防患於未然。

旺角著名旅遊熱點「女人街」現時有400多個非固定的攤檔，攤檔背向民居，是本港的城市風景。2011年11月花園街排檔發生四級大火，釀成9死34傷，通菜街（女人街）販商協會主席鄭素娥指，自此當局提高攤檔及排檔防火規格，如要求排檔採用防火物料搭建、排檔之間預留足夠空間，方便附近樓宇住客疏散，並須每檔配備滅火筒。

鄭續稱，「女人街」攤檔屬「朝行晚拆」，大大減少火警隱患。近年「女人街」攤檔雖曾於日間營業時發生小火警，但檔主十分警覺，曾於消防員到達前自行用滅火筒撲滅火源，火源疑涉附近居民丟棄煙蒂。她指，於大埔火災翌日接獲食環署通知，促請檔主提高防火意識，如清理雜物，減少火警危機。

油麻地廟街的排檔亦屬旅遊熱點，近年增設提供明火煮食的廟街夜市。廟街販商商會主席陳錦榮亦指，提供明火煮食的夜市販商已應消防處要求，每檔配備小型滅火筒及滅火氈，至於其他乾貨排檔，亦各自配備滅火筒，消防處亦有定期巡查。

花園街販商協會主席黃培清亦指，大埔大火當日下午正與消防處及食環署等進行季度會議，期間加入排檔冬季防火的討論。有花園街檔主稱，四級大火後，當局推行「留架不留貨」的措施，確保排檔每晚沒有存貨，避免助燃火勢，他直言，「不准貨物留過夜」確實不便，但人命安全最重要。

記者：關英傑"
3524976.0,連鎖快餐店見阿叔撿食二手飯陷掙扎 良心食客最終一「尷尬」舉動  獲網民讚爆：唔需要介懷,2025-12-08 12:29,https://www.stheadline.com/food/3524976/連鎖快餐店見阿叔撿食二手飯陷掙扎-良心食客最終一尷尬舉動-獲網民讚爆唔需要介懷,"
        飲食
    ",singtao,2025-12-08 12:29,2025-12-08 12:45,"在人來人往的都市中，不少人也在等待你我的一個小小善舉，排憂解困。有網民近日就在社交平台Threads 上分享一個小故事，指自己在連鎖快餐店吃早餐時，目睹一中年男在店內徘徊，似乎想要撿食他人剩下的早餐，內心掙扎後決定為對方買一份全新的早餐，希望能為其挽回一點尊嚴。這一事件引起了網民的廣泛關注和熱烈討論。

目睹阿叔食二手飯  港男猶豫：會唔會介入咗佢本身嘅因果呢

事主在社交平台上分享了自己用餐時的一段經歷，描述了當時的所見所感，並分享了自己最終的決定，帖文觸動了不少讀者。當時，該網民正獨自坐在一角吃早餐，留意到「有一個叔叔在人哋食早餐嘅時候喺人哋旁邊行來行去」。他觀察了一會兒，發現該名叔叔一直在等待其他食客離開，然後進食他們吃剩的食物。目睹此景，事主內心產生了猶豫，他心想：「應唔應該請佢食早餐呢？」甚至一度思考此舉「會唔會介入咗佢本身嘅因果呢？」。

「尷尬」舉動試為阿叔挽回尊嚴：請佢食個早餐都唔係咩大問題

然而，事主轉念一想，認為「請佢食個早餐都唔係咩大問題」，而且該名叔叔沒有騷擾其他食客，也非主動乞討。事主表示，雖然不知道對方有著怎樣的背景和故事，但認為「一個早餐嘅錢，如果可以幫到叔叔挽回一個小小嘅尊嚴，都值得嘅」。本著「有緣見到就伸出下隻手」的念頭，他決定行動。

事主本想請職員將食物直送過去，但最後還是選擇親自請叔叔「坐低」，並將等候食物的牌子交給他。事主坦言自己當下「有少少尷尬，所以我放低咗就即刻走」。

網民大讚事主  兼提「更貼心」做法

該分享帖文發布後，迅速引起網民共鳴，不少人留言讚揚事主的善心。有網民稱讚這是「好人好事，值得讚」，並鼓勵事主：「你做得好好樓主，唔需要介懷，做自己認為啱嘅事」。亦有網民分享類似經歷，表示自己也曾購買食物給有需要的人，認為這是「日常生活」中自然而然的舉動。更有留言指，事主的行為是「承傳獅子山精神」，一件微不足道的小事，卻可能意義深遠。此外，有網民體貼地提出建議，認為下次可以「話你唔小心叫多咗，可唔可以叫佢幫幫手要咗佢」，讓雙方都不會感到尷尬。

資料來源：holisticwellnessetc＠Threads

延伸閱讀：沙田路邊出現神秘箭嘴？由瀝源橋亭仔指向隧道出口 網民揭記號用途：唔係古靈精怪嘢"
3524974.0,大埔宏福苑五級火│死者家屬DNA採樣 「好想畀返身份佢哋 」嘆申援過程辛苦,2025-12-08 12:21,https://www.stheadline.com/breaking-news/3524974/大埔宏福苑五級火死者家屬DNA採樣-好想畀返身份佢哋-嘆申援過程辛苦,"
        突發
    ",singtao,2025-12-08 12:21,2025-12-08 12:30,"大埔宏福苑五級奪命火，8座大廈中有7座陷入火海，釀成過百人死亡，其中先起火為宏昌閣低層棚架位置。今日有宏昌閣失聯住戶的家屬到廣福社區會堂，進行DNA採樣，希望可辨認出遺體。陳小姐的父母住在宏昌閣低層單位，預料已罹難，但至今仍未找到遺體，或已化成灰燼。她指今早進行口腔組織採樣，過程約半小時，被告之需三至四星期才有化驗結果。

大埔宏福苑五級火│失聯者及未能辨認遺體家屬 今早到社區會堂作DNA採樣



「佢哋（工作人員）話唔知搵唔搵到遺體，有機會被水沖走，講咗好多可能性，依家唯有接受咗先。」她又坦言好傷痛，「好想畀返個身份佢哋（死者）。」除了失去親人，對於善後工作亦感身心疲乏。「仲有好多手續要辦，每一日都有好多嘢要自己排隊，就算搵親朋戚友代辦都唔可以，要我同妹妹拎住災民證去辦。」

她又坦言一戶一社工並無落實，「其實有啲災民都仲未聯絡到社工幫手，每日都要自己去撲，有時朝早10點排隊，排到下午3點，但11點已經派完籌，之後又唔知幾時再派籌，我一日要行四區，去唔同地方申請基金。」

對於若一旦證實不到父母罹難，沒有死亡證如何是好，她坦言百感交集，「我都想知程序，但香港的政策又要跟返（程序），希望盡快解決，因為返工的返工，返學的返學，唔可以冇了期請假，我嚟咗新公司唔係做咗好耐，但公司都很體諒我，由第一日出事到依家，冇可能返到工，真係好影響生活。」"
3524966.0,立法會選舉︱新議會40人屬新面孔 27人身兼全國人大政協 佔總數三成歷屆最多,2025-12-08 12:15,https://www.stheadline.com/politics/3524966/立法會選舉新議會40人屬新面孔-27人身兼全國人大政協-佔總數三成歷屆最多,"
        政情
    ",singtao,2025-12-08 12:15,2025-12-08 12:30,"立法會選舉曲終人散，90名當選人磨拳擦掌，準備投入新一屆議會工作。新一屆90名議員之中，有50人是連任議員，40人是新丁。最資深議員分別為民建聯主席陳克勤、會務顧問李慧琼、經民聯梁美芬，三人都是2008年連任至今。

另一方面，今屆有多達14名港區全國人大代表，以及13名全國政協委員進入立法會，合共27人，屬歷屆最多，佔全體議員三成。

江旻憓、方國珊領銜 40名新丁登堂入室

今屆地區直選之中，有12名當選人是連任議員，8人是新人，連任者包括民建聯主席陳克勤、工聯會會長吳秋北等；功能界別的30名當選人中，有16人是新人，包括旅遊界的「劍后」江旻憓，另有14名是現任議員。選委界方面，24名當選人是連任者、16人是新人。

港區人大代表 近四成當選立法會議員

港區人大政協，在「愛國者治港」時代下，對香港政治的參與程度越來越高。《星島》根據香港友好協進會網頁核對，以下27名當選人身兼港區全國人大政協：

李慧琼*吳秋北梁美芬吳永嘉陳曉峰姚祖輝陳振英霍啟剛陳勇文頴怡樓家強黃錦良陳曼琪陳仲尼

*李慧琼同時身兼全國人大常委

劉業強邵家輝吳傑莊劉智鵬蘇紹聰管浩鳴黃錦輝李鎮強何君堯魏明德范駿華朱立威黃國

參考上屆議會，共有24人身兼全國人大政協（人大政協各12人），本身已屬歷來最多，今屆增至27人，換言之再創新紀錄。其中港區人大代表總共只有36人，其中14人擔任立法會議員，比率高達39%。

此外，循選委界連任成功的李浩然，雖非港區人代政協，但本身亦是基本法委員會委員。新一屆議會有大批議員身兼國家要職。





回到目錄

地區直選點票結果

"
3524969.0,巴基斯坦邊境建結合旅遊新國道  連接喀喇昆侖公路往中國,2025-12-08 12:14,https://www.stheadline.com/realtime-world/3524969/巴基斯坦邊境建結合旅遊新國道-連接喀喇昆侖公路往中國,"
        即時國際
    ",singtao,2025-12-08 12:14,2025-12-08 12:30,"巴基斯坦交通部近日宣布，已批准修建一條從西北部開普省曼塞赫拉地區通往中國邊境的公路，命名為「新15號國道」。

按照計劃，新15號國道將連接曼塞赫拉、納蘭和齊拉斯等北部重鎮，設計為雙向四車道，可全年通車，並將以公私合營的模式共同開發，公路沿線將建設度假村、酒店、湖泊風景區和購物商圈，有望成為新的旅遊走廊。

巴基斯坦此前已建設15號國道

巴方之所以將新項目命名為新15號國道，是因為當地原本已設有15號國道，主要連接曼塞赫拉和吉爾吉特-伯爾蒂斯坦地區的齊拉斯市，被視為喀喇昆侖公路（巴稱35號國道）的分支。

喀喇昆侖公路由中方援建，於1979年全線通車。因年久失修，中方先後開啟喀喇昆侖公路改擴建項目和喀喇昆侖公路二期項目。

相關新聞：巴基斯坦兩航天員來華培訓 明年進中國太空站

巴基斯坦傳媒指出，原本的15號國道和喀喇昆侖公路都經過曼塞赫拉，去往中國邊境仍需要通過喀喇昆侖公路後半程。新15號國道旨在為喀喇昆侖公路提供更快、更安全的替代路線，豐富巴基斯坦北部地區交通網絡，改善當地交通狀況。"
3524970.0,香港科技探索旗下HKTVmall英國無人店結業 IG貼「R.I.P」自嘲,2025-12-08 12:04,https://www.stheadline.com/realtime-finance/3524970/香港科技探索旗下HKTVmall英國無人店結業-IG貼RIP自嘲,"
        商業創科
    ",singtao,2025-12-08 12:04,2025-12-08 12:15,"HKTVmall母公司香港科技探索（1137）自2023年8月在英國曼徹斯特開設首家無人商店「In:Five」，惟事隔兩年多，該店上周於Instagram官方帳號宣布停運，更配以「R.I.P.」字眼自嘲。香港科技探索股價半日跌1.38%，暫報1.43元。

全英僅餘一間分店試業

帖文同時指出，位於曼徹斯特MediaCity（媒體城）的分店目前正在邀請用家測試中；目前全英亦僅餘一間分店仍在試業中。

事實上，HKTV在2024年年報中表示，英國無人商店的發展正面對重大技術障礙，導致項目延誤超出了最初的時間表。報告指出，儘管工程團隊已盡全力應對，但受限於當地複雜的監管法規及技術難題，前進之路仍高度複雜。"
3524965.0,浙江度假村點燈疑倒入酒精  3人全身著火畫面曝︱有片,2025-12-08 12:04,https://www.stheadline.com/realtime-china/3524965/浙江度假村點燈疑倒入酒精-3人全身著火畫面曝有片,"
        即時中國
    ",singtao,2025-12-08 12:04,2025-12-08 12:15,"浙江有度假村發生恐怖意外。遊客在參加聖誕點燈儀式期間，疑有人在火裡倒入酒精，導致3人全身著火送院。

網民：就怕蠢人靈機一動

內地網民「Miss菲」發影片，指其朋友日前參加浙江莫干山裸心堡度假村一個聖誕點燈儀式時，被大火燒傷，要求涉事度假村承擔責任。

從影片可見，在裸心堡參加聖誕點燈儀式的遊客有約30-40人，全部在戶外圍坐於一個爐火旁，部份人頭戴聖誕帽。

事發時有一名外籍人士在演講，疑有人在爐火中倒入酒精，導致爐火突然冒出大火，其中3名遊客遭波及，全身著火。

3名火人立即起身躲避，有人頭髮也起火，其中1名男遊客立即試圖脫去起火衣服，在場其他遊客則紛紛協助另兩名起火者滅火。

荔枝新聞8日報道，指莫干山裸心堡度假村的行政總監回應指，事故中有3人受傷，正在住院，傷勢方面不重，派出所已經介入，具體原因還在調查中。

網民紛紛批評在明火中倒入酒精反智，危害他人，「看地上的藍色火焰，肯定是倒入了酒精」、「就怕蠢人靈機一動」、「身上著火第一時間在地上打滾呀」。

"
3524964.0,尖沙咀兩私家車相撞 2女司機同傷送院,2025-12-08 11:59,https://www.stheadline.com/breaking-news/3524964/尖沙咀兩私家車相撞-2女司機同傷送院,"
        突發
    ",singtao,2025-12-08 11:59,2025-12-08 12:15,"今日（8日）早上10時18分，兩輛私家車在柯士甸道和覺士道交界相撞。警方及消防接報指有人被困車上，於是到場救援，證實無人被困。惟意外中兩名女司機同告受傷清醒，其後由救護車送往伊利沙伯醫院治理。

現場消息稱，涉事的黑色私家車沿柯士甸道往紅磡方向行駛，另一輛白色私家車則由柯士甸道右轉駛入覺士道。當兩車駛至覺士道交界時相撞，車頭均損毀。警員正調查意外原因。"
3524954.0,南韓總統府月底遷回青瓦台 標誌「龍山時代」結束,2025-12-08 11:56,https://www.stheadline.com/realtime-world/3524954/南韓總統府月底遷回青瓦台-標誌龍山時代結束,"
        即時國際
    ",singtao,2025-12-08 11:56,2025-12-08 12:15,"南韓總統秘書室長姜勳植周日（7日）證實，為期數月的青瓦台整修工作已完成，總統府將於月底從龍山遷回青瓦台，標誌「龍山時代」正式結束。

姜勳植表示，青瓦台的環境整頓及電氣通信施工已全部完成，總統府預計12月25日前後從龍山遷出，「回到其原本應該在的地方」。

姜勳植另提到，供傳媒記者使用的新聞發佈間也將於12月20日至23日之間遷至青瓦台春秋館，總統府未來還計劃線上進行新聞發佈會，擴大新聞發佈方式。

相關新聞：李在明：將盡快把韓總統府遷回青瓦台

總統李在明在競選期間曾表示，他將暫時在龍山總統府辦公，青瓦台重新裝修後，會把總統府遷回青瓦台。

自1948年以來，青瓦台一直是韓國歷任總統官邸和辦公場所。前總統尹錫悅2022年5月上任後，將辦公地點搬遷至首爾市龍山區國防部大樓的新設總統府。"
3524963.0,內地11月美元計價出口增5.9%勝預期 進口增1.9%,2025-12-08 11:48,https://www.stheadline.com/macroeconomics/3524963/內地11月美元計價出口增59勝預期-進口增19,"
        宏觀經濟
    ",singtao,2025-12-08 11:48,2025-12-08 12:00,"中國海關總署公布，11月以美元計價出口按年增長5.9%，較預期為高，10月為跌1.1%；進口增長1.9%則低於預期，但較10月加快0.9個百分點。11月貿易順差為1,116.8億美元。

以1至11月計，出口按年增長5.4%，進口下跌0.6%，貿易順差10,758.48億美元。

以人民幣計價，11月出口按年增長5.7%，較10月跌0.8%為佳；進口增長1.7%，升幅較10月加快0.3個百分點。11月貿易順差為7,926億元。以首11個月計，出口按年增長6.2%，進口增長0.2%。"
3524961.0,觀塘海濱道男童遭的士撞倒 受傷送院,2025-12-08 11:47,https://www.stheadline.com/breaking-news/3524961/觀塘海濱道男童遭的士撞倒-受傷送院,"
        突發
    ",singtao,2025-12-08 11:47,2025-12-08 12:00,觀塘發生交通意外。今日（8日）早上10時40分，一輛的士駛至海濱道151至153號對開時，撞倒一名男童。男童受傷倒地，熱心途人上前協助。救護員其後到場，發現男童清醒，於是將他送往伊利沙伯醫院救治。
3524962.0,華製INIU充電器涉11宗火警釀3傷 美宣布回收21萬部,2025-12-08 11:43,https://www.stheadline.com/realtime-world/3524962/華製INIU充電器涉11宗火警釀3傷-美宣布回收21萬部,"
        即時國際
    ",singtao,2025-12-08 11:43,2025-12-08 12:00,"美國消費品安全委員會（CPSC）指，在中國深圳製造的INIU充電器（型號BI-B41），存在鋰電池可能過熱並自燃的風險，目前已有11宗起火通報，CPSC為此宣布回收21萬部。

今次回收的商品名稱為INIU BI-B41 Power Banks，產品序號則是000G21、000H21、000I21、000L21，一共發生15宗行動電源過熱事件，其中11宗引發火警，造成3人燒燙傷、財產損失逾38萬美元（約295萬港元）。

促往官網登記退款

CPSC指出，該商品於2021年8月至2022年4月在電商亞馬遜發售，價格為18美元（約140港元）。CPSC呼籲，民眾應立即停用手上的回收產品，但不可隨意丟棄在垃圾桶及廢電池回收桶。

CPSC表示，民眾應聯絡自身所在城市的家庭危險廢棄物收集中心或其他地方政府部門，以便確認當地如何處理鋰電池產品，並前往INIU官網登記，以獲得全額退款。"
