id,title,date,url,section,source,last_update,scrape_time,news_content
3577985,宏福苑安置︱東華三院額外撥款 居民接受政府轉讓業權方案 每戶可獲3萬元安居津貼,2026-05-31 09:27,https://www.stheadline.com/society/3577985/宏福苑安置東華三院額外撥款-居民接受政府轉讓業權方案-每戶可獲3萬元安居津貼,"
        社會
    ",singtao,2026-05-31 09:27,2026-05-31 09:45,"東華三院早前公布撥出1000萬元，為接受政府收購建議的大埔宏福苑業主，提供免費法律援助，料可協助800至1000宗個案。另外，政府早前向宏福苑業主發出收購建議信件，希望他們於8月底前表達出售業權的意願。東華三院行政總監蘇祐安今早（31日）在商台節目指出，東華三院最新已額外撥出3千萬元，作為新居所安居津貼，只要接受政府的轉讓業權方案，即可獲得支援，每戶3萬元。

蘇祐安指出，法律援助計劃反應正面，至今已接獲超過1000宗查詢。至於到東華三院於大埔服務中心查詢服務的個案，則有逾500宗。他形容工作進度理想，會轉介個案交由律師團隊核實及跟進。他又提到，早前於大埔設立鄰舍資源中心後，不少宏福苑居民反映不太了解長遠安置方案的法律程序，擔心出現財政壓力，因此推出免費法律援助服務，希望盡力幫助大家。

相關新聞：

東華免費法援獲逾千宏福業主查詢

東華三院接獲居民意見 冀覓新居所期間有所支援

蘇祐安又提到，近期亦聽到街坊意見，指日後出售業權後，希望盡快找到新居所，中間也有些過渡時間，決定往後具體新居所的選擇，到底參與哪個項目，可能需要一些經濟援助，而不同家庭狀況各異。

因此他透露，東華三院最新決定額外撥出3千萬元，讓居民尋覓新居所過程中可獲直接援助，每戶3萬元。只要居民可出示證明，以示接受政府的轉讓業權方案，並有新居所需要，即可符合資格。若居民選樓需時，要幾個月才完成行政程序，亦可先取資助。款項用途不限，居民可用於租金、添置傢俱等用途等。

接受委託提供法律服務的國際青年法律交流聯會創會會長、立法會議員范凱傑在同一節目指出，3個法律團隊共有數百名律師提供服務，而樓宇買賣及轉讓手續涉及不同程序，律師會與業主見面時，會解釋法律程序及相關法律後果，亦涉及「實報實銷」的影印及查冊費用，將以最低收費協助居民。此外，不少居民都關注出售業權後，業權附帶權利及責任誰屬，以及買賣及轉讓程序的時長，相信免費法律援助能支援居民。"
3577981,中環私家車上揭懷疑毒品 警封鎖現場調查,2026-05-31 09:13,https://www.stheadline.com/breaking-news/3577981/中環私家車上揭懷疑毒品-警封鎖現場調查,"
        突發
    ",singtao,2026-05-31 09:13,2026-05-31 09:30,"今（31日）晨8時16分，警方在中環皇后大道中72號對開一輛私家車上，發現懷疑毒品，封鎖現場調查。據了解，今凌晨5時許，一對情侶曾在車上發生爭執，女乘客情緒激動大吵大鬧：「我哋分X咗手，我唔再愛你吖」，她繼而坐上司機位，兩度用腳踢向男司機下半身。途人見狀報警，警員到場調查，發現涉事男司機與女友身上均有酒氣，其後二人帶走調查。

"
3577980,習近平9月訪美前 特朗普或暫緩與賴清德通話,2026-05-31 09:02,https://www.stheadline.com/realtime-china/3577980/習近平9月訪美前-特朗普或暫緩與賴清德通話,"
        即時中國
    ",singtao,2026-05-31 09:02,2026-05-31 09:15,"美媒報道，國家主席習近平今秋訪美前，美國總統特朗普將暫緩與台灣領導人賴清德通話。習特會後，美國近日暫緩批准140億（美元，下同）對台軍售案。美國國防部長赫格塞思在被問及對台軍售時稱，任何決定都將由特朗普做出。

赫格塞思：對台軍售應分開看待

外媒早前報道，美國對台的140億軍售案，將是歷來金額最高的一次，涉及武器包括「愛國者三型」防空反導導彈系統，及先進地對空防空系統。

此前美方消息指，為確保美軍擁有充足彈藥用於對伊朗發動的「史詩級怒火」軍事行動，決定暫停對台軍售案。相關新聞：特朗普將與賴清德通話 外交部：停止向「台獨」勢力發出錯誤信號

赫格塞思昨日被問及對台軍售時回應稱，對台軍售案和彈藥供應問題應分開看待，「我們的庫存完全足以應付，無論是在當地還是全球各地」。對於任何對台軍售的決定，都將由特朗普定奪。

白宮此前宣布，特朗普邀請習近平9月24日訪美，中國駐美大使館公使銜副館長邱文星27日表示，習近平已同意於今秋訪美，但具體日期仍待確定。美國哥倫比亞廣播公司前日引述多名知情人士報道，習近平訪美前，特朗普將暫緩與賴清德對話。

報道指出，特朗普5月中旬訪華時，習近平曾表明要謹慎處理台灣問題，若處理不當，將令中美發生碰撞甚至衝突。此後特朗普兩度表示，在決定是否批准對台軍售前，將先與賴清德通話。"
3577979,貝森特稱現為沃什掌儲局好時機 不會面臨減息政治壓力,2026-05-31 09:00,https://www.stheadline.com/macroeconomics/3577979/貝森特稱現為沃什掌儲局好時機-不會面臨減息政治壓力,"
        宏觀經濟
    ",singtao,2026-05-31 09:00,2026-05-31 09:15,"外媒報道，美國財長貝森特上周五表示，剛上任的聯儲局主席沃什（Kevin Warsh）不會面臨要求減息的政治壓力。

貝森特在一個場合被問及是否認同美國總統特朗普希望沃什保持獨立性的說法時，回答：「百分之百認同。」貝森特認為，儘管目前通脹與利率仍偏高，但現在正是沃什接掌儲局的好時機。

在沃什的宣誓典禮上，特朗普表示，「我希望沃什能完全獨立。不要看我，也不要看任何人，只要按照自己的想法做事，並把工作做好。」

債券市場預估加息四分一厘

目前債券市場預估儲局今年將加息四分一厘。儲局官員則傾向按兵不動，但正密切關注通脹壓力是否進一步擴散，以判斷是否需要再度加息。貝森特指出，美國國債殖利率正好在沃什上周五宣誓就任儲局主席前一天見頂。

最新通脹數據顯示，沃什面臨的挑戰並不輕鬆。4月美國消費者物價按年增近4%，且通脹壓力似乎正在擴大，因能源價格上漲推高企業成本，並逐漸轉嫁給消費者。同時，美國4月批發價格按年增6%，主要也是受到能源價格上漲帶動。

同日，美國聯儲局理事鮑曼表示，儘管中東戰爭對經濟的影響仍在評估之中，但這可能導致通脹持續攀升，屆時或需採取更緊縮的貨幣政策。"
3577978,中國觀察：釋永信入獄 佛門商業化塵緣已了？,2026-05-31 08:57,https://www.stheadline.com/realtime-china/3577978/中國觀察釋永信入獄-佛門商業化塵緣已了,"
        即時中國
    ",singtao,2026-05-31 08:57,2026-05-31 09:00,"河南法院前日判決少林寺原住持釋永信數罪並罰，判刑24年、罰款350萬。過去20多年，釋永信做得最成功的一件事，便是讓外界深信佛寺可以走商業化之路，但這也是一條讓他「走火入魔」的不歸路。

從1999年正式接任少林寺方丈後，釋永信跳出傳統，帶着這座千年古剎興辦文旅產業、拓展品牌營銷、布局海外市場，就連多國賓客也慕名而來。相關新聞：少林釋永信被判囚24年 中國佛教協會：咎由自取

在大眾認知裡，釋永信長袖善舞，擅於經營，將少林寺打造成商業帝國。他手握數百個商標，涵蓋影視、旅遊、餐飲，將古剎名氣推向頂峰。這一切看似順應大勢，即使惹起爭議，也有人以「在商言商」替其辯護，佛寺儼如牟利機構，釋永信成了少林寺CEO。

然而，在無序的商業化操作下，貪婪暗中滋生。法院查明，1998年至2025年間，釋永信利用職務便利，犯下職務侵佔、挪用資金、受賄、行賄多項罪名，涉案金額近3億元。

寺院門票收入、十方信眾的功德款，本是維繫古剎運轉、傳承文化的資財，卻被他視作私人金庫。更荒唐是，釋永信私生活糜爛，長期與多名女性有不正當關係，甚至育有私生子。

類似的「酒肉和尚」過往也有，較轟動的是2018年時任中國佛教協會會長釋學誠被指控性侵女弟子、寺廟違建、挪用善款等。他最終辭職被「發配」福州一間寺廟，靜思己過。

不同的是，釋永信案直指宗教商業化的禍害，信仰、權力和金錢勾結，不但損害了這座千年古寺的名聲，也褻瀆了整個佛教界的公信力。

種貪緣，得纏縛；造惡業，墮苦果。釋永信的牢獄之災，並不能代表內地宗教商業化時代結束，宗教同旅遊捆綁的例子仍隨處可見，但類似少林寺般野蠻生長的過度商業化行為，預料將大為收斂，其意義遠大於一個釋永信被懲戒，相信也是此案要傳達的最重要訊息。

紀曉華"
3577977,伊朗局勢︱伊導彈襲科威特 殘骸毀損美2架MQ-9無人機,2026-05-31 08:55,https://www.stheadline.com/realtime-world/3577977/伊朗局勢伊導彈襲科威特-殘骸毀損美2架MQ-9無人機,"
        即時國際
    ",singtao,2026-05-31 08:55,2026-05-31 09:00,"在美國總統特朗普考慮是否延長美伊停火協議之際，美國媒體報道，伊朗近日向科威特空軍基地發射一枚彈道導彈，儘管科威特成功攔截，掉落殘骸造成5名美方人員輕傷，兩架美國MQ-9死神無人機嚴重受損。

無人機造價超2億港元

知情人士透露，科威特防空部隊攔截了伊朗發射的「征服者-110」型導彈，但碎片墜落在美軍位於科威特的薩利姆空軍基地，導致包括承包商及現役人員在內，約有5人受到輕傷。一架死神（Reaper）無人機被摧毀，至少有另一架嚴重受損；這類無人機每架造價約達3000萬美元（2.35億港元）。

相關新聞：伊朗局勢︱美伊協議草案仍待批准 擬設3000億美元戰後重建基金

科威特遇襲之際，美方正在考慮一項延長美伊停火狀態的協議。特朗普上周五在白宮戰情室同其助手們的會議持續約兩個小時，但並未就與伊朗的協議作出「最終決定」。 特朗普當天早些時候在社交媒體發文重申美國對伊朗談判的立場，並稱「我現正前往戰情室開會，以作出最終決定」。特朗普說，伊朗必須同意永遠不擁有核武器，霍爾木茲海峽必須立即雙向開放，免收通行費，允許航運交通不受限制地運行，所有水雷都需被清除。

相關新聞：伊朗局勢︱美空軍已折損42架飛行器 作戰成本逾850億美元超估算3倍

伊朗外交部發言人巴加埃周五晚發聲明說，伊朗與美國的訊息交流仍在繼續，但尚未達成最終共識。 聲明提及霍爾木茲海峽，強調伊朗和阿曼作為沿岸國的管理責任。伊朗法爾斯通訊社當日以伊方知情人士為消息源，反駁特朗普關於美伊協議內容的最新說法，稱其言論「真假參半」，試圖描繪捏造的勝利。

報道說，特朗普對協議要點的歪曲主要體現在兩方面。一是霍爾木茲海峽。二是核材料。知情人士強調，諒解備忘錄中不僅沒有此類內容，而且說法毫無根據。 報道還說，特朗普忽略了協議中的一些關鍵條款，比如美國必須立即解凍伊朗被凍結資產中的120億美元。"
3577976,王毅晤卡尼：中加關係轉圜是加方正確選擇,2026-05-31 08:49,https://www.stheadline.com/china-politics/3577976/王毅晤卡尼中加關係轉圜是加方正確選擇,"
        大國外交
    ",singtao,2026-05-31 08:49,2026-05-31 09:00,"外交部長王毅上周五在渥太華與加拿大總理卡尼會面，是相隔十年再有中國外長訪加。王毅強調，中加關係轉圜是加方的正確選擇，兩國擁有巨大合作空間。

加拿大對華出口有望翻倍

卡尼在會面中表示，他年初訪華時與中方決定構建中加新型戰略夥伴關係。4個月來，中加各層級交往、各領域合作加速重啟推進，取得積極成果。加方願同中方一道，密切高層交往，深化能源、金融、農漁業等領域合作，不斷夯實兩國關係基礎。

王毅表示，卡尼成功訪華，中加關係校正航向，重歸正軌。他強調，事實已證明，中加關係轉圜，符合兩國利益，順應各方期待，是加方的正確選擇，又稱兩國之間不存在根本利害衝突，擁有巨大合作空間。

王毅上周四抵達加拿大，開展為期3天的訪問，期間還同加拿大外長阿南德舉行會談。經貿是此次會談重點，中國是加拿大第二大貿易夥伴。阿南德表示，希望達成「到2030年對華出口增長50%」的目標。王毅稱，如果延續兩國發展的良好勢頭和政策穩定，加拿大對華出口有望翻倍，中國市場永遠向加拿大敞開。"
3577975,短線炒作好玩但無益 低撈富途獲利後 轉買一隻軟件ETF｜李聲揚,2026-05-31 08:48,https://www.stheadline.com/investment/3577975/短線炒作好玩但無益-低撈富途獲利後-轉買一隻軟件ETF李聲揚,"
        投資理財
    ",singtao,2026-05-31 08:48,2026-05-31 09:00,"筆者較少做短線操作，也較少在本欄討論。但筆者近期低位買了富途（FUTU）獲利，然後轉買一隻軟件ETF（IGV），也和讀者分享一下心路歷程。不過整體來說，買入優質股並長期持有，才是主菜。短線炒作，只像零食，好玩但無益。

富途幾年前已有類似劇本

富途被中央政府處分，大家已有所聞。但當日盤前股價一度跌40%，開盤仍跌超過30%，筆者就趁機買入。背後原因已在社交媒體及Patreon解釋，不重複太多。肯定的是，這不是富途首次被「整頓」（也可能不是最後一次），但只要投資者不善忘，就會記得幾年前已有類似劇本。

網上的「分析」嘩眾取寵，部份提到公司將會倒閉，或者是內地人只能沽貨不能買貨，甚至要峰擁來港。但現實一點，類似的劇本幾年前已上演，而罰款金額對富途來說也是小菜一碟。創辦人只被罰125萬人民幣，更明顯是從輕發落，根本是好消息！

筆者之前都有想買入富途，苦無機會。結果成功在大插時，約84元買入。不過，富途股價反彈之快，也叫筆者意外，一度反彈至110元水平，而「出事」前才120元左右；當近兩天富途股價也穩定下來，筆者認為「時機差不多」，就減持了大部份持股，只留下小部份。

投資者切忌陷入僵化思維

監管機構的處分，肯定對富途還有影響，股價回升至近110元，似乎已相當合理。但必須強調的是，市場並不總是線性運作。我們常會觀察到一種現象：儘管基本面惡化或出現利淡消息，股價卻依然堅挺，甚至高於壞消息前的水平。這在投資領域並不罕見，例如過往美股在關稅戰陰霾下仍能突破新高（明明有效稅率仍較關稅戰前高），或是疫情期間市場在極短時間內修復並刷新高位（明明疫情一定會打擊經濟）。因此，作為投資者，切忌陷入僵化的直線思維，更不要執意與市場趨勢對抗，盲目「造淡」。

筆者保留了小部分富途倉位，因為長遠來看，筆者仍欣賞該公司的商業模式。然而，近年外在干擾不斷，難免讓人思考是否有更佳選擇，例如考慮買入盈透證券（IBKR）。背後的核心投資邏輯始終不變：我們應「買莊不買閒」。在這個資本市場中，散戶以為聰明，日炒夜炒，最終獲利的往往是券商、發行商，這實質上是一場財富轉移的過程。

軟件板塊已出現明顯復甦

另外，筆者沽出大部份富途的資金，轉向了軟件類股ETF（IGV）。理由很簡單：之前軟件即服務（SaaS）板塊歷經了嚴峻的「世界末日」，估值一度跌至谷底，但近期伴隨着如Snowflake（SNOW）等企業繳出亮眼業績，該板塊已明顯復甦。與其費心挑選單一個股，不如透過IGV進行「大包圍」配置——反正筆者都持有微軟、Palantir及Salesforce等較大的公司。

筆者仍是主張採取中長線布局，投資不應是日夜懸心的負擔，在輕鬆的狀態下運作，其重要性往往被嚴重低估。

當然，筆者針對富途採取了「超短線」策略，皆因機會一閃即逝；但對於IGV這類中長線布局，則毋須過於急躁。所以我們不能一本通書睇到老。

若果短期IGV能有可觀獲利，筆者可能又會再鎖定部份利潤，再調配至黑石Blackstone（BX）等標的。BX作為私募信貸巨頭，其業務與SaaS板塊的興衰有著千絲萬縷的聯繫，筆者會在未來詳細剖析。但這只是一個假設，筆者並未進行相關操作，也可能改變主意。

Patreon作者 李聲揚

相關文章：退休All in美債 穩賺5厘表面吸引 單靠債券難贏通脹 「不宜全數資產瞓身」｜李聲揚

李聲揚簡介:

財經分析員，Patreon作者，專欄作家，文青。金融或非金融故事。

網站: https://www.patreon.com/ivanliresearch

Facebook: https://www.facebook.com/meatbonetea/?locale=zh_HK"
3577974,困擾學界80年數學難題 AI破解「平面單位距離猜想」,2026-05-31 08:46,https://www.stheadline.com/realtime-world/3577974/困擾學界80年數學難題-AI破解平面單位距離猜想,"
        即時國際
    ",singtao,2026-05-31 08:46,2026-05-31 09:00,"美國人工智能(AI)公司OpenAI近日宣布，其AI模型成功破解困擾學界長達80年的難題「平面單位距離猜想」。這項顛覆性成果展示了AI從過去連基本運算都顯得笨拙，到如今具備解決高等幾何理論的智慧，引發學界轟動。

該猜想由傳奇數學家艾狄胥於1946年提出，是離散幾何領域的核心難題。簡單來說，其核心問題是：「如果你在一張紙上畫n個點，有多少對點之間的距離恰好為1個單位？」艾狄胥本人的猜測是，將這些點排列成網格可以得到一定數量的點對，沒有其他排列方式會做得更好。80年來，學界也普遍相信類似「正方形網格」是最好的解法。然而，OpenAI的通用推理模型自主推導出了一套打破傳統網格思維的反證。它突破性地運用了高階的「代數數論」，在平面上建構出了一種全新的點陣排列方式，宣告推翻艾狄胥「平面單位距離猜想」。

相關新聞：AI越用越蠢？｜實驗揭外判思考驚人後果 互動10分鐘解難表現跌20%

頂尖數學家驗證推理有效

隨即，多位非OpenAI公司的國際頂尖數學家驗證其推理有效。這項突破讓不少對AI能否徹底改變數學抱持懷疑態度的學者都感到震驚。普林斯頓大學教授阿隆稱讚AI做到了人類嘗試卻失敗的事，多倫多大學助理教授利特亦稱其為令人興奮的獨立成果。數學界最高榮譽之一「菲爾茲獎」的得主高爾斯更給予極高評價：「若此推理由人撰寫並提交到《數學年刊》，而我被要求快速給出意見，我會毫不猶豫推薦接收。」他還表示，人類在解決數學問題方面將很難與AI競爭。曾對OpenAI早期數學成果持批評態度的數學家布魯姆審查後也承認，AI擁有高於人類的毅力，走完了那些因耗時而被人類放棄的路徑。"
3577973,遼寧小子染白髮穿皮褸掃街  扮黃仁勳影片播放量破百萬,2026-05-31 08:40,https://www.stheadline.com/realtime-china/3577973/遼寧小子染白髮穿皮褸掃街-扮黃仁勳影片播放量破百萬,"
        即時中國
    ",singtao,2026-05-31 08:40,2026-05-31 08:45,"28歲的遼寧小伙楊洋近日因模仿輝達CEO黃仁勳而走紅全網。他發布了23條模仿黃仁勳的視頻，多條播放量破百萬。有律師提醒，若惡意歪曲、醜化、侮辱以博取眼球，可能侵害名譽權。

穿上黑皮褸化名「黃銀勳」

影片中，楊洋對着手機鏡頭，往剛噴了髮膠的頭髮上抹了一把麵粉，戴上10元（人民幣，下同）買來的眼鏡，穿上網購100元的黑色皮褸，全套裝備僅花不到200元，化名「黃銀勳」。他一手端着蜜雪冰城的「蜜桃四季春」，一手拎着顯卡模型，模仿黃仁勳發布會上的招牌動作。

相關新聞：特朗普訪華︱NVIDIA黃仁勳皺眉飲豆汁成熱話 商家推「大佬同款」爆紅︱有片

楊洋表示，此前他只是個喜歡用手機記錄農村創業生活的普通農民，直到去年7月，一位網友建議他模仿黃仁勳，沒料到意外走紅。

對突然爆紅，楊洋坦言，非常擔心收到輝達法務團隊律師信。有律師表示，以娛樂為目的的模仿屬於言論自由、網絡創意表演範疇，值得包容。楊洋未惡意醜化黃仁勳，公眾也能清晰辨別為模仿而非本人，故一般不構成侵權。

"
3577972,美國人打麻將悟投資 俱樂部搜尋量爆增逾40倍,2026-05-31 08:39,https://www.stheadline.com/realtime-world/3577972/美國人打麻將悟投資-俱樂部搜尋量爆增逾40倍,"
        即時國際
    ",singtao,2026-05-31 08:39,2026-05-31 08:45,"麻將這種源自中國的遊戲，近年再度風靡全美國，引發熱潮。麻將熱潮近年席捲美國各地，迎來它的黃金時代。美國知名點評平台Yelp的數據顯示，在2024年9月至2025年8月期間，全美對麻將俱樂部的搜尋量爆發式增長了4467%，麻將課程的搜尋量也飆升了819%。紐約麻將教練布羅曼指出，新冠肺炎疫情後，人們渴望面對面交流，而麻將恰好提供了一個可以放下手機、專注互動的場合。

美聯盟每年更新胡牌標準

「人際關係是推動這股麻將熱潮的動力。」麻將教學機構「Mahj with Marissa」的創始人布羅曼指出，在第一次世界大戰和西班牙流感大流行之後的1920年代，麻將的受歡迎程度也曾飆升。

美國的麻將主要有兩種：香港麻將和美式麻將。美式麻將經由猶太女性加以本土化，包括加入了8張百搭牌。有趣的是，美國麻將聯盟（NMJL）每年都會更新官方規則與標準的胡牌牌型，讓遊戲充滿變數。

表面上看，麻將是一款集結心機、運氣與社交元素的桌上遊戲，但它其實也提供了不少深刻的理財哲理。

牌桌與理財同樣瞬息萬變

卡內基私人財富管理公司高級財務顧問韋爾認為，麻將與財務規劃有異曲同工之妙，「你在開始每一場牌局前都知道，自己可能需要調整策略、靈活變陣。這在財務規劃中也絕對適用：生活總有變數，我們必須隨時應變」。

財經專家從麻將遊戲中提煉出5大理財法則。

一、坦然接受不確定性，計劃趕不上變化：牌局從來不按劇本走，可能你離胡牌只剩一步之遙，卻總是差張；可能你以為勝券在握，沒想到被人直接截胡。

韋爾的「雀友」、夏洛特市金融服務高管洛克比對此深有感觸。她表示，牌桌上的情況「瞬息萬變」，理財亦然。市場與人生充滿未知，靈活調整往往比固執堅持更重要。

二、分散投資：美國麻將聯盟每年更換麻將規則，列出新的贏牌組合，以保持其趣味性。密蘇里州堪薩斯城的財務顧問克萊門茨表示，不斷變化的規則意味着你可以用各種不同的牌型贏得比賽，這與投資非常相似。她解釋：「每年盈利的資產類別組合都不一樣，這取決於當下的經濟環境，需要考慮通脹、利率走勢、股市表現等。」

須謹慎分配資源懂得取捨

三、攻守兼備：韋爾指出，追求收益（進攻）只是成功的一半。通過風險管理和稅務規劃來保全財富（防禦）對於整體成功同樣至關重要。「要成為麻將高手，你還得時刻關注其他玩家的動向，並據此調整策略或採取相應的防守。」韋爾說：「有時候，最好的進攻就是最佳的防守。」

四、優化有限資源：牌桌上的牌有限，生活中的時間與金錢也有限。韋爾指出，若想避免不必要的財務開支與虧損，必須非常謹慎地分配眼前的資源，懂得取捨與優先排序。

五、自律終有回報：金融知識和財富都會隨着耐心而增長。你堅持自律的投資策略的時間越長，就越容易上手。

總之，如果把麻將當成一門投資藝術來看，你會發現它就像是一面鏡子，映照出人們在理財時必須要面對的抉擇：何時冒險、何時按兵不動、何時轉變策略，以及何時坦然接受不可控的因素。"
