id,title,date,url,section,source,last_update,scrape_time,news_content
3578076,軟銀擬大舉投資法國AI基礎設施 最多達750億歐元,2026-05-31 16:10,https://www.stheadline.com/realtime-finance/3578076/軟銀擬大舉投資法國AI基礎設施-最多達750億歐元,"
        商業創科
    ",singtao,2026-05-31 16:10,2026-05-31 16:30,"據外媒報道，日本軟銀集團未來5年將於法國投資450億歐元（約4,113億港元）以建造AI基礎設施，是其至今為止在歐洲同類計劃中規模最大的一筆投資，主要於法國北部法蘭西大區（Hauts-de-France）提供3.1吉瓦（GW）的發電容量。軟銀還表示，未來計劃在法國各地增設更多設施，並使計劃總投資達到750億歐元（約6,855億港元）。

2031年前陸續投入營運

根據計劃，包括鄧寇克（Dunkirk）在內的3個基地將預計於2031年前陸續投入營運。談及選擇法國的原因，孫正義指法國是能源生產與出口國，對於AI基礎設施的投資來說絕對具有決定性。

報道提到，法國工程公司施耐德電氣（Schneider Electric）及法國電力公司（EDF），亦將成為該計劃的關鍵合作夥伴之一。同時，軟銀這項法國計劃將進一步推動其全球AI基礎設施領域的投資，目前軟銀在AI領域的投資則包括向OpenAI投資超過300億美元，持股約11%。"
3578069,羅便臣道火警｜「劏場大王」尹柏權昏迷危殆 6年前同涉藏毒 前女友禮頓山墮斃,2026-05-31 16:09,https://www.stheadline.com/breaking-news/3578069/羅便臣道火警劏場大王尹柏權昏迷危殆-6年前同涉藏毒-前女友禮頓山墮斃,"
        突發
    ",singtao,2026-05-31 16:09,2026-05-31 16:15,"半山羅便臣道5號一住宅單位周六（5月30日）起火，單位內64歲姓尹男住戶及31歲姓倪內地女伴侶，和37歲姓盧內地女友人，均昏迷送院治理，其中倪女經搶救後惜告不治，其餘兩人仍然危殆。警方在單位尋獲「冰壺」等吸毒工具。據悉，昏迷尹男為人稱「劏場大王」的資深物業投資者尹柏權。翻查資料，2020年7月其同居前女友，於尹名下跑馬地禮頓山豪宅墮樓身亡，警方事後到單位調查檢獲可卡因，尹因而被控。

相關報道：羅便臣道火警｜31歲女子晚上傷重不治 一對男女仍危殆

人稱「劏場大王」 歷年涉獵多個商場

資料顯示，尹柏權為本港資深投資者，歷年先後發展尖沙咀首都廣場、荃灣地皇廣場、荃立方商場、天水圍新北江商場等多個商場，再分拆為「蚊型」劏舖出租，故有「劏場大王」稱號。

室內設計師前女友墮斃後被揭藏毒

2020年7月，一名時年27歲、任職室內設計師的女子，於跑馬地禮頓山的1700呎住所墮樓。警方調查後於其墮樓單位內檢獲少量懷疑可卡因及吸毒工具，並發現單位男戶主為綽號「劏場大王」的商人尹柏權，至於死者據悉為尹的同居女朋友。

相關報道：疑27歲同居女友墮樓亡 單位檢可卡因「劏場大王」涉販毒被捕

尹柏權其後承認管有危險藥物等兩罪，辯方當年求情提到，尹的妻子曾兩度紅杏出牆，兒子亦因此自殘，被告大受打擊，承受巨大壓力才接觸可卡因。最終，東區法院2021年7月判處尹15個月感化令，其間被告嚴禁沾染毒品，並需提交尿液樣本供驗毒，及參與戒毒療程等。

事後涉案單位平市價4成沽

至2023年12月，尹柏權以5300萬元沽出禮頓山事發單位，較當年9500萬元市價低4成。不過尹柏權是於2009年以約3870萬元買入上述單位，持貨14年，故帳面仍賺約1,430萬元。

相關報道：「劏場大王」尹柏權認藏毒等兩罪 判15個月感化

相關報道：「劏場大王」禮頓山事故單位 平市價4成沽 女友於3年前墮樓亡

羅便臣道火警現場"
3578057,柬埔寨中國地產商遭殘殺撕票   妻子曾收綁匪$1560萬贖金訊息,2026-05-31 16:05,https://www.stheadline.com/realtime-china/3578057/柬埔寨中國地產商遭殘殺撕票-妻子曾收綁匪1560萬贖金訊息,"
        即時中國
    ",singtao,2026-05-31 16:05,2026-05-31 16:15,"一名居於柬埔寨首都金邊的中國男子，懷疑遭人綁架、勒索兼且殘酷殺害。其屍體於5月30日上午，在金邊市朗哥區一處空地被發現。警方初步調查顯示，死者生前曾被人控制、毆打及施虐，疑犯更一度向其家屬勒索200萬美元（約$1560萬港元）贖金。目前案件已列作嚴重刑事謀殺案，警方正全力追緝涉案人士。

遭3男子強行擄走

據《柬中時報》取得的警方初步調查報告，死者為一名52至53歲的中國男子，名叫楊偉新（Yang Weixin），生前從事房地產開發，是當地一間地產公司的老闆，居住於金邊市鐵橋頭區一個公寓單位的19樓。案件於5月30日上午10時30分曝光，發現地點位於金邊市朗哥區217號路旁邊的一片空地。

相關新聞：世界盃2026︱墨西哥度假小鎮疑現連環殺手 3女衣衫凌亂陳屍荒野

報案的37歲貨車司機皮占榮向警方表示，當日上午約10時30分，他駕車駛入該空地準備泊車時，見到一輛白色豐田Prius停泊在現場。他發現車內後座躺著一名男子，起初以為對方昏迷，於是打開車門查看，結果證實該男子已經死亡，車廂內遺下大量血跡，他隨即報警。警方經調查後確認，涉事車輛為一輛白色豐田Prius，車牌號碼為「金邊2BH-1311」。

死者妻子向警方透露，其丈夫於5月29日晚失蹤。經查看公寓監控錄像發現，當晚8時16分，有3名身份不明男子在停車場將其丈夫強行帶上一輛汽車後離開。她表示，30日淩晨約3時，其丈夫手機曾向她發送信息，要求支付200萬美元贖金。此後對方持續發訊息施壓，直到當天上午8時47分，對方突然發來信息稱「事情到此為止」，隨後便失去聯系。當天上午11時30分左右，她接獲警方通知，證實丈夫已經遇害。

死者楊偉新的妻子透露，其丈夫自2014年起與一名中國籍男子因生意失敗而結下債務糾紛。上年開始，該名男子曾再次上門追討欠款，雙方積怨多年。警方正調查案件是否與此商業糾紛有關。

現場勘查顯示，涉事車輛內外留下大量可疑證物，包括兩把染血刀具、沾滿血迹的紙巾與膠帶、塑膠索帶、枕頭、襪子，以及多個礦泉水樽。

身上多處嚴重傷勢

法醫驗屍結果指出，楊偉新身上有多處嚴重傷勢，包括頭部被重擊至撕裂、面部及頸部大面積瘀傷、雙眼充血，四肢與軀幹亦有大量被打及捆綁痕跡。法醫初步判斷，死因為窒息，並曾遭受毆打、刺傷及其他暴力虐待，案件定性為蓄意謀殺。"
3578031,青衣「鎅袋黨」疑專吼長者晨早出動 廿歲狂徒刀片推到最盡猛割 黑袋中門大開破口觸目驚心｜Juicy叮,2026-05-31 15:44,https://www.stheadline.com/local-topics/3578031/青衣鎅袋黨疑專吼長者晨早出動-廿歲狂徒刀片推到最盡猛割-黑袋中門大開破口觸目驚心Juicy叮,"
        時事熱話
    ",singtao,2026-05-31 15:44,2026-05-31 16:00,"青衣有懷疑專門向長者落手的「鎅袋黨」出沒，一名廿歲狂徒於大清早便犯案，鎖定目標後，把鎅刀刀片推到最盡猛割，受害的黑色袋子應聲中門大開，破口觸目驚心。詳情見下圖及下文：

青衣「鎅袋黨」疑專吼長者晨早出動 廿歲狂徒刀片推到最盡猛割 黑袋中門大開破口觸目驚心逐張睇↓↓↓↓

樓主：告知一下屋企嘅長者

樓主昨天（30日）在社交平台facebook群組「青衣街坊吹水會」上載相片發出緊急警報，留言指「住附近嘅街坊也告知一下屋企嘅長者或者自己，都留意一下🙏」。

樓主：持鎅刀將刀片推到最出

樓主詳細描述事發經過：「今日上午老人家在長康邨康和樓，喺大快活士多附近睇緊嘢，一個年輕人試圖扒竊佢；年約廿十多歲，手持鎅刀將刀片推到最出。手袋被鎅開了，幸運嘅係，袋被鎅爛了，人冇受傷，但冇嘢被偷走，有機會係慣犯，專揀老人家落手」。

樓主在回應欄補充，事發於「早上07:30發生，真有點猖狂，二十多歲男」。

從樓主上載的相片可見，遇害的黑色袋子慘遭「開膛破肚」，破口由拉鏈旁邊直落，鎅出的巨大裂口觸目驚心。

網民：孭袋最好向番前面安全啲

帖文一出隨即引爆街坊關注，不少人直斥賊人手法「好猖狂」，但慶幸「好彩冇鎅到人」，建議「孭袋最好向番前面安全啲！」。

有網民不禁憶述「20幾年前我爸喺深圳就試過被人鎅開銀包，估唔到今時今日香港會發生咁嘅事」。

資料來源：GenuinePelican5393＠facebook

相關閱讀：

「借錢黨」拖兩女殺入青衣屋邨 周街向長者攞$100買蕃茄 網民怒爆詳細行蹤警世

青衣「催眠黨」 港爸自動㩒錢奉獻 痛失$XXXX（附騙徒5大特徵）

「呃食黨」疑入侵青衣 「上海生意人」四圍借錢食飯 街坊大爆行騙手法"
3578065,大澳行山男子墮澗暈倒  直升機送院搶救,2026-05-31 15:42,https://www.stheadline.com/breaking-news/3578065/大澳行山男子墮澗暈倒-直升機送院搶救,"
        突發
    ",singtao,2026-05-31 15:42,2026-05-31 15:45,"今（31日）午1時許，一名65歲男子到大嶼山大澳行山，行至水澇漕石澗跣腳，從高處墮落水池中，他頭部受傷，當場不省人事，同行女子大驚報警，由政府飛行服務隊直升機送往東區醫院救治。

"
3578061,泰國公寓墮樓案︱26歲女子4樓墮地亡  事發前與台灣同性伴侶吵架,2026-05-31 15:30,https://www.stheadline.com/china-taiwan/3578061/泰國公寓墮樓案26歲女子4樓墮地亡-事發前與台灣同性伴侶吵架,"
        兩岸熱話
    ",singtao,2026-05-31 15:30,2026-05-31 15:45,"泰國曼谷一楝8層高公寓今日（31日）凌晨2時許發生墮樓事件，一名26歲女子從4樓墮地重傷不治。據當地傳媒報道，警局、曼谷急救中心醫護人員以及救援基金會工作人員接報後趕到現場，發現女子倒地昏迷。醫護人員搶救約30分鐘，最終確認死亡。

死者在娛樂場所陪侍

死者為一名26歲女子，事發時身穿睡衣及紫色長褲。經初步檢查，其頸部嚴重受傷並伴有多處擦傷。警方推測其從約10米高的4樓房間墮下。警方調查發現，死者從事娛樂陪侍類自由職業，與其24歲的台灣女友租住該公寓，至今約兩個月。初步消息指，事發前，台灣伴侶正在與朋友通電話。期間，死者曾大聲表示：「不要講那麼大聲，也關心一下我。」隨後雙方發生言語爭執。

台灣伴侶曾要求「閉嘴」

警方稱，台灣伴侶曾要求死者「閉嘴」，死者就入睡房反鎖房門。警方初步估計，死者在情緒壓力較大的情況下，從4樓房間墮下死亡。目前，警方正進一步訊問該名台灣女子，並翻看公寓閉路電視錄影及其他相關證據，以還原事件。"
3577990,中歐研建貿易投資磋商機制  商務部：如歐方推歧視性措施將反制,2026-05-31 15:10,https://www.stheadline.com/china-politics/3577990/中歐研建貿易投資磋商機制-商務部如歐方推歧視性措施將反制,"
        大國外交
    ",singtao,2026-05-31 15:10,2026-05-31 15:30,"商務部表示，正與歐盟探討建立貿易投資磋商機制，以處理貿易摩擦，並將就此展開對話，強調如歐方執意單方面推出新貿易工具並採取歧視性限制，中方將堅決反制，採取有效措施維護自身利益。

商務部新聞發言人，30日在北京回應有關歐盟委員會開展對華關係討論的提問時表示，中歐是平等和互惠互利的重要經貿夥伴，希望歐方遵守世貿組織規則，堅持自由貿易和公平競爭，堅定反對保護主義和單邊主義。

發言人又說，希望歐方與中方相向而行，透過對話協商妥處分歧摩擦，推動中歐經貿關係穩定健康發展，但如果歐方執意單方面推出新貿易工具、並採取歧視性限制，中方將堅決反制，採取有效措施維護自身利益。"
3578053,李家超訪哈薩克及烏茲別克 多名官員及逾70名商貿代表團隨行,2026-05-31 15:01,https://www.stheadline.com/politics/3578053/李家超訪哈薩克及烏茲別克-多名官員及逾70名商貿代表團隨行,"
        政情
    ",singtao,2026-05-31 15:01,2026-05-31 15:30,"行政長官李家超今早（31日）出發前往哈薩克和烏茲別克訪問，率領本屆政府規模最大的商貿代表團，加強香港與中亞地區在金融、貿易、基建、創新科技、綠色發展的交流合作，建立新的商貿通道，開拓新興市場機遇。

30多位內地企業代表隨行 涵工商、法律、創科等

今次代表團為本屆政府規模最大、人數最多及涵蓋企業範圍最廣的一次。成員包括40多位香港商貿與專業代表，以及約30位內地企業代表，涵蓋工商、金融、法律、建築工程、物流、創科、高端製造及汽車產業等多個領域。隨團官員包括律政司副司長張國鈞、商務及經濟發展局局長丘應樺、財經事務及庫務局局長許正宇、行政長官辦公室主任葉文娟、創新科技及工業局副局長張曼莉等。

李家超將先訪問哈薩克斯坦，隨後於6月3日轉往烏茲別克斯坦。李家超將於6月6日返抵香港。在他離港期間，將由政務司司長陳國基署理行政長官職務。

何力治：香港能助中亞企業上市、融資

「一帶一路」專員何力治接受《政府新聞網》訪問，表示香港與整個中亞地區的經貿往來近年不斷增加，2025年商品貿易總額較2020年上升27%，相信行政長官李家超率團出訪中亞國家哈薩克斯坦和烏茲別克斯坦，有助促進交流、拓展商機。

何力治又指，香港與中亞地區在多方面均有合作發展空間，包括中亞國家有豐富天然資源和礦產，香港作為國際金融中心，可協助它們上市、融資、發債。而在綠色發展方面，每個國家均有其碳中和目標，希望找尋合作夥伴，香港正可提供協助，加速當地達到碳中和的目標。

他相信，通過政府與政府對接，可打開一些大門，讓政府與政府之間建立機制，加強溝通。此外，他認為樞紐對樞紐，希望香港可作為中亞國家進入亞洲、中國內地、粵港澳大灣區，甚至進入東南亞國家聯盟的重要樞紐。相反，香港、大灣區企業進入中亞時，也可揀選哈薩克斯坦或烏茲別克斯坦。"
3578052,熱浪襲印度︱宿舍無冷氣靠冰水解暑  中國留學生頂唔順提早回國,2026-05-31 15:00,https://www.stheadline.com/realtime-china/3578052/熱浪襲印度宿舍無冷氣靠冰水解暑-中國留學生頂唔順提早回國,"
        即時中國
    ",singtao,2026-05-31 15:00,2026-05-31 15:30,"熱浪襲印度，印度北部與中部平原地區正遭遇持續性極端高溫天氣，其中邦班達地區最高氣溫飆升至48.2℃，首都新德里最高氣溫達到45℃。內地傳媒報道，有中國留學生不堪當地高溫，加上宿舍沒有冷氣，決定提前回國。內地封面新聞報道，新德里的尼赫魯大學念研一的中國留學生盧嘉藝（小盧）形容當地環境惡劣。他表示，4月底時，當局預報40至43℃，宿舍內沒有冷氣機，只有電扇，細小房間空氣焗促，只有一個沒有窗紗的窗戶，一開窗蚊子入房咬他。

相關新聞：熱浪襲印度︱自來水燙手超50°C 兩日逾40人熱死

小盧表示，宿舍整晚轉動的風扇吹出的是熱風，感覺自己的內臟在「沸騰」。除了沖涼，她每日用宿舍提供的冰水作降溫之用，每晚多達5公升。白天時段，由於課室冷氣沒太大作用，盧嘉藝就用帶著電腦去連鎖咖啡店。面對酷熱日子差不多半個月，原本放暑假打算留在印度拍攝些素才，小盧忍受不了天氣，決定回國避暑。小盧憶述，今年4月中旬，她到瓦拉納西看場景，見到當地人為了消暑，有人睡在大街上和恆河邊上。據悉，截至2024年，14多億人口的印度，只有9400萬台空調，普及率不到10%。"
3578051,稻城亞丁︱四川景區被指省道當搖錢樹  攔路收費迫簽承諾書始放行,2026-05-31 14:38,https://www.stheadline.com/realtime-china/3578051/稻城亞丁四川景區被指省道當搖錢樹-攔路收費迫簽承諾書始放行,"
        即時中國
    ",singtao,2026-05-31 14:38,2026-05-31 15:00,"四川著名景區稻城亞丁被揭將省道納入觀光車收費範圍，擅自向自駕遊旅客收費。事件曝光後，當地官方宣布整治稻城亞丁，期間暫停收取該景區的觀光車及電瓶車交通運輸服務費用。

截斷S462省道收費

綜合內媒報道，自駕博主「呂大俠V50」24日連發多條影片，指他15日駕車到稻城亞丁旅遊，但被該景區人員攔停，指不准外來車輛進入景區，必須以每人105元人民幣乘坐指定觀光車。

相關新聞：8人偷入亞丁景區保護區兼破壞 被罰終身禁入

「呂大俠V50」要求對方出示收費文件後，工作人員即提出免除車票費用、報銷住宿費等條件，但要博主必須坐觀光車。博主力拒，指景區截斷S462省道收費不合理，景區人員要他簽下免責承諾書始放行。

同日，景區發通報，指值班人員違反規定擅自放博主已被處理。通報指，稻城亞丁聯合國教科文組織認定的世界生物圈保護區，也是國家級自然保護區，大量社會車輛進入必將突破自然保護區生態環境承載力，景區重申禁止社會車輛違規進入景區。

有景區工作人員稱，S642被包進景區內，是自然發展形成的，並不是景區為了收費，特意將遊客中心設在路道入口，「禁止社會車輛進入，是自然保護區的管理規定。」

5月28日，甘孜州稻城亞丁景區問題整改工作專班發布通告，進駐景區開展全面核查和靶向整治。甘孜州發展和改革委員會也發布通告稱，從5月29日起，暫停收取稻城亞丁景區觀光車及電瓶車交通運輸服務費用。

"
3578045,愉景灣康頤閣發生連環爆竊案  半日第二宗,2026-05-31 14:20,https://www.stheadline.com/breaking-news/3578045/愉景灣康頤閣發生連環爆竊案-半日第二宗,"
        突發
    ",singtao,2026-05-31 14:20,2026-05-31 14:30,"大嶼山愉景灣再發生爆竊案，今（31日）中午12時許，愉景灣道1號康頤閣一名女子報警，聲稱單位露台有指紋，屋內有搜掠痕跡，發現一批珠寶首飾不翼而飛，於是報警，警方到場調查相信賊人夜深爬露台潛入爆竊。

今日凌晨3時許，康頤閣另一單位亦發生爆竊案，損失一隻約值20萬元的名貴手錶、一批約值1萬元的金飾，以及約2,700港元外幣現金不翼而飛。警方不排除同一幫賊匪所為，將案件列作「爆竊」案處理，交由機場警區刑事調查隊第二隊跟進。

相關新聞：愉景灣單位遭爆竊 男戶主20萬元名錶及金飾等被盜



"
3578042,只許總統入市，不許議員開戶｜藍血工廠,2026-05-31 14:11,https://www.stheadline.com/investment/3578042/只許總統入市不許議員開戶藍血工廠,"
        投資理財
    ",singtao,2026-05-31 14:11,2026-05-31 14:30,"發財本身就是一場無須掩飾的行為藝術。最近，那位狂人總統在現代史上史無前例地披露了他在任期間的股票交易，總值估計高達7.5億美元。這個交易量是甚麼概念？2025年美國國會535位議員的交易總額加起來，都不及他一人。最諷刺的是，他不足3個月前才在國情咨文中大義凜然地呼籲禁止國會議員炒股。這種「只許總統入市，不許議員開戶」的霸氣，正是華盛頓沼澤（The Swamp）裏最坦誠的風景。

Palantir源源不絕獲政府合約

​看看他在大數據公司Palantir上的神級操作，簡直是Palantir stock traded left and right。單單在2026年第一季，Trump就申報了14次Palantir的股票交易。他最大的一筆動作是拋售，從中獲利保守估計超過500萬美元。有趣的是，在他第二個任期內，這家依賴政府開支的公司股價已經翻了兩倍有多。這邊廂總統與國會議員左手交右手地炒賣，那邊廂Palantir就源源不絕地獲得聯邦政府合約——第一季拿了超過2,700萬美元，到了第二季更猛增至估計1.85億美元。Trump大部份的買入操作，恰巧都精準落在第一季末。你說這是眼光獨到，還是春江水暖鴨先知，預判了政府合約的激增？

科網巨頭瘋狂擴建Data center

​至於那些矽谷科網巨頭，一開局就大刀闊斧解除AI和科技發展的監管，推翻了拜登時代允許各州自定監管框架的政策。結果？Meta、Amazon、Microsoft和Alphabet這四大巨頭毫無顧忌地瘋狂加速擴建Data center，在極度有利的政策環境下，股價自然水漲船高。Trump順勢割韭菜，單是拋售這幾家科技巨無霸及Apple和Nvidia的股票，就佔了他總銷售收益的近四分之一；其中Meta和Amazon更是各套現了高達2,500萬美元。科技菁英在網上罵他，他卻在華爾街笑住數錢，這是資本主義最現實的黑色幽默。

國防股買賣多接近第二季

最後，當然少不了美國的全球霸權命脈——軍工複合體（Military-industrial complex）。今年第一季末，Trump掃入了多隻國防軍工股，期間唯一大額拋售的防務股，只是賣了約100萬美元的Honeywell。原本年初時聯邦政府合約批得比較慢，但到了剛剛過去一個月，經歷了平靜的第一季後，General Dynamics、Northrop Grumman和RTX等軍工大廠突然齊齊躋身聯邦合約最大受惠者的首25位。總統先生的國防股買賣幾乎全部集中在接近第二季的時間點，這筆來自國防訂單的豐厚紅利，看來早已在計算之內。

​順帶一提，在這些動輒千萬的科技與軍工巨頭之間，Trump竟然還申報了一筆500萬美元的買入，對象是一家叫Kura Sushi（藏壽司）的迴轉壽司小盤股。這種將大國軍事博弈、尖端AI晶與平民日式快餐共冶一爐的奇異投資組合，或許，這就是他引以自豪的The Art of炒股。

藍血工廠

相關文章：特朗普是白宮的華爾街大亨｜藍血工廠

藍血工廠簡介:

千億家族辦公室小跟班，見證資本的宏偉敘事，體會執行的真實質感。

Facebook: https://www.facebook.com/people/藍血家族辦公室/61581201953632/?mibextid=wwXIfr&amp;rdid=MWeLHs5DUNefUBwY&amp;share_url=https://www.facebook.com/share/1EpHCbTAKy/?mibextid=wwXIfr"
3578041,香格里拉對話會︱放軍代表質問日防衛大臣  「日本何時向亞洲受害國道歉？」,2026-05-31 14:09,https://www.stheadline.com/china-politics/3578041/香格里拉對話會放軍代表質問日防衛大臣-日本何時向亞洲受害國道歉,"
        大國外交
    ",singtao,2026-05-31 14:09,2026-05-31 14:15,"今日（31日）上午，解放軍專家學者代表團成員、國防大學沈志雄大校在新加坡舉行的香格里拉對話會（簡稱「香會」）上針對日本防衛大臣大臣小泉進次郎進行尖銳提問，引起廣泛關注。

沈志雄提問：「很高興您在演講中提及了『新型軍國主義』。最近，日本領導人在澳洲戰爭紀念館向澳方在二戰中因為日本軍國主義而陣亡的士兵表達哀悼，但亞洲國家的受害國並未得到日方的道歉和懺悔。中方認為，真正的和解應當建立在對所有受害國一視同仁的歷史反思基礎上。請問，日本政府是否準備以同樣嚴肅和明確的方式，回應中國、韓國和東南亞受害國關於二戰歷史問題的關切，從而為地區安全互信創造條件。」

相關新聞：香格里拉對話會︱美防長：不要保護國只要夥伴 資助防務時代已結束

小泉進次郎拒正面回應

對此，小泉進次郎稱「我認為現在是進入更具挑戰性部分的時候」，但他沒有正面回應問題。

小泉進次郎首先辯解說，日本的防務政策和防衛建設，並不是基於將任何特定國家或地區視為威脅，或與其進行軍事對抗的理念。然後，他反稱，「中國持續以較高水平增加國防開支，並在多個領域迅速擴展其軍事能力，缺乏足夠透明度。中國的對外方針和軍事活動，令日本以及國際社會嚴重關切。」

最後，他稱「日本認為，正因為存在挑戰，才更有必要在不回避具體而棘手問題的情況下，持續開展坦誠的對話與溝通。」

軍事問題專家：日方表達自欺欺人

對此，《環球時報》引述軍事問題專家張軍社表示，日方這種拒不道歉、缺乏深刻反省的態度讓亞洲地區受害國的民眾感到憤慨，因為受到日本軍國主義摧殘最嚴重的是日本的亞洲鄰國。不僅如此，近年來日本還大力發展進攻性軍事力量，讓周邊鄰國再次感受到日本軍國主義復活的威脅。基於此，日本根本沒有和中國展開談話的誠意，更缺乏和中國防長展開對話的政治基礎，小泉的這種表達根本是自欺欺人，更是痴心妄想。"
