id,title,date,url,section,source,last_update,scrape_time,news_content
3578009,遊日注意︱颱風薔薇逼近 香港快運取消6班往返沖繩客機 港航：往返沖繩及大阪或延誤取消（附航班名單、改機票連結）,2026-05-31 12:04,https://www.stheadline.com/society/3578009/遊日注意颱風薔薇逼近-香港快運取消6班往返沖繩客機-港航往返沖繩及大阪或延誤取消附航班名單改機票連結,"
        社會
    ",singtao,2026-05-31 12:04,2026-05-31 12:15,"天文台今日（31日）表示，在正午12時，颱風薔薇集結在沖繩島以南約530公里，預料向北或西北偏北移動，時速約14公里，移向琉球群島一帶，隨後大致移向日本以南海域。

香港快運：取消6班香港往返沖繩航班

香港快運Hong Kong Express（UO）表示，受颱風薔薇影響，2026年6月1日往返香港及沖繩的UO844、UO845、UO824及UO825航班將會取消。另外，原定於2026年6月2日出發的UO842及UO843航班亦將會取消。UO表示已通知受影響的乘客有關航班變動的資訊，並提供適切的協助，讓旅客可及早安排行程更改；而颱風特別機票安排適用於受影響航班，受影響乘客可按電郵通知或使用以下連結了解航班改期的詳情或退票： https://irop.hkexpress.com/zh-hant-hk/irop/login 。

由於天氣狀況不穩定，UO建議於2026年6月1日至3日期間往返香港及沖繩的旅客定期查閱電郵，並在前往機場前先查看其航班狀況： https://mybooking.hkexpress.com/zh-hk/flight-status 。請於航班出發前三小時抵達機場，以便有足夠時間辦理登機手續。如需協助，請參閱此網頁聯絡客戶聯繫團隊： https://www.hkexpress.com/zh-hk/need-help/customer-care/ （服務時間為星期一至日香港時間早上8時至晚上8時）。

香港航空：6.1-6.3往返大阪航班可能延誤或取消

香港航空Hong Kong Airlines（HX）表示，颱風薔薇正接近沖繩及大阪，香港航空正密切監察其對航班運作的潛在影響。目前航班運作正常，但預料6月1日往返沖繩及6月3日往返大阪之航班可能受到延誤或取消。

旅客前往機場前，請於香港航空網站查看「航班狀態」，或於起飛時間4小時前，註冊「航班提示」服務，以短訊/電郵接收航班狀態提示，亦可使用官網「在線諮詢」服務，或「聯繫我們」電話查詢。"
3577443,台茶店熱潮背後 負責人揭加盟「魔鬼細節」：裝修連按金投資逾百萬 日賣呢個數先回本,2026-05-31 12:00,https://www.stheadline.com/food/3577443/台茶店熱潮背後-負責人揭加盟魔鬼細節裝修連按金投資逾百萬-日賣呢個數先回本,"
        飲食
    ",singtao,2026-05-31 12:00,2026-05-31 12:15,"近年手搖飲品店在香港開完一間又一間，不少人對其經營成本及利潤感到好奇。一名台茶店負責人於2018年，在香港尖沙咀經歷了天價租金及繁複的加盟開店過程，事主對當年龐大的開支及隱藏行規感受甚深。

台灣拜師回港開店  裝修連按金投資逾百萬

日前，有台茶店負責人在社交平台上分享個人經歷，詳細講述當年隻身前往台灣取得手搖飲品代理權，以至回港後尋找舖位、計算裝修及設備成本的真實過程，讓大眾一窺這個行業的真實運作情況。

事件始於2018年，當時正值「珍奶戰國年代」，市場上有多間知名品牌鼎立，事主憶述其中一間大型品牌更曾報價「100萬港幣做香港代理」。事主表示，由於當時是「轉行業，對飲品手搖一竅不通」，只能夠「搵個行內嘅人帶住」。他最終花費約40多萬港元，親身飛往台北向一間當時只有五至六間分店的茶飲品牌「學師」。事主形容該品牌雖然規模較小，但老闆是台北人，「比較好傾靈活度大」。

在合作方面，事主表示與台灣人合作「都尚算冇乜問題」，但亦聽聞業界有許多魔鬼細節，例如「連一支飲管都要同總代理買」。根據事主的描述，回港後他在2018年11月於尖沙咀厚福街租下一個不足200呎的舖位，連同雜費及差餉月租高達13萬港元。

尖沙咀200呎舖月租13萬  更設「隱藏收費」

開業成本方面，除了交予業主高達52萬的「三按一上」(即繳付3個月租金作按金及1個月租金預繳作上期)外，由於舖位前身為小食店，因此不少地方需要由零重做，單是裝修便花費50至60萬。

此外，於台港兩地採購的器材設備便已耗資20多萬，而首批向台灣訂購的2至3個月食材用量亦花費近20萬。

入舖後，事主更發現該區有一項神奇開支，就是要繳交泊車費，由專人看管店外的車位，對方更會發出寫有「收泊車費」的單據。

事主又揭開台式茶飲店加盟制度的「魔鬼細節」，他提醒有意者必須看清合約中「有幾多強制購貨比例、裝修出資同埋分成分布」，否則一旦簽錯，總公司權利極大，「代理只係俾人撳住嚟砌」。

網民驚訝：咩驅使你有勇氣租一個10幾萬嘅舖位

帖文一出，隨即引發網民熱烈討論。有網民質疑台灣飲品業是「雞棚」，認為品牌方透過花錢炒作新聞及「叫人慢慢沖 制做排隊效應」來吸引加盟，最終因加盟者過多而分薄人流，導致全線結業。同時，不少人對高昂的租金感到驚訝，直言在該地段交六位數租金經營極度困難，並好奇詢問「係咩驅使你有勇氣租一個10幾萬嘅舖位？」更有網民問及究竟要做多少生意才足夠應付租金，事主則親自回覆透露：「平均真係要日賣500杯」。

資料來源:hkbaroness33@Threads

延伸閱讀：炮台山西餐廳苦呻午市生意冷清！地段差「每次落雨都無客」 網民獻計提1點"
3402209,定存攻略｜港元定存3個月優惠突破3厘 現有客戶12個月2.95厘 起存額僅100元,2026-05-31 12:00,https://www.stheadline.com/investment/3402209/定存攻略港元定存3個月優惠突破3厘-現有客戶12個月295厘-起存額僅100元,"
        投資理財
    ",singtao,2026-05-31 12:00,2026-05-31 13:00,"【定期存款/定存/高息定存】隨着美國通脹持續，加上美伊談判仍未明朗，市場不排除美國需採取更緊縮的貨幣政策。本港銀行定存息率方面，港元定存仍普遍有增無減，其中南洋商業銀行推出的「多元配置，多元賞息」優惠，3個月港元定存息率最高有3.08厘。此外，以現有客戶的3個月及12個月定存計，平安數字銀行提供的2.9厘及2.95厘為最高；6個月期方面，則以平安數字銀行及富邦銀行提供的2.8厘最高。

定期存款利率比較｜哪間銀行定存利息高？

南洋商業銀行推出「多元配置，多元賞息」優惠，由5月1日至9月30日，成功認購基金、股票掛鈎投資（ELI）、債券或投保人壽保險客戶，可以「最新合資格資金結餘」等值新資金，開立2個月或3個月港元定存，年利率分別為2.88厘及3.08厘；美元、澳元或英鎊更達3.8厘。每筆定存本金最少為等值10萬港元，並需留意「合資格資金結餘」定義是指推廣期內之基金、ELI或債券總認購金額。

一般定存方面，3個月期港元定存息率2.55厘，起存額100萬元，需為特選理財客戶；若為一般理財客戶，息率為2.5厘。至於9及12個月最高息率則為2.4厘及2.3厘，同樣屬特選理財客戶優惠；若為一般理財客戶，息率為2.35厘及2.25厘。其他客戶方面，3個月2.45厘，9及12個月息率則為2.3厘及2.2厘，起存額10萬元。

此外，該行4個月、5個月及6個月期港元定存息率，分別為2.35、2.45及2.4厘，不分理財客戶或一般客戶。

若為美元定存的話，特選理財客戶3個月最高3.55厘，6個月及12個月分別為3.5厘及3.25厘；若為一般客戶，3、6、12個月期分別為3.45厘、3.4厘及3.15厘，起存額為等值10萬港元。

平安數字銀行持續推出港元新資金定存優惠，由即日起至6月30日，個人客戶只需存入100至1億元新資金，1個月享2.5厘、3個月2.9厘、6個月2.8厘，12個月則為2.95厘，惟額度有限，額滿即止。美元定存方面，該行1、3、6及12個月息率分別為2.8厘、2.7厘、2.7厘及3.8厘。

匯立銀行（WeLab Bank）港元定存3個月息率為2.6厘，6個月2.65厘，8個月及12個月分別為2.7厘及2.85厘；此外，該行提供18及24個月超長期定存，息率均為2.85厘，起存額為10元。

美元定存方面，1個月為3厘，3、6及12個月分別為3.38厘、3.4厘及3.5厘，起存額10美元。

象象銀行（EleBank）港元定存息率3個月2.4厘，4個月及6個月分別為2.5厘及2.55厘，9個月及12個月則為2.75厘及2.85厘，起存額為1,000元。美元定存方面，該行3個月及4個月分別為3.4厘及3.6厘，6個月、9個月及12個月則分別為3.65厘、3.7厘及3.7厘。

富邦銀行推出新資金定期存款優惠，港元定存3個月、6個月及12個月均為2.8厘，起存額50萬元新資金；美元定存3個月4厘，起存額12.8萬美元新資金。

此外，不論新舊資金，該行3個月及4個月港元定存息率為2.65厘，1個月及2個月分別為2.25及2.35厘，6個月及12個月則為2.65厘及2.7厘，起存額50萬元，需經Fubon+手機應用程式申請。至於美元定存1個月及2個月息率分別為3.65厘及3.8厘，3個月為3.9厘，4個月、6個月及12個月均為3.8厘，起存額為65,000美元或以上。

富融銀行現有客戶3個月港元定存息率為2.7厘；6個月及12個月定存息率則為2.6厘及2.8厘，起存額為1元。美元定存方面，該行3個月息率為3.6厘，6及12個月息率均為3.7厘。

此外，該行在「快閃星期一」活動推出年利率高達25厘港元定存優惠。該行新客戶於5月31日前用邀請碼「FLASH2026」開戶，並存入新資金，可於星期一搶25厘的14天港元定存優惠，名額1,000份；每份額度為5萬元，每位客戶限搶一份。同時，該行亦提供7天8.8厘、3個月2.5厘及18個月2.75厘優惠，名額分別有100份、1,000份及1,000份，每份額度為1萬元、5萬元及5萬元，每位客戶可搶1份、60份及60份，適用於新客戶及現有客戶。

工銀亞洲現有工銀財富客戶，以全新資金到分行開立港元定存，98天及188天分別上調至2.8厘及2.7厘，存款額需300萬元或以上；若為工銀財富或理財金賬戶，98天及188天分別為2.75厘及2.65厘，存款額需80萬元或以上；若為零售銀行個人客戶，存款額為5萬元以上，98天及188天分別為2.7厘及2.6厘。

美元定存方面，該行98天或188天最高3.8厘及3.75厘，起存額10萬美元或以上；若起存額15,000美元或以上，息率分別為3.75厘及3.7厘。

此外，該行設有新客戶手機銀行「e開戶」定存3個月3.88厘優惠，存款額為1,000元至10萬元，推廣期至6月30日。至於該行全新工銀財富客戶，若以10萬至100萬元到分行開立3個月港元定存，最高息率2.88厘；若為全新理財金，3個月最高2.83厘，起存額10萬至300萬元；理財e時代或綜合客戶3個月最高2.78厘，起存額10萬元或以上。

建行亞洲客戶以合資格新資金開立3個月定存，息率最高2.7厘，6及12個月為2.6厘，起存額需100萬元或以上；若起存額低於100萬元，3、6及12個月息率為2.6厘、2.5厘及2.5厘。美元定存方面，3個月、6個月及12個月最高均為3.75厘，起存額需10萬美元或以上。

此外，該行全新「智選理財」客戶可享3個月5.88厘港元定存優惠，以本金5萬元計，到期後可獲741元利息，優惠期至6月30日。至於新客戶開立「貴賓理財」帳戶，以100萬至250萬元開立3個月港元定存，當中首20%資金年利率為6.88厘，其餘80%資金需以另一定期存款利率作計算，優惠期同樣至6月30日。

中信銀行（國際）新舊客戶經「inMotion動感銀行」開立港元定存，3個月期息率2.7厘，6個月及12個月分別為2.6厘及2.65厘，起存額為1萬元新資金。美元定存方面，3個月及6個月期息率分別為3.6厘及3.65厘，12個月則為3.4厘，起存額為1,500美元新資金。

Mox Bank港元定存3、6及12個月分別為2.3厘、2.35厘及2.7厘，起存額僅1元新資金。此外，該行為市場上罕有提供36個月及48個月港元定存的銀行，息率均為2.3厘。

美元定存方面，該行1個月及2個月定存息率分別為3.2厘及3.3厘，3個月及6個月為3.4厘及3.3厘，12個月為3.3厘。

集友銀行3個月港元定存上調至2.65厘，4個月2.6厘，6個月2.5厘，12個月則為2.35厘，起存額為100萬至5,000萬元新資金；若起存額為20萬至100萬元以下，3、4、6及12個月定存息率，分別為2.5厘、2.45厘、2.35厘及2.05厘，上述優惠只適用於分行。

美元定存方面，3、4、6及12個月定存息率分別為3.6厘、3.6厘、3.55厘及3.2厘，起存額為12.5萬至1,000萬美元新資金；若起存額為3萬至12.5萬美元，3、4、6及12個月定存息率，分別為3.3厘、3.3厘、3.25厘及2.85厘，同樣只適用於分行。

大眾銀行港元定存3個月2.65厘，6個月2.5厘，12個月期則為2.4厘，起存額為50萬元，適用於新舊資金，並需以電子銀行辦理。若起存額為10萬至50萬元以下，3個月及6個月分別為2.6厘及2.45厘，12個月息率為2.35厘；起存額為1萬至10萬元以下的話，3個月、6個月及12個月則分別為2.55厘、2.4厘及2.3厘。

大新銀行VIP客戶3個月及6個月港元定存息率分別為2.5厘及2.4厘，12個月期為2.1厘，起存額需20萬元或以上；一般客戶方面，3個月及6個月期分別為2.4及2.3厘，12個月則為2.2厘，但起存額需100萬元；若起存額20萬元至100萬元以下，各存期均低0.1厘。

美元定存方面，VIP客戶3個月及6個月最高3.5厘及3.3厘，12個月3.3厘，起存額為等值港元100萬或以上；一般客戶方面，3個月及6個月期最高3.2厘及3厘，12個月為3厘，起存額亦需等值100萬港元。

新客戶方面，全新VIP客戶港元定存10萬至50萬元，3個月高達2.6厘、6個月高達2.5厘。

此外，大新銀行全新客戶開立12個月存款期或參加52周儲蓄挑戰之「夢想成真」零存整付儲蓄計劃，並符合指定要求，可享2.5厘息率，優惠期至6月30日。

華僑銀行1個月及3個月港元定存分別為1.85厘及2.4厘，6及12個月定存為2.5厘及2.55厘，適用於宏富理財客戶，起存額10萬元新資金；若為一般個人客戶，1個月及3個月港元定存分別為1.85厘及2.3厘，6及12個月定存為2.4厘及2.45厘，起存額則為50萬元新資金。

至於美元定存，3個月及6個月分別3.6厘及3.55厘，12個月則為3.38厘，起存額為等值10萬港元新資金，適用於宏富理財客戶及個人客戶。

此外，該行宏富理財推出了第二季開戶禮遇，推廣期至6月30日，其中定存3個月「一口價獎賞」最高2.88厘（包括相應現金獎賞），首筆單一港元定存金額需300萬元或以上（上限500萬元)；若首筆單一港元定存金額為100萬元至300萬元以下，3個月期息率為2.6厘。

Livi Bank港元定存息率3個月、4個月、6個月、9個月及12個月均為2.5厘，起存額5萬元或以上；若起存額為500至5萬元以下，3個月及4個月分別為1.1及1.2厘，6個月及9個月1.3厘，12個月則為1.6厘。美元定存方面，3、6及12個月息率分別為3.6厘、3.4厘及3.3厘。

東亞銀行網上3個月及6個月港元定存息率均為2.45厘，起存額1萬元新資金，適用於顯卓私人理財或顯卓理財客戶；而至尊理財客戶、BEA GOAL或其他個人綜合戶口則為2.4厘。12個月期方面，顯卓私人理財或顯卓理財客戶最高2.4厘，至尊理財客戶、BEA GOAL或其他個人綜合戶口則為2.35厘。

美元定存方面，3個月及6個月分別為3.35及3.45厘，12個月則為3.45厘，適用於顯卓私人理財或顯卓理財客戶；若為至尊理財客戶、BEA GOAL或其他個人綜合戶口，3、6及12個月息率分別為3.3厘、3.4厘及3.4厘。以上起存額需為1,000美元或以上。

滙豐3個月港元定存息率2.2厘，6個月則為2厘，適用於理財客戶、HSBC One及其他客戶，起存額為1萬元新資金。美元定存方面，滙豐理財客戶3個月定存息率3.2厘，6個月及12個月期則為3.1厘及3厘；HSBC One及其他客戶則分別有3厘、2.9厘及2.8厘，起存額為2,000美元或以上新資金。

值得留意的是，滙豐近日推出「獎賞錢」定存優惠，透過HSBC HK App開立港元或美元新資金定存，即可賺取預先發放「獎賞錢」，最低存款金額10,000港元或2,000美元，等值年利率根據基本年利率及預先發放「獎賞錢」的價值合併計算得出，其中港元定存3個月2.435厘、6個月2.215厘。美元定存方面，滙豐理財客戶3個月3.54厘、6個月3.425厘；HSBC One及其他客戶則分別有3.32厘、3.205厘。

此外，滙豐繼續提供1個月港元定存最高10厘的優惠，起存額為10,000元，但需要加入「交易薈」，並每月至少需完成一項交易。若每月交易金額越多，經紀佣金將越少、10厘息定存上限亦會越高，其中每月交易金額要求由1元至4,000萬元不等，佣金由0.01%至0.25%，定存上限則由1萬元至最高400萬元。

花旗銀行1個月港元定存息率2.2厘，2個月及3個月分別為1.95及2.4厘，6及12個月分別為2.06及2.09厘，不設最高或最低存款額限制。美元定存方面，1個月及2個月為3.03及3.04厘，3、6及12個月分別為3.05厘、3.09厘及3.18厘。惟以上年利率僅為參考，每日或有浮動。

星展銀行網上3個月期港元定存息率2.25厘，4個月2.4厘，6個月及12個月為2.3厘，起存額為5萬元以上，適用於星展豐盛理財及私人客戶，以及一般星展客戶。美元定存方面，該行網上3個月期定存息率為3.3厘，4個月3.35厘，6個月及12個月分別為3.2厘及2.8厘。

此外，該行推出了一項特選個人客戶網上新資金定期存款優惠，推廣期至5月31日，合資格客戶需事先登記，並以新資金開立合計50萬港元或65,000美元或以上定存，可獲額外年利率獎賞，其中港元定存3個月最高2.5厘，美元定存3個月最高3.9厘。

渣打銀行一般3個月定存息率2.3厘，6個月2.1厘，12個月則為2厘，起存額為1萬元新資金。至於該行美元定存3個月及6個月期為3.2厘及3.3厘，12個月則為2.7厘，起存額為2,000美元或以上新資金。

螞蟻銀行港元3個月定存1.6厘，6個月1.8厘，9個月及12個月則為2.2厘及2.3厘，起存額為1元新資金。此外，該行提供18個月及24個月港元定存，息率均為2.3厘。美元定存方面，1、3、6、9及12個月息率一律為3厘。

恒生銀行3個月及6個月港元定存息率分別為2.2及2厘，需透過網上理財開立，適用於優越私人理財、優越理財、優進理財或綜合戶口，起存額同為1萬元新資金。至於該行美元定期存款3個月及6個月期，息率分別為3.3厘及3.2厘，起存額美元2,000或以上。

中銀香港一般3個月定存息率2.1厘，6個月則為1.9厘，起存額1萬元，需透過網上理財或手機銀行開立，除了適用於私人財富、中銀理財客戶外，亦適用於智盈理財、自在理財及其他個人客戶。

美元定期存款方面，私人財富及中銀理財客戶可享3個月定存息率3厘，6個月定存則為2.9厘；若為智盈理財、自在理財及其他個人客戶，息率低0.2厘，起存額為1,000美元。

此外，中銀香港設有「手機開戶高息定存賞」，於6月30日前，全新客戶透過手機銀行應用程式輸入指定推廣碼「BBANEWHKD」開戶，可享港元1個月定存4.8厘，起存額1萬至10萬元，但要留意不適用於分行「二維碼開戶」服務。

聯儲局議息時間表｜美國減幾多息？

根據芝商所FedWatch工具顯示，聯儲局2026年6月減息0.25厘機會率為0.4%，維持息率不變機會率則為99.6%。

以下為聯儲局2026年議息時間表：



2026年"
3578006,香港超越瑞士成「世一」跨境財管中心 陳茂波：海內外資金對香港投下信任票 須承接並用好資金流,2026-05-31 11:59,https://www.stheadline.com/politics/3578006/香港超越瑞士成世一跨境財管中心-陳茂波海內外資金對香港投下信任票-須承接並用好資金流,"
        政情
    ",singtao,2026-05-31 11:59,2026-05-31 12:15,"波士頓諮詢公司（BCG）上周發表最新報告，表示香港去年跨境財富管理資產規模按年增長10.7%至約23萬億港元，超越瑞士成為全球第一的跨境財管中心。財政司司長陳茂波在網誌表示，該報告估算較政府原來的目標更早，指報告帶來一個值得深思的觀察。他指，在全球地緣政治變亂交織與人工智能浪潮席捲全球之際，資金正以前所未有的規模重新配置。

資金加速流向穩定可靠的安全港

陳茂波認為單邊主義、地區衝突，為全球經濟前景帶來巨大不確定性，資金加速流向穩定可靠的安全港；與此同時，人工智能的不斷突破，展現了龐大發展潛力，吸引大量資金湧入相關領域。他直言，如何同時承接並用好這兩股資金流，是香港發展當前的關鍵課題之一。

該報告估算，香港去年跨境財富管理資產規模按年增長10.7%至約23萬億港元，超越瑞士成為全球第一的跨境財管中心，較政府原來的目標更早。報告更預計，從現在到2030年，香港管理的跨境財富每年增長約9%，增速也高於瑞士。

跨境財富年增約9% 增速也高於瑞士

陳茂波形容這是海內外資金對香港的制度和投資環境投下的信任票。他指香港在「一國兩制」下擁有普通法制度、資金自由流動、貨幣自由兌換、簡單低稅制，以及與國際接軌的監管框架，稱這些制度優勢吸引資金持續的流入。

積極考慮推出嶄新離岸人民幣創投基金

《財政預算案》提出「AI+」和「金融+」的發展策略，陳茂波指，正是希望加速這兩股力量的結合和相互驅動。而作為特區政府耐心資本的投資旗艦，港投公司正好展示以投資帶動發展的實踐。截至3月底，港投公司累計投資超過200個項目，涵蓋硬科技、生命科技及健康科技、新能源及綠色科技等戰略賽道。在其投資組合中，10家企業已在港上市，另有逾30家正申請或籌備今年在港上市。

為了強化這正向循環，陳茂波表示正推進注資港投公司的事宜，並積極考慮推出嶄新的離岸人民幣創投基金，引導並槓桿離岸市場人民幣資金聚焦在前沿科技和新興產業的同時，也支持人民幣國際化穩步發展。此外，北部都會區的「研發—轉化—量產」一體化布局，亦將成為港投公司創科生態圈相關企業在港深化發展的重要土壤。

陳茂波總結道，本港對創科的大力投入，正加速轉化為經濟增長新動能，但這項工作須加大力度、加快速度。他指政府已看到這正向循環的拉動作用，以金融支持創科、以創科推動金融，讓兩者加速聯動，為經濟高質量發展注入更強動力。"
3578004,羅湖口岸︱北上男鬼祟貼牆走  揭口香糖盒藏大麻煙,2026-05-31 11:38,https://www.stheadline.com/realtime-china/3578004/羅湖口岸北上男鬼祟貼牆走-揭口香糖盒藏大麻煙,"
        即時中國
    ",singtao,2026-05-31 11:38,2026-05-31 11:45,"羅湖海關近日有男旅客入境時，因刻意貼牆邊走，引起海關注意，截查下發現其口香糖盒內藏有1支淨重0.15克的大麻煙。

海關發布消息，近日，羅湖海關在進境旅客攜帶的口香糖盒內查獲大麻煙1支，淨重0.15克。海關關員在對進境旅客進行監管時，發現一名男性旅客進入海關監管區未向海關申報。該旅客步伐很快，一直貼著牆邊走，經過海關關員時刻意遠離，關員隨即對其進行攔截檢查。

相關新關 :羅湖口岸︱北上男闊腳牛仔褲奇異凸起 1378手機鏡頭綁腿被截

檢查過程中，該旅客手部刻意遮擋正在被檢查的物品。被要求將口袋內物品拿出檢查時，該旅客很遲疑地從口袋掏出口香糖盒後又企圖塞回包裡。

經進一步檢查，海關關員在該旅客攜帶的口香糖盒內發現疑似自制大麻煙1支。經現場檢測，該香菸呈四氫大麻酚（THC）陽性。後經專業機構鑑定，上述物品檢出四氫大麻酚成分，確認為大麻，淨重0.15克。

目前，該案已移交海關緝私部門處理。根據《中華人民共和國刑法》《中華人民共和國禁毒法》等相關法律規定，毒品是指鴉片、海洛因、甲基苯丙胺（冰毒）、嗎啡、大麻、可卡因以及國家規定管制的其他能使人形成癮癖的麻醉藥品和精神藥品。走私、販賣、運輸、製造毒品，無論數量多少，都應當追究刑事責任，予以刑事處罰。

"
