id,title,date,url,section,source,last_update,scrape_time,news_content
3525064.0,美減息高度預期提防「獲利回吐」 料更關注2026年步伐 高盛稱3月及6月再減,2025-12-09 06:00,https://www.stheadline.com/investment/3525064/美減息高度預期提防獲利回吐-料更關注2026年步伐-高盛稱3月及6月再減,"
        投資理財
    ",singtao,2025-12-09 06:00,2025-12-09 06:15,"美國聯儲局將於本港時間周四（11日）凌晨3時公布議息結果，市場普遍預期再減息0.25厘；不過，局方目前亦面臨不少問題，其中包括AI引發高學歷群體失業率攀升、聯儲局官員決策共識不一，加上政府停擺後或令數據失真，市場正等待鮑威爾如何拆局。此外，由於市場已高度預期再減息0.25厘，因此市場焦點料將在於利率點陣圖及2026年減息步伐。

相關文章：下任聯儲局主席「大熱」哈塞特料本月減息0.25厘

AI引發高學歷群體失業率攀升

高盛研究部首席經濟學家Jan Hatzius在最新《全球展望》報告中直言，延期很久的9月就業數據顯示勞動力市場已出現降溫跡象，尤其是高學歷群體的失業率顯著上升，可能是AI和其他提升效率措施所帶來的影響。然而，下一份就業報告及通脹數據分別定於12月16日及12月18日出爐；換言之，上述數據表現將不影響在12月10日議息會議上的決策。

該行預計，明年減息前景相對不明朗，但隨着關稅影響減弱、減稅政策及金融環境放鬆等因素推動，美國經濟將加速增長，聯儲局可能會在2026年1月暫停減息，其後在3月和6月再次減息，最終將聯邦基金利率降至3%至3.25%的區間。

聯儲局內部料出現嚴重分歧

據彭博最新調查41位經濟學家的數據顯示，多數經濟學家預期聯儲局在下周減息後，將從2026年3月開始再實施兩次25個基點的減息。調查指出，僅18%受訪者認為通脹是主要風險，絕大多數專家認為「就業市場顯著走弱」，才是決策者面臨的最大挑戰。

Scope Ratings經濟學家Dennis Shen表示，聯儲局「鴿派」似乎略佔上風，但若聯儲局再度放鬆貨幣政策，預期鮑威爾會強調此後將暫停減息，以等待更多經濟信號。

值得留意的是，絕大多數受訪者預計，本次會議可能出現近年罕見的「嚴重分歧」。隨着聯儲局內部對通脹與就業風險的評估不一，預計將再次出現反對票。當中，堪薩斯城聯儲總裁Jeff Schmid及聖路易斯聯儲總裁Alberto Musalem可能會投下反對票，而聯儲局理事米蘭預計將再次反對25個基點的降息，但會支持減息50個基點。

相關文章：美國減息｜達拉斯聯儲行長稱12月不宜再減息 將觀察數據和金融形勢發展

DWS：停擺後官方數據或失真

對於今次聯儲局會議，DWS首席美國經濟學家Christian Scherrmann提醒，由於早前政府停擺，目前可獲取的官方數據有限且可能失真，將令聯儲局陷入決策兩難。他指出，私人市場數據顯示就業放緩，但官方的申請失業救濟數據仍溫和，加上企業因AI技術發展對招聘猶豫不決，以及通脹維持約3%偏高水平，局方要在鷹派與鴿派之間達成共識並不容易。

他認為，若鮑威爾選擇「鴿派暫停」，可能只是延後失望及其對金融環境與消費的影響；但若進行另一次鷹派減息，則可能挑戰聯儲局的公信力，並鼓勵市場期待更多的寬鬆措施，且考慮到近期有關鮑威爾潛在繼任者的消息，此舉甚至可能再度引發關於聯儲局獨立性的討論。

雖然DWS預期聯儲局本周會減息，但若局方選擇按兵不動，直到1月會議再收集更多數據，亦認為屬情理之中。

富途：港股前景取決內地經濟

另一方面，針對未來投資趨勢影響，富途分析師指出，市場普遍預期再減息0.25厘，相信焦點將在於官員對2026年的減息步伐共識，亦即利率點陣圖。同時，若減息如期落地，充裕的市場流動性有望支撐美股在高位運行，科技及房地產股將特別受惠於融資成本下降，但分析師亦提醒投資者需警惕「獲利回吐」風險。

港股⽅⾯，富途指⾦管局勢必跟隨美國下調基本利率，將帶動HIBOR回落，直接舒緩本地企業借貸及供樓壓⼒，為地產股及REITs注入動⼒，惟港股中⻑線表現仍取決於內地經濟復甦⼒度，減息僅屬流動性層⾯的托底因素。

相關文章：美國減息｜聯儲局12月減息機會達87% 特朗普親信料減0.25厘 即睇最新議息及官員言論"
3525199.0,金寶湯高層稱產品是「做給窮人吃」 錄音曝光被停職,2025-12-09 05:20,https://www.stheadline.com/realtime-world/3525199/金寶湯高層稱產品是做給窮人吃-錄音曝光被停職,"
        即時國際
    ",singtao,2025-12-09 05:20,2025-12-09 05:30,"美國百年食品巨擘金寶湯（Campbell Soup Co.）近日捲入公關風波。一名前員工提交的會議錄音證據顯示，公司資訊安全副總裁巴利（Martin Bally）不僅對印度裔同事發表種族歧視言論，更以粗言狂踩公司自家產品為「專供窮人的劣質貨」，他幾乎不會再買來吃。英國《衞報》引述金寶公司表示，巴利已被解僱（dismisses）。

根據密歇根州前員工加爾薩（Robert Garza）向法院提交的訴訟文件，加爾薩去年9月入職金寶公司，11月約巴利在餐廳見面談薪資問題，然而，巴利隨後進行了長達一小時的「咆哮」，猛烈抨擊公司：「我們賣的都是些給窮人吃的垃圾。誰會買我們的東西？我現在幾乎不再購買金寶產品。」

巴利更暗指公司湯品含有「基因改造肉」，稱「我可不想吃從3D打印機出來的雞肉」。

錄音中亦出現針對印度裔員工的侮辱性言論，包括「該死的印度人甚麼都不懂」、「 他們好像沒有自己的思考能力。」

加爾薩稱，他今年1月曾向直屬主管反映巴利的言行，未獲正視，反而於1月30日遭無理解僱。他現已對金寶公司、巴利及該名主管提起訴訟，指控公司縱容種族歧視文化，並對揭發者進行報復。

加爾薩的律師指出，當事人過往工作表現良好，從未受紀律處分，卻因挺身舉報不當言行而遭解僱，顯示公司內部管治存在嚴重問題。訴訟要求金寶賠償其精神困擾及經濟損失。

金寶公司發言人回應稱，經調查後確認錄音中聲音屬於巴利，其言論「粗鄙、冒犯且完全失實」，公司對此致歉。聲明強調：「我們對自家食品、員工及優質原料深感自豪，所有產品均以合理價格提供良好營養。」公司特別澄清，其雞肉湯品使用的均為經美國農業部認可、不含抗生素的傳統雞肉，絕未使用「3D打印雞肉」或實驗室培育肉。

金寶公司以罐裝湯品聞名全球，旗下雞肉麵湯長期深受家庭歡迎。

巴利自2022年1月起在金寶公司工作。"
3525198.0,日本青森7.6級地震｜中國駐札幌總領館提醒公民注意防範海嘯及餘震,2025-12-09 03:33,https://www.stheadline.com/realtime-world/3525198/日本青森76級地震中國駐札幌總領館提醒公民注意防範海嘯及餘震,"
        即時國際
    ",singtao,2025-12-09 03:33,2025-12-09 03:45,"據日本氣象廳發布，日本時間12月8日23時15分左右，青森縣東面附近海域發生7.6級地震，震源深度約50公里。日本氣象廳已針對北海道、青森縣、岩手縣等地沿海地區發布不同級別的海嘯警報或提醒，呼籲民眾立刻從危險區域撤離。預計海嘯將於8日23時50分至9日0時20分到達北海道、青森、岩手附近海域，浪高3米。

中國駐札幌總領館提醒領區內中國公民，特別是北海道、青森縣太平洋沿岸地區和岩手縣中國公民，通過官方渠道及時了解最新情況，遵循當地政府發布的避難指令，做好應急避難，遠離海邊，確保人身安全。

總領館又提醒，注意海嘯可能會反覆來襲，不要因為取東西或觀察情況等靠近海岸。如遇緊急情況，請及時報警並與中國駐札幌總領館聯系尋求協助。

同時，總領館提醒領區中國公民，特別是居住在震源地附近中國公民高度警惕餘震發生及次生災害。出行人員預先了解飛機、鐵路等公共交通工具運行情況，通過總領館網站、微信公眾號及日本媒體等渠道密切關注地震有關信息。

"
3525197.0,觀塘夫婦家中爆爭執 夫施襲妻擸菜刀還擊 雙雙受傷被捕,2025-12-09 03:30,https://www.stheadline.com/breaking-news/3525197/觀塘夫婦家中爆爭執-夫施襲妻擸菜刀還擊-雙雙受傷被捕,"
        突發
    ",singtao,2025-12-09 03:30,2025-12-09 03:45,"觀塘發生傷人案。周一（8日）晚上近10時，警方接獲一名女子報案，指她與丈夫在雲漢街24號一單位內因瑣事爭執，其間丈夫懷疑以手襲擊她，她遂持一把長約26厘米的菜刀還擊。

警員及救護員到場後，經初步調查，以涉嫌「普通襲擊」拘捕34歲姓徐男子；33歲姓林女子則涉嫌「傷人」被捕，兩人現正被扣留調查。案件交由觀塘警區刑事調查隊第七隊跟進。

事件中，徐男手部受傷，林女面部受傷，兩人清醒由救護車送往聯合醫院治理。"
3525196.0,珍惜生命｜觀塘男子公廁所割頸自殺 昏迷送院搶救,2025-12-09 03:01,https://www.stheadline.com/breaking-news/3525196/珍惜生命觀塘男子公廁所割頸自殺-昏迷送院搶救,"
        突發
    ",singtao,2025-12-09 03:01,2025-12-09 03:15,"觀塘發生自殺案。周一（8日）晚上近11時，一名姓鄧（49歲）男子，在警方接獲途人報案，基業里公廁一廁格內企圖自殺，有途人發現後報警。

警員及救護員接報到場，發現鄧男倒臥內廁格並陷入昏迷 ，身上有一把鎅刀，救護員將他送往伊利沙伯醫院治理。人員經初步調查，相信鄧男懷疑割頸自殺。警方於現場沒有檢獲遺書。



防止自殺求助熱線：



「情緒通」精神健康支援熱線：18111

香港撒瑪利亞防止自殺會： 2389 2222

生命熱線： 2382 0000

明愛向晴軒： 18288

社會福利署： 2343 2255

撒瑪利亞會熱線(多種語言)： 2896 0000

東華三院芷若園： 18281

醫管局精神健康專線： 2466 7350

賽馬會青少年情緒健康網上支援平台「Open 噏」：http://www.openup.hk"
3525166.0,葵涌私家車失控連撞3鐵柱 男司機吹波超標涉酒駕被捕,2025-12-09 01:06,https://www.stheadline.com/breaking-news/3525166/葵涌私家車失控連撞3鐵柱-男司機吹波超標涉酒駕被捕,"
        突發
    ",singtao,2025-12-09 01:06,2025-12-09 01:15,葵涌發生酒駕案。周一（8日）晚上9時許 ，一輛私家車沿大窩口道往葵涌方向行駛，駛至近林護紀念中學對開時，懷疑失控撞向路邊三支鐵柱。警方接報到場，發現姓盧（46歲）男司機身上有酒氣。經初步調查，盧男未能通過酒精呼氣測試，涉嫌酒後駕駛被捕，現正被扣留調查。案件中沒有人受傷。
3525165.0,日本青森縣7.6級地震｜午夜湧40厘米海嘯 有酒店多人傷 新幹線停運百人受困,2025-12-09 01:01,https://www.stheadline.com/realtime-world/3525165/日本青森縣76級地震午夜湧40厘米海嘯-有酒店多人傷-新幹線停運百人受困,"
        即時國際
    ",singtao,2025-12-09 01:01,2025-12-09 01:15,"日本北部近海昨晚（12月8日）發生強烈地震，日本氣象廳表示，當地時間23時15分左右（本港時間22時15分），發生黎克特制7.6級地震。氣象廳隨即向北海道太平洋沿岸中部、青森縣太平洋沿岸以及巖手縣發佈海嘯警報，預計海嘯高度將達3米。

東北町道路塌陷一人傷

地震發生後，日本媒體引述氣象廳指，午夜前在青森縣陸奧市小川原港及北海道浦川港，已觀測到約40厘米高的海嘯。

受是次強烈地震影響，多地傳出居民受傷報告。據日本放送協會（NHK）報道，青森縣八戶市一家旅館發生意外，有多人受傷，幸所有傷者均意識清醒，已被安排送院。該旅館職員透露，地震搖晃持續約一分鐘，導致架上物品掉落，但相信建築物主體並無損壞。

此外，青森縣政府表示，東北町發生道路塌陷，導致一名男性受傷，傷者尚有意識。當地消防部門亦透露，青森縣五所川原市有一名70多歲女性在家中因物品掉落而受傷，傷勢未明，但亦保持清醒。

交通方面，受地震影響，東北新幹線（Tohoku Shinkansen）服務暫停。據報，一列載有94名乘客的子彈列車因而被困，所幸車上無人受傷。

JR北海道所有列車服務暫停

JR北海道公司亦宣佈，截至昨晚11時33分，旗下所有列車服務已暫停。營運新千歲機場的北海道機場公司則表示，截至昨晚11時40分，機場正在檢查兩條跑道，以確定地震有否造成異常。

"
3525140.0,安世半導體｜韓正籲德恪守一中原則  王文濤：中國已採安世半導體晶片出口許可豁免措施,2025-12-08 23:59,https://www.stheadline.com/china-politics/3525140/安世半導體韓正籲德恪守一中原則-王文濤中國已採安世半導體晶片出口許可豁免措施,"
        大國外交
    ",singtao,2025-12-08 23:59,2025-12-09 00:15,"在北京，國家副主席韓正及商務部長王文濤周一會晤了正在訪華的德國外長瓦德富爾。韓正在會面中重申台灣問題是中國核心利益，敦促德方恪守「一個中國」原則，並期望德國作為歐盟核心大國，能對推動中歐關係健康發展發揮積極作用。商務部長王文濤表示，中國已採安世半導體晶片出口許可豁免措施。

韓正強調台灣屬「核心利益的核心」

國家副主席韓正周一在北京會見到訪的德國外長瓦德富爾時指出，中德兩國互為重要經貿合作夥伴，雙方合作互利共贏。中方願意與德方落實兩國領導人的重要共識，加強溝通對話，推動中德全方位戰略夥伴關係邁向新台階。

韓正強調，台灣問題是「中國核心利益的核心」，希望德方必須恪守「一個中國」原則。他同時寄望德國能夠對推動中歐關係健康發展發揮積極作用。

瓦德富爾回應表示，德國新政府高度重視發展對華關係，將堅定奉行「一個中國」政策。他期待同中方進行密切的高層交往，深化全方位合作，成為中國可靠的合作夥伴。

中方對安世晶片出口開綠燈

針對外界高度關注的供應鏈問題，瓦德富爾亦與商務部長王文濤舉行會談。王文濤表示，中方歡迎德國企業鞏固傳統領域合作，並拓展新興領域合作。他同時希望德國政府為在德中資企業營造公平、開放、非歧視的政策環境。

王文濤特別指出，中方重視德方在出口管制如安世半導體等問題上的關切，並已在稀土等領域逐步適用通用許可制度。中方更已採取安世半導體相關晶片出口許可豁免措施，以努力維護全球產供鏈穩定暢通。

瓦德富爾表示，德方願與中方妥善處理分歧，共同維護自由貿易和以規則為基礎的多邊貿易體制。他並承諾德方願在安世半導體問題上發揮作用，與中方一道，推動企業盡快找到長期有效的解決方案。"
3525139.0,日本青森縣7.6級地震｜縱橫遊：約300團友在日本  情況安好,2025-12-08 23:40,https://www.stheadline.com/society/3525139/日本青森縣76級地震縱橫遊約300團友在日本-情況安好,"
        社會
    ",singtao,2025-12-08 23:40,2025-12-08 23:45,日本本州東面近岸今晚發生7級以上地震。縱橫遊常務董事袁振寧對《星島頭條》表示，現時有大約300名團友在日本，所有團友情況安好，已通知所團友留房，接下來會密切留意情況，強調會確保所有團友安全。
3525126.0,警查尖沙咀可疑平治 搜獲依托咪酯毒品拘司機,2025-12-08 22:59,https://www.stheadline.com/breaking-news/3525126/警查尖沙咀可疑平治-搜獲依托咪酯毒品拘司機,"
        突發
    ",singtao,2025-12-08 22:59,2025-12-08 23:15,尖沙咀堪富利士道2號對出，今日（12月8日）晚上時分警員巡邏期間，發現一部停泊的黑色平治私家車形跡可疑，遂上前截查。警員調查後，在車內檢獲一批依托咪酯毒品，遂將司機拘捕並帶上警車。毒品來源及去向仍在調查。
3525119.0,寄艙行李藏$470萬大麻花 曼谷抵港兩男子被捕,2025-12-08 22:45,https://www.stheadline.com/breaking-news/3525119/寄艙行李藏470萬大麻花-曼谷抵港兩男子被捕,"
        突發
    ",singtao,2025-12-08 22:45,2025-12-08 23:15,香港海關昨日（7日）在香港國際機場偵破一宗行李藏毒的販毒案件，檢獲約23公斤懷疑大麻花，估計市值約470萬元，並拘捕兩名懷疑涉案人士。兩名分別43歲和58歲的男旅客昨日從泰國曼谷飛抵本港。海關人員清關時，在兩人攜同的寄艙行李內發現該批懷疑大麻花，遂把二人拘捕，案件仍在調查中。
3525124.0,宏福苑五級火｜房署巡5屋苑揭部分棚架有雜物  政府大致完成向災民派一萬元應急補助金,2025-12-08 22:41,https://www.stheadline.com/society/3525124/宏福苑五級火房署巡5屋苑揭部分棚架有雜物-政府大致完成向災民派一萬元應急補助金,"
        社會
    ",singtao,2025-12-08 22:41,2025-12-08 22:45,"房屋署統籌的緊急維修承建商今日( 8日 )已完成清理大埔宏福苑樓宇外圍雜物的工作。房屋局獨立審查組今日亦繼續抽取受災樓宇的混凝土芯，目前已包括5座樓宇。

5個屋苑部分棚架上置有雜物  承建商正作出清理

審查組已巡查4個居屋屋苑（深水埗怡閣苑、觀塘安基苑、沙田穗禾苑、深水埗清麗苑）和一個租置屋邨（柴灣峰華邨）的棚架狀況，發現當中部分棚架上置有雜物，承建商正作出清理，審查組會密切監察進度。

就屋宇署發出的移除棚網命令，截至今日下午5時，227幢私人樓宇的外牆棚網已經移除（包括兩宗由政府承建商移除），尚有3宗屋宇署已接受其延期申請的個案正進行工程，預計可於本周內完成。屋宇署爭取本星期內公布一套新的安排，要求工地使用的棚網在上架前就地採樣及核實是否符合標準，以便有關外牆工程可盡早恢復。

勞工處繼續巡查設有大型棚架的樓宇維修工程工地的防火設施及火災應變安排，以保障工人的職業安全。截至今日下午4時，勞工處已巡查351個建築地盤，共發出180份書面警告及96張敦促改善通知書，並提出25宗檢控。

另外，截至今日中午，政府成立的「大埔宏福苑援助基金」已收到的外界捐款約30億元，連同政府投入的3億元啓動資金，基金總額維持約為33億元，會用在協助居民重建家園，是長期和持續的支援。政府早前宣布基金會向每戶受影響家庭發放生活津貼，截至今日已處理1 357宗個案；生活津貼金額已由5萬元增至10萬元，政府會陸續發放有關款項。另外，基金會就每名死者向家屬發放20萬元慰問金及5萬元殮葬金，截至今日已處理95宗個案。政府至今已向1 932戶派發一萬元應急補助金，相關派發工作已大致完成。 截至今日上午，共有1 422名居民入住由民政及青年事務局協調的青年宿舍／營舍或酒店房間；另有2 522名居民現居於房屋局的過渡性房屋或香港房屋協會項目的單位。此外，大埔民政事務處現維持一所位於大埔社區中心的臨時庇護中心對外開放，供有需要人士使用；另一所位於東昌街社區會堂的臨時庇護中心，則會繼續運作至所有使用者全部遷往經安排的應急住宿為止。"
3525112.0,美股三大指數漲跌不一 CFLT升近三成 大摩：美股迎「看漲格局」,2025-12-08 22:41,https://www.stheadline.com/stock-market/3525112/美股三大指數漲跌不一-CFLT升近三成-大摩美股迎看漲格局,"
        股市
    ",singtao,2025-12-08 22:41,2025-12-08 22:45,"本周全球市场迎来「超级央行周」，債券市場氣氛持續緊綳，美股三大指數漲跌不一。

道指報47924點，跌30點；標指報6876點，升6點；納指報23650點，升71點或0.3%。

據華爾街日報報道，IBM正進行高層談判，計劃以約110億美元收購數據流平臺Confluent (CFLT)，CFLT急升29.93%；博通（AVGO）升3.12%；機器人概念iRobot（IRBT）走高，漲超8.6%。

大摩：標普500年末目標位7800點

摩根士丹利策略師Michael Wilson領導的團隊認為，鑑於企業盈利預期改善和美聯儲降息預期，美國股市面臨「看漲格局」，其對標普500指數的12個月目標位為7800點，意味着較當前水平有約14%的上漲空間。

市場期待「聖誕老人行情」延續漲勢，惟美銀策略師Michael Hartnett預警，若美聯儲主席Fed周四釋出過於鴿派的訊號，恐引發長天期公債遭拋售，進而壓抑股市年末表現。"
3525122.0,宏福苑五級火｜警就6屋苑棚網涉行使虛假文書展開調查 包括碧瑤灣及清麗苑,2025-12-08 22:33,https://www.stheadline.com/breaking-news/3525122/宏福苑五級火警就6屋苑棚網涉行使虛假文書展開調查-包括碧瑤灣及清麗苑,"
        突發
    ",singtao,2025-12-08 22:33,2025-12-08 22:45,"大埔宏福苑發生五級大火，當局揭發有人將不合規的棚網，與合規的棚網混合使用，事件震驚全港，令多名已搭建棚架及棚網維修大廈的業主對棚網質量是否合格深感擔憂。早前警方表示有屋苑維修時使用的棚網涉及行使虛假文書，警方指至今已經就6宗案件展開調查，分別涉及西區碧瑤灣、柴灣峰華邨、北角富澤花園、深水埗怡閣苑、長沙灣清麗苑及紅磡萬高花園大廈，案件列作「求警調查」，交由港島總區重案組調查，暫未有人被捕。

相關新聞 : 紅磡萬高花園棚網證書疑造假警列虛假文件案跟進

上周四（4日）警方接獲市民報案，指紅磡信用街2號萬高花園大廈B座的棚架圍網的檢驗證書懷疑造假。據了解，警方檢取一張由「濱州市檢驗檢測中心」發出的棚網阻燃合格檢測報告。

警方早前就宏福苑大火先後拘捕15人，包括宏福苑維修工程大判工程公司、工程顧問公司，和二判棚架及外牆維修公司人員，涉嫌誤殺。警方其後在宏福苑20個棚網樣本中，發現7個未達到阻燃測試標準，大多位於較難觸及的位置，當中處於唾手可得位置的樣本合格率較高，而在較難取樣地方所得的樣本不合格率則大得多。政務司司長陳國基當時在記者會上表示，涉案人士混合使用合標準和不合標準的圍網，以逃避政府檢測，手法狡猾，而且處心積慮。"
3525116.0,石硤尾兩漢碰撞釀爭執 躁男打人再當街持刀追嚇 對方驚呼「報警啊」｜有片,2025-12-08 22:27,https://www.stheadline.com/breaking-news/3525116/石硤尾兩漢碰撞釀爭執-躁男打人再當街持刀追嚇-對方驚呼報警啊有片,"
        突發
    ",singtao,2025-12-08 22:27,2025-12-08 22:30,"石硤尾窩仔街港鐵站B1出口外，今日（12月8日）下午1時許，深水埗警區人員執行職務期間，發現兩名男子因身體碰撞爭執。其間，67歲姓關男子追逐受害人後，不僅手腳並用襲擊對方，其後更以一鎅刀指嚇及企圖襲擊受害人。

警員隨即制止，經初步調查，關男涉嫌企圖傷人被捕，現正被扣留調查。案件交由深水埗警區刑事調查隊第七隊跟進。至於受害人為64歲姓黃男子，報稱手腳受輕傷，清醒被送往明愛醫院治療。

網上片段所見，當時兩名男子於窩仔街馬路上爭執，期間黑衫男疑情緒激動，從背囊拿出一把懷疑鎅刀物體，向對方步步進逼威脅，灰衫老翁見狀隨即舉手擋開並後退，並重複大叫「有刀啊」、「報警啊」，途人聞聲紛紛張望。

至片段最後，一部私家車駛近，疑似司機想制止雙方，惟此時片段戛然而止，未拍攝到後續制服過程。"
3525121.0,日本青森縣7.2級地震  當局發海嘯警報,2025-12-08 22:24,https://www.stheadline.com/realtime-world/3525121/日本青森縣72級地震-當局發海嘯警報,"
        即時國際
    ",singtao,2025-12-08 22:24,2025-12-08 22:30,日本天氣協會資料，當地時間12月8日23時15分，青森縣近海發生7.2級地震，已發海嘯預警。
3525115.0,固力果Pocky︱朱古力產品味道與標準不同  主動回收日本600萬件,2025-12-08 21:29,https://www.stheadline.com/realtime-world/3525115/固力果Pocky朱古力產品味道與標準不同-主動回收日本600萬件,"
        即時國際
    ",singtao,2025-12-08 21:29,2025-12-08 21:45,"日本知名零食「Pocky朱古力」受到不少港人喜愛。日本食品大廠固力果（Glico）今（8）日宣布，主動回收全國販售的Pocky系列餅乾等共20項產品，總計約600萬件。部分巧克力產品味道出現異常。

強調沒有食品安全問題

日本固力果指出，針對其日本市場的部分批次產品，因巧克力與原有味道不同，未達其標準而宣布主動回收，同時強調產品沒有食品安全或法規不符合之疑慮，可安全食用。"
