id,title,date,scrape_time,section,source,url,news_content
6948b77ab392e5851f3c50f8,跨境網購成消費新常態 內地電商憑優惠服務拓市場｜星期日檔案‧延伸閱讀,2026-01-05 11:15,2026-01-05 12:00,local,tvb,https://news.tvb.com/tc/local/6948b77ab392e5851f3c50f8,"隨著電子商務服務品質的不斷提升，加上近年「北上消費」風氣的盛行，香港市民透過網絡購買內地商品的趨勢日益顯著，預期未來只會持續增長，難以逆轉。這一現象的背後，不僅反映了兩地經濟活動的緊密交融，也凸顯出消費者對跨境購物便利性與性價比的追求。內地電商平台看準這股需求，積極拓展香港市場，並透過一系列針對性的促銷策略—如節日優惠、跨境免運、本地化支付及限時折扣等，成功吸引大量港人投身於這股跨境網購熱潮之中。

針對性策略吸引港客　內地電商積極拓展市場

這些促銷活動不僅降低了香港消費者的購買門檻，也讓更多人體驗到內地電商在物流、客服與商品多樣性上的進步。從日常用品到電子產品，從服飾到特色食品，內地電商憑藉豐富的貨源與具競爭力的價格，逐漸改變了許多港人的消費習慣。同時，隨著配送效率提升與退換貨機制愈趨完善，以往跨境購物常見的顧慮逐漸消散，進一步推動了這股趨勢的深化。

服務進步消除顧慮　消費習慣逐漸改變

可以預見，在服務持續優化與優惠活動的雙重推動下，香港消費者對內地電商的依賴與認可將不斷提高。這不僅促進了兩地商業生態的互動，也為香港零售市場帶來新的啟示與挑戰。未來，隨著跨境電商基礎建設日趨成熟，此一網購熱潮勢必更為蓬勃，成為香港消費文化中不可或缺的一部分。

<a href=""https://news.tvb.com/tc/programme/sundayreport"" target=""_blank"" rel="""">星期日檔案 星期日晚 7:00 翡翠台 - 節目重溫 </a>"
695b288ec26d920e36689de8,數據顯示內地服務業活動增長放緩,2026-01-05 11:00,2026-01-05 11:15,finance,tvb,https://news.tvb.com/tc/finance/695b288ec26d920e36689de8,"數據顯示，內地服務業活動增長放緩。

反映內地中小企活動的標普全球中國服務業採購經理指數(PMI)，去年十二月報52，按月放緩0.1，是去年六月以來最低，但高於50以上的擴張水平。

計及製造業的標普全球綜合採購經理指數，回升至51.3，連續七個月處於50以上的擴張水平。

期內，新訂單和商業活動的增速均是去年六月以來最低水平。銷售增長放緩的原因，是新出口業務再次下滑；因遊客數量減少，尤其是來自日本的遊客數量減少；企業再次裁員，導致積壓訂單略有增加；市場競爭導致價格下跌，企業投入成本持續上漲。

但企業對未來一年的信心，升至九個月來的最高水平。編製指數的機構表示，樂觀情緒來自企業擴張計劃的預期，但認為就業收縮和外部需求波動，仍是行業面臨的主要限制。"
69579948c26d920e364b567c,東華三院逾百年文物保育之路 見證香港慈善醫療與歷史傳承｜探古尋源‧延伸閱讀,2026-01-05 11:00,2026-01-05 12:00,local,tvb,https://news.tvb.com/tc/local/69579948c26d920e364b567c,"東華三院的歷史與香港社會發展緊密相連。自19世紀成立以來，東華三院不僅提供醫療、教育及社會服務，更在戰亂時期堅守崗位，持續服務市民。1941年太平洋戰爭爆發，東華三院在這非常時期，仍堅持在東華醫院及廣華醫院，提供有限度的醫療服務，又竭力協助疏散市民回鄉、施粥派飯、派送寒衣、殮死救傷。和平後，東華三院全面恢復醫療服務，及至五、六十年代，東華三院手開辦中、小學及發展正規和系統化的社會服務。

文物館由醫院大堂活化而成　獲列法定古蹟

文物保育方面，東華一直致力保存、研究和整理機構歷史。1970年，東華慶祝成立百周年，將廣華醫院大堂闢為東華三院文物館，開始有系統的收集、保存和展示東華的文物及檔案；2010年，成立檔案及歷史文化辦公室，藉推廣文物保育工作及提供文化服務，致力保護、開發及分享東華三院的歷史文化；2016年，設立東華三院何超蕸檔案及文物中心，妥善保存珍貴的文物及檔案，並致力發展成為研究香港史、中國近代史、世界華人史及世界史的重要資源中心。除保存及推廣東華文物保育外，辦公室更擔起本地文物保育先鋒的角色。

位於窩打老道的東華三院文物館，原為廣華醫院大堂，於1911年落成，是首間在九龍及新界興辦的醫院，啟用後一直為社區提供中西醫療服務。1970年，東華三院慶祝成立100周年， 將廣華醫院大堂闢為東華三院文物館，保存本院的歷史檔案和文物。文物館於1993年起向公眾開放，並於2010年11月12日獲政府列為法定古蹟。

檔案及文物中心成立　推動歷史研究與文化傳承

至於東華三院何超蕸檔案及文物中心，於2016年3月成立，中心設檔案庫、文物庫、修復室、數碼工作室及閱覽室。中心使命是透過建立檔案及文物管理系統，中心設備齊全，設有檔案庫、文物庫、修復室、數碼工作室和閱覽室，妥善整理、保存、修復和分享東華三院超過一個世紀的珍貴檔案及文物，傳承東華獨特的歷史文化及慈善精神。

檔案及歷史文化辦公室，致力保存及弘揚東華三院的歷史文化，以協助保存香港的歷史文化，探討東華三院過去和將來，在連繫世界華人社會上的角色，以及發展轄下的東華三院文物館，及東華三院何超蕸檔案及文物中心，成為研究香港史、中國近代史、世界華人史及世界史的重要資源中心。由於東華三院的歷史與香港的歷史息息相關，辦公室更擔當本地歷史文化保育先鋒的角色，提供不同的文化服務。

<a href=""https://news.tvb.com/tc/programme/hkhistoricalsites/69595ce9c26d920e365a4c63"" target=""_blank"" rel="""">點擊觀看節目重溫</a>"
695b1e96c26d920e366845cf,人民幣中間價見逾15個月高位,2026-01-05 10:14,2026-01-05 10:30,finance,tvb,https://news.tvb.com/tc/finance/695b1e96c26d920e366845cf,"人民幣中間價見逾十五個月高位。

內地金融市場假期後復市，官方開出的人民幣中間價報7.023兌一美元，較上個交易日上調58點子，是自去年九月三十日以來的高位。現貨人民幣方面，在岸價和離岸價早段都於6.9算上落。

另外，人民銀行進行135億元人民幣七天期逆回購操作，扣除到期的逆回購，單日在市場淨回籠4,688億元人民幣。"
695b1b6cc26d920e366838e7,南韓有科技初創擬來港開拓商機 學者認為香港應更主動把握機遇,2026-01-05 10:01,2026-01-05 11:00,local,tvb,https://news.tvb.com/tc/local/695b1b6cc26d920e366838e7,"南韓總統李在明訪華，聚焦經貿議題，推動兩國加強合作。南韓有科技初創公司計劃來港開拓商機。有學者認為，香港應更主動把握機遇。

提起南韓科技，很多人第一時間想起它們，大品牌以外，當地亦有不少初創企業積極發圍。南韓這間初創公司開發「超級應用程式」，類似「南韓版微信」，集多功能於一身，透過創建虛擬社區，讓志同道合的人互動，可以聊天、發起活動及調查等，還能電子商務。

公司設計程式時，刻意減少南韓元素，方便全球用家。他們希望擴展業務版圖，計劃今年來香港開分公司。

南韓初創企業行政總裁愼宰桓說：「香港無疑是亞洲金融中心，對於加密貨幣、去中心化金融及社群品牌內容而言，香港是絕佳環境，適合這些產業及合作夥伴。香港是通往中國市場，及整個東南亞市場的主要門戶，所以我們希望在香港開設分公司。」

南韓正大力發展創科，計劃五年內孵化一萬間初創，聚焦人工智能(AI)等先進產業。有學者認為，單靠南韓本土市場，難以容納這麼大批初創，建議香港提供更多稅務優惠、協助找辦公室等，吸引南韓初創來港。

南韓東國大學經營學科責任教授高偉森稱：「有非常多人來南韓做醫美，未來能否有較創新的，或有些科技，不僅讓人工智能進行輔助診斷，更多的是用人工智能進行操作，這樣我覺得是非常有潛力的東西。」

行政長官李家超早前訪問南韓時就提及，當地人工智能、醫療科技發展迅速，與香港重點優勢產業吻合，兩地有很多合作空間。"
695b173ac26d920e36680cae,電視廣播高層人事變動 曾志偉將轉任新成立諮詢委員會召集人,2026-01-05 09:43,2026-01-05 10:00,local,tvb,https://news.tvb.com/tc/local/695b173ac26d920e36680cae,"電視廣播(TVB)宣布高層人事變動。

現任總經理曾志偉將由本月21日起，轉任新成立的諮詢委員會召集人，專責向董事局提出新節目內容及策略方向，並專注於探索新內容形式，及促進與外部內容合作夥伴的策略夥伴合作。

曾志偉現有行政職責及日常工作，將重新分配予其他高級行政人員。"
695b172cc26d920e36680bba,蘇惠思稱將帶領北都辦 提速提質發展北部都會區,2026-01-05 09:42,2026-01-05 10:15,local,tvb,https://news.tvb.com/tc/local/695b172cc26d920e36680bba,"新任北部都會區統籌辦事處主任蘇惠思指，會帶領北都辦，提速提質發展北部都會區。

北部都會區統籌辦事處主任蘇惠思表示：「北區發展對香港非常重要，它既是推動香港產業轉型的新引擎，亦是與大灣區城市聯動合作的新平台。在特首及司局長帶領下，我們已有一個藍圖，現在我們最重要要做的，是將已有的藍圖細化，提速、提質，盡量做到最好，為香港及國家帶來最大的利益。」"
695b16c1c26d920e36680832,劉宇隆稱數據顯示夏季流感最快約一周後完結 呼籲市民續做好防護,2026-01-05 09:41,2026-01-05 10:15,local,tvb,https://news.tvb.com/tc/local/695b16c1c26d920e36680832,"疫苗可預防疾病科學委員會主席劉宇隆認為，數據顯示今次夏季流感季節，最快大約再過一周就會完結，而冬季流感仍未至，但亦不能排除重疊的可能性，呼籲市民做好防護。

疫苗可預防疾病科學委員會主席劉宇隆稱：「因季節性是根據客觀指標，陽性率其實一直下跌中，未來一兩周應跌至基線以下。(夏季流感)峰值也不是很高，在十月初已到達，已連續跌了四周。我估算未來兩周也會跌，跌至低於基線，就應脫離了2025夏季流感季節。」

劉宇隆續指：「至於會否無縫銜接(冬季流感)，沒人講得準，學校衞生程度要好、通風要好，市民可做甚麼？當然乘港鐵、巴士很擠迫，不妨考慮戴口罩。若真的有冬季流感來時，可拉低峰值、時間拉長。雖然感染人數可能相若，但感染時間可拉長，從而入院等一系列壓力都可減低。」"
695b173ec26d920e36680d00,開市焦點｜地緣局勢升溫 港股好淡爭持 關注美國空襲委內瑞拉與伊朗局勢,2026-01-05 09:37,2026-01-05 10:00,finance,tvb,https://news.tvb.com/tc/finance/695b173ec26d920e36680d00,"港股周末、周日後復市，市場預期將高開約200點。投資者焦點集中在兩大地緣政治事件：美國空襲委內瑞拉並俘虜總統馬杜羅夫婦，以及伊朗爆發大規模示威。與此同時，亞太股市風險胃納未見縮減，日本及南韓股市今早破頂。

地緣政治震盪：委內瑞拉與伊朗

市場最關注的是南美洲局勢劇變。美國對委內瑞拉發動空襲，並成功擒獲總統馬杜羅及其妻子。美國總統特朗普表示，美國將接管委內瑞拉，直至權力實現和平移交。此重大地緣政治事件預計將加劇市場對能源供應及新興市場穩定性的關注。

另一方面，伊朗因通貨膨脹及貨幣嚴重貶值，爆發大規模示威衝突，當地貨幣一度創下歷史新低。中東局勢不穩，同樣可能影響全球投資者情緒。

亞太股市強勢未改　日韓股市今早破頂

儘管地緣風險升溫，亞太區股市的風險胃納未見明顯縮減。日本東證指數及南韓首爾綜合指數今早雙雙破頂，反映區內資金氣氛仍然偏向樂觀，追逐風險資產的意願強烈。

內地消費數據偏軟　關注A股及北水復市表現

內地方面，數據顯示元旦假期期間，國內遊客人均消費較疫情前的2019年同期下跌2.4%，反映消費復甦力度仍需觀察。投資者需密切關注今日復市的內地股市表現，以及「北水」（港股通資金）在假期結束後的流向，這將對港股後市構成關鍵影響。

綜合來看，港股雖受外圍地緣政治不明朗因素困擾，但在亞太股市氣氛偏強及預期資金回流下，短期走勢仍存支持，後市需緊盯委內瑞拉事態發展及內地市場動向。"
695b0e6ec26d920e3667ca42,港股高開22點 恒指報26361點,2026-01-05 09:23,2026-01-05 09:30,finance,tvb,https://news.tvb.com/tc/finance/695b0e6ec26d920e3667ca42,"港股高開22點，恒生指數報26,361點。

快手升百分之5.8，創科實業升百分之2.7，中海油跌百分之2.6。"
695a9bedc26d920e366454af,報章要聞｜東方：研究揭阿士匹靈效用受制於腸道菌微生態／明報：促銷電話兩年增22萬,2026-01-05 08:28,2026-01-05 09:00,local,tvb,https://news.tvb.com/tc/local/695a9bedc26d920e366454af,"東方日報報道︰中大醫學院就阿士匹靈的最新研究發現，腸道細菌微生態可影響阿士匹靈的成效。中大內科及藥物治療學講座教授陳家亮昨日表示，稍後會發布詳情。

他同時指出，不少人以為服用阿士匹靈會傷胃，醫生會向病人處方有保護膜的阿士匹靈，以減少胃部出血風險，但研究揭示這是絕對錯誤，由於有關藥物要到小腸才釋出藥劑，可增加小腸出血風險。

明報報道︰促銷電話不絕，根據非應邀來電回報網站HKJunkcall數據，用戶2025年回報46.6萬宗促銷電話，按年增逾五成，比2023年更增百分之93。

財務借貸及銀行投資促銷成為增長「火車頭」，兩年間增近16萬宗，增幅八成九；地產推銷和體檢促銷，分別增加1倍和10倍。HKJunkcall創辦人胡文翰估計回報量大增，可能與用戶更積極舉報有關。"
695afeb7c26d920e3667467f,小米汽車今年交付目標為55萬輛 較往年增長逾三成,2026-01-05 08:15,2026-01-05 09:00,finance,tvb,https://news.tvb.com/tc/finance/695afeb7c26d920e3667467f,"小米汽車今年的交付目標是55萬輛車，即比往年增長超過三成。

小米集團創辦人兼董事長雷軍日前直播，拆解小米旗下第二款推出的電動車YU7。期間他透露集團去年電動車交付量達到41萬輛，超出最初定下的30萬輛目標；今年的交付目標是55萬輛，並希望能再次超越目標。

他又回應公司被批評「小字營銷」、即用小字標示註釋，公司往後會改掉這行業陋習，盡可能把「小字變大字」。"
695a9bdec26d920e366453ca,報章要聞｜大公：「FV」牌內地車疑違規裝閃燈／星島：增兩留宿中心應對虐兒舉報,2026-01-05 07:58,2026-01-05 08:15,local,tvb,https://news.tvb.com/tc/local/695a9bdec26d920e366453ca,"大公報報道︰網上流傳片段顯示，一輛掛有內地車牌和英文字母「FV」開頭香港車牌的私家車在香港行駛期間，疑違規在車頂安裝紅色閃燈，且未有在擋風玻璃的左面展示「國際通行許可證」。

運輸署表示，涉事車輛為持有粵港常規配額的內地私家車，已將個案轉介予執法部門跟進，亦已要求涉事車輛驗車。若許可證持有人未能提供合理的回覆，運輸署會考慮以有關車輛違反許可證條件，而撤銷其許可證。

星島日報報道︰《強制舉報虐待兒童條例》將於本月20日生效，指明三大界別的25類專業人員在工作中如有合理懷疑兒童受虐，必須盡快舉報。

勞工及福利局副局長何啟明表示，社會福利署已新增兩個留宿中心，以應對可能增加的舉報虐兒個案。署方亦成立4間社區親子中心，透過遊戲促進親子互動，並教育家長正向育兒的方法，預計首年可惠及4萬人。"
695af5b6c26d920e36670048,油價亞洲市低開1% 金價升穿4370美元一盎司,2026-01-05 07:46,2026-01-05 08:00,finance,tvb,https://news.tvb.com/tc/finance/695af5b6c26d920e36670048,"美國突襲委內瑞拉。油價在亞洲市低開百分之1，金價升穿4,370美元一盎司。

紐約期油在亞洲市一度跌穿57美元一桶，倫敦期油跌至61美元水平。

避險情緒升溫，金價上升，現貨金價升穿4,370美元一盎司。分析認為，全球投資者正面臨新一輪的地緣政治風險，並預計會加劇美元作為避險資產不確定性。"
695af5c5c26d920e366700fd,Saks Global陷財困 據報正尋求10億美元貸款,2026-01-05 07:46,2026-01-05 11:45,finance,tvb,https://news.tvb.com/tc/finance/695af5c5c26d920e366700fd,"據報正陷入財困的美國奢侈品百貨集團Saks Global，正尋求10億美元貸款。

Saks Global旗下的Saks Fifth Avenue已有158年歷史，但公司一筆逾億美元的債券利息在上月底到期未付，公司正與債權人商討債務重組方案。

《彭博》報道，有債權人要求公司最少尋找7.5億美元新資金，而集團正尋求最多10億美元貸款，以維持業務能繼續運作。"
695aed94c26d920e3666c05d,元旦假期內地出遊1.42億人次 內地出遊總花費逾847億元,2026-01-05 07:16,2026-01-05 07:30,finance,tvb,https://news.tvb.com/tc/finance/695aed94c26d920e3666c05d,"元旦假期內地出遊1.42億人次，內地出遊總花費逾847億元。

據文化和旅遊部公佈元旦三日假期，內地出遊1.42億人次，出遊總花費847.89億元，指出假期各地文旅活動豐富，居民出遊意願增強，助推歲末年初市場持續升溫。平台數據顯示，消費者出遊意願與消費力均提升，人均購買數量按年增長逾兩成，人均消費額按年增長逾三成。

《路透》根據文旅部數據計算，內地元旦假期，內地遊客人均消費支出597.1元人民幣，較2024年元旦假期，增長百分之1.1。但與疫情前的元旦相比，仍然下跌約百分之2.4。"
695a9bc3c26d920e36645251,社評｜經濟：美霸凌震懾鄰邦／明報：以色列重塑紅海戰略版圖,2026-01-05 06:58,2026-01-05 07:15,local,tvb,https://news.tvb.com/tc/local/695a9bc3c26d920e36645251,"經濟日報社評︰美國違反國際法，軍事入侵委內瑞拉捉拿其總統，標誌其政策正依新版國安戰略激進轉向「新門羅主義」，強制控制拉美「後花園」。這不是個別事件，中國在拉美的利益與合作將受嚴峻考驗，部署需更具靈活韌性。

中國應持續聯合國際社會，在聯合國等多邊場合抵制單邊主義與霸權行徑，佔據國際道義制高點。並支持拉美區域一體化和戰略自主，以集體機制減輕個別國家各自壓力，分散風險。
　　
明報社評︰中東地緣政治局勢再起波瀾。以色列早前突然宣布，承認東非國家索馬里的分離地區索馬里蘭為「獨立國家」，以色列成為全球唯一承認所謂「索馬里蘭國」的聯合國成員國。總理內塔尼亞胡聲稱，這「符合」美國總統特朗普所倡議的《亞伯拉罕協議》精神，然而以方真正意圖備受揣測。

索馬里蘭毗鄰紅海，位置具戰略性，事態除了加劇中東地緣政治角力，承認索馬里蘭亦可能引發骨牌效應，鼓勵其他分離勢力，加劇地區不穩。"
695ae799c26d920e36668f60,海南自貿港藥械「零關稅」政策一年減免稅款逾6000萬元人民幣,2026-01-05 06:47,2026-01-05 07:00,finance,tvb,https://news.tvb.com/tc/finance/695ae799c26d920e36668f60,"海南自貿港藥械「零關稅」政策，一年減免稅款逾6,000萬元人民幣 。

據海口海關發布數據，海南自貿港藥品、醫療器械「零關稅」政策平穩運行一周年。截至去年底，累計進口「零關稅」藥械貨值約4.6億元人民幣，減免稅款約6,200萬元。

海口海關相關負責人表示，將繼續優化監管服務，引導企業用好用足政策，進一步推動藥械「零關稅」政策釋放。"
695ae783c26d920e36668e92,市場本周注視美國多項與就業相關數據及內地消費物價表現,2026-01-05 06:46,2026-01-05 07:15,finance,tvb,https://news.tvb.com/tc/finance/695ae783c26d920e36668e92,"市場今個星期注視美國公布多項與就業相關的數據，以及內地消費物價表現。

市場關注今年的利率走勢，美國今個星期會公布多項與就業相關的數據，以判斷美國勞動市場的情況，評估聯邦儲備局會否持續減息。

市場預期，去年12月的非農業就業職位增加5.5萬個，增幅按月減少9,000個。估計失業率由逾四年高位，略為放緩至百分之4.5。估計平均時薪按年及按月比較均錄得升幅，預期按年升幅百分之3.6，按月上升百分之0.3。亦要關注有「小非農」之稱的美國私營企業職位，雖然去年11月數據出乎預期減少3.2萬個，是2023年3月以來最大跌幅。但市場預期上月企業職位扭轉跌勢，增加至5萬個。

其他要關注的數據，包括製造業指數、工廠訂單、商品貿易及消費者信心等。

內地食品價格回升，帶動去年11月的居民消費物價指數升至2024年3月以來的高位。市場預期，上月通脹會維持在百分之0.7，因基數效應及食品價格上漲，令居民消費價格指數維持在高位。

至於反映上游通脹壓力的工業生產者出廠價格指數，市場預期按年下跌百分之2，跌幅較去年11月收窄0.2個百分點。"
695a9c1dc26d920e3664576c,社評｜文匯：提升防火能力保安全／AM730：控煙走向形式主義,2026-01-05 06:28,2026-01-05 06:45,local,tvb,https://news.tvb.com/tc/local/695a9c1dc26d920e3664576c,"文匯報社評︰石硤尾邨昨日發生火警，釀一死八傷。與宏福苑世紀大
火相隔只有一個多月時間，又發生致命火災，反映本港防火須警鐘長鳴。

特區政府專責消防的部門及機構須加強全港公共屋邨、私人樓宇的防火巡查、檢討，加大力度宣傳防火教育、引導市民正確使用防火設施，持續提升防火能力；市民亦應積極參與火警演習，愛護及善用防火設施。政府、市民合力防患未然，更有效保障公眾生命財產安
全。

AM730社評︰政府今年起逐步實施「控煙十式」，旨在減少煙草危害……然而，部分措施的設計與執行流於形式主義，好像持續增加煙草
稅，反助長走私煙猖獗，令青少年更易接觸廉價非法香煙。新措施「完稅標籤制度」，其先導計劃竟選擇在幾乎無「白牌煙」問題的連鎖便利店進行，而真正受私煙衝擊最嚴重的報攤、士多卻被排除在外，反映當局也對政策成效缺乏信心。

此外，擴展指定場所出入口三米範圍為禁煙區，界線模糊不清，容易引發爭執，無助於在香港這樣人口密集的都市建立一種互相體諒的
「負責任吸煙」文化。"
695ae004c26d920e36665719,宇樹科技稱上市工作正常推進 澄清未涉申請「綠色通道」事宜,2026-01-05 06:17,2026-01-05 06:30,finance,tvb,https://news.tvb.com/tc/finance/695ae004c26d920e36665719,"「杭州六小龍」之一的宇樹科技表示上市工作正常推進，澄清未涉及申請「綠色通道」事宜。

宇樹科技表示，近日有媒體發布集團上市相關報道，內容與事實情況不符，澄清沒有申請上市的「綠色通道」，相關報道誤導民眾認知，已嚴重侵害集團合法權益，將保留透過法律手段追責的權利。強調目前上市工作正常推進，相關進展將依法依規進行。

據中國證監會官網訊息，宇樹科技已於去年11月完成IPO上市輔導，並計劃在內地市場首次公開招股，中信證券擔任其上市輔導機構。若宇樹科技成功上市，將成為A股首家人形機器人上市公司，可望帶動機器人全產業鏈發展與升級。"
695adfe9c26d920e36665685,財政部今季將發行43隻國債,2026-01-05 06:17,2026-01-05 06:45,finance,tvb,https://news.tvb.com/tc/finance/695adfe9c26d920e36665685,"中國財政部今季度將發行43隻國債。

財政部發布首季度債券發行安排，當中超長期一般國債發行自本月14日啟動，期限為30年。2月6日及3月6日將分別續發30年期債，3月11日續發50年期債。

所得資金將用於支持重大項目，提升國家安全能力及優化地方債務結構等。"
