id,title,date,scrape_time,section,source,url,news_content
6876091e54d16ed89ec8fa20,港股收市報24590點 升386點,2025-07-15 16:10,2025-07-15 16:30,finance,tvb,https://news.tvb.com/tc/finance/6876091e54d16ed89ec8fa20,"恒生指數收市報24,590點，升386點。

石藥升百分之7.5，阿里巴巴升百分之6.9。"
68760aa454d16ed89ec90b9a,文憑試｜明日放榜 逾1.6萬名日校考生考獲資助大學基本收生要求,2025-07-15 16:00,2025-07-15 16:30,local,tvb,https://news.tvb.com/tc/local/68760aa454d16ed89ec90b9a,"中學文憑試(DSE)明日放榜，逾1.6萬名日校考生考獲八間資助大學基本收生要求。

考評局指，今屆共5.5萬名考生，比去年多一成，其中日校考生4.2萬多人。

百分之38.5名日校考生、即逾1.6萬人，在四個核心科目取得「332A」成績，即在中、英文科考獲至少3級，數學考獲至少2級，及公民和社會科獲達標，並於兩個選修科達至少3級，比去年增加百分之0.1。"
687603b454d16ed89ec8ccd2,35+顛覆政權案｜上訴聆訊繼續,2025-07-15 15:30,2025-07-15 16:00,local,tvb,https://news.tvb.com/tc/local/687603b454d16ed89ec8ccd2,"「35+」串謀顛覆國家政權案，上訴聆訊繼續。

正在服刑的12名上訴人，由囚車押送到西九龍法院。上訴人指《基本法》訂明，《預算案》在立法會被否決時如何處理，立法會基於政治訴求等否決《預算案》，不可能造成顛覆國家政權。

律政司副刑事檢控專員周天行陳詞，反駁上訴方的論點，指《基本法》沒有賦權立法會議員無差別否決《預算案》，並引用《基本法》第73條，指立法會議員有責任要審核《預算案》，刻意拒絕審核是違反職責；而整個計劃真正目的，在於無差別否決《預算案》，來迫使政府回應政治訴求，可見顛覆意圖。"
6876039d54d16ed89ec8cbc4,李家超認同「超前部署」應對極端天氣 稱政府將總結經驗,2025-07-15 15:30,2025-07-15 16:00,local,tvb,https://news.tvb.com/tc/local/6876039d54d16ed89ec8cbc4,"熱帶氣旋「丹娜絲」上周掠過香港，政府提早一日宣布周五停課，最終無出現惡劣天氣。行政長官李家超表示，政府會總結經驗。

熱帶氣旋「丹娜絲」的殘餘，上星期四為香港帶來狂風雷暴，天文台半日內三度發出紅色暴雨警告。政務司司長陳國基領導的「應對極端天氣督導委員會」，當日接近中午宣布，周五所有日校停課。

但到星期五，大部分地區都無雨，惹起部分市民不滿，包括畢業禮被取消的學生和家長。陳國基解釋是根據天文台評估會有豪雨，「寧安全、莫後悔」。

行政長官李家超表示：「針對由政務司司長領導的委員會，應對熱帶氣旋『丹娜絲』，而統籌各部門作『超前部署』，這方面的行動絕對是對的。」

李家超讚揚渠務署、路政署等部門，作出大量預防和準備工作。

李家超說：「我們今次是這樣做，將來我相信也應是這樣做，確保可做很多預防及應對措施。有關委員會對停課決定，我們聽到社會不同意見，我們會總結經驗，以後部署應對極端天氣時，會作通盤考慮。」

另外，對於多個政黨反對政府立法設同性伴侶登記制度，李家超解釋，政府必須履行終審法院裁決。

李家超指出：「這是終審法院的裁決，有法律效力，對政府有約束力。政府不能違反法庭裁決，否則是違反法治。法治是香港經濟、投資者信心，及賴以成功的基石，違反法治後果嚴重。終審法院判決肯定了《基本法》下，所保障的婚姻只限於異性婚姻。根據《基本法》，司法機構依法行使獨立審判權，立法會亦依法行使立法權，兩者各司其職。特區政府尊重司法機關及立法機關依照《基本法》，行使各自權力。」

條例草案明天提交立法會首讀，他指政府全力配合審議工作。"
6876011b54d16ed89ec8bab4,文憑試｜一名超級狀元考獲7科「5**」 10男5女考獲6科「5**」,2025-07-15 15:19,2025-07-15 15:30,local,tvb,https://news.tvb.com/tc/local/6876011b54d16ed89ec8bab4,DSE明天放榜｜一名超級狀元考獲7科「5**」　另有10男5女考獲6科「5**」。
6875fed154d16ed89ec8a64e,證券業人士認為港股短期仍有上升動力,2025-07-15 15:10,2025-07-15 15:30,finance,tvb,https://news.tvb.com/tc/finance/6875fed154d16ed89ec8a64e,"有證券業人士認為，港股短期仍有上升動力。

富昌金融集團聯席董事譚朗蔚指：「最新支持位升至23,900點附近，亦有止蝕位23,400點附近。總之這兩個數完全不觸及，或者觸及後能企穩，升浪是繼續持續的。上方看甚麼，大家明白24,874點。如果各項因素，未浮現太大利淡情況之下，我覺得可以調高目標至26,000點。」"
6875f6ee54d16ed89ec869cb,文憑試．現場｜考評局︰逾1.6萬考生成績達八大基本收生標準 佔38.5%,2025-07-15 14:36,2025-07-15 16:30,local,tvb,https://news.tvb.com/tc/local/6875f6ee54d16ed89ec869cb,中學文憑試(DSE)明天放榜，考評局公布，逾1.6萬名考生成績達八大基本收生標準，比率為百分之38.5。
6875bbfd54d16ed89ec69b5f,Nvidia獲准恢復向華售H20晶片 黃仁勳已抵京網上流傳與雷軍合照,2025-07-15 14:00,2025-07-15 14:45,finance,tvb,https://news.tvb.com/tc/finance/6875bbfd54d16ed89ec69b5f,"美國晶片商Nvidia輝達宣布，美國政府已批准輝達恢復向中國出售旗下專為中國市場設計的H20晶片。行政總裁黃仁勳訪華期間，將與中方討論如何利用人工智能技術擴大產能和商機。

黃仁勳已抵達北京，網上流傳他與小米集團董事長雷軍的合照；亦有兩人與小米電動車SU7 Ultra的合照。

央視新聞報道，黃仁勳應中國貿促會邀請，將於明天出席第三屆中國國際供應鏈促進博覽會的開幕儀式及參與相關活動。

這次是黃仁勳今年第三次訪華。他早前與中國貿促會會長任鴻斌會談時表示，中國是輝達非常重要的市場，希望繼續與中國合作。"
6875e0d454d16ed89ec7c347,國統局︰會以更大力度來推進房地產止跌回穩,2025-07-15 13:16,2025-07-15 14:15,finance,tvb,https://news.tvb.com/tc/finance/6875e0d454d16ed89ec7c347,"國家統計局表示，今年以來各地區各部門依照中央的決策部署與要求，因城施策推動房地產市場企穩，會以更大的力度來推進房地產止跌回穩。

國家統計局副局長盛來運說︰「房地產從總整體上來看，上半年雖然有所波動，但總體上還是朝著止跌回穩的方向在邁進。市場的交易量有所改善，商品房銷售降幅同比收窄。在『白名單』政策，以及房地產市場銷售回暖的帶動下，房地產企業化債的工作也在有序的推進。當然我們也要看到現在房地產銷售面積及銷售金額還都在下降，所以房地產的這個築底需要一個過程，在築底和轉型階段有所起伏波動，也是很正常的。」"
6875df1954d16ed89ec7b094,港股曾升逾300點 太陽能相關股受壓,2025-07-15 13:03,2025-07-15 16:30,finance,tvb,https://news.tvb.com/tc/finance/6875df1954d16ed89ec7b094,"港股一度升逾300點。

大市早段升過350多點，但內地經濟增長數據公布後，獲利沽壓增加，指數曾經掉頭下跌。

太陽能相關股受壓，信義玻璃和信義光能齊跌百分之4。"
6875df0154d16ed89ec7b053,內地第二季經濟增長5.2% 分析相信全年經濟增長達標難度不大,2025-07-15 13:03,2025-07-15 13:45,finance,tvb,https://news.tvb.com/tc/finance/6875df0154d16ed89ec7b053,"內地第二季經濟增長百分之5.2，繼續高於全年目標水平。分析則相信中央有足夠政策空間，全年經濟增長要達標難度不大。

在國際形勢急劇變化，外部壓力明顯加大的情況下，內地第二季國內生產總值雖然較首季放緩0.2個百分點，按年上升百分之5.2，但仍略好過市場預期的百分之5.1。綜合上半年，經濟增長百分之5.3。

社會消費品零售總額六月份上升百分之4.8，增速是四個月來最慢，差過市場預期。工業增長則提速至百分之6.8，是三個月來最高。至於反映基建及房屋等施工量的固定資產投資，首六個月上升百分之2.8，增速較首五個月放緩。

國家統計局指複雜形勢下，上半年取得這樣成績非常不容易，強調下半年經濟增長繼續有政策支撐。

國家統計局副局長盛來運說︰「從上半年，經濟穩中有進的發展態勢和成效，為完成全年目標打下了較好基礎。消費政策還會繼續的加力，宏觀政策協同發力，將為經濟穩定運行保駕護航。中國經濟下半年會繼續保持穩中有進，穩中向好的發展態勢。」

有分析認為，雖然外部壓力仍然大，但中央有足夠的政策空間，相信全年經濟增長要達標難度不大。

花旗投資策略及環球財富策劃部主管廖嘉豪稱︰「現在這刻是否出了很多招？政府是否很多政策出台？都未是、都仍有空間。我們覺得都是觀望，因為始終經濟數據真的不是太差，全年經濟增長百分之5，我們覺得有空間，達標亦都不是太難，有政策可以支持得到。但會否增速得好厲害，這個就未必是一個合理預期。中美出口始終都會有些壓力，有機會減慢經濟增長。」

就業方面，六月全國城鎮調查失業率維持百分之5。上半年失業率百分之5.2，較首季下跌0.1個百分點。"
6875de5f54d16ed89ec7ad3c,菲律賓5.6級地震 本港天文台接獲逾十名市民報告感到輕微震動,2025-07-15 13:00,2025-07-15 13:45,local,tvb,https://news.tvb.com/tc/local/6875de5f54d16ed89ec7ad3c,"菲律賓發生5.6級地震，天文台接獲逾十名市民報告，感受到輕微震動。

震央位於呂宋島，距離香港東南偏東約820公里，上午十時半左右發生5.6級地震，震源深度約10公里。

天文台表示接獲逾十名市民報告，表示感到輕微震感，震動維持數秒。初步分析顯示，香港的地震烈度為修訂麥加利地震烈度表的第二度、即在樓宇上層或合適位置，在靜止中的人有感。"
6875d84e54d16ed89ec77981,消委會發現部分兒童雨衣及雨披繩索及拉帶設計不符合歐洲標準,2025-07-15 12:30,2025-07-15 13:00,local,tvb,https://news.tvb.com/tc/local/6875d84e54d16ed89ec77981,"消委會測試兒童雨衣及雨披，發現部分繩索及拉帶設計，不符合歐洲標準，亦有樣本塑化劑含量超出上限。

測試的14個樣本，適用於三至七歲的兒童。

有3款繩索及拉帶設計長度超出歐洲標準，兒童可能有遭勒頸風險，消委會建議生產商改善。

另外有兩款鄰苯二甲酸酯類塑化劑含量超出歐盟標準，若皮膚上有傷口或濕疹或塗有防曬劑及油溶性潤膚產品，均會增加吸收塑化劑的風險。

其中一款同時檢測出總鉛含量超出美國規定上限。若含鉛的部件破碎、幼童不小心吞下，有潛在健康風險。"
6875d82a54d16ed89ec778e8,規管網約車｜政府下午向立會提交立法框架 暫未定網約車數目,2025-07-15 12:30,2025-07-15 13:00,local,tvb,https://news.tvb.com/tc/local/6875d82a54d16ed89ec778e8,"行政長官李家超宣布，政府下午會向立法會提交規管網約車的立法框架。他表示有七個原則架，包括要規管司機駕駛資格，亦要為的士預留營運空間，暫時未定網約車數目。

網約車2014年開始在香港出現，為點對點交通服務提供多一個選擇，但同時帶來安全及監管等問題，亦引起的士業界不滿。

行政長官李家超說︰「由於問題複雜，涉及的因素廣泛，多個角色及多方面利益，11年來都未有制訂監管方案。我同意問題複雜，但認為問題不應再拖，政府必須拿出解決方法。」

李家超表示，他要求按七項原則制訂框架，包括網約車平台營運標準及責任、說明營運要求、訂明車輛規管及司機駕駛資格要求、確保質素及安全。同時要制訂保險要求，確保乘客安全及利益。另外要為的士服務制訂網約營運環境，營造網約車及的士共存環境。

李家超稱︰「我們除了提供市民優質、方便的點對點交通服務外，亦應該營造有利的士營業的新空間。有關我們應該容許網約車的數量多少，我們做了立法框架後，再聚焦處理這方面的問題。我會建議，首先見有共識的事先處理，我們行第一個大步，接下來技術小步。我們聚焦處理，亦多聽意見、多作研究。」

他希望立法會交通事務委員會充分討論建議，政府再細心研究，盡快提交立法草案。"
6875d1e554d16ed89ec74a88,今年上半年消委會接約千三宗與電訊服務相關投訴,2025-07-15 12:16,2025-07-15 12:30,local,tvb,https://news.tvb.com/tc/local/6875d1e554d16ed89ec74a88,"消委會過去兩年，平均每年接獲逾三千宗與電訊服務相關的投訴，今年上半年亦有約一千三百宗。

其中一宗投訴，電訊商門市職員向八十多歲的長者銷售長達67個月的合約，涵蓋副卡號、漫遊數據等。投訴人質疑員工明知長者推銷無需要的服務。

另有投訴指，家居寬頻服務合約到期時未如以往接獲來電邀請續約，查詢後才知道已按合約自動續約。公司指曾發出續約通知書列明不同意續約的通知期限，最終同意終止合約。

消委會提醒業界加強員工培訓，按消費者實際需要提供合適計劃，加強服務質素及技術支援，並設立合理退款安排。"
6875a99e54d16ed89ec6124f,港股中午收市報24250點 升47點,2025-07-15 12:00,2025-07-15 12:30,finance,tvb,https://news.tvb.com/tc/finance/6875a99e54d16ed89ec6124f,"恒生指數中午收報24,250點，上升47點。

石藥集團升百分之3.8，創科實業升百分之3，信義光能跌百分之4.9。"
6875cf4854d16ed89ec73672,日本10年期國債孳息率升至2008年以來最高水平,2025-07-15 11:47,2025-07-15 12:00,finance,tvb,https://news.tvb.com/tc/finance/6875cf4854d16ed89ec73672,"日本10年期國債孳息率，升至2008年以來最高水平。

在亞洲時段早段，日本10年期國債孳息率逼近1.6厘，連升第三個交易日。

市場關注周日的日本參議院選舉，執政自民黨提出發放現金；反對黨則計劃減稅，都增加日本政府的財政壓力。

另外，日本央行前首席經濟學家早川英男認為，國內通脹強勁，預計央行將上調通脹預測；又指如果關稅不確定性減退，央行可能最快十月加息。"
