id,title,date,scrape_time,section,source,url,news_content
68770fc154d16ed89ed11e3c,人民幣中間價見一周低位,2025-07-16 11:15,2025-07-16 11:45,finance,tvb,https://news.tvb.com/tc/finance/68770fc154d16ed89ed11e3c,"人民幣中間價連跌三天，並見一周低位。

官方開出的人民幣中間價報7.1526兌一美元，較上個交易日下調28點子，是自七月九日以來的低位。現貨人民幣方面，在岸價早段於7.17上落，離岸價於7.18徘徊。

另外，人民銀行進行5,201億元人民幣七天期逆回購操作。扣除今天到期的逆回購，單日在市場淨投放4,446億元人民幣。"
687717f954d16ed89ed15cfe,林順潮倡「合作查驗、一次放行」推展到其他口岸實施,2025-07-16 11:01,2025-07-16 11:30,local,tvb,https://news.tvb.com/tc/local/687717f954d16ed89ed15cfe,"新皇崗口岸最快明年啟用，將實施「合作查驗、一次放行」。有立法會議員建議，將這種通關模式推展到其他口岸實施，包括蓮塘/香園圍口岸。

選舉委員會界別議員林順潮稱︰「蓮塘最初設計是三萬人，平日已至7.8萬人，假日就有9.1萬人次，人流很多，那個口岸就現有設施優化。但從整體檢查制度實施『兩地一檢』或『一地兩檢』，『兩地一檢』僅需透過智能化及制度上互通，很希望不要等到皇崗那邊可以實施才考慮現有的口岸，現有口岸很需要。想像一下過關需半小時，但縮短至五分鐘，節省出來的時間產生多少經濟效益。」"
6877153a54d16ed89ed146ff,謝偉俊︰倡設同性伴侶登記非衝擊一夫一妻制 政府有責任履行終院裁決,2025-07-16 11:01,2025-07-16 11:30,local,tvb,https://news.tvb.com/tc/local/6877153a54d16ed89ed146ff,"《同性伴侶關係登記條例草案》今日提交立法會首讀，早前多個政黨表明反對。立法會議員謝偉俊認為，政府建議設立的制度並不衝擊一夫一妻制，政府有責任履行終審法院的裁決。

選舉委員會界別謝偉俊指出︰「終審法院有判決，一旦做不到，甚或做了或通過方案，未必滿足終審法院要求。過往處理酷刑聲請案件，政府某些東西或不做部分，終審法院也指做不夠、要再做，始終我們也要再改，這是一個過程。希望今次做了後終審法院知道難度，不要過分要求政府、立法會走太大步，但連這半步也不做，恐怕是很明顯地不尊重我們的法治。(若不通過)或涉及政府要提出新方案，又要向法庭申請，有機會予我們重新包裝、游說，或換屆後是下屆政府的事。但總不能避免這議題，未來數年也是爭議性議題。」"
68770f9154d16ed89ed11cc3,港大生涉用AI製不雅照 蔡若蓮冀大學加強價值觀教育上多做工夫,2025-07-16 11:00,2025-07-16 11:30,local,tvb,https://news.tvb.com/tc/local/68770f9154d16ed89ed11cc3,"港大法律系一名男學生懷疑利用人工智能軟件，未經同意下將多名同學的近照製作成數百張不雅相片。教育局局長蔡若蓮回應稱，希望大學在加強價值觀教育上，多做工夫。

教育局局長蔡若蓮說︰「這是個別事件。現在人工智能發展非常急促，我們希望大學在加強價值觀、品格教育方面做更多工夫。我相信香港大學會很好處理，如何把握機會，讓同學明白到作為大學生如何符合社會期望，將來也是社會支柱，相信港大會留意到社會對於大學的期望。事實上在處理學生行為或課程教學方面，都應該是大學向社會問責的範疇。」"
68770fa554d16ed89ed11d58,規管網約車｜陳美寶︰將設入場門檻 確保服務質素,2025-07-16 10:44,2025-07-16 11:15,local,tvb,https://news.tvb.com/tc/local/68770fa554d16ed89ed11d58,"政府就規管網約車制定立法框架。運輸及物流局局長陳美寶表示，局方爭取在今年第三季向立法會提交主體法例，以及今個立法年度內通過。她又表示，雖然當局建議不會限制網約車平台的數量，但會設立入場門檻，以確保服務質素。

運輸及物流局局長陳美寶說︰「太多的平台，我們會擔心市民會花多眼亂。我們都會設立入場的門檻有基本的要求，在營運上需具有一定的經驗；有一定規模和資本投入，營運的規模、持續性的財力如何支撐，這些都是基本要求。營運方面會看看他們在本地、海外或內地都有營運經驗，我們會作為參考和考慮指標。我都看到在海外的經驗，當網約車的供應沒有設限，亦都出現惡性競爭和『內捲』的情況，有些甚至會出現割喉式減價，這些時候政府要考量是否需要保留權力，價格如果太低或太高，就會影響行業的良性競爭。」"
6877030a54d16ed89ed0b94f,立法會直播室｜謝偉俊︰通過同性伴侶關係登記條例草案彰顯法治,2025-07-16 10:30,2025-07-16 11:00,local,tvb,https://news.tvb.com/tc/local/6877030a54d16ed89ed0b94f,
68770ecf54d16ed89ed11331,男童上周六紅磡被人推落海 據悉警方拘捕23歲本地男子,2025-07-16 10:29,2025-07-16 10:45,local,tvb,https://news.tvb.com/tc/local/68770ecf54d16ed89ed11331,一名男童上周六在紅磡海心公園碼頭被人推落海。據了解，警方拘捕一名23歲本地男子，初步懷疑他精神狀態有異。
68770b5b54d16ed89ed0f6fd,文憑試放榜｜共誕生16位狀元,2025-07-16 10:10,2025-07-16 11:00,local,tvb,https://news.tvb.com/tc/local/68770b5b54d16ed89ed0f6fd,"今屆中學文憑試共誕生16位狀元。

成績最好的一位男學生來自東區的香港中國婦女會中學。他考獲7科5**，連同數學延伸部分同樣考獲5**，成為「終極狀元」。他希望日後成為一名醫生。

至於「超級狀元」、即考獲6科5**，連同數學延伸部分都考獲5**，一人來自保良局董玉娣中學。九龍塘喇沙書院、上水香港道教聯合會鄧顯紀念中學、華英中學、皇仁書院及英皇書院等亦各有一人。其中大埔迦密柏雨中學首次有「超級狀元」。

至於香港真光中學，以及民生書院各有一人考獲6科5**。"
6877021054d16ed89ed0b3fe,立法會直播室｜林順潮倡羅湖口岸延長通關 應付大型演唱會過境觀眾需要,2025-07-16 10:00,2025-07-16 10:30,local,tvb,https://news.tvb.com/tc/local/6877021054d16ed89ed0b3fe,隨着啟德體育園啟用，多場大型演唱會在香港舉行，旅客散場後過境擠塞的情況引來關注。在今日的立法會大會上，議員林順潮提出口頭質詢關注有關問題。
687704d654d16ed89ed0c9e6,文憑試放榜｜逾1.8萬名日校考生成績達資助大學基本收生要求,2025-07-16 09:40,2025-07-16 10:15,local,tvb,https://news.tvb.com/tc/local/687704d654d16ed89ed0c9e6,"今屆中學文憑試，逾1.8萬名日校考生成績，達八間資助大學基本收生要求，較去年多660人。

早上有學生陸續回到學校領取成績單。教育局局長蔡若蓮到大埔一間中學為考生打氣。

今年共有近5.4萬人應考文憑試，按年升近一成，當中18,298名學校考生考獲「332A22」、達到八大收生入學門檻。八大資助學士學位學額維持1.5萬個，約1.41人爭一個學額，競爭較去年微升。

蔡若蓮表示學生仍有多元出路，可作為升學的選擇。

教育局局長蔡若蓮說︰「今年讓同學的多元選擇上其實多了很多出路，去年已經多了兩間應用科學大學。另外，在八大每年都有1.5萬個學士學額不變；另外加上自資大學、界別提供7,000多個課程，同時也有三萬多個副學位、高級文憑，其實是很多元出路讓同學選擇。所以我鼓勵大家，不要逼在同一條路，最重要因應自己能力和興趣。」"
6876f8bc54d16ed89ed06774,港股高開113點 恒指報24704點,2025-07-16 09:24,2025-07-16 10:00,finance,tvb,https://news.tvb.com/tc/finance/6876f8bc54d16ed89ed06774,"港股高開113點，恒生指數報24,704點。

百度升百分之4.5，騰訊音樂升百分之2，蔚來及中芯國際偏軟。"
6876fa5a54d16ed89ed07b22,現場｜蔡若蓮︰極端天氣停課以保障學生福祉為首要考慮,2025-07-16 09:01,2025-07-16 09:30,local,tvb,https://news.tvb.com/tc/local/6876fa5a54d16ed89ed07b22,
6876f43c54d16ed89ed043f2,報章要聞｜大公：「留學港」再增動力／東方：慢性病延緩計劃參與者有改善,2025-07-16 08:24,2025-07-16 09:00,local,tvb,https://news.tvb.com/tc/local/6876f43c54d16ed89ed043f2,"大公報報道：英國高等教育調查機構QS昨天發布2026年最佳留學城市排名，在全球150個城市和行政區中，香港重返世界前20強，排名第17。

QS表示，香港憑藉其卓越的大學、強大的就業市場和充滿活力的文化氛圍，吸引來自世界各地的學生。這項成就標誌著香港作為國際學生熱門留學目的地的地位，再次獲得世界肯定。

東方日報報道：中大在2022年推出健康計劃，協助中年人建立健康生活方式，預防及延緩慢性疾病。該計劃招募了8,000名35歲至59歲慢性病高風險人士參與。

經過6個月專業健康管理後，逾半血壓、血脂偏高人士回復正常水平，近半糖尿病前期患者血糖改善，部分參加者每日更減少近一小時久坐時間，反映「生活方式醫學」成效顯著。"
6876f0f454d16ed89ed02708,國家財政部今日在澳門發行60億元人民幣國債,2025-07-16 08:23,2025-07-16 08:45,finance,tvb,https://news.tvb.com/tc/finance/6876f0f454d16ed89ed02708,"國家財政部今日在澳門發行60億元人民幣國債。

今次是中央政府連續第四年在澳門發行的人民幣國債，亦是香港、澳門債券市場基礎設施聯通後的首筆澳門人民幣國債。

業內人士認為，中央在澳門發行人民幣國債規模創歷史新高，發行期限結構進一步優化，有利於完善發行機制，對支持澳門債券市場基礎設施建設、提高國際市場吸引力具積極意義，彰顯中央對澳門加快培育債券市場，推動經濟適度多元的持續支持。"
6876f0e554d16ed89ed026ba,金力永磁半年純利將按年增最高1.8倍,2025-07-16 08:21,2025-07-16 08:45,finance,tvb,https://news.tvb.com/tc/finance/6876f0e554d16ed89ed026ba,"金力永磁預期截至六月底止半年純利將按年增長最高1.8倍，介乎3億至3.35億元人民幣。扣除非經常性損益後純利最多增長6.79倍，至2.65億元人民幣。

收入預期約35億元人民幣，增長百分之4至5。"
6876efb854d16ed89ed01e55,一文看清｜本屆文憑試共誕生16名狀元 香港真光中學首次誕生「狀元」,2025-07-16 08:16,2025-07-16 10:15,local,tvb,https://news.tvb.com/tc/local/6876efb854d16ed89ed01e55,"本屆文憑試共誕生16名狀元，分別來自14間中學，香港真光中學首次誕生「狀元」。

香港中國婦女會中學1名男學生考獲7科5**，連同數學延伸部分5**，成為「終極狀元」。

迦密柏雨中學首次有學生考獲6科5**，連同數學延伸部分5**，成為「超級狀元」。

聖保羅男女中學誕生3名狀元，其餘誕生狀元中學包括：皇仁書院、 張祝珊英文中學、英皇書院、喇沙書院、華英中學、拔萃女書院、民生書院、協恩中學、香港道教聯合會鄧顯紀念中學，以及保良局董玉娣中學。"
6876e9a854d16ed89ecff1a2,報章要聞｜星島：勞工團體盼納破欠基金／文匯：工總獻七策,2025-07-16 07:51,2025-07-16 08:45,local,tvb,https://news.tvb.com/tc/local/6876e9a854d16ed89ecff1a2,"星島日報報道：飲食及零售業接連有企業倒閉，不少僱員須申請「破產欠薪保障基金」以獲補償，今年1月至5月，當局已批出1.21億元相關款項。

現行制度下，破欠基金僅涵蓋因僱主清盤或破產而拖欠的薪金、代通知金及遣散費等，不包括強積金供款，需由積金局追討，惟一旦僱主破產或結業，追討困難重重。有勞工團體認為強積金屬於法定權益，建議納入破欠基金範圍；但亦有意見指出，相關做法或加劇部分公司濫用程序將責任轉嫁予政府，變相為企業「包底」。

文匯報報道：香港工業總會昨日公布《香港製造：新型工業化策略》。研究報告提出七大政策倡議，建議政府盡快制定新型工業發展策略，包括聚焦發展高端製造業，確保配備充足的人才與資源，以配合產業發展需求。

該會主席莊子雄指，新型工業已成為香港工業的核心動力，既是香港經濟發展的新引擎，也支撐著包括研發、物流、專業服務在內的生產性服務業。"
6876e99354d16ed89ecff107,康龍化成上半年收入將按年增最多一成六,2025-07-16 07:51,2025-07-16 08:45,finance,tvb,https://news.tvb.com/tc/finance/6876e99354d16ed89ecff107,"康龍化成預期截至六月底止上半年收入將按年增長最多一成六，至65億元人民幣。

純利介乎6.79億至7.12億元人民幣，按年倒退三成六至三成九。經調整純利則增長百分之6，至一成一。每股賺0.3858至0.4048元人民幣。"
6876e97654d16ed89ecff016,丘鈦科技售印度丘鈦五成一股權 代價55.3億印度盧比,2025-07-16 07:51,2025-07-16 08:45,finance,tvb,https://news.tvb.com/tc/finance/6876e97654d16ed89ecff016,"丘鈦科技出售印度丘鈦五成一股權，代價55.3億印度盧比、相當於4.61億元人民幣，預期收益95億印度盧比、相當於約7.92億元人民幣，是根據印度丘鈦上半年度未經審核淨虧損，以及股權估值估計。

印度丘鈦主要從事攝像鏡頭模組及指紋識別模組設計、研發，製造及銷售。"
6876e95754d16ed89ecfef77,趣致集團配股集資近3.2億元,2025-07-16 07:50,2025-07-16 08:45,finance,tvb,https://news.tvb.com/tc/finance/6876e95754d16ed89ecfef77,"趣致集團配股集資近3.2億元，每股配售價106.6元，較上日收市價折讓一成七，配售300萬股，佔已擴大發行股本百分之1.13。

集資所得約五成用於境內外業務營運發展，約一成用於研發投入，餘額用於優化資本結構及一般企業用途。"
6876e93254d16ed89ecfee56,領航醫藥生物科技向兩名專業投資者配股集資2808萬元,2025-07-16 07:49,2025-07-16 08:45,finance,tvb,https://news.tvb.com/tc/finance/6876e93254d16ed89ecfee56,"領航醫藥生物科技向兩名專業投資者配股集資2,808萬元。

每股配售價0.312元，較上日收市價折讓兩成，共配售9,000股，佔已擴大發行股本百分之4.4。

集資所得將用作一般營運資金。"
6876e84d54d16ed89ecfe55c,文憑試放榜｜共16位狀元 7科5**「終極狀元」來自香港中國婦女會中學,2025-07-16 07:45,2025-07-16 08:30,local,tvb,https://news.tvb.com/tc/local/6876e84d54d16ed89ecfe55c,"中學文憑試放榜，今年共誕生16位狀元。

在大埔一間中學，學生早上回校，領取成績單。今年文憑試合共誕生16名狀元，來自14間學校，「終極狀元」來自香港中國婦女會中學，考獲七科5**，並在數學延伸部分同樣考獲5**。

至於大埔迦密柏雨中學，以及香港真光中學，分別首次誕生「超級狀元」，考獲6科5**，數學延伸部分同樣考獲5**。

其餘誕生狀元的學校，包括上水香港道教聯合會鄧顯紀念中學，屯門保良局董玉娣中學，以及傳統名校喇沙書院、皇仁書院、華英中學、拔萃女書院、聖保羅男女中學等。"
6876e21054d16ed89ecfb5f6,內地企業用AI提升效率 有科企與港投公司簽協議擴大在港研發投入等,2025-07-16 07:19,2025-07-16 08:45,local,tvb,https://news.tvb.com/tc/local/6876e21054d16ed89ecfb5f6,"人工智能(AI)產業在內地加速發展，不少企業應用人工智能大模型，提升製造效率或改進產品性能。

工業生產流程不少環節已機械化，這間深圳科企研發用人工智能，連產品出廠前的品質檢驗都可做快些。例如產品外殼哪裡有瑕疵，多角度。精細如電路板等部件，也難不到它。

他們亦研發出機械臂系統識別語音等指令，並夾起合適的物品。

這間在香港科學園孵化的科企，總部設在深圳前海，去年與香港政府成立的香港投資管理公司，簽訂戰略合作協議，包括擴大在港的研發投入及人才培訓。公司指將持續善用香港優勢，增強對外合作交流。

思謀科技聯合創始人呂江波說：「由於這些高校都是做最頂尖的研究，我們團隊也是在這樣的一個過程中，對接到最新的技術和資訊。香港那邊更多的在做一些科技源頭，包括AI大模型的一些創新。深圳這一端，我們就做它的產品化、技術化、工程化。」

面對美國關稅政策不斷改變，部分措施針對中國高新行業，科企就指已提前做好準備。

呂江波指：「其實在包含信息安全性、數據安全性，還有供應鏈安全這方面的一些考量，所以我們公司內部有專業的團隊，在作這樣的風險評估等級。在供應鏈方面的一些安全性，其實我們在很早以前，也做了各式各樣的儲備，包括一些同類平替，可替代事情的準備。」

思謀目標在短期內，繼續招募來自各國的科技人才，亦會繼續跟香港政府討論，日後在北部都會區的發展。

另外，有科企將人工智能融入駕駛技術。

總部位於深圳的元戎啓行，研發出一套融合駕駛者視覺，語言及動作的模型，可以理解複雜路況，並根據語音指令作出駕駛反應，已開始與多間車企合作，預計年內將有逾20萬架，應用相關技術的車輛投入市場。"
6876e1cf54d16ed89ecfb3e3,AMD指很快可向中國出口AI晶片 刺激公司股價急升逾6%,2025-07-16 07:18,2025-07-16 08:30,finance,tvb,https://news.tvb.com/tc/finance/6876e1cf54d16ed89ecfb3e3,"繼Nvidia輝達宣布，將恢復對中國出口人工智能AI晶片，同業AMD亦表示，很快可向中國出口AI晶片，刺激公司股價急升逾百分之6。

AMD表示，已接獲美國商務部通知，將重新審批出口MI308晶片至中國市場的許可申請，公司在取得出口許可後，會立即啟動出貨。AMD在4月時曾公布，若有關晶片未能出口至中國，將損失最多8億美元。"
6876e1e054d16ed89ecfb458,通用汽車指將把部分燃油SUV生產遷往原定純電動車生產線,2025-07-16 07:18,2025-07-16 08:30,finance,tvb,https://news.tvb.com/tc/finance/6876e1e054d16ed89ecfb458,"美國通用汽車宣布，將把部分燃油SUV的生產，遷往原定只供純電動車的生產線。

公司會把多款皮卡車及SUV車型，遷往位於密歇根州的奧里恩廠房，預計在2027年初開始生產，以滿足強勁的客戶需求。通用汽車原計劃把這間廠房，設定為集團在美國第二間純電動車生產工廠，但因電動車需求不及預期，公司已調整計劃，以更靈活策略滿足市場需求。"
6876e1f354d16ed89ecfb4fe,有美聯儲官員認為考慮減息問題可保持耐性,2025-07-16 07:18,2025-07-16 08:45,finance,tvb,https://news.tvb.com/tc/finance/6876e1f354d16ed89ecfb4fe,"有聯邦儲備局的官員認為，局方在考慮減息問題上可以保持耐性。

波士頓聯儲銀行行長科林斯表示，持續穩健的經濟狀況，令聯儲局有足夠時間仔細評估各項數據，目前採取積極耐心的貨幣政策，仍然是合適的。

她指出，經濟數據表明，關稅的影響可能會因企業降低利潤率，以及消費者在價格上漲的情況下，繼續減少支出。並預計就業增長將面臨壓力，認為在目前不確定較高的環境下，制定貨幣政策具一定挑戰性，擔心關稅在一段時間內，對目前強勁的經濟產生影響。"
6876dbec54d16ed89ecf88aa,社評｜信報：推行寵物友善政策／文匯：中國經濟穩中向好,2025-07-16 06:53,2025-07-16 08:30,local,tvb,https://news.tvb.com/tc/local/6876dbec54d16ed89ecf88aa,"信報社評：要鼓勵市民留港消費，其實可以循一個角度思考，推行寵物友善政策，容許狗主、貓主或其他飼主帶其寵物進入商場和食肆。畢竟他們是留港的中堅分子，不會帶著心愛的寵物出境，但蘊藏的消費力卻被嚴重遏抑，寵物友善政策可釋放潛能。

目前香港至少有十二間商場覷準寵物主人的消費潛力，推行寵物友善政策，弔詭之處乃在於可以逛商場，不准入食肆。商場開放寵物進入，為的正是刺激消費，法例卻依舊將狗隻拒諸食肆門外，邏輯上確有說不通之嫌。

文匯報社評：國家統計局昨日發布上半年的經濟數據，GDP增長百分之五點三，呈現穩中向好的態勢。在外部經濟不確定性持續增加的情況下，內地經濟迎難而上，取得了來之不易的成績。

內地有超過十四億人的超大市場，有能力做大內循環，激活內需保持經濟健康增長，減少對外部市場的依賴。同時以創新技術驅動新產業蓬勃發展，帶動整體經濟向高端方向轉型。內地經濟穩增長動力足、韌性強，高質量發展穩步前行。"
6876dbd854d16ed89ecf883b,有內地商會批外賣平台極端補貼致惡性循環 當局指正制定措施治理內捲,2025-07-16 06:52,2025-07-16 08:00,finance,tvb,https://news.tvb.com/tc/finance/6876dbd854d16ed89ecf883b,"有內地餐飲商會批評，美團及淘寶閃購等極端補貼行為造成惡性循環。國家統計局表明，有關部門正制定措施，規範治理「內捲式」競爭。

內地外賣平台補貼戰不斷，美團、京東及阿里巴巴旗下淘寶閃購，自上周末開始，發起「0元奶茶券」，「滿18.8減18.8」等優惠。

消費者爭相落單，茶飲店做不停手。社交平台湧現大量「零元購」戰利品。不過，就引起餐飲業界強烈抵制。

貴州遵義市紅花崗區餐飲行業商會發布倡議書，批評美團、淘寶閃購近期發起的極端補貼行為，為爭奪外賣市場份額，挑動低於成本價的惡性價格戰，已造成市場經營秩序混亂，行業生態嚴重失衡。

導致大量餐飲企業經營陷入不參與則無流量，參與則破價虧損的惡性循環，更讓大量依賴堂食的實體店，遭遇嚴重衝擊、苦不堪言。呼籲平台停止非理性補貼，回歸價值競爭，保障商家合法權益。

國家統計局指，針對部分行業、企業「內捲式」競爭加劇，有關部門正制定措施，進一步加大市場秩序的規範治理。

國家統計局副局長盛來運說：「相信這些政策和措施，是有利於規範市場秩序，推動市場供求關係改善，促進價格合理回升，也有利於企業利潤改善，活力的增強，進而推動結構調整，和高質量的發展。」

補貼亦造成大量浪費的問題，有內媒引述內地茶飲店商家指，有下單後沒取飲品的情況出現，每日要棄掉幾十杯落單後未有認領的飲品。

據內媒報道，目前美團和阿里巴巴緊盯彼此，補貼衝單量已成為雙方每周的例行工作，以免被對手抓著機會。有報道引述美團中高層表明，「你衝、我就衝，你不衝、我不衝」。

淘寶閃購聯合餓了麼公布，本周一日訂單量再破8,000萬，創歷史新高。美團上周六則指，當天訂單量達到1.5億，刷新中國外賣史單日紀錄。"
6876d59954d16ed89ecf52ce,港鐵東鐵綫事故已妥善處理 班次逐步回復正常,2025-07-16 06:50,2025-07-16 07:00,local,tvb,https://news.tvb.com/tc/local/6876d59954d16ed89ecf52ce,"運輸署接獲港鐵公司通知，較早前東鐵綫的事故已經妥善處理，班次會逐步回復正常。

[早前報導]
運輸署接獲港鐵公司通知，由於上水站附近，有信號設備運作不暢順，東鐵綫由羅湖或落馬洲，往金鐘的車程延長10至15分鐘。"
6876d6c654d16ed89ecf5f2b,河北貧困縣中學得到港澳捐助改善教學環境 學生成績明顯進步,2025-07-16 06:31,2025-07-16 07:30,local,tvb,https://news.tvb.com/tc/local/6876d6c654d16ed89ecf5f2b,"河北有貧困縣的中學，近年得到大量來自港澳的捐助，改善教學環境，學生成績明顯進步。

這間有73年歷史中學，是河北贊皇縣內唯一官辦中學，校園不同角落都見到港人熟悉的名字及企業。

這幢五層高綜合教學樓「勤志樓」，由香港的慈善基金及商人，合共捐出3,600萬港元興建，在2022年啟用。

舊的女生宿舍是二十人一間房，設備簡陋，經港澳企業家捐贈900萬人民幣重建，改為八人房，並且有冷氣及獨立浴室。

這個港資銀行出資興建的課室，配備四十部智能黑板，方便師生互動，實時掌握全班學習進度。

河北贊皇中學教師甄靜雨說：「像數學函數的畫法，像化學模擬實驗的做法，像物理實驗的設置，都是非常有用的。課堂上以智慧黑板為輔助，學生為主，老師進行課堂上跟蹤輔導，都是對我們得到高效的課堂，有非常大幫助。」

贊皇縣曾經是國家級貧困縣，2019年才正式脫貧。學校在過去資源十分短缺，近年由中央港澳辦大力協調下，獲港澳企業及熱心人士捐助，並資助師生到港澳交流，近年學生成績有明顯進步。

甄靜雨表示：「高考成績越來越好，我們高考『上線』總人數，也是逐年增加，當時參加研學活動的學生，在當年高考取得了非常好的成績。」

學校在擴建後，可容納學生人數達3,800多人，較2018年多逾一倍，方便當地學生不需跨縣上學，當局稱每個家庭每年支出可節省10萬人民幣。"
