id,title,date,scrape_time,section,source,url,news_content
68763c8d54d16ed89ecab644,規管網約車｜據悉政府冀車牌數量參考服務人次占比 平台認為設限將增候車時間,2025-07-15 19:33,2025-07-15 20:15,local,tvb,https://news.tvb.com/tc/local/68763c8d54d16ed89ecab644,"運輸及物流局向立法會提交規管網約車立法框架建議。局方文件沒有提及會發多少網約車牌，消息指當局期望參考現時的士跟網約車八二比的服務人次。有網約平台認為，會增加乘客候車時間。

點對點出行，的士外可以合法叫網約車，乘客最關心又是甚麼？

劉先生表示：「一年都是新牌，說不中聽的話，每日接那麼多人，在路上行駛始終不是太安全，而且年齡方面應有限制。」

內地旅客胡先生指出：「對遊客而言，我們出行起了很好作用。價格應是符合老百姓的正常出行的，我們的接受能力。」

有的士業界質疑，網約車司機人數無上限，影響的士吸納年輕人入行。

的士車行車主協會永遠會長吳坤成說：「我們很擔心，因為如此令到大部分年輕人考了網約車牌後，他不會再駕駛的士。希望令的士司機老齡化及缺少收入這方面，可慢慢補充這個不足。」

至於網約車的車輛發牌上限，政府消息人士指，期望參考現時的士跟網約車八二比的服務人次。

工聯會選舉委員會界別議員陸頌雄稱：「需要政府有更精準的市場調查，精準地評估網約車的需要，從而釐定日後網約車的發牌數量，不會導致如某些地方，因網約車而造成過度競爭，令交通擠塞。」

其中一個主要網約車平台Uber，活躍司機用戶就有約30,000人。平台回應指，網約車設上限，增加乘客候車時間，車費亦會上升，同時限制司機的收入。

運輸及物流局指，會考慮及平衡多項因素，包括市民乘車需求、道路網絡承受力、整體個人化點對點交通服務行業健康和可持續發展等。"
687635c454d16ed89eca7b0e,35+顛覆政權案｜律政司指若說議員獲賦予否決權可為所欲為 說法荒謬,2025-07-15 19:04,2025-07-15 19:30,local,tvb,https://news.tvb.com/tc/local/687635c454d16ed89eca7b0e,"「35+」串謀顛覆國家政權案，上訴聆訊繼續。律政司一方指，如果說議員獲賦予否決權，便可以為所欲為，說法是荒謬。

正在服刑的12名上訴人，由囚車押送到西九龍法院。上訴方之前陳詞指，議員的權力是由選民賦予，議員按自己意願行使權力，並非濫權。

律政司副刑事檢控專員周天行陳詞時提到，《基本法》第73條列明立法會議員職權，包括審核《財政預算案》。如果故意不考慮《預算案》內容而作出表決，是違反有關規定。

對於上訴方指，嘗試以爭取普選，可視為否決《預算案》的理由，周天行反駁，這是混淆視聽，指出《基本法》有提及立法會不同的權力及功能，如果說議員獲賦予否決權，就可以為所欲為，這說法是荒謬。

針對上訴方提出，法庭不應干預立法會運作，周天行認為此原則並非絕對，指本案針對違反《憲法》責任，這個原則並不適用。

至於《國安法》第22條，有關「其他非法手段」的詮釋，周天行表示，上訴方認為應限於「使用武力」並不合邏輯，也有違立法目的；「非法手段」不限刑事罪行行為，應是指任何未經法律授權的行為。

法庭之後聽取各上訴方陳詞，其中代表林卓廷及黃碧雲的大律師指，《基本法》沒任何字眼限制如何審核《預算案》，又指《基本法》訂明，香港終須落實普選。

代表何啟明、陳志全的大律師則認為，「顛覆意圖」需要控方另行舉證證明。聆訊周三繼續。"
687635b254d16ed89eca7a37,油麻地住宅發現仿製槍械 警方追緝兩人,2025-07-15 19:04,2025-07-15 20:00,local,tvb,https://news.tvb.com/tc/local/687635b254d16ed89eca7a37,"警方在油麻地一個住宅單位，發現仿製槍械。

現場是文苑街文苑樓，警員檢獲約10支BB彈槍、彈殼、氣樽以及手銬等配件，據了解，一對男女去年十月起租用單位，但去年12月和今年1月欠租。業主和執達吏上門收樓時，在客廳發現有關器具。

案件列為管有仿製槍械和管有違禁武器，追緝一名32歲男子和一名24歲女子。"
687635a054d16ed89eca79ac,元朗院舍命案涉事50歲院友被控謀殺 明日提堂,2025-07-15 19:03,2025-07-15 19:30,local,tvb,https://news.tvb.com/tc/local/687635a054d16ed89eca79ac,"元朗一間院舍發生命案，兩名院友爭執，其中一人暈倒、最終不治，涉事的院友被控謀殺。

事發院舍位於元朗朗和路。警方昨日下午近5時半接報，兩名院友在院舍內爭執和推撞，其中一名54歲男子暈倒，送院搶救後不治。

警方調查後拘捕一名50歲男子，並起訴他一項謀殺罪，明日在屯門裁判法院提堂。"
6876354354d16ed89eca76d3,入境處打擊外賣黑工拘15人 其中八名持「行街紙」租借他人帳號送餐,2025-07-15 19:02,2025-07-15 19:30,local,tvb,https://news.tvb.com/tc/local/6876354354d16ed89eca76d3,"入境處針對外賣平台打擊黑工，拘捕八名持「行街紙」的非法勞工，另外拘捕七人涉嫌出租外賣平台帳戶被捕。

多名涉嫌違法的外賣員，被入境處帶走調查。行動中檢獲多輛外賣用的單車及一批銀行月結單，還有多張俗稱「行街紙」的擔保書。

入境處上月底起，在油尖旺及中西區，打擊外賣黑工，共拘捕15人。其中八名25至55歲非華裔男子，涉嫌利用其他人的外賣平台帳號送餐，分別為土耳其、南非、巴基斯坦、印度及孟加拉籍，全部均持「行街紙」。其中七人早前提出免遣返聲請，但被裁定個案不獲確立。另一人就以旅客身份來港，逾期居留非法工作。

入境處指他們以月租3,000元，向他人租借外賣平台戶口送外賣，每單賺取15至30元，扣除租借帳戶成本，估計每日收入有五、六百元。入境處在行動中，以串謀詐騙罪，拘捕借出帳戶的六男一女，全部是非華裔本港居民。

入境處特遣隊副指揮官梁梓聰說：「雖然外賣平台已加強核實外賣員身份的程序，包括設動態人臉識別、引入多重認證等，但仍有不法之徒被我們發現及拘捕，證明外賣平台仍有改善空間。我們會繼續與外賣平台溝通，要求他們加強核實程序，杜絕非法外賣員使用他人的帳戶。」

入境處提醒市民，將外賣平台帳戶交予非法勞工使用，等同協助及教唆「打黑工」，同樣需面臨刑責。"
6876314654d16ed89eca4e1e,文憑試｜逾1.6萬考生達八大基本收生要求 一位男考生成為「終極狀元」,2025-07-15 18:45,2025-07-15 19:15,local,tvb,https://news.tvb.com/tc/local/6876314654d16ed89eca4e1e,"中學文憑試(DSE)明日放榜，一萬六千多名日校考生考獲八間資助大學基本收生要求。成績最好的一位考生，考獲七科「5**」，在數學延伸部分同樣考獲「5**」。

今屆文憑試考生有5.5萬多人，比去年多大約一成，日校考生有4.2萬多人。

考評局表示，達到八大基本收生要求、即「332A33」成績，包括中、英文考獲3級或以上、數學有2級或以上成績、公民科成績達標，並於兩個選修科達到3級或以上成績的，有逾1.6萬名日校考生，比去年增加百分之0.1，佔比為百分之38.5。

考評局秘書長魏向東說：「達到『332A33』的比例、人數都有增加。對大學收生來說，今年會是大豐收。公民科今年有百分之93及格，比去年輕微下降少少。我們覺得這是新科目，輕微波動是正常範圍。」

翻查資料，去年有逾1.5萬名學生，經大學聯招獲派八大學士課程，換言之，絕大部分成績達標考生可獲大學取錄。

另外，今年有一位男考生取得七科「5**」，並在數學延伸部分考獲「5**」，成為「終極狀元」。另有10人考獲六科「5**」，以及在數學延伸部分取得「5**」。

去年有內地教育機構安排報考文憑試被拒，提出司法覆核。考評局早前更新報考規則，列明修讀非文憑試課程者，要證明學校獲官方認可，開辦高中程度的課程。考評局強調，並非想控制考試人數。

魏向東指出：「我們絕對歡迎多些人來考文憑試，這標誌著我們文憑試的信譽和地位，甚至香港國際教育樞紐的地位。」

今屆文憑試有六名考生作弊，其中五人屬於嚴重作弊，全部科目均被取消資格。考評局呼籲所有考生務必誠實應考，展現應有的能力。"
6876315c54d16ed89eca4f18,第35屆書展明日開鑼 新增文化及創意產品展區,2025-07-15 18:45,2025-07-15 19:15,local,tvb,https://news.tvb.com/tc/local/6876315c54d16ed89eca4f18,"會展明日起一連七日舉行書展。

書展來到第35屆，以「飲食文化‧未來生活」為主題，將舉辦六百多項文化活動。今年新增文化及創意產品展區，展示不同地區具有中華文化特色的文創產品。

成人票價是30元、小童10元，長者免費入場。"
68762e9354d16ed89eca39fd,黃仁勳：美國批准向中國出口H20晶片,2025-07-15 18:33,2025-07-15 19:00,finance,tvb,https://news.tvb.com/tc/finance/68762e9354d16ed89eca39fd,"晶片生產商Nvidia輝達行政總裁黃仁勳表示，美國政府已經批准公司向中國出口人工智能(AI)晶片H20。

輝達行政總裁黃仁勳說：「美國政府已經批准我們H20(晶片)的出口許可，我們將會向中國市場銷售H20，我很期待H20短期內能夠出貨，我對此消息感到非常高興。第二個消息是我們還會發布一款新顯示卡，名為RTX Pro，RTX Pro是非常重要，因為它是為計算機圖形、數碼分身及人工智能而設。」"
68762e8654d16ed89eca3947,安踏體育旗下主要品牌上季及上半年零售額均錄得增長,2025-07-15 18:33,2025-07-15 19:00,finance,tvb,https://news.tvb.com/tc/finance/68762e8654d16ed89eca3947,"安踏體育旗下主要品牌，上季和上半年零售額均錄得增長。

安踏品牌第二季零售額，按年增長低單位數。期內，FILA品牌錄得中單位數增幅。

綜合上半年，安踏品牌零售額，按年上升中單位數，FILA品牌有高單位數增幅。"
68762e5954d16ed89eca3826,泡泡瑪特發盈喜,2025-07-15 18:32,2025-07-15 19:00,finance,tvb,https://news.tvb.com/tc/finance/68762e5954d16ed89eca3826,"泡泡瑪特發盈喜。

預期截至6月底止，上半年溢利按年上升至少3.5倍，期內收入增長不低於2倍。

主要由於泡泡瑪特品牌及旗下IP在全球認可度提升、多樣化產品推動收入增長、海外收入佔比提升，以及優化產品成本，加強費用管控所致。"
68762e1954d16ed89eca32ec,輝達宣布美國批准對華出售H20晶片 據報字節跳動及騰訊計劃訂購,2025-07-15 18:31,2025-07-15 20:00,finance,tvb,https://news.tvb.com/tc/finance/68762e1954d16ed89eca32ec,"美國晶片商Nvidia輝達宣布獲美國政府批准，恢復向中國出售專為中國市場設計的H20晶片。據報多間內地企業，包括字節跳動和騰訊都計劃訂購。

正在北京展開訪華行程的美國晶片商Nvidia輝達行政總裁黃仁勳，周二向傳媒表示，美國批准輝達對華出口H20晶片。

輝達行政總裁黃仁勳說：「我宣布美國政府已批准我們H20(晶片)出口許可，我們將向中國市場銷售H20，我很期待H20能很快發貨，我對這個好消息感到非常高興。」

H20晶片是輝達為遵守美國出口限制而推出，專為中國市場設計，是高端H100晶片的降級版本，不過今年4月，被美國政府限制向中國市場銷售。

路透社引述消息指，多間內地企業，包括字節跳動和騰訊都正申請訂購H20晶片。

對於輝達表示獲美國批准它對華銷售此款晶片，中方重申，反對將科技和經貿問題政治化。

外交部發言人林劍表示：「我要指出的是中方反對將科技和經貿問題政治化、工具化、武器化，對中國進行惡意封鎖和打壓的立場，是一貫的、明確的，這種做法擾亂全球產供鏈的穩定，也不符合任何一方利益。」

這次是黃仁勳今年第三次訪華，網上流傳他與小米集團董事長雷軍的合照，亦有兩人與小米電動車SU7 Ultra的合照。輝達表示，黃仁勳此行將在北京，與中國政府官員和產業代表會面，討論人工智能(AI)如何提高產能和擴大商機。

內地央視新聞報道，黃仁勳在北京接受採訪時，表示中國市場非常大，人工智能在中國發展非常快，並稱美國企業紮根中國市場至關重要。

報道稱，黃仁勳應中國貿促會邀請，將於周三出席第三屆中國國際供應鏈促進博覽會的開幕儀式及參與相關活動。"
68762e0054d16ed89eca31af,本周後期或有熱帶氣旋吹襲本港 李家超稱就應對極端天氣總結經驗,2025-07-15 18:31,2025-07-15 19:15,local,tvb,https://news.tvb.com/tc/local/68762e0054d16ed89eca31af,"熱帶氣旋丹娜絲上周掠過香港，政府提早一日宣布停課，最終無出現惡劣天氣。行政長官李家超表示，政府會總結經驗。

高空反氣旋正覆蓋南海北部，本港持續酷熱，天文台下午最高錄得32.7度。不過要留意位於菲律賓以東的低壓區，逐漸發展為熱帶氣旋，本周後期會移入南海，有機會吹襲香港，帶來狂風雷暴。

天文台科學主任林家輝說：「但它現時未生成，所以路徑及強度都存在變數，生成的位置對它的路徑會有影響，周末至下周初，本港天氣不穩定，風勢都會比較大。」

對於熱帶氣旋丹娜絲上周四掠過香港，帶來大雨，天文台半日內三度發出紅色暴雨警告。政府提前一日宣布周五所有日校停課，引起部分市民不滿。

行政長官李家超被問到，會否再作「超前部署」。

行政長官李家超說：「針對由政務司司長領導的委員會，應對熱帶氣旋丹娜絲，而統籌各部門作『超前部署』，這方面的行動絕對是對的。有關委員會對停課決定，我們聽到社會不同意見，我們會總結經驗，以後部署應對極端天氣時，會作通盤考慮。」

李家超讚揚渠務署、路政署等部門，作出大量預防和準備工作，將來亦應該這樣做。"
68762dca54d16ed89eca2f10,規管網約車｜平台、司機及車輛均須領牌 政府擬向每程車徵費支援的士業界,2025-07-15 18:30,2025-07-15 19:00,local,tvb,https://news.tvb.com/tc/local/68762dca54d16ed89eca2f10,"運輸及物流局向立法會提交規管網約車立法框架建議，營運平台、司機及車輛都要領取營運許可證。行政長官李家超表示，要為的士預留營運空間，營造共存環境。

網約車平台2014年開始在香港運作，為點對點交通服務提供多一個選擇，但同時引起的士業界不滿，要求規管。

行政長官李家超說：「我同意問題複雜，但認為問題不應再拖，政府必須拿出解決方法。」

政府建議，網約平台、車輛和司機都要領取牌照。營運網約平台的公司必須在香港註冊，政府發牌會考慮營運經驗、資本投入、財力證明等，亦規定要設投訴機制及司機評分系統。

平台可因應市場情況自訂車費，必須在行程前通知乘客。政府考慮向平台每程車徵費，用以支援的士業提升服務。平台亦需按旗下車輛數目繳付平台牌費，牌照有效期為五年、不得轉讓。

至於網約車司機，數目不設上限，必須年滿21歲、持私家車駕照執照至少一年，申請牌照前五年內，無嚴重交通定罪紀錄，並須通過指定考核，許可證有效期五年。持證後可向多於一個平台註冊接收訂單。

而營運的車輛，就未定發牌上限，須以個人名義登記，車齡要七年以下，並須每年驗車、購買商用車第三者保險。許可證有效期一年，可以續牌、最多五年，不得轉讓。

換言之，合法駕駛網約車要增加成本，每年汽車牌費以外，額外支付新的司機牌、網約車牌，這兩個收費都未定。另外，亦要每年付款驗車和過萬元的商用車保險。

當局指，營運平台必須確保旗下車輛及司機持有合法牌證，否則可判罰款及監禁，甚至可暫停或取消平台牌照。

行政長官李家超表示：「我會建議，首先將有共識的事先處理，我們行第一個大步，接下來技術小步，我們聚焦處理，亦多聽意見，多作研究。」

政府又稱，目標今年第三季向立法會提交主體法例修訂，並爭取在今個立法年度內完成審議程序，期望可盡早落實。"
6876252554d16ed89ec9ebdd,時事通識｜《全球財富和高端生活報告》,2025-07-15 18:26,2025-07-15 18:30,local,tvb,https://news.tvb.com/tc/local/6876252554d16ed89ec9ebdd,"財富管理集團瑞士寶盛最新發表的《全球財富和高端生活報告》顯示，新加坡連續三年都是全球生活成本最高的城市。香港由第二變為第三位，被倫敦超前。

報告是反映高淨值人士的消費方式，調查全球25個大城市高端商品和服務價格的變動。調查涵蓋11種商品和9種服務的價格，商品包括住宅物業、汽車、珠寶、手袋和服裝等；而服務就包括飛機商務客位、酒店套房、高級晚餐、醫療保健和律師服務等。

調查在去年11月至今年3月進行，期間亦有訪問360位家庭資產超過100萬美元的高淨值人士。

計算加權平均數後，香港在全球生活成本雖然排第三，仍然是生活成本最高的成市之一，當中律師費用是全球最高，汽車和住宅物業價格都在全球排第二，高級晚餐就排第三。

報告又指，香港一些高端服務的價格有下跌，其中跌幅最大是酒店套房，達百分之26。

<a href=""https://news.tvb.com/tc/programme/behindtheheadlines"" target=""_blank"" rel="""">點擊重溫其他集數</a>"
6876239554d16ed89ec9e068,港股走勢「過山車」收市升近400點 見近四個月高位,2025-07-15 17:46,2025-07-15 19:00,finance,tvb,https://news.tvb.com/tc/finance/6876239554d16ed89ec9e068,"港股走勢「過山車」，收市升近400點，見近四個月高位。

內地公布經濟數據前，港股率先炒上超過300點。不過，上季經濟增長好過預期，大市反而藉勢獲利，指數一度要倒跌。午

市在科技股帶動下，重拾上升動力。以全日高位24,590點收市，上升386點，成交增加至2,884億元。

富昌金融集團聯席董事譚朗蔚說：「最新支持位升至23,900點附近，亦有止蝕位、23,400點附近。總之這兩個數完全不觸及，或者觸及後能企穩，升浪是繼續持續的。上方看甚麼，大家明白24,874點。如果各項因素未浮現太大利淡情況之下，我覺得可以調高目標至26,000點。」

科網股是升市火車頭，阿里巴巴上升近百分之7。騰訊和美團，升幅百分之3至4。

醫藥股有支持，石藥上升百分之7，是升幅最大藍籌。獲大行調高目標價的恒生，見逾一年高位。

內地樓價持續下跌，龍湖和華潤置地逆市向下。

據報美國對進口太陽能原材料展開調查，太陽能相關股受壓，信義玻璃和協鑫科技，下跌百分之3至4。"
687622a154d16ed89ec9d42b,入境處打擊非法勞工 拘15人,2025-07-15 17:42,2025-07-15 18:00,local,tvb,https://news.tvb.com/tc/local/687622a154d16ed89ec9d42b,"入境處打擊非法勞工，拘捕15人。

入境處上月底展開針對非法外賣員行動，巡查中西區多個外賣熱點，拘捕八名25至55歲非華裔男子，涉嫌租借外賣平台帳號送餐，當中七人為免遣返聲請者，另一人涉嫌非法逗留，估計日薪達五至六百元。

處方又以串謀詐騙等罪，拘捕借出帳戶的六男一女，全部是非華裔本港居民。他們以月租三千元，將帳戶租予非法勞工。"
68761c4c54d16ed89ec99f83,內地樓價跌勢持續 國統局稱交投有改善將繼續推動房地產市場企穩,2025-07-15 17:15,2025-07-15 17:30,finance,tvb,https://news.tvb.com/tc/finance/68761c4c54d16ed89ec99f83,"內地樓價跌勢持續。國家統計局指，要以更大力度推進房地產止跌回穩。

內地樓市未擺脫跌勢，《彭博》根據國家統計局的數據推算，內地七十大中城市新樓樓價，六月份按年下跌百分之3.7，跌幅較五月收窄0.4個百分點。不過，按月則下跌百分之0.27，跌幅是八個月來最大。

上月新樓樓價按月上升的城市增加一個，至14個，下跌的城市數目增至56個。按年比較，上升及下跌的城市數目維持不變。

四大一線城市的新樓樓價，只有上海錄得升幅，北京、廣州和深圳，按年跌幅介乎百分之2至5。

國統局表示，政策支持下，樓市交投已有改善，各地區部門會因城施策，繼續推動房地產市場企穩。

國家統計局副局長盛來運稱：「在『白名單』政策以及房地產市場銷售回暖的帶動下，房地產企業化債的工作也在有序的推進。當然我們也要看到，現在房地產銷售面積及銷售金額還都在下降，所以房地產的這個築底需要一個過程，在築底和轉型階段有所起伏波動，也是很正常的。」

上半年房地產開發投資下跌百分之11.2，差過市場預期。有分析認為，隨著去年九月出台一系列政策，效果逐漸消退，市場預計中央政治局會議將會有新一輪支持政策出台，持續提振樓市。"
687612c454d16ed89ec95862,內地第二季經濟按年增5.2%勝預期 國統局：仍需加力鞏固經濟,2025-07-15 16:35,2025-07-15 17:15,finance,tvb,https://news.tvb.com/tc/finance/687612c454d16ed89ec95862,"內地第二季經濟按年增長百分之5.2，較第一季增長，略高於市場預期，國統局指外部不確定因素仍然較多，國內有效需求不足，仍需加力鞏固經濟增長。

國家統計局公布，上半年國內生產總值66萬億元人民幣，按年增長百分之5.3。第二季經濟增長，由第一季百分之5.4，回落至5.2，仍高過市場預期的百分之5.1。

國家統計局指，政府更加積極有為的宏觀政策發力顯效，經濟運行總體平穩、穩中向好。

國家統計局副局長盛來運說：「生產需求穩定增長，就業形勢總體穩定，居民收入繼續增加，新動能成長壯大，高質量發展取得新進展，社會大局保持穩定。」

增長主要由消費開支帶動，貢獻率為百分之52。

工業方面，全國規模以上工業增加值，按年升百分之6.4，3D列印設備、新能源汽車、工業機器人產品產量，增長至少百分之35以上。

就業形勢總體穩定，6月大城市失業率維持百分之5。人均可支配收入中位數18,186元人民幣，按年增加百分之4.8。

不過，國家統計局認為，外部不穩、不確定因素較多，國內有效需求不足，經濟回升向好基礎仍需加力鞏固。

盛來運指出：「統籌國內經濟工作和國際經貿鬥爭，堅定不移辦好自己的事，進一步做強國內大循環，以高質量發展的確定性，應對外部不確定性，推動經濟持續健康發展。」

至於房地產，上半年全國新建商品房，銷售面積按年下跌百分之3.5，較去年同期收窄15.5個百分點，國家統計局形容，總體朝向止跌回穩邁進。"
687612f854d16ed89ec95a3c,規管網約車｜營運平台、車輛及司機均須領牌 爭取本立法年度通過法例草案,2025-07-15 16:34,2025-07-15 19:00,local,tvb,https://news.tvb.com/tc/local/687612f854d16ed89ec95a3c,"運輸及物流局向立法會提交規管網約車立法框架建議。

網約平台、車輛和司機都要領取牌照。司機必須年滿21歲、持私家車執照至少一年，申請牌照前五年內無嚴重交通定罪紀錄，並須通過指定考核。許可證有效期五年，可以續牌但不得轉讓，不設數目上限。

至於營運的車輛，須以個人名義登記，申請許可時車齡不能超過7年、需要每年驗車，及購買商用車第三者保險。許可證有效期一年，可以續牌至最多五年，不得轉讓。

而網約營運平台牌照，有效期五年，需要設立投訴機制及司機評分系統。

政府消息人士指，會按旗下車輛數目繳付平台費用。目標第三季提交主體法例草案，爭取今個立法年度通過，明年再加入附屬法例。"
68760e2854d16ed89ec92ce7,亞太區主要股市靠穩,2025-07-15 16:15,2025-07-15 16:30,finance,tvb,https://news.tvb.com/tc/finance/68760e2854d16ed89ec92ce7,"亞太區主要股市靠穩。

日本股市結束三連跌，並以全日高位收市。南韓股市繼續造好，再創近四年高位。

台灣股市曾經反彈逾百分之1，逼近22,900點水平。澳洲股市重上8,600點水平。"
68760e1e54d16ed89ec92c36,內地股市個別發展,2025-07-15 16:14,2025-07-15 16:30,finance,tvb,https://news.tvb.com/tc/finance/68760e1e54d16ed89ec92c36,"內地股市個別發展。

四大指數中，僅上證綜合指數錄得跌幅，終止之前三日升勢。其餘三大指數中，深圳創業板指數升幅較大，曾升逾百分之2；滬深300指數連升第四日。滬深京三市成交增加至逾1.6萬億元人民幣。

人工智能概念股造好；黃金、電力和光伏股則下跌。"
