id,title,date,scrape_time,section,source,url,news_content
68c0f7dbeee6da38c4d63695,政府倡提高商用車司機體格證明要求 陳美寶：目標明年第二季實施新安排,2025-09-10 12:00,2025-09-10 12:15,local,tvb,https://news.tvb.com/tc/local/68c0f7dbeee6da38c4d63695,"政府兩年前提出，商用車司機提交體格證明年齡門檻，由70歲降至65歲，以及一年一檢，但至今仍未落實。運輸及物流局局長陳美寶指，目標明年第二季實施。

運輸及物流局局長陳美寶說：「業界代表提出，可否稍為放寬65歲至70歲之間的體格評估頻率，亦有持份者認為，應該考慮增加要求司機進行反應測試。亦有醫學界代表指出，要加強考慮前線醫生實務操作情況。專家小組正積極檢視，以及考慮微調規則附表一當中，所指明的疾病以及傷殘項目，以及供醫生參考的醫療指引內容，務求令指引更清晰、更客觀、更實用。」

陳美寶表示，運輸署制訂新規例時，會參考海事處有關駕駛本地船隻健康證明要求。今年第四季起，又會要求商用車司機參與體格評估試驗計劃，以收集醫生意見。

另外，亦會研究利用創新科技及人工智能(AI)，測試司機身體反應能力，以及駕駛反應。目標明年第二季實施新安排。"
68c0f7aceee6da38c4d63084,港股中午收市報26246點 升308點,2025-09-10 12:00,2025-09-10 12:30,finance,tvb,https://news.tvb.com/tc/finance/68c0f7aceee6da38c4d63084,"恒生指數中午收市報26,246點，升308點。

京東集團升百分之4.6，中國聯通升百分之4.1，泡泡瑪特跌百分之5。"
68c0f4b0eee6da38c4d618ef,盧寵茂：政府將推出更多政策 讓新科技及藥物早日「落地」,2025-09-10 11:44,2025-09-10 12:15,local,tvb,https://news.tvb.com/tc/local/68c0f4b0eee6da38c4d618ef,"醫務衞生局局長盧寵茂指，累計14款新藥經「1+」審批機制獲批在本港註冊，未來會推出更多政策，讓新科技及藥物早日「落地」。

醫務衞生局局長盧寵茂稱：「政府正爭取在今年年底成立全球研究和應用中心，以加速創新藥物產品的研發、批准和上市程序，這正為香港生物科技產業，創造充滿活力和支持的生態。無論是想進行頂尖臨床試驗、探索新的監管途徑，或進入廣闊大灣區的市場，香港都是最佳選擇。」"
68c0f0d2eee6da38c4d5f5ed,有證券業界認為港股短期走勢仍可看好,2025-09-10 11:30,2025-09-10 11:45,finance,tvb,https://news.tvb.com/tc/finance/68c0f0d2eee6da38c4d5f5ed,"有證券業人士認為，港股短期走勢仍可看好。

致富證券市務總監郭思治表示：「總言之指數在10天、20天線之上，繼續向上望；掉轉的話，哪一天指數再度反覆，而跌穿10天、20天線，我便當作『狼來了』。看50天線，一旦跌穿50天線，隻『狼』可能真的出現，但暫時這一分鐘、這一刻未見到。」"
68c0e687eee6da38c4d5a817,一帶一路高峰論壇揭幕 李家超：將討論能源等多方面合作,2025-09-10 10:46,2025-09-10 11:00,local,tvb,https://news.tvb.com/tc/local/68c0e687eee6da38c4d5a817,"「一帶一路」高峰論壇一連兩日在灣仔會展舉行。

論壇由貿發局主辦，已經來到第十屆，有90個「一帶一路」沿線國家和地區、逾6,000名政商界代表參與，國家商務部副部長鄢東亦來港出席。

行政長官李家超致辭時表示，香港與「一帶一路」沿線國家和地區，去年貿易額逾2,760億美元，較2013年前增長約八成，指今屆論壇會討論多方面的合作。

行政長官李家超指出：「我們還能舉辦關於能源、天然資源、公共事業和城市發展的投資會議，包括香港北部都會區，這地方佔香港三分一，是作為創科的基地。我們有36項企業對企業的協議和交易即將宣布，涵蓋金融科技、物流、專業服務和教育，有賴這幾天達成的項目和交易，這些交易總額已達近10億美元。」"
68c0e2c0eee6da38c4d588cb,立法會直播室｜梁熙：加強控煙草案「有辣有唔辣」 冀順利通過推行,2025-09-10 10:30,2025-09-10 11:30,local,tvb,https://news.tvb.com/tc/local/68c0e2c0eee6da38c4d588cb,政府推出草案加強控煙，今日在立法會恢復二讀辯論。民建聯香港島東議員梁熙稱，草案內容「有辣有唔辣」，冀順利通過推行。
68c0dd4ceee6da38c4d563f0,人民幣中間價終止連續兩日升勢,2025-09-10 10:07,2025-09-10 10:30,finance,tvb,https://news.tvb.com/tc/finance/68c0dd4ceee6da38c4d563f0,"人民幣中間價終止連續兩天的升勢。

官方開出的人民幣中間價報7.1062兌一美元，較上個交易日下調54點子。現貨人民幣方面，在岸和離岸價早段都於7.12上落。

另外，人民銀行進行3,040億元人民幣七天期逆回購操作，單日在市場淨投放749億元人民幣。"
68c0dbeeeee6da38c4d55c9b,立法會直播室｜同性伴侶登記草案恢復二讀辯論 林新強：屬民主體現,2025-09-10 10:00,2025-09-10 10:30,local,tvb,https://news.tvb.com/tc/local/68c0dbeeeee6da38c4d55c9b,立法會大會今日恢復二讀辯論《同性伴侶關係登記條例草案》。法律界議員林新強認為，表決屬於民主體現。
68c0d5efeee6da38c4d5298a,內地八月居民消費價格指數按年跌0.4%,2025-09-10 09:35,2025-09-10 11:45,finance,tvb,https://news.tvb.com/tc/finance/68c0d5efeee6da38c4d5298a,"內地上月消費物價下跌。

國家統計局公布，八月份居民消費價格指數(CPI)按年下跌百分之0.4，是六月以來再次出現下跌，亦低過市場預期。

至於反映上游通脹壓力的工業生產者出廠價格指數，八月份下跌百分之2.9，較七月份收窄0.7個百分點，符合市場預期。

國家統計局指，八月居民消費價格指數由持平轉為下跌，主要是上年同期對比基數高，加上八月份食品價格升幅低於季節性水平所致。

至於工業生產者出廠價格指數，除受去年同期對比基數走低影響外，中央加緊實施更加積極有為的宏觀政策，令一些行業價格呈現積極變化。"
68c0ce73eee6da38c4d4f34e,港股高開104點 恒指報26042點,2025-09-10 09:23,2025-09-10 09:30,finance,tvb,https://news.tvb.com/tc/finance/68c0ce73eee6da38c4d4f34e,"港股高開104點，恒生指數報26,042點。

京東集團升百分之2.8，藥明生物升百分之2.2，美團跌百分之1.2。"
68c0c3bceee6da38c4d49bb2,興勝創建以4.1億元出售The Connaught,2025-09-10 08:45,2025-09-10 09:00,finance,tvb,https://news.tvb.com/tc/finance/68c0c3bceee6da38c4d49bb2,"興勝創建以4.1億元出售西營盤酒店The Connaught，預期出售虧損1.77億元。交易將於下月15日或之前完成。

董事認為出售事項為公司在當前市場環境下，變現物業價值的良機。"
68c061efeee6da38c4d1bf0e,"報章要聞｜星島：飲食業輸外勞今起須先勞處招聘
／文匯：河套數學院入駐深圳園區",2025-09-10 08:28,2025-09-10 08:45,local,tvb,https://news.tvb.com/tc/local/68c061efeee6da38c4d1bf0e,"星島日報報道︰本港餐飲業近期面對嚴峻經營挑戰，最新失業率更攀上百分之6.4高位，令坊間質疑業內是否要維持輸入外勞。

為保障本地工人優先就業，勞工處今起實施新安排，申請輸入侍應生及初級廚師崗位的僱主在四周「本地招聘」期間，必須每周參加一次在勞工處指定就業中心舉辦的招聘會，以進行即場面試；未能按時參加者，勞工處將拒絕其外勞申請。

文匯報報道︰河套數學與交叉學科研究院(深圳)在河套深港科技創新合作區深圳園區舉辦了入駐暨場地啟用活動。河套數學院由世界頂級數學家、中國科學院外籍院士丘成桐發起建設並擔任理事長，將依託河套合作區的區位政策與資源優勢，聚焦基礎數學、應用數學、數學加人工智能等交叉研究領域，構建集基礎研究、人才引進、人才培養為一體的數學與多學科交叉研究平台。

當前研究院已引才17人，預計到2025年年底擴充人才到50至60人。"
68c0c0d2eee6da38c4d4882d,飛天雲動配股集資逾7500萬元,2025-09-10 08:16,2025-09-10 08:45,finance,tvb,https://news.tvb.com/tc/finance/68c0c0d2eee6da38c4d4882d,"飛天雲動配股集資逾7,500萬元。

每股配售價0.174元，較上日收市價折讓近兩成。配售最多約4.33億股，佔已擴大發行股本逾一成六。

集資所得約六成，擬用於從媒體平台，或授權代理獲取廣告流量；三成用於增強研發能力，以及改進服務及產品組合；餘額作一般營運資金。"
68c061e2eee6da38c4d1bea8,報章要聞｜明報：帶路論壇今開幕／大公：灣區試驗所夥港大及藥廠推臨床數據研究,2025-09-10 07:58,2025-09-10 08:30,local,tvb,https://news.tvb.com/tc/local/68c061e2eee6da38c4d1bea8,"明報報道︰貿發局主辦的第十屆「一帶一路高峰論壇」今日舉行。特首李家超在報章撰文，稱香港一直在一帶一路倡議中扮演功能平台角色，並發揮「超級聯繫人」和「超級增值人」的重要作用；世界進入新的動盪變革期，共建一帶一路作為開放、安全、長遠發展的國際合作平台，已成為香港未來的新增長點。

李家超稱上任後出訪多個一帶一路地區，2023年香港對共建國家的對外直接投資超過1,330億美元，為2013年的3.6倍。而現時香港約有1,400間一帶一路企業，當中超過100間在港上市。

大公報報道︰粵港澳大灣區國際臨床試驗所、香港大學李嘉誠醫學院及葛蘭素史克於昨日簽署首個三方合作備忘錄，聯手建立策略性合作框架，以發展香港成為真實世界研究的領先地區與國際樞紐為目標，同時積極探索運用真實世界數據，以支持藥物於內地註冊及上市。

是次合作涵蓋四大範疇，包括臨床試驗與真實世界數據研究、共同開發及推動真實世界數據的新研究方法、學術交流，以及人才培訓。"
68c0bb9feee6da38c4d4573e,來凱醫藥配股集資逾5.8億元,2025-09-10 07:47,2025-09-10 08:30,finance,tvb,https://news.tvb.com/tc/finance/68c0bb9feee6da38c4d4573e,"來凱醫藥配股集資逾5.8億元。

每股配售價16.3元，較上日收市價折讓逾百分之9，配售3,600萬股，佔已擴大發行股本百分之8.1。

集資所得約九成用於臨床及臨床前管線項目的研發，餘額用於一般及企業用途。"
68c0bb93eee6da38c4d4567e,創勝集團配股集資6235萬元,2025-09-10 07:47,2025-09-10 08:30,finance,tvb,https://news.tvb.com/tc/finance/68c0bb93eee6da38c4d4567e,"創勝集團配股集資6,235萬元。

每股配售價4.33元，較上日收市價折讓近一成九，配售1,440萬股，佔已擴大發行股本百分之3.2。

集資所得四成用於管線資產的臨床開發，三成用於推進最具前景且具有近期對外許可潛力的臨床前階段管線資產。餘額用於營運資金及一般用途。"
68c0bb89eee6da38c4d455e1,中國金茂上月合同銷售額按年增長四成六,2025-09-10 07:47,2025-09-10 08:00,finance,tvb,https://news.tvb.com/tc/finance/68c0bb89eee6da38c4d455e1,"中國金茂上月的合同銷售額按年增長四成六，月增長百分之7，超過90億元人民幣。

累計今年首八個月，合同銷售額接近709億元人民幣，按年增長逾兩成半。

截至上月底，集團錄得已認購未簽約物業銷售額7.76億元人民幣。"
68c0bb7deee6da38c4d4552a,雅居樂八月預售金額按年及按月均錄升幅,2025-09-10 07:46,2025-09-10 08:30,finance,tvb,https://news.tvb.com/tc/finance/68c0bb7deee6da38c4d4552a,"雅居樂八月預售金額按年和按月均錄得升幅，按年增長百分之7.4，至5.8億元人民幣；按月上升一成一。

綜合首八個月預售金額按年則下跌三成九，至62.7億元人民幣。 "
68c0bb72eee6da38c4d4546a,龍湖集團上月合同銷售額按年減少兩成七,2025-09-10 07:46,2025-09-10 08:30,finance,tvb,https://news.tvb.com/tc/finance/68c0bb72eee6da38c4d4546a,"龍湖集團上月的合同銷售額按年減少兩成七；按月減少兩成一，超過47億元人民幣。

累計今年首八個月，合同銷售額逾457億元人民幣，按年倒退近三成。

截至上月底，集團實現經營性收入約176.9億元人民幣。"
68c0b3cfeee6da38c4d41aff,諾科達科技與兩間巴基斯坦企業分別簽署合作備忘錄,2025-09-10 07:16,2025-09-10 07:30,finance,tvb,https://news.tvb.com/tc/finance/68c0b3cfeee6da38c4d41aff,"諾科達科技與兩間巴基斯坦企業分別簽署合作備忘錄。

公司將與兩公司共同推動巴基斯坦智能城市項目與智能綜合解決方案的發展，並分別向兩公司提供全面AI RaaS機器人即服務技術，以及技術培訓和本地服務能力支援。"
68c0b3b3eee6da38c4d41a8f,美國勞非農業就業數據大幅向下修訂 白宮指數據顯示聯儲局需減息,2025-09-10 07:16,2025-09-10 08:00,finance,tvb,https://news.tvb.com/tc/finance/68c0b3b3eee6da38c4d41a8f,"美國勞工部將年度非農業就業數據大幅向下修訂91.1萬個。白宮發言人表示，數據顯示聯邦儲備局需要減息。

美國白宮發言人萊維特稱︰「就業職位被誇大了大約200萬個，拜登政府站出來為這些數據擔保，並告訴你們這些數據是真實的。而當總統特朗普質疑這些數據的真實性時，就像他在宣誓就職前、甚至身為美國總統時那樣，他都受到嘲笑。這次修改證明了兩件事情，第一、總統是對的。這就是為甚麼我們需要聯儲局新的領導層。這清楚地表明，總統接手拜登政府的經濟狀況，較以往任何報道的都要糟糕得多。這也證明聯儲局的貨幣政策過於嚴格、利率太高了，聯儲局需要減息，因為我們從拜登政府接手了爛攤子。」"
68c0b1c5eee6da38c4d41215,再多兩間為婦女作健康篩查「樂妍站」投入服務 將推出多項新檢查,2025-09-10 07:01,2025-09-10 12:00,local,tvb,https://news.tvb.com/tc/local/68c0b1c5eee6da38c4d41215,"再多兩間為婦女作健康篩查等的「樂妍站」，即日起投入服務，月內亦會推出多項新檢查服務，包括3D乳房造影，用家以共付模式支付費用。

其中一間新的「樂妍站」在藍田，為已登記的女性提供乳癌等健康篩查，亦提供接種「HPV」、即人類乳頭瘤病毒疫苗服務。

各個「樂妍站」都設有電子健康站，包括量血壓及血氧等，最後會列出個人健康資訊，以及提供運動推薦建議等。

另一間新的「樂妍站」在屯門。整體三個站，月內再有新服務，包括能驗出高危類型的「HPV」基因分型檢測，共付額、即用家在獲政府資助下要付500元。亦新增乳房超聲波及3D乳房造影，分別要付500元，以及1,500至2,500元。

現時婦女要先在地區康健中心做評估，有需要才獲轉介到「樂妍站」。當局稱，將來可選擇由慢病共治計劃下的醫生做評估及轉介，但首先都要做康健中心會員。

基層醫療健康助理專員林瑜玉說︰「有檢查結果的時候，『樂妍站』會將結果發送至家庭醫生。家庭醫生就是一個好好的角色，成為一個橋樑，將他們轉介至一些專科醫生接受服務。」

根據當局計劃，衞生署的婦女健康服務整合到基層醫療署，並由三間「樂妍站」提供，在柴灣的首間6月中開始運作。截至8月底，已有2,350人獲安排到該站接受服務，但僅1,070人已接受、不足一半。

「樂妍站」主管醫生何書韻稱︰「例如住新界或九龍區較方便，即使知道獲得接受『樂妍站』服務，但他們會等到9月中，新界及九龍『樂妍站』開幕才接受服務，因此約一千人其實是想等距離較近、較方便的服務點接受服務。」

至於兩個位於油麻地和北角的過渡點，當局稱短時間內會繼續服務，長遠就會再作檢視。"
68c061bfeee6da38c4d1bd96,社評｜經濟：投資教育提競力／信報：人才與創新務須轉化為實際產業,2025-09-10 06:58,2025-09-10 07:15,local,tvb,https://news.tvb.com/tc/local/68c061bfeee6da38c4d1bd96,"經濟日報社評︰瑞士洛桑國際管理發展學院公布《二零二五年世界人才排名》，香港排名由去年第九位升至第四位，超越新加坡成亞洲之冠。新加坡排名急跌，香港應引以為鑑，檢視持續對教育開支投入，招才則朝由重量轉向重質，提升長遠競爭力。

當局要檢視教育開支是否不足。目前香港政府在教育支出佔GDP約百分之三點九，比位列排名榜前八位的六個歐洲國家教育開支對GDP佔比百分之五至百分之七點二為低。

信報社評︰招攬人才和發展創科密不可分，既然得力於「搶人才」讓香港的世界人才排名躍升至亞洲之冠，那麼對於推動創科產業自然猶如順水推舟。問題則在於，創科產業很多時候乃「無中生有」或「從零到一」的初試啼聲，缺乏站穩腳跟的成本，實在需要融資扶持。

有人才就應善用，可創新就該創富，切勿入寶山空手回。正值中美角力牽引科技競爭各擅勝場，其實有助於創科企業大展拳腳，香港務須把推動創科產業的目標落到實處。"
68c0ab28eee6da38c4d3db79,iPhone 17 Pro系列在美入門售價較上一代同級貴100美元,2025-09-10 06:46,2025-09-10 07:30,finance,tvb,https://news.tvb.com/tc/finance/68c0ab28eee6da38c4d3db79,"美國蘋果公司舉行新品發布會，推出的產品與之前傳聞一樣。公司股價跌超過百分之1。

蘋果一如市場所料，除了發布全新系列手機外，亦發布新一代智能手表及耳機。當中iPhone 17 Pro系列在美國入門售價為1,099美元，較上一代同級手機貴100美元，是集團自2017年以來首次加價。

但有分析認為，從產品定價與去年新品相若，反映公司大幅降低了關稅影響。而公司股價表現也一如以往，在新品發布後下跌。"
68c0ab1beee6da38c4d3dacf,甲骨文首季業績差過預期 集團披露未確定收入達4550億美元,2025-09-10 06:45,2025-09-10 07:00,finance,tvb,https://news.tvb.com/tc/finance/68c0ab1beee6da38c4d3dacf,"甲骨文截至八月底止季度業績雖然差過市場預期，但披露未確定收入達4,550億美元，按年增長近3.6倍，刺激公司股價在延長交易時段曾升逾兩成七。

甲骨文上季純利逾29億美元，按年微跌。經調整每股攤薄盈利1.47美元，較預期少1美仙。

收入逾149億美元，較預期少逾1億美元。分部收入方面，雲業務表現最佳，收入逾71億美元，按年增長近兩成八。軟件業務收入較弱，按年跌近百分之1。"
68c0ab11eee6da38c4d3da66,美國向下修訂非農業就業職位數目 摩通CEO指美國經濟或步向衰退,2025-09-10 06:45,2025-09-10 07:00,finance,tvb,https://news.tvb.com/tc/finance/68c0ab11eee6da38c4d3da66,"因應美國勞工部向下修訂非農業就業職位數目，摩根大通行政總裁戴蒙表示，美國經濟或正步向衰退。

他認為美國經濟正在轉弱，但不清楚是步向衰退或只是轉弱。他表示公司掌握包括消費者、企業與全球貿易的多項數據，大部分消費者仍然有工作，仍然按他們的收入水平花費，但他們的信心或受打擊。目前經濟受很多不同因素影響，消費動力轉弱，但企業盈利仍然理想，只能繼續觀望。

他相信聯儲局本月會議後大概會下調利率，但即使減息，也未必對整體經濟有顯著影響。"
68c061ceeee6da38c4d1be2f,社評｜明報：房署應以人為本護弱勢／AM730：熱氣球鬧劇揭官僚陋習,2025-09-10 06:28,2025-09-10 06:45,local,tvb,https://news.tvb.com/tc/local/68c061ceeee6da38c4d1be2f,"明報社評︰精神病患母子遭房屋署要求遷出公屋單位後相繼墮樓亡，儘管青山醫院兩度發信，建議容許兩人續居於單位，但當局「不為所動」，惹來不少批評。當局所謂的「情理兼備」及「人性化」處理都是以收樓為前提，遷出單位無情講，酌情只限於善後安排。

今次個案中，當局的處理，守住了打擊濫用公屋政策，也堅守了處理申報不實個案的官僚程序，但卻沒有好好顧及兩名精神病患者的需要。這種機械性的處理，難言是以人為本，當局有必要認真檢討。

AM730社評︰「香港國際熱氣球節」鬧劇終在八號風球下落幕。事件過後，執法部門如何跟進，以及從中汲取教訓，促進部門改變態度，以促成者角色協調舉辦盛事，而非以冷漠態度讓主辦方一力承擔所有風險，這才是保障消費者及提升香港盛事聲譽的根本方法。

熱氣球並不是新鮮或高科技的項目，在各地的自然美景或著名景點都能見到熱氣球的蹤影。美國、英國、土耳其、澳洲等國家均有一整套熱氣球的安全規範，對駕駛者、熱氣球升空器、地面聯繫等方面有嚴格的規定。港府大可借鑑其他國家的經驗，而不是避而不見，設重重關卡。"
68c063b8eee6da38c4d1c675,市場料聯儲局下周開會後決定減息 金價曾再創新高,2025-09-10 06:17,2025-09-10 06:45,finance,tvb,https://news.tvb.com/tc/finance/68c063b8eee6da38c4d1c675,"市場預期美國聯儲局下周開會後將決定減息，金價曾再創新高。

紐約期金一度升穿3,700美元一盎司，收市報3,682.2美元，升4.8美元，升幅百分之0.1。現貨金一度升至3,674.27美元一盎司，升幅逾百分之1。過去兩日累積上升百分之2.5，今年以來累積升幅近四成。

市場對美國聯儲局減息的預期升溫、地緣政治緊張，以及多國央行增持黃金，都推動金價上升。捷克央行在社交媒體發文指，黃金持有量已達到1993年以來最高水平。捷克央行於八月底持有65.2噸黃金。"
68c063c9eee6da38c4d1c76b,原油期貨價格上升,2025-09-10 06:17,2025-09-10 06:30,finance,tvb,https://news.tvb.com/tc/finance/68c063c9eee6da38c4d1c76b,"以色列空襲卡塔爾首都多哈，目標哈馬斯領導層，原油期貨價格上升。

紐約期油收市報62.63美元一桶，升37美仙，升幅近百分之0.6。倫敦期油收市報66.39美元一桶，同樣升37美仙，升幅逾百分之0.5。"
68c0a26eeee6da38c4d39437,英美資源及泰克資源宣布合併 成全球前五大銅生產商,2025-09-10 06:17,2025-09-10 06:45,finance,tvb,https://news.tvb.com/tc/finance/68c0a26eeee6da38c4d39437,"英美資源及泰克資源兩大礦業公司宣布合併，組成全球前五大銅生產商。

根據交易協議，在英國上市的英美資源將持有合併公司百分之62.4股權，泰克資源持股百分之37.6。合併預計能創造稅前年化協同效應約8億美元，當中八成有望在第二年結束前實現。

合併公司總部設於加拿大，預期同時在紐約、多倫多、倫敦及約翰內斯堡上市。預計交易將於12至18個月內完成。"
68c063a6eee6da38c4d1c584,港股美國預託證券與本港收市比較 造價個別發展,2025-09-10 06:16,2025-09-10 06:30,finance,tvb,https://news.tvb.com/tc/finance/68c063a6eee6da38c4d1c584,"在美國買賣的港股預託證券與本港收市比較，造價個別發展。

滙豐控股收市折合103.65元，比本港收市高1.25元。工商銀行5.86元，低3仙。建設銀行7.74元，低1仙。友邦保險74.86元，低4仙。港交所440.05元，高1.45元。

騰訊控股632.22元，高5.22元。阿里巴巴143.23元，高1.33元。理想汽車94.33元，低0.77元。金沙中國19.94元，低3仙。長和51.33元，低0.32元。"
68c0638ceee6da38c4d1c4e9,美股三項主要指數連升兩日 齊創收市新高,2025-09-10 06:16,2025-09-10 06:45,finance,tvb,https://news.tvb.com/tc/finance/68c0638ceee6da38c4d1c4e9,"美股三項主要指數連續第二日上升，並且齊創收市新高。

道瓊斯工業平均指數收市報45,711點，升196點。標準普爾500指數收市報6,512點，升17點。

美股延續上日升勢，三大指數均高開。其中道指高開32點，早段見全日低位後，開始反覆向上。尾市升幅擴大至最多249點，收市升196點。標準普爾500指數高開8點後，早段一度倒跌12點。其後重拾升勢，收市升17點。

蘋果舉行新產品發布會，股價跌百分之1。

人工智能晶片股個別發展，Nvidia輝達升逾百分之1。股價連日造好的博通回吐逾百分之2。荷蘭人工智能基礎設施公司Nebius獲微軟給予逾194億美元五年期合約供應，股價急升近五成。

納斯達克指數收市報21,879點，升80點。反映中國概念股表現的納斯達克中國金龍指數收市報8,230點，升119點。"
68c08fa4eee6da38c4d30fd0,歐盟委員會年度報告涉本港維護國安等內容 港府表示強烈不滿及反對,2025-09-10 05:00,2025-09-10 05:30,local,tvb,https://news.tvb.com/tc/local/68c08fa4eee6da38c4d30fd0,"特區政府就歐盟委員會年度報告，針對香港特區維護國家安全、保障人權等方面的不實和偏頗內容，表示強烈不滿和反對。

特區政府發言人強調，香港法治固若金湯、歷久不變，並無任何倒退，任何指稱香港正成為一個「極權」城市的說法絕非事實。香港普通法制度不會因個別海外非常任法官離任而有所改變。

發言人又指，歐盟對香港特區維護國家安全的法律制度和執行機制指手畫腳，全然漠視香港特區訂立相關法律的憲制責任和實際需要，以及訂立後對經濟發展和人權保障帶來的正面效果，是實實在在的雙重標準。"
