id,title,date,scrape_time,section,source,url,news_content
6954ffa5d6adf87a9bf2e6ee,公立醫院收費改革｜醫管局將派過千人協助 有病人指或考慮轉找私家醫生,2025-12-31 18:48,2025-12-31 19:15,local,tvb,https://news.tvb.com/tc/local/6954ffa5d6adf87a9bf2e6ee,"公營醫院新收費元旦起實施，醫管局將派出過千名服務大使協助病人。有病人指，加價後或考慮轉找私家醫生診症。

公立醫院實施新收費前夕，不少醫院的急症室，診症如常要長時間輪候。廣華醫院非緊急輪候時間，一度要7、8個小時以上。最後一日以劃一舊價180元診症，新收費將設「兩級制」，危殆、危急病人免費，緊急、次緊急及非緊急劃一收400元。

一名病人說：「加不加價我都要看醫生，腳痛、好痛。」

亦有市民前一晚肚突然不適，分流至非緊急，等了8小時才見到醫生，加價後有需要仍會去急症室求診。

伍先生稱：「沒甚麼事都不想再看醫生，不會為了加價前而來看，不會想常常進出醫院，自己乘不到車，唯有召救護車。」

岑先生指：「400元、我今次又要乘的士過來，計過數後我會寧願看私家，非不得已我和家人不會到急症室。」

有病人就到醫院申請醫療費用減免。

李先生表示：「我本身在想隨便、不需要豁免，但價錢升了十倍會怎麼想？我本身50元處理到的事，現在幾乎要500元。那是否要申請？我以前都沒有申請的。」

除了急症室，家庭醫學門診及專科門診，診金分別加至150元及250元。藥費則分別加至5元4星期，及20元4星期。

住院方面，急症增至300元一天，豁免入院費，非急症就加至200元一日。

電腦掃描、磁力共振以及病理檢驗，由免費變逐項收費，最多收500元，超聲波檢查加至250元，若屬緊急可免費。

醫管局稱，各個系統包括病人登記及收費等已做好測試，會密切留意各公立醫院運作情況，確保收費改革順利推行。"
6954ff5bd6adf87a9bf2e18a,屯門兇案｜掃管笏男子報稱與妻打架 警方到場證實女事主當場死亡,2025-12-31 18:47,2025-12-31 19:30,local,tvb,https://news.tvb.com/tc/local/6954ff5bd6adf87a9bf2e18a,"屯門下午發生命案，一對夫婦懷疑爭執打架，女事主死亡。

現場是屯門掃管笏管翠路一號，下午4時許，警方接獲一名男子報案，指他與妻子在單位內爭執打架，其後發現妻子在房內暈倒。

警方及救護人員到場，當場證實女事主已經死亡，警方正調查事件。"
6954fe96d6adf87a9bf2d6cd,現場｜西九文化區不少人帶備野餐墊 等候觀賞跨年倒數表演,2025-12-31 18:44,2025-12-31 19:45,local,tvb,https://news.tvb.com/tc/local/6954fe96d6adf87a9bf2d6cd,西九文化區稍後將舉行跨年倒數活動，下午起多名歌手在場彩排。不少人帶備野餐墊，在場等候觀賞表演。
6954fc87d6adf87a9bf2c6a1,金管局：十一月新申請按揭貸款個案按月少2.9%,2025-12-31 18:34,2025-12-31 19:00,finance,tvb,https://news.tvb.com/tc/finance/6954fc87d6adf87a9bf2c6a1,"金管局公布，十一月新申請按揭貸款個案，按月減少百分之2.9，至8,019宗。

新批按揭貸款額，按月減少百分之7，至291億元，當中涉及一手市場交易，批出貸款減少百分之12.6，至108億元。二手交易批出貸款減少百分之2.3，至156億元。

十一月新取用按揭貸款額，按月減少百分之2.3，至197億元。截至十一月底，未償還按揭貸款總額，按月增加百分之0.3，至19,135億元，按揭貸款拖欠比率百分之0.14，仍維持於低水平。"
6954fc44d6adf87a9bf2c44a,本財政年度首八個月錄赤字180億港元,2025-12-31 18:34,2025-12-31 19:00,finance,tvb,https://news.tvb.com/tc/finance/6954fc44d6adf87a9bf2c44a,"本財政年度首八個月，錄得赤字180億港元。

政府公布，截至十一月底的財政年度首八個月，整體開支4,966億元，收入3,719億元，計入發行政府債券所得，及償還政府債券的本金後，錄得赤字180億元。

政府發言人表示，赤字較十月減少，因薪俸稅及利得稅等主要收入，均大多在財政年度後期收取。財政儲備在十一月底，為6,363億港元。"
6954fc31d6adf87a9bf2c399,本港外匯基金總資產按月減少,2025-12-31 18:33,2025-12-31 19:00,finance,tvb,https://news.tvb.com/tc/finance/6954fc31d6adf87a9bf2c399,"本港外匯基金總資產按月減少。

金管局公布，截至11月底，外匯基金總資產逾41,000億港元，按月減少107億元。

其中外幣資產減少99億元，因已購入但未結算證券的月底餘額減少，但有關減幅因發行數碼綠色債券，及人民幣特區政府機構債券所得款項，來自投資的利息收入，及投資按市價重估而被部分抵銷。

至於港元資產減少8億元，因港股按市值重估。"
6954fc14d6adf87a9bf2c2d5,壁仞科技暗盤一度升逾九成,2025-12-31 18:33,2025-12-31 19:00,finance,tvb,https://news.tvb.com/tc/finance/6954fc14d6adf87a9bf2c2d5,"國產「GPU四小龍」之一壁仞科技，暗盤一度升逾九成。

根據幾間券商的暗盤交易平台，壁仞科技曾經高見38.8元，較招股價19.6元，高出近九成八。收盤升幅介乎七成九至八成，即一手帳面最多賺3,156元。

據市場消息，壁仞公開發售部分，超額認購超過2,300倍，有多達47.6萬人認購，是2025年最多人認購的新股。

壁仞是按上市規則第18C章上市的特專科技公司，集資最多約48億元。股份將於周五掛牌，是2026年首隻掛牌的新股。"
6954fbd4d6adf87a9bf2c06c,現場｜蘭桂坊有餐廳指今晚訂座已滿 形容市道理想,2025-12-31 18:32,2025-12-31 19:00,local,tvb,https://news.tvb.com/tc/local/6954fbd4d6adf87a9bf2c06c,"據本台記者所見，目前蘭桂坊人流不算多，有餐廳今晚訂座已滿，形容市道理想。

有餐廳及酒吧方面表示，受惠旅發局在中環舉辦倒數活動，帶動人流，預計生意額有五至十成增長。"
6954fbe7d6adf87a9bf2c11d,配合跨年慶祝活動深圳灣口岸今晚通宵運作 多項公共交通加強服務,2025-12-31 18:32,2025-12-31 19:30,local,tvb,https://news.tvb.com/tc/local/6954fbe7d6adf87a9bf2c11d,"深圳灣口岸今晚通宵運作，羅湖口岸亦延長服務至元旦凌晨二時。多項公共交通加強服務。

在西九龍高鐵站入境大堂，抵港的內地旅客不少人是一家大小。內地多個城市包括廣州、西安等，公眾地方都不會舉行由官方舉辦的跨年倒數活動，有人專程來香港感受跨年氣氛。

成都旅客梁小姐稱：「在內地跨年可能就是太普普通通了，想來香港感受一下不一樣的跨年。」

福建旅客王小姐表示：「我覺得香港跨年夜也是比較熱鬧的，雖然沒有煙花，但是也可以走走看看的。」

在羅湖口岸，旅客清關服務延長至元旦凌晨二時。顯示屏提示旅客，東鐵綫往羅湖尾班車，元旦凌晨零時56分由金鐘開出，往金鐘的尾班車，就於凌晨2時30分由羅湖開出。

有市民把握時間即日來回。

周先生指出：「先跟朋友飲早茶，下午去卡拉OK，晚飯跟朋友慶祝生日，然後回港倒數。」

上海旅客劉小姐說：「我們是來看周深的演唱會，然後過跨年、元旦這樣子。」

運輸署提醒市民和旅客及早規劃行程，可考慮於非繁忙時間出行，並留意最新交通情況。

為配合跨年慶祝活動，深圳灣口岸旅客清關服務改為24小時運作。

港鐵大部分路綫將通宵服務，並由下午三時起分階段加密班次。11條特別巴士線元旦凌晨提供特別服務，逾20條巴士線加強服務或延長服務時間。

<a href=""https://news.tvb.com/tc/local/6954dc06d6adf87a9bf1a08b"" target=""_blank"" rel="""">除夕交通安排｜港鐵8條本地綫通宵行駛　城巴、九巴設特別路線｜一文看清</a>

<a href=""https://news.tvb.com/tc/local/695344ccd6adf87a9be41f0f"" target=""_blank"" rel="""">倒數迎2026好去處｜西九首辦海濱倒數音樂會　中環遮打道迪士尼同步賀新年｜一文看清‧活動詳情</a>"
6954fb99d6adf87a9bf2bb1b,現場｜中環跨年活動場地工作人員正作最後準備 不少市民到場等候,2025-12-31 18:31,2025-12-31 19:00,local,tvb,https://news.tvb.com/tc/local/6954fb99d6adf87a9bf2bb1b,在中環跨年活動舉行現場，工作人員正作最後準備，不少市民已到場等候觀賞表演。
6954fbadd6adf87a9bf2be2d,蘭桂坊有酒吧推優惠吸客 灣仔海景餐廳因煙花取消生意大跌一半,2025-12-31 18:31,2025-12-31 19:00,local,tvb,https://news.tvb.com/tc/local/6954fbadd6adf87a9bf2be2d,"蘭桂坊有酒吧推出優惠及有獎遊戲，吸引市民及遊客光顧，估計生意較去年增長兩成，但灣仔有海景餐廳就因為煙花取消，預計生意少一半。

即將告別2025年，中環蘭桂坊下午已有不少人來打卡。與往年一樣，商戶安排跨年倒數活動。警方提早架設鐵馬，準備做好人流管制。

準備就緒的還有餐廳，不少都推出倒數套餐及優惠，包括飲品放題。亦有酒吧舉辦有獎遊戲，大獎是北海道來回機票，訂座已爆滿。

餐廳及酒吧負責人郭先生說：「食材方面亦可能會精緻些，讓食客多些選擇。我們看到很多遊客來此消費，很多訂座都是外國人為主，相信除夕夜(生意)也會增長百分之15至20。」

蘭桂坊協會指，旅發局跨年活動移師中環舉行，有助帶動人流及生意，相信生意額按年有半成至一成增長，但餐廳定價都不敢太進取。

蘭桂坊協會總監張素媚表示：「考慮到最近香港的社會氣氛，及長期以來環球經濟沒有升幅，去鼓勵市民或海外遊客很豪爽地消費，定價比疫情前更有大折讓，有大約四成的減幅，都估計所有商戶是希望港人留港消費。」

不過，有人歡喜有人愁，位於灣仔海濱這間餐廳，本身是絕佳的煙花觀賞點，但因為匯演取消，大批客人「撻訂」，令生意大跌一半。

灣仔海濱餐廳負責人鄭小姐指出：「(往年)看煙花的三日入座是滿的，每年如是。我們這兩個星期都想了很多活動，今晚有美人魚表演、有唱片騎師，希望多些氣氛，可留住客人。損失就難(挽回)，但希望沒那麼差。」

她又指，有在內地社交平台推廣，希望仍可吸引到人來倒數。"
6954fb7fd6adf87a9bf2b9c5,有歌迷專程到中環觀賞Air Supply表演 八座地標大廈將上演光影表演,2025-12-31 18:30,2025-12-31 19:00,local,tvb,https://news.tvb.com/tc/local/6954fb7fd6adf87a9bf2b9c5,"多區都有倒數活動迎接2026年。

國際殿堂級組合Air Supply下午來到中環踏台板，守候的歌迷先睹為快。

胡先生說：「我特地來追Air Supply，我太太很喜歡Air Supply，沒有煙花、有Air Supply補回也很興奮。」

張先生稱：「約了親戚去尖沙咀。(中環)有哪些歌手？」

記者表示：「Air Supply。」

張先生回答：「那麼厲害、那要回來，我很喜歡唱歌。很喜歡，劉洋曾唱過的『Without You』，立即要回來這邊。」

旅發局在遮打道行人專用區舉辦跨年倒數活動，除了有歌手獻唱，八座地標大廈，包括終審法院、中銀、滙豐等的外牆，有時鐘及光影圖案倒數跨年，再上演長約三分鐘的光影表演，展示「新希望、新開始」。

黃小姐指出：「以前會看煙花，但今年沒有煙花，也很多人、想在家，與家人或朋友一起過。」

亦有旅客一心來看煙花，現在變為感受香港的過年氣氛。

台灣旅客蘇小姐表示：「會去海港城那邊，本來是要看煙火，有一點(失望)，但現在一起感受人潮。」

黃小姐說：「因為行程已經訂了，酒店甚麼也不能退，所以還是想說，回來感受一下氛圍。」

芝加哥旅客李小姐稱：「我們打算找個位置看煙花，但暫仍未決定到哪，你有甚麼建議嗎？」

記者提醒：「不過今年煙花已取消。」

李小姐說：「真的嗎？我們不知道。」

對岸的西九文化區，首次舉辦跨年倒數音樂會。鄰近M+博物館幕牆，及全港最高的環球貿易廣場，都會配合一同倒數。

余小姐表示：「下午會在這拍西九的聖誕樹。過了一年，可將不好的事帶走，迎接新一年，即使沒了煙花也可以。」

另外，尖沙咀文化中心外牆、灣仔會展玻璃外牆，亦有巨型倒數時鐘，跟市民一同迎接新一年。

<a href=""https://news.tvb.com/tc/local/695344ccd6adf87a9be41f0f"" target=""_blank"" rel="""">倒數迎2026好去處｜西九首辦海濱倒數音樂會　中環遮打道迪士尼同步賀新年｜一文看清‧活動詳情</a>

<a href=""https://news.tvb.com/tc/local/6954dc06d6adf87a9bf1a08b"" target=""_blank"" rel="""">除夕交通安排｜港鐵8條本地綫通宵行駛　城巴、九巴設特別路線｜一文看清</a>"
6954eefad6adf87a9bf24a2a,時事通識｜貴金屬價造好,2025-12-31 18:26,2025-12-31 18:30,local,tvb,https://news.tvb.com/tc/local/6954eefad6adf87a9bf24a2a,"貴金屬價格近日出現大幅波動，尤其白銀價格日前一度跌逾一成，但總結年內表現，整體貴金屬價格仍有可觀升幅。

貴金屬年內一直獲追捧，當中黃金及白銀價格，均創出1979年以來表現最好的一年，實際是在多項利好因素疊加起來的結果。

美國聯邦儲備局自2024年9月至今，累計減息共6次，共1.75厘，利好沒有利息的貴金屬。俄烏戰事持續、中東衝突及美國的「對等關稅」政策，引發市場避險情緒升溫，推動資金走向貴金屬。

但更重要是自2008年金融海嘯爆發後，打擊市場對貨幣的信心，多國中央銀行開始逐漸增持黃金。當中俄羅斯、中國、印度、土耳其及波蘭，近十七年來累計增持黃金數量，約佔全球央行總增持量達八成。

投資銀行高盛預期多國央行繼續買金，金價可望升至4,900美元一盎司。摩根大通預測，金價將見5,055美元。

<a href=""https://news.tvb.com/tc/programme/behindtheheadlines"" target=""_blank"" rel="""">點擊重溫其他集數</a>"
6954f4a5d6adf87a9bf280e6,李家超發表新年寄語 指香港會主動對接國家「十五五」規劃,2025-12-31 18:02,2025-12-31 18:15,local,tvb,https://news.tvb.com/tc/local/6954f4a5d6adf87a9bf280e6,"行政長官李家超發表新年寄語，指香港會主動對接國家「十五五」規劃。

李家超在《紫荊》雜誌發文，形容2025年香港充滿考驗，又展現韌性。新的一年，政府將全力拼經濟、謀發展、搞建設、惠民生。

李家超提出三點寄望，堅定貫徹「一國兩制」，堅持及完善行政主導；團結帶領社會推行改革，推動經濟高質量發展；亦會深度參與粵港澳大灣區建設，更好融入和服務國家發展大局。

李家超指，會加快發展北部都會區，用好中央挺港惠港措施，深化國際交往合作及改革。"
6954f48fd6adf87a9bf28048,現場｜蘭桂坊有酒吧和餐廳認為今年市道不錯 料倒數活動可帶動客流,2025-12-31 18:01,2025-12-31 19:00,local,tvb,https://news.tvb.com/tc/local/6954f48fd6adf87a9bf28048,蘭桂坊有酒吧和餐廳認為今年市道不錯，有旅發局在中環推出歌手表演和倒數活動，可以帶動人流前來吃飯或飲酒。不少酒吧和餐廳都推出倒數和抽獎活動吸客，更有餐廳指，今晚訂座已滿。
6954f15ed6adf87a9bf262af,警員偽造口供訛稱報案人不再追究致九宗案件終止調查 判監兩年,2025-12-31 17:47,2025-12-31 18:00,local,tvb,https://news.tvb.com/tc/local/6954f15ed6adf87a9bf262af,"一名偵緝警員偽造口供，訛稱報案人不再追究，令九宗案件終止調查，判監兩年。

案件在區域法院審理，34歲被告黃耀聰早前經審訊後，被裁定偽造文書及公職人員行為失當罪成。被告曾於旺角及深水埗警區刑事調查隊工作。

而本案涉及10宗被告曾負責調查的案件，報案日期橫跨2022年1月27日至2023年6月15日。而導致終止調查的案件，五宗涉及以欺騙手段獲得財產、三宗涉及盜竊，還有一宗涉及勒索。

有報案人因電騙損失26萬元，而大部分事主審訊期間曾出庭作供，指是想繼續追究。

辯方求情指，被告背景報告正面，因不懂處理工作壓力及工作量，採取逃避態度而犯案，又指被告患癌，治療進展良好、正在康復。

暫委法官黃國輝判刑時指，即使被告沒金錢得益，只想減輕工作量，但他用不當手法，要報案人簽署「不追究陳述書」，令案件終止調查，亦誤導上司、影響程序。

考慮辯方審訊時同意大部分案情，而被告患癌，須長期服藥，獲額外扣減刑期，最終總刑期為監禁24個月。"
6954e6e8d6adf87a9bf207e3,現場｜Air Supply到中環跨年活動場地視察 遮打道一帶今晚6點封路,2025-12-31 17:03,2025-12-31 17:45,local,tvb,https://news.tvb.com/tc/local/6954e6e8d6adf87a9bf207e3,中環跨年活動籌備得七七八八，國際歌唱組合Air Supply到場地進行視察，與粉絲現場互動，遮打道一帶今晚6點封路。
6954df5ad6adf87a9bf1bce5,警方元朗檢獲107公斤懷疑可卡因 拘一對情侶,2025-12-31 16:30,2025-12-31 17:00,local,tvb,https://news.tvb.com/tc/local/6954df5ad6adf87a9bf1bce5,"警方在元朗搗破毒品儲存倉庫，檢獲107公斤懷疑可卡因，約值逾八千萬元。

行動檢獲大量可卡因磚。警方毒品調查科探員，昨日下午在元朗突擊搜查一間村屋，檢獲10公斤懷疑可卡因。以販毒罪拘捕一名28歲女子及一名31歲男子，二人為情侶關係。之後押解他們到附近一間鐵皮屋搜查，再檢獲97公斤懷疑可卡因，約值逾八千萬。

警方調查相信，兩人受金錢利誘，被販毒集團招攬成倉管及派送毒品角色。又指他們將毒品收藏在偏遠村屋及鐵皮屋，企圖逃避追查。"
6954df24d6adf87a9bf1ba29,內地股市個別發展 總結全年四大指數均錄雙位數升幅,2025-12-31 16:30,2025-12-31 18:30,finance,tvb,https://news.tvb.com/tc/finance/6954df24d6adf87a9bf1ba29,"內地股市個別發展。

上證指數收市靠穩，其餘三項指數高開低收，以創業板指數跌幅較大，收市跌百分之1.2。滬深兩市成交逾2萬億元人民幣。

總結全年，四大指數均錄得雙位數升幅，以創業板指數升幅最大，全年升近五成，深證成分指數升近三成。

滬深兩市全年總成交額逾400萬億元人民幣，按年增長超過六成，創年度紀錄新高。"
6954d917d6adf87a9bf18dc2,現場｜不少市民提早到西九聖誕市集 迎接跨年倒數活動,2025-12-31 16:04,2025-12-31 18:30,local,tvb,https://news.tvb.com/tc/local/6954d917d6adf87a9bf18dc2,西九文化區人流不算多，不少市民下午提早到聖誕市集，迎接今晚跨年倒數活動。
6954addcd6adf87a9bf0177b,本港多處有跨年倒數活動 多區下午起分階段封路,2025-12-31 16:00,2025-12-31 16:30,local,tvb,https://news.tvb.com/tc/local/6954addcd6adf87a9bf0177b,"即將踏入2026年，晚上雖然沒有跨年煙花匯演，但多處都有倒數活動，多區下午起會分階段封路。

快將告別2025年，本港今年除夕維港沒有煙花。旅客有否失望呢？

上海旅客劉小姐說：「煙花取消，但我們覺得2025年到2026年有種跨度，邁過去的感覺，倒數仍有紀念意義在那邊。」

成都旅客楊小姐稱：「今天是2025年最後一天，很有紀念意義。」

灣仔海濱這間餐廳，就因為煙花匯演取消，這日有大批客人「撻訂」，生意大跌一半。

灣仔海濱餐廳負責人鄭小姐指：「沒有了煙花，人們就不會特地過來倒數。推出美人魚、200多元套餐，希望吸引年輕人過來這裡。又有唱片騎師表演，希望今晚的人多些。」

沒有了煙花，倒數活動仍一項接一項。

旅發局移師中環遮打道行人專用區舉辦跨年活動，晚上11時半起，由國際歌唱組合Air Supply，和本地歌手「打頭陣」。

舉辦「光影匯」的八座地標大廈，包括終審法院、中銀、滙豐等的外牆，會有巨型倒數時鐘及光影圖案倒數。之後以「新希望、新開始」為主題，上演長約三分鐘的光影表演。

另外，不少人都會選擇到蘭桂坊倒數。警方下午兩時起分階段封路，中環遮打道由傍晚六時起封路，部分車輛需改道。

對岸的西九文化區，會舉辦跨年倒數音樂會。

鄰近M+博物館幕牆，及全港最高的環球貿易廣場，都會「配合」一同倒數。

維港上空無煙花，但仍是倒數的好地點。

尖沙咀文化中心外牆，灣仔會展玻璃外牆，屆時亦有巨型倒數時鐘，讓市民一同迎接新一年。

警方指會因應現場情況，在尖沙咀一帶實施封路及改道措施。

迪士尼樂園亦舉行倒數派對，會有煙火及無人機演出。

啟德體育園亦有歌手，舉辦跨年演唱會。

<a href=""https://news.tvb.com/tc/local/695344ccd6adf87a9be41f0f"" target=""_blank"" rel="""">倒數迎2026好去處｜西九首辦海濱倒數音樂會　中環遮打道迪士尼同步賀新年｜一文看清‧活動詳情</a>"
6954d23fd6adf87a9bf14a0c,財金戰報｜港股收爐！恒指創八年最好表現 明年乘勝追擊？,2025-12-31 15:35,2025-12-31 16:15,finance,tvb,https://news.tvb.com/tc/finance/6954d23fd6adf87a9bf14a0c,"港股全年累升5,570點，升幅逾27%，表現為2017年來最好，市場普遍預期明年可見3萬點？選股有何策略？"
6954d232d6adf87a9bf14968,交易現場｜譚智樂︰短線可追百度 上望150元水平,2025-12-31 15:34,2025-12-31 16:15,finance,tvb,https://news.tvb.com/tc/finance/6954d232d6adf87a9bf14968,港股短線可留意甚麼股份？揀股條件是甚麼？短線追百度要如何操作？
6954d171d6adf87a9bf13efb,台灣股市創收市新高 澳洲股市收市微跌,2025-12-31 15:31,2025-12-31 16:15,finance,tvb,https://news.tvb.com/tc/finance/6954d171d6adf87a9bf13efb,"日本及南韓假期休市。

台灣股市在電子股帶動，創收市新高，台積電股價創新高，全年計，台股累升逾5,900點，升幅近兩成六。

澳洲股市在今年最後一個交易日，收市微跌，全年計累升逾百分之6。"
6954a2d7d6adf87a9befb3c0,西貢破邊洲內地旅客疑拍照時失足墮海身亡,2025-12-31 15:30,2025-12-31 15:45,local,tvb,https://news.tvb.com/tc/local/6954a2d7d6adf87a9befb3c0,"一名內地旅客在西貢破邊洲，懷疑拍照時失足墮海死亡。

20歲男事主被救起時已經昏迷，送到西貢對面海水警基地，最終不治。

據了解，事主來自廣州，與三個同學早上到破邊洲行山。早上10時許，去到懸崖邊的涼亭休息及拍照，期間不慎失平衡，從70米高崖墮海，同行人士隨即報警。

警方初步調查發現，死者後腦嚴重骨折，身上有多處擦傷，案件無可疑，列作屍體發現。"
6954cd9fd6adf87a9bf11826,鑫鼎鑫飲用水事件｜當局重新招標 指已加強要求防範詐騙等,2025-12-31 15:15,2025-12-31 15:30,local,tvb,https://news.tvb.com/tc/local/6954cd9fd6adf87a9bf11826,"政府採購懷疑冒牌樽裝水，政府物流服務署重新為港島及離島政府，辦公室飲用樽裝水招標。

新的飲用水招標為「貨物合約」，為期27個月，涉及146萬支樽裝飲用水。

文件規定，投標者必須是飲用水製造商，或全資擁有一間製造商，並證明具一定物流能力。若樽裝水屬進口，必須符合食品進口商資格，亦要提交安全檢測報告。

又指若中標價逾1,500萬元，投標者需通過財務審查，及繳交合約保證金，並容許當局實地視察。

財庫局指，招標文件已按新指引，在各階段加強要求，防範詐騙等行為。"
6954ca7bd6adf87a9bf104b2,孫玉菡：至本月中1.7萬宗高才通續簽申請獲批 比率達94%,2025-12-31 15:01,2025-12-31 15:30,local,tvb,https://news.tvb.com/tc/local/6954ca7bd6adf87a9bf104b2,"截至本月中，高才通計劃下，有約3.3萬人的逗留期限屆滿，當中五成三、即逾1.7萬人，向入境處申請續簽。

勞工及福利局局長孫玉菡在社交平台公布，入境處批出12萬宗高才通申請，其中8.8萬人來自世界頂尖大學，至今處理約1.9萬宗高才通續簽申請，其中1.7萬宗獲批，比率達九成四。

孫玉菡表示，各項人才入境計劃，累計收到57萬宗申請，當中40萬宗獲批，約26萬人帶同家人抵港。"
