id,title,date,scrape_time,section,source,url,news_content
68c005aeeee6da38c4ceca92,德國慕尼黑車展周二揭幕 協會指中歐產業合作是推動汽車業轉型關鍵動力,2025-09-09 18:46,2025-09-09 21:00,finance,tvb,https://news.tvb.com/tc/finance/68c005aeeee6da38c4ceca92,"德國慕尼黑車展周二揭幕，有116間中國參展商，是德國以外，最多參展商的國家。

中國汽車工業協會認為，中歐產業合作，是推動汽車業轉型的關鍵動力。

比亞迪執行副總裁李柯出席德國慕尼黑車展。她表示，集團今年底在歐洲將有超過1,000間門店，遍及32個國家。

她又透露，目前正與數百家歐洲供應商洽談合作，匈牙利的新電動車廠房會在年底前投產。

歐洲的電動車龍頭大眾汽車便發布全新小型電動車，預計明年上半年上市。行政總裁奧博穆表示，集團在歐洲電動車市場佔有率達兩成八，期望可進一步提升。

每兩年舉辦一次的德國慕尼黑車展，是全球汽車產業的風向標。初步統計今屆參展商有748間，有五成七來自德國以外，比例是歷屆最高。中國是德國以外最多參展商的國家，有116間，涵蓋新能源製造、三電系統，智能化軟硬體等全產業鏈。據統計，中國汽車品牌在歐洲汽車市佔率約百分之5.3，單計純電動車市佔率近一成，不少中國車企都希望，加快擴展歐洲市場的步伐。

廣汽集團董事長馮興亞說：「必須要以用戶需求為核心，可以說在新能源，智能網聯等領域的技術創新，中國車企已經建立起，全球領先的競爭優勢。」

零跑汽車創始人朱江明表示：「我們可以在非常短的時間內，鋪設了1,700家海外經銷商渠道的網絡門店。我們可能還會跟斯泰蘭蒂斯，供應一部分零部件。」

中國汽車工業協會認為，中歐產業合作是推動汽車業轉型的關鍵動力。

中國汽車工業協會副秘書長柳燕提到：「產業鏈各方『組團出海』也是大勢所趨，有助於形成合力，為中國汽車在歐盟市場的發展提供更好的支撐。」

有分析認為，歐洲車企在製造和品牌擁有豐富經驗，中國企業在數字化、軟件和自動駕駛技術開發上具有優勢，認為加強合作，能夠將更多創新產品帶入市場。"
68bfef60eee6da38c4ce0aab,土瓜灣中電電動車撞途人及兩架私家車 一死五傷,2025-09-09 18:40,2025-09-09 19:00,local,tvb,https://news.tvb.com/tc/local/68bfef60eee6da38c4ce0aab,"中電一輛電動車在土瓜灣，撞到兩個途人及兩部私家車，釀成一死五傷。

涉事的中電電動車，車頭嚴重損毀，前座車門凹陷，被撞到的其中一輛私家車，車頭亦嚴重損毀，車尾撞向牆身變型，旁邊的客貨車亦受到波及。現場違下血跡，以及雨傘及鞋等物品。

出事的中電電動車，下午三時半駛入馬頭圍邨停車場時，先撞到兩名途人，再撞向私家車和客貨車。其中一名被撞的女途人，送院搶救後不治，另外一名途人，以及電動車司機和三名乘客輕傷送院。"
68c001c8eee6da38c4cea5fc,內地網購平台商戶聲稱可訂製「香港學生證」 大律師警告用偽證最高囚14年,2025-09-09 18:30,2025-09-09 19:00,local,tvb,https://news.tvb.com/tc/local/68c001c8eee6da38c4cea5fc,"近日內地網購平台，有商戶聲稱可訂製「香港學生證」，冒充任何一間香港的院校都可以。有大律師警告，行使這類「偽證」，會觸犯虛假文書等罪行。

大專生憑學生證，除了可自由進出校園，出示亦可享有不少學生優惠。近日在內地網購平台「拼多多」，有網店標榜可以製作「香港學生證」，提供個人資料、上傳相片，可指定印上哪間大學和學科。港大、浸大及城大等的款式都有，一張賣40多元人民幣。其中一間獲過百條評價，有買家形容和「真的」出入不大，還原度很高。

大學生馬小姐說：「是最近熱門討論的，因此看到。都幾惡劣，可能冒充學生，去享用大學福利。」

大學生羅小姐指出：「用假學生證入學校，可能對學校學生和老師，都會有影響、構成傷害。」

大學生陳先生表示：「驚訝為何會有，不明白為何要整這些學生證出來，可能會冒認是這間學校的學生，拿來做不好的事，影響學校形象。」

有大律師指，持有或使用仿真「學生證」，是涉嫌管有和行使虛假文書，最高可判囚14年。

執業大律師陸偉雄稱：「拿出來擺動和使用，目的是令到人相信學生證是真的，已經干犯罪行，買了藏有在身上或放在家中，都會干犯罪行。你用那張學生證時，可能會和其他人一齊，如果其他人同時知道你正在用假證，全部人都會一併告串謀詐騙罪。獲取折扣，因為用學生證，即詐騙電腦公司，這樣會告串謀詐騙。」

本台向各間大學查詢，港大回覆指知悉事件，有需要時會尋求法律意見，採取適當行動。

警方上月亦曾拘捕四名男子，偽造和使用以百計的假大學學生證，以優惠價買平板電腦等電子產品，再轉售圖利。"
68bffad6eee6da38c4ce741b,時事通識｜載人升空氣球,2025-09-09 18:26,2025-09-09 18:30,local,tvb,https://news.tvb.com/tc/local/68bffad6eee6da38c4ce741b,"香港國際熱氣球節主辦單位因未獲發牌照，取消乘坐熱氣球升空的環節，令不少入場人士失望。

坐氣球升空在香港並非新事物，曾用作表演和宣傳，亦是海洋公園的遊樂設施。

香港早在百多年前就有熱氣球出現，據1891年1月初的報章報道，跑馬地馬場舉行收費的載人熱氣球表演。1984年一套以香港航空事業為主題的新郵票，其中一枚就描繪了當日的熱氣球。2003年的維園中秋綵燈會，亦安排市民乘坐熱氣球，市民捐出50元作慈善用途，就可以乘坐熱氣球，升上三十米半空賞月。

海洋公園2007年初推出遊樂設施「七彩昇空天地」，就利用氦氣氣球載人升空六十米俯瞰南區景色，但在2012年6月底，氣球下降時接縫出現缺口，洩漏氦氣急墜，造成六人受傷，海洋公園其後宣布「七彩昇空天地」完成歷史任務，並將該景區規劃為表演及展覽場地。

<a href=""https://news.tvb.com/tc/programme/behindtheheadlines"" target=""_blank"" rel="""">點擊重溫其他集數</a>"
68bffb04eee6da38c4ce75e5,第十二批在韓志願軍烈士遺骸周五回國 港澳優秀師生代表親赴瀋陽迎接,2025-09-09 18:01,2025-09-09 19:00,local,tvb,https://news.tvb.com/tc/local/68bffb04eee6da38c4ce75e5,"第十二批在韓志願軍烈士遺骸將於周五回國，港澳優秀師生代表將到瀋陽迎接，而安葬儀式將在周六舉行。

據介紹，退役軍人事務部已同南韓國防部達成一致，韓方於周五向中方移交30名志願軍烈士遺骸和遺物，而中方高級別代表團組解放軍儀仗司禮大隊、運-20運輸機等，將在周三赴南韓執行交接任務。周四中午在南韓仁川志願軍烈士遺骸臨時安置所，還會舉行裝殮儀式，簽署交接書。周五當天，中方代表團組和駐韓使館人員會在仁川國際機場停機坪，舉行悼念儀式。

今年是抗美援朝75周年，為配合烈士遺骸歸國安葬活動，周五當天還將邀請港澳優秀師生代表到瀋陽迎接。

退役軍人事務部相關負責人又指，截至目前，已經完成十一批共981位，在韓志願軍烈士遺骸鑒定比對，並成功為28位志願軍烈士，確認身份並找到遺屬。安葬儀式將在周六舉行。"
68bff7c9eee6da38c4ce5605,港股收市升逾300點連升三日 創近四年新高,2025-09-09 17:47,2025-09-09 19:15,finance,tvb,https://news.tvb.com/tc/finance/68bff7c9eee6da38c4ce5605,"港股收市升超過300點，連升三日，創近四年新高。

美國減息預期增加，繼續利好大市氣氛。大市高開77點後，升幅進一步擴大最多升近400點，曾經突破兩萬六關口，全日收市升304點，報25,938點，成交2,940億元。

富昌金融集團聯席董事譚朗蔚說：「今次(美國)減息預期真的有膨漲，現時看美聯儲觀察，九月、十月和十二月。總共三次(減息)、每次25點子。全球尤其是新興市場，港股等等，應該會受惠。「放水」是根本性改變、向好的。26,000點之後，28,000點曾經說過，當然不會一帆風順。」

科網股帶動大市，騰訊上升超過百分之1，創超過一年新高。阿里巴巴升百分之3，重上140元，見半年高位。京東健康和阿里健康，是表現最好的兩隻藍籌。

有報道指，世茂集團有貸款獲延長期限，股價上升兩成七。其他內房股亦有支持。
雅居樂、合景泰富和碧桂園，升幅一至兩成。

金價再破頂，赤峰黃金升一成一。山東黃金、靈寶、紫金和招金，上升百分之3至7，齊創新高。"
68bff72feee6da38c4ce5112,香港中醫醫院與三間大學簽署合作協議 將於臨床服務、教學和科研展開合作,2025-09-09 17:45,2025-09-09 18:15,local,tvb,https://news.tvb.com/tc/local/68bff72feee6da38c4ce5112,"香港中醫醫院與浸會大學，中文大學和香港大學，簽署合作協議。

簽署儀式由醫務衞生局局長盧寵茂見證。香港中醫醫院與三間大學，將於臨床服務、教學，和科研三方面展開合作。

選址將軍澳百勝角路的中醫醫院，將於12月分階段投入服務。採用公私營合作模式，提供純中醫、中醫為主及中西醫協作模式的臨床服務，包括內外科、兒科及針灸等。

醫院將設有400張病床，70間診症室及45間治療室。預計門診每年可接待約40萬人次。

醫務衞生局局長盧寵茂指出：「以香港中醫院，作為三間大學的教學醫院後，我們不論本科或研究院的中醫藥學的學生，均可以有更多病例，作為教學培訓的以至科研創新的用途。三間大學的中醫藥方面的專家，亦可以他們的豐富的臨床經驗，幫助中醫院提高服務水平，亦可與中醫院合作，建立中醫藥方面的臨床標準，以至臨床指引，很快的去提升我們中醫藥方面的服務。」"
68bff3d2eee6da38c4ce334b,大行科工首日掛牌造好 收報56.9元,2025-09-09 17:30,2025-09-09 18:15,finance,tvb,https://news.tvb.com/tc/finance/68bff3d2eee6da38c4ce334b,"內地最大的摺疊自行車公司大行科工首日掛牌造好。

收報56.9元，較招股價49.5元，高近一成半。以每手100股，不計手續費計算，一手帳面賺740元。股份公開發售獲超額認購約7,557倍。一手中籤率為百分之0.02，而認購3,960手的「頂頭槌」，亦未能穩獲一手。

股份集資淨額3.4億元，用於擴大營運規模，加強經銷網絡和研發能力。"
68bfeff9eee6da38c4ce0d9b,工信部指絕不能容忍非理性競爭毀掉企業和產業 將開展專項整治行動,2025-09-09 17:14,2025-09-09 17:30,finance,tvb,https://news.tvb.com/tc/finance/68bfeff9eee6da38c4ce0d9b,"國家工信部表示，絕不能容忍非理性競爭毀掉企業、產業，將針對個別領域的誇大和虛假宣傳，惡意詆毀攻擊等網絡亂象，開展專項整治行動，規範生產行為。

工信部部長李樂成表示：「我們工信部會同相關部門一道，依法依規治理新能源汽車，光伏等重點行業的非理性競爭，在各方的共同努力下，應該說有了初步的成效。抓行業必須抓治理，實現新型工業化，建設現代化產業體系，必須推進行業治理的現代化。我們講，企業、產業的培育可謂千辛萬苦，而非理性競爭毀掉一個企業，毀掉一個產業，可謂一夜之間，我們絕不能容忍這種事情發生。」"
68bfefebeee6da38c4ce0cb7,亞太區股市普遍向好 日本股市創新高後回軟,2025-09-09 17:14,2025-09-09 17:30,finance,tvb,https://news.tvb.com/tc/finance/68bfefebeee6da38c4ce0cb7,"亞太區股市普遍向好，但日本股市創新高後回軟。

日經指數曾經升穿44,000點關口，其後無以為繼，收市略為倒跌。

澳洲股市開市見全日高位，收市跌至8,800點邊緣。

南韓股市連升第六日，見逾四年高位。

台灣股市五連升，並以接近全日高位收市。"
68bfefe1eee6da38c4ce0bef,內地股市四大指數全線下跌,2025-09-09 17:14,2025-09-09 17:30,finance,tvb,https://news.tvb.com/tc/finance/68bfefe1eee6da38c4ce0bef,"內地股市四大指數全線下跌。

深圳創業板指數跌幅較大，超過百分之2。

上證綜合指數險守3,800點關口。滬深京三市成交縮減，至不足2.2萬億元人民幣。

消費電子和半導體板塊下跌。黃金、銀行和房地產股逆市上升。"
68bfb5d4eee6da38c4cc4543,國際熱氣球節｜除「友邦熱氣球跑」外 即日起接受退款,2025-09-09 16:36,2025-09-09 17:00,local,tvb,https://news.tvb.com/tc/local/68bfb5d4eee6da38c4cc4543,"中環海濱舉行的國際熱氣球節，即日起接受退款。不過活動期間舉行的跑步活動，就不獲退款。

國際熱氣球節上周四起，一連四日在中環海濱舉行，宣傳以「繫留」方式，載人坐熱氣球升空，但因安全問題未獲批出牌照，環節取消，不少入場人士不滿，主辦機構盛事(亞洲)有限公司，宣布全數退款。

整項活動四日，五種門票都可獲退款，即早上門票、黃昏門票、兩天黃昏票、三天門票，及二人同行票，即使曾額外入場一次，同樣可以申請，必須經官方渠道購買，包括快達票、大麥網、Trip.com等。

即日起至下月8日晚上10時前，可經電郵或致電熱線，提交退款申請，需要提供與銀行帳戶一致的姓名、銀行帳戶資料、購票憑證及門票交易編號，和有效聯絡電話號碼。所有完整正確的申請資料，將於11月7日前透過銀行轉帳、轉數快或雙方協議其他方式完成退款。但不包括任何手續費。

不過，熱氣球節期間舉行的「友邦熱氣球跑」門票，就不設退票，主辦單位未有交代原因。這項活動收費480元至980元，參加者會獲得星期六早上門票。

主辦單位熱線表示：「6468-5897的留言信箱，已經滿了，請你遲些再打過來。」

官方退款熱線，留言信箱長時間爆滿，一度「飛線」到另一號碼，留言信箱同樣爆滿。"
68bfe5f8eee6da38c4cdc111,日本股市收市倒跌 分析料企業基本因素難支持更高估值再升空間有限,2025-09-09 16:31,2025-09-09 17:00,finance,tvb,https://news.tvb.com/tc/finance/68bfe5f8eee6da38c4cdc111,"日本股市曾突破四萬四關口，創出新高，但收市倒跌。有分析認為，企業基本因素難以支持更高估值，日股再升空間有限。

美日關稅談判上表現弱勢，國內物價高漲問題一直未解決。面對下台壓力的石破茂，以避免黨內分裂為由，辭任日本首相。

市場憧憬新任首相或推出寬鬆的貨幣政策，利好日股表現，日經指數首次突破44,000點關口，創出新高。但之後掉頭回落，全日收市倒跌184點，跌幅百分之0.4。

分析認為，日股由四月初以來，已累積過萬點升幅。除非日圓匯價顯著回落，為企業出口帶來支持，否則日股再升空間有限。

高富金融投資總監梁偉民表示：「舉個例『股神』很喜歡買的五大商社，預計今年的財年，收入盈利只得低單位數的增長，很多不會超過百分之5，甚至有部分商社，可能在收入盈利方面會有倒退的情況。當日經已經去到頂位時，企業盈利沒有再增長，這個都是叫減分，始終過去數年的高增長，來自日圓轉弱。如果日圓不是跌穿150，或去到155的話，我覺得日股在這些位置未必有很多的上升空間。」

石破茂下台，接任首相的自民黨總裁選舉戰隨即展開。前首相小泉純一郎幼子，現任農林水產大臣小泉進次郎，以及前經濟安全保障大臣高市早苗，在黨內的呼聲最高。

高市早苗被視為「安倍經濟學」的信奉者，她曾嚴厲批評日本央行加息的計劃，並支持推出更大規模的財政刺激措施。

民意調查顯示，高市早苗的支持率暫時稍為領先。"
68bfe5d8eee6da38c4cdbfb5,多個團體籲盡快通過控煙條例草案 保障公眾健康,2025-09-09 16:31,2025-09-09 17:00,local,tvb,https://news.tvb.com/tc/local/68bfe5d8eee6da38c4cdbfb5,"吸煙與健康委員會等多個團體，呼籲立法會盡快通過控煙條例草案，保障公眾健康。

支持加強控煙的團體，來自醫學、教育及社福等40個界別，他們指上次大幅修訂控煙條例已是18年前，香港控煙工作落後其他先進地區。又提到立法會接獲的建議書中，有逾30份來自商界等人士支持，反映控煙和經濟並非背道而馳。

要求政府盡快實施，禁止另類煙機及邊行邊吸煙等，中長期控煙措施，並從根源阻截煙草毒害青少年。"
68bfe20beee6da38c4cd9a78,葉吉江危駕罪成 民青局暫停其區議員職能及職務一周,2025-09-09 16:14,2025-09-09 16:30,local,tvb,https://news.tvb.com/tc/local/68bfe20beee6da38c4cd9a78,屯門區區議員葉吉江早前危駕罪成，民青局決定暫停其區議員職能和職務一星期。
68bfde92eee6da38c4cd8aae,港股收市報25938點 升304點,2025-09-09 16:10,2025-09-09 16:30,finance,tvb,https://news.tvb.com/tc/finance/68bfde92eee6da38c4cd8aae,"港股收市報25,938點，升304點。阿里健康升百分之10。藥明生物跌百分之3.3。"
68bfd450eee6da38c4cd2fd4,梁志堅指樓價已有回升跡象,2025-09-09 15:16,2025-09-09 15:45,finance,tvb,https://news.tvb.com/tc/finance/68bfd450eee6da38c4cd2fd4,"地產建設商會已就新一份《施政報告》向政府提交建議，其中包括放寬100元印花稅徵收門檻，以及調整投資移民買樓限制等措施。

地產建設商會執委會主席梁志堅又指，樓價已有回升跡象。

地產建設商會執委會主席梁志堅表示：「怎樣都好，地產一定要看經濟環境怎樣，過往數年經濟都是比較滑落了，照情況看應該一直有機會復蘇，我估計由現時開始這段時間，樓價一直已穩定下來，亦有機會慢慢回升，我認為至年底，怎樣都會有百分之5至6的增長。」"
68bfc9c9eee6da38c4ccdc87,深圳海關破獲由香港走私活體觀賞魚入境案,2025-09-09 14:31,2025-09-09 15:15,local,tvb,https://news.tvb.com/tc/local/68bfc9c9eee6da38c4ccdc87,"深圳海關破獲由香港走私活體觀賞魚入境案。

央視報道，深圳皇崗口岸海關人員，近日在檢查一輛入境的私家車時，在第三排座椅下方同汽車尾廂，分別發現一個白色大膠袋，打開後見到裡面有多個小膠袋，每一個膠袋都裝著一條活體觀賞魚，共188條。

經鑒定，當中有149條魚屬於外來物種，其中一種外型橙紅色並有藍色斑紋的火焰神仙魚，佔總數過半。

海關提醒，外來物種一旦脫離人工管控，可能因缺乏天敵而大量繁殖，對本土生物多樣性造成影響。188條檢獲的觀賞魚，已按規定處理。"
68bfd07deee6da38c4cd177a,世界人才排名香港躍升至全球第四亞洲第一 李家超指證明創科及人才政策收效,2025-09-09 14:15,2025-09-09 15:45,local,tvb,https://news.tvb.com/tc/local/68bfd07deee6da38c4cd177a,"國際管理發展學院公布2025年世界人才排名，香港躍升至全球第四、歷來最高排名，亦是亞洲第一。

政府致力「搶人才」，位於瑞士洛桑的國際管理發展學院，公布2025年世界人才排名，在69個經濟體中，瑞士排首位，緊隨的是盧森堡和冰島，香港就由去年第九位，躍升至第四位。

三個人才競爭力因素，香港的排名都比去年高，其中「就緒度」由去年第四升至第三，「投資及發展」排第十二，而「吸引力」排名就升至第二十。

至於其他指標，香港的科學學科畢業生百分比繼續高踞全球第一，財務技能排名上升至全球第三，而管理層薪酬和管理教育效能，均位列全球第五。

行政長官李家超出席一個論壇時指，排名證明政府在教育、創新科技，及引進人才方面的政策措施收效。

行政長官李家超表示：「值得一提的是，這份全球人才排名，確認香港在科學領域的卓越成就，使我們在科學領域畢業生指標中位列全球第一。香港是全球唯一擁有五所世界百強大學的城市，我們優秀的高等學府，培育出世界級科學家及各領域的研究人才。憑藉這股優勢，香港正快速崛起為創新科技樞紐。」

另外政府發言人指，截至八月底，各項輸入人才計劃共收到逾52萬宗申請，超過20萬人才已抵港。政府將會繼續對準香港八大中心戰略定位，加強培育及引進人才。"
68bfbef9eee6da38c4cc8a1f,慕尼黑車展周二開幕 中國參展商116間成德國以外最多國家,2025-09-09 13:45,2025-09-09 14:30,finance,tvb,https://news.tvb.com/tc/finance/68bfbef9eee6da38c4cc8a1f,"德國慕尼黑車展周二開幕，今屆來自中國的參展商有116間，是德國以外最多參展商的國家。

中國汽車工業協會認為，中歐產業合作是推動汽車業轉型的關鍵動力。

比亞迪執行副總裁李柯出席德國慕尼黑車展。她表示，集團今年底在歐洲將有超過1,000間門店，遍及32個國家。

兩年前在歐洲銷售的車款只有6款，至今已增加超過一倍。未來半年，將再推出3至4款混能車。預計集團在歐洲的混能車銷量，很快會超越純電動車。

她又透露，目前正與數百家歐洲供應商洽談合作，匈牙利的新電動車廠房會在年底前投產。

歐洲的電動車龍頭大眾汽車便發布全新小型電動車，預計明年上半年上市。行政總裁奧博穆表示，集團在歐洲電動車市場佔有率達兩成八，期望可進一步提升。也又提到，美國提高進口關稅，將可能令集團損失數十億美元。

每兩年舉辦一次的德國慕尼黑車展，是全球汽車產業的風向標，初步統計今屆參展商有748間，有五成七來自德國以外，比例是歷屆最高。

中國是德國以外，最多參展商的國家，有116間。涵蓋新能源製造、三電系統、智能化軟硬體等全產業鏈。

據統計，中國汽車品牌在歐洲汽車市佔率約百分之5.3，單計純電動車市佔率近一成，不少中國車企都希望，加快擴展歐洲市場的步伐。

廣汽集團董事長馮興亞指：「中國擁有全球最大規模的市場，也有全球最廣泛的用戶，這一點決定了中國車企必須要以用戶需求為核心，可以說在新能源，智能網聯等領域的技術創新，中國車企已經建立起全球領先的競爭優勢。」

零跑汽車創始人朱江明表示：「我們可以在非常短的時間內，鋪設了1,700家海外經銷商渠道的網絡門店。我們可能還會跟斯泰蘭蒂斯供應一部分零部件，我們可以在原有整車產品的基礎上，我有一些零部件的收入。」

中國汽車工業協會認為，中歐產業合作是推動汽車業轉型的關鍵動力。

中國汽車工業協會副秘書長柳燕指出：「我們認為，本土化、多元化、優勢互補與合作共贏，是走進歐盟模式的關鍵詞，產業鏈各方『組團出海』也是大勢所趨，有助於形成合力，為中國汽車在歐盟市場的發展，提供更好的支撐。」

有分析認為，歐洲車企在製造和品牌擁有豐富經驗，中國企業在數字化、軟件和自動駕駛技術開發上具有優勢。認為加強合作，能夠將更多創新產品帶入市場。"
68bfb90aeee6da38c4cc5c34,恒指一度突破兩萬六關口 阿里巴巴見半年高位,2025-09-09 13:19,2025-09-09 14:00,finance,tvb,https://news.tvb.com/tc/finance/68bfb90aeee6da38c4cc5c34,"恒指一度突破兩萬六關口，創近四年新高。

阿里巴巴升百分之2，重上140元，見半年高位。

今日除淨的快手升百分之3。

騰訊升近百分之1，創逾一年新高。

金價再破頂，赤峰黃金升一成三。"
