id,title,date,scrape_time,section,source,url,news_content
695adfaec26d920e36665449,過去兩天本港住宅二手成交量略為回升 新盤交投仍未見活躍,2026-01-05 06:16,2026-01-05 06:45,finance,tvb,https://news.tvb.com/tc/finance/695adfaec26d920e36665449,"聖誕及新年假期過後，本港住宅二手成交量在過去兩天略為回升；但新盤交投在沒有大型新盤推售下，成交仍未見活躍。

據地產代理統計，剛過去的周六及周日，全港十大藍籌屋苑二手成交只有約12宗，少過上周同期約15宗，但仍然是連續兩周達雙位數水平。有地產代理認為，剛過去的周末睇樓氣氛明顯改善，料節日因素消散後，二手交投將逐涉恢復正常。

港島區，太古城兩日錄得約3宗成交，平均實用成交呎價接近14,500元。當中華山閣低層F室實用面積685平方呎，三房間隔，以930萬元賣出，實用呎價13,577元。原業主於2024年以839萬元買入單位，持貨約一年，帳面獲利91萬元，單位升值近一成一。

九龍區，美孚新邨亦有約3宗成交。當中包括三期百老匯街65號中層B室，實用面積509平方呎，兩房間隔。放盤僅1日，就成功以550萬元賣出，實用呎價10,806元。

新界區，東涌映灣園有約1宗成交，為9座低層G室，實用面積756平方呎三房一套間隔，以745萬元賣出，實用呎價9,854元。原業主於2016年以590萬元買入單位，持貨超過9年，帳面獲利155萬元，期間單位升值超過兩成六。

新盤方面，過去兩日有約50宗成交，較上周的約37宗交投略為回升。當中由信和置業夥拍嘉華及中國海外的元朗新盤，兩日賣出7伙。至於由萬科香港發展的大埔新盤，單計周日就賣出6伙，過去兩日共賣出7伙，套現超過4,300萬元。"
695adfd2c26d920e3666558c,油組及盟友維持2月及3月產量不變 未討論委內瑞拉問題,2026-01-05 06:16,2026-01-05 06:45,finance,tvb,https://news.tvb.com/tc/finance/695adfd2c26d920e3666558c,"石油輸出國組織及盟友維持2月和3月產量不變。

油組及盟友發表聲明，指八個主要產油國決定繼續暫停增產。聲明指出由於季節性因素，沙特阿拉伯、俄羅斯、伊拉克、阿拉伯聯合酋長國等國家，決定在2月和3月暫停增產步伐，產量與去年12月及今年1月相同。但同時指出，為維護石油市場穩定，八國將根據市場情況靈活調整增產節奏。市場對供應過剩的擔憂加劇，令油價去年下跌一成八，創2020年以來最大年度跌幅。更連跌第三年。

另外，與會國家在會上並未討論委內瑞拉的問題，該國目前的石油日產量約80萬桶，佔全球供應量不足百分之1。"
695a9bb6c26d920e3664518e,天氣家族｜要再次準備厚衫 隨後兩三日轉冷,2026-01-05 06:15,2026-01-05 06:30,local,tvb,https://news.tvb.com/tc/local/695a9bb6c26d920e3664518e,
695acbffc26d920e3665bed1,荃灣中心有單位起火 一名女子吸入濃煙不適送院,2026-01-05 04:21,2026-01-05 04:45,local,tvb,https://news.tvb.com/tc/local/695acbffc26d920e3665bed1,"荃灣中心一個單位起火，一名女子吸入濃煙不適送院。

凌晨二時許，警方接報太原樓高層一個單位起火冒煙，消防員到場破門進入單位將火撲熄，救出一名吸入濃煙的女住客，救護員將她送院治理。

火警期間，兩百多名住客疏散到安全地方，起火原因有待調查。"
695a8b9dc26d920e3663d134,解放軍駐港部隊開展本年度軍事訓練 提高履行香港防務能力,2026-01-04 23:47,2026-01-05 00:15,local,tvb,https://news.tvb.com/tc/local/695a8b9dc26d920e3663d134,"解放軍駐港部隊開展本年度軍事訓練。

海、陸、空官兵在訓練場列隊，進行開訓動員。三軍展開新一年度軍事訓練，提高履行香港防務能力。動員結束後，官兵展開實戰化課目訓練。"
695a808ec26d920e3663876b,石硤尾美如樓火警｜初步調查指有充電器起火肇禍 消防籲正確學習用喉轆,2026-01-04 23:00,2026-01-04 23:15,local,tvb,https://news.tvb.com/tc/local/695a808ec26d920e3663876b,"石硤尾邨火警，73歲男戶主死亡，八人受傷送院，其中兩人情況嚴重。消防初步調查，指單位內有充電器起火導致火警。

由觀眾提供片段見到，起火單位窗口冒出火光，濃煙升上半空。現場是石硤尾邨，早上約八時有居民報案指，美如樓有單位起火冒煙。消防到場射水、將火撲熄，在起火單位發現一名男子，當場證實死亡。

消防救出多人，懷疑吸入濃煙不適，需要送院治理，包括男戶主的太太。有獲救長者需戴氧氣罩協助呼吸，逾200名居民疏散到地下。

起火單位在21樓，有同層住戶指，事發時有很大煙。

美如樓居民周先生稱：「外面的濃煙太厲害，完全無法出去，我唯有關門，挺恐怖的，全屋都是煙、看不到東西，很多消防隱患在這棟樓，很多住戶如何說都不聽，開了防煙門，將紙皮擺在走廊。」

美如樓居民鄺先生說：「我跑下去21樓，見到兩個年輕人在協助救火，說沒有水，然後看到煙、電梯都停了。」

大廈低層中午解封後，部分樓層有防煙門打開，房委會大半年前已張貼告示，提醒住戶保持防煙門關閉。涉事單位火場面積約5米乘4米。

消防處表示，單位有大量雜物，初步調查有充電器起火導致火警。又指起火樓層沒發現防煙門打開，而大廈各項消防設備運作正常。

消防處署理助理消防區長葉錦江指出：「我們測試了大廈的消防裝置和設備，也沒有不妥當地方，包括涉事樓層21樓。同事使用美如樓消防裝置，發覺使用正常，所以我想趁機會和市民說要正確學習使用喉轆。」

美如樓對面的宏恩基督教學院，在美如樓圍封期間，自發開放予居民休息，並提供小食給有需要居民。"
695a79c8c26d920e366359ba,宏福苑五級火｜當局稱會協助災民盡快過渡至中期住屋安排,2026-01-04 22:31,2026-01-04 23:15,local,tvb,https://news.tvb.com/tc/local/695a79c8c26d920e366359ba,"有傳媒報道，部分宏福苑災民入住青年宿舍，約兩星期後接獲通知需於本月遷出。民政及青年事務局表示，會協助災民盡快過渡至中期住屋安排。

宏福苑大火後，包括宏志閣在內的八座大廈至今仍未解封。民青局發言人指，部分仍然留在青年宿舍住宿的災民，如在本月31日後，未能及時遷往中期住宿居所，青年宿舍營運者將按實際情况，酌情處理個案，並會聯同「一戶一社工」協助居民。

局方表示，政府上月宣布推出業主租金補助，每年提供15萬元，協助解決中長期的住宿安排，當時已表示，就酒店及青年宿舍的住宿安排，要因應營運者的房間供應。

目前不少居民已遷出或計劃遷出青年宿舍，在外租住單位或搬往過渡屋。宿舍營運者將重啟公眾申請宿位的安排。"
695a7991c26d920e36635815,中環冬日小鎮中聖誕燈飾與「光影匯」今日結束,2026-01-04 22:30,2026-01-04 23:15,local,tvb,https://news.tvb.com/tc/local/695a7991c26d920e36635815,"旅發局在中環舉行的冬日小鎮，當中聖誕燈飾在今日結束。

不少市民和遊客趁最後一日到場，在燈飾前拍照「打卡」。

同場在八棟地標大廈外牆舉行的「光影匯」，亦會在今晚結束。至於在遮打道一帶懸掛的燈飾，就會跨越農曆新年，每晚亮燈直至下月22日。"
695a1ec2c26d920e366058dc,石硤尾美如樓火警｜73歲男戶主當場證實死亡 兩名傷者情況嚴重,2026-01-04 22:22,2026-01-04 23:15,local,tvb,https://news.tvb.com/tc/local/695a1ec2c26d920e366058dc,"石硤尾邨有單位起火，73歲男戶主當場證實死亡，八人受傷送院，其中兩人情況嚴重。消防初步調查，指單位內有充電器起火導致火警。

由觀眾提供片段見到，起火單位窗口冒出火光，濃煙升上半空。

現場是石硤尾邨，早上約八時有居民報案指，美如樓有單位起火冒煙，消防到場射水、將火撲熄，在起火單位發現一名男子，當場證實死亡。

消防救出多人，懷疑吸入濃煙不適，1男7女要送院治理，有獲救長者需戴氧氣罩協助呼吸，逾二百名居民疏散到地下。

起火單位在21樓，有同層住戶指，當時大量濃煙湧入他的單位。

美如樓居民周先生說：「外面的濃煙太厲害，完全無法出去，我唯有關門，挺恐怖的，全屋都是煙、看不到東西。很多消防隱患在這棟樓，很多住戶如何說都不聽，開了防煙門，將紙皮擺在走廊。」

美如樓居民鄺先生表示：「我跑下去21樓，見到兩個年輕人在協助救火，沒有水，然後看到煙、電梯都停了。」

大廈低層中午解封後，可以見到部分樓層，防煙門打開，房委會大半年前已張貼告示，提醒住戶保持防煙門關閉。

涉事單位火場面積約5米乘4米，消防處表示，單位有大量雜物，會循包括電力故障等方向，調查起火原因，又指起火樓層沒發現防煙門打開，而大廈各項消防設備運作正常。

消防處署理助理消防區長葉錦江稱：「我們測試了大廈的消防裝置和設備，也沒有不妥當地方，包括涉事樓層21樓。同事使用美如樓消防裝置，發覺使用正常，所以我想趁機會和市民說要正確學習使用喉轆。」

美如樓對面的宏恩基督教學院，在美如樓圍封期間，自發開放予居民休息，並提供小食給有需要居民。"
695a6f2ac26d920e3663175a,八分鐘本地新聞重點｜石硤尾美如樓火警／中大醫院鍾健禮專訪／工展會周一閉幕,2026-01-04 21:46,2026-01-04 22:45,local,tvb,https://news.tvb.com/tc/local/695a6f2ac26d920e3663175a,"【石硤尾美如樓火警】

石硤尾邨有單位起火，73歲男戶主當場證實死亡，八人受傷送院，其中兩人情況嚴重。消防指，起火單位內有大量雜物，會循包括電力故障等方向調查起火原因。

由觀眾提供片段見到，起火單位窗口冒出火光，濃煙升上半空。

現場是石硤尾邨，早上約八時有居民報案指，美如樓有單位起火冒煙，消防到場射水、將火撲熄，在起火單位發現一名男子，當場證實死亡。

消防救出多人，懷疑吸入濃煙不適，1男7女要送院治理，有獲救長者需戴氧氣罩協助呼吸，逾二百名居民疏散到地下。

起火單位在21樓，有同層住戶指，當時大量濃煙湧入他的單位。

美如樓居民周先生說：「外面的濃煙太厲害，完全無法出去，我唯有關門，挺恐怖的，全屋都是煙、看不到東西。很多消防隱患在這棟樓，很多住戶如何說都不聽，開了防煙門，將紙皮擺在走廊。」

美如樓居民鄺先生表示：「我跑下去21樓，見到兩個年輕人在協助救火，沒有水，然後看到煙、電梯都停了。」

大廈低層中午解封後，可以見到部分樓層，防煙門打開，房委會大半年前已張貼告示，提醒住戶保持防煙門關閉。

涉事單位火場面積約5米乘4米，消防處表示，單位有大量雜物，會循包括電力故障等方向，調查起火原因，又指起火樓層沒發現防煙門打開，而大廈各項消防設備運作正常。

消防處署理助理消防區長葉錦江稱：「我們測試了大廈的消防裝置和設備，也沒有不妥當地方，包括涉事樓層21樓。同事使用美如樓消防裝置，發覺使用正常，所以我想趁機會和市民說要正確學習使用喉轆。」

美如樓對面的宏恩基督教學院，在美如樓圍封期間，自發開放予居民休息，並提供小食給有需要居民。


【陳茂波：在港上市新經濟公司交投量佔港股三成】

財政司司長陳茂波表示，在港上市新經濟公司交投量佔港股三成，預料今年前沿科企陸續有來，未來會憑藉金融和創科聯動，推動經濟高質量發展。

財政司司長陳茂波在網誌撰文指今年首個交易日上市的壁仞科技，是港股GPU，即圖像處理器「第一股」，亦是本港首批引進的重點企業，被喻為「國產GPU四小龍」。

而截至去年底共有逾400間，新經濟公司在港上市，雖然只佔公司數目約一成半，但不論是市值和成交額都佔大市約三成，預料今年的上市申請中前沿科企陸續有來。

陳茂波表示，除歡迎它們來港上市集資，更鼓勵它們落戶本港，在這設立科研中心，並把成果轉化以及設立先進製造設施，亦支持在香港成立區域或國際總部，通過香港走向國際市場。例如壁仞科技就是2023年他出訪上海後，同年引進。

陳茂波表示，香港有「內聯外通」的獨特優勢，能連通各個生態圈的創科力量，特別是融通國際資金，匯聚國際頂尖科研人才，國際專利授權便利，以至國際化應用場景等，為創科企業「出海」提供有力支撐。

他又指科技園公司2024年，與杭州創新孵化中心簽署合作協議至今，已有12家來自浙江包括杭州的創科企業落戶科學園。未來會憑藉金融和創科的聯動發展，建立更蓬勃的創科和產業生態，推動經濟高質量發展。


【賊人假扮水務署職員涉最少三宗入屋盜竊案】

警方拘捕一名男子，涉嫌假扮水務署職員入屋盜竊，至少涉及三宗案件，警方提醒市民、特別是長者，切勿輕易讓陌生人入屋。

警方星期六以涉嫌入屋犯法罪，拘捕一名50歲本地男子，並檢獲相信是涉案贓物，包括鈔票、八達通及手機等。

警方聖誕節期間接獲三宗報案，位於長沙灣、深水埗及屯門的唐樓和公屋單位，先後遭人入屋盜竊。

匪徒訛稱是水務署職員，聲稱要入屋檢查水管，期間沒出示工作證，亦只是穿便服，而入屋後趁事主不為意，偷走放在當眼位置的財物，過程只是約一至兩分鐘，經調查後相信是同一人犯案。

深水埗警區刑事調查隊第十隊督察麥浿枬稱：「三宗案件犯案手法高度相似，受害人為70歲以上長者，賊人訛稱自己是水務署職員，專門針對欠缺閉路電視、鐵閘或保安的唐樓，或能透過走廊窗戶看到屋內情況的公共屋邨入手。特別是長者請提高警覺，切勿輕易相信陌生人，讓人進入單位前必須核實身份，提醒他們拿出證件。」

警方又提醒市民，避免將貴重物品放在當眼位置，而農曆新年假期將至，市民外遊前應鎖好門窗，加強家居防盜措施，避免賊人有機可乘。


【講清講楚｜專訪中大醫院鍾健禮】

中大醫院行政總裁鍾健禮稱，未來兩個月可能就24小時門診減價或推「套餐價」，又指當初顧問估計的生意模式太誇張，希望增加醫院的社會價值，游說各界可能要再延遲還款。

公立醫院大部分服務元旦起加價，中大醫院行政總裁鍾健禮在本台節目《講清講楚》稱，仍需時觀察是否多了病人求診，但相信24小時門診較大可能受惠。本身都正研究本月底或下月初，就這方面減價或推「套餐」。

中大醫院行政總裁鍾健禮說：「診症費相對外面不是太高，但為何市民都會擔心，到我們的急症或者二十四小時門診。很多時就是他們擔心有些隱形收費，或一些意外收費。希望給市民有確切性，來院時，很多時市民來到都是一些發燒、傷風、感冒，或者腸胃炎等，這一類輕症是否能夠確定性些，知道大約用多少錢，可以得到整體的醫療及藥。」

過去兩個月，中大醫院已接連減價，鍾健禮稱暫時接種疫苗人數有增加，例如預防「生蛇」的疫苗，由以前一個月只接種4至5針，增至77針。自去年七月他上任以來，首四個月的服務、手術量及總收入，按年分別多一成半。至今整體仍有虧損，但按年收窄五成。

他認為當初顧問估算，醫院啟用三至五年間，每年總收入達70億元，是過份樂觀。

鍾健禮指出：「這個數是很誇張，70億元是香港最高總收入的醫院，才能夠去到的數，我們去年做到23.8億元，邊際利潤，去到超過百分之20，這個其實於私家醫院中不常見，一般非牟利醫院在百分之10以下。」

兩度延期償還約40億元政府貸款，能否如期後年起夠錢還？鍾健禮稱年總收入達60億元才可，現時一半未到。

鍾健禮表示：「盡力去做只可以，難度相當高，錢是一方面，你能否達到社會價值，是更加重要，所以我為何這麼緊張現時要做好質素，亦都要將價格做得合理，只要市民支持這間醫院，我相信政府亦會去重新看這件事(再延遲還款)。」

至於能否降低醫護成本「節流」，他認為最重要增加服務量，屆時就要靠前線人手。

<a href=""https://news.tvb.com/tc/programme/ontherecord/6959b0dec26d920e365cc42b"" target=""_blank"" rel="""">點擊觀看節目重溫</a>


【工展會周一閉幕】

工展會明日閉幕，不少人趁假期入場購物，部分商戶推出優惠減價促銷。

臨近工展會尾聲，有擺檔的酒商推出「盲盒」抽獎吸客，花費50元就有機會抽中，價值數百至數千元的澳洲紅酒，部分人抽到心頭好。

梁女士說：「抽到了(價值)數千元的酒，一共付了四百多元，現在有很多酒，很開心。」

檔主表示，「盲盒」抽獎成功帶旺銷情。

工展會檔主黃先生指出：「年輕人很多，但老人家也很喜歡玩『盲盒』，抽完再抽，所以『盲盒』這個噱頭也挺好，很滿意。」

周日下午的維園人頭湧湧，工展會約900個攤位，有不少商戶都趁最後兩天減價促銷，吸引市民「掃貨」。

盧太稱：「買年糕，今天還會買枕頭，以及家裏有需要的(物品)，還會看平日吃的食品會不會比較便宜。

黃女士表示：「預算了約500元，沒有帶(購物)車來，起初以為沒有特別的東西要買，怎料來到就有要買的。」

亦有檔主表示，生意額較上屆遜色。

工展會檔主何女士指出：「今屆(生意額)比往屆差了一點，但還是比預期高，很多人購物時都不看便宜的，多數看貴價貨品。暫時沒有提供優惠，因為大部分貨品都賣完了。」

工展會將於周一閉幕，早上11時開放入場，提早一小時晚上8時就會關閉。工展會自上月13日起舉行，合共舉辦24天，每晚7時起免費入場。"
695a3df5c26d920e36615f5b,警破元朗製毒工場及毒品儲存倉 拘三人據悉包括歌手羅啟聰,2026-01-04 21:45,2026-01-04 22:00,local,tvb,https://news.tvb.com/tc/local/695a3df5c26d920e36615f5b,"警方拘捕兩男一女，涉嫌製毒和販毒，檢獲依托咪酯等多種毒品，值逾770萬元。

警方搜獲的毒品，包括7.9公斤可卡因、1.2公斤冰毒及259粒依托咪酯煙彈。

探員昨日突擊搜查元朗一個村屋單位，搜出這批毒品及製毒工具，初步調查相信單位是製毒工場及毒品儲存倉，運作約一個月。

拘捕兩名本地男子及一名內地女子，介乎21至35歲，分別報稱學生、歌手及無業。據了解，其中一個被捕的男人是歌手羅啟聰。"
695a5d97c26d920e3662724a,先施百貨深水埗分店最後一日營業 不少市民「掃貨」,2026-01-04 20:31,2026-01-04 21:00,local,tvb,https://news.tvb.com/tc/local/695a5d97c26d920e3662724a,"位於西九龍中心、開業逾30年的先施百貨分店，今天最後一日營業。

不少市民到場「掃貨」，部分商品以一折出售。門外貼有告示，稱「散聚終有時」。

先施深水埗分店於1994年開業，最初有多達七層，其後縮減至三層。結業後，先施百貨只剩下中環及旺角兩間分店。

廖小姐稱：「它結業都很可惜，(日後)有時候想買東西都很難再找到，被子、家具等日常用品都有，剛剛買了個電飯煲。」

何先生說：「因為今日是最後一天，它的貨品可能多些會便宜點，目標可能花400至500元，有點感觸，營運了30年，突然結業少了個去處。」"
695a5930c26d920e366246f2,內地三日元旦假期昨結束 有訪港旅客選擇今天回程避開人潮,2026-01-04 20:12,2026-01-04 20:45,local,tvb,https://news.tvb.com/tc/local/695a5930c26d920e366246f2,"內地一連三日元旦假期昨日結束，有訪港的旅客選擇今天才回程，避開人潮。另外，也有到內地旅遊的港人，趕在假期最後一天回港。

在西九龍高鐵站離境大堂，來乘搭高鐵的人流不算多，車站屏幕顯示，多班長途和短途車次仍有車票售賣。內地元旦一連三日元旦假期周六結束，調休後內地民眾周日就要上班，不過有人請多幾天假。

福建旅客柯先生稱：「元旦過來可能比較有氛圍一些，主要是購物，可能尖沙咀、銅鑼灣這些，兩個人花了兩、三萬元。」

廣州旅客廖女士說：「今天回去明天上班，跟人家約好時間了，只有3號4號兩天，兩天(花了)兩千多，也不多，隨便玩一下看一下，買不了多少東西，就是孩子買了一千多元玩具。」

抵港大堂人頭湧湧，有人自聖誕長假期起到內地玩，現在才回港。

曾女士指出：「這次去了新疆，玩了九日，很漂亮。西九龍人流一直還不錯，還行，不會說特別擁擠，過關都是高鐵站的人，過程挺流暢的。」

張小姐表示：「因為小朋友明天上學。內地平靚正，香港消費比較高，所以小朋友一般放假都回內地玩。」

港鐵公布，去年高鐵香港段載客量創新高。全年載客逾3,000萬人次，按年增加近一成七。單計上月27日，高鐵西九龍站錄得近14萬人次乘客，刷新單日乘客人次紀錄。香港段自2018年9月開通至今，累計乘客量已突破一億人次。"
695a5358c26d920e36621e74,本屆工展會最後兩天 有酒商推「盲盒」抽獎吸客,2026-01-04 19:47,2026-01-04 20:30,local,tvb,https://news.tvb.com/tc/local/695a5358c26d920e36621e74,"工展會明日閉幕，不少人趁假期入場購物，部分商戶推出優惠減價促銷。

臨近工展會尾聲，有擺檔的酒商推出「盲盒」抽獎吸客，花費50元就有機會抽中，價值數百至數千元的澳洲紅酒，部分人抽到心頭好。

梁女士說：「抽到了(價值)數千元的酒，一共付了四百多元，現在有很多酒，很開心。」

檔主表示，「盲盒」抽獎成功帶旺銷情。

工展會檔主黃先生指出：「年輕人很多，但老人家也很喜歡玩『盲盒』，抽完再抽，所以『盲盒』這個噱頭也挺好，很滿意。」

周日下午的維園人頭湧湧，工展會約900個攤位，有不少商戶都趁最後兩天減價促銷，吸引市民「掃貨」。

盧太稱：「買年糕，今天還會買枕頭，以及家裏有需要的(物品)，還會看平日吃的食品會不會比較便宜。

黃女士表示：「預算了約500元，沒有帶(購物)車來，起初以為沒有特別的東西要買，怎料來到就有要買的。」

亦有檔主表示，生意額較上屆遜色。

工展會檔主何女士指出：「今屆(生意額)比往屆差了一點，但還是比預期高，很多人購物時都不看便宜的，多數看貴價貨品。暫時沒有提供優惠，因為大部分貨品都賣完了。」

工展會將於周一閉幕，早上11時開放入場，提早一小時晚上8時就會關閉。工展會自上月13日起舉行，合共舉辦24天，每晚7時起免費入場。"
695a46a3c26d920e3661aecd,委內瑞拉局勢｜林健鋒指凸顯國家安全重要性 分析料或致油價短期波動,2026-01-04 18:46,2026-01-04 19:15,finance,tvb,https://news.tvb.com/tc/finance/695a46a3c26d920e3661aecd,"美軍突襲委內瑞拉，俘虜總統馬杜羅夫婦，本港行政會議成員林健鋒認為，事件凸顯國家安全的重要。有分析就相信，事件或導致油價短期波動。

行政會議成員林健鋒，回應委內瑞拉局勢對香港的影響，形容事件是不幸，並凸顯維護國家安全非常重要，香港保持穩定有利招商引資。

行政會議成員林健鋒稱：「所以我們自身一定要做好準備，在香港而言，金融方面我認為一定要強化。我們作為一個國際金融中心，在這一方面，若我們受到外來的襲擊，是會影響整個整體經濟。若世界其他地區或國家，情況不穩定，一些穩定的地區，例如香港是更加有利的。」

林健鋒表示，本港與委內瑞拉貿易不多，但關注其是石油出口大國，事件可能推高油價，影響進出口貿易生意。

紐約期油上個交易日，在每桶57美元附近窄幅上落，有分析認為，如果委內瑞拉可短期恢復出口石油，油價長遠仍是向下。

獨立外匯商品分析師盧楚仁指出：「最關鍵就是當地政權，是否真的全面逆轉，若他們最終都是下台的下台，結束管治就結束管治的話，相信對油價也是負面的，但若暫時未能做到的話，不排除油價有輕微的反彈，但反彈過後始終也是弱勢。」

他指市場預期事件可在短期轉趨明朗，金價即使因此輕微搶高，也會很快回落。"
