id,title,date,scrape_time,section,source,url,news_content
6939f22dd63af8b438bdc5ef,社評｜信報：慶祝聖誕不應忌諱／文匯：增強治理能量推動高質發展,2025-12-11 06:20,2025-12-11 06:45,local,tvb,https://news.tvb.com/tc/local/6939f22dd63af8b438bdc5ef,"信報社評︰踏入十二月正值傳統的聖誕節旺季，恰逢大埔宏福苑發生奪命火災，難免產生是否應該舉辦節慶活動的猶豫。平心而論，火災事發至今已經半個月，社會各界走出悲傷恢復正常運作，不失為合情合理的抉擇。

香港的聖誕節可以在毋忘災難的心態之下舉行，不必過度忌諱。商界為了迎來一年一度的聖誕節花上不少時間、金錢和心機籌備，社會若然遲遲不復常，無異於白白錯失市民和遊客消費的黃金檔期。

文匯報社評︰第八屆立法會選舉日前圓滿落幕，新一屆立法會議員的組成多元，專業背景扎實、社會代表性廣泛，為香港管治團隊注入了新鮮血液與治理能量。更重要的是，此次選舉所呈現的政治氛圍和社會凝聚力，為香港破除長期積弊、推動經濟產業轉型升級、深度融入和服務國家發展大局提供了堅實基礎。

香港未來五年的關鍵，在於把握歷史機遇，將選舉成果轉化為惠民實績，真正實現由治及興的歷史跨越。"
6939ecacd63af8b438bd9777,天氣家族｜早晨！提提你今日都有一兩陣微雨 周末之後還會轉涼啊,2025-12-11 06:15,2025-12-11 06:45,local,tvb,https://news.tvb.com/tc/local/6939ecacd63af8b438bd9777,
6939ef1ad63af8b438bdb018,美國阻礙委內瑞拉出口原油 原油期貨價格先跌後反彈,2025-12-11 06:07,2025-12-11 06:45,finance,tvb,https://news.tvb.com/tc/finance/6939ef1ad63af8b438bdb018,"美國在委內瑞拉海岸附近扣押一艘油輪，阻礙委內瑞拉出口原油，原油期貨價格先跌後反彈。

紐約期油收市報58.46美元一桶，升21美仙，升幅百分之0.3。倫敦期油收市報62.21美元一桶，升27美仙，升幅百分之0.4。"
6939ef00d63af8b438bdaf6f,美國今年第三次減息 金價變動不大,2025-12-11 06:06,2025-12-11 07:00,finance,tvb,https://news.tvb.com/tc/finance/6939ef00d63af8b438bdaf6f,"美國聯邦儲備局今年第三次減息，金價變動不大，現貨金價曾升約百分之0.4，至4,225美元水平。

紐約期金收市報4,224.7美元一盎司，跌11.5美元，跌幅近百分之0.3。"
6939eee0d63af8b438bdaec1,Nvidia稱未看到任何證據證實Deepseek應用走私集團最先進晶片,2025-12-11 06:05,2025-12-11 06:45,finance,tvb,https://news.tvb.com/tc/finance/6939eee0d63af8b438bdaec1,"就報道指中國人工智能初創公司深度求索Deepseek，在開發新一代人工智能模型時應用了走私進口的輝達最先進晶片，輝達回應未看到任何證據，證實有關報道。

《The Information》報道，深度求索新一代人工智能模型應用了被美國政府禁止出口的輝達Blackwell晶片。輝達發表聲明回應尚未看到任何證據，亦未接獲任何關於「幽靈數據中心」的舉報、即為了欺騙公司及OEM合作夥伴，建造後拆解，並在其他地方重建的數據中心。

聲明還指有關走私行為有點牽強，但公司會追查任何收到的線索。"
6939ee9bd63af8b438bdad96,港股美國預託證券與本港收市比較 造價個別發展,2025-12-11 06:04,2025-12-11 06:45,finance,tvb,https://news.tvb.com/tc/finance/6939ee9bd63af8b438bdad96,"在美國買賣的港股預託證券，與本港收市比較，造價個別發展。

滙豐控股收市折合115.27元，比本港收市高3.57元。工商銀行6.07元，低1仙。建設銀行7.58元，高1仙。友邦保險78.1元，高0.6元。港交所403.49元，高0.69元。

騰訊控股601.66元，低1.34元。阿里巴巴154.46元，高1.26元。理想汽車66.95元，高0.2元。金沙中國21元，高0.2元。長和54元，低0.25元。"
6939ee52d63af8b438bdabab,聯儲局年內第三次減息 美股三項主要指數全線向上,2025-12-11 06:03,2025-12-11 06:45,finance,tvb,https://news.tvb.com/tc/finance/6939ee52d63af8b438bdabab,"美國聯儲局一如預期減息四分之一厘，美股三項主要指數全線向上。

聯儲局年內第三次減息後，市場憧憬明年減息持續，美股三項主要指數上升，當中道指高開13點後，早段一度倒跌97點，但很快回穩並倒升。當議息結果公布後，升幅更一度擴大至超過600點，收市升497點。

標普500指數開低7點後，早段窄幅上落，至議息結果公布後確認升勢，並一度升至6,900點，收市升46點，創收市新高。

大市上升，多隻股份創新高，當中包括通用汽車及金融公司道富，分別升百分之4及百分之2。但人工智能概念股，走勢繼續疲弱，獲美國政府開綠燈，可以出口晶片往中國的輝達，股價微跌，同業AMD亦未見起色。

納斯達克指數在議息結果公布前，一直偏軟，至確認減息後才倒升，收市報23,654點，升77點。反映中國概念股表現的納斯達克中國金龍指數，收市報7,780點，升49點。"
6939df37d63af8b438bd371d,道指收市報48057點 升497點,2025-12-11 05:00,2025-12-11 05:15,finance,tvb,https://news.tvb.com/tc/finance/6939df37d63af8b438bd371d,"道瓊斯工業平均指數收報48,057點，升497點。

標準普爾五百指數收報6,886點，升46點。"
6939ca75d63af8b438bc988d,旺角有私家車司機棄車而逃 車輛在無人駕駛下溜前撞毀兩架車,2025-12-11 03:30,2025-12-11 04:00,local,tvb,https://news.tvb.com/tc/local/6939ca75d63af8b438bc988d,"旺角有私家車司機為逃避警方截查，棄車而逃。車輛在無人駕駛下溜前，撞毀兩架車。

涉事白色私家車，車頭損毀。

現場消息稱，凌晨近一時，警方在亞皆老街發現一名男司機於駕駛時觀看手機，要求他停車受查。司機未有理會，棄車逃去，車輛則溜前撞毀一架私家車及一架的士。

事故中無人受傷，警方正追緝涉事司機。"
6939c42bd63af8b438bc6ecb,美聯儲再減息四分之一厘 市場料下次會議有七成機會維持利率不變,2025-12-11 03:02,2025-12-11 04:00,finance,tvb,https://news.tvb.com/tc/finance/6939c42bd63af8b438bc6ecb,"美國聯邦儲備局一如預期，再減息四分之一厘，將聯邦基金利率，調低到3年多以來最低。

聯儲局公開市場委員會，以9票對3票議決，將聯邦基金利率目標範圍，調低到3.5至3.75厘，是連續第三次會議減息，利率水平下降到2022年11月初以來最低。

聯儲局下次貨幣政策會議，於明年1月27日至28日舉行。

市場目前估計，聯儲局這次會議，維持利率不變的機會率為七成左右。"
6939a78cd63af8b438bb971d,國家及地區奧委會協會全體代表大會 明年12月7至10日首次在港舉行,2025-12-11 01:01,2025-12-11 01:30,local,tvb,https://news.tvb.com/tc/local/6939a78cd63af8b438bb971d,"國家及地區奧委會協會全體代表大會，明年12月7至10日首次在港舉行。

全體代表大會督導委員會，昨日在倒計時一年發布會上指，預計屆時有來自206個國家及地區，逾1,200名體育領袖出席，共同探討管治、運動員福祉，及奧林匹克政策等重要議題。

文化體育及旅遊局局長羅淑佩視像致辭時說，這個是全球體育界最重要的會議之一，香港將向嘉賓展示世界級的場館等基建。

大會督導委員會主席兼港協暨奧委會副會長霍啟剛指，這次盛事，能將香港打造成國際交流的平台。"
6939a8d6d63af8b438bb9e2f,歐洲主要股市個別發展,2025-12-11 01:00,2025-12-11 01:30,finance,tvb,https://news.tvb.com/tc/finance/6939a8d6d63af8b438bb9e2f,"倫敦富時100指數收報9,655點，升13點。

巴黎CAC 40指數收報8,022點，跌29點。

德國DAX指數收報24,130點，跌32點。"
6939a07ad63af8b438bb4faa,馬會稱「香港國際賽事周」吸引逾千海外馬迷組團參加 料帶來約3500萬港元消費,2025-12-11 00:31,2025-12-11 01:00,local,tvb,https://news.tvb.com/tc/local/6939a07ad63af8b438bb4faa,"本周是馬會的「香港國際賽事周」，馬會稱吸引了過千名海外馬迷組團到港參加，按年多一倍。

其中一場國際騎師錦標賽，晚上在跑馬地上演，不少海外馬迷都即場「做功課」。馬會稱，賽事周還包括即將在周日舉行的香港國際賽事，合共近1,400名海外旅客參與。
 
澳洲旅客Britt說︰「我一直都想來香港看賽馬，尤其是看到嘉應高昇主導賽事，能夠看到他在自己本土跑真的很激動。」
 
馬會稱，他們同時會參觀不同旅遊景點，平均留港一周。撇除機票及住宿，在港人均消費約2.5萬港元，變相共消費約3,500萬港元。
 
澳洲旅客Ashleigh表示︰「聖誕節快要來到，我甚麼都還未買，我會在這裏買聖誕禮物，我預計會花2萬至2.5萬港元。」
 
有負責組團的領隊稱，四年間這類旅客有大幅增長，今年海外馬迷的這一團有近百人，一度因為額滿要截止報名，當中三成是「回頭客」。
 
澳洲賽馬團負責人Eliza O' Sullivan稱︰「香港在世界賽馬舞台上獨一無二，就以跑馬地馬場為例，馬場被住宅包圍，將賽馬融入社區，澳洲也在嘗試複製這個景觀。」
 
馬會指，將繼續翻新馬場設施，並開放更多場地予旅客使用，全面提升接待能力，配合政府發展賽馬旅遊。"
6939a071d63af8b438bb4f31,高級督察飛虎隊遴選後昏迷不治 周一鳴：整個遴選是循序漸進,2025-12-11 00:31,2025-12-11 01:00,local,tvb,https://news.tvb.com/tc/local/6939a071d63af8b438bb4f31,"31歲高級督察在飛虎隊遴選跳水後，昏迷危殆，延至昨晚不治。保安局局長鄧炳強、公務員事務局局長楊何蓓茵稱，對事件感難過悲痛。

該名高級督察，本身在瑪嘉烈醫院深切治療部留醫。他上周四中午約12時，在南丫島對出海面進行「進階遴選」測試，包括跳水、游水及潛水。期間在跳水後不適，失去知覺，隨即被送院搶救，要接受腦部手術。警方強調整個遴選是循序漸進，當時有醫療隊駐守，事發後已即時暫停相關遴選程序並檢視，防止同類意外再發生。

警務處處長周一鳴昨晚有到醫院，他稱該名高級督察在家人、朋友及同袍陪伴下離世。

警務處處長周一鳴說：「整個遴選過程首先是有驗身過程，遴選過程中亦有不同保護裝備，例如這個測試項目有頭盔，有潛水衣、手套等，每個過程都會再問考生，當時情況是否可繼續。」

周一鳴指：「這位同事姓黃，黃督察是年輕有為、有毅力，表現優越的同事，我和同事對他的離去感到很痛心，我們會為其家人提供一切適切協助及支援等，事件將由港島總區繼續跟進，將提交一個死因報告，之後給死因裁判官決定，是否進行一個死因研訊。」"
69399b23d63af8b438bb1f25,加拿大央行宣布維持利率不變符合預期 指關稅問題對經濟造成損害,2025-12-11 00:15,2025-12-11 00:30,finance,tvb,https://news.tvb.com/tc/finance/69399b23d63af8b438bb1f25,"加拿大央行宣布維持利率不變，符合市場預期。

指標利率處於2.25厘。加拿大央行表示，近期的經濟數據，沒有令央行改變對加拿大經濟和通脹的看法。預期明年經濟適度增長，通脹將接近百分之2的目標水平。

關稅問題已經對經濟造成損害，但整體表現仍有堅韌性。"
6939990bd63af8b438bb1068,高級督察於飛虎隊遴選跳水後昏迷危殆 延至昨晚不治,2025-12-11 00:00,2025-12-11 00:15,local,tvb,https://news.tvb.com/tc/local/6939990bd63af8b438bb1068,"31歲高級督察在飛虎隊遴選跳水後昏迷危殆，延至晚上不治。

涉事高級督察上周四中午約12時，在南丫島對出海面，進行「進階遴選」測試，包括跳水、游水及潛水。期間在跳水後不適，失去知覺，隨即被送院搶救，要接受腦部手術。

警務處處長周一鳴事發後，曾到瑪嘉烈醫院探望。

警方日前亦向涉事警務人員的家人，致以最深切慰問，表示將人員安全放首位，已即時暫停相關遴選程序並檢視，防止同類意外再發生。"
693995a8d63af8b438baee2c,現場｜周一鳴：高級督察飛虎隊遴選後昏迷不治 警方將向死因裁判官交報告,2025-12-10 23:45,2025-12-11 00:30,local,tvb,https://news.tvb.com/tc/local/693995a8d63af8b438baee2c,"警務處處長周一鳴深夜見記者，公布31歲高級督察在飛虎隊遴選跳水後昏迷危殆，延至今晚不治。

周一鳴表示感到痛心，警隊會為離世同事的家人提供協助及支援。港島總區將提交死因報告，由死因裁判官決定是否進行死因研訊。"
693995bfd63af8b438baefc0,美股個別發展 道指早段走勢反覆上落,2025-12-10 23:45,2025-12-11 00:15,finance,tvb,https://news.tvb.com/tc/finance/693995bfd63af8b438baefc0,"美國股市個別發展，道瓊斯工業平均指數早段走勢反覆上落。

美國聯儲局周四凌晨將公布議息結果及最新政策指引，投資者態度較為觀望，美股缺乏明顯方向。納斯達克指數曾跌逾100點，再度失守23,500點水平。

人工智能(AI)晶片生產商Nvidia輝達，和博通早段走勢偏軟，下跌不足百分之1。連日造好的華納兄弟，再升約百分之3。"
69399438d63af8b438bade40,繽紛冬日巡禮‧圖輯｜中環皇后像廣場上演首晚光影匯演 終審法院換「聖誕新裝」,2025-12-10 23:39,2025-12-11 00:30,local,tvb,https://news.tvb.com/tc/local/69399438d63af8b438bade40,"旅發局晚上在中環皇后像廣場，上演首晚的光影匯演，以配合繽紛冬日巡禮。

其中終審法院大樓換上「聖誕新裝」，不同的聖誕裝飾被投影在外牆上。馴鹿由雪地跑到中環，在中銀大廈的牆上「奔跑」，六角星在香港大會堂高座緩緩升起。

這個名為「光影匯‧中環」的匯演，旅發局將燈光效果及動畫，投影在皇后像廣場旁的八座地標外牆，即日起至明年1月4日，平日晚上七時半至十一時半舉行，周末就提早半小時開始，每半小時表演一次。

該表演原訂上月底開始，因宏福苑火災延期。皇后像廣場的冬日小鎮亦重開。"
693991d7d63af8b438bac1fe,馬會稱「香港國際賽事周」吸引逾千海外馬迷組團參加 料帶來約3500萬港元消費,2025-12-10 23:29,2025-12-10 23:45,local,tvb,https://news.tvb.com/tc/local/693991d7d63af8b438bac1fe,"本周是馬會的「香港國際賽事周」，馬會稱吸引了過千名海外馬迷組團到港參加，按年多一倍。

其中一場國際騎師錦標賽，晚上在跑馬地上演，不少海外馬迷都即場「做功課」。馬會稱，賽事周還包括即將在周日舉行的香港國際賽事，合共近1,400名海外旅客參與。
 
澳洲旅客Britt說︰「我一直都想來香港看賽馬，尤其是看到嘉應高昇主導賽事，能夠看到他在自己本土跑真的很激動。」
 
馬會稱，他們同時會參觀不同旅遊景點，平均留港一周。撇除機票及住宿，在港人均消費約2.5萬港元，變相共消費約3,500萬港元。
 
澳洲旅客Ashleigh表示︰「聖誕節快要來到，我甚麼都還未買，我會在這裏買聖誕禮物，我預計會花2萬至2.5萬港元。」
 
有負責組團的領隊稱，四年間這類旅客有大幅增長，今年海外馬迷的這一團有過百人，一度因為額滿要截止報名，當中三成是「回頭客」。
 
澳洲賽馬團負責人Eliza O' Sullivan稱︰「香港在世界賽馬舞台上獨一無二，就以跑馬地馬場為例，馬場被住宅包圍，將賽馬融入社區，澳洲也在嘗試複製這個景觀。」
 
馬會指，將繼續翻新馬場設施，並開放更多場地予旅客使用，全面提升接待能力，配合政府發展賽馬旅遊。"
69398eabd63af8b438baa246,瑪嘉烈醫院擴建工程有分判商提交儀器校正證明書疑偽造 初步估計無影響病人,2025-12-10 23:15,2025-12-11 01:00,local,tvb,https://news.tvb.com/tc/local/69398eabd63af8b438baa246,"醫管局發現瑪嘉烈醫院荔景大樓擴建工程，一個分判商提交儀器校正證明書有問題，懷疑是偽造，已報警處理。

醫管局稱，涉及的是監測震動儀器，本身用於監測醫院進行工程期間，產生的震動會否影響醫院運作。

今次涉及的證明書，是由分判商諾和工程公司呈交，再經總承建商中鐵建設集團有限公司呈交醫管局。

證明書本身列明，由廣東中正航計量檢測有限公司發出，但醫管局上月18日收到傳媒查詢後，決定進行核實。最終本月8日，收到該檢測公司向中鐵建設集團回覆的函件稱，並無發出有關證明，懷疑文件是偽造。

當局又進一步透露，諾和工程有將相關監測儀器，及儀器校正服務，分判予一間叫「北微傳感科技」的公司。不過早在10月27日，當局曾收到「北微傳感科技」通知，稱終止跟諾和工程的合約關係。醫管局於是要求總承建商，確保工程不受影響，以及委託合資格的檢測中心，提交證明。

之後在11月15日，收到總承建商提交五份校正證明書，其中四份的校準日期是10月28日，餘下一份是去年11月25日。

醫管局稱，已責成總承建商嚴肅跟進及徹查事件，並要求對方暫停諾和工程的工作。又稱涉事的監測儀器屬預防性質，初步估計事件無影響醫療服務及病人。

諾和工程亦有監測廣華醫院、聖母醫院、葛量洪醫院及北區醫院的工程震動。局方稱，將全面檢視所有諾和工程曾提交的檢測證書，以及相關工程及服務。"
69398b7cd63af8b438ba8f59,基孔肯雅熱｜再有本地個案患者曾到青衣自然徑 當局料暫無爆發風險,2025-12-10 23:02,2025-12-10 23:45,local,tvb,https://news.tvb.com/tc/local/69398b7cd63af8b438ba8f59,"本港新增一宗基孔肯雅熱本地個案，患者到青衣自然徑遠足時曾被蚊叮咬。當局昨晚起，已暫停開放自然徑，密集滅蚊。衞生防護中心稱，預計七至十日完成，暫時無爆發風險。
 
最新一宗跟青衣自然徑有關的基孔肯雅熱本地個案，是一名住在屯門業旺路的40歲男子。衞生防護中心調查稱，他上月30日，曾與11人到青衣自然徑遠足，期間曾被蚊叮咬，至上周四及五，先後出現關節痛及發燒，周日起出現皮疹，周二到屯門醫院急症室求醫。血液樣本對基孔肯雅病毒呈陽性反應。

中心稱，他潛伏期不曾外遊，未發現他潛伏期內其他活動地點跟早前確診個案到訪地點重疊，認為他較大機會是在青衣自然徑一帶受感染。

近日已累計六宗本地個案，患者都到過青衣自然徑一帶。穿上全套防護衣物的食環署職員，在已暫停開放的青衣自然徑北面入口，向草叢噴滅蚊噴霧。入口有圍欄封住，但有市民無理會，照樣越過圍欄上山，

有附近居民指，擔心被蚊叮咬。
 
鍾女士稱︰「我還貼了蚊貼，有噴(蚊怕水)。」

吳先生表示︰「我不停下來沒有蚊咬我，一停下來卻是很多蚊子。」

衞生防護中心早上預料，暫時無社區爆發風險。
 
衞生防護中心傳染病處主任歐家榮指出︰「個案都是零星的，但持續出現，我們相信感染源頭在青衣自然徑，仍然未清除。白紋伊蚊飛行距離不長，大概100米範圍以內，相信不會飛去市區。我們相信大概用七至十天完成。」

有滅蟲專家就稱，青衣自然徑全長約四公里，附近有三個屋邨，包括長宏邨、長亨邨和長康邨，居住了逾42,000人，大規模滅蚊的難度高。

衞生防護中心提醒，要預防被蚊叮，最好穿著寬鬆、淺色的長袖衫褲，及噴含避蚊胺的蚊怕水。


【延伸閱讀：基孔肯雅熱】

患者感染基孔肯雅熱後會出現發燒和嚴重關節痛。「基孔肯雅」是源自非洲馬孔德語中的一個詞，意思是「變得扭曲」，描述患者關節疼痛彎着腰的模樣。其他常見症狀包括肌肉疼痛、頭痛、噁心、疲倦和出現紅疹。症狀通常是自限性的，一般持續數天。但有些患者的關節痛可能會持續數月，甚至數年。

由基孔肯雅熱所引致的嚴重症狀及死亡十分罕見，並多數與其他已存在的健康問題有關。大部分患者可以完全痊癒。在偶爾的情況下，基孔肯雅熱病毒可引起眼、心臟及神經的嚴重併發症。新生兒、年紀較長人士及長期病患者出現重症的風險較高。

治理方法：
目前沒有特定的抗病毒藥物治療基孔肯雅熱，治療方法主要是紓緩症狀，包括使用退燒藥、止痛藥和補充體液。

資料來源：衞生署"
69398b3fd63af8b438ba8cf8,宏福苑五級火｜援助基金增至34億元 政府部門會自行承擔有關執行開支,2025-12-10 23:01,2025-12-10 23:30,local,tvb,https://news.tvb.com/tc/local/69398b3fd63af8b438ba8cf8,"政府成立的「大埔宏福苑援助基金」，外界捐款最新達31億元，連同3億元政府資金，合共有34億元。當局宣布向每戶業主發放一次性十萬元補助，又稱不排除部分基金用來重建，或應付災民的住屋。

大埔宏福苑火災發生至今兩星期，目前確認160人罹難，當局下午向部分單位灌混凝土，相信用來加固結構。

援助方面，政府成立的援助基金，收到26.3萬宗外界捐款，累計達31億元，當中一萬元以下有25.7萬宗，而五百萬以上有170宗，合共有17億。

之前發放的10萬元生活津貼，已批出1,717宗。向死者家屬發放的20萬元慰問金及5萬元殮葬費，暫時涉及109宗。而向傷者發放的5萬至10萬元，已批出64宗。

至於向受影響外傭、學生及工友發放的資助金，分別有63宗、220宗及110宗。

當局召開援助基金督導委員會後交代，將向宏福苑每戶業主發放一次性10萬元補助。

政務司副司長卓永興指出：「有些業主其實靠出租宏福苑的單位收入，應付日常開支，火災令他們失去收入，亦有業主早前投入一定資金，為單位進行裝修及維修，因此亦有損失及現金流壓力。即使單位有超過一名業主，我們以每戶計算，補助額都是10萬元。」

當局指，委員會會監察援助基金運作，確保基金用得其所，部門會自行承擔有關執行開支，不會要求基金回撥，重申支援是長期持續。

卓永興表示：「是否現時已做得差不多，我想不可以這樣說，一有新問題、新的需要，我們要適時提供協助。應急住宿安排工作組，是研究宏福苑居民長期住屋及居住問題，那方面會看屆時有何方案走出來，如有需要時，基金會如何配合。」

被問到今次做法會否適用於日後其他火警跟進，民政及青年事務局局長麥美娟強調，今次是特事特辦。

民政及青年事務局局長麥美娟稱：「政府固然對某些事故有既定機制，但今次要做的已超出一般做法。今次規模之大、受影響人數之多，對我們社會造成影響，所以政府今次採取了司長所說的特事特辦。至於將來最重要是，如何預防不幸的事故再發生。」

當局下周開始將會向捐款市民發放收據，用作稅務寬免。"
69398a83d63af8b438ba7fd8,高級督察飛虎隊遴選跳水後危殆據悉延至今晚不治 周一鳴深夜見記者,2025-12-10 22:57,2025-12-10 23:45,local,tvb,https://news.tvb.com/tc/local/69398a83d63af8b438ba7fd8,"31歲高級督察在飛虎隊遴選跳水後，昏迷危殆，據了解延至今晚不治。警務處處長周一鳴深夜將見記者。

涉事高級督察上周四中午約12時，在南丫島對出海面進行「進階遴選」測試，包括跳水、游水及潛水。期間在跳水後不適，失去知覺，隨即被送院搶救，要接受腦部手術。

警務處處長周一鳴事發後，曾到瑪嘉烈醫院探望。

警方日前亦向涉事警務人員的家人，致以最深切慰問，表示將人員安全放首位，已即時暫停相關遴選程序並檢視，防止同類意外再發生。"
69398693d63af8b438ba58bf,美國抵押貸款申請按周上升百分之4.8,2025-12-10 22:41,2025-12-10 23:00,finance,tvb,https://news.tvb.com/tc/finance/69398693d63af8b438ba58bf,"美國抵押貸款申請回升。

美國截至12月5日的一周，抵押貸款申請，按周上升百分之4.8，扭轉前一周的百分之1.4跌勢。

至於30年期固定抵押貸款利率，反彈至6.33厘，較前一周高1點子。"
69398689d63af8b438ba5897,美聯儲第二日貨幣政策會議前貴金屬價格率先上升 白銀價格升穿每盎司60美元,2025-12-10 22:41,2025-12-10 23:30,finance,tvb,https://news.tvb.com/tc/finance/69398689d63af8b438ba5897,"美國聯儲局舉行第二日的貨幣政策會議前，貴金屬價格率先上升，當中白銀價格升穿每盎司60美元，創歷史新高。

市場預期聯儲局有機會減息，借貸成本下降，利好不產生利息收入的貴金屬，金價靠穩，在4,200美元水平上落。

至於銀價首次突破60美元關口，單日升幅逾百分之1.5，今年以來累積上升1.1倍，超越金價的六成一升幅。

市場預期未來幾年，白銀的工業需求持續上升，最近更被美國納入「關鍵礦物」名單，提升其戰略及金融層面的重要性，刺激銀價近月屢創新高。"
