id,title,date,scrape_time,section,source,url,news_content
6896c0dbbccdd0876d275389,陳國基：近日黑雨未「超前部署」市面很快恢復 證明原有機制有效暢順,2025-08-09 11:30,2025-08-09 12:00,local,tvb,https://news.tvb.com/tc/local/6896c0dbbccdd0876d275389,"政府上月初曾提早一日預測有大雨並宣布停課，但近日連場黑雨，並無作出同樣的「超前部署」。政務司司長陳國基表示，今次暴雨後，市面很快恢復正常，證明原有機制有效及暢順。

政務司司長陳國基說：「大雨為何那麼難(預測)？天文台向我說過一個例子很合適，稱正如我們煲水至一百度，我們會預計到有氣泡，但氣泡由哪裡出來、很難預測，所以今次十一小時多的黑雨，我可很坦白說，事前大家都猜不到那麼長、那麼大雨，甚至當日上午也不知道下午何時可轉紅雨。雨雖然不能夠預測，但我們已有機制即時可運作，所以是不會有問題，今次亦證明到整件事運作很暢順，所以市民都要明白，不是不召開極端天氣督導委員會，是否就少了保護，其實不是，當然只是有很大問題出現，我們提早知道會做。」"
6896b9f0bccdd0876d272830,基孔肯雅熱｜陳國基：當局於口岸及本地均加強滅蚊,2025-08-09 11:00,2025-08-09 11:15,local,tvb,https://news.tvb.com/tc/local/6896b9f0bccdd0876d272830,"本港今年累計有五宗基孔肯雅熱輸入個案，另外有一宗可能個案，政務司司長陳國基稱，當局在口岸和本地都加強滅蚊。

政務司司長陳國基說：「有些地方蚊患指數例如去到20，我們就要滅蚊，但現在我們將它降到10，簡單來說就是提早去做。當有朋友有病時，首先呼籲所有朋友，如覺得不舒服就盡快看醫生，看看是否有這個病毒，如果有第一件事安排他在一些沒有蚊的環境下治療，這個很重要，讓蚊不會叮咬他後再叮咬其他人，第二亦會在他香港的住所，250米範圍內大規模滅蚊，希望將蚊全部滅殺，當然一般市民，希望他們清除積水，這個很重要。」"
6896b86ebccdd0876d2716f2,成都世運會：楊頌熹太極拳太極劍全能奪金,2025-08-09 10:53,2025-08-09 12:15,local,tvb,https://news.tvb.com/tc/local/6896b86ebccdd0876d2716f2,成都世運會，武術楊頌熹在男子太極拳太極劍全能，奪港隊今屆第二金。
6896b2dabccdd0876d26ebe0,的士車隊｜陳美寶：首支獲發牌車隊運作後日均接一百張單,2025-08-09 10:30,2025-08-09 11:00,local,tvb,https://news.tvb.com/tc/local/6896b2dabccdd0876d26ebe0,"政府已向五支的士車隊發牌，運輸及物流局局長陳美寶指，當中首支獲發牌的車隊，運作一個月以來，每日平均可接到一百張單，而不同車隊亦有不同定位。

運輸及物流局局長陳美寶表示：「其他車隊規模不一，以及接載的客群不同，有些正因規模及車款種類，可能是較集中與酒店業界聯繫，從而方便酒店為住客訂車，有些會專做機場客，推出初期至目前而言，在網約方面是有很多可再優化空間，如何透過網約召車程式，能令市民可快些亦方便些。」

根據車隊牌照申請條款，須於年底投入全數共三千五百輛的士，陳美寶未有正面回應是否有信心達到，但同意若車輛數目不足，會影響預約速度，歡迎八達通等公司，研究建立統一預約平台，方便市民預約。"
6896abc5bccdd0876d26bfa4,陳美寶：就收緊高齡司機續牌體檢等修例 擬最遲明年首季提交立法會,2025-08-09 10:00,2025-08-09 10:30,local,tvb,https://news.tvb.com/tc/local/6896abc5bccdd0876d26bfa4,"近日社會再次關注高齡商用車司機的潛在風險，政府前年曾建議，將目前70歲或以上司機，續牌要每年提交體格檢驗證明的年齡門檻降至65歲，並增加檢查項目。運輸及物流局局長陳美寶指，相關法例草擬已進入最後階段，目標最遲明年第一季提交立法會。

運輸及物流局局長陳美寶說：「運輸署成立了一個專家顧問小組，當中亦有邀請到醫學界代表加入，都給予了很多有用意見，就現行法例規定做的體檢證明書，有很細節地檢視內容，看看哪些方面可加強及細化，特別如視力方面，譬如是否有青光眼等，都驗得仔細些，都希望增加指定範圍，舉例說聽力方面都重要，所以都會定明檢驗規格。另外由於一些高齡人士，不只司機，一般人士也可能有慢性病或要服藥，以至可能在反應時的肌肉控制，都要特別小心，如果將來診所做體格檢驗，其醫療評估的指引都正在進行(檢視)。」"
68969a72bccdd0876d263966,巨星傳奇發盈警 料上半年純利不超過850萬元人民幣,2025-08-09 08:46,2025-08-09 09:15,finance,tvb,https://news.tvb.com/tc/finance/68969a72bccdd0876d263966,"巨星傳奇發盈警。

預期截至6月底止的上半年，純利不超過850萬元人民幣，較去年同期減少約六成七，因投資公平值虧損約1,950萬元人民幣，與集團主營業務無直接關聯。

撇除上述非經營性影響，經調整綜合溢利預期，不超過2,800萬元人民幣，較去年同期增加不多於百分之9.8。"
68969a69bccdd0876d263923,中國心連心化肥中期純利5.9億元人民幣,2025-08-09 08:46,2025-08-09 09:15,finance,tvb,https://news.tvb.com/tc/finance/68969a69bccdd0876d263923,"中國心連心化肥中期純利5.9億元人民幣。

按年下跌一成二，不派中期息，期內收入按年上升半成，至126.6億元人民幣。展望下半年，集團表示，內地氮肥市場供應相對充足，需求保持平穩、出口調節有序，預計尿素價格將延續平穩走勢。"
689694d3bccdd0876d260bcd,報章要聞｜文匯：民安隊全力服務全運會／信報：電騙新招 誘分享手機熒幕,2025-08-09 08:22,2025-08-09 09:00,local,tvb,https://news.tvb.com/tc/local/689694d3bccdd0876d260bcd,"文匯報報道：距離第十五屆全國運動會開幕只有三個月，香港特區政府一眾部門正全力籌備迎接該項盛事相關工作。作為保安局轄下的輔助紀律部隊之一，民安隊亦將以「全民皆兵」之勢，投入全運會服務，將動員約4,000人次參與，數目僅次於2008年北京奧運在港舉行的馬術賽事。

屆時所有長官及現役隊員將參與，負責在場地周邊環境及出入口，執行人群管理工作，確保技術人員、運動員、觀眾與其他工作人員，順利及有序地進出場館。

信報報道：電騙又有新招，警方雖多番宣傳市民，收到自稱「內地官員」電話可「冚線」，仍有人中招。警方公布上月有騙徒冒充電訊商客服人員，訛稱受害人大灣區數據計劃試用期滿，並開始每月在銀行帳戶扣數。受害人將手機熒幕與對方分享，最終被轉走逾550萬元。警方提醒任何人接到自稱客服，不要輕信對方，亦不要隨意與第三方共享手機或電腦熒幕。"
689694b4bccdd0876d260acd,富智康集團中期業績轉虧為盈,2025-08-09 08:21,2025-08-09 08:45,finance,tvb,https://news.tvb.com/tc/finance/689694b4bccdd0876d260acd,"富智康集團中期業績轉虧為盈。

截至六月底止半年，賺616.5億美元，去年同期則蝕逾3,150萬美元。不派中期股息。期內，收入20.6億美元，按年增加約百分之8。"
68969444bccdd0876d2607fc,據報特朗普將擴大美聯儲主席人選名單 堅持不會罷免鮑威爾,2025-08-09 08:19,2025-08-09 08:45,finance,tvb,https://news.tvb.com/tc/finance/68969444bccdd0876d2607fc,"據報美國總統特朗普將聯邦儲備局主席人選名單擴大。

《華爾街日報》引述，美國政府高級官員指，特朗普將更多人選加入對聯邦儲備局主席鮑威爾潛在接替人的名單。 消息指，除了被認為是特朗普潛在選擇的國家經濟委員會主任哈塞特、聯儲局理事沃勒、及聯儲局前理事沃什外，新名單包括前聖路易斯聯儲銀行、行長布拉德和曾擔任美國前總統喬治布殊，經濟顧問的薩默林。

 特朗普經常對聯儲局主席鮑威爾作出批評，但堅持不會罷免鮑威爾。"
68968d21bccdd0876d25d4e4,報章要聞｜明報：毛樂禮指應遵法庭判決／大公：北都新田科技城地盤工程招標,2025-08-09 07:49,2025-08-09 08:15,local,tvb,https://news.tvb.com/tc/local/68968d21bccdd0876d25d4e4,"明報報道：港府因應終審法院裁決，提出《同性伴侶關係登記條例草案》，坊間討論兩極。大律師公會主席毛樂禮表示，公會並不會支持或反對草案內容，而會「支持法治」，認為「有法庭判辭及判決，都應該去遵守」。

而過往類似案件的判決，亦反映終院對一男一女的婚姻制度原則一致，希望最終能得出滿足憲制責任的草案。他認為法庭的判辭無意，亦無改變婚姻制度，並留有彈性給行政機構，考慮同性伴侶框架內容。

大公報報道：土木工程拓展署昨日，就新田科技城地盤平整工程刊憲招標，涉及興建連接落馬洲路，青山公路洲頭段，及古洞路的多條道路，污水泵房等工程，預計十二月展開工程，並需於六十個月內完成，即可望最快於2030年底竣工。

新田科技城第一期，第一階段發展佔地約158公頃，主要涵蓋新深路東面、靠近粉嶺公路一帶的創科用地，以及未來因新皇崗口岸啟用。而釋出的落馬洲邊境管制站用地，首批住宅和配套用地，以及一些關鍵道路和基礎設施。首批居民可望於2031年遷入。"
68968cffbccdd0876d25d3e2,據報美國政府擬今年出售房利美和房地美股份,2025-08-09 07:48,2025-08-09 08:15,finance,tvb,https://news.tvb.com/tc/finance/68968cffbccdd0876d25d3e2,"據報美國政府計劃今年出售房利美和房地美股份。

《華爾街日報》引述知情人士表示，美國政府準備於今年稍後時間，出售聯邦住房金融局旗下兩間物業按揭機構，房利美及房地美的股份，預計可籌集約300億美元。

報道指，美國一些政府官員正討論計劃，兩間公司總估值或超過5,000億美元，計劃出售百分之5至一成半的股份。

美國政府於2008年9月，金融危機期間出手救助兩間公司，以避免房貸市場崩潰。但多年來一直未能就兩間公司的未來達成共識，因包括對按揭成本，及可負擔房屋承諾的憂慮。報道指，美國總統特朗普，近期聽取多家大型銀行行政總裁，對執行複雜操作的建議。"
689685c8bccdd0876d259ada,首鋼資源發盈警 主要由於平均精焦煤實現售價下跌,2025-08-09 07:18,2025-08-09 08:00,finance,tvb,https://news.tvb.com/tc/finance/689685c8bccdd0876d259ada,"首鋼資源發盈警，預期截至六月底止，半年純利按年跌五成至五成二，純利最多4.2億元。

主要由於期間平均精焦煤實現售價，按年跌約四成半。集團已採取積極措施，應對煤價波動影響，盡量減少對利潤的負面影響。"
689685babccdd0876d259a42,WTO料今年全球貨物貿易量將增0.9%,2025-08-09 07:17,2025-08-09 08:00,finance,tvb,https://news.tvb.com/tc/finance/689685babccdd0876d259a42,"世界貿易組織(WTO)預計，今年全球貨物貿易量將增長百分之0.9。

世貿指，最新修訂的預計，高於4月時估算的收縮百分之0.2，但遠低於關稅上調前的百分之2.7。世貿表示，修訂是由於美國企業，為規避關稅影響提前進口。

今年上半年美國進口激增，進口量較去年同期增長一成一，將暫時提振今年的貿易前景。而目前全球宏觀經濟前景，較許多經濟學家，在4月的預期更為樂觀。

但世貿認為，近期的關稅變化，特別是美國8月7日實施更高所謂「對等關稅」稅率，預計將對全球貿易前景產生整體負面影響。將明年貿易額增長，由原先預期的百分之2.5，下調至百分之1.8。 "
689682b4bccdd0876d258605,中國駐瓦努阿圖大使冀盡快開通中瓦直航 相信香港能為兩國關係發揮重要作用,2025-08-09 07:04,2025-08-09 07:45,local,tvb,https://news.tvb.com/tc/local/689682b4bccdd0876d258605,"今年是中國和瓦努阿圖建交43周年，中國駐瓦努阿圖大使李名剛指，當地旅遊業有很大發展潛力，期望盡快開通中瓦直航，又相信香港能為兩國關係發揮重要作用。

「瓦努阿圖，我想住的地方」，這句廣告對白，不少人都耳熟能詳。瓦努阿圖，這個人口有約32萬的南太平洋島國，農業及旅遊業是經濟支柱，當中旅遊業佔國民生產總值約三分之一。

不過內地和香港都沒有直航機到當地，想去旅行就要在斐濟，或澳洲等地轉機，我們此行加上轉機時間，就用了差不多20小時。

中國駐瓦努阿圖大使李名剛接受傳媒訪問時指，當地旅遊業有很大發展潛力，期望盡快開通中瓦直航航班。

中國駐瓦努阿圖大使李名剛說：「北部有潔白的沙灘，南部有著名的這個塔納火山，所以在過去這些年，我重點的一項任務，就是想推動兩國人員的交往，開通這個直航，方便廣大的中國遊客，包括企業家來瓦努阿圖。」

李名剛又指，瓦努阿圖經濟規模小，發展動力較弱，需要找合作夥伴發展，香港有優勢能發揮作用，深化兩地合作。

李名剛認為：「從兩國關係來講，中國毫無疑問，是他們需要的一個重要的合作夥伴。香港是中華文明和世界文明對接的一個重要的窗口，具有很鮮明的外向性。我過去兩年當中，不管是陪同瓦努阿圖的政要到中國訪問，還是邀請他們一些重要的人物到中國去訪問，他們都要把時間留出來，要到香港去走一走、看一看。他們覺得非常的舒服、舒適，香港的文化他們也非常的熱愛，尤其是香港的美食。」

李名剛又指，青年交流對兩國關係非常重要，除了會鼓勵更多中國青年來到瓦努阿圖旅遊，亦希望鼓勵更多瓦努阿圖學生到中國留學。"
68968299bccdd0876d25856d,李夏茵冀用科技令病人毋須多次排隊 又指加薪未必能留住醫護,2025-08-09 07:04,2025-08-09 07:45,local,tvb,https://news.tvb.com/tc/local/68968299bccdd0876d25856d,"上任約一周的醫管局行政總裁李夏茵稱，未來希望利用科技提供一站式服務，令病人毋須多次排隊，就可完成整個求診流程。又稱加人工不一定留到人。

由醫務衞生局重回醫管局「掌舵」約一周的行政總裁李夏茵，跟傳媒茶聚，再次分享她的未來工作大計，包括如何縮減病人在診症過程的輪候時間，毋須每個程序都排一次隊。

醫管局行政總裁李夏茵說：「例如看完醫生後，他只需要拿一張醫生給他的紙，就可以去一站式的服務站，預約日後所有程序，包括下次的覆診時間，抽血、做檢查的時間。有一些服務因為(早前)黑雨取消了，病人要回來再預約下一個門診，其實是否不需要病人親身到診所預約，可否用科技或手機程式已可做到。」

她強調服務應由病人角度出發，所以上任後另一工作是加強跟社區的溝通。病人向來關注醫療事故，如何解決？她稱會盡量減少，但不可能完全避免，鼓勵員工敢言反映，非只著重問責。

李夏茵指：「(員工)敢言文化，是病人安全文化的一個因素。我們有無可能在會議時，提供很安全環境，讓同事發表意見，我們當然要理性討論。不需要『吹哨者』，他很舒服地告之，這件事不妥，直接拿出來說。」

醫管局面對另一問題是醫護流失，近期雖然有放緩，但會否考慮加薪留人？

李夏茵表示：「與其令他加很多人工，如果他覺得無達到初心，圓滿他的理想，其實他都不會留下。另外一些高級的同事，如果提供多些機會予這些同事，改變一些政策，一些服務模式，令其理想真的能實踐，我相信是很重要方法，令我們員工留下。」

被問到海外醫生招聘情況，李夏茵稱這方面工作會繼續做，又稱會發揮好香港內聯外通的優勢，歡迎各地有興趣投身香港公營醫療體系的醫生加入。"
68967f81bccdd0876d256cdb,社評｜商報：人才要搶得來用得好留得住／明報：「高才通」續簽從嚴把關,2025-08-09 06:51,2025-08-09 07:30,local,tvb,https://news.tvb.com/tc/local/68967f81bccdd0876d256cdb,"商報社評：高才通效益毋庸置疑，人才既要搶得來，還要用得好，且要留得住，當局要理順把關及配套工作。香港總人口疫後亦見萎縮，少子化意味自然增長乏力，輸入人才政策不單有利從數量上補充人口，人口結構也因此改善優化。

輸入人才有沒有副作用呢？外來人口難免會擠兌本地資源，但須強調，一來高端人才不見會擠兌基層市民福利，包括搶佔公屋。高才通也要求簽證續期時，證明在港受聘並獲穩定收入，又或已在港開辦或參與業務，確保他們不是來港「混」。輸入人才必須算大帳，不應算小帳，其中也須把好關，及爭取趨利避害。

明報社評：評估「搶人才」成效，當然是看實際有多少人才在港生活、工作及發展。人才家庭落戶，必然要找地方居住。過去數年本港出現了移民潮，「高才通」等措施其中一項作用，正是填補由此造成的人才及勞動力缺口。

「一減一加」之下，私樓入住量及空置量過去數年大致平穩，未有大幅變化似乎也說得通。獲批來港人才有多少真的在港發展，是一個必須搞清楚的問題，政府有責任交代。為了釋除疑慮，當局在交代高才通續簽情況時，應盡量詳細讓外界掌握，同期獲批來港者當中，實際有多少人在港發展。"
68967f62bccdd0876d256c18,廣汽集團上月銷量按年跌一成半,2025-08-09 06:50,2025-08-09 07:15,finance,tvb,https://news.tvb.com/tc/finance/68967f62bccdd0876d256c18,"廣汽集團上月銷量，按年跌一成半。

按月跌兩成，至11.9萬輛。當中新能源車銷量，超過3.3萬輛，按年跌百分之1。累計今年首七個月，銷量87萬輛，按年跌近一成三。"
68967f49bccdd0876d256b75,美元匯價偏軟,2025-08-09 06:50,2025-08-09 07:15,finance,tvb,https://news.tvb.com/tc/finance/68967f49bccdd0876d256b75,"美元匯價偏軟。

反映美元兌六隻主要貨幣的美匯指數跌約百分之0.1，至98.265。美國經濟數據疲弱，市場預期聯儲局今年會進一步減息，並且關注美國總統特朗普對聯儲局主席的提名，美元兌日圓報147.72，每百日圓兌港元在5.32算，歐元兌美元跌約百分之0.09，至1.165水平。"
68967947bccdd0876d25376f,社評｜信報：「長期主義」奠定星洲奇蹟／大公：要做機器人研發應用引領者,2025-08-09 06:24,2025-08-09 07:00,local,tvb,https://news.tvb.com/tc/local/68967947bccdd0876d25376f,"信報社評：今天是新加坡建國六十周年，六十年來新加坡經濟發展一直取得優異成績，也經常被用來與香港比較。新加坡一九六五年被迫獨立，國父李光耀更淚灑當場，但以「長期打算，充分發展」的「長期主義」精神作為目標，為應對長遠發展，新加坡每二十年編定《概念規劃》。

現時香港處於轉型期，正需要「長期主義」的戰略定力。過去香港就由於沒有「土地儲備」，往往臨渴掘井，甚至「見縫插針」建設房屋，影響原來的社區承受能力。經濟、金融政策也需要「長期主義」，具連續性、一致性，避免像啟德發展規劃數十年來屢次更改，惟有這樣才能令商人安心投資。

大公報社評：世界機器人大會昨日在北京盛大開幕，香港貿發局組織了五家機構參展，展現香港在傳感器、機器人等領域的創新成果。香港擁有發展機器人展業的條件和廣泛應用場景，當務之急是做好制度建設，盡快形成打造機器人產業全鏈條良好生態環境。

特區政府可成立相關的高層委員會，負責產業規劃、政策制定，並統籌資源應用，確保政策落地。擴大應用場景，加快培育機器人產業快速成長的沃土，這不僅可提升香港自身競爭力，亦可為國家科技強國大計作出獨特貢獻。"
68967866bccdd0876d2532bd,利福中國中期業績盈轉虧,2025-08-09 06:21,2025-08-09 07:00,finance,tvb,https://news.tvb.com/tc/finance/68967866bccdd0876d2532bd,"利福中國中期業績盈轉虧。

截至六月底止半年，蝕373萬元人民幣，去年同期賺逾4,160萬元人民幣。不派中期股息。期內，收入接近6.2億元人民幣，按年下跌百分之4。"
68967858bccdd0876d253263,中慧生物招股獲超額認購4千倍,2025-08-09 06:20,2025-08-09 07:00,finance,tvb,https://news.tvb.com/tc/finance/68967858bccdd0876d253263,"內地疫苗公司中慧生物，招股獲超額認購4千倍。

下周一掛牌的中慧生物，股份公開發售部分，錄得超額認購約4,006倍，一手中籤率百分之1。抽4,500手才穩獲派一手。國際發售則未足額認購。每股定價12.9元，集資淨額3.8億元。"
68967837bccdd0876d25313a,市場憂美國關稅政策或打擊經濟前景 油價創6月底以來最大單周跌幅,2025-08-09 06:20,2025-08-09 07:00,finance,tvb,https://news.tvb.com/tc/finance/68967837bccdd0876d25313a,"原油期貨價格變動不大，但受市場對美國關稅政策或打擊經濟前景的擔憂，油價創自6月底以來，最大的單周跌幅。

紐約期油收市報63.88美元一桶，無升跌。倫敦期油收市報66.59美元一桶，升16美仙，升幅百分之0.24。

全個星期計，紐約期油跌百分之5.1，倫敦期油跌百分之4.4。"
68967810bccdd0876d25304c,白宮澄清金條不應被徵收關稅 金價升幅收窄,2025-08-09 06:19,2025-08-09 06:45,finance,tvb,https://news.tvb.com/tc/finance/68967810bccdd0876d25304c,"美國白宮澄清金條不應被徵收關稅，金價升幅收窄。

紐約期金收市報3,491.3美元一盎司，升37.6美元，升幅百分之1。

美國計劃發布行政命令。英國《金融時報》報道，美國對進口的一公斤和100盎司金條加徵關稅，消息引發12月份期金一度升至每盎司3,534元美元的新高。並罕有地較現貨金價高超過100美元，令市場處於混亂狀態。分析師警告，美國政府的徵稅行動或威脅到紐約，作為最大黃金期貨市場的地位。"
689677eebccdd0876d252f3b,港股美國預託證券與本港收市比較 造價普遍較高,2025-08-09 06:18,2025-08-09 06:45,finance,tvb,https://news.tvb.com/tc/finance/689677eebccdd0876d252f3b,"在美國買賣的港股預託證券，與本港收市比較，造價普遍較高。

滙豐控股收市折合100.02元，比本港收市高1.82元。工商銀行6.16元，與本港收市價相同。建設銀行7.95元，高1仙。友邦保險73.95元，高0.35元。港交所428.96元，高1.56元。

騰訊控股562.69元，高1.69元。阿里巴巴118.1元，高1.8元。理想汽車97.3元，高0.8元。金沙中國20.19元，高7仙。長和50.97元，低0.48元。"
689677cfbccdd0876d252e58,美股三大指數上升 納指創新高及收市新高,2025-08-09 06:18,2025-08-09 06:45,finance,tvb,https://news.tvb.com/tc/finance/689677cfbccdd0876d252e58,"美股三項主要指數上升，其中納斯達克指數創新高及收市新高。

道瓊斯工業平均指數，收市報44,175點，升206點。標準普爾500指數，收市報6,389點，升49點。

市場對聯邦儲備局下月減息的預期升溫。美股三大指數均高開，其中道指高開76點後，好快升幅擴大至逾300點，其後升幅一度收窄至60點，收市升206點。全個星期計，上升587點。

標普500指數高開15點，開市已經是全日最低位。指數升幅曾擴大至55點，收市升49點。全個星期計，上升151點。

蘋果獲大行上調評級，股價升逾百分之4，是升幅最大的道指成分股。全個星期計，股價累升逾一成三，創2020年7月以來最好的單周表現。

Nvidia輝達股價升逾百分之1。全個星期升幅超過半成。

Google母公司Alphabet，收市升逾百分之2。

晶片製造商英特爾股價由低位反彈，一度升逾百分之1。收市靠穩。

納斯達克指數創收市新高，收市報21,450點，升207點，全個星期計，升799點。

反映中國概念股表現的納斯達克中國金龍指數，收市報7,502點，跌19點。全個星期計，上升175點。"
68965234bccdd0876d241fe4,道指收市報44175點 升206點,2025-08-09 04:00,2025-08-09 04:30,finance,tvb,https://news.tvb.com/tc/finance/68965234bccdd0876d241fe4,"道瓊斯工業平均指數收報44,175點，升206點。

標準普爾五百指數收報6,389點，升49點。"
68962d01bccdd0876d231736,歐洲主要股市個別發展,2025-08-09 01:00,2025-08-09 01:15,finance,tvb,https://news.tvb.com/tc/finance/68962d01bccdd0876d231736,"倫敦富時100指數收報9,095點，跌5點。

巴黎CAC 40指數收報7,743點，升33點。

德國DAX指數收報24,162點，跌29點。"
