id,title,date,scrape_time,section,source,url,news_content
6954c801d6adf87a9bf0ec28,港股今年最後交易日跌逾200點 總結全年累升兩成七,2025-12-31 14:51,2025-12-31 15:45,local,tvb,https://news.tvb.com/tc/local/6954c801d6adf87a9bf0ec28,"港股在2025年最後交易日，下跌超過200點。但總結全年，恒生指數累升兩成七，是2017年以來表現最好。

2025年最後交易日只有半日市。恒指低開後跌幅擴大，最多跌300點，再次失守10天和20天線。收報25,630點，下跌224點，半日市成交只有1,189億元。

總結全年，國產人工智能大模型DeepSeek深度求索，掀起市場對港股價值重估，資金持續流入推動大市。

踏入第二季，雖然關稅戰陰霾下，港股一度急回。但美國減息、中央整治「內捲」，以至「十五五」規劃利好下，大市重拾動力，曾經高見27,381點。

即使第四季科網股跟不上，恒指全年仍升5,570點，升幅超過兩成七，是2017年以來表現最好。全年「北水」淨流入超過萬億元，創出新高。

獨立股評人郭思治指出：「兩年的走勢都是先低後高，明年仍然可以維持先低後高。簡單說，直至這一分鐘，認為目前大市仍處於一期牛市的尋頂之中。現時目標個人看法，第一個大關肯定是30,000點。再上望些是剛才所說，2021年一季的高位31,183點。」

不少恒指成分股今年升幅超過一倍。

受惠鋁材銷售價量齊升，中國宏橋上升一倍七，藍籌中稱冠。

國際金價全年大升，紫金礦業亦水漲船高。

國產替代概念下，中芯國際升一倍二。

受內地外賣戰困擾的美團，全年跌近三成二，是表現最差的藍籌。"
6954c73ad6adf87a9bf0e67d,內地製造及服務業經營擺脫收縮局面 有分析稱明年政策仍以穩增為主調,2025-12-31 14:47,2025-12-31 15:30,finance,tvb,https://news.tvb.com/tc/finance/6954c73ad6adf87a9bf0e67d,"內地製造及服務業經營，擺脫收縮局面。有分析相信，明年內地政策，仍以穩增長為主調。

國家統計局公布，十二月份製造業採購經理指數，重上50以上的擴張區間，報50.1，擺脫四月以來的收縮局面。反映服務業的非製造業採購經理指數，十二月份亦升至50.2，回復擴張。

國統局指，製造業市場需求釋放，整體經濟景氣有改善。

國家統計局服務業調查中心企業景氣處處長霍麗慧表示︰「在調查的二十一個行業中，有十六個行業的，採購經理指數是按月回升，相關企業生產經營狀況有所改善，此外在製造業產需回升的帶動下，企業採購活動加快。」

有分析相信，明年內地政策，仍以穩增長為主調。

東亞證券高級投資策略師陳偉聰說︰「去到明年我們看，(經濟增長)大概百分之4.8至5，未必會有再進一步加速的動能，現時穩定是內地的主軸，當然我同意，始終內地經濟在明年2026年首季，都仍可能有一定程度壓力，因為2025年同期基數比較高，譬如一些消費環節上，始終2025年初以舊換新、補貼，都令到基數變得比較高。」

中央繼續發力支持內需，國家發改委指，已向地方提前下達2026年，第一批625億元人民幣超長期特別國債，支持消費品以舊換新，滿足元旦、春節等旺季消費需求。

不過與2025年相比，整體補貼金額減少，補貼限制亦有所提高。發改委亦提前，批出明年「兩重」建設項目清單。亦即國家重大戰略實施和重點領域安全能力建設安排。涉及金額約2,200億元人民幣。連同中央預算內投資計劃，合共2,950億元人民幣，加快資金撥付及使用節奏。"
6954ae76d6adf87a9bf01e51,恒指全年升逾27%為八年來表現最佳 「北水」淨流入逾萬億創新高,2025-12-31 13:02,2025-12-31 14:00,local,tvb,https://news.tvb.com/tc/local/6954ae76d6adf87a9bf01e51,"港股在2025年最後交易日，下跌超過200點。但總結全年，恒生指數累升兩成七，是2017年以來表現最好。

2025年最後交易日，只有半日市。恒指低開後跌幅擴大。最多跌300點，再次失守10天和20天線。收報25,630點，下跌224點。半日市成交只有1,189億元。

總結全年，國產人工智能大模型DeepSeek，深度求索掀起市場，對港股價值重估，資金持續流入推動大市。

踏入第二季，雖然關稅戰陰霾下，港股一度急回。但美國減息、中央整治「內捲」，以至「十五五」規劃利好下，大市重拾動力，曾經高見27,381點。即使第四季科網股跟不上。

恒指全年仍升5,570點，升幅超過兩成七，是2017年以來表現最好。全年「北水」淨流入超過萬億元，創出新高。

東亞證券高級投資策略師陳偉聰說：「(明年恒指)初步目標30,800點，為甚麼估值還可以上升。一些新經濟，如科技、人工能智能。智能駕駛、機器人等等。相信政策支持力度，在這幾個範疇應該不會減少，甚至乎再加碼。」

不少恒指成分股今年升幅超過一倍。受惠鋁材銷售價量齊升，中國宏橋上升一倍七，藍籌中稱冠。

國際金價全年大升，紫金礦業亦水漲船高。國產替代概念下，中芯國際升一倍二。

受內地外賣戰困擾的美團，全年跌近三成二。是表現最差的藍籌。"
6954b3acd6adf87a9bf04211,樂華南邨謀殺案｜警方繼續蒐證調查 追查死者非華裔男友下落,2025-12-31 13:01,2025-12-31 13:45,local,tvb,https://news.tvb.com/tc/local/6954b3acd6adf87a9bf04211,"警方繼續調查牛頭角樂華南邨謀殺案，一名35歲失蹤女子藏屍在一個單位的床架內，警方追緝她的非華裔男友。

現場是樂華南邨喜華樓，多名重案組探員上樓蒐證，案發單位在35樓，警方劃出封鎖線，有警員把守禁止其他人進入。

警方是在星期一晚，接獲女事主母親報案，稱35歲的女兒失蹤，警方調查後，懷疑她到過喜華樓男朋友住所，星期二凌晨到喜華樓調查，但無人應門，破門入屋後，單位亦已斷電，不見任何人，不過有四具貓狗屍體，警方再翻查閉路電視，發現女事主曾到訪但無離開，到天亮再仔細搜查，最後在床架內發現女事主。

東九龍總區重案組總督察蘇志兵說：「當時她的身體是完整的，但已沒明顯生命跡象，經過法醫到場初步檢驗後，在死者頭部發現多處相信由硬物造成傷口，而她雙手雙腳及面部都有新的瘀傷。我們相信(單位)是第一案發現場，有人在案發後有處理過現場，包括清理血漬，包括處理證物，與此同時處理相關兇器。」

法醫初步估計，女事主在其母親報警前，即星期一早上已死亡，至於為何未能即時找到屍體，警方稱因為無明顯痕跡。

東九龍總區刑事部署理高級警司黃奕隆稱：「現場單位雖小，但擺設較為凌亂，我們上到現場首次發現沒有任何打鬥痕跡，剛才提及傷勢，一般情況我們預計有很多血，或有明顯打鬥痕跡，奈何沒有，但正如我們第一次接案已經將案件列作高危，我們沒有掉以輕心，一直翻查閉路電視，雖然說是床架，但當時屍體包裹很隱蔽。」

警方稱從垃圾房中找到女死者的身份證明文件及懷疑相關衣物，正追查其非華裔男友下落，包括是否已離境，並會循多方面調查犯案動機、單位電力中斷原因等，警方呼籲如有任何資料提供，可致電聯絡東九龍總區重案組。"
6954adfad6adf87a9bf019e3,除夕深圳灣口岸通宵運作 羅湖口岸服務延長至元旦凌晨二時,2025-12-31 13:00,2025-12-31 13:30,local,tvb,https://news.tvb.com/tc/local/6954adfad6adf87a9bf019e3,"除夕多項公共交通加強服務，深圳灣口岸通宵運作，羅湖口岸亦會延長服務，至元旦凌晨二時。

在西九龍高鐵站入境大堂，抵港的內地旅客，不少人是一家大小。內地多個城市包括廣州、西安等，公眾地方都不會舉行由官方舉辦的跨年倒數活動，有人專程來香港感受跨年氣氛。

成都旅客梁小姐說：「前面幾年都是這樣，所以大家會覺得，在內地跨年可能就是太普普通通了，想來香港感受一下，不一樣的跨年。」

福建旅客王小姐稱：「我們會留在香港(過夜)，我覺得香港跨年夜也是比較熱鬧的，雖然沒有煙花，但是也可以走走看看的，香港(酒店)房價相對內地，比較高一點，但是既然都來了，還是值得的。」

在羅湖口岸，旅客清關服務延長至元旦凌晨二時，顯示屏提示旅客東鐵綫往羅湖尾班車，元旦凌晨零時56分由金鐘開出，往金鐘的尾班車，就於凌晨2時30分由羅湖開出。

有市民把握時間即日來回。

周先生表示：「先跟朋友飲早茶，然後去卡拉OK，晚飯跟朋友慶祝生日，然後回港倒數。多年來都在香港倒數，香港的氣氛是最好的。」

上海旅客劉小姐說：「我們是來看周深的演唱會，然後過跨年、元旦這樣子，想在香港簡單旅遊一下吧，因為我是第二次來香港，還是想多逛一下，感受一下跟內地不一樣的風景。」

運輸署提醒市民和旅客及早規劃行程，可考慮於非繁忙時間出行，並留意最新交通情況。

為配合跨年慶祝活動，深圳灣口岸旅客清關服務改為24小時運作，粵港兩地增發跨境巴士特別加班配額，以提供通宵服務。

港鐵大部分路綫將通宵服務並由下午三時起，分階段加密班次。11條特別巴士線，元旦凌晨提供特別服務，逾20條巴士線，加強服務或延長服務時間。

<a href=""https://news.tvb.com/tc/local/695344ccd6adf87a9be41f0f"" target=""_blank"" rel=""""> 倒數迎2026好去處｜西九首辦海濱倒數音樂會　中環遮打道迪士尼同步賀新年｜一文看清‧活動詳情</a>"
69549fb0d6adf87a9befa227,港股中午收市報25630點 跌224點,2025-12-31 12:00,2025-12-31 15:45,finance,tvb,https://news.tvb.com/tc/finance/69549fb0d6adf87a9befa227,"恒指收報25,630點，下跌224點。

總結2025年，恒指累積上升5,570點，升幅兩成七，是2017年以來表現最好。"
69549e12d6adf87a9bef94f3,國務院任命張勇出任中聯辦副主任 ,2025-12-31 11:52,2025-12-31 12:45,local,tvb,https://news.tvb.com/tc/local/69549e12d6adf87a9bef94f3,"國務院任命張勇出任中聯辦副主任。

中聯辦網頁介紹，張勇有研究生學歷，曾任中央財經委員會辦公室經濟二局局長、秘書局局長和機關黨委常務副書記，之後到中國遠洋海運集團任副總經理。"
69549ab2d6adf87a9bef7753,衞生署鼓勵50至75歲市民參與大腸癌篩查,2025-12-31 11:32,2025-12-31 11:45,local,tvb,https://news.tvb.com/tc/local/69549ab2d6adf87a9bef7753,"​衞生署宣布，1950至1976年出生的香港居民，將於明年元旦起符合資格，參加政府資助的大腸癌篩查計劃。衞生署呼籲所有合資格人士盡早參加計劃。
　　 
計劃以公私營協作的模式推行，資助年齡介乎50至75歲、沒有大腸癌徵狀的香港居民每兩年於私營機構接受篩查。有意參加計劃的人士需先約見參與計劃的基層醫療醫生，安排進行大便免疫化學測試，如大便免疫化學測試結果呈陽性，參加者會獲轉介到大腸鏡醫生接受政府資助的大腸鏡檢查。如測試結果呈陰性，參加者應於兩年後進行覆檢。

目前，有超過1,200名基層醫療醫生在約2,300家診所提供服務，並有260名大腸鏡醫生參與計劃，於約790個診所進行檢查。在提供大腸鏡檢查基本服務時，大腸鏡醫生只可向參加者收取不多於1,000元的額外費用。超過70%的服務地點不會就大腸鏡檢查或切除瘜肉收取額外費用。"
69549904d6adf87a9bef67ed,大批內地旅客專程來港跨年 感受熱鬧氣氛,2025-12-31 11:31,2025-12-31 12:00,local,tvb,https://news.tvb.com/tc/local/69549904d6adf87a9bef67ed,"本港除夕無維港煙火匯演，但中環和西九文化區都會舉辦跨年倒數活動，吸引不少內地旅客專程來港。

在西九龍高鐵站入境大堂，早上有內地旅客抵埗，不少人是一家大小，帶同行李箱。

內地多個城市包括廣州、西安等公眾地方，都不會舉行由官方舉辦的跨年倒數活動，有民眾稱，雖然知道無煙火匯演，但都專程來港，感受跨年氣氛。

成都旅客梁小姐說：「有一些是取消了，可能人員聚集太多了，前面幾年都是這樣，所以大家會覺得在內地跨年可能就是太普普通通了，想來香港感受一下不一樣的跨年。」

山東旅客趙小姐指出：「我們準備去中環看倒數，原本想去維港，但維港煙花取消了，然後我們想來香港感受一下氛圍，就留在這裡，挺遺憾的，因為期待了挺久，然後突然就取消了。」

福建旅客王小姐稱：「我們會留在香港(過夜)，我覺得香港跨年夜也是比較熱鬧的，雖然沒有煙花，但是也可以走走看看的，香港(酒店)房價相對內地比較高一點，但是既然都來了，還是值得的。」

<a href=""https://news.tvb.com/tc/local/695344ccd6adf87a9be41f0f"" target=""_blank"" rel=""""> 倒數迎2026好去處｜西九首辦海濱倒數音樂會　中環遮打道迪士尼同步賀新年｜一文看清‧活動詳情</a>"
6954955dd6adf87a9bef4784,內地製造及服務業經營改善 重返擴張水平,2025-12-31 11:15,2025-12-31 11:45,finance,tvb,https://news.tvb.com/tc/finance/6954955dd6adf87a9bef4784,"內地製造及服務業經營改善，重返擴張水平。

國家統計局公布，十二月份製造業採購經理指數，較上月升0.9個百分點，至50.1，重上50水平，顯示擺脫四月以來的收縮局面。

反映服務業的非製造業採購經理指數，十二月份升至50.2，亦回復擴張。

十二月份綜合採購經理指數上升1個百分點至50.7，是六個月以來的高位。

國家統計局指，製造業市場需求有所釋放，企業生產較好擴張，市場價格向好運行，經濟景氣水平總體回升。"
695483cfd6adf87a9beec362,人民幣中間價升穿7.03關口 見十五個月高位,2025-12-31 10:00,2025-12-31 10:30,finance,tvb,https://news.tvb.com/tc/finance/695483cfd6adf87a9beec362,"人民幣中間價升穿7.03關口，並見十五個月高位。

官方開出的人民幣中間價，報7.0288兌一美元，較上個交易日上調60點子，是自去年九月三十日以來的高位。總結全年升約百分之2，終止連續三年的跌幅。現貨人民幣方面，在岸價和離岸價雙雙破7關，早段都於6.9算上落。

另外，人民銀行進行5,288億元人民幣七天期逆回購操作，扣除到期的逆回購，單日在市場淨投放5,028億元人民幣。外電估算，人行本周淨投放達11,710億元人民幣，規模見兩個月最高。"
69548068d6adf87a9beea2ed,樂華南邨謀殺案｜警方追緝死者非華裔本地男友 封鎖案發單位,2025-12-31 09:45,2025-12-31 10:00,local,tvb,https://news.tvb.com/tc/local/69548068d6adf87a9beea2ed,"牛頭角樂華南邨發生謀殺案，一名35歲失蹤女子被發現藏屍在一個單位的床架內，警方正追緝其非華裔本地男友。

到早上，位於喜華樓35樓的案發單位，警方在對出走廊設封鎖線，禁止其他人進入範圍，有警員在現場把守。"
69547bc2d6adf87a9bee7a1c,恒指開低53點 報25801點,2025-12-31 09:25,2025-12-31 15:45,finance,tvb,https://news.tvb.com/tc/finance/69547bc2d6adf87a9bee7a1c,"恒生指數開低53點，報25,801點。

攜程集團開低百分之2.01。優必選開高百分之2。小鵬汽車開高百分之2.18。"
69547631d6adf87a9bee56c4,擴大禁煙區｜元旦起指定場所門外3米內吸煙罰三千元 控煙辦：旅客會被直接票控,2025-12-31 09:02,2025-12-31 11:30,local,tvb,https://news.tvb.com/tc/local/69547631d6adf87a9bee56c4,"禁煙範圍元旦起進一步擴大，罰款倍增至三千元。控煙辦稱大部分情況，包括旅客都會被直接票控，但按現時人手，難以一收到投訴就到場，建議報警處理。

元旦起，市民在擴大了的禁煙區會見到新標示，包括院舍、學校、醫院等專用出入口三米範圍內，而在某些地方排隊時，見到這個藍色標示要留意，吸煙就要被罰3,000元。這些地方包括排隊入戲院、文娛中心、中環摩天輪、兩個主題公園、體育場、會展及亞博館，以及登上公共交通工具，夠兩人就算是排隊。

不過若果是這類公交候車點，就算一個人輪候，都禁止吸煙，這款沒有用地面標記、圍欄劃定區域就可以。

控煙酒辦公室稱，元旦起大部分情況，都會被直接票控。

控煙酒辦公室主任林民聰說：「在指定場所門外3米，這個禁煙情景，其實我們執法上都會有考慮的，例如當巡查時發現有吸煙人士，在不知情情況走過這些地方，或站在3米邊緣地方時，我們都可考慮作勸喻或警告。如果違例的人，很清晰地站在3米內，我們會一如以往不會作警告。」

這個情況下，加上禁煙範圍擴大，會否令更多人做「火車頭」，邊走路邊吸煙，避過票控？

林民聰表示：「我們下一步，將來都會考慮禁煙區會否需要進一步擴展，這是建立一個無煙的文化，無煙的氛圍，慢慢希望吸煙人士都盡量在不影響人的情況下，真的吸煙時，去一些不影響人的地方吸煙。」

他指前線職員目前有約120多名會主動巡查投訴多的地方，相信人手足夠，但要即時處理投訴或舉報有難度。

林民聰稱：「以現時人手，及考慮到吸煙是一瞬間行為，其實比較難做到，一收到投訴就即時到現場執法。如果發現有人違例吸煙時，可即時作出勸喻，假如遇到一些很不合作情況，可能需要即時找警方。」

控煙酒辦亦特別準備了這些小錦囊，在各個出入境口岸、主要旅遊景點，以及巴士站派發，提醒旅客新的禁煙措施。

至於9月起已禁止向18歲以下人士提供吸煙產品的措施，當局指至今接獲2宗舉報，由於資料不足，暫時未檢控。"
6954101ad6adf87a9beb405f,報章要聞｜明報：的士隊屆死線未達標／東方：團體料逾萬斑蝶停南大嶼,2025-12-31 08:58,2025-12-31 09:15,local,tvb,https://news.tvb.com/tc/local/6954101ad6adf87a9beb405f,"明報報道：政府七月向5支的士車隊發牌，牌照條件列明，車隊須在發牌後4個月內，達至所申請的車數規模，以5隊合計，上月底要有合共3,500輛，車隊的士服務。不過，運輸署回覆《明報》查詢確認，至今約1,300輛的士服務，即為完整規模約百分之37，未達牌照要求。

根據牌照文件，運輸署長可就車隊未遵守牌照條件，取消、暫時吊銷牌照或更改牌照條款。署方回覆時無回應車隊未達牌照條件有何後果，稱會繼續協助車隊招募司機及車主，推動各隊邁向所承諾的規模。

東方日報報道：環保團體綠色力量繼本月初於南大嶼，發現逾2,000隻斑蝶群，聚集越冬後，日前再於區內另一地點發現大量越冬斑蝶，數量更超過5,000隻，估計現時整個南大嶼有逾萬隻斑蝶停留，規模之大屬10年罕見，料該批斑蝶將留守當地跨年。

綠色力量環境事務經理盧詠鋒呼籲市民，如發現斑蝶群不應作出騷擾，行經時亦應保持動作緩慢，以免產生氣流觸動斑蝶群驚飛。"
6954100ed6adf87a9beb4016,報章要聞｜文匯：六成受訪者嫌樂齡科技產品貴／星島：伊院服務明年中遷新醫院,2025-12-31 08:28,2025-12-31 08:45,local,tvb,https://news.tvb.com/tc/local/6954100ed6adf87a9beb4016,"文匯報報道：為了解大眾對樂齡科技發展的看法，嶺南大學在11月進行民意調查，結果顯示醫療與運動相關的樂齡科技產品最受市民關注，但有六成受訪者認為，有關產品價格偏高，窒礙他們採用這類科技。

超過九成受訪者期望，政府能加強資助安老服務機構應用樂齡科技產品，擴闊長者醫療券計劃的涵蓋範圍，以資助長者購置樂齡科技產品。

星島日報報道：伊利沙伯醫院多項服務，未來將陸續遷往啟德發展區的新急症醫院。醫院管理局昨日向黃大仙區議會提交文件，指新醫院將於明年年中稍後時間分階段投入服務，大部分臨床服務，會以循序漸進的模式逐步轉移至新醫院。

臨床腫瘤科專科門診的舊症覆診會在首階段搬遷至「腫瘤科大樓」。有立法會議員關注文件中沒有詳細交代，伊院未來的醫療用途，期望醫管局日後可向公眾交代細節。"
6954635ad6adf87a9bedb8ca,豪威集團今起招股 入場費約10585元,2025-12-31 08:16,2025-12-31 08:45,finance,tvb,https://news.tvb.com/tc/finance/6954635ad6adf87a9bedb8ca,"半導體設計公司豪威集團今日起招股，入場費約10,585元。

每股招股價最高104.8元，共發售4,580萬股H股，當中一成本港發售，餘額國際發售。集資最多近48億元。下周三截止招股，下月12日掛牌。"
6954636cd6adf87a9bedb9d6,兆易創新今起招股 入場費約16363元,2025-12-31 08:16,2025-12-31 08:45,finance,tvb,https://news.tvb.com/tc/finance/6954636cd6adf87a9bedb9d6,"晶片設計公司兆易創新今日起招股，入場費約16,363元。

每股招股價最高162元，共發售逾2,891萬股H股，當中一成本港發售，餘額國際發售。集資最多逾46.84億元。下周四截止招股，下月13日掛牌。"
69546377d6adf87a9bedba97,瑞博生物今起招股 入場費約11710元,2025-12-31 08:16,2025-12-31 08:30,finance,tvb,https://news.tvb.com/tc/finance/69546377d6adf87a9bedba97,"生物製藥公司瑞博生物今日起招股，入場費約11,710元。

每股招股價57.97元，共發售逾2,748萬股H股，當中一成本港發售，餘額國際發售。集資超過15.93億元。下周二截止招股，下周五掛牌。"
69545f49d6adf87a9bed9b9c,金潯資源今起招股 入場費約6060元,2025-12-31 07:46,2025-12-31 08:00,finance,tvb,https://news.tvb.com/tc/finance/69545f49d6adf87a9bed9b9c,"陰極銅製造商金潯資源今日起招股，入場費約6,060元。

每股招股價30元，共發售逾3,676萬股H股，當中一成本港發售，餘額國際發售。集資逾11億元。下周二截止招股，下周五掛牌。"
69545f3ed6adf87a9bed9b4d,紅星冷鏈今起招股 入場費約6191元,2025-12-31 07:46,2025-12-31 08:00,finance,tvb,https://news.tvb.com/tc/finance/69545f3ed6adf87a9bed9b4d,"冷凍倉儲服務公司紅星冷鏈今日起招股，入場費約6,191元。

每股招股價12.26元，共發售逾2,326萬股H股，當中一成本港發售，餘額國際發售。集資逾2.85億元。下周四截止招股，下月13日掛牌。"
69545f32d6adf87a9bed9aef,MiniMax今起招股 入場費約3333元,2025-12-31 07:46,2025-12-31 08:00,finance,tvb,https://news.tvb.com/tc/finance/69545f32d6adf87a9bed9aef,"人工智能科技公司MiniMax今日起招股，入場費約3,333元。

每股招股價最高165元，共發售逾2,538萬股，當中百分之5本港發售，餘額國際發售。集資最多逾41.89億元。下周二截止招股，下周五掛牌。

基石投資者包括阿里巴巴及騰訊等內地企業，以及阿布扎比旗下投資機構等。"
69545f19d6adf87a9bed9a41,據報華納兄弟探索或再拒絕派拉蒙天舞收購建議,2025-12-31 07:46,2025-12-31 08:15,finance,tvb,https://news.tvb.com/tc/finance/69545f19d6adf87a9bed9a41,"據報華納兄弟探索很可能再一次拒絕，由派拉蒙天舞提出的收購建議。

《彭博》報道，華納兄弟探索或於下星期宣布拒絕派拉蒙天舞的收購建議，即使華納董事會尚未作出最後決定，但主要考慮因素是派拉蒙天舞並未提高收購價，之前董事會就是以條件不如Netflix，才拒絕派拉蒙天舞的建議。

華納將於下周舉行董事會會議作出最後決定，部分董事預期，派拉蒙天舞將提高收購價。"
69545997d6adf87a9bed7577,中韓商加快推進自貿協定第二階段談判,2025-12-31 07:30,2025-12-31 08:00,finance,tvb,https://news.tvb.com/tc/finance/69545997d6adf87a9bed7577,"商務部副部長李成鋼會晤南韓官員，討論加快推進中韓自貿協定第二階段談判。

李成鋼昨日在北京會見南韓產業通商部通商交涉本部長呂翰九。

對於南韓總統李在明將於下周日起訪華四天，期間會晤國家主席習近平，李成鋼就稱中韓兩國元首近期舉行會談，為雙邊經貿關係發展作出戰略指引，並提出要加快推進中韓自貿協定第二階段談判。

呂翰九表示願以兩國元首共識為指引，與中方共同努力、相向而行，加快推進韓中自貿協定第二階段談判，爭取盡早達成互利平衡的結果。"
69545520d6adf87a9bed4873,國家財政部發布個人銷售房屋增值稅政策,2025-12-31 07:16,2025-12-31 07:45,finance,tvb,https://news.tvb.com/tc/finance/69545520d6adf87a9bed4873,"國家財政部發布個人銷售房屋增值稅政策。

財政部表示由明年一月一日起，對個人出售購入不足兩年的住房，按照百分之3徵收率全額繳納增值稅，出售購入兩年以上的免徵增值稅。

至於在明年一月一日前，個人銷售房屋涉及的增值稅尚未申報繳納的符合本公告規定的，可依相關公告執行。 "
