id,title,date,scrape_time,section,source,url,news_content
68961537bccdd0876d225809,中芯國際：關稅政策硬著陸並未發生,2025-08-08 23:18,2025-08-09 00:00,finance,tvb,https://news.tvb.com/tc/finance/68961537bccdd0876d225809,"中芯國際指，關稅政策硬著陸並未發生，未見客戶提前備貨透支需求，集團產能至少到十月左右，仍供不應求，預計關稅影響或變得更小。

中芯國際聯合首席執行官趙海軍指出：「原先我們擔心的，關稅政策是否硬著陸，這場刺激和急建庫存，是否透支了未來的需求，以及大眾商品需求是否在新關稅下，引起的價格上漲後衰退，這些並沒有發生，至少在當下還沒有發生。可能又過數個月的時間，大家做了更有餘地的安排，可能這個影響會變得更小。」"
689614ffbccdd0876d2254a8,美股上升 道指重回44000點以上,2025-08-08 23:17,2025-08-09 00:00,finance,tvb,https://news.tvb.com/tc/finance/689614ffbccdd0876d2254a8,"美國股市上升，道瓊斯工業平均指數重回44,000點以上。

市場對聯儲局下月減息的預期升溫，美股三大指數均高開，道指曾升逾200點。

蘋果公司繼續造好，早段再升約百分之1。電動車生產商Tesla特斯拉升約百分之3。上日曾創新高的Nvidia輝達重回183美元附近。"
6895d1cebccdd0876d200207,首批參與聯廈聯管「三無大廈」聯合制定標書 業界指約十間公司有意投標,2025-08-08 23:15,2025-08-08 23:30,local,tvb,https://news.tvb.com/tc/local/6895d1cebccdd0876d200207,"政府為協助「三無大廈」，推出「聯廈聯管」計劃至今兩個月，第一階段約10座大廈，今日聯合制定標書。物業管理界人士指，要靠科技去聯合管理這類大廈。

第一階段參與「聯廈聯管」試驗計劃的大廈，部分位於深水埗大南街。這裡有舊式住宅大廈，並無安裝大閘，地面電箱欠缺保養，電線外露，甚至管線隨意接駁。

黃先生表示：「有管理當然好些，好過現在沒人管理，衞生弄好些，現在垃圾要全部自己拿去掉。」

吳女士稱：「掉垃圾沒人理，後樓梯有人吸煙，以及(環境)質素問題。有管理會好些，但費用又再轉嫁消費者身上。」

全港有超過3,000幢「三無大廈」，即沒業主立案法團、居民組織及管理公司。政府推行的「聯廈聯管」試驗計劃，希望協助「三無大廈」業主共同聘用同一間物管公司，聯合管理大廈，攤分管理費用，以較相宜的費用獲得基本大廈管理服務，從而改善管理及居住環境。

「聯廈聯管」試驗計劃六月起開始，包括深水埗等四區，合共已有約40棟大廈業主有意向參與。

有服務團體為大約10棟大廈聯合制訂標書，是首批落實參與的大廈，計劃向較有規模的物管公司招標，預計9月回標。

雖然大廈位置分散，每座大廈亦可能有不同需求，物管業界人士透露，初步有約十間公司有意投標。

香港物業管理公司協會前會長陳志球指出：「管理公司其實是促進人，你有不同要求服務，它就會告訴你，如要甲這項服務就有這費用，你要乙的時候，業主要承擔多少，招標過程業主會清清楚楚講出來。這些大廈不是要求很複雜，或很全面性的管理服務，最主要是最基礎，有人開業主會、成立法團，及最基本的維修。」

他認為可以利用科技遙距監控，解決大廈分散的限制。"
6896115ebccdd0876d223a85,基孔肯雅熱｜新增個案患者居石籬一邨曾往佛山探親 家居接觸者暫無病徵,2025-08-08 23:01,2025-08-08 23:30,local,tvb,https://news.tvb.com/tc/local/6896115ebccdd0876d223a85,"本港新增一宗基孔肯雅熱輸入個案，患者住在石籬一邨，去過佛山市探親。另外有一宗可能個案，患者最近亦曾經外遊。

衞生防護中心稱，新宗個案涉及一名有長期病患的66歲女子，住在葵涌石籬一邨。她上月24日至本月5日，獨自到廣東佛山市探親，返港後亦即周三起發燒、出皮疹及關節痛。過了一天到仁濟醫院求醫，同日入院，情況穩定。

中心認為，她潛伏期在佛山市，屬輸入個案，家居接觸者暫無病徵。

石籬邨住戶周先生稱：「都有少許擔心，暫時盡量避免去山區地方，花槽附近很多蚊，蠓也很多的。有時夏天到公園玩，很多小朋友也被蚊叮。」

石籬邨住戶楊小姐說：「確診了、有這些徵狀才來擔心，現在怎樣擔心？那隻蚊會飛、真的不知道。」

另一宗可能個案，涉及一名住在西灣河街的22歲女子。她上月16日至本月4日外遊，分別到過馬達加斯加、毛里求斯及馬來西亞。

她早於7月底在馬達加斯加時曾被蚊咬，有發燒，之後出疹，返港前已經退燒，但因關節痛求醫，已接受治療出院。

核酸檢測呈陰性，之後檢驗抗體就呈陽性反應，顯示可能是康復個案。中心認為她返港時已不具傳染性，下周再安排檢驗。

食環署就加緊滅蚊，包括早上到白紋伊紋分布廣泛的花墟一帶噴灑滅蚊劑，又稱會降低加強控蚊的門檻。

原本的機制，分區誘蚊器指數達百分之20時，才啟動強化控蚊工作；新機制下，指數介乎百分之10至20時，都會啟動。署方會評估這些區域的風險，在蚊患較高地點控蚊，亦會加強指數的資訊發放。

暫時上月全港白紋伊蚊誘蚊器指數為百分之8.1，按月有下跌，但仍顯示白紋伊蚊廣泛。


【延伸閱讀：基孔肯雅熱】

患者感染基孔肯雅熱後會出現發燒和嚴重關節痛。「基孔肯雅」是源自非洲馬孔德語中的一個詞，意思是「變得扭曲」，描述患者關節疼痛彎着腰的模樣。其他常見症狀包括肌肉疼痛、頭痛、噁心、疲倦和出現紅疹。症狀通常是自限性的，一般持續數天。但有些患者的關節痛可能會持續數月，甚至數年。

由基孔肯雅熱所引致的嚴重症狀及死亡十分罕見，並多數與其他已存在的健康問題有關。大部分患者可以完全痊癒。在偶爾的情況下，基孔肯雅熱病毒可引起眼、心臟及神經的嚴重併發症。新生兒、年紀較長人士及長期病患者出現重症的風險較高。

治理方法：
目前沒有特定的抗病毒藥物治療基孔肯雅熱，治療方法主要是紓緩症狀，包括使用退燒藥、止痛藥和補充體液。

資料來源：衞生署"
68960e58bccdd0876d221eec,全運會11月舉行 警務處聯同消防處等舉行跨部門重大事故及反恐演習,2025-08-08 22:48,2025-08-09 00:00,local,tvb,https://news.tvb.com/tc/local/68960e58bccdd0876d221eec,"十五屆全國運動會11月舉行，警務處聯同消防處等舉行跨部門重大事故及反恐演習。

演習在大嶼山竹篙灣社區隔離設施舉行，模擬有持械恐怖分子，在粵港澳三地公路自行車賽事期間，駕車衝向觀眾施襲。警方制服恐怖分子後，消防員利用爆破工具展開救援行動。救護人員為傷者分流，並與醫管局醫療隊，一同為傷者處理傷勢。

演習包括10個政府部門及相關機構，合共派出逾300名人參與，測試及提升各部門及持份者，在不同突發情況下，調配人手、制服施襲者，以及進行緊急疏散和救援的協調能力。"
68960c9cbccdd0876d2209e6,7月全球百大手遊發行商收入榜 中國佔32家,2025-08-08 22:41,2025-08-08 23:15,finance,tvb,https://news.tvb.com/tc/finance/68960c9cbccdd0876d2209e6,"有統計顯示，7月共有32家中國手遊發行商打入全球百大手遊發行商收入榜。

據Sensor Tower商店情報平台數據，百大內的中國手遊發行商合共吸金19.5億美元，佔百大手遊發行商收入的三成四。當中騰訊靠「王者榮耀」等多隻遊戲，帶動遊戲收入按月升兩成，繼續成為中國手遊發行商收入之冠，佔次席的是點點互動。"
68960c82bccdd0876d2209c0,加拿大失業率保持穩定,2025-08-08 22:41,2025-08-08 23:15,finance,tvb,https://news.tvb.com/tc/finance/68960c82bccdd0876d2209c0,"加拿大失業率保持穩定。

七月失業率維持於百分之6.9，與6月相同。市場原本預期加拿大的失業率，稍為升至百分之7。

期內，平均時薪增長擴大，上升百分之3.5，較6月高0.3個百分點。市場原本預期升幅放緩至百分之3.1。"
689605eebccdd0876d21cfee,金鐘牌照事務處將對代辦申請免試簽發駕駛執照人士實施新派籌要求,2025-08-08 22:12,2025-08-08 22:45,local,tvb,https://news.tvb.com/tc/local/689605eebccdd0876d21cfee,"運輸署位於金鐘的牌照事務處，下周三起將對代辦申請免試簽發駕駛執照的人士，實行新的派籌要求。

當日起，所有獲委託遞交申請的代辦，在領取即日籌時，須同時於系統輸入各免試簽發申請人的身份證首四位號碼或字母，有關資料會列印於籌號上。

櫃位人員會核對籌號持有人及申請人身份證號碼。如資料與籌號上列印的不符，即屬無效，申請一概不獲受理，亦不會補發籌號。

運輸署發言人指，新措施可以遏止憑籌號招攬生意的情況，確保市民公平有序使用牌證服務。牌照事務處已派員巡查和維持秩序，提升派籌系統以加強核對身份，阻截籌號轉讓。"
689605cbbccdd0876d21cfc8,崇正中學被指與深圳補習社合辦DSE課程 教育局已暫停學校營辦,2025-08-08 22:12,2025-08-08 22:45,local,tvb,https://news.tvb.com/tc/local/689605cbbccdd0876d21cfc8,"崇正中學被指跟深圳一間補習社，合辦中學文憑試(DSE)課程，令學生可以「學校考生」身份，報考文憑試。教育局稱已暫停該校的營辦。

教育局稱，由於崇正中學校董行為不令人滿意，所以按相關條例作有關決定，強調會繼續跟進事件，若發現學校有違法，會嚴肅處理。

至於被指合辦課程的深圳「摘星教育」補習社，在社交平台發聲明，稱只代理崇正中學招生，未有錄取任何一位學生，而該中學招收的學生，都會在香港校址上課。"
68960388bccdd0876d21c586,G-Dragon亞博舉行演唱會 有觀眾網購懷疑假門票未能入場報警求助,2025-08-08 22:01,2025-08-08 22:45,local,tvb,https://news.tvb.com/tc/local/68960388bccdd0876d21c586,"南韓歌手G-Dragon來港，一連三日在亞博舉行演唱會，有觀眾經網上購買懷疑假門票，未能入場，報警求助。

演唱會晚上8時開始後，仍然有多人在亞博館門口聚集，秩序大致良好，有警員到場了解，向部分人錄取口供。

有在現場等候的市民透露，經網上二手平台購買門票，但進場時發現未能讀取門票二維碼，懷疑買了假門票，報警求助。其後，警員安排部分人登上警車離開。"
68960308bccdd0876d21c21d,公立醫院收費改革｜醫管局正增聘人手 設專隊處理醫療費用減免申請,2025-08-08 22:00,2025-08-08 22:15,local,tvb,https://news.tvb.com/tc/local/68960308bccdd0876d21c21d,"公立醫院收費改革明年起實施，當局早前估算，在醫療費用減免機制下，受惠人數增至140萬人。醫管局稱正陸續增聘人手，成立專隊處理減免申請，亦會簡化審查程序。

醫管局回應查詢時稱，專隊除了處理減免申請，亦會減少重複核實病人收入和資產資料的需要，例如申請者家屬上次獲批的申請仍有效，則毋須逐一重頭評估。

局方在審批時，亦會參考其他社福和政府資助計劃下，已確認的經濟審查資格，亦會持續檢視人手需求，評估過程亦會盡量以電子化方式處理。"
6895ffa5bccdd0876d21a02a,成都世運會：劉慕裳奪港隊今屆首金 為年底世錦賽增強信心,2025-08-08 21:46,2025-08-08 22:15,local,tvb,https://news.tvb.com/tc/local/6895ffa5bccdd0876d21a02a,"成都世界運動會，劉慕裳在空手道為香港奪得今屆第一金。

劉慕裳在女子個人形，小組三戰全勝，四強再以3分輕取伊朗代表，晉身決賽，肯定突破上屆銅牌的成績。這位「世一」，決賽對世界第二、日本的尾野真步，今季第六次惡鬥，劉慕裳對上五次贏出四場。

兩人同樣選用「北谷屋良公相君」出戰，壓軸出場的她，最終獲得45.3分，贏1.7分奪金，完成賽前獎牌轉色的目標，更兌現一個承諾。

世運會空手道個人形金牌得主劉慕裳說：「我出賽前兩星期婆婆離世，這是我在她離開前應承她的事。」

劉慕裳感謝大家支持，又指這面金牌為她年底出戰世錦賽，增強信心。

劉慕裳稱：「知道自己仍有很大進步空間，不是到達一個盡頭，我很期待、急不及待回去練習，開始為11月的世錦賽做準備。大家對我的支持、我接收到的，我會在表現上回答大家。多謝大家支持。」

劉慕裳為港隊首奪世運會空手道金牌，亦是香港今屆第一金。"
6895fa8ebccdd0876d216d14,港鐵紅磡站信號設備狀況已處理 屯馬綫服務逐步復常,2025-08-08 21:39,2025-08-08 22:00,local,tvb,https://news.tvb.com/tc/local/6895fa8ebccdd0876d216d14,"[21:39]
交通消息｜港鐵：紅磡站信號設備狀況已經處理，屯馬綫列車服務逐步回復正常。

[21:23]
交通消息｜運輸署接獲港鐵通知，紅磡站附近有信號設備運作不暢順，屯馬綫來往屯門至烏溪沙的車程延長20至25分鐘。"
68960e3cbccdd0876d221e1d,時事多面睇｜懷疑無牌代理違規推銷基金 事主投資500萬追討無門,2025-08-08 21:30,2025-08-09 00:00,local,tvb,https://news.tvb.com/tc/local/68960e3cbccdd0876d221e1d,"近年有持牌基金公司，懷疑招攬無牌人士，游說其他人買基金產品，有機會觸犯《證券及期貨條例》。

法例上何謂推廣和銷售呢？市民透過這些「艇仔」買基金，會有甚麼風險？

<a href=""https://news.tvb.com/tc/programme/closerlook/68961796bccdd0876d2267ad"" target=""_blank"" rel="""">點擊觀看節目重溫</a>"
6895facfbccdd0876d216ec7,六間本地動畫公司獲政府資助推出六部動畫短片舉行首映,2025-08-08 21:15,2025-08-08 21:45,local,tvb,https://news.tvb.com/tc/local/6895facfbccdd0876d216ec7,"六間本地動畫公司早前獲政府資助推出的六部動畫短片，舉行首映。

入選本地原創動畫包括《海倫娜的夢》、《九宵》等六部動畫短片，分別長約15至20分鐘，最多可獲政府85萬元資助。

首映在香港藝術中心舉行，動畫公司派代表出席，分享製作經驗，以及應用人工智能(AI)技術時面對的挑戰。

六部動畫短片早前到法國參加安錫國際動畫影展暨市場展。部分入選作品月底起會在影院上映，供市民欣賞。"
6895f85abccdd0876d215678,都大：學費為主要收入來源 每年考慮不同因素調整研究生課程學費,2025-08-08 21:14,2025-08-08 22:00,local,tvb,https://news.tvb.com/tc/local/6895f85abccdd0876d215678,"本地大學的碩士課程學費近年急升，部分課程三年間加價近十萬元。

香港都會大學回覆查詢指，作為由政府創辦、財政獨立的自資大學，學費是主要收入來源，以支付大學營運及課程營運開支。

校方每年會考慮不同因素，包括綜合消費物價指數、課程特色及成本，以及同等院校所提供相關課程收費等，調整研究生課程學費。"
6895f502bccdd0876d2144f4,柴灣安老院舍五名女院友染產碳青霉烯酶腸道桿菌 暫無病徵,2025-08-08 21:00,2025-08-08 21:30,local,tvb,https://news.tvb.com/tc/local/6895f502bccdd0876d2144f4,"柴灣一間安老院舍，五名女院友感染抗藥性的產碳青霉烯酶腸道桿菌。

涉及的是柴灣環翠護老中心，五名院友介乎68至93歲，暫無出現病徵。衞生防護中心稱，經調查發現，該院舍未有全面執行感染控制措施，細菌可能在院舍內傳播。

中心會進行篩查，以找出其他帶菌者，強調該細菌可引致嚴重甚至致命感染。"
6895f4b2bccdd0876d213cea,基孔肯雅熱｜食環署稱會降低加強控蚊門檻,2025-08-08 20:45,2025-08-08 21:15,local,tvb,https://news.tvb.com/tc/local/6895f4b2bccdd0876d213cea,"因應本港有基孔肯雅熱輸入個案，食環署稱會降低加強控蚊的門檻。

原本的機制，分區誘蚊器指數達百分之20時，才啟動強化控蚊工作。新機制下，指數介乎百分之10至20時都會啟動。署方會評估這些區域的風險，在蚊患較高地點控蚊，亦會加強指數的資訊發放。

暫時上月全港白紋伊蚊誘蚊器指數，為百分之8.1，按月有下跌，但仍顯示白紋伊蚊廣泛。


【延伸閱讀：基孔肯雅熱】

患者感染基孔肯雅熱後會出現發燒和嚴重關節痛。「基孔肯雅」是源自非洲馬孔德語中的一個詞，意思是「變得扭曲」，描述患者關節疼痛彎着腰的模樣。其他常見症狀包括肌肉疼痛、頭痛、噁心、疲倦和出現紅疹。症狀通常是自限性的，一般持續數天。但有些患者的關節痛可能會持續數月，甚至數年。

由基孔肯雅熱所引致的嚴重症狀及死亡十分罕見，並多數與其他已存在的健康問題有關。大部分患者可以完全痊癒。在偶爾的情況下，基孔肯雅熱病毒可引起眼、心臟及神經的嚴重併發症。新生兒、年紀較長人士及長期病患者出現重症的風險較高。

治理方法：
目前沒有特定的抗病毒藥物治療基孔肯雅熱，治療方法主要是紓緩症狀，包括使用退燒藥、止痛藥和補充體液。

資料來源：衞生署"
6895f07cbccdd0876d21153b,基孔肯雅熱｜新增一宗輸入個案及一宗可能個案 累計至少五宗,2025-08-08 20:40,2025-08-08 20:45,local,tvb,https://news.tvb.com/tc/local/6895f07cbccdd0876d21153b,截至下午五時，新增一宗基孔肯雅熱輸入個案及一宗可能個案，累計至少五宗。
6895edd6bccdd0876d20fc75,據報中遠海運尋求長和出售港口交易佔至少兩成股權 北京稱將依法監管,2025-08-08 20:30,2025-08-08 21:00,local,tvb,https://news.tvb.com/tc/local/6895edd6bccdd0876d20fc75,"據報中遠海運集團正尋求在長和出售港口交易中，佔兩至三成股權，當中包括最關鍵的巴拿馬運河權益。

《金融時報》報道，目前討論中的方案，還包括中遠海運只取得41個港口股權，不包括兩個巴拿馬港口。

中遠海運是目前唯一一間獲准參與談判的中國企業，令公司擁有較大談判籌碼，因為貝萊德牽頭財團需要一個中國合作夥伴參與交易，才能獲中國當局批准。

長和上周曾公布，與貝萊德財團獨家磋商期已屆滿，擬邀請來自內地的主要策略投資者，加入成為財團重要成員。

在北京，外交部回應表示，關於長和出售海外港口資產，中國政府將依法進行監管，堅決維護國家主權、安全、發展利益，維護市場公平公正。"
6895e3debccdd0876d20a656,21名本地男女涉非法利用他人資料開設空殼公司 登記車輛作毒品餐車等,2025-08-08 19:47,2025-08-08 20:15,local,tvb,https://news.tvb.com/tc/local/6895e3debccdd0876d20a656,"警方拘捕21名本地男女，涉嫌非法利用他人資料，開設空殼公司，登記車輛作毒品餐車及流動武器庫等，檢獲共值約480萬元相關證物，包括18輛私家車。

警方在其中一輛私家車上，檢獲一系列公司登記的相關文件、約6.5公斤懷疑冰毒，約值340萬元，還有約10萬元現金等等。

警方指調查今年一月，一名24歲、懷疑有三合會背景男子在元朗工業區一帶，被斬多刀身亡的案件時，追查到該批私家車。

新界北總區重案組第一隊總督察歐陽德稱：「刀手的六輛私家車，分別由四間公司用作登記。這四間公司，其中三間的公司名的發音，是和一個活躍在本地黑社會的字頭發音極相近，帶有很濃烈的黑社會意味。」

警方指，四間公司去年4月至10月註冊成立，共登記了59輛私家車，其中兩間公司地址位於屯門某條村的村公所。

三間公司董事懷疑被人盜用了個人身份資料，用作註冊，剩下一間公司的董事暫時未找到，相信不法團夥是想隱藏真正的車主，逃避追查。

新界北總區刑事警司(行動)鄧翊几表示：「真實車主的身份是成疑，有可能影響有關車輛的保險效力，到真是不幸發生交通意外的時候，可能影響到追討損失和責任，對其他道路使用者的安全構成重大威脅。」

介乎19至55歲的十九男、兩女，包括一名開設空殼公司的骨幹成員，周二涉嫌行使虛假文書、串謀詐騙，和販運危險藥物等被捕。警方不排除有更多人被捕。"
6895e3b7bccdd0876d20a540,11名外傭被捕涉殺胎或供應藥物墮胎 警籲僱主提醒有懷孕跡象外傭及早求醫,2025-08-08 19:46,2025-08-08 20:15,local,tvb,https://news.tvb.com/tc/local/6895e3b7bccdd0876d20a540,"警方拘捕11名外傭，涉嫌殺胎或供應藥物墮胎等。警方指僱主應多留意外傭，若有懷孕跡象要盡早求醫。

警方6月接報，有外傭在天水圍住宅暈倒。救護員在她床邊洗衣籃，發現一個無生命跡象、28星期大的胎兒，相信她從朋友購買墮胎藥服食。

警方上月初在機場拘捕外傭的32歲朋友，同樣任職家傭，在她工作地址，檢獲懷疑墮胎藥包裝，及十粒墮胎藥。經調查後發現，她由去年5月起，一年內多次出售墮胎藥給其他外傭。

元朗警區重案組督察林浩賢說：「這名售賣(墮胎藥)、32歲外籍傭工是自己，從其他國家運送(墮胎藥)，本身是處方藥，需要註冊藥劑師或醫生才可以處方，有一定副作用。」

警方上月底起，在全港各區拘捕另外九名外傭，介乎30至46歲，涉嫌施用藥物促致墮胎。其中五人遭落案起訴，獲准保釋。

林浩賢指出：「警方呼籲有聘請外傭的僱主，如果留意到外傭有懷孕跡象，應該提醒他們及早求醫。不同地方有不同文化和法例，在香港非法提供服食藥物而引致墮胎，或因以上原因導致非法墮胎，都會觸犯刑事法例。」

警方提醒若胎兒滿28周大，殺胎最高可被判終身監禁。供應或服食墮胎藥，一經定罪，亦會被判三年至七年監禁。"
6895da50bccdd0876d205058,成都世界運動會：劉慕裳空手道女子個人形奪金 為港隊今屆首面獎牌,2025-08-08 19:06,2025-08-08 19:15,local,tvb,https://news.tvb.com/tc/local/6895da50bccdd0876d205058,成都世界運動會，劉慕裳在空手道女子個人形奪金，是港隊今屆第一面獎牌。
6895d8c9bccdd0876d204687,圖輯｜啟德體育園「五行童樂園」即日起開放 小朋友烈日下嬉水消暑,2025-08-08 19:00,2025-08-08 19:45,local,tvb,https://news.tvb.com/tc/local/6895d8c9bccdd0876d204687,"啟德體育園北斗園區戶外設施「五行童樂園」，即日起免費向公眾開放。

「五行童樂園」位於啟德體藝館旁邊，距離港鐵啟德站步行距離大約五分鐘，啟用首日已經吸引不少人入場。樂園面積逾4,300平方米，以金、木、水、火、土五行概念，設計成為五個園區，以五種顏色劃分，遊樂設施包括有滑梯、繩網、攀石牆、滑索等。

另外亦設有嬉水區等，市民可以在烈日下消消暑，小朋友都玩得很投入。

羅小朋友說：「下次如果我穿泳衣來，就可以在嬉水區內站久些。」

范小朋友稱：「這裡的避暑地方有點少，所以會很熱，會玩這個滑索涼一涼。」

園內亦設有適合傷健兒童玩的設施，推動共融遊樂的理念。遊樂場即日起朝九晚九開放。

另外，園區亦設有沙灘球場，可進行沙灘排球、網球及足球等活動。

國際排聯沙灘排球教練黃俊偉表示：「近期香港下大雨，疏水的情況都非常好，沙的質量非常好，非常接近去海外比賽的情況，所以運動員長期來進行訓練，高規格的設備，對比賽的適應力非常好。」

就算下雨都不怕，園區提供有蓋硬地球場，可以在室內進行匹克球，躲避盤等新興運動。啟德體育園總監鄧竟成亦親身落場，切磋球技。

有蓋硬地球場還可以進行五人足球及閃避球等運動，登記後就可以在無賽事及團體租用期間，預訂租用園區內的戶外場地。

至於多功能網球場，就採用靈活設計，可以轉換成為籃球場或排球場。預計本年第三季正式開放予公眾使用。"
6895d2c3bccdd0876d200e64,世茂集團上月合同銷售額按年減近兩成七,2025-08-08 18:34,2025-08-08 19:15,finance,tvb,https://news.tvb.com/tc/finance/6895d2c3bccdd0876d200e64,"世茂集團上月的合同銷售額，按年減少近兩成七，按月跌一成四，至接近20億元人民幣。

累計今年首七個月，合同銷售額155億元，按年跌兩成一。"
6895d29fbccdd0876d200d8c,和記電訊上半年轉虧為盈,2025-08-08 18:33,2025-08-08 19:15,finance,tvb,https://news.tvb.com/tc/finance/6895d29fbccdd0876d200d8c,"和記電訊截至六月底止上半年轉虧為盈。

純利600萬元，上年度同期虧損1,200萬元。中期息每股派2.28仙，與去年同期相同。收入升百分之7，至22億元。"
