id,title,date,scrape_time,section,source,url,news_content
693a3519d63af8b438bff374,兩共同業主涉僭建 被判罰款逾13萬元,2025-12-11 11:03,2025-12-11 11:15,local,tvb,https://news.tvb.com/tc/local/693a3519d63af8b438bff374,"​兩名共同業主由於不遵從根據《建築物條例》發出的清拆令，周三在九龍城裁判法院被定罪，及判罰款合共133,250元，當中109,250元屬就罪行持續的日數所判的罰款。

個䅁涉及大角咀福全街一幢商住大廈天台上的一個搭建物，面積約20平方米，僭建物並無事先獲得屋宇署的批准及同意。

屋宇署根據《建築物條例》向業主發出清拆令，但沒有履行清拆令，遭屋宇署檢控。

屋宇署發言人指：「僭建物可導致嚴重後果，業主必須盡快遵從清拆令。對於未有遵從清拆令的業主，屋宇署會繼續採取執法行動，包括提出檢控，以保障樓宇及公眾安全。」

根據《建築物條例》，任何人無合理辯解而沒有遵從清拆令是嚴重罪行，一經定罪，最高可處罰款200,000元及監禁一年，及可就罪行持續的每一天，另處罰款最高20,000元。"
693a33e3d63af8b438bfeb3e,余偉文：香港資本市場今年表現不俗 減息對本港樓市及經濟有正面作用,2025-12-11 11:00,2025-12-11 11:15,local,tvb,https://news.tvb.com/tc/local/693a33e3d63af8b438bfeb3e,"金管局總裁余偉文表示，減息對本港樓市及經濟有正面作用。

金融管理局總裁余偉文稱：「經濟也好，樓市亦好，有很多其他因素影響，並非只是息口，當然息口影響借貸成本，會有正面作用。我們見到香港的經濟，其實在過去幾季都頗正面發展，我們的資本市場今年表現亦不錯，樓市亦都穩定。當資產市場，包括股市及樓市比較穩定，或有所向上的時候，亦都會對消費有一定正面作用，所以有這些其他因素，加上減息，對我們的經濟或樓市都是正面。」"
693a302fd63af8b438bfc476,京東工業首掛股價「潛水」 開報13元較招股價低逾7%,2025-12-11 10:44,2025-12-11 11:00,finance,tvb,https://news.tvb.com/tc/finance/693a302fd63af8b438bfc476,"由京東集團分拆出來的供應鏈服務商京東工業首日掛牌，股價「潛水」。

開報13元，較招股價14.1元低逾百分之7。以每手200股、不計手續費，一手帳面蝕220元。股價早段一度低見12.66元。

股份公開發售部分錄得超額認購逾59倍，一手中籤率百分之35，國際發售超購約六倍八。集資淨額約28億元，主要用於加強供應鏈能力、業務擴張，以及戰略投資或收購。"
693a3018d63af8b438bfc300,有經濟師預期明年美聯儲新主席上任後減息步伐將加快 幅度或達一厘,2025-12-11 10:44,2025-12-11 11:00,finance,tvb,https://news.tvb.com/tc/finance/693a3018d63af8b438bfc300,"有經濟師預期，聯儲局明年減息幅度有機會達到一厘。

東亞銀行首席經濟師卓亮稱：「我們覺得(聯儲局主席)鮑威爾離任前，會否再有減息的一個動作，最多一次、或者不減息，但若(明年)五月份真的有一名新任主席上任後，相信減息步伐會加快，的確有一定的空間，有機會明年減息三至四次、75至100個基點的一個水平。」"
693a2eabd63af8b438bfb934,宏福苑五級火｜金管局：銀行業界正與保險業等討論 研究部分單位按揭安排,2025-12-11 10:33,2025-12-11 11:00,local,tvb,https://news.tvb.com/tc/local/693a2eabd63af8b438bfb934,"大埔宏福苑火災，金管局總裁余偉文表示，銀行業界正與保險業和法律界等，研究部分單位的按揭安排。

金融管理局總裁余偉文說：「按揭方面是頗複雜的情況，我們跟政府、保險界，其實我們跟銀行界是一起的，跟保險界、法律界不同人士有密切聯繫和討論，如何安排要視乎保險的安排如何，或之後重置安排如何，再看看之後法律方面的程序或問題要處理，但銀行業已在一籃子措施中，包括未來6個月，按揭供款可暫停，有空間大家可以去研究，往後這些按揭貸款可如何處理。」

余偉文又表示，與銀行業界已推出兩輪、合共11項支援措施，包括身故人士的戶口處理、提供緊急免息或低息貸款等，會因應災民在銀行服務的需要，提出進一步支援。"
693a2c80d63af8b438bfa2b4,飛虎隊—香港警方精銳部隊的遴選訓練流程｜延伸閱讀,2025-12-11 10:30,2025-12-11 10:45,local,tvb,https://news.tvb.com/tc/local/693a2c80d63af8b438bfa2b4,"香港警務處於1973年成立神槍手隊，並於翌年正式升格為「特別任務連」，俗稱「飛虎隊」。作為警隊的反恐精銳部隊，飛虎隊以執行高危任務聞名，其成員須通過多項高階訓練，並具備海、陸、空三棲作戰能力。

遴選流程

投考者須先通過為期四日三夜的「聯合基本遴選」，期間接受密集的體能與心理測試。通過者將進入為期一周的「進階遴選」。在此階段，投考者需連續完成大量突發任務。

成功通過遴選的人員，將接受為期三個月的基礎訓練課程，以及隨後長達半年的進階反恐訓練課程。只有表現出色者才能正式入隊。隊員在候命期間，亦須根據國際反恐情報，持續進行高強度的模擬訓練。

遴選注重心理素質　訓練嚴格全面

特警隊的遴選要求極為嚴格。警方曾表示過往有些潛質優厚的警務人員因體能要求而卻步，但現在隊伍更注重申請者的情緒成熟度和心理穩定性，體能則可透過培訓加強。候選人必須先通過為期四日的基本遴選課程，再參加六周的準備訓練，內容包括體能、武器運用、搏擊及行動戰略。其後，他們須接受為期七日的「遴選周」，評估領導才能、獨立處事能力及技能水平。學員亦須完成為期五個月的高級反恐怖活動訓練課程，

國際認可　裝備與訓練達一流水平

特警隊透過與海外執法機關的專業交流、聯合演習，以及對隊員表現的極高要求，已成為全球受尊崇的反恐隊伍之一。警方指出隊伍的卓越成績歸功於多個因素：不斷提升訓練課程質素、與海外優秀警隊互相派遣隊員訓練、重視內部溝通以提升士氣和團隊精神，以及配備最優良的裝備，強調特警隊不容許隊員只顧突出個人表現，團隊合作至關重要。

參與重大案件回顧

飛虎隊歷年來參與多宗重大案件，展現其處理高危情況的能力。

2012年10月，南丫島發生撞船海難，飛虎隊派遣水鬼隊潛入沉船進行搜救及蒐證工作。

2011年9月，隊伍參與處理屯門藍地回收場涉及6億元可卡因的案件。

2004年12月，飛虎隊搗破位於西貢榕樹澳的漁排，查獲歷來最大宗的液體可卡因工場。

2004年2月，大埔公路發生劫案，警方出動直升機及飛虎隊展開陸空搜捕，最終拘捕5名匪徒。

2003年12月，飛虎隊在油麻地行動中，成功拘捕頭號通緝犯季炳雄，並起獲AK-47等重型軍火。"
693a25d4d63af8b438bf7691,人民幣中間價兩連升 見逾一年高位,2025-12-11 10:01,2025-12-11 10:15,finance,tvb,https://news.tvb.com/tc/finance/693a25d4d63af8b438bf7691,"人民幣中間價連升兩天，並見逾一年高位。

官方開出的人民幣中間價報7.0686兌一美元，較上個交易日上調67點子，是自去年十月九日以來的高位。現貨人民幣方面，在岸價早段於7.06上落，離岸價於7.05徘徊。

另外，人民銀行進行1,186億元人民幣七天期逆回購操作，扣除到期的逆回購，單日在市場淨回籠622億元人民幣。"
693a25b2d63af8b438bf759f,余偉文：明年利率走向仍然不明確 視乎經濟數據,2025-12-11 10:00,2025-12-11 10:15,finance,tvb,https://news.tvb.com/tc/finance/693a25b2d63af8b438bf759f,"美國聯邦儲備局減息四分之一厘，金融管理局總裁余偉文表示，明年利率走向仍然不明確。

金融管理局總裁余偉文說：「勞工市場及通脹問題所引申的利率方向是相反的，若失業率高，其實要減息，通脹高要加息，所以美聯儲在如何衡量兩邊風險、如何平衡兩個風險、如何兼顧兩個政策目標，其實是有一定的難度及不確定性。所以我說未來減息的途徑或走向，其實頗不確定，要看即將公布的經濟數據如何。當然美國的息口走向會影響香港利率如何走，因為聯匯下，港息趨近美息。」"
693a0c53d63af8b438be99f4,香港中醫醫院今起分階段投入服務 首年提供門診及日間住院服務,2025-12-11 09:44,2025-12-11 10:15,local,tvb,https://news.tvb.com/tc/local/693a0c53d63af8b438be99f4,"位於將軍澳百勝角的香港中醫醫院，今日起分階段投入服務。

中醫醫院早上近8時舉行升旗儀式，醫務衞生局局長盧寵茂、衞生署署長林文健等出席。

中醫醫院首年會提供門診及日間住院服務，包括六大分科，亦即中醫內科、外科、婦科、兒科、骨傷科及針灸科。另外，亦包括老年退化性疾病，和中風後復康等12個專病項目。

醫院全科門診收費是180元，日間住院服務分上午、下午兩個時段，每時段四小時，首年收費450元。至於護理服務等收費，介乎200元至800元。"
693a20dcd63af8b438bf4631,開市焦點‧一圖看清｜市場關注聯儲局政策動向 港股早市初段上升,2025-12-11 09:34,2025-12-11 09:45,finance,tvb,https://news.tvb.com/tc/finance/693a20dcd63af8b438bf4631,"美股週三顯著上升，道瓊斯工業平均指數上漲497點，重上48,000點水平，收報48,057點；納斯達克指數亦錄得0.33%的升幅。市場焦點在於聯儲局最新的貨幣政策動向。

聯儲局公布減息並啟動買短債計劃

美國聯邦儲備局在議息會議後宣布減息，並同時公布將購買短期國債，以維持市場流動性穩定。此舉被視為當局對當前經濟狀況的應對措施。

個股消息：甲骨文盤後股價顯著波動

科技股方面，數據庫軟件巨頭甲骨文（Oracle）在美股收市後的延長交易時段中，股價急跌超過10%，市場關注其最新業績或前景展望的細節。

科技行業合作與採購動態

據市場消息指，社交媒體公司Meta Platforms 正在利用阿里巴巴集團的「通義千問」大型語言模型，以協助改善其人工智能模型的研發工作。受相關消息影響，阿里巴巴在美股市場的股價表現強於其港股價格，差距約為0.8%。

此外，有報道引述消息人士指，阿里巴巴及字節跳動等中國科技公司，據報有意向英偉達（Nvidia）訂購其最新的H200人工智能晶片。此舉顯示中國企業對高端AI算力持續存在需求。

港股展望

在聯儲局政策決議及一系列科技股消息影響下，市場氣氛趨向審慎。市場本預計港股今日將偏軟低開，但最後早市初段升過200幾點過外。投資者將繼續關注外圍市場動態及企業消息。"
693a1b36d63af8b438bf1465,港股高開169點 恒指報25710點,2025-12-11 09:23,2025-12-11 09:30,finance,tvb,https://news.tvb.com/tc/finance/693a1b36d63af8b438bf1465,"港股高開169點，恒生指數報25,710點。

滙控升百分之2.4，泡泡瑪特升百分之2.1，翰森製藥跌百分之1.1。"
693a186dd63af8b438bf0668,現場｜余偉文：美國息率走向存在不確定性 金管局將密切留意市場情況,2025-12-11 09:00,2025-12-11 09:45,local,tvb,https://news.tvb.com/tc/local/693a186dd63af8b438bf0668,"美國聯邦儲備局一如預期，減息四分之一厘。金管局按機制下調貼現窗基本利率，至4厘。

金管局總裁余偉文指出，聯儲局此次減息大致與市場預期相同，但認為美國的通脹走勢及就業情況仍存在許多不確定性，估計未來當地貨幣政策、息率走向有待觀察。

他表示，香港貨幣金融市場保持有序運作，港元拆息貼近美國息率，金管局將密切留意市場情況，維持香港貨幣金融穩定。"
693a1020d63af8b438beb87c,報章要聞｜明報：大嶼南部罕現2300斑蝶越冬／星島：推動「中醫藥走出去」策略,2025-12-11 08:58,2025-12-11 09:15,local,tvb,https://news.tvb.com/tc/local/693a1020d63af8b438beb87c,"明報報道︰環保團體綠色力量前日在大嶼山南部發現約2,300隻越冬斑蝶，數量之多為近年少見。

當中逾九成屬烏鴉型，包括藍點紫斑蝶、幻紫斑蝶和異型紫斑蝶，亦有零星屬老虎型，包括青斑蝶和嗇青斑蝶，更發現非常罕見的史氏絹斑蝶。發現地位於郊野公園範圍，屬山谷雜木林生境，面積約1,000平方米。

星島日報報道︰中醫中藥長年植根市民生活，從小醫館、跌打舖，到今天首間現代化中醫醫院，與政府中藥檢測中心正式啟用。

隨基礎設施與制度陸續到位，中醫藥發展邁向新階段。業界建議政府持續推動「標準化」與「國際化」雙軌策略，簡化審批流程、促進數據共享與科研轉化、提升中醫醫院作為臨床與研發平台的角色，結合醫、藥、產、研力量，發展成為香港創科與出口的支柱，拓展內地與國際市場，助力中醫藥「走出去」。"
693a1047d63af8b438bebaa7,智匯礦業今起招股 入場費約4555元,2025-12-11 08:45,2025-12-11 09:15,finance,tvb,https://news.tvb.com/tc/finance/693a1047d63af8b438bebaa7,"西藏礦業公司智匯礦業今日起招股，入場費約4,555元。

每股招股價最高4.51元，共發售逾1.2億股H股，當中一成本港發售，餘額國際發售，集資最多逾5.5億元。下周二截止招股，下周五掛牌。"
693a0e3ad63af8b438beb035,報章要聞｜東方︰勞工處巡棚網指引漏招種巨禍／大公︰棚網須全方位採樣,2025-12-11 08:19,2025-12-11 09:00,local,tvb,https://news.tvb.com/tc/local/693a0e3ad63af8b438beb035,"東方日報報道︰勞工處辦事不力，早接投訴巡查大埔宏福苑16次，內部無指引需檢查棚網阻燃性終肇禍。

《東方日報》近日接獲可靠消息，得悉勞工處內部巡查清單並無訂明建築工程地盤，需檢查棚網有否防火或阻燃，故即使多次接投訴到場，均無檢取宏福苑棚網樣本做阻燃測試，亦無引用條例要求停工。有工程師坦言，從未聽過勞工處會對棚網進行阻燃測試，處方平時亦未必會對棚架和棚網的阻燃性作詳細檢查。勞工處回覆指會不時審視內部守則及指引，在有需要時更新。

大公報報道︰大埔宏福苑大火揭發棚網阻燃證書涉嫌造假問題，政府爭取在本周內發出棚網安全檢測新安排，要求所有棚網物料送到工地後，必須就地採樣。

據了解，屋宇署已經擬定相關方案，包括要求承建商承擔確保棚網符合阻燃等標準的責任，就地採樣必須「全方位，多角度」，並須攝錄就地採樣全過程。棚網合格上架後政府會抽查，若發現未達標，承建商將被懲罰。"
693a0debd63af8b438bead13,現場｜本港經濟師分析料美聯儲明年或減息三至四次 達75至100個基點,2025-12-11 08:18,2025-12-11 09:00,finance,tvb,https://news.tvb.com/tc/finance/693a0debd63af8b438bead13,"美國聯邦儲備局一如預期，減息四分之一厘，聯邦基金利率目標範圍降至3.5厘至3.75厘。

對於聯儲局預料明年只減息一次、0.25厘，東亞銀行首席經濟師卓亮認為，預測基於點陣圖中位數意見，難以作準，估計明年減息幅度有機會較大，或達到75至100個基點、即減息三至四次。"
693a0e10d63af8b438beae56,特朗普再次抨擊鮑威爾 指聯儲局減息幅度本來可翻倍,2025-12-11 08:18,2025-12-11 09:00,finance,tvb,https://news.tvb.com/tc/finance/693a0e10d63af8b438beae56,"美國總統特朗普再次抨擊聯邦儲備局主席鮑威爾，指聯儲局減息幅度本來可翻倍。

特朗普表示，美國的利率應該是全世界最低，應該能夠實現超過百分之3或百分之4的經濟增長，不明白為甚麼美國不能實現兩成，甚至兩成半的經濟增長。

至於被視為下任聯儲局主席大熱人選的白宮經濟顧問哈塞特認為，聯儲局仍有很大的減息空間，而且需要進一步減息，認為聯儲局可以減息半厘，甚至更多。

他並表示，特朗普將於未來一至兩周最終確定下任聯儲局主席的人選。"
693a09bed63af8b438be8e4b,希迪智駕今起招股 入場費約2656元,2025-12-11 08:00,2025-12-11 08:30,finance,tvb,https://news.tvb.com/tc/finance/693a09bed63af8b438be8e4b,"商用車自動駕駛系統供應商希迪智駕今日起招股，入場費約2,656元。

每股招股價263元，共發售逾540萬股H股，當中百分之5本港發售，餘額國際發售，集資超過14億元。下周二截止招股，下周五掛牌。

公司由香港科技大學教授、亦即大疆創始人李澤湘，以及曾任德州儀器董事的馬濰創辦。"
693a09a6d63af8b438be8da3,京東工業招股獲接近60倍超額認購,2025-12-11 07:57,2025-12-11 08:30,finance,tvb,https://news.tvb.com/tc/finance/693a09a6d63af8b438be8da3,"由京東集團分拆出來的供應鏈服務商京東工業，招股獲接近60倍超額認購。

周四掛牌的京東工業，股份公開發售部分錄得59.5倍超額認購，一手中籤率百分之35。國際發售超購約6.8倍。

招股價每股14.1元，集資淨額約28.2億元，主要用於加強供應鏈能力、業務擴張，以及戰略投資或收購。"
6939edf3d63af8b438bda8c1,美國減息四分之一厘 本港金管局將基準利率降至四厘,2025-12-11 07:46,2025-12-11 08:30,finance,tvb,https://news.tvb.com/tc/finance/6939edf3d63af8b438bda8c1,"美國聯邦儲備局一如市場預期減息四分之一厘，預計明年只會減息一次。金管局將基準利率降至四厘。

聯儲局公開市場委員會舉行今年最後一次貨幣政策會議，以九票對三票議決，決定把聯邦基金利率目標範圍，下調到3.5至3.75厘，是連續第三次會議減息，利率水平下降到2022年11月初以來最低。

堪薩斯城聯邦儲備銀行行長施密德，及芝加哥聯邦儲備銀行行長古爾斯比，主張維持利率不變。

由美國總統特朗普提名，成為聯儲局理事的米蘭，則支持減息半厘。是自2019年以來，首次有三位官員對決議持不同意見。

會後聲明表示，經濟活動正以溫和的速度擴張。今年以來，就業增長放緩，通脹自年初以來有所上升，目前仍處於較高水平，經濟前景的不確定性依然較高。關注就業及通脹所面臨的風險。另外，為持續維持充足的儲備供應。聯儲局短期將購買400億美元國債，未來幾個月買債規模維持較高水平。

聯儲局主席鮑威爾表示，要謹慎評估就業及通脹情況，又認為若沒有新的重大關稅出台，通脹將於明年首季見頂。

美國聯儲局主席鮑威爾說：「假設沒有重大的新關稅政策出台，商品通脹應該會在明年第一季左右達到高峰。眾所周知，我們一直無法準確預測這一點。事實上，沒有人能做到，但可以肯定的是，明年第一季左右應該是通脹高峰。」

此外，聯儲局上調明年經濟增長預測，中位數為百分之2.3。作為衡量通脹指標的核心個人消費開支物價指數PCE，預測為百分之2.5。

聯儲局的點陣圖顯示，明年將減息四分之一厘，利率中位數為3.4厘。19位官員中，有7位認為明年不應減息。

聯儲局下次貨幣政策會議，是明年1月27至28日舉行。市場目前估計，聯儲局下月會議，維持利率不變的機會率，約七成左右。"
693a0133d63af8b438be3f25,加拿大央行維持基準利率於2.25厘 央行：目前政策利率大致合適,2025-12-11 07:24,2025-12-11 07:45,finance,tvb,https://news.tvb.com/tc/finance/693a0133d63af8b438be3f25,"加拿大央行一如預期，維持基準利率於2.25厘。央行表示，目前政策利率大致合適，若經濟前景有變，已準備好應對。

加拿大央行行長麥克林說：「加拿大經濟正經歷艱難的結構性調整，這將需要一些時間。當我們與企業交流時，他們對投資計劃非常謹慎，對招聘計劃也審慎。因此是的，我們很高興看到這些韌性，但展望未來我們預期增長將非常溫和。」"
693a0111d63af8b438be3e4a,Delivery Hero進行策略評估 以強化財務狀況並精簡營運,2025-12-11 07:23,2025-12-11 07:45,finance,tvb,https://news.tvb.com/tc/finance/693a0111d63af8b438be3e4a,"foodpanda母公司Delivery Hero正進行策略評估，以強化財務狀況並精簡營運。

公司向股東發信，透露正與顧問評估多項策略選項，以提升營運效率，並決定特定資產與國家業務的最佳長期擁有權方案，以及通過改善資本結構及資本配置措施，釋放業務價值。

《彭博》早前報道，由於公司過去一年股價表現欠佳，公司第二大股東，以及持股逾半成的投資者正施壓要求公司，出售全部或部分業務。"
693a00fcd63af8b438be3df1,亞馬遜2030年前向印度追加350億美元投資,2025-12-11 07:23,2025-12-11 07:45,finance,tvb,https://news.tvb.com/tc/finance/693a00fcd63af8b438be3df1,"亞馬遜宣布，在2030年前向印度追加350億美元、折合約2,730億港元的投資。主要涉及由AI人工智能、驅動的數碼化、出口增長及創造就業。

公司計劃在2030年為印度創造100萬個直接、間接、相關及季節性就業職位，並把出口額翻兩番至800億美元，及讓1,500萬家小企業受惠於AI帶來的效益。"
693a00ecd63af8b438be3da7,甲骨文截至十一月底止季度業績未如市場預期,2025-12-11 07:23,2025-12-11 07:45,finance,tvb,https://news.tvb.com/tc/finance/693a00ecd63af8b438be3da7,"甲骨文截至十一月底止季度業績未如市場預期，股價在延長交易時段，一度跌逾一成。

公司季內純利超過61億美元，按年增長九成四。經調整每股攤薄盈利2.26元，較預期多62美仙。但收入160.5億美元，較預期少超過1億美元。

當中軟件業務收入按年跌百分之3，至不足59億美元，較市場預期少超過1億美元。貢獻最大的雲端業務，收入接近80億美元，當中雲基建收入佔約41億美元。硬件及服務收入，則錄得單位數增長。"
6939fafad63af8b438be0d58,社評｜經濟：雙管齊下治通縮／明報：社媒年齡設限澳洲開先河,2025-12-11 06:57,2025-12-11 07:45,local,tvb,https://news.tvb.com/tc/local/6939fafad63af8b438be0d58,"經濟日報社評︰內地公布十一月份通脹數據，居民消費價格指數和生產者出廠價格指數，呈現一升一跌現象，折射經濟深層結構性問題，內需不足和產能過剩。

要打破當前通縮困局，從需求和供給管理兩方面同時入手。

在需求方面，需加大力度提升居民消費。當局亦要加大反內捲監管力度，一方面針對高內捲行業制訂最低出廠價格指引，違者會被重罰。當企業停止減價，商品出廠價格便有望止跌企穩，屆時民眾擔心愈遲買愈貴，便不再觀望，繼而讓居民消費價格指數也升溫。

明報社評：澳洲限制十六歲以下青少年，使用十大社交媒體帳戶的新法例，昨天正式生效，開創全球先河。

愈來愈多研究顯示，社媒會令人上癮。兒童青少年長時間使用，出現精神心理問題的可能也會增加。

社媒巨頭未有克盡社會責任，為了逐利無視未成年人福祉。政府加強監管無可非議，這不是單純的言論自由問題，還是公共衞生問題。即使無法禁絕青少年使用社媒，但可以向社媒巨頭施加問責壓力。

目前多國有意仿效澳洲做法，香港亦應密切留意事態發展。"
6939fae7d63af8b438be0c19,聯儲局年內第三次減息 美元匯價下跌,2025-12-11 06:57,2025-12-11 07:15,finance,tvb,https://news.tvb.com/tc/finance/6939fae7d63af8b438be0c19,"聯儲局一如市場預期，年內第三次減息，美元匯價下跌。

反映美元兌六隻主要貨幣的美匯指數，跌穿99水平，一度低見98.592，跌幅超過百分之0.6。

當中美元兌日圓跌約百分之0.6，跌穿156水平。美元兌加元跌百分之0.4，美元兌瑞士法郎跌約百分之0.8，歐元兌美元升百分之0.5，英鎊兌美元升百分之0.6。"
