id,title,date,scrape_time,section,source,url,news_content
689584adbccdd0876d1d847d,34歲男子涉推倒他人致死 承認誤殺判囚2年6個月,2025-08-08 13:01,2025-08-08 14:00,local,tvb,https://news.tvb.com/tc/local/689584adbccdd0876d1d847d,"一名男子去年初在黃大仙勸交時被推跌撞倒後腦不治。涉案的34歲男子承認誤殺罪，判囚2年6個月。

事發在去年1月29日凌晨，一名59歲男子在東頭邨的便利店飲酒，期間同行友人與一對父子起爭執，男子上前勸阻時被人推跌，留院兩日後不治。涉案的兒子、現年34歲被告章慶樂，承認一項誤殺罪。

辯方求情指，被告無意圖傷害該男子，認為事件屬不幸，亦深感悔意，又提到去年年底，被告在還押期間，父親離世，被告無法參加父親喪禮。辯方律師亦呈上4封，由被告母親、前僱主等所寫的求情信。

法官譚耀豪指，事發後被推跌的男子躺在地上時，被告逃離現場，沒有尋求醫療協助。法官接受被告無意圖傷害他，但指其行為帶來嚴重後果，令無辜的人死亡，判刑須具阻嚇作用，以判囚4年為量刑起點。

法官指，留意到被告早前就不同控罪，包括暴力相關行為罪行有定罪紀錄，基於被告認罪，判刑2年6個月。"
68957d92bccdd0876d1d485a,據報新世界發展與黑石集團等洽售資產,2025-08-08 12:30,2025-08-08 13:15,finance,tvb,https://news.tvb.com/tc/finance/68957d92bccdd0876d1d485a,"據報新世界發展正與多個潛在投資者，包括黑石集團及凱德集團，洽售資產。

《彭博》報道，美國黑石集團已與新世界展開討論，洽購多項資產，但目前未有實質計劃。至於新加坡凱德集團，在最近幾星期，亦已與新世界進行探索討論。

另外，阿瑞斯資產管理亦正檢視新世界的可收購資產。"
68957d7dbccdd0876d1d474e,恒指半日成交1125億元 多隻藥股繼續受壓,2025-08-08 12:30,2025-08-08 13:15,finance,tvb,https://news.tvb.com/tc/finance/68957d7dbccdd0876d1d474e,"恒生指數中午收市報24,916點，跌165點，半日成交1,125億元。

港股低開113點後，跌幅略為擴大，並在低位徘徊，受美國關稅憂慮，多隻藥股繼續受壓，尤其兩隻剛公布業績的藥股和黃醫藥跌一成半。

中芯上半年賺少近兩成，跌逾半成。其他大型科網股微跌，騰訊及阿里巴巴齊跌百分之1。"
68957a1cbccdd0876d1d2c14,基孔肯雅熱｜食環署於各區加強滅蚊,2025-08-08 12:16,2025-08-08 12:45,local,tvb,https://news.tvb.com/tc/local/68957a1cbccdd0876d1d2c14,"因應本港有基孔肯雅熱輸入個案，食環署在各區加強滅蚊。 

早上有人員在花墟公園外，一段界限街滅蚊。向草叢噴灑滅蚊劑。

根據食環署上月誘蚊器指數，花墟一帶所在的深水埗東達到黃色水平，即白紋伊紋分布廣泛。當局指食環署各分區正繼續聯同各相關部門及持份者，加強巡查，特別針對地盤及蚊患風險較高地點，加強清除積水及於積水處施放蚊沙等殺幼蟲劑，以超低微量霧化處理殺滅成蚊等。"
