id,title,date,scrape_time,section,source,url,news_content
69533e1dd6adf87a9be3e835,手語新聞報道｜更換播放頻道 1月5日起晚上6:30無綫新聞台播出,2026-01-05 16:01,2026-01-05 16:15,local,tvb,https://news.tvb.com/tc/local/69533e1dd6adf87a9be3e835,"電視廣播有限公司（TVB）早前向通訊事務管理局提出申請，調整附有手語傳譯的新聞節目播放安排。通訊局總監（經授權行使通訊局權力）已就此作出正式批覆。

批准改於TVB新聞台播放

根據通訊局於2025年12月12日發出的批准信件，通訊局總監已引用TVB本地免費電視節目服務牌照第一附表第2.2條的條件，批准TVB由2026年1月5日起，將《手語新聞報道》由明珠台改於無綫新聞台播放。

須合理通知觀眾安排變動

是次批准附帶一項條件，即TVB必須採取合理步驟，通知觀眾有關節目播放的變更安排，以確保公眾尤其是依賴手語新聞服務的觀眾能夠知悉播放頻道的更改。

——————————

手語新聞報道
2026年1月5日起　星期一至日　
晚上6:30　無綫新聞台"
695b6be8c26d920e366adaba,羅兵咸永道料今年本港新股上市增至150宗 集資額有望繼續躋身全球三甲,2026-01-05 15:44,2026-01-05 16:00,finance,tvb,https://news.tvb.com/tc/finance/695b6be8c26d920e366adaba,"有會計師估計，今年本港新股上市集資額介乎3,200億至3,500億元，有望繼續躋身全球三甲位置。

本港去年新股上市數目接近120宗，按年增長六成八，總集資額重奪全球第一，有超過2,800億元。羅兵咸永道認為，雖然地緣政治不確定性增加，但整體利率下降趨勢，以至政府的利好政策，均有利本港新股市場保持強勢。

目前已有逾300家企業遞表申請上市，當中不乏大型企業，預計今年新股上市數目會增至150宗，總集資額介乎3,200億至3,500億元。

羅兵咸永道資本市場服務主管合夥人黃金錢說：「中國經濟保持一個中高速增長，企業上市的融資需求，我們估計依然會很強勁，估計在2026年，大概40多間A股公司會在香港順利上市。2026年，我們估計依然有最少有3至5間、集資逾100億元的公司會在港上市。香港整體集資額會有機會繼續在全球集資額中，排名三甲之內。」

羅兵咸永道認為，新經濟企業，尤其是特專科技公司，以及生物科技企業，繼續是今年新股市場焦點。而零售及消費品服務，受惠內地政策推動內需，預計會有更多相關企業來港上市集資。"
695b68a0c26d920e366abec7,分析料委內瑞拉石油供應將顯著回升 國際油價下行風險增加,2026-01-05 15:30,2026-01-05 16:00,finance,tvb,https://news.tvb.com/tc/finance/695b68a0c26d920e366abec7,"美國對委內瑞拉採取軍事行動，並接管當地石油資源。有分析指出，委內瑞拉石油儲量全球最多，預計當地石油供應將顯著回升，國際油價下行風險正增加。

美國突襲委內瑞拉。美國總統特朗普指美國企業將斥資數十億美元，重建委內瑞拉的能源基礎設施，幫助委內瑞拉石油產業重現昔日輝煌。

委內瑞拉曾經是石油生產大國，並且是世界上石油儲量最多的國家，有超過3,000億桶，比沙特阿拉伯還要多。以現時每桶約57美元計，價值超過17萬2,000億美元。

不過，過去二十年來，委內瑞拉國家管理混亂、腐敗嚴重，加上美國對其石油實施全面禁運，制裁令到當地石油業陷入低迷。若美國可以完全掌控委內瑞拉的石油資源。分析相信，委內瑞拉在限制鬆綁下，供應會顯著增加，油價將面對新一輪下行壓力。而從事下游加工業務的美國墨西哥灣及西岸煉油廠亦將直接得益。

iFAST Global Markets副總裁溫鋼城說：「委內瑞拉多資源，除了油之外，金、銀、銅、鐵、錫都有，你知道特朗普，一會格陵蘭，一會是那裡，全部你有那些東西，他都好像有些興趣，所以(石油)生產上會否慢慢復蘇？或者慢慢增多？我覺得會今年很大程度上在每桶60至53美元之間徘徊，我認為所有事情穩定下來，油價壓力又會出現。」

多年來已有美國石油企業龍頭進駐委內瑞拉市場，但礙於制裁，產量一直受限。由於部分當地設施已老化，市場相信需要時間修復以恢復產能。

高盛維持對今年油價預測不變，但預期委內瑞拉的長期潛在供應會加大。對2027年及以後的國際油價構成下行風險。

而地緣政局不穩，黃金再發揮其避險功能，國際金價上升超過百分之1，重上每盎司4,400美元。"
695b597cc26d920e366a3e21,財金戰報｜以舊換新補貼料「縮水」 溫鋼城：續看淡汽車股,2026-01-05 14:31,2026-01-05 15:00,finance,tvb,https://news.tvb.com/tc/finance/695b597cc26d920e366a3e21,"內地新能源車今年「以舊換新」安排，由定額改為按車價比例補貼，市場憂慮會打擊低價車型的銷量。

溫鋼城維持看淡汽車股，認為「出海」是內地車企唯一出路，但並非每間公司出品都高質素。"
695b553dc26d920e366a1ee8,委內瑞拉局勢｜當地華人指有人搶購物資秩序大致良好 貨幣持續貶值影響大,2026-01-05 14:00,2026-01-05 14:30,finance,tvb,https://news.tvb.com/tc/finance/695b553dc26d920e366a1ee8,"委內瑞拉啟動全面戰備狀態，有當地華人指，有人搶購物資，但秩序大致良好。

移居委內瑞拉多年的李小姐，與先生在當地從事日用品批發生意。她指，自總統馬杜羅被美軍俘虜後，已不敢開門做生意，但市面秩序大致良好。

委內瑞拉華人李小姐說：「這兩天市面上很平靜，沒有示威，但是有很多市民排隊搶購物資，沒有哄搶情況，大家都很有秩序，排隊去買東西。綁架了總統，對我們最大影響是貨幣貶值，每天會貶百分之10左右，這是對我們影響非常之大。」

有內地專家分析，美國今次俘虜另一個主權國家領導人，不會取得預期效果。

復旦大學國際問題研究院院長吳心伯稱：「採取類似的這種霸權主義的行徑，肯定會給這個地區帶來巨大的衝擊。它不會帶來這個地區的和平、穩定和繁榮，很可能是局勢的緊張，甚至衝突和動盪，甚至美國國內，也會有這個來自民主黨的、強烈的反對的聲音。它的負面的衝擊會是長期的和嚴峻的，不管對美國還是對國際社會來講，都是如此。」

亦有專家認為，美國襲擊委內瑞拉的霸權行為，旨在掠奪當地石油等資源，本質上是一種「經濟殖民」。

<a href=""https://news.tvb.com/tc/world/6959220fc26d920e365868ba"" target=""_blank"" rel="""">委內瑞拉局勢．不斷更新</a>"
695b47a7c26d920e3669acb9,商務部等部門發布實施綠色消費推進行動通知 包括推動廢舊物品回收,2026-01-05 13:09,2026-01-05 13:45,finance,tvb,https://news.tvb.com/tc/finance/695b47a7c26d920e3669acb9,"國家商務部等九個部門，發布實施綠色消費推進行動的通知。

當中提到從七個方面著手，加大綠色農產品供應、發展綠色餐飲、推廣綠色消費積分、減少一次性塑料製品使用、推動廢舊物品回收再利用、發展二手商品流通，及加大信貸投放等20條措施。"
695b478ec26d920e3669ac35,證券業人士料恒指於兩萬六有支持,2026-01-05 13:08,2026-01-05 13:30,finance,tvb,https://news.tvb.com/tc/finance/695b478ec26d920e3669ac35,"有證券業人士認為，大市在兩萬六有支持。

獨立股評人熊麗萍指出：「本星期即使要調整回落，初步看是26,000點。或甚至乎10天、20天線最密集區域，便是25,700點。暫時26,000點可以守穩，都是700、800點上落。」"
695b4669c26d920e3669a5d5,港股反覆偏軟上午高低波幅不足200點 石油股有沽壓,2026-01-05 13:06,2026-01-05 13:30,finance,tvb,https://news.tvb.com/tc/finance/695b4669c26d920e3669a5d5,"港股反覆偏軟，上午高低波幅不足200點。

大市略為高開22點後，缺乏方向。市場憂慮油價下跌風險增加，石油股有沽壓，中石油和中海油，下跌百分之3至4。

資金追捧人工智能(AI)概念，快手上升百分之9，是上午表現最好的藍籌。阿里巴巴重上150元。

醫藥股亦有支持，信達生物、藥明康德和石藥，上升百分之4至6。"
695b4649c26d920e3669a4d3,土瓜灣遊樂場籃球架倒塌擊傷20歲青年 有居民懷疑當局未有經常巡查,2026-01-05 13:04,2026-01-05 14:00,local,tvb,https://news.tvb.com/tc/local/695b4649c26d920e3669a4d3,"土瓜灣靠背壟道遊樂場一個籃球架倒塌，擊傷一名青年。

籃球場位於樂民新邨旁，塌下的籃球架仍未移走，支架底部見到明顯生鏽痕跡。一名20歲青年周日晚十時半與朋友在此打籃球時，籃球架突然向前傾斜，擊中事主。據了解，傷者頭部擦傷，左膝及右邊肋骨痛，送往伊利沙伯醫院治理。

籃球場另一邊的籃球架，底部同樣已經生鏽。有居民懷疑這個籃球場位置較偏僻，當局未有經常巡查。

陸同學稱：「如果你不是住在這裡，都不會知道有這籃球場，不像公共運動場，少些人，可能就較少檢查。學校有人打籃球會扣下去、很大力扣下去，很大聲的，你會聽到『澎』一聲扣下去，可能這會令它塌下。」

同區的土瓜灣道遊樂場，籃球架底部及籃板亦欠缺保養。

申訴專員公署兩年前，曾就康文署戶外遊樂及康體設施保養及維修展開主動調查，指康文署部分前線人員沒有適時匯報設施損壞，或採取臨時安全措施。而署方當時曾估計，有300至400宗設施損毀，但暫緩維修，最長可達半年。

有立法會議員指，曾接獲市民投訴轉介康文署，未即時處理。

新民黨選舉委員會界別議員何敬康說：「有個案是去到場地做了適當檢查，認為未那麼嚴重，可能嚴重些的場地會優先(處理)。意外是不應發生，經過今次事件，可能表面上安全隱患未相對那麼高，都應該著手修葺。」

他又建議當局設立直接渠道，讓市民反映有設施損壞情況。"
695b45c9c26d920e36699fb2,二十四節氣．小寒｜天文台料今晚轉冷市區明日最低12度 日夜溫差頗大,2026-01-05 13:02,2026-01-05 14:00,local,tvb,https://news.tvb.com/tc/local/695b45c9c26d920e36699fb2,"今日是二十四節氣的小寒，天文台預測今晚轉冷，市區氣溫明日最低降至12度，星期三進一步下降至11度。

廣東地區天色大致良好，天晴乾燥，吹和緩北風，各區氣溫回升至20度或以上。

王先生指出：「21、22度舒服，最舒服是這種天氣。」

姚女士說：「涼了一些，不太凍，沒想像中那麼冷。」

羅太表示：「每個星期有幾日突然很冷，又突然升溫至20多度，都挺反常。不適應的，在家突然感到很冷，要全開暖氣。」

天文台預料，一股冬季季候風今日稍後逐漸影響廣東沿岸，夜晚北風增強，天氣轉冷，市區明日最低氣溫約12度，星期三、四進一步下降至11度，新界再低幾度，天晴及非常乾燥，日夜溫差頗大。

天文台科學主任陳玉葆稱：「受高空環流影響，與其相關的西風波動，不斷將北邊的乾冷空氣向華南輸送，所以這次季候風影響華南時間相對較長。季候風在周末和下周初稍為緩和，廣東沿岸早上仍然清涼，預料一股季候風補充下周中期影響華南沿岸。」

天文台指，星期二、三風寒效應明顯，提醒市民注意保暖。

<a href=""https://www.hko.gov.hk/tc/wxinfo/currwx/fnd.htm"" target=""_blank"" rel="""">九天天氣預報</a>"
695b46b4c26d920e3669a7f8,天氣動態圖｜冬季季候風北向南推進 未來數日早晚寒冷乾燥 天文台預測最低11度,2026-01-05 13:00,2026-01-05 13:15,local,tvb,https://news.tvb.com/tc/local/695b46b4c26d920e3669a7f8,"天文台今天（1月5日）上午發出特別天氣提示，指一股冬季季候風會在今天稍後逐漸影響廣東沿岸地區。預料這股季候風影響華南的時間相對較長，本港未來數日早上將持續寒冷，天氣非常乾燥，市民需注意保暖。

未來數日天氣預測：早晚寒冷乾燥　日夜溫差大

受冬季季候風影響，本港氣溫將會下降。展望未來兩至三日，早上將持續寒冷，市區最低氣溫維持在11至12度左右，新界地區會再低幾度。天氣則為天晴及非常乾燥，日夜溫差頗大。

天氣預報（1月5日11:30更新）如下：

1月6日（星期二）：天晴乾燥，早上寒冷。氣溫約 12至18度。

1月7日（星期三）：天晴，早上寒冷，日間非常乾燥。氣溫約 11至18度。

1月8日（星期四）：大致天晴，早上寒冷，日間非常乾燥。氣溫約 12至19度。

本周後期至下周初，季候風會稍為緩和，但廣東沿岸早上天氣仍然清涼。預料一股季候風補充會在下周中期影響華南沿岸，屆時天氣可能再度轉涼。

市民注意：做好保暖措施 關顧長者健康

由於天氣持續寒冷及乾燥，市民應注意以下事項：

適時添衣：早晚氣溫偏低，外出及睡前應準備足夠保暖衣物。

補充水分：天氣非常乾燥，應多飲水，並使用潤膚露防止皮膚乾裂。

關顧他人：多關顧身邊的長者及慢性病患者，確保他們有足夠的保暖措施。使用暖爐或暖風機時，務必注意室內空氣流通及消防安全。

市民可透過天文台官方網站或流動應用程式，查閱最新的天氣預報及警告信息。

<a href=""https://news.tvb.com/tc/local/695b3a9dc26d920e366934fd"" target=""_blank"" rel="""">小寒‧圖輯｜歲暮天寒　萬物冬藏待春歸</a>"
695b4219c26d920e36697aa8,羅兵咸永道料今年本港新股上市延續升勢 集資額至少3200億,2026-01-05 12:44,2026-01-05 16:00,finance,tvb,https://news.tvb.com/tc/finance/695b4219c26d920e36697aa8,"羅兵咸永道估計，今年本港新股上市延續升勢，集資額介乎3,200億至3,500億元，有機會排名全球三甲。

羅兵咸永道資本市場服務主管合夥人黃金錢說：「中國經濟保持一個中高速增長，企業上市的融資需求，我們估計依然會很強勁，估計在2026年，大概40多間A股公司會在香港順利上市。2026年，我們估計依然有最少三至五間公司、集資逾100億元的公司會來上市。新經濟公司因為業務的需求，這些公司來港集資，我們估計在2026年，甚至2027年會多，香港整體集資額有機會繼續在全球集資額中排名三甲之內。」"
695b3b63c26d920e3669442f,涉肉毒桿菌注射命案93歲西醫李宏邦被控誤導警務人員等 獲控方撤控,2026-01-05 12:17,2026-01-05 16:15,local,tvb,https://news.tvb.com/tc/local/695b3b63c26d920e3669442f,"西醫李宏邦肉毒桿菌注射命案，他另外涉及誤導警務人員，獲控方撤銷控罪。

案件早上在九龍城裁判法院提堂。93歲西醫李宏邦被控企圖誤導警務人員、沒有備存有關危險藥物的登記冊等罪。

控方聽取法律意見後，認為李宏邦身體狀況不適合答辯，申請撤銷控罪，獲裁判官陳志輝批准，李宏邦當庭釋放。

案發在2018年，李宏邦在尖沙咀的美容中心，為52歲女子張淑玲注射肉毒桿菌時，因為混合使用多種藥物，導致對方死亡。李宏邦亦被控誤殺，早前在高院「特殊聆訊」亦獲無條件釋放。"
695b3a9dc26d920e366934fd,小寒‧圖輯｜歲暮天寒 萬物冬藏待春歸,2026-01-05 12:15,2026-01-05 12:30,local,tvb,https://news.tvb.com/tc/local/695b3a9dc26d920e366934fd,"「小寒」是二十四節氣中的第二十三個節氣，正值「三九」前後。民諺有云「小寒大寒，凍成冰團」，標誌着一年中最寒冷時段的到來。雖然名為「小寒」，但在中國多數地區，小寒時節的氣溫往往比大寒更低，氣象記錄亦顯示它多是一年中最冷的節氣。儘管天寒地凍，古人觀察到陽氣已悄然萌動，並將小寒分為三候：「一候雁北鄉，二候鵲始巢，三候雉始鴝」，意指候鳥開始感知春信，準備向北遷徙、築巢，野雞也因陽氣滋長而發出鳴叫。

▍ 風有信，花不誤：小寒花信風

自小寒起，至穀雨終，二十四番花信風依時而至。每個節氣均有三種花次第開放。小寒節氣的花信風是梅花、山茶花、水仙花。這些花朵在嚴冬中綻放，向人們傳遞着堅韌與春來的訊息。

▍ 食暖人間：各地禦寒養生食俗

小寒時節的習俗主要圍繞禦寒養生與迎接新年而展開。各地飲食傳統充滿地域特色與溫情：

北京：一鍋沸水翻騰的涮羊肉，是抵禦嚴寒的最佳慰藉。

南京：一碗融合了青菜、板鴨、香腸的菜飯，盛滿了地道的鄉情。

東北：鐵鍋燉大鵝的濃郁香氣，被視為冬日裡最扎實的幸福。

廣東：家人圍坐同食的糯米飯，寄託着驅避寒氣、溫補滋養的心願。
此外，街頭巷尾烤紅薯的焦香，溫暖着寒風中的匆匆歸人；而臘八粥等溫補食物也是此時常見的節令飲食。

▍ 歲末生趣：從消寒圖到冰上嬉戲

在準備迎接農曆新年之際，小寒也充滿生機與樂趣。人們開始為春節做準備，寫春聯、剪窗花、置辦年貨，年味漸濃。此時亦有「畫圖數九」的習俗，繼續填描「消寒圖」，以雅趣的方式度過寒冬。

在冰天雪地的北方，河湖冰層厚實，滑冰、滑雪等冰上娛樂活動正當時，為凜冽冬日增添了無限生機。暖陽下，老人們閒話家常；冰場上，孩子們追逐嬉鬧，笑聲漾滿冬日晴空。

▍ 小寒雖寒，望春則暖

小寒雖是一年中最冷的時節，卻也蘊含着春天的希望。正如人生，不必抱怨生活的一地雞毛，也無需憂心困難永不消散。走過風雪嚴寒，便是春暖人間。四季交替，歲月輪迴，嚴寒至深處，也正是春聲漸近時。

<a href=""https://news.tvb.com/tc/greaterchina/69473db9b392e5851f306780"" target=""_blank"" rel="""">冬至．圖輯｜晝短情長　傳統習俗中的團圓與歲暮之美｜延伸閱讀</a>"
695b380ac26d920e36692b88,土瓜灣靠背壟道遊樂場有籃球架倒塌 20歲青年被擊中受傷送院,2026-01-05 12:03,2026-01-05 12:45,local,tvb,https://news.tvb.com/tc/local/695b380ac26d920e36692b88,"土瓜灣靠背壟道遊樂場有籃球架倒塌，擊中一名青年。

事發後，當局用圍帶將涉事籃球場封起，見到倒塌的籃球架，支架底部有明顯生鏽痕跡。至於另一邊的籃球架底部，同樣已經生鏽。

事發在周日晚十時半，一名20歲青年與朋友在現場打籃球，籃球架突然向前傾倒，並擊中事主。據了解，傷者頭部擦傷、左膝及右邊肋骨痛，清醒送往伊利沙伯醫院治理。"
695b33a3c26d920e3668fc80,港股中午收市報26316點 跌21點,2026-01-05 12:00,2026-01-05 12:30,finance,tvb,https://news.tvb.com/tc/finance/695b33a3c26d920e3668fc80,"恒指中午收報26,316點，跌21點。

中石油跌百分之4.3，九龍倉置業跌百分之4.1，快手升百分之9.6。"
695b33b9c26d920e3668fdc1,香港今年首次舉辦國際刑警組織周年大會 政府成立三層架構統籌協調,2026-01-05 11:44,2026-01-05 12:15,local,tvb,https://news.tvb.com/tc/local/695b33b9c26d920e3668fdc1,"香港今年首次舉辦國際刑警組織周年大會，將會有超過千名各地警隊高層及部長級官員出席。

警務處處長周一鳴接受報章訪問，指大會11月舉行，討論攜手打擊跨國罪案及加強國際協作。他指行政長官高度重視此次會議，成立了三層架構，分別由政務司司長、保安局局長及警務處處長，統籌內部工作小組及相關會議，利用近年籌辦大型活動經驗，確保協調順暢。

國際刑警組織1923年成立，本港警隊在1960年加入，目前共有196個成員。"
695b2668c26d920e36688fb0,二十四節氣．小寒｜冬季季候風今日逐漸影響廣東沿岸地區 本港晚間料轉冷,2026-01-05 11:40,2026-01-05 14:00,local,tvb,https://news.tvb.com/tc/local/695b2668c26d920e36688fb0,"[11:40]
天文台11時40分發出特別天氣提示指，冬季季候風會在今日稍後逐漸影響廣東沿岸地區，本港晚間天氣轉冷，明日(1月6日)早上市區最低氣溫會在12度左右。

預料季候風影響華南的時間相對較長，星期三、四早上仍會持續寒冷，市區最低氣溫在11、12度左右，新界再低幾度，日間非常乾燥。天文台提醒市民注意保暖，並多關顧長者及慢性病患者。

<a href=""https://www.hko.gov.hk/tc/wxinfo/currwx/fnd.htm"" target=""_blank"" rel="""">九天天氣預報</a>

[10:45]
今日是二十四節氣中的小寒，今晚顯著轉涼，天文台預測未來兩、三日，市區氣溫最低降至12、13度。

今早本港各區大約在13至16度，天文台預料，一股冬季季候風今日稍後逐漸影響廣東沿岸，未來兩、三日天氣轉冷，市區明日最低氣溫約13度，星期三、四進一步下降至12度，新界再低幾度，天晴及非常乾燥，日夜溫差頗大。

隨著季候風稍為緩和，周末至下周初氣溫略為回升，天氣持續晴朗，但早上仍然清涼。"
695b0a13c26d920e3667a3c4,油價亞洲市回穩 金價升穿4410美元一盎司,2026-01-05 11:30,2026-01-05 15:45,finance,tvb,https://news.tvb.com/tc/finance/695b0a13c26d920e3667a3c4,"美國突襲委內瑞拉，油價在亞洲市低開百分之1，其後回穩，金價升穿4,410美元一盎司。

紐約期油在亞洲市一度跌穿57美元一桶，倫敦期油跌至61美元水平。避險情緒升溫，金價上升，現貨金價升穿4,410美元一盎司，升幅近百分之2。銀價升逾百分之4，升穿76美元一盎司。

分析認為，全球投資者正面臨新一輪地緣政治風險，並預計會加劇美元作為避險資產不確定性。"
69589709c26d920e3653b9dc,新聞透視‧延伸閱讀｜創傷後遺症：成因、診斷與共病情況,2026-01-05 11:30,2026-01-05 12:00,local,tvb,https://news.tvb.com/tc/local/69589709c26d920e3653b9dc,"經歷嚴重的創傷事件後，部分人的身心壓力反應可能持續不退，甚至發展成「創傷後遺症」。這是一種焦慮症，指個人在經歷或目擊重大創傷後，出現持續且影響生活的焦慮及壓力反應。可能引發此症的創傷事件範圍廣泛，包括嚴重交通事故、軍事衝突、暴力襲擊、身體虐待、恐怖襲擊，以及各類天然或人為災難。

診斷標準：症狀持續逾一月且功能受損

精神科醫生在診斷創傷後遺症時，主要依據兩大國際通用標準：美國精神醫學學會的《精神疾病診斷與統計手冊》及世界衛生組織的《國際疾病和相關健康問題分類》。

關鍵的診斷條件在於，患者因創傷而出現的壓力相關症狀（如反覆回憶、噩夢、過度警覺、逃避相關情境、負面情緒與認知改變等）必須持續超過一個月，並且已明顯損害其人際關係、工作表現或日常社會功能。精神科醫生強調，症狀表現因人而異，需根據患者的具體情況進行全面評估，方能作出準確診斷並制定合適的治療方案。

常見共病情況：抑鬱、濫藥與解離狀態

值得注意的是，許多創傷後遺症患者可能同時受到其他精神健康問題的困擾。常見的共病情況包括抑鬱症、廣泛性焦慮症或恐慌症。

部分患者為了暫時忘卻創傷帶來的痛苦，可能會轉向酒精或毒品，因而衍生出酗酒或濫藥等次發性問題。此外，亦有患者可能出現「解離」狀態，感到自己的情緒或記憶彷彿與自身分裂開來，甚至遺忘某些與創傷相關的重要經歷或技能。

專家提醒，若懷疑自己或親友受相關症狀困擾，影響日常生活，應及早尋求精神科醫生或臨床心理學家等專業協助，透過評估與適切治療，有效管理症狀，促進康復。


新聞透視
星期六　晚上7:00　翡翠台
<a href=""https://news.tvb.com/tc/programme/newsmagazine/6958ba60c26d920e3654e2f2"" target=""_blank"" rel="""">節目重溫 - 新聞透視</a>"
