id,title,date,scrape_time,section,source,url,news_content
6939841cd63af8b438ba4316,時事多面睇｜康文署擬開放八場地舉辦商業活動 如何平衡一般市民使用權？,2025-12-10 22:30,2025-12-10 23:15,local,tvb,https://news.tvb.com/tc/local/6939841cd63af8b438ba4316,"康文署計劃開放八個場地，用作舉辦私人或商業活動，將委聘專業營辦商經營。學者及議員建議，要定期檢視營辦商有否跟從條款，亦要預留一定比例的時間給公眾使用。

尖沙咀文化中心外的露天廣場，即使不是假日也有不少人流。經營活動策劃公司的馬小姐指，這種室外場地，舉辦商業或私人活動，吸引力大。

活動策劃及布置公司負責人馬小姐稱：「因為已擁有最獨特的海景位置，這是政府場地獨有的，是給私人(機構)幾萬元也買不到的地方。例如尖沙咀這個廣場，又有鐘樓、維港景色，很適合舉辦主題性市集或節日活動。」

康文署計劃開放文化中心外的露天廣場、觀塘海濱花園等八個場地，用作舉辦商業或私人活動等，例如商業推廣、小型音樂會和生日會，打算委聘專業營辦商經營。署方月初已舉辦簡介會，有32個機構參加。

有遊客認為在觀塘海濱，舉辦小型音樂會是不錯的選擇。

旅客Sherry指出：「因為又有景色，又能聽聽音樂，或者有些活動，還挺有意思的。」

亦有市民擔心改由營辦商管理後，公眾不容易享用場地。

張先生表示：「這些是大家的公眾地方，我可以來散步或跑步，各人有各人選擇。給私人管理的話，希望不要阻擋這條路。」

有學者建議康文署應先決定場地規劃，能否持續發展，令經濟有幫助。亦應在批出場地後，定期檢視營辦商履行合約的情況。

香港都會大學運動及房地產管理課程主任吳偉恒說：「例如究竟用途是否符合批出時的目的，甚至參加的人數、活動的次數、種類等，這些全都能作為政府將來參考的數據。」

立法會議員謝偉銓建議，政府可在合約條款中，要求營辦商，預留一定時間給普通市民，或非牟利機構使用場地。"
6939806ed63af8b438ba1d29,舜宇光學上月主要產品出貨量按年均上升,2025-12-10 22:15,2025-12-10 22:30,finance,tvb,https://news.tvb.com/tc/finance/6939806ed63af8b438ba1d29,"舜宇光學上月主要產品出貨量按年均上升。
       
手機鏡頭按年增加百分之7.5，至近1.2億件，按月則下跌百分之2.3。

車載鏡頭出貨量按月和按年分別升百分之3.4和六成九。

手機攝像模組則按月跌近百分之8，按年增加近一成一。"
69398227d63af8b438ba327c,商湯已故創辦人遺孀設基金資助AI人才 蔡若蓮相信能與本港科技教育協同效應,2025-12-10 22:15,2025-12-10 22:45,local,tvb,https://news.tvb.com/tc/local/69398227d63af8b438ba327c,"由已故商湯創辦人湯曉鷗遺孀成立的慈善基金，捐出二千萬元，資助本地和海外大學培養人工智能(AI)人才。

著名人工智能技術科學家、商湯科技創辦人湯曉鷗前年逝世，終年55歲。

他的遺孀、港交所行政總裁顧問楊秋梅，今年3月成立「銘新慈善基金」，英文名稱以夫婦二人名字命名，將捐出2,000萬元推動人工智能發展。其中一半會捐贈予湯曉鷗生前任教25年的中文大學，用作招攬學者。

基金另外會向中大、港大、科大與新加坡南洋理工大學分別捐出250萬元，用於成立獎學金，預計可讓約30位從事人工智能研究的博士生受惠。

楊秋梅希望透過基金，繼承丈夫的遺志。

銘新慈善基金創辦人楊秋梅表示︰「他突然去世離開我們，其實這兩年是很難的。但我知道一件事情要做的，就要把他的願望，培養人才、支持社區持續做下去。現在人工智能全球發展的時候，一個是缺錢也缺人，同時也缺乏國際交流，現在有些聲音是要割斷學術交流，我們一定要逆潮流，多做一些向善、正面的，推動學術交流的。」

出席基金啟動禮的教育局局長蔡若蓮，相信捐助能與香港科技教育發展產生協同效應。

教育局局長蔡若蓮指︰「這個戰略性舉措，展現香港獨特角色，作為聯通內地和國際的橋樑，培養頂級人才、拓展前沿知識，推動科技和創新發展。」

基金會又計劃日後考慮資助內地或美國大學，目標三年後參與資助院校超過十間。"
69397b0ed63af8b438b9f029,醫管局：瑪嘉烈醫院擴建工程一分判商提交儀器校正證明書有問題 已報警,2025-12-10 21:51,2025-12-10 22:30,local,tvb,https://news.tvb.com/tc/local/69397b0ed63af8b438b9f029,醫管局：發現瑪嘉烈醫院荔景大樓擴建工程一分判商提交儀器校正證明書有問題，已報警調查。
69397932d63af8b438b9d999,馬會稱「香港國際賽事周」吸引逾千海外馬迷組團參加 按年多一倍,2025-12-10 21:44,2025-12-10 22:30,local,tvb,https://news.tvb.com/tc/local/69397932d63af8b438b9d999,"本周是馬會的「香港國際賽事周」，馬會稱，吸引了過千名海外馬迷組團到港參加，按年多一倍。
 
其中一場國際騎師錦標賽，晚上在跑馬地上演，不少海外馬迷都即場「做功課」。馬會稱，賽事周還包括即將在周日舉行的香港國際賽事，合共近1,400名海外旅客參與。他們同時會參觀不同旅遊景點，平均留港一周。

有負責組團的領隊稱，四年間這類旅客有大幅增長，今年海外馬迷的這一團有過百人，一度因為額滿要截止報名，當中三成是「回頭客」。

撇除機票及住宿，這班海外馬迷在港的消費約2.5萬至5萬港元，變相留港一周共消費至少約3,500萬港元。"
6939747ad63af8b438b9b23a,八分鐘本地新聞重點｜宏福苑每戶業主獲補助／拆圍網後或未移走雜物／青衣自然徑暫關閉,2025-12-10 21:23,2025-12-10 22:30,local,tvb,https://news.tvb.com/tc/local/6939747ad63af8b438b9b23a,"【宏福苑五級火｜宏福苑每戶業主獲補助】

政府成立的「大埔宏福苑援助基金」，外界捐款最新達31億元，連同3億元政府資金，合共有34億元。當局宣布向每戶業主發放一次性十萬元補助，又稱不排除部分基金用來重建或應付災民的住屋。
 
大埔宏福苑火災發生至今兩星期，目前確認160人罹難，當局下午向部分單位灌混凝土，相信用來加固結構。

援助方面，政府成立的援助基金收到26.3萬宗外界捐款，累計達31億元，當中一萬元以下有25.7萬宗，而五百萬以上有170宗，合共有17億。

之前發放的10萬元生活津貼，已批出1,617宗。向死者家屬發放的20萬元慰問金及5萬元殮葬費，暫時涉及106宗。而向傷者發放的5萬至10萬元，已批出64宗。至於向受影響外傭、學生及工友發放的資助金分別有63宗、220宗及110宗。

當局召開援助基金督導委員會後交代，將向宏福苑每戶業主發放一次性10萬元補助。

政務司副司長卓永興指出︰「有些業主其實靠出租宏福苑的單位收入應付日常開支，火災令他們失去收入。亦有業主早前投入一定資金為單位進行裝修及維修，因此亦有損失及現金流壓力。即使單位有超過一名業主，我們以每戶計算，補助額都是10萬元。」

當局指，委員會會監察援助基金運作，確保基金用得其所，部分自行承擔有關執行開支，不會要求基金回撥，重申支援是長期持續。
 
卓永興表示︰「是否現時已做得差不多，我想不可以這樣說，一有新問題、新的需要，我們要適時提供協助。應急住宿安排工作組，是研究宏福苑居民長期住屋及居住問題，那方面會看屆時有何方案走出來。如有需要時，基金會如何配合。」

被問到今次做法會否適用於日後其他火警跟進，民政及青年局局長麥美娟強調，今次是特事特辦。
 
民政及青年事務局局長麥美娟說︰「政府固然對某些事故有既定機制，但今次要做的已超出一般做法，今次規模之大、受影響人數之多，對我們社會造成影響，所以政府今次採取了司長所說的特事特辦。至於將來，最重要是如何預防不幸的事故再發生。」

當局下周開始將會向捐款市民發放收據，用作稅務寬免。


【宏福苑五級火｜民建聯向官員提四大重建選址建議】

民建聯跟政府會面，提出大埔宏福苑災民的五大安置方案，以及四大重建選址，最新包括廣福公園及富蝶邨第三期。他們引述政府稱會考慮，亦認同要提供不同方案，予災民選擇。

民建聯主席陳克勤，聯同19名黨內候任立法會議員，約見財政司副司長黃偉綸、房屋局局長何永賢等，討論他們的建議，指部分災民反映，一個百多呎的過渡性房屋要住三至四人，環境易造成情緒等問題，建議中期讓居民暫住簡約公屋。

長遠有五大安置建議，其中一個是重建，有四個選址，除了之前提出富善邨後建造學院訓練場用地，新增三個，包括跟宏福苑，一街之隔的廣福公園及球場，面積最大，有3.7公頃，但要處理附近加氣站在地底鋪設的管道。還有大埔頌雅路富蝶邨三期用地，地基已打好，但只能提供約一千個單位，數目只是宏福苑的一半。最後一個方案是原址重建。

民建聯主席陳克勤指出：「四處重建方案土地建議，也是以市民自己的選擇為本，讓他們有多些不同方案，適應現時災民環境及身份。第一我們沒有指，一定要哪個重置位置，亦沒有指一定方法賠償及安置災民，政府也覺得這是合適做法。」

若等不及重建宏福苑，民建聯有四個建議。包括容許居民將單位賣予政府，獲得一筆過資金，再買樓等，或交出宏福苑單位，再以居屋「樓換樓」，如何平衡正輪候居屋市民的聲音？

陳克勤說：「畢竟那只是1,900戶，而且1,900戶也不一定全部上公屋或換居屋，很多不同方案予他們選擇。我們提醒政府及自己，公帑運用要得宜，我們自己覺得重建工作上，最重要先用現時政府成立的支援基金，捐款先用，有需要再考慮向社會募捐或政府補貼。」

至於租戶，他建議提供一筆過賠償，作重購家具及電器等。


【宏福苑五級火｜大維修樓宇拆圍網後或未移走雜物】

政府早前勒令所有大維修的樓宇，拆除圍網，不過有業界指，不排除有承建商仍然未移走雜物，對途人仍存在風險。

屋宇署早前向全部230幢私人樓宇，發出移除棚網命令，所有外牆棚網已經完成移除。不過有業界人士反映，不少棚架在施工期間，被當作存放物料的空間，棚架上擺滿建築物料、紙皮箱等，擔心有部分移除棚網的棚架，未能及時移走雜物。

港九搭棚同敬工會理事長何炳德稱：「趕在三天將所有棚網下架的話，可能其他行頭未來得及，將物料全部清除，有機會因季候風吹至物料下墜，你拆網要三天，隨時重新拉網的時間，最少要十多天時間，所以真空期有機會超過一個月，就算用任何方法也好，都要及時將棚架上物料，移除或穩固。」

屋宇署正制定有關棚網的新安排，要求工地使用的棚網在上架前，就地採樣及核實是否符合標準，以便外牆工程可盡早恢復，最快本周內公布，何炳德希望新安排，亦能夠規管在棚架上擺放物件的準則。

何炳德表示：「反正業界內也存在那麼多惡習，亦有不規範的管理，要有一個統一的標準，我覺得要將指引寫得明確些，一些棚架上存放的物料，或用的發泡膠都沒列明，變相大家貪便宜或方便，走漏洞造成安全隱患。不要太過於彈性，讓大家有選擇，這情況下大家很多時會走漏洞。」

根據法例，棚架沒有安全圍網情況下，不能從事任何外牆工程，包括泥水、油漆、窗框、冷氣及水喉等工作。


【基孔肯雅熱｜青衣自然徑暫關閉滅蚊料至少需時7日】

因應近期的基孔肯雅熱本地個案，青衣自然徑暫停開放，以進行密集滅蚊，預計7至10日完成。衞生防護中心表示，蚊的飛行距離有限，相信暫時無社區爆發風險。

穿上全套防護衣物的食環署職員，在青衣自然徑北面入口，向草叢噴滅蚊噴霧。入口有圍欄封住，但有市民無理會，照樣越過圍欄上山。有附近居民指，擔心被蚊叮咬。

鍾女士說：「我還貼了蚊貼、有噴(蚊怕水)，但倒楣起來都沒辦法。」

吳先生表示：「我不停下來，沒有蚊咬我，一停下來卻是很多蚊子。」

衞生防護中心因應近期五宗基孔肯雅熱本地個案，患者都到過青衣自然徑一帶，部分人曾被蚊叮咬，經評估後認為自然徑風險較高，決定暫停開放，但認為暫時無社區爆發風險。

衞生防護中心傳染病處主任歐家榮稱：「個案都是零星的，但持續出現，我們相信感染源頭在青衣自然徑，仍然未清除。傳播基孔肯雅熱的是白紋伊蚊，白紋伊蚊飛行距離不長，大概100米範圍以內，相信不會飛去市區。我們相信大概用7至10天完成，風險減低會開放。」

青衣自然徑全長約4公里，附近有3個屋苑，包括長宏邨、長亨邨和長康邨，居住了逾42,000人。有滅蟲專家認為，大規模滅蚊的難度高。

香港蟲害控制從業員協會會長梁廣源指出：「行人徑周邊去噴，就算用手提，背在背上的射程不是很遠。地方大，噴的位置覆蓋大、角度小，蚊會飛走。你要用大型機器擠出藥水，一次過很大、很多蓋過去，(蚊子)沒那麼容易逃脫。」

誘蚊器指數顯示，包括葵青區在內的64個監察點，均低於警戒水平，屯門、元朗等白紋伊蚊數量稍多。衞生防護中心提醒，要預防被蚊叮，最好穿著寬鬆、淺色的長袖衫褲，及噴含避蚊胺的蚊怕水。


【延伸閱讀：基孔肯雅熱】

患者感染基孔肯雅熱後會出現發燒和嚴重關節痛。「基孔肯雅」是源自非洲馬孔德語中的一個詞，意思是「變得扭曲」，描述患者關節疼痛彎着腰的模樣。其他常見症狀包括肌肉疼痛、頭痛、噁心、疲倦和出現紅疹。症狀通常是自限性的，一般持續數天。但有些患者的關節痛可能會持續數月，甚至數年。

由基孔肯雅熱所引致的嚴重症狀及死亡十分罕見，並多數與其他已存在的健康問題有關。大部分患者可以完全痊癒。在偶爾的情況下，基孔肯雅熱病毒可引起眼、心臟及神經的嚴重併發症。新生兒、年紀較長人士及長期病患者出現重症的風險較高。

治理方法：
目前沒有特定的抗病毒藥物治療基孔肯雅熱，治療方法主要是紓緩症狀，包括使用退燒藥、止痛藥和補充體液。

資料來源：衞生署"
69396efad63af8b438b9812d,尖沙咀酒店婚宴31人吃乳豬等食物後疑食物中毒 全部情況穩定,2025-12-10 21:00,2025-12-10 21:30,local,tvb,https://news.tvb.com/tc/local/69396efad63af8b438b9812d,"31人在尖沙咀一間酒店的婚宴，進食乳豬等食物後，懷疑集體食物中毒，全部人情況穩定。

涉事是位於尖沙咀千禧新世界香港酒店的大宴會廳。

衞生防護中心稱，受影響人士介乎2歲至75歲，他們上周六到酒店的宴會廳，參與一個中式婚禮晚宴，用膳約2小時至27小時後，先後出現腹痛及腹瀉等病徵，當中一人已求醫，全部人毋須入院。初步調查顯示，他們曾進食多種共同食物，包括乳豬。

食安中心已即時指示酒店暫停供應涉事食物，清潔消毒，並抽取食物及環境樣本化驗。"
69396238d63af8b438b909ad,基孔肯雅熱｜再多一宗本地個案曾到青衣自然徑 男子居屯門業旺路,2025-12-10 20:05,2025-12-10 21:00,local,tvb,https://news.tvb.com/tc/local/69396238d63af8b438b909ad,"再多一宗基孔肯雅熱本地個案，曾到青衣自然徑，是一名40歲住屯門業旺路的男子。

當局昨晚起已暫停開放自然徑，以密集滅蚊。衞生防護中心稱預計7至10日完成，強調蚊的飛行距離有限，相信暫時無爆發風險。

穿上全套防護衣物的食環署職員，在青衣自然徑北面入口，向草叢噴滅蚊噴霧。入口有圍欄封住，但有市民無理會，照樣越過圍欄上山。有附近居民指，擔心被蚊叮咬。

鍾女士說：「我還貼了蚊貼、有噴(蚊怕水)，但倒楣起來都沒辦法。」

吳先生表示：「我不停下來，沒有蚊咬我，一停下來卻是很多蚊子。」

衞生防護中心因應近期五宗基孔肯雅熱本地個案，患者都到過青衣自然徑一帶，部分人曾被蚊叮咬，經評估後認為自然徑風險較高，決定暫停開放，但認為暫時無社區爆發風險。

衞生防護中心傳染病處主任歐家榮稱：「個案都是零星的，但持續出現，我們相信感染源頭在青衣自然徑，仍然未清除。傳播基孔肯雅熱的是白紋伊蚊，白紋伊蚊飛行距離不長，大概100米範圍以內，相信不會飛去市區。我們相信大概用7至10天完成，風險減低會開放。」

青衣自然徑全長約4公里，附近有3個屋苑，包括長宏邨、長亨邨和長康邨，居住了逾42,000人。有滅蟲專家認為，大規模滅蚊的難度高。

香港蟲害控制從業員協會會長梁廣源指出：「行人徑周邊去噴，就算用手提，背在背上的射程不是很遠。地方大，噴的位置覆蓋大、角度小，蚊會飛走。你要用大型機器擠出藥水，一次過很大、很多蓋過去，(蚊子)沒那麼容易逃脫。」

誘蚊器指數顯示，包括葵青區在內的64個監察點，均低於警戒水平，屯門、元朗等白紋伊蚊數量稍多。衞生防護中心提醒，要預防被蚊叮，最好穿著寬鬆、淺色的長袖衫褲，及噴含避蚊胺的蚊怕水。


【延伸閱讀：基孔肯雅熱】

患者感染基孔肯雅熱後會出現發燒和嚴重關節痛。「基孔肯雅」是源自非洲馬孔德語中的一個詞，意思是「變得扭曲」，描述患者關節疼痛彎着腰的模樣。其他常見症狀包括肌肉疼痛、頭痛、噁心、疲倦和出現紅疹。症狀通常是自限性的，一般持續數天。但有些患者的關節痛可能會持續數月，甚至數年。

由基孔肯雅熱所引致的嚴重症狀及死亡十分罕見，並多數與其他已存在的健康問題有關。大部分患者可以完全痊癒。在偶爾的情況下，基孔肯雅熱病毒可引起眼、心臟及神經的嚴重併發症。新生兒、年紀較長人士及長期病患者出現重症的風險較高。

治理方法：
目前沒有特定的抗病毒藥物治療基孔肯雅熱，治療方法主要是紓緩症狀，包括使用退燒藥、止痛藥和補充體液。

資料來源：衞生署"
6939610dd63af8b438b90063,兩岸四地｜有香港畢業生到大灣區內地城市工作 稱生活成本較低可體驗不同活動,2025-12-10 20:00,2025-12-10 21:30,local,tvb,https://news.tvb.com/tc/local/6939610dd63af8b438b90063,"近年越來越多大學畢業生，到大灣區內地城市工作，體驗不一樣的職場文化，以及生活節奏。有機構建議政府與更多大型企業合作，提供工作崗位。

Gigi去年在科大畢業後，就選擇來到廣州，從事金融行業風險管理工作，月入約兩萬元。她覺得內地職場文化，上班時間比較規律，更容易平衡工作和生活。

Gigi說：「我覺得在文化上吸引了我，因為一直都沒有特別深入體驗，在內地生活或工作。內地生活成本比較低，我可以用比較低的成本，做更多的事情、體驗不同的活動。」

她偶爾會與其他同樣在內地工作的香港年輕人見面，分享生活點滴，討論香港時事。

Gigi指出：「我會覺得回到自己熟悉的圈子裡，不適感就會再少一些，因為畢竟在這裡要自己生活一年，其實都會有一些思鄉，但幸好高鐵回去也是一、兩小時，不算太久，特別想家的時候，也可以回去『充電』。」

他們都是經政府舉辦的大灣區青年就業計劃來到廣州。而政府外聘了支援機構，為這些身處異鄉的年輕人舉辦聯誼活動。

除了唱歌，機構亦會舉辦手作坊、打羽毛球等活動，主要目的都是讓這些青年，可以在休假的時候聚一聚、鬆一鬆。

項目負責人稱2023年起，有約三千名香港青年，經大灣區青年就業計劃來到內地，現時就有約700名仍然在職。他認為政府應該繼續增加計劃的吸引力。

大灣區社會服務社項目主任葉文悅表示：「同學都傾向參與大公司的計劃，希望剛畢業第一份工作就在大公司工作，我們希望政府可以多些向不同的大企業、知名企業參加到計劃當中，開放多些不同的崗位給同學選擇。」

他亦建議政府多些到大專院校宣傳計劃。"
69395e9bd63af8b438b8e74a,運輸署明年起調整跨境許可證有效期至最長五年,2025-12-10 19:50,2025-12-10 20:15,local,tvb,https://news.tvb.com/tc/local/69395e9bd63af8b438b8e74a,"運輸署明年起，調整跨境許可證有效期至最長五年。

目前私家車跨境許可證每年每張為450元，明年一月一日所有遞交的申請，將可獲發較長有效期，以更有效配合個別跨境配額的有效期，最長可達60個月。12至60個月劃一收744元，少於12個月收62元。

已獲批使用多於一個陸路管制站的跨境私家車，會獲發一張涵蓋所有相關管制站的許可證。

至於在今年12月31日前接獲的申請，獲發的許可證有效期，維持不多於12個月，並按現行水平收費。"
69394f73d63af8b438b85454,粵車南下｜運輸署接逾百宗申請 有廣州車主到指定中心驗車形容過程順利,2025-12-10 19:45,2025-12-10 20:15,local,tvb,https://news.tvb.com/tc/local/69394f73d63af8b438b85454,"「粵車南下」計劃，本月23日起首批「粵車」可進入本港市區，有車主到指定中心驗車，需時約半小時，形容過程順利。運輸署稱昨日開始接受申請，暫時收到逾100宗。

廣州車主張先生，來到番禺區這間「粵車南下」內地車輛查驗中心驗車。他是「粵車南下」入境市區計劃的首批中籤者，驗車人員逐一測試扭方向盤、水撥、安全帶等功能。

合資格的私家車要八座以下，車身長度不可超過6.3米，車身沒有破損，其他條件要跟足香港標準，包括前擋風玻璃透光度不可少於百分之70。

車胎紋深度不少於1毫米，車亦不能進行結構性改裝等。通過查驗的車，同時免費獲貼「易通行」，全程約25分鐘。

驗車費用是450元人民幣，張先生還選擇安裝香港車牌的增值服務，合共付1,000元。

廣州車主張先生說：「如果能爭取23號出發，我就23日過去，活動範圍應該更大，去以前公交出行沒那麼方便的地方。」

驗車中心指，若是電動車有輔助或自動駕駛系統，就要做多一步。

「粵車南下」車輛查驗中心車間經理鍾仲欣指出：「因香港的標準是輔助系統上是帶有警示，是可以的，但可以實現自動駕駛，需要廠商和運輸署申請過才可以用，四星期有效期內，修正當時驗車不及格的項目，再預約驗車就可以。」

在休息室，有香港道路規則、駕駛指引等傳單及宣傳片，讓車主可以邊看邊等驗車。

廣東省政府首輪抽籤共1,700名車主獲可進入香港市區名額。運輸署周二起接受合資格粵車申請，至今接獲逾100宗內地部門的轉介。下周一起，中籤者可預約出行名額。"
69395b33d63af8b438b8c24f,今日有樓睇｜受惠多重利好因素 市場看明年樓價最多升一成半,2025-12-10 19:36,2025-12-10 20:00,finance,tvb,https://news.tvb.com/tc/finance/69395b33d63af8b438b8c24f,臨近年底，各大代理行及物業顧問，均展望明年樓市，以中原最樂觀，預期明年樓價升一成半，戴德梁行及仲量聯行預期最多升半成。
