id,title,date,scrape_time,section,source,url,news_content
695a2c27c26d920e3660ce1c,工展會明日閉幕 不少商戶減價促銷並提供特價貨品吸客,2026-01-04 17:00,2026-01-04 17:30,local,tvb,https://news.tvb.com/tc/local/695a2c27c26d920e3660ce1c,"工展會明日閉幕，不少人趁假期入場購物。

下午維園人頭湧湧，全場約900個攤位，不少商戶減價促銷，提供特價貨品吸客，有賣酒的攤檔就設「盲盒」抽獎。

今日工展會會開放至晚上9時，8時半起停止入場。明日最後一日開放時間是早上11時至晚上8時，7時起停止入場。"
695a2c1ac26d920e3660cb3b,賊人假扮水務署職員涉最少三宗入屋盜竊案 警提醒長者勿輕易相信陌生人,2026-01-04 17:00,2026-01-04 17:30,local,tvb,https://news.tvb.com/tc/local/695a2c1ac26d920e3660cb3b,"警方拘捕一名男子，涉嫌假扮水務署職員入屋盜竊，至少涉及三宗案件，警方提醒市民、特別是長者，切勿輕易讓陌生人入屋。

警方星期六以涉嫌入屋犯法罪，拘捕一名50歲本地男子，並檢獲相信是涉案贓物，包括鈔票、八達通及手機等。

警方聖誕節期間接獲三宗報案，位於長沙灣、深水埗及屯門的唐樓和公屋單位，先後遭人入屋盜竊。

匪徒訛稱是水務署職員，聲稱要入屋檢查水管，期間沒出示工作證，亦只是穿便服，而入屋後趁事主不為意，偷走放在當眼位置的財物，過程只是約一至兩分鐘，經調查後相信是同一人犯案。

深水埗警區刑事調查隊第十隊督察麥浿枬稱：「三宗案件犯案手法高度相似，受害人為70歲以上長者，賊人訛稱自己是水務署職員，專門針對欠缺閉路電視、鐵閘或保安的唐樓，或能透過走廊窗戶看到屋內情況的公共屋邨入手。特別是長者請提高警覺，切勿輕易相信陌生人，讓人進入單位前必須核實身份，提醒他們拿出證件。」

警方又提醒市民，避免將貴重物品放在當眼位置，而農曆新年假期將至，市民外遊前應鎖好門窗，加強家居防盜措施，避免賊人有機可乘。"
695a358ac26d920e3661185a,林健鋒指隨著經濟有望回穩 政府應考慮公務員加薪,2026-01-04 16:45,2026-01-04 18:00,local,tvb,https://news.tvb.com/tc/local/695a358ac26d920e3661185a,"本港去年經濟預計增長百分之3.2，行政會議成員林健鋒表示，隨著經濟有望回穩，政府應考慮公務員加薪。

行政會議成員林健鋒稱：「抱著一個有福同享的心態，特首亦在北京透露，我們現在經濟向穩，財政司司長亦表示，可能我們走向一個較穩定，有可能會出現盈餘。若每件事一環接一環轉好，香港經濟我認為是會向好的，既然在這個環境底下，公務員亦付出很多。除公務員，其實香港我們商界也好、專業界別也好均付出很多，若轉過頭來大家都有一些鼓勵，我認為是好的。」"
695a273dc26d920e36609e36,宏福苑五級火｜援助基金暫動用約12億助覓居所等 官員籲區內業主勿坐地起價,2026-01-04 16:39,2026-01-04 17:15,local,tvb,https://news.tvb.com/tc/local/695a273dc26d920e36609e36,"宏福苑援助基金已累計有41億元，勞工及福利局副局長何啟明稱，暫時動用約12億元，部分用於協助受影響業主及租戶尋覓居所，呼籲大埔區業主切勿坐地起價。

勞工及福利局副局長何啟明說：「對於如何使用慈善基金，整個特區政府包括民政局，會再檢視。當然街坊會希望大埔原區安置，希望大家了解，確實大埔位置有限，東鐵綫沿綫是否可以考慮，我覺得都可再檢視，盡量減低對大家的影響。希望大家(業主)，不要趁這時候坐地起價，我想這不是香港人希望見到的事。」"
