id,title,date,scrape_time,section,source,url,news_content
6895d27bbccdd0876d200c5c,舜宇光學上月手機鏡頭出貨量按年跌逾一成四,2025-08-08 18:33,2025-08-08 19:15,finance,tvb,https://news.tvb.com/tc/finance/6895d27bbccdd0876d200c5c,"舜宇光學上月手機鏡頭出貨量，按年跌超過一成四，為9,856萬件，主要因為公司專注於中高端案子，且產品結構較去年同期顯著改善。

車載鏡頭則增長近兩成九，主要是客戶端的需求提升。至於手機攝像模組出貨量，則跌近百分之3。"
6895d201bccdd0876d2004a2,本地大學碩士課程學費急升部分三年間加價近十萬 議員憂打擊本地生報讀意欲,2025-08-08 18:31,2025-08-08 19:30,local,tvb,https://news.tvb.com/tc/local/6895d201bccdd0876d2004a2,"本地大學的碩士課程學費近年急升，部分課程三年間加價近十萬元。有議員指，院校考慮供求自主釐定收費。有意見擔心打擊本地生報讀意欲。

本港上學年有近七萬人正修讀自資碩士或博士等研究生課程，學費動軏六位數，不少近年幾乎年年加價。

以香港大學為例，經濟學碩士2020/21學年，課程收26.8萬元，之後三個學年入學，每屆貴約2萬至4萬，最新一年學費加到36萬元。

都會大學工商管理碩士(中文)，新學年入學收43萬元，比三年前貴了五成，即加了逾14萬元。

研究院課程內容、收費，由院校自主釐定。本身是嶺大副校長的立法會議員劉智鵬指，除了考慮成本，還有需求。

選舉委員會界別議員劉智鵬稱：「近這五年，香港很多大學都在QS上越排越高。國際地位越提升，我們課程受歡迎程度越高，於是需求大過供應很多。這數年有地緣政治的影響，我們發現大學內很多學科，即使加了學費，申請人數都是增加。」

政府提出推動國際專上教育樞紐建設。上學年在香港讀研究院課程，近七成是非本地生，來自內地的佔多數，海外學生佔整體百分之1.6。有議員就擔心，碩士課程再加價，本地學生報讀意欲會再跌。

立法會教育事務委員會副主席梁子穎表示：「影響到僱主找一些專業人才去幫助公司業務發展。若本地的學生或青年朋友，學歷不及其他海外人士的話，變相我自己擔心，這些公司請更多外地專才來港，變相不利本地青年發展。」

他指，非本地生入讀研究生課程，所需宿舍等配套較多，建議院校考慮分非本地生和本地生收費。"
6895d1eabccdd0876d200376,土瓜灣私人屋苑翔龍灣現沉降裂縫最闊超過一吋 疑與中九龍幹線工程有關,2025-08-08 18:31,2025-08-08 19:15,local,tvb,https://news.tvb.com/tc/local/6895d1eabccdd0876d200376,"土瓜灣私人屋苑翔龍灣出現沉降，商舖與行人路之間出現裂縫，最闊超過一吋，懷疑與中九龍幹線工程有關。屋宇署曾派員視察，認為樓宇整體結構沒有明顯危險。

位於土瓜灣的翔龍灣，幾乎整個屋苑的地面，都可以見到這些裂縫。面向九龍城碼頭的外牆，裂縫較闊。商場和旁邊的中華煤氣變電站之間都出現罅隙。部分地方暫時圍封，工人正填補空隙。

其中一個出現裂縫的位置在海港酒家門口，外面的樓梯與地面之間的罅隙，可以塞入三隻手指。這些裂縫出現已經有一段時間。

黃小朋友說：「有些樓梯的膠破了，也不會太害怕，我們樓上大廈仍未受到影響。」

鄔先生稱：「我每天都在這裡，但我不感覺到有下陷，也不太察覺有裂縫。就算在我居住的大廈，即對面工廠大廈，(中九龍幹線)就在我們大廈地底，但都不覺有問題。」

九龍城區議會早前曾討論事件，有區議員質疑沉降問題，是否與中九龍幹線工程有關。

路政署回應指，於翔龍灣收集的監察數據並無異常，沒有對結構造成不良影響，亦沒有超出預設沉降指標。屋宇署亦曾派員到場視察，認為樓宇整體結構沒有明顯危險。

有工程師指，大廈結構主要依賴樁柱，地面沉降不會對樓宇結構有危險。

結構工程師倪學仁表示：「唯一要擔心的是，有一些地底設施會經過不同地方，有些會連接屋宇入面。如果大廈不動，而外面的泥土出現沉降，有機會令排水管漏水、水喉會爆，所以施工時多數會與外面喉管連接的地方，放一些避震喉，一般可以承受200毫米的沉降。」

他又指，翔龍灣位於填海區，如果附近有施工，可能會增加泥土重量，以及增加地面震動，沉降屬正常現象。


【延伸閱讀：中九龍幹線 (將命名為「中九龍繞道（油麻地段）」)】

中九龍幹線全長4.7公里，採用雙程三線分隔車道的設計，連接西九龍的油麻地交匯處，與東九龍的啟德發展區和九龍灣道路網，成為橫跨九龍中部的幹道。

中九龍幹線將提供一條快速替代道路，令車輛繞過現時擠塞的路段，大大節省行車時間。工程完成後，預計在繁忙時間，取道幹線來往西九龍與九龍灣的車程約為5分鐘，與沒有幹線的情況比較，大大節省約25分鐘。

中九龍幹線亦會分流九龍區東西行主要幹道的交通流量，紓緩其擠塞情況。周邊地區如黃大仙、何文田及九龍城等，亦可因交通情況改善而同時受惠。

資料來源：路政署"
68958f4fbccdd0876d1dd234,屯門海珠路住宅地共收八份標書 分析相信發展商出價進取,2025-08-08 18:30,2025-08-08 19:15,finance,tvb,https://news.tvb.com/tc/finance/68958f4fbccdd0876d1dd234,"今季唯一一幅招標住宅地，屯門海珠路地皮住宅地截標，一共收到八份標書。有分析認為，地區發展成熟，相信發展商出價進取。

作為港府季內唯一一幅推出招標的住宅用地，吸引到包括信置、中海外、長實、保利置業，以及嘉華等的發展商入標。

嘉華香港地產發展及租務總監尹紫薇表示：「現時有很多巴士路線很方便，以及將來起好後，都會有新港鐵站在附近，所以我們都覺得這幅地在位置上都可以。」

地皮位於屯門海珠路，鄰近輕鐵豐景園站，及日後落成的屯門南延綫港鐵車站。地盤面積約4.7萬平方呎，最高可建樓面約28.2萬平方呎，預計可興建約26層高住宅，提供逾500伙，最遲2031年落成。最新市場估值介乎4.2億至7.9億元，相當於每呎樓面地價約1,500元至2,800元。

根據賣地條款，中標的發展商需興建公共交通總站，及平整周邊作公眾用途的路面等。

高力香港研究部主管李婉茵說：「當然最開初會增加了他開發的初期成本，例如交通樞紐站的建設，都有利於項目將來的可達性，亦都提高項目的吸引性。另外將會有屯門延綫，將來港鐵新的鐵路服務，應該非常受當區居民一些換樓客歡迎。住宅市場應該開始回穩，相信發展商投標信心大了，出價會比較進取。」

本港樓市疲弱，發展商投地意欲審慎，過去兩年多次有地皮流標，政府減慢賣地步伐。截至六月底，本港未來三至四年，一手住宅供應量仍維持在10萬伙以上。

李婉茵認為市場供應仍多，相信政府日後仍會採取「一季一地」的賣地策略，待消化目前的庫存後，才會再逐漸推出更多土地儲備。她預計，在息口和外圍局勢不明朗下，下半年本港樓價維持平穩，明年才有機會重拾升勢。"
6895c1b9bccdd0876d1f705f,時事通識｜交通意外傷亡援助計劃,2025-08-08 18:26,2025-08-08 18:30,local,tvb,https://news.tvb.com/tc/local/6895c1b9bccdd0876d1f705f,"社署去年3月起透過內部審查，發現有不法分子利用偽造病假紙，騙取交通意外傷亡援助金。警方已先後拘捕300多人，部分人已遭起訴。

交通意外傷亡援助計劃已實施46年，原意是為交通意外中的傷亡者及家屬，提供經濟援助，不設經濟審查。

當局早前在檢討計劃期間，發現有不尋常個案。例如有行人在5年內，多次遇到交通意外後申請援助金，獲批超過64萬元。

當局今年6月底實施新安排，將原本五個補助項目當中，受傷補助和臨時生活補助，合併為體恤補助。合資格申請人每日可獲發330元，大約是以往兩項補助額，每日最高918元的三分一。新安排又規定最多以60日病假為限，要由醫生證明需留院不少於七日，或獲發不少於七日病假。

騙取交通意外傷亡援助金，屬刑事罪行，可根據《盜竊罪條例》被起訴，最高可被判入獄14年。

<a href=""https://news.tvb.com/tc/programme/behindtheheadlines"" target=""_blank"" rel="""">點擊重溫其他集數</a>"
6895ce87bccdd0876d1fe690,11名外傭涉殺胎或供應藥物墮胎被捕 其中五人被落案起訴獲准保釋,2025-08-08 18:16,2025-08-08 19:00,local,tvb,https://news.tvb.com/tc/local/6895ce87bccdd0876d1fe690,"警方拘捕11名外傭，涉嫌殺胎或供應藥物墮胎。

警方6月接報，有外傭在天水圍住宅暈倒。救護員在她床邊洗衣籃，發現一個無生命跡象、28星期大的胎兒，相信她從朋友購買墮胎藥服食。

警方上月初在機場拘捕外傭32歲朋友，同樣任職家傭，在她工作地址檢獲懷疑墮胎藥包裝，及十粒經處方的墮胎藥。經調查後發現，她由去年5月起，一年內多次出售墮胎藥給其他外傭。

自上月底起，全港各區有另外九名外傭被捕，介乎30至46歲，涉嫌施用藥物促致墮胎，其中五人遭落案起訴，獲准保釋。

元朗警區重案組督察林浩賢表示：「有墮胎打算，切勿妄信網上資訊，隨便服用藥物。應該尋找註冊醫生，索取專業醫療意見，了解每種藥物用途及其副作用。鑑於今次案件牽涉的都是外傭，警方呼籲有聘請外傭的僱主，如果留意到外傭有懷孕跡象，應該提醒他們及早求醫。不同地方有不同文化和法例，在香港非法提供、服食藥物而引致墮胎，或因以上原因導致非法墮胎，都會觸犯刑事法例。」"
689584f1bccdd0876d1d861e,天氣｜天文台：續驗證AI預告下雨表現 為預測提供參考基礎,2025-08-08 18:00,2025-08-08 18:15,local,tvb,https://news.tvb.com/tc/local/689584f1bccdd0876d1d861e,"近日的暴雨，有人工智能(AI)電腦模式預測到相近降雨量，但雨勢分布不完全準確。天文台表示，未來會繼續驗證人工智能預告下雨的表現，為預測提供參考基礎。

八日內發出四次黑色暴雨警告信號，已打破一年內「黑雨」次數紀錄，單日雨量亦打破月份最高紀錄。

天文台早前指，人工智能電腦模式「風烏」，早約一周預測到有雨帶覆蓋廣東沿岸，雨量最高值亦與實況相近。不過雨的分布則估得未完全準確。

天文台表示，人工智能預報未來十日大範圍天氣形勢，已比傳統模式稍為優勝，而未來會繼續驗證預告下雨的表現。

天文台署理高級科學主任何宇恒說：「現時人工智能用於天氣預報仍面對很多限制，對暴雨的預測困難，比較難提早很多日，準確預測暴雨的確定時間及位置。去年下半年開始，部分人工智能天氣預告模式開始輸出下雨預測，但人工智能在天氣預告應用仍是初步階段，大雨的案例比較少。」

這兩天天氣好轉，晴朗及酷熱，多區氣溫中午前已達30度以上，跑馬地更錄得34度。

而在西北太平洋，關島以北的熱帶氣旋「楊柳」，與香港仍有一段距離，之後的動向會怎樣？

天文台科學主任林家輝指出：「未來數天逐漸發展，並向偏西方向移動，大致移向台灣一帶，但隨後路徑及強度仍存在變數，有較大機會移向福建及廣東沿岸一帶。」

天文台預料，高空反氣旋未來數日都會支配華南，持續酷熱。到下周初，偏南氣流會為廣東沿岸帶來驟雨。

<a href=""https://www.hko.gov.hk/tc/wxinfo/currwx/fnd.htm"" target=""_blank"" rel="""">九天天氣預報</a>"
6895c96ebccdd0876d1fb7bd,台積電上月收入見單月歷史第二高,2025-08-08 17:54,2025-08-08 18:30,finance,tvb,https://news.tvb.com/tc/finance/6895c96ebccdd0876d1fb7bd,"台積電上月收入見單月歷史第二高。

七月收入達3,231億元新台幣，僅次於今年四月的約3,495億元新台幣，按月增加兩成二，按年增加兩成半。

今年首七個月，累計收入突破2萬億元新台幣，創歷年同期高位，按年增長三成七。"
6895c7e3bccdd0876d1fad8e,黃之鋒被控串謀勾結外國勢力 毋須答辯押後至下月進行交付程序,2025-08-08 17:49,2025-08-08 18:15,local,tvb,https://news.tvb.com/tc/local/6895c7e3bccdd0876d1fad8e,"前香港眾志秘書長黃之鋒被控串謀勾結外國勢力，案件將會安排在高等法院審理。

黃之鋒因為35+顛覆政權案正在服刑，由囚車押送到西九龍法院應訊。他被控一項串謀勾結外國或境外勢力危害國家安全罪。

控罪指他於2020年7月1日至11月23日期間，與羅冠聰及其他人，串謀請求外國對香港特別行政區或中華人民共和國實施制裁或其他敵對行動。

被告暫時毋須答辯，案件押後至9月5日進行交付程序，安排到高等法院審理。"
6895c7c8bccdd0876d1faa06,男子拉開夾公仔機一分鐘內盜取Labubu等32隻公仔 承認盜竊判囚一年,2025-08-08 17:48,2025-08-08 18:00,local,tvb,https://news.tvb.com/tc/local/6895c7c8bccdd0876d1faa06,"一名男子6月在夾公仔店，趁無人看管時拉開夾公仔機，偷走32隻、共值逾一萬元的公仔。他承認盜竊罪，被判監一年。

涉及的兩間夾公仔店，位於長沙灣青山道。案情指，報稱裝修工人的48歲被告鄧卓文，今年6月22日凌晨，從兩間店盜取Labubu等合共32隻公仔，總值逾一萬元。他早前承認兩項盜竊罪，早上在西九龍裁判法院判刑。

庭上播放事發時的閉路電視片段，顯示被告進入店內，環顧四周後，拉開沒上鎖的夾公仔機玻璃門，分別在約一分鐘內盜走公仔。

裁判官王證瑜指，案發在凌晨時段，明顯有利於被告盜竊，而不被發現，被告用連帽衛衣蓋頭及戴口罩，必定是為了不被人認出。

裁判官又指，被告帶備兩個大袋，把夾公仔機的玻璃門打開，上半身探入機內，取走大量公仔，必然是故意及有計劃利用事主疏忽犯案，判處被告監禁一年，及向事主賠償9,792元。"
6895c79cbccdd0876d1fa8c7,港股升勢斷纜收市跌222點 北水淨流入62億元,2025-08-08 17:46,2025-08-08 18:15,finance,tvb,https://news.tvb.com/tc/finance/6895c79cbccdd0876d1fa8c7,"港股升勢斷纜，大市跌222點，北水淨流入62億元。

美股道指下跌，內地A股亦偏軟，恒指低開113點後，全日在低位窄幅上落，高低位相差不足190點。收市報24,858點，跌222點，成交較上日減少近一成六，至2,067億元。

大唐資本投資策略部總監盧志明表示：「25,000點是一個較大的分水嶺，大家都看到過去三星期，都是圍繞25,000點，我相信8月也繼續在這個水平牛皮，等候新消息。新消息不外乎都是美國利率在九月(議息)的情況，再加內地經濟數據，這些都是未來相關消息，大家要留意。」

多隻剛派成績的藍籌股，表現都欠佳，中芯及九龍倉置業齊跌百分之8。金價上升，紫金礦業升百分之2。

上日跌幅較大的醫藥股，普遍出現反彈，石藥升近百分之6，聯邦制藥升百分之3。

MSCI公布指數成分股季檢結果，但多隻MSCI中國指數新貴表現一般，網易雲音樂升百分之1，中信金融資產跌百分之2。"
6895c77fbccdd0876d1fa7d2,本港二手樓價終止連續兩周升勢 見近一年最大跌幅,2025-08-08 17:46,2025-08-08 18:15,finance,tvb,https://news.tvb.com/tc/finance/6895c77fbccdd0876d1fa7d2,"本港二手樓價終止連續兩周的升勢，並見近一年最大的跌幅。

中原城市領先指數最新報137.19點，按周比較跌百分之1.19，跌幅是自去年九月初以來最大。

四區樓價中，只有新界東錄得升幅，按周升百分之0.78。港島終止四周連升，跌逾百分之3，創近半年最大跌幅。新界西連升兩周後回軟，跌逾百分之2，九龍結束三周連升，跌百分之0.55。

編制指數的機構表示，樓市氣氛正面，拆息持續低企，加上九月美國減息預期升溫等利好因素出現，估計樓價將反覆上試年初高位。"
6895c07fbccdd0876d1f6561,孫玉菡稱高才通續簽情況理想 不點名回應梁振英指人才來港初期先租樓正常,2025-08-08 17:16,2025-08-08 17:45,local,tvb,https://news.tvb.com/tc/local/6895c07fbccdd0876d1f6561,"勞工及福利局局長孫玉菡表示，高才通計劃續簽情況理想，未來兩星期內會公布相關數字。

現屆政府在2022年起推出多項「搶人才」措施。勞工及福利局局長孫玉菡在社交平台發文，交代最新數字，指截至上月底，各項人才計劃共收到51萬宗申請，其中約34萬宗獲批，超過22萬人才已經抵港。

全國政協副主席、前行政長官梁振英日前發文，指以本港私樓入住量為例，過去五年均無大變化。推論絕大多數人才家庭沒有落戶香港，為本港政策制定及社會穩定，帶來太多不確定性。

孫玉菡在帖文不點名回應，指人才來港發展初期，選擇先租樓是正常不過。又指香港面對人口老化，原本會導致住宅物業需求減少，「搶人才」措施帶來新客，空置率才大致平穩，形容是「幸保不失」。

孫玉菡指人才流入，扭轉本地勞動人口跌勢，2024年中，香港人口比2022年年中，增加了百分之2.4，期間30至44歲這個年齡層的勞動人口，亦上升百分之1.7。他指來港人才的子女，是香港未來生力軍，「搶人才」措施不只是引才，更是「育才」的長線投資。

孫玉菡形容落戶安頓需時，招攬人才措施的成效亦需時觀察，當局會繼續協助來港人才，了解他們的發展和需要。他指「高才通」首批簽證去年年底起陸續到期，形容續簽情況相當理想，未來兩周內會公布相關數字。"
6895bcd3bccdd0876d1f4910,現場｜警方拘捕11名涉嫌殺胎及非法墮胎女子 均為外籍傭工,2025-08-08 17:00,2025-08-08 17:45,local,tvb,https://news.tvb.com/tc/local/6895bcd3bccdd0876d1f4910,"警方拘捕11名女子，涉嫌殺胎及非法墮胎等，11人均為外籍傭工。

警方指，非法墮胎觸犯刑事罪行，呼籲市民切勿從非法途徑購買墮胎藥。"
6895b5e9bccdd0876d1f050d,亞太區股市個別發展,2025-08-08 16:31,2025-08-08 16:45,finance,tvb,https://news.tvb.com/tc/finance/6895b5e9bccdd0876d1f050d,"亞太區股市個別發展。

日本股市連升四日，曾經突破42,000點關口，但收市未能企穩。 綜合全星期，反彈逾百分之2。

台灣股市連升兩日，全周累積升幅百分之2.5。

南韓股市則終止四日升勢，一度跌穿3,200點，全周累積上升近百分之3。

澳洲股市連跌兩日，全周計則反彈逾百分之1。"
6895b2d8bccdd0876d1eea76,啟德體育園「五行童樂園」即日起朝九晚九開放 設滑梯、鞦韆等,2025-08-08 16:18,2025-08-08 16:45,local,tvb,https://news.tvb.com/tc/local/6895b2d8bccdd0876d1eea76,"啟德體育園北斗園區戶外設施「五行童樂園」，即日起免費向公眾開放。

樂園佔地逾4,300平方米，分為五個園區，以金、木、水、火、土五行概念做主題，每日朝九晚九開放。

園內遊樂設施包括滑梯、鞦韆，亦有攀石牆、滑索及嬉水區等，以及適合傷健兒童的共融設施。園區亦包括有蓋硬地球場和沙灘球場，上月起已開放予公眾租用。

至於多功能網球場，就預計今年第三季啟用。"
6895ad90bccdd0876d1ebc86,港股收市報24858點 跌222點,2025-08-08 16:10,2025-08-08 16:45,finance,tvb,https://news.tvb.com/tc/finance/6895ad90bccdd0876d1ebc86,"恒生指數收市報24,858點，跌222點。

中芯國際跌百分之8.1，石藥升百分之5.99。"
6895a817bccdd0876d1e9181,西貢有私家車疑閃避途人失控衝落山坡 司機受輕傷,2025-08-08 15:32,2025-08-08 16:00,local,tvb,https://news.tvb.com/tc/local/6895a817bccdd0876d1e9181,"西貢一輛私家車懷疑閃避途人，失控衝落山坡，司機受輕傷。

涉事私家車撞毀路邊欄杆，衝落約三米高的山坡，車頭損壞，露出零部件。

事發於近中午12時半，一輛私家車沿清水灣道往九龍方向行駛，去到近檳榔灣時，懷疑閃避途人，失控衝落山坡，其他汽車司機目睹報案。

警方及救護員接報到場，救出被困女司機。她頸部受輕傷，毋須送院。該路段一度需實施單線雙程行駛。"
6895a7f4bccdd0876d1e8e9f,48歲男子拉開夾公仔機盜Labubu等價值逾萬元公仔 判監一年,2025-08-08 15:30,2025-08-08 18:00,local,tvb,https://news.tvb.com/tc/local/6895a7f4bccdd0876d1e8e9f,"一名男子6月在長沙灣一間夾公仔店，趁無人看管時拉開夾公仔機，盜取價值逾一萬元的公仔，被判監一年。

案情指，48歲被告鄧卓文6月22日凌晨在兩間夾公仔店，打開未有上鎖的夾公仔機，盜取Labubu等32隻公仔。他早前承認兩項盜竊罪，今早在西九龍裁判法院判刑。

裁判官王證瑜指，被告帶備了兩個大袋，把夾公仔機的玻璃門打開，上半身探入機內，取走大量公仔，必然是故意及有計劃利用事主疏忽犯案，判處監禁一年及罰款近一萬元。"
6895a795bccdd0876d1e8b02,據報中遠海運尋求長和出售港口交易佔兩至三成股權 包括巴拿馬運河權益,2025-08-08 15:30,2025-08-08 16:00,local,tvb,https://news.tvb.com/tc/local/6895a795bccdd0876d1e8b02,"據報中遠海運集團正尋求在長和出售港口交易中，佔兩至三成股權，當中包括最關鍵的巴拿馬運河權益。

《金融時報》報道，目前討論中的方案，還包括中遠海運只取得41個港口股權，不包括兩個巴拿馬港口。

中遠海運是目前唯一一間獲准參與談判的中國企業，令公司擁有較大談判籌碼，因為貝萊德牽頭財團需要一個中國合作夥伴參與交易，才能獲中國當局批准。

長和上周曾公布，與貝萊德財團獨家磋商期已屆滿，擬邀請來自內地的主要策略投資者，加入成為財團重要成員。"
68958789bccdd0876d1d8e4f,34萬宗人才計劃申請獲批 當局指兩周內公布「高才通」續約數字,2025-08-08 13:13,2025-08-08 13:45,local,tvb,https://news.tvb.com/tc/local/68958789bccdd0876d1d8e4f,"現屆政府各項人才計劃，申請宗數最新增至51萬，其中34萬宗獲批。勞工及福利局形容是長線投資。未來兩周內會公布「高才通」續約數字。

勞福局局長孫玉菡在社交平台發文，指持續引入人才，有助整體人口保持穩定。很多人已在香港就業，投身金融、創新及資訊科技及商貿等關鍵產業。

對於全國政協副主席梁振英提出，大多數輸入人才未有落戶香港，為政策制定帶來不確定性。孫玉菡不點名反駁指，人才來港多數都是先租樓。當局會繼續協助來港人才，了解他們的發展和需要。

「高才通」首批簽證去年年底起陸續到期，局方形容續簽情況相當理想，會在未來兩周公布相關數字。"
68958529bccdd0876d1d87d4,據報通用汽車仍計劃採購寧德時代電池 分析指徵稅後華企仍具競爭優勢,2025-08-08 13:03,2025-08-08 16:45,finance,tvb,https://news.tvb.com/tc/finance/68958529bccdd0876d1d87d4,"美國特朗普政府不斷針對中國，並加徵來自中國進口品關稅，但據報美國通用汽車仍計劃採購中資企業寧德時代的電池。分析認為，即使電池進口美國要徵收關稅，中國企業仍具備競爭優勢。

通用汽車計劃向中國企業購買電動車電池，以供即將推出的入門版電動車使用，直至與南韓LG新能源在美國的電池廠投產為止。

外電報道，通用汽車在2027年前，都會向寧德時代購買磷酸鐵鋰電池，相關車型會在今年稍後時間，於美國堪薩斯州的工廠投產。分析認為，即使中國進口美國商品被徵收較高關稅，但中國電動車電池仍有優勢。

易方資本投資總監王華指出：「對比區內其他對手，來來去去都是南韓及日本對手為主，競爭優勢仍然存在。就算計及關稅，中國電池的成本優勢依然存在，不過可能少賺一點，與日本和南韓的價差仍在。」

有調查發現，以電池儲能量計，今年上半年，頭十大電池廠，中國企業佔了六位，總市佔率達六成八。而頭五位中，有三間是中資企業，單是寧德時代及比亞迪，就壟斷超過一半的市場分額。

王華認為，就算美國政府要求企業將電池生產線搬回美國，但人力成本偏高，可能令「美國製造」的電池只有內銷市場。"
68958543bccdd0876d1d88a7,港股下跌 徘徊24900點附近,2025-08-08 13:03,2025-08-08 16:45,finance,tvb,https://news.tvb.com/tc/finance/68958543bccdd0876d1d88a7,"港股下跌，在24,900點附近徘徊。

在美國關稅憂慮下，多隻藥股繼續受壓，和黃醫藥及百濟神州，分別跌約一成半及百分之6。中芯上半年賺少近兩成，跌逾半成。"
