id,title,date,scrape_time,section,source,url,news_content
69555dadd6adf87a9bf6357e,現場｜蘭桂坊仍有不少人聚集秩序良好 警方未實施單向人潮管制措施,2026-01-01 01:30,2026-01-01 02:00,local,tvb,https://news.tvb.com/tc/local/69555dadd6adf87a9bf6357e,跨年倒數活動後，不少人仍在蘭桂坊聚集，慶祝新一年。現場人山人海，秩序良好，警方未實施單向人潮管制措施。
6954f622d6adf87a9bf28b38,港鐵：較早前關閉中環站L和J1出入口已重新開放,2026-01-01 01:15,2026-01-01 01:30,local,tvb,https://news.tvb.com/tc/local/6954f622d6adf87a9bf28b38,"[1/1 01:15更新]
港鐵：較早前關閉的中環站L和J1出入口，已重新開放。H和L出入口因相連大廈通道的開放時間已過，會維持關閉。

[31/12 23:51更新]
港鐵中環站L、J1、H、F出入口暫時關閉，以配合人潮管制措施。

[19:10]
港鐵中環站L、J1及H出入口暫時關閉，以配合人潮管制措施。
 
[18:07]
為配合人潮管制措施，以下車站部分出入口暫時關閉：

中環站：L, J1

港鐵呼籲乘客使用其他出入口，指相關車站出入口安排會不時變動，以配合現場情況及最新人流管理安排。

<a href=""https://news.tvb.com/tc/local/6954dc06d6adf87a9bf1a08b"" target=""_blank"" rel="""">除夕交通安排｜港鐵8條本地綫通宵行駛　城巴、九巴設特別路線｜一文看清</a>

<a href=""https://news.tvb.com/tc/local/695344ccd6adf87a9be41f0f"" target=""_blank"" rel="""">倒數迎2026好去處｜西九首辦海濱倒數音樂會　中環遮打道迪士尼同步賀新年｜一文看清‧活動詳情</a>"
69555856d6adf87a9bf60d48,港交所︰逾300隻新股上市申請正處理中,2026-01-01 01:06,2026-01-01 01:30,finance,tvb,https://news.tvb.com/tc/finance/69555856d6adf87a9bf60d48,"港交所表示，逾300隻新股上市申請正處理中。

港交所表示截至2025年12月31日，全年共有119隻新股於主板上市，已獲上市委員會批准、等待上市的企業有23間，315宗上市申請正在處理中。去年新股總集資額約2,900億元，重登全球新股上市集資額首位。

展望2026年，德勤估計本港新股上市宗數有望達到160宗，集資額將不少於3,000億元。安永預計，上市宗數將增加至180宗，集資額3,200億元。畢馬威預計今年新股上市180至200宗，集資規模或高見3,500億元。"
695557b6d6adf87a9bf60a04,公立醫院新收費｜最初運作大致順暢 六人零時零分入急症室獲酌情處理,2026-01-01 01:04,2026-01-01 02:00,local,tvb,https://news.tvb.com/tc/local/695557b6d6adf87a9bf60a04,"公立醫院元旦起實施新收費，包括非危殆危急病人到急症室求診收400元。醫管局稱最初運作大致順暢，有六人零時零分「擲界」入急症室，獲酌情處理收舊價。

踏入零時零分，廣華醫院有職員舉標示牌，提醒入急症室市民即時起採用新收費。隨即有市民入內，醫管局決定酌情處理收舊價。

醫管局主席范鴻齡，以及行政總裁李夏茵等接近深夜已到場視察。當局稱暫時各急症室運作大致順暢，至今收到3.5萬份醫療費減免申請。除了廣華醫院的一位，尚有五人獲酌情處理收舊價、即180元。

醫管局行政總裁李夏茵說︰「為何要彈性處理，因為我們很擔心急症室這一刻很多人正輪候，他們明明已來到、未來得及登記，究竟他是凌晨零時抑或怎樣，所以為何我們有個酌情安排。好像是你見到其中一個個案，她凌晨零時剛來到門口，她未走到登記處櫃台，這個情況我們覺得其實你來都來了，我們又無人龍，不如讓你(付舊價)。」

<a href=""https://news.tvb.com/tc/local/695548e5d6adf87a9bf58667"" target=""_blank"" rel="""">2026新收費｜非危殆危急病人到急症室收400元　交通違例罰金增加｜一文看清</a>"
69555779d6adf87a9bf6083e,現場｜陸續有旅遊巴抵達深圳灣口岸 料人流逐漸增加,2026-01-01 01:01,2026-01-01 01:30,local,tvb,https://news.tvb.com/tc/local/69555779d6adf87a9bf6083e,深圳灣口岸過關人數較午夜前少，但陸續有旅遊巴抵達，預計人流會逐漸增加。入境處及警方已部署更多人手。
69554ff2d6adf87a9bf5bfc3,美股2025年最後一個交易日先升後跌,2026-01-01 00:31,2026-01-01 00:45,finance,tvb,https://news.tvb.com/tc/finance/69554ff2d6adf87a9bf5bfc3,"美國股市在2025年最後一個交易日先升後跌

三大指數均高開，其中道指高開4點，但好快掉頭下跌逾100點。

科技股個別發展，據報Nvidia輝達已就H200晶片新訂單接洽台積電，股價靠穩；美光科技跌逾百分之2。IBM跌近百分之1。"
69554fbfd6adf87a9bf5bd2f,志蓮淨苑舉行元旦叩鐘祈福活動 為香港新一年祝願,2026-01-01 00:30,2026-01-01 01:15,local,tvb,https://news.tvb.com/tc/local/69554fbfd6adf87a9bf5bd2f,"志蓮淨苑舉行元旦叩鐘祈福活動。

距離凌晨零時一分鐘，政務司司長陳國基、中聯辦副主任孫尚武及香港佛教聯合會會長寬運叩鐘三次、完成108響，為香港新一年祝願。之後再由法師唱吉祥偈，為香港頌經祝福。

政務司司長陳國基說︰「在新的一年，我祝願我們的祖國富強昌盛、國泰民安；我們祝願香港繁榮安定、百業興旺。當然祝每一位市民，身體健康、家庭幸福！」"
69554fb3d6adf87a9bf5bc99,踏入2026年 全港多處有跨年活動慶祝,2026-01-01 00:30,2026-01-01 01:15,local,tvb,https://news.tvb.com/tc/local/69554fb3d6adf87a9bf5bc99,"踏入2026年，全港多處都有跨年活動慶祝。

中環遮打道有光影匯演。在終審法院、中銀大廈、滙豐總部等八座中環地標外牆上投影。國際殿堂組合Air Supply聯同本地歌手在台上獻唱，帶動全場氣氛。

對岸的西九文化區首次舉行倒數音樂會。今年維港沒有煙花匯演，但不少人都指不介意，認為在歌聲下迎接新一年一樣有氣氛。

蘭桂坊就有不少外國人來倒數，現場情緒高漲。不少人舉起手機記錄這一刻。

銅鑼灣海傍就有傳統的怡和子夜禮砲儀式。自1946年起舉行，寓意送舊迎新。"
69554e71d6adf87a9bf5b148,元旦BB｜重3.2公斤男嬰零時零分中大醫院順產出生 屬父母首胎,2026-01-01 00:24,2026-01-01 00:30,local,tvb,https://news.tvb.com/tc/local/69554e71d6adf87a9bf5b148,一名重3.2公斤男嬰零時零分中大醫院順產出生，屬父母首胎。
69554be4d6adf87a9bf5939d,公立醫院新收費｜李夏茵：6人零時零分入急症室 獲酌情處理收舊價,2026-01-01 00:14,2026-01-01 00:45,local,tvb,https://news.tvb.com/tc/local/69554be4d6adf87a9bf5939d,"公立醫院新收費｜李夏茵：各急症室大致運作順暢，有六人零時零分「擲界」入急症室，獲酌情處理收舊價。

<a href=""https://news.tvb.com/tc/local/695548e5d6adf87a9bf58667"" target=""_blank"" rel="""">2026新收費｜非危殆危急病人到急症室收400元　交通違例罰金增加｜一文看清</a>"
695548e5d6adf87a9bf58667,2026新收費｜非危殆危急病人到急症室收400元 交通違例罰金增加｜一文看清,2026-01-01 00:00,2026-01-01 00:30,local,tvb,https://news.tvb.com/tc/local/695548e5d6adf87a9bf58667,"● 醫管局

急症室增至400元
急症住院費增至300元
住院費（療養/康復等) 加至200元

專科門診每次診症250元
每項藥物20元

專科門診病理檢驗服務
進階項目50元
高端項目200元

普通科門診每次診症150元
每項藥物5元

非緊急放射造影服務
進階項目250元
高端項目500元


● 運輸署

20項交通違例罰金增加
違例泊車增至400元
超速罰款480元起


● 控煙辦公室

擴大禁煙範圍
違例吸煙罰款增至3,000元


● 電費減價

中電每度電下調至140.6仙
港燈每度電下調至163.3仙


● 航空公司燃料附加費

國泰航空
短途上調至191元
長途上調至596元

香港航空
短途上調至185至211元
長途上調至787元


● 文憑試(DSE)考試費

總考試費上調4%
自修生報名費會595元
內地考場報名費2,500元


● 60歲二元乘車優惠

4月起改「兩元兩折」
車程$10元以上付兩折
車程$10元或以下付2元"
69554865d6adf87a9bf57dd3,現場．圖輯｜多區舉行慶祝活動迎接2026年 中環上演光影表演,2025-12-31 23:59,2026-01-01 00:30,local,tvb,https://news.tvb.com/tc/local/69554865d6adf87a9bf57dd3,多區舉行慶祝活動，迎接2026年。在中環遮打道，參與「光影匯．中環」的八幢建築物外牆，於踏入新年一刻，上演長約三分鐘、以「新希望、新開始」為主題的光影表演，向現場及全球觀眾送上祝福。
6955452cd6adf87a9bf55c5c,現場‧圖輯｜中環遮打道跨年倒數 國際殿堂組合Air Supply獻唱,2025-12-31 23:45,2026-01-01 00:15,local,tvb,https://news.tvb.com/tc/local/6955452cd6adf87a9bf55c5c,還有不足半小時就踏入2026年，旅發局在中環舉辦光影匯演，國際殿堂組合Air Supply獻唱，一齊欣賞他們表演。
69554249d6adf87a9bf543b5,西九文化區跨年倒數｜現場實施單向人流管理 警方已關閉藝術公園入口,2025-12-31 23:32,2025-12-31 23:45,local,tvb,https://news.tvb.com/tc/local/69554249d6adf87a9bf543b5,西九文化區跨年倒數｜現場實施單向人流管理，警方已關閉藝術公園入口。
695541c8d6adf87a9bf53ae3,現場｜深圳灣未到人流高峰 現場或將實施特別交通安排,2025-12-31 23:31,2025-12-31 23:45,local,tvb,https://news.tvb.com/tc/local/695541c8d6adf87a9bf53ae3,深圳灣口岸過關的人不太多，相信還未到人流高峰。現場交通可能會實施特別交通安排，跨境私家車在車流高峰期，或需要比較長的輪候時間等待過關。
695532f4d6adf87a9bf4acd0,旅發局：中環遮打道人數眾多 旅發局籲往尖沙咀文化中心觀賞投影直播,2025-12-31 23:30,2025-12-31 23:45,local,tvb,https://news.tvb.com/tc/local/695532f4d6adf87a9bf4acd0,"[23:30更新]
中環遮打道跨年倒數｜旅發局指人數眾多，呼籲公眾前往尖沙咀文化中心觀賞投影直播。

[22:27]
中環跨年倒數，旅發局指，遮打道人數眾多，呼籲市民旅客前往愛丁堡廣場直播區，或到尖沙咀文化中心觀賞投影直播。"
69553e88d6adf87a9bf51e23,圖輯｜蘭桂坊有酒吧推優惠及遊戲氣氛熾熱 不少遊客慕名而來準備好倒數,2025-12-31 23:17,2026-01-01 00:15,local,tvb,https://news.tvb.com/tc/local/69553e88d6adf87a9bf51e23,"有蘭桂坊酒吧推出優惠及有獎遊戲，吸引市民及遊客光顧，估計生意較去年增長兩成。但灣仔有海景餐廳，就因為煙花取消，預計生意少一半。

2025年的最後數小時，中環蘭桂坊已人頭湧湧，不少人已飲定兩杯，準備好興奮的心情倒數，連冷血的牠都要來感受下熾熱的氣氛。亦有不少遊客慕名而來。

加拿大旅客Crystal說︰「今日是除夕，是2025年的完結，而蘭桂坊有極好的酒吧、很經典。」

意大利遊客稱︰「我們很『幸運』，我們說要來香港看煙花，但煙花匯演取消了。」

記者問︰「甚麼吸引你來蘭桂坊？」

意大利遊客表示︰「這裡很熱鬧及很快樂。」

亦有家長帶同子女來體驗。

周先生說︰「剛剛在附近吃完飯，接著就過來這裡，順手帶小朋友來看看，因為他也沒來過。新年願望當然是賺多些錢。」

有餐廳及酒吧一早準備好，倒數套餐及優惠，更會舉辦有獎遊戲，大獎是北海道來回機票，訂座已爆滿。

餐廳及酒吧負責人郭先生稱︰「我們看到很多遊客來此消費，很多訂座都是外國人為主，相信除夕夜(生意)也會增長百分之15至20。」

蘭桂坊協會指，旅發局跨年活動移師中環舉行，有助帶動人流及生意，相信生意額按年有半成至一成增長，但餐廳定價都不敢太進取。

蘭桂坊協會總監張素媚指︰「考慮到最近香港的社會氣氛，定價比疫情前更有大折讓，有大約四成的減幅，都估計所有商戶是希望，香港人留港消費。」

不過有人歡喜有人愁，位於灣仔海濱這間餐廳，本身是絕佳的煙花觀賞點，但因為匯演取消，大批客人「撻訂」，令生意大跌一半。

灣仔海濱餐廳負責人鄭小姐表示︰「我們這兩個星期都想了很多活動，今晚有美人魚表演，希望多些氣氛，可留住客人，損失就難(挽回)，但希望沒那麼差。」

她又指有在內地社交平台推廣，希望仍可吸引到人來倒數。"
69553e59d6adf87a9bf51bb1,現場｜中環現場氣氛非常高漲 Air Supply將演唱兩首經典歌曲,2025-12-31 23:16,2025-12-31 23:45,local,tvb,https://news.tvb.com/tc/local/69553e59d6adf87a9bf51bb1,"現場氣氛非常高漲，不少人來到行人專用區，準備欣賞今晚的表演。旅發局較早前做出呼籲，因中環人數較多，希望公眾可以去尖沙咀文化中心欣賞直播。

Air Supply將帶來兩首經典歌曲，也會與兩位本地歌手合唱《Even the Nights Are Better》。"
69553e67d6adf87a9bf51c74,現場｜西九文化區越夜越熱鬧 觀景台站滿觀賞跨年音樂會民眾,2025-12-31 23:16,2025-12-31 23:45,local,tvb,https://news.tvb.com/tc/local/69553e67d6adf87a9bf51c74,現場所見，西九文化區越夜越熱鬧，觀景台站滿觀賞跨年音樂會的民眾。
69553e4dd6adf87a9bf51b09,除夕夜歌聲與歡呼聲響遍西九文化區 中環遮打道充滿節日氣氛,2025-12-31 23:15,2026-01-01 00:15,local,tvb,https://news.tvb.com/tc/local/69553e4dd6adf87a9bf51b09,"還有不足一小時，就踏入2026年。全港多處地方都有倒數活動。今年跨年倒數沒有煙花匯演，不少人到中環及西九欣賞光影匯演和音樂會。

除夕夜，歌聲與歡呼聲響遍西九文化區。西九今年首辦倒數音樂會，以勁歌迎接2026。告別五味雜陳的2025，人人都有不同願望。

文小朋友說：「(2025年)激怒爸爸媽媽，會感情不好。(2026年)我希望可以改過自新，令大家不要那麼憤怒。」

區小朋友稱：「我想以後不用做功課。」

張先生表示：「2026年最重要賺多些錢，3號那天中六合彩，中一億元便不用上班。」

這一年維港無跨年煙花，她們都指不介意。

陳小姐指出：「整晚都有音樂表演，整晚都持續有氣氛，不像放煙花只得數分鐘有(氣氛)。」

馮小姐稱：「這裡多人，但不算很擠迫，不會窒息般、很舒服，而且很多燈光、氣氛很好。」

今次西九文化區倒數，首次與附近、全港最高商廈環球貿易廣場合作，令倒數的規模更大，西九管理局指希望可送上祝福。

送舊迎新，中環遮打道一樣充滿節日氣氛。踏入零時零分，終審法院、滙豐等八座中環地標將有三分鐘匯演，展示時鐘及光影圖案。

歌手綵排，已經令全場期待。焦點是國際殿堂組合Air Supply帶來經典金曲。

霍小姐表示：「是、是他們Air Supply，不好意思，表白。很感動，我年輕時很喜歡他們。」

一名寧夏旅客說：「香港跨年氣氛較熱鬧，我們喜歡，所以今年來到香港跨年。」

馬來西亞旅客梁女士指出：「兩年前我們都有來過，沒想過今年特別些。(氣氛)相差很遠，無煙花看。」

旅發局指，今年的活動，以「新希望、新開始」為主題，期望向市民及旅客傳達平安、盼望及祝福。

<a href=""https://news.tvb.com/tc/local/6954dc06d6adf87a9bf1a08b"" target=""_blank"" rel="""">除夕交通安排｜港鐵8條本地綫通宵行駛　城巴、九巴設特別路線｜一文看清</a>

<a href=""https://news.tvb.com/tc/local/695344ccd6adf87a9be41f0f"" target=""_blank"" rel="""">倒數迎2026好去處｜西九首辦海濱倒數音樂會　中環遮打道迪士尼同步賀新年｜一文看清‧活動詳情</a>"
69553a87d6adf87a9bf4fff7,李家超發表新年賀詞 指2026目標聚焦民生福祉及強化創科驅動,2025-12-31 23:00,2025-12-31 23:30,local,tvb,https://news.tvb.com/tc/local/69553a87d6adf87a9bf4fff7,"行政長官李家超發表新年賀詞，指2026年目標，聚焦民生福祉及強化創科驅動，政府將繼續落實施政，讓市民共享成果。

行政長官李家超說︰「2025年是充滿挑戰，但體現堅毅的一年，我們一同經歷，經濟復蘇的強勁動力，也共同承受大埔宏福苑火災帶來的悲痛。展望2026年，除了繼續支援災民，提出長遠居住建議外，我們會聚焦兩大目標，一是增進民生福祉，加快公營房屋建設，二是強化創科驅動，主動對接國家『十五五』規劃，加快發展北部都會區。前路縱有挑戰，但機遇更多，只要我們團結一致，必能克服挑戰、乘風破浪，讓我們的城市更加繁華與璀璨。」

李家超又總結2025年，指政府與市民同心協力，將改革和動力，融入發展經濟及改善民生，不斷見到來之不易的成果。

又指過去一年有很多難忘畫面，包括粵港澳首次共同承辦全運會，港隊獎牌數創歷史佳績。亦提及立法會換屆選舉順利完成，政府將與新一屆議員合力推進改革，和協助宏福苑受影響家庭，回復正常生活，完善樓宇安全制度和監管。"
695533bdd6adf87a9bf4b92c,中環即將舉辦演唱及光影匯演迎新年 大批觀眾表現興奮,2025-12-31 23:00,2025-12-31 23:15,local,tvb,https://news.tvb.com/tc/local/695533bdd6adf87a9bf4b92c,"多區都有倒數活動迎接2026年，其中旅發局在中環，舉辦演唱及光影匯演。

匯演未開始，不少人聽到歌手綵排的歌聲，已表現興奮。這麼多人舉機，為的是希望拍到國際殿堂級組合Air Supply踏台板的情況。

匯演在遮打道行人專用區舉行，除了有歌手獻唱，附近八座地標大廈，包括終審法院、中銀、滙豐等的外牆，有時鐘及光影圖案倒數跨年。再上演長約三分鐘的光影表演，展示「新希望、新開始」。

市民霍小姐驚呼：「是呀，是他們呀，Air Supply呀，不好意思，表白。」

記者問：「聽到他們唱歌感受如何？」

霍小姐笑答：「很感動，我後生時很喜歡他們。」

一名寧夏旅客表示：「香港跨年這個氣氛是比較熱鬧，我們比較喜歡，所以今年來到香港跨年。」

一名馬來西亞旅客稱：「兩年前我們都有來過，沒想過今年特別些，(氣氛)相差很遠，無煙花看。」"
695537cbd6adf87a9bf4e4b3,中央和國家機關工委副書記郭文奇 到港澳辦考察,2025-12-31 22:48,2025-12-31 23:30,local,tvb,https://news.tvb.com/tc/local/695537cbd6adf87a9bf4e4b3,"中央和國家機關工委副書記郭文奇，到港澳辦考察。

港澳辦副主任徐啟方向郭文奇等人，介紹中央港澳機關，黨建工作情況。

郭文奇表示，「十五五」時期，要把握關鍵時期對機關黨建，及港澳工作等提出的更高要求，要全面提高機關黨建質量，推動港澳工作不斷實現新跨越，開創新局面。又稱要持續加強政治機關建設，深化理論武裝，持續正風肅紀反腐，並要強化政治擔當。

港澳辦主任夏寶龍，在會見郭文奇一行人時稱，會持續推進港澳系統幹部革命性鍛造，以高質量黨建促進港澳工作，高質量發展。"
69553624d6adf87a9bf4cdd6,美國新申領失業金人數減少,2025-12-31 22:41,2025-12-31 23:00,finance,tvb,https://news.tvb.com/tc/finance/69553624d6adf87a9bf4cdd6,"美國新申領失業金人數減少。

美國勞工部公布，首次申領失業保險救濟人數，上星期減少1.5萬人，至19.9萬，為11月底以來最少。市場預期增加至21.8萬人。

持續申領人數按周減少5.7萬人，減至186.6萬，亦低過市場預期的190.2萬人。"
695530a6d6adf87a9bf49ea7,女子於油麻地被貨車撞倒捲入車底 送院後證實不治,2025-12-31 22:17,2025-12-31 22:45,local,tvb,https://news.tvb.com/tc/local/695530a6d6adf87a9bf49ea7,"一名女子在油麻地被貨車撞倒，捲入車底死亡。

涉事貨車事發後停在渡船街。警方稱，晚上近八時接到貨車司機報案，指一名60多歲女子被撞，捲入車底。她被救出送院後證實不治。

消息指，貨車由窩打老道轉入渡船街時，發生今次事故，正調查起因。"
69553084d6adf87a9bf49c53,現場｜西九文化區有DJ預熱表演 場地內站滿人,2025-12-31 22:17,2025-12-31 22:45,local,tvb,https://news.tvb.com/tc/local/69553084d6adf87a9bf49c53,"西九文化區進入DJ預熱表演環節，草坪上站滿人。夜晚十點鐘之前，大部分人在場內坐著，隨著人流增加，工作人員要求站起來，容納更多人。

大約十點半後，多個本地流行音樂歌手將上台表演。當局指將根據現場人流情況，再實施人潮管理措施。"
6954ff8ad6adf87a9bf2e5d3,21歲內地客破邊洲疑拍照時失足墮海亡 專家倡加強巡邏及懲罰,2025-12-31 22:17,2025-12-31 22:45,local,tvb,https://news.tvb.com/tc/local/6954ff8ad6adf87a9bf2e5d3,"一名21歲內地旅客在西貢破邊洲，懷疑拍照時失足墮海死亡。有攀山專家建議加強巡邏及懲罰，防止遊客靠近危險位置。漁護署稱，元旦假期期間，會加派人員在破邊洲觀景台一帶，加強宣傳行山安全。

失足墮海的21歲青年，救起時已經昏迷，送到西貢對面海水警基地，最終不治。網上有人上載事發後情況，見到不少人圍觀，水警快艇在海面打撈。

據了解，事主來自廣州，早上與三名同學到西貢破邊洲行山，10時許去到懸崖邊，休息及拍照期間不慎失平衡，從70米高墮海，同學隨即報警。

警方初步調查發現，死者後腦嚴重骨折，身上有多處擦傷，案件無可疑，列作屍體發現。

在內地社交平台，見到不少人在破邊洲懸崖邊「打卡」，無視旁邊「切勿前進」的警告牌。近年不少內地旅客根據社交平台的推介，來港行山「打卡」，有攀山專家擔心這類意外可能會越來越多，建議當局派人在「黑點」加強巡邏。

攀山專家鍾建民表示：「那些工作人員如沒執法權力，無可能勸告其他人。如果給予他們權力，行出去可能會受罰，會罰款，甚至上庭，有少許阻嚇作用，會有少許幫助。」

他指政府亦應加強宣傳，提醒市民及遊客莫欺山，亦莫欺水。"
69552c8fd6adf87a9bf47adb,現場｜參與中環跨年倒數活動嘉賓準備就緒 有觀眾稱視野不太清楚感可惜,2025-12-31 22:00,2025-12-31 22:15,local,tvb,https://news.tvb.com/tc/local/69552c8fd6adf87a9bf47adb,"旅發局在中環遮打道行人專用區舉行跨年倒數活動，結合國際與本地歌手的演出，嘉賓及司儀均已準備就緒。

現場所見，觀眾席範圍與主舞台有一定距離，有觀眾稱視野不太清楚，略感可惜。不過亦有樂迷表示，能現場聽到樂隊演出已經很高興。"
69552908d6adf87a9bf4538f,兩名眼鏡店職員被發現反鎖及昏迷在店內房間 兩人頸有刀傷,2025-12-31 21:45,2025-12-31 22:00,local,tvb,https://news.tvb.com/tc/local/69552908d6adf87a9bf4538f,"兩名眼鏡店職員，被發現反鎖及昏迷在店內一間房，兩人都有刀傷。

涉事眼鏡店在天水圍天湖路天耀廣場地下。警方稱下午近二時接到眼鏡店一名53歲男職員報案，指店內一間房突然傳出救命聲，但房間反鎖，於是報警。

消防破門後發現另外一男一女店員，頸有刀傷昏迷，送院治理。案件暫列作傷人處理。"
6955025fd6adf87a9bf304a8,車隊的士數量至今僅達目標三成多 業界稱與長期聘請不足司機有關,2025-12-31 21:44,2025-12-31 22:00,local,tvb,https://news.tvb.com/tc/local/6955025fd6adf87a9bf304a8,"的士車隊推出約五個月，最新數字顯示，至今只有約1,300輛的士，只達目標的三成多。有的士車隊稱，跟司機長期聘請不足有關，又認為一下子推五個車隊牌太急，但長遠車隊仍有存在價值。

這堆不是廢車，而是其中一支的士車隊的新的士，至少數十輛放在邊境，全部都無掛車牌，內櫳連包裝都未拆。

另一支的士車隊也有類似情況，有約一百輛電動的士閒置，或者落訂後未付運，原因都是未請夠司機。不少都認為電車充電，不及入石油氣的士入氣快。

星群的士董事總經理鄭克和表示：「車隊不要講賺錢，不蝕本都好。車全部投入服務，收支平衡就達到，但不完全投入，就達不到。車隊不是無得做，但要漫漫長路。現時政府一次過推五隊，太急，人手都不夠。」

運輸署今年七月底向五支的士車隊發牌，預計合共可提供逾3,500輛的士。推出初期已經不達到申請規模六成的標準，只有約1,000輛。

經過五個月，署方最新稱，多了約300輛投入服務，即約1,300輛，只達目標的三成多，司機就有約1,400位。有立法會議員認為，可以再觀望多一會。

民建聯新界西南議員陳恒鑌說：「現在運行了幾個月，雖然未必非常成功，但都有很多經驗累積了出來。若中期檢討時可作調整，未必要如此快下定論，稱它沒法子救。如要他們每間車隊有一個網約平台，為何不可組成大平台，令大家召車方便？如何可吸引多些人駕駛的士，甚至經營的模式是否可改變，如日租車可否拆帳？」

的士車隊牌照期五年，陳恒鑌稱，因應現時情況，希望營運一兩年後、約2027年就做檢討，再決定是否調節計劃。"
