id,title,date,scrape_time,section,source,url,news_content
693e3e05a8d97e781d741617,宏福苑五級火｜有候任議員冀獨立委員會檢視招標機制 協助業主聘請專業顧問,2025-12-14 12:32,2025-12-14 13:15,local,tvb,https://news.tvb.com/tc/local/693e3e05a8d97e781d741617,"政府就大埔宏福苑火災成立獨立委員會，本月下旬開始運作。有候任立法會議員期望，委員會可以檢視招標機制，協助業主聘請具經驗的專業顧問，避免出現「圍標」，亦能更好監管地盤安全。

工程界候任立法會議員卜國明說：「未來方向是否，當大維修工作達至某個銀碼時，必要找『招標妥』。『招標妥』是一個方法，另一個是參與找專業顧問時，需要第三方專業幫忙。機制上希望業主立案法團，有真正、有心的業主才可參與，舉例如住逾五年。」

新界東南候任立法會議員方國珊表示：「我覺得可增加透明度，例如有些標書可放上網，因過去我曾拿過一些屋苑的標書，要花很長時間也拿不到，或拿的時候部分資料有加減。希望在立法會內務委員會成立小組，就法例修正，如加強建築物條例，及消防安全條例的行政措施或法例修訂，方便前線執勤加大力度，如有違規立即出警告信，而不是等16次(巡查)才去告。」"
693e1bc2a8d97e781d731361,天氣｜本港風勢頗大 今早氣溫普遍降至15度左右,2025-12-14 12:06,2025-12-14 12:30,local,tvb,https://news.tvb.com/tc/local/693e1bc2a8d97e781d731361,"受一股強烈東北季候風影響，本港風勢頗大，天氣顯著轉涼。

本港今早氣溫普遍降至15度左右，較昨天低了四至五度。市民出門都穿上較厚衣物。

天文台指，一股強烈東北季候風，在今明兩日影響華南沿岸，該區早晚清涼，天氣乾燥。

今日日間部分時間有陽光，及非常乾燥，明日早上仍然清涼 ，隨著季候風在本周中期緩和，氣溫逐漸回升，但內陸地區日夜溫差較大。

一位市民說：「不冷，你看我只穿一件衣服，你們那麼誇張。」

鍾先生稱：「昨天沒那麼多羽絨，昨天穿外套就可以。」

古太指：「我們住新界，感覺上比九龍冷，稍為開了暖氣。我們也是『洋蔥式』穿法，即裡面的外套是可以脫的，所以還可以。很熱了？他已很熱了，所以可以脫了。因為這陣子時冷時熱，衣服拿出來放著沒收回。」

古先生就笑稱：「所以希望香港一直也很冷，就可以不停用，不用收起來。」

<a href=""https://www.hko.gov.hk/tc/wxinfo/currwx/fnd.htm"" target=""_blank"" rel="""">九天天氣預報</a>"
693e33f3a8d97e781d73ca8f,運輸署提醒下周一起實施車輛登記及領牌新制度 源頭打擊不當棄置車輛,2025-12-14 11:49,2025-12-14 12:15,local,tvb,https://news.tvb.com/tc/local/693e33f3a8d97e781d73ca8f,"運輸署提醒登記車主，下周一起實施車輛登記及領牌新制度，源頭打擊不當棄置車輛。

兩年或以上未領牌的車，運輸署會向其登記車主發出通知書，要求車主必須在三個月內為車輛領牌，把車輛拆毀或永久送離香港，之後向運輸署提交證明文件，並取消登記。

否則即屬違法，首次定罪最高罰款一萬元，和監禁三個月，其後每次定罪最高罰款二萬五千元，和監禁六個月。"
693e2fa1a8d97e781d73a4d2,講清講楚｜陳克勤：民建聯在大埔火災事件不涉任何法律問題 未來會做好服務,2025-12-14 11:31,2025-12-14 12:00,local,tvb,https://news.tvb.com/tc/local/693e2fa1a8d97e781d73a4d2,"民建聯主席陳克勤稱，整個黨在大埔火災事件，不涉及任何法律問題，仍有很多災民，主動尋求區議員黃碧嬌協助，相信政府都會查個水落石出，未來會做好服務，挽回市民信心。

立法會換屆選舉結束，民建聯仍是立法會最大黨，但得票有明顯跌幅。民建聯主席陳克勤，在本台節目《講清講楚》稱，有多個影響因素，包括民建聯在大埔火災事件中被抹黑。

民建聯主席陳克勤說：「我們是清者自清，我們相信在過程中，是無涉及任何法律問題。」

記者問：「這是否包括區議員黃碧嬌女士？」

陳克勤回答：「這個我們講得很清楚，任何人只要在這件事中違法違規，我們一定是不會寬恕，亦會嚴肅去處理。政府查完後一定會有結果，而這個結果一定是公開公平。這一刻我很相信我們是沒有問題。」

他稱等候結果的這九個月，民建聯會做好地區服務，挽回市民信心。首要是處理好災民長遠安置及重建問題，先用收到的善款及保險金處理，期望當局短期有方案公布。

民建聯已經組成十多人的專責小組跟進，但日前跟政府會面商討時，並非所有大埔區議員都現身。

陳克勤表示：「黃碧嬌在過程中一直有其選民聯絡，我們接觸的一千戶中，有很大部分，也是主動打電話給黃碧嬌，而黃碧嬌是轉介給我們一起去協助，所以沒有分，陳克勤做多一點，或者是誰做少一點，是我們整個團隊一起去做。」

政府剛成立獨立委員會，審視多方面。若有需要，例如有建造業界人士不合作，委員會可建議特首，就某些議題按法例，成為法定的獨立調查委員會。

陳克勤稱：「不一定是看一個人，兩個人或是一班人(不合作)，而是視乎事件的重要性。如果該事情是因為那個人，而有一個核心問題要解決到，若要他出來說清楚，我們都要用這個權力。」

他相信無人會不配合，政府的做法已回應社會訴求。"
693e12c9a8d97e781d72c66a,交通意外｜港島薄扶林道三車相撞 至少12人受傷,2025-12-14 09:27,2025-12-14 14:15,local,tvb,https://news.tvb.com/tc/local/693e12c9a8d97e781d72c66a,"港島薄扶林道有三車相撞，至少12人受傷。受事故影響，薄扶林道近蒲飛路實施單線雙程行車。

意外發生後，多架救護車接報到場，有傷者坐在擔架床被送院。救護員在現場設臨時分流站，傷勢較輕的人士，先在路邊接受治理。

現場是薄扶林道109號對開，早上約9時，一輛小巴與一輛的士發生碰撞，尾隨另一輛小巴，懷疑收掣不及，釀成三車連環相撞。

初步消息指，意外中至少12人受傷，全部清醒送往瑪麗醫院治理。警方在現場，向其中一名涉事司機查問事發經過，正調查意外原因。"
693be897d63af8b438ce104c,黎智英、蘋果日報6名前高層國安法案｜延伸閱讀‧控罪與審訊背景,2025-12-14 09:00,2025-12-14 09:15,local,tvb,https://news.tvb.com/tc/local/693be897d63af8b438ce104c,"壹傳媒創辦人黎智英涉嫌違反《港區國安法》案，高等法院將於明日(12月15日)，借用西九龍法院宣布裁決。

三項控罪涵蓋《國安法》及煽動刊物罪

黎智英被控三項罪名，當中兩項涉及《港區國安法》，分別是串謀勾結外國或境外勢力以危害國家安全罪，另一項則為根據《刑事罪行條例》提出的串謀刊印及發布煽動刊物罪。

控罪指黎智英於2020年至2021年間，涉嫌串謀請求外國或境外機構、組織或人員，對香港特區或中國實施制裁、封鎖或採取敵對行動。煽動刊物罪則指他與壹傳媒集團及《蘋果日報》6名前高層串謀刊印及發布煽動刊物，並同樣請求外國機構對香港或中國採取制裁。涉案的6人，包括前行政總裁張劍虹、前副社長陳沛敏、前總編輯羅偉光、前執行總編輯林文宗、英文版前執行總編輯馮偉光及前主筆楊清奇，均已認罪，張劍虹、陳沛敏、楊清奇曾在審訊中擔任重犯證人。

另外，黎智英兩項《國安法》控罪中，其中一項與「重光團隊」成員李宇軒及陳梓華有關。李宇軒是「12港人案」其中一名被告，兩人亦已認罪。所有已認罪被告將在黎智英案審結後才宣判刑期。

指定法官審理　原料審訊歷時約80日　

案件由三名《國安法》指定法官杜麗冰、李素蘭及李運騰審理。三人早前裁定黎智英三項控罪表證成立。

在結案陳詞階段，控方指黎智英為案件主腦，利用《蘋果日報》尋求外國勢力協助；針對煽動刊物罪，控方認為涉事文章超出一般批判性意見範圍。辯方則申辯，黎智英只是行使言論及新聞自由。法官表示，合法行為並非絕對，會視乎不同國家的包容程度，並結合語境考慮，不僅看文章是否提及「制裁」字眼。

這宗案件是首宗不認罪的「勾結外國勢力罪」案件，於2023年12月中開審，原預計審約80日，但最終在今年8月底完成結案陳詞，審訊歷時156日。

司法機構網頁顯示，案件定於周一上午10時在西九龍法院裁決，預計需時約60分鐘。"
693dfe0ba8d97e781d72302d,報章要聞｜大公：小巴研開新線經中九龍繞道／東方：促進銀髮經濟措施受學者質疑,2025-12-14 08:00,2025-12-14 08:30,local,tvb,https://news.tvb.com/tc/local/693dfe0ba8d97e781d72302d,"大公報報道：中九龍繞道（油麻地段）通車在即。香港公共小巴車主司機協進總會主席張漢華向大公報表示，如政府准許小巴行走新路段，待全面通車後，小巴路線由油麻地前往觀塘一帶，中間將毋須繞道至宋皇臺、九龍城，相信可為乘客節省約25至30分鐘。

城巴公司上月表示，預計路段通車後，將開通往來將軍澳及機場的全新機場快線路線A28X，將來由日出康城前往機場的車程，預計可大幅縮減約40分鐘。

東方日報報道：政府在今年5月提出了5個範疇推動銀髮經濟，包括發展銀色產業等一共30個方向，鼓勵各界推出更多銀髮相關產品及服務。但嶺大亞太老年學研究中心總監陳澤群認為，政府促進銀髮經濟的措施，只是舊酒新瓶，均着重於消費和經濟層面，並欠缺新的發展方向。

消委會明年初則將推出一站式平台，整合歷年有關銀髮產品的資料與測試報告，以及供投訴渠道等，期望可令銀髮族放心消費。"
693be3cad63af8b438cdde11,瘋牛症傳播途徑？ 克雅二氏症又有多致命？｜延伸閱讀,2025-12-14 08:00,2025-12-14 08:30,local,tvb,https://news.tvb.com/tc/local/693be3cad63af8b438cdde11,"瘋牛症是一種牛隻所患的致命疾病，發病部位一般在腦部和脊髓。該病由變異的普里昂蛋白 (prion protein) 所引致。這種異常蛋白很難被破壞或變性，因此屠場裡曾被受感染牛隻組織污染的物件包括工具等很難徹底清潔。瘋牛症在牛身上的潛伏期很長，由30個月至8年不等，染病的牛隻多在4至5歲時始發病。所有品種的牛都有染病的可能。研究顯示，瘋牛症的病原主要存在於受感染牛隻的腦部、脊髓和視網膜等組織。這些部位被指定為「高風險部位」，在屠宰過程中必須予以清除或銷毀，以免進入人類及動物的食物鏈。

人類若進食受瘋牛症污染的牛肉產品，可能會患非典型克雅二氏症。該病的潛伏期不詳，患者很可能在多年甚至數十年後才病發。非典型克雅二氏症病發初期，會有逐漸失智的現象，隨着病程進展症狀會持續惡化，患者會出現走路不穩、行動困難、視力衰退、肌肉抽搐，以及其他神經方面的症狀。非典型克雅二氏症是致命疾病，目前尚未有證明行之有效的治療或預防方法。

非典型克雅二氏症與瘋牛症的關係使進食受瘋牛症病原污染的食品成為公共衞生關注事宜。

以往瘋牛症的爆發情況

瘋牛症於1986年在英國首次被發現，肇因是英國農民把病牛的肉骨粉作為補充劑加入飼料中餵飼牛犢。在這場疫症中，以英國和歐洲各國的疫情最為嚴重，亞洲國家及美國僅有零星個案。在瘋牛症肆虐最烈的英國，有超過18萬頭牛染病，440萬頭牛在撲殺行動中被宰殺。

全球的瘋牛症個案數目，與英國比起來也不過是小巫見大巫。在1992年疫症高峰期，英國發現的個案逾37,000宗，與歐盟多國、美國、加拿大及日本等24個國家合共數百宗相比，英國瘋牛症發病率之高令人為之咋舌。

公共衞生管制措施

因應瘋牛症疫情，多國已實施公共衞生管制措施，例如監察、宰殺病牛或禁用「高風險部位」等。曾出現本土瘋牛症確認個案的國家尤其如是，目的是避免可能受瘋牛症感染的組織進入人類的食物鏈中。在眾多管制措施中，最嚴格的莫過於英國實施的《30個月以上規則》。按照該項規定，所有超過30個月大的牛隻都不可供人或牲畜食用。事後證明此舉對遏止瘋牛症收效宏大。隨着英國瘋牛症的個案減少，英國在2005年取消《30個月以上規則》，改行瘋牛症檢測計劃。2000年6月，歐洲委員會為加強對瘋牛症的管制，要求歐盟成員國自2000年10月1日起，禁止「高風險部位」進入人類和動物的食物鏈。

本港在審批進口牛肉時，會評估出口國的公眾衞生措施，確保這些措施在出現瘋牛症疫情的國家行之有效，把瘋牛症的傳播風險減到最低。因此，港人從食物染上非典型克雅二氏症的風險極微。另外，相信牛奶及乳製品不會傳播瘋牛症病原。

克雅二氏症病徵

克雅二氏症可因應病因而分為四類：偶發性（佔所有克雅二氏症大約百分之85）、家族性（百分之5至15）、醫源性和非典型。

克雅二氏症的臨牀病徵是快速惡化的認知障礙症並伴有多灶性神經系統症狀。早期病徵包括記憶力衰退、步履不穩和四肢運動失調。這些類似痴呆的症狀會逐漸惡化，患者的四肢與軀幹會出現抽搐。此外，亦可能出現視力模糊、行為異常及癲癇。大部分患者在症狀出現後一年內死亡。

傳播途徑

傳播途徑取決於克雅二氏症的類型：
‧偶發性克雅二氏症的傳播途徑不明。
‧家族性克雅二氏症由遺傳了突變的基因引起。
‧醫源性克雅二氏症是經由醫療或手術過程中傳播，如人體組織 / 器官移植。
‧非典型克雅二氏症與進食患上牛海綿狀腦病（俗稱「瘋牛症」）的牛製品有關。在外地亦曾有非典型克雅二氏症個案與輸血有關。

潛伏期

克雅二氏症的潛伏期通常較長，一般以年期計算，或可超過50年。

治理方法

目前並沒有治療任何類型克雅二氏症的有效方法。治理仍以支援性為主，沒有特別療法可阻止疾病的惡化。

預防方法

要防止此病散播，患有克雅二氏症或非典型克雅二氏症的人不得成為人體器官，組織及血液成分的捐贈者或製作成生物製品。

盡可能使用即棄的儀器和保護裝備（適用於人和工作表面）。可能被污染的手術儀器亦不應重用。

因應非典型克雅二氏症與進食受「瘋牛症」病原污染的牛製品有關，世界衞生組織建議各國不應容許有可能受「瘋牛症」病原污染的組織進入食物鏈。"
693df98aa8d97e781d720451,報章要聞｜星島：中九龍繞道迎通車／明報：未補價居屋租白表客准許費擬按租金比計,2025-12-14 07:32,2025-12-14 08:00,local,tvb,https://news.tvb.com/tc/local/693df98aa8d97e781d720451,"星島日報報道：歷時8年，集「上天、入地、下海」的中九龍繞道（油麻地段），將於下周日正式通車，連接西九龍的油麻地交匯處，與東九龍的啟德及九龍灣，預料在繁忙時間，油麻地至九龍灣的車程，由原約30分鐘大幅縮短至約5分鐘。

該路段工程規模龐大，路政署接受《星島日報》訪問時，形容挑戰性很大，同時涉及高架橋、地底及海底隧道，亦有市區建築物和臨時填海工程，並需在鬧市中施工，工程複雜且高難度。

明報報道：今年《施政報告》提出豐富置業階梯六大措施。其中由房委會及房協推出先導計劃，容許擁有資助出售單位10年或以上業主，於繳付出租准許費後，可把未補價單位，出租予合資格白表申請者，計劃名額3,000個。

接近房委會消息人士向《明報》表示，先導計劃最快明年中推出，為期兩年，及後再檢討計劃成效。當局亦傾向出租整個單位及經租賃平台開放申請。"
693deffca8d97e781d71c068,天氣｜本港天氣顯著轉涼 早上各區氣溫介乎14至16度,2025-12-14 07:00,2025-12-14 07:15,local,tvb,https://news.tvb.com/tc/local/693deffca8d97e781d71c068,"強烈季候風訊號現正生效。本港風勢頗大，天氣顯著轉涼。

天文台科學主任梁麗儷說：「在今早六點，各區氣溫普遍介乎14至16度之間，與昨天同一時間比較低了四至五度，大家出門要記得穿足夠衣物。」

一道雲帶正覆蓋華南沿岸，今日日間部分時間有陽光，及非常乾燥，最高氣溫約20度。天文台預計，明日早上仍然清涼。隨後一兩日部分時間有陽光，氣溫逐漸回升。

<a href=""https://www.hko.gov.hk/tc/wxinfo/currwx/fnd.htm"" target=""_blank"" rel="""">九天天氣預報</a>"
693de918a8d97e781d7183b7,社評｜東方：收查詢改口自爆 機管局欲蓋彌彰／明報：西方內部爆文明衝突,2025-12-14 06:30,2025-12-14 07:00,local,tvb,https://news.tvb.com/tc/local/693de918a8d97e781d7183b7,"東方日報社評：《東方日報》近日再收到消息，指香港機場旅客捷運系統在2021年運行期間轉彎時爆出大量火花，機管局至今逾4年都無向機電署通報，直至近日收到查詢才向機電署自爆。

政府在施政方面亦不斷努力增加透明度，讓公眾有效地監督，這是民主制度的優勢，良政善治的根基。是以機管局應與時並進，要通報的就即時通報，給大眾知情權，有缺失就改正，反而更能贏得公信力。

明報社評：美國本月發布了長達33頁的《國家安全戰略》，文件不僅猛烈抨擊歐洲的移民政策及一體化路線，甚至斷言歐洲將在20年內面臨「文明被抹除」。文件淡化俄羅斯威脅，並主張美國必須「重新建立對俄羅斯的戰略穩定」。刻下正值烏克蘭戰爭談判進入關鍵期，這份戰略文件令歐洲深感不安，然而歐盟卻以沉默回應。

相較之下，俄羅斯不僅表示歡迎，更稱文件觀點與俄方立場高度一致。在此背景下，歐洲該如何自處，不僅關乎俄烏和談，更關乎「西方」該當如何定義。"
693de1eaa8d97e781d714d0a,天氣｜本港風勢頗大 早上市區普遍15至16度,2025-12-14 06:00,2025-12-14 06:30,local,tvb,https://news.tvb.com/tc/local/693de1eaa8d97e781d714d0a,"天文台指，強烈東北季候風正影響廣東沿岸地區，本港風勢頗大，天氣顯著轉涼。

強烈季候風信號現正生效。

今早氣溫普遍較昨日低四至五度，市區普遍15至16度，打鼓嶺及石崗等地區氣溫僅14度，新界部分地區寒冷。預測日間部分時間有陽光及非常乾燥，最高氣溫約20度。

天文台預計，星期一早上仍然清涼，呼籲市民留意天氣變化，注意保暖。隨後一兩日部分時間有陽光，氣溫逐漸回升。

<a href=""https://www.hko.gov.hk/tc/wxinfo/currwx/fnd.htm"" target=""_blank"" rel="""">九天天氣預報</a>"
693da3d3a8d97e781d6f6a02,天氣家族｜新界部分地區寒冷 就算身處港九都一樣要做好保暖啊,2025-12-14 06:00,2025-12-14 06:15,local,tvb,https://news.tvb.com/tc/local/693da3d3a8d97e781d6f6a02,
693de221a8d97e781d715077,社評｜明報：西方內部爆文明衝突／星島：中美AI競賽 特朗普作秀不如實幹,2025-12-14 06:00,2025-12-14 06:30,local,tvb,https://news.tvb.com/tc/local/693de221a8d97e781d715077,"明報社評：美國本月發布了長達33頁的《國家安全戰略》，文件不僅猛烈抨擊歐洲的移民政策及一體化路線，甚至斷言歐洲將在20年內面臨「文明被抹除」。文件淡化俄羅斯威脅，並主張美國必須「重新建立對俄羅斯的戰略穩定」。刻下正值烏克蘭戰爭談判進入關鍵期，這份戰略文件令歐洲深感不安，然而歐盟卻以沉默回應。

相較之下，俄羅斯不僅表示歡迎，更稱文件觀點與俄方立場高度一致。在此背景下，歐洲該如何自處，不僅關乎俄烏和談，更關乎「西方」該當如何定義。

星島日報社評：中美人工智能競賽被視為世紀之戰，輝達行政總裁黃仁勳早前警告，中國將贏出AI競賽，對此美國總統特朗普上月底啟動國家級計劃「創世紀任務」，要利用AI加速科學突破，以戰勝中國。

特朗普想靠政治騷保持AI領先中國優勢，只是椽木求魚，他更應做的是，改善美國AI人力及電力等基礎。"
693ce5bca8d97e781d694207,天氣｜天文台：本港風勢頗大天氣顯著轉涼 明早仍清涼,2025-12-14 05:45,2025-12-14 06:00,local,tvb,https://news.tvb.com/tc/local/693ce5bca8d97e781d694207,"<a href=""https://www.hko.gov.hk/tc/wxinfo/currwx/fnd.htm"" target=""_blank"" rel="""">九天天氣預報</a>

[05:45]
天文台：強烈東北季候風正影響廣東沿岸地區，本港風勢頗大，天氣顯著轉涼。明日早上仍然清涼。

市民請留意天氣變化，注意保暖，多關顧長者及慢性病患者。

[14/12 00:00]
天文台：強烈東北季候風正影響廣東沿岸地區，本港風勢頗大，天氣顯著轉涼。今早（12月14日）市區最低氣溫約14度，新界部分地區寒冷。星期一早上仍然清涼。

市民請留意天氣變化，注意保暖，多關顧長者及慢性病患者。

[13/12 16:20]
天文台指，與冷鋒相關的強烈東北季候風，正影響廣東沿岸地區。本港風勢頗大，今晚有一兩陣雨，天氣顯著轉涼。

明早市區最低氣溫約14度，新界部分地區寒冷。星期一早上仍然清涼。

[15:15]
天文台發出特別天氣提示，指一道冷鋒正橫過廣東沿岸地區，受隨後的東北季候風影響，本港北風將會增強及有一兩陣雨，氣溫顯著下降。

[12:00]
天文台發出特別天氣提示，預料一道冷鋒會在今日下午稍後橫過廣東沿岸，本港北風將會增強及有一兩陣雨，氣溫顯著下降。"
693db7bca8d97e781d7004c4,灣仔有私家車撞欄翻側 男司機清醒送院,2025-12-14 03:00,2025-12-14 03:15,local,tvb,https://news.tvb.com/tc/local/693db7bca8d97e781d7004c4,"灣仔有私家車撞向防撞欄翻側，男司機清醒送院。

警方星期六晚上近11時接報，指一輛私家車沿夏愨道西行時，到警察總部對開，失控撞向防撞欄，全車翻側。私家車嚴重損毀，車門碎片飛脫，玻璃碎片散落一地。

司機輕傷送院，警方指他的酒精呼氣測試呈陰性。"
