id,title,date,scrape_time,section,source,url,news_content
6939531cd63af8b438b87a38,將軍澳有糧食店疑用冷藏牛肉冒充新鮮肉出售 不少市民稱難辨兩者差異,2025-12-10 19:01,2025-12-10 19:45,local,tvb,https://news.tvb.com/tc/local/6939531cd63af8b438b87a38,"食環署在將軍澳一間新鮮糧食店，檢獲逾半噸冷藏牛肉，店舖懷疑用來冒充新鮮牛肉出售，涉嫌違反持牌條件。

涉事新鮮糧食店，位於將軍澳新都城二期街市內，下午仍有多名食環署人員在場調查。店內部分位置看見不少蟑螂，衞生情況惡劣。

有市民稱：「我見過他們即場解凍，我以後也沒有買。我問牛肉店員，他指哪有那麼多新鮮，大多是急凍的。」

署方早前接獲市民舉報，指這間店舖懷疑以冷藏牛肉，冒充新鮮肉出售。經過數月資料分析，早上展開行動。在店內檢獲520公斤不當處理及預先包裝冷藏牛肉，店舖會以新鮮牛肉市價，即每公斤約300元出售，較冷藏肉貴近一倍。

西貢區高級衞生督察羅佩君表示：「食環署強調以冰鮮或冷藏肉，充當新鮮肉出售，除了違反持牌條件，亦會引發食物安全的問題。這種謀取暴利經營方式，亦會對其他遵從規定的店舖造成不公。」

署方指會調查貨單及調查該批凍肉有否防腐劑等，再考慮檢控。而店舖牆身有明顯污漬，已違反《食物業規例》將作檢控。

有市民指，不太懂得分辨凍肉和新鮮肉。

朱先生稱：「顏色上有少許分別，(鮮肉)好像紅些，但現時做到真與假也很紅。去買慣買熟的、大間的，不是太相熟就不要選擇，太便宜也不敢買。」

周婆婆表示：「分不到、不懂怎麼分。我們付出的(鮮肉)正式價錢，買了凍肉就不行。」

豬肉檔店員李先生指出：「凍肉是較軟、沒有彈性，色澤也是較淺，新鮮肉色澤較好。行內人容易分，一般人也不太容易。」

食環署呼籲市民要到信譽良好的店舖買肉，若有懷疑可向食環署舉報。"
69394f8bd63af8b438b8554f,立法會選舉｜新界北選區當選人譚鎮國及姚銘為新面孔 皆稱將推動落實北都事務,2025-12-10 18:46,2025-12-10 19:30,local,tvb,https://news.tvb.com/tc/local/69394f8bd63af8b438b8554f,"立法會選舉新界北選區當選兩人均是「新面孔」，他們都稱，會推動落實北部都會區發展的各項事務。
 
當選新界北議員的譚鎮國，這日來到天水圍謝票。本身是新社聯理事長的他，在一眾首次出戰直選的議會新丁中，以約4.1萬票、最高票跑出，指全靠團隊多年的地區工作。
 
立法會新界北候任議員譚鎮國稱︰「我自己打正新界社團聯會牌頭，所以亦令很多市民再一次認識到其實新社聯的服務，真的惠及了我們很久。」

過往新社聯多數與民建聯用「雙牌頭」出選，這次分拆兩隊，而民建聯選前受輿論影響，是否有利自己選情？
 
譚鎮國說︰「我們的成員亦不單包括單一政黨，除了民建聯，我們一直也與很多方方面面的界別持分者合作，有不同地區非政府組織及團體，這是最大的因素，令鎮國可成功爭取那麼多市民支持。」

同區的民建聯姚銘，由區選「票王」，再下一城步入議會，成功接棒劉國勳，但所得票數不足他一半。
 
立法會新界北候任議員姚銘稱︰「非常感謝國勳支持我，讓我能夠成功參選，當中都有很大是他的功勞，結果當中都見到支持民建聯的朋友，今次都繼續支持我們。過程中我相信有些抹黑的情況，但不要緊，市民是真正看到我們的初心服務，這才是最重要。」

兩人都身兼北區區議員，未來如何平衡兩者工作？

姚銘稱︰「兩者是沒有衝突，兩者都是與市民息息相關的事，未來會關注發展事務範疇為主。北部都會區就在我們新界北範疇中，而很多事務都要落實。」

譚鎮國說︰「一直以來在地區服務，所以我相信我可以很好地兼顧到如何可吸引到龍頭企業落戶北部都會區。有商界背景，我對於招商引資方面，都有一定經驗及網絡。」

他們亦同樣關注區內交通及醫療等規劃。"
69394c84d63af8b438b8377a,國家財政部在港成功發行70億元人民幣國債,2025-12-10 18:33,2025-12-10 19:45,finance,tvb,https://news.tvb.com/tc/finance/69394c84d63af8b438b8377a,"國家財政部在港成功發行，70億元人民幣國債。

面向機構投資者招標發行，今年第六期70億元人民幣國債，受到投資者廣泛歡迎，認購倍數約5倍，其中兩年期20億元人民幣，發行利率為1.43厘。三年期30億元人民幣，利率1.45厘。五年期20億元人民幣，利率1.65厘。"
69394c5bd63af8b438b835ec,兩隻新股首掛股價造好,2025-12-10 18:32,2025-12-10 20:00,finance,tvb,https://news.tvb.com/tc/finance/69394c5bd63af8b438b835ec,"兩隻新股首日掛牌，股價造好。

內地藥企寶濟藥業收報63元，較招股價26.38元，高出一倍三。以每手100股，不計手續費，一手帳面賺3,662元。股份公開發售部分，錄得約3,525倍超額認購，一手中籤率百分之7，國際發售超購近五倍六。集資淨額約9.2億元。

透過合併特殊目的收購公司上市的，內地圖像級激光雷達解決方案提供商，圖達通收報13.3元，較定價10元，高出逾三成。公司獲准發行3,708萬股，集資約3.7億元。

圖達通是繼獅騰及找鋼集團後，第三間借殼特殊目的收購公司，上市的個案。"
69394c2fd63af8b438b8340c,IMF上調今年內地經濟增長預測至5%,2025-12-10 18:32,2025-12-10 19:30,finance,tvb,https://news.tvb.com/tc/finance/69394c2fd63af8b438b8340c,"國際貨幣基金組織(IMF)上調今年內地經濟增長預測至百分之5。

國際貨幣基金組織指，主要由於內地採取了宏觀經濟刺激措施，而且美方對華關稅低於預期水平，預計內地經濟在2025年和2026年，將分別增長百分之5和4.5，相較十月預測，分別上調0.2個和0.3個百分點。"
69394c15d63af8b438b8304c,宏福苑五級火｜建造業界冀規管棚架上擺放物件準則 消除惡習及安全隱患,2025-12-10 18:31,2025-12-10 19:30,local,tvb,https://news.tvb.com/tc/local/69394c15d63af8b438b8304c,"政府早前勒令所有大維修的樓宇，拆除圍網，不過有業界指，不排除有承建商仍然未移走雜物，對途人仍存在風險。

屋宇署早前向全部230幢私人樓宇，發出移除棚網命令，所有外牆棚網已經完成移除。不過有業界人士反映，不少棚架在施工期間，被當作存放物料的空間，棚架上擺滿建築物料、紙皮箱等，擔心有部分移除棚網的棚架，未能及時移走雜物。

港九搭棚同敬工會理事長何炳德稱：「趕在三天將所有棚網下架的話，可能其他行頭未來得及，將物料全部清除，有機會因季候風吹至物料下墜，你拆網要三天，隨時重新拉網的時間，最少要十多天時間，所以真空期有機會超過一個月，就算用任何方法也好，都要及時將棚架上物料，移除或穩固。」

屋宇署正制定有關棚網的新安排，要求工地使用的棚網在上架前，就地採樣及核實是否符合標準，以便外牆工程可盡早恢復，最快本周內公布，何炳德希望新安排，亦能夠規管在棚架上擺放物件的準則。

何炳德表示：「反正業界內也存在那麼多惡習，亦有不規範的管理，要有一個統一的標準，我覺得要將指引寫得明確些，一些棚架上存放的物料，或用的發泡膠都沒列明，變相大家貪便宜或方便，走漏洞造成安全隱患。不要太過於彈性，讓大家有選擇，這情況下大家很多時會走漏洞。」

根據法例，棚架沒有安全圍網情況下，不能從事任何外牆工程，包括泥水、油漆、窗框、冷氣及水喉等工作。"
69394bffd63af8b438b82ed8,宏福苑五級火｜民建聯向官員提四大重建選址建議 指公帑運用要得宜,2025-12-10 18:30,2025-12-10 19:30,local,tvb,https://news.tvb.com/tc/local/69394bffd63af8b438b82ed8,"民建聯跟政府會面，提出大埔宏福苑災民的五大安置方案，以及四大重建選址，最新包括廣福公園及富蝶邨第三期。他們引述政府稱會考慮，亦認同要提供不同方案，予災民選擇。

民建聯主席陳克勤，聯同19名黨內候任立法會議員，約見財政司副司長黃偉綸、房屋局局長何永賢等，討論他們的建議，指部分災民反映，一個百多呎的過渡性房屋要住三至四人，環境易造成情緒等問題，建議中期讓居民暫住簡約公屋。

長遠有五大安置建議，其中一個是重建，有四個選址，除了之前提出富善邨後建造學院訓練場用地，新增三個，包括跟宏福苑，一街之隔的廣福公園及球場，面積最大，有3.7公頃，但要處理附近加氣站在地底鋪設的管道。還有大埔頌雅路富蝶邨三期用地，地基已打好，但只能提供約一千個單位，數目只是宏福苑的一半。最後一個方案是原址重建。

民建聯主席陳克勤指出：「四處重建方案土地建議，也是以市民自己的選擇為本，讓他們有多些不同方案，適應現時災民環境及身份。第一我們沒有指，一定要哪個重置位置，亦沒有指一定方法賠償及安置災民，政府也覺得這是合適做法。」

若等不及重建宏福苑，民建聯有四個建議。包括容許居民將單位賣予政府，獲得一筆過資金，再買樓等，或交出宏福苑單位，再以居屋「樓換樓」，如何平衡正輪候居屋市民的聲音？

陳克勤說：「畢竟那只是1,900戶，而且1,900戶也不一定全部上公屋或換居屋，很多不同方案予他們選擇。我們提醒政府及自己，公帑運用要得宜，我們自己覺得重建工作上，最重要先用現時政府成立的支援基金，捐款先用，有需要再考慮向社會募捐或政府補貼。」

至於租戶，他建議提供一筆過賠償，作重購家具及電器等。"
69394bd7d63af8b438b82cf2,宏福苑五級火｜當局將向每戶業主發一筆過十萬元補助 不排除部分援助基金用於重建,2025-12-10 18:30,2025-12-10 19:30,local,tvb,https://news.tvb.com/tc/local/69394bd7d63af8b438b82cf2,"政府成立的「大埔宏福苑援助基金」，外界捐款最新達31億元，連同3億元政府資金，合共有34億元。當局宣布向每戶業主發放一次性十萬元補助，又稱不排除部分基金用來重建或應付災民的住屋。
 
大埔宏福苑火災發生至今兩星期，目前確認160人罹難，當局下午向部分單位灌混凝土，相信用來加固結構。

援助方面，政府成立的援助基金收到26.3萬宗外界捐款，累計達31億元，當中一萬元以下有25.7萬宗，而五百萬以上有170宗，合共有17億。

之前發放的10萬元生活津貼，已批出1,617宗。向死者家屬發放的20萬元慰問金及5萬元殮葬費，暫時涉及106宗。而向傷者發放的5萬至10萬元，已批出64宗。至於向受影響外傭、學生及工友發放的資助金分別有63宗、220宗及110宗。

當局召開援助基金督導委員會後交代，將向宏福苑每戶業主發放一次性10萬元補助。

政務司副司長卓永興指出︰「有些業主其實靠出租宏福苑的單位收入應付日常開支，火災令他們失去收入。亦有業主早前投入一定資金為單位進行裝修及維修，因此亦有損失及現金流壓力。即使單位有超過一名業主，我們以每戶計算，補助額都是10萬元。」

當局指，委員會會監察援助基金運作，確保基金用得其所，部分自行承擔有關執行開支，不會要求基金回撥，重申支援是長期持續，
 
卓永興表示︰「是否現時已做得差不多，我想不可以這樣說，一有新問題，新的需要，我們要適時提供協助。應急住宿安排工作組，是研究宏福苑居民長期住屋及居住問題，那方面會看屆時有何方案走出來。如有需要時，基金會如何配合。」

被問到今次做法會否適用於日後其他火警跟進，民政及青年局局長麥美娟強調，今次是特事特辦。
 
民政及青年事務局局長麥美娟說︰「政府固然對某些事故有既定機制，但今次要做的已超出一般做法，今次規模之大、受影響人數之多，對我們社會造成影響，所以政府今次採取了司長所說的特事特辦。至於將來最重要是如何預防不幸的事故再發生。」

當局下周開始將會向捐款市民發放收據，用作稅務寬免。"
693941dfd63af8b438b7d202,時事通識｜中性利率,2025-12-10 18:25,2025-12-10 18:45,finance,tvb,https://news.tvb.com/tc/finance/693941dfd63af8b438b7d202,"日本央行行長植田和男近日表示，會慢慢調整貨幣寬鬆程度，以政策利率回到「中性利率」為目標。

「中性利率」究竟是甚麼呢？不單止日本，美國亦正以「中性利率」為目標。

中性利率又稱為「自然利率」或「均衡利率」，是指導國家或地區的貨幣政策、貨幣供應量和利率走向的理論利率。意思是一個既不刺激，亦不壓抑經濟的利率水平。換言之，當利率處於中性水平，經濟增長不會加快，亦不會減慢，經濟保持於潛在增長率之中運行。

中性利率是判斷利率政策鬆緊程度的標準。當央行想抑制通脹，政策利率應該高於中性利率。當經濟出現收縮跡象，政策利率理論上要低於中性利率，以達到刺激經濟的效用。當利率處於中性水平，經濟增長幅度和潛力一致。

至於哪個水平才是中性利率，取決各自經濟情況而定，以目前歐美經濟水平傾向的中性利率，一般介乎百分之2至3。

<a href=""https://news.tvb.com/tc/programme/behindtheheadlines"" target=""_blank"" rel="""">點擊重溫其他集數</a>"
693947ded63af8b438b80066,內地居民消費價格指數持續回升 分析料通縮壓力已逐步紓緩,2025-12-10 18:13,2025-12-10 18:45,finance,tvb,https://news.tvb.com/tc/finance/693947ded63af8b438b80066,"內地居民消費價格指數(CPI)持續回升。有分析認為，隨著整體物價走勢回暖，通縮壓力已逐步紓緩。
 
受到食品價格由跌轉升拉動，內地十一月居民消費價格指數按年升幅擴大至百分之0.7，是2024年三月以來最大升幅，符合市場預期。

扣除食品和能源價格，核心通脹百分之1.2，連續三個月維持在百分之1以上。當中鮮菜價格上升一成四，是連續下跌九個月後，首次轉升。鮮果亦都轉升。至於蛋類和豬肉價格都下跌超過一成。

有內地豬肉商戶指，隨著近期需求增加，豬肉價格已逐漸回穩。

北京新發地市場商戶李美表示︰「價格還比較平均，天氣涼了了(銷量)有些增加，一天增加有四、五頭。」

北京新發地市場商戶張洪志稱︰「銷量多了，依應量比較充足。」

擴內需政策措施繼續顯效，家用器具價格按年升近半成，服裝升百分之2。飛機票和在外餐飲價格分別上升百分之7和1.2。金飾品價格升幅擴大至五成八。

今年以來，內地整體物價走勢偏弱，居民消費價格指數多個月份出現下跌。隨著中央定調明年要提振內需，有分析相信，通縮壓力已得到紓緩。
 
資深經濟學家林樵基指出︰「數字告訴大家知道，通縮風險越來越低，看到數據都開始回暖，未來數月情況可能會有些波動，因為始終今年新年在二月，亦都反映去年上半年存在通縮環境。第十五個五年計劃，我相信會帶來很多機遇，亦都很多例如經濟措施會出台。未來這一年經濟增長都仍然可以維持於百分之4.5至5左右。」

至於反映上游通脹壓力的工業生產者出廠價格指數，按年下跌百分之2.2，主要受去年同期對比基數走高影響。

國家統計局指，各項宏觀政策不斷顯效，價格呈現積極變化，包括綜合整治「內捲式」競爭成效顯現，相關行業價格按年跌幅收窄。"
693944eed63af8b438b7f0cd,商湯科技已故創辦人與遺孀設基金 向本地及海外大學捐款培育AI人才,2025-12-10 18:01,2025-12-10 18:30,local,tvb,https://news.tvb.com/tc/local/693944eed63af8b438b7f0cd,"由商湯科技已故創辦人湯曉鷗，遺孀楊秋梅成立的慈善基金，分別向本地和海外大學捐款，培育人工智能人才。

基金將捐出2,000萬元，其中一半會捐贈予中文大學，用於招攬學者，推動人工智能發展。基金另外會向中大、港大、科大、新加坡南洋理工大學，分別捐出250萬元，用於成立獎學金，預計可讓約30位從事人工智能，研究的博士生受惠。

基金在科學園舉行啓動禮，教育局局長蔡若蓮，中大校長盧煜明等出席。"
693942bad63af8b438b7d98b,本港將於明年初實行證券無紙化 有股份過戶處指正進行系統最後測試,2025-12-10 17:51,2025-12-10 18:30,finance,tvb,https://news.tvb.com/tc/finance/693942bad63af8b438b7d98b,"本港將於明年初實行證券無紙化，有股份過戶處指，正就系統進行最後測試，將協助約1,100家上市公司客戶，以及超過160萬個投資者帳戶轉換至新制。
 
Computershare亞洲發行人服務行政總裁熊瑞律指出︰「當股票做了無紙證券模式之後，確實是可以做電子轉讓，以及更改地址、銀行戶口等事情都可以在手機應用程式上做到。當然在這個過渡時期之中，有些股份還沒有參與無紙模式，都會在手機應用程式上，可以看到整個投資組合所有股票的總值。」"
693942abd63af8b438b7d91c,港股先跌後升以全日高位收市 惟成交縮減,2025-12-10 17:51,2025-12-10 18:45,finance,tvb,https://news.tvb.com/tc/finance/693942abd63af8b438b7d91c,"港股先跌後升，以全日高位收市，但成交縮減。

連跌了兩日，大市有反彈。恒指最多下跌176點，曾經跌穿25,300點關口。午市逐步回穩，收市倒升106點，報25,540點，成交1,933億元。

胤源世創家族辦公室(香港)第一副總裁黃偉豪稱：「特別是100天線近日失守後，暫時未能再企穩之上，未來要看這位置能否收復，再看年底前能否試26,200點以上水平。一旦真的無法收復100天線，短線向下支持位，要看過去兩個月低位，約25,100點位置。」

港交所先跌後回穩，曾經失守400元，見五個月低位。領展下跌百分之1，見半年低位。運費指數下跌，航運股有沽壓，東方海外是表現最差的藍籌。

國際油價下跌，中石油和中石化跌百分之1。憧憬美國減息，金礦股有支持，靈寶黃金升百分之9。

據報萬科與債權人商討債務延期，股價升一成三。擬配股集資的長飛光纖先跌後升，收市升一成。"
69391e1bd63af8b438b67de7,有會計師行料本港今年新股上市集資額將重登全球第一 料明年進一步增加,2025-12-10 17:51,2025-12-10 18:30,finance,tvb,https://news.tvb.com/tc/finance/69391e1bd63af8b438b67de7,"有會計師行預計，本港今年新股上市集資額重登全球第一，料明年集資額進一步增加。

會計師行畢馬威表示，本港今年可重奪全球新股市場榜首，預計集資額2,721億元，按年上升兩倍一。

截至本月七日，上市申請有316宗，當中「A+H」申請佔92宗，為明年新股市場延續勢頭建立了良好基礎。
 
畢馬威中國香港資本市場組主管合夥人劉大昌指出︰「『A+H』上市公司的體量，發覺很大部分都是大型公司，有九成的申請市值超過100億元人民幣，當中還有為數不少是1,000億元人民幣以上。我們預計熱潮不會是2025年止步，2026年都會繼續延續這個勢頭。預測2026年，有機會有180至200宗的上市項目，而集資額如果樂觀些看，有機會達到3,500億元。」"
693940d0d63af8b438b7c156,有股份過戶處指年初至今已處理六成本港新股上市 料將持續活躍,2025-12-10 17:43,2025-12-10 18:15,finance,tvb,https://news.tvb.com/tc/finance/693940d0d63af8b438b7c156,"有本港股份過戶處指，年初至今，公司已處理六成在本港的新股上市，預計新股上市活動會持續活躍。
 
Computershare亞洲發行人服務行政總裁熊瑞律稱︰「我們看到背後的活動確實多得比較驚人，大家可以想像到，未看到上報紙公布上市前，背後有很多預先、前期的工作需要處理，都要詢問要點名哪間過戶處，幫他們處理上市。我們在看到的報價數量已經遠超我們過去數年，以倍計的處理。我們非常有正面的憧憬，對於我們未來的新股市場。」"
6939056cd63af8b438b5adcb,工展會周六維園揭幕續推一折及「1元」等優惠 「老友記」可享最少九五折,2025-12-10 17:31,2025-12-10 18:15,local,tvb,https://news.tvb.com/tc/local/6939056cd63af8b438b5adcb,"第59屆工展會周六起，一連24天在維園舉行，共有逾900個攤位，繼續推出多項優惠。

在維園，各參展商積極準備工作。今屆工展會繼續推出多項優惠，包括受市民歡迎的一折及「1元」優惠，包括蝦子麵、有機靈芝等。多項產品如鮑魚、保健品及食品亦只需十元就買到，不過每日名額有限。

今年「老友記」繼續有「著數」，持長者咭及樂悠咭都可獲最少九五折優惠。又首設「樂齡活力區」，集中適合長者的產品。

有參展商期望生意額有兩成增長。

健康產品公司助理傳訊經理黃嘉琪表示：「『銀髮』區域那邊應該有大約百分之10至20增長，因為有全新AI服務，加設了AI眼底肌分析，我們會讓65歲以上的長者可享有半價優惠體驗，那機器可以分析有無全身性疾病風險。」

有參展商第一次參展，除了希望推廣品牌，更希望可為社會帶來正能量。

南韓燒酒品牌參展商方秋岸指出：「社會氣氛有點低沉，希望藉著機會將產品為大家帶來歡樂，以及閒餘消閒活動。」

旅客持證件可免費入場。廠商會會長盧金榮指，已捐出一千萬元，包括工展會部分門券收入，支援宏福苑火災居民。

中華廠商聯合會會長盧金榮說：「大家需要團結一致，回復正常生活和經濟活動，這樣才能幫到受影響居民重新建立新生活。最近無論訪港旅客有所上升，以及零售消費數據也向好，希望保持到和去年一樣的成績，130萬人次入場和10億元銷售額。」

工展會成人入場費十元，若過了晚上七時，就可以免費入場，而一米以下小童、65歲或以上長者及殘疾人士免費。"
69393dd5d63af8b438b7a6bf,宏福苑五級火｜麥美娟強調火災規模大須特事特辦 以盡快及彈性協助災民,2025-12-10 17:30,2025-12-10 18:15,local,tvb,https://news.tvb.com/tc/local/69393dd5d63af8b438b7a6bf,"被問到今次對大埔宏福苑火災的支援做法，會否適用於日後火警跟進，民政及青年局局長麥美娟強調，今次火災規模大，有必要特事特辦。

民政及青年事務局局長麥美娟稱：「政府固然對某些事故有既定機制，但今次要做的已超出一般做法，大家相信亦同意今次規模之大、受影響人數之多，對我們社會造成影響，所以政府今次採取了司長所說的特事特辦，亦用很多方法，盡快、彈性可以幫到受影響災民、居民，至於將來最重要是如何預防不幸的事故再發生。」"
69393dbcd63af8b438b7a594,宏福苑五級火｜男子涉冒認災民騙取多間社福機構近二萬元援助金,2025-12-10 17:30,2025-12-10 18:15,local,tvb,https://news.tvb.com/tc/local/69393dbcd63af8b438b7a594,"警方拘捕一名36歲男子，涉嫌冒認大埔宏福苑災民，騙取多間社福機構近二萬元援助金。

警方上周接獲一名大埔宏福苑居民報案，指有人騙取社福機構的援助金。

經調查後，昨日在大埔拘捕涉案36歲男子。指他早前涉及一宗騙案，取得一名宏福苑居民的身份證，之後自上月29日起，利用該身份證的影印本，冒認是火災災民，到至少三間機構申請及騙取火災援助基金，涉款1.8萬元。

警方相信他單獨犯案，將起訴五項欺詐等罪。"
693937ecd63af8b438b76e98,食環署將軍澳檢獲冷藏牛肉冒充新鮮肉出售 形容「謀取暴利」或考慮檢控,2025-12-10 17:05,2025-12-10 17:30,local,tvb,https://news.tvb.com/tc/local/693937ecd63af8b438b76e98,"食環署在將軍澳一間店舖檢獲半噸冷藏牛肉，冒充新鮮肉出售。

食環署早前接獲投訴，經數月資料分析，早上去到將軍澳新都城二期街市展開行動，在一間持牌新鮮糧食店，檢獲520公斤不當處理及預先包裝冷藏牛肉。店舖以新鮮牛肉市價每公斤約300元出售，署方形容是「謀取暴利」。

署方指，會調查貨單，並調查該批凍肉有否防腐劑等，再考慮檢控。而店內牆身由於有明顯污漬，已違反《食物業規例》，署方將作檢控。"
