id,title,date,scrape_time,section,source,url,news_content
693e8215a8d97e781d762cc7,黎智英案｜明早10時有裁決 罪成最高判終身監禁,2025-12-14 20:40,2025-12-14 21:45,local,tvb,https://news.tvb.com/tc/local/693e8215a8d97e781d762cc7,"壹傳媒創辦人黎智英被控違反《香港國安法》案，明天早上10時有裁決，是《國安法》生效後首宗勾結外國勢力案件。一旦罪成，最高可判處終身監禁。

壹傳媒創辦人黎智英，2020年8月被國安處拘捕，一度獲准保釋，至同年12月被起訴，首次提堂還柙至裁決，歷時約五年，其中審訊用了156天。

除了黎智英，案中尚有11名被告，包括《蘋果日報》時任社長張劍虹等六名管理層，以及反修例期間登報眾籌的「重光團隊」成員李宇軒、陳梓華。當中8人已認罪，部分人成為「從犯證人」，指證黎智英。

黎智英與《蘋果日報》等3間公司否認控罪，案件前年底正式開審，由3名指定法官杜麗冰、李運騰，及李素蘭審理。

黎智英控罪有三項，第一、二項涉及跟《蘋果日報》高層串謀，發布煽動刊物及勾結外國勢力。涉案的煽動材料共161篇，時間由反修例事件前，至《國安法》生效後，類型涵蓋新聞報道至黎智英專欄、視像節目，其中31份涉及請求外國制裁。

綜合證人供詞，黎智英是壹傳媒最高領導及決策人。反修例事件前夕曾下令「做大」前政務司司長陳方安生，跟時任美國副總統彭斯會晤談人權。

而政府宣布暫緩修例後，黎智英曾稱暫緩只是策略，要將行動加劇，翌日報紙標題叫人「照上街」。

控方指2019年中下旬，黎智英兩度訪美，包括與彭斯和時任國務卿蓬佩奧會面，並請求制裁。庭上證供顯示黎智英主張「和勇不分化」，同年七一立法會被破壞後，下令多做年輕人心聲，爭取支持。

翌年在《蘋果日報》發起向時任美國總統特朗普，發一人一信救香港。亦推出《蘋果日報》英文版，指示要「偏黃」，毋須平衡報道，多做內地負面新聞。

在《國安法》生效後，繼續邀請外國嘉賓在其節目對談，亦無表明要改變《蘋果日報》的編採方針。被捕後曾受訪稱「坐監都揀這條路」。

黎智英自辯指不干預編採，承認《國安法》生效前，有發出部分編採指令，但《國安法》生效後，有稱須改內容以免違法，不過會「擦邊球」。又稱其專欄只是列明事實或分析推測。

至於第三項控罪，涉及串謀跟「重光團隊」，勾結外國勢力。控方指黎智英是幕後主腦，旗下公司或助手Mark Simon，在反修例期間，有份墊支團隊的登報眾籌等，以引起國際對港關注。

控方亦指黎智英有份協調李宇軒跟美國參議員會面，而Mark Simon有資助外國政客，來港參與區議會選舉監選團。黎智英跟「重光團隊」個別成員會面時，曾提及要透過制裁達到目的。而「重光團隊」訪美時，曾透過現時被國安通緝的朱牧民，將制裁名單轉交予美國議員。

而《國安法》生效後，「重光團隊」亦繼續協助英國保守黨人權委員會委員裴倫德，成立「對華政策跨國議會聯盟」，即IPAC，亦跟日本議員成立分支。

黎智英自辯稱，不認識「重光團隊」，不知個別隊員搞「國際線」，《國安法》生效前有倡議制裁，生效後無。

法庭去年7月裁定三項控罪表證成立。控方結案陳詞時指，就煽動罪，只須證明涉案文章有煽動的意圖，而被告在知情下發布，已屬違法。辯方就提出傳媒監察政府的論點。

另一爭議是相關犯罪行為在國安法生效後，是否須重新協議才算違法。"
693ea615a8d97e781d7755b7,沙田馬場國際賽｜10場賽事投注額為16.6億元 旅客入場人數創單日新高｜附全文,2025-12-14 19:55,2025-12-14 21:15,local,tvb,https://news.tvb.com/tc/local/693ea615a8d97e781d7755b7,"全日13,300名旅客入場創單日新高，10場賽事投注額為16.6億元。

【馬會公告全文】

年度國際馬壇盛事「浪琴香港國際賽事」今天（14日）在沙田馬場圓滿舉行。在賽馬旅遊帶動下，入場旅客人數高達13,300人，不單創下歷來浪琴香港國際賽事的新高，更打破單日賽馬日的旅客入場紀錄。

隨着今天破紀錄的旅客入場人數，2025/26年度馬季開鑼僅僅三個月，累積入場旅客已突破11萬人；對比2024/25年度馬季，需時半年才達到10萬名旅客入場的大關，今季僅用三個月便超過上年紀錄的一半，充分顯示賽馬旅遊的吸引力。按此勢頭，今個馬季的最終入場旅客人數，有望挑戰上個馬季的195,786名旅客入場數字。

投注額方面，今天10場賽事共錄得逾16億6000萬港元，其中匯合彩池投注額錄得近4億8000萬港元，打破歷來10場賽事的紀錄。

馬會行政總裁應家柏表示，今天的浪琴香港國際賽事日匯聚了頂尖的騎師和馬匹，上演了歷來其中最精彩的賽事日，他說：「我們在沙田見證了頂級世界級賽事，在海外及本地馬主、練馬師及騎師的支持下，馬會在國際舞台上展現香港的風采，我們對此深感自豪。」

過去一年香港賽駒在海外屢創佳績，包括世界王者「浪漫勇士」及應屆香港馬王「嘉應高昇」，成功帶動內地及海外旅客專程來港，欣賞牠們在香港主場出戰浪琴香港國際賽事。廈門旅客湯先生第一次來港，他指過去幾年一直關注香港賽馬，為了支持「浪漫勇士」出戰浪琴香港盃，今天特意來港參與賽事。他表示曾到海外其他馬場觀賽，認為香港賽事氣氛更熱烈：「將來有機會一定會再來港入馬場欣賞賽事，也會推薦朋友前來。」

南非旅客Kuben Gengan熱愛賽馬，更到訪六大洲觀看賽馬賽事。今年10月他觀看「嘉應高昇」以精湛表現在澳洲攻下「珠穆朗瑪峰錦標」後，決心一定要來港，親睹這匹世界短途王者在港出戰。Kuben Gengan和親友均是第一次來港，他盛讚香港的景色令人嘆為觀止，尤其馬場充滿活力：「馬場內人山人海，氣氛是最熱烈，充分感受到港人對賽馬的熱情。」

今天全日上演四場一級賽，主隊最終囊括當中三項大賽桂冠，成績十分亮麗。其中全球最高評分的短途星級賽駒「嘉應高昇」，以壓倒性姿態成功衛冕浪琴香港短途錦標，取得跨季16連捷，平了傳奇香港馬王「金鎗六十」的紀錄。

在一級賽浪琴香港盃中，「浪漫勇士」輕鬆獲勝，連續四年攻下此賽冠軍，締創歷史，同時把其累積獎金增至二億四千萬港元，繼續成為全球贏得最多獎金的賽駒。上屆香港三冠王「遨遊氣泡」在一級賽浪琴香港一哩錦標中，成功蟬聯冠軍。至於海外賽駒「同工之妙」，則揚威一級賽浪琴香港瓶。"
693ea47ba8d97e781d774e4f,立法會選舉｜不少候任議員無政黨 有新議員關注大埔火災引伸樓宇工程問題,2025-12-14 19:50,2025-12-14 21:45,local,tvb,https://news.tvb.com/tc/local/693ea47ba8d97e781d774e4f,"新一屆立法會30個功能界別議席，逾半數由「新丁」當選，不少是無政黨背景。

「新面孔」吳錦華在立法會會計界選舉中，以七百多票之差勝出，擊敗民建聯現屆議員黃俊碩。

競選期間以「三無」為賣點，最終成功當選。

候任立法會會計界議員吳錦華表示：「我不敢評論是否『爆冷』，無論你是哪個會計師也好，大家講的語言都一樣，即會計是一個共通語言，所以用一個持平客觀角度。」

曾任稅務學會會長，目前有競委會，社工註冊局等公職，吳錦華稱晉身議會後，可用更高平台向政府表達意見，有信心勝任議員職務。

吳錦華稱：「會計的功能較多是較為後勤些，去監測政府如何運用款項，用得是否到位，圍標問題會否，第一是由競爭法(入手)，又或建築物管理條例，要去探討法例如何研究及修改。」

同樣首次進入議會的還有建築、測量、都市規劃及園境界的劉文君，亦關注大埔宏幅苑大火引伸的樓宇工程問題。

候任立法會建築、測量、都市規劃及園境界議員劉文君說：「未有新的改革措施前，我認為加強抽樣調查，是一個最直接的方法，無論個人或組織，有時我們很想社會進步期間，可能都會有些盲點，大家都從錯誤中學習、向前看，看看如何防止這些事情發生，就比較務實些。」

她本身是建築師學會會長，打破這界別，多年來由測量師連勝的局面，劉文君坦言今次是險勝，希望未來可扭轉行業弊端。

劉文君指出：「有些政策可能都非常一刀切，並非循序漸進，指超過三千萬的公務工程，就一定要用組裝合成，不論其性質為何，其實因此有時造成建築費特別貴。」

她又稱未來聚焦在建築方法等，確保公帑得以善用。"
693e91f8a8d97e781d76acd4,宏福苑五級火｜候任議員倡檢視招標機制 部分工程強制用「招標妥」等,2025-12-14 18:31,2025-12-14 19:00,local,tvb,https://news.tvb.com/tc/local/693e91f8a8d97e781d76acd4,"大埔宏福苑周三舉行業主大會，議程包括匯報火災前消防系統狀況、議決終止大維修工程合約等。有候任立法會議員提議，政府成立的獨立委員會應檢視招標機制，部分工程要強制用「招標妥」等。

據宏福苑居民提供的議程，業主大會周三晚上七時半，在太和鄰里社區中心禮堂舉行，九項議程包括悼念默哀儀式、由管理公司匯報火災前消防系統狀況等，及議決終止大維修工程合約等。

政府就火災成立的獨立委員會本月下旬起運作，候任工程界立法會議員卜國明期望，委員會可檢視招標機制，協助業主聘請具經驗的專業顧問，甚至部分工程要強制用「招標妥」，避免出現「圍標」。

工程界候任立法會議員卜國明表示：「未來方向是否當大維修工作，達至某個銀碼時必要找『招標妥』，『招標妥』是一個方法，另一個是參與找專業顧問時，需要第三方專業幫忙，機制上希望業主立案法團，有真正、有心的業主才可參與，舉例如住逾五年。」

民建聯新界西北議員周浩鼎指出：「以往大家講始終私人工程，就私人管理好像政府干涉及可監督情況，可有改善空間，我們認為『招標妥』，日後市建局某些工程，若符合某些條件，是否可由政府代辦，加強政府介入及監督力度。」

另一名候任立法會議員方國珊認為，有必要加強招標透明度。

新界東南候任立法會議員方國珊稱：「例如有些標書可放上網，因過去我曾拿過一些屋苑的標書，要花很長時間也拿不到，或拿的時候部分資料有加減。」

而醫管局周一起至明年2月28日，為受災居民安排接受最多三次免費中醫診症服務，已有150名中醫師參與，涵蓋超過170個服務點。"
693e8e1da8d97e781d768889,首引非法操練罪｜26歲女子被捕 涉新蒲崗工廈槍械訓練案,2025-12-14 18:13,2025-12-14 19:00,local,tvb,https://news.tvb.com/tc/local/693e8e1da8d97e781d768889,"警方國安處再拘捕一名26歲女子，涉嫌同上周新蒲崗工廈單位，進行槍械訓練等案件有關，累計有十人被捕。

女子上周五晚被捕涉嫌違反《國安條例》下的「非法操練罪」，她獲准保釋候查，須於下月中向警方報到。

至於早前被捕的九人，國安處落案起訴其中兩名分別24歲及25歲男子，他們合共被控一項「串謀顛覆國家政權」罪，明日上午在西九龍裁判法院提堂。

警方調查顯示，有團夥於工廈單位內進行非法操練，包括持槍械操練、刀術及格鬥術等。"
693e848ea8d97e781d764520,七男涉公共場所偷信用卡「碌爆卡」被捕 涉款逾400萬元,2025-12-14 17:34,2025-12-14 18:15,local,tvb,https://news.tvb.com/tc/local/693e848ea8d97e781d764520,"警方拘捕七名男子，涉嫌偷取信用卡進行大額簽帳圖利，涉款逾400萬元。

警方周五起一連兩日展開行動，偵破一個盜用信用卡簽帳的犯罪集團，以涉嫌盜竊及以欺騙手段取得財產，拘捕七名30至60歲男子，涉嫌9月至本月在港島和九龍人流密集的地區，包括運動場、咖啡室和餐廳等，偷取受害人銀包內的信用卡，然後交予中間人，再分發給其他成員，然後短時間內到名店及海味店等，以最快速度用盡簽帳額，即「碌爆卡」，簽帳金額可高達數十萬元，包括一隻價值30萬元的名表。

港島總區科技及財富罪案組高級督察徐蔚瑩說：「(被捕人)趁受害人沒留意時，將他們銀包內的信用卡盜取，然後將錢包和其他財物放回原位，令受害人難以即時發現他們的信用卡不見了。我們翻查和整合大量閉路電視片段，包括警隊銳眼計劃，成功梳理出犯罪鏈條上不同的角色，包括扒手、中間人和假買家。」

被捕人涉及22宗案件，涉款超過400萬元，警方相信疑犯會將購入的物品放到黑市變賣套現，不排除有更多人被捕。

警方呼籲市民在人多的地方要提高警惕，商戶處理大額信用卡交易亦應核實簽帳者，是否信用卡持有人。"
693e81c0a8d97e781d762a2c,民主黨通過表決解散及清盤決定 羅健熙：意味結束運作,2025-12-14 17:21,2025-12-14 17:30,local,tvb,https://news.tvb.com/tc/local/693e81c0a8d97e781d762a2c,民主黨通過表決解散及清盤決定，主席羅健熙：意味民主黨結束運作。
693e71eaa8d97e781d75a12f,有越南設廠港商指當地不少勞工懂粵語 對發展潛力有信心,2025-12-14 16:13,2025-12-14 16:45,local,tvb,https://news.tvb.com/tc/local/693e71eaa8d97e781d75a12f,"越南近年成功吸引不少外資在當地設廠，有港商指，當地人口年輕，加上不少勞工都懂粵語，對當地發展潛力有信心。

這家港企有超過20年眼鏡生產經驗，多年來在深圳設廠。七年前轉到越南胡志明市附近的隆安省，設立生產線。

採用循環再造物料，例如塑膠水瓶製作眼鏡框架，又用可生物降解物料製造鏡片。除了自家眼鏡品牌，亦有為多個國際品牌，提供設計、材料及代工等一條龍服務。年產量達二、三百萬副眼鏡。

公司指，越南北部和中部，今年多次受颱風吹襲及水浸，但他們的廠房在南部，損毀相對輕微，但亦要做足準備。

港資眼鏡公司總經理林之豪說：「廠房在外面都有一個地下水池。除了收集雨水之外，也是防洪，所以我們在這裡，也做很多策略性的工夫。」

廠房現時有逾450名員工，正持續擴充團隊，期望能擴大產能。

林之豪稱：「其實胡志明是一個很繁華的地方，所以都見到生意或經濟正在發展。他們正在建造一個新的機場，新機場亦會近我們工廠些，所以亦係一個挺好的發展。」

越南本地員工Annie表示：「越來越多香港和中國（企業）來投資，我覺得將來會發展得很大。我是華僑、同聲同氣，很多發展機會。」

越南本地員工Zizu指：「我們全部用粵語溝通，溝通完全沒有任何困難、很順暢。」

香港工業總會主席林世雄指，越南地理位置與雲南、廣西接壤，具地理優勢。

香港工業總會主席林世雄指出：「物流鏈是，陸路可去到中國，而在越南有個生產基地之後，他們可以在越南自己的市場，越南有1億人的市場。另外還有它可出口去不同國家，譬如說越南和美國，就定了它的關稅是多少。中國的關稅，現在暫時可說是休戰，其實大概都休戰一年，將來下去怎樣呢，大家都不知道。」

這裡的產品不少需要精細作業，部分工序比較難由智能生產線取代，所以選擇勞工成本較低的越南設廠，相對有成本效益。"
693e6ed2a8d97e781d759586,宏福苑五級火｜李家超明起上京述職 向習近平匯報火災跟進工作,2025-12-14 16:01,2025-12-14 17:00,local,tvb,https://news.tvb.com/tc/local/693e6ed2a8d97e781d759586,"行政長官李家超明日至周三到北京述職，他日前曾經表示將向國家領導人匯報大埔宏福苑火災跟進工作。

行政長官李家超周一至三到北京述職，匯報內容包括香港經濟、社會和政治等方面的最新情況。

李家超日前交代就大埔宏福苑火災，成立獨立委員會的安排時，已表示述職期間，會匯報火災善後工作。

行政長官李家超說：「習近平主席已經表示高度關注，我必然會匯報特區政府在這方面所做的工作，以及香港社會『一方有難、八方支援』的共同力量。」

李家超亦提到，相信習近平主席希望知道的包括本港按「十四五」規劃的發展、部署和成績，多年來《施政報告》做出來的成績，國際對香港的觀感、評級進展、可以再強化的空間，以及如何更好地積極服務國家發展大局等。

李家超述職期間，行政長官辦公室主任葉文娟和行政長官私人秘書黃霆芝會隨行，政務司司長陳國基會署理行政長官職務。

另外，澳門行政長官岑浩輝同樣於周一至三到北京述職，向國家領導人匯報澳門特區政府過去一年施政工作和2026年施政重點。期間由行政法務司司長黃少澤臨時代理行政長官職務。"
693e6855a8d97e781d755e86,警方拘七男涉偷信用卡「碌爆卡」 涉款逾400萬元,2025-12-14 15:32,2025-12-14 16:45,local,tvb,https://news.tvb.com/tc/local/693e6855a8d97e781d755e86,"警方拘捕七名男子，涉嫌偷取信用卡進行大額簽帳圖利，涉款金額逾400萬元。

行動中檢獲多張懷疑被盜用的信用卡、金飾、名牌手袋等證物。

警方近日展開行動，以盜竊等罪，拘捕7名由30至60歲男子，全部是犯罪集團成員。涉嫌在9月至本月期間，在人流密集地區，例如運動場、咖啡室和餐廳等，偷取受害人銀包內信用卡。然後交予中間人並分發給其他成員，短時間內到名店及海味店等，以最快速度用盡簽帳額，即「碌爆卡」，簽帳金額由數千元至數十萬元。

警方相信被捕人完成交易後，變賣物品圖利，涉案總金額超過四百萬元。

港島總區科技及財富罪案組高級督察徐蔚瑩說：「(被捕人)趁受害人沒留意時，將他們銀包內的信用卡盜取，然後將錢包和其他財物放回原位，令受害人難以即時發現他們的信用卡不見了，我們翻查和整合大量閉路電視片段，包括警隊銳眼計劃安裝在罪案黑點的閉路電視錄像，成功梳理出犯罪鏈條上不同的角色，包括扒手、中間人和假買家，我們掌握了他們的犯罪路線、交接過程和消費模式，最終成功鎖定和拘捕涉案成員。」"
693e617aa8d97e781d752a2d,石硤尾24歲男子涉斬傷父親被捕 疑因使用洗手間問題,2025-12-14 15:03,2025-12-14 16:15,local,tvb,https://news.tvb.com/tc/local/693e617aa8d97e781d752a2d,"石硤尾白田邨一名24歲男子，涉嫌用刀襲擊父親被捕。

事發在麗田樓一個單位，警方上午約9時半接報，一對同住父子懷疑因為使用洗手間問題發生爭執，期間有人用一把長約21厘米水果刀，襲擊65歲父親，他頸部受傷清醒送院。

施襲男子涉嫌傷人被捕，消息指有精神病紀錄，有定期覆診，他事發後亦情緒不穩，送往明愛醫院檢查。"
693e480ba8d97e781d745ddf,李家超明起到北京述職 向習近平匯報香港經濟等最新情況,2025-12-14 13:14,2025-12-14 16:45,local,tvb,https://news.tvb.com/tc/local/693e480ba8d97e781d745ddf,"行政長官李家超明日至周三，到北京述職。

李家超將向國家領導人，匯報香港經濟、社會和政治等方面最新情況。行政長官辦公室主任葉文娟，和行政長官私人秘書黃霆芝將會隨行。

他離港期間，由政務司司長陳國基，署理行政長官職務。"
693e44b0a8d97e781d744d7f,天氣｜氣溫急降有市民「洋蔥式」穿衣 有家庭醫生稱求診人數多三成,2025-12-14 13:01,2025-12-14 14:15,local,tvb,https://news.tvb.com/tc/local/693e44b0a8d97e781d744d7f,"受強烈東北季候風影響，本港風勢頗大，天氣顯著轉涼。

氣溫急降、天氣明顯轉涼，不少市民外出都要「變裝」，羽絨、頸巾等都出動，就連牠們也要添衣保暖。

古太說：「我們也是『洋蔥式』穿法，即裡面的外套是可以脫的，所以還可以。」

有市民稱：「不冷，你看我只穿一件衣服，你們那麼誇張。」

早上各區氣溫普遍降至約15度，較周六低4至5度，當中大帽山，最低氣溫只有約6度。

天文台表示，一股強烈東北季候風，今明兩日影響華南沿岸，早晚清涼、天氣乾燥，而隨著季候風在本周中期緩和，氣溫逐漸回升。

天文台科學主任黃浩宜指出：「預計明早仍清涼，至本周中期天色稍為好轉，部分時間有陽光、氣溫會回升，內陸地區日夜溫差較大。」

有家庭醫生稱氣溫急降下，這兩天求診人數，比平日多了三成。

家庭醫生林永和表示：「隨著天氣冷，或市民穿著可能不合適，一時太多一時太少，太侷或太冷，令免疫系統受考驗，令病毒乘虛而入，有很多發高燒，或急性喉嚨痛或咳，急著來求診。」

他提醒家長，盡快帶子女接種流感疫苗，避免患上流感及引發併發症風險。"
693e448fa8d97e781d744c8c,據悉本周將展開財政預算案公眾諮詢 陳茂波稱加快創科培育應用是重要課題,2025-12-14 13:00,2025-12-14 14:00,local,tvb,https://news.tvb.com/tc/local/693e448fa8d97e781d744c8c,"新一年度《財政預算案》，據了解今個星期中展開公眾諮詢。財政司司長陳茂波稱，加快創新科技的培育和應用，會是重要課題之一。

財政司司長陳茂波最新在網誌撰文，題為《預期正面、加快轉型》，預告即將就新一年度《財政預算案》展開公眾諮詢。諮詢重點將包括，如何進一步擴大經濟發展的面向和領域，加快創新科技的培育和應用，加速優化產業結構，創造更多優質就業職位，以及為高質量發展增添動能。

陳茂波表示，今年來香港的貨物出口，按年錄得雙位數增長，加上本地需求改善，私人消費開支輕微加快，零售、餐飲和住宅物業市道均回穩，企業投資開支亦增加，令本港即使面對不明朗的外圍因素，今年以來經濟仍然穩步發展。首三季合計按年增長百分之3.3，全年增長預測上調至百分之3.2。

訪港旅客量創疫情後新高，當中逾兩成三是內地以外的旅客，按年升幅一成六，支持零售和餐飲市道。即將來臨的聖誕和新年假期，形形色色的活動，以及業界的不同優惠推廣，將吸引更多旅客到來，為消費市道以至整體經濟，注入更大動力。

陳茂波又提到，投資者和商界對本港經濟前景持續樂觀。過去數月，相繼有金融機構和大型電商平台，租用或購入多層商業樓面，甚至整幢商廈，透過加強在本港的部署，以開拓內地以及國際業務，均反映市場對未來的正面預期。

他呼籲市民就《預算案》諮詢，提出更多具體建議。"
693e40a6a8d97e781d742664,中九龍繞道油麻地段下周日通車 路政署指工程穿越鬧市地底遇不少挑戰,2025-12-14 12:44,2025-12-14 13:30,local,tvb,https://news.tvb.com/tc/local/693e40a6a8d97e781d742664,"中九龍繞道油麻地段下周日通車，路政署表示，工程穿越中九龍鬧市地底，施工期間遇到不少挑戰。

造價達423億元的中九龍繞道油麻地段，花了八年時間興建。政府早前敲定本月21通車，預計繁忙時間，由油麻地到九龍灣的車程，可由約30分鐘，大幅縮減至約5分鐘。

有別於本港其他行車隧道，這項工程不用穿山、過海，但要穿越整個中九龍的「石屎森林」地底，為工程團隊帶來多項挑戰。

由於這裡的地底原本已有繁忙的港鐵網絡，隧道部分走線同港鐵行車隧道，最近距離僅3米。

其中由土瓜灣馬頭角，至油麻地地底的一段隧道，長2.8公里，最深達150米。工程團隊在高樓大廈林立的地底，共進行約2,400次爆破，但要確保地面和附近，約240幢樓宇不受影響，當中包括伊利沙伯醫院。

路政署高級工程師(中九龍幹線)潘家欣表示：「我們每天最多只能在特定的15分鐘內進行爆破，以免影響醫院醫療設施日常運作，所以整個過程都需要嚴密監測。」

還有一個困難，是與現有天橋交換位置。

潘家欣介紹：「我們先要拆卸原有天橋樁柱，再興建隧道。完成興建隧道後，這座新的加士居道天橋，其樁柱會與隧道的結構融為一體地建造，所以過程比較複雜，過程中同時要維持天橋上的交通。」

建造過程中，路政署引入多項新建造技術，包括智慧工地管理平台，實時監察工地運作和進度。又引入智能超高車輛檢測系統，利用偵測相機、光學雷達，防止過高的車輛撞到興建中的橋樑。"
