id,title,date,scrape_time,section,source,url,news_content
68bfb60aeee6da38c4cc4640,公屋精神病母子因隱瞞資產被勒令遷出後墮亡 何永賢：署方已人性化處理,2025-09-09 13:07,2025-09-09 17:15,local,tvb,https://news.tvb.com/tc/local/68bfb60aeee6da38c4cc4640,"一對住公屋母子因隱瞞資產被房屋署勒令遷出，兩母子都患精神病，之後墮樓身亡。房屋局局長何永賢指，署方已人性化處理，認同可提高敏感度和更細心。

這對母子住在天水圍天恩邨，被指13年前申請公屋時，無如實申報資產，房屋署查證後，去年十一月向其發出遷出通知書。母子提出上訴，青山醫院發出證明書，建議容許二人繼續居住於該單位，但上訴委員會最終維持決定，二人先後墮樓身亡。

房屋局局長何永賢回應稱，房屋已向租戶強調可暫緩搬出日期，亦可為他們申請寶田中轉屋，但認同可加強訓練前線人員處理手法。

房屋局局長何永賢說：「在多次中間的申報，都沒有提及他們有土地，兩塊土地的價值估值70多萬元，加入資產總值是超出了。有醫生信的，他們亦有交給上訴委員會，上訴委員會過程中，都有考慮一整體原因，包括事實上真的有瞞騙情況。當然在細節上，特別是有特殊需要住戶，可能都要加強認知，如溝通要再細心點、敏感度。」

何永賢又指，處理這個個案的上訴委員會，成員包括律師及社工背景專業人士，可考慮加入醫學背景人士。

何永賢指：「上訴委員會組成，暫時是律師較多、過半都是律師，其他就是教育界等專業人士，我覺得有醫學背景專業人士方面，我們可以物色多點有心的。」

她又指今年首七個月處理的上訴個案，有近四成獲修訂或取消，亦有住戶會尋求司法覆核，反映上訴制度完整及公平。"
68bfb5eeeee6da38c4cc45d8,季節性流感疫苗接種計劃本月25日開始 暫有23間學校不參與外展接種,2025-09-09 13:06,2025-09-09 14:00,local,tvb,https://news.tvb.com/tc/local/68bfb5eeeee6da38c4cc45d8,"季節性流感疫苗接種計劃將在本月25日開始。暫時有23間學校不參與外展接種。

本地流感活躍程度呈上升趨勢。衞生防護中心稱，上月底流感輕微超越基線水平，會再判斷是否已進入夏季流感季節。

當局今年繼續推行學校外展接種計劃，目前有23間學校表明不參加，署方會如去年般，將名單上載至網站。

包括這間學校，去年都沒參加計劃，但有家長認為，如可在校內打針會較方便。

王太說：「試過流感高峰期找不到疫苗，連噴鼻都沒有、都好頭痛，但學校又要求接種，要等好長時間才有。若學校提供到都會相信，都會接種。」

陳女士稱：「(學校)沒有都沒辦法，自己在外面接種、都要打，(校內)方便點，不用自己在外面約時間，又要到處找，在學校一併接種就好。」

政府今年亦採購新的流感疫苗，包括「重組疫苗」及科興滅活疫苗，衞生防護中心指每款適用人士不同。

衞生署衞生防護中心總監徐樂堅表示：「就科興疫苗及重組疫苗，在孕婦上不是禁忌症，因為這兩種疫苗在做試驗時，未獲得太多孕婦及哺乳女士的數據。孕婦打疫苗除了幫助自己減低風險，亦能幫助嬰兒，尤其現時很多疫苗，六個月或以下不適合接種，小朋友在母親腹中最重要。是取得疫苗給予的抗體。」

他又指滅活平台已使用多年，對很多年齡群組而言都是安全。"
