id,title,date,scrape_time,section,source,url,news_content
6876d65e54d16ed89ecf58c3,社評｜明報：網約車合法化邁大步／星島：網約車規管框架出爐,2025-07-16 06:29,2025-07-16 07:15,local,tvb,https://news.tvb.com/tc/local/6876d65e54d16ed89ecf58c3,"明報社評：網約車規管框架千喚萬喚終出爐，網約平台、司機及車輛牌照有效期最長皆為五年，所有牌照不得轉讓，司機發牌不設上限，車輛牌則設總量控制，數目待定。

規管框架的引入標誌網約車服務合法化，乘客也可得到更佳保障。至於能否滿足市場需求，還看車輛發牌數量等細節。為防出現惡性競爭等亂象，當局在合法化起步階段傾向審慎可以理解，然而網約車發牌數目不應太少，否則難以滿足乘客需要。

星島日報社評：香港的士服務質素欠佳早就不是新聞，許多乘客於是「轉投」近年逐漸普及的網約車，但卻凸顯了當局對這一新興事物的監管問題。就在網約車平台「攻港」十一年後，政府提出規管的立法建議，雖屬姍姍來遲，但相比往屆政府的蹉跎躊躇，本屆政府明顯不迴避不畏難，勇於改變，有利本港點對點交通服務的進步和革新。

我們不應認為，規管網約車的立法程序完成後，就沒有進一步改革的必要，畢竟內地和美國已經有了無人駕駛網約車，香港若要追趕時代，將來就要持續優化相關法律，進一步完善點對點交通服務。"
6876d3fd54d16ed89ecf4bc6,市場對供應擔憂紓緩 油價下跌,2025-07-16 06:19,2025-07-16 07:15,finance,tvb,https://news.tvb.com/tc/finance/6876d3fd54d16ed89ecf4bc6,"原油期貨價格下跌。美國總統特朗普要求俄羅斯50日內結束與烏克蘭的戰爭，以避免制裁，紓緩市場對供應的擔憂，油價下跌。

紐約期油收市報66.52美元一桶，跌46美仙，跌幅百分之0.69。倫敦期油收市報68.71美元一桶，跌50美仙，跌幅百分之0.72。

另外，美國石油協會公布，上周原油庫存增加83.9萬桶，市場原先預期減少163.7萬桶。汽油庫存則增加193.1萬桶，市場預期為減少69.4萬桶。"
6876d3e054d16ed89ecf4ad8,美國通脹數據符合預期 美元上升拖累金價下跌,2025-07-16 06:18,2025-07-16 07:15,finance,tvb,https://news.tvb.com/tc/finance/6876d3e054d16ed89ecf4ad8,"美國通脹數據符合預期，美元上升，拖累金價下跌，現貨金價跌約百分之0.5。

至於紐約期金，收市報3,336.7美元一盎司，跌22.4美元，跌幅百分之0.67。"
6876d3c754d16ed89ecf4a09,美國加密貨幣相關法案未獲眾議院通過關鍵程序 曾跌穿11.6萬美元水平,2025-07-16 06:17,2025-07-16 07:00,finance,tvb,https://news.tvb.com/tc/finance/6876d3c754d16ed89ecf4a09,"美國多項加密貨幣相關法案未能在眾議院通過關鍵程序表決，比特幣一度跌超過百分之3，曾跌穿11.6萬美元水平。

根據財經頻道《CNBC》報道，有13名共和黨議員聯同民主黨阻擋程序性動議，令多項由美國總統特朗普支持的多條加密貨幣相關法案，未獲通過關鍵程序。眾議院領導層暫定在稍後時間再次舉行表決，試圖推動立法。比特幣曾低見11.57萬美元水平，目前則在11.7萬美元以上。"
6876d38f54d16ed89ecf47e8,港股美國預託證券與本港收市比較 造價個別發展,2025-07-16 06:17,2025-07-16 06:45,finance,tvb,https://news.tvb.com/tc/finance/6876d38f54d16ed89ecf47e8,"在美國買賣的港股預託證券與本港收市比較，造價個別發展。

滙豐控股收市折合97.06元，比本港收市低0.59元。工商銀行6.13元，低2仙。建設銀行8.42元，與本港收市價相同。友邦保險69.06元，高0.11元。港交所427.43元，高3仙。

騰訊控股518.09元，高0.59元。阿里巴巴114.78元，高1.28元。理想汽車113.47元，高0.47元。金沙中國19.17元，高5仙。長和47.57元，低0.58元。"
6876d37654d16ed89ecf4696,美股三大指數個別發展 傳統股份下跌科技股上升,2025-07-16 06:17,2025-07-16 06:45,finance,tvb,https://news.tvb.com/tc/finance/6876d37654d16ed89ecf4696,"傳統股份下跌，科技股上升，美股三項主要指數個別發展。

道瓊斯工業平均指數收市報44,023點，跌436點。標準普爾500指數收市報6,243點，跌24點。

美國上月通脹率回升，多家大銀行業績好壞參半，道指接近平開後，略為抽高就急轉直下，午市一直在低位橫行，尾市曾見全日低位，最多跌457點，收市跌436點。

標普500指數在科技股帶動下，開高26點，更一度升越6,300點關，但很快掉頭向下，尾市最多跌26點，收市跌24點。

人工智能晶片商Nvidia輝達升百分之4，公司行政總裁黃仁勳訪華，並宣布專供中國市場的H20晶片即將恢復供貨。貝萊德第二季度業績不如市場預期，跌近百分之6。富國銀行下調今年盈利指引，跌半成。次季業績勝預期的花旗集團就升超過百分之3。

納斯達克指數一度升近200點，收市升37點，報20,677點。反映中國概念股表現的納斯達克中國金龍指數，收市報7,697點，升206點。"
6876cc7954d16ed89ecf14fa,美國消費物價加快上升惟特朗普促減息 摩根大通CEO指聯儲局獨立性至關重要,2025-07-16 05:45,2025-07-16 06:15,finance,tvb,https://news.tvb.com/tc/finance/6876cc7954d16ed89ecf14fa,"美國消費物價上月加快上升，升幅是五個月來最大，但總統特朗普仍然認為物價低企，再次敦促聯邦儲備局減息。摩根大通行政總裁戴蒙為聯儲局主席鮑威爾發聲，指聯儲局的獨立性至關重要。

根據美國勞工部公布的6月份數字，消費物價按月比較上升百分之0.3，為今年1月以來最大升幅，較5月份升幅高0.2個百分點。而按年比較則升百分之2.7，為4個月以來最大升幅，較5月份升幅高0.3個百分點，為連續第二個月加快上升。

美國總統特朗普在社交媒體發文，指物價處於低水平，聯儲局應該馬上減息。

特朗普和政府官員以至外界估計，有機會接替鮑威爾出任聯儲局主席的前理事沃爾什，近日藉聯儲局翻新總部一事，對鮑威爾窮追猛打，指他管理失誤，可能構成罷免他的原因。

摩根大通行政總裁戴蒙周二表示，聯儲局的獨立性絕對重要，玩弄聯儲局將會有反效果。

戴蒙是美國主要金融機構中首位領導人，因應政府近期對鮑威爾的猛烈抨擊，為鮑威爾發聲。

財政部長貝森特周二接受彭博電視訪問時，為特朗普針對鮑威爾的行為解畫，指特朗普沒有意圖，在鮑威爾的任期明年5月屆滿前將他辭退，近期抨擊鮑威爾只是在施壓。

他又表示，獨立的中央銀行，對維護長期政府債券作為穩健投資的可信度非常重要。"
6876cb1854d16ed89ecf0523,港元匯價再觸及弱方兌換保證 金管局承接逾148億港元沽盤,2025-07-16 05:39,2025-07-16 06:00,finance,tvb,https://news.tvb.com/tc/finance/6876cb1854d16ed89ecf0523,港元匯價再觸及弱方兌換保證，金融管理局在紐約時段，承接逾148億港元沽盤。
6876891654d16ed89ecd3420,道指收市報44023點 跌436點,2025-07-16 04:00,2025-07-16 05:15,finance,tvb,https://news.tvb.com/tc/finance/6876891654d16ed89ecd3420,"道瓊斯工業平均指數收報44,023點，跌436點。

標準普爾五百指數收報6,243點，跌24點。"
6876a08854d16ed89ecdd6e7,東涌有非華裔男子於行人天橋遇劫 輕傷送院,2025-07-16 02:39,2025-07-16 03:15,local,tvb,https://news.tvb.com/tc/local/6876a08854d16ed89ecdd6e7,"東涌有非華裔男子在行人天橋遇劫，輕傷送院。

案發於滿東邨滿樂坊對開的行人天橋。警方指昨晚九時半，42歲男事主被4名戴口罩非華裔男子截劫，搶走銀包及手機，現金損失兩萬元。男事主臉部受傷送院，劫匪得手後，往黃家圍村方向逃去。"
6876906d54d16ed89ecd64f3,啟德有果汁店冰凍乳酪驗出總含菌量超標三倍多 食安中心指示停售,2025-07-16 01:31,2025-07-16 02:00,local,tvb,https://news.tvb.com/tc/local/6876906d54d16ed89ecd64f3,"啟德有果汁店的冰凍乳酪，驗出總含菌量超標三倍多。

該商店位於九龍城Airside商場地庫。食安中心抽取的檢測樣本，大腸菌群含量每克120個，超出法例上限兩成。樣本總含菌量達每克22萬個，比每克不可含有五萬個細菌的法例上限，超標三倍多。

食安中心指顯示產品衞生欠理想，但並不表示會引起食物中毒，指示商店停售冰凍乳酪和棄置相關食品。亦向店舖負責人和員工作出食物安全和衞生教育，要求商戶徹底清潔和消毒。"
6876897354d16ed89ecd397a,荃灣有私家車懷疑失控撞壆 81歲司機昏迷送院,2025-07-16 01:01,2025-07-16 01:30,local,tvb,https://news.tvb.com/tc/local/6876897354d16ed89ecd397a,"荃灣有私家車懷疑失控撞壆，81歲司機昏迷送院。

事發後，黑色私家車停在石壆旁，車身輕微損毀。

警方在昨晚近八時接報，指私家車沿荃灣路往屯門方向行駛，駛至近海之戀商場附近，男司機懷疑身體不適暈倒，車輛失控撞向石壆。司機被困車內，消防救出時昏迷，送往瑪嘉烈醫院治理。警方調查意外原因。"
687688f154d16ed89ecd314b,歐洲主要股市下跌,2025-07-16 01:00,2025-07-16 06:45,finance,tvb,https://news.tvb.com/tc/finance/687688f154d16ed89ecd314b,"倫敦富時100指數收報8,938點，跌59點。

巴黎CAC 40指數收報7,766點，跌41點。

德國DAX指數收報24,060點，跌100點。"
687677d054d16ed89ecca8a1,美股個別發展道指早段跌逾200點 標指及納指再創新高,2025-07-15 23:45,2025-07-16 00:00,finance,tvb,https://news.tvb.com/tc/finance/687677d054d16ed89ecca8a1,"美國股市個別發展，道指早段下跌逾200點，標指和納指則再創新高。

晶片生產商Nvidia輝達獲美國政府批准，向中國出口人工智能(AI)晶片H20，輝達股價造好，早段升幅約半成，突破170美元關口。

納指一開市就突破20,800點關口，再創新高。標指亦破頂，升至6,300點水平。

摩根大通公布上季業績後，股價升百分之1，突破290美元後回軟。富國銀行公布上季業績後，早段跌約百分之4。"
6876743854d16ed89ecc877e,圖輯｜書展明起一連七日會展舉行 以飲食文化及未來生活為主題,2025-07-15 23:31,2025-07-16 00:00,local,tvb,https://news.tvb.com/tc/local/6876743854d16ed89ecc877e,"香港書展明日起一連七日在會展舉行，今屆以飲食文化及未來生活為主題。

在「世界文化藝術廊」展區，這八張餐桌展示世界各地有關食療、節慶飲食，以及餐桌禮儀等書籍及展品，由八位藝術家與各國駐港總領事館合作，推動中外飲食文學及文化藝術交流。

今屆書展的年度主題是「飲食文化‧未來生活」。有內地展商指，準備了1,200多款有關中國飲食、文化和建築等書籍，當中超過一半是新出版。

南方出版傳媒負責人陳斌說：「歷史經典、典籍，我們有做很大的套書，讓大家知道嶺南文化基礎。最好全部賣光，以往有六、七成會賣光，最後會做促銷。」

今年的新展區「文化及創意產品區」，展示了來自不同地區、具有中華文化特色的文創產品。展區內有互動遊戲、文創紀念品，以及非物質文化遺產互動體驗區。

有參展商準備了非遺銅雕技藝大師朱炳仁，以及十多位本地藝術家的作品。

集古齋行政總監賴欽輝表示：「我們想將本地藝術家推廣給大家，希望用文創產品，將中華文化傳承給市民。」

同場的運動消閒博覽，就設置了運動體驗場區，以及全運會展示區。讓入場人士了解香港承辦的競賽項目。

連同零食世界，三個同期舉行的項目，一共有超過770間展商參加。成人入場票價30元、小童10元，嬰幼兒及長者免費。

展區內亦有互動裝置，拍下照片就可以生成不同風格和飲食場合的AI畫作，可以帶走留念。"
687671dc54d16ed89ecc7562,瑪嘉烈醫院至少五名病人感染產碳青霉烯酶腸道桿菌 涉內科及老人科,2025-07-15 23:20,2025-07-15 23:30,local,tvb,https://news.tvb.com/tc/local/687671dc54d16ed89ecc7562,"瑪嘉烈醫院爆發產碳青霉烯酶腸道桿菌感染群組，涉及五名病人。

院方指，涉及內科及老人科一個男病房，上周一起，先後有五名65歲至90歲病人，經檢測後確診相關腸道桿菌，正接受隔離治療。

其中一名病人出現感染病徵，因自身疾病，現時情況危殆；另外四人無病徵，兩人情況穩定、兩人嚴重。

醫院會根據指引，徹底清潔及消毒相關病房，加強病人及環境篩查，及嚴格執行接觸傳播防護措施，加強員工及病人手部衞生。

根據衞生防護中心資訊，腸道桿菌能引致身體不同部位感染，這些細菌通常有抗藥性，帶菌者可毫無病徵。正確使用抗生素和注意和環境衞生，有助預防感染和傳播。"
687671d254d16ed89ecc74ca,秀茂坪有巴士與貨車相撞 包括兩名司機在內共八人受傷,2025-07-15 23:18,2025-07-15 23:30,local,tvb,https://news.tvb.com/tc/local/687671d254d16ed89ecc74ca,"秀茂坪有巴士和貨車相撞，八人受傷。

事發後，涉事巴士和貨車停在秀茂坪道及寶林路十字路口，有警員了解情況。巴士車頭擋風玻璃被撞毀，車門嚴重損毀，玻璃散落一地。貨車車頭凹陷。

警方在下午四時許接報，指一輛城巴601線在寶林路東行，轉入寶達邨時與一輛貨車相撞，包括兩名司機在內共八人受輕傷，其中一人拒絕送院，其他均送往聯合醫院治理。警方正調查意外原因。"
68766aab54d16ed89ecc39f2,行會允共享基金會以一千元地價租用西區歷史建築,2025-07-15 22:50,2025-07-15 23:30,local,tvb,https://news.tvb.com/tc/local/68766aab54d16ed89ecc39f2,"行政長官會同行政會議批准，前特首梁振英牽頭的共享基金會，以1,000元象徵式地價，租用西區一個歷史建築作為辦公室。

獲批的政府土地位於醫院道四號，約1,046平方米，連同現有的二級歷史建築，包括一座五層高的主大樓，和一座一層高的附屬大樓，建於1921年。

政府發言人表示，共享基金會是香港的國際人道主義援助機構，目前已在八個「一帶一路」國家展開服務，包括白內障手術、登革熱防控等，批地可滿足基金會擴展需求。"
68766aa354d16ed89ecc39b5,屯門有電動滑板車疑短路起火 三人燒傷,2025-07-15 22:49,2025-07-15 23:00,local,tvb,https://news.tvb.com/tc/local/68766aa354d16ed89ecc39b5,"屯門有電動滑板車懷疑短路，引起火警，三人燒傷。

起火的是屯門福亨村162號地下，警方下午約一時半接報，消防到場後用兩個滅火筒將火救熄。初步調查發現一輛停泊近門口的電動滑板車，懷疑短路過熱起火。

單位內持「行街紙」的印尼籍一家三口，分別面、手及腳受傷，送往屯門醫院治理。"
6876693f54d16ed89ecc2851,富國銀行第二季多賺近一成二,2025-07-15 22:44,2025-07-15 23:00,finance,tvb,https://news.tvb.com/tc/finance/6876693f54d16ed89ecc2851,"富國銀行第二季多賺近一成二。

盈利接近55億美元，每股盈利1.6美元，按年增加兩成。期內，收入逾208億美元，稍高過市場預期。"
6876692f54d16ed89ecc2762,摩通第二季業績勝預期,2025-07-15 22:43,2025-07-15 23:00,finance,tvb,https://news.tvb.com/tc/finance/6876692f54d16ed89ecc2762,"摩根大通第二季業績好過市場預期。

盈利接近150億美元，按年下跌一成七，按季則上升百分之2。每股盈利5.24美元。

期內，淨收入減少一成，至456.8億美元，高過市場預期的440億美元。淨利息收入佔233億美元，非利息收入224億美元。

摩根大通行政總裁戴蒙表示，美國經濟保持韌性，稅改及放寬監管有利經濟前景，但市場仍存有重大風險，包括關稅及貿易不確定、地緣政局惡化，及財政赤字上升。"
6876691b54d16ed89ecc262f,美國上月通脹略為升溫,2025-07-15 22:43,2025-07-15 23:00,finance,tvb,https://news.tvb.com/tc/finance/6876691b54d16ed89ecc262f,"美國上月通脹略為升溫。

美國勞工部公布，6月消費物價指數(CPI)按年上升百分之2.7，較5月高0.3個百分點，並見2月以來最高。按月比較，上升百分之0.3，較5月高0.2個百分點，但符合市場預期。

扣除能源和食品的核心消費物價指數，按年升百分之2.9，按月升百分之0.2，兩項數據都稍高過5月份。"
6876662354d16ed89ecc0e06,行政會議按一貫暑假安排 下周二不舉行會議,2025-07-15 22:30,2025-07-15 22:45,local,tvb,https://news.tvb.com/tc/local/6876662354d16ed89ecc0e06,"行政會議按一貫暑假安排，下周二不舉行會議。

行政會議秘書處就行會的會議安排發新聞稿，指按一貫暑假安排，行會下周二不舉行會議，下次會議日期將另行公布。

期間行政會議會繼續就不同專題，進行內部小組討論，並會按需要與有關部門探討問題。"
68765b8854d16ed89ecbb655,六合彩結果：頭獎一注中 派逾一千四百萬,2025-07-15 22:20,2025-07-15 22:45,local,tvb,https://news.tvb.com/tc/local/68765b8854d16ed89ecbb655,"六合彩號碼：9、12、23、30、31、44，特別號碼：5。

頭獎一注中，派逾一千四百萬。"
6876629754d16ed89ecbed4b,立法會舉行酒會與駐港總領事等交流 梁君彥指香港具無限潛力及機遇,2025-07-15 22:15,2025-07-15 22:45,local,tvb,https://news.tvb.com/tc/local/6876629754d16ed89ecbed4b,"立法會舉行交流酒會，與駐港總領事及名譽領事交流。立法會主席梁君彥致辭表示，香港經歷過去數年的挑戰，變得更有韌性，未來有無限潛力和機遇。

立法會主席梁君彥說：「從2019年暴動到新冠疫情、經濟持續下行等，為城市的基礎帶來考驗，但香港在其中展現韌力。過去兩年半，我們政府協助1,300間海外和內地企業來港開設和拓展業務，帶來逾1,600億元直接投資，這些不是『死城』的徵狀，而是城市充滿活力，擁有巨大潛力和無限機遇，香港肯定『未玩完』。」"
68765f0654d16ed89ecbda2d,澳門歷史城區申遺成功20周年 民間團體辦導賞團傳承歷史文化,2025-07-15 22:00,2025-07-15 22:30,local,tvb,https://news.tvb.com/tc/local/68765f0654d16ed89ecbda2d,"今日是澳門歷史城區申遺成功20周年，澳門發行主題郵票，並將舉辦多項慶祝活動，民間團體亦有舉辦世遺導賞團。

1849年的一個傍晚，澳門總督亞馬留騎馬出遊，有華人跪在路邊佯裝遞狀，其實是刺殺總督。澳門有團體舉辦夜遊世遺活動，以劇本殺的形式呈現這宗歷史事件。

澳門居民易小姐說：「劇本殺元素是最吸引到我，其實令我們在聽導賞時，會更加投入去聽故事是怎樣，如何去利用自己角色身份，最後可能去破解一些任務。」

導賞長兩小時，每場大約有二十名參加者，分別扮演澳葡官員或者村民，由議事亭前地出發，走過市政署大樓、舊法院、區華利前地，以及政府總部等地方，一邊走一邊了解澳門歷史城區和歷史故事。

北京旅客肖小姐指出：「所以這次一路走過來的形式非常好，結合實地場景，一一地介紹這個地方、它歷史的細節，非常有繼續想深入去了解的欲望。」

主辦方表示，希望透過多元的活動形式，傳承澳門歷史文化。

澳門文物大使協會副理事長鍾梓榛表示：「我們想的是有這麼好的歷史(題材)，都可以加些不同的元素，加些新的想法，去令到歷史事件，對於年輕人來說沒那麼乏味和沉悶，然後用新穎方式，令他們更加容易接受，自己親身代入去玩，就有更加多不同體驗。」

澳門歷史城區包括20多座歷史建築，2005年被列入世界文化遺產名錄。

澳門文化局將在7月至12月期間，舉辦超過50場活動，以慶祝澳門歷史城區申遺成功20年，包括發行一套主題郵票，選取澳門哪咤廟、大炮台、聖安多尼堂及前地，和玫瑰聖母堂等作為圖案，並會製作世遺紀錄片，以及舉辦國際論壇等。"
68766ed254d16ed89ecc5f25,時事多面睇｜網約車規管出爐 司機會否加入？,2025-07-15 21:30,2025-07-16 00:00,local,tvb,https://news.tvb.com/tc/local/68766ed254d16ed89ecc5f25,"政府提交規管網約車立法建議，計劃向平台、司機與車輛分別發牌。

有前兼職網約車司機說，會等細節公布後，再決定是否重新入行，有甚麼考慮因素呢？的士司機又會否加入網約車行列？

<a href=""https://news.tvb.com/tc/programme/closerlook/6876739854d16ed89ecc7edd"" target=""_blank"" rel="""">點擊觀看節目重溫</a>"
687649fe54d16ed89ecb21e3,私隱署就港大生涉用AI製不雅照展開調查 李家超：政府密切監察人工智能發展,2025-07-15 20:30,2025-07-15 21:00,local,tvb,https://news.tvb.com/tc/local/687649fe54d16ed89ecb21e3,"港大法律系有男學生利用人工智能(AI)技術，將多名女同學及教師的相片製作成不雅相片。個人資料私隱專員公署指，已就事件展開刑事調查。

身兼港大校監的行政長官李家超指，現行法例涵蓋大部分網絡行為，會密切監察人工智能發展。

行政長官李家超表示︰「大學除了培育學生知識外，亦應以立德樹人的精神，培育大學生的德行。任何傷害他人的行為，除了可能涉及刑事罪行外，亦可能侵犯他人的私隱及個人利益。大學有責任嚴肅處理學生行為問題，除了以校規處理缺德外，如涉及違法，應向執法部門舉報，以儆效尤。大部分現行法例原則上適用於網絡世界。人工智能是新興科技，發展迅速萬變，很短時間就可能出現新變化及能力。政府會密切監察人工智能發展及應用情況，亦審視全球管理趨勢，參考國際最佳實踐，進行深入研究如何處理。」"
6875de7854d16ed89ec7ae09,消委會發現可攜式電風扇送風量差異逾1.5倍 一款樣本充電時過熱,2025-07-15 20:15,2025-07-15 20:45,local,tvb,https://news.tvb.com/tc/local/6875de7854d16ed89ec7ae09,"消委會測試發現，可攜式電風扇送風量差異逾1.5倍，亦有一款充電時電池會過熱，溫度升至攝氏56.6度。

夏日炎炎，不少人都會攜帶電風扇外出。

李太表示：「可以散熱，幫我減輕些溫度。一入港鐵就立即關機，盡量都省電來用。」

有市民指出：「帶出街都沒有用，因氣溫三十多度，吹出來的風都是熱的。有時吹一小時就沒電，又要充電。」

消委會測試市面上18款可攜式電風扇，分為兩個組別。機身較輕組別，送風量範圍每分鐘為0.91至2.34立方米，差距超過1.5倍；而機身較重組別，其中三款風扇頭直徑均為約6厘米，但送風量相差約九成，顯示不應以風扇頭大小，評估送風能力。

至於安全性，大部分樣本均通過防止過熱保護及過度充電保護等測試，但有一款充電時，溫度升幅不符要求。

根據國際安全標準，充電池表面的最高溫度升幅不應超出20度，但這款樣本充電時，電池表面溫度升逾31度；引述專家指出，一般不會構成著火或爆炸，但或會令充電池內部出現反應，加速老化。

消委會研究及普查總監張昕帆說：「若電池老化，可能買回來的新風扇可吹三小時，慢慢地電池老化就用不了三小時，可能兩小時、一小時。提醒消費者如使用風扇時，表面很熱或有異味，要馬上關閉及移除電源。」

廠商回覆指，電池與電路板預留空隙，不會直接接觸，正常使用下溫度不會過高。

另外，消委會發現全部樣本的說明書均有不足之處，如欠缺勿讓小孩玩等警告字句。消委會促請廠商應按標準要求，改善產品說明書內容，又指已將安全測試結果轉交海關，作進一步跟進。"
