id,title,date,scrape_time,section,source,url,news_content
68c0564eeee6da38c4d15f97,道指收市報45711點 升196點,2025-09-10 04:00,2025-09-10 05:00,finance,tvb,https://news.tvb.com/tc/finance/68c0564eeee6da38c4d15f97,"道瓊斯工業平均指數收報45,711點，升196點。

標準普爾五百指數收報6,512點，升17點。"
68c0563deee6da38c4d15e55,歐洲主要股市個別發展,2025-09-10 01:00,2025-09-10 04:15,finance,tvb,https://news.tvb.com/tc/finance/68c0563deee6da38c4d15e55,"倫敦富時100指數收報9,242點，升21點。

巴黎CAC 40指數收報7,749點，升14點。

德國DAX指數收報23,718點，跌88點。"
68c04f0feee6da38c4d12d5a,中電電動車撞兩名途人及兩部車釀一死六傷 司機涉危駕被捕,2025-09-10 00:00,2025-09-10 00:45,local,tvb,https://news.tvb.com/tc/local/68c04f0feee6da38c4d12d5a,"中電一輛電動車在土瓜灣撞到兩名途人及兩部車，釀成一死六傷。

涉事的中電電動車，車頭嚴重損毀，前座車門凹陷，被撞到的私家車，車頭亦嚴重損毀，車尾撞向牆身變型，旁邊的客貨車亦受到波及。現場留下血漬，以及雨傘及鞋等物品。

出事的中電電動車，下午三時半駛入馬頭圍邨停車場，到達閘口時，突然加速撞到閘口欄杆，隨後逆線右轉駛入，撞到兩名女途人，再撞向私家車和客貨車。其中一名被撞的55歲女途人，送往廣華醫院搶救後不治。

62歲涉事電動車男司機被帶上警車調查，之後送往醫院治理，其後以危險駕駛導致他人死亡被捕。

電動車上三男一女乘客，以及另一名女途人受輕傷，分別被送往廣華醫院和伊利沙伯醫院救治。

有汽車業界人士提醒，即使大部分新型電動車有自動煞車系統，駕駛者都要小心留意路面情況。認為電動車加速比一般汽車更快，可能是今次意外原因之一。

中國香港汽車會永遠榮譽會長李耀培說：「電動車加速很快之餘，電動車也是沒有聲音的，今次撞倒兩個行人，因為它是逆線，行人是完全不知道。而且電動車的重量，因為有電池，它加速或者撞擊的時候，會產生很大的撞擊。」

中電發言人表示，會全力協助警方調查，已即時派員跟進。案件交由西九龍交通意外特別調查隊跟進。中電曾表示，截至今年4月底，中電的小型車種包括房車和SUV等逾八成已轉成電動車。"
68c04c16eee6da38c4d11239,同性伴侶本港產子僅一人獲登記為母親 兩人提司法覆核勝訴,2025-09-09 23:47,2025-09-10 00:15,local,tvb,https://news.tvb.com/tc/local/68c04c16eee6da38c4d11239,"一對女同性伴侶在外國透過體外受精受孕，在本港分娩。申請出世紙時，只有其中一人獲登記為母親，兩人提出司法覆核獲判勝訴。

司法覆核申請人是一對女同性伴侶，一人捐卵、一人懷胎。兩人2020年在南非接受「互惠人工受孕」，從其中一人體內取出卵子，與捐贈者的精子結合成胚胎，植入同性伴侶的子宮。2021年在香港誕下男嬰，兩女子向入境處登記作「父母」，但只有懷胎的一位列為「母親」，父親一欄留空。高等法院早前裁定，捐卵的女子，也是該男嬰「普通法下的家長」。兩人再提司法覆核，要求在出世紙上，確立捐卵的都是「母親」。

政府一方提到，雙重母親未必得到本港社會共識認可，法官高浩文反駁，民意大多數均無法動搖法庭如何詮釋人權，就算有人認為雙重母親窒礙子女個人成長以至福祉，但說法欠缺實質證據。引用外國案例指出，捐卵的女子基因上是嬰兒的家長。而本案關鍵問題之一，是為何案中男嬰不能如同其他兒童一樣，將遺傳基因和受孕雙方登記為父母，認為存在差別待遇。判申請方勝訴，但應該作甚麼頒令，則需與訟各方商議。

根據現時《父母與子女條例》，包括藉代母等醫療懷孕，因胚胎被放置到體內而懷孕的女子，除她以外，別無其他女子被視為該子女的母親，有立法會議員擔心，判案衝擊傳統家庭倫理。

民建聯新界西北議員周浩鼎說：「我對今日高等法院的判決，感到非常失望及焦慮，最需要糾正的法律觀點，究竟《父母與子女條例》中父母的定義如何？還是一男一女，還是現時法庭的判決就是根本上不需要是一男一女。制定時是符合我們的家庭倫理價值，只不過現時法庭對這定義有不同看法。但判決出來，對社會是有非常深遠的影響。」

他認為政府須上訴。"
68c04b82eee6da38c4d10bb3,美股個別發展 道指早段反覆向上,2025-09-09 23:45,2025-09-10 00:15,finance,tvb,https://news.tvb.com/tc/finance/68c04b82eee6da38c4d10bb3,"美國股市個別發展，道指早段反覆向上。

美國非農就業數據大幅向下修訂，市場對聯儲局減息預期進一步增加。

道指早段曾升逾150點，升至45,600點水平。標指和納指則窄幅上落。"
68c0448beee6da38c4d0cc85,學校或院舍流感爆發持續增加 衞生防護中心籲接種疫苗,2025-09-09 23:15,2025-09-09 23:45,local,tvb,https://news.tvb.com/tc/local/68c0448beee6da38c4d0cc85,"衞生防護中心指，香港已進入夏季流感季節，呼籲學童和高風險群組接種流感疫苗。而市民逗留人多擠迫地方，應戴口罩。

近日越來越多人感染流感，衞生防護中心上周四曾指截至上月底，流感病毒陽性比率和入院率皆已輕微超越基線水平。約半個星期後，中心就指流感活躍程度進一步上升，審慎監察近兩周趨勢後，判斷已進入夏季流感季節。

近日學校或院舍流感爆發持續增加。上周有26宗、按周倍增。共259人染病，是前一周的三倍。隨著新學期開始，學校爆發個案顯著增加。今周首三天已有24宗，是開學前一周的六倍。涉及276人，最多的一宗有98人感染。中心指已派人在該些學校視察，建議學生戴口罩、適當開窗改善通風，停止跨班別、跨級別活動等。

亞洲兒童傳染病學會會長關日華說：「多了小朋友互相接觸，人與人之間傳播病毒。現在暫時數目不算多，如果做足預防措施，可以繼續上學。如果打了流感針，相對風險感染後併發症會低些。另外我們工作間都要注意通風，我們給多些鮮風稀釋空氣，讓病毒不聚集感染我們，另外注意個人衞生。」

再多一宗兒童嚴重個案，一名15歲男童周一開始發燒，喉嚨痛、咳嗽及嘔吐，到私家醫院求診，獲安排在兒童深切治療部留醫，確診H3甲型流感病毒併發敗血性休克。周二已轉往普通病房留醫，情況穩定。

中心又提醒，疫苗有效預防季節性流感重症及併發症。衞生署以上年度為例，各疫苗接種計劃共打了約209萬劑流感疫苗，創下歷史新高。成人和兒童嚴重流感個案，較新冠疫情前的流感季節分別跌兩成和六成。相信是歸功於疫苗接種率上升。

中心提醒高危人士到公眾地方時應戴口罩。市民乘搭交通工具，或在人多擠迫的地方逗留時，亦應考慮戴口罩。"
68c03cadeee6da38c4d08c7a,現貨金價突破3670美元一盎司,2025-09-09 22:41,2025-09-09 23:00,finance,tvb,https://news.tvb.com/tc/finance/68c03cadeee6da38c4d08c7a,"現貨金價突破3,670美元一盎司。

金價曾升至3,674美元水平，較上日升百分之1。過去兩日累積上升百分之2.5，今年以來累積升幅近四成。

市場對美國聯儲局減息的預期升溫，地緣政治緊張，以及多國央行增持黃金，都推動金價上升。

捷克央行在社交媒體發文指，黃金持有量已達到1993年以來最高水平。捷克央行於八月底持有65.2噸黃金。"
68c03cb5eee6da38c4d08ca4,雲鋒金融獲准提供虛擬資產交易服務,2025-09-09 22:41,2025-09-09 23:15,finance,tvb,https://news.tvb.com/tc/finance/68c03cb5eee6da38c4d08ca4,"雲鋒金融獲批准提供虛擬資產交易服務。

旗下的全資附屬公司雲鋒證券獲得證監會批准，現有第一類(證券交易)受規管活動的牌照升級，提供虛擬資產交易服務。

雲鋒金融早前宣布，買入以太幣作為儲備資產，在公開市場累計買入1萬枚以太幣，投資成本4,400萬美元，相當於約3.4億港元。"
68c02fa0eee6da38c4d02a8b,六合彩結果：頭獎無人中 二獎三注半中每注派逾106萬,2025-09-09 22:25,2025-09-09 23:00,local,tvb,https://news.tvb.com/tc/local/68c02fa0eee6da38c4d02a8b,"六合彩號碼：7、15、32、40、42、44，特別號碼：9。

頭獎無人中，二獎三注半中，每注派逾106萬。"
68c036a8eee6da38c4d05c5a,WTT澳門冠軍賽 王楚欽、林詩棟首圈輕鬆過關,2025-09-09 22:16,2025-09-09 23:15,local,tvb,https://news.tvb.com/tc/local/68c036a8eee6da38c4d05c5a,"澳門一連六日舉辦第四屆世界乒乓球職業大聯盟，即WTT澳門冠軍賽。國家隊的王楚欽、林詩棟，首圈輕鬆過關。

賽事在東亞運動會體育館舉行，該場地亦會在全運會期間舉行排球及羽毛球比賽項目。有世界頂尖男、女各32名球員參加，冠軍將獲得1,000點世界排名積分。國家隊盡遣主力，由男、女單打世界第一，林詩棟、孫穎莎，以及新科世界冠軍王楚欽領銜。首日賽事，王楚欽、林詩棟都順利勝出。而孫穎莎、王曼昱則明日出戰。

有球迷在場館外，與展板上心儀的選手合照，有不少人帶了應援物品，當地有小學組織校內乒乓球隊的學生觀賽。

澳門居民譚先生表示：「我覺得這樣起碼讓小朋友提前去認識頂級選手的打法，可以給自己累積少少經驗，雖然不是自己下場打，但起碼看到別人是怎樣打，自己學時都會有個印象。」

內地旅客梁小姐指出：「上一次我們是世界盃來過，三、四月份，我們都是從奧運會開始喜歡他們兩個(選手)，因為我們離得比較近，所以就選擇來澳門看。多辦比賽，我們多多來看。」"
68c001e2eee6da38c4cea79b,區議員葉吉江危駕罪成被停職一周 民青局指屬最嚴厲處分,2025-09-09 22:15,2025-09-09 23:00,local,tvb,https://news.tvb.com/tc/local/68c001e2eee6da38c4cea79b,"民政及青年事務局首次按區議員履職監察制度，暫停屯門區區議員葉吉江職務一星期，亦不會發這星期的酬金。局方稱暫停議員職能和職務是最嚴厲的處分。

屯門區議會網頁公布葉吉江停職的安排，由本月10日至本月16日，暫停區議員職能和職務，其議員辦事處期間亦只會有限度運作。議員資料一欄，仍然有葉吉江的資料，他是委任議員，報稱商人，無政治聯繫。事件原於去年8月，葉吉江在上水駕駛時撞到一部的士，今年5月承認危險駕駛，判罰200小時社會服務令。

民青局局長麥美娟根據《區議會條例》，委任監察委員會進行調查。委員會考慮相關證據，事件對區議員、區議會及政府的聲譽及威信造成的負面影響，以及葉吉江的書面陳述，認為葉吉江被法庭判刑構成行為失當，建議暫停葉吉江區議員職能和職務一星期。

民青局局長同意委員會的意見，以書面通知葉吉江有關決定，他暫停職務期間，無權收取任何酬金或津貼，但可獲發還這段時間的運作開支，例如辦事處租金和員工薪酬。 

麥美娟表示，今次是完善地區治理後，首次根據區議員履職監察制度，對區議員行為失當作出調查及處分，強調政府非常重視區議員的品行和誠信操守，政府會繼續監察區議員的履職情況，確保每一位區議員能盡忠職守，為居民服務。"
68c03687eee6da38c4d059bd,金價繼續創新高 ,2025-09-09 22:15,2025-09-09 23:00,finance,tvb,https://news.tvb.com/tc/finance/68c03687eee6da38c4d059bd,"金價繼續創新高，現貨金價逼近3,660美元一盎司。

金價升至3,659美元水平，較上日升百分0.6。過去兩日累積上升百分之2.5，今年以來累積升幅近四成。

市場對美國聯儲局減息的預期升溫，地緣政治緊張，以及多國央行增持黃金，都推動金價上升。

捷克央行在社交媒體發文指，黃金持有量已達到1993年以來，最高水平。捷克央行於八月底，持有65.2噸黃金。"
68c02f1feee6da38c4d02294,時事多面睇｜關閉回收點   如何平衡慳資源和減方便？,2025-09-09 21:30,2025-09-10 01:15,local,tvb,https://news.tvb.com/tc/local/68c02f1feee6da38c4d02294,"調景嶺一個回收點即將停運，店內的智能回收箱會搬到另一個商場，當區區議員擔心規模縮小，會影響居民回收意欲，情況是如何呢？

學者指，做法可能涉及資源考慮，為甚麼呢？

<a href=""https://news.tvb.com/tc/programme/closerlook/68c0444deee6da38c4d0c7e5"" target=""_blank"" rel=""""> 點擊觀看節目重溫</a>"
68c0252feee6da38c4cfd750,立法會明日恢復審議控煙條例草案 議員提修正案要求取消禁售加味煙,2025-09-09 21:01,2025-09-09 22:30,local,tvb,https://news.tvb.com/tc/local/68c0252feee6da38c4cfd750,"立法會明日恢復審議控煙條例草案。有議員提出修正案，要求取消禁售加味煙。但吸煙與健康委員會認為，應盡早立法杜絕煙草禍害。

「控煙十招」包括建議擴大禁煙區，禁止指定地點排隊時吸煙，禁止管有另類煙及禁售加味煙等。

自由黨議員邵家輝及李鎮強，早前提出兩組修正案，包括要求取消禁售加味煙，以及在指明添加劑列表內不要納入並非為注入味道，而加入傳統吸煙產品的物質。當局回應指若刪去有關加味煙的內容，將嚴重妨礙減少煙草產品吸引力的目標，從根本上改變了政策原意，有違《議事規則》。

立法會主席梁君彥則認為，即使刪去一項控煙措施，對實施其餘措施無影響，接納所有修正案。

自由黨批發及零售界議員邵家輝說：「世界各地很多地方，仍可繼續享用加味煙，而香港市民沒有了這選擇權，我們認為不應該。第二是遊客來香港，都有機會不方便，若未來(加味煙)不准在市面上買賣，但市民或遊客可繼續在境外帶入香港，付稅款後就可繼續享用，我們擔心令香港私煙情況更嚴重。」

不過吸煙與健康委員會就聯同醫學、教育及社福等40個界別，召開記者會促請盡快通過草案。

吸煙與健康委員會主席湯修齊指出：「有些人用讓煙民選擇模式，去解釋指不要禁止加味煙，煙當中含有的尼古丁，是令煙民更沒有自由選擇，因尼古丁的成癮度是非常高，而最終得益的就只是煙草商。」

吸煙與健康委員會副主席陳志球稱：「(2007年)當時社會上都有聲音指，若禁止食肆內吸煙，就會沒有生意做、會倒閉，結果看到是剛相反。(立法會)書面回應有逾30份來自商界，我自己也是來自商界，及一些食肆是表示歡迎。」

委員會又要求政府盡快實施，禁止另類煙機及邊行邊吸煙等中長期控煙措施，並從根源阻截煙草毒害青少年。"
68c0250deee6da38c4cfd643,運輸署12月中起加強打擊不當棄置車輛 違例判罰一萬元及監禁三個月,2025-09-09 21:00,2025-09-09 21:45,local,tvb,https://news.tvb.com/tc/local/68c0250deee6da38c4cfd643,"運輸署12月22日起實施新制度，加強打擊不當棄置車輛，違例車主首次定罪，可判罰款一萬元和監禁三個月。

新界一些偏僻地方不時會見到有人將車輛棄置，為針對這些不當情況，運輸署由12月22日起，將向兩年或以上未領牌車輛的登記車主，發出通知書，要求車主必須在發出通知書日期，三個月內為車輛領牌，把車輛拆毀或永久送離香港，並向署方取消登記。

車主若未及時妥善處理車輛，首次定罪最高可罰款一萬元和監禁三個月，其後每次定罪，最高罰款兩萬五千元和監禁六個月。若不交罰款，運輸署可根據法庭命令，拒絕向車主發駕駛執照，不處理涉事車輛的過戶申請，以及拒絕車主名下車輛發牌。

不過如果車主有實際困難，可以申請豁免，包括車輛等待零件維修送驗，車齡30年或以上，正作私人收藏，不會在路上使用的車，或保存於經銷商寄賣的車輛。

運輸署表示，已加強宣傳和公眾教育，車主亦可善用運輸署的「牌證易」網上平台，查閱名下車輛牌照屆滿日期，以及處理各類牌照事務。"
68c0242aeee6da38c4cfc669,衞生防護中心：本地已進入流感季節 籲市民戴口罩,2025-09-09 20:56,2025-09-09 22:00,local,tvb,https://news.tvb.com/tc/local/68c0242aeee6da38c4cfc669,"衞生防護中心指，香港已進入夏季流感季節，呼籲學童接種流感疫苗。市民逗留人多擠迫地方應戴口罩。

中心指流感活躍程度過去一星期進一步上升。監察近兩周趨勢，判斷本地已進入流感季節，預料本地流感活躍程度會在短期內維持在較高水平。

今周首三天已錄得24宗學校爆發個案，共影響276人，其中一間有98人感染。兒童嚴重個案多一宗一名15歲男童昨日開始發燒，喉嚨痛、咳嗽及嘔吐，到私家醫院求診，獲安排在兒童深切治療部留醫，確診H3甲型流感病毒併發敗血性休克。今日已轉往普通病房留醫，情況穩定。"
68bff47eeee6da38c4ce3c12,港燈高壓電纜疑被第三方工程意外損壞 逾200戶電力供應一度受影響,2025-09-09 20:32,2025-09-09 20:45,local,tvb,https://news.tvb.com/tc/local/68bff47eeee6da38c4ce3c12,"淺水灣有港燈高壓電纜，懷疑被第三方工程意外損壞，附近200多戶電力供應一度受影響。

事故發生在下午五時許，港燈派出緊急維修技工，到其中一個受影響的屋苑聚豪居，檢察大廈電表房，又安排流動發電車到場。港燈就事件致歉，正調查事故原因，晚上六點半起陸續恢復供電。

現場消息指，早前聚豪居附近一個斜坡收到修葺令，工人今日在斜坡用鐵釘，進行斜坡鞏固工程期間，鑿斷了一條電纜。"
68c00c41eee6da38c4cefcb6,中醫醫院與本港三間大學簽合作協議 成大學教學醫院,2025-09-09 19:15,2025-09-09 20:30,local,tvb,https://news.tvb.com/tc/local/68c00c41eee6da38c4cefcb6,"香港中醫醫院年底分階段投入服務。今日與本港三間大學簽署合作協議，將成為大學的教學醫院。

簽署儀式由醫務衞生局局長盧寵茂見證。香港中醫醫院與三間設有中醫或中醫藥學院的大學，包括香港大學、中文大學及浸會大學，在醫院管治、人才交流、醫療服務、教學培訓及科研方面展開合作。三間大學會安排專家到醫院參與臨床服務，並轉介大學中醫診所病人到醫院治療。

醫院將會成為大學的教學醫院，為學士學位及研究生提供本地臨床培訓機會，為臨床經驗少於三年的註冊中醫師提供基礎培訓，以及為臨床經驗多於三年的提供進階培訓。設帶教診症室、多功能演講廳及模擬學習中心。

醫院將設有20張病床，可進行第一和第二期臨床試驗，大學可利用平台研發新的中成藥及擴闊現有中成藥的效用。

醫務衞生局局長盧寵茂說：「我們不論本科或研究院的中醫藥學的學生均可以有更多病例，作為教學培訓的以至科研創新的用途，三間大學的中醫藥方面的專家亦可以他們的豐富的臨床經驗，幫助中醫院提高服務水平。亦可與中醫院合作建立中醫藥方面的臨床標準，以至臨床指引，很快的去提升我們中醫藥方面的服務。」

選址將軍澳百勝角路的本港首間中醫醫院，預計12月起分階段投入服務。首年提供門診及日間住院服務為主，第二年起有住院服務。預計門診每年可接待約40萬人次。中醫醫院以公私營合作模式提供純中醫、中醫為主及中西醫協作模式的臨床服務，分內外科、兒科及針灸等。亦有社區外展，包括物理治療、言語治療等。但就不包括急症室，深切治療及分娩服務。

至於中醫醫院的收費詳情，院方表示會在10月中旬公布。"
68c0098ceee6da38c4ceee71,一對女同本港分娩申請出世紙僅一人獲登記為母親 提司法覆核勝訴,2025-09-09 19:03,2025-09-09 20:00,local,tvb,https://news.tvb.com/tc/local/68c0098ceee6da38c4ceee71,"一對女同性戀者，在外國透過體外受精受孕，在本港分娩，申請出世紙時，只有其中一人獲登記為母親，兩人提出司法覆核獲判勝訴。

兩個申請人以英文R和B代號，兩人2020年在南非，接受「互惠人工受孕」，即從R體內取出卵子與捐贈者的精子結合成胚胎，植入B的子宮懷孕。

2021年在香港誕下嬰兒K，B和R向入境處登記，為K的「父母」，但只有B列為「母親」。兩人提出司法覆核，要求確立R也是法定母親，高等法院頒布裁決裁定勝訴，但應該作甚麼頒令，則需與訟各方商議。"
68c0099beee6da38c4ceeef1,國慶煙花匯演十月一日晚上八時維港上演,2025-09-09 19:03,2025-09-09 20:00,local,tvb,https://news.tvb.com/tc/local/68c0099beee6da38c4ceeef1,"國慶煙花匯演，十月一日晚上八時在維港上演。

匯演以「維港煙花,閃耀中華」為主題，分為八幕，歷時23分鐘。三艘躉船及六艘浮船，合共發放逾三萬枚煙花。會有大熊貓龍鳳胎，以及全運會圖案的煙花。"
68c0057eeee6da38c4cec902,特別需要人士藉體恤安置計劃申請公屋 房委會委員建議嚴格把關,2025-09-09 18:46,2025-09-09 20:00,local,tvb,https://news.tvb.com/tc/local/68c0057eeee6da38c4cec902,"現時有醫療等需要人士可以經社署，透過體恤安置計劃申請公屋，有房委會委員認為，應該嚴格把關。

根據《房屋條例》，公屋租戶收到「終止租契通知書」或「遷出通知書」，15天內可以向房委會上訴委員會提出上訴，委員會會按客觀事實作考慮。

西九新動力九龍西議員梁文廣說：「上訴委員會都會考慮事主的健康情況或其他理由，但可能都會繼續執行相關『遷出通知書』，但他可能有其他方面社福理由，可能要轉介體恤安置，看看是否需要，提供公屋資源生活。」

有特別需要人士包括醫療需要，可透過社會福利署申請體恤安置計劃，身兼房委會委員的梁文廣認為，要謹慎處理。

梁文廣稱：「現時都有過渡性房屋或單身人士宿舍等，其實都是社署做到轉介，或其他部門安置有需要居民，始終公屋資源珍貴，如不經過深思熟慮，就直接體恤安置，可能對其他公屋輪候市民不公。」

有社工指，體恤安置計劃申請門檻高，社署會先「把關」。

社區組織協會幹事阮淑茵稱：「他們對何謂特殊困難定義，大家有不一樣標準，尤其做審批的社工，他們很擔心會否變成『特權』，(社署)可以先開檔案，再看是否合符資格，不是一開始未必有開檔案機會，詳細了解個案情形，如果很快拒絕他們，有機會遺漏有需要個案。」

社署指，署方推薦的體恤安置個案，由2022/23年度的387宗，上年度減至249宗，強調體恤安置，不屬一般的公屋申請，須由專業社工或授權人士作全面評估，並協助探討及使用其他可行方法，解決其房屋需要。"
68c0056feee6da38c4cec858,23間學校不參與流感疫苗外展接種 家長認為校內打針較方便,2025-09-09 18:46,2025-09-09 19:30,local,tvb,https://news.tvb.com/tc/local/68c0056feee6da38c4cec858,"季節性流感疫苗接種計劃，將在本月25日開始，暫時有23間學校，不參與外展接種。

本地流感活躍程度呈上升趨勢，衞生署今年繼續推行學校外展接種計劃，目前有23間學校表明不參加，署方會如去年般，將名單上載至網站。

這間學校去年沒參加計劃，有家長認為，如可在校內打針會較方便。

王太說：「試過流感高峰期，找不到疫苗，連噴鼻都沒有、都好頭痛，但學校又要求接種，要等好長時間才有。」

陳女士指出：「(學校)沒有都沒辦法，自己在外面接種、都要打，在學校一併接種就好。」

有學校準備在11月為學生安排外展接種計劃，家長可選擇是否讓子女打針，今年除注射亦可選擇噴鼻式疫苗。

油蔴地天主教小學(海泓道)校長陳說：「我們預期有更多人選擇噴鼻式，始終不用打針，相信小朋友沒那麼怕，若突然在接種前，流感高峰期很嚴重，發現很多學校都有這情況，家長突然在外面接種，都沒有問題。」

另外，政府今年採購新的流感疫苗，包括「重組疫苗」及科興滅活疫苗，衞生防護中心總監徐樂堅指，雖然疫苗未有太多孕婦數據，但並非禁忌。"
